"CAM Key","CAM Topic","CAM Company Title","Audit Opinion Key","Year Ended Date","Signature Date","Auditor Key",Auditor,"Auditor Affiliate Key","Auditor Affiliate","Auditor Affiliate PCAOB","Auditor City","Auditor State Code","Auditor State Name","Auditor State Region",Source,"Source Date","Going Concern",Company,"CIK Code",Ticker,"Bus Street 1","Bus Street 2",City,"State Code","State Name","State Region","Parent CIK","Parent Name","SIC Code","SIC Description","NAICS Code","NAICS Description","Filer Act","Stock Price ($)","Stock Price Date","Market Cap ($)","Financials Date","Revenue ($)","Earnings ($)","Book Value ($)","Assets ($)"
24223,"Revenue from customer contracts","Revenue Recognition
",499735,12/31/22,02/16/23,2,"Ernst & Young LLP",,,,"San Jose",CA,CALIFORNIA,"US West",10-K,2023-02-16,,"10x Genomics, Inc.",1770787,"=""TXG""","6230 STONERIDGE MALL ROAD",,PLEASANTON,CA,CALIFORNIA,"US West",,,"=""3826""","Laboratory Analytical Instruments",334516,"Analytical Laboratory Instrument Manufacturing",34,36,12/31/22,"3,517,471,232",12/31/22,"516,409,000","-166,000,000","778,374,000","1,028,980,000"
29689,"Revenue from customer contracts","Revenue Recognition— Refer to Note 2(m) and Note 13 to the financial statements",510550,12/31/22,04/28/23,3,"Deloitte & Touche LLP",499,"Deloitte Touche Tohmatsu Certified Public Accountants LLP",1113,Shanghai,F4,CHINA,Foreign,20-F,2023-04-28,,"111, Inc.",1738906,"=""YI""","3-4/F, NO.295 ZUCHONGZHI ROAD","PUDONG NEW AREA",SHANGHAI,F4,CHINA,Foreign,,,"=""5912""","Drug Stores and Proprietary Stores",446110,"Pharmacies and Drug Stores",34,3,12/29/22,"140,281,248",12/31/22,"1,944,373,000","-59,968,000","91,930,000","499,707,000"
24572,"Insurance contract liabilities","Valuation of Incurred but not yet Reported (“IBNR”) Claims Liability",500233,12/31/22,02/21/23,1,"PricewaterhouseCoopers LLP",,,,"San Francisco",CA,CALIFORNIA,"US West",10-K,2023-02-22,,"1Life Healthcare Inc",1404123,,"ONE EMBARCADERO CENTER, SUITE 1900",,"San Francisco",CA,CALIFORNIA,"US West",,,"=""8011""","Offices and Clinics of Doctors of Medicine",621111,"Offices of Physicians (except Mental Health Specialists)",34,,,"3,442,778,010",12/31/22,"1,045,547,000","-397,847,000","74,408,000","2,432,734,000"
28948,"Allowance for credit losses","Allowance for Credit Losses – Refer to Note 2 to the consolidated financial statements",508518,12/31/22,04/11/23,3,"Deloitte & Touche LLP",,,,Atlanta,GA,GEORGIA,"US Southeast",10-K,2023-04-11,,"1st FRANKLIN FINANCIAL CORP",38723,,"135 E TUGALO ST","P O BOX 880",TOCCOA,GA,GEORGIA,"US Southeast",,,"=""6141""","Personal Credit Institutions",522292,"Real Estate Credit",34,,,,12/31/22,"209,657,031","16,159,627",,"1,162,924,256"
20486,"Long-lived assets","Assessment of impairment of store-level long-lived assets",484294,02/26/22,04/21/22,4,"KPMG LLP",,,,"Short Hills",NJ,"NEW JERSEY","US Mid Atlantic",10-K,2022-04-21,,"20230930-DK-Butterfly-1, Inc.",886158,,"650 LIBERTY AVENUE",,UNION,NJ,"NEW JERSEY","US Mid Atlantic",,,"=""5700""","Retail-Home Furniture, Furnishings & Equipment Stores",442299,"All Other Home Furnishings Stores",34,17,02/28/22,"1,627,143,936",02/26/22,"7,867,778,000","-559,623,000",,"5,130,572,000"
28946,"Long-lived assets","Assessment of impairment of store-level long-lived assets",508498,02/26/22,04/21/22,4,"KPMG LLP",,,,"Short Hills",NJ,"NEW JERSEY","US Mid Atlantic",S-1,2023-04-11,,"20230930-DK-Butterfly-1, Inc.",886158,,"650 LIBERTY AVENUE",,UNION,NJ,"NEW JERSEY","US Mid Atlantic",,,"=""5700""","Retail-Home Furniture, Furnishings & Equipment Stores",442299,"All Other Home Furnishings Stores",34,17,02/28/22,"1,627,143,936",02/26/22,"7,867,778,000","-559,623,000",,"5,130,572,000"
24505,"Revenue from customer contracts","Determination of implied pricing concessions",500095,12/31/22,02/21/23,4,"KPMG LLP",,,,McLean,VA,VIRGINIA,"US Mid Atlantic",10-K,2023-02-21,,"2U, LLC",1459417,,"7900 HARKINS ROAD",,LANHAM,MD,MARYLAND,"US Mid Atlantic",,,"=""7372""","Prepackaged Software",511210,"Software Publishers",34,6,12/29/22,"484,870,336",12/31/22,"963,080,000","-322,151,000","-782,859,000","1,810,859,000"
24506,"Goodwill and intangible assets","Impairment of goodwill and indefinite-lived intangible asset",500095,12/31/22,02/21/23,4,"KPMG LLP",,,,McLean,VA,VIRGINIA,"US Mid Atlantic",10-K,2023-02-21,,"2U, LLC",1459417,,"7900 HARKINS ROAD",,LANHAM,MD,MARYLAND,"US Mid Atlantic",,,"=""7372""","Prepackaged Software",511210,"Software Publishers",34,6,12/29/22,"484,870,336",12/31/22,"963,080,000","-322,151,000","-782,859,000","1,810,859,000"
23705,"Other contingent liabilities","Legal Proceedings",498859,12/31/22,02/08/23,1,"PricewaterhouseCoopers LLP",,,,Minneapolis,MN,MINNESOTA,"US Midwest",10-K,2023-02-08,,"3M CO",66740,"=""MMM""","3M CENTER","BLDG. 220-9E-02","ST PAUL",MN,MINNESOTA,"US Midwest",,,"=""3841""","Surgical and Medical Instruments and Apparatus",322222,"Coated and Laminated Paper Manufacturing",34,120,12/31/22,"55,067,316,224",12/31/22,"34,229,000,000","5,777,000,000","-2,767,000,000","46,455,000,000"
23706,"Disposals and divestitures","Tax-free Determination of the Split-Off of the Food Safety Division",498859,12/31/22,02/08/23,1,"PricewaterhouseCoopers LLP",,,,Minneapolis,MN,MINNESOTA,"US Midwest",10-K,2023-02-08,,"3M CO",66740,"=""MMM""","3M CENTER","BLDG. 220-9E-02","ST PAUL",MN,MINNESOTA,"US Midwest",,,"=""3841""","Surgical and Medical Instruments and Apparatus",322222,"Coated and Laminated Paper Manufacturing",34,120,12/31/22,"55,067,316,224",12/31/22,"34,229,000,000","5,777,000,000","-2,767,000,000","46,455,000,000"
23707,"Long-lived assets","Property, Plant and Equipment and Goodwill Impairment Assessments for the Advanced Materials Division",498859,12/31/22,02/08/23,1,"PricewaterhouseCoopers LLP",,,,Minneapolis,MN,MINNESOTA,"US Midwest",10-K,2023-02-08,,"3M CO",66740,"=""MMM""","3M CENTER","BLDG. 220-9E-02","ST PAUL",MN,MINNESOTA,"US Midwest",,,"=""3841""","Surgical and Medical Instruments and Apparatus",322222,"Coated and Laminated Paper Manufacturing",34,120,12/31/22,"55,067,316,224",12/31/22,"34,229,000,000","5,777,000,000","-2,767,000,000","46,455,000,000"
21834,Inventory,"Assessment of the write-down of inventories",489785,05/31/22,07/21/22,4,"KPMG LLP",,,,Chicago,IL,ILLINOIS,"US Midwest",10-K,2022-07-21,,"AAR CORP",1750,"=""AIR""","1100 N WOOD DALE RD",,"WOOD DALE",IL,ILLINOIS,"US Midwest",,,"=""3720""","Aircraft & Parts",334613,"Magnetic and Optical Recording Media Manufacturing",34,48,05/31/22,"1,706,558,080",05/31/22,"1,820,000,000","78,700,000","914,800,000","1,573,900,000"
21835,"Revenue from customer contracts","Evaluation of the estimate of costs at completion of certain performance obligations",489785,05/31/22,07/21/22,4,"KPMG LLP",,,,Chicago,IL,ILLINOIS,"US Midwest",10-K,2022-07-21,,"AAR CORP",1750,"=""AIR""","1100 N WOOD DALE RD",,"WOOD DALE",IL,ILLINOIS,"US Midwest",,,"=""3720""","Aircraft & Parts",334613,"Magnetic and Optical Recording Media Manufacturing",34,48,05/31/22,"1,706,558,080",05/31/22,"1,820,000,000","78,700,000","914,800,000","1,573,900,000"
26242,"Other contingent liabilities","Estimated claims liabilities costs",502554,12/31/22,03/01/23,2,"Ernst & Young LLP",,,,Atlanta,GA,GEORGIA,"US Southeast",10-K,2023-03-01,,"Aaron's Company, Inc.",1821393,,"400 GALLERIA PARKWAY SE, SUITE 300",,ATLANTA,GA,GEORGIA,"US Southeast",,,"=""7359""","Equipment Rental and Leasing, NEC",532210,"Consumer Electronics and Appliances Rental",34,12,12/31/22,"365,904,928",12/31/22,"2,249,434,000","-5,280,000","522,164,000","1,858,463,000"
26243,"Business combinations","BrandsMart Acquisition - Trade names Intangible",502554,12/31/22,03/01/23,2,"Ernst & Young LLP",,,,Atlanta,GA,GEORGIA,"US Southeast",10-K,2023-03-01,,"Aaron's Company, Inc.",1821393,,"400 GALLERIA PARKWAY SE, SUITE 300",,ATLANTA,GA,GEORGIA,"US Southeast",,,"=""7359""","Equipment Rental and Leasing, NEC",532210,"Consumer Electronics and Appliances Rental",34,12,12/31/22,"365,904,928",12/31/22,"2,249,434,000","-5,280,000","522,164,000","1,858,463,000"
26244,Goodwill,"Valuation of Goodwill - BrandsMart reporting unit",502554,12/31/22,03/01/23,2,"Ernst & Young LLP",,,,Atlanta,GA,GEORGIA,"US Southeast",10-K,2023-03-01,,"Aaron's Company, Inc.",1821393,,"400 GALLERIA PARKWAY SE, SUITE 300",,ATLANTA,GA,GEORGIA,"US Southeast",,,"=""7359""","Equipment Rental and Leasing, NEC",532210,"Consumer Electronics and Appliances Rental",34,12,12/31/22,"365,904,928",12/31/22,"2,249,434,000","-5,280,000","522,164,000","1,858,463,000"
25595,"Revenue from customer contracts","Revenue recognition for certain long-term fixed price contracts using the percentage-of-completion method ",500904,12/31/22,02/23/23,4,"KPMG LLP",288,"KPMG AG",3240,Zurich,V8,SWITZERLAND,Foreign,20-F,2023-02-24,,"ABB LTD",1091587,"=""ABBNY""","PO BOX 8131",*,ZURICH,V8,SWITZERLAND,Foreign,,,"=""3613""","Switchgear and Switchboard Apparatus",335311,"Power, Distribution, and Specialty Transformer Manufacturing",34,30,12/31/22,"56,807,899,136",12/31/22,"29,446,000,000","2,475,000,000","945,000,000","39,148,000,000"
25596,"Other income taxes","Valuation of unrecognized tax benefits related to transfer pricing",500904,12/31/22,02/23/23,4,"KPMG LLP",288,"KPMG AG",3240,Zurich,V8,SWITZERLAND,Foreign,20-F,2023-02-24,,"ABB LTD",1091587,"=""ABBNY""","PO BOX 8131",*,ZURICH,V8,SWITZERLAND,Foreign,,,"=""3613""","Switchgear and Switchboard Apparatus",335311,"Power, Distribution, and Specialty Transformer Manufacturing",34,30,12/31/22,"56,807,899,136",12/31/22,"29,446,000,000","2,475,000,000","945,000,000","39,148,000,000"
24328,"Other income taxes","Income taxes – Unrecognized tax benefits",499931,12/31/22,02/17/23,2,"Ernst & Young LLP",,,,Chicago,IL,ILLINOIS,"US Midwest",10-K,2023-02-17,,"ABBOTT LABORATORIES",1800,"=""ABT""","100 ABBOTT PARK ROAD",,"ABBOTT PARK",IL,ILLINOIS,"US Midwest",,,"=""2834""","Pharmaceutical Preparations",325412,"Pharmaceutical Preparation Manufacturing",34,110,12/31/22,"190,792,515,584",12/31/22,"43,653,000,000","6,933,000,000","3,433,000,000","74,438,000,000"
24378,"Sales return and allowances","Sales rebate accruals for Medicaid, Medicare and managed care programs",499853,12/31/22,02/17/23,2,"Ernst & Young LLP",,,,Chicago,IL,ILLINOIS,"US Midwest",10-K,2023-02-17,,"AbbVie Inc.",1551152,"=""ABBV""","1 NORTH WAUKEGAN ROAD",,"NORTH CHICAGO",IL,ILLINOIS,"US Midwest",,,"=""2834""","Pharmaceutical Preparations",325412,"Pharmaceutical Preparation Manufacturing",34,162,12/31/22,"285,917,380,608",12/31/22,"58,054,000,000","11,836,000,000","-82,341,000,000","138,805,000,000"
24379,"Business combinations","Valuation of contingent consideration",499853,12/31/22,02/17/23,2,"Ernst & Young LLP",,,,Chicago,IL,ILLINOIS,"US Midwest",10-K,2023-02-17,,"AbbVie Inc.",1551152,"=""ABBV""","1 NORTH WAUKEGAN ROAD",,"NORTH CHICAGO",IL,ILLINOIS,"US Midwest",,,"=""2834""","Pharmaceutical Preparations",325412,"Pharmaceutical Preparation Manufacturing",34,162,12/31/22,"285,917,380,608",12/31/22,"58,054,000,000","11,836,000,000","-82,341,000,000","138,805,000,000"
27721,"Allowance for credit losses","Provision for Expected Credit Losses of Trade Receivables in Abcam Inc.",505566,12/31/22,03/20/23,1,"PricewaterhouseCoopers LLP",121,"PricewaterhouseCoopers LLP",876,Cambridge,X0,"UNITED KINGDOM",Foreign,20-F,2023-03-20,,"Abcam plc",1492074,"=""ABCZF""","DISCOVERY DRIVE","CAMBRIDGE BIOMEDICAL CAMPUS",CAMBRIDGE,X0,"UNITED KINGDOM",Foreign,,,"=""2836""","Biological Products, Except Diagnostic Substances",325414,"Biological Product (except Diagnostic) Manufacturing",34,16,12/29/22,"3,556,851,712",12/31/22,"435,100,000","-10,200,000","121,100,000","1,271,000,000"
24598,"Business combinations","Fair value of contingent consideration liability",500131,12/31/22,02/21/23,4,"KPMG LLP",187,"KPMG LLP Chartered Accountants",85,Vancouver,A1,"BRITISH COLUMBIA",Canada,10-K,2023-02-21,,"AbCellera Biologics Inc.",1703057,"=""ABCL""","150 W 4TH AVENUE",,VANCOUVER,A1,"BRITISH COLUMBIA",Canada,,,"=""2834""","Pharmaceutical Preparations",325412,"Pharmaceutical Preparation Manufacturing",34,10,12/31/22,"2,905,806,592",12/31/22,"485,424,000","158,519,000","1,070,023,000","1,540,907,000"
19215,"Long-lived assets","Impairment of Long-Lived Assets – Stores",480932,01/29/22,03/28/22,1,"PricewaterhouseCoopers LLP",,,,Columbus,OH,OHIO,"US Midwest",10-K,2022-03-28,,"ABERCROMBIE & FITCH CO /DE/",1018840,"=""ANF""","6301 FITCH PATH",,"NEW ALBANY",OH,OHIO,"US Midwest",,,"=""5651""","Family Clothing Stores",448140,"Family Clothing Stores",34,39,01/31/22,"2,066,414,976",01/29/22,"3,712,768,000","263,010,000",,"2,939,491,000"
21231,"Other investments","Valuation of investments in medical device companies – Refer to Note 5, Financial Instruments and Note 10, Other Assets",487253,03/31/22,05/20/22,3,"Deloitte & Touche LLP",,,,Boston,MA,MASSACHUSETTS,"US New England",10-K,2022-05-20,,"ABIOMED INC",815094,,"22 CHERRY HILL DR",,DANVERS,MA,MASSACHUSETTS,"US New England",,,"=""3841""","Surgical and Medical Instruments and Apparatus",339112,"Surgical and Medical Instrument Manufacturing",34,331,03/31/22,"15,086,325,760",03/31/22,"1,031,753,000","136,505,000","1,408,532,000","1,673,393,000"
23249,"Business combinations","Initial fair value measurement of the contingent consideration liability associated with the acquisition of RavenVolt",496149,10/31/22,12/21/22,4,"KPMG LLP",,,,"New York",NY,"NEW YORK","US Mid Atlantic",10-K,2022-12-21,,"ABM INDUSTRIES INC /DE/",771497,"=""ABM""","ONE LIBERTY PLAZA","7TH FLOOR","NEW YORK",NY,"NEW YORK","US Mid Atlantic",,,"=""7340""","Services-To Dwellings & Other Buildings",561720,"Janitorial Services",34,45,10/31/22,"2,919,317,248",10/31/22,"7,806,600,000","230,400,000","-1,146,700,000","4,868,900,000"
23250,"Other contingent liabilities","Valuation of self-insurance liabilities",496149,10/31/22,12/21/22,4,"KPMG LLP",,,,"New York",NY,"NEW YORK","US Mid Atlantic",10-K,2022-12-21,,"ABM INDUSTRIES INC /DE/",771497,"=""ABM""","ONE LIBERTY PLAZA","7TH FLOOR","NEW YORK",NY,"NEW YORK","US Mid Atlantic",,,"=""7340""","Services-To Dwellings & Other Buildings",561720,"Janitorial Services",34,45,10/31/22,"2,919,317,248",10/31/22,"7,806,600,000","230,400,000","-1,146,700,000","4,868,900,000"
26376,"Other investments","Evaluation of the evidence pertaining to the existence of the gold holdings",502392,12/31/22,02/28/23,4,"KPMG LLP",,,,"New York",NY,"NEW YORK","US Mid Atlantic",10-K,2023-03-01,,"abrdn Gold ETF Trust",1450923,"=""SGOL""","C/O ABRDN","1900 MARKET STREET, SUITE 200",PHILADELPHIA,PA,PENNSYLVANIA,"US Mid Atlantic",,,"=""6221""","Commodity Contracts Brokers and Dealers",525990,"Other Financial Vehicles",34,17,12/29/22,"2,410,606,080",12/31/22,,"-17,367,000",,"2,443,129,000"
26370,"Other investments","Evaluation of the evidence pertaining to the existence of the palladium holdings",502415,12/31/22,02/28/23,4,"KPMG LLP",,,,"New York",NY,"NEW YORK","US Mid Atlantic",10-K,2023-03-01,,"abrdn Palladium ETF Trust",1459862,"=""PALL""","C/O ABRDN","1900 MARKET STREET, SUITE 200",PHILADELPHIA,PA,PENNSYLVANIA,"US Mid Atlantic",,,"=""6221""","Commodity Contracts Brokers and Dealers",523991,"Trust, Fiduciary, and Custody Activities",34,168,12/29/22,"301,788,000",12/31/22,,"-60,481,000",,"295,638,000"
26371,"Other investments","Evaluation of the evidence pertaining to the existence of the platinum holdings",502416,12/31/22,02/28/23,4,"KPMG LLP",,,,"New York",NY,"NEW YORK","US Mid Atlantic",10-K,2023-03-01,,"abrdn Platinum ETF Trust",1460235,"=""PPLT""","C/O ABRDN","1900 MARKET STREET, SUITE 200",PHILADELPHIA,PA,PENNSYLVANIA,"US Mid Atlantic",,,"=""6221""","Commodity Contracts Brokers and Dealers",523991,"Trust, Fiduciary, and Custody Activities",34,98,12/29/22,"1,152,674,944",12/31/22,,"63,463,000",,"1,097,107,000"
26480,"Other investments","Evaluation of the evidence pertaining to the existence of the bullion holdings",502379,12/31/22,02/28/23,4,"KPMG LLP",,,,"New York",NY,"NEW YORK","US Mid Atlantic",10-K,2023-03-01,,"abrdn Precious Metals Basket ETF Trust",1483386,"=""GLTR""","C/O ABRDN","1900 MARKET STREET, SUITE 200",PHILADELPHIA,PA,PENNSYLVANIA,"US Mid Atlantic",,,"=""6221""","Commodity Contracts Brokers and Dealers",523920,"Portfolio Management",34,89,12/29/22,"1,007,620,992",12/31/22,,"-26,750,000",,"1,008,014,000"
26561,"Other investments","Evaluation of the evidence pertaining to the existence of the silver holdings",502293,12/31/22,02/28/23,4,"KPMG LLP",,,,"New York",NY,"NEW YORK","US Mid Atlantic",10-K,2023-03-01,,"abrdn Silver ETF Trust",1450922,"=""SIVR""","C/O ABRDN","1900 MARKET STREET, SUITE 200",PHILADELPHIA,PA,PENNSYLVANIA,"US Mid Atlantic",,,"=""6221""","Commodity Contracts Brokers and Dealers",523991,"Trust, Fiduciary, and Custody Activities",34,23,12/29/22,"1,101,600,000",12/31/22,,"6,279,000",,"1,119,097,000"
27600,"Other intangible assets","Intangible asset – valuation",505341,12/31/22,03/16/23,1,"PricewaterhouseCoopers LLP",286,"PricewaterhouseCoopers SA",1358,Lausanne,V8,SWITZERLAND,Foreign,20-F,2023-03-16,,"AC Immune SA",1651625,"=""ACIU""","EPFL INNOVATION PARK, BUILDING B",,"1015 LAUSANNE",V8,SWITZERLAND,Foreign,,,"=""2834""","Pharmaceutical Preparations",325412,"Pharmaceutical Preparation Manufacturing",34,2,12/29/22,"152,766,592",12/31/22,"4,253,000","-76,473,000","128,162,000","200,971,000"
19382,Inventory,"Merchandise Inventories",481297,01/29/22,03/29/22,3,"Deloitte & Touche LLP",,,,Houston,TX,TEXAS,"US Southwest",10-K,2022-03-29,,"Academy Sports & Outdoors, Inc.",1817358,"=""ASO""","1800 NORTH MASON ROAD",,KATY,TX,TEXAS,"US Southwest",,,"=""5940""","Retail-Miscellaneous Shopping Goods Stores",451110,"Sporting Goods Stores",34,39,01/31/22,"3,387,388,416",01/29/22,"6,773,128,000","671,381,000","27,811,000","4,584,940,000"
25870,"Revenue from customer contracts","Revenue Recognition",501943,12/31/22,02/28/23,2,"Ernst & Young LLP",,,,Nashville,TN,TENNESSEE,"US Southeast",10-K,2023-02-28,,"Acadia Healthcare Company, Inc.",1520697,"=""ACHC""","6100 TOWER CIRCLE","SUITE 1000",FRANKLIN,TN,TENNESSEE,"US Southeast",,,"=""8093""","Specialty Outpatient Facilities, NEC",623220,"Residential Mental Health and Substance Abuse Facilities",34,82,12/31/22,"7,401,692,160",12/31/22,"2,610,399,000","273,139,000","602,138,000","4,987,901,000"
26173,"Sales return and allowances","Allowance for Medicare Part D rebates",501741,12/31/22,02/27/23,2,"Ernst & Young LLP",,,,"San Diego",CA,CALIFORNIA,"US West",10-K,2023-02-28,,"ACADIA PHARMACEUTICALS INC",1070494,"=""ACAD""","12830 EL CAMINO REAL","SUITE 400","SAN DIEGO",CA,CALIFORNIA,"US West",,,"=""2834""","Pharmaceutical Preparations",325412,"Pharmaceutical Preparation Manufacturing",34,16,12/31/22,"2,580,072,704",12/31/22,"517,235,000","-215,975,000",,"587,812,000"
25907,"Deferred and stock-based compensation","Assessment of the fair value measurement of the cash-settled affiliate awards liability",502033,12/31/22,02/28/23,4,"KPMG LLP",,,,Boston,MA,MASSACHUSETTS,"US New England",10-K,2023-02-28,,"Acadian Asset Management Inc.",1748824,"=""AAMI""","200 STATE STREET","SUITE 601A",BOSTON,MA,MASSACHUSETTS,"US New England",,,"=""6282""","Investment Advice",523930,"Investment Advice",34,21,12/31/22,"852,734,080",12/31/22,"396,700,000","100,600,000","-41,900,000","518,700,000"
26363,"Business combinations","Acquisition-date fair value of location contract intangible assets",502464,12/31/22,03/01/23,4,"KPMG LLP",,,,Chicago,IL,ILLINOIS,"US Midwest",10-K,2023-03-01,,"Accel Entertainment, Inc.",1698991,"=""ACEL""","140 TOWER DRIVE",,"BURR RIDGE",IL,ILLINOIS,"US Midwest",,,"=""7900""","Services-Amusement & Recreation Services",713290,"Other Gambling Industries",34,8,12/31/22,"667,392,832",12/31/22,"969,797,000","74,102,000","54,904,000","862,769,000"
26364,"Other assets","Sufficiency of audit evidence over cash",502464,12/31/22,03/01/23,4,"KPMG LLP",,,,Chicago,IL,ILLINOIS,"US Midwest",10-K,2023-03-01,,"Accel Entertainment, Inc.",1698991,"=""ACEL""","140 TOWER DRIVE",,"BURR RIDGE",IL,ILLINOIS,"US Midwest",,,"=""7900""","Services-Amusement & Recreation Services",713290,"Other Gambling Industries",34,8,12/31/22,"667,392,832",12/31/22,"969,797,000","74,102,000","54,904,000","862,769,000"
28709,Inventory,"Valuation of Instrument Inventory",507873,12/31/22,03/31/23,2,"Ernst & Young LLP",,,,Phoenix,AZ,ARIZONA,"US Southwest",10-K,2023-03-31,Yes,"Accelerate Diagnostics, Inc",727207,"=""AXDXQ""","3950 S. COUNTRY CLUB ROAD #470","BUILDING 3-307",TUCSON,AZ,ARIZONA,"US Southwest",,,"=""3826""","Laboratory Analytical Instruments",511210,"Software Publishers",34,1,12/31/22,"68,819,144",12/31/22,"12,752,000","-62,493,000",,"65,015,000"
22597,"Revenue from customer contracts","Estimated costs to complete certain technology integration consulting services contracts",493120,08/31/22,10/12/22,4,"KPMG LLP",,,,Chicago,IL,ILLINOIS,"US Midwest",10-K,2022-10-12,,"Accenture plc",1467373,"=""ACN""","1 GRAND CANAL SQUARE","GRAND CANAL HARBOUR",DUBLIN,L2,IRELAND,Foreign,,,"=""7389""","Business Services, NEC",541611,"Administrative Management and General Management Consulting Services",34,288,08/31/22,"182,066,593,792",08/31/22,"61,594,305,000","6,877,169,000","8,972,804,000","47,263,390,000"
22598,"Uncertain tax positions","Unrecognized tax benefits",493120,08/31/22,10/12/22,4,"KPMG LLP",,,,Chicago,IL,ILLINOIS,"US Midwest",10-K,2022-10-12,,"Accenture plc",1467373,"=""ACN""","1 GRAND CANAL SQUARE","GRAND CANAL HARBOUR",DUBLIN,L2,IRELAND,Foreign,,,"=""7389""","Business Services, NEC",541611,"Administrative Management and General Management Consulting Services",34,288,08/31/22,"182,066,593,792",08/31/22,"61,594,305,000","6,877,169,000","8,972,804,000","47,263,390,000"
25241,Inventory,"Write-down of certain finished goods inventory for obsolete and slow-moving items",501146,12/31/22,02/24/23,4,"KPMG LLP",,,,Chicago,IL,ILLINOIS,"US Midwest",10-K,2023-02-24,,"ACCO BRANDS Corp",712034,"=""ACCO""","FOUR CORPORATE DRIVE",,"LAKE ZURICH",IL,ILLINOIS,"US Midwest",,,"=""2780""","Blankbooks, Looseleaf Binders & Bookbindg & Relatd Work",323118,"Blankbook, Looseleaf Binders, and Devices Manufacturing",34,6,12/31/22,"526,918,592",12/31/22,"1,947,600,000","-13,200,000","-708,400,000","2,794,700,000"
25242,Goodwill,"Goodwill Impairment Assessment of North America and International Reporting Unit",501146,12/31/22,02/24/23,4,"KPMG LLP",,,,Chicago,IL,ILLINOIS,"US Midwest",10-K,2023-02-24,,"ACCO BRANDS Corp",712034,"=""ACCO""","FOUR CORPORATE DRIVE",,"LAKE ZURICH",IL,ILLINOIS,"US Midwest",,,"=""2780""","Blankbooks, Looseleaf Binders & Bookbindg & Relatd Work",323118,"Blankbook, Looseleaf Binders, and Devices Manufacturing",34,6,12/31/22,"526,918,592",12/31/22,"1,947,600,000","-13,200,000","-708,400,000","2,794,700,000"
20879,"Other intangible assets","Fair value of customer relationships intangible asset",486129,02/28/22,05/02/22,4,"KPMG LLP",,,,Philadelphia,PA,PENNSYLVANIA,"US Mid Atlantic",10-K,2022-05-02,,"Accolade, Inc.",1481646,,"660 W. GERMANTOWN PIKE SUITE 500",,"PLYMOUTH MEETING",PA,PENNSYLVANIA,"US Mid Atlantic",,,"=""7389""","Business Services, NEC",611710,"Educational Support Services",34,18,02/28/22,"1,206,430,592",02/28/22,"310,021,000","-123,124,000","33,208,000","1,285,529,000"
20880,"Revenue from customer contracts","Revenue recognition – variable consideration related to healthcare cost savings",486129,02/28/22,05/02/22,4,"KPMG LLP",,,,Philadelphia,PA,PENNSYLVANIA,"US Mid Atlantic",10-K,2022-05-02,,"Accolade, Inc.",1481646,,"660 W. GERMANTOWN PIKE SUITE 500",,"PLYMOUTH MEETING",PA,PENNSYLVANIA,"US Mid Atlantic",,,"=""7389""","Business Services, NEC",611710,"Educational Support Services",34,18,02/28/22,"1,206,430,592",02/28/22,"310,021,000","-123,124,000","33,208,000","1,285,529,000"
28968,"Business combinations","Valuation of intangible assets acquired in a business combination",508615,12/31/22,04/13/23,2,"Ernst & Young LLP",,,,Philadelphia,PA,PENNSYLVANIA,"US Mid Atlantic",10-K,2023-04-13,Yes,"Aceragen, Inc.",861838,,"505 EAGLEVIEW BOULEVARD","SUITE 212",EXTON,PA,PENNSYLVANIA,"US Mid Atlantic",,,"=""2836""","Biological Products, Except Diagnostic Substances",325414,"Biological Product (except Diagnostic) Manufacturing",34,6,12/31/22,"21,739,420",12/31/22,"4,862,000","-23,360,000","-43,766,000","101,107,000"
28969,"Business combinations","Valuation of Series X preferred stock liability",508615,12/31/22,04/13/23,2,"Ernst & Young LLP",,,,Philadelphia,PA,PENNSYLVANIA,"US Mid Atlantic",10-K,2023-04-13,Yes,"Aceragen, Inc.",861838,,"505 EAGLEVIEW BOULEVARD","SUITE 212",EXTON,PA,PENNSYLVANIA,"US Mid Atlantic",,,"=""2836""","Biological Products, Except Diagnostic Substances",325414,"Biological Product (except Diagnostic) Manufacturing",34,6,12/31/22,"21,739,420",12/31/22,"4,862,000","-23,360,000","-43,766,000","101,107,000"
30718,"Business combinations","Valuation of intangible assets acquired in a business combination",514905,12/31/22,04/13/23,2,"Ernst & Young LLP",,,,Philadelphia,PA,PENNSYLVANIA,"US Mid Atlantic","DEF 14A",2023-07-21,Yes,"Aceragen, Inc.",861838,,"505 EAGLEVIEW BOULEVARD","SUITE 212",EXTON,PA,PENNSYLVANIA,"US Mid Atlantic",,,"=""2836""","Biological Products, Except Diagnostic Substances",325414,"Biological Product (except Diagnostic) Manufacturing",34,6,12/31/22,"21,739,420",12/31/22,"4,862,000","-23,360,000","-43,766,000","101,107,000"
30719,"Business combinations","Valuation of Series X preferred stock liability",514905,12/31/22,04/13/23,2,"Ernst & Young LLP",,,,Philadelphia,PA,PENNSYLVANIA,"US Mid Atlantic","DEF 14A",2023-07-21,Yes,"Aceragen, Inc.",861838,,"505 EAGLEVIEW BOULEVARD","SUITE 212",EXTON,PA,PENNSYLVANIA,"US Mid Atlantic",,,"=""2836""","Biological Products, Except Diagnostic Substances",325414,"Biological Product (except Diagnostic) Manufacturing",34,6,12/31/22,"21,739,420",12/31/22,"4,862,000","-23,360,000","-43,766,000","101,107,000"
26478,"Revenue from customer contracts","Revenue Recognition - Refer to Note 2 to the financial statements",502695,12/31/22,03/01/23,3,"Deloitte & Touche LLP",,,,Omaha,NE,NEBRASKA,"US Midwest",10-K,2023-03-01,,"ACI WORLDWIDE, INC.",935036,"=""ACIW""","6060 COVENTRY DRIVE",,ELKHORN,NE,NEBRASKA,"US Midwest",,,"=""7372""","Prepackaged Software",511210,"Software Publishers",34,23,12/31/22,"2,485,583,104",12/31/22,"1,421,901,000","142,177,000","-390,646,000","3,209,895,000"
24950,"Business combinations","Fair Value of the Contingent Consideration Liability related to zunsemetinib",500510,12/31/22,02/23/23,1,"PricewaterhouseCoopers LLP",,,,Philadelphia,PA,PENNSYLVANIA,"US Mid Atlantic",10-K,2023-02-23,,"Aclaris Therapeutics, Inc.",1557746,"=""ACRS""","701 LEE ROAD","SUITE 103",WAYNE,PA,PENNSYLVANIA,"US Mid Atlantic",,,"=""2834""","Pharmaceutical Preparations",325412,"Pharmaceutical Preparation Manufacturing",34,16,12/31/22,"1,050,346,176",12/31/22,"29,752,000","-86,908,000","223,748,000","254,596,000"
27345,"Revenue from customer contracts","Estimate of variable consideration in contracts with customers",505012,12/31/22,03/14/23,2,"Ernst & Young LLP",,,,Stamford,CT,CONNECTICUT,"US New England",10-K,2023-03-15,,"Acorda Therapeutics, Inc.",1008848,,"TWO BLUE HILL PLAZA",,"PEARL RIVER",NY,"NEW YORK","US Mid Atlantic",,,"=""2836""","Biological Products, Except Diagnostic Substances",325414,"Biological Product (except Diagnostic) Manufacturing",34,1,12/29/22,"16,194,381",12/31/22,"118,566,000","-65,916,000","-211,465,000","395,595,000"
27346,"Other contingent liabilities","Fair Value Measurement of the Contingent Consideration",505012,12/31/22,03/14/23,2,"Ernst & Young LLP",,,,Stamford,CT,CONNECTICUT,"US New England",10-K,2023-03-15,,"Acorda Therapeutics, Inc.",1008848,,"TWO BLUE HILL PLAZA",,"PEARL RIVER",NY,"NEW YORK","US Mid Atlantic",,,"=""2836""","Biological Products, Except Diagnostic Substances",325414,"Biological Product (except Diagnostic) Manufacturing",34,1,12/29/22,"16,194,381",12/31/22,"118,566,000","-65,916,000","-211,465,000","395,595,000"
24926,"Revenue from customer contracts","Revenue Recognition – Determination of Estimated Service Period",500719,12/31/22,02/23/23,1,"PricewaterhouseCoopers LLP",,,,"Los Angeles",CA,CALIFORNIA,"US West",10-K,2023-02-23,,"Activision Blizzard, Inc.",718877,,"2701 OLYMPIC BOULEVARD","BUILDING B","SANTA MONICA",CA,CALIFORNIA,"US West",,,"=""7372""","Prepackaged Software",511210,"Software Publishers",34,77,12/31/22,"60,031,856,640",12/31/22,"7,528,000,000","1,513,000,000","8,231,000,000","27,383,000,000"
22686,"Other intangible assets","Valuation of Indefinite-Lived Trade Names",493572,08/31/22,10/26/22,2,"Ernst & Young LLP",,,,Atlanta,GA,GEORGIA,"US Southeast",10-K,2022-10-26,,"ACUITY INC. (DE)",1144215,"=""AYI""","1170 PEACHTREE STREET NE","SUITE 1200",ATLANTA,GA,GEORGIA,"US Southeast",,,"=""3640""","Electric Lighting & Wiring Equipment",335110,"Electric Lamp Bulb and Part Manufacturing",34,164,08/31/22,"5,325,634,560",08/31/22,"4,006,100,000","384,000,000","298,300,000","3,480,200,000"
26253,"Other income taxes","Accounting for Income Taxes",502457,12/31/22,03/01/23,1,"PricewaterhouseCoopers LLP",,,,Boston,MA,MASSACHUSETTS,"US New England",10-K,2023-03-01,,"Acushnet Holdings Corp.",1672013,"=""GOLF""","333 BRIDGE STREET",,FAIRHAVEN,MA,MASSACHUSETTS,"US New England",,,"=""3949""","Sporting and Athletic Goods, NEC",339920,"Sporting and Athletic Goods Manufacturing",34,42,12/31/22,"2,863,039,488",12/31/22,"2,270,336,000","199,278,000","195,002,000","2,193,807,000"
26323,"Deferred and capitalized costs","Capitalized internal-use software development costs",502443,12/31/22,03/01/23,2,"Ernst & Young LLP",,,,"New York",NY,"NEW YORK","US Mid Atlantic",10-K,2023-03-01,,"ACV Auctions Inc.",1637873,"=""ACVA""","640 ELLICOTT STREET",,BUFFALO,NY,"NEW YORK","US Mid Atlantic",,,"=""7389""","Business Services, NEC",459999,,34,8,12/31/22,"995,169,216",12/31/22,"421,529,000","-102,193,000","374,678,000","914,922,000"
27572,"Other contingent liabilities","Measurement of accrued liabilities for automobile and workers’ compensation claims",505405,12/31/22,03/16/23,4,"KPMG LLP",,,,Houston,TX,TEXAS,"US Southwest",10-K,2023-03-16,,"ADAMS RESOURCES & ENERGY, INC.",2178,,"2727 ALLEN PARKWAY","9TH FLOOR",HOUSTON,TX,TEXAS,"US Southwest",,,"=""5172""","Petroleum and Petroleum Products Wholesalers, Except Bulk Stations and Terminals",424720,"Petroleum and Petroleum Products Merchant Wholesalers (except Bulk Stations and Terminals)",34,39,12/31/22,"97,124,240",12/31/22,"3,366,917,000","3,487,000","77,004,000","384,159,000"
25984,"Other revenue","Implicit Price Concession",502027,12/31/22,02/28/23,4,"KPMG LLP",,,,Philadelphia,PA,PENNSYLVANIA,"US Mid Atlantic",10-K,2023-02-28,,"AdaptHealth Corp.",1725255,"=""AHCO""","555 EAST NORTH LANE","SUITE 5075",CONSHOHOCKEN,PA,PENNSYLVANIA,"US Mid Atlantic",,,"=""8082""","Home Health Care Services",423450,"Medical, Dental, and Hospital Equipment and Supplies Merchant Wholesalers",34,19,12/31/22,"2,583,843,072",12/31/22,"2,970,595,000","69,316,000","-1,556,912,000","5,219,587,000"
23942,"Research and development expenses","Genentech Agreement",499393,12/31/22,02/14/23,2,"Ernst & Young LLP",,,,Seattle,WA,WASHINGTON,"US West",10-K,2023-02-14,,"Adaptive Biotechnologies Corp",1478320,"=""ADPT""","1165 EASTLAKE AVE E",,SEATTLE,WA,WASHINGTON,"US West",,,"=""2836""","Biological Products, Except Diagnostic Substances",325414,"Biological Product (except Diagnostic) Manufacturing",34,8,12/31/22,"1,093,322,240",12/31/22,"185,308,000","-200,191,000","338,366,000","856,617,000"
27414,"Other debt","Royalty purchase agreement with HealthCare Royalty Partners - Deferred royalty obligation accretion of the liability",505106,12/31/22,03/15/23,1,"PricewaterhouseCoopers LLP",286,"PricewaterhouseCoopers SA",1358,Lausanne,V8,SWITZERLAND,Foreign,6-K,2023-03-15,,"ADC Therapeutics SA",1771910,"=""ADCT""",BIOPOLE,"ROUTE DE LA CORNICHE 3B",EPALINGES,V8,SWITZERLAND,Foreign,,,"=""2834""","Pharmaceutical Preparations",325412,"Pharmaceutical Preparation Manufacturing",34,4,12/29/22,"291,111,712",12/31/22,"209,908,000","-155,800,000","74,367,000","529,168,000"
27415,"Sales return and allowances","Product revenue - Gross-to-net sales adjustments (GTN)",505106,12/31/22,03/15/23,1,"PricewaterhouseCoopers LLP",286,"PricewaterhouseCoopers SA",1358,Lausanne,V8,SWITZERLAND,Foreign,6-K,2023-03-15,,"ADC Therapeutics SA",1771910,"=""ADCT""",BIOPOLE,"ROUTE DE LA CORNICHE 3B",EPALINGES,V8,SWITZERLAND,Foreign,,,"=""2834""","Pharmaceutical Preparations",325412,"Pharmaceutical Preparation Manufacturing",34,4,12/29/22,"291,111,712",12/31/22,"209,908,000","-155,800,000","74,367,000","529,168,000"
27423,"Other debt","Royalty purchase agreement with HealthCare Royalty Partners – Deferred royalty obligation accretion of the liability",505159,12/31/22,03/15/23,1,"PricewaterhouseCoopers LLP",286,"PricewaterhouseCoopers SA",1358,Lausanne,V8,SWITZERLAND,Foreign,20-F,2023-03-15,,"ADC Therapeutics SA",1771910,"=""ADCT""",BIOPOLE,"ROUTE DE LA CORNICHE 3B",EPALINGES,V8,SWITZERLAND,Foreign,,,"=""2834""","Pharmaceutical Preparations",325412,"Pharmaceutical Preparation Manufacturing",34,4,12/29/22,"291,111,712",12/31/22,"209,908,000","-155,800,000","74,367,000","529,168,000"
27424,"Sales return and allowances","Product Revenue – Gross-to-net (GTN) sales adjustments",505159,12/31/22,03/15/23,1,"PricewaterhouseCoopers LLP",286,"PricewaterhouseCoopers SA",1358,Lausanne,V8,SWITZERLAND,Foreign,20-F,2023-03-15,,"ADC Therapeutics SA",1771910,"=""ADCT""",BIOPOLE,"ROUTE DE LA CORNICHE 3B",EPALINGES,V8,SWITZERLAND,Foreign,,,"=""2834""","Pharmaceutical Preparations",325412,"Pharmaceutical Preparation Manufacturing",34,4,12/29/22,"291,111,712",12/31/22,"209,908,000","-155,800,000","74,367,000","529,168,000"
26095,"Accounts/loans receivable","Valuation of Accounts Receivable, Net of Allowances for Implicit Price Concessions",501794,12/31/22,02/28/23,1,"PricewaterhouseCoopers LLP",,,,Dallas,TX,TEXAS,"US Southwest",10-K,2023-02-28,,"Addus HomeCare Corp",1468328,"=""ADUS""","6303 COWBOYS WAY","SUITE 600",FRISCO,TX,TEXAS,"US Southwest",,,"=""8082""","Home Health Care Services",621610,"Home Health Care Services",34,99,12/31/22,"1,604,574,720",12/31/22,"951,120,000","46,025,000","-21,485,000","937,994,000"
27043,"Other assets","Valuation of Level 3 Biological Assets",504112,12/31/22,03/07/23,1,"PricewaterhouseCoopers LLP",88,"Price Waterhouse & Co SRL",1349,"Buenos Aires",C1,ARGENTINA,Foreign,6-K,2023-03-09,,"Adecoagro S.A.",1499505,"=""AGRO""","28, BOULEVARD F.W. RAIFFEEISEN",,N/A,N4,LUXEMBOURG,Foreign,,,"=""0100""","Agricultural production- crops",111150,"Corn Farming",34,8,12/29/22,"916,548,352",12/31/22,"1,347,724,000","108,606,000","1,089,971,000","3,108,855,000"
27044,"Long-lived assets","Property, Plant and Equipment and Goodwill Impairment Assessment- Cash Generating Units with Allocated Goodwill in Brazil",504112,12/31/22,03/07/23,1,"PricewaterhouseCoopers LLP",88,"Price Waterhouse & Co SRL",1349,"Buenos Aires",C1,ARGENTINA,Foreign,6-K,2023-03-09,,"Adecoagro S.A.",1499505,"=""AGRO""","28, BOULEVARD F.W. RAIFFEEISEN",,N/A,N4,LUXEMBOURG,Foreign,,,"=""0100""","Agricultural production- crops",111150,"Corn Farming",34,8,12/29/22,"916,548,352",12/31/22,"1,347,724,000","108,606,000","1,089,971,000","3,108,855,000"
29454,"Other assets","Valuation of Level 3 Biological Assets",509963,12/31/22,04/26/23,1,"PricewaterhouseCoopers LLP",88,"Price Waterhouse & Co SRL",1349,"Buenos Aires",C1,ARGENTINA,Foreign,20-F,2023-04-26,,"Adecoagro S.A.",1499505,"=""AGRO""","28, BOULEVARD F.W. RAIFFEEISEN",,N/A,N4,LUXEMBOURG,Foreign,,,"=""0100""","Agricultural production- crops",111150,"Corn Farming",34,8,12/29/22,"916,548,352",12/31/22,"1,347,724,000","108,606,000","1,089,971,000","3,108,855,000"
29455,"Long-lived assets","Property, Plant and Equipment and Goodwill Impairment Assessment- Cash Generating Units with Allocated Goodwill in Brazil
",509963,12/31/22,04/26/23,1,"PricewaterhouseCoopers LLP",88,"Price Waterhouse & Co SRL",1349,"Buenos Aires",C1,ARGENTINA,Foreign,20-F,2023-04-26,,"Adecoagro S.A.",1499505,"=""AGRO""","28, BOULEVARD F.W. RAIFFEEISEN",,N/A,N4,LUXEMBOURG,Foreign,,,"=""0100""","Agricultural production- crops",111150,"Corn Farming",34,8,12/29/22,"916,548,352",12/31/22,"1,347,724,000","108,606,000","1,089,971,000","3,108,855,000"
26317,"Revenue from customer contracts","Revenue Recognition – Allocation of Transaction Price to Performance Obligations",502490,12/31/22,03/01/23,1,"PricewaterhouseCoopers LLP",,,,"San Jose",CA,CALIFORNIA,"US West",10-K,2023-03-01,,"Adeia Inc.",1803696,"=""ADEA""","3025 ORCHARD PARKWAY",,"SAN JOSE",CA,CALIFORNIA,"US West",,,"=""4841""","Cable and Other Pay Television Services",334413,"Semiconductor and Related Device Manufacturing",34,9,12/31/22,"996,983,168",12/31/22,"438,933,000","-295,880,000","-444,724,000","1,210,526,000"
22988,Goodwill,"Annual Goodwill Impairment Assessment",494826,09/30/22,11/22/22,1,"PricewaterhouseCoopers LLP",,,,Detroit,MI,MICHIGAN,"US Midwest",10-K,2022-11-22,,"Adient plc",1670541,"=""ADNT""","25 NORTH WALL QUAY","DUBLIN 1",DUBLIN,L2,IRELAND,Foreign,,,"=""3714""","Motor Vehicle Parts and Accessories",336399,"All Other Motor Vehicle Parts Manufacturing",34,31,09/28/22,"2,960,082,432",09/30/22,"14,121,000,000","-120,000,000","-406,000,000","9,158,000,000"
23437,"Revenue from customer contracts","Performance obligations in cloud-enabled software subscriptions",497653,12/02/22,01/17/23,4,"KPMG LLP",,,,"Santa Clara",CA,CALIFORNIA,"US West",10-K,2023-01-17,,"ADOBE INC.",796343,"=""ADBE""","345 PARK AVE",,"SAN JOSE",CA,CALIFORNIA,"US West",,,"=""7372""","Prepackaged Software",511210,"Software Publishers",34,345,11/30/22,"160,357,957,632",12/02/22,"17,606,000,000","4,756,000,000","-185,000,000","27,165,000,000"
25894,Goodwill,"Goodwill Impairment Assessments — Solar and Commercial Reporting Units",501999,12/31/22,02/28/23,1,"PricewaterhouseCoopers LLP",,,,"Hallandale Beach",FL,FLORIDA,"US Southeast",10-K,2023-02-28,,"ADT Inc.",1703056,"=""ADT""","1501 YAMATO ROAD",,"BOCA RATON",FL,FLORIDA,"US Southeast",,,"=""7381""","Detective, Guard, and Armored Car Services",561621,"Security Systems Services (except Locksmiths)",34,9,12/31/22,"7,819,229,184",12/31/22,"6,395,310,000","132,663,000","-7,465,615,000","17,821,236,000"
30765,Goodwill,"Goodwill Impairment Assessments – Solar and Commercial Reporting Units",515216,12/31/22,02/28/23,1,"PricewaterhouseCoopers LLP",,,,"Hallandale Beach",FL,FLORIDA,"US Southeast",10-K/A,2023-07-27,,"ADT Inc.",1703056,"=""ADT""","1501 YAMATO ROAD",,"BOCA RATON",FL,FLORIDA,"US Southeast",,,"=""7381""","Detective, Guard, and Armored Car Services",561621,"Security Systems Services (except Locksmiths)",34,9,12/31/22,"7,819,229,184",12/31/22,"6,395,310,000","132,663,000","-7,465,615,000","17,821,236,000"
22036,"Business combinations","Acquisition of Walden University – Valuation of Title IV Eligibility and Accreditations and Trade Name Intangible Assets",490711,06/30/22,08/11/22,1,"PricewaterhouseCoopers LLP",,,,Chicago,IL,ILLINOIS,"US Midwest",10-K,2022-08-11,,"Adtalem Global Education Inc.",730464,"=""ATGE""","233 S. WACKER DRIVE","SUITE 800",CHICAGO,IL,ILLINOIS,"US Midwest",,,"=""8200""","Services-Educational Services",611519,"Other Technical and Trade Schools",34,36,06/30/22,"1,625,016,704",06/30/22,"1,381,842,000","310,991,000","-329,772,000","3,029,175,000"
26443,"Business combinations","Acquisition of ADVA Optical Networking SE – Valuation of Developed Technology, Customer Relationships, and Backlog Intangible Assets ",502786,12/31/22,03/01/23,1,"PricewaterhouseCoopers LLP",,,,Birmingham,AL,ALABAMA,"US Southeast",10-K,2023-03-01,,"ADTRAN Holdings, Inc.",926282,"=""ADTN""","901 EXPLORER BLVD",,HUNTSVILLE,AL,ALABAMA,"US Southeast",,,"=""3661""","Telephone and Telegraph Apparatus",334210,"Telephone Apparatus Manufacturing",34,19,12/31/22,"1,463,534,336",12/31/22,"1,025,536,000","-2,037,000","191,019,000","1,943,494,000"
30940,"Business combinations","Acquisition of ADVA Optical Networking SE – Valuation of Developed Technology, Customer Relationships, and Backlog Intangible Assets",515925,12/31/22,03/01/23,1,"PricewaterhouseCoopers LLP",,,,Birmingham,AL,ALABAMA,"US Southeast",10-K/A,2023-08-14,,"ADTRAN Holdings, Inc.",926282,"=""ADTN""","901 EXPLORER BLVD",,HUNTSVILLE,AL,ALABAMA,"US Southeast",,,"=""3661""","Telephone and Telegraph Apparatus",334210,"Telephone Apparatus Manufacturing",34,19,12/31/22,"1,463,534,336",12/31/22,"1,025,536,000","-2,037,000","191,019,000","1,943,494,000"
25989,"Vendor/supplier rebates","Vendor Incentives — Refer to Note 2 to the Consolidated Financial Statements",501861,12/31/22,02/28/23,3,"Deloitte & Touche LLP",,,,Charlotte,NC,"NORTH CAROLINA","US Southeast",10-K,2023-02-28,,"ADVANCE AUTO PARTS INC",1158449,"=""AAP""","4200 SIX FORKS ROAD",,RALEIGH,NC,"NORTH CAROLINA","US Southeast",,,"=""5531""","Auto and Home Supply Stores",441310,"Automotive Parts and Accessories Stores",34,147,12/31/22,"8,713,585,664",12/31/22,"11,154,722,000","464,402,000","987,820,000","11,986,447,000"
21212,"Deferred and stock-based compensation","Employee Benefit Plans - Employee Stock Ownership Plan (“ESOP”) – Refer to Note 13 to the financial statements",487218,03/31/22,05/19/22,3,"Deloitte & Touche LLP",,,,Columbus,OH,OHIO,"US Midwest",10-K,2022-05-19,,"ADVANCED DRAINAGE SYSTEMS, INC.",1604028,"=""WMS""","4024 GREEN STRIPE LANE",,HILLIARD,OH,OHIO,"US Midwest",,,"=""3086""","Plastics Foam Products",326122,"Plastics Pipe and Pipe Fitting Manufacturing",34,119,03/31/22,"8,591,032,320",03/31/22,"2,769,315,000","271,331,000","46,745,000","2,649,758,000"
24420,Inventory,"Inventory Valuation",499848,12/31/22,02/17/23,2,"Ernst & Young LLP",,,,Denver,CO,COLORADO,"US West",10-K,2023-02-17,,"ADVANCED ENERGY INDUSTRIES INC",927003,"=""AEIS""","ATTN:  PAUL OLDHAM","1595 WYNKOOP ST, SUITE 800",DENVER,CO,COLORADO,"US West",,,"=""3679""","Electronic Components, NEC",335999,"All Other Miscellaneous Electrical Equipment and Component Manufacturing",34,86,12/31/22,"3,210,659,584",12/31/22,"1,845,422,000","199,660,000","595,308,000","1,992,168,000"
25727,Inventory,"Inventory Valuation",501698,12/31/22,02/27/23,2,"Ernst & Young LLP",,,,"San Jose",CA,CALIFORNIA,"US West",10-K,2023-02-27,,"ADVANCED MICRO DEVICES INC",2488,"=""AMD""","2485 AUGUSTINE DRIVE",,"SANTA CLARA",CA,CALIFORNIA,"US West",,,"=""3674""","Semiconductors and Related Devices",334413,"Semiconductor and Related Device Manufacturing",34,65,12/31/22,"104,409,243,648",12/31/22,"23,601,000,000","1,320,000,000","6,455,000,000","67,580,000,000"
25728,"Business combinations","Business Combination",501698,12/31/22,02/27/23,2,"Ernst & Young LLP",,,,"San Jose",CA,CALIFORNIA,"US West",10-K,2023-02-27,,"ADVANCED MICRO DEVICES INC",2488,"=""AMD""","2485 AUGUSTINE DRIVE",,"SANTA CLARA",CA,CALIFORNIA,"US West",,,"=""3674""","Semiconductors and Related Devices",334413,"Semiconductor and Related Device Manufacturing",34,65,12/31/22,"104,409,243,648",12/31/22,"23,601,000,000","1,320,000,000","6,455,000,000","67,580,000,000"
24334,"Business combinations","Valuation of the Customer Relationships Intangible Asset - Acquisition of U.S. Amines Limited",499927,12/31/22,02/17/23,1,"PricewaterhouseCoopers LLP",,,,"Florham Park",NJ,"NEW JERSEY","US Mid Atlantic",10-K,2023-02-17,,"AdvanSix Inc.",1673985,"=""ASIX""","300 KIMBALL DRIVE","SUITE 101",PARSIPPANY,NJ,"NEW JERSEY","US Mid Atlantic",,,"=""2821""","Plastics Material and Synthetic Resins, and Nonvulcanizable Elastomers",325211,"Plastics Material and Resin Manufacturing",34,38,12/31/22,"1,043,516,672",12/31/22,"1,945,640,000","171,886,000","632,746,000","1,495,331,000"
26366,Goodwill,"Annual Goodwill Impairment Assessment – sales and marketing reporting units",502508,12/31/22,03/01/23,1,"PricewaterhouseCoopers LLP",,,,Irvine,CA,CALIFORNIA,"US West",10-K,2023-03-01,,"Advantage Solutions Inc.",1776661,"=""ADV""","C/O ADVANTAGE SOLUTIONS, INC.","7676 FORSYTH BOULEVARD, 5TH FLOOR","ST. LOUIS",MO,MISSOURI,"US Southeast",,,"=""7389""","Business Services, NEC",541611,"Administrative Management and General Management Consulting Services",34,2,12/31/22,"664,955,840",12/31/22,"4,049,742,000","-1,380,502,000","-1,657,726,000","4,262,371,000"
26367,"Other intangible assets","Annual Indefinite-Lived Intangible Assets Impairment Assessment – sales and marketing trade names",502508,12/31/22,03/01/23,1,"PricewaterhouseCoopers LLP",,,,Irvine,CA,CALIFORNIA,"US West",10-K,2023-03-01,,"Advantage Solutions Inc.",1776661,"=""ADV""","C/O ADVANTAGE SOLUTIONS, INC.","7676 FORSYTH BOULEVARD, 5TH FLOOR","ST. LOUIS",MO,MISSOURI,"US Southeast",,,"=""7389""","Business Services, NEC",541611,"Administrative Management and General Management Consulting Services",34,2,12/31/22,"664,955,840",12/31/22,"4,049,742,000","-1,380,502,000","-1,657,726,000","4,262,371,000"
28386,"Research and development expenses","Accrued research and development expenses – clinical and manufacturing costs",506976,12/31/22,03/30/23,2,"Ernst & Young LLP",,,,"San Jose",CA,CALIFORNIA,"US West",10-K,2023-03-30,,"Adverum Biotechnologies, Inc.",1501756,"=""ADVM""","100 CARDINAL WAY",,"REDWOOD CITY",CA,CALIFORNIA,"US West",,,"=""2836""","Biological Products, Except Diagnostic Substances",325414,"Biological Product (except Diagnostic) Manufacturing",34,1,12/31/22,"58,067,860",12/31/22,,"-154,536,000",,"308,372,000"
22907,"Revenue from customer contracts","Revenue Recognition - Contract cost and claim recovery estimates",494640,09/30/22,11/16/22,2,"Ernst & Young LLP",,,,"Los Angeles",CA,CALIFORNIA,"US West",10-K,2022-11-17,,AECOM,868857,"=""ACM""","13355 NOEL ROAD","SUITE 400",DALLAS,TX,TEXAS,"US Southwest",,,"=""8711""","Engineering Services",541611,"Administrative Management and General Management Consulting Services",34,68,09/30/22,"9,498,910,720",09/30/22,"13,148,182,000","310,611,000","-939,659,000","11,139,315,000"
27836,"Insurance contract liabilities","Valuation of certain assets and liabilities arising from insurance contracts",505784,12/31/22,03/22/23,1,"PricewaterhouseCoopers LLP",108,"PricewaterhouseCoopers Accountants NV",1395,Amsterdam,P7,NETHERLANDS,Foreign,20-F,2023-03-22,,"AEGON LTD.",769218,"=""AEG""","WORLD TRADE CENTER SCHIPHOL","SCHIPHOL BOULEVARD 223",SCHIPHOL,P7,NETHERLANDS,Foreign,,,"=""6311""","Life Insurance",524113,"Direct Life Insurance Carriers",34,5,12/29/22,"10,721,134,592",12/31/22,"-36,540,000,000","-3,000,000,000","13,636,000,000","428,810,000,000"
27837,"Other investments","Valuation of certain Level 3 investments",505784,12/31/22,03/22/23,1,"PricewaterhouseCoopers LLP",108,"PricewaterhouseCoopers Accountants NV",1395,Amsterdam,P7,NETHERLANDS,Foreign,20-F,2023-03-22,,"AEGON LTD.",769218,"=""AEG""","WORLD TRADE CENTER SCHIPHOL","SCHIPHOL BOULEVARD 223",SCHIPHOL,P7,NETHERLANDS,Foreign,,,"=""6311""","Life Insurance",524113,"Direct Life Insurance Carriers",34,5,12/29/22,"10,721,134,592",12/31/22,"-36,540,000,000","-3,000,000,000","13,636,000,000","428,810,000,000"
27838,"Shareholder valuation","Disclosure over the estimated impact of IFRS 17 and IFRS 9 in accordance with IAS 8",505784,12/31/22,03/22/23,1,"PricewaterhouseCoopers LLP",108,"PricewaterhouseCoopers Accountants NV",1395,Amsterdam,P7,NETHERLANDS,Foreign,20-F,2023-03-22,,"AEGON LTD.",769218,"=""AEG""","WORLD TRADE CENTER SCHIPHOL","SCHIPHOL BOULEVARD 223",SCHIPHOL,P7,NETHERLANDS,Foreign,,,"=""6311""","Life Insurance",524113,"Direct Life Insurance Carriers",34,5,12/29/22,"10,721,134,592",12/31/22,"-36,540,000,000","-3,000,000,000","13,636,000,000","428,810,000,000"
29959,"Accounts/loans receivable","Valuation of the trade account receivable from Gasoducto Sur Peruano S.A.",512104,12/31/22,05/15/23,4,"KPMG LLP",865,"Emmerich Cordova y Asociados S Civil de RL",2282,Lima,R5,PERU,Foreign,20-F,2023-05-16,,"AENZA S.A.A.",1572621,,"AV. PASEO DE LA REPUBLICA 4667",,LIMA,R5,PERU,Foreign,,,"=""1600""","Heavy Construction Other Than Bldg Const - Contractors",236210,"Industrial Building Construction",34,3,12/29/22,"180,194,560",12/31/22,"1,155,139,000","-72,385,000","71,894,000","1,552,715,000"
29960,"Other contingent liabilities","Provisions for civil reparation and the sanctioning administrative process",512104,12/31/22,05/15/23,4,"KPMG LLP",865,"Emmerich Cordova y Asociados S Civil de RL",2282,Lima,R5,PERU,Foreign,20-F,2023-05-16,,"AENZA S.A.A.",1572621,,"AV. PASEO DE LA REPUBLICA 4667",,LIMA,R5,PERU,Foreign,,,"=""1600""","Heavy Construction Other Than Bldg Const - Contractors",236210,"Industrial Building Construction",34,3,12/29/22,"180,194,560",12/31/22,"1,155,139,000","-72,385,000","71,894,000","1,552,715,000"
29961,"Revenue from customer contracts","Revenue recognition for engineering and construction contracts with customers",512104,12/31/22,05/15/23,4,"KPMG LLP",865,"Emmerich Cordova y Asociados S Civil de RL",2282,Lima,R5,PERU,Foreign,20-F,2023-05-16,,"AENZA S.A.A.",1572621,,"AV. PASEO DE LA REPUBLICA 4667",,LIMA,R5,PERU,Foreign,,,"=""1600""","Heavy Construction Other Than Bldg Const - Contractors",236210,"Industrial Building Construction",34,3,12/29/22,"180,194,560",12/31/22,"1,155,139,000","-72,385,000","71,894,000","1,552,715,000"
25004,"Regulatory assets and liabilities","Accounting for the Effects of Cost-Based Regulation
",500763,12/31/22,02/23/23,1,"PricewaterhouseCoopers LLP",,,,Columbus,OH,OHIO,"US Midwest",10-K,2023-02-23,,"AEP Texas Inc.",1721781,,"1 RIVERSIDE PLAZA",,COLUMBUS,OH,OHIO,"US Midwest",4904,"AMERICAN ELECTRIC POWER CO INC","=""4911""","Electric Services",221122,"Electric Power Distribution",34,,,,12/31/22,"1,846,800,000","307,900,000",,"12,892,200,000"
30136,"Regulatory assets and liabilities","Accounting for the Effects of Cost-Based Regulation",512578,12/31/22,02/23/23,1,"PricewaterhouseCoopers LLP",,,,Columbus,OH,OHIO,"US Midwest",8-K,2023-05-26,,"AEP Texas Inc.",1721781,,"1 RIVERSIDE PLAZA",,COLUMBUS,OH,OHIO,"US Midwest",4904,"AMERICAN ELECTRIC POWER CO INC","=""4911""","Electric Services",221122,"Electric Power Distribution",34,,,,12/31/22,"1,846,800,000","307,900,000",,"12,892,200,000"
24942,"Regulatory assets and liabilities","Accounting for the Effects of Cost-Based Regulation",500751,12/31/22,02/23/23,1,"PricewaterhouseCoopers LLP",,,,Columbus,OH,OHIO,"US Midwest",10-K,2023-02-23,,"AEP Transmission Company, LLC",1702494,,"1 RIVERSIDE PLAZA",,COLUMBUS,OH,OHIO,"US Midwest",4904,"AMERICAN ELECTRIC POWER CO INC","=""4911""","Electric Services",221121,"Electric Bulk Power Transmission and Control",34,,,,12/31/22,"1,624,500,000","594,200,000",,"13,814,200,000"
24943,"Discontinued operations","Classification of the Assets and Liabilities of KTCo as Held For Sale",500751,12/31/22,02/23/23,1,"PricewaterhouseCoopers LLP",,,,Columbus,OH,OHIO,"US Midwest",10-K,2023-02-23,,"AEP Transmission Company, LLC",1702494,,"1 RIVERSIDE PLAZA",,COLUMBUS,OH,OHIO,"US Midwest",4904,"AMERICAN ELECTRIC POWER CO INC","=""4911""","Electric Services",221121,"Electric Bulk Power Transmission and Control",34,,,,12/31/22,"1,624,500,000","594,200,000",,"13,814,200,000"
30134,"Regulatory assets and liabilities","Accounting for the Effects of Cost-Based Regulation",512577,12/31/22,02/23/23,1,"PricewaterhouseCoopers LLP",,,,Columbus,OH,OHIO,"US Midwest",8-K,2023-05-26,,"AEP Transmission Company, LLC",1702494,,"1 RIVERSIDE PLAZA",,COLUMBUS,OH,OHIO,"US Midwest",4904,"AMERICAN ELECTRIC POWER CO INC","=""4911""","Electric Services",221121,"Electric Bulk Power Transmission and Control",34,,,,12/31/22,"1,624,500,000","594,200,000",,"13,814,200,000"
30135,"Discontinued operations","Classification of the Assets and Liabilities of KTCo as Held For Sale",512577,12/31/22,02/23/23,1,"PricewaterhouseCoopers LLP",,,,Columbus,OH,OHIO,"US Midwest",8-K,2023-05-26,,"AEP Transmission Company, LLC",1702494,,"1 RIVERSIDE PLAZA",,COLUMBUS,OH,OHIO,"US Midwest",4904,"AMERICAN ELECTRIC POWER CO INC","=""4911""","Electric Services",221121,"Electric Bulk Power Transmission and Control",34,,,,12/31/22,"1,624,500,000","594,200,000",,"13,814,200,000"
26673,Leases,"Assessment of impairment of flight equipment held for operating leases subject to impairment.",502811,12/31/22,03/02/23,4,"KPMG LLP",71,KPMG,1116,Dublin,L2,IRELAND,Foreign,20-F,2023-03-02,,"AerCap Holdings N.V.",1378789,"=""AER""","AERCAP HOUSE","65 ST. STEPHEN'S GREEN",DUBLIN,L2,IRELAND,Foreign,,,"=""7359""","Equipment Rental and Leasing, NEC",532411,"Commercial Air, Rail, and Water Transportation Equipment Rental and Leasing",34,58,12/29/22,"14,201,034,752",12/31/22,"6,530,546,000","-726,041,000","15,932,297,000","69,726,918,000"
24058,"Revenue from customer contracts","Revenue recognition - estimated total cost at completion on fixed-price contracts",499542,12/31/22,02/15/23,1,"PricewaterhouseCoopers LLP",,,,Sacramento,CA,CALIFORNIA,"US West",10-K,2023-02-15,,"AEROJET ROCKETDYNE HOLDINGS, INC.",40888,,"222 N. PACIFIC COAST HIGHWAY","SUITE 500","EL SEGUNDO",CA,CALIFORNIA,"US West",,,"=""3760""","Guided Missiles & Space Vehicles & Parts",326291,"Rubber Product Manufacturing for Mechanical Use",34,56,12/31/22,"4,513,550,848",12/31/22,"2,237,600,000","74,000,000","351,600,000","2,371,800,000"
29799,"Revenue from customer contracts","Revenue recognition - estimated total cost at completion on fixed-price contracts",511468,12/31/22,02/15/23,1,"PricewaterhouseCoopers LLP",,,,Sacramento,CA,CALIFORNIA,"US West",10-K/A,2023-05-04,,"AEROJET ROCKETDYNE HOLDINGS, INC.",40888,,"222 N. PACIFIC COAST HIGHWAY","SUITE 500","EL SEGUNDO",CA,CALIFORNIA,"US West",,,"=""3760""","Guided Missiles & Space Vehicles & Parts",326291,"Rubber Product Manufacturing for Mechanical Use",34,56,12/31/22,"4,513,550,848",12/31/22,"2,237,600,000","74,000,000","351,600,000","2,371,800,000"
21644,"Business combinations","Business Acquisitions – Refer to Note 1 and 21 to the financial statements",488981,04/30/22,06/28/22,3,"Deloitte & Touche LLP",,,,"Los Angeles",CA,CALIFORNIA,"US West",10-K,2022-06-29,,"AeroVironment Inc",1368622,"=""AVAV""","241 18TH STREET SOUTH, SUITE 650",,ARLINGTON,VA,VIRGINIA,"US Mid Atlantic",,,"=""3721""",Aircraft,336411,"Aircraft Manufacturing",34,80,04/30/22,"2,004,087,424",04/30/22,"445,732,000","-4,188,000","176,398,000","914,200,000"
21645,Goodwill,"Goodwill— Refer to Note 1 and Note 7 to the financial statements",488981,04/30/22,06/28/22,3,"Deloitte & Touche LLP",,,,"Los Angeles",CA,CALIFORNIA,"US West",10-K,2022-06-29,,"AeroVironment Inc",1368622,"=""AVAV""","241 18TH STREET SOUTH, SUITE 650",,ARLINGTON,VA,VIRGINIA,"US Mid Atlantic",,,"=""3721""",Aircraft,336411,"Aircraft Manufacturing",34,80,04/30/22,"2,004,087,424",04/30/22,"445,732,000","-4,188,000","176,398,000","914,200,000"
26251,Goodwill,"Goodwill Impairment Test for AES Andes and AES El Salvador Reporting Units",502606,12/31/22,03/01/23,2,"Ernst & Young LLP",,,,Tysons,VA,VIRGINIA,"US Mid Atlantic",10-K,2023-03-01,,"AES CORP",874761,"=""AES""","4300 WILSON BOULEVARD",,ARLINGTON,VA,VIRGINIA,"US Mid Atlantic",,,"=""4991""","Cogeneration Services & Small Power Producers",221122,"Electric Power Distribution",34,29,12/31/22,"19,233,062,912",12/31/22,"12,617,000,000","-546,000,000","1,555,000,000","38,363,000,000"
26252,"Property, plant and equipment","Long-lived Asset Impairments and Re-evaluation of Useful Lives",502606,12/31/22,03/01/23,2,"Ernst & Young LLP",,,,Tysons,VA,VIRGINIA,"US Mid Atlantic",10-K,2023-03-01,,"AES CORP",874761,"=""AES""","4300 WILSON BOULEVARD",,ARLINGTON,VA,VIRGINIA,"US Mid Atlantic",,,"=""4991""","Cogeneration Services & Small Power Producers",221122,"Electric Power Distribution",34,29,12/31/22,"19,233,062,912",12/31/22,"12,617,000,000","-546,000,000","1,555,000,000","38,363,000,000"
29825,Goodwill,"Goodwill Impairment Test for AES Andes and AES El Salvador Reporting Units",511704,12/31/22,03/01/23,2,"Ernst & Young LLP",,,,Tysons,VA,VIRGINIA,"US Mid Atlantic",8-K,2023-05-08,,"AES CORP",874761,"=""AES""","4300 WILSON BOULEVARD",,ARLINGTON,VA,VIRGINIA,"US Mid Atlantic",,,"=""4991""","Cogeneration Services & Small Power Producers",221122,"Electric Power Distribution",34,29,12/31/22,"19,233,062,912",12/31/22,"12,617,000,000","-546,000,000","1,555,000,000","38,363,000,000"
29826,"Property, plant and equipment","Long-lived Asset Impairments and Re-evaluation of Useful Lives",511704,12/31/22,03/01/23,2,"Ernst & Young LLP",,,,Tysons,VA,VIRGINIA,"US Mid Atlantic",8-K,2023-05-08,,"AES CORP",874761,"=""AES""","4300 WILSON BOULEVARD",,ARLINGTON,VA,VIRGINIA,"US Mid Atlantic",,,"=""4991""","Cogeneration Services & Small Power Producers",221122,"Electric Power Distribution",34,29,12/31/22,"19,233,062,912",12/31/22,"12,617,000,000","-546,000,000","1,555,000,000","38,363,000,000"
28009,"Revenue from customer contracts","Revenue — Refer to Notes 1 and 3 to the financial statements",506217,12/31/22,03/24/23,3,"Deloitte & Touche LLP",,,,"San Jose",CA,CALIFORNIA,"US West",10-K,2023-03-24,,"Aeva Technologies, Inc.",1789029,"=""AEVA""","555 ELLIS STREET",,"MOUNTAIN VIEW",CA,CALIFORNIA,"US West",,,"=""3714""","Motor Vehicle Parts and Accessories",334413,"Semiconductor and Related Device Manufacturing",34,1,12/31/22,"297,497,280",12/31/22,"4,192,000","-147,305,000","326,401,000","356,632,000"
24325,"Equity investments and joint ventures","Impairment Measurement for Equity Method Investment in Affiliate",499894,12/31/22,02/17/23,1,"PricewaterhouseCoopers LLP",,,,Boston,MA,MASSACHUSETTS,"US New England",10-K,2023-02-17,,"AFFILIATED MANAGERS GROUP, INC.",1004434,"=""AMG""","777 SOUTH FLAGLER DRIVE","SUITE 1401 EAST TOWER","WEST PALM BEACH",FL,FLORIDA,"US Southeast",,,"=""6282""","Investment Advice",523930,"Investment Advice",34,158,12/31/22,"5,671,794,176",12/31/22,"2,215,200,000","1,145,900,000","-829,000,000","8,881,000,000"
27928,"Revenue from customer contracts","Revenue recognition from collaboration agreements",505971,12/31/22,03/23/23,4,"KPMG LLP",254,"KPMG AG Wirtschaftsprüfungsgesellschaft",1021,Mannheim,2M,GERMANY,Foreign,20-F,2023-03-23,,"Affimed N.V.",1608390,"=""AFMDQ""","GOTTLIEB-DAIMLER-STRASSE 2",,MANNHEIM,2M,GERMANY,Foreign,,,"=""2834""","Pharmaceutical Preparations",325414,"Biological Product (except Diagnostic) Manufacturing",34,1,12/29/22,"151,806,320",12/31/22,"44,134,000","-91,789,000","163,138,000","213,998,000"
22200,"Allowance for credit losses","Allowance for Credit Losses — Refer to Notes 2 and 4 to the financial statements",491256,06/30/22,08/29/22,3,"Deloitte & Touche LLP",,,,"San Francisco",CA,CALIFORNIA,"US West",10-K,2022-08-29,,"Affirm Holdings, Inc.",1820953,"=""AFRM""","650 CALIFORNIA STREET",,"SAN FRANCISCO",CA,CALIFORNIA,"US West",,,"=""6141""","Personal Credit Institutions",522320,"Financial Transactions Processing, Reserve, and Clearinghouse Activities",34,18,06/30/22,"4,104,234,752",06/30/22,"1,349,292,000","-707,417,000","1,999,779,000","6,973,792,000"
25449,"Long-term investments","Fair value of certain privately issued securities",500968,12/31/22,02/23/23,4,"KPMG LLP",,,,Atlanta,GA,GEORGIA,"US Southeast",10-K,2023-02-24,,"AFLAC INC",4977,"=""AFL""","1932 WYNNTON RD",,COLUMBUS,GA,GEORGIA,"US Southeast",,,"=""6321""","Accident and Health Insurance",524114,"Direct Health and Medical Insurance Carriers",34,72,12/31/22,"44,261,515,264",12/31/22,"19,140,000,000","4,418,000,000",,"131,017,000,000"
25450,"Insurance contract liabilities","Estimate of unpaid policy claims",500968,12/31/22,02/23/23,4,"KPMG LLP",,,,Atlanta,GA,GEORGIA,"US Southeast",10-K,2023-02-24,,"AFLAC INC",4977,"=""AFL""","1932 WYNNTON RD",,COLUMBUS,GA,GEORGIA,"US Southeast",,,"=""6321""","Accident and Health Insurance",524114,"Direct Health and Medical Insurance Carriers",34,72,12/31/22,"44,261,515,264",12/31/22,"19,140,000,000","4,418,000,000",,"131,017,000,000"
25451,"Policy changes","Disclosure of the expected impact from the adoption of ASU 2018-12 Financial Services - Insurance: Targeted Improvement to the Accounting for Long-Duration Contracts",500968,12/31/22,02/23/23,4,"KPMG LLP",,,,Atlanta,GA,GEORGIA,"US Southeast",10-K,2023-02-24,,"AFLAC INC",4977,"=""AFL""","1932 WYNNTON RD",,COLUMBUS,GA,GEORGIA,"US Southeast",,,"=""6321""","Accident and Health Insurance",524114,"Direct Health and Medical Insurance Carriers",34,72,12/31/22,"44,261,515,264",12/31/22,"19,140,000,000","4,418,000,000",,"131,017,000,000"
27839,"Business combinations","Business combinations",505786,12/31/22,03/20/23,2,"Ernst & Young LLP",34,"Ernst & Young Auditores Independentes SS",1448,"Belo Horizonte",D5,BRAZIL,Foreign,6-K,2023-03-22,,"Afya Ltd",1771007,"=""AFYA""","ALAMEDA OSCAR NIEMEYER, NO. 119","15TH FLOOR, VILA DA SERRA","NOVA LIMA, MINAS GERAIS",D5,BRAZIL,Foreign,,,"=""8200""","Services-Educational Services",611710,"Educational Support Services",34,16,12/31/22,"689,369,664",12/31/22,"441,130,000","74,389,000","-159,600,000","1,363,614,000"
29605,"Business combinations","Business combinations",510988,12/31/22,03/20/23,2,"Ernst & Young LLP",34,"Ernst & Young Auditores Independentes SS",1448,"Belo Horizonte",D5,BRAZIL,Foreign,20-F,2023-04-28,,"Afya Ltd",1771007,"=""AFYA""","ALAMEDA OSCAR NIEMEYER, NO. 119","15TH FLOOR, VILA DA SERRA","NOVA LIMA, MINAS GERAIS",D5,BRAZIL,Foreign,,,"=""8200""","Services-Educational Services",611710,"Educational Support Services",34,16,12/31/22,"689,369,664",12/31/22,"441,130,000","74,389,000","-159,600,000","1,363,614,000"
25655,"Other investments","Fair Value of Investments in Certain Residential Mortgage Loans",501565,12/31/22,02/27/23,1,"PricewaterhouseCoopers LLP",,,,"New York",NY,"NEW YORK","US Mid Atlantic",10-K,2023-02-27,,"AG Mortgage Investment Trust, Inc.",1514281,"=""MITN""","245 PARK AVENUE","26TH FLOOR","NEW YORK",NY,"NEW YORK","US Mid Atlantic",,,"=""6798""","Real Estate Investment Trusts",525990,"Other Financial Vehicles",34,5,12/31/22,"113,018,040",12/31/22,"218,000","-53,100,000",,"4,369,778,000"
26373,"Sales return and allowances","Assessment of the reserve and allowance for volume discount and sales incentive programs in certain geographic regions",502600,12/31/22,03/01/23,4,"KPMG LLP",,,,Atlanta,GA,GEORGIA,"US Southeast",10-K,2023-03-01,,"AGCO CORP /DE",880266,"=""AGCO""","4205 RIVER GREEN PKWAY",,DULUTH,GA,GEORGIA,"US Southeast",,,"=""3523""","Farm Machinery and Equipment",333111,"Farm Machinery and Equipment Manufacturing",34,139,12/31/22,"10,346,387,456",12/31/22,"12,651,400,000","889,600,000","2,207,200,000","10,103,700,000"
26374,"Other income taxes","Assessment of gross unrecognized income tax benefits in certain jurisdictions",502600,12/31/22,03/01/23,4,"KPMG LLP",,,,Atlanta,GA,GEORGIA,"US Southeast",10-K,2023-03-01,,"AGCO CORP /DE",880266,"=""AGCO""","4205 RIVER GREEN PKWAY",,DULUTH,GA,GEORGIA,"US Southeast",,,"=""3523""","Farm Machinery and Equipment",333111,"Farm Machinery and Equipment Manufacturing",34,139,12/31/22,"10,346,387,456",12/31/22,"12,651,400,000","889,600,000","2,207,200,000","10,103,700,000"
26375,Goodwill,"Assessment of goodwill impairment for a certain reporting unit",502600,12/31/22,03/01/23,4,"KPMG LLP",,,,Atlanta,GA,GEORGIA,"US Southeast",10-K,2023-03-01,,"AGCO CORP /DE",880266,"=""AGCO""","4205 RIVER GREEN PKWAY",,DULUTH,GA,GEORGIA,"US Southeast",,,"=""3523""","Farm Machinery and Equipment",333111,"Farm Machinery and Equipment Manufacturing",34,139,12/31/22,"10,346,387,456",12/31/22,"12,651,400,000","889,600,000","2,207,200,000","10,103,700,000"
27461,"Going concern","Going concern analysis  ",505247,12/31/22,03/16/23,4,"KPMG LLP",,,,Boston,MA,MASSACHUSETTS,"US New England",10-K,2023-03-16,,"AGENUS INC",1098972,"=""AGEN""","3 FORBES ROAD",,LEXINGTON,MA,MASSACHUSETTS,"US New England",,,"=""2836""","Biological Products, Except Diagnostic Substances",325414,"Biological Product (except Diagnostic) Manufacturing",34,2,12/31/22,"733,376,128",12/31/22,"98,024,000","-220,074,000","-92,973,000","413,556,000"
27867,"Revenue from customer contracts","Revenues, net",505871,12/31/22,03/22/23,2,"Ernst & Young LLP",,,,Iselin,NJ,"NEW JERSEY","US Mid Atlantic",10-K,2023-03-23,Yes,"AGILE THERAPEUTICS INC",1261249,,"500 COLLEGE ROAD EAST","SUITE 310",PRINCETON,NJ,"NEW JERSEY","US Mid Atlantic",,,"=""2834""","Pharmaceutical Preparations",325412,"Pharmaceutical Preparation Manufacturing",34,0,12/31/22,"9,754,213",12/31/22,"10,884,000","-25,412,000",,"14,242,000"
32415,"Revenue from customer contracts","Revenues, net",524143,12/31/22,03/22/23,2,"Ernst & Young LLP",,,,Iselin,NJ,"NEW JERSEY","US Mid Atlantic",S-1/A,2024-02-07,Yes,"AGILE THERAPEUTICS INC",1261249,,"500 COLLEGE ROAD EAST","SUITE 310",PRINCETON,NJ,"NEW JERSEY","US Mid Atlantic",,,"=""2834""","Pharmaceutical Preparations",325412,"Pharmaceutical Preparation Manufacturing",34,0,12/31/22,"9,754,213",12/31/22,"10,884,000","-25,412,000",,"14,242,000"
23261,"Uncertain tax positions","Uncertain Tax Positions",496060,10/31/22,12/20/22,1,"PricewaterhouseCoopers LLP",,,,"San Jose",CA,CALIFORNIA,"US West",10-K,2022-12-21,,"AGILENT TECHNOLOGIES, INC.",1090872,"=""A""","5301 STEVENS CREEK BLVD",,"SANTA CLARA",CA,CALIFORNIA,"US West",,,"=""3826""","Laboratory Analytical Instruments",334515,"Instrument Manufacturing for Measuring and Testing Electricity and Electrical Signals",34,135,11/02/22,"40,045,408,256",10/31/22,"6,848,000,000","1,254,000,000","532,000,000","10,532,000,000"
26864,"Internal controls","Sufficiency of audit evidence",503557,12/31/22,03/07/23,4,"KPMG LLP",,,,Minneapolis,MN,MINNESOTA,"US Midwest",10-K,2023-03-07,,"AGILITI, INC. \DE",1749704,,"11095 VIKING DRIVE, SUITE 300",,"EDEN PRAIRIE",MN,MINNESOTA,"US Midwest",,,"=""7350""","Services-Miscellaneous Equipment Rental & Leasing",532490,"Other Commercial and Industrial Machinery and Equipment Rental and Leasing",34,16,12/31/22,"2,179,154,432",12/31/22,"1,121,292,000","30,212,000","-804,998,000","2,444,107,000"
26311,"Revenue from customer contracts","Estimating Medicare Advantage risk adjustment revenue",502568,12/31/22,03/01/23,2,"Ernst & Young LLP",,,,"Los Angeles",CA,CALIFORNIA,"US West",10-K,2023-03-01,,"agilon health, inc.",1831097,"=""AGL""","440 POLARIS PARKWAY","SUITE 550",WESTERVILLE,OH,OHIO,"US Midwest",,,"=""8090""","Services-Misc Health & Allied Services, NEC",541511,"Custom Computer Programming Services",34,16,12/31/22,"6,655,894,016",12/31/22,"2,708,211,000","-106,553,000","932,000,000","1,697,468,000"
26312,"Insurance contract liabilities","Valuation of incurred but not reported claims ",502568,12/31/22,03/01/23,2,"Ernst & Young LLP",,,,"Los Angeles",CA,CALIFORNIA,"US West",10-K,2023-03-01,,"agilon health, inc.",1831097,"=""AGL""","440 POLARIS PARKWAY","SUITE 550",WESTERVILLE,OH,OHIO,"US Midwest",,,"=""8090""","Services-Misc Health & Allied Services, NEC",541511,"Custom Computer Programming Services",34,16,12/31/22,"6,655,894,016",12/31/22,"2,708,211,000","-106,553,000","932,000,000","1,697,468,000"
30894,"Revenue from customer contracts","Estimating Medicare Advantage risk adjustment revenue",515772,12/31/22,03/01/23,2,"Ernst & Young LLP",,,,"Los Angeles",CA,CALIFORNIA,"US West",10-K/A,2023-08-08,,"agilon health, inc.",1831097,"=""AGL""","440 POLARIS PARKWAY","SUITE 550",WESTERVILLE,OH,OHIO,"US Midwest",,,"=""8090""","Services-Misc Health & Allied Services, NEC",541511,"Custom Computer Programming Services",34,16,12/31/22,"6,655,894,016",12/31/22,"2,708,211,000","-106,553,000","932,000,000","1,697,468,000"
30895,"Insurance contract liabilities","Valuation of incurred but not reported claims",515772,12/31/22,03/01/23,2,"Ernst & Young LLP",,,,"Los Angeles",CA,CALIFORNIA,"US West",10-K/A,2023-08-08,,"agilon health, inc.",1831097,"=""AGL""","440 POLARIS PARKWAY","SUITE 550",WESTERVILLE,OH,OHIO,"US Midwest",,,"=""8090""","Services-Misc Health & Allied Services, NEC",541511,"Custom Computer Programming Services",34,16,12/31/22,"6,655,894,016",12/31/22,"2,708,211,000","-106,553,000","932,000,000","1,697,468,000"
24927,"Discontinued operations","Accounting for the Sagard agreement",500705,12/31/22,02/23/23,1,"PricewaterhouseCoopers LLP",,,,Boston,MA,MASSACHUSETTS,"US New England",10-K,2023-02-23,,"AGIOS PHARMACEUTICALS, INC.",1439222,"=""AGIO""","88 SIDNEY STREET",,CAMBRIDGE,MA,MASSACHUSETTS,"US New England",,,"=""2834""","Pharmaceutical Preparations",325412,"Pharmaceutical Preparation Manufacturing",34,28,12/31/22,"1,545,515,008",12/31/22,"14,240,000","-231,801,000",,"1,238,718,000"
25829,"Depreciation and amortization","Agency securities and non-agency securities of high credit quality net premium amortization",501379,12/31/22,02/24/23,2,"Ernst & Young LLP",,,,Tysons,VA,VIRGINIA,"US Mid Atlantic",10-K,2023-02-27,,"AGNC Investment Corp.",1423689,"=""AGNC""","7373 WISCONSIN AVENUE, 22ND FLOOR",,BETHESDA,MD,MARYLAND,"US Mid Atlantic",,,"=""6798""","Real Estate Investment Trusts",525990,"Other Financial Vehicles",34,10,12/31/22,"5,947,109,888",12/31/22,"-1,116,000,000","-1,190,000,000","7,344,000,000","51,748,000,000"
28080,"Business combinations","Business combination",506384,12/31/22,03/24/23,2,"Ernst & Young LLP",192,"Ernst & Young LLP Chartered Accountants",1263,Toronto,A6,ONTARIO,Canada,40-F,2023-03-27,,"AGNICO EAGLE MINES LTD",2809,"=""AEM""","145 KING STREET EAST","SUITE 400",TORONTO,A6,ONTARIO,Canada,,,"=""1040""","Metal Mining",212221,"Gold Ore Mining",34,52,12/31/22,"23,731,630,080",12/31/22,"5,741,162,000","670,249,000","14,197,222,000","23,494,808,000"
28081,Goodwill,"Goodwill impairment assessment",506384,12/31/22,03/24/23,2,"Ernst & Young LLP",192,"Ernst & Young LLP Chartered Accountants",1263,Toronto,A6,ONTARIO,Canada,40-F,2023-03-27,,"AGNICO EAGLE MINES LTD",2809,"=""AEM""","145 KING STREET EAST","SUITE 400",TORONTO,A6,ONTARIO,Canada,,,"=""1040""","Metal Mining",212221,"Gold Ore Mining",34,52,12/31/22,"23,731,630,080",12/31/22,"5,741,162,000","670,249,000","14,197,222,000","23,494,808,000"
29480,Goodwill,"Goodwill impairment assessment of Easemob reporting unit",510015,12/31/22,04/26/23,1,"PricewaterhouseCoopers LLP",94,"PricewaterhouseCoopers Zhong Tian LLP",1424,Shanghai,F4,CHINA,Foreign,20-F,2023-04-26,,"Agora, Inc.",1802883,"=""API""","2804 MISSION COLLEGE BLVD,",,"SANTA CLARA",CA,CALIFORNIA,"US West",,,"=""7372""","Prepackaged Software",518210,"Data Processing, Hosting, and Related Services",34,4,12/29/22,"1,584,067,712",12/31/22,"160,670,000","-120,380,000","693,605,000","800,715,000"
29481,"Allowance for credit losses","Valuation of allowance for current expected credit losses – accounts receivable, net",510015,12/31/22,04/26/23,1,"PricewaterhouseCoopers LLP",94,"PricewaterhouseCoopers Zhong Tian LLP",1424,Shanghai,F4,CHINA,Foreign,20-F,2023-04-26,,"Agora, Inc.",1802883,"=""API""","2804 MISSION COLLEGE BLVD,",,"SANTA CLARA",CA,CALIFORNIA,"US West",,,"=""7372""","Prepackaged Software",518210,"Data Processing, Hosting, and Related Services",34,4,12/29/22,"1,584,067,712",12/31/22,"160,670,000","-120,380,000","693,605,000","800,715,000"
27139,"Other intangible assets","Indefinite-Lived Intangible Assets — Refer to Notes 2 and 7 to the financial statements",504407,12/31/22,03/10/23,3,"Deloitte & Touche LLP",,,,Philadelphia,PA,PENNSYLVANIA,"US Mid Atlantic",10-K,2023-03-10,,"AgroFresh Solutions, Inc.",1592016,,"100 S. INDEPENDENCE MALL WEST",,PHILADELPHIA,PA,PENNSYLVANIA,"US Mid Atlantic",,,"=""2870""","Agricultural Chemicals",423820,"Farm and Garden Machinery and Equipment Merchant Wholesalers",34,3,12/31/22,"159,005,280",12/31/22,"161,937,000","-33,357,000","-161,275,000","697,710,000"
29398,"Revenue from customer contracts","Revenue recognition: Estimate of variable renewal commissions for long-term life insurance products and impact on revenue recognized — Refer to Note 2(q) to the financial statements",509797,12/31/22,04/25/23,3,"Deloitte & Touche LLP",499,"Deloitte Touche Tohmatsu Certified Public Accountants LLP",1113,Shenzhen,F4,CHINA,Foreign,20-F,2023-04-25,,"AIFU Inc.",1413855,"=""AIFU""","60/F PEARL RIVER TOWER","NO.15 WEST ZHUJIANG ROAD TIANHE DISTRICT",GUANGZHOU,F4,CHINA,Foreign,,,"=""6411""","Insurance Agents, Brokers, and Service",524126,"Direct Property and Casualty Insurance Carriers",34,7,12/29/22,"411,489,344",12/31/22,"400,134,000","14,424,000","217,703,000","444,426,000"
30052,"Revenue from customer contracts","Revenue recognition: Estimate of variable renewal commissions for long-term life insurance products and impact on revenue recognized — Refer to Note 2(q) to the financial statements   ",512327,12/31/22,04/25/23,3,"Deloitte & Touche LLP",499,"Deloitte Touche Tohmatsu Certified Public Accountants LLP",1113,Shenzhen,F4,CHINA,Foreign,20-F/A,2023-05-22,,"AIFU Inc.",1413855,"=""AIFU""","60/F PEARL RIVER TOWER","NO.15 WEST ZHUJIANG ROAD TIANHE DISTRICT",GUANGZHOU,F4,CHINA,Foreign,,,"=""6411""","Insurance Agents, Brokers, and Service",524126,"Direct Property and Casualty Insurance Carriers",34,7,12/29/22,"411,489,344",12/31/22,"400,134,000","14,424,000","217,703,000","444,426,000"
25654,"Other investments","Impairment of mezzanine investment",501563,12/31/22,02/27/23,2,"Ernst & Young LLP",,,,Denver,CO,COLORADO,"US West",10-K,2023-02-27,,"Aimco OP L.P.",1820878,,"4582 S ULSTER STREET, SUITE 1450",,DENVER,CO,COLORADO,"US West",,,"=""6500""","Real Estate",531110,"Lessors of Residential Buildings and Dwellings",34,,,,12/31/22,"190,344,000","79,657,000",,"2,181,223,000"
24246,Leases,"Assessment of the carrying value of flight equipment subject to operating leases
",499709,12/31/22,02/16/23,4,"KPMG LLP",,,,Irvine,CA,CALIFORNIA,"US West",10-K,2023-02-16,,"AIR LEASE CORP",1487712,"=""AL""","2000 AVENUE OF THE STARS","SUITE 1000N","LOS ANGELES",CA,CALIFORNIA,"US West",,,"=""7359""","Equipment Rental and Leasing, NEC",532411,"Commercial Air, Rail, and Water Transportation Equipment Rental and Leasing",34,38,12/31/22,"4,260,474,368",12/31/22,"2,317,302,000","-97,024,000",,"28,396,705,000"
22989,"Revenue from customer contracts","Revenue Recognition – On-site Customer Contracts – Refer to Notes 1 and 4 to the Financial Statements
",494827,09/30/22,11/22/22,3,"Deloitte & Touche LLP",,,,Philadelphia,PA,PENNSYLVANIA,"US Mid Atlantic",10-K,2022-11-22,,"Air Products & Chemicals, Inc.",2969,"=""APD""","1940 AIR PRODUCTS BLVD.",,ALLENTOWN,PA,PENNSYLVANIA,"US Mid Atlantic",,,"=""2810""","Industrial Inorganic Chemicals",325120,"Industrial Gas Manufacturing",34,233,09/30/22,"51,628,519,424",09/30/22,"12,698,600,000","2,256,100,000","11,973,500,000","27,192,600,000"
23052,"Equity investments and joint ventures","Investments in Joint Ventures – Consolidation Accounting – Refer to Notes 1, 7, and 22 to the Financial Statements",494827,09/30/22,11/22/22,3,"Deloitte & Touche LLP",,,,Philadelphia,PA,PENNSYLVANIA,"US Mid Atlantic",10-K,2022-11-22,,"Air Products & Chemicals, Inc.",2969,"=""APD""","1940 AIR PRODUCTS BLVD.",,ALLENTOWN,PA,PENNSYLVANIA,"US Mid Atlantic",,,"=""2810""","Industrial Inorganic Chemicals",325120,"Industrial Gas Manufacturing",34,233,09/30/22,"51,628,519,424",09/30/22,"12,698,600,000","2,256,100,000","11,973,500,000","27,192,600,000"
21627,"Other investments","Redeemable non-controlling interest – valuation of Contrail Aviation Support, LLC — Refer to Notes 1 and 4 to the financial statements",488975,03/31/22,06/28/22,3,"Deloitte & Touche LLP",,,,Minneapolis,MN,MINNESOTA,"US Midwest",10-K,2022-06-28,,"AIR T INC",353184,"=""AIRT""","11020 DAVID TAYLOR DRIVE","SUITE 305",CHARLOTTE,NC,"NORTH CAROLINA","US Southeast",,,"=""4513""","Air Courier Services",492110,Couriers,34,23,03/31/22,"65,211,008",03/31/22,"177,077,000","10,928,000","11,988,000","207,599,000"
26479,"Other debt","Stock Warrant Obligations - Fair Value Measurements - Level 3 Liabilities - Refer to Note C to the Financial Statements",502691,12/31/22,03/01/23,3,"Deloitte & Touche LLP",,,,Cincinnati,OH,OHIO,"US Midwest",10-K,2023-03-01,,"Air Transport Services Group, Inc.",894081,"=""ATSG""","145 HUNTER DR",,WILMINGTON,OH,OHIO,"US Midwest",,,"=""4513""","Air Courier Services",492110,Couriers,34,26,12/31/22,"1,879,075,200",12/31/22,"2,045,469,000","198,581,000","919,864,000","3,589,893,000"
24342,"Uncertain tax positions","Uncertain Tax Positions",499921,12/31/22,02/17/23,1,"PricewaterhouseCoopers LLP",,,,"San Francisco",CA,CALIFORNIA,"US West",10-K,2023-02-17,,"Airbnb, Inc.",1559720,"=""ABNB""","888 BRANNAN ST.",,"SAN FRANCISCO",CA,CALIFORNIA,"US West",,,"=""7340""","Services-To Dwellings & Other Buildings",511210,"Software Publishers",34,86,12/31/22,"34,884,001,792",12/31/22,"8,399,000,000","1,893,000,000","4,876,000,000","16,038,000,000"
20720,Leases,"Recoverability assessment and Impairment of flight equipment held for lease
",485556,02/28/22,04/28/22,2,"Ernst & Young LLP",,,,Stamford,CT,CONNECTICUT,"US New England",10-K,2022-04-28,,"Aircastle LTD",1362988,"=""AYR""","C/O AIRCASTLE ADVISOR LLC","201 TRESSER BLVD, SUITE 400",STAMFORD,CT,CONNECTICUT,"US New England",,,"=""7359""","Equipment Rental and Leasing, NEC",532411,"Commercial Air, Rail, and Water Transportation Equipment Rental and Leasing",34,,,,02/28/22,"769,787,000","-278,209,000","1,829,699,000","7,093,266,000"
20721,"Other income taxes","Accounting for Income Tax
",485556,02/28/22,04/28/22,2,"Ernst & Young LLP",,,,Stamford,CT,CONNECTICUT,"US New England",10-K,2022-04-28,,"Aircastle LTD",1362988,"=""AYR""","C/O AIRCASTLE ADVISOR LLC","201 TRESSER BLVD, SUITE 400",STAMFORD,CT,CONNECTICUT,"US New England",,,"=""7359""","Equipment Rental and Leasing, NEC",532411,"Commercial Air, Rail, and Water Transportation Equipment Rental and Leasing",34,,,,02/28/22,"769,787,000","-278,209,000","1,829,699,000","7,093,266,000"
26023,"Business combinations","Valuation of Customer-Related Intangible Assets and Completed Technologies Intangible Assets - Acquisition of Linode Limited Liability Company
",501831,12/31/22,02/28/23,1,"PricewaterhouseCoopers LLP",,,,Boston,MA,MASSACHUSETTS,"US New England",10-K,2023-02-28,,"AKAMAI TECHNOLOGIES INC",1086222,"=""AKAM""","145 BROADWAY",,CAMBRIDGE,MA,MASSACHUSETTS,"US New England",,,"=""7389""","Business Services, NEC",334119,"Other Computer Peripheral Equipment Manufacturing",34,84,12/31/22,"13,192,512,512",12/31/22,"3,616,654,000","523,672,000","1,154,633,000","8,303,400,000"
27110,"Sales return and allowances","Revenue recognition - Payor Mix Impact on Measuring Variable Consideration, specifically payor rebates",504496,12/31/22,03/10/23,2,"Ernst & Young LLP",,,,Boston,MA,MASSACHUSETTS,"US New England",10-K,2023-03-10,,"Akebia Therapeutics, Inc.",1517022,"=""AKBA""","245 FIRST STREET",,CAMBRIDGE,MA,MASSACHUSETTS,"US New England",,,"=""2834""","Pharmaceutical Preparations",325412,"Pharmaceutical Preparation Manufacturing",34,1,12/31/22,"106,798,712",12/31/22,"292,484,000","-94,226,000","-125,898,000","356,054,000"
31074,"Sales return and allowances","Revenue recognition - Payor Mix Impact on Measuring Variable Consideration, specifically payor rebates",516402,12/31/22,03/10/23,2,"Ernst & Young LLP",,,,Boston,MA,MASSACHUSETTS,"US New England",10-K/A,2023-08-28,,"Akebia Therapeutics, Inc.",1517022,"=""AKBA""","245 FIRST STREET",,CAMBRIDGE,MA,MASSACHUSETTS,"US New England",,,"=""2834""","Pharmaceutical Preparations",325412,"Pharmaceutical Preparation Manufacturing",34,1,12/31/22,"106,798,712",12/31/22,"292,484,000","-94,226,000","-125,898,000","356,054,000"
27651,"Research and development expenses","Accrued Research and Development Expenses & Prepaid Research and Development Expenses — Refer to Note 2 to the financial statements ",505454,12/31/22,03/17/23,3,"Deloitte & Touche LLP",,,,Morristown,NJ,"NEW JERSEY","US Mid Atlantic",10-K,2023-03-17,,"Akero Therapeutics, Inc.",1744659,"=""AKRO""","601 GATEWAY BOULEVARD, SUITE 350",,"SOUTH SAN FRANCISCO",CA,CALIFORNIA,"US West",,,"=""2834""","Pharmaceutical Preparations",325412,"Pharmaceutical Preparation Manufacturing",34,55,12/31/22,"2,568,213,248",12/31/22,,"-112,033,000",,"356,570,000"
24265,"Regulatory assets and liabilities","Impact of Rate Regulation on the Financial Statements – Refer to Note 1 (Summary of Significant Accounting Policies – Regulatory Assets and Liabilities) and Note 2 (Regulatory Matters – Alabama Power) to the financial statements",499598,12/31/22,02/15/23,3,"Deloitte & Touche LLP",,,,Birmingham,AL,ALABAMA,"US Southeast",10-K,2023-02-16,,"ALABAMA POWER CO",3153,,"600 N 18TH ST","P O BOX 2641",BIRMINGHAM,AL,ALABAMA,"US Southeast",92122,"SOUTHERN CO","=""4911""","Electric Services",221122,"Electric Power Distribution",34,,,,12/31/22,"7,817,000,000","1,351,000,000",,"34,970,000,000"
25032,Inventory,"Sufficiency of evidence over the existence of inventory",500848,12/31/22,02/23/23,4,"KPMG LLP",,,,"San Antonio",TX,TEXAS,"US Southwest",10-K,2023-02-23,,"ALAMO GROUP INC",897077,"=""ALG""","1627 E WALNUT",,SEGUIN,TX,TEXAS,"US Southwest",,,"=""3523""","Farm Machinery and Equipment",333111,"Farm Machinery and Equipment Manufacturing",34,142,12/31/22,"1,687,006,848",12/31/22,"1,513,616,000","101,928,000","418,161,000","1,308,508,000"
25406,"Property, plant and equipment","Evaluation of the recoverable amount of the Young-Davidson cash generating unit",501345,12/31/22,02/22/23,4,"KPMG LLP",187,"KPMG LLP Chartered Accountants",85,Toronto,A6,ONTARIO,Canada,6-K,2023-02-24,,"ALAMOS GOLD INC",1178819,"=""AGI""","181 BAY STREET","SUITE 3910",TORONTO,A6,ONTARIO,Canada,,,"=""1040""","Metal Mining",212221,"Gold Ore Mining",34,10,12/31/22,"3,981,383,680",12/31/22,"821,200,000","37,100,000",,"3,674,200,000"
28203,"Property, plant and equipment","Evaluation of the recoverable amount of the Young-Davidson cash generating unit",506679,12/31/22,02/22/23,4,"KPMG LLP",187,"KPMG LLP Chartered Accountants",85,Toronto,A6,ONTARIO,Canada,40-F,2023-03-29,,"ALAMOS GOLD INC",1178819,"=""AGI""","181 BAY STREET","SUITE 3910",TORONTO,A6,ONTARIO,Canada,,,"=""1040""","Metal Mining",212221,"Gold Ore Mining",34,10,12/31/22,"3,981,383,680",12/31/22,"821,200,000","37,100,000",,"3,674,200,000"
25324,"Revenue from customer contracts","Revenue recognition",501060,12/31/22,02/24/23,1,"PricewaterhouseCoopers LLP",,,,Washington,DC,"DISTRICT OF COLUMBIA","US Mid Atlantic",10-K,2023-02-24,,"Alarm.com Holdings, Inc.",1459200,"=""ALRM""","8281 GREENSBORO DRIVE","SUITE 100",TYSONS,VA,VIRGINIA,"US Mid Atlantic",,,"=""7372""","Prepackaged Software",541511,"Custom Computer Programming Services",34,49,12/31/22,"2,446,919,936",12/31/22,"842,559,000","56,338,000","392,206,000","1,329,375,000"
23924,"Revenue from customer contracts","Assessment of Mileage Plan model
",499299,12/31/22,02/13/23,4,"KPMG LLP",,,,Seattle,WA,WASHINGTON,"US West",10-K,2023-02-13,,"ALASKA AIR GROUP, INC.",766421,"=""ALK""","19300 INTERNATIONAL BOULEVARD",,SEATTLE,WA,WASHINGTON,"US West",,,"=""4512""","Air Transportation, Scheduled",481111,"Scheduled Passenger Air Transportation",34,43,12/31/22,"5,476,271,104",12/31/22,"9,646,000,000","58,000,000","1,778,000,000","14,186,000,000"
25446,"Revenue from customer contracts","Evaluation of estimated total contract costs at completion for Albany Engineered Composites revenue recognition for certain firm-fixed-price contracts",501163,12/31/22,02/24/23,4,"KPMG LLP",,,,Albany,NY,"NEW YORK","US Mid Atlantic",10-K,2023-02-24,,"ALBANY INTERNATIONAL CORP /DE/",819793,"=""AIN""","216 AIRPORT DRIVE",,ROCHESTER,NH,"NEW HAMPSHIRE","US New England",,,"=""2221""","Broadwoven Fabric Mills, Manmade Fiber and Silk",313210,"Broadwoven Fabric Mills",34,99,12/31/22,"3,067,222,784",12/31/22,"1,034,887,000","95,762,000","651,021,000","1,642,255,000"
24043,Goodwill,"Goodwill Impairment Assessment – Refining Solutions Reporting Unit",499503,12/31/22,02/15/23,1,"PricewaterhouseCoopers LLP",,,,Charlotte,NC,"NORTH CAROLINA","US Southeast",10-K,2023-02-15,,"ALBEMARLE CORP",915913,"=""ALB""","4250 CONGRESS STREET","SUITE 900",CHARLOTTE,NC,"NORTH CAROLINA","US Southeast",,,"=""2821""","Plastics Material and Synthetic Resins, and Nonvulcanizable Elastomers",325211,"Plastics Material and Resin Manufacturing",34,217,12/31/22,"25,409,052,672",12/31/22,"3,780,515,000","2,210,537,000","1,236,234,000","2,969,582,000"
20583,"Other contingent liabilities","Self-Insurance Liabilities—Refer to Note 1 to the financial statements",484990,02/26/22,04/26/22,3,"Deloitte & Touche LLP",,,,Boise,ID,IDAHO,"US West",10-K,2022-04-26,,"Albertsons Companies, Inc.",1646972,"=""ACI""","250 PARKCENTER BLVD.",,BOISE,ID,IDAHO,"US West",,,"=""5411""","Grocery Stores",445110,"Supermarkets and Other Grocery (except Convenience) Stores",34,29,02/28/22,"14,082,893,824",02/26/22,"71,887,000,000","1,619,600,000","817,100,000","28,123,000,000"
24849,"Pension and other post-employment benefits","U.S. Pension Annuitizations",500640,12/31/22,02/23/23,1,"PricewaterhouseCoopers LLP",,,,Pittsburgh,PA,PENNSYLVANIA,"US Mid Atlantic",10-K,2023-02-23,,"Alcoa Corp",1675149,"=""AA""","201 ISABELLA STREET","SUITE 500",PITTSBURGH,PA,PENNSYLVANIA,"US Mid Atlantic",,,"=""3334""","Primary Production of Aluminum",331312,"Primary Aluminum Production",34,45,12/31/22,"8,046,784,512",12/31/22,"12,451,000,000","-123,000,000",,"14,756,000,000"
25657,"Goodwill and intangible assets","Goodwill and Alcon Brand Name Impairment Assessments",501566,12/31/22,02/27/23,1,"PricewaterhouseCoopers LLP",,,,"Fort Worth",TX,TEXAS,"US Southwest",20-F,2023-02-27,,"ALCON INC",1167379,"=""ALC""","6201 SOUTH FREEWAY",,"FORT WORTH",TX,TEXAS,"US Southwest",,,"=""3851""","Ophthalmic Goods",339115,"Ophthalmic Goods Manufacturing",34,69,12/29/22,"33,860,110,336",12/31/22,"8,717,000,000","335,000,000","1,018,000,000","29,209,000,000"
25658,"Other intangible assets","In-Process Research and Development Intangible Asset Impairment Assessments",501566,12/31/22,02/27/23,1,"PricewaterhouseCoopers LLP",,,,"Fort Worth",TX,TEXAS,"US Southwest",20-F,2023-02-27,,"ALCON INC",1167379,"=""ALC""","6201 SOUTH FREEWAY",,"FORT WORTH",TX,TEXAS,"US Southwest",,,"=""3851""","Ophthalmic Goods",339115,"Ophthalmic Goods Manufacturing",34,69,12/29/22,"33,860,110,336",12/31/22,"8,717,000,000","335,000,000","1,018,000,000","29,209,000,000"
25659,"Business combinations","Valuation of Intangible Assets Acquired in the Aerie Pharmaceuticals, Inc. Business Combination",501566,12/31/22,02/27/23,1,"PricewaterhouseCoopers LLP",,,,"Fort Worth",TX,TEXAS,"US Southwest",20-F,2023-02-27,,"ALCON INC",1167379,"=""ALC""","6201 SOUTH FREEWAY",,"FORT WORTH",TX,TEXAS,"US Southwest",,,"=""3851""","Ophthalmic Goods",339115,"Ophthalmic Goods Manufacturing",34,69,12/29/22,"33,860,110,336",12/31/22,"8,717,000,000","335,000,000","1,018,000,000","29,209,000,000"
25949,"Revenue from customer contracts","Revenue Recognition",501987,12/31/22,02/28/23,2,"Ernst & Young LLP",,,,"San Mateo",CA,CALIFORNIA,"US West",10-K,2023-02-28,,"Alector, Inc.",1653087,"=""ALEC""","131 OYSTER POINT BLVD., SUITE 600",,"SOUTH SAN FRANCISCO",CA,CALIFORNIA,"US West",,,"=""2836""","Biological Products, Except Diagnostic Substances",325414,"Biological Product (except Diagnostic) Manufacturing",34,9,12/31/22,"765,127,488",12/31/22,"133,617,000","-133,310,000",,"787,648,000"
26573,"Discontinued operations","Assessment of Held for Sale and Discontinued Operations Classification — Refer to Note 2 – Significant Accounting Policies and Note 23 – Held for Sale and Discontinued Operations to the financial statements",502216,12/31/22,03/01/23,3,"Deloitte & Touche LLP",,,,Honolulu,HI,HAWAII,"US West",10-K,2023-03-01,,"Alexander & Baldwin, Inc.",1545654,"=""ALEX""","822 BISHOP STREET, P.O. BOX 3440",,HONOLULU,HI,HAWAII,"US West",,,"=""6798""","Real Estate Investment Trusts",531312,"Nonresidential Property Managers",34,19,12/31/22,"1,357,924,992",12/31/22,"230,553,000","-50,657,000","1,035,000,000","1,787,300,000"
23891,"Real estate investments","Real Estate Impairment – Refer to Note 2 to the financial statements",499225,12/31/22,02/13/23,3,"Deloitte & Touche LLP",,,,"New York",NY,"NEW YORK","US Mid Atlantic",10-K,2023-02-13,,"ALEXANDERS INC",3499,"=""ALX""","210 ROUTE 4 EAST",,PARAMUS,NJ,"NEW JERSEY","US Mid Atlantic",,,"=""6798""","Real Estate Investment Trusts",525990,"Other Financial Vehicles",34,220,12/31/22,"1,123,910,272",12/31/22,"205,814,000","57,632,000",,"1,397,776,000"
23522,"Business combinations","Recognition of acquired real estate – Purchase price accounting",498255,12/31/22,01/30/23,2,"Ernst & Young LLP",,,,"Los Angeles",CA,CALIFORNIA,"US West",10-K,2023-01-30,,"ALEXANDRIA REAL ESTATE EQUITIES, INC.",1035443,"=""ARE""","26 NORTH EUCLID AVENUE",,PASADENA,CA,CALIFORNIA,"US West",,,"=""6798""","Real Estate Investment Trusts",525990,"Other Financial Vehicles",34,146,12/31/22,"24,872,919,040",12/31/22,"2,588,962,000","521,660,000",,"35,523,399,000"
21484,"Business combinations","Merger transaction – Refer to Note 4 to the financial statements",488426,03/31/22,06/14/22,3,"Deloitte & Touche LLP",468,"Deloitte LLP",1208,Toronto,A6,ONTARIO,Canada,6-K,2022-06-15,,"Algoma Steel Group Inc.",1860805,"=""ASTL""","105 WEST STREET",,"SAULT STE. MARIE",A6,ONTARIO,Canada,,,"=""3312""","Steel Works, Blast Furnaces (Including Coke Ovens), and Rolling Mills",331111,"Iron and Steel Mills",34,11,03/31/22,"1,664,525,056",03/31/22,"3,047,100,000","686,700,000","1,266,100,000","2,156,500,000"
21485,"Derivatives and hedging","Derivative financial instruments — Refer to Notes 3 and 21 to the financial statements",488426,03/31/22,06/14/22,3,"Deloitte & Touche LLP",468,"Deloitte LLP",1208,Toronto,A6,ONTARIO,Canada,6-K,2022-06-15,,"Algoma Steel Group Inc.",1860805,"=""ASTL""","105 WEST STREET",,"SAULT STE. MARIE",A6,ONTARIO,Canada,,,"=""3312""","Steel Works, Blast Furnaces (Including Coke Ovens), and Rolling Mills",331111,"Iron and Steel Mills",34,11,03/31/22,"1,664,525,056",03/31/22,"3,047,100,000","686,700,000","1,266,100,000","2,156,500,000"
21522,"Business combinations","Merger transaction – Refer to Note 4 to the financial statements",488546,03/31/22,06/14/22,3,"Deloitte & Touche LLP",468,"Deloitte LLP",1208,Toronto,A6,ONTARIO,Canada,20-F,2022-06-17,,"Algoma Steel Group Inc.",1860805,"=""ASTL""","105 WEST STREET",,"SAULT STE. MARIE",A6,ONTARIO,Canada,,,"=""3312""","Steel Works, Blast Furnaces (Including Coke Ovens), and Rolling Mills",331111,"Iron and Steel Mills",34,11,03/31/22,"1,664,525,056",03/31/22,"3,047,100,000","686,700,000","1,266,100,000","2,156,500,000"
21523,"Derivatives and hedging","Derivative financial instruments — Refer to Notes 3 and 21 to the financial statements",488546,03/31/22,06/14/22,3,"Deloitte & Touche LLP",468,"Deloitte LLP",1208,Toronto,A6,ONTARIO,Canada,20-F,2022-06-17,,"Algoma Steel Group Inc.",1860805,"=""ASTL""","105 WEST STREET",,"SAULT STE. MARIE",A6,ONTARIO,Canada,,,"=""3312""","Steel Works, Blast Furnaces (Including Coke Ovens), and Rolling Mills",331111,"Iron and Steel Mills",34,11,03/31/22,"1,664,525,056",03/31/22,"3,047,100,000","686,700,000","1,266,100,000","2,156,500,000"
21682,"Business combinations","Merger transaction – Refer to Note 4 to the financial statements",489088,03/31/22,06/14/22,3,"Deloitte & Touche LLP",468,"Deloitte LLP",1208,Toronto,A6,ONTARIO,Canada,"POS AM",2022-06-30,,"Algoma Steel Group Inc.",1860805,"=""ASTL""","105 WEST STREET",,"SAULT STE. MARIE",A6,ONTARIO,Canada,,,"=""3312""","Steel Works, Blast Furnaces (Including Coke Ovens), and Rolling Mills",331111,"Iron and Steel Mills",34,11,03/31/22,"1,664,525,056",03/31/22,"3,047,100,000","686,700,000","1,266,100,000","2,156,500,000"
21683,"Derivatives and hedging","Derivative financial instruments – Refer to Notes 3 and 21 to the financial statements",489088,03/31/22,06/14/22,3,"Deloitte & Touche LLP",468,"Deloitte LLP",1208,Toronto,A6,ONTARIO,Canada,"POS AM",2022-06-30,,"Algoma Steel Group Inc.",1860805,"=""ASTL""","105 WEST STREET",,"SAULT STE. MARIE",A6,ONTARIO,Canada,,,"=""3312""","Steel Works, Blast Furnaces (Including Coke Ovens), and Rolling Mills",331111,"Iron and Steel Mills",34,11,03/31/22,"1,664,525,056",03/31/22,"3,047,100,000","686,700,000","1,266,100,000","2,156,500,000"
27633,"Regulatory assets and liabilities","Regulatory assets and liabilities—Recovery of costs through rate regulation",505428,12/31/22,03/17/23,2,"Ernst & Young LLP",192,"Ernst & Young LLP Chartered Accountants",1263,Toronto,A6,ONTARIO,Canada,40-F,2023-03-17,,"ALGONQUIN POWER & UTILITIES CORP.",1174169,"=""AQN""","354 DAVIS ROAD",,OAKVILLE,A6,ONTARIO,Canada,,,"=""4911""","Electric Services",221111,"Hydroelectric Power Generation",34,7,12/29/22,"4,414,778,880",12/31/22,"2,765,155,000","-211,989,000","4,121,761,000","17,627,613,000"
27634,"Long-lived assets","Impairment of Long-lived Assets",505428,12/31/22,03/17/23,2,"Ernst & Young LLP",192,"Ernst & Young LLP Chartered Accountants",1263,Toronto,A6,ONTARIO,Canada,40-F,2023-03-17,,"ALGONQUIN POWER & UTILITIES CORP.",1174169,"=""AQN""","354 DAVIS ROAD",,OAKVILLE,A6,ONTARIO,Canada,,,"=""4911""","Electric Services",221111,"Hydroelectric Power Generation",34,7,12/29/22,"4,414,778,880",12/31/22,"2,765,155,000","-211,989,000","4,121,761,000","17,627,613,000"
27635,"Equity investments and joint ventures","Impairment of long-term investment in Texas Coastal Wind Facilities",505428,12/31/22,03/17/23,2,"Ernst & Young LLP",192,"Ernst & Young LLP Chartered Accountants",1263,Toronto,A6,ONTARIO,Canada,40-F,2023-03-17,,"ALGONQUIN POWER & UTILITIES CORP.",1174169,"=""AQN""","354 DAVIS ROAD",,OAKVILLE,A6,ONTARIO,Canada,,,"=""4911""","Electric Services",221111,"Hydroelectric Power Generation",34,7,12/29/22,"4,414,778,880",12/31/22,"2,765,155,000","-211,989,000","4,121,761,000","17,627,613,000"
27774,"Regulatory assets and liabilities","Regulatory assets and liabilities—Recovery of costs through rate regulation",505681,12/31/22,03/17/23,2,"Ernst & Young LLP",192,"Ernst & Young LLP Chartered Accountants",1263,Toronto,A6,ONTARIO,Canada,40-F/A,2023-03-21,,"ALGONQUIN POWER & UTILITIES CORP.",1174169,"=""AQN""","354 DAVIS ROAD",,OAKVILLE,A6,ONTARIO,Canada,,,"=""4911""","Electric Services",221111,"Hydroelectric Power Generation",34,7,12/29/22,"4,414,778,880",12/31/22,"2,765,155,000","-211,989,000","4,121,761,000","17,627,613,000"
27775,"Long-lived assets","Impairment of Long-lived Assets",505681,12/31/22,03/17/23,2,"Ernst & Young LLP",192,"Ernst & Young LLP Chartered Accountants",1263,Toronto,A6,ONTARIO,Canada,40-F/A,2023-03-21,,"ALGONQUIN POWER & UTILITIES CORP.",1174169,"=""AQN""","354 DAVIS ROAD",,OAKVILLE,A6,ONTARIO,Canada,,,"=""4911""","Electric Services",221111,"Hydroelectric Power Generation",34,7,12/29/22,"4,414,778,880",12/31/22,"2,765,155,000","-211,989,000","4,121,761,000","17,627,613,000"
27776,"Equity investments and joint ventures","Impairment of long-term investment in Texas Coastal Wind Facilities",505681,12/31/22,03/17/23,2,"Ernst & Young LLP",192,"Ernst & Young LLP Chartered Accountants",1263,Toronto,A6,ONTARIO,Canada,40-F/A,2023-03-21,,"ALGONQUIN POWER & UTILITIES CORP.",1174169,"=""AQN""","354 DAVIS ROAD",,OAKVILLE,A6,ONTARIO,Canada,,,"=""4911""","Electric Services",221111,"Hydroelectric Power Generation",34,7,12/29/22,"4,414,778,880",12/31/22,"2,765,155,000","-211,989,000","4,121,761,000","17,627,613,000"
30045,"Regulatory assets and liabilities","Regulatory assets and liabilities—Recovery of costs through rate regulation",512270,12/31/22,03/17/23,2,"Ernst & Young LLP",192,"Ernst & Young LLP Chartered Accountants",1263,Toronto,A6,ONTARIO,Canada,6-K,2023-05-19,,"ALGONQUIN POWER & UTILITIES CORP.",1174169,"=""AQN""","354 DAVIS ROAD",,OAKVILLE,A6,ONTARIO,Canada,,,"=""4911""","Electric Services",221111,"Hydroelectric Power Generation",34,7,12/29/22,"4,414,778,880",12/31/22,"2,765,155,000","-211,989,000","4,121,761,000","17,627,613,000"
30046,"Long-lived assets","Impairment of Long-lived Assets",512270,12/31/22,03/17/23,2,"Ernst & Young LLP",192,"Ernst & Young LLP Chartered Accountants",1263,Toronto,A6,ONTARIO,Canada,6-K,2023-05-19,,"ALGONQUIN POWER & UTILITIES CORP.",1174169,"=""AQN""","354 DAVIS ROAD",,OAKVILLE,A6,ONTARIO,Canada,,,"=""4911""","Electric Services",221111,"Hydroelectric Power Generation",34,7,12/29/22,"4,414,778,880",12/31/22,"2,765,155,000","-211,989,000","4,121,761,000","17,627,613,000"
30047,"Equity investments and joint ventures","Impairment of long-term investment in Texas Coastal Wind Facilities",512270,12/31/22,03/17/23,2,"Ernst & Young LLP",192,"Ernst & Young LLP Chartered Accountants",1263,Toronto,A6,ONTARIO,Canada,6-K,2023-05-19,,"ALGONQUIN POWER & UTILITIES CORP.",1174169,"=""AQN""","354 DAVIS ROAD",,OAKVILLE,A6,ONTARIO,Canada,,,"=""4911""","Electric Services",221111,"Hydroelectric Power Generation",34,7,12/29/22,"4,414,778,880",12/31/22,"2,765,155,000","-211,989,000","4,121,761,000","17,627,613,000"
21869,Goodwill,"Impairment Assessment on Goodwill Relating to Reporting Units under the Digital Media and Entertainment Segment",490023,03/31/22,07/26/22,1,"PricewaterhouseCoopers LLP",95,PricewaterhouseCoopers,1389,"Hong Kong",F4,CHINA,Foreign,20-F,2022-07-26,,"Alibaba Group Holding Ltd",1577552,"=""BABA""","26/F TOWER ONE","TIMES SQUARE, 1 MATHESON STREET","CAUSEWAY BAY",K3,"HONG KONG",Foreign,,,"=""7389""","Business Services, NEC",518210,"Data Processing, Hosting, and Related Services",33,117,03/29/22,"316,561,752,064",03/31/22,"134,487,000,000","9,814,000,000","99,214,000,000","267,307,000,000"
21870,"Other investments","Fair Value Determination Related to Investments in Privately Held Companies Accounted for Using the Measurement Alternative",490023,03/31/22,07/26/22,1,"PricewaterhouseCoopers LLP",95,PricewaterhouseCoopers,1389,"Hong Kong",F4,CHINA,Foreign,20-F,2022-07-26,,"Alibaba Group Holding Ltd",1577552,"=""BABA""","26/F TOWER ONE","TIMES SQUARE, 1 MATHESON STREET","CAUSEWAY BAY",K3,"HONG KONG",Foreign,,,"=""7389""","Business Services, NEC",518210,"Data Processing, Hosting, and Related Services",33,117,03/29/22,"316,561,752,064",03/31/22,"134,487,000,000","9,814,000,000","99,214,000,000","267,307,000,000"
26229,Goodwill,"Goodwill Impairment Assessment",502544,12/31/22,03/01/23,2,"Ernst & Young LLP",,,,Chicago,IL,ILLINOIS,"US Midwest",10-K,2023-03-01,,"Alight, Inc. / Delaware",1809104,"=""ALIT""","4 OVERLOOK POINT",,LINCOLNSHIRE,IL,ILLINOIS,"US Midwest",,,"=""7389""","Business Services, NEC",511210,"Software Publishers",34,8,12/31/22,"3,998,924,544",12/31/22,"2,207,000,000","-62,000,000","-3,112,000,000","11,235,000,000"
26230,"Other debt","Measurement of the Tax Receivable Agreement Liability",502544,12/31/22,03/01/23,2,"Ernst & Young LLP",,,,Chicago,IL,ILLINOIS,"US Midwest",10-K,2023-03-01,,"Alight, Inc. / Delaware",1809104,"=""ALIT""","4 OVERLOOK POINT",,LINCOLNSHIRE,IL,ILLINOIS,"US Midwest",,,"=""7389""","Business Services, NEC",511210,"Software Publishers",34,8,12/31/22,"3,998,924,544",12/31/22,"2,207,000,000","-62,000,000","-3,112,000,000","11,235,000,000"
29823,Goodwill,"Goodwill Impairment Assessment",511698,12/31/22,03/01/23,2,"Ernst & Young LLP",,,,Chicago,IL,ILLINOIS,"US Midwest","POS AM",2023-05-08,,"Alight, Inc. / Delaware",1809104,"=""ALIT""","4 OVERLOOK POINT",,LINCOLNSHIRE,IL,ILLINOIS,"US Midwest",,,"=""7389""","Business Services, NEC",511210,"Software Publishers",34,8,12/31/22,"3,998,924,544",12/31/22,"2,207,000,000","-62,000,000","-3,112,000,000","11,235,000,000"
29824,"Other debt","Measurement of the Tax Receivable Agreement Liability",511698,12/31/22,03/01/23,2,"Ernst & Young LLP",,,,Chicago,IL,ILLINOIS,"US Midwest","POS AM",2023-05-08,,"Alight, Inc. / Delaware",1809104,"=""ALIT""","4 OVERLOOK POINT",,LINCOLNSHIRE,IL,ILLINOIS,"US Midwest",,,"=""7389""","Business Services, NEC",511210,"Software Publishers",34,8,12/31/22,"3,998,924,544",12/31/22,"2,207,000,000","-62,000,000","-3,112,000,000","11,235,000,000"
30021,Goodwill,"Goodwill Impairment Assessment",512226,12/31/22,03/01/23,2,"Ernst & Young LLP",,,,Chicago,IL,ILLINOIS,"US Midwest","POS AM",2023-05-18,,"Alight, Inc. / Delaware",1809104,"=""ALIT""","4 OVERLOOK POINT",,LINCOLNSHIRE,IL,ILLINOIS,"US Midwest",,,"=""7389""","Business Services, NEC",511210,"Software Publishers",34,8,12/31/22,"3,998,924,544",12/31/22,"2,207,000,000","-62,000,000","-3,112,000,000","11,235,000,000"
30022,"Other debt","Measurement of the Tax Receivable Agreement Liability",512226,12/31/22,03/01/23,2,"Ernst & Young LLP",,,,Chicago,IL,ILLINOIS,"US Midwest","POS AM",2023-05-18,,"Alight, Inc. / Delaware",1809104,"=""ALIT""","4 OVERLOOK POINT",,LINCOLNSHIRE,IL,ILLINOIS,"US Midwest",,,"=""7389""","Business Services, NEC",511210,"Software Publishers",34,8,12/31/22,"3,998,924,544",12/31/22,"2,207,000,000","-62,000,000","-3,112,000,000","11,235,000,000"
25559,"Revenue from customer contracts","Revenue Recognition – Determination of Standalone Selling Price of Distinct Performance Obligations in Clear Aligner Contracts
",501545,12/31/22,02/27/23,1,"PricewaterhouseCoopers LLP",,,,"San Jose",CA,CALIFORNIA,"US West",10-K,2023-02-27,,"ALIGN TECHNOLOGY INC",1097149,"=""ALGN""","410 NORTH SCOTTSDALE ROAD, SUITE 1300",,TEMPE,AZ,ARIZONA,"US Southwest",,,"=""3842""","Orthopedic, Prosthetic, and Surgical Appliances and Supplies",339114,"Dental Equipment and Supplies Manufacturing",34,211,12/31/22,"16,295,610,368",12/31/22,"3,734,635,000","361,573,000","3,098,087,000","5,947,947,000"
25946,"Insurance contract liabilities","Medical expenses payable – Incurred but not paid claims - Refer to Notes 2 and 7 to the financial statements",501968,12/31/22,02/28/23,3,"Deloitte & Touche LLP",,,,"Los Angeles",CA,CALIFORNIA,"US West",10-K,2023-02-28,,"Alignment Healthcare, Inc.",1832466,"=""ALHC""","1100 W. TOWN AND COUNTRY ROAD","SUITE 1600",ORANGE,CA,CALIFORNIA,"US West",,,"=""6324""","Hospital and Medical Service Plans",524114,"Direct Health and Medical Insurance Carriers",34,12,12/31/22,"2,202,413,056",12/31/22,"1,434,159,000","-149,547,000","197,838,000","633,863,000"
24169,"Sales return and allowances","Rebate Accruals – Medicaid Drug Rebate Program",499715,12/31/22,02/16/23,1,"PricewaterhouseCoopers LLP",,,,Boston,MA,MASSACHUSETTS,"US New England",10-K,2023-02-16,,"Alkermes plc.",1520262,"=""ALKS""","CONNAUGHT HOUSE","1 BURLINGTON ROAD","DUBLIN 4",L2,IRELAND,Foreign,,,"=""2834""","Pharmaceutical Preparations",325412,"Pharmaceutical Preparation Manufacturing",34,26,12/31/22,"3,992,717,568",12/31/22,"1,111,795,000","-158,267,000","913,200,000","1,963,978,000"
26755,"Research and development expenses","Accrued contract research and development expenses",503281,12/31/22,03/06/23,2,"Ernst & Young LLP",,,,"San Mateo",CA,CALIFORNIA,"US West",10-K,2023-03-06,,"Allakos Inc.",1564824,,"4757 EXECUTIVE DRIVE","SUITE  210","SAN DIEGO",CA,CALIFORNIA,"US West",,,"=""2834""","Pharmaceutical Preparations",325414,"Biological Product (except Diagnostic) Manufacturing",34,8,12/31/22,"718,958,528",12/31/22,,"-319,952,000",,"386,420,000"
25623,"Other contingent liabilities","Estimated Loss associated with Sunseeker Resort",501650,12/31/22,02/27/23,4,"KPMG LLP",,,,Dallas,TX,TEXAS,"US Southwest",10-K,2023-02-27,,"Allegiant Travel CO",1362468,"=""ALGT""","1201 N. TOWN CENTER DRIVE",,"LAS VEGAS",NV,NEVADA,"US West",,,"=""4512""","Air Transportation, Scheduled",561510,"Travel Agencies",34,68,12/31/22,"1,232,535,040",12/31/22,"2,301,829,000","2,493,000",,"4,511,297,000"
24593,"Business combinations","Acquisition of the Access Technologies business – Valuation of Customer Relationships",500235,12/31/22,02/22/23,1,"PricewaterhouseCoopers LLP",,,,Indianapolis,IN,INDIANA,"US Midwest",10-K,2023-02-22,,"Allegion plc",1579241,"=""ALLE""","UNIT NO. 233, THE CAPEL BUILDING","MARY'S ABBEY","DUBLIN 7",L2,IRELAND,Foreign,,,"=""7381""","Detective, Guard, and Armored Car Services",423610,"Electrical Apparatus and Equipment, Wiring Supplies, and Related Equipment Merchant  Wholesalers",34,105,12/31/22,"9,247,383,552",12/31/22,"3,271,900,000","458,000,000","-1,080,200,000","3,991,200,000"
24143,"Regulatory assets and liabilities","Accounting for the Effects of Regulatory Matters",499613,12/31/22,02/16/23,1,"PricewaterhouseCoopers LLP",,,,Minneapolis,MN,MINNESOTA,"US Midwest",10-K,2023-02-16,,"ALLETE INC",66756,"=""ALE""","30 W SUPERIOR ST",,DULUTH,MN,MINNESOTA,"US Midwest",,,"=""4931""","Electric and Other Services Combined",221122,"Electric Power Distribution",34,65,12/29/22,"3,736,672,000",12/31/22,"1,570,700,000","189,300,000","2,536,300,000","6,845,600,000"
23867,"Equity investments and joint ventures","Acquisition of CarVal Investors L.P. - Fair Value of Finite-Lived Intangible Assets and Contingent Consideration Payable",499090,12/31/22,02/10/23,1,"PricewaterhouseCoopers LLP",,,,Nashville,TN,TENNESSEE,"US Southeast",10-K,2023-02-10,,"ALLIANCEBERNSTEIN HOLDING L.P.",825313,"=""AB""","501 COMMERCE STREET",,NASHVILLE,TN,TENNESSEE,"US Southeast",1333986,"Equitable Holdings, Inc.","=""6282""","Investment Advice",523930,"Investment Advice",34,34,12/29/22,"3,449,779,968",12/31/22,"305,504,000","274,165,000",,"2,074,626,000"
23840,"Business combinations","Acquisition of CarVal Investors L.P. - Fair Value of Finite-Lived Intangible Assets and Contingent Consideration Payable",499070,12/31/22,02/10/23,1,"PricewaterhouseCoopers LLP",,,,Nashville,TN,TENNESSEE,"US Southeast",10-K,2023-02-10,,"ALLIANCEBERNSTEIN L.P.",1109448,,"501 COMMERCE STREET",,NASHVILLE,TN,TENNESSEE,"US Southeast",1333986,"Equitable Holdings, Inc.","=""6282""","Investment Advice",523930,"Investment Advice",34,,,,12/31/22,"4,036,384,000","831,813,000","924,895,000","11,138,931,000"
25218,"Regulatory assets and liabilities","Regulatory Assets and Regulatory Liabilities - Impact of rate regulation on the financial statements - Refer to Notes 1, 2, and 3 to the financial statements",501138,12/31/22,02/24/23,3,"Deloitte & Touche LLP",,,,Milwaukee,WI,WISCONSIN,"US Midwest",10-K,2023-02-24,,"ALLIANT ENERGY CORP",352541,"=""LNT""","4902 NORTH BILTMORE LANE","SUITE 1000",MADISON,WI,WISCONSIN,"US Midwest",,,"=""4931""","Electric and Other Services Combined",221122,"Electric Power Distribution",34,55,12/31/22,"13,865,161,728",12/31/22,"4,205,000,000","686,000,000",,"20,163,000,000"
26866,Inventory,"Inventories – Refer to Note 1 to the financial statements",503632,12/31/22,03/07/23,3,"Deloitte & Touche LLP",,,,Williamsville,NY,"NEW YORK","US Mid Atlantic",10-K,2023-03-07,,"ALLIENT INC",46129,"=""ALNT""","495 COMMERCE DRIVE, SUITE 3",,AMHERST,NY,"NEW YORK","US Mid Atlantic",,,"=""3825""","Instruments for Measuring and Testing of Electricity and Electrical Signals",334519,"Other Measuring and Controlling Device Manufacturing",34,35,12/31/22,"556,194,176",12/31/22,"502,988,000","17,389,000","-29,976,000","588,347,000"
24109,"Warranty liabilities","Product Warranty Liabilities",499579,12/31/22,02/16/23,1,"PricewaterhouseCoopers LLP",,,,Indianapolis,IN,INDIANA,"US Midwest",10-K,2023-02-16,,"Allison Transmission Holdings Inc",1411207,"=""ALSN""","ONE ALLISON WAY",,Indianapolis,IN,INDIANA,"US Midwest",,,"=""3714""","Motor Vehicle Parts and Accessories",336350,"Motor Vehicle Transmission and Power Train Parts Manufacturing",34,42,12/31/22,"3,818,417,664",12/31/22,"2,769,000,000","531,000,000","-2,079,000,000","4,671,000,000"
28113,"Revenue from customer contracts","Revenue Recognition",506449,12/31/22,03/28/23,2,"Ernst & Young LLP",222,"Kost Forer Gabbay & Kasierer",1281,"Tel Aviv",L3,ISRAEL,Foreign,20-F,2023-03-28,,"Allot Ltd.",1365767,"=""ALLT""","22 HANGAR STREET","NEVE NE'EMAN, INDUSTRIAL ZONE B",HOD-HASHARON,L3,ISRAEL,Foreign,,,"=""3576""","Computer Communications Equipment",541511,"Custom Computer Programming Services",34,3,12/29/22,"122,976,288",12/31/22,"122,737,000","-32,030,000","66,629,000","212,953,000"
24210,"Insurance contract liabilities","Reserve for Property and Casualty Insurance Claims and Claims Expense - Refer to Notes 2 and 9 to the Financial Statements",499678,12/31/22,02/16/23,3,"Deloitte & Touche LLP",,,,Chicago,IL,ILLINOIS,"US Midwest",10-K,2023-02-16,,"ALLSTATE CORP",899051,"=""ALL""","3100 SANDERS ROAD",,NORTHBROOK,IL,ILLINOIS,"US Midwest",,,"=""6331""","Fire, Marine, and Casualty Insurance",524126,"Direct Property and Casualty Insurance Carriers",34,136,12/31/22,"35,662,798,848",12/31/22,"51,412,000,000","-1,311,000,000","13,973,000,000","97,957,000,000"
25394,"Allowance for credit losses","Allowance for Loan Losses — Consumer Automotive Portfolio — Refer to Notes 1 and 9 to the financial statements",501306,12/31/22,02/24/23,3,"Deloitte & Touche LLP",,,,Detroit,MI,MICHIGAN,"US Midwest",10-K,2023-02-24,,"Ally Financial Inc.",40729,"=""ALLY""","ALLY DETROIT CENTER","500 WOODWARD AVE. FLOOR 10",DETROIT,MI,MICHIGAN,"US Midwest",,,"=""6022""","State Commercial Banks",522220,"Sales Financing",34,24,12/31/22,"7,318,480,384",12/31/22,"7,943,000,000","1,714,000,000",,"191,826,000,000"
30593,"Goodwill and intangible assets","Assessment of value in use of the groups of cash generating units",514311,12/31/22,07/03/23,4,"KPMG LLP",664,"KPMG SAS",5070,Medellin,F8,COLOMBIA,Foreign,20FR12B,2023-07-03,,"Almacenes Exito S.A.",1957146,"=""EXTOY""","CARRERA 48 # 32 B SUR 139.",,"ENVIGADO, ANTIOQUIA,",F8,COLOMBIA,Foreign,,,"=""5331""","Variety Stores",445110,"Supermarkets and Other Grocery (except Convenience) Stores",34,,,,12/31/22,"4,252,000,000","51,000,000","667,000,000","3,748,000,000"
30714,"Goodwill and intangible assets","Assessment of value in use of the groups of cash generating units",514896,12/31/22,07/03/23,4,"KPMG LLP",664,"KPMG SAS",5070,Medellin,F8,COLOMBIA,Foreign,20FR12B/A,2023-07-20,,"Almacenes Exito S.A.",1957146,"=""EXTOY""","CARRERA 48 # 32 B SUR 139.",,"ENVIGADO, ANTIOQUIA,",F8,COLOMBIA,Foreign,,,"=""5331""","Variety Stores",445110,"Supermarkets and Other Grocery (except Convenience) Stores",34,,,,12/31/22,"4,252,000,000","51,000,000","667,000,000","3,748,000,000"
24854,"Other liabilities and provisions","Liability Related to Sale of Future Royalties and Commercial Milestones",500650,12/31/22,02/23/23,1,"PricewaterhouseCoopers LLP",,,,Boston,MA,MASSACHUSETTS,"US New England",10-K,2023-02-23,,"ALNYLAM PHARMACEUTICALS, INC.",1178670,"=""ALNY""","675 WEST KENDALL STREET","HENRI A. TERMEER SQUARE",CAMBRIDGE,MA,MASSACHUSETTS,"US New England",,,"=""2834""","Pharmaceutical Preparations",325412,"Pharmaceutical Preparation Manufacturing",34,238,12/31/22,"29,450,776,576",12/31/22,"1,037,418,000","-1,131,156,000",,"3,546,359,000"
23606,"Other contingent liabilities","Loss Contingencies ",498574,12/31/22,02/02/23,2,"Ernst & Young LLP",,,,"San Jose",CA,CALIFORNIA,"US West",10-K,2023-02-03,,"Alphabet Inc.",1652044,"=""GOOGL""","1600 AMPHITHEATRE PARKWAY",,"MOUNTAIN VIEW",CA,CALIFORNIA,"US West",,,"=""7370""","Services-Computer Programming, Data Processing, Etc.",518112,"Web Search Portals",34,88,12/29/22,"528,311,844,864",12/31/22,"282,836,000,000","59,972,000,000","225,100,000,000","365,264,000,000"
25987,Inventory,"Valuation of Inventories - Refer to Note 1 to the Financial Statements",501908,12/31/22,02/28/23,3,"Deloitte & Touche LLP",,,,"San Diego",CA,CALIFORNIA,"US West",10-K,2023-02-28,,"Alphatec Holdings, Inc.",1350653,"=""ATEC""","1950 CAMINO VIA ROBLE",,CARLSBAD,CA,CALIFORNIA,"US West",,,"=""3841""","Surgical and Medical Instruments and Apparatus",339112,"Surgical and Medical Instrument Manufacturing",34,12,12/31/22,"1,317,004,032",12/31/22,"350,867,000","-152,149,000","-135,666,000","513,376,000"
27929,"Revenue from customer contracts","Accounting for Revenue under the AbbVie and Horizon Collaboration Agreements",505976,12/31/22,03/23/23,2,"Ernst & Young LLP",,,,Seattle,WA,WASHINGTON,"US West",10-K,2023-03-23,,"ALPINE IMMUNE SCIENCES, INC.",1626199,,"188 EAST BLAINE ST., SUITE 200",,SEATTLE,WA,WASHINGTON,"US West",,,"=""2834""","Pharmaceutical Preparations",325412,"Pharmaceutical Preparation Manufacturing",34,7,12/31/22,"337,985,568",12/31/22,"30,064,000","-57,762,000",,"286,686,000"
27033,"Revenue from customer contracts","Revenue Recognition— Refer to Notes 2 and 3 to the financial statements",504153,12/31/22,03/09/23,3,"Deloitte & Touche LLP",,,,Detroit,MI,MICHIGAN,"US Midwest",10-K,2023-03-09,,"ALTA EQUIPMENT GROUP INC.",1759824,"=""ALTG""","13211 MERRIMAN ROAD",,LIVONIA,MI,MICHIGAN,"US Midwest",,,"=""5084""","Industrial Machinery and Equipment",423830,"Industrial Machinery and Equipment Merchant Wholesalers",34,13,12/31/22,"424,642,080",12/31/22,"1,571,800,000","9,300,000","9,900,000","1,290,600,000"
26578,"Derivatives and hedging","Fair Value Measurement of Level 3 Derivatives",502886,12/31/22,03/01/23,2,"Ernst & Young LLP",192,"Ernst & Young LLP Chartered Accountants",1263,Calgary,A0,ALBERTA,Canada,40-F,2023-03-02,,"AltaGas Ltd.",1695519,,"1700, 355-4 AVENUE SW",,CALGARY,A0,ALBERTA,Canada,,,"=""1311""","Crude Petroleum and Natural Gas",211111,"Crude Petroleum and Natural Gas Extraction",34,,,,12/31/22,"10,397,000,000","386,000,000","1,540,000,000","17,687,000,000"
25462,"Revenue from customer contracts","Software Revenue Recognition",500955,12/31/22,02/24/23,2,"Ernst & Young LLP",,,,Detroit,MI,MICHIGAN,"US Midwest",10-K,2023-02-24,,"Altair Engineering Inc.",1701732,"=""ALTR""","1820 E. BIG BEAVER ROAD",,TROY,MI,MICHIGAN,"US Midwest",,,"=""7372""","Prepackaged Software",511210,"Software Publishers",34,45,12/31/22,"2,377,035,264",12/31/22,"572,221,000","-43,429,000","13,079,000","1,204,738,000"
25463,"Business combinations","Business Combination",500955,12/31/22,02/24/23,2,"Ernst & Young LLP",,,,Detroit,MI,MICHIGAN,"US Midwest",10-K,2023-02-24,,"Altair Engineering Inc.",1701732,"=""ALTR""","1820 E. BIG BEAVER ROAD",,TROY,MI,MICHIGAN,"US Midwest",,,"=""7372""","Prepackaged Software",511210,"Software Publishers",34,45,12/31/22,"2,377,035,264",12/31/22,"572,221,000","-43,429,000","13,079,000","1,204,738,000"
29934,"Other intangible assets","NTANGIBLE ASSETS – IMPAIRMENT ASSESSMENT – REFER TO NOTE 2 (SECTION DEVELOPMENT EXPENDITURES), NOTE 3 (SECTION INTANGIBLE ASSETS), AND NOTE 9 (INTANGIBLE ASSETS) TO THE FINANCIAL STATEMENTS",512106,12/31/22,05/16/23,3,"Deloitte & Touche LLP",395,"Deloitte AG",1235,Zurich,V8,SWITZERLAND,Foreign,20-F,2023-05-16,Yes,"Altamira Therapeutics Ltd.",1601936,"=""CYTOF""","CLARENDON HOUSE","2 CHURCH STREET","HAMILTON HM 11",D0,BERMUDA,Foreign,,,"=""2834""","Pharmaceutical Preparations",325412,"Pharmaceutical Preparation Manufacturing",34,5,12/29/22,"3,705,151",12/31/22,"330,324","-28,673,164","-13,195,517","6,812,327"
22247,"Research and development expenses","Research and development tax incentive receivable",491358,06/30/22,08/31/22,1,"PricewaterhouseCoopers LLP",89,PricewaterhouseCoopers,1379,Melbourne,C3,AUSTRALIA,Foreign,20-F,2022-08-31,,"ALTERITY THERAPEUTICS LTD",1131343,"=""ATHE""","LEVEL 3, 460 BOURKE STREET",,MELBOURNE,C3,AUSTRALIA,Foreign,,,"=""2834""","Pharmaceutical Preparations",325412,"Pharmaceutical Preparation Manufacturing",34,1,06/30/22,"245,100,064",06/30/22,"-3,723","-8,834,331",,"28,443,159"
23854,"Revenue from customer contracts","Revenue Recognition – Determination of Standalone Selling Prices – Refer to Notes 2 and 3 of the Financial Statements",499080,12/31/22,02/09/23,3,"Deloitte & Touche LLP",,,,"Los Angeles",CA,CALIFORNIA,"US West",10-K,2023-02-10,,"Alteryx, Inc.",1689923,,"17200 LAGUNA CANYON ROAD",,IRVINE,CA,CALIFORNIA,"US West",,,"=""7372""","Prepackaged Software",511210,"Software Publishers",34,51,12/31/22,"3,122,082,816",12/31/22,"855,000,000","-319,000,000","-285,000,000","1,557,000,000"
23855,"Business combinations","Business Combinations – Estimate for valuation of acquired intangible assets – Refer to Notes 2 and 4 of the Financial Statements",499080,12/31/22,02/09/23,3,"Deloitte & Touche LLP",,,,"Los Angeles",CA,CALIFORNIA,"US West",10-K,2023-02-10,,"Alteryx, Inc.",1689923,,"17200 LAGUNA CANYON ROAD",,IRVINE,CA,CALIFORNIA,"US West",,,"=""7372""","Prepackaged Software",511210,"Software Publishers",34,51,12/31/22,"3,122,082,816",12/31/22,"855,000,000","-319,000,000","-285,000,000","1,557,000,000"
25990,"Research and development expenses","Accrued Research and Development Expenses",501857,12/31/22,02/28/23,2,"Ernst & Young LLP",,,,Tysons,VA,VIRGINIA,"US Mid Atlantic",10-K,2023-02-28,,"Altimmune, Inc.",1326190,"=""ALT""","910 CLOPPER ROAD","SUITE 201S",GAITHERSBURG,MD,MARYLAND,"US Mid Atlantic",,,"=""2834""","Pharmaceutical Preparations",325412,"Pharmaceutical Preparation Manufacturing",34,16,12/31/22,"809,337,472",12/31/22,"-68,000","-84,713,000","172,874,000","206,928,000"
28066,"Accounts/loans receivable","Loans Held for Sale or Investment, at Fair Value",506322,12/31/22,03/27/23,2,"Ernst & Young LLP",,,,Atlanta,GA,GEORGIA,"US Southeast",10-K,2023-03-27,,"Altisource Asset Management Corp",1555074,"=""AAMCD""","5100 TAMARIND REEF",,CHRISTIANSTED,VI,"VIRGIN ISLANDS (US)",Foreign,,,"=""6500""","Real Estate",523930,"Investment Advice",34,20,12/29/22,"36,101,432",12/31/22,"4,965,000","-15,934,000",,"117,647,000"
26564,Goodwill,"Goodwill —Portescap Reporting Unit — Refer to Notes 1 and 7 to the financial statements",502273,12/31/22,03/01/23,3,"Deloitte & Touche LLP",,,,Boston,MA,MASSACHUSETTS,"US New England",10-K,2023-03-01,,"Altra Industrial Motion Corp.",1374535,,"300 GRANITE STREET","SUITE 201",BRAINTREE,MA,MASSACHUSETTS,"US New England",,,"=""3569""","General Industrial Machinery and Equipment, NEC",423840,"Industrial Supplies Merchant Wholesalers",34,60,12/31/22,"3,900,477,696",12/31/22,"1,945,500,000","127,000,000","-492,500,000","3,676,600,000"
23557,"Other contingent liabilities","Tobacco and Health Litigation Provisions and Disclosures",498425,12/31/22,02/01/23,1,"PricewaterhouseCoopers LLP",,,,Richmond,VA,VIRGINIA,"US Mid Atlantic",8-K,2023-02-01,,"ALTRIA GROUP, INC.",764180,"=""MO""","6601 WEST BROAD STREET",,RICHMOND,VA,VIRGINIA,"US Mid Atlantic",,,"=""2111""",Cigarettes,312221,"Cigarette Manufacturing",34,46,12/31/22,"81,616,764,928",12/31/22,"25,096,000,000","5,764,000,000","-21,534,000,000","36,954,000,000"
23558,"Equity investments and joint ventures","JUUL Labs, Inc. (“JUUL”) - Determination of the Fair Value of the Investment",498425,12/31/22,02/01/23,1,"PricewaterhouseCoopers LLP",,,,Richmond,VA,VIRGINIA,"US Mid Atlantic",8-K,2023-02-01,,"ALTRIA GROUP, INC.",764180,"=""MO""","6601 WEST BROAD STREET",,RICHMOND,VA,VIRGINIA,"US Mid Atlantic",,,"=""2111""",Cigarettes,312221,"Cigarette Manufacturing",34,46,12/31/22,"81,616,764,928",12/31/22,"25,096,000,000","5,764,000,000","-21,534,000,000","36,954,000,000"
23559,"Other intangible assets","Skoal Trademark Impairment Assessment",498425,12/31/22,02/01/23,1,"PricewaterhouseCoopers LLP",,,,Richmond,VA,VIRGINIA,"US Mid Atlantic",8-K,2023-02-01,,"ALTRIA GROUP, INC.",764180,"=""MO""","6601 WEST BROAD STREET",,RICHMOND,VA,VIRGINIA,"US Mid Atlantic",,,"=""2111""",Cigarettes,312221,"Cigarette Manufacturing",34,46,12/31/22,"81,616,764,928",12/31/22,"25,096,000,000","5,764,000,000","-21,534,000,000","36,954,000,000"
25691,"Other contingent liabilities","Tobacco and Health Litigation Provisions and Disclosures",501592,12/31/22,02/01/23,1,"PricewaterhouseCoopers LLP",,,,Richmond,VA,VIRGINIA,"US Mid Atlantic",10-K,2023-02-27,,"ALTRIA GROUP, INC.",764180,"=""MO""","6601 WEST BROAD STREET",,RICHMOND,VA,VIRGINIA,"US Mid Atlantic",,,"=""2111""",Cigarettes,312221,"Cigarette Manufacturing",34,46,12/31/22,"81,616,764,928",12/31/22,"25,096,000,000","5,764,000,000","-21,534,000,000","36,954,000,000"
25692,"Equity investments and joint ventures","JUUL Labs, Inc. (“JUUL”) - Determination of the Fair Value of the Investment",501592,12/31/22,02/01/23,1,"PricewaterhouseCoopers LLP",,,,Richmond,VA,VIRGINIA,"US Mid Atlantic",10-K,2023-02-27,,"ALTRIA GROUP, INC.",764180,"=""MO""","6601 WEST BROAD STREET",,RICHMOND,VA,VIRGINIA,"US Mid Atlantic",,,"=""2111""",Cigarettes,312221,"Cigarette Manufacturing",34,46,12/31/22,"81,616,764,928",12/31/22,"25,096,000,000","5,764,000,000","-21,534,000,000","36,954,000,000"
25693,"Other intangible assets","Skoal Trademark Impairment Assessment",501592,12/31/22,02/01/23,1,"PricewaterhouseCoopers LLP",,,,Richmond,VA,VIRGINIA,"US Mid Atlantic",10-K,2023-02-27,,"ALTRIA GROUP, INC.",764180,"=""MO""","6601 WEST BROAD STREET",,RICHMOND,VA,VIRGINIA,"US Mid Atlantic",,,"=""2111""",Cigarettes,312221,"Cigarette Manufacturing",34,46,12/31/22,"81,616,764,928",12/31/22,"25,096,000,000","5,764,000,000","-21,534,000,000","36,954,000,000"
29393,"Property, plant and equipment","Impairment assessment of property, plant and equipment",509789,12/31/22,04/25/23,1,"PricewaterhouseCoopers LLP",94,"PricewaterhouseCoopers Zhong Tian LLP",1424,Shanghai,F4,CHINA,Foreign,20-F,2023-04-25,,"ALUMINUM CORP OF CHINA LTD",1161611,"=""ALMMF""","NO 12B FUXING ROAD","HAIDIAN DISTRICT",BEIJING,F4,CHINA,Foreign,,,"=""3334""","Primary Production of Aluminum",331312,"Primary Aluminum Production",34,11,12/29/22,"1,688,017,408",12/31/22,"41,858,530,000","1,559,810,000","5,962,885,000","30,546,202,000"
29394,Goodwill,"Impairment assessment of goodwill",509789,12/31/22,04/25/23,1,"PricewaterhouseCoopers LLP",94,"PricewaterhouseCoopers Zhong Tian LLP",1424,Shanghai,F4,CHINA,Foreign,20-F,2023-04-25,,"ALUMINUM CORP OF CHINA LTD",1161611,"=""ALMMF""","NO 12B FUXING ROAD","HAIDIAN DISTRICT",BEIJING,F4,CHINA,Foreign,,,"=""3334""","Primary Production of Aluminum",331312,"Primary Aluminum Production",34,11,12/29/22,"1,688,017,408",12/31/22,"41,858,530,000","1,559,810,000","5,962,885,000","30,546,202,000"
27037,"Research and development expenses","Assessment of contract manufacturing accruals",504169,12/31/22,03/09/23,4,"KPMG LLP",,,,"San Francisco",CA,CALIFORNIA,"US West",10-K,2023-03-09,,"ALX ONCOLOGY HOLDINGS INC",1810182,"=""ALXO""","323 ALLERTON AVENUE",,"SOUTH SAN FRANCISCO",CA,CALIFORNIA,"US West",,,"=""2834""","Pharmaceutical Preparations",325412,"Pharmaceutical Preparation Manufacturing",34,11,12/31/22,"460,507,808",12/31/22,,"-123,482,000",,"306,489,000"
26447,"Sales return and allowances","Product Return Reserve Estimate",502788,12/31/22,03/01/23,2,"Ernst & Young LLP",,,,Iselin,NJ,"NEW JERSEY","US Mid Atlantic",10-K,2023-03-01,,"AMARIN CORP PLC\UK",897448,"=""AMRN""","SPACES SOUTH DOCKLANDS, BLOCK C","77 SIR JOHN ROGERSON'S QUAY","ELY CAMBRIDGESHIRE",X0,"UNITED KINGDOM",Foreign,,,"=""2834""","Pharmaceutical Preparations",325412,"Pharmaceutical Preparation Manufacturing",34,1,12/31/22,"489,258,976",12/31/22,"369,193,000","-105,803,000","573,553,000","886,179,000"
23596,"Uncertain tax positions","Uncertain Tax Positions",498569,12/31/22,02/02/23,2,"Ernst & Young LLP",,,,Seattle,WA,WASHINGTON,"US West",10-K,2023-02-03,,"AMAZON COM INC",1018724,"=""AMZN""","410 TERRY AVENUE NORTH",,SEATTLE,WA,WASHINGTON,"US West",,,"=""5961""","Catalog and Mail-Order Houses",518210,"Data Processing, Hosting, and Related Services",34,84,12/31/22,"860,327,968,768",12/31/22,"513,983,000,000","-2,722,000,000","125,755,000,000","462,675,000,000"
19891,"Other income taxes","Accounting for Income Taxes",482522,01/31/22,04/01/22,1,"PricewaterhouseCoopers LLP",,,,"San Jose",CA,CALIFORNIA,"US West",10-K,2022-04-01,,"AMBARELLA INC",1280263,"=""AMBA""","3001 TASMAN DRIVE",,"SANTA CLARA",CA,CALIFORNIA,"US West",,,"=""3674""","Semiconductors and Related Devices",334413,"Semiconductor and Related Device Manufacturing",34,140,01/31/22,"5,227,990,016",01/31/22,"331,856,000","-26,411,000","197,249,000","657,545,000"
19892,"Business combinations","Acquisition of Oculii Corp. - Valuation of Developed Technology and Customer Relationships Intangible Assets Acquired",482522,01/31/22,04/01/22,1,"PricewaterhouseCoopers LLP",,,,"San Jose",CA,CALIFORNIA,"US West",10-K,2022-04-01,,"AMBARELLA INC",1280263,"=""AMBA""","3001 TASMAN DRIVE",,"SANTA CLARA",CA,CALIFORNIA,"US West",,,"=""3674""","Semiconductors and Related Devices",334413,"Semiconductor and Related Device Manufacturing",34,140,01/31/22,"5,227,990,016",01/31/22,"331,856,000","-26,411,000","197,249,000","657,545,000"
29859,Goodwill,"Goodwill impairment assessment",511852,12/31/22,05/11/23,1,"PricewaterhouseCoopers LLP",95,PricewaterhouseCoopers,1389,"Hong Kong",F4,CHINA,Foreign,20-F,2023-05-11,,"Amber International Holding Ltd",1697818,"=""AMBR""","1 WALLICH STREET","#30-02 GUOCO TOWER",SINGAPORE,U0,SINGAPORE,Foreign,,,"=""6199""","Finance Services",511210,"Software Publishers",34,4,12/29/22,"35,246,732",12/31/22,"46,571,000","-202,805,000","73,939,000","221,782,000"
29860,"Long-lived assets","Impairment assessments of long-lived assets that are held and used",511852,12/31/22,05/11/23,1,"PricewaterhouseCoopers LLP",95,PricewaterhouseCoopers,1389,"Hong Kong",F4,CHINA,Foreign,20-F,2023-05-11,,"Amber International Holding Ltd",1697818,"=""AMBR""","1 WALLICH STREET","#30-02 GUOCO TOWER",SINGAPORE,U0,SINGAPORE,Foreign,,,"=""6199""","Finance Services",511210,"Software Publishers",34,4,12/29/22,"35,246,732",12/31/22,"46,571,000","-202,805,000","73,939,000","221,782,000"
27678,"Other income taxes","Tax contingencies and uncertain tax treatments",505516,12/31/22,03/15/23,1,"PricewaterhouseCoopers LLP",91,"PricewaterhouseCoopers Auditores Independentes",1351,"São Paulo",D5,BRAZIL,Foreign,20-F,2023-03-17,,"AMBEV S.A.",1565025,"=""ABEV""","RUA DR. RENATO PAES DE BARROS, 1017","3 ANDAR PARTE","SAO PAULO",D5,BRAZIL,Foreign,,,"=""2080""",Beverages,312120,Breweries,34,3,12/29/22,"43,281,342,464",12/31/22,"15,097,100,000","2,820,400,000","6,087,300,000","26,129,600,000"
27679,"Other income taxes","PIS and COFINS Recovery - exclusion of ICMS (VAT tax) from the basis of calculation",505516,12/31/22,03/15/23,1,"PricewaterhouseCoopers LLP",91,"PricewaterhouseCoopers Auditores Independentes",1351,"São Paulo",D5,BRAZIL,Foreign,20-F,2023-03-17,,"AMBEV S.A.",1565025,"=""ABEV""","RUA DR. RENATO PAES DE BARROS, 1017","3 ANDAR PARTE","SAO PAULO",D5,BRAZIL,Foreign,,,"=""2080""",Beverages,312120,Breweries,34,3,12/29/22,"43,281,342,464",12/31/22,"15,097,100,000","2,820,400,000","6,087,300,000","26,129,600,000"
25858,"Long-lived assets","Impairment of long-lived assets",501932,12/31/22,02/28/23,2,"Ernst & Young LLP",,,,"Kansas City",MO,MISSOURI,"US Southeast",10-K,2023-02-28,,"AMC ENTERTAINMENT HOLDINGS, INC.",1411579,"=""AMC""","ONE AMC WAY","11500 ASH STREET",LEAWOOD,KS,KANSAS,"US Midwest",,,"=""7830""","Services-Motion Picture Theaters",512131,"Motion Picture Theaters (except Drive-Ins)",34,4,12/31/22,"2,103,534,336",12/31/22,"3,911,400,000","-973,600,000","-5,113,800,000","9,135,600,000"
24345,Goodwill,"Assessment of the carrying value of goodwill in the AMC Networks International (AMCNI) reporting unit",499918,12/31/22,02/17/23,4,"KPMG LLP",,,,"New York",NY,"NEW YORK","US Mid Atlantic",10-K,2023-02-17,,"AMC Networks Inc.",1514991,"=""AMCX""","11 PENN PLAZA",,"NEW YORK",NY,"NEW YORK","US Mid Atlantic",,,"=""4841""","Cable and Other Pay Television Services",515120,"Television Broadcasting",34,16,12/31/22,"493,996,736",12/31/22,"3,096,545,000","7,594,000","-1,700,377,000","5,633,836,000"
24346,"Depreciation and amortization","Assessment of amortization of owned original program rights predominantly monetized individually",499918,12/31/22,02/17/23,4,"KPMG LLP",,,,"New York",NY,"NEW YORK","US Mid Atlantic",10-K,2023-02-17,,"AMC Networks Inc.",1514991,"=""AMCX""","11 PENN PLAZA",,"NEW YORK",NY,"NEW YORK","US Mid Atlantic",,,"=""4841""","Cable and Other Pay Television Services",515120,"Television Broadcasting",34,16,12/31/22,"493,996,736",12/31/22,"3,096,545,000","7,594,000","-1,700,377,000","5,633,836,000"
22101,"Other intangible assets","Valuation of assets and liabilities held for sale",490885,06/30/22,08/18/22,1,"PricewaterhouseCoopers LLP",119,"PricewaterhouseCoopers AG",1358,Zurich,V8,SWITZERLAND,Foreign,10-K,2022-08-18,,"Amcor plc",1748790,"=""AMCR""","83 TOWER ROAD NORTH",,"WARMLEY, BRISTOL",X0,"UNITED KINGDOM",Foreign,,,"=""3990""","Miscellaneous Manufacturing Industries",322221,"Coated and Laminated Packaging Paper and Plastics Film Manufacturing",34,12,06/28/22,"18,529,114,112",06/30/22,"14,544,000,000","805,000,000","-2,860,000,000","17,426,000,000"
23170,"Revenue from customer contracts","Revenue recognition for projects",495833,09/30/22,12/13/22,2,"Ernst & Young LLP",,,,"New York",NY,"NEW YORK","US Mid Atlantic",20-F,2022-12-13,,"AMDOCS LTD",1062579,"=""DOX""","P.O BOX 263, HIRZEL HOUSE","SMITH STREET,","ST. PETER PORT",Y7,GUERNSEY,Foreign,,,"=""7371""","Computer Programming Services",541511,"Custom Computer Programming Services",34,80,09/28/22,"9,995,541,504",09/30/22,"4,576,697,000","549,501,000","676,632,000","6,390,393,000"
23171,"Uncertain tax positions","Uncertain Tax Positions",495833,09/30/22,12/13/22,2,"Ernst & Young LLP",,,,"New York",NY,"NEW YORK","US Mid Atlantic",20-F,2022-12-13,,"AMDOCS LTD",1062579,"=""DOX""","P.O BOX 263, HIRZEL HOUSE","SMITH STREET,","ST. PETER PORT",Y7,GUERNSEY,Foreign,,,"=""7371""","Computer Programming Services",541511,"Custom Computer Programming Services",34,80,09/28/22,"9,995,541,504",09/30/22,"4,576,697,000","549,501,000","676,632,000","6,390,393,000"
24193,"Revenue from customer contracts","Evaluation of the non-contractual revenue adjustment estimates for Home Health and Hospice",499620,12/31/22,02/16/23,4,"KPMG LLP",,,,"Baton Rouge",LA,LOUISIANA,"US Southeast",10-K,2023-02-16,,"AMEDISYS INC",896262,,"3854 AMERICAN WAY","SUITE A","BATON ROUGE",LA,LOUISIANA,"US Southeast",,,"=""8082""","Home Health Care Services",621610,"Home Health Care Services",34,84,12/31/22,"2,716,577,024",12/31/22,"2,223,199,000","118,609,000","-336,993,000","1,976,245,000"
32096,"Goodwill and intangible assets","Valuation of goodwill and trademarks for the Peak Performance and Winter Sports Equipment cash generating units",522406,12/31/22,08/11/23,4,"KPMG LLP",309,"KPMG AB",1049,Stockholm,V7,SWEDEN,Foreign,DRS,2023-08-11,,"Amer Sports, Inc.",1988894,"=""AS""","SILTASAARENKATU 8-10",FL-00530,HELSINKI,H9,FINLAND,Foreign,,,"=""2300""","Apparel & Other Finishd Prods of Fabrics & Similar Matl",339920,"Sporting and Athletic Goods Manufacturing",34,,,,12/31/22,"3,548,800,000","-252,700,000","-5,072,200,000","7,895,100,000"
32099,"Goodwill and intangible assets","Valuation of goodwill and trademarks for the Peak Performance and Winter Sports Equipment cash generating units",522491,12/31/22,08/11/23,4,"KPMG LLP",309,"KPMG AB",1049,Stockholm,V7,SWEDEN,Foreign,DRS/A,2023-09-18,,"Amer Sports, Inc.",1988894,"=""AS""","SILTASAARENKATU 8-10",FL-00530,HELSINKI,H9,FINLAND,Foreign,,,"=""2300""","Apparel & Other Finishd Prods of Fabrics & Similar Matl",339920,"Sporting and Athletic Goods Manufacturing",34,,,,12/31/22,"3,548,800,000","-252,700,000","-5,072,200,000","7,895,100,000"
32100,"Goodwill and intangible assets","Valuation of goodwill and trademarks for the Peak Performance and Winter Sports Equipment cash generating units",522492,12/31/22,08/11/23,4,"KPMG LLP",309,"KPMG AB",1049,Stockholm,V7,SWEDEN,Foreign,DRS/A,2023-10-05,,"Amer Sports, Inc.",1988894,"=""AS""","SILTASAARENKATU 8-10",FL-00530,HELSINKI,H9,FINLAND,Foreign,,,"=""2300""","Apparel & Other Finishd Prods of Fabrics & Similar Matl",339920,"Sporting and Athletic Goods Manufacturing",34,,,,12/31/22,"3,548,800,000","-252,700,000","-5,072,200,000","7,895,100,000"
32103,"Goodwill and intangible assets","Valuation of goodwill and trademarks for the Peak Performance and Winter Sports Equipment cash generating units",522493,12/31/22,08/11/23,4,"KPMG LLP",309,"KPMG AB",1049,Stockholm,V7,SWEDEN,Foreign,DRS/A,2023-11-20,,"Amer Sports, Inc.",1988894,"=""AS""","SILTASAARENKATU 8-10",FL-00530,HELSINKI,H9,FINLAND,Foreign,,,"=""2300""","Apparel & Other Finishd Prods of Fabrics & Similar Matl",339920,"Sporting and Athletic Goods Manufacturing",34,,,,12/31/22,"3,548,800,000","-252,700,000","-5,072,200,000","7,895,100,000"
32108,"Goodwill and intangible assets","Valuation of goodwill and trademarks for the Peak Performance and Winter Sports Equipment cash generating units",522502,12/31/22,08/11/23,4,"KPMG LLP",309,"KPMG AB",1049,Stockholm,V7,SWEDEN,Foreign,F-1,2024-01-04,,"Amer Sports, Inc.",1988894,"=""AS""","SILTASAARENKATU 8-10",FL-00530,HELSINKI,H9,FINLAND,Foreign,,,"=""2300""","Apparel & Other Finishd Prods of Fabrics & Similar Matl",339920,"Sporting and Athletic Goods Manufacturing",34,,,,12/31/22,"3,548,800,000","-252,700,000","-5,072,200,000","7,895,100,000"
32191,"Goodwill and intangible assets","Valuation of goodwill and trademarks for the Peak Performance and Winter Sports Equipment cash generating units",523293,12/31/22,08/11/23,4,"KPMG LLP",309,"KPMG AB",1049,Stockholm,V7,SWEDEN,Foreign,F-1/A,2024-01-22,,"Amer Sports, Inc.",1988894,"=""AS""","SILTASAARENKATU 8-10",FL-00530,HELSINKI,H9,FINLAND,Foreign,,,"=""2300""","Apparel & Other Finishd Prods of Fabrics & Similar Matl",339920,"Sporting and Athletic Goods Manufacturing",34,,,,12/31/22,"3,548,800,000","-252,700,000","-5,072,200,000","7,895,100,000"
32244,"Goodwill and intangible assets","Valuation of goodwill and trademarks for the Peak Performance and Winter Sports Equipment cash generating units",523591,12/31/22,08/11/23,4,"KPMG LLP",309,"KPMG AB",1049,Stockholm,V7,SWEDEN,Foreign,F-1/A,2024-01-26,,"Amer Sports, Inc.",1988894,"=""AS""","SILTASAARENKATU 8-10",FL-00530,HELSINKI,H9,FINLAND,Foreign,,,"=""2300""","Apparel & Other Finishd Prods of Fabrics & Similar Matl",339920,"Sporting and Athletic Goods Manufacturing",34,,,,12/31/22,"3,548,800,000","-252,700,000","-5,072,200,000","7,895,100,000"
32335,"Goodwill and intangible assets","Valuation of goodwill and trademarks for the Peak Performance and Winter Sports Equipment cash generating units",523921,12/31/22,08/11/23,4,"KPMG LLP",309,"KPMG AB",1049,Stockholm,V7,SWEDEN,Foreign,424B4,2024-02-02,,"Amer Sports, Inc.",1988894,"=""AS""","SILTASAARENKATU 8-10",FL-00530,HELSINKI,H9,FINLAND,Foreign,,,"=""2300""","Apparel & Other Finishd Prods of Fabrics & Similar Matl",339920,"Sporting and Athletic Goods Manufacturing",34,,,,12/31/22,"3,548,800,000","-252,700,000","-5,072,200,000","7,895,100,000"
24597,"Regulatory assets and liabilities","Accounting for the Effects of Regulation",500222,12/31/22,02/21/23,1,"PricewaterhouseCoopers LLP",,,,"Saint Louis",MO,MISSOURI,"US Southeast",10-K,2023-02-22,,"AMEREN CORP",1002910,"=""AEE""","1901 CHOUTEAU AVE","MC 1310","ST LOUIS",MO,MISSOURI,"US Southeast",,,"=""4931""","Electric and Other Services Combined",221122,"Electric Power Distribution",34,89,12/31/22,"23,297,040,384",12/31/22,"7,957,000,000","1,074,000,000","10,097,000,000","37,904,000,000"
24624,"Regulatory assets and liabilities","Accounting for the Effects of Regulation",500246,12/31/22,02/21/23,1,"PricewaterhouseCoopers LLP",,,,"Saint Louis",MO,MISSOURI,"US Southeast",10-K,2023-02-22,,"Ameren Illinois Co",18654,"=""AILIH""","10 RICHARD MARK WAY",,COLLINSVILLE,IL,ILLINOIS,"US Midwest",1002910,"AMEREN CORP","=""4931""","Electric and Other Services Combined",221121,"Electric Bulk Power Transmission and Control",34,,,,12/31/22,"3,756,000,000","515,000,000","5,757,000,000","16,441,000,000"
29723,"Deferred income taxes","Deferred tax assets, realizability of amounts related to Net Operating Loss Carryforwards and temporary differences related to employee benefits",511029,12/31/22,05/01/23,2,"Ernst & Young LLP",139,"Mancera SC",1284,"Mexico City",O5,MEXICO,Foreign,20-F,2023-05-01,,"AMERICA MOVIL SAB DE CV/",1129137,"=""AMX""","LAGO ZURICH 245",*,"COLONIA ANAHUAC",O5,MEXICO,Foreign,,,"=""4813""","Telephone Communications, Except Radiotelephone",517310,"Telecommunications Resellers",34,18,12/29/22,"42,003,812,352",12/31/22,"43,336,099,000","4,182,550,000","5,326,042,000","83,033,745,000"
29724,Goodwill,"Impairment of goodwill",511029,12/31/22,05/01/23,2,"Ernst & Young LLP",139,"Mancera SC",1284,"Mexico City",O5,MEXICO,Foreign,20-F,2023-05-01,,"AMERICA MOVIL SAB DE CV/",1129137,"=""AMX""","LAGO ZURICH 245",*,"COLONIA ANAHUAC",O5,MEXICO,Foreign,,,"=""4813""","Telephone Communications, Except Radiotelephone",517310,"Telecommunications Resellers",34,18,12/29/22,"42,003,812,352",12/31/22,"43,336,099,000","4,182,550,000","5,326,042,000","83,033,745,000"
29725,"Pension and other post-employment benefits","Discount rate used in determining defined benefit pension obligations in Mexico",511029,12/31/22,05/01/23,2,"Ernst & Young LLP",139,"Mancera SC",1284,"Mexico City",O5,MEXICO,Foreign,20-F,2023-05-01,,"AMERICA MOVIL SAB DE CV/",1129137,"=""AMX""","LAGO ZURICH 245",*,"COLONIA ANAHUAC",O5,MEXICO,Foreign,,,"=""4813""","Telephone Communications, Except Radiotelephone",517310,"Telecommunications Resellers",34,18,12/29/22,"42,003,812,352",12/31/22,"43,336,099,000","4,182,550,000","5,326,042,000","83,033,745,000"
24770,"Deferred income taxes","Sufficiency of audit evidence over realizability of tax operating loss and other carryforwards",500410,12/31/22,02/22/23,4,"KPMG LLP",,,,Dallas,TX,TEXAS,"US Southwest",10-K,2023-02-22,,"American Airlines Group Inc.",6201,"=""AAL""","1 SKYVIEW DRIVE",,"FORT WORTH",TX,TEXAS,"US Southwest",,,"=""4512""","Air Transportation, Scheduled",481111,"Scheduled Passenger Air Transportation",34,13,12/31/22,"8,276,172,288",12/31/22,"48,971,000,000","127,000,000","-11,949,000,000","64,716,000,000"
24544,"Deferred income taxes","Sufficiency of audit evidence over realizability of tax operating loss and other carryforwards",500249,12/31/22,02/22/23,4,"KPMG LLP",,,,Dallas,TX,TEXAS,"US Southwest",10-K,2023-02-22,,"AMERICAN AIRLINES, INC.",4515,,"1 SKYVIEW DRIVE",,"FORT WORTH",TX,TEXAS,"US Southwest",6201,"American Airlines Group Inc.","=""4512""","Air Transportation, Scheduled",481111,"Scheduled Passenger Air Transportation",34,,,,12/31/22,"48,965,000,000","338,000,000","-557,000,000","70,324,000,000"
23824,"Real estate investments","Impairment of real estate properties",499128,12/31/22,02/10/23,2,"Ernst & Young LLP",,,,"San Diego",CA,CALIFORNIA,"US West",10-K,2023-02-10,,"American Assets Trust, Inc.",1500217,"=""AAT""","3420 CARMEL MOUNTAIN ROAD","SUITE 100","SAN DIEGO",CA,CALIFORNIA,"US West",,,"=""6798""","Real Estate Investment Trusts",525990,"Other Financial Vehicles",34,27,12/31/22,"1,609,044,352",12/31/22,"422,648,000","43,506,000",,"2,987,881,000"
23825,"Business combinations","Property asset acquisitions",499128,12/31/22,02/10/23,2,"Ernst & Young LLP",,,,"San Diego",CA,CALIFORNIA,"US West",10-K,2023-02-10,,"American Assets Trust, Inc.",1500217,"=""AAT""","3420 CARMEL MOUNTAIN ROAD","SUITE 100","SAN DIEGO",CA,CALIFORNIA,"US West",,,"=""6798""","Real Estate Investment Trusts",525990,"Other Financial Vehicles",34,27,12/31/22,"1,609,044,352",12/31/22,"422,648,000","43,506,000",,"2,987,881,000"
23821,"Real estate investments","Impairment of real estate properties",499130,12/31/22,02/10/23,2,"Ernst & Young LLP",,,,"San Diego",CA,CALIFORNIA,"US West",10-K,2023-02-10,,"American Assets Trust, L.P.",1509570,,"11455 EL CAMINO REAL","SUITE 200","SAN DIEGO",CA,CALIFORNIA,"US West",,,"=""6798""","Real Estate Investment Trusts",525990,"Other Financial Vehicles",34,,,,12/31/22,"422,648,000","55,877,000",,"2,987,881,000"
23822,"Business combinations","Property asset acquisition",499130,12/31/22,02/10/23,2,"Ernst & Young LLP",,,,"San Diego",CA,CALIFORNIA,"US West",10-K,2023-02-10,,"American Assets Trust, L.P.",1509570,,"11455 EL CAMINO REAL","SUITE 200","SAN DIEGO",CA,CALIFORNIA,"US West",,,"=""6798""","Real Estate Investment Trusts",525990,"Other Financial Vehicles",34,,,,12/31/22,"422,648,000","55,877,000",,"2,987,881,000"
24421,"Other income taxes","Income Taxes — Refer to Notes 1 and 9 to the consolidated financial statements",499851,12/31/22,02/17/23,3,"Deloitte & Touche LLP",,,,Detroit,MI,MICHIGAN,"US Midwest",10-K,2023-02-17,,"AMERICAN AXLE & MANUFACTURING HOLDINGS INC",1062231,"=""AXL""","ONE DAUCH DRIVE",,DETROIT,MI,MICHIGAN,"US Midwest",,,"=""3714""","Motor Vehicle Parts and Accessories",336350,"Motor Vehicle Transmission and Power Train Parts Manufacturing",34,8,12/31/22,"896,172,032",12/31/22,"5,802,400,000","64,300,000","-170,500,000","5,469,400,000"
24422,Goodwill,"Goodwill Impairment Analysis — Refer to Notes 1 and 3 to the consolidated financial statements",499851,12/31/22,02/17/23,3,"Deloitte & Touche LLP",,,,Detroit,MI,MICHIGAN,"US Midwest",10-K,2023-02-17,,"AMERICAN AXLE & MANUFACTURING HOLDINGS INC",1062231,"=""AXL""","ONE DAUCH DRIVE",,DETROIT,MI,MICHIGAN,"US Midwest",,,"=""3714""","Motor Vehicle Parts and Accessories",336350,"Motor Vehicle Transmission and Power Train Parts Manufacturing",34,8,12/31/22,"896,172,032",12/31/22,"5,802,400,000","64,300,000","-170,500,000","5,469,400,000"
29198,"Insurance contract liabilities","LIABILITY FOR UNPAID LOSSES AND LOSS ADJUSTMENT EXPENSE (LAE)- Refer to Notes 2 and 10 to the Financial Statements",509036,12/31/22,04/17/23,3,"Deloitte & Touche LLP",,,,Tampa,FL,FLORIDA,"US Southeast",10-K,2023-04-17,Yes,"AMERICAN COASTAL INSURANCE Corp",1401521,"=""ACIC""","570 CARILLON PARKWAY","SUITE 100","SAINT PETERSBURG",FL,FLORIDA,"US Southeast",,,"=""6331""","Fire, Marine, and Casualty Insurance",524126,"Direct Property and Casualty Insurance Carriers",34,1,12/29/22,"31,181,826",12/31/22,"455,422,000","-469,855,000","-254,285,000","2,837,496,000"
31204,"Insurance contract liabilities","LIABILITY FOR UNPAID LOSSES AND LOSS ADJUSTMENT EXPENSE (LAE)- Refer to Notes 2 and 11 to the Financial Statements",517173,12/31/22,04/17/23,3,"Deloitte & Touche LLP",,,,Tampa,FL,FLORIDA,"US Southeast",8-K,2023-09-19,Yes,"AMERICAN COASTAL INSURANCE Corp",1401521,"=""ACIC""","570 CARILLON PARKWAY","SUITE 100","SAINT PETERSBURG",FL,FLORIDA,"US Southeast",,,"=""6331""","Fire, Marine, and Casualty Insurance",524126,"Direct Property and Casualty Insurance Carriers",34,1,12/29/22,"31,181,826",12/31/22,"455,422,000","-469,855,000","-254,285,000","2,837,496,000"
18500,"Business combinations","Valuation of customer relationships intangible asset in the acquisition of Quiet Logistics, Inc.",479374,01/29/22,03/14/22,2,"Ernst & Young LLP",,,,Pittsburgh,PA,PENNSYLVANIA,"US Mid Atlantic",10-K,2022-03-14,,"AMERICAN EAGLE OUTFITTERS INC",919012,"=""AEO""","77 HOT METAL STREET",,PITTSBURGH,PA,PENNSYLVANIA,"US Mid Atlantic",,,"=""5651""","Family Clothing Stores",448140,"Family Clothing Stores",34,23,01/31/22,"3,851,398,144",01/29/22,"5,010,785,000","419,629,000","1,049,555,000","3,786,643,000"
24932,"Regulatory assets and liabilities","Accounting for the Effects of Cost-Based Regulation",500713,12/31/22,02/23/23,1,"PricewaterhouseCoopers LLP",,,,Columbus,OH,OHIO,"US Midwest",10-K,2023-02-23,,"AMERICAN ELECTRIC POWER CO INC",4904,"=""AEP""","1 RIVERSIDE PLAZA",,COLUMBUS,OH,OHIO,"US Midwest",,,"=""4911""","Electric Services",221122,"Electric Power Distribution",34,96,12/29/22,"49,336,053,760",12/31/22,"19,639,500,000","2,307,200,000","23,886,800,000","93,469,400,000"
24933,"Derivatives and hedging","Valuation of Level 3 Risk Management Commodity Contracts",500713,12/31/22,02/23/23,1,"PricewaterhouseCoopers LLP",,,,Columbus,OH,OHIO,"US Midwest",10-K,2023-02-23,,"AMERICAN ELECTRIC POWER CO INC",4904,"=""AEP""","1 RIVERSIDE PLAZA",,COLUMBUS,OH,OHIO,"US Midwest",,,"=""4911""","Electric Services",221122,"Electric Power Distribution",34,96,12/29/22,"49,336,053,760",12/31/22,"19,639,500,000","2,307,200,000","23,886,800,000","93,469,400,000"
24934,"Discontinued operations","Classification of the Assets and Liabilities of KPCo and KTCo as Held for Sale",500713,12/31/22,02/23/23,1,"PricewaterhouseCoopers LLP",,,,Columbus,OH,OHIO,"US Midwest",10-K,2023-02-23,,"AMERICAN ELECTRIC POWER CO INC",4904,"=""AEP""","1 RIVERSIDE PLAZA",,COLUMBUS,OH,OHIO,"US Midwest",,,"=""4911""","Electric Services",221122,"Electric Power Distribution",34,96,12/29/22,"49,336,053,760",12/31/22,"19,639,500,000","2,307,200,000","23,886,800,000","93,469,400,000"
30137,"Regulatory assets and liabilities","Accounting for the Effects of Cost-Based Regulation",512582,12/31/22,02/23/23,1,"PricewaterhouseCoopers LLP",,,,Columbus,OH,OHIO,"US Midwest",8-K,2023-05-26,,"AMERICAN ELECTRIC POWER CO INC",4904,"=""AEP""","1 RIVERSIDE PLAZA",,COLUMBUS,OH,OHIO,"US Midwest",,,"=""4911""","Electric Services",221122,"Electric Power Distribution",34,96,12/29/22,"49,336,053,760",12/31/22,"19,639,500,000","2,307,200,000","23,886,800,000","93,469,400,000"
30138,"Derivatives and hedging","Valuation of Level 3 Risk Management Commodity Contracts",512582,12/31/22,02/23/23,1,"PricewaterhouseCoopers LLP",,,,Columbus,OH,OHIO,"US Midwest",8-K,2023-05-26,,"AMERICAN ELECTRIC POWER CO INC",4904,"=""AEP""","1 RIVERSIDE PLAZA",,COLUMBUS,OH,OHIO,"US Midwest",,,"=""4911""","Electric Services",221122,"Electric Power Distribution",34,96,12/29/22,"49,336,053,760",12/31/22,"19,639,500,000","2,307,200,000","23,886,800,000","93,469,400,000"
30139,"Discontinued operations","Classification of the Assets and Liabilities of KPCo and KTCo as Held for Sale",512582,12/31/22,02/23/23,1,"PricewaterhouseCoopers LLP",,,,Columbus,OH,OHIO,"US Midwest",8-K,2023-05-26,,"AMERICAN ELECTRIC POWER CO INC",4904,"=""AEP""","1 RIVERSIDE PLAZA",,COLUMBUS,OH,OHIO,"US Midwest",,,"=""4911""","Electric Services",221122,"Electric Power Distribution",34,96,12/29/22,"49,336,053,760",12/31/22,"19,639,500,000","2,307,200,000","23,886,800,000","93,469,400,000"
23803,"Allowance for credit losses","Reserves for Credit Losses on Card Member Loans",499149,12/31/22,02/10/23,1,"PricewaterhouseCoopers LLP",,,,"New York",NY,"NEW YORK","US Mid Atlantic",10-K,2023-02-10,,"AMERICAN EXPRESS CO",4962,"=""AXP""","200 VESEY STREET","50TH FLOOR","NEW YORK",NY,"NEW YORK","US Mid Atlantic",,,"=""6199""","Finance Services",523930,"Investment Advice",34,148,12/31/22,"109,778,247,680",12/31/22,"50,680,000,000","7,514,000,000",,"228,354,000,000"
23804,"Other liabilities and provisions","Membership Rewards Liability",499149,12/31/22,02/10/23,1,"PricewaterhouseCoopers LLP",,,,"New York",NY,"NEW YORK","US Mid Atlantic",10-K,2023-02-10,,"AMERICAN EXPRESS CO",4962,"=""AXP""","200 VESEY STREET","50TH FLOOR","NEW YORK",NY,"NEW YORK","US Mid Atlantic",,,"=""6199""","Finance Services",523930,"Investment Advice",34,148,12/31/22,"109,778,247,680",12/31/22,"50,680,000,000","7,514,000,000",,"228,354,000,000"
25458,"Other investments","Valuation of investments in fixed maturity securities
",500987,12/31/22,02/24/23,2,"Ernst & Young LLP",,,,Cincinnati,OH,OHIO,"US Midwest",10-K,2023-02-24,,"AMERICAN FINANCIAL GROUP INC",1042046,"=""AFG""","GREAT AMERICAN INSURANCE GROUP TOWER","301 E. 4TH STREET",CINCINNATI,OH,OHIO,"US Midwest",,,"=""6331""","Fire, Marine, and Casualty Insurance",524126,"Direct Property and Casualty Insurance Carriers",34,138,12/29/22,"11,717,448,704",12/31/22,"7,040,000,000","898,000,000","3,806,000,000","28,831,000,000"
25459,"Insurance contract liabilities","Unpaid losses and loss adjustment expenses",500987,12/31/22,02/24/23,2,"Ernst & Young LLP",,,,Cincinnati,OH,OHIO,"US Midwest",10-K,2023-02-24,,"AMERICAN FINANCIAL GROUP INC",1042046,"=""AFG""","GREAT AMERICAN INSURANCE GROUP TOWER","301 E. 4TH STREET",CINCINNATI,OH,OHIO,"US Midwest",,,"=""6331""","Fire, Marine, and Casualty Insurance",524126,"Direct Property and Casualty Insurance Carriers",34,138,12/29/22,"11,717,448,704",12/31/22,"7,040,000,000","898,000,000","3,806,000,000","28,831,000,000"
27659,"Long-lived assets","Impairment of Long-Lived Assets relating to real estate investments — Refer to Note 2 to the financial statements",505520,12/31/22,03/17/23,3,"Deloitte & Touche LLP",,,,"Costa Mesa",CA,CALIFORNIA,"US West",10-K,2023-03-17,,"American Healthcare REIT, Inc.",1632970,"=""AHR""","18191 VON KARMAN AVENUE","SUITE 300",IRVINE,CA,CALIFORNIA,"US West",,,"=""6798""","Real Estate Investment Trusts",525990,"Other Financial Vehicles",34,,,,12/31/22,"1,643,175,000","-81,302,000","1,013,795,000","4,786,698,000"
25302,"Business combinations","Purchase price accounting",501081,12/31/22,02/24/23,2,"Ernst & Young LLP",,,,"Los Angeles",CA,CALIFORNIA,"US West",10-K,2023-02-24,,"American Homes 4 Rent",1562401,"=""AMH""","280 PILOT ROAD",,"LAS VEGAS",NV,NEVADA,"US West",,,"=""6798""","Real Estate Investment Trusts",525990,"Other Financial Vehicles",34,30,12/31/22,"10,635,857,920",12/31/22,"1,490,534,000","273,138,000","6,375,708,000","12,175,059,000"
25257,"Business combinations","Purchase price accounting",501104,12/31/22,02/24/23,2,"Ernst & Young LLP",,,,"Los Angeles",CA,CALIFORNIA,"US West",10-K,2023-02-24,,"American Homes 4 Rent, L.P.",1716558,,"280 PILOT ROAD",,"LAS VEGAS",NV,NEVADA,"US West",1562401,"American Homes 4 Rent","=""6798""","Real Estate Investment Trusts",531110,"Lessors of Residential Buildings and Dwellings",34,,,,12/31/22,"1,490,534,000","310,025,000","7,054,379,000","12,175,059,000"
21573,"Allowance for credit losses","Allowance for expected credit losses on retail loans",488717,03/31/22,06/23/22,4,"KPMG LLP",,,,"Los Angeles",CA,CALIFORNIA,"US West",10-K,2022-06-23,,"AMERICAN HONDA FINANCE CORP",864270,,"1919 TORRANCE BLVD.",,TORRANCE,CA,CALIFORNIA,"US West",715153,"HONDA MOTOR CO LTD","=""6141""","Personal Credit Institutions",522291,"Consumer Lending",34,,,,03/31/22,"8,803,000,000","1,768,000,000",,"76,278,000,000"
21574,Leases,"Estimated early termination losses on operating lease assets",488717,03/31/22,06/23/22,4,"KPMG LLP",,,,"Los Angeles",CA,CALIFORNIA,"US West",10-K,2022-06-23,,"AMERICAN HONDA FINANCE CORP",864270,,"1919 TORRANCE BLVD.",,TORRANCE,CA,CALIFORNIA,"US West",715153,"HONDA MOTOR CO LTD","=""6141""","Personal Credit Institutions",522291,"Consumer Lending",34,,,,03/31/22,"8,803,000,000","1,768,000,000",,"76,278,000,000"
21575,Leases,"Estimated end of term residual values of leased vehicles",488717,03/31/22,06/23/22,4,"KPMG LLP",,,,"Los Angeles",CA,CALIFORNIA,"US West",10-K,2022-06-23,,"AMERICAN HONDA FINANCE CORP",864270,,"1919 TORRANCE BLVD.",,TORRANCE,CA,CALIFORNIA,"US West",715153,"HONDA MOTOR CO LTD","=""6141""","Personal Credit Institutions",522291,"Consumer Lending",34,,,,03/31/22,"8,803,000,000","1,768,000,000",,"76,278,000,000"
24367,"Other investments","Valuation of Certain Level 3 Fixed Maturity Securities",499858,12/31/22,02/17/23,1,"PricewaterhouseCoopers LLP",,,,"New York",NY,"NEW YORK","US Mid Atlantic",10-K,2023-02-17,,"AMERICAN INTERNATIONAL GROUP, INC.",5272,"=""AIG""","1271 AVE OF THE AMERICAS","FL 37","NEW YORK",NY,"NEW YORK","US Mid Atlantic",,,"=""6331""","Fire, Marine, and Casualty Insurance",524130,"Reinsurance Carriers",34,63,12/31/22,"46,426,259,456",12/31/22,"56,437,000,000","10,276,000,000",,"526,634,000,000"
24368,"Insurance contract liabilities","Valuation of Insurance Liabilities - Unpaid Losses and Loss Adjustment Expenses (Loss Reserves), Net of Reinsurance",499858,12/31/22,02/17/23,1,"PricewaterhouseCoopers LLP",,,,"New York",NY,"NEW YORK","US Mid Atlantic",10-K,2023-02-17,,"AMERICAN INTERNATIONAL GROUP, INC.",5272,"=""AIG""","1271 AVE OF THE AMERICAS","FL 37","NEW YORK",NY,"NEW YORK","US Mid Atlantic",,,"=""6331""","Fire, Marine, and Casualty Insurance",524130,"Reinsurance Carriers",34,63,12/31/22,"46,426,259,456",12/31/22,"56,437,000,000","10,276,000,000",,"526,634,000,000"
24369,"Insurance contract liabilities","Valuation of Embedded Derivatives for Variable Annuity and Fixed Index Annuity Products and Valuation of Certain Guaranteed Benefit Features for Universal Life Products",499858,12/31/22,02/17/23,1,"PricewaterhouseCoopers LLP",,,,"New York",NY,"NEW YORK","US Mid Atlantic",10-K,2023-02-17,,"AMERICAN INTERNATIONAL GROUP, INC.",5272,"=""AIG""","1271 AVE OF THE AMERICAS","FL 37","NEW YORK",NY,"NEW YORK","US Mid Atlantic",,,"=""6331""","Fire, Marine, and Casualty Insurance",524130,"Reinsurance Carriers",34,63,12/31/22,"46,426,259,456",12/31/22,"56,437,000,000","10,276,000,000",,"526,634,000,000"
24370,"Depreciation and amortization","Valuation of Deferred Policy Acquisition Costs for Universal Life and Individual Retirement Variable Annuity Products",499858,12/31/22,02/17/23,1,"PricewaterhouseCoopers LLP",,,,"New York",NY,"NEW YORK","US Mid Atlantic",10-K,2023-02-17,,"AMERICAN INTERNATIONAL GROUP, INC.",5272,"=""AIG""","1271 AVE OF THE AMERICAS","FL 37","NEW YORK",NY,"NEW YORK","US Mid Atlantic",,,"=""6331""","Fire, Marine, and Casualty Insurance",524130,"Reinsurance Carriers",34,63,12/31/22,"46,426,259,456",12/31/22,"56,437,000,000","10,276,000,000",,"526,634,000,000"
24371,"Deferred income taxes","Recoverability of U.S. Federal Deferred Tax Asset",499858,12/31/22,02/17/23,1,"PricewaterhouseCoopers LLP",,,,"New York",NY,"NEW YORK","US Mid Atlantic",10-K,2023-02-17,,"AMERICAN INTERNATIONAL GROUP, INC.",5272,"=""AIG""","1271 AVE OF THE AMERICAS","FL 37","NEW YORK",NY,"NEW YORK","US Mid Atlantic",,,"=""6331""","Fire, Marine, and Casualty Insurance",524130,"Reinsurance Carriers",34,63,12/31/22,"46,426,259,456",12/31/22,"56,437,000,000","10,276,000,000",,"526,634,000,000"
26092,"Deferred and capitalized costs","Deferred Policy Acquisition Costs (DAC), Deferred Sales Inducements (DSI) and liability for Lifetime Income Benefit Rider (LIBR)",501796,12/31/22,02/28/23,2,"Ernst & Young LLP",,,,"Des Moines",IA,IOWA,"US Midwest",10-K,2023-02-28,,"American National Group Inc.",1039828,"=""AEL.A""","6000 WESTOWN PARKWAY",,"WEST DES MOINES",IA,IOWA,"US Midwest",,,"=""6311""","Life Insurance",524113,"Direct Life Insurance Carriers",34,46,12/31/22,"3,869,043,712",12/31/22,"1,413,825,000","1,920,219,000",,"73,183,599,000"
26093,"Insurance contract liabilities","Fixed Index Annuity Embedded Derivative Liability",501796,12/31/22,02/28/23,2,"Ernst & Young LLP",,,,"Des Moines",IA,IOWA,"US Midwest",10-K,2023-02-28,,"American National Group Inc.",1039828,"=""AEL.A""","6000 WESTOWN PARKWAY",,"WEST DES MOINES",IA,IOWA,"US Midwest",,,"=""6311""","Life Insurance",524113,"Direct Life Insurance Carriers",34,46,12/31/22,"3,869,043,712",12/31/22,"1,413,825,000","1,920,219,000",,"73,183,599,000"
30899,"Insurance contract liabilities","Fixed Index Annuity Embedded Derivative Liability and Market Risk Benefits",515785,12/31/22,02/28/23,2,"Ernst & Young LLP",,,,"Des Moines",IA,IOWA,"US Midwest",8-K,2023-08-09,,"American National Group Inc.",1039828,"=""AEL.A""","6000 WESTOWN PARKWAY",,"WEST DES MOINES",IA,IOWA,"US Midwest",,,"=""6311""","Life Insurance",524113,"Direct Life Insurance Carriers",34,46,12/31/22,"3,869,043,712",12/31/22,"1,413,825,000","1,920,219,000",,"73,183,599,000"
27284,"Goodwill and intangible assets","Goodwill and Intangible Assets — RU Reporting Unit — Refer to Notes 2 and 6 to the financial statements",504906,12/31/22,03/14/23,3,"Deloitte & Touche LLP",,,,McLean,VA,VIRGINIA,"US Mid Atlantic",10-K,2023-03-14,,"AMERICAN PUBLIC EDUCATION INC",1201792,"=""APEI""","111 W CONGRESS STREET",,"CHARLES TOWN",WV,"WEST VIRGINIA","US Mid Atlantic",,,"=""8200""","Services-Educational Services",923110,"Administration of Education Programs",34,12,12/31/22,"232,192,400",12/31/22,"606,328,000","-114,993,000","182,400,000","615,056,000"
27285,"Shareholder valuation","Preferred Stock Equity Raise— Refer to Note 11 to the financial statements",504906,12/31/22,03/14/23,3,"Deloitte & Touche LLP",,,,McLean,VA,VIRGINIA,"US Mid Atlantic",10-K,2023-03-14,,"AMERICAN PUBLIC EDUCATION INC",1201792,"=""APEI""","111 W CONGRESS STREET",,"CHARLES TOWN",WV,"WEST VIRGINIA","US Mid Atlantic",,,"=""8200""","Services-Educational Services",923110,"Administration of Education Programs",34,12,12/31/22,"232,192,400",12/31/22,"606,328,000","-114,993,000","182,400,000","615,056,000"
26461,"Regulatory assets and liabilities","Accounting for the Effects of Rate Regulation",502329,12/31/22,03/01/23,1,"PricewaterhouseCoopers LLP",,,,"Los Angeles",CA,CALIFORNIA,"US West",10-K,2023-03-01,,"AMERICAN STATES WATER CO",1056903,"=""AWR""","630 E FOOTHILL BLVD",,"SAN DIMAS",CA,CALIFORNIA,"US West",,,"=""4941""","Water Supply",221310,"Water Supply and Irrigation Systems",34,93,12/31/22,"3,420,855,296",12/31/22,"491,528,000","78,396,000","708,433,000","2,034,374,000"
27553,"Real estate investments","Impairment Assessment of Real Estate Investments, including Acquired Intangible Assets and Below-Market Lease Liabilities",505306,12/31/22,03/16/23,1,"PricewaterhouseCoopers LLP",,,,"New York",NY,"NEW YORK","US Mid Atlantic",10-K,2023-03-16,,"American Strategic Investment Co.",1595527,"=""NYC""","222 BELLEVUE AVENUE",,NEWPORT,RI,"RHODE ISLAND","US New England",,,"=""6798""","Real Estate Investment Trusts",531120,"Lessors of Nonresidential Buildings (except Miniwarehouses)",34,14,12/31/22,"26,709,980",12/31/22,"64,005,000","-45,896,000","229,214,000","790,455,000"
24772,"Revenue from customer contracts","Revenue Recognition for Significant Contract Modifications - Refer to Notes 1 and 4 to the financial statements.",500563,12/31/22,02/23/23,3,"Deloitte & Touche LLP",,,,Boston,MA,MASSACHUSETTS,"US New England",10-K,2023-02-23,,"AMERICAN TOWER CORP /MA/",1053507,"=""AMT""","116 HUNTINGTON AVE",,BOSTON,MA,MASSACHUSETTS,"US New England",,,"=""6798""","Real Estate Investment Trusts",525930,"Real Estate Investment Trusts",34,212,12/31/22,"98,646,040,576",12/31/22,"10,711,100,000","1,765,800,000","-25,367,600,000","67,194,500,000"
24773,"Long-lived assets","Recoverability of goodwill and long-lived assets – India Reporting Unit - Refer to Notes 1, 3, 5, 16, and 22 to the financial statements.",500563,12/31/22,02/23/23,3,"Deloitte & Touche LLP",,,,Boston,MA,MASSACHUSETTS,"US New England",10-K,2023-02-23,,"AMERICAN TOWER CORP /MA/",1053507,"=""AMT""","116 HUNTINGTON AVE",,BOSTON,MA,MASSACHUSETTS,"US New England",,,"=""6798""","Real Estate Investment Trusts",525930,"Real Estate Investment Trusts",34,212,12/31/22,"98,646,040,576",12/31/22,"10,711,100,000","1,765,800,000","-25,367,600,000","67,194,500,000"
24068,"Regulatory assets and liabilities","Accounting for the Effects of Rate Regulation",499522,12/31/22,02/15/23,1,"PricewaterhouseCoopers LLP",,,,Philadelphia,PA,PENNSYLVANIA,"US Mid Atlantic",10-K,2023-02-15,,"American Water Works Company, Inc.",1410636,"=""AWK""","1 WATER STREET",,CAMDEN,NJ,"NEW JERSEY","US Mid Atlantic",,,"=""4941""","Water Supply",221310,"Water Supply and Irrigation Systems",34,152,12/31/22,"27,718,805,504",12/31/22,"3,792,000,000","820,000,000","6,553,000,000","27,787,000,000"
24920,"Revenue from customer contracts","Revenue Recognition - Platform Subscription and Visits",500690,12/31/22,02/23/23,1,"PricewaterhouseCoopers LLP",,,,Boston,MA,MASSACHUSETTS,"US New England",10-K,2023-02-23,,"American Well Corp",1393584,"=""AMWL""","75 STATE STREET","26TH FLOOR",Boston,MA,MASSACHUSETTS,"US New England",,,"=""7389""","Business Services, NEC",923120,"Administration of Public Health Programs",34,3,12/31/22,"691,068,224",12/31/22,"277,190,000","-270,429,000","493,618,000","1,217,557,000"
21670,Goodwill,"Assessment of goodwill recoverability",489028,04/30/22,06/29/22,4,"KPMG LLP",,,,Richmond,VA,VIRGINIA,"US Mid Atlantic",10-K,2022-06-29,,"AMERICAN WOODMARK CORP",794619,"=""AMWD""","3102 SHAWNEE DRIVE",,WINCHESTER,VA,VIRGINIA,"US Mid Atlantic",,,"=""2430""","Millwood, Veneer, Plywood, & Structural Wood Members",337110,"Wood Kitchen Cabinet and Countertop Manufacturing",34,47,04/30/22,"776,333,504",04/30/22,"1,857,186,000","-29,722,000","-70,840,000","1,632,496,000"
25732,Goodwill,"Test of Goodwill for Impairment",501706,12/31/22,02/27/23,2,"Ernst & Young LLP",,,,Atlanta,GA,GEORGIA,"US Southeast",10-K,2023-02-27,,"AMERICOLD REALTY TRUST",1455863,"=""COLD""","10 Glenlake Pkwy., Suite 800 S. Tower",,Atlanta,GA,GEORGIA,"US Southeast",,,"=""6798""","Real Estate Investment Trusts",525990,"Other Financial Vehicles",34,28,12/31/22,"7,638,461,440",12/31/22,"2,914,735,000","-19,440,000","1,655,854,000","7,945,856,000"
28647,"Deferred income taxes","Deferred tax asset – Refer to Notes 2 and 8 to the consolidated financial statements",507394,12/31/22,03/31/23,3,"Deloitte & Touche LLP",506,"Deloitte Ltd",5230,Hamilton,D0,BERMUDA,Foreign,10-K,2023-03-31,,"AMERINST INSURANCE GROUP LTD",1065201,,"CEDAR MANAGEMENT LIMITED, 25 CHURCH ST.","CONTINENTAL BLDG, , P.O. BOX HM 1601",HAMILTON,D0,BERMUDA,Foreign,,,"=""6399""","Insurance Carriers, NEC",524128,"Other Direct Insurance (except Life, Health, and Medical) Carriers",34,,,,12/31/22,"2,270,789","-1,930,563",,"4,082,455"
31196,"Deferred income taxes","Deferred tax asset – Refer to Notes 2 and 8 to the consolidated financial statements",517109,12/31/22,03/31/23,3,"Deloitte & Touche LLP",506,"Deloitte Ltd",5230,Hamilton,D0,BERMUDA,Foreign,PREM14A,2023-09-15,,"AMERINST INSURANCE GROUP LTD",1065201,,"CEDAR MANAGEMENT LIMITED, 25 CHURCH ST.","CONTINENTAL BLDG, , P.O. BOX HM 1601",HAMILTON,D0,BERMUDA,Foreign,,,"=""6399""","Insurance Carriers, NEC",524128,"Other Direct Insurance (except Life, Health, and Medical) Carriers",34,,,,12/31/22,"2,270,789","-1,930,563",,"4,082,455"
31252,"Deferred income taxes","Deferred tax asset – Refer to Notes 2 and 8 to the consolidated financial statements",517438,12/31/22,03/31/23,3,"Deloitte & Touche LLP",506,"Deloitte Ltd",5230,Hamilton,D0,BERMUDA,Foreign,DEFM14A,2023-09-26,,"AMERINST INSURANCE GROUP LTD",1065201,,"CEDAR MANAGEMENT LIMITED, 25 CHURCH ST.","CONTINENTAL BLDG, , P.O. BOX HM 1601",HAMILTON,D0,BERMUDA,Foreign,,,"=""6399""","Insurance Carriers, NEC",524128,"Other Direct Insurance (except Life, Health, and Medical) Carriers",34,,,,12/31/22,"2,270,789","-1,930,563",,"4,082,455"
25028,"Other investments","Valuation of Certain Level 2 and Level 3 Available-for-Sale Securities",500793,12/31/22,02/23/23,1,"PricewaterhouseCoopers LLP",,,,Minneapolis,MN,MINNESOTA,"US Midwest",10-K,2023-02-23,,"AMERIPRISE CERTIFICATE CO",52428,,"50606 AMERIPRISE FINANCIAL CENTER",,MINNEAPOLIS,MN,MINNESOTA,"US Midwest",820027,"AMERIPRISE FINANCIAL INC",,,525990,"Other Financial Vehicles",34,,,,12/31/22,"159,096,000","130,355,000","414,483,000","9,825,964,000"
25014,"Derivatives and hedging","Valuation of the embedded derivatives in certain variable annuity riders",500865,12/31/22,02/23/23,1,"PricewaterhouseCoopers LLP",,,,Minneapolis,MN,MINNESOTA,"US Midwest",10-K,2023-02-23,,"AMERIPRISE FINANCIAL INC",820027,"=""AMP""","1099 AMERIPRISE FINANCIAL CENTER",,MINNEAPOLIS,MN,MINNESOTA,"US Midwest",,,"=""6282""","Investment Advice",523930,"Investment Advice",34,311,12/31/22,"32,780,720,128",12/31/22,"14,334,000,000","3,149,000,000",,"158,468,000,000"
25015,"Insurance contract liabilities","Valuation of certain guarantees on variable annuity and certain life insurance policies accounted for as insurance liabilities",500865,12/31/22,02/23/23,1,"PricewaterhouseCoopers LLP",,,,Minneapolis,MN,MINNESOTA,"US Midwest",10-K,2023-02-23,,"AMERIPRISE FINANCIAL INC",820027,"=""AMP""","1099 AMERIPRISE FINANCIAL CENTER",,MINNEAPOLIS,MN,MINNESOTA,"US Midwest",,,"=""6282""","Investment Advice",523930,"Investment Advice",34,311,12/31/22,"32,780,720,128",12/31/22,"14,334,000,000","3,149,000,000",,"158,468,000,000"
25982,"Allowance for credit losses","Quantitative component of the allowance for credit losses on loans evaluated on a collective basis",502113,12/31/22,02/28/23,4,"KPMG LLP",,,,Atlanta,GA,GEORGIA,"US Southeast",10-K,2023-02-28,,"Ameris Bancorp",351569,"=""ABCB""","3490 PIEDMONT RD","SUITE 1550",ATLANTA,GA,GEORGIA,"US Southeast",,,"=""6022""","State Commercial Banks",522110,"Commercial Banking",34,47,12/31/22,"3,270,056,960",12/31/22,"1,013,753,000","346,540,000","2,075,560,000","25,053,286,000"
24470,"Insurance contract liabilities","Valuation of Loss and Loss Adjustment Expense reserves",500041,12/31/22,02/21/23,2,"Ernst & Young LLP",,,,"New Orleans",LA,LOUISIANA,"US Southeast",10-K,2023-02-21,,"AMERISAFE INC",1018979,"=""AMSF""","2301 HIGHWAY 190 WEST",,DERIDDER,LA,LOUISIANA,"US Southeast",,,"=""6331""","Fire, Marine, and Casualty Insurance",524126,"Direct Property and Casualty Insurance Carriers",34,52,12/31/22,"995,530,688",12/31/22,"294,737,000","55,602,000",,"1,269,279,000"
24473,"Other intangible assets","Impairment Assessment of Indefinite Lived Intangible Assets (other than Goodwill)",500045,12/31/22,02/21/23,2,"Ernst & Young LLP",,,,Philadelphia,PA,PENNSYLVANIA,"US Mid Atlantic",10-K,2023-02-21,,"AMETEK INC/",1037868,"=""AME""","1100 CASSATT ROAD",,BERWYN,PA,PENNSYLVANIA,"US Mid Atlantic",,,"=""3823""","Industrial Instruments for Measurement, Display, and Control of Process Variables; and Related Products",335312,"Motor and Generator Manufacturing",34,140,12/31/22,"32,142,678,016",12/31/22,"6,150,530,000","1,159,542,000","-1,238,135,000","12,431,120,000"
23733,"Sales return and allowances","Sales deductions",499017,12/31/22,02/09/23,2,"Ernst & Young LLP",,,,"Los Angeles",CA,CALIFORNIA,"US West",10-K,2023-02-09,,"AMGEN INC",318154,"=""AMGN""","ONE AMGEN CENTER DRIVE",,"THOUSAND OAKS",CA,CALIFORNIA,"US West",,,"=""2836""","Biological Products, Except Diagnostic Substances",325414,"Biological Product (except Diagnostic) Manufacturing",34,263,12/31/22,"140,249,759,744",12/31/22,"26,323,000,000","6,552,000,000","-27,948,000,000","65,121,000,000"
23734,"Other income taxes","Unrecognized tax benefits",499017,12/31/22,02/09/23,2,"Ernst & Young LLP",,,,"Los Angeles",CA,CALIFORNIA,"US West",10-K,2023-02-09,,"AMGEN INC",318154,"=""AMGN""","ONE AMGEN CENTER DRIVE",,"THOUSAND OAKS",CA,CALIFORNIA,"US West",,,"=""2836""","Biological Products, Except Diagnostic Substances",325414,"Biological Product (except Diagnostic) Manufacturing",34,263,12/31/22,"140,249,759,744",12/31/22,"26,323,000,000","6,552,000,000","-27,948,000,000","65,121,000,000"
26368,"Business combinations","Fair Value Measurement of the Contingent Consideration",502395,12/31/22,03/01/23,2,"Ernst & Young LLP",,,,Iselin,NJ,"NEW JERSEY","US Mid Atlantic",10-K,2023-03-01,,"AMICUS THERAPEUTICS, INC.",1178879,"=""FOLD""","47 HULFISH STREET",,PRINCETON,NJ,"NEW JERSEY","US Mid Atlantic",,,"=""2834""","Pharmaceutical Preparations",325412,"Pharmaceutical Preparation Manufacturing",34,12,12/31/22,"3,432,332,032",12/31/22,"329,233,000","-236,568,000","-74,750,000","724,167,000"
24637,"Other income taxes","Accounting for Income Taxes",500271,12/31/22,02/22/23,1,"PricewaterhouseCoopers LLP",,,,Phoenix,AZ,ARIZONA,"US Southwest",10-K,2023-02-22,,"AMKOR TECHNOLOGY, INC.",1047127,"=""AMKR""","2045 EAST INNOVATION CIRCLE",,TEMPE,AZ,ARIZONA,"US Southwest",,,"=""3674""","Semiconductors and Related Devices",334515,"Instrument Manufacturing for Measuring and Testing Electricity and Electrical Signals",34,24,12/31/22,"5,877,282,304",12/31/22,"7,091,585,000","765,823,000","3,647,235,000","6,821,757,000"
24692,"Other contingent liabilities","Professional Liability Reserve",500315,12/31/22,02/22/23,4,"KPMG LLP",,,,"San Diego",CA,CALIFORNIA,"US West",10-K,2023-02-22,,"AMN HEALTHCARE SERVICES INC",1142750,"=""AMN""","2999 OLYMPUS BOULEVARD","SUITE 500",DALLAS,TX,TEXAS,"US Southwest",,,"=""7363""","Help Supply Services",561310,"Employment Placement Agencies",34,103,12/31/22,"4,305,998,848",12/31/22,"5,243,242,000","444,050,000","-368,562,000","2,888,351,000"
26686,"Sales return and allowances","Medicaid Rebates",503062,12/31/22,03/03/23,2,"Ernst & Young LLP",,,,Iselin,NJ,"NEW JERSEY","US Mid Atlantic",10-K,2023-03-03,,"Amneal Pharmaceuticals, Inc.",1723128,"=""AMRX""","30831 HUNTWOOD AVE",,HAYWARD,CA,CALIFORNIA,"US West",,,"=""2834""","Pharmaceutical Preparations",325412,"Pharmaceutical Preparation Manufacturing",34,2,12/31/22,"301,465,088",12/31/22,"2,212,304,000","-129,986,000","-1,371,576,000","3,799,341,000"
26687,"Sales return and allowances","Sales Returns",503062,12/31/22,03/03/23,2,"Ernst & Young LLP",,,,Iselin,NJ,"NEW JERSEY","US Mid Atlantic",10-K,2023-03-03,,"Amneal Pharmaceuticals, Inc.",1723128,"=""AMRX""","30831 HUNTWOOD AVE",,HAYWARD,CA,CALIFORNIA,"US West",,,"=""2834""","Pharmaceutical Preparations",325412,"Pharmaceutical Preparation Manufacturing",34,2,12/31/22,"301,465,088",12/31/22,"2,212,304,000","-129,986,000","-1,371,576,000","3,799,341,000"
26688,"Other intangible assets","Impairment of Intangible Assets with Finite Lives",503062,12/31/22,03/03/23,2,"Ernst & Young LLP",,,,Iselin,NJ,"NEW JERSEY","US Mid Atlantic",10-K,2023-03-03,,"Amneal Pharmaceuticals, Inc.",1723128,"=""AMRX""","30831 HUNTWOOD AVE",,HAYWARD,CA,CALIFORNIA,"US West",,,"=""2834""","Pharmaceutical Preparations",325412,"Pharmaceutical Preparation Manufacturing",34,2,12/31/22,"301,465,088",12/31/22,"2,212,304,000","-129,986,000","-1,371,576,000","3,799,341,000"
26689,"Goodwill and intangible assets","Impairment of Goodwill and Other Indefinite-lived Intangible Assets
",503062,12/31/22,03/03/23,2,"Ernst & Young LLP",,,,Iselin,NJ,"NEW JERSEY","US Mid Atlantic",10-K,2023-03-03,,"Amneal Pharmaceuticals, Inc.",1723128,"=""AMRX""","30831 HUNTWOOD AVE",,HAYWARD,CA,CALIFORNIA,"US West",,,"=""2834""","Pharmaceutical Preparations",325412,"Pharmaceutical Preparation Manufacturing",34,2,12/31/22,"301,465,088",12/31/22,"2,212,304,000","-129,986,000","-1,371,576,000","3,799,341,000"
26396,"Sales return and allowances","Provision for chargebacks estimate",502390,12/31/22,03/01/23,2,"Ernst & Young LLP",,,,Irvine,CA,CALIFORNIA,"US West",10-K,2023-03-01,,"Amphastar Pharmaceuticals, Inc.",1297184,"=""AMPH""","11570 SIXTH STREET",,"RANCHO CUCAMONGA",CA,CALIFORNIA,"US West",,,"=""2834""","Pharmaceutical Preparations",325412,"Pharmaceutical Preparation Manufacturing",34,28,12/31/22,"1,348,100,224",12/31/22,"498,987,000","91,386,000","491,360,000","741,987,000"
26397,Inventory,"Enoxaparin inventory lower of cost or net realizable value estimate",502390,12/31/22,03/01/23,2,"Ernst & Young LLP",,,,Irvine,CA,CALIFORNIA,"US West",10-K,2023-03-01,,"Amphastar Pharmaceuticals, Inc.",1297184,"=""AMPH""","11570 SIXTH STREET",,"RANCHO CUCAMONGA",CA,CALIFORNIA,"US West",,,"=""2834""","Pharmaceutical Preparations",325412,"Pharmaceutical Preparation Manufacturing",34,28,12/31/22,"1,348,100,224",12/31/22,"498,987,000","91,386,000","491,360,000","741,987,000"
23711,"Other income taxes","Income Taxes — Unrecognized Tax Benefits — Refer to Notes 1 and 6 to the financial statements",498863,12/31/22,02/08/23,3,"Deloitte & Touche LLP",,,,Hartford,CT,CONNECTICUT,"US New England",10-K,2023-02-08,,"AMPHENOL CORP /DE/",820313,"=""APH""","358 HALL AVE",,WALLINGFORD,CT,CONNECTICUT,"US New England",,,"=""3678""","Electronic Connectors",334417,"Electronic Connector Manufacturing",34,76,12/31/22,"45,288,071,168",12/31/22,"12,623,000,000","1,902,300,000","-144,000,000","15,326,200,000"
27056,"Proven and unproven reserves","Oil and Natural Gas Properties and Depletion – Oil and Natural Gas Reserve Quantities — Refer to Notes 2 and 18 to the financial statements
",504216,12/31/22,03/09/23,3,"Deloitte & Touche LLP",,,,Houston,TX,TEXAS,"US Southwest",10-K,2023-03-09,,"Amplify Energy Corp.",1533924,"=""AMPY""","500 DALLAS STREET","SUITE 1700",,TX,TEXAS,"US Southwest",,,"=""1311""","Crude Petroleum and Natural Gas",211111,"Crude Petroleum and Natural Gas Extraction",34,9,12/31/22,"338,061,024",12/31/22,"458,456,000","57,875,000",,"459,478,000"
24233,"Revenue from customer contracts","Revenue arrangements with non-standard terms and conditions",499743,12/31/22,02/16/23,4,"KPMG LLP",,,,"San Francisco",CA,CALIFORNIA,"US West",10-K,2023-02-16,,"Amplitude, Inc.",1866692,"=""AMPL""","201 THIRD STREET, SUITE 200",,"SAN FRANCISCO",CA,CALIFORNIA,"US West",,,"=""7372""","Prepackaged Software",511210,"Software Publishers",34,12,12/31/22,"922,320,064",12/31/22,"238,067,000","-93,377,000","288,874,000","413,755,000"
22994,"Sales return and allowances","Revenue Recognition – Measuring Price Protection Credits
",494828,10/29/22,11/22/22,2,"Ernst & Young LLP",,,,Boston,MA,MASSACHUSETTS,"US New England",10-K,2022-11-22,,"ANALOG DEVICES INC",6281,"=""ADI""","ONE ANALOG WAY",,WILMINGTON,MA,MASSACHUSETTS,"US New England",,,"=""3674""","Semiconductors and Related Devices",334413,"Semiconductor and Related Device Manufacturing",34,143,10/31/22,"73,355,386,880",10/29/22,"12,013,953,000","2,748,561,000","-3,713,217,000","50,302,350,000"
19006,"Depreciation and amortization","Amortization period for capitalized sales commissions
",480415,01/31/22,03/23/22,4,"KPMG LLP",,,,"San Francisco",CA,CALIFORNIA,"US West",10-K,2022-03-23,,"Anaplan, Inc.",1540755,,"50 HAWTHORNE STREET",,"SAN FRANCISCO",CA,CALIFORNIA,"US West",,,"=""7372""","Prepackaged Software",511210,"Software Publishers",34,48,01/31/22,"7,198,017,024",01/31/22,"592,176,000","-203,599,000","230,322,000","832,635,000"
26466,"Research and development expenses","Evaluation of Research and Development Costs",502325,12/31/22,03/01/23,4,"KPMG LLP",,,,"San Diego",CA,CALIFORNIA,"US West",10-K,2023-03-01,,"ANAPTYSBIO, INC",1370053,"=""ANAB""","10770 WATERIDGE CIRCLE, SUITE 210",,"SAN DIEGO",CA,CALIFORNIA,"US West",,,"=""2834""","Pharmaceutical Preparations",325412,"Pharmaceutical Preparation Manufacturing",34,31,12/31/22,"883,617,856",12/31/22,"10,287,000","-128,724,000",,"610,383,000"
25035,Goodwill,"Goodwill—GSM and FSI Reporting Units—Refer to Notes 1 and 17 to the Consolidated Financial Statements",500863,12/31/22,02/23/23,3,"Deloitte & Touche LLP",,,,Cleveland,OH,OHIO,"US Midwest",10-K,2023-02-23,,"Andersons, Inc.",821026,"=""ANDE""","1947 BRIARFIELD BOULEVARD",,MAUMEE,OH,OHIO,"US Midwest",,,"=""5150""","Wholesale-Farm Product Raw Materials",493130,"Farm Product Warehousing and Storage",34,35,12/31/22,"1,176,293,760",12/31/22,"17,325,384,000","131,080,000","968,352,000","4,607,996,000"
29497,"Other contingent liabilities","Tax Contingencies in Brazil",510120,12/31/22,04/25/23,1,"PricewaterhouseCoopers LLP",93,"PricewaterhouseCoopers Consultores Auditores y Compania Limitada",1364,Santiago,F3,CHILE,Foreign,20-F,2023-04-26,,"ANDINA BOTTLING CO INC",925261,"=""AKO.A""","AVENIDA EL GOLF 40, PISO 4","LAS CONDES",SANTIAGO,F3,CHILE,Foreign,,,"=""2086""","Bottled and Canned Soft Drinks and Carbonated Waters",312111,"Soft Drink Manufacturing",34,10,12/29/22,"826,284,224",12/31/22,"3,118,585,000","150,782,000","63,921,000","3,533,894,000"
29498,"Goodwill and intangible assets","Intangible Assets with Indefinite Useful Life (Distribution Rights) and Goodwill Impairment Assessment",510120,12/31/22,04/25/23,1,"PricewaterhouseCoopers LLP",93,"PricewaterhouseCoopers Consultores Auditores y Compania Limitada",1364,Santiago,F3,CHILE,Foreign,20-F,2023-04-26,,"ANDINA BOTTLING CO INC",925261,"=""AKO.A""","AVENIDA EL GOLF 40, PISO 4","LAS CONDES",SANTIAGO,F3,CHILE,Foreign,,,"=""2086""","Bottled and Canned Soft Drinks and Carbonated Waters",312111,"Soft Drink Manufacturing",34,10,12/29/22,"826,284,224",12/31/22,"3,118,585,000","150,782,000","63,921,000","3,533,894,000"
27722,"Other investments","Assessment of the valuation of residential mortgage loans at fair value",505569,12/31/22,03/20/23,4,"KPMG LLP",,,,Atlanta,GA,GEORGIA,"US Southeast",10-K,2023-03-20,,"Angel Oak Mortgage REIT, Inc.",1766478,"=""AOMD""","3344 PEACHTREE ROAD NE","SUITE 1725",ATLANTA,GA,GEORGIA,"US Southeast",,,"=""6500""","Real Estate",531390,"Other Activities Related to Real Estate",34,5,12/31/22,"117,896,936",12/31/22,"-157,950,000","-187,833,000",,"2,946,212,000"
26322,Goodwill,"Goodwill - Quantitative Impairment Assessment for Angi Services",502471,12/31/22,03/01/23,2,"Ernst & Young LLP",,,,"New York",NY,"NEW YORK","US Mid Atlantic",10-K,2023-03-01,,"Angi Inc.",1705110,"=""ANGI""","555 WEST 18TH STREET",,"NEW YORK",NY,"NEW YORK","US Mid Atlantic",,,"=""7310""",Services-Advertising,541870,"Advertising Material Distribution Services",34,2,12/31/22,"194,107,648",12/31/22,"1,764,355,000","-128,450,000","-12,670,000","1,907,778,000"
21849,Inventory,"Inventories – Excess Quantities and Obsolescence — Refer to Notes 1 & 5",489878,05/31/22,07/22/22,3,"Deloitte & Touche LLP",,,,Boston,MA,MASSACHUSETTS,"US New England",10-K,2022-07-22,,"ANGIODYNAMICS INC",1275187,"=""ANGO""","14 PLAZA DRIVE",,LATHAM,NY,"NEW YORK","US Mid Atlantic",,,"=""3841""","Surgical and Medical Instruments and Apparatus",334510,"Electromedical and Electrotherapeutic Apparatus Manufacturing",34,20,05/31/22,"768,930,112",05/31/22,"316,219,000","-26,547,000","71,051,000","552,751,000"
27673,"Other income taxes","Geita VAT recoverability",505463,12/31/22,03/17/23,2,"Ernst & Young LLP",281,"Ernst & Young Incorporated",1698,Johannesburg,T3,"SOUTH AFRICA",Foreign,20-F,2023-03-17,,"ANGLOGOLD ASHANTI (PTY) LTD",1067428,"=""AU""","76 JEPPE STREET","PO BOX 62117",MARSHALLTOWN,T3,"SOUTH AFRICA",Foreign,,,"=""1040""","Metal Mining",212221,"Gold Ore Mining",34,19,12/31/22,"8,129,221,120",12/31/22,"4,501,000,000","316,000,000","3,994,000,000","8,072,000,000"
27674,"Asset retirement and environmental obligations","Environmental rehabilitation obligations",505463,12/31/22,03/17/23,2,"Ernst & Young LLP",281,"Ernst & Young Incorporated",1698,Johannesburg,T3,"SOUTH AFRICA",Foreign,20-F,2023-03-17,,"ANGLOGOLD ASHANTI (PTY) LTD",1067428,"=""AU""","76 JEPPE STREET","PO BOX 62117",MARSHALLTOWN,T3,"SOUTH AFRICA",Foreign,,,"=""1040""","Metal Mining",212221,"Gold Ore Mining",34,19,12/31/22,"8,129,221,120",12/31/22,"4,501,000,000","316,000,000","3,994,000,000","8,072,000,000"
27675,"Long-lived assets","Impairment assessment of AGA Mineração",505463,12/31/22,03/17/23,2,"Ernst & Young LLP",281,"Ernst & Young Incorporated",1698,Johannesburg,T3,"SOUTH AFRICA",Foreign,20-F,2023-03-17,,"ANGLOGOLD ASHANTI (PTY) LTD",1067428,"=""AU""","76 JEPPE STREET","PO BOX 62117",MARSHALLTOWN,T3,"SOUTH AFRICA",Foreign,,,"=""1040""","Metal Mining",212221,"Gold Ore Mining",34,19,12/31/22,"8,129,221,120",12/31/22,"4,501,000,000","316,000,000","3,994,000,000","8,072,000,000"
27655,"Goodwill and intangible assets","Impairment of goodwill and intangible assets with indefinite useful life",505523,12/31/22,03/14/23,1,"PricewaterhouseCoopers LLP",507,"PricewaterhouseCoopers Reviseurs d’Entreprises",1350,Diegem,C9,BELGIUM,Foreign,20-F,2023-03-17,,"Anheuser-Busch InBev SA/NV",1668717,"=""BUD""","BROUWERIJPLEIN 1",,LEUVEN,C9,BELGIUM,Foreign,,,"=""2082""","Malt Beverages",312120,Breweries,34,60,12/29/22,"104,888,246,272",12/31/22,"57,786,000,000","7,595,000,000","-79,820,000,000","212,943,000,000"
27656,"Uncertain tax positions","Uncertain tax positions",505523,12/31/22,03/14/23,1,"PricewaterhouseCoopers LLP",507,"PricewaterhouseCoopers Reviseurs d’Entreprises",1350,Diegem,C9,BELGIUM,Foreign,20-F,2023-03-17,,"Anheuser-Busch InBev SA/NV",1668717,"=""BUD""","BROUWERIJPLEIN 1",,LEUVEN,C9,BELGIUM,Foreign,,,"=""2082""","Malt Beverages",312120,Breweries,34,60,12/29/22,"104,888,246,272",12/31/22,"57,786,000,000","7,595,000,000","-79,820,000,000","212,943,000,000"
27475,Inventory,"Inventories — Refer to Notes 2 and 5 to the financial statements",505224,12/31/22,03/16/23,3,"Deloitte & Touche LLP",,,,Boston,MA,MASSACHUSETTS,"US New England",10-K,2023-03-16,,"Anika Therapeutics, Inc.",898437,"=""ANIK""","32 WIGGINS AVENUE",,BEDFORD,MA,MASSACHUSETTS,"US New England",,,"=""3841""","Surgical and Medical Instruments and Apparatus",325414,"Biological Product (except Diagnostic) Manufacturing",34,30,12/31/22,"432,900,000",12/31/22,"156,236,000","-14,859,000","203,625,000","349,128,000"
24176,"Other investments","Valuation of mortgage servicing rights",499650,12/31/22,02/16/23,2,"Ernst & Young LLP",,,,"New York",NY,"NEW YORK","US Mid Atlantic",10-K,2023-02-16,,"ANNALY CAPITAL MANAGEMENT INC",1043219,"=""NLY""","1211 AVENUE OF THE AMERICAS",,"NEW YORK",NY,"NEW YORK","US Mid Atlantic",,,"=""6798""","Real Estate Investment Trusts",525990,"Other Financial Vehicles",34,21,12/31/22,"9,871,970,304",12/31/22,"1,934,720,000","1,725,325,000","11,253,764,000","81,850,712,000"
26757,"Other debt","Warrants issued in private placement",503283,12/31/22,03/06/23,4,"KPMG LLP",,,,"San Francisco",CA,CALIFORNIA,"US West",10-K,2023-03-06,,"Annexon, Inc.",1528115,"=""ANNX""","1400 SIERRA POINT PARKWAY","BLDG C, SUITE 200",BRISBANE,CA,CALIFORNIA,"US West",,,"=""2834""","Pharmaceutical Preparations",325412,"Pharmaceutical Preparation Manufacturing",34,5,12/31/22,"246,727,888",12/31/22,,"-141,947,000",,"285,096,000"
24625,"Revenue from customer contracts","Revenue—Time-Based Subscription Lease Licenses—Refer to Notes 2 and 3 to the financial statements",500254,12/31/22,02/22/23,3,"Deloitte & Touche LLP",,,,Pittsburgh,PA,PENNSYLVANIA,"US Mid Atlantic",10-K,2023-02-22,,"ANSYS INC",1013462,"=""ANSS""","2600 ANSYS DRIVE, SOUTHPOINTE",,CANONSBURG,PA,PENNSYLVANIA,"US Mid Atlantic",,,"=""7372""","Prepackaged Software",511210,"Software Publishers",34,242,12/31/22,"21,006,231,552",12/31/22,"2,065,553,000","523,710,000","398,401,000","6,687,945,000"
24087,Leases,"Lease classification for ongoing modifications to the gathering and compression assets  ",499560,12/31/22,02/15/23,4,"KPMG LLP",,,,Denver,CO,COLORADO,"US West",10-K,2023-02-15,,"Antero Midstream Corp",1623925,"=""AM""","1615 WYNKOOP STREET",,DENVER,CO,COLORADO,"US West",,,"=""4922""","Natural Gas Transmission",486210,"Pipeline Transportation of Natural Gas",34,11,12/31/22,"5,162,982,400",12/31/22,"919,985,000","326,242,000","906,215,000","5,791,320,000"
24069,"Proven and unproven reserves","Estimated oil and gas reserves on depletion expense related to proved oil and gas properties  ",499526,12/31/22,02/15/23,4,"KPMG LLP",,,,Denver,CO,COLORADO,"US West",10-K,2023-02-15,,"ANTERO RESOURCES Corp",1433270,"=""AR""","1615 WYNKOOP STREET",,DENVER,CO,COLORADO,"US West",,,"=""1311""","Crude Petroleum and Natural Gas",211111,"Crude Petroleum and Natural Gas Extraction",34,31,12/31/22,"9,215,155,200",12/31/22,"7,138,436,000","1,871,636,000",,"14,118,039,000"
25606,Goodwill,"Annual Goodwill Impairment Assessment—Owned Brokerage Group and Cartus/Leads Group Reporting Units",500925,12/31/22,02/24/23,1,"PricewaterhouseCoopers LLP",,,,"Florham Park",NJ,"NEW JERSEY","US Mid Atlantic",10-K,2023-02-24,,"Anywhere Real Estate Group LLC",1355001,,"175 PARK AVENUE",,MADISON,NJ,"NEW JERSEY","US Mid Atlantic",1398987,"Anywhere Real Estate Inc.","=""6531""","Real Estate Agents and Managers",531210,"Offices of Real Estate Agents and Brokers",34,,,,12/31/22,"6,908,000,000","-287,000,000","-2,474,000,000","6,383,000,000"
25607,"Other intangible assets","Annual Indefinite-Lived Asset Impairment Assessment—Franchise Trademarks Intangible Asset",500925,12/31/22,02/24/23,1,"PricewaterhouseCoopers LLP",,,,"Florham Park",NJ,"NEW JERSEY","US Mid Atlantic",10-K,2023-02-24,,"Anywhere Real Estate Group LLC",1355001,,"175 PARK AVENUE",,MADISON,NJ,"NEW JERSEY","US Mid Atlantic",1398987,"Anywhere Real Estate Inc.","=""6531""","Real Estate Agents and Managers",531210,"Offices of Real Estate Agents and Brokers",34,,,,12/31/22,"6,908,000,000","-287,000,000","-2,474,000,000","6,383,000,000"
25563,Goodwill,"Annual Goodwill Impairment Assessment—Owned Brokerage Group and Cartus/Leads Group Reporting Units",500942,12/31/22,02/24/23,1,"PricewaterhouseCoopers LLP",,,,"Florham Park",NJ,"NEW JERSEY","US Mid Atlantic",10-K,2023-02-24,,"Anywhere Real Estate Inc.",1398987,"=""HOUS""","175 PARK AVENUE",,MADISON,NJ,"NEW JERSEY","US Mid Atlantic",,,"=""6531""","Real Estate Agents and Managers",531210,"Offices of Real Estate Agents and Brokers",34,6,12/31/22,"699,579,456",12/31/22,"6,908,000,000","-287,000,000","-2,474,000,000","6,383,000,000"
25564,"Other intangible assets","Annual Indefinite-Lived Asset Impairment Assessment—Franchise Trademarks Intangible Asset",500942,12/31/22,02/24/23,1,"PricewaterhouseCoopers LLP",,,,"Florham Park",NJ,"NEW JERSEY","US Mid Atlantic",10-K,2023-02-24,,"Anywhere Real Estate Inc.",1398987,"=""HOUS""","175 PARK AVENUE",,MADISON,NJ,"NEW JERSEY","US Mid Atlantic",,,"=""6531""","Real Estate Agents and Managers",531210,"Offices of Real Estate Agents and Brokers",34,6,12/31/22,"699,579,456",12/31/22,"6,908,000,000","-287,000,000","-2,474,000,000","6,383,000,000"
24315,"Deferred income taxes","Realizability of Deferred Tax Assets",499889,12/31/22,02/17/23,2,"Ernst & Young LLP",,,,Chicago,IL,ILLINOIS,"US Midwest",10-K,2023-02-17,,"Aon plc",315293,"=""AON""","15 GEORGES QUAY",,"DUBLIN 2",L2,IRELAND,Foreign,,,"=""6411""","Insurance Agents, Brokers, and Service",524210,"Insurance Agencies and Brokerages",34,300,12/31/22,"61,648,756,736",12/31/22,"12,479,000,000","2,589,000,000","-9,268,000,000","32,704,000,000"
25008,"Proven and unproven reserves","Depreciation, depletion and amortization of property and equipment",500781,12/31/22,02/23/23,2,"Ernst & Young LLP",,,,Houston,TX,TEXAS,"US Southwest",10-K,2023-02-23,,"APA Corp",1841666,"=""APA""","2000 W SAM HOUSTON PKWY S","SUITE 200",HOUSTON,TX,TEXAS,"US Southwest",,,"=""1311""","Crude Petroleum and Natural Gas",211111,"Crude Petroleum and Natural Gas Extraction",34,47,12/31/22,"14,543,581,184",12/31/22,"11,075,000,000","3,604,000,000",,"13,147,000,000"
25009,"Asset retirement and environmental obligations","Accounting for asset retirement obligation for the North Sea segment",500781,12/31/22,02/23/23,2,"Ernst & Young LLP",,,,Houston,TX,TEXAS,"US Southwest",10-K,2023-02-23,,"APA Corp",1841666,"=""APA""","2000 W SAM HOUSTON PKWY S","SUITE 200",HOUSTON,TX,TEXAS,"US Southwest",,,"=""1311""","Crude Petroleum and Natural Gas",211111,"Crude Petroleum and Natural Gas Extraction",34,47,12/31/22,"14,543,581,184",12/31/22,"11,075,000,000","3,604,000,000",,"13,147,000,000"
25010,"Other contingent liabilities","Accounting for decommissioning contingency for sold Gulf of Mexico properties",500781,12/31/22,02/23/23,2,"Ernst & Young LLP",,,,Houston,TX,TEXAS,"US Southwest",10-K,2023-02-23,,"APA Corp",1841666,"=""APA""","2000 W SAM HOUSTON PKWY S","SUITE 200",HOUSTON,TX,TEXAS,"US Southwest",,,"=""1311""","Crude Petroleum and Natural Gas",211111,"Crude Petroleum and Natural Gas Extraction",34,47,12/31/22,"14,543,581,184",12/31/22,"11,075,000,000","3,604,000,000",,"13,147,000,000"
24923,"Proven and unproven reserves","Depreciation, depletion and amortization of property and equipment",500715,12/31/22,02/23/23,2,"Ernst & Young LLP",,,,Houston,TX,TEXAS,"US Southwest",10-K,2023-02-23,,"APACHE CORP",6769,,"2000 W SAM HOUSTON PKWY S","SUITE 200",HOUSTON,TX,TEXAS,"US Southwest",1841666,"APA Corp","=""1311""","Crude Petroleum and Natural Gas",211111,"Crude Petroleum and Natural Gas Extraction",34,,,,12/31/22,"10,883,000,000","3,466,000,000",,"14,255,000,000"
24924,"Asset retirement and environmental obligations","Accounting for asset retirement obligation for the North Sea segment",500715,12/31/22,02/23/23,2,"Ernst & Young LLP",,,,Houston,TX,TEXAS,"US Southwest",10-K,2023-02-23,,"APACHE CORP",6769,,"2000 W SAM HOUSTON PKWY S","SUITE 200",HOUSTON,TX,TEXAS,"US Southwest",1841666,"APA Corp","=""1311""","Crude Petroleum and Natural Gas",211111,"Crude Petroleum and Natural Gas Extraction",34,,,,12/31/22,"10,883,000,000","3,466,000,000",,"14,255,000,000"
24925,"Other contingent liabilities","Accounting for decommissioning contingency for sold Gulf of Mexico properties",500715,12/31/22,02/23/23,2,"Ernst & Young LLP",,,,Houston,TX,TEXAS,"US Southwest",10-K,2023-02-23,,"APACHE CORP",6769,,"2000 W SAM HOUSTON PKWY S","SUITE 200",HOUSTON,TX,TEXAS,"US Southwest",1841666,"APA Corp","=""1311""","Crude Petroleum and Natural Gas",211111,"Crude Petroleum and Natural Gas Extraction",34,,,,12/31/22,"10,883,000,000","3,466,000,000",,"14,255,000,000"
26239,"Business combinations","Real Estate— Refer to Notes 2 and 3 to the financial statements",502552,12/31/22,02/28/23,3,"Deloitte & Touche LLP",,,,Denver,CO,COLORADO,"US West",10-K,2023-03-01,,"Apartment Income REIT Corp.",1820877,,"4582 S. ULSTER STREET, SUITE 1700",,DENVER,CO,COLORADO,"US West",,,"=""6798""","Real Estate Investment Trusts",525990,"Other Financial Vehicles",34,34,12/31/22,"5,115,159,552",12/31/22,"773,723,000","904,432,000","2,201,274,000","6,551,883,000"
26477,"Real estate investments","Real Estate— Refer to Notes 2 and 3 to the financial statements",502719,12/31/22,02/28/23,3,"Deloitte & Touche LLP",,,,Denver,CO,COLORADO,"US West",10-K,2023-03-01,,"Apartment Income REIT, L.P.",926660,,"345 PARK AVENUE",,"NEW YORK",NY,"NEW YORK","US Mid Atlantic",922864,"APARTMENT INVESTMENT & MANAGEMENT CO","=""6513""","Operators of Apartment Buildings",531110,"Lessors of Residential Buildings and Dwellings",34,,,,12/31/22,"773,723,000","969,592,000","2,442,948,000","6,551,883,000"
25741,"Other investments","Impairment of mezzanine investment",501671,12/31/22,02/27/23,2,"Ernst & Young LLP",,,,Denver,CO,COLORADO,"US West",10-K,2023-02-27,,"APARTMENT INVESTMENT & MANAGEMENT CO",922864,"=""AIV""","4582 SOUTH ULSTER STREET","SUITE 1450",DENVER,CO,COLORADO,"US West",,,"=""6798""","Real Estate Investment Trusts",525990,"Other Financial Vehicles",34,7,12/31/22,"1,043,257,600",12/31/22,"190,344,000","75,726,000",,"2,181,223,000"
24502,"Research and development expenses","Accrued and Prepaid Research and Development Expenses — Refer to Notes 2 and 7 to the financial statements",500102,12/31/22,02/21/23,3,"Deloitte & Touche LLP",,,,Boston,MA,MASSACHUSETTS,"US New England",10-K,2023-02-21,Yes,"Apellis Pharmaceuticals, Inc.",1492422,"=""APLS""","100 FIFTH AVENUE",,WALTHAM,MA,MASSACHUSETTS,"US New England",,,"=""2834""","Pharmaceutical Preparations",325412,"Pharmaceutical Preparation Manufacturing",34,52,12/31/22,"5,728,019,968",12/31/22,"75,422,000","-652,172,000",,"760,217,000"
26234,"Revenue from customer contracts","Total estimated costs for certain fixed price projects recognized over time",502538,12/31/22,03/01/23,4,"KPMG LLP",,,,Minneapolis,MN,MINNESOTA,"US Midwest",10-K,2023-03-01,,"APi Group Corp",1796209,"=""APG""","C/O API GROUP, INC.","1100 OLD HIGHWAY 8 NW","NEW BRIGHTON",MN,MINNESOTA,"US Midwest",,,"=""7340""","Services-To Dwellings & Other Buildings",238910,"Site Preparation Contractors",34,19,12/31/22,"4,390,327,808",12/31/22,"6,558,000,000","73,000,000","-1,236,000,000","8,091,000,000"
26235,"Business combinations","Fair value measurement of certain acquired intangible assets",502538,12/31/22,03/01/23,4,"KPMG LLP",,,,Minneapolis,MN,MINNESOTA,"US Midwest",10-K,2023-03-01,,"APi Group Corp",1796209,"=""APG""","C/O API GROUP, INC.","1100 OLD HIGHWAY 8 NW","NEW BRIGHTON",MN,MINNESOTA,"US Midwest",,,"=""7340""","Services-To Dwellings & Other Buildings",238910,"Site Preparation Contractors",34,19,12/31/22,"4,390,327,808",12/31/22,"6,558,000,000","73,000,000","-1,236,000,000","8,091,000,000"
20505,"Revenue from customer contracts","Net Sales — Revenue Recognition for Long-Term Contracts in the Architectural Services Segment — Refer to Notes 1, 2, and 15 to the consolidated financial statements",484534,02/26/22,04/22/22,3,"Deloitte & Touche LLP",,,,Minneapolis,MN,MINNESOTA,"US Midwest",10-K,2022-04-22,,"APOGEE ENTERPRISES, INC.",6845,"=""APOG""","4400 WEST 78TH STREET","SUITE 520",MINNEAPOLIS,MN,MINNESOTA,"US Midwest",,,"=""3231""","Glass Products, Made of Purchased Glass",327215,"Glass Product Manufacturing Made of Purchased Glass",34,45,02/28/22,"1,068,226,176",02/26/22,"1,313,977,000","3,486,000","183,616,000","887,863,000"
20506,Goodwill,"Goodwill — Window and Wall Systems Reporting Unit — Refer to Notes 1 and 6 to the consolidated financial statements",484534,02/26/22,04/22/22,3,"Deloitte & Touche LLP",,,,Minneapolis,MN,MINNESOTA,"US Midwest",10-K,2022-04-22,,"APOGEE ENTERPRISES, INC.",6845,"=""APOG""","4400 WEST 78TH STREET","SUITE 520",MINNEAPOLIS,MN,MINNESOTA,"US Midwest",,,"=""3231""","Glass Products, Made of Purchased Glass",327215,"Glass Product Manufacturing Made of Purchased Glass",34,45,02/28/22,"1,068,226,176",02/26/22,"1,313,977,000","3,486,000","183,616,000","887,863,000"
26559,"Other revenue","Performance Allocations— Refer to Note 2 in the consolidated financial statements",502285,12/31/22,02/28/23,3,"Deloitte & Touche LLP",,,,"New York",NY,"NEW YORK","US Mid Atlantic",10-K,2023-03-01,,"Apollo Asset Management, Inc.",1411494,,"9 WEST 57TH STREET, 42ND FLOOR",,"new York",NY,"NEW YORK","US Mid Atlantic",1858681,"Apollo Global Management, Inc.","=""6282""","Investment Advice",541611,"Administrative Management and General Management Consulting Services",34,,,,12/31/22,"3,420,847,000","933,867,000","2,616,421,000","13,793,947,000"
23692,"Allowance for credit losses","Current Expected Credit Losses (“CECL”) Allowance—Estimation of Economic Conditions—Refer to Notes 2 and 4 to the Financial Statements",498844,12/31/22,02/08/23,3,"Deloitte & Touche LLP",,,,"New York",NY,"NEW YORK","US Mid Atlantic",10-K,2023-02-08,,"Apollo Commercial Real Estate Finance, Inc.",1467760,"=""ARI""","C/O APOLLO GLOBAL MANAGEMENT, LLC","9 WEST 57TH STREET, 43RD FLOOR","NEW YORK",NY,"NEW YORK","US Mid Atlantic",,,"=""6798""","Real Estate Investment Trusts",525990,"Other Financial Vehicles",34,11,12/31/22,"1,512,812,928",12/31/22,"62,062,000","265,232,000",,"9,568,352,000"
23693,"Allowance for credit losses","CECL Allowance—Estimation of Fair Value of Underlying Collateral of Loans Exhibiting Signs of Financial Difficulty — Refer to Notes 2 and 4 to the financial statements",498844,12/31/22,02/08/23,3,"Deloitte & Touche LLP",,,,"New York",NY,"NEW YORK","US Mid Atlantic",10-K,2023-02-08,,"Apollo Commercial Real Estate Finance, Inc.",1467760,"=""ARI""","C/O APOLLO GLOBAL MANAGEMENT, LLC","9 WEST 57TH STREET, 43RD FLOOR","NEW YORK",NY,"NEW YORK","US Mid Atlantic",,,"=""6798""","Real Estate Investment Trusts",525990,"Other Financial Vehicles",34,11,12/31/22,"1,512,812,928",12/31/22,"62,062,000","265,232,000",,"9,568,352,000"
27570,"Other investments","Fair Value of Investments — Refer to Notes 2 and 4 to the financial statements",505408,12/31/22,03/16/23,3,"Deloitte & Touche LLP",,,,"New York",NY,"NEW YORK","US Mid Atlantic",10-K,2023-03-16,,"Apollo Debt Solutions BDC",1837532,,"9 WEST 57TH STREET",,"NEW YORK",NY,"NEW YORK","US Mid Atlantic",,,,,525990,"Other Financial Vehicles",34,,,,12/31/22,"252,301,000","147,863,000","2,154,933,000","4,506,220,000"
29833,"Other investments","Fair Value of Investments—Refer to Notes 2 and 4 to the financial statements",511769,12/31/22,03/16/23,3,"Deloitte & Touche LLP",,,,"New York",NY,"NEW YORK","US Mid Atlantic",486BPOS,2023-05-09,,"Apollo Debt Solutions BDC",1837532,,"9 WEST 57TH STREET",,"NEW YORK",NY,"NEW YORK","US Mid Atlantic",,,,,525990,"Other Financial Vehicles",34,,,,12/31/22,"252,301,000","147,863,000","2,154,933,000","4,506,220,000"
26246,"Other investments","Performance Allocations— Refer to Note 2, Summary of Significant Accounting Policies",502586,12/31/22,02/28/23,3,"Deloitte & Touche LLP",,,,"New York",NY,"NEW YORK","US Mid Atlantic",10-K,2023-03-01,,"Apollo Global Management, Inc.",1858681,"=""APO""","9 WEST 57TH STREET, 42ND FLOOR",,"NEW YORK",NY,"NEW YORK","US Mid Atlantic",,,"=""6282""","Investment Advice",0,,34,64,12/29/22,"36,380,069,888",12/31/22,"-2,837,000,000","-3,213,000,000","-2,893,000,000","259,333,000,000"
26247,"Other investments","Valuation of Certain Structured Level 3 Asset-Backed Securities - Refer to Note 4, Investments, Note 7, Fair Value, and Note 17, Related Parties",502586,12/31/22,02/28/23,3,"Deloitte & Touche LLP",,,,"New York",NY,"NEW YORK","US Mid Atlantic",10-K,2023-03-01,,"Apollo Global Management, Inc.",1858681,"=""APO""","9 WEST 57TH STREET, 42ND FLOOR",,"NEW YORK",NY,"NEW YORK","US Mid Atlantic",,,"=""6282""","Investment Advice",0,,34,64,12/29/22,"36,380,069,888",12/31/22,"-2,837,000,000","-3,213,000,000","-2,893,000,000","259,333,000,000"
26248,"Derivatives and hedging","Certain Assumptions Used in the Valuation of Value of Business Acquired (VOBA), Future Policy Benefits, and Interest Sensitive Contract Liabilities - Refer to Note 2 , Summary of Significant Accounting Policies, Note 7, Fair Value, and Note 9, Deferred Acquisition Costs, Deferred Sales Inducements and Value of Business Acquired",502586,12/31/22,02/28/23,3,"Deloitte & Touche LLP",,,,"New York",NY,"NEW YORK","US Mid Atlantic",10-K,2023-03-01,,"Apollo Global Management, Inc.",1858681,"=""APO""","9 WEST 57TH STREET, 42ND FLOOR",,"NEW YORK",NY,"NEW YORK","US Mid Atlantic",,,"=""6282""","Investment Advice",0,,34,64,12/29/22,"36,380,069,888",12/31/22,"-2,837,000,000","-3,213,000,000","-2,893,000,000","259,333,000,000"
24937,"Regulatory assets and liabilities","Accounting for the Effects of Cost-Based Regulation",500716,12/31/22,02/23/23,1,"PricewaterhouseCoopers LLP",,,,Columbus,OH,OHIO,"US Midwest",10-K,2023-02-23,,"APPALACHIAN POWER CO",6879,,"1 RIVERSIDE PLAZA",,COLUMBUS,OH,OHIO,"US Midwest",4904,"AMERICAN ELECTRIC POWER CO INC","=""4911""","Electric Services",221122,"Electric Power Distribution",34,,,,12/31/22,"3,519,900,000","394,200,000",,"15,222,200,000"
30141,"Regulatory assets and liabilities","Accounting for the Effects of Cost-Based Regulation",512584,12/31/22,02/23/23,1,"PricewaterhouseCoopers LLP",,,,Columbus,OH,OHIO,"US Midwest",8-K,2023-05-26,,"APPALACHIAN POWER CO",6879,,"1 RIVERSIDE PLAZA",,COLUMBUS,OH,OHIO,"US Midwest",4904,"AMERICAN ELECTRIC POWER CO INC","=""4911""","Electric Services",221122,"Electric Power Distribution",34,,,,12/31/22,"3,519,900,000","394,200,000",,"15,222,200,000"
23768,"Long-lived assets","Impairment of Long-Lived Assets",498984,12/31/22,02/09/23,1,"PricewaterhouseCoopers LLP",,,,"Los Angeles",CA,CALIFORNIA,"US West",10-K,2023-02-09,,"APPFOLIO INC",1433195,"=""APPF""","70 CASTILIAN DRIVE",,"SANTA BARBARA",CA,CALIFORNIA,"US West",,,"=""7372""","Prepackaged Software",511210,"Software Publishers",34,105,12/31/22,"2,167,561,216",12/31/22,"471,883,000","-68,119,000","169,338,000","381,217,000"
27420,"Long-lived assets","Impairment of Long-lived Assets",505164,12/31/22,03/15/23,2,"Ernst & Young LLP",,,,Louisville,KY,KENTUCKY,"US Mid Atlantic",10-K,2023-03-15,Yes,"AppHarvest, Inc.",1807707,,"1890 STAR SHOOT PKWY","STE 170 PMB 168",LEXINGTON,KY,KENTUCKY,"US Mid Atlantic",,,"=""0100""","Agricultural production- crops",111419,"Other Food Crops Grown Under Cover",34,1,12/29/22,"60,879,536",12/31/22,"14,592,000","-176,646,000",,"595,328,000"
24508,"Real estate investments","Investments in Real Estate – Impairment Analysis ",500089,12/31/22,02/21/23,2,"Ernst & Young LLP",,,,Richmond,VA,VIRGINIA,"US Mid Atlantic",10-K,2023-02-21,,"Apple Hospitality REIT, Inc.",1418121,"=""APLE""","814 EAST MAIN STREET",,RICHMOND,VA,VIRGINIA,"US Mid Atlantic",,,"=""6798""","Real Estate Investment Trusts",525990,"Other Financial Vehicles",34,16,12/31/22,"3,608,015,872",12/31/22,"1,238,417,000","144,805,000",,"4,772,714,000"
22712,"Uncertain tax positions","Uncertain Tax Positions",493711,09/24/22,10/27/22,2,"Ernst & Young LLP",,,,"San Jose",CA,CALIFORNIA,"US West",10-K,2022-10-28,,"Apple Inc.",320193,"=""AAPL""","ONE APPLE PARK WAY",,CUPERTINO,CA,CALIFORNIA,"US West",,,"=""3571""","Electronic Computers",334111,"Electronic Computer Manufacturing",34,138,09/30/22,"2,203,381,399,552",09/24/22,"394,328,000,000","99,803,000,000",,"352,755,000,000"
22491,"Research and development expenses","Accrued Research and Development Expenses",492482,06/30/22,09/27/22,2,"Ernst & Young LLP",,,,Tampa,FL,FLORIDA,"US Southeast",10-K,2022-09-27,Yes,"APPLIED GENETIC TECHNOLOGIES CORP",1273636,,"14193 NW 119TH TERRACE","SUITE #10",ALACHUA,FL,FLORIDA,"US Southeast",,,"=""2836""","Biological Products, Except Diagnostic Substances",325412,"Pharmaceutical Preparation Manufacturing",34,1,06/30/22,"39,236,888",06/30/22,"325,000","-68,943,000","28,044,000","66,684,000"
22052,Goodwill,"Goodwill - Fluid Power & Flow Control Segment - Refer to Notes 1 and 5 to the financial statements",490759,06/30/22,08/12/22,3,"Deloitte & Touche LLP",,,,Cleveland,OH,OHIO,"US Midwest",10-K,2022-08-12,,"APPLIED INDUSTRIAL TECHNOLOGIES INC",109563,"=""AIT""","ONE APPLIED PLAZA",,CLEVELAND,OH,OHIO,"US Midwest",,,"=""5080""","Wholesale-Machinery, Equipment & Supplies",423830,"Industrial Machinery and Equipment Merchant Wholesalers",34,96,06/30/22,"3,702,448,896",06/30/22,"3,810,676,000","257,414,000","335,560,000","2,452,588,000"
23222,Inventory,"Evaluation of net realizable value adjustments to inventories for excess or obsolescence",495933,10/30/22,12/16/22,4,"KPMG LLP",,,,"Santa Clara",CA,CALIFORNIA,"US West",10-K,2022-12-16,,"APPLIED MATERIALS INC /DE",6951,"=""AMAT""","3050 BOWERS AVE",,"SANTA CLARA",CA,CALIFORNIA,"US West",,,"=""3674""","Semiconductors and Related Devices",333295,"Semiconductor Machinery Manufacturing",34,88,10/31/22,"74,516,758,528",10/30/22,"25,785,000,000","6,525,000,000","8,155,000,000","26,726,000,000"
27085,"Research and development expenses","Accrued and Prepaid Expenses - Accrued and Prepaid Research and Development Expenses - Refer to Note 2 and Note 4 to the financial statements",504317,12/31/22,03/09/23,3,"Deloitte & Touche LLP",,,,"San Francisco",CA,CALIFORNIA,"US West",10-K,2023-03-09,Yes,"Applied Molecular Transport Inc.",1801777,,"C/O THE CORPORATION TRUST COMPANY","CORPORATION TRUST CENTER, 1209 ORANGE ST",WILMINGTON,DE,DELAWARE,"US Mid Atlantic",,,"=""2834""","Pharmaceutical Preparations",325412,"Pharmaceutical Preparation Manufacturing",34,0,12/31/22,"16,456,356",12/31/22,"898,000","-126,325,000","60,838,000","107,446,000"
25901,"Business combinations","Acquisitions and Dispositions—Acquisitions of MoPub and Wurl—Forecasted Revenue—Refer to Notes 2 and 6 to the financial statements",502035,12/31/22,02/28/23,3,"Deloitte & Touche LLP",,,,"San Jose",CA,CALIFORNIA,"US West",10-K,2023-02-28,,"AppLovin Corp",1751008,"=""APP""","1100 PAGE MILL RD",,"PALO ALTO",CA,CALIFORNIA,"US West",,,"=""7370""","Services-Computer Programming, Data Processing, Etc.",541511,"Custom Computer Programming Services",34,11,12/31/22,"3,187,547,392",12/31/22,"2,817,058,000","-192,746,000","-1,598,738,000","5,847,846,000"
24419,"Revenue from customer contracts","Revenue Recognition – Product Sales",499847,12/31/22,02/17/23,1,"PricewaterhouseCoopers LLP",,,,Chicago,IL,ILLINOIS,"US Midwest",10-K,2023-02-17,,"APTARGROUP, INC.",896622,"=""ATR""","265 EXCHANGE DRIVE","SUITE 301","CRYSTAL LAKE",IL,ILLINOIS,"US Midwest",,,"=""3089""","Plastics Products, NEC",326199,"All Other Plastics Product Manufacturing",34,110,12/31/22,"7,170,696,192",12/31/22,"3,322,249,000","239,288,000","792,559,000","4,203,458,000"
23685,"Uncertain tax positions","Uncertain Tax Positions",498835,12/31/22,02/08/23,2,"Ernst & Young LLP",,,,Detroit,MI,MICHIGAN,"US Midwest",10-K,2023-02-08,,"Aptiv PLC",1521332,"=""APTV""","SPITALSTRASSE 5",,SCHAFFHAUSEN,V8,SWITZERLAND,Foreign,,,"=""3714""","Motor Vehicle Parts and Accessories",423120,"Motor Vehicle Supplies and New Parts Merchant Wholesalers",34,93,12/31/22,"25,233,534,976",12/31/22,"17,489,000,000","594,000,000","1,214,000,000","21,884,000,000"
23686,"Revenue from customer contracts","Revenue Recognition",498835,12/31/22,02/08/23,2,"Ernst & Young LLP",,,,Detroit,MI,MICHIGAN,"US Midwest",10-K,2023-02-08,,"Aptiv PLC",1521332,"=""APTV""","SPITALSTRASSE 5",,SCHAFFHAUSEN,V8,SWITZERLAND,Foreign,,,"=""3714""","Motor Vehicle Parts and Accessories",423120,"Motor Vehicle Supplies and New Parts Merchant Wholesalers",34,93,12/31/22,"25,233,534,976",12/31/22,"17,489,000,000","594,000,000","1,214,000,000","21,884,000,000"
23687,"Business combinations","Acquisition of Wind River - Valuation of Intangible Assets",498835,12/31/22,02/08/23,2,"Ernst & Young LLP",,,,Detroit,MI,MICHIGAN,"US Midwest",10-K,2023-02-08,,"Aptiv PLC",1521332,"=""APTV""","SPITALSTRASSE 5",,SCHAFFHAUSEN,V8,SWITZERLAND,Foreign,,,"=""3714""","Motor Vehicle Parts and Accessories",423120,"Motor Vehicle Supplies and New Parts Merchant Wholesalers",34,93,12/31/22,"25,233,534,976",12/31/22,"17,489,000,000","594,000,000","1,214,000,000","21,884,000,000"
27953,"Research and development expenses","Research and Development Prepaid and Accrued Costs",506104,12/31/22,03/23/23,4,"KPMG LLP",187,"KPMG LLP Chartered Accountants",85,Vaughan,A6,ONTARIO,Canada,10-K,2023-03-24,Yes,"Aptose Biosciences Inc.",882361,"=""APTOF""","66 WELLINGTON STREET WEST, SUITE 5300","TD BANK TOWER BOX 48",TORONTO,A6,ONTARIO,Canada,,,"=""2836""","Biological Products, Except Diagnostic Substances",325414,"Biological Product (except Diagnostic) Manufacturing",34,1,12/31/22,"53,573,020",12/31/22,,"-41,823,000",,"51,027,000"
32188,"Research and development expenses","Research and Development Prepaid and Accrued Costs",523283,12/31/22,03/23/23,4,"KPMG LLP",187,"KPMG LLP Chartered Accountants",85,Vaughan,A6,ONTARIO,Canada,S-1/A,2024-01-22,Yes,"Aptose Biosciences Inc.",882361,"=""APTOF""","66 WELLINGTON STREET WEST, SUITE 5300","TD BANK TOWER BOX 48",TORONTO,A6,ONTARIO,Canada,,,"=""2836""","Biological Products, Except Diagnostic Substances",325414,"Biological Product (except Diagnostic) Manufacturing",34,1,12/31/22,"53,573,020",12/31/22,,"-41,823,000",,"51,027,000"
32228,"Research and development expenses","Research and Development Prepaid and Accrued Costs",523527,12/31/22,03/23/23,4,"KPMG LLP",187,"KPMG LLP Chartered Accountants",85,Vaughan,A6,ONTARIO,Canada,424B4,2024-01-26,Yes,"Aptose Biosciences Inc.",882361,"=""APTOF""","66 WELLINGTON STREET WEST, SUITE 5300","TD BANK TOWER BOX 48",TORONTO,A6,ONTARIO,Canada,,,"=""2836""","Biological Products, Except Diagnostic Substances",325414,"Biological Product (except Diagnostic) Manufacturing",34,1,12/31/22,"53,573,020",12/31/22,,"-41,823,000",,"51,027,000"
26880,Inventory,"Inventory – Fish in Process – Refer to Notes 2 and 5 to the financial statements ",503652,12/31/22,03/07/23,3,"Deloitte & Touche LLP",,,,Baltimore,MD,MARYLAND,"US Mid Atlantic",10-K,2023-03-07,,"AQUABOUNTY TECHNOLOGIES INC",1603978,"=""AQB""","233 AYER ROAD SUITE 4","SUITE 4",HARVARD,MA,MASSACHUSETTS,"US New England",,,"=""0900""","Fishing, hunting, and trapping",112519,"Other Animal Aquaculture",34,1,12/31/22,"54,044,140",12/31/22,"3,136,954","-22,157,195","191,702,904","213,840,772"
22985,Goodwill,"Goodwill - FSS US Reporting Unit",494822,09/30/22,11/22/22,3,"Deloitte & Touche LLP",,,,Philadelphia,PA,PENNSYLVANIA,"US Mid Atlantic",10-K,2022-11-22,,Aramark,1584509,"=""ARMK""","2400 MARKET STREET",,PHILADELPHIA,PA,PENNSYLVANIA,"US Mid Atlantic",,,"=""5812""","Eating and Drinking Places",722310,"Food Service Contractors",34,31,09/30/22,"5,826,575,872",09/30/22,"13,687,269,000","194,484,000","-4,590,370,000","15,082,436,000"
29286,"Property, plant and equipment","Valuation of Biological Assets",509452,12/31/22,04/13/23,1,"PricewaterhouseCoopers LLP",93,"PricewaterhouseCoopers Consultores Auditores y Compania Limitada",1364,Santiago,F3,CHILE,Foreign,20-F,2023-04-20,,"ARAUCO & CONSTITUTION PULP INC",1004156,,"EL GOLF NO 150","14TH FL.",SANTIAGO,F3,CHILE,Foreign,,,"=""2611""","Pulp Mills",322110,"Pulp Mills",34,,,,12/31/22,"7,102,070,000","704,226,000","8,259,984,000","17,180,108,000"
30626,"Property, plant and equipment","Valuation of Biological Assets",514602,12/31/22,04/13/23,1,"PricewaterhouseCoopers LLP",93,"PricewaterhouseCoopers Consultores Auditores y Compania Limitada",1364,Santiago,F3,CHILE,Foreign,20-F/A,2023-07-12,,"ARAUCO & CONSTITUTION PULP INC",1004156,,"EL GOLF NO 150","14TH FL.",SANTIAGO,F3,CHILE,Foreign,,,"=""2611""","Pulp Mills",322110,"Pulp Mills",34,,,,12/31/22,"7,102,070,000","704,226,000","8,259,984,000","17,180,108,000"
24382,"Other investments","Valuation of Mortgage Servicing Rights",499838,12/31/22,02/17/23,2,"Ernst & Young LLP",,,,"New York",NY,"NEW YORK","US Mid Atlantic",10-K,2023-02-17,,"ARBOR REALTY TRUST INC",1253986,"=""ABR""","333 EARLE OVINGTON BOULEVARD","SUITE 900",UNIONDALE,NY,"NEW YORK","US Mid Atlantic",,,"=""6798""","Real Estate Investment Trusts",525990,"Other Financial Vehicles",34,13,12/31/22,"2,350,860,544",12/31/22,"228,277,000","325,783,000","2,840,927,000","17,038,985,000"
24383,"Allowance for credit losses","Allowance for Credit Losses",499838,12/31/22,02/17/23,2,"Ernst & Young LLP",,,,"New York",NY,"NEW YORK","US Mid Atlantic",10-K,2023-02-17,,"ARBOR REALTY TRUST INC",1253986,"=""ABR""","333 EARLE OVINGTON BOULEVARD","SUITE 900",UNIONDALE,NY,"NEW YORK","US Mid Atlantic",,,"=""6798""","Real Estate Investment Trusts",525990,"Other Financial Vehicles",34,13,12/31/22,"2,350,860,544",12/31/22,"228,277,000","325,783,000","2,840,927,000","17,038,985,000"
26678,"Other contingent liabilities","Valuation of contingent consideration liability",502817,12/31/22,03/02/23,2,"Ernst & Young LLP",,,,Philadelphia,PA,PENNSYLVANIA,"US Mid Atlantic",10-K,2023-03-02,,"Arbutus Biopharma Corp",1447028,"=""ABUS""","701 VETERANS CIRCLE",,WARMINSTER,PA,PENNSYLVANIA,"US Mid Atlantic",,,"=""2834""","Pharmaceutical Preparations",541710,"Research and Development in the Physical, Engineering, and Life Sciences",34,2,12/31/22,"366,871,008",12/31/22,"39,019,000","-69,456,000",,"195,419,000"
26679,"Equity investments and joint ventures","Collaboration and License Agreement with Qilu",502817,12/31/22,03/02/23,2,"Ernst & Young LLP",,,,Philadelphia,PA,PENNSYLVANIA,"US Mid Atlantic",10-K,2023-03-02,,"Arbutus Biopharma Corp",1447028,"=""ABUS""","701 VETERANS CIRCLE",,WARMINSTER,PA,PENNSYLVANIA,"US Mid Atlantic",,,"=""2834""","Pharmaceutical Preparations",541710,"Research and Development in the Physical, Engineering, and Life Sciences",34,2,12/31/22,"366,871,008",12/31/22,"39,019,000","-69,456,000",,"195,419,000"
28389,Inventory,"GoodWheat Inventory Valuation – Refer to Note 4 to the consolidated financial statements",506969,12/31/22,03/30/23,3,"Deloitte & Touche LLP",,,,Tempe,AZ,ARIZONA,"US Southwest",10-K,2023-03-30,Yes,"Arcadia Biosciences, Inc.",1469443,"=""RKDA""","5956 SHERRY LANE","SUITE 2000",DALLAS,TX,TEXAS,"US Southwest",,,"=""1311""","Crude Petroleum and Natural Gas",541710,"Research and Development in the Physical, Engineering, and Life Sciences",34,11,12/31/22,"6,678,296",12/31/22,"7,418,000","-15,376,000","20,993,000","28,922,000"
25466,"Other contingent liabilities","Insurance reserves",501277,12/31/22,02/24/23,2,"Ernst & Young LLP",,,,Tulsa,OK,OKLAHOMA,"US Southwest",10-K,2023-02-24,,"ARCBEST CORP /DE/",894405,"=""ARCB""","8401 MCCLURE DRIVE",,"FORT SMITH",AR,ARKANSAS,"US Southeast",,,"=""4213""","Trucking, Except Local",484122,"General Freight Trucking, Long-Distance, Less Than Truckload",34,70,12/31/22,"1,697,022,464",12/31/22,"5,029,008,000","298,209,000","732,223,000","2,494,286,000"
26943,"Long-lived assets","Impairment of Goodwill, Intangible Assets and Property, Plant and Equipment",503767,12/31/22,03/08/23,2,"Ernst & Young LLP",226,"Ernst & Young SA",1367,Luxembourg,N4,LUXEMBOURG,Foreign,20-F,2023-03-08,,ArcelorMittal,1243429,"=""MT""","24-26, BOULEVARD D?AVRANCHES","L-1160 LUXEMBOURG",LUXEMBOURG,N4,LUXEMBOURG,Foreign,,,"=""3312""","Steel Works, Blast Furnaces (Including Coke Ovens), and Rolling Mills",331111,"Iron and Steel Mills",34,26,12/29/22,"24,111,343,616",12/31/22,"79,844,000,000","9,538,000,000","48,249,000,000","94,547,000,000"
26944,"Deferred income taxes","Recoverability of Deferred Tax Assets (“DTAs”)",503767,12/31/22,03/08/23,2,"Ernst & Young LLP",226,"Ernst & Young SA",1367,Luxembourg,N4,LUXEMBOURG,Foreign,20-F,2023-03-08,,ArcelorMittal,1243429,"=""MT""","24-26, BOULEVARD D?AVRANCHES","L-1160 LUXEMBOURG",LUXEMBOURG,N4,LUXEMBOURG,Foreign,,,"=""3312""","Steel Works, Blast Furnaces (Including Coke Ovens), and Rolling Mills",331111,"Iron and Steel Mills",34,26,12/29/22,"24,111,343,616",12/31/22,"79,844,000,000","9,538,000,000","48,249,000,000","94,547,000,000"
25552,"Other contingent liabilities","Valuation of Reserve for Losses and Loss Adjustment Expenses",501272,12/31/22,02/24/23,1,"PricewaterhouseCoopers LLP",,,,"New York",NY,"NEW YORK","US Mid Atlantic",10-K,2023-02-24,,"ARCH CAPITAL GROUP LTD.",947484,"=""ACGL""","WATERLOO HOUSE, GROUND FLOOR","100 PITTS BAY ROAD",PEMBROKE,D0,BERMUDA,Foreign,,,"=""6331""","Fire, Marine, and Casualty Insurance",524130,"Reinsurance Carriers",34,63,12/31/22,"23,250,321,408",12/31/22,"9,613,000,000","1,476,000,000","12,116,613,000","47,990,507,000"
24249,"Asset retirement and environmental obligations","Asset Retirement Obligation (ARO) Liability

",499649,12/31/22,02/16/23,2,"Ernst & Young LLP",,,,"Saint Louis",MO,MISSOURI,"US Southeast",10-K,2023-02-16,,"ARCH RESOURCES, INC.",1037676,,"CITY PLACE ONE STE 300","ARCH MINERAL CORP","ST LOUIS",MO,MISSOURI,"US Southeast",,,"=""1221""","Bituminous Coal and Lignite Surface Mining",212111,"Bituminous Coal and Lignite Surface Mining",34,143,12/31/22,"2,506,535,680",12/31/22,"3,724,593,000","1,330,914,000",,"2,433,108,000"
24006,Inventory,"Market or Fair Values of Certain Merchandisable Agricultural Commodity Inventories, Inventory-Related Payables, and Forward Commodity Purchase and Sales Contracts",499363,12/31/22,02/14/23,2,"Ernst & Young LLP",,,,"Saint Louis",MO,MISSOURI,"US Southeast",10-K,2023-02-14,,"Archer-Daniels-Midland Co",7084,"=""ADM""","77 W. WACKER DR.",,CHICAGO,IL,ILLINOIS,"US Midwest",,,"=""2070""","Fats & Oils",311222,"Soybean Processing",34,93,12/29/22,"51,154,001,920",12/31/22,"101,556,000,000","4,340,000,000","18,039,000,000","59,774,000,000"
24766,"Property, plant and equipment","Long–Lived Asset Impairment – Refer to Note 20 to the financial statements.",500374,12/31/22,02/22/23,3,"Deloitte & Touche LLP",,,,Houston,TX,TEXAS,"US Southwest",10-K,2023-02-22,,"Archrock, Inc.",1389050,"=""AROC""","16666 NORTHCHASE DRIVE","STE 100",HOUSTON,TX,TEXAS,"US Southwest",,,"=""4922""","Natural Gas Transmission",213112,"Support Activities for Oil and Gas Operations",34,9,12/31/22,"1,397,543,552",12/31/22,"845,568,000","44,296,000","823,616,000","2,598,750,000"
29034,"Other debt","Convertible Notes — Refer to Note 11 to the financial statements",508748,12/31/22,04/14/23,3,"Deloitte & Touche LLP",,,,Portland,OR,OREGON,"US West",10-K,2023-04-14,Yes,"Arcimoto Inc",1558583,"=""FUVV""","2034 WEST 2ND AVENUE",,EUGENE,OR,OREGON,"US West",,,"=""3751""","Motorcycles, Bicycles, and Parts",336991,"Motorcycle, Bicycle, and Parts Manufacturing",34,3,12/29/22,"6,987,644",12/31/22,"6,557,526","-62,879,398","22,320,655","56,408,032"
28774,Goodwill,"Goodwill impairment testing",507199,12/31/22,03/30/23,2,"Ernst & Young LLP",34,"Ernst & Young Auditores Independentes SS",1448,Recife,D5,BRAZIL,Foreign,20-F,2023-03-31,,"Arco Platform Ltd.",1740594,,"RUA AUGUSTA 2840","9TH FLOOR, SUITE 91","SAO PAULO - SP",D5,BRAZIL,Foreign,,,"=""8200""","Services-Educational Services",611710,"Educational Support Services",34,14,12/29/22,"403,472,544",12/31/22,"336,271,000","7,479,000","-243,689,000","1,089,712,000"
28775,"Business combinations","Valuation of accounts payable to selling shareholders",507199,12/31/22,03/30/23,2,"Ernst & Young LLP",34,"Ernst & Young Auditores Independentes SS",1448,Recife,D5,BRAZIL,Foreign,20-F,2023-03-31,,"Arco Platform Ltd.",1740594,,"RUA AUGUSTA 2840","9TH FLOOR, SUITE 91","SAO PAULO - SP",D5,BRAZIL,Foreign,,,"=""8200""","Services-Educational Services",611710,"Educational Support Services",34,14,12/29/22,"403,472,544",12/31/22,"336,271,000","7,479,000","-243,689,000","1,089,712,000"
24466,"Long-lived assets","Valuation of Long-Lived Assets – Extrusions Asset Group",499993,12/31/22,02/21/23,1,"PricewaterhouseCoopers LLP",,,,Pittsburgh,PA,PENNSYLVANIA,"US Mid Atlantic",10-K,2023-02-21,,"Arconic Corp",1790982,,"201 ISABELLA STREET",,PITTSBURGH,PA,PENNSYLVANIA,"US Mid Atlantic",,,"=""3350""","Rolling Drawing & Extruding of Nonferrous Metals",331315,"Aluminum Sheet, Plate, and Foil Manufacturing",34,21,12/31/22,"2,103,985,280",12/31/22,"8,961,000,000","-182,000,000","1,065,000,000","6,015,000,000"
27393,"Long-lived assets","Impairment of long-lived assets for markets with impairment indicators",505076,12/31/22,03/15/23,2,"Ernst & Young LLP",134,"Pistrelli Henry Martin y Asociados SRL (Inactive)",1449,"Buenos Aires",C1,ARGENTINA,Foreign,6-K,2023-03-15,,"Arcos Dorados Holdings Inc.",1508478,"=""ARCO""","RIO NEGRO 1338, FIRST FLOOR",,MONTEVIDEO,X3,URUGUAY,Foreign,,,"=""5812""","Eating and Drinking Places",722211,"Limited-Service Restaurants",34,8,12/31/22,"1,091,770,368",12/31/22,"3,618,902,000","140,343,000","269,054,000","2,636,630,000"
27394,"Other contingent liabilities","Tax and labor contingencies",505076,12/31/22,03/15/23,2,"Ernst & Young LLP",134,"Pistrelli Henry Martin y Asociados SRL (Inactive)",1449,"Buenos Aires",C1,ARGENTINA,Foreign,6-K,2023-03-15,,"Arcos Dorados Holdings Inc.",1508478,"=""ARCO""","RIO NEGRO 1338, FIRST FLOOR",,MONTEVIDEO,X3,URUGUAY,Foreign,,,"=""5812""","Eating and Drinking Places",722211,"Limited-Service Restaurants",34,8,12/31/22,"1,091,770,368",12/31/22,"3,618,902,000","140,343,000","269,054,000","2,636,630,000"
29613,"Long-lived assets","Impairment of long-lived assets for markets with impairment indicators",510972,12/31/22,03/15/23,2,"Ernst & Young LLP",134,"Pistrelli Henry Martin y Asociados SRL (Inactive)",1449,"Buenos Aires",C1,ARGENTINA,Foreign,20-F,2023-04-28,,"Arcos Dorados Holdings Inc.",1508478,"=""ARCO""","RIO NEGRO 1338, FIRST FLOOR",,MONTEVIDEO,X3,URUGUAY,Foreign,,,"=""5812""","Eating and Drinking Places",722211,"Limited-Service Restaurants",34,8,12/31/22,"1,091,770,368",12/31/22,"3,618,902,000","140,343,000","269,054,000","2,636,630,000"
29614,"Other contingent liabilities","Tax and labor contingencies",510972,12/31/22,03/15/23,2,"Ernst & Young LLP",134,"Pistrelli Henry Martin y Asociados SRL (Inactive)",1449,"Buenos Aires",C1,ARGENTINA,Foreign,20-F,2023-04-28,,"Arcos Dorados Holdings Inc.",1508478,"=""ARCO""","RIO NEGRO 1338, FIRST FLOOR",,MONTEVIDEO,X3,URUGUAY,Foreign,,,"=""5812""","Eating and Drinking Places",722211,"Limited-Service Restaurants",34,8,12/31/22,"1,091,770,368",12/31/22,"3,618,902,000","140,343,000","269,054,000","2,636,630,000"
25260,Goodwill,"Valuation of Goodwill
",501111,12/31/22,02/24/23,2,"Ernst & Young LLP",,,,Dallas,TX,TEXAS,"US Southwest",10-K,2023-02-24,,"Arcosa, Inc.",1739445,"=""ACA""","500 N. AKARD SREET","SUITE 400",DALLAS,TX,TEXAS,"US Southwest",,,"=""3440""","Fabricated Structural Metal Products",327992,"Ground or Treated Mineral and Earth Manufacturing",34,54,12/31/22,"2,630,055,936",12/31/22,"2,242,800,000","245,800,000","969,800,000","3,340,600,000"
28263,"Research and development expenses","Accrued research and development expenses",506828,12/31/22,03/28/23,2,"Ernst & Young LLP",,,,"San Diego",CA,CALIFORNIA,"US West",10-K,2023-03-29,,"Arcturus Therapeutics Holdings Inc.",1768224,"=""ARCT""","10285 SCIENCE CENTER DRIVE",,"SAN DIEGO",CA,CALIFORNIA,"US West",,,"=""2834""","Pharmaceutical Preparations",325414,"Biological Product (except Diagnostic) Manufacturing",34,17,12/31/22,"450,372,800",12/31/22,"205,999,000","9,349,000",,"450,387,000"
25952,"Revenue from customer contracts","Accounting for license and collaboration agreements with Gilead Sciences, Inc. ",502026,12/31/22,02/28/23,2,"Ernst & Young LLP",,,,"San Mateo",CA,CALIFORNIA,"US West",10-K,2023-02-28,,"Arcus Biosciences, Inc.",1724521,"=""RCUS""","3928 POINT EDEN WAY",,HAYWARD,CA,CALIFORNIA,"US West",,,"=""2834""","Pharmaceutical Preparations",325412,"Pharmaceutical Preparation Manufacturing",34,21,12/31/22,"1,507,571,968",12/31/22,"112,000,000","-267,000,000",,"1,345,000,000"
25917,"Research and development expenses","Accrued Clinical Trial Costs",502059,12/31/22,02/28/23,2,"Ernst & Young LLP",,,,"Los Angeles",CA,CALIFORNIA,"US West",10-K,2023-02-28,,"Arcutis Biotherapeutics, Inc.",1787306,"=""ARQT""","3027 TOWNSGATE ROAD","SUITE 300","WESTLAKE VILLAGE",CA,CALIFORNIA,"US West",,,"=""2834""","Pharmaceutical Preparations",325412,"Pharmaceutical Preparation Manufacturing",34,15,12/31/22,"903,344,448",12/31/22,"3,686,000","-311,458,000","202,393,000","449,274,000"
25178,"Business combinations","Valuation of Earnout Shares Resulting from the AMP Transfer",500590,12/31/22,02/23/23,1,"PricewaterhouseCoopers LLP",104,PricewaterhouseCoopers,1366,Dublin,L2,IRELAND,Foreign,6-K,2023-02-23,,"Ardagh Metal Packaging S.A.",1845097,"=""AMBP""","56, RUE CHARLES MARTEL",,LUXEMBOURG,N4,LUXEMBOURG,Foreign,,,"=""3411""","Metal Cans",332431,"Metal Can Manufacturing",34,5,12/31/22,"2,871,569,920",12/31/22,"4,689,000,000","237,000,000","-1,018,000,000","5,865,000,000"
26691,"Business combinations","Valuation of Earnout Shares Resulting from the AMP Transfer",503072,12/31/22,02/23/23,1,"PricewaterhouseCoopers LLP",104,PricewaterhouseCoopers,1366,Dublin,L2,IRELAND,Foreign,20-F,2023-03-03,,"Ardagh Metal Packaging S.A.",1845097,"=""AMBP""","56, RUE CHARLES MARTEL",,LUXEMBOURG,N4,LUXEMBOURG,Foreign,,,"=""3411""","Metal Cans",332431,"Metal Can Manufacturing",34,5,12/31/22,"2,871,569,920",12/31/22,"4,689,000,000","237,000,000","-1,018,000,000","5,865,000,000"
26674,"Revenue from customer contracts","Estimates of Reserves for Variable Consideration",502814,12/31/22,03/02/23,2,"Ernst & Young LLP",,,,"San Mateo",CA,CALIFORNIA,"US West",10-K,2023-03-02,Yes,"ARDELYX, INC.",1437402,"=""ARDX""","34175 ARDENWOOD BLVD.",,FREMONT,CA,CALIFORNIA,"US West",,,"=""2834""","Pharmaceutical Preparations",325412,"Pharmaceutical Preparation Manufacturing",34,3,12/31/22,"565,938,816",12/31/22,"52,158,000","-67,207,000",,"190,066,000"
27995,"Property, plant and equipment","Determination of Vessel Asset Impairment Indicators — Refer to Note 2.16 to the financial statements",506188,12/31/22,03/24/23,3,"Deloitte & Touche LLP",,,,"New York",NY,"NEW YORK","US Mid Atlantic",20-F,2023-03-24,,"Ardmore Shipping Corp",1577437,"=""ASC""","DORCHESTER HOUSE","7 CHURCH STREET",HAMILTON,D0,BERMUDA,Foreign,,,"=""4412""","Deep Sea Foreign Transportation of  Freight",483111,"Deep Sea Freight Transportation",34,14,12/29/22,"482,812,576",12/31/22,"445,741,000","138,454,000",,"723,859,000"
23652,"Other investments","Fair value of investments",498765,12/31/22,02/07/23,4,"KPMG LLP",,,,"Los Angeles",CA,CALIFORNIA,"US West",10-K,2023-02-07,,"ARES CAPITAL CORP",1287750,"=""ARCC""","245 PARK AVENUE, 44TH FLOOR",,"NEW YORK",NY,"NEW YORK","US Mid Atlantic",,,,,525990,"Other Financial Vehicles",34,19,12/29/22,"9,504,448,512",12/31/22,"1,641,000,000","600,000,000",,"22,398,000,000"
24018,"Allowance for credit losses","Current expected credit losses",499459,12/31/22,02/14/23,2,"Ernst & Young LLP",,,,"Los Angeles",CA,CALIFORNIA,"US West",10-K,2023-02-15,,"Ares Commercial Real Estate Corp",1529377,"=""ACRE""","245 PARK AVENUE","42ND FLOOR","NEW YORK",NY,"NEW YORK","US Mid Atlantic",,,"=""6798""","Real Estate Investment Trusts",525990,"Other Financial Vehicles",34,10,12/31/22,"560,228,608",12/31/22,"2,672,000","29,785,000",,"324,963,000"
27749,"Business combinations","Evaluation of the estimated fair value of certain acquired tangible assets",505636,12/31/22,03/20/23,4,"KPMG LLP",,,,Denver,CO,COLORADO,"US West",10-K,2023-03-20,,"ARES INDUSTRIAL REAL ESTATE INCOME TRUST Inc.",1625941,"=""ZAIRDX""","1200 17TH STREET","SUITE 2900",DENVER,CO,COLORADO,"US West",,,"=""6798""","Real Estate Investment Trusts",525990,"Other Financial Vehicles",34,,,,12/31/22,"392,025,000","-308,079,000",,"7,223,475,000"
25438,"Equity investments and joint ventures","Valuation of underlying investments of equity method investments",501020,12/31/22,02/24/23,2,"Ernst & Young LLP",,,,"Los Angeles",CA,CALIFORNIA,"US West",10-K,2023-02-24,,"Ares Management Corp",1176948,"=""ARES""","1800 AVE OF THE STARS","SUITE 1400","LOS ANGELES",CA,CALIFORNIA,"US West",,,"=""6282""","Investment Advice",523930,"Investment Advice",34,68,12/31/22,"11,901,170,688",12/31/22,"2,572,726,000","167,541,000","487,774,000","22,002,839,000"
27738,"Business combinations","Evaluation of the estimated fair value of certain acquired tangible assets",505602,12/31/22,03/20/23,4,"KPMG LLP",,,,Denver,CO,COLORADO,"US West",10-K,2023-03-20,,"Ares Real Estate Income Trust Inc.",1327978,"=""ZAREDX""","ONE TABOR CENTER","1200 SEVENTEENTH STREET, SUITE 2900",DENVER,CO,COLORADO,"US West",,,"=""6798""","Real Estate Investment Trusts",525990,"Other Financial Vehicles",34,,,,12/31/22,"299,223,000","-39,979,000",,"4,174,724,000"
27739,"Real estate investments","Assessment of the expected hold periods for investments in real estate properties",505602,12/31/22,03/20/23,4,"KPMG LLP",,,,Denver,CO,COLORADO,"US West",10-K,2023-03-20,,"Ares Real Estate Income Trust Inc.",1327978,"=""ZAREDX""","ONE TABOR CENTER","1200 SEVENTEENTH STREET, SUITE 2900",DENVER,CO,COLORADO,"US West",,,"=""6798""","Real Estate Investment Trusts",525990,"Other Financial Vehicles",34,,,,12/31/22,"299,223,000","-39,979,000",,"4,174,724,000"
27593,"Revenue from customer contracts","Product net sales — Refer to Note 15 & 18 to the financial statements",505330,12/31/22,03/16/23,3,"Deloitte & Touche LLP",21,"Deloitte Accountants BV",1243,Rotterdam,P7,NETHERLANDS,Foreign,20-F,2023-03-16,,"ARGENX SE",1697862,"=""ARGX""","INDUSTRIEPARK ZWIJNAARDE 7","BUILDING C B-9052",ZWIJNAARDE,C9,BELGIUM,Foreign,,,"=""2836""","Biological Products, Except Diagnostic Substances",325414,"Biological Product (except Diagnostic) Manufacturing",34,376,12/29/22,"19,416,436,736",12/31/22,"445,266,000","-709,593,000","2,638,798,000","3,134,261,000"
26758,"Other contingent liabilities","Estimate of reserves for losses and loss adjustment expenses",503275,12/31/22,03/06/23,4,"KPMG LLP",,,,"New York",NY,"NEW YORK","US Mid Atlantic",10-K,2023-03-06,,"Argo Group International Holdings, Inc.",1091748,"=""ARGD""","501 7TH AVENUE, 7TH FLOOR",,"NEW YORK",NY,"NEW YORK","US Mid Atlantic",,,"=""6361""","Title Insurance",524126,"Direct Property and Casualty Insurance Carriers",34,26,12/31/22,"906,325,760",12/31/22,"1,754,900,000","-175,200,000","1,114,300,000","10,034,400,000"
23975,Inventory,"Inventory Valuation & Contract Manufacturer/Supplier Liabilities",499315,12/31/22,02/13/23,2,"Ernst & Young LLP",,,,"San Jose",CA,CALIFORNIA,"US West",10-K,2023-02-14,,"Arista Networks, Inc.",1596532,"=""ANET""","5453 GREAT AMERICA PARKWAY",,"SANTA CLARA",CA,CALIFORNIA,"US West",,,"=""3576""","Computer Communications Equipment",511210,"Software Publishers",34,121,12/31/22,"37,241,102,336",12/31/22,"4,381,310,000","1,352,446,000","4,497,691,000","6,775,410,000"
25555,"Regulatory assets and liabilities","Regulatory Accounting – Impact of Rate Regulation on the Financial Statements — Refer to Notes 1 and 3 to the financial statements",501510,12/31/22,02/27/23,3,"Deloitte & Touche LLP",,,,Tempe,AZ,ARIZONA,"US Southwest",10-K,2023-02-27,,"ARIZONA PUBLIC SERVICE CO",7286,,"400 NORTH FIFTH STREET",,PHOENIX,AZ,ARIZONA,"US Southwest",764622,"PINNACLE WEST CAPITAL CORP","=""4931""","Electric and Other Services Combined",221112,"Fossil Fuel Electric Power Generation",34,,,,12/31/22,"4,324,385,000","524,929,000","6,683,001,000","22,543,852,000"
28661,"Other investments","Fair Value of the Mortgage Servicing Rights used to value the MSR Financing Receivables",507347,12/31/22,03/31/23,1,"PricewaterhouseCoopers LLP",,,,Washington,DC,"DISTRICT OF COLUMBIA","US Mid Atlantic",10-K,2023-03-31,,"Arlington Asset Investment Corp.",1209028,,"6862 ELM STREET","SUITE 320",MCLEAN,VA,VIRGINIA,"US Mid Atlantic",,,"=""6798""","Real Estate Investment Trusts",525990,"Other Financial Vehicles",34,24,12/29/22,"691,935,424",12/31/22,"27,945,000","5,426,000",,"983,598,000"
24850,"Allowance for credit losses","Allowance for Loan Losses - Notes Receivable",500615,12/31/22,02/23/23,2,"Ernst & Young LLP",,,,Richmond,VA,VIRGINIA,"US Mid Atlantic",10-K,2023-02-23,,"Armada Hoffler Properties, Inc.",1569187,"=""AHH""","222 CENTRAL PARK AVENUE","SUITE 2100","VIRGINIA BEACH",VA,VIRGINIA,"US Mid Atlantic",,,"=""6500""","Real Estate",525990,"Other Financial Vehicles",34,12,12/31/22,"778,893,312",12/31/22,"471,131,000","74,747,000","543,580,000","2,242,310,000"
24851,"Revenue from customer contracts","General contracting revenue recognition",500615,12/31/22,02/23/23,2,"Ernst & Young LLP",,,,Richmond,VA,VIRGINIA,"US Mid Atlantic",10-K,2023-02-23,,"Armada Hoffler Properties, Inc.",1569187,"=""AHH""","222 CENTRAL PARK AVENUE","SUITE 2100","VIRGINIA BEACH",VA,VIRGINIA,"US Mid Atlantic",,,"=""6500""","Real Estate",525990,"Other Financial Vehicles",34,12,12/31/22,"778,893,312",12/31/22,"471,131,000","74,747,000","543,580,000","2,242,310,000"
24852,"Equity investments and joint ventures","Harbor Point Parcel 4 Consolidation Analysis",500615,12/31/22,02/23/23,2,"Ernst & Young LLP",,,,Richmond,VA,VIRGINIA,"US Mid Atlantic",10-K,2023-02-23,,"Armada Hoffler Properties, Inc.",1569187,"=""AHH""","222 CENTRAL PARK AVENUE","SUITE 2100","VIRGINIA BEACH",VA,VIRGINIA,"US Mid Atlantic",,,"=""6500""","Real Estate",525990,"Other Financial Vehicles",34,12,12/31/22,"778,893,312",12/31/22,"471,131,000","74,747,000","543,580,000","2,242,310,000"
27601,"Research and development expenses","Accrued clinical trial expenses and related research and development costs",505342,12/31/22,03/16/23,2,"Ernst & Young LLP",,,,"San Diego",CA,CALIFORNIA,"US West",10-K,2023-03-16,Yes,"Armata Pharmaceuticals, Inc.",921114,"=""ARMP""","5005 MCCONNELL AVE",,"LOS ANGELES",CA,CALIFORNIA,"US West",,,"=""2836""","Biological Products, Except Diagnostic Substances",325414,"Biological Product (except Diagnostic) Manufacturing",34,1,12/31/22,"44,819,436",12/31/22,"5,508,000","-36,917,000","22,334,000","95,834,000"
24440,"Pension and other post-employment benefits","Pension and postretirement benefit obligations",499969,12/31/22,02/21/23,4,"KPMG LLP",,,,Philadelphia,PA,PENNSYLVANIA,"US Mid Atlantic",10-K,2023-02-21,,"ARMSTRONG WORLD INDUSTRIES INC",7431,"=""AWI""","2500 COLUMBIA AVE",,LANCASTER,PA,PENNSYLVANIA,"US Mid Atlantic",,,"=""3089""","Plastics Products, NEC",326199,"All Other Plastics Product Manufacturing",34,69,12/31/22,"3,125,796,096",12/31/22,"1,233,100,000","202,900,000","-40,000,000","1,687,200,000"
24156,"Revenue from customer contracts","Revenue Recognition - Retail Service and Equipment Sales Revenue",499700,12/31/22,02/16/23,1,"PricewaterhouseCoopers LLP",,,,Chicago,IL,ILLINOIS,"US Midwest",10-K,2023-02-16,,"ARRAY DIGITAL INFRASTRUCTURE, INC.",821130,"=""AD""","500 WEST MADISON STREET","SUITE 810",CHICAGO,IL,ILLINOIS,"US Midwest",1051512,"TELEPHONE & DATA SYSTEMS INC /DE/","=""4812""","Radiotelephone Communications",517212,"Cellular and Other Wireless Telecommunications",34,21,12/31/22,"1,084,199,936",12/31/22,"4,169,000,000","30,000,000","-124,000,000","11,119,000,000"
23722,Inventory,"Evaluation of net realizable value adjustments to inventories for excess or obsolescence",499023,12/31/22,02/09/23,2,"Ernst & Young LLP",,,,Denver,CO,COLORADO,"US West",10-K,2023-02-09,,"ARROW ELECTRONICS, INC.",7536,"=""ARW""","7459 S LIMA STREET",,ENGLEWOOD,CO,COLORADO,"US West",,,"=""5065""","Electronic Parts and Equipment, NEC",423610,"Electrical Apparatus and Equipment, Wiring Supplies, and Related Equipment Merchant  Wholesalers",34,105,12/31/22,"6,195,667,968",12/31/22,"37,124,422,000","1,426,884,000","3,359,594,000","21,763,182,000"
23723,Goodwill,"Evaluation of Americas Components and eInfochips Goodwill for Impairment",499023,12/31/22,02/09/23,2,"Ernst & Young LLP",,,,Denver,CO,COLORADO,"US West",10-K,2023-02-09,,"ARROW ELECTRONICS, INC.",7536,"=""ARW""","7459 S LIMA STREET",,ENGLEWOOD,CO,COLORADO,"US West",,,"=""5065""","Electronic Parts and Equipment, NEC",423610,"Electrical Apparatus and Equipment, Wiring Supplies, and Related Equipment Merchant  Wholesalers",34,105,12/31/22,"6,195,667,968",12/31/22,"37,124,422,000","1,426,884,000","3,359,594,000","21,763,182,000"
30692,"Allowance for credit losses","Allowance for Credit Losses – Loans evaluated on a collective basis",514766,12/31/22,07/17/23,4,"KPMG LLP",,,,Albany,NY,"NEW YORK","US Mid Atlantic",10-K,2023-07-18,,"ARROW FINANCIAL CORP",717538,"=""AROW""","250 GLEN ST",,"GLENS FALLS",NY,"NEW YORK","US Mid Atlantic",,,"=""6021""","National Commercial Banks",522110,"Commercial Banking",34,34,12/31/22,"561,055,808",12/31/22,"144,443,000","48,799,000","330,165,000","3,969,509,000"
23805,"Business combinations","Business acquisitions – Accounting for acquisitions",499148,12/31/22,02/10/23,2,"Ernst & Young LLP",,,,Chicago,IL,ILLINOIS,"US Midwest",10-K,2023-02-10,,"Arthur J. Gallagher & Co.",354190,"=""AJG""","2850 GOLF ROAD",,"ROLLING MEADOWS",IL,ILLINOIS,"US Midwest",,,"=""6411""","Insurance Agents, Brokers, and Service",524210,"Insurance Agencies and Brokerages",34,189,12/31/22,"39,951,626,240",12/31/22,"8,550,600,000","1,114,200,000","-3,717,900,000","38,907,800,000"
25724,"Deferred income taxes","Income Taxes – Deferred Tax Assets and Amounts Payable Under Tax Receivable Agreements",501692,12/31/22,02/27/23,1,"PricewaterhouseCoopers LLP",,,,Chicago,IL,ILLINOIS,"US Midwest",10-K,2023-02-27,,"Artisan Partners Asset Management Inc.",1517302,"=""APAM""","875 E. WISCONSIN AVENUE","SUITE 800",MILWAUKEE,WI,WISCONSIN,"US Midwest",,,"=""6282""","Investment Advice",523120,"Securities Brokerage",34,30,12/31/22,"2,019,066,112",12/31/22,"983,373,000","205,842,000",,"1,234,608,000"
25012,"Deferred and capitalized costs","Deferred Preservation Costs",500882,12/31/22,02/23/23,2,"Ernst & Young LLP",,,,Atlanta,GA,GEORGIA,"US Southeast",10-K,2023-02-23,,"ARTIVION, INC.",784199,"=""AORT""","1655 ROBERTS BOULEVARD N W",,KENNESAW,GA,GEORGIA,"US Southeast",,,"=""3841""","Surgical and Medical Instruments and Apparatus",541710,"Research and Development in the Physical, Engineering, and Life Sciences",34,12,12/31/22,"488,957,152",12/31/22,"313,789,000","-19,192,000","-101,549,000","762,798,000"
24848,"Research and development expenses","Prepaid and Accrued Research and Development - Refer to Note 2 in the Consolidated Financial Statements
",500636,12/31/22,02/23/23,3,"Deloitte & Touche LLP",,,,Stamford,CT,CONNECTICUT,"US New England",10-K,2023-02-23,,"ARVINAS, INC.",1655759,"=""ARVN""","395 WINCHESTER AVE","5 SCIENCE PARK","NEW HAVEN",CT,CONNECTICUT,"US New England",,,"=""2834""","Pharmaceutical Preparations",325412,"Pharmaceutical Preparation Manufacturing",34,34,12/31/22,"1,819,971,968",12/31/22,"131,400,000","-282,500,000",,"1,268,800,000"
19072,"Revenue from customer contracts","Revenue Recognition",480552,01/31/22,03/24/22,1,"PricewaterhouseCoopers LLP",,,,"San Francisco",CA,CALIFORNIA,"US West",10-K,2022-03-24,,"Asana, Inc.",1477720,"=""ASAN""","633 FOLSOM STREET","SUITE 100","SAN FRANCISCO",CA,CALIFORNIA,"US West",,,"=""7372""","Prepackaged Software",511210,"Software Publishers",34,52,01/31/22,"5,395,422,208",01/31/22,"378,437,000","-288,342,000",,"707,035,000"
26418,"Business combinations","Valuation of Acquired Manufacturer Franchise Rights for Larry H. Miller Dealerships",502378,12/31/22,03/01/23,2,"Ernst & Young LLP",,,,Atlanta,GA,GEORGIA,"US Southeast",10-K,2023-03-01,,"ASBURY AUTOMOTIVE GROUP INC",1144980,"=""ABG""","6655 PEACHTREE DUNWOODY ROAD",,ATLANTA,GA,GEORGIA,"US Southeast",,,"=""5500""","Retail-Auto Dealers & Gasoline Stations",441110,"New Car Dealers",34,179,12/31/22,"3,866,302,464",12/31/22,"15,433,900,000","997,300,000","-680,000,000","8,021,400,000"
24296,"Derivatives and hedging","Derivative liabilities – Refer to Notes 2, 3 and 15 to the financial statements",499722,12/31/22,02/16/23,3,"Deloitte & Touche LLP",582,"Deloitte Statsautoriseret Revisionspartnerselskab",1294,Copenhagen,G7,DENMARK,Foreign,20-F,2023-02-16,,"Ascendis Pharma A/S",1612042,"=""ASND""","TUBORG BOULEVARD 12",,HELLERUP,G7,DENMARK,Foreign,,,"=""2834""","Pharmaceutical Preparations",325412,"Pharmaceutical Preparation Manufacturing",34,121,12/29/22,"6,886,612,480",12/31/22,"54,616,000","-622,419,000","275,907,000","1,163,032,000"
28915,Goodwill,"Goodwill – Packaging and Testing Segments - Refer to Notes 4, 5 and 18 to the consolidated financial statements",508358,12/31/22,03/20/23,3,"Deloitte & Touche LLP",28,"Deloitte & Touche",1060,Taipei,F5,TAIWAN,Foreign,20-F,2023-04-10,,"ASE Technology Holding Co., Ltd.",1122411,"=""ASX""","26, CHIN 3RD RD.","NANZIH DISTRICT",KAOHSIUNG,F5,TAIWAN,Foreign,,,"=""3674""","Semiconductors and Related Devices",334413,"Semiconductor and Related Device Manufacturing",34,6,12/31/22,"13,464,960,000",12/31/22,"21,827,289,000","2,102,393,000","7,196,147,000","23,021,908,000"
30130,Goodwill,"Goodwill - Packaging and Testing Segments - Refer to Notes 4, 5 and 18 to the consolidated financial statements",512574,12/31/22,03/20/23,3,"Deloitte & Touche LLP",28,"Deloitte & Touche",1060,Taipei,F5,TAIWAN,Foreign,6-K,2023-05-26,,"ASE Technology Holding Co., Ltd.",1122411,"=""ASX""","26, CHIN 3RD RD.","NANZIH DISTRICT",KAOHSIUNG,F5,TAIWAN,Foreign,,,"=""3674""","Semiconductors and Related Devices",334413,"Semiconductor and Related Device Manufacturing",34,6,12/31/22,"13,464,960,000",12/31/22,"21,827,289,000","2,102,393,000","7,196,147,000","23,021,908,000"
25558,"Goodwill and intangible assets","Goodwill and Identifiable Intangible Assets — Refer to Notes 2, 6 and 7 to the financial statements",501516,12/31/22,02/24/23,3,"Deloitte & Touche LLP",,,,"Los Angeles",CA,CALIFORNIA,"US West",10-K,2023-02-27,,"ASGN Inc",890564,"=""ASGN""","4400 COX ROAD, SUITE 110",,"GLEN ALLEN",VA,VIRGINIA,"US Mid Atlantic",,,"=""7363""","Help Supply Services",561310,"Employment Placement Agencies",34,81,12/31/22,"4,033,260,032",12/31/22,"4,581,100,000","268,100,000","-560,300,000","3,585,700,000"
22960,"Asset retirement and environmental obligations","Valuation of Environmental Remediation Reserves",494785,09/30/22,11/21/22,2,"Ernst & Young LLP",,,,"Grandview Heights",OH,OHIO,"US Midwest",10-K,2022-11-21,,"ASHLAND INC.",1674862,"=""ASH""","8145 BLAZER DRIVE",,WILMINGTON,DE,DELAWARE,"US Mid Atlantic",,,"=""5160""","Wholesale-Chemicals & Allied Products",424690,"Other Chemical and Allied Products Merchant Wholesalers",34,95,09/30/22,"5,128,379,904",09/30/22,"2,391,000,000","927,000,000","945,000,000","6,213,000,000"
22961,"Other contingent liabilities","Valuation of Asbestos Litigation Reserves",494785,09/30/22,11/21/22,2,"Ernst & Young LLP",,,,"Grandview Heights",OH,OHIO,"US Midwest",10-K,2022-11-21,,"ASHLAND INC.",1674862,"=""ASH""","8145 BLAZER DRIVE",,WILMINGTON,DE,DELAWARE,"US Mid Atlantic",,,"=""5160""","Wholesale-Chemicals & Allied Products",424690,"Other Chemical and Allied Products Merchant Wholesalers",34,95,09/30/22,"5,128,379,904",09/30/22,"2,391,000,000","927,000,000","945,000,000","6,213,000,000"
29391,"Revenue from customer contracts","Revenue Recognition – Estimating Measure of Progress for Supply, Delivery and Installation (“SDI”) Contracts",509769,12/31/22,04/21/23,1,"PricewaterhouseCoopers LLP",331,"PricewaterhouseCoopers Taiwan",1345,Taipei,F5,TAIWAN,Foreign,20-F,2023-04-25,,"ASIA PACIFIC WIRE & CABLE CORP LTD",1026980,"=""APWC""","15/FL. B, NO. 77, SEC. 2,","DUNHUA SOUTH ROAD","TAIPEI, 106",F5,TAIWAN,Foreign,,,"=""3357""","Drawing and Insulating of Nonferrous Wire",332618,"Other Fabricated Wire Product Manufacturing",34,1,12/29/22,"19,542,394",12/31/22,"433,893,000","4,757,000","151,456,000","371,019,000"
24024,"Revenue from customer contracts","Revenue recognition – Identification of distinct performance obligations and allocation of the total contract consideration",499468,12/31/22,02/15/23,4,"KPMG LLP",76,"KPMG Accountants NV",1012,Amstelveen,P7,NETHERLANDS,Foreign,20-F,2023-02-15,,"ASML HOLDING NV",937966,"=""ASML""","DE RUN 6501",,"DR VELDHOVEN",P7,NETHERLANDS,Foreign,,,"=""3559""","Special  Industry Machinery, NEC",333295,"Semiconductor Machinery Manufacturing",34,551,12/29/22,"222,022,713,344",12/31/22,"22,597,500,000","6,002,500,000","3,642,300,000","38,741,900,000"
27457,Inventory,"Net realizable value of certain inventories",505251,12/31/22,03/16/23,4,"KPMG LLP",,,,Hartford,CT,CONNECTICUT,"US New England",10-K,2023-03-16,,"ASPEN AEROGELS INC",1145986,"=""ASPN""","30 FORBES ROAD","BUILDING B",NORTHBOROUGH,MA,MASSACHUSETTS,"US New England",,,"=""5030""","Wholesale-Lumber & Other Construction Materials",541330,"Engineering Services",34,12,12/31/22,"825,240,640",12/31/22,"180,364,000","-84,355,000",,"643,416,000"
29296,"Insurance contract liabilities","Valuation of incurred but not reported reserve estimates, gross and net of reinsurance",509469,12/31/22,04/20/23,2,"Ernst & Young LLP",57,"Ernst & Young LLP",1438,London,X0,"UNITED KINGDOM",Foreign,20-F,2023-04-20,,"ASPEN INSURANCE HOLDINGS LTD",1267395,"=""AHL""","11 VICTORIA ST",,HAMILTON,D0,BERMUDA,Foreign,,,"=""6331""","Fire, Marine, and Casualty Insurance",524130,"Reinsurance Carriers",34,23,12/29/22,"1,384,333,056",12/31/22,"2,890,000,000","51,100,000","2,336,200,000","15,157,300,000"
29297,"Other investments","Valuation of privately–held investments",509469,12/31/22,04/20/23,2,"Ernst & Young LLP",57,"Ernst & Young LLP",1438,London,X0,"UNITED KINGDOM",Foreign,20-F,2023-04-20,,"ASPEN INSURANCE HOLDINGS LTD",1267395,"=""AHL""","11 VICTORIA ST",,HAMILTON,D0,BERMUDA,Foreign,,,"=""6331""","Fire, Marine, and Casualty Insurance",524130,"Reinsurance Carriers",34,23,12/29/22,"1,384,333,056",12/31/22,"2,890,000,000","51,100,000","2,336,200,000","15,157,300,000"
32010,"Insurance contract liabilities","Valuation of incurred but not reported reserve estimates, gross and net of reinsurance",521432,12/31/22,04/20/23,2,"Ernst & Young LLP",57,"Ernst & Young LLP",1438,London,X0,"UNITED KINGDOM",Foreign,F-1,2023-12-20,,"ASPEN INSURANCE HOLDINGS LTD",1267395,"=""AHL""","11 VICTORIA ST",,HAMILTON,D0,BERMUDA,Foreign,,,"=""6331""","Fire, Marine, and Casualty Insurance",524130,"Reinsurance Carriers",34,23,12/29/22,"1,384,333,056",12/31/22,"2,890,000,000","51,100,000","2,336,200,000","15,157,300,000"
32011,"Other investments","Valuation of privately–held investments",521432,12/31/22,04/20/23,2,"Ernst & Young LLP",57,"Ernst & Young LLP",1438,London,X0,"UNITED KINGDOM",Foreign,F-1,2023-12-20,,"ASPEN INSURANCE HOLDINGS LTD",1267395,"=""AHL""","11 VICTORIA ST",,HAMILTON,D0,BERMUDA,Foreign,,,"=""6331""","Fire, Marine, and Casualty Insurance",524130,"Reinsurance Carriers",34,23,12/29/22,"1,384,333,056",12/31/22,"2,890,000,000","51,100,000","2,336,200,000","15,157,300,000"
32312,"Insurance contract liabilities","Valuation of incurred but not reported reserve estimates, gross and net of reinsurance",523832,12/31/22,04/20/23,2,"Ernst & Young LLP",57,"Ernst & Young LLP",1438,London,X0,"UNITED KINGDOM",Foreign,F-1/A,2024-02-01,,"ASPEN INSURANCE HOLDINGS LTD",1267395,"=""AHL""","11 VICTORIA ST",,HAMILTON,D0,BERMUDA,Foreign,,,"=""6331""","Fire, Marine, and Casualty Insurance",524130,"Reinsurance Carriers",34,23,12/29/22,"1,384,333,056",12/31/22,"2,890,000,000","51,100,000","2,336,200,000","15,157,300,000"
32313,"Other investments","Valuation of privately–held investments",523832,12/31/22,04/20/23,2,"Ernst & Young LLP",57,"Ernst & Young LLP",1438,London,X0,"UNITED KINGDOM",Foreign,F-1/A,2024-02-01,,"ASPEN INSURANCE HOLDINGS LTD",1267395,"=""AHL""","11 VICTORIA ST",,HAMILTON,D0,BERMUDA,Foreign,,,"=""6331""","Fire, Marine, and Casualty Insurance",524130,"Reinsurance Carriers",34,23,12/29/22,"1,384,333,056",12/31/22,"2,890,000,000","51,100,000","2,336,200,000","15,157,300,000"
22153,"Revenue from customer contracts","Determination of Standalone Selling Prices for Term Software License and Maintenance Performance Obligations
",491092,06/30/22,08/25/22,4,"KPMG LLP",,,,Boston,MA,MASSACHUSETTS,"US New England",10-KT,2022-08-25,,"Aspen Technology, Inc.",1897982,,"20 CROSBY DRIVE",,BEDFORD,MA,MASSACHUSETTS,"US New England",,,"=""7371""","Computer Programming Services",541511,"Custom Computer Programming Services",34,,,,,,,,
22154,"Business combinations","Evaluation of the Acquisition Date Fair Value of Certain Acquired Intangible Assets
",491092,06/30/22,08/25/22,4,"KPMG LLP",,,,Boston,MA,MASSACHUSETTS,"US New England",10-KT,2022-08-25,,"Aspen Technology, Inc.",1897982,,"20 CROSBY DRIVE",,BEDFORD,MA,MASSACHUSETTS,"US New England",,,"=""7371""","Computer Programming Services",541511,"Custom Computer Programming Services",34,,,,,,,,
27806,"Research and development expenses","Accrued research and development expenses",505753,12/31/22,03/22/23,2,"Ernst & Young LLP",,,,"San Jose",CA,CALIFORNIA,"US West",10-K,2023-03-22,,"ASSEMBLY BIOSCIENCES, INC.",1426800,"=""ASMB""","TWO TOWER PLACE","7TH FLOOR","SOUTH SAN FRANCISCO",CA,CALIFORNIA,"US West",,,"=""2834""","Pharmaceutical Preparations",541710,"Research and Development in the Physical, Engineering, and Life Sciences",34,1,12/31/22,"63,563,464",12/31/22,,"-93,092,000",,"101,794,000"
39275,"Allowance for credit losses","Assessment of the allowance for credit losses related to loans, excluding individually analyzed loans",503248,12/31/22,02/13/23,4,"KPMG LLP",,,,Chicago,IL,ILLINOIS,"US Midwest",10-K,2023-02-13,,"ASSOCIATED BANC-CORP",7789,"=""ASB""","433 MAIN STREET",,"GREEN BAY",WI,WISCONSIN,"US Midwest",,,"=""6022""","State Commercial Banks",522110,"Commercial Banking",34,23,12/31/22,"3,473,752,320",12/31/22,"1,206,692,000","366,121,000","2,861,215,000","39,405,726,000"
27481,"Equity investments and joint ventures","Deconsolidation of PMV Consumer Acquisition Corp - Refer to Notes 1, 2 and 5 to the financial statements",505202,12/31/22,03/15/23,3,"Deloitte & Touche LLP",,,,Stamford,CT,CONNECTICUT,"US New England",10-K,2023-03-16,,"Associated Capital Group, Inc.",1642122,"=""ACGP""","191 MASON STREET",,GREENWICH,CT,CONNECTICUT,"US New England",,,"=""6211""","Security Brokers, Dealers, and Flotation Companies",523110,"Investment Banking and Securities Dealing",34,42,12/31/22,"127,126,448",12/31/22,"15,012,000","-48,907,000","896,870,000","927,690,000"
24356,"Insurance contract liabilities","Valuation of Claims and Benefits Payable Reserves for Global Lifestyle, Global Housing and Non-Core Operations Short Duration Insurance Contracts",499910,12/31/22,02/17/23,1,"PricewaterhouseCoopers LLP",,,,"New York",NY,"NEW YORK","US Mid Atlantic",10-K,2023-02-17,,"ASSURANT, INC.",1267238,"=""AIZ""","ONE CHASE MANHATTAN PLAZA",,"NEW YORK",NY,"NEW YORK","US Mid Atlantic",,,"=""6399""","Insurance Carriers, NEC",524130,"Reinsurance Carriers",34,125,12/31/22,"6,606,967,296",12/31/22,"10,193,000,000","276,600,000","986,800,000","33,123,800,000"
26398,"Insurance contract liabilities","Valuation of the Loss and Loss Adjustment Expense (LAE) Reserve and the Salvage and Subrogation Recoverable - Estimation of the Expected Loss to be Paid (Recovered)",502384,12/31/22,03/01/23,1,"PricewaterhouseCoopers LLP",,,,"New York",NY,"NEW YORK","US Mid Atlantic",10-K,2023-03-01,,"ASSURED GUARANTY LTD",1273813,"=""AGO""","30 WOODBOURNE AVENUE","5TH FLOOR",HAMILTON,D0,BERMUDA,Foreign,,,"=""6351""","Surety Insurance",524292,"Third Party Administration of Insurance and Pension Funds",34,62,12/31/22,"3,674,151,936",12/31/22,"723,000,000","124,000,000","4,901,000,000","16,843,000,000"
26393,Inventory,"Evaluation of the sufficiency of audit evidence over inventories and net sales
",502728,12/31/22,03/01/23,4,"KPMG LLP",,,,Atlanta,GA,GEORGIA,"US Southeast",10-K,2023-03-01,,"ASTEC INDUSTRIES INC",792987,"=""ASTE""","1725 SHEPHERD ROAD",,CHATTANOOGA,TN,TENNESSEE,"US Southeast",,,"=""3531""","Construction Machinery and Equipment",333120,"Construction Machinery Manufacturing",34,41,12/31/22,"919,893,120",12/31/22,"1,274,500,000","-100,000","559,200,000","1,014,400,000"
26394,Goodwill,"Goodwill impairment analysis for the Material Solutions reporting unit",502728,12/31/22,03/01/23,4,"KPMG LLP",,,,Atlanta,GA,GEORGIA,"US Southeast",10-K,2023-03-01,,"ASTEC INDUSTRIES INC",792987,"=""ASTE""","1725 SHEPHERD ROAD",,CHATTANOOGA,TN,TENNESSEE,"US Southeast",,,"=""3531""","Construction Machinery and Equipment",333120,"Construction Machinery Manufacturing",34,41,12/31/22,"919,893,120",12/31/22,"1,274,500,000","-100,000","559,200,000","1,014,400,000"
28393,Goodwill,"Impairment of Goodwill ",506973,12/31/22,03/30/23,1,"PricewaterhouseCoopers LLP",,,,"San Francisco",CA,CALIFORNIA,"US West",10-K,2023-03-30,Yes,"Astra Space, Inc.",1814329,,"1900 SKYHAWK STREET",,ALAMEDA,CA,CALIFORNIA,"US West",,,"=""4700""","Transportation Services",336414,"Guided Missile and Space Vehicle Manufacturing",34,0,12/31/22,"92,744,696",12/31/22,"9,370,000","-411,438,000","72,178,000","174,699,000"
28394,"Property, plant and equipment","Impairment of Property, Plant and Equipment",506973,12/31/22,03/30/23,1,"PricewaterhouseCoopers LLP",,,,"San Francisco",CA,CALIFORNIA,"US West",10-K,2023-03-30,Yes,"Astra Space, Inc.",1814329,,"1900 SKYHAWK STREET",,ALAMEDA,CA,CALIFORNIA,"US West",,,"=""4700""","Transportation Services",336414,"Guided Missile and Space Vehicle Manufacturing",34,0,12/31/22,"92,744,696",12/31/22,"9,370,000","-411,438,000","72,178,000","174,699,000"
26441,"Accounts/loans receivable","Risk Pool Settlements and Related Receivables",502343,12/31/22,03/01/23,2,"Ernst & Young LLP",,,,"Los Angeles",CA,CALIFORNIA,"US West",10-K,2023-03-01,,"Astrana Health, Inc.",1083446,"=""ASTH""","1668 S. GARFIELD AVENUE","2ND FLOOR",ALHAMBRA,CA,CALIFORNIA,"US West",,,"=""8742""","Management Consulting Services",621111,"Offices of Physicians (except Mental Health Specialists)",34,30,12/29/22,"1,685,820,800",12/31/22,"1,144,163,000","45,171,000","210,884,000","966,213,000"
26442,"Insurance contract liabilities","Valuation of Incurred but not Reported (IBNR) Claims Liability",502343,12/31/22,03/01/23,2,"Ernst & Young LLP",,,,"Los Angeles",CA,CALIFORNIA,"US West",10-K,2023-03-01,,"Astrana Health, Inc.",1083446,"=""ASTH""","1668 S. GARFIELD AVENUE","2ND FLOOR",ALHAMBRA,CA,CALIFORNIA,"US West",,,"=""8742""","Management Consulting Services",621111,"Offices of Physicians (except Mental Health Specialists)",34,30,12/29/22,"1,685,820,800",12/31/22,"1,144,163,000","45,171,000","210,884,000","966,213,000"
30897,"Accounts/loans receivable","Risk Pool Settlements and Related Receivables",515784,12/31/22,03/01/23,2,"Ernst & Young LLP",,,,"Los Angeles",CA,CALIFORNIA,"US West",10-K/A,2023-08-09,,"Astrana Health, Inc.",1083446,"=""ASTH""","1668 S. GARFIELD AVENUE","2ND FLOOR",ALHAMBRA,CA,CALIFORNIA,"US West",,,"=""8742""","Management Consulting Services",621111,"Offices of Physicians (except Mental Health Specialists)",34,30,12/29/22,"1,685,820,800",12/31/22,"1,144,163,000","45,171,000","210,884,000","966,213,000"
30898,"Insurance contract liabilities","Valuation of Incurred but not Reported (IBNR) Claims Liability",515784,12/31/22,03/01/23,2,"Ernst & Young LLP",,,,"Los Angeles",CA,CALIFORNIA,"US West",10-K/A,2023-08-09,,"Astrana Health, Inc.",1083446,"=""ASTH""","1668 S. GARFIELD AVENUE","2ND FLOOR",ALHAMBRA,CA,CALIFORNIA,"US West",,,"=""8742""","Management Consulting Services",621111,"Offices of Physicians (except Mental Health Specialists)",34,30,12/29/22,"1,685,820,800",12/31/22,"1,144,163,000","45,171,000","210,884,000","966,213,000"
24606,"Sales return and allowances","Recognition and measurement of accruals for Managed Care, Medicaid and Medicare Part D rebates on US Product Sales (excluding Rare Diseases)",500118,12/31/22,02/09/23,1,"PricewaterhouseCoopers LLP",121,"PricewaterhouseCoopers LLP",876,London,X0,"UNITED KINGDOM",Foreign,20-F,2023-02-21,,"ASTRAZENECA PLC",901832,"=""AZN""","1 FRANCIS CRICK AVENUE","CAMBRIDGE BIOMEDICAL CAMPUS",LONDON,X0,"UNITED KINGDOM",Foreign,,,"=""2834""","Pharmaceutical Preparations",325412,"Pharmaceutical Preparation Manufacturing",34,68,12/29/22,"52,757,094,400",12/31/22,"44,351,000,000","3,293,000,000","-22,090,000,000","96,483,000,000"
24607,"Other intangible assets","Impairment assessment of the product, marketing and distribution rights and other intangibles",500118,12/31/22,02/09/23,1,"PricewaterhouseCoopers LLP",121,"PricewaterhouseCoopers LLP",876,London,X0,"UNITED KINGDOM",Foreign,20-F,2023-02-21,,"ASTRAZENECA PLC",901832,"=""AZN""","1 FRANCIS CRICK AVENUE","CAMBRIDGE BIOMEDICAL CAMPUS",LONDON,X0,"UNITED KINGDOM",Foreign,,,"=""2834""","Pharmaceutical Preparations",325412,"Pharmaceutical Preparation Manufacturing",34,68,12/29/22,"52,757,094,400",12/31/22,"44,351,000,000","3,293,000,000","-22,090,000,000","96,483,000,000"
24608,"Other contingent liabilities","Recognition and measurement of legal provisions and disclosure of contingent liabilities",500118,12/31/22,02/09/23,1,"PricewaterhouseCoopers LLP",121,"PricewaterhouseCoopers LLP",876,London,X0,"UNITED KINGDOM",Foreign,20-F,2023-02-21,,"ASTRAZENECA PLC",901832,"=""AZN""","1 FRANCIS CRICK AVENUE","CAMBRIDGE BIOMEDICAL CAMPUS",LONDON,X0,"UNITED KINGDOM",Foreign,,,"=""2834""","Pharmaceutical Preparations",325412,"Pharmaceutical Preparation Manufacturing",34,68,12/29/22,"52,757,094,400",12/31/22,"44,351,000,000","3,293,000,000","-22,090,000,000","96,483,000,000"
24609,"Uncertain tax positions","Recognition, measurement and disclosure of tax liabilities for uncertain tax treatments",500118,12/31/22,02/09/23,1,"PricewaterhouseCoopers LLP",121,"PricewaterhouseCoopers LLP",876,London,X0,"UNITED KINGDOM",Foreign,20-F,2023-02-21,,"ASTRAZENECA PLC",901832,"=""AZN""","1 FRANCIS CRICK AVENUE","CAMBRIDGE BIOMEDICAL CAMPUS",LONDON,X0,"UNITED KINGDOM",Foreign,,,"=""2834""","Pharmaceutical Preparations",325412,"Pharmaceutical Preparation Manufacturing",34,68,12/29/22,"52,757,094,400",12/31/22,"44,351,000,000","3,293,000,000","-22,090,000,000","96,483,000,000"
24610,"Pension and other post-employment benefits","Valuation of defined benefit obligations (in the UK and Sweden)",500118,12/31/22,02/09/23,1,"PricewaterhouseCoopers LLP",121,"PricewaterhouseCoopers LLP",876,London,X0,"UNITED KINGDOM",Foreign,20-F,2023-02-21,,"ASTRAZENECA PLC",901832,"=""AZN""","1 FRANCIS CRICK AVENUE","CAMBRIDGE BIOMEDICAL CAMPUS",LONDON,X0,"UNITED KINGDOM",Foreign,,,"=""2834""","Pharmaceutical Preparations",325412,"Pharmaceutical Preparation Manufacturing",34,68,12/29/22,"52,757,094,400",12/31/22,"44,351,000,000","3,293,000,000","-22,090,000,000","96,483,000,000"
27805,"Research and development expenses","STAR-0215 Accrued and Prepaid Research and Development Costs",505755,12/31/22,03/22/23,2,"Ernst & Young LLP",,,,Boston,MA,MASSACHUSETTS,"US New England",10-K,2023-03-22,,"Astria Therapeutics, Inc.",1454789,"=""ATXS""","22 BOSTON WHARF ROAD","10TH FLOOR",BOSTON,MA,MASSACHUSETTS,"US New England",,,"=""2834""","Pharmaceutical Preparations",325412,"Pharmaceutical Preparation Manufacturing",34,15,12/31/22,"409,494,944",12/31/22,,"-51,834,000",,"230,633,000"
27149,Goodwill,"Valuation of Goodwill",504612,12/31/22,03/10/23,2,"Ernst & Young LLP",,,,Buffalo,NY,"NEW YORK","US Mid Atlantic",10-K,2023-03-10,,"ASTRONICS CORP",8063,"=""ATRO""","130 COMMERCE WAY",-,"EAST AURORA",NY,"NEW YORK","US Mid Atlantic",,,"=""3728""","Aircraft Parts and Auxiliary Equipment, NEC",336413,"Other Aircraft Parts and Auxiliary Equipment Manufacturing",34,10,12/31/22,"267,462,496",12/31/22,"534,894,000","-35,747,000","102,474,000","615,031,000"
27150,"Revenue from customer contracts","Revenue Recognition",504612,12/31/22,03/10/23,2,"Ernst & Young LLP",,,,Buffalo,NY,"NEW YORK","US Mid Atlantic",10-K,2023-03-10,,"ASTRONICS CORP",8063,"=""ATRO""","130 COMMERCE WAY",-,"EAST AURORA",NY,"NEW YORK","US Mid Atlantic",,,"=""3728""","Aircraft Parts and Auxiliary Equipment, NEC",336413,"Other Aircraft Parts and Auxiliary Equipment Manufacturing",34,10,12/31/22,"267,462,496",12/31/22,"534,894,000","-35,747,000","102,474,000","615,031,000"
23920,"Pension and other post-employment benefits","Discount rates used in determining pension and postretirement benefit obligations",499297,12/31/22,02/13/23,2,"Ernst & Young LLP",,,,Dallas,TX,TEXAS,"US Southwest",10-K,2023-02-13,,"AT&T Inc.",732717,"=""T""","208 S. AKARD ST",,DALLAS,TX,TEXAS,"US Southwest",,,"=""4813""","Telephone Communications, Except Radiotelephone",517110,"Wired Telecommunications Carriers",34,18,12/29/22,"131,493,150,720",12/31/22,"120,741,000,000","-8,524,000,000","-99,841,000,000","402,853,000,000"
23921,Goodwill,"Evaluation of goodwill for impairment",499297,12/31/22,02/13/23,2,"Ernst & Young LLP",,,,Dallas,TX,TEXAS,"US Southwest",10-K,2023-02-13,,"AT&T Inc.",732717,"=""T""","208 S. AKARD ST",,DALLAS,TX,TEXAS,"US Southwest",,,"=""4813""","Telephone Communications, Except Radiotelephone",517110,"Wired Telecommunications Carriers",34,18,12/29/22,"131,493,150,720",12/31/22,"120,741,000,000","-8,524,000,000","-99,841,000,000","402,853,000,000"
28958,Goodwill,"Valuation of goodwill",508562,12/31/22,04/12/23,4,"KPMG LLP",355,"KPMG Huazhen LLP",1186,Beijing,F4,CHINA,Foreign,20-F,2023-04-12,,"ATA Creativity Global",1420529,"=""AACG""","RM. 507, BLDG. 3, BINHUZHUOYUECHENG","WENHUAKECHUANGYUAN, HUAYUAN BLVD. 365","BAOHE, HEFEI, ANHUI",F4,CHINA,Foreign,,,"=""8200""","Services-Educational Services",611710,"Educational Support Services",34,1,12/29/22,"42,691,844",12/31/22,"29,751,122","-6,889,381","-18,601,148","68,251,617"
23700,"Revenue from customer contracts","License and Collaboration Revenue and Deferred Revenue – Accounting for Out- License Agreement – Refer to Notes 2 and 5 to the Financial Statements",498853,12/31/22,02/08/23,3,"Deloitte & Touche LLP",,,,"San Francisco",CA,CALIFORNIA,"US West",10-K,2023-02-08,,"Atara Biotherapeutics, Inc.",1604464,"=""ATRA""","1280 RANCHO CONEJO BLVD",,"THOUSAND OAKS",CA,CALIFORNIA,"US West",,,"=""2836""","Biological Products, Except Diagnostic Substances",325412,"Pharmaceutical Preparation Manufacturing",34,3,12/31/22,"314,640,576",12/31/22,"63,573,000","-228,302,000",,"376,420,000"
23701,"Research and development expenses","Accrued Research and Development Expenses & Prepaid Research and Development Expenses - Refer to Note 2 to the financial statements",498853,12/31/22,02/08/23,3,"Deloitte & Touche LLP",,,,"San Francisco",CA,CALIFORNIA,"US West",10-K,2023-02-08,,"Atara Biotherapeutics, Inc.",1604464,"=""ATRA""","1280 RANCHO CONEJO BLVD",,"THOUSAND OAKS",CA,CALIFORNIA,"US West",,,"=""2836""","Biological Products, Except Diagnostic Substances",325412,"Pharmaceutical Preparation Manufacturing",34,3,12/31/22,"314,640,576",12/31/22,"63,573,000","-228,302,000",,"376,420,000"
31819,"Going concern","Going Concern and Restructuring Plan— Refer to Notes 2 a) and 31 to the financial statements",520413,12/31/22,11/28/23,3,"Deloitte & Touche LLP",4,"Deloitte Touche Tohmatsu Auditores Independentes",1045,"São Paulo",D5,BRAZIL,Foreign,20-F,2023-11-29,Yes,"Atento S.A.",1606457,,"DA VINCI BLDG, 4 RUE LOU HEMMER,","L-1748 LUXEMBOURG FINDEL",LUXEMBOURG-FINDEL,N4,LUXEMBOURG,Foreign,,,"=""4813""","Telephone Communications, Except Radiotelephone",517110,"Wired Telecommunications Carriers",34,,,,12/31/22,"1,389,968,000","-295,577,000","-503,472,000","885,972,000"
31820,"Revenue from customer contracts","Unbilled Revenue — Refer to Notes 3P) and 22 to the financial statements",520413,12/31/22,11/28/23,3,"Deloitte & Touche LLP",4,"Deloitte Touche Tohmatsu Auditores Independentes",1045,"São Paulo",D5,BRAZIL,Foreign,20-F,2023-11-29,Yes,"Atento S.A.",1606457,,"DA VINCI BLDG, 4 RUE LOU HEMMER,","L-1748 LUXEMBOURG FINDEL",LUXEMBOURG-FINDEL,N4,LUXEMBOURG,Foreign,,,"=""4813""","Telephone Communications, Except Radiotelephone",517110,"Wired Telecommunications Carriers",34,,,,12/31/22,"1,389,968,000","-295,577,000","-503,472,000","885,972,000"
31821,"Other contingent liabilities","Provision for liabilities and taxes - Refer to Note 21 to the financial statements",520413,12/31/22,11/28/23,3,"Deloitte & Touche LLP",4,"Deloitte Touche Tohmatsu Auditores Independentes",1045,"São Paulo",D5,BRAZIL,Foreign,20-F,2023-11-29,Yes,"Atento S.A.",1606457,,"DA VINCI BLDG, 4 RUE LOU HEMMER,","L-1748 LUXEMBOURG FINDEL",LUXEMBOURG-FINDEL,N4,LUXEMBOURG,Foreign,,,"=""4813""","Telephone Communications, Except Radiotelephone",517110,"Wired Telecommunications Carriers",34,,,,12/31/22,"1,389,968,000","-295,577,000","-503,472,000","885,972,000"
31822,Goodwill,"Impairment of assets - Goodwill - Refer to Note 8 to the financial statements",520413,12/31/22,11/28/23,3,"Deloitte & Touche LLP",4,"Deloitte Touche Tohmatsu Auditores Independentes",1045,"São Paulo",D5,BRAZIL,Foreign,20-F,2023-11-29,Yes,"Atento S.A.",1606457,,"DA VINCI BLDG, 4 RUE LOU HEMMER,","L-1748 LUXEMBOURG FINDEL",LUXEMBOURG-FINDEL,N4,LUXEMBOURG,Foreign,,,"=""4813""","Telephone Communications, Except Radiotelephone",517110,"Wired Telecommunications Carriers",34,,,,12/31/22,"1,389,968,000","-295,577,000","-503,472,000","885,972,000"
26570,"Other investments","Valuation of Certain Structured Level 3 Asset-Backed Securities - Refer to Note 3, Investments, Note 6, Fair Value, and Note 14, Related Parties",502213,12/31/22,02/28/23,3,"Deloitte & Touche LLP",,,,"Des Moines",IA,IOWA,"US Midwest",10-K,2023-03-01,,"Athene Holding Ltd.",1527469,"=""ATHS""","7700 MILLS CIVIC PARKWAY",,"WEST DES MOINES",IA,IOWA,"US Midwest",,,"=""6311""","Life Insurance",523920,"Portfolio Management",34,22,12/29/22,"4,144,493,056",12/31/22,"7,623,000,000","-2,910,000,000","3,100,000,000","243,931,000,000"
26571,"Insurance contract liabilities","Certain Assumptions Used in the Valuation of Value of Business Acquired (VOBA), Future Policy Benefits, and Interest Sensitive Contract Liabilities - Refer to notes 1, Business, Basis of Presentation and Significant Accounting Policies, 6, Fair Value, and 8, Deferred Acquisition Costs, Deferred Sales Inducements and Value of Business Acquired",502213,12/31/22,02/28/23,3,"Deloitte & Touche LLP",,,,"Des Moines",IA,IOWA,"US Midwest",10-K,2023-03-01,,"Athene Holding Ltd.",1527469,"=""ATHS""","7700 MILLS CIVIC PARKWAY",,"WEST DES MOINES",IA,IOWA,"US Midwest",,,"=""6311""","Life Insurance",523920,"Portfolio Management",34,22,12/29/22,"4,144,493,056",12/31/22,"7,623,000,000","-2,910,000,000","3,100,000,000","243,931,000,000"
27730,"Sales return and allowances","Revenue Chargebacks – Refer to Note 19 (Commercial Platform) to the consolidated financial statements",505583,12/31/22,03/20/23,3,"Deloitte & Touche LLP",,,,Williamsville,NY,"NEW YORK","US Mid Atlantic",10-K,2023-03-20,Yes,"Athenex, Inc.",1300699,,"1001 MAIN STREET","SUITE 600",BUFFALO,NY,"NEW YORK","US Mid Atlantic",,,"=""2834""","Pharmaceutical Preparations",325412,"Pharmaceutical Preparation Manufacturing",34,3,12/31/22,"25,448,968",12/31/22,"102,821,000","-103,427,000","-78,618,000","204,055,000"
27731,"Long-lived assets","Accounting for Kuur In-Process Research and Development and Contingent Consideration – Refer to Note 8 (Kuur IPR&D) and Note 13 (Contingent Consideration) to the consolidated financial statements",505583,12/31/22,03/20/23,3,"Deloitte & Touche LLP",,,,Williamsville,NY,"NEW YORK","US Mid Atlantic",10-K,2023-03-20,Yes,"Athenex, Inc.",1300699,,"1001 MAIN STREET","SUITE 600",BUFFALO,NY,"NEW YORK","US Mid Atlantic",,,"=""2834""","Pharmaceutical Preparations",325412,"Pharmaceutical Preparation Manufacturing",34,3,12/31/22,"25,448,968",12/31/22,"102,821,000","-103,427,000","-78,618,000","204,055,000"
27732,"Other liabilities and provisions","Revenue Interest Purchase Agreement – Refer to Note 12 (Royalty Financing Liability) to the consolidated financial statements",505583,12/31/22,03/20/23,3,"Deloitte & Touche LLP",,,,Williamsville,NY,"NEW YORK","US Mid Atlantic",10-K,2023-03-20,Yes,"Athenex, Inc.",1300699,,"1001 MAIN STREET","SUITE 600",BUFFALO,NY,"NEW YORK","US Mid Atlantic",,,"=""2834""","Pharmaceutical Preparations",325412,"Pharmaceutical Preparation Manufacturing",34,3,12/31/22,"25,448,968",12/31/22,"102,821,000","-103,427,000","-78,618,000","204,055,000"
28816,"Other debt","Issuance of Common Stock and Warrants",507909,12/31/22,03/31/23,2,"Ernst & Young LLP",,,,Cleveland,OH,OHIO,"US Midwest",10-K,2023-04-03,Yes,"ATHERSYS, INC / NEW",1368148,"=""ATHXQ""","3201 CARNEGIE AVENUE",,CLEVELAND,OH,OHIO,"US Midwest",,,"=""2834""","Pharmaceutical Preparations",325412,"Pharmaceutical Preparation Manufacturing",34,1,12/31/22,"15,108,363",12/31/22,"5,325,000","-72,534,000",,"27,731,000"
25480,Goodwill,"Goodwill impairment assessment- Forged Products reporting unit",500977,12/31/22,02/24/23,2,"Ernst & Young LLP",,,,Pittsburgh,PA,PENNSYLVANIA,"US Mid Atlantic",10-K,2023-02-24,,"ATI INC",1018963,"=""ATI""","2021 MCKINNEY AVENUE",,DALLAS,TX,TEXAS,"US Southwest",,,"=""3317""","Steel Pipe and Tubes",331111,"Iron and Steel Mills",34,30,12/31/22,"3,830,233,088",12/31/22,"3,836,000,000","130,900,000","818,700,000","4,445,600,000"
27566,"Revenue from customer contracts","Valuation of patient service revenue and related accounts receivable - contractual allowances",505413,12/31/22,03/16/23,1,"PricewaterhouseCoopers LLP",,,,Chicago,IL,ILLINOIS,"US Midwest",10-K,2023-03-16,Yes,"ATI Physical Therapy, Inc.",1815849,"=""ATIP""","2001 BUTTERFIELD ROAD","SUITE 1600","DOWNERS GROVE",IL,ILLINOIS,"US Midwest",,,"=""8050""","Services-Nursing & Personal Care Facilities",621340,"Offices of Physical, Occupational and Speech Therapists, and Audiologists",34,0,12/31/22,"60,512,000",12/31/22,"635,671,000","-492,379,000","-348,742,000","1,078,985,000"
27567,"Goodwill and intangible assets","Goodwill and trade name indefinite-lived intangible asset impairment assessments",505413,12/31/22,03/16/23,1,"PricewaterhouseCoopers LLP",,,,Chicago,IL,ILLINOIS,"US Midwest",10-K,2023-03-16,Yes,"ATI Physical Therapy, Inc.",1815849,"=""ATIP""","2001 BUTTERFIELD ROAD","SUITE 1600","DOWNERS GROVE",IL,ILLINOIS,"US Midwest",,,"=""8050""","Services-Nursing & Personal Care Facilities",621340,"Offices of Physical, Occupational and Speech Therapists, and Audiologists",34,0,12/31/22,"60,512,000",12/31/22,"635,671,000","-492,379,000","-348,742,000","1,078,985,000"
22917,"Business combinations","United Poly Systems, LLC (“United Poly”) - Acquisitions - Refer to Note 3 to the financial statements",494659,09/30/22,11/18/22,3,"Deloitte & Touche LLP",,,,Chicago,IL,ILLINOIS,"US Midwest",10-K,2022-11-18,,"Atkore Inc.",1666138,"=""ATKR""","16100 SOUTH LATHROP AVENUE",,HARVEY,IL,ILLINOIS,"US Midwest",,,"=""3690""","Miscellaneous Electrical Machinery, Equipment & Supplies",335932,"Noncurrent-Carrying Wiring Device Manufacturing",34,78,09/30/22,"3,197,248,000",09/30/22,"3,913,949,000","913,433,000","577,751,000","2,598,996,000"
24002,"Regulatory assets and liabilities","Accounting for the Effects of Rate Regulation",499356,12/31/22,02/14/23,1,"PricewaterhouseCoopers LLP",,,,Philadelphia,PA,PENNSYLVANIA,"US Mid Atlantic",10-K,2023-02-14,,"ATLANTIC CITY ELECTRIC CO",8192,,"500 NORTH WAKEFIELD DRIVE",,NEWARK,DE,DELAWARE,"US Mid Atlantic",1109357,"EXELON CORP","=""4911""","Electric Services",221122,"Electric Power Distribution",34,,,,12/31/22,"1,431,000,000","148,000,000",,"4,979,000,000"
25469,"Allowance for credit losses","Allowance for Loan and Lease Losses (ALLL) ",501278,12/31/22,02/23/23,2,"Ernst & Young LLP",,,,Richmond,VA,VIRGINIA,"US Mid Atlantic",10-K,2023-02-24,,"Atlantic Union Bankshares Corp",883948,"=""AUB""","4300 COX ROAD",,"GLEN ALLEN",VA,VIRGINIA,"US Mid Atlantic",,,"=""6022""","State Commercial Banks",522110,"Commercial Banking",34,35,12/31/22,"2,625,401,600",12/31/22,"683,756,000","234,510,000","1,420,765,000","20,461,138,000"
26568,"Other intangible assets","Recoverability assessment of contracted concessional, PP&E and other intangible assets",502193,12/31/22,02/28/23,2,"Ernst & Young LLP",163,"Ernst & Young SL",1461,Madrid,U3,SPAIN,Foreign,20-F,2023-03-01,,"Atlantica Sustainable Infrastructure plc",1601072,,"GREAT WEST HOUSE, GW1, 17TH FLOOR","GREAT WEST ROAD",BRENTFORD,X0,"UNITED KINGDOM",Foreign,,,"=""4911""","Electric Services",221121,"Electric Bulk Power Transmission and Control",34,26,12/29/22,"2,950,577,920",12/31/22,"1,102,029,000","-5,443,000",,"9,100,911,000"
24847,"Deferred and capitalized costs","Heavy Maintenance Costs ",500630,12/31/22,02/23/23,1,"PricewaterhouseCoopers LLP",,,,"New York",NY,"NEW YORK","US Mid Atlantic",10-K,2023-02-23,,"ATLAS AIR WORLDWIDE HOLDINGS INC",1135185,,"2000 WESTCHESTER AVENUE",,PURCHASE,NY,"NEW YORK","US Mid Atlantic",,,"=""4522""","Air Transportation, Nonscheduled",481212,"Nonscheduled Chartered Freight Air Transportation",34,101,12/31/22,"2,877,053,952",12/31/22,"4,549,104,000","355,880,000","3,006,010,000","6,696,316,000"
27486,"Property, plant and equipment","Assessment of indicators of impairment for vessels",505192,12/31/22,03/15/23,4,"KPMG LLP",187,"KPMG LLP Chartered Accountants",85,Vancouver,A1,"BRITISH COLUMBIA",Canada,20-F,2023-03-16,,"Atlas Corp.",1794846,,"2600-200 GRANVILLE STREET",,VANCOUVER,A1,"BRITISH COLUMBIA",Canada,,,"=""4412""","Deep Sea Foreign Transportation of  Freight",483111,"Deep Sea Freight Transportation",34,15,12/29/22,"3,789,358,848",12/31/22,"1,543,000,000","622,300,000","4,350,500,000","11,302,400,000"
22118,"Revenue from customer contracts","Revenue recognition",490938,06/30/22,08/19/22,2,"Ernst & Young LLP",,,,"San Francisco",CA,CALIFORNIA,"US West",20-F,2022-08-19,,"Atlassian Corp",1650372,"=""TEAM""","350 BUSH STREET","FLOOR 13","SAN FRANCISCO",CA,CALIFORNIA,"US West",,,"=""7372""","Prepackaged Software",511210,"Software Publishers",34,193,06/28/22,"26,445,475,840",06/30/22,"2,802,882,000","-614,124,000","-497,903,000","3,361,206,000"
22858,"Deferred and capitalized costs","Determination of Capital Costs",494489,09/30/22,11/14/22,2,"Ernst & Young LLP",,,,Dallas,TX,TEXAS,"US Southwest",10-K,2022-11-14,,"ATMOS ENERGY CORP",731802,"=""ATO""","1800 THREE LINCOLN CTR","5430 LBJ FREEWAY",DALLAS,TX,TEXAS,"US Southwest",,,"=""4924""","Natural Gas Distribution",221210,"Natural Gas Distribution",34,102,09/30/22,"14,350,318,592",09/30/22,"4,201,662,000","774,398,000","8,687,834,000","22,192,989,000"
27422,Goodwill,"Goodwill impairment assessment for a certain reporting unit in the US Telecom segment",505121,12/31/22,03/15/23,1,"PricewaterhouseCoopers LLP",,,,Boston,MA,MASSACHUSETTS,"US New England",10-K,2023-03-15,,"ATN International, Inc.",879585,"=""ATNI""","500 CUMMINGS CENTER",,BEVERLY,MA,MASSACHUSETTS,"US New England",,,"=""4813""","Telephone Communications, Except Radiotelephone",517310,"Telecommunications Resellers",34,45,12/31/22,"714,236,992",12/31/22,"725,745,000","-5,645,000","487,488,000","1,707,869,000"
29225,"Other intangible assets","Intangible assets - Brand names - Refer to Notes 2.11, 2.13 and 6 to the financial statements",509131,12/31/22,04/18/23,3,"Deloitte & Touche LLP",499,"Deloitte Touche Tohmatsu Certified Public Accountants LLP",1113,Shanghai,F4,CHINA,Foreign,20-F,2023-04-18,,"ATRenew Inc.",1838957,"=""RERE""","12TH FLOOR, NO.6 BUILDING","433 SONGHU ROAD",SHANGHAI,K3,"HONG KONG",Foreign,,,"=""5990""","Retail-Retail Stores, NEC",453310,"Used Merchandise Stores",34,3,12/29/22,"406,169,984",12/31/22,"1,419,714,000","-355,012,000","480,029,000","726,262,000"
29226,Goodwill,"Goodwill - Refer to Notes 2.12 and 8 to the financial statements",509131,12/31/22,04/18/23,3,"Deloitte & Touche LLP",499,"Deloitte Touche Tohmatsu Certified Public Accountants LLP",1113,Shanghai,F4,CHINA,Foreign,20-F,2023-04-18,,"ATRenew Inc.",1838957,"=""RERE""","12TH FLOOR, NO.6 BUILDING","433 SONGHU ROAD",SHANGHAI,K3,"HONG KONG",Foreign,,,"=""5990""","Retail-Retail Stores, NEC",453310,"Used Merchandise Stores",34,3,12/29/22,"406,169,984",12/31/22,"1,419,714,000","-355,012,000","480,029,000","726,262,000"
24769,"Deferred and stock-based compensation","Valuation of Performance Share Awards with a Market Condition - Refer to Note 15 to the financial statements",500353,12/31/22,02/22/23,3,"Deloitte & Touche LLP",,,,Cincinnati,OH,OHIO,"US Midwest",10-K,2023-02-22,,"AtriCure, Inc.",1323885,"=""ATRC""","7555 INNOVATION WAY",,MASON,OH,OHIO,"US Midwest",,,"=""3841""","Surgical and Medical Instruments and Apparatus",339113,"Surgical Appliance and Supplies Manufacturing",34,44,12/31/22,"2,066,465,920",12/31/22,"330,379,000","-46,466,000","182,634,000","585,448,000"
27288,"Research and development expenses","Accrued clinical and manufacturing costs ",504914,12/31/22,03/14/23,2,"Ernst & Young LLP",,,,"San Diego",CA,CALIFORNIA,"US West",10-K,2023-03-14,,"aTYR PHARMA INC",1339970,"=""ATYR""","10240 SORRENTO VALLEY ROAD","SUITE 300","SAN DIEGO",CA,CALIFORNIA,"US West",,,"=""2836""","Biological Products, Except Diagnostic Substances",325414,"Biological Product (except Diagnostic) Manufacturing",34,2,12/29/22,"60,339,516",12/31/22,"10,386,000","-45,338,000",,"95,786,000"
29385,"Revenue from customer contracts","Revenue Recognition",509764,12/31/22,04/24/23,2,"Ernst & Young LLP",222,"Kost Forer Gabbay & Kasierer",1281,"Tel Aviv",L3,ISRAEL,Foreign,20-F,2023-04-24,,"AUDIOCODES LTD",1086434,"=""AUDC""","6 OFRA HAZA STREET",,"AIRPORT CITY LOD",L3,ISRAEL,Foreign,,,"=""3661""","Telephone and Telegraph Apparatus",334513,"Instruments and Related Products Manufacturing for Measuring, Displaying, and Controlling Industrial Proc",34,18,12/29/22,"576,843,328",12/31/22,"275,093,000","28,466,000","150,634,000","323,831,000"
25979,"Deferred and stock-based compensation","Measurement of Deferred Compensation Liability",501974,12/31/22,02/27/23,1,"PricewaterhouseCoopers LLP",191,"PricewaterhouseCoopers LLP Chartered Accountants",271,Oakville,A6,ONTARIO,Canada,10-K,2023-02-28,,"Aurinia Pharmaceuticals Inc.",1600620,"=""AUPH""","#140, 14315 - 118 AVENUE",,EDMONTON,A0,ALBERTA,Canada,,,"=""2834""","Pharmaceutical Preparations",325412,"Pharmaceutical Preparation Manufacturing",34,4,12/31/22,"614,597,760",12/31/22,"134,030,000","-108,180,000","399,010,000","470,860,000"
22426,"Long-lived assets","Valuation of goodwill, intangible assets, and property, plant and equipment in the Canadian cannabis operating segment and in the International cannabis operating segment",492184,06/30/22,09/20/22,4,"KPMG LLP",187,"KPMG LLP Chartered Accountants",85,Vancouver,A1,"BRITISH COLUMBIA",Canada,40-F,2022-09-21,,"AURORA CANNABIS INC",1683541,"=""ACB""","2207 90B STREET SW",,EDMONTON,A0,ALBERTA,Canada,,,"=""2833""","Medicinal Chemicals and Botanical Products",111419,"Other Food Crops Grown Under Cover",34,1,06/28/22,"295,122,688",06/30/22,"171,587,000","-1,331,818,000","458,272,000","840,619,000"
22427,"Other assets","Measurement of fair value of biological assets",492184,06/30/22,09/20/22,4,"KPMG LLP",187,"KPMG LLP Chartered Accountants",85,Vancouver,A1,"BRITISH COLUMBIA",Canada,40-F,2022-09-21,,"AURORA CANNABIS INC",1683541,"=""ACB""","2207 90B STREET SW",,EDMONTON,A0,ALBERTA,Canada,,,"=""2833""","Medicinal Chemicals and Botanical Products",111419,"Other Food Crops Grown Under Cover",34,1,06/28/22,"295,122,688",06/30/22,"171,587,000","-1,331,818,000","458,272,000","840,619,000"
22428,Inventory,"Assessment of the cannabis inventory provision",492184,06/30/22,09/20/22,4,"KPMG LLP",187,"KPMG LLP Chartered Accountants",85,Vancouver,A1,"BRITISH COLUMBIA",Canada,40-F,2022-09-21,,"AURORA CANNABIS INC",1683541,"=""ACB""","2207 90B STREET SW",,EDMONTON,A0,ALBERTA,Canada,,,"=""2833""","Medicinal Chemicals and Botanical Products",111419,"Other Food Crops Grown Under Cover",34,1,06/28/22,"295,122,688",06/30/22,"171,587,000","-1,331,818,000","458,272,000","840,619,000"
18450,"Revenue from customer contracts","Revenue Recognition",479383,01/31/22,03/14/22,2,"Ernst & Young LLP",,,,"San Francisco",CA,CALIFORNIA,"US West",10-K,2022-03-14,,"Autodesk, Inc.",769397,"=""ADSK""","ONE MARKET, STE. 400.",,"SAN FRANCISCO",CA,CALIFORNIA,"US West",,,"=""7372""","Prepackaged Software",511210,"Software Publishers",34,250,01/31/22,"54,504,177,664",01/31/22,"4,386,000,000","497,000,000","-3,248,500,000","8,606,800,000"
18451,"Business combinations","Valuation of Innovyze intangible assets",479383,01/31/22,03/14/22,2,"Ernst & Young LLP",,,,"San Francisco",CA,CALIFORNIA,"US West",10-K,2022-03-14,,"Autodesk, Inc.",769397,"=""ADSK""","ONE MARKET, STE. 400.",,"SAN FRANCISCO",CA,CALIFORNIA,"US West",,,"=""7372""","Prepackaged Software",511210,"Software Publishers",34,250,01/31/22,"54,504,177,664",01/31/22,"4,386,000,000","497,000,000","-3,248,500,000","8,606,800,000"
29399,"Allowance for credit losses","Allowance for current expected credit losses on accounts receivable",509799,12/31/22,04/25/23,1,"PricewaterhouseCoopers LLP",94,"PricewaterhouseCoopers Zhong Tian LLP",1424,Beijing,F4,CHINA,Foreign,20-F,2023-04-25,,"Autohome Inc.",1527636,"=""ATHM""","18TH FLOOR TOWER B, CEC PLAZA","3 Dan Ling Street, Haidian District",BEIJING,F4,CHINA,Foreign,,,"=""7374""","Computer Processing and Data Preparation and Processing Services",518210,"Data Processing, Hosting, and Related Services",34,31,12/29/22,"3,918,963,200",12/31/22,"998,436,000","259,962,000","3,060,284,000","4,274,612,000"
29400,"Equity investments and joint ventures","The determination of fair value of convertible redeemable noncontrolling interests in TTP Car Inc. (“TTP”)",509799,12/31/22,04/25/23,1,"PricewaterhouseCoopers LLP",94,"PricewaterhouseCoopers Zhong Tian LLP",1424,Beijing,F4,CHINA,Foreign,20-F,2023-04-25,,"Autohome Inc.",1527636,"=""ATHM""","18TH FLOOR TOWER B, CEC PLAZA","3 Dan Ling Street, Haidian District",BEIJING,F4,CHINA,Foreign,,,"=""7374""","Computer Processing and Data Preparation and Processing Services",518210,"Data Processing, Hosting, and Related Services",34,31,12/29/22,"3,918,963,200",12/31/22,"998,436,000","259,962,000","3,060,284,000","4,274,612,000"
24201,"Revenue from customer contracts","Revenue recognition – Variable consideration related to price concessions",499610,12/31/22,02/16/23,2,"Ernst & Young LLP",55,"Ernst & Young AB",1433,Stockholm,V7,SWEDEN,Foreign,10-K,2023-02-16,,"AUTOLIV INC",1034670,"=""ALV""","3350 AIRPORT RD",,OGDEN,UT,UTAH,"US West",,,"=""3714""","Motor Vehicle Parts and Accessories",336399,"All Other Motor Vehicle Parts Manufacturing",34,78,12/29/22,"6,735,046,144",12/31/22,"8,842,000,000","423,000,000","1,235,000,000","7,718,000,000"
24202,"Warranty liabilities","Product recall liabilities",499610,12/31/22,02/16/23,2,"Ernst & Young LLP",55,"Ernst & Young AB",1433,Stockholm,V7,SWEDEN,Foreign,10-K,2023-02-16,,"AUTOLIV INC",1034670,"=""ALV""","3350 AIRPORT RD",,OGDEN,UT,UTAH,"US West",,,"=""3714""","Motor Vehicle Parts and Accessories",336399,"All Other Motor Vehicle Parts Manufacturing",34,78,12/29/22,"6,735,046,144",12/31/22,"8,842,000,000","423,000,000","1,235,000,000","7,718,000,000"
21959,Goodwill,"Goodwill – Employer Services Reportable Segment— Refer to Notes 1 and 7 to the financial statements",490418,06/30/22,08/03/22,3,"Deloitte & Touche LLP",,,,Morristown,NJ,"NEW JERSEY","US Mid Atlantic",10-K,2022-08-03,,"AUTOMATIC DATA PROCESSING INC",8670,"=""ADP""","ONE ADP BOULVARD",,ROSELAND,NJ,"NEW JERSEY","US Mid Atlantic",,,"=""7374""","Computer Processing and Data Preparation and Processing Services",518210,"Data Processing, Hosting, and Related Services",34,210,06/30/22,"87,397,646,336",06/30/22,"16,498,300,000","2,948,900,000","-408,300,000","63,068,200,000"
21960,"Other liabilities and provisions","Client Funds Obligations - Refer to Note 4 to the financial statements",490418,06/30/22,08/03/22,3,"Deloitte & Touche LLP",,,,Morristown,NJ,"NEW JERSEY","US Mid Atlantic",10-K,2022-08-03,,"AUTOMATIC DATA PROCESSING INC",8670,"=""ADP""","ONE ADP BOULVARD",,ROSELAND,NJ,"NEW JERSEY","US Mid Atlantic",,,"=""7374""","Computer Processing and Data Preparation and Processing Services",518210,"Data Processing, Hosting, and Related Services",34,210,06/30/22,"87,397,646,336",06/30/22,"16,498,300,000","2,948,900,000","-408,300,000","63,068,200,000"
24311,"Other intangible assets","Fair value of franchise rights",499887,12/31/22,02/17/23,4,"KPMG LLP",,,,"Fort Lauderdale",FL,FLORIDA,"US Southeast",10-K,2023-02-17,,"AUTONATION, INC.",350698,"=""AN""","200 SW 1ST AVE","SUITE 1600","FORT LAUDERDALE",FL,FLORIDA,"US Southeast",,,"=""5500""","Retail-Auto Dealers & Gasoline Stations",441110,"New Car Dealers",34,107,12/31/22,"5,112,500,736",12/31/22,"26,985,000,000","1,377,400,000","-109,300,000","10,059,700,000"
22678,"Other contingent liabilities","Valuation of Self-insurance Reserves",493509,08/27/22,10/24/22,2,"Ernst & Young LLP",,,,Memphis,TN,TENNESSEE,"US Southeast",10-K,2022-10-24,,"AUTOZONE INC",866787,"=""AZO""","123 SOUTH FRONT ST","DEPT 8074",MEMPHIS,TN,TENNESSEE,"US Southeast",,,"=""5531""","Auto and Home Supply Stores",441310,"Automotive Parts and Accessories Stores",34,"2,119",08/31/22,"40,532,008,960",08/27/22,"16,252,230,000","2,429,604,000","-3,841,558,000","15,275,043,000"
28179,"Going concern","Going Concern - Refer to Note 1 to the financial statements",506630,12/31/22,03/29/23,3,"Deloitte & Touche LLP",,,,"Saint Louis",MO,MISSOURI,"US Southeast",10-K,2023-03-29,,"AVADEL PHARMACEUTICALS PLC",1012477,"=""AVDL""","10 EARLSFORT TERRACE",,"DUBLIN 2",L2,IRELAND,Foreign,,,"=""2834""","Pharmaceutical Preparations",325412,"Pharmaceutical Preparation Manufacturing",34,7,12/31/22,"450,206,464",12/31/22,,"-137,464,000","-37,981,000","132,785,000"
28259,"Derivatives and hedging","Valuation of Derivative Instrument",506823,12/31/22,03/29/23,2,"Ernst & Young LLP",,,,Tysons,VA,VIRGINIA,"US Mid Atlantic",10-K,2023-03-29,Yes,"Avalo Therapeutics, Inc.",1534120,"=""AVTX""","1500 LIBERTY RIDGE DRIVE","SUITE 321",WAYNE,PA,PENNSYLVANIA,"US Mid Atlantic",,,"=""2834""","Pharmaceutical Preparations",325412,"Pharmaceutical Preparation Manufacturing",34,5,12/31/22,"47,529,600",12/31/22,"18,051,000","-41,658,000","-25,324,000","33,367,000"
25321,"Deferred and capitalized costs","Valuation of Deferred Development Costs and Land Held for Development",501239,12/31/22,02/24/23,2,"Ernst & Young LLP",,,,Tysons,VA,VIRGINIA,"US Mid Atlantic",10-K,2023-02-24,,"AVALONBAY COMMUNITIES INC",915912,"=""AVB""","4040 WILSON BOULEVARD","STE 1000",ARLINGTON,VA,VIRGINIA,"US Mid Atlantic",,,"=""6798""","Real Estate Investment Trusts",525990,"Other Financial Vehicles",34,162,12/31/22,"22,599,372,800",12/31/22,"2,593,446,000","1,136,775,000",,"20,457,764,000"
24758,Goodwill,"Evaluation of the impairment of the carrying value of goodwill in the Renewables reporting unit",500463,12/31/22,02/22/23,4,"KPMG LLP",,,,"New York",NY,"NEW YORK","US Mid Atlantic",10-K,2023-02-22,,"Avangrid, Inc.",1634997,,"180 MARSH HILL ROAD",,ORANGE,CT,CONNECTICUT,"US New England",,,"=""4911""","Electric Services",221119,"Other Electric Power Generation",34,44,12/29/22,"16,833,618,944",12/31/22,"7,923,000,000","881,000,000","15,980,000,000","41,123,000,000"
24759,"Regulatory assets and liabilities","Evaluation of regulatory assets and liabilities",500463,12/31/22,02/22/23,4,"KPMG LLP",,,,"New York",NY,"NEW YORK","US Mid Atlantic",10-K,2023-02-22,,"Avangrid, Inc.",1634997,,"180 MARSH HILL ROAD",,ORANGE,CT,CONNECTICUT,"US New England",,,"=""4911""","Electric Services",221119,"Other Electric Power Generation",34,44,12/29/22,"16,833,618,944",12/31/22,"7,923,000,000","881,000,000","15,980,000,000","41,123,000,000"
24760,"Equity investments and joint ventures","Fair value of liquidating distribution",500463,12/31/22,02/22/23,4,"KPMG LLP",,,,"New York",NY,"NEW YORK","US Mid Atlantic",10-K,2023-02-22,,"Avangrid, Inc.",1634997,,"180 MARSH HILL ROAD",,ORANGE,CT,CONNECTICUT,"US New England",,,"=""4911""","Electric Services",221119,"Other Electric Power Generation",34,44,12/29/22,"16,833,618,944",12/31/22,"7,923,000,000","881,000,000","15,980,000,000","41,123,000,000"
24585,"Sales return and allowances","Net Sales/Accrued Expenses- Refer to Notes 1 and 15 to the Consolidated Financial Statements",500117,12/31/22,02/21/23,3,"Deloitte & Touche LLP",,,,Atlanta,GA,GEORGIA,"US Southeast",10-K,2023-02-21,,"AVANOS MEDICAL, INC.",1606498,"=""AVNS""","5405 WINDWARD PARKWAY","SUITE 100 SOUTH",ALPHARETTA,GA,GEORGIA,"US Southeast",,,"=""3842""","Orthopedic, Prosthetic, and Surgical Appliances and Supplies",524114,"Direct Health and Medical Insurance Carriers",34,27,12/31/22,"1,259,072,256",12/31/22,"820,000,000","50,500,000","220,800,000","1,786,900,000"
26170,"Research and development expenses","Internally Developed Software",501740,12/31/22,02/28/23,2,"Ernst & Young LLP",,,,Dallas,TX,TEXAS,"US Southwest",10-K,2023-02-28,,"AVANTAX, INC.",1068875,,"3200 OLYMPUS BLVD.","SUITE 100",DALLAS,TX,TEXAS,"US Southwest",,,"=""6199""","Finance Services",519120,"Libraries and Archives",34,26,12/31/22,"1,227,456,896",12/31/22,"666,496,000","420,247,000","210,917,000","963,515,000"
23946,Goodwill,"Goodwill —Americas and Europe Reporting Units - Refer to Notes 2, 6 and 11 to the financial statements",499387,12/31/22,02/14/23,3,"Deloitte & Touche LLP",,,,Philadelphia,PA,PENNSYLVANIA,"US Mid Atlantic",10-K,2023-02-14,,"Avantor, Inc.",1722482,"=""AVTR""","RADNOR CORPORATE CENTER, BUILDING ONE","SUITE 200, 100 MATSONFORD ROAD",RADNOR,PA,PENNSYLVANIA,"US Mid Atlantic",,,"=""3826""","Laboratory Analytical Instruments",325188,"All Other Basic Inorganic Chemical Manufacturing",34,21,12/31/22,"14,220,987,392",12/31/22,"7,512,400,000","686,500,000","-4,930,500,000","13,464,300,000"
23947,"Long-lived assets","Long-Lived Asset Impairment – Ritter GmbH— Refer to Notes 2, 4, and 6 to the financial statements",499387,12/31/22,02/14/23,3,"Deloitte & Touche LLP",,,,Philadelphia,PA,PENNSYLVANIA,"US Mid Atlantic",10-K,2023-02-14,,"Avantor, Inc.",1722482,"=""AVTR""","RADNOR CORPORATE CENTER, BUILDING ONE","SUITE 200, 100 MATSONFORD ROAD",RADNOR,PA,PENNSYLVANIA,"US Mid Atlantic",,,"=""3826""","Laboratory Analytical Instruments",325188,"All Other Basic Inorganic Chemical Manufacturing",34,21,12/31/22,"14,220,987,392",12/31/22,"7,512,400,000","686,500,000","-4,930,500,000","13,464,300,000"
31149,"Long-lived assets","Finite-lived Asset Recoverability Test for the Services Asset Group and Interim Goodwill Impairment Assessment for the Services Reporting Unit",516920,09/30/22,09/08/23,1,"PricewaterhouseCoopers LLP",,,,"New York",NY,"NEW YORK","US Mid Atlantic",10-K,2023-09-08,,"Avaya Holdings Corp.",1418100,,"co Avaya Inc","2605 MERIDIAN PARKWAY, SUITE 200",DURHAM,NC,"NORTH CAROLINA","US Southeast",,,"=""7372""","Prepackaged Software",541611,"Administrative Management and General Management Consulting Services",34,,,,,,,,
31150,"Other intangible assets","Indefinite-Lived Intangible Asset Impairment Assessments - Avaya Trade Name",516920,09/30/22,09/08/23,1,"PricewaterhouseCoopers LLP",,,,"New York",NY,"NEW YORK","US Mid Atlantic",10-K,2023-09-08,,"Avaya Holdings Corp.",1418100,,"co Avaya Inc","2605 MERIDIAN PARKWAY, SUITE 200",DURHAM,NC,"NORTH CAROLINA","US Southeast",,,"=""7372""","Prepackaged Software",541611,"Administrative Management and General Management Consulting Services",34,,,,,,,,
27476,"Accounts/loans receivable","Estimated Explicit and Implicit Price Concessions on Patient Accounts Receivable",505211,12/31/22,03/16/23,2,"Ernst & Young LLP",,,,Atlanta,GA,GEORGIA,"US Southeast",10-K,2023-03-16,,"Aveanna Healthcare Holdings, Inc.",1832332,"=""AVAH""","400 INTERSTATE NORTH PARKWAY","STE 1700",ATLANTA,GA,GEORGIA,"US Southeast",,,"=""8082""","Home Health Care Services",621610,"Home Health Care Services",34,1,12/31/22,"147,310,144",12/31/22,"1,787,645,000","-662,034,000","-1,259,726,000","1,711,760,000"
27477,Goodwill,"Goodwill Impairment",505211,12/31/22,03/16/23,2,"Ernst & Young LLP",,,,Atlanta,GA,GEORGIA,"US Southeast",10-K,2023-03-16,,"Aveanna Healthcare Holdings, Inc.",1832332,"=""AVAH""","400 INTERSTATE NORTH PARKWAY","STE 1700",ATLANTA,GA,GEORGIA,"US Southeast",,,"=""8082""","Home Health Care Services",621610,"Home Health Care Services",34,1,12/31/22,"147,310,144",12/31/22,"1,787,645,000","-662,034,000","-1,259,726,000","1,711,760,000"
28484,"Other debt","Valuation of warrant liability",507615,12/31/22,03/31/23,4,"KPMG LLP",,,,"New York",NY,"NEW YORK","US Mid Atlantic",10-K,2023-03-31,Yes,"AVENUE THERAPEUTICS, INC.",1644963,"=""ATXI""","1111 KANE CONCOURSE","SUITE 301","BAY HARBOR ISLANDS",FL,FLORIDA,"US Southeast",,,"=""2834""","Pharmaceutical Preparations",325412,"Pharmaceutical Preparation Manufacturing",34,1,12/31/22,"5,537,637",12/31/22,,"-3,552,000",,"6,845,000"
24715,"Deferred income taxes","Income Taxes",500404,12/31/22,02/22/23,1,"PricewaterhouseCoopers LLP",,,,"Los Angeles",CA,CALIFORNIA,"US West",10-K,2023-02-22,,"Avery Dennison Corp",8818,"=""AVY""","8080 NORTON PARKWAY",,MENTOR,OH,OHIO,"US Midwest",,,"=""2670""","Converted Paper & Paperboard Prods (No Contaners/Boxes)",322222,"Coated and Laminated Paper Manufacturing",34,181,12/31/22,"14,626,613,248",12/31/22,"9,039,300,000","757,100,000","-670,500,000","7,950,500,000"
21667,"Deferred and capitalized costs","Estimated costs at completion for projects",489026,04/30/22,06/29/22,2,"Ernst & Young LLP",,,,Irvine,CA,CALIFORNIA,"US West",10-K,2022-06-29,,"Avid Bioservices, Inc.",704562,,"14191 MYFORD ROAD",,TUSTIN,CA,CALIFORNIA,"US West",,,"=""2834""","Pharmaceutical Preparations",325412,"Pharmaceutical Preparation Manufacturing",34,13,04/30/22,"831,922,240",04/30/22,"119,597,000","127,672,000",,"429,843,000"
21668,"Deferred income taxes","Realizability of Deferred Tax Assets",489026,04/30/22,06/29/22,2,"Ernst & Young LLP",,,,Irvine,CA,CALIFORNIA,"US West",10-K,2022-06-29,,"Avid Bioservices, Inc.",704562,,"14191 MYFORD ROAD",,TUSTIN,CA,CALIFORNIA,"US West",,,"=""2834""","Pharmaceutical Preparations",325412,"Pharmaceutical Preparation Manufacturing",34,13,04/30/22,"831,922,240",04/30/22,"119,597,000","127,672,000",,"429,843,000"
26282,"Other debt","Restricted Funds Held for Customers and Payment Service Obligations",502585,12/31/22,03/01/23,1,"PricewaterhouseCoopers LLP",,,,Charlotte,NC,"NORTH CAROLINA","US Southeast",10-K,2023-03-01,,"AvidXchange Holdings, Inc.",1858257,"=""AVDX""","1210 AVIDXCHANGE LANE",,CHARLOTTE,NC,"NORTH CAROLINA","US Southeast",,,"=""7372""","Prepackaged Software",511210,"Software Publishers",34,10,12/31/22,"1,982,373,888",12/31/22,"316,350,000","-101,284,000","392,774,000","2,211,996,000"
24675,"Asset retirement and environmental obligations","Environmental Accrued Liabilities - Calvert City",500304,12/31/22,02/22/23,2,"Ernst & Young LLP",,,,Cleveland,OH,OHIO,"US Midwest",10-K,2023-02-22,,"AVIENT CORP",1122976,"=""AVNT""","33587 WALKER ROAD",,"AVON LAKE",OH,OHIO,"US Midwest",,,"=""2821""","Plastics Material and Synthetic Resins, and Nonvulcanizable Elastomers",325211,"Plastics Material and Resin Manufacturing",34,34,12/31/22,"3,068,784,128",12/31/22,"3,396,900,000","703,100,000","-935,000,000","6,085,000,000"
24676,"Business combinations","Valuation of Certain Intangible Assets in the Acquisition of Avient Protective Materials",500304,12/31/22,02/22/23,2,"Ernst & Young LLP",,,,Cleveland,OH,OHIO,"US Midwest",10-K,2023-02-22,,"AVIENT CORP",1122976,"=""AVNT""","33587 WALKER ROAD",,"AVON LAKE",OH,OHIO,"US Midwest",,,"=""2821""","Plastics Material and Synthetic Resins, and Nonvulcanizable Elastomers",325211,"Plastics Material and Resin Manufacturing",34,34,12/31/22,"3,068,784,128",12/31/22,"3,396,900,000","703,100,000","-935,000,000","6,085,000,000"
28215,"Property, plant and equipment","Plant, equipment and mining properties - Assessment of Whether Indicators of Impairment Exist –Refer to Notes 2 and 3 to the financial statements",506728,12/31/22,03/28/23,3,"Deloitte & Touche LLP",468,"Deloitte LLP",1208,Vancouver,A1,"BRITISH COLUMBIA",Canada,6-K,2023-03-29,,"AVINO SILVER & GOLD MINES LTD",316888,"=""ASM""","455 GRANVILLE STREET","SUITE 400",VANCOUVER,A1,"BRITISH COLUMBIA",Canada,,,"=""1000""","Metal mining",213114,"Support Activities for Metal Mining",34,1,12/29/22,"70,256,424",12/31/22,"44,187,000","3,096,000",,"121,196,000"
28829,"Property, plant and equipment","Plant, equipment and mining properties - Assessment of Whether Indicators of Impairment Exist –Refer to Notes 2 and 3 to the financial statements",507933,12/31/22,03/28/23,3,"Deloitte & Touche LLP",468,"Deloitte LLP",1208,Vancouver,A1,"BRITISH COLUMBIA",Canada,40-F,2023-04-03,,"AVINO SILVER & GOLD MINES LTD",316888,"=""ASM""","455 GRANVILLE STREET","SUITE 400",VANCOUVER,A1,"BRITISH COLUMBIA",Canada,,,"=""1000""","Metal mining",213114,"Support Activities for Metal Mining",34,1,12/29/22,"70,256,424",12/31/22,"44,187,000","3,096,000",,"121,196,000"
24141,"Depreciation and amortization","Vehicles - Depreciation Expense - United States Risk Vehicles - Refer to Notes 2 and 8 to the financial statements",499615,12/31/22,02/16/23,3,"Deloitte & Touche LLP",,,,"New York",NY,"NEW YORK","US Mid Atlantic",10-K,2023-02-16,,"AVIS BUDGET GROUP, INC.",723612,"=""CAR""","379 INTERPACE PARKWAY",,PARSIPPANY,NJ,"NEW JERSEY","US Mid Atlantic",,,"=""7510""","Services-Auto Rental & Leasing (No Drivers)",532111,"Passenger Car Rental",34,164,12/31/22,"6,393,269,760",12/31/22,"11,994,000,000","2,764,000,000","1,611,000,000","25,333,000,000"
24142,"Other contingent liabilities","Self-Insurance Reserves - Public Liability and Property Damage Claims - United States - Refer to Note 2 to the financial statements",499615,12/31/22,02/16/23,3,"Deloitte & Touche LLP",,,,"New York",NY,"NEW YORK","US Mid Atlantic",10-K,2023-02-16,,"AVIS BUDGET GROUP, INC.",723612,"=""CAR""","379 INTERPACE PARKWAY",,PARSIPPANY,NJ,"NEW JERSEY","US Mid Atlantic",,,"=""7510""","Services-Auto Rental & Leasing (No Drivers)",532111,"Passenger Car Rental",34,164,12/31/22,"6,393,269,760",12/31/22,"11,994,000,000","2,764,000,000","1,611,000,000","25,333,000,000"
24555,"Regulatory assets and liabilities","Regulatory Matters - Refer to Notes 1, 22, and 23 to the financial statements",500226,12/31/22,02/21/23,3,"Deloitte & Touche LLP",,,,Portland,OR,OREGON,"US West",10-K,2023-02-22,,"AVISTA CORP",104918,"=""AVA""","1411 E MISSION AVE",,SPOKANE,WA,WASHINGTON,"US West",,,"=""4931""","Electric and Other Services Combined",221210,"Natural Gas Distribution",34,44,12/31/22,"3,323,103,232",12/31/22,"1,710,000,000","155,000,000","2,282,242,000","7,417,350,000"
24556,"Other investments","Investments, at fair value - Level 3 Investment Valuations and Fair Value Measurements - Refer to Note 7, 18",500226,12/31/22,02/21/23,3,"Deloitte & Touche LLP",,,,Portland,OR,OREGON,"US West",10-K,2023-02-22,,"AVISTA CORP",104918,"=""AVA""","1411 E MISSION AVE",,SPOKANE,WA,WASHINGTON,"US West",,,"=""4931""","Electric and Other Services Combined",221210,"Natural Gas Distribution",34,44,12/31/22,"3,323,103,232",12/31/22,"1,710,000,000","155,000,000","2,282,242,000","7,417,350,000"
22055,"Other income taxes","Evaluation of accounting for income taxes",490769,07/02/22,08/12/22,4,"KPMG LLP",,,,Phoenix,AZ,ARIZONA,"US Southwest",10-K,2022-08-12,,"AVNET INC",8858,"=""AVT""","2211 SOUTH 47TH STREET",,PHOENIX,AZ,ARIZONA,"US Southwest",,,"=""5065""","Electronic Parts and Equipment, NEC",334419,"Other Electronic Component Manufacturing",34,43,06/30/22,"4,188,592,640",07/02/22,"24,310,708,000","692,379,000","3,421,276,000","10,388,532,000"
27300,"Deferred income taxes","Realizability of foreign loss carryforward deferred tax assets in certain jurisdictions",504929,12/31/22,03/14/23,1,"PricewaterhouseCoopers LLP",121,"PricewaterhouseCoopers LLP",876,London,X0,"UNITED KINGDOM",Foreign,10-K,2023-03-14,,"AVON PRODUCTS INC",8868,,"1 AVON PLACE",,SUFFERN,NY,"NEW YORK","US Mid Atlantic",1776967,"Natura &Co Holding S.A.","=""2844""","Perfumes, Cosmetics, and Other Toilet Preparations",325620,"Toilet Preparation Manufacturing",34,,,,12/31/22,"2,769,200,000","-428,100,000","-1,270,600,000","2,161,700,000"
27301,"Other contingent liabilities","Talc-Related Litigation",504929,12/31/22,03/14/23,1,"PricewaterhouseCoopers LLP",121,"PricewaterhouseCoopers LLP",876,London,X0,"UNITED KINGDOM",Foreign,10-K,2023-03-14,,"AVON PRODUCTS INC",8868,,"1 AVON PLACE",,SUFFERN,NY,"NEW YORK","US Mid Atlantic",1776967,"Natura &Co Holding S.A.","=""2844""","Perfumes, Cosmetics, and Other Toilet Preparations",325620,"Toilet Preparation Manufacturing",34,,,,12/31/22,"2,769,200,000","-428,100,000","-1,270,600,000","2,161,700,000"
24137,"Other income taxes","Measurement of Unrecognized Tax Benefits",499611,12/31/22,02/16/23,1,"PricewaterhouseCoopers LLP",,,,Philadelphia,PA,PENNSYLVANIA,"US Mid Atlantic",10-K,2023-02-16,,"Axalta Coating Systems Ltd.",1616862,"=""AXTA""","1050 CONSTITUTION AVENUE",,PHILADELPHIA,PA,PENNSYLVANIA,"US Mid Atlantic",,,"=""2851""","Paints, Varnishes, Lacquers, Enamels, and Allied Products",325510,"Paint and Coating Manufacturing",34,25,12/31/22,"5,618,681,856",12/31/22,"4,884,000,000","192,000,000","-1,156,800,000","7,059,200,000"
25418,"Revenue from customer contracts","Systems Revenue recognition",501009,12/31/22,02/24/23,2,"Ernst & Young LLP",,,,Boston,MA,MASSACHUSETTS,"US New England",10-K,2023-02-24,,"AXCELIS TECHNOLOGIES INC",1113232,"=""ACLS""","108 CHERRY HILL DRIVE",,BEVERLY,MA,MASSACHUSETTS,"US New England",,,"=""3559""","Special  Industry Machinery, NEC",333295,"Semiconductor Machinery Manufacturing",34,79,12/31/22,"2,601,024,000",12/31/22,"919,998,000","183,079,000",,"1,013,641,000"
25419,Inventory,"Estimate of Excess Inventory",501009,12/31/22,02/24/23,2,"Ernst & Young LLP",,,,Boston,MA,MASSACHUSETTS,"US New England",10-K,2023-02-24,,"AXCELIS TECHNOLOGIES INC",1113232,"=""ACLS""","108 CHERRY HILL DRIVE",,BEVERLY,MA,MASSACHUSETTS,"US New England",,,"=""3559""","Special  Industry Machinery, NEC",333295,"Semiconductor Machinery Manufacturing",34,79,12/31/22,"2,601,024,000",12/31/22,"919,998,000","183,079,000",,"1,013,641,000"
25744,"Other contingent liabilities","Reserve for losses and loss expenses - Refer to Notes 2 and 8 to the consolidated financial statements",501459,12/31/22,02/24/23,3,"Deloitte & Touche LLP",506,"Deloitte Ltd",5230,Hamilton,D0,BERMUDA,Foreign,10-K,2023-02-27,,"AXIS CAPITAL HOLDINGS LTD",1214816,"=""AXS""","92 PITTS BAY ROAD",,PEMBROKE,D0,BERMUDA,Foreign,,,"=""6331""","Fire, Marine, and Casualty Insurance",524126,"Direct Property and Casualty Insurance Carriers",34,54,12/29/22,"4,559,312,384",12/31/22,"5,135,439,000","223,083,000","4,341,309,000","27,595,811,000"
27299,Inventory,"Inventory – Valuation Associated with Excess and Obsolete (E&O) Inventory — Refer to Notes 2 and 3 to the financial statements",504953,12/31/22,03/14/23,3,"Deloitte & Touche LLP",,,,Miami,FL,FLORIDA,"US Southeast",10-K,2023-03-14,,"Axogen, Inc.",805928,"=""AXGN""","13631 PROGRESS BLVD.","SUITE 400",ALACHUA,FL,FLORIDA,"US Southeast",,,"=""3845""","Electromedical and Electrotherapeutic Apparatus",325412,"Pharmaceutical Preparation Manufacturing",34,10,12/31/22,"423,606,272",12/31/22,"138,584,000","-28,948,000","97,350,000","195,387,000"
25947,"Business combinations","Valuation of developed technology intangible asset acquired in a business combination and fair value of contingent consideration liability",501962,12/31/22,02/27/23,2,"Ernst & Young LLP",,,,"New York",NY,"NEW YORK","US Mid Atlantic",10-K,2023-02-28,,"Axsome Therapeutics, Inc.",1579428,"=""AXSM""","ONE WORLD TRADE CENTER, 29TH FLOOR",,"NEW YORK",NY,"NEW YORK","US Mid Atlantic",,,"=""2834""","Pharmaceutical Preparations",325412,"Pharmaceutical Preparation Manufacturing",34,77,12/31/22,"3,355,048,448",12/31/22,"50,037,106","-187,133,651","70,685,637","331,476,095"
25948,"Sales return and allowances","Reserve for variable consideration for commercial managed care",501962,12/31/22,02/27/23,2,"Ernst & Young LLP",,,,"New York",NY,"NEW YORK","US Mid Atlantic",10-K,2023-02-28,,"Axsome Therapeutics, Inc.",1579428,"=""AXSM""","ONE WORLD TRADE CENTER, 29TH FLOOR",,"NEW YORK",NY,"NEW YORK","US Mid Atlantic",,,"=""2834""","Pharmaceutical Preparations",325412,"Pharmaceutical Preparation Manufacturing",34,77,12/31/22,"3,355,048,448",12/31/22,"50,037,106","-187,133,651","70,685,637","331,476,095"
23055,Goodwill,"Quantitative Goodwill Impairment Assessment",495125,09/30/22,11/29/22,1,"PricewaterhouseCoopers LLP",,,,Chicago,IL,ILLINOIS,"US Midwest",10-K,2022-11-29,,"AZEK Co Inc.",1782754,,"1330 W FULTON STREET, #350",,CHICAGO,IL,ILLINOIS,"US Midwest",,,"=""3089""","Plastics Products, NEC",332322,"Sheet Metal Work Manufacturing",34,17,09/30/22,"2,510,295,552",09/30/22,"1,355,586,000","67,158,000","204,613,000","2,383,091,000"
23030,Goodwill,"Goodwill Impairment Assessments – Life Sciences Products and Life Sciences Services Reporting Units",494935,09/30/22,11/25/22,1,"PricewaterhouseCoopers LLP",,,,Boston,MA,MASSACHUSETTS,"US New England",10-K,2022-11-25,,"Azenta, Inc.",933974,"=""AZTA""","200 SUMMIT DRIVE","6TH FLOOR",BURLINGTON,MA,MASSACHUSETTS,"US New England",,,"=""3559""","Special  Industry Machinery, NEC",333298,"All Other Industrial Machinery Manufacturing",34,43,09/30/22,"3,215,368,192",09/30/22,"555,498,000","2,132,859,000","2,671,362,000","3,716,122,000"
29293,"Revenue from customer contracts","Air Traffic Liability - Breakage Revenue",509468,12/31/22,04/19/23,2,"Ernst & Young LLP",34,"Ernst & Young Auditores Independentes SS",1448,"São Paulo",D5,BRAZIL,Foreign,20-F,2023-04-20,,"AZUL SA",1432364,"=""AZULQ""","AV. MARCOS PENTEADO ULHOA RODRIGUES","NO. 939, 9 FLOOR, ED. JATOBA",BARUERI,D5,BRAZIL,Foreign,,,"=""4512""","Air Transportation, Scheduled",481111,"Scheduled Passenger Air Transportation",34,6,12/29/22,"691,829,888",12/31/22,"3,020,610,000","-136,818,000","-3,870,264,000","3,545,867,000"
29294,Leases,"Maintenance Reserve Deposits",509468,12/31/22,04/19/23,2,"Ernst & Young LLP",34,"Ernst & Young Auditores Independentes SS",1448,"São Paulo",D5,BRAZIL,Foreign,20-F,2023-04-20,,"AZUL SA",1432364,"=""AZULQ""","AV. MARCOS PENTEADO ULHOA RODRIGUES","NO. 939, 9 FLOOR, ED. JATOBA",BARUERI,D5,BRAZIL,Foreign,,,"=""4512""","Air Transportation, Scheduled",481111,"Scheduled Passenger Air Transportation",34,6,12/29/22,"691,829,888",12/31/22,"3,020,610,000","-136,818,000","-3,870,264,000","3,545,867,000"
29295,"Going concern","Assessment of the impacts of the COVID-19 pandemic and capital structure and net working capital",509468,12/31/22,04/19/23,2,"Ernst & Young LLP",34,"Ernst & Young Auditores Independentes SS",1448,"São Paulo",D5,BRAZIL,Foreign,20-F,2023-04-20,,"AZUL SA",1432364,"=""AZULQ""","AV. MARCOS PENTEADO ULHOA RODRIGUES","NO. 939, 9 FLOOR, ED. JATOBA",BARUERI,D5,BRAZIL,Foreign,,,"=""4512""","Air Transportation, Scheduled",481111,"Scheduled Passenger Air Transportation",34,6,12/29/22,"691,829,888",12/31/22,"3,020,610,000","-136,818,000","-3,870,264,000","3,545,867,000"
32071,"Revenue from customer contracts","Air Traffic Liability - Breakage Revenue",522031,12/31/22,04/19/23,2,"Ernst & Young LLP",34,"Ernst & Young Auditores Independentes SS",1448,"São Paulo",D5,BRAZIL,Foreign,20-F/A,2023-12-28,,"AZUL SA",1432364,"=""AZULQ""","AV. MARCOS PENTEADO ULHOA RODRIGUES","NO. 939, 9 FLOOR, ED. JATOBA",BARUERI,D5,BRAZIL,Foreign,,,"=""4512""","Air Transportation, Scheduled",481111,"Scheduled Passenger Air Transportation",34,6,12/29/22,"691,829,888",12/31/22,"3,020,610,000","-136,818,000","-3,870,264,000","3,545,867,000"
32072,"Proven and unproven reserves","Maintenance Reserve Deposits",522031,12/31/22,04/19/23,2,"Ernst & Young LLP",34,"Ernst & Young Auditores Independentes SS",1448,"São Paulo",D5,BRAZIL,Foreign,20-F/A,2023-12-28,,"AZUL SA",1432364,"=""AZULQ""","AV. MARCOS PENTEADO ULHOA RODRIGUES","NO. 939, 9 FLOOR, ED. JATOBA",BARUERI,D5,BRAZIL,Foreign,,,"=""4512""","Air Transportation, Scheduled",481111,"Scheduled Passenger Air Transportation",34,6,12/29/22,"691,829,888",12/31/22,"3,020,610,000","-136,818,000","-3,870,264,000","3,545,867,000"
32073,"Going concern","Assessment of the impacts of the COVID-19 pandemic and capital structure and net working capital",522031,12/31/22,04/19/23,2,"Ernst & Young LLP",34,"Ernst & Young Auditores Independentes SS",1448,"São Paulo",D5,BRAZIL,Foreign,20-F/A,2023-12-28,,"AZUL SA",1432364,"=""AZULQ""","AV. MARCOS PENTEADO ULHOA RODRIGUES","NO. 939, 9 FLOOR, ED. JATOBA",BARUERI,D5,BRAZIL,Foreign,,,"=""4512""","Air Transportation, Scheduled",481111,"Scheduled Passenger Air Transportation",34,6,12/29/22,"691,829,888",12/31/22,"3,020,610,000","-136,818,000","-3,870,264,000","3,545,867,000"
26033,"Other intangible assets","Assessment of the carrying values of certain indefinite-lived intangible assets",501904,12/31/22,02/28/23,4,"KPMG LLP",,,,"Short Hills",NJ,"NEW JERSEY","US Mid Atlantic",10-K,2023-02-28,,"B&G Foods, Inc.",1278027,"=""BGS""","FOUR GATEHALL DRIVE","SUITE 110",PARSIPPANY,NJ,"NEW JERSEY","US Mid Atlantic",,,"=""2000""","Food and Kindred Products",311999,"All Other Miscellaneous Food Manufacturing",34,11,12/31/22,"799,099,776",12/31/22,"2,163,000,000","-11,370,000","-1,539,232,000","3,841,609,000"
24723,"Long-lived assets","Impairment tests of the Gramalote Project cash-generating unit (CGU)",500379,12/31/22,02/22/23,1,"PricewaterhouseCoopers LLP",191,"PricewaterhouseCoopers LLP Chartered Accountants",271,Vancouver,A1,"BRITISH COLUMBIA",Canada,6-K,2023-02-22,,"B2GOLD CORP",1429937,"=""BTG""","PARK PLACE","SUITE 3400 - 666 BURRARD STREET",VANCOUVER,A1,"BRITISH COLUMBIA",Canada,,,"=""1040""","Metal Mining",212221,"Gold Ore Mining",34,4,12/31/22,"3,836,660,736",12/31/22,"1,732,590,000","286,723,000",,"3,681,233,000"
24724,"Long-lived assets","Impairment test of the Masbate Mine CGU",500379,12/31/22,02/22/23,1,"PricewaterhouseCoopers LLP",191,"PricewaterhouseCoopers LLP Chartered Accountants",271,Vancouver,A1,"BRITISH COLUMBIA",Canada,6-K,2023-02-22,,"B2GOLD CORP",1429937,"=""BTG""","PARK PLACE","SUITE 3400 - 666 BURRARD STREET",VANCOUVER,A1,"BRITISH COLUMBIA",Canada,,,"=""1040""","Metal Mining",212221,"Gold Ore Mining",34,4,12/31/22,"3,836,660,736",12/31/22,"1,732,590,000","286,723,000",,"3,681,233,000"
27522,"Long-lived assets","Impairment tests of the Gramalote Project cash-generating unit (CGU)",505275,12/31/22,02/22/23,1,"PricewaterhouseCoopers LLP",191,"PricewaterhouseCoopers LLP Chartered Accountants",271,Vancouver,A1,"BRITISH COLUMBIA",Canada,40-F,2023-03-16,,"B2GOLD CORP",1429937,"=""BTG""","PARK PLACE","SUITE 3400 - 666 BURRARD STREET",VANCOUVER,A1,"BRITISH COLUMBIA",Canada,,,"=""1040""","Metal Mining",212221,"Gold Ore Mining",34,4,12/31/22,"3,836,660,736",12/31/22,"1,732,590,000","286,723,000",,"3,681,233,000"
27523,"Long-lived assets","Impairment test of the Masbate Mine CGU",505275,12/31/22,02/22/23,1,"PricewaterhouseCoopers LLP",191,"PricewaterhouseCoopers LLP Chartered Accountants",271,Vancouver,A1,"BRITISH COLUMBIA",Canada,40-F,2023-03-16,,"B2GOLD CORP",1429937,"=""BTG""","PARK PLACE","SUITE 3400 - 666 BURRARD STREET",VANCOUVER,A1,"BRITISH COLUMBIA",Canada,,,"=""1040""","Metal Mining",212221,"Gold Ore Mining",34,4,12/31/22,"3,836,660,736",12/31/22,"1,732,590,000","286,723,000",,"3,681,233,000"
27589,"Revenue from customer contracts","Revenue Recognition and Contracts – Refer to Notes 2 and 5 to the financial statements",505327,12/31/22,03/16/23,3,"Deloitte & Touche LLP",,,,Cleveland,OH,OHIO,"US Midwest",10-K,2023-03-16,,"Babcock & Wilcox Enterprises, Inc.",1630805,"=""BW""","1200 E. MARKET STREET, SUITE 650",,AKRON,OH,OHIO,"US Midwest",,,"=""3433""","Heating Equipment, Except Electric and Warm Air Furnaces",333414,"Heating Equipment (except Warm Air Furnaces) Manufacturing",34,6,12/31/22,"511,799,008",12/31/22,"609,437,000","-22,861,000","-219,860,000","942,655,000"
27590,Goodwill,"Goodwill – Babcock & Wilcox Solar Reporting Unit - Refer to Notes 2 and 8 to the financial statements",505327,12/31/22,03/16/23,3,"Deloitte & Touche LLP",,,,Cleveland,OH,OHIO,"US Midwest",10-K,2023-03-16,,"Babcock & Wilcox Enterprises, Inc.",1630805,"=""BW""","1200 E. MARKET STREET, SUITE 650",,AKRON,OH,OHIO,"US Midwest",,,"=""3433""","Heating Equipment, Except Electric and Warm Air Furnaces",333414,"Heating Equipment (except Warm Air Furnaces) Manufacturing",34,6,12/31/22,"511,799,008",12/31/22,"609,437,000","-22,861,000","-219,860,000","942,655,000"
27591,"Business combinations","Acquisition of Babcock & Wilcox Solar - Contingent Consideration Liability and Acquisition of Remaining Ownership Interest – Refer to Note 26 to the financial statements",505327,12/31/22,03/16/23,3,"Deloitte & Touche LLP",,,,Cleveland,OH,OHIO,"US Midwest",10-K,2023-03-16,,"Babcock & Wilcox Enterprises, Inc.",1630805,"=""BW""","1200 E. MARKET STREET, SUITE 650",,AKRON,OH,OHIO,"US Midwest",,,"=""3433""","Heating Equipment, Except Electric and Warm Air Furnaces",333414,"Heating Equipment (except Warm Air Furnaces) Manufacturing",34,6,12/31/22,"511,799,008",12/31/22,"609,437,000","-22,861,000","-219,860,000","942,655,000"
24713,"Warranty liabilities","Warranty and After-Sale Costs Reserve",500402,12/31/22,02/22/23,2,"Ernst & Young LLP",,,,Milwaukee,WI,WISCONSIN,"US Midwest",10-K,2023-02-22,,"BADGER METER INC",9092,"=""BMI""","4545 WEST BROWN DEER ROAD",,MILWAUKEE,WI,WISCONSIN,"US Midwest",,,"=""3824""","Totalizing Fluid Meters and Counting Devices",335313,"Switchgear and Switchboard Apparatus Manufacturing",34,109,12/31/22,"3,193,818,624",12/31/22,"565,568,000","66,496,000","287,554,000","603,047,000"
27821,"Equity investments and joint ventures","Impairment assessment of equity method investments and equity investments accounted for using the measurement alternative",505745,12/31/22,03/22/23,2,"Ernst & Young LLP",211,"Ernst & Young Hua Ming LLP",1408,Beijing,F4,CHINA,Foreign,20-F,2023-03-22,,"Baidu, Inc.",1329099,"=""BIDU""","BAIDU CAMPUS, NO. 10 SHANGDI 10TH STREET","HAIDIAN DISTRICT",BEIJING,F4,CHINA,Foreign,,,"=""7370""","Services-Computer Programming, Data Processing, Etc.",518210,"Data Processing, Hosting, and Related Services",34,115,12/29/22,"31,724,904,448",12/31/22,"17,791,000,000","1,087,000,000","27,086,000,000","56,241,000,000"
26121,"Equity investments and joint ventures","Valuation of Portfolio Investments—Certain Level 3 Portfolio Investments in Loans, Subordinated Debt, Preferred Equity, and Equity Interests Valued Using Significant Unobservable Inputs",501875,12/31/22,02/28/23,1,"PricewaterhouseCoopers LLP",,,,Boston,MA,MASSACHUSETTS,"US New England",10-K,2023-02-28,,"Bain Capital Specialty Finance, Inc.",1655050,"=""BCSF""","C/O BAIN CAPITAL CREDIT, LP","200 CLARENDON STREET",BOSTON,MA,MASSACHUSETTS,"US New England",,,,,525990,"Other Financial Vehicles",34,12,12/31/22,"768,290,944",12/31/22,"167,227,000","105,480,000",,"2,592,434,000"
23941,"Revenue from customer contracts","Revenue recognition on certain agreements for sales of equipment manufactured to unique customer specifications",499394,12/31/22,02/14/23,4,"KPMG LLP",,,,Houston,TX,TEXAS,"US Southwest",10-K,2023-02-14,,"Baker Hughes Co",1701605,"=""BKR""","575 NORTH DAIRY ASHFORD ROAD, SUITE 100",,HOUSTON,TX,TEXAS,"US Southwest",40545,"GENERAL ELECTRIC CO","=""3533""","Oil and Gas Field Machinery and Equipment",333132,"Oil and Gas Field Machinery and Equipment Manufacturing",34,30,12/31/22,"29,707,180,032",12/31/22,"21,156,000,000","-601,000,000","4,284,000,000","34,181,000,000"
23954,"Revenue from customer contracts","Revenue recognition on certain agreements for sales of equipment manufactured to unique customer specifications",499357,12/31/22,02/14/23,4,"KPMG LLP",,,,Houston,TX,TEXAS,"US Southwest",10-K,2023-02-14,,"Baker Hughes Holdings LLC",808362,,"575 NORTH DAIRY ASHFORD ROAD, SUITE 100",,HOUSTON,TX,TEXAS,"US Southwest",40545,"GENERAL ELECTRIC CO","=""3533""","Oil and Gas Field Machinery and Equipment",333131,"Mining Machinery and Equipment Manufacturing",34,,,,12/31/22,"21,156,000,000","-526,000,000","4,657,000,000","34,172,000,000"
25913,"Business combinations","Valuation of the Acquired Relationships Intangible Assets",502054,12/31/22,02/28/23,1,"PricewaterhouseCoopers LLP",,,,Tampa,FL,FLORIDA,"US Southeast",10-K,2023-02-28,,"Baldwin Insurance Group, Inc.",1781755,"=""BWIN""","4211 W. BOY SCOUT BLVD.","SUITE 800",TAMPA,FL,FLORIDA,"US Southeast",,,"=""6411""","Insurance Agents, Brokers, and Service",524210,"Insurance Agencies and Brokerages",34,25,12/31/22,"1,544,786,816",12/31/22,"980,720,000","-41,772,000","-1,913,387,000","3,462,182,000"
25914,"Other contingent liabilities","Valuation of Contingent Earnout Liabilities",502054,12/31/22,02/28/23,1,"PricewaterhouseCoopers LLP",,,,Tampa,FL,FLORIDA,"US Southeast",10-K,2023-02-28,,"Baldwin Insurance Group, Inc.",1781755,"=""BWIN""","4211 W. BOY SCOUT BLVD.","SUITE 800",TAMPA,FL,FLORIDA,"US Southeast",,,"=""6411""","Insurance Agents, Brokers, and Service",524210,"Insurance Agencies and Brokerages",34,25,12/31/22,"1,544,786,816",12/31/22,"980,720,000","-41,772,000","-1,913,387,000","3,462,182,000"
29831,"Business combinations","Valuation of the Acquired Relationships Intangible Assets",511750,12/31/22,02/28/23,1,"PricewaterhouseCoopers LLP",,,,Tampa,FL,FLORIDA,"US Southeast",8-K,2023-05-09,,"Baldwin Insurance Group, Inc.",1781755,"=""BWIN""","4211 W. BOY SCOUT BLVD.","SUITE 800",TAMPA,FL,FLORIDA,"US Southeast",,,"=""6411""","Insurance Agents, Brokers, and Service",524210,"Insurance Agencies and Brokerages",34,25,12/31/22,"1,544,786,816",12/31/22,"980,720,000","-41,772,000","-1,913,387,000","3,462,182,000"
29832,"Other contingent liabilities","Valuation of Contingent Earnout Liabilities",511750,12/31/22,02/28/23,1,"PricewaterhouseCoopers LLP",,,,Tampa,FL,FLORIDA,"US Southeast",8-K,2023-05-09,,"Baldwin Insurance Group, Inc.",1781755,"=""BWIN""","4211 W. BOY SCOUT BLVD.","SUITE 800",TAMPA,FL,FLORIDA,"US Southeast",,,"=""6411""","Insurance Agents, Brokers, and Service",524210,"Insurance Agencies and Brokerages",34,25,12/31/22,"1,544,786,816",12/31/22,"980,720,000","-41,772,000","-1,913,387,000","3,462,182,000"
24581,"Revenue from customer contracts","Revenue Recognition - Estimated Costs at Completion for Aerospace Fixed-Price Contracts",500110,12/31/22,02/21/23,1,"PricewaterhouseCoopers LLP",,,,Denver,CO,COLORADO,"US West",10-K,2023-02-21,,"BALL Corp",9389,"=""BALL""","9200 W. 108TH CIRCLE",,WESTMINSTER,CO,COLORADO,"US West",,,"=""3411""","Metal Cans",322215,"Nonfolding Sanitary Food Container Manufacturing",34,51,12/31/22,"16,063,484,928",12/31/22,"13,372,000,000","719,000,000","-2,191,000,000","19,909,000,000"
27636,"Revenue from customer contracts","Estimated costs to complete engineering and technology transfer services for long-term fixed-price contracts",505430,12/31/22,03/16/23,4,"KPMG LLP",187,"KPMG LLP Chartered Accountants",85,Vancouver,A1,"BRITISH COLUMBIA",Canada,40-F,2023-03-17,,"Ballard Power Systems Inc.",1453015,"=""BLDP""","9000 GLENLYON PARKWAY",,BURNABY,A1,"BRITISH COLUMBIA",Canada,,,"=""3620""","Electrical Industrial Apparatus",335999,"All Other Miscellaneous Electrical Equipment and Component Manufacturing",34,5,12/29/22,"1,402,168,448",12/31/22,"83,786,000","-173,494,000","1,089,429,000","1,247,077,000"
27671,"Revenue from customer contracts","Estimated costs to complete engineering and technology transfer services for long-term fixed-price contracts",505504,12/31/22,03/16/23,4,"KPMG LLP",187,"KPMG LLP Chartered Accountants",85,Vancouver,A1,"BRITISH COLUMBIA",Canada,40-F/A,2023-03-17,,"Ballard Power Systems Inc.",1453015,"=""BLDP""","9000 GLENLYON PARKWAY",,BURNABY,A1,"BRITISH COLUMBIA",Canada,,,"=""3620""","Electrical Industrial Apparatus",335999,"All Other Miscellaneous Electrical Equipment and Component Manufacturing",34,5,12/29/22,"1,402,168,448",12/31/22,"83,786,000","-173,494,000","1,089,429,000","1,247,077,000"
29699,"Revenue from customer contracts","Estimated costs to complete engineering and technology transfer services for long-term fixed-price contracts",511098,12/31/22,03/16/23,4,"KPMG LLP",187,"KPMG LLP Chartered Accountants",85,Vancouver,A1,"BRITISH COLUMBIA",Canada,6-K,2023-05-01,,"Ballard Power Systems Inc.",1453015,"=""BLDP""","9000 GLENLYON PARKWAY",,BURNABY,A1,"BRITISH COLUMBIA",Canada,,,"=""3620""","Electrical Industrial Apparatus",335999,"All Other Miscellaneous Electrical Equipment and Component Manufacturing",34,5,12/29/22,"1,402,168,448",12/31/22,"83,786,000","-173,494,000","1,089,429,000","1,247,077,000"
26304,Goodwill,"Goodwill – International Interactive and North America Interactive Reporting Units – Refer to Notes 2 and 10 to the financial statements",502497,12/31/22,03/01/23,3,"Deloitte & Touche LLP",,,,"New York",NY,"NEW YORK","US Mid Atlantic",10-K,2023-03-01,,"Bally's Corp",1747079,"=""BALY""","100 WESTMINSTER STREET",,PROVIDENCE,RI,"RHODE ISLAND","US New England",,,"=""7011""","Hotels and Motels",721120,"Casino Hotels",34,19,12/31/22,"904,465,728",12/31/22,"2,255,705,000","-425,546,000","-2,902,321,000","6,300,113,000"
23981,"Regulatory assets and liabilities","Accounting for the Effects of Rate Regulation",499339,12/31/22,02/14/23,1,"PricewaterhouseCoopers LLP",,,,Baltimore,MD,MARYLAND,"US Mid Atlantic",10-K,2023-02-14,,"BALTIMORE GAS & ELECTRIC CO",9466,,"2 CENTER PLAZA","110 W. FAYETTE STREET",BALTIMORE,MD,MARYLAND,"US Mid Atlantic",1004440,"CONSTELLATION ENERGY GROUP INC","=""4931""","Electric and Other Services Combined",221122,"Electric Power Distribution",34,,,,12/31/22,"3,895,000,000","380,000,000",,"13,350,000,000"
25714,"Allowance for credit losses","Allowance for Loan Losses",501500,12/31/22,02/27/23,2,"Ernst & Young LLP",,,,Irvine,CA,CALIFORNIA,"US West",10-K,2023-02-27,,"BANC OF CALIFORNIA, INC.",1169770,"=""BANC""","3 MACARTHUR PLACE",,"SANTA ANA",CA,CALIFORNIA,"US West",,,"=""6021""","National Commercial Banks",522120,"Savings Institutions",34,16,12/31/22,"932,614,400",12/31/22,"1,341,089,000","423,613,000","837,780,000","9,197,016,000"
29493,"Allowance for credit losses","Impairment of financial assets",510100,12/31/22,04/26/23,2,"Ernst & Young LLP",134,"Pistrelli Henry Martin y Asociados SRL (Inactive)",1449,"Buenos Aires",C1,ARGENTINA,Foreign,20-F,2023-04-26,,"Banco BBVA Argentina S.A.",913059,"=""BBAR""","AV. CORDOBA 111",,"BUENOS AIRES",C1,ARGENTINA,Foreign,,,"=""6029""","Commercial Banks, NEC",522110,"Commercial Banking",34,4,12/29/22,"776,099,456",12/31/22,"2,611,764,000","327,250,000","6,090,124,000","34,319,362,000"
26799,"Allowance for credit losses","Expected credit losses related to loans and advances to customers",503330,12/31/22,03/06/23,2,"Ernst & Young LLP",163,"Ernst & Young SL",1461,Madrid,U3,SPAIN,Foreign,20-F,2023-03-06,,"BANCO BILBAO VIZCAYA ARGENTARIA, S.A.",842180,"=""BBVA""","CALLE AZUL 4",,BILBOA,U3,SPAIN,Foreign,,,"=""6029""","Commercial Banks, NEC",522110,"Commercial Banking",33,6,12/29/22,"40,340,713,472",12/31/22,"26,938,000,000","6,477,000,000","63,798,000,000","759,985,000,000"
26800,"Other investments","Measurement of fair value of certain financial instruments",503330,12/31/22,03/06/23,2,"Ernst & Young LLP",163,"Ernst & Young SL",1461,Madrid,U3,SPAIN,Foreign,20-F,2023-03-06,,"BANCO BILBAO VIZCAYA ARGENTARIA, S.A.",842180,"=""BBVA""","CALLE AZUL 4",,BILBOA,U3,SPAIN,Foreign,,,"=""6029""","Commercial Banks, NEC",522110,"Commercial Banking",33,6,12/29/22,"40,340,713,472",12/31/22,"26,938,000,000","6,477,000,000","63,798,000,000","759,985,000,000"
29542,"Allowance for credit losses","Expected Credit Loss Allowance for Commercial, Mortgage and Consumer Loans - Collective Basis",510319,12/31/22,04/25/23,1,"PricewaterhouseCoopers LLP",93,"PricewaterhouseCoopers Consultores Auditores y Compania Limitada",1364,Santiago,F3,CHILE,Foreign,20-F,2023-04-27,,"BANCO ITAU CHILE",1276671,"=""ITCLY""","AV. PRESIDENTE RIESCO 5537",,SANTIAGO,F3,CHILE,Foreign,,,"=""6029""","Commercial Banks, NEC",522110,"Commercial Banking",34,3,12/31/22,"2,096,308,480",12/31/22,"1,403,000,000","520,000,000","3,080,000,000","47,328,000,000"
29543,Goodwill,"Goodwill Impairment Assessment",510319,12/31/22,04/25/23,1,"PricewaterhouseCoopers LLP",93,"PricewaterhouseCoopers Consultores Auditores y Compania Limitada",1364,Santiago,F3,CHILE,Foreign,20-F,2023-04-27,,"BANCO ITAU CHILE",1276671,"=""ITCLY""","AV. PRESIDENTE RIESCO 5537",,SANTIAGO,F3,CHILE,Foreign,,,"=""6029""","Commercial Banks, NEC",522110,"Commercial Banking",34,3,12/31/22,"2,096,308,480",12/31/22,"1,403,000,000","520,000,000","3,080,000,000","47,328,000,000"
25865,"Allowance for credit losses","Measurement of expected credit losses",501938,12/31/22,02/27/23,1,"PricewaterhouseCoopers LLP",91,"PricewaterhouseCoopers Auditores Independentes",1351,"São Paulo",D5,BRAZIL,Foreign,20-F,2023-02-28,,"Banco Santander (Brasil) S.A.",1471055,"=""BSBR""","AV. JUSCELINO KUBITSCHEK, 2235","AV. JUSCELINO KUBITSCHEK, 2041","SAO PAULO, SP",D5,BRAZIL,Foreign,891478,"Banco Santander, S.A.","=""6029""","Commercial Banks, NEC",522110,"Commercial Banking",34,5,12/31/22,"40,081,158,144",12/31/22,"7,612,679,000","2,691,035,000","14,883,299,000","186,647,252,000"
25866,"Other contingent liabilities","Provisions for judicial and administrative proceedings",501938,12/31/22,02/27/23,1,"PricewaterhouseCoopers LLP",91,"PricewaterhouseCoopers Auditores Independentes",1351,"São Paulo",D5,BRAZIL,Foreign,20-F,2023-02-28,,"Banco Santander (Brasil) S.A.",1471055,"=""BSBR""","AV. JUSCELINO KUBITSCHEK, 2235","AV. JUSCELINO KUBITSCHEK, 2041","SAO PAULO, SP",D5,BRAZIL,Foreign,891478,"Banco Santander, S.A.","=""6029""","Commercial Banks, NEC",522110,"Commercial Banking",34,5,12/31/22,"40,081,158,144",12/31/22,"7,612,679,000","2,691,035,000","14,883,299,000","186,647,252,000"
24964,"Allowance for credit losses","Expected Credit Loss Allowance for Commercial, Mortgage and Consumer Loans – Collective Basis",500549,12/31/22,02/22/23,1,"PricewaterhouseCoopers LLP",93,"PricewaterhouseCoopers Consultores Auditores y Compania Limitada",1364,Santiago,F3,CHILE,Foreign,20-F,2023-02-23,,"BANCO SANTANDER CHILE",1027552,"=""BSAC""","BANDERA 140, PISO 19",,SANTIAGO,F3,CHILE,Foreign,891478,"Banco Santander, S.A.","=""6029""","Commercial Banks, NEC",522293,"International Trade Financing",34,16,12/29/22,"7,471,888,896",12/31/22,"2,187,000,000","948,000,000","5,571,000,000","80,312,000,000"
25896,"Allowance for credit losses","Allowance for Impairment Losses – Macroeconomic Factors Impacting the Downside Scenario of the Forward-Looking Analysis",501997,12/31/22,02/28/23,1,"PricewaterhouseCoopers LLP",107,"PricewaterhouseCoopers SC",1128,"Mexico City",O5,MEXICO,Foreign,20-F,2023-02-28,,"Banco Santander Mexico S.A., Institucion de Banca Multiple, Grupo Financiero Santander Mexico",1698287,"=""BSMX""","PROLONGACION PASEO DE LA REFORMA NO. 500","PISO 2, MODULO 206",MEXICO,O5,MEXICO,Foreign,,,"=""6029""","Commercial Banks, NEC",522110,"Commercial Banking",34,6,12/29/22,"3,967,286,016",12/31/22,"-1,899,000,000","-5,131,000,000","7,837,000,000","93,057,000,000"
26581,"Accounts/loans receivable","Estimation of impairment of financial assets at amortised cost– loans and advances to customers",502804,12/31/22,03/01/23,1,"PricewaterhouseCoopers LLP",117,"PricewaterhouseCoopers Auditores SL",1306,Madrid,U3,SPAIN,Foreign,20-F,2023-03-01,,"Banco Santander, S.A.",891478,"=""SAN""","CIUDAD GRUPO SANTANDER","BOADILLA DEL MONTE",MADRID,U3,SPAIN,Foreign,,,"=""6029""","Commercial Banks, NEC",522110,"Commercial Banking",34,3,12/29/22,"51,675,111,424",12/31/22,"42,983,000,000","7,476,000,000","465,304,000,000","1,851,330,000,000"
26582,Goodwill,"Goodwill Impairment Assessment of Certain Cash Generating Unit (CGU)",502804,12/31/22,03/01/23,1,"PricewaterhouseCoopers LLP",117,"PricewaterhouseCoopers Auditores SL",1306,Madrid,U3,SPAIN,Foreign,20-F,2023-03-01,,"Banco Santander, S.A.",891478,"=""SAN""","CIUDAD GRUPO SANTANDER","BOADILLA DEL MONTE",MADRID,U3,SPAIN,Foreign,,,"=""6029""","Commercial Banks, NEC",522110,"Commercial Banking",34,3,12/29/22,"51,675,111,424",12/31/22,"42,983,000,000","7,476,000,000","465,304,000,000","1,851,330,000,000"
26583,"Other contingent liabilities","Litigation provisions and contingencies",502804,12/31/22,03/01/23,1,"PricewaterhouseCoopers LLP",117,"PricewaterhouseCoopers Auditores SL",1306,Madrid,U3,SPAIN,Foreign,20-F,2023-03-01,,"Banco Santander, S.A.",891478,"=""SAN""","CIUDAD GRUPO SANTANDER","BOADILLA DEL MONTE",MADRID,U3,SPAIN,Foreign,,,"=""6029""","Commercial Banks, NEC",522110,"Commercial Banking",34,3,12/29/22,"51,675,111,424",12/31/22,"42,983,000,000","7,476,000,000","465,304,000,000","1,851,330,000,000"
28814,"Allowance for credit losses","Allowance for loans, advances and lease losses",507904,12/31/22,04/03/23,1,"PricewaterhouseCoopers LLP",812,"PwC Contadores y Auditores Ltda",6466,Medellin,F8,COLOMBIA,Foreign,20-F,2023-04-03,,"BANCOLOMBIA SA",1071371,,"AVENIDA LOS INDUSTRIALES","CARRERA 48 # 26 -85",MEDELLIN,F8,COLOMBIA,Foreign,,,"=""6029""","Commercial Banks, NEC",522110,"Commercial Banking",34,28,12/29/22,"3,164,856,832",12/31/22,"4,255,000,000","1,443,000,000","5,908,000,000","72,762,000,000"
28815,Goodwill,"Goodwill Impairment Assessment

",507904,12/31/22,04/03/23,1,"PricewaterhouseCoopers LLP",812,"PwC Contadores y Auditores Ltda",6466,Medellin,F8,COLOMBIA,Foreign,20-F,2023-04-03,,"BANCOLOMBIA SA",1071371,,"AVENIDA LOS INDUSTRIALES","CARRERA 48 # 26 -85",MEDELLIN,F8,COLOMBIA,Foreign,,,"=""6029""","Commercial Banks, NEC",522110,"Commercial Banking",34,28,12/29/22,"3,164,856,832",12/31/22,"4,255,000,000","1,443,000,000","5,908,000,000","72,762,000,000"
24820,"Revenue from customer contracts","Revenue Recognition",500596,12/31/22,02/23/23,2,"Ernst & Young LLP",,,,Raleigh,NC,"NORTH CAROLINA","US Southeast",10-K,2023-02-23,,"Bandwidth Inc.",1514416,"=""BAND""","2230 BANDMATE WAY",,RALEIGH,NC,"NORTH CAROLINA","US Southeast",,,"=""7372""","Prepackaged Software",511210,"Software Publishers",34,23,12/31/22,"536,548,064",12/31/22,"573,152,000","19,570,000","-231,598,000","929,318,000"
29682,"Allowance for credit losses","Assessment of the allowance for expected credit losses on loans and advances to customers, loan commitments, financial guarantees, financial assets at fair value through other comprehensive income and securities at amortized cost",510546,12/31/22,04/27/23,4,"KPMG LLP",61,"KPMG Auditores Independentes",1124,"São Paulo",D5,BRAZIL,Foreign,20-F,2023-04-28,,"BANK BRADESCO",1160330,"=""BBD""","CIDADE DE DEUS S/N VILA YARA",OSASCO,"SAO PAULO",D5,BRAZIL,Foreign,,,"=""6022""","State Commercial Banks",522110,"Commercial Banking",34,3,12/29/22,"15,481,474,048",12/31/22,"15,625,924,000","4,063,975,000","26,655,641,000","339,464,708,000"
29683,"Other contingent liabilities","Evaluation of the measurement of provisions and the disclosure of contingent liabilities - tax, civil and labor lawsuits",510546,12/31/22,04/27/23,4,"KPMG LLP",61,"KPMG Auditores Independentes",1124,"São Paulo",D5,BRAZIL,Foreign,20-F,2023-04-28,,"BANK BRADESCO",1160330,"=""BBD""","CIDADE DE DEUS S/N VILA YARA",OSASCO,"SAO PAULO",D5,BRAZIL,Foreign,,,"=""6022""","State Commercial Banks",522110,"Commercial Banking",34,3,12/29/22,"15,481,474,048",12/31/22,"15,625,924,000","4,063,975,000","26,655,641,000","339,464,708,000"
29684,"Deferred income taxes","Assessment of the recoverability of deferred tax assets",510546,12/31/22,04/27/23,4,"KPMG LLP",61,"KPMG Auditores Independentes",1124,"São Paulo",D5,BRAZIL,Foreign,20-F,2023-04-28,,"BANK BRADESCO",1160330,"=""BBD""","CIDADE DE DEUS S/N VILA YARA",OSASCO,"SAO PAULO",D5,BRAZIL,Foreign,,,"=""6022""","State Commercial Banks",522110,"Commercial Banking",34,3,12/29/22,"15,481,474,048",12/31/22,"15,625,924,000","4,063,975,000","26,655,641,000","339,464,708,000"
29685,"Goodwill and intangible assets","Evaluation of the impairment testing of goodwill and intangible assets",510546,12/31/22,04/27/23,4,"KPMG LLP",61,"KPMG Auditores Independentes",1124,"São Paulo",D5,BRAZIL,Foreign,20-F,2023-04-28,,"BANK BRADESCO",1160330,"=""BBD""","CIDADE DE DEUS S/N VILA YARA",OSASCO,"SAO PAULO",D5,BRAZIL,Foreign,,,"=""6022""","State Commercial Banks",522110,"Commercial Banking",34,3,12/29/22,"15,481,474,048",12/31/22,"15,625,924,000","4,063,975,000","26,655,641,000","339,464,708,000"
29686,"Insurance contract liabilities","Evaluation of the measurement of insurance and pension plan technical provisions",510546,12/31/22,04/27/23,4,"KPMG LLP",61,"KPMG Auditores Independentes",1124,"São Paulo",D5,BRAZIL,Foreign,20-F,2023-04-28,,"BANK BRADESCO",1160330,"=""BBD""","CIDADE DE DEUS S/N VILA YARA",OSASCO,"SAO PAULO",D5,BRAZIL,Foreign,,,"=""6022""","State Commercial Banks",522110,"Commercial Banking",34,3,12/29/22,"15,481,474,048",12/31/22,"15,625,924,000","4,063,975,000","26,655,641,000","339,464,708,000"
24665,"Allowance for credit losses","Allowance for Loan and Lease Losses - Commercial and Consumer Card Loans",500319,12/31/22,02/22/23,1,"PricewaterhouseCoopers LLP",,,,Charlotte,NC,"NORTH CAROLINA","US Southeast",10-K,2023-02-22,,"BANK OF AMERICA CORP /DE/",70858,"=""BAC""","BANK OF AMERICA CORPORATE CENTER","100 N TRYON ST",CHARLOTTE,NC,"NORTH CAROLINA","US Southeast",,,"=""6021""","National Commercial Banks",522110,"Commercial Banking",34,33,12/29/22,"265,863,397,376",12/31/22,"92,407,000,000","27,528,000,000","204,175,000,000","3,051,375,000,000"
24666,"Other investments","Valuation of Certain Level 3 Financial Instruments",500319,12/31/22,02/22/23,1,"PricewaterhouseCoopers LLP",,,,Charlotte,NC,"NORTH CAROLINA","US Southeast",10-K,2023-02-22,,"BANK OF AMERICA CORP /DE/",70858,"=""BAC""","BANK OF AMERICA CORPORATE CENTER","100 N TRYON ST",CHARLOTTE,NC,"NORTH CAROLINA","US Southeast",,,"=""6021""","National Commercial Banks",522110,"Commercial Banking",34,33,12/29/22,"265,863,397,376",12/31/22,"92,407,000,000","27,528,000,000","204,175,000,000","3,051,375,000,000"
29621,"Allowance for credit losses","Allowance for loan losses",510962,12/31/22,04/27/23,2,"Ernst & Young LLP",636,"EY Servicios Profesionales de Auditoría y Asesorías SpA (EY Audit SpA)",1431,Santiago,F3,CHILE,Foreign,20-F,2023-04-28,,"BANK OF CHILE",1161125,"=""BCH""","PASEO AHUMADA 251",,SANTIAGO,F3,CHILE,Foreign,,,"=""6029""","Commercial Banks, NEC",522110,"Commercial Banking",34,21,12/31/22,"10,515,878,132",12/31/22,"3,536,486,646","1,611,222,442",,"63,239,474,536"
26382,"Allowance for credit losses","Allowance for Credit Losses – Loans and Leases",502641,12/31/22,03/01/23,2,"Ernst & Young LLP",,,,Honolulu,HI,HAWAII,"US West",10-K,2023-03-01,,"BANK OF HAWAII CORP",46195,"=""BOH""","130 MERCHANT STREET",,HONOLULU,HI,HAWAII,"US West",,,"=""6022""","State Commercial Banks",522110,"Commercial Banking",34,78,12/31/22,"3,089,660,672",12/31/22,"705,899,000","225,804,000","1,285,478,000","23,606,877,000"
23070,"Allowance for credit losses","Assessment of the Allowances for Credit Losses for Loans",495216,10/31/22,12/01/22,4,"KPMG LLP",187,"KPMG LLP Chartered Accountants",85,Toronto,A6,ONTARIO,Canada,40-F,2022-12-01,,"BANK OF MONTREAL /CAN/",927971,"=""BMO""","FIRST CANADIAN PLACE",*,TORONTO,A6,ONTARIO,Canada,,,"=""6029""","Commercial Banks, NEC",521110,"Monetary Authorities - Central Bank",34,91,11/02/22,"59,055,042,560",10/31/22,"24,985,000,000","9,924,000,000","46,596,000,000","835,159,000,000"
23071,"Other investments","Assessment of the Measurement of the Fair Value of Certain Securities",495216,10/31/22,12/01/22,4,"KPMG LLP",187,"KPMG LLP Chartered Accountants",85,Toronto,A6,ONTARIO,Canada,40-F,2022-12-01,,"BANK OF MONTREAL /CAN/",927971,"=""BMO""","FIRST CANADIAN PLACE",*,TORONTO,A6,ONTARIO,Canada,,,"=""6029""","Commercial Banks, NEC",521110,"Monetary Authorities - Central Bank",34,91,11/02/22,"59,055,042,560",10/31/22,"24,985,000,000","9,924,000,000","46,596,000,000","835,159,000,000"
23072,"Uncertain tax positions","Assessment of Income Tax Uncertainties",495216,10/31/22,12/01/22,4,"KPMG LLP",187,"KPMG LLP Chartered Accountants",85,Toronto,A6,ONTARIO,Canada,40-F,2022-12-01,,"BANK OF MONTREAL /CAN/",927971,"=""BMO""","FIRST CANADIAN PLACE",*,TORONTO,A6,ONTARIO,Canada,,,"=""6029""","Commercial Banks, NEC",521110,"Monetary Authorities - Central Bank",34,91,11/02/22,"59,055,042,560",10/31/22,"24,985,000,000","9,924,000,000","46,596,000,000","835,159,000,000"
23073,"Insurance contract liabilities","Assessment of Insurance-related Liabilities",495216,10/31/22,12/01/22,4,"KPMG LLP",187,"KPMG LLP Chartered Accountants",85,Toronto,A6,ONTARIO,Canada,40-F,2022-12-01,,"BANK OF MONTREAL /CAN/",927971,"=""BMO""","FIRST CANADIAN PLACE",*,TORONTO,A6,ONTARIO,Canada,,,"=""6029""","Commercial Banks, NEC",521110,"Monetary Authorities - Central Bank",34,91,11/02/22,"59,055,042,560",10/31/22,"24,985,000,000","9,924,000,000","46,596,000,000","835,159,000,000"
23074,"Allowance for credit losses","Assessment of the Allowances for Credit Losses for Loans",495334,10/31/22,12/01/22,4,"KPMG LLP",187,"KPMG LLP Chartered Accountants",85,Toronto,A6,ONTARIO,Canada,6-K,2022-12-01,,"BANK OF MONTREAL /CAN/",927971,"=""BMO""","FIRST CANADIAN PLACE",*,TORONTO,A6,ONTARIO,Canada,,,"=""6029""","Commercial Banks, NEC",521110,"Monetary Authorities - Central Bank",34,91,11/02/22,"59,055,042,560",10/31/22,"24,985,000,000","9,924,000,000","46,596,000,000","835,159,000,000"
23075,"Other investments","Assessment of the Measurement of the Fair Value of Certain Securities",495334,10/31/22,12/01/22,4,"KPMG LLP",187,"KPMG LLP Chartered Accountants",85,Toronto,A6,ONTARIO,Canada,6-K,2022-12-01,,"BANK OF MONTREAL /CAN/",927971,"=""BMO""","FIRST CANADIAN PLACE",*,TORONTO,A6,ONTARIO,Canada,,,"=""6029""","Commercial Banks, NEC",521110,"Monetary Authorities - Central Bank",34,91,11/02/22,"59,055,042,560",10/31/22,"24,985,000,000","9,924,000,000","46,596,000,000","835,159,000,000"
23076,"Uncertain tax positions","Assessment of Income Tax Uncertainties",495334,10/31/22,12/01/22,4,"KPMG LLP",187,"KPMG LLP Chartered Accountants",85,Toronto,A6,ONTARIO,Canada,6-K,2022-12-01,,"BANK OF MONTREAL /CAN/",927971,"=""BMO""","FIRST CANADIAN PLACE",*,TORONTO,A6,ONTARIO,Canada,,,"=""6029""","Commercial Banks, NEC",521110,"Monetary Authorities - Central Bank",34,91,11/02/22,"59,055,042,560",10/31/22,"24,985,000,000","9,924,000,000","46,596,000,000","835,159,000,000"
23077,"Insurance contract liabilities","Assessment of Insurance-related Liabilities",495334,10/31/22,12/01/22,4,"KPMG LLP",187,"KPMG LLP Chartered Accountants",85,Toronto,A6,ONTARIO,Canada,6-K,2022-12-01,,"BANK OF MONTREAL /CAN/",927971,"=""BMO""","FIRST CANADIAN PLACE",*,TORONTO,A6,ONTARIO,Canada,,,"=""6029""","Commercial Banks, NEC",521110,"Monetary Authorities - Central Bank",34,91,11/02/22,"59,055,042,560",10/31/22,"24,985,000,000","9,924,000,000","46,596,000,000","835,159,000,000"
24765,"Allowance for credit losses","Allowance for Credit Losses",500461,12/31/22,02/22/23,1,"PricewaterhouseCoopers LLP",90,"PricewaterhouseCoopers Ltd",1403,Hamilton,D0,BERMUDA,Foreign,20-F,2023-02-22,,"Bank of N.T. Butterfield & Son Ltd",1653242,"=""NTB""","65 FRONT STREET",,HAMILTON,D0,BERMUDA,Foreign,,,"=""6029""","Commercial Banks, NEC",522110,"Commercial Banking",34,30,12/29/22,"1,507,322,752",12/31/22,"549,297,000","214,020,000","790,445,000","14,306,062,000"
25832,"Allowance for credit losses","Quantitative component of BNY Mellon’s pooled allowance for credit losses for loans and lending-related commitments related to higher risk-rated and pass-rated commercial and institutional credits and loans secured by commercial real estate",501425,12/31/22,02/27/23,4,"KPMG LLP",,,,"New York",NY,"NEW YORK","US Mid Atlantic",10-K,2023-02-27,,"Bank of New York Mellon Corp",1390777,"=""BK""","240 GREENWICH STREET",,"NEW YORK",NY,"NEW YORK","US Mid Atlantic",,,"=""6022""","State Commercial Banks",522110,"Commercial Banking",34,46,12/31/22,"36,800,397,312",12/31/22,"16,490,000,000","2,556,000,000","21,792,000,000","405,783,000,000"
25833,"Other contingent liabilities","Identification and measurement of accruals for litigation and regulatory contingencies",501425,12/31/22,02/27/23,4,"KPMG LLP",,,,"New York",NY,"NEW YORK","US Mid Atlantic",10-K,2023-02-27,,"Bank of New York Mellon Corp",1390777,"=""BK""","240 GREENWICH STREET",,"NEW YORK",NY,"NEW YORK","US Mid Atlantic",,,"=""6022""","State Commercial Banks",522110,"Commercial Banking",34,46,12/31/22,"36,800,397,312",12/31/22,"16,490,000,000","2,556,000,000","21,792,000,000","405,783,000,000"
25834,Goodwill,"Assessment of the valuation of goodwill for the Investment Management reporting unit
",501425,12/31/22,02/27/23,4,"KPMG LLP",,,,"New York",NY,"NEW YORK","US Mid Atlantic",10-K,2023-02-27,,"Bank of New York Mellon Corp",1390777,"=""BK""","240 GREENWICH STREET",,"NEW YORK",NY,"NEW YORK","US Mid Atlantic",,,"=""6022""","State Commercial Banks",522110,"Commercial Banking",34,46,12/31/22,"36,800,397,312",12/31/22,"16,490,000,000","2,556,000,000","21,792,000,000","405,783,000,000"
23097,"Allowance for credit losses","(i) Assessment of Allowance for Credit Losses on Financial Assets (ACL)",495327,10/31/22,11/29/22,4,"KPMG LLP",187,"KPMG LLP Chartered Accountants",85,Toronto,A6,ONTARIO,Canada,6-K,2022-11-29,,"BANK OF NOVA SCOTIA",9631,"=""BNS""","40 TEMPERANCE STREET",,TORONTO,A6,ONTARIO,Canada,,,"=""6022""","State Commercial Banks",522110,"Commercial Banking",34,48,11/02/22,"58,105,286,656",10/31/22,"22,018,000,000","7,270,000,000","41,342,000,000","989,273,000,000"
23098,"Other investments","(ii) Assessment of the Measurement of Fair Value of Certain Financial Instruments",495327,10/31/22,11/29/22,4,"KPMG LLP",187,"KPMG LLP Chartered Accountants",85,Toronto,A6,ONTARIO,Canada,6-K,2022-11-29,,"BANK OF NOVA SCOTIA",9631,"=""BNS""","40 TEMPERANCE STREET",,TORONTO,A6,ONTARIO,Canada,,,"=""6022""","State Commercial Banks",522110,"Commercial Banking",34,48,11/02/22,"58,105,286,656",10/31/22,"22,018,000,000","7,270,000,000","41,342,000,000","989,273,000,000"
23099,"Uncertain tax positions","(iii) Assessment of Uncertain Tax Provisions",495327,10/31/22,11/29/22,4,"KPMG LLP",187,"KPMG LLP Chartered Accountants",85,Toronto,A6,ONTARIO,Canada,6-K,2022-11-29,,"BANK OF NOVA SCOTIA",9631,"=""BNS""","40 TEMPERANCE STREET",,TORONTO,A6,ONTARIO,Canada,,,"=""6022""","State Commercial Banks",522110,"Commercial Banking",34,48,11/02/22,"58,105,286,656",10/31/22,"22,018,000,000","7,270,000,000","41,342,000,000","989,273,000,000"
23102,"Allowance for credit losses","(i) Assessment of Allowance for Credit Losses on Financial Assets (ACL)
",495326,10/31/22,11/29/22,4,"KPMG LLP",187,"KPMG LLP Chartered Accountants",85,Toronto,A6,ONTARIO,Canada,6-K,2022-11-29,,"BANK OF NOVA SCOTIA",9631,"=""BNS""","40 TEMPERANCE STREET",,TORONTO,A6,ONTARIO,Canada,,,"=""6022""","State Commercial Banks",522110,"Commercial Banking",34,48,11/02/22,"58,105,286,656",10/31/22,"22,018,000,000","7,270,000,000","41,342,000,000","989,273,000,000"
23103,"Other investments","(ii) Assessment of the Measurement of Fair Value of Certain Financial Instruments",495326,10/31/22,11/29/22,4,"KPMG LLP",187,"KPMG LLP Chartered Accountants",85,Toronto,A6,ONTARIO,Canada,6-K,2022-11-29,,"BANK OF NOVA SCOTIA",9631,"=""BNS""","40 TEMPERANCE STREET",,TORONTO,A6,ONTARIO,Canada,,,"=""6022""","State Commercial Banks",522110,"Commercial Banking",34,48,11/02/22,"58,105,286,656",10/31/22,"22,018,000,000","7,270,000,000","41,342,000,000","989,273,000,000"
23104,"Uncertain tax positions","(iii) Assessment of Uncertain Tax Provisions",495326,10/31/22,11/29/22,4,"KPMG LLP",187,"KPMG LLP Chartered Accountants",85,Toronto,A6,ONTARIO,Canada,6-K,2022-11-29,,"BANK OF NOVA SCOTIA",9631,"=""BNS""","40 TEMPERANCE STREET",,TORONTO,A6,ONTARIO,Canada,,,"=""6022""","State Commercial Banks",522110,"Commercial Banking",34,48,11/02/22,"58,105,286,656",10/31/22,"22,018,000,000","7,270,000,000","41,342,000,000","989,273,000,000"
39256,"Allowance for credit losses","(i) Assessment of Allowance for Credit Losses on Financial Assets (ACL)",495234,10/31/22,11/29/22,4,"KPMG LLP",187,"KPMG LLP Chartered Accountants",85,Toronto,A6,ONTARIO,Canada,40-F,2022-11-29,,"BANK OF NOVA SCOTIA",9631,"=""BNS""","40 TEMPERANCE STREET",,TORONTO,A6,ONTARIO,Canada,,,"=""6022""","State Commercial Banks",522110,"Commercial Banking",34,48,11/02/22,"58,105,286,656",10/31/22,"22,018,000,000","7,270,000,000","41,342,000,000","989,273,000,000"
39257,"Other investments","(ii) Assessment of the Measurement of Fair Value of Certain Financial Instruments",495234,10/31/22,11/29/22,4,"KPMG LLP",187,"KPMG LLP Chartered Accountants",85,Toronto,A6,ONTARIO,Canada,40-F,2022-11-29,,"BANK OF NOVA SCOTIA",9631,"=""BNS""","40 TEMPERANCE STREET",,TORONTO,A6,ONTARIO,Canada,,,"=""6022""","State Commercial Banks",522110,"Commercial Banking",34,48,11/02/22,"58,105,286,656",10/31/22,"22,018,000,000","7,270,000,000","41,342,000,000","989,273,000,000"
39258,"Uncertain tax positions","(iii) Assessment of Uncertain Tax Provisions",495234,10/31/22,11/29/22,4,"KPMG LLP",187,"KPMG LLP Chartered Accountants",85,Toronto,A6,ONTARIO,Canada,40-F,2022-11-29,,"BANK OF NOVA SCOTIA",9631,"=""BNS""","40 TEMPERANCE STREET",,TORONTO,A6,ONTARIO,Canada,,,"=""6022""","State Commercial Banks",522110,"Commercial Banking",34,48,11/02/22,"58,105,286,656",10/31/22,"22,018,000,000","7,270,000,000","41,342,000,000","989,273,000,000"
24664,"Allowance for credit losses","Allowance for Credit Losses — Refer to Notes 1 and 4 to the financial statements",500317,12/31/22,02/22/23,3,"Deloitte & Touche LLP",,,,Miami,FL,FLORIDA,"US Southeast",10-K,2023-02-22,,"BankUnited, Inc.",1504008,"=""BKU""","14817 OAK LANE",,"MIAMI LAKES",FL,FLORIDA,"US Southeast",,,"=""6035""","Savings Institutions, Federally Chartered",522110,"Commercial Banking",34,34,12/31/22,"2,570,665,728",12/31/22,"915,442,000","284,971,000","2,358,344,000","37,026,712,000"
29416,Goodwill,"Goodwill - Baozun Reporting Unit — Refer to Notes 2(p) to the financial statements",509818,12/31/22,04/25/23,3,"Deloitte & Touche LLP",499,"Deloitte Touche Tohmatsu Certified Public Accountants LLP",1113,Shanghai,F4,CHINA,Foreign,20-F,2023-04-25,,"Baozun Inc.",1625414,"=""BZUN""","NO. 1-9, LANE 510, WEST JIANGCHANG ROAD","JING'AN DISTRICT",SHANGHAI,F4,CHINA,Foreign,,,"=""5961""","Catalog and Mail-Order Houses",454111,"Electronic Shopping",34,5,12/31/22,"311,642,848",12/31/22,"1,208,428,000","-93,976,000","695,614,000","1,456,114,000"
24031,"Allowance for credit losses","Impairment allowance for loans and advances at amortized cost, including off-balance sheet elements of the allowance",499487,12/31/22,02/14/23,4,"KPMG LLP",87,"KPMG LLP",1118,London,X0,"UNITED KINGDOM",Foreign,20-F,2023-02-15,,"BARCLAYS BANK PLC",312070,"=""DJP""","1 CHURCHILL PLACE",*,LONDON,X0,"UNITED KINGDOM",Foreign,312069,"BARCLAYS PLC","=""6029""","Commercial Banks, NEC",522110,"Commercial Banking",34,,,,12/31/22,"24,066,000,000","5,271,000,000","68,912,000,000","1,447,742,000,000"
24032,"Other investments","Valuation of certain difficult-to-value financial instruments recorded at fair value",499487,12/31/22,02/14/23,4,"KPMG LLP",87,"KPMG LLP",1118,London,X0,"UNITED KINGDOM",Foreign,20-F,2023-02-15,,"BARCLAYS BANK PLC",312070,"=""DJP""","1 CHURCHILL PLACE",*,LONDON,X0,"UNITED KINGDOM",Foreign,312069,"BARCLAYS PLC","=""6029""","Commercial Banks, NEC",522110,"Commercial Banking",34,,,,12/31/22,"24,066,000,000","5,271,000,000","68,912,000,000","1,447,742,000,000"
24033,"Pension and other post-employment benefits","UK Pension Scheme – Defined Benefit Obligation (‘DBO’) assumptions",499487,12/31/22,02/14/23,4,"KPMG LLP",87,"KPMG LLP",1118,London,X0,"UNITED KINGDOM",Foreign,20-F,2023-02-15,,"BARCLAYS BANK PLC",312070,"=""DJP""","1 CHURCHILL PLACE",*,LONDON,X0,"UNITED KINGDOM",Foreign,312069,"BARCLAYS PLC","=""6029""","Commercial Banks, NEC",522110,"Commercial Banking",34,,,,12/31/22,"24,066,000,000","5,271,000,000","68,912,000,000","1,447,742,000,000"
24026,"Allowance for credit losses","Impairment allowance for loans and advances at amortized cost, including off-balance sheet elements of the allowance",499478,12/31/22,02/14/23,4,"KPMG LLP",87,"KPMG LLP",1118,London,X0,"UNITED KINGDOM",Foreign,20-F,2023-02-15,,"BARCLAYS PLC",312069,"=""BCS""","1 CHURCHILL PLACE","CANARY WHARF",LONDON,X0,"UNITED KINGDOM",Foreign,,,"=""6029""","Commercial Banks, NEC",521110,"Monetary Authorities - Central Bank",34,8,12/29/22,"32,667,291,648",12/31/22,"32,207,000,000","7,185,000,000","72,238,000,000","1,820,838,000,000"
24027,"Other investments","Valuation of certain difficult-to-value financial instruments recorded at fair value",499478,12/31/22,02/14/23,4,"KPMG LLP",87,"KPMG LLP",1118,London,X0,"UNITED KINGDOM",Foreign,20-F,2023-02-15,,"BARCLAYS PLC",312069,"=""BCS""","1 CHURCHILL PLACE","CANARY WHARF",LONDON,X0,"UNITED KINGDOM",Foreign,,,"=""6029""","Commercial Banks, NEC",521110,"Monetary Authorities - Central Bank",34,8,12/29/22,"32,667,291,648",12/31/22,"32,207,000,000","7,185,000,000","72,238,000,000","1,820,838,000,000"
24028,"Pension and other post-employment benefits","UK Pension Scheme – Defined Benefit Obligation (‘DBO’) assumptions",499478,12/31/22,02/14/23,4,"KPMG LLP",87,"KPMG LLP",1118,London,X0,"UNITED KINGDOM",Foreign,20-F,2023-02-15,,"BARCLAYS PLC",312069,"=""BCS""","1 CHURCHILL PLACE","CANARY WHARF",LONDON,X0,"UNITED KINGDOM",Foreign,,,"=""6029""","Commercial Banks, NEC",521110,"Monetary Authorities - Central Bank",34,8,12/29/22,"32,667,291,648",12/31/22,"32,207,000,000","7,185,000,000","72,238,000,000","1,820,838,000,000"
24897,"Other investments","Assessment of the fair value of investments",500684,12/31/22,02/23/23,4,"KPMG LLP",,,,Charlotte,NC,"NORTH CAROLINA","US Southeast",10-K,2023-02-23,,"Barings BDC, Inc.",1379785,"=""BBDC""","300 SOUTH TRYON STREET","SUITE 2500",CHARLOTTE,NC,"NORTH CAROLINA","US Southeast",,,,,525990,"Other Financial Vehicles",34,8,12/31/22,"879,516,736",12/31/22,"162,264,000","4,681,000",,"2,709,957,000"
21365,Inventory,"Inventory – Excess and Obsolete Inventory Reserve — Refer to Note 2 to the financial statements",487655,03/31/22,05/31/22,3,"Deloitte & Touche LLP",,,,"New York",NY,"NEW YORK","US Mid Atlantic",10-K,2022-05-31,,"Bark, Inc.",1819574,"=""BARK""","120 BROADWAY, 12TH FLOOR",,"NEW YORK",NY,"NEW YORK","US Mid Atlantic",,,"=""5990""","Retail-Retail Stores, NEC",454111,"Electronic Shopping",34,4,03/31/22,"648,573,504",03/31/22,"507,406,000","-68,299,000","213,224,000","434,061,000"
21662,Inventory,"Non-Returnable Inventory Reserve",489015,04/30/22,06/29/22,2,"Ernst & Young LLP",,,,Iselin,NJ,"NEW JERSEY","US Mid Atlantic",10-K,2022-06-29,,"Barnes & Noble Education, Inc.",1634117,"=""BNED""","120 MOUNTAIN VIEW BOULEVARD",,"BASKING RIDGE",NJ,"NEW JERSEY","US Mid Atlantic",,,"=""5940""","Retail-Miscellaneous Shopping Goods Stores",451211,"Book Stores",34,3,04/30/22,"158,219,840",04/30/22,"1,531,400,000","-68,857,000","94,050,000","1,071,553,000"
21663,"Long-lived assets","Long-Lived Asset Impairment",489015,04/30/22,06/29/22,2,"Ernst & Young LLP",,,,Iselin,NJ,"NEW JERSEY","US Mid Atlantic",10-K,2022-06-29,,"Barnes & Noble Education, Inc.",1634117,"=""BNED""","120 MOUNTAIN VIEW BOULEVARD",,"BASKING RIDGE",NJ,"NEW JERSEY","US Mid Atlantic",,,"=""5940""","Retail-Miscellaneous Shopping Goods Stores",451211,"Book Stores",34,3,04/30/22,"158,219,840",04/30/22,"1,531,400,000","-68,857,000","94,050,000","1,071,553,000"
24509,Goodwill,"Goodwill Impairment Assessments – Automation Reporting Unit",500103,12/31/22,02/21/23,1,"PricewaterhouseCoopers LLP",,,,Hartford,CT,CONNECTICUT,"US New England",10-K,2023-02-21,,"BARNES GROUP INC",9984,,"123 MAIN ST",,BRISTOL,CT,CONNECTICUT,"US New England",,,"=""3490""","Miscellaneous Fabricated Metal Products",334511,"Search, Detection, Navigation, Guidance, Aeronautical, and Nautical System and Instrument Manufacturing",34,41,12/31/22,"2,066,629,760",12/31/22,"1,261,868,000","13,479,000","68,363,000","2,413,730,000"
26811,"Other contingent liabilities","Workers' Compensation Claims Liabilities",503387,12/31/22,03/06/23,3,"Deloitte & Touche LLP",,,,Portland,OR,OREGON,"US West",10-K,2023-03-06,,"BARRETT BUSINESS SERVICES INC",902791,"=""BBSI""","8100 NE PARKWAY DRIVE","SUITE 200",VANCOUVER,WA,WASHINGTON,"US West",,,"=""7363""","Help Supply Services",561310,"Employment Placement Agencies",34,93,12/31/22,"640,926,848",12/31/22,"1,054,326,000","47,268,000","130,022,000","686,938,000"
24092,"Long-lived assets","Impairment assessments for goodwill and other non-current assets",499564,12/31/22,02/14/23,1,"PricewaterhouseCoopers LLP",191,"PricewaterhouseCoopers LLP Chartered Accountants",271,Toronto,A6,ONTARIO,Canada,6-K,2023-02-15,,"BARRICK MINING CORP",756894,"=""B""","BROOKFIELD PLACE, TD CANADA TRUST TOWER","161 BAY STREET SUITE 3700",TORONTO,A6,ONTARIO,Canada,,,"=""1040""","Metal Mining",212221,"Gold Ore Mining",34,17,12/31/22,"30,156,906,496",12/31/22,"11,013,000,000","1,017,000,000","19,041,000,000","45,965,000,000"
24093,"Uncertain tax positions","Uncertain tax positions",499564,12/31/22,02/14/23,1,"PricewaterhouseCoopers LLP",191,"PricewaterhouseCoopers LLP Chartered Accountants",271,Toronto,A6,ONTARIO,Canada,6-K,2023-02-15,,"BARRICK MINING CORP",756894,"=""B""","BROOKFIELD PLACE, TD CANADA TRUST TOWER","161 BAY STREET SUITE 3700",TORONTO,A6,ONTARIO,Canada,,,"=""1040""","Metal Mining",212221,"Gold Ore Mining",34,17,12/31/22,"30,156,906,496",12/31/22,"11,013,000,000","1,017,000,000","19,041,000,000","45,965,000,000"
27641,"Long-lived assets","Impairment assessments for goodwill and other non-current assets",505441,12/31/22,02/14/23,1,"PricewaterhouseCoopers LLP",191,"PricewaterhouseCoopers LLP Chartered Accountants",271,Toronto,A6,ONTARIO,Canada,40-F,2023-03-17,,"BARRICK MINING CORP",756894,"=""B""","BROOKFIELD PLACE, TD CANADA TRUST TOWER","161 BAY STREET SUITE 3700",TORONTO,A6,ONTARIO,Canada,,,"=""1040""","Metal Mining",212221,"Gold Ore Mining",34,17,12/31/22,"30,156,906,496",12/31/22,"11,013,000,000","1,017,000,000","19,041,000,000","45,965,000,000"
27642,"Uncertain tax positions","Uncertain tax positions",505441,12/31/22,02/14/23,1,"PricewaterhouseCoopers LLP",191,"PricewaterhouseCoopers LLP Chartered Accountants",271,Toronto,A6,ONTARIO,Canada,40-F,2023-03-17,,"BARRICK MINING CORP",756894,"=""B""","BROOKFIELD PLACE, TD CANADA TRUST TOWER","161 BAY STREET SUITE 3700",TORONTO,A6,ONTARIO,Canada,,,"=""1040""","Metal Mining",212221,"Gold Ore Mining",34,17,12/31/22,"30,156,906,496",12/31/22,"11,013,000,000","1,017,000,000","19,041,000,000","45,965,000,000"
23477,Inventory,"Measurement of Reserves for Excess and Obsolete Inventories",498032,11/26/22,01/24/23,2,"Ernst & Young LLP",,,,Richmond,VA,VIRGINIA,"US Mid Atlantic",10-K,2023-01-24,,"BASSETT FURNITURE INDUSTRIES INC",10329,"=""BSET""","PO BOX 626",,BASSETT,VA,VIRGINIA,"US Mid Atlantic",,,"=""2511""","Wood Household Furniture, Except Upholstered",337122,"Nonupholstered Wood Household Furniture Manufacturing",34,19,11/30/22,"169,995,424",11/26/22,"485,601,000","65,345,000","173,882,000","406,273,000"
18867,"Other income taxes","Tax-Free Determination of the Spin-Off of the Victoria’s Secret Business",480097,01/29/22,03/18/22,2,"Ernst & Young LLP",,,,"Grandview Heights",OH,OHIO,"US Midwest",10-K,2022-03-18,,"Bath & Body Works, Inc.",701985,"=""BBWI""","THREE LIMITED PKWY","P O BOX 16000",COLUMBUS,OH,OHIO,"US Midwest",,,"=""5990""","Retail-Retail Stores, NEC",448120,"Women's Clothing Stores",34,56,01/31/22,"14,241,779,712",01/29/22,"7,882,000,000","1,333,000,000","-2,311,000,000","6,026,000,000"
28405,"Proven and unproven reserves","Proved Oil and Natural Gas Property and Depletion — Oil and Natural Gas Reserve Quantities — Refer to Note 1 and 4 to the financial statements",506915,12/31/22,03/30/23,3,"Deloitte & Touche LLP",,,,Houston,TX,TEXAS,"US Southwest",10-K,2023-03-30,,"BATTALION OIL CORP",1282648,"=""BATL""","820 GESSNER ROAD","SUITE 1100",HOUSTON,TX,TEXAS,"US Southwest",,,"=""1311""","Crude Petroleum and Natural Gas",211111,"Crude Petroleum and Natural Gas Extraction",34,10,12/31/22,"158,708,160",12/31/22,"359,064,000","18,539,000",,"485,358,000"
24660,Goodwill,"Goodwill Impairment Assessments – Vision Care, Ophthalmic Pharmaceuticals, and Surgical Reporting Units",500289,12/31/22,02/22/23,1,"PricewaterhouseCoopers LLP",,,,"Florham Park",NJ,"NEW JERSEY","US Mid Atlantic",10-K,2023-02-22,,"Bausch & Lomb Corp",1860742,"=""BLCO""","520 APPLEWOOD CRESCENT",,VAUGHAN,A6,ONTARIO,Canada,,,"=""3851""","Ophthalmic Goods",339115,"Ophthalmic Goods Manufacturing",34,16,12/31/22,"5,428,511,744",12/31/22,"3,768,000,000","6,000,000","468,000,000","11,144,000,000"
25066,"Sales return and allowances","Medicaid Rebates and Sales Returns Allowances",500854,12/31/22,02/23/23,1,"PricewaterhouseCoopers LLP",,,,"Florham Park",NJ,"NEW JERSEY","US Mid Atlantic",10-K,2023-02-23,,"Bausch Health Companies Inc.",885590,"=""BHC""","2150 ST. ELZEAR BLVD. WEST",LAVAL,QUEBEC,A8,QUEBEC,Canada,,,"=""2834""","Pharmaceutical Preparations",325412,"Pharmaceutical Preparation Manufacturing",34,6,12/31/22,"2,272,724,736",12/31/22,"8,124,000,000","-225,000,000","-17,831,000,000","25,686,000,000"
25067,Goodwill,"Goodwill Impairment Assessments – Ortho Dermatologics, Vision Care, Ophthalmic Pharmaceuticals, Surgical and Neurology and Other Reporting Units",500854,12/31/22,02/23/23,1,"PricewaterhouseCoopers LLP",,,,"Florham Park",NJ,"NEW JERSEY","US Mid Atlantic",10-K,2023-02-23,,"Bausch Health Companies Inc.",885590,"=""BHC""","2150 ST. ELZEAR BLVD. WEST",LAVAL,QUEBEC,A8,QUEBEC,Canada,,,"=""2834""","Pharmaceutical Preparations",325412,"Pharmaceutical Preparation Manufacturing",34,6,12/31/22,"2,272,724,736",12/31/22,"8,124,000,000","-225,000,000","-17,831,000,000","25,686,000,000"
25068,"Goodwill and intangible assets","Interim Finite-Lived Intangible Assets and Goodwill Impairment Assessments - Xifaxan® Finite-Lived Intangible Assets and Salix Reporting Unit",500854,12/31/22,02/23/23,1,"PricewaterhouseCoopers LLP",,,,"Florham Park",NJ,"NEW JERSEY","US Mid Atlantic",10-K,2023-02-23,,"Bausch Health Companies Inc.",885590,"=""BHC""","2150 ST. ELZEAR BLVD. WEST",LAVAL,QUEBEC,A8,QUEBEC,Canada,,,"=""2834""","Pharmaceutical Preparations",325412,"Pharmaceutical Preparation Manufacturing",34,6,12/31/22,"2,272,724,736",12/31/22,"8,124,000,000","-225,000,000","-17,831,000,000","25,686,000,000"
23738,Goodwill,"Trigger-Based Goodwill Impairment Assessments - Patient Support Systems, Front Line Care, and Surgical Solutions Reporting Units",498957,12/31/22,02/09/23,1,"PricewaterhouseCoopers LLP",,,,Chicago,IL,ILLINOIS,"US Midwest",10-K,2023-02-09,,"BAXTER INTERNATIONAL INC",10456,"=""BAX""","ONE BAXTER PARKWAY",,DEERFIELD,IL,ILLINOIS,"US Midwest",,,"=""3841""","Surgical and Medical Instruments and Apparatus",325414,"Biological Product (except Diagnostic) Manufacturing",34,51,12/31/22,"25,710,917,632",12/31/22,"15,113,000,000","-2,433,000,000","-7,803,000,000","28,287,000,000"
23739,"Other intangible assets","Trigger-Based Indefinite-Lived Intangible Asset Impairment Assessments - Hillrom and Welch Allyn Trade Names",498957,12/31/22,02/09/23,1,"PricewaterhouseCoopers LLP",,,,Chicago,IL,ILLINOIS,"US Midwest",10-K,2023-02-09,,"BAXTER INTERNATIONAL INC",10456,"=""BAX""","ONE BAXTER PARKWAY",,DEERFIELD,IL,ILLINOIS,"US Midwest",,,"=""3841""","Surgical and Medical Instruments and Apparatus",325414,"Biological Product (except Diagnostic) Manufacturing",34,51,12/31/22,"25,710,917,632",12/31/22,"15,113,000,000","-2,433,000,000","-7,803,000,000","28,287,000,000"
25481,"Proven and unproven reserves","Assessment of the recoverable amount of oil and gas properties",500912,12/31/22,02/23/23,4,"KPMG LLP",187,"KPMG LLP Chartered Accountants",85,Calgary,A0,ALBERTA,Canada,40-F,2023-02-24,,"BAYTEX ENERGY CORP.",1279495,"=""BTE""","2200 205 5TH AVE SW",,CALGARY,A0,ALBERTA,Canada,,,"=""1381""","Drilling Oil and Gas Wells",213111,"Drilling Oil and Gas Wells",34,,,,12/31/22,"1,716,728,000","631,466,000",,"3,766,758,000"
25482,"Proven and unproven reserves","Impact of estimated oil and gas reserves on depletion expense related to oil and gas properties",500912,12/31/22,02/23/23,4,"KPMG LLP",187,"KPMG LLP Chartered Accountants",85,Calgary,A0,ALBERTA,Canada,40-F,2023-02-24,,"BAYTEX ENERGY CORP.",1279495,"=""BTE""","2200 205 5TH AVE SW",,CALGARY,A0,ALBERTA,Canada,,,"=""1381""","Drilling Oil and Gas Wells",213111,"Drilling Oil and Gas Wells",34,,,,12/31/22,"1,716,728,000","631,466,000",,"3,766,758,000"
32167,"Going concern","Appropriateness of Management’s Use of the Going Concern Basis of Accounting",523146,12/31/22,11/13/23,1,"PricewaterhouseCoopers LLP",107,"PricewaterhouseCoopers SC",1128,"Mexico City",O5,MEXICO,Foreign,DRS,2023-11-13,,"BBB FOODS INC",1978954,"=""TBBB""","RIO DANUBIO 51","COL. CUAUHTEMOC","MEXICO CITY",O5,MEXICO,Foreign,,,"=""5411""","Grocery Stores",445110,"Supermarkets and Other Grocery (except Convenience) Stores",34,,,,12/31/22,"1,671,883,000","-28,999,000","-242,287,000","605,263,000"
32168,"Going concern","Appropriateness of Management’s Use of the Going Concern Basis of Accounting",523147,12/31/22,11/13/23,1,"PricewaterhouseCoopers LLP",107,"PricewaterhouseCoopers SC",1128,"Mexico City",O5,MEXICO,Foreign,DRS/A,2023-12-27,,"BBB FOODS INC",1978954,"=""TBBB""","RIO DANUBIO 51","COL. CUAUHTEMOC","MEXICO CITY",O5,MEXICO,Foreign,,,"=""5411""","Grocery Stores",445110,"Supermarkets and Other Grocery (except Convenience) Stores",34,,,,12/31/22,"1,671,883,000","-28,999,000","-242,287,000","605,263,000"
32175,"Going concern","Appropriateness of Management’s Use of the Going Concern Basis of Accounting",523171,12/31/22,11/13/23,1,"PricewaterhouseCoopers LLP",107,"PricewaterhouseCoopers SC",1128,"Mexico City",O5,MEXICO,Foreign,F-1,2024-01-18,,"BBB FOODS INC",1978954,"=""TBBB""","RIO DANUBIO 51","COL. CUAUHTEMOC","MEXICO CITY",O5,MEXICO,Foreign,,,"=""5411""","Grocery Stores",445110,"Supermarkets and Other Grocery (except Convenience) Stores",34,,,,12/31/22,"1,671,883,000","-28,999,000","-242,287,000","605,263,000"
32342,"Going concern","Appropriateness of Management’s Use of the Going Concern Basis of Accounting",523938,12/31/22,11/13/23,1,"PricewaterhouseCoopers LLP",107,"PricewaterhouseCoopers SC",1128,"Mexico City",O5,MEXICO,Foreign,F-1/A,2024-02-02,,"BBB FOODS INC",1978954,"=""TBBB""","RIO DANUBIO 51","COL. CUAUHTEMOC","MEXICO CITY",O5,MEXICO,Foreign,,,"=""5411""","Grocery Stores",445110,"Supermarkets and Other Grocery (except Convenience) Stores",34,,,,12/31/22,"1,671,883,000","-28,999,000","-242,287,000","605,263,000"
32393,"Going concern","Appropriateness of Management’s Use of the Going Concern Basis of Accounting",524107,12/31/22,11/13/23,1,"PricewaterhouseCoopers LLP",107,"PricewaterhouseCoopers SC",1128,"Mexico City",O5,MEXICO,Foreign,F-1/A,2024-02-06,,"BBB FOODS INC",1978954,"=""TBBB""","RIO DANUBIO 51","COL. CUAUHTEMOC","MEXICO CITY",O5,MEXICO,Foreign,,,"=""5411""","Grocery Stores",445110,"Supermarkets and Other Grocery (except Convenience) Stores",34,,,,12/31/22,"1,671,883,000","-28,999,000","-242,287,000","605,263,000"
32476,"Going concern","Appropriateness of Management’s Use of the Going Concern Basis of Accounting",524278,12/31/22,11/13/23,1,"PricewaterhouseCoopers LLP",107,"PricewaterhouseCoopers SC",1128,"Mexico City",O5,MEXICO,Foreign,F-1/A,2024-02-08,,"BBB FOODS INC",1978954,"=""TBBB""","RIO DANUBIO 51","COL. CUAUHTEMOC","MEXICO CITY",O5,MEXICO,Foreign,,,"=""5411""","Grocery Stores",445110,"Supermarkets and Other Grocery (except Convenience) Stores",34,,,,12/31/22,"1,671,883,000","-28,999,000","-242,287,000","605,263,000"
32521,"Going concern","Appropriateness of Management’s Use of the Going Concern Basis of Accounting",524380,12/31/22,11/13/23,1,"PricewaterhouseCoopers LLP",107,"PricewaterhouseCoopers SC",1128,"Mexico City",O5,MEXICO,Foreign,424B1,2024-02-09,,"BBB FOODS INC",1978954,"=""TBBB""","RIO DANUBIO 51","COL. CUAUHTEMOC","MEXICO CITY",O5,MEXICO,Foreign,,,"=""5411""","Grocery Stores",445110,"Supermarkets and Other Grocery (except Convenience) Stores",34,,,,12/31/22,"1,671,883,000","-28,999,000","-242,287,000","605,263,000"
27086,"Other investments","Fair Value of Level 3 Investments — Refer to Notes 2 and 4 to the financial statements",504330,12/31/22,03/09/23,3,"Deloitte & Touche LLP",,,,"New York",NY,"NEW YORK","US Mid Atlantic",10-K,2023-03-09,,"BC Partners Lending Corp",1726548,,"650 MADISON AVENUE",,"NEW YORK",NY,"NEW YORK","US Mid Atlantic",,,,,525990,"Other Financial Vehicles",34,,,,12/31/22,"9,273,000","2,543,000","48,772,000","109,473,000"
26697,"Goodwill and intangible assets","Goodwill and Intangible Assets - Bell Media Group - Refer to Notes 2N, 8, 19 and 22 to the financial statements",503135,12/31/22,03/02/23,3,"Deloitte & Touche LLP",486,"Deloitte srl",1208,Montreal,A8,QUEBEC,Canada,40-F,2023-03-03,,"BCE INC",718940,"=""BCE""","1 CARREFOUR ALEXANDER-GRAHAM-BELL","BUREAU 4100",MONTREAL,A8,QUEBEC,Canada,,,"=""4813""","Telephone Communications, Except Radiotelephone",517310,"Telecommunications Resellers",34,44,12/29/22,"40,105,914,368",12/31/22,"17,841,000,000","2,159,000,000","-3,625,000,000","51,167,000,000"
27032,"Other investments","Fair Value of Level 3 Investments — Refer to Notes 2 and 4 to the financial statements",504132,12/31/22,03/09/23,3,"Deloitte & Touche LLP",,,,"New York",NY,"NEW YORK","US Mid Atlantic",10-K,2023-03-09,,"BCP Investment Corp",1372807,"=""BCIC""","650 MADISON AVENUE","3RD FLOOR","NEW YORK",NY,"NEW YORK","US Mid Atlantic",,,,,525990,"Other Financial Vehicles",34,23,12/31/22,"220,375,328",12/31/22,"51,913,000","-20,996,000",,"619,486,000"
27552,"Long-lived assets","Goodwill and Long-lived Assets Impairment",505295,12/31/22,03/16/23,2,"Ernst & Young LLP",,,,"Los Angeles",CA,CALIFORNIA,"US West",10-K,2023-03-16,,"Beachbody Company, Inc.",1826889,"=""BODI""","400 CONTINENTAL BLVD","SUITE 400","EL SEGUNDO",CA,CALIFORNIA,"US West",,,"=""5960""","Retail-Nonstore Retailers",454111,"Electronic Shopping",34,1,12/29/22,"89,472,336",12/31/22,"692,199,000","-194,192,000","78,172,000","443,395,000"
32209,"Long-lived assets","Goodwill and Long-lived Assets Impairment",523381,12/31/22,03/16/23,2,"Ernst & Young LLP",,,,"Los Angeles",CA,CALIFORNIA,"US West",S-1,2024-01-24,,"Beachbody Company, Inc.",1826889,"=""BODI""","400 CONTINENTAL BLVD","SUITE 400","EL SEGUNDO",CA,CALIFORNIA,"US West",,,"=""5960""","Retail-Nonstore Retailers",454111,"Electronic Shopping",34,1,12/29/22,"89,472,336",12/31/22,"692,199,000","-194,192,000","78,172,000","443,395,000"
25908,"Revenue from customer contracts","License and Collaboration Revenue – Pfizer Agreement – Refer to Notes 2 and 11 to the financial statements",502032,12/31/22,02/28/23,3,"Deloitte & Touche LLP",,,,Boston,MA,MASSACHUSETTS,"US New England",10-K,2023-02-28,,"Beam Therapeutics Inc.",1745999,"=""BEAM""","26 LANDSDOWNE STREET",,CAMBRIDGE,MA,MASSACHUSETTS,"US New England",,,"=""2836""","Biological Products, Except Diagnostic Substances",325414,"Biological Product (except Diagnostic) Manufacturing",34,39,12/31/22,"2,787,656,704",12/31/22,"60,920,000","-289,088,000",,"1,341,714,000"
25909,"Equity investments and joint ventures","Equity Method Investment – Orbital Agreement – Refer to Notes 2, 8, and 11 to the financial statements",502032,12/31/22,02/28/23,3,"Deloitte & Touche LLP",,,,Boston,MA,MASSACHUSETTS,"US New England",10-K,2023-02-28,,"Beam Therapeutics Inc.",1745999,"=""BEAM""","26 LANDSDOWNE STREET",,CAMBRIDGE,MA,MASSACHUSETTS,"US New England",,,"=""2836""","Biological Products, Except Diagnostic Substances",325414,"Biological Product (except Diagnostic) Manufacturing",34,39,12/31/22,"2,787,656,704",12/31/22,"60,920,000","-289,088,000",,"1,341,714,000"
26315,"Allowance for credit losses","Accounts Receivable: Allowance for Estimated Credit Losses — Refer to Note 2 to the financial statements",502547,12/31/22,03/01/23,3,"Deloitte & Touche LLP",,,,"Los Angeles",CA,CALIFORNIA,"US West",10-K,2023-03-01,,"Beauty Health Co",1818093,"=""SKIN""","2165 SPRING STREET",,"LONG BEACH",CA,CALIFORNIA,"US West",,,"=""3841""","Surgical and Medical Instruments and Apparatus",325620,"Toilet Preparation Manufacturing",34,9,12/31/22,"1,203,153,664",12/31/22,"365,876,000","44,224,000","497,000","1,008,907,000"
26316,"Equity investments and joint ventures","Common Stock Repurchases: Accelerated Share Repurchases — Refer to Note 17 to the financial statements",502547,12/31/22,03/01/23,3,"Deloitte & Touche LLP",,,,"Los Angeles",CA,CALIFORNIA,"US West",10-K,2023-03-01,,"Beauty Health Co",1818093,"=""SKIN""","2165 SPRING STREET",,"LONG BEACH",CA,CALIFORNIA,"US West",,,"=""3841""","Surgical and Medical Instruments and Apparatus",325620,"Toilet Preparation Manufacturing",34,9,12/31/22,"1,203,153,664",12/31/22,"365,876,000","44,224,000","497,000","1,008,907,000"
22841,Inventory,"Owned Inventory—Valuation of Projects in Progress—Refer to Notes 2 and 5 to the financial statements.",494460,09/30/22,11/10/22,3,"Deloitte & Touche LLP",,,,Atlanta,GA,GEORGIA,"US Southeast",10-K,2022-11-10,,"BEAZER HOMES USA INC",915840,"=""BZH""","2002 SUMMIT BLVD NE","15TH FLOOR",ATLANTA,GA,GEORGIA,"US Southeast",,,"=""1531""","Operative Builders",236117,"New Housing Operative Builders",34,10,09/30/22,"298,610,944",09/30/22,"2,316,988,000","220,704,000","927,910,000","2,251,963,000"
22978,"Other contingent liabilities","Estimation of Product Liability Reserves",494817,09/30/22,11/22/22,2,"Ernst & Young LLP",,,,"New York",NY,"NEW YORK","US Mid Atlantic",10-K,2022-11-22,,"BECTON DICKINSON & CO",10795,"=""BDX""","ONE BECTON DR",,"FRANKLIN LAKES",NJ,"NEW JERSEY","US Mid Atlantic",,,"=""3841""","Surgical and Medical Instruments and Apparatus",334516,"Analytical Laboratory Instrument Manufacturing",34,223,09/30/22,"63,140,376,576",09/30/22,"18,870,000,000","1,780,000,000","-11,650,000,000","52,932,000,000"
22979,"Uncertain tax positions","Income taxes - Uncertain tax positions
",494817,09/30/22,11/22/22,2,"Ernst & Young LLP",,,,"New York",NY,"NEW YORK","US Mid Atlantic",10-K,2022-11-22,,"BECTON DICKINSON & CO",10795,"=""BDX""","ONE BECTON DR",,"FRANKLIN LAKES",NJ,"NEW JERSEY","US Mid Atlantic",,,"=""3841""","Surgical and Medical Instruments and Apparatus",334516,"Analytical Laboratory Instrument Manufacturing",34,223,09/30/22,"63,140,376,576",09/30/22,"18,870,000,000","1,780,000,000","-11,650,000,000","52,932,000,000"
25495,"Equity investments and joint ventures","Valuation of certain equity method securities",501013,12/31/22,02/24/23,4,"KPMG LLP",,,,"Salt Lake City",UT,UTAH,"US West",10-K,2023-02-24,,"BED BATH & BEYOND, INC.",1130713,"=""BBBY""","433 W. ASCENSION WAY, 3RD FLOOR",,MURRAY,UT,UTAH,"US West",,,"=""5961""","Catalog and Mail-Order Houses",454111,"Electronic Shopping",34,19,12/29/22,"882,777,344",12/31/22,"1,929,334,000","-35,236,000","639,666,000","878,546,000"
25376,"Revenue from customer contracts","Revenue recognition - estimating variable consideration",501308,12/31/22,02/24/23,2,"Ernst & Young LLP",,,,"Saint Louis",MO,MISSOURI,"US Southeast",10-K,2023-02-24,,"BELDEN INC.",913142,"=""BDC""","1 NORTH BRENTWOOD BLVD","15TH FLOOR","ST. LOUIS",MO,MISSOURI,"US Southeast",,,"=""3357""","Drawing and Insulating of Nonferrous Wire",334290,"Other Communications Equipment Manufacturing",34,72,12/31/22,"3,079,692,800",12/31/22,"2,606,485,000","254,663,000","33,928,000","3,161,675,000"
28658,"Other debt","Warrant liability valuation of Bellicum Pharmaceuticals",507515,12/31/22,03/31/23,2,"Ernst & Young LLP",,,,Houston,TX,TEXAS,"US Southwest",10-K,2023-03-31,Yes,"BELLICUM PHARMACEUTICALS, INC",1358403,,"3730 KIRBY DRIVE","SUITE 1200",HOUSTON,TX,TEXAS,"US Southwest",,,"=""2834""","Pharmaceutical Preparations",325412,"Pharmaceutical Preparation Manufacturing",34,1,12/31/22,"6,202,584",12/31/22,"1,500,000","-24,973,000",,"23,823,000"
22912,"Sales return and allowances","Receivables, net- Allowance for Trade Promotions",494655,09/30/22,11/17/22,1,"PricewaterhouseCoopers LLP",,,,"Saint Louis",MO,MISSOURI,"US Southeast",10-K,2022-11-17,,"BELLRING BRANDS, INC.",1772016,"=""BRBR""","1 N. BRENTWOOD BOULEVARD, SUITE 1550",,CLAYTON,MO,MISSOURI,"US Southeast",,,"=""2000""","Food and Kindred Products",446191,"Food (Health) Supplement Stores",34,21,09/30/22,"2,788,441,856",09/30/22,"1,371,500,000","82,300,000","-645,400,000","707,200,000"
27874,"Research and development expenses","Evaluation of accrued or prepaid expenses for research and development",505915,12/31/22,03/23/23,4,"KPMG LLP",187,"KPMG LLP Chartered Accountants",85,Montreal,A8,QUEBEC,Canada,40-F,2023-03-23,,"BELLUS Health Inc.",1259942,,"275 ARMAND-FRAPPIER BLVD.",,LAVAL,A8,QUEBEC,Canada,,,"=""2834""","Pharmaceutical Preparations",325412,"Pharmaceutical Preparation Manufacturing",34,8,12/29/22,"651,766,848",12/31/22,"16,000","-76,080,000",,"407,820,000"
28170,"Research and development expenses","Evaluation of accrued or prepaid expenses for research and development",506603,12/31/22,03/23/23,4,"KPMG LLP",187,"KPMG LLP Chartered Accountants",85,Montreal,A8,QUEBEC,Canada,6-K,2023-03-29,,"BELLUS Health Inc.",1259942,,"275 ARMAND-FRAPPIER BLVD.",,LAVAL,A8,QUEBEC,Canada,,,"=""2834""","Pharmaceutical Preparations",325412,"Pharmaceutical Preparation Manufacturing",34,8,12/29/22,"651,766,848",12/31/22,"16,000","-76,080,000",,"407,820,000"
25614,"Other income taxes","Evaluation of income tax expense",501188,12/31/22,02/24/23,4,"KPMG LLP",,,,Phoenix,AZ,ARIZONA,"US Southwest",10-K,2023-02-24,,"BENCHMARK ELECTRONICS INC",863436,"=""BHE""","56 SOUTH ROCKFORD DRIVE",,TEMPE,AZ,ARIZONA,"US Southwest",,,"=""3672""","Printed Circuit Boards",334418,"Printed Circuit Assembly (Electronic Assembly) Manufacturing",34,27,12/31/22,"938,527,168",12/31/22,"2,886,331,000","68,229,000","834,300,000","2,227,331,000"
26200,"Business combinations","Evaluation of the fair value of certain customer relationships acquired in a business combination",501787,12/31/22,02/28/23,4,"KPMG LLP",,,,Philadelphia,PA,PENNSYLVANIA,"US Mid Atlantic",10-K,2023-02-28,,"BENTLEY SYSTEMS INC",1031308,"=""BSY""","685 STOCKTON DRIVE",,EXTON,PA,PENNSYLVANIA,"US Mid Atlantic",,,"=""7372""","Prepackaged Software",541511,"Custom Computer Programming Services",34,37,12/31/22,"10,253,174,784",12/31/22,"1,099,082,000","174,780,000","-1,956,705,000","3,165,005,000"
26201,"Revenue from customer contracts","Evaluation of the standalone selling price for certain term license subscriptions and portfolio balancing material rights",501787,12/31/22,02/28/23,4,"KPMG LLP",,,,Philadelphia,PA,PENNSYLVANIA,"US Mid Atlantic",10-K,2023-02-28,,"BENTLEY SYSTEMS INC",1031308,"=""BSY""","685 STOCKTON DRIVE",,EXTON,PA,PENNSYLVANIA,"US Mid Atlantic",,,"=""7372""","Prepackaged Software",541511,"Custom Computer Programming Services",34,37,12/31/22,"10,253,174,784",12/31/22,"1,099,082,000","174,780,000","-1,956,705,000","3,165,005,000"
25762,"Research and development expenses","Accrued Clinical Trial Expenses",501402,12/31/22,02/27/23,2,"Ernst & Young LLP",,,,Boston,MA,MASSACHUSETTS,"US New England",10-K,2023-02-27,,"BeOne Medicines Ltd.",1651308,"=""ONC""","C/O BEONE MEDICINES I GMBH","AESCHENGRABEN 27, 21ST FLOOR",BASEL,V8,SWITZERLAND,Foreign,,,"=""2834""","Pharmaceutical Preparations",325412,"Pharmaceutical Preparation Manufacturing",34,224,12/29/22,"16,291,570,688",12/31/22,"1,415,921,000","-2,003,815,000","4,342,739,000","6,379,290,000"
25603,"Allowance for credit losses","Reserves for losses and loss expenses",500909,12/31/22,02/24/23,4,"KPMG LLP",,,,"New York",NY,"NEW YORK","US Mid Atlantic",10-K,2023-02-24,,"BERKLEY W R CORP",11544,"=""WRB""","475 STEAMBOAT ROAD",.,GREENWICH,CT,CONNECTICUT,"US New England",,,"=""6331""","Fire, Marine, and Casualty Insurance",524113,"Direct Life Insurance Carriers",34,73,12/31/22,"19,198,109,696",12/31/22,"11,166,499,000","1,381,062,000","6,562,823,000","33,861,099,000"
25759,"Regulatory assets and liabilities","Regulatory Matters — Effects of Rate Regulation on the Financial Statements — Refer to Notes 2 and 7 to the financial statements",501455,12/31/22,02/24/23,3,"Deloitte & Touche LLP",,,,"Des Moines",IA,IOWA,"US Midwest",10-K,2023-02-27,,"BERKSHIRE HATHAWAY ENERGY CO",1081316,,"1615 LOCUST STREET",,"DES MOINES",IA,IOWA,"US Midwest",1067983,"BERKSHIRE HATHAWAY INC","=""4900""","Electric, Gas & Sanitary Services",221122,"Electric Power Distribution",34,,,,12/31/22,"26,337,000,000","2,721,000,000","35,343,000,000","133,840,000,000"
25760,"Other contingent liabilities","Wildfires — Contingencies — See Note 16 to the financial statements",501455,12/31/22,02/24/23,3,"Deloitte & Touche LLP",,,,"Des Moines",IA,IOWA,"US Midwest",10-K,2023-02-27,,"BERKSHIRE HATHAWAY ENERGY CO",1081316,,"1615 LOCUST STREET",,"DES MOINES",IA,IOWA,"US Midwest",1067983,"BERKSHIRE HATHAWAY INC","=""4900""","Electric, Gas & Sanitary Services",221122,"Electric Power Distribution",34,,,,12/31/22,"26,337,000,000","2,721,000,000","35,343,000,000","133,840,000,000"
25753,"Insurance contract liabilities","Unpaid Losses and Loss Adjustment Expenses— Refer to Notes 1 and 16 to the financial statements",501413,12/31/22,02/25/23,3,"Deloitte & Touche LLP",,,,Omaha,NE,NEBRASKA,"US Midwest",10-K,2023-02-27,,"BERKSHIRE HATHAWAY INC",1067983,"=""BRK.A""","3555 FARNAM STREET",,OMAHA,NE,NEBRASKA,"US Midwest",,,"=""6331""","Fire, Marine, and Casualty Insurance",524130,"Reinsurance Carriers",34,"468,711",12/31/22,"277,272,526,848",12/31/22,"234,121,000,000","-22,759,000,000","365,054,000,000","948,452,000,000"
25754,"Insurance contract liabilities","Unpaid Losses and Loss Adjustment Expenses Under Retroactive Reinsurance Contracts — Refer to Notes 1 and 17 to the financial statements",501413,12/31/22,02/25/23,3,"Deloitte & Touche LLP",,,,Omaha,NE,NEBRASKA,"US Midwest",10-K,2023-02-27,,"BERKSHIRE HATHAWAY INC",1067983,"=""BRK.A""","3555 FARNAM STREET",,OMAHA,NE,NEBRASKA,"US Midwest",,,"=""6331""","Fire, Marine, and Casualty Insurance",524130,"Reinsurance Carriers",34,"468,711",12/31/22,"277,272,526,848",12/31/22,"234,121,000,000","-22,759,000,000","365,054,000,000","948,452,000,000"
25755,"Goodwill and intangible assets","Goodwill and Indefinite-Lived Intangible Assets — Refer to Notes 1 and 13 to the financial statements",501413,12/31/22,02/25/23,3,"Deloitte & Touche LLP",,,,Omaha,NE,NEBRASKA,"US Midwest",10-K,2023-02-27,,"BERKSHIRE HATHAWAY INC",1067983,"=""BRK.A""","3555 FARNAM STREET",,OMAHA,NE,NEBRASKA,"US Midwest",,,"=""6331""","Fire, Marine, and Casualty Insurance",524130,"Reinsurance Carriers",34,"468,711",12/31/22,"277,272,526,848",12/31/22,"234,121,000,000","-22,759,000,000","365,054,000,000","948,452,000,000"
22929,"Pension and other post-employment benefits","United Kingdom Defined Benefit Pension Obligation",494683,10/01/22,11/18/22,2,"Ernst & Young LLP",,,,Indianapolis,IN,INDIANA,"US Midwest",10-K,2022-11-18,,"BERRY GLOBAL GROUP, INC.",1378992,"=""BERY""","101 OAKLEY STREET","PO BOX 959",EVANSVILLE,IN,INDIANA,"US Midwest",,,"=""3089""","Plastics Products, NEC",326199,"All Other Plastics Product Manufacturing",34,60,12/31/22,"7,354,331,136",10/01/22,"14,495,000,000","766,000,000","-3,489,000,000","16,956,000,000"
18882,"Vendor/supplier rebates","Vendor Allowances — Refer to Note 1 to the financial statements",480085,01/29/22,03/18/22,3,"Deloitte & Touche LLP",,,,Minneapolis,MN,MINNESOTA,"US Midwest",10-K,2022-03-18,,"BEST BUY CO INC",764478,"=""BBY""","7601 PENN AVE SOUTH",,RICHFIELD,MN,MINNESOTA,"US Midwest",,,"=""5731""","Radio, Television, and Consumer Electronics Stores",443112,"Radio, Television, and Other Electronics Stores",34,99,01/31/22,"22,576,271,360",01/29/22,"51,761,000,000","2,454,000,000","1,636,000,000","17,504,000,000"
18883,Goodwill,"Goodwill – Best Buy Health Reporting Unit — Refer to Note 1 to the financial statements",480085,01/29/22,03/18/22,3,"Deloitte & Touche LLP",,,,Minneapolis,MN,MINNESOTA,"US Midwest",10-K,2022-03-18,,"BEST BUY CO INC",764478,"=""BBY""","7601 PENN AVE SOUTH",,RICHFIELD,MN,MINNESOTA,"US Midwest",,,"=""5731""","Radio, Television, and Consumer Electronics Stores",443112,"Radio, Television, and Other Electronics Stores",34,99,01/31/22,"22,576,271,360",01/29/22,"51,761,000,000","2,454,000,000","1,636,000,000","17,504,000,000"
29340,"Long-lived assets","Impairment assessment of long-lived assets




",509564,12/31/22,04/21/23,2,"Ernst & Young LLP",211,"Ernst & Young Hua Ming LLP",1408,Shanghai,F4,CHINA,Foreign,20-F,2023-04-21,Yes,"BEST Inc.",1709505,,"2/F, BLOCK A, HUAXING MODERN INDUSTRY","PARK, NO.18 TANGMIAO ROAD, XIHU DISTRICT","HANGZHOU, ZHEJIANG PROVINCE",F4,CHINA,Foreign,,,"=""4210""","Trucking & Courier Services (No Air)",541614,"Process, Physical Distribution, and Logistics Consulting Services",34,1,12/29/22,"29,138,812",12/31/22,"1,113,982,000","-210,497,000","109,208,000","1,120,624,000"
29341,"Going concern","Going concern",509564,12/31/22,04/21/23,2,"Ernst & Young LLP",211,"Ernst & Young Hua Ming LLP",1408,Shanghai,F4,CHINA,Foreign,20-F,2023-04-21,Yes,"BEST Inc.",1709505,,"2/F, BLOCK A, HUAXING MODERN INDUSTRY","PARK, NO.18 TANGMIAO ROAD, XIHU DISTRICT","HANGZHOU, ZHEJIANG PROVINCE",F4,CHINA,Foreign,,,"=""4210""","Trucking & Courier Services (No Air)",541614,"Process, Physical Distribution, and Logistics Consulting Services",34,1,12/29/22,"29,138,812",12/31/22,"1,113,982,000","-210,497,000","109,208,000","1,120,624,000"
29904,"Allowance for credit losses","Accounts Receivable Allowance for Credit Losses ",512001,12/31/22,05/15/23,1,"PricewaterhouseCoopers LLP",107,"PricewaterhouseCoopers SC",1128,Guadalajara,O5,MEXICO,Foreign,20-F,2023-05-15,,"BETTERWARE DE MEXICO, S.A.P.I. DE C.V",1788257,"=""BWMX""","CRUCE CARRETERA GDL AMECA HUAXTLA KM5",,"EL ARENAL",O5,MEXICO,Foreign,,,"=""5961""","Catalog and Mail-Order Houses",423220,"Home Furnishing Merchant Wholesalers",34,6,12/29/22,"239,572,224",12/31/22,"590,517,000","44,643,000","-115,332,000","581,546,000"
29905,"Goodwill and intangible assets","Goodwill and Indefinite-lived Intangible Assets Impairment Assessment ",512001,12/31/22,05/15/23,1,"PricewaterhouseCoopers LLP",107,"PricewaterhouseCoopers SC",1128,Guadalajara,O5,MEXICO,Foreign,20-F,2023-05-15,,"BETTERWARE DE MEXICO, S.A.P.I. DE C.V",1788257,"=""BWMX""","CRUCE CARRETERA GDL AMECA HUAXTLA KM5",,"EL ARENAL",O5,MEXICO,Foreign,,,"=""5961""","Catalog and Mail-Order Houses",423220,"Home Furnishing Merchant Wholesalers",34,6,12/29/22,"239,572,224",12/31/22,"590,517,000","44,643,000","-115,332,000","581,546,000"
29906,"Business combinations","JAFRA´s Business Acquisition",512001,12/31/22,05/15/23,1,"PricewaterhouseCoopers LLP",107,"PricewaterhouseCoopers SC",1128,Guadalajara,O5,MEXICO,Foreign,20-F,2023-05-15,,"BETTERWARE DE MEXICO, S.A.P.I. DE C.V",1788257,"=""BWMX""","CRUCE CARRETERA GDL AMECA HUAXTLA KM5",,"EL ARENAL",O5,MEXICO,Foreign,,,"=""5961""","Catalog and Mail-Order Houses",423220,"Home Furnishing Merchant Wholesalers",34,6,12/29/22,"239,572,224",12/31/22,"590,517,000","44,643,000","-115,332,000","581,546,000"
26267,Inventory,"Inventory — Provision for Excess and Obsolete Inventory — Refer to Notes 2 and 5 to the financial statements",502448,12/31/22,03/01/23,3,"Deloitte & Touche LLP",,,,"Los Angeles",CA,CALIFORNIA,"US West",10-K,2023-03-01,,"BEYOND MEAT, INC.",1655210,"=""BYND""","888 N. DOUGLAS STREET, SUITE 100",,"EL SEGUNDO",CA,CALIFORNIA,"US West",,,"=""2000""","Food and Kindred Products",311991,"Perishable Prepared Food Manufacturing",34,12,12/31/22,"785,057,728",12/31/22,"418,933,000","-366,137,000",,"1,062,224,000"
29243,"Going concern","Going Concern",509278,12/31/22,04/18/23,2,"Ernst & Young LLP",211,"Ernst & Young Hua Ming LLP",1408,Beijing,F4,CHINA,Foreign,20-F,2023-04-18,Yes,"BeyondSpring Inc.",1677940,"=""BYSI""","100 CAMPUS DRIVE, WEST SIDE, 4TH FLOOR","SUITE 410","FLORHAM PARK",NJ,"NEW JERSEY","US Mid Atlantic",,,"=""2834""","Pharmaceutical Preparations",325412,"Pharmaceutical Preparation Manufacturing",34,2,12/29/22,"69,680,336",12/31/22,"1,351,000","-33,279,000",,"46,222,000"
26522,"Other income taxes","Accounting for Income Taxes",502347,12/31/22,03/01/23,2,"Ernst & Young LLP",,,,"New York",NY,"NEW YORK","US Mid Atlantic",10-K,2023-03-01,,"BGC Group, Inc.",1094831,"=""BGC""","499 PARK AVENUE",,"NEW YORK",NY,"NEW YORK","US Mid Atlantic",,,"=""6200""","Security & Commodity Brokers, Dealers, Exchanges & Services",523120,"Securities Brokerage",34,4,12/29/22,"1,241,084,928",12/31/22,"1,737,370,000","48,712,000","5,796,000","3,074,971,000"
22276,"Property, plant and equipment","Carrying value of property, plant and equipment",491573,06/30/22,09/06/22,2,"Ernst & Young LLP",32,"Ernst & Young",1435,Melbourne,C3,AUSTRALIA,Foreign,20-F,2022-09-06,,"BHP Group Ltd",811809,"=""BHP""","LEVEL 27","180 LONSDALE STREET",MELBOURNE,C3,AUSTRALIA,Foreign,,,"=""1000""","Metal mining",212210,"Iron Ore Mining",34,56,06/30/22,"142,141,603,840",06/30/22,"65,098,000,000","30,900,000,000","43,588,000,000","95,166,000,000"
22277,"Asset retirement and environmental obligations","Closure and rehabilitation provisions",491573,06/30/22,09/06/22,2,"Ernst & Young LLP",32,"Ernst & Young",1435,Melbourne,C3,AUSTRALIA,Foreign,20-F,2022-09-06,,"BHP Group Ltd",811809,"=""BHP""","LEVEL 27","180 LONSDALE STREET",MELBOURNE,C3,AUSTRALIA,Foreign,,,"=""1000""","Metal mining",212210,"Iron Ore Mining",34,56,06/30/22,"142,141,603,840",06/30/22,"65,098,000,000","30,900,000,000","43,588,000,000","95,166,000,000"
22278,"Other contingent liabilities","Samarco dam failure provisions recognised, including the Germano dam decommissioning and contingent liabilities disclosed",491573,06/30/22,09/06/22,2,"Ernst & Young LLP",32,"Ernst & Young",1435,Melbourne,C3,AUSTRALIA,Foreign,20-F,2022-09-06,,"BHP Group Ltd",811809,"=""BHP""","LEVEL 27","180 LONSDALE STREET",MELBOURNE,C3,AUSTRALIA,Foreign,,,"=""1000""","Metal mining",212210,"Iron Ore Mining",34,56,06/30/22,"142,141,603,840",06/30/22,"65,098,000,000","30,900,000,000","43,588,000,000","95,166,000,000"
25905,"Revenue from customer contracts","Revenue recognition - Accounting treatment for the exercise of an Expansion Option under the Genentech Collaboration Agreement",502042,12/31/22,02/28/23,1,"PricewaterhouseCoopers LLP",121,"PricewaterhouseCoopers LLP",876,Cambridge,X0,"UNITED KINGDOM",Foreign,10-K,2023-02-28,,"BICYCLE THERAPEUTICS PLC",1761612,"=""BCYC""","BLOCKS A & B, PORTWAY BUILDING","GRANTA PARK, GREAT ABINGTON",CAMBRIDGE,X0,"UNITED KINGDOM",Foreign,,,"=""2834""","Pharmaceutical Preparations",325412,"Pharmaceutical Preparation Manufacturing",34,30,12/31/22,"884,267,264",12/31/22,"14,463,000","-112,717,000",,"410,609,000"
26413,Inventory,"Inventory - Valuation of Merchandise Inventories, Net - Refer to Note 2 to the financial statements",502361,01/01/23,03/01/23,3,"Deloitte & Touche LLP",,,,"Los Angeles",CA,CALIFORNIA,"US West",10-K,2023-03-01,,"BIG 5 SPORTING GOODS Corp",1156388,"=""BGFV""","2525 EAST EL SEGUNDO BOULEVARD",,"EL SEGUNDO",CA,CALIFORNIA,"US West",,,"=""5940""","Retail-Miscellaneous Shopping Goods Stores",451110,"Sporting Goods Stores",34,9,01/03/23,"198,993,440",01/01/23,"995,538,000","26,134,000",,"708,793,000"
25765,"Property, plant and equipment","Property and Equipment — Refer to Notes 1 and 6 to the financial statements",501410,12/31/22,02/25/23,3,"Deloitte & Touche LLP",,,,Austin,TX,TEXAS,"US Southwest",10-K,2023-02-27,,"Biglari Holdings Inc.",1726173,"=""BH""","19100 RIDGEWOOD PKWY, SUITE 1200",,"SAN ANTONIO",TX,TEXAS,"US Southwest",,,"=""5812""","Eating and Drinking Places",722110,"Full-Service Restaurants",34,139,12/31/22,"287,127,232",12/31/22,"368,231,000","-76,260,381","470,416,000","828,474,000"
29524,"Revenue from customer contracts","Revenue recognition for in-game virtual items",510167,12/31/22,04/27/23,1,"PricewaterhouseCoopers LLP",94,"PricewaterhouseCoopers Zhong Tian LLP",1424,Beijing,F4,CHINA,Foreign,20-F,2023-04-27,,"Bilibili Inc.",1723690,"=""BILI""","17TH FLOOR, BUILDING 3, GUOZHENG CENTER","NO. 485 ZHENGLI ROAD, YANGPU DISTRICT",SHANGHAI,F4,CHINA,Foreign,,,"=""7374""","Computer Processing and Data Preparation and Processing Services",516110,"Internet Publishing and Broadcasting",34,24,12/29/22,"7,454,345,216",12/31/22,"3,150,189,000","-1,078,443,000","1,177,540,000","6,017,315,000"
22131,"Other liabilities and provisions","Funds Held for Customers and Customer Fund Deposits",491014,06/30/22,08/22/22,2,"Ernst & Young LLP",,,,"San Francisco",CA,CALIFORNIA,"US West",10-K,2022-08-22,,"BILL Holdings, Inc.",1786352,"=""BILL""","6220 AMERICA CENTER DR.","SUITE 100","SAN JOSE",CA,CALIFORNIA,"US West",,,"=""7372""","Prepackaged Software",511210,"Software Publishers",34,110,06/30/22,"11,514,126,336",06/30/22,"641,959,000","-326,361,000","1,248,218,000","9,256,026,000"
22132,"Business combinations","Valuation of an Acquired Customer Relationships Intangible Asset",491014,06/30/22,08/22/22,2,"Ernst & Young LLP",,,,"San Francisco",CA,CALIFORNIA,"US West",10-K,2022-08-22,,"BILL Holdings, Inc.",1786352,"=""BILL""","6220 AMERICA CENTER DR.","SUITE 100","SAN JOSE",CA,CALIFORNIA,"US West",,,"=""7372""","Prepackaged Software",511210,"Software Publishers",34,110,06/30/22,"11,514,126,336",06/30/22,"641,959,000","-326,361,000","1,248,218,000","9,256,026,000"
30176,"Other liabilities and provisions","Funds Held for Customers and Customer Fund Deposits",512642,06/30/22,08/22/22,2,"Ernst & Young LLP",,,,"San Mateo",CA,CALIFORNIA,"US West",10-K/A,2023-05-26,,"BILL Holdings, Inc.",1786352,"=""BILL""","6220 AMERICA CENTER DR.","SUITE 100","SAN JOSE",CA,CALIFORNIA,"US West",,,"=""7372""","Prepackaged Software",511210,"Software Publishers",34,110,06/30/22,"11,514,126,336",06/30/22,"641,959,000","-326,361,000","1,248,218,000","9,256,026,000"
30177,"Business combinations","Valuation of an Acquired Customer Relationships Intangible Asset",512642,06/30/22,08/22/22,2,"Ernst & Young LLP",,,,"San Mateo",CA,CALIFORNIA,"US West",10-K/A,2023-05-26,,"BILL Holdings, Inc.",1786352,"=""BILL""","6220 AMERICA CENTER DR.","SUITE 100","SAN JOSE",CA,CALIFORNIA,"US West",,,"=""7372""","Prepackaged Software",511210,"Software Publishers",34,110,06/30/22,"11,514,126,336",06/30/22,"641,959,000","-326,361,000","1,248,218,000","9,256,026,000"
28256,"Research and development expenses","Prepaid or Accrued Research and Development Expenses",506901,12/31/22,03/30/23,2,"Ernst & Young LLP",,,,Houston,TX,TEXAS,"US Southwest",10-K,2023-03-30,Yes,"BIO-PATH HOLDINGS, INC.",1133818,"=""BPTH""","4710 BELLAIRE BOULEVARD","SUITE 210",BELLAIRE,TX,TEXAS,"US Southwest",,,"=""2834""","Pharmaceutical Preparations",541710,"Research and Development in the Physical, Engineering, and Life Sciences",34,2,12/31/22,"12,019,600",12/31/22,,"-13,868,000",,"15,971,000"
24359,Leases,"Assessment of Lease Term for Reagent Rental Arrangements",499908,12/31/22,02/17/23,4,"KPMG LLP",,,,"Santa Clara",CA,CALIFORNIA,"US West",10-K,2023-02-17,,"BIO-RAD LABORATORIES, INC.",12208,"=""BIO""","1000 ALFRED NOBEL DRIVE",,HERCULES,CA,CALIFORNIA,"US West",,,"=""3826""","Laboratory Analytical Instruments",334516,"Analytical Laboratory Instrument Manufacturing",34,420,12/31/22,"10,311,079,936",12/31/22,"2,802,200,000","-3,627,500,000","8,876,617,000","13,501,666,000"
22149,Goodwill,"Goodwill impairment analysis for the Molecular Diagnostics Division reporting unit",491086,06/30/22,08/24/22,4,"KPMG LLP",,,,Minneapolis,MN,MINNESOTA,"US Midwest",10-K,2022-08-24,,"BIO-TECHNE Corp",842023,"=""TECH""","614 MCKINLEY PL N E","SUITE 1500",MINNEAPOLIS,MN,MINNESOTA,"US Midwest",,,"=""2836""","Biological Products, Except Diagnostic Substances",325413,"In-Vitro Diagnostic Substance Manufacturing",34,347,06/30/22,"13,574,422,528",06/30/22,"1,105,599,000","272,051,000","353,147,000","2,294,805,000"
27904,"Research and development expenses","Accrual of Clinical Trial Expenses",505924,12/31/22,03/23/23,2,"Ernst & Young LLP",,,,"San Diego",CA,CALIFORNIA,"US West",10-K,2023-03-23,,"BioAtla, Inc.",1826892,"=""BCAB""","11085 TORREYANA ROAD",,"SAN DIEGO",CA,CALIFORNIA,"US West",,,"=""2836""","Biological Products, Except Diagnostic Substances",325414,"Biological Product (except Diagnostic) Manufacturing",34,8,12/31/22,"382,273,376",12/31/22,,"-106,482,000",,"225,736,000"
25779,"Research and development expenses","Accrued Clinical Trial and Manufacturing Activities",501678,12/31/22,02/27/23,2,"Ernst & Young LLP",,,,Raleigh,NC,"NORTH CAROLINA","US Southeast",10-K,2023-02-27,,"BIOCRYST PHARMACEUTICALS INC",882796,"=""BCRX""","4505 EMPEROR BOULEVARD","SUITE 200",DURHAM,NC,"NORTH CAROLINA","US Southeast",,,"=""2836""","Biological Products, Except Diagnostic Substances",325414,"Biological Product (except Diagnostic) Manufacturing",34,11,12/31/22,"2,157,160,960",12/31/22,"270,827,000","-247,116,000",,"550,000,000"
25780,"Revenue from customer contracts","Royalty Financing Obligations",501678,12/31/22,02/27/23,2,"Ernst & Young LLP",,,,Raleigh,NC,"NORTH CAROLINA","US Southeast",10-K,2023-02-27,,"BIOCRYST PHARMACEUTICALS INC",882796,"=""BCRX""","4505 EMPEROR BOULEVARD","SUITE 200",DURHAM,NC,"NORTH CAROLINA","US Southeast",,,"=""2836""","Biological Products, Except Diagnostic Substances",325414,"Biological Product (except Diagnostic) Manufacturing",34,11,12/31/22,"2,157,160,960",12/31/22,"270,827,000","-247,116,000",,"550,000,000"
25781,"Sales return and allowances","Product Sales, net",501678,12/31/22,02/27/23,2,"Ernst & Young LLP",,,,Raleigh,NC,"NORTH CAROLINA","US Southeast",10-K,2023-02-27,,"BIOCRYST PHARMACEUTICALS INC",882796,"=""BCRX""","4505 EMPEROR BOULEVARD","SUITE 200",DURHAM,NC,"NORTH CAROLINA","US Southeast",,,"=""2836""","Biological Products, Except Diagnostic Substances",325414,"Biological Product (except Diagnostic) Manufacturing",34,11,12/31/22,"2,157,160,960",12/31/22,"270,827,000","-247,116,000",,"550,000,000"
24053,"Sales return and allowances","Reserves for Medicaid and Managed Care Rebates",499511,12/31/22,02/15/23,1,"PricewaterhouseCoopers LLP",,,,Boston,MA,MASSACHUSETTS,"US New England",10-K,2023-02-15,,"BIOGEN INC.",875045,"=""BIIB""","225 BINNEY STREET",,CAMBRIDGE,MA,MASSACHUSETTS,"US New England",,,"=""2836""","Biological Products, Except Diagnostic Substances",325414,"Biological Product (except Diagnostic) Manufacturing",34,277,12/31/22,"39,876,481,024",12/31/22,"10,173,400,000","3,046,900,000","5,798,800,000","24,554,100,000"
27826,"Other intangible assets","Intellectual Property Impairment Assessment",505772,12/31/22,03/22/23,1,"PricewaterhouseCoopers LLP",223,"Kesselman & Kesselman",1309,"Tel Aviv",L3,ISRAEL,Foreign,20-F,2023-03-22,Yes,"BioLineRx Ltd.",1498403,"=""BLRX""","2 HAMAAYAN STREET","MODI-IN TECHNOLOGY PARK",MODI-IN,L3,ISRAEL,Foreign,,,"=""2834""","Pharmaceutical Preparations",541710,"Research and Development in the Physical, Engineering, and Life Sciences",34,1,12/29/22,"27,295,120",12/31/22,,"-24,951,000","28,956,000","76,384,000"
25704,"Revenue from customer contracts","Evaluation of variable consideration relating to ALDURAZYME product sales",501540,12/31/22,02/27/23,4,"KPMG LLP",,,,"San Francisco",CA,CALIFORNIA,"US West",10-K,2023-02-27,,"BIOMARIN PHARMACEUTICAL INC",1048477,"=""BMRN""","105 DIGITAL DRIVE",,NOVATO,CA,CALIFORNIA,"US West",,,"=""2834""","Pharmaceutical Preparations",325412,"Pharmaceutical Preparation Manufacturing",34,103,12/31/22,"19,275,087,872",12/31/22,"2,096,039,000","141,561,000","4,068,388,000","6,375,074,000"
28034,"Revenue from customer contracts","Revenue recognition from collaboration partner’s COVID-19 vaccine sales",506278,12/31/22,03/27/23,2,"Ernst & Young LLP",271,"Ernst & Young GmbH Wirtschaftsprüfungsgesellschaft (Inactive)",1251,Cologne,2M,GERMANY,Foreign,20-F,2023-03-27,,"BioNTech SE",1776985,"=""BNTX""","AN DER GOLDGRUBE 12",,MAINZ,2M,GERMANY,Foreign,,,"=""2836""","Biological Products, Except Diagnostic Substances",325414,"Biological Product (except Diagnostic) Manufacturing",33,150,12/31/22,"36,535,783,424",12/31/22,"18,474,900,000","10,068,900,000","21,170,000,000","24,844,800,000"
28035,"Other contingent liabilities","Claims and legal contingencies",506278,12/31/22,03/27/23,2,"Ernst & Young LLP",271,"Ernst & Young GmbH Wirtschaftsprüfungsgesellschaft (Inactive)",1251,Cologne,2M,GERMANY,Foreign,20-F,2023-03-27,,"BioNTech SE",1776985,"=""BNTX""","AN DER GOLDGRUBE 12",,MAINZ,2M,GERMANY,Foreign,,,"=""2836""","Biological Products, Except Diagnostic Substances",325414,"Biological Product (except Diagnostic) Manufacturing",33,150,12/31/22,"36,535,783,424",12/31/22,"18,474,900,000","10,068,900,000","21,170,000,000","24,844,800,000"
21596,"Going concern","Assessment of the Company’s ability to continue as a going concern",488753,03/26/22,06/22/22,4,"KPMG LLP",187,"KPMG LLP Chartered Accountants",85,Montreal,A8,QUEBEC,Canada,20-F,2022-06-24,,"BIRKS GROUP INC.",1179821,"=""BGI""","2020 ROBERT BOURASSA","SUITE 200",MONTREAL,A8,QUEBEC,Canada,,,"=""5944""","Jewelry Stores",448310,"Jewelry Stores",34,5,03/28/22,"54,082,008",03/26/22,"181,342,000","1,287,000","-167,000","183,261,000"
21597,Inventory,"Evaluation of the reserve for slow-moving finished goods inventories",488753,03/26/22,06/22/22,4,"KPMG LLP",187,"KPMG LLP Chartered Accountants",85,Montreal,A8,QUEBEC,Canada,20-F,2022-06-24,,"BIRKS GROUP INC.",1179821,"=""BGI""","2020 ROBERT BOURASSA","SUITE 200",MONTREAL,A8,QUEBEC,Canada,,,"=""5944""","Jewelry Stores",448310,"Jewelry Stores",34,5,03/28/22,"54,082,008",03/26/22,"181,342,000","1,287,000","-167,000","183,261,000"
18744,"Other contingent liabilities","Workers’ Compensation and General Liability Reserves",479847,01/29/22,03/17/22,1,"PricewaterhouseCoopers LLP",,,,Boston,MA,MASSACHUSETTS,"US New England",10-K,2022-03-17,,"BJ's Wholesale Club Holdings, Inc.",1531152,"=""BJ""","350 CAMPUS DRIVE",,MARLBOROUGH,MA,MASSACHUSETTS,"US New England",,,"=""5331""","Variety Stores",452910,"Warehouse Clubs and Supercenters",34,61,01/31/22,"8,329,553,920",01/29/22,"16,667,302,000","426,652,000","-400,666,000","5,668,894,000"
26189,"Long-lived assets","Evaluation of long-lived assets for impairment",501734,01/03/23,02/27/23,4,"KPMG LLP",,,,"Los Angeles",CA,CALIFORNIA,"US West",10-K,2023-02-28,,"BJs RESTAURANTS INC",1013488,"=""BJRI""","7755 CENTER AVENUE","SUITE 300","HUNTINGTON BEACH",CA,CALIFORNIA,"US West",,,"=""5812""","Eating and Drinking Places",722110,"Full-Service Restaurants",34,27,01/05/23,"638,838,016",01/03/23,"1,283,926,000","4,076,000","340,842,000","1,045,922,000"
23998,"Regulatory assets and liabilities","Regulatory Accounting - Impact of Rate Regulation on the Financial Statements — Refer to Notes 1 and 2 to the Financial Statements",499352,12/31/22,02/14/23,3,"Deloitte & Touche LLP",,,,Minneapolis,MN,MINNESOTA,"US Midwest",10-K,2023-02-14,,"BLACK HILLS CORP /SD/",1130464,"=""BKH""","7001 MT RUSHMORE RD","PO BOX 1400","RAPID CITY",SD,"SOUTH DAKOTA","US Midwest",,,"=""4911""","Electric Services",221119,"Other Electric Power Generation",34,70,12/31/22,"4,649,732,096",12/31/22,"2,551,816,000","258,387,000","1,685,870,000","9,618,230,000"
25939,"Revenue from customer contracts","Assessment of revenue recognition for contracts with multiple performance obligations",501979,12/31/22,02/28/23,4,"KPMG LLP",,,,Jacksonville,FL,FLORIDA,"US Southeast",10-K,2023-02-28,,"Black Knight, Inc.",1627014,,"601 RIVERSIDE AVENUE",,JACKSONVILLE,FL,FLORIDA,"US Southeast",,,"=""7372""","Prepackaged Software",541611,"Administrative Management and General Management Consulting Services",34,62,12/31/22,"9,628,701,696",12/31/22,"1,551,900,000","452,500,000","-2,040,700,000","5,831,600,000"
24824,"Proven and unproven reserves","Depreciation, Depletion and Amortization (“DD&A”) of Oil and Natural Gas Properties",500509,12/31/22,02/22/23,2,"Ernst & Young LLP",,,,Houston,TX,TEXAS,"US Southwest",10-K,2023-02-23,,"Black Stone Minerals, L.P.",1621434,"=""BSM""","1001 FANNIN STREET, SUITE 2020",,HOUSTON,TX,TEXAS,"US Southwest",,,"=""1311""","Crude Petroleum and Natural Gas",211111,"Crude Petroleum and Natural Gas Extraction",34,17,12/31/22,"3,532,696,064",12/31/22,"663,604,000","476,480,000",,"1,271,082,000"
24825,"Revenue from customer contracts","Revenues from Contracts with Customers Accrual",500509,12/31/22,02/22/23,2,"Ernst & Young LLP",,,,Houston,TX,TEXAS,"US Southwest",10-K,2023-02-23,,"Black Stone Minerals, L.P.",1621434,"=""BSM""","1001 FANNIN STREET, SUITE 2020",,HOUSTON,TX,TEXAS,"US Southwest",,,"=""1311""","Crude Petroleum and Natural Gas",211111,"Crude Petroleum and Natural Gas Extraction",34,17,12/31/22,"3,532,696,064",12/31/22,"663,604,000","476,480,000",,"1,271,082,000"
25403,"Revenue from customer contracts","Revenue Recognition - Payment Processing Services",501026,12/31/22,02/24/23,2,"Ernst & Young LLP",,,,Raleigh,NC,"NORTH CAROLINA","US Southeast",10-K,2023-02-24,,"BLACKBAUD INC",1280058,"=""BLKB""","65 FAIRCHILD STREET",,CHARLESTON,SC,"SOUTH CAROLINA","US Southeast",,,"=""7372""","Prepackaged Software",511210,"Software Publishers",34,59,12/31/22,"3,123,630,336",12/31/22,"1,058,105,000","-45,407,000","-1,082,399,000","2,992,703,000"
19887,Goodwill,"Goodwill impairment test for the selected reporting units using the income approach",482503,02/28/22,04/01/22,1,"PricewaterhouseCoopers LLP",191,"PricewaterhouseCoopers LLP Chartered Accountants",271,Toronto,A6,ONTARIO,Canada,10-K,2022-04-01,,"BLACKBERRY Ltd",1070235,"=""BB""","2200 UNIVERSITY AVENUE EAST",*,WATERLOO,A6,ONTARIO,Canada,,,"=""7372""","Prepackaged Software",518210,"Data Processing, Hosting, and Related Services",34,7,02/28/22,"3,958,685,696",02/28/22,"718,000,000","12,000,000","190,000,000","2,567,000,000"
19888,"Revenue from customer contracts","Revenue recognition – Intellectual property licensing",482503,02/28/22,04/01/22,1,"PricewaterhouseCoopers LLP",191,"PricewaterhouseCoopers LLP Chartered Accountants",271,Toronto,A6,ONTARIO,Canada,10-K,2022-04-01,,"BLACKBERRY Ltd",1070235,"=""BB""","2200 UNIVERSITY AVENUE EAST",*,WATERLOO,A6,ONTARIO,Canada,,,"=""7372""","Prepackaged Software",518210,"Data Processing, Hosting, and Related Services",34,7,02/28/22,"3,958,685,696",02/28/22,"718,000,000","12,000,000","190,000,000","2,567,000,000"
24890,"Business combinations","Valuation of Acquired Intangible Assets and Contingent Consideration Liability – Acquisition of FourQ Systems, Inc.",500639,12/31/22,02/23/23,1,"PricewaterhouseCoopers LLP",,,,"Los Angeles",CA,CALIFORNIA,"US West",10-K,2023-02-23,,"BLACKLINE, INC.",1666134,"=""BL""","21300 VICTORY BOULEVARD","12TH FLOOR","WOODLAND HILLS",CA,CALIFORNIA,"US West",,,"=""7372""","Prepackaged Software",511210,"Software Publishers",34,67,12/31/22,"4,037,331,712",12/31/22,"522,938,000","-29,391,000","-431,032,000","1,943,656,000"
26395,"Other investments","Investment Valuation — Level 3 Investments — Refer to Note 2 to the financial statements",502386,12/31/22,03/01/23,3,"Deloitte & Touche LLP",,,,"Los Angeles",CA,CALIFORNIA,"US West",10-K,2023-03-01,,"BlackRock Capital Investment Corp",1326003,,"50 HUDSON YARDS",,"NEW YORK",NY,"NEW YORK","US Mid Atlantic",,,,,523920,"Portfolio Management",34,4,12/31/22,"262,710,304",12/31/22,"44,795,392","3,486,976",,"589,060,146"
25357,"Other intangible assets","Impairment of indefinite-lived intangible assets — Refer to Notes 2 and 12 to the financial statements",501045,12/31/22,02/24/23,3,"Deloitte & Touche LLP",,,,"New York",NY,"NEW YORK","US Mid Atlantic",10-K,2023-02-24,,"BlackRock Finance, Inc.",1364742,,"50 HUDSON YARDS",,"NEW YORK",NY,"NEW YORK","US Mid Atlantic",,,"=""6211""","Security Brokers, Dealers, and Flotation Companies",523120,"Securities Brokerage",34,716,12/29/22,"107,562,565,632",12/31/22,"17,661,000,000","5,178,000,000","5,010,000,000","117,628,000,000"
26123,"Other investments","Investment Valuation — Level 3 Investments — Refer to Note 2 to the financial statements",501756,12/31/22,02/28/23,3,"Deloitte & Touche LLP",,,,"Los Angeles",CA,CALIFORNIA,"US West",10-K,2023-02-28,,"BlackRock TCP Capital Corp.",1370755,"=""TCPC""","2951 28TH STREET","SUITE 1000","SANTA MONICA",CA,CALIFORNIA,"US West",,,,,525990,"Other Financial Vehicles",34,13,12/31/22,"747,508,416",12/31/22,"141,643,564","-9,225,331",,"1,719,349,849"
25389,"Other investments","Fair Value of Underlying Investments to determine Performance Allocations and Accrued Performance Allocations — Refer to Notes 2 and 4 to the financial statements",501048,12/31/22,02/24/23,3,"Deloitte & Touche LLP",,,,"New York",NY,"NEW YORK","US Mid Atlantic",10-K,2023-02-24,,"Blackstone Inc.",1393818,"=""BX""","345 PARK AVENUE",,"NEW YORK",NY,"NEW YORK","US Mid Atlantic",,,"=""6282""","Investment Advice",523920,"Portfolio Management",34,74,12/31/22,"52,695,445,504",12/31/22,"8,200,448,000","1,747,631,000","7,263,428,000","42,524,227,000"
23682,"Allowance for credit losses","Current Expected Credit Loss (“CECL”) Reserve – Adjustments to Reflect Management’s Estimation of Economic Conditions – Refer to Note 2 in the Financial Statements",498830,12/31/22,02/08/23,3,"Deloitte & Touche LLP",,,,"New York",NY,"NEW YORK","US Mid Atlantic",10-K,2023-02-08,,"BLACKSTONE MORTGAGE TRUST, INC.",1061630,"=""BXMT""","345 PARK AVENUE","24TH FLOOR","NEW YORK",NY,"NEW YORK","US Mid Atlantic",,,"=""6798""","Real Estate Investment Trusts",525990,"Other Financial Vehicles",34,21,12/31/22,"3,634,803,968",12/31/22,"416,545,000","248,642,000",,"25,353,985,000"
23683,"Accounts/loans receivable","CECL Reserve – Estimation of Fair Value of Underlying Collateral of Impaired Loans – Refer to Note 2 and Note 3 in the Financial Statements",498830,12/31/22,02/08/23,3,"Deloitte & Touche LLP",,,,"New York",NY,"NEW YORK","US Mid Atlantic",10-K,2023-02-08,,"BLACKSTONE MORTGAGE TRUST, INC.",1061630,"=""BXMT""","345 PARK AVENUE","24TH FLOOR","NEW YORK",NY,"NEW YORK","US Mid Atlantic",,,"=""6798""","Real Estate Investment Trusts",525990,"Other Financial Vehicles",34,21,12/31/22,"3,634,803,968",12/31/22,"416,545,000","248,642,000",,"25,353,985,000"
27676,"Other investments","Fair Value – Investments — Refer to Footnote 2 and 5 in the financial statements",505514,12/31/22,03/17/23,3,"Deloitte & Touche LLP",,,,"New York",NY,"NEW YORK","US Mid Atlantic",10-K,2023-03-17,,"Blackstone Private Credit Fund",1803498,,"345 PARK AVENUE","31ST FLOOR","NEW YORK",NY,"NEW YORK","US Mid Atlantic",,,,,525990,"Other Financial Vehicles",34,,,,12/31/22,"3,602,347,000","1,985,552,000","22,685,065,000","52,692,896,000"
29248,"Other investments","Fair Value — Investments — Refer to Footnote 2 and 5 in the financial statements",509293,12/31/22,03/17/23,3,"Deloitte & Touche LLP",,,,"New York",NY,"NEW YORK","US Mid Atlantic",486BPOS,2023-04-18,,"Blackstone Private Credit Fund",1803498,,"345 PARK AVENUE","31ST FLOOR","NEW YORK",NY,"NEW YORK","US Mid Atlantic",,,,,525990,"Other Financial Vehicles",34,,,,12/31/22,"3,602,347,000","1,985,552,000","22,685,065,000","52,692,896,000"
31046,"Other investments","Fair Value – Investments",516384,12/31/22,03/17/23,3,"Deloitte & Touche LLP",,,,"New York",NY,"NEW YORK","US Mid Atlantic",N-2/A,2023-08-25,,"Blackstone Private Credit Fund",1803498,,"345 PARK AVENUE","31ST FLOOR","NEW YORK",NY,"NEW YORK","US Mid Atlantic",,,,,525990,"Other Financial Vehicles",34,,,,12/31/22,"3,602,347,000","1,985,552,000","22,685,065,000","52,692,896,000"
27657,"Real estate investments","Allocation of Purchase Price for Investments in Real Estate — Refer to Notes 2, 3, and 4 to the financial statements",505522,12/31/22,03/17/23,3,"Deloitte & Touche LLP",,,,"New York",NY,"NEW YORK","US Mid Atlantic",10-K,2023-03-17,,"Blackstone Real Estate Income Trust, Inc.",1662972,"=""BSTT""","345 PARK AVENUE",,"NEW YORK",NY,"NEW YORK","US Mid Atlantic",,,"=""6798""","Real Estate Investment Trusts",525990,"Other Financial Vehicles",34,,,,12/31/22,"7,646,378,000","-883,519,000",,"142,687,424,000"
25768,"Other investments","Fair Value – Investments — Refer to Footnote 2 and 5 in the financial statements",501412,12/31/22,02/27/23,3,"Deloitte & Touche LLP",,,,"New York",NY,"NEW YORK","US Mid Atlantic",10-K,2023-02-27,,"Blackstone Secured Lending Fund",1736035,"=""BXSL""","345 PARK AVENUE","31ST FLOOR","NEW YORK",NY,"NEW YORK","US Mid Atlantic",,,,,525990,"Other Financial Vehicles",34,22,12/31/22,"3,584,109,824",12/31/22,"646,713,000","404,556,000",,"9,908,995,000"
24821,"Business combinations","Business Combinations - Valuation",500595,12/31/22,02/23/23,2,"Ernst & Young LLP",,,,"San Francisco",CA,CALIFORNIA,"US West",10-K,2023-02-23,,"Block, Inc.",1512673,"=""XYZ""","1955 BROADWAY","SUITE 600",OAKLAND,CA,CALIFORNIA,"US West",,,"=""7372""","Prepackaged Software",511210,"Software Publishers",34,63,12/29/22,"33,814,439,936",12/31/22,"17,531,587,000","-540,747,000","3,242,084,000","31,364,340,000"
24822,"Sales return and allowances","Accrued Transaction Losses",500595,12/31/22,02/23/23,2,"Ernst & Young LLP",,,,"San Francisco",CA,CALIFORNIA,"US West",10-K,2023-02-23,,"Block, Inc.",1512673,"=""XYZ""","1955 BROADWAY","SUITE 600",OAKLAND,CA,CALIFORNIA,"US West",,,"=""7372""","Prepackaged Software",511210,"Software Publishers",34,63,12/29/22,"33,814,439,936",12/31/22,"17,531,587,000","-540,747,000","3,242,084,000","31,364,340,000"
24823,"Allowance for credit losses","Allowance for Credit Losses Related to Consumer Receivables",500595,12/31/22,02/23/23,2,"Ernst & Young LLP",,,,"San Francisco",CA,CALIFORNIA,"US West",10-K,2023-02-23,,"Block, Inc.",1512673,"=""XYZ""","1955 BROADWAY","SUITE 600",OAKLAND,CA,CALIFORNIA,"US West",,,"=""7372""","Prepackaged Software",511210,"Software Publishers",34,63,12/29/22,"33,814,439,936",12/31/22,"17,531,587,000","-540,747,000","3,242,084,000","31,364,340,000"
24601,"Revenue from customer contracts","Product Revenue Recognition – Refer to Notes 2 and 3 to the financial statements",500122,12/31/22,02/21/23,3,"Deloitte & Touche LLP",,,,"San Jose",CA,CALIFORNIA,"US West",10-K,2023-02-21,,"Bloom Energy Corp",1664703,"=""BE""","4353 NORTH FIRST STREET",,"SAN JOSE",CA,CALIFORNIA,"US West",,,"=""3620""","Electrical Industrial Apparatus",335311,"Power, Distribution, and Specialty Transformer Manufacturing",34,19,12/31/22,"3,630,213,376",12/31/22,"1,199,125,000","-301,708,000",,"1,946,627,000"
24741,"Insurance contract liabilities","Valuation of Insurance Reserves",500501,12/25/22,02/22/23,1,"PricewaterhouseCoopers LLP",,,,Tampa,FL,FLORIDA,"US Southeast",10-K,2023-02-22,,"Bloomin' Brands, Inc.",1546417,"=""BLMN""","2202 NORTH WEST SHORE BOULEVARD","SUITE 500",TAMPA,FL,FLORIDA,"US Southeast",,,"=""5812""","Eating and Drinking Places",722110,"Full-Service Restaurants",34,20,12/31/22,"1,764,447,488",12/25/22,"4,009,250,000","101,907,000","-449,989,000","3,320,425,000"
27621,Leases,"Adoption of ASU 2016-02, Leases (Topic 842)",505370,12/31/22,03/16/23,2,"Ernst & Young LLP",,,,"New York",NY,"NEW YORK","US Mid Atlantic",10-K,2023-03-16,Yes,"Blue Apron Holdings, Inc.",1701114,"=""APRN""","28 LIBERTY STREET",,"NEW YORK",NY,"NEW YORK","US Mid Atlantic",,,"=""5961""","Catalog and Mail-Order Houses",424490,"Other Grocery and Related Products Merchant Wholesalers",34,1,12/31/22,"43,908,612",12/31/22,"458,467,000","-109,733,000",,"171,142,000"
24640,"Other investments","Fair value of investments",500274,12/31/22,02/22/23,4,"KPMG LLP",,,,"New York",NY,"NEW YORK","US Mid Atlantic",10-K,2023-02-22,,"Blue Owl Capital Corp",1655888,"=""OBDC""","399 PARK AVENUE",,"NEW YORK",NY,"NEW YORK","US Mid Atlantic",,,,,525990,"Other Financial Vehicles",34,12,12/31/22,"4,533,105,664",12/31/22,"894,465,000","466,355,000",,"13,584,853,000"
26740,"Other investments","Fair value of investments",503291,12/31/22,03/03/23,4,"KPMG LLP",,,,"New York",NY,"NEW YORK","US Mid Atlantic",10-K,2023-03-06,,"Blue Owl Capital Corp II",1655887,,"399 PARK AVENUE",,"NEW YORK",NY,"NEW YORK","US Mid Atlantic",,,,,525990,"Other Financial Vehicles",34,,,,12/31/22,"218,243,000","101,473,000","1,296,261,000","2,326,450,000"
25633,"Business combinations","Evaluation of the fair value of certain acquired intangible assets",501641,12/31/22,02/27/23,4,"KPMG LLP",,,,"New York",NY,"NEW YORK","US Mid Atlantic",10-K,2023-02-27,,"BLUE OWL CAPITAL INC.",1823945,"=""OWL""","399 PARK AVENUE, 37TH FLOOR",,"NEW YORK",NY,"NEW YORK","US Mid Atlantic",,,"=""6282""","Investment Advice",523930,"Investment Advice",34,11,12/31/22,"4,718,392,320",12/31/22,"1,369,722,000","-9,289,000","-5,005,883,000","8,893,075,000"
27185,"Other investments","Fair value of investments",504581,12/31/22,03/10/23,4,"KPMG LLP",,,,"New York",NY,"NEW YORK","US Mid Atlantic",10-K,2023-03-10,,"Blue Owl Credit Income Corp.",1812554,,"399 PARK AVENUE",,"NEW YORK",NY,"NEW YORK","US Mid Atlantic",,,,,525990,"Other Financial Vehicles",34,,,,12/31/22,"670,185,000","346,851,000","5,249,753,000","11,036,362,000"
30598,"Other investments","Fair value of investments",514382,12/31/22,03/10/23,4,"KPMG LLP",,,,"New York",NY,"NEW YORK","US Mid Atlantic",486BPOS,2023-07-06,,"Blue Owl Credit Income Corp.",1812554,,"399 PARK AVENUE",,"NEW YORK",NY,"NEW YORK","US Mid Atlantic",,,,,525990,"Other Financial Vehicles",34,,,,12/31/22,"670,185,000","346,851,000","5,249,753,000","11,036,362,000"
31243,"Other investments","Fair value of investments",517397,12/31/22,03/10/23,4,"KPMG LLP",,,,"New York",NY,"NEW YORK","US Mid Atlantic",N-2,2023-09-25,,"Blue Owl Credit Income Corp.",1812554,,"399 PARK AVENUE",,"NEW YORK",NY,"NEW YORK","US Mid Atlantic",,,,,525990,"Other Financial Vehicles",34,,,,12/31/22,"670,185,000","346,851,000","5,249,753,000","11,036,362,000"
31923,"Other investments","Fair value of investments",521146,12/31/22,03/10/23,4,"KPMG LLP",,,,"New York",NY,"NEW YORK","US Mid Atlantic",N-2,2023-12-13,,"Blue Owl Credit Income Corp.",1812554,,"399 PARK AVENUE",,"NEW YORK",NY,"NEW YORK","US Mid Atlantic",,,,,525990,"Other Financial Vehicles",34,,,,12/31/22,"670,185,000","346,851,000","5,249,753,000","11,036,362,000"
26907,"Other investments","Fair value of investments",503780,12/31/22,03/08/23,4,"KPMG LLP",,,,"New York",NY,"NEW YORK","US Mid Atlantic",10-K,2023-03-08,,"Blue Owl Technology Finance Corp.",1747777,"=""OTF""","399 PARK AVENUE",,"NEW YORK",NY,"NEW YORK","US Mid Atlantic",,,,,525990,"Other Financial Vehicles",34,,,,12/31/22,"494,845,000","273,243,000","3,387,365,000","6,663,369,000"
28209,"Research and development expenses","Accrued Clinical and Contract Research Organization Costs and Manufacturing Costs",506702,12/31/22,03/29/23,2,"Ernst & Young LLP",,,,Boston,MA,MASSACHUSETTS,"US New England",10-K,2023-03-29,Yes,"bluebird bio, Inc.",1293971,,"455 GRAND UNION BOULEVARD",,SOMERVILLE,MA,MASSACHUSETTS,"US New England",,,"=""2836""","Biological Products, Except Diagnostic Substances",325414,"Biological Product (except Diagnostic) Manufacturing",34,7,12/31/22,"573,827,136",12/31/22,"3,597,000","-230,342,000","185,829,000","554,902,000"
27230,"Allowance for credit losses","Allowance for Loan Losses",504647,12/31/22,03/13/23,2,"Ernst & Young LLP",,,,"Boca Raton",FL,FLORIDA,"US Southeast",10-K,2023-03-13,,"Bluegreen Vacations Holding Corp",315858,,"401 EAST LAS OLAS BLVD","SUITE 800","FORT LAUDERDALE",FL,FLORIDA,"US Southeast",,,"=""6500""","Real Estate",522120,"Savings Institutions",34,25,12/31/22,"303,659,008",12/31/22,"745,029,000","64,385,000","110,367,000","1,398,385,000"
24486,"Pension and other post-employment benefits","Valuation of the Pension Benefit Obligation",500075,12/31/22,02/21/23,2,"Ernst & Young LLP",,,,Atlanta,GA,GEORGIA,"US Southeast",10-K,2023-02-21,,"BlueLinx Holdings Inc.",1301787,"=""BXC""","1950 SPECTRUM CIRCLE","SUITE 300",MARIETTA,GA,GEORGIA,"US Southeast",,,"=""5031""","Lumber, Plywood, Millwork, and Wood Panels",444190,"Other Building Material Dealers",34,71,12/31/22,"643,446,144",12/31/22,"4,450,214,000","296,176,000","499,668,000","1,490,042,000"
24170,"Research and development expenses","Accrued Clinical Trial Expenses",499719,12/31/22,02/16/23,2,"Ernst & Young LLP",,,,Boston,MA,MASSACHUSETTS,"US New England",10-K,2023-02-16,,"Blueprint Medicines Corp",1597264,,"45 SIDNEY STREET",,CAMBRIDGE,MA,MASSACHUSETTS,"US New England",,,"=""2834""","Pharmaceutical Preparations",325412,"Pharmaceutical Preparation Manufacturing",34,44,12/31/22,"2,626,800,128",12/31/22,"204,036,000","-557,517,000",,"1,349,902,000"
24171,"Shareholder valuation","IDRx Inc. License and Stock Purchase Agreement",499719,12/31/22,02/16/23,2,"Ernst & Young LLP",,,,Boston,MA,MASSACHUSETTS,"US New England",10-K,2023-02-16,,"Blueprint Medicines Corp",1597264,,"45 SIDNEY STREET",,CAMBRIDGE,MA,MASSACHUSETTS,"US New England",,,"=""2834""","Pharmaceutical Preparations",325412,"Pharmaceutical Preparation Manufacturing",34,44,12/31/22,"2,626,800,128",12/31/22,"204,036,000","-557,517,000",,"1,349,902,000"
23640,Goodwill,"Goodwill — Refer to Notes 2 and 8 to the financial statements",498752,12/31/22,02/07/23,3,"Deloitte & Touche LLP",,,,Houston,TX,TEXAS,"US Southwest",10-K,2023-02-07,,"Boardwalk Pipeline Partners, LP",1336047,,"9 GREENWAY PLAZA, SUITE 2800",,HOUSTON,TX,TEXAS,"US Southwest",,,"=""4922""","Natural Gas Transmission",486210,"Pipeline Transportation of Natural Gas",34,,,,12/31/22,"1,432,000,000","342,200,000","5,464,800,000","9,569,900,000"
23519,"Revenue from customer contracts","Cost Estimates for Fixed-Price Development Contracts — Refer to Notes 1 and 13 to the financial statements",498214,12/31/22,01/27/23,3,"Deloitte & Touche LLP",,,,Chicago,IL,ILLINOIS,"US Midwest",10-K,2023-01-27,,"BOEING CO",12927,"=""BA""","100 N RIVERSIDE PLZ",,CHICAGO,IL,ILLINOIS,"US Midwest",,,"=""3721""",Aircraft,336411,"Aircraft Manufacturing",34,190,12/31/22,"113,834,876,928",12/31/22,"66,608,000,000","-4,935,000,000","-26,251,000,000","137,100,000,000"
23520,"Revenue from customer contracts","Program Accounting Estimates for the 777X Program — Refer to Notes 1, 7, and 22 to the financial statements",498214,12/31/22,01/27/23,3,"Deloitte & Touche LLP",,,,Chicago,IL,ILLINOIS,"US Midwest",10-K,2023-01-27,,"BOEING CO",12927,"=""BA""","100 N RIVERSIDE PLZ",,CHICAGO,IL,ILLINOIS,"US Midwest",,,"=""3721""",Aircraft,336411,"Aircraft Manufacturing",34,190,12/31/22,"113,834,876,928",12/31/22,"66,608,000,000","-4,935,000,000","-26,251,000,000","137,100,000,000"
23521,"Revenue from customer contracts","Program Accounting Revenue Estimates for the 787 Program — Refer to Notes 1, 7, and 22 to the financial statements",498214,12/31/22,01/27/23,3,"Deloitte & Touche LLP",,,,Chicago,IL,ILLINOIS,"US Midwest",10-K,2023-01-27,,"BOEING CO",12927,"=""BA""","100 N RIVERSIDE PLZ",,CHICAGO,IL,ILLINOIS,"US Midwest",,,"=""3721""",Aircraft,336411,"Aircraft Manufacturing",34,190,12/31/22,"113,834,876,928",12/31/22,"66,608,000,000","-4,935,000,000","-26,251,000,000","137,100,000,000"
24522,"Sales return and allowances","Customer rebates payable for engineered wood products",500082,12/31/22,02/21/23,4,"KPMG LLP",,,,Boise,ID,IDAHO,"US West",10-K,2023-02-21,,"BOISE CASCADE Co",1328581,"=""BCC""","1111 WEST JEFFERSON STREET, SUITE 300","P. O. BOX 50",BOISE,ID,IDAHO,"US West",,,"=""5030""","Wholesale-Lumber & Other Construction Materials",321999,"All Other Miscellaneous Wood Product Manufacturing",34,69,12/31/22,"2,709,718,272",12/31/22,"8,387,307,000","857,658,000","1,758,584,000","3,240,514,000"
26280,"Allowance for credit losses","Allowance for credit losses",502601,12/31/22,03/01/23,2,"Ernst & Young LLP",,,,Tulsa,OK,OKLAHOMA,"US Southwest",10-K,2023-03-01,,"BOK FINANCIAL CORP",875357,"=""BOKF""","BANK OF OKLAHOMA TOWER","BOSTON AVENUE AT SECOND STREET",TULSA,OK,OKLAHOMA,"US Southwest",,,"=""6021""","National Commercial Banks",522110,"Commercial Banking",34,104,12/31/22,"6,949,636,608",12/31/22,"1,824,637,000","520,273,000","3,561,769,000","47,790,642,000"
24813,"Other revenue","Total Revenues - Refer to Notes 2 and 3 to the financial statements",500568,12/31/22,02/23/23,3,"Deloitte & Touche LLP",,,,Stamford,CT,CONNECTICUT,"US New England",10-K,2023-02-23,,"Booking Holdings Inc.",1075531,"=""BKNG""","800 CONNECTICUT AVE",,NORWALK,CT,CONNECTICUT,"US New England",,,"=""4700""","Transportation Services",561510,"Travel Agencies",34,"2,015",12/31/22,"76,304,482,304",12/31/22,"17,090,000,000","3,058,000,000","-1,854,000,000","25,361,000,000"
24814,Goodwill,"Goodwill - Refer to Notes 2 and 11 to the financial statements",500568,12/31/22,02/23/23,3,"Deloitte & Touche LLP",,,,Stamford,CT,CONNECTICUT,"US New England",10-K,2023-02-23,,"Booking Holdings Inc.",1075531,"=""BKNG""","800 CONNECTICUT AVE",,NORWALK,CT,CONNECTICUT,"US New England",,,"=""4700""","Transportation Services",561510,"Travel Agencies",34,"2,015",12/31/22,"76,304,482,304",12/31/22,"17,090,000,000","3,058,000,000","-1,854,000,000","25,361,000,000"
24815,"Other contingent liabilities","Commitments and Contingencies - Tax Matters - Refer to Note 16 to the financial statements",500568,12/31/22,02/23/23,3,"Deloitte & Touche LLP",,,,Stamford,CT,CONNECTICUT,"US New England",10-K,2023-02-23,,"Booking Holdings Inc.",1075531,"=""BKNG""","800 CONNECTICUT AVE",,NORWALK,CT,CONNECTICUT,"US New England",,,"=""4700""","Transportation Services",561510,"Travel Agencies",34,"2,015",12/31/22,"76,304,482,304",12/31/22,"17,090,000,000","3,058,000,000","-1,854,000,000","25,361,000,000"
21082,Inventory,"Inventories – Refer to Note 2 to the financial statements",486857,03/26/22,05/11/22,3,"Deloitte & Touche LLP",,,,"Costa Mesa",CA,CALIFORNIA,"US West",10-K,2022-05-12,,"Boot Barn Holdings, Inc.",1610250,"=""BOOT""","17100 LAGUNA CANYON ROAD",,IRVINE,CA,CALIFORNIA,"US West",,,"=""5661""","Shoe Stores",448210,"Shoe Stores",34,95,03/31/22,"2,813,841,152",03/26/22,"1,488,256,000","192,450,000","341,361,000","1,199,855,000"
21221,"Revenue from customer contracts","Revenue recognition related to the cost-based input method and variable consideration",487241,03/31/22,05/20/22,2,"Ernst & Young LLP",,,,Tysons,VA,VIRGINIA,"US Mid Atlantic",10-K,2022-05-20,,"Booz Allen Hamilton Holding Corp",1443646,"=""BAH""","8283 GREENSBORO DRIVE",,MCLEAN,VA,VIRGINIA,"US Mid Atlantic",,,"=""8742""","Management Consulting Services",541611,"Administrative Management and General Management Consulting Services",34,88,03/31/22,"11,646,209,024",03/31/22,"8,363,700,000","466,740,000","-1,622,543,000","6,025,575,000"
21222,"Other contingent liabilities","Government Contracting Matters - Provision for Claimed Indirect Costs",487241,03/31/22,05/20/22,2,"Ernst & Young LLP",,,,Tysons,VA,VIRGINIA,"US Mid Atlantic",10-K,2022-05-20,,"Booz Allen Hamilton Holding Corp",1443646,"=""BAH""","8283 GREENSBORO DRIVE",,MCLEAN,VA,VIRGINIA,"US Mid Atlantic",,,"=""8742""","Management Consulting Services",541611,"Administrative Management and General Management Consulting Services",34,88,03/31/22,"11,646,209,024",03/31/22,"8,363,700,000","466,740,000","-1,622,543,000","6,025,575,000"
21223,"Uncertain tax positions","Unrecognized Tax Benefits",487241,03/31/22,05/20/22,2,"Ernst & Young LLP",,,,Tysons,VA,VIRGINIA,"US Mid Atlantic",10-K,2022-05-20,,"Booz Allen Hamilton Holding Corp",1443646,"=""BAH""","8283 GREENSBORO DRIVE",,MCLEAN,VA,VIRGINIA,"US Mid Atlantic",,,"=""8742""","Management Consulting Services",541611,"Administrative Management and General Management Consulting Services",34,88,03/31/22,"11,646,209,024",03/31/22,"8,363,700,000","466,740,000","-1,622,543,000","6,025,575,000"
21224,"Business combinations","Valuation of acquired intangible assets",487241,03/31/22,05/20/22,2,"Ernst & Young LLP",,,,Tysons,VA,VIRGINIA,"US Mid Atlantic",10-K,2022-05-20,,"Booz Allen Hamilton Holding Corp",1443646,"=""BAH""","8283 GREENSBORO DRIVE",,MCLEAN,VA,VIRGINIA,"US Mid Atlantic",,,"=""8742""","Management Consulting Services",541611,"Administrative Management and General Management Consulting Services",34,88,03/31/22,"11,646,209,024",03/31/22,"8,363,700,000","466,740,000","-1,622,543,000","6,025,575,000"
23750,Goodwill,"Goodwill Impairment Analysis for the Reporting Unit Containing the Goodwill from the Company’s 2021 Acquisition of Akasol AG",498970,12/31/22,02/09/23,1,"PricewaterhouseCoopers LLP",,,,Detroit,MI,MICHIGAN,"US Midwest",10-K,2023-02-09,,"BORGWARNER INC",908255,"=""BWA""","3850 HAMLIN RD.",,"AUBURN HILLS",MI,MICHIGAN,"US Midwest",,,"=""3714""","Motor Vehicle Parts and Accessories",336399,"All Other Motor Vehicle Parts Manufacturing",34,40,12/31/22,"9,423,419,392",12/31/22,"15,801,000,000","944,000,000","2,776,000,000","16,994,000,000"
23751,"Other income taxes","Worldwide Provision for Income Taxes",498970,12/31/22,02/09/23,1,"PricewaterhouseCoopers LLP",,,,Detroit,MI,MICHIGAN,"US Midwest",10-K,2023-02-09,,"BORGWARNER INC",908255,"=""BWA""","3850 HAMLIN RD.",,"AUBURN HILLS",MI,MICHIGAN,"US Midwest",,,"=""3714""","Motor Vehicle Parts and Accessories",336399,"All Other Motor Vehicle Parts Manufacturing",34,40,12/31/22,"9,423,419,392",12/31/22,"15,801,000,000","944,000,000","2,776,000,000","16,994,000,000"
24705,"Other intangible assets","Dogfish Head Trademark Intangible — Refer to Notes B, I, and O to the financial statements",500390,12/31/22,02/22/23,3,"Deloitte & Touche LLP",,,,Boston,MA,MASSACHUSETTS,"US New England",10-K,2023-02-22,,"BOSTON BEER CO INC",949870,"=""SAM""","ONE DESIGN CENTER PLACE","SUITE 850",BOSTON,MA,MASSACHUSETTS,"US New England",,,"=""2082""","Malt Beverages",312120,Breweries,34,330,12/31/22,"3,373,628,672",12/31/22,"2,090,334,000","67,263,000","879,696,000","1,420,773,000"
27971,"Business combinations","Evaluating the fair value of the Customer Relationship Intangible Assets acquired in the InfoWest Inc and Go Fiber, LLC Acquisition ",506185,12/31/22,03/24/23,4,"KPMG LLP",,,,Omaha,NE,NEBRASKA,"US Midwest",10-K,2023-03-24,,"BOSTON OMAHA Corp",1494582,"=""BOC""","1601 DODGE STREET","SUITE 3300",OMAHA,NE,NEBRASKA,"US Midwest",,,"=""6510""","Real Estate Operators (No Developers) & Lessors",531210,"Offices of Real Estate Agents and Brokers",34,27,12/31/22,"759,243,264",12/31/22,"81,234,194","7,139,548","245,298,111","657,581,223"
27972,"Insurance contract liabilities","Estimated reserves for losses and loss adjustment expenses (LAE)",506185,12/31/22,03/24/23,4,"KPMG LLP",,,,Omaha,NE,NEBRASKA,"US Midwest",10-K,2023-03-24,,"BOSTON OMAHA Corp",1494582,"=""BOC""","1601 DODGE STREET","SUITE 3300",OMAHA,NE,NEBRASKA,"US Midwest",,,"=""6510""","Real Estate Operators (No Developers) & Lessors",531210,"Offices of Real Estate Agents and Brokers",34,27,12/31/22,"759,243,264",12/31/22,"81,234,194","7,139,548","245,298,111","657,581,223"
25700,"Long-lived assets","Assessment of Impairment Indicators of Long-Lived Assets and Investments in Unconsolidated Joint Ventures",501539,12/31/22,02/27/23,1,"PricewaterhouseCoopers LLP",,,,Boston,MA,MASSACHUSETTS,"US New England",10-K,2023-02-27,,"BOSTON PROPERTIES LTD PARTNERSHIP",1043121,,"800 BOYLSTON STREET","SUITE 1900",BOSTON,MA,MASSACHUSETTS,"US New England",1037540,"BXP, Inc.","=""6798""","Real Estate Investment Trusts",525990,"Other Financial Vehicles",34,,,,12/31/22,"3,108,581,000","957,265,000",,"23,957,763,000"
25701,"Property, plant and equipment","Purchase Price Allocation for Long-Lived Asset Property Acquisitions",501539,12/31/22,02/27/23,1,"PricewaterhouseCoopers LLP",,,,Boston,MA,MASSACHUSETTS,"US New England",10-K,2023-02-27,,"BOSTON PROPERTIES LTD PARTNERSHIP",1043121,,"800 BOYLSTON STREET","SUITE 1900",BOSTON,MA,MASSACHUSETTS,"US New England",1037540,"BXP, Inc.","=""6798""","Real Estate Investment Trusts",525990,"Other Financial Vehicles",34,,,,12/31/22,"3,108,581,000","957,265,000",,"23,957,763,000"
25062,"Business combinations","Business Combinations",500853,12/31/22,02/23/23,2,"Ernst & Young LLP",,,,Boston,MA,MASSACHUSETTS,"US New England",10-K,2023-02-23,,"BOSTON SCIENTIFIC CORP",885725,"=""BSX""","300 BOSTON SCIENTIFIC WAY",,MARLBOROUGH,MA,MASSACHUSETTS,"US New England",,,"=""3841""","Surgical and Medical Instruments and Apparatus",339112,"Surgical and Medical Instrument Manufacturing",34,46,12/31/22,"66,320,834,560",12/31/22,"12,682,000,000","696,000,000","-1,249,000,000","32,470,000,000"
18707,"Revenue from customer contracts","Revenue recognition – evaluation of contract terms and conditions",479712,01/31/22,03/16/22,2,"Ernst & Young LLP",,,,"San Francisco",CA,CALIFORNIA,"US West",10-K,2022-03-16,,"BOX INC",1372612,"=""BOX""","900 JEFFERSON AVE",,"REDWOOD CITY",CA,CALIFORNIA,"US West",,,"=""7372""","Prepackaged Software",511210,"Software Publishers",34,26,01/31/22,"3,790,966,528",01/31/22,"874,332,000","-41,459,000","18,327,000","1,392,009,000"
25293,"Goodwill and intangible assets","Goodwill and Gaming License Rights Indefinite-Lived Intangible Assets —Refer to Notes 1, 4 and 5 to the financial statements",501235,12/31/22,02/24/23,3,"Deloitte & Touche LLP",,,,"Las Vegas",NV,NEVADA,"US West",10-K,2023-02-24,,"BOYD GAMING CORP",906553,"=""BYD""","6465 SOUTH RAINBOW BOULEVARD",,"LAS VEGAS",NV,NEVADA,"US West",,,"=""7011""","Hotels and Motels",721120,"Casino Hotels",34,55,12/31/22,"5,606,562,304",12/31/22,"3,555,377,000","639,377,000","-870,254,000","6,311,127,000"
25294,"Business combinations","Acquisition of Pala Interactive, LLC — Refer to Notes 1 and 2 to the financial statements",501235,12/31/22,02/24/23,3,"Deloitte & Touche LLP",,,,"Las Vegas",NV,NEVADA,"US West",10-K,2023-02-24,,"BOYD GAMING CORP",906553,"=""BYD""","6465 SOUTH RAINBOW BOULEVARD",,"LAS VEGAS",NV,NEVADA,"US West",,,"=""7011""","Hotels and Motels",721120,"Casino Hotels",34,55,12/31/22,"5,606,562,304",12/31/22,"3,555,377,000","639,377,000","-870,254,000","6,311,127,000"
27186,"Property, plant and equipment","Impairment of upstream oil and gas property, plant and equipment (PP&E) assets – Notes 1, 4 and 12 to the financial statements",504364,12/31/22,03/10/23,3,"Deloitte & Touche LLP",293,"Deloitte LLP",1147,London,X0,"UNITED KINGDOM",Foreign,20-F,2023-03-10,,"BP PLC",313807,"=""BP""","1 ST JAMES'S SQUARE",,LONDON,X0,"UNITED KINGDOM",Foreign,,,"=""2911""","Petroleum Refining",324110,"Petroleum Refineries",34,35,12/29/22,"120,166,572,032",12/31/22,"241,392,000,000","-1,357,000,000","45,393,000,000","288,120,000,000"
27187,"Asset retirement and environmental obligations","Decommissioning provisions – Notes 1 and 23",504364,12/31/22,03/10/23,3,"Deloitte & Touche LLP",293,"Deloitte LLP",1147,London,X0,"UNITED KINGDOM",Foreign,20-F,2023-03-10,,"BP PLC",313807,"=""BP""","1 ST JAMES'S SQUARE",,LONDON,X0,"UNITED KINGDOM",Foreign,,,"=""2911""","Petroleum Refining",324110,"Petroleum Refineries",34,35,12/29/22,"120,166,572,032",12/31/22,"241,392,000,000","-1,357,000,000","45,393,000,000","288,120,000,000"
27188,"Other debt","Accounting for complex transactions executed by the trading and shipping (T&S) function to deliver against the wider group strategy and valuation of commodity financial derivatives, where fraud risks may arise in revenue recognition (potentially impacting all financial statement accounts, in particular finance debt) - Notes 1, 20, 22, 29 and 30 to the financial statements",504364,12/31/22,03/10/23,3,"Deloitte & Touche LLP",293,"Deloitte LLP",1147,London,X0,"UNITED KINGDOM",Foreign,20-F,2023-03-10,,"BP PLC",313807,"=""BP""","1 ST JAMES'S SQUARE",,LONDON,X0,"UNITED KINGDOM",Foreign,,,"=""2911""","Petroleum Refining",324110,"Petroleum Refineries",34,35,12/29/22,"120,166,572,032",12/31/22,"241,392,000,000","-1,357,000,000","45,393,000,000","288,120,000,000"
27189,"Long-lived assets","Impairment of E&A assets, investments in joint ventures and refinery PP&E as a consequence, inter alia, of climate change and the energy transition – Notes 1, 4, 15 and 16",504364,12/31/22,03/10/23,3,"Deloitte & Touche LLP",293,"Deloitte LLP",1147,London,X0,"UNITED KINGDOM",Foreign,20-F,2023-03-10,,"BP PLC",313807,"=""BP""","1 ST JAMES'S SQUARE",,LONDON,X0,"UNITED KINGDOM",Foreign,,,"=""2911""","Petroleum Refining",324110,"Petroleum Refineries",34,35,12/29/22,"120,166,572,032",12/31/22,"241,392,000,000","-1,357,000,000","45,393,000,000","288,120,000,000"
22264,"Deferred income taxes","Taxes — Valuation Allowances — Refer to Notes 1 and 11 to the financial statements",491397,07/31/22,09/01/22,3,"Deloitte & Touche LLP",,,,Milwaukee,WI,WISCONSIN,"US Midwest",10-K,2022-09-01,,"BRADY CORP",746598,"=""BRC""","6555 W GOOD HOPE RD","P O BOX 571",MILWAUKEE,WI,WISCONSIN,"US Midwest",,,"=""3990""","Miscellaneous Manufacturing Industries",322222,"Coated and Laminated Paper Manufacturing",34,48,07/31/22,"2,218,838,272",07/31/22,"1,302,062,000","149,979,000","250,438,000","1,367,332,000"
28275,"Deferred and stock-based compensation","Stock-Based Compensation to Employees and Directors – Stock Options — Refer to Note 9 to the financial statements",506814,12/31/22,03/30/23,3,"Deloitte & Touche LLP",257,"Brightman Almagor Zohar & Co",1197,"Tel Aviv",L3,ISRAEL,Foreign,10-K,2023-03-30,Yes,"BRAINSTORM CELL THERAPEUTICS INC.",1137883,"=""BCLI""","1325 AVENUE OF AMERICAS","28TH FLOOR","NEW YORK",NY,"NEW YORK","US Mid Atlantic",,,"=""2836""","Biological Products, Except Diagnostic Substances",325413,"In-Vitro Diagnostic Substance Manufacturing",34,2,12/31/22,"60,178,268",12/31/22,,"-24,277,000",,"8,451,000"
19138,"Other contingent liabilities","Estimate of Workers' Compensation Self-Insurance Reserve",480733,01/29/22,03/25/22,2,"Ernst & Young LLP",,,,Nashville,TN,TENNESSEE,"US Southeast",10-K,2022-03-25,,"BRAND HOUSE COLLECTIVE, INC.",1056285,"=""KIRK""","5310 MARYLAND WAY",,BRENTWOOD,TN,TENNESSEE,"US Southeast",,,"=""5990""","Retail-Retail Stores, NEC",442299,"All Other Home Furnishings Stores",34,17,01/31/22,"213,848,704",01/29/22,"558,180,000","22,026,000",,"331,189,000"
24477,"Real estate investments","Impairment Assessments of Real Estate Investments and Investments in Unconsolidated Real Estate Ventures",500049,12/31/22,02/21/23,1,"PricewaterhouseCoopers LLP",,,,Philadelphia,PA,PENNSYLVANIA,"US Mid Atlantic",10-K,2023-02-21,,"BRANDYWINE OPERATING PARTNERSHIP, L.P.",1060386,,"C/O BRANDYWINE REALTY TRUST","2929 ARCH STREET, SUITE 1800",PHILADELPHIA,PA,PENNSYLVANIA,"US Mid Atlantic",790816,"BRANDYWINE REALTY TRUST","=""6798""","Real Estate Investment Trusts",525990,"Other Financial Vehicles",34,,,,12/31/22,"506,100,000","53,994,000","1,612,051,000","3,874,505,000"
24567,"Real estate investments","Impairment Assessments of Real Estate Investments and Investments in Unconsolidated Real Estate Ventures",500149,12/31/22,02/21/23,1,"PricewaterhouseCoopers LLP",,,,Philadelphia,PA,PENNSYLVANIA,"US Mid Atlantic",10-K,2023-02-21,,"BRANDYWINE REALTY TRUST",790816,"=""BDN""","2929 ARCH STREET","SUITE 1800",PHILADELPHIA,PA,PENNSYLVANIA,"US Mid Atlantic",,,"=""6798""","Real Estate Investment Trusts",525990,"Other Financial Vehicles",34,6,12/31/22,"1,055,154,304",12/31/22,"506,100,000","53,824,000","1,607,181,000","3,874,505,000"
29392,"Asset retirement and environmental obligations","Evaluation of the provision and disclosures related to the geological phenomenon in the state of Alagoas",509779,12/31/22,04/24/23,4,"KPMG LLP",61,"KPMG Auditores Independentes",1124,"São Paulo",D5,BRAZIL,Foreign,20-F,2023-04-25,,"BRASKEM SA",1071438,"=""BAK""","RUA ETENO, 1561","POLO PETROQUIMICO DE CAMACARI",CAMACARI,D5,BRAZIL,Foreign,,,"=""2860""","Industrial Organic Chemicals",325110,"Petrochemical Manufacturing",34,9,12/29/22,"3,138,723,072",12/31/22,"18,281,000,000","-155,000,000","814,367,000","16,676,710,000"
26182,"Discontinued operations","Discontinued operations - Discontinuation of Hypermarket Format and Planned Distribution of Subsidiary Éxito to Shareholders",502380,12/31/22,02/27/23,3,"Deloitte & Touche LLP",4,"Deloitte Touche Tohmatsu Auditores Independentes",1045,"São Paulo",D5,BRAZIL,Foreign,6-K,2023-02-28,,"BRAZILIAN DISTRIBUTION CO COMPANHIA BRASILEIRA DE DISTR CBD",1038572,"=""CBDBY""","AV BRIGADEIRO LUIZ ANTONIO","3126 1 ANDAR SP","SAO PAULO",D5,BRAZIL,Foreign,,,"=""5411""","Grocery Stores",445110,"Supermarkets and Other Grocery (except Convenience) Stores",34,3,12/31/22,"836,935,872",12/31/22,"3,281,000,000","-1,000,000","1,801,000,000","8,303,000,000"
26183,"Other income taxes","Recoverability of ICMS and PIS/COFINS tax credits",502380,12/31/22,02/27/23,3,"Deloitte & Touche LLP",4,"Deloitte Touche Tohmatsu Auditores Independentes",1045,"São Paulo",D5,BRAZIL,Foreign,6-K,2023-02-28,,"BRAZILIAN DISTRIBUTION CO COMPANHIA BRASILEIRA DE DISTR CBD",1038572,"=""CBDBY""","AV BRIGADEIRO LUIZ ANTONIO","3126 1 ANDAR SP","SAO PAULO",D5,BRAZIL,Foreign,,,"=""5411""","Grocery Stores",445110,"Supermarkets and Other Grocery (except Convenience) Stores",34,3,12/31/22,"836,935,872",12/31/22,"3,281,000,000","-1,000,000","1,801,000,000","8,303,000,000"
26184,"Uncertain tax positions","Provisions and Tax contingencies",502380,12/31/22,02/27/23,3,"Deloitte & Touche LLP",4,"Deloitte Touche Tohmatsu Auditores Independentes",1045,"São Paulo",D5,BRAZIL,Foreign,6-K,2023-02-28,,"BRAZILIAN DISTRIBUTION CO COMPANHIA BRASILEIRA DE DISTR CBD",1038572,"=""CBDBY""","AV BRIGADEIRO LUIZ ANTONIO","3126 1 ANDAR SP","SAO PAULO",D5,BRAZIL,Foreign,,,"=""5411""","Grocery Stores",445110,"Supermarkets and Other Grocery (except Convenience) Stores",34,3,12/31/22,"836,935,872",12/31/22,"3,281,000,000","-1,000,000","1,801,000,000","8,303,000,000"
30966,"Discontinued operations","Discontinued Operations - Discontinuation of Hypermarket Format and Planned Distribution of Subsidiary Éxito to Shareholders - Refer to notes 1.1, 1.2, 32 and 33 to the financial statements",516013,12/31/22,08/16/23,3,"Deloitte & Touche LLP",4,"Deloitte Touche Tohmatsu Auditores Independentes",1045,"São Paulo",D5,BRAZIL,Foreign,20-F,2023-08-16,,"BRAZILIAN DISTRIBUTION CO COMPANHIA BRASILEIRA DE DISTR CBD",1038572,"=""CBDBY""","AV BRIGADEIRO LUIZ ANTONIO","3126 1 ANDAR SP","SAO PAULO",D5,BRAZIL,Foreign,,,"=""5411""","Grocery Stores",445110,"Supermarkets and Other Grocery (except Convenience) Stores",34,3,12/31/22,"836,935,872",12/31/22,"3,281,000,000","-1,000,000","1,801,000,000","8,303,000,000"
30967,"Other income taxes","Recoverability of ICMS and PIS/COFINS Tax Credits - Refer to note 10 to the financial statements",516013,12/31/22,08/16/23,3,"Deloitte & Touche LLP",4,"Deloitte Touche Tohmatsu Auditores Independentes",1045,"São Paulo",D5,BRAZIL,Foreign,20-F,2023-08-16,,"BRAZILIAN DISTRIBUTION CO COMPANHIA BRASILEIRA DE DISTR CBD",1038572,"=""CBDBY""","AV BRIGADEIRO LUIZ ANTONIO","3126 1 ANDAR SP","SAO PAULO",D5,BRAZIL,Foreign,,,"=""5411""","Grocery Stores",445110,"Supermarkets and Other Grocery (except Convenience) Stores",34,3,12/31/22,"836,935,872",12/31/22,"3,281,000,000","-1,000,000","1,801,000,000","8,303,000,000"
30968,"Uncertain tax positions","Provisions and Tax contingencies - Refer to note 21 to the financial statements",516013,12/31/22,08/16/23,3,"Deloitte & Touche LLP",4,"Deloitte Touche Tohmatsu Auditores Independentes",1045,"São Paulo",D5,BRAZIL,Foreign,20-F,2023-08-16,,"BRAZILIAN DISTRIBUTION CO COMPANHIA BRASILEIRA DE DISTR CBD",1038572,"=""CBDBY""","AV BRIGADEIRO LUIZ ANTONIO","3126 1 ANDAR SP","SAO PAULO",D5,BRAZIL,Foreign,,,"=""5411""","Grocery Stores",445110,"Supermarkets and Other Grocery (except Convenience) Stores",34,3,12/31/22,"836,935,872",12/31/22,"3,281,000,000","-1,000,000","1,801,000,000","8,303,000,000"
29310,"Other contingent liabilities","Litigation Contingencies",509525,12/31/22,04/20/23,1,"PricewaterhouseCoopers LLP",91,"PricewaterhouseCoopers Auditores Independentes",1351,"Rio de Janeiro",D5,BRAZIL,Foreign,20-F,2023-04-20,,"BRAZILIAN ELECTRIC POWER CO",1439124,"=""AXIA""","RUA DA QUITANDA, 196, 24TH FLOOR",CENTRO,"RIO DE JANEIRO",D5,BRAZIL,Foreign,,,"=""4911""","Electric Services",221111,"Hydroelectric Power Generation",34,8,12/29/22,"10,272,075,776",12/31/22,"6,453,759,000","689,120,000","5,781,375,000","51,179,973,000"
29311,"Long-lived assets","Assessment of Impairment for fixed assets, intangible and investments in affiliates",509525,12/31/22,04/20/23,1,"PricewaterhouseCoopers LLP",91,"PricewaterhouseCoopers Auditores Independentes",1351,"Rio de Janeiro",D5,BRAZIL,Foreign,20-F,2023-04-20,,"BRAZILIAN ELECTRIC POWER CO",1439124,"=""AXIA""","RUA DA QUITANDA, 196, 24TH FLOOR",CENTRO,"RIO DE JANEIRO",D5,BRAZIL,Foreign,,,"=""4911""","Electric Services",221111,"Hydroelectric Power Generation",34,8,12/29/22,"10,272,075,776",12/31/22,"6,453,759,000","689,120,000","5,781,375,000","51,179,973,000"
29312,"Revenue from customer contracts","Contractual transmission assets - Measurement",509525,12/31/22,04/20/23,1,"PricewaterhouseCoopers LLP",91,"PricewaterhouseCoopers Auditores Independentes",1351,"Rio de Janeiro",D5,BRAZIL,Foreign,20-F,2023-04-20,,"BRAZILIAN ELECTRIC POWER CO",1439124,"=""AXIA""","RUA DA QUITANDA, 196, 24TH FLOOR",CENTRO,"RIO DE JANEIRO",D5,BRAZIL,Foreign,,,"=""4911""","Electric Services",221111,"Hydroelectric Power Generation",34,8,12/29/22,"10,272,075,776",12/31/22,"6,453,759,000","689,120,000","5,781,375,000","51,179,973,000"
29313,"Pension and other post-employment benefits","Post-employment benefits",509525,12/31/22,04/20/23,1,"PricewaterhouseCoopers LLP",91,"PricewaterhouseCoopers Auditores Independentes",1351,"Rio de Janeiro",D5,BRAZIL,Foreign,20-F,2023-04-20,,"BRAZILIAN ELECTRIC POWER CO",1439124,"=""AXIA""","RUA DA QUITANDA, 196, 24TH FLOOR",CENTRO,"RIO DE JANEIRO",D5,BRAZIL,Foreign,,,"=""4911""","Electric Services",221111,"Hydroelectric Power Generation",34,8,12/29/22,"10,272,075,776",12/31/22,"6,453,759,000","689,120,000","5,781,375,000","51,179,973,000"
29314,"Business combinations","Business Combination",509525,12/31/22,04/20/23,1,"PricewaterhouseCoopers LLP",91,"PricewaterhouseCoopers Auditores Independentes",1351,"Rio de Janeiro",D5,BRAZIL,Foreign,20-F,2023-04-20,,"BRAZILIAN ELECTRIC POWER CO",1439124,"=""AXIA""","RUA DA QUITANDA, 196, 24TH FLOOR",CENTRO,"RIO DE JANEIRO",D5,BRAZIL,Foreign,,,"=""4911""","Electric Services",221111,"Hydroelectric Power Generation",34,8,12/29/22,"10,272,075,776",12/31/22,"6,453,759,000","689,120,000","5,781,375,000","51,179,973,000"
29315,"Other revenue","Recognition of intangible assets - New concession contracts",509525,12/31/22,04/20/23,1,"PricewaterhouseCoopers LLP",91,"PricewaterhouseCoopers Auditores Independentes",1351,"Rio de Janeiro",D5,BRAZIL,Foreign,20-F,2023-04-20,,"BRAZILIAN ELECTRIC POWER CO",1439124,"=""AXIA""","RUA DA QUITANDA, 196, 24TH FLOOR",CENTRO,"RIO DE JANEIRO",D5,BRAZIL,Foreign,,,"=""4911""","Electric Services",221111,"Hydroelectric Power Generation",34,8,12/29/22,"10,272,075,776",12/31/22,"6,453,759,000","689,120,000","5,781,375,000","51,179,973,000"
26026,"Allowance for credit losses","Allowance for Credit Losses — Refer to Notes 1 and 3 to the financial statements",501837,12/31/22,02/28/23,3,"Deloitte & Touche LLP",,,,Columbus,OH,OHIO,"US Midwest",10-K,2023-02-28,,"BREAD FINANCIAL HOLDINGS, INC.",1101215,"=""BFH""","3095 LOYALTY CIRCLE",,COLUMBUS,OH,OHIO,"US Midwest",,,"=""6141""","Personal Credit Institutions",518210,"Data Processing, Hosting, and Related Services",34,38,12/31/22,"1,879,234,048",12/31/22,"3,870,000,000","223,000,000","1,466,000,000","25,407,000,000"
29625,"Deferred income taxes","Recoverability of deferred tax assets - income tax and social contribution",510958,12/31/22,04/28/23,4,"KPMG LLP",61,"KPMG Auditores Independentes",1124,"São Paulo",D5,BRAZIL,Foreign,20-F,2023-04-28,,"BRF S.A.",1122491,"=""BRFS""","AV DAS NACOES UNIDAS 14401 22ND-25TH","FLOORS TORRE A2 VILA GERTRUDES 04794-000","SAO PAULO",D5,BRAZIL,Foreign,,,"=""2011""","Meat Packing Plants",311615,"Poultry Processing",34,2,12/29/22,"1,299,957,248",12/31/22,"10,190,829,000","-595,033,000","896,697,000","10,938,659,000"
29626,"Goodwill and intangible assets","Recoverable amount of cash-generating units",510958,12/31/22,04/28/23,4,"KPMG LLP",61,"KPMG Auditores Independentes",1124,"São Paulo",D5,BRAZIL,Foreign,20-F,2023-04-28,,"BRF S.A.",1122491,"=""BRFS""","AV DAS NACOES UNIDAS 14401 22ND-25TH","FLOORS TORRE A2 VILA GERTRUDES 04794-000","SAO PAULO",D5,BRAZIL,Foreign,,,"=""2011""","Meat Packing Plants",311615,"Poultry Processing",34,2,12/29/22,"1,299,957,248",12/31/22,"10,190,829,000","-595,033,000","896,697,000","10,938,659,000"
24966,"Research and development expenses","Research and Development Expenses and Accrued Research and Development Liabilities - Refer to Notes 2 and 9 to the financial statements",500731,12/31/22,02/23/23,3,"Deloitte & Touche LLP",,,,"San Francisco",CA,CALIFORNIA,"US West",10-K,2023-02-23,,"BridgeBio Pharma, Inc.",1743881,"=""BBIO""","3160 PORTER DR.","SUITE 250","PALO ALTO",CA,CALIFORNIA,"US West",,,"=""2834""","Pharmaceutical Preparations",325414,"Biological Product (except Diagnostic) Manufacturing",34,8,12/31/22,"1,147,766,912",12/31/22,"77,648,000","-481,183,000","-1,284,918,000","623,036,000"
26202,"Revenue from customer contracts","Revenue - Refer to Notes 2 and 3 to the financial statements",501790,12/31/22,02/28/23,3,"Deloitte & Touche LLP",,,,Boston,MA,MASSACHUSETTS,"US New England",10-K,2023-02-28,,"BRIGHT HORIZONS FAMILY SOLUTIONS INC.",1437578,"=""BFAM""","2 WELLS AVENUE",,NEWTON,MA,MASSACHUSETTS,"US New England",,,"=""8351""","Child Day Care Services",624410,"Child Day Care Services",34,63,12/31/22,"3,630,214,400",12/31/22,"2,020,487,000","80,641,000","-892,973,000","3,798,869,000"
30412,"Goodwill and intangible assets","Goodwill and indefinite lived intangible assets — Overseas Schools reporting unit — Refer to Notes 2, 8 and 10 to the financial statements",513661,08/31/22,06/21/23,3,"Deloitte & Touche LLP",499,"Deloitte Touche Tohmatsu Certified Public Accountants LLP",1113,Guangzhou,F4,CHINA,Foreign,20-F,2023-06-21,,"Bright Scholar Education Holdings Ltd",1696355,"=""BEDU""","NO.1, COUNTRY GARDEN ROAD","BEIJIAO TOWN, SHUNDE DISTRICT","FOSHAN, GUANGDONG",F4,CHINA,Foreign,,,"=""8200""","Services-Educational Services",611110,"Elementary and Secondary Schools",34,3,09/02/22,"20,593,006",08/31/22,"248,619,000","-102,893,000","-12,607,000","718,475,000"
30413,Leases,"Leases— Overseas Schools segment— Refer to Notes 2 and 15 to the financial statements",513661,08/31/22,06/21/23,3,"Deloitte & Touche LLP",499,"Deloitte Touche Tohmatsu Certified Public Accountants LLP",1113,Guangzhou,F4,CHINA,Foreign,20-F,2023-06-21,,"Bright Scholar Education Holdings Ltd",1696355,"=""BEDU""","NO.1, COUNTRY GARDEN ROAD","BEIJIAO TOWN, SHUNDE DISTRICT","FOSHAN, GUANGDONG",F4,CHINA,Foreign,,,"=""8200""","Services-Educational Services",611110,"Elementary and Secondary Schools",34,3,09/02/22,"20,593,006",08/31/22,"248,619,000","-102,893,000","-12,607,000","718,475,000"
24888,"Revenue from customer contracts","Revenue Recognition – Variable Consideration",500663,12/31/22,02/23/23,2,"Ernst & Young LLP",,,,Boston,MA,MASSACHUSETTS,"US New England",10-K,2023-02-23,,"BRIGHTCOVE INC",1313275,,"281 SUMMER STREET",,BOSTON,MA,MASSACHUSETTS,"US New England",,,"=""7374""","Computer Processing and Data Preparation and Processing Services",511210,"Software Publishers",34,5,12/31/22,"221,305,760",12/31/22,"211,008,000","-9,015,000","17,209,000","227,813,000"
24892,"Insurance contract liabilities","Liability for Future Policy Benefits – Refer to Notes 1 and 3 to the consolidated financial statements",500644,12/31/22,02/23/23,3,"Deloitte & Touche LLP",,,,Charlotte,NC,"NORTH CAROLINA","US Southeast",10-K,2023-02-23,,"Brighthouse Financial, Inc.",1685040,"=""BHF""","11225 N COMMUNITY HOUSE ROAD",,CHARLOTTE,NC,"NORTH CAROLINA","US Southeast",,,"=""6311""","Life Insurance",524113,"Direct Life Insurance Carriers",34,51,12/31/22,"3,500,616,448",12/31/22,"8,473,000,000","5,000,000",,"225,580,000,000"
24893,"Deferred and capitalized costs","Deferred Policy Acquisition Costs (DAC) – Refer to Notes 1 and 4 to the consolidated financial statements",500644,12/31/22,02/23/23,3,"Deloitte & Touche LLP",,,,Charlotte,NC,"NORTH CAROLINA","US Southeast",10-K,2023-02-23,,"Brighthouse Financial, Inc.",1685040,"=""BHF""","11225 N COMMUNITY HOUSE ROAD",,CHARLOTTE,NC,"NORTH CAROLINA","US Southeast",,,"=""6311""","Life Insurance",524113,"Direct Life Insurance Carriers",34,51,12/31/22,"3,500,616,448",12/31/22,"8,473,000,000","5,000,000",,"225,580,000,000"
24894,"Insurance contract liabilities","Embedded Derivative Liabilities Related to Variable Annuity Guarantees – Refer to Notes 1, 7, and 8 to the consolidated financial statements.",500644,12/31/22,02/23/23,3,"Deloitte & Touche LLP",,,,Charlotte,NC,"NORTH CAROLINA","US Southeast",10-K,2023-02-23,,"Brighthouse Financial, Inc.",1685040,"=""BHF""","11225 N COMMUNITY HOUSE ROAD",,CHARLOTTE,NC,"NORTH CAROLINA","US Southeast",,,"=""6311""","Life Insurance",524113,"Direct Life Insurance Carriers",34,51,12/31/22,"3,500,616,448",12/31/22,"8,473,000,000","5,000,000",,"225,580,000,000"
26344,"Insurance contract liabilities","Liability for Future Policy Benefits– Refer to Notes 1 and 3 to the consolidated financial statements",502656,12/31/22,03/01/23,3,"Deloitte & Touche LLP",,,,Charlotte,NC,"NORTH CAROLINA","US Southeast",10-K,2023-03-01,,"BRIGHTHOUSE LIFE INSURANCE Co",733076,,"11225 NORTH COMMUNITY HOUSE ROAD",,CHARLOTTE,NC,"NORTH CAROLINA","US Southeast",1099219,"METLIFE INC","=""6311""","Life Insurance",524113,"Direct Life Insurance Carriers",34,,,,12/31/22,"7,832,000,000","-64,000,000",,"216,151,000,000"
26345,"Deferred and capitalized costs","Deferred Policy Acquisition Costs (DAC) – Refer to Notes 1 and 4 to the consolidated financial statements",502656,12/31/22,03/01/23,3,"Deloitte & Touche LLP",,,,Charlotte,NC,"NORTH CAROLINA","US Southeast",10-K,2023-03-01,,"BRIGHTHOUSE LIFE INSURANCE Co",733076,,"11225 NORTH COMMUNITY HOUSE ROAD",,CHARLOTTE,NC,"NORTH CAROLINA","US Southeast",1099219,"METLIFE INC","=""6311""","Life Insurance",524113,"Direct Life Insurance Carriers",34,,,,12/31/22,"7,832,000,000","-64,000,000",,"216,151,000,000"
26346,"Other debt","Embedded Derivative Liabilities Related to Variable Annuity Guarantees – Refer to Notes 1, 7, and 8 to the consolidated financial statements.",502656,12/31/22,03/01/23,3,"Deloitte & Touche LLP",,,,Charlotte,NC,"NORTH CAROLINA","US Southeast",10-K,2023-03-01,,"BRIGHTHOUSE LIFE INSURANCE Co",733076,,"11225 NORTH COMMUNITY HOUSE ROAD",,CHARLOTTE,NC,"NORTH CAROLINA","US Southeast",1099219,"METLIFE INC","=""6311""","Life Insurance",524113,"Direct Life Insurance Carriers",34,,,,12/31/22,"7,832,000,000","-64,000,000",,"216,151,000,000"
28909,"Insurance contract liabilities","Liability for Future Policy Benefits – Refer to Notes 1 and 3 to the financial statements",508352,12/31/22,03/24/23,3,"Deloitte & Touche LLP",,,,Charlotte,NC,"NORTH CAROLINA","US Southeast","POS AM",2023-04-10,,"BRIGHTHOUSE LIFE INSURANCE Co OF NY",1167609,,"285 MADISON AVENUE, 14TH FLOOR",,"NEW YORK",NY,"NEW YORK","US Mid Atlantic",,,"=""6311""","Life Insurance",524113,"Direct Life Insurance Carriers",33,,,,,,,,
28910,"Deferred and capitalized costs","Deferred Policy Acquisition Costs (DAC) – Refer to Notes 1 and 4 to the financial statements",508352,12/31/22,03/24/23,3,"Deloitte & Touche LLP",,,,Charlotte,NC,"NORTH CAROLINA","US Southeast","POS AM",2023-04-10,,"BRIGHTHOUSE LIFE INSURANCE Co OF NY",1167609,,"285 MADISON AVENUE, 14TH FLOOR",,"NEW YORK",NY,"NEW YORK","US Mid Atlantic",,,"=""6311""","Life Insurance",524113,"Direct Life Insurance Carriers",33,,,,,,,,
28911,"Other debt","Embedded Derivative Liabilities Related to Variable Annuity Guarantees – Refer to Notes 1, 7, and 8 to the financial statements.",508352,12/31/22,03/24/23,3,"Deloitte & Touche LLP",,,,Charlotte,NC,"NORTH CAROLINA","US Southeast","POS AM",2023-04-10,,"BRIGHTHOUSE LIFE INSURANCE Co OF NY",1167609,,"285 MADISON AVENUE, 14TH FLOOR",,"NEW YORK",NY,"NEW YORK","US Mid Atlantic",,,"=""6311""","Life Insurance",524113,"Direct Life Insurance Carriers",33,,,,,,,,
28912,"Insurance contract liabilities","Liability for Future Policy Benefits – Refer to Notes 1 and 3 to the financial statements",508354,12/31/22,03/24/23,3,"Deloitte & Touche LLP",,,,Charlotte,NC,"NORTH CAROLINA","US Southeast","POS AM",2023-04-10,,"BRIGHTHOUSE LIFE INSURANCE Co OF NY",1167609,,"285 MADISON AVENUE, 14TH FLOOR",,"NEW YORK",NY,"NEW YORK","US Mid Atlantic",,,"=""6311""","Life Insurance",524113,"Direct Life Insurance Carriers",33,,,,,,,,
28913,"Deferred and capitalized costs","Deferred Policy Acquisition Costs (DAC) – Refer to Notes 1 and 4 to the financial statements",508354,12/31/22,03/24/23,3,"Deloitte & Touche LLP",,,,Charlotte,NC,"NORTH CAROLINA","US Southeast","POS AM",2023-04-10,,"BRIGHTHOUSE LIFE INSURANCE Co OF NY",1167609,,"285 MADISON AVENUE, 14TH FLOOR",,"NEW YORK",NY,"NEW YORK","US Mid Atlantic",,,"=""6311""","Life Insurance",524113,"Direct Life Insurance Carriers",33,,,,,,,,
28914,"Other debt","Embedded Derivative Liabilities Related to Variable Annuity Guarantees – Refer to Notes 1, 7, and 8 to the financial statements.",508354,12/31/22,03/24/23,3,"Deloitte & Touche LLP",,,,Charlotte,NC,"NORTH CAROLINA","US Southeast","POS AM",2023-04-10,,"BRIGHTHOUSE LIFE INSURANCE Co OF NY",1167609,,"285 MADISON AVENUE, 14TH FLOOR",,"NEW YORK",NY,"NEW YORK","US Mid Atlantic",,,"=""6311""","Life Insurance",524113,"Direct Life Insurance Carriers",33,,,,,,,,
28916,"Insurance contract liabilities","Liability for Future Policy Benefits – Refer to Notes 1 and 3 to the financial statements",508360,12/31/22,03/24/23,3,"Deloitte & Touche LLP",,,,Charlotte,NC,"NORTH CAROLINA","US Southeast","POS AM",2023-04-10,,"BRIGHTHOUSE LIFE INSURANCE Co OF NY",1167609,,"285 MADISON AVENUE, 14TH FLOOR",,"NEW YORK",NY,"NEW YORK","US Mid Atlantic",,,"=""6311""","Life Insurance",524113,"Direct Life Insurance Carriers",33,,,,,,,,
28917,"Deferred and capitalized costs","Deferred Policy Acquisition Costs (DAC) – Refer to Notes 1 and 4 to the financial statements",508360,12/31/22,03/24/23,3,"Deloitte & Touche LLP",,,,Charlotte,NC,"NORTH CAROLINA","US Southeast","POS AM",2023-04-10,,"BRIGHTHOUSE LIFE INSURANCE Co OF NY",1167609,,"285 MADISON AVENUE, 14TH FLOOR",,"NEW YORK",NY,"NEW YORK","US Mid Atlantic",,,"=""6311""","Life Insurance",524113,"Direct Life Insurance Carriers",33,,,,,,,,
28918,"Other debt","Embedded Derivative Liabilities Related to Variable Annuity Guarantees – Refer to Notes 1, 7, and 8 to the financial statements.",508360,12/31/22,03/24/23,3,"Deloitte & Touche LLP",,,,Charlotte,NC,"NORTH CAROLINA","US Southeast","POS AM",2023-04-10,,"BRIGHTHOUSE LIFE INSURANCE Co OF NY",1167609,,"285 MADISON AVENUE, 14TH FLOOR",,"NEW YORK",NY,"NEW YORK","US Mid Atlantic",,,"=""6311""","Life Insurance",524113,"Direct Life Insurance Carriers",33,,,,,,,,
28921,"Insurance contract liabilities","Liability for Future Policy Benefits – Refer to Notes 1 and 3 to the financial statements",508361,12/31/22,03/24/23,3,"Deloitte & Touche LLP",,,,Charlotte,NC,"NORTH CAROLINA","US Southeast","POS AM",2023-04-10,,"BRIGHTHOUSE LIFE INSURANCE Co OF NY",1167609,,"285 MADISON AVENUE, 14TH FLOOR",,"NEW YORK",NY,"NEW YORK","US Mid Atlantic",,,"=""6311""","Life Insurance",524113,"Direct Life Insurance Carriers",33,,,,,,,,
28922,"Deferred and capitalized costs","Deferred Policy Acquisition Costs (DAC) – Refer to Notes 1 and 4 to the financial statements",508361,12/31/22,03/24/23,3,"Deloitte & Touche LLP",,,,Charlotte,NC,"NORTH CAROLINA","US Southeast","POS AM",2023-04-10,,"BRIGHTHOUSE LIFE INSURANCE Co OF NY",1167609,,"285 MADISON AVENUE, 14TH FLOOR",,"NEW YORK",NY,"NEW YORK","US Mid Atlantic",,,"=""6311""","Life Insurance",524113,"Direct Life Insurance Carriers",33,,,,,,,,
28923,"Other debt","Embedded Derivative Liabilities Related to Variable Annuity Guarantees – Refer to Notes 1, 7, and 8 to the financial statements.",508361,12/31/22,03/24/23,3,"Deloitte & Touche LLP",,,,Charlotte,NC,"NORTH CAROLINA","US Southeast","POS AM",2023-04-10,,"BRIGHTHOUSE LIFE INSURANCE Co OF NY",1167609,,"285 MADISON AVENUE, 14TH FLOOR",,"NEW YORK",NY,"NEW YORK","US Mid Atlantic",,,"=""6311""","Life Insurance",524113,"Direct Life Insurance Carriers",33,,,,,,,,
27976,"Insurance contract liabilities","Liability for Future Policy Benefits — Refer to Notes 1 and 3 to the consolidated financial statements",506119,12/31/22,03/24/23,3,"Deloitte & Touche LLP",,,,Tampa,FL,FLORIDA,"US Southeast",N-VPFS,2023-03-24,,"Brighthouse Variable Life Account A",1350943,,"BRIGHTHOUSE LIFE INSURANCE CO","11225 NORTH COMMUNITY HOUSE ROAD",CHARLOTTE,NC,"NORTH CAROLINA","US Southeast",,,,,525990,"Other Financial Vehicles",40,,,,,,,,
27977,"Deferred and capitalized costs","Deferred Policy Acquisition Costs (DAC) — Refer to Notes 1 and 4 to the consolidated financial statements",506119,12/31/22,03/24/23,3,"Deloitte & Touche LLP",,,,Tampa,FL,FLORIDA,"US Southeast",N-VPFS,2023-03-24,,"Brighthouse Variable Life Account A",1350943,,"BRIGHTHOUSE LIFE INSURANCE CO","11225 NORTH COMMUNITY HOUSE ROAD",CHARLOTTE,NC,"NORTH CAROLINA","US Southeast",,,,,525990,"Other Financial Vehicles",40,,,,,,,,
27978,"Derivatives and hedging","Embedded Derivative Liabilities Related to Variable Annuity Guarantees — Refer to Notes 1, 7, and 8 to the consolidated financial statements.",506119,12/31/22,03/24/23,3,"Deloitte & Touche LLP",,,,Tampa,FL,FLORIDA,"US Southeast",N-VPFS,2023-03-24,,"Brighthouse Variable Life Account A",1350943,,"BRIGHTHOUSE LIFE INSURANCE CO","11225 NORTH COMMUNITY HOUSE ROAD",CHARLOTTE,NC,"NORTH CAROLINA","US Southeast",,,,,525990,"Other Financial Vehicles",40,,,,,,,,
24592,"Allowance for credit losses","Allowance for Loan Losses",500135,12/31/22,02/21/23,2,"Ernst & Young LLP",,,,"New York",NY,"NEW YORK","US Mid Atlantic",10-K,2023-02-21,,"BrightSpire Capital, Inc.",1717547,"=""BRSP""","590 MADISON AVENUE","33RD FLOOR","NEW YORK",NY,"NEW YORK","US Mid Atlantic",,,"=""6798""","Real Estate Investment Trusts",525990,"Other Financial Vehicles",34,6,12/31/22,"802,875,520",12/31/22,"96,249,000","94,992,000",,"4,750,389,000"
32087,"Other contingent liabilities","Valuation of self-insurance liabilities",522176,12/31/22,03/30/23,4,"KPMG LLP",,,,Louisville,KY,KENTUCKY,"US Mid Atlantic",DRS,2023-08-28,,"BrightSpring Health Services, Inc.",1865782,"=""BTSG""","805 N. WHITTINGTON PARKWAY",,LOUISVILLE,KY,KENTUCKY,"US Mid Atlantic",,,"=""8082""","Home Health Care Services",621610,"Home Health Care Services",34,,,,12/31/22,"7,720,560,000","-53,907,000","-2,767,861,000","5,441,138,000"
32088,"Other contingent liabilities","Valuation of self-insurance liabilities",522177,12/31/22,03/30/23,4,"KPMG LLP",,,,Louisville,KY,KENTUCKY,"US Mid Atlantic",DRS/A,2023-09-29,,"BrightSpring Health Services, Inc.",1865782,"=""BTSG""","805 N. WHITTINGTON PARKWAY",,LOUISVILLE,KY,KENTUCKY,"US Mid Atlantic",,,"=""8082""","Home Health Care Services",621610,"Home Health Care Services",34,,,,12/31/22,"7,720,560,000","-53,907,000","-2,767,861,000","5,441,138,000"
32089,"Other contingent liabilities","Valuation of self-insurance liabilities",522178,12/31/22,03/30/23,4,"KPMG LLP",,,,Louisville,KY,KENTUCKY,"US Mid Atlantic",DRS/A,2023-11-09,,"BrightSpring Health Services, Inc.",1865782,"=""BTSG""","805 N. WHITTINGTON PARKWAY",,LOUISVILLE,KY,KENTUCKY,"US Mid Atlantic",,,"=""8082""","Home Health Care Services",621610,"Home Health Care Services",34,,,,12/31/22,"7,720,560,000","-53,907,000","-2,767,861,000","5,441,138,000"
32090,"Other contingent liabilities","Valuation of self-insurance liabilities",522179,12/31/22,03/30/23,4,"KPMG LLP",,,,Louisville,KY,KENTUCKY,"US Mid Atlantic",DRS/A,2023-12-18,,"BrightSpring Health Services, Inc.",1865782,"=""BTSG""","805 N. WHITTINGTON PARKWAY",,LOUISVILLE,KY,KENTUCKY,"US Mid Atlantic",,,"=""8082""","Home Health Care Services",621610,"Home Health Care Services",34,,,,12/31/22,"7,720,560,000","-53,907,000","-2,767,861,000","5,441,138,000"
32092,"Other contingent liabilities","Valuation of self-insurance liabilities",522218,12/31/22,03/30/23,4,"KPMG LLP",,,,Louisville,KY,KENTUCKY,"US Mid Atlantic",S-1,2024-01-02,,"BrightSpring Health Services, Inc.",1865782,"=""BTSG""","805 N. WHITTINGTON PARKWAY",,LOUISVILLE,KY,KENTUCKY,"US Mid Atlantic",,,"=""8082""","Home Health Care Services",621610,"Home Health Care Services",34,,,,12/31/22,"7,720,560,000","-53,907,000","-2,767,861,000","5,441,138,000"
32169,"Other contingent liabilities","Valuation of self-insurance liabilities",523119,12/31/22,03/30/23,4,"KPMG LLP",,,,Louisville,KY,KENTUCKY,"US Mid Atlantic",S-1/A,2024-01-17,,"BrightSpring Health Services, Inc.",1865782,"=""BTSG""","805 N. WHITTINGTON PARKWAY",,LOUISVILLE,KY,KENTUCKY,"US Mid Atlantic",,,"=""8082""","Home Health Care Services",621610,"Home Health Care Services",34,,,,12/31/22,"7,720,560,000","-53,907,000","-2,767,861,000","5,441,138,000"
32222,"Other contingent liabilities","Valuation of self-insurance liabilities",523498,12/31/22,03/30/23,4,"KPMG LLP",,,,Louisville,KY,KENTUCKY,"US Mid Atlantic",S-1/A,2024-01-25,,"BrightSpring Health Services, Inc.",1865782,"=""BTSG""","805 N. WHITTINGTON PARKWAY",,LOUISVILLE,KY,KENTUCKY,"US Mid Atlantic",,,"=""8082""","Home Health Care Services",621610,"Home Health Care Services",34,,,,12/31/22,"7,720,560,000","-53,907,000","-2,767,861,000","5,441,138,000"
32230,"Other contingent liabilities","Valuation of self-insurance liabilities",523533,12/31/22,03/30/23,4,"KPMG LLP",,,,Louisville,KY,KENTUCKY,"US Mid Atlantic",424B4,2024-01-26,,"BrightSpring Health Services, Inc.",1865782,"=""BTSG""","805 N. WHITTINGTON PARKWAY",,LOUISVILLE,KY,KENTUCKY,"US Mid Atlantic",,,"=""8082""","Home Health Care Services",621610,"Home Health Care Services",34,,,,12/31/22,"7,720,560,000","-53,907,000","-2,767,861,000","5,441,138,000"
32232,"Other contingent liabilities","Valuation of self-insurance liabilities",523535,12/31/22,03/30/23,4,"KPMG LLP",,,,Louisville,KY,KENTUCKY,"US Mid Atlantic",424B4,2024-01-26,,"BrightSpring Health Services, Inc.",1865782,"=""BTSG""","805 N. WHITTINGTON PARKWAY",,LOUISVILLE,KY,KENTUCKY,"US Mid Atlantic",,,"=""8082""","Home Health Care Services",621610,"Home Health Care Services",34,,,,12/31/22,"7,720,560,000","-53,907,000","-2,767,861,000","5,441,138,000"
25943,"Revenue from customer contracts","Revenue Recognition – Identifying and Evaluating Contractual Terms and Conditions",501976,12/31/22,02/28/23,1,"PricewaterhouseCoopers LLP",,,,Boston,MA,MASSACHUSETTS,"US New England",20-F,2023-02-28,,"Brightstar Lottery PLC",1619762,"=""BRSL""","10 FINSBURY SQUARE","THIRD FLOOR",LONDON,X0,"UNITED KINGDOM",Foreign,,,"=""7990""","Services-Miscellaneous Amusement & Recreation",713290,"Other Gambling Industries",34,23,12/29/22,"4,609,462,272",12/31/22,"2,597,000,000","275,000,000","-4,429,000,000","10,433,000,000"
22902,Goodwill,"Goodwill – Maintenance Reporting Unit – Refer to Notes 2 and 7 to the financial statements",494635,09/30/22,11/17/22,3,"Deloitte & Touche LLP",,,,Philadelphia,PA,PENNSYLVANIA,"US Mid Atlantic",10-K,2022-11-17,,"BrightView Holdings, Inc.",1734713,"=""BV""","980 JOLLY ROAD","SUITE 300","BLUE BELL",PA,PENNSYLVANIA,"US Mid Atlantic",,,"=""0700""","Agricultural services",561730,"Landscaping Services",34,8,09/30/22,"738,419,968",09/30/22,"2,774,600,000","14,000,000","-966,300,000","3,305,500,000"
22173,"Revenue from customer contracts","Assessment of gift card breakage revenue",491158,06/29/22,08/26/22,4,"KPMG LLP",,,,Dallas,TX,TEXAS,"US Southwest",10-K,2022-08-26,,"BRINKER INTERNATIONAL, INC",703351,"=""EAT""","3000 OLYMPUS BLVD.",,DALLAS,TX,TEXAS,"US Southwest",,,"=""5812""","Eating and Drinking Places",722110,"Full-Service Restaurants",34,22,06/30/22,"964,913,984",06/29/22,"3,804,100,000","117,600,000","-490,600,000","2,484,400,000"
26357,Goodwill,"Valuation of goodwill for the Europe reporting unit",502659,12/31/22,03/01/23,4,"KPMG LLP",,,,Richmond,VA,VIRGINIA,"US Mid Atlantic",10-K,2023-03-01,,"BRINKS CO",78890,"=""BCO""","1801 BAYBERRY COURT","P O BOX 18100",RICHMOND,VA,VIRGINIA,"US Mid Atlantic",,,"=""4731""","Arrangement of Transportation of  Freight and Cargo",561613,"Armored Car Services",34,54,12/31/22,"2,486,772,992",12/31/22,"4,535,500,000","170,600,000","-1,539,300,000","6,366,000,000"
23949,"Sales return and allowances","Gross-to-Net U.S. Rebate Accruals for U.S. Medicaid, Medicare Part D, and managed healthcare — Refer to “Note 2 – Revenue” to the financial statements",499383,12/31/22,02/14/23,3,"Deloitte & Touche LLP",,,,Morristown,NJ,"NEW JERSEY","US Mid Atlantic",10-K,2023-02-14,,"BRISTOL MYERS SQUIBB CO",14272,"=""BMY""","ROUTE 206 AND PROVINCE LINE ROAD",,PRINCETON,NJ,"NEW JERSEY","US Mid Atlantic",,,"=""2834""","Pharmaceutical Preparations",325412,"Pharmaceutical Preparation Manufacturing",34,72,12/31/22,"149,296,250,880",12/31/22,"46,159,000,000","6,327,000,000","-25,947,000,000","96,820,000,000"
23950,"Uncertain tax positions","Taxes — Unrecognized Tax Benefit Liabilities for U.S. Transfer Pricing — Refer to “Note 7- Income Taxes” to the financial statements",499383,12/31/22,02/14/23,3,"Deloitte & Touche LLP",,,,Morristown,NJ,"NEW JERSEY","US Mid Atlantic",10-K,2023-02-14,,"BRISTOL MYERS SQUIBB CO",14272,"=""BMY""","ROUTE 206 AND PROVINCE LINE ROAD",,PRINCETON,NJ,"NEW JERSEY","US Mid Atlantic",,,"=""2834""","Pharmaceutical Preparations",325412,"Pharmaceutical Preparation Manufacturing",34,72,12/31/22,"149,296,250,880",12/31/22,"46,159,000,000","6,327,000,000","-25,947,000,000","96,820,000,000"
21361,"Equity investments and joint ventures","Valuation of investment in equity securities",487649,03/31/22,05/31/22,4,"KPMG LLP",,,,Houston,TX,TEXAS,"US Southwest",10-K,2022-05-31,,"Bristow Group Inc.",1525221,"=""VTOL""","3151 BRIARPARK DRIVE, SUITE 700",,HOUSTON,TX,TEXAS,"US Southwest",,,"=""4522""","Air Transportation, Nonscheduled",481111,"Scheduled Passenger Air Transportation",34,37,03/31/22,"1,048,881,984",03/31/22,"1,185,204,000","-53,675,000",,"1,824,279,000"
27023,"Deferred income taxes","Realizability of certain deferred tax assets",504212,12/31/22,03/08/23,4,"KPMG LLP",,,,Houston,TX,TEXAS,"US Southwest",10-KT,2023-03-09,,"Bristow Group Inc.",1525221,"=""VTOL""","3151 BRIARPARK DRIVE, SUITE 700",,HOUSTON,TX,TEXAS,"US Southwest",,,"=""4522""","Air Transportation, Nonscheduled",481111,"Scheduled Passenger Air Transportation",34,,,,,,,,
23724,"Goodwill and intangible assets","Impairment analysis of goodwill and trademarks with indefinite lives arising from the 2017 acquisition of Reynolds American
Inc. (Reynolds American)",499057,12/31/22,02/08/23,4,"KPMG LLP",87,"KPMG LLP",1118,London,X0,"UNITED KINGDOM",Foreign,6-K,2023-02-09,,"British American Tobacco p.l.c.",1303523,"=""BTI""","GLOBE HOUSE","4 TEMPLE PLACE",LONDON,X0,"UNITED KINGDOM",Foreign,,,"=""2111""",Cigarettes,312221,"Cigarette Manufacturing",34,40,12/29/22,"98,215,575,552",12/31/22,"33,266,000,000","8,235,000,000","-64,605,000,000","184,701,000,000"
23725,"Other contingent liabilities","Canadian legal proceedings",499057,12/31/22,02/08/23,4,"KPMG LLP",87,"KPMG LLP",1118,London,X0,"UNITED KINGDOM",Foreign,6-K,2023-02-09,,"British American Tobacco p.l.c.",1303523,"=""BTI""","GLOBE HOUSE","4 TEMPLE PLACE",LONDON,X0,"UNITED KINGDOM",Foreign,,,"=""2111""",Cigarettes,312221,"Cigarette Manufacturing",34,40,12/29/22,"98,215,575,552",12/31/22,"33,266,000,000","8,235,000,000","-64,605,000,000","184,701,000,000"
26692,"Goodwill and intangible assets","Impairment analysis of goodwill and trademarks with indefinite lives arising from the 2017 acquisition of Reynolds American
Inc. (Reynolds American)",502808,12/31/22,02/08/23,4,"KPMG LLP",87,"KPMG LLP",1118,London,X0,"UNITED KINGDOM",Foreign,20-F,2023-03-02,,"British American Tobacco p.l.c.",1303523,"=""BTI""","GLOBE HOUSE","4 TEMPLE PLACE",LONDON,X0,"UNITED KINGDOM",Foreign,,,"=""2111""",Cigarettes,312221,"Cigarette Manufacturing",34,40,12/29/22,"98,215,575,552",12/31/22,"33,266,000,000","8,235,000,000","-64,605,000,000","184,701,000,000"
26693,"Other contingent liabilities","Canadian legal proceedings",502808,12/31/22,02/08/23,4,"KPMG LLP",87,"KPMG LLP",1118,London,X0,"UNITED KINGDOM",Foreign,20-F,2023-03-02,,"British American Tobacco p.l.c.",1303523,"=""BTI""","GLOBE HOUSE","4 TEMPLE PLACE",LONDON,X0,"UNITED KINGDOM",Foreign,,,"=""2111""",Cigarettes,312221,"Cigarette Manufacturing",34,40,12/29/22,"98,215,575,552",12/31/22,"33,266,000,000","8,235,000,000","-64,605,000,000","184,701,000,000"
30753,"Goodwill and intangible assets","Impairment analysis of goodwill and trademarks with indefinite lives arising from the 2017 acquisition of Reynolds American
Inc. (Reynolds American)",515149,12/31/22,02/08/23,4,"KPMG LLP",87,"KPMG LLP",1118,London,X0,"UNITED KINGDOM",Foreign,6-K,2023-07-26,,"British American Tobacco p.l.c.",1303523,"=""BTI""","GLOBE HOUSE","4 TEMPLE PLACE",LONDON,X0,"UNITED KINGDOM",Foreign,,,"=""2111""",Cigarettes,312221,"Cigarette Manufacturing",34,40,12/29/22,"98,215,575,552",12/31/22,"33,266,000,000","8,235,000,000","-64,605,000,000","184,701,000,000"
30754,"Other contingent liabilities","Canadian legal proceedings",515149,12/31/22,02/08/23,4,"KPMG LLP",87,"KPMG LLP",1118,London,X0,"UNITED KINGDOM",Foreign,6-K,2023-07-26,,"British American Tobacco p.l.c.",1303523,"=""BTI""","GLOBE HOUSE","4 TEMPLE PLACE",LONDON,X0,"UNITED KINGDOM",Foreign,,,"=""2111""",Cigarettes,312221,"Cigarette Manufacturing",34,40,12/29/22,"98,215,575,552",12/31/22,"33,266,000,000","8,235,000,000","-64,605,000,000","184,701,000,000"
23916,"Real estate investments","Impairment of Real Estate Assets - Refer to Note 1 and Note 5 to the financial statements",499277,12/31/22,02/13/23,3,"Deloitte & Touche LLP",,,,Philadelphia,PA,PENNSYLVANIA,"US Mid Atlantic",10-K,2023-02-13,,"Brixmor Operating Partnership LP",1630031,,"100 PARK AVENUE",,"NEW YORK",NY,"NEW YORK","US Mid Atlantic",1581068,"Brixmor Property Group Inc.","=""6798""","Real Estate Investment Trusts",531120,"Lessors of Nonresidential Buildings (except Miniwarehouses)",34,,,,12/31/22,"1,218,074,000","354,193,000",,"8,435,003,000"
23913,"Real estate investments","Impairment of Real Estate Assets - Refer to Note 1 and Note 5 to the financial statements",499275,12/31/22,02/13/23,3,"Deloitte & Touche LLP",,,,Philadelphia,PA,PENNSYLVANIA,"US Mid Atlantic",10-K,2023-02-13,,"Brixmor Property Group Inc.",1581068,"=""BRX""","100 PARK AVENUE",,"NEW YORK",NY,"NEW YORK","US Mid Atlantic",,,"=""6798""","Real Estate Investment Trusts",525990,"Other Financial Vehicles",34,23,12/31/22,"6,799,090,176",12/31/22,"1,218,074,000","354,193,000",,"8,435,930,000"
23214,"Uncertain tax positions","Uncertain Tax Positions (UTPs)",495928,10/30/22,12/16/22,1,"PricewaterhouseCoopers LLP",,,,"San Jose",CA,CALIFORNIA,"US West",10-K,2022-12-16,,"Broadcom Inc.",1730168,"=""AVGO""","3421 HILLVIEW AVENUE",,"PALO ALTO",CA,CALIFORNIA,"US West",,,"=""3674""","Semiconductors and Related Devices",334413,"Semiconductor and Related Device Manufacturing",34,470,10/31/22,"196,501,798,912",10/30/22,"33,203,000,000","11,495,000,000","-28,016,000,000","73,249,000,000"
22053,Goodwill,"Goodwill - Refer to Notes 2 and 10 to the financial statements",490760,06/30/22,08/12/22,3,"Deloitte & Touche LLP",,,,"New York",NY,"NEW YORK","US Mid Atlantic",10-K,2022-08-12,,"BROADRIDGE FINANCIAL SOLUTIONS, INC.",1383312,"=""BR""","5 DAKOTA DRIVE",,"LAKE SUCCESS",NY,"NEW YORK","US Mid Atlantic",,,"=""7389""","Business Services, NEC",522320,"Financial Transactions Processing, Reserve, and Clearinghouse Activities",34,143,06/30/22,"16,721,115,136",06/30/22,"5,709,100,000","539,100,000","-2,642,900,000","8,168,900,000"
24895,"Business combinations","Investment in rental property — Refer to Notes 2 and 5 to the financial statements",500698,12/31/22,02/23/23,3,"Deloitte & Touche LLP",,,,Rochester,NY,"NEW YORK","US Mid Atlantic",10-K,2023-02-23,,"Broadstone Net Lease, Inc.",1424182,"=""BNL""","207 HIGH POINT DRIVE",,VICTOR,NY,"NEW YORK","US Mid Atlantic",,,"=""6798""","Real Estate Investment Trusts",525990,"Other Financial Vehicles",34,16,12/31/22,"3,016,908,032",12/31/22,"407,513,000","122,115,000","2,423,564,000","5,457,609,000"
24896,"Long-lived assets","Evaluation of long-lived asset impairment —Refer to Note 2 to the consolidated financial statements ",500698,12/31/22,02/23/23,3,"Deloitte & Touche LLP",,,,Rochester,NY,"NEW YORK","US Mid Atlantic",10-K,2023-02-23,,"Broadstone Net Lease, Inc.",1424182,"=""BNL""","207 HIGH POINT DRIVE",,VICTOR,NY,"NEW YORK","US Mid Atlantic",,,"=""6798""","Real Estate Investment Trusts",525990,"Other Financial Vehicles",34,16,12/31/22,"3,016,908,032",12/31/22,"407,513,000","122,115,000","2,423,564,000","5,457,609,000"
24798,"Property, plant and equipment","Evaluation of Property, Plant and Equipment and Leasehold Intangibles, Net and Operating Lease Right-of-Use Assets for Impairment",500361,12/31/22,02/22/23,2,"Ernst & Young LLP",,,,Chicago,IL,ILLINOIS,"US Midwest",10-K,2023-02-22,,"Brookdale Senior Living Inc.",1332349,"=""BKD""","105 WESTWOOD PLACE","SUITE 400",BRENTWOOD,TN,TENNESSEE,"US Southeast",,,"=""8050""","Services-Nursing & Personal Care Facilities",623312,"Homes for the Elderly",34,3,12/31/22,"511,191,040",12/31/22,"2,825,379,000","-238,427,000","555,284,000","5,937,062,000"
28803,"Equity investments and joint ventures","Accounting for Equity Method Investment in Brookfield Asset Management ULC – Refer to Notes 2 and 3 to the financial statements",507983,12/31/22,03/31/23,3,"Deloitte & Touche LLP",468,"Deloitte LLP",1208,Toronto,A6,ONTARIO,Canada,6-K,2023-04-03,,"Brookfield Asset Management Ltd.",1937926,"=""BAM""","BROOKFIELD PLACE","250 VESEY STREET, 15TH FLOOR","NEW YORK",NY,"NEW YORK","US Mid Atlantic",,,"=""6282""","Investment Advice",541611,"Administrative Management and General Management Consulting Services",34,,,,,,,,
28828,"Equity investments and joint ventures","Accounting for Equity Method Investment in Brookfield Asset Management ULC – Refer to Notes 2 and 3 to the financial statements",507932,12/31/22,03/31/23,3,"Deloitte & Touche LLP",468,"Deloitte LLP",1208,Toronto,A6,ONTARIO,Canada,20-F,2023-04-03,,"Brookfield Asset Management Ltd.",1937926,"=""BAM""","BROOKFIELD PLACE","250 VESEY STREET, 15TH FLOOR","NEW YORK",NY,"NEW YORK","US Mid Atlantic",,,"=""6282""","Investment Advice",541611,"Administrative Management and General Management Consulting Services",34,,,,,,,,
31110,"Equity investments and joint ventures","Accounting for Equity Method Investment in Brookfield Asset Management ULC – Refer to Notes 2 and 3 to the financial statements",516679,12/31/22,03/31/23,3,"Deloitte & Touche LLP",468,"Deloitte LLP",1208,Toronto,A6,ONTARIO,Canada,F-4,2023-09-01,,"Brookfield Asset Management Ltd.",1937926,"=""BAM""","BROOKFIELD PLACE","250 VESEY STREET, 15TH FLOOR","NEW YORK",NY,"NEW YORK","US Mid Atlantic",,,"=""6282""","Investment Advice",541611,"Administrative Management and General Management Consulting Services",34,,,,,,,,
31373,"Equity investments and joint ventures","Accounting for Equity Method Investment in Brookfield Asset Management ULC – Refer to Notes 2 and 3 to the financial statements",518267,12/31/22,03/31/23,3,"Deloitte & Touche LLP",468,"Deloitte LLP",1208,Toronto,A6,ONTARIO,Canada,424B3,2023-10-11,,"Brookfield Asset Management Ltd.",1937926,"=""BAM""","BROOKFIELD PLACE","250 VESEY STREET, 15TH FLOOR","NEW YORK",NY,"NEW YORK","US Mid Atlantic",,,"=""6282""","Investment Advice",541611,"Administrative Management and General Management Consulting Services",34,,,,,,,,
31377,"Equity investments and joint ventures","Accounting for Equity Method Investment in Brookfield Asset Management ULC – Refer to Notes 2 and 3 to the financial statements",518300,12/31/22,03/31/23,3,"Deloitte & Touche LLP",468,"Deloitte LLP",1208,Toronto,A6,ONTARIO,Canada,F-4/A,2023-10-11,,"Brookfield Asset Management Ltd.",1937926,"=""BAM""","BROOKFIELD PLACE","250 VESEY STREET, 15TH FLOOR","NEW YORK",NY,"NEW YORK","US Mid Atlantic",,,"=""6282""","Investment Advice",541611,"Administrative Management and General Management Consulting Services",34,,,,,,,,
27667,"Business combinations","Acquisition of Business – Refer to Notes 2(e) and 3(a) to the financial statements",505490,12/31/22,03/17/23,3,"Deloitte & Touche LLP",468,"Deloitte LLP",1208,Toronto,A6,ONTARIO,Canada,20-F,2023-03-17,,"Brookfield Business Corp",1871130,"=""BBUC""","250 VESEY STREET","15TH FLOOR","NEW YORK",NY,"NEW YORK","US Mid Atlantic",,,"=""1700""","Construction - Special Trade Contractors",561439,"Other Business Service Centers (including Copy Shops)",34,19,12/29/22,"1,389,343,872",12/31/22,"10,598,000,000","1,076,000,000","-15,850,000,000","27,376,000,000"
27668,Goodwill,"Goodwill - Refer to Notes 2(n) and 12 to the financial statements",505490,12/31/22,03/17/23,3,"Deloitte & Touche LLP",468,"Deloitte LLP",1208,Toronto,A6,ONTARIO,Canada,20-F,2023-03-17,,"Brookfield Business Corp",1871130,"=""BBUC""","250 VESEY STREET","15TH FLOOR","NEW YORK",NY,"NEW YORK","US Mid Atlantic",,,"=""1700""","Construction - Special Trade Contractors",561439,"Other Business Service Centers (including Copy Shops)",34,19,12/29/22,"1,389,343,872",12/31/22,"10,598,000,000","1,076,000,000","-15,850,000,000","27,376,000,000"
26874,"Business combinations","Acquisition of Businesses – Refer to Notes 2(e) and 3(a) to the financial statements",503646,12/31/22,03/06/23,3,"Deloitte & Touche LLP",468,"Deloitte LLP",1208,Toronto,A6,ONTARIO,Canada,20-F,2023-03-07,,"Brookfield Business Partners L.P.",1654795,"=""BBU""","73 FRONT STREET, 5TH FLOOR",,HAMILTON,D0,BERMUDA,Foreign,,,"=""1700""","Construction - Special Trade Contractors",325998,"All Other Miscellaneous Chemical Product and Preparation Manufacturing",34,17,12/29/22,"1,863,224,960",12/31/22,"57,385,000,000","240,000,000","-38,024,000,000","89,250,000,000"
31253,"Business combinations","Acquisition of Businesses – Refer to Notes 2(e) and 3(a) to the financial statements",517442,12/31/22,09/26/23,3,"Deloitte & Touche LLP",468,"Deloitte LLP",1208,Toronto,A6,ONTARIO,Canada,6-K,2023-09-26,,"Brookfield Business Partners L.P.",1654795,"=""BBU""","73 FRONT STREET, 5TH FLOOR",,HAMILTON,D0,BERMUDA,Foreign,,,"=""1700""","Construction - Special Trade Contractors",325998,"All Other Miscellaneous Chemical Product and Preparation Manufacturing",34,17,12/29/22,"1,863,224,960",12/31/22,"57,385,000,000","240,000,000","-38,024,000,000","89,250,000,000"
27968,"Property, plant and equipment","Fair Value of Investment Properties and Property, Plant and Equipment – Refer to Notes 2(h)(i), 2(h)(ii), 11, and 12 to the financial statements",506169,12/31/22,03/24/23,3,"Deloitte & Touche LLP",468,"Deloitte LLP",1208,Toronto,A6,ONTARIO,Canada,40-F,2023-03-24,,"BROOKFIELD Corp /ON/",1001085,"=""BN""","BROOKFIELD PLACE, 181 BAY ST, STE 100","PO BOX 762",TORONTO,A6,ONTARIO,Canada,,,"=""6512""","Operators of Nonresidential Buildings",531120,"Lessors of Nonresidential Buildings (except Miniwarehouses)",34,31,12/30/22,"51,609,968,640",12/31/22,"82,067,000,000","5,195,000,000","-23,320,000,000","441,284,000,000"
27979,"Property, plant and equipment","Fair Value of Investment Properties and Property, Plant and Equipment – Refer to Notes 2(h)(i), 2(h)(ii), 11, and 12 to the financial statements
",506121,12/31/22,03/24/23,3,"Deloitte & Touche LLP",468,"Deloitte LLP",1208,Toronto,A6,ONTARIO,Canada,6-K,2023-03-24,,"BROOKFIELD Corp /ON/",1001085,"=""BN""","BROOKFIELD PLACE, 181 BAY ST, STE 100","PO BOX 762",TORONTO,A6,ONTARIO,Canada,,,"=""6512""","Operators of Nonresidential Buildings",531120,"Lessors of Nonresidential Buildings (except Miniwarehouses)",34,31,12/30/22,"51,609,968,640",12/31/22,"82,067,000,000","5,195,000,000","-23,320,000,000","441,284,000,000"
28471,"Going concern","Liquidity and Going Concern — Refer to Note 2 to the financial statements",507589,12/31/22,03/31/23,3,"Deloitte & Touche LLP",,,,"New York",NY,"NEW YORK","US Mid Atlantic",10-K,2023-03-31,,"Brookfield DTLA Fund Office Trust Investor Inc.",1575311,"=""DTLAP""","C/O BROOKFIELD OFFICE PROPERTIES INC.","250 VESEY STREET, 15TH FLOOR","NEW YORK",NY,"NEW YORK","US Mid Atlantic",,,"=""6798""","Real Estate Investment Trusts",531120,"Lessors of Nonresidential Buildings (except Miniwarehouses)",34,,,,12/31/22,"294,815,000","-282,794,000","174,987,000","2,544,169,000"
28472,"Real estate investments","Impairment Review — Refer to Note 2 to the financial statements",507589,12/31/22,03/31/23,3,"Deloitte & Touche LLP",,,,"New York",NY,"NEW YORK","US Mid Atlantic",10-K,2023-03-31,,"Brookfield DTLA Fund Office Trust Investor Inc.",1575311,"=""DTLAP""","C/O BROOKFIELD OFFICE PROPERTIES INC.","250 VESEY STREET, 15TH FLOOR","NEW YORK",NY,"NEW YORK","US Mid Atlantic",,,"=""6798""","Real Estate Investment Trusts",531120,"Lessors of Nonresidential Buildings (except Miniwarehouses)",34,,,,12/31/22,"294,815,000","-282,794,000","174,987,000","2,544,169,000"
27672,"Property, plant and equipment","Revaluation of Property, Plant and Equipment - Refer to Notes 3 and 9 to the financial statements",505510,12/31/22,03/17/23,3,"Deloitte & Touche LLP",468,"Deloitte LLP",1208,Toronto,A6,ONTARIO,Canada,20-F,2023-03-17,,"Brookfield Infrastructure Corp",1788348,"=""BIPC""","250 VESEY STREET, 15TH FLOOR",,"NEW YORK",NY,"NEW YORK","US Mid Atlantic",,,"=""4923""","Natural Gas Transmission and Distribution",486210,"Pipeline Transportation of Natural Gas",34,40,12/29/22,"4,388,625,408",12/31/22,"1,886,000,000","1,619,000,000","-4,484,000,000","10,178,000,000"
27688,"Property, plant and equipment","Revaluation of Property, Plant and Equipment - Refer to Notes 3 and 14 to the financial statements",505472,12/31/22,03/17/23,3,"Deloitte & Touche LLP",468,"Deloitte LLP",1208,Toronto,A6,ONTARIO,Canada,20-F,2023-03-17,,"Brookfield Infrastructure Partners L.P.",1406234,"=""BIP""","73 FRONT STREET",,HAMILTON,D0,BERMUDA,Foreign,,,"=""4400""","Water Transportation",221121,"Electric Bulk Power Transmission and Control",34,31,12/29/22,"14,327,634,944",12/31/22,"14,427,000,000","1,375,000,000","4,025,000,000","72,969,000,000"
27689,"Equity investments and joint ventures","Valuation of Investments in Associates and Joint Ventures - Refer to Notes 3 and 13 to the financial statements",505472,12/31/22,03/17/23,3,"Deloitte & Touche LLP",468,"Deloitte LLP",1208,Toronto,A6,ONTARIO,Canada,20-F,2023-03-17,,"Brookfield Infrastructure Partners L.P.",1406234,"=""BIP""","73 FRONT STREET",,HAMILTON,D0,BERMUDA,Foreign,,,"=""4400""","Water Transportation",221121,"Electric Bulk Power Transmission and Control",34,31,12/29/22,"14,327,634,944",12/31/22,"14,427,000,000","1,375,000,000","4,025,000,000","72,969,000,000"
27786,"Other investments","Valuation of investments which utilize significant unobservable inputs",505685,12/31/22,03/21/23,2,"Ernst & Young LLP",,,,"Los Angeles",CA,CALIFORNIA,"US West",10-K,2023-03-21,,"Brookfield Oaktree Holdings, LLC",1403528,"=""OAK.A""","333 SOUTH GRAND AVENUE","28TH FLOOR","LOS ANGELES",CA,CALIFORNIA,"US West",,,"=""6282""","Investment Advice",523920,"Portfolio Management",34,22,12/29/22,"2,171,933,952",12/31/22,"244,192,000","228,158,000",,"5,654,889,000"
25298,"Property, plant and equipment","Fair Value of Investment Property - Refer to Notes 2(e), 2(v)(v) and 4 to the financial statements",501077,12/31/22,02/24/23,3,"Deloitte & Touche LLP",468,"Deloitte LLP",1208,Toronto,A6,ONTARIO,Canada,20-F,2023-02-24,,"Brookfield Property Partners L.P.",1545772,"=""BPYPM""","73 FRONT STREET",,HAMILTON,D0,BERMUDA,Foreign,,,"=""6500""","Real Estate",531312,"Nonresidential Property Managers",34,14,12/29/22,"105,174,400",12/31/22,"7,365,000,000","996,000,000","7,008,000,000","112,516,000,000"
26379,"Property, plant and equipment","Revaluation of power generating assets",502512,12/31/22,02/28/23,2,"Ernst & Young LLP",192,"Ernst & Young LLP Chartered Accountants",1263,Toronto,A6,ONTARIO,Canada,20-F,2023-03-01,,"Brookfield Renewable Corp",1791863,"=""BEPC""","250 VESEY STREET, 15TH FLOOR",,"NEW YORK",NY,"NEW YORK","US Mid Atlantic",,,"=""4911""","Electric Services",221111,"Hydroelectric Power Generation",34,28,12/29/22,"4,788,975,104",12/31/22,"3,778,000,000","1,850,000,000","-723,000,000","43,288,000,000"
26385,"Property, plant and equipment","Revaluation of power generating assets",502845,12/31/22,02/28/23,2,"Ernst & Young LLP",192,"Ernst & Young LLP Chartered Accountants",1263,Toronto,A6,ONTARIO,Canada,6-K,2023-03-01,,"Brookfield Renewable Partners L.P.",1533232,"=""BEP""","73 FRONT STREET","FIFTH FLOOR",HAMILTON,D0,BERMUDA,Foreign,,,"=""4911""","Electric Services",221111,"Hydroelectric Power Generation",34,25,12/29/22,"7,006,396,416",12/31/22,"4,711,000,000","138,000,000","7,113,000,000","64,111,000,000"
26386,"Business combinations","Significant utility-scale acquisitions",502845,12/31/22,02/28/23,2,"Ernst & Young LLP",192,"Ernst & Young LLP Chartered Accountants",1263,Toronto,A6,ONTARIO,Canada,6-K,2023-03-01,,"Brookfield Renewable Partners L.P.",1533232,"=""BEP""","73 FRONT STREET","FIFTH FLOOR",HAMILTON,D0,BERMUDA,Foreign,,,"=""4911""","Electric Services",221111,"Hydroelectric Power Generation",34,25,12/29/22,"7,006,396,416",12/31/22,"4,711,000,000","138,000,000","7,113,000,000","64,111,000,000"
26387,"Business combinations","Significant distributed generation acquisition",502845,12/31/22,02/28/23,2,"Ernst & Young LLP",192,"Ernst & Young LLP Chartered Accountants",1263,Toronto,A6,ONTARIO,Canada,6-K,2023-03-01,,"Brookfield Renewable Partners L.P.",1533232,"=""BEP""","73 FRONT STREET","FIFTH FLOOR",HAMILTON,D0,BERMUDA,Foreign,,,"=""4911""","Electric Services",221111,"Hydroelectric Power Generation",34,25,12/29/22,"7,006,396,416",12/31/22,"4,711,000,000","138,000,000","7,113,000,000","64,111,000,000"
26526,"Property, plant and equipment","Revaluation of power generating assets",502318,12/31/22,02/28/23,2,"Ernst & Young LLP",192,"Ernst & Young LLP Chartered Accountants",1263,Toronto,A6,ONTARIO,Canada,20-F,2023-03-01,,"Brookfield Renewable Partners L.P.",1533232,"=""BEP""","73 FRONT STREET","FIFTH FLOOR",HAMILTON,D0,BERMUDA,Foreign,,,"=""4911""","Electric Services",221111,"Hydroelectric Power Generation",34,25,12/29/22,"7,006,396,416",12/31/22,"4,711,000,000","138,000,000","7,113,000,000","64,111,000,000"
26527,"Business combinations","Significant utility-scale acquisitions",502318,12/31/22,02/28/23,2,"Ernst & Young LLP",192,"Ernst & Young LLP Chartered Accountants",1263,Toronto,A6,ONTARIO,Canada,20-F,2023-03-01,,"Brookfield Renewable Partners L.P.",1533232,"=""BEP""","73 FRONT STREET","FIFTH FLOOR",HAMILTON,D0,BERMUDA,Foreign,,,"=""4911""","Electric Services",221111,"Hydroelectric Power Generation",34,25,12/29/22,"7,006,396,416",12/31/22,"4,711,000,000","138,000,000","7,113,000,000","64,111,000,000"
26528,"Business combinations","Significant distributed generation acquisition",502318,12/31/22,02/28/23,2,"Ernst & Young LLP",192,"Ernst & Young LLP Chartered Accountants",1263,Toronto,A6,ONTARIO,Canada,20-F,2023-03-01,,"Brookfield Renewable Partners L.P.",1533232,"=""BEP""","73 FRONT STREET","FIFTH FLOOR",HAMILTON,D0,BERMUDA,Foreign,,,"=""4911""","Electric Services",221111,"Hydroelectric Power Generation",34,25,12/29/22,"7,006,396,416",12/31/22,"4,711,000,000","138,000,000","7,113,000,000","64,111,000,000"
28771,"Business combinations","American National Insurance Company Acquisition – Future policy benefits – Refer to Notes 2 and 3 to the financial statements",507193,12/31/22,03/31/23,3,"Deloitte & Touche LLP",468,"Deloitte LLP",1208,Toronto,A6,ONTARIO,Canada,20-F,2023-03-31,,"Brookfield Wealth Solutions Ltd.",1837429,"=""BNT""","IDEATION HOUSE, 1ST FLOOR","94 PITTS BAY ROAD",PEMBROKE,D0,BERMUDA,Foreign,,,"=""6399""","Insurance Carriers, NEC",524126,"Direct Property and Casualty Insurance Carriers",34,,,,12/31/22,"4,309,000,000","501,000,000","4,084,000,000","43,458,000,000"
28772,"Pension and other post-employment benefits","Future Policy Benefits — Refer to Notes 2(aa) and 13 to the financial statements",507193,12/31/22,03/31/23,3,"Deloitte & Touche LLP",468,"Deloitte LLP",1208,Toronto,A6,ONTARIO,Canada,20-F,2023-03-31,,"Brookfield Wealth Solutions Ltd.",1837429,"=""BNT""","IDEATION HOUSE, 1ST FLOOR","94 PITTS BAY ROAD",PEMBROKE,D0,BERMUDA,Foreign,,,"=""6399""","Insurance Carriers, NEC",524126,"Direct Property and Casualty Insurance Carriers",34,,,,12/31/22,"4,309,000,000","501,000,000","4,084,000,000","43,458,000,000"
30539,"Insurance contract liabilities","American National Insurance Group Acquisition - Future policy benefits – Refer to Notes 2 and 3 to the financial statements",514028,12/31/22,06/26/23,3,"Deloitte & Touche LLP",468,"Deloitte LLP",1208,Toronto,A6,ONTARIO,Canada,6-K,2023-06-28,,"Brookfield Wealth Solutions Ltd.",1837429,"=""BNT""","IDEATION HOUSE, 1ST FLOOR","94 PITTS BAY ROAD",PEMBROKE,D0,BERMUDA,Foreign,,,"=""6399""","Insurance Carriers, NEC",524126,"Direct Property and Casualty Insurance Carriers",34,,,,12/31/22,"4,309,000,000","501,000,000","4,084,000,000","43,458,000,000"
30540,"Insurance contract liabilities","Future Policy Benefits — Long Duration Targeted Improvements - Refer to Notes 2 and 16 to the financial statements",514028,12/31/22,06/26/23,3,"Deloitte & Touche LLP",468,"Deloitte LLP",1208,Toronto,A6,ONTARIO,Canada,6-K,2023-06-28,,"Brookfield Wealth Solutions Ltd.",1837429,"=""BNT""","IDEATION HOUSE, 1ST FLOOR","94 PITTS BAY ROAD",PEMBROKE,D0,BERMUDA,Foreign,,,"=""6399""","Insurance Carriers, NEC",524126,"Direct Property and Casualty Insurance Carriers",34,,,,12/31/22,"4,309,000,000","501,000,000","4,084,000,000","43,458,000,000"
25706,"Allowance for credit losses","Assessment of the collective allowance for credit losses",501541,12/31/22,02/27/23,4,"KPMG LLP",,,,Boston,MA,MASSACHUSETTS,"US New England",10-K,2023-02-27,,"BROOKLINE BANCORP INC",1049782,"=""BRKL""","131 CLARENDON STREET",,BOSTON,MA,MASSACHUSETTS,"US New England",,,"=""6035""","Savings Institutions, Federally Chartered",522120,"Savings Institutions",34,14,12/31/22,"1,087,345,920",12/31/22,"319,491,000","109,744,000","829,917,000","9,185,836,000"
25770,"Business combinations","Earn-out obligation — Refer to Notes 1 (Goodwill and Amortizable Intangible Assets) and 3 (Business Combinations) to the financial statements ",501682,12/31/22,02/27/23,3,"Deloitte & Touche LLP",,,,Tampa,FL,FLORIDA,"US Southeast",10-K,2023-02-27,,"BROWN & BROWN, INC.",79282,"=""BRO""","300 N. BEACH STREET",,"DAYTONA BEACH",FL,FLORIDA,"US Southeast",,,"=""6411""","Insurance Agents, Brokers, and Service",524210,"Insurance Agencies and Brokerages",34,57,12/31/22,"16,133,904,384",12/31/22,"3,573,400,000","671,800,000","-3,662,800,000","13,973,500,000"
21521,"Other intangible assets","Valuation of Other Intangible Assets with Indefinite Lives",488541,04/30/22,06/17/22,2,"Ernst & Young LLP",,,,Louisville,KY,KENTUCKY,"US Mid Atlantic",10-K,2022-06-17,,"BROWN FORMAN CORP",14693,"=""BF.B""","850 DIXIE HWY",,LOUISVILLE,KY,KENTUCKY,"US Mid Atlantic",,,"=""2080""",Beverages,312140,Distilleries,34,65,05/02/22,"20,235,839,488",04/30/22,"3,933,000,000","838,000,000","1,390,000,000","6,373,000,000"
19107,"Revenue from customer contracts","Revenue — Refer to Note 2 and 22 to the Financial Statements",480664,01/31/22,03/24/22,3,"Deloitte & Touche LLP",486,"Deloitte srl",1208,Montreal,A8,QUEBEC,Canada,40-F,2022-03-25,,"BRP Inc.",1748797,"=""DOOO""","726 SAINT-JOSEPH STREET",,VALCOURT,A8,QUEBEC,Canada,,,"=""3790""","Miscellaneous Transportation Equipment",336999,"All Other Transportation Equipment Manufacturing",34,82,02/02/22,"3,500,097,536",01/31/22,"6,013,400,000","624,800,000","-493,600,000","3,955,700,000"
27349,"Equity investments and joint ventures","Joint Venture Consolidation Assessment",505018,12/31/22,03/15/23,2,"Ernst & Young LLP",,,,"New York",NY,"NEW YORK","US Mid Atlantic",10-K,2023-03-15,,"BRT Apartments Corp.",14846,"=""BRT""","60 CUTTER MILL RD","SUITE 303","GREAT NECK",NY,"NEW YORK","US Mid Atlantic",,,"=""6798""","Real Estate Investment Trusts",531110,"Lessors of Residential Buildings and Dwellings",34,20,12/31/22,"353,637,824",12/31/22,"70,527,000","49,955,000",,"732,118,000"
24965,"Revenue from customer contracts","Identification of performance obligations in the Company’s revenue agreements with customers",500744,12/31/22,02/23/23,4,"KPMG LLP",,,,"San Francisco",CA,CALIFORNIA,"US West",10-K,2023-02-23,,"Bruker Cellular Analysis, Inc.",1689657,,"5858 HORTON STREET","SUITE 320",EMERYVILLE,CA,CALIFORNIA,"US West",,,"=""3826""","Laboratory Analytical Instruments",334516,"Analytical Laboratory Instrument Manufacturing",34,3,12/31/22,"193,413,056",12/31/22,"78,595,000","-98,040,000",,"226,094,000"
26415,"Revenue from customer contracts","Revenue Recognition – System Sales",502360,12/31/22,02/28/23,1,"PricewaterhouseCoopers LLP",,,,Boston,MA,MASSACHUSETTS,"US New England",10-K,2023-03-01,,"BRUKER CORP",1109354,"=""BRKR""","40 MANNING RD",,BILLERICA,MA,MASSACHUSETTS,"US New England",,,"=""3826""","Laboratory Analytical Instruments",334516,"Analytical Laboratory Instrument Manufacturing",34,68,12/31/22,"10,049,032,192",12/31/22,"2,530,700,000","296,600,000","391,400,000","3,611,800,000"
24212,"Goodwill and intangible assets","Navico Reporting Unit Goodwill and Trade Name Intangible Asset Impairment – Refer to Notes 1 and 10 to the financial statements",499711,12/31/22,02/16/23,3,"Deloitte & Touche LLP",,,,Chicago,IL,ILLINOIS,"US Midwest",10-K,2023-02-16,,"BRUNSWICK CORP",14930,"=""BC""","26125 N. RIVERWOODS BLVD. SUITE 500",,METTAWA,IL,ILLINOIS,"US Midwest",,,"=""3510""","Engines & Turbines",333618,"Other Engine Equipment Manufacturing",34,72,12/31/22,"5,143,989,248",12/31/22,"6,812,200,000","677,000,000","77,300,000","6,321,300,000"
19457,Inventory,"Inventory – Adjustment to Inventory for Markdowns and Obsolescence – Refer to Note A to the financial statements",481609,01/29/22,03/30/22,3,"Deloitte & Touche LLP",,,,Omaha,NE,NEBRASKA,"US Midwest",10-K,2022-03-30,,"BUCKLE INC",885245,"=""BKE""","2407 W 24TH ST",,KEARNEY,NE,NEBRASKA,"US Midwest",,,"=""5651""","Family Clothing Stores",448110,"Men's Clothing Stores",34,38,01/31/22,"1,871,786,368",01/29/22,"1,294,607,000","254,820,000",,"780,884,000"
29700,"Long-lived assets","Impairment of Property, plant, equipment and development cost",510949,12/31/22,04/28/23,2,"Ernst & Young LLP",846,"Tanaka Valdivia & Asociados Sociedad Civil de Responsabilidad Limitada",1315,Lima,R5,PERU,Foreign,20-F,2023-05-01,,"BUENAVENTURA MINING CO INC",1013131,"=""BVN""","AVE CARLOS VILLARAN 790",,LIMA,R5,PERU,Foreign,,,"=""1000""","Metal mining",212221,"Gold Ore Mining",34,8,12/29/22,"1,913,012,480",12/31/22,"824,802,000","602,935,000",,"4,503,227,000"
29701,"Uncertain tax positions","Receivables related to uncertain tax positions",510949,12/31/22,04/28/23,2,"Ernst & Young LLP",846,"Tanaka Valdivia & Asociados Sociedad Civil de Responsabilidad Limitada",1315,Lima,R5,PERU,Foreign,20-F,2023-05-01,,"BUENAVENTURA MINING CO INC",1013131,"=""BVN""","AVE CARLOS VILLARAN 790",,LIMA,R5,PERU,Foreign,,,"=""1000""","Metal mining",212221,"Gold Ore Mining",34,8,12/29/22,"1,913,012,480",12/31/22,"824,802,000","602,935,000",,"4,503,227,000"
20183,"Revenue from customer contracts","Revenue recognition - gift card breakage",483395,01/29/22,04/14/22,2,"Ernst & Young LLP",,,,"Saint Louis",MO,MISSOURI,"US Southeast",10-K,2022-04-14,,"BUILD-A-BEAR WORKSHOP INC",1113809,"=""BBW""","415 S. 18TH STREET, SUITE 200",,"ST LOUIS",MO,MISSOURI,"US Southeast",,,"=""5945""","Hobby, Toy, and Game Shops",339931,"Doll and Stuffed Toy Manufacturing",34,18,01/31/22,"288,050,560",01/29/22,"411,522,000","47,265,000",,"266,324,000"
25880,Goodwill,"Goodwill Impairment Test - West Geographic Reporting Unit ",501915,12/31/22,02/28/23,1,"PricewaterhouseCoopers LLP",,,,Dallas,TX,TEXAS,"US Southwest",10-K,2023-02-28,,"Builders FirstSource, Inc.",1316835,"=""BLDR""","6031 CONNECTION DR., STE. 400",,IRVING,TX,TEXAS,"US Southwest",,,"=""5211""","Lumber and Other Building Materials Dealers",238290,"Other Building Equipment Contractors",34,65,12/31/22,"9,009,496,064",12/31/22,"22,726,418,000","2,749,369,000","-45,232,000","10,595,160,000"
25891,"Other intangible assets","Indefinite-lived intangible asset impairment assessment – Badoo brand",501970,12/31/22,02/28/23,2,"Ernst & Young LLP",,,,Austin,TX,TEXAS,"US Southwest",10-K,2023-02-28,,"Bumble Inc.",1830043,"=""BMBL""","1105 WEST 41ST STREET",,AUSTIN,TX,TEXAS,"US Southwest",,,"=""7370""","Services-Computer Programming, Data Processing, Etc.",511210,"Software Publishers",34,21,12/31/22,"2,731,749,120",12/31/22,"903,503,000","-79,746,000","-1,476,383,000","3,692,621,000"
25892,"Uncertain tax positions","Measurement of the Tax Receivable Agreement Liability",501970,12/31/22,02/28/23,2,"Ernst & Young LLP",,,,Austin,TX,TEXAS,"US Southwest",10-K,2023-02-28,,"Bumble Inc.",1830043,"=""BMBL""","1105 WEST 41ST STREET",,AUSTIN,TX,TEXAS,"US Southwest",,,"=""7370""","Services-Computer Programming, Data Processing, Etc.",511210,"Software Publishers",34,21,12/31/22,"2,731,749,120",12/31/22,"903,503,000","-79,746,000","-1,476,383,000","3,692,621,000"
25455,Inventory,"Readily Marketable Inventories and Physically Settled Forward Purchase and Sale Contracts - Refer to Notes 1 and 16 to the financial statements",501015,12/31/22,02/24/23,3,"Deloitte & Touche LLP",,,,"Saint Louis",MO,MISSOURI,"US Southeast",10-K,2023-02-24,,BUNGELTD,1144519,,"1391 TIMBERLAKE MANOR PARKWAY",,CHESTERFIELD,MO,MISSOURI,"US Southeast",,,"=""2070""","Fats & Oils",311225,"Fats and Oils Refining and Blending",34,100,12/29/22,"14,948,557,824",12/31/22,"67,232,000,000","1,610,000,000","8,398,000,000","24,580,000,000"
21940,"Other investments","Assessment of objective evidence of impairment of the investment in Merit Functional Foods Corporation",490307,03/31/22,06/27/22,1,"PricewaterhouseCoopers LLP",191,"PricewaterhouseCoopers LLP Chartered Accountants",271,Vancouver,A1,"BRITISH COLUMBIA",Canada,20-F,2022-08-01,,"Burcon NutraScience Corp",1158399,,"1946 WEST BROADWAY",,VANCOUVER,A1,"BRITISH COLUMBIA",Canada,,,"=""2020""","Dairy Products",311999,"All Other Miscellaneous Food Manufacturing",34,1,03/31/22,,03/31/22,"135,437",,,"23,181,979"
29935,"Other investments","Valuation of capital provision assets",512111,12/31/22,05/16/23,2,"Ernst & Young LLP",57,"Ernst & Young LLP",1438,Guernsey,X0,"UNITED KINGDOM",Foreign,20-F,2023-05-16,,"Burford Capital Ltd",1714174,"=""BUR""","OAK HOUSE","HIRZEL STREET","ST PETER PORT",Y7,GUERNSEY,Foreign,,,"=""6199""","Finance Services",523110,"Investment Banking and Securities Dealing",34,8,12/29/22,"1,765,542,016",12/31/22,"241,838,000","30,506,000","1,608,672,000","4,288,359,000"
25785,"Deferred and capitalized costs","Property and Equipment – Self Constructed Assets – Appropriate Capitalization of Costs – Refer to Notes 2 and 7 to the financial statements.",501437,12/31/22,02/27/23,3,"Deloitte & Touche LLP",,,,"Fort Worth",TX,TEXAS,"US Southwest",10-K,2023-02-27,,"BURLINGTON NORTHERN SANTA FE, LLC",934612,"=""BNI""","2650 LOU MENK DR",,"FT WORTH",TX,TEXAS,"US Southwest",1067983,"BERKSHIRE HATHAWAY INC","=""4011""","Railroads, Line-haul Operating",482111,"Line-Haul Railroads",34,,,,12/31/22,"25,888,000,000","5,946,000,000","32,384,000,000","92,611,000,000"
18646,Inventory,"Retail Inventory Method—Impact of Markdowns—Refer to Note 1 to the financial statements",479737,01/29/22,03/16/22,3,"Deloitte & Touche LLP",,,,Parsippany,NJ,"NEW JERSEY","US Mid Atlantic",10-K,2022-03-16,,"Burlington Stores, Inc.",1579298,"=""BURL""","1830 ROUTE 130 NORTH",,BURLINGTON,NJ,"NEW JERSEY","US Mid Atlantic",,,"=""5311""","Department Stores",448140,"Family Clothing Stores",34,237,01/31/22,"15,753,843,712",01/29/22,"9,322,256,000","408,839,000","475,353,000","7,089,513,000"
29309,"Revenue from customer contracts","Revenue recognition – determining the standalone selling price of the Company’s performance obligation for in-hospital business",509506,12/31/22,04/20/23,2,"Ernst & Young LLP",211,"Ernst & Young Hua Ming LLP",1408,Guangzhou,F4,CHINA,Foreign,20-F,2023-04-20,,"Burning Rock Biotech Ltd",1792267,"=""BNR""","NO. 5 XINGDAO RING ROAD NORTH,","INTERNATIONAL BIO ISLAND","GUANGZHOU, GUANGDONG",F4,CHINA,Foreign,,,"=""8071""","Medical Laboratories",621511,"Medical Laboratories",34,2,12/29/22,"190,491,280",12/31/22,"81,022,000","-139,712,000","166,341,000","228,357,000"
27948,"Other contingent liabilities","Purchase Commitments - Note 19 Commitments and Contingencies",506038,12/31/22,03/23/23,3,"Deloitte & Touche LLP",,,,"New York",NY,"NEW YORK","US Mid Atlantic",10-K,2023-03-23,,"Butterfly Network, Inc.",1804176,"=""BFLY""","1600 DISTRICT AVENUE",,BURLINGTON,MA,MASSACHUSETTS,"US New England",,,"=""3844""","X-Ray Apparatus and Tubes and Related Irradiation Apparatus",511210,"Software Publishers",34,2,12/31/22,"429,171,488",12/31/22,"73,390,000","-168,723,000",,"417,570,000"
29775,"Other contingent liabilities","Purchase Commitments - Note 19 Commitments and Contingencies",511304,12/31/22,03/23/23,3,"Deloitte & Touche LLP",,,,"New York",NY,"NEW YORK","US Mid Atlantic","POS AM",2023-05-02,,"Butterfly Network, Inc.",1804176,"=""BFLY""","1600 DISTRICT AVENUE",,BURLINGTON,MA,MASSACHUSETTS,"US New England",,,"=""3844""","X-Ray Apparatus and Tubes and Related Irradiation Apparatus",511210,"Software Publishers",34,2,12/31/22,"429,171,488",12/31/22,"73,390,000","-168,723,000",,"417,570,000"
30887,"Other contingent liabilities","Purchase Commitments - Note 19 Commitments and Contingencies",515747,12/31/22,03/23/23,3,"Deloitte & Touche LLP",,,,"New York",NY,"NEW YORK","US Mid Atlantic","POS AM",2023-08-08,,"Butterfly Network, Inc.",1804176,"=""BFLY""","1600 DISTRICT AVENUE",,BURLINGTON,MA,MASSACHUSETTS,"US New England",,,"=""3844""","X-Ray Apparatus and Tubes and Related Irradiation Apparatus",511210,"Software Publishers",34,2,12/31/22,"429,171,488",12/31/22,"73,390,000","-168,723,000",,"417,570,000"
38627,"Revenue from customer contracts","Sufficiency of audit evidence on determining the timing of cargo sales revenue recognition",537566,12/31/22,01/05/24,4,"KPMG LLP",81,"KPMG LLP",1051,Singapore,U0,SINGAPORE,Foreign,DRS,2024-01-05,,"BW LPG Ltd",1649313,"=""BWLP""","10 PASIR PANJANG ROAD",#17-02,"MAPLETREE BUSINESS CITY",U0,SINGAPORE,Foreign,,,"=""4700""","Transportation Services",0,,34,,,,,,,,
25061,"Revenue from customer contracts","Revenue Recognition – Estimating Costs at Completion – Refer to Note 1 and Note 3 to the Financial Statements.",500717,12/31/22,02/23/23,3,"Deloitte & Touche LLP",,,,Charlotte,NC,"NORTH CAROLINA","US Southeast",10-K,2023-02-23,,"BWX Technologies, Inc.",1486957,"=""BWXT""","800 MAIN STREET","4TH FLOOR",LYNCHBURG,VA,VIRGINIA,"US Mid Atlantic",,,"=""3510""","Engines & Turbines",332410,"Power Boiler and Heat Exchanger Manufacturing",34,58,12/31/22,"5,300,048,384",12/31/22,"2,232,834,000","238,191,000","261,533,000","2,618,939,000"
25698,"Long-lived assets","Assessment of Impairment Indicators of Long-Lived Assets and Investments in Unconsolidated Joint Ventures",501538,12/31/22,02/27/23,1,"PricewaterhouseCoopers LLP",,,,Boston,MA,MASSACHUSETTS,"US New England",10-K,2023-02-27,,"BXP, Inc.",1037540,"=""BXP""","800 BOYLSTON STREET","SUITE 1900",BOSTON,MA,MASSACHUSETTS,"US New England",,,"=""6798""","Real Estate Investment Trusts",531120,"Lessors of Nonresidential Buildings (except Miniwarehouses)",34,68,12/31/22,"10,593,696,768",12/31/22,"3,108,581,000","848,947,000",,"24,207,669,000"
25699,"Property, plant and equipment","Purchase Price Allocation for Long-Lived Asset Property Acquisitions",501538,12/31/22,02/27/23,1,"PricewaterhouseCoopers LLP",,,,Boston,MA,MASSACHUSETTS,"US New England",10-K,2023-02-27,,"BXP, Inc.",1037540,"=""BXP""","800 BOYLSTON STREET","SUITE 1900",BOSTON,MA,MASSACHUSETTS,"US New England",,,"=""6798""","Real Estate Investment Trusts",531120,"Lessors of Nonresidential Buildings (except Miniwarehouses)",34,68,12/31/22,"10,593,696,768",12/31/22,"3,108,581,000","848,947,000",,"24,207,669,000"
24395,"Revenue from customer contracts","Revenue Recognition — Refer to Notes 1 and 10 to the financial statements",499896,12/31/22,02/17/23,3,"Deloitte & Touche LLP",,,,Minneapolis,MN,MINNESOTA,"US Midwest",10-K,2023-02-17,,"C. H. ROBINSON WORLDWIDE, INC.",1043277,"=""CHRW""","14701 CHARLSON ROAD",,"EDEN PRAIRIE",MN,MINNESOTA,"US Midwest",,,"=""4731""","Arrangement of Transportation of  Freight and Cargo",488510,"Freight Transportation Arrangement",34,92,12/31/22,"10,650,533,888",12/31/22,"24,696,625,000","940,524,000","-181,417,000","5,954,564,000"
21565,"Revenue from customer contracts","Revenue — Refer to Notes 1 and 2 to the financial statements",488706,04/30/22,06/22/22,3,"Deloitte & Touche LLP",,,,"San Jose",CA,CALIFORNIA,"US West",10-K,2022-06-23,,"C3.ai, Inc.",1577526,"=""AI""","1400 SEAPORT BLVD",,"REDWOOD CITY",CA,CALIFORNIA,"US West",,,"=""7372""","Prepackaged Software",334611,"Software Reproducing",34,17,04/30/22,"1,745,298,432",04/30/22,"252,759,000","-192,065,000","988,852,000","1,170,882,000"
21566,"Related party transactions","Related Party Transactions – Revenue Transactions with Baker Hughes Company — Refer to Note 13 to the financial statements",488706,04/30/22,06/22/22,3,"Deloitte & Touche LLP",,,,"San Jose",CA,CALIFORNIA,"US West",10-K,2022-06-23,,"C3.ai, Inc.",1577526,"=""AI""","1400 SEAPORT BLVD",,"REDWOOD CITY",CA,CALIFORNIA,"US West",,,"=""7372""","Prepackaged Software",334611,"Software Reproducing",34,17,04/30/22,"1,745,298,432",04/30/22,"252,759,000","-192,065,000","988,852,000","1,170,882,000"
24875,"Revenue from customer contracts","Evaluation of revenue recognition for certain research and development services",500638,12/31/22,02/23/23,4,"KPMG LLP",,,,Boston,MA,MASSACHUSETTS,"US New England",10-K,2023-02-23,,"C4 Therapeutics, Inc.",1662579,"=""CCCC""","490 ARSENAL WAY","SUITE 120",WATERTOWN,MA,MASSACHUSETTS,"US New England",,,"=""2836""","Biological Products, Except Diagnostic Substances",325414,"Biological Product (except Diagnostic) Manufacturing",34,6,12/31/22,"288,900,672",12/31/22,"31,096,000","-128,175,000",,"430,840,000"
25478,"Deferred and capitalized costs","Capitalization of Internal Labor Costs",500952,12/31/22,02/23/23,1,"PricewaterhouseCoopers LLP",,,,Phoenix,AZ,ARIZONA,"US Southwest",10-K,2023-02-24,,"Cable One, Inc.",1632127,"=""CABO""","210 E. EARLL DRIVE",,PHOENIX,AZ,ARIZONA,"US Southwest",,,"=""4841""","Cable and Other Pay Television Services",515210,"Cable and Other Subscription Programming",34,712,12/31/22,"4,104,592,640",12/31/22,"1,706,043,000","213,057,000","-1,858,620,000","6,886,147,000"
25479,"Equity investments and joint ventures","Fair Value of Options Associated with the Mega Broadband Investment",500952,12/31/22,02/23/23,1,"PricewaterhouseCoopers LLP",,,,Phoenix,AZ,ARIZONA,"US Southwest",10-K,2023-02-24,,"Cable One, Inc.",1632127,"=""CABO""","210 E. EARLL DRIVE",,PHOENIX,AZ,ARIZONA,"US Southwest",,,"=""4841""","Cable and Other Pay Television Services",515210,"Cable and Other Subscription Programming",34,712,12/31/22,"4,104,592,640",12/31/22,"1,706,043,000","213,057,000","-1,858,620,000","6,886,147,000"
23005,"Other contingent liabilities","Commitments and Contingencies — Respirator Liabilities — Refer to Note S to the consolidated financial statements

",494869,09/30/22,11/23/22,3,"Deloitte & Touche LLP",,,,Boston,MA,MASSACHUSETTS,"US New England",10-K,2022-11-23,,"CABOT CORP",16040,"=""CBT""","TWO SEAPORT LANE SUITE 1400",,BOSTON,MA,MASSACHUSETTS,"US New England",,,"=""2890""","Miscellaneous Chemical Products",325211,"Plastics Material and Resin Manufacturing",34,64,09/30/22,"3,593,720,320",09/30/22,"4,321,000,000","209,000,000","706,000,000","3,525,000,000"
