"CAM Key","CAM Topic","CAM Company Title","Audit Opinion Key","Year Ended Date","Signature Date","Auditor Key",Auditor,"Auditor Affiliate Key","Auditor Affiliate","Auditor Affiliate PCAOB","Auditor City","Auditor State Code","Auditor State Name","Auditor State Region",Source,"Source Date","Going Concern",Company,"CIK Code",Ticker,"Bus Street 1","Bus Street 2",City,"State Code","State Name","State Region","Parent CIK","Parent Name","SIC Code","SIC Description","NAICS Code","NAICS Description","Filer Act","Stock Price ($)","Stock Price Date","Market Cap ($)","Financials Date","Revenue ($)","Earnings ($)","Book Value ($)","Assets ($)"
32937,"Revenue from customer contracts","Revenue Recognition",524816,12/31/23,02/15/24,2,"Ernst & Young LLP",,,,"San Jose",CA,CALIFORNIA,"US West",10-K,2024-02-15,,"10x Genomics, Inc.",1770787,"=""TXG""","6230 STONERIDGE MALL ROAD",,PLEASANTON,CA,CALIFORNIA,"US West",,,"=""3826""","Laboratory Analytical Instruments",334516,"Analytical Laboratory Instrument Manufacturing",34,56,12/31/23,"5,877,956,096",12/31/23,"618,727,000","-255,099,000","719,916,000","965,143,000"
38291,"Revenue from customer contracts","Revenue Recognition— Refer to Note 2(m) and Note 13 to the financial statements",536107,12/31/23,05/14/24,3,"Deloitte & Touche LLP",499,"Deloitte Touche Tohmatsu Certified Public Accountants LLP",1113,Shanghai,F4,CHINA,Foreign,20-F,2024-05-14,Yes,"111, Inc.",1738906,"=""YI""","3-4/F, NO.295 ZUCHONGZHI ROAD","PUDONG NEW AREA",SHANGHAI,F4,CHINA,Foreign,,,"=""5912""","Drug Stores and Proprietary Stores",446110,"Pharmacies and Drug Stores",34,2,01/02/24,"137,803,568",12/31/23,"2,107,686,000","-55,370,000","40,202,000","435,554,000"
37216,"Allowance for credit losses","Allowance for Credit Losses – Refer to Note 2 to the consolidated financial statements",532349,12/31/23,04/01/24,3,"Deloitte & Touche LLP",,,,Atlanta,GA,GEORGIA,"US Southeast",10-K,2024-04-01,,"1st FRANKLIN FINANCIAL CORP",38723,,"135 E TUGALO ST","P O BOX 880",TOCCOA,GA,GEORGIA,"US Southeast",,,"=""6141""","Personal Credit Institutions",522292,"Real Estate Credit",34,,,,12/31/23,"204,573,713","530,089",,"1,240,296,760"
30368,"Long-lived assets","Impairments of Long-Lived Assets",513463,02/25/23,06/13/23,4,"KPMG LLP",,,,"New York",NY,"NEW YORK","US Mid Atlantic",10-K,2023-06-14,Yes,"20230930-DK-Butterfly-1, Inc.",886158,,"650 LIBERTY AVENUE",,UNION,NJ,"NEW JERSEY","US Mid Atlantic",,,"=""5700""","Retail-Home Furniture, Furnishings & Equipment Stores",442299,"All Other Home Furnishings Stores",34,1,02/28/23,"365,236,544",02/25/23,"5,344,685,000","-3,498,801,000",,"2,225,217,000"
35487,"Revenue from customer contracts","Determination of implied pricing concessions",528454,12/31/23,03/06/24,4,"KPMG LLP",,,,McLean,VA,VIRGINIA,"US Mid Atlantic",10-K,2024-03-06,Yes,"2U, LLC",1459417,,"7900 HARKINS ROAD",,LANHAM,MD,MARYLAND,"US Mid Atlantic",,,"=""7372""","Prepackaged Software",511210,"Software Publishers",34,1,01/02/24,"96,020,920",12/31/23,"945,953,000","-317,607,000","-803,651,000","1,459,683,000"
35488,"Goodwill and intangible assets","Impairment of goodwill and indefinite-lived intangible asset",528454,12/31/23,03/06/24,4,"KPMG LLP",,,,McLean,VA,VIRGINIA,"US Mid Atlantic",10-K,2024-03-06,Yes,"2U, LLC",1459417,,"7900 HARKINS ROAD",,LANHAM,MD,MARYLAND,"US Mid Atlantic",,,"=""7372""","Prepackaged Software",511210,"Software Publishers",34,1,01/02/24,"96,020,920",12/31/23,"945,953,000","-317,607,000","-803,651,000","1,459,683,000"
32423,"Other contingent liabilities","Legal Proceedings",524155,12/31/23,02/07/24,1,"PricewaterhouseCoopers LLP",,,,Minneapolis,MN,MINNESOTA,"US Midwest",10-K,2024-02-07,,"3M CO",66740,"=""MMM""","3M CENTER","BLDG. 220-9E-02","ST PAUL",MN,MINNESOTA,"US Midwest",,,"=""3841""","Surgical and Medical Instruments and Apparatus",322222,"Coated and Laminated Paper Manufacturing",34,110,01/02/24,"60,754,874,368",12/31/23,"24,610,000,000","-6,995,000,000","-12,346,000,000","50,580,000,000"
35279,"Uncertain tax positions","Assessment of an uncertain tax position",527917,12/31/23,03/01/24,4,"KPMG LLP",,,,"San Francisco",CA,CALIFORNIA,"US West",10-K,2024-03-01,,"89bio, Inc.",1785173,"=""ETNB""","655 MONTGOMERY STREET","SUITE 1500","SAN FRANCISCO",CA,CALIFORNIA,"US West",,,"=""2834""","Pharmaceutical Preparations",325412,"Pharmaceutical Preparation Manufacturing",34,11,12/31/23,"1,041,818,944",12/31/23,,"-142,189,000",,"596,269,000"
30697,Inventory,"Assessment of the write-down of inventories",514785,05/31/23,07/18/23,4,"KPMG LLP",,,,Chicago,IL,ILLINOIS,"US Midwest",10-K,2023-07-18,,"AAR CORP",1750,"=""AIR""","1100 N WOOD DALE RD",,"WOOD DALE",IL,ILLINOIS,"US Midwest",,,"=""3720""","Aircraft & Parts",334613,"Magnetic and Optical Recording Media Manufacturing",34,50,05/31/23,"1,749,618,176",05/31/23,"1,990,500,000","90,200,000","859,600,000","1,833,100,000"
30698,"Revenue from customer contracts","Evaluation of the estimate of costs at completion of certain performance obligations",514785,05/31/23,07/18/23,4,"KPMG LLP",,,,Chicago,IL,ILLINOIS,"US Midwest",10-K,2023-07-18,,"AAR CORP",1750,"=""AIR""","1100 N WOOD DALE RD",,"WOOD DALE",IL,ILLINOIS,"US Midwest",,,"=""3720""","Aircraft & Parts",334613,"Magnetic and Optical Recording Media Manufacturing",34,50,05/31/23,"1,749,618,176",05/31/23,"1,990,500,000","90,200,000","859,600,000","1,833,100,000"
34871,"Other contingent liabilities","Estimated claims liabilities costs",527515,12/31/23,02/29/24,2,"Ernst & Young LLP",,,,Atlanta,GA,GEORGIA,"US Southeast",10-K,2024-02-29,,"Aaron's Company, Inc.",1821393,,"400 GALLERIA PARKWAY SE, SUITE 300",,ATLANTA,GA,GEORGIA,"US Southeast",,,"=""7359""","Equipment Rental and Leasing, NEC",532210,"Consumer Electronics and Appliances Rental",34,11,01/02/24,"343,630,816",12/31/23,"2,139,890,000","2,823,000","522,230,000","1,826,576,000"
34872,Goodwill,"Valuation of Goodwill – BrandsMart and BrandsMart Leasing reporting units",527515,12/31/23,02/29/24,2,"Ernst & Young LLP",,,,Atlanta,GA,GEORGIA,"US Southeast",10-K,2024-02-29,,"Aaron's Company, Inc.",1821393,,"400 GALLERIA PARKWAY SE, SUITE 300",,ATLANTA,GA,GEORGIA,"US Southeast",,,"=""7359""","Equipment Rental and Leasing, NEC",532210,"Consumer Electronics and Appliances Rental",34,11,01/02/24,"343,630,816",12/31/23,"2,139,890,000","2,823,000","522,230,000","1,826,576,000"
34083,"Revenue from customer contracts","Revenue recognition for certain long-term fixed price contracts using the percentage-of-completion method",525946,12/31/23,02/22/24,4,"KPMG LLP",288,"KPMG AG",3240,Zurich,V8,SWITZERLAND,Foreign,20-F,2024-02-23,,"ABB LTD",1091587,"=""ABBNY""","PO BOX 8131",*,ZURICH,V8,SWITZERLAND,Foreign,,,"=""3613""","Switchgear and Switchboard Apparatus",335311,"Power, Distribution, and Specialty Transformer Manufacturing",34,44,12/31/23,"81,600,716,800",12/31/23,"32,235,000,000","3,745,000,000","1,715,000,000","40,940,000,000"
33069,"Other income taxes","Income taxes – Unrecognized tax benefits",524978,12/31/23,02/16/24,2,"Ernst & Young LLP",,,,Chicago,IL,ILLINOIS,"US Midwest",10-K,2024-02-16,,"ABBOTT LABORATORIES",1800,"=""ABT""","100 ABBOTT PARK ROAD",,"ABBOTT PARK",IL,ILLINOIS,"US Midwest",,,"=""2834""","Pharmaceutical Preparations",325412,"Pharmaceutical Preparation Manufacturing",34,110,01/02/24,"190,706,024,448",12/31/23,"40,109,000,000","5,723,000,000","6,109,000,000","73,214,000,000"
33099,"Sales return and allowances","Sales rebate accruals for Medicaid, Medicare and managed care programs",525114,12/31/23,02/20/24,2,"Ernst & Young LLP",,,,Chicago,IL,ILLINOIS,"US Midwest",10-K,2024-02-20,,"AbbVie Inc.",1551152,"=""ABBV""","1 NORTH WAUKEGAN ROAD",,"NORTH CHICAGO",IL,ILLINOIS,"US Midwest",,,"=""2834""","Pharmaceutical Preparations",325412,"Pharmaceutical Preparation Manufacturing",34,160,01/02/24,"282,168,197,120",12/31/23,"54,318,000,000","4,863,000,000","-77,543,000,000","134,711,000,000"
33100,"Business combinations","Valuation of contingent consideration",525114,12/31/23,02/20/24,2,"Ernst & Young LLP",,,,Chicago,IL,ILLINOIS,"US Midwest",10-K,2024-02-20,,"AbbVie Inc.",1551152,"=""ABBV""","1 NORTH WAUKEGAN ROAD",,"NORTH CHICAGO",IL,ILLINOIS,"US Midwest",,,"=""2834""","Pharmaceutical Preparations",325412,"Pharmaceutical Preparation Manufacturing",34,160,01/02/24,"282,168,197,120",12/31/23,"54,318,000,000","4,863,000,000","-77,543,000,000","134,711,000,000"
33188,"Revenue from customer contracts","Identification of distinct performance obligations",525153,12/31/23,02/20/24,4,"KPMG LLP",187,"KPMG LLP Chartered Accountants",85,Vancouver,A1,"BRITISH COLUMBIA",Canada,10-K,2024-02-20,,"AbCellera Biologics Inc.",1703057,"=""ABCL""","150 W 4TH AVENUE",,VANCOUVER,A1,"BRITISH COLUMBIA",Canada,,,"=""2834""","Pharmaceutical Preparations",325412,"Pharmaceutical Preparation Manufacturing",34,6,12/31/23,"1,660,610,560",12/31/23,"38,025,000","-146,398,000","989,000,000","1,488,094,000"
36263,"Other debt","Direct Placement Offering — Refer to Note 9 to the financial statements",530412,12/31/23,03/15/24,3,"Deloitte & Touche LLP",,,,Morristown,NJ,"NEW JERSEY","US Mid Atlantic",10-K,2024-03-18,,"ABEONA THERAPEUTICS INC.",318306,"=""ABEO""","6555 CARNEGIE AVE, 4TH FLOOR",,CLEVELAND,OH,OHIO,"US Midwest",,,"=""2834""","Pharmaceutical Preparations",325412,"Pharmaceutical Preparation Manufacturing",34,5,12/31/23,"132,884,632",12/31/23,"3,500,000","-54,188,000",,"64,002,000"
28047,"Long-lived assets","Impairment of Long-Lived Assets – Stores",506292,01/28/23,03/27/23,1,"PricewaterhouseCoopers LLP",,,,Columbus,OH,OHIO,"US Midwest",10-K,2023-03-27,,"ABERCROMBIE & FITCH CO /DE/",1018840,"=""ANF""","6301 FITCH PATH",,"NEW ALBANY",OH,OHIO,"US Midwest",,,"=""5651""","Family Clothing Stores",448140,"Family Clothing Stores",34,29,01/31/23,"1,419,097,856",01/28/23,"3,697,751,000","2,816,000",,"2,713,100,000"
31981,"Other contingent liabilities","Valuation of self-insurance liabilities",521334,10/31/23,12/18/23,4,"KPMG LLP",,,,"New York",NY,"NEW YORK","US Mid Atlantic",10-K,2023-12-18,,"ABM INDUSTRIES INC /DE/",771497,"=""ABM""","ONE LIBERTY PLAZA","7TH FLOOR","NEW YORK",NY,"NEW YORK","US Mid Atlantic",,,"=""7340""","Services-To Dwellings & Other Buildings",561720,"Janitorial Services",34,39,10/31/23,"2,472,416,256",10/31/23,"8,096,400,000","251,400,000","-994,300,000","4,933,700,000"
35191,"Other investments","Evaluation of the evidence pertaining to the existence of the gold holdings",527456,12/31/23,02/28/24,4,"KPMG LLP",,,,"New York",NY,"NEW YORK","US Mid Atlantic",10-K,2024-02-29,,"abrdn Gold ETF Trust",1450923,"=""SGOL""","C/O ABRDN","1900 MARKET STREET, SUITE 200",PHILADELPHIA,PA,PENNSYLVANIA,"US Mid Atlantic",,,"=""6221""","Commodity Contracts Brokers and Dealers",525990,"Other Financial Vehicles",34,20,01/02/24,"2,818,176,000",12/31/23,,"345,743,000",,"2,826,667,000"
35026,"Other investments","Evaluation of the evidence pertaining to the existence of the palladium holdings",527465,12/31/23,02/28/24,4,"KPMG LLP",,,,"New York",NY,"NEW YORK","US Mid Atlantic",10-K,2024-02-29,,"abrdn Palladium ETF Trust",1459862,"=""PALL""","C/O ABRDN","1900 MARKET STREET, SUITE 200",PHILADELPHIA,PA,PENNSYLVANIA,"US Mid Atlantic",,,"=""6221""","Commodity Contracts Brokers and Dealers",523991,"Trust, Fiduciary, and Custody Activities",34,100,01/02/24,"199,580,000",12/31/23,,"-111,382,000",,"219,421,000"
35077,"Other investments","Evaluation of the evidence pertaining to the existence of the platinum holdings",527432,12/31/23,02/28/24,4,"KPMG LLP",,,,"New York",NY,"NEW YORK","US Mid Atlantic",10-K,2024-02-29,,"abrdn Platinum ETF Trust",1460235,"=""PPLT""","C/O ABRDN","1900 MARKET STREET, SUITE 200",PHILADELPHIA,PA,PENNSYLVANIA,"US Mid Atlantic",,,"=""6221""","Commodity Contracts Brokers and Dealers",523991,"Trust, Fiduciary, and Custody Activities",34,90,01/02/24,"953,931,008",12/31/23,,"-32,804,000",,"997,955,000"
34922,"Other investments","Evaluation of the evidence pertaining to the existence of the bullion holdings",527522,12/31/23,02/28/24,4,"KPMG LLP",,,,"New York",NY,"NEW YORK","US Mid Atlantic",10-K,2024-02-29,,"abrdn Precious Metals Basket ETF Trust",1483386,"=""GLTR""","C/O ABRDN","1900 MARKET STREET, SUITE 200",PHILADELPHIA,PA,PENNSYLVANIA,"US Mid Atlantic",,,"=""6221""","Commodity Contracts Brokers and Dealers",523920,"Portfolio Management",34,91,01/02/24,"965,038,016",12/31/23,,"27,534,000",,"959,323,000"
35057,"Other investments","Evaluation of the evidence pertaining to the existence of the silver holdings",527424,12/31/23,02/28/24,4,"KPMG LLP",,,,"New York",NY,"NEW YORK","US Mid Atlantic",10-K,2024-02-29,,"abrdn Silver ETF Trust",1450922,"=""SIVR""","C/O ABRDN","1900 MARKET STREET, SUITE 200",PHILADELPHIA,PA,PENNSYLVANIA,"US Mid Atlantic",,,"=""6221""","Commodity Contracts Brokers and Dealers",523991,"Trust, Fiduciary, and Custody Activities",34,23,01/02/24,"1,067,475,968",12/31/23,,"-13,382,000",,"1,060,674,000"
36007,"Other intangible assets","Intangible asset – valuation",529965,12/31/23,03/14/24,1,"PricewaterhouseCoopers LLP",286,"PricewaterhouseCoopers SA",1358,Lausanne,V8,SWITZERLAND,Foreign,20-F,2024-03-14,,"AC Immune SA",1651625,"=""ACIU""","EPFL INNOVATION PARK, BUILDING B",,"1015 LAUSANNE",V8,SWITZERLAND,Foreign,,,"=""2834""","Pharmaceutical Preparations",325412,"Pharmaceutical Preparation Manufacturing",34,5,12/31/23,"495,989,152",12/31/23,"17,586,000","-64,437,000","130,966,000","217,209,000"
27535,Inventory,"Company’s merchandise inventories",505289,01/28/23,03/16/23,3,"Deloitte & Touche LLP",,,,Houston,TX,TEXAS,"US Southwest",10-K,2023-03-16,,"Academy Sports & Outdoors, Inc.",1817358,"=""ASO""","1800 NORTH MASON ROAD",,KATY,TX,TEXAS,"US Southwest",,,"=""5940""","Retail-Miscellaneous Shopping Goods Stores",451110,"Sporting Goods Stores",34,58,01/31/23,"4,481,498,624",01/28/23,"6,395,073,000","628,001,000","188,670,000","4,595,439,000"
34720,"Revenue from customer contracts","Revenue Recognition",527058,12/31/23,02/28/24,2,"Ernst & Young LLP",,,,Nashville,TN,TENNESSEE,"US Southeast",10-K,2024-02-28,,"Acadia Healthcare Company, Inc.",1520697,"=""ACHC""","6100 TOWER CIRCLE","SUITE 1000",FRANKLIN,TN,TENNESSEE,"US Southeast",,,"=""8093""","Specialty Outpatient Facilities, NEC",623220,"Residential Mental Health and Substance Abuse Facilities",34,78,01/02/24,"7,216,861,184",12/31/23,"2,928,738,000","-21,667,000","588,420,000","5,358,841,000"
34858,"Sales return and allowances","Medicare Part D sales rebate accruals",526958,12/31/23,02/27/24,2,"Ernst & Young LLP",,,,"San Diego",CA,CALIFORNIA,"US West",10-K,2024-02-28,,"ACADIA PHARMACEUTICALS INC",1070494,"=""ACAD""","12830 EL CAMINO REAL","SUITE 400","SAN DIEGO",CA,CALIFORNIA,"US West",,,"=""2834""","Pharmaceutical Preparations",325412,"Pharmaceutical Preparation Manufacturing",34,31,12/31/23,"5,155,198,464",12/31/23,"726,437,000","-61,286,000","366,265,000","748,956,000"
33005,"Real estate investments","Operating real estate, net — Impairment — Refer to Notes 1, 2 and 8 to the financial statements",525009,12/31/23,02/16/24,3,"Deloitte & Touche LLP",,,,"New York",NY,"NEW YORK","US Mid Atlantic",10-K,2024-02-16,,"ACADIA REALTY TRUST",899629,"=""AKR""","411 THEODORE FREMD AVENUE","SUITE 300",RYE,NY,"NEW YORK","US Mid Atlantic",,,"=""6798""","Real Estate Investment Trusts",531120,"Lessors of Nonresidential Buildings (except Miniwarehouses)",34,17,12/31/23,"1,620,194,816",12/31/23,"338,692,000","19,873,000",,"4,291,154,000"
34759,"Deferred and stock-based compensation","Assessment of the fair value measurement of the cash-settled affiliate awards liability",527278,12/31/23,02/28/24,4,"KPMG LLP",,,,Boston,MA,MASSACHUSETTS,"US New England",10-K,2024-02-28,,"Acadian Asset Management Inc.",1748824,"=""AAMI""","200 STATE STREET","SUITE 601A",BOSTON,MA,MASSACHUSETTS,"US New England",,,"=""6282""","Investment Advice",523930,"Investment Advice",34,19,01/02/24,"780,353,088",12/31/23,"407,000,000","65,800,000","29,200,000","611,400,000"
34670,"Accounts/loans receivable","Sufficiency of audit evidence over cash",527020,12/31/23,02/28/24,4,"KPMG LLP",,,,Chicago,IL,ILLINOIS,"US Midwest",10-K,2024-02-28,,"Accel Entertainment, Inc.",1698991,"=""ACEL""","140 TOWER DRIVE",,"BURR RIDGE",IL,ILLINOIS,"US Midwest",,,"=""7900""","Services-Amusement & Recreation Services",713290,"Other Gambling Industries",34,10,01/02/24,"876,865,984",12/31/23,"1,170,420,000","45,603,000","76,308,000","912,893,000"
36894,Inventory,"Valuation of Instrument Inventory",531894,12/31/23,03/28/24,2,"Ernst & Young LLP",,,,Phoenix,AZ,ARIZONA,"US Southwest",10-K,2024-03-29,Yes,"Accelerate Diagnostics, Inc",727207,"=""AXDXQ""","3950 S. COUNTRY CLUB ROAD #470","BUILDING 3-307",TUCSON,AZ,ARIZONA,"US Southwest",,,"=""3826""","Laboratory Analytical Instruments",511210,"Software Publishers",34,4,01/02/24,"61,549,060",12/31/23,"12,059,000","-61,618,000",,"31,366,000"
31382,"Revenue from customer contracts","Estimated costs to complete certain technology integration consulting services contracts",518313,08/31/23,10/12/23,4,"KPMG LLP",,,,Chicago,IL,ILLINOIS,"US Midwest",10-K,2023-10-12,,"Accenture plc",1467373,"=""ACN""","1 GRAND CANAL SQUARE","GRAND CANAL HARBOUR",DUBLIN,L2,IRELAND,Foreign,,,"=""7389""","Business Services, NEC",541611,"Administrative Management and General Management Consulting Services",34,324,08/31/23,"203,413,405,696",08/31/23,"64,111,745,000","6,871,557,000","10,119,836,000","51,245,305,000"
31383,"Uncertain tax positions","Unrecognized tax benefits",518313,08/31/23,10/12/23,4,"KPMG LLP",,,,Chicago,IL,ILLINOIS,"US Midwest",10-K,2023-10-12,,"Accenture plc",1467373,"=""ACN""","1 GRAND CANAL SQUARE","GRAND CANAL HARBOUR",DUBLIN,L2,IRELAND,Foreign,,,"=""7389""","Business Services, NEC",541611,"Administrative Management and General Management Consulting Services",34,324,08/31/23,"203,413,405,696",08/31/23,"64,111,745,000","6,871,557,000","10,119,836,000","51,245,305,000"
39599,"Revenue from customer contracts","Estimated costs to complete certain technology integration consulting services contracts",541913,08/31/23,10/12/23,4,"KPMG LLP",,,,Chicago,IL,ILLINOIS,"US Midwest",8-K,2024-09-30,,"Accenture plc",1467373,"=""ACN""","1 GRAND CANAL SQUARE","GRAND CANAL HARBOUR",DUBLIN,L2,IRELAND,Foreign,,,"=""7389""","Business Services, NEC",541611,"Administrative Management and General Management Consulting Services",34,324,08/31/23,"203,413,405,696",08/31/23,"64,111,745,000","6,871,557,000","10,119,836,000","51,245,305,000"
39600,"Uncertain tax positions","Unrecognized tax benefits",541913,08/31/23,10/12/23,4,"KPMG LLP",,,,Chicago,IL,ILLINOIS,"US Midwest",8-K,2024-09-30,,"Accenture plc",1467373,"=""ACN""","1 GRAND CANAL SQUARE","GRAND CANAL HARBOUR",DUBLIN,L2,IRELAND,Foreign,,,"=""7389""","Business Services, NEC",541611,"Administrative Management and General Management Consulting Services",34,324,08/31/23,"203,413,405,696",08/31/23,"64,111,745,000","6,871,557,000","10,119,836,000","51,245,305,000"
33877,Inventory,"Write-down of certain finished goods inventory for obsolete and slow-moving items",526221,12/31/23,02/23/24,4,"KPMG LLP",,,,Chicago,IL,ILLINOIS,"US Midwest",10-K,2024-02-23,,"ACCO BRANDS Corp",712034,"=""ACCO""","FOUR CORPORATE DRIVE",,"LAKE ZURICH",IL,ILLINOIS,"US Midwest",,,"=""2780""","Blankbooks, Looseleaf Binders & Bookbindg & Relatd Work",323118,"Blankbook, Looseleaf Binders, and Devices Manufacturing",34,6,12/31/23,"577,147,968",12/31/23,"1,832,800,000","-21,800,000","-618,700,000","2,644,800,000"
33878,Goodwill,"Goodwill Impairment Assessment of North America Reporting Unit",526221,12/31/23,02/23/24,4,"KPMG LLP",,,,Chicago,IL,ILLINOIS,"US Midwest",10-K,2024-02-23,,"ACCO BRANDS Corp",712034,"=""ACCO""","FOUR CORPORATE DRIVE",,"LAKE ZURICH",IL,ILLINOIS,"US Midwest",,,"=""2780""","Blankbooks, Looseleaf Binders & Bookbindg & Relatd Work",323118,"Blankbook, Looseleaf Binders, and Devices Manufacturing",34,6,12/31/23,"577,147,968",12/31/23,"1,832,800,000","-21,800,000","-618,700,000","2,644,800,000"
29675,"Revenue from customer contracts","Sufficiency of audit evidence over revenue",510539,02/28/23,04/27/23,4,"KPMG LLP",,,,Philadelphia,PA,PENNSYLVANIA,"US Mid Atlantic",10-K,2023-04-28,,"Accolade, Inc.",1481646,,"660 W. GERMANTOWN PIKE SUITE 500",,"PLYMOUTH MEETING",PA,PENNSYLVANIA,"US Mid Atlantic",,,"=""7389""","Business Services, NEC",611710,"Educational Support Services",34,11,02/28/23,"812,019,648",02/28/23,"363,142,000","-459,650,000","-7,607,000","903,069,000"
36814,"Other investments","Contingent consideration arising from the Sopharma share purchase agreement",531652,12/31/23,03/28/24,1,"PricewaterhouseCoopers LLP",191,"PricewaterhouseCoopers LLP Chartered Accountants",271,Vancouver,A1,"BRITISH COLUMBIA",Canada,10-K,2024-03-28,,"ACHIEVE LIFE SCIENCES, INC.",949858,"=""ACHV""","22722 29TH DR. SE","SUITE 100",SEATTLE,WA,WASHINGTON,"US West",,,"=""2835""","In Vitro and In Vivo Diagnostic Substances",325412,"Pharmaceutical Preparation Manufacturing",34,4,01/02/24,"88,261,216",12/31/23,,"-29,815,000","-3,679,000","19,371,000"
34975,"Revenue from customer contracts","Revenue Recognition - Refer to Note 2 to the financial statements",527693,12/31/23,02/29/24,3,"Deloitte & Touche LLP",,,,Omaha,NE,NEBRASKA,"US Midwest",10-K,2024-02-29,,"ACI WORLDWIDE, INC.",935036,"=""ACIW""","6060 COVENTRY DRIVE",,ELKHORN,NE,NEBRASKA,"US Midwest",,,"=""7372""","Prepackaged Software",511210,"Software Publishers",34,30,01/02/24,"3,302,990,592",12/31/23,"1,452,579,000","121,509,000","-205,793,000","3,444,739,000"
34493,"Business combinations","Fair Value of the Contingent Consideration Liability",526562,12/31/23,02/27/24,1,"PricewaterhouseCoopers LLP",,,,Philadelphia,PA,PENNSYLVANIA,"US Mid Atlantic",10-K,2024-02-27,,"Aclaris Therapeutics, Inc.",1557746,"=""ACRS""","701 LEE ROAD","SUITE 103",WAYNE,PA,PENNSYLVANIA,"US Mid Atlantic",,,"=""2834""","Pharmaceutical Preparations",325412,"Pharmaceutical Preparation Manufacturing",34,1,12/31/23,"74,439,632",12/31/23,"31,249,000","-88,481,000","163,110,000","197,405,000"
34496,"Revenue from customer contracts","Revenue Recognition",527126,12/31/23,02/28/24,2,"Ernst & Young LLP",211,"Ernst & Young Hua Ming LLP",1408,Shanghai,F4,CHINA,Foreign,10-K,2024-02-28,,"ACM Research, Inc.",1680062,"=""ACMR""","42307 OSGOOD ROAD, SUITE I",,FREMONT,CA,CALIFORNIA,"US West",,,"=""3559""","Special  Industry Machinery, NEC",333295,"Semiconductor Machinery Manufacturing",34,19,01/02/24,"1,037,790,336",12/31/23,"557,723,000","77,349,000","756,485,000","1,490,908,000"
37253,"Revenue from customer contracts","Estimate of variable consideration in contracts with customers",532018,12/31/23,04/01/24,2,"Ernst & Young LLP",,,,Stamford,CT,CONNECTICUT,"US New England",10-K,2024-04-01,Yes,"Acorda Therapeutics, Inc.",1008848,,"TWO BLUE HILL PLAZA",,"PEARL RIVER",NY,"NEW YORK","US Mid Atlantic",,,"=""2836""","Biological Products, Except Diagnostic Substances",325414,"Biological Product (except Diagnostic) Manufacturing",34,15,01/02/24,"18,569,364",12/31/23,"117,633,000","-252,854,000","-180,943,000","108,525,000"
37254,"Business combinations","Fair Value Measurement of the Contingent Consideration",532018,12/31/23,04/01/24,2,"Ernst & Young LLP",,,,Stamford,CT,CONNECTICUT,"US New England",10-K,2024-04-01,Yes,"Acorda Therapeutics, Inc.",1008848,,"TWO BLUE HILL PLAZA",,"PEARL RIVER",NY,"NEW YORK","US Mid Atlantic",,,"=""2836""","Biological Products, Except Diagnostic Substances",325414,"Biological Product (except Diagnostic) Manufacturing",34,15,01/02/24,"18,569,364",12/31/23,"117,633,000","-252,854,000","-180,943,000","108,525,000"
37255,"Long-lived assets","Long-Lived Intangible Assets – Quantitative Impairment Assessment",532018,12/31/23,04/01/24,2,"Ernst & Young LLP",,,,Stamford,CT,CONNECTICUT,"US New England",10-K,2024-04-01,Yes,"Acorda Therapeutics, Inc.",1008848,,"TWO BLUE HILL PLAZA",,"PEARL RIVER",NY,"NEW YORK","US Mid Atlantic",,,"=""2836""","Biological Products, Except Diagnostic Substances",325414,"Biological Product (except Diagnostic) Manufacturing",34,15,01/02/24,"18,569,364",12/31/23,"117,633,000","-252,854,000","-180,943,000","108,525,000"
31496,"Other intangible assets","Valuation of Indefinite-Lived Trade Names",518859,08/31/23,10/26/23,2,"Ernst & Young LLP",,,,Atlanta,GA,GEORGIA,"US Southeast",10-K,2023-10-26,,"ACUITY INC. (DE)",1144215,"=""AYI""","1170 PEACHTREE STREET NE","SUITE 1200",ATLANTA,GA,GEORGIA,"US Southeast",,,"=""3640""","Electric Lighting & Wiring Equipment",335110,"Electric Lamp Bulb and Part Manufacturing",34,161,08/31/23,"5,007,581,184",08/31/23,"3,952,200,000","346,000,000","436,300,000","3,408,500,000"
34859,"Other income taxes","Accounting for Income Taxes",527600,12/31/23,02/29/24,1,"PricewaterhouseCoopers LLP",,,,Boston,MA,MASSACHUSETTS,"US New England",10-K,2024-02-29,,"Acushnet Holdings Corp.",1672013,"=""GOLF""","333 BRIDGE STREET",,FAIRHAVEN,MA,MASSACHUSETTS,"US New England",,,"=""3949""","Sporting and Athletic Goods, NEC",339920,"Sporting and Athletic Goods Manufacturing",34,64,01/02/24,"4,165,869,568",12/31/23,"2,381,995,000","198,429,000","111,311,000","2,196,677,000"
33365,"Revenue from customer contracts","Revenue – highly automated processes within auction & other marketplace revenue",525430,12/31/23,02/21/24,2,"Ernst & Young LLP",,,,Buffalo,NY,"NEW YORK","US Mid Atlantic",10-K,2024-02-21,,"ACV Auctions Inc.",1637873,"=""ACVA""","640 ELLICOTT STREET",,BUFFALO,NY,"NEW YORK","US Mid Atlantic",,,"=""7389""","Business Services, NEC",459999,,34,15,12/31/23,"2,100,355,840",12/31/23,"481,234,000","-75,261,000","318,957,000","922,924,000"
35920,"Other contingent liabilities","Measurement of accrued liabilities for automobile and workers’ compensation claims",529866,12/31/23,03/13/24,4,"KPMG LLP",,,,Houston,TX,TEXAS,"US Southwest",10-K,2024-03-13,,"ADAMS RESOURCES & ENERGY, INC.",2178,,"2727 ALLEN PARKWAY","9TH FLOOR",HOUSTON,TX,TEXAS,"US Southwest",,,"=""5172""","Petroleum and Petroleum Products Wholesalers, Except Bulk Stations and Terminals",424720,"Petroleum and Petroleum Products Merchant Wholesalers (except Bulk Stations and Terminals)",34,26,12/31/23,"66,684,492",12/31/23,"2,745,293,000","212,000","78,058,000","361,334,000"
34437,"Other revenue","Implicit Price Concession",526716,12/31/23,02/27/24,4,"KPMG LLP",,,,Philadelphia,PA,PENNSYLVANIA,"US Mid Atlantic",10-K,2024-02-27,,"AdaptHealth Corp.",1725255,"=""AHCO""","555 EAST NORTH LANE","SUITE 5075",CONSHOHOCKEN,PA,PENNSYLVANIA,"US Mid Atlantic",,,"=""8082""","Home Health Care Services",423450,"Medical, Dental, and Hospital Equipment and Supplies Merchant Wholesalers",34,7,01/02/24,"990,188,864",12/31/23,"3,200,177,000","-678,895,000","-1,396,664,000","4,508,650,000"
34438,Goodwill,"Impairment of Goodwill",526716,12/31/23,02/27/24,4,"KPMG LLP",,,,Philadelphia,PA,PENNSYLVANIA,"US Mid Atlantic",10-K,2024-02-27,,"AdaptHealth Corp.",1725255,"=""AHCO""","555 EAST NORTH LANE","SUITE 5075",CONSHOHOCKEN,PA,PENNSYLVANIA,"US Mid Atlantic",,,"=""8082""","Home Health Care Services",423450,"Medical, Dental, and Hospital Equipment and Supplies Merchant Wholesalers",34,7,01/02/24,"990,188,864",12/31/23,"3,200,177,000","-678,895,000","-1,396,664,000","4,508,650,000"
35449,"Revenue from customer contracts","Identification of performance obligations",528487,12/31/23,03/06/24,4,"KPMG LLP",87,"KPMG LLP",1118,Reading,X0,"UNITED KINGDOM",Foreign,10-K,2024-03-06,,"Adaptimmune Therapeutics PLC",1621227,"=""ADAPY""","60 JUBILEE AVENUE","MILTON PARK","ABINGDON, OXFORDSHIRE",X0,"UNITED KINGDOM",Foreign,,,"=""2836""","Biological Products, Except Diagnostic Substances",325412,"Pharmaceutical Preparation Manufacturing",34,1,12/31/23,"179,462,736",12/31/23,"60,281,000","-113,871,000","39,183,000","282,616,000"
34918,"Research and development expenses","Genentech Agreement",527519,12/31/23,02/29/24,2,"Ernst & Young LLP",,,,Seattle,WA,WASHINGTON,"US West",10-K,2024-02-29,,"Adaptive Biotechnologies Corp",1478320,"=""ADPT""","1165 EASTLAKE AVE E",,SEATTLE,WA,WASHINGTON,"US West",,,"=""2836""","Biological Products, Except Diagnostic Substances",325414,"Biological Product (except Diagnostic) Manufacturing",34,5,01/02/24,"690,566,016",12/31/23,"170,276,000","-225,250,000","184,299,000","661,134,000"
35849,"Other debt","Deferred royalty obligation with HealthCare Royalty Partners",529928,12/31/23,03/13/24,1,"PricewaterhouseCoopers LLP",286,"PricewaterhouseCoopers SA",1358,Lausanne,V8,SWITZERLAND,Foreign,10-K,2024-03-13,,"ADC Therapeutics SA",1771910,"=""ADCT""",BIOPOLE,"ROUTE DE LA CORNICHE 3B",EPALINGES,V8,SWITZERLAND,Foreign,,,"=""2834""","Pharmaceutical Preparations",325412,"Pharmaceutical Preparation Manufacturing",34,2,12/31/23,"136,606,608",12/31/23,"69,558,000","-240,053,000",,"354,782,000"
35850,"Sales return and allowances","Product Revenue – Gross-to-net (GTN) sales adjustment – Discarded Drug Rebate",529928,12/31/23,03/13/24,1,"PricewaterhouseCoopers LLP",286,"PricewaterhouseCoopers SA",1358,Lausanne,V8,SWITZERLAND,Foreign,10-K,2024-03-13,,"ADC Therapeutics SA",1771910,"=""ADCT""",BIOPOLE,"ROUTE DE LA CORNICHE 3B",EPALINGES,V8,SWITZERLAND,Foreign,,,"=""2834""","Pharmaceutical Preparations",325412,"Pharmaceutical Preparation Manufacturing",34,2,12/31/23,"136,606,608",12/31/23,"69,558,000","-240,053,000",,"354,782,000"
34435,"Accounts/loans receivable","Valuation of Accounts Receivable, Net of Allowances for Implicit Price Concessions",526720,12/31/23,02/27/24,1,"PricewaterhouseCoopers LLP",,,,Dallas,TX,TEXAS,"US Southwest",10-K,2024-02-27,,"Addus HomeCare Corp",1468328,"=""ADUS""","6303 COWBOYS WAY","SUITE 600",FRISCO,TX,TEXAS,"US Southwest",,,"=""8082""","Home Health Care Services",621610,"Home Health Care Services",34,93,01/02/24,"1,511,692,160",12/31/23,"1,058,651,000","62,516,000","-48,284,000","1,024,426,000"
34436,Goodwill,"Goodwill Impairment Assessment – Hospice Reporting Unit",526720,12/31/23,02/27/24,1,"PricewaterhouseCoopers LLP",,,,Dallas,TX,TEXAS,"US Southwest",10-K,2024-02-27,,"Addus HomeCare Corp",1468328,"=""ADUS""","6303 COWBOYS WAY","SUITE 600",FRISCO,TX,TEXAS,"US Southwest",,,"=""8082""","Home Health Care Services",621610,"Home Health Care Services",34,93,01/02/24,"1,511,692,160",12/31/23,"1,058,651,000","62,516,000","-48,284,000","1,024,426,000"
35972,"Other assets","Valuation of Level 3 Biological Assets",530133,12/31/23,03/12/24,1,"PricewaterhouseCoopers LLP",88,"Price Waterhouse & Co SRL",1349,"Buenos Aires",C1,ARGENTINA,Foreign,6-K,2024-03-14,,"Adecoagro S.A.",1499505,"=""AGRO""","28, BOULEVARD F.W. RAIFFEEISEN",,N/A,N4,LUXEMBOURG,Foreign,,,"=""0100""","Agricultural production- crops",111150,"Corn Farming",34,11,12/31/23,"1,176,660,992",12/31/23,"1,298,871,000","226,721,000","1,201,609,000","3,164,894,000"
37949,"Other assets","Valuation of Level 3 Biological Assets",534586,12/31/23,04/26/24,1,"PricewaterhouseCoopers LLP",88,"Price Waterhouse & Co SRL",1349,"Buenos Aires",C1,ARGENTINA,Foreign,20-F,2024-04-26,,"Adecoagro S.A.",1499505,"=""AGRO""","28, BOULEVARD F.W. RAIFFEEISEN",,N/A,N4,LUXEMBOURG,Foreign,,,"=""0100""","Agricultural production- crops",111150,"Corn Farming",34,11,12/31/23,"1,176,660,992",12/31/23,"1,298,871,000","226,721,000","1,201,609,000","3,164,894,000"
33914,"Revenue from customer contracts","Revenue Recognition – Allocation of Transaction Price to Performance Obligations",526005,12/31/23,02/23/24,1,"PricewaterhouseCoopers LLP",,,,"San Jose",CA,CALIFORNIA,"US West",10-K,2024-02-23,,"Adeia Inc.",1803696,"=""ADEA""","3025 ORCHARD PARKWAY",,"SAN JOSE",CA,CALIFORNIA,"US West",,,"=""4841""","Cable and Other Pay Television Services",334413,"Semiconductor and Related Device Manufacturing",34,13,01/02/24,"1,342,875,008",12/31/23,"388,788,000","67,372,000","-304,210,000","1,105,556,000"
31721,Goodwill,"Annual Goodwill Impairment Assessment",519932,09/30/23,11/17/23,1,"PricewaterhouseCoopers LLP",,,,Detroit,MI,MICHIGAN,"US Midwest",10-K,2023-11-17,,"Adient plc",1670541,"=""ADNT""","25 NORTH WALL QUAY","DUBLIN 1",DUBLIN,L2,IRELAND,Foreign,,,"=""3714""","Motor Vehicle Parts and Accessories",336399,"All Other Motor Vehicle Parts Manufacturing",34,36,10/02/23,"3,397,864,448",09/30/23,"15,395,000,000","205,000,000","-217,000,000","9,424,000,000"
32166,"Revenue from customer contracts","Performance obligations in cloud-enabled software subscriptions",523099,12/01/23,01/16/24,4,"KPMG LLP",,,,"Santa Clara",CA,CALIFORNIA,"US West",10-K,2024-01-17,,"ADOBE INC.",796343,"=""ADBE""","345 PARK AVE",,"SAN JOSE",CA,CALIFORNIA,"US West",,,"=""7372""","Prepackaged Software",511210,"Software Publishers",34,617,11/29/23,"281,097,666,560",12/01/23,"19,409,000,000","5,428,000,000","2,625,000,000","29,779,000,000"
34522,Goodwill,"Interim Goodwill Impairment Assessments — Solar Reporting Unit",527137,12/31/23,02/28/24,1,"PricewaterhouseCoopers LLP",,,,Miami,FL,FLORIDA,"US Southeast",10-K,2024-02-28,,"ADT Inc.",1703056,"=""ADT""","1501 YAMATO ROAD",,"BOCA RATON",FL,FLORIDA,"US Southeast",,,"=""7381""","Detective, Guard, and Armored Car Services",561621,"Security Systems Services (except Locksmiths)",34,7,01/02/24,"6,078,208,000",12/31/23,"4,982,659,000","463,009,000","-5,992,746,000","15,964,094,000"
30912,"Goodwill and intangible assets","Impairment Assessments – Walden Reporting Unit Goodwill, Trade Name and Title IV Eligibility and Accreditations",515850,06/30/23,08/10/23,1,"PricewaterhouseCoopers LLP",,,,Chicago,IL,ILLINOIS,"US Midwest",10-K,2023-08-10,,"Adtalem Global Education Inc.",730464,"=""ATGE""","233 S. WACKER DRIVE","SUITE 800",CHICAGO,IL,ILLINOIS,"US Midwest",,,"=""8200""","Services-Educational Services",611519,"Other Technical and Trade Schools",34,34,06/30/23,"1,452,925,440",06/30/23,"1,450,826,000","93,358,000","-316,264,000","2,810,541,000"
36166,Goodwill,"Interim Goodwill Impairment Assessments – Network Solutions and Services & Support Reporting Units",530291,12/31/23,03/15/24,1,"PricewaterhouseCoopers LLP",,,,Birmingham,AL,ALABAMA,"US Southeast",10-K,2024-03-15,,"ADTRAN Holdings, Inc.",926282,"=""ADTN""","901 EXPLORER BLVD",,HUNTSVILLE,AL,ALABAMA,"US Southeast",,,"=""3661""","Telephone and Telegraph Apparatus",334210,"Telephone Apparatus Manufacturing",34,7,01/02/24,"584,733,568",12/31/23,"1,149,100,000","-268,852,000","364,178,000","1,682,512,000"
35769,"Vendor/supplier rebates","Vendor Incentives — Refer to Note 2 to the Consolidated Financial Statements",529701,12/30/23,03/12/24,3,"Deloitte & Touche LLP",,,,Charlotte,NC,"NORTH CAROLINA","US Southeast",10-K,2024-03-12,,"ADVANCE AUTO PARTS INC",1158449,"=""AAP""","4200 SIX FORKS ROAD",,RALEIGH,NC,"NORTH CAROLINA","US Southeast",,,"=""5531""","Auto and Home Supply Stores",441310,"Automotive Parts and Accessories Stores",34,61,12/28/23,"3,656,826,368",12/30/23,"11,287,607,000","29,735,000","934,644,000","12,276,326,000"
38491,"Vendor/supplier rebates","Vendor Incentives — Refer to Note 2 to the Consolidated Financial Statements",536736,12/30/23,03/12/24,3,"Deloitte & Touche LLP",,,,Charlotte,NC,"NORTH CAROLINA","US Southeast",10-K/A,2024-05-30,,"ADVANCE AUTO PARTS INC",1158449,"=""AAP""","4200 SIX FORKS ROAD",,RALEIGH,NC,"NORTH CAROLINA","US Southeast",,,"=""5531""","Auto and Home Supply Stores",441310,"Automotive Parts and Accessories Stores",34,61,12/28/23,"3,656,826,368",12/30/23,"11,287,607,000","29,735,000","934,644,000","12,276,326,000"
30019,Goodwill,"Goodwill, Infiltrator Water Technologies Reporting Unit — Refer to Note 8 to the financial statements",512216,03/31/23,05/18/23,3,"Deloitte & Touche LLP",,,,Columbus,OH,OHIO,"US Midwest",10-K,2023-05-18,,"ADVANCED DRAINAGE SYSTEMS, INC.",1604028,"=""WMS""","4024 GREEN STRIPE LANE",,HILLIARD,OH,OHIO,"US Midwest",,,"=""3086""","Plastics Foam Products",326122,"Plastics Pipe and Pipe Fitting Manufacturing",34,84,03/31/23,"6,648,126,976",03/31/23,"3,071,121,000","507,086,000","-50,453,000","2,901,125,000"
33101,Inventory,"Inventory valuation",525119,12/31/23,02/20/24,2,"Ernst & Young LLP",,,,Denver,CO,COLORADO,"US West",10-K,2024-02-20,,"ADVANCED ENERGY INDUSTRIES INC",927003,"=""AEIS""","ATTN:  PAUL OLDHAM","1595 WYNKOOP ST, SUITE 800",DENVER,CO,COLORADO,"US West",,,"=""3679""","Electronic Components, NEC",335999,"All Other Miscellaneous Electrical Equipment and Component Manufacturing",34,106,01/02/24,"3,960,697,088",12/31/23,"1,655,810,000","128,284,000","698,864,000","2,556,757,000"
32280,Inventory,"Inventory Valuation",523754,12/30/23,01/31/24,2,"Ernst & Young LLP",,,,"San Jose",CA,CALIFORNIA,"US West",10-K,2024-01-31,,"ADVANCED MICRO DEVICES INC",2488,"=""AMD""","2485 AUGUSTINE DRIVE",,"SANTA CLARA",CA,CALIFORNIA,"US West",,,"=""3674""","Semiconductors and Related Devices",334413,"Semiconductor and Related Device Manufacturing",34,149,12/28/23,"240,321,609,728",12/30/23,"22,680,000,000","854,000,000","10,267,000,000","67,885,000,000"
33022,Goodwill,"Quantitative Goodwill Impairment Assessment",524944,12/31/23,02/16/24,1,"PricewaterhouseCoopers LLP",,,,"Florham Park",NJ,"NEW JERSEY","US Mid Atlantic",10-K,2024-02-16,,"AdvanSix Inc.",1673985,"=""ASIX""","300 KIMBALL DRIVE","SUITE 101",PARSIPPANY,NJ,"NEW JERSEY","US Mid Atlantic",,,"=""2821""","Plastics Material and Synthetic Resins, and Nonvulcanizable Elastomers",325211,"Plastics Material and Resin Manufacturing",34,30,12/31/23,"801,444,096",12/31/23,"1,533,599,000","54,623,000","636,852,000","1,496,020,000"
35276,Goodwill,"Annual Goodwill Impairment Assessments – sales and marketing reporting units",527916,12/31/23,03/01/24,1,"PricewaterhouseCoopers LLP",,,,Irvine,CA,CALIFORNIA,"US West",10-K,2024-03-01,,"Advantage Solutions Inc.",1776661,"=""ADV""","C/O ADVANTAGE SOLUTIONS, INC.","7676 FORSYTH BOULEVARD, 5TH FLOOR","ST. LOUIS",MO,MISSOURI,"US Southeast",,,"=""7389""","Business Services, NEC",541611,"Administrative Management and General Management Consulting Services",34,4,12/31/23,"1,166,491,648",12/31/23,"3,900,125,000","-63,322,000","-1,330,163,000","3,779,323,000"
35277,"Other intangible assets","Annual and Interim Indefinite-Lived Intangible Assets Impairment Assessments – sales and marketing trade names",527916,12/31/23,03/01/24,1,"PricewaterhouseCoopers LLP",,,,Irvine,CA,CALIFORNIA,"US West",10-K,2024-03-01,,"Advantage Solutions Inc.",1776661,"=""ADV""","C/O ADVANTAGE SOLUTIONS, INC.","7676 FORSYTH BOULEVARD, 5TH FLOOR","ST. LOUIS",MO,MISSOURI,"US Southeast",,,"=""7389""","Business Services, NEC",541611,"Administrative Management and General Management Consulting Services",34,4,12/31/23,"1,166,491,648",12/31/23,"3,900,125,000","-63,322,000","-1,330,163,000","3,779,323,000"
39108,"Going concern","Going Concern",539990,12/31/23,08/13/24,2,"Ernst & Young LLP",45,"Ernst & Young (Hellas) Cert. Auditors Accts.",1457,Athens,J3,GREECE,Foreign,10-K,2024-08-13,Yes,"ADVENT TECHNOLOGIES HOLDINGS, INC.",1744494,"=""ADNH""","500 RUTHERFORD AVENUE","SUITE 102",BOSTON,MA,MASSACHUSETTS,"US New England",,,"=""3690""","Miscellaneous Electrical Machinery, Equipment & Supplies",335999,"All Other Miscellaneous Electrical Equipment and Component Manufacturing",34,0,01/02/24,"13,756,871",12/31/23,"4,859,000","-71,397,000","13,369,000","34,737,000"
47643,"Going concern","Going Concern",566427,12/31/23,08/13/24,2,"Ernst & Young LLP",45,"Ernst & Young (Hellas) Cert. Auditors Accts.",1457,Athens,J3,GREECE,Foreign,10-K,2025-06-06,Yes,"ADVENT TECHNOLOGIES HOLDINGS, INC.",1744494,"=""ADNH""","500 RUTHERFORD AVENUE","SUITE 102",BOSTON,MA,MASSACHUSETTS,"US New England",,,"=""3690""","Miscellaneous Electrical Machinery, Equipment & Supplies",335999,"All Other Miscellaneous Electrical Equipment and Component Manufacturing",34,0,01/02/24,"13,756,871",12/31/23,"4,859,000","-71,397,000","13,369,000","34,737,000"
48221,"Going concern","Going Concern",570519,12/31/23,08/13/24,2,"Ernst & Young LLP",45,"Ernst & Young (Hellas) Cert. Auditors Accts.",1457,Athens,J3,GREECE,Foreign,S-1,2025-08-18,Yes,"ADVENT TECHNOLOGIES HOLDINGS, INC.",1744494,"=""ADNH""","500 RUTHERFORD AVENUE","SUITE 102",BOSTON,MA,MASSACHUSETTS,"US New England",,,"=""3690""","Miscellaneous Electrical Machinery, Equipment & Supplies",335999,"All Other Miscellaneous Electrical Equipment and Component Manufacturing",34,0,01/02/24,"13,756,871",12/31/23,"4,859,000","-71,397,000","13,369,000","34,737,000"
48310,"Revenue from customer contracts","Revenue Recognition",571028,12/31/23,08/13/24,2,"Ernst & Young LLP",45,"Ernst & Young (Hellas) Cert. Auditors Accts.",1457,Athens,J3,GREECE,Foreign,424B3,2025-08-27,Yes,"ADVENT TECHNOLOGIES HOLDINGS, INC.",1744494,"=""ADNH""","500 RUTHERFORD AVENUE","SUITE 102",BOSTON,MA,MASSACHUSETTS,"US New England",,,"=""3690""","Miscellaneous Electrical Machinery, Equipment & Supplies",335999,"All Other Miscellaneous Electrical Equipment and Component Manufacturing",34,0,01/02/24,"13,756,871",12/31/23,"4,859,000","-71,397,000","13,369,000","34,737,000"
36248,"Research and development expenses","Accrued research and development expenses – clinical and manufacturing costs",530388,12/31/23,03/18/24,2,"Ernst & Young LLP",,,,"San Francisco",CA,CALIFORNIA,"US West",10-K,2024-03-18,,"Adverum Biotechnologies, Inc.",1501756,"=""ADVM""","100 CARDINAL WAY",,"REDWOOD CITY",CA,CALIFORNIA,"US West",,,"=""2836""","Biological Products, Except Diagnostic Substances",325414,"Biological Product (except Diagnostic) Manufacturing",34,1,12/31/23,"76,074,752",12/31/23,"3,600,000","-122,116,000",,"173,010,000"
36249,Leases,"Accounting for operating lease modification",530388,12/31/23,03/18/24,2,"Ernst & Young LLP",,,,"San Francisco",CA,CALIFORNIA,"US West",10-K,2024-03-18,,"Adverum Biotechnologies, Inc.",1501756,"=""ADVM""","100 CARDINAL WAY",,"REDWOOD CITY",CA,CALIFORNIA,"US West",,,"=""2836""","Biological Products, Except Diagnostic Substances",325414,"Biological Product (except Diagnostic) Manufacturing",34,1,12/31/23,"76,074,752",12/31/23,"3,600,000","-122,116,000",,"173,010,000"
31668,"Revenue from customer contracts","Revenue Recognition - Contract cost and claim recovery estimates",519832,09/30/23,11/14/23,2,"Ernst & Young LLP",,,,"Los Angeles",CA,CALIFORNIA,"US West",10-K,2023-11-15,,AECOM,868857,"=""ACM""","13355 NOEL ROAD","SUITE 400",DALLAS,TX,TEXAS,"US Southwest",,,"=""8711""","Engineering Services",541611,"Administrative Management and General Management Consulting Services",34,81,10/02/23,"11,245,194,240",09/30/23,"14,378,461,000","55,332,000","-1,224,367,000","11,233,398,000"
37340,"Business combinations","Valuation and accounting of the stake in a.s.r.",532606,12/31/23,04/03/24,1,"PricewaterhouseCoopers LLP",108,"PricewaterhouseCoopers Accountants NV",1395,Amsterdam,P7,NETHERLANDS,Foreign,20-F,2024-04-04,,"AEGON LTD.",769218,"=""AEG""","WORLD TRADE CENTER SCHIPHOL","SCHIPHOL BOULEVARD 223",SCHIPHOL,P7,NETHERLANDS,Foreign,,,"=""6311""","Life Insurance",524113,"Direct Life Insurance Carriers",34,6,01/02/24,"12,087,034,880",12/31/23,"28,245,000,000","-2,610,000,000","9,857,000,000","333,144,000,000"
37341,"Insurance contract liabilities","Valuation of certain assets and liabilities arising from insurance contracts",532606,12/31/23,04/03/24,1,"PricewaterhouseCoopers LLP",108,"PricewaterhouseCoopers Accountants NV",1395,Amsterdam,P7,NETHERLANDS,Foreign,20-F,2024-04-04,,"AEGON LTD.",769218,"=""AEG""","WORLD TRADE CENTER SCHIPHOL","SCHIPHOL BOULEVARD 223",SCHIPHOL,P7,NETHERLANDS,Foreign,,,"=""6311""","Life Insurance",524113,"Direct Life Insurance Carriers",34,6,01/02/24,"12,087,034,880",12/31/23,"28,245,000,000","-2,610,000,000","9,857,000,000","333,144,000,000"
38250,"Accounts/loans receivable","Valuation of the account receivable from Gasoducto Sur Peruano S.A.",536026,12/31/23,05/13/24,4,"KPMG LLP",865,"Emmerich Cordova y Asociados S Civil de RL",2282,Lima,R5,PERU,Foreign,20-F,2024-05-13,,"AENZA S.A.A.",1572621,,"AV. PASEO DE LA REPUBLICA 4667",,LIMA,R5,PERU,Foreign,,,"=""1600""","Heavy Construction Other Than Bldg Const - Contractors",236210,"Industrial Building Construction",34,,,,12/31/23,"1,161,744,000","37,418,000","137,720,000","1,602,795,000"
38251,"Revenue from customer contracts","Revenue recognition from construction contracts with customers",536026,12/31/23,05/13/24,4,"KPMG LLP",865,"Emmerich Cordova y Asociados S Civil de RL",2282,Lima,R5,PERU,Foreign,20-F,2024-05-13,,"AENZA S.A.A.",1572621,,"AV. PASEO DE LA REPUBLICA 4667",,LIMA,R5,PERU,Foreign,,,"=""1600""","Heavy Construction Other Than Bldg Const - Contractors",236210,"Industrial Building Construction",34,,,,12/31/23,"1,161,744,000","37,418,000","137,720,000","1,602,795,000"
34135,"Regulatory assets and liabilities","Accounting for the Effects of Cost-Based Regulation",526392,12/31/23,02/26/24,1,"PricewaterhouseCoopers LLP",,,,Columbus,OH,OHIO,"US Midwest",10-K,2024-02-26,,"AEP Texas Inc.",1721781,,"1 RIVERSIDE PLAZA",,COLUMBUS,OH,OHIO,"US Midwest",4904,"AMERICAN ELECTRIC POWER CO INC","=""4911""","Electric Services",221122,"Electric Power Distribution",34,,,,12/31/23,"1,901,900,000","370,400,000",,"13,990,700,000"
34071,"Regulatory assets and liabilities","Accounting for the Effects of Cost-Based Regulation",526468,12/31/23,02/26/24,1,"PricewaterhouseCoopers LLP",,,,Columbus,OH,OHIO,"US Midwest",10-K,2024-02-26,,"AEP Transmission Company, LLC",1702494,,"1 RIVERSIDE PLAZA",,COLUMBUS,OH,OHIO,"US Midwest",4904,"AMERICAN ELECTRIC POWER CO INC","=""4911""","Electric Services",221121,"Electric Bulk Power Transmission and Control",34,,,,12/31/23,"1,672,000,000","614,200,000",,"15,072,500,000"
33907,Leases,"Assessment of impairment of flight equipment held for operating leases subject to impairment.",526038,12/31/23,02/23/24,4,"KPMG LLP",71,KPMG,1116,Dublin,L2,IRELAND,Foreign,20-F,2024-02-23,,"AerCap Holdings N.V.",1378789,"=""AER""","AERCAP HOUSE","65 ST. STEPHEN'S GREEN",DUBLIN,L2,IRELAND,Foreign,,,"=""7359""","Equipment Rental and Leasing, NEC",532411,"Commercial Air, Rail, and Water Transportation Equipment Rental and Leasing",34,72,01/02/24,"17,793,128,448",12/31/23,"6,860,320,000","3,136,091,000","16,425,663,000","71,274,559,000"
39466,Leases,"Assessment of impairment of flight equipment held for operating leases subject to impairment.",541198,12/31/23,02/23/24,4,"KPMG LLP",71,KPMG,1116,Dublin,L2,IRELAND,Foreign,20-F/A,2024-09-13,,"AerCap Holdings N.V.",1378789,"=""AER""","AERCAP HOUSE","65 ST. STEPHEN'S GREEN",DUBLIN,L2,IRELAND,Foreign,,,"=""7359""","Equipment Rental and Leasing, NEC",532411,"Commercial Air, Rail, and Water Transportation Equipment Rental and Leasing",34,72,01/02/24,"17,793,128,448",12/31/23,"6,860,320,000","3,136,091,000","16,425,663,000","71,274,559,000"
30520,Goodwill,"Goodwill— Refer to Note 1 and Note 6 to the financial statements",513975,04/30/23,06/27/23,3,"Deloitte & Touche LLP",,,,"Los Angeles",CA,CALIFORNIA,"US West",10-K,2023-06-28,,"AeroVironment Inc",1368622,"=""AVAV""","241 18TH STREET SOUTH, SUITE 650",,ARLINGTON,VA,VIRGINIA,"US Mid Atlantic",,,"=""3721""",Aircraft,336411,"Aircraft Manufacturing",34,101,04/30/23,"2,639,779,328",04/30/23,"540,536,000","-176,212,000","326,592,000","824,577,000"
34170,"Long-lived assets","Long-lived Asset Impairments of Coal and Pet Coke-fired Generation Assets",526465,12/31/23,02/26/24,2,"Ernst & Young LLP",,,,Tysons,VA,VIRGINIA,"US Mid Atlantic",10-K,2024-02-26,,"AES CORP",874761,"=""AES""","4300 WILSON BOULEVARD",,ARLINGTON,VA,VIRGINIA,"US Mid Atlantic",,,"=""4991""","Cogeneration Services & Small Power Producers",221122,"Electric Power Distribution",34,19,12/31/23,"12,891,594,752",12/31/23,"12,668,000,000","249,000,000","1,361,000,000","44,799,000,000"
34171,"Business combinations","Accounting for the Bellefield and Rexford Renewable Acquisitions",526465,12/31/23,02/26/24,2,"Ernst & Young LLP",,,,Tysons,VA,VIRGINIA,"US Mid Atlantic",10-K,2024-02-26,,"AES CORP",874761,"=""AES""","4300 WILSON BOULEVARD",,ARLINGTON,VA,VIRGINIA,"US Mid Atlantic",,,"=""4991""","Cogeneration Services & Small Power Producers",221122,"Electric Power Distribution",34,19,12/31/23,"12,891,594,752",12/31/23,"12,668,000,000","249,000,000","1,361,000,000","44,799,000,000"
34172,"Equity investments and joint ventures","Allocation of Earnings to Noncontrolling Interests in Tax Equity Partnerships",526465,12/31/23,02/26/24,2,"Ernst & Young LLP",,,,Tysons,VA,VIRGINIA,"US Mid Atlantic",10-K,2024-02-26,,"AES CORP",874761,"=""AES""","4300 WILSON BOULEVARD",,ARLINGTON,VA,VIRGINIA,"US Mid Atlantic",,,"=""4991""","Cogeneration Services & Small Power Producers",221122,"Electric Power Distribution",34,19,12/31/23,"12,891,594,752",12/31/23,"12,668,000,000","249,000,000","1,361,000,000","44,799,000,000"
36181,"Other debt","Warrant Liability – Series A Warrants – Refer to Notes 1, 4, 10, and 11 to the financial statements",530261,12/31/23,03/15/24,3,"Deloitte & Touche LLP",,,,"San Jose",CA,CALIFORNIA,"US West",10-K,2024-03-15,,"Aeva Technologies, Inc.",1789029,"=""AEVA""","555 ELLIS STREET",,"MOUNTAIN VIEW",CA,CALIFORNIA,"US West",,,"=""3714""","Motor Vehicle Parts and Accessories",334413,"Semiconductor and Related Device Manufacturing",34,4,12/31/23,"992,770,816",12/31/23,"4,312,000","-149,333,000","225,817,000","257,385,000"
32967,"Equity investments and joint ventures","Impairment Assessment for Certain Equity Method Investments in Affiliates",524901,12/31/23,02/16/24,1,"PricewaterhouseCoopers LLP",,,,Boston,MA,MASSACHUSETTS,"US New England",10-K,2024-02-16,,"AFFILIATED MANAGERS GROUP, INC.",1004434,"=""AMG""","777 SOUTH FLAGLER DRIVE","SUITE 1401 EAST TOWER","WEST PALM BEACH",FL,FLORIDA,"US Southeast",,,"=""6282""","Investment Advice",523930,"Investment Advice",34,150,01/02/24,"5,065,886,208",12/31/23,"1,934,000,000","672,900,000","-354,700,000","9,059,600,000"
36839,"Going concern","Going concern assessment",531476,12/31/23,03/28/24,4,"KPMG LLP",254,"KPMG AG Wirtschaftsprüfungsgesellschaft",1021,Mannheim,2M,GERMANY,Foreign,20-F,2024-03-28,,"Affimed N.V.",1608390,"=""AFMDQ""","GOTTLIEB-DAIMLER-STRASSE 2",,MANNHEIM,2M,GERMANY,Foreign,,,"=""2834""","Pharmaceutical Preparations",325414,"Biological Product (except Diagnostic) Manufacturing",34,1,01/02/24,"93,337,088",12/31/23,"9,141,000","-117,025,000","63,829,000","107,325,000"
31071,"Allowance for credit losses","Allowance for Credit Losses — Refer to Notes 2 and 4 to the financial statements",516338,06/30/23,08/25/23,3,"Deloitte & Touche LLP",,,,"San Francisco",CA,CALIFORNIA,"US West",10-K,2023-08-25,,"Affirm Holdings, Inc.",1820953,"=""AFRM""","650 CALIFORNIA STREET",,"SAN FRANCISCO",CA,CALIFORNIA,"US West",,,"=""6141""","Personal Credit Institutions",522320,"Financial Transactions Processing, Reserve, and Clearinghouse Activities",34,15,06/30/23,"3,636,741,632",06/30/23,"1,587,985,000","-985,345,000","1,957,178,000","8,155,615,000"
33554,"Long-term investments","Fair value of certain privately issued securities",525750,12/31/23,02/22/24,4,"KPMG LLP",,,,Atlanta,GA,GEORGIA,"US Southeast",10-K,2024-02-22,,"AFLAC INC",4977,"=""AFL""","1932 WYNNTON RD",,COLUMBUS,GA,GEORGIA,"US Southeast",,,"=""6321""","Accident and Health Insurance",524114,"Direct Health and Medical Insurance Carriers",34,83,01/02/24,"48,667,156,480",12/31/23,"18,701,000,000","4,659,000,000",,"126,724,000,000"
33555,"Insurance contract liabilities","Valuation of the liability for future policy benefits",525750,12/31/23,02/22/24,4,"KPMG LLP",,,,Atlanta,GA,GEORGIA,"US Southeast",10-K,2024-02-22,,"AFLAC INC",4977,"=""AFL""","1932 WYNNTON RD",,COLUMBUS,GA,GEORGIA,"US Southeast",,,"=""6321""","Accident and Health Insurance",524114,"Direct Health and Medical Insurance Carriers",34,83,01/02/24,"48,667,156,480",12/31/23,"18,701,000,000","4,659,000,000",,"126,724,000,000"
35965,"Business combinations","Accounting for Business combinations",530127,12/31/23,03/14/24,2,"Ernst & Young LLP",34,"Ernst & Young Auditores Independentes SS",1448,"Belo Horizonte",D5,BRAZIL,Foreign,6-K,2024-03-14,,"Afya Ltd",1771007,"=""AFYA""","ALAMEDA OSCAR NIEMEYER, NO. 119","15TH FLOOR, VILA DA SERRA","NOVA LIMA, MINAS GERAIS",D5,BRAZIL,Foreign,,,"=""8200""","Services-Educational Services",611710,"Educational Support Services",34,22,12/31/23,"968,134,720",12/31/23,"592,044,000","83,460,000","-245,905,000","1,561,364,000"
37928,"Business combinations","Accounting for Business combinations",534597,12/31/23,03/14/24,2,"Ernst & Young LLP",34,"Ernst & Young Auditores Independentes SS",1448,"Belo Horizonte",D5,BRAZIL,Foreign,20-F,2024-04-26,,"Afya Ltd",1771007,"=""AFYA""","ALAMEDA OSCAR NIEMEYER, NO. 119","15TH FLOOR, VILA DA SERRA","NOVA LIMA, MINAS GERAIS",D5,BRAZIL,Foreign,,,"=""8200""","Services-Educational Services",611710,"Educational Support Services",34,22,12/31/23,"968,134,720",12/31/23,"592,044,000","83,460,000","-245,905,000","1,561,364,000"
35714,"Business combinations","Acquisition of Western Asset Mortgage Capital Corporation — Acquisition Date Fair Value of Residential Mortgage Loans and Commercial Loans",529622,12/31/23,03/11/24,1,"PricewaterhouseCoopers LLP",,,,"New York",NY,"NEW YORK","US Mid Atlantic",10-K,2024-03-11,,"AG Mortgage Investment Trust, Inc.",1514281,"=""MITN""","245 PARK AVENUE","26TH FLOOR","NEW YORK",NY,"NEW YORK","US Mid Atlantic",,,"=""6798""","Real Estate Investment Trusts",525990,"Other Financial Vehicles",34,,,,12/31/23,"53,848,000","53,784,000",,"6,126,428,000"
35715,"Other investments","Fair Value of Investments in Residential Mortgage Loans",529622,12/31/23,03/11/24,1,"PricewaterhouseCoopers LLP",,,,"New York",NY,"NEW YORK","US Mid Atlantic",10-K,2024-03-11,,"AG Mortgage Investment Trust, Inc.",1514281,"=""MITN""","245 PARK AVENUE","26TH FLOOR","NEW YORK",NY,"NEW YORK","US Mid Atlantic",,,"=""6798""","Real Estate Investment Trusts",525990,"Other Financial Vehicles",34,,,,12/31/23,"53,848,000","53,784,000",,"6,126,428,000"
34284,"Sales return and allowances","Assessment of the reserve and allowance for volume discount and sales incentive programs in certain geographic regions",526842,12/31/23,02/27/24,4,"KPMG LLP",,,,Atlanta,GA,GEORGIA,"US Southeast",10-K,2024-02-27,,"AGCO CORP /DE",880266,"=""AGCO""","4205 RIVER GREEN PKWAY",,DULUTH,GA,GEORGIA,"US Southeast",,,"=""3523""","Farm Machinery and Equipment",333111,"Farm Machinery and Equipment Manufacturing",34,122,01/02/24,"9,143,588,864",12/31/23,"14,412,400,000","1,171,400,000","3,014,500,000","11,421,200,000"
34285,"Other income taxes","Assessment of gross unrecognized income tax benefits in certain jurisdictions",526842,12/31/23,02/27/24,4,"KPMG LLP",,,,Atlanta,GA,GEORGIA,"US Southeast",10-K,2024-02-27,,"AGCO CORP /DE",880266,"=""AGCO""","4205 RIVER GREEN PKWAY",,DULUTH,GA,GEORGIA,"US Southeast",,,"=""3523""","Farm Machinery and Equipment",333111,"Farm Machinery and Equipment Manufacturing",34,122,01/02/24,"9,143,588,864",12/31/23,"14,412,400,000","1,171,400,000","3,014,500,000","11,421,200,000"
34286,Goodwill,"Assessment of goodwill impairment for certain reporting units",526842,12/31/23,02/27/24,4,"KPMG LLP",,,,Atlanta,GA,GEORGIA,"US Southeast",10-K,2024-02-27,,"AGCO CORP /DE",880266,"=""AGCO""","4205 RIVER GREEN PKWAY",,DULUTH,GA,GEORGIA,"US Southeast",,,"=""3523""","Farm Machinery and Equipment",333111,"Farm Machinery and Equipment Manufacturing",34,122,01/02/24,"9,143,588,864",12/31/23,"14,412,400,000","1,171,400,000","3,014,500,000","11,421,200,000"
36844,"Sales return and allowances","Product Return Reserve Estimate",531460,12/31/23,03/28/24,2,"Ernst & Young LLP",,,,Iselin,NJ,"NEW JERSEY","US Mid Atlantic",10-K,2024-03-28,Yes,"AGILE THERAPEUTICS INC",1261249,,"500 COLLEGE ROAD EAST","SUITE 310",PRINCETON,NJ,"NEW JERSEY","US Mid Atlantic",,,"=""2834""","Pharmaceutical Preparations",325412,"Pharmaceutical Preparation Manufacturing",34,2,01/02/24,"4,621,449",12/31/23,"19,593,000","-14,465,000",,"10,255,000"
32001,Inventory,"Valuation of Inventory – Estimate of Excess and Obsolete Inventory",521399,10/31/23,12/19/23,1,"PricewaterhouseCoopers LLP",,,,"San Jose",CA,CALIFORNIA,"US West",10-K,2023-12-20,,"AGILENT TECHNOLOGIES, INC.",1090872,"=""A""","5301 STEVENS CREEK BLVD",,"SANTA CLARA",CA,CALIFORNIA,"US West",,,"=""3826""","Laboratory Analytical Instruments",334515,"Instrument Manufacturing for Measuring and Testing Electricity and Electrical Signals",34,104,11/02/23,"30,566,592,512",10/31/23,"6,833,000,000","1,240,000,000","1,410,000,000","10,763,000,000"
39373,Inventory,"Valuation of Inventory – Estimate of Excess and Obsolete Inventory",540681,10/31/23,12/19/23,1,"PricewaterhouseCoopers LLP",,,,"San Jose",CA,CALIFORNIA,"US West",8-K,2024-09-03,,"AGILENT TECHNOLOGIES, INC.",1090872,"=""A""","5301 STEVENS CREEK BLVD",,"SANTA CLARA",CA,CALIFORNIA,"US West",,,"=""3826""","Laboratory Analytical Instruments",334515,"Instrument Manufacturing for Measuring and Testing Electricity and Electrical Signals",34,104,11/02/23,"30,566,592,512",10/31/23,"6,833,000,000","1,240,000,000","1,410,000,000","10,763,000,000"
35453,"Internal controls","Sufficiency of audit evidence",528577,12/31/23,03/05/24,4,"KPMG LLP",,,,Minneapolis,MN,MINNESOTA,"US Midwest",10-K,2024-03-06,,"AGILITI, INC. \DE",1749704,,"11095 VIKING DRIVE, SUITE 300",,"EDEN PRAIRIE",MN,MINNESOTA,"US Midwest",,,"=""7350""","Services-Miscellaneous Equipment Rental & Leasing",532490,"Other Commercial and Industrial Machinery and Equipment Rental and Leasing",34,8,12/31/23,"1,071,990,528",12/31/23,"1,174,604,000","-19,425,000","-728,877,000","2,398,944,000"
34317,"Insurance contract liabilities","Valuation of incurred but not reported claims",526644,12/31/23,02/27/24,2,"Ernst & Young LLP",,,,"Los Angeles",CA,CALIFORNIA,"US West",10-K,2024-02-27,,"agilon health, inc.",1831097,"=""AGL""","440 POLARIS PARKWAY","SUITE 550",WESTERVILLE,OH,OHIO,"US Midwest",,,"=""8090""","Services-Misc Health & Allied Services, NEC",541511,"Custom Computer Programming Services",34,13,12/31/23,"5,100,156,928",12/31/23,"4,316,363,000","-262,596,000","573,937,000","1,740,866,000"
32929,"Revenue from customer contracts","Revenue Recognition - PYRUKYND® Product Revenue",524819,12/31/23,02/15/24,1,"PricewaterhouseCoopers LLP",,,,Boston,MA,MASSACHUSETTS,"US New England",10-K,2024-02-15,,"AGIOS PHARMACEUTICALS, INC.",1439222,"=""AGIO""","88 SIDNEY STREET",,CAMBRIDGE,MA,MASSACHUSETTS,"US New England",,,"=""2834""","Pharmaceutical Preparations",325412,"Pharmaceutical Preparation Manufacturing",34,22,12/31/23,"1,245,896,832",12/31/23,"26,823,000","-352,088,000",,"937,118,000"
33708,"Depreciation and amortization","Agency securities and non-agency securities of high credit quality net premium amortization",525476,12/31/23,02/22/24,2,"Ernst & Young LLP",,,,Tysons,VA,VIRGINIA,"US Mid Atlantic",10-K,2024-02-22,,"AGNC Investment Corp.",1423689,"=""AGNC""","7373 WISCONSIN AVENUE, 22ND FLOOR",,BETHESDA,MD,MARYLAND,"US Mid Atlantic",,,"=""6798""","Real Estate Investment Trusts",525990,"Other Financial Vehicles",34,10,01/02/24,"6,482,882,560",12/31/23,"251,000,000","155,000,000","7,731,000,000","71,596,000,000"
36545,"Business combinations","Acquisition of Canadian assets of Yamana Gold Inc., including Canadian Malartic Complex",531084,12/31/23,03/22/24,2,"Ernst & Young LLP",192,"Ernst & Young LLP Chartered Accountants",1263,Toronto,A6,ONTARIO,Canada,40-F,2024-03-25,,"AGNICO EAGLE MINES LTD",2809,"=""AEM""","145 KING STREET EAST","SUITE 400",TORONTO,A6,ONTARIO,Canada,,,"=""1040""","Metal Mining",212221,"Gold Ore Mining",34,55,12/31/23,"27,276,873,728",12/31/23,"6,626,909,000","1,941,307,000","15,265,243,000","28,684,949,000"
36546,Goodwill,"Impairment assessment for Goodwill and Long-Lived Assets",531084,12/31/23,03/22/24,2,"Ernst & Young LLP",192,"Ernst & Young LLP Chartered Accountants",1263,Toronto,A6,ONTARIO,Canada,40-F,2024-03-25,,"AGNICO EAGLE MINES LTD",2809,"=""AEM""","145 KING STREET EAST","SUITE 400",TORONTO,A6,ONTARIO,Canada,,,"=""1040""","Metal Mining",212221,"Gold Ore Mining",34,55,12/31/23,"27,276,873,728",12/31/23,"6,626,909,000","1,941,307,000","15,265,243,000","28,684,949,000"
37821,"Allowance for credit losses","Valuation of allowance for current expected credit losses – accounts receivable, net",534245,12/31/23,04/24/24,1,"PricewaterhouseCoopers LLP",94,"PricewaterhouseCoopers Zhong Tian LLP",1424,Shanghai,F4,CHINA,Foreign,20-F,2024-04-24,,"Agora, Inc.",1802883,"=""API""","2804 MISSION COLLEGE BLVD,",,"SANTA CLARA",CA,CALIFORNIA,"US West",,,"=""7372""","Prepackaged Software",518210,"Data Processing, Hosting, and Related Services",34,3,12/31/23,"242,486,000",12/31/23,"141,538,000","-87,219,000","436,229,000","674,595,000"
38014,"Revenue from customer contracts","Revenue recognition: Estimate of variable renewal commissions for long-term life insurance products and impact on revenue recognized — Refer to Note 2(q) to the financial statements",535017,12/31/23,04/29/24,3,"Deloitte & Touche LLP",499,"Deloitte Touche Tohmatsu Certified Public Accountants LLP",1113,Shenzhen,F4,CHINA,Foreign,20-F,2024-04-29,,"AIFU Inc.",1413855,"=""AIFU""","60/F PEARL RIVER TOWER","NO.15 WEST ZHUJIANG ROAD TIANHE DISTRICT",GUANGZHOU,F4,CHINA,Foreign,,,"=""6411""","Insurance Agents, Brokers, and Service",524126,"Direct Property and Casualty Insurance Carriers",34,6,01/02/24,"343,309,600",12/31/23,"450,973,000","39,547,000","231,070,000","571,175,000"
38015,"Business combinations","Business combination: Estimate of the fair values of identifiable intangible assets for purchase price allocation — Refer to Note 3(a) and 3(b) to the financial statements",535017,12/31/23,04/29/24,3,"Deloitte & Touche LLP",499,"Deloitte Touche Tohmatsu Certified Public Accountants LLP",1113,Shenzhen,F4,CHINA,Foreign,20-F,2024-04-29,,"AIFU Inc.",1413855,"=""AIFU""","60/F PEARL RIVER TOWER","NO.15 WEST ZHUJIANG ROAD TIANHE DISTRICT",GUANGZHOU,F4,CHINA,Foreign,,,"=""6411""","Insurance Agents, Brokers, and Service",524126,"Direct Property and Casualty Insurance Carriers",34,6,01/02/24,"343,309,600",12/31/23,"450,973,000","39,547,000","231,070,000","571,175,000"
34214,"Other investments","Impairment of mezzanine investment",526313,12/31/23,02/26/24,2,"Ernst & Young LLP",,,,Denver,CO,COLORADO,"US West",10-K,2024-02-26,,"Aimco OP L.P.",1820878,,"4582 S ULSTER STREET, SUITE 1450",,DENVER,CO,COLORADO,"US West",,,"=""6500""","Real Estate",531110,"Lessors of Residential Buildings and Dwellings",34,,,,12/31/23,"186,995,000","-175,234,000",,"2,089,475,000"
32909,Leases,"Assessment of the carrying value of flight equipment subject to operating leases",524830,12/31/23,02/15/24,4,"KPMG LLP",,,,Irvine,CA,CALIFORNIA,"US West",10-K,2024-02-15,,"AIR LEASE CORP",1487712,"=""AL""","2000 AVENUE OF THE STARS","SUITE 1000N","LOS ANGELES",CA,CALIFORNIA,"US West",,,"=""7359""","Equipment Rental and Leasing, NEC",532411,"Commercial Air, Rail, and Water Transportation Equipment Rental and Leasing",34,42,12/31/23,"4,656,482,816",12/31/23,"2,684,977,000","614,622,000",,"30,452,252,000"
31686,"Revenue from customer contracts","Revenue Recognition – On-site Customer Contracts – Refer to Notes 1 and 6 to the Financial Statements",519876,09/30/23,11/16/23,3,"Deloitte & Touche LLP",,,,Philadelphia,PA,PENNSYLVANIA,"US Mid Atlantic",10-K,2023-11-16,,"Air Products & Chemicals, Inc.",2969,"=""APD""","1940 AIR PRODUCTS BLVD.",,ALLENTOWN,PA,PENNSYLVANIA,"US Mid Atlantic",,,"=""2810""","Industrial Inorganic Chemicals",325120,"Industrial Gas Manufacturing",34,279,10/02/23,"61,997,277,184",09/30/23,"12,600,000,000","2,300,200,000","13,116,600,000","32,002,500,000"
30499,"Other investments","Redeemable non-controlling interest – valuation of Contrail Aviation Support, LLC — Refer to Notes 1 and 4 to the financial statements",513941,03/31/23,06/27/23,3,"Deloitte & Touche LLP",,,,Minneapolis,MN,MINNESOTA,"US Midwest",10-K,2023-06-27,,"AIR T INC",353184,"=""AIRT""","11020 DAVID TAYLOR DRIVE","SUITE 305",CHARLOTTE,NC,"NORTH CAROLINA","US Southeast",,,"=""4513""","Air Courier Services",492110,Couriers,34,25,03/31/23,"70,600,272",03/31/23,"247,323,000","-12,295,000","1,948,000","189,562,000"
30534,"Other investments","Redeemable non-controlling interest – valuation of Contrail Aviation Support, LLC — Refer to Notes 1 and 4 to the financial statements",513999,03/31/23,06/27/23,3,"Deloitte & Touche LLP",,,,Minneapolis,MN,MINNESOTA,"US Midwest",10-K/A,2023-06-28,,"AIR T INC",353184,"=""AIRT""","11020 DAVID TAYLOR DRIVE","SUITE 305",CHARLOTTE,NC,"NORTH CAROLINA","US Southeast",,,"=""4513""","Air Courier Services",492110,Couriers,34,25,03/31/23,"70,600,272",03/31/23,"247,323,000","-12,295,000","1,948,000","189,562,000"
34936,"Other debt","Stock Warrant Obligations - Fair Value Measurements - Level 3 Liabilities - Refer to Note D to the Financial Statements",527668,12/31/23,02/29/24,3,"Deloitte & Touche LLP",,,,Cincinnati,OH,OHIO,"US Midwest",10-K,2024-02-29,,"Air Transport Services Group, Inc.",894081,"=""ATSG""","145 HUNTER DR",,WILMINGTON,OH,OHIO,"US Midwest",,,"=""4513""","Air Courier Services",492110,Couriers,34,17,01/02/24,"1,078,308,352",12/31/23,"2,070,611,000","60,327,000","886,275,000","3,882,090,000"
32976,"Uncertain tax positions","Uncertain Tax Positions",524920,12/31/23,02/16/24,1,"PricewaterhouseCoopers LLP",,,,"San Francisco",CA,CALIFORNIA,"US West",10-K,2024-02-16,,"Airbnb, Inc.",1559720,"=""ABNB""","888 BRANNAN ST.",,"SAN FRANCISCO",CA,CALIFORNIA,"US West",,,"=""7340""","Services-To Dwellings & Other Buildings",511210,"Software Publishers",34,136,12/31/23,"59,629,318,144",12/31/23,"9,917,000,000","4,792,000,000","7,373,000,000","20,645,000,000"
29395,Leases,"Recoverability assessment and Impairment of flight equipment held for lease",509795,02/28/23,04/25/23,2,"Ernst & Young LLP",,,,Stamford,CT,CONNECTICUT,"US New England",10-K,2023-04-25,,"Aircastle LTD",1362988,"=""AYR""","C/O AIRCASTLE ADVISOR LLC","201 TRESSER BLVD, SUITE 400",STAMFORD,CT,CONNECTICUT,"US New England",,,"=""7359""","Equipment Rental and Leasing, NEC",532411,"Commercial Air, Rail, and Water Transportation Equipment Rental and Leasing",34,,,,02/28/23,"796,033,000","62,759,000","1,871,458,000","7,266,851,000"
29396,"Other income taxes","Accounting for Income Tax
",509795,02/28/23,04/25/23,2,"Ernst & Young LLP",,,,Stamford,CT,CONNECTICUT,"US New England",10-K,2023-04-25,,"Aircastle LTD",1362988,"=""AYR""","C/O AIRCASTLE ADVISOR LLC","201 TRESSER BLVD, SUITE 400",STAMFORD,CT,CONNECTICUT,"US New England",,,"=""7359""","Equipment Rental and Leasing, NEC",532411,"Commercial Air, Rail, and Water Transportation Equipment Rental and Leasing",34,,,,02/28/23,"796,033,000","62,759,000","1,871,458,000","7,266,851,000"
34877,"Revenue from customer contracts","Revenue Recognition",526961,12/31/23,02/28/24,1,"PricewaterhouseCoopers LLP",,,,Boston,MA,MASSACHUSETTS,"US New England",10-K,2024-02-28,,"AKAMAI TECHNOLOGIES INC",1086222,"=""AKAM""","145 BROADWAY",,CAMBRIDGE,MA,MASSACHUSETTS,"US New England",,,"=""7389""","Business Services, NEC",334119,"Other Computer Peripheral Equipment Manufacturing",34,117,01/02/24,"17,629,194,240",12/31/23,"3,811,920,000","547,629,000","1,210,542,000","9,900,037,000"
35936,"Sales return and allowances","Revenue Recognition - Payor Mix Impact on Measuring Variable Consideration, Specifically Payor Rebates",530032,12/31/23,03/14/24,2,"Ernst & Young LLP",,,,Boston,MA,MASSACHUSETTS,"US New England",10-K,2024-03-14,,"Akebia Therapeutics, Inc.",1517022,"=""AKBA""","245 FIRST STREET",,CAMBRIDGE,MA,MASSACHUSETTS,"US New England",,,"=""2834""","Pharmaceutical Preparations",325412,"Pharmaceutical Preparation Manufacturing",34,1,01/02/24,"239,254,560",12/31/23,"194,623,000","-51,925,000","-125,670,000","241,703,000"
34913,"Research and development expenses","Accrued Expenses - Research and Development Expenses & Prepaid Expenses - Research and Development Expenses — Refer to Note 2 and 5 to the financial statements",527477,12/31/23,02/28/24,3,"Deloitte & Touche LLP",,,,Morristown,NJ,"NEW JERSEY","US Mid Atlantic",10-K,2024-02-29,,"Akero Therapeutics, Inc.",1744659,"=""AKRO""","601 GATEWAY BOULEVARD, SUITE 350",,"SOUTH SAN FRANCISCO",CA,CALIFORNIA,"US West",,,"=""2834""","Pharmaceutical Preparations",325412,"Pharmaceutical Preparation Manufacturing",34,23,01/02/24,"1,308,065,664",12/31/23,,"-151,759,000",,"580,271,000"
32879,"Regulatory assets and liabilities","Impact of Rate Regulation on the Financial Statements – Refer to Note 1 (Summary of Significant Accounting Policies – Regulatory Assets and Liabilities) and Note 2 (Regulatory Matters – Alabama Power) to the financial statements",524762,12/31/23,02/14/24,3,"Deloitte & Touche LLP",,,,Birmingham,AL,ALABAMA,"US Southeast",10-K,2024-02-15,,"ALABAMA POWER CO",3153,,"600 N 18TH ST","P O BOX 2641",BIRMINGHAM,AL,ALABAMA,"US Southeast",92122,"SOUTHERN CO","=""4911""","Electric Services",221122,"Electric Power Distribution",34,,,,12/31/23,"7,050,000,000","1,370,000,000",,"35,780,000,000"
33614,Inventory,"Sufficiency of evidence over the existence of inventory",525696,12/31/23,02/22/24,4,"KPMG LLP",,,,"San Antonio",TX,TEXAS,"US Southwest",10-K,2024-02-22,,"ALAMO GROUP INC",897077,"=""ALG""","1627 E WALNUT",,SEGUIN,TX,TEXAS,"US Southwest",,,"=""3523""","Farm Machinery and Equipment",333111,"Farm Machinery and Equipment Manufacturing",34,210,12/31/23,"2,514,751,232",12/31/23,"1,689,651,000","136,161,000","557,931,000","1,409,386,000"
35929,Inventory,"Sufficiency of evidence over the existence of inventory",529885,12/31/23,02/22/24,4,"KPMG LLP",,,,"San Antonio",TX,TEXAS,"US Southwest",ARS,2024-03-13,,"ALAMO GROUP INC",897077,"=""ALG""","1627 E WALNUT",,SEGUIN,TX,TEXAS,"US Southwest",,,"=""3523""","Farm Machinery and Equipment",333111,"Farm Machinery and Equipment Manufacturing",34,210,12/31/23,"2,514,751,232",12/31/23,"1,689,651,000","136,161,000","557,931,000","1,409,386,000"
33682,"Property, plant and equipment","Evaluation of indicators of impairment or impairment reversal of mineral, property, plant and equipment of the Young-Davidson cash generating unit",525902,12/31/23,02/21/24,4,"KPMG LLP",187,"KPMG LLP Chartered Accountants",85,Toronto,A6,ONTARIO,Canada,6-K,2024-02-22,,"ALAMOS GOLD INC",1178819,"=""AGI""","181 BAY STREET","SUITE 3910",TORONTO,A6,ONTARIO,Canada,,,"=""1040""","Metal Mining",212221,"Gold Ore Mining",34,13,12/31/23,"5,347,010,560",12/31/23,"1,023,300,000","210,000,000",,"4,001,200,000"
36663,"Property, plant and equipment","Evaluation of indicators of impairment or impairment reversal of mineral, property, plant and equipment of the Young-Davidson cash generating unit",531131,12/31/23,02/21/24,4,"KPMG LLP",187,"KPMG LLP Chartered Accountants",85,Toronto,A6,ONTARIO,Canada,40-F,2024-03-26,,"ALAMOS GOLD INC",1178819,"=""AGI""","181 BAY STREET","SUITE 3910",TORONTO,A6,ONTARIO,Canada,,,"=""1040""","Metal Mining",212221,"Gold Ore Mining",34,13,12/31/23,"5,347,010,560",12/31/23,"1,023,300,000","210,000,000",,"4,001,200,000"
33482,"Revenue from customer contracts","Revenue recognition",525598,12/31/23,02/22/24,1,"PricewaterhouseCoopers LLP",,,,Washington,DC,"DISTRICT OF COLUMBIA","US Mid Atlantic",10-K,2024-02-22,,"Alarm.com Holdings, Inc.",1459200,"=""ALRM""","8281 GREENSBORO DRIVE","SUITE 100",TYSONS,VA,VIRGINIA,"US Mid Atlantic",,,"=""7372""","Prepackaged Software",541511,"Custom Computer Programming Services",34,65,12/31/23,"3,222,481,408",12/31/23,"881,682,000","81,043,000","491,792,000","1,439,563,000"
36003,"Goodwill and intangible assets","Goodwill and Intangible Assets Impairment Assessment – CyberKick cash-generating unit",529971,12/31/23,03/14/24,1,"PricewaterhouseCoopers LLP",223,"Kesselman & Kesselman",1309,"Tel Aviv",L3,ISRAEL,Foreign,20-F,2024-03-14,,"Alarum Technologies Ltd.",1725332,"=""ALAR""","30 HAARBA'A STREET","TEL-AVIV (P.O.BOX 174)",TEL-AVIV,L3,ISRAEL,Foreign,,,"=""7372""","Prepackaged Software",511210,"Software Publishers",34,9,01/02/24,"29,495,748",12/31/23,"26,521,000","-5,525,000","7,677,000","20,066,000"
32768,"Revenue from customer contracts","Assessment of Mileage Plan model",524609,12/31/23,02/14/24,4,"KPMG LLP",,,,Seattle,WA,WASHINGTON,"US West",10-K,2024-02-14,,"ALASKA AIR GROUP, INC.",766421,"=""ALK""","19300 INTERNATIONAL BOULEVARD",,SEATTLE,WA,WASHINGTON,"US West",,,"=""4512""","Air Transportation, Scheduled",481111,"Scheduled Passenger Air Transportation",34,38,01/02/24,"4,909,555,200",12/31/23,"10,426,000,000","235,000,000","2,080,000,000","14,613,000,000"
34115,"Revenue from customer contracts","Evaluation of estimated total contract costs at completion for Albany Engineered Composites revenue recognition for certain firm-fixed-price contracts",526367,12/31/23,02/26/24,4,"KPMG LLP",,,,Albany,NY,"NEW YORK","US Mid Atlantic",10-K,2024-02-26,,"ALBANY INTERNATIONAL CORP /DE/",819793,"=""AIN""","216 AIRPORT DRIVE",,ROCHESTER,NH,"NEW HAMPSHIRE","US New England",,,"=""2221""","Broadwoven Fabric Mills, Manmade Fiber and Silk",313210,"Broadwoven Fabric Mills",34,98,12/31/23,"3,063,979,264",12/31/23,"1,147,909,000","111,120,000","736,541,000","1,835,014,000"
32864,Goodwill,"Goodwill Impairment Assessment – Refining Solutions Reporting Unit",524866,12/31/23,02/14/24,1,"PricewaterhouseCoopers LLP",,,,Charlotte,NC,"NORTH CAROLINA","US Southeast",10-K,2024-02-15,,"ALBEMARLE CORP",915913,"=""ALB""","4250 CONGRESS STREET","SUITE 900",CHARLOTTE,NC,"NORTH CAROLINA","US Southeast",,,"=""2821""","Plastics Material and Synthetic Resins, and Nonvulcanizable Elastomers",325211,"Plastics Material and Resin Manufacturing",34,144,12/31/23,"16,955,594,752",12/31/23,"6,733,624,000","4,290,592,000","7,520,593,000","18,270,652,000"
29417,"Other contingent liabilities","Self-Insurance Liabilities—Refer to Note 1 to the financial statements",509819,02/25/23,04/25/23,3,"Deloitte & Touche LLP",,,,Boise,ID,IDAHO,"US West",10-K,2023-04-25,,"Albertsons Companies, Inc.",1646972,"=""ACI""","250 PARKCENTER BLVD.",,BOISE,ID,IDAHO,"US West",,,"=""5411""","Grocery Stores",445110,"Supermarkets and Other Grocery (except Convenience) Stores",34,20,02/27/23,"10,842,921,984",02/25/23,"77,649,700,000","1,513,500,000","-2,010,000,000","26,168,200,000"
33359,"Asset retirement and environmental obligations","Asset Retirement Obligations – Mine Reclamation and Closure of Bauxite Residue Areas",525437,12/31/23,02/21/24,1,"PricewaterhouseCoopers LLP",,,,Pittsburgh,PA,PENNSYLVANIA,"US Mid Atlantic",10-K,2024-02-21,,"Alcoa Corp",1675149,"=""AA""","201 ISABELLA STREET","SUITE 500",PITTSBURGH,PA,PENNSYLVANIA,"US Mid Atlantic",,,"=""3334""","Primary Production of Aluminum",331312,"Primary Aluminum Production",34,33,01/02/24,"5,944,899,072",12/31/23,"10,551,000,000","-651,000,000",,"14,155,000,000"
34360,"Goodwill and intangible assets","Goodwill and Alcon Brand Name Impairment Assessments",526605,12/31/23,02/27/24,1,"PricewaterhouseCoopers LLP",,,,"Fort Worth",TX,TEXAS,"US Southwest",20-F,2024-02-27,,"ALCON INC",1167379,"=""ALC""","6201 SOUTH FREEWAY",,"FORT WORTH",TX,TEXAS,"US Southwest",,,"=""3851""","Ophthalmic Goods",339115,"Ophthalmic Goods Manufacturing",34,77,01/02/24,"37,756,301,312",12/31/23,"9,455,000,000","974,000,000","2,638,000,000","29,614,000,000"
34361,"Other intangible assets","In-Process Research and Development Intangible Asset Impairment Assessments",526605,12/31/23,02/27/24,1,"PricewaterhouseCoopers LLP",,,,"Fort Worth",TX,TEXAS,"US Southwest",20-F,2024-02-27,,"ALCON INC",1167379,"=""ALC""","6201 SOUTH FREEWAY",,"FORT WORTH",TX,TEXAS,"US Southwest",,,"=""3851""","Ophthalmic Goods",339115,"Ophthalmic Goods Manufacturing",34,77,01/02/24,"37,756,301,312",12/31/23,"9,455,000,000","974,000,000","2,638,000,000","29,614,000,000"
34386,"Revenue from customer contracts","Revenue Recognition",526706,12/31/23,02/27/24,2,"Ernst & Young LLP",,,,"San Mateo",CA,CALIFORNIA,"US West",10-K,2024-02-27,,"Alector, Inc.",1653087,"=""ALEC""","131 OYSTER POINT BLVD., SUITE 600",,"SOUTH SAN FRANCISCO",CA,CALIFORNIA,"US West",,,"=""2836""","Biological Products, Except Diagnostic Substances",325414,"Biological Product (except Diagnostic) Manufacturing",34,8,12/31/23,"677,339,968",12/31/23,"97,062,000","-130,391,000",,"621,827,000"
35118,"Discontinued operations","Income (Loss) from Discontinued Operations, Net of Income Taxes – Grace Disposal Group – Refer to Notes 1, 2, and 21 to the financial statements",527452,12/31/23,02/29/24,3,"Deloitte & Touche LLP",,,,Honolulu,HI,HAWAII,"US West",10-K,2024-02-29,,"Alexander & Baldwin, Inc.",1545654,"=""ALEX""","822 BISHOP STREET, P.O. BOX 3440",,HONOLULU,HI,HAWAII,"US West",,,"=""6798""","Real Estate Investment Trusts",531312,"Nonresidential Property Managers",34,19,01/02/24,"1,384,718,208",12/31/23,"208,900,000","29,800,000","994,300,000","1,646,200,000"
32525,"Real estate investments","Real Estate Impairment – Refer to Note 2 to the financial statements",524460,12/31/23,02/12/24,3,"Deloitte & Touche LLP",,,,"New York",NY,"NEW YORK","US Mid Atlantic",10-K,2024-02-12,,"ALEXANDERS INC",3499,"=""ALX""","210 ROUTE 4 EAST",,PARAMUS,NJ,"NEW JERSEY","US Mid Atlantic",,,"=""6798""","Real Estate Investment Trusts",525990,"Other Financial Vehicles",34,214,12/31/23,"1,090,763,904",12/31/23,"224,962,000","102,413,000",,"1,403,680,000"
32246,"Long-lived assets","Valuation of long-lived real estate assets",523598,12/31/23,01/29/24,2,"Ernst & Young LLP",,,,"Los Angeles",CA,CALIFORNIA,"US West",10-K,2024-01-29,,"ALEXANDRIA REAL ESTATE EQUITIES, INC.",1035443,"=""ARE""","26 NORTH EUCLID AVENUE",,PASADENA,CA,CALIFORNIA,"US West",,,"=""6798""","Real Estate Investment Trusts",525990,"Other Financial Vehicles",34,127,12/31/23,"21,793,105,920",12/31/23,"2,885,699,000","103,639,000",,"36,771,402,000"
30443,"Property, plant and equipment","Property, plant and equipment impairment assessment - Refer to Notes 3 and 4 to the consolidated financial statements",513713,03/31/23,06/21/23,3,"Deloitte & Touche LLP",468,"Deloitte LLP",1208,Toronto,A6,ONTARIO,Canada,F-10,2023-06-22,,"Algoma Steel Group Inc.",1860805,"=""ASTL""","105 WEST STREET",,"SAULT STE. MARIE",A6,ONTARIO,Canada,,,"=""3312""","Steel Works, Blast Furnaces (Including Coke Ovens), and Rolling Mills",331111,"Iron and Steel Mills",34,8,03/29/23,"1,140,754,560",03/31/23,"2,053,100,000","220,600,000","1,079,800,000","1,814,500,000"
30444,"Property, plant and equipment","Property, plant and equipment impairment assessment - Refer to Notes 3 and 4 to the consolidated financial statements",513715,03/31/23,06/21/23,3,"Deloitte & Touche LLP",468,"Deloitte LLP",1208,Toronto,A6,ONTARIO,Canada,40-F,2023-06-22,,"Algoma Steel Group Inc.",1860805,"=""ASTL""","105 WEST STREET",,"SAULT STE. MARIE",A6,ONTARIO,Canada,,,"=""3312""","Steel Works, Blast Furnaces (Including Coke Ovens), and Rolling Mills",331111,"Iron and Steel Mills",34,8,03/29/23,"1,140,754,560",03/31/23,"2,053,100,000","220,600,000","1,079,800,000","1,814,500,000"
35695,"Regulatory assets and liabilities","Regulatory assets and liabilities—Recovery of costs through rate regulation",529223,12/31/23,03/08/24,2,"Ernst & Young LLP",192,"Ernst & Young LLP Chartered Accountants",1263,Toronto,A6,ONTARIO,Canada,40-F,2024-03-08,,"ALGONQUIN POWER & UTILITIES CORP.",1174169,"=""AQN""","354 DAVIS ROAD",,OAKVILLE,A6,ONTARIO,Canada,,,"=""4911""","Electric Services",221111,"Hydroelectric Power Generation",34,6,01/02/24,"4,409,315,328",12/31/23,"2,698,015,000","28,674,000","3,961,402,000","18,373,961,000"
38172,"Regulatory assets and liabilities","Regulatory assets and liabilities—Recovery of costs through rate regulation",535772,12/31/23,03/08/24,2,"Ernst & Young LLP",192,"Ernst & Young LLP Chartered Accountants",1263,Toronto,A6,ONTARIO,Canada,6-K,2024-05-03,,"ALGONQUIN POWER & UTILITIES CORP.",1174169,"=""AQN""","354 DAVIS ROAD",,OAKVILLE,A6,ONTARIO,Canada,,,"=""4911""","Electric Services",221111,"Hydroelectric Power Generation",34,6,01/02/24,"4,409,315,328",12/31/23,"2,698,015,000","28,674,000","3,961,402,000","18,373,961,000"
30720,Goodwill,"Impairment assessment on goodwill relating to a reporting unit under the Digital media and entertainment segment",514906,03/31/23,07/21/23,1,"PricewaterhouseCoopers LLP",95,PricewaterhouseCoopers,1389,"Hong Kong",F4,CHINA,Foreign,20-F,2023-07-21,,"Alibaba Group Holding Ltd",1577552,"=""BABA""","26/F TOWER ONE","TIMES SQUARE, 1 MATHESON STREET","CAUSEWAY BAY",K3,"HONG KONG",Foreign,,,"=""7389""","Business Services, NEC",518210,"Data Processing, Hosting, and Related Services",33,100,03/29/23,"266,752,966,656",03/31/23,"126,412,000,000","10,591,000,000","99,611,000,000","255,105,000,000"
30721,"Other investments","Fair value determination related to investments in privately held companies accounted for using the measurement alternative",514906,03/31/23,07/21/23,1,"PricewaterhouseCoopers LLP",95,PricewaterhouseCoopers,1389,"Hong Kong",F4,CHINA,Foreign,20-F,2023-07-21,,"Alibaba Group Holding Ltd",1577552,"=""BABA""","26/F TOWER ONE","TIMES SQUARE, 1 MATHESON STREET","CAUSEWAY BAY",K3,"HONG KONG",Foreign,,,"=""7389""","Business Services, NEC",518210,"Data Processing, Hosting, and Related Services",33,100,03/29/23,"266,752,966,656",03/31/23,"126,412,000,000","10,591,000,000","99,611,000,000","255,105,000,000"
34893,Goodwill,"Goodwill Impairment Assessment",527624,12/31/23,02/29/24,2,"Ernst & Young LLP",,,,Chicago,IL,ILLINOIS,"US Midwest",10-K,2024-02-29,,"Alight, Inc. / Delaware",1809104,"=""ALIT""","4 OVERLOOK POINT",,LINCOLNSHIRE,IL,ILLINOIS,"US Midwest",,,"=""7389""","Business Services, NEC",511210,"Software Publishers",34,8,01/02/24,"4,214,952,448",12/31/23,"2,386,000,000","-345,000,000","-2,635,000,000","10,782,000,000"
34894,"Other debt","Measurement of the Tax Receivable Agreement Liability",527624,12/31/23,02/29/24,2,"Ernst & Young LLP",,,,Chicago,IL,ILLINOIS,"US Midwest",10-K,2024-02-29,,"Alight, Inc. / Delaware",1809104,"=""ALIT""","4 OVERLOOK POINT",,LINCOLNSHIRE,IL,ILLINOIS,"US Midwest",,,"=""7389""","Business Services, NEC",511210,"Software Publishers",34,8,01/02/24,"4,214,952,448",12/31/23,"2,386,000,000","-345,000,000","-2,635,000,000","10,782,000,000"
34881,"Revenue from customer contracts","Revenue Recognition – Determination of Standalone Selling Price of Distinct Performance Obligations in Clear Aligner Contracts",526964,12/31/23,02/28/24,1,"PricewaterhouseCoopers LLP",,,,"San Jose",CA,CALIFORNIA,"US West",10-K,2024-02-28,,"ALIGN TECHNOLOGY INC",1097149,"=""ALGN""","410 NORTH SCOTTSDALE ROAD, SUITE 1300",,TEMPE,AZ,ARIZONA,"US Southwest",,,"=""3842""","Orthopedic, Prosthetic, and Surgical Appliances and Supplies",339114,"Dental Equipment and Supplies Manufacturing",34,269,01/02/24,"20,596,344,832",12/31/23,"3,862,260,000","445,053,000","3,128,841,000","6,083,877,000"
34314,"Insurance contract liabilities","Medical expenses payable – Incurred but not paid claims - Refer to Notes 2 and 7 to the financial statements",526645,12/31/23,02/27/24,3,"Deloitte & Touche LLP",,,,"Los Angeles",CA,CALIFORNIA,"US West",10-K,2024-02-27,,"Alignment Healthcare, Inc.",1832466,"=""ALHC""","1100 W. TOWN AND COUNTRY ROAD","SUITE 1600",ORANGE,CA,CALIFORNIA,"US West",,,"=""6324""","Hospital and Medical Service Plans",524114,"Direct Health and Medical Insurance Carriers",34,8,01/02/24,"1,605,457,152",12/31/23,"1,823,630,000","-148,017,000","116,868,000","591,880,000"
33287,"Other income taxes","Tax-Free Determination of the Separation of the Oncology Business",525322,12/31/23,02/21/24,1,"PricewaterhouseCoopers LLP",,,,Boston,MA,MASSACHUSETTS,"US New England",10-K,2024-02-21,,"Alkermes plc.",1520262,"=""ALKS""","CONNAUGHT HOUSE","1 BURLINGTON ROAD","DUBLIN 4",L2,IRELAND,Foreign,,,"=""2834""","Pharmaceutical Preparations",325412,"Pharmaceutical Preparation Manufacturing",34,29,01/02/24,"5,131,052,544",12/31/23,"1,663,405,000","355,757,000","1,117,668,000","2,136,223,000"
33288,"Sales return and allowances","Rebate Accruals – Medicaid Drug Rebate Program",525322,12/31/23,02/21/24,1,"PricewaterhouseCoopers LLP",,,,Boston,MA,MASSACHUSETTS,"US New England",10-K,2024-02-21,,"Alkermes plc.",1520262,"=""ALKS""","CONNAUGHT HOUSE","1 BURLINGTON ROAD","DUBLIN 4",L2,IRELAND,Foreign,,,"=""2834""","Pharmaceutical Preparations",325412,"Pharmaceutical Preparation Manufacturing",34,29,01/02/24,"5,131,052,544",12/31/23,"1,663,405,000","355,757,000","1,117,668,000","2,136,223,000"
35946,"Research and development expenses","Accrued Clinical Investigative Sites Expenses",530044,12/31/23,03/14/24,2,"Ernst & Young LLP",,,,"San Mateo",CA,CALIFORNIA,"US West",10-K,2024-03-14,,"Allakos Inc.",1564824,,"4757 EXECUTIVE DRIVE","SUITE  210","SAN DIEGO",CA,CALIFORNIA,"US West",,,"=""2834""","Pharmaceutical Preparations",325414,"Biological Product (except Diagnostic) Manufacturing",34,3,01/02/24,"239,685,168",12/31/23,,"-185,701,000",,"243,610,000"
35065,"Other contingent liabilities","Estimated Loss associated with Sunseeker Resort",527401,12/31/23,02/29/24,4,"KPMG LLP",,,,Dallas,TX,TEXAS,"US Southwest",10-K,2024-02-29,,"Allegiant Travel CO",1362468,"=""ALGT""","1201 N. TOWN CENTER DRIVE",,"LAS VEGAS",NV,NEVADA,"US West",,,"=""4512""","Air Transportation, Scheduled",561510,"Travel Agencies",34,81,01/02/24,"1,492,151,680",12/31/23,"2,509,857,000","117,596,000",,"4,869,410,000"
33251,"Revenue from customer contracts","Revenue Recognition",525087,12/31/23,02/20/24,1,"PricewaterhouseCoopers LLP",,,,Indianapolis,IN,INDIANA,"US Midwest",10-K,2024-02-20,,"Allegion plc",1579241,"=""ALLE""","UNIT NO. 233, THE CAPEL BUILDING","MARY'S ABBEY","DUBLIN 7",L2,IRELAND,Foreign,,,"=""7381""","Detective, Guard, and Armored Car Services",423610,"Electrical Apparatus and Equipment, Wiring Supplies, and Related Equipment Merchant  Wholesalers",34,127,12/31/23,"11,085,967,360",12/31/23,"3,650,800,000","540,400,000","-697,600,000","4,311,500,000"
30128,"Sales return and allowances","Revenue Recognition – Sales Allowance",512535,03/31/23,05/25/23,1,"PricewaterhouseCoopers LLP",,,,Boston,MA,MASSACHUSETTS,"US New England",10-K,2023-05-25,,"ALLEGRO MICROSYSTEMS, INC.",866291,"=""ALGM""","955 PERIMETER ROAD",,MANCHESTER,NH,"NEW HAMPSHIRE","US New England",,,"=""3674""","Semiconductors and Related Devices",334413,"Semiconductor and Related Device Manufacturing",34,48,03/31/23,"9,202,288,640",03/31/23,"973,653,000","187,357,000","885,559,000","1,181,155,000"
33239,"Regulatory assets and liabilities","Accounting for the Effects of Regulatory Matters",525090,12/31/23,02/20/24,1,"PricewaterhouseCoopers LLP",,,,Minneapolis,MN,MINNESOTA,"US Midwest",10-K,2024-02-20,,"ALLETE INC",66756,"=""ALE""","30 W SUPERIOR ST",,DULUTH,MN,MINNESOTA,"US Midwest",,,"=""4931""","Electric and Other Services Combined",221122,"Electric Power Distribution",34,62,01/02/24,"3,580,267,520",12/31/23,"1,879,800,000","247,100,000","2,654,700,000","6,656,400,000"
32593,"Equity investments and joint ventures","Measurement of Equity in Net Income Attributable to AB Unitholders - Performance Based Fees",524328,12/31/23,02/09/24,1,"PricewaterhouseCoopers LLP",,,,Nashville,TN,TENNESSEE,"US Southeast",10-K,2024-02-09,,"ALLIANCEBERNSTEIN HOLDING L.P.",825313,"=""AB""","501 COMMERCE STREET",,NASHVILLE,TN,TENNESSEE,"US Southeast",1333986,"Equitable Holdings, Inc.","=""6282""","Investment Advice",523930,"Investment Advice",34,31,01/02/24,"3,437,753,856",12/31/23,"299,781,000","264,184,000",,"2,077,540,000"
32610,"Revenue from customer contracts","Performance Based Fees",524336,12/31/23,02/09/24,1,"PricewaterhouseCoopers LLP",,,,Nashville,TN,TENNESSEE,"US Southeast",10-K,2024-02-09,,"ALLIANCEBERNSTEIN L.P.",1109448,,"501 COMMERCE STREET",,NASHVILLE,TN,TENNESSEE,"US Southeast",1333986,"Equitable Holdings, Inc.","=""6282""","Investment Advice",523930,"Investment Advice",34,,,,12/31/23,"4,100,929,000","764,610,000","795,064,000","9,609,806,000"
32956,"Regulatory assets and liabilities","Regulatory Accounting - Impact of rate regulation on the financial statements - Refer to Notes 1, 2, and 3 to the financial statements",525003,12/31/23,02/16/24,3,"Deloitte & Touche LLP",,,,Milwaukee,WI,WISCONSIN,"US Midwest",10-K,2024-02-16,,"ALLIANT ENERGY CORP",352541,"=""LNT""","4902 NORTH BILTMORE LANE","SUITE 1000",MADISON,WI,WISCONSIN,"US Midwest",,,"=""4931""","Electric and Other Services Combined",221122,"Electric Power Distribution",34,51,12/31/23,"13,137,768,448",12/31/23,"4,027,000,000","703,000,000",,"21,237,000,000"
35382,Inventory,"Inventories—Refer to Note 1 to the financial statements",528357,12/31/23,03/05/24,3,"Deloitte & Touche LLP",,,,Williamsville,NY,"NEW YORK","US Mid Atlantic",10-K,2024-03-05,,"ALLIENT INC",46129,"=""ALNT""","495 COMMERCE DRIVE, SUITE 3",,AMHERST,NY,"NEW YORK","US Mid Atlantic",,,"=""3825""","Instruments for Measuring and Testing of Electricity and Electrical Signals",334519,"Other Measuring and Controlling Device Manufacturing",34,30,12/31/23,"492,664,672",12/31/23,"578,634,000","24,097,000","8,864,000","597,542,000"
32761,"Warranty liabilities","Product Warranty Liabilities",524647,12/31/23,02/14/24,1,"PricewaterhouseCoopers LLP",,,,Indianapolis,IN,INDIANA,"US Midwest",10-K,2024-02-14,,"Allison Transmission Holdings Inc",1411207,"=""ALSN""","ONE ALLISON WAY",,Indianapolis,IN,INDIANA,"US Midwest",,,"=""3714""","Motor Vehicle Parts and Accessories",336350,"Motor Vehicle Transmission and Power Train Parts Manufacturing",34,57,01/02/24,"5,098,839,040",12/31/23,"3,035,000,000","673,000,000","-1,676,000,000","5,025,000,000"
37421,"Revenue from customer contracts","Revenue Recognition",532959,12/31/23,04/10/24,2,"Ernst & Young LLP",222,"Kost Forer Gabbay & Kasierer",1281,"Tel Aviv",L3,ISRAEL,Foreign,20-F,2024-04-10,,"Allot Ltd.",1365767,"=""ALLT""","22 HANGAR STREET","NEVE NE'EMAN, INDUSTRIAL ZONE B",HOD-HASHARON,L3,ISRAEL,Foreign,,,"=""3576""","Computer Communications Equipment",541511,"Custom Computer Programming Services",34,2,01/02/24,"61,286,872",12/31/23,"93,150,000","-62,804,000","17,015,000","138,163,000"
33449,"Insurance contract liabilities","Reserve for Property and Casualty Insurance Claims and Claims Expense - Refer to Notes 2 and 9 to the Financial Statements",525334,12/31/23,02/21/24,3,"Deloitte & Touche LLP",,,,Chicago,IL,ILLINOIS,"US Midwest",10-K,2024-02-21,,"ALLSTATE CORP",899051,"=""ALL""","3100 SANDERS ROAD",,NORTHBROOK,IL,ILLINOIS,"US Midwest",,,"=""6331""","Fire, Marine, and Casualty Insurance",524126,"Direct Property and Casualty Insurance Carriers",34,144,01/02/24,"37,633,216,512",12/31/23,"57,094,000,000","-188,000,000","14,268,000,000","103,362,000,000"
33177,"Allowance for credit losses","Allowance for Loan Losses — Consumer Automotive Portfolio — Refer to Notes 1 and 9 to the financial statements",525078,12/31/23,02/20/24,3,"Deloitte & Touche LLP",,,,Detroit,MI,MICHIGAN,"US Midwest",10-K,2024-02-20,,"Ally Financial Inc.",40729,"=""ALLY""","ALLY DETROIT CENTER","500 WOODWARD AVE. FLOOR 10",DETROIT,MI,MICHIGAN,"US Midwest",,,"=""6022""","State Commercial Banks",522220,"Sales Financing",34,35,01/02/24,"10,665,651,200",12/31/23,"7,106,000,000","957,000,000",,"196,392,000,000"
38133,"Goodwill and intangible assets","Assessment of the recoverable amounts of groups of cash-generating units to which goodwill and trademarks with an indefinite useful life are allocated.",535542,12/31/23,04/30/24,4,"KPMG LLP",664,"KPMG SAS",5070,Medellin,F8,COLOMBIA,Foreign,20-F,2024-05-01,,"Almacenes Exito S.A.",1957146,"=""EXTOY""","CARRERA 48 # 32 B SUR 139.",,"ENVIGADO, ANTIOQUIA,",F8,COLOMBIA,Foreign,,,"=""5331""","Variety Stores",445110,"Supermarkets and Other Grocery (except Convenience) Stores",34,,,,12/31/23,"5,452,000,000","80,000,000","685,000,000","4,218,000,000"
32799,"Other liabilities and provisions","Liability Related to Sale of Future Royalties and Commercial Milestones",524794,12/31/23,02/15/24,1,"PricewaterhouseCoopers LLP",,,,Boston,MA,MASSACHUSETTS,"US New England",10-K,2024-02-15,,"ALNYLAM PHARMACEUTICALS, INC.",1178670,"=""ALNY""","675 WEST KENDALL STREET","HENRI A. TERMEER SQUARE",CAMBRIDGE,MA,MASSACHUSETTS,"US New England",,,"=""2834""","Pharmaceutical Preparations",325412,"Pharmaceutical Preparation Manufacturing",34,191,12/31/23,"24,078,229,504",12/31/23,"1,828,292,000","-440,242,000",,"3,829,880,000"
32292,"Other contingent liabilities","Loss Contingencies",523773,12/31/23,01/30/24,2,"Ernst & Young LLP",,,,"San Jose",CA,CALIFORNIA,"US West",10-K,2024-01-31,,"Alphabet Inc.",1652044,"=""GOOGL""","1600 AMPHITHEATRE PARKWAY",,"MOUNTAIN VIEW",CA,CALIFORNIA,"US West",,,"=""7370""","Services-Computer Programming, Data Processing, Etc.",518112,"Web Search Portals",34,138,01/02/24,"817,690,050,560",12/31/23,"307,394,000,000","73,795,000,000","254,181,000,000","402,392,000,000"
34458,Inventory,"Valuation of Inventories - Refer to Note 1 to the Financial Statements",526581,12/31/23,02/27/24,3,"Deloitte & Touche LLP",,,,"San Diego",CA,CALIFORNIA,"US West",10-K,2024-02-27,,"Alphatec Holdings, Inc.",1350653,"=""ATEC""","1950 CAMINO VIA ROBLE",,CARLSBAD,CA,CALIFORNIA,"US West",,,"=""3841""","Surgical and Medical Instruments and Apparatus",339112,"Surgical and Medical Instrument Manufacturing",34,15,12/31/23,"2,103,991,936",12/31/23,"482,262,000","-186,638,000","-73,735,000","805,208,000"
36352,"Revenue from customer contracts","Accounting for Revenue under the AbbVie and Amgen Collaboration Agreements",530595,12/31/23,03/19/24,2,"Ernst & Young LLP",,,,Seattle,WA,WASHINGTON,"US West",10-K,2024-03-20,,"ALPINE IMMUNE SCIENCES, INC.",1626199,,"188 EAST BLAINE ST., SUITE 200",,SEATTLE,WA,WASHINGTON,"US West",,,"=""2834""","Pharmaceutical Preparations",325412,"Pharmaceutical Preparation Manufacturing",34,19,12/31/23,"1,150,222,592",12/31/23,"58,876,000","-32,184,000",,"379,852,000"
36063,"Revenue from customer contracts","Revenue Recognition — Refer to Notes 2 and 3 to the financial statements",529983,12/31/23,03/14/24,3,"Deloitte & Touche LLP",,,,Detroit,MI,MICHIGAN,"US Midwest",10-K,2024-03-14,,"ALTA EQUIPMENT GROUP INC.",1759824,"=""ALTG""","13211 MERRIMAN ROAD",,LIVONIA,MI,MICHIGAN,"US Midwest",,,"=""5084""","Industrial Machinery and Equipment",423830,"Industrial Machinery and Equipment Merchant Wholesalers",34,12,12/31/23,"400,414,688",12/31/23,"1,876,800,000","8,900,000","6,700,000","1,570,900,000"
33488,"Revenue from customer contracts","Software Revenue Recognition",525642,12/31/23,02/22/24,2,"Ernst & Young LLP",,,,Detroit,MI,MICHIGAN,"US Midwest",10-K,2024-02-22,,"Altair Engineering Inc.",1701732,"=""ALTR""","1820 E. BIG BEAVER ROAD",,TROY,MI,MICHIGAN,"US Midwest",,,"=""7372""","Prepackaged Software",511210,"Software Publishers",34,84,12/31/23,"4,648,445,952",12/31/23,"612,701,000","-8,926,000","169,656,000","1,363,493,000"
31096,"Research and development expenses","Research and development tax incentive receivable",516528,06/30/23,08/31/23,1,"PricewaterhouseCoopers LLP",89,PricewaterhouseCoopers,1379,Melbourne,C3,AUSTRALIA,Foreign,20-F,2023-08-31,Yes,"ALTERITY THERAPEUTICS LTD",1131343,"=""ATHE""","LEVEL 3, 460 BOURKE STREET",,MELBOURNE,C3,AUSTRALIA,Foreign,,,"=""2834""","Pharmaceutical Preparations",325412,"Pharmaceutical Preparation Manufacturing",34,3,06/28/23,"11,312,310",06/30/23,,"-9,190,313",,"18,183,996"
32387,"Revenue from customer contracts","Revenue Recognition – Determination of Standalone Selling Prices – Refer to Notes 2 and 3 of the Financial Statements",524099,12/31/23,02/06/24,3,"Deloitte & Touche LLP",,,,"Los Angeles",CA,CALIFORNIA,"US West",10-K,2024-02-06,,"Alteryx, Inc.",1689923,,"17200 LAGUNA CANYON ROAD",,IRVINE,CA,CALIFORNIA,"US West",,,"=""7372""","Prepackaged Software",511210,"Software Publishers",34,47,12/31/23,"3,036,039,424",12/31/23,"970,000,000","-179,000,000","-256,000,000","1,912,000,000"
36749,"Research and development expenses","Accrued and Prepaid Research and Development Expenses",531294,12/31/23,03/27/24,2,"Ernst & Young LLP",,,,Tysons,VA,VIRGINIA,"US Mid Atlantic",10-K,2024-03-27,,"Altimmune, Inc.",1326190,"=""ALT""","910 CLOPPER ROAD","SUITE 201S",GAITHERSBURG,MD,MARYLAND,"US Mid Atlantic",,,"=""2834""","Pharmaceutical Preparations",325412,"Pharmaceutical Preparation Manufacturing",34,11,01/02/24,"565,227,712",12/31/23,"426,000","-88,447,000","194,099,000","210,640,000"
37043,"Accounts/loans receivable","Loans Held for Sale or Investment, at Fair Value",531811,12/31/23,03/29/24,2,"Ernst & Young LLP",,,,Atlanta,GA,GEORGIA,"US Southeast",10-K,2024-03-29,,"Altisource Asset Management Corp",1555074,"=""AAMCD""","5100 TAMARIND REEF",,CHRISTIANSTED,VI,"VIRGIN ISLANDS (US)",Foreign,,,"=""6500""","Real Estate",523930,"Investment Advice",34,4,01/02/24,"12,239,668",12/31/23,"3,167,000","-32,546,000",,"25,539,000"
32306,"Other contingent liabilities","Tobacco and Health Litigation",523820,12/31/23,02/01/24,1,"PricewaterhouseCoopers LLP",,,,Richmond,VA,VIRGINIA,"US Mid Atlantic",8-K,2024-02-01,,"ALTRIA GROUP, INC.",764180,"=""MO""","6601 WEST BROAD STREET",,RICHMOND,VA,VIRGINIA,"US Mid Atlantic",,,"=""2111""",Cigarettes,312221,"Cigarette Manufacturing",34,42,01/02/24,"73,540,329,472",12/31/23,"24,483,000,000","8,130,000,000","-24,017,000,000","38,570,000,000"
32307,"Other intangible assets","Skoal Trademark Impairment Assessment",523820,12/31/23,02/01/24,1,"PricewaterhouseCoopers LLP",,,,Richmond,VA,VIRGINIA,"US Mid Atlantic",8-K,2024-02-01,,"ALTRIA GROUP, INC.",764180,"=""MO""","6601 WEST BROAD STREET",,RICHMOND,VA,VIRGINIA,"US Mid Atlantic",,,"=""2111""",Cigarettes,312221,"Cigarette Manufacturing",34,42,01/02/24,"73,540,329,472",12/31/23,"24,483,000,000","8,130,000,000","-24,017,000,000","38,570,000,000"
32308,"Business combinations","Acquisition of NJOY Holdings, Inc. – Valuation of Developed Technology",523820,12/31/23,02/01/24,1,"PricewaterhouseCoopers LLP",,,,Richmond,VA,VIRGINIA,"US Mid Atlantic",8-K,2024-02-01,,"ALTRIA GROUP, INC.",764180,"=""MO""","6601 WEST BROAD STREET",,RICHMOND,VA,VIRGINIA,"US Mid Atlantic",,,"=""2111""",Cigarettes,312221,"Cigarette Manufacturing",34,42,01/02/24,"73,540,329,472",12/31/23,"24,483,000,000","8,130,000,000","-24,017,000,000","38,570,000,000"
34393,"Other contingent liabilities","Tobacco and Health Litigation",526886,12/31/23,02/01/24,1,"PricewaterhouseCoopers LLP",,,,Richmond,VA,VIRGINIA,"US Mid Atlantic",10-K,2024-02-27,,"ALTRIA GROUP, INC.",764180,"=""MO""","6601 WEST BROAD STREET",,RICHMOND,VA,VIRGINIA,"US Mid Atlantic",,,"=""2111""",Cigarettes,312221,"Cigarette Manufacturing",34,42,01/02/24,"73,540,329,472",12/31/23,"24,483,000,000","8,130,000,000","-24,017,000,000","38,570,000,000"
34394,"Other intangible assets","Skoal Trademark Impairment Assessment",526886,12/31/23,02/01/24,1,"PricewaterhouseCoopers LLP",,,,Richmond,VA,VIRGINIA,"US Mid Atlantic",10-K,2024-02-27,,"ALTRIA GROUP, INC.",764180,"=""MO""","6601 WEST BROAD STREET",,RICHMOND,VA,VIRGINIA,"US Mid Atlantic",,,"=""2111""",Cigarettes,312221,"Cigarette Manufacturing",34,42,01/02/24,"73,540,329,472",12/31/23,"24,483,000,000","8,130,000,000","-24,017,000,000","38,570,000,000"
34395,"Business combinations","Acquisition of NJOY Holdings, Inc. – Valuation of Developed Technology",526886,12/31/23,02/01/24,1,"PricewaterhouseCoopers LLP",,,,Richmond,VA,VIRGINIA,"US Mid Atlantic",10-K,2024-02-27,,"ALTRIA GROUP, INC.",764180,"=""MO""","6601 WEST BROAD STREET",,RICHMOND,VA,VIRGINIA,"US Mid Atlantic",,,"=""2111""",Cigarettes,312221,"Cigarette Manufacturing",34,42,01/02/24,"73,540,329,472",12/31/23,"24,483,000,000","8,130,000,000","-24,017,000,000","38,570,000,000"
35544,"Research and development expenses","Assessment of contract manufacturing accruals",529005,12/31/23,03/07/24,4,"KPMG LLP",,,,"San Francisco",CA,CALIFORNIA,"US West",10-K,2024-03-07,,"ALX ONCOLOGY HOLDINGS INC",1810182,"=""ALXO""","323 ALLERTON AVENUE",,"SOUTH SAN FRANCISCO",CA,CALIFORNIA,"US West",,,"=""2834""","Pharmaceutical Preparations",325412,"Pharmaceutical Preparation Manufacturing",34,15,12/31/23,"743,785,088",12/31/23,,"-160,805,000",,"242,553,000"
35172,"Sales return and allowances","Product Return Reserve Estimate",527714,12/31/23,02/29/24,2,"Ernst & Young LLP",,,,Iselin,NJ,"NEW JERSEY","US Mid Atlantic",10-K,2024-02-29,,"AMARIN CORP PLC\UK",897448,"=""AMRN""","SPACES SOUTH DOCKLANDS, BLOCK C","77 SIR JOHN ROGERSON'S QUAY","ELY CAMBRIDGESHIRE",X0,"UNITED KINGDOM",Foreign,,,"=""2834""","Pharmaceutical Preparations",325412,"Pharmaceutical Preparation Manufacturing",34,1,12/31/23,"355,676,960",12/31/23,"306,911,000","-59,112,000","532,793,000","831,684,000"
32317,"Uncertain tax positions","Uncertain Tax Positions",523873,12/31/23,02/01/24,2,"Ernst & Young LLP",,,,Seattle,WA,WASHINGTON,"US West",10-K,2024-02-02,,"AMAZON COM INC",1018724,"=""AMZN""","410 TERRY AVENUE NORTH",,SEATTLE,WA,WASHINGTON,"US West",,,"=""5961""","Catalog and Mail-Order Houses",518210,"Data Processing, Hosting, and Related Services",34,152,12/31/23,"1,556,169,490,432",12/31/23,"574,785,000,000","30,425,000,000","179,086,000,000","527,854,000,000"
28629,"Other income taxes","Accounting for Income Taxes",507439,01/31/23,03/31/23,1,"PricewaterhouseCoopers LLP",,,,"San Jose",CA,CALIFORNIA,"US West",10-K,2023-03-31,,"AMBARELLA INC",1280263,"=""AMBA""","3001 TASMAN DRIVE",,"SANTA CLARA",CA,CALIFORNIA,"US West",,,"=""3674""","Semiconductors and Related Devices",334413,"Semiconductor and Related Device Manufacturing",34,90,01/31/23,"3,507,623,168",01/31/23,"337,606,000","-65,386,000","243,966,000","710,195,000"
38649,"Going concern","Going concern assessment",537714,12/31/23,06/20/24,1,"PricewaterhouseCoopers LLP",95,PricewaterhouseCoopers,1389,"Hong Kong",F4,CHINA,Foreign,20-F,2024-06-20,,"Amber International Holding Ltd",1697818,"=""AMBR""","1 WALLICH STREET","#30-02 GUOCO TOWER",SINGAPORE,U0,SINGAPORE,Foreign,,,"=""6199""","Finance Services",511210,"Software Publishers",34,4,12/31/23,"37,926,028",12/31/23,"36,051,000","-38,767,000","37,125,000","163,704,000"
35738,"Other income taxes","Tax Contingencies and Uncertain Tax Treatments",529584,12/31/23,03/11/24,1,"PricewaterhouseCoopers LLP",91,"PricewaterhouseCoopers Auditores Independentes",1351,"São Paulo",D5,BRAZIL,Foreign,20-F,2024-03-11,,"AMBEV S.A.",1565025,"=""ABEV""","RUA DR. RENATO PAES DE BARROS, 1017","3 ANDAR PARTE","SAO PAULO",D5,BRAZIL,Foreign,,,"=""2080""",Beverages,312120,Breweries,34,3,01/02/24,"43,470,598,144",12/31/23,"16,414,900,000","3,079,800,000","6,366,200,000","27,306,600,000"
34653,"Long-lived assets","Impairment of long-lived assets",527030,12/31/23,02/28/24,2,"Ernst & Young LLP",,,,"Kansas City",MO,MISSOURI,"US Southeast",10-K,2024-02-28,,"AMC ENTERTAINMENT HOLDINGS, INC.",1411579,"=""AMC""","ONE AMC WAY","11500 ASH STREET",LEAWOOD,KS,KANSAS,"US Midwest",,,"=""7830""","Services-Motion Picture Theaters",512131,"Motion Picture Theaters (except Drive-Ins)",34,6,01/02/24,"1,211,960,704",12/31/23,"4,812,600,000","-396,600,000","-4,353,300,000","9,009,200,000"
32527,Goodwill,"Assessment of the carrying value of goodwill in the AMC Networks International (AMCNI) reporting unit",524365,12/31/23,02/09/24,4,"KPMG LLP",,,,"New York",NY,"NEW YORK","US Mid Atlantic",10-K,2024-02-09,,"AMC Networks Inc.",1514991,"=""AMCX""","11 PENN PLAZA",,"NEW YORK",NY,"NEW YORK","US Mid Atlantic",,,"=""4841""","Cable and Other Pay Television Services",515120,"Television Broadcasting",34,19,12/31/23,"602,726,848",12/31/23,"2,711,877,000","215,464,000","-1,464,359,000","4,969,787,000"
32528,"Depreciation and amortization","Assessment of amortization of owned original program rights predominantly monetized individually",524365,12/31/23,02/09/24,4,"KPMG LLP",,,,"New York",NY,"NEW YORK","US Mid Atlantic",10-K,2024-02-09,,"AMC Networks Inc.",1514991,"=""AMCX""","11 PENN PLAZA",,"NEW YORK",NY,"NEW YORK","US Mid Atlantic",,,"=""4841""","Cable and Other Pay Television Services",515120,"Television Broadcasting",34,19,12/31/23,"602,726,848",12/31/23,"2,711,877,000","215,464,000","-1,464,359,000","4,969,787,000"
30977,Goodwill,"Goodwill Impairment Assessment – Flexibles Latin America Reporting Unit within the Flexibles Segment",516031,06/30/23,08/17/23,1,"PricewaterhouseCoopers LLP",119,"PricewaterhouseCoopers AG",1358,Zurich,V8,SWITZERLAND,Foreign,10-K,2023-08-17,,"Amcor plc",1748790,"=""AMCR""","83 TOWER ROAD NORTH",,"WARMLEY, BRISTOL",X0,"UNITED KINGDOM",Foreign,,,"=""3990""","Miscellaneous Manufacturing Industries",322221,"Coated and Laminated Packaging Paper and Plastics Film Manufacturing",34,10,06/28/23,"14,434,864,128",06/30/23,"14,694,000,000","1,048,000,000","-2,864,000,000","17,003,000,000"
31918,"Revenue from customer contracts","Revenue recognition for projects",521139,09/30/23,12/13/23,2,"Ernst & Young LLP",,,,"New York",NY,"NEW YORK","US Mid Atlantic",20-F,2023-12-13,,"AMDOCS LTD",1062579,"=""DOX""","P.O BOX 263, HIRZEL HOUSE","SMITH STREET,","ST. PETER PORT",Y7,GUERNSEY,Foreign,,,"=""7371""","Computer Programming Services",541511,"Custom Computer Programming Services",34,84,10/02/23,"10,150,782,976",09/30/23,"4,887,550,000","540,709,000","593,179,000","6,425,653,000"
31919,"Uncertain tax positions","Uncertain Tax Positions",521139,09/30/23,12/13/23,2,"Ernst & Young LLP",,,,"New York",NY,"NEW YORK","US Mid Atlantic",20-F,2023-12-13,,"AMDOCS LTD",1062579,"=""DOX""","P.O BOX 263, HIRZEL HOUSE","SMITH STREET,","ST. PETER PORT",Y7,GUERNSEY,Foreign,,,"=""7371""","Computer Programming Services",541511,"Custom Computer Programming Services",34,84,10/02/23,"10,150,782,976",09/30/23,"4,887,550,000","540,709,000","593,179,000","6,425,653,000"
33706,"Revenue from customer contracts","Evaluation of the non-contractual revenue adjustment estimates for Home Health",525816,12/31/23,02/22/24,4,"KPMG LLP",,,,"Baton Rouge",LA,LOUISIANA,"US Southeast",10-K,2024-02-22,,"AMEDISYS INC",896262,,"3854 AMERICAN WAY","SUITE A","BATON ROUGE",LA,LOUISIANA,"US Southeast",,,"=""8082""","Home Health Care Services",621610,"Home Health Care Services",34,95,01/02/24,"3,099,188,992",12/31/23,"2,236,382,000","-9,747,000","-280,840,000","2,060,170,000"
36264,"Goodwill and intangible assets","Valuation of goodwill and trademarks for the Winter Sports Equipment and Peak Performance cash generating units",530415,12/31/23,03/18/24,4,"KPMG LLP",309,"KPMG AB",1049,Stockholm,V7,SWEDEN,Foreign,20-F,2024-03-18,,"Amer Sports, Inc.",1988894,"=""AS""","SILTASAARENKATU 8-10",FL-00530,HELSINKI,H9,FINLAND,Foreign,,,"=""2300""","Apparel & Other Finishd Prods of Fabrics & Similar Matl",339920,"Sporting and Athletic Goods Manufacturing",34,,,,12/31/23,"4,368,400,000","-208,800,000","-5,178,900,000","8,373,800,000"
35222,"Regulatory assets and liabilities","Accounting for the Effects of Regulation",527321,12/31/23,02/29/24,1,"PricewaterhouseCoopers LLP",,,,"Saint Louis",MO,MISSOURI,"US Southeast",10-K,2024-02-29,,"AMEREN CORP",1002910,"=""AEE""","1901 CHOUTEAU AVE","MC 1310","ST LOUIS",MO,MISSOURI,"US Southeast",,,"=""4931""","Electric and Other Services Combined",221122,"Electric Power Distribution",34,74,01/02/24,"19,457,933,312",12/31/23,"7,500,000,000","1,152,000,000","10,938,000,000","40,830,000,000"
34886,"Regulatory assets and liabilities","Accounting for the Effects of Regulation",527637,12/31/23,02/29/24,1,"PricewaterhouseCoopers LLP",,,,"Saint Louis",MO,MISSOURI,"US Southeast",10-K,2024-02-29,,"Ameren Illinois Co",18654,"=""AILIH""","10 RICHARD MARK WAY",,COLLINSVILLE,IL,ILLINOIS,"US Midwest",1002910,"AMEREN CORP","=""4931""","Electric and Other Services Combined",221121,"Electric Bulk Power Transmission and Control",34,,,,12/31/23,"3,482,000,000","609,000,000","6,414,000,000","18,122,000,000"
38146,"Deferred income taxes","Deferred tax assets, realizability of amounts related to net operating loss carryforwards and temporary differences related to employee benefits",535289,12/31/23,04/29/24,2,"Ernst & Young LLP",139,"Mancera SC",1284,"Mexico City",O5,MEXICO,Foreign,20-F,2024-04-30,,"AMERICA MOVIL SAB DE CV/",1129137,"=""AMX""","LAGO ZURICH 245",*,"COLONIA ANAHUAC",O5,MEXICO,Foreign,,,"=""4813""","Telephone Communications, Except Radiotelephone",517310,"Telecommunications Resellers",34,18,01/02/24,"58,387,365,888",12/31/23,"48,186,415,000","4,770,713,000","5,854,034,000","92,366,823,000"
38147,"Pension and other post-employment benefits","Discount rate used in determining defined benefit pension obligations in Mexico",535289,12/31/23,04/29/24,2,"Ernst & Young LLP",139,"Mancera SC",1284,"Mexico City",O5,MEXICO,Foreign,20-F,2024-04-30,,"AMERICA MOVIL SAB DE CV/",1129137,"=""AMX""","LAGO ZURICH 245",*,"COLONIA ANAHUAC",O5,MEXICO,Foreign,,,"=""4813""","Telephone Communications, Except Radiotelephone",517310,"Telecommunications Resellers",34,18,01/02/24,"58,387,365,888",12/31/23,"48,186,415,000","4,770,713,000","5,854,034,000","92,366,823,000"
38152,"Deferred income taxes","Deferred tax assets, realizability of amounts related to net operating loss carryforwards and temporary differences related to employee benefits",535524,12/31/23,04/29/24,2,"Ernst & Young LLP",139,"Mancera SC",1284,"Mexico City",O5,MEXICO,Foreign,20-F/A,2024-05-01,,"AMERICA MOVIL SAB DE CV/",1129137,"=""AMX""","LAGO ZURICH 245",*,"COLONIA ANAHUAC",O5,MEXICO,Foreign,,,"=""4813""","Telephone Communications, Except Radiotelephone",517310,"Telecommunications Resellers",34,18,01/02/24,"58,387,365,888",12/31/23,"48,186,415,000","4,770,713,000","5,854,034,000","92,366,823,000"
38153,"Pension and other post-employment benefits","Discount rate used in determining defined benefit pension obligations in Mexico",535524,12/31/23,04/29/24,2,"Ernst & Young LLP",139,"Mancera SC",1284,"Mexico City",O5,MEXICO,Foreign,20-F/A,2024-05-01,,"AMERICA MOVIL SAB DE CV/",1129137,"=""AMX""","LAGO ZURICH 245",*,"COLONIA ANAHUAC",O5,MEXICO,Foreign,,,"=""4813""","Telephone Communications, Except Radiotelephone",517310,"Telecommunications Resellers",34,18,01/02/24,"58,387,365,888",12/31/23,"48,186,415,000","4,770,713,000","5,854,034,000","92,366,823,000"
46535,"Deferred income taxes","Deferred tax assets, realizability of amounts related to net operating loss carryforwards and temporary differences related to employee benefits",561094,12/31/23,04/29/24,2,"Ernst & Young LLP",139,"Mancera SC",1284,"Mexico City",O5,MEXICO,Foreign,20-F/A,2025-04-10,,"AMERICA MOVIL SAB DE CV/",1129137,"=""AMX""","LAGO ZURICH 245",*,"COLONIA ANAHUAC",O5,MEXICO,Foreign,,,"=""4813""","Telephone Communications, Except Radiotelephone",517310,"Telecommunications Resellers",34,18,01/02/24,"58,387,365,888",12/31/23,"48,186,415,000","4,770,713,000","5,854,034,000","92,366,823,000"
46536,"Pension and other post-employment benefits","Discount rate used in determining defined benefit pension obligations in Mexico",561094,12/31/23,04/29/24,2,"Ernst & Young LLP",139,"Mancera SC",1284,"Mexico City",O5,MEXICO,Foreign,20-F/A,2025-04-10,,"AMERICA MOVIL SAB DE CV/",1129137,"=""AMX""","LAGO ZURICH 245",*,"COLONIA ANAHUAC",O5,MEXICO,Foreign,,,"=""4813""","Telephone Communications, Except Radiotelephone",517310,"Telecommunications Resellers",34,18,01/02/24,"58,387,365,888",12/31/23,"48,186,415,000","4,770,713,000","5,854,034,000","92,366,823,000"
33292,"Deferred income taxes","Sufficiency of audit evidence over the realizability of tax net operating loss and other carryforwards",525227,12/31/23,02/21/24,4,"KPMG LLP",,,,Dallas,TX,TEXAS,"US Southwest",10-K,2024-02-21,,"American Airlines Group Inc.",6201,"=""AAL""","1 SKYVIEW DRIVE",,"FORT WORTH",TX,TEXAS,"US Southwest",,,"=""4512""","Air Transportation, Scheduled",481111,"Scheduled Passenger Air Transportation",34,13,01/02/24,"8,783,585,280",12/31/23,"52,788,000,000","822,000,000","-11,344,000,000","63,058,000,000"
33308,"Deferred income taxes","Sufficiency of audit evidence over the realizability of tax net operating loss and other carryforwards",525344,12/31/23,02/21/24,4,"KPMG LLP",,,,Dallas,TX,TEXAS,"US Southwest",10-K,2024-02-21,,"AMERICAN AIRLINES, INC.",4515,,"1 SKYVIEW DRIVE",,"FORT WORTH",TX,TEXAS,"US Southwest",6201,"American Airlines Group Inc.","=""4512""","Air Transportation, Scheduled",481111,"Scheduled Passenger Air Transportation",34,,,,12/31/23,"52,784,000,000","1,188,000,000","435,000,000","69,074,000,000"
32740,"Real estate investments","Impairment of real estate properties",524656,12/31/23,02/14/24,2,"Ernst & Young LLP",,,,"San Diego",CA,CALIFORNIA,"US West",10-K,2024-02-14,,"American Assets Trust, Inc.",1500217,"=""AAT""","3420 CARMEL MOUNTAIN ROAD","SUITE 100","SAN DIEGO",CA,CALIFORNIA,"US West",,,"=""6798""","Real Estate Investment Trusts",525990,"Other Financial Vehicles",34,23,01/02/24,"1,393,022,976",12/31/23,"441,164,000","50,378,000",,"2,984,681,000"
32737,"Real estate investments","Impairment of real estate properties",524658,12/31/23,02/14/24,2,"Ernst & Young LLP",,,,"San Diego",CA,CALIFORNIA,"US West",10-K,2024-02-14,,"American Assets Trust, L.P.",1509570,,"11455 EL CAMINO REAL","SUITE 200","SAN DIEGO",CA,CALIFORNIA,"US West",,,"=""6798""","Real Estate Investment Trusts",525990,"Other Financial Vehicles",34,,,,12/31/23,"441,164,000","64,690,000",,"2,984,681,000"
32981,"Other income taxes","Income Taxes — Refer to Notes 1 and 9 to the consolidated financial statements",524926,12/31/23,02/16/24,3,"Deloitte & Touche LLP",,,,Detroit,MI,MICHIGAN,"US Midwest",10-K,2024-02-16,,"AMERICAN AXLE & MANUFACTURING HOLDINGS INC",1062231,"=""AXL""","ONE DAUCH DRIVE",,DETROIT,MI,MICHIGAN,"US Midwest",,,"=""3714""","Motor Vehicle Parts and Accessories",336350,"Motor Vehicle Transmission and Power Train Parts Manufacturing",34,9,12/31/23,"1,031,651,008",12/31/23,"6,079,500,000","-33,600,000","-110,000,000","5,356,300,000"
32982,Goodwill,"Goodwill Impairment Analysis — Refer to Notes 1 and 3 to the consolidated financial statements",524926,12/31/23,02/16/24,3,"Deloitte & Touche LLP",,,,Detroit,MI,MICHIGAN,"US Midwest",10-K,2024-02-16,,"AMERICAN AXLE & MANUFACTURING HOLDINGS INC",1062231,"=""AXL""","ONE DAUCH DRIVE",,DETROIT,MI,MICHIGAN,"US Midwest",,,"=""3714""","Motor Vehicle Parts and Accessories",336350,"Motor Vehicle Transmission and Power Train Parts Manufacturing",34,9,12/31/23,"1,031,651,008",12/31/23,"6,079,500,000","-33,600,000","-110,000,000","5,356,300,000"
36221,"Insurance contract liabilities","Liability for Unpaid Losses and Loss Adjustment Expense — Refer to Notes 2 and 11 to the Financial Statements",530170,12/31/23,03/15/24,3,"Deloitte & Touche LLP",,,,Tampa,FL,FLORIDA,"US Southeast",10-K,2024-03-15,,"AMERICAN COASTAL INSURANCE Corp",1401521,"=""ACIC""","570 CARILLON PARKWAY","SUITE 100","SAINT PETERSBURG",FL,FLORIDA,"US Southeast",,,"=""6331""","Fire, Marine, and Casualty Insurance",524126,"Direct Property and Casualty Insurance Carriers",34,9,12/31/23,"442,510,464",12/31/23,"286,543,000","309,911,000","99,966,000","1,060,383,000"
36222,"Discontinued operations","Tax Impacts of Receivership – Discontinued Operations — Refer to Notes 1, 2, 3 and 15 to the Financial Statements",530170,12/31/23,03/15/24,3,"Deloitte & Touche LLP",,,,Tampa,FL,FLORIDA,"US Southeast",10-K,2024-03-15,,"AMERICAN COASTAL INSURANCE Corp",1401521,"=""ACIC""","570 CARILLON PARKWAY","SUITE 100","SAINT PETERSBURG",FL,FLORIDA,"US Southeast",,,"=""6331""","Fire, Marine, and Casualty Insurance",524126,"Direct Property and Casualty Insurance Carriers",34,9,12/31/23,"442,510,464",12/31/23,"286,543,000","309,911,000","99,966,000","1,060,383,000"
37287,"Insurance contract liabilities","Liability for Unpaid Losses and Loss Adjustment Expense Refer to Notes 2 and 11 to the Financial Statements",532431,12/31/23,03/15/24,3,"Deloitte & Touche LLP",,,,Tampa,FL,FLORIDA,"US Southeast",ARS,2024-04-02,,"AMERICAN COASTAL INSURANCE Corp",1401521,"=""ACIC""","570 CARILLON PARKWAY","SUITE 100","SAINT PETERSBURG",FL,FLORIDA,"US Southeast",,,"=""6331""","Fire, Marine, and Casualty Insurance",524126,"Direct Property and Casualty Insurance Carriers",34,9,12/31/23,"442,510,464",12/31/23,"286,543,000","309,911,000","99,966,000","1,060,383,000"
37288,"Discontinued operations","Tax Impacts of Receivership - Discontinued Operations Refer to Notes 1, 2, 3 and 15 to the Financial Statements",532431,12/31/23,03/15/24,3,"Deloitte & Touche LLP",,,,Tampa,FL,FLORIDA,"US Southeast",ARS,2024-04-02,,"AMERICAN COASTAL INSURANCE Corp",1401521,"=""ACIC""","570 CARILLON PARKWAY","SUITE 100","SAINT PETERSBURG",FL,FLORIDA,"US Southeast",,,"=""6331""","Fire, Marine, and Casualty Insurance",524126,"Direct Property and Casualty Insurance Carriers",34,9,12/31/23,"442,510,464",12/31/23,"286,543,000","309,911,000","99,966,000","1,060,383,000"
39652,"Insurance contract liabilities","Liability for Unpaid Losses and Loss Adjustment Expense — Refer to Notes 2 and 10 to the Financial Statements",542237,12/31/23,10/04/24,3,"Deloitte & Touche LLP",,,,Tampa,FL,FLORIDA,"US Southeast",8-K,2024-10-04,,"AMERICAN COASTAL INSURANCE Corp",1401521,"=""ACIC""","570 CARILLON PARKWAY","SUITE 100","SAINT PETERSBURG",FL,FLORIDA,"US Southeast",,,"=""6331""","Fire, Marine, and Casualty Insurance",524126,"Direct Property and Casualty Insurance Carriers",34,9,12/31/23,"442,510,464",12/31/23,"286,543,000","309,911,000","99,966,000","1,060,383,000"
39653,"Discontinued operations","Tax Impacts of Receivership – Discontinued Operations — Refer to Notes 1, 2, 3 and 14 to the Financial Statements",542237,12/31/23,10/04/24,3,"Deloitte & Touche LLP",,,,Tampa,FL,FLORIDA,"US Southeast",8-K,2024-10-04,,"AMERICAN COASTAL INSURANCE Corp",1401521,"=""ACIC""","570 CARILLON PARKWAY","SUITE 100","SAINT PETERSBURG",FL,FLORIDA,"US Southeast",,,"=""6331""","Fire, Marine, and Casualty Insurance",524126,"Direct Property and Casualty Insurance Carriers",34,9,12/31/23,"442,510,464",12/31/23,"286,543,000","309,911,000","99,966,000","1,060,383,000"
27247,"Property, plant and equipment","Retail Store Long-Lived Asset Impairment",504744,01/28/23,03/13/23,2,"Ernst & Young LLP",,,,Pittsburgh,PA,PENNSYLVANIA,"US Mid Atlantic",10-K,2023-03-13,,"AMERICAN EAGLE OUTFITTERS INC",919012,"=""AEO""","77 HOT METAL STREET",,PITTSBURGH,PA,PENNSYLVANIA,"US Mid Atlantic",,,"=""5651""","Family Clothing Stores",448140,"Family Clothing Stores",34,16,01/31/23,"3,148,333,056",01/28/23,"4,989,833,000","125,136,000","1,239,682,000","3,420,956,000"
34249,"Regulatory assets and liabilities","Accounting for the Effects of Cost-Based Regulation",526345,12/31/23,02/26/24,1,"PricewaterhouseCoopers LLP",,,,Columbus,OH,OHIO,"US Midwest",10-K,2024-02-26,,"AMERICAN ELECTRIC POWER CO INC",4904,"=""AEP""","1 RIVERSIDE PLAZA",,COLUMBUS,OH,OHIO,"US Midwest",,,"=""4911""","Electric Services",221122,"Electric Power Distribution",34,81,12/31/23,"42,736,713,728",12/31/23,"18,982,300,000","2,208,100,000","25,236,700,000","96,684,000,000"
34250,"Derivatives and hedging","Valuation of Level 3 Risk Management Commodity Contracts",526345,12/31/23,02/26/24,1,"PricewaterhouseCoopers LLP",,,,Columbus,OH,OHIO,"US Midwest",10-K,2024-02-26,,"AMERICAN ELECTRIC POWER CO INC",4904,"=""AEP""","1 RIVERSIDE PLAZA",,COLUMBUS,OH,OHIO,"US Midwest",,,"=""4911""","Electric Services",221122,"Electric Power Distribution",34,81,12/31/23,"42,736,713,728",12/31/23,"18,982,300,000","2,208,100,000","25,236,700,000","96,684,000,000"
32589,"Allowance for credit losses","Reserves for Credit Losses on Card Member Loans",524344,12/31/23,02/09/24,1,"PricewaterhouseCoopers LLP",,,,"New York",NY,"NEW YORK","US Mid Atlantic",10-K,2024-02-09,,"AMERICAN EXPRESS CO",4962,"=""AXP""","200 VESEY STREET","50TH FLOOR","NEW YORK",NY,"NEW YORK","US Mid Atlantic",,,"=""6199""","Finance Services",523930,"Investment Advice",34,188,01/02/24,"137,230,082,048",12/31/23,"55,592,000,000","8,374,000,000",,"261,108,000,000"
32590,"Other liabilities and provisions","Membership Rewards Liability",524344,12/31/23,02/09/24,1,"PricewaterhouseCoopers LLP",,,,"New York",NY,"NEW YORK","US Mid Atlantic",10-K,2024-02-09,,"AMERICAN EXPRESS CO",4962,"=""AXP""","200 VESEY STREET","50TH FLOOR","NEW YORK",NY,"NEW YORK","US Mid Atlantic",,,"=""6199""","Finance Services",523930,"Investment Advice",34,188,01/02/24,"137,230,082,048",12/31/23,"55,592,000,000","8,374,000,000",,"261,108,000,000"
34066,"Other investments","Valuation of investments in fixed maturity securities",525923,12/31/23,02/23/24,2,"Ernst & Young LLP",,,,Cincinnati,OH,OHIO,"US Midwest",10-K,2024-02-23,,"AMERICAN FINANCIAL GROUP INC",1042046,"=""AFG""","GREAT AMERICAN INSURANCE GROUP TOWER","301 E. 4TH STREET",CINCINNATI,OH,OHIO,"US Midwest",,,"=""6331""","Fire, Marine, and Casualty Insurance",524126,"Direct Property and Casualty Insurance Carriers",34,119,01/02/24,"10,002,232,320",12/31/23,"7,827,000,000","852,000,000","3,953,000,000","29,787,000,000"
34067,"Insurance contract liabilities","Unpaid losses and loss adjustment expenses",525923,12/31/23,02/23/24,2,"Ernst & Young LLP",,,,Cincinnati,OH,OHIO,"US Midwest",10-K,2024-02-23,,"AMERICAN FINANCIAL GROUP INC",1042046,"=""AFG""","GREAT AMERICAN INSURANCE GROUP TOWER","301 E. 4TH STREET",CINCINNATI,OH,OHIO,"US Midwest",,,"=""6331""","Fire, Marine, and Casualty Insurance",524126,"Direct Property and Casualty Insurance Carriers",34,119,01/02/24,"10,002,232,320",12/31/23,"7,827,000,000","852,000,000","3,953,000,000","29,787,000,000"
36470,"Long-lived assets","Impairment of Long-Lived Assets relating to real estate investments, net — Refer to Notes 2 and 3 to the financial statements",530872,12/31/23,03/22/24,3,"Deloitte & Touche LLP",,,,"Costa Mesa",CA,CALIFORNIA,"US West",10-K,2024-03-22,,"American Healthcare REIT, Inc.",1632970,"=""AHR""","18191 VON KARMAN AVENUE","SUITE 300",IRVINE,CA,CALIFORNIA,"US West",,,"=""6798""","Real Estate Investment Trusts",525990,"Other Financial Vehicles",34,,,,12/31/23,"1,866,618,000","-71,469,000","888,752,000","4,577,933,000"
33979,"Real estate investments","Real estate assets, net",526104,12/31/23,02/23/24,2,"Ernst & Young LLP",,,,"Los Angeles",CA,CALIFORNIA,"US West",10-K,2024-02-23,,"American Homes 4 Rent",1562401,"=""AMH""","280 PILOT ROAD",,"LAS VEGAS",NV,NEVADA,"US West",,,"=""6798""","Real Estate Investment Trusts",525990,"Other Financial Vehicles",34,37,01/02/24,"13,206,318,080",12/31/23,"1,623,605,000","380,168,000","6,847,245,000","12,688,190,000"
33830,"Real estate investments","Real estate assets, net",526117,12/31/23,02/23/24,2,"Ernst & Young LLP",,,,"Los Angeles",CA,CALIFORNIA,"US West",10-K,2024-02-23,,"American Homes 4 Rent, L.P.",1716558,,"280 PILOT ROAD",,"LAS VEGAS",NV,NEVADA,"US West",1562401,"American Homes 4 Rent","=""6798""","Real Estate Investment Trusts",531110,"Lessors of Residential Buildings and Dwellings",34,,,,12/31/23,"1,623,605,000","432,142,000","7,532,604,000","12,688,190,000"
30461,"Allowance for credit losses","Allowance for expected credit losses on retail loans",513798,03/31/23,06/23/23,4,"KPMG LLP",,,,"Los Angeles",CA,CALIFORNIA,"US West",10-K,2023-06-23,,"AMERICAN HONDA FINANCE CORP",864270,,"1919 TORRANCE BLVD.",,TORRANCE,CA,CALIFORNIA,"US West",715153,"HONDA MOTOR CO LTD","=""6141""","Personal Credit Institutions",522291,"Consumer Lending",34,,,,03/31/23,"7,243,000,000","1,053,000,000",,"68,891,000,000"
30462,Leases,"Estimated early termination losses on operating lease assets",513798,03/31/23,06/23/23,4,"KPMG LLP",,,,"Los Angeles",CA,CALIFORNIA,"US West",10-K,2023-06-23,,"AMERICAN HONDA FINANCE CORP",864270,,"1919 TORRANCE BLVD.",,TORRANCE,CA,CALIFORNIA,"US West",715153,"HONDA MOTOR CO LTD","=""6141""","Personal Credit Institutions",522291,"Consumer Lending",34,,,,03/31/23,"7,243,000,000","1,053,000,000",,"68,891,000,000"
30463,Leases,"Estimated end of term residual values of leased vehicles",513798,03/31/23,06/23/23,4,"KPMG LLP",,,,"Los Angeles",CA,CALIFORNIA,"US West",10-K,2023-06-23,,"AMERICAN HONDA FINANCE CORP",864270,,"1919 TORRANCE BLVD.",,TORRANCE,CA,CALIFORNIA,"US West",715153,"HONDA MOTOR CO LTD","=""6141""","Personal Credit Institutions",522291,"Consumer Lending",34,,,,03/31/23,"7,243,000,000","1,053,000,000",,"68,891,000,000"
32721,"Other investments","Valuation of Certain Level 3 Fixed Maturity Securities",524614,12/31/23,02/14/24,1,"PricewaterhouseCoopers LLP",,,,"New York",NY,"NEW YORK","US Mid Atlantic",10-K,2024-02-14,,"AMERICAN INTERNATIONAL GROUP, INC.",5272,"=""AIG""","1271 AVE OF THE AMERICAS","FL 37","NEW YORK",NY,"NEW YORK","US Mid Atlantic",,,"=""6331""","Fire, Marine, and Casualty Insurance",524130,"Reinsurance Carriers",34,68,12/31/23,"46,668,894,208",12/31/23,"27,938,000,000","3,643,000,000",,"539,306,000,000"
32722,"Insurance contract liabilities","Valuation of Insurance Liabilities - Unpaid Losses and Loss Adjustment Expenses (Loss Reserves), Net of Reinsurance",524614,12/31/23,02/14/24,1,"PricewaterhouseCoopers LLP",,,,"New York",NY,"NEW YORK","US Mid Atlantic",10-K,2024-02-14,,"AMERICAN INTERNATIONAL GROUP, INC.",5272,"=""AIG""","1271 AVE OF THE AMERICAS","FL 37","NEW YORK",NY,"NEW YORK","US Mid Atlantic",,,"=""6331""","Fire, Marine, and Casualty Insurance",524130,"Reinsurance Carriers",34,68,12/31/23,"46,668,894,208",12/31/23,"27,938,000,000","3,643,000,000",,"539,306,000,000"
32723,"Insurance contract liabilities","Valuation of Market Risk Benefits (MRBs) on Individual Retirement Variable and Fixed Index Annuity contracts and the valuation of Embedded Derivatives (EDs) for certain Guaranteed Benefit Features on Fixed Index Annuity contracts",524614,12/31/23,02/14/24,1,"PricewaterhouseCoopers LLP",,,,"New York",NY,"NEW YORK","US Mid Atlantic",10-K,2024-02-14,,"AMERICAN INTERNATIONAL GROUP, INC.",5272,"=""AIG""","1271 AVE OF THE AMERICAS","FL 37","NEW YORK",NY,"NEW YORK","US Mid Atlantic",,,"=""6331""","Fire, Marine, and Casualty Insurance",524130,"Reinsurance Carriers",34,68,12/31/23,"46,668,894,208",12/31/23,"27,938,000,000","3,643,000,000",,"539,306,000,000"
32724,"Policy changes","Adoption of the New Accounting Standard for Long-Duration Contracts",524614,12/31/23,02/14/24,1,"PricewaterhouseCoopers LLP",,,,"New York",NY,"NEW YORK","US Mid Atlantic",10-K,2024-02-14,,"AMERICAN INTERNATIONAL GROUP, INC.",5272,"=""AIG""","1271 AVE OF THE AMERICAS","FL 37","NEW YORK",NY,"NEW YORK","US Mid Atlantic",,,"=""6331""","Fire, Marine, and Casualty Insurance",524130,"Reinsurance Carriers",34,68,12/31/23,"46,668,894,208",12/31/23,"27,938,000,000","3,643,000,000",,"539,306,000,000"
32725,"Deferred income taxes","Recoverability of U.S. Federal Deferred Tax Asset",524614,12/31/23,02/14/24,1,"PricewaterhouseCoopers LLP",,,,"New York",NY,"NEW YORK","US Mid Atlantic",10-K,2024-02-14,,"AMERICAN INTERNATIONAL GROUP, INC.",5272,"=""AIG""","1271 AVE OF THE AMERICAS","FL 37","NEW YORK",NY,"NEW YORK","US Mid Atlantic",,,"=""6331""","Fire, Marine, and Casualty Insurance",524130,"Reinsurance Carriers",34,68,12/31/23,"46,668,894,208",12/31/23,"27,938,000,000","3,643,000,000",,"539,306,000,000"
35235,"Insurance contract liabilities","Fixed Index Annuity Embedded Derivative Liability and Market Risk Benefits",527333,12/31/23,02/29/24,2,"Ernst & Young LLP",,,,"Des Moines",IA,IOWA,"US Midwest",10-K,2024-02-29,,"American National Group Inc.",1039828,"=""AEL.A""","6000 WESTOWN PARKWAY",,"WEST DES MOINES",IA,IOWA,"US Midwest",,,"=""6311""","Life Insurance",524113,"Direct Life Insurance Carriers",34,55,01/02/24,"4,362,170,368",12/31/23,"2,835,970,000","210,530,000",,"79,918,302,000"
36734,"Accounts/loans receivable","Valuation of Patient Services Accounts Receivable – Allowance for Contractual Adjustments",531626,12/31/23,03/28/24,1,"PricewaterhouseCoopers LLP",,,,Nashville,TN,TENNESSEE,"US Southeast",10-K,2024-03-28,,"American Oncology Network, Inc.",1839998,"=""AONC""","14543 GLOBAL PKWY #110",,"FORT MYERS",FL,FLORIDA,"US Southeast",,,"=""8000""","Services-Health Services",621111,"Offices of Physicians (except Mental Health Specialists)",34,6,01/02/24,"55,437,368",12/31/23,"1,279,185,000","-5,542,000","69,054,000","374,453,000"
38083,"Accounts/loans receivable","Valuation of Patient Services Accounts Receivable – Allowance for Contractual Adjustments",535196,12/31/23,03/28/24,1,"PricewaterhouseCoopers LLP",,,,Nashville,TN,TENNESSEE,"US Southeast","POS AM",2024-04-29,,"American Oncology Network, Inc.",1839998,"=""AONC""","14543 GLOBAL PKWY #110",,"FORT MYERS",FL,FLORIDA,"US Southeast",,,"=""8000""","Services-Health Services",621111,"Offices of Physicians (except Mental Health Specialists)",34,6,01/02/24,"55,437,368",12/31/23,"1,279,185,000","-5,542,000","69,054,000","374,453,000"
38180,"Accounts/loans receivable","Valuation of Patient Services Accounts Receivable – Allowance for Contractual Adjustments",535827,12/31/23,03/28/24,1,"PricewaterhouseCoopers LLP",,,,Nashville,TN,TENNESSEE,"US Southeast",424B3,2024-05-06,,"American Oncology Network, Inc.",1839998,"=""AONC""","14543 GLOBAL PKWY #110",,"FORT MYERS",FL,FLORIDA,"US Southeast",,,"=""8000""","Services-Health Services",621111,"Offices of Physicians (except Mental Health Specialists)",34,6,01/02/24,"55,437,368",12/31/23,"1,279,185,000","-5,542,000","69,054,000","374,453,000"
35391,"Goodwill and intangible assets","Goodwill and Intangible Assets — Rasmussen University Reporting Unit — Refer to Notes 2 and 7 to the financial statements.",528257,12/31/23,03/05/24,3,"Deloitte & Touche LLP",,,,McLean,VA,VIRGINIA,"US Mid Atlantic",10-K,2024-03-05,,"AMERICAN PUBLIC EDUCATION INC",1201792,"=""APEI""","111 W CONGRESS STREET",,"CHARLES TOWN",WV,"WEST VIRGINIA","US Mid Atlantic",,,"=""8200""","Services-Educational Services",923110,"Administration of Education Programs",34,10,12/31/23,"169,882,176",12/31/23,"600,545,000","-47,286,000","200,844,000","557,386,000"
33428,"Regulatory assets and liabilities","Accounting for the Effects of Rate Regulation",525214,12/31/23,02/21/24,1,"PricewaterhouseCoopers LLP",,,,"Los Angeles",CA,CALIFORNIA,"US West",10-K,2024-02-21,,"AMERICAN STATES WATER CO",1056903,"=""AWR""","630 E FOOTHILL BLVD",,"SAN DIMAS",CA,CALIFORNIA,"US West",,,"=""4941""","Water Supply",221310,"Water Supply and Irrigation Systems",34,80,12/31/23,"2,973,980,928",12/31/23,"595,699,000","124,921,000",,"2,246,122,000"
37126,"Long-lived assets","Impairment Assessment of Real Estate Investments, including Acquired Intangible Assets and Below-Market Lease Liabilities",532092,12/31/23,04/01/24,1,"PricewaterhouseCoopers LLP",,,,"New York",NY,"NEW YORK","US Mid Atlantic",10-K,2024-04-01,,"American Strategic Investment Co.",1595527,"=""NYC""","222 BELLEVUE AVENUE",,NEWPORT,RI,"RHODE ISLAND","US New England",,,"=""6798""","Real Estate Investment Trusts",531120,"Lessors of Nonresidential Buildings (except Miniwarehouses)",34,8,12/29/23,"18,604,690",12/31/23,"62,710,000","-105,924,000","167,865,000","694,172,000"
34490,Goodwill,"Determination of fair value of the Spain reporting unit - Refer to Notes 1, 5, 11, and 16 to the financial statements.",526559,12/31/23,02/27/24,3,"Deloitte & Touche LLP",,,,Boston,MA,MASSACHUSETTS,"US New England",10-K,2024-02-27,,"AMERICAN TOWER CORP /MA/",1053507,"=""AMT""","116 HUNTINGTON AVE",,BOSTON,MA,MASSACHUSETTS,"US New England",,,"=""6798""","Real Estate Investment Trusts",525930,"Real Estate Investment Trusts",34,219,01/02/24,"102,001,590,272",12/31/23,"10,012,200,000","1,483,300,000","-24,961,500,000","66,027,600,000"
36854,"Sales return and allowances","Accrued Program Costs — Refer to Note 1 to the financial statements",531717,12/31/23,03/27/24,3,"Deloitte & Touche LLP",,,,"Costa Mesa",CA,CALIFORNIA,"US West",10-K,2024-03-28,,"AMERICAN VANGUARD CORP",5981,"=""AVD""","4695 MACARTHUR COURT",,"NEWPORT BEACH",CA,CALIFORNIA,"US West",,,"=""2870""","Agricultural Chemicals",325320,"Pesticide and Other Agricultural Chemical Manufacturing",34,11,12/31/23,"315,514,816",12/31/23,"579,371,000","7,519,000","146,303,000","767,548,000"
36855,Goodwill,"Goodwill — Refer to Notes 1 and 9 to the financial statements",531717,12/31/23,03/27/24,3,"Deloitte & Touche LLP",,,,"Costa Mesa",CA,CALIFORNIA,"US West",10-K,2024-03-28,,"AMERICAN VANGUARD CORP",5981,"=""AVD""","4695 MACARTHUR COURT",,"NEWPORT BEACH",CA,CALIFORNIA,"US West",,,"=""2870""","Agricultural Chemicals",325320,"Pesticide and Other Agricultural Chemical Manufacturing",34,11,12/31/23,"315,514,816",12/31/23,"579,371,000","7,519,000","146,303,000","767,548,000"
32762,"Regulatory assets and liabilities","Accounting for the Effects of Rate Regulation",524645,12/31/23,02/14/24,1,"PricewaterhouseCoopers LLP",,,,Philadelphia,PA,PENNSYLVANIA,"US Mid Atlantic",10-K,2024-02-14,,"American Water Works Company, Inc.",1410636,"=""AWK""","1 WATER STREET",,CAMDEN,NJ,"NEW JERSEY","US Mid Atlantic",,,"=""4941""","Water Supply",221310,"Water Supply and Irrigation Systems",34,132,12/31/23,"25,702,426,624",12/31/23,"4,234,000,000","944,000,000","8,657,000,000","30,298,000,000"
32851,"Revenue from customer contracts","Revenue Recognition - Platform Subscription and Visits",524738,12/31/23,02/14/24,1,"PricewaterhouseCoopers LLP",,,,Boston,MA,MASSACHUSETTS,"US New England",10-K,2024-02-15,,"American Well Corp",1393584,"=""AMWL""","75 STATE STREET","26TH FLOOR",Boston,MA,MASSACHUSETTS,"US New England",,,"=""7389""","Business Services, NEC",923120,"Administration of Public Health Programs",34,1,01/02/24,"369,203,776",12/31/23,"259,047,000","-675,164,000","343,971,000","589,705,000"
35280,"Revenue from customer contracts","Revenue Recognition - Platform Subscription and Visits",527895,12/31/23,02/15/24,1,"PricewaterhouseCoopers LLP",,,,Boston,MA,MASSACHUSETTS,"US New England",10-K/A,2024-03-01,,"American Well Corp",1393584,"=""AMWL""","75 STATE STREET","26TH FLOOR",Boston,MA,MASSACHUSETTS,"US New England",,,"=""7389""","Business Services, NEC",923120,"Administration of Public Health Programs",34,1,01/02/24,"369,203,776",12/31/23,"259,047,000","-675,164,000","343,971,000","589,705,000"
30503,Goodwill,"Goodwill Impairment Assessment",513951,04/30/23,06/27/23,2,"Ernst & Young LLP",,,,Richmond,VA,VIRGINIA,"US Mid Atlantic",10-K,2023-06-27,,"AMERICAN WOODMARK CORP",794619,"=""AMWD""","3102 SHAWNEE DRIVE",,WINCHESTER,VA,VIRGINIA,"US Mid Atlantic",,,"=""2430""","Millwood, Veneer, Plywood, & Structural Wood Members",337110,"Wood Kitchen Cabinet and Countertop Manufacturing",34,51,04/30/23,"840,415,104",04/30/23,"2,066,200,000","93,723,000","75,732,000","1,518,798,000"
35127,Goodwill,"Test of Goodwill for Impairment",527458,12/31/23,02/29/24,2,"Ernst & Young LLP",,,,Atlanta,GA,GEORGIA,"US Southeast",10-K,2024-02-29,,"AMERICOLD REALTY TRUST",1455863,"=""COLD""","10 Glenlake Pkwy., Suite 800 S. Tower",,Atlanta,GA,GEORGIA,"US Southeast",,,"=""6798""","Real Estate Investment Trusts",525990,"Other Financial Vehicles",34,30,01/02/24,"8,590,653,440",12/31/23,"2,673,329,000","-336,215,000","1,730,633,000","7,675,174,000"
33544,"Other investments","Valuation of Level 2 Available-for-Sale Securities",525709,12/31/23,02/22/24,1,"PricewaterhouseCoopers LLP",,,,Minneapolis,MN,MINNESOTA,"US Midwest",10-K,2024-02-22,,"AMERIPRISE CERTIFICATE CO",52428,,"50606 AMERIPRISE FINANCIAL CENTER",,MINNEAPOLIS,MN,MINNESOTA,"US Midwest",820027,"AMERIPRISE FINANCIAL INC",,,525990,"Other Financial Vehicles",34,,,,12/31/23,"660,113,000","102,762,000","689,358,000","14,249,353,000"
33709,"Insurance contract liabilities","Valuation of market risk benefits",525815,12/31/23,02/22/24,1,"PricewaterhouseCoopers LLP",,,,Minneapolis,MN,MINNESOTA,"US Midwest",10-K,2024-02-22,,"AMERIPRISE FINANCIAL INC",820027,"=""AMP""","1099 AMERIPRISE FINANCIAL CENTER",,MINNEAPOLIS,MN,MINNESOTA,"US Midwest",,,"=""6282""","Investment Advice",523930,"Investment Advice",34,379,01/02/24,"38,356,393,984",12/31/23,"16,096,000,000","2,556,000,000",,"175,191,000,000"
33710,"Policy changes","Adoption of the new accounting standard for long-duration insurance contracts",525815,12/31/23,02/22/24,1,"PricewaterhouseCoopers LLP",,,,Minneapolis,MN,MINNESOTA,"US Midwest",10-K,2024-02-22,,"AMERIPRISE FINANCIAL INC",820027,"=""AMP""","1099 AMERIPRISE FINANCIAL CENTER",,MINNEAPOLIS,MN,MINNESOTA,"US Midwest",,,"=""6282""","Investment Advice",523930,"Investment Advice",34,379,01/02/24,"38,356,393,984",12/31/23,"16,096,000,000","2,556,000,000",,"175,191,000,000"
34562,"Allowance for credit losses","Quantitative component of the allowance for credit losses on loans evaluated on a collective basis",527219,12/31/23,02/28/24,4,"KPMG LLP",,,,Atlanta,GA,GEORGIA,"US Southeast",10-K,2024-02-28,,"Ameris Bancorp",351569,"=""ABCB""","3490 PIEDMONT RD","SUITE 1550",ATLANTA,GA,GEORGIA,"US Southeast",,,"=""6022""","State Commercial Banks",522110,"Commercial Banking",34,52,01/02/24,"3,601,064,960",12/31/23,"935,216,000","269,105,000","2,323,152,000","25,203,699,000"
34058,"Insurance contract liabilities","Valuation of Loss and Loss Adjustment Expense reserves",525912,12/31/23,02/23/24,2,"Ernst & Young LLP",,,,"New Orleans",LA,LOUISIANA,"US Southeast",10-K,2024-02-23,,"AMERISAFE INC",1018979,"=""AMSF""","2301 HIGHWAY 190 WEST",,DERIDDER,LA,LOUISIANA,"US Southeast",,,"=""6331""","Fire, Marine, and Casualty Insurance",524126,"Direct Property and Casualty Insurance Carriers",34,47,01/02/24,"901,542,208",12/31/23,"306,853,000","62,108,000",,"1,229,162,000"
33736,"Other intangible assets","Impairment Assessment of Indefinite Lived Intangible Assets (other than Goodwill)",525469,12/31/23,02/22/24,2,"Ernst & Young LLP",,,,Philadelphia,PA,PENNSYLVANIA,"US Mid Atlantic",10-K,2024-02-22,,"AMETEK INC/",1037868,"=""AME""","1100 CASSATT ROAD",,BERWYN,PA,PENNSYLVANIA,"US Mid Atlantic",,,"=""3823""","Industrial Instruments for Measurement, Display, and Control of Process Variables; and Related Products",335312,"Motor and Generator Manufacturing",34,163,01/02/24,"37,590,175,744",12/31/23,"6,596,950,000","1,313,188,000","-1,882,755,000","15,023,533,000"
33737,"Business combinations","Accounting for the Provisional Fair Value of the Intangibles from the Acquisition of Paragon Medical",525469,12/31/23,02/22/24,2,"Ernst & Young LLP",,,,Philadelphia,PA,PENNSYLVANIA,"US Mid Atlantic",10-K,2024-02-22,,"AMETEK INC/",1037868,"=""AME""","1100 CASSATT ROAD",,BERWYN,PA,PENNSYLVANIA,"US Mid Atlantic",,,"=""3823""","Industrial Instruments for Measurement, Display, and Control of Process Variables; and Related Products",335312,"Motor and Generator Manufacturing",34,163,01/02/24,"37,590,175,744",12/31/23,"6,596,950,000","1,313,188,000","-1,882,755,000","15,023,533,000"
32714,"Sales return and allowances","Sales deductions",524620,12/31/23,02/14/24,2,"Ernst & Young LLP",,,,"Los Angeles",CA,CALIFORNIA,"US West",10-K,2024-02-14,,"AMGEN INC",318154,"=""AMGN""","ONE AMGEN CENTER DRIVE",,"THOUSAND OAKS",CA,CALIFORNIA,"US West",,,"=""2836""","Biological Products, Except Diagnostic Substances",325414,"Biological Product (except Diagnostic) Manufacturing",34,297,01/02/24,"159,156,600,832",12/31/23,"28,190,000,000","6,717,000,000","-45,038,000,000","97,154,000,000"
32715,"Other income taxes","Unrecognized tax benefits",524620,12/31/23,02/14/24,2,"Ernst & Young LLP",,,,"Los Angeles",CA,CALIFORNIA,"US West",10-K,2024-02-14,,"AMGEN INC",318154,"=""AMGN""","ONE AMGEN CENTER DRIVE",,"THOUSAND OAKS",CA,CALIFORNIA,"US West",,,"=""2836""","Biological Products, Except Diagnostic Substances",325414,"Biological Product (except Diagnostic) Manufacturing",34,297,01/02/24,"159,156,600,832",12/31/23,"28,190,000,000","6,717,000,000","-45,038,000,000","97,154,000,000"
32716,"Business combinations","Valuation of intangible assets acquired in a business combination",524620,12/31/23,02/14/24,2,"Ernst & Young LLP",,,,"Los Angeles",CA,CALIFORNIA,"US West",10-K,2024-02-14,,"AMGEN INC",318154,"=""AMGN""","ONE AMGEN CENTER DRIVE",,"THOUSAND OAKS",CA,CALIFORNIA,"US West",,,"=""2836""","Biological Products, Except Diagnostic Substances",325414,"Biological Product (except Diagnostic) Manufacturing",34,297,01/02/24,"159,156,600,832",12/31/23,"28,190,000,000","6,717,000,000","-45,038,000,000","97,154,000,000"
34825,"Sales return and allowances","Revenue recognition – Measurement of variable consideration for Ex-U.S. third-party discounts and rebates",526973,12/31/23,02/28/24,2,"Ernst & Young LLP",,,,Iselin,NJ,"NEW JERSEY","US Mid Atlantic",10-K,2024-02-28,,"AMICUS THERAPEUTICS, INC.",1178879,"=""FOLD""","47 HULFISH STREET",,PRINCETON,NJ,"NEW JERSEY","US Mid Atlantic",,,"=""2834""","Pharmaceutical Preparations",325412,"Pharmaceutical Preparation Manufacturing",34,14,01/02/24,"4,175,819,264",12/31/23,"399,356,000","-151,584,000","-58,113,000","777,880,000"
32970,"Other income taxes","Accounting for Income Taxes",524917,12/31/23,02/16/24,1,"PricewaterhouseCoopers LLP",,,,Phoenix,AZ,ARIZONA,"US Southwest",10-K,2024-02-16,,"AMKOR TECHNOLOGY, INC.",1047127,"=""AMKR""","2045 EAST INNOVATION CIRCLE",,TEMPE,AZ,ARIZONA,"US Southwest",,,"=""3674""","Semiconductors and Related Devices",334515,"Instrument Manufacturing for Measuring and Testing Electricity and Electrical Signals",34,32,01/02/24,"7,864,579,584",12/31/23,"6,503,065,000","359,813,000","3,942,305,000","6,771,125,000"
33674,"Other contingent liabilities","Professional Liability Reserve",525531,12/31/23,02/22/24,4,"KPMG LLP",,,,"San Diego",CA,CALIFORNIA,"US West",10-K,2024-02-22,,"AMN HEALTHCARE SERVICES INC",1142750,"=""AMN""","2999 OLYMPUS BOULEVARD","SUITE 500",DALLAS,TX,TEXAS,"US Southwest",,,"=""7363""","Help Supply Services",561310,"Employment Placement Agencies",34,77,01/02/24,"2,926,391,040",12/31/23,"3,789,254,000","210,679,000","-754,427,000","2,924,394,000"
33675,"Business combinations","Fair value of certain intangible assets acquired in the acquisition of MSDR",525531,12/31/23,02/22/24,4,"KPMG LLP",,,,"San Diego",CA,CALIFORNIA,"US West",10-K,2024-02-22,,"AMN HEALTHCARE SERVICES INC",1142750,"=""AMN""","2999 OLYMPUS BOULEVARD","SUITE 500",DALLAS,TX,TEXAS,"US Southwest",,,"=""7363""","Help Supply Services",561310,"Employment Placement Agencies",34,77,01/02/24,"2,926,391,040",12/31/23,"3,789,254,000","210,679,000","-754,427,000","2,924,394,000"
36009,"Sales return and allowances","Medicaid Rebates",530101,12/31/23,03/14/24,2,"Ernst & Young LLP",,,,Iselin,NJ,"NEW JERSEY","US Mid Atlantic",10-K,2024-03-14,,"Amneal Pharmaceuticals, Inc.",1723128,"=""AMRX""","30831 HUNTWOOD AVE",,HAYWARD,CA,CALIFORNIA,"US West",,,"=""2834""","Pharmaceutical Preparations",325412,"Pharmaceutical Preparation Manufacturing",34,6,12/31/23,"1,860,849,536",12/31/23,"2,393,607,000","-83,993,000","-1,427,978,000","3,472,569,000"
36010,"Sales return and allowances","Sales Returns",530101,12/31/23,03/14/24,2,"Ernst & Young LLP",,,,Iselin,NJ,"NEW JERSEY","US Mid Atlantic",10-K,2024-03-14,,"Amneal Pharmaceuticals, Inc.",1723128,"=""AMRX""","30831 HUNTWOOD AVE",,HAYWARD,CA,CALIFORNIA,"US West",,,"=""2834""","Pharmaceutical Preparations",325412,"Pharmaceutical Preparation Manufacturing",34,6,12/31/23,"1,860,849,536",12/31/23,"2,393,607,000","-83,993,000","-1,427,978,000","3,472,569,000"
36011,"Goodwill and intangible assets","Impairment of Goodwill and Other Indefinite-lived Intangible Assets",530101,12/31/23,03/14/24,2,"Ernst & Young LLP",,,,Iselin,NJ,"NEW JERSEY","US Mid Atlantic",10-K,2024-03-14,,"Amneal Pharmaceuticals, Inc.",1723128,"=""AMRX""","30831 HUNTWOOD AVE",,HAYWARD,CA,CALIFORNIA,"US West",,,"=""2834""","Pharmaceutical Preparations",325412,"Pharmaceutical Preparation Manufacturing",34,6,12/31/23,"1,860,849,536",12/31/23,"2,393,607,000","-83,993,000","-1,427,978,000","3,472,569,000"
35049,"Sales return and allowances","Provision for chargebacks estimate",527409,12/31/23,02/29/24,2,"Ernst & Young LLP",,,,Irvine,CA,CALIFORNIA,"US West",10-K,2024-02-29,,"Amphastar Pharmaceuticals, Inc.",1297184,"=""AMPH""","11570 SIXTH STREET",,"RANCHO CUCAMONGA",CA,CALIFORNIA,"US West",,,"=""2834""","Pharmaceutical Preparations",325412,"Pharmaceutical Preparation Manufacturing",34,62,01/02/24,"2,984,152,576",12/31/23,"644,395,000","137,545,000","26,126,000","1,512,912,000"
35050,Inventory,"Enoxaparin inventory lower of cost or net realizable value estimate",527409,12/31/23,02/29/24,2,"Ernst & Young LLP",,,,Irvine,CA,CALIFORNIA,"US West",10-K,2024-02-29,,"Amphastar Pharmaceuticals, Inc.",1297184,"=""AMPH""","11570 SIXTH STREET",,"RANCHO CUCAMONGA",CA,CALIFORNIA,"US West",,,"=""2834""","Pharmaceutical Preparations",325412,"Pharmaceutical Preparation Manufacturing",34,62,01/02/24,"2,984,152,576",12/31/23,"644,395,000","137,545,000","26,126,000","1,512,912,000"
35051,"Business combinations","BAQSIMI® Acquisition",527409,12/31/23,02/29/24,2,"Ernst & Young LLP",,,,Irvine,CA,CALIFORNIA,"US West",10-K,2024-02-29,,"Amphastar Pharmaceuticals, Inc.",1297184,"=""AMPH""","11570 SIXTH STREET",,"RANCHO CUCAMONGA",CA,CALIFORNIA,"US West",,,"=""2834""","Pharmaceutical Preparations",325412,"Pharmaceutical Preparation Manufacturing",34,62,01/02/24,"2,984,152,576",12/31/23,"644,395,000","137,545,000","26,126,000","1,512,912,000"
32420,"Other income taxes","Income Taxes — Unrecognized Tax Benefits — Refer to Notes 1 and 6 to the financial statements",524150,12/31/23,02/07/24,3,"Deloitte & Touche LLP",,,,Hartford,CT,CONNECTICUT,"US New England",10-K,2024-02-07,,"AMPHENOL CORP /DE/",820313,"=""APH""","358 HALL AVE",,WALLINGFORD,CT,CONNECTICUT,"US New England",,,"=""3678""","Electronic Connectors",334417,"Electronic Connector Manufacturing",34,97,01/02/24,"57,934,381,056",12/31/23,"12,554,700,000","1,928,000,000","450,000,000","16,526,400,000"
35577,"Proven and unproven reserves","Oil and Natural Gas Properties, Depletion – Oil and Natural Gas Reserve Quantities as used in the calculation of DD&A— Refer to Notes 2 and 18 to the financial statements.",528975,12/31/23,03/06/24,3,"Deloitte & Touche LLP",,,,Houston,TX,TEXAS,"US Southwest",10-K,2024-03-07,,"Amplify Energy Corp.",1533924,"=""AMPY""","500 DALLAS STREET","SUITE 1700",,TX,TEXAS,"US Southwest",,,"=""1311""","Crude Petroleum and Natural Gas",211111,"Crude Petroleum and Natural Gas Extraction",34,6,12/31/23,"232,142,928",12/31/23,"307,596,000","392,750,000",,"737,674,000"
33166,"Revenue from customer contracts","Revenue arrangements with non-standard terms and conditions",525174,12/31/23,02/20/24,4,"KPMG LLP",,,,"Santa Clara",CA,CALIFORNIA,"US West",10-K,2024-02-20,,"Amplitude, Inc.",1866692,"=""AMPL""","201 THIRD STREET, SUITE 200",,"SAN FRANCISCO",CA,CALIFORNIA,"US West",,,"=""7372""","Prepackaged Software",511210,"Software Publishers",34,13,12/31/23,"1,089,188,096",12/31/23,"276,284,000","-90,363,000","290,071,000","433,684,000"
42155,Goodwill,"Building Envelope Goodwill Impairment Test",554860,12/31/23,09/06/24,2,"Ernst & Young LLP",56,"Ernst & Young AG",1460,Zurich,V8,SWITZERLAND,Foreign,DRS/A,2025-01-10,,"Amrize Ltd",2035989,"=""AMRZ""","GRAFENAUWEG 8",,ZUG,V8,SWITZERLAND,Foreign,,,"=""3241""","Cement, Hydraulic",,,34,,,,,,,,
42156,"Other intangible assets","Fair Value of Customer Relationships as part of Business Combinations",554860,12/31/23,09/06/24,2,"Ernst & Young LLP",56,"Ernst & Young AG",1460,Zurich,V8,SWITZERLAND,Foreign,DRS/A,2025-01-10,,"Amrize Ltd",2035989,"=""AMRZ""","GRAFENAUWEG 8",,ZUG,V8,SWITZERLAND,Foreign,,,"=""3241""","Cement, Hydraulic",,,34,,,,,,,,
42157,Goodwill,"Building Envelope Goodwill Impairment Test",554853,12/31/23,09/06/24,2,"Ernst & Young LLP",56,"Ernst & Young AG",1460,Zurich,V8,SWITZERLAND,Foreign,DRS/A,2024-12-12,,"Amrize Ltd",2035989,"=""AMRZ""","GRAFENAUWEG 8",,ZUG,V8,SWITZERLAND,Foreign,,,"=""3241""","Cement, Hydraulic",,,34,,,,,,,,
42158,"Other intangible assets","Fair Value of Customer Relationships as part of Business Combinations",554853,12/31/23,09/06/24,2,"Ernst & Young LLP",56,"Ernst & Young AG",1460,Zurich,V8,SWITZERLAND,Foreign,DRS/A,2024-12-12,,"Amrize Ltd",2035989,"=""AMRZ""","GRAFENAUWEG 8",,ZUG,V8,SWITZERLAND,Foreign,,,"=""3241""","Cement, Hydraulic",,,34,,,,,,,,
42159,Goodwill,"Building Envelope Goodwill Impairment Test",554850,12/31/23,09/06/24,2,"Ernst & Young LLP",56,"Ernst & Young AG",1460,Zurich,V8,SWITZERLAND,Foreign,DRS/A,2024-10-31,,"Amrize Ltd",2035989,"=""AMRZ""","GRAFENAUWEG 8",,ZUG,V8,SWITZERLAND,Foreign,,,"=""3241""","Cement, Hydraulic",,,34,,,,,,,,
42160,"Other intangible assets","Fair Value of Customer Relationships as part of Business Combinations",554850,12/31/23,09/06/24,2,"Ernst & Young LLP",56,"Ernst & Young AG",1460,Zurich,V8,SWITZERLAND,Foreign,DRS/A,2024-10-31,,"Amrize Ltd",2035989,"=""AMRZ""","GRAFENAUWEG 8",,ZUG,V8,SWITZERLAND,Foreign,,,"=""3241""","Cement, Hydraulic",,,34,,,,,,,,
42161,Goodwill,"Building Envelope Goodwill Impairment Test",554849,12/31/23,09/06/24,2,"Ernst & Young LLP",56,"Ernst & Young AG",1460,Zurich,V8,SWITZERLAND,Foreign,DRS,2024-09-06,,"Amrize Ltd",2035989,"=""AMRZ""","GRAFENAUWEG 8",,ZUG,V8,SWITZERLAND,Foreign,,,"=""3241""","Cement, Hydraulic",,,34,,,,,,,,
42162,"Other intangible assets","Fair Value of Customer Relationships as part of Business Combinations",554849,12/31/23,09/06/24,2,"Ernst & Young LLP",56,"Ernst & Young AG",1460,Zurich,V8,SWITZERLAND,Foreign,DRS,2024-09-06,,"Amrize Ltd",2035989,"=""AMRZ""","GRAFENAUWEG 8",,ZUG,V8,SWITZERLAND,Foreign,,,"=""3241""","Cement, Hydraulic",,,34,,,,,,,,
33622,"Accounts/loans receivable","Variable consideration related to gross-to-net (“GTN”) adjustments - Refer to Notes 2 and 3 to the financial statements",525610,12/31/23,02/22/24,3,"Deloitte & Touche LLP",,,,Boston,MA,MASSACHUSETTS,"US New England",10-K,2024-02-22,,"Amylyx Pharmaceuticals, Inc.",1658551,"=""AMLX""","43 THORNDIKE STREET",,CAMBRIDGE,MA,MASSACHUSETTS,"US New England",,,"=""2834""","Pharmaceutical Preparations",325412,"Pharmaceutical Preparation Manufacturing",34,15,12/31/23,"996,653,376",12/31/23,"380,786,000","49,271,000",,"517,454,000"
31760,"Sales return and allowances","Revenue Recognition – Measuring Price Protection Credits",520125,10/28/23,11/21/23,2,"Ernst & Young LLP",,,,Boston,MA,MASSACHUSETTS,"US New England",10-K,2023-11-21,,"ANALOG DEVICES INC",6281,"=""ADI""","ONE ANALOG WAY",,WILMINGTON,MA,MASSACHUSETTS,"US New England",,,"=""3674""","Semiconductors and Related Devices",334413,"Semiconductor and Related Device Manufacturing",34,157,10/31/23,"78,076,846,080",10/28/23,"12,305,539,000","3,314,579,000","-2,659,969,000","48,794,478,000"
35753,"Research and development expenses","Evaluation of Research and Development Costs",529576,12/31/23,03/11/24,4,"KPMG LLP",,,,"San Diego",CA,CALIFORNIA,"US West",10-K,2024-03-11,,"ANAPTYSBIO, INC",1370053,"=""ANAB""","10770 WATERIDGE CIRCLE, SUITE 210",,"SAN DIEGO",CA,CALIFORNIA,"US West",,,"=""2834""","Pharmaceutical Preparations",325412,"Pharmaceutical Preparation Manufacturing",34,21,12/31/23,"569,707,712",12/31/23,"17,157,000","-163,619,000",,"452,389,000"
33407,Goodwill,"Goodwill—GSM and FSI Reporting Units—Refer to Notes 1 and 16 to the consolidated financial statements",525345,12/31/23,02/21/24,3,"Deloitte & Touche LLP",,,,Cleveland,OH,OHIO,"US Midwest",10-K,2024-02-21,,"Andersons, Inc.",821026,"=""ANDE""","1947 BRIARFIELD BOULEVARD",,MAUMEE,OH,OHIO,"US Midwest",,,"=""5150""","Wholesale-Farm Product Raw Materials",493130,"Farm Product Warehousing and Storage",34,58,01/02/24,"1,945,483,776",12/31/23,"14,750,112,000","101,190,000","1,069,464,000","3,855,007,000"
36689,"Goodwill and intangible assets","Intangible Assets with Indefinite Useful Life (Distribution rights) and Goodwill Impairment Assessment",531346,12/31/23,03/26/24,1,"PricewaterhouseCoopers LLP",93,"PricewaterhouseCoopers Consultores Auditores y Compania Limitada",1364,Santiago,F3,CHILE,Foreign,20-F,2024-03-27,,"ANDINA BOTTLING CO INC",925261,"=""AKO.A""","AVENIDA EL GOLF 40, PISO 4","LAS CONDES",SANTIAGO,F3,CHILE,Foreign,,,"=""2086""","Bottled and Canned Soft Drinks and Carbonated Waters",312111,"Soft Drink Manufacturing",34,12,01/02/24,"5,632,142,848",12/31/23,"2,998,376,000","199,833,000","78,165,000","3,345,438,000"
36084,"Other investments","Assessment of the valuation of residential mortgage loans at fair value",530218,12/31/23,03/15/24,4,"KPMG LLP",,,,Atlanta,GA,GEORGIA,"US Southeast",10-K,2024-03-15,,"Angel Oak Mortgage REIT, Inc.",1766478,"=""AOMD""","3344 PEACHTREE ROAD NE","SUITE 1725",ATLANTA,GA,GEORGIA,"US Southeast",,,"=""6500""","Real Estate",531390,"Other Activities Related to Real Estate",34,11,12/31/23,"264,631,904",12/31/23,"54,864,000","33,714,000",,"2,308,011,000"
34939,"Revenue from customer contracts","Revenue Processed By Highly Automated Proprietary Systems - Leads and Services",527618,12/31/23,02/29/24,2,"Ernst & Young LLP",,,,"New York",NY,"NEW YORK","US Mid Atlantic",10-K,2024-02-29,,"Angi Inc.",1705110,"=""ANGI""","555 WEST 18TH STREET",,"NEW YORK",NY,"NEW YORK","US Mid Atlantic",,,"=""7310""",Services-Advertising,541870,"Advertising Material Distribution Services",34,2,01/02/24,"204,326,400",12/31/23,"1,358,748,000","-40,940,000","-16,053,000","1,856,215,000"
30850,Inventory,"Inventories – Excess Quantities and Obsolescence — Refer to Notes 1 & 6",515559,05/31/23,08/03/23,3,"Deloitte & Touche LLP",,,,Boston,MA,MASSACHUSETTS,"US New England",10-K,2023-08-03,,"ANGIODYNAMICS INC",1275187,"=""ANGO""","14 PLAZA DRIVE",,LATHAM,NY,"NEW YORK","US Mid Atlantic",,,"=""3841""","Surgical and Medical Instruments and Apparatus",334510,"Electromedical and Electrotherapeutic Apparatus Manufacturing",34,9,05/31/23,"374,724,064",05/31/23,"338,752,000","-52,442,000","107,914,000","532,637,000"
30851,Goodwill,"Valuation of Goodwill for the Med Device Reporting Unit - Refer to Notes 1 & 9",515559,05/31/23,08/03/23,3,"Deloitte & Touche LLP",,,,Boston,MA,MASSACHUSETTS,"US New England",10-K,2023-08-03,,"ANGIODYNAMICS INC",1275187,"=""ANGO""","14 PLAZA DRIVE",,LATHAM,NY,"NEW YORK","US Mid Atlantic",,,"=""3841""","Surgical and Medical Instruments and Apparatus",334510,"Electromedical and Electrotherapeutic Apparatus Manufacturing",34,9,05/31/23,"374,724,064",05/31/23,"338,752,000","-52,442,000","107,914,000","532,637,000"
37847,"Other intangible assets","Assessment of impairment and impairment reversals for tangible, intangible and right of use assets",534418,12/31/23,04/25/24,1,"PricewaterhouseCoopers LLP",116,"PricewaterhouseCoopers Incorporated",1308,Johannesburg,T3,"SOUTH AFRICA",Foreign,20-F,2024-04-25,,"AngloGold Ashanti PLC",1973832,"=""AU""","THIRD FLOOR, HOBHOUSE COURT","SUFFOLK STREET",LONDON,X0,"UNITED KINGDOM",Foreign,,,"=""1040""","Metal Mining",212221,"Gold Ore Mining",34,,,"7,844,751,009",12/31/23,"4,582,000,000","-222,000,000","3,633,000,000","8,175,000,000"
37848,"Asset retirement and environmental obligations","Environmental rehabilitation provisions",534418,12/31/23,04/25/24,1,"PricewaterhouseCoopers LLP",116,"PricewaterhouseCoopers Incorporated",1308,Johannesburg,T3,"SOUTH AFRICA",Foreign,20-F,2024-04-25,,"AngloGold Ashanti PLC",1973832,"=""AU""","THIRD FLOOR, HOBHOUSE COURT","SUFFOLK STREET",LONDON,X0,"UNITED KINGDOM",Foreign,,,"=""1040""","Metal Mining",212221,"Gold Ore Mining",34,,,"7,844,751,009",12/31/23,"4,582,000,000","-222,000,000","3,633,000,000","8,175,000,000"
35751,"Goodwill and intangible assets","Impairment of goodwill and intangible assets with indefinite useful life",529654,12/31/23,03/08/24,1,"PricewaterhouseCoopers LLP",507,"PricewaterhouseCoopers Reviseurs d’Entreprises",1350,Diegem,C9,BELGIUM,Foreign,20-F,2024-03-11,,"Anheuser-Busch InBev SA/NV",1668717,"=""BUD""","BROUWERIJPLEIN 1",,LEUVEN,C9,BELGIUM,Foreign,,,"=""2082""","Malt Beverages",312120,Breweries,34,64,01/02/24,"111,614,541,824",12/31/23,"59,380,000,000","6,889,000,000","-76,480,000,000","219,340,000,000"
35752,"Uncertain tax positions","Uncertain tax positions",529654,12/31/23,03/08/24,1,"PricewaterhouseCoopers LLP",507,"PricewaterhouseCoopers Reviseurs d’Entreprises",1350,Diegem,C9,BELGIUM,Foreign,20-F,2024-03-11,,"Anheuser-Busch InBev SA/NV",1668717,"=""BUD""","BROUWERIJPLEIN 1",,LEUVEN,C9,BELGIUM,Foreign,,,"=""2082""","Malt Beverages",312120,Breweries,34,64,01/02/24,"111,614,541,824",12/31/23,"59,380,000,000","6,889,000,000","-76,480,000,000","219,340,000,000"
36115,Inventory,"Reserve for Excess and Obsolete Inventories — Refer to Notes 2 and 4 to the financial statements",530307,12/31/23,03/15/24,3,"Deloitte & Touche LLP",,,,Boston,MA,MASSACHUSETTS,"US New England",10-K,2024-03-15,,"Anika Therapeutics, Inc.",898437,"=""ANIK""","32 WIGGINS AVENUE",,BEDFORD,MA,MASSACHUSETTS,"US New England",,,"=""3841""","Surgical and Medical Instruments and Apparatus",325414,"Biological Product (except Diagnostic) Manufacturing",34,23,12/31/23,"332,195,584",12/31/23,"166,662,000","-82,667,000","200,068,000","270,632,000"
36116,"Other intangible assets","Fair Value of Intangible Assets within the Arthrosurface and Parcus Asset Groups — Refer to Notes 2 and 6 to the financial statements",530307,12/31/23,03/15/24,3,"Deloitte & Touche LLP",,,,Boston,MA,MASSACHUSETTS,"US New England",10-K,2024-03-15,,"Anika Therapeutics, Inc.",898437,"=""ANIK""","32 WIGGINS AVENUE",,BEDFORD,MA,MASSACHUSETTS,"US New England",,,"=""3841""","Surgical and Medical Instruments and Apparatus",325414,"Biological Product (except Diagnostic) Manufacturing",34,23,12/31/23,"332,195,584",12/31/23,"166,662,000","-82,667,000","200,068,000","270,632,000"
32835,"Other investments","Valuation of mortgage servicing rights",524744,12/31/23,02/15/24,2,"Ernst & Young LLP",,,,"New York",NY,"NEW YORK","US Mid Atlantic",10-K,2024-02-15,,"ANNALY CAPITAL MANAGEMENT INC",1043219,"=""NLY""","1211 AVENUE OF THE AMERICAS",,"NEW YORK",NY,"NEW YORK","US Mid Atlantic",,,"=""6798""","Real Estate Investment Trusts",525990,"Other Financial Vehicles",34,19,01/02/24,"9,631,733,760",12/31/23,"-1,436,470,000","-1,643,171,000","11,243,687,000","93,227,236,000"
36649,"Other debt","Pre-funded warrants",531157,12/31/23,03/26/24,4,"KPMG LLP",,,,"San Francisco",CA,CALIFORNIA,"US West",10-K,2024-03-26,,"Annexon, Inc.",1528115,"=""ANNX""","1400 SIERRA POINT PARKWAY","BLDG C, SUITE 200",BRISBANE,CA,CALIFORNIA,"US West",,,"=""2834""","Pharmaceutical Preparations",325412,"Pharmaceutical Preparation Manufacturing",34,5,12/31/23,"355,795,712",12/31/23,,"-134,237,000",,"297,674,000"
33309,"Revenue from customer contracts","Revenue—Time-Based Subscription Lease Licenses—Refer to Notes 2 and 3 to the financial statements",525207,12/31/23,02/21/24,3,"Deloitte & Touche LLP",,,,Pittsburgh,PA,PENNSYLVANIA,"US Mid Atlantic",10-K,2024-02-21,,"ANSYS INC",1013462,"=""ANSS""","2600 ANSYS DRIVE, SOUTHPOINTE",,CANONSBURG,PA,PENNSYLVANIA,"US Mid Atlantic",,,"=""7372""","Prepackaged Software",511210,"Software Publishers",34,363,12/31/23,"31,536,398,336",12/31/23,"2,269,949,000","500,412,000","749,073,000","7,322,875,000"
32746,"Long-lived assets","Evaluation of impairment triggering events for long-lived assets",524654,12/31/23,02/14/24,4,"KPMG LLP",,,,Denver,CO,COLORADO,"US West",10-K,2024-02-14,,"Antero Midstream Corp",1623925,"=""AM""","1615 WYNKOOP STREET",,DENVER,CO,COLORADO,"US West",,,"=""4922""","Natural Gas Transmission",486210,"Pipeline Transportation of Natural Gas",34,13,12/31/23,"5,995,567,616",12/31/23,"1,041,771,000","371,786,000","936,300,000","5,737,618,000"
32760,"Proven and unproven reserves","Estimated oil and gas reserves impact on depletion expense related to proved oil and gas properties",524648,12/31/23,02/14/24,4,"KPMG LLP",,,,Denver,CO,COLORADO,"US West",10-K,2024-02-14,,"ANTERO RESOURCES Corp",1433270,"=""AR""","1615 WYNKOOP STREET",,DENVER,CO,COLORADO,"US West",,,"=""1311""","Crude Petroleum and Natural Gas",211111,"Crude Petroleum and Natural Gas Extraction",34,23,12/31/23,"6,884,378,112",12/31/23,"4,681,972,000","242,919,000",,"13,619,414,000"
33252,Goodwill,"Annual Goodwill Impairment Assessments—Cartus Reporting Unit",525088,12/31/23,02/20/24,1,"PricewaterhouseCoopers LLP",,,,"Florham Park",NJ,"NEW JERSEY","US Mid Atlantic",10-K,2024-02-20,,"Anywhere Real Estate Group LLC",1355001,,"175 PARK AVENUE",,MADISON,NJ,"NEW JERSEY","US Mid Atlantic",1398987,"Anywhere Real Estate Inc.","=""6531""","Real Estate Agents and Managers",531210,"Offices of Real Estate Agents and Brokers",34,,,,12/31/23,"5,636,000,000","-97,000,000","-2,420,000,000","5,839,000,000"
33253,"Other intangible assets","Annual Indefinite-Lived Asset Impairment Assessment—Franchise Trademarks Intangible Asset",525088,12/31/23,02/20/24,1,"PricewaterhouseCoopers LLP",,,,"Florham Park",NJ,"NEW JERSEY","US Mid Atlantic",10-K,2024-02-20,,"Anywhere Real Estate Group LLC",1355001,,"175 PARK AVENUE",,MADISON,NJ,"NEW JERSEY","US Mid Atlantic",1398987,"Anywhere Real Estate Inc.","=""6531""","Real Estate Agents and Managers",531210,"Offices of Real Estate Agents and Brokers",34,,,,12/31/23,"5,636,000,000","-97,000,000","-2,420,000,000","5,839,000,000"
33128,Goodwill,"Annual Goodwill Impairment Assessments—Cartus Reporting Unit",525097,12/31/23,02/20/24,1,"PricewaterhouseCoopers LLP",,,,"Florham Park",NJ,"NEW JERSEY","US Mid Atlantic",10-K,2024-02-20,,"Anywhere Real Estate Inc.",1398987,"=""HOUS""","175 PARK AVENUE",,MADISON,NJ,"NEW JERSEY","US Mid Atlantic",,,"=""6531""","Real Estate Agents and Managers",531210,"Offices of Real Estate Agents and Brokers",34,8,01/02/24,"871,749,312",12/31/23,"5,636,000,000","-97,000,000","-2,420,000,000","5,839,000,000"
33129,"Other intangible assets","Annual Indefinite-Lived Asset Impairment Assessment—Franchise Trademarks Intangible Asset",525097,12/31/23,02/20/24,1,"PricewaterhouseCoopers LLP",,,,"Florham Park",NJ,"NEW JERSEY","US Mid Atlantic",10-K,2024-02-20,,"Anywhere Real Estate Inc.",1398987,"=""HOUS""","175 PARK AVENUE",,MADISON,NJ,"NEW JERSEY","US Mid Atlantic",,,"=""6531""","Real Estate Agents and Managers",531210,"Offices of Real Estate Agents and Brokers",34,8,01/02/24,"871,749,312",12/31/23,"5,636,000,000","-97,000,000","-2,420,000,000","5,839,000,000"
33023,"Deferred income taxes","Realizability of Deferred Tax Assets",524949,12/31/23,02/16/24,2,"Ernst & Young LLP",,,,Chicago,IL,ILLINOIS,"US Midwest",10-K,2024-02-16,,"Aon plc",315293,"=""AON""","15 GEORGES QUAY",,"DUBLIN 2",L2,IRELAND,Foreign,,,"=""6411""","Insurance Agents, Brokers, and Service",524210,"Insurance Agencies and Brokerages",34,288,01/02/24,"57,666,310,144",12/31/23,"13,376,000,000","2,564,000,000","-9,474,000,000","33,959,000,000"
33454,"Proven and unproven reserves","Depreciation, depletion and amortization of property and equipment",525662,12/31/23,02/22/24,2,"Ernst & Young LLP",,,,Houston,TX,TEXAS,"US Southwest",10-K,2024-02-22,,"APA Corp",1841666,"=""APA""","2000 W SAM HOUSTON PKWY S","SUITE 200",HOUSTON,TX,TEXAS,"US Southwest",,,"=""1311""","Crude Petroleum and Natural Gas",211111,"Crude Petroleum and Natural Gas Extraction",34,36,12/31/23,"10,892,303,360",12/31/23,"8,279,000,000","2,855,000,000",,"15,244,000,000"
33455,"Asset retirement and environmental obligations","Accounting for asset retirement obligation for the North Sea segment",525662,12/31/23,02/22/24,2,"Ernst & Young LLP",,,,Houston,TX,TEXAS,"US Southwest",10-K,2024-02-22,,"APA Corp",1841666,"=""APA""","2000 W SAM HOUSTON PKWY S","SUITE 200",HOUSTON,TX,TEXAS,"US Southwest",,,"=""1311""","Crude Petroleum and Natural Gas",211111,"Crude Petroleum and Natural Gas Extraction",34,36,12/31/23,"10,892,303,360",12/31/23,"8,279,000,000","2,855,000,000",,"15,244,000,000"
33456,"Other contingent liabilities","Accounting for decommissioning contingency for sold Gulf of Mexico properties",525662,12/31/23,02/22/24,2,"Ernst & Young LLP",,,,Houston,TX,TEXAS,"US Southwest",10-K,2024-02-22,,"APA Corp",1841666,"=""APA""","2000 W SAM HOUSTON PKWY S","SUITE 200",HOUSTON,TX,TEXAS,"US Southwest",,,"=""1311""","Crude Petroleum and Natural Gas",211111,"Crude Petroleum and Natural Gas Extraction",34,36,12/31/23,"10,892,303,360",12/31/23,"8,279,000,000","2,855,000,000",,"15,244,000,000"
33610,"Proven and unproven reserves","Depreciation, depletion and amortization of property and equipment",525630,12/31/23,02/22/24,2,"Ernst & Young LLP",,,,Houston,TX,TEXAS,"US Southwest",10-K,2024-02-22,,"APACHE CORP",6769,,"2000 W SAM HOUSTON PKWY S","SUITE 200",HOUSTON,TX,TEXAS,"US Southwest",1841666,"APA Corp","=""1311""","Crude Petroleum and Natural Gas",211111,"Crude Petroleum and Natural Gas Extraction",34,,,,12/31/23,"7,973,000,000","2,526,000,000",,"16,944,000,000"
33611,"Asset retirement and environmental obligations","Accounting for asset retirement obligation for the North Sea segment",525630,12/31/23,02/22/24,2,"Ernst & Young LLP",,,,Houston,TX,TEXAS,"US Southwest",10-K,2024-02-22,,"APACHE CORP",6769,,"2000 W SAM HOUSTON PKWY S","SUITE 200",HOUSTON,TX,TEXAS,"US Southwest",1841666,"APA Corp","=""1311""","Crude Petroleum and Natural Gas",211111,"Crude Petroleum and Natural Gas Extraction",34,,,,12/31/23,"7,973,000,000","2,526,000,000",,"16,944,000,000"
33612,"Other contingent liabilities","Accounting for decommissioning contingency for sold Gulf of Mexico properties",525630,12/31/23,02/22/24,2,"Ernst & Young LLP",,,,Houston,TX,TEXAS,"US Southwest",10-K,2024-02-22,,"APACHE CORP",6769,,"2000 W SAM HOUSTON PKWY S","SUITE 200",HOUSTON,TX,TEXAS,"US Southwest",1841666,"APA Corp","=""1311""","Crude Petroleum and Natural Gas",211111,"Crude Petroleum and Natural Gas Extraction",34,,,,12/31/23,"7,973,000,000","2,526,000,000",,"16,944,000,000"
33073,"Real estate investments","Real Estate— Refer to Notes 2 and 3 to the financial statements",524981,12/31/23,02/16/24,3,"Deloitte & Touche LLP",,,,Denver,CO,COLORADO,"US West",10-K,2024-02-16,,"Apartment Income REIT Corp.",1820877,,"4582 S. ULSTER STREET, SUITE 1700",,DENVER,CO,COLORADO,"US West",,,"=""6798""","Real Estate Investment Trusts",525990,"Other Financial Vehicles",34,35,01/02/24,"5,132,985,344",12/31/23,"820,036,000","635,101,000","2,396,750,000","6,134,752,000"
33077,"Real estate investments","Real Estate— Refer to Notes 2 and 3 to the financial statements",524985,12/31/23,02/16/24,3,"Deloitte & Touche LLP",,,,Denver,CO,COLORADO,"US West",10-K,2024-02-16,,"Apartment Income REIT, L.P.",926660,,"345 PARK AVENUE",,"NEW YORK",NY,"NEW YORK","US Mid Atlantic",922864,"APARTMENT INVESTMENT & MANAGEMENT CO","=""6513""","Operators of Apartment Buildings",531110,"Lessors of Residential Buildings and Dwellings",34,,,,12/31/23,"820,036,000","684,102,000","2,681,201,000","6,134,752,000"
34132,"Other investments","Impairment of mezzanine investment",526391,12/31/23,02/26/24,2,"Ernst & Young LLP",,,,Denver,CO,COLORADO,"US West",10-K,2024-02-26,,"APARTMENT INVESTMENT & MANAGEMENT CO",922864,"=""AIV""","4582 SOUTH ULSTER STREET","SUITE 1450",DENVER,CO,COLORADO,"US West",,,"=""6798""","Real Estate Investment Trusts",525990,"Other Financial Vehicles",34,8,12/31/23,"1,100,710,912",12/31/23,"186,995,000","-166,196,000",,"2,089,475,000"
34239,"Research and development expenses","Accounting For New Customer Contracts Under ASC 606 — Refer to Notes 2 and 3 to the financial statements",526751,12/31/23,02/27/24,3,"Deloitte & Touche LLP",,,,Boston,MA,MASSACHUSETTS,"US New England",10-K,2024-02-27,,"Apellis Pharmaceuticals, Inc.",1492422,"=""APLS""","100 FIFTH AVENUE",,WALTHAM,MA,MASSACHUSETTS,"US New England",,,"=""2834""","Pharmaceutical Preparations",325412,"Pharmaceutical Preparation Manufacturing",34,60,12/31/23,"7,156,622,336",12/31/23,"396,591,000","-528,628,000",,"788,730,000"
35000,"Revenue from customer contracts","Accounting For New Customer Contracts Under ASC 606 — Refer to Notes 2 and 3 to the financial statements",527526,12/31/23,02/27/24,3,"Deloitte & Touche LLP",,,,Boston,MA,MASSACHUSETTS,"US New England",10-K/A,2024-02-29,,"Apellis Pharmaceuticals, Inc.",1492422,"=""APLS""","100 FIFTH AVENUE",,WALTHAM,MA,MASSACHUSETTS,"US New England",,,"=""2834""","Pharmaceutical Preparations",325412,"Pharmaceutical Preparation Manufacturing",34,60,12/31/23,"7,156,622,336",12/31/23,"396,591,000","-528,628,000",,"788,730,000"
34662,"Revenue from customer contracts","Total estimated costs for certain fixed price projects recognized over time",527043,12/31/23,02/28/24,4,"KPMG LLP",,,,Minneapolis,MN,MINNESOTA,"US Midwest",10-K,2024-02-28,,"APi Group Corp",1796209,"=""APG""","C/O API GROUP, INC.","1100 OLD HIGHWAY 8 NW","NEW BRIGHTON",MN,MINNESOTA,"US Midwest",,,"=""7340""","Services-To Dwellings & Other Buildings",238910,"Site Preparation Contractors",34,33,01/02/24,"7,745,185,280",12/31/23,"6,928,000,000","153,000,000","-1,212,000,000","7,590,000,000"
29336,"Revenue from customer contracts","Net Sales — Revenue Recognition for Long-Term Contracts in the Architectural Services Segment — Refer to Notes 1, 2, and 15 to the consolidated financial statements",509553,02/25/23,04/21/23,3,"Deloitte & Touche LLP",,,,Minneapolis,MN,MINNESOTA,"US Midwest",10-K,2023-04-21,,"APOGEE ENTERPRISES, INC.",6845,"=""APOG""","4400 WEST 78TH STREET","SUITE 520",MINNEAPOLIS,MN,MINNESOTA,"US Midwest",,,"=""3231""","Glass Products, Made of Purchased Glass",327215,"Glass Product Manufacturing Made of Purchased Glass",34,46,02/28/23,"1,016,983,936",02/25/23,"1,440,696,000","104,107,000","200,007,000","915,365,000"
29337,"Goodwill and intangible assets","Goodwill and Intangible Assets — Window and Wall Systems Reporting Unit and EFCO Trade Name Indefinite-Lived Intangible Asset — Refer to Notes 1 and 6 to the consolidated financial statements",509553,02/25/23,04/21/23,3,"Deloitte & Touche LLP",,,,Minneapolis,MN,MINNESOTA,"US Midwest",10-K,2023-04-21,,"APOGEE ENTERPRISES, INC.",6845,"=""APOG""","4400 WEST 78TH STREET","SUITE 520",MINNEAPOLIS,MN,MINNESOTA,"US Midwest",,,"=""3231""","Glass Products, Made of Purchased Glass",327215,"Glass Product Manufacturing Made of Purchased Glass",34,46,02/28/23,"1,016,983,936",02/25/23,"1,440,696,000","104,107,000","200,007,000","915,365,000"
32369,"Allowance for credit losses","Current Expected Credit Losses (“CECL”) Allowance—Estimation of Economic Conditions—Refer to Notes 2 and 4 to the Financial Statements",524067,12/31/23,02/06/24,3,"Deloitte & Touche LLP",,,,"New York",NY,"NEW YORK","US Mid Atlantic",10-K,2024-02-06,,"Apollo Commercial Real Estate Finance, Inc.",1467760,"=""ARI""","C/O APOLLO GLOBAL MANAGEMENT, LLC","9 WEST 57TH STREET, 43RD FLOOR","NEW YORK",NY,"NEW YORK","US Mid Atlantic",,,"=""6798""","Real Estate Investment Trusts",525990,"Other Financial Vehicles",34,12,12/31/23,"1,659,550,080",12/31/23,"92,419,000","58,127,000",,"9,296,730,000"
32370,"Allowance for credit losses","CECL Allowance—Estimation of Fair Value of Underlying Collateral of Loans Exhibiting Signs of Financial Difficulty — Refer to Notes 2 and 4 to the financial statements",524067,12/31/23,02/06/24,3,"Deloitte & Touche LLP",,,,"New York",NY,"NEW YORK","US Mid Atlantic",10-K,2024-02-06,,"Apollo Commercial Real Estate Finance, Inc.",1467760,"=""ARI""","C/O APOLLO GLOBAL MANAGEMENT, LLC","9 WEST 57TH STREET, 43RD FLOOR","NEW YORK",NY,"NEW YORK","US Mid Atlantic",,,"=""6798""","Real Estate Investment Trusts",525990,"Other Financial Vehicles",34,12,12/31/23,"1,659,550,080",12/31/23,"92,419,000","58,127,000",,"9,296,730,000"
36019,"Other investments","Fair Value of Investments — Refer to Notes 2 and 4 to the Financial Statements",530097,12/31/23,03/14/24,3,"Deloitte & Touche LLP",,,,"New York",NY,"NEW YORK","US Mid Atlantic",10-K,2024-03-14,,"Apollo Debt Solutions BDC",1837532,,"9 WEST 57TH STREET",,"NEW YORK",NY,"NEW YORK","US Mid Atlantic",,,,,525990,"Other Financial Vehicles",34,,,,12/31/23,"586,832,000","309,330,000","4,123,696,000","7,153,867,000"
36120,"Other investments","Fair Value of Investments — Refer to Notes 2 and 4 to the Financial Statements",530357,12/31/23,03/14/24,3,"Deloitte & Touche LLP",,,,"New York",NY,"NEW YORK","US Mid Atlantic",424B3,2024-03-15,,"Apollo Debt Solutions BDC",1837532,,"9 WEST 57TH STREET",,"NEW YORK",NY,"NEW YORK","US Mid Atlantic",,,,,525990,"Other Financial Vehicles",34,,,,12/31/23,"586,832,000","309,330,000","4,123,696,000","7,153,867,000"
37317,"Other investments","Fair Value of Investments — Refer to Notes 2 and 4 to the Financial Statements",532513,12/31/23,03/14/24,3,"Deloitte & Touche LLP",,,,"New York",NY,"NEW YORK","US Mid Atlantic",N-2,2024-04-03,,"Apollo Debt Solutions BDC",1837532,,"9 WEST 57TH STREET",,"NEW YORK",NY,"NEW YORK","US Mid Atlantic",,,,,525990,"Other Financial Vehicles",34,,,,12/31/23,"586,832,000","309,330,000","4,123,696,000","7,153,867,000"
34302,"Other investments","Performance Allocations— Refer to Note 2, Summary of Significant Accounting Policies",526668,12/31/23,02/27/24,3,"Deloitte & Touche LLP",,,,"New York",NY,"NEW YORK","US Mid Atlantic",10-K,2024-02-27,,"Apollo Global Management, Inc.",1858681,"=""APO""","9 WEST 57TH STREET, 42ND FLOOR",,"NEW YORK",NY,"NEW YORK","US Mid Atlantic",,,"=""6282""","Investment Advice",0,,34,91,01/02/24,"51,834,822,656",12/31/23,"16,228,000,000","5,047,000,000","9,727,000,000","313,488,000,000"
34303,"Other investments","Valuation of Certain Structured Level 3 Asset-Backed Securities - Refer to Note 5, Investments, Note 8, Fair Value, and Note 19, Related Parties",526668,12/31/23,02/27/24,3,"Deloitte & Touche LLP",,,,"New York",NY,"NEW YORK","US Mid Atlantic",10-K,2024-02-27,,"Apollo Global Management, Inc.",1858681,"=""APO""","9 WEST 57TH STREET, 42ND FLOOR",,"NEW YORK",NY,"NEW YORK","US Mid Atlantic",,,"=""6282""","Investment Advice",0,,34,91,01/02/24,"51,834,822,656",12/31/23,"16,228,000,000","5,047,000,000","9,727,000,000","313,488,000,000"
34304,"Insurance contract liabilities","Adoption of Long Duration Targeted Improvements (LDTI) - Refer to Note 2, Summary of Significant Accounting Policies, and Note 3, Adoption of Accounting Pronouncement",526668,12/31/23,02/27/24,3,"Deloitte & Touche LLP",,,,"New York",NY,"NEW YORK","US Mid Atlantic",10-K,2024-02-27,,"Apollo Global Management, Inc.",1858681,"=""APO""","9 WEST 57TH STREET, 42ND FLOOR",,"NEW YORK",NY,"NEW YORK","US Mid Atlantic",,,"=""6282""","Investment Advice",0,,34,91,01/02/24,"51,834,822,656",12/31/23,"16,228,000,000","5,047,000,000","9,727,000,000","313,488,000,000"
34305,"Insurance contract liabilities","Certain Assumptions Used in the Valuation of Future Policy Benefits, Market Risk Benefits, and Interest Sensitive Contract Liabilities - Refer to Note 2, Summary of Significant Accounting Policies, Note 8, Fair Value, and Note 12, Long-duration Contracts",526668,12/31/23,02/27/24,3,"Deloitte & Touche LLP",,,,"New York",NY,"NEW YORK","US Mid Atlantic",10-K,2024-02-27,,"Apollo Global Management, Inc.",1858681,"=""APO""","9 WEST 57TH STREET, 42ND FLOOR",,"NEW YORK",NY,"NEW YORK","US Mid Atlantic",,,"=""6282""","Investment Advice",0,,34,91,01/02/24,"51,834,822,656",12/31/23,"16,228,000,000","5,047,000,000","9,727,000,000","313,488,000,000"
34175,"Regulatory assets and liabilities","Accounting for the Effects of Cost-Based Regulation",526462,12/31/23,02/26/24,1,"PricewaterhouseCoopers LLP",,,,Columbus,OH,OHIO,"US Midwest",10-K,2024-02-26,,"APPALACHIAN POWER CO",6879,,"1 RIVERSIDE PLAZA",,COLUMBUS,OH,OHIO,"US Midwest",4904,"AMERICAN ELECTRIC POWER CO INC","=""4911""","Electric Services",221122,"Electric Power Distribution",34,,,,12/31/23,"3,720,700,000","294,400,000",,"15,711,900,000"
32302,"Revenue from customer contracts","Revenue Recognition",523806,12/31/23,02/01/24,1,"PricewaterhouseCoopers LLP",,,,"Los Angeles",CA,CALIFORNIA,"US West",10-K,2024-02-01,,"APPFOLIO INC",1433195,"=""APPF""","70 CASTILIAN DRIVE",,"SANTA BARBARA",CA,CALIFORNIA,"US West",,,"=""7372""","Prepackaged Software",511210,"Software Publishers",34,169,01/02/24,"3,662,667,264",12/31/23,"620,445,000","2,702,000","217,333,000","408,889,000"
33751,"Real estate investments","Investments in Real Estate – Impairment Analysis",525473,12/31/23,02/22/24,2,"Ernst & Young LLP",,,,Richmond,VA,VIRGINIA,"US Mid Atlantic",10-K,2024-02-22,,"Apple Hospitality REIT, Inc.",1418121,"=""APLE""","814 EAST MAIN STREET",,RICHMOND,VA,VIRGINIA,"US Mid Atlantic",,,"=""6798""","Real Estate Investment Trusts",525990,"Other Financial Vehicles",34,17,12/31/23,"4,011,572,992",12/31/23,"1,343,800,000","177,489,000",,"4,937,298,000"
31548,"Uncertain tax positions","Uncertain Tax Positions",519307,09/30/23,11/02/23,2,"Ernst & Young LLP",,,,"San Jose",CA,CALIFORNIA,"US West",10-K,2023-11-03,,"Apple Inc.",320193,"=""AAPL""","ONE APPLE PARK WAY",,CUPERTINO,CA,CALIFORNIA,"US West",,,"=""3571""","Electronic Computers",334111,"Electronic Computer Manufacturing",34,171,09/30/23,"2,662,325,813,248",09/30/23,"383,285,000,000","96,995,000,000",,"352,583,000,000"
30913,Goodwill,"Goodwill - Engineered Solutions Segment - Refer to Notes 1 and 5 to the financial statements",515875,06/30/23,08/11/23,3,"Deloitte & Touche LLP",,,,Cleveland,OH,OHIO,"US Midwest",10-K,2023-08-11,,"APPLIED INDUSTRIAL TECHNOLOGIES INC",109563,"=""AIT""","ONE APPLIED PLAZA",,CLEVELAND,OH,OHIO,"US Midwest",,,"=""5080""","Wholesale-Machinery, Equipment & Supplies",423830,"Industrial Machinery and Equipment Merchant Wholesalers",34,145,06/30/23,"5,598,693,376",06/30/23,"4,412,794,000","346,739,000","644,470,000","2,743,332,000"
31956,Inventory,"Evaluation of net realizable value adjustments to inventories for excess or obsolescence",521272,10/29/23,12/15/23,4,"KPMG LLP",,,,"Santa Clara",CA,CALIFORNIA,"US West",10-K,2023-12-15,,"APPLIED MATERIALS INC /DE",6951,"=""AMAT""","3050 BOWERS AVE",,"SANTA CLARA",CA,CALIFORNIA,"US West",,,"=""3674""","Semiconductors and Related Devices",333295,"Semiconductor Machinery Manufacturing",34,132,10/31/23,"110,715,256,832",10/29/23,"26,517,000,000","6,856,000,000","12,323,000,000","30,729,000,000"
34096,"Deferred and stock-based compensation","Performance-based Restricted Stock Units - Refer to Note 11 to the financial statements",526376,12/31/23,02/26/24,3,"Deloitte & Touche LLP",,,,"San Jose",CA,CALIFORNIA,"US West",10-K,2024-02-26,,"AppLovin Corp",1751008,"=""APP""","1100 PAGE MILL RD",,"PALO ALTO",CA,CALIFORNIA,"US West",,,"=""7370""","Services-Computer Programming, Data Processing, Etc.",541511,"Custom Computer Programming Services",34,39,01/02/24,"10,262,697,984",12/31/23,"3,283,087,000","356,711,000","-1,879,156,000","5,359,187,000"
32584,Goodwill,"Goodwill Impairment Assessment – Injectables and Active Material Science Solutions Reporting Units",524323,12/31/23,02/09/24,1,"PricewaterhouseCoopers LLP",,,,Chicago,IL,ILLINOIS,"US Midwest",10-K,2024-02-09,,"APTARGROUP, INC.",896622,"=""ATR""","265 EXCHANGE DRIVE","SUITE 301","CRYSTAL LAKE",IL,ILLINOIS,"US Midwest",,,"=""3089""","Plastics Products, NEC",326199,"All Other Plastics Product Manufacturing",34,124,12/31/23,"8,146,557,952",12/31/23,"3,487,450,000","284,487,000","1,060,195,000","4,451,890,000"
32585,"Revenue from customer contracts","Revenue Recognition – Product Sales",524323,12/31/23,02/09/24,1,"PricewaterhouseCoopers LLP",,,,Chicago,IL,ILLINOIS,"US Midwest",10-K,2024-02-09,,"APTARGROUP, INC.",896622,"=""ATR""","265 EXCHANGE DRIVE","SUITE 301","CRYSTAL LAKE",IL,ILLINOIS,"US Midwest",,,"=""3089""","Plastics Products, NEC",326199,"All Other Plastics Product Manufacturing",34,124,12/31/23,"8,146,557,952",12/31/23,"3,487,450,000","284,487,000","1,060,195,000","4,451,890,000"
32391,"Uncertain tax positions","Uncertain Tax Positions",524104,12/31/23,02/06/24,2,"Ernst & Young LLP",,,,Detroit,MI,MICHIGAN,"US Midwest",10-K,2024-02-06,,"Aptiv PLC",1521332,"=""APTV""","SPITALSTRASSE 5",,SCHAFFHAUSEN,V8,SWITZERLAND,Foreign,,,"=""3714""","Motor Vehicle Parts and Accessories",423120,"Motor Vehicle Supplies and New Parts Merchant Wholesalers",34,90,12/31/23,"25,034,872,832",12/31/23,"20,051,000,000","2,938,000,000","4,097,000,000","24,427,000,000"
32392,"Revenue from customer contracts","Revenue Recognition",524104,12/31/23,02/06/24,2,"Ernst & Young LLP",,,,Detroit,MI,MICHIGAN,"US Midwest",10-K,2024-02-06,,"Aptiv PLC",1521332,"=""APTV""","SPITALSTRASSE 5",,SCHAFFHAUSEN,V8,SWITZERLAND,Foreign,,,"=""3714""","Motor Vehicle Parts and Accessories",423120,"Motor Vehicle Supplies and New Parts Merchant Wholesalers",34,90,12/31/23,"25,034,872,832",12/31/23,"20,051,000,000","2,938,000,000","4,097,000,000","24,427,000,000"
36670,"Research and development expenses","Research and Development Prepaid and Accrued Costs",531147,12/31/23,03/26/24,4,"KPMG LLP",187,"KPMG LLP Chartered Accountants",85,Vaughan,A6,ONTARIO,Canada,10-K,2024-03-26,Yes,"Aptose Biosciences Inc.",882361,"=""APTOF""","66 WELLINGTON STREET WEST, SUITE 5300","TD BANK TOWER BOX 48",TORONTO,A6,ONTARIO,Canada,,,"=""2836""","Biological Products, Except Diagnostic Substances",325414,"Biological Product (except Diagnostic) Manufacturing",34,3,12/31/23,"20,173,602",12/31/23,,"-51,207,000",,"12,989,000"
37062,Inventory,"Inventory – Fish in Process – Refer to Notes 2 and 4 to the financial statements",532195,12/31/23,04/01/24,3,"Deloitte & Touche LLP",,,,Baltimore,MD,MARYLAND,"US Mid Atlantic",10-K,2024-04-01,Yes,"AQUABOUNTY TECHNOLOGIES INC",1603978,"=""AQB""","233 AYER ROAD SUITE 4","SUITE 4",HARVARD,MA,MASSACHUSETTS,"US New England",,,"=""0900""","Fishing, hunting, and trapping",112519,"Other Animal Aquaculture",34,3,12/31/23,"10,964,013",12/31/23,"2,472,659","-27,557,901","164,812,282","187,551,428"
35417,"Going concern","Evaluation of the Company’s ability to continue as a going concern",528268,12/31/23,03/05/24,4,"KPMG LLP",,,,"Short Hills",NJ,"NEW JERSEY","US Mid Atlantic",10-K,2024-03-05,,"Aquestive Therapeutics, Inc.",1398733,"=""AQST""","30 TECHNOLOGY DRIVE",,WARREN,NJ,"NEW JERSEY","US Mid Atlantic",,,"=""2834""","Pharmaceutical Preparations",325412,"Pharmaceutical Preparation Manufacturing",34,2,12/31/23,"138,436,832",12/31/23,"50,583,000","-7,870,000","-107,765,000","57,418,000"
31748,Goodwill,"Goodwill - FSS US Reporting Unit - Refer to Note 4 to the financial statements",520071,09/29/23,11/21/23,3,"Deloitte & Touche LLP",,,,Philadelphia,PA,PENNSYLVANIA,"US Mid Atlantic",10-K,2023-11-21,,Aramark,1584509,"=""ARMK""","2400 MARKET STREET",,PHILADELPHIA,PA,PENNSYLVANIA,"US Mid Atlantic",,,"=""5812""","Eating and Drinking Places",722310,"Food Service Contractors",34,35,09/27/23,"9,061,054,464",09/29/23,"18,853,857,000","674,108,000","-3,901,669,000","16,871,241,000"
37352,"Property, plant and equipment","Valuation of Biological Assets",532667,12/31/23,04/04/24,1,"PricewaterhouseCoopers LLP",93,"PricewaterhouseCoopers Consultores Auditores y Compania Limitada",1364,Santiago,F3,CHILE,Foreign,20-F,2024-04-05,,"ARAUCO & CONSTITUTION PULP INC",1004156,,"EL GOLF NO 150","14TH FL.",SANTIAGO,F3,CHILE,Foreign,,,"=""2611""","Pulp Mills",322110,"Pulp Mills",34,,,,12/31/23,"6,011,819,000","-358,527,000","7,886,707,000","17,910,364,000"
33244,"Other investments","Valuation of Mortgage Servicing Rights",525072,12/31/23,02/20/24,2,"Ernst & Young LLP",,,,"New York",NY,"NEW YORK","US Mid Atlantic",10-K,2024-02-20,,"ARBOR REALTY TRUST INC",1253986,"=""ABR""","333 EARLE OVINGTON BOULEVARD","SUITE 900",UNIONDALE,NY,"NEW YORK","US Mid Atlantic",,,"=""6798""","Real Estate Investment Trusts",525990,"Other Financial Vehicles",34,15,01/02/24,"2,833,179,648",12/31/23,"293,021,000","371,434,000","3,026,595,000","15,738,636,000"
33245,"Allowance for credit losses","Allowance for Credit Losses",525072,12/31/23,02/20/24,2,"Ernst & Young LLP",,,,"New York",NY,"NEW YORK","US Mid Atlantic",10-K,2024-02-20,,"ARBOR REALTY TRUST INC",1253986,"=""ABR""","333 EARLE OVINGTON BOULEVARD","SUITE 900",UNIONDALE,NY,"NEW YORK","US Mid Atlantic",,,"=""6798""","Real Estate Investment Trusts",525990,"Other Financial Vehicles",34,15,01/02/24,"2,833,179,648",12/31/23,"293,021,000","371,434,000","3,026,595,000","15,738,636,000"
35387,"Other contingent liabilities","Valuation of contingent consideration liability",528275,12/31/23,03/05/24,2,"Ernst & Young LLP",,,,Philadelphia,PA,PENNSYLVANIA,"US Mid Atlantic",10-K,2024-03-05,,"Arbutus Biopharma Corp",1447028,"=""ABUS""","701 VETERANS CIRCLE",,WARMINSTER,PA,PENNSYLVANIA,"US Mid Atlantic",,,"=""2834""","Pharmaceutical Preparations",541710,"Research and Development in the Physical, Engineering, and Life Sciences",34,3,01/02/24,"434,330,688",12/31/23,"18,141,000","-72,849,000",,"144,401,000"
36820,Inventory,"GoodWheat Inventory Valuation – Refer to Note 4 to the consolidated financial statements",531521,12/31/23,03/28/24,3,"Deloitte & Touche LLP",,,,Tempe,AZ,ARIZONA,"US Southwest",10-K,2024-03-28,Yes,"Arcadia Biosciences, Inc.",1469443,"=""RKDA""","5956 SHERRY LANE","SUITE 2000",DALLAS,TX,TEXAS,"US Southwest",,,"=""1311""","Crude Petroleum and Natural Gas",541710,"Research and Development in the Physical, Engineering, and Life Sciences",34,3,01/02/24,"3,231,081",12/31/23,"4,454,000","-13,981,000","12,802,000","19,705,000"
41537,Inventory,"GoodWheat Inventory Valuation – Refer to Note 4 to the consolidated financial statements",551535,12/31/23,03/28/24,3,"Deloitte & Touche LLP",,,,Tempe,AZ,ARIZONA,"US Southwest",S-4,2025-02-14,Yes,"Arcadia Biosciences, Inc.",1469443,"=""RKDA""","5956 SHERRY LANE","SUITE 2000",DALLAS,TX,TEXAS,"US Southwest",,,"=""1311""","Crude Petroleum and Natural Gas",541710,"Research and Development in the Physical, Engineering, and Life Sciences",34,3,01/02/24,"3,231,081",12/31/23,"4,454,000","-13,981,000","12,802,000","19,705,000"
34920,"Uncertain tax positions","Assessment of unrecognized tax benefits",527652,12/31/23,02/29/24,4,"KPMG LLP",,,,Philadelphia,PA,PENNSYLVANIA,"US Mid Atlantic",10-K,2024-02-29,,"Arcadium Lithium plc",1977303,,"SUITE 12, GATEWAY HUB","SHANNON AIRPORT HOUSE","SHANNON, CO. CLARE V14 E3 70",L2,IRELAND,Foreign,,,"=""2810""","Industrial Inorganic Chemicals",0,,34,7,12/31/23,"3,232,988,160",12/31/23,"882,500,000","330,100,000","1,610,100,000","3,230,100,000"
34921,"Business combinations","Evaluation of the fair value of mineral rights acquired",527652,12/31/23,02/29/24,4,"KPMG LLP",,,,Philadelphia,PA,PENNSYLVANIA,"US Mid Atlantic",10-K,2024-02-29,,"Arcadium Lithium plc",1977303,,"SUITE 12, GATEWAY HUB","SHANNON AIRPORT HOUSE","SHANNON, CO. CLARE V14 E3 70",L2,IRELAND,Foreign,,,"=""2810""","Industrial Inorganic Chemicals",0,,34,7,12/31/23,"3,232,988,160",12/31/23,"882,500,000","330,100,000","1,610,100,000","3,230,100,000"
33818,"Other contingent liabilities","Insurance reserves",526163,12/31/23,02/23/24,2,"Ernst & Young LLP",,,,Tulsa,OK,OKLAHOMA,"US Southwest",10-K,2024-02-23,,"ARCBEST CORP /DE/",894405,"=""ARCB""","8401 MCCLURE DRIVE",,"FORT SMITH",AR,ARKANSAS,"US Southeast",,,"=""4213""","Trucking, Except Local",484122,"General Freight Trucking, Long-Distance, Less Than Truckload",34,121,01/02/24,"2,864,505,856",12/31/23,"4,427,443,000","195,433,000","929,360,000","2,485,094,000"
34615,"Equity investments and joint ventures","Accounting for the Kite Collaboration Agreement",527127,12/31/23,02/28/24,2,"Ernst & Young LLP",,,,Tysons,VA,VIRGINIA,"US Mid Atlantic",10-K,2024-02-28,,"Arcellx, Inc.",1786205,"=""ACLX""","800 BRIDGE PARKWAY",,"REDWOOD CITY",CA,CALIFORNIA,"US West",,,"=""2836""","Biological Products, Except Diagnostic Substances",325414,"Biological Product (except Diagnostic) Manufacturing",34,56,01/02/24,"2,733,729,280",12/31/23,"110,319,000","-70,690,000",,"825,132,000"
43392,"Equity investments and joint ventures","Accounting for the Kite Collaboration Agreement",554065,12/31/23,02/28/24,2,"Ernst & Young LLP",,,,Tysons,VA,VIRGINIA,"US Mid Atlantic",10-K,2025-02-27,,"Arcellx, Inc.",1786205,"=""ACLX""","800 BRIDGE PARKWAY",,"REDWOOD CITY",CA,CALIFORNIA,"US West",,,"=""2836""","Biological Products, Except Diagnostic Substances",325414,"Biological Product (except Diagnostic) Manufacturing",34,56,01/02/24,"2,733,729,280",12/31/23,"110,319,000","-70,690,000",,"825,132,000"
34723,"Long-lived assets","Impairment of Goodwill, Intangible Assets and Property, Plant and Equipment",526995,12/31/23,02/28/24,2,"Ernst & Young LLP",226,"Ernst & Young SA",1367,Luxembourg,N4,LUXEMBOURG,Foreign,20-F,2024-02-28,,ArcelorMittal,1243429,"=""MT""","24-26, BOULEVARD D?AVRANCHES","L-1160 LUXEMBOURG",LUXEMBOURG,N4,LUXEMBOURG,Foreign,,,"=""3312""","Steel Works, Blast Furnaces (Including Coke Ovens), and Rolling Mills",331111,"Iron and Steel Mills",34,28,01/02/24,"22,726,635,520",12/31/23,"68,275,000,000","1,022,000,000","48,859,000,000","93,917,000,000"
34724,"Deferred income taxes","Recoverability of Deferred Tax Assets (“DTAs”)",526995,12/31/23,02/28/24,2,"Ernst & Young LLP",226,"Ernst & Young SA",1367,Luxembourg,N4,LUXEMBOURG,Foreign,20-F,2024-02-28,,ArcelorMittal,1243429,"=""MT""","24-26, BOULEVARD D?AVRANCHES","L-1160 LUXEMBOURG",LUXEMBOURG,N4,LUXEMBOURG,Foreign,,,"=""3312""","Steel Works, Blast Furnaces (Including Coke Ovens), and Rolling Mills",331111,"Iron and Steel Mills",34,28,01/02/24,"22,726,635,520",12/31/23,"68,275,000,000","1,022,000,000","48,859,000,000","93,917,000,000"
33800,"Other contingent liabilities","Valuation of Reserve for Losses and Loss Adjustment Expenses",526150,12/31/23,02/23/24,1,"PricewaterhouseCoopers LLP",,,,"New York",NY,"NEW YORK","US Mid Atlantic",10-K,2024-02-23,,"ARCH CAPITAL GROUP LTD.",947484,"=""ACGL""","WATERLOO HOUSE, GROUND FLOOR","100 PITTS BAY ROAD",PEMBROKE,D0,BERMUDA,Foreign,,,"=""6331""","Fire, Marine, and Casualty Insurance",524130,"Reinsurance Carriers",34,76,01/02/24,"28,193,138,688",12/31/23,"13,634,000,000","4,443,000,000","17,624,000,000","58,906,000,000"
33801,"Deferred income taxes","Measurement of Deferred Tax Assets related to Certain Identifiable Intangible Assets in Bermuda Entities",526150,12/31/23,02/23/24,1,"PricewaterhouseCoopers LLP",,,,"New York",NY,"NEW YORK","US Mid Atlantic",10-K,2024-02-23,,"ARCH CAPITAL GROUP LTD.",947484,"=""ACGL""","WATERLOO HOUSE, GROUND FLOOR","100 PITTS BAY ROAD",PEMBROKE,D0,BERMUDA,Foreign,,,"=""6331""","Fire, Marine, and Casualty Insurance",524130,"Reinsurance Carriers",34,76,01/02/24,"28,193,138,688",12/31/23,"13,634,000,000","4,443,000,000","17,624,000,000","58,906,000,000"
32832,"Asset retirement and environmental obligations","Asset Retirement Obligation (ARO) Liability",524741,12/31/23,02/15/24,2,"Ernst & Young LLP",,,,"Saint Louis",MO,MISSOURI,"US Southeast",10-K,2024-02-15,,"ARCH RESOURCES, INC.",1037676,,"CITY PLACE ONE STE 300","ARCH MINERAL CORP","ST LOUIS",MO,MISSOURI,"US Southeast",,,"=""1221""","Bituminous Coal and Lignite Surface Mining",212111,"Bituminous Coal and Lignite Surface Mining",34,166,12/31/23,"3,046,658,304",12/31/23,"3,145,843,000","464,038,000",,"2,484,173,000"
34789,"Other debt","Accounting for the Wisk Settlement and Valuation of the Second Tranche Warrant",527588,12/31/23,02/29/24,1,"PricewaterhouseCoopers LLP",,,,Irvine,CA,CALIFORNIA,"US West",10-K,2024-02-29,,"Archer Aviation Inc.",1824502,"=""ACHR""","190 WEST TASMAN DRIVE",,"SAN JOSE",CA,CALIFORNIA,"US West",,,"=""3721""",Aircraft,336411,"Aircraft Manufacturing",34,6,12/31/23,"1,630,890,496",12/31/23,,"-457,900,000","366,700,000","554,300,000"
35834,Inventory,"Market or Fair Values of Certain Merchandisable Agricultural Commodity Inventories, Inventory-Related Payables, and Forward Commodity Purchase and Sales Contracts",529771,12/31/23,03/12/24,2,"Ernst & Young LLP",,,,"Saint Louis",MO,MISSOURI,"US Southeast",10-K,2024-03-12,,"Archer-Daniels-Midland Co",7084,"=""ADM""","77 W. WACKER DR.",,CHICAGO,IL,ILLINOIS,"US Midwest",,,"=""2070""","Fats & Oils",311222,"Soybean Processing",34,72,12/31/23,"37,048,860,672",12/31/23,"93,935,000,000","3,483,000,000","18,111,000,000","54,631,000,000"
35835,Goodwill,"Animal Nutrition Goodwill Impairment Evaluation",529771,12/31/23,03/12/24,2,"Ernst & Young LLP",,,,"Saint Louis",MO,MISSOURI,"US Southeast",10-K,2024-03-12,,"Archer-Daniels-Midland Co",7084,"=""ADM""","77 W. WACKER DR.",,CHICAGO,IL,ILLINOIS,"US Midwest",,,"=""2070""","Fats & Oils",311222,"Soybean Processing",34,72,12/31/23,"37,048,860,672",12/31/23,"93,935,000,000","3,483,000,000","18,111,000,000","54,631,000,000"
40007,Inventory,"Market or Fair Values of Certain Merchandisable Agricultural Commodity Inventories, Inventory-Related Payables, and Forward Commodity Purchase and Sales Contracts",544130,12/31/23,03/12/24,2,"Ernst & Young LLP",,,,"Saint Louis",MO,MISSOURI,"US Southeast",10-K/A,2024-11-18,,"Archer-Daniels-Midland Co",7084,"=""ADM""","77 W. WACKER DR.",,CHICAGO,IL,ILLINOIS,"US Midwest",,,"=""2070""","Fats & Oils",311222,"Soybean Processing",34,72,12/31/23,"37,048,860,672",12/31/23,"93,935,000,000","3,483,000,000","18,111,000,000","54,631,000,000"
40008,Goodwill,"Animal Nutrition Goodwill Impairment Evaluation",544130,12/31/23,03/12/24,2,"Ernst & Young LLP",,,,"Saint Louis",MO,MISSOURI,"US Southeast",10-K/A,2024-11-18,,"Archer-Daniels-Midland Co",7084,"=""ADM""","77 W. WACKER DR.",,CHICAGO,IL,ILLINOIS,"US Midwest",,,"=""2070""","Fats & Oils",311222,"Soybean Processing",34,72,12/31/23,"37,048,860,672",12/31/23,"93,935,000,000","3,483,000,000","18,111,000,000","54,631,000,000"
33386,"Long-lived assets","Long–Lived Asset Impairment – Refer to Note 21 to the financial statements.",525401,12/31/23,02/21/24,3,"Deloitte & Touche LLP",,,,Houston,TX,TEXAS,"US Southwest",10-K,2024-02-21,,"Archrock, Inc.",1389050,"=""AROC""","16666 NORTHCHASE DRIVE","STE 100",HOUSTON,TX,TEXAS,"US Southwest",,,"=""4922""","Natural Gas Transmission",213112,"Support Activities for Oil and Gas Operations",34,15,12/31/23,"2,401,844,736",12/31/23,"990,337,000","104,998,000","840,839,000","2,655,950,000"
35844,"Long-lived assets","Impairment of long-lived assets for markets with impairment indicators",529950,12/31/23,03/13/24,2,"Ernst & Young LLP",134,"Pistrelli Henry Martin y Asociados SRL (Inactive)",1449,"Buenos Aires",C1,ARGENTINA,Foreign,6-K,2024-03-13,,"Arcos Dorados Holdings Inc.",1508478,"=""ARCO""","RIO NEGRO 1338, FIRST FLOOR",,MONTEVIDEO,X3,URUGUAY,Foreign,,,"=""5812""","Eating and Drinking Places",722211,"Limited-Service Restaurants",34,13,12/31/23,"1,658,011,520",12/31/23,"4,331,878,000","181,274,000","445,255,000","3,019,238,000"
35845,"Other contingent liabilities","Tax and labor contingencies",529950,12/31/23,03/13/24,2,"Ernst & Young LLP",134,"Pistrelli Henry Martin y Asociados SRL (Inactive)",1449,"Buenos Aires",C1,ARGENTINA,Foreign,6-K,2024-03-13,,"Arcos Dorados Holdings Inc.",1508478,"=""ARCO""","RIO NEGRO 1338, FIRST FLOOR",,MONTEVIDEO,X3,URUGUAY,Foreign,,,"=""5812""","Eating and Drinking Places",722211,"Limited-Service Restaurants",34,13,12/31/23,"1,658,011,520",12/31/23,"4,331,878,000","181,274,000","445,255,000","3,019,238,000"
38022,"Long-lived assets","Impairment of long-lived assets for markets with impairment indicators",535024,12/31/23,03/13/24,2,"Ernst & Young LLP",134,"Pistrelli Henry Martin y Asociados SRL (Inactive)",1449,"Buenos Aires",C1,ARGENTINA,Foreign,20-F,2024-04-29,,"Arcos Dorados Holdings Inc.",1508478,"=""ARCO""","RIO NEGRO 1338, FIRST FLOOR",,MONTEVIDEO,X3,URUGUAY,Foreign,,,"=""5812""","Eating and Drinking Places",722211,"Limited-Service Restaurants",34,13,12/31/23,"1,658,011,520",12/31/23,"4,331,878,000","181,274,000","445,255,000","3,019,238,000"
38023,"Other contingent liabilities","Tax and labor contingencies",535024,12/31/23,03/13/24,2,"Ernst & Young LLP",134,"Pistrelli Henry Martin y Asociados SRL (Inactive)",1449,"Buenos Aires",C1,ARGENTINA,Foreign,20-F,2024-04-29,,"Arcos Dorados Holdings Inc.",1508478,"=""ARCO""","RIO NEGRO 1338, FIRST FLOOR",,MONTEVIDEO,X3,URUGUAY,Foreign,,,"=""5812""","Eating and Drinking Places",722211,"Limited-Service Restaurants",34,13,12/31/23,"1,658,011,520",12/31/23,"4,331,878,000","181,274,000","445,255,000","3,019,238,000"
33825,Goodwill,"Valuation of Goodwill",526122,12/31/23,02/23/24,2,"Ernst & Young LLP",,,,Dallas,TX,TEXAS,"US Southwest",10-K,2024-02-23,,"Arcosa, Inc.",1739445,"=""ACA""","500 N. AKARD SREET","SUITE 400",DALLAS,TX,TEXAS,"US Southwest",,,"=""3440""","Fabricated Structural Metal Products",327992,"Ground or Treated Mineral and Earth Manufacturing",34,82,01/02/24,"3,999,780,096",12/31/23,"2,307,900,000","159,200,000","1,070,600,000","3,577,900,000"
36064,"Research and development expenses","Clinical trial accruals",529984,12/31/23,03/14/24,2,"Ernst & Young LLP",,,,"San Diego",CA,CALIFORNIA,"US West",10-K,2024-03-14,,"Arcturus Therapeutics Holdings Inc.",1768224,"=""ARCT""","10285 SCIENCE CENTER DRIVE",,"SAN DIEGO",CA,CALIFORNIA,"US West",,,"=""2834""","Pharmaceutical Preparations",325414,"Biological Product (except Diagnostic) Manufacturing",34,32,12/31/23,"845,886,848",12/31/23,"166,799,000","-29,725,000",,"429,402,000"
33280,"Revenue from customer contracts","Accounting for agreements with Gilead Sciences, Inc.",525320,12/31/23,02/21/24,2,"Ernst & Young LLP",,,,"San Mateo",CA,CALIFORNIA,"US West",10-K,2024-02-21,,"Arcus Biosciences, Inc.",1724521,"=""RCUS""","3928 POINT EDEN WAY",,HAYWARD,CA,CALIFORNIA,"US West",,,"=""2834""","Pharmaceutical Preparations",325412,"Pharmaceutical Preparation Manufacturing",34,19,12/31/23,"1,442,050,048",12/31/23,"117,000,000","-307,000,000",,"1,095,000,000"
34345,"Sales return and allowances","Sales deductions",526612,12/31/23,02/27/24,2,"Ernst & Young LLP",,,,"Los Angeles",CA,CALIFORNIA,"US West",10-K,2024-02-27,Yes,"Arcutis Biotherapeutics, Inc.",1787306,"=""ARQT""","3027 TOWNSGATE ROAD","SUITE 300","WESTLAKE VILLAGE",CA,CALIFORNIA,"US West",,,"=""2834""","Pharmaceutical Preparations",325412,"Pharmaceutical Preparation Manufacturing",34,3,12/31/23,"312,623,104",12/31/23,"59,606,000","-262,140,000","82,229,000","341,365,000"
33633,"Business combinations","Valuation of Earnout Shares Resulting from the AMP Transfer",525901,12/31/23,02/22/24,1,"PricewaterhouseCoopers LLP",104,PricewaterhouseCoopers,1366,Dublin,L2,IRELAND,Foreign,6-K,2024-02-22,,"Ardagh Metal Packaging S.A.",1845097,"=""AMBP""","56, RUE CHARLES MARTEL",,LUXEMBOURG,N4,LUXEMBOURG,Foreign,,,"=""3411""","Metal Cans",332431,"Metal Can Manufacturing",34,4,01/02/24,"2,288,713,472",12/31/23,"4,812,000,000","-50,000,000","-1,282,000,000","5,669,000,000"
34887,"Business combinations","Valuation of Earnout Shares Resulting from the AMP Transfer",527633,12/31/23,02/22/24,1,"PricewaterhouseCoopers LLP",104,PricewaterhouseCoopers,1366,Dublin,L2,IRELAND,Foreign,20-F,2024-02-29,,"Ardagh Metal Packaging S.A.",1845097,"=""AMBP""","56, RUE CHARLES MARTEL",,LUXEMBOURG,N4,LUXEMBOURG,Foreign,,,"=""3411""","Metal Cans",332431,"Metal Can Manufacturing",34,4,01/02/24,"2,288,713,472",12/31/23,"4,812,000,000","-50,000,000","-1,282,000,000","5,669,000,000"
35196,"Business combinations","Valuation of Earnout Shares Resulting from the AMP Transfer",527851,12/31/23,02/22/24,1,"PricewaterhouseCoopers LLP",104,PricewaterhouseCoopers,1366,Dublin,L2,IRELAND,Foreign,6-K,2024-02-29,,"Ardagh Metal Packaging S.A.",1845097,"=""AMBP""","56, RUE CHARLES MARTEL",,LUXEMBOURG,N4,LUXEMBOURG,Foreign,,,"=""3411""","Metal Cans",332431,"Metal Can Manufacturing",34,4,01/02/24,"2,288,713,472",12/31/23,"4,812,000,000","-50,000,000","-1,282,000,000","5,669,000,000"
33485,"Revenue from customer contracts","Estimates of Reserves for Variable Consideration Impacted by Estimated Payor Mix",525597,12/31/23,02/22/24,2,"Ernst & Young LLP",,,,Boston,MA,MASSACHUSETTS,"US New England",10-K,2024-02-22,,"ARDELYX, INC.",1437402,"=""ARDX""","34175 ARDENWOOD BLVD.",,FREMONT,CA,CALIFORNIA,"US West",,,"=""2834""","Pharmaceutical Preparations",325412,"Pharmaceutical Preparation Manufacturing",34,6,12/31/23,"1,441,209,728",12/31/23,"124,456,000","-66,067,000",,"297,579,000"
38655,"Revenue from customer contracts","Revenue Recognition – Contractual Adjustments and Implicit Price Concessions",537806,12/31/23,03/08/24,2,"Ernst & Young LLP",,,,Nashville,TN,TENNESSEE,"US Southeast",DRS,2024-03-15,,"Ardent Health, Inc.",1756655,"=""ARDT""","340 SEVEN SPRINGS WAY","SUITE 100",BRENTWOOD,TN,TENNESSEE,"US Southeast",,,"=""8062""","General Medical and Surgical Hospitals",622110,"General Medical and Surgical Hospitals",34,,,,12/31/23,"5,409,483,000","53,904,000","-243,436,000","4,731,558,000"
38656,"Other contingent liabilities","Professional and General Liability and Related Costs",537806,12/31/23,03/08/24,2,"Ernst & Young LLP",,,,Nashville,TN,TENNESSEE,"US Southeast",DRS,2024-03-15,,"Ardent Health, Inc.",1756655,"=""ARDT""","340 SEVEN SPRINGS WAY","SUITE 100",BRENTWOOD,TN,TENNESSEE,"US Southeast",,,"=""8062""","General Medical and Surgical Hospitals",622110,"General Medical and Surgical Hospitals",34,,,,12/31/23,"5,409,483,000","53,904,000","-243,436,000","4,731,558,000"
38657,"Revenue from customer contracts","Revenue Recognition – Contractual Adjustments and Implicit Price Concessions",537814,12/31/23,03/08/24,2,"Ernst & Young LLP",,,,Nashville,TN,TENNESSEE,"US Southeast",DRS/A,2024-04-26,,"Ardent Health, Inc.",1756655,"=""ARDT""","340 SEVEN SPRINGS WAY","SUITE 100",BRENTWOOD,TN,TENNESSEE,"US Southeast",,,"=""8062""","General Medical and Surgical Hospitals",622110,"General Medical and Surgical Hospitals",34,,,,12/31/23,"5,409,483,000","53,904,000","-243,436,000","4,731,558,000"
38658,"Other contingent liabilities","Professional and General Liability and Related Costs",537814,12/31/23,03/08/24,2,"Ernst & Young LLP",,,,Nashville,TN,TENNESSEE,"US Southeast",DRS/A,2024-04-26,,"Ardent Health, Inc.",1756655,"=""ARDT""","340 SEVEN SPRINGS WAY","SUITE 100",BRENTWOOD,TN,TENNESSEE,"US Southeast",,,"=""8062""","General Medical and Surgical Hospitals",622110,"General Medical and Surgical Hospitals",34,,,,12/31/23,"5,409,483,000","53,904,000","-243,436,000","4,731,558,000"
38659,"Revenue from customer contracts","Revenue Recognition – Contractual Adjustments and Implicit Price Concessions",537816,12/31/23,03/08/24,2,"Ernst & Young LLP",,,,Nashville,TN,TENNESSEE,"US Southeast",DRS/A,2024-06-03,,"Ardent Health, Inc.",1756655,"=""ARDT""","340 SEVEN SPRINGS WAY","SUITE 100",BRENTWOOD,TN,TENNESSEE,"US Southeast",,,"=""8062""","General Medical and Surgical Hospitals",622110,"General Medical and Surgical Hospitals",34,,,,12/31/23,"5,409,483,000","53,904,000","-243,436,000","4,731,558,000"
38660,"Other contingent liabilities","Professional and General Liability and Related Costs",537816,12/31/23,03/08/24,2,"Ernst & Young LLP",,,,Nashville,TN,TENNESSEE,"US Southeast",DRS/A,2024-06-03,,"Ardent Health, Inc.",1756655,"=""ARDT""","340 SEVEN SPRINGS WAY","SUITE 100",BRENTWOOD,TN,TENNESSEE,"US Southeast",,,"=""8062""","General Medical and Surgical Hospitals",622110,"General Medical and Surgical Hospitals",34,,,,12/31/23,"5,409,483,000","53,904,000","-243,436,000","4,731,558,000"
38664,"Revenue from customer contracts","Revenue Recognition – Contractual Adjustments and Implicit Price Concessions",537852,12/31/23,03/08/24,2,"Ernst & Young LLP",,,,Nashville,TN,TENNESSEE,"US Southeast",S-1,2024-06-21,,"Ardent Health, Inc.",1756655,"=""ARDT""","340 SEVEN SPRINGS WAY","SUITE 100",BRENTWOOD,TN,TENNESSEE,"US Southeast",,,"=""8062""","General Medical and Surgical Hospitals",622110,"General Medical and Surgical Hospitals",34,,,,12/31/23,"5,409,483,000","53,904,000","-243,436,000","4,731,558,000"
38665,"Other contingent liabilities","Professional and General Liability and Related Costs",537852,12/31/23,03/08/24,2,"Ernst & Young LLP",,,,Nashville,TN,TENNESSEE,"US Southeast",S-1,2024-06-21,,"Ardent Health, Inc.",1756655,"=""ARDT""","340 SEVEN SPRINGS WAY","SUITE 100",BRENTWOOD,TN,TENNESSEE,"US Southeast",,,"=""8062""","General Medical and Surgical Hospitals",622110,"General Medical and Surgical Hospitals",34,,,,12/31/23,"5,409,483,000","53,904,000","-243,436,000","4,731,558,000"
38824,"Revenue from customer contracts","Revenue Recognition – Contractual Adjustments and Implicit Price Concessions",538587,12/31/23,03/08/24,2,"Ernst & Young LLP",,,,Nashville,TN,TENNESSEE,"US Southeast",S-1/A,2024-07-08,,"Ardent Health, Inc.",1756655,"=""ARDT""","340 SEVEN SPRINGS WAY","SUITE 100",BRENTWOOD,TN,TENNESSEE,"US Southeast",,,"=""8062""","General Medical and Surgical Hospitals",622110,"General Medical and Surgical Hospitals",34,,,,12/31/23,"5,409,483,000","53,904,000","-243,436,000","4,731,558,000"
38825,"Other contingent liabilities","Professional and General Liability and Related Costs",538587,12/31/23,03/08/24,2,"Ernst & Young LLP",,,,Nashville,TN,TENNESSEE,"US Southeast",S-1/A,2024-07-08,,"Ardent Health, Inc.",1756655,"=""ARDT""","340 SEVEN SPRINGS WAY","SUITE 100",BRENTWOOD,TN,TENNESSEE,"US Southeast",,,"=""8062""","General Medical and Surgical Hospitals",622110,"General Medical and Surgical Hospitals",34,,,,12/31/23,"5,409,483,000","53,904,000","-243,436,000","4,731,558,000"
38863,"Revenue from customer contracts","Revenue Recognition – Contractual Adjustments and Implicit Price Concessions",538803,12/31/23,03/08/24,2,"Ernst & Young LLP",,,,Nashville,TN,TENNESSEE,"US Southeast",S-1/A,2024-07-15,,"Ardent Health, Inc.",1756655,"=""ARDT""","340 SEVEN SPRINGS WAY","SUITE 100",BRENTWOOD,TN,TENNESSEE,"US Southeast",,,"=""8062""","General Medical and Surgical Hospitals",622110,"General Medical and Surgical Hospitals",34,,,,12/31/23,"5,409,483,000","53,904,000","-243,436,000","4,731,558,000"
38864,"Other contingent liabilities","Professional and General Liability and Related Costs",538803,12/31/23,03/08/24,2,"Ernst & Young LLP",,,,Nashville,TN,TENNESSEE,"US Southeast",S-1/A,2024-07-15,,"Ardent Health, Inc.",1756655,"=""ARDT""","340 SEVEN SPRINGS WAY","SUITE 100",BRENTWOOD,TN,TENNESSEE,"US Southeast",,,"=""8062""","General Medical and Surgical Hospitals",622110,"General Medical and Surgical Hospitals",34,,,,12/31/23,"5,409,483,000","53,904,000","-243,436,000","4,731,558,000"
38888,"Revenue from customer contracts","Revenue Recognition – Contractual Adjustments and Implicit Price Concessions",538923,12/31/23,03/08/24,2,"Ernst & Young LLP",,,,Nashville,TN,TENNESSEE,"US Southeast",424B4,2024-07-18,,"Ardent Health, Inc.",1756655,"=""ARDT""","340 SEVEN SPRINGS WAY","SUITE 100",BRENTWOOD,TN,TENNESSEE,"US Southeast",,,"=""8062""","General Medical and Surgical Hospitals",622110,"General Medical and Surgical Hospitals",34,,,,12/31/23,"5,409,483,000","53,904,000","-243,436,000","4,731,558,000"
38889,"Other contingent liabilities","Professional and General Liability and Related Costs",538923,12/31/23,03/08/24,2,"Ernst & Young LLP",,,,Nashville,TN,TENNESSEE,"US Southeast",424B4,2024-07-18,,"Ardent Health, Inc.",1756655,"=""ARDT""","340 SEVEN SPRINGS WAY","SUITE 100",BRENTWOOD,TN,TENNESSEE,"US Southeast",,,"=""8062""","General Medical and Surgical Hospitals",622110,"General Medical and Surgical Hospitals",34,,,,12/31/23,"5,409,483,000","53,904,000","-243,436,000","4,731,558,000"
36134,"Property, plant and equipment","Determination of Vessel Asset Impairment Indicators — Refer to Note 2.16 to the financial statements.",530188,12/31/23,03/15/24,3,"Deloitte & Touche LLP",,,,"New York",NY,"NEW YORK","US Mid Atlantic",20-F,2024-03-15,,"Ardmore Shipping Corp",1577437,"=""ASC""","DORCHESTER HOUSE","7 CHURCH STREET",HAMILTON,D0,BERMUDA,Foreign,,,"=""4412""","Deep Sea Foreign Transportation of  Freight",483111,"Deep Sea Freight Transportation",34,14,12/31/23,"581,982,528",12/31/23,"395,978,000","116,808,000",,"690,951,000"
32398,"Other investments","Fair value of investments",524117,12/31/23,02/07/24,4,"KPMG LLP",,,,"Los Angeles",CA,CALIFORNIA,"US West",10-K,2024-02-07,,"ARES CAPITAL CORP",1287750,"=""ARCC""","245 PARK AVENUE, 44TH FLOOR",,"NEW YORK",NY,"NEW YORK","US Mid Atlantic",,,,,525990,"Other Financial Vehicles",34,20,01/02/24,"11,405,815,808",12/31/23,"2,032,000,000","1,522,000,000",,"23,800,000,000"
33521,"Allowance for credit losses","Current expected credit losses",525627,12/31/23,02/21/24,2,"Ernst & Young LLP",,,,"Los Angeles",CA,CALIFORNIA,"US West",10-K,2024-02-22,,"Ares Commercial Real Estate Corp",1529377,"=""ACRE""","245 PARK AVENUE","42ND FLOOR","NEW YORK",NY,"NEW YORK","US Mid Atlantic",,,"=""6798""","Real Estate Investment Trusts",525990,"Other Financial Vehicles",34,10,12/31/23,"560,985,984",12/31/23,"3,970,000","-38,867,000",,"2,240,796,000"
35651,"Business combinations","Evaluation of the estimated fair value of certain acquired tangible assets",529422,12/31/23,03/08/24,4,"KPMG LLP",,,,Denver,CO,COLORADO,"US West",10-K,2024-03-08,,"ARES INDUSTRIAL REAL ESTATE INCOME TRUST Inc.",1625941,"=""ZAIRDX""","1200 17TH STREET","SUITE 2900",DENVER,CO,COLORADO,"US West",,,"=""6798""","Real Estate Investment Trusts",525990,"Other Financial Vehicles",34,,,,12/31/23,"470,095,000","-204,674,000",,"7,329,504,000"
36141,"Business combinations","Evaluation of the estimated fair value of certain acquired tangible assets",530356,12/31/23,03/08/24,4,"KPMG LLP",,,,Denver,CO,COLORADO,"US West",424B3,2024-03-15,,"ARES INDUSTRIAL REAL ESTATE INCOME TRUST Inc.",1625941,"=""ZAIRDX""","1200 17TH STREET","SUITE 2900",DENVER,CO,COLORADO,"US West",,,"=""6798""","Real Estate Investment Trusts",525990,"Other Financial Vehicles",34,,,,12/31/23,"470,095,000","-204,674,000",,"7,329,504,000"
34326,"Equity investments and joint ventures","Valuation of underlying investments of equity method investments",526643,12/31/23,02/27/24,2,"Ernst & Young LLP",,,,"Los Angeles",CA,CALIFORNIA,"US West",10-K,2024-02-27,,"Ares Management Corp",1176948,"=""ARES""","1800 AVE OF THE STARS","SUITE 1400","LOS ANGELES",CA,CALIFORNIA,"US West",,,"=""6282""","Investment Advice",523930,"Investment Advice",34,115,01/02/24,"21,427,851,264",12/31/23,"2,771,008,000","474,326,000","257,964,000","24,730,500,000"
35904,"Business combinations","Evaluation of the estimated fair value of certain acquired tangible assets",529845,12/31/23,03/13/24,4,"KPMG LLP",,,,Denver,CO,COLORADO,"US West",10-K,2024-03-13,,"Ares Real Estate Income Trust Inc.",1327978,"=""ZAREDX""","ONE TABOR CENTER","1200 SEVENTEENTH STREET, SUITE 2900",DENVER,CO,COLORADO,"US West",,,"=""6798""","Real Estate Investment Trusts",525990,"Other Financial Vehicles",34,,,,12/31/23,"353,170,000","-62,427,000",,"4,639,406,000"
35905,"Real estate investments","Assessment of the expected hold periods for investments in real estate properties",529845,12/31/23,03/13/24,4,"KPMG LLP",,,,Denver,CO,COLORADO,"US West",10-K,2024-03-13,,"Ares Real Estate Income Trust Inc.",1327978,"=""ZAREDX""","ONE TABOR CENTER","1200 SEVENTEENTH STREET, SUITE 2900",DENVER,CO,COLORADO,"US West",,,"=""6798""","Real Estate Investment Trusts",525990,"Other Financial Vehicles",34,,,,12/31/23,"353,170,000","-62,427,000",,"4,639,406,000"
36144,"Business combinations","Evaluation of the estimated fair value of certain acquired tangible assets",530353,12/31/23,03/13/24,4,"KPMG LLP",,,,Denver,CO,COLORADO,"US West",424B3,2024-03-15,,"Ares Real Estate Income Trust Inc.",1327978,"=""ZAREDX""","ONE TABOR CENTER","1200 SEVENTEENTH STREET, SUITE 2900",DENVER,CO,COLORADO,"US West",,,"=""6798""","Real Estate Investment Trusts",525990,"Other Financial Vehicles",34,,,,12/31/23,"353,170,000","-62,427,000",,"4,639,406,000"
36145,"Real estate investments","Assessment of the expected hold periods for investments in real estate properties",530353,12/31/23,03/13/24,4,"KPMG LLP",,,,Denver,CO,COLORADO,"US West",424B3,2024-03-15,,"Ares Real Estate Income Trust Inc.",1327978,"=""ZAREDX""","ONE TABOR CENTER","1200 SEVENTEENTH STREET, SUITE 2900",DENVER,CO,COLORADO,"US West",,,"=""6798""","Real Estate Investment Trusts",525990,"Other Financial Vehicles",34,,,,12/31/23,"353,170,000","-62,427,000",,"4,639,406,000"
36402,"Revenue from customer contracts","Gross-to-net adjustments in revenue – Refer to Note 14 & 15 to financial statements",530730,12/31/23,03/21/24,3,"Deloitte & Touche LLP",21,"Deloitte Accountants BV",1243,Rotterdam,P7,NETHERLANDS,Foreign,20-F,2024-03-21,,"ARGENX SE",1697862,"=""ARGX""","INDUSTRIEPARK ZWIJNAARDE 7","BUILDING C B-9052",ZWIJNAARDE,C9,BELGIUM,Foreign,,,"=""2836""","Biological Products, Except Diagnostic Substances",325414,"Biological Product (except Diagnostic) Manufacturing",34,381,01/02/24,"21,105,821,696",12/31/23,"1,268,594,000","-295,053,000","3,972,279,000","4,542,458,000"
36279,"Other contingent liabilities","Estimate of reserves for losses and loss adjustment expenses",530463,12/31/23,03/18/24,4,"KPMG LLP",,,,"New York",NY,"NEW YORK","US Mid Atlantic",10-K,2024-03-19,,"Argo Group International Holdings, Inc.",1091748,"=""ARGD""","501 7TH AVENUE, 7TH FLOOR",,"NEW YORK",NY,"NEW YORK","US Mid Atlantic",,,"=""6361""","Title Insurance",524126,"Direct Property and Casualty Insurance Carriers",34,,,,12/31/23,"1,515,100,000","-209,500,000","1,116,900,000","8,503,100,000"
36280,"Insurance contract liabilities","Fair value adjustment for reserves for losses and loss adjustment expenses and value of business acquired (VOBA) resulting from a business combination",530463,12/31/23,03/18/24,4,"KPMG LLP",,,,"New York",NY,"NEW YORK","US Mid Atlantic",10-K,2024-03-19,,"Argo Group International Holdings, Inc.",1091748,"=""ARGD""","501 7TH AVENUE, 7TH FLOOR",,"NEW YORK",NY,"NEW YORK","US Mid Atlantic",,,"=""6361""","Title Insurance",524126,"Direct Property and Casualty Insurance Carriers",34,,,,12/31/23,"1,515,100,000","-209,500,000","1,116,900,000","8,503,100,000"
35750,"Internal controls","Consolidated Financial Statements – Impact of Controls Related to Financial Reporting",529575,12/31/23,03/11/24,1,"PricewaterhouseCoopers LLP",,,,Cleveland,OH,OHIO,"US Midwest",10-K,2024-03-11,,"Arhaus, Inc.",1875444,"=""ARHS""","51 EAST HINES HILL ROAD",,"BOSTON HEIGHTS",OH,OHIO,"US Midwest",,,"=""5712""","Furniture Stores",442110,"Furniture Stores",34,12,12/31/23,"630,061,056",12/31/23,"1,287,704,000","125,239,000","329,277,000","1,114,094,000"
32630,Inventory,"Inventory Valuation and Contract Manufacturer/Supplier Liabilities",524507,12/31/23,02/12/24,2,"Ernst & Young LLP",,,,"San Mateo",CA,CALIFORNIA,"US West",10-K,2024-02-13,,"Arista Networks, Inc.",1596532,"=""ANET""","5453 GREAT AMERICA PARKWAY",,"SANTA CLARA",CA,CALIFORNIA,"US West",,,"=""3576""","Computer Communications Equipment",511210,"Software Publishers",34,236,12/31/23,"73,536,823,296",12/31/23,"5,860,168,000","2,087,321,000","6,861,760,000","9,946,806,000"
34258,"Regulatory assets and liabilities","Regulatory Accounting – Impact of Rate Regulation on the Financial Statements — Refer to Notes 1 and 3 to the financial statements",526771,12/31/23,02/27/24,3,"Deloitte & Touche LLP",,,,Tempe,AZ,ARIZONA,"US Southwest",10-K,2024-02-27,,"ARIZONA PUBLIC SERVICE CO",7286,,"400 NORTH FIFTH STREET",,PHOENIX,AZ,ARIZONA,"US Southwest",764622,"PINNACLE WEST CAPITAL CORP","=""4931""","Electric and Other Services Combined",221112,"Fossil Fuel Electric Power Generation",34,,,,12/31/23,"4,695,991,000","547,337,000","6,974,983,000","24,516,455,000"
34973,"Warranty liabilities","Accrued Sales Warranty Returns",527556,12/31/23,02/29/24,1,"PricewaterhouseCoopers LLP",,,,"San Jose",CA,CALIFORNIA,"US West",10-K,2024-02-29,,"Arlo Technologies, Inc.",1736946,"=""ARLO""","5770 FLEET STREET",,CARLSBAD,CA,CALIFORNIA,"US West",,,"=""3651""","Household Audio and Video Equipment",334310,"Audio and Video Equipment Manufacturing",34,9,01/02/24,"873,422,016",12/31/23,"491,176,000","-22,036,000","92,238,000","285,538,000"
35125,"Allowance for credit losses","Allowance for Loan Losses - Notes Receivable",527454,12/31/23,02/28/24,2,"Ernst & Young LLP",,,,Richmond,VA,VIRGINIA,"US Mid Atlantic",10-K,2024-02-29,,"Armada Hoffler Properties, Inc.",1569187,"=""AHH""","222 CENTRAL PARK AVENUE","SUITE 2100","VIRGINIA BEACH",VA,VIRGINIA,"US Mid Atlantic",,,"=""6500""","Real Estate",525990,"Other Financial Vehicles",34,12,01/02/24,"837,796,032",12/31/23,"667,158,000","8,287,000","463,485,000","2,562,898,000"
35126,"Revenue from customer contracts","General contracting revenue recognition",527454,12/31/23,02/28/24,2,"Ernst & Young LLP",,,,Richmond,VA,VIRGINIA,"US Mid Atlantic",10-K,2024-02-29,,"Armada Hoffler Properties, Inc.",1569187,"=""AHH""","222 CENTRAL PARK AVENUE","SUITE 2100","VIRGINIA BEACH",VA,VIRGINIA,"US Mid Atlantic",,,"=""6500""","Real Estate",525990,"Other Financial Vehicles",34,12,01/02/24,"837,796,032",12/31/23,"667,158,000","8,287,000","463,485,000","2,562,898,000"
36419,"Research and development expenses","Accrued clinical trial expenses and related research and development costs",530726,12/31/23,03/21/24,2,"Ernst & Young LLP",,,,"San Diego",CA,CALIFORNIA,"US West",10-K,2024-03-21,Yes,"Armata Pharmaceuticals, Inc.",921114,"=""ARMP""","5005 MCCONNELL AVE",,"LOS ANGELES",CA,CALIFORNIA,"US West",,,"=""2836""","Biological Products, Except Diagnostic Substances",325414,"Biological Product (except Diagnostic) Manufacturing",34,3,12/31/23,"117,038,296",12/31/23,"4,529,000","-69,045,000","-45,811,000","98,363,000"
33192,"Pension and other post-employment benefits","Pension and postretirement benefit obligations",525151,12/31/23,02/20/24,4,"KPMG LLP",,,,Philadelphia,PA,PENNSYLVANIA,"US Mid Atlantic",10-K,2024-02-20,,"ARMSTRONG WORLD INDUSTRIES INC",7431,"=""AWI""","2500 COLUMBIA AVE",,LANCASTER,PA,PENNSYLVANIA,"US Mid Atlantic",,,"=""3089""","Plastics Products, NEC",326199,"All Other Plastics Product Manufacturing",34,98,12/31/23,"4,316,450,816",12/31/23,"1,295,200,000","223,800,000","3,900,000","1,672,400,000"
33046,"Revenue from customer contracts","Revenue Recognition - Retail Service and Equipment Sales Revenue",524999,12/31/23,02/16/24,1,"PricewaterhouseCoopers LLP",,,,Chicago,IL,ILLINOIS,"US Midwest",10-K,2024-02-16,,"ARRAY DIGITAL INFRASTRUCTURE, INC.",821130,"=""AD""","500 WEST MADISON STREET","SUITE 810",CHICAGO,IL,ILLINOIS,"US Midwest",1051512,"TELEPHONE & DATA SYSTEMS INC /DE/","=""4812""","Radiotelephone Communications",517212,"Cellular and Other Wireless Telecommunications",34,42,12/31/23,"2,160,079,872",12/31/23,"3,906,000,000","54,000,000","-55,000,000","10,750,000,000"
34725,Goodwill,"Goodwill – STI Operations Reporting Unit – Refer to Note 2 and 7 to the financial statements",527063,12/31/23,02/27/24,3,"Deloitte & Touche LLP",,,,Tempe,AZ,ARIZONA,"US Southwest",10-K,2024-02-28,,"Array Technologies, Inc.",1820721,"=""ARRY""","3901 MIDWAY PLACE NE",,ALBUQUERQUE,NM,"NEW MEXICO","US Southwest",,,"=""3990""","Miscellaneous Manufacturing Industries",335121,"Residential Electric Lighting Fixture Manufacturing",34,17,12/31/23,"2,540,867,584",12/31/23,"1,576,551,000","137,240,000","-175,479,000","1,706,741,000"
34726,"Other debt","Accounting for Capped Calls -- Refer to Note 11 to the financial statements",527063,12/31/23,02/27/24,3,"Deloitte & Touche LLP",,,,Tempe,AZ,ARIZONA,"US Southwest",10-K,2024-02-28,,"Array Technologies, Inc.",1820721,"=""ARRY""","3901 MIDWAY PLACE NE",,ALBUQUERQUE,NM,"NEW MEXICO","US Southwest",,,"=""3990""","Miscellaneous Manufacturing Industries",335121,"Residential Electric Lighting Fixture Manufacturing",34,17,12/31/23,"2,540,867,584",12/31/23,"1,576,551,000","137,240,000","-175,479,000","1,706,741,000"
32660,Inventory,"Evaluation of net realizable value adjustments to inventories for excess or obsolescence",524538,12/31/23,02/13/24,2,"Ernst & Young LLP",,,,Denver,CO,COLORADO,"US West",10-K,2024-02-13,,"ARROW ELECTRONICS, INC.",7536,"=""ARW""","7459 S LIMA STREET",,ENGLEWOOD,CO,COLORADO,"US West",,,"=""5065""","Electronic Parts and Equipment, NEC",423610,"Electrical Apparatus and Equipment, Wiring Supplies, and Related Equipment Merchant  Wholesalers",34,120,01/02/24,"6,493,170,176",12/31/23,"33,107,120,000","903,505,000","3,627,598,000","21,726,168,000"
32661,Goodwill,"Evaluation of Americas Components and eInfochips Goodwill for Impairment",524538,12/31/23,02/13/24,2,"Ernst & Young LLP",,,,Denver,CO,COLORADO,"US West",10-K,2024-02-13,,"ARROW ELECTRONICS, INC.",7536,"=""ARW""","7459 S LIMA STREET",,ENGLEWOOD,CO,COLORADO,"US West",,,"=""5065""","Electronic Parts and Equipment, NEC",423610,"Electrical Apparatus and Equipment, Wiring Supplies, and Related Equipment Merchant  Wholesalers",34,120,01/02/24,"6,493,170,176",12/31/23,"33,107,120,000","903,505,000","3,627,598,000","21,726,168,000"
35739,"Allowance for credit losses","Allowance for Credit Losses - Loans evaluated on a collective basis",529591,12/31/23,03/11/24,4,"KPMG LLP",,,,Albany,NY,"NEW YORK","US Mid Atlantic",10-K,2024-03-11,,"ARROW FINANCIAL CORP",717538,"=""AROW""","250 GLEN ST",,"GLENS FALLS",NY,"NEW YORK","US Mid Atlantic",,,"=""6021""","National Commercial Banks",522110,"Commercial Banking",34,28,01/02/24,"481,981,824",12/31/23,"130,568,000","30,075,000","356,789,000","4,169,868,000"
37854,"Allowance for credit losses","Allowance for Credit Losses - Loans evaluated on a collective basis",534374,12/31/23,03/11/24,4,"KPMG LLP",,,,Albany,NY,"NEW YORK","US Mid Atlantic",ARS,2024-04-25,,"ARROW FINANCIAL CORP",717538,"=""AROW""","250 GLEN ST",,"GLENS FALLS",NY,"NEW YORK","US Mid Atlantic",,,"=""6021""","National Commercial Banks",522110,"Commercial Banking",34,28,01/02/24,"481,981,824",12/31/23,"130,568,000","30,075,000","356,789,000","4,169,868,000"
32586,"Business combinations","Business acquisitions – accounting for acquisitions",524346,12/31/23,02/09/24,2,"Ernst & Young LLP",,,,Chicago,IL,ILLINOIS,"US Midwest",10-K,2024-02-09,,"Arthur J. Gallagher & Co.",354190,"=""AJG""","2850 GOLF ROAD",,"ROLLING MEADOWS",IL,ILLINOIS,"US Midwest",,,"=""6411""","Insurance Agents, Brokers, and Service",524210,"Insurance Agencies and Brokerages",34,225,01/02/24,"48,577,499,136",12/31/23,"10,071,900,000","969,500,000","-5,333,600,000","51,615,800,000"
33670,"Deferred income taxes","Income Taxes – Deferred Tax Assets and Amounts Payable Under Tax Receivable Agreements",525507,12/31/23,02/22/24,1,"PricewaterhouseCoopers LLP",,,,Chicago,IL,ILLINOIS,"US Midwest",10-K,2024-02-22,,"Artisan Partners Asset Management Inc.",1517302,"=""APAM""","875 E. WISCONSIN AVENUE","SUITE 800",MILWAUKEE,WI,WISCONSIN,"US Midwest",,,"=""6282""","Investment Advice",523120,"Securities Brokerage",34,44,01/02/24,"3,011,038,720",12/31/23,"966,560,000","221,784,000",,"1,405,858,000"
33989,"Deferred and capitalized costs","Deferred Preservation Costs",526072,12/31/23,02/23/24,2,"Ernst & Young LLP",,,,Atlanta,GA,GEORGIA,"US Southeast",10-K,2024-02-23,,"ARTIVION, INC.",784199,"=""AORT""","1655 ROBERTS BOULEVARD N W",,KENNESAW,GA,GEORGIA,"US Southeast",,,"=""3841""","Surgical and Medical Instruments and Apparatus",541710,"Research and Development in the Physical, Engineering, and Life Sciences",34,18,01/02/24,"737,233,024",12/31/23,"354,004,000","-30,690,000","-73,898,000","792,397,000"
34415,"Research and development expenses","Research and Development Expenses – Contract Research Organization Accruals — Refer to Note 2 in the Consolidated Financial Statements",526818,12/31/23,02/27/24,3,"Deloitte & Touche LLP",,,,Boston,MA,MASSACHUSETTS,"US New England",10-K,2024-02-27,,"ARVINAS, INC.",1655759,"=""ARVN""","395 WINCHESTER AVE","5 SCIENCE PARK","NEW HAVEN",CT,CONNECTICUT,"US New England",,,"=""2834""","Pharmaceutical Preparations",325412,"Pharmaceutical Preparation Manufacturing",34,42,01/02/24,"2,283,558,400",12/31/23,"78,500,000","-367,300,000",,"1,304,600,000"
27955,"Revenue from customer contracts","Revenue Recognition",506183,01/31/23,03/24/23,1,"PricewaterhouseCoopers LLP",,,,"San Francisco",CA,CALIFORNIA,"US West",10-K,2023-03-24,,"Asana, Inc.",1477720,"=""ASAN""","633 FOLSOM STREET","SUITE 100","SAN FRANCISCO",CA,CALIFORNIA,"US West",,,"=""7372""","Prepackaged Software",511210,"Software Publishers",34,16,01/31/23,"1,996,452,608",01/31/23,"547,212,000","-407,768,000",,"954,963,000"
35180,"Other intangible assets","Manufacturer Franchise Rights Quantitative Impairment Assessment",527367,12/31/23,02/29/24,2,"Ernst & Young LLP",,,,Atlanta,GA,GEORGIA,"US Southeast",10-K,2024-02-29,,"ASBURY AUTOMOTIVE GROUP INC",1144980,"=""ABG""","6655 PEACHTREE DUNWOODY ROAD",,ATLANTA,GA,GEORGIA,"US Southeast",,,"=""5500""","Retail-Auto Dealers & Gasoline Stations",441110,"New Car Dealers",34,223,01/02/24,"4,585,461,760",12/31/23,"14,802,700,000","602,500,000","-860,500,000","10,159,400,000"
32411,"Derivatives and hedging","Derivative liabilities – Refer to Notes 2, 3 and 16 to the financial statements",524138,12/31/23,02/07/24,3,"Deloitte & Touche LLP",582,"Deloitte Statsautoriseret Revisionspartnerselskab",1294,Copenhagen,G7,DENMARK,Foreign,20-F,2024-02-07,,"Ascendis Pharma A/S",1612042,"=""ASND""","TUBORG BOULEVARD 12",,HELLERUP,G7,DENMARK,Foreign,,,"=""2834""","Pharmaceutical Preparations",325412,"Pharmaceutical Preparation Manufacturing",34,128,01/02/24,"7,288,632,320",12/31/23,"294,631,000","-531,833,000","-165,826,000","911,989,000"
37314,Goodwill,"Goodwill – Allocated to the Packaging and Testing Segments for Impairment - Refer to Notes 4, 5 and 18 to the consolidated financial statements",532509,12/31/23,03/28/24,3,"Deloitte & Touche LLP",28,"Deloitte & Touche",1060,Taipei,F5,TAIWAN,Foreign,20-F,2024-04-03,,"ASE Technology Holding Co., Ltd.",1122411,"=""ASX""","26, CHIN 3RD RD.","NANZIH DISTRICT",KAOHSIUNG,F5,TAIWAN,Foreign,,,"=""3674""","Semiconductors and Related Devices",334413,"Semiconductor and Related Device Manufacturing",34,9,12/31/23,"20,285,540,352",12/31/23,"18,960,736,000","1,215,616,000","7,307,003,000","21,730,363,000"
33798,"Other liabilities and provisions","Long-Term Debt — Senior Secured Credit Facility — Refer to Note 9 to the financial statements",526151,12/31/23,02/22/24,3,"Deloitte & Touche LLP",,,,Richmond,VA,VIRGINIA,"US Mid Atlantic",10-K,2024-02-23,,"ASGN Inc",890564,"=""ASGN""","4400 COX ROAD, SUITE 110",,"GLEN ALLEN",VA,VIRGINIA,"US Mid Atlantic",,,"=""7363""","Help Supply Services",561310,"Employment Placement Agencies",34,96,01/02/24,"4,515,623,936",12/31/23,"4,450,600,000","219,300,000","-499,900,000","3,544,600,000"
31723,"Asset retirement and environmental obligations","Valuation of Environmental Remediation Reserves",519935,09/30/23,11/17/23,2,"Ernst & Young LLP",,,,"Grandview Heights",OH,OHIO,"US Midwest",10-K,2023-11-17,,"ASHLAND INC.",1674862,"=""ASH""","8145 BLAZER DRIVE",,WILMINGTON,DE,DELAWARE,"US Mid Atlantic",,,"=""5160""","Wholesale-Chemicals & Allied Products",424690,"Other Chemical and Allied Products Merchant Wholesalers",34,80,10/02/23,"4,084,933,888",09/30/23,"2,191,000,000","178,000,000","849,000,000","5,939,000,000"
31724,"Other contingent liabilities","Valuation of Asbestos Litigation Reserves",519935,09/30/23,11/17/23,2,"Ernst & Young LLP",,,,"Grandview Heights",OH,OHIO,"US Midwest",10-K,2023-11-17,,"ASHLAND INC.",1674862,"=""ASH""","8145 BLAZER DRIVE",,WILMINGTON,DE,DELAWARE,"US Mid Atlantic",,,"=""5160""","Wholesale-Chemicals & Allied Products",424690,"Other Chemical and Allied Products Merchant Wholesalers",34,80,10/02/23,"4,084,933,888",09/30/23,"2,191,000,000","178,000,000","849,000,000","5,939,000,000"
38073,"Revenue from customer contracts","Revenue Recognition – Estimating Measure of Progress for Supply, Delivery and Installation (“SDI”) Contracts",535009,12/31/23,04/25/24,1,"PricewaterhouseCoopers LLP",331,"PricewaterhouseCoopers Taiwan",1345,Taipei,F5,TAIWAN,Foreign,20-F,2024-04-29,,"ASIA PACIFIC WIRE & CABLE CORP LTD",1026980,"=""APWC""","15/FL. B, NO. 77, SEC. 2,","DUNHUA SOUTH ROAD","TAIPEI, 106",F5,TAIWAN,Foreign,,,"=""3357""","Drawing and Insulating of Nonferrous Wire",332618,"Other Fabricated Wire Product Manufacturing",34,1,12/31/23,"25,770,284",12/31/23,"425,772,000","302,000","156,935,000","366,664,000"
37480,"Going concern","Going Concern — Refer to Note 4c to the Financial Statements (also see Going Concern explanatory paragraph above)",533141,12/31/23,04/12/24,3,"Deloitte & Touche LLP",430,"Deloitte & Touche LLP",1046,Singapore,U0,SINGAPORE,Foreign,20-F,2024-04-12,Yes,"ASLAN Pharmaceuticals Ltd",1722926,,"83 CLEMENCEAU AVENUE","#12-03 UE SQUARE",SINGAPORE,U0,SINGAPORE,Foreign,,,"=""2834""","Pharmaceutical Preparations",325412,"Pharmaceutical Preparation Manufacturing",34,1,01/02/24,"44,232,852",12/31/23,"12,000,000","-44,219,604","-13,288,647","24,626,525"
32735,"Revenue from customer contracts","Revenue recognition – Identification of distinct performance obligations and allocation of the total contract consideration",524587,12/31/23,02/14/24,4,"KPMG LLP",76,"KPMG Accountants NV",1012,Amstelveen,P7,NETHERLANDS,Foreign,20-F,2024-02-14,,"ASML HOLDING NV",937966,"=""ASML""","DE RUN 6501",,"DR VELDHOVEN",P7,NETHERLANDS,Foreign,,,"=""3559""","Special  Industry Machinery, NEC",333295,"Semiconductor Machinery Manufacturing",34,717,01/02/24,"282,889,027,584",12/31/23,"30,442,600,000","8,659,400,000","8,972,200,000","44,139,300,000"
35588,Inventory,"Net realizable value of certain inventories",528937,12/31/23,03/07/24,4,"KPMG LLP",,,,Boston,MA,MASSACHUSETTS,"US New England",10-K,2024-03-07,,"ASPEN AEROGELS INC",1145986,"=""ASPN""","30 FORBES ROAD","BUILDING B",NORTHBOROUGH,MA,MASSACHUSETTS,"US New England",,,"=""5030""","Wholesale-Lumber & Other Construction Materials",541330,"Engineering Services",34,15,01/02/24,"1,077,038,720",12/31/23,"238,718,000","-52,345,000",,"703,048,000"
37129,"Insurance contract liabilities","Valuation of incurred but not reported reserve estimates, gross and net of reinsurance",532090,12/31/23,04/01/24,2,"Ernst & Young LLP",57,"Ernst & Young LLP",1438,London,X0,"UNITED KINGDOM",Foreign,20-F,2024-04-01,,"ASPEN INSURANCE HOLDINGS LTD",1267395,"=""AHL""","11 VICTORIA ST",,HAMILTON,D0,BERMUDA,Foreign,,,"=""6331""","Fire, Marine, and Casualty Insurance",524130,"Reinsurance Carriers",34,25,01/02/24,"1,526,202,880",12/31/23,"2,966,100,000","534,700,000","2,886,800,000","15,224,800,000"
37130,"Other investments","Valuation of privately–held investments",532090,12/31/23,04/01/24,2,"Ernst & Young LLP",57,"Ernst & Young LLP",1438,London,X0,"UNITED KINGDOM",Foreign,20-F,2024-04-01,,"ASPEN INSURANCE HOLDINGS LTD",1267395,"=""AHL""","11 VICTORIA ST",,HAMILTON,D0,BERMUDA,Foreign,,,"=""6331""","Fire, Marine, and Casualty Insurance",524130,"Reinsurance Carriers",34,25,01/02/24,"1,526,202,880",12/31/23,"2,966,100,000","534,700,000","2,886,800,000","15,224,800,000"
37365,"Insurance contract liabilities","Valuation of incurred but not reported reserve estimates, gross and net of reinsurance",532722,12/31/23,04/01/24,2,"Ernst & Young LLP",57,"Ernst & Young LLP",1438,London,X0,"UNITED KINGDOM",Foreign,F-1/A,2024-04-05,,"ASPEN INSURANCE HOLDINGS LTD",1267395,"=""AHL""","11 VICTORIA ST",,HAMILTON,D0,BERMUDA,Foreign,,,"=""6331""","Fire, Marine, and Casualty Insurance",524130,"Reinsurance Carriers",34,25,01/02/24,"1,526,202,880",12/31/23,"2,966,100,000","534,700,000","2,886,800,000","15,224,800,000"
37366,"Other investments","Valuation of privately–held investments",532722,12/31/23,04/01/24,2,"Ernst & Young LLP",57,"Ernst & Young LLP",1438,London,X0,"UNITED KINGDOM",Foreign,F-1/A,2024-04-05,,"ASPEN INSURANCE HOLDINGS LTD",1267395,"=""AHL""","11 VICTORIA ST",,HAMILTON,D0,BERMUDA,Foreign,,,"=""6331""","Fire, Marine, and Casualty Insurance",524130,"Reinsurance Carriers",34,25,01/02/24,"1,526,202,880",12/31/23,"2,966,100,000","534,700,000","2,886,800,000","15,224,800,000"
40228,"Insurance contract liabilities","Valuation of incurred but not reported reserve estimates, gross and net of reinsurance",545327,12/31/23,04/01/24,2,"Ernst & Young LLP",57,"Ernst & Young LLP",1438,London,X0,"UNITED KINGDOM",Foreign,F-1/A,2024-12-11,,"ASPEN INSURANCE HOLDINGS LTD",1267395,"=""AHL""","11 VICTORIA ST",,HAMILTON,D0,BERMUDA,Foreign,,,"=""6331""","Fire, Marine, and Casualty Insurance",524130,"Reinsurance Carriers",34,25,01/02/24,"1,526,202,880",12/31/23,"2,966,100,000","534,700,000","2,886,800,000","15,224,800,000"
40229,"Other investments","Valuation of privately–held investments",545327,12/31/23,04/01/24,2,"Ernst & Young LLP",57,"Ernst & Young LLP",1438,London,X0,"UNITED KINGDOM",Foreign,F-1/A,2024-12-11,,"ASPEN INSURANCE HOLDINGS LTD",1267395,"=""AHL""","11 VICTORIA ST",,HAMILTON,D0,BERMUDA,Foreign,,,"=""6331""","Fire, Marine, and Casualty Insurance",524130,"Reinsurance Carriers",34,25,01/02/24,"1,526,202,880",12/31/23,"2,966,100,000","534,700,000","2,886,800,000","15,224,800,000"
45310,"Insurance contract liabilities","Valuation of incurred but not reported reserve estimates, gross and net of reinsurance",558281,12/31/23,04/01/24,2,"Ernst & Young LLP",57,"Ernst & Young LLP",1438,London,X0,"UNITED KINGDOM",Foreign,F-1/A,2025-03-20,,"ASPEN INSURANCE HOLDINGS LTD",1267395,"=""AHL""","11 VICTORIA ST",,HAMILTON,D0,BERMUDA,Foreign,,,"=""6331""","Fire, Marine, and Casualty Insurance",524130,"Reinsurance Carriers",34,25,01/02/24,"1,526,202,880",12/31/23,"2,966,100,000","534,700,000","2,886,800,000","15,224,800,000"
45311,"Other investments","Valuation of privately–held investments",558281,12/31/23,04/01/24,2,"Ernst & Young LLP",57,"Ernst & Young LLP",1438,London,X0,"UNITED KINGDOM",Foreign,F-1/A,2025-03-20,,"ASPEN INSURANCE HOLDINGS LTD",1267395,"=""AHL""","11 VICTORIA ST",,HAMILTON,D0,BERMUDA,Foreign,,,"=""6331""","Fire, Marine, and Casualty Insurance",524130,"Reinsurance Carriers",34,25,01/02/24,"1,526,202,880",12/31/23,"2,966,100,000","534,700,000","2,886,800,000","15,224,800,000"
31006,"Revenue from customer contracts","Sufficiency of audit evidence over revenue",516117,06/30/23,08/21/23,4,"KPMG LLP",,,,Boston,MA,MASSACHUSETTS,"US New England",10-K,2023-08-21,,"Aspen Technology, Inc.",1897982,,"20 CROSBY DRIVE",,BEDFORD,MA,MASSACHUSETTS,"US New England",,,"=""7371""","Computer Programming Services",541511,"Custom Computer Programming Services",34,168,06/30/23,"10,805,019,648",06/30/23,"1,044,178,000","-107,760,000","80,461,000","14,486,052,000"
36897,"Revenue from customer contracts","Collaboration Agreement with Gilead Sciences, Inc.",531508,12/31/23,03/28/24,2,"Ernst & Young LLP",,,,"San Jose",CA,CALIFORNIA,"US West",10-K,2024-03-28,,"ASSEMBLY BIOSCIENCES, INC.",1426800,"=""ASMB""","TWO TOWER PLACE","7TH FLOOR","SOUTH SAN FRANCISCO",CA,CALIFORNIA,"US West",,,"=""2834""","Pharmaceutical Preparations",541710,"Research and Development in the Physical, Engineering, and Life Sciences",34,1,01/02/24,"54,669,980",12/31/23,"7,163,000","-61,228,000",,"136,823,000"
32491,"Allowance for credit losses","Assessment of the allowance for credit losses related to loans, excluding individually analyzed loans",524256,12/31/23,02/08/24,4,"KPMG LLP",,,,Chicago,IL,ILLINOIS,"US Midwest",10-K,2024-02-08,,"ASSOCIATED BANC-CORP",7789,"=""ASB""","433 MAIN STREET",,"GREEN BAY",WI,WISCONSIN,"US Midwest",,,"=""6022""","State Commercial Banks",522110,"Commercial Banking",34,22,01/02/24,"3,282,938,624",12/31/23,"1,019,736,000","182,955,000","3,028,510,000","41,015,855,000"
32796,"Insurance contract liabilities","Valuation of Claims and Benefits Payable Reserves for Global Lifestyle, Global Housing and Non-Core Operations Short Duration Insurance Contracts",524795,12/31/23,02/15/24,1,"PricewaterhouseCoopers LLP",,,,"New York",NY,"NEW YORK","US Mid Atlantic",10-K,2024-02-15,,"ASSURANT, INC.",1267238,"=""AIZ""","ONE CHASE MANHATTAN PLAZA",,"NEW YORK",NY,"NEW YORK","US Mid Atlantic",,,"=""6399""","Insurance Carriers, NEC",524130,"Reinsurance Carriers",34,170,01/02/24,"8,933,043,200",12/31/23,"11,131,600,000","642,500,000","1,633,600,000","33,635,200,000"
34686,"Insurance contract liabilities","Valuation of the Loss and Loss Adjustment Expense (LAE) Reserve and the Salvage and Subrogation Recoverable - Estimation of the Expected Loss to be Paid (Recovered)",527012,12/31/23,02/28/24,1,"PricewaterhouseCoopers LLP",,,,"New York",NY,"NEW YORK","US Mid Atlantic",10-K,2024-02-28,,"ASSURED GUARANTY LTD",1273813,"=""AGO""","30 WOODBOURNE AVENUE","5TH FLOOR",HAMILTON,D0,BERMUDA,Foreign,,,"=""6351""","Surety Insurance",524292,"Third Party Administration of Insurance and Pension Funds",34,75,12/31/23,"4,206,740,992",12/31/23,"1,373,000,000","739,000,000","5,707,000,000","12,539,000,000"
34687,"Equity investments and joint ventures","Valuation of the Consideration Received for the Contribution of Most of the Assured Investment Management LLC Business to Sound Point Capital Management LP",527012,12/31/23,02/28/24,1,"PricewaterhouseCoopers LLP",,,,"New York",NY,"NEW YORK","US Mid Atlantic",10-K,2024-02-28,,"ASSURED GUARANTY LTD",1273813,"=""AGO""","30 WOODBOURNE AVENUE","5TH FLOOR",HAMILTON,D0,BERMUDA,Foreign,,,"=""6351""","Surety Insurance",524292,"Third Party Administration of Insurance and Pension Funds",34,75,12/31/23,"4,206,740,992",12/31/23,"1,373,000,000","739,000,000","5,707,000,000","12,539,000,000"
34591,"Revenue from customer contracts","Revenue Recognition – Certain Contracts with Customers – Refer to Note 2 to the financial statements",527153,12/31/23,02/28/24,3,"Deloitte & Touche LLP",,,,Nashville,TN,TENNESSEE,"US Southeast",10-K,2024-02-28,,"ASTEC INDUSTRIES INC",792987,"=""ASTE""","1725 SHEPHERD ROAD",,CHATTANOOGA,TN,TENNESSEE,"US Southeast",,,"=""3531""","Construction Machinery and Equipment",333120,"Construction Machinery Manufacturing",34,36,01/02/24,"814,748,992",12/31/23,"1,338,200,000","33,500,000","590,700,000","1,059,300,000"
37675,"Other debt","Valuation of Convertible Notes",533715,12/31/23,04/17/24,1,"PricewaterhouseCoopers LLP",,,,"San Francisco",CA,CALIFORNIA,"US West",10-K,2024-04-18,Yes,"Astra Space, Inc.",1814329,,"1900 SKYHAWK STREET",,ALAMEDA,CA,CALIFORNIA,"US West",,,"=""4700""","Transportation Services",336414,"Guided Missile and Space Vehicle Manufacturing",34,2,12/31/23,"43,058,940",12/31/23,"3,874,000","-178,376,000","-83,325,000","77,420,000"
35187,"Accounts/loans receivable","Risk Pool Settlements and Related Receivables",527355,12/31/23,02/29/24,2,"Ernst & Young LLP",,,,"Los Angeles",CA,CALIFORNIA,"US West",10-K,2024-02-29,,"Astrana Health, Inc.",1083446,"=""ASTH""","1668 S. GARFIELD AVENUE","2ND FLOOR",ALHAMBRA,CA,CALIFORNIA,"US West",,,"=""8742""","Management Consulting Services",621111,"Offices of Physicians (except Mental Health Specialists)",34,,,,12/31/23,"1,386,661,000","60,717,000","57,856,000","933,361,000"
35188,"Insurance contract liabilities","Valuation of Incurred but not Reported (IBNR) Claims Liability",527355,12/31/23,02/29/24,2,"Ernst & Young LLP",,,,"Los Angeles",CA,CALIFORNIA,"US West",10-K,2024-02-29,,"Astrana Health, Inc.",1083446,"=""ASTH""","1668 S. GARFIELD AVENUE","2ND FLOOR",ALHAMBRA,CA,CALIFORNIA,"US West",,,"=""8742""","Management Consulting Services",621111,"Offices of Physicians (except Mental Health Specialists)",34,,,,12/31/23,"1,386,661,000","60,717,000","57,856,000","933,361,000"
33137,"Sales return and allowances","Recognition and measurement of accruals for Managed Care, Medicaid and Medicare Part D rebates on US Product Sales (excluding Rare Diseases)",525126,12/31/23,02/08/24,1,"PricewaterhouseCoopers LLP",121,"PricewaterhouseCoopers LLP",876,London,X0,"UNITED KINGDOM",Foreign,20-F,2024-02-20,,"ASTRAZENECA PLC",901832,"=""AZN""","1 FRANCIS CRICK AVENUE","CAMBRIDGE BIOMEDICAL CAMPUS",LONDON,X0,"UNITED KINGDOM",Foreign,,,"=""2834""","Pharmaceutical Preparations",325412,"Pharmaceutical Preparation Manufacturing",34,68,01/02/24,"53,003,161,600",12/31/23,"45,811,000,000","5,961,000,000","-18,994,000,000","101,119,000,000"
33138,"Other intangible assets","Impairment assessment of the product, marketing and distribution rights and other intangibles",525126,12/31/23,02/08/24,1,"PricewaterhouseCoopers LLP",121,"PricewaterhouseCoopers LLP",876,London,X0,"UNITED KINGDOM",Foreign,20-F,2024-02-20,,"ASTRAZENECA PLC",901832,"=""AZN""","1 FRANCIS CRICK AVENUE","CAMBRIDGE BIOMEDICAL CAMPUS",LONDON,X0,"UNITED KINGDOM",Foreign,,,"=""2834""","Pharmaceutical Preparations",325412,"Pharmaceutical Preparation Manufacturing",34,68,01/02/24,"53,003,161,600",12/31/23,"45,811,000,000","5,961,000,000","-18,994,000,000","101,119,000,000"
33139,"Other contingent liabilities","Recognition and measurement of legal provisions and disclosure of contingent liabilities",525126,12/31/23,02/08/24,1,"PricewaterhouseCoopers LLP",121,"PricewaterhouseCoopers LLP",876,London,X0,"UNITED KINGDOM",Foreign,20-F,2024-02-20,,"ASTRAZENECA PLC",901832,"=""AZN""","1 FRANCIS CRICK AVENUE","CAMBRIDGE BIOMEDICAL CAMPUS",LONDON,X0,"UNITED KINGDOM",Foreign,,,"=""2834""","Pharmaceutical Preparations",325412,"Pharmaceutical Preparation Manufacturing",34,68,01/02/24,"53,003,161,600",12/31/23,"45,811,000,000","5,961,000,000","-18,994,000,000","101,119,000,000"
33140,"Uncertain tax positions","Recognition, measurement and disclosure of tax liabilities for uncertain tax treatments",525126,12/31/23,02/08/24,1,"PricewaterhouseCoopers LLP",121,"PricewaterhouseCoopers LLP",876,London,X0,"UNITED KINGDOM",Foreign,20-F,2024-02-20,,"ASTRAZENECA PLC",901832,"=""AZN""","1 FRANCIS CRICK AVENUE","CAMBRIDGE BIOMEDICAL CAMPUS",LONDON,X0,"UNITED KINGDOM",Foreign,,,"=""2834""","Pharmaceutical Preparations",325412,"Pharmaceutical Preparation Manufacturing",34,68,01/02/24,"53,003,161,600",12/31/23,"45,811,000,000","5,961,000,000","-18,994,000,000","101,119,000,000"
33141,"Pension and other post-employment benefits","Valuation of defined benefit obligations (in the UK and Sweden)",525126,12/31/23,02/08/24,1,"PricewaterhouseCoopers LLP",121,"PricewaterhouseCoopers LLP",876,London,X0,"UNITED KINGDOM",Foreign,20-F,2024-02-20,,"ASTRAZENECA PLC",901832,"=""AZN""","1 FRANCIS CRICK AVENUE","CAMBRIDGE BIOMEDICAL CAMPUS",LONDON,X0,"UNITED KINGDOM",Foreign,,,"=""2834""","Pharmaceutical Preparations",325412,"Pharmaceutical Preparation Manufacturing",34,68,01/02/24,"53,003,161,600",12/31/23,"45,811,000,000","5,961,000,000","-18,994,000,000","101,119,000,000"
35300,"Research and development expenses","STAR-0215 Accrued and Prepaid Research and Development Costs",528194,12/31/23,03/04/24,2,"Ernst & Young LLP",,,,Boston,MA,MASSACHUSETTS,"US New England",10-K,2024-03-04,,"Astria Therapeutics, Inc.",1454789,"=""ATXS""","22 BOSTON WHARF ROAD","10TH FLOOR",BOSTON,MA,MASSACHUSETTS,"US New England",,,"=""2834""","Pharmaceutical Preparations",325412,"Pharmaceutical Preparation Manufacturing",34,8,12/31/23,"315,147,232",12/31/23,,"-72,891,000",,"254,666,000"
35367,Goodwill,"Valuation of Goodwill",528418,12/31/23,03/04/24,2,"Ernst & Young LLP",,,,Buffalo,NY,"NEW YORK","US Mid Atlantic",10-K,2024-03-05,,"ASTRONICS CORP",8063,"=""ATRO""","130 COMMERCE WAY",-,"EAST AURORA",NY,"NEW YORK","US Mid Atlantic",,,"=""3728""","Aircraft Parts and Auxiliary Equipment, NEC",336413,"Other Aircraft Parts and Auxiliary Equipment Manufacturing",34,17,01/02/24,"481,559,488",12/31/23,"689,206,000","-26,421,000","125,888,000","633,792,000"
35368,"Revenue from customer contracts","Revenue Recognition",528418,12/31/23,03/04/24,2,"Ernst & Young LLP",,,,Buffalo,NY,"NEW YORK","US Mid Atlantic",10-K,2024-03-05,,"ASTRONICS CORP",8063,"=""ATRO""","130 COMMERCE WAY",-,"EAST AURORA",NY,"NEW YORK","US Mid Atlantic",,,"=""3728""","Aircraft Parts and Auxiliary Equipment, NEC",336413,"Other Aircraft Parts and Auxiliary Equipment Manufacturing",34,17,01/02/24,"481,559,488",12/31/23,"689,206,000","-26,421,000","125,888,000","633,792,000"
33995,"Pension and other post-employment benefits","Discount rates used in determining pension and postretirement benefit obligations",526056,12/31/23,02/23/24,2,"Ernst & Young LLP",,,,Dallas,TX,TEXAS,"US Southwest",10-K,2024-02-23,,"AT&T Inc.",732717,"=""T""","208 S. AKARD ST",,DALLAS,TX,TEXAS,"US Southwest",,,"=""4813""","Telephone Communications, Except Radiotelephone",517110,"Wired Telecommunications Carriers",34,17,01/02/24,"123,337,850,880",12/31/23,"122,428,000,000","14,400,000,000","-95,086,000,000","407,060,000,000"
33996,Goodwill,"Evaluation of goodwill for impairment",526056,12/31/23,02/23/24,2,"Ernst & Young LLP",,,,Dallas,TX,TEXAS,"US Southwest",10-K,2024-02-23,,"AT&T Inc.",732717,"=""T""","208 S. AKARD ST",,DALLAS,TX,TEXAS,"US Southwest",,,"=""4813""","Telephone Communications, Except Radiotelephone",517110,"Wired Telecommunications Carriers",34,17,01/02/24,"123,337,850,880",12/31/23,"122,428,000,000","14,400,000,000","-95,086,000,000","407,060,000,000"
36811,"Revenue from customer contracts","Commercialization Revenue and Deferred Revenue – Accounting for Out- License Agreement – Refer to Notes 2 and 5 to the Financial Statements",531565,12/31/23,03/28/24,3,"Deloitte & Touche LLP",,,,"San Francisco",CA,CALIFORNIA,"US West",10-K,2024-03-28,Yes,"Atara Biotherapeutics, Inc.",1604464,"=""ATRA""","1280 RANCHO CONEJO BLVD",,"THOUSAND OAKS",CA,CALIFORNIA,"US West",,,"=""2836""","Biological Products, Except Diagnostic Substances",325412,"Pharmaceutical Preparation Manufacturing",34,0,01/02/24,"48,912,488",12/31/23,"8,573,000","-276,126,000",,"165,504,000"
34263,"Other investments","Valuation of Certain Structured Level 3 Asset-Backed Securities - Refer to Note 4, Investments, Note 7, Fair Value, and Note 16, Related Parties",526769,12/31/23,02/27/24,3,"Deloitte & Touche LLP",,,,"Des Moines",IA,IOWA,"US Midwest",10-K,2024-02-27,,"Athene Holding Ltd.",1527469,"=""ATHS""","7700 MILLS CIVIC PARKWAY",,"WEST DES MOINES",IA,IOWA,"US Midwest",,,"=""6311""","Life Insurance",523920,"Portfolio Management",34,23,01/02/24,"4,384,669,696",12/31/23,"28,194,000,000","4,665,000,000","9,773,000,000","300,579,000,000"
34264,"Policy changes","Adoption of Long Duration Targeted Improvements (LDTI) - Refer to Note 1, Business, Basis of Presentation and Significant Accounting Policies and Note 2, Adoption of Accounting Pronouncement",526769,12/31/23,02/27/24,3,"Deloitte & Touche LLP",,,,"Des Moines",IA,IOWA,"US Midwest",10-K,2024-02-27,,"Athene Holding Ltd.",1527469,"=""ATHS""","7700 MILLS CIVIC PARKWAY",,"WEST DES MOINES",IA,IOWA,"US Midwest",,,"=""6311""","Life Insurance",523920,"Portfolio Management",34,23,01/02/24,"4,384,669,696",12/31/23,"28,194,000,000","4,665,000,000","9,773,000,000","300,579,000,000"
34265,"Insurance contract liabilities","Certain Assumptions Used in the Future Policy Benefits, Market Risk Benefits, and Interest Sensitive Contract Liabilities - Refer to Note 1, Business, Basis of Presentation and Significant Accounting Policies, Note 7, Fair Value, and Note 10, Long-duration Contracts",526769,12/31/23,02/27/24,3,"Deloitte & Touche LLP",,,,"Des Moines",IA,IOWA,"US Midwest",10-K,2024-02-27,,"Athene Holding Ltd.",1527469,"=""ATHS""","7700 MILLS CIVIC PARKWAY",,"WEST DES MOINES",IA,IOWA,"US Midwest",,,"=""6311""","Life Insurance",523920,"Portfolio Management",34,23,01/02/24,"4,384,669,696",12/31/23,"28,194,000,000","4,665,000,000","9,773,000,000","300,579,000,000"
34056,Goodwill,"Goodwill impairment assessment - Forged Products reporting unit",525911,12/31/23,02/23/24,2,"Ernst & Young LLP",,,,Pittsburgh,PA,PENNSYLVANIA,"US Mid Atlantic",10-K,2024-02-23,,"ATI INC",1018963,"=""ATI""","2021 MCKINNEY AVENUE",,DALLAS,TX,TEXAS,"US Southwest",,,"=""3317""","Steel Pipe and Tubes",331111,"Iron and Steel Mills",34,44,01/02/24,"5,651,670,528",12/31/23,"4,173,700,000","410,800,000","1,145,800,000","4,985,100,000"
34404,"Goodwill and intangible assets","Valuation of Goodwill and Trade Name Indefinite-Lived Intangible Asset – Refer to Notes 2 and 5 to the financial statements",526841,12/31/23,02/27/24,3,"Deloitte & Touche LLP",,,,Chicago,IL,ILLINOIS,"US Midwest",10-K,2024-02-27,Yes,"ATI Physical Therapy, Inc.",1815849,"=""ATIP""","2001 BUTTERFIELD ROAD","SUITE 1600","DOWNERS GROVE",IL,ILLINOIS,"US Midwest",,,"=""8050""","Services-Nursing & Personal Care Facilities",621340,"Offices of Physical, Occupational and Speech Therapists, and Audiologists",34,6,01/02/24,"26,434,184",12/31/23,"699,016,000","-69,795,000","-416,115,000","1,003,281,000"
34405,"Revenue from customer contracts","Valuation of Net Patient Revenue and Related Accounts Receivable – Refer to Notes 2 and 4 to the financial statements",526841,12/31/23,02/27/24,3,"Deloitte & Touche LLP",,,,Chicago,IL,ILLINOIS,"US Midwest",10-K,2024-02-27,Yes,"ATI Physical Therapy, Inc.",1815849,"=""ATIP""","2001 BUTTERFIELD ROAD","SUITE 1600","DOWNERS GROVE",IL,ILLINOIS,"US Midwest",,,"=""8050""","Services-Nursing & Personal Care Facilities",621340,"Offices of Physical, Occupational and Speech Therapists, and Audiologists",34,6,01/02/24,"26,434,184",12/31/23,"699,016,000","-69,795,000","-416,115,000","1,003,281,000"
31718,"Other income taxes","Solar Tax Credit Accounting — Refer to Notes 1 and 7 to the financial statements",519929,09/30/23,11/17/23,3,"Deloitte & Touche LLP",,,,Chicago,IL,ILLINOIS,"US Midwest",10-K,2023-11-17,,"Atkore Inc.",1666138,"=""ATKR""","16100 SOUTH LATHROP AVENUE",,HARVEY,IL,ILLINOIS,"US Midwest",,,"=""3690""","Miscellaneous Electrical Machinery, Equipment & Supplies",335932,"Noncurrent-Carrying Wiring Device Manufacturing",34,149,09/30/23,"5,567,456,256",09/30/23,"3,518,761,000","689,899,000","762,641,000","2,935,009,000"
33310,"Regulatory assets and liabilities","Accounting for the Effects of Rate Regulation",525347,12/31/23,02/21/24,1,"PricewaterhouseCoopers LLP",,,,Philadelphia,PA,PENNSYLVANIA,"US Mid Atlantic",10-K,2024-02-21,,"ATLANTIC CITY ELECTRIC CO",8192,,"500 NORTH WAKEFIELD DRIVE",,NEWARK,DE,DELAWARE,"US Mid Atlantic",1109357,"EXELON CORP","=""4911""","Electric Services",221122,"Electric Power Distribution",34,,,,12/31/23,"1,522,000,000","120,000,000",,"5,157,000,000"
33701,"Allowance for credit losses","Allowance for Loan and Lease Losses (ALLL)",525835,12/31/23,02/22/24,2,"Ernst & Young LLP",,,,Richmond,VA,VIRGINIA,"US Mid Atlantic",10-K,2024-02-22,,"Atlantic Union Bankshares Corp",883948,"=""AUB""","4300 COX ROAD",,"GLEN ALLEN",VA,VIRGINIA,"US Mid Atlantic",,,"=""6022""","State Commercial Banks",522110,"Commercial Banking",34,36,01/02/24,"2,734,339,840",12/31/23,"670,272,000","201,818,000","1,611,933,000","21,166,197,000"
35256,"Other intangible assets","Recoverability assessment of contracted concessional, PP&E and other intangible assets",527929,12/31/23,02/29/24,2,"Ernst & Young LLP",163,"Ernst & Young SL",1461,Madrid,U3,SPAIN,Foreign,20-F,2024-03-01,,"Atlantica Sustainable Infrastructure plc",1601072,,"GREAT WEST HOUSE, GW1, 17TH FLOOR","GREAT WEST ROAD",BRENTFORD,X0,"UNITED KINGDOM",Foreign,,,"=""4911""","Electric Services",221121,"Electric Bulk Power Transmission and Control",34,22,12/31/23,"2,497,419,776",12/31/23,"1,099,894,000","43,380,000",,"8,714,333,000"
36050,"Property, plant and equipment","Assessment of indicators of impairment for vessels",529991,12/31/23,03/14/24,4,"KPMG LLP",187,"KPMG LLP Chartered Accountants",85,Vancouver,A1,"BRITISH COLUMBIA",Canada,20-F,2024-03-14,,"Atlas Corp.",1794846,,"2600-200 GRANVILLE STREET",,VANCOUVER,A1,"BRITISH COLUMBIA",Canada,,,"=""4412""","Deep Sea Foreign Transportation of  Freight",483111,"Deep Sea Freight Transportation",34,24,01/02/24,"6,813,884,416",12/31/23,"1,702,800,000","403,000,000","4,637,500,000","13,713,000,000"
30989,"Revenue from customer contracts","Revenue Recognition",516063,06/30/23,08/18/23,2,"Ernst & Young LLP",,,,"San Francisco",CA,CALIFORNIA,"US West",10-K,2023-08-18,,"Atlassian Corp",1650372,"=""TEAM""","350 BUSH STREET","FLOOR 13","SAN FRANCISCO",CA,CALIFORNIA,"US West",,,"=""7372""","Prepackaged Software",511210,"Software Publishers",34,168,06/30/23,"25,581,404,160",06/30/23,"3,534,647,000","-486,761,000","-141,611,000","4,106,779,000"
31648,"Regulatory assets and liabilities",Regulation,519799,09/30/23,11/14/23,2,"Ernst & Young LLP",,,,Dallas,TX,TEXAS,"US Southwest",10-K,2023-11-14,,"ATMOS ENERGY CORP",731802,"=""ATO""","1800 THREE LINCOLN CTR","5430 LBJ FREEWAY",DALLAS,TX,TEXAS,"US Southwest",,,"=""4924""","Natural Gas Distribution",221210,"Natural Gas Distribution",34,103,10/02/23,"15,256,004,608",09/30/23,"4,275,357,000","885,862,000","10,046,605,000","22,516,968,000"
32689,"Revenue from customer contracts","Revenue Recognition",524674,12/31/23,02/14/24,1,"PricewaterhouseCoopers LLP",,,,Nashville,TN,TENNESSEE,"US Southeast",S-4,2024-02-14,,"Atmus Filtration Technologies Inc.",1921963,"=""ATMU""","26 CENTURY BOULEVARD","SUITE 500",NASHVILLE,TN,TENNESSEE,"US Southeast",,,"=""3714""","Motor Vehicle Parts and Accessories",423120,"Motor Vehicle Supplies and New Parts Merchant Wholesalers",34,23,01/02/24,"1,933,341,824",12/31/23,"1,628,100,000","171,300,000","-4,000,000","1,088,600,000"
32790,"Revenue from customer contracts","Revenue Recognition",524634,12/31/23,02/14/24,1,"PricewaterhouseCoopers LLP",,,,Nashville,TN,TENNESSEE,"US Southeast",10-K,2024-02-14,,"Atmus Filtration Technologies Inc.",1921963,"=""ATMU""","26 CENTURY BOULEVARD","SUITE 500",NASHVILLE,TN,TENNESSEE,"US Southeast",,,"=""3714""","Motor Vehicle Parts and Accessories",423120,"Motor Vehicle Supplies and New Parts Merchant Wholesalers",34,23,01/02/24,"1,933,341,824",12/31/23,"1,628,100,000","171,300,000","-4,000,000","1,088,600,000"
35530,"Revenue from customer contracts","Revenue Recognition",529179,12/31/23,02/14/24,1,"PricewaterhouseCoopers LLP",,,,Nashville,TN,TENNESSEE,"US Southeast",424B3,2024-03-07,,"Atmus Filtration Technologies Inc.",1921963,"=""ATMU""","26 CENTURY BOULEVARD","SUITE 500",NASHVILLE,TN,TENNESSEE,"US Southeast",,,"=""3714""","Motor Vehicle Parts and Accessories",423120,"Motor Vehicle Supplies and New Parts Merchant Wholesalers",34,23,01/02/24,"1,933,341,824",12/31/23,"1,628,100,000","171,300,000","-4,000,000","1,088,600,000"
36110,Goodwill,"Goodwill impairment assessment for a certain reporting unit in the US Telecom segment",530310,12/31/23,03/15/24,1,"PricewaterhouseCoopers LLP",,,,Boston,MA,MASSACHUSETTS,"US New England",10-K,2024-03-15,,"ATN International, Inc.",879585,"=""ATNI""","500 CUMMINGS CENTER",,BEVERLY,MA,MASSACHUSETTS,"US New England",,,"=""4813""","Telephone Communications, Except Radiotelephone",517310,"Telecommunications Resellers",34,39,01/02/24,"607,606,336",12/31/23,"762,216,000","-14,538,000","453,982,000","1,783,714,000"
37260,"Equity investments and joint ventures","Valuation of Investment in Equity Securities",532045,12/31/23,04/01/24,2,"Ernst & Young LLP",,,,Seattle,WA,WASHINGTON,"US West",10-K,2024-04-01,,"ATOSSA THERAPEUTICS, INC.",1488039,"=""ATOS""","10202 5TH AVENUE NE","SUITE 200",SEATTLE,WA,WASHINGTON,"US West",,,"=""2834""","Pharmaceutical Preparations",541710,"Research and Development in the Physical, Engineering, and Life Sciences",34,1,12/31/23,"109,105,936",12/31/23,,"-30,094,000",,"96,252,000"
37965,"Long-lived assets","Evaluation of impairment of long-lived assets of leased hotels",534583,12/31/23,04/26/24,4,"KPMG LLP",355,"KPMG Huazhen LLP",1186,Shanghai,F4,CHINA,Foreign,20-F,2024-04-26,,"Atour Lifestyle Holdings Ltd",1853717,"=""ATAT""","1ST FLOOR, WUZHONG BUILDING","618 WUZHONG ROAD, MINHANG DISTRICT",SHANGHAI,F4,CHINA,Foreign,,,"=""7011""","Hotels and Motels",721110,"Hotels (except Casino Hotels) and Motels",34,17,12/31/23,"2,388,653,312",12/31/23,"276,410,000","-277,554,000","288,538,000","928,770,000"
37481,Inventory,"Inventories estimation of net realizable value subject to volatile changes in price levels–Refer to Note 2.9 to the financial statements",533136,12/31/23,04/12/24,3,"Deloitte & Touche LLP",499,"Deloitte Touche Tohmatsu Certified Public Accountants LLP",1113,Shanghai,F4,CHINA,Foreign,20-F,2024-04-12,,"ATRenew Inc.",1838957,"=""RERE""","12TH FLOOR, NO.6 BUILDING","433 SONGHU ROAD",SHANGHAI,K3,"HONG KONG",Foreign,,,"=""5990""","Retail-Retail Stores, NEC",453310,"Used Merchandise Stores",34,2,12/31/23,"425,667,840",12/31/23,"1,828,175,000","-22,031,000","485,157,000","774,524,000"
32968,"Deferred and stock-based compensation","Valuation of Performance Share Awards with a Market Condition - Refer to Note 14 to the financial statements",524953,12/31/23,02/16/24,3,"Deloitte & Touche LLP",,,,Cincinnati,OH,OHIO,"US Midwest",10-K,2024-02-16,,"AtriCure, Inc.",1323885,"=""ATRC""","7555 INNOVATION WAY",,MASON,OH,OHIO,"US Midwest",,,"=""3841""","Surgical and Medical Instruments and Apparatus",339113,"Surgical Appliance and Supplies Manufacturing",34,35,01/02/24,"1,673,994,240",12/31/23,"399,245,000","-30,438,000","167,401,000","613,932,000"
35983,"Research and development expenses","Accrued clinical and manufacturing costs",530011,12/31/23,03/14/24,2,"Ernst & Young LLP",,,,"San Diego",CA,CALIFORNIA,"US West",10-K,2024-03-14,,"aTYR PHARMA INC",1339970,"=""ATYR""","10240 SORRENTO VALLEY ROAD","SUITE 300","SAN DIEGO",CA,CALIFORNIA,"US West",,,"=""2836""","Biological Products, Except Diagnostic Substances",325414,"Biological Product (except Diagnostic) Manufacturing",34,1,01/02/24,"87,547,288",12/31/23,"353,000","-50,389,000",,"120,653,000"
36768,"Revenue from customer contracts","Revenue Recognition",531264,12/31/23,03/27/24,2,"Ernst & Young LLP",222,"Kost Forer Gabbay & Kasierer",1281,"Tel Aviv",L3,ISRAEL,Foreign,20-F,2024-03-27,,"AUDIOCODES LTD",1086434,"=""AUDC""","6 OFRA HAZA STREET",,"AIRPORT CITY LOD",L3,ISRAEL,Foreign,,,"=""3661""","Telephone and Telegraph Apparatus",334513,"Instruments and Related Products Manufacturing for Measuring, Displaying, and Controlling Industrial Proc",34,12,01/02/24,"374,558,592",12/31/23,"244,383,000","8,780,000","149,531,000","337,517,000"
32802,"Deferred and stock-based compensation","Measurement of Deferred Compensation Liability",524789,12/31/23,02/14/24,1,"PricewaterhouseCoopers LLP",191,"PricewaterhouseCoopers LLP Chartered Accountants",271,Toronto,A6,ONTARIO,Canada,10-K,2024-02-15,,"Aurinia Pharmaceuticals Inc.",1600620,"=""AUPH""","#140, 14315 - 118 AVENUE",,EDMONTON,A0,ALBERTA,Canada,,,"=""2834""","Pharmaceutical Preparations",325412,"Pharmaceutical Preparation Manufacturing",34,9,12/31/23,"1,293,058,688",12/31/23,"175,513,000","-78,020,000","372,977,000","548,062,000"
30366,"Other intangible assets","Valuation of intangible assets in the Canadian cannabis cash generating unit and in the European cannabis cash generating unit",513452,03/31/23,06/14/23,4,"KPMG LLP",187,"KPMG LLP Chartered Accountants",85,Vancouver,A1,"BRITISH COLUMBIA",Canada,40-F,2023-06-14,,"AURORA CANNABIS INC",1683541,"=""ACB""","2207 90B STREET SW",,EDMONTON,A0,ALBERTA,Canada,,,"=""2833""","Medicinal Chemicals and Botanical Products",111419,"Other Food Crops Grown Under Cover",34,1,06/30/23,"194,267,733",06/30/23,"155,667,550","-2,136,945,066",,"625,270,651"
30367,"Business combinations","Fair value measurement of acquired land and buildings related to a business combination",513452,03/31/23,06/14/23,4,"KPMG LLP",187,"KPMG LLP Chartered Accountants",85,Vancouver,A1,"BRITISH COLUMBIA",Canada,40-F,2023-06-14,,"AURORA CANNABIS INC",1683541,"=""ACB""","2207 90B STREET SW",,EDMONTON,A0,ALBERTA,Canada,,,"=""2833""","Medicinal Chemicals and Botanical Products",111419,"Other Food Crops Grown Under Cover",34,1,06/30/23,"194,267,733",06/30/23,"155,667,550","-2,136,945,066",,"625,270,651"
32806,"Research and development expenses","Research and Development Costs",524845,12/31/23,02/14/24,1,"PricewaterhouseCoopers LLP",,,,Pittsburgh,PA,PENNSYLVANIA,"US Mid Atlantic",10-K,2024-02-15,,"Aurora Innovation, Inc.",1828108,"=""AUR""","1654 SMALLMAN ST.",,PITTSBURGH,PA,PENNSYLVANIA,"US Mid Atlantic",,,"=""7373""","Computer Integrated Systems Design",511210,"Software Publishers",34,4,01/02/24,"4,267,516,928",12/31/23,,"-796,000,000","1,368,000,000","2,235,000,000"
38418,"Research and development expenses","Research and Development Costs",536544,12/31/23,02/14/24,1,"PricewaterhouseCoopers LLP",,,,Pittsburgh,PA,PENNSYLVANIA,"US Mid Atlantic",10-K/A,2024-05-24,,"Aurora Innovation, Inc.",1828108,"=""AUR""","1654 SMALLMAN ST.",,PITTSBURGH,PA,PENNSYLVANIA,"US Mid Atlantic",,,"=""7373""","Computer Integrated Systems Design",511210,"Software Publishers",34,4,01/02/24,"4,267,516,928",12/31/23,,"-796,000,000","1,368,000,000","2,235,000,000"
37482,"Equity investments and joint ventures","Impairment assessment of equity investments accounted for using the measurement alternative",533143,12/31/23,04/12/24,2,"Ernst & Young LLP",211,"Ernst & Young Hua Ming LLP",1408,Shenzhen,F4,CHINA,Foreign,20-F,2024-04-12,,"Aurora Mobile Ltd",1737339,"=""JG""","31/F, BLOCK 12-A, SHENZHEN BAY","SCIENCE AND TECHNOLOGY ECOLOGICAL PARK","NANSHAN DISTRICT, SHENZHEN",F4,CHINA,Foreign,,,"=""7370""","Services-Computer Programming, Data Processing, Etc.",518210,"Data Processing, Hosting, and Related Services",34,3,12/31/23,"16,850,368",12/31/23,"40,923,000","-8,756,000","2,513,000","49,376,000"
27316,"Revenue from customer contracts","Revenue Recognition",504978,01/31/23,03/14/23,2,"Ernst & Young LLP",,,,"San Francisco",CA,CALIFORNIA,"US West",10-K,2023-03-14,,"Autodesk, Inc.",769397,"=""ADSK""","ONE MARKET, STE. 400.",,"SAN FRANCISCO",CA,CALIFORNIA,"US West",,,"=""7372""","Prepackaged Software",511210,"Software Publishers",34,215,01/31/23,"46,259,400,704",01/31/23,"5,005,000,000","823,000,000","-2,887,000,000","9,438,000,000"
37880,"Allowance for credit losses","Allowance for current expected credit losses on accounts receivable",534375,12/31/23,04/25/24,1,"PricewaterhouseCoopers LLP",94,"PricewaterhouseCoopers Zhong Tian LLP",1424,Beijing,F4,CHINA,Foreign,20-F,2024-04-25,,"Autohome Inc.",1527636,"=""ATHM""","18TH FLOOR TOWER B, CEC PLAZA","3 Dan Ling Street, Haidian District",BEIJING,F4,CHINA,Foreign,,,"=""7374""","Computer Processing and Data Preparation and Processing Services",518210,"Data Processing, Hosting, and Related Services",34,28,01/02/24,"3,407,314,176",12/31/23,"1,012,963,000","265,092,000","3,037,584,000","4,347,837,000"
37881,"Other debt","The determination of fair value of convertible redeemable noncontrolling interests in TTP Car Inc. (“TTP”)",534375,12/31/23,04/25/24,1,"PricewaterhouseCoopers LLP",94,"PricewaterhouseCoopers Zhong Tian LLP",1424,Beijing,F4,CHINA,Foreign,20-F,2024-04-25,,"Autohome Inc.",1527636,"=""ATHM""","18TH FLOOR TOWER B, CEC PLAZA","3 Dan Ling Street, Haidian District",BEIJING,F4,CHINA,Foreign,,,"=""7374""","Computer Processing and Data Preparation and Processing Services",518210,"Data Processing, Hosting, and Related Services",34,28,01/02/24,"3,407,314,176",12/31/23,"1,012,963,000","265,092,000","3,037,584,000","4,347,837,000"
33199,"Revenue from customer contracts","Revenue recognition – Variable consideration related to price concessions",525047,12/31/23,02/20/24,2,"Ernst & Young LLP",55,"Ernst & Young AB",1433,Stockholm,V7,SWEDEN,Foreign,10-K,2024-02-20,,"AUTOLIV INC",1034670,"=""ALV""","3350 AIRPORT RD",,OGDEN,UT,UTAH,"US West",,,"=""3714""","Motor Vehicle Parts and Accessories",336399,"All Other Motor Vehicle Parts Manufacturing",34,110,01/02/24,"9,247,901,696",12/31/23,"10,475,000,000","487,000,000","1,173,000,000","8,333,000,000"
33200,"Warranty liabilities","Product recall liabilities",525047,12/31/23,02/20/24,2,"Ernst & Young LLP",55,"Ernst & Young AB",1433,Stockholm,V7,SWEDEN,Foreign,10-K,2024-02-20,,"AUTOLIV INC",1034670,"=""ALV""","3350 AIRPORT RD",,OGDEN,UT,UTAH,"US West",,,"=""3714""","Motor Vehicle Parts and Accessories",336399,"All Other Motor Vehicle Parts Manufacturing",34,110,01/02/24,"9,247,901,696",12/31/23,"10,475,000,000","487,000,000","1,173,000,000","8,333,000,000"
36390,"Other liabilities and provisions","Liabilities related to future royalties and sales milestones",530752,12/31/23,03/21/24,2,"Ernst & Young LLP",57,"Ernst & Young LLP",1438,Reading,X0,"UNITED KINGDOM",Foreign,10-K,2024-03-21,,"Autolus Therapeutics plc",1730463,"=""AUTL""","THE MEDIAWORKS","191 WOOD LANE",LONDON,X0,"UNITED KINGDOM",Foreign,,,"=""2836""","Biological Products, Except Diagnostic Substances",325414,"Biological Product (except Diagnostic) Manufacturing",34,6,12/31/23,"1,121,212,800",12/31/23,"1,698,000","-208,383,000",,"375,381,000"
30848,Goodwill,"Goodwill – Employer Services Reportable Segment— Refer to Notes 1 and 7 to the financial statements",515558,06/30/23,08/03/23,3,"Deloitte & Touche LLP",,,,Morristown,NJ,"NEW JERSEY","US Mid Atlantic",10-K,2023-08-03,,"AUTOMATIC DATA PROCESSING INC",8670,"=""ADP""","ONE ADP BOULVARD",,ROSELAND,NJ,"NEW JERSEY","US Mid Atlantic",,,"=""7374""","Computer Processing and Data Preparation and Processing Services",518210,"Data Processing, Hosting, and Related Services",34,220,06/30/23,"90,575,462,400",06/30/23,"18,012,200,000","3,412,000,000","-173,900,000","50,971,000,000"
30849,"Other liabilities and provisions","Client Funds Obligations - Refer to Note 4 to the financial statements",515558,06/30/23,08/03/23,3,"Deloitte & Touche LLP",,,,Morristown,NJ,"NEW JERSEY","US Mid Atlantic",10-K,2023-08-03,,"AUTOMATIC DATA PROCESSING INC",8670,"=""ADP""","ONE ADP BOULVARD",,ROSELAND,NJ,"NEW JERSEY","US Mid Atlantic",,,"=""7374""","Computer Processing and Data Preparation and Processing Services",518210,"Data Processing, Hosting, and Related Services",34,220,06/30/23,"90,575,462,400",06/30/23,"18,012,200,000","3,412,000,000","-173,900,000","50,971,000,000"
32961,"Other intangible assets","Fair value of franchise rights",525001,12/31/23,02/16/24,4,"KPMG LLP",,,,"Fort Lauderdale",FL,FLORIDA,"US Southeast",10-K,2024-02-16,,"AUTONATION, INC.",350698,"=""AN""","200 SW 1ST AVE","SUITE 1600","FORT LAUDERDALE",FL,FLORIDA,"US Southeast",,,"=""5500""","Retail-Auto Dealers & Gasoline Stations",441110,"New Car Dealers",34,151,01/02/24,"6,407,409,664",12/31/23,"26,948,900,000","1,021,100,000","-182,200,000","11,980,000,000"
31470,"Other contingent liabilities","Valuation of Self-insurance Reserves",518767,08/26/23,10/24/23,2,"Ernst & Young LLP",,,,Memphis,TN,TENNESSEE,"US Southeast",10-K,2023-10-24,,"AUTOZONE INC",866787,"=""AZO""","123 SOUTH FRONT ST","DEPT 8074",MEMPHIS,TN,TENNESSEE,"US Southeast",,,"=""5531""","Auto and Home Supply Stores",441310,"Automotive Parts and Accessories Stores",34,"2,531",08/31/23,"45,201,960,960",08/26/23,"17,457,209,000","2,528,426,000","-4,652,539,000","15,985,878,000"
35227,"Revenue from customer contracts","Net Product Revenue- Reserves for Variable Consideration– Patient Financial Assistance Programs and Rebates – Refer to Note 1 to the financial statements",527327,12/31/23,02/29/24,3,"Deloitte & Touche LLP",,,,"Saint Louis",MO,MISSOURI,"US Southeast",10-K,2024-02-29,,"AVADEL PHARMACEUTICALS PLC",1012477,"=""AVDL""","10 EARLSFORT TERRACE",,"DUBLIN 2",L2,IRELAND,Foreign,,,"=""2834""","Pharmaceutical Preparations",325412,"Pharmaceutical Preparation Manufacturing",34,14,12/31/23,"1,268,328,960",12/31/23,"27,963,000","-160,276,000","70,903,000","164,698,000"
37001,"Derivatives and hedging","Valuation of Derivative Instrument",531838,12/31/23,03/29/24,2,"Ernst & Young LLP",,,,Tysons,VA,VIRGINIA,"US Mid Atlantic",10-K,2024-03-29,,"Avalo Therapeutics, Inc.",1534120,"=""AVTX""","1500 LIBERTY RIDGE DRIVE","SUITE 321",WAYNE,PA,PENNSYLVANIA,"US Mid Atlantic",,,"=""2834""","Pharmaceutical Preparations",325412,"Pharmaceutical Preparation Manufacturing",34,9,12/31/23,"7,295,888",12/31/23,"1,924,000","-31,544,000","-3,198,000","20,993,000"
38744,"Derivatives and hedging","Valuation of Derivative Instrument",538111,12/31/23,03/29/24,2,"Ernst & Young LLP",,,,Tysons,VA,VIRGINIA,"US Mid Atlantic","DEF 14A",2024-06-27,,"Avalo Therapeutics, Inc.",1534120,"=""AVTX""","1500 LIBERTY RIDGE DRIVE","SUITE 321",WAYNE,PA,PENNSYLVANIA,"US Mid Atlantic",,,"=""2834""","Pharmaceutical Preparations",325412,"Pharmaceutical Preparation Manufacturing",34,9,12/31/23,"7,295,888",12/31/23,"1,924,000","-31,544,000","-3,198,000","20,993,000"
33811,"Deferred and capitalized costs","Valuation of Deferred Development Costs and Land Held for Development",526132,12/31/23,02/23/24,2,"Ernst & Young LLP",,,,Tysons,VA,VIRGINIA,"US Mid Atlantic",10-K,2024-02-23,,"AVALONBAY COMMUNITIES INC",915912,"=""AVB""","4040 WILSON BOULEVARD","STE 1000",ARLINGTON,VA,VIRGINIA,"US Mid Atlantic",,,"=""6798""","Real Estate Investment Trusts",525990,"Other Financial Vehicles",34,188,01/02/24,"26,722,983,936",12/31/23,"2,767,909,000","928,825,000",,"20,678,214,000"
33596,Goodwill,"Evaluation of the impairment of the carrying value of goodwill in the Renewables reporting unit",525539,12/31/23,02/22/24,4,"KPMG LLP",,,,"New York",NY,"NEW YORK","US Mid Atlantic",10-K,2024-02-22,,"Avangrid, Inc.",1634997,,"180 MARSH HILL ROAD",,ORANGE,CT,CONNECTICUT,"US New England",,,"=""4911""","Electric Services",221119,"Other Electric Power Generation",34,33,01/02/24,"12,883,339,264",12/31/23,"8,309,000,000","786,000,000","16,245,000,000","43,989,000,000"
33597,"Regulatory assets and liabilities","Evaluation of regulatory assets and liabilities",525539,12/31/23,02/22/24,4,"KPMG LLP",,,,"New York",NY,"NEW YORK","US Mid Atlantic",10-K,2024-02-22,,"Avangrid, Inc.",1634997,,"180 MARSH HILL ROAD",,ORANGE,CT,CONNECTICUT,"US New England",,,"=""4911""","Electric Services",221119,"Other Electric Power Generation",34,33,01/02/24,"12,883,339,264",12/31/23,"8,309,000,000","786,000,000","16,245,000,000","43,989,000,000"
33320,"Sales return and allowances","Net Sales/Accrued rebate expenses- Refer to Notes 1 and 16 to the consolidated financial statements",525356,12/31/23,02/21/24,3,"Deloitte & Touche LLP",,,,Atlanta,GA,GEORGIA,"US Southeast",10-K,2024-02-21,,"AVANOS MEDICAL, INC.",1606498,"=""AVNS""","5405 WINDWARD PARKWAY","SUITE 100 SOUTH",ALPHARETTA,GA,GEORGIA,"US Southeast",,,"=""3842""","Orthopedic, Prosthetic, and Surgical Appliances and Supplies",524114,"Direct Health and Medical Insurance Carriers",34,23,01/02/24,"1,052,931,904",12/31/23,"673,300,000","-61,800,000","200,700,000","1,692,400,000"
33321,Goodwill,"Goodwill Valuation - Refer to Note 4 to the consolidated financial statements",525356,12/31/23,02/21/24,3,"Deloitte & Touche LLP",,,,Atlanta,GA,GEORGIA,"US Southeast",10-K,2024-02-21,,"AVANOS MEDICAL, INC.",1606498,"=""AVNS""","5405 WINDWARD PARKWAY","SUITE 100 SOUTH",ALPHARETTA,GA,GEORGIA,"US Southeast",,,"=""3842""","Orthopedic, Prosthetic, and Surgical Appliances and Supplies",524114,"Direct Health and Medical Insurance Carriers",34,23,01/02/24,"1,052,931,904",12/31/23,"673,300,000","-61,800,000","200,700,000","1,692,400,000"
33322,"Discontinued operations","Discontinued Operations - Accounting and Disclosure - Refer to Note 2 to the consolidated financial statements",525356,12/31/23,02/21/24,3,"Deloitte & Touche LLP",,,,Atlanta,GA,GEORGIA,"US Southeast",10-K,2024-02-21,,"AVANOS MEDICAL, INC.",1606498,"=""AVNS""","5405 WINDWARD PARKWAY","SUITE 100 SOUTH",ALPHARETTA,GA,GEORGIA,"US Southeast",,,"=""3842""","Orthopedic, Prosthetic, and Surgical Appliances and Supplies",524114,"Direct Health and Medical Insurance Carriers",34,23,01/02/24,"1,052,931,904",12/31/23,"673,300,000","-61,800,000","200,700,000","1,692,400,000"
32749,Goodwill,"Goodwill —Americas and Europe Reporting Units - Refer to Notes 2, 6 and 11 to the financial statements",524651,12/31/23,02/14/24,3,"Deloitte & Touche LLP",,,,Philadelphia,PA,PENNSYLVANIA,"US Mid Atlantic",10-K,2024-02-14,,"Avantor, Inc.",1722482,"=""AVTR""","RADNOR CORPORATE CENTER, BUILDING ONE","SUITE 200, 100 MATSONFORD ROAD",RADNOR,PA,PENNSYLVANIA,"US Mid Atlantic",,,"=""3826""","Laboratory Analytical Instruments",325188,"All Other Basic Inorganic Chemical Manufacturing",34,23,12/31/23,"15,446,777,856",12/31/23,"6,967,200,000","321,100,000","-4,239,400,000","12,972,700,000"
32750,"Long-lived assets","Long-Lived Asset Impairment – Ritter GmbH— Refer to Notes 2, 4, 6, 10 and 11 to the financial statements",524651,12/31/23,02/14/24,3,"Deloitte & Touche LLP",,,,Philadelphia,PA,PENNSYLVANIA,"US Mid Atlantic",10-K,2024-02-14,,"Avantor, Inc.",1722482,"=""AVTR""","RADNOR CORPORATE CENTER, BUILDING ONE","SUITE 200, 100 MATSONFORD ROAD",RADNOR,PA,PENNSYLVANIA,"US Mid Atlantic",,,"=""3826""","Laboratory Analytical Instruments",325188,"All Other Basic Inorganic Chemical Manufacturing",34,23,12/31/23,"15,446,777,856",12/31/23,"6,967,200,000","321,100,000","-4,239,400,000","12,972,700,000"
32751,"Uncertain tax positions","Income Taxes – Uncertain Tax Positions – Refer to Notes 2 and 19 to the financial statements",524651,12/31/23,02/14/24,3,"Deloitte & Touche LLP",,,,Philadelphia,PA,PENNSYLVANIA,"US Mid Atlantic",10-K,2024-02-14,,"Avantor, Inc.",1722482,"=""AVTR""","RADNOR CORPORATE CENTER, BUILDING ONE","SUITE 200, 100 MATSONFORD ROAD",RADNOR,PA,PENNSYLVANIA,"US Mid Atlantic",,,"=""3826""","Laboratory Analytical Instruments",325188,"All Other Basic Inorganic Chemical Manufacturing",34,23,12/31/23,"15,446,777,856",12/31/23,"6,967,200,000","321,100,000","-4,239,400,000","12,972,700,000"
36040,"Accounts/loans receivable","Estimated Contractual Adjustments and Implicit Price Concessions",530002,12/30/23,03/14/24,2,"Ernst & Young LLP",,,,Atlanta,GA,GEORGIA,"US Southeast",10-K,2024-03-14,,"Aveanna Healthcare Holdings, Inc.",1832332,"=""AVAH""","400 INTERSTATE NORTH PARKWAY","STE 1700",ATLANTA,GA,GEORGIA,"US Southeast",,,"=""8082""","Home Health Care Services",621610,"Home Health Care Services",34,3,12/31/23,"511,164,864",12/30/23,"1,895,209,000","-134,524,000","-1,275,997,000","1,612,985,000"
36041,Goodwill,"Goodwill Impairment",530002,12/30/23,03/14/24,2,"Ernst & Young LLP",,,,Atlanta,GA,GEORGIA,"US Southeast",10-K,2024-03-14,,"Aveanna Healthcare Holdings, Inc.",1832332,"=""AVAH""","400 INTERSTATE NORTH PARKWAY","STE 1700",ATLANTA,GA,GEORGIA,"US Southeast",,,"=""8082""","Home Health Care Services",621610,"Home Health Care Services",34,3,12/31/23,"511,164,864",12/30/23,"1,895,209,000","-134,524,000","-1,275,997,000","1,612,985,000"
36258,"Other debt","Valuation of warrant liabilities",530407,12/31/23,03/18/24,4,"KPMG LLP",,,,"New York",NY,"NEW YORK","US Mid Atlantic",10-K,2024-03-18,Yes,"AVENUE THERAPEUTICS, INC.",1644963,"=""ATXI""","1111 KANE CONCOURSE","SUITE 301","BAY HARBOR ISLANDS",FL,FLORIDA,"US Southeast",,,"=""2834""","Pharmaceutical Preparations",325412,"Pharmaceutical Preparation Manufacturing",34,0,12/31/23,"4,095,620",12/31/23,,"-10,377,000",,"1,850,000"
34897,"Revenue from customer contracts","Revenue Recognition – Determination of Standalone Selling Prices — Refer to Note 2 to the financial statements",527493,12/31/23,02/29/24,3,"Deloitte & Touche LLP",,,,"New York",NY,"NEW YORK","US Mid Atlantic",10-K,2024-02-29,,"AvePoint, Inc.",1777921,"=""AVPT""","525 WASHINGTON BLVD","SUITE 1400",,NJ,"NEW JERSEY","US Mid Atlantic",,,"=""7372""","Prepackaged Software",511210,"Software Publishers",34,8,01/02/24,"1,450,928,128",12/31/23,"271,825,000","-21,725,000","186,935,000","442,582,000"
35347,"Revenue from customer contracts","Revenue Recognition – Determination of Standalone Selling Prices — Refer to Note 2 to the financial statements",528246,12/31/23,02/29/24,3,"Deloitte & Touche LLP",,,,"New York",NY,"NEW YORK","US Mid Atlantic",424B3,2024-03-04,,"AvePoint, Inc.",1777921,"=""AVPT""","525 WASHINGTON BLVD","SUITE 1400",,NJ,"NEW JERSEY","US Mid Atlantic",,,"=""7372""","Prepackaged Software",511210,"Software Publishers",34,8,01/02/24,"1,450,928,128",12/31/23,"271,825,000","-21,725,000","186,935,000","442,582,000"
33423,"Revenue from customer contracts","Revenue Recognition from Certain Product Revenue",525336,12/30/23,02/21/24,1,"PricewaterhouseCoopers LLP",,,,"Los Angeles",CA,CALIFORNIA,"US West",10-K,2024-02-21,,"Avery Dennison Corp",8818,"=""AVY""","8080 NORTON PARKWAY",,MENTOR,OH,OHIO,"US Midwest",,,"=""2670""","Converted Paper & Paperboard Prods (No Contaners/Boxes)",322222,"Coated and Laminated Paper Manufacturing",34,203,12/28/23,"16,330,132,480",12/30/23,"8,364,300,000","503,000,000","-734,800,000","8,209,800,000"
31092,"Revenue from customer contracts","Revenue Recognition — Service Revenues - Estimated Costs to Complete - Refer to Note 3 to the financial statements",516496,06/30/23,08/30/23,3,"Deloitte & Touche LLP",,,,Austin,TX,TEXAS,"US Southwest",10-K,2023-08-30,,"AVIAT NETWORKS, INC.",1377789,"=""AVNW""","200 PARKER DRIVE","SUITE C100A",AUSTIN,TX,TEXAS,"US Southwest",,,"=""3663""","Radio and Television Broadcasting and Communications Equipment",517212,"Cellular and Other Wireless Telecommunications",34,33,06/30/23,"384,355,648",06/30/23,"346,593,000","11,528,000","205,940,000","364,496,000"
30417,"Deferred and capitalized costs","Estimated costs at completion for projects",513671,04/30/23,06/21/23,2,"Ernst & Young LLP",,,,Irvine,CA,CALIFORNIA,"US West",10-K,2023-06-21,,"Avid Bioservices, Inc.",704562,,"14191 MYFORD ROAD",,TUSTIN,CA,CALIFORNIA,"US West",,,"=""2834""","Pharmaceutical Preparations",325412,"Pharmaceutical Preparation Manufacturing",34,18,04/30/23,"1,131,588,480",04/30/23,"149,266,000","259,000",,"451,054,000"
37819,"Deferred and capitalized costs","Estimated costs at completion for projects",534278,04/30/23,06/21/23,2,"Ernst & Young LLP",,,,Irvine,CA,CALIFORNIA,"US West",10-K/A,2024-04-24,,"Avid Bioservices, Inc.",704562,,"14191 MYFORD ROAD",,TUSTIN,CA,CALIFORNIA,"US West",,,"=""2834""","Pharmaceutical Preparations",325412,"Pharmaceutical Preparation Manufacturing",34,18,04/30/23,"1,131,588,480",04/30/23,"149,266,000","259,000",,"451,054,000"
34988,"Other debt","Restricted Funds Held for Customers and Payment Service Obligations",527535,12/31/23,02/29/24,1,"PricewaterhouseCoopers LLP",,,,Charlotte,NC,"NORTH CAROLINA","US Southeast",10-K,2024-02-29,,"AvidXchange Holdings, Inc.",1858257,"=""AVDX""","1210 AVIDXCHANGE LANE",,CHARLOTTE,NC,"NORTH CAROLINA","US Southeast",,,"=""7372""","Prepackaged Software",511210,"Software Publishers",34,12,01/02/24,"2,456,054,272",12/31/23,"380,720,000","-47,325,000","405,719,000","2,483,737,000"
33217,"Asset retirement and environmental obligations","Environmental Accrued Liabilities - Calvert City",525065,12/31/23,02/20/24,2,"Ernst & Young LLP",,,,Cleveland,OH,OHIO,"US Midwest",10-K,2024-02-20,,"AVIENT CORP",1122976,"=""AVNT""","33587 WALKER ROAD",,"AVON LAKE",OH,OHIO,"US Midwest",,,"=""2821""","Plastics Material and Synthetic Resins, and Nonvulcanizable Elastomers",325211,"Plastics Material and Resin Manufacturing",34,41,01/02/24,"3,748,558,336",12/31/23,"3,142,800,000","75,700,000","-990,900,000","5,968,500,000"
33218,"Goodwill and intangible assets","Impairment assessment of the Avient Protective Materials (APM) Reporting Unit and the Dyneema Indefinite-Lived Trade Name",525065,12/31/23,02/20/24,2,"Ernst & Young LLP",,,,Cleveland,OH,OHIO,"US Midwest",10-K,2024-02-20,,"AVIENT CORP",1122976,"=""AVNT""","33587 WALKER ROAD",,"AVON LAKE",OH,OHIO,"US Midwest",,,"=""2821""","Plastics Material and Synthetic Resins, and Nonvulcanizable Elastomers",325211,"Plastics Material and Resin Manufacturing",34,41,01/02/24,"3,748,558,336",12/31/23,"3,142,800,000","75,700,000","-990,900,000","5,968,500,000"
36465,"Proven and unproven reserves","Determination of Recoverable Amount – Refer to Notes 2 and 3 to the financial statements",530806,12/31/23,03/20/24,3,"Deloitte & Touche LLP",468,"Deloitte LLP",1208,Vancouver,A1,"BRITISH COLUMBIA",Canada,6-K,2024-03-21,,"AVINO SILVER & GOLD MINES LTD",316888,"=""ASM""","455 GRANVILLE STREET","SUITE 400",VANCOUVER,A1,"BRITISH COLUMBIA",Canada,,,"=""1000""","Metal mining",213114,"Support Activities for Metal Mining",34,1,12/31/23,"66,938,688",12/31/23,"43,889,000","542,000",,"128,340,000"
36954,"Proven and unproven reserves","Determination of Recoverable Amount – Refer to Notes 2 and 3 to the financial statements",531963,12/31/23,03/20/24,3,"Deloitte & Touche LLP",468,"Deloitte LLP",1208,Vancouver,A1,"BRITISH COLUMBIA",Canada,40-F,2024-03-29,,"AVINO SILVER & GOLD MINES LTD",316888,"=""ASM""","455 GRANVILLE STREET","SUITE 400",VANCOUVER,A1,"BRITISH COLUMBIA",Canada,,,"=""1000""","Metal mining",213114,"Support Activities for Metal Mining",34,1,12/31/23,"66,938,688",12/31/23,"43,889,000","542,000",,"128,340,000"
32945,"Depreciation and amortization","Vehicles - Depreciation Expense - United States Risk Vehicles - Refer to Notes 2 and 8 to the financial statements",524963,12/31/23,02/16/24,3,"Deloitte & Touche LLP",,,,"New York",NY,"NEW YORK","US Mid Atlantic",10-K,2024-02-16,,"AVIS BUDGET GROUP, INC.",723612,"=""CAR""","379 INTERPACE PARKWAY",,PARSIPPANY,NJ,"NEW JERSEY","US Mid Atlantic",,,"=""7510""","Services-Auto Rental & Leasing (No Drivers)",532111,"Passenger Car Rental",34,176,01/02/24,"6,362,277,888",12/31/23,"12,008,000,000","1,632,000,000","1,954,000,000","31,850,000,000"
32946,"Other contingent liabilities","Self-Insurance Reserves - Public Liability and Property Damage Claims - United States - Refer to Note 2 to the financial statements",524963,12/31/23,02/16/24,3,"Deloitte & Touche LLP",,,,"New York",NY,"NEW YORK","US Mid Atlantic",10-K,2024-02-16,,"AVIS BUDGET GROUP, INC.",723612,"=""CAR""","379 INTERPACE PARKWAY",,PARSIPPANY,NJ,"NEW JERSEY","US Mid Atlantic",,,"=""7510""","Services-Auto Rental & Leasing (No Drivers)",532111,"Passenger Car Rental",34,176,01/02/24,"6,362,277,888",12/31/23,"12,008,000,000","1,632,000,000","1,954,000,000","31,850,000,000"
33427,"Regulatory assets and liabilities","Regulatory Matters - Refer to Notes 1, 22, and 23 to the financial statements",525213,12/31/23,02/20/24,3,"Deloitte & Touche LLP",,,,Portland,OR,OREGON,"US West",10-K,2024-02-21,,"AVISTA CORP",104918,"=""AVA""","1411 E MISSION AVE",,SPOKANE,WA,WASHINGTON,"US West",,,"=""4931""","Electric and Other Services Combined",221210,"Natural Gas Distribution",34,36,12/31/23,"2,790,385,664",12/31/23,"1,751,554,000","171,180,000","2,432,897,000","7,702,477,000"
30994,"Other income taxes","Evaluation of accounting for income taxes",516073,07/01/23,08/18/23,4,"KPMG LLP",,,,Phoenix,AZ,ARIZONA,"US Southwest",10-K,2023-08-18,,"AVNET INC",8858,"=""AVT""","2211 SOUTH 47TH STREET",,PHOENIX,AZ,ARIZONA,"US Southwest",,,"=""5065""","Electronic Parts and Equipment, NEC",334419,"Other Electronic Component Manufacturing",34,48,09/30/23,"4,384,507,904",07/01/23,"26,536,881,000","770,828,000","3,971,040,000","12,477,159,000"
32880,"Other income taxes","Measurement of Unrecognized Tax Benefits",524758,12/31/23,02/15/24,1,"PricewaterhouseCoopers LLP",,,,Philadelphia,PA,PENNSYLVANIA,"US Mid Atlantic",10-K,2024-02-15,,"Axalta Coating Systems Ltd.",1616862,"=""AXTA""","1050 CONSTITUTION AVENUE",,PHILADELPHIA,PA,PENNSYLVANIA,"US Mid Atlantic",,,"=""2851""","Paints, Varnishes, Lacquers, Enamels, and Allied Products",325510,"Paint and Coating Manufacturing",34,33,01/02/24,"7,368,379,904",12/31/23,"5,184,100,000","267,400,000","-993,300,000","7,272,100,000"
34036,"Revenue from customer contracts","Systems Revenue recognition",525955,12/31/23,02/23/24,2,"Ernst & Young LLP",,,,Boston,MA,MASSACHUSETTS,"US New England",10-K,2024-02-23,,"AXCELIS TECHNOLOGIES INC",1113232,"=""ACLS""","108 CHERRY HILL DRIVE",,BEVERLY,MA,MASSACHUSETTS,"US New England",,,"=""3559""","Special  Industry Machinery, NEC",333295,"Semiconductor Machinery Manufacturing",34,125,01/02/24,"4,084,263,168",12/31/23,"1,130,604,000","246,263,000",,"1,281,967,000"
34037,Inventory,"Estimate of Excess Inventory",525955,12/31/23,02/23/24,2,"Ernst & Young LLP",,,,Boston,MA,MASSACHUSETTS,"US New England",10-K,2024-02-23,,"AXCELIS TECHNOLOGIES INC",1113232,"=""ACLS""","108 CHERRY HILL DRIVE",,BEVERLY,MA,MASSACHUSETTS,"US New England",,,"=""3559""","Special  Industry Machinery, NEC",333295,"Semiconductor Machinery Manufacturing",34,125,01/02/24,"4,084,263,168",12/31/23,"1,130,604,000","246,263,000",,"1,281,967,000"
34814,"Revenue from customer contracts","Systems Revenue recognition",526981,12/31/23,02/23/24,2,"Ernst & Young LLP",,,,Boston,MA,MASSACHUSETTS,"US New England",10-K/A,2024-02-28,,"AXCELIS TECHNOLOGIES INC",1113232,"=""ACLS""","108 CHERRY HILL DRIVE",,BEVERLY,MA,MASSACHUSETTS,"US New England",,,"=""3559""","Special  Industry Machinery, NEC",333295,"Semiconductor Machinery Manufacturing",34,125,01/02/24,"4,084,263,168",12/31/23,"1,130,604,000","246,263,000",,"1,281,967,000"
34815,Inventory,"Estimate of Excess Inventory",526981,12/31/23,02/23/24,2,"Ernst & Young LLP",,,,Boston,MA,MASSACHUSETTS,"US New England",10-K/A,2024-02-28,,"AXCELIS TECHNOLOGIES INC",1113232,"=""ACLS""","108 CHERRY HILL DRIVE",,BEVERLY,MA,MASSACHUSETTS,"US New England",,,"=""3559""","Special  Industry Machinery, NEC",333295,"Semiconductor Machinery Manufacturing",34,125,01/02/24,"4,084,263,168",12/31/23,"1,130,604,000","246,263,000",,"1,281,967,000"
34307,"Other contingent liabilities","Reserve for losses and loss expenses - Refer to Notes 2 and 8 to the consolidated financial statements",526671,12/31/23,02/27/24,3,"Deloitte & Touche LLP",506,"Deloitte Ltd",5230,Hamilton,D0,BERMUDA,Foreign,10-K,2024-02-27,,"AXIS CAPITAL HOLDINGS LTD",1214816,"=""AXS""","92 PITTS BAY ROAD",,PEMBROKE,D0,BERMUDA,Foreign,,,"=""6331""","Fire, Marine, and Casualty Insurance",524126,"Direct Property and Casualty Insurance Carriers",34,55,01/02/24,"4,712,159,232",12/31/23,"5,643,388,000","376,292,000","4,975,512,000","30,250,672,000"
35370,Inventory,"Inventory – Valuation Associated with Excess and Obsolete (E&O) Inventory — Refer to Notes 2 and 3 to the financial statements",528416,12/31/23,03/05/24,3,"Deloitte & Touche LLP",,,,Tampa,FL,FLORIDA,"US Southeast",10-K,2024-03-05,,"Axogen, Inc.",805928,"=""AXGN""","13631 PROGRESS BLVD.","SUITE 400",ALACHUA,FL,FLORIDA,"US Southeast",,,"=""3845""","Electromedical and Electrotherapeutic Apparatus",325412,"Pharmaceutical Preparation Manufacturing",34,7,12/31/23,"294,540,320",12/31/23,"159,012,000","-21,716,000","91,134,000","196,827,000"
33847,"Sales return and allowances","Reserves for Variable Consideration - Commercial Managed Care— Refer to Note 2 to the financial statements",526105,12/31/23,02/23/24,3,"Deloitte & Touche LLP",,,,Morristown,NJ,"NEW JERSEY","US Mid Atlantic",10-K,2024-02-23,,"Axsome Therapeutics, Inc.",1579428,"=""AXSM""","ONE WORLD TRADE CENTER, 29TH FLOOR",,"NEW YORK",NY,"NEW YORK","US Mid Atlantic",,,"=""2834""","Pharmaceutical Preparations",325412,"Pharmaceutical Preparation Manufacturing",34,77,01/02/24,"3,646,444,288",12/31/23,"270,600,000","-239,238,000","198,949,000","588,236,000"
31825,Goodwill,"Quantitative Goodwill Impairment Assessments - Certain Reporting Units",520422,09/30/23,11/29/23,1,"PricewaterhouseCoopers LLP",,,,Chicago,IL,ILLINOIS,"US Midwest",10-K,2023-11-29,,"AZEK Co Inc.",1782754,,"1330 W FULTON STREET, #350",,CHICAGO,IL,ILLINOIS,"US Midwest",,,"=""3089""","Plastics Products, NEC",332322,"Sheet Metal Work Manufacturing",34,29,10/02/23,"4,389,683,712",09/30/23,"1,370,316,000","62,361,000","216,545,000","2,343,876,000"
38590,Goodwill,"Quantitative Goodwill Impairment Assessments – Certain Reporting Units",537558,09/30/23,11/29/23,1,"PricewaterhouseCoopers LLP",,,,Chicago,IL,ILLINOIS,"US Midwest",10-K/A,2024-06-14,,"AZEK Co Inc.",1782754,,"1330 W FULTON STREET, #350",,CHICAGO,IL,ILLINOIS,"US Midwest",,,"=""3089""","Plastics Products, NEC",332322,"Sheet Metal Work Manufacturing",34,29,10/02/23,"4,389,683,712",09/30/23,"1,370,316,000","62,361,000","216,545,000","2,343,876,000"
31765,"Business combinations","Acquisition of B Medical Systems S.á.r.l. - Valuation of One Certain Completed Technology",520131,09/30/23,11/20/23,1,"PricewaterhouseCoopers LLP",,,,Boston,MA,MASSACHUSETTS,"US New England",10-K,2023-11-21,,"Azenta, Inc.",933974,"=""AZTA""","200 SUMMIT DRIVE","6TH FLOOR",BURLINGTON,MA,MASSACHUSETTS,"US New England",,,"=""3559""","Special  Industry Machinery, NEC",333298,"All Other Industrial Machinery Manufacturing",34,50,10/02/23,"2,993,859,328",09/30/23,"665,072,000","-14,257,000","1,455,860,000","2,885,720,000"
38333,"Revenue from customer contracts","Passenger revenue (including breakage)",536255,12/31/23,05/15/24,2,"Ernst & Young LLP",34,"Ernst & Young Auditores Independentes SS",1448,"São Paulo",D5,BRAZIL,Foreign,20-F,2024-05-16,,"AZUL SA",1432364,"=""AZULQ""","AV. MARCOS PENTEADO ULHOA RODRIGUES","NO. 939, 9 FLOOR, ED. JATOBA",BARUERI,D5,BRAZIL,Foreign,,,"=""4512""","Air Transportation, Scheduled",481111,"Scheduled Passenger Air Transportation",34,9,01/02/24,"1,005,751,488",12/31/23,"3,819,669,000","-490,048,000","-4,691,842,000","4,226,966,000"
38334,Leases,"Maintenance reserve",536255,12/31/23,05/15/24,2,"Ernst & Young LLP",34,"Ernst & Young Auditores Independentes SS",1448,"São Paulo",D5,BRAZIL,Foreign,20-F,2024-05-16,,"AZUL SA",1432364,"=""AZULQ""","AV. MARCOS PENTEADO ULHOA RODRIGUES","NO. 939, 9 FLOOR, ED. JATOBA",BARUERI,D5,BRAZIL,Foreign,,,"=""4512""","Air Transportation, Scheduled",481111,"Scheduled Passenger Air Transportation",34,9,01/02/24,"1,005,751,488",12/31/23,"3,819,669,000","-490,048,000","-4,691,842,000","4,226,966,000"
38335,"Going concern","Net working capital and capital structure",536255,12/31/23,05/15/24,2,"Ernst & Young LLP",34,"Ernst & Young Auditores Independentes SS",1448,"São Paulo",D5,BRAZIL,Foreign,20-F,2024-05-16,,"AZUL SA",1432364,"=""AZULQ""","AV. MARCOS PENTEADO ULHOA RODRIGUES","NO. 939, 9 FLOOR, ED. JATOBA",BARUERI,D5,BRAZIL,Foreign,,,"=""4512""","Air Transportation, Scheduled",481111,"Scheduled Passenger Air Transportation",34,9,01/02/24,"1,005,751,488",12/31/23,"3,819,669,000","-490,048,000","-4,691,842,000","4,226,966,000"
38336,"Long-lived assets","Modifications to aircraft right-of-use assets and lease liabilities",536255,12/31/23,05/15/24,2,"Ernst & Young LLP",34,"Ernst & Young Auditores Independentes SS",1448,"São Paulo",D5,BRAZIL,Foreign,20-F,2024-05-16,,"AZUL SA",1432364,"=""AZULQ""","AV. MARCOS PENTEADO ULHOA RODRIGUES","NO. 939, 9 FLOOR, ED. JATOBA",BARUERI,D5,BRAZIL,Foreign,,,"=""4512""","Air Transportation, Scheduled",481111,"Scheduled Passenger Air Transportation",34,9,01/02/24,"1,005,751,488",12/31/23,"3,819,669,000","-490,048,000","-4,691,842,000","4,226,966,000"
38428,"Revenue from customer contracts","Passenger revenue (including breakage)",536531,12/31/23,05/15/24,2,"Ernst & Young LLP",34,"Ernst & Young Auditores Independentes SS",1448,"São Paulo",D5,BRAZIL,Foreign,20-F/A,2024-05-24,,"AZUL SA",1432364,"=""AZULQ""","AV. MARCOS PENTEADO ULHOA RODRIGUES","NO. 939, 9 FLOOR, ED. JATOBA",BARUERI,D5,BRAZIL,Foreign,,,"=""4512""","Air Transportation, Scheduled",481111,"Scheduled Passenger Air Transportation",34,9,01/02/24,"1,005,751,488",12/31/23,"3,819,669,000","-490,048,000","-4,691,842,000","4,226,966,000"
38429,Leases,"Maintenance reserve",536531,12/31/23,05/15/24,2,"Ernst & Young LLP",34,"Ernst & Young Auditores Independentes SS",1448,"São Paulo",D5,BRAZIL,Foreign,20-F/A,2024-05-24,,"AZUL SA",1432364,"=""AZULQ""","AV. MARCOS PENTEADO ULHOA RODRIGUES","NO. 939, 9 FLOOR, ED. JATOBA",BARUERI,D5,BRAZIL,Foreign,,,"=""4512""","Air Transportation, Scheduled",481111,"Scheduled Passenger Air Transportation",34,9,01/02/24,"1,005,751,488",12/31/23,"3,819,669,000","-490,048,000","-4,691,842,000","4,226,966,000"
38430,"Going concern","Net working capital and capital structure",536531,12/31/23,05/15/24,2,"Ernst & Young LLP",34,"Ernst & Young Auditores Independentes SS",1448,"São Paulo",D5,BRAZIL,Foreign,20-F/A,2024-05-24,,"AZUL SA",1432364,"=""AZULQ""","AV. MARCOS PENTEADO ULHOA RODRIGUES","NO. 939, 9 FLOOR, ED. JATOBA",BARUERI,D5,BRAZIL,Foreign,,,"=""4512""","Air Transportation, Scheduled",481111,"Scheduled Passenger Air Transportation",34,9,01/02/24,"1,005,751,488",12/31/23,"3,819,669,000","-490,048,000","-4,691,842,000","4,226,966,000"
38431,"Long-lived assets","Modifications to aircraft right-of-use assets and lease liabilities",536531,12/31/23,05/15/24,2,"Ernst & Young LLP",34,"Ernst & Young Auditores Independentes SS",1448,"São Paulo",D5,BRAZIL,Foreign,20-F/A,2024-05-24,,"AZUL SA",1432364,"=""AZULQ""","AV. MARCOS PENTEADO ULHOA RODRIGUES","NO. 939, 9 FLOOR, ED. JATOBA",BARUERI,D5,BRAZIL,Foreign,,,"=""4512""","Air Transportation, Scheduled",481111,"Scheduled Passenger Air Transportation",34,9,01/02/24,"1,005,751,488",12/31/23,"3,819,669,000","-490,048,000","-4,691,842,000","4,226,966,000"
34676,"Other intangible assets","Assessment of the carrying values of certain indefinite-lived intangible assets",527015,12/30/23,02/28/24,4,"KPMG LLP",,,,"Short Hills",NJ,"NEW JERSEY","US Mid Atlantic",10-K,2024-02-28,,"B&G Foods, Inc.",1278027,"=""BGS""","FOUR GATEHALL DRIVE","SUITE 110",PARSIPPANY,NJ,"NEW JERSEY","US Mid Atlantic",,,"=""2000""","Food and Kindred Products",311999,"All Other Miscellaneous Food Manufacturing",34,11,12/28/23,"838,136,320",12/30/23,"2,062,313,000","-66,198,000","-1,411,772,000","3,463,290,000"
33685,"Business combinations","Valuation of certain assets acquired and liabilities assumed in the acquisition of Sabina Gold & Silver Corp.",525900,12/31/23,02/21/24,1,"PricewaterhouseCoopers LLP",191,"PricewaterhouseCoopers LLP Chartered Accountants",271,Vancouver,A1,"BRITISH COLUMBIA",Canada,6-K,2024-02-22,,"B2GOLD CORP",1429937,"=""BTG""","PARK PLACE","SUITE 3400 - 666 BURRARD STREET",VANCOUVER,A1,"BRITISH COLUMBIA",Canada,,,"=""1040""","Metal Mining",212221,"Gold Ore Mining",34,3,12/31/23,"4,115,571,968",12/31/23,"1,934,272,000","41,588,000",,"4,874,619,000"
33686,"Long-lived assets","Impairment of the Fekola Complex cash-generating unit (CGU)",525900,12/31/23,02/21/24,1,"PricewaterhouseCoopers LLP",191,"PricewaterhouseCoopers LLP Chartered Accountants",271,Vancouver,A1,"BRITISH COLUMBIA",Canada,6-K,2024-02-22,,"B2GOLD CORP",1429937,"=""BTG""","PARK PLACE","SUITE 3400 - 666 BURRARD STREET",VANCOUVER,A1,"BRITISH COLUMBIA",Canada,,,"=""1040""","Metal Mining",212221,"Gold Ore Mining",34,3,12/31/23,"4,115,571,968",12/31/23,"1,934,272,000","41,588,000",,"4,874,619,000"
36215,"Business combinations","Valuation of certain assets acquired and liabilities assumed in the acquisition of Sabina Gold & Silver Corp.",530163,12/31/23,02/21/24,1,"PricewaterhouseCoopers LLP",191,"PricewaterhouseCoopers LLP Chartered Accountants",271,Vancouver,A1,"BRITISH COLUMBIA",Canada,40-F,2024-03-15,,"B2GOLD CORP",1429937,"=""BTG""","PARK PLACE","SUITE 3400 - 666 BURRARD STREET",VANCOUVER,A1,"BRITISH COLUMBIA",Canada,,,"=""1040""","Metal Mining",212221,"Gold Ore Mining",34,3,12/31/23,"4,115,571,968",12/31/23,"1,934,272,000","41,588,000",,"4,874,619,000"
36216,"Long-lived assets","Impairment of the Fekola Complex cash-generating unit (CGU)",530163,12/31/23,02/21/24,1,"PricewaterhouseCoopers LLP",191,"PricewaterhouseCoopers LLP Chartered Accountants",271,Vancouver,A1,"BRITISH COLUMBIA",Canada,40-F,2024-03-15,,"B2GOLD CORP",1429937,"=""BTG""","PARK PLACE","SUITE 3400 - 666 BURRARD STREET",VANCOUVER,A1,"BRITISH COLUMBIA",Canada,,,"=""1040""","Metal Mining",212221,"Gold Ore Mining",34,3,12/31/23,"4,115,571,968",12/31/23,"1,934,272,000","41,588,000",,"4,874,619,000"
36087,"Revenue from customer contracts","Revenue Recognition and Contracts – Refer to Notes 2 and 6 to the financial statements",530235,12/31/23,03/15/24,3,"Deloitte & Touche LLP",,,,Cleveland,OH,OHIO,"US Midwest",10-K,2024-03-15,,"Babcock & Wilcox Enterprises, Inc.",1630805,"=""BW""","1200 E. MARKET STREET, SUITE 650",,AKRON,OH,OHIO,"US Midwest",,,"=""3433""","Heating Equipment, Except Electric and Warm Air Furnaces",333414,"Heating Equipment (except Warm Air Furnaces) Manufacturing",34,1,12/31/23,"130,595,536",12/31/23,"727,315,000","-197,208,000","-309,663,000","775,700,000"
33045,"Warranty liabilities","Warranty and After-Sale Costs Reserve",525000,12/31/23,02/16/24,2,"Ernst & Young LLP",,,,Milwaukee,WI,WISCONSIN,"US Midwest",10-K,2024-02-16,,"BADGER METER INC",9092,"=""BMI""","4545 WEST BROWN DEER ROAD",,MILWAUKEE,WI,WISCONSIN,"US Midwest",,,"=""3824""","Totalizing Fluid Meters and Counting Devices",335313,"Switchgear and Switchboard Apparatus Manufacturing",34,156,01/02/24,"4,589,557,760",12/31/23,"703,592,000","92,598,000","349,582,000","716,919,000"
36218,"Equity investments and joint ventures","Impairment assessment of equity method investments and equity investments accounted for using the measurement alternative",530165,12/31/23,03/15/24,2,"Ernst & Young LLP",211,"Ernst & Young Hua Ming LLP",1408,Beijing,F4,CHINA,Foreign,20-F,2024-03-15,,"Baidu, Inc.",1329099,"=""BIDU""","BAIDU CAMPUS, NO. 10 SHANGDI 10TH STREET","HAIDIAN DISTRICT",BEIJING,F4,CHINA,Foreign,,,"=""7370""","Services-Computer Programming, Data Processing, Etc.",518210,"Data Processing, Hosting, and Related Services",34,115,01/02/24,"32,504,039,424",12/31/23,"18,978,000,000","2,864,000,000","29,509,000,000","57,353,000,000"
34453,"Equity investments and joint ventures","Valuation of Portfolio Investments – Certain Level 3 Portfolio Investments in Loans, Subordinated Debt, Preferred Equity, and Equity Interests Valued Using Significant Unobservable Inputs",526584,12/31/23,02/27/24,1,"PricewaterhouseCoopers LLP",,,,Boston,MA,MASSACHUSETTS,"US New England",10-K,2024-02-27,,"Bain Capital Specialty Finance, Inc.",1655050,"=""BCSF""","C/O BAIN CAPITAL CREDIT, LP","200 CLARENDON STREET",BOSTON,MA,MASSACHUSETTS,"US New England",,,,,525990,"Other Financial Vehicles",34,15,01/02/24,"976,827,072",12/31/23,"217,781,000","123,375,000",,"2,472,348,000"
32355,"Revenue from customer contracts","Revenue recognition on certain agreements for sales of equipment manufactured to unique customer specifications",524018,12/31/23,02/05/24,4,"KPMG LLP",,,,Houston,TX,TEXAS,"US Southwest",10-K,2024-02-05,,"Baker Hughes Co",1701605,"=""BKR""","575 NORTH DAIRY ASHFORD ROAD, SUITE 100",,HOUSTON,TX,TEXAS,"US Southwest",40545,"GENERAL ELECTRIC CO","=""3533""","Oil and Gas Field Machinery and Equipment",333132,"Oil and Gas Field Machinery and Equipment Manufacturing",34,34,01/02/24,"34,141,515,776",12/31/23,"25,506,000,000","1,943,000,000","5,138,000,000","36,945,000,000"
34612,"Other contingent liabilities","Valuation of Contingent Earnout Liabilities",527129,12/31/23,02/28/24,1,"PricewaterhouseCoopers LLP",,,,Tampa,FL,FLORIDA,"US Southeast",10-K,2024-02-28,,"Baldwin Insurance Group, Inc.",1781755,"=""BWIN""","4211 W. BOY SCOUT BLVD.","SUITE 800",TAMPA,FL,FLORIDA,"US Southeast",,,"=""6411""","Insurance Agents, Brokers, and Service",524210,"Insurance Agencies and Brokerages",34,24,01/02/24,"1,521,765,248",12/31/23,"1,218,555,000","-90,141,000","-1,868,906,000","3,501,937,000"
33095,"Revenue from customer contracts","Revenue Recognition - Estimated Costs at Completion for Aerospace Fixed-Price Contracts",525117,12/31/23,02/20/24,1,"PricewaterhouseCoopers LLP",,,,Denver,CO,COLORADO,"US West",10-K,2024-02-20,,"BALL Corp",9389,"=""BALL""","9200 W. 108TH CIRCLE",,WESTMINSTER,CO,COLORADO,"US West",,,"=""3411""","Metal Cans",322215,"Nonfolding Sanitary Food Container Manufacturing",34,57,01/02/24,"17,965,862,912",12/31/23,"14,029,000,000","707,000,000","-1,830,000,000","19,303,000,000"
35771,"Revenue from customer contracts","Estimated costs to complete engineering and technology transfer services for long-term fixed-price contracts",529592,12/31/23,03/08/24,4,"KPMG LLP",187,"KPMG LLP Chartered Accountants",85,Vancouver,A1,"BRITISH COLUMBIA",Canada,40-F,2024-03-11,,"Ballard Power Systems Inc.",1453015,"=""BLDP""","9000 GLENLYON PARKWAY",,BURNABY,A1,"BRITISH COLUMBIA",Canada,,,"=""3620""","Electrical Industrial Apparatus",335999,"All Other Miscellaneous Electrical Equipment and Component Manufacturing",34,4,01/02/24,"1,089,138,816",12/31/23,"102,368,000","-177,716,000","949,533,000","1,077,542,000"
36094,Goodwill,"Goodwill – International Interactive Reporting Unit – Refer to Notes 2 and 10 to the financial statements.",530211,12/31/23,03/15/24,3,"Deloitte & Touche LLP",,,,"New York",NY,"NEW YORK","US Mid Atlantic",10-K,2024-03-15,,"Bally's Corp",1747079,"=""BALY""","100 WESTMINSTER STREET",,PROVIDENCE,RI,"RHODE ISLAND","US New England",,,"=""7011""","Hotels and Motels",721120,"Casino Hotels",34,13,01/02/24,"613,166,208",12/31/23,"2,449,073,000","-187,500,000","-3,171,805,000","6,861,103,000"
36095,"Other intangible assets","Gaming Licenses – Refer to Notes 2 and 10 to the financial statements.",530211,12/31/23,03/15/24,3,"Deloitte & Touche LLP",,,,"New York",NY,"NEW YORK","US Mid Atlantic",10-K,2024-03-15,,"Bally's Corp",1747079,"=""BALY""","100 WESTMINSTER STREET",,PROVIDENCE,RI,"RHODE ISLAND","US New England",,,"=""7011""","Hotels and Motels",721120,"Casino Hotels",34,13,01/02/24,"613,166,208",12/31/23,"2,449,073,000","-187,500,000","-3,171,805,000","6,861,103,000"
33267,"Regulatory assets and liabilities","Accounting for the Effects of Rate Regulation",525296,12/31/23,02/21/24,1,"PricewaterhouseCoopers LLP",,,,Baltimore,MD,MARYLAND,"US Mid Atlantic",10-K,2024-02-21,,"BALTIMORE GAS & ELECTRIC CO",9466,,"2 CENTER PLAZA","110 W. FAYETTE STREET",BALTIMORE,MD,MARYLAND,"US Mid Atlantic",1004440,"CONSTELLATION ENERGY GROUP INC","=""4931""","Electric and Other Services Combined",221122,"Electric Power Distribution",34,,,,12/31/23,"4,027,000,000","485,000,000",,"14,184,000,000"
35119,"Allowance for credit losses","Allowance for credit losses for loans and leases collectively evaluated",527376,12/31/23,02/29/24,4,"KPMG LLP",,,,Irvine,CA,CALIFORNIA,"US West",10-K,2024-02-29,,"BANC OF CALIFORNIA, INC.",1169770,"=""BANC""","3 MACARTHUR PLACE",,"SANTA ANA",CA,CALIFORNIA,"US West",,,"=""6021""","National Commercial Banks",522120,"Savings Institutions",34,13,01/02/24,"757,090,240",12/31/23,"246,843,000","-1,899,137,000","3,026,661,000","38,534,064,000"
35120,Goodwill,"Valuation of Goodwill",527376,12/31/23,02/29/24,4,"KPMG LLP",,,,Irvine,CA,CALIFORNIA,"US West",10-K,2024-02-29,,"BANC OF CALIFORNIA, INC.",1169770,"=""BANC""","3 MACARTHUR PLACE",,"SANTA ANA",CA,CALIFORNIA,"US West",,,"=""6021""","National Commercial Banks",522120,"Savings Institutions",34,13,01/02/24,"757,090,240",12/31/23,"246,843,000","-1,899,137,000","3,026,661,000","38,534,064,000"
35121,"Business combinations","Determination of the accounting acquirer",527376,12/31/23,02/29/24,4,"KPMG LLP",,,,Irvine,CA,CALIFORNIA,"US West",10-K,2024-02-29,,"BANC OF CALIFORNIA, INC.",1169770,"=""BANC""","3 MACARTHUR PLACE",,"SANTA ANA",CA,CALIFORNIA,"US West",,,"=""6021""","National Commercial Banks",522120,"Savings Institutions",34,13,01/02/24,"757,090,240",12/31/23,"246,843,000","-1,899,137,000","3,026,661,000","38,534,064,000"
35122,"Business combinations","Valuation of loans and leases and the core deposit intangible assets in connection with the reverse merger accounting",527376,12/31/23,02/29/24,4,"KPMG LLP",,,,Irvine,CA,CALIFORNIA,"US West",10-K,2024-02-29,,"BANC OF CALIFORNIA, INC.",1169770,"=""BANC""","3 MACARTHUR PLACE",,"SANTA ANA",CA,CALIFORNIA,"US West",,,"=""6021""","National Commercial Banks",522120,"Savings Institutions",34,13,01/02/24,"757,090,240",12/31/23,"246,843,000","-1,899,137,000","3,026,661,000","38,534,064,000"
37661,"Allowance for credit losses","Impairment of financial assets",533609,12/31/23,04/17/24,2,"Ernst & Young LLP",134,"Pistrelli Henry Martin y Asociados SRL (Inactive)",1449,"Buenos Aires",C1,ARGENTINA,Foreign,20-F,2024-04-17,,"Banco BBVA Argentina S.A.",913059,"=""BBAR""","AV. CORDOBA 111",,"BUENOS AIRES",C1,ARGENTINA,Foreign,,,"=""6029""","Commercial Banks, NEC",522110,"Commercial Banking",34,5,12/31/23,"1,111,047,424",12/31/23,"5,868,528,000","423,558,000","1,686,676,000","7,557,376,000"
35265,"Allowance for credit losses","Expected credit losses related to loans and advances to customers",527971,12/31/23,03/01/24,2,"Ernst & Young LLP",163,"Ernst & Young SL",1461,Madrid,U3,SPAIN,Foreign,20-F,2024-03-01,,"BANCO BILBAO VIZCAYA ARGENTARIA, S.A.",842180,"=""BBVA""","CALLE AZUL 4",,BILBOA,U3,SPAIN,Foreign,,,"=""6029""","Commercial Banks, NEC",522110,"Commercial Banking",33,9,12/31/23,"53,183,635,456",12/31/23,"33,042,000,000","8,577,000,000","73,929,000,000","856,725,000,000"
35266,"Other investments","Measurement of fair value of certain financial instruments",527971,12/31/23,03/01/24,2,"Ernst & Young LLP",163,"Ernst & Young SL",1461,Madrid,U3,SPAIN,Foreign,20-F,2024-03-01,,"BANCO BILBAO VIZCAYA ARGENTARIA, S.A.",842180,"=""BBVA""","CALLE AZUL 4",,BILBOA,U3,SPAIN,Foreign,,,"=""6029""","Commercial Banks, NEC",522110,"Commercial Banking",33,9,12/31/23,"53,183,635,456",12/31/23,"33,042,000,000","8,577,000,000","73,929,000,000","856,725,000,000"
34097,"Allowance for credit losses","Measurement of expected credit losses",526433,12/31/23,02/26/24,1,"PricewaterhouseCoopers LLP",91,"PricewaterhouseCoopers Auditores Independentes",1351,"São Paulo",D5,BRAZIL,Foreign,20-F,2024-02-26,,"Banco Santander (Brasil) S.A.",1471055,"=""BSBR""","AV. JUSCELINO KUBITSCHEK, 2235","AV. JUSCELINO KUBITSCHEK, 2041","SAO PAULO, SP",D5,BRAZIL,Foreign,891478,"Banco Santander, S.A.","=""6029""","Commercial Banks, NEC",522110,"Commercial Banking",34,7,12/31/23,"48,759,148,544",12/31/23,"6,828,556,000","1,740,615,000","16,896,716,000","229,671,602,000"
34098,"Other contingent liabilities","Provisions for judicial and administrative proceedings",526433,12/31/23,02/26/24,1,"PricewaterhouseCoopers LLP",91,"PricewaterhouseCoopers Auditores Independentes",1351,"São Paulo",D5,BRAZIL,Foreign,20-F,2024-02-26,,"Banco Santander (Brasil) S.A.",1471055,"=""BSBR""","AV. JUSCELINO KUBITSCHEK, 2235","AV. JUSCELINO KUBITSCHEK, 2041","SAO PAULO, SP",D5,BRAZIL,Foreign,891478,"Banco Santander, S.A.","=""6029""","Commercial Banks, NEC",522110,"Commercial Banking",34,7,12/31/23,"48,759,148,544",12/31/23,"6,828,556,000","1,740,615,000","16,896,716,000","229,671,602,000"
33764,"Allowance for credit losses","Expected Credit Loss Allowance for Commercial, Mortgage and Consumer Loans – Collective Basis",525486,12/31/23,02/20/24,1,"PricewaterhouseCoopers LLP",93,"PricewaterhouseCoopers Consultores Auditores y Compania Limitada",1364,Santiago,F3,CHILE,Foreign,20-F,2024-02-22,,"BANCO SANTANDER CHILE",1027552,"=""BSAC""","BANDERA 140, PISO 19",,SANTIAGO,F3,CHILE,Foreign,891478,"Banco Santander, S.A.","=""6029""","Commercial Banks, NEC",522293,"International Trade Financing",34,19,01/02/24,"9,153,770,496",12/31/23,"1,833,000,000","680,000,000","5,863,000,000","81,052,000,000"
33414,"Accounts/loans receivable","Estimation of impairment of financial assets at amortised cost– loans and advances to customers",525343,12/31/23,02/21/24,1,"PricewaterhouseCoopers LLP",117,"PricewaterhouseCoopers Auditores SL",1306,Madrid,U3,SPAIN,Foreign,20-F,2024-02-21,,"Banco Santander, S.A.",891478,"=""SAN""","CIUDAD GRUPO SANTANDER","BOADILLA DEL MONTE",MADRID,U3,SPAIN,Foreign,,,"=""6029""","Commercial Banks, NEC",522110,"Commercial Banking",34,4,01/02/24,"70,032,654,336",12/31/23,"48,629,000,000","12,616,000,000","530,807,000,000","1,985,134,000,000"
33415,Goodwill,"Goodwill Impairment Assessment of Certain Cash Generating Unit (CGU)",525343,12/31/23,02/21/24,1,"PricewaterhouseCoopers LLP",117,"PricewaterhouseCoopers Auditores SL",1306,Madrid,U3,SPAIN,Foreign,20-F,2024-02-21,,"Banco Santander, S.A.",891478,"=""SAN""","CIUDAD GRUPO SANTANDER","BOADILLA DEL MONTE",MADRID,U3,SPAIN,Foreign,,,"=""6029""","Commercial Banks, NEC",522110,"Commercial Banking",34,4,01/02/24,"70,032,654,336",12/31/23,"48,629,000,000","12,616,000,000","530,807,000,000","1,985,134,000,000"
33416,"Other contingent liabilities","Litigation provisions and contingencies",525343,12/31/23,02/21/24,1,"PricewaterhouseCoopers LLP",117,"PricewaterhouseCoopers Auditores SL",1306,Madrid,U3,SPAIN,Foreign,20-F,2024-02-21,,"Banco Santander, S.A.",891478,"=""SAN""","CIUDAD GRUPO SANTANDER","BOADILLA DEL MONTE",MADRID,U3,SPAIN,Foreign,,,"=""6029""","Commercial Banks, NEC",522110,"Commercial Banking",34,4,01/02/24,"70,032,654,336",12/31/23,"48,629,000,000","12,616,000,000","530,807,000,000","1,985,134,000,000"
36653,"Allowance for credit losses","Allowance for loans, advances and lease losses",531120,12/31/23,03/26/24,1,"PricewaterhouseCoopers LLP",812,"PwC Contadores y Auditores Ltda",6466,Medellin,F8,COLOMBIA,Foreign,20-F,2024-03-26,,"BANCOLOMBIA SA",1071371,,"AVENIDA LOS INDUSTRIALES","CARRERA 48 # 26 -85",MEDELLIN,F8,COLOMBIA,Foreign,,,"=""6029""","Commercial Banks, NEC",522110,"Commercial Banking",34,31,01/02/24,"3,531,076,096",12/31/23,"5,444,000,000","1,604,000,000","7,641,000,000","88,521,000,000"
36654,Goodwill,"Goodwill Impairment Assessment",531120,12/31/23,03/26/24,1,"PricewaterhouseCoopers LLP",812,"PwC Contadores y Auditores Ltda",6466,Medellin,F8,COLOMBIA,Foreign,20-F,2024-03-26,,"BANCOLOMBIA SA",1071371,,"AVENIDA LOS INDUSTRIALES","CARRERA 48 # 26 -85",MEDELLIN,F8,COLOMBIA,Foreign,,,"=""6029""","Commercial Banks, NEC",522110,"Commercial Banking",34,31,01/02/24,"3,531,076,096",12/31/23,"5,444,000,000","1,604,000,000","7,641,000,000","88,521,000,000"
37433,"Allowance for credit losses","Allowance for loans, advances and lease losses",533006,12/31/23,03/26/24,1,"PricewaterhouseCoopers LLP",812,"PwC Contadores y Auditores Ltda",6466,Medellin,F8,COLOMBIA,Foreign,6-K,2024-04-10,,"BANCOLOMBIA SA",1071371,,"AVENIDA LOS INDUSTRIALES","CARRERA 48 # 26 -85",MEDELLIN,F8,COLOMBIA,Foreign,,,"=""6029""","Commercial Banks, NEC",522110,"Commercial Banking",34,31,01/02/24,"3,531,076,096",12/31/23,"5,444,000,000","1,604,000,000","7,641,000,000","88,521,000,000"
37434,Goodwill,"Goodwill Impairment Assessment",533006,12/31/23,03/26/24,1,"PricewaterhouseCoopers LLP",812,"PwC Contadores y Auditores Ltda",6466,Medellin,F8,COLOMBIA,Foreign,6-K,2024-04-10,,"BANCOLOMBIA SA",1071371,,"AVENIDA LOS INDUSTRIALES","CARRERA 48 # 26 -85",MEDELLIN,F8,COLOMBIA,Foreign,,,"=""6029""","Commercial Banks, NEC",522110,"Commercial Banking",34,31,01/02/24,"3,531,076,096",12/31/23,"5,444,000,000","1,604,000,000","7,641,000,000","88,521,000,000"
34722,"Revenue from customer contracts","Revenue Recognition",527059,12/31/23,02/28/24,2,"Ernst & Young LLP",,,,Raleigh,NC,"NORTH CAROLINA","US Southeast",10-K,2024-02-28,,"Bandwidth Inc.",1514416,"=""BAND""","2230 BANDMATE WAY",,RALEIGH,NC,"NORTH CAROLINA","US Southeast",,,"=""7372""","Prepackaged Software",511210,"Software Publishers",34,14,12/31/23,"350,262,848",12/31/23,"601,117,000","-16,343,000","-205,396,000","1,101,048,000"
38031,"Allowance for credit losses","Assessment of the allowance for expected credit losses on loans and advances to customers, loan commitments, financial guarantees, financial assets at fair value through other comprehensive income and securities at amortized cost",535037,12/31/23,04/29/24,4,"KPMG LLP",61,"KPMG Auditores Independentes",1124,"São Paulo",D5,BRAZIL,Foreign,20-F,2024-04-29,,"BANK BRADESCO",1160330,"=""BBD""","CIDADE DE DEUS S/N VILA YARA",OSASCO,"SAO PAULO",D5,BRAZIL,Foreign,,,"=""6022""","State Commercial Banks",522110,"Commercial Banking",34,3,01/02/24,"18,166,579,200",12/31/23,"14,031,042,000","2,985,582,000","29,690,344,000","396,805,675,000"
38032,"Other contingent liabilities","Evaluation of the measurement of provisions and the disclosure of contingent liabilities tax and civil lawsuits",535037,12/31/23,04/29/24,4,"KPMG LLP",61,"KPMG Auditores Independentes",1124,"São Paulo",D5,BRAZIL,Foreign,20-F,2024-04-29,,"BANK BRADESCO",1160330,"=""BBD""","CIDADE DE DEUS S/N VILA YARA",OSASCO,"SAO PAULO",D5,BRAZIL,Foreign,,,"=""6022""","State Commercial Banks",522110,"Commercial Banking",34,3,01/02/24,"18,166,579,200",12/31/23,"14,031,042,000","2,985,582,000","29,690,344,000","396,805,675,000"
38033,"Deferred income taxes","Assessment of the recoverability of deferred tax assets",535037,12/31/23,04/29/24,4,"KPMG LLP",61,"KPMG Auditores Independentes",1124,"São Paulo",D5,BRAZIL,Foreign,20-F,2024-04-29,,"BANK BRADESCO",1160330,"=""BBD""","CIDADE DE DEUS S/N VILA YARA",OSASCO,"SAO PAULO",D5,BRAZIL,Foreign,,,"=""6022""","State Commercial Banks",522110,"Commercial Banking",34,3,01/02/24,"18,166,579,200",12/31/23,"14,031,042,000","2,985,582,000","29,690,344,000","396,805,675,000"
38034,"Insurance contract liabilities","Measurement of certain liabilities from insurance contracts issued under the general measurement and the variable fee approach model",535037,12/31/23,04/29/24,4,"KPMG LLP",61,"KPMG Auditores Independentes",1124,"São Paulo",D5,BRAZIL,Foreign,20-F,2024-04-29,,"BANK BRADESCO",1160330,"=""BBD""","CIDADE DE DEUS S/N VILA YARA",OSASCO,"SAO PAULO",D5,BRAZIL,Foreign,,,"=""6022""","State Commercial Banks",522110,"Commercial Banking",34,3,01/02/24,"18,166,579,200",12/31/23,"14,031,042,000","2,985,582,000","29,690,344,000","396,805,675,000"
33114,"Allowance for credit losses","Allowance for Loan and Lease Losses - Commercial and Consumer Card Loans",525163,12/31/23,02/20/24,1,"PricewaterhouseCoopers LLP",,,,Charlotte,NC,"NORTH CAROLINA","US Southeast",10-K,2024-02-20,,"BANK OF AMERICA CORP /DE/",70858,"=""BAC""","BANK OF AMERICA CORPORATE CENTER","100 N TRYON ST",CHARLOTTE,NC,"NORTH CAROLINA","US Southeast",,,"=""6021""","National Commercial Banks",522110,"Commercial Banking",34,34,01/02/24,"268,275,515,392",12/31/23,"94,187,000,000","26,515,000,000","222,625,000,000","3,180,151,000,000"
33115,"Other investments","Valuation of Certain Level 3 Financial Instruments",525163,12/31/23,02/20/24,1,"PricewaterhouseCoopers LLP",,,,Charlotte,NC,"NORTH CAROLINA","US Southeast",10-K,2024-02-20,,"BANK OF AMERICA CORP /DE/",70858,"=""BAC""","BANK OF AMERICA CORPORATE CENTER","100 N TRYON ST",CHARLOTTE,NC,"NORTH CAROLINA","US Southeast",,,"=""6021""","National Commercial Banks",522110,"Commercial Banking",34,34,01/02/24,"268,275,515,392",12/31/23,"94,187,000,000","26,515,000,000","222,625,000,000","3,180,151,000,000"
37940,"Allowance for credit losses","Allowance for loan losses",534573,12/31/23,04/25/24,2,"Ernst & Young LLP",894,"EY Servicios Profesionales de Auditoria y Asesorias Limitada",1431,Santiago,F3,CHILE,Foreign,20-F,2024-04-26,,"BANK OF CHILE",1161125,"=""BCH""","PASEO AHUMADA 251",,SANTIAGO,F3,CHILE,Foreign,,,"=""6029""","Commercial Banks, NEC",522110,"Commercial Banking",34,23,12/31/23,"11,657,371,170",12/31/23,"3,379,336,338","1,419,289,991",,"63,729,042,402"
34929,"Allowance for credit losses","Allowance for Credit Losses – Loans and Leases",527653,12/31/23,02/29/24,2,"Ernst & Young LLP",,,,Honolulu,HI,HAWAII,"US West",10-K,2024-02-29,,"BANK OF HAWAII CORP",46195,"=""BOH""","130 MERCHANT STREET",,HONOLULU,HI,HAWAII,"US West",,,"=""6022""","State Commercial Banks",522110,"Commercial Banking",34,73,01/02/24,"2,884,301,312",12/31/23,"664,634,000","171,202,000","1,382,725,000","23,733,296,000"
31854,"Business combinations","Valuation of the Loans Acquired in the Bank of the West Acquisition",520611,10/31/23,12/01/23,4,"KPMG LLP",187,"KPMG LLP Chartered Accountants",85,Toronto,A6,ONTARIO,Canada,40-F,2023-12-01,,"BANK OF MONTREAL /CAN/",927971,"=""BMO""","FIRST CANADIAN PLACE",*,TORONTO,A6,ONTARIO,Canada,,,"=""6029""","Commercial Banks, NEC",521110,"Monetary Authorities - Central Bank",34,79,11/02/23,"53,214,011,392",10/31/23,"19,508,000,000","3,196,000,000","39,665,000,000","931,587,000,000"
31855,"Allowance for credit losses","Assessment of the Allowances for Credit Losses for Loans",520611,10/31/23,12/01/23,4,"KPMG LLP",187,"KPMG LLP Chartered Accountants",85,Toronto,A6,ONTARIO,Canada,40-F,2023-12-01,,"BANK OF MONTREAL /CAN/",927971,"=""BMO""","FIRST CANADIAN PLACE",*,TORONTO,A6,ONTARIO,Canada,,,"=""6029""","Commercial Banks, NEC",521110,"Monetary Authorities - Central Bank",34,79,11/02/23,"53,214,011,392",10/31/23,"19,508,000,000","3,196,000,000","39,665,000,000","931,587,000,000"
31856,"Other investments","Assessment of the Measurement of the Fair Value of Certain Securities",520611,10/31/23,12/01/23,4,"KPMG LLP",187,"KPMG LLP Chartered Accountants",85,Toronto,A6,ONTARIO,Canada,40-F,2023-12-01,,"BANK OF MONTREAL /CAN/",927971,"=""BMO""","FIRST CANADIAN PLACE",*,TORONTO,A6,ONTARIO,Canada,,,"=""6029""","Commercial Banks, NEC",521110,"Monetary Authorities - Central Bank",34,79,11/02/23,"53,214,011,392",10/31/23,"19,508,000,000","3,196,000,000","39,665,000,000","931,587,000,000"
31857,"Uncertain tax positions","Assessment of Income Tax Uncertainties",520611,10/31/23,12/01/23,4,"KPMG LLP",187,"KPMG LLP Chartered Accountants",85,Toronto,A6,ONTARIO,Canada,40-F,2023-12-01,,"BANK OF MONTREAL /CAN/",927971,"=""BMO""","FIRST CANADIAN PLACE",*,TORONTO,A6,ONTARIO,Canada,,,"=""6029""","Commercial Banks, NEC",521110,"Monetary Authorities - Central Bank",34,79,11/02/23,"53,214,011,392",10/31/23,"19,508,000,000","3,196,000,000","39,665,000,000","931,587,000,000"
31858,"Insurance contract liabilities","Assessment of Insurance-related Liabilities",520611,10/31/23,12/01/23,4,"KPMG LLP",187,"KPMG LLP Chartered Accountants",85,Toronto,A6,ONTARIO,Canada,40-F,2023-12-01,,"BANK OF MONTREAL /CAN/",927971,"=""BMO""","FIRST CANADIAN PLACE",*,TORONTO,A6,ONTARIO,Canada,,,"=""6029""","Commercial Banks, NEC",521110,"Monetary Authorities - Central Bank",34,79,11/02/23,"53,214,011,392",10/31/23,"19,508,000,000","3,196,000,000","39,665,000,000","931,587,000,000"
33362,"Allowance for credit losses","Allowance for Credit Losses",525433,12/31/23,02/21/24,1,"PricewaterhouseCoopers LLP",90,"PricewaterhouseCoopers Ltd",1403,Hamilton,D0,BERMUDA,Foreign,20-F,2024-02-21,,"Bank of N.T. Butterfield & Son Ltd",1653242,"=""NTB""","65 FRONT STREET",,HAMILTON,D0,BERMUDA,Foreign,,,"=""6029""","Commercial Banks, NEC",522110,"Commercial Banking",34,32,12/31/23,"1,501,268,992",12/31/23,"578,597,000","225,492,000","904,690,000","13,374,020,000"
34799,"Allowance for credit losses","Quantitative component of BNY Mellon’s pooled allowance for credit losses for loans and lending-related commitments related to higher risk-rated and pass-rated commercial and institutional credits and loans secured by commercial real estate",527070,12/31/23,02/28/24,4,"KPMG LLP",,,,"New York",NY,"NEW YORK","US Mid Atlantic",10-K,2024-02-28,,"Bank of New York Mellon Corp",1390777,"=""BK""","240 GREENWICH STREET",,"NEW YORK",NY,"NEW YORK","US Mid Atlantic",,,"=""6022""","State Commercial Banks",522110,"Commercial Banking",34,52,01/02/24,"40,284,057,600",12/31/23,"17,578,000,000","3,302,000,000","21,844,000,000","409,953,000,000"
34800,"Other contingent liabilities","Identification and measurement of accruals for litigation and regulatory contingencies",527070,12/31/23,02/28/24,4,"KPMG LLP",,,,"New York",NY,"NEW YORK","US Mid Atlantic",10-K,2024-02-28,,"Bank of New York Mellon Corp",1390777,"=""BK""","240 GREENWICH STREET",,"NEW YORK",NY,"NEW YORK","US Mid Atlantic",,,"=""6022""","State Commercial Banks",522110,"Commercial Banking",34,52,01/02/24,"40,284,057,600",12/31/23,"17,578,000,000","3,302,000,000","21,844,000,000","409,953,000,000"
34801,Goodwill,"Valuation of goodwill for the Investment Management reporting unit",527070,12/31/23,02/28/24,4,"KPMG LLP",,,,"New York",NY,"NEW YORK","US Mid Atlantic",10-K,2024-02-28,,"Bank of New York Mellon Corp",1390777,"=""BK""","240 GREENWICH STREET",,"NEW YORK",NY,"NEW YORK","US Mid Atlantic",,,"=""6022""","State Commercial Banks",522110,"Commercial Banking",34,52,01/02/24,"40,284,057,600",12/31/23,"17,578,000,000","3,302,000,000","21,844,000,000","409,953,000,000"
31801,"Allowance for credit losses","(i) Assessment of Allowance for Credit Losses on Financial Assets (ACL)",520352,10/31/23,11/28/23,4,"KPMG LLP",187,"KPMG LLP Chartered Accountants",85,Toronto,A6,ONTARIO,Canada,6-K,2023-11-28,,"BANK OF NOVA SCOTIA",9631,"=""BNS""","40 TEMPERANCE STREET",,TORONTO,A6,ONTARIO,Canada,,,"=""6022""","State Commercial Banks",522110,"Commercial Banking",34,40,10/31/23,"49,132,376,064",10/31/23,"20,807,000,000","5,338,000,000","42,967,000,000","1,016,419,000,000"
31802,"Other investments","(ii) Assessment of the Measurement of Fair Value of Certain Financial Instruments",520352,10/31/23,11/28/23,4,"KPMG LLP",187,"KPMG LLP Chartered Accountants",85,Toronto,A6,ONTARIO,Canada,6-K,2023-11-28,,"BANK OF NOVA SCOTIA",9631,"=""BNS""","40 TEMPERANCE STREET",,TORONTO,A6,ONTARIO,Canada,,,"=""6022""","State Commercial Banks",522110,"Commercial Banking",34,40,10/31/23,"49,132,376,064",10/31/23,"20,807,000,000","5,338,000,000","42,967,000,000","1,016,419,000,000"
31803,"Uncertain tax positions","(iii) Assessment of Uncertain Tax Provisions",520352,10/31/23,11/28/23,4,"KPMG LLP",187,"KPMG LLP Chartered Accountants",85,Toronto,A6,ONTARIO,Canada,6-K,2023-11-28,,"BANK OF NOVA SCOTIA",9631,"=""BNS""","40 TEMPERANCE STREET",,TORONTO,A6,ONTARIO,Canada,,,"=""6022""","State Commercial Banks",522110,"Commercial Banking",34,40,10/31/23,"49,132,376,064",10/31/23,"20,807,000,000","5,338,000,000","42,967,000,000","1,016,419,000,000"
31807,"Allowance for credit losses","(i) Assessment of Allowance for Credit Losses on Financial Assets (ACL)",520359,10/31/23,11/28/23,4,"KPMG LLP",187,"KPMG LLP Chartered Accountants",85,Toronto,A6,ONTARIO,Canada,40-F,2023-11-28,,"BANK OF NOVA SCOTIA",9631,"=""BNS""","40 TEMPERANCE STREET",,TORONTO,A6,ONTARIO,Canada,,,"=""6022""","State Commercial Banks",522110,"Commercial Banking",34,40,10/31/23,"49,132,376,064",10/31/23,"20,807,000,000","5,338,000,000","42,967,000,000","1,016,419,000,000"
31808,"Other investments","(ii) Assessment of the Measurement of Fair Value of Certain Financial Instruments",520359,10/31/23,11/28/23,4,"KPMG LLP",187,"KPMG LLP Chartered Accountants",85,Toronto,A6,ONTARIO,Canada,40-F,2023-11-28,,"BANK OF NOVA SCOTIA",9631,"=""BNS""","40 TEMPERANCE STREET",,TORONTO,A6,ONTARIO,Canada,,,"=""6022""","State Commercial Banks",522110,"Commercial Banking",34,40,10/31/23,"49,132,376,064",10/31/23,"20,807,000,000","5,338,000,000","42,967,000,000","1,016,419,000,000"
31809,"Uncertain tax positions","(iii) Assessment of Uncertain Tax Provisions",520359,10/31/23,11/28/23,4,"KPMG LLP",187,"KPMG LLP Chartered Accountants",85,Toronto,A6,ONTARIO,Canada,40-F,2023-11-28,,"BANK OF NOVA SCOTIA",9631,"=""BNS""","40 TEMPERANCE STREET",,TORONTO,A6,ONTARIO,Canada,,,"=""6022""","State Commercial Banks",522110,"Commercial Banking",34,40,10/31/23,"49,132,376,064",10/31/23,"20,807,000,000","5,338,000,000","42,967,000,000","1,016,419,000,000"
33116,"Allowance for credit losses","Allowance for Credit Losses — Refer to Notes 1 and 4 to the financial statements",525112,12/31/23,02/20/24,3,"Deloitte & Touche LLP",,,,Miami,FL,FLORIDA,"US Southeast",10-K,2024-02-20,,"BankUnited, Inc.",1504008,"=""BKU""","14817 OAK LANE",,"MIAMI LAKES",FL,FLORIDA,"US Southeast",,,"=""6035""","Savings Institutions, Federally Chartered",522110,"Commercial Banking",34,32,01/02/24,"2,416,675,840",12/31/23,"873,035,000","178,671,000","2,500,284,000","35,761,607,000"
37724,Goodwill,"Goodwill - Baozun and BolTone Reporting Units — Refer to Notes 2(p) and 11 to the financial statements",533824,12/31/23,04/19/24,3,"Deloitte & Touche LLP",499,"Deloitte Touche Tohmatsu Certified Public Accountants LLP",1113,Shanghai,F4,CHINA,Foreign,20-F,2024-04-19,,"Baozun Inc.",1625414,"=""BZUN""","NO. 1-9, LANE 510, WEST JIANGCHANG ROAD","JING'AN DISTRICT",SHANGHAI,F4,CHINA,Foreign,,,"=""5961""","Catalog and Mail-Order Houses",454111,"Electronic Shopping",34,3,01/02/24,"143,528,768",12/31/23,"1,242,494,000","-39,257,000","708,485,000","1,476,901,000"
33219,"Allowance for credit losses","Impairment allowance for loans and advances at amortised cost, including off-balance sheet elements of the allowance",525144,12/31/23,02/19/24,4,"KPMG LLP",87,"KPMG LLP",1118,London,X0,"UNITED KINGDOM",Foreign,20-F,2024-02-20,,"BARCLAYS BANK PLC",312070,"=""DJP""","1 CHURCHILL PLACE",*,LONDON,X0,"UNITED KINGDOM",Foreign,312069,"BARCLAYS PLC","=""6029""","Commercial Banks, NEC",522110,"Commercial Banking",34,,,,12/31/23,"25,416,000,000","4,540,000,000","75,750,000,000","1,510,863,000,000"
33220,"Other investments","Valuation of certain Level 3 and Level 2 financial instruments recorded at fair value",525144,12/31/23,02/19/24,4,"KPMG LLP",87,"KPMG LLP",1118,London,X0,"UNITED KINGDOM",Foreign,20-F,2024-02-20,,"BARCLAYS BANK PLC",312070,"=""DJP""","1 CHURCHILL PLACE",*,LONDON,X0,"UNITED KINGDOM",Foreign,312069,"BARCLAYS PLC","=""6029""","Commercial Banks, NEC",522110,"Commercial Banking",34,,,,12/31/23,"25,416,000,000","4,540,000,000","75,750,000,000","1,510,863,000,000"
33221,"Pension and other post-employment benefits","UK Pension Scheme – Defined Benefit Obligation (DBO) assumptions",525144,12/31/23,02/19/24,4,"KPMG LLP",87,"KPMG LLP",1118,London,X0,"UNITED KINGDOM",Foreign,20-F,2024-02-20,,"BARCLAYS BANK PLC",312070,"=""DJP""","1 CHURCHILL PLACE",*,LONDON,X0,"UNITED KINGDOM",Foreign,312069,"BARCLAYS PLC","=""6029""","Commercial Banks, NEC",522110,"Commercial Banking",34,,,,12/31/23,"25,416,000,000","4,540,000,000","75,750,000,000","1,510,863,000,000"
33304,"Allowance for credit losses","Impairment allowance for loans and advances at amortised cost, including off-balance sheet elements of the allowance",525338,12/31/23,02/19/24,4,"KPMG LLP",87,"KPMG LLP",1118,London,X0,"UNITED KINGDOM",Foreign,20-F/A,2024-02-21,,"BARCLAYS BANK PLC",312070,"=""DJP""","1 CHURCHILL PLACE",*,LONDON,X0,"UNITED KINGDOM",Foreign,312069,"BARCLAYS PLC","=""6029""","Commercial Banks, NEC",522110,"Commercial Banking",34,,,,12/31/23,"25,416,000,000","4,540,000,000","75,750,000,000","1,510,863,000,000"
33305,"Other investments","Valuation of certain Level 3 and Level 2 financial instruments recorded at fair value",525338,12/31/23,02/19/24,4,"KPMG LLP",87,"KPMG LLP",1118,London,X0,"UNITED KINGDOM",Foreign,20-F/A,2024-02-21,,"BARCLAYS BANK PLC",312070,"=""DJP""","1 CHURCHILL PLACE",*,LONDON,X0,"UNITED KINGDOM",Foreign,312069,"BARCLAYS PLC","=""6029""","Commercial Banks, NEC",522110,"Commercial Banking",34,,,,12/31/23,"25,416,000,000","4,540,000,000","75,750,000,000","1,510,863,000,000"
33306,"Pension and other post-employment benefits","UK Pension Scheme – Defined Benefit Obligation (DBO) assumptions",525338,12/31/23,02/19/24,4,"KPMG LLP",87,"KPMG LLP",1118,London,X0,"UNITED KINGDOM",Foreign,20-F/A,2024-02-21,,"BARCLAYS BANK PLC",312070,"=""DJP""","1 CHURCHILL PLACE",*,LONDON,X0,"UNITED KINGDOM",Foreign,312069,"BARCLAYS PLC","=""6029""","Commercial Banks, NEC",522110,"Commercial Banking",34,,,,12/31/23,"25,416,000,000","4,540,000,000","75,750,000,000","1,510,863,000,000"
33162,"Allowance for credit losses","Impairment allowance for loans and advances at amortized cost, including off-balance sheet elements of the allowance",525180,12/31/23,02/19/24,4,"KPMG LLP",87,"KPMG LLP",1118,London,X0,"UNITED KINGDOM",Foreign,20-F,2024-02-20,,"BARCLAYS PLC",312069,"=""BCS""","1 CHURCHILL PLACE","CANARY WHARF",LONDON,X0,"UNITED KINGDOM",Foreign,,,"=""6029""","Commercial Banks, NEC",521110,"Monetary Authorities - Central Bank",34,8,01/02/24,"31,425,187,840",12/31/23,"34,534,000,000","6,786,000,000","80,836,000,000","1,883,517,000,000"
33163,"Other investments","Valuation of certain Level 3 and Level 2 financial instruments recorded at fair value",525180,12/31/23,02/19/24,4,"KPMG LLP",87,"KPMG LLP",1118,London,X0,"UNITED KINGDOM",Foreign,20-F,2024-02-20,,"BARCLAYS PLC",312069,"=""BCS""","1 CHURCHILL PLACE","CANARY WHARF",LONDON,X0,"UNITED KINGDOM",Foreign,,,"=""6029""","Commercial Banks, NEC",521110,"Monetary Authorities - Central Bank",34,8,01/02/24,"31,425,187,840",12/31/23,"34,534,000,000","6,786,000,000","80,836,000,000","1,883,517,000,000"
33164,"Pension and other post-employment benefits","UK Pension Scheme – Defined Benefit Obligation (DBO) assumptions",525180,12/31/23,02/19/24,4,"KPMG LLP",87,"KPMG LLP",1118,London,X0,"UNITED KINGDOM",Foreign,20-F,2024-02-20,,"BARCLAYS PLC",312069,"=""BCS""","1 CHURCHILL PLACE","CANARY WHARF",LONDON,X0,"UNITED KINGDOM",Foreign,,,"=""6029""","Commercial Banks, NEC",521110,"Monetary Authorities - Central Bank",34,8,01/02/24,"31,425,187,840",12/31/23,"34,534,000,000","6,786,000,000","80,836,000,000","1,883,517,000,000"
33727,"Other investments","Assessment of the fair value of investments",525466,12/31/23,02/22/24,4,"KPMG LLP",,,,Charlotte,NC,"NORTH CAROLINA","US Southeast",10-K,2024-02-22,,"Barings BDC, Inc.",1379785,"=""BBDC""","300 SOUTH TRYON STREET","SUITE 2500",CHARLOTTE,NC,"NORTH CAROLINA","US Southeast",,,,,525990,"Other Financial Vehicles",34,9,12/31/23,"910,055,488",12/31/23,"204,490,000","127,999,000",,"2,677,453,000"
30234,Inventory,"Inventory – Excess and Obsolete Inventory Reserve — Refer to Note 2 to the financial statements",512830,03/31/23,06/01/23,3,"Deloitte & Touche LLP",,,,"New York",NY,"NEW YORK","US Mid Atlantic",10-K,2023-06-01,,"Bark, Inc.",1819574,"=""BARK""","120 BROADWAY, 12TH FLOOR",,"NEW YORK",NY,"NEW YORK","US Mid Atlantic",,,"=""5990""","Retail-Retail Stores, NEC",454111,"Electronic Shopping",34,1,03/31/23,"257,589,248",03/31/23,"535,315,000","-61,519,000","166,447,000","400,420,000"
30802,Inventory,"Non-Returnable Inventory Reserve",515341,04/29/23,07/31/23,2,"Ernst & Young LLP",,,,Iselin,NJ,"NEW JERSEY","US Mid Atlantic",10-K,2023-07-31,,"Barnes & Noble Education, Inc.",1634117,"=""BNED""","120 MOUNTAIN VIEW BOULEVARD",,"BASKING RIDGE",NJ,"NEW JERSEY","US Mid Atlantic",,,"=""5940""","Retail-Miscellaneous Shopping Goods Stores",451211,"Book Stores",34,2,04/30/23,"82,062,240",04/29/23,"1,543,208,000","-101,862,000","20,119,000","980,779,000"
30803,"Long-lived assets","Long-Lived Asset Impairment",515341,04/29/23,07/31/23,2,"Ernst & Young LLP",,,,Iselin,NJ,"NEW JERSEY","US Mid Atlantic",10-K,2023-07-31,,"Barnes & Noble Education, Inc.",1634117,"=""BNED""","120 MOUNTAIN VIEW BOULEVARD",,"BASKING RIDGE",NJ,"NEW JERSEY","US Mid Atlantic",,,"=""5940""","Retail-Miscellaneous Shopping Goods Stores",451211,"Book Stores",34,2,04/30/23,"82,062,240",04/29/23,"1,543,208,000","-101,862,000","20,119,000","980,779,000"
34050,Goodwill,"Goodwill Impairment Assessment - Automation Reporting Unit",526400,12/31/23,02/26/24,1,"PricewaterhouseCoopers LLP",,,,Hartford,CT,CONNECTICUT,"US New England",10-K,2024-02-26,,"BARNES GROUP INC",9984,,"123 MAIN ST",,BRISTOL,CT,CONNECTICUT,"US New England",,,"=""3490""","Miscellaneous Fabricated Metal Products",334511,"Search, Detection, Navigation, Guidance, Aeronautical, and Nautical System and Instrument Manufacturing",34,33,12/31/23,"1,653,902,464",12/31/23,"1,450,871,000","15,996,000","-527,832,000","3,308,014,000"
34051,"Business combinations","Acquisition of MB Aerospace Holdings Inc. - Valuation of Customer Relationships and Developed Technology",526400,12/31/23,02/26/24,1,"PricewaterhouseCoopers LLP",,,,Hartford,CT,CONNECTICUT,"US New England",10-K,2024-02-26,,"BARNES GROUP INC",9984,,"123 MAIN ST",,BRISTOL,CT,CONNECTICUT,"US New England",,,"=""3490""","Miscellaneous Fabricated Metal Products",334511,"Search, Detection, Navigation, Guidance, Aeronautical, and Nautical System and Instrument Manufacturing",34,33,12/31/23,"1,653,902,464",12/31/23,"1,450,871,000","15,996,000","-527,832,000","3,308,014,000"
35252,"Other contingent liabilities","Workers' Compensation Claims Liabilities",527981,12/31/23,03/01/24,3,"Deloitte & Touche LLP",,,,Portland,OR,OREGON,"US West",10-K,2024-03-01,,"BARRETT BUSINESS SERVICES INC",902791,"=""BBSI""","8100 NE PARKWAY DRIVE","SUITE 200",VANCOUVER,WA,WASHINGTON,"US West",,,"=""7363""","Help Supply Services",561310,"Employment Placement Agencies",34,115,01/02/24,"760,915,072",12/31/23,"1,069,307,000","50,612,000","151,320,000","721,538,000"
32701,Goodwill,"Impairment assessments for goodwill and other non-current assets",524715,12/31/23,02/13/24,1,"PricewaterhouseCoopers LLP",191,"PricewaterhouseCoopers LLP Chartered Accountants",271,Toronto,A6,ONTARIO,Canada,6-K,2024-02-14,,"BARRICK MINING CORP",756894,"=""B""","BROOKFIELD PLACE, TD CANADA TRUST TOWER","161 BAY STREET SUITE 3700",TORONTO,A6,ONTARIO,Canada,,,"=""1040""","Metal Mining",212221,"Gold Ore Mining",34,18,12/31/23,"31,758,262,272",12/31/23,"11,397,000,000","1,953,000,000","19,611,000,000","45,811,000,000"
36091,Goodwill,"Impairment assessments for goodwill and other non-current assets",530238,12/31/23,02/13/24,1,"PricewaterhouseCoopers LLP",191,"PricewaterhouseCoopers LLP Chartered Accountants",271,Toronto,A6,ONTARIO,Canada,40-F,2024-03-15,,"BARRICK MINING CORP",756894,"=""B""","BROOKFIELD PLACE, TD CANADA TRUST TOWER","161 BAY STREET SUITE 3700",TORONTO,A6,ONTARIO,Canada,,,"=""1040""","Metal Mining",212221,"Gold Ore Mining",34,18,12/31/23,"31,758,262,272",12/31/23,"11,397,000,000","1,953,000,000","19,611,000,000","45,811,000,000"
32212,Inventory,"Measurement of Reserves for Excess and Obsolete Inventories",523435,11/25/23,01/25/24,2,"Ernst & Young LLP",,,,Richmond,VA,VIRGINIA,"US Mid Atlantic",10-K,2024-01-25,,"BASSETT FURNITURE INDUSTRIES INC",10329,"=""BSET""","PO BOX 626",,BASSETT,VA,VIRGINIA,"US Mid Atlantic",,,"=""2511""","Wood Household Furniture, Except Upholstered",337122,"Nonupholstered Wood Household Furniture Manufacturing",34,17,11/30/23,"144,851,008",11/25/23,"390,136,000","-3,171,000","167,374,000","370,424,000"
27681,"Other revenue","Loyalty Program",505483,01/28/23,03/17/23,2,"Ernst & Young LLP",,,,"Grandview Heights",OH,OHIO,"US Midwest",10-K,2023-03-17,,"Bath & Body Works, Inc.",701985,"=""BBWI""","THREE LIMITED PKWY","P O BOX 16000",COLUMBUS,OH,OHIO,"US Midwest",,,"=""5990""","Retail-Retail Stores, NEC",448120,"Women's Clothing Stores",34,46,01/31/23,"10,536,290,304",01/28/23,"7,560,000,000","800,000,000","-2,999,000,000","5,494,000,000"
37123,"Proven and unproven reserves","Proved Oil and Natural Gas Property and Depletion — Oil and Natural Gas Reserve Quantities — Refer to Note 1 and 5 to the financial statements",532093,12/31/23,03/29/24,3,"Deloitte & Touche LLP",,,,Houston,TX,TEXAS,"US Southwest",10-K,2024-04-01,,"BATTALION OIL CORP",1282648,"=""BATL""","820 GESSNER ROAD","SUITE 1100",HOUSTON,TX,TEXAS,"US Southwest",,,"=""1311""","Crude Petroleum and Natural Gas",211111,"Crude Petroleum and Natural Gas Extraction",34,10,12/31/23,"158,147,568",12/31/23,"220,762,000","-3,048,000",,"485,338,000"
33363,"Business combinations","XIIDRA Acquisition - Valuation of Product Brand",525431,12/31/23,02/21/24,1,"PricewaterhouseCoopers LLP",,,,"Florham Park",NJ,"NEW JERSEY","US Mid Atlantic",10-K,2024-02-21,,"Bausch & Lomb Corp",1860742,"=""BLCO""","520 APPLEWOOD CRESCENT",,VAUGHAN,A6,ONTARIO,Canada,,,"=""3851""","Ophthalmic Goods",339115,"Ophthalmic Goods Manufacturing",34,17,12/31/23,"5,986,589,696",12/31/23,"4,146,000,000","-260,000,000","-1,314,000,000","13,442,000,000"
33364,Goodwill,"Goodwill Impairment Assessments – Vision Care, Pharmaceuticals, and Surgical Reporting Units",525431,12/31/23,02/21/24,1,"PricewaterhouseCoopers LLP",,,,"Florham Park",NJ,"NEW JERSEY","US Mid Atlantic",10-K,2024-02-21,,"Bausch & Lomb Corp",1860742,"=""BLCO""","520 APPLEWOOD CRESCENT",,VAUGHAN,A6,ONTARIO,Canada,,,"=""3851""","Ophthalmic Goods",339115,"Ophthalmic Goods Manufacturing",34,17,12/31/23,"5,986,589,696",12/31/23,"4,146,000,000","-260,000,000","-1,314,000,000","13,442,000,000"
33745,"Sales return and allowances","Medicaid Rebates and Sales Returns Allowances",525684,12/31/23,02/22/24,1,"PricewaterhouseCoopers LLP",,,,"Florham Park",NJ,"NEW JERSEY","US Mid Atlantic",10-K,2024-02-22,,"Bausch Health Companies Inc.",885590,"=""BHC""","2150 ST. ELZEAR BLVD. WEST",LAVAL,QUEBEC,A8,QUEBEC,Canada,,,"=""2834""","Pharmaceutical Preparations",325412,"Pharmaceutical Preparation Manufacturing",34,8,12/31/23,"2,929,216,000",12/31/23,"8,757,000,000","-592,000,000","-18,408,000,000","27,350,000,000"
33746,Goodwill,"Goodwill Impairment Assessments – Dermatology, Neurology, Generics, Vision Care, Pharmaceuticals, and Surgical Reporting Units",525684,12/31/23,02/22/24,1,"PricewaterhouseCoopers LLP",,,,"Florham Park",NJ,"NEW JERSEY","US Mid Atlantic",10-K,2024-02-22,,"Bausch Health Companies Inc.",885590,"=""BHC""","2150 ST. ELZEAR BLVD. WEST",LAVAL,QUEBEC,A8,QUEBEC,Canada,,,"=""2834""","Pharmaceutical Preparations",325412,"Pharmaceutical Preparation Manufacturing",34,8,12/31/23,"2,929,216,000",12/31/23,"8,757,000,000","-592,000,000","-18,408,000,000","27,350,000,000"
33747,"Business combinations","XIIDRA Acquisition - Valuation of a Product Brand",525684,12/31/23,02/22/24,1,"PricewaterhouseCoopers LLP",,,,"Florham Park",NJ,"NEW JERSEY","US Mid Atlantic",10-K,2024-02-22,,"Bausch Health Companies Inc.",885590,"=""BHC""","2150 ST. ELZEAR BLVD. WEST",LAVAL,QUEBEC,A8,QUEBEC,Canada,,,"=""2834""","Pharmaceutical Preparations",325412,"Pharmaceutical Preparation Manufacturing",34,8,12/31/23,"2,929,216,000",12/31/23,"8,757,000,000","-592,000,000","-18,408,000,000","27,350,000,000"
32443,Goodwill,"Goodwill Impairment Assessments – Front Line Care and Chronic Therapies Reporting Units",524192,12/31/23,02/08/24,1,"PricewaterhouseCoopers LLP",,,,Chicago,IL,ILLINOIS,"US Midwest",10-K,2024-02-08,,"BAXTER INTERNATIONAL INC",10456,"=""BAX""","ONE BAXTER PARKWAY",,DEERFIELD,IL,ILLINOIS,"US Midwest",,,"=""3841""","Surgical and Medical Instruments and Apparatus",325414,"Biological Product (except Diagnostic) Manufacturing",34,39,12/31/23,"19,625,093,120",12/31/23,"10,360,000,000","2,656,000,000","-4,191,000,000","28,276,000,000"
35085,"Proven and unproven reserves","Assessment of the recoverable amount of oil and gas properties",527391,12/31/23,02/28/24,4,"KPMG LLP",187,"KPMG LLP Chartered Accountants",85,Calgary,A0,ALBERTA,Canada,40-F,2024-02-29,,"BAYTEX ENERGY CORP.",1279495,"=""BTE""","2200 205 5TH AVE SW",,CALGARY,A0,ALBERTA,Canada,,,"=""1381""","Drilling Oil and Gas Wells",213111,"Drilling Oil and Gas Wells",34,3,01/02/24,"1,792,819,968",12/31/23,"2,057,356,000","-176,973,000",,"5,658,222,000"
35086,"Business combinations","Fair value measurement of oil and gas properties in a business combination",527391,12/31/23,02/28/24,4,"KPMG LLP",187,"KPMG LLP Chartered Accountants",85,Calgary,A0,ALBERTA,Canada,40-F,2024-02-29,,"BAYTEX ENERGY CORP.",1279495,"=""BTE""","2200 205 5TH AVE SW",,CALGARY,A0,ALBERTA,Canada,,,"=""1381""","Drilling Oil and Gas Wells",213111,"Drilling Oil and Gas Wells",34,3,01/02/24,"1,792,819,968",12/31/23,"2,057,356,000","-176,973,000",,"5,658,222,000"
35087,"Proven and unproven reserves","Assessment of indicators of impairment related to the Eagle Ford Operated CGU",527391,12/31/23,02/28/24,4,"KPMG LLP",187,"KPMG LLP Chartered Accountants",85,Calgary,A0,ALBERTA,Canada,40-F,2024-02-29,,"BAYTEX ENERGY CORP.",1279495,"=""BTE""","2200 205 5TH AVE SW",,CALGARY,A0,ALBERTA,Canada,,,"=""1381""","Drilling Oil and Gas Wells",213111,"Drilling Oil and Gas Wells",34,3,01/02/24,"1,792,819,968",12/31/23,"2,057,356,000","-176,973,000",,"5,658,222,000"
35088,"Proven and unproven reserves","Impact of estimated oil and gas reserves on depletion expense related to oil and gas properties",527391,12/31/23,02/28/24,4,"KPMG LLP",187,"KPMG LLP Chartered Accountants",85,Calgary,A0,ALBERTA,Canada,40-F,2024-02-29,,"BAYTEX ENERGY CORP.",1279495,"=""BTE""","2200 205 5TH AVE SW",,CALGARY,A0,ALBERTA,Canada,,,"=""1381""","Drilling Oil and Gas Wells",213111,"Drilling Oil and Gas Wells",34,3,01/02/24,"1,792,819,968",12/31/23,"2,057,356,000","-176,973,000",,"5,658,222,000"
38103,Leases,"Accounting for Lease Contracts",535340,12/31/23,04/30/24,1,"PricewaterhouseCoopers LLP",107,"PricewaterhouseCoopers SC",1128,"Mexico City",O5,MEXICO,Foreign,20-F,2024-04-30,,"BBB FOODS INC",1978954,"=""TBBB""","RIO DANUBIO 51","COL. CUAUHTEMOC","MEXICO CITY",O5,MEXICO,Foreign,,,"=""5411""","Grocery Stores",445110,"Supermarkets and Other Grocery (except Convenience) Stores",34,,,,12/31/23,"2,602,879,000","-18,079,000","-274,093,000","883,628,000"
40704,Leases,"Accounting for Lease Contracts",548242,12/31/23,04/30/24,1,"PricewaterhouseCoopers LLP",107,"PricewaterhouseCoopers SC",1128,"Mexico City",O5,MEXICO,Foreign,F-1/A,2025-02-05,,"BBB FOODS INC",1978954,"=""TBBB""","RIO DANUBIO 51","COL. CUAUHTEMOC","MEXICO CITY",O5,MEXICO,Foreign,,,"=""5411""","Grocery Stores",445110,"Supermarkets and Other Grocery (except Convenience) Stores",34,,,,12/31/23,"2,602,879,000","-18,079,000","-274,093,000","883,628,000"
40764,Leases,"Accounting for Lease Contracts",550395,12/31/23,04/30/24,1,"PricewaterhouseCoopers LLP",107,"PricewaterhouseCoopers SC",1128,"Mexico City",O5,MEXICO,Foreign,424B1,2025-02-06,,"BBB FOODS INC",1978954,"=""TBBB""","RIO DANUBIO 51","COL. CUAUHTEMOC","MEXICO CITY",O5,MEXICO,Foreign,,,"=""5411""","Grocery Stores",445110,"Supermarkets and Other Grocery (except Convenience) Stores",34,,,,12/31/23,"2,602,879,000","-18,079,000","-274,093,000","883,628,000"
35838,"Other investments","Fair Value of Level 3 Investments — Refer to Notes 2 and 4 to the financial statements",529777,12/31/23,03/12/24,3,"Deloitte & Touche LLP",,,,"New York",NY,"NEW YORK","US Mid Atlantic",10-K,2024-03-12,,"BC Partners Lending Corp",1726548,,"650 MADISON AVENUE",,"NEW YORK",NY,"NEW YORK","US Mid Atlantic",,,,,525990,"Other Financial Vehicles",34,,,,12/31/23,"16,287,000","5,171,000","68,147,000","142,587,000"
35616,"Goodwill and intangible assets","Goodwill and intangible assets - Bell Media group - refer to notes 2N, 8, 19 and 22 to the financial statements",529349,12/31/23,03/07/24,3,"Deloitte & Touche LLP",486,"Deloitte srl",1208,Montreal,A8,QUEBEC,Canada,40-F,2024-03-08,,"BCE INC",718940,"=""BCE""","1 CARREFOUR ALEXANDER-GRAHAM-BELL","BUREAU 4100",MONTREAL,A8,QUEBEC,Canada,,,"=""4813""","Telephone Communications, Except Radiotelephone",517310,"Telecommunications Resellers",34,40,01/02/24,"36,825,866,240",12/31/23,"18,712,000,000","1,765,000,000","-5,553,000,000","54,558,000,000"
35887,"Other investments","Fair Value of Level III Investments — Refer to Notes 2 and 4 to the financial statements",529851,12/31/23,03/13/24,3,"Deloitte & Touche LLP",,,,"New York",NY,"NEW YORK","US Mid Atlantic",10-K,2024-03-13,,"BCP Investment Corp",1372807,"=""BCIC""","650 MADISON AVENUE","3RD FLOOR","NEW YORK",NY,"NEW YORK","US Mid Atlantic",,,,,525990,"Other Financial Vehicles",34,18,12/31/23,"170,679,168",12/31/23,"51,009,000","11,381,000",,"549,239,000"
35690,Goodwill,"Goodwill Impairment Assessment – Refer to Notes 1 and 8 to the financial statements",529640,12/31/23,03/11/24,3,"Deloitte & Touche LLP",,,,"Los Angeles",CA,CALIFORNIA,"US West",10-K,2024-03-11,,"Beachbody Company, Inc.",1826889,"=""BODI""","400 CONTINENTAL BLVD","SUITE 400","EL SEGUNDO",CA,CALIFORNIA,"US West",,,"=""5960""","Retail-Nonstore Retailers",454111,"Electronic Shopping",34,8,12/31/23,"32,980,572",12/31/23,"527,109,000","-152,641,000","-2,406,000","276,839,000"
35711,Goodwill,"Goodwill Impairment Assessment – Refer to Notes 1 and 8 to the financial statements",529691,12/31/23,03/11/24,3,"Deloitte & Touche LLP",,,,"Los Angeles",CA,CALIFORNIA,"US West",424B3,2024-03-11,,"Beachbody Company, Inc.",1826889,"=""BODI""","400 CONTINENTAL BLVD","SUITE 400","EL SEGUNDO",CA,CALIFORNIA,"US West",,,"=""5960""","Retail-Nonstore Retailers",454111,"Electronic Shopping",34,8,12/31/23,"32,980,572",12/31/23,"527,109,000","-152,641,000","-2,406,000","276,839,000"
38135,Goodwill,"Goodwill Impairment Assessment – Refer to Notes 1 and 8 to the financial statements",535479,12/31/23,03/11/24,3,"Deloitte & Touche LLP",,,,"Los Angeles",CA,CALIFORNIA,"US West",S-1/A,2024-04-30,,"Beachbody Company, Inc.",1826889,"=""BODI""","400 CONTINENTAL BLVD","SUITE 400","EL SEGUNDO",CA,CALIFORNIA,"US West",,,"=""5960""","Retail-Nonstore Retailers",454111,"Electronic Shopping",34,8,12/31/23,"32,980,572",12/31/23,"527,109,000","-152,641,000","-2,406,000","276,839,000"
38160,Goodwill,"Goodwill Impairment Assessment – Refer to Notes 1 and 8 to the financial statements",535475,12/31/23,03/11/24,3,"Deloitte & Touche LLP",,,,"Los Angeles",CA,CALIFORNIA,"US West","POS AM",2024-04-30,,"Beachbody Company, Inc.",1826889,"=""BODI""","400 CONTINENTAL BLVD","SUITE 400","EL SEGUNDO",CA,CALIFORNIA,"US West",,,"=""5960""","Retail-Nonstore Retailers",454111,"Electronic Shopping",34,8,12/31/23,"32,980,572",12/31/23,"527,109,000","-152,641,000","-2,406,000","276,839,000"
38544,Goodwill,"Goodwill Impairment Assessment – Refer to Notes 1 and 8 to the financial statements",537381,12/31/23,03/11/24,3,"Deloitte & Touche LLP",,,,"Los Angeles",CA,CALIFORNIA,"US West",S-1/A,2024-06-10,,"Beachbody Company, Inc.",1826889,"=""BODI""","400 CONTINENTAL BLVD","SUITE 400","EL SEGUNDO",CA,CALIFORNIA,"US West",,,"=""5960""","Retail-Nonstore Retailers",454111,"Electronic Shopping",34,8,12/31/23,"32,980,572",12/31/23,"527,109,000","-152,641,000","-2,406,000","276,839,000"
34366,"Revenue from customer contracts","Revenue Recognition – Refer to Notes 2 and 11 to the financial statements",526603,12/31/23,02/27/24,3,"Deloitte & Touche LLP",,,,Boston,MA,MASSACHUSETTS,"US New England",10-K,2024-02-27,,"Beam Therapeutics Inc.",1745999,"=""BEAM""","26 LANDSDOWNE STREET",,CAMBRIDGE,MA,MASSACHUSETTS,"US New England",,,"=""2836""","Biological Products, Except Diagnostic Substances",325414,"Biological Product (except Diagnostic) Manufacturing",34,27,12/31/23,"2,222,036,480",12/31/23,"377,709,000","-132,527,000",,"1,459,714,000"
35800,"Other liabilities and provisions","Syndeo Program Reserve — Refer to Note 18 to the financial statements",529714,12/31/23,03/12/24,3,"Deloitte & Touche LLP",,,,"Los Angeles",CA,CALIFORNIA,"US West",10-K,2024-03-12,,"Beauty Health Co",1818093,"=""SKIN""","2165 SPRING STREET",,"LONG BEACH",CA,CALIFORNIA,"US West",,,"=""3841""","Surgical and Medical Instruments and Apparatus",325620,"Toilet Preparation Manufacturing",34,3,12/31/23,"382,215,904",12/31/23,"397,991,000","-100,116,000","-128,551,000","929,113,000"
31695,Inventory,"Owned Inventory—Valuation of Projects in Progress—Refer to Notes 2 and 4 to the financial statements.",519887,09/30/23,11/16/23,3,"Deloitte & Touche LLP",,,,Atlanta,GA,GEORGIA,"US Southeast",10-K,2023-11-16,,"BEAZER HOMES USA INC",915840,"=""BZH""","2002 SUMMIT BLVD NE","15TH FLOOR",ATLANTA,GA,GEORGIA,"US Southeast",,,"=""1531""","Operative Builders",236117,"New Housing Operative Builders",34,25,10/02/23,"779,092,864",09/30/23,"2,206,785,000","158,611,000","1,091,443,000","2,411,033,000"
31743,"Other contingent liabilities","Estimation of Product Liability Reserves",520053,09/30/23,11/21/23,2,"Ernst & Young LLP",,,,"New York",NY,"NEW YORK","US Mid Atlantic",10-K,2023-11-21,,"BECTON DICKINSON & CO",10795,"=""BDX""","ONE BECTON DR",,"FRANKLIN LAKES",NJ,"NEW JERSEY","US Mid Atlantic",,,"=""3841""","Surgical and Medical Instruments and Apparatus",334516,"Analytical Laboratory Instrument Manufacturing",34,258,10/02/23,"74,778,386,432",09/30/23,"19,372,000,000","1,484,000,000","-9,672,000,000","52,781,000,000"
31744,"Uncertain tax positions","Income taxes — Uncertain tax positions",520053,09/30/23,11/21/23,2,"Ernst & Young LLP",,,,"New York",NY,"NEW YORK","US Mid Atlantic",10-K,2023-11-21,,"BECTON DICKINSON & CO",10795,"=""BDX""","ONE BECTON DR",,"FRANKLIN LAKES",NJ,"NEW JERSEY","US Mid Atlantic",,,"=""3841""","Surgical and Medical Instruments and Apparatus",334516,"Analytical Laboratory Instrument Manufacturing",34,258,10/02/23,"74,778,386,432",09/30/23,"19,372,000,000","1,484,000,000","-9,672,000,000","52,781,000,000"
34014,"Equity investments and joint ventures","Valuation of certain equity method securities",525961,12/31/23,02/23/24,4,"KPMG LLP",,,,"Salt Lake City",UT,UTAH,"US West",10-K,2024-02-23,,"BED BATH & BEYOND, INC.",1130713,"=""BBBY""","433 W. ASCENSION WAY, 3RD FLOOR",,MURRAY,UT,UTAH,"US West",,,"=""5961""","Catalog and Mail-Order Houses",454111,"Electronic Shopping",34,27,01/02/24,"1,212,813,440",12/31/23,"1,561,122,000","-307,842,000","327,718,000","635,818,000"
32656,"Revenue from customer contracts","Revenue recognition - estimating variable consideration",524534,12/31/23,02/13/24,2,"Ernst & Young LLP",,,,"Saint Louis",MO,MISSOURI,"US Southeast",10-K,2024-02-13,,"BELDEN INC.",913142,"=""BDC""","1 NORTH BRENTWOOD BLVD","15TH FLOOR","ST. LOUIS",MO,MISSOURI,"US Southeast",,,"=""3357""","Drawing and Insulating of Nonferrous Wire",334290,"Other Communications Equipment Manufacturing",34,77,01/02/24,"3,212,818,432",12/31/23,"2,512,084,000","242,759,000","-10,218,000","3,240,191,000"
31752,"Sales return and allowances","Receivables, net- Allowance for Trade Promotions",520075,09/30/23,11/21/23,1,"PricewaterhouseCoopers LLP",,,,"Saint Louis",MO,MISSOURI,"US Southeast",10-K,2023-11-21,,"BELLRING BRANDS, INC.",1772016,"=""BRBR""","1 N. BRENTWOOD BOULEVARD, SUITE 1550",,CLAYTON,MO,MISSOURI,"US Southeast",,,"=""2000""","Food and Kindred Products",446191,"Food (Health) Supplement Stores",34,41,09/30/23,"5,411,245,568",09/30/23,"1,666,800,000","165,500,000","-566,200,000","691,600,000"
34278,"Other income taxes","Evaluation of income tax expense",526754,12/31/23,02/26/24,4,"KPMG LLP",,,,Phoenix,AZ,ARIZONA,"US Southwest",10-K,2024-02-27,,"BENCHMARK ELECTRONICS INC",863436,"=""BHE""","56 SOUTH ROCKFORD DRIVE",,TEMPE,AZ,ARIZONA,"US Southwest",,,"=""3672""","Printed Circuit Boards",334418,"Printed Circuit Assembly (Electronic Assembly) Manufacturing",34,27,01/02/24,"973,400,896",12/31/23,"2,838,976,000","64,315,000","886,969,000","2,274,755,000"
34465,"Revenue from customer contracts","Evaluation of the standalone selling price for certain term license subscriptions and the portfolio balancing material right",526550,12/31/23,02/27/24,4,"KPMG LLP",,,,Philadelphia,PA,PENNSYLVANIA,"US Mid Atlantic",10-K,2024-02-27,,"BENTLEY SYSTEMS INC",1031308,"=""BSY""","685 STOCKTON DRIVE",,EXTON,PA,PENNSYLVANIA,"US Mid Atlantic",,,"=""7372""","Prepackaged Software",541511,"Custom Computer Programming Services",34,49,01/02/24,"14,035,740,672",12/31/23,"1,228,413,000","326,787,000","-1,634,845,000","3,319,850,000"
34466,"Other income taxes","Evaluation of intra&#8209;entity transactions",526550,12/31/23,02/27/24,4,"KPMG LLP",,,,Philadelphia,PA,PENNSYLVANIA,"US Mid Atlantic",10-K,2024-02-27,,"BENTLEY SYSTEMS INC",1031308,"=""BSY""","685 STOCKTON DRIVE",,EXTON,PA,PENNSYLVANIA,"US Mid Atlantic",,,"=""7372""","Prepackaged Software",541511,"Custom Computer Programming Services",34,49,01/02/24,"14,035,740,672",12/31/23,"1,228,413,000","326,787,000","-1,634,845,000","3,319,850,000"
34158,"Research and development expenses","Accrued Clinical Trial Expenses",526350,12/31/23,02/26/24,2,"Ernst & Young LLP",,,,Boston,MA,MASSACHUSETTS,"US New England",10-K,2024-02-26,,"BeOne Medicines Ltd.",1651308,"=""ONC""","C/O BEONE MEDICINES I GMBH","AESCHENGRABEN 27, 21ST FLOOR",BASEL,V8,SWITZERLAND,Foreign,,,"=""2834""","Pharmaceutical Preparations",325412,"Pharmaceutical Preparation Manufacturing",34,177,01/02/24,"11,870,349,312",12/31/23,"2,458,779,000","-881,708,000","3,480,189,000","5,805,275,000"
33961,"Allowance for credit losses","Reserves for losses and loss expenses",525968,12/31/23,02/23/24,4,"KPMG LLP",,,,"New York",NY,"NEW YORK","US Mid Atlantic",10-K,2024-02-23,,"BERKLEY W R CORP",11544,"=""WRB""","475 STEAMBOAT ROAD",.,GREENWICH,CT,CONNECTICUT,"US New England",,,"=""6331""","Fire, Marine, and Casualty Insurance",524113,"Direct Life Insurance Carriers",34,72,01/02/24,"18,605,467,648",12/31/23,"12,142,938,000","1,381,359,000","7,280,834,000","37,202,015,000"
34111,"Regulatory assets and liabilities","Regulatory Matters — Effects of Rate Regulation on the Financial Statements — Refer to Note 7 to the financial statements",526370,12/31/23,02/23/24,3,"Deloitte & Touche LLP",,,,"Des Moines",IA,IOWA,"US Midwest",10-K,2024-02-26,,"BERKSHIRE HATHAWAY ENERGY CO",1081316,,"1615 LOCUST STREET",,"DES MOINES",IA,IOWA,"US Midwest",1067983,"BERKSHIRE HATHAWAY INC","=""4900""","Electric, Gas & Sanitary Services",221122,"Electric Power Distribution",34,,,,12/31/23,"25,602,000,000","3,020,000,000","36,887,000,000","137,840,000,000"
34112,"Other contingent liabilities","Wildfires — Contingencies — Refer to Note 16 to the financial statements",526370,12/31/23,02/23/24,3,"Deloitte & Touche LLP",,,,"Des Moines",IA,IOWA,"US Midwest",10-K,2024-02-26,,"BERKSHIRE HATHAWAY ENERGY CO",1081316,,"1615 LOCUST STREET",,"DES MOINES",IA,IOWA,"US Midwest",1067983,"BERKSHIRE HATHAWAY INC","=""4900""","Electric, Gas & Sanitary Services",221122,"Electric Power Distribution",34,,,,12/31/23,"25,602,000,000","3,020,000,000","36,887,000,000","137,840,000,000"
34164,"Insurance contract liabilities","Unpaid Losses and Loss Adjustment Expenses — Refer to Notes 1 and 16 to the financial statements",526471,12/31/23,02/24/24,3,"Deloitte & Touche LLP",,,,Omaha,NE,NEBRASKA,"US Midwest",10-K,2024-02-26,,"BERKSHIRE HATHAWAY INC",1067983,"=""BRK.A""","3555 FARNAM STREET",,OMAHA,NE,NEBRASKA,"US Midwest",,,"=""6331""","Fire, Marine, and Casualty Insurance",524130,"Reinsurance Carriers",34,"542,625",12/31/23,"308,088,930,304",12/31/23,"439,337,000,000","96,223,000,000","450,581,000,000","1,069,978,000,000"
34165,"Insurance contract liabilities","Unpaid Losses and Loss Adjustment Expenses — Retroactive Reinsurance Contracts — Refer to Notes 1 and 17 to the financial statements",526471,12/31/23,02/24/24,3,"Deloitte & Touche LLP",,,,Omaha,NE,NEBRASKA,"US Midwest",10-K,2024-02-26,,"BERKSHIRE HATHAWAY INC",1067983,"=""BRK.A""","3555 FARNAM STREET",,OMAHA,NE,NEBRASKA,"US Midwest",,,"=""6331""","Fire, Marine, and Casualty Insurance",524130,"Reinsurance Carriers",34,"542,625",12/31/23,"308,088,930,304",12/31/23,"439,337,000,000","96,223,000,000","450,581,000,000","1,069,978,000,000"
34166,"Goodwill and intangible assets","Goodwill and Indefinite-Lived Intangible Assets — Refer to Notes 1 and 13 to the financial statements",526471,12/31/23,02/24/24,3,"Deloitte & Touche LLP",,,,Omaha,NE,NEBRASKA,"US Midwest",10-K,2024-02-26,,"BERKSHIRE HATHAWAY INC",1067983,"=""BRK.A""","3555 FARNAM STREET",,OMAHA,NE,NEBRASKA,"US Midwest",,,"=""6331""","Fire, Marine, and Casualty Insurance",524130,"Reinsurance Carriers",34,"542,625",12/31/23,"308,088,930,304",12/31/23,"439,337,000,000","96,223,000,000","450,581,000,000","1,069,978,000,000"
35649,"Proven and unproven reserves","Estimate of proved oil and natural gas reserve quantities used in the depletion of proved oil and natural gas properties",529368,12/31/23,03/07/24,4,"KPMG LLP",,,,Dallas,TX,TEXAS,"US Southwest",10-K,2024-03-08,,"Berry Corp (bry)",1705873,"=""BRY""","16000 N. DALLAS PARKWAY, SUITE 500",,DALLAS,TX,TEXAS,"US Southwest",,,"=""1311""","Crude Petroleum and Natural Gas",211111,"Crude Petroleum and Natural Gas Extraction",34,7,12/31/23,"531,942,048",12/31/23,"863,454,000","63,786,000",,"1,594,158,000"
35650,"Proven and unproven reserves","Estimate of undiscounted future cash flows of proved oil and natural gas reserves used to assess the recoverability of the carrying value of certain proved oil and natural gas properties",529368,12/31/23,03/07/24,4,"KPMG LLP",,,,Dallas,TX,TEXAS,"US Southwest",10-K,2024-03-08,,"Berry Corp (bry)",1705873,"=""BRY""","16000 N. DALLAS PARKWAY, SUITE 500",,DALLAS,TX,TEXAS,"US Southwest",,,"=""1311""","Crude Petroleum and Natural Gas",211111,"Crude Petroleum and Natural Gas Extraction",34,7,12/31/23,"531,942,048",12/31/23,"863,454,000","63,786,000",,"1,594,158,000"
31713,"Pension and other post-employment benefits","United Kingdom Defined Benefit Pension Obligation",519921,09/30/23,11/17/23,2,"Ernst & Young LLP",,,,Indianapolis,IN,INDIANA,"US Midwest",10-K,2023-11-17,,"BERRY GLOBAL GROUP, INC.",1378992,"=""BERY""","101 OAKLEY STREET","PO BOX 959",EVANSVILLE,IN,INDIANA,"US Midwest",,,"=""3089""","Plastics Products, NEC",326199,"All Other Plastics Product Manufacturing",34,61,10/02/23,"7,260,788,224",09/30/23,"12,664,000,000","609,000,000","-3,468,000,000","16,587,000,000"
27685,"Vendor/supplier rebates","Vendor Allowances — Refer to Note 1 to the financial statements",505479,01/28/23,03/17/23,3,"Deloitte & Touche LLP",,,,Minneapolis,MN,MINNESOTA,"US Midwest",10-K,2023-03-17,,"BEST BUY CO INC",764478,"=""BBY""","7601 PENN AVE SOUTH",,RICHFIELD,MN,MINNESOTA,"US Midwest",,,"=""5731""","Radio, Television, and Consumer Electronics Stores",443112,"Radio, Television, and Other Electronics Stores",34,89,01/31/23,"19,349,831,680",01/28/23,"46,298,000,000","1,419,000,000","1,412,000,000","15,803,000,000"
27686,Goodwill,"Goodwill – Best Buy Health Reporting Unit — Refer to Note 1 to the financial statements",505479,01/28/23,03/17/23,3,"Deloitte & Touche LLP",,,,Minneapolis,MN,MINNESOTA,"US Midwest",10-K,2023-03-17,,"BEST BUY CO INC",764478,"=""BBY""","7601 PENN AVE SOUTH",,RICHFIELD,MN,MINNESOTA,"US Midwest",,,"=""5731""","Radio, Television, and Consumer Electronics Stores",443112,"Radio, Television, and Other Electronics Stores",34,89,01/31/23,"19,349,831,680",01/28/23,"46,298,000,000","1,419,000,000","1,412,000,000","15,803,000,000"
38087,"Going concern","Going concern",535365,12/31/23,04/30/24,2,"Ernst & Young LLP",211,"Ernst & Young Hua Ming LLP",1408,Shanghai,F4,CHINA,Foreign,20-F,2024-04-30,Yes,"BEST Inc.",1709505,,"2/F, BLOCK A, HUAXING MODERN INDUSTRY","PARK, NO.18 TANGMIAO ROAD, XIHU DISTRICT","HANGZHOU, ZHEJIANG PROVINCE",F4,CHINA,Foreign,,,"=""4210""","Trucking & Courier Services (No Air)",541614,"Process, Physical Distribution, and Logistics Consulting Services",34,2,01/02/24,"7,861,190",12/31/23,"1,172,534,000","-114,831,000","-7,557,000","881,752,000"
38114,"Goodwill and intangible assets","Goodwill and Indefinite-lived Intangible Assets Impairment Assessment – JAFRA Mexico Cash Generating Unit",535389,12/31/23,04/30/24,1,"PricewaterhouseCoopers LLP",107,"PricewaterhouseCoopers SC",1128,"Mexico City",O5,MEXICO,Foreign,20-F,2024-04-30,,"BETTERWARE DE MEXICO, S.A.P.I. DE C.V",1788257,"=""BWMX""","CRUCE CARRETERA GDL AMECA HUAXTLA KM5",,"EL ARENAL",O5,MEXICO,Foreign,,,"=""5961""","Catalog and Mail-Order Houses",423220,"Home Furnishing Merchant Wholesalers",34,14,01/02/24,"506,012,352",12/31/23,"768,225,000","61,210,000","-104,817,000","654,766,000"
35253,Inventory,"Inventory — Provision for Excess and Obsolete Raw Materials and Work in Process Inventory — Refer to Notes 2 and 5 to the financial statements",527933,12/31/23,03/01/24,3,"Deloitte & Touche LLP",,,,"Los Angeles",CA,CALIFORNIA,"US West",10-K,2024-03-01,,"BEYOND MEAT, INC.",1655210,"=""BYND""","888 N. DOUGLAS STREET, SUITE 100",,"EL SEGUNDO",CA,CALIFORNIA,"US West",,,"=""2000""","Food and Kindred Products",311991,"Perishable Prepared Food Manufacturing",34,8,01/02/24,"528,590,016",12/31/23,"343,376,000","-338,144,000",,"774,450,000"
35183,"Other income taxes","Accounting for Income Taxes",527357,12/31/23,02/29/24,2,"Ernst & Young LLP",,,,"New York",NY,"NEW YORK","US Mid Atlantic",10-K,2024-02-29,,"BGC Group, Inc.",1094831,"=""BGC""","499 PARK AVENUE",,"NEW YORK",NY,"NEW YORK","US Mid Atlantic",,,"=""6200""","Security & Commodity Brokers, Dealers, Exchanges & Services",523120,"Securities Brokerage",34,7,01/02/24,"2,699,800,320",12/31/23,"1,948,170,000","36,265,000","167,454,000","3,175,937,000"
31122,"Property, plant and equipment","Carrying value of property, plant and equipment",516714,06/30/23,09/05/23,2,"Ernst & Young LLP",32,"Ernst & Young",1435,Melbourne,C3,AUSTRALIA,Foreign,20-F,2023-09-05,,"BHP Group Ltd",811809,"=""BHP""","LEVEL 27","180 LONSDALE STREET",MELBOURNE,C3,AUSTRALIA,Foreign,,,"=""1000""","Metal mining",212210,"Iron Ore Mining",34,60,06/30/23,"151,096,639,488",06/30/23,"53,817,000,000","12,921,000,000","42,886,000,000","101,296,000,000"
31123,"Asset retirement and environmental obligations","Closure and rehabilitation provisions",516714,06/30/23,09/05/23,2,"Ernst & Young LLP",32,"Ernst & Young",1435,Melbourne,C3,AUSTRALIA,Foreign,20-F,2023-09-05,,"BHP Group Ltd",811809,"=""BHP""","LEVEL 27","180 LONSDALE STREET",MELBOURNE,C3,AUSTRALIA,Foreign,,,"=""1000""","Metal mining",212210,"Iron Ore Mining",34,60,06/30/23,"151,096,639,488",06/30/23,"53,817,000,000","12,921,000,000","42,886,000,000","101,296,000,000"
31124,"Other contingent liabilities","Samarco dam failure provisions recognised and the contingent liabilities disclosed",516714,06/30/23,09/05/23,2,"Ernst & Young LLP",32,"Ernst & Young",1435,Melbourne,C3,AUSTRALIA,Foreign,20-F,2023-09-05,,"BHP Group Ltd",811809,"=""BHP""","LEVEL 27","180 LONSDALE STREET",MELBOURNE,C3,AUSTRALIA,Foreign,,,"=""1000""","Metal mining",212210,"Iron Ore Mining",34,60,06/30/23,"151,096,639,488",06/30/23,"53,817,000,000","12,921,000,000","42,886,000,000","101,296,000,000"
33119,"Revenue from customer contracts","Revenue recognition: Initial accounting treatment for collaboration agreements",525107,12/31/23,02/20/24,1,"PricewaterhouseCoopers LLP",121,"PricewaterhouseCoopers LLP",876,Cambridge,X0,"UNITED KINGDOM",Foreign,10-K,2024-02-20,,"BICYCLE THERAPEUTICS PLC",1761612,"=""BCYC""","BLOCKS A & B, PORTWAY BUILDING","GRANTA PARK, GREAT ABINGTON",CAMBRIDGE,X0,"UNITED KINGDOM",Foreign,,,"=""2834""","Pharmaceutical Preparations",325412,"Pharmaceutical Preparation Manufacturing",34,18,12/31/23,"682,083,968",12/31/23,"26,976,000","-180,664,000",,"595,344,000"
34805,Inventory,"Inventory - Valuation of merchandise inventories, net for slow-moving or obsolete merchandise reserves - Refer to Note 2 to the financial statements",526991,12/31/23,02/28/24,3,"Deloitte & Touche LLP",,,,"Los Angeles",CA,CALIFORNIA,"US West",10-K,2024-02-28,,"BIG 5 SPORTING GOODS Corp",1156388,"=""BGFV""","2525 EAST EL SEGUNDO BOULEVARD",,"EL SEGUNDO",CA,CALIFORNIA,"US West",,,"=""5940""","Retail-Miscellaneous Shopping Goods Stores",451110,"Sporting Goods Stores",34,6,12/31/23,"142,271,888",12/31/23,"884,745,000","-7,083,000",,"644,683,000"
34227,"Property, plant and equipment","Property and Equipment — Refer to Notes 1 and 6 to the financial statements",526310,12/31/23,02/24/24,3,"Deloitte & Touche LLP",,,,Austin,TX,TEXAS,"US Southwest",10-K,2024-02-26,,"Biglari Holdings Inc.",1726173,"=""BH""","19100 RIDGEWOOD PKWY, SUITE 1200",,"SAN ANTONIO",TX,TEXAS,"US Southwest",,,"=""5812""","Eating and Drinking Places",722110,"Full-Service Restaurants",34,165,12/31/23,"341,180,800",12/31/23,"365,318,000","41,177,912","522,570,000","849,422,000"
36682,"Revenue from customer contracts","Revenue recognition for in-game virtual items",531335,12/31/23,03/27/24,1,"PricewaterhouseCoopers LLP",94,"PricewaterhouseCoopers Zhong Tian LLP",1424,Beijing,F4,CHINA,Foreign,20-F,2024-03-27,,"Bilibili Inc.",1723690,"=""BILI""","17TH FLOOR, BUILDING 3, GUOZHENG CENTER","NO. 485 ZHENGLI ROAD, YANGPU DISTRICT",SHANGHAI,F4,CHINA,Foreign,,,"=""7374""","Computer Processing and Data Preparation and Processing Services",516110,"Internet Publishing and Broadcasting",34,12,01/02/24,"3,609,136,384",12/31/23,"3,176,446,000","-679,947,000","1,133,533,000","4,675,428,000"
31085,"Other liabilities and provisions","Funds Held for Customers and Customer Fund Deposits",516458,06/30/23,08/29/23,2,"Ernst & Young LLP",,,,"San Mateo",CA,CALIFORNIA,"US West",10-K,2023-08-29,,"BILL Holdings, Inc.",1786352,"=""BILL""","6220 AMERICA CENTER DR.","SUITE 100","SAN JOSE",CA,CALIFORNIA,"US West",,,"=""7372""","Prepackaged Software",511210,"Software Publishers",34,117,06/30/23,"12,450,367,488",06/30/23,"1,058,468,000","-223,725,000","1,328,033,000","9,636,018,000"
35601,"Research and development expenses","Prepaid or Accrued Research and Development Expenses",528861,12/31/23,03/07/24,2,"Ernst & Young LLP",,,,Houston,TX,TEXAS,"US Southwest",10-K,2024-03-07,Yes,"BIO-PATH HOLDINGS, INC.",1133818,"=""BPTH""","4710 BELLAIRE BOULEVARD","SUITE 210",BELLAIRE,TX,TEXAS,"US Southwest",,,"=""2834""","Pharmaceutical Preparations",541710,"Research and Development in the Physical, Engineering, and Life Sciences",34,9,12/31/23,"285,958",12/31/23,,"-16,078,000",,"3,220,000"
40539,"Research and development expenses","Prepaid or Accrued Research and Development Expenses",547402,12/31/23,03/07/24,2,"Ernst & Young LLP",,,,Houston,TX,TEXAS,"US Southwest",S-1,2025-01-21,Yes,"BIO-PATH HOLDINGS, INC.",1133818,"=""BPTH""","4710 BELLAIRE BOULEVARD","SUITE 210",BELLAIRE,TX,TEXAS,"US Southwest",,,"=""2834""","Pharmaceutical Preparations",541710,"Research and Development in the Physical, Engineering, and Life Sciences",34,9,12/31/23,"285,958",12/31/23,,"-16,078,000",,"3,220,000"
41053,"Research and development expenses","Prepaid or Accrued Research and Development Expenses",551033,12/31/23,03/07/24,2,"Ernst & Young LLP",,,,Houston,TX,TEXAS,"US Southwest",S-1/A,2025-02-12,Yes,"BIO-PATH HOLDINGS, INC.",1133818,"=""BPTH""","4710 BELLAIRE BOULEVARD","SUITE 210",BELLAIRE,TX,TEXAS,"US Southwest",,,"=""2834""","Pharmaceutical Preparations",541710,"Research and Development in the Physical, Engineering, and Life Sciences",34,9,12/31/23,"285,958",12/31/23,,"-16,078,000",,"3,220,000"
33010,"Financial statements and disclosures","Evaluation of the sufficiency of audit evidence over net sales",524945,12/31/23,02/16/24,4,"KPMG LLP",,,,"Santa Clara",CA,CALIFORNIA,"US West",10-K,2024-02-16,,"BIO-RAD LABORATORIES, INC.",12208,"=""BIO""","1000 ALFRED NOBEL DRIVE",,HERCULES,CA,CALIFORNIA,"US West",,,"=""3826""","Laboratory Analytical Instruments",334516,"Analytical Laboratory Instrument Manufacturing",34,328,01/02/24,"7,891,227,648",12/31/23,"2,671,262,000","-637,324,000","8,007,050,000","12,299,070,000"
31034,"Business combinations","Fair value measurement of the developed technology intangible asset acquired in the Namocell acquisition",516254,06/30/23,08/23/23,4,"KPMG LLP",,,,Minneapolis,MN,MINNESOTA,"US Midwest",10-K,2023-08-23,,"BIO-TECHNE Corp",842023,"=""TECH""","614 MCKINLEY PL N E","SUITE 1500",MINNEAPOLIS,MN,MINNESOTA,"US Midwest",,,"=""2836""","Biological Products, Except Diagnostic Substances",325413,"In-Vitro Diagnostic Substance Manufacturing",34,82,06/30/23,"12,868,308,992",06/30/23,"1,136,702,000","285,263,000","559,134,000","2,638,692,000"
36609,"Research and development expenses","Accrual of Clinical Trial Expenses",531167,12/31/23,03/26/24,2,"Ernst & Young LLP",,,,"San Diego",CA,CALIFORNIA,"US West",10-K,2024-03-26,,"BioAtla, Inc.",1826892,"=""BCAB""","11085 TORREYANA ROAD",,"SAN DIEGO",CA,CALIFORNIA,"US West",,,"=""2836""","Biological Products, Except Diagnostic Substances",325414,"Biological Product (except Diagnostic) Manufacturing",34,3,01/02/24,"127,029,888",12/31/23,,"-123,462,000",,"119,658,000"
31641,"Goodwill and intangible assets","Impairment Tests on Goodwill (Pro Farm Group, Inc. and Rizobacter S.A. Cash Generating Units) and Intangible Assets Not Yet Available for Use",519790,06/30/23,11/14/23,1,"PricewaterhouseCoopers LLP",88,"Price Waterhouse & Co SRL",1349,Rosario,C1,ARGENTINA,Foreign,20-F,2023-11-14,,"Bioceres Crop Solutions Corp.",1769484,"=""BIOX""","PO BOX 309, UGLAND HOUSE",,"GEORGE TOWN, GRAND CAYMAN",E9,"CAYMAN ISLANDS",Foreign,,,"=""2870""","Agricultural Chemicals",325320,"Pesticide and Other Agricultural Chemical Manufacturing",34,13,06/30/23,"838,964,928",06/30/23,"415,705,560","20,174,599","12,646,700","818,059,158"
31642,"Business combinations","Acquisition of Pro Farm Group, Inc. – Valuation of Intangible Assets",519790,06/30/23,11/14/23,1,"PricewaterhouseCoopers LLP",88,"Price Waterhouse & Co SRL",1349,Rosario,C1,ARGENTINA,Foreign,20-F,2023-11-14,,"Bioceres Crop Solutions Corp.",1769484,"=""BIOX""","PO BOX 309, UGLAND HOUSE",,"GEORGE TOWN, GRAND CAYMAN",E9,"CAYMAN ISLANDS",Foreign,,,"=""2870""","Agricultural Chemicals",325320,"Pesticide and Other Agricultural Chemical Manufacturing",34,13,06/30/23,"838,964,928",06/30/23,"415,705,560","20,174,599","12,646,700","818,059,158"
31643,"Foreign currency translation","Change in Functional Currency",519790,06/30/23,11/14/23,1,"PricewaterhouseCoopers LLP",88,"Price Waterhouse & Co SRL",1349,Rosario,C1,ARGENTINA,Foreign,20-F,2023-11-14,,"Bioceres Crop Solutions Corp.",1769484,"=""BIOX""","PO BOX 309, UGLAND HOUSE",,"GEORGE TOWN, GRAND CAYMAN",E9,"CAYMAN ISLANDS",Foreign,,,"=""2870""","Agricultural Chemicals",325320,"Pesticide and Other Agricultural Chemical Manufacturing",34,13,06/30/23,"838,964,928",06/30/23,"415,705,560","20,174,599","12,646,700","818,059,158"
34428,"Revenue from customer contracts","Royalty Financing Obligations",526761,12/31/23,02/27/24,2,"Ernst & Young LLP",,,,Raleigh,NC,"NORTH CAROLINA","US Southeast",10-K,2024-02-27,,"BIOCRYST PHARMACEUTICALS INC",882796,"=""BCRX""","4505 EMPEROR BOULEVARD","SUITE 200",DURHAM,NC,"NORTH CAROLINA","US Southeast",,,"=""2836""","Biological Products, Except Diagnostic Substances",325414,"Biological Product (except Diagnostic) Manufacturing",34,6,01/02/24,"1,243,192,960",12/31/23,"331,412,000","-226,539,000",,"516,960,000"
34429,"Sales return and allowances","Product Sales, net",526761,12/31/23,02/27/24,2,"Ernst & Young LLP",,,,Raleigh,NC,"NORTH CAROLINA","US Southeast",10-K,2024-02-27,,"BIOCRYST PHARMACEUTICALS INC",882796,"=""BCRX""","4505 EMPEROR BOULEVARD","SUITE 200",DURHAM,NC,"NORTH CAROLINA","US Southeast",,,"=""2836""","Biological Products, Except Diagnostic Substances",325414,"Biological Product (except Diagnostic) Manufacturing",34,6,01/02/24,"1,243,192,960",12/31/23,"331,412,000","-226,539,000",,"516,960,000"
32744,"Sales return and allowances","Reserves for Medicaid and Managed Care Rebates in the U.S.",524594,12/31/23,02/13/24,1,"PricewaterhouseCoopers LLP",,,,Boston,MA,MASSACHUSETTS,"US New England",10-K,2024-02-14,,"BIOGEN INC.",875045,"=""BIIB""","225 BINNEY STREET",,CAMBRIDGE,MA,MASSACHUSETTS,"US New England",,,"=""2836""","Biological Products, Except Diagnostic Substances",325414,"Biological Product (except Diagnostic) Manufacturing",34,259,12/31/23,"37,495,771,136",12/31/23,"9,835,600,000","1,161,100,000","217,200,000","26,844,800,000"
32745,"Business combinations","Acquisition of Reata - Valuation of Completed Technology and In-Process Research and Development Intangible Assets",524594,12/31/23,02/13/24,1,"PricewaterhouseCoopers LLP",,,,Boston,MA,MASSACHUSETTS,"US New England",10-K,2024-02-14,,"BIOGEN INC.",875045,"=""BIIB""","225 BINNEY STREET",,CAMBRIDGE,MA,MASSACHUSETTS,"US New England",,,"=""2836""","Biological Products, Except Diagnostic Substances",325414,"Biological Product (except Diagnostic) Manufacturing",34,259,12/31/23,"37,495,771,136",12/31/23,"9,835,600,000","1,161,100,000","217,200,000","26,844,800,000"
34978,"Research and development expenses","Accounting for Research and Development Costs and Related Prepaid and Accrued Costs",527551,12/31/23,02/29/24,2,"Ernst & Young LLP",,,,Hartford,CT,CONNECTICUT,"US New England",10-K,2024-02-29,,"Biohaven Ltd.",1935979,"=""BHVN""","215 CHURCH STREET",,"NEW HAVEN",CT,CONNECTICUT,"US New England",,,"=""2834""","Pharmaceutical Preparations",325412,"Pharmaceutical Preparation Manufacturing",34,42,01/02/24,"3,364,197,120",12/31/23,,"-408,168,000","408,185,000","513,212,000"
36671,"Revenue from customer contracts","Revenue Recognition and Determination of Standalone Selling Price – License Agreement with Hong Seng Technology Limited (“HST”) and Guangzhou Gloria Biosciences Co., Ltd. (“Gloria”)",531150,12/31/23,03/26/24,1,"PricewaterhouseCoopers LLP",223,"Kesselman & Kesselman",1309,"Tel Aviv",L3,ISRAEL,Foreign,20-F,2024-03-26,Yes,"BioLineRx Ltd.",1498403,"=""BLRX""","2 HAMAAYAN STREET","MODI-IN TECHNOLOGY PARK",MODI-IN,L3,ISRAEL,Foreign,,,"=""2834""","Pharmaceutical Preparations",541710,"Research and Development in the Physical, Engineering, and Life Sciences",34,2,01/02/24,"1,412,127,232",12/31/23,"4,800,000","-60,614,000","-1,631,000","63,925,000"
36673,"Revenue from customer contracts","Revenue Recognition and Determination of Standalone Selling Price - License Agreement with Hong Seng Technology Limited (“HST”) and Guangzhou Gloria Biosciences Co., Ltd. (“Gloria”)",531152,12/31/23,03/26/24,1,"PricewaterhouseCoopers LLP",223,"Kesselman & Kesselman",1309,"Tel Aviv",L3,ISRAEL,Foreign,20-F/A,2024-03-26,Yes,"BioLineRx Ltd.",1498403,"=""BLRX""","2 HAMAAYAN STREET","MODI-IN TECHNOLOGY PARK",MODI-IN,L3,ISRAEL,Foreign,,,"=""2834""","Pharmaceutical Preparations",541710,"Research and Development in the Physical, Engineering, and Life Sciences",34,2,01/02/24,"1,412,127,232",12/31/23,"4,800,000","-60,614,000","-1,631,000","63,925,000"
34244,"Revenue from customer contracts","Evaluation of variable consideration relating to ALDURAZYME product sales",526336,12/31/23,02/26/24,4,"KPMG LLP",,,,"San Francisco",CA,CALIFORNIA,"US West",10-K,2024-02-26,,"BIOMARIN PHARMACEUTICAL INC",1048477,"=""BMRN""","105 DIGITAL DRIVE",,NOVATO,CA,CALIFORNIA,"US West",,,"=""2834""","Pharmaceutical Preparations",325412,"Pharmaceutical Preparation Manufacturing",34,98,01/02/24,"18,469,498,880",12/31/23,"2,419,226,000","167,645,000","4,460,649,000","6,841,603,000"
36345,"Business combinations","Valuation of Intangible assets acquired within Business Combination of InstaDeep Ltd.",530607,12/31/23,03/20/24,2,"Ernst & Young LLP",892,"EY GmbH & Co KG Wirtschaftspruefungsgesellschaft",1251,Cologne,2M,GERMANY,Foreign,20-F,2024-03-20,,"BioNTech SE",1776985,"=""BNTX""","AN DER GOLDGRUBE 12",,MAINZ,2M,GERMANY,Foreign,,,"=""2836""","Biological Products, Except Diagnostic Substances",325414,"Biological Product (except Diagnostic) Manufacturing",33,106,12/31/23,"25,089,574,912",12/31/23,"4,218,700,000","1,027,700,000","21,076,000,000","25,414,000,000"
36346,"Revenue from customer contracts","Revenue recognition from collaboration partner’s COVID-19 vaccine sales",530607,12/31/23,03/20/24,2,"Ernst & Young LLP",892,"EY GmbH & Co KG Wirtschaftspruefungsgesellschaft",1251,Cologne,2M,GERMANY,Foreign,20-F,2024-03-20,,"BioNTech SE",1776985,"=""BNTX""","AN DER GOLDGRUBE 12",,MAINZ,2M,GERMANY,Foreign,,,"=""2836""","Biological Products, Except Diagnostic Substances",325414,"Biological Product (except Diagnostic) Manufacturing",33,106,12/31/23,"25,089,574,912",12/31/23,"4,218,700,000","1,027,700,000","21,076,000,000","25,414,000,000"
36347,"Other contingent liabilities","Claims and legal contingencies",530607,12/31/23,03/20/24,2,"Ernst & Young LLP",892,"EY GmbH & Co KG Wirtschaftspruefungsgesellschaft",1251,Cologne,2M,GERMANY,Foreign,20-F,2024-03-20,,"BioNTech SE",1776985,"=""BNTX""","AN DER GOLDGRUBE 12",,MAINZ,2M,GERMANY,Foreign,,,"=""2836""","Biological Products, Except Diagnostic Substances",325414,"Biological Product (except Diagnostic) Manufacturing",33,106,12/31/23,"25,089,574,912",12/31/23,"4,218,700,000","1,027,700,000","21,076,000,000","25,414,000,000"
36526,"Research and development expenses","Clinical trial expense and related accrued clinical trial expenses",530882,12/31/23,03/22/24,2,"Ernst & Young LLP",,,,Stamford,CT,CONNECTICUT,"US New England",10-K,2024-03-22,Yes,"BioXcel Therapeutics, Inc.",1720893,"=""BTAI""","555 LONG WHARF DRIVE",,"NEW HAVEN",CT,CONNECTICUT,"US New England",,,"=""2834""","Pharmaceutical Preparations",325412,"Pharmaceutical Preparation Manufacturing",34,3,12/31/23,"88,293,488",12/31/23,"1,380,000","-179,053,000",,"73,702,000"
32192,"Goodwill and intangible assets","Impairment Evaluation of Goodwill and Indefinite Lived Intangibles",523309,09/30/23,01/18/24,2,"Ernst & Young LLP",271,"Ernst & Young GmbH Wirtschaftsprüfungsgesellschaft (Inactive)",1251,Cologne,2M,GERMANY,Foreign,20-F,2024-01-18,,"Birkenstock Holding plc",1977102,"=""BIRK""","1-2 BERKELEY SQUARE",,LONDON,X0,"UNITED KINGDOM",Foreign,,,"=""3140""","Footwear, (No Rubber)",0,,34,,,,09/30/23,"1,579,561,000","79,430,000","-951,884,000","5,111,084,000"
32193,"Deferred and stock-based compensation","Valuation of Stock-Based Compensation Awards",523309,09/30/23,01/18/24,2,"Ernst & Young LLP",271,"Ernst & Young GmbH Wirtschaftsprüfungsgesellschaft (Inactive)",1251,Cologne,2M,GERMANY,Foreign,20-F,2024-01-18,,"Birkenstock Holding plc",1977102,"=""BIRK""","1-2 BERKELEY SQUARE",,LONDON,X0,"UNITED KINGDOM",Foreign,,,"=""3140""","Footwear, (No Rubber)",0,,34,,,,09/30/23,"1,579,561,000","79,430,000","-951,884,000","5,111,084,000"
30451,"Going concern","Assessment of the Company’s ability to continue as a going concern",513790,03/25/23,06/22/23,4,"KPMG LLP",187,"KPMG LLP Chartered Accountants",85,Montreal,A8,QUEBEC,Canada,20-F,2023-06-23,,"BIRKS GROUP INC.",1179821,"=""BGI""","2020 ROBERT BOURASSA","SUITE 200",MONTREAL,A8,QUEBEC,Canada,,,"=""5944""","Jewelry Stores",448310,"Jewelry Stores",34,8,03/27/23,"86,903,312",03/25/23,"162,950,000","-7,432,000","-7,602,000","196,981,000"
30452,Inventory,"Evaluation of the reserve for slow-moving finished goods inventories",513790,03/25/23,06/22/23,4,"KPMG LLP",187,"KPMG LLP Chartered Accountants",85,Montreal,A8,QUEBEC,Canada,20-F,2023-06-23,,"BIRKS GROUP INC.",1179821,"=""BGI""","2020 ROBERT BOURASSA","SUITE 200",MONTREAL,A8,QUEBEC,Canada,,,"=""5944""","Jewelry Stores",448310,"Jewelry Stores",34,8,03/27/23,"86,903,312",03/25/23,"162,950,000","-7,432,000","-7,602,000","196,981,000"
27532,"Other contingent liabilities","Workers’ Compensation and General Liability Reserves",505285,01/28/23,03/16/23,1,"PricewaterhouseCoopers LLP",,,,Boston,MA,MASSACHUSETTS,"US New England",10-K,2023-03-16,,"BJ's Wholesale Club Holdings, Inc.",1531152,"=""BJ""","350 CAMPUS DRIVE",,MARLBOROUGH,MA,MASSACHUSETTS,"US New England",,,"=""5331""","Variety Stores",452910,"Warehouse Clubs and Supercenters",34,72,01/31/23,"9,703,950,336",01/28/23,"19,315,165,000","513,177,000","-77,484,000","6,349,956,000"
27533,"Business combinations","Acquisition of assets and operations of four distribution centers and the related private transportation fleet from Burris Logistics, LLC.",505285,01/28/23,03/16/23,1,"PricewaterhouseCoopers LLP",,,,Boston,MA,MASSACHUSETTS,"US New England",10-K,2023-03-16,,"BJ's Wholesale Club Holdings, Inc.",1531152,"=""BJ""","350 CAMPUS DRIVE",,MARLBOROUGH,MA,MASSACHUSETTS,"US New England",,,"=""5331""","Variety Stores",452910,"Warehouse Clubs and Supercenters",34,72,01/31/23,"9,703,950,336",01/28/23,"19,315,165,000","513,177,000","-77,484,000","6,349,956,000"
34464,"Long-lived assets","Evaluation of long-lived assets for impairment",526539,01/02/24,02/27/24,4,"KPMG LLP",,,,"Los Angeles",CA,CALIFORNIA,"US West",10-K,2024-02-27,,"BJs RESTAURANTS INC",1013488,"=""BJRI""","7755 CENTER AVENUE","SUITE 300","HUNTINGTON BEACH",CA,CALIFORNIA,"US West",,,"=""5812""","Eating and Drinking Places",722110,"Full-Service Restaurants",34,33,01/04/24,"755,667,200",01/02/24,"1,333,229,000","19,660,000","361,088,000","1,058,454,000"
32782,"Regulatory assets and liabilities","Regulatory Accounting — Impact of Rate Regulation on the Financial Statements — Refer to Notes 1 and 2 to the Financial Statements.",524628,12/31/23,02/14/24,3,"Deloitte & Touche LLP",,,,Minneapolis,MN,MINNESOTA,"US Midwest",10-K,2024-02-14,,"BLACK HILLS CORP /SD/",1130464,"=""BKH""","7001 MT RUSHMORE RD","PO BOX 1400","RAPID CITY",SD,"SOUTH DAKOTA","US Midwest",,,"=""4911""","Electric Services",221119,"Other Electric Power Generation",34,55,01/02/24,"3,753,138,688",12/31/23,"2,331,300,000","262,200,000","1,907,400,000","9,620,400,000"
33134,"Proven and unproven reserves","Depreciation, Depletion and Amortization (“DD&A”) of Oil and Natural Gas Properties",525125,12/31/23,02/20/24,2,"Ernst & Young LLP",,,,Houston,TX,TEXAS,"US Southwest",10-K,2024-02-20,,"Black Stone Minerals, L.P.",1621434,"=""BSM""","1001 FANNIN STREET, SUITE 2020",,HOUSTON,TX,TEXAS,"US Southwest",,,"=""1311""","Crude Petroleum and Natural Gas",211111,"Crude Petroleum and Natural Gas Extraction",34,16,12/31/23,"3,351,459,840",12/31/23,"592,216,000","422,549,000",,"1,266,884,000"
33135,"Revenue from customer contracts","Revenues from Contracts with Customers Accrual",525125,12/31/23,02/20/24,2,"Ernst & Young LLP",,,,Houston,TX,TEXAS,"US Southwest",10-K,2024-02-20,,"Black Stone Minerals, L.P.",1621434,"=""BSM""","1001 FANNIN STREET, SUITE 2020",,HOUSTON,TX,TEXAS,"US Southwest",,,"=""1311""","Crude Petroleum and Natural Gas",211111,"Crude Petroleum and Natural Gas Extraction",34,16,12/31/23,"3,351,459,840",12/31/23,"592,216,000","422,549,000",,"1,266,884,000"
33307,"Revenue from customer contracts","Revenue Recognition - Payment Processing Services",525221,12/31/23,02/21/24,2,"Ernst & Young LLP",,,,Raleigh,NC,"NORTH CAROLINA","US Southeast",10-K,2024-02-21,,"BLACKBAUD INC",1280058,"=""BLKB""","65 FAIRCHILD STREET",,CHARLESTON,SC,"SOUTH CAROLINA","US Southeast",,,"=""7372""","Prepackaged Software",511210,"Software Publishers",34,86,01/02/24,"4,608,168,448",12/31/23,"1,105,432,000","1,820,000","-987,164,000","2,912,279,000"
28603,"Long-lived assets","Impairment Tests of Goodwill for the BlackBerry Spark Reporting Unit and of the Long-Lived Assets for the Unified Endpoint Security (UES) Asset Group",507397,02/28/23,03/31/23,1,"PricewaterhouseCoopers LLP",191,"PricewaterhouseCoopers LLP Chartered Accountants",271,Toronto,A6,ONTARIO,Canada,10-K,2023-03-31,,"BLACKBERRY Ltd",1070235,"=""BB""","2200 UNIVERSITY AVENUE EAST",*,WATERLOO,A6,ONTARIO,Canada,,,"=""7372""","Prepackaged Software",518210,"Data Processing, Hosting, and Related Services",34,4,02/28/23,"2,258,769,920",02/28/23,"526,300,000","-734,400,000","59,000,000","1,679,000,000"
33836,"Revenue from customer contracts","Revenue Recognition – Certain Subscription and Support Revenue",526111,12/31/23,02/23/24,1,"PricewaterhouseCoopers LLP",,,,"Los Angeles",CA,CALIFORNIA,"US West",10-K,2024-02-23,,"BLACKLINE, INC.",1666134,"=""BL""","21300 VICTORY BOULEVARD","12TH FLOOR","WOODLAND HILLS",CA,CALIFORNIA,"US West",,,"=""7372""","Prepackaged Software",511210,"Software Publishers",34,62,12/31/23,"3,841,003,264",12/31/23,"589,996,000","52,833,000","-274,905,000","2,100,765,000"
35414,"Other investments","Investment Valuation — Level 3 Investments — Refer to Note 2 to the financial statements",528265,12/31/23,03/05/24,3,"Deloitte & Touche LLP",,,,"Los Angeles",CA,CALIFORNIA,"US West",10-K,2024-03-05,,"BlackRock Capital Investment Corp",1326003,,"50 HUDSON YARDS",,"NEW YORK",NY,"NEW YORK","US Mid Atlantic",,,,,523920,"Portfolio Management",34,4,12/31/23,"280,853,280",12/31/23,"58,643,557","26,236,270",,"627,285,472"
33946,"Other intangible assets","Impairment of indefinite-lived intangible assets related to certain management contracts — Refer to Notes 2 and 11 to the financial statements",526024,12/31/23,02/23/24,3,"Deloitte & Touche LLP",,,,"New York",NY,"NEW YORK","US Mid Atlantic",10-K,2024-02-23,,"BlackRock Finance, Inc.",1364742,,"50 HUDSON YARDS",,"NEW YORK",NY,"NEW YORK","US Mid Atlantic",,,"=""6211""","Security Brokers, Dealers, and Flotation Companies",523120,"Securities Brokerage",34,800,01/02/24,"119,054,606,336",12/31/23,"17,567,000,000","5,502,000,000","7,305,000,000","123,211,000,000"
35090,"Other investments","Investment Valuation — Level 3 Investments — Refer to Note 2 to the financial statements",527390,12/31/23,02/29/24,3,"Deloitte & Touche LLP",,,,"Los Angeles",CA,CALIFORNIA,"US West",10-K,2024-02-29,,"BlackRock TCP Capital Corp.",1370755,"=""TCPC""","2951 28TH STREET","SUITE 1000","SANTA MONICA",CA,CALIFORNIA,"US West",,,,,525990,"Other Financial Vehicles",34,12,12/31/23,"666,634,240",12/31/23,"161,518,143","38,474,432",,"1,698,772,353"
33998,"Other investments","Fair Value of Certain Underlying Investments to determine Performance Allocations and Accrued Performance Allocations — Refer to Notes 2 and 4 to the financial statements",526054,12/31/23,02/23/24,3,"Deloitte & Touche LLP",,,,"New York",NY,"NEW YORK","US Mid Atlantic",10-K,2024-02-23,,"Blackstone Inc.",1393818,"=""BX""","345 PARK AVENUE",,"NEW YORK",NY,"NEW YORK","US Mid Atlantic",,,"=""6282""","Investment Advice",523920,"Portfolio Management",34,128,01/02/24,"91,141,562,368",12/31/23,"7,590,973,000","1,390,880,000","5,904,461,000","40,287,530,000"
40109,"Other investments","Fair Value of Certain Underlying Investments to determine Performance Allocations and Accrued Performance Allocations — Refer to Notes 2 and 4 to the financial statements",544456,12/31/23,02/23/24,3,"Deloitte & Touche LLP",,,,"New York",NY,"NEW YORK","US Mid Atlantic",8-K,2024-11-25,,"Blackstone Inc.",1393818,"=""BX""","345 PARK AVENUE",,"NEW YORK",NY,"NEW YORK","US Mid Atlantic",,,"=""6282""","Investment Advice",523920,"Portfolio Management",34,128,01/02/24,"91,141,562,368",12/31/23,"7,590,973,000","1,390,880,000","5,904,461,000","40,287,530,000"
32676,"Allowance for credit losses","Current Expected Credit Loss (“CECL”) Reserve – Adjustments to Reflect Management’s Estimation of Economic Conditions – Refer to Note 2 in the Financial Statements",524605,12/31/23,02/14/24,3,"Deloitte & Touche LLP",,,,"New York",NY,"NEW YORK","US Mid Atlantic",10-K,2024-02-14,,"BLACKSTONE MORTGAGE TRUST, INC.",1061630,"=""BXMT""","345 PARK AVENUE","24TH FLOOR","NEW YORK",NY,"NEW YORK","US Mid Atlantic",,,"=""6798""","Real Estate Investment Trusts",525990,"Other Financial Vehicles",34,21,12/31/23,"3,684,175,360",12/31/23,"420,875,000","246,555,000",,"24,036,178,000"
32677,"Accounts/loans receivable","CECL Reserve – Estimation of Fair Value of Underlying Collateral of Impaired Loans – Refer to Note 2 and Note 3 in the Financial Statements",524605,12/31/23,02/14/24,3,"Deloitte & Touche LLP",,,,"New York",NY,"NEW YORK","US Mid Atlantic",10-K,2024-02-14,,"BLACKSTONE MORTGAGE TRUST, INC.",1061630,"=""BXMT""","345 PARK AVENUE","24TH FLOOR","NEW YORK",NY,"NEW YORK","US Mid Atlantic",,,"=""6798""","Real Estate Investment Trusts",525990,"Other Financial Vehicles",34,21,12/31/23,"3,684,175,360",12/31/23,"420,875,000","246,555,000",,"24,036,178,000"
36076,"Other investments","Investments – Level 3 Fair Value Measurements – Refer to Footnote 2 and 5 in the financial statements",530229,12/31/23,03/15/24,3,"Deloitte & Touche LLP",,,,"New York",NY,"NEW YORK","US Mid Atlantic",10-K,2024-03-15,,"Blackstone Private Credit Fund",1803498,,"345 PARK AVENUE","31ST FLOOR","NEW YORK",NY,"NEW YORK","US Mid Atlantic",,,,,525990,"Other Financial Vehicles",34,,,,12/31/23,"5,738,009,000","3,058,462,000","28,534,437,000","53,317,236,000"
36367,"Other investments","Investments – Level 3 Fair Value Measurements – Refer to Footnote 2 and 5 in the financial statements",530625,12/31/23,03/15/24,3,"Deloitte & Touche LLP",,,,"New York",NY,"NEW YORK","US Mid Atlantic",424B3,2024-03-20,,"Blackstone Private Credit Fund",1803498,,"345 PARK AVENUE","31ST FLOOR","NEW YORK",NY,"NEW YORK","US Mid Atlantic",,,,,525990,"Other Financial Vehicles",34,,,,12/31/23,"5,738,009,000","3,058,462,000","28,534,437,000","53,317,236,000"
37951,"Other investments","Investments – Level 3 Fair Value Measurements – Refer to Footnote 2 and 5 in the financial statements",534692,12/31/23,03/15/24,3,"Deloitte & Touche LLP",,,,"New York",NY,"NEW YORK","US Mid Atlantic",N-2,2024-04-26,,"Blackstone Private Credit Fund",1803498,,"345 PARK AVENUE","31ST FLOOR","NEW YORK",NY,"NEW YORK","US Mid Atlantic",,,,,525990,"Other Financial Vehicles",34,,,,12/31/23,"5,738,009,000","3,058,462,000","28,534,437,000","53,317,236,000"
40499,"Other investments","Investments – Level 3 Fair Value Measurements – Refer to Footnote 2 and 5 in the financial statements",547204,12/31/23,03/15/24,3,"Deloitte & Touche LLP",,,,"New York",NY,"NEW YORK","US Mid Atlantic",N-2/A,2025-01-14,,"Blackstone Private Credit Fund",1803498,,"345 PARK AVENUE","31ST FLOOR","NEW YORK",NY,"NEW YORK","US Mid Atlantic",,,,,525990,"Other Financial Vehicles",34,,,,12/31/23,"5,738,009,000","3,058,462,000","28,534,437,000","53,317,236,000"
40573,"Other investments","Investments – Level 3 Fair Value Measurements – Refer to Footnote 2 and 5 in the financial statements",547642,12/31/23,03/15/24,3,"Deloitte & Touche LLP",,,,"New York",NY,"NEW YORK","US Mid Atlantic",424B1,2025-01-24,,"Blackstone Private Credit Fund",1803498,,"345 PARK AVENUE","31ST FLOOR","NEW YORK",NY,"NEW YORK","US Mid Atlantic",,,,,525990,"Other Financial Vehicles",34,,,,12/31/23,"5,738,009,000","3,058,462,000","28,534,437,000","53,317,236,000"
36805,"Real estate investments","Impairments of Investment in Real Estate – Hold Period — Refer to Notes 2 and 3 to the financial statements",531571,12/31/23,03/28/24,3,"Deloitte & Touche LLP",,,,"New York",NY,"NEW YORK","US Mid Atlantic",10-K,2024-03-28,,"Blackstone Real Estate Income Trust, Inc.",1662972,"=""BSTT""","345 PARK AVENUE",,"NEW YORK",NY,"NEW YORK","US Mid Atlantic",,,"=""6798""","Real Estate Investment Trusts",525990,"Other Financial Vehicles",34,,,,12/31/23,"8,934,405,000","-691,822,000",,"130,797,795,000"
34652,"Other investments","Investments - Level 3 Fair Value Measurements — Refer to Footnote 2 and 5 in the financial statements",527038,12/31/23,02/28/24,3,"Deloitte & Touche LLP",,,,"New York",NY,"NEW YORK","US Mid Atlantic",10-K,2024-02-28,,"Blackstone Secured Lending Fund",1736035,"=""BXSL""","345 PARK AVENUE","31ST FLOOR","NEW YORK",NY,"NEW YORK","US Mid Atlantic",,,,,525990,"Other Financial Vehicles",34,28,12/31/23,"5,135,025,664",12/31/23,"877,097,000","611,951,000",,"10,134,618,000"
33641,"Allowance for credit losses","Allowance for Credit Losses related to Consumer Receivables",525595,12/31/23,02/22/24,2,"Ernst & Young LLP",,,,"San Francisco",CA,CALIFORNIA,"US West",10-K,2024-02-22,,"Block, Inc.",1512673,"=""XYZ""","1955 BROADWAY","SUITE 600",OAKLAND,CA,CALIFORNIA,"US West",,,"=""7372""","Prepackaged Software",511210,"Software Publishers",34,72,01/02/24,"39,978,752",12/31/23,"21,915,623,000","9,772,000","5,014,015,000","34,069,893,000"
32803,"Revenue from customer contracts","Product Revenue Recognition – Refer to Notes 2 and 3 to the financial statements",524805,12/31/23,02/15/24,3,"Deloitte & Touche LLP",,,,"San Jose",CA,CALIFORNIA,"US West",10-K,2024-02-15,,"Bloom Energy Corp",1664703,"=""BE""","4353 NORTH FIRST STREET",,"SAN JOSE",CA,CALIFORNIA,"US West",,,"=""3620""","Electrical Industrial Apparatus",335311,"Power, Distribution, and Specialty Transformer Manufacturing",34,15,12/31/23,"3,325,819,392",12/31/23,"1,333,470,000","-302,116,000",,"2,413,677,000"
32804,"Other investments","Amendment to Securities Purchase Agreement and Second Tranche Closing – Refer to Note 17 to the financial statements",524805,12/31/23,02/15/24,3,"Deloitte & Touche LLP",,,,"San Jose",CA,CALIFORNIA,"US West",10-K,2024-02-15,,"Bloom Energy Corp",1664703,"=""BE""","4353 NORTH FIRST STREET",,"SAN JOSE",CA,CALIFORNIA,"US West",,,"=""3620""","Electrical Industrial Apparatus",335311,"Power, Distribution, and Specialty Transformer Manufacturing",34,15,12/31/23,"3,325,819,392",12/31/23,"1,333,470,000","-302,116,000",,"2,413,677,000"
36612,"Revenue from customer contracts","Product Revenue Recognition - Refer to Notes 2 and 3 to the financial statements",531172,12/31/23,02/15/24,3,"Deloitte & Touche LLP",,,,"San Jose",CA,CALIFORNIA,"US West",ARS,2024-03-26,,"Bloom Energy Corp",1664703,"=""BE""","4353 NORTH FIRST STREET",,"SAN JOSE",CA,CALIFORNIA,"US West",,,"=""3620""","Electrical Industrial Apparatus",335311,"Power, Distribution, and Specialty Transformer Manufacturing",34,15,12/31/23,"3,325,819,392",12/31/23,"1,333,470,000","-302,116,000",,"2,413,677,000"
36613,"Other investments","Amendment to Securities Purchase Agreement and Second Tranche Closing - Refer to Note 17 to the financial statements",531172,12/31/23,02/15/24,3,"Deloitte & Touche LLP",,,,"San Jose",CA,CALIFORNIA,"US West",ARS,2024-03-26,,"Bloom Energy Corp",1664703,"=""BE""","4353 NORTH FIRST STREET",,"SAN JOSE",CA,CALIFORNIA,"US West",,,"=""3620""","Electrical Industrial Apparatus",335311,"Power, Distribution, and Specialty Transformer Manufacturing",34,15,12/31/23,"3,325,819,392",12/31/23,"1,333,470,000","-302,116,000",,"2,413,677,000"
34736,"Insurance contract liabilities","Valuation of Insurance Reserves",527066,12/31/23,02/28/24,1,"PricewaterhouseCoopers LLP",,,,Tampa,FL,FLORIDA,"US Southeast",10-K,2024-02-28,,"Bloomin' Brands, Inc.",1546417,"=""BLMN""","2202 NORTH WEST SHORE BOULEVARD","SUITE 500",TAMPA,FL,FLORIDA,"US Southeast",,,"=""5812""","Eating and Drinking Places",722110,"Full-Service Restaurants",34,27,01/02/24,"2,370,891,520",12/31/23,"4,168,160,000","247,386,000","-310,180,000","3,424,081,000"
33361,"Other investments","Assessment of Fair Value of Investments",525434,12/31/23,02/21/24,4,"KPMG LLP",,,,"New York",NY,"NEW YORK","US Mid Atlantic",10-K,2024-02-21,,"Blue Owl Capital Corp",1655888,"=""OBDC""","399 PARK AVENUE",,"NEW YORK",NY,"NEW YORK","US Mid Atlantic",,,,,525990,"Other Financial Vehicles",34,15,12/31/23,"5,752,457,216",12/31/23,"1,145,788,000","793,312,000",,"13,511,396,000"
35571,"Other investments","Assessment of Fair Value of Investments",529014,12/31/23,03/06/24,4,"KPMG LLP",,,,"New York",NY,"NEW YORK","US Mid Atlantic",10-K,2024-03-07,,"Blue Owl Capital Corp II",1655887,,"399 PARK AVENUE",,"NEW YORK",NY,"NEW YORK","US Mid Atlantic",,,,,525990,"Other Financial Vehicles",34,,,,12/31/23,"272,763,000","120,432,000","1,263,487,000","2,190,553,000"
33900,"Business combinations","Recoverability of finite-lived intangible assets",526008,12/31/23,02/23/24,4,"KPMG LLP",,,,"New York",NY,"NEW YORK","US Mid Atlantic",10-K,2024-02-23,,"BLUE OWL CAPITAL INC.",1823945,"=""OWL""","399 PARK AVENUE, 37TH FLOOR",,"NEW YORK",NY,"NEW YORK","US Mid Atlantic",,,"=""6282""","Investment Advice",523930,"Investment Advice",34,15,12/31/23,"6,919,938,048",12/31/23,"1,731,608,000","54,343,000","-4,805,922,000","8,817,621,000"
35572,"Other investments","Assessment of Fair Value of Investments",529006,12/31/23,03/06/24,4,"KPMG LLP",,,,"New York",NY,"NEW YORK","US Mid Atlantic",10-K,2024-03-07,,"Blue Owl Credit Income Corp.",1812554,,"399 PARK AVENUE",,"NEW YORK",NY,"NEW YORK","US Mid Atlantic",,,,,525990,"Other Financial Vehicles",34,,,,12/31/23,"1,549,939,000","819,124,000","8,892,546,000","17,256,482,000"
35620,"Other investments","Assessment of Fair Value of Investments",529525,12/31/23,03/06/24,4,"KPMG LLP",,,,"New York",NY,"NEW YORK","US Mid Atlantic",424B3,2024-03-08,,"Blue Owl Credit Income Corp.",1812554,,"399 PARK AVENUE",,"NEW YORK",NY,"NEW YORK","US Mid Atlantic",,,,,525990,"Other Financial Vehicles",34,,,,12/31/23,"1,549,939,000","819,124,000","8,892,546,000","17,256,482,000"
37305,"Other investments","Assessment of Fair Value of Investments",532454,12/31/23,03/06/24,4,"KPMG LLP",,,,"New York",NY,"NEW YORK","US Mid Atlantic",N-2,2024-04-02,,"Blue Owl Credit Income Corp.",1812554,,"399 PARK AVENUE",,"NEW YORK",NY,"NEW YORK","US Mid Atlantic",,,,,525990,"Other Financial Vehicles",34,,,,12/31/23,"1,549,939,000","819,124,000","8,892,546,000","17,256,482,000"
38729,"Other investments","Assessment of Fair Value of Investments",538035,12/31/23,03/06/24,4,"KPMG LLP",,,,"New York",NY,"NEW YORK","US Mid Atlantic",N-2,2024-06-26,,"Blue Owl Credit Income Corp.",1812554,,"399 PARK AVENUE",,"NEW YORK",NY,"NEW YORK","US Mid Atlantic",,,,,525990,"Other Financial Vehicles",34,,,,12/31/23,"1,549,939,000","819,124,000","8,892,546,000","17,256,482,000"
40197,"Other investments","Assessment of Fair Value of Investments",545164,12/31/23,03/06/24,4,"KPMG LLP",,,,"New York",NY,"NEW YORK","US Mid Atlantic",486BPOS,2024-12-06,,"Blue Owl Credit Income Corp.",1812554,,"399 PARK AVENUE",,"NEW YORK",NY,"NEW YORK","US Mid Atlantic",,,,,525990,"Other Financial Vehicles",34,,,,12/31/23,"1,549,939,000","819,124,000","8,892,546,000","17,256,482,000"
35444,"Other investments","Assessment of Fair Value of Investments",528617,12/31/23,03/06/24,4,"KPMG LLP",,,,"New York",NY,"NEW YORK","US Mid Atlantic",10-K,2024-03-06,,"Blue Owl Technology Finance Corp.",1747777,"=""OTF""","399 PARK AVENUE",,"NEW YORK",NY,"NEW YORK","US Mid Atlantic",,,,,525990,"Other Financial Vehicles",34,,,,12/31/23,"683,814,000","366,150,000","3,529,994,000","6,652,183,000"
39463,"Research and development expenses","Accrued Clinical and Contract Research Organization Costs",541196,12/31/23,09/13/24,2,"Ernst & Young LLP",,,,Boston,MA,MASSACHUSETTS,"US New England",10-K,2024-09-13,Yes,"bluebird bio, Inc.",1293971,,"455 GRAND UNION BOULEVARD",,SOMERVILLE,MA,MASSACHUSETTS,"US New England",,,"=""2836""","Biological Products, Except Diagnostic Substances",325414,"Biological Product (except Diagnostic) Manufacturing",34,1,12/31/23,"266,025,360",12/31/23,"29,497,000","-211,913,000","178,453,000","619,161,000"
39464,Leases,"Embedded Leases in Contract Manufacturing Agreements",541196,12/31/23,09/13/24,2,"Ernst & Young LLP",,,,Boston,MA,MASSACHUSETTS,"US New England",10-K,2024-09-13,Yes,"bluebird bio, Inc.",1293971,,"455 GRAND UNION BOULEVARD",,SOMERVILLE,MA,MASSACHUSETTS,"US New England",,,"=""2836""","Biological Products, Except Diagnostic Substances",325414,"Biological Product (except Diagnostic) Manufacturing",34,1,12/31/23,"266,025,360",12/31/23,"29,497,000","-211,913,000","178,453,000","619,161,000"
33247,Goodwill,"Valuation of Goodwill",525079,12/30/23,02/20/24,2,"Ernst & Young LLP",,,,Atlanta,GA,GEORGIA,"US Southeast",10-K,2024-02-20,,"BlueLinx Holdings Inc.",1301787,"=""BXC""","1950 SPECTRUM CIRCLE","SUITE 300",MARIETTA,GA,GEORGIA,"US Southeast",,,"=""5031""","Lumber, Plywood, Millwork, and Wood Panels",444190,"Other Building Material Dealers",34,113,12/31/23,"980,136,704",12/30/23,"3,136,381,000","48,536,000","548,122,000","1,537,601,000"
32916,"Research and development expenses","Accrued Clinical Trial Expenses",524765,12/31/23,02/15/24,2,"Ernst & Young LLP",,,,Boston,MA,MASSACHUSETTS,"US New England",10-K,2024-02-15,,"Blueprint Medicines Corp",1597264,,"45 SIDNEY STREET",,CAMBRIDGE,MA,MASSACHUSETTS,"US New England",,,"=""2834""","Pharmaceutical Preparations",325412,"Pharmaceutical Preparation Manufacturing",34,92,12/31/23,"5,640,221,184",12/31/23,"249,380,000","-506,984,000",,"1,049,250,000"
32365,Goodwill,"Goodwill — Refer to Notes 2 and 9 to the financial statements",524051,12/31/23,02/06/24,3,"Deloitte & Touche LLP",,,,Houston,TX,TEXAS,"US Southwest",10-K,2024-02-06,,"Boardwalk Pipeline Partners, LP",1336047,,"9 GREENWAY PLAZA, SUITE 2800",,HOUSTON,TX,TEXAS,"US Southwest",,,"=""4922""","Natural Gas Transmission",486210,"Pipeline Transportation of Natural Gas",34,,,,12/31/23,"1,617,700,000","386,000,000","5,553,700,000","9,696,400,000"
32366,"Business combinations","Acquisition — Purchase Price Allocation — Refer to Note 3 to the financial statements",524051,12/31/23,02/06/24,3,"Deloitte & Touche LLP",,,,Houston,TX,TEXAS,"US Southwest",10-K,2024-02-06,,"Boardwalk Pipeline Partners, LP",1336047,,"9 GREENWAY PLAZA, SUITE 2800",,HOUSTON,TX,TEXAS,"US Southwest",,,"=""4922""","Natural Gas Transmission",486210,"Pipeline Transportation of Natural Gas",34,,,,12/31/23,"1,617,700,000","386,000,000","5,553,700,000","9,696,400,000"
32290,"Revenue from customer contracts","Cost Estimates for Fixed-Price Development Contracts - Refer to Notes 1 and 13 to the financial statements",523769,12/31/23,01/31/24,3,"Deloitte & Touche LLP",,,,Chicago,IL,ILLINOIS,"US Midwest",10-K,2024-01-31,,"BOEING CO",12927,"=""BA""","100 N RIVERSIDE PLZ",,CHICAGO,IL,ILLINOIS,"US Midwest",,,"=""3721""",Aircraft,336411,"Aircraft Manufacturing",34,261,12/31/23,"158,876,188,672",12/31/23,"77,794,000,000","-2,222,000,000","-27,420,000,000","137,012,000,000"
32291,"Revenue from customer contracts","Program Accounting Estimates for the 777X Program — Refer to Notes 1 and 7 to the financial statements",523769,12/31/23,01/31/24,3,"Deloitte & Touche LLP",,,,Chicago,IL,ILLINOIS,"US Midwest",10-K,2024-01-31,,"BOEING CO",12927,"=""BA""","100 N RIVERSIDE PLZ",,CHICAGO,IL,ILLINOIS,"US Midwest",,,"=""3721""",Aircraft,336411,"Aircraft Manufacturing",34,261,12/31/23,"158,876,188,672",12/31/23,"77,794,000,000","-2,222,000,000","-27,420,000,000","137,012,000,000"
39103,"Revenue from customer contracts","Cost Estimates for Fixed-Price Development Contracts – Refer to Notes 1 and 13 to the financial statements",539945,12/31/23,01/31/24,3,"Deloitte & Touche LLP",,,,Chicago,IL,ILLINOIS,"US Midwest",S-4,2024-08-12,,"BOEING CO",12927,"=""BA""","100 N RIVERSIDE PLZ",,CHICAGO,IL,ILLINOIS,"US Midwest",,,"=""3721""",Aircraft,336411,"Aircraft Manufacturing",34,261,12/31/23,"158,876,188,672",12/31/23,"77,794,000,000","-2,222,000,000","-27,420,000,000","137,012,000,000"
39104,"Revenue from customer contracts","Program Accounting Estimates for the 777X Program – Refer to Notes 1 and 7 to the financial statements",539945,12/31/23,01/31/24,3,"Deloitte & Touche LLP",,,,Chicago,IL,ILLINOIS,"US Midwest",S-4,2024-08-12,,"BOEING CO",12927,"=""BA""","100 N RIVERSIDE PLZ",,CHICAGO,IL,ILLINOIS,"US Midwest",,,"=""3721""",Aircraft,336411,"Aircraft Manufacturing",34,261,12/31/23,"158,876,188,672",12/31/23,"77,794,000,000","-2,222,000,000","-27,420,000,000","137,012,000,000"
33169,"Sales return and allowances","Customer rebates payable for engineered wood products",525082,12/31/23,02/20/24,4,"KPMG LLP",,,,Boise,ID,IDAHO,"US West",10-K,2024-02-20,,"BOISE CASCADE Co",1328581,"=""BCC""","1111 WEST JEFFERSON STREET, SUITE 300","P. O. BOX 50",BOISE,ID,IDAHO,"US West",,,"=""5030""","Wholesale-Lumber & Other Construction Materials",321999,"All Other Miscellaneous Wood Product Manufacturing",34,129,12/31/23,"5,114,894,336",12/31/23,"6,838,245,000","483,656,000","1,834,667,000","3,458,646,000"
33391,"Allowance for credit losses","Allowance for credit losses",525394,12/31/23,02/21/24,2,"Ernst & Young LLP",,,,Tulsa,OK,OKLAHOMA,"US Southwest",10-K,2024-02-21,,"BOK FINANCIAL CORP",875357,"=""BOKF""","BANK OF OKLAHOMA TOWER","BOSTON AVENUE AT SECOND STREET",TULSA,OK,OKLAHOMA,"US Southwest",,,"=""6021""","National Commercial Banks",522110,"Commercial Banking",34,86,01/02/24,"5,646,519,808",12/31/23,"2,016,129,000","530,746,000","4,037,714,000","49,824,830,000"
33663,"Other revenue","Revenue - Refer to Notes 2 and 3 to the financial statements",525510,12/31/23,02/22/24,3,"Deloitte & Touche LLP",,,,Stamford,CT,CONNECTICUT,"US New England",10-K,2024-02-22,,"Booking Holdings Inc.",1075531,"=""BKNG""","800 CONNECTICUT AVE",,NORWALK,CT,CONNECTICUT,"US New England",,,"=""4700""","Transportation Services",561510,"Travel Agencies",34,"3,481",01/02/24,"121,436,299,264",12/31/23,"21,365,000,000","4,289,000,000","-7,183,000,000","24,342,000,000"
33664,Goodwill,"Goodwill - Refer to Notes 2 and 11 to the financial statements",525510,12/31/23,02/22/24,3,"Deloitte & Touche LLP",,,,Stamford,CT,CONNECTICUT,"US New England",10-K,2024-02-22,,"Booking Holdings Inc.",1075531,"=""BKNG""","800 CONNECTICUT AVE",,NORWALK,CT,CONNECTICUT,"US New England",,,"=""4700""","Transportation Services",561510,"Travel Agencies",34,"3,481",01/02/24,"121,436,299,264",12/31/23,"21,365,000,000","4,289,000,000","-7,183,000,000","24,342,000,000"
33665,"Other contingent liabilities","Commitments and Contingencies - Competition and Consumer Protection Reviews and Other Matters - Refer to Note 16 to the financial statements",525510,12/31/23,02/22/24,3,"Deloitte & Touche LLP",,,,Stamford,CT,CONNECTICUT,"US New England",10-K,2024-02-22,,"Booking Holdings Inc.",1075531,"=""BKNG""","800 CONNECTICUT AVE",,NORWALK,CT,CONNECTICUT,"US New England",,,"=""4700""","Transportation Services",561510,"Travel Agencies",34,"3,481",01/02/24,"121,436,299,264",12/31/23,"21,365,000,000","4,289,000,000","-7,183,000,000","24,342,000,000"
30016,Inventory,"Inventories – Refer to Note 2 to the financial statements",512212,04/01/23,05/18/23,3,"Deloitte & Touche LLP",,,,"Costa Mesa",CA,CALIFORNIA,"US West",10-K,2023-05-18,,"Boot Barn Holdings, Inc.",1610250,"=""BOOT""","17100 LAGUNA CANYON ROAD",,IRVINE,CA,CALIFORNIA,"US West",,,"=""5661""","Shoe Stores",448210,"Shoe Stores",34,77,04/03/23,"2,285,921,792",04/01/23,"1,657,615,000","170,553,000","518,197,000","1,517,381,000"
30163,"Revenue from customer contracts","Revenue recognition related to the cost-based input method",512622,03/31/23,05/26/23,2,"Ernst & Young LLP",,,,Tysons,VA,VIRGINIA,"US Mid Atlantic",10-K,2023-05-26,,"Booz Allen Hamilton Holding Corp",1443646,"=""BAH""","8283 GREENSBORO DRIVE",,MCLEAN,VA,VIRGINIA,"US Mid Atlantic",,,"=""8742""","Management Consulting Services",541611,"Administrative Management and General Management Consulting Services",34,93,03/31/23,"12,201,488,384",03/31/23,"9,258,911,000","271,791,000","-2,032,012,000","6,550,652,000"
30164,"Other contingent liabilities","Government Contracting Matters - Provision for Claimed Indirect Costs",512622,03/31/23,05/26/23,2,"Ernst & Young LLP",,,,Tysons,VA,VIRGINIA,"US Mid Atlantic",10-K,2023-05-26,,"Booz Allen Hamilton Holding Corp",1443646,"=""BAH""","8283 GREENSBORO DRIVE",,MCLEAN,VA,VIRGINIA,"US Mid Atlantic",,,"=""8742""","Management Consulting Services",541611,"Administrative Management and General Management Consulting Services",34,93,03/31/23,"12,201,488,384",03/31/23,"9,258,911,000","271,791,000","-2,032,012,000","6,550,652,000"
30165,"Uncertain tax positions","Unrecognized Tax Benefits",512622,03/31/23,05/26/23,2,"Ernst & Young LLP",,,,Tysons,VA,VIRGINIA,"US Mid Atlantic",10-K,2023-05-26,,"Booz Allen Hamilton Holding Corp",1443646,"=""BAH""","8283 GREENSBORO DRIVE",,MCLEAN,VA,VIRGINIA,"US Mid Atlantic",,,"=""8742""","Management Consulting Services",541611,"Administrative Management and General Management Consulting Services",34,93,03/31/23,"12,201,488,384",03/31/23,"9,258,911,000","271,791,000","-2,032,012,000","6,550,652,000"
30166,"Business combinations","Valuation of acquired intangible assets",512622,03/31/23,05/26/23,2,"Ernst & Young LLP",,,,Tysons,VA,VIRGINIA,"US Mid Atlantic",10-K,2023-05-26,,"Booz Allen Hamilton Holding Corp",1443646,"=""BAH""","8283 GREENSBORO DRIVE",,MCLEAN,VA,VIRGINIA,"US Mid Atlantic",,,"=""8742""","Management Consulting Services",541611,"Administrative Management and General Management Consulting Services",34,93,03/31/23,"12,201,488,384",03/31/23,"9,258,911,000","271,791,000","-2,032,012,000","6,550,652,000"
32449,"Other income taxes","Worldwide Provision for Income Taxes",524197,12/31/23,02/08/24,1,"PricewaterhouseCoopers LLP",,,,Detroit,MI,MICHIGAN,"US Midwest",10-K,2024-02-08,,"BORGWARNER INC",908255,"=""BWA""","3850 HAMLIN RD.",,"AUBURN HILLS",MI,MICHIGAN,"US Midwest",,,"=""3714""","Motor Vehicle Parts and Accessories",336399,"All Other Motor Vehicle Parts Manufacturing",34,36,01/02/24,"8,447,891,968",12/31/23,"14,198,000,000","625,000,000","2,251,000,000","14,453,000,000"
36686,"Property, plant and equipment","Jack-up drilling rigs impairment assessment",531331,12/31/23,03/27/24,1,"PricewaterhouseCoopers LLP",121,"PricewaterhouseCoopers LLP",876,Watford,X0,"UNITED KINGDOM",Foreign,20-F,2024-03-27,,"Borr Drilling Ltd",1715497,"=""BORR""","S.E. PEARMAN BUILDING","2ND FLOOR 9 PAR-LA-VILLE ROAD",HAMILTON,D0,BERMUDA,Foreign,,,"=""1381""","Drilling Oil and Gas Wells",213111,"Drilling Oil and Gas Wells",34,7,12/31/23,"1,859,003,776",12/31/23,"771,600,000","22,100,000",,"3,080,100,000"
34418,"Other intangible assets","Dogfish Head Trademark Intangible — Refer to Notes B, H, and N to the financial statements",526797,12/30/23,02/27/24,3,"Deloitte & Touche LLP",,,,Boston,MA,MASSACHUSETTS,"US New England",10-K,2024-02-27,,"BOSTON BEER CO INC",949870,"=""SAM""","ONE DESIGN CENTER PLACE","SUITE 850",BOSTON,MA,MASSACHUSETTS,"US New England",,,"=""2082""","Malt Beverages",312120,Breweries,34,349,12/28/23,"3,535,982,080",12/30/23,"2,008,625,000","76,250,000","905,756,000","1,429,993,000"
36728,"Real estate investments","Evaluating the fair value of the real estate assets in the 24th Street Funds",531314,12/31/23,03/27/24,4,"KPMG LLP",,,,Omaha,NE,NEBRASKA,"US Midwest",10-K,2024-03-27,,"BOSTON OMAHA Corp",1494582,"=""BOC""","1601 DODGE STREET","SUITE 3300",OMAHA,NE,NEBRASKA,"US Midwest",,,"=""6510""","Real Estate Operators (No Developers) & Lessors",531210,"Offices of Real Estate Agents and Brokers",34,16,12/31/23,"475,922,784",12/31/23,"96,253,736","-7,004,009","218,828,730","681,102,820"
34475,"Long-lived assets","Assessment of Impairment Indicators of Long-Lived Assets and Investments in Unconsolidated Joint Ventures",526551,12/31/23,02/27/24,1,"PricewaterhouseCoopers LLP",,,,Boston,MA,MASSACHUSETTS,"US New England",10-K,2024-02-27,,"BOSTON PROPERTIES LTD PARTNERSHIP",1043121,,"800 BOYLSTON STREET","SUITE 1900",BOSTON,MA,MASSACHUSETTS,"US New England",1037540,"BXP, Inc.","=""6798""","Real Estate Investment Trusts",525990,"Other Financial Vehicles",34,,,,12/31/23,"3,273,569,000","219,771,000",,"25,783,251,000"
34476,"Property, plant and equipment","Purchase Price Allocation for Long-Lived Asset Property Acquisitions",526551,12/31/23,02/27/24,1,"PricewaterhouseCoopers LLP",,,,Boston,MA,MASSACHUSETTS,"US New England",10-K,2024-02-27,,"BOSTON PROPERTIES LTD PARTNERSHIP",1043121,,"800 BOYLSTON STREET","SUITE 1900",BOSTON,MA,MASSACHUSETTS,"US New England",1037540,"BXP, Inc.","=""6798""","Real Estate Investment Trusts",525990,"Other Financial Vehicles",34,,,,12/31/23,"3,273,569,000","219,771,000",,"25,783,251,000"
33126,"Business combinations","Business Combinations",525101,12/31/23,02/20/24,2,"Ernst & Young LLP",,,,Boston,MA,MASSACHUSETTS,"US New England",10-K,2024-02-20,,"BOSTON SCIENTIFIC CORP",885725,"=""BSX""","300 BOSTON SCIENTIFIC WAY",,MARLBOROUGH,MA,MASSACHUSETTS,"US New England",,,"=""3841""","Surgical and Medical Instruments and Apparatus",339112,"Surgical and Medical Instrument Manufacturing",34,58,01/02/24,"84,734,607,360",12/31/23,"14,240,000,000","1,593,000,000","-1,109,000,000","35,134,000,000"
27241,"Revenue from customer contracts","Revenue recognition – evaluation of contract terms and conditions",504726,01/31/23,03/13/23,2,"Ernst & Young LLP",,,,"San Francisco",CA,CALIFORNIA,"US West",10-K,2023-03-13,,"BOX INC",1372612,"=""BOX""","900 JEFFERSON AVE",,"REDWOOD CITY",CA,CALIFORNIA,"US West",,,"=""7372""","Prepackaged Software",511210,"Software Publishers",34,32,01/31/23,"4,616,188,928",01/31/23,"990,874,000","26,783,000","-107,724,000","1,207,165,000"
34147,"Goodwill and intangible assets","Goodwill and Gaming License Rights Indefinite-Lived Intangible Assets",526432,12/31/23,02/26/24,3,"Deloitte & Touche LLP",,,,"Las Vegas",NV,NEVADA,"US West",10-K,2024-02-26,,"BOYD GAMING CORP",906553,"=""BYD""","6465 SOUTH RAINBOW BOULEVARD",,"LAS VEGAS",NV,NEVADA,"US West",,,"=""7011""","Hotels and Motels",721120,"Casino Hotels",34,64,01/02/24,"6,245,560,832",12/31/23,"3,738,492,000","620,023,000","-596,083,000","6,273,126,000"
35664,"Property, plant and equipment","1.Impairment of upstream oil and gas property, plant and equipment (PP&E) assets – Notes 1, 4 and 12 to the financial statements",529337,12/31/23,03/08/24,3,"Deloitte & Touche LLP",293,"Deloitte LLP",1147,London,X0,"UNITED KINGDOM",Foreign,20-F,2024-03-08,,"BP PLC",313807,"=""BP""","1 ST JAMES'S SQUARE",,LONDON,X0,"UNITED KINGDOM",Foreign,,,"=""2911""","Petroleum Refining",324110,"Petroleum Refineries",34,36,01/02/24,"112,995,213,312",12/31/23,"210,130,000,000","15,880,000,000","47,820,000,000","280,294,000,000"
35665,"Asset retirement and environmental obligations","2.Decommissioning provisions – Notes 1 and 23",529337,12/31/23,03/08/24,3,"Deloitte & Touche LLP",293,"Deloitte LLP",1147,London,X0,"UNITED KINGDOM",Foreign,20-F,2024-03-08,,"BP PLC",313807,"=""BP""","1 ST JAMES'S SQUARE",,LONDON,X0,"UNITED KINGDOM",Foreign,,,"=""2911""","Petroleum Refining",324110,"Petroleum Refineries",34,36,01/02/24,"112,995,213,312",12/31/23,"210,130,000,000","15,880,000,000","47,820,000,000","280,294,000,000"
35666,"Other liabilities and provisions","3. Accounting for complex transactions executed to deliver against the wider group strategy - Notes 1, 20, 22, 29 and 30 to the financial statements",529337,12/31/23,03/08/24,3,"Deloitte & Touche LLP",293,"Deloitte LLP",1147,London,X0,"UNITED KINGDOM",Foreign,20-F,2024-03-08,,"BP PLC",313807,"=""BP""","1 ST JAMES'S SQUARE",,LONDON,X0,"UNITED KINGDOM",Foreign,,,"=""2911""","Petroleum Refining",324110,"Petroleum Refineries",34,36,01/02/24,"112,995,213,312",12/31/23,"210,130,000,000","15,880,000,000","47,820,000,000","280,294,000,000"
35667,"Derivatives and hedging","4. Valuation of commodity financial derivatives, where fraud risks may arise in revenue recognition - Notes 1, 29 and 30 to the financial statements",529337,12/31/23,03/08/24,3,"Deloitte & Touche LLP",293,"Deloitte LLP",1147,London,X0,"UNITED KINGDOM",Foreign,20-F,2024-03-08,,"BP PLC",313807,"=""BP""","1 ST JAMES'S SQUARE",,LONDON,X0,"UNITED KINGDOM",Foreign,,,"=""2911""","Petroleum Refining",324110,"Petroleum Refineries",34,36,01/02/24,"112,995,213,312",12/31/23,"210,130,000,000","15,880,000,000","47,820,000,000","280,294,000,000"
35668,"Long-lived assets","5. Impairment of E&A assets, investments in joint ventures and refinery PP&E as a consequence, among other things, of climate change and the energy transition – Notes 1, 4, 15 and 16",529337,12/31/23,03/08/24,3,"Deloitte & Touche LLP",293,"Deloitte LLP",1147,London,X0,"UNITED KINGDOM",Foreign,20-F,2024-03-08,,"BP PLC",313807,"=""BP""","1 ST JAMES'S SQUARE",,LONDON,X0,"UNITED KINGDOM",Foreign,,,"=""2911""","Petroleum Refining",324110,"Petroleum Refineries",34,36,01/02/24,"112,995,213,312",12/31/23,"210,130,000,000","15,880,000,000","47,820,000,000","280,294,000,000"
31121,"Deferred income taxes","Taxes — Valuation Allowances — Refer to Notes 1 and 11 to the financial statements",516711,07/31/23,09/05/23,3,"Deloitte & Touche LLP",,,,Milwaukee,WI,WISCONSIN,"US Midwest",10-K,2023-09-05,,"BRADY CORP",746598,"=""BRC""","6555 W GOOD HOPE RD","P O BOX 571",MILWAUKEE,WI,WISCONSIN,"US Midwest",,,"=""3990""","Miscellaneous Manufacturing Industries",322222,"Coated and Laminated Paper Manufacturing",34,52,07/31/23,"2,321,550,080",07/31/23,"1,331,863,000","174,857,000","336,177,000","1,389,257,000"
37143,"Deferred and stock-based compensation","Stock-Based Compensation to Employees and Directors – Stock Options — Refer to Note 10 to the financial statements",532083,12/31/23,04/01/24,3,"Deloitte & Touche LLP",257,"Brightman Almagor Zohar & Co",1197,"Tel Aviv",L3,ISRAEL,Foreign,10-K,2024-04-01,Yes,"BRAINSTORM CELL THERAPEUTICS INC.",1137883,"=""BCLI""","1325 AVENUE OF AMERICAS","28TH FLOOR","NEW YORK",NY,"NEW YORK","US Mid Atlantic",,,"=""2836""","Biological Products, Except Diagnostic Substances",325413,"In-Vitro Diagnostic Substance Manufacturing",34,0,12/31/23,"16,332,086",12/31/23,,"-17,192,000",,"4,208,000"
28844,"Other contingent liabilities","Estimate of Workers' Compensation Self-Insurance Reserves",508027,01/28/23,04/04/23,2,"Ernst & Young LLP",,,,Nashville,TN,TENNESSEE,"US Southeast",10-K,2023-04-04,,"BRAND HOUSE COLLECTIVE, INC.",1056285,"=""KIRK""","5310 MARYLAND WAY",,BRENTWOOD,TN,TENNESSEE,"US Southeast",,,"=""5990""","Retail-Retail Stores, NEC",442299,"All Other Home Furnishings Stores",34,4,01/31/23,"46,680,988",01/28/23,"498,825,000","-44,694,000",,"274,246,000"
33779,"Real estate investments","Impairment Assessments of Real Estate Investments",525501,12/31/23,02/22/24,1,"PricewaterhouseCoopers LLP",,,,Philadelphia,PA,PENNSYLVANIA,"US Mid Atlantic",10-K,2024-02-22,,"BRANDYWINE OPERATING PARTNERSHIP, L.P.",1060386,,"C/O BRANDYWINE REALTY TRUST","2929 ARCH STREET, SUITE 1800",PHILADELPHIA,PA,PENNSYLVANIA,"US Mid Atlantic",790816,"BRANDYWINE REALTY TRUST","=""6798""","Real Estate Investment Trusts",525990,"Other Financial Vehicles",34,,,,12/31/23,"514,651,000","-197,381,000","1,313,653,000","3,732,447,000"
33484,"Real estate investments","Impairment Assessments of Real Estate Investments",525671,12/31/23,02/22/24,1,"PricewaterhouseCoopers LLP",,,,Philadelphia,PA,PENNSYLVANIA,"US Mid Atlantic",10-K,2024-02-22,,"BRANDYWINE REALTY TRUST",790816,"=""BDN""","2929 ARCH STREET","SUITE 1800",PHILADELPHIA,PA,PENNSYLVANIA,"US Mid Atlantic",,,"=""6798""","Real Estate Investment Trusts",525990,"Other Financial Vehicles",34,6,01/02/24,"949,979,072",12/31/23,"514,651,000","-196,789,000","1,309,690,000","3,732,447,000"
37507,"Asset retirement and environmental obligations","Evaluation of the provision and disclosures related to the geological event in the state of Alagoas",533116,12/31/23,04/11/24,4,"KPMG LLP",61,"KPMG Auditores Independentes",1124,"São Paulo",D5,BRAZIL,Foreign,20-F,2024-04-12,,"BRASKEM SA",1071438,"=""BAK""","RUA ETENO, 1561","POLO PETROQUIMICO DE CAMACARI",CAMACARI,D5,BRAZIL,Foreign,,,"=""2860""","Industrial Organic Chemicals",325110,"Petrochemical Manufacturing",34,9,01/02/24,"2,964,068,864",12/31/23,"14,528,000,000","-1,007,000,000","182,000,000","18,886,000,000"
28776,"Revenue from customer contracts","Timing and measurement of Revenue Recognition",507201,01/31/23,03/30/23,2,"Ernst & Young LLP",,,,"New York",NY,"NEW YORK","US Mid Atlantic",10-K,2023-03-31,,"Braze, Inc.",1676238,"=""BRZE""","63 MADISON BUILDING","28 E. 28TH ST., FLOOR 12 MAILROOM","NEW YORK",NY,"NEW YORK","US Mid Atlantic",,,"=""7372""","Prepackaged Software",511210,"Software Publishers",34,32,01/31/23,"1,970,751,104",01/31/23,"355,426,000","-138,966,000",,"705,406,000"
38774,"Discontinued operations","Discontinued operations - Distribution of Subsidiary Éxito to Shareholders - Refer to notes 1.2 and 33 to the consolidated financial statements",538127,12/31/23,06/28/24,3,"Deloitte & Touche LLP",4,"Deloitte Touche Tohmatsu Auditores Independentes",1045,"São Paulo",D5,BRAZIL,Foreign,20-F,2024-06-28,,"BRAZILIAN DISTRIBUTION CO COMPANHIA BRASILEIRA DE DISTR CBD",1038572,"=""CBDBY""","AV BRIGADEIRO LUIZ ANTONIO","3126 1 ANDAR SP","SAO PAULO",D5,BRAZIL,Foreign,,,"=""5411""","Grocery Stores",445110,"Supermarkets and Other Grocery (except Convenience) Stores",34,1,12/01/25,"205,227,352",12/31/23,"3,963,000,000","-439,000,000","565,000,000","4,539,000,000"
38775,"Other income taxes","Realization of recoverable taxes - Refer to note 11 to the consolidated financial statements",538127,12/31/23,06/28/24,3,"Deloitte & Touche LLP",4,"Deloitte Touche Tohmatsu Auditores Independentes",1045,"São Paulo",D5,BRAZIL,Foreign,20-F,2024-06-28,,"BRAZILIAN DISTRIBUTION CO COMPANHIA BRASILEIRA DE DISTR CBD",1038572,"=""CBDBY""","AV BRIGADEIRO LUIZ ANTONIO","3126 1 ANDAR SP","SAO PAULO",D5,BRAZIL,Foreign,,,"=""5411""","Grocery Stores",445110,"Supermarkets and Other Grocery (except Convenience) Stores",34,1,12/01/25,"205,227,352",12/31/23,"3,963,000,000","-439,000,000","565,000,000","4,539,000,000"
38776,"Uncertain tax positions","Tax Contingencies - Refer to note 21 to the consolidated financial statements",538127,12/31/23,06/28/24,3,"Deloitte & Touche LLP",4,"Deloitte Touche Tohmatsu Auditores Independentes",1045,"São Paulo",D5,BRAZIL,Foreign,20-F,2024-06-28,,"BRAZILIAN DISTRIBUTION CO COMPANHIA BRASILEIRA DE DISTR CBD",1038572,"=""CBDBY""","AV BRIGADEIRO LUIZ ANTONIO","3126 1 ANDAR SP","SAO PAULO",D5,BRAZIL,Foreign,,,"=""5411""","Grocery Stores",445110,"Supermarkets and Other Grocery (except Convenience) Stores",34,1,12/01/25,"205,227,352",12/31/23,"3,963,000,000","-439,000,000","565,000,000","4,539,000,000"
37851,"Other contingent liabilities","Litigation Contingencies",534352,12/31/23,04/25/24,1,"PricewaterhouseCoopers LLP",91,"PricewaterhouseCoopers Auditores Independentes",1351,"Rio de Janeiro",D5,BRAZIL,Foreign,20-F,2024-04-25,,"BRAZILIAN ELECTRIC POWER CO",1439124,"=""AXIA""","RUA DA QUITANDA, 196, 24TH FLOOR",CENTRO,"RIO DE JANEIRO",D5,BRAZIL,Foreign,,,"=""4911""","Electric Services",221111,"Hydroelectric Power Generation",34,9,12/31/23,"19,360,147,456",12/31/23,"7,649,643,000","904,739,000","6,683,781,000","54,977,284,000"
37852,"Property, plant and equipment","Assessment of Impairment for Property, Plant and Equipment and Investments in Associates",534352,12/31/23,04/25/24,1,"PricewaterhouseCoopers LLP",91,"PricewaterhouseCoopers Auditores Independentes",1351,"Rio de Janeiro",D5,BRAZIL,Foreign,20-F,2024-04-25,,"BRAZILIAN ELECTRIC POWER CO",1439124,"=""AXIA""","RUA DA QUITANDA, 196, 24TH FLOOR",CENTRO,"RIO DE JANEIRO",D5,BRAZIL,Foreign,,,"=""4911""","Electric Services",221111,"Hydroelectric Power Generation",34,9,12/31/23,"19,360,147,456",12/31/23,"7,649,643,000","904,739,000","6,683,781,000","54,977,284,000"
37853,"Revenue from customer contracts","Contractual transmission assets - Measurement",534352,12/31/23,04/25/24,1,"PricewaterhouseCoopers LLP",91,"PricewaterhouseCoopers Auditores Independentes",1351,"Rio de Janeiro",D5,BRAZIL,Foreign,20-F,2024-04-25,,"BRAZILIAN ELECTRIC POWER CO",1439124,"=""AXIA""","RUA DA QUITANDA, 196, 24TH FLOOR",CENTRO,"RIO DE JANEIRO",D5,BRAZIL,Foreign,,,"=""4911""","Electric Services",221111,"Hydroelectric Power Generation",34,9,12/31/23,"19,360,147,456",12/31/23,"7,649,643,000","904,739,000","6,683,781,000","54,977,284,000"
33213,"Allowance for credit losses","Allowance for Credit Losses for credit card loans — Refer to Notes 1 and 3 to the financial statements",525061,12/31/23,02/20/24,3,"Deloitte & Touche LLP",,,,Columbus,OH,OHIO,"US Midwest",10-K,2024-02-20,,"BREAD FINANCIAL HOLDINGS, INC.",1101215,"=""BFH""","3095 LOYALTY CIRCLE",,COLUMBUS,OH,OHIO,"US Midwest",,,"=""6141""","Personal Credit Institutions",518210,"Data Processing, Hosting, and Related Services",34,33,12/31/23,"1,623,942,016",12/31/23,"4,295,000,000","718,000,000","2,156,000,000","23,141,000,000"
33475,"Research and development expenses","Accrued Research and Development Liabilities, Prepaid expenses and other current assets, Other assets and Research and Development Expenses from Contract Research Organizations (CROs) and Contract Manufacturing Organizations (CMOs) — Refer to Notes 2 and 9 to the financial statements",525669,12/31/23,02/22/24,3,"Deloitte & Touche LLP",,,,"San Francisco",CA,CALIFORNIA,"US West",10-K,2024-02-22,,"BridgeBio Pharma, Inc.",1743881,"=""BBIO""","3160 PORTER DR.","SUITE 250","PALO ALTO",CA,CALIFORNIA,"US West",,,"=""2834""","Pharmaceutical Preparations",325414,"Biological Product (except Diagnostic) Manufacturing",34,40,12/31/23,"7,068,098,560",12/31/23,"9,303,000","-643,202,000","-1,380,098,000","546,380,000"
34434,"Revenue from customer contracts","Revenue - Refer to Notes 2 and 3 to the financial statements",526721,12/31/23,02/27/24,3,"Deloitte & Touche LLP",,,,Boston,MA,MASSACHUSETTS,"US New England",10-K,2024-02-27,,"BRIGHT HORIZONS FAMILY SOLUTIONS INC.",1437578,"=""BFAM""","2 WELLS AVENUE",,NEWTON,MA,MASSACHUSETTS,"US New England",,,"=""8351""","Child Day Care Services",624410,"Child Day Care Services",34,93,01/02/24,"5,411,792,384",12/31/23,"2,418,257,000","74,223,000","-790,305,000","3,896,144,000"
32091,"Goodwill and intangible assets","Goodwill and indefinite lived intangible assets — Overseas Schools reporting unit — Refer to Notes 2, 7 and 9 to the financial statements",522199,08/31/23,01/02/24,3,"Deloitte & Touche LLP",499,"Deloitte Touche Tohmatsu Certified Public Accountants LLP",1113,Shenzhen,F4,CHINA,Foreign,20-F,2024-01-02,,"Bright Scholar Education Holdings Ltd",1696355,"=""BEDU""","NO.1, COUNTRY GARDEN ROAD","BEIJIAO TOWN, SHUNDE DISTRICT","FOSHAN, GUANGDONG",F4,CHINA,Foreign,,,"=""8200""","Services-Educational Services",611110,"Elementary and Secondary Schools",34,1,08/29/23,"22,945,484",08/31/23,"243,083,000","-54,201,000","-578,000","633,660,000"
33561,"Revenue from customer contracts","Revenue Recognition – Variable Consideration",525548,12/31/23,02/22/24,2,"Ernst & Young LLP",,,,Boston,MA,MASSACHUSETTS,"US New England",10-K,2024-02-22,,"BRIGHTCOVE INC",1313275,,"281 SUMMER STREET",,BOSTON,MA,MASSACHUSETTS,"US New England",,,"=""7374""","Computer Processing and Data Preparation and Processing Services",511210,"Software Publishers",34,3,12/31/23,"113,180,200",12/31/23,"201,187,000","-22,886,000","12,686,000","216,107,000"
33470,"Insurance contract liabilities","Certain Assumptions Used in the Valuation of Liability for Future Policy Benefits – Refer to Notes 1 and 4 to the financial statements",525665,12/31/23,02/22/24,3,"Deloitte & Touche LLP",,,,Charlotte,NC,"NORTH CAROLINA","US Southeast",10-K,2024-02-22,,"Brighthouse Financial, Inc.",1685040,"=""BHF""","11225 N COMMUNITY HOUSE ROAD",,CHARLOTTE,NC,"NORTH CAROLINA","US Southeast",,,"=""6311""","Life Insurance",524113,"Direct Life Insurance Carriers",34,53,01/02/24,"3,391,939,584",12/31/23,"4,117,000,000","-1,112,000,000",,"236,340,000,000"
33471,"Other investments","Certain Assumptions Used in the Valuation of Market Risk Benefits – Refer to Notes 1, 5, and 11 to the financial statements",525665,12/31/23,02/22/24,3,"Deloitte & Touche LLP",,,,Charlotte,NC,"NORTH CAROLINA","US Southeast",10-K,2024-02-22,,"Brighthouse Financial, Inc.",1685040,"=""BHF""","11225 N COMMUNITY HOUSE ROAD",,CHARLOTTE,NC,"NORTH CAROLINA","US Southeast",,,"=""6311""","Life Insurance",524113,"Direct Life Insurance Carriers",34,53,01/02/24,"3,391,939,584",12/31/23,"4,117,000,000","-1,112,000,000",,"236,340,000,000"
34994,"Insurance contract liabilities","Certain Assumptions Used in the Valuation of Liability for Future Policy Benefits – Refer to Notes 1 and 4 to the financial statements",527699,12/31/23,02/29/24,3,"Deloitte & Touche LLP",,,,Charlotte,NC,"NORTH CAROLINA","US Southeast",10-K,2024-02-29,,"BRIGHTHOUSE LIFE INSURANCE Co",733076,,"11225 NORTH COMMUNITY HOUSE ROAD",,CHARLOTTE,NC,"NORTH CAROLINA","US Southeast",1099219,"METLIFE INC","=""6311""","Life Insurance",524113,"Direct Life Insurance Carriers",34,,,,12/31/23,"3,405,000,000","-1,124,000,000",,"226,204,000,000"
34995,"Insurance contract liabilities","Certain Assumptions Used in the Valuation of Market Risk Benefits – Refer to Notes 1, 5, and 11 to the financial statements",527699,12/31/23,02/29/24,3,"Deloitte & Touche LLP",,,,Charlotte,NC,"NORTH CAROLINA","US Southeast",10-K,2024-02-29,,"BRIGHTHOUSE LIFE INSURANCE Co",733076,,"11225 NORTH COMMUNITY HOUSE ROAD",,CHARLOTTE,NC,"NORTH CAROLINA","US Southeast",1099219,"METLIFE INC","=""6311""","Life Insurance",524113,"Direct Life Insurance Carriers",34,,,,12/31/23,"3,405,000,000","-1,124,000,000",,"226,204,000,000"
33279,"Allowance for credit losses","Current Expected Credit Loss (“CECL”) reserve",525318,12/31/23,02/21/24,2,"Ernst & Young LLP",,,,"New York",NY,"NEW YORK","US Mid Atlantic",10-K,2024-02-21,,"BrightSpire Capital, Inc.",1717547,"=""BRSP""","590 MADISON AVENUE","33RD FLOOR","NEW YORK",NY,"NEW YORK","US Mid Atlantic",,,"=""6798""","Real Estate Investment Trusts",525990,"Other Financial Vehicles",34,7,12/31/23,"967,089,216",12/31/23,"107,324,000","-39,161,000",,"4,198,254,000"
35462,"Other contingent liabilities","Valuation of self-insurance liabilities",528499,12/31/23,03/06/24,4,"KPMG LLP",,,,Louisville,KY,KENTUCKY,"US Mid Atlantic",10-K,2024-03-06,,"BrightSpring Health Services, Inc.",1865782,"=""BTSG""","805 N. WHITTINGTON PARKWAY",,LOUISVILLE,KY,KENTUCKY,"US Mid Atlantic",,,"=""8082""","Home Health Care Services",621610,"Home Health Care Services",34,,,,12/31/23,"8,826,175,000","-154,603,000","-2,878,009,000","5,532,721,000"
35785,"Revenue from customer contracts","Revenue Recognition – Identifying and Evaluating Contractual Terms and Conditions",529735,12/31/23,03/12/24,1,"PricewaterhouseCoopers LLP",,,,Boston,MA,MASSACHUSETTS,"US New England",20-F,2024-03-12,,"Brightstar Lottery PLC",1619762,"=""BRSL""","10 FINSBURY SQUARE","THIRD FLOOR",LONDON,X0,"UNITED KINGDOM",Foreign,,,"=""7990""","Services-Miscellaneous Amusement & Recreation",713290,"Other Gambling Industries",34,27,01/02/24,"5,454,761,984",12/31/23,"4,310,000,000","157,000,000","-1,322,000,000","10,466,000,000"
31683,Goodwill,"Goodwill – Maintenance Reporting Unit – Refer to Notes 2 and 7 to the financial statements",519870,09/30/23,11/16/23,3,"Deloitte & Touche LLP",,,,Philadelphia,PA,PENNSYLVANIA,"US Mid Atlantic",10-K,2023-11-16,,"BrightView Holdings, Inc.",1734713,"=""BV""","980 JOLLY ROAD","SUITE 300","BLUE BELL",PA,PENNSYLVANIA,"US Mid Atlantic",,,"=""0700""","Agricultural services",561730,"Landscaping Services",34,8,09/30/23,"725,400,000",09/30/23,"2,816,000,000","-7,700,000","-412,200,000","3,352,200,000"
31032,"Revenue from customer contracts","Assessment of gift card breakage revenue",516229,06/28/23,08/23/23,4,"KPMG LLP",,,,Dallas,TX,TEXAS,"US Southwest",10-K,2023-08-23,,"BRINKER INTERNATIONAL, INC",703351,"=""EAT""","3000 OLYMPUS BLVD.",,DALLAS,TX,TEXAS,"US Southwest",,,"=""5812""","Eating and Drinking Places",722110,"Full-Service Restaurants",34,37,06/30/23,"1,632,359,936",06/28/23,"4,133,200,000","102,600,000","-363,200,000","2,487,000,000"
34827,Goodwill,"Valuation of goodwill for the Europe reporting unit",527617,12/31/23,02/29/24,4,"KPMG LLP",,,,Richmond,VA,VIRGINIA,"US Mid Atlantic",10-K,2024-02-29,,"BRINKS CO",78890,"=""BCO""","1801 BAYBERRY COURT","P O BOX 18100",RICHMOND,VA,VIRGINIA,"US Mid Atlantic",,,"=""4731""","Arrangement of Transportation of  Freight and Cargo",561613,"Armored Car Services",34,86,01/02/24,"3,886,111,488",12/31/23,"4,874,600,000","87,700,000","-1,564,700,000","6,601,800,000"
32647,"Sales return and allowances","Gross-to-Net U.S. Rebate Accruals for U.S. Medicaid, Medicare Part D, and managed healthcare — Refer to “Note 2 – Revenue” to the financial statements",524523,12/31/23,02/12/24,3,"Deloitte & Touche LLP",,,,Morristown,NJ,"NEW JERSEY","US Mid Atlantic",10-K,2024-02-13,,"BRISTOL MYERS SQUIBB CO",14272,"=""BMY""","ROUTE 206 AND PROVINCE LINE ROAD",,PRINCETON,NJ,"NEW JERSEY","US Mid Atlantic",,,"=""2834""","Pharmaceutical Preparations",325412,"Pharmaceutical Preparation Manufacturing",34,53,01/02/24,"107,353,817,088",12/31/23,"45,006,000,000","8,025,000,000","-18,811,000,000","95,159,000,000"
32648,"Uncertain tax positions","Taxes — Unrecognized Tax Benefit Liabilities for U.S. Transfer Pricing — Refer to “Note 7- Income Taxes” to the financial statements",524523,12/31/23,02/12/24,3,"Deloitte & Touche LLP",,,,Morristown,NJ,"NEW JERSEY","US Mid Atlantic",10-K,2024-02-13,,"BRISTOL MYERS SQUIBB CO",14272,"=""BMY""","ROUTE 206 AND PROVINCE LINE ROAD",,PRINCETON,NJ,"NEW JERSEY","US Mid Atlantic",,,"=""2834""","Pharmaceutical Preparations",325412,"Pharmaceutical Preparation Manufacturing",34,53,01/02/24,"107,353,817,088",12/31/23,"45,006,000,000","8,025,000,000","-18,811,000,000","95,159,000,000"
35497,"Deferred income taxes","Realizability of certain deferred tax assets",528373,12/31/23,03/05/24,4,"KPMG LLP",,,,Houston,TX,TEXAS,"US Southwest",10-K,2024-03-06,,"Bristow Group Inc.",1525221,"=""VTOL""","3151 BRIARPARK DRIVE, SUITE 700",,HOUSTON,TX,TEXAS,"US Southwest",,,"=""4522""","Air Transportation, Nonscheduled",481111,"Scheduled Passenger Air Transportation",34,28,12/31/23,"800,323,712",12/31/23,"1,297,429,000","3,188,000",,"1,937,278,000"
32608,"Goodwill and intangible assets","Impairment analysis of goodwill and trademarks and similar intangibles with indefinite lives arising from the 2017 acquisition of Reynolds American Inc. (Reynolds American)",524339,12/31/23,02/07/24,4,"KPMG LLP",87,"KPMG LLP",1118,London,X0,"UNITED KINGDOM",Foreign,20-F,2024-02-09,,"British American Tobacco p.l.c.",1303523,"=""BTI""","GLOBE HOUSE","4 TEMPLE PLACE",LONDON,X0,"UNITED KINGDOM",Foreign,,,"=""2111""",Cigarettes,312221,"Cigarette Manufacturing",34,30,01/02/24,"73,214,648,320",12/31/23,"34,781,000,000","-18,088,000,000","-54,812,000,000","151,340,000,000"
32609,"Other contingent liabilities","Canadian legal proceedings",524339,12/31/23,02/07/24,4,"KPMG LLP",87,"KPMG LLP",1118,London,X0,"UNITED KINGDOM",Foreign,20-F,2024-02-09,,"British American Tobacco p.l.c.",1303523,"=""BTI""","GLOBE HOUSE","4 TEMPLE PLACE",LONDON,X0,"UNITED KINGDOM",Foreign,,,"=""2111""",Cigarettes,312221,"Cigarette Manufacturing",34,30,01/02/24,"73,214,648,320",12/31/23,"34,781,000,000","-18,088,000,000","-54,812,000,000","151,340,000,000"
32573,"Real estate investments","Impairment of Real Estate Assets — Refer to Notes 1 and 5 to the financial statements",524436,12/31/23,02/12/24,3,"Deloitte & Touche LLP",,,,Philadelphia,PA,PENNSYLVANIA,"US Mid Atlantic",10-K,2024-02-12,,"Brixmor Operating Partnership LP",1630031,,"100 PARK AVENUE",,"NEW YORK",NY,"NEW YORK","US Mid Atlantic",1581068,"Brixmor Property Group Inc.","=""6798""","Real Estate Investment Trusts",531120,"Lessors of Nonresidential Buildings (except Miniwarehouses)",34,,,,12/31/23,"1,245,036,000","305,087,000",,"8,332,716,000"
32548,"Real estate investments","Impairment of Real Estate Assets — Refer to Notes 1 and 5 to the financial statements",524435,12/31/23,02/12/24,3,"Deloitte & Touche LLP",,,,Philadelphia,PA,PENNSYLVANIA,"US Mid Atlantic",10-K,2024-02-12,,"Brixmor Property Group Inc.",1581068,"=""BRX""","100 PARK AVENUE",,"NEW YORK",NY,"NEW YORK","US Mid Atlantic",,,"=""6798""","Real Estate Investment Trusts",525990,"Other Financial Vehicles",34,23,12/31/23,"6,994,877,952",12/31/23,"1,245,036,000","305,087,000",,"8,332,716,000"
31933,"Uncertain tax positions","Uncertain Tax Positions (UTPs)",521218,10/29/23,12/14/23,1,"PricewaterhouseCoopers LLP",,,,"San Jose",CA,CALIFORNIA,"US West",10-K,2023-12-14,,"Broadcom Inc.",1730168,"=""AVGO""","3421 HILLVIEW AVENUE",,"PALO ALTO",CA,CALIFORNIA,"US West",,,"=""3674""","Semiconductors and Related Devices",334413,"Semiconductor and Related Device Manufacturing",34,841,10/31/23,"347,263,270,912",10/29/23,"35,819,000,000","14,082,000,000","-23,532,000,000","72,861,000,000"
30889,Goodwill,"Goodwill - Refer to Notes 2 and 10 to the financial statements",515752,06/30/23,08/08/23,3,"Deloitte & Touche LLP",,,,"New York",NY,"NEW YORK","US Mid Atlantic",10-K,2023-08-08,,"BROADRIDGE FINANCIAL SOLUTIONS, INC.",1383312,"=""BR""","5 DAKOTA DRIVE",,"LAKE SUCCESS",NY,"NEW YORK","US Mid Atlantic",,,"=""7389""","Business Services, NEC",522320,"Financial Transactions Processing, Reserve, and Clearinghouse Activities",34,166,06/30/23,"19,560,902,656",06/30/23,"6,060,900,000","630,600,000","-2,688,200,000","8,233,200,000"
33763,"Long-lived assets","Evaluation of long-lived asset impairment —Refer to Note 2 to the consolidated financial statements",525479,12/31/23,02/22/24,3,"Deloitte & Touche LLP",,,,Rochester,NY,"NEW YORK","US Mid Atlantic",10-K,2024-02-22,,"Broadstone Net Lease, Inc.",1424182,"=""BNL""","207 HIGH POINT DRIVE",,VICTOR,NY,"NEW YORK","US Mid Atlantic",,,"=""6798""","Real Estate Investment Trusts",525990,"Other Financial Vehicles",34,18,01/02/24,"3,286,360,064",12/31/23,"442,888,000","155,478,000","2,421,246,000","5,268,735,000"
33410,"Property, plant and equipment","Evaluation of Property, Plant and Equipment and Leasehold Intangibles, Net and Operating Lease Right-of-Use Assets for Impairment",525268,12/31/23,02/21/24,2,"Ernst & Young LLP",,,,Chicago,IL,ILLINOIS,"US Midwest",10-K,2024-02-21,,"Brookdale Senior Living Inc.",1332349,"=""BKD""","105 WESTWOOD PLACE","SUITE 400",BRENTWOOD,TN,TENNESSEE,"US Southeast",,,"=""8050""","Services-Nursing & Personal Care Facilities",623312,"Homes for the Elderly",34,6,01/02/24,"1,076,722,048",12/31/23,"3,015,829,000","-189,011,000","376,343,000","5,573,435,000"
36305,"Equity investments and joint ventures","Accounting for Equity Method Investment in Brookfield Asset Management ULC – Refer to Notes 2 and 3 to the financial statements",530502,12/31/23,03/19/24,3,"Deloitte & Touche LLP",468,"Deloitte LLP",1208,Toronto,A6,ONTARIO,Canada,40-F,2024-03-19,,"Brookfield Asset Management Ltd.",1937926,"=""BAM""","BROOKFIELD PLACE","250 VESEY STREET, 15TH FLOOR","NEW YORK",NY,"NEW YORK","US Mid Atlantic",,,"=""6282""","Investment Advice",541611,"Administrative Management and General Management Consulting Services",34,39,01/02/24,"16,005,803,008",12/31/23,"374,000,000","451,000,000",,"3,205,000,000"
36315,"Equity investments and joint ventures","Accounting for Equity Method Investment in Brookfield Asset Management ULC – Refer to Notes 2 and 3 to the financial statements",530544,12/31/23,03/19/24,3,"Deloitte & Touche LLP",468,"Deloitte LLP",1208,Toronto,A6,ONTARIO,Canada,6-K,2024-03-19,,"Brookfield Asset Management Ltd.",1937926,"=""BAM""","BROOKFIELD PLACE","250 VESEY STREET, 15TH FLOOR","NEW YORK",NY,"NEW YORK","US Mid Atlantic",,,"=""6282""","Investment Advice",541611,"Administrative Management and General Management Consulting Services",34,39,01/02/24,"16,005,803,008",12/31/23,"374,000,000","451,000,000",,"3,205,000,000"
35345,Goodwill,"Goodwill – Refer to Notes 2(m) and 15 to the financial statements",527953,12/31/23,03/01/24,3,"Deloitte & Touche LLP",468,"Deloitte LLP",1208,Toronto,A6,ONTARIO,Canada,20-F,2024-03-01,,"Brookfield Business Corp",1871130,"=""BBUC""","250 VESEY STREET","15TH FLOOR","NEW YORK",NY,"NEW YORK","US Mid Atlantic",,,"=""1700""","Construction - Special Trade Contractors",561439,"Other Business Service Centers (including Copy Shops)",34,23,01/02/24,"1,664,116,864",12/31/23,"7,683,000,000","2,829,000,000","-11,753,000,000","21,182,000,000"
35346,Goodwill,"Goodwill Impairment-Refer to Notes 2(m) and 15 to the financial statements",527953,12/31/23,03/01/24,3,"Deloitte & Touche LLP",468,"Deloitte LLP",1208,Toronto,A6,ONTARIO,Canada,20-F,2024-03-01,,"Brookfield Business Corp",1871130,"=""BBUC""","250 VESEY STREET","15TH FLOOR","NEW YORK",NY,"NEW YORK","US Mid Atlantic",,,"=""1700""","Construction - Special Trade Contractors",561439,"Other Business Service Centers (including Copy Shops)",34,23,01/02/24,"1,664,116,864",12/31/23,"7,683,000,000","2,829,000,000","-11,753,000,000","21,182,000,000"
35269,Goodwill,"Goodwill – Refer to Notes 2(n) and 13 to the financial statements",527906,12/31/23,03/01/24,3,"Deloitte & Touche LLP",468,"Deloitte LLP",1208,Toronto,A6,ONTARIO,Canada,20-F,2024-03-01,,"Brookfield Business Partners L.P.",1654795,"=""BBU""","73 FRONT STREET, 5TH FLOOR",,HAMILTON,D0,BERMUDA,Foreign,,,"=""1700""","Construction - Special Trade Contractors",325998,"All Other Miscellaneous Chemical Product and Preparation Manufacturing",34,20,01/02/24,"1,504,934,144",12/31/23,"55,068,000,000","3,777,000,000","-33,066,000,000","82,385,000,000"
35270,Goodwill,"Goodwill Impairment – Refer to Notes 2(n) and 13 to the financial statements",527906,12/31/23,03/01/24,3,"Deloitte & Touche LLP",468,"Deloitte LLP",1208,Toronto,A6,ONTARIO,Canada,20-F,2024-03-01,,"Brookfield Business Partners L.P.",1654795,"=""BBU""","73 FRONT STREET, 5TH FLOOR",,HAMILTON,D0,BERMUDA,Foreign,,,"=""1700""","Construction - Special Trade Contractors",325998,"All Other Miscellaneous Chemical Product and Preparation Manufacturing",34,20,01/02/24,"1,504,934,144",12/31/23,"55,068,000,000","3,777,000,000","-33,066,000,000","82,385,000,000"
36277,"Property, plant and equipment","Fair Value of Investment Properties and Property, Plant and Equipment – Refer to Notes 2(h)(i), 2(h)(ii), 11, and 12 to the financial statements",530460,12/31/23,03/18/24,3,"Deloitte & Touche LLP",468,"Deloitte LLP",1208,Toronto,A6,ONTARIO,Canada,40-F,2024-03-19,,"BROOKFIELD Corp /ON/",1001085,"=""BN""","BROOKFIELD PLACE, 181 BAY ST, STE 100","PO BOX 762",TORONTO,A6,ONTARIO,Canada,,,"=""6512""","Operators of Nonresidential Buildings",531120,"Lessors of Nonresidential Buildings (except Miniwarehouses)",34,39,01/02/24,"63,672,160,256",12/31/23,"80,421,000,000","5,105,000,000","-28,128,000,000","490,095,000,000"
36314,"Property, plant and equipment","Fair Value of Investment Properties and Property, Plant and Equipment – Refer to Notes 2(h)(i), 2(h)(ii), 11, and 12 to the financial statements",530530,12/31/23,03/18/24,3,"Deloitte & Touche LLP",468,"Deloitte LLP",1208,Toronto,A6,ONTARIO,Canada,6-K,2024-03-19,,"BROOKFIELD Corp /ON/",1001085,"=""BN""","BROOKFIELD PLACE, 181 BAY ST, STE 100","PO BOX 762",TORONTO,A6,ONTARIO,Canada,,,"=""6512""","Operators of Nonresidential Buildings",531120,"Lessors of Nonresidential Buildings (except Miniwarehouses)",34,39,01/02/24,"63,672,160,256",12/31/23,"80,421,000,000","5,105,000,000","-28,128,000,000","490,095,000,000"
36268,"Property, plant and equipment","Revaluation of Property, Plant and Equipment - Refer to Notes 3 and 8 to the financial statements",530429,12/31/23,03/18/24,3,"Deloitte & Touche LLP",468,"Deloitte LLP",1208,Toronto,A6,ONTARIO,Canada,20-F,2024-03-18,,"Brookfield Infrastructure Corp",1788348,"=""BIPC""","250 VESEY STREET, 15TH FLOOR",,"NEW YORK",NY,"NEW YORK","US Mid Atlantic",,,"=""4923""","Natural Gas Transmission and Distribution",486210,"Pipeline Transportation of Natural Gas",34,35,01/02/24,"3,900,827,392",12/31/23,"2,503,000,000","606,000,000","-5,824,000,000","23,909,000,000"
36269,"Business combinations","Acquisition of Businesses – Refer to Notes 3 and 4 to the financial statements",530429,12/31/23,03/18/24,3,"Deloitte & Touche LLP",468,"Deloitte LLP",1208,Toronto,A6,ONTARIO,Canada,20-F,2024-03-18,,"Brookfield Infrastructure Corp",1788348,"=""BIPC""","250 VESEY STREET, 15TH FLOOR",,"NEW YORK",NY,"NEW YORK","US Mid Atlantic",,,"=""4923""","Natural Gas Transmission and Distribution",486210,"Pipeline Transportation of Natural Gas",34,35,01/02/24,"3,900,827,392",12/31/23,"2,503,000,000","606,000,000","-5,824,000,000","23,909,000,000"
36241,"Property, plant and equipment","Revaluation of Property, Plant and Equipment - Refer to Notes 3 and 13 to the financial statements",530381,12/31/23,03/18/24,3,"Deloitte & Touche LLP",468,"Deloitte LLP",1208,Toronto,A6,ONTARIO,Canada,20-F,2024-03-18,,"Brookfield Infrastructure Partners L.P.",1406234,"=""BIP""","73 FRONT STREET",,HAMILTON,D0,BERMUDA,Foreign,,,"=""4400""","Water Transportation",221121,"Electric Bulk Power Transmission and Control",34,31,01/02/24,"14,260,211,712",12/31/23,"17,931,000,000","1,448,000,000","2,765,000,000","100,784,000,000"
36242,"Equity investments and joint ventures","Valuation of Investments in Associates and Joint Ventures - Refer to Notes 3 and 12 to the financial statements",530381,12/31/23,03/18/24,3,"Deloitte & Touche LLP",468,"Deloitte LLP",1208,Toronto,A6,ONTARIO,Canada,20-F,2024-03-18,,"Brookfield Infrastructure Partners L.P.",1406234,"=""BIP""","73 FRONT STREET",,HAMILTON,D0,BERMUDA,Foreign,,,"=""4400""","Water Transportation",221121,"Electric Bulk Power Transmission and Control",34,31,01/02/24,"14,260,211,712",12/31/23,"17,931,000,000","1,448,000,000","2,765,000,000","100,784,000,000"
36243,"Business combinations","Acquisition of Businesses - Refer to Notes 3 and 6 to the financial statements",530381,12/31/23,03/18/24,3,"Deloitte & Touche LLP",468,"Deloitte LLP",1208,Toronto,A6,ONTARIO,Canada,20-F,2024-03-18,,"Brookfield Infrastructure Partners L.P.",1406234,"=""BIP""","73 FRONT STREET",,HAMILTON,D0,BERMUDA,Foreign,,,"=""4400""","Water Transportation",221121,"Electric Bulk Power Transmission and Control",34,31,01/02/24,"14,260,211,712",12/31/23,"17,931,000,000","1,448,000,000","2,765,000,000","100,784,000,000"
36463,"Other investments","Valuation of investments which utilize significant unobservable inputs",530664,12/31/23,03/21/24,2,"Ernst & Young LLP",,,,"Los Angeles",CA,CALIFORNIA,"US West",10-K,2024-03-21,,"Brookfield Oaktree Holdings, LLC",1403528,"=""OAK.A""","333 SOUTH GRAND AVENUE","28TH FLOOR","LOS ANGELES",CA,CALIFORNIA,"US West",,,"=""6282""","Investment Advice",523920,"Portfolio Management",34,22,01/02/24,"2,123,930,112",12/31/23,"289,717,000","221,177,000",,"7,555,933,000"
35322,"Property, plant and equipment","Fair Value of Investment Properties - Refer to Notes 2(d), 2(r)(v) and 4 to the financial statements",527891,12/31/23,03/01/24,3,"Deloitte & Touche LLP",468,"Deloitte LLP",1208,Toronto,A6,ONTARIO,Canada,20-F,2024-03-01,,"Brookfield Property Partners L.P.",1545772,"=""BPYPM""","73 FRONT STREET",,HAMILTON,D0,BERMUDA,Foreign,,,"=""6500""","Real Estate",531312,"Nonresidential Property Managers",34,12,01/02/24,"91,816,000",12/31/23,"9,483,000,000","-1,849,000,000","6,283,000,000","131,577,000,000"
35332,"Property, plant and equipment","Revaluation of power generating assets",527922,12/31/23,02/29/24,2,"Ernst & Young LLP",192,"Ernst & Young LLP Chartered Accountants",1263,Toronto,A6,ONTARIO,Canada,20-F,2024-03-01,,"Brookfield Renewable Corp",1791863,"=""BEPC""","250 VESEY STREET, 15TH FLOOR",,"NEW YORK",NY,"NEW YORK","US Mid Atlantic",,,"=""4911""","Electric Services",221111,"Hydroelectric Power Generation",34,29,01/02/24,"4,992,602,624",12/31/23,"3,967,000,000","308,000,000","-854,000,000","49,421,000,000"
35333,"Business combinations","Significant acquisitions: wind and solar portfolio",527922,12/31/23,02/29/24,2,"Ernst & Young LLP",192,"Ernst & Young LLP Chartered Accountants",1263,Toronto,A6,ONTARIO,Canada,20-F,2024-03-01,,"Brookfield Renewable Corp",1791863,"=""BEPC""","250 VESEY STREET, 15TH FLOOR",,"NEW YORK",NY,"NEW YORK","US Mid Atlantic",,,"=""4911""","Electric Services",221111,"Hydroelectric Power Generation",34,29,01/02/24,"4,992,602,624",12/31/23,"3,967,000,000","308,000,000","-854,000,000","49,421,000,000"
35296,"Property, plant and equipment","Revaluation of power generating assets",528199,12/31/23,02/29/24,2,"Ernst & Young LLP",192,"Ernst & Young LLP Chartered Accountants",1263,Toronto,A6,ONTARIO,Canada,20-F/A,2024-03-04,,"Brookfield Renewable Partners L.P.",1533232,"=""BEP""","73 FRONT STREET","FIFTH FLOOR",HAMILTON,D0,BERMUDA,Foreign,,,"=""4911""","Electric Services",221111,"Hydroelectric Power Generation",34,26,01/02/24,"7,164,834,816",12/31/23,"5,038,000,000","616,000,000","6,488,000,000","76,128,000,000"
35297,"Business combinations","Significant acquisitions: wind and solar portfolio’s",528199,12/31/23,02/29/24,2,"Ernst & Young LLP",192,"Ernst & Young LLP Chartered Accountants",1263,Toronto,A6,ONTARIO,Canada,20-F/A,2024-03-04,,"Brookfield Renewable Partners L.P.",1533232,"=""BEP""","73 FRONT STREET","FIFTH FLOOR",HAMILTON,D0,BERMUDA,Foreign,,,"=""4911""","Electric Services",221111,"Hydroelectric Power Generation",34,26,01/02/24,"7,164,834,816",12/31/23,"5,038,000,000","616,000,000","6,488,000,000","76,128,000,000"
35319,"Property, plant and equipment","Revaluation of power generating assets",527890,12/31/23,02/29/24,2,"Ernst & Young LLP",192,"Ernst & Young LLP Chartered Accountants",1263,Toronto,A6,ONTARIO,Canada,20-F,2024-03-01,,"Brookfield Renewable Partners L.P.",1533232,"=""BEP""","73 FRONT STREET","FIFTH FLOOR",HAMILTON,D0,BERMUDA,Foreign,,,"=""4911""","Electric Services",221111,"Hydroelectric Power Generation",34,26,01/02/24,"7,164,834,816",12/31/23,"5,038,000,000","616,000,000","6,488,000,000","76,128,000,000"
35320,"Business combinations","Significant acquisitions: wind and solar portfolio’s",527890,12/31/23,02/29/24,2,"Ernst & Young LLP",192,"Ernst & Young LLP Chartered Accountants",1263,Toronto,A6,ONTARIO,Canada,20-F,2024-03-01,,"Brookfield Renewable Partners L.P.",1533232,"=""BEP""","73 FRONT STREET","FIFTH FLOOR",HAMILTON,D0,BERMUDA,Foreign,,,"=""4911""","Electric Services",221111,"Hydroelectric Power Generation",34,26,01/02/24,"7,164,834,816",12/31/23,"5,038,000,000","616,000,000","6,488,000,000","76,128,000,000"
36737,"Insurance contract liabilities","Future Policy Benefits — Long Duration Targeted Improvements - Refer to Notes 2 and 17 to the financial statements",531625,12/31/23,03/27/24,3,"Deloitte & Touche LLP",468,"Deloitte LLP",1208,Toronto,A6,ONTARIO,Canada,20-F,2024-03-28,,"Brookfield Wealth Solutions Ltd.",1837429,"=""BNT""","IDEATION HOUSE, 1ST FLOOR","94 PITTS BAY ROAD",PEMBROKE,D0,BERMUDA,Foreign,,,"=""6399""","Insurance Carriers, NEC",524126,"Direct Property and Casualty Insurance Carriers",34,39,01/02/24,"371,230,112",12/31/23,"7,020,000,000","797,000,000","8,347,000,000","61,643,000,000"
36738,"Insurance contract liabilities","Policy and Contract Claims – Property and casualty liability for unpaid claims and claim adjustment expenses — Refer to Notes 2 and 20 to the financial statements",531625,12/31/23,03/27/24,3,"Deloitte & Touche LLP",468,"Deloitte LLP",1208,Toronto,A6,ONTARIO,Canada,20-F,2024-03-28,,"Brookfield Wealth Solutions Ltd.",1837429,"=""BNT""","IDEATION HOUSE, 1ST FLOOR","94 PITTS BAY ROAD",PEMBROKE,D0,BERMUDA,Foreign,,,"=""6399""","Insurance Carriers, NEC",524126,"Direct Property and Casualty Insurance Carriers",34,39,01/02/24,"371,230,112",12/31/23,"7,020,000,000","797,000,000","8,347,000,000","61,643,000,000"
34491,"Allowance for credit losses","Assessment of the collective allowance for credit losses",526560,12/31/23,02/27/24,4,"KPMG LLP",,,,Boston,MA,MASSACHUSETTS,"US New England",10-K,2024-02-27,,"BROOKLINE BANCORP INC",1049782,"=""BRKL""","131 CLARENDON STREET",,BOSTON,MA,MASSACHUSETTS,"US New England",,,"=""6035""","Savings Institutions, Federally Chartered",522120,"Savings Institutions",34,11,01/02/24,"970,419,264",12/31/23,"333,438,000","74,999,000","933,215,000","11,382,256,000"
34492,"Business combinations","Fair value measurement of loans and the core deposit intangible asset acquired in the PCSB Financial Corporation business combination",526560,12/31/23,02/27/24,4,"KPMG LLP",,,,Boston,MA,MASSACHUSETTS,"US New England",10-K,2024-02-27,,"BROOKLINE BANCORP INC",1049782,"=""BRKL""","131 CLARENDON STREET",,BOSTON,MA,MASSACHUSETTS,"US New England",,,"=""6035""","Savings Institutions, Federally Chartered",522120,"Savings Institutions",34,11,01/02/24,"970,419,264",12/31/23,"333,438,000","74,999,000","933,215,000","11,382,256,000"
35317,"Allowance for credit losses","Assessment of the collective allowance for credit losses",528126,12/31/23,02/27/24,4,"KPMG LLP",,,,Boston,MA,MASSACHUSETTS,"US New England",10-K/A,2024-03-04,,"BROOKLINE BANCORP INC",1049782,"=""BRKL""","131 CLARENDON STREET",,BOSTON,MA,MASSACHUSETTS,"US New England",,,"=""6035""","Savings Institutions, Federally Chartered",522120,"Savings Institutions",34,11,01/02/24,"970,419,264",12/31/23,"333,438,000","74,999,000","933,215,000","11,382,256,000"
35318,"Business combinations","Fair value measurement of loans and the core deposit intangible asset acquired in the PCSB Financial Corporation business combination",528126,12/31/23,02/27/24,4,"KPMG LLP",,,,Boston,MA,MASSACHUSETTS,"US New England",10-K/A,2024-03-04,,"BROOKLINE BANCORP INC",1049782,"=""BRKL""","131 CLARENDON STREET",,BOSTON,MA,MASSACHUSETTS,"US New England",,,"=""6035""","Savings Institutions, Federally Chartered",522120,"Savings Institutions",34,11,01/02/24,"970,419,264",12/31/23,"333,438,000","74,999,000","933,215,000","11,382,256,000"
33459,"Business combinations","Business Combinations — Purchased Customer Accounts — Refer to Note 3 to the consolidated financial statements",525654,12/31/23,02/22/24,3,"Deloitte & Touche LLP",,,,Tampa,FL,FLORIDA,"US Southeast",10-K,2024-02-22,,"BROWN & BROWN, INC.",79282,"=""BRO""","300 N. BEACH STREET",,"DAYTONA BEACH",FL,FLORIDA,"US Southeast",,,"=""6411""","Insurance Agents, Brokers, and Service",524210,"Insurance Agencies and Brokerages",34,71,01/02/24,"20,135,297,024",12/31/23,"4,257,100,000","870,500,000","-3,382,800,000","14,883,400,000"
30392,"Other intangible assets","Valuation of the Finlandia Brand Name Other Intangible Asset",513550,04/30/23,06/16/23,2,"Ernst & Young LLP",,,,Louisville,KY,KENTUCKY,"US Mid Atlantic",10-K,2023-06-16,,"BROWN FORMAN CORP",14693,"=""BF.B""","850 DIXIE HWY",,LOUISVILLE,KY,KENTUCKY,"US Mid Atlantic",,,"=""2080""",Beverages,312140,Distilleries,34,65,05/02/23,"20,029,140,992",04/30/23,"4,228,000,000","783,000,000","647,000,000","7,777,000,000"
30393,"Other intangible assets","Valuation of Intangible Assets for Gin Mare and Diplomático",513550,04/30/23,06/16/23,2,"Ernst & Young LLP",,,,Louisville,KY,KENTUCKY,"US Mid Atlantic",10-K,2023-06-16,,"BROWN FORMAN CORP",14693,"=""BF.B""","850 DIXIE HWY",,LOUISVILLE,KY,KENTUCKY,"US Mid Atlantic",,,"=""2080""",Beverages,312140,Distilleries,34,65,05/02/23,"20,029,140,992",04/30/23,"4,228,000,000","783,000,000","647,000,000","7,777,000,000"
27875,"Revenue from customer contracts","Revenue — Refer to Note 2n and 23 to the financial statements",505881,01/31/23,03/22/23,3,"Deloitte & Touche LLP",486,"Deloitte srl",1208,Montreal,A8,QUEBEC,Canada,40-F,2023-03-23,,"BRP Inc.",1748797,"=""DOOO""","726 SAINT-JOSEPH STREET",,VALCOURT,A8,QUEBEC,Canada,,,"=""3790""","Miscellaneous Transportation Equipment",336999,"All Other Transportation Equipment Manufacturing",34,84,01/31/23,"3,051,820,800",01/31/23,"7,519,300,000","648,600,000","-150,800,000","4,844,800,000"
35961,"Real estate investments","Valuation of Investments in Real Estate",530052,12/31/23,03/14/24,2,"Ernst & Young LLP",,,,"New York",NY,"NEW YORK","US Mid Atlantic",10-K,2024-03-14,,"BRT Apartments Corp.",14846,"=""BRT""","60 CUTTER MILL RD","SUITE 303","GREAT NECK",NY,"NEW YORK","US Mid Atlantic",,,"=""6798""","Real Estate Investment Trusts",531110,"Lessors of Residential Buildings and Dwellings",34,19,12/31/23,"325,994,240",12/31/23,"93,617,000","3,873,000",,"709,963,000"
35179,"Revenue from customer contracts","Revenue Recognition – System Sales",527360,12/31/23,02/29/24,1,"PricewaterhouseCoopers LLP",,,,Boston,MA,MASSACHUSETTS,"US New England",10-K,2024-02-29,,"BRUKER CORP",1109354,"=""BRKR""","40 MANNING RD",,BILLERICA,MA,MASSACHUSETTS,"US New England",,,"=""3826""","Laboratory Analytical Instruments",334516,"Analytical Laboratory Instrument Manufacturing",34,72,01/02/24,"10,007,131,136",12/31/23,"2,964,500,000","427,200,000","482,800,000","4,249,900,000"
32969,"Goodwill and intangible assets","Navico Reporting Unit Goodwill and Trade Name Intangible Asset Impairment – Refer to Notes 1 and 9 to the financial statements",524915,12/31/23,02/16/24,3,"Deloitte & Touche LLP",,,,Chicago,IL,ILLINOIS,"US Midwest",10-K,2024-02-16,,"BRUNSWICK CORP",14930,"=""BC""","26125 N. RIVERWOODS BLVD. SUITE 500",,METTAWA,IL,ILLINOIS,"US Midwest",,,"=""3510""","Engines & Turbines",333618,"Other Engine Equipment Manufacturing",34,95,01/02/24,"6,537,201,664",12/31/23,"6,401,400,000","420,400,000","78,700,000","6,230,500,000"
28253,Inventory,"Inventory – Adjustment to Inventory for Markdowns and Obsolescence – Refer to Note A to the financial statements",506743,01/28/23,03/29/23,3,"Deloitte & Touche LLP",,,,Omaha,NE,NEBRASKA,"US Midwest",10-K,2023-03-29,,"BUCKLE INC",885245,"=""BKE""","2407 W 24TH ST",,KEARNEY,NE,NEBRASKA,"US Midwest",,,"=""5651""","Family Clothing Stores",448110,"Men's Clothing Stores",34,44,01/31/23,"2,204,075,008",01/28/23,"1,345,187,000","254,626,000",,"837,579,000"
38150,"Long-lived assets","Impairment of property, plant, equipment and development cost",535511,12/31/23,04/30/24,2,"Ernst & Young LLP",846,"Tanaka Valdivia & Asociados Sociedad Civil de Responsabilidad Limitada",1315,Lima,R5,PERU,Foreign,20-F,2024-05-01,,"BUENAVENTURA MINING CO INC",1013131,"=""BVN""","AVE CARLOS VILLARAN 790",,LIMA,R5,PERU,Foreign,,,"=""1000""","Metal mining",212221,"Gold Ore Mining",34,15,01/02/24,"3,729,613,312",12/31/23,"823,845,000","32,682,000",,"4,533,799,000"
38151,"Uncertain tax positions","Uncertain tax positions",535511,12/31/23,04/30/24,2,"Ernst & Young LLP",846,"Tanaka Valdivia & Asociados Sociedad Civil de Responsabilidad Limitada",1315,Lima,R5,PERU,Foreign,20-F,2024-05-01,,"BUENAVENTURA MINING CO INC",1013131,"=""BVN""","AVE CARLOS VILLARAN 790",,LIMA,R5,PERU,Foreign,,,"=""1000""","Metal mining",212221,"Gold Ore Mining",34,15,01/02/24,"3,729,613,312",12/31/23,"823,845,000","32,682,000",,"4,533,799,000"
40492,"Long-lived assets","Impairment of property, plant, equipment and development cost",547186,12/31/23,04/30/24,2,"Ernst & Young LLP",846,"Tanaka Valdivia & Asociados Sociedad Civil de Responsabilidad Limitada",1315,Lima,R5,PERU,Foreign,20-F/A,2025-01-14,,"BUENAVENTURA MINING CO INC",1013131,"=""BVN""","AVE CARLOS VILLARAN 790",,LIMA,R5,PERU,Foreign,,,"=""1000""","Metal mining",212221,"Gold Ore Mining",34,15,01/02/24,"3,729,613,312",12/31/23,"823,845,000","32,682,000",,"4,533,799,000"
40493,"Uncertain tax positions","Uncertain tax positions",547186,12/31/23,04/30/24,2,"Ernst & Young LLP",846,"Tanaka Valdivia & Asociados Sociedad Civil de Responsabilidad Limitada",1315,Lima,R5,PERU,Foreign,20-F/A,2025-01-14,,"BUENAVENTURA MINING CO INC",1013131,"=""BVN""","AVE CARLOS VILLARAN 790",,LIMA,R5,PERU,Foreign,,,"=""1000""","Metal mining",212221,"Gold Ore Mining",34,15,01/02/24,"3,729,613,312",12/31/23,"823,845,000","32,682,000",,"4,533,799,000"
28980,"Revenue from customer contracts","Revenue recognition - gift card breakage",508688,01/28/23,04/13/23,2,"Ernst & Young LLP",,,,"Saint Louis",MO,MISSOURI,"US Southeast",10-K,2023-04-13,,"BUILD-A-BEAR WORKSHOP INC",1113809,"=""BBW""","415 S. 18TH STREET, SUITE 200",,"ST LOUIS",MO,MISSOURI,"US Southeast",,,"=""5945""","Hobby, Toy, and Game Shops",339931,"Doll and Stuffed Toy Manufacturing",34,25,01/31/23,"363,545,408",01/28/23,"467,937,000","47,985,000",,"280,794,000"
33583,"Revenue from customer contracts","Revenue Recognition – Distribution Sales",525571,12/31/23,02/22/24,1,"PricewaterhouseCoopers LLP",,,,Dallas,TX,TEXAS,"US Southwest",10-K,2024-02-22,,"Builders FirstSource, Inc.",1316835,"=""BLDR""","6031 CONNECTION DR., STE. 400",,IRVING,TX,TEXAS,"US Southwest",,,"=""5211""","Lumber and Other Building Materials Dealers",238290,"Other Building Equipment Contractors",34,167,12/31/23,"20,342,808,576",12/31/23,"17,097,330,000","1,540,555,000","-122,378,000","10,499,452,000"
47960,"Other intangible assets","Digital assets held&#8201;—&#8201;inventories, Digital assets held&#8201;—&#8201;financial assets, and Safeguarding Digital Assets — Refer to Notes 2, 3, 13, and 27",568723,12/31/23,08/30/24,3,"Deloitte & Touche LLP",,,,"San Francisco",CA,CALIFORNIA,"US West",DRS,2024-08-30,,Bullish,1872195,"=""BLSH""","UGLAND HOUSE, BOX 309",,"GRAND CAYMAN",E9,"CAYMAN ISLANDS",Foreign,,,"=""6199""","Finance Services",523210,"Securities and Commodity Exchanges",33,,,,12/31/23,"116,507,500,000","1,300,015,000","1,206,275,000","1,804,519,000"
47961,"Other intangible assets","Digital assets held&#8201;—&#8201;inventories, Digital assets held&#8201;—&#8201;financial assets, and Safeguarding Digital Assets — Refer to Notes 2, 3, 13, and 27",568729,12/31/23,08/30/24,3,"Deloitte & Touche LLP",,,,"San Francisco",CA,CALIFORNIA,"US West",DRS/A,2025-01-17,,Bullish,1872195,"=""BLSH""","UGLAND HOUSE, BOX 309",,"GRAND CAYMAN",E9,"CAYMAN ISLANDS",Foreign,,,"=""6199""","Finance Services",523210,"Securities and Commodity Exchanges",33,,,,12/31/23,"116,507,500,000","1,300,015,000","1,206,275,000","1,804,519,000"
47962,"Other intangible assets","Digital assets held&#8201;—&#8201;inventories, Digital assets held&#8201;—&#8201;financial assets, and Safeguarding Digital Assets — Refer to Notes 2, 3, 13, and 27",568732,12/31/23,08/30/24,3,"Deloitte & Touche LLP",,,,"San Francisco",CA,CALIFORNIA,"US West",DRS/A,2025-02-28,,Bullish,1872195,"=""BLSH""","UGLAND HOUSE, BOX 309",,"GRAND CAYMAN",E9,"CAYMAN ISLANDS",Foreign,,,"=""6199""","Finance Services",523210,"Securities and Commodity Exchanges",33,,,,12/31/23,"116,507,500,000","1,300,015,000","1,206,275,000","1,804,519,000"
34733,"Uncertain tax positions","Measurement of the Tax Receivable Agreement Liability",527060,12/31/23,02/28/24,2,"Ernst & Young LLP",,,,Austin,TX,TEXAS,"US Southwest",10-K,2024-02-28,,"Bumble Inc.",1830043,"=""BMBL""","1105 WEST 41ST STREET",,AUSTIN,TX,TEXAS,"US Southwest",,,"=""7370""","Services-Computer Programming, Data Processing, Etc.",511210,"Software Publishers",34,15,01/02/24,"1,982,894,720",12/31/23,"1,051,830,000","-4,213,000","-1,435,025,000","3,625,127,000"
33451,Inventory,"Readily Marketable Inventories and Physically Settled Forward Purchase and Sale Contracts - Refer to Notes 1 and 15 to the financial statements",525659,12/31/23,02/22/24,3,"Deloitte & Touche LLP",,,,"Saint Louis",MO,MISSOURI,"US Southeast",10-K,2024-02-22,,"Bunge Global SA",1996862,"=""BG""","ROUTE DE FLORISSANT 13",,GENEVA,V8,SWITZERLAND,Foreign,,,"=""2070""","Fats & Oils",0,,34,101,12/31/23,"15,133,205,504",12/31/23,"59,540,000,000","2,243,000,000","9,965,000,000","25,372,000,000"
37356,Inventory,"Readily Marketable Inventories and Physically Settled Forward Purchase and Sale Contracts - Refer to Notes 1 and 15 to the financial statements",532691,12/31/23,02/22/24,3,"Deloitte & Touche LLP",,,,"Saint Louis",MO,MISSOURI,"US Southeast",ARS,2024-04-05,,"Bunge Global SA",1996862,"=""BG""","ROUTE DE FLORISSANT 13",,GENEVA,V8,SWITZERLAND,Foreign,,,"=""2070""","Fats & Oils",0,,34,101,12/31/23,"15,133,205,504",12/31/23,"59,540,000,000","2,243,000,000","9,965,000,000","25,372,000,000"
36727,"Other investments","Valuation of capital provision assets",531599,12/31/23,03/28/24,2,"Ernst & Young LLP",57,"Ernst & Young LLP",1438,Guernsey,X0,"UNITED KINGDOM",Foreign,20-F,2024-03-28,,"Burford Capital Ltd",1714174,"=""BUR""","OAK HOUSE","HIRZEL STREET","ST PETER PORT",Y7,GUERNSEY,Foreign,,,"=""6199""","Finance Services",523110,"Investment Banking and Securities Dealing",34,15,01/02/24,"3,300,586,240",12/31/23,"987,767,000","610,522,000","2,156,893,000","5,837,394,000"
37428,Goodwill,"Valuation of the Anthony’s reporting unit",532973,01/01/24,04/10/24,4,"KPMG LLP",,,,Miami,FL,FLORIDA,"US Southeast",10-K,2024-04-10,Yes,"BurgerFi International, Inc.",1723580,"=""BFICQ""","200 WEST CYPRESS CREEK ROAD","SUITE 220","FORT LAUDERDALE",FL,FLORIDA,"US Southeast",,,"=""5812""","Eating and Drinking Places",722211,"Limited-Service Restaurants",34,1,01/03/24,"20,789,880",01/01/24,"170,100,000","-30,708,000","-125,227,000","258,476,000"
37867,Goodwill,"Valuation of the Anthony’s reporting unit",534386,01/01/24,04/10/24,4,"KPMG LLP",,,,Miami,FL,FLORIDA,"US Southeast",ARS,2024-04-25,Yes,"BurgerFi International, Inc.",1723580,"=""BFICQ""","200 WEST CYPRESS CREEK ROAD","SUITE 220","FORT LAUDERDALE",FL,FLORIDA,"US Southeast",,,"=""5812""","Eating and Drinking Places",722211,"Limited-Service Restaurants",34,1,01/03/24,"20,789,880",01/01/24,"170,100,000","-30,708,000","-125,227,000","258,476,000"
34157,"Deferred and capitalized costs","Property and Equipment – Self Constructed Assets – Appropriate Capitalization of Costs",526412,12/31/23,02/26/24,3,"Deloitte & Touche LLP",,,,"Fort Worth",TX,TEXAS,"US Southwest",10-K,2024-02-26,,"BURLINGTON NORTHERN SANTA FE, LLC",934612,"=""BNI""","2650 LOU MENK DR",,"FT WORTH",TX,TEXAS,"US Southwest",1067983,"BERKSHIRE HATHAWAY INC","=""4011""","Railroads, Line-haul Operating",482111,"Line-Haul Railroads",34,,,,12/31/23,"23,876,000,000","5,087,000,000","33,913,000,000","94,577,000,000"
27269,Inventory,"Retail Inventory Method—Impact of Markdowns—Refer to Note 1 to the financial statements",504843,01/28/23,03/13/23,3,"Deloitte & Touche LLP",,,,"New York",NY,"NEW YORK","US Mid Atlantic",10-K,2023-03-13,,"Burlington Stores, Inc.",1579298,"=""BURL""","1830 ROUTE 130 NORTH",,BURLINGTON,NJ,"NEW JERSEY","US Mid Atlantic",,,"=""5311""","Department Stores",448140,"Family Clothing Stores",34,230,01/31/23,"14,943,480,832",01/28/23,"8,702,604,000","230,123,000","509,841,000","7,269,597,000"
38056,"Revenue from customer contracts","Revenue recognition – determining the standalone selling price of the Company’s performance obligation for in-hospital business",535103,12/31/23,04/29/24,2,"Ernst & Young LLP",211,"Ernst & Young Hua Ming LLP",1408,Guangzhou,F4,CHINA,Foreign,20-F,2024-04-29,,"Burning Rock Biotech Ltd",1792267,"=""BNR""","NO. 5 XINGDAO RING ROAD NORTH,","INTERNATIONAL BIO ISLAND","GUANGZHOU, GUANGDONG",F4,CHINA,Foreign,,,"=""8071""","Medical Laboratories",621511,"Medical Laboratories",34,1,01/02/24,"82,673,720",12/31/23,"75,778,000","-92,170,000","108,210,000","146,640,000"
35323,Inventory,"Inventory Raw Materials Valuation– Note 5 Inventories",528209,12/31/23,03/04/24,3,"Deloitte & Touche LLP",,,,"New York",NY,"NEW YORK","US Mid Atlantic",10-K,2024-03-04,,"Butterfly Network, Inc.",1804176,"=""BFLY""","1600 DISTRICT AVENUE",,BURLINGTON,MA,MASSACHUSETTS,"US New England",,,"=""3844""","X-Ray Apparatus and Tubes and Related Irradiation Apparatus",511210,"Software Publishers",34,1,01/02/24,"191,538,368",12/31/23,"65,900,000","-133,700,000","209,736,000","304,274,000"
37402,"Revenue from customer contracts","Sufficiency of audit evidence on determining the timing of cargo sales revenue recognition",532852,12/31/23,03/06/24,4,"KPMG LLP",81,"KPMG LLP",1051,Singapore,U0,SINGAPORE,Foreign,20FR12B,2024-04-08,,"BW LPG Ltd",1649313,"=""BWLP""","10 PASIR PANJANG ROAD",#17-02,"MAPLETREE BUSINESS CITY",U0,SINGAPORE,Foreign,,,"=""4700""","Transportation Services",0,,34,15,12/31/23,"2,005,430,594",12/31/23,"2,947,340,000","462,690,849",,"2,520,462,000"
38628,"Revenue from customer contracts","Sufficiency of audit evidence on determining the timing of cargo sales revenue recognition",537570,12/31/23,03/06/24,4,"KPMG LLP",81,"KPMG LLP",1051,Singapore,U0,SINGAPORE,Foreign,DRS/A,2024-03-07,,"BW LPG Ltd",1649313,"=""BWLP""","10 PASIR PANJANG ROAD",#17-02,"MAPLETREE BUSINESS CITY",U0,SINGAPORE,Foreign,,,"=""4700""","Transportation Services",0,,34,15,12/31/23,"2,005,430,594",12/31/23,"2,947,340,000","462,690,849",,"2,520,462,000"
34315,"Revenue from customer contracts","Revenue Recognition – Estimating Costs at Completion – Refer to Note 1 and Note 3 to the Financial Statements.",526675,12/31/23,02/27/24,3,"Deloitte & Touche LLP",,,,Charlotte,NC,"NORTH CAROLINA","US Southeast",10-K,2024-02-27,,"BWX Technologies, Inc.",1486957,"=""BWXT""","800 MAIN STREET","4TH FLOOR",LYNCHBURG,VA,VIRGINIA,"US Mid Atlantic",,,"=""3510""","Engines & Turbines",332410,"Power Boiler and Heat Exchanger Manufacturing",34,77,12/31/23,"7,022,929,920",12/31/23,"2,496,309,000","245,849,000","450,821,000","2,747,065,000"
34477,"Long-lived assets","Assessment of Impairment Indicators of Long-Lived Assets and Investments in Unconsolidated Joint Ventures",526544,12/31/23,02/27/24,1,"PricewaterhouseCoopers LLP",,,,Boston,MA,MASSACHUSETTS,"US New England",10-K,2024-02-27,,"BXP, Inc.",1037540,"=""BXP""","800 BOYLSTON STREET","SUITE 1900",BOSTON,MA,MASSACHUSETTS,"US New England",,,"=""6798""","Real Estate Investment Trusts",531120,"Lessors of Nonresidential Buildings (except Miniwarehouses)",34,72,01/02/24,"11,315,387,392",12/31/23,"3,273,569,000","190,215,000",,"26,026,149,000"
34478,"Property, plant and equipment","Purchase Price Allocation for Long-Lived Asset Property Acquisitions",526544,12/31/23,02/27/24,1,"PricewaterhouseCoopers LLP",,,,Boston,MA,MASSACHUSETTS,"US New England",10-K,2024-02-27,,"BXP, Inc.",1037540,"=""BXP""","800 BOYLSTON STREET","SUITE 1900",BOSTON,MA,MASSACHUSETTS,"US New England",,,"=""6798""","Real Estate Investment Trusts",531120,"Lessors of Nonresidential Buildings (except Miniwarehouses)",34,72,01/02/24,"11,315,387,392",12/31/23,"3,273,569,000","190,215,000",,"26,026,149,000"
33052,"Revenue from customer contracts","Revenue Recognition — Refer to Notes 1 and 10 to the financial statements",524914,12/31/23,02/16/24,3,"Deloitte & Touche LLP",,,,Minneapolis,MN,MINNESOTA,"US Midwest",10-K,2024-02-16,,"C. H. ROBINSON WORLDWIDE, INC.",1043277,"=""CHRW""","14701 CHARLSON ROAD",,"EDEN PRAIRIE",MN,MINNESOTA,"US Midwest",,,"=""4731""","Arrangement of Transportation of  Freight and Cargo",488510,"Freight Transportation Arrangement",34,87,01/02/24,"10,163,805,184",12/31/23,"17,596,443,000","325,129,000","-98,565,000","5,225,280,000"
30432,"Revenue from customer contracts","Revenue — Refer to Notes 1 and 2 to the financial statements",513704,04/30/23,06/21/23,3,"Deloitte & Touche LLP",,,,"San Jose",CA,CALIFORNIA,"US West",10-K,2023-06-22,,"C3.ai, Inc.",1577526,"=""AI""","1400 SEAPORT BLVD",,"REDWOOD CITY",CA,CALIFORNIA,"US West",,,"=""7372""","Prepackaged Software",334611,"Software Reproducing",34,18,04/30/23,"1,968,086,528",04/30/23,"266,795,000","-268,839,000","929,040,000","1,103,028,000"
30433,"Related party transactions","Related Party Transactions – Revenue Transactions with Baker Hughes Company — Refer to Note 13 to the financial statements",513704,04/30/23,06/21/23,3,"Deloitte & Touche LLP",,,,"San Jose",CA,CALIFORNIA,"US West",10-K,2023-06-22,,"C3.ai, Inc.",1577526,"=""AI""","1400 SEAPORT BLVD",,"REDWOOD CITY",CA,CALIFORNIA,"US West",,,"=""7372""","Prepackaged Software",334611,"Software Reproducing",34,18,04/30/23,"1,968,086,528",04/30/23,"266,795,000","-268,839,000","929,040,000","1,103,028,000"
33838,"Deferred and capitalized costs","Capitalization of Internal Labor Costs",526110,12/31/23,02/22/24,1,"PricewaterhouseCoopers LLP",,,,Phoenix,AZ,ARIZONA,"US Southwest",10-K,2024-02-23,,"Cable One, Inc.",1632127,"=""CABO""","210 E. EARLL DRIVE",,PHOENIX,AZ,ARIZONA,"US Southwest",,,"=""4841""","Cable and Other Pay Television Services",515210,"Cable and Other Subscription Programming",34,557,12/31/23,"3,126,358,784",12/31/23,"1,678,081,000","224,622,000","-1,715,569,000","6,759,510,000"
33839,"Equity investments and joint ventures","Fair Value of Options Associated with the Mega Broadband Investment",526110,12/31/23,02/22/24,1,"PricewaterhouseCoopers LLP",,,,Phoenix,AZ,ARIZONA,"US Southwest",10-K,2024-02-23,,"Cable One, Inc.",1632127,"=""CABO""","210 E. EARLL DRIVE",,PHOENIX,AZ,ARIZONA,"US Southwest",,,"=""4841""","Cable and Other Pay Television Services",515210,"Cable and Other Subscription Programming",34,557,12/31/23,"3,126,358,784",12/31/23,"1,678,081,000","224,622,000","-1,715,569,000","6,759,510,000"
39632,"Deferred and capitalized costs","Capitalization of Internal Labor Costs",542004,12/31/23,02/22/24,1,"PricewaterhouseCoopers LLP",,,,Phoenix,AZ,ARIZONA,"US Southwest",10-K/A,2024-10-02,,"Cable One, Inc.",1632127,"=""CABO""","210 E. EARLL DRIVE",,PHOENIX,AZ,ARIZONA,"US Southwest",,,"=""4841""","Cable and Other Pay Television Services",515210,"Cable and Other Subscription Programming",34,557,12/31/23,"3,126,358,784",12/31/23,"1,678,081,000","224,622,000","-1,715,569,000","6,759,510,000"
39633,"Equity investments and joint ventures","Fair Value of Options Associated with the Mega Broadband Investment",542004,12/31/23,02/22/24,1,"PricewaterhouseCoopers LLP",,,,Phoenix,AZ,ARIZONA,"US Southwest",10-K/A,2024-10-02,,"Cable One, Inc.",1632127,"=""CABO""","210 E. EARLL DRIVE",,PHOENIX,AZ,ARIZONA,"US Southwest",,,"=""4841""","Cable and Other Pay Television Services",515210,"Cable and Other Subscription Programming",34,557,12/31/23,"3,126,358,784",12/31/23,"1,678,081,000","224,622,000","-1,715,569,000","6,759,510,000"
31773,"Other contingent liabilities","Commitments and Contingencies — CWP Respirator Liabilities — Refer to Note S to the consolidated financial statements",520162,09/30/23,11/22/23,3,"Deloitte & Touche LLP",,,,Boston,MA,MASSACHUSETTS,"US New England",10-K,2023-11-22,,"CABOT CORP",16040,"=""CBT""","TWO SEAPORT LANE SUITE 1400",,BOSTON,MA,MASSACHUSETTS,"US New England",,,"=""2890""","Miscellaneous Chemical Products",325211,"Plastics Material and Resin Manufacturing",34,68,10/02/23,"3,805,952,512",09/30/23,"3,931,000,000","445,000,000","1,070,000,000","3,604,000,000"
31774,"Deferred income taxes","Income Taxes – Domestic Deferred Tax Assets – Refer to Note Q to the consolidated financial statements",520162,09/30/23,11/22/23,3,"Deloitte & Touche LLP",,,,Boston,MA,MASSACHUSETTS,"US New England",10-K,2023-11-22,,"CABOT CORP",16040,"=""CBT""","TWO SEAPORT LANE SUITE 1400",,BOSTON,MA,MASSACHUSETTS,"US New England",,,"=""2890""","Miscellaneous Chemical Products",325211,"Plastics Material and Resin Manufacturing",34,68,10/02/23,"3,805,952,512",09/30/23,"3,931,000,000","445,000,000","1,070,000,000","3,604,000,000"
30907,"Revenue from customer contracts","Revenue Recognized over time",515834,06/30/23,08/10/23,1,"PricewaterhouseCoopers LLP",,,,Washington,DC,"DISTRICT OF COLUMBIA","US Mid Atlantic",10-K,2023-08-10,,"CACI INTERNATIONAL INC /DE/",16058,"=""CACI""","TWO RESTON OVERLOOK","12021 SUNSET HILLS ROAD",RESTON,VA,VIRGINIA,"US Mid Atlantic",,,"=""7373""","Computer Integrated Systems Design",541512,"Computer Systems Design Services",34,341,06/30/23,"7,770,129,408",06/30/23,"6,702,546,000","384,735,000","-1,368,341,000","6,600,808,000"
34986,"Other debt","Liability related to the Tax Receivable Agreement",527536,12/31/23,02/29/24,1,"PricewaterhouseCoopers LLP",,,,Houston,TX,TEXAS,"US Southwest",10-K,2024-02-29,,"Cactus, Inc.",1699136,"=""WHD""","920 MEMORIAL CITY WAY","SUITE 300",HOUSTON,TX,TEXAS,"US Southwest",,,"=""3533""","Oil and Gas Field Machinery and Equipment",333132,"Oil and Gas Field Machinery and Equipment Manufacturing",34,44,01/02/24,"2,887,282,176",12/31/23,"1,096,960,000","169,171,000","482,516,000","1,522,561,000"
34987,"Business combinations","Acquisition of FlexSteel – Valuation of Customer Relationships and Developed Technology",527536,12/31/23,02/29/24,1,"PricewaterhouseCoopers LLP",,,,Houston,TX,TEXAS,"US Southwest",10-K,2024-02-29,,"Cactus, Inc.",1699136,"=""WHD""","920 MEMORIAL CITY WAY","SUITE 300",HOUSTON,TX,TEXAS,"US Southwest",,,"=""3533""","Oil and Gas Field Machinery and Equipment",333132,"Oil and Gas Field Machinery and Equipment Manufacturing",34,44,01/02/24,"2,887,282,176",12/31/23,"1,096,960,000","169,171,000","482,516,000","1,522,561,000"
32765,"Revenue from customer contracts","Revenue Recognition – Identifying and Evaluating Terms and Conditions in Contracts",524606,12/31/23,02/13/24,1,"PricewaterhouseCoopers LLP",,,,"San Jose",CA,CALIFORNIA,"US West",10-K,2024-02-14,,"CADENCE DESIGN SYSTEMS INC",813672,"=""CDNS""","2655 SEELY AVENUE BLDG 5",,"SAN JOSE",CA,CALIFORNIA,"US West",,,"=""7372""","Prepackaged Software",511210,"Software Publishers",34,272,12/31/23,"74,004,561,920",12/31/23,"4,089,986,000","1,041,144,000","1,531,583,000","5,669,491,000"
36889,"Going concern","Liquidity Assessment",531666,12/31/23,03/28/24,1,"PricewaterhouseCoopers LLP",,,,"Los Angeles",CA,CALIFORNIA,"US West",10-K,2024-03-28,,"CADIZ INC",727273,"=""CDZI""","550 SOUTH HOPE STREET","SUITE 2850","LOS ANGELES",CA,CALIFORNIA,"US West",,,"=""4941""","Water Supply",531312,"Nonresidential Property Managers",34,3,01/02/24,"193,461,312",12/31/23,"1,991,000","-31,446,000","34,253,000","107,374,000"
30202,"Revenue from customer contracts","Revenue recognition – Estimated costs to complete certain contracts in the Defense and Security and Civil Aviation segments",512705,03/31/23,05/31/23,1,"PricewaterhouseCoopers LLP",493,"PricewaterhouseCoopers srl",271,Montreal,A8,QUEBEC,Canada,6-K,2023-05-31,,"CAE INC",1173382,"=""CAE""","8585 COTE DE LIESSE",,ST-LAURENT,A8,QUEBEC,Canada,,,"=""3690""","Miscellaneous Electrical Machinery, Equipment & Supplies",333319,"Other Commercial and Service Industry Machinery Manufacturing",34,22,03/29/23,"6,857,231,872",03/31/23,"2,963,500,000","171,400,000","337,600,000","7,711,600,000"
30429,"Revenue from customer contracts","Revenue recognition – Estimated costs to complete certain contracts in the Defense and Security and Civil Aviation segments",513701,03/31/23,05/31/23,1,"PricewaterhouseCoopers LLP",493,"PricewaterhouseCoopers srl",271,Montreal,A8,QUEBEC,Canada,40-F,2023-06-22,,"CAE INC",1173382,"=""CAE""","8585 COTE DE LIESSE",,ST-LAURENT,A8,QUEBEC,Canada,,,"=""3690""","Miscellaneous Electrical Machinery, Equipment & Supplies",333319,"Other Commercial and Service Industry Machinery Manufacturing",34,22,03/29/23,"6,857,231,872",03/31/23,"2,963,500,000","171,400,000","337,600,000","7,711,600,000"
30440,"Revenue from customer contracts","Revenue recognition – Estimated costs to complete certain contracts in the Defense and Security and Civil Aviation segments",513710,03/31/23,05/31/23,1,"PricewaterhouseCoopers LLP",493,"PricewaterhouseCoopers srl",271,Montreal,A8,QUEBEC,Canada,6-K,2023-06-22,,"CAE INC",1173382,"=""CAE""","8585 COTE DE LIESSE",,ST-LAURENT,A8,QUEBEC,Canada,,,"=""3690""","Miscellaneous Electrical Machinery, Equipment & Supplies",333319,"Other Commercial and Service Industry Machinery Manufacturing",34,22,03/29/23,"6,857,231,872",03/31/23,"2,963,500,000","171,400,000","337,600,000","7,711,600,000"
33240,"Deferred income taxes","Income Taxes – Valuation Allowance – Refer to Note 17 to the Financial Statements",525089,12/31/23,02/20/24,3,"Deloitte & Touche LLP",,,,"Las Vegas",NV,NEVADA,"US West",10-K,2024-02-20,,"Caesars Entertainment, Inc.",1590895,"=""CZR""","100 WEST LIBERTY STREET, 12TH FLOOR",,RENO,NV,NEVADA,"US West",,,"=""7011""","Hotels and Motels",721120,"Casino Hotels",34,47,12/31/23,"10,116,734,976",12/31/23,"11,528,000,000","786,000,000","-10,961,000,000","33,366,000,000"
33241,"Goodwill and intangible assets","Goodwill and Indefinite-lived Intangible Assets – Refer to Note 7 to the Financial Statements",525089,12/31/23,02/20/24,3,"Deloitte & Touche LLP",,,,"Las Vegas",NV,NEVADA,"US West",10-K,2024-02-20,,"Caesars Entertainment, Inc.",1590895,"=""CZR""","100 WEST LIBERTY STREET, 12TH FLOOR",,RENO,NV,NEVADA,"US West",,,"=""7011""","Hotels and Motels",721120,"Casino Hotels",34,47,12/31/23,"10,116,734,976",12/31/23,"11,528,000,000","786,000,000","-10,961,000,000","33,366,000,000"
35484,"Other contingent liabilities","Provision for bodily injury claims related to exposure to silica dust",528385,12/31/23,03/06/24,2,"Ernst & Young LLP",222,"Kost Forer Gabbay & Kasierer",1281,"Tel Aviv",L3,ISRAEL,Foreign,20-F,2024-03-06,,"Caesarstone Ltd.",1504379,"=""CSTE""","Kibbutz Sdot Yam",,"MP Menashe",L3,ISRAEL,Foreign,,,"=""3281""","Cut Stone and Stone Products",327991,"Cut Stone and Stone Product Manufacturing",34,4,01/02/24,"140,789,792",12/31/23,"565,231,000","-107,656,000","322,178,000","579,855,000"
35485,"Long-lived assets","Impairment of long-lived assets of Richmond Hill production facility",528385,12/31/23,03/06/24,2,"Ernst & Young LLP",222,"Kost Forer Gabbay & Kasierer",1281,"Tel Aviv",L3,ISRAEL,Foreign,20-F,2024-03-06,,"Caesarstone Ltd.",1504379,"=""CSTE""","Kibbutz Sdot Yam",,"MP Menashe",L3,ISRAEL,Foreign,,,"=""3281""","Cut Stone and Stone Products",327991,"Cut Stone and Stone Product Manufacturing",34,4,01/02/24,"140,789,792",12/31/23,"565,231,000","-107,656,000","322,178,000","579,855,000"
29651,Goodwill,"Goodwill – Telematics Products Reporting Unit – Refer to Notes 1 and 8 to the Financial Statements",510567,02/28/23,04/27/23,3,"Deloitte & Touche LLP",,,,"Costa Mesa",CA,CALIFORNIA,"US West",10-K,2023-04-28,,"CalAmp Corp.",730255,,"15635 ALTON PARKWAY, SUITE 250",,IRVINE,CA,CALIFORNIA,"US West",,,"=""3663""","Radio and Television Broadcasting and Communications Equipment",334220,"Radio and Television Broadcasting and Wireless Communications Equipment Manufacturing",34,4,02/28/23,"159,646,752",02/28/23,"294,949,000","-32,490,000","-106,540,000","380,120,000"
29652,"Revenue from customer contracts","Revenue Recognition — Refer to Note 1 to the financial statements",510567,02/28/23,04/27/23,3,"Deloitte & Touche LLP",,,,"Costa Mesa",CA,CALIFORNIA,"US West",10-K,2023-04-28,,"CalAmp Corp.",730255,,"15635 ALTON PARKWAY, SUITE 250",,IRVINE,CA,CALIFORNIA,"US West",,,"=""3663""","Radio and Television Broadcasting and Communications Equipment",334220,"Radio and Television Broadcasting and Wireless Communications Equipment Manufacturing",34,4,02/28/23,"159,646,752",02/28/23,"294,949,000","-32,490,000","-106,540,000","380,120,000"
32284,"Related party transactions","Mexican IVA taxes receivable — Refer to Note 14 to the financial statements",523765,10/31/23,01/31/24,3,"Deloitte & Touche LLP",,,,"Los Angeles",CA,CALIFORNIA,"US West",10-K,2024-01-31,,"CALAVO GROWERS INC",1133470,"=""CVGW""","1141A CUMMINGS ROAD",,"SANTA PAULA",CA,CALIFORNIA,"US West",,,"=""0700""","Agricultural services",111339,"Other Noncitrus Fruit Farming",34,25,10/31/23,"450,063,744",10/31/23,"594,102,000","-8,344,000","174,486,000","386,854,000"
32285,"Uncertain tax positions","Uncertain Tax Positions Related to Mexico tax audits — Refer to Note 7 to the financial statements",523765,10/31/23,01/31/24,3,"Deloitte & Touche LLP",,,,"Los Angeles",CA,CALIFORNIA,"US West",10-K,2024-01-31,,"CALAVO GROWERS INC",1133470,"=""CVGW""","1141A CUMMINGS ROAD",,"SANTA PAULA",CA,CALIFORNIA,"US West",,,"=""0700""","Agricultural services",111339,"Other Noncitrus Fruit Farming",34,25,10/31/23,"450,063,744",10/31/23,"594,102,000","-8,344,000","174,486,000","386,854,000"
28124,Inventory,"Inventory Markdown Reserve",506458,01/28/23,03/28/23,2,"Ernst & Young LLP",,,,"Saint Louis",MO,MISSOURI,"US Southeast",10-K,2023-03-28,,"CALERES INC",14707,"=""CAL""","8300 MARYLAND AVE","P O BOX 29","ST LOUIS",MO,MISSOURI,"US Southeast",,,"=""3140""","Footwear, (No Rubber)",448210,"Shoe Stores",34,26,01/31/23,"929,323,840",01/28/23,"2,968,138,000","181,742,000","205,291,000","1,836,472,000"
34626,"Proven and unproven reserves","Impact of estimated oil and gas reserves on depletion expense for proved oil and gas properties",527097,12/31/23,02/28/24,4,"KPMG LLP",,,,"Los Angeles",CA,CALIFORNIA,"US West",10-K,2024-02-28,,"California Resources Corp",1609253,"=""CRC""","1 WORLD TRADE CENTER","SUITE 1500","LONG BEACH",CA,CALIFORNIA,"US West",,,"=""1311""","Crude Petroleum and Natural Gas",211111,"Crude Petroleum and Natural Gas Extraction",34,54,01/02/24,"3,705,472,000",12/31/23,"2,813,000,000","564,000,000",,"3,998,000,000"
35234,"Regulatory assets and liabilities","Regulatory Assets and Liabilities - Regulated Utility Accounting— Refer to Notes 2 and 4 to the financial statements",527332,12/31/23,02/29/24,3,"Deloitte & Touche LLP",,,,"San Francisco",CA,CALIFORNIA,"US West",10-K,2024-02-29,,"CALIFORNIA WATER SERVICE GROUP",1035201,"=""CWT""","1720 N FIRST ST","C/O CALIFORNIA WATER SERVICE CO","SAN JOSE",CA,CALIFORNIA,"US West",,,"=""4941""","Water Supply",221310,"Water Supply and Irrigation Systems",34,52,01/02/24,"2,994,623,744",12/31/23,"794,632,000","51,911,000","1,356,773,000","4,595,533,000"
33778,Inventory,"Evaluation of net realizable value of raw material and finished goods inventory and excess and obsolete component liabilities",526059,12/31/23,02/22/24,4,"KPMG LLP",,,,"Santa Clara",CA,CALIFORNIA,"US West",10-K,2024-02-23,,"CALIX, INC",1406666,"=""CALX""","3155 OLSEN DRIVE, SUITE 450",,"SAN JOSE",CA,CALIFORNIA,"US West",,,"=""4899""","Communications Services, NEC",517110,"Wired Telecommunications Carriers",34,44,01/02/24,"2,894,856,704",12/31/23,"1,039,593,000","29,325,000","602,807,000","941,865,000"
37817,"Revenue from customer contracts","Estimate of variable consideration for revenue recognition",534247,12/31/23,04/24/24,2,"Ernst & Young LLP",55,"Ernst & Young AB",1433,Stockholm,V7,SWEDEN,Foreign,20-F,2024-04-24,,"Calliditas Therapeutics AB",1795579,,"KUNGSBRON 1, D5",,STOCKHOLM,V7,SWEDEN,Foreign,,,"=""2834""","Pharmaceutical Preparations",325412,"Pharmaceutical Preparation Manufacturing",34,26,12/31/23,"690,759,552",12/31/23,"119,756,000","-46,258,000","-8,730,000","184,488,000"
37818,"Other intangible assets","Impairment assessment of intangible assets",534247,12/31/23,04/24/24,2,"Ernst & Young LLP",55,"Ernst & Young AB",1433,Stockholm,V7,SWEDEN,Foreign,20-F,2024-04-24,,"Calliditas Therapeutics AB",1795579,,"KUNGSBRON 1, D5",,STOCKHOLM,V7,SWEDEN,Foreign,,,"=""2834""","Pharmaceutical Preparations",325412,"Pharmaceutical Preparation Manufacturing",34,26,12/31/23,"690,759,552",12/31/23,"119,756,000","-46,258,000","-8,730,000","184,488,000"
35110,"Asset retirement and environmental obligations","Renewable Identification Numbers (“RINs”) Obligation",527380,12/31/23,02/29/24,2,"Ernst & Young LLP",,,,Indianapolis,IN,INDIANA,"US Midwest",10-K,2024-02-29,,"Calumet Specialty Products Partners, L.P.",1340122,,"2780 WATERFRONT","PARKWAY E. DRIVE, SUITE 200",INDIANAPOLIS,IN,INDIANA,"US Midwest",2013745,"Calumet, Inc. /DE","=""2911""","Petroleum Refining",325110,"Petrochemical Manufacturing",34,18,01/02/24,"1,403,427,200",12/31/23,"4,181,000,000","48,100,000","-446,200,000","2,751,300,000"
38548,"Asset retirement and environmental obligations","Renewable Identification Numbers (“RINs”) Obligation",537353,12/31/23,02/29/24,2,"Ernst & Young LLP",,,,Indianapolis,IN,INDIANA,"US Midwest",DEFM14A,2024-06-07,,"Calumet Specialty Products Partners, L.P.",1340122,,"2780 WATERFRONT","PARKWAY E. DRIVE, SUITE 200",INDIANAPOLIS,IN,INDIANA,"US Midwest",2013745,"Calumet, Inc. /DE","=""2911""","Petroleum Refining",325110,"Petrochemical Manufacturing",34,18,01/02/24,"1,403,427,200",12/31/23,"4,181,000,000","48,100,000","-446,200,000","2,751,300,000"
33704,"Property, plant and equipment","Asset Impairment - Determination of Impairment Indicators of Properties Under Development, Including Land - Refer to Note 2 to the financial statements.",525755,12/31/23,02/22/24,3,"Deloitte & Touche LLP",,,,Houston,TX,TEXAS,"US Southwest",10-K,2024-02-22,,"CAMDEN PROPERTY TRUST",906345,"=""CPT""","2800 POST OAK BOULEVARD","SUITE 2700",HOUSTON,TX,TEXAS,"US Southwest",,,"=""6798""","Real Estate Investment Trusts",525990,"Other Financial Vehicles",34,100,01/02/24,"10,717,693,952",12/31/23,"1,545,478,000","403,309,000",,"9,383,737,000"
32440,"Deferred income taxes","Assessment of recoverability of deferred tax assets",524309,12/31/23,02/07/24,4,"KPMG LLP",187,"KPMG LLP Chartered Accountants",85,Saskatoon,A9,SASKATCHEWAN,Canada,6-K,2024-02-08,,"CAMECO CORP",1009001,"=""CCJ""","2121 11TH ST W",,SASKATOON,Z4,CANADA,Canada,,,"=""1090""","Metal Mining",212221,"Gold Ore Mining",34,43,12/31/23,"18,712,975,360",12/31/23,"1,962,504,000","273,636,000","4,588,751,000","7,533,791,000"
36515,"Deferred income taxes","Assessment of recoverability of deferred tax assets",530819,12/31/23,02/07/24,4,"KPMG LLP",187,"KPMG LLP Chartered Accountants",85,Saskatoon,A9,SASKATCHEWAN,Canada,40-F,2024-03-22,,"CAMECO CORP",1009001,"=""CCJ""","2121 11TH ST W",,SASKATOON,Z4,CANADA,Canada,,,"=""1090""","Metal Mining",212221,"Gold Ore Mining",34,43,12/31/23,"18,712,975,360",12/31/23,"1,962,504,000","273,636,000","4,588,751,000","7,533,791,000"
31222,"Other intangible assets","Indefinite-Lived Intangible Assets Impairment Test for Certain Trademarks",517255,07/30/23,09/21/23,1,"PricewaterhouseCoopers LLP",,,,Philadelphia,PA,PENNSYLVANIA,"US Mid Atlantic",10-K,2023-09-21,,"CAMPBELL'S Co",16732,"=""CPB""","CAMPBELL PL",,CAMDEN,NJ,"NEW JERSEY","US Mid Atlantic",,,"=""2000""","Food and Kindred Products",311999,"All Other Miscellaneous Food Manufacturing",34,46,07/31/23,"13,654,360,064",07/30/23,"9,357,000,000","858,000,000","-3,446,000,000","12,058,000,000"
34094,"Revenue from customer contracts","Revenue Recognition — Chargebacks related to Extended Service Contracts and Other Insurance Products - Refer to Note 1 to the consolidated financial statements",526378,12/31/23,02/26/24,3,"Deloitte & Touche LLP",,,,Chicago,IL,ILLINOIS,"US Midwest",10-K,2024-02-26,,"Camping World Holdings, Inc.",1669779,"=""CWH""","2 MARRIOTT DRIVE",,LINCOLNSHIRE,IL,ILLINOIS,"US Midwest",,,"=""5500""","Retail-Auto Dealers & Gasoline Stations",441210,"Recreational Vehicle Dealers",34,26,01/02/24,"1,183,987,712",12/31/23,"6,226,547,000","31,044,000","-600,355,000","4,845,684,000"
34095,"Long-lived assets","Long-Lived Asset Impairment — Refer to Notes 1 and 5 to the consolidated financial statements",526378,12/31/23,02/26/24,3,"Deloitte & Touche LLP",,,,Chicago,IL,ILLINOIS,"US Midwest",10-K,2024-02-26,,"Camping World Holdings, Inc.",1669779,"=""CWH""","2 MARRIOTT DRIVE",,LINCOLNSHIRE,IL,ILLINOIS,"US Midwest",,,"=""5500""","Retail-Auto Dealers & Gasoline Stations",441210,"Recreational Vehicle Dealers",34,26,01/02/24,"1,183,987,712",12/31/23,"6,226,547,000","31,044,000","-600,355,000","4,845,684,000"
36438,Inventory,"Inventory Provision Estimate",530646,12/31/23,03/21/24,4,"KPMG LLP",220,"Somekh Chaikin Certified Public Accountants (Israel)",1057,"Tel Aviv",L3,ISRAEL,Foreign,20-F,2024-03-21,,"CAMTEK LTD",1109138,"=""CAMT""","INDUSTRIAL ZONE",*,"MIGDAL HAEMEK",L3,ISRAEL,Foreign,,,"=""3827""","Optical Instruments and Lenses",333314,"Optical Instrument and Lens Manufacturing",34,69,12/31/23,"3,115,274,496",12/31/23,"315,375,000","78,632,000","384,866,000","787,667,000"
36439,"Business combinations","Acquisition-date fair value of developed technology intangible asset in the FRT acquisition",530646,12/31/23,03/21/24,4,"KPMG LLP",220,"Somekh Chaikin Certified Public Accountants (Israel)",1057,"Tel Aviv",L3,ISRAEL,Foreign,20-F,2024-03-21,,"CAMTEK LTD",1109138,"=""CAMT""","INDUSTRIAL ZONE",*,"MIGDAL HAEMEK",L3,ISRAEL,Foreign,,,"=""3827""","Optical Instruments and Lenses",333314,"Optical Instrument and Lens Manufacturing",34,69,12/31/23,"3,115,274,496",12/31/23,"315,375,000","78,632,000","384,866,000","787,667,000"
36858,"Going concern","Liquidity and Capital Resources",531451,12/31/23,03/28/24,2,"Ernst & Young LLP",222,"Kost Forer Gabbay & Kasierer",1281,"Tel Aviv",L3,ISRAEL,Foreign,20-F,2024-03-28,,"Can-Fite BioPharma Ltd.",1536196,"=""CANF""","26 BEN GURION STREET",,"RAMAT GAN",L3,ISRAEL,Foreign,,,"=""2834""","Pharmaceutical Preparations",325412,"Pharmaceutical Preparation Manufacturing",34,2,01/02/24,"5,628,649",12/31/23,"743,000","-7,634,000",,"9,989,000"
30014,Inventory,"Inventory Obsolescence– Refer to Notes 2k, 3 and 10 to the financial statements",512210,04/02/23,05/17/23,3,"Deloitte & Touche LLP",468,"Deloitte LLP",1208,Toronto,A6,ONTARIO,Canada,20-F,2023-05-18,,"Canada Goose Holdings Inc.",1690511,"=""GOOS""","250 BOWIE AVENUE",,TORONTO,A6,ONTARIO,Canada,,,"=""2300""","Apparel & Other Finishd Prods of Fabrics & Similar Matl",315222,"Men's and Boys' Cut and Sew Suit, Coat, and Overcoat Manufacturing",34,19,04/04/23,"1,023,657,280",04/02/23,"899,300,000","50,900,000","200,000,000","1,174,900,000"
30015,"Business combinations","Business Combination – Refer to Notes 2(e)(r) and 5 to the financial statements",512210,04/02/23,05/17/23,3,"Deloitte & Touche LLP",468,"Deloitte LLP",1208,Toronto,A6,ONTARIO,Canada,20-F,2023-05-18,,"Canada Goose Holdings Inc.",1690511,"=""GOOS""","250 BOWIE AVENUE",,TORONTO,A6,ONTARIO,Canada,,,"=""2300""","Apparel & Other Finishd Prods of Fabrics & Similar Matl",315222,"Men's and Boys' Cut and Sew Suit, Coat, and Overcoat Manufacturing",34,19,04/04/23,"1,023,657,280",04/02/23,"899,300,000","50,900,000","200,000,000","1,174,900,000"
36832,"Other expenses","Determination of Shared Service Expense",531748,12/31/23,02/01/24,4,"KPMG LLP",187,"KPMG LLP Chartered Accountants",85,Toronto,A6,ONTARIO,Canada,"POS AM",2024-03-28,,"CANADIAN DERIVATIVES CLEARING CORP",319643,,"120 ADELAIDE STREET W","SUITE 300",TORONTO,A6,ONTARIO,Canada,,,"=""6200""","Security & Commodity Brokers, Dealers, Exchanges & Services",523140,"Commodity Contracts Brokerage",34,,,,,,,,
31837,"Allowance for credit losses","Allowance for credit losses",520490,10/31/23,11/29/23,2,"Ernst & Young LLP",192,"Ernst & Young LLP Chartered Accountants",1263,Toronto,A6,ONTARIO,Canada,40-F,2023-11-30,,"CANADIAN IMPERIAL BANK OF COMMERCE /CAN/",1045520,"=""CM""","81 BAY STREET","CIBC SQUARE",TORONTO,A6,ONTARIO,Canada,,,"=""6029""","Commercial Banks, NEC",522110,"Commercial Banking",34,37,11/02/23,"33,866,051,584",10/31/23,"15,352,000,000","3,598,000,000","32,245,000,000","702,820,000,000"
31838,"Derivatives and hedging","Fair value measurement of derivatives",520490,10/31/23,11/29/23,2,"Ernst & Young LLP",192,"Ernst & Young LLP Chartered Accountants",1263,Toronto,A6,ONTARIO,Canada,40-F,2023-11-30,,"CANADIAN IMPERIAL BANK OF COMMERCE /CAN/",1045520,"=""CM""","81 BAY STREET","CIBC SQUARE",TORONTO,A6,ONTARIO,Canada,,,"=""6029""","Commercial Banks, NEC",522110,"Commercial Banking",34,37,11/02/23,"33,866,051,584",10/31/23,"15,352,000,000","3,598,000,000","32,245,000,000","702,820,000,000"
31839,"Uncertain tax positions","Measurement of uncertain tax provisions",520490,10/31/23,11/29/23,2,"Ernst & Young LLP",192,"Ernst & Young LLP Chartered Accountants",1263,Toronto,A6,ONTARIO,Canada,40-F,2023-11-30,,"CANADIAN IMPERIAL BANK OF COMMERCE /CAN/",1045520,"=""CM""","81 BAY STREET","CIBC SQUARE",TORONTO,A6,ONTARIO,Canada,,,"=""6029""","Commercial Banks, NEC",522110,"Commercial Banking",34,37,11/02/23,"33,866,051,584",10/31/23,"15,352,000,000","3,598,000,000","32,245,000,000","702,820,000,000"
32278,"Deferred income taxes","Evaluation of income taxes",523732,12/31/23,01/31/24,4,"KPMG LLP",187,"KPMG LLP Chartered Accountants",85,Montreal,A8,QUEBEC,Canada,6-K,2024-01-31,,"CANADIAN NATIONAL RAILWAY CO",16868,"=""CNI""","935 DE LA GAUCHETIERE ST W",*,MONTREAL,A8,QUEBEC,Canada,,,"=""4011""","Railroads, Line-haul Operating",482111,"Line-Haul Railroads",34,126,12/31/23,"80,742,401,000",12/31/23,"12,543,225,521","4,087,572,000",,"39,256,091,947"
32279,"Deferred and capitalized costs","Evaluation of capitalization of costs relating to track and railway infrastructure",523732,12/31/23,01/31/24,4,"KPMG LLP",187,"KPMG LLP Chartered Accountants",85,Montreal,A8,QUEBEC,Canada,6-K,2024-01-31,,"CANADIAN NATIONAL RAILWAY CO",16868,"=""CNI""","935 DE LA GAUCHETIERE ST W",*,MONTREAL,A8,QUEBEC,Canada,,,"=""4011""","Railroads, Line-haul Operating",482111,"Line-Haul Railroads",34,126,12/31/23,"80,742,401,000",12/31/23,"12,543,225,521","4,087,572,000",,"39,256,091,947"
36323,"Proven and unproven reserves","The Impact of Crude Oil and Natural Gas Reserves on Property, Plant and Equipment Assets in the North America Exploration and Production Segment",530547,12/31/23,02/28/24,1,"PricewaterhouseCoopers LLP",191,"PricewaterhouseCoopers LLP Chartered Accountants",271,Calgary,A0,ALBERTA,Canada,40-F,2024-03-20,,"CANADIAN NATURAL RESOURCES LTD",1017413,"=""CNQ""","2500, 855 - 2ND STREET S.W.",,CALGARY,A0,ALBERTA,Canada,,,"=""1311""","Crude Petroleum and Natural Gas",211111,"Crude Petroleum and Natural Gas Extraction",34,66,01/02/24,"72,487,288,832",12/31/23,"27,277,000,000","6,244,000,000",,"57,603,000,000"
34444,"Pension and other post-employment benefits","Defined Benefit Pension",526710,12/31/23,02/27/24,2,"Ernst & Young LLP",192,"Ernst & Young LLP Chartered Accountants",1263,Calgary,A0,ALBERTA,Canada,10-K,2024-02-27,,"CANADIAN PACIFIC KANSAS CITY LTD/CN",16875,"=""CP""","7550 OGDEN DALE ROAD S.E.",,CALGARY,A0,ALBERTA,Canada,,,"=""4011""","Railroads, Line-haul Operating",482111,"Line-Haul Railroads",34,79,12/31/23,"73,691,824,128",12/31/23,"9,521,000,000","2,978,000,000","15,766,000,000","60,596,000,000"
34445,"Business combinations","Acquisition of Kansas City Southern",526710,12/31/23,02/27/24,2,"Ernst & Young LLP",192,"Ernst & Young LLP Chartered Accountants",1263,Calgary,A0,ALBERTA,Canada,10-K,2024-02-27,,"CANADIAN PACIFIC KANSAS CITY LTD/CN",16875,"=""CP""","7550 OGDEN DALE ROAD S.E.",,CALGARY,A0,ALBERTA,Canada,,,"=""4011""","Railroads, Line-haul Operating",482111,"Line-Haul Railroads",34,79,12/31/23,"73,691,824,128",12/31/23,"9,521,000,000","2,978,000,000","15,766,000,000","60,596,000,000"
37942,"Revenue from customer contracts","Revenue Recognition - solar power and battery energy storage asset sales - Refer to Note 2 (y) and Note 22 to the financial statements",534578,12/31/23,04/26/24,3,"Deloitte & Touche LLP",499,"Deloitte Touche Tohmatsu Certified Public Accountants LLP",1113,Shanghai,F4,CHINA,Foreign,20-F,2024-04-26,,"Canadian Solar Inc.",1375877,"=""CSIQ""","4273 KING STREET EAST, SUITE 102",,KITCHENER,A6,ONTARIO,Canada,,,"=""3674""","Semiconductors and Related Devices",423690,"Other Electronic Parts and Equipment Merchant Wholesalers",34,26,01/02/24,"1,660,385,792",12/31/23,"7,613,626,000","274,187,000","2,539,516,000","11,895,760,000"
37973,"Allowance for credit losses","Measurement of expected credit loss on contingent risk assurance liabilities, financing receivables and finance lease receivables",534567,12/31/23,04/26/24,2,"Ernst & Young LLP",211,"Ernst & Young Hua Ming LLP",1408,Shanghai,F4,CHINA,Foreign,20-F,2024-04-26,,"Cango Inc.",1725123,"=""CANG""","ROOM 2605, HARBOUR CENTRE","25 HARBOUR ROAD","HONG KONG",K3,"HONG KONG",Foreign,,,"=""7372""","Prepackaged Software",518210,"Data Processing, Hosting, and Related Services",34,1,12/31/23,"111,096,264",12/31/23,"239,970,494","-5,340,131","531,372,958","655,453,881"
34940,Consolidation,"Investments in Unconsolidated Affiliates in Sightline and System1 — Other-than-temporary impairment — Refer to Note B to the financial statements",527616,12/31/23,02/29/24,3,"Deloitte & Touche LLP",,,,"Las Vegas",NV,NEVADA,"US West",10-K,2024-02-29,,"Cannae Holdings, Inc.",1704720,"=""CNNE""","C/O CANNAE HOLDINGS, INC.","1701 VILLAGE CENTER CIRCLE","LAS VEGAS",NV,NEVADA,"US West",,,"=""5810""","Retail-Eating & Drinking Places",722110,"Full-Service Restaurants",34,20,01/02/24,"1,396,561,536",12/31/23,"570,000,000","-313,400,000","2,254,300,000","2,686,700,000"
37144,"Revenue from customer contracts","Accounting for capitated revenue",532152,12/31/23,04/01/24,2,"Ernst & Young LLP",,,,Miami,FL,FLORIDA,"US Southeast",10-K,2024-04-01,Yes,"Cano Health, Inc.",1800682,,"9725 NW 117TH AVENUE, SUITE 200",,MIAMI,FL,FLORIDA,"US Southeast",,,"=""8011""","Offices and Clinics of Doctors of Medicine",621111,"Offices of Physicians (except Mental Health Specialists)",34,6,12/31/23,"21,179,658",12/31/23,"3,137,757,000","-594,418,000","-515,426,000","1,013,739,000"
37145,"Insurance contract liabilities","Accounting for third-party medical costs and unpaid service provider costs liabilities",532152,12/31/23,04/01/24,2,"Ernst & Young LLP",,,,Miami,FL,FLORIDA,"US Southeast",10-K,2024-04-01,Yes,"Cano Health, Inc.",1800682,,"9725 NW 117TH AVENUE, SUITE 200",,MIAMI,FL,FLORIDA,"US Southeast",,,"=""8011""","Offices and Clinics of Doctors of Medicine",621111,"Offices of Physicians (except Mental Health Specialists)",34,6,12/31/23,"21,179,658",12/31/23,"3,137,757,000","-594,418,000","-515,426,000","1,013,739,000"
37146,Goodwill,"Valuation of Goodwill",532152,12/31/23,04/01/24,2,"Ernst & Young LLP",,,,Miami,FL,FLORIDA,"US Southeast",10-K,2024-04-01,Yes,"Cano Health, Inc.",1800682,,"9725 NW 117TH AVENUE, SUITE 200",,MIAMI,FL,FLORIDA,"US Southeast",,,"=""8011""","Offices and Clinics of Doctors of Medicine",621111,"Offices of Physicians (except Mental Health Specialists)",34,6,12/31/23,"21,179,658",12/31/23,"3,137,757,000","-594,418,000","-515,426,000","1,013,739,000"
37141,"Other debt","Convertible Debt — Yorkville Convertible Debentures — Refer to Notes 2, 4, and 9 to the financial statements",532144,12/31/23,04/01/24,3,"Deloitte & Touche LLP",,,,Austin,TX,TEXAS,"US Southwest",10-K,2024-04-01,Yes,"Canoo Inc.",1750153,"=""GOEVQ""","19951 MARINER AVENUE",,TORRANCE,CA,CALIFORNIA,"US West",,,"=""3714""","Motor Vehicle Parts and Accessories",511210,"Software Publishers",34,0,01/02/24,"167,050,048",12/31/23,"886,000","-302,021,000",,"542,005,000"
37142,"Shareholder valuation","Preferred Stock Purchase Agreement— Refer to Notes 4, 14 and 16 to the financial statements",532144,12/31/23,04/01/24,3,"Deloitte & Touche LLP",,,,Austin,TX,TEXAS,"US Southwest",10-K,2024-04-01,Yes,"Canoo Inc.",1750153,"=""GOEVQ""","19951 MARINER AVENUE",,TORRANCE,CA,CALIFORNIA,"US West",,,"=""3714""","Motor Vehicle Parts and Accessories",511210,"Software Publishers",34,0,01/02/24,"167,050,048",12/31/23,"886,000","-302,021,000",,"542,005,000"
30437,"Other investments","Fair value measurement of the Acreage financial instrument",513709,03/31/23,06/22/23,4,"KPMG LLP",187,"KPMG LLP Chartered Accountants",85,Ottawa,A6,ONTARIO,Canada,10-K,2023-06-22,Yes,"Canopy Growth Corp",1737927,"=""CGC""","1 HERSHEY DRIVE",,"SMITH FALLS",A6,ONTARIO,Canada,,,"=""2833""","Medicinal Chemicals and Botanical Products",325411,"Medicinal and Botanical Manufacturing",34,2,03/31/23,"905,284,736",03/31/23,"381,250,000","-3,278,158,000","357,744,000","1,802,267,000"
30438,Goodwill,"Goodwill impairment assessment of the Storz & Bickel reporting unit",513709,03/31/23,06/22/23,4,"KPMG LLP",187,"KPMG LLP Chartered Accountants",85,Ottawa,A6,ONTARIO,Canada,10-K,2023-06-22,Yes,"Canopy Growth Corp",1737927,"=""CGC""","1 HERSHEY DRIVE",,"SMITH FALLS",A6,ONTARIO,Canada,,,"=""2833""","Medicinal Chemicals and Botanical Products",325411,"Medicinal and Botanical Manufacturing",34,2,03/31/23,"905,284,736",03/31/23,"381,250,000","-3,278,158,000","357,744,000","1,802,267,000"
30439,"Equity investments and joint ventures","Consolidation of Canopy USA under the variable interest entity model",513709,03/31/23,06/22/23,4,"KPMG LLP",187,"KPMG LLP Chartered Accountants",85,Ottawa,A6,ONTARIO,Canada,10-K,2023-06-22,Yes,"Canopy Growth Corp",1737927,"=""CGC""","1 HERSHEY DRIVE",,"SMITH FALLS",A6,ONTARIO,Canada,,,"=""2833""","Medicinal Chemicals and Botanical Products",325411,"Medicinal and Botanical Manufacturing",34,2,03/31/23,"905,284,736",03/31/23,"381,250,000","-3,278,158,000","357,744,000","1,802,267,000"
37069,"Business combinations","Allocation of Purchase Price for Investments in Real Estate",531803,12/31/23,03/28/24,2,"Ernst & Young LLP",,,,"New York",NY,"NEW YORK","US Mid Atlantic",10-K,2024-03-29,,"Cantor Fitzgerald Income Trust, Inc.",1666244,,"110 EAST 59TH STREET",,"NEW YORK",NY,"NEW YORK","US Mid Atlantic",,,"=""6798""","Real Estate Investment Trusts",525990,"Other Financial Vehicles",34,,,,12/31/23,"90,630,435","-6,889,873","216,966,707","1,143,502,493"
37666,"Real estate investments","Allocation of Purchase Price for Investments in Real Estate",533677,12/31/23,03/28/24,2,"Ernst & Young LLP",,,,"New York",NY,"NEW YORK","US Mid Atlantic",424B3,2024-04-17,,"Cantor Fitzgerald Income Trust, Inc.",1666244,,"110 EAST 59TH STREET",,"NEW YORK",NY,"NEW YORK","US Mid Atlantic",,,"=""6798""","Real Estate Investment Trusts",525990,"Other Financial Vehicles",34,,,,12/31/23,"90,630,435","-6,889,873","216,966,707","1,143,502,493"
33796,"Allowance for credit losses","Allowance for credit losses – Credit Card",526152,12/31/23,02/22/24,2,"Ernst & Young LLP",,,,Tysons,VA,VIRGINIA,"US Mid Atlantic",10-K,2024-02-23,,"CAPITAL ONE FINANCIAL CORP",927628,"=""COF""","1680 CAPITAL ONE DRIVE",,MCLEAN,VA,VIRGINIA,"US Mid Atlantic",,,"=""6021""","National Commercial Banks",522291,"Consumer Lending",34,132,01/02/24,"50,313,666,560",12/31/23,"26,361,000,000","4,887,000,000","43,024,000,000","478,464,000,000"
33797,Goodwill,"Goodwill Impairment Assessment",526152,12/31/23,02/22/24,2,"Ernst & Young LLP",,,,Tysons,VA,VIRGINIA,"US Mid Atlantic",10-K,2024-02-23,,"CAPITAL ONE FINANCIAL CORP",927628,"=""COF""","1680 CAPITAL ONE DRIVE",,MCLEAN,VA,VIRGINIA,"US Mid Atlantic",,,"=""6021""","National Commercial Banks",522291,"Consumer Lending",34,132,01/02/24,"50,313,666,560",12/31/23,"26,361,000,000","4,887,000,000","43,024,000,000","478,464,000,000"
31817,"Allowance for credit losses","Allowance for Credit Losses — Refer to Notes 1 and 4 to the financial statements",520394,09/30/23,11/29/23,3,"Deloitte & Touche LLP",,,,"Kansas City",MO,MISSOURI,"US Southeast",10-K,2023-11-29,,"Capitol Federal Financial, Inc.",1490906,"=""CFFN""","700 S KANSAS AVENUE",,TOPEKA,KS,KANSAS,"US Midwest",,,"=""6035""","Savings Institutions, Federally Chartered",522110,"Commercial Banking",34,5,10/02/23,"629,183,808",09/30/23,"-25,021,000","-101,659,000",,"10,177,461,000"
30216,Goodwill,"Valuation of Goodwill and Indefinite-lived Intangible Assets",512765,04/01/23,05/31/23,2,"Ernst & Young LLP",,,,"New York",NY,"NEW YORK","US Mid Atlantic",10-K,2023-05-31,,"Capri Holdings Ltd",1530721,"=""CPRI""","90 WHITFIELD STREET","2ND FLOOR",LONDON,X0,"UNITED KINGDOM",Foreign,,,"=""3100""","Leather & Leather Products",424330,"Women's, Children's, and Infants' Clothing and Accessories Merchant Wholesalers",34,47,04/03/23,"5,912,120,320",04/01/23,"5,619,000,000","616,000,000","-1,173,000,000","7,295,000,000"
30217,"Long-lived assets","Impairment of Retail Store Long-Lived assets",512765,04/01/23,05/31/23,2,"Ernst & Young LLP",,,,"New York",NY,"NEW YORK","US Mid Atlantic",10-K,2023-05-31,,"Capri Holdings Ltd",1530721,"=""CPRI""","90 WHITFIELD STREET","2ND FLOOR",LONDON,X0,"UNITED KINGDOM",Foreign,,,"=""3100""","Leather & Leather Products",424330,"Women's, Children's, and Infants' Clothing and Accessories Merchant Wholesalers",34,47,04/03/23,"5,912,120,320",04/01/23,"5,619,000,000","616,000,000","-1,173,000,000","7,295,000,000"
30955,Goodwill,"Medical Unit Goodwill",515989,06/30/23,08/15/23,2,"Ernst & Young LLP",,,,"Grandview Heights",OH,OHIO,"US Midwest",10-K,2023-08-15,,"CARDINAL HEALTH INC",721371,"=""CAH""","7000 CARDINAL PLACE",,DUBLIN,OH,OHIO,"US Midwest",,,"=""5122""","Drugs, Drug Proprietaries, and Druggists` Sundries",325412,"Pharmaceutical Preparation Manufacturing",34,95,06/30/23,"23,737,069,568",06/30/23,"204,979,000,000","330,000,000","-8,933,000,000","43,417,000,000"
