"CAM Key","CAM Topic","CAM Company Title","Audit Opinion Key","Year Ended Date","Signature Date","Auditor Key",Auditor,"Auditor Affiliate Key","Auditor Affiliate","Auditor Affiliate PCAOB","Auditor City","Auditor State Code","Auditor State Name","Auditor State Region",Source,"Source Date","Going Concern",Company,"CIK Code",Ticker,"Bus Street 1","Bus Street 2",City,"State Code","State Name","State Region","Parent CIK","Parent Name","SIC Code","SIC Description","NAICS Code","NAICS Description","Filer Act","Stock Price ($)","Stock Price Date","Market Cap ($)","Financials Date","Revenue ($)","Earnings ($)","Book Value ($)","Assets ($)"
41172,"Revenue from customer contracts","Revenue Recognition",551159,12/31/24,02/12/25,2,"Ernst & Young LLP",,,,"San Jose",CA,CALIFORNIA,"US West",10-K,2025-02-13,,"10x Genomics, Inc.",1770787,"=""TXG""","6230 STONERIDGE MALL ROAD",,PLEASANTON,CA,CALIFORNIA,"US West",,,"=""3826""","Laboratory Analytical Instruments",334516,"Analytical Laboratory Instrument Manufacturing",34,14,12/31/24,"1,554,254,720",12/31/24,"610,785,000","-182,627,000","689,952,000","918,636,000"
47163,"Allowance for credit losses","Allowance for Credit Losses – Refer to Note 2 to the consolidated financial statements",563542,12/31/24,04/29/25,3,"Deloitte & Touche LLP",,,,Atlanta,GA,GEORGIA,"US Southeast",10-K,2025-04-30,,"1st FRANKLIN FINANCIAL CORP",38723,,"135 E TUGALO ST","P O BOX 880",TOCCOA,GA,GEORGIA,"US Southeast",,,"=""6141""","Personal Credit Institutions",522292,"Real Estate Credit",34,,,,12/31/24,"223,258,804","-5,605,372",,"1,311,663,070"
46783,"Other investments","Valuation of Investments Accounted for at Fair Value",561805,12/31/24,04/17/25,1,"PricewaterhouseCoopers LLP",94,"PricewaterhouseCoopers Zhong Tian LLP",1424,Beijing,F4,CHINA,Foreign,20-F,2025-04-17,,"36Kr Holdings Inc.",1779476,"=""KRKR""","BUILDING B6, UNIVERSAL BUSINESS PARK","NO. 10 JIUXIANQIAO ROAD","CHAOYANG DISTRICT, BEIJING",F4,CHINA,Foreign,,,"=""7389""","Business Services, NEC",541890,"Other Services Related to Advertising",34,3,01/02/25,"5,274,359",12/31/24,"31,657,000","-18,803,000","15,965,000","37,839,000"
46784,"Allowance for credit losses","Allowance for Credit Losses on Accounts Receivable",561805,12/31/24,04/17/25,1,"PricewaterhouseCoopers LLP",94,"PricewaterhouseCoopers Zhong Tian LLP",1424,Beijing,F4,CHINA,Foreign,20-F,2025-04-17,,"36Kr Holdings Inc.",1779476,"=""KRKR""","BUILDING B6, UNIVERSAL BUSINESS PARK","NO. 10 JIUXIANQIAO ROAD","CHAOYANG DISTRICT, BEIJING",F4,CHINA,Foreign,,,"=""7389""","Business Services, NEC",541890,"Other Services Related to Advertising",34,3,01/02/25,"5,274,359",12/31/24,"31,657,000","-18,803,000","15,965,000","37,839,000"
45746,"Revenue from customer contracts","Revenue - Unobservable Stand-Alone Selling Price Determination — Refer to Note 5 to the financial statements",559188,12/31/24,03/26/25,3,"Deloitte & Touche LLP",,,,Charlotte,NC,"NORTH CAROLINA","US Southeast",10-K,2025-03-27,,"3D SYSTEMS CORP",910638,"=""DDD""","333 THREE D SYSTEMS CIRCLE",,"ROCK HILL",SC,"SOUTH CAROLINA","US Southeast",,,"=""7372""","Prepackaged Software",511210,"Software Publishers",34,3,12/31/24,"444,472,800",12/31/24,"440,121,000","-255,593,000","145,252,000","608,846,000"
45747,"Revenue from customer contracts","Revenue from Collaboration Agreements – Refer to Note 5 to the financial statements",559188,12/31/24,03/26/25,3,"Deloitte & Touche LLP",,,,Charlotte,NC,"NORTH CAROLINA","US Southeast",10-K,2025-03-27,,"3D SYSTEMS CORP",910638,"=""DDD""","333 THREE D SYSTEMS CIRCLE",,"ROCK HILL",SC,"SOUTH CAROLINA","US Southeast",,,"=""7372""","Prepackaged Software",511210,"Software Publishers",34,3,12/31/24,"444,472,800",12/31/24,"440,121,000","-255,593,000","145,252,000","608,846,000"
45748,"Long-lived assets","Goodwill, Intangible Assets and Long-Lived Assets Impairment Charges — Refer to Notes 2, 7, 8 and 9 to the financial statements",559188,12/31/24,03/26/25,3,"Deloitte & Touche LLP",,,,Charlotte,NC,"NORTH CAROLINA","US Southeast",10-K,2025-03-27,,"3D SYSTEMS CORP",910638,"=""DDD""","333 THREE D SYSTEMS CIRCLE",,"ROCK HILL",SC,"SOUTH CAROLINA","US Southeast",,,"=""7372""","Prepackaged Software",511210,"Software Publishers",34,3,12/31/24,"444,472,800",12/31/24,"440,121,000","-255,593,000","145,252,000","608,846,000"
40716,"Other contingent liabilities","PFAS-Related Legal Proceedings",548250,12/31/24,02/05/25,1,"PricewaterhouseCoopers LLP",,,,Minneapolis,MN,MINNESOTA,"US Midwest",10-K,2025-02-05,,"3M CO",66740,"=""MMM""","3M CENTER","BLDG. 220-9E-02","ST PAUL",MN,MINNESOTA,"US Midwest",,,"=""3841""","Surgical and Medical Instruments and Apparatus",322222,"Coated and Laminated Paper Manufacturing",34,130,01/02/25,"70,629,253,120",12/31/24,"24,575,000,000","4,173,000,000","-3,649,000,000","39,868,000,000"
40717,"Disposals and divestitures","Tax-Free Determination of the Health Care Spin-Off and Certain Internal Business Separation Transactions",548250,12/31/24,02/05/25,1,"PricewaterhouseCoopers LLP",,,,Minneapolis,MN,MINNESOTA,"US Midwest",10-K,2025-02-05,,"3M CO",66740,"=""MMM""","3M CENTER","BLDG. 220-9E-02","ST PAUL",MN,MINNESOTA,"US Midwest",,,"=""3841""","Surgical and Medical Instruments and Apparatus",322222,"Coated and Laminated Paper Manufacturing",34,130,01/02/25,"70,629,253,120",12/31/24,"24,575,000,000","4,173,000,000","-3,649,000,000","39,868,000,000"
43926,"Research and development expenses","Accrued Clinical Research Organization Costs",554712,12/31/24,02/28/25,1,"PricewaterhouseCoopers LLP",,,,"San Jose",CA,CALIFORNIA,"US West",10-K,2025-02-28,,"4D Molecular Therapeutics, Inc.",1650648,"=""FDMT""","5858 HORTON STREET #455",,EMERYVILLE,CA,CALIFORNIA,"US West",,,"=""2836""","Biological Products, Except Diagnostic Substances",325414,"Biological Product (except Diagnostic) Manufacturing",34,6,12/31/24,"255,072,256",12/31/24,"37,000","-160,868,000",,"560,384,000"
38896,Inventory,"Assessment of the write-down of inventories",538930,05/31/24,07/18/24,4,"KPMG LLP",,,,Chicago,IL,ILLINOIS,"US Midwest",10-K,2024-07-19,,"AAR CORP",1750,"=""AIR""","1100 N WOOD DALE RD",,"WOOD DALE",IL,ILLINOIS,"US Midwest",,,"=""3720""","Aircraft & Parts",334613,"Magnetic and Optical Recording Media Manufacturing",34,69,05/29/24,"2,455,803,648",05/31/24,"2,318,900,000","46,300,000","399,600,000","2,770,000,000"
38897,"Business combinations","Valuation of acquired intangible assets",538930,05/31/24,07/18/24,4,"KPMG LLP",,,,Chicago,IL,ILLINOIS,"US Midwest",10-K,2024-07-19,,"AAR CORP",1750,"=""AIR""","1100 N WOOD DALE RD",,"WOOD DALE",IL,ILLINOIS,"US Midwest",,,"=""3720""","Aircraft & Parts",334613,"Magnetic and Optical Recording Media Manufacturing",34,69,05/29/24,"2,455,803,648",05/31/24,"2,318,900,000","46,300,000","399,600,000","2,770,000,000"
42281,"Other income taxes","Income taxes – Unrecognized tax benefits",552434,12/31/24,02/21/25,2,"Ernst & Young LLP",,,,Chicago,IL,ILLINOIS,"US Midwest",10-K,2025-02-21,,"ABBOTT LABORATORIES",1800,"=""ABT""","100 ABBOTT PARK ROAD",,"ABBOTT PARK",IL,ILLINOIS,"US Midwest",,,"=""2834""","Pharmaceutical Preparations",325412,"Pharmaceutical Preparation Manufacturing",34,113,01/02/25,"196,756,602,880",12/31/24,"41,950,000,000","13,402,000,000","17,909,000,000","81,414,000,000"
41453,"Sales return and allowances","Sales rebate accruals for Medicaid, Medicare and managed care programs",551403,12/31/24,02/14/25,2,"Ernst & Young LLP",,,,Chicago,IL,ILLINOIS,"US Midwest",10-K,2025-02-14,,"AbbVie Inc.",1551152,"=""ABBV""","1 NORTH WAUKEGAN ROAD",,"NORTH CHICAGO",IL,ILLINOIS,"US Midwest",,,"=""2834""","Pharmaceutical Preparations",325412,"Pharmaceutical Preparation Manufacturing",34,179,01/02/25,"317,095,673,856",12/31/24,"56,334,000,000","4,278,000,000","-91,699,000,000","135,161,000,000"
41454,"Business combinations","Valuation of contingent consideration",551403,12/31/24,02/14/25,2,"Ernst & Young LLP",,,,Chicago,IL,ILLINOIS,"US Midwest",10-K,2025-02-14,,"AbbVie Inc.",1551152,"=""ABBV""","1 NORTH WAUKEGAN ROAD",,"NORTH CHICAGO",IL,ILLINOIS,"US Midwest",,,"=""2834""","Pharmaceutical Preparations",325412,"Pharmaceutical Preparation Manufacturing",34,179,01/02/25,"317,095,673,856",12/31/24,"56,334,000,000","4,278,000,000","-91,699,000,000","135,161,000,000"
43393,"Revenue from customer contracts","Evaluation of revenue recognition for certain research and development services",554067,12/31/24,02/27/25,4,"KPMG LLP",187,"KPMG LLP Chartered Accountants",85,Vancouver,A1,"BRITISH COLUMBIA",Canada,10-K,2025-02-27,,"AbCellera Biologics Inc.",1703057,"=""ABCL""","150 W 4TH AVENUE",,VANCOUVER,A1,"BRITISH COLUMBIA",Canada,,,"=""2834""","Pharmaceutical Preparations",325412,"Pharmaceutical Preparation Manufacturing",34,3,12/31/24,"866,568,000",12/31/24,"28,833,000","-162,857,000","966,165,000","1,360,553,000"
45282,"Other debt","Loan and Security Agreement and Common Stock Warrants — Refer to Notes 9 and 10 to the financial statements",558221,12/31/24,03/19/25,3,"Deloitte & Touche LLP",,,,Morristown,NJ,"NEW JERSEY","US Mid Atlantic",10-K,2025-03-20,,"ABEONA THERAPEUTICS INC.",318306,"=""ABEO""","6555 CARNEGIE AVE, 4TH FLOOR",,CLEVELAND,OH,OHIO,"US Midwest",,,"=""2834""","Pharmaceutical Preparations",325412,"Pharmaceutical Preparation Manufacturing",34,6,01/02/25,"256,913,792",12/31/24,,"-63,734,000",,"108,931,000"
37189,"Long-lived assets","Impairment of Long-Lived Assets – Stores",532023,02/03/24,04/01/24,1,"PricewaterhouseCoopers LLP",,,,Columbus,OH,OHIO,"US Midwest",10-K,2024-04-01,,"ABERCROMBIE & FITCH CO /DE/",1018840,"=""ANF""","6301 FITCH PATH",,"NEW ALBANY",OH,OHIO,"US Midwest",,,"=""5651""","Family Clothing Stores",448140,"Family Clothing Stores",34,106,02/05/24,"5,365,667,328",02/03/24,"4,280,677,000","328,123,000",,"2,974,233,000"
40325,"Other contingent liabilities","Valuation of self-insurance liabilities",545642,10/31/24,12/19/24,4,"KPMG LLP",,,,"New York",NY,"NEW YORK","US Mid Atlantic",10-K,2024-12-19,,"ABM INDUSTRIES INC /DE/",771497,"=""ABM""","ONE LIBERTY PLAZA","7TH FLOOR","NEW YORK",NY,"NEW YORK","US Mid Atlantic",,,"=""7340""","Services-To Dwellings & Other Buildings",561720,"Janitorial Services",34,53,10/31/24,"3,300,155,136",10/31/24,"8,359,400,000","81,400,000","-1,076,300,000","5,097,300,000"
43809,"Other investments","Evaluation of the evidence pertaining to the existence of the gold holdings",554555,12/31/24,02/28/25,4,"KPMG LLP",,,,"New York",NY,"NEW YORK","US Mid Atlantic",10-K,2025-02-28,,"abrdn Gold ETF Trust",1450923,"=""SGOL""","C/O ABRDN","1900 MARKET STREET, SUITE 200",PHILADELPHIA,PA,PENNSYLVANIA,"US Mid Atlantic",,,"=""6221""","Commodity Contracts Brokers and Dealers",525990,"Other Financial Vehicles",34,25,01/02/25,"3,831,351,040",12/31/24,,"710,639,000",,"3,756,668,000"
43806,"Other investments","Evaluation of the evidence pertaining to the existence of the palladium holdings",554557,12/31/24,02/28/25,4,"KPMG LLP",,,,"New York",NY,"NEW YORK","US Mid Atlantic",10-K,2025-02-28,,"abrdn Palladium ETF Trust",1459862,"=""PALL""","C/O ABRDN","1900 MARKET STREET, SUITE 200",PHILADELPHIA,PA,PENNSYLVANIA,"US Mid Atlantic",,,"=""6221""","Commodity Contracts Brokers and Dealers",523991,"Trust, Fiduciary, and Custody Activities",34,84,01/02/25,"397,812,512",12/31/24,,"-67,646,000",,"354,243,000"
43808,"Other investments","Evaluation of the evidence pertaining to the existence of the platinum holdings",554558,12/31/24,02/28/25,4,"KPMG LLP",,,,"New York",NY,"NEW YORK","US Mid Atlantic",10-K,2025-02-28,,"abrdn Platinum ETF Trust",1460235,"=""PPLT""","C/O ABRDN","1900 MARKET STREET, SUITE 200",PHILADELPHIA,PA,PENNSYLVANIA,"US Mid Atlantic",,,"=""6221""","Commodity Contracts Brokers and Dealers",523991,"Trust, Fiduciary, and Custody Activities",34,85,01/02/25,"993,932,480",12/31/24,,"-94,684,000",,"1,019,466,000"
43814,"Other investments","Evaluation of the evidence pertaining to the existence of the bullion holdings",554565,12/31/24,02/28/25,4,"KPMG LLP",,,,"New York",NY,"NEW YORK","US Mid Atlantic",10-K,2025-02-28,,"abrdn Precious Metals Basket ETF Trust",1483386,"=""GLTR""","C/O ABRDN","1900 MARKET STREET, SUITE 200",PHILADELPHIA,PA,PENNSYLVANIA,"US Mid Atlantic",,,"=""6221""","Commodity Contracts Brokers and Dealers",523920,"Portfolio Management",34,112,01/02/25,"1,058,168,000",12/31/24,,"170,283,000",,"1,040,489,000"
43810,"Other investments","Evaluation of the evidence pertaining to the existence of the silver holdings",554554,12/31/24,02/28/25,4,"KPMG LLP",,,,"New York",NY,"NEW YORK","US Mid Atlantic",10-K,2025-02-28,,"abrdn Silver ETF Trust",1450922,"=""SIVR""","C/O ABRDN","1900 MARKET STREET, SUITE 200",PHILADELPHIA,PA,PENNSYLVANIA,"US Mid Atlantic",,,"=""6221""","Commodity Contracts Brokers and Dealers",523991,"Trust, Fiduciary, and Custody Activities",34,28,01/02/25,"1,433,575,936",12/31/24,,"215,240,000",,"1,421,490,000"
44808,"Other intangible assets","Intangible asset – valuation",557364,12/31/24,03/13/25,1,"PricewaterhouseCoopers LLP",286,"PricewaterhouseCoopers SA",1358,Pully,V8,SWITZERLAND,Foreign,20-F,2025-03-13,,"AC Immune SA",1651625,"=""ACIU""","EPFL INNOVATION PARK, BUILDING B",,"1015 LAUSANNE",V8,SWITZERLAND,Foreign,,,"=""2834""","Pharmaceutical Preparations",325412,"Pharmaceutical Preparation Manufacturing",34,3,01/02/25,"282,713,824",12/31/24,"30,134,000","-56,183,000","68,254,000","254,801,000"
36407,"Other contingent liabilities","Accounting and disclosure of loss contingencies",530768,02/03/24,03/21/24,3,"Deloitte & Touche LLP",,,,Houston,TX,TEXAS,"US Southwest",10-K,2024-03-21,,"Academy Sports & Outdoors, Inc.",1817358,"=""ASO""","1800 NORTH MASON ROAD",,KATY,TX,TEXAS,"US Southwest",,,"=""5940""","Retail-Miscellaneous Shopping Goods Stores",451110,"Sporting Goods Stores",34,63,02/05/24,"4,656,707,072",02/03/24,"6,159,291,000","519,190,000","514,494,000","4,676,713,000"
43351,"Revenue from customer contracts","Revenue Recognition",553947,12/31/24,02/27/25,2,"Ernst & Young LLP",,,,Nashville,TN,TENNESSEE,"US Southeast",10-K,2025-02-27,,"Acadia Healthcare Company, Inc.",1520697,"=""ACHC""","6100 TOWER CIRCLE","SUITE 1000",FRANKLIN,TN,TENNESSEE,"US Southeast",,,"=""8093""","Specialty Outpatient Facilities, NEC",623220,"Residential Mental Health and Substance Abuse Facilities",34,40,12/31/24,"3,638,889,216",12/31/24,"3,153,963,000","255,612,000","855,977,000","5,956,915,000"
43182,"Sales return and allowances","Medicare Part D sales rebate accruals",553867,12/31/24,02/27/25,2,"Ernst & Young LLP",,,,"San Diego",CA,CALIFORNIA,"US West",10-K,2025-02-27,,"ACADIA PHARMACEUTICALS INC",1070494,"=""ACAD""","12830 EL CAMINO REAL","SUITE 400","SAN DIEGO",CA,CALIFORNIA,"US West",,,"=""2834""","Pharmaceutical Preparations",325412,"Pharmaceutical Preparation Manufacturing",34,18,12/31/24,"3,059,107,584",12/31/24,"957,797,000","226,451,000","613,011,000","1,187,756,000"
41476,"Real estate investments","Operating real estate, net — Impairment — Refer to Notes 1, 2 and 8 to the financial statements",551445,12/31/24,02/14/25,3,"Deloitte & Touche LLP",,,,"New York",NY,"NEW YORK","US Mid Atlantic",10-K,2025-02-14,,"ACADIA REALTY TRUST",899629,"=""AKR""","411 THEODORE FREMD AVENUE","SUITE 300",RYE,NY,"NEW YORK","US Mid Atlantic",,,"=""6798""","Real Estate Investment Trusts",531120,"Lessors of Nonresidential Buildings (except Miniwarehouses)",34,24,01/02/25,"2,859,752,192",12/31/24,"359,689,000","21,650,000",,"4,371,203,000"
43442,"Deferred and stock-based compensation","Assessment of the fair value measurement of the cash-settled subsidiary awards liability",553986,12/31/24,02/27/25,4,"KPMG LLP",,,,Boston,MA,MASSACHUSETTS,"US New England",10-K,2025-02-27,,"Acadian Asset Management Inc.",1748824,"=""AAMI""","200 STATE STREET","SUITE 601A",BOSTON,MA,MASSACHUSETTS,"US New England",,,"=""6282""","Investment Advice",523930,"Investment Advice",34,26,01/02/25,"962,429,632",12/31/24,"486,200,000","85,000,000","66,800,000","703,200,000"
43997,"Accounts/loans receivable","Sufficiency of audit evidence over cash",554941,12/31/24,03/03/25,4,"KPMG LLP",,,,Chicago,IL,ILLINOIS,"US Midwest",10-K,2025-03-03,,"Accel Entertainment, Inc.",1698991,"=""ACEL""","140 TOWER DRIVE",,"BURR RIDGE",IL,ILLINOIS,"US Midwest",,,"=""7900""","Services-Amusement & Recreation Services",713290,"Other Gambling Industries",34,11,01/02/25,"870,370,368",12/31/24,"1,230,972,000","35,252,000","89,115,000","1,048,398,000"
39678,"Revenue from customer contracts","Estimated costs to complete certain technology integration consulting services contracts",542395,08/31/24,10/10/24,4,"KPMG LLP",,,,Chicago,IL,ILLINOIS,"US Midwest",10-K,2024-10-10,,"Accenture plc",1467373,"=""ACN""","1 GRAND CANAL SQUARE","GRAND CANAL HARBOUR",DUBLIN,L2,IRELAND,Foreign,,,"=""7389""","Business Services, NEC",541611,"Administrative Management and General Management Consulting Services",34,340,08/29/24,"228,606,443,520",08/31/24,"64,896,464,000","7,264,787,000","4,264,436,000","55,932,363,000"
39679,"Uncertain tax positions","Unrecognized tax benefits",542395,08/31/24,10/10/24,4,"KPMG LLP",,,,Chicago,IL,ILLINOIS,"US Midwest",10-K,2024-10-10,,"Accenture plc",1467373,"=""ACN""","1 GRAND CANAL SQUARE","GRAND CANAL HARBOUR",DUBLIN,L2,IRELAND,Foreign,,,"=""7389""","Business Services, NEC",541611,"Administrative Management and General Management Consulting Services",34,340,08/29/24,"228,606,443,520",08/31/24,"64,896,464,000","7,264,787,000","4,264,436,000","55,932,363,000"
42377,Inventory,"Write-down of certain finished goods inventory for obsolete and slow-moving items",552701,12/31/24,02/21/25,4,"KPMG LLP",,,,Chicago,IL,ILLINOIS,"US Midwest",10-K,2025-02-21,,"ACCO BRANDS Corp",712034,"=""ACCO""","FOUR CORPORATE DRIVE",,"LAKE ZURICH",IL,ILLINOIS,"US Midwest",,,"=""2780""","Blankbooks, Looseleaf Binders & Bookbindg & Relatd Work",323118,"Blankbook, Looseleaf Binders, and Devices Manufacturing",34,5,01/02/25,"482,052,416",12/31/24,"1,666,200,000","-101,600,000","-549,900,000","2,228,400,000"
42378,"Goodwill and intangible assets","Impairment Assessment of Americas Reporting Unit Goodwill and Five Star Trade Name Intangible Asset",552701,12/31/24,02/21/25,4,"KPMG LLP",,,,Chicago,IL,ILLINOIS,"US Midwest",10-K,2025-02-21,,"ACCO BRANDS Corp",712034,"=""ACCO""","FOUR CORPORATE DRIVE",,"LAKE ZURICH",IL,ILLINOIS,"US Midwest",,,"=""2780""","Blankbooks, Looseleaf Binders & Bookbindg & Relatd Work",323118,"Blankbook, Looseleaf Binders, and Devices Manufacturing",34,5,01/02/25,"482,052,416",12/31/24,"1,666,200,000","-101,600,000","-549,900,000","2,228,400,000"
37992,"Revenue from customer contracts","Sufficiency of audit evidence over revenue",534548,02/29/24,04/25/24,4,"KPMG LLP",,,,Philadelphia,PA,PENNSYLVANIA,"US Mid Atlantic",10-K,2024-04-26,,"Accolade, Inc.",1481646,,"660 W. GERMANTOWN PIKE SUITE 500",,"PLYMOUTH MEETING",PA,PENNSYLVANIA,"US Mid Atlantic",,,"=""7389""","Business Services, NEC",611710,"Educational Support Services",34,10,02/29/24,"800,225,536",02/29/24,"414,292,000","-99,805,000","1,867,000","788,151,000"
44614,"Other investments","Contingent consideration arising from the Sopharma share purchase agreement",556965,12/31/24,03/11/25,1,"PricewaterhouseCoopers LLP",191,"PricewaterhouseCoopers LLP Chartered Accountants",271,Vancouver,A1,"BRITISH COLUMBIA",Canada,10-K,2025-03-11,Yes,"ACHIEVE LIFE SCIENCES, INC.",949858,"=""ACHV""","22722 29TH DR. SE","SUITE 100",SEATTLE,WA,WASHINGTON,"US West",,,"=""2835""","In Vitro and In Vivo Diagnostic Substances",325412,"Pharmaceutical Preparation Manufacturing",34,4,01/02/25,"126,898,904",12/31/24,,"-39,827,000","18,891,000","38,633,000"
43541,"Revenue from customer contracts","Revenue Recognition - Software License Arrangements - Refer to Note 2 to the financial statements",554223,12/31/24,02/27/25,3,"Deloitte & Touche LLP",,,,Omaha,NE,NEBRASKA,"US Midwest",10-K,2025-02-27,,"ACI WORLDWIDE, INC.",935036,"=""ACIW""","6060 COVENTRY DRIVE",,ELKHORN,NE,NEBRASKA,"US Midwest",,,"=""7372""","Prepackaged Software",511210,"Software Publishers",34,52,12/31/24,"5,463,782,400",12/31/24,"1,594,288,000","203,118,000","-59,969,000","3,025,293,000"
43277,"Other contingent liabilities","Fair Value of the Contingent Consideration Liability",553954,12/31/24,02/27/25,1,"PricewaterhouseCoopers LLP",,,,Philadelphia,PA,PENNSYLVANIA,"US Mid Atlantic",10-K,2025-02-27,,"Aclaris Therapeutics, Inc.",1557746,"=""ACRS""","701 LEE ROAD","SUITE 103",WAYNE,PA,PENNSYLVANIA,"US Mid Atlantic",,,"=""2834""","Pharmaceutical Preparations",325412,"Pharmaceutical Preparation Manufacturing",34,2,12/31/24,"267,468,304",12/31/24,"18,720,000","-132,065,000",,"220,327,000"
44161,"Revenue from customer contracts","Revenue Recognition",555014,12/31/24,03/03/25,2,"Ernst & Young LLP",211,"Ernst & Young Hua Ming LLP",1408,Shanghai,F4,CHINA,Foreign,10-K,2025-03-03,,"ACM Research, Inc.",1680062,"=""ACMR""","42307 OSGOOD ROAD, SUITE I",,FREMONT,CA,CALIFORNIA,"US West",,,"=""3559""","Special  Industry Machinery, NEC",333295,"Semiconductor Machinery Manufacturing",34,16,01/02/25,"896,925,952",12/31/24,"782,118,000","103,627,000","901,164,000","1,855,721,000"
45103,"Allowance for credit losses","Allowance for Current Expected Credit Losses (CECL)",557722,12/31/24,03/14/25,2,"Ernst & Young LLP",,,,Philadelphia,PA,PENNSYLVANIA,"US Mid Atlantic",10-K,2025-03-17,,"ACRES Commercial Realty Corp.",1332551,"=""ACR""","390 RXR PLAZA",,UNIONDALE,NY,"NEW YORK","US Mid Atlantic",,,"=""6798""","Real Estate Investment Trusts",525990,"Other Financial Vehicles",34,16,01/02/25,"127,504,224",12/31/24,"78,698,000","29,267,000","432,140,000","1,881,467,000"
39804,"Warranty liabilities","Product Warranty Costs",543033,08/31/24,10/28/24,2,"Ernst & Young LLP",,,,Atlanta,GA,GEORGIA,"US Southeast",10-K,2024-10-28,,"ACUITY INC. (DE)",1144215,"=""AYI""","1170 PEACHTREE STREET NE","SUITE 1200",ATLANTA,GA,GEORGIA,"US Southeast",,,"=""3640""","Electric Lighting & Wiring Equipment",335110,"Electric Lamp Bulb and Part Manufacturing",34,250,08/29/24,"7,686,432,256",08/31/24,"3,841,000,000","422,600,000","839,600,000","3,814,600,000"
43265,"Other income taxes","Accounting for Income Taxes",553944,12/31/24,02/27/25,1,"PricewaterhouseCoopers LLP",,,,Boston,MA,MASSACHUSETTS,"US New England",10-K,2025-02-27,,"Acushnet Holdings Corp.",1672013,"=""GOLF""","333 BRIDGE STREET",,FAIRHAVEN,MA,MASSACHUSETTS,"US New England",,,"=""3949""","Sporting and Athletic Goods, NEC",339920,"Sporting and Athletic Goods Manufacturing",34,71,12/31/24,"4,284,605,184",12/31/24,"2,457,091,000","214,298,000","26,008,000","2,180,206,000"
41802,"Revenue from customer contracts","Revenue – highly automated processes within auction & other marketplace revenue",551941,12/31/24,02/19/25,2,"Ernst & Young LLP",,,,Buffalo,NY,"NEW YORK","US Mid Atlantic",10-K,2025-02-19,,"ACV Auctions Inc.",1637873,"=""ACVA""","640 ELLICOTT STREET",,BUFFALO,NY,"NEW YORK","US Mid Atlantic",,,"=""7389""","Business Services, NEC",459999,,34,22,12/31/24,"3,629,424,640",12/31/24,"637,156,000","-79,700,000","168,710,000","984,149,000"
42778,"Other revenue","Implicit Price Concession",553230,12/31/24,02/25/25,4,"KPMG LLP",,,,Philadelphia,PA,PENNSYLVANIA,"US Mid Atlantic",10-K,2025-02-25,,"AdaptHealth Corp.",1725255,"=""AHCO""","555 EAST NORTH LANE","SUITE 5075",CONSHOHOCKEN,PA,PENNSYLVANIA,"US Mid Atlantic",,,"=""8082""","Home Health Care Services",423450,"Medical, Dental, and Hospital Equipment and Supplies Merchant Wholesalers",34,10,12/31/24,"1,281,414,016",12/31/24,"3,260,975,000","90,422,000","-1,209,569,000","4,486,947,000"
44067,"Research and development expenses","Genentech Agreement",555049,12/31/24,03/03/25,2,"Ernst & Young LLP",,,,Seattle,WA,WASHINGTON,"US West",10-K,2025-03-03,,"Adaptive Biotechnologies Corp",1478320,"=""ADPT""","1165 EASTLAKE AVE E",,SEATTLE,WA,WASHINGTON,"US West",,,"=""2836""","Biological Products, Except Diagnostic Substances",325414,"Biological Product (except Diagnostic) Manufacturing",34,6,01/02/25,"913,516,992",12/31/24,"178,957,000","-159,492,000","80,312,000","539,376,000"
45709,"Other debt","Deferred royalty obligation with HealthCare Royalty Partners",559176,12/31/24,03/27/25,1,"PricewaterhouseCoopers LLP",286,"PricewaterhouseCoopers SA",1358,Pully,V8,SWITZERLAND,Foreign,10-K,2025-03-27,,"ADC Therapeutics SA",1771910,"=""ADCT""",BIOPOLE,"ROUTE DE LA CORNICHE 3B",EPALINGES,V8,SWITZERLAND,Foreign,,,"=""2834""","Pharmaceutical Preparations",325412,"Pharmaceutical Preparation Manufacturing",34,2,12/31/24,"196,734,192",12/31/24,"70,837,000","-157,846,000",,"321,980,000"
45710,"Sales return and allowances","Product Revenue – Gross-to-net (GTN) sales adjustment – Discarded Drug Rebate",559176,12/31/24,03/27/25,1,"PricewaterhouseCoopers LLP",286,"PricewaterhouseCoopers SA",1358,Pully,V8,SWITZERLAND,Foreign,10-K,2025-03-27,,"ADC Therapeutics SA",1771910,"=""ADCT""",BIOPOLE,"ROUTE DE LA CORNICHE 3B",EPALINGES,V8,SWITZERLAND,Foreign,,,"=""2834""","Pharmaceutical Preparations",325412,"Pharmaceutical Preparation Manufacturing",34,2,12/31/24,"196,734,192",12/31/24,"70,837,000","-157,846,000",,"321,980,000"
42792,"Accounts/loans receivable","Valuation of Accounts Receivable, Net of Allowances for Implicit Price Concessions",553237,12/31/24,02/25/25,1,"PricewaterhouseCoopers LLP",,,,Dallas,TX,TEXAS,"US Southwest",10-K,2025-02-25,,"Addus HomeCare Corp",1468328,"=""ADUS""","6303 COWBOYS WAY","SUITE 600",FRISCO,TX,TEXAS,"US Southwest",,,"=""8082""","Home Health Care Services",621610,"Home Health Care Services",34,125,12/31/24,"2,274,851,840",12/31/24,"1,154,599,000","73,598,000","-109,709,000","1,412,634,000"
44853,"Other assets","Valuation of Level 3 Biological Assets",557440,12/31/24,03/13/25,1,"PricewaterhouseCoopers LLP",88,"Price Waterhouse & Co SRL",1349,"Buenos Aires",C1,ARGENTINA,Foreign,6-K,2025-03-13,,"Adecoagro S.A.",1499505,"=""AGRO""","28, BOULEVARD F.W. RAIFFEEISEN",,N/A,N4,LUXEMBOURG,Foreign,,,"=""0100""","Agricultural production- crops",111150,"Corn Farming",34,9,12/31/24,"943,507,136",12/31/24,"1,518,907,000","92,101,000","1,331,919,000","3,114,888,000"
44854,"Other assets","Net Assets Impairment Assessment – Farming and Sugar, Ethanol and Energy Business",557440,12/31/24,03/13/25,1,"PricewaterhouseCoopers LLP",88,"Price Waterhouse & Co SRL",1349,"Buenos Aires",C1,ARGENTINA,Foreign,6-K,2025-03-13,,"Adecoagro S.A.",1499505,"=""AGRO""","28, BOULEVARD F.W. RAIFFEEISEN",,N/A,N4,LUXEMBOURG,Foreign,,,"=""0100""","Agricultural production- crops",111150,"Corn Farming",34,9,12/31/24,"943,507,136",12/31/24,"1,518,907,000","92,101,000","1,331,919,000","3,114,888,000"
46975,"Other assets","Valuation of Level 3 Biological Assets",562680,12/31/24,04/24/25,1,"PricewaterhouseCoopers LLP",88,"Price Waterhouse & Co SRL",1349,"Buenos Aires",C1,ARGENTINA,Foreign,20-F,2025-04-25,,"Adecoagro S.A.",1499505,"=""AGRO""","28, BOULEVARD F.W. RAIFFEEISEN",,N/A,N4,LUXEMBOURG,Foreign,,,"=""0100""","Agricultural production- crops",111150,"Corn Farming",34,9,12/31/24,"943,507,136",12/31/24,"1,518,907,000","92,101,000","1,331,919,000","3,114,888,000"
46976,"Long-lived assets","Net Assets Impairment Assessment – Farming and Sugar, Ethanol and Energy Business",562680,12/31/24,04/24/25,1,"PricewaterhouseCoopers LLP",88,"Price Waterhouse & Co SRL",1349,"Buenos Aires",C1,ARGENTINA,Foreign,20-F,2025-04-25,,"Adecoagro S.A.",1499505,"=""AGRO""","28, BOULEVARD F.W. RAIFFEEISEN",,N/A,N4,LUXEMBOURG,Foreign,,,"=""0100""","Agricultural production- crops",111150,"Corn Farming",34,9,12/31/24,"943,507,136",12/31/24,"1,518,907,000","92,101,000","1,331,919,000","3,114,888,000"
41890,"Revenue from customer contracts","Revenue Recognition – Allocation of Transaction Price to Performance Obligations",551965,12/31/24,02/19/25,1,"PricewaterhouseCoopers LLP",,,,"San Jose",CA,CALIFORNIA,"US West",10-K,2025-02-19,,"Adeia Inc.",1803696,"=""ADEA""","3025 ORCHARD PARKWAY",,"SAN JOSE",CA,CALIFORNIA,"US West",,,"=""4841""","Cable and Other Pay Television Services",334413,"Semiconductor and Related Device Manufacturing",34,14,12/31/24,"1,510,846,592",12/31/24,"376,024,000","64,623,000","-218,266,000","1,097,961,000"
40003,Goodwill,"Annual Goodwill Impairment Assessment",544126,09/30/24,11/18/24,1,"PricewaterhouseCoopers LLP",,,,Detroit,MI,MICHIGAN,"US Midwest",10-K,2024-11-18,,"Adient plc",1670541,"=""ADNT""","25 NORTH WALL QUAY","DUBLIN 1",DUBLIN,L2,IRELAND,Foreign,,,"=""3714""","Motor Vehicle Parts and Accessories",336399,"All Other Motor Vehicle Parts Manufacturing",34,22,10/02/24,"1,932,128,896",09/30/24,"14,688,000,000","18,000,000","-310,000,000","9,351,000,000"
45162,"Sales return and allowances","Valuation of the U.S. Medicaid rebate accrual for immunoglobulin products",557878,12/31/24,03/18/25,4,"KPMG LLP",,,,Stamford,CT,CONNECTICUT,"US New England",10-K,2025-03-18,,"ADMA BIOLOGICS, INC.",1368514,"=""ADMA""","C/O ADMA BIOLOGICS, INC.","465 STATE ROUTE 17",RAMSEY,NJ,"NEW JERSEY","US Mid Atlantic",,,"=""2836""","Biological Products, Except Diagnostic Substances",325412,"Pharmaceutical Preparation Manufacturing",34,18,01/02/25,"4,247,932,928",12/31/24,"426,454,000","197,673,000","345,028,000","488,678,000"
40480,"Revenue from customer contracts","Performance obligations in cloud-enabled software subscriptions",547167,11/29/24,01/13/25,4,"KPMG LLP",,,,"Santa Clara",CA,CALIFORNIA,"US West",10-K,2025-01-13,,"ADOBE INC.",796343,"=""ADBE""","345 PARK AVE",,"SAN JOSE",CA,CALIFORNIA,"US West",,,"=""7372""","Prepackaged Software",511210,"Software Publishers",34,514,11/27/24,"226,121,940,992",11/29/24,"21,505,000,000","5,560,000,000","535,000,000","30,230,000,000"
43389,"Discontinued operations","Discontinued Operations – Solar Business",554062,12/31/24,02/27/25,1,"PricewaterhouseCoopers LLP",,,,Miami,FL,FLORIDA,"US Southeast",10-K,2025-02-27,,"ADT Inc.",1703056,"=""ADT""","1501 YAMATO ROAD",,"BOCA RATON",FL,FLORIDA,"US Southeast",,,"=""7381""","Detective, Guard, and Armored Car Services",561621,"Security Systems Services (except Locksmiths)",34,7,12/31/24,"5,780,835,328",12/31/24,"4,898,446,000","501,053,000","-5,957,197,000","16,050,957,000"
39049,"Goodwill and intangible assets","Impairment Assessments – American University of the Caribbean School of Medicine (“AUC”) Reporting Unit Goodwill and AUC Title IV Eligibility and Accreditations",539679,06/30/24,08/06/24,1,"PricewaterhouseCoopers LLP",,,,Chicago,IL,ILLINOIS,"US Midwest",10-K,2024-08-06,,"Adtalem Global Education Inc.",730464,"=""ATGE""","233 S. WACKER DRIVE","SUITE 800",CHICAGO,IL,ILLINOIS,"US Midwest",,,"=""8200""","Services-Educational Services",611519,"Other Technical and Trade Schools",34,67,07/02/24,"2,535,804,160",06/30/24,"1,584,652,000","136,777,000","-368,821,000","2,741,417,000"
44201,Inventory,"Valuation of Inventory – Estimate of Certain Excess and Obsolete Reserves",555075,12/31/24,03/03/25,1,"PricewaterhouseCoopers LLP",,,,Birmingham,AL,ALABAMA,"US Southeast",10-K,2025-03-03,,"ADTRAN Holdings, Inc.",926282,"=""ADTN""","901 EXPLORER BLVD",,HUNTSVILLE,AL,ALABAMA,"US Southeast",,,"=""3661""","Telephone and Telegraph Apparatus",334210,"Telephone Apparatus Manufacturing",34,9,01/02/25,"689,465,792",12/31/24,"922,720,000","-459,891,000","212,083,000","1,171,419,000"
44202,"Accounts/loans receivable","Accounts Receivable Factoring",555075,12/31/24,03/03/25,1,"PricewaterhouseCoopers LLP",,,,Birmingham,AL,ALABAMA,"US Southeast",10-K,2025-03-03,,"ADTRAN Holdings, Inc.",926282,"=""ADTN""","901 EXPLORER BLVD",,HUNTSVILLE,AL,ALABAMA,"US Southeast",,,"=""3661""","Telephone and Telegraph Apparatus",334210,"Telephone Apparatus Manufacturing",34,9,01/02/25,"689,465,792",12/31/24,"922,720,000","-459,891,000","212,083,000","1,171,419,000"
44203,Goodwill,"Interim Goodwill and Asset Group Impairment Assessments – Network Solutions Reporting Unit and Asset Group",555075,12/31/24,03/03/25,1,"PricewaterhouseCoopers LLP",,,,Birmingham,AL,ALABAMA,"US Southeast",10-K,2025-03-03,,"ADTRAN Holdings, Inc.",926282,"=""ADTN""","901 EXPLORER BLVD",,HUNTSVILLE,AL,ALABAMA,"US Southeast",,,"=""3661""","Telephone and Telegraph Apparatus",334210,"Telephone Apparatus Manufacturing",34,9,01/02/25,"689,465,792",12/31/24,"922,720,000","-459,891,000","212,083,000","1,171,419,000"
47448,Inventory,"Valuation of Inventory – Estimate of Certain Excess and Obsolete Reserves",565436,12/31/24,03/03/25,1,"PricewaterhouseCoopers LLP",,,,Birmingham,AL,ALABAMA,"US Southeast",10-K/A,2025-05-20,,"ADTRAN Holdings, Inc.",926282,"=""ADTN""","901 EXPLORER BLVD",,HUNTSVILLE,AL,ALABAMA,"US Southeast",,,"=""3661""","Telephone and Telegraph Apparatus",334210,"Telephone Apparatus Manufacturing",34,9,01/02/25,"689,465,792",12/31/24,"922,720,000","-459,891,000","212,083,000","1,171,419,000"
47449,"Accounts/loans receivable","Accounts Receivable Factoring",565436,12/31/24,03/03/25,1,"PricewaterhouseCoopers LLP",,,,Birmingham,AL,ALABAMA,"US Southeast",10-K/A,2025-05-20,,"ADTRAN Holdings, Inc.",926282,"=""ADTN""","901 EXPLORER BLVD",,HUNTSVILLE,AL,ALABAMA,"US Southeast",,,"=""3661""","Telephone and Telegraph Apparatus",334210,"Telephone Apparatus Manufacturing",34,9,01/02/25,"689,465,792",12/31/24,"922,720,000","-459,891,000","212,083,000","1,171,419,000"
47450,Goodwill,"Interim Goodwill and Asset Group Impairment Assessments – Network Solutions Reporting Unit and Asset Group",565436,12/31/24,03/03/25,1,"PricewaterhouseCoopers LLP",,,,Birmingham,AL,ALABAMA,"US Southeast",10-K/A,2025-05-20,,"ADTRAN Holdings, Inc.",926282,"=""ADTN""","901 EXPLORER BLVD",,HUNTSVILLE,AL,ALABAMA,"US Southeast",,,"=""3661""","Telephone and Telegraph Apparatus",334210,"Telephone Apparatus Manufacturing",34,9,01/02/25,"689,465,792",12/31/24,"922,720,000","-459,891,000","212,083,000","1,171,419,000"
42930,"Vendor/supplier rebates","Vendor Incentives — Refer to Note 2 to the Consolidated Financial Statements",553506,12/28/24,02/26/25,3,"Deloitte & Touche LLP",,,,Charlotte,NC,"NORTH CAROLINA","US Southeast",10-K,2025-02-26,,"ADVANCE AUTO PARTS INC",1158449,"=""AAP""","4200 SIX FORKS ROAD",,RALEIGH,NC,"NORTH CAROLINA","US Southeast",,,"=""5531""","Auto and Home Supply Stores",441310,"Automotive Parts and Accessories Stores",34,47,12/31/24,"2,809,120,512",12/28/24,"9,094,327,000","-335,788,000","1,165,974,000","10,798,109,000"
42931,Inventory,"Restructuring — Refer to Note 3 to the Consolidated Financial Statements",553506,12/28/24,02/26/25,3,"Deloitte & Touche LLP",,,,Charlotte,NC,"NORTH CAROLINA","US Southeast",10-K,2025-02-26,,"ADVANCE AUTO PARTS INC",1158449,"=""AAP""","4200 SIX FORKS ROAD",,RALEIGH,NC,"NORTH CAROLINA","US Southeast",,,"=""5531""","Auto and Home Supply Stores",441310,"Automotive Parts and Accessories Stores",34,47,12/31/24,"2,809,120,512",12/28/24,"9,094,327,000","-335,788,000","1,165,974,000","10,798,109,000"
38327,Goodwill,"Goodwill, Infiltrator Water Technologies Reporting Unit — Refer to Note 8 to the financial statements",536258,03/31/24,05/16/24,3,"Deloitte & Touche LLP",,,,Columbus,OH,OHIO,"US Midwest",10-K,2024-05-16,,"ADVANCED DRAINAGE SYSTEMS, INC.",1604028,"=""WMS""","4024 GREEN STRIPE LANE",,HILLIARD,OH,OHIO,"US Midwest",,,"=""3086""","Plastics Foam Products",326122,"Plastics Pipe and Pipe Fitting Manufacturing",34,172,03/31/24,"13,357,211,648",03/31/24,"2,874,473,000","509,915,000","292,062,000","3,268,913,000"
41697,Inventory,"Inventory valuation",551701,12/31/24,02/18/25,2,"Ernst & Young LLP",,,,Denver,CO,COLORADO,"US West",10-K,2025-02-18,,"ADVANCED ENERGY INDUSTRIES INC",927003,"=""AEIS""","ATTN:  PAUL OLDHAM","1595 WYNKOOP ST, SUITE 800",DENVER,CO,COLORADO,"US West",,,"=""3679""","Electronic Components, NEC",335999,"All Other Miscellaneous Electrical Equipment and Component Manufacturing",34,115,01/02/25,"4,345,211,392",12/31/24,"1,482,042,000","54,214,000","767,778,000","2,261,894,000"
40719,Inventory,"Inventory Valuation",548248,12/28/24,02/05/25,2,"Ernst & Young LLP",,,,"San Jose",CA,CALIFORNIA,"US West",10-K,2025-02-05,,"ADVANCED MICRO DEVICES INC",2488,"=""AMD""","2485 AUGUSTINE DRIVE",,"SANTA CLARA",CA,CALIFORNIA,"US West",,,"=""3674""","Semiconductors and Related Devices",334413,"Semiconductor and Related Device Manufacturing",34,122,12/30/24,"198,696,534,016",12/28/24,"25,785,000,000","1,641,000,000","13,799,000,000","69,226,000,000"
42317,"Revenue from customer contracts","Revenue Recognition – Transfer of Control",552444,12/31/24,02/21/25,1,"PricewaterhouseCoopers LLP",,,,"Florham Park",NJ,"NEW JERSEY","US Mid Atlantic",10-K,2025-02-21,,"AdvanSix Inc.",1673985,"=""ASIX""","300 KIMBALL DRIVE","SUITE 101",PARSIPPANY,NJ,"NEW JERSEY","US Mid Atlantic",,,"=""2821""","Plastics Material and Synthetic Resins, and Nonvulcanizable Elastomers",325211,"Plastics Material and Resin Manufacturing",34,28,12/31/24,"761,738,176",12/31/24,"1,517,557,000","44,149,000","675,314,000","1,594,920,000"
44468,Goodwill,"Interim and Annual Goodwill Impairment Assessments – Certain Reporting Units",556199,12/31/24,03/07/25,1,"PricewaterhouseCoopers LLP",,,,Irvine,CA,CALIFORNIA,"US West",10-K,2025-03-07,,"Advantage Solutions Inc.",1776661,"=""ADV""","C/O ADVANTAGE SOLUTIONS, INC.","7676 FORSYTH BOULEVARD, 5TH FLOOR","ST. LOUIS",MO,MISSOURI,"US Southeast",,,"=""7389""","Business Services, NEC",541611,"Administrative Management and General Management Consulting Services",34,3,12/31/24,"936,657,472",12/31/24,"3,566,324,000","-326,962,000","-1,060,864,000","3,106,517,000"
44469,"Other intangible assets","Interim and Annual Indefinite-Lived Intangible Asset Impairment Assessments",556199,12/31/24,03/07/25,1,"PricewaterhouseCoopers LLP",,,,Irvine,CA,CALIFORNIA,"US West",10-K,2025-03-07,,"Advantage Solutions Inc.",1776661,"=""ADV""","C/O ADVANTAGE SOLUTIONS, INC.","7676 FORSYTH BOULEVARD, 5TH FLOOR","ST. LOUIS",MO,MISSOURI,"US Southeast",,,"=""7389""","Business Services, NEC",541611,"Administrative Management and General Management Consulting Services",34,3,12/31/24,"936,657,472",12/31/24,"3,566,324,000","-326,962,000","-1,060,864,000","3,106,517,000"
46666,"Research and development expenses","Accrued research and development expenses – clinical trials",561426,12/31/24,04/15/25,2,"Ernst & Young LLP",,,,"San Francisco",CA,CALIFORNIA,"US West",10-K,2025-04-15,Yes,"Adverum Biotechnologies, Inc.",1501756,"=""ADVM""","100 CARDINAL WAY",,"REDWOOD CITY",CA,CALIFORNIA,"US West",,,"=""2836""","Biological Products, Except Diagnostic Substances",325414,"Biological Product (except Diagnostic) Manufacturing",34,5,12/31/24,"97,360,160",12/31/24,"1,000,000","-130,927,000",,"179,841,000"
46667,Leases,"Accounting for North Carolina leases",561426,12/31/24,04/15/25,2,"Ernst & Young LLP",,,,"San Francisco",CA,CALIFORNIA,"US West",10-K,2025-04-15,Yes,"Adverum Biotechnologies, Inc.",1501756,"=""ADVM""","100 CARDINAL WAY",,"REDWOOD CITY",CA,CALIFORNIA,"US West",,,"=""2836""","Biological Products, Except Diagnostic Substances",325414,"Biological Product (except Diagnostic) Manufacturing",34,5,12/31/24,"97,360,160",12/31/24,"1,000,000","-130,927,000",,"179,841,000"
40023,"Revenue from customer contracts","Revenue Recognition - Contract cost and claim recovery estimates",544182,09/30/24,11/19/24,2,"Ernst & Young LLP",,,,"Los Angeles",CA,CALIFORNIA,"US West",10-K,2024-11-19,,AECOM,868857,"=""ACM""","13355 NOEL ROAD","SUITE 400",DALLAS,TX,TEXAS,"US Southwest",,,"=""8711""","Engineering Services",541611,"Administrative Management and General Management Consulting Services",34,102,10/02/24,"13,670,786,048",09/30/24,"16,105,498,000","402,266,000","-1,302,882,000","12,061,669,000"
45753,"Insurance contract liabilities","Valuation of insurance contract liabilities and investment contract liabilities with discretionary participating features",559255,12/31/24,03/26/25,2,"Ernst & Young LLP",899,"EY Accountants BV",1396,"The Hague",P7,NETHERLANDS,Foreign,20-F,2025-03-27,,"AEGON LTD.",769218,"=""AEG""","WORLD TRADE CENTER SCHIPHOL","SCHIPHOL BOULEVARD 223",SCHIPHOL,P7,NETHERLANDS,Foreign,,,"=""6311""","Life Insurance",524113,"Direct Life Insurance Carriers",34,6,01/02/25,"10,688,741,376",12/31/24,"26,737,000,000","-1,763,000,000","8,918,000,000","339,015,000,000"
41149,"Regulatory assets and liabilities","Accounting for the Effects of Cost-Based Regulation",551149,12/31/24,02/13/25,1,"PricewaterhouseCoopers LLP",,,,Columbus,OH,OHIO,"US Midwest",10-K,2025-02-13,,"AEP Texas Inc.",1721781,,"1 RIVERSIDE PLAZA",,COLUMBUS,OH,OHIO,"US Midwest",4904,"AMERICAN ELECTRIC POWER CO INC","=""4911""","Electric Services",221122,"Electric Power Distribution",34,,,,12/31/24,"2,079,900,000","420,100,000",,"15,199,600,000"
41371,"Regulatory assets and liabilities","Accounting for the Effects of Cost-Based Regulation",551117,12/31/24,02/13/25,1,"PricewaterhouseCoopers LLP",,,,Columbus,OH,OHIO,"US Midwest",10-K,2025-02-13,,"AEP Transmission Company, LLC",1702494,,"1 RIVERSIDE PLAZA",,COLUMBUS,OH,OHIO,"US Midwest",4904,"AMERICAN ELECTRIC POWER CO INC","=""4911""","Electric Services",221121,"Electric Bulk Power Transmission and Control",34,,,,12/31/24,"1,890,900,000","688,400,000",,"16,370,300,000"
42967,Leases,"Assessment of impairment of flight equipment held for operating leases subject to impairment",553539,12/31/24,02/26/25,4,"KPMG LLP",71,KPMG,1116,Dublin,L2,IRELAND,Foreign,20-F,2025-02-26,,"AerCap Holdings N.V.",1378789,"=""AER""","AERCAP HOUSE","65 ST. STEPHEN'S GREEN",DUBLIN,L2,IRELAND,Foreign,,,"=""7359""","Equipment Rental and Leasing, NEC",532411,"Commercial Air, Rail, and Water Transportation Equipment Rental and Leasing",34,96,12/31/24,"17,875,154,944",12/31/24,"7,003,997,000","2,098,632,000","17,044,957,000","71,441,976,000"
38739,Goodwill,"Goodwill — Refer to Note 1 and Note 6 to the financial statements",538071,04/30/24,06/26/24,3,"Deloitte & Touche LLP",,,,"Los Angeles",CA,CALIFORNIA,"US West",10-K,2024-06-27,,"AeroVironment Inc",1368622,"=""AVAV""","241 18TH STREET SOUTH, SUITE 650",,ARLINGTON,VA,VIRGINIA,"US Mid Atlantic",,,"=""3721""",Aircraft,336411,"Aircraft Manufacturing",34,166,05/02/24,"4,662,653,952",04/30/24,"716,720,000","59,666,000","474,869,000","1,015,860,000"
38740,"Business combinations","Business Acquisitions — Refer to Note 1 and Note 21 to the financial statements",538071,04/30/24,06/26/24,3,"Deloitte & Touche LLP",,,,"Los Angeles",CA,CALIFORNIA,"US West",10-K,2024-06-27,,"AeroVironment Inc",1368622,"=""AVAV""","241 18TH STREET SOUTH, SUITE 650",,ARLINGTON,VA,VIRGINIA,"US Mid Atlantic",,,"=""3721""",Aircraft,336411,"Aircraft Manufacturing",34,166,05/02/24,"4,662,653,952",04/30/24,"716,720,000","59,666,000","474,869,000","1,015,860,000"
44643,"Shareholder valuation","Allocation of Earnings to Noncontrolling Interests in Tax Equity Partnerships",556955,12/31/24,03/10/25,2,"Ernst & Young LLP",,,,Tysons,VA,VIRGINIA,"US Mid Atlantic",10-K,2025-03-11,,"AES CORP",874761,"=""AES""","4300 WILSON BOULEVARD",,ARLINGTON,VA,VIRGINIA,"US Mid Atlantic",,,"=""4991""","Cogeneration Services & Small Power Producers",221122,"Electric Power Distribution",34,13,01/02/25,"9,278,903,296",12/31/24,"12,278,000,000","1,679,000,000","2,290,000,000","47,406,000,000"
44644,"Business combinations","Accounting for the Madison and Birdseye Acquisition",556955,12/31/24,03/10/25,2,"Ernst & Young LLP",,,,Tysons,VA,VIRGINIA,"US Mid Atlantic",10-K,2025-03-11,,"AES CORP",874761,"=""AES""","4300 WILSON BOULEVARD",,ARLINGTON,VA,VIRGINIA,"US Mid Atlantic",,,"=""4991""","Cogeneration Services & Small Power Producers",221122,"Electric Power Distribution",34,13,01/02/25,"9,278,903,296",12/31/24,"12,278,000,000","1,679,000,000","2,290,000,000","47,406,000,000"
45441,"Other debt","Warrant Liability – Series A Warrants – Refer to Notes 1, 3, 10, and 11 to the financial statements",558320,12/31/24,03/20/25,3,"Deloitte & Touche LLP",,,,"San Jose",CA,CALIFORNIA,"US West",10-K,2025-03-21,,"Aeva Technologies, Inc.",1789029,"=""AEVA""","555 ELLIS STREET",,"MOUNTAIN VIEW",CA,CALIFORNIA,"US West",,,"=""3714""","Motor Vehicle Parts and Accessories",334413,"Semiconductor and Related Device Manufacturing",34,5,01/02/25,"269,952,832",12/31/24,"9,065,000","-152,261,000","97,627,000","147,489,000"
41554,"Equity investments and joint ventures","Impairment Assessment for an Equity Method Investment in an Affiliate",551323,12/31/24,02/14/25,1,"PricewaterhouseCoopers LLP",,,,Boston,MA,MASSACHUSETTS,"US New England",10-K,2025-02-14,,"AFFILIATED MANAGERS GROUP, INC.",1004434,"=""AMG""","777 SOUTH FLAGLER DRIVE","SUITE 1401 EAST TOWER","WEST PALM BEACH",FL,FLORIDA,"US Southeast",,,"=""6282""","Investment Advice",523930,"Investment Advice",34,187,01/02/25,"5,649,077,248",12/31/24,"1,907,600,000","511,600,000","-586,900,000","8,830,900,000"
39336,"Allowance for credit losses","Allowance for Credit Losses — Refer to Notes 2 and 4 to the financial statements",540468,06/30/24,08/28/24,3,"Deloitte & Touche LLP",,,,"San Francisco",CA,CALIFORNIA,"US West",10-K,2024-08-28,,"Affirm Holdings, Inc.",1820953,"=""AFRM""","650 CALIFORNIA STREET",,"SAN FRANCISCO",CA,CALIFORNIA,"US West",,,"=""6141""","Personal Credit Institutions",522320,"Financial Transactions Processing, Reserve, and Clearinghouse Activities",34,30,06/30/24,"8,075,297,792",06/30/24,"1,118,644,000","-517,757,000","2,185,048,000","9,519,619,000"
43107,"Other investments","Fair value of certain privately issued securities",553725,12/31/24,02/26/25,4,"KPMG LLP",,,,Atlanta,GA,GEORGIA,"US Southeast",10-K,2025-02-26,,"AFLAC INC",4977,"=""AFL""","1932 WYNNTON RD",,COLUMBUS,GA,GEORGIA,"US Southeast",,,"=""6321""","Accident and Health Insurance",524114,"Direct Health and Medical Insurance Carriers",34,102,01/02/25,"56,863,887,360",12/31/24,"18,927,000,000","5,443,000,000",,"117,566,000,000"
43108,"Insurance contract liabilities","Valuation of the liability for future policy benefits",553725,12/31/24,02/26/25,4,"KPMG LLP",,,,Atlanta,GA,GEORGIA,"US Southeast",10-K,2025-02-26,,"AFLAC INC",4977,"=""AFL""","1932 WYNNTON RD",,COLUMBUS,GA,GEORGIA,"US Southeast",,,"=""6321""","Accident and Health Insurance",524114,"Direct Health and Medical Insurance Carriers",34,102,01/02/25,"56,863,887,360",12/31/24,"18,927,000,000","5,443,000,000",,"117,566,000,000"
44855,"Business combinations","Accounting for Business combination",557444,12/31/24,03/13/25,2,"Ernst & Young LLP",34,"Ernst & Young Auditores Independentes SS",1448,"Belo Horizonte",D5,BRAZIL,Foreign,6-K,2025-03-13,,"Afya Ltd",1771007,"=""AFYA""","ALAMEDA OSCAR NIEMEYER, NO. 119","15TH FLOOR, VILA DA SERRA","NOVA LIMA, MINAS GERAIS",D5,BRAZIL,Foreign,,,"=""8200""","Services-Educational Services",611710,"Educational Support Services",34,16,12/31/24,"737,856,768",12/31/24,"534,867,000","105,040,000","-204,414,000","1,429,225,000"
47129,"Business combinations","Accounting for Business combination",563168,12/31/24,03/13/25,2,"Ernst & Young LLP",34,"Ernst & Young Auditores Independentes SS",1448,"Belo Horizonte",D5,BRAZIL,Foreign,20-F,2025-04-29,,"Afya Ltd",1771007,"=""AFYA""","ALAMEDA OSCAR NIEMEYER, NO. 119","15TH FLOOR, VILA DA SERRA","NOVA LIMA, MINAS GERAIS",D5,BRAZIL,Foreign,,,"=""8200""","Services-Educational Services",611710,"Educational Support Services",34,16,12/31/24,"737,856,768",12/31/24,"534,867,000","105,040,000","-204,414,000","1,429,225,000"
44185,"Other investments","Fair value measurements – financial instruments valued using significant unobservable inputs — Refer to Note 5 to the financial statements",555244,12/31/24,03/04/25,3,"Deloitte & Touche LLP",,,,"New York",NY,"NEW YORK","US Mid Atlantic",10-K,2025-03-04,,"AG Mortgage Investment Trust, Inc.",1514281,"=""MITN""","245 PARK AVENUE","26TH FLOOR","NEW YORK",NY,"NEW YORK","US Mid Atlantic",,,"=""6798""","Real Estate Investment Trusts",525990,"Other Financial Vehicles",34,25,01/02/25,"745,169,664",12/31/24,"75,322,000","55,737,000",,"6,913,609,000"
42468,"Sales return and allowances","Assessment of the reserve and allowance for volume discount and sales incentive programs in certain geographic regions",552874,12/31/24,02/24/25,4,"KPMG LLP",,,,Atlanta,GA,GEORGIA,"US Southeast",10-K,2025-02-24,,"AGCO CORP /DE",880266,"=""AGCO""","4205 RIVER GREEN PKWAY",,DULUTH,GA,GEORGIA,"US Southeast",,,"=""3523""","Farm Machinery and Equipment",333111,"Farm Machinery and Equipment Manufacturing",34,91,01/02/25,"6,815,860,736",12/31/24,"11,661,900,000","-424,800,000","1,493,600,000","11,190,600,000"
42469,"Uncertain tax positions","Assessment of gross unrecognized income tax benefits in certain jurisdictions",552874,12/31/24,02/24/25,4,"KPMG LLP",,,,Atlanta,GA,GEORGIA,"US Southeast",10-K,2025-02-24,,"AGCO CORP /DE",880266,"=""AGCO""","4205 RIVER GREEN PKWAY",,DULUTH,GA,GEORGIA,"US Southeast",,,"=""3523""","Farm Machinery and Equipment",333111,"Farm Machinery and Equipment Manufacturing",34,91,01/02/25,"6,815,860,736",12/31/24,"11,661,900,000","-424,800,000","1,493,600,000","11,190,600,000"
42470,Goodwill,"Assessment of goodwill impairment for a certain reporting unit",552874,12/31/24,02/24/25,4,"KPMG LLP",,,,Atlanta,GA,GEORGIA,"US Southeast",10-K,2025-02-24,,"AGCO CORP /DE",880266,"=""AGCO""","4205 RIVER GREEN PKWAY",,DULUTH,GA,GEORGIA,"US Southeast",,,"=""3523""","Farm Machinery and Equipment",333111,"Farm Machinery and Equipment Manufacturing",34,91,01/02/25,"6,815,860,736",12/31/24,"11,661,900,000","-424,800,000","1,493,600,000","11,190,600,000"
45118,"Other liabilities and provisions","Accounting for the Purchase and Sale Agreement with Ligand Pharmaceuticals Incorporated",557710,12/31/24,03/17/25,4,"KPMG LLP",,,,Boston,MA,MASSACHUSETTS,"US New England",10-K,2025-03-17,Yes,"AGENUS INC",1098972,"=""AGEN""","3 FORBES ROAD",,LEXINGTON,MA,MASSACHUSETTS,"US New England",,,"=""2836""","Biological Products, Except Diagnostic Substances",325414,"Biological Product (except Diagnostic) Manufacturing",34,3,12/31/24,"64,758,996",12/31/24,"103,463,000","-227,212,000","-353,848,000","226,271,000"
40348,"Business combinations","Acquisition of BIOVECTRA – Valuation of Certain Customer Relationships",545680,10/31/24,12/19/24,1,"PricewaterhouseCoopers LLP",,,,"San Jose",CA,CALIFORNIA,"US West",10-K,2024-12-20,,"AGILENT TECHNOLOGIES, INC.",1090872,"=""A""","5301 STEVENS CREEK BLVD",,"SANTA CLARA",CA,CALIFORNIA,"US West",,,"=""3826""","Laboratory Analytical Instruments",334515,"Instrument Manufacturing for Measuring and Testing Electricity and Electrical Signals",34,131,10/29/24,"37,706,010,624",10/31/24,"6,510,000,000","1,289,000,000","874,000,000","11,846,000,000"
44153,"Business combinations","Acquisition of BIOVECTRA – Valuation of Certain Customer Relationships",555167,10/31/24,12/19/24,1,"PricewaterhouseCoopers LLP",,,,"San Jose",CA,CALIFORNIA,"US West",8-K,2025-03-03,,"AGILENT TECHNOLOGIES, INC.",1090872,"=""A""","5301 STEVENS CREEK BLVD",,"SANTA CLARA",CA,CALIFORNIA,"US West",,,"=""3826""","Laboratory Analytical Instruments",334515,"Instrument Manufacturing for Measuring and Testing Electricity and Electrical Signals",34,131,10/29/24,"37,706,010,624",10/31/24,"6,510,000,000","1,289,000,000","874,000,000","11,846,000,000"
42826,"Insurance contract liabilities","Valuation of incurred but not reported claims",553246,12/31/24,02/25/25,2,"Ernst & Young LLP",,,,"Los Angeles",CA,CALIFORNIA,"US West",10-K,2025-02-25,,"agilon health, inc.",1831097,"=""AGL""","440 POLARIS PARKWAY","SUITE 550",WESTERVILLE,OH,OHIO,"US Midwest",,,"=""8090""","Services-Misc Health & Allied Services, NEC",541511,"Custom Computer Programming Services",34,2,12/31/24,"783,168,576",12/31/24,"6,060,530,000","-260,151,000","374,048,000","1,733,983,000"
41115,"Revenue from customer contracts","Revenue Recognition - PYRUKYND® Product Revenue",551082,12/31/24,02/13/25,1,"PricewaterhouseCoopers LLP",,,,Boston,MA,MASSACHUSETTS,"US New England",10-K,2025-02-13,,"AGIOS PHARMACEUTICALS, INC.",1439222,"=""AGIO""","88 SIDNEY STREET",,CAMBRIDGE,MA,MASSACHUSETTS,"US New England",,,"=""2834""","Pharmaceutical Preparations",325412,"Pharmaceutical Preparation Manufacturing",34,33,12/31/24,"1,878,155,520",12/31/24,"36,498,000","673,725,000",,"1,663,199,000"
42215,"Depreciation and amortization","Agency securities and non-agency securities of high credit quality net premium amortization",552393,12/31/24,02/21/25,2,"Ernst & Young LLP",,,,Tysons,VA,VIRGINIA,"US Mid Atlantic",10-K,2025-02-21,,"AGNC Investment Corp.",1423689,"=""AGNC""","7373 WISCONSIN AVENUE, 22ND FLOOR",,BETHESDA,MD,MARYLAND,"US Mid Atlantic",,,"=""6798""","Real Estate Investment Trusts",525990,"Other Financial Vehicles",34,9,01/02/25,"8,218,737,664",12/31/24,"973,000,000","863,000,000","9,236,000,000","88,015,000,000"
41342,Goodwill,"Impairment assessment for Goodwill",551317,12/31/24,02/13/25,2,"Ernst & Young LLP",192,"Ernst & Young LLP Chartered Accountants",1263,Toronto,A6,ONTARIO,Canada,6-K,2025-02-13,,"AGNICO EAGLE MINES LTD",2809,"=""AEM""","145 KING STREET EAST","SUITE 400",TORONTO,A6,ONTARIO,Canada,,,"=""1040""","Metal Mining",212221,"Gold Ore Mining",34,78,12/31/24,"39,240,265,728",12/31/24,"8,285,753,000","1,895,581,000","16,675,228,000","29,987,018,000"
43497,Goodwill,"Impairment assessment for Goodwill",554155,12/31/24,02/13/25,2,"Ernst & Young LLP",192,"Ernst & Young LLP Chartered Accountants",1263,Toronto,A6,ONTARIO,Canada,40-F,2025-02-27,,"AGNICO EAGLE MINES LTD",2809,"=""AEM""","145 KING STREET EAST","SUITE 400",TORONTO,A6,ONTARIO,Canada,,,"=""1040""","Metal Mining",212221,"Gold Ore Mining",34,78,12/31/24,"39,240,265,728",12/31/24,"8,285,753,000","1,895,581,000","16,675,228,000","29,987,018,000"
46715,"Allowance for credit losses","Valuation of allowance for current expected credit losses – accounts receivable, net",561568,12/31/24,04/15/25,1,"PricewaterhouseCoopers LLP",94,"PricewaterhouseCoopers Zhong Tian LLP",1424,Shanghai,F4,CHINA,Foreign,20-F,2025-04-15,,"Agora, Inc.",1802883,"=""API""","2804 MISSION COLLEGE BLVD,",,"SANTA CLARA",CA,CALIFORNIA,"US West",,,"=""7372""","Prepackaged Software",518210,"Data Processing, Hosting, and Related Services",34,4,12/31/24,"309,004,864",12/31/24,"133,256,000","-42,727,000","410,655,000","699,654,000"
41083,Leases,"Assessment of the carrying value of flight equipment subject to operating leases",551087,12/31/24,02/13/25,4,"KPMG LLP",,,,Irvine,CA,CALIFORNIA,"US West",10-K,2025-02-13,,"AIR LEASE CORP",1487712,"=""AL""","2000 AVENUE OF THE STARS","SUITE 1000N","LOS ANGELES",CA,CALIFORNIA,"US West",,,"=""7359""","Equipment Rental and Leasing, NEC",532411,"Commercial Air, Rail, and Water Transportation Equipment Rental and Leasing",34,48,12/31/24,"5,369,479,680",12/31/24,"2,733,657,000","427,704,000",,"32,277,896,000"
40061,"Revenue from customer contracts","Revenue Recognition – On-site Customer Contracts – Refer to Notes 1 and 7 to the Financial Statements",544302,09/30/24,11/21/24,3,"Deloitte & Touche LLP",,,,Philadelphia,PA,PENNSYLVANIA,"US Mid Atlantic",10-K,2024-11-21,,"Air Products & Chemicals, Inc.",2969,"=""APD""","1940 AIR PRODUCTS BLVD.",,ALLENTOWN,PA,PENNSYLVANIA,"US Mid Atlantic",,,"=""2810""","Industrial Inorganic Chemicals",325120,"Industrial Gas Manufacturing",34,290,10/02/24,"64,471,203,840",09/30/24,"12,100,600,000","3,828,200,000","15,819,800,000","39,574,600,000"
38715,"Other investments","Redeemable non-controlling interest – valuation of Contrail Aviation Support, LLC — Refer to Notes 1 and 4 to the financial statements",538004,03/31/24,06/26/24,3,"Deloitte & Touche LLP",,,,Minneapolis,MN,MINNESOTA,"US Midwest",10-K,2024-06-26,,"AIR T INC",353184,"=""AIRT""","11020 DAVID TAYLOR DRIVE","SUITE 305",CHARLOTTE,NC,"NORTH CAROLINA","US Southeast",,,"=""4513""","Air Courier Services",492110,Couriers,34,22,04/02/24,"62,298,808",03/31/24,"286,834,000","-6,819,000","-3,772,000","177,167,000"
38827,"Other investments","Redeemable non-controlling interest - valuation of Contrail Aviation Support, LLC - Refer to Notes 1 and 4 to the financial statements",538642,03/31/24,06/26/24,3,"Deloitte & Touche LLP",,,,Minneapolis,MN,MINNESOTA,"US Midwest",ARS,2024-07-10,,"AIR T INC",353184,"=""AIRT""","11020 DAVID TAYLOR DRIVE","SUITE 305",CHARLOTTE,NC,"NORTH CAROLINA","US Southeast",,,"=""4513""","Air Courier Services",492110,Couriers,34,22,04/02/24,"62,298,808",03/31/24,"286,834,000","-6,819,000","-3,772,000","177,167,000"
44106,"Other debt","Stock Warrant Obligations - Fair Value Measurements - Level 3 Liabilities - Refer to Note D to the Financial Statements",555082,12/31/24,03/03/25,3,"Deloitte & Touche LLP",,,,Cincinnati,OH,OHIO,"US Midwest",10-K,2025-03-03,,"Air Transport Services Group, Inc.",894081,"=""ATSG""","145 HUNTER DR",,WILMINGTON,OH,OHIO,"US Midwest",,,"=""4513""","Air Courier Services",492110,Couriers,34,22,12/31/24,"1,448,219,264",12/31/24,"1,961,971,000","27,434,000","1,016,688,000","3,893,711,000"
41099,"Uncertain tax positions","Uncertain Tax Positions",551099,12/31/24,02/13/25,1,"PricewaterhouseCoopers LLP",,,,"San Francisco",CA,CALIFORNIA,"US West",10-K,2025-02-13,,"Airbnb, Inc.",1559720,"=""ABNB""","888 BRANNAN ST.",,"SAN FRANCISCO",CA,CALIFORNIA,"US West",,,"=""7340""","Services-To Dwellings & Other Buildings",511210,"Software Publishers",34,131,12/31/24,"57,031,938,048",12/31/24,"11,102,000,000","2,648,000,000","7,635,000,000","20,959,000,000"
37895,Leases,"Recoverability assessment and Impairment of flight equipment held for lease",534337,02/29/24,04/25/24,2,"Ernst & Young LLP",,,,Stamford,CT,CONNECTICUT,"US New England",10-K,2024-04-25,,"Aircastle LTD",1362988,"=""AYR""","C/O AIRCASTLE ADVISOR LLC","201 TRESSER BLVD, SUITE 400",STAMFORD,CT,CONNECTICUT,"US New England",,,"=""7359""","Equipment Rental and Leasing, NEC",532411,"Commercial Air, Rail, and Water Transportation Equipment Rental and Leasing",34,,,,02/29/24,"855,416,000","83,316,000",,"7,679,953,000"
37896,"Other income taxes","Accounting for Income Tax",534337,02/29/24,04/25/24,2,"Ernst & Young LLP",,,,Stamford,CT,CONNECTICUT,"US New England",10-K,2024-04-25,,"Aircastle LTD",1362988,"=""AYR""","C/O AIRCASTLE ADVISOR LLC","201 TRESSER BLVD, SUITE 400",STAMFORD,CT,CONNECTICUT,"US New England",,,"=""7359""","Equipment Rental and Leasing, NEC",532411,"Commercial Air, Rail, and Water Transportation Equipment Rental and Leasing",34,,,,02/29/24,"855,416,000","83,316,000",,"7,679,953,000"
42475,"Revenue from customer contracts","Revenue Recognition",552884,12/31/24,02/24/25,1,"PricewaterhouseCoopers LLP",,,,Boston,MA,MASSACHUSETTS,"US New England",10-K,2025-02-24,,"AKAMAI TECHNOLOGIES INC",1086222,"=""AKAM""","145 BROADWAY",,CAMBRIDGE,MA,MASSACHUSETTS,"US New England",,,"=""7389""","Business Services, NEC",334119,"Other Computer Peripheral Equipment Manufacturing",34,95,01/02/25,"14,334,658,560",12/31/24,"3,991,168,000","504,918,000","999,695,000","10,368,785,000"
42476,"Business combinations","Acquisition of Noname Gate Ltd. – Valuation of Completed Technologies",552884,12/31/24,02/24/25,1,"PricewaterhouseCoopers LLP",,,,Boston,MA,MASSACHUSETTS,"US New England",10-K,2025-02-24,,"AKAMAI TECHNOLOGIES INC",1086222,"=""AKAM""","145 BROADWAY",,CAMBRIDGE,MA,MASSACHUSETTS,"US New England",,,"=""7389""","Business Services, NEC",334119,"Other Computer Peripheral Equipment Manufacturing",34,95,01/02/25,"14,334,658,560",12/31/24,"3,991,168,000","504,918,000","999,695,000","10,368,785,000"
44883,"Other liabilities and provisions","Valuation of Excess Firm Purchase Commitment Liability",557282,12/31/24,03/13/25,2,"Ernst & Young LLP",,,,Boston,MA,MASSACHUSETTS,"US New England",10-K,2025-03-13,,"Akebia Therapeutics, Inc.",1517022,"=""AKBA""","245 FIRST STREET",,CAMBRIDGE,MA,MASSACHUSETTS,"US New England",,,"=""2834""","Pharmaceutical Preparations",325412,"Pharmaceutical Preparation Manufacturing",34,2,01/02/25,"414,544,288",12/31/24,"160,180,000","-69,410,000","-108,229,000","220,670,000"
43758,"Research and development expenses","Research and development expenses related to contract research organizations and contract manufacturing organizations — Refer to Note 2 to the financial statements",554537,12/31/24,02/27/25,3,"Deloitte & Touche LLP",,,,Morristown,NJ,"NEW JERSEY","US Mid Atlantic",10-K,2025-02-28,,"Akero Therapeutics, Inc.",1744659,"=""AKRO""","601 GATEWAY BOULEVARD, SUITE 350",,"SOUTH SAN FRANCISCO",CA,CALIFORNIA,"US West",,,"=""2834""","Pharmaceutical Preparations",325412,"Pharmaceutical Preparation Manufacturing",34,28,12/31/24,"2,013,695,360",12/31/24,,"-252,060,000",,"825,886,000"
42093,"Regulatory assets and liabilities","Impact of Rate Regulation on the Financial Statements – Refer to Note 1 (Summary of Significant Accounting Policies – Regulatory Assets and Liabilities) and Note 2 (Regulatory Matters – Georgia Power) to the financial statements",552243,12/31/24,02/19/25,3,"Deloitte & Touche LLP",,,,Birmingham,AL,ALABAMA,"US Southeast",10-K,2025-02-20,,"ALABAMA POWER CO",3153,,"600 N 18TH ST","P O BOX 2641",BIRMINGHAM,AL,ALABAMA,"US Southeast",92122,"SOUTHERN CO","=""4911""","Electric Services",221122,"Electric Power Distribution",34,,,,12/31/24,"7,554,000,000","1,403,000,000",,"36,538,000,000"
43493,Inventory,"Sufficiency of evidence over the existence of inventory",554177,12/31/24,02/27/25,4,"KPMG LLP",,,,"New Orleans",LA,LOUISIANA,"US Southeast",10-K,2025-02-27,,"ALAMO GROUP INC",897077,"=""ALG""","1627 E WALNUT",,SEGUIN,TX,TEXAS,"US Southwest",,,"=""3523""","Farm Machinery and Equipment",333111,"Farm Machinery and Equipment Manufacturing",34,186,12/31/24,"2,234,137,856",12/31/24,"1,628,513,000","115,930,000","663,867,000","1,450,279,000"
44819,Inventory,"Sufficiency of evidence over the existence of inventory",557371,12/31/24,02/27/25,4,"KPMG LLP",,,,"New Orleans",LA,LOUISIANA,"US Southeast",ARS,2025-03-13,,"ALAMO GROUP INC",897077,"=""ALG""","1627 E WALNUT",,SEGUIN,TX,TEXAS,"US Southwest",,,"=""3523""","Farm Machinery and Equipment",333111,"Farm Machinery and Equipment Manufacturing",34,186,12/31/24,"2,234,137,856",12/31/24,"1,628,513,000","115,930,000","663,867,000","1,450,279,000"
41867,"Property, plant and equipment","Evaluation of the recoverable amount of the Young-Davidson cash generating unit",552032,12/31/24,02/19/25,4,"KPMG LLP",187,"KPMG LLP Chartered Accountants",85,Toronto,A6,ONTARIO,Canada,6-K,2025-02-19,,"ALAMOS GOLD INC",1178819,"=""AGI""","181 BAY STREET","SUITE 3910",TORONTO,A6,ONTARIO,Canada,,,"=""1040""","Metal Mining",212221,"Gold Ore Mining",34,18,12/31/24,"7,751,531,520",12/31/24,"1,346,900,000","284,300,000",,"5,336,100,000"
41868,"Business combinations","Acquisition of Argonaut Gold Inc. - valuation of mineral properties",552032,12/31/24,02/19/25,4,"KPMG LLP",187,"KPMG LLP Chartered Accountants",85,Toronto,A6,ONTARIO,Canada,6-K,2025-02-19,,"ALAMOS GOLD INC",1178819,"=""AGI""","181 BAY STREET","SUITE 3910",TORONTO,A6,ONTARIO,Canada,,,"=""1040""","Metal Mining",212221,"Gold Ore Mining",34,18,12/31/24,"7,751,531,520",12/31/24,"1,346,900,000","284,300,000",,"5,336,100,000"
45976,"Property, plant and equipment","Evaluation of the recoverable amount of the Young-Davidson cash generating unit",559695,12/31/24,02/19/25,4,"KPMG LLP",187,"KPMG LLP Chartered Accountants",85,Toronto,A6,ONTARIO,Canada,40-F,2025-03-31,,"ALAMOS GOLD INC",1178819,"=""AGI""","181 BAY STREET","SUITE 3910",TORONTO,A6,ONTARIO,Canada,,,"=""1040""","Metal Mining",212221,"Gold Ore Mining",34,18,12/31/24,"7,751,531,520",12/31/24,"1,346,900,000","284,300,000",,"5,336,100,000"
45977,"Business combinations","Acquisition of Argonaut Gold Inc. - valuation of mineral properties",559695,12/31/24,02/19/25,4,"KPMG LLP",187,"KPMG LLP Chartered Accountants",85,Toronto,A6,ONTARIO,Canada,40-F,2025-03-31,,"ALAMOS GOLD INC",1178819,"=""AGI""","181 BAY STREET","SUITE 3910",TORONTO,A6,ONTARIO,Canada,,,"=""1040""","Metal Mining",212221,"Gold Ore Mining",34,18,12/31/24,"7,751,531,520",12/31/24,"1,346,900,000","284,300,000",,"5,336,100,000"
41977,"Revenue from customer contracts","Revenue recognition",552144,12/31/24,02/20/25,1,"PricewaterhouseCoopers LLP",,,,Washington,DC,"DISTRICT OF COLUMBIA","US Mid Atlantic",10-K,2025-02-20,,"Alarm.com Holdings, Inc.",1459200,"=""ALRM""","8281 GREENSBORO DRIVE","SUITE 100",TYSONS,VA,VIRGINIA,"US Mid Atlantic",,,"=""7372""","Prepackaged Software",541511,"Custom Computer Programming Services",34,61,12/31/24,"3,016,795,392",12/31/24,"939,827,000","124,116,000","553,923,000","2,038,208,000"
41547,"Business combinations","Fair value of trademark acquired in a business combination",551481,12/31/24,02/14/25,4,"KPMG LLP",,,,Seattle,WA,WASHINGTON,"US West",10-K,2025-02-14,,"ALASKA AIR GROUP, INC.",766421,"=""ALK""","19300 INTERNATIONAL BOULEVARD",,SEATTLE,WA,WASHINGTON,"US West",,,"=""4512""","Air Transportation, Scheduled",481111,"Scheduled Passenger Air Transportation",34,64,01/02/25,"8,162,534,912",12/31/24,"11,735,000,000","395,000,000","775,000,000","19,768,000,000"
41548,"Revenue from customer contracts","Assessment of Mileage Plan model",551481,12/31/24,02/14/25,4,"KPMG LLP",,,,Seattle,WA,WASHINGTON,"US West",10-K,2025-02-14,,"ALASKA AIR GROUP, INC.",766421,"=""ALK""","19300 INTERNATIONAL BOULEVARD",,SEATTLE,WA,WASHINGTON,"US West",,,"=""4512""","Air Transportation, Scheduled",481111,"Scheduled Passenger Air Transportation",34,64,01/02/25,"8,162,534,912",12/31/24,"11,735,000,000","395,000,000","775,000,000","19,768,000,000"
43131,"Revenue from customer contracts","Evaluation of estimated total contract costs at completion for Albany Engineered Composites revenue recognition for certain firm-fixed-price contracts",553697,12/31/24,02/26/25,4,"KPMG LLP",,,,Albany,NY,"NEW YORK","US Mid Atlantic",10-K,2025-02-26,,"ALBANY INTERNATIONAL CORP /DE/",819793,"=""AIN""","216 AIRPORT DRIVE",,ROCHESTER,NH,"NEW HAMPSHIRE","US New England",,,"=""2221""","Broadwoven Fabric Mills, Manmade Fiber and Silk",313210,"Broadwoven Fabric Mills",34,80,12/31/24,"2,484,891,136",12/31/24,"1,230,615,000","87,623,000","729,150,000","1,648,696,000"
40937,Goodwill,"Interim and Annual Goodwill Impairment Assessments – Energy Storage Reporting Unit",550829,12/31/24,02/12/25,1,"PricewaterhouseCoopers LLP",,,,Charlotte,NC,"NORTH CAROLINA","US Southeast",10-K,2025-02-12,,"ALBEMARLE CORP",915913,"=""ALB""","4250 CONGRESS STREET","SUITE 900",CHARLOTTE,NC,"NORTH CAROLINA","US Southeast",,,"=""2821""","Plastics Material and Synthetic Resins, and Nonvulcanizable Elastomers",325211,"Plastics Material and Resin Manufacturing",34,86,12/31/24,"10,119,545,856",12/31/24,"1,220,121,000","439,673,000","1,032,437,000","2,726,056,000"
40938,Goodwill,"Annual Goodwill Impairment Assessment – Refining Solutions Reporting Unit",550829,12/31/24,02/12/25,1,"PricewaterhouseCoopers LLP",,,,Charlotte,NC,"NORTH CAROLINA","US Southeast",10-K,2025-02-12,,"ALBEMARLE CORP",915913,"=""ALB""","4250 CONGRESS STREET","SUITE 900",CHARLOTTE,NC,"NORTH CAROLINA","US Southeast",,,"=""2821""","Plastics Material and Synthetic Resins, and Nonvulcanizable Elastomers",325211,"Plastics Material and Resin Manufacturing",34,86,12/31/24,"10,119,545,856",12/31/24,"1,220,121,000","439,673,000","1,032,437,000","2,726,056,000"
37763,"Other contingent liabilities","Self-Insurance Liabilities—Refer to Note 1 to the financial statements",533990,02/24/24,04/22/24,3,"Deloitte & Touche LLP",,,,Boise,ID,IDAHO,"US West",10-K,2024-04-22,,"Albertsons Companies, Inc.",1646972,"=""ACI""","250 PARKCENTER BLVD.",,BOISE,ID,IDAHO,"US West",,,"=""5411""","Grocery Stores",445110,"Supermarkets and Other Grocery (except Convenience) Stores",34,22,02/26/24,"12,425,180,160",02/24/24,"79,237,700,000","1,296,000,000","-888,000,000","26,221,100,000"
41934,"Asset retirement and environmental obligations","Asset Retirement Obligations – Mine Reclamation and Closure of Bauxite Residue Areas",552103,12/31/24,02/20/25,1,"PricewaterhouseCoopers LLP",,,,Pittsburgh,PA,PENNSYLVANIA,"US Mid Atlantic",10-K,2025-02-20,,"Alcoa Corp",1675149,"=""AA""","201 ISABELLA STREET","SUITE 500",PITTSBURGH,PA,PENNSYLVANIA,"US Mid Atlantic",,,"=""3334""","Primary Production of Aluminum",331312,"Primary Aluminum Production",34,38,01/02/25,"9,814,899,712",12/31/24,"11,895,000,000","60,000,000",,"14,064,000,000"
42713,"Goodwill and intangible assets","Annual Impairment Assessments for Goodwill for a Certain Cash Generating Unit and Alcon Brand Name",553174,12/31/24,02/25/25,1,"PricewaterhouseCoopers LLP",,,,"Fort Worth",TX,TEXAS,"US Southwest",20-F,2025-02-25,,"ALCON INC",1167379,"=""ALC""","6201 SOUTH FREEWAY",,"FORT WORTH",TX,TEXAS,"US Southwest",,,"=""3851""","Ophthalmic Goods",339115,"Ophthalmic Goods Manufacturing",34,85,12/31/24,"41,987,981,312",12/31/24,"9,911,000,000","1,018,000,000","4,020,000,000","30,347,000,000"
42714,"Other intangible assets","Annual Impairment Assessment for a Certain In-Process Research and Development Intangible Asset",553174,12/31/24,02/25/25,1,"PricewaterhouseCoopers LLP",,,,"Fort Worth",TX,TEXAS,"US Southwest",20-F,2025-02-25,,"ALCON INC",1167379,"=""ALC""","6201 SOUTH FREEWAY",,"FORT WORTH",TX,TEXAS,"US Southwest",,,"=""3851""","Ophthalmic Goods",339115,"Ophthalmic Goods Manufacturing",34,85,12/31/24,"41,987,981,312",12/31/24,"9,911,000,000","1,018,000,000","4,020,000,000","30,347,000,000"
43024,"Revenue from customer contracts","Revenue Recognition",553606,12/31/24,02/26/25,2,"Ernst & Young LLP",,,,"San Mateo",CA,CALIFORNIA,"US West",10-K,2025-02-26,,"Alector, Inc.",1653087,"=""ALEC""","131 OYSTER POINT BLVD., SUITE 600",,"SOUTH SAN FRANCISCO",CA,CALIFORNIA,"US West",,,"=""2836""","Biological Products, Except Diagnostic Substances",325414,"Biological Product (except Diagnostic) Manufacturing",34,2,12/31/24,"187,272,336",12/31/24,"100,558,000","-119,049,000",,"468,303,000"
43829,"Business combinations","Real Estate Acquisitions and Dispositions – Acquisition of Real Estate Properties— Refer to Notes 2 and 4 to the financial statements",554646,12/31/24,02/28/25,3,"Deloitte & Touche LLP",,,,Honolulu,HI,HAWAII,"US West",10-K,2025-02-28,,"Alexander & Baldwin, Inc.",1545654,"=""ALEX""","822 BISHOP STREET, P.O. BOX 3440",,HONOLULU,HI,HAWAII,"US West",,,"=""6798""","Real Estate Investment Trusts",531312,"Nonresidential Property Managers",34,18,01/02/25,"1,280,518,912",12/31/24,"236,641,000","60,537,000","994,814,000","1,670,432,000"
40835,"Real estate investments","Real Estate Impairment – Refer to Note 2 to the financial statements",550680,12/31/24,02/10/25,3,"Deloitte & Touche LLP",,,,"New York",NY,"NEW YORK","US Mid Atlantic",10-K,2025-02-10,,"ALEXANDERS INC",3499,"=""ALX""","210 ROUTE 4 EAST",,PARAMUS,NJ,"NEW JERSEY","US Mid Atlantic",,,"=""6798""","Real Estate Investment Trusts",525990,"Other Financial Vehicles",34,200,12/31/24,"1,021,764,416",12/31/24,"226,374,000","43,444,000",,"1,341,295,000"
40585,"Real estate investments","Impairment of investments in real estate",547715,12/31/24,01/27/25,2,"Ernst & Young LLP",,,,"Los Angeles",CA,CALIFORNIA,"US West",10-K,2025-01-27,,"ALEXANDRIA REAL ESTATE EQUITIES, INC.",1035443,"=""ARE""","26 NORTH EUCLID AVENUE",,PASADENA,CA,CALIFORNIA,"US West",,,"=""6798""","Real Estate Investment Trusts",525990,"Other Financial Vehicles",34,98,12/31/24,"16,798,445,568",12/31/24,"3,116,394,000","322,949,000",,"37,527,449,000"
38671,"Revenue from customer contracts","Revenue Recognition – Refer to Notes 3 and 6 of the financial statements.",537792,03/31/24,06/20/24,3,"Deloitte & Touche LLP",468,"Deloitte LLP",1208,Toronto,A6,ONTARIO,Canada,40-F,2024-06-21,,"Algoma Steel Group Inc.",1860805,"=""ASTL""","105 WEST STREET",,"SAULT STE. MARIE",A6,ONTARIO,Canada,,,"=""3312""","Steel Works, Blast Furnaces (Including Coke Ovens), and Rolling Mills",331111,"Iron and Steel Mills",34,8,03/31/24,"883,835,072",03/31/24,"2,066,000,000","77,700,000","1,109,800,000","1,977,500,000"
44825,"Revenue from customer contracts","Revenue Recognition – Refer to Notes 3 and 6 of the financial statements.",557392,12/31/24,03/12/25,3,"Deloitte & Touche LLP",468,"Deloitte LLP",1208,Toronto,A6,ONTARIO,Canada,40-F,2025-03-13,,"Algoma Steel Group Inc.",1860805,"=""ASTL""","105 WEST STREET",,"SAULT STE. MARIE",A6,ONTARIO,Canada,,,"=""3312""","Steel Works, Blast Furnaces (Including Coke Ovens), and Rolling Mills",331111,"Iron and Steel Mills",34,5,03/31/25,"568,741,207",03/31/25,"1,836,512,219","-112,279,168",,"2,151,517,541"
44520,"Regulatory assets and liabilities","Regulatory assets and liabilities—Recovery of costs through rate regulation",556129,12/31/24,03/07/25,2,"Ernst & Young LLP",192,"Ernst & Young LLP Chartered Accountants",1263,Toronto,A6,ONTARIO,Canada,40-F,2025-03-07,,"ALGONQUIN POWER & UTILITIES CORP.",1174169,"=""AQN""","354 DAVIS ROAD",,OAKVILLE,A6,ONTARIO,Canada,,,"=""4911""","Electric Services",221111,"Hydroelectric Power Generation",34,5,01/02/25,"3,129,290,496",12/31/24,"2,319,538,000","-1,380,517,000","3,331,569,000","16,961,757,000"
46506,"Regulatory assets and liabilities","Regulatory assets and liabilities—Recovery of costs through rate regulation",561027,12/31/24,03/07/25,2,"Ernst & Young LLP",192,"Ernst & Young LLP Chartered Accountants",1263,Toronto,A6,ONTARIO,Canada,6-K,2025-04-09,,"ALGONQUIN POWER & UTILITIES CORP.",1174169,"=""AQN""","354 DAVIS ROAD",,OAKVILLE,A6,ONTARIO,Canada,,,"=""4911""","Electric Services",221111,"Hydroelectric Power Generation",34,5,01/02/25,"3,129,290,496",12/31/24,"2,319,538,000","-1,380,517,000","3,331,569,000","16,961,757,000"
38401,Goodwill,"Impairment assessment on goodwill relating to a reporting unit under Digital Media and Entertainment Group",536492,03/31/24,05/23/24,1,"PricewaterhouseCoopers LLP",94,"PricewaterhouseCoopers Zhong Tian LLP",1424,Shanghai,F4,CHINA,Foreign,20-F,2024-05-23,,"Alibaba Group Holding Ltd",1577552,"=""BABA""","26/F TOWER ONE","TIMES SQUARE, 1 MATHESON STREET","CAUSEWAY BAY",K3,"HONG KONG",Foreign,,,"=""7389""","Business Services, NEC",518210,"Data Processing, Hosting, and Related Services",33,73,04/02/24,"186,992,017,408",03/31/24,"130,221,000,000","11,070,000,000","98,326,000,000","244,184,000,000"
38402,"Other investments","Fair value determination related to investments in privately held companies accounted for using the measurement alternative",536492,03/31/24,05/23/24,1,"PricewaterhouseCoopers LLP",94,"PricewaterhouseCoopers Zhong Tian LLP",1424,Shanghai,F4,CHINA,Foreign,20-F,2024-05-23,,"Alibaba Group Holding Ltd",1577552,"=""BABA""","26/F TOWER ONE","TIMES SQUARE, 1 MATHESON STREET","CAUSEWAY BAY",K3,"HONG KONG",Foreign,,,"=""7389""","Business Services, NEC",518210,"Data Processing, Hosting, and Related Services",33,73,04/02/24,"186,992,017,408",03/31/24,"130,221,000,000","11,070,000,000","98,326,000,000","244,184,000,000"
43521,Goodwill,"Goodwill Impairment Assessment",554139,12/31/24,02/27/25,2,"Ernst & Young LLP",,,,Chicago,IL,ILLINOIS,"US Midwest",10-K,2025-02-27,,"Alight, Inc. / Delaware",1809104,"=""ALIT""","4 OVERLOOK POINT",,LINCOLNSHIRE,IL,ILLINOIS,"US Midwest",,,"=""7389""","Business Services, NEC",511210,"Software Publishers",34,7,01/02/25,"3,594,417,664",12/31/24,"2,332,000,000","-157,000,000","-1,758,000,000","8,193,000,000"
43522,"Other income taxes","Measurement of the Tax Receivable Agreement Liability",554139,12/31/24,02/27/25,2,"Ernst & Young LLP",,,,Chicago,IL,ILLINOIS,"US Midwest",10-K,2025-02-27,,"Alight, Inc. / Delaware",1809104,"=""ALIT""","4 OVERLOOK POINT",,LINCOLNSHIRE,IL,ILLINOIS,"US Midwest",,,"=""7389""","Business Services, NEC",511210,"Software Publishers",34,7,01/02/25,"3,594,417,664",12/31/24,"2,332,000,000","-157,000,000","-1,758,000,000","8,193,000,000"
43800,"Revenue from customer contracts","Revenue Recognition – Determination of Standalone Selling Price of Distinct Performance Obligations in Clear Aligner Contracts",554478,12/31/24,02/28/25,1,"PricewaterhouseCoopers LLP",,,,"San Jose",CA,CALIFORNIA,"US West",10-K,2025-02-28,,"ALIGN TECHNOLOGY INC",1097149,"=""ALGN""","410 NORTH SCOTTSDALE ROAD, SUITE 1300",,TEMPE,AZ,ARIZONA,"US Southwest",,,"=""3842""","Orthopedic, Prosthetic, and Surgical Appliances and Supplies",339114,"Dental Equipment and Supplies Manufacturing",34,208,01/02/25,"15,564,416,000",12/31/24,"3,999,012,000","421,362,000","3,305,867,000","6,214,600,000"
43458,"Insurance contract liabilities","Medical expenses payable – Incurred but not paid claims - Refer to Notes 2 and 7 to the financial statements",554108,12/31/24,02/27/25,3,"Deloitte & Touche LLP",,,,"Costa Mesa",CA,CALIFORNIA,"US West",10-K,2025-02-27,,"Alignment Healthcare, Inc.",1832466,"=""ALHC""","1100 W. TOWN AND COUNTRY ROAD","SUITE 1600",ORANGE,CA,CALIFORNIA,"US West",,,"=""6324""","Hospital and Medical Service Plans",524114,"Direct Health and Medical Insurance Carriers",34,12,01/02/25,"2,216,006,912",12/31/24,"2,703,561,000","-128,035,000","60,475,000","782,063,000"
38578,Goodwill,"Impairment test of goodwill",537499,03/31/24,06/12/24,4,"KPMG LLP",187,"KPMG LLP Chartered Accountants",85,Montreal,A8,QUEBEC,Canada,40-F,2024-06-13,,"Alithya Group inc",1734520,"=""ALYAF""","700 RENE-LEVESQUE WEST BOULEVARD","SUITE 400",MONTREAL,A8,QUEBEC,Canada,,,"=""7370""","Services-Computer Programming, Data Processing, Etc.",541512,"Computer Systems Design Services",34,2,03/31/24,"133,092,912",03/31/24,"362,923,000","-12,311,000","-53,621,000","307,775,000"
38579,"Revenue from customer contracts","Revenue recognition for fixed-fee and time and material arrangements applying the input method",537499,03/31/24,06/12/24,4,"KPMG LLP",187,"KPMG LLP Chartered Accountants",85,Montreal,A8,QUEBEC,Canada,40-F,2024-06-13,,"Alithya Group inc",1734520,"=""ALYAF""","700 RENE-LEVESQUE WEST BOULEVARD","SUITE 400",MONTREAL,A8,QUEBEC,Canada,,,"=""7370""","Services-Computer Programming, Data Processing, Etc.",541512,"Computer Systems Design Services",34,2,03/31/24,"133,092,912",03/31/24,"362,923,000","-12,311,000","-53,621,000","307,775,000"
43877,"Revenue from customer contracts","Accounting for Revenue Recognition",554630,12/31/24,02/28/25,2,"Ernst & Young LLP",,,,Dallas,TX,TEXAS,"US Southwest",10-K,2025-02-28,,"ALKAMI TECHNOLOGY, INC.",1529274,"=""ALKT""","5601 GRANITE PARKWAY","SUITE 120",PLANO,TX,TEXAS,"US Southwest",,,"=""7372""","Prepackaged Software",511210,"Software Publishers",34,37,12/31/24,"3,744,616,448",12/31/24,"333,849,000","-40,835,000","179,959,000","437,277,000"
40981,"Sales return and allowances","Rebate Accruals – Medicaid Drug Rebate Program",550916,12/31/24,02/12/25,1,"PricewaterhouseCoopers LLP",,,,Boston,MA,MASSACHUSETTS,"US New England",10-K,2025-02-12,,"Alkermes plc.",1520262,"=""ALKS""","CONNAUGHT HOUSE","1 BURLINGTON ROAD","DUBLIN 4",L2,IRELAND,Foreign,,,"=""2834""","Pharmaceutical Preparations",325412,"Pharmaceutical Preparation Manufacturing",34,29,12/31/24,"4,664,210,432",12/31/24,"1,557,632,000","367,070,000","1,381,060,000","2,055,567,000"
44698,"Research and development expenses","Accrued Clinical Expenses",557147,12/31/24,03/12/25,2,"Ernst & Young LLP",,,,"San Mateo",CA,CALIFORNIA,"US West",10-K,2025-03-12,,"Allakos Inc.",1564824,,"4757 EXECUTIVE DRIVE","SUITE  210","SAN DIEGO",CA,CALIFORNIA,"US West",,,"=""2834""","Pharmaceutical Preparations",325414,"Biological Product (except Diagnostic) Manufacturing",34,1,01/02/25,"110,786,104",12/31/24,,"-115,818,000",,"96,601,000"
44045,"Property, plant and equipment","Impairment of Sunseeker Resort",554999,12/31/24,03/03/25,4,"KPMG LLP",,,,Dallas,TX,TEXAS,"US Southwest",10-K,2025-03-03,,"Allegiant Travel CO",1362468,"=""ALGT""","1201 N. TOWN CENTER DRIVE",,"LAS VEGAS",NV,NEVADA,"US West",,,"=""4512""","Air Transportation, Scheduled",561510,"Travel Agencies",34,92,01/02/25,"1,686,725,888",12/31/24,"2,512,589,000","-240,238,000",,"4,429,853,000"
41829,"Revenue from customer contracts","Revenue Recognition",551741,12/31/24,02/18/25,1,"PricewaterhouseCoopers LLP",,,,Indianapolis,IN,INDIANA,"US Midwest",10-K,2025-02-18,,"Allegion plc",1579241,"=""ALLE""","UNIT NO. 233, THE CAPEL BUILDING","MARY'S ABBEY","DUBLIN 7",L2,IRELAND,Foreign,,,"=""7381""","Detective, Guard, and Armored Car Services",423610,"Electrical Apparatus and Equipment, Wiring Supplies, and Related Equipment Merchant  Wholesalers",34,131,12/31/24,"11,271,770,112",12/31/24,"3,772,200,000","597,500,000","-557,700,000","4,487,800,000"
38397,"Sales return and allowances","Revenue Recognition – Sales Allowance",536503,03/29/24,05/23/24,1,"PricewaterhouseCoopers LLP",,,,Boston,MA,MASSACHUSETTS,"US New England",10-K,2024-05-23,,"ALLEGRO MICROSYSTEMS, INC.",866291,"=""ALGM""","955 PERIMETER ROAD",,MANCHESTER,NH,"NEW HAMPSHIRE","US New England",,,"=""3674""","Semiconductors and Related Devices",334413,"Semiconductor and Related Device Manufacturing",34,27,03/27/24,"5,175,772,160",03/29/24,"1,049,367,000","152,697,000","651,156,000","1,530,603,000"
38398,"Business combinations","Acquisition of Crocus Technology International Corp. - Valuation of Completed Technology",536503,03/29/24,05/23/24,1,"PricewaterhouseCoopers LLP",,,,Boston,MA,MASSACHUSETTS,"US New England",10-K,2024-05-23,,"ALLEGRO MICROSYSTEMS, INC.",866291,"=""ALGM""","955 PERIMETER ROAD",,MANCHESTER,NH,"NEW HAMPSHIRE","US New England",,,"=""3674""","Semiconductors and Related Devices",334413,"Semiconductor and Related Device Manufacturing",34,27,03/27/24,"5,175,772,160",03/29/24,"1,049,367,000","152,697,000","651,156,000","1,530,603,000"
41175,"Regulatory assets and liabilities","Accounting for the Effects of Regulatory Matters",551171,12/31/24,02/13/25,1,"PricewaterhouseCoopers LLP",,,,Minneapolis,MN,MINNESOTA,"US Midwest",10-K,2025-02-13,,"ALLETE INC",66756,"=""ALE""","30 W SUPERIOR ST",,DULUTH,MN,MINNESOTA,"US Midwest",,,"=""4931""","Electric and Other Services Combined",221122,"Electric Power Distribution",34,65,01/02/25,"3,752,451,328",12/31/24,"1,529,800,000","179,300,000","2,693,100,000","6,754,300,000"
48439,"Warranty liabilities","Product Warranty Liability",572087,12/31/24,06/11/25,2,"Ernst & Young LLP",,,,Milwaukee,WI,WISCONSIN,"US Midwest",DRS,2025-06-17,,"Alliance Laundry Holdings Inc.",1317685,"=""ALH""","221 SHEPARD ST",,RIPON,WI,WISCONSIN,"US Midwest",,,"=""3580""","Refrigeration & Service Industry Machinery",335224,"Household Laundry Equipment Manufacturing",34,,,,12/31/24,"1,508,440,000","98,319,000","-1,737,574,000","2,832,105,000"
48440,"Warranty liabilities","Product Warranty Liability",572089,12/31/24,07/29/25,2,"Ernst & Young LLP",,,,Milwaukee,WI,WISCONSIN,"US Midwest",DRS/A,2025-07-30,,"Alliance Laundry Holdings Inc.",1317685,"=""ALH""","221 SHEPARD ST",,RIPON,WI,WISCONSIN,"US Midwest",,,"=""3580""","Refrigeration & Service Industry Machinery",335224,"Household Laundry Equipment Manufacturing",34,,,,12/31/24,"1,508,440,000","98,319,000","-1,737,574,000","2,832,105,000"
48442,"Warranty liabilities","Product Warranty Liability",572091,12/31/24,07/29/25,2,"Ernst & Young LLP",,,,Milwaukee,WI,WISCONSIN,"US Midwest",DRS/A,2025-08-22,,"Alliance Laundry Holdings Inc.",1317685,"=""ALH""","221 SHEPARD ST",,RIPON,WI,WISCONSIN,"US Midwest",,,"=""3580""","Refrigeration & Service Industry Machinery",335224,"Household Laundry Equipment Manufacturing",34,,,,12/31/24,"1,508,440,000","98,319,000","-1,737,574,000","2,832,105,000"
48447,"Warranty liabilities","Product Warranty Liability",572101,12/31/24,07/29/25,2,"Ernst & Young LLP",,,,Milwaukee,WI,WISCONSIN,"US Midwest",S-1,2025-09-12,,"Alliance Laundry Holdings Inc.",1317685,"=""ALH""","221 SHEPARD ST",,RIPON,WI,WISCONSIN,"US Midwest",,,"=""3580""","Refrigeration & Service Industry Machinery",335224,"Household Laundry Equipment Manufacturing",34,,,,12/31/24,"1,508,440,000","98,319,000","-1,737,574,000","2,832,105,000"
48502,"Warranty liabilities","Product Warranty Liability",572545,12/31/24,07/29/25,2,"Ernst & Young LLP",,,,Milwaukee,WI,WISCONSIN,"US Midwest",S-1/A,2025-09-19,,"Alliance Laundry Holdings Inc.",1317685,"=""ALH""","221 SHEPARD ST",,RIPON,WI,WISCONSIN,"US Midwest",,,"=""3580""","Refrigeration & Service Industry Machinery",335224,"Household Laundry Equipment Manufacturing",34,,,,12/31/24,"1,508,440,000","98,319,000","-1,737,574,000","2,832,105,000"
48559,"Warranty liabilities","Product Warranty Liability",573206,12/31/24,09/29/25,2,"Ernst & Young LLP",,,,Milwaukee,WI,WISCONSIN,"US Midwest",S-1/A,2025-09-29,,"Alliance Laundry Holdings Inc.",1317685,"=""ALH""","221 SHEPARD ST",,RIPON,WI,WISCONSIN,"US Midwest",,,"=""3580""","Refrigeration & Service Industry Machinery",335224,"Household Laundry Equipment Manufacturing",34,,,,12/31/24,"1,508,440,000","98,319,000","-1,737,574,000","2,832,105,000"
48618,"Warranty liabilities","Product Warranty Liability",573845,12/31/24,09/29/25,2,"Ernst & Young LLP",,,,Milwaukee,WI,WISCONSIN,"US Midwest",424B4,2025-10-09,,"Alliance Laundry Holdings Inc.",1317685,"=""ALH""","221 SHEPARD ST",,RIPON,WI,WISCONSIN,"US Midwest",,,"=""3580""","Refrigeration & Service Industry Machinery",335224,"Household Laundry Equipment Manufacturing",34,,,,12/31/24,"1,508,440,000","98,319,000","-1,737,574,000","2,832,105,000"
41488,"Equity investments and joint ventures","Measurement of Equity Method Investment in AB - Valuation of the Initial Investment in the Unconsolidated JVs",551469,12/31/24,02/14/25,1,"PricewaterhouseCoopers LLP",,,,Nashville,TN,TENNESSEE,"US Southeast",10-K,2025-02-14,,"ALLIANCEBERNSTEIN HOLDING L.P.",825313,"=""AB""","501 COMMERCE STREET",,NASHVILLE,TN,TENNESSEE,"US Southeast",1333986,"Equitable Holdings, Inc.","=""6282""","Investment Advice",523930,"Investment Advice",34,37,01/02/25,"4,203,914,240",12/31/24,"461,949,000","423,374,000",,"2,034,632,000"
41377,"Equity investments and joint ventures","Valuation of the Initial Investment in the Unconsolidated JVs",551347,12/31/24,02/14/25,1,"PricewaterhouseCoopers LLP",,,,Nashville,TN,TENNESSEE,"US Southeast",10-K,2025-02-14,,"ALLIANCEBERNSTEIN L.P.",1109448,,"501 COMMERCE STREET",,NASHVILLE,TN,TENNESSEE,"US Southeast",1333986,"Equitable Holdings, Inc.","=""6282""","Investment Advice",523930,"Investment Advice",34,,,,12/31/24,"4,431,630,000","1,173,247,000","1,108,139,000","9,071,927,000"
42393,"Regulatory assets and liabilities","Regulatory Accounting - Impact of rate regulation on the financial statements - Refer to Notes 1, 2, and 3 to the financial statements",552558,12/31/24,02/21/25,3,"Deloitte & Touche LLP",,,,Milwaukee,WI,WISCONSIN,"US Midwest",10-K,2025-02-21,,"ALLIANT ENERGY CORP",352541,"=""LNT""","4902 NORTH BILTMORE LANE","SUITE 1000",MADISON,WI,WISCONSIN,"US Midwest",,,"=""4931""","Electric and Other Services Combined",221122,"Electric Power Distribution",34,59,12/31/24,"15,180,659,712",12/31/24,"3,981,000,000","690,000,000",,"22,714,000,000"
44263,Inventory,"Inventories – Refer to Note 1 to the financial statements",555531,12/31/24,03/05/25,3,"Deloitte & Touche LLP",,,,Williamsville,NY,"NEW YORK","US Mid Atlantic",10-K,2025-03-05,,"ALLIENT INC",46129,"=""ALNT""","495 COMMERCE DRIVE, SUITE 3",,AMHERST,NY,"NEW YORK","US Mid Atlantic",,,"=""3825""","Instruments for Measuring and Testing of Electricity and Electrical Signals",334519,"Other Measuring and Controlling Device Manufacturing",34,24,12/31/24,"408,146,816",12/31/24,"529,968,000","13,166,000","33,394,000","575,781,000"
41092,"Warranty liabilities","Product Warranty Liabilities",551080,12/31/24,02/13/25,1,"PricewaterhouseCoopers LLP",,,,Indianapolis,IN,INDIANA,"US Midwest",10-K,2025-02-13,,"Allison Transmission Holdings Inc",1411207,"=""ALSN""","ONE ALLISON WAY",,Indianapolis,IN,INDIANA,"US Midwest",,,"=""3714""","Motor Vehicle Parts and Accessories",336350,"Motor Vehicle Transmission and Power Train Parts Manufacturing",34,108,12/31/24,"9,269,041,152",12/31/24,"3,225,000,000","731,000,000","-1,246,000,000","5,336,000,000"
44815,"Long-lived assets","Impairment of Long-Lived Assets",557377,12/31/24,03/13/25,2,"Ernst & Young LLP",,,,"San Mateo",CA,CALIFORNIA,"US West",10-K,2025-03-13,,"Allogene Therapeutics, Inc.",1737287,"=""ALLO""","210 EAST GRAND AVENUE",,"SOUTH SAN FRANCISCO",CA,CALIFORNIA,"US West",,,"=""2836""","Biological Products, Except Diagnostic Substances",325414,"Biological Product (except Diagnostic) Manufacturing",34,2,12/31/24,"452,008,576",12/31/24,"22,000","-257,590,000",,"548,710,000"
45789,"Revenue from customer contracts","Revenue Recognition",559121,12/31/24,03/27/25,2,"Ernst & Young LLP",222,"Kost Forer Gabbay & Kasierer",1281,"Tel Aviv",L3,ISRAEL,Foreign,20-F,2025-03-27,,"Allot Ltd.",1365767,"=""ALLT""","22 HANGAR STREET","NEVE NE'EMAN, INDUSTRIAL ZONE B",HOD-HASHARON,L3,ISRAEL,Foreign,,,"=""3576""","Computer Communications Equipment",541511,"Custom Computer Programming Services",34,6,01/02/25,"237,553,248",12/31/24,"92,195,000","-5,869,000","17,671,000","139,641,000"
42477,"Insurance contract liabilities","Reserve for Property and Casualty Insurance Claims and Claims Expense - Refer to Notes 2 and 10 to the Financial Statements",552888,12/31/24,02/24/25,3,"Deloitte & Touche LLP",,,,Chicago,IL,ILLINOIS,"US Midwest",10-K,2025-02-24,,"ALLSTATE CORP",899051,"=""ALL""","3100 SANDERS ROAD",,NORTHBROOK,IL,ILLINOIS,"US Midwest",,,"=""6331""","Fire, Marine, and Casualty Insurance",524126,"Direct Property and Casualty Insurance Carriers",34,192,01/02/25,"50,829,025,280",12/31/24,"64,106,000,000","4,667,000,000","18,197,000,000","111,617,000,000"
41846,"Allowance for credit losses","Allowance for Loan Losses — Consumer Automotive Portfolio — Refer to Notes 1 and 9 to the financial statements",551982,12/31/24,02/19/25,3,"Deloitte & Touche LLP",,,,Detroit,MI,MICHIGAN,"US Midwest",10-K,2025-02-19,,"Ally Financial Inc.",40729,"=""ALLY""","ALLY DETROIT CENTER","500 WOODWARD AVE. FLOOR 10",DETROIT,MI,MICHIGAN,"US Midwest",,,"=""6022""","State Commercial Banks",522220,"Sales Financing",34,36,01/02/25,"10,896,601,088",12/31/24,"6,751,000,000","668,000,000",,"191,836,000,000"
47166,"Goodwill and intangible assets","Impairment assessments of trademarks and goodwill for cash-generating units of Almacenes Éxito S. A.",563528,12/31/24,04/29/25,1,"PricewaterhouseCoopers LLP",890,"PwC Contadores y Auditores SAS",6466,Medellin,F8,COLOMBIA,Foreign,20-F,2025-04-30,,"Almacenes Exito S.A.",1957146,"=""EXTOY""","CARRERA 48 # 32 B SUR 139.",,"ENVIGADO, ANTIOQUIA,",F8,COLOMBIA,Foreign,,,"=""5331""","Variety Stores",445110,"Supermarkets and Other Grocery (except Convenience) Stores",34,3,01/30/25,"562,948,666",12/31/24,"4,967,000,000","54,000,000","680,000,000","3,985,000,000"
41217,"Other liabilities and provisions","Liability Related to Sale of Future Royalties and Commercial Milestones",551071,12/31/24,02/13/25,1,"PricewaterhouseCoopers LLP",,,,Boston,MA,MASSACHUSETTS,"US New England",10-K,2025-02-13,,"ALNYLAM PHARMACEUTICALS, INC.",1178670,"=""ALNY""","675 WEST KENDALL STREET","HENRI A. TERMEER SQUARE",CAMBRIDGE,MA,MASSACHUSETTS,"US New England",,,"=""2834""","Pharmaceutical Preparations",325412,"Pharmaceutical Preparation Manufacturing",34,235,12/31/24,"30,424,170,496",12/31/24,"2,248,243,000","-278,157,000",,"4,239,983,000"
40720,"Other contingent liabilities","Loss Contingencies",548217,12/31/24,02/04/25,2,"Ernst & Young LLP",,,,"San Jose",CA,CALIFORNIA,"US West",10-K,2025-02-05,,"Alphabet Inc.",1652044,"=""GOOGL""","1600 AMPHITHEATRE PARKWAY",,"MOUNTAIN VIEW",CA,CALIFORNIA,"US West",,,"=""7370""","Services-Computer Programming, Data Processing, Etc.",518112,"Web Search Portals",34,189,01/02/25,"1,106,839,470,080",12/31/24,"350,018,000,000","100,118,000,000","293,199,000,000","450,256,000,000"
42960,Inventory,"Valuation of Inventories - Refer to Note 1 to the Financial Statements",553531,12/31/24,02/26/25,3,"Deloitte & Touche LLP",,,,"San Diego",CA,CALIFORNIA,"US West",10-K,2025-02-26,,"Alphatec Holdings, Inc.",1350653,"=""ATEC""","1950 CAMINO VIA ROBLE",,CARLSBAD,CA,CALIFORNIA,"US West",,,"=""3841""","Surgical and Medical Instruments and Apparatus",339112,"Surgical and Medical Instrument Manufacturing",34,9,12/31/24,"1,323,104,256",12/31/24,"611,562,000","-162,123,000","-155,060,000","775,710,000"
44316,"Revenue from customer contracts","Revenue Recognition — Refer to Notes 2 and 3 to the financial statements",555636,12/31/24,03/05/25,3,"Deloitte & Touche LLP",,,,Detroit,MI,MICHIGAN,"US Midwest",10-K,2025-03-05,,"ALTA EQUIPMENT GROUP INC.",1759824,"=""ALTG""","13211 MERRIMAN ROAD",,LIVONIA,MI,MICHIGAN,"US Midwest",,,"=""5084""","Industrial Machinery and Equipment",423830,"Industrial Machinery and Equipment Merchant Wholesalers",34,7,12/31/24,"214,264,368",12/31/24,"1,876,600,000","-62,100,000","-54,600,000","1,480,400,000"
41936,"Revenue from customer contracts","Software Revenue Recognition",552106,12/31/24,02/20/25,2,"Ernst & Young LLP",,,,Detroit,MI,MICHIGAN,"US Midwest",10-K,2025-02-20,,"Altair Engineering Inc.",1701732,"=""ALTR""","1820 E. BIG BEAVER ROAD",,TROY,MI,MICHIGAN,"US Midwest",,,"=""7372""","Prepackaged Software",511210,"Software Publishers",34,109,12/31/24,"6,566,348,800",12/31/24,"665,788,000","14,175,000","321,793,000","1,445,647,000"
39547,"Research and development expenses","Research and development tax incentive receivable",541659,06/30/24,09/26/24,1,"PricewaterhouseCoopers LLP",89,PricewaterhouseCoopers,1379,Melbourne,C3,AUSTRALIA,Foreign,20-F,2024-09-26,Yes,"ALTERITY THERAPEUTICS LTD",1131343,"=""ATHE""","LEVEL 3, 460 BOURKE STREET",,MELBOURNE,C3,AUSTRALIA,Foreign,,,"=""2834""","Pharmaceutical Preparations",325412,"Pharmaceutical Preparation Manufacturing",34,2,07/02/24,"7,360,358",06/30/24,,"-12,771,624",,"12,838,596"
43245,"Research and development expenses","Accrued and Prepaid Research and Development Expenses",553812,12/31/24,02/27/25,2,"Ernst & Young LLP",,,,Iselin,NJ,"NEW JERSEY","US Mid Atlantic",10-K,2025-02-27,,"Altimmune, Inc.",1326190,"=""ALT""","910 CLOPPER ROAD","SUITE 201S",GAITHERSBURG,MD,MARYLAND,"US Mid Atlantic",,,"=""2834""","Pharmaceutical Preparations",325412,"Pharmaceutical Preparation Manufacturing",34,7,12/31/24,"521,662,976",12/31/24,"20,000","-95,059,000",,"139,306,000"
40648,"Other contingent liabilities","E-Vapor Product Litigation",547982,12/31/24,01/30/25,1,"PricewaterhouseCoopers LLP",,,,Richmond,VA,VIRGINIA,"US Mid Atlantic",8-K,2025-01-30,,"ALTRIA GROUP, INC.",764180,"=""MO""","6601 WEST BROAD STREET",,RICHMOND,VA,VIRGINIA,"US Mid Atlantic",,,"=""2111""",Cigarettes,312221,"Cigarette Manufacturing",34,53,01/02/25,"88,994,627,584",12/31/24,"24,018,000,000","11,264,000,000","-22,156,000,000","35,177,000,000"
40649,"Other intangible assets","Skoal Trademark Impairment Assessments",547982,12/31/24,01/30/25,1,"PricewaterhouseCoopers LLP",,,,Richmond,VA,VIRGINIA,"US Mid Atlantic",8-K,2025-01-30,,"ALTRIA GROUP, INC.",764180,"=""MO""","6601 WEST BROAD STREET",,RICHMOND,VA,VIRGINIA,"US Mid Atlantic",,,"=""2111""",Cigarettes,312221,"Cigarette Manufacturing",34,53,01/02/25,"88,994,627,584",12/31/24,"24,018,000,000","11,264,000,000","-22,156,000,000","35,177,000,000"
40650,Goodwill,"Goodwill Impairment Assessment- E-Vapor Reporting Unit",547982,12/31/24,01/30/25,1,"PricewaterhouseCoopers LLP",,,,Richmond,VA,VIRGINIA,"US Mid Atlantic",8-K,2025-01-30,,"ALTRIA GROUP, INC.",764180,"=""MO""","6601 WEST BROAD STREET",,RICHMOND,VA,VIRGINIA,"US Mid Atlantic",,,"=""2111""",Cigarettes,312221,"Cigarette Manufacturing",34,53,01/02/25,"88,994,627,584",12/31/24,"24,018,000,000","11,264,000,000","-22,156,000,000","35,177,000,000"
43116,"Other contingent liabilities","E-Vapor Product Litigation",553731,12/31/24,01/30/25,1,"PricewaterhouseCoopers LLP",,,,Richmond,VA,VIRGINIA,"US Mid Atlantic",10-K,2025-02-26,,"ALTRIA GROUP, INC.",764180,"=""MO""","6601 WEST BROAD STREET",,RICHMOND,VA,VIRGINIA,"US Mid Atlantic",,,"=""2111""",Cigarettes,312221,"Cigarette Manufacturing",34,53,01/02/25,"88,994,627,584",12/31/24,"24,018,000,000","11,264,000,000","-22,156,000,000","35,177,000,000"
43117,"Other intangible assets","Skoal Trademark Impairment Assessments",553731,12/31/24,01/30/25,1,"PricewaterhouseCoopers LLP",,,,Richmond,VA,VIRGINIA,"US Mid Atlantic",10-K,2025-02-26,,"ALTRIA GROUP, INC.",764180,"=""MO""","6601 WEST BROAD STREET",,RICHMOND,VA,VIRGINIA,"US Mid Atlantic",,,"=""2111""",Cigarettes,312221,"Cigarette Manufacturing",34,53,01/02/25,"88,994,627,584",12/31/24,"24,018,000,000","11,264,000,000","-22,156,000,000","35,177,000,000"
43118,Goodwill,"Goodwill Impairment Assessment- E-Vapor Reporting Unit",553731,12/31/24,01/30/25,1,"PricewaterhouseCoopers LLP",,,,Richmond,VA,VIRGINIA,"US Mid Atlantic",10-K,2025-02-26,,"ALTRIA GROUP, INC.",764180,"=""MO""","6601 WEST BROAD STREET",,RICHMOND,VA,VIRGINIA,"US Mid Atlantic",,,"=""2111""",Cigarettes,312221,"Cigarette Manufacturing",34,53,01/02/25,"88,994,627,584",12/31/24,"24,018,000,000","11,264,000,000","-22,156,000,000","35,177,000,000"
45725,"Deferred income taxes","Income Taxes —Recognition of Deferred Tax Assets — Refer to Notes 2 and 10 to the financial statements",559226,12/31/24,03/26/25,3,"Deloitte & Touche LLP",515,"Deloitte ehf",1490,Kopavogur,K6,ICELAND,Foreign,20-F,2025-03-27,,Alvotech,1898416,"=""ALVO""","9, RUE DE BITBOURG",,LUXEMBOURG,N4,LUXEMBOURG,Foreign,,,"=""2836""","Biological Products, Except Diagnostic Substances",325414,"Biological Product (except Diagnostic) Manufacturing",34,13,12/31/24,"3,992,889,088",12/31/24,"491,978,000","-231,864,000","-444,722,000","1,221,400,000"
44739,"Sales return and allowances","U.S. Product Return Reserve Estimate",557110,12/31/24,03/12/25,2,"Ernst & Young LLP",,,,Iselin,NJ,"NEW JERSEY","US Mid Atlantic",10-K,2025-03-12,,"AMARIN CORP PLC\UK",897448,"=""AMRN""","SPACES SOUTH DOCKLANDS, BLOCK C","77 SIR JOHN ROGERSON'S QUAY","ELY CAMBRIDGESHIRE",X0,"UNITED KINGDOM",Foreign,,,"=""2834""","Pharmaceutical Preparations",325412,"Pharmaceutical Preparation Manufacturing",34,0,12/31/24,"201,676,576",12/31/24,"228,614,000","-82,183,000","469,787,000","685,349,000"
40769,"Uncertain tax positions","Uncertain Tax Positions",550442,12/31/24,02/06/25,2,"Ernst & Young LLP",,,,Seattle,WA,WASHINGTON,"US West",10-K,2025-02-07,,"AMAZON COM INC",1018724,"=""AMZN""","410 TERRY AVENUE NORTH",,SEATTLE,WA,WASHINGTON,"US West",,,"=""5961""","Catalog and Mail-Order Houses",518210,"Data Processing, Hosting, and Related Services",34,219,12/31/24,"2,323,998,310,400",12/31/24,"637,959,000,000","59,248,000,000","262,896,000,000","624,894,000,000"
37046,"Other income taxes","Accounting for Income Taxes",531796,01/31/24,03/29/24,1,"PricewaterhouseCoopers LLP",,,,"San Jose",CA,CALIFORNIA,"US West",10-K,2024-03-29,,"AMBARELLA INC",1280263,"=""AMBA""","3001 TASMAN DRIVE",,"SANTA CLARA",CA,CALIFORNIA,"US West",,,"=""3674""","Semiconductors and Related Devices",334413,"Semiconductor and Related Device Manufacturing",34,52,02/02/24,"2,092,497,280",01/31/24,"226,474,000","-169,417,000","201,110,000","657,655,000"
44718,"Other income taxes","Tax Contingencies and Uncertain Tax Treatments",557150,12/31/24,03/07/25,1,"PricewaterhouseCoopers LLP",91,"PricewaterhouseCoopers Auditores Independentes",1351,"São Paulo",D5,BRAZIL,Foreign,20-F,2025-03-12,,"AMBEV S.A.",1565025,"=""ABEV""","RUA DR. RENATO PAES DE BARROS, 1017","3 ANDAR PARTE","SAO PAULO",D5,BRAZIL,Foreign,,,"=""2080""",Beverages,312120,Breweries,34,2,01/02/25,"28,829,515,776",12/31/24,"14,479,600,000","2,403,200,000","6,761,100,000","26,305,000,000"
42976,"Long-lived assets","Impairment of long-lived assets",553548,12/31/24,02/25/25,2,"Ernst & Young LLP",,,,"Kansas City",MO,MISSOURI,"US Southeast",10-K,2025-02-26,,"AMC ENTERTAINMENT HOLDINGS, INC.",1411579,"=""AMC""","ONE AMC WAY","11500 ASH STREET",LEAWOOD,KS,KANSAS,"US Midwest",,,"=""7830""","Services-Motion Picture Theaters",512131,"Motion Picture Theaters (except Drive-Ins)",34,4,12/31/24,"1,649,382,784",12/31/24,"4,637,200,000","-352,600,000","-4,205,900,000","8,247,500,000"
42977,"Derivatives and hedging","Initial Recognition of Exchangeable Notes and Related Features",553548,12/31/24,02/25/25,2,"Ernst & Young LLP",,,,"Kansas City",MO,MISSOURI,"US Southeast",10-K,2025-02-26,,"AMC ENTERTAINMENT HOLDINGS, INC.",1411579,"=""AMC""","ONE AMC WAY","11500 ASH STREET",LEAWOOD,KS,KANSAS,"US Midwest",,,"=""7830""","Services-Motion Picture Theaters",512131,"Motion Picture Theaters (except Drive-Ins)",34,4,12/31/24,"1,649,382,784",12/31/24,"4,637,200,000","-352,600,000","-4,205,900,000","8,247,500,000"
41544,Goodwill,"Assessment of the carrying value of goodwill in the Domestic Operations and AMC Networks International (AMCNI) reporting units",551396,12/31/24,02/14/25,4,"KPMG LLP",,,,"New York",NY,"NEW YORK","US Mid Atlantic",10-K,2025-02-14,,"AMC Networks Inc.",1514991,"=""AMCX""","11 PENN PLAZA",,"NEW YORK",NY,"NEW YORK","US Mid Atlantic",,,"=""4841""","Cable and Other Pay Television Services",515120,"Television Broadcasting",34,10,12/31/24,"323,096,384",12/31/24,"2,421,314,000","-226,546,000","-1,265,258,000","4,362,221,000"
41545,"Depreciation and amortization","Assessment of the amortization of owned original program rights predominantly monetized as a group",551396,12/31/24,02/14/25,4,"KPMG LLP",,,,"New York",NY,"NEW YORK","US Mid Atlantic",10-K,2025-02-14,,"AMC Networks Inc.",1514991,"=""AMCX""","11 PENN PLAZA",,"NEW YORK",NY,"NEW YORK","US Mid Atlantic",,,"=""4841""","Cable and Other Pay Television Services",515120,"Television Broadcasting",34,10,12/31/24,"323,096,384",12/31/24,"2,421,314,000","-226,546,000","-1,265,258,000","4,362,221,000"
39189,Goodwill,"Goodwill Impairment Assessment - Flexibles Latin America Reporting Unit",540105,06/30/24,08/16/24,1,"PricewaterhouseCoopers LLP",119,"PricewaterhouseCoopers AG",1358,Zurich,V8,SWITZERLAND,Foreign,10-K,2024-08-16,,"Amcor plc",1748790,"=""AMCR""","83 TOWER ROAD NORTH",,"WARMLEY, BRISTOL",X0,"UNITED KINGDOM",Foreign,,,"=""3990""","Miscellaneous Manufacturing Industries",322221,"Coated and Laminated Packaging Paper and Plastics Film Manufacturing",34,10,07/02/24,"13,846,387,712",06/30/24,"13,640,000,000","730,000,000","-2,855,000,000","16,524,000,000"
40285,"Revenue from customer contracts","Revenue recognition for projects",545533,09/30/24,12/17/24,2,"Ernst & Young LLP",,,,"New York",NY,"NEW YORK","US Mid Atlantic",20-F,2024-12-17,,"AMDOCS LTD",1062579,"=""DOX""","P.O BOX 263, HIRZEL HOUSE","SMITH STREET,","ST. PETER PORT",Y7,GUERNSEY,Foreign,,,"=""7371""","Computer Programming Services",541511,"Custom Computer Programming Services",34,88,10/02/24,"10,330,128,384",09/30/24,"5,004,989,000","493,197,000","451,339,000","6,386,142,000"
43577,"Other revenue","Evaluation of the non-contractual revenue adjustment estimates for Home Health",554275,12/31/24,02/27/25,4,"KPMG LLP",,,,"Baton Rouge",LA,LOUISIANA,"US Southeast",10-K,2025-02-27,,"AMEDISYS INC",896262,,"3854 AMERICAN WAY","SUITE A","BATON ROUGE",LA,LOUISIANA,"US Southeast",,,"=""8082""","Home Health Care Services",621610,"Home Health Care Services",34,91,12/31/24,"2,975,746,560",12/31/24,"2,348,324,000","43,231,000","-160,502,000","2,138,714,000"
43578,Goodwill,"Goodwill impairment of the High Acuity Care reporting unit",554275,12/31/24,02/27/25,4,"KPMG LLP",,,,"Baton Rouge",LA,LOUISIANA,"US Southeast",10-K,2025-02-27,,"AMEDISYS INC",896262,,"3854 AMERICAN WAY","SUITE A","BATON ROUGE",LA,LOUISIANA,"US Southeast",,,"=""8082""","Home Health Care Services",621610,"Home Health Care Services",34,91,12/31/24,"2,975,746,560",12/31/24,"2,348,324,000","43,231,000","-160,502,000","2,138,714,000"
40290,"Revenue from customer contracts","Revenue recognition related to the cost-based input method for certain fixed-price contracts",545540,09/27/24,12/17/24,2,"Ernst & Young LLP",,,,Tysons,VA,VIRGINIA,"US Mid Atlantic",10-K,2024-12-17,,"Amentum Holdings, Inc.",2011286,"=""AMTM""","4800 WESTFIELDS BOULEVARD","SUITE 400",CHANTILLY,VA,VIRGINIA,"US Mid Atlantic",,,"=""7389""","Business Services, NEC",0,,34,,,,09/27/24,"8,388,000,000","-82,000,000","-3,719,000,000","11,974,000,000"
40291,"Business combinations","Valuation of acquired customer relationship intangible assets",545540,09/27/24,12/17/24,2,"Ernst & Young LLP",,,,Tysons,VA,VIRGINIA,"US Mid Atlantic",10-K,2024-12-17,,"Amentum Holdings, Inc.",2011286,"=""AMTM""","4800 WESTFIELDS BOULEVARD","SUITE 400",CHANTILLY,VA,VIRGINIA,"US Mid Atlantic",,,"=""7389""","Business Services, NEC",0,,34,,,,09/27/24,"8,388,000,000","-82,000,000","-3,719,000,000","11,974,000,000"
44504,"Revenue from customer contracts","Revenue recognition related to the cost-based input method for certain fixed-price contracts",556593,09/27/24,12/17/24,2,"Ernst & Young LLP",,,,Tysons,VA,VIRGINIA,"US Mid Atlantic",8-K,2025-03-07,,"Amentum Holdings, Inc.",2011286,"=""AMTM""","4800 WESTFIELDS BOULEVARD","SUITE 400",CHANTILLY,VA,VIRGINIA,"US Mid Atlantic",,,"=""7389""","Business Services, NEC",0,,34,,,,09/27/24,"8,388,000,000","-82,000,000","-3,719,000,000","11,974,000,000"
44505,"Business combinations","Valuation of acquired customer relationship intangible assets",556593,09/27/24,12/17/24,2,"Ernst & Young LLP",,,,Tysons,VA,VIRGINIA,"US Mid Atlantic",8-K,2025-03-07,,"Amentum Holdings, Inc.",2011286,"=""AMTM""","4800 WESTFIELDS BOULEVARD","SUITE 400",CHANTILLY,VA,VIRGINIA,"US Mid Atlantic",,,"=""7389""","Business Services, NEC",0,,34,,,,09/27/24,"8,388,000,000","-82,000,000","-3,719,000,000","11,974,000,000"
44488,"Goodwill and intangible assets","Valuation of goodwill and trademarks for the Winter Sports Equipment and Peak Performance cash generating units",556290,12/31/24,03/07/25,4,"KPMG LLP",309,"KPMG AB",1049,Stockholm,V7,SWEDEN,Foreign,20-F,2025-03-07,,"Amer Sports, Inc.",1988894,"=""AS""","SILTASAARENKATU 8-10",FL-00530,HELSINKI,H9,FINLAND,Foreign,,,"=""2300""","Apparel & Other Finishd Prods of Fabrics & Similar Matl",339920,"Sporting and Athletic Goods Manufacturing",34,29,01/02/25,"14,576,451,584",12/31/24,"5,183,300,000","78,400,000","281,500,000","8,336,300,000"
41584,"Regulatory assets and liabilities","Accounting for the Effects of Regulation",551666,12/31/24,02/18/25,1,"PricewaterhouseCoopers LLP",,,,"Saint Louis",MO,MISSOURI,"US Southeast",10-K,2025-02-18,,"AMEREN CORP",1002910,"=""AEE""","1901 CHOUTEAU AVE","MC 1310","ST LOUIS",MO,MISSOURI,"US Southeast",,,"=""4931""","Electric and Other Services Combined",221122,"Electric Power Distribution",34,89,01/02/25,"23,753,902,080",12/31/24,"7,623,000,000","1,182,000,000","11,703,000,000","44,598,000,000"
41579,"Regulatory assets and liabilities","Accounting for the Effects of Regulation",551654,12/31/24,02/18/25,1,"PricewaterhouseCoopers LLP",,,,"Saint Louis",MO,MISSOURI,"US Southeast",10-K,2025-02-18,,"Ameren Illinois Co",18654,"=""AILIH""","10 RICHARD MARK WAY",,COLLINSVILLE,IL,ILLINOIS,"US Midwest",1002910,"AMEREN CORP","=""4931""","Electric and Other Services Combined",221121,"Electric Bulk Power Transmission and Control",34,,,,12/31/24,"3,472,000,000","622,000,000","6,960,000,000","19,230,000,000"
47381,"Deferred income taxes","Deferred tax assets, realizability of amounts related to net operating loss carryforwards and temporary differences related to employee benefits",564984,12/31/24,05/14/25,2,"Ernst & Young LLP",139,"Mancera SC",1284,"Mexico City",O5,MEXICO,Foreign,20-F,2025-05-14,,"AMERICA MOVIL SAB DE CV/",1129137,"=""AMX""","LAGO ZURICH 245",*,"COLONIA ANAHUAC",O5,MEXICO,Foreign,,,"=""4813""","Telephone Communications, Except Radiotelephone",517310,"Telecommunications Resellers",34,14,01/02/25,"45,026,451,456",12/31/24,"41,804,022,000","1,326,975,000","3,391,201,000","86,276,272,000"
47382,"Pension and other post-employment benefits","Discount rate used in determining defined benefit pension obligations in Mexico",564984,12/31/24,05/14/25,2,"Ernst & Young LLP",139,"Mancera SC",1284,"Mexico City",O5,MEXICO,Foreign,20-F,2025-05-14,,"AMERICA MOVIL SAB DE CV/",1129137,"=""AMX""","LAGO ZURICH 245",*,"COLONIA ANAHUAC",O5,MEXICO,Foreign,,,"=""4813""","Telephone Communications, Except Radiotelephone",517310,"Telecommunications Resellers",34,14,01/02/25,"45,026,451,456",12/31/24,"41,804,022,000","1,326,975,000","3,391,201,000","86,276,272,000"
41832,"Deferred income taxes","Sufficiency of audit evidence over the realizability of tax net operating loss and other carryforwards",551967,12/31/24,02/19/25,4,"KPMG LLP",,,,Dallas,TX,TEXAS,"US Southwest",10-K,2025-02-19,,"American Airlines Group Inc.",6201,"=""AAL""","1 SKYVIEW DRIVE",,"FORT WORTH",TX,TEXAS,"US Southwest",,,"=""4512""","Air Transportation, Scheduled",481111,"Scheduled Passenger Air Transportation",34,17,01/02/25,"11,171,226,624",12/31/24,"54,211,000,000","846,000,000","-10,112,000,000","61,783,000,000"
41825,"Deferred income taxes","Sufficiency of audit evidence over the realizability of tax net operating loss and other carryforwards",551960,12/31/24,02/19/25,4,"KPMG LLP",,,,Dallas,TX,TEXAS,"US Southwest",10-K,2025-02-19,,"AMERICAN AIRLINES, INC.",4515,,"1 SKYVIEW DRIVE",,"FORT WORTH",TX,TEXAS,"US Southwest",6201,"American Airlines Group Inc.","=""4512""","Air Transportation, Scheduled",481111,"Scheduled Passenger Air Transportation",34,,,,12/31/24,"54,204,000,000","1,262,000,000","2,099,000,000","68,755,000,000"
40977,"Real estate investments","Impairment of real estate properties",550912,12/31/24,02/11/25,2,"Ernst & Young LLP",,,,"San Diego",CA,CALIFORNIA,"US West",10-K,2025-02-12,,"American Assets Trust, Inc.",1500217,"=""AAT""","3420 CARMEL MOUNTAIN ROAD","SUITE 100","SAN DIEGO",CA,CALIFORNIA,"US West",,,"=""6798""","Real Estate Investment Trusts",525990,"Other Financial Vehicles",34,26,01/02/25,"1,587,095,296",12/31/24,"457,855,000","56,798,000",,"3,273,365,000"
40980,"Real estate investments","Impairment of real estate properties",550915,12/31/24,02/11/25,2,"Ernst & Young LLP",,,,"San Diego",CA,CALIFORNIA,"US West",10-K,2025-02-12,,"American Assets Trust, L.P.",1509570,,"11455 EL CAMINO REAL","SUITE 200","SAN DIEGO",CA,CALIFORNIA,"US West",,,"=""6798""","Real Estate Investment Trusts",525990,"Other Financial Vehicles",34,,,,12/31/24,"457,855,000","72,819,000",,"3,273,365,000"
41366,"Other income taxes","Income Taxes — Refer to Notes 1 and 13 to the consolidated financial statements",551341,12/31/24,02/14/25,3,"Deloitte & Touche LLP",,,,Detroit,MI,MICHIGAN,"US Midwest",10-K,2025-02-14,,"AMERICAN AXLE & MANUFACTURING HOLDINGS INC",1062231,"=""AXL""","ONE DAUCH DRIVE",,DETROIT,MI,MICHIGAN,"US Midwest",,,"=""3714""","Motor Vehicle Parts and Accessories",336350,"Motor Vehicle Transmission and Power Train Parts Manufacturing",34,6,12/31/24,"685,497,408",12/31/24,"6,124,900,000","35,000,000","-65,900,000","5,059,900,000"
41367,Goodwill,"Goodwill Impairment Analysis — Refer to Notes 1 and 3 to the consolidated financial statements",551341,12/31/24,02/14/25,3,"Deloitte & Touche LLP",,,,Detroit,MI,MICHIGAN,"US Midwest",10-K,2025-02-14,,"AMERICAN AXLE & MANUFACTURING HOLDINGS INC",1062231,"=""AXL""","ONE DAUCH DRIVE",,DETROIT,MI,MICHIGAN,"US Midwest",,,"=""3714""","Motor Vehicle Parts and Accessories",336350,"Motor Vehicle Transmission and Power Train Parts Manufacturing",34,6,12/31/24,"685,497,408",12/31/24,"6,124,900,000","35,000,000","-65,900,000","5,059,900,000"
39528,"Discontinued operations","Valuation of held for sale assets",541518,06/30/24,09/23/24,4,"KPMG LLP",,,,Portland,OR,OREGON,"US West",10-K,2024-09-23,Yes,"AMERICAN BATTERY TECHNOLOGY Co",1576873,"=""ABAT""","100 WASHINGTON STREET","SUITE 100",RENO,NV,NEVADA,"US West",,,"=""1400""","Mining & Quarrying of Nonmetallic Minerals (No Fuels)",212393,"Other Chemical and Fertilizer Mineral Mining",34,1,07/02/24,"64,457,944",06/30/24,"343,500","-52,501,824","56,948,602","77,675,132"
44556,"Insurance contract liabilities","Liability for Unpaid Losses and Loss Adjustment Expenses — Refer to Notes 2, 11 and 13 to the Financial Statements",556771,12/31/24,03/10/25,3,"Deloitte & Touche LLP",,,,Tampa,FL,FLORIDA,"US Southeast",10-K,2025-03-10,,"AMERICAN COASTAL INSURANCE Corp",1401521,"=""ACIC""","570 CARILLON PARKWAY","SUITE 100","SAINT PETERSBURG",FL,FLORIDA,"US Southeast",,,"=""6331""","Fire, Marine, and Casualty Insurance",524126,"Direct Property and Casualty Insurance Carriers",34,13,01/02/25,"613,649,152",12/31/24,"296,657,000","75,718,000","170,276,000","1,216,112,000"
46273,"Insurance contract liabilities","Liability for Unpaid Losses and Loss Adjustment Expenses - Refer to Notes 2, 11 and 13 to the Financial Statements",560417,12/31/24,03/10/25,3,"Deloitte & Touche LLP",,,,Tampa,FL,FLORIDA,"US Southeast",ARS,2025-04-02,,"AMERICAN COASTAL INSURANCE Corp",1401521,"=""ACIC""","570 CARILLON PARKWAY","SUITE 100","SAINT PETERSBURG",FL,FLORIDA,"US Southeast",,,"=""6331""","Fire, Marine, and Casualty Insurance",524126,"Direct Property and Casualty Insurance Carriers",34,13,01/02/25,"613,649,152",12/31/24,"296,657,000","75,718,000","170,276,000","1,216,112,000"
36163,Goodwill,"Quiet Goodwill Impairment",530298,02/03/24,03/15/24,2,"Ernst & Young LLP",,,,Pittsburgh,PA,PENNSYLVANIA,"US Mid Atlantic",10-K,2024-03-15,,"AMERICAN EAGLE OUTFITTERS INC",919012,"=""AEO""","77 HOT METAL STREET",,PITTSBURGH,PA,PENNSYLVANIA,"US Mid Atlantic",,,"=""5651""","Family Clothing Stores",448140,"Family Clothing Stores",34,21,02/05/24,"4,055,462,400",02/03/24,"5,261,770,000","170,038,000","1,465,347,000","3,557,909,000"
41265,"Regulatory assets and liabilities","Accounting for the Effects of Cost-Based Regulation",551234,12/31/24,02/13/25,1,"PricewaterhouseCoopers LLP",,,,Columbus,OH,OHIO,"US Midwest",10-K,2025-02-13,,"AMERICAN ELECTRIC POWER CO INC",4904,"=""AEP""","1 RIVERSIDE PLAZA",,COLUMBUS,OH,OHIO,"US Midwest",,,"=""4911""","Electric Services",221122,"Electric Power Distribution",34,92,12/31/24,"49,150,078,976",12/31/24,"19,721,300,000","2,967,100,000","26,929,100,000","103,078,000,000"
41266,"Derivatives and hedging","Valuation of Level 3 Energy Contracts",551234,12/31/24,02/13/25,1,"PricewaterhouseCoopers LLP",,,,Columbus,OH,OHIO,"US Midwest",10-K,2025-02-13,,"AMERICAN ELECTRIC POWER CO INC",4904,"=""AEP""","1 RIVERSIDE PLAZA",,COLUMBUS,OH,OHIO,"US Midwest",,,"=""4911""","Electric Services",221122,"Electric Power Distribution",34,92,12/31/24,"49,150,078,976",12/31/24,"19,721,300,000","2,967,100,000","26,929,100,000","103,078,000,000"
41267,"Asset retirement and environmental obligations","Incremental Asset Retirement Obligations arising from the Federal Environment Protection Agency’s (“Federal EPA”) Revised Coal Combustion Residuals (CCR) Rule",551234,12/31/24,02/13/25,1,"PricewaterhouseCoopers LLP",,,,Columbus,OH,OHIO,"US Midwest",10-K,2025-02-13,,"AMERICAN ELECTRIC POWER CO INC",4904,"=""AEP""","1 RIVERSIDE PLAZA",,COLUMBUS,OH,OHIO,"US Midwest",,,"=""4911""","Electric Services",221122,"Electric Power Distribution",34,92,12/31/24,"49,150,078,976",12/31/24,"19,721,300,000","2,967,100,000","26,929,100,000","103,078,000,000"
40793,"Allowance for credit losses","Reserves for Credit Losses on Card Member Loans",550428,12/31/24,02/07/25,1,"PricewaterhouseCoopers LLP",,,,"New York",NY,"NEW YORK","US Mid Atlantic",10-K,2025-02-07,,"AMERICAN EXPRESS CO",4962,"=""AXP""","200 VESEY STREET","50TH FLOOR","NEW YORK",NY,"NEW YORK","US Mid Atlantic",,,"=""6199""","Finance Services",523930,"Investment Advice",34,298,01/02/25,"210,227,494,912",12/31/24,"60,764,000,000","10,129,000,000",,"271,461,000,000"
40794,"Other liabilities and provisions","Membership Rewards Liability",550428,12/31/24,02/07/25,1,"PricewaterhouseCoopers LLP",,,,"New York",NY,"NEW YORK","US Mid Atlantic",10-K,2025-02-07,,"AMERICAN EXPRESS CO",4962,"=""AXP""","200 VESEY STREET","50TH FLOOR","NEW YORK",NY,"NEW YORK","US Mid Atlantic",,,"=""6199""","Finance Services",523930,"Investment Advice",34,298,01/02/25,"210,227,494,912",12/31/24,"60,764,000,000","10,129,000,000",,"271,461,000,000"
42880,"Other investments","Valuation of investments in fixed maturity securities",553081,12/31/24,02/25/25,2,"Ernst & Young LLP",,,,Cincinnati,OH,OHIO,"US Midwest",10-K,2025-02-25,,"AMERICAN FINANCIAL GROUP INC",1042046,"=""AFG""","GREAT AMERICAN INSURANCE GROUP TOWER","301 E. 4TH STREET",CINCINNATI,OH,OHIO,"US Midwest",,,"=""6331""","Fire, Marine, and Casualty Insurance",524126,"Direct Property and Casualty Insurance Carriers",34,135,01/02/25,"11,365,970,944",12/31/24,"8,324,000,000","887,000,000","4,161,000,000","30,836,000,000"
42881,"Insurance contract liabilities","Unpaid losses and loss adjustment expenses",553081,12/31/24,02/25/25,2,"Ernst & Young LLP",,,,Cincinnati,OH,OHIO,"US Midwest",10-K,2025-02-25,,"AMERICAN FINANCIAL GROUP INC",1042046,"=""AFG""","GREAT AMERICAN INSURANCE GROUP TOWER","301 E. 4TH STREET",CINCINNATI,OH,OHIO,"US Midwest",,,"=""6331""","Fire, Marine, and Casualty Insurance",524126,"Direct Property and Casualty Insurance Carriers",34,135,01/02/25,"11,365,970,944",12/31/24,"8,324,000,000","887,000,000","4,161,000,000","30,836,000,000"
43921,"Long-lived assets","Impairment of Long-Lived Assets relating to real estate investments, net — Refer to Notes 2 and 3 to the financial statements",554710,12/31/24,02/28/25,3,"Deloitte & Touche LLP",,,,"Costa Mesa",CA,CALIFORNIA,"US West",10-K,2025-02-28,,"American Healthcare REIT, Inc.",1632970,"=""AHR""","18191 VON KARMAN AVENUE","SUITE 300",IRVINE,CA,CALIFORNIA,"US West",,,"=""6798""","Real Estate Investment Trusts",525990,"Other Financial Vehicles",34,28,12/31/24,"4,474,635,264",12/31/24,"2,070,668,000","-37,812,000","1,865,036,000","4,488,057,000"
42282,"Business combinations","Purchase price accounting",552442,12/31/24,02/21/25,2,"Ernst & Young LLP",,,,"Los Angeles",CA,CALIFORNIA,"US West",10-K,2025-02-21,,"American Homes 4 Rent",1562401,"=""AMH""","280 PILOT ROAD",,"LAS VEGAS",NV,NEVADA,"US West",,,"=""6798""","Real Estate Investment Trusts",525990,"Other Financial Vehicles",34,37,01/02/25,"13,556,054,016",12/31/24,"1,728,697,000","412,426,000","7,039,737,000","13,381,151,000"
42284,"Business combinations","Purchase price accounting",552441,12/31/24,02/21/25,2,"Ernst & Young LLP",,,,"Los Angeles",CA,CALIFORNIA,"US West",10-K,2025-02-21,,"American Homes 4 Rent, L.P.",1716558,,"280 PILOT ROAD",,"LAS VEGAS",NV,NEVADA,"US West",1562401,"American Homes 4 Rent","=""6798""","Real Estate Investment Trusts",531110,"Lessors of Residential Buildings and Dwellings",34,,,,12/31/24,"1,728,697,000","468,142,000","7,728,351,000","13,381,151,000"
38641,"Allowance for credit losses","Allowance for expected credit losses on retail loans",537720,03/31/24,06/20/24,4,"KPMG LLP",,,,"Los Angeles",CA,CALIFORNIA,"US West",10-K,2024-06-20,,"AMERICAN HONDA FINANCE CORP",864270,,"1919 TORRANCE BLVD.",,TORRANCE,CA,CALIFORNIA,"US West",715153,"HONDA MOTOR CO LTD","=""6141""","Personal Credit Institutions",522291,"Consumer Lending",34,,,,03/31/24,"6,529,000,000","1,029,000,000",,"78,469,000,000"
38642,Leases,"Estimated early termination losses on operating lease assets",537720,03/31/24,06/20/24,4,"KPMG LLP",,,,"Los Angeles",CA,CALIFORNIA,"US West",10-K,2024-06-20,,"AMERICAN HONDA FINANCE CORP",864270,,"1919 TORRANCE BLVD.",,TORRANCE,CA,CALIFORNIA,"US West",715153,"HONDA MOTOR CO LTD","=""6141""","Personal Credit Institutions",522291,"Consumer Lending",34,,,,03/31/24,"6,529,000,000","1,029,000,000",,"78,469,000,000"
38643,Leases,"Estimated end of term residual values of leased vehicles",537720,03/31/24,06/20/24,4,"KPMG LLP",,,,"Los Angeles",CA,CALIFORNIA,"US West",10-K,2024-06-20,,"AMERICAN HONDA FINANCE CORP",864270,,"1919 TORRANCE BLVD.",,TORRANCE,CA,CALIFORNIA,"US West",715153,"HONDA MOTOR CO LTD","=""6141""","Personal Credit Institutions",522291,"Consumer Lending",34,,,,03/31/24,"6,529,000,000","1,029,000,000",,"78,469,000,000"
41295,"Insurance contract liabilities","Valuation of Insurance Liabilities - Unpaid Losses and Loss Adjustment Expenses (Loss Reserves), Net of Reinsurance",551250,12/31/24,02/13/25,1,"PricewaterhouseCoopers LLP",,,,"New York",NY,"NEW YORK","US Mid Atlantic",10-K,2025-02-13,,"AMERICAN INTERNATIONAL GROUP, INC.",5272,"=""AIG""","1271 AVE OF THE AMERICAS","FL 37","NEW YORK",NY,"NEW YORK","US Mid Atlantic",,,"=""6331""","Fire, Marine, and Casualty Insurance",524130,"Reinsurance Carriers",34,73,01/02/25,"45,522,690,048",12/31/24,"27,251,000,000","-1,404,000,000","39,148,000,000","161,322,000,000"
46220,"Business combinations","Acquisitions – Certain Assumptions Used in the Value of Business Acquired – Refer to Notes 2 and 16 to the financial statements",559663,12/31/24,03/31/25,3,"Deloitte & Touche LLP",,,,Houston,TX,TEXAS,"US Southwest",10-K,2025-03-31,,"American National Group Inc.",1039828,"=""AEL.A""","6000 WESTOWN PARKWAY",,"WEST DES MOINES",IA,IOWA,"US Midwest",,,"=""6311""","Life Insurance",524113,"Direct Life Insurance Carriers",34,,,,12/31/24,"9,503,000,000","729,000,000","7,622,000,000","121,221,000,000"
46221,"Insurance contract liabilities","Policy and Contract Claims — Refer to Notes 2 and 20 to the financial statements",559663,12/31/24,03/31/25,3,"Deloitte & Touche LLP",,,,Houston,TX,TEXAS,"US Southwest",10-K,2025-03-31,,"American National Group Inc.",1039828,"=""AEL.A""","6000 WESTOWN PARKWAY",,"WEST DES MOINES",IA,IOWA,"US Midwest",,,"=""6311""","Life Insurance",524113,"Direct Life Insurance Carriers",34,,,,12/31/24,"9,503,000,000","729,000,000","7,622,000,000","121,221,000,000"
46222,"Insurance contract liabilities","Policyholders’ Account Balances-Fixed Annuity Contracts – Valuation of embedded derivative liability and market risk benefits— Refer to Notes 2, 9, 11, 18 and 19 to the financial statements",559663,12/31/24,03/31/25,3,"Deloitte & Touche LLP",,,,Houston,TX,TEXAS,"US Southwest",10-K,2025-03-31,,"American National Group Inc.",1039828,"=""AEL.A""","6000 WESTOWN PARKWAY",,"WEST DES MOINES",IA,IOWA,"US Midwest",,,"=""6311""","Life Insurance",524113,"Direct Life Insurance Carriers",34,,,,12/31/24,"9,503,000,000","729,000,000","7,622,000,000","121,221,000,000"
45707,"Accounts/loans receivable","Valuation of Patient Services Accounts Receivable - Allowance for Contractual Adjustments",559164,12/31/24,03/27/25,1,"PricewaterhouseCoopers LLP",,,,Nashville,TN,TENNESSEE,"US Southeast",10-K,2025-03-27,,"American Oncology Network, Inc.",1839998,"=""AONC""","14543 GLOBAL PKWY #110",,"FORT MYERS",FL,FLORIDA,"US Southeast",,,"=""8000""","Services-Health Services",621111,"Offices of Physicians (except Mental Health Specialists)",34,5,12/31/24,"152,775,808",12/31/24,"1,759,484,000","-3,973,000","93,047,000","470,328,000"
44341,"Goodwill and intangible assets","Goodwill and Intangible Assets — Rasmussen University Reporting Unit — Refer to Notes 2 and 7 to the financial statements",555816,12/31/24,03/06/25,3,"Deloitte & Touche LLP",,,,McLean,VA,VIRGINIA,"US Mid Atlantic",10-K,2025-03-06,,"AMERICAN PUBLIC EDUCATION INC",1201792,"=""APEI""","111 W CONGRESS STREET",,"CHARLES TOWN",WV,"WEST VIRGINIA","US Mid Atlantic",,,"=""8200""","Services-Educational Services",923110,"Administration of Education Programs",34,21,01/02/25,"375,495,488",12/31/24,"624,559,000","16,113,000","216,065,000","570,103,000"
41737,"Regulatory assets and liabilities","Accounting for the Effects of Regulatory Matters",551877,12/31/24,02/19/25,1,"PricewaterhouseCoopers LLP",,,,"Los Angeles",CA,CALIFORNIA,"US West",10-K,2025-02-19,,"AMERICAN STATES WATER CO",1056903,"=""AWR""","630 E FOOTHILL BLVD",,"SAN DIMAS",CA,CALIFORNIA,"US West",,,"=""4941""","Water Supply",221310,"Water Supply and Irrigation Systems",34,78,12/31/24,"2,965,097,728",12/31/24,"595,459,000","119,268,000",,"2,500,209,000"
45241,"Long-lived assets","Impairment Assessment of Real Estate Investments, including Acquired Intangible Assets and Below-Market Lease Liabilities",558073,12/31/24,03/19/25,1,"PricewaterhouseCoopers LLP",,,,"New York",NY,"NEW YORK","US Mid Atlantic",10-K,2025-03-19,,"American Strategic Investment Co.",1595527,"=""NYC""","222 BELLEVUE AVENUE",,NEWPORT,RI,"RHODE ISLAND","US New England",,,"=""6798""","Real Estate Investment Trusts",531120,"Lessors of Nonresidential Buildings (except Miniwarehouses)",34,9,01/02/25,"23,116,154",12/31/24,"61,570,000","-140,591,000","66,523,000","507,066,000"
42633,"Other intangible assets","Change in estimated useful life of tower assets - Refer to Notes 1, 3, 4, and 5 to the financial statements.",553082,12/31/24,02/25/25,3,"Deloitte & Touche LLP",,,,Boston,MA,MASSACHUSETTS,"US New England",10-K,2025-02-25,,"AMERICAN TOWER CORP /MA/",1053507,"=""AMT""","116 HUNTINGTON AVE",,BOSTON,MA,MASSACHUSETTS,"US New England",,,"=""6798""","Real Estate Investment Trusts",525930,"Real Estate Investment Trusts",34,183,12/31/24,"85,722,816,512",12/31/24,"10,127,200,000","2,255,000,000","-22,860,200,000","61,077,400,000"
47567,"Sales return and allowances","Accrued Program Costs — Refer to Note 1 to the financial statements",565926,12/31/24,05/28/25,3,"Deloitte & Touche LLP",,,,"Costa Mesa",CA,CALIFORNIA,"US West",10-K,2025-05-29,,"AMERICAN VANGUARD CORP",5981,"=""AVD""","4695 MACARTHUR COURT",,"NEWPORT BEACH",CA,CALIFORNIA,"US West",,,"=""2870""","Agricultural Chemicals",325320,"Pesticide and Other Agricultural Chemical Manufacturing",34,5,12/31/24,"133,711,464",12/31/24,"547,306,000","-126,340,000","62,912,000","636,721,000"
47568,Goodwill,"Goodwill — International Reporting Unit — Refer to Notes 1 and 9 to the financial statements",565926,12/31/24,05/28/25,3,"Deloitte & Touche LLP",,,,"Costa Mesa",CA,CALIFORNIA,"US West",10-K,2025-05-29,,"AMERICAN VANGUARD CORP",5981,"=""AVD""","4695 MACARTHUR COURT",,"NEWPORT BEACH",CA,CALIFORNIA,"US West",,,"=""2870""","Agricultural Chemicals",325320,"Pesticide and Other Agricultural Chemical Manufacturing",34,5,12/31/24,"133,711,464",12/31/24,"547,306,000","-126,340,000","62,912,000","636,721,000"
41769,"Regulatory assets and liabilities","Accounting for the Effects of Rate Regulation",551907,12/31/24,02/19/25,1,"PricewaterhouseCoopers LLP",,,,Philadelphia,PA,PENNSYLVANIA,"US Mid Atlantic",10-K,2025-02-19,,"American Water Works Company, Inc.",1410636,"=""AWK""","1 WATER STREET",,CAMDEN,NJ,"NEW JERSEY","US Mid Atlantic",,,"=""4941""","Water Supply",221310,"Water Supply and Irrigation Systems",34,124,12/31/24,"24,265,650,176",12/31/24,"4,684,000,000","1,051,000,000","9,191,000,000","32,830,000,000"
40915,"Revenue from customer contracts","Revenue Recognition - Platform Subscription and Visits",550859,12/31/24,02/12/25,1,"PricewaterhouseCoopers LLP",,,,Boston,MA,MASSACHUSETTS,"US New England",10-K,2025-02-12,,"American Well Corp",1393584,"=""AMWL""","75 STATE STREET","26TH FLOOR",Boston,MA,MASSACHUSETTS,"US New England",,,"=""7389""","Business Services, NEC",923120,"Administration of Public Health Programs",34,7,12/31/24,"100,940,856",12/31/24,"254,364,000","-208,143,000","203,234,000","435,968,000"
38713,"Revenue from customer contracts","Timing of Revenue Recognition",538011,04/30/24,06/26/24,2,"Ernst & Young LLP",,,,Richmond,VA,VIRGINIA,"US Mid Atlantic",10-K,2024-06-26,,"AMERICAN WOODMARK CORP",794619,"=""AMWD""","3102 SHAWNEE DRIVE",,WINCHESTER,VA,VIRGINIA,"US Mid Atlantic",,,"=""2430""","Millwood, Veneer, Plywood, & Structural Wood Members",337110,"Wood Kitchen Cabinet and Countertop Manufacturing",34,93,05/02/24,"1,479,476,352",04/30/24,"1,847,502,000","116,216,000","142,764,000","1,593,865,000"
43209,Goodwill,"Test of Goodwill for Impairment",553846,12/31/24,02/27/25,2,"Ernst & Young LLP",,,,Atlanta,GA,GEORGIA,"US Southeast",10-K,2025-02-27,,"AMERICOLD REALTY TRUST",1455863,"=""COLD""","10 Glenlake Pkwy., Suite 800 S. Tower",,Atlanta,GA,GEORGIA,"US Southeast",,,"=""6798""","Real Estate Investment Trusts",525990,"Other Financial Vehicles",34,21,01/02/25,"6,068,913,664",12/31/24,"2,666,541,000","-94,313,000","1,658,086,000","7,735,954,000"
42164,"Other investments","Valuation of Level 2 Available-for-Sale Securities",552302,12/31/24,02/20/25,1,"PricewaterhouseCoopers LLP",,,,Minneapolis,MN,MINNESOTA,"US Midwest",10-K,2025-02-20,,"AMERIPRISE CERTIFICATE CO",52428,,"50606 AMERIPRISE FINANCIAL CENTER",,MINNEAPOLIS,MN,MINNESOTA,"US Midwest",820027,"AMERIPRISE FINANCIAL INC",,,525990,"Other Financial Vehicles",34,,,,12/31/24,"743,868,000","109,083,000","601,255,000","12,001,473,000"
42039,"Insurance contract liabilities","Valuation of market risk benefits",552194,12/31/24,02/20/25,1,"PricewaterhouseCoopers LLP",,,,Minneapolis,MN,MINNESOTA,"US Midwest",10-K,2025-02-20,,"AMERIPRISE FINANCIAL INC",820027,"=""AMP""","1099 AMERIPRISE FINANCIAL CENTER",,MINNEAPOLIS,MN,MINNESOTA,"US Midwest",,,"=""6282""","Investment Advice",523930,"Investment Advice",34,530,01/02/25,"51,413,839,872",12/31/24,"17,926,000,000","3,401,000,000",,"181,403,000,000"
43834,"Allowance for credit losses","Quantitative component of the allowance for credit losses on loans evaluated on a collective basis",554606,12/31/24,02/28/25,4,"KPMG LLP",,,,Atlanta,GA,GEORGIA,"US Southeast",10-K,2025-02-28,,"Ameris Bancorp",351569,"=""ABCB""","3490 PIEDMONT RD","SUITE 1550",ATLANTA,GA,GEORGIA,"US Southeast",,,"=""6022""","State Commercial Banks",522110,"Commercial Banking",34,61,01/02/25,"4,212,379,904",12/31/24,"1,083,654,000","358,685,000","2,665,115,000","26,262,050,000"
43723,"Insurance contract liabilities","Valuation of Loss and Loss Adjustment Expense reserves",554408,12/31/24,02/28/25,2,"Ernst & Young LLP",,,,"New Orleans",LA,LOUISIANA,"US Southeast",10-K,2025-02-28,,"AMERISAFE INC",1018979,"=""AMSF""","2301 HIGHWAY 190 WEST",,DERIDDER,LA,LOUISIANA,"US Southeast",,,"=""6331""","Fire, Marine, and Casualty Insurance",524126,"Direct Property and Casualty Insurance Carriers",34,51,01/02/25,"976,120,448",12/31/24,"309,043,000","55,436,000",,"1,157,791,000"
41929,"Other intangible assets","Impairment Assessment of Indefinite-Lived Intangible Assets (other than Goodwill)",552057,12/31/24,02/20/25,2,"Ernst & Young LLP",,,,Philadelphia,PA,PENNSYLVANIA,"US Mid Atlantic",10-K,2025-02-20,,"AMETEK INC/",1037868,"=""AME""","1100 CASSATT ROAD",,BERWYN,PA,PENNSYLVANIA,"US Mid Atlantic",,,"=""3823""","Industrial Instruments for Measurement, Display, and Control of Process Variables; and Related Products",335312,"Motor and Generator Manufacturing",34,178,01/02/25,"41,249,099,776",12/31/24,"6,941,180,000","1,376,124,000","-815,746,000","14,631,169,000"
41930,"Business combinations","Estimating the Fair Value of the Intangibles from the Acquisition of Paragon Medical",552057,12/31/24,02/20/25,2,"Ernst & Young LLP",,,,Philadelphia,PA,PENNSYLVANIA,"US Mid Atlantic",10-K,2025-02-20,,"AMETEK INC/",1037868,"=""AME""","1100 CASSATT ROAD",,BERWYN,PA,PENNSYLVANIA,"US Mid Atlantic",,,"=""3823""","Industrial Instruments for Measurement, Display, and Control of Process Variables; and Related Products",335312,"Motor and Generator Manufacturing",34,178,01/02/25,"41,249,099,776",12/31/24,"6,941,180,000","1,376,124,000","-815,746,000","14,631,169,000"
41485,"Sales return and allowances","Sales deductions",551467,12/31/24,02/14/25,2,"Ernst & Young LLP",,,,"Los Angeles",CA,CALIFORNIA,"US West",10-K,2025-02-14,,"AMGEN INC",318154,"=""AMGN""","ONE AMGEN CENTER DRIVE",,"THOUSAND OAKS",CA,CALIFORNIA,"US West",,,"=""2836""","Biological Products, Except Diagnostic Substances",325414,"Biological Product (except Diagnostic) Manufacturing",34,259,01/02/25,"139,371,479,040",12/31/24,"33,424,000,000","4,090,000,000","-40,459,000,000","91,839,000,000"
41486,"Uncertain tax positions","Unrecognized tax benefits",551467,12/31/24,02/14/25,2,"Ernst & Young LLP",,,,"Los Angeles",CA,CALIFORNIA,"US West",10-K,2025-02-14,,"AMGEN INC",318154,"=""AMGN""","ONE AMGEN CENTER DRIVE",,"THOUSAND OAKS",CA,CALIFORNIA,"US West",,,"=""2836""","Biological Products, Except Diagnostic Substances",325414,"Biological Product (except Diagnostic) Manufacturing",34,259,01/02/25,"139,371,479,040",12/31/24,"33,424,000,000","4,090,000,000","-40,459,000,000","91,839,000,000"
41800,"Sales return and allowances","Revenue recognition – Measurement of variable consideration
for Ex-U.S. third-party discounts and rebates",551889,12/31/24,02/19/25,2,"Ernst & Young LLP",,,,Iselin,NJ,"NEW JERSEY","US Mid Atlantic",10-K,2025-02-19,,"AMICUS THERAPEUTICS, INC.",1178879,"=""FOLD""","47 HULFISH STREET",,PRINCETON,NJ,"NEW JERSEY","US Mid Atlantic",,,"=""2834""","Pharmaceutical Preparations",325412,"Pharmaceutical Preparation Manufacturing",34,9,12/31/24,"2,816,972,288",12/31/24,"528,295,000","-56,106,000","-20,950,000","785,033,000"
42438,"Other income taxes","Accounting for Income Taxes",552398,12/31/24,02/21/25,1,"PricewaterhouseCoopers LLP",,,,Phoenix,AZ,ARIZONA,"US Southwest",10-K,2025-02-21,,"AMKOR TECHNOLOGY, INC.",1047127,"=""AMKR""","2045 EAST INNOVATION CIRCLE",,TEMPE,AZ,ARIZONA,"US Southwest",,,"=""3674""","Semiconductors and Related Devices",334515,"Instrument Manufacturing for Measuring and Testing Electricity and Electrical Signals",34,26,01/02/25,"6,414,874,112",12/31/24,"6,317,692,000","354,012,000","4,131,598,000","6,944,328,000"
42330,"Other contingent liabilities","Professional liability reserve",552405,12/31/24,02/20/25,4,"KPMG LLP",,,,"San Diego",CA,CALIFORNIA,"US West",10-K,2025-02-21,,"AMN HEALTHCARE SERVICES INC",1142750,"=""AMN""","2999 OLYMPUS BOULEVARD","SUITE 500",DALLAS,TX,TEXAS,"US Southwest",,,"=""7363""","Help Supply Services",561310,"Employment Placement Agencies",34,24,12/31/24,"910,849,664",12/31/24,"2,983,781,000","-146,979,000","-572,200,000","2,415,727,000"
42331,Goodwill,"Goodwill impairment assessment of the nurse and allied solutions and physician and leadership solutions reporting units",552405,12/31/24,02/20/25,4,"KPMG LLP",,,,"San Diego",CA,CALIFORNIA,"US West",10-K,2025-02-21,,"AMN HEALTHCARE SERVICES INC",1142750,"=""AMN""","2999 OLYMPUS BOULEVARD","SUITE 500",DALLAS,TX,TEXAS,"US Southwest",,,"=""7363""","Help Supply Services",561310,"Employment Placement Agencies",34,24,12/31/24,"910,849,664",12/31/24,"2,983,781,000","-146,979,000","-572,200,000","2,415,727,000"
44014,"Sales return and allowances","Medicaid Rebates",554527,12/31/24,02/28/25,2,"Ernst & Young LLP",,,,Iselin,NJ,"NEW JERSEY","US Mid Atlantic",10-K,2025-02-28,,"Amneal Pharmaceuticals, Inc.",1723128,"=""AMRX""","30831 HUNTWOOD AVE",,HAYWARD,CA,CALIFORNIA,"US West",,,"=""2834""","Pharmaceutical Preparations",325412,"Pharmaceutical Preparation Manufacturing",34,8,12/31/24,"2,454,257,408",12/31/24,"2,793,957,000","-116,886,000","-1,374,106,000","3,501,445,000"
44015,"Sales return and allowances","Sales Returns",554527,12/31/24,02/28/25,2,"Ernst & Young LLP",,,,Iselin,NJ,"NEW JERSEY","US Mid Atlantic",10-K,2025-02-28,,"Amneal Pharmaceuticals, Inc.",1723128,"=""AMRX""","30831 HUNTWOOD AVE",,HAYWARD,CA,CALIFORNIA,"US West",,,"=""2834""","Pharmaceutical Preparations",325412,"Pharmaceutical Preparation Manufacturing",34,8,12/31/24,"2,454,257,408",12/31/24,"2,793,957,000","-116,886,000","-1,374,106,000","3,501,445,000"
44037,"Sales return and allowances","Provision for chargebacks estimate",554984,12/31/24,03/03/25,2,"Ernst & Young LLP",,,,Irvine,CA,CALIFORNIA,"US West",10-K,2025-03-03,,"Amphastar Pharmaceuticals, Inc.",1297184,"=""AMPH""","11570 SIXTH STREET",,"RANCHO CUCAMONGA",CA,CALIFORNIA,"US West",,,"=""2834""","Pharmaceutical Preparations",325412,"Pharmaceutical Preparation Manufacturing",34,36,01/02/25,"1,748,240,896",12/31/24,"731,967,000","159,519,000","141,638,000","1,577,470,000"
44038,Inventory,"Estimated selling price impacting the Enoxaparin inventory lower of cost or net realizable value",554984,12/31/24,03/03/25,2,"Ernst & Young LLP",,,,Irvine,CA,CALIFORNIA,"US West",10-K,2025-03-03,,"Amphastar Pharmaceuticals, Inc.",1297184,"=""AMPH""","11570 SIXTH STREET",,"RANCHO CUCAMONGA",CA,CALIFORNIA,"US West",,,"=""2834""","Pharmaceutical Preparations",325412,"Pharmaceutical Preparation Manufacturing",34,36,01/02/25,"1,748,240,896",12/31/24,"731,967,000","159,519,000","141,638,000","1,577,470,000"
40801,"Uncertain tax positions","Income Taxes — Unrecognized Tax Benefits — Refer to Notes 1 and 6 to the financial statements",550422,12/31/24,02/07/25,3,"Deloitte & Touche LLP",,,,Hartford,CT,CONNECTICUT,"US New England",10-K,2025-02-07,,"AMPHENOL CORP /DE/",820313,"=""APH""","358 HALL AVE",,WALLINGFORD,CT,CONNECTICUT,"US New England",,,"=""3678""","Electronic Connectors",334417,"Electronic Connector Manufacturing",34,69,01/02/25,"83,199,344,640",12/31/24,"15,222,700,000","2,424,000,000","339,400,000","21,440,200,000"
44323,"Proven and unproven reserves","Oil and Natural Gas Properties, Depletion – Oil and Natural Gas Reserve Quantities as used in the calculation of DD&A— Refer to Note 2 to the financial statements.",555456,12/31/24,03/05/25,3,"Deloitte & Touche LLP",,,,Houston,TX,TEXAS,"US Southwest",10-K,2025-03-05,,"Amplify Energy Corp.",1533924,"=""AMPY""","500 DALLAS STREET","SUITE 1700",,TX,TEXAS,"US Southwest",,,"=""1311""","Crude Petroleum and Natural Gas",211111,"Crude Petroleum and Natural Gas Extraction",34,6,12/31/24,"238,770,832",12/31/24,"294,681,000","12,946,000",,"747,076,000"
42084,"Revenue from customer contracts","Revenue arrangements with non-standard terms and conditions",552225,12/31/24,02/20/25,4,"KPMG LLP",,,,"Santa Clara",CA,CALIFORNIA,"US West",10-K,2025-02-20,,"Amplitude, Inc.",1866692,"=""AMPL""","201 THIRD STREET, SUITE 200",,"SAN FRANCISCO",CA,CALIFORNIA,"US West",,,"=""7372""","Prepackaged Software",511210,"Software Publishers",34,11,12/31/24,"1,013,802,240",12/31/24,"299,272,000","-94,319,000","267,822,000","445,911,000"
43952,Goodwill,"Building Envelope Goodwill Impairment Test",554882,12/31/24,02/27/25,2,"Ernst & Young LLP",56,"Ernst & Young AG",1460,Zurich,V8,SWITZERLAND,Foreign,10-12B,2025-02-28,,"Amrize Ltd",2035989,"=""AMRZ""","GRAFENAUWEG 8",,ZUG,V8,SWITZERLAND,Foreign,,,"=""3241""","Cement, Hydraulic",,,34,,,,12/31/24,,,"-834,000,000","23,805,000,000"
47301,Goodwill,"Building Envelope Goodwill Impairment Test",564513,12/31/24,02/27/25,2,"Ernst & Young LLP",56,"Ernst & Young AG",1460,Zurich,V8,SWITZERLAND,Foreign,10-12B/A,2025-05-07,,"Amrize Ltd",2035989,"=""AMRZ""","GRAFENAUWEG 8",,ZUG,V8,SWITZERLAND,Foreign,,,"=""3241""","Cement, Hydraulic",,,34,,,,12/31/24,,,"-834,000,000","23,805,000,000"
47619,Goodwill,"Building Envelope Goodwill Impairment Test",566163,12/31/24,02/27/25,2,"Ernst & Young LLP",56,"Ernst & Young AG",1460,Zurich,V8,SWITZERLAND,Foreign,8-K,2025-06-02,,"Amrize Ltd",2035989,"=""AMRZ""","GRAFENAUWEG 8",,ZUG,V8,SWITZERLAND,Foreign,,,"=""3241""","Cement, Hydraulic",,,34,,,,12/31/24,,,"-834,000,000","23,805,000,000"
48697,Goodwill,"Building Envelope Goodwill Impairment Test",574754,12/31/24,02/27/25,2,"Ernst & Young LLP",56,"Ernst & Young AG",1460,Zurich,V8,SWITZERLAND,Foreign,S-4,2025-10-30,,"Amrize Ltd",2035989,"=""AMRZ""","GRAFENAUWEG 8",,ZUG,V8,SWITZERLAND,Foreign,,,"=""3241""","Cement, Hydraulic",,,34,,,,12/31/24,,,"-834,000,000","23,805,000,000"
48855,Goodwill,"Building Envelope Goodwill Impairment Test",575825,12/31/24,02/27/25,2,"Ernst & Young LLP",56,"Ernst & Young AG",1460,Zurich,V8,SWITZERLAND,Foreign,424B3,2025-11-19,,"Amrize Ltd",2035989,"=""AMRZ""","GRAFENAUWEG 8",,ZUG,V8,SWITZERLAND,Foreign,,,"=""3241""","Cement, Hydraulic",,,34,,,,12/31/24,,,"-834,000,000","23,805,000,000"
40242,"Other intangible assets","Valuation of Entrepix Inc. developed technology intangible asset",545384,09/30/24,12/12/24,4,"KPMG LLP",,,,Phoenix,AZ,ARIZONA,"US Southwest",10-K,2024-12-12,,"AMTECH SYSTEMS INC",720500,"=""ASYS""","58 S RIVER DRIVE SUITE 370",,TEMPE,AZ,ARIZONA,"US Southwest",,,"=""3559""","Special  Industry Machinery, NEC",333295,"Semiconductor Machinery Manufacturing",34,6,10/02/24,"82,326,824",09/30/24,"101,214,000","-8,486,000","57,093,000","118,953,000"
40243,Goodwill,"Valuation of the Semiconductor Fabrication Solutions reporting unit",545384,09/30/24,12/12/24,4,"KPMG LLP",,,,Phoenix,AZ,ARIZONA,"US Southwest",10-K,2024-12-12,,"AMTECH SYSTEMS INC",720500,"=""ASYS""","58 S RIVER DRIVE SUITE 370",,TEMPE,AZ,ARIZONA,"US Southwest",,,"=""3559""","Special  Industry Machinery, NEC",333295,"Semiconductor Machinery Manufacturing",34,6,10/02/24,"82,326,824",09/30/24,"101,214,000","-8,486,000","57,093,000","118,953,000"
40110,"Revenue from customer contracts","Revenue Recognition – Measuring Price Protection Credits",544467,11/02/24,11/26/24,2,"Ernst & Young LLP",,,,Boston,MA,MASSACHUSETTS,"US New England",10-K,2024-11-26,,"ANALOG DEVICES INC",6281,"=""ADI""","ONE ANALOG WAY",,WILMINGTON,MA,MASSACHUSETTS,"US New England",,,"=""3674""","Semiconductors and Related Devices",334413,"Semiconductor and Related Device Manufacturing",34,224,11/04/24,"111,308,865,536",11/02/24,"9,427,157,000","1,635,273,000","-1,318,922,000","48,228,277,000"
43250,"Research and development expenses","Evaluation of Research and Development Costs",553933,12/31/24,02/27/25,4,"KPMG LLP",,,,"San Diego",CA,CALIFORNIA,"US West",10-K,2025-02-27,,"ANAPTYSBIO, INC",1370053,"=""ANAB""","10770 WATERIDGE CIRCLE, SUITE 210",,"SAN DIEGO",CA,CALIFORNIA,"US West",,,"=""2834""","Pharmaceutical Preparations",325412,"Pharmaceutical Preparation Manufacturing",34,13,12/31/24,"403,462,528",12/31/24,"91,280,000","-145,231,000",,"483,834,000"
41836,Goodwill,"Goodwill — GSM and FSI Reporting Units — Refer to Notes 1 and 16 to the consolidated financial statements",551973,12/31/24,02/19/25,3,"Deloitte & Touche LLP",,,,Cleveland,OH,OHIO,"US Midwest",10-K,2025-02-19,,"Andersons, Inc.",821026,"=""ANDE""","1947 BRIARFIELD BOULEVARD",,MAUMEE,OH,OHIO,"US Midwest",,,"=""5150""","Wholesale-Farm Product Raw Materials",493130,"Farm Product Warehousing and Storage",34,41,12/31/24,"1,378,206,720",12/31/24,"11,257,548,000","114,012,000","1,168,985,000","4,121,314,000"
45573,"Goodwill and intangible assets","Intangible Assets with Indefinite Useful Life (Distribution rights) and Goodwill Impairment Assessment",558929,12/31/24,03/25/25,1,"PricewaterhouseCoopers LLP",93,"PricewaterhouseCoopers Consultores Auditores y Compania Limitada",1364,Santiago,F3,CHILE,Foreign,20-F,2025-03-26,,"ANDINA BOTTLING CO INC",925261,"=""AKO.A""","AVENIDA EL GOLF 40, PISO 4","LAS CONDES",SANTIAGO,F3,CHILE,Foreign,,,"=""2086""","Bottled and Canned Soft Drinks and Carbonated Waters",312111,"Soft Drink Manufacturing",34,15,01/02/25,"6,876,893,696",12/31/24,"3,241,983,000","235,936,000","139,105,000","3,309,222,000"
45458,"Other investments","Assessment of the valuation of residential mortgage loans at fair value",558525,12/31/24,03/24/25,4,"KPMG LLP",,,,Atlanta,GA,GEORGIA,"US Southeast",10-K,2025-03-24,,"Angel Oak Mortgage REIT, Inc.",1766478,"=""AOMD""","3344 PEACHTREE ROAD NE","SUITE 1725",ATLANTA,GA,GEORGIA,"US Southeast",,,"=""6500""","Real Estate",531390,"Other Activities Related to Real Estate",34,25,01/02/25,"597,421,440",12/31/24,"51,458,000","28,750,000",,"2,269,769,000"
43899,"Revenue from customer contracts","Revenue Processed by Highly Automated Proprietary Systems – Consumer Connection Revenue",554725,12/31/24,02/28/25,2,"Ernst & Young LLP",,,,"New York",NY,"NEW YORK","US Mid Atlantic",10-K,2025-02-28,,"Angi Inc.",1705110,"=""ANGI""","555 WEST 18TH STREET",,"NEW YORK",NY,"NEW YORK","US Mid Atlantic",,,"=""7310""",Services-Advertising,541870,"Advertising Material Distribution Services",34,2,01/02/25,"121,904,656",12/31/24,"1,185,112,000","36,004,000","11,699,000","1,830,735,000"
43900,Goodwill,"Valuation of Goodwill",554725,12/31/24,02/28/25,2,"Ernst & Young LLP",,,,"New York",NY,"NEW YORK","US Mid Atlantic",10-K,2025-02-28,,"Angi Inc.",1705110,"=""ANGI""","555 WEST 18TH STREET",,"NEW YORK",NY,"NEW YORK","US Mid Atlantic",,,"=""7310""",Services-Advertising,541870,"Advertising Material Distribution Services",34,2,01/02/25,"121,904,656",12/31/24,"1,185,112,000","36,004,000","11,699,000","1,830,735,000"
38927,Inventory,"Inventories – Excess Quantities and Obsolescence — Refer to Notes 1 & 6",539135,05/31/24,07/25/24,3,"Deloitte & Touche LLP",,,,Boston,MA,MASSACHUSETTS,"US New England",10-K,2024-07-25,,"ANGIODYNAMICS INC",1275187,"=""ANGO""","14 PLAZA DRIVE",,LATHAM,NY,"NEW YORK","US Mid Atlantic",,,"=""3841""","Surgical and Medical Instruments and Apparatus",334510,"Electromedical and Electrotherapeutic Apparatus Manufacturing",34,6,05/29/24,"245,534,288",05/31/24,"303,914,000","-184,349,000","128,203,000","317,671,000"
38928,Goodwill,"Goodwill - Valuation of Goodwill for the Med Tech Reporting Unit - Refer to Notes 1 & 9",539135,05/31/24,07/25/24,3,"Deloitte & Touche LLP",,,,Boston,MA,MASSACHUSETTS,"US New England",10-K,2024-07-25,,"ANGIODYNAMICS INC",1275187,"=""ANGO""","14 PLAZA DRIVE",,LATHAM,NY,"NEW YORK","US Mid Atlantic",,,"=""3841""","Surgical and Medical Instruments and Apparatus",334510,"Electromedical and Electrotherapeutic Apparatus Manufacturing",34,6,05/29/24,"245,534,288",05/31/24,"303,914,000","-184,349,000","128,203,000","317,671,000"
46741,"Business combinations","Acquisition of Centamin plc",561563,12/31/24,04/15/25,1,"PricewaterhouseCoopers LLP",116,"PricewaterhouseCoopers Incorporated",1308,Johannesburg,T3,"SOUTH AFRICA",Foreign,20-F,2025-04-15,,"AngloGold Ashanti PLC",1973832,"=""AU""","THIRD FLOOR, HOBHOUSE COURT","SUFFOLK STREET",LONDON,X0,"UNITED KINGDOM",Foreign,,,"=""1040""","Metal Mining",212221,"Gold Ore Mining",34,23,12/31/24,,12/31/24,"5,793,000,000",,,"12,963,000,000"
46742,"Asset retirement and environmental obligations","Environmental rehabilitation provisions",561563,12/31/24,04/15/25,1,"PricewaterhouseCoopers LLP",116,"PricewaterhouseCoopers Incorporated",1308,Johannesburg,T3,"SOUTH AFRICA",Foreign,20-F,2025-04-15,,"AngloGold Ashanti PLC",1973832,"=""AU""","THIRD FLOOR, HOBHOUSE COURT","SUFFOLK STREET",LONDON,X0,"UNITED KINGDOM",Foreign,,,"=""1040""","Metal Mining",212221,"Gold Ore Mining",34,23,12/31/24,,12/31/24,"5,793,000,000",,,"12,963,000,000"
44719,"Goodwill and intangible assets","Impairment of goodwill and intangible assets with indefinite useful life",557167,12/31/24,03/12/25,1,"PricewaterhouseCoopers LLP",507,"PricewaterhouseCoopers Reviseurs d’Entreprises",1350,Diegem,C9,BELGIUM,Foreign,20-F,2025-03-12,,"Anheuser-Busch InBev SA/NV",1668717,"=""BUD""","BROUWERIJPLEIN 1",,LEUVEN,C9,BELGIUM,Foreign,,,"=""2082""","Malt Beverages",312120,Breweries,34,50,12/31/24,"87,792,140,288",12/31/24,"59,768,000,000","7,417,000,000","-72,275,000,000","206,638,000,000"
44720,"Uncertain tax positions","Uncertain tax positions",557167,12/31/24,03/12/25,1,"PricewaterhouseCoopers LLP",507,"PricewaterhouseCoopers Reviseurs d’Entreprises",1350,Diegem,C9,BELGIUM,Foreign,20-F,2025-03-12,,"Anheuser-Busch InBev SA/NV",1668717,"=""BUD""","BROUWERIJPLEIN 1",,LEUVEN,C9,BELGIUM,Foreign,,,"=""2082""","Malt Beverages",312120,Breweries,34,50,12/31/24,"87,792,140,288",12/31/24,"59,768,000,000","7,417,000,000","-72,275,000,000","206,638,000,000"
45052,Inventory,"Reserve for Excess and Obsolete Inventories — Refer to Notes 2 and 5 to the financial statements",557738,12/31/24,03/14/25,3,"Deloitte & Touche LLP",,,,Boston,MA,MASSACHUSETTS,"US New England",10-K,2025-03-17,,"Anika Therapeutics, Inc.",898437,"=""ANIK""","32 WIGGINS AVENUE",,BEDFORD,MA,MASSACHUSETTS,"US New England",,,"=""3841""","Surgical and Medical Instruments and Apparatus",325414,"Biological Product (except Diagnostic) Manufacturing",34,16,01/02/25,"237,405,104",12/31/24,"119,907,000","-56,385,000","144,374,000","202,740,000"
41050,"Other investments","Valuation of mortgage servicing rights",551059,12/31/24,02/13/25,2,"Ernst & Young LLP",,,,"New York",NY,"NEW YORK","US Mid Atlantic",10-K,2025-02-13,,"ANNALY CAPITAL MANAGEMENT INC",1043219,"=""NLY""","1211 AVENUE OF THE AMERICAS",,"NEW YORK",NY,"NEW YORK","US Mid Atlantic",,,"=""6798""","Real Estate Investment Trusts",525990,"Other Financial Vehicles",34,18,01/02/25,"10,302,874,624",12/31/24,"1,198,384,000","1,001,906,000","12,599,825,000","103,556,384,000"
44053,"Other debt","Pre-funded warrants",554975,12/31/24,03/03/25,4,"KPMG LLP",,,,"San Francisco",CA,CALIFORNIA,"US West",10-K,2025-03-03,,"Annexon, Inc.",1528115,"=""ANNX""","1400 SIERRA POINT PARKWAY","BLDG C, SUITE 200",BRISBANE,CA,CALIFORNIA,"US West",,,"=""2834""","Pharmaceutical Preparations",325412,"Pharmaceutical Preparation Manufacturing",34,5,12/31/24,"561,127,360",12/31/24,,"-138,200,000",,"350,071,000"
41759,"Revenue from customer contracts","Revenue—Time-Based Subscription Lease Licenses—Refer to Notes 2 and 3 to the financial statements",551868,12/31/24,02/19/25,3,"Deloitte & Touche LLP",,,,Pittsburgh,PA,PENNSYLVANIA,"US Mid Atlantic",10-K,2025-02-19,,"ANSYS INC",1013462,"=""ANSS""","2600 ANSYS DRIVE, SOUTHPOINTE",,CANONSBURG,PA,PENNSYLVANIA,"US Mid Atlantic",,,"=""7372""","Prepackaged Software",511210,"Software Publishers",34,337,12/31/24,"29,528,397,824",12/31/24,"2,544,809,000","575,692,000","1,592,068,000","8,051,431,000"
43638,"Revenue from customer contracts","Revenue—Time-Based Subscription Lease Licenses—Refer to Notes 2 and 3 to the financial statements",554369,12/31/24,02/19/25,3,"Deloitte & Touche LLP",,,,Pittsburgh,PA,PENNSYLVANIA,"US Mid Atlantic",425,2025-02-27,,"ANSYS INC",1013462,"=""ANSS""","2600 ANSYS DRIVE, SOUTHPOINTE",,CANONSBURG,PA,PENNSYLVANIA,"US Mid Atlantic",,,"=""7372""","Prepackaged Software",511210,"Software Publishers",34,337,12/31/24,"29,528,397,824",12/31/24,"2,544,809,000","575,692,000","1,592,068,000","8,051,431,000"
40926,"Long-lived assets","Evaluation of impairment triggering events for long-lived assets",550866,12/31/24,02/12/25,4,"KPMG LLP",,,,Denver,CO,COLORADO,"US West",10-K,2025-02-12,,"Antero Midstream Corp",1623925,"=""AM""","1615 WYNKOOP STREET",,DENVER,CO,COLORADO,"US West",,,"=""4922""","Natural Gas Transmission",486210,"Pipeline Transportation of Natural Gas",34,15,12/31/24,"7,234,478,080",12/31/24,"1,106,193,000","400,892,000","970,412,000","5,761,748,000"
40925,"Proven and unproven reserves","Assessment of the estimated oil and gas reserves on depletion expense related to proved oil and gas properties",550868,12/31/24,02/12/25,4,"KPMG LLP",,,,Denver,CO,COLORADO,"US West",10-K,2025-02-12,,"ANTERO RESOURCES Corp",1433270,"=""AR""","1615 WYNKOOP STREET",,DENVER,CO,COLORADO,"US West",,,"=""1311""","Crude Petroleum and Natural Gas",211111,"Crude Petroleum and Natural Gas Extraction",34,35,12/31/24,"10,906,333,184",12/31/24,"4,325,596,000","57,226,000",,"13,010,050,000"
42848,Goodwill,"Annual Goodwill Impairment Assessment—Cartus Reporting Unit",553129,12/31/24,02/25/25,1,"PricewaterhouseCoopers LLP",,,,"Florham Park",NJ,"NEW JERSEY","US Mid Atlantic",10-K,2025-02-25,,"Anywhere Real Estate Group LLC",1355001,,"175 PARK AVENUE",,MADISON,NJ,"NEW JERSEY","US Mid Atlantic",1398987,"Anywhere Real Estate Inc.","=""6531""","Real Estate Agents and Managers",531210,"Offices of Real Estate Agents and Brokers",34,,,,12/31/24,"5,692,000,000","-128,000,000","-2,443,000,000","5,636,000,000"
42849,"Other intangible assets","Annual Indefinite-Lived Asset Impairment Assessment—Franchise Trademarks Intangible Asset",553129,12/31/24,02/25/25,1,"PricewaterhouseCoopers LLP",,,,"Florham Park",NJ,"NEW JERSEY","US Mid Atlantic",10-K,2025-02-25,,"Anywhere Real Estate Group LLC",1355001,,"175 PARK AVENUE",,MADISON,NJ,"NEW JERSEY","US Mid Atlantic",1398987,"Anywhere Real Estate Inc.","=""6531""","Real Estate Agents and Managers",531210,"Offices of Real Estate Agents and Brokers",34,,,,12/31/24,"5,692,000,000","-128,000,000","-2,443,000,000","5,636,000,000"
42786,Goodwill,"Annual Goodwill Impairment Assessment—Cartus Reporting Unit",553222,12/31/24,02/25/25,1,"PricewaterhouseCoopers LLP",,,,"Florham Park",NJ,"NEW JERSEY","US Mid Atlantic",10-K,2025-02-25,,"Anywhere Real Estate Inc.",1398987,"=""HOUS""","175 PARK AVENUE",,MADISON,NJ,"NEW JERSEY","US Mid Atlantic",,,"=""6531""","Real Estate Agents and Managers",531210,"Offices of Real Estate Agents and Brokers",34,3,01/02/25,"360,487,584",12/31/24,"5,692,000,000","-128,000,000","-2,443,000,000","5,636,000,000"
42787,"Other intangible assets","Annual Indefinite-Lived Asset Impairment Assessment—Franchise Trademarks Intangible Asset",553222,12/31/24,02/25/25,1,"PricewaterhouseCoopers LLP",,,,"Florham Park",NJ,"NEW JERSEY","US Mid Atlantic",10-K,2025-02-25,,"Anywhere Real Estate Inc.",1398987,"=""HOUS""","175 PARK AVENUE",,MADISON,NJ,"NEW JERSEY","US Mid Atlantic",,,"=""6531""","Real Estate Agents and Managers",531210,"Offices of Real Estate Agents and Brokers",34,3,01/02/25,"360,487,584",12/31/24,"5,692,000,000","-128,000,000","-2,443,000,000","5,636,000,000"
41622,"Deferred income taxes","Realizability of Deferred Tax Assets",551716,12/31/24,02/18/25,2,"Ernst & Young LLP",,,,Chicago,IL,ILLINOIS,"US Midwest",10-K,2025-02-18,,"Aon plc",315293,"=""AON""","15 GEORGES QUAY",,"DUBLIN 2",L2,IRELAND,Foreign,,,"=""6411""","Insurance Agents, Brokers, and Service",524210,"Insurance Agencies and Brokerages",34,355,01/02/25,"76,770,205,696",12/31/24,"15,698,000,000","2,654,000,000","-15,731,000,000","48,965,000,000"
41623,"Business combinations","Valuation of customer relationship intangible assets in the acquisition of NFP",551716,12/31/24,02/18/25,2,"Ernst & Young LLP",,,,Chicago,IL,ILLINOIS,"US Midwest",10-K,2025-02-18,,"Aon plc",315293,"=""AON""","15 GEORGES QUAY",,"DUBLIN 2",L2,IRELAND,Foreign,,,"=""6411""","Insurance Agents, Brokers, and Service",524210,"Insurance Agencies and Brokerages",34,355,01/02/25,"76,770,205,696",12/31/24,"15,698,000,000","2,654,000,000","-15,731,000,000","48,965,000,000"
43911,"Proven and unproven reserves","Depreciation, depletion and amortization of property and equipment",554797,12/31/24,02/28/25,2,"Ernst & Young LLP",,,,Houston,TX,TEXAS,"US Southwest",10-K,2025-02-28,,"APA Corp",1841666,"=""APA""","2000 W SAM HOUSTON PKWY S","SUITE 200",HOUSTON,TX,TEXAS,"US Southwest",,,"=""1311""","Crude Petroleum and Natural Gas",211111,"Crude Petroleum and Natural Gas Extraction",34,23,01/02/25,"8,649,371,648",12/31/24,"9,737,000,000","804,000,000",,"19,390,000,000"
43912,"Asset retirement and environmental obligations","Accounting for asset retirement obligation for the North Sea segment",554797,12/31/24,02/28/25,2,"Ernst & Young LLP",,,,Houston,TX,TEXAS,"US Southwest",10-K,2025-02-28,,"APA Corp",1841666,"=""APA""","2000 W SAM HOUSTON PKWY S","SUITE 200",HOUSTON,TX,TEXAS,"US Southwest",,,"=""1311""","Crude Petroleum and Natural Gas",211111,"Crude Petroleum and Natural Gas Extraction",34,23,01/02/25,"8,649,371,648",12/31/24,"9,737,000,000","804,000,000",,"19,390,000,000"
43913,"Other contingent liabilities","Accounting for decommissioning contingency for sold Gulf of America properties",554797,12/31/24,02/28/25,2,"Ernst & Young LLP",,,,Houston,TX,TEXAS,"US Southwest",10-K,2025-02-28,,"APA Corp",1841666,"=""APA""","2000 W SAM HOUSTON PKWY S","SUITE 200",HOUSTON,TX,TEXAS,"US Southwest",,,"=""1311""","Crude Petroleum and Natural Gas",211111,"Crude Petroleum and Natural Gas Extraction",34,23,01/02/25,"8,649,371,648",12/31/24,"9,737,000,000","804,000,000",,"19,390,000,000"
43914,"Business combinations","Evaluation of the fair value measurement of proved oil and gas properties acquired in the Callon Petroleum business combination",554797,12/31/24,02/28/25,2,"Ernst & Young LLP",,,,Houston,TX,TEXAS,"US Southwest",10-K,2025-02-28,,"APA Corp",1841666,"=""APA""","2000 W SAM HOUSTON PKWY S","SUITE 200",HOUSTON,TX,TEXAS,"US Southwest",,,"=""1311""","Crude Petroleum and Natural Gas",211111,"Crude Petroleum and Natural Gas Extraction",34,23,01/02/25,"8,649,371,648",12/31/24,"9,737,000,000","804,000,000",,"19,390,000,000"
45201,"Real estate investments","Real Estate— Refer to Notes 2 and 4 to the financial statements",558017,12/31/24,03/19/25,3,"Deloitte & Touche LLP",,,,Denver,CO,COLORADO,"US West",10-K,2025-03-19,,"Apartment Income REIT, L.P.",926660,,"345 PARK AVENUE",,"NEW YORK",NY,"NEW YORK","US Mid Atlantic",922864,"APARTMENT INVESTMENT & MANAGEMENT CO","=""6513""","Operators of Apartment Buildings",531110,"Lessors of Residential Buildings and Dwellings",34,,,,12/31/24,"800,601,000","-361,112,000","89,905,000","6,575,542,000"
43787,Inventory,"Inventory Valuation – Refer to Notes 2 and 4 to the financial statements",554573,12/31/24,02/28/25,3,"Deloitte & Touche LLP",,,,Boston,MA,MASSACHUSETTS,"US New England",10-K,2025-02-28,,"Apellis Pharmaceuticals, Inc.",1492422,"=""APLS""","100 FIFTH AVENUE",,WALTHAM,MA,MASSACHUSETTS,"US New England",,,"=""2834""","Pharmaceutical Preparations",325412,"Pharmaceutical Preparation Manufacturing",34,32,12/31/24,"3,972,635,392",12/31/24,"781,367,000","-197,878,000",,"885,051,000"
43062,"Revenue from customer contracts","Total estimated costs for certain fixed price projects recognized over time",553651,12/31/24,02/26/25,4,"KPMG LLP",,,,Minneapolis,MN,MINNESOTA,"US Midwest",10-K,2025-02-26,,"APi Group Corp",1796209,"=""APG""","C/O API GROUP, INC.","1100 OLD HIGHWAY 8 NW","NEW BRIGHTON",MN,MINNESOTA,"US Midwest",,,"=""7340""","Services-To Dwellings & Other Buildings",238910,"Site Preparation Contractors",34,36,12/31/24,"9,883,776,000",12/31/24,"7,018,000,000","250,000,000","-1,579,000,000","8,152,000,000"
47276,"Revenue from customer contracts","Total estimated costs for certain fixed price projects recognized over time",564275,12/31/24,02/26/25,4,"KPMG LLP",,,,Minneapolis,MN,MINNESOTA,"US Midwest",8-K,2025-05-02,,"APi Group Corp",1796209,"=""APG""","C/O API GROUP, INC.","1100 OLD HIGHWAY 8 NW","NEW BRIGHTON",MN,MINNESOTA,"US Midwest",,,"=""7340""","Services-To Dwellings & Other Buildings",238910,"Site Preparation Contractors",34,36,12/31/24,"9,883,776,000",12/31/24,"7,018,000,000","250,000,000","-1,579,000,000","8,152,000,000"
37957,"Revenue from customer contracts","Net Sales — Revenue Recognition for Long-Term Contracts in the Architectural Services Segment — Refer to Notes 1, 2, and 15 to the consolidated financial statements",534591,03/02/24,04/26/24,3,"Deloitte & Touche LLP",,,,Minneapolis,MN,MINNESOTA,"US Midwest",10-K,2024-04-26,,"APOGEE ENTERPRISES, INC.",6845,"=""APOG""","4400 WEST 78TH STREET","SUITE 520",MINNEAPOLIS,MN,MINNESOTA,"US Midwest",,,"=""3231""","Glass Products, Made of Purchased Glass",327215,"Glass Product Manufacturing Made of Purchased Glass",34,56,03/04/24,"1,247,587,200",03/02/24,"1,416,942,000","99,613,000","275,729,000","884,064,000"
44150,"Other expenses","Accrued Manufacturing Expenses",555117,12/31/24,03/03/25,2,"Ernst & Young LLP",,,,Boston,MA,MASSACHUSETTS,"US New England",10-K,2025-03-03,,"Apogee Therapeutics, Inc.",1974640,"=""APGE""","221 CRESCENT ST.","BUILDING 17, SUITE 102B",WALTHAM,MA,MASSACHUSETTS,"US New England",,,"=""2836""","Biological Products, Except Diagnostic Substances",325414,"Biological Product (except Diagnostic) Manufacturing",34,45,12/31/24,"2,083,441,408",12/31/24,,"-182,146,000",,"753,951,000"
40827,"Allowance for credit losses","Current Expected Credit Losses (""CECL"") Allowance—Estimation of Economic Conditions—Refer to Notes 2 and 4 to the Financial Statements",550671,12/31/24,02/10/25,3,"Deloitte & Touche LLP",,,,"New York",NY,"NEW YORK","US Mid Atlantic",10-K,2025-02-10,,"Apollo Commercial Real Estate Finance, Inc.",1467760,"=""ARI""","C/O APOLLO GLOBAL MANAGEMENT, LLC","9 WEST 57TH STREET, 43RD FLOOR","NEW YORK",NY,"NEW YORK","US Mid Atlantic",,,"=""6798""","Real Estate Investment Trusts",525990,"Other Financial Vehicles",34,9,12/31/24,"1,196,592,384",12/31/24,"104,689,000","-119,636,000",,"8,411,591,000"
40828,"Allowance for credit losses","CECL Allowance – Estimation of Fair Value of Underlying Collateral of Loans Exhibiting Signs of Financial Difficulty — Refer to Notes 2 and 4 to the financial statements",550671,12/31/24,02/10/25,3,"Deloitte & Touche LLP",,,,"New York",NY,"NEW YORK","US Mid Atlantic",10-K,2025-02-10,,"Apollo Commercial Real Estate Finance, Inc.",1467760,"=""ARI""","C/O APOLLO GLOBAL MANAGEMENT, LLC","9 WEST 57TH STREET, 43RD FLOOR","NEW YORK",NY,"NEW YORK","US Mid Atlantic",,,"=""6798""","Real Estate Investment Trusts",525990,"Other Financial Vehicles",34,9,12/31/24,"1,196,592,384",12/31/24,"104,689,000","-119,636,000",,"8,411,591,000"
44828,"Other investments","Fair Value of Level 3 Investments — Refer to Notes 2 and 4 to the Financial Statements",557391,12/31/24,03/13/25,3,"Deloitte & Touche LLP",,,,"New York",NY,"NEW YORK","US Mid Atlantic",10-K,2025-03-13,,"Apollo Debt Solutions BDC",1837532,,"9 WEST 57TH STREET",,"NEW YORK",NY,"NEW YORK","US Mid Atlantic",,,,,525990,"Other Financial Vehicles",34,,,,12/31/24,"1,206,384,000","674,960,000","9,546,496,000","15,235,388,000"
44857,"Other investments","Fair Value of Level 3 Investments — Refer to Notes 2 and 4 to the Financial Statements",557446,12/31/24,03/13/25,3,"Deloitte & Touche LLP",,,,"New York",NY,"NEW YORK","US Mid Atlantic",424B3,2025-03-13,,"Apollo Debt Solutions BDC",1837532,,"9 WEST 57TH STREET",,"NEW YORK",NY,"NEW YORK","US Mid Atlantic",,,,,525990,"Other Financial Vehicles",34,,,,12/31/24,"1,206,384,000","674,960,000","9,546,496,000","15,235,388,000"
46818,"Other investments","Fair Value of Level 3 Investments — Refer to Notes 2 and 4 to the Financial Statements",561844,12/31/24,03/13/25,3,"Deloitte & Touche LLP",,,,"New York",NY,"NEW YORK","US Mid Atlantic",486BPOS,2025-04-17,,"Apollo Debt Solutions BDC",1837532,,"9 WEST 57TH STREET",,"NEW YORK",NY,"NEW YORK","US Mid Atlantic",,,,,525990,"Other Financial Vehicles",34,,,,12/31/24,"1,206,384,000","674,960,000","9,546,496,000","15,235,388,000"
42608,"Other investments","Fair Value of Certain Underlying Investments to Determine Performance Allocations— Refer to Note 2, Summary of Significant Accounting Policies and Note 4, Investments",552956,12/31/24,02/24/25,3,"Deloitte & Touche LLP",,,,"New York",NY,"NEW YORK","US Mid Atlantic",10-K,2025-02-24,,"Apollo Global Management, Inc.",1858681,"=""APO""","9 WEST 57TH STREET, 42ND FLOOR",,"NEW YORK",NY,"NEW YORK","US Mid Atlantic",,,"=""6282""","Investment Advice",0,,34,166,01/02/25,"93,846,315,008",12/31/24,"20,698,000,000","4,577,000,000","12,942,000,000","377,895,000,000"
42609,"Other investments","Valuation of Certain Structured Level 3 Asset-Backed Securities - Refer to Note 4, Investments, Note 7, Fair Value, and Note 18, Related Parties",552956,12/31/24,02/24/25,3,"Deloitte & Touche LLP",,,,"New York",NY,"NEW YORK","US Mid Atlantic",10-K,2025-02-24,,"Apollo Global Management, Inc.",1858681,"=""APO""","9 WEST 57TH STREET, 42ND FLOOR",,"NEW YORK",NY,"NEW YORK","US Mid Atlantic",,,"=""6282""","Investment Advice",0,,34,166,01/02/25,"93,846,315,008",12/31/24,"20,698,000,000","4,577,000,000","12,942,000,000","377,895,000,000"
42610,"Insurance contract liabilities","Certain Assumptions Used in the Valuation of Market Risk Benefits and Interest Sensitive Contract Liabilities - Refer to Note 2, Summary of Significant Accounting Policies, Note 7, Fair Value, and Note 11, Long-duration Contracts",552956,12/31/24,02/24/25,3,"Deloitte & Touche LLP",,,,"New York",NY,"NEW YORK","US Mid Atlantic",10-K,2025-02-24,,"Apollo Global Management, Inc.",1858681,"=""APO""","9 WEST 57TH STREET, 42ND FLOOR",,"NEW YORK",NY,"NEW YORK","US Mid Atlantic",,,"=""6282""","Investment Advice",0,,34,166,01/02/25,"93,846,315,008",12/31/24,"20,698,000,000","4,577,000,000","12,942,000,000","377,895,000,000"
41320,"Regulatory assets and liabilities","Accounting for the Effects of Cost-Based Regulation",551223,12/31/24,02/13/25,1,"PricewaterhouseCoopers LLP",,,,Columbus,OH,OHIO,"US Midwest",10-K,2025-02-13,,"APPALACHIAN POWER CO",6879,,"1 RIVERSIDE PLAZA",,COLUMBUS,OH,OHIO,"US Midwest",4904,"AMERICAN ELECTRIC POWER CO INC","=""4911""","Electric Services",221122,"Electric Power Distribution",34,,,,12/31/24,"4,032,600,000","421,700,000",,"16,665,900,000"
41321,"Asset retirement and environmental obligations","Incremental Asset Retirement Obligations arising from the Federal Environment Protection Agency’s (“Federal EPA”) Revised Coal Combustion Residuals (CCR) Rule",551223,12/31/24,02/13/25,1,"PricewaterhouseCoopers LLP",,,,Columbus,OH,OHIO,"US Midwest",10-K,2025-02-13,,"APPALACHIAN POWER CO",6879,,"1 RIVERSIDE PLAZA",,COLUMBUS,OH,OHIO,"US Midwest",4904,"AMERICAN ELECTRIC POWER CO INC","=""4911""","Electric Services",221122,"Electric Power Distribution",34,,,,12/31/24,"4,032,600,000","421,700,000",,"16,665,900,000"
40756,"Business combinations","Acquisition of Move EZ, Inc.– Valuation of Customer Relationships and Developed Technology",550314,12/31/24,02/06/25,1,"PricewaterhouseCoopers LLP",,,,"Los Angeles",CA,CALIFORNIA,"US West",10-K,2025-02-06,,"APPFOLIO INC",1433195,"=""APPF""","70 CASTILIAN DRIVE",,"SANTA BARBARA",CA,CALIFORNIA,"US West",,,"=""7372""","Prepackaged Software",511210,"Software Publishers",34,248,01/02/25,"5,726,348,288",12/31/24,"794,202,000","204,068,000","358,394,000","626,678,000"
40757,"Revenue from customer contracts","Revenue Recognition",550314,12/31/24,02/06/25,1,"PricewaterhouseCoopers LLP",,,,"Los Angeles",CA,CALIFORNIA,"US West",10-K,2025-02-06,,"APPFOLIO INC",1433195,"=""APPF""","70 CASTILIAN DRIVE",,"SANTA BARBARA",CA,CALIFORNIA,"US West",,,"=""7372""","Prepackaged Software",511210,"Software Publishers",34,248,01/02/25,"5,726,348,288",12/31/24,"794,202,000","204,068,000","358,394,000","626,678,000"
42559,"Real estate investments","Evaluation of investments in hotel properties for impairment",552959,12/31/24,02/24/25,4,"KPMG LLP",,,,Richmond,VA,VIRGINIA,"US Mid Atlantic",10-K,2025-02-24,,"Apple Hospitality REIT, Inc.",1418121,"=""APLE""","814 EAST MAIN STREET",,RICHMOND,VA,VIRGINIA,"US Mid Atlantic",,,"=""6798""","Real Estate Investment Trusts",525990,"Other Financial Vehicles",34,15,12/31/24,"3,680,406,528",12/31/24,"1,431,468,000","214,064,000",,"4,969,920,000"
39869,"Uncertain tax positions","Uncertain Tax Positions",543369,09/28/24,11/01/24,2,"Ernst & Young LLP",,,,"San Jose",CA,CALIFORNIA,"US West",10-K,2024-11-01,,"Apple Inc.",320193,"=""AAPL""","ONE APPLE PARK WAY",,CUPERTINO,CA,CALIFORNIA,"US West",,,"=""3571""","Electronic Computers",334111,"Electronic Computer Manufacturing",34,233,09/30/24,"3,542,563,946,496",09/28/24,"391,035,000,000","93,736,000,000",,"364,980,000,000"
39186,Goodwill,"Goodwill - A reporting unit within the Engineered Solutions segment - Refer to Notes 1 and 5 to the financial statements",540101,06/30/24,08/16/24,3,"Deloitte & Touche LLP",,,,Cleveland,OH,OHIO,"US Midwest",10-K,2024-08-16,,"APPLIED INDUSTRIAL TECHNOLOGIES INC",109563,"=""AIT""","ONE APPLIED PLAZA",,CLEVELAND,OH,OHIO,"US Midwest",,,"=""5080""","Wholesale-Machinery, Equipment & Supplies",423830,"Industrial Machinery and Equipment Merchant Wholesalers",34,192,07/02/24,"7,409,000,448",06/30/24,"4,479,406,000","385,762,000","823,516,000","2,951,910,000"
39187,Inventory,"Inventory - Refer to Notes 1 and 4 to the financial statements",540101,06/30/24,08/16/24,3,"Deloitte & Touche LLP",,,,Cleveland,OH,OHIO,"US Midwest",10-K,2024-08-16,,"APPLIED INDUSTRIAL TECHNOLOGIES INC",109563,"=""AIT""","ONE APPLIED PLAZA",,CLEVELAND,OH,OHIO,"US Midwest",,,"=""5080""","Wholesale-Machinery, Equipment & Supplies",423830,"Industrial Machinery and Equipment Merchant Wholesalers",34,192,07/02/24,"7,409,000,448",06/30/24,"4,479,406,000","385,762,000","823,516,000","2,951,910,000"
39429,Goodwill,"Goodwill - A reporting unit within the Engineered Solutions segment - Refer to Notes 1 and 5 to the financial statements",541084,06/30/24,08/16/24,3,"Deloitte & Touche LLP",,,,Cleveland,OH,OHIO,"US Midwest",10-K/A,2024-09-10,,"APPLIED INDUSTRIAL TECHNOLOGIES INC",109563,"=""AIT""","ONE APPLIED PLAZA",,CLEVELAND,OH,OHIO,"US Midwest",,,"=""5080""","Wholesale-Machinery, Equipment & Supplies",423830,"Industrial Machinery and Equipment Merchant Wholesalers",34,192,07/02/24,"7,409,000,448",06/30/24,"4,479,406,000","385,762,000","823,516,000","2,951,910,000"
39430,Inventory,"Inventory - Refer to Notes 1 and 4 to the financial statements",541084,06/30/24,08/16/24,3,"Deloitte & Touche LLP",,,,Cleveland,OH,OHIO,"US Midwest",10-K/A,2024-09-10,,"APPLIED INDUSTRIAL TECHNOLOGIES INC",109563,"=""AIT""","ONE APPLIED PLAZA",,CLEVELAND,OH,OHIO,"US Midwest",,,"=""5080""","Wholesale-Machinery, Equipment & Supplies",423830,"Industrial Machinery and Equipment Merchant Wholesalers",34,192,07/02/24,"7,409,000,448",06/30/24,"4,479,406,000","385,762,000","823,516,000","2,951,910,000"
40254,"Revenue from customer contracts","Evaluation of sufficiency of audit evidence over revenue",545449,10/27/24,12/13/24,4,"KPMG LLP",,,,"Santa Clara",CA,CALIFORNIA,"US West",10-K,2024-12-13,,"APPLIED MATERIALS INC /DE",6951,"=""AMAT""","3050 BOWERS AVE",,"SANTA CLARA",CA,CALIFORNIA,"US West",,,"=""3674""","Semiconductors and Related Devices",333295,"Semiconductor Machinery Manufacturing",34,190,10/29/24,"156,735,700,992",10/27/24,"27,176,000,000","7,177,000,000","15,020,000,000","34,409,000,000"
46628,"Other debt","Valuation of liability-classified warrants",561467,12/31/24,04/14/25,2,"Ernst & Young LLP",,,,"New York",NY,"NEW YORK","US Mid Atlantic",10-K,2025-04-15,Yes,"Applied Therapeutics, Inc.",1697532,"=""APLT""","545 FIFTH AVENUE, SUITE 1400",,"NEW YORK",NY,"NEW YORK","US Mid Atlantic",,,"=""2834""","Pharmaceutical Preparations",325412,"Pharmaceutical Preparation Manufacturing",34,1,12/31/24,"118,016,720",12/31/24,"455,000","-105,624,000",,"86,691,000"
43372,"Deferred and stock-based compensation","Performance-based Restricted Stock Units - Refer to Note 2 and Note 11 to the financial statements",554042,12/31/24,02/27/25,3,"Deloitte & Touche LLP",,,,"San Jose",CA,CALIFORNIA,"US West",10-K,2025-02-27,,"AppLovin Corp",1751008,"=""APP""","1100 PAGE MILL RD",,"PALO ALTO",CA,CALIFORNIA,"US West",,,"=""7370""","Services-Computer Programming, Data Processing, Etc.",541511,"Custom Computer Programming Services",34,342,01/02/25,"102,078,668,800",12/31/24,"4,709,248,000","1,579,776,000","-1,610,285,000","5,869,259,000"
40796,Goodwill,"Goodwill Impairment Assessment – Injectables Reporting Unit",550418,12/31/24,02/07/25,1,"PricewaterhouseCoopers LLP",,,,Chicago,IL,ILLINOIS,"US Midwest",10-K,2025-02-07,,"APTARGROUP, INC.",896622,"=""ATR""","265 EXCHANGE DRIVE","SUITE 301","CRYSTAL LAKE",IL,ILLINOIS,"US Midwest",,,"=""3089""","Plastics Products, NEC",326199,"All Other Plastics Product Manufacturing",34,154,01/02/25,"10,258,308,096",12/31/24,"3,582,890,000","374,541,000","1,280,863,000","4,432,278,000"
40797,"Revenue from customer contracts","Revenue Recognition – Product Sales",550418,12/31/24,02/07/25,1,"PricewaterhouseCoopers LLP",,,,Chicago,IL,ILLINOIS,"US Midwest",10-K,2025-02-07,,"APTARGROUP, INC.",896622,"=""ATR""","265 EXCHANGE DRIVE","SUITE 301","CRYSTAL LAKE",IL,ILLINOIS,"US Midwest",,,"=""3089""","Plastics Products, NEC",326199,"All Other Plastics Product Manufacturing",34,154,01/02/25,"10,258,308,096",12/31/24,"3,582,890,000","374,541,000","1,280,863,000","4,432,278,000"
40789,"Uncertain tax positions","Uncertain Tax Positions",550500,12/31/24,02/07/25,2,"Ernst & Young LLP",,,,Detroit,MI,MICHIGAN,"US Midwest",10-K,2025-02-07,,"Aptiv PLC",1521332,"=""APTV""","SPITALSTRASSE 5",,SCHAFFHAUSEN,V8,SWITZERLAND,Foreign,,,"=""3714""","Motor Vehicle Parts and Accessories",423120,"Motor Vehicle Supplies and New Parts Merchant Wholesalers",34,60,01/02/25,"14,172,654,592",12/31/24,"19,713,000,000","1,787,000,000","1,724,000,000","23,458,000,000"
40790,"Revenue from customer contracts","Revenue Recognition",550500,12/31/24,02/07/25,2,"Ernst & Young LLP",,,,Detroit,MI,MICHIGAN,"US Midwest",10-K,2025-02-07,,"Aptiv PLC",1521332,"=""APTV""","SPITALSTRASSE 5",,SCHAFFHAUSEN,V8,SWITZERLAND,Foreign,,,"=""3714""","Motor Vehicle Parts and Accessories",423120,"Motor Vehicle Supplies and New Parts Merchant Wholesalers",34,60,01/02/25,"14,172,654,592",12/31/24,"19,713,000,000","1,787,000,000","1,724,000,000","23,458,000,000"
40791,Goodwill,"Goodwill impairment — Wind River Reporting Unit",550500,12/31/24,02/07/25,2,"Ernst & Young LLP",,,,Detroit,MI,MICHIGAN,"US Midwest",10-K,2025-02-07,,"Aptiv PLC",1521332,"=""APTV""","SPITALSTRASSE 5",,SCHAFFHAUSEN,V8,SWITZERLAND,Foreign,,,"=""3714""","Motor Vehicle Parts and Accessories",423120,"Motor Vehicle Supplies and New Parts Merchant Wholesalers",34,60,01/02/25,"14,172,654,592",12/31/24,"19,713,000,000","1,787,000,000","1,724,000,000","23,458,000,000"
45883,"Research and development expenses","Evaluation of Research and Development Prepaid and Accrued Costs",559475,12/31/24,03/28/25,4,"KPMG LLP",187,"KPMG LLP Chartered Accountants",85,Vaughan,A6,ONTARIO,Canada,10-K,2025-03-28,Yes,"Aptose Biosciences Inc.",882361,"=""APTOF""","66 WELLINGTON STREET WEST, SUITE 5300","TD BANK TOWER BOX 48",TORONTO,A6,ONTARIO,Canada,,,"=""2836""","Biological Products, Except Diagnostic Substances",325414,"Biological Product (except Diagnostic) Manufacturing",34,0,01/02/25,"4,597,239",12/31/24,,"-25,430,000",,"10,127,000"
45691,"Long-lived assets","Impairment of Long-Lived Assets – Refer to Notes 2 and 6 to the financial statements",559126,12/31/24,03/27/25,3,"Deloitte & Touche LLP",,,,Baltimore,MD,MARYLAND,"US Mid Atlantic",10-K,2025-03-27,Yes,"AQUABOUNTY TECHNOLOGIES INC",1603978,"=""AQB""","233 AYER ROAD SUITE 4","SUITE 4",HARVARD,MA,MASSACHUSETTS,"US New England",,,"=""0900""","Fishing, hunting, and trapping",112519,"Other Animal Aquaculture",34,1,01/02/25,"3,053,578",12/31/24,,"-149,192,660","15,840,710","34,061,798"
44275,"Going concern","Evaluation of the Company’s ability to continue as a going concern",555521,12/31/24,03/05/25,4,"KPMG LLP",,,,"Short Hills",NJ,"NEW JERSEY","US Mid Atlantic",10-K,2025-03-05,,"Aquestive Therapeutics, Inc.",1398733,"=""AQST""","30 TECHNOLOGY DRIVE",,WARREN,NJ,"NEW JERSEY","US Mid Atlantic",,,"=""2834""","Pharmaceutical Preparations",325412,"Pharmaceutical Preparation Manufacturing",34,4,12/31/24,"325,432,928",12/31/24,"57,561,000","-44,137,000","-60,156,000","101,424,000"
40016,Goodwill,"Goodwill - FSS US Reporting Unit - Refer to Note 5 to the financial statements",544197,09/27/24,11/19/24,3,"Deloitte & Touche LLP",,,,Philadelphia,PA,PENNSYLVANIA,"US Mid Atlantic",10-K,2024-11-19,,Aramark,1584509,"=""ARMK""","2400 MARKET STREET",,PHILADELPHIA,PA,PENNSYLVANIA,"US Mid Atlantic",,,"=""5812""","Eating and Drinking Places",722310,"Food Service Contractors",34,37,09/25/24,"9,816,091,648",09/27/24,"17,400,701,000","262,522,000","-3,435,335,000","12,674,371,000"
45814,"Property, plant and equipment","Valuation of Biological Assets",559061,12/31/24,03/25/25,1,"PricewaterhouseCoopers LLP",93,"PricewaterhouseCoopers Consultores Auditores y Compania Limitada",1364,Santiago,F3,CHILE,Foreign,20-F,2025-03-27,,"ARAUCO & CONSTITUTION PULP INC",1004156,,"EL GOLF NO 150","14TH FL.",SANTIAGO,F3,CHILE,Foreign,,,"=""2611""","Pulp Mills",322110,"Pulp Mills",34,,,,12/31/24,"6,546,146,000","476,281,000","8,616,410,000","18,159,312,000"
42300,"Allowance for credit losses","Allowance for Credit Losses",552409,12/31/24,02/21/25,2,"Ernst & Young LLP",,,,"New York",NY,"NEW YORK","US Mid Atlantic",10-K,2025-02-21,,"ARBOR REALTY TRUST INC",1253986,"=""ABR""","333 EARLE OVINGTON BOULEVARD","SUITE 900",UNIONDALE,NY,"NEW YORK","US Mid Atlantic",,,"=""6798""","Real Estate Investment Trusts",525990,"Other Financial Vehicles",34,14,12/31/24,"2,621,243,136",12/31/24,"258,866,000","264,641,000","2,935,966,000","13,490,981,000"
45681,"Other contingent liabilities","Valuation of contingent consideration liability",559092,12/31/24,03/27/25,2,"Ernst & Young LLP",,,,Philadelphia,PA,PENNSYLVANIA,"US Mid Atlantic",10-K,2025-03-27,,"Arbutus Biopharma Corp",1447028,"=""ABUS""","701 VETERANS CIRCLE",,WARMINSTER,PA,PENNSYLVANIA,"US Mid Atlantic",,,"=""2834""","Pharmaceutical Preparations",541710,"Research and Development in the Physical, Engineering, and Life Sciences",34,3,12/31/24,"621,180,608",12/31/24,"6,171,000","-69,920,000",,"131,707,000"
45522,"Derivatives and hedging","Identification and recognition of contingent features within note receivable – Refer to Note 8 to the financial statements",558672,12/31/24,03/25/25,3,"Deloitte & Touche LLP",,,,Tempe,AZ,ARIZONA,"US Southwest",10-K,2025-03-25,Yes,"Arcadia Biosciences, Inc.",1469443,"=""RKDA""","5956 SHERRY LANE","SUITE 2000",DALLAS,TX,TEXAS,"US Southwest",,,"=""1311""","Crude Petroleum and Natural Gas",541710,"Research and Development in the Physical, Engineering, and Life Sciences",34,6,01/02/25,"8,312,485",12/31/24,"5,045,000","-7,038,000","6,184,000","13,517,000"
48077,"Derivatives and hedging","Identification and recognition of contingent features within note receivable – Refer to Note 8 to the financial statements",569531,12/31/24,03/25/25,3,"Deloitte & Touche LLP",,,,Tempe,AZ,ARIZONA,"US Southwest",S-4/A,2025-07-31,Yes,"Arcadia Biosciences, Inc.",1469443,"=""RKDA""","5956 SHERRY LANE","SUITE 2000",DALLAS,TX,TEXAS,"US Southwest",,,"=""1311""","Crude Petroleum and Natural Gas",541710,"Research and Development in the Physical, Engineering, and Life Sciences",34,6,01/02/25,"8,312,485",12/31/24,"5,045,000","-7,038,000","6,184,000","13,517,000"
43485,"Business combinations","Evaluation of the fair value of mineral rights asset acquired",554138,12/31/24,02/27/25,4,"KPMG LLP",,,,Philadelphia,PA,PENNSYLVANIA,"US Mid Atlantic",10-K,2025-02-27,Yes,"Arcadium Lithium plc",1977303,,"SUITE 12, GATEWAY HUB","SHANNON AIRPORT HOUSE","SHANNON, CO. CLARE V14 E3 70",L2,IRELAND,Foreign,,,"=""2810""","Industrial Inorganic Chemicals",0,,34,5,12/31/24,"5,521,207,808",12/31/24,"1,007,800,000","103,200,000","4,836,800,000","10,190,100,000"
44116,"Other contingent liabilities","Insurance reserves",555092,12/31/24,03/03/25,2,"Ernst & Young LLP",,,,Rogers,AR,ARKANSAS,"US Southeast",10-K,2025-03-03,,"ARCBEST CORP /DE/",894405,"=""ARCB""","8401 MCCLURE DRIVE",,"FORT SMITH",AR,ARKANSAS,"US Southeast",,,"=""4213""","Trucking, Except Local",484122,"General Freight Trucking, Long-Distance, Less Than Truckload",34,92,01/02/25,"2,151,355,648",12/31/24,"4,179,019,000","173,961,000","923,644,000","2,429,731,000"
43391,"Revenue from customer contracts","Revenue Recognition – Kite Collaboration Agreement Third Party Contract Costs",554064,12/31/24,02/27/25,1,"PricewaterhouseCoopers LLP",,,,"San Jose",CA,CALIFORNIA,"US West",10-K,2025-02-27,,"Arcellx, Inc.",1786205,"=""ACLX""","800 BRIDGE PARKWAY",,"REDWOOD CITY",CA,CALIFORNIA,"US West",,,"=""2836""","Biological Products, Except Diagnostic Substances",325414,"Biological Product (except Diagnostic) Manufacturing",34,77,12/31/24,"4,163,776,000",12/31/24,"107,936,000","-107,348,000",,"711,327,000"
44580,"Long-lived assets","Impairment of Goodwill, Intangible Assets and Property, Plant and Equipment",556711,12/31/24,03/10/25,2,"Ernst & Young LLP",226,"Ernst & Young SA",1367,Luxembourg,N4,LUXEMBOURG,Foreign,20-F,2025-03-10,,ArcelorMittal,1243429,"=""MT""","24-26, BOULEVARD D?AVRANCHES","L-1160 LUXEMBOURG",LUXEMBOURG,N4,LUXEMBOURG,Foreign,,,"=""3312""","Steel Works, Blast Furnaces (Including Coke Ovens), and Rolling Mills",331111,"Iron and Steel Mills",34,23,01/02/25,"18,728,552,448",12/31/24,"62,441,000,000","1,380,000,000","44,770,000,000","89,385,000,000"
44581,"Deferred income taxes","Recoverability of Deferred Tax Assets (“DTAs”)",556711,12/31/24,03/10/25,2,"Ernst & Young LLP",226,"Ernst & Young SA",1367,Luxembourg,N4,LUXEMBOURG,Foreign,20-F,2025-03-10,,ArcelorMittal,1243429,"=""MT""","24-26, BOULEVARD D?AVRANCHES","L-1160 LUXEMBOURG",LUXEMBOURG,N4,LUXEMBOURG,Foreign,,,"=""3312""","Steel Works, Blast Furnaces (Including Coke Ovens), and Rolling Mills",331111,"Iron and Steel Mills",34,23,01/02/25,"18,728,552,448",12/31/24,"62,441,000,000","1,380,000,000","44,770,000,000","89,385,000,000"
43542,"Insurance contract liabilities","Valuation of Reserve for Losses and Loss Adjustment Expenses",554227,12/31/24,02/27/25,1,"PricewaterhouseCoopers LLP",,,,"New York",NY,"NEW YORK","US Mid Atlantic",10-K,2025-02-27,,"ARCH CAPITAL GROUP LTD.",947484,"=""ACGL""","WATERLOO HOUSE, GROUND FLOOR","100 PITTS BAY ROAD",PEMBROKE,D0,BERMUDA,Foreign,,,"=""6331""","Fire, Marine, and Casualty Insurance",524130,"Reinsurance Carriers",34,91,01/02/25,"34,380,984,320",12/31/24,"17,440,000,000","4,312,000,000","19,469,000,000","70,906,000,000"
43837,"Research and development expenses","Research and Development Costs",554553,12/31/24,02/27/25,1,"PricewaterhouseCoopers LLP",,,,Irvine,CA,CALIFORNIA,"US West",10-K,2025-02-28,,"Archer Aviation Inc.",1824502,"=""ACHR""","190 WEST TASMAN DRIVE",,"SAN JOSE",CA,CALIFORNIA,"US West",,,"=""3721""",Aircraft,336411,"Aircraft Manufacturing",34,10,12/31/24,"4,911,830,528",12/31/24,,"-536,800,000","752,300,000","1,001,200,000"
42150,Inventory,"Market or Fair Values of Certain Merchandisable Agricultural Commodity Inventories, Inventory-Related Payables, and Forward Commodity Purchase and Sales Contracts",552297,12/31/24,02/20/25,2,"Ernst & Young LLP",,,,"Saint Louis",MO,MISSOURI,"US Southeast",10-K,2025-02-20,,"Archer-Daniels-Midland Co",7084,"=""ADM""","77 W. WACKER DR.",,CHICAGO,IL,ILLINOIS,"US Midwest",,,"=""2070""","Fats & Oils",311222,"Soybean Processing",34,50,01/02/25,"24,031,952,896",12/31/24,"85,530,000,000","1,800,000,000","15,652,000,000","53,271,000,000"
42151,Goodwill,"Animal Nutrition Goodwill Impairment Evaluation",552297,12/31/24,02/20/25,2,"Ernst & Young LLP",,,,"Saint Louis",MO,MISSOURI,"US Southeast",10-K,2025-02-20,,"Archer-Daniels-Midland Co",7084,"=""ADM""","77 W. WACKER DR.",,CHICAGO,IL,ILLINOIS,"US Midwest",,,"=""2070""","Fats & Oils",311222,"Soybean Processing",34,50,01/02/25,"24,031,952,896",12/31/24,"85,530,000,000","1,800,000,000","15,652,000,000","53,271,000,000"
42677,"Business combinations","TOPS ACQUISITION - Refer to Note 4 and 18 to the financial statements.",553143,12/31/24,02/25/25,3,"Deloitte & Touche LLP",,,,Houston,TX,TEXAS,"US Southwest",10-K,2025-02-25,,"Archrock, Inc.",1389050,"=""AROC""","16666 NORTHCHASE DRIVE","STE 100",HOUSTON,TX,TEXAS,"US Southwest",,,"=""4922""","Natural Gas Transmission",213112,"Support Activities for Oil and Gas Operations",34,25,12/31/24,"4,359,919,616",12/31/24,"1,157,591,000","172,231,000","1,173,105,000","3,824,205,000"
44730,"Long-lived assets","Impairment of long-lived assets for markets with impairment indicators",557237,12/31/24,03/12/25,2,"Ernst & Young LLP",134,"Pistrelli Henry Martin y Asociados SRL (Inactive)",1449,"Buenos Aires",C1,ARGENTINA,Foreign,6-K,2025-03-12,,"Arcos Dorados Holdings Inc.",1508478,"=""ARCO""","RIO NEGRO 1338, FIRST FLOOR",,MONTEVIDEO,X3,URUGUAY,Foreign,,,"=""5812""","Eating and Drinking Places",722211,"Limited-Service Restaurants",34,7,12/31/24,"951,227,072",12/31/24,"4,470,162,000","148,759,000","441,436,000","2,892,654,000"
44731,"Other contingent liabilities","Tax contingencies",557237,12/31/24,03/12/25,2,"Ernst & Young LLP",134,"Pistrelli Henry Martin y Asociados SRL (Inactive)",1449,"Buenos Aires",C1,ARGENTINA,Foreign,6-K,2025-03-12,,"Arcos Dorados Holdings Inc.",1508478,"=""ARCO""","RIO NEGRO 1338, FIRST FLOOR",,MONTEVIDEO,X3,URUGUAY,Foreign,,,"=""5812""","Eating and Drinking Places",722211,"Limited-Service Restaurants",34,7,12/31/24,"951,227,072",12/31/24,"4,470,162,000","148,759,000","441,436,000","2,892,654,000"
47084,"Long-lived assets","Impairment of long-lived assets for markets with impairment indicators",563218,12/31/24,03/12/25,2,"Ernst & Young LLP",134,"Pistrelli Henry Martin y Asociados SRL (Inactive)",1449,"Buenos Aires",C1,ARGENTINA,Foreign,20-F,2025-04-29,,"Arcos Dorados Holdings Inc.",1508478,"=""ARCO""","RIO NEGRO 1338, FIRST FLOOR",,MONTEVIDEO,X3,URUGUAY,Foreign,,,"=""5812""","Eating and Drinking Places",722211,"Limited-Service Restaurants",34,7,12/31/24,"951,227,072",12/31/24,"4,470,162,000","148,759,000","441,436,000","2,892,654,000"
47085,"Other contingent liabilities","Tax contingencies",563218,12/31/24,03/12/25,2,"Ernst & Young LLP",134,"Pistrelli Henry Martin y Asociados SRL (Inactive)",1449,"Buenos Aires",C1,ARGENTINA,Foreign,20-F,2025-04-29,,"Arcos Dorados Holdings Inc.",1508478,"=""ARCO""","RIO NEGRO 1338, FIRST FLOOR",,MONTEVIDEO,X3,URUGUAY,Foreign,,,"=""5812""","Eating and Drinking Places",722211,"Limited-Service Restaurants",34,7,12/31/24,"951,227,072",12/31/24,"4,470,162,000","148,759,000","441,436,000","2,892,654,000"
43901,"Business combinations","Accounting for business combination",554726,12/31/24,02/28/25,2,"Ernst & Young LLP",,,,Dallas,TX,TEXAS,"US Southwest",10-K,2025-02-28,,"Arcosa, Inc.",1739445,"=""ACA""","500 N. AKARD SREET","SUITE 400",DALLAS,TX,TEXAS,"US Southwest",,,"=""3440""","Fabricated Structural Metal Products",327992,"Ground or Treated Mineral and Earth Manufacturing",34,97,01/02/25,"4,714,767,360",12/31/24,"2,569,900,000","93,700,000","728,700,000","4,915,500,000"
44332,"Revenue from customer contracts","Collaboration Revenue — Refer to Note 2 and Note 3 to the financial statements",555782,12/31/24,03/06/25,3,"Deloitte & Touche LLP",,,,"San Diego",CA,CALIFORNIA,"US West",10-K,2025-03-06,,"Arcturus Therapeutics Holdings Inc.",1768224,"=""ARCT""","10285 SCIENCE CENTER DRIVE",,"SAN DIEGO",CA,CALIFORNIA,"US West",,,"=""2834""","Pharmaceutical Preparations",325414,"Biological Product (except Diagnostic) Manufacturing",34,17,12/31/24,"458,190,016",12/31/24,"152,310,000","-80,941,000",,"344,069,000"
42748,"Revenue from customer contracts","Accounting for agreements with Gilead Sciences, Inc.",553139,12/31/24,02/25/25,2,"Ernst & Young LLP",,,,"San Mateo",CA,CALIFORNIA,"US West",10-K,2025-02-25,,"Arcus Biosciences, Inc.",1724521,"=""RCUS""","3928 POINT EDEN WAY",,HAYWARD,CA,CALIFORNIA,"US West",,,"=""2834""","Pharmaceutical Preparations",325412,"Pharmaceutical Preparation Manufacturing",34,15,12/31/24,"1,372,857,984",12/31/24,"258,000,000","-283,000,000",,"1,150,000,000"
42692,"Sales return and allowances","Sales deductions",553152,12/31/24,02/25/25,2,"Ernst & Young LLP",,,,"Los Angeles",CA,CALIFORNIA,"US West",10-K,2025-02-25,,"Arcutis Biotherapeutics, Inc.",1787306,"=""ARQT""","3027 TOWNSGATE ROAD","SUITE 300","WESTLAKE VILLAGE",CA,CALIFORNIA,"US West",,,"=""2834""","Pharmaceutical Preparations",325412,"Pharmaceutical Preparation Manufacturing",34,14,12/31/24,"1,641,623,040",12/31/24,"196,542,000","-140,039,000","148,062,000","348,889,000"
43633,"Shareholder valuation","Valuation of Earnout Shares Resulting from the AMP Transfer",554375,12/31/24,02/27/25,1,"PricewaterhouseCoopers LLP",104,PricewaterhouseCoopers,1366,Dublin,L2,IRELAND,Foreign,6-K,2025-02-27,,"Ardagh Metal Packaging S.A.",1845097,"=""AMBP""","56, RUE CHARLES MARTEL",,LUXEMBOURG,N4,LUXEMBOURG,Foreign,,,"=""3411""","Metal Cans",332431,"Metal Can Manufacturing",34,3,12/31/24,"1,799,046,912",12/31/24,"4,908,000,000","-3,000,000","-1,365,000,000","5,462,000,000"
44231,"Shareholder valuation","Valuation of Earnout Shares Resulting from the AMP Transfer",555412,12/31/24,02/27/25,1,"PricewaterhouseCoopers LLP",104,PricewaterhouseCoopers,1366,Dublin,L2,IRELAND,Foreign,6-K,2025-03-04,,"Ardagh Metal Packaging S.A.",1845097,"=""AMBP""","56, RUE CHARLES MARTEL",,LUXEMBOURG,N4,LUXEMBOURG,Foreign,,,"=""3411""","Metal Cans",332431,"Metal Can Manufacturing",34,3,12/31/24,"1,799,046,912",12/31/24,"4,908,000,000","-3,000,000","-1,365,000,000","5,462,000,000"
44256,"Shareholder valuation","Valuation of Earnout Shares Resulting from the AMP Transfer",555186,12/31/24,02/27/25,1,"PricewaterhouseCoopers LLP",104,PricewaterhouseCoopers,1366,Dublin,L2,IRELAND,Foreign,20-F,2025-03-04,,"Ardagh Metal Packaging S.A.",1845097,"=""AMBP""","56, RUE CHARLES MARTEL",,LUXEMBOURG,N4,LUXEMBOURG,Foreign,,,"=""3411""","Metal Cans",332431,"Metal Can Manufacturing",34,3,12/31/24,"1,799,046,912",12/31/24,"4,908,000,000","-3,000,000","-1,365,000,000","5,462,000,000"
41974,"Revenue from customer contracts","Estimates of Reserves for Variable Consideration Impacted by Estimated Payor Mix",552141,12/31/24,02/20/25,2,"Ernst & Young LLP",,,,Boston,MA,MASSACHUSETTS,"US New England",10-K,2025-02-20,,"ARDELYX, INC.",1437402,"=""ARDX""","34175 ARDENWOOD BLVD.",,FREMONT,CA,CALIFORNIA,"US West",,,"=""2834""","Pharmaceutical Preparations",325412,"Pharmaceutical Preparation Manufacturing",34,5,12/31/24,"1,206,740,224",12/31/24,"333,615,000","-39,136,000",,"435,754,000"
43363,"Revenue from customer contracts","Revenue Recognition – Contractual Adjustments and Implicit Price Concessions",554033,12/31/24,02/27/25,2,"Ernst & Young LLP",,,,Nashville,TN,TENNESSEE,"US Southeast",10-K,2025-02-27,,"Ardent Health, Inc.",1756655,"=""ARDT""","340 SEVEN SPRINGS WAY","SUITE 100",BRENTWOOD,TN,TENNESSEE,"US Southeast",,,"=""8062""","General Medical and Surgical Hospitals",622110,"General Medical and Surgical Hospitals",34,17,12/31/24,"2,438,132,736",12/31/24,"5,966,072,000","210,343,000","203,520,000","4,956,100,000"
43364,"Other contingent liabilities","Professional and General Liability and Related Costs",554033,12/31/24,02/27/25,2,"Ernst & Young LLP",,,,Nashville,TN,TENNESSEE,"US Southeast",10-K,2025-02-27,,"Ardent Health, Inc.",1756655,"=""ARDT""","340 SEVEN SPRINGS WAY","SUITE 100",BRENTWOOD,TN,TENNESSEE,"US Southeast",,,"=""8062""","General Medical and Surgical Hospitals",622110,"General Medical and Surgical Hospitals",34,17,12/31/24,"2,438,132,736",12/31/24,"5,966,072,000","210,343,000","203,520,000","4,956,100,000"
44502,"Property, plant and equipment","Determination of Vessel Asset Impairment Indicators — Refer to Note 2.16 to the financial statements.",556187,12/31/24,03/07/25,3,"Deloitte & Touche LLP",,,,"New York",NY,"NEW YORK","US Mid Atlantic",20-F,2025-03-07,,"Ardmore Shipping Corp",1577437,"=""ASC""","DORCHESTER HOUSE","7 CHURCH STREET",HAMILTON,D0,BERMUDA,Foreign,,,"=""4412""","Deep Sea Foreign Transportation of  Freight",483111,"Deep Sea Freight Transportation",34,12,01/02/25,"513,416,800",12/31/24,"405,784,000","133,006,000",,"704,799,000"
46737,Goodwill,"Valuation of goodwill",561551,12/31/24,04/15/25,4,"KPMG LLP",,,,Chicago,IL,ILLINOIS,"US Midwest",10-K,2025-04-15,Yes,"Arena Group Holdings, Inc.",894871,"=""AREN""","200 VESEY STREET","24TH FLOOR","NEW YORK",NY,"NEW YORK","US Mid Atlantic",,,"=""4841""","Cable and Other Pay Television Services",339113,"Surgical Appliance and Supplies Manufacturing",34,1,12/31/24,"63,725,396",12/31/24,"125,907,000","-100,710,000","-195,524,000","116,352,000"
46738,"Financial statements and disclosures","Sufficiency of audit evidence over programmatic advertising revenue and publisher revenue",561551,12/31/24,04/15/25,4,"KPMG LLP",,,,Chicago,IL,ILLINOIS,"US Midwest",10-K,2025-04-15,Yes,"Arena Group Holdings, Inc.",894871,"=""AREN""","200 VESEY STREET","24TH FLOOR","NEW YORK",NY,"NEW YORK","US Mid Atlantic",,,"=""4841""","Cable and Other Pay Television Services",339113,"Surgical Appliance and Supplies Manufacturing",34,1,12/31/24,"63,725,396",12/31/24,"125,907,000","-100,710,000","-195,524,000","116,352,000"
40708,"Other investments","Fair value of investments",548207,12/31/24,02/05/25,4,"KPMG LLP",,,,"Los Angeles",CA,CALIFORNIA,"US West",10-K,2025-02-05,,"ARES CAPITAL CORP",1287750,"=""ARCC""","245 PARK AVENUE, 44TH FLOOR",,"NEW YORK",NY,"NEW YORK","US Mid Atlantic",,,,,525990,"Other Financial Vehicles",34,22,01/02/25,"14,349,350,912",12/31/24,"2,275,000,000","1,522,000,000",,"28,254,000,000"
40982,"Allowance for credit losses","Current expected credit losses",550917,12/31/24,02/11/25,2,"Ernst & Young LLP",,,,"Los Angeles",CA,CALIFORNIA,"US West",10-K,2025-02-12,,"Ares Commercial Real Estate Corp",1529377,"=""ACRE""","245 PARK AVENUE","42ND FLOOR","NEW YORK",NY,"NEW YORK","US Mid Atlantic",,,"=""6798""","Real Estate Investment Trusts",525990,"Other Financial Vehicles",34,6,12/31/24,"321,253,440",12/31/24,"17,918,000","-34,993,000",,"1,751,206,000"
44451,"Other investments","Evaluation of financing obligations carried at fair value",555729,12/31/24,03/06/25,4,"KPMG LLP",,,,Denver,CO,COLORADO,"US West",10-K,2025-03-06,,"ARES INDUSTRIAL REAL ESTATE INCOME TRUST Inc.",1625941,"=""ZAIRDX""","1200 17TH STREET","SUITE 2900",DENVER,CO,COLORADO,"US West",,,"=""6798""","Real Estate Investment Trusts",525990,"Other Financial Vehicles",34,,,,12/31/24,"525,908,000","-111,058,000",,"7,581,011,000"
44452,"Real estate investments","Assessment of the expected hold periods for investments in real estate properties",555729,12/31/24,03/06/25,4,"KPMG LLP",,,,Denver,CO,COLORADO,"US West",10-K,2025-03-06,,"ARES INDUSTRIAL REAL ESTATE INCOME TRUST Inc.",1625941,"=""ZAIRDX""","1200 17TH STREET","SUITE 2900",DENVER,CO,COLORADO,"US West",,,"=""6798""","Real Estate Investment Trusts",525990,"Other Financial Vehicles",34,,,,12/31/24,"525,908,000","-111,058,000",,"7,581,011,000"
43333,"Equity investments and joint ventures","Valuation of underlying investments of equity method investments",553901,12/31/24,02/27/25,2,"Ernst & Young LLP",,,,"Los Angeles",CA,CALIFORNIA,"US West",10-K,2025-02-27,,"Ares Management Corp",1176948,"=""ARES""","1800 AVE OF THE STARS","SUITE 1400","LOS ANGELES",CA,CALIFORNIA,"US West",,,"=""6282""","Investment Advice",523930,"Investment Advice",34,179,01/02/25,"35,478,106,112",12/31/24,"2,906,480,000","463,742,000","1,979,378,000","24,884,308,000"
44424,"Other investments","Evaluation of financing obligations carried at fair value",555823,12/31/24,03/06/25,4,"KPMG LLP",,,,Denver,CO,COLORADO,"US West",10-K,2025-03-06,,"Ares Real Estate Income Trust Inc.",1327978,"=""ZAREDX""","ONE TABOR CENTER","1200 SEVENTEENTH STREET, SUITE 2900",DENVER,CO,COLORADO,"US West",,,"=""6798""","Real Estate Investment Trusts",525990,"Other Financial Vehicles",34,,,,12/31/24,"417,493,000","-37,135,000",,"5,731,249,000"
44425,"Real estate investments","Assessment of the expected hold periods for investments in real estate properties",555823,12/31/24,03/06/25,4,"KPMG LLP",,,,Denver,CO,COLORADO,"US West",10-K,2025-03-06,,"Ares Real Estate Income Trust Inc.",1327978,"=""ZAREDX""","ONE TABOR CENTER","1200 SEVENTEENTH STREET, SUITE 2900",DENVER,CO,COLORADO,"US West",,,"=""6798""","Real Estate Investment Trusts",525990,"Other Financial Vehicles",34,,,,12/31/24,"417,493,000","-37,135,000",,"5,731,249,000"
44586,"Other investments","Fair value of investments without a readily available market value",556902,12/31/24,03/10/25,4,"KPMG LLP",,,,"Los Angeles",CA,CALIFORNIA,"US West",424B3,2025-03-10,,"ARES STRATEGIC INCOME FUND",1918712,,"245 PARK AVE","44TH FLOOR","NEW YORK",NY,"NEW YORK","US Mid Atlantic",,,,,525990,"Other Financial Vehicles",34,,,,12/31/24,"554,209,000","324,399,000","5,900,696,000","12,149,914,000"
44601,"Other investments","Fair value of investments without a readily available market value",556630,12/31/24,03/10/25,4,"KPMG LLP",,,,"Los Angeles",CA,CALIFORNIA,"US West",10-K,2025-03-10,,"ARES STRATEGIC INCOME FUND",1918712,,"245 PARK AVE","44TH FLOOR","NEW YORK",NY,"NEW YORK","US Mid Atlantic",,,,,525990,"Other Financial Vehicles",34,,,,12/31/24,"554,209,000","324,399,000","5,900,696,000","12,149,914,000"
46915,"Other investments","Fair value of investments without a readily available market value",562392,12/31/24,03/10/25,4,"KPMG LLP",,,,"Los Angeles",CA,CALIFORNIA,"US West",N-2,2025-04-23,,"ARES STRATEGIC INCOME FUND",1918712,,"245 PARK AVE","44TH FLOOR","NEW YORK",NY,"NEW YORK","US Mid Atlantic",,,,,525990,"Other Financial Vehicles",34,,,,12/31/24,"554,209,000","324,399,000","5,900,696,000","12,149,914,000"
48005,"Other investments","Fair value of investments without a readily available market value",568904,12/31/24,03/10/25,4,"KPMG LLP",,,,"Los Angeles",CA,CALIFORNIA,"US West",N-2,2025-07-22,,"ARES STRATEGIC INCOME FUND",1918712,,"245 PARK AVE","44TH FLOOR","NEW YORK",NY,"NEW YORK","US Mid Atlantic",,,,,525990,"Other Financial Vehicles",34,,,,12/31/24,"554,209,000","324,399,000","5,900,696,000","12,149,914,000"
48157,"Other investments","Fair value of investments without a readily available market value",570133,12/31/24,03/10/25,4,"KPMG LLP",,,,"Los Angeles",CA,CALIFORNIA,"US West",DRS,2025-04-25,,"ARES STRATEGIC INCOME FUND",1918712,,"245 PARK AVE","44TH FLOOR","NEW YORK",NY,"NEW YORK","US Mid Atlantic",,,,,525990,"Other Financial Vehicles",34,,,,12/31/24,"554,209,000","324,399,000","5,900,696,000","12,149,914,000"
48674,"Other investments","Fair value of investments without a readily available market value",574432,12/31/24,03/10/25,4,"KPMG LLP",,,,"Los Angeles",CA,CALIFORNIA,"US West",N-2/A,2025-10-24,,"ARES STRATEGIC INCOME FUND",1918712,,"245 PARK AVE","44TH FLOOR","NEW YORK",NY,"NEW YORK","US Mid Atlantic",,,,,525990,"Other Financial Vehicles",34,,,,12/31/24,"554,209,000","324,399,000","5,900,696,000","12,149,914,000"
45288,"Sales return and allowances","Trade and Other Payables | US Sales rebates and reserves — Refer to Notes 2.17, 3 and 14 to the financial statements",558233,12/31/24,03/20/25,3,"Deloitte & Touche LLP",21,"Deloitte Accountants BV",1243,Rotterdam,P7,NETHERLANDS,Foreign,20-F,2025-03-20,,"ARGENX SE",1697862,"=""ARGX""","INDUSTRIEPARK ZWIJNAARDE 7","BUILDING C B-9052",ZWIJNAARDE,C9,BELGIUM,Foreign,,,"=""2836""","Biological Products, Except Diagnostic Substances",325414,"Biological Product (except Diagnostic) Manufacturing",34,620,01/02/25,"36,710,051,840",12/31/24,"2,252,039,000","833,040,000","5,316,838,000","6,202,522,000"
45289,"Deferred income taxes","Deferred Tax Assets | Recognition of deferred tax assets in Belgium — Refer to Notes 2.16, 3 and 23 to the financial statements",558233,12/31/24,03/20/25,3,"Deloitte & Touche LLP",21,"Deloitte Accountants BV",1243,Rotterdam,P7,NETHERLANDS,Foreign,20-F,2025-03-20,,"ARGENX SE",1697862,"=""ARGX""","INDUSTRIEPARK ZWIJNAARDE 7","BUILDING C B-9052",ZWIJNAARDE,C9,BELGIUM,Foreign,,,"=""2836""","Biological Products, Except Diagnostic Substances",325414,"Biological Product (except Diagnostic) Manufacturing",34,620,01/02/25,"36,710,051,840",12/31/24,"2,252,039,000","833,040,000","5,316,838,000","6,202,522,000"
45546,"Insurance contract liabilities","Reserves for losses and loss adjustment expenses – estimates of the reserve for unpaid costs of losses and loss adjustment expenses – Refer to Notes 1 and 7 to the financial statements",558655,12/31/24,03/25/25,3,"Deloitte & Touche LLP",,,,"New York",NY,"NEW YORK","US Mid Atlantic",10-K,2025-03-25,,"Argo Group International Holdings, Inc.",1091748,"=""ARGD""","501 7TH AVENUE, 7TH FLOOR",,"NEW YORK",NY,"NEW YORK","US Mid Atlantic",,,"=""6361""","Title Insurance",524126,"Direct Property and Casualty Insurance Carriers",34,25,01/02/25,"31,441,100,800",12/31/24,"1,359,600,000","-148,100,000","1,464,200,000","8,879,600,000"
43113,"Internal controls","Consolidated Financial Statements – Impact of Controls Related to Financial Reporting",553700,12/31/24,02/26/25,1,"PricewaterhouseCoopers LLP",,,,Cleveland,OH,OHIO,"US Midwest",10-K,2025-02-26,,"Arhaus, Inc.",1875444,"=""ARHS""","51 EAST HINES HILL ROAD",,"BOSTON HEIGHTS",OH,OHIO,"US Midwest",,,"=""5712""","Furniture Stores",442110,"Furniture Stores",34,9,12/31/24,"503,032,192",12/31/24,"1,271,107,000","68,550,000","332,784,000","1,206,316,000"
41775,Inventory,"Inventory Valuation and Contract Manufacturer/Supplier Liabilities",551913,12/31/24,02/18/25,2,"Ernst & Young LLP",,,,"San Mateo",CA,CALIFORNIA,"US West",10-K,2025-02-19,,"Arista Networks, Inc.",1596532,"=""ANET""","5453 GREAT AMERICA PARKWAY",,"SANTA CLARA",CA,CALIFORNIA,"US West",,,"=""3576""","Computer Communications Equipment",511210,"Software Publishers",34,111,12/31/24,"139,415,240,704",12/31/24,"7,003,146,000","2,852,054,000","9,664,267,000","14,043,921,000"
42757,"Regulatory assets and liabilities","Regulatory Accounting – Impact of Rate Regulation on the Financial Statements — Refer to Notes 1 and 3 to the financial statements",553206,12/31/24,02/25/25,3,"Deloitte & Touche LLP",,,,Tempe,AZ,ARIZONA,"US Southwest",10-K,2025-02-25,,"ARIZONA PUBLIC SERVICE CO",7286,,"400 NORTH FIFTH STREET",,PHOENIX,AZ,ARIZONA,"US Southwest",764622,"PINNACLE WEST CAPITAL CORP","=""4931""","Electric and Other Services Combined",221112,"Fossil Fuel Electric Power Generation",34,,,,12/31/24,"5,124,915,000","641,925,000","7,682,011,000","25,988,235,000"
43477,"Warranty liabilities","Accrued Sales Returns – Refer to Notes 3 and 4 to the Financial Statements",554010,12/31/24,02/27/25,3,"Deloitte & Touche LLP",,,,"Costa Mesa",CA,CALIFORNIA,"US West",10-K,2025-02-27,,"Arlo Technologies, Inc.",1736946,"=""ARLO""","5770 FLEET STREET",,CARLSBAD,CA,CALIFORNIA,"US West",,,"=""3651""","Household Audio and Video Equipment",334310,"Audio and Video Equipment Manufacturing",34,11,12/31/24,"1,128,904,960",12/31/24,"510,886,000","-30,504,000","89,871,000","298,400,000"
38467,"Revenue from customer contracts","Revenue Recognition for Material Long-Term Revenue Arrangements - Refer to Notes 1 and 4 to the Consolidated Financial Statements",536692,03/31/24,05/29/24,3,"Deloitte & Touche LLP",,,,"San Jose",CA,CALIFORNIA,"US West",20-F,2024-05-29,,"ARM HOLDINGS PLC /UK",1973239,"=""ARM""","110 FULBOURN ROAD",,CAMBRIDGE,X0,"UNITED KINGDOM",Foreign,,,"=""3674""","Semiconductors and Related Devices",334413,"Semiconductor and Related Device Manufacturing",34,125,03/31/24,"130,030,911,488",03/31/24,"3,233,000,000","306,000,000","3,518,000,000","7,927,000,000"
43845,"Allowance for credit losses","Allowance for Loan Losses - Notes Receivable",554678,12/31/24,02/27/25,2,"Ernst & Young LLP",,,,Richmond,VA,VIRGINIA,"US Mid Atlantic",10-K,2025-02-28,,"Armada Hoffler Properties, Inc.",1569187,"=""AHH""","222 CENTRAL PARK AVENUE","SUITE 2100","VIRGINIA BEACH",VA,VIRGINIA,"US Mid Atlantic",,,"=""6500""","Real Estate",525990,"Other Financial Vehicles",34,10,12/31/24,"815,289,472",12/31/24,"708,470,000","35,645,000","580,897,000","2,512,863,000"
46982,"Allowance for credit losses","Allowance for Loan Losses - Notes Receivable",562683,12/31/24,02/27/25,2,"Ernst & Young LLP",,,,Richmond,VA,VIRGINIA,"US Mid Atlantic",ARS,2025-04-25,,"Armada Hoffler Properties, Inc.",1569187,"=""AHH""","222 CENTRAL PARK AVENUE","SUITE 2100","VIRGINIA BEACH",VA,VIRGINIA,"US Mid Atlantic",,,"=""6500""","Real Estate",525990,"Other Financial Vehicles",34,10,12/31/24,"815,289,472",12/31/24,"708,470,000","35,645,000","580,897,000","2,512,863,000"
45420,"Research and development expenses","Accrued clinical trial expenses and related research and development costs",558339,12/31/24,03/20/25,2,"Ernst & Young LLP",,,,"San Diego",CA,CALIFORNIA,"US West",10-K,2025-03-21,Yes,"Armata Pharmaceuticals, Inc.",921114,"=""ARMP""","5005 MCCONNELL AVE",,"LOS ANGELES",CA,CALIFORNIA,"US West",,,"=""2836""","Biological Products, Except Diagnostic Substances",325414,"Biological Product (except Diagnostic) Manufacturing",34,2,01/02/25,"70,520,800",12/31/24,"5,174,000","-18,916,000","-61,765,000","86,437,000"
42770,"Pension and other post-employment benefits","Pension and postretirement benefit obligations",553215,12/31/24,02/25/25,4,"KPMG LLP",,,,Philadelphia,PA,PENNSYLVANIA,"US Mid Atlantic",10-K,2025-02-25,,"ARMSTRONG WORLD INDUSTRIES INC",7431,"=""AWI""","2500 COLUMBIA AVE",,LANCASTER,PA,PENNSYLVANIA,"US Mid Atlantic",,,"=""3089""","Plastics Products, NEC",326199,"All Other Plastics Product Manufacturing",34,141,12/31/24,"6,156,568,064",12/31/24,"1,445,700,000","264,900,000","98,900,000","1,842,700,000"
42341,"Revenue from customer contracts","Revenue Recognition - Retail Service and Equipment Sales Revenue",552520,12/31/24,02/21/25,1,"PricewaterhouseCoopers LLP",,,,Chicago,IL,ILLINOIS,"US Midwest",10-K,2025-02-21,,"ARRAY DIGITAL INFRASTRUCTURE, INC.",821130,"=""AD""","500 WEST MADISON STREET","SUITE 810",CHICAGO,IL,ILLINOIS,"US Midwest",1051512,"TELEPHONE & DATA SYSTEMS INC /DE/","=""4812""","Radiotelephone Communications",517212,"Cellular and Other Wireless Telecommunications",34,63,12/31/24,"3,266,971,392",12/31/24,"3,770,000,000","-39,000,000","14,000,000","10,449,000,000"
44079,Goodwill,"Goodwill and Long-Lived Assets– STI Operations– Refer to Note 2 and 7 to the financial statements",555042,12/31/24,02/28/25,3,"Deloitte & Touche LLP",,,,Tempe,AZ,ARIZONA,"US Southwest",10-K,2025-03-03,,"Array Technologies, Inc.",1820721,"=""ARRY""","3901 MIDWAY PLACE NE",,ALBUQUERQUE,NM,"NEW MEXICO","US Southwest",,,"=""3990""","Miscellaneous Manufacturing Industries",335121,"Residential Electric Lighting Fixture Manufacturing",34,7,01/02/25,"1,024,095,680",12/31/24,"915,807,000","-240,394,000","-52,763,000","1,425,999,000"
40883,Inventory,"Evaluation of net realizable value adjustments to inventories for excess or obsolescence",550695,12/31/24,02/11/25,2,"Ernst & Young LLP",,,,Denver,CO,COLORADO,"US West",10-K,2025-02-11,,"ARROW ELECTRONICS, INC.",7536,"=""ARW""","7459 S LIMA STREET",,ENGLEWOOD,CO,COLORADO,"US West",,,"=""5065""","Electronic Parts and Equipment, NEC",423610,"Electrical Apparatus and Equipment, Wiring Supplies, and Related Equipment Merchant  Wholesalers",34,111,01/02/25,"5,857,515,008",12/31/24,"27,923,324,000","392,074,000","3,609,150,000","21,757,707,000"
40884,Goodwill,"Evaluation of Americas Components Goodwill for Impairment",550695,12/31/24,02/11/25,2,"Ernst & Young LLP",,,,Denver,CO,COLORADO,"US West",10-K,2025-02-11,,"ARROW ELECTRONICS, INC.",7536,"=""ARW""","7459 S LIMA STREET",,ENGLEWOOD,CO,COLORADO,"US West",,,"=""5065""","Electronic Parts and Equipment, NEC",423610,"Electrical Apparatus and Equipment, Wiring Supplies, and Related Equipment Merchant  Wholesalers",34,111,01/02/25,"5,857,515,008",12/31/24,"27,923,324,000","392,074,000","3,609,150,000","21,757,707,000"
40103,"Revenue from customer contracts","Sufficiency of audit evidence over valuation of future royalty sales liability",544484,09/30/24,11/26/24,4,"KPMG LLP",,,,"San Diego",CA,CALIFORNIA,"US West",10-K,2024-11-26,,"ARROWHEAD PHARMACEUTICALS, INC.",879407,"=""ARWR""","177 E COLORADO BLVD","SUITE 700",PASADENA,CA,CALIFORNIA,"US West",,,"=""2834""","Pharmaceutical Preparations",541710,"Research and Development in the Physical, Engineering, and Life Sciences",34,19,09/30/24,"2,409,163,008",09/30/24,"3,551,000","-599,493,000","176,882,000","1,139,802,000"
41692,"Business combinations","Accounting for business combinations",551785,12/31/24,02/17/25,2,"Ernst & Young LLP",,,,Chicago,IL,ILLINOIS,"US Midwest",10-K,2025-02-18,,"Arthur J. Gallagher & Co.",354190,"=""AJG""","2850 GOLF ROAD",,"ROLLING MEADOWS",IL,ILLINOIS,"US Midwest",,,"=""6411""","Insurance Agents, Brokers, and Service",524210,"Insurance Agencies and Brokerages",34,276,01/02/25,"60,530,266,112",12/31/24,"11,554,900,000","1,462,700,000","3,353,200,000","64,255,200,000"
42808,"Deferred income taxes","Income Taxes – Deferred Tax Assets and Amounts Payable Under Tax Receivable Agreements",553257,12/31/24,02/25/25,1,"PricewaterhouseCoopers LLP",,,,Chicago,IL,ILLINOIS,"US Midwest",10-K,2025-02-25,,"Artisan Partners Asset Management Inc.",1517302,"=""APAM""","875 E. WISCONSIN AVENUE","SUITE 800",MILWAUKEE,WI,WISCONSIN,"US Midwest",,,"=""6282""","Investment Advice",523120,"Securities Brokerage",34,43,01/02/25,"2,978,638,336",12/31/24,"1,103,192,000","260,252,000",,"1,618,756,000"
43840,"Deferred and capitalized costs","Deferred Preservation Costs",554650,12/31/24,02/28/25,2,"Ernst & Young LLP",,,,Atlanta,GA,GEORGIA,"US Southeast",10-K,2025-02-28,,"ARTIVION, INC.",784199,"=""AORT""","1655 ROBERTS BOULEVARD N W",,KENNESAW,GA,GEORGIA,"US Southeast",,,"=""3841""","Surgical and Medical Instruments and Apparatus",541710,"Research and Development in the Physical, Engineering, and Life Sciences",34,28,01/02/25,"1,177,110,656",12/31/24,"388,537,000","-13,359,000","-68,261,000","789,101,000"
40900,"Revenue from customer contracts","Research Collaboration and License Agreements – Novartis License and Asset Agreements – Refer to Notes 2 and 3 in the Consolidated Financial Statements",550653,12/31/24,02/11/25,3,"Deloitte & Touche LLP",,,,Boston,MA,MASSACHUSETTS,"US New England",10-K,2025-02-11,,"ARVINAS, INC.",1655759,"=""ARVN""","395 WINCHESTER AVE","5 SCIENCE PARK","NEW HAVEN",CT,CONNECTICUT,"US New England",,,"=""2834""","Pharmaceutical Preparations",325412,"Pharmaceutical Preparation Manufacturing",34,19,12/31/24,"1,318,896,000",12/31/24,"263,400,000","-198,900,000",,"1,091,400,000"
35947,"Revenue from customer contracts","Revenue Recognition",530045,01/31/24,03/14/24,1,"PricewaterhouseCoopers LLP",,,,"San Francisco",CA,CALIFORNIA,"US West",10-K,2024-03-14,,"Asana, Inc.",1477720,"=""ASAN""","633 FOLSOM STREET","SUITE 100","SAN FRANCISCO",CA,CALIFORNIA,"US West",,,"=""7372""","Prepackaged Software",511210,"Software Publishers",34,17,01/31/24,"2,425,535,744",01/31/24,"652,504,000","-257,030,000",,"961,960,000"
42926,"Goodwill and intangible assets","Goodwill and Manufacturer Franchise Rights Interim Quantitative Impairment Assessment",553500,12/31/24,02/26/25,2,"Ernst & Young LLP",,,,Atlanta,GA,GEORGIA,"US Southeast",10-K,2025-02-26,,"ASBURY AUTOMOTIVE GROUP INC",1144980,"=""ABG""","6655 PEACHTREE DUNWOODY ROAD",,ATLANTA,GA,GEORGIA,"US Southeast",,,"=""5500""","Retail-Auto Dealers & Gasoline Stations",441110,"New Car Dealers",34,236,01/02/25,"4,630,866,944",12/31/24,"17,188,600,000","430,300,000","-454,000,000","10,337,200,000"
40996,"Sales return and allowances","Revenue and provisions – US commercial sales deductions – Refer to Notes 2 and 3 to the financial statements",550927,12/31/24,02/12/25,3,"Deloitte & Touche LLP",582,"Deloitte Statsautoriseret Revisionspartnerselskab",1294,Copenhagen,G7,DENMARK,Foreign,20-F,2025-02-12,,"Ascendis Pharma A/S",1612042,"=""ASND""","TUBORG BOULEVARD 12",,HELLERUP,G7,DENMARK,Foreign,,,"=""2834""","Pharmaceutical Preparations",325412,"Pharmaceutical Preparation Manufacturing",34,138,01/02/25,"7,963,626,496",12/31/24,"376,553,000","-391,509,000","-113,630,000","1,221,376,000"
45810,Goodwill,"Goodwill – Allocated to the Packaging and Testing Segments for Impairment - Refer to Notes 4, 5 and 18 to the consolidated financial statements",559076,12/31/24,03/26/25,3,"Deloitte & Touche LLP",28,"Deloitte & Touche",1060,Taipei,F5,TAIWAN,Foreign,20-F,2025-03-27,,"ASE Technology Holding Co., Ltd.",1122411,"=""ASX""","26, CHIN 3RD RD.","NANZIH DISTRICT",KAOHSIUNG,F5,TAIWAN,Foreign,,,"=""3674""","Semiconductors and Related Devices",334413,"Semiconductor and Related Device Manufacturing",34,10,01/02/25,"43,931,955,200",12/31/24,"18,161,314,000","1,031,491,000","7,680,720,000","22,603,977,000"
42526,"Goodwill and intangible assets","Goodwill and Identifiable Intangible Assets, net — Creative Circle Reporting Unit — Refer to Notes 2 and 6 of the financial statements",552934,12/31/24,02/21/25,3,"Deloitte & Touche LLP",,,,Richmond,VA,VIRGINIA,"US Mid Atlantic",10-K,2025-02-24,,"ASGN Inc",890564,"=""ASGN""","4400 COX ROAD, SUITE 110",,"GLEN ALLEN",VA,VIRGINIA,"US Mid Atlantic",,,"=""7363""","Help Supply Services",561310,"Employment Placement Agencies",34,83,01/02/25,"3,662,412,032",12/31/24,"4,099,700,000","175,200,000","-556,200,000","3,429,000,000"
40004,"Asset retirement and environmental obligations","Valuation of Environmental Remediation Reserves",544127,09/30/24,11/18/24,2,"Ernst & Young LLP",,,,"Grandview Heights",OH,OHIO,"US Midwest",10-K,2024-11-18,,"ASHLAND INC.",1674862,"=""ASH""","8145 BLAZER DRIVE",,WILMINGTON,DE,DELAWARE,"US Mid Atlantic",,,"=""5160""","Wholesale-Chemicals & Allied Products",424690,"Other Chemical and Allied Products Merchant Wholesalers",34,85,10/02/24,"4,165,358,336",09/30/24,"2,113,000,000","169,000,000","736,000,000","5,645,000,000"
40005,"Other contingent liabilities","Valuation of Asbestos Litigation Reserves",544127,09/30/24,11/18/24,2,"Ernst & Young LLP",,,,"Grandview Heights",OH,OHIO,"US Midwest",10-K,2024-11-18,,"ASHLAND INC.",1674862,"=""ASH""","8145 BLAZER DRIVE",,WILMINGTON,DE,DELAWARE,"US Mid Atlantic",,,"=""5160""","Wholesale-Chemicals & Allied Products",424690,"Other Chemical and Allied Products Merchant Wholesalers",34,85,10/02/24,"4,165,358,336",09/30/24,"2,113,000,000","169,000,000","736,000,000","5,645,000,000"
46223,"Revenue from customer contracts","Revenue Recognition – Estimating Measure of Progress for Supply, Delivery and Installation (“SDI”) Contracts",559661,12/31/24,03/31/25,1,"PricewaterhouseCoopers LLP",331,"PricewaterhouseCoopers Taiwan",1345,Taipei,F5,TAIWAN,Foreign,20-F,2025-03-31,,"ASIA PACIFIC WIRE & CABLE CORP LTD",1026980,"=""APWC""","15/FL. B, NO. 77, SEC. 2,","DUNHUA SOUTH ROAD","TAIPEI, 106",F5,TAIWAN,Foreign,,,"=""3357""","Drawing and Insulating of Nonferrous Wire",332618,"Other Fabricated Wire Product Manufacturing",34,1,12/31/24,"30,305,854",12/31/24,"472,672,000","6,568,000","154,848,000","339,860,000"
44276,"Revenue from customer contracts","Revenue recognition – Identification of distinct performance obligations in certain volume purchase agreements",555586,12/31/24,03/05/25,4,"KPMG LLP",76,"KPMG Accountants NV",1012,Amstelveen,P7,NETHERLANDS,Foreign,20-F,2025-03-05,,"ASML HOLDING NV",937966,"=""ASML""","DE RUN 6501",,"DR VELDHOVEN",P7,NETHERLANDS,Foreign,,,"=""3559""","Special  Industry Machinery, NEC",333295,"Semiconductor Machinery Manufacturing",34,700,01/02/25,"275,560,431,616",12/31/24,"29,266,400,000","7,840,400,000","13,738,000,000","50,314,900,000"
43208,Inventory,"Net realizable value of certain inventories",553885,12/31/24,02/27/25,4,"KPMG LLP",,,,Boston,MA,MASSACHUSETTS,"US New England",10-K,2025-02-27,,"ASPEN AEROGELS INC",1145986,"=""ASPN""","30 FORBES ROAD","BUILDING B",NORTHBOROUGH,MA,MASSACHUSETTS,"US New England",,,"=""5030""","Wholesale-Lumber & Other Construction Materials",541330,"Engineering Services",34,12,01/02/25,"998,515,520",12/31/24,"452,699,000","17,784,000",,"895,144,000"
45202,"Insurance contract liabilities","Valuation of Incurred but not Reported Reserve Estimates, Gross and Net of Reinsurance",558040,12/31/24,03/19/25,2,"Ernst & Young LLP",33,"Ernst & Young Ltd",1277,Hamilton,D0,BERMUDA,Foreign,20-F,2025-03-19,,"ASPEN INSURANCE HOLDINGS LTD",1267395,"=""AHL""","11 VICTORIA ST",,HAMILTON,D0,BERMUDA,Foreign,,,"=""6331""","Fire, Marine, and Casualty Insurance",524130,"Reinsurance Carriers",34,25,12/31/24,"1,510,499,968",12/31/24,"3,260,300,000","486,100,000","3,352,000,000","15,748,500,000"
45203,"Other investments","Valuation of Privately–Held Investments",558040,12/31/24,03/19/25,2,"Ernst & Young LLP",33,"Ernst & Young Ltd",1277,Hamilton,D0,BERMUDA,Foreign,20-F,2025-03-19,,"ASPEN INSURANCE HOLDINGS LTD",1267395,"=""AHL""","11 VICTORIA ST",,HAMILTON,D0,BERMUDA,Foreign,,,"=""6331""","Fire, Marine, and Casualty Insurance",524130,"Reinsurance Carriers",34,25,12/31/24,"1,510,499,968",12/31/24,"3,260,300,000","486,100,000","3,352,000,000","15,748,500,000"
45305,"Insurance contract liabilities","Valuation of Incurred but not Reported Reserve Estimates, Gross and Net of Reinsurance",558280,12/31/24,03/19/25,2,"Ernst & Young LLP",33,"Ernst & Young Ltd",1277,Hamilton,D0,BERMUDA,Foreign,F-1/A,2025-03-20,,"ASPEN INSURANCE HOLDINGS LTD",1267395,"=""AHL""","11 VICTORIA ST",,HAMILTON,D0,BERMUDA,Foreign,,,"=""6331""","Fire, Marine, and Casualty Insurance",524130,"Reinsurance Carriers",34,25,12/31/24,"1,510,499,968",12/31/24,"3,260,300,000","486,100,000","3,352,000,000","15,748,500,000"
45306,"Other investments","Valuation of Privately–Held Investments",558280,12/31/24,03/19/25,2,"Ernst & Young LLP",33,"Ernst & Young Ltd",1277,Hamilton,D0,BERMUDA,Foreign,F-1/A,2025-03-20,,"ASPEN INSURANCE HOLDINGS LTD",1267395,"=""AHL""","11 VICTORIA ST",,HAMILTON,D0,BERMUDA,Foreign,,,"=""6331""","Fire, Marine, and Casualty Insurance",524130,"Reinsurance Carriers",34,25,12/31/24,"1,510,499,968",12/31/24,"3,260,300,000","486,100,000","3,352,000,000","15,748,500,000"
47136,"Insurance contract liabilities","Valuation of Incurred but not Reported Reserve Estimates, Gross and Net of Reinsurance",563554,12/31/24,03/19/25,2,"Ernst & Young LLP",33,"Ernst & Young Ltd",1277,Hamilton,D0,BERMUDA,Foreign,6-K,2025-04-29,,"ASPEN INSURANCE HOLDINGS LTD",1267395,"=""AHL""","11 VICTORIA ST",,HAMILTON,D0,BERMUDA,Foreign,,,"=""6331""","Fire, Marine, and Casualty Insurance",524130,"Reinsurance Carriers",34,25,12/31/24,"1,510,499,968",12/31/24,"3,260,300,000","486,100,000","3,352,000,000","15,748,500,000"
47137,"Other investments","Valuation of Privately–Held Investments",563554,12/31/24,03/19/25,2,"Ernst & Young LLP",33,"Ernst & Young Ltd",1277,Hamilton,D0,BERMUDA,Foreign,6-K,2025-04-29,,"ASPEN INSURANCE HOLDINGS LTD",1267395,"=""AHL""","11 VICTORIA ST",,HAMILTON,D0,BERMUDA,Foreign,,,"=""6331""","Fire, Marine, and Casualty Insurance",524130,"Reinsurance Carriers",34,25,12/31/24,"1,510,499,968",12/31/24,"3,260,300,000","486,100,000","3,352,000,000","15,748,500,000"
47140,"Insurance contract liabilities","Valuation of Incurred but not Reported Reserve Estimates, Gross and Net of Reinsurance",563356,12/31/24,03/19/25,2,"Ernst & Young LLP",33,"Ernst & Young Ltd",1277,Hamilton,D0,BERMUDA,Foreign,F-1/A,2025-04-29,,"ASPEN INSURANCE HOLDINGS LTD",1267395,"=""AHL""","11 VICTORIA ST",,HAMILTON,D0,BERMUDA,Foreign,,,"=""6331""","Fire, Marine, and Casualty Insurance",524130,"Reinsurance Carriers",34,25,12/31/24,"1,510,499,968",12/31/24,"3,260,300,000","486,100,000","3,352,000,000","15,748,500,000"
47141,"Other investments","Valuation of Privately–Held Investments",563356,12/31/24,03/19/25,2,"Ernst & Young LLP",33,"Ernst & Young Ltd",1277,Hamilton,D0,BERMUDA,Foreign,F-1/A,2025-04-29,,"ASPEN INSURANCE HOLDINGS LTD",1267395,"=""AHL""","11 VICTORIA ST",,HAMILTON,D0,BERMUDA,Foreign,,,"=""6331""","Fire, Marine, and Casualty Insurance",524130,"Reinsurance Carriers",34,25,12/31/24,"1,510,499,968",12/31/24,"3,260,300,000","486,100,000","3,352,000,000","15,748,500,000"
47322,"Insurance contract liabilities","Valuation of Incurred but not Reported Reserve Estimates, Gross and Net of Reinsurance",564586,12/31/24,03/19/25,2,"Ernst & Young LLP",33,"Ernst & Young Ltd",1277,Hamilton,D0,BERMUDA,Foreign,424B4,2025-05-08,,"ASPEN INSURANCE HOLDINGS LTD",1267395,"=""AHL""","11 VICTORIA ST",,HAMILTON,D0,BERMUDA,Foreign,,,"=""6331""","Fire, Marine, and Casualty Insurance",524130,"Reinsurance Carriers",34,25,12/31/24,"1,510,499,968",12/31/24,"3,260,300,000","486,100,000","3,352,000,000","15,748,500,000"
47323,"Other investments","Valuation of Privately–Held Investments",564586,12/31/24,03/19/25,2,"Ernst & Young LLP",33,"Ernst & Young Ltd",1277,Hamilton,D0,BERMUDA,Foreign,424B4,2025-05-08,,"ASPEN INSURANCE HOLDINGS LTD",1267395,"=""AHL""","11 VICTORIA ST",,HAMILTON,D0,BERMUDA,Foreign,,,"=""6331""","Fire, Marine, and Casualty Insurance",524130,"Reinsurance Carriers",34,25,12/31/24,"1,510,499,968",12/31/24,"3,260,300,000","486,100,000","3,352,000,000","15,748,500,000"
39110,"Revenue from customer contracts","Sufficiency of audit evidence over revenue",539997,06/30/24,08/13/24,4,"KPMG LLP",,,,Boston,MA,MASSACHUSETTS,"US New England",10-K,2024-08-13,,"Aspen Technology, Inc.",1897982,,"20 CROSBY DRIVE",,BEDFORD,MA,MASSACHUSETTS,"US New England",,,"=""7371""","Computer Programming Services",541511,"Custom Computer Programming Services",34,195,07/02/24,"12,351,464,448",06/30/24,"1,127,482,000","-9,771,000","299,904,000","14,071,707,000"
39793,"Revenue from customer contracts","Sufficiency of audit evidence over revenue",542877,06/30/24,08/13/24,4,"KPMG LLP",,,,Boston,MA,MASSACHUSETTS,"US New England",ARS,2024-10-24,,"Aspen Technology, Inc.",1897982,,"20 CROSBY DRIVE",,BEDFORD,MA,MASSACHUSETTS,"US New England",,,"=""7371""","Computer Programming Services",541511,"Custom Computer Programming Services",34,195,07/02/24,"12,351,464,448",06/30/24,"1,127,482,000","-9,771,000","299,904,000","14,071,707,000"
45233,"Revenue from customer contracts","Collaboration Agreement with Gilead Sciences, Inc.",558162,12/31/24,03/20/25,2,"Ernst & Young LLP",,,,"San Jose",CA,CALIFORNIA,"US West",10-K,2025-03-20,,"ASSEMBLY BIOSCIENCES, INC.",1426800,"=""ASMB""","TWO TOWER PLACE","7TH FLOOR","SOUTH SAN FRANCISCO",CA,CALIFORNIA,"US West",,,"=""2834""","Pharmaceutical Preparations",541710,"Research and Development in the Physical, Engineering, and Life Sciences",34,17,01/02/25,"109,010,304",12/31/24,"28,520,000","-40,177,000",,"119,168,000"
40909,"Allowance for credit losses","Assessment of the allowance for credit losses related to loans, excluding individually analyzed loans",550856,12/31/24,02/12/25,4,"KPMG LLP",,,,Chicago,IL,ILLINOIS,"US Midwest",10-K,2025-02-12,,"ASSOCIATED BANC-CORP",7789,"=""ASB""","433 MAIN STREET",,"GREEN BAY",WI,WISCONSIN,"US Midwest",,,"=""6022""","State Commercial Banks",522110,"Commercial Banking",34,24,01/02/25,"3,569,618,432",12/31/24,"952,855,000","123,144,000","3,468,909,000","43,023,067,000"
42059,"Insurance contract liabilities","Valuation of Claims and Benefits Payable Reserves for Global Lifestyle and Global Housing Short Duration Insurance Contracts",552210,12/31/24,02/20/25,1,"PricewaterhouseCoopers LLP",,,,"New York",NY,"NEW YORK","US Mid Atlantic",10-K,2025-02-20,,"ASSURANT, INC.",1267238,"=""AIZ""","ONE CHASE MANHATTAN PLAZA",,"NEW YORK",NY,"NEW YORK","US Mid Atlantic",,,"=""6399""","Insurance Carriers, NEC",524130,"Reinsurance Carriers",34,211,01/02/25,"10,842,663,936",12/31/24,"11,877,500,000","760,200,000","1,955,100,000","35,020,600,000"
43709,"Insurance contract liabilities","Valuation of the Loss and Loss Adjustment Expense (LAE) Reserve and the Salvage and Subrogation Recoverable - Estimation of the Expected Loss to be Paid (Recovered) Related to Public Finance Obligations",554459,12/31/24,02/28/25,1,"PricewaterhouseCoopers LLP",,,,"New York",NY,"NEW YORK","US Mid Atlantic",10-K,2025-02-28,,"ASSURED GUARANTY LTD",1273813,"=""AGO""","30 WOODBOURNE AVENUE","5TH FLOOR",HAMILTON,D0,BERMUDA,Foreign,,,"=""6351""","Surety Insurance",524292,"Third Party Administration of Insurance and Pension Funds",34,90,12/31/24,"4,545,984,000",12/31/24,"872,000,000","376,000,000",,"11,901,000,000"
44080,"Other liabilities and provisions","Valuation of liability for private placement warrants",555050,12/31/24,03/03/25,4,"KPMG LLP",,,,Miami,FL,FLORIDA,"US Southeast",10-K,2025-03-03,,"AST SpaceMobile, Inc.",1780312,"=""ASTS""","MIDLAND INTL. AIR & SPACE PORT","2901 ENTERPRISE LANE",MIDLAND,TX,TEXAS,"US Southwest",,,"=""4899""","Communications Services, NEC",334220,"Radio and Television Broadcasting and Wireless Communications Equipment Manufacturing",34,21,12/31/24,"4,392,454,656",12/31/24,"4,418,000","-300,083,000",,"954,561,000"
43042,"Revenue from customer contracts","Revenue Recognition – Certain Contracts with Customers – Refer to Note 2 to the financial statements",553596,12/31/24,02/26/25,3,"Deloitte & Touche LLP",,,,Nashville,TN,TENNESSEE,"US Southeast",10-K,2025-02-26,,"ASTEC INDUSTRIES INC",792987,"=""ASTE""","1725 SHEPHERD ROAD",,CHATTANOOGA,TN,TENNESSEE,"US Southeast",,,"=""3531""","Construction Machinery and Equipment",333120,"Construction Machinery Manufacturing",34,34,12/31/24,"766,213,568",12/31/24,"1,305,100,000","4,300,000","601,600,000","1,043,600,000"
44997,"Insurance contract liabilities","Valuation of Incurred but not Reported (IBNR) Claims Liability",557469,12/31/24,03/14/25,2,"Ernst & Young LLP",,,,"Los Angeles",CA,CALIFORNIA,"US West",10-K,2025-03-14,,"Astrana Health, Inc.",1083446,"=""ASTH""","1668 S. GARFIELD AVENUE","2ND FLOOR",ALHAMBRA,CA,CALIFORNIA,"US West",,,"=""8742""","Management Consulting Services",621111,"Offices of Physicians (except Mental Health Specialists)",34,32,01/02/25,"1,811,337,856",12/31/24,"2,034,540,000","43,149,000","-27,270,000","1,354,894,000"
44998,"Accounts/loans receivable","Related Party Risk Pool Settlements and Related Receivables",557469,12/31/24,03/14/25,2,"Ernst & Young LLP",,,,"Los Angeles",CA,CALIFORNIA,"US West",10-K,2025-03-14,,"Astrana Health, Inc.",1083446,"=""ASTH""","1668 S. GARFIELD AVENUE","2ND FLOOR",ALHAMBRA,CA,CALIFORNIA,"US West",,,"=""8742""","Management Consulting Services",621111,"Offices of Physicians (except Mental Health Specialists)",34,32,01/02/25,"1,811,337,856",12/31/24,"2,034,540,000","43,149,000","-27,270,000","1,354,894,000"
41663,"Sales return and allowances","Recognition and measurement of accruals for Managed Care, Medicaid and Medicare Part D rebates on US Product Sales (excluding Rare Diseases)",551759,12/31/24,02/06/25,1,"PricewaterhouseCoopers LLP",121,"PricewaterhouseCoopers LLP",876,London,X0,"UNITED KINGDOM",Foreign,20-F,2025-02-18,,"ASTRAZENECA PLC",901832,"=""AZN""","1 FRANCIS CRICK AVENUE","CAMBRIDGE BIOMEDICAL CAMPUS",LONDON,X0,"UNITED KINGDOM",Foreign,,,"=""2834""","Pharmaceutical Preparations",325412,"Pharmaceutical Preparation Manufacturing",34,66,01/02/25,"51,062,358,016",12/31/24,"54,073,000,000","7,041,000,000","-17,416,000,000","104,035,000,000"
41664,"Other intangible assets","Impairment assessment of the product, marketing and distribution rights and other intangibles",551759,12/31/24,02/06/25,1,"PricewaterhouseCoopers LLP",121,"PricewaterhouseCoopers LLP",876,London,X0,"UNITED KINGDOM",Foreign,20-F,2025-02-18,,"ASTRAZENECA PLC",901832,"=""AZN""","1 FRANCIS CRICK AVENUE","CAMBRIDGE BIOMEDICAL CAMPUS",LONDON,X0,"UNITED KINGDOM",Foreign,,,"=""2834""","Pharmaceutical Preparations",325412,"Pharmaceutical Preparation Manufacturing",34,66,01/02/25,"51,062,358,016",12/31/24,"54,073,000,000","7,041,000,000","-17,416,000,000","104,035,000,000"
41665,"Other contingent liabilities","Recognition and measurement of legal provisions and disclosure of contingent liabilities",551759,12/31/24,02/06/25,1,"PricewaterhouseCoopers LLP",121,"PricewaterhouseCoopers LLP",876,London,X0,"UNITED KINGDOM",Foreign,20-F,2025-02-18,,"ASTRAZENECA PLC",901832,"=""AZN""","1 FRANCIS CRICK AVENUE","CAMBRIDGE BIOMEDICAL CAMPUS",LONDON,X0,"UNITED KINGDOM",Foreign,,,"=""2834""","Pharmaceutical Preparations",325412,"Pharmaceutical Preparation Manufacturing",34,66,01/02/25,"51,062,358,016",12/31/24,"54,073,000,000","7,041,000,000","-17,416,000,000","104,035,000,000"
41666,"Uncertain tax positions","Recognition, measurement and disclosure of tax liabilities for uncertain tax treatments",551759,12/31/24,02/06/25,1,"PricewaterhouseCoopers LLP",121,"PricewaterhouseCoopers LLP",876,London,X0,"UNITED KINGDOM",Foreign,20-F,2025-02-18,,"ASTRAZENECA PLC",901832,"=""AZN""","1 FRANCIS CRICK AVENUE","CAMBRIDGE BIOMEDICAL CAMPUS",LONDON,X0,"UNITED KINGDOM",Foreign,,,"=""2834""","Pharmaceutical Preparations",325412,"Pharmaceutical Preparation Manufacturing",34,66,01/02/25,"51,062,358,016",12/31/24,"54,073,000,000","7,041,000,000","-17,416,000,000","104,035,000,000"
41667,"Pension and other post-employment benefits","Valuation of defined benefit obligations (in the UK and Sweden)",551759,12/31/24,02/06/25,1,"PricewaterhouseCoopers LLP",121,"PricewaterhouseCoopers LLP",876,London,X0,"UNITED KINGDOM",Foreign,20-F,2025-02-18,,"ASTRAZENECA PLC",901832,"=""AZN""","1 FRANCIS CRICK AVENUE","CAMBRIDGE BIOMEDICAL CAMPUS",LONDON,X0,"UNITED KINGDOM",Foreign,,,"=""2834""","Pharmaceutical Preparations",325412,"Pharmaceutical Preparation Manufacturing",34,66,01/02/25,"51,062,358,016",12/31/24,"54,073,000,000","7,041,000,000","-17,416,000,000","104,035,000,000"
44642,"Research and development expenses","Navenibart Accrued and Prepaid Research and Development Costs",556956,12/31/24,03/11/25,2,"Ernst & Young LLP",,,,Boston,MA,MASSACHUSETTS,"US New England",10-K,2025-03-11,,"Astria Therapeutics, Inc.",1454789,"=""ATXS""","22 BOSTON WHARF ROAD","10TH FLOOR",BOSTON,MA,MASSACHUSETTS,"US New England",,,"=""2834""","Pharmaceutical Preparations",325412,"Pharmaceutical Preparation Manufacturing",34,9,12/31/24,"504,521,920",12/31/24,,"-94,260,000",,"342,363,000"
44290,Goodwill,"Valuation of Goodwill of the Test Systems Reporting Unit",555614,12/31/24,03/05/25,2,"Ernst & Young LLP",,,,Buffalo,NY,"NEW YORK","US Mid Atlantic",10-K,2025-03-05,,"ASTRONICS CORP",8063,"=""ATRO""","130 COMMERCE WAY",-,"EAST AURORA",NY,"NEW YORK","US Mid Atlantic",,,"=""3728""","Aircraft Parts and Auxiliary Equipment, NEC",336413,"Other Aircraft Parts and Auxiliary Equipment Manufacturing",34,16,12/31/24,"481,614,784",12/31/24,"795,426,000","-16,215,000","145,564,000","648,764,000"
44291,"Revenue from customer contracts","Revenue Recognition",555614,12/31/24,03/05/25,2,"Ernst & Young LLP",,,,Buffalo,NY,"NEW YORK","US Mid Atlantic",10-K,2025-03-05,,"ASTRONICS CORP",8063,"=""ATRO""","130 COMMERCE WAY",-,"EAST AURORA",NY,"NEW YORK","US Mid Atlantic",,,"=""3728""","Aircraft Parts and Auxiliary Equipment, NEC",336413,"Other Aircraft Parts and Auxiliary Equipment Manufacturing",34,16,12/31/24,"481,614,784",12/31/24,"795,426,000","-16,215,000","145,564,000","648,764,000"
40911,"Pension and other post-employment benefits","Discount rates used in determining pension and postretirement benefit obligations",550858,12/31/24,02/12/25,2,"Ernst & Young LLP",,,,Dallas,TX,TEXAS,"US Southwest",10-K,2025-02-12,,"AT&T Inc.",732717,"=""T""","208 S. AKARD ST",,DALLAS,TX,TEXAS,"US Southwest",,,"=""4813""","Telephone Communications, Except Radiotelephone",517110,"Wired Telecommunications Carriers",34,23,01/02/25,"163,811,852,288",12/31/24,"122,336,000,000","10,948,000,000","-89,370,000,000","394,795,000,000"
41085,Goodwill,"Evaluation of goodwill for impairment",550858,12/31/24,02/12/25,2,"Ernst & Young LLP",,,,Dallas,TX,TEXAS,"US Southwest",10-K,2025-02-12,,"AT&T Inc.",732717,"=""T""","208 S. AKARD ST",,DALLAS,TX,TEXAS,"US Southwest",,,"=""4813""","Telephone Communications, Except Radiotelephone",517110,"Wired Telecommunications Carriers",34,23,01/02/25,"163,811,852,288",12/31/24,"122,336,000,000","10,948,000,000","-89,370,000,000","394,795,000,000"
44501,"Revenue from customer contracts","Commercialization Revenue and Deferred Revenue – Accounting for Out- License Agreements – Refer to Notes 2 and 5 to the Financial Statements",556189,12/31/24,03/07/25,3,"Deloitte & Touche LLP",,,,"San Francisco",CA,CALIFORNIA,"US West",10-K,2025-03-07,Yes,"Atara Biotherapeutics, Inc.",1604464,"=""ATRA""","1280 RANCHO CONEJO BLVD",,"THOUSAND OAKS",CA,CALIFORNIA,"US West",,,"=""2836""","Biological Products, Except Diagnostic Substances",325412,"Pharmaceutical Preparation Manufacturing",34,14,01/02/25,"81,558,064",12/31/24,"128,940,000","-85,403,000",,"109,098,000"
42591,"Other investments","Valuation of Certain Structured Level 3 Asset-Backed Securities - Refer to Note 3, Investments, Note 6, Fair Value, and Note 15, Related Parties",552990,12/31/24,02/24/25,3,"Deloitte & Touche LLP",,,,"Des Moines",IA,IOWA,"US Midwest",10-K,2025-02-24,,"Athene Holding Ltd.",1527469,"=""ATHS""","7700 MILLS CIVIC PARKWAY",,"WEST DES MOINES",IA,IOWA,"US Midwest",,,"=""6311""","Life Insurance",523920,"Portfolio Management",34,25,01/02/25,"4,830,438,400",12/31/24,"20,689,000,000","3,461,000,000","12,297,000,000","363,343,000,000"
42592,"Insurance contract liabilities","Certain Assumptions Used in the Market Risk Benefits and Interest Sensitive Contract Liabilities - Refer to Note 1, Business, Basis of Presentation and Significant Accounting Policies, Note 6, Fair Value, and Note 9, Long-duration Contracts",552990,12/31/24,02/24/25,3,"Deloitte & Touche LLP",,,,"Des Moines",IA,IOWA,"US Midwest",10-K,2025-02-24,,"Athene Holding Ltd.",1527469,"=""ATHS""","7700 MILLS CIVIC PARKWAY",,"WEST DES MOINES",IA,IOWA,"US Midwest",,,"=""6311""","Life Insurance",523920,"Portfolio Management",34,25,01/02/25,"4,830,438,400",12/31/24,"20,689,000,000","3,461,000,000","12,297,000,000","363,343,000,000"
42299,Goodwill,"Goodwill impairment assessment - Forged Products reporting unit",552366,12/29/24,02/21/25,2,"Ernst & Young LLP",,,,Pittsburgh,PA,PENNSYLVANIA,"US Mid Atlantic",10-K,2025-02-21,,"ATI INC",1018963,"=""ATI""","2021 MCKINNEY AVENUE",,DALLAS,TX,TEXAS,"US Southwest",,,"=""3317""","Steel Pipe and Tubes",331111,"Iron and Steel Mills",34,55,12/31/24,"7,851,047,936",12/29/24,"4,362,100,000","367,800,000","1,623,200,000","5,230,600,000"
45173,"Goodwill and intangible assets","Valuation of Goodwill and Trade Name Indefinite-Lived Intangible Asset – Refer to Notes 2 and 5 to the financial statements",557824,12/31/24,03/18/25,3,"Deloitte & Touche LLP",,,,Chicago,IL,ILLINOIS,"US Midwest",10-K,2025-03-18,Yes,"ATI Physical Therapy, Inc.",1815849,"=""ATIP""","2001 BUTTERFIELD ROAD","SUITE 1600","DOWNERS GROVE",IL,ILLINOIS,"US Midwest",,,"=""8050""","Services-Nursing & Personal Care Facilities",621340,"Offices of Physical, Occupational and Speech Therapists, and Audiologists",34,3,01/02/25,"11,160,946",12/31/24,"753,064,000","-58,299,000","-465,286,000","958,116,000"
45174,"Revenue from customer contracts","Valuation of Net Patient Revenue and Related Accounts Receivable – Refer to Notes 2 and 4 to the financial statements",557824,12/31/24,03/18/25,3,"Deloitte & Touche LLP",,,,Chicago,IL,ILLINOIS,"US Midwest",10-K,2025-03-18,Yes,"ATI Physical Therapy, Inc.",1815849,"=""ATIP""","2001 BUTTERFIELD ROAD","SUITE 1600","DOWNERS GROVE",IL,ILLINOIS,"US Midwest",,,"=""8050""","Services-Nursing & Personal Care Facilities",621340,"Offices of Physical, Occupational and Speech Therapists, and Audiologists",34,3,01/02/25,"11,160,946",12/31/24,"753,064,000","-58,299,000","-465,286,000","958,116,000"
44154,"Financial statements and disclosures","Sufficiency of audit evidence over certain baseball event revenue",555113,12/31/24,03/03/25,4,"KPMG LLP",,,,Atlanta,GA,GEORGIA,"US Southeast",10-K,2025-03-03,,"Atlanta Braves Holdings, Inc.",1958140,"=""BATRA""","755 BATTERY AVENUE SE",,ATLANTA,GA,GEORGIA,"US Southeast",,,"=""7900""","Services-Amusement & Recreation Services",711211,"Sports Teams and Clubs",34,40,01/02/25,"416,956,928",12/31/24,"662,748,000","-31,268,000","224,712,000","1,523,846,000"
41042,"Regulatory assets and liabilities","Accounting for the Effects of Rate Regulation",550876,12/31/24,02/12/25,1,"PricewaterhouseCoopers LLP",,,,Philadelphia,PA,PENNSYLVANIA,"US Mid Atlantic",10-K,2025-02-12,,"ATLANTIC CITY ELECTRIC CO",8192,,"500 NORTH WAKEFIELD DRIVE",,NEWARK,DE,DELAWARE,"US Mid Atlantic",1109357,"EXELON CORP","=""4911""","Electric Services",221122,"Electric Power Distribution",34,,,,12/31/24,"1,628,000,000","155,000,000",,"5,349,000,000"
43487,"Business combinations","Business Combination - Fair Value of Acquired Loans",554171,12/31/24,02/27/25,2,"Ernst & Young LLP",,,,Richmond,VA,VIRGINIA,"US Mid Atlantic",10-K,2025-02-27,,"Atlantic Union Bankshares Corp",883948,"=""AUB""","4300 COX ROAD",,"GLEN ALLEN",VA,VIRGINIA,"US Mid Atlantic",,,"=""6022""","State Commercial Banks",522110,"Commercial Banking",34,37,01/02/25,"3,317,246,208",12/31/24,"767,328,000","209,131,000","1,844,263,000","24,585,323,000"
43488,"Allowance for credit losses","Allowance for Loan and Lease Losses (ALLL)",554171,12/31/24,02/27/25,2,"Ernst & Young LLP",,,,Richmond,VA,VIRGINIA,"US Mid Atlantic",10-K,2025-02-27,,"Atlantic Union Bankshares Corp",883948,"=""AUB""","4300 COX ROAD",,"GLEN ALLEN",VA,VIRGINIA,"US Mid Atlantic",,,"=""6022""","State Commercial Banks",522110,"Commercial Banking",34,37,01/02/25,"3,317,246,208",12/31/24,"767,328,000","209,131,000","1,844,263,000","24,585,323,000"
44868,"Accounts/loans receivable","Loans at Fair Value – Refer to Notes 2 and 6 to the Consolidated Financial Statements",557281,12/31/24,03/13/25,3,"Deloitte & Touche LLP",,,,Atlanta,GA,GEORGIA,"US Southeast",10-K,2025-03-13,,"Atlanticus Holdings Corp",1464343,"=""ATLC""","FIVE CONCOURSE PARKWAY","SUITE 300",ATLANTA,GA,GEORGIA,"US Southeast",,,"=""6141""","Personal Credit Institutions",522291,"Consumer Lending",34,56,12/31/24,"831,355,840",12/31/24,"401,432,000","111,296,000",,"3,270,707,000"
44940,"Property, plant and equipment","Assessment of indicators of impairment for vessels",557538,12/31/24,03/14/25,4,"KPMG LLP",187,"KPMG LLP Chartered Accountants",85,Vancouver,A1,"BRITISH COLUMBIA",Canada,20-F,2025-03-14,,"Atlas Corp.",1794846,,"2600-200 GRANVILLE STREET",,VANCOUVER,A1,"BRITISH COLUMBIA",Canada,,,"=""4412""","Deep Sea Foreign Transportation of  Freight",483111,"Deep Sea Freight Transportation",34,25,01/02/25,"5,149,072,384",12/31/24,"2,300,100,000","672,300,000","5,125,200,000","17,158,200,000"
42856,"Business combinations","Accounting for Business Combinations",553297,12/31/24,02/25/25,2,"Ernst & Young LLP",,,,Austin,TX,TEXAS,"US Southwest",10-K,2025-02-25,,"Atlas Energy Solutions Inc.",1984060,"=""AESI""","5918 WEST COURTYARD DRIVE","SUITE 500",AUSTIN,TX,TEXAS,"US Southwest",,,"=""1311""","Crude Petroleum and Natural Gas",0,,34,22,12/31/24,"2,444,620,202",12/31/24,"1,055,957,000","60,619,527",,"1,972,652,000"
39184,"Revenue from customer contracts","Revenue Recognition",540104,06/30/24,08/16/24,2,"Ernst & Young LLP",,,,"San Francisco",CA,CALIFORNIA,"US West",10-K,2024-08-16,,"Atlassian Corp",1650372,"=""TEAM""","350 BUSH STREET","FLOOR 13","SAN FRANCISCO",CA,CALIFORNIA,"US West",,,"=""7372""","Prepackaged Software",511210,"Software Publishers",34,182,07/02/24,"29,034,608,640",06/30/24,"4,358,603,000","-300,519,000","-554,962,000","5,212,133,000"
39185,"Other intangible assets","Valuation of developed technology intangible asset in the acquisition of Loom, Inc.",540104,06/30/24,08/16/24,2,"Ernst & Young LLP",,,,"San Francisco",CA,CALIFORNIA,"US West",10-K,2024-08-16,,"Atlassian Corp",1650372,"=""TEAM""","350 BUSH STREET","FLOOR 13","SAN FRANCISCO",CA,CALIFORNIA,"US West",,,"=""7372""","Prepackaged Software",511210,"Software Publishers",34,182,07/02/24,"29,034,608,640",06/30/24,"4,358,603,000","-300,519,000","-554,962,000","5,212,133,000"
40011,"Regulatory assets and liabilities",Regulation,544133,09/30/24,11/18/24,2,"Ernst & Young LLP",,,,Dallas,TX,TEXAS,"US Southwest",10-K,2024-11-18,,"ATMOS ENERGY CORP",731802,"=""ATO""","1800 THREE LINCOLN CTR","5430 LBJ FREEWAY",DALLAS,TX,TEXAS,"US Southwest",,,"=""4924""","Natural Gas Distribution",221210,"Natural Gas Distribution",34,139,09/30/24,"21,535,954,944",09/30/24,"4,165,187,000","1,042,895,000","11,343,568,000","25,194,465,000"
42291,"Revenue from customer contracts","Revenue Recognition",552450,12/31/24,02/21/25,1,"PricewaterhouseCoopers LLP",,,,Nashville,TN,TENNESSEE,"US Southeast",10-K,2025-02-21,,"Atmus Filtration Technologies Inc.",1921963,"=""ATMU""","26 CENTURY BOULEVARD","SUITE 500",NASHVILLE,TN,TENNESSEE,"US Southeast",,,"=""3714""","Motor Vehicle Parts and Accessories",423120,"Motor Vehicle Supplies and New Parts Merchant Wholesalers",34,39,12/31/24,"3,246,696,448",12/31/24,"1,669,600,000","185,600,000","142,700,000","1,190,300,000"
45059,Goodwill,"Goodwill impairment assessment for a certain reporting unit in the US Telecom segment",557746,12/31/24,03/17/25,1,"PricewaterhouseCoopers LLP",,,,Boston,MA,MASSACHUSETTS,"US New England",10-K,2025-03-17,,"ATN International, Inc.",879585,"=""ATNI""","500 CUMMINGS CENTER",,BEVERLY,MA,MASSACHUSETTS,"US New England",,,"=""4813""","Telephone Communications, Except Radiotelephone",517310,"Telecommunications Resellers",34,17,01/02/25,"249,989,136",12/31/24,"729,075,000","-26,429,000","435,652,000","1,727,103,000"
45518,"Research and development expenses","Accrued and prepaid research and development expenses",558675,12/31/24,03/25/25,2,"Ernst & Young LLP",,,,Seattle,WA,WASHINGTON,"US West",10-K,2025-03-25,,"ATOSSA THERAPEUTICS, INC.",1488039,"=""ATOS""","10202 5TH AVENUE NE","SUITE 200",SEATTLE,WA,WASHINGTON,"US West",,,"=""2834""","Pharmaceutical Preparations",541710,"Research and Development in the Physical, Engineering, and Life Sciences",34,1,12/31/24,"121,419,800",12/31/24,,"-25,504,000",,"76,444,000"
46948,"Long-lived assets","Evaluation of impairment of long-lived assets of leased hotels",562703,12/31/24,04/25/25,4,"KPMG LLP",355,"KPMG Huazhen LLP",1186,Shanghai,F4,CHINA,Foreign,20-F,2025-04-25,,"Atour Lifestyle Holdings Ltd",1853717,"=""ATAT""","1ST FLOOR, WUZHONG BUILDING","618 WUZHONG ROAD, MINHANG DISTRICT",SHANGHAI,F4,CHINA,Foreign,,,"=""7011""","Hotels and Motels",721110,"Hotels (except Casino Hotels) and Motels",34,27,01/02/25,"3,054,203,904",12/31/24,"424,589,000","-393,657,000","401,741,000","1,079,400,000"
46576,"Revenue from customer contracts","Revenue recognition for net online product revenue from self-developed online channels –Refer to Notes 2.15 to the financial statements",561219,12/31/24,04/11/25,3,"Deloitte & Touche LLP",499,"Deloitte Touche Tohmatsu Certified Public Accountants LLP",1113,Shanghai,F4,CHINA,Foreign,20-F,2025-04-11,,"ATRenew Inc.",1838957,"=""RERE""","12TH FLOOR, NO.6 BUILDING","433 SONGHU ROAD",SHANGHAI,K3,"HONG KONG",Foreign,,,"=""5990""","Retail-Retail Stores, NEC",453310,"Used Merchandise Stores",34,3,01/02/25,"375,327,392",12/31/24,"2,236,997,000","-1,127,000","498,400,000","697,431,000"
41391,"Deferred and stock-based compensation","Valuation of Performance Shares - Refer to Note 15 to the financial statements",551366,12/31/24,02/14/25,3,"Deloitte & Touche LLP",,,,Cincinnati,OH,OHIO,"US Midwest",10-K,2025-02-14,,"AtriCure, Inc.",1323885,"=""ATRC""","7555 INNOVATION WAY",,MASON,OH,OHIO,"US Midwest",,,"=""3841""","Surgical and Medical Instruments and Apparatus",339113,"Surgical Appliance and Supplies Manufacturing",34,30,01/02/25,"1,482,098,816",12/31/24,"465,307,000","-44,698,000","169,721,000","609,328,000"
38343,"Revenue from customer contracts","Estimated costs to complete on long-term revenue construction contracts",536254,03/31/24,05/15/24,2,"Ernst & Young LLP",192,"Ernst & Young LLP Chartered Accountants",1263,Toronto,A6,ONTARIO,Canada,40-F,2024-05-16,,"ATS Corp /ATS",1394832,"=""ATS""","730 FOUNTAIN STREET NORTH","BUILDING #3",CAMBRIDGE,A6,ONTARIO,Canada,,,"=""3569""","General Industrial Machinery and Equipment, NEC",333999,"All Other Miscellaneous General Purpose Machinery Manufacturing",34,,,,03/31/24,"2,241,185,000","143,492,000","-168,100,000","3,021,466,000"
38344,"Business combinations","Valuation of acquired intangible assets in Avidity Science business combination",536254,03/31/24,05/15/24,2,"Ernst & Young LLP",192,"Ernst & Young LLP Chartered Accountants",1263,Toronto,A6,ONTARIO,Canada,40-F,2024-05-16,,"ATS Corp /ATS",1394832,"=""ATS""","730 FOUNTAIN STREET NORTH","BUILDING #3",CAMBRIDGE,A6,ONTARIO,Canada,,,"=""3569""","General Industrial Machinery and Equipment, NEC",333999,"All Other Miscellaneous General Purpose Machinery Manufacturing",34,,,,03/31/24,"2,241,185,000","143,492,000","-168,100,000","3,021,466,000"
44845,"Research and development expenses","Accrued clinical and manufacturing costs",557280,12/31/24,03/13/25,2,"Ernst & Young LLP",,,,"San Diego",CA,CALIFORNIA,"US West",10-K,2025-03-13,,"aTYR PHARMA INC",1339970,"=""ATYR""","10240 SORRENTO VALLEY ROAD","SUITE 300","SAN DIEGO",CA,CALIFORNIA,"US West",,,"=""2836""","Biological Products, Except Diagnostic Substances",325414,"Biological Product (except Diagnostic) Manufacturing",34,4,01/02/25,"328,214,816",12/31/24,"235,000","-64,023,000",,"96,830,000"
45651,"Revenue from customer contracts","Revenue Recognition",558884,12/31/24,03/26/25,2,"Ernst & Young LLP",222,"Kost Forer Gabbay & Kasierer",1281,"Tel Aviv",L3,ISRAEL,Foreign,20-F,2025-03-26,,"AUDIOCODES LTD",1086434,"=""AUDC""","6 OFRA HAZA STREET",,"AIRPORT CITY LOD",L3,ISRAEL,Foreign,,,"=""3661""","Telephone and Telegraph Apparatus",334513,"Instruments and Related Products Manufacturing for Measuring, Displaying, and Controlling Industrial Proc",34,10,01/02/25,"303,084,576",12/31/24,"242,176,000","15,311,000","153,765,000","335,901,000"
43383,"Vendor/supplier rebates","Measurement of the liability for Medicaid rebate accruals",554023,12/31/24,02/26/25,1,"PricewaterhouseCoopers LLP",191,"PricewaterhouseCoopers LLP Chartered Accountants",271,Toronto,A6,ONTARIO,Canada,10-K,2025-02-27,,"Aurinia Pharmaceuticals Inc.",1600620,"=""AUPH""","#140, 14315 - 118 AVENUE",,EDMONTON,A0,ALBERTA,Canada,,,"=""2834""","Pharmaceutical Preparations",325412,"Pharmaceutical Preparation Manufacturing",34,9,12/31/24,"1,265,129,344",12/31/24,"235,133,000","5,752,000","373,123,000","550,645,000"
38650,"Other intangible assets","Valuation of intangible assets in the European cannabis cash generating unit",537715,03/31/24,06/19/24,4,"KPMG LLP",187,"KPMG LLP Chartered Accountants",85,Vancouver,A1,"BRITISH COLUMBIA",Canada,40-F,2024-06-20,,"AURORA CANNABIS INC",1683541,"=""ACB""","2207 90B STREET SW",,EDMONTON,A0,ALBERTA,Canada,,,"=""2833""","Medicinal Chemicals and Botanical Products",111419,"Other Food Crops Grown Under Cover",34,4,03/31/24,"239,456,048",03/31/24,"199,251,000","-51,229,000","351,556,000","619,747,000"
38651,Goodwill,"Valuation of goodwill in the Plant Propagation cash generating unit",537715,03/31/24,06/19/24,4,"KPMG LLP",187,"KPMG LLP Chartered Accountants",85,Vancouver,A1,"BRITISH COLUMBIA",Canada,40-F,2024-06-20,,"AURORA CANNABIS INC",1683541,"=""ACB""","2207 90B STREET SW",,EDMONTON,A0,ALBERTA,Canada,,,"=""2833""","Medicinal Chemicals and Botanical Products",111419,"Other Food Crops Grown Under Cover",34,4,03/31/24,"239,456,048",03/31/24,"199,251,000","-51,229,000","351,556,000","619,747,000"
41458,"Research and development expenses","Research and Development Costs",551447,12/31/24,02/14/25,1,"PricewaterhouseCoopers LLP",,,,Pittsburgh,PA,PENNSYLVANIA,"US Mid Atlantic",10-K,2025-02-14,,"Aurora Innovation, Inc.",1828108,"=""AUR""","1654 SMALLMAN ST.",,PITTSBURGH,PA,PENNSYLVANIA,"US Mid Atlantic",,,"=""7373""","Computer Integrated Systems Design",511210,"Software Publishers",34,6,12/31/24,"8,712,899,584",12/31/24,,"-748,000,000","1,258,000,000","2,138,000,000"
46367,"Equity investments and joint ventures","Impairment assessment of equity investments accounted for using the measurement alternative",560544,12/31/24,04/03/25,2,"Ernst & Young LLP",211,"Ernst & Young Hua Ming LLP",1408,Shenzhen,F4,CHINA,Foreign,20-F,2025-04-03,,"Aurora Mobile Ltd",1737339,"=""JG""","31/F, BLOCK 12-A, SHENZHEN BAY","SCIENCE AND TECHNOLOGY ECOLOGICAL PARK","NANSHAN DISTRICT, SHENZHEN",F4,CHINA,Foreign,,,"=""7370""","Services-Computer Programming, Data Processing, Etc.",518210,"Data Processing, Hosting, and Related Services",34,7,01/02/25,"423,547,520",12/31/24,"43,315,000","-965,000","2,243,000","51,791,000"
38546,"Revenue from customer contracts","Revenue Recognition",537374,01/31/24,06/10/24,2,"Ernst & Young LLP",,,,"San Francisco",CA,CALIFORNIA,"US West",10-K,2024-06-10,,"Autodesk, Inc.",769397,"=""ADSK""","ONE MARKET, STE. 400.",,"SAN FRANCISCO",CA,CALIFORNIA,"US West",,,"=""7372""","Prepackaged Software",511210,"Software Publishers",34,256,02/02/24,"54,858,584,064",01/31/24,"5,497,000,000","906,000,000","-2,204,000,000","9,912,000,000"
46629,"Allowance for credit losses","Allowance for current expected credit losses on accounts receivable",561468,12/31/24,04/15/25,1,"PricewaterhouseCoopers LLP",94,"PricewaterhouseCoopers Zhong Tian LLP",1424,Beijing,F4,CHINA,Foreign,20-F,2025-04-15,,"Autohome Inc.",1527636,"=""ATHM""","18TH FLOOR TOWER B, CEC PLAZA","3 Dan Ling Street, Haidian District",BEIJING,F4,CHINA,Foreign,,,"=""7374""","Computer Processing and Data Preparation and Processing Services",518210,"Data Processing, Hosting, and Related Services",34,26,01/02/25,"3,114,292,224",12/31/24,"964,426,000","221,881,000","2,988,475,000","4,140,374,000"
41878,"Revenue from customer contracts","Revenue recognition",552051,12/31/24,02/20/25,2,"Ernst & Young LLP",55,"Ernst & Young AB",1433,Stockholm,V7,SWEDEN,Foreign,10-K,2025-02-20,,"AUTOLIV INC",1034670,"=""ALV""","3350 AIRPORT RD",,OGDEN,UT,UTAH,"US West",,,"=""3714""","Motor Vehicle Parts and Accessories",336399,"All Other Motor Vehicle Parts Manufacturing",34,92,01/02/25,"7,269,573,632",12/31/24,"10,390,000,000","648,000,000","899,000,000","7,803,000,000"
41879,"Warranty liabilities","Product recall liabilities",552051,12/31/24,02/20/25,2,"Ernst & Young LLP",55,"Ernst & Young AB",1433,Stockholm,V7,SWEDEN,Foreign,10-K,2025-02-20,,"AUTOLIV INC",1034670,"=""ALV""","3350 AIRPORT RD",,OGDEN,UT,UTAH,"US West",,,"=""3714""","Motor Vehicle Parts and Accessories",336399,"All Other Motor Vehicle Parts Manufacturing",34,92,01/02/25,"7,269,573,632",12/31/24,"10,390,000,000","648,000,000","899,000,000","7,803,000,000"
45338,"Other liabilities and provisions","Liabilities related to future royalties and milestones, net (the “Liabilities”)",558126,12/31/24,03/20/25,2,"Ernst & Young LLP",57,"Ernst & Young LLP",1438,Reading,X0,"UNITED KINGDOM",Foreign,10-K,2025-03-20,,"Autolus Therapeutics plc",1730463,"=""AUTL""","THE MEDIAWORKS","191 WOOD LANE",LONDON,X0,"UNITED KINGDOM",Foreign,,,"=""2836""","Biological Products, Except Diagnostic Substances",325414,"Biological Product (except Diagnostic) Manufacturing",34,2,12/31/24,"625,385,984",12/31/24,"10,120,000","-220,662,000","414,952,000","782,725,000"
45339,"Other liabilities and provisions","BioNTech Transaction",558126,12/31/24,03/20/25,2,"Ernst & Young LLP",57,"Ernst & Young LLP",1438,Reading,X0,"UNITED KINGDOM",Foreign,10-K,2025-03-20,,"Autolus Therapeutics plc",1730463,"=""AUTL""","THE MEDIAWORKS","191 WOOD LANE",LONDON,X0,"UNITED KINGDOM",Foreign,,,"=""2836""","Biological Products, Except Diagnostic Substances",325414,"Biological Product (except Diagnostic) Manufacturing",34,2,12/31/24,"625,385,984",12/31/24,"10,120,000","-220,662,000","414,952,000","782,725,000"
39056,Goodwill,"Goodwill – Employer Services Reportable Segment— Refer to Notes 1 and 7 to the financial statements",539736,06/30/24,08/07/24,3,"Deloitte & Touche LLP",,,,Morristown,NJ,"NEW JERSEY","US Mid Atlantic",10-K,2024-08-07,,"AUTOMATIC DATA PROCESSING INC",8670,"=""ADP""","ONE ADP BOULVARD",,ROSELAND,NJ,"NEW JERSEY","US Mid Atlantic",,,"=""7374""","Computer Processing and Data Preparation and Processing Services",518210,"Data Processing, Hosting, and Related Services",34,237,07/02/24,"96,850,608,128",06/30/24,"19,202,600,000","3,752,000,000","858,000,000","54,362,700,000"
39057,"Other liabilities and provisions","Client Funds Obligations - Refer to Note 4 to the financial statements",539736,06/30/24,08/07/24,3,"Deloitte & Touche LLP",,,,Morristown,NJ,"NEW JERSEY","US Mid Atlantic",10-K,2024-08-07,,"AUTOMATIC DATA PROCESSING INC",8670,"=""ADP""","ONE ADP BOULVARD",,ROSELAND,NJ,"NEW JERSEY","US Mid Atlantic",,,"=""7374""","Computer Processing and Data Preparation and Processing Services",518210,"Data Processing, Hosting, and Related Services",34,237,07/02/24,"96,850,608,128",06/30/24,"19,202,600,000","3,752,000,000","858,000,000","54,362,700,000"
41487,"Other intangible assets","Fair value of franchise rights",551468,12/31/24,02/14/25,4,"KPMG LLP",,,,"Fort Lauderdale",FL,FLORIDA,"US Southeast",10-K,2025-02-14,,"AUTONATION, INC.",350698,"=""AN""","200 SW 1ST AVE","SUITE 1600","FORT LAUDERDALE",FL,FLORIDA,"US Southeast",,,"=""5500""","Retail-Auto Dealers & Gasoline Stations",441110,"New Car Dealers",34,167,01/02/25,"6,618,537,472",12/31/24,"26,765,400,000","692,200,000","98,500,000","13,001,700,000"
39808,"Other contingent liabilities","Valuation of Self-insurance Reserves",543042,08/31/24,10/28/24,2,"Ernst & Young LLP",,,,Memphis,TN,TENNESSEE,"US Southeast",10-K,2024-10-28,,"AUTOZONE INC",866787,"=""AZO""","123 SOUTH FRONT ST","DEPT 8074",MEMPHIS,TN,TENNESSEE,"US Southeast",,,"=""5531""","Auto and Home Supply Stores",441310,"Automotive Parts and Accessories Stores",34,"3,205",08/29/24,"54,745,792,512",08/31/24,"18,490,268,000","2,662,427,000","-5,052,259,000","17,176,538,000"
44102,"Revenue from customer contracts","Net Product Revenue- Reserves for Variable Consideration– Patient Financial Assistance Programs and Rebates – Refer to Note 1 to the financial statements",554920,12/31/24,03/03/25,3,"Deloitte & Touche LLP",,,,"Saint Louis",MO,MISSOURI,"US Southeast",10-K,2025-03-03,,"AVADEL PHARMACEUTICALS PLC",1012477,"=""AVDL""","10 EARLSFORT TERRACE",,"DUBLIN 2",L2,IRELAND,Foreign,,,"=""2834""","Pharmaceutical Preparations",325412,"Pharmaceutical Preparation Manufacturing",34,11,12/31/24,"1,014,404,160",12/31/24,"169,117,000","-48,832,000","57,012,000","164,236,000"
45331,"Derivatives and hedging","Valuation of Derivative Instrument",558183,12/31/24,03/20/25,2,"Ernst & Young LLP",,,,Tysons,VA,VIRGINIA,"US Mid Atlantic",10-K,2025-03-20,,"Avalo Therapeutics, Inc.",1534120,"=""AVTX""","1500 LIBERTY RIDGE DRIVE","SUITE 321",WAYNE,PA,PENNSYLVANIA,"US Mid Atlantic",,,"=""2834""","Pharmaceutical Preparations",325412,"Pharmaceutical Preparation Manufacturing",34,8,01/02/25,"87,621,032",12/31/24,"441,000","-35,129,000","122,530,000","150,732,000"
45332,"Other investments","Accounting for the Private Placement Financing",558183,12/31/24,03/20/25,2,"Ernst & Young LLP",,,,Tysons,VA,VIRGINIA,"US Mid Atlantic",10-K,2025-03-20,,"Avalo Therapeutics, Inc.",1534120,"=""AVTX""","1500 LIBERTY RIDGE DRIVE","SUITE 321",WAYNE,PA,PENNSYLVANIA,"US Mid Atlantic",,,"=""2834""","Pharmaceutical Preparations",325412,"Pharmaceutical Preparation Manufacturing",34,8,01/02/25,"87,621,032",12/31/24,"441,000","-35,129,000","122,530,000","150,732,000"
43585,"Deferred and capitalized costs","Valuation of Deferred Development Costs and Land Held for Development",554239,12/31/24,02/27/25,2,"Ernst & Young LLP",,,,Tysons,VA,VIRGINIA,"US Mid Atlantic",10-K,2025-02-27,,"AVALONBAY COMMUNITIES INC",915912,"=""AVB""","4040 WILSON BOULEVARD","STE 1000",ARLINGTON,VA,VIRGINIA,"US Mid Atlantic",,,"=""6798""","Real Estate Investment Trusts",525990,"Other Financial Vehicles",34,217,01/02/25,"30,875,437,056",12/31/24,"2,913,757,000","1,081,994,000",,"21,000,737,000"
42992,"Sales return and allowances","Net Sales/Accrued rebate expenses- Refer to Notes 1 and 17 to the consolidated financial statements",553567,12/31/24,02/26/25,3,"Deloitte & Touche LLP",,,,Atlanta,GA,GEORGIA,"US Southeast",10-K,2025-02-26,,"AVANOS MEDICAL, INC.",1606498,"=""AVNS""","5405 WINDWARD PARKWAY","SUITE 100 SOUTH",ALPHARETTA,GA,GEORGIA,"US Southeast",,,"=""3842""","Orthopedic, Prosthetic, and Surgical Appliances and Supplies",524114,"Direct Health and Medical Insurance Carriers",34,16,12/31/24,"731,724,992",12/31/24,"687,800,000","-392,100,000","260,600,000","1,154,200,000"
42993,Goodwill,"Goodwill Valuation - Refer to Notes 1 and 2 to the consolidated financial statements",553567,12/31/24,02/26/25,3,"Deloitte & Touche LLP",,,,Atlanta,GA,GEORGIA,"US Southeast",10-K,2025-02-26,,"AVANOS MEDICAL, INC.",1606498,"=""AVNS""","5405 WINDWARD PARKWAY","SUITE 100 SOUTH",ALPHARETTA,GA,GEORGIA,"US Southeast",,,"=""3842""","Orthopedic, Prosthetic, and Surgical Appliances and Supplies",524114,"Direct Health and Medical Insurance Carriers",34,16,12/31/24,"731,724,992",12/31/24,"687,800,000","-392,100,000","260,600,000","1,154,200,000"
40772,Goodwill,"Goodwill Impairment - Refer to Notes 2, 6 and 11 to the financial statements",550440,12/31/24,02/07/25,3,"Deloitte & Touche LLP",,,,Philadelphia,PA,PENNSYLVANIA,"US Mid Atlantic",10-K,2025-02-07,,"Avantor, Inc.",1722482,"=""AVTR""","RADNOR CORPORATE CENTER, BUILDING ONE","SUITE 200, 100 MATSONFORD ROAD",RADNOR,PA,PENNSYLVANIA,"US Mid Atlantic",,,"=""3826""","Laboratory Analytical Instruments",325188,"All Other Basic Inorganic Chemical Manufacturing",34,21,12/31/24,"14,344,456,192",12/31/24,"6,783,600,000","711,500,000","-2,942,700,000","12,114,500,000"
44823,"Accounts/loans receivable","Estimated Contractual Adjustments and Implicit Price Concessions",557387,12/28/24,03/13/25,2,"Ernst & Young LLP",,,,Atlanta,GA,GEORGIA,"US Southeast",10-K,2025-03-13,,"Aveanna Healthcare Holdings, Inc.",1832332,"=""AVAH""","400 INTERSTATE NORTH PARKWAY","STE 1700",ATLANTA,GA,GEORGIA,"US Southeast",,,"=""8082""","Home Health Care Services",621610,"Home Health Care Services",34,5,12/31/24,"883,039,040",12/28/24,"2,024,506,000","-10,929,000","-1,266,208,000","1,663,394,000"
44824,"Goodwill and intangible assets","Goodwill Impairment",557387,12/28/24,03/13/25,2,"Ernst & Young LLP",,,,Atlanta,GA,GEORGIA,"US Southeast",10-K,2025-03-13,,"Aveanna Healthcare Holdings, Inc.",1832332,"=""AVAH""","400 INTERSTATE NORTH PARKWAY","STE 1700",ATLANTA,GA,GEORGIA,"US Southeast",,,"=""8082""","Home Health Care Services",621610,"Home Health Care Services",34,5,12/31/24,"883,039,040",12/28/24,"2,024,506,000","-10,929,000","-1,266,208,000","1,663,394,000"
46022,"Other debt","Valuation of warrants",559781,12/31/24,03/31/25,4,"KPMG LLP",,,,"New York",NY,"NEW YORK","US Mid Atlantic",10-K,2025-03-31,Yes,"AVENUE THERAPEUTICS, INC.",1644963,"=""ATXI""","1111 KANE CONCOURSE","SUITE 301","BAY HARBOR ISLANDS",FL,FLORIDA,"US Southeast",,,"=""2834""","Pharmaceutical Preparations",325412,"Pharmaceutical Preparation Manufacturing",34,2,01/02/25,"3,689,452",12/31/24,,"-11,652,000",,"2,672,000"
43763,"Revenue from customer contracts","Revenue Recognition – Determination of Standalone Selling Prices — Refer to Note 2 to the financial statements",554541,12/31/24,02/27/25,3,"Deloitte & Touche LLP",,,,"New York",NY,"NEW YORK","US Mid Atlantic",10-K,2025-02-28,,"AvePoint, Inc.",1777921,"=""AVPT""","525 WASHINGTON BLVD","SUITE 1400",,NJ,"NEW JERSEY","US Mid Atlantic",,,"=""7372""","Prepackaged Software",511210,"Software Publishers",34,17,01/02/25,"3,116,437,760",12/31/24,"330,482,000","-29,090,000","242,550,000","519,055,000"
43080,"Revenue from customer contracts","Revenue Recognition from Certain Product Revenue",553690,12/28/24,02/26/25,1,"PricewaterhouseCoopers LLP",,,,"Los Angeles",CA,CALIFORNIA,"US West",10-K,2025-02-26,,"Avery Dennison Corp",8818,"=""AVY""","8080 NORTON PARKWAY",,MENTOR,OH,OHIO,"US Midwest",,,"=""2670""","Converted Paper & Paperboard Prods (No Contaners/Boxes)",322222,"Coated and Laminated Paper Manufacturing",34,187,12/30/24,"15,044,062,208",12/28/24,"8,755,700,000","704,900,000","-412,600,000","8,405,100,000"
39646,"Revenue from customer contracts","Revenue Recognition — Service Revenues - Estimated Costs to Complete - Refer to Note 3 to the financial statements",542155,06/28/24,10/04/24,3,"Deloitte & Touche LLP",,,,Austin,TX,TEXAS,"US Southwest",10-K,2024-10-04,,"AVIAT NETWORKS, INC.",1377789,"=""AVNW""","200 PARKER DRIVE","SUITE C100A",AUSTIN,TX,TEXAS,"US Southwest",,,"=""3663""","Radio and Television Broadcasting and Communications Equipment",517212,"Cellular and Other Wireless Telecommunications",34,28,06/26/24,"355,723,200",06/28/24,"408,083,000","10,760,000","234,024,000","535,223,000"
39647,"Business combinations","Acquisitions — NEC’s Wireless Transport Business – Key Assumptions in Valuation of Acquired Intangible Assets - Refer to Note 12 to the financial statements",542155,06/28/24,10/04/24,3,"Deloitte & Touche LLP",,,,Austin,TX,TEXAS,"US Southwest",10-K,2024-10-04,,"AVIAT NETWORKS, INC.",1377789,"=""AVNW""","200 PARKER DRIVE","SUITE C100A",AUSTIN,TX,TEXAS,"US Southwest",,,"=""3663""","Radio and Television Broadcasting and Communications Equipment",517212,"Cellular and Other Wireless Telecommunications",34,28,06/26/24,"355,723,200",06/28/24,"408,083,000","10,760,000","234,024,000","535,223,000"
38798,"Deferred and capitalized costs","Estimated costs at completion for projects",538334,04/30/24,07/02/24,2,"Ernst & Young LLP",,,,Irvine,CA,CALIFORNIA,"US West",10-K,2024-07-02,,"Avid Bioservices, Inc.",704562,,"14191 MYFORD ROAD",,TUSTIN,CA,CALIFORNIA,"US West",,,"=""2834""","Pharmaceutical Preparations",325412,"Pharmaceutical Preparation Manufacturing",34,8,04/30/24,"485,023,840",04/30/24,"139,911,000","-140,753,000",,"336,557,000"
43928,"Other debt","Restricted Funds Held for Customers and Payment Service Obligations",554799,12/31/24,02/28/25,1,"PricewaterhouseCoopers LLP",,,,Charlotte,NC,"NORTH CAROLINA","US Southeast",10-K,2025-02-28,,"AvidXchange Holdings, Inc.",1858257,"=""AVDX""","1210 AVIDXCHANGE LANE",,CHARLOTTE,NC,"NORTH CAROLINA","US Southeast",,,"=""7372""","Prepackaged Software",511210,"Software Publishers",34,10,01/02/25,"2,133,378,304",12/31/24,"438,940,000","8,145,000","434,844,000","2,089,711,000"
41626,"Asset retirement and environmental obligations","Environmental Accrued Liabilities - Calvert City",551708,12/31/24,02/18/25,2,"Ernst & Young LLP",,,,Cleveland,OH,OHIO,"US Midwest",10-K,2025-02-18,,"AVIENT CORP",1122976,"=""AVNT""","33587 WALKER ROAD",,"AVON LAKE",OH,OHIO,"US Midwest",,,"=""2821""","Plastics Material and Synthetic Resins, and Nonvulcanizable Elastomers",325211,"Plastics Material and Resin Manufacturing",34,40,01/02/25,"3,678,332,416",12/31/24,"3,240,400,000","169,500,000","-796,300,000","5,811,100,000"
44729,"Proven and unproven reserves","Plant, Equipment and Mining properties - Assessment of Whether Indicators of Impairment Exist – Refer to Note 2 and 3 to the financial statements",557251,12/31/24,03/11/25,3,"Deloitte & Touche LLP",468,"Deloitte LLP",1208,Vancouver,A1,"BRITISH COLUMBIA",Canada,6-K,2025-03-12,,"AVINO SILVER & GOLD MINES LTD",316888,"=""ASM""","455 GRANVILLE STREET","SUITE 400",VANCOUVER,A1,"BRITISH COLUMBIA",Canada,,,"=""1000""","Metal mining",213114,"Support Activities for Metal Mining",34,1,01/02/25,"124,531,704",12/31/24,"66,178,000","8,100,000",,"148,711,000"
44745,"Proven and unproven reserves","Plant, Equipment and Mining properties - Assessment of Whether Indicators of Impairment Exist – Refer to Note 2 and 3 to the financial statements",557135,12/31/24,03/11/25,3,"Deloitte & Touche LLP",468,"Deloitte LLP",1208,Vancouver,A1,"BRITISH COLUMBIA",Canada,40-F,2025-03-12,,"AVINO SILVER & GOLD MINES LTD",316888,"=""ASM""","455 GRANVILLE STREET","SUITE 400",VANCOUVER,A1,"BRITISH COLUMBIA",Canada,,,"=""1000""","Metal mining",213114,"Support Activities for Metal Mining",34,1,01/02/25,"124,531,704",12/31/24,"66,178,000","8,100,000",,"148,711,000"
41500,"Depreciation and amortization","Vehicles - Depreciation Expense - United States Risk Vehicles - Refer to Notes 2 and 8 to the financial statements",551479,12/31/24,02/14/25,3,"Deloitte & Touche LLP",,,,"New York",NY,"NEW YORK","US Mid Atlantic",10-K,2025-02-14,,"AVIS BUDGET GROUP, INC.",723612,"=""CAR""","379 INTERPACE PARKWAY",,PARSIPPANY,NJ,"NEW JERSEY","US Mid Atlantic",,,"=""7510""","Services-Auto Rental & Leasing (No Drivers)",532111,"Passenger Car Rental",34,80,01/02/25,"2,826,597,120",12/31/24,"11,789,000,000","-1,821,000,000","677,000,000","28,344,000,000"
41501,"Other contingent liabilities","Self-Insurance Reserves - Public Liability and Property Damage Claims - United States - Refer to Note 2 to the financial statements",551479,12/31/24,02/14/25,3,"Deloitte & Touche LLP",,,,"New York",NY,"NEW YORK","US Mid Atlantic",10-K,2025-02-14,,"AVIS BUDGET GROUP, INC.",723612,"=""CAR""","379 INTERPACE PARKWAY",,PARSIPPANY,NJ,"NEW JERSEY","US Mid Atlantic",,,"=""7510""","Services-Auto Rental & Leasing (No Drivers)",532111,"Passenger Car Rental",34,80,01/02/25,"2,826,597,120",12/31/24,"11,789,000,000","-1,821,000,000","677,000,000","28,344,000,000"
41502,"Long-lived assets","Impairment of Long-Lived Assets – United States Vehicles – Refer to Notes 2 and 8 to the financial statements",551479,12/31/24,02/14/25,3,"Deloitte & Touche LLP",,,,"New York",NY,"NEW YORK","US Mid Atlantic",10-K,2025-02-14,,"AVIS BUDGET GROUP, INC.",723612,"=""CAR""","379 INTERPACE PARKWAY",,PARSIPPANY,NJ,"NEW JERSEY","US Mid Atlantic",,,"=""7510""","Services-Auto Rental & Leasing (No Drivers)",532111,"Passenger Car Rental",34,80,01/02/25,"2,826,597,120",12/31/24,"11,789,000,000","-1,821,000,000","677,000,000","28,344,000,000"
42914,"Regulatory assets and liabilities","Regulatory Matters - Refer to Notes 1, 22, and 23 to the financial statements",553460,12/31/24,02/25/25,3,"Deloitte & Touche LLP",,,,Portland,OR,OREGON,"US West",10-K,2025-02-26,,"AVISTA CORP",104918,"=""AVA""","1411 E MISSION AVE",,SPOKANE,WA,WASHINGTON,"US West",,,"=""4931""","Electric and Other Services Combined",221210,"Natural Gas Distribution",34,37,12/31/24,"2,931,828,480",12/31/24,"1,938,000,000","180,000,000","2,539,000,000","7,941,000,000"
39136,"Other income taxes","Evaluation of accounting for income taxes",540033,06/29/24,08/14/24,4,"KPMG LLP",,,,Phoenix,AZ,ARIZONA,"US Southwest",10-K,2024-08-14,,"AVNET INC",8858,"=""AVT""","2211 SOUTH 47TH STREET",,PHOENIX,AZ,ARIZONA,"US Southwest",,,"=""5065""","Electronic Parts and Equipment, NEC",334419,"Other Electronic Component Manufacturing",34,51,07/01/24,"4,584,085,504",06/29/24,"23,757,129,000","498,699,000","4,144,520,000","12,209,147,000"
41133,"Other income taxes","Measurement of Unrecognized Tax Benefits",551102,12/31/24,02/13/25,1,"PricewaterhouseCoopers LLP",,,,Philadelphia,PA,PENNSYLVANIA,"US Mid Atlantic",10-K,2025-02-13,,"Axalta Coating Systems Ltd.",1616862,"=""AXTA""","1050 CONSTITUTION AVENUE",,PHILADELPHIA,PA,PENNSYLVANIA,"US Mid Atlantic",,,"=""2851""","Paints, Varnishes, Lacquers, Enamels, and Allied Products",325510,"Paint and Coating Manufacturing",34,34,01/02/25,"7,318,202,368",12/31/24,"5,276,000,000","391,000,000","-877,000,000","7,249,000,000"
43706,"Revenue from customer contracts","Systems Revenue recognition",554486,12/31/24,02/27/25,2,"Ernst & Young LLP",,,,Boston,MA,MASSACHUSETTS,"US New England",10-K,2025-02-28,,"AXCELIS TECHNOLOGIES INC",1113232,"=""ACLS""","108 CHERRY HILL DRIVE",,BEVERLY,MA,MASSACHUSETTS,"US New England",,,"=""3559""","Special  Industry Machinery, NEC",333295,"Semiconductor Machinery Manufacturing",34,70,01/02/25,"2,281,928,960",12/31/24,"1,017,865,000","200,992,000",,"1,348,781,000"
43707,Inventory,"Estimate of Excess Inventory",554486,12/31/24,02/27/25,2,"Ernst & Young LLP",,,,Boston,MA,MASSACHUSETTS,"US New England",10-K,2025-02-28,,"AXCELIS TECHNOLOGIES INC",1113232,"=""ACLS""","108 CHERRY HILL DRIVE",,BEVERLY,MA,MASSACHUSETTS,"US New England",,,"=""3559""","Special  Industry Machinery, NEC",333295,"Semiconductor Machinery Manufacturing",34,70,01/02/25,"2,281,928,960",12/31/24,"1,017,865,000","200,992,000",,"1,348,781,000"
43009,"Other contingent liabilities","Reserve for losses and loss expenses - Refer to Notes 2 and 8 to the consolidated financial statements",553520,12/31/24,02/26/25,3,"Deloitte & Touche LLP",506,"Deloitte Ltd",5230,Hamilton,D0,BERMUDA,Foreign,10-K,2025-02-26,,"AXIS CAPITAL HOLDINGS LTD",1214816,"=""AXS""","92 PITTS BAY ROAD",,PEMBROKE,D0,BERMUDA,Foreign,,,"=""6331""","Fire, Marine, and Casualty Insurance",524126,"Direct Property and Casualty Insurance Carriers",34,89,01/02/25,"7,434,455,552",12/31/24,"5,957,651,000","1,081,786,000","5,846,914,000","32,520,293,000"
43035,Inventory,"Inventory – Excess and Obsolete (E&O) Inventory — Refer to Notes 2 and 3 to the financial statements",553616,12/31/24,02/26/25,3,"Deloitte & Touche LLP",,,,Tampa,FL,FLORIDA,"US Southeast",10-K,2025-02-26,,"Axogen, Inc.",805928,"=""AXGN""","13631 PROGRESS BLVD.","SUITE 400",ALACHUA,FL,FLORIDA,"US Southeast",,,"=""3845""","Electromedical and Electrotherapeutic Apparatus",325412,"Pharmaceutical Preparation Manufacturing",34,16,12/31/24,"727,572,800",12/31/24,"187,338,000","-9,964,000","98,328,000","203,728,000"
43746,"Revenue from customer contracts","Revenue Recognition for Certain Products and Services",554424,12/31/24,02/28/25,1,"PricewaterhouseCoopers LLP",,,,Phoenix,AZ,ARIZONA,"US Southwest",10-K,2025-02-28,,"AXON ENTERPRISE, INC.",1069183,"=""AXON""","17800 N. 85TH ST.",,SCOTTSDALE,AZ,ARIZONA,"US Southwest",,,"=""3480""","Ordnance & Accessories, (No Vehicles/Guided Missiles)",332994,"Small Arms Manufacturing",34,596,01/02/25,"45,485,211,648",12/31/24,"2,082,526,000","377,034,000","1,395,670,000","4,474,588,000"
43747,"Business combinations","Valuation of Certain Intangible Assets - Acquisitions of Fusus and Dedrone",554424,12/31/24,02/28/25,1,"PricewaterhouseCoopers LLP",,,,Phoenix,AZ,ARIZONA,"US Southwest",10-K,2025-02-28,,"AXON ENTERPRISE, INC.",1069183,"=""AXON""","17800 N. 85TH ST.",,SCOTTSDALE,AZ,ARIZONA,"US Southwest",,,"=""3480""","Ordnance & Accessories, (No Vehicles/Guided Missiles)",332994,"Small Arms Manufacturing",34,596,01/02/25,"45,485,211,648",12/31/24,"2,082,526,000","377,034,000","1,395,670,000","4,474,588,000"
47312,"Revenue from customer contracts","Revenue Recognition for Certain Products and Services",564482,12/31/24,02/28/25,1,"PricewaterhouseCoopers LLP",,,,Phoenix,AZ,ARIZONA,"US Southwest",10-K/A,2025-05-07,,"AXON ENTERPRISE, INC.",1069183,"=""AXON""","17800 N. 85TH ST.",,SCOTTSDALE,AZ,ARIZONA,"US Southwest",,,"=""3480""","Ordnance & Accessories, (No Vehicles/Guided Missiles)",332994,"Small Arms Manufacturing",34,596,01/02/25,"45,485,211,648",12/31/24,"2,082,526,000","377,034,000","1,395,670,000","4,474,588,000"
47313,"Business combinations","Valuation of Certain Intangible Assets - Acquisitions of Fusus and Dedrone",564482,12/31/24,02/28/25,1,"PricewaterhouseCoopers LLP",,,,Phoenix,AZ,ARIZONA,"US Southwest",10-K/A,2025-05-07,,"AXON ENTERPRISE, INC.",1069183,"=""AXON""","17800 N. 85TH ST.",,SCOTTSDALE,AZ,ARIZONA,"US Southwest",,,"=""3480""","Ordnance & Accessories, (No Vehicles/Guided Missiles)",332994,"Small Arms Manufacturing",34,596,01/02/25,"45,485,211,648",12/31/24,"2,082,526,000","377,034,000","1,395,670,000","4,474,588,000"
41633,"Sales return and allowances","Reserves for Variable Consideration - Commercial Managed Care — Refer to Note 2 to the financial statements",551703,12/31/24,02/18/25,3,"Deloitte & Touche LLP",,,,Morristown,NJ,"NEW JERSEY","US Mid Atlantic",10-K,2025-02-18,,"Axsome Therapeutics, Inc.",1579428,"=""AXSM""","ONE WORLD TRADE CENTER, 29TH FLOOR",,"NEW YORK",NY,"NEW YORK","US Mid Atlantic",,,"=""2834""","Pharmaceutical Preparations",325412,"Pharmaceutical Preparation Manufacturing",34,85,12/31/24,"4,117,764,608",12/31/24,"385,693,000","-287,216,000","89,759,000","568,498,000"
40048,Inventory,Inventory,544220,09/30/24,11/20/24,1,"PricewaterhouseCoopers LLP",,,,Chicago,IL,ILLINOIS,"US Midwest",10-K,2024-11-20,,"AZEK Co Inc.",1782754,,"1330 W FULTON STREET, #350",,CHICAGO,IL,ILLINOIS,"US Midwest",,,"=""3089""","Plastics Products, NEC",332322,"Sheet Metal Work Manufacturing",34,47,09/30/24,"6,693,067,264",09/30/24,"1,441,448,000","153,379,000","234,531,000","2,167,711,000"
47585,Inventory,Inventory,565948,09/30/24,11/20/24,1,"PricewaterhouseCoopers LLP",,,,Chicago,IL,ILLINOIS,"US Midwest",DEFM14A,2025-05-29,,"AZEK Co Inc.",1782754,,"1330 W FULTON STREET, #350",,CHICAGO,IL,ILLINOIS,"US Midwest",,,"=""3089""","Plastics Products, NEC",332322,"Sheet Metal Work Manufacturing",34,47,09/30/24,"6,693,067,264",09/30/24,"1,441,448,000","153,379,000","234,531,000","2,167,711,000"
40118,Goodwill,"Goodwill Impairment Interim Assessments - B Medical Systems Reporting Unit",544532,09/30/24,11/26/24,1,"PricewaterhouseCoopers LLP",,,,Boston,MA,MASSACHUSETTS,"US New England",10-K,2024-11-27,,"Azenta, Inc.",933974,"=""AZTA""","200 SUMMIT DRIVE","6TH FLOOR",BURLINGTON,MA,MASSACHUSETTS,"US New England",,,"=""3559""","Special  Industry Machinery, NEC",333298,"All Other Industrial Machinery Manufacturing",34,48,10/02/24,"2,334,253,312",09/30/24,"656,323,000","-164,170,000","829,528,000","2,100,041,000"
42730,"Other intangible assets","Assessment of the carrying values of certain indefinite-lived intangible assets",553188,12/28/24,02/25/25,4,"KPMG LLP",,,,"New York",NY,"NEW YORK","US Mid Atlantic",10-K,2025-02-25,,"B&G Foods, Inc.",1278027,"=""BGS""","FOUR GATEHALL DRIVE","SUITE 110",PARSIPPANY,NJ,"NEW JERSEY","US Mid Atlantic",,,"=""2000""","Food and Kindred Products",311999,"All Other Miscellaneous Food Manufacturing",34,7,12/31/24,"545,307,648",12/28/24,"1,932,454,000","-251,251,000","-1,309,370,000","2,994,052,000"
42731,Goodwill,"Assessment of fair values of the Specialty, Meals, Frozen & Vegetables and Spices & Flavor Solutions reporting units",553188,12/28/24,02/25/25,4,"KPMG LLP",,,,"New York",NY,"NEW YORK","US Mid Atlantic",10-K,2025-02-25,,"B&G Foods, Inc.",1278027,"=""BGS""","FOUR GATEHALL DRIVE","SUITE 110",PARSIPPANY,NJ,"NEW JERSEY","US Mid Atlantic",,,"=""2000""","Food and Kindred Products",311999,"All Other Miscellaneous Food Manufacturing",34,7,12/31/24,"545,307,648",12/28/24,"1,932,454,000","-251,251,000","-1,309,370,000","2,994,052,000"
42244,"Long-lived assets","Impairment of the Goose Project cash-generating unit (CGU)",552348,12/31/24,02/19/25,1,"PricewaterhouseCoopers LLP",191,"PricewaterhouseCoopers LLP Chartered Accountants",271,Vancouver,A1,"BRITISH COLUMBIA",Canada,6-K,2025-02-20,,"B2GOLD CORP",1429937,"=""BTG""","PARK PLACE","SUITE 3400 - 666 BURRARD STREET",VANCOUVER,A1,"BRITISH COLUMBIA",Canada,,,"=""1040""","Metal Mining",212221,"Gold Ore Mining",34,2,12/31/24,"3,216,019,200",12/31/24,"1,902,030,000","-626,653,000",,"4,813,998,000"
42245,"Long-lived assets","Impairment of the Fekola Complex CGU",552348,12/31/24,02/19/25,1,"PricewaterhouseCoopers LLP",191,"PricewaterhouseCoopers LLP Chartered Accountants",271,Vancouver,A1,"BRITISH COLUMBIA",Canada,6-K,2025-02-20,,"B2GOLD CORP",1429937,"=""BTG""","PARK PLACE","SUITE 3400 - 666 BURRARD STREET",VANCOUVER,A1,"BRITISH COLUMBIA",Canada,,,"=""1040""","Metal Mining",212221,"Gold Ore Mining",34,2,12/31/24,"3,216,019,200",12/31/24,"1,902,030,000","-626,653,000",,"4,813,998,000"
45886,"Long-lived assets","Impairment of the Goose Project cash-generating unit (CGU)",559493,12/31/24,02/19/25,1,"PricewaterhouseCoopers LLP",191,"PricewaterhouseCoopers LLP Chartered Accountants",271,Vancouver,A1,"BRITISH COLUMBIA",Canada,40-F,2025-03-28,,"B2GOLD CORP",1429937,"=""BTG""","PARK PLACE","SUITE 3400 - 666 BURRARD STREET",VANCOUVER,A1,"BRITISH COLUMBIA",Canada,,,"=""1040""","Metal Mining",212221,"Gold Ore Mining",34,2,12/31/24,"3,216,019,200",12/31/24,"1,902,030,000","-626,653,000",,"4,813,998,000"
45887,"Long-lived assets","Impairment of the Fekola Complex CGU",559493,12/31/24,02/19/25,1,"PricewaterhouseCoopers LLP",191,"PricewaterhouseCoopers LLP Chartered Accountants",271,Vancouver,A1,"BRITISH COLUMBIA",Canada,40-F,2025-03-28,,"B2GOLD CORP",1429937,"=""BTG""","PARK PLACE","SUITE 3400 - 666 BURRARD STREET",VANCOUVER,A1,"BRITISH COLUMBIA",Canada,,,"=""1040""","Metal Mining",212221,"Gold Ore Mining",34,2,12/31/24,"3,216,019,200",12/31/24,"1,902,030,000","-626,653,000",,"4,813,998,000"
46139,"Revenue from customer contracts","Revenue Recognition and Contracts – Refer to Notes 2, 4 and 6 to the financial statements",560030,12/31/24,03/31/25,3,"Deloitte & Touche LLP",,,,Cleveland,OH,OHIO,"US Midwest",10-K,2025-03-31,Yes,"Babcock & Wilcox Enterprises, Inc.",1630805,"=""BW""","1200 E. MARKET STREET, SUITE 650",,AKRON,OH,OHIO,"US Midwest",,,"=""3433""","Heating Equipment, Except Electric and Warm Air Furnaces",333414,"Heating Equipment (except Warm Air Furnaces) Manufacturing",34,2,12/31/24,"156,026,320",12/31/24,"717,333,000","-59,915,000","-384,952,000","726,987,000"
46140,"Internal controls","Impact on Audit of Financial Statements Because of Material Weaknesses in Internal Control Over Financial Reporting – Refer to Management’s Annual Report on Internal Control Over Financial Reporting",560030,12/31/24,03/31/25,3,"Deloitte & Touche LLP",,,,Cleveland,OH,OHIO,"US Midwest",10-K,2025-03-31,Yes,"Babcock & Wilcox Enterprises, Inc.",1630805,"=""BW""","1200 E. MARKET STREET, SUITE 650",,AKRON,OH,OHIO,"US Midwest",,,"=""3433""","Heating Equipment, Except Electric and Warm Air Furnaces",333414,"Heating Equipment (except Warm Air Furnaces) Manufacturing",34,2,12/31/24,"156,026,320",12/31/24,"717,333,000","-59,915,000","-384,952,000","726,987,000"
41472,"Warranty liabilities","Warranty and After-Sale Costs Reserve",551436,12/31/24,02/14/25,2,"Ernst & Young LLP",,,,Milwaukee,WI,WISCONSIN,"US Midwest",10-K,2025-02-14,,"BADGER METER INC",9092,"=""BMI""","4545 WEST BROWN DEER ROAD",,MILWAUKEE,WI,WISCONSIN,"US Midwest",,,"=""3824""","Totalizing Fluid Meters and Counting Devices",335313,"Switchgear and Switchboard Apparatus Manufacturing",34,212,01/02/25,"6,225,647,616",12/31/24,"826,558,000","124,942,000","449,396,000","816,413,000"
45834,"Equity investments and joint ventures","Impairment assessment of equity method investments and equity investments accounted for using the measurement alternative",559384,12/31/24,03/28/25,2,"Ernst & Young LLP",211,"Ernst & Young Hua Ming LLP",1408,Beijing,F4,CHINA,Foreign,20-F,2025-03-28,,"Baidu, Inc.",1329099,"=""BIDU""","BAIDU CAMPUS, NO. 10 SHANGDI 10TH STREET","HAIDIAN DISTRICT",BEIJING,F4,CHINA,Foreign,,,"=""7370""","Services-Computer Programming, Data Processing, Etc.",518210,"Data Processing, Hosting, and Related Services",34,83,01/02/25,"23,573,749,760",12/31/24,"18,238,000,000","3,255,000,000","31,305,000,000","58,606,000,000"
43248,"Other investments","Valuation of Portfolio Investments—Certain Level 3 Portfolio Investments in Loans, Subordinated Debt, Preferred Equity, and Equity Interests Valued Using Significant Unobservable Inputs",553930,12/31/24,02/27/25,1,"PricewaterhouseCoopers LLP",,,,Boston,MA,MASSACHUSETTS,"US New England",10-K,2025-02-27,,"Bain Capital Specialty Finance, Inc.",1655050,"=""BCSF""","C/O BAIN CAPITAL CREDIT, LP","200 CLARENDON STREET",BOSTON,MA,MASSACHUSETTS,"US New England",,,,,525990,"Other Financial Vehicles",34,18,12/31/24,"1,131,130,880",12/31/24,"217,965,000","119,418,000",,"2,632,157,000"
40683,"Revenue from customer contracts","Revenue recognition on certain agreements for sales of equipment manufactured to unique customer specifications",548178,12/31/24,02/04/25,4,"KPMG LLP",,,,Houston,TX,TEXAS,"US Southwest",10-K,2025-02-04,,"Baker Hughes Co",1701605,"=""BKR""","575 NORTH DAIRY ASHFORD ROAD, SUITE 100",,HOUSTON,TX,TEXAS,"US Southwest",40545,"GENERAL ELECTRIC CO","=""3533""","Oil and Gas Field Machinery and Equipment",333132,"Oil and Gas Field Machinery and Equipment Manufacturing",34,42,01/02/25,"41,124,691,968",12/31/24,"27,829,000,000","2,979,000,000","6,866,000,000","38,363,000,000"
45294,"Other intangible assets","Assessment of obligation to securely store crypto assets",558245,12/31/24,03/19/25,4,"KPMG LLP",,,,"New York",NY,"NEW YORK","US Mid Atlantic",10-K,2025-03-20,,"Bakkt Holdings, Inc.",1820302,"=""BKKT""","ONE LIBERTY PLAZA","1 LIBERTY ST FL 3 STE 305-306","NEW YORK",NY,"NEW YORK","US Mid Atlantic",,,"=""6199""","Finance Services",518210,"Data Processing, Hosting, and Related Services",34,25,12/31/24,"161,274,624",12/31/24,"3,490,220,000","-46,659,000","-37,007,000","269,377,000"
45295,"Going concern","Evaluation of the Company’s ability to continue as a going concern",558245,12/31/24,03/19/25,4,"KPMG LLP",,,,"New York",NY,"NEW YORK","US Mid Atlantic",10-K,2025-03-20,,"Bakkt Holdings, Inc.",1820302,"=""BKKT""","ONE LIBERTY PLAZA","1 LIBERTY ST FL 3 STE 305-306","NEW YORK",NY,"NEW YORK","US Mid Atlantic",,,"=""6199""","Finance Services",518210,"Data Processing, Hosting, and Related Services",34,25,12/31/24,"161,274,624",12/31/24,"3,490,220,000","-46,659,000","-37,007,000","269,377,000"
45296,"Other debt","Accounting for and Fair Values of Class 1 and Class 2 Warrants",558245,12/31/24,03/19/25,4,"KPMG LLP",,,,"New York",NY,"NEW YORK","US Mid Atlantic",10-K,2025-03-20,,"Bakkt Holdings, Inc.",1820302,"=""BKKT""","ONE LIBERTY PLAZA","1 LIBERTY ST FL 3 STE 305-306","NEW YORK",NY,"NEW YORK","US Mid Atlantic",,,"=""6199""","Finance Services",518210,"Data Processing, Hosting, and Related Services",34,25,12/31/24,"161,274,624",12/31/24,"3,490,220,000","-46,659,000","-37,007,000","269,377,000"
45297,Goodwill,"Goodwill impairment assessment",558245,12/31/24,03/19/25,4,"KPMG LLP",,,,"New York",NY,"NEW YORK","US Mid Atlantic",10-K,2025-03-20,,"Bakkt Holdings, Inc.",1820302,"=""BKKT""","ONE LIBERTY PLAZA","1 LIBERTY ST FL 3 STE 305-306","NEW YORK",NY,"NEW YORK","US Mid Atlantic",,,"=""6199""","Finance Services",518210,"Data Processing, Hosting, and Related Services",34,25,12/31/24,"161,274,624",12/31/24,"3,490,220,000","-46,659,000","-37,007,000","269,377,000"
42696,"Revenue from customer contracts","Revenue Recognition – Direct Bill Commission Revenue for the Insurance Advisory Services (IAS) Reportable Segment",553158,12/31/24,02/25/25,1,"PricewaterhouseCoopers LLP",,,,Tampa,FL,FLORIDA,"US Southeast",10-K,2025-02-25,,"Baldwin Insurance Group, Inc.",1781755,"=""BWIN""","4211 W. BOY SCOUT BLVD.","SUITE 800",TAMPA,FL,FLORIDA,"US Southeast",,,"=""6411""","Insurance Agents, Brokers, and Service",524210,"Insurance Agencies and Brokerages",34,39,12/31/24,"2,634,882,304",12/31/24,"1,389,037,000","-24,518,000","-1,782,192,000","3,534,731,000"
42105,"Revenue from customer contracts","Revenue Recognition from Certain Product Revenue",552236,12/31/24,02/20/25,1,"PricewaterhouseCoopers LLP",,,,Denver,CO,COLORADO,"US West",10-K,2025-02-20,,"BALL Corp",9389,"=""BALL""","9200 W. 108TH CIRCLE",,WESTMINSTER,CO,COLORADO,"US West",,,"=""3411""","Metal Cans",322215,"Nonfolding Sanitary Food Container Manufacturing",34,54,01/02/25,"16,246,308,864",12/31/24,"11,795,000,000","4,008,000,000","610,000,000","17,628,000,000"
44778,"Long-lived assets","Evaluation of the recoverable amount of property, plant and equipment and goodwill",557313,12/31/24,03/12/25,4,"KPMG LLP",187,"KPMG LLP Chartered Accountants",85,Vancouver,A1,"BRITISH COLUMBIA",Canada,40-F,2025-03-13,,"Ballard Power Systems Inc.",1453015,"=""BLDP""","9000 GLENLYON PARKWAY",,BURNABY,A1,"BRITISH COLUMBIA",Canada,,,"=""3620""","Electrical Industrial Apparatus",335999,"All Other Miscellaneous Electrical Equipment and Component Manufacturing",34,2,12/31/24,"497,067,264",12/31/24,"69,731,000","-324,245,000","671,233,000","777,307,000"
45095,Goodwill,"Goodwill – International Interactive Reporting Unit – Refer to Notes 2 and 11 to the financial statements.",557871,12/31/24,03/17/25,3,"Deloitte & Touche LLP",,,,"New York",NY,"NEW YORK","US Mid Atlantic",10-K,2025-03-17,,"Bally's Corp",1747079,"=""BALY""","100 WESTMINSTER STREET",,PROVIDENCE,RI,"RHODE ISLAND","US New England",,,"=""7011""","Hotels and Motels",721120,"Casino Hotels",34,18,01/02/25,"727,123,200",12/31/24,"2,450,478,000","-567,754,000","-3,076,385,000","5,860,137,000"
40923,"Regulatory assets and liabilities","Accounting for the Effects of Rate Regulation",550822,12/31/24,02/12/25,1,"PricewaterhouseCoopers LLP",,,,Baltimore,MD,MARYLAND,"US Mid Atlantic",10-K,2025-02-12,,"BALTIMORE GAS & ELECTRIC CO",9466,,"2 CENTER PLAZA","110 W. FAYETTE STREET",BALTIMORE,MD,MARYLAND,"US Mid Atlantic",1004440,"CONSTELLATION ENERGY GROUP INC","=""4931""","Electric and Other Services Combined",221122,"Electric Power Distribution",34,,,,12/31/24,"4,426,000,000","527,000,000",,"15,542,000,000"
44054,"Allowance for credit losses","Allowance for loan and lease losses - collectively evaluated",554955,12/31/24,03/03/25,2,"Ernst & Young LLP",,,,Irvine,CA,CALIFORNIA,"US West",10-K,2025-03-03,,"BANC OF CALIFORNIA, INC.",1169770,"=""BANC""","3 MACARTHUR PLACE",,"SANTA ANA",CA,CALIFORNIA,"US West",,,"=""6021""","National Commercial Banks",522120,"Savings Institutions",34,15,01/02/25,"2,414,526,464",12/31/24,"960,394,000","126,888,000","3,152,484,000","33,542,864,000"
46402,"Allowance for credit losses","Impairment of financial assets",560652,12/31/24,04/04/25,2,"Ernst & Young LLP",912,"Pistrelli Henry Martin y Asociados SA",1449,"Buenos Aires",C1,ARGENTINA,Foreign,20-F,2025-04-04,,"Banco BBVA Argentina S.A.",913059,"=""BBAR""","AV. CORDOBA 111",,"BUENOS AIRES",C1,ARGENTINA,Foreign,,,"=""6029""","Commercial Banks, NEC",522110,"Commercial Banking",34,19,12/31/24,"3,892,750,848",12/31/24,"3,947,233,000","353,846,000","2,429,225,000","14,277,298,000"
42422,"Allowance for credit losses","Expected credit losses related to loans and advances to customers at amortized cost",552725,12/31/24,02/21/25,2,"Ernst & Young LLP",163,"Ernst & Young SL",1461,Madrid,U3,SPAIN,Foreign,20-F,2025-02-21,,"BANCO BILBAO VIZCAYA ARGENTARIA, S.A.",842180,"=""BBVA""","CALLE AZUL 4",,BILBOA,U3,SPAIN,Foreign,,,"=""6029""","Commercial Banks, NEC",522110,"Commercial Banking",33,10,12/31/24,"55,951,093,760",12/31/24,"36,049,000,000","9,983,000,000","71,983,000,000","799,826,000,000"
42423,"Other investments","Measurement of fair value of certain financial instruments",552725,12/31/24,02/21/25,2,"Ernst & Young LLP",163,"Ernst & Young SL",1461,Madrid,U3,SPAIN,Foreign,20-F,2025-02-21,,"BANCO BILBAO VIZCAYA ARGENTARIA, S.A.",842180,"=""BBVA""","CALLE AZUL 4",,BILBOA,U3,SPAIN,Foreign,,,"=""6029""","Commercial Banks, NEC",522110,"Commercial Banking",33,10,12/31/24,"55,951,093,760",12/31/24,"36,049,000,000","9,983,000,000","71,983,000,000","799,826,000,000"
43780,"Allowance for credit losses","Measurement of expected credit losses",554561,12/31/24,02/28/25,1,"PricewaterhouseCoopers LLP",91,"PricewaterhouseCoopers Auditores Independentes",1351,"São Paulo",D5,BRAZIL,Foreign,20-F,2025-02-28,,"Banco Santander (Brasil) S.A.",1471055,"=""BSBR""","AV. JUSCELINO KUBITSCHEK, 2235","AV. JUSCELINO KUBITSCHEK, 2041","SAO PAULO, SP",D5,BRAZIL,Foreign,891478,"Banco Santander, S.A.","=""6029""","Commercial Banks, NEC",522110,"Commercial Banking",34,4,01/02/25,"15,128,094,720",12/31/24,"6,520,292,000","1,861,739,000","14,028,325,000","200,522,319,000"
43781,"Other contingent liabilities","Provisions for judicial and administrative proceedings",554561,12/31/24,02/28/25,1,"PricewaterhouseCoopers LLP",91,"PricewaterhouseCoopers Auditores Independentes",1351,"São Paulo",D5,BRAZIL,Foreign,20-F,2025-02-28,,"Banco Santander (Brasil) S.A.",1471055,"=""BSBR""","AV. JUSCELINO KUBITSCHEK, 2235","AV. JUSCELINO KUBITSCHEK, 2041","SAO PAULO, SP",D5,BRAZIL,Foreign,891478,"Banco Santander, S.A.","=""6029""","Commercial Banks, NEC",522110,"Commercial Banking",34,4,01/02/25,"15,128,094,720",12/31/24,"6,520,292,000","1,861,739,000","14,028,325,000","200,522,319,000"
43734,"Allowance for credit losses","Expected Credit Loss Allowance for Commercial, Mortgage and Consumer Loans – Collective Basis",554417,12/31/24,02/27/25,1,"PricewaterhouseCoopers LLP",93,"PricewaterhouseCoopers Consultores Auditores y Compania Limitada",1364,Santiago,F3,CHILE,Foreign,20-F,2025-02-28,,"BANCO SANTANDER CHILE",1027552,"=""BSAC""","BANDERA 140, PISO 19",,SANTIAGO,F3,CHILE,Foreign,891478,"Banco Santander, S.A.","=""6029""","Commercial Banks, NEC",522293,"International Trade Financing",34,19,01/02/25,"8,814,567,424",12/31/24,"2,114,000,000","865,000,000","5,195,000,000","68,780,000,000"
43946,"Accounts/loans receivable","Estimation of impairment of financial assets at amortized cost– loans and advances to customers",554841,12/31/24,02/28/25,1,"PricewaterhouseCoopers LLP",117,"PricewaterhouseCoopers Auditores SL",1306,Madrid,U3,SPAIN,Foreign,20-F,2025-02-28,,"Banco Santander, S.A.",891478,"=""SAN""","CIUDAD GRUPO SANTANDER","BOADILLA DEL MONTE",MADRID,U3,SPAIN,Foreign,,,"=""6029""","Commercial Banks, NEC",522110,"Commercial Banking",34,4,01/02/25,"72,181,293,056",12/31/24,"47,875,000,000","12,661,000,000","525,238,000,000","1,902,311,000,000"
43947,Goodwill,"Goodwill Impairment Assessment of Certain Cash Generating Unit (CGU)",554841,12/31/24,02/28/25,1,"PricewaterhouseCoopers LLP",117,"PricewaterhouseCoopers Auditores SL",1306,Madrid,U3,SPAIN,Foreign,20-F,2025-02-28,,"Banco Santander, S.A.",891478,"=""SAN""","CIUDAD GRUPO SANTANDER","BOADILLA DEL MONTE",MADRID,U3,SPAIN,Foreign,,,"=""6029""","Commercial Banks, NEC",522110,"Commercial Banking",34,4,01/02/25,"72,181,293,056",12/31/24,"47,875,000,000","12,661,000,000","525,238,000,000","1,902,311,000,000"
43948,"Other contingent liabilities","Litigation provisions and contingencies",554841,12/31/24,02/28/25,1,"PricewaterhouseCoopers LLP",117,"PricewaterhouseCoopers Auditores SL",1306,Madrid,U3,SPAIN,Foreign,20-F,2025-02-28,,"Banco Santander, S.A.",891478,"=""SAN""","CIUDAD GRUPO SANTANDER","BOADILLA DEL MONTE",MADRID,U3,SPAIN,Foreign,,,"=""6029""","Commercial Banks, NEC",522110,"Commercial Banking",34,4,01/02/25,"72,181,293,056",12/31/24,"47,875,000,000","12,661,000,000","525,238,000,000","1,902,311,000,000"
45947,"Allowance for credit losses","Allowance for loans, advances and lease losses",559329,12/31/24,03/28/25,1,"PricewaterhouseCoopers LLP",890,"PwC Contadores y Auditores SAS",6466,Medellin,F8,COLOMBIA,Foreign,20-F,2025-03-28,,"BANCOLOMBIA SA",1071371,,"AVENIDA LOS INDUSTRIALES","CARRERA 48 # 26 -85",MEDELLIN,F8,COLOMBIA,Foreign,,,"=""6029""","Commercial Banks, NEC",522110,"Commercial Banking",34,32,12/31/24,"3,561,594,368",12/31/24,"5,082,000,000","1,445,000,000","7,667,000,000","84,488,000,000"
45948,Goodwill,"Goodwill impairment assessment",559329,12/31/24,03/28/25,1,"PricewaterhouseCoopers LLP",890,"PwC Contadores y Auditores SAS",6466,Medellin,F8,COLOMBIA,Foreign,20-F,2025-03-28,,"BANCOLOMBIA SA",1071371,,"AVENIDA LOS INDUSTRIALES","CARRERA 48 # 26 -85",MEDELLIN,F8,COLOMBIA,Foreign,,,"=""6029""","Commercial Banks, NEC",522110,"Commercial Banking",34,32,12/31/24,"3,561,594,368",12/31/24,"5,082,000,000","1,445,000,000","7,667,000,000","84,488,000,000"
46420,"Allowance for credit losses","Allowance for loans, advances and lease losses",560822,12/31/24,03/28/25,1,"PricewaterhouseCoopers LLP",890,"PwC Contadores y Auditores SAS",6466,Medellin,F8,COLOMBIA,Foreign,6-K,2025-04-07,,"BANCOLOMBIA SA",1071371,,"AVENIDA LOS INDUSTRIALES","CARRERA 48 # 26 -85",MEDELLIN,F8,COLOMBIA,Foreign,,,"=""6029""","Commercial Banks, NEC",522110,"Commercial Banking",34,32,12/31/24,"3,561,594,368",12/31/24,"5,082,000,000","1,445,000,000","7,667,000,000","84,488,000,000"
46421,Goodwill,"Goodwill impairment assessment",560822,12/31/24,03/28/25,1,"PricewaterhouseCoopers LLP",890,"PwC Contadores y Auditores SAS",6466,Medellin,F8,COLOMBIA,Foreign,6-K,2025-04-07,,"BANCOLOMBIA SA",1071371,,"AVENIDA LOS INDUSTRIALES","CARRERA 48 # 26 -85",MEDELLIN,F8,COLOMBIA,Foreign,,,"=""6029""","Commercial Banks, NEC",522110,"Commercial Banking",34,32,12/31/24,"3,561,594,368",12/31/24,"5,082,000,000","1,445,000,000","7,667,000,000","84,488,000,000"
42067,"Revenue from customer contracts","Revenue Recognition",552178,12/31/24,02/20/25,2,"Ernst & Young LLP",,,,Raleigh,NC,"NORTH CAROLINA","US Southeast",10-K,2025-02-20,,"Bandwidth Inc.",1514416,"=""BAND""","2230 BANDMATE WAY",,RALEIGH,NC,"NORTH CAROLINA","US Southeast",,,"=""7372""","Prepackaged Software",511210,"Software Publishers",34,17,12/31/24,"452,539,456",12/31/24,"748,487,000","-6,524,000","-150,065,000","989,166,000"
45969,"Allowance for credit losses","Assessment of the allowance for expected credit losses on loans and advances to customers, loan commitments, financial guarantees, financial assets at fair value through other comprehensive income and securities at amortized cost",559688,12/31/24,03/31/25,4,"KPMG LLP",61,"KPMG Auditores Independentes",1124,"São Paulo",D5,BRAZIL,Foreign,20-F,2025-03-31,,"BANK BRADESCO",1160330,"=""BBD""","CIDADE DE DEUS S/N VILA YARA",OSASCO,"SAO PAULO",D5,BRAZIL,Foreign,,,"=""6022""","State Commercial Banks",522110,"Commercial Banking",34,2,12/31/24,"10,104,895,488",12/31/24,"12,737,991,000","2,839,524,000","23,415,986,000","334,984,560,000"
45970,"Other contingent liabilities","Evaluation of the measurement of provisions and the disclosure of contingent liabilities tax and civil",559688,12/31/24,03/31/25,4,"KPMG LLP",61,"KPMG Auditores Independentes",1124,"São Paulo",D5,BRAZIL,Foreign,20-F,2025-03-31,,"BANK BRADESCO",1160330,"=""BBD""","CIDADE DE DEUS S/N VILA YARA",OSASCO,"SAO PAULO",D5,BRAZIL,Foreign,,,"=""6022""","State Commercial Banks",522110,"Commercial Banking",34,2,12/31/24,"10,104,895,488",12/31/24,"12,737,991,000","2,839,524,000","23,415,986,000","334,984,560,000"
45971,"Deferred income taxes","Assessment of the recoverability of deferred tax assets",559688,12/31/24,03/31/25,4,"KPMG LLP",61,"KPMG Auditores Independentes",1124,"São Paulo",D5,BRAZIL,Foreign,20-F,2025-03-31,,"BANK BRADESCO",1160330,"=""BBD""","CIDADE DE DEUS S/N VILA YARA",OSASCO,"SAO PAULO",D5,BRAZIL,Foreign,,,"=""6022""","State Commercial Banks",522110,"Commercial Banking",34,2,12/31/24,"10,104,895,488",12/31/24,"12,737,991,000","2,839,524,000","23,415,986,000","334,984,560,000"
45972,"Insurance contract liabilities","Measurement of certain liabilities from insurance contracts issued under the general measurement and the variable fee approach model",559688,12/31/24,03/31/25,4,"KPMG LLP",61,"KPMG Auditores Independentes",1124,"São Paulo",D5,BRAZIL,Foreign,20-F,2025-03-31,,"BANK BRADESCO",1160330,"=""BBD""","CIDADE DE DEUS S/N VILA YARA",OSASCO,"SAO PAULO",D5,BRAZIL,Foreign,,,"=""6022""","State Commercial Banks",522110,"Commercial Banking",34,2,12/31/24,"10,104,895,488",12/31/24,"12,737,991,000","2,839,524,000","23,415,986,000","334,984,560,000"
42919,"Allowance for credit losses","Allowance for Loan and Lease Losses - Commercial and Consumer Card Loans",553335,12/31/24,02/25/25,1,"PricewaterhouseCoopers LLP",,,,Charlotte,NC,"NORTH CAROLINA","US Southeast",10-K,2025-02-25,,"BANK OF AMERICA CORP /DE/",70858,"=""BAC""","BANK OF AMERICA CORPORATE CENTER","100 N TRYON ST",CHARLOTTE,NC,"NORTH CAROLINA","US Southeast",,,"=""6021""","National Commercial Banks",522110,"Commercial Banking",34,44,01/02/25,"339,831,848,960",12/31/24,"96,066,000,000","27,132,000,000","226,538,000,000","3,261,519,000,000"
42920,"Other investments","Valuation of Certain Level 3 Financial Instruments",553335,12/31/24,02/25/25,1,"PricewaterhouseCoopers LLP",,,,Charlotte,NC,"NORTH CAROLINA","US Southeast",10-K,2025-02-25,,"BANK OF AMERICA CORP /DE/",70858,"=""BAC""","BANK OF AMERICA CORPORATE CENTER","100 N TRYON ST",CHARLOTTE,NC,"NORTH CAROLINA","US Southeast",,,"=""6021""","National Commercial Banks",522110,"Commercial Banking",34,44,01/02/25,"339,831,848,960",12/31/24,"96,066,000,000","27,132,000,000","226,538,000,000","3,261,519,000,000"
47011,"Allowance for credit losses","Allowance for loan losses",562658,12/31/24,04/24/25,2,"Ernst & Young LLP",894,"EY Servicios Profesionales de Auditoria y Asesorias Limitada",1431,Santiago,F3,CHILE,Foreign,20-F,2025-04-25,,"BANK OF CHILE",1161125,"=""BCH""","PASEO AHUMADA 251",,SANTIAGO,F3,CHILE,Foreign,,,"=""6029""","Commercial Banks, NEC",522110,"Commercial Banking",34,23,12/31/24,"11,455,337,008",12/31/24,"3,086,750,124","1,227,357,537",,"52,957,901,567"
44221,"Allowance for credit losses","Allowance for Credit Losses – Loans and Leases",555309,12/31/24,03/03/25,2,"Ernst & Young LLP",,,,Honolulu,HI,HAWAII,"US West",10-K,2025-03-04,,"BANK OF HAWAII CORP",46195,"=""BOH""","130 MERCHANT STREET",,HONOLULU,HI,HAWAII,"US West",,,"=""6022""","State Commercial Banks",522110,"Commercial Banking",34,70,01/02/25,"2,784,358,144",12/31/24,"627,959,000","149,994,000","1,636,257,000","23,601,114,000"
40173,"Allowance for credit losses","Assessment of the Allowance for Credit Losses for Loans",544951,10/31/24,12/05/24,4,"KPMG LLP",187,"KPMG LLP Chartered Accountants",85,Toronto,A6,ONTARIO,Canada,40-F,2024-12-05,,"BANK OF MONTREAL /CAN/",927971,"=""BMO""","FIRST CANADIAN PLACE",*,TORONTO,A6,ONTARIO,Canada,,,"=""6029""","Commercial Banks, NEC",521110,"Monetary Authorities - Central Bank",34,93,10/29/24,"67,051,388,928",10/31/24,"20,829,000,000","5,256,000,000","44,873,000,000","1,011,261,000,000"
40174,"Other investments","Assessment of the Measurement of the Fair Value of Certain Securities",544951,10/31/24,12/05/24,4,"KPMG LLP",187,"KPMG LLP Chartered Accountants",85,Toronto,A6,ONTARIO,Canada,40-F,2024-12-05,,"BANK OF MONTREAL /CAN/",927971,"=""BMO""","FIRST CANADIAN PLACE",*,TORONTO,A6,ONTARIO,Canada,,,"=""6029""","Commercial Banks, NEC",521110,"Monetary Authorities - Central Bank",34,93,10/29/24,"67,051,388,928",10/31/24,"20,829,000,000","5,256,000,000","44,873,000,000","1,011,261,000,000"
40175,"Uncertain tax positions","Assessment of Income Tax Uncertainties",544951,10/31/24,12/05/24,4,"KPMG LLP",187,"KPMG LLP Chartered Accountants",85,Toronto,A6,ONTARIO,Canada,40-F,2024-12-05,,"BANK OF MONTREAL /CAN/",927971,"=""BMO""","FIRST CANADIAN PLACE",*,TORONTO,A6,ONTARIO,Canada,,,"=""6029""","Commercial Banks, NEC",521110,"Monetary Authorities - Central Bank",34,93,10/29/24,"67,051,388,928",10/31/24,"20,829,000,000","5,256,000,000","44,873,000,000","1,011,261,000,000"
40176,"Insurance contract liabilities","Assessment of the Valuation of Insurance-related Liabilities and Transition to IFRS 17",544951,10/31/24,12/05/24,4,"KPMG LLP",187,"KPMG LLP Chartered Accountants",85,Toronto,A6,ONTARIO,Canada,40-F,2024-12-05,,"BANK OF MONTREAL /CAN/",927971,"=""BMO""","FIRST CANADIAN PLACE",*,TORONTO,A6,ONTARIO,Canada,,,"=""6029""","Commercial Banks, NEC",521110,"Monetary Authorities - Central Bank",34,93,10/29/24,"67,051,388,928",10/31/24,"20,829,000,000","5,256,000,000","44,873,000,000","1,011,261,000,000"
41806,"Allowance for credit losses","Allowance for Credit Losses for Loans",551944,12/31/24,02/19/25,1,"PricewaterhouseCoopers LLP",90,"PricewaterhouseCoopers Ltd",1403,Hamilton,D0,BERMUDA,Foreign,20-F,2025-02-19,,"Bank of N.T. Butterfield & Son Ltd",1653242,"=""NTB""","65 FRONT STREET",,HAMILTON,D0,BERMUDA,Foreign,,,"=""6029""","Commercial Banks, NEC",522110,"Commercial Banking",34,36,01/02/25,"1,727,680,768",12/31/24,"579,933,000","216,316,000","931,203,000","14,231,396,000"
43254,"Allowance for credit losses","Quantitative component of BNY’s pooled allowance for credit losses for loans and lending-related commitments related to higher risk-rated and pass-rated commercial and institutional credits and loans secured by commercial real estate",553935,12/31/24,02/27/25,4,"KPMG LLP",,,,"New York",NY,"NEW YORK","US Mid Atlantic",10-K,2025-02-27,,"Bank of New York Mellon Corp",1390777,"=""BK""","240 GREENWICH STREET",,"NEW YORK",NY,"NEW YORK","US Mid Atlantic",,,"=""6022""","State Commercial Banks",522110,"Commercial Banking",34,77,01/02/25,"56,283,131,904",12/31/24,"18,549,000,000","4,530,000,000","21,956,000,000","416,064,000,000"
43255,"Other contingent liabilities","Identification and measurement of accruals for litigation and regulatory contingencies",553935,12/31/24,02/27/25,4,"KPMG LLP",,,,"New York",NY,"NEW YORK","US Mid Atlantic",10-K,2025-02-27,,"Bank of New York Mellon Corp",1390777,"=""BK""","240 GREENWICH STREET",,"NEW YORK",NY,"NEW YORK","US Mid Atlantic",,,"=""6022""","State Commercial Banks",522110,"Commercial Banking",34,77,01/02/25,"56,283,131,904",12/31/24,"18,549,000,000","4,530,000,000","21,956,000,000","416,064,000,000"
43256,Goodwill,"Valuation of goodwill for the Investment Management reporting unit",553935,12/31/24,02/27/25,4,"KPMG LLP",,,,"New York",NY,"NEW YORK","US Mid Atlantic",10-K,2025-02-27,,"Bank of New York Mellon Corp",1390777,"=""BK""","240 GREENWICH STREET",,"NEW YORK",NY,"NEW YORK","US Mid Atlantic",,,"=""6022""","State Commercial Banks",522110,"Commercial Banking",34,77,01/02/25,"56,283,131,904",12/31/24,"18,549,000,000","4,530,000,000","21,956,000,000","416,064,000,000"
40145,"Allowance for credit losses","(i) Assessment of Allowance for Credit Losses (ACL)",544767,10/31/24,12/03/24,4,"KPMG LLP",187,"KPMG LLP Chartered Accountants",85,Toronto,A6,ONTARIO,Canada,40-F,2024-12-03,,"BANK OF NOVA SCOTIA",9631,"=""BNS""","40 TEMPERANCE STREET",,TORONTO,A6,ONTARIO,Canada,,,"=""6022""","State Commercial Banks",522110,"Commercial Banking",34,51,10/31/24,"64,075,993,088",10/31/24,"21,248,000,000","5,565,000,000","47,000,000,000","1,012,968,000,000"
40146,"Other investments","(ii) Assessment of the Measurement of Fair Value of Certain Financial Instruments",544767,10/31/24,12/03/24,4,"KPMG LLP",187,"KPMG LLP Chartered Accountants",85,Toronto,A6,ONTARIO,Canada,40-F,2024-12-03,,"BANK OF NOVA SCOTIA",9631,"=""BNS""","40 TEMPERANCE STREET",,TORONTO,A6,ONTARIO,Canada,,,"=""6022""","State Commercial Banks",522110,"Commercial Banking",34,51,10/31/24,"64,075,993,088",10/31/24,"21,248,000,000","5,565,000,000","47,000,000,000","1,012,968,000,000"
40147,"Uncertain tax positions","(iii) Assessment of Uncertain Tax Provisions",544767,10/31/24,12/03/24,4,"KPMG LLP",187,"KPMG LLP Chartered Accountants",85,Toronto,A6,ONTARIO,Canada,40-F,2024-12-03,,"BANK OF NOVA SCOTIA",9631,"=""BNS""","40 TEMPERANCE STREET",,TORONTO,A6,ONTARIO,Canada,,,"=""6022""","State Commercial Banks",522110,"Commercial Banking",34,51,10/31/24,"64,075,993,088",10/31/24,"21,248,000,000","5,565,000,000","47,000,000,000","1,012,968,000,000"
40154,"Allowance for credit losses","(i) Assessment of Allowance for Credit Losses (ACL)",544844,10/31/24,12/03/24,4,"KPMG LLP",187,"KPMG LLP Chartered Accountants",85,Toronto,A6,ONTARIO,Canada,6-K,2024-12-03,,"BANK OF NOVA SCOTIA",9631,"=""BNS""","40 TEMPERANCE STREET",,TORONTO,A6,ONTARIO,Canada,,,"=""6022""","State Commercial Banks",522110,"Commercial Banking",34,51,10/31/24,"64,075,993,088",10/31/24,"21,248,000,000","5,565,000,000","47,000,000,000","1,012,968,000,000"
40155,"Other investments","(ii) Assessment of the Measurement of Fair Value of Certain Financial Instruments",544844,10/31/24,12/03/24,4,"KPMG LLP",187,"KPMG LLP Chartered Accountants",85,Toronto,A6,ONTARIO,Canada,6-K,2024-12-03,,"BANK OF NOVA SCOTIA",9631,"=""BNS""","40 TEMPERANCE STREET",,TORONTO,A6,ONTARIO,Canada,,,"=""6022""","State Commercial Banks",522110,"Commercial Banking",34,51,10/31/24,"64,075,993,088",10/31/24,"21,248,000,000","5,565,000,000","47,000,000,000","1,012,968,000,000"
40156,"Uncertain tax positions","(iii) Assessment of Uncertain Tax Provisions",544844,10/31/24,12/03/24,4,"KPMG LLP",187,"KPMG LLP Chartered Accountants",85,Toronto,A6,ONTARIO,Canada,6-K,2024-12-03,,"BANK OF NOVA SCOTIA",9631,"=""BNS""","40 TEMPERANCE STREET",,TORONTO,A6,ONTARIO,Canada,,,"=""6022""","State Commercial Banks",522110,"Commercial Banking",34,51,10/31/24,"64,075,993,088",10/31/24,"21,248,000,000","5,565,000,000","47,000,000,000","1,012,968,000,000"
43803,"Allowance for credit losses","Allowance for Credit Losses — Refer to Notes 1 and 4 to the financial statements",554578,12/31/24,02/28/25,3,"Deloitte & Touche LLP",,,,Miami,FL,FLORIDA,"US Southeast",10-K,2025-02-28,,"BankUnited, Inc.",1504008,"=""BKU""","14817 OAK LANE",,"MIAMI LAKES",FL,FLORIDA,"US Southeast",,,"=""6035""","Savings Institutions, Federally Chartered",522110,"Commercial Banking",34,38,01/02/25,"2,834,482,432",12/31/24,"958,349,000","232,467,000","2,736,681,000","35,241,742,000"
46899,Goodwill,"Impairment assessment of goodwill of Baozun, Morefun and International reporting units",562340,12/31/24,04/23/25,4,"KPMG LLP",355,"KPMG Huazhen LLP",1186,Shanghai,F4,CHINA,Foreign,20-F,2025-04-23,,"Baozun Inc.",1625414,"=""BZUN""","NO. 1-9, LANE 510, WEST JIANGCHANG ROAD","JING'AN DISTRICT",SHANGHAI,F4,CHINA,Foreign,,,"=""5961""","Catalog and Mail-Order Houses",454111,"Electronic Shopping",34,3,01/02/25,"155,029,408",12/31/24,"1,290,849,000","-25,372,000","661,336,000","1,398,363,000"
41298,"Allowance for credit losses","Impairment allowance for loans and advances at amortised cost, including off-balance sheet elements of the allowance",551251,12/31/24,02/12/25,4,"KPMG LLP",87,"KPMG LLP",1118,London,X0,"UNITED KINGDOM",Foreign,20-F,2025-02-13,,"BARCLAYS BANK PLC",312070,"=""DJP""","1 CHURCHILL PLACE",*,LONDON,X0,"UNITED KINGDOM",Foreign,312069,"BARCLAYS PLC","=""6029""","Commercial Banks, NEC",522110,"Commercial Banking",34,32,01/02/25,"75,852,046,336",12/31/24,"25,843,000,000","4,694,000,000","72,383,000,000","1,526,093,000,000"
41299,"Other investments","Valuation of certain Level 3 and Level 2 financial instruments recorded at fair value",551251,12/31/24,02/12/25,4,"KPMG LLP",87,"KPMG LLP",1118,London,X0,"UNITED KINGDOM",Foreign,20-F,2025-02-13,,"BARCLAYS BANK PLC",312070,"=""DJP""","1 CHURCHILL PLACE",*,LONDON,X0,"UNITED KINGDOM",Foreign,312069,"BARCLAYS PLC","=""6029""","Commercial Banks, NEC",522110,"Commercial Banking",34,32,01/02/25,"75,852,046,336",12/31/24,"25,843,000,000","4,694,000,000","72,383,000,000","1,526,093,000,000"
41300,"Pension and other post-employment benefits","UK Pension Scheme – Defined Benefit Obligation (DBO) assumptions",551251,12/31/24,02/12/25,4,"KPMG LLP",87,"KPMG LLP",1118,London,X0,"UNITED KINGDOM",Foreign,20-F,2025-02-13,,"BARCLAYS BANK PLC",312070,"=""DJP""","1 CHURCHILL PLACE",*,LONDON,X0,"UNITED KINGDOM",Foreign,312069,"BARCLAYS PLC","=""6029""","Commercial Banks, NEC",522110,"Commercial Banking",34,32,01/02/25,"75,852,046,336",12/31/24,"25,843,000,000","4,694,000,000","72,383,000,000","1,526,093,000,000"
41259,"Allowance for credit losses","Impairment allowance for loans and advances at amortized cost, including off-balance sheet elements of the allowance",551228,12/31/24,02/12/25,4,"KPMG LLP",87,"KPMG LLP",1118,London,X0,"UNITED KINGDOM",Foreign,20-F,2025-02-13,,"BARCLAYS PLC",312069,"=""BCS""","1 CHURCHILL PLACE","CANARY WHARF",LONDON,X0,"UNITED KINGDOM",Foreign,,,"=""6029""","Commercial Banks, NEC",521110,"Monetary Authorities - Central Bank",34,13,01/02/25,"49,744,822,272",12/31/24,"35,576,000,000","7,960,000,000","79,586,000,000","1,901,413,000,000"
41260,"Other investments","Valuation of certain level 3 and level 2 financial instruments recorded at fair value",551228,12/31/24,02/12/25,4,"KPMG LLP",87,"KPMG LLP",1118,London,X0,"UNITED KINGDOM",Foreign,20-F,2025-02-13,,"BARCLAYS PLC",312069,"=""BCS""","1 CHURCHILL PLACE","CANARY WHARF",LONDON,X0,"UNITED KINGDOM",Foreign,,,"=""6029""","Commercial Banks, NEC",521110,"Monetary Authorities - Central Bank",34,13,01/02/25,"49,744,822,272",12/31/24,"35,576,000,000","7,960,000,000","79,586,000,000","1,901,413,000,000"
41261,"Pension and other post-employment benefits","UK Pension Scheme – Defined Benefit Obligation (DBO) assumptions",551228,12/31/24,02/12/25,4,"KPMG LLP",87,"KPMG LLP",1118,London,X0,"UNITED KINGDOM",Foreign,20-F,2025-02-13,,"BARCLAYS PLC",312069,"=""BCS""","1 CHURCHILL PLACE","CANARY WHARF",LONDON,X0,"UNITED KINGDOM",Foreign,,,"=""6029""","Commercial Banks, NEC",521110,"Monetary Authorities - Central Bank",34,13,01/02/25,"49,744,822,272",12/31/24,"35,576,000,000","7,960,000,000","79,586,000,000","1,901,413,000,000"
42095,"Other investments","Assessment of the fair value of investments",552252,12/31/24,02/20/25,4,"KPMG LLP",,,,Boston,MA,MASSACHUSETTS,"US New England",10-K,2025-02-20,,"Barings BDC, Inc.",1379785,"=""BBDC""","300 SOUTH TRYON STREET","SUITE 2500",CHARLOTTE,NC,"NORTH CAROLINA","US Southeast",,,,,525990,"Other Financial Vehicles",34,10,12/31/24,"1,008,763,520",12/31/24,"200,653,000","110,289,000",,"2,695,660,000"
38521,Inventory,"Inventory – Excess and Obsolete Inventory — Refer to Note 2 to the financial statements",536938,03/31/24,06/03/24,3,"Deloitte & Touche LLP",,,,"New York",NY,"NEW YORK","US Mid Atlantic",10-K,2024-06-03,,"Bark, Inc.",1819574,"=""BARK""","120 BROADWAY, 12TH FLOOR",,"NEW YORK",NY,"NEW YORK","US Mid Atlantic",,,"=""5990""","Retail-Retail Stores, NEC",454111,"Electronic Shopping",34,1,03/31/24,"217,661,088",03/31/24,"490,184,000","-37,010,000","127,462,000","298,588,000"
38788,Inventory,"Non-Returnable Inventory Reserve",538256,04/27/24,07/01/24,2,"Ernst & Young LLP",,,,Iselin,NJ,"NEW JERSEY","US Mid Atlantic",10-K,2024-07-01,,"Barnes & Noble Education, Inc.",1634117,"=""BNED""","120 MOUNTAIN VIEW BOULEVARD",,"BASKING RIDGE",NJ,"NEW JERSEY","US Mid Atlantic",,,"=""5940""","Retail-Miscellaneous Shopping Goods Stores",451211,"Book Stores",34,4,04/30/24,"10,813,661",04/27/24,"1,567,135,000","-63,211,000","-23,612,000","905,084,000"
38789,"Long-lived assets","Long-Lived Asset Impairment",538256,04/27/24,07/01/24,2,"Ernst & Young LLP",,,,Iselin,NJ,"NEW JERSEY","US Mid Atlantic",10-K,2024-07-01,,"Barnes & Noble Education, Inc.",1634117,"=""BNED""","120 MOUNTAIN VIEW BOULEVARD",,"BASKING RIDGE",NJ,"NEW JERSEY","US Mid Atlantic",,,"=""5940""","Retail-Miscellaneous Shopping Goods Stores",451211,"Book Stores",34,4,04/30/24,"10,813,661",04/27/24,"1,567,135,000","-63,211,000","-23,612,000","905,084,000"
40246,Inventory,"Non-Returnable Inventory Reserve",545425,04/27/24,07/01/24,2,"Ernst & Young LLP",,,,Iselin,NJ,"NEW JERSEY","US Mid Atlantic",8-K,2024-12-11,,"Barnes & Noble Education, Inc.",1634117,"=""BNED""","120 MOUNTAIN VIEW BOULEVARD",,"BASKING RIDGE",NJ,"NEW JERSEY","US Mid Atlantic",,,"=""5940""","Retail-Miscellaneous Shopping Goods Stores",451211,"Book Stores",34,4,04/30/24,"10,813,661",04/27/24,"1,567,135,000","-63,211,000","-23,612,000","905,084,000"
40247,"Long-lived assets","Long-Lived Asset Impairment",545425,04/27/24,07/01/24,2,"Ernst & Young LLP",,,,Iselin,NJ,"NEW JERSEY","US Mid Atlantic",8-K,2024-12-11,,"Barnes & Noble Education, Inc.",1634117,"=""BNED""","120 MOUNTAIN VIEW BOULEVARD",,"BASKING RIDGE",NJ,"NEW JERSEY","US Mid Atlantic",,,"=""5940""","Retail-Miscellaneous Shopping Goods Stores",451211,"Book Stores",34,4,04/30/24,"10,813,661",04/27/24,"1,567,135,000","-63,211,000","-23,612,000","905,084,000"
43934,"Other contingent liabilities","Workers' Compensation Claims Liabilities",554827,12/31/24,02/28/25,3,"Deloitte & Touche LLP",,,,Portland,OR,OREGON,"US West",10-K,2025-02-28,,"BARRETT BUSINESS SERVICES INC",902791,"=""BBSI""","8100 NE PARKWAY DRIVE","SUITE 200",VANCOUVER,WA,WASHINGTON,"US West",,,"=""7363""","Help Supply Services",561310,"Employment Placement Agencies",34,43,01/02/25,"1,114,774,400",12/31/24,"1,144,531,000","52,993,000","173,584,000","745,508,000"
44197,"Other contingent liabilities","Workers' Compensation Claims Liabilities",555090,12/31/24,02/28/25,3,"Deloitte & Touche LLP",,,,Portland,OR,OREGON,"US West",10-K/A,2025-03-03,,"BARRETT BUSINESS SERVICES INC",902791,"=""BBSI""","8100 NE PARKWAY DRIVE","SUITE 200",VANCOUVER,WA,WASHINGTON,"US West",,,"=""7363""","Help Supply Services",561310,"Employment Placement Agencies",34,43,01/02/25,"1,114,774,400",12/31/24,"1,144,531,000","52,993,000","173,584,000","745,508,000"
41322,"Long-lived assets","Impairment (impairment reversal) assessments for goodwill and other non-current assets",551318,12/31/24,02/11/25,1,"PricewaterhouseCoopers LLP",191,"PricewaterhouseCoopers LLP Chartered Accountants",271,Toronto,A6,ONTARIO,Canada,6-K,2025-02-13,,"BARRICK MINING CORP",756894,"=""B""","BROOKFIELD PLACE, TD CANADA TRUST TOWER","161 BAY STREET SUITE 3700",TORONTO,A6,ONTARIO,Canada,,,"=""1040""","Metal Mining",212221,"Gold Ore Mining",34,16,12/31/24,"26,770,057,216",12/31/24,"12,922,000,000","3,088,000,000","21,045,000,000","47,626,000,000"
44916,"Long-lived assets","Impairment (impairment reversal) assessments for goodwill and other non-current assets",557508,12/31/24,02/11/25,1,"PricewaterhouseCoopers LLP",191,"PricewaterhouseCoopers LLP Chartered Accountants",271,Toronto,A6,ONTARIO,Canada,40-F,2025-03-14,,"BARRICK MINING CORP",756894,"=""B""","BROOKFIELD PLACE, TD CANADA TRUST TOWER","161 BAY STREET SUITE 3700",TORONTO,A6,ONTARIO,Canada,,,"=""1040""","Metal Mining",212221,"Gold Ore Mining",34,16,12/31/24,"26,770,057,216",12/31/24,"12,922,000,000","3,088,000,000","21,045,000,000","47,626,000,000"
40833,Inventory,"Measurement of Wholesale Reserves for Excess and Obsolete Inventories",550652,11/30/24,02/10/25,2,"Ernst & Young LLP",,,,Richmond,VA,VIRGINIA,"US Mid Atlantic",10-K,2025-02-10,,"BASSETT FURNITURE INDUSTRIES INC",10329,"=""BSET""","PO BOX 626",,BASSETT,VA,VIRGINIA,"US Mid Atlantic",,,"=""2511""","Wood Household Furniture, Except Upholstered",337122,"Nonupholstered Wood Household Furniture Manufacturing",34,15,12/02/24,"135,273,472",11/30/24,"329,923,000","-9,695,000","153,142,000","341,170,000"
36496,"Other revenue","Loyalty Program",530925,02/03/24,03/22/24,2,"Ernst & Young LLP",,,,"Grandview Heights",OH,OHIO,"US Midwest",10-K,2024-03-22,,"Bath & Body Works, Inc.",701985,"=""BBWI""","THREE LIMITED PKWY","P O BOX 16000",COLUMBUS,OH,OHIO,"US Midwest",,,"=""5990""","Retail-Retail Stores, NEC",448120,"Women's Clothing Stores",34,43,02/05/24,"9,667,997,696",02/03/24,"7,429,000,000","878,000,000","-2,420,000,000","5,463,000,000"
45988,"Proven and unproven reserves","Proved Oil and Natural Gas Property and Depletion — Oil and Natural Gas Reserve Quantities — Refer to Note 1 and 6 to the financial statements",559723,12/31/24,03/31/25,3,"Deloitte & Touche LLP",,,,Houston,TX,TEXAS,"US Southwest",10-K,2025-03-31,,"BATTALION OIL CORP",1282648,"=""BATL""","820 GESSNER ROAD","SUITE 1100",HOUSTON,TX,TEXAS,"US Southwest",,,"=""1311""","Crude Petroleum and Natural Gas",211111,"Crude Petroleum and Natural Gas Extraction",34,2,12/31/24,"28,305,288",12/31/24,"193,893,000","-31,882,000",,"431,048,000"
41811,"Sales return and allowances","Medicaid Rebates for Certain Product Categories",551950,12/31/24,02/19/25,1,"PricewaterhouseCoopers LLP",,,,"Florham Park",NJ,"NEW JERSEY","US Mid Atlantic",10-K,2025-02-19,,"Bausch & Lomb Corp",1860742,"=""BLCO""","520 APPLEWOOD CRESCENT",,VAUGHAN,A6,ONTARIO,Canada,,,"=""3851""","Ophthalmic Goods",339115,"Ophthalmic Goods Manufacturing",34,18,12/31/24,"6,364,386,816",12/31/24,"4,791,000,000","-317,000,000","-1,544,000,000","13,469,000,000"
41812,"Business combinations","Acquisition of Elios Vision, Inc. – Valuation of In-Process Research and Development Asset and Product Brands",551950,12/31/24,02/19/25,1,"PricewaterhouseCoopers LLP",,,,"Florham Park",NJ,"NEW JERSEY","US Mid Atlantic",10-K,2025-02-19,,"Bausch & Lomb Corp",1860742,"=""BLCO""","520 APPLEWOOD CRESCENT",,VAUGHAN,A6,ONTARIO,Canada,,,"=""3851""","Ophthalmic Goods",339115,"Ophthalmic Goods Manufacturing",34,18,12/31/24,"6,364,386,816",12/31/24,"4,791,000,000","-317,000,000","-1,544,000,000","13,469,000,000"
42124,"Sales return and allowances","Medicaid Rebates and Sales Returns Allowances",552271,12/31/24,02/19/25,1,"PricewaterhouseCoopers LLP",,,,"Florham Park",NJ,"NEW JERSEY","US Mid Atlantic",10-K,2025-02-20,,"Bausch Health Companies Inc.",885590,"=""BHC""","2150 ST. ELZEAR BLVD. WEST",LAVAL,QUEBEC,A8,QUEBEC,Canada,,,"=""2834""","Pharmaceutical Preparations",325412,"Pharmaceutical Preparation Manufacturing",34,8,12/31/24,"2,964,815,104",12/31/24,"9,625,000,000","-46,000,000","-17,607,000,000","26,523,000,000"
42125,Goodwill,"Goodwill Impairment Assessments – Dermatology and Generics Reporting Units",552271,12/31/24,02/19/25,1,"PricewaterhouseCoopers LLP",,,,"Florham Park",NJ,"NEW JERSEY","US Mid Atlantic",10-K,2025-02-20,,"Bausch Health Companies Inc.",885590,"=""BHC""","2150 ST. ELZEAR BLVD. WEST",LAVAL,QUEBEC,A8,QUEBEC,Canada,,,"=""2834""","Pharmaceutical Preparations",325412,"Pharmaceutical Preparation Manufacturing",34,8,12/31/24,"2,964,815,104",12/31/24,"9,625,000,000","-46,000,000","-17,607,000,000","26,523,000,000"
42208,Goodwill,"Goodwill Impairment Assessment – Front Line Care Reporting Unit",552372,12/31/24,02/21/25,1,"PricewaterhouseCoopers LLP",,,,Chicago,IL,ILLINOIS,"US Midwest",10-K,2025-02-21,,"BAXTER INTERNATIONAL INC",10456,"=""BAX""","ONE BAXTER PARKWAY",,DEERFIELD,IL,ILLINOIS,"US Midwest",,,"=""3841""","Surgical and Medical Instruments and Apparatus",325414,"Biological Product (except Diagnostic) Manufacturing",34,29,01/02/25,"14,939,792,384",12/31/24,"10,636,000,000","-649,000,000","-3,534,000,000","25,782,000,000"
44267,"Proven and unproven reserves","Assessment of indicators of impairment or impairment reversal related to the Eagle Ford Operated, Eagle Ford Non-operated, Viking and Lloydminster CGUs",555471,12/31/24,03/04/25,4,"KPMG LLP",187,"KPMG LLP Chartered Accountants",85,Calgary,A0,ALBERTA,Canada,40-F,2025-03-05,,"BAYTEX ENERGY CORP.",1279495,"=""BTE""","2200 205 5TH AVE SW",,CALGARY,A0,ALBERTA,Canada,,,"=""1381""","Drilling Oil and Gas Wells",213111,"Drilling Oil and Gas Wells",34,3,12/31/24,"1,995,862,144",12/31/24,"2,314,608,000","164,509,000",,"5,395,456,000"
44268,"Proven and unproven reserves","Impact of estimated oil and gas reserves on depletion expense related to oil and gas properties",555471,12/31/24,03/04/25,4,"KPMG LLP",187,"KPMG LLP Chartered Accountants",85,Calgary,A0,ALBERTA,Canada,40-F,2025-03-05,,"BAYTEX ENERGY CORP.",1279495,"=""BTE""","2200 205 5TH AVE SW",,CALGARY,A0,ALBERTA,Canada,,,"=""1381""","Drilling Oil and Gas Wells",213111,"Drilling Oil and Gas Wells",34,3,12/31/24,"1,995,862,144",12/31/24,"2,314,608,000","164,509,000",,"5,395,456,000"
47114,"Deferred and stock-based compensation","Accounting for Shared-based Payments",563243,12/31/24,04/29/25,1,"PricewaterhouseCoopers LLP",107,"PricewaterhouseCoopers SC",1128,"Mexico City",O5,MEXICO,Foreign,20-F,2025-04-29,,"BBB FOODS INC",1978954,"=""TBBB""","RIO DANUBIO 51","COL. CUAUHTEMOC","MEXICO CITY",O5,MEXICO,Foreign,,,"=""5411""","Grocery Stores",445110,"Supermarkets and Other Grocery (except Convenience) Stores",34,30,01/02/25,"1,148,129,024",12/31/24,"2,762,454,000","16,084,000","193,721,000","1,095,421,000"
44816,"Other investments","Fair Value of Level 3 Investments — Refer to Notes 2 and 4 to the financial statements",557375,12/31/24,03/12/25,3,"Deloitte & Touche LLP",,,,"New York",NY,"NEW YORK","US Mid Atlantic",10-K,2025-03-13,,"BC Partners Lending Corp",1726548,,"650 MADISON AVENUE",,"NEW YORK",NY,"NEW YORK","US Mid Atlantic",,,,,525990,"Other Financial Vehicles",34,,,,12/31/24,"17,737,000","6,947,000","69,937,000","144,508,000"
44492,"Goodwill and intangible assets","Goodwill and intangible assets - Bell Media group - refer to notes 2N, 8, 19 and 22 to the financial statements",556299,12/31/24,03/06/25,3,"Deloitte & Touche LLP",486,"Deloitte srl",1208,Montreal,A8,QUEBEC,Canada,40-F,2025-03-07,,"BCE INC",718940,"=""BCE""","1 CARREFOUR ALEXANDER-GRAHAM-BELL","BUREAU 4100",MONTREAL,A8,QUEBEC,Canada,,,"=""4813""","Telephone Communications, Except Radiotelephone",517310,"Telecommunications Resellers",34,23,01/02/25,"21,219,506,176",12/31/24,"16,972,000,000","261,000,000","-6,936,000,000","51,095,000,000"
44776,"Other investments","Fair Value of Level III Investments — Refer to Notes 2 and 4 to the financial statements",557309,12/31/24,03/13/25,3,"Deloitte & Touche LLP",,,,"New York",NY,"NEW YORK","US Mid Atlantic",10-K,2025-03-13,,"BCP Investment Corp",1372807,"=""BCIC""","650 MADISON AVENUE","3RD FLOOR","NEW YORK",NY,"NEW YORK","US Mid Atlantic",,,,,525990,"Other Financial Vehicles",34,16,01/02/25,"151,092,864",12/31/24,"41,650,000","-5,935,000",,"453,634,000"
45826,Goodwill,"Goodwill Impairment Assessment – Refer to Notes 1 and 8 to the financial statements",559366,12/31/24,03/28/25,3,"Deloitte & Touche LLP",,,,"Los Angeles",CA,CALIFORNIA,"US West",10-K,2025-03-28,,"Beachbody Company, Inc.",1826889,"=""BODI""","400 CONTINENTAL BLVD","SUITE 400","EL SEGUNDO",CA,CALIFORNIA,"US West",,,"=""5960""","Retail-Nonstore Retailers",454111,"Electronic Shopping",34,6,01/02/25,"25,838,712",12/31/24,"418,796,000","-71,642,000","-36,996,000","174,556,000"
45933,Goodwill,"Goodwill Impairment Assessment – Refer to Notes 1 and 8 to the financial statements",559633,12/31/24,03/28/25,3,"Deloitte & Touche LLP",,,,"Los Angeles",CA,CALIFORNIA,"US West",424B3,2025-03-28,,"Beachbody Company, Inc.",1826889,"=""BODI""","400 CONTINENTAL BLVD","SUITE 400","EL SEGUNDO",CA,CALIFORNIA,"US West",,,"=""5960""","Retail-Nonstore Retailers",454111,"Electronic Shopping",34,6,01/02/25,"25,838,712",12/31/24,"418,796,000","-71,642,000","-36,996,000","174,556,000"
45934,Goodwill,"Goodwill Impairment Assessment – Refer to Notes 1 and 8 to the financial statements",559631,12/31/24,03/28/25,3,"Deloitte & Touche LLP",,,,"Los Angeles",CA,CALIFORNIA,"US West",424B3,2025-03-28,,"Beachbody Company, Inc.",1826889,"=""BODI""","400 CONTINENTAL BLVD","SUITE 400","EL SEGUNDO",CA,CALIFORNIA,"US West",,,"=""5960""","Retail-Nonstore Retailers",454111,"Electronic Shopping",34,6,01/02/25,"25,838,712",12/31/24,"418,796,000","-71,642,000","-36,996,000","174,556,000"
42938,"Research and development expenses","Research and Development Estimates – Refer to Notes 2 and 6 to the financial statements",553296,12/31/24,02/25/25,3,"Deloitte & Touche LLP",,,,Boston,MA,MASSACHUSETTS,"US New England",10-K,2025-02-25,,"Beam Therapeutics Inc.",1745999,"=""BEAM""","26 LANDSDOWNE STREET",,CAMBRIDGE,MA,MASSACHUSETTS,"US New England",,,"=""2836""","Biological Products, Except Diagnostic Substances",325414,"Biological Product (except Diagnostic) Manufacturing",34,25,12/31/24,"2,074,100,096",12/31/24,"63,518,000","-376,742,000",,"1,103,824,000"
42939,"Revenue from customer contracts","Revenue Recognition – Refer to Notes 2 and 11 to the financial statements",553296,12/31/24,02/25/25,3,"Deloitte & Touche LLP",,,,Boston,MA,MASSACHUSETTS,"US New England",10-K,2025-02-25,,"Beam Therapeutics Inc.",1745999,"=""BEAM""","26 LANDSDOWNE STREET",,CAMBRIDGE,MA,MASSACHUSETTS,"US New England",,,"=""2836""","Biological Products, Except Diagnostic Substances",325414,"Biological Product (except Diagnostic) Manufacturing",34,25,12/31/24,"2,074,100,096",12/31/24,"63,518,000","-376,742,000",,"1,103,824,000"
44688,Inventory,"Inventories — Provision for obsolete and excess inventory – Refer to Notes 2 and 3 to the financial statements",557134,12/31/24,03/12/25,3,"Deloitte & Touche LLP",,,,"Los Angeles",CA,CALIFORNIA,"US West",10-K,2025-03-12,,"Beauty Health Co",1818093,"=""SKIN""","2165 SPRING STREET",,"LONG BEACH",CA,CALIFORNIA,"US West",,,"=""3841""","Surgical and Medical Instruments and Apparatus",325620,"Toilet Preparation Manufacturing",34,2,12/31/24,"198,629,456",12/31/24,"334,294,000","-29,098,000","-119,208,000","685,683,000"
39955,Inventory,"Owned Inventory—Valuation of Projects in Progress—Refer to Notes 2 and 4 to the financial statements.",543983,09/30/24,11/13/24,3,"Deloitte & Touche LLP",,,,Atlanta,GA,GEORGIA,"US Southeast",10-K,2024-11-13,,"BEAZER HOMES USA INC",915840,"=""BZH""","2002 SUMMIT BLVD NE","15TH FLOOR",ATLANTA,GA,GEORGIA,"US Southeast",,,"=""1531""","Operative Builders",236117,"New Housing Operative Builders",34,34,09/30/24,"1,060,893,440",09/30/24,"2,330,197,000","140,175,000","1,220,735,000","2,591,527,000"
40123,"Business combinations","Business Combination",544556,09/30/24,11/27/24,2,"Ernst & Young LLP",,,,"New York",NY,"NEW YORK","US Mid Atlantic",10-K,2024-11-27,,"BECTON DICKINSON & CO",10795,"=""BDX""","ONE BECTON DR",,"FRANKLIN LAKES",NJ,"NEW JERSEY","US Mid Atlantic",,,"=""3841""","Surgical and Medical Instruments and Apparatus",334516,"Analytical Laboratory Instrument Manufacturing",34,240,10/02/24,"69,300,813,824",09/30/24,"20,178,000,000","1,705,000,000","-11,491,000,000","57,287,000,000"
40124,"Uncertain tax positions","Income taxes — Uncertain tax positions",544556,09/30/24,11/27/24,2,"Ernst & Young LLP",,,,"New York",NY,"NEW YORK","US Mid Atlantic",10-K,2024-11-27,,"BECTON DICKINSON & CO",10795,"=""BDX""","ONE BECTON DR",,"FRANKLIN LAKES",NJ,"NEW JERSEY","US Mid Atlantic",,,"=""3841""","Surgical and Medical Instruments and Apparatus",334516,"Analytical Laboratory Instrument Manufacturing",34,240,10/02/24,"69,300,813,824",09/30/24,"20,178,000,000","1,705,000,000","-11,491,000,000","57,287,000,000"
42700,"Equity investments and joint ventures","Valuation of certain equity method securities",553162,12/31/24,02/25/25,4,"KPMG LLP",,,,"Salt Lake City",UT,UTAH,"US West",10-K,2025-02-25,,"BED BATH & BEYOND, INC.",1130713,"=""BBBY""","433 W. ASCENSION WAY, 3RD FLOOR",,MURRAY,UT,UTAH,"US West",,,"=""5961""","Catalog and Mail-Order Houses",454111,"Electronic Shopping",34,5,12/31/24,"261,630,176",12/31/24,"1,394,964,000","-258,795,000","126,326,000","401,954,000"
41154,"Revenue from customer contracts","Revenue recognition - estimating variable consideration",551135,12/31/24,02/13/25,2,"Ernst & Young LLP",,,,"Saint Louis",MO,MISSOURI,"US Southeast",10-K,2025-02-13,,"BELDEN INC.",913142,"=""BDC""","1 NORTH BRENTWOOD BLVD","15TH FLOOR","ST. LOUIS",MO,MISSOURI,"US Southeast",,,"=""3357""","Drawing and Insulating of Nonferrous Wire",334290,"Other Communications Equipment Manufacturing",34,113,01/02/25,"4,566,108,160",12/31/24,"2,460,979,000","198,433,000","-143,015,000","3,327,938,000"
41155,"Business combinations","Fair Value of Customer Relationships Acquired in the Precision Optical Business Combination",551135,12/31/24,02/13/25,2,"Ernst & Young LLP",,,,"Saint Louis",MO,MISSOURI,"US Southeast",10-K,2025-02-13,,"BELDEN INC.",913142,"=""BDC""","1 NORTH BRENTWOOD BLVD","15TH FLOOR","ST. LOUIS",MO,MISSOURI,"US Southeast",,,"=""3357""","Drawing and Insulating of Nonferrous Wire",334290,"Other Communications Equipment Manufacturing",34,113,01/02/25,"4,566,108,160",12/31/24,"2,460,979,000","198,433,000","-143,015,000","3,327,938,000"
40030,"Sales return and allowances","Receivables, net- Allowance for Trade Promotions",544189,09/30/24,11/19/24,1,"PricewaterhouseCoopers LLP",,,,"Saint Louis",MO,MISSOURI,"US Southeast",10-K,2024-11-19,,"BELLRING BRANDS, INC.",1772016,"=""BRBR""","1 N. BRENTWOOD BOULEVARD, SUITE 1550",,CLAYTON,MO,MISSOURI,"US Southeast",,,"=""2000""","Food and Kindred Products",446191,"Food (Health) Supplement Stores",34,60,10/02/24,"7,803,659,776",09/30/24,"1,996,200,000","246,500,000","-413,600,000","837,000,000"
42569,"Other income taxes","Evaluation of income tax expense",552931,12/31/24,02/21/25,4,"KPMG LLP",,,,Phoenix,AZ,ARIZONA,"US Southwest",10-K,2025-02-24,,"BENCHMARK ELECTRONICS INC",863436,"=""BHE""","56 SOUTH ROCKFORD DRIVE",,TEMPE,AZ,ARIZONA,"US Southwest",,,"=""3672""","Printed Circuit Boards",334418,"Printed Circuit Assembly (Electronic Assembly) Manufacturing",34,45,01/02/25,"1,631,380,352",12/31/24,"2,656,105,000","63,327,000","921,197,000","2,139,464,000"
43626,"Other income taxes","Evaluation of income tax expense",554276,12/31/24,02/24/25,4,"KPMG LLP",,,,Phoenix,AZ,ARIZONA,"US Southwest",10-K/A,2025-02-27,,"BENCHMARK ELECTRONICS INC",863436,"=""BHE""","56 SOUTH ROCKFORD DRIVE",,TEMPE,AZ,ARIZONA,"US Southwest",,,"=""3672""","Printed Circuit Boards",334418,"Printed Circuit Assembly (Electronic Assembly) Manufacturing",34,45,01/02/25,"1,631,380,352",12/31/24,"2,656,105,000","63,327,000","921,197,000","2,139,464,000"
43132,"Revenue from customer contracts","IT systems used in subscriptions and licenses revenues",553445,12/31/24,02/26/25,4,"KPMG LLP",,,,Philadelphia,PA,PENNSYLVANIA,"US Mid Atlantic",10-K,2025-02-26,,"BENTLEY SYSTEMS INC",1031308,"=""BSY""","685 STOCKTON DRIVE",,EXTON,PA,PENNSYLVANIA,"US Mid Atlantic",,,"=""7372""","Prepackaged Software",541511,"Custom Computer Programming Services",34,47,12/31/24,"13,563,534,336",12/31/24,"1,353,095,000","234,787,000","-1,540,151,000","3,399,807,000"
43365,"Revenue from customer contracts","Product Revenue, Net",554034,12/31/24,02/27/25,2,"Ernst & Young LLP",,,,Boston,MA,MASSACHUSETTS,"US New England",10-K,2025-02-27,,"BeOne Medicines Ltd.",1651308,"=""ONC""","C/O BEONE MEDICINES I GMBH","AESCHENGRABEN 27, 21ST FLOOR",BASEL,V8,SWITZERLAND,Foreign,,,"=""2834""","Pharmaceutical Preparations",325412,"Pharmaceutical Preparation Manufacturing",34,184,01/02/25,"253,833,379,840",12/31/24,"3,810,241,000","-644,786,000","3,281,127,000","5,920,910,000"
42510,"Insurance contract liabilities","Reserves for losses and loss expenses",552900,12/31/24,02/24/25,4,"KPMG LLP",,,,"New York",NY,"NEW YORK","US Mid Atlantic",10-K,2025-02-24,,"BERKLEY W R CORP",11544,"=""WRB""","475 STEAMBOAT ROAD",.,GREENWICH,CT,CONNECTICUT,"US New England",,,"=""6331""","Fire, Marine, and Casualty Insurance",524113,"Direct Life Insurance Carriers",34,58,01/02/25,"22,105,819,136",12/31/24,"13,638,752,000","1,756,115,000","8,210,779,000","40,567,268,000"
42473,"Regulatory assets and liabilities","Regulatory Matters — Effects of Rate Regulation on the Financial Statements — Refer to Note 7 to the financial statements",552875,12/31/24,02/21/25,3,"Deloitte & Touche LLP",,,,"Des Moines",IA,IOWA,"US Midwest",10-K,2025-02-24,,"BERKSHIRE HATHAWAY ENERGY CO",1081316,,"1615 LOCUST STREET",,"DES MOINES",IA,IOWA,"US Midwest",1067983,"BERKSHIRE HATHAWAY INC","=""4900""","Electric, Gas & Sanitary Services",221122,"Electric Power Distribution",34,,,,12/31/24,"25,920,000,000","4,300,000,000","38,596,000,000","140,140,000,000"
42474,"Other contingent liabilities","Wildfires — Contingencies — Refer to Note 16 to the financial statements",552875,12/31/24,02/21/25,3,"Deloitte & Touche LLP",,,,"Des Moines",IA,IOWA,"US Midwest",10-K,2025-02-24,,"BERKSHIRE HATHAWAY ENERGY CO",1081316,,"1615 LOCUST STREET",,"DES MOINES",IA,IOWA,"US Midwest",1067983,"BERKSHIRE HATHAWAY INC","=""4900""","Electric, Gas & Sanitary Services",221122,"Electric Power Distribution",34,,,,12/31/24,"25,920,000,000","4,300,000,000","38,596,000,000","140,140,000,000"
42678,"Insurance contract liabilities","Unpaid Losses and Loss Adjustment Expenses — Refer to Notes 1 and 16 to the financial statements",552872,12/31/24,02/22/25,3,"Deloitte & Touche LLP",,,,Omaha,NE,NEBRASKA,"US Midwest",10-K,2025-02-24,,"BERKSHIRE HATHAWAY INC",1067983,"=""BRK.A""","3555 FARNAM STREET",,OMAHA,NE,NEBRASKA,"US Midwest",,,"=""6331""","Fire, Marine, and Casualty Insurance",524130,"Reinsurance Carriers",34,"680,920",12/31/24,"372,845,903,872",12/31/24,"424,232,000,000","88,995,000,000","530,850,000,000","1,153,881,000,000"
42679,"Insurance contract liabilities","Unpaid Losses and Loss Adjustment Expenses — Retroactive Reinsurance Contracts — Refer to Notes 1 and 17 to the financial statements",552872,12/31/24,02/22/25,3,"Deloitte & Touche LLP",,,,Omaha,NE,NEBRASKA,"US Midwest",10-K,2025-02-24,,"BERKSHIRE HATHAWAY INC",1067983,"=""BRK.A""","3555 FARNAM STREET",,OMAHA,NE,NEBRASKA,"US Midwest",,,"=""6331""","Fire, Marine, and Casualty Insurance",524130,"Reinsurance Carriers",34,"680,920",12/31/24,"372,845,903,872",12/31/24,"424,232,000,000","88,995,000,000","530,850,000,000","1,153,881,000,000"
44843,"Proven and unproven reserves","Estimate of proved oil and natural gas reserve quantities used in the depletion of proved oil and natural gas properties",557279,12/31/24,03/13/25,4,"KPMG LLP",,,,Dallas,TX,TEXAS,"US Southwest",10-K,2025-03-13,,"Berry Corp (bry)",1705873,"=""BRY""","16000 N. DALLAS PARKWAY, SUITE 500",,DALLAS,TX,TEXAS,"US Southwest",,,"=""1311""","Crude Petroleum and Natural Gas",211111,"Crude Petroleum and Natural Gas Extraction",34,4,12/31/24,"317,758,048",12/31/24,"783,841,000","42,032,000",,"1,517,686,000"
40098,"Pension and other post-employment benefits","United Kingdom Defined Benefit Pension Obligation",544480,09/28/24,11/26/24,2,"Ernst & Young LLP",,,,Indianapolis,IN,INDIANA,"US Midwest",10-K,2024-11-26,,"BERRY GLOBAL GROUP, INC.",1378992,"=""BERY""","101 OAKLEY STREET","PO BOX 959",EVANSVILLE,IN,INDIANA,"US Midwest",,,"=""3089""","Plastics Products, NEC",326199,"All Other Plastics Product Manufacturing",34,68,09/30/24,"7,790,508,032",09/28/24,"12,258,000,000","516,000,000","-3,016,000,000","16,613,000,000"
47135,"Pension and other post-employment benefits","United Kingdom Defined Benefit Pension Obligation",563564,09/28/24,11/26/24,2,"Ernst & Young LLP",,,,Indianapolis,IN,INDIANA,"US Midwest",8-K,2025-04-29,,"BERRY GLOBAL GROUP, INC.",1378992,"=""BERY""","101 OAKLEY STREET","PO BOX 959",EVANSVILLE,IN,INDIANA,"US Midwest",,,"=""3089""","Plastics Products, NEC",326199,"All Other Plastics Product Manufacturing",34,68,09/30/24,"7,790,508,032",09/28/24,"12,258,000,000","516,000,000","-3,016,000,000","16,613,000,000"
47146,"Pension and other post-employment benefits","United Kingdom Defined Benefit Pension Obligation",563339,09/28/24,11/26/24,2,"Ernst & Young LLP",,,,Indianapolis,IN,INDIANA,"US Midwest",425,2025-04-29,,"BERRY GLOBAL GROUP, INC.",1378992,"=""BERY""","101 OAKLEY STREET","PO BOX 959",EVANSVILLE,IN,INDIANA,"US Midwest",,,"=""3089""","Plastics Products, NEC",326199,"All Other Plastics Product Manufacturing",34,68,09/30/24,"7,790,508,032",09/28/24,"12,258,000,000","516,000,000","-3,016,000,000","16,613,000,000"
47147,"Pension and other post-employment benefits","United Kingdom Defined Benefit Pension Obligation",563338,09/28/24,11/26/24,2,"Ernst & Young LLP",,,,Indianapolis,IN,INDIANA,"US Midwest",425,2025-04-29,,"BERRY GLOBAL GROUP, INC.",1378992,"=""BERY""","101 OAKLEY STREET","PO BOX 959",EVANSVILLE,IN,INDIANA,"US Midwest",,,"=""3089""","Plastics Products, NEC",326199,"All Other Plastics Product Manufacturing",34,68,09/30/24,"7,790,508,032",09/28/24,"12,258,000,000","516,000,000","-3,016,000,000","16,613,000,000"
36158,"Vendor/supplier rebates","Vendor Allowances – Domestic Reporting Segment — Refer to Note 1 to the financial statements",530304,02/03/24,03/15/24,3,"Deloitte & Touche LLP",,,,Minneapolis,MN,MINNESOTA,"US Midwest",10-K,2024-03-15,,"BEST BUY CO INC",764478,"=""BBY""","7601 PENN AVE SOUTH",,RICHFIELD,MN,MINNESOTA,"US Midwest",,,"=""5731""","Radio, Television, and Consumer Electronics Stores",443112,"Radio, Television, and Other Electronics Stores",34,74,02/05/24,"15,984,534,528",02/03/24,"43,452,000,000","1,241,000,000","1,670,000,000","14,967,000,000"
36159,Goodwill,"Goodwill – Best Buy Health Reporting Unit — Refer to Note 1 to the financial statements",530304,02/03/24,03/15/24,3,"Deloitte & Touche LLP",,,,Minneapolis,MN,MINNESOTA,"US Midwest",10-K,2024-03-15,,"BEST BUY CO INC",764478,"=""BBY""","7601 PENN AVE SOUTH",,RICHFIELD,MN,MINNESOTA,"US Midwest",,,"=""5731""","Radio, Television, and Consumer Electronics Stores",443112,"Radio, Television, and Other Electronics Stores",34,74,02/05/24,"15,984,534,528",02/03/24,"43,452,000,000","1,241,000,000","1,670,000,000","14,967,000,000"
47133,"Goodwill and intangible assets","Goodwill and Indefinite-lived Intangible Assets Impairment Assessment – Jafra Mexico Group of Cash Generating Units",563172,12/31/24,04/29/25,1,"PricewaterhouseCoopers LLP",107,"PricewaterhouseCoopers SC",1128,"Mexico City",O5,MEXICO,Foreign,20-F,2025-04-29,,"BETTERWARE DE MEXICO, S.A.P.I. DE C.V",1788257,"=""BWMX""","CRUCE CARRETERA GDL AMECA HUAXTLA KM5",,"EL ARENAL",O5,MEXICO,Foreign,,,"=""5961""","Catalog and Mail-Order Houses",423220,"Home Furnishing Merchant Wholesalers",34,11,01/02/25,"412,347,840",12/31/24,"678,157,000","34,220,000","-96,455,000","502,760,000"
44279,Inventory,"Inventory—Provision for Excess and Obsolete Raw Materials and Work in Process Inventory—Refer to Notes 2 and 5 to the financial statements",555476,12/31/24,03/05/25,3,"Deloitte & Touche LLP",,,,"Los Angeles",CA,CALIFORNIA,"US West",10-K,2025-03-05,,"BEYOND MEAT, INC.",1655210,"=""BYND""","888 N. DOUGLAS STREET, SUITE 100",,"EL SEGUNDO",CA,CALIFORNIA,"US West",,,"=""2000""","Food and Kindred Products",311991,"Perishable Prepared Food Manufacturing",34,4,01/02/25,"251,032,768",12/31/24,"326,452,000","-160,278,000",,"678,146,000"
43989,"Other income taxes","Accounting for Income Taxes",554944,12/31/24,03/03/25,2,"Ernst & Young LLP",,,,"New York",NY,"NEW YORK","US Mid Atlantic",10-K,2025-03-03,,"BGC Group, Inc.",1094831,"=""BGC""","499 PARK AVENUE",,"NEW YORK",NY,"NEW YORK","US Mid Atlantic",,,"=""6200""","Security & Commodity Brokers, Dealers, Exchanges & Services",523120,"Securities Brokerage",34,9,01/02/25,"3,454,581,760",12/31/24,"2,171,743,000","126,988,000","117,307,000","3,591,967,000"
39355,"Property, plant and equipment","Carrying value of property, plant and equipment",540631,06/30/24,08/30/24,2,"Ernst & Young LLP",32,"Ernst & Young",1435,Melbourne,C3,AUSTRALIA,Foreign,20-F,2024-08-30,,"BHP Group Ltd",811809,"=""BHP""","LEVEL 27","180 LONSDALE STREET",MELBOURNE,C3,AUSTRALIA,Foreign,,,"=""1000""","Metal mining",212210,"Iron Ore Mining",34,57,06/30/24,"144,730,947,584",06/30/24,"55,658,000,000","7,897,000,000","43,093,000,000","102,362,000,000"
39356,"Asset retirement and environmental obligations","Closure and rehabilitation provisions",540631,06/30/24,08/30/24,2,"Ernst & Young LLP",32,"Ernst & Young",1435,Melbourne,C3,AUSTRALIA,Foreign,20-F,2024-08-30,,"BHP Group Ltd",811809,"=""BHP""","LEVEL 27","180 LONSDALE STREET",MELBOURNE,C3,AUSTRALIA,Foreign,,,"=""1000""","Metal mining",212210,"Iron Ore Mining",34,57,06/30/24,"144,730,947,584",06/30/24,"55,658,000,000","7,897,000,000","43,093,000,000","102,362,000,000"
39357,"Other contingent liabilities","Samarco dam failure provisions recognised and the contingent liabilities disclosed",540631,06/30/24,08/30/24,2,"Ernst & Young LLP",32,"Ernst & Young",1435,Melbourne,C3,AUSTRALIA,Foreign,20-F,2024-08-30,,"BHP Group Ltd",811809,"=""BHP""","LEVEL 27","180 LONSDALE STREET",MELBOURNE,C3,AUSTRALIA,Foreign,,,"=""1000""","Metal mining",212210,"Iron Ore Mining",34,57,06/30/24,"144,730,947,584",06/30/24,"55,658,000,000","7,897,000,000","43,093,000,000","102,362,000,000"
42688,"Revenue from customer contracts","Revenue recognition - Estimating costs to complete the performance obligations in collaboration and license agreements",553146,12/31/24,02/25/25,1,"PricewaterhouseCoopers LLP",121,"PricewaterhouseCoopers LLP",876,Cambridge,X0,"UNITED KINGDOM",Foreign,10-K,2025-02-25,,"BICYCLE THERAPEUTICS PLC",1761612,"=""BCYC""","BLOCKS A & B, PORTWAY BUILDING","GRANTA PARK, GREAT ABINGTON",CAMBRIDGE,X0,"UNITED KINGDOM",Foreign,,,"=""2834""","Pharmaceutical Preparations",325412,"Pharmaceutical Preparation Manufacturing",34,14,12/31/24,"665,970,496",12/31/24,"35,275,000","-169,031,000",,"956,868,000"
43167,Inventory,"Inventory — Valuation of merchandise inventories, net for slow-moving or obsolete merchandise reserves — Refer to Note 2 to the financial statements",553442,12/29/24,02/26/25,3,"Deloitte & Touche LLP",,,,"Los Angeles",CA,CALIFORNIA,"US West",10-K,2025-02-26,,"BIG 5 SPORTING GOODS Corp",1156388,"=""BGFV""","2525 EAST EL SEGUNDO BOULEVARD",,"EL SEGUNDO",CA,CALIFORNIA,"US West",,,"=""5940""","Retail-Miscellaneous Shopping Goods Stores",451110,"Sporting Goods Stores",34,2,12/31/24,"40,618,008",12/29/24,"795,468,000","-69,072,000",,"609,366,000"
44078,"Property, plant and equipment","Oil and Gas properties - Determination of Impairment Indicators and Recoverability Test - Refer to Notes 1 and 6 to the financial statements",555041,12/31/24,03/01/25,3,"Deloitte & Touche LLP",,,,Austin,TX,TEXAS,"US Southwest",10-K,2025-03-03,,"Biglari Holdings Inc.",1726173,"=""BH""","19100 RIDGEWOOD PKWY, SUITE 1200",,"SAN ANTONIO",TX,TEXAS,"US Southwest",,,"=""5812""","Eating and Drinking Places",722110,"Full-Service Restaurants",34,254,12/31/24,"526,034,464",12/31/24,"362,114,000","-3,062,708",,"367,629,898"
45493,"Revenue from customer contracts","Revenue recognition for in-game virtual items",558735,12/31/24,03/25/25,1,"PricewaterhouseCoopers LLP",94,"PricewaterhouseCoopers Zhong Tian LLP",1424,Beijing,F4,CHINA,Foreign,20-F,2025-03-25,,"Bilibili Inc.",1723690,"=""BILI""","17TH FLOOR, BUILDING 3, GUOZHENG CENTER","NO. 485 ZHENGLI ROAD, YANGPU DISTRICT",SHANGHAI,F4,CHINA,Foreign,,,"=""7374""","Computer Processing and Data Preparation and Processing Services",516110,"Internet Publishing and Broadcasting",34,18,12/31/24,"6,027,708,416",12/31/24,"3,675,929,000","-184,512,000","1,120,972,000","4,479,707,000"
39236,"Revenue from customer contracts","Revenue Recognition",540321,06/30/24,08/23/24,1,"PricewaterhouseCoopers LLP",,,,"San Jose",CA,CALIFORNIA,"US West",10-K,2024-08-23,,"BILL Holdings, Inc.",1786352,"=""BILL""","6220 AMERICA CENTER DR.","SUITE 100","SAN JOSE",CA,CALIFORNIA,"US West",,,"=""7372""","Prepackaged Software",511210,"Software Publishers",34,54,07/02/24,"5,682,594,816",06/30/24,"1,290,172,000","-28,878,000","1,456,221,000","9,178,813,000"
45792,"Research and development expenses","Prepaid or Accrued Research and Development Expenses",559079,12/31/24,03/27/25,2,"Ernst & Young LLP",,,,Houston,TX,TEXAS,"US Southwest",10-K,2025-03-27,Yes,"BIO-PATH HOLDINGS, INC.",1133818,"=""BPTH""","4710 BELLAIRE BOULEVARD","SUITE 210",BELLAIRE,TX,TEXAS,"US Southwest",,,"=""2834""","Pharmaceutical Preparations",541710,"Research and Development in the Physical, Engineering, and Life Sciences",34,1,01/02/25,"4,952,926",12/31/24,,"-9,894,000",,"3,883,000"
41390,"Financial statements and disclosures","Evaluation of the sufficiency of audit evidence over net sales",551354,12/31/24,02/14/25,4,"KPMG LLP",,,,"Santa Clara",CA,CALIFORNIA,"US West",10-K,2025-02-14,,"BIO-RAD LABORATORIES, INC.",12208,"=""BIO""","1000 ALFRED NOBEL DRIVE",,HERCULES,CA,CALIFORNIA,"US West",,,"=""3826""","Laboratory Analytical Instruments",334516,"Analytical Laboratory Instrument Manufacturing",34,326,01/02/25,"7,476,192,768",12/31/24,"2,566,500,000","-1,844,200,000","5,865,200,000","9,364,100,000"
39221,"Business combinations","Fair value measurement of the developed technology intangible asset acquired in the Lunaphore acquisition",540263,06/30/24,08/22/24,4,"KPMG LLP",,,,Minneapolis,MN,MINNESOTA,"US Midwest",10-K,2024-08-22,,"BIO-TECHNE Corp",842023,"=""TECH""","614 MCKINLEY PL N E","SUITE 1500",MINNEAPOLIS,MN,MINNESOTA,"US Midwest",,,"=""2836""","Biological Products, Except Diagnostic Substances",325413,"In-Vitro Diagnostic Substance Manufacturing",34,71,07/02/24,"11,226,329,088",06/30/24,"1,159,060,000","168,105,000","589,106,000","2,703,867,000"
45833,"Research and development expenses","Accrual of Clinical Trial Expenses",559382,12/31/24,03/27/25,2,"Ernst & Young LLP",,,,"San Diego",CA,CALIFORNIA,"US West",10-K,2025-03-28,Yes,"BioAtla, Inc.",1826892,"=""BCAB""","11085 TORREYANA ROAD",,"SAN DIEGO",CA,CALIFORNIA,"US West",,,"=""2836""","Biological Products, Except Diagnostic Substances",325414,"Biological Product (except Diagnostic) Manufacturing",34,1,12/31/24,"34,278,508",12/31/24,"11,000,000","-69,776,000",,"52,422,000"
39598,"Goodwill and intangible assets","Impairment Tests on Goodwill (Pro Farm Group, Inc., Rizobacter S.A. and Bioceres Crops S.A. Cash Generating Units) and Intangible Assets Not yet available for use or with indefinite useful lives.",541915,06/30/24,09/27/24,1,"PricewaterhouseCoopers LLP",88,"Price Waterhouse & Co SRL",1349,Rosario,C1,ARGENTINA,Foreign,6-K,2024-09-30,,"Bioceres Crop Solutions Corp.",1769484,"=""BIOX""","PO BOX 309, UGLAND HOUSE",,"GEORGE TOWN, GRAND CAYMAN",E9,"CAYMAN ISLANDS",Foreign,,,"=""2870""","Agricultural Chemicals",325320,"Pesticide and Other Agricultural Chemical Manufacturing",34,11,07/02/24,"690,764,544",06/30/24,"462,397,733","7,288,983","25,984,689","852,548,194"
39845,"Goodwill and intangible assets","Impairment Tests on Goodwill (Pro Farm Group, Inc., Rizobacter S.A. and Bioceres Crops S.A. Cash Generating Units) and Intangible Assets Not yet available for use or with indefinite useful lives.",543191,06/30/24,10/30/24,1,"PricewaterhouseCoopers LLP",88,"Price Waterhouse & Co SRL",1349,Rosario,C1,ARGENTINA,Foreign,20-F,2024-10-30,,"Bioceres Crop Solutions Corp.",1769484,"=""BIOX""","PO BOX 309, UGLAND HOUSE",,"GEORGE TOWN, GRAND CAYMAN",E9,"CAYMAN ISLANDS",Foreign,,,"=""2870""","Agricultural Chemicals",325320,"Pesticide and Other Agricultural Chemical Manufacturing",34,11,07/02/24,"690,764,544",06/30/24,"462,397,733","7,288,983","25,984,689","852,548,194"
42815,"Revenue from customer contracts","Royalty Financing Obligations",553263,12/31/24,02/25/25,2,"Ernst & Young LLP",,,,Raleigh,NC,"NORTH CAROLINA","US Southeast",10-K,2025-02-25,,"BIOCRYST PHARMACEUTICALS INC",882796,"=""BCRX""","4505 EMPEROR BOULEVARD","SUITE 200",DURHAM,NC,"NORTH CAROLINA","US Southeast",,,"=""2836""","Biological Products, Except Diagnostic Substances",325414,"Biological Product (except Diagnostic) Manufacturing",34,8,12/31/24,"1,568,246,784",12/31/24,"450,712,000","-88,881,000",,"490,420,000"
40903,"Sales return and allowances","Reserves for Medicaid and Managed Care Rebates in the U.S.",550836,12/31/24,02/12/25,1,"PricewaterhouseCoopers LLP",,,,Boston,MA,MASSACHUSETTS,"US New England",10-K,2025-02-12,,"BIOGEN INC.",875045,"=""BIIB""","225 BINNEY STREET",,CAMBRIDGE,MA,MASSACHUSETTS,"US New England",,,"=""2836""","Biological Products, Except Diagnostic Substances",325414,"Biological Product (except Diagnostic) Manufacturing",34,153,12/31/24,"22,283,401,216",12/31/24,"9,675,900,000","1,632,200,000","545,900,000","28,049,300,000"
40904,"Business combinations","Acquisition of Human Immunology Biosciences, Inc. (HI-Bio) - Valuation of In-Process Research and Development Intangible Assets",550836,12/31/24,02/12/25,1,"PricewaterhouseCoopers LLP",,,,Boston,MA,MASSACHUSETTS,"US New England",10-K,2025-02-12,,"BIOGEN INC.",875045,"=""BIIB""","225 BINNEY STREET",,CAMBRIDGE,MA,MASSACHUSETTS,"US New England",,,"=""2836""","Biological Products, Except Diagnostic Substances",325414,"Biological Product (except Diagnostic) Manufacturing",34,153,12/31/24,"22,283,401,216",12/31/24,"9,675,900,000","1,632,200,000","545,900,000","28,049,300,000"
44036,"Research and development expenses","Accrued and Prepaid Research and Development Expenses",554982,12/31/24,03/03/25,2,"Ernst & Young LLP",,,,Boston,MA,MASSACHUSETTS,"US New England",10-K,2025-03-03,,"Biohaven Ltd.",1935979,"=""BHVN""","215 CHURCH STREET",,"NEW HAVEN",CT,CONNECTICUT,"US New England",,,"=""2834""","Pharmaceutical Preparations",325412,"Pharmaceutical Preparation Manufacturing",34,37,12/31/24,"3,780,641,280",12/31/24,,"-846,422,000","403,646,000","615,107,000"
45984,"Other intangible assets","Intellectual Property Impairment Assessment",559720,12/31/24,03/31/25,1,"PricewaterhouseCoopers LLP",223,"Kesselman & Kesselman",1309,"Tel Aviv",L3,ISRAEL,Foreign,20-F,2025-03-31,Yes,"BioLineRx Ltd.",1498403,"=""BLRX""","2 HAMAAYAN STREET","MODI-IN TECHNOLOGY PARK",MODI-IN,L3,ISRAEL,Foreign,,,"=""2834""","Pharmaceutical Preparations",541710,"Research and Development in the Physical, Engineering, and Life Sciences",34,0,01/02/25,"18,515,480",12/31/24,"28,940,000","-9,221,000","3,012,000","38,906,000"
42668,"Revenue from customer contracts","Evaluation of variable consideration relating to ALDURAZYME product sales",552867,12/31/24,02/24/25,4,"KPMG LLP",,,,"San Francisco",CA,CALIFORNIA,"US West",10-K,2025-02-24,,"BIOMARIN PHARMACEUTICAL INC",1048477,"=""BMRN""","105 DIGITAL DRIVE",,NOVATO,CA,CALIFORNIA,"US West",,,"=""2834""","Pharmaceutical Preparations",325412,"Pharmaceutical Preparation Manufacturing",34,66,01/02/25,"12,671,864,832",12/31/24,"2,853,915,000","426,859,000","5,206,513,000","6,988,940,000"
45494,"Other intangible assets","Intangible asset initial valuation and impairment assessment",558738,12/31/24,03/25/25,1,"PricewaterhouseCoopers LLP",223,"Kesselman & Kesselman",1309,"Tel Aviv",L3,ISRAEL,Foreign,10-K,2025-03-25,Yes,"BiomX Inc.",1739174,"=""PHGE""","22 EINSTEIN ST.","FLOOR 4","NESS ZIONA",L3,ISRAEL,Foreign,,,"=""2836""","Biological Products, Except Diagnostic Substances",325414,"Biological Product (except Diagnostic) Manufacturing",34,1,01/02/25,"14,268,633",12/31/24,,"-16,808,000",,"43,233,000"
44575,"Revenue from customer contracts","Revenue recognition from collaboration partner’s COVID-19 vaccine sales",556849,12/31/24,03/10/25,2,"Ernst & Young LLP",892,"EY GmbH & Co KG Wirtschaftspruefungsgesellschaft",1251,Cologne,2M,GERMANY,Foreign,20-F,2025-03-10,,"BioNTech SE",1776985,"=""BNTX""","AN DER GOLDGRUBE 12",,MAINZ,2M,GERMANY,Foreign,,,"=""2836""","Biological Products, Except Diagnostic Substances",325414,"Biological Product (except Diagnostic) Manufacturing",33,114,12/31/24,"27,344,672,768",12/31/24,"2,848,800,000","-688,900,000","18,887,800,000","23,329,700,000"
44576,"Other contingent liabilities","Claims and legal contingencies",556849,12/31/24,03/10/25,2,"Ernst & Young LLP",892,"EY GmbH & Co KG Wirtschaftspruefungsgesellschaft",1251,Cologne,2M,GERMANY,Foreign,20-F,2025-03-10,,"BioNTech SE",1776985,"=""BNTX""","AN DER GOLDGRUBE 12",,MAINZ,2M,GERMANY,Foreign,,,"=""2836""","Biological Products, Except Diagnostic Substances",325414,"Biological Product (except Diagnostic) Manufacturing",33,114,12/31/24,"27,344,672,768",12/31/24,"2,848,800,000","-688,900,000","18,887,800,000","23,329,700,000"
45937,"Research and development expenses","Clinical trial expense and related accrued clinical trial expenses",559333,12/31/24,03/28/25,2,"Ernst & Young LLP",,,,Stamford,CT,CONNECTICUT,"US New England",10-K,2025-03-28,Yes,"BioXcel Therapeutics, Inc.",1720893,"=""BTAI""","555 LONG WHARF DRIVE",,"NEW HAVEN",CT,CONNECTICUT,"US New England",,,"=""2834""","Pharmaceutical Preparations",325412,"Pharmaceutical Preparation Manufacturing",34,0,01/02/25,"16,757,359",12/31/24,"2,266,000","-59,599,000",,"38,338,000"
40298,"Deferred income taxes","Tax receivable agreement liability",545606,09/30/24,12/18/24,2,"Ernst & Young LLP",892,"EY GmbH & Co KG Wirtschaftspruefungsgesellschaft",1251,Cologne,2M,GERMANY,Foreign,20-F,2024-12-18,,"Birkenstock Holding plc",1977102,"=""BIRK""","1-2 BERKELEY SQUARE",,LONDON,X0,"UNITED KINGDOM",Foreign,,,"=""3140""","Footwear, (No Rubber)",0,,34,49,09/30/24,"9,258,101,760",09/30/24,"2,014,140,000","213,839,000","-635,032,000","5,451,880,000"
38868,"Going concern","Assessment of the Company’s ability to continue as a going concern",538815,03/30/24,07/16/24,4,"KPMG LLP",187,"KPMG LLP Chartered Accountants",85,Montreal,A8,QUEBEC,Canada,20-F,2024-07-16,,"BIRKS GROUP INC.",1179821,"=""BGI""","2020 ROBERT BOURASSA","SUITE 200",MONTREAL,A8,QUEBEC,Canada,,,"=""5944""","Jewelry Stores",448310,"Jewelry Stores",34,3,04/01/24,"37,096,304",03/30/24,"185,275,000","-4,631,000","-13,036,000","203,268,000"
38869,Inventory,"Evaluation of the reserve for slow-moving finished goods inventories",538815,03/30/24,07/16/24,4,"KPMG LLP",187,"KPMG LLP Chartered Accountants",85,Montreal,A8,QUEBEC,Canada,20-F,2024-07-16,,"BIRKS GROUP INC.",1179821,"=""BGI""","2020 ROBERT BOURASSA","SUITE 200",MONTREAL,A8,QUEBEC,Canada,,,"=""5944""","Jewelry Stores",448310,"Jewelry Stores",34,3,04/01/24,"37,096,304",03/30/24,"185,275,000","-4,631,000","-13,036,000","203,268,000"
38880,"Going concern","Assessment of the Company’s ability to continue as a going concern",538892,03/30/24,07/16/24,4,"KPMG LLP",187,"KPMG LLP Chartered Accountants",85,Montreal,A8,QUEBEC,Canada,20-F/A,2024-07-18,,"BIRKS GROUP INC.",1179821,"=""BGI""","2020 ROBERT BOURASSA","SUITE 200",MONTREAL,A8,QUEBEC,Canada,,,"=""5944""","Jewelry Stores",448310,"Jewelry Stores",34,3,04/01/24,"37,096,304",03/30/24,"185,275,000","-4,631,000","-13,036,000","203,268,000"
38881,Inventory,"Evaluation of the reserve for slow-moving finished goods inventories",538892,03/30/24,07/16/24,4,"KPMG LLP",187,"KPMG LLP Chartered Accountants",85,Montreal,A8,QUEBEC,Canada,20-F/A,2024-07-18,,"BIRKS GROUP INC.",1179821,"=""BGI""","2020 ROBERT BOURASSA","SUITE 200",MONTREAL,A8,QUEBEC,Canada,,,"=""5944""","Jewelry Stores",448310,"Jewelry Stores",34,3,04/01/24,"37,096,304",03/30/24,"185,275,000","-4,631,000","-13,036,000","203,268,000"
45787,"Revenue from customer contracts","Revenues from sale of computational power used for hashing calculations",559306,12/31/24,03/26/25,1,"PricewaterhouseCoopers LLP",191,"PricewaterhouseCoopers LLP Chartered Accountants",271,Toronto,A6,ONTARIO,Canada,6-K,2025-03-27,,"Bitfarms Ltd",1812477,"=""BITF""","110 YONGE STREET","SUITE 1601",TORONTO,A6,ONTARIO,Canada,,,"=""6199""","Finance Services",518210,"Data Processing, Hosting, and Related Services",34,1,12/31/24,"714,206,016",12/31/24,"192,881,000","-54,063,000","603,956,000","667,616,000"
46313,"Revenue from customer contracts","Revenues from sale of computational power used for hashing calculations",560281,12/31/24,03/26/25,1,"PricewaterhouseCoopers LLP",191,"PricewaterhouseCoopers LLP Chartered Accountants",271,Toronto,A6,ONTARIO,Canada,40-F,2025-04-01,,"Bitfarms Ltd",1812477,"=""BITF""","110 YONGE STREET","SUITE 1601",TORONTO,A6,ONTARIO,Canada,,,"=""6199""","Finance Services",518210,"Data Processing, Hosting, and Related Services",34,1,12/31/24,"714,206,016",12/31/24,"192,881,000","-54,063,000","603,956,000","667,616,000"
36251,"Other contingent liabilities","Workers’ Compensation and General Liability Reserves",530393,02/03/24,03/18/24,1,"PricewaterhouseCoopers LLP",,,,Boston,MA,MASSACHUSETTS,"US New England",10-K,2024-03-18,,"BJ's Wholesale Club Holdings, Inc.",1531152,"=""BJ""","350 CAMPUS DRIVE",,MARLBOROUGH,MA,MASSACHUSETTS,"US New England",,,"=""5331""","Variety Stores",452910,"Warehouse Clubs and Supercenters",34,65,02/05/24,"8,712,446,976",02/03/24,"19,968,689,000","523,741,000","342,403,000","6,677,622,000"
42894,"Long-lived assets","Evaluation of long-lived assets for impairment",553440,12/31/24,02/26/25,4,"KPMG LLP",,,,"Los Angeles",CA,CALIFORNIA,"US West",10-K,2025-02-26,,"BJs RESTAURANTS INC",1013488,"=""BJRI""","7755 CENTER AVENUE","SUITE 300","HUNTINGTON BEACH",CA,CALIFORNIA,"US West",,,"=""5812""","Eating and Drinking Places",722110,"Full-Service Restaurants",34,36,01/02/25,"819,113,280",12/31/24,"1,357,302,000","16,687,000","365,344,000","1,041,064,000"
40946,"Regulatory assets and liabilities","Regulatory Accounting – Impact of Rate Regulation on the Financial Statements – Refer to Notes 1 and 2 to the Financial Statements",550852,12/31/24,02/12/25,3,"Deloitte & Touche LLP",,,,Minneapolis,MN,MINNESOTA,"US Midwest",10-K,2025-02-12,,"BLACK HILLS CORP /SD/",1130464,"=""BKH""","7001 MT RUSHMORE RD","PO BOX 1400","RAPID CITY",SD,"SOUTH DAKOTA","US Midwest",,,"=""4911""","Electric Services",221119,"Other Electric Power Generation",34,58,01/02/25,"4,159,120,640",12/31/24,"2,127,700,000","273,100,000","2,194,400,000","10,022,600,000"
42649,"Depreciation and amortization","Depreciation, Depletion and Amortization (“DD&A”) of Oil and Natural Gas Properties",553109,12/31/24,02/25/25,2,"Ernst & Young LLP",,,,Houston,TX,TEXAS,"US Southwest",10-K,2025-02-25,,"Black Stone Minerals, L.P.",1621434,"=""BSM""","1001 FANNIN STREET, SUITE 2020",,HOUSTON,TX,TEXAS,"US Southwest",,,"=""1311""","Crude Petroleum and Natural Gas",211111,"Crude Petroleum and Natural Gas Extraction",34,15,12/31/24,"3,076,145,920",12/31/24,"433,699,000","271,326,000",,"1,218,906,000"
42280,"Revenue from customer contracts","Revenue Recognition - Payment Processing Services",552412,12/31/24,02/21/25,2,"Ernst & Young LLP",,,,Raleigh,NC,"NORTH CAROLINA","US Southeast",10-K,2025-02-21,,"BLACKBAUD INC",1280058,"=""BLKB""","65 FAIRCHILD STREET",,CHARLESTON,SC,"SOUTH CAROLINA","US Southeast",,,"=""7372""","Prepackaged Software",511210,"Software Publishers",34,74,01/02/25,"3,738,907,136",12/31/24,"1,155,495,000","-283,172,000","-1,191,713,000","2,495,715,000"
37345,Goodwill,"Impairment Test of Goodwill for the BlackBerry Spark Reporting Unit",532618,02/29/24,04/04/24,1,"PricewaterhouseCoopers LLP",191,"PricewaterhouseCoopers LLP Chartered Accountants",271,Toronto,A6,ONTARIO,Canada,10-K,2024-04-04,,"BLACKBERRY Ltd",1070235,"=""BB""","2200 UNIVERSITY AVENUE EAST",*,WATERLOO,A6,ONTARIO,Canada,,,"=""7372""","Prepackaged Software",518210,"Data Processing, Hosting, and Related Services",34,3,02/27/24,"1,586,301,056",02/29/24,"759,100,000","-130,200,000","60,000,000","1,395,000,000"
42307,"Revenue from customer contracts","Revenue Recognition – Certain Subscription and Support Revenue",552456,12/31/24,02/21/25,1,"PricewaterhouseCoopers LLP",,,,"Los Angeles",CA,CALIFORNIA,"US West",10-K,2025-02-21,,"BLACKLINE, INC.",1666134,"=""BL""","21300 VICTORY BOULEVARD","12TH FLOOR","WOODLAND HILLS",CA,CALIFORNIA,"US West",,,"=""7372""","Prepackaged Software",511210,"Software Publishers",34,60,01/02/25,"3,769,751,552",12/31/24,"653,336,000","161,174,000","-70,781,000","1,825,036,000"
43300,"Other investments","Investment Valuation — Level 3 Investments — Refer to Note 2 to the financial statements",553968,12/31/24,02/27/25,3,"Deloitte & Touche LLP",,,,"Los Angeles",CA,CALIFORNIA,"US West",10-K,2025-02-27,,"BlackRock TCP Capital Corp.",1370755,"=""TCPC""","2951 28TH STREET","SUITE 1000","SANTA MONICA",CA,CALIFORNIA,"US West",,,,,525990,"Other Financial Vehicles",34,9,01/02/25,"759,193,344",12/31/24,"187,273,348","-63,137,172",,"1,923,031,363"
43301,"Business combinations","Accounting for the Merger with BlackRock Capital Investment Corporation (""BCIC"") – Refer to Note 12 to the Financial Statements",553968,12/31/24,02/27/25,3,"Deloitte & Touche LLP",,,,"Los Angeles",CA,CALIFORNIA,"US West",10-K,2025-02-27,,"BlackRock TCP Capital Corp.",1370755,"=""TCPC""","2951 28TH STREET","SUITE 1000","SANTA MONICA",CA,CALIFORNIA,"US West",,,,,525990,"Other Financial Vehicles",34,9,01/02/25,"759,193,344",12/31/24,"187,273,348","-63,137,172",,"1,923,031,363"
42928,"Business combinations","Acquisition of Global Infrastructure Management, LLC (“GIP”) – Fair Value of intangible assets related to management contracts and contingent consideration — Refer to Notes 2 and 3 to the financial statements",553301,12/31/24,02/25/25,3,"Deloitte & Touche LLP",,,,"New York",NY,"NEW YORK","US Mid Atlantic",10-K,2025-02-25,,"BlackRock, Inc.",2012383,"=""BLK""","50 HUDSON YARDS",,"NEW YORK",NY,"NEW YORK","US Mid Atlantic",,,"=""6211""","Security Brokers, Dealers, and Flotation Companies",0,,34,,,,12/31/24,"19,869,000,000","6,369,000,000","2,494,000,000","138,615,000,000"
42929,"Other intangible assets","Impairment of indefinite-lived intangible assets related to certain management contracts — Refer to Notes 2 and 12 to the financial statements",553301,12/31/24,02/25/25,3,"Deloitte & Touche LLP",,,,"New York",NY,"NEW YORK","US Mid Atlantic",10-K,2025-02-25,,"BlackRock, Inc.",2012383,"=""BLK""","50 HUDSON YARDS",,"NEW YORK",NY,"NEW YORK","US Mid Atlantic",,,"=""6211""","Security Brokers, Dealers, and Flotation Companies",0,,34,,,,12/31/24,"19,869,000,000","6,369,000,000","2,494,000,000","138,615,000,000"
45340,"Business combinations","Business Acquisition — Valuation of LeoStella and Related Intangible Assets — Refer to Note 7 to the financial statements",558125,12/31/24,03/19/25,3,"Deloitte & Touche LLP",,,,McLean,VA,VIRGINIA,"US Mid Atlantic",10-K,2025-03-20,,"BlackSky Technology Inc.",1753539,"=""BKSY""","2411 DULLES CORNER PARK","SUITE 300",HERNDON,VA,VIRGINIA,"US Mid Atlantic",,,"=""3663""","Radio and Television Broadcasting and Communications Equipment",517910,"Other Telecommunications",34,11,01/02/25,"329,026,816",12/31/24,"102,093,000","-57,023,000","78,283,000","254,342,000"
43752,"Other investments","Fair Value of Certain Underlying Investments to determine Performance Allocations and Accrued Performance Allocations — Refer to Notes 2 and 4 to the financial statements",554532,12/31/24,02/28/25,3,"Deloitte & Touche LLP",,,,"New York",NY,"NEW YORK","US Mid Atlantic",10-K,2025-02-28,,"Blackstone Inc.",1393818,"=""BX""","345 PARK AVENUE",,"NEW YORK",NY,"NEW YORK","US Mid Atlantic",,,"=""6282""","Investment Advice",523920,"Portfolio Management",34,174,01/02/25,"125,447,970,816",12/31/24,"12,786,280,000","2,776,508,000","6,958,275,000","43,469,875,000"
41069,"Allowance for credit losses","Current Expected Credit Loss (“CECL”) Reserve – Adjustments to Reflect Management’s Estimation of Economic Conditions – Refer to Note 2 in the Financial Statements",550838,12/31/24,02/12/25,3,"Deloitte & Touche LLP",,,,"New York",NY,"NEW YORK","US Mid Atlantic",10-K,2025-02-12,,"BLACKSTONE MORTGAGE TRUST, INC.",1061630,"=""BXMT""","345 PARK AVENUE","24TH FLOOR","NEW YORK",NY,"NEW YORK","US Mid Atlantic",,,"=""6798""","Real Estate Investment Trusts",525990,"Other Financial Vehicles",34,17,12/31/24,"3,008,310,272",12/31/24,"-67,686,000","-204,088,000",,"19,801,955,000"
41070,"Accounts/loans receivable","CECL Reserve – Estimation of Fair Value of Underlying Collateral of Impaired Loans – Refer to Note 2 and Note 3 in the Financial Statements",550838,12/31/24,02/12/25,3,"Deloitte & Touche LLP",,,,"New York",NY,"NEW YORK","US Mid Atlantic",10-K,2025-02-12,,"BLACKSTONE MORTGAGE TRUST, INC.",1061630,"=""BXMT""","345 PARK AVENUE","24TH FLOOR","NEW YORK",NY,"NEW YORK","US Mid Atlantic",,,"=""6798""","Real Estate Investment Trusts",525990,"Other Financial Vehicles",34,17,12/31/24,"3,008,310,272",12/31/24,"-67,686,000","-204,088,000",,"19,801,955,000"
41071,"Business combinations","Allocation of Purchase Price for Real Estate Owned – Refer to Notes 2 and 4 in the Financial Statements",550838,12/31/24,02/12/25,3,"Deloitte & Touche LLP",,,,"New York",NY,"NEW YORK","US Mid Atlantic",10-K,2025-02-12,,"BLACKSTONE MORTGAGE TRUST, INC.",1061630,"=""BXMT""","345 PARK AVENUE","24TH FLOOR","NEW YORK",NY,"NEW YORK","US Mid Atlantic",,,"=""6798""","Real Estate Investment Trusts",525990,"Other Financial Vehicles",34,17,12/31/24,"3,008,310,272",12/31/24,"-67,686,000","-204,088,000",,"19,801,955,000"
44946,"Other investments","Investments – Level 3 Fair Value Measurements – Refer to Footnote 2 and 5 in the financial statements",557543,12/31/24,03/14/25,3,"Deloitte & Touche LLP",,,,"New York",NY,"NEW YORK","US Mid Atlantic",10-K,2025-03-14,,"Blackstone Private Credit Fund",1803498,,"345 PARK AVENUE","31ST FLOOR","NEW YORK",NY,"NEW YORK","US Mid Atlantic",,,,,525990,"Other Financial Vehicles",34,,,,12/31/24,"6,694,692,000","3,708,479,000","38,855,763,000","71,283,570,000"
45321,"Other investments","Investments – Level 3 Fair Value Measurements – Refer to Footnote 2 and 5 in the financial statements",558311,12/31/24,03/14/25,3,"Deloitte & Touche LLP",,,,"New York",NY,"NEW YORK","US Mid Atlantic",424B3,2025-03-20,,"Blackstone Private Credit Fund",1803498,,"345 PARK AVENUE","31ST FLOOR","NEW YORK",NY,"NEW YORK","US Mid Atlantic",,,,,525990,"Other Financial Vehicles",34,,,,12/31/24,"6,694,692,000","3,708,479,000","38,855,763,000","71,283,570,000"
46914,"Other investments","Investments — Level 3 Fair Value Measurements — Refer to Footnote 2 and 5 in the financial statements",562385,12/31/24,03/14/25,3,"Deloitte & Touche LLP",,,,"New York",NY,"NEW YORK","US Mid Atlantic",486BPOS,2025-04-23,,"Blackstone Private Credit Fund",1803498,,"345 PARK AVENUE","31ST FLOOR","NEW YORK",NY,"NEW YORK","US Mid Atlantic",,,,,525990,"Other Financial Vehicles",34,,,,12/31/24,"6,694,692,000","3,708,479,000","38,855,763,000","71,283,570,000"
44470,"Real estate investments","Impairments of Investments in Real Estate – Hold Period — Refer to Notes 2 and 3 to the financial statements",556240,12/31/24,03/07/25,3,"Deloitte & Touche LLP",,,,"New York",NY,"NEW YORK","US Mid Atlantic",10-K,2025-03-07,,"Blackstone Real Estate Income Trust, Inc.",1662972,"=""BSTT""","345 PARK AVENUE",,"NEW YORK",NY,"NEW YORK","US Mid Atlantic",,,"=""6798""","Real Estate Investment Trusts",525990,"Other Financial Vehicles",34,0,12/31/24,"281,460,000",12/31/24,"8,531,034,000","-890,549,000",,"116,238,241,000"
45114,"Real estate investments","Impairments of Investments in Real Estate – Hold Period — Refer to Notes 2 and 3 to the financial statements",557979,12/31/24,03/07/25,3,"Deloitte & Touche LLP",,,,"New York",NY,"NEW YORK","US Mid Atlantic",424B3,2025-03-17,,"Blackstone Real Estate Income Trust, Inc.",1662972,"=""BSTT""","345 PARK AVENUE",,"NEW YORK",NY,"NEW YORK","US Mid Atlantic",,,"=""6798""","Real Estate Investment Trusts",525990,"Other Financial Vehicles",34,0,12/31/24,"281,460,000",12/31/24,"8,531,034,000","-890,549,000",,"116,238,241,000"
43039,"Other investments","Investments - Level 3 Fair Value Measurements — Refer to Footnote 2 and 5 in the financial statements",553624,12/31/24,02/26/25,3,"Deloitte & Touche LLP",,,,"New York",NY,"NEW YORK","US Mid Atlantic",10-K,2025-02-26,,"Blackstone Secured Lending Fund",1736035,"=""BXSL""","345 PARK AVENUE","31ST FLOOR","NEW YORK",NY,"NEW YORK","US Mid Atlantic",,,,,525990,"Other Financial Vehicles",34,32,12/31/24,"7,169,336,320",12/31/24,"1,000,768,000","694,097,000",,"13,472,224,000"
42590,"Other investments","Bitcoin Investment and Bitcoin Held for Other Parties",552989,12/31/24,02/24/25,2,"Ernst & Young LLP",,,,"San Francisco",CA,CALIFORNIA,"US West",10-K,2025-02-24,,"Block, Inc.",1512673,"=""XYZ""","1955 BROADWAY","SUITE 600",OAKLAND,CA,CALIFORNIA,"US West",,,"=""7372""","Prepackaged Software",511210,"Software Publishers",34,,,,12/31/24,"24,121,053,000","2,897,047,000","8,417,443,000","36,777,595,000"
43271,"Revenue from customer contracts","Product Revenue Recognition – Refer to Notes 2 and 3 to the financial statements",553937,12/31/24,02/27/25,3,"Deloitte & Touche LLP",,,,"San Jose",CA,CALIFORNIA,"US West",10-K,2025-02-27,,"Bloom Energy Corp",1664703,"=""BE""","4353 NORTH FIRST STREET",,"SAN JOSE",CA,CALIFORNIA,"US West",,,"=""3620""","Electrical Industrial Apparatus",335311,"Power, Distribution, and Specialty Transformer Manufacturing",34,22,12/31/24,"5,089,254,400",12/31/24,"1,473,856,000","-29,227,000",,"2,657,354,000"
43019,"Insurance contract liabilities","Valuation of Insurance Reserves",553599,12/29/24,02/26/25,1,"PricewaterhouseCoopers LLP",,,,Tampa,FL,FLORIDA,"US Southeast",10-K,2025-02-26,,"Bloomin' Brands, Inc.",1546417,"=""BLMN""","2202 NORTH WEST SHORE BOULEVARD","SUITE 500",TAMPA,FL,FLORIDA,"US Southeast",,,"=""5812""","Eating and Drinking Places",722110,"Full-Service Restaurants",34,12,12/31/24,"1,036,076,736",12/29/24,"3,950,475,000","-128,018,000","-506,904,000","3,384,805,000"
41782,"Other investments","Assessment of Fair Value of Investments",551922,12/31/24,02/19/25,4,"KPMG LLP",,,,"New York",NY,"NEW YORK","US Mid Atlantic",10-K,2025-02-19,,"Blue Owl Capital Corp",1655888,"=""OBDC""","399 PARK AVENUE",,"NEW YORK",NY,"NEW YORK","US Mid Atlantic",,,,,525990,"Other Financial Vehicles",34,15,12/31/24,"5,900,085,760",12/31/24,"1,131,843,000","594,980,000",,"13,865,564,000"
44360,"Other investments","Assessment of Fair Value of Investments",555731,12/31/24,03/05/25,4,"KPMG LLP",,,,"New York",NY,"NEW YORK","US Mid Atlantic",10-K,2025-03-06,,"Blue Owl Capital Corp II",1655887,,"399 PARK AVENUE",,"NEW YORK",NY,"NEW YORK","US Mid Atlantic",,,,,525990,"Other Financial Vehicles",34,,,,12/31/24,"256,887,000","108,469,000","1,123,549,000","2,003,841,000"
42302,"Business combinations","Recoverability of finite-lived intangible assets",552458,12/31/24,02/21/25,4,"KPMG LLP",,,,"New York",NY,"NEW YORK","US Mid Atlantic",10-K,2025-02-21,,"BLUE OWL CAPITAL INC.",1823945,"=""OWL""","399 PARK AVENUE, 37TH FLOOR",,"NEW YORK",NY,"NEW YORK","US Mid Atlantic",,,"=""6282""","Investment Advice",523930,"Investment Advice",34,23,12/31/24,"14,150,132,736",12/31/24,"2,295,427,000","109,584,000","-5,474,459,000","10,992,470,000"
42303,"Business combinations","Evaluation of the fair value of certain acquired intangible assets",552458,12/31/24,02/21/25,4,"KPMG LLP",,,,"New York",NY,"NEW YORK","US Mid Atlantic",10-K,2025-02-21,,"BLUE OWL CAPITAL INC.",1823945,"=""OWL""","399 PARK AVENUE, 37TH FLOOR",,"NEW YORK",NY,"NEW YORK","US Mid Atlantic",,,"=""6282""","Investment Advice",523930,"Investment Advice",34,23,12/31/24,"14,150,132,736",12/31/24,"2,295,427,000","109,584,000","-5,474,459,000","10,992,470,000"
44288,"Other investments","Assessment of Fair Value of Investments",555177,12/31/24,03/04/25,4,"KPMG LLP",,,,"New York",NY,"NEW YORK","US Mid Atlantic",10-K,2025-03-04,,"Blue Owl Credit Income Corp.",1812554,,"399 PARK AVENUE",,"NEW YORK",NY,"NEW YORK","US Mid Atlantic",,,,,525990,"Other Financial Vehicles",34,,,,12/31/24,"2,565,001,000","1,354,877,000","14,521,602,000","28,063,881,000"
44318,"Other investments","Assessment of Fair Value of Investments",555706,12/31/24,03/04/25,4,"KPMG LLP",,,,"New York",NY,"NEW YORK","US Mid Atlantic",424B3,2025-03-05,,"Blue Owl Credit Income Corp.",1812554,,"399 PARK AVENUE",,"NEW YORK",NY,"NEW YORK","US Mid Atlantic",,,,,525990,"Other Financial Vehicles",34,,,,12/31/24,"2,565,001,000","1,354,877,000","14,521,602,000","28,063,881,000"
44980,"Other investments","Assessment of Fair Value of Investments",557648,12/31/24,03/04/25,4,"KPMG LLP",,,,"New York",NY,"NEW YORK","US Mid Atlantic",N-2/A,2025-03-14,,"Blue Owl Credit Income Corp.",1812554,,"399 PARK AVENUE",,"NEW YORK",NY,"NEW YORK","US Mid Atlantic",,,,,525990,"Other Financial Vehicles",34,,,,12/31/24,"2,565,001,000","1,354,877,000","14,521,602,000","28,063,881,000"
46722,"Other investments","Assessment of Fair Value of Investments",561621,12/31/24,03/04/25,4,"KPMG LLP",,,,"New York",NY,"NEW YORK","US Mid Atlantic",N-2,2025-04-15,,"Blue Owl Credit Income Corp.",1812554,,"399 PARK AVENUE",,"NEW YORK",NY,"NEW YORK","US Mid Atlantic",,,,,525990,"Other Financial Vehicles",34,,,,12/31/24,"2,565,001,000","1,354,877,000","14,521,602,000","28,063,881,000"
48256,"Other investments","Assessment of Fair Value of Investments",570654,12/31/24,03/04/25,4,"KPMG LLP",,,,"New York",NY,"NEW YORK","US Mid Atlantic",N-2/A,2025-08-21,,"Blue Owl Credit Income Corp.",1812554,,"399 PARK AVENUE",,"NEW YORK",NY,"NEW YORK","US Mid Atlantic",,,,,525990,"Other Financial Vehicles",34,,,,12/31/24,"2,565,001,000","1,354,877,000","14,521,602,000","28,063,881,000"
44331,"Other investments","Assessment of Fair Value of Investments",555750,12/31/24,03/06/25,4,"KPMG LLP",,,,"New York",NY,"NEW YORK","US Mid Atlantic",10-K,2025-03-06,,"Blue Owl Technology Finance Corp.",1747777,"=""OTF""","399 PARK AVENUE",,"NEW YORK",NY,"NEW YORK","US Mid Atlantic",,,,,525990,"Other Financial Vehicles",34,,12/31/24,,12/31/24,"684,034,000","374,142,000","3,625,150,000","6,722,621,000"
45676,Leases,"Embedded Leases in Contract Manufacturing Agreements",559102,12/31/24,03/27/25,2,"Ernst & Young LLP",,,,Boston,MA,MASSACHUSETTS,"US New England",10-K,2025-03-27,Yes,"bluebird bio, Inc.",1293971,,"455 GRAND UNION BOULEVARD",,SOMERVILLE,MA,MASSACHUSETTS,"US New England",,,"=""2836""","Biological Products, Except Diagnostic Substances",325414,"Biological Product (except Diagnostic) Manufacturing",34,8,12/31/24,"81,131,520",12/31/24,"83,807,000","-240,715,000","-46,727,000","460,232,000"
41713,Goodwill,"Valuation of Goodwill",551660,12/28/24,02/18/25,2,"Ernst & Young LLP",,,,Atlanta,GA,GEORGIA,"US Southeast",10-K,2025-02-18,,"BlueLinx Holdings Inc.",1301787,"=""BXC""","1950 SPECTRUM CIRCLE","SUITE 300",MARIETTA,GA,GEORGIA,"US Southeast",,,"=""5031""","Lumber, Plywood, Millwork, and Wood Panels",444190,"Other Building Material Dealers",34,102,12/31/24,"847,396,544",12/28/24,"2,952,532,000","53,116,000","564,188,000","1,577,717,000"
41082,"Research and development expenses","Accrued Clinical Trial Expenses",551101,12/31/24,02/13/25,2,"Ernst & Young LLP",,,,Boston,MA,MASSACHUSETTS,"US New England",10-K,2025-02-13,,"Blueprint Medicines Corp",1597264,,"45 SIDNEY STREET",,CAMBRIDGE,MA,MASSACHUSETTS,"US New England",,,"=""2834""","Pharmaceutical Preparations",325412,"Pharmaceutical Preparation Manufacturing",34,87,12/31/24,"5,556,982,784",12/31/24,"508,824,000","-67,089,000",,"1,179,813,000"
40865,Goodwill,"Goodwill — Refer to Notes 2 and 9 to the financial statements",550632,12/31/24,02/11/25,3,"Deloitte & Touche LLP",,,,Houston,TX,TEXAS,"US Southwest",10-K,2025-02-11,,"Boardwalk Pipeline Partners, LP",1336047,,"9 GREENWAY PLAZA, SUITE 2800",,HOUSTON,TX,TEXAS,"US Southwest",,,"=""4922""","Natural Gas Transmission",486210,"Pipeline Transportation of Natural Gas",34,,,,12/31/24,"2,028,100,000","510,900,000","5,668,600,000","9,779,400,000"
40669,"Revenue from customer contracts","Cost Estimates for Fixed-Price Development Contracts — Refer to Notes 1 and 14 to the financial statements",548098,12/31/24,02/03/25,3,"Deloitte & Touche LLP",,,,Chicago,IL,ILLINOIS,"US Midwest",10-K,2025-02-03,,"BOEING CO",12927,"=""BA""","100 N RIVERSIDE PLZ",,CHICAGO,IL,ILLINOIS,"US Midwest",,,"=""3721""",Aircraft,336411,"Aircraft Manufacturing",34,172,01/02/25,"106,250,190,848",12/31/24,"66,517,000,000","-11,817,000,000","-13,949,000,000","156,363,000,000"
40670,"Revenue from customer contracts","Program Accounting Estimates for the 777X Program — Refer to Notes 1 and 8 to the financial statements",548098,12/31/24,02/03/25,3,"Deloitte & Touche LLP",,,,Chicago,IL,ILLINOIS,"US Midwest",10-K,2025-02-03,,"BOEING CO",12927,"=""BA""","100 N RIVERSIDE PLZ",,CHICAGO,IL,ILLINOIS,"US Midwest",,,"=""3721""",Aircraft,336411,"Aircraft Manufacturing",34,172,01/02/25,"106,250,190,848",12/31/24,"66,517,000,000","-11,817,000,000","-13,949,000,000","156,363,000,000"
40671,"Revenue from customer contracts","Program Accounting Estimates for the 737 Program — Refer to Notes 1 and 8 to the financial statements",548098,12/31/24,02/03/25,3,"Deloitte & Touche LLP",,,,Chicago,IL,ILLINOIS,"US Midwest",10-K,2025-02-03,,"BOEING CO",12927,"=""BA""","100 N RIVERSIDE PLZ",,CHICAGO,IL,ILLINOIS,"US Midwest",,,"=""3721""",Aircraft,336411,"Aircraft Manufacturing",34,172,01/02/25,"106,250,190,848",12/31/24,"66,517,000,000","-11,817,000,000","-13,949,000,000","156,363,000,000"
42104,"Sales return and allowances","Customer rebates payable for engineered wood products",552238,12/31/24,02/20/25,4,"KPMG LLP",,,,Boise,ID,IDAHO,"US West",10-K,2025-02-20,,"BOISE CASCADE Co",1328581,"=""BCC""","1111 WEST JEFFERSON STREET, SUITE 300","P. O. BOX 50",BOISE,ID,IDAHO,"US West",,,"=""5030""","Wholesale-Lumber & Other Construction Materials",321999,"All Other Miscellaneous Wood Product Manufacturing",34,119,12/31/24,"4,538,431,488",12/31/24,"6,724,294,000","376,354,000","1,806,302,000","3,369,383,000"
41850,"Allowance for credit losses","Allowance for credit losses",551990,12/31/24,02/19/25,2,"Ernst & Young LLP",,,,Tulsa,OK,OKLAHOMA,"US Southwest",10-K,2025-02-19,,"BOK FINANCIAL CORP",875357,"=""BOKF""","BANK OF OKLAHOMA TOWER","BOSTON AVENUE AT SECOND STREET",TULSA,OK,OKLAHOMA,"US Southwest",,,"=""6021""","National Commercial Banks",522110,"Commercial Banking",34,107,01/02/25,"6,846,564,352",12/31/24,"2,032,399,000","523,569,000","4,456,816,000","49,685,892,000"
41925,"Other revenue","Revenues - Refer to Notes 2 and 3 to the financial statements",552095,12/31/24,02/20/25,3,"Deloitte & Touche LLP",,,,Stamford,CT,CONNECTICUT,"US New England",10-K,2025-02-20,,"Booking Holdings Inc.",1075531,"=""BKNG""","800 CONNECTICUT AVE",,NORWALK,CT,CONNECTICUT,"US New England",,,"=""4700""","Transportation Services",561510,"Travel Agencies",34,"4,968",12/31/24,"163,693,871,104",12/31/24,"23,739,000,000","5,882,000,000","-8,201,000,000","27,708,000,000"
38298,Inventory,"Inventories – Refer to Note 2 to the financial statements",536203,03/30/24,05/14/24,3,"Deloitte & Touche LLP",,,,"Costa Mesa",CA,CALIFORNIA,"US West",10-K,2024-05-15,,"Boot Barn Holdings, Inc.",1610250,"=""BOOT""","17100 LAGUNA CANYON ROAD",,IRVINE,CA,CALIFORNIA,"US West",,,"=""5661""","Shoe Stores",448210,"Shoe Stores",34,95,03/31/24,"2,887,231,488",03/30/24,"1,667,009,000","146,996,000","687,444,000","1,705,592,000"
38423,"Revenue from customer contracts","Revenue recognition based on certain contracts using a cost input measure of progress",536534,03/31/24,05/24/24,2,"Ernst & Young LLP",,,,Tysons,VA,VIRGINIA,"US Mid Atlantic",10-K,2024-05-24,,"Booz Allen Hamilton Holding Corp",1443646,"=""BAH""","8283 GREENSBORO DRIVE",,MCLEAN,VA,VIRGINIA,"US Mid Atlantic",,,"=""8742""","Management Consulting Services",541611,"Administrative Management and General Management Consulting Services",34,148,03/31/24,"19,244,224,512",03/31/24,"10,662,000,000","606,000,000","-1,898,270,000","6,563,688,000"
38424,"Other contingent liabilities","Government Contracting Matters - Provision for Claimed Indirect Costs",536534,03/31/24,05/24/24,2,"Ernst & Young LLP",,,,Tysons,VA,VIRGINIA,"US Mid Atlantic",10-K,2024-05-24,,"Booz Allen Hamilton Holding Corp",1443646,"=""BAH""","8283 GREENSBORO DRIVE",,MCLEAN,VA,VIRGINIA,"US Mid Atlantic",,,"=""8742""","Management Consulting Services",541611,"Administrative Management and General Management Consulting Services",34,148,03/31/24,"19,244,224,512",03/31/24,"10,662,000,000","606,000,000","-1,898,270,000","6,563,688,000"
38425,"Uncertain tax positions","Certain unrecognized tax benefits that, if recognized, would affect the effective income tax rate",536534,03/31/24,05/24/24,2,"Ernst & Young LLP",,,,Tysons,VA,VIRGINIA,"US Mid Atlantic",10-K,2024-05-24,,"Booz Allen Hamilton Holding Corp",1443646,"=""BAH""","8283 GREENSBORO DRIVE",,MCLEAN,VA,VIRGINIA,"US Mid Atlantic",,,"=""8742""","Management Consulting Services",541611,"Administrative Management and General Management Consulting Services",34,148,03/31/24,"19,244,224,512",03/31/24,"10,662,000,000","606,000,000","-1,898,270,000","6,563,688,000"
40735,"Other income taxes","Worldwide Provision for Income Taxes",550324,12/31/24,02/06/25,1,"PricewaterhouseCoopers LLP",,,,Detroit,MI,MICHIGAN,"US Midwest",10-K,2025-02-06,,"BORGWARNER INC",908255,"=""BWA""","3850 HAMLIN RD.",,"AUBURN HILLS",MI,MICHIGAN,"US Midwest",,,"=""3714""","Motor Vehicle Parts and Accessories",336399,"All Other Motor Vehicle Parts Manufacturing",34,32,12/31/24,"6,951,515,136",12/31/24,"14,086,000,000","338,000,000","2,701,000,000","13,993,000,000"
45492,"Property, plant and equipment","Jack-up drilling rigs impairment assessment",558733,12/31/24,03/25/25,1,"PricewaterhouseCoopers LLP",121,"PricewaterhouseCoopers LLP",876,Watford,X0,"UNITED KINGDOM",Foreign,20-F,2025-03-25,,"Borr Drilling Ltd",1715497,"=""BORR""","S.E. PEARMAN BUILDING","2ND FLOOR 9 PAR-LA-VILLE ROAD",HAMILTON,D0,BERMUDA,Foreign,,,"=""1381""","Drilling Oil and Gas Wells",213111,"Drilling Oil and Gas Wells",34,4,12/31/24,"955,214,592",12/31/24,"1,010,600,000","82,100,000",,"3,419,600,000"
42809,"Other intangible assets","Dogfish Head Trademark Intangible — Refer to Notes B, H, and N to the financial statements",553258,12/28/24,02/25/25,3,"Deloitte & Touche LLP",,,,Boston,MA,MASSACHUSETTS,"US New England",10-K,2025-02-25,,"BOSTON BEER CO INC",949870,"=""SAM""","ONE DESIGN CENTER PLACE","SUITE 850",BOSTON,MA,MASSACHUSETTS,"US New England",,,"=""2082""","Malt Beverages",312120,Breweries,34,300,12/31/24,"2,778,774,016",12/28/24,"2,012,926,000","59,695,000","787,212,000","1,250,018,000"
45846,"Real estate investments","Evaluation of the fair value of the real estate assets in the 24th Street Funds",559427,12/31/24,03/28/25,4,"KPMG LLP",,,,Omaha,NE,NEBRASKA,"US Midwest",10-K,2025-03-28,,"BOSTON OMAHA Corp",1494582,"=""BOC""","1601 DODGE STREET","SUITE 3300",OMAHA,NE,NEBRASKA,"US Midwest",,,"=""6510""","Real Estate Operators (No Developers) & Lessors",531210,"Offices of Real Estate Agents and Brokers",34,14,12/31/24,"437,198,144",12/31/24,"108,274,901","-1,292,450","218,026,417","654,265,398"
43152,"Long-lived assets","Impairment Assessment of Long-Lived Assets and Investments in Unconsolidated Joint Ventures",553837,12/31/24,02/27/25,1,"PricewaterhouseCoopers LLP",,,,Boston,MA,MASSACHUSETTS,"US New England",10-K,2025-02-27,,"BOSTON PROPERTIES LTD PARTNERSHIP",1043121,,"800 BOYLSTON STREET","SUITE 1900",BOSTON,MA,MASSACHUSETTS,"US New England",1037540,"BXP, Inc.","=""6798""","Real Estate Investment Trusts",525990,"Other Financial Vehicles",34,,,,12/31/24,"3,407,719,000","23,480,000",,"25,848,890,000"
43153,"Business combinations","Purchase Price Allocation for Long-Lived Asset Property Acquisitions",553837,12/31/24,02/27/25,1,"PricewaterhouseCoopers LLP",,,,Boston,MA,MASSACHUSETTS,"US New England",10-K,2025-02-27,,"BOSTON PROPERTIES LTD PARTNERSHIP",1043121,,"800 BOYLSTON STREET","SUITE 1900",BOSTON,MA,MASSACHUSETTS,"US New England",1037540,"BXP, Inc.","=""6798""","Real Estate Investment Trusts",525990,"Other Financial Vehicles",34,,,,12/31/24,"3,407,719,000","23,480,000",,"25,848,890,000"
41617,"Business combinations","Valuation of intangible assets acquired in business combinations",551711,12/31/24,02/18/25,2,"Ernst & Young LLP",,,,Boston,MA,MASSACHUSETTS,"US New England",10-K,2025-02-18,,"BOSTON SCIENTIFIC CORP",885725,"=""BSX""","300 BOSTON SCIENTIFIC WAY",,MARLBOROUGH,MA,MASSACHUSETTS,"US New England",,,"=""3841""","Surgical and Medical Instruments and Apparatus",339112,"Surgical and Medical Instrument Manufacturing",34,89,01/02/25,"131,730,702,336",12/31/24,"16,747,000,000","1,856,000,000","-2,001,000,000","39,396,000,000"
35748,"Revenue from customer contracts","Revenue recognition – evaluation of contract terms and conditions",529578,01/31/24,03/11/24,2,"Ernst & Young LLP",,,,"San Francisco",CA,CALIFORNIA,"US West",10-K,2024-03-11,,"BOX INC",1372612,"=""BOX""","900 JEFFERSON AVE",,"REDWOOD CITY",CA,CALIFORNIA,"US West",,,"=""7372""","Prepackaged Software",511210,"Software Publishers",34,26,01/31/24,"3,750,292,480",01/31/24,"1,037,741,000","129,032,000","-15,717,000","1,241,163,000"
42386,"Goodwill and intangible assets","Goodwill and Gaming License Rights Indefinite-Lived Intangible Assets — Refer to Notes 1, 4 and 5 to the financial statements",552710,12/31/24,02/21/25,3,"Deloitte & Touche LLP",,,,"Las Vegas",NV,NEVADA,"US West",10-K,2025-02-21,,"BOYD GAMING CORP",906553,"=""BYD""","6465 SOUTH RAINBOW BOULEVARD",,"LAS VEGAS",NV,NEVADA,"US West",,,"=""7011""","Hotels and Motels",721120,"Casino Hotels",34,72,01/02/25,"6,348,990,464",12/31/24,"3,930,194,000","577,952,000","-767,383,000","6,391,815,000"
44426,"Property, plant and equipment","1.Impairment of upstream oil and gas property, plant and equipment (PP&E) assets – Notes 1, 4 and 12 to the financial statements",555900,12/31/24,03/06/25,3,"Deloitte & Touche LLP",293,"Deloitte LLP",1147,London,X0,"UNITED KINGDOM",Foreign,20-F,2025-03-06,,"BP PLC",313807,"=""BP""","1 ST JAMES'S SQUARE",,LONDON,X0,"UNITED KINGDOM",Foreign,,,"=""2911""","Petroleum Refining",324110,"Petroleum Refineries",34,30,01/02/25,"89,295,159,296",12/31/24,"189,185,000,000","1,229,000,000","34,712,000,000","282,228,000,000"
44427,"Asset retirement and environmental obligations","2.Decommissioning provisions – Notes 1 and 23 to the financial statements",555900,12/31/24,03/06/25,3,"Deloitte & Touche LLP",293,"Deloitte LLP",1147,London,X0,"UNITED KINGDOM",Foreign,20-F,2025-03-06,,"BP PLC",313807,"=""BP""","1 ST JAMES'S SQUARE",,LONDON,X0,"UNITED KINGDOM",Foreign,,,"=""2911""","Petroleum Refining",324110,"Petroleum Refineries",34,30,01/02/25,"89,295,159,296",12/31/24,"189,185,000,000","1,229,000,000","34,712,000,000","282,228,000,000"
44428,"Derivatives and hedging","3.Valuation of commodity financial derivatives - Notes 1, 29 and 30 to the financial statements",555900,12/31/24,03/06/25,3,"Deloitte & Touche LLP",293,"Deloitte LLP",1147,London,X0,"UNITED KINGDOM",Foreign,20-F,2025-03-06,,"BP PLC",313807,"=""BP""","1 ST JAMES'S SQUARE",,LONDON,X0,"UNITED KINGDOM",Foreign,,,"=""2911""","Petroleum Refining",324110,"Petroleum Refineries",34,30,01/02/25,"89,295,159,296",12/31/24,"189,185,000,000","1,229,000,000","34,712,000,000","282,228,000,000"
44429,"Long-lived assets","4.Impairment of E&A assets and refinery PP&E as a consequence, among other things, of climate change and the energy transition – Notes 1, 4, 8 and 15 to the financial statements",555900,12/31/24,03/06/25,3,"Deloitte & Touche LLP",293,"Deloitte LLP",1147,London,X0,"UNITED KINGDOM",Foreign,20-F,2025-03-06,,"BP PLC",313807,"=""BP""","1 ST JAMES'S SQUARE",,LONDON,X0,"UNITED KINGDOM",Foreign,,,"=""2911""","Petroleum Refining",324110,"Petroleum Refineries",34,30,01/02/25,"89,295,159,296",12/31/24,"189,185,000,000","1,229,000,000","34,712,000,000","282,228,000,000"
39417,"Deferred income taxes","Taxes — Valuation Allowances — Refer to Notes 1 and 11 to the financial statements",540892,07/31/24,09/06/24,3,"Deloitte & Touche LLP",,,,Milwaukee,WI,WISCONSIN,"US Midwest",10-K,2024-09-06,,"BRADY CORP",746598,"=""BRC""","6555 W GOOD HOPE RD","P O BOX 571",MILWAUKEE,WI,WISCONSIN,"US Midwest",,,"=""3990""","Miscellaneous Manufacturing Industries",322222,"Coated and Laminated Paper Manufacturing",34,72,07/31/24,"3,153,880,576",07/31/24,"1,341,393,000","197,215,000","425,208,000","1,515,569,000"
45966,"Deferred and stock-based compensation","Stock-Based Compensation to Employees and Directors – Refer to Note 8 to the financial statements",559683,12/31/24,03/31/25,3,"Deloitte & Touche LLP",257,"Brightman Almagor Zohar & Co",1197,"Tel Aviv",L3,ISRAEL,Foreign,10-K,2025-03-31,Yes,"BRAINSTORM CELL THERAPEUTICS INC.",1137883,"=""BCLI""","1325 AVENUE OF AMERICAS","28TH FLOOR","NEW YORK",NY,"NEW YORK","US Mid Atlantic",,,"=""2836""","Biological Products, Except Diagnostic Substances",325413,"In-Vitro Diagnostic Substance Manufacturing",34,2,01/02/25,"12,205,332",12/31/24,,"-11,623,000",,"1,832,000"
46865,Inventory,"Inventory Valuation",562203,12/31/24,04/21/25,2,"Ernst & Young LLP",222,"Kost Forer Gabbay & Kasierer",1281,"Tel Aviv",L3,ISRAEL,Foreign,20-F,2025-04-22,,"Brainsway Ltd.",1505065,"=""BWAY""","16 HARTUM STREET RAD TOWER, 14TH FLOOR","Har HaHotzvim",Jerusalem,L3,ISRAEL,Foreign,,,"=""3841""","Surgical and Medical Instruments and Apparatus",334510,"Electromedical and Electrotherapeutic Apparatus Manufacturing",34,10,01/02/25,"159,230,096",12/31/24,"41,016,000","2,921,000",,"94,316,000"
37098,"Other contingent liabilities","Estimate of Workers' Compensation Self-Insurance Reserves",531777,02/03/24,03/29/24,2,"Ernst & Young LLP",,,,Nashville,TN,TENNESSEE,"US Southeast",10-K,2024-03-29,,"BRAND HOUSE COLLECTIVE, INC.",1056285,"=""KIRK""","5310 MARYLAND WAY",,BRENTWOOD,TN,TENNESSEE,"US Southeast",,,"=""5990""","Retail-Retail Stores, NEC",442299,"All Other Home Furnishings Stores",34,3,02/05/24,"38,900,268",02/03/24,"468,690,000","-27,751,000",,"250,573,000"
43212,"Long-lived assets","Impairment Assessments of Real Estate Investments and Investments in Unconsolidated Real Estate Ventures",553854,12/31/24,02/26/25,1,"PricewaterhouseCoopers LLP",,,,Philadelphia,PA,PENNSYLVANIA,"US Mid Atlantic",10-K,2025-02-27,,"BRANDYWINE OPERATING PARTNERSHIP, L.P.",1060386,,"C/O BRANDYWINE REALTY TRUST","2929 ARCH STREET, SUITE 1800",PHILADELPHIA,PA,PENNSYLVANIA,"US Mid Atlantic",790816,"BRANDYWINE REALTY TRUST","=""6798""","Real Estate Investment Trusts",525990,"Other Financial Vehicles",34,,,,12/31/24,"505,517,000","-196,492,000","1,036,267,000","3,492,213,000"
43594,"Real estate investments","Impairment Assessments of Real Estate Investments and Investments in Unconsolidated Real Estate Ventures",554293,12/31/24,02/26/25,1,"PricewaterhouseCoopers LLP",,,,Philadelphia,PA,PENNSYLVANIA,"US Mid Atlantic",10-K,2025-02-27,,"BRANDYWINE REALTY TRUST",790816,"=""BDN""","2929 ARCH STREET","SUITE 1800",PHILADELPHIA,PA,PENNSYLVANIA,"US Mid Atlantic",,,"=""6798""","Real Estate Investment Trusts",525990,"Other Financial Vehicles",34,6,01/02/25,"972,109,824",12/31/24,"505,517,000","-195,907,000","1,033,130,000","3,492,213,000"
46201,"Asset retirement and environmental obligations","Evaluation of the provision and disclosures related to the geological event in the state of Alagoas",559669,12/31/24,03/28/25,4,"KPMG LLP",61,"KPMG Auditores Independentes",1124,"São Paulo",D5,BRAZIL,Foreign,20-F,2025-03-31,,"BRASKEM SA",1071438,"=""BAK""","RUA ETENO, 1561","POLO PETROQUIMICO DE CAMACARI",CAMACARI,D5,BRAZIL,Foreign,,,"=""2860""","Industrial Organic Chemicals",325110,"Petrochemical Manufacturing",34,4,01/02/25,"1,806,674,560",12/31/24,"12,530,000,000","-1,951,000,000","-1,322,000,000","16,442,000,000"
46202,Goodwill,"Goodwill impairment assessment",559669,12/31/24,03/28/25,4,"KPMG LLP",61,"KPMG Auditores Independentes",1124,"São Paulo",D5,BRAZIL,Foreign,20-F,2025-03-31,,"BRASKEM SA",1071438,"=""BAK""","RUA ETENO, 1561","POLO PETROQUIMICO DE CAMACARI",CAMACARI,D5,BRAZIL,Foreign,,,"=""2860""","Industrial Organic Chemicals",325110,"Petrochemical Manufacturing",34,4,01/02/25,"1,806,674,560",12/31/24,"12,530,000,000","-1,951,000,000","-1,322,000,000","16,442,000,000"
46203,"Deferred income taxes","Recoverability of certain deferred tax assets",559669,12/31/24,03/28/25,4,"KPMG LLP",61,"KPMG Auditores Independentes",1124,"São Paulo",D5,BRAZIL,Foreign,20-F,2025-03-31,,"BRASKEM SA",1071438,"=""BAK""","RUA ETENO, 1561","POLO PETROQUIMICO DE CAMACARI",CAMACARI,D5,BRAZIL,Foreign,,,"=""2860""","Industrial Organic Chemicals",325110,"Petrochemical Manufacturing",34,4,01/02/25,"1,806,674,560",12/31/24,"12,530,000,000","-1,951,000,000","-1,322,000,000","16,442,000,000"
46204,"Going concern","Going concern assessment",559669,12/31/24,03/28/25,4,"KPMG LLP",61,"KPMG Auditores Independentes",1124,"São Paulo",D5,BRAZIL,Foreign,20-F,2025-03-31,,"BRASKEM SA",1071438,"=""BAK""","RUA ETENO, 1561","POLO PETROQUIMICO DE CAMACARI",CAMACARI,D5,BRAZIL,Foreign,,,"=""2860""","Industrial Organic Chemicals",325110,"Petrochemical Manufacturing",34,4,01/02/25,"1,806,674,560",12/31/24,"12,530,000,000","-1,951,000,000","-1,322,000,000","16,442,000,000"
37118,"Revenue from customer contracts","Revenue Recognition",532111,01/31/24,04/01/24,2,"Ernst & Young LLP",,,,"New York",NY,"NEW YORK","US Mid Atlantic",10-K,2024-04-01,,"Braze, Inc.",1676238,"=""BRZE""","63 MADISON BUILDING","28 E. 28TH ST., FLOOR 12 MAILROOM","NEW YORK",NY,"NEW YORK","US Mid Atlantic",,,"=""7372""","Prepackaged Software",511210,"Software Publishers",34,56,02/02/24,"3,853,661,696",01/31/24,"471,800,000","-129,166,000","412,287,000","810,941,000"
46797,"Other contingent liabilities","Litigation Contingencies",561807,12/31/24,04/17/25,1,"PricewaterhouseCoopers LLP",91,"PricewaterhouseCoopers Auditores Independentes",1351,"Rio de Janeiro",D5,BRAZIL,Foreign,20-F,2025-04-17,,"BRAZILIAN ELECTRIC POWER CO",1439124,"=""AXIA""","RUA DA QUITANDA, 196, 24TH FLOOR",CENTRO,"RIO DE JANEIRO",D5,BRAZIL,Foreign,,,"=""4911""","Electric Services",221111,"Hydroelectric Power Generation",34,6,01/02/25,"11,328,674,816",12/31/24,"6,504,132,000","1,680,318,000","7,072,033,000","46,921,070,000"
46798,"Long-lived assets","Assessment of Impairment for Property, Plant and Equipment, Intangible assets and Equity method investments",561807,12/31/24,04/17/25,1,"PricewaterhouseCoopers LLP",91,"PricewaterhouseCoopers Auditores Independentes",1351,"Rio de Janeiro",D5,BRAZIL,Foreign,20-F,2025-04-17,,"BRAZILIAN ELECTRIC POWER CO",1439124,"=""AXIA""","RUA DA QUITANDA, 196, 24TH FLOOR",CENTRO,"RIO DE JANEIRO",D5,BRAZIL,Foreign,,,"=""4911""","Electric Services",221111,"Hydroelectric Power Generation",34,6,01/02/25,"11,328,674,816",12/31/24,"6,504,132,000","1,680,318,000","7,072,033,000","46,921,070,000"
46799,"Revenue from customer contracts","Contractual transmission assets - Measurement",561807,12/31/24,04/17/25,1,"PricewaterhouseCoopers LLP",91,"PricewaterhouseCoopers Auditores Independentes",1351,"Rio de Janeiro",D5,BRAZIL,Foreign,20-F,2025-04-17,,"BRAZILIAN ELECTRIC POWER CO",1439124,"=""AXIA""","RUA DA QUITANDA, 196, 24TH FLOOR",CENTRO,"RIO DE JANEIRO",D5,BRAZIL,Foreign,,,"=""4911""","Electric Services",221111,"Hydroelectric Power Generation",34,6,01/02/25,"11,328,674,816",12/31/24,"6,504,132,000","1,680,318,000","7,072,033,000","46,921,070,000"
41543,"Allowance for credit losses","Allowance for Credit Losses for credit card loans — Refer to Notes 1 and 3 to the financial statements",551346,12/31/24,02/14/25,3,"Deloitte & Touche LLP",,,,Columbus,OH,OHIO,"US Midwest",10-K,2025-02-14,,"BREAD FINANCIAL HOLDINGS, INC.",1101215,"=""BFH""","3095 LOYALTY CIRCLE",,COLUMBUS,OH,OHIO,"US Midwest",,,"=""6141""","Personal Credit Institutions",518210,"Data Processing, Hosting, and Related Services",34,60,01/02/25,"3,006,269,696",12/31/24,"3,838,000,000","277,000,000","2,305,000,000","22,891,000,000"
42126,"Research and development expenses","Accrued research and development liabilities, Prepaid expenses and other current assets, Other assets, and Research and development expenses from Contract Research Organizations (CROs) and Contract Manufacturing Organizations (CMOs) — Refer to Note 2 to the financial statements",552272,12/31/24,02/20/25,3,"Deloitte & Touche LLP",,,,"San Francisco",CA,CALIFORNIA,"US West",10-K,2025-02-20,,"BridgeBio Pharma, Inc.",1743881,"=""BBIO""","3160 PORTER DR.","SUITE 250","PALO ALTO",CA,CALIFORNIA,"US West",,,"=""2834""","Pharmaceutical Preparations",325414,"Biological Product (except Diagnostic) Manufacturing",34,27,12/31/24,"5,214,820,352",12/31/24,"221,902,000","-535,762,000","-1,491,688,000","919,338,000"
43261,"Revenue from customer contracts","Revenue - Refer to Notes 2 and 3 to the financial statements",553941,12/31/24,02/27/25,3,"Deloitte & Touche LLP",,,,Boston,MA,MASSACHUSETTS,"US New England",10-K,2025-02-27,,"BRIGHT HORIZONS FAMILY SOLUTIONS INC.",1437578,"=""BFAM""","2 WELLS AVENUE",,NEWTON,MA,MASSACHUSETTS,"US New England",,,"=""8351""","Child Day Care Services",624410,"Child Day Care Services",34,111,01/02/25,"6,432,155,648",12/31/24,"2,686,013,000","140,191,000","-681,862,000","3,850,319,000"
40255,"Goodwill and intangible assets","Goodwill and indefinite lived intangible assets - Overseas Schools reporting unit - Refer to Notes 2, 6 and 8 to the financial statements",545436,08/31/24,12/13/24,3,"Deloitte & Touche LLP",499,"Deloitte Touche Tohmatsu Certified Public Accountants LLP",1113,Shenzhen,F4,CHINA,Foreign,20-F,2024-12-13,,"Bright Scholar Education Holdings Ltd",1696355,"=""BEDU""","NO.1, COUNTRY GARDEN ROAD","BEIJIAO TOWN, SHUNDE DISTRICT","FOSHAN, GUANGDONG",F4,CHINA,Foreign,,,"=""8200""","Services-Educational Services",611110,"Elementary and Secondary Schools",34,2,08/29/24,"54,993,476",08/31/24,"247,624,000","-140,555,000","-8,476,000","429,651,000"
43895,"Insurance contract liabilities","Certain Assumptions Used in the Valuation of Liability for Future Policy Benefits – Refer to Notes 1 and 3 to the financial statements",554719,12/31/24,02/28/25,3,"Deloitte & Touche LLP",,,,Charlotte,NC,"NORTH CAROLINA","US Southeast",10-K,2025-02-28,,"Brighthouse Financial, Inc.",1685040,"=""BHF""","11225 N COMMUNITY HOUSE ROAD",,CHARLOTTE,NC,"NORTH CAROLINA","US Southeast",,,"=""6311""","Life Insurance",524113,"Direct Life Insurance Carriers",34,48,01/02/25,"2,848,410,624",12/31/24,"4,724,000,000","388,000,000",,"238,537,000,000"
43896,"Other investments","Certain Assumptions Used in the Valuation of Market Risk Benefits – Refer to Notes 1, 4, and 10 to the financial statements",554719,12/31/24,02/28/25,3,"Deloitte & Touche LLP",,,,Charlotte,NC,"NORTH CAROLINA","US Southeast",10-K,2025-02-28,,"Brighthouse Financial, Inc.",1685040,"=""BHF""","11225 N COMMUNITY HOUSE ROAD",,CHARLOTTE,NC,"NORTH CAROLINA","US Southeast",,,"=""6311""","Life Insurance",524113,"Direct Life Insurance Carriers",34,48,01/02/25,"2,848,410,624",12/31/24,"4,724,000,000","388,000,000",,"238,537,000,000"
44225,"Insurance contract liabilities","Certain Assumptions Used in the Valuation of Liability for Future Policy Benefits – Refer to Notes 1 and 3 to the financial statements",555306,12/31/24,03/03/25,3,"Deloitte & Touche LLP",,,,Charlotte,NC,"NORTH CAROLINA","US Southeast",10-K,2025-03-04,,"BRIGHTHOUSE LIFE INSURANCE Co",733076,,"11225 NORTH COMMUNITY HOUSE ROAD",,CHARLOTTE,NC,"NORTH CAROLINA","US Southeast",1099219,"METLIFE INC","=""6311""","Life Insurance",524113,"Direct Life Insurance Carriers",34,,,,12/31/24,"3,973,000,000","256,000,000",,"228,591,000,000"
44226,"Insurance contract liabilities","Certain Assumptions Used in the Valuation of Market Risk Benefits – Refer to Notes 1, 4, and 10 to the financial statements",555306,12/31/24,03/03/25,3,"Deloitte & Touche LLP",,,,Charlotte,NC,"NORTH CAROLINA","US Southeast",10-K,2025-03-04,,"BRIGHTHOUSE LIFE INSURANCE Co",733076,,"11225 NORTH COMMUNITY HOUSE ROAD",,CHARLOTTE,NC,"NORTH CAROLINA","US Southeast",1099219,"METLIFE INC","=""6311""","Life Insurance",524113,"Direct Life Insurance Carriers",34,,,,12/31/24,"3,973,000,000","256,000,000",,"228,591,000,000"
45856,"Insurance contract liabilities","Certain Assumptions Used in the Valuation of Liability for Future Policy Benefits — Refer to Notes 1 and 3 to the financial statements",559442,12/31/24,03/03/25,3,"Deloitte & Touche LLP",,,,Charlotte,NC,"NORTH CAROLINA","US Southeast",N-VPFS,2025-03-28,,"Brighthouse Life Insurance Co (RILA MVA)",2041679,,"11225 NORTH COMMUNITY HOUSE ROAD",,CHARLOTTE,NC,"NORTH CAROLINA","US Southeast",,,,,525990,"Other Financial Vehicles",33,,,,,,,,
45857,"Other contingent liabilities","Certain Assumptions Used in the Valuation of Market Risk Benefits — Refer to Notes 1, 4, and 10 to the financial statements",559442,12/31/24,03/03/25,3,"Deloitte & Touche LLP",,,,Charlotte,NC,"NORTH CAROLINA","US Southeast",N-VPFS,2025-03-28,,"Brighthouse Life Insurance Co (RILA MVA)",2041679,,"11225 NORTH COMMUNITY HOUSE ROAD",,CHARLOTTE,NC,"NORTH CAROLINA","US Southeast",,,,,525990,"Other Financial Vehicles",33,,,,,,,,
41820,"Allowance for credit losses","Current Expected Credit Loss (“CECL”) reserve",551956,12/31/24,02/19/25,2,"Ernst & Young LLP",,,,"New York",NY,"NEW YORK","US Mid Atlantic",10-K,2025-02-19,,"BrightSpire Capital, Inc.",1717547,"=""BRSP""","590 MADISON AVENUE","33RD FLOOR","NEW YORK",NY,"NEW YORK","US Mid Atlantic",,,"=""6798""","Real Estate Investment Trusts",525990,"Other Financial Vehicles",34,6,12/31/24,"731,424,448",12/31/24,"114,032,000","-266,436,000",,"3,723,478,000"
41821,"Real estate investments","Impairment of Real Estate Held for Investment",551956,12/31/24,02/19/25,2,"Ernst & Young LLP",,,,"New York",NY,"NEW YORK","US Mid Atlantic",10-K,2025-02-19,,"BrightSpire Capital, Inc.",1717547,"=""BRSP""","590 MADISON AVENUE","33RD FLOOR","NEW YORK",NY,"NEW YORK","US Mid Atlantic",,,"=""6798""","Real Estate Investment Trusts",525990,"Other Financial Vehicles",34,6,12/31/24,"731,424,448",12/31/24,"114,032,000","-266,436,000",,"3,723,478,000"
44399,"Other contingent liabilities","Valuation of self-insurance liabilities",556035,12/31/24,03/06/25,4,"KPMG LLP",,,,Louisville,KY,KENTUCKY,"US Mid Atlantic",10-K,2025-03-06,,"BrightSpring Health Services, Inc.",1865782,"=""BTSG""","805 N. WHITTINGTON PARKWAY",,LOUISVILLE,KY,KENTUCKY,"US Mid Atlantic",,,"=""8082""","Home Health Care Services",621610,"Home Health Care Services",34,17,12/31/24,"2,967,409,152",12/31/24,"11,266,472,000","-18,062,000","-1,831,421,000","5,926,140,000"
47677,"Other contingent liabilities","Valuation of self-insurance liabilities",566799,12/31/24,03/06/25,4,"KPMG LLP",,,,Louisville,KY,KENTUCKY,"US Mid Atlantic",8-K,2025-06-10,,"BrightSpring Health Services, Inc.",1865782,"=""BTSG""","805 N. WHITTINGTON PARKWAY",,LOUISVILLE,KY,KENTUCKY,"US Mid Atlantic",,,"=""8082""","Home Health Care Services",621610,"Home Health Care Services",34,17,12/31/24,"2,967,409,152",12/31/24,"11,266,472,000","-18,062,000","-1,831,421,000","5,926,140,000"
42850,"Revenue from customer contracts","Revenue Recognition – Identifying and Evaluating Contractual Terms and Conditions",553277,12/31/24,02/25/25,1,"PricewaterhouseCoopers LLP",,,,Boston,MA,MASSACHUSETTS,"US New England",20-F,2025-02-25,,"Brightstar Lottery PLC",1619762,"=""BRSL""","10 FINSBURY SQUARE","THIRD FLOOR",LONDON,X0,"UNITED KINGDOM",Foreign,,,"=""7990""","Services-Miscellaneous Amusement & Recreation",713290,"Other Gambling Industries",34,17,01/02/25,"3,492,400,896",12/31/24,"2,512,000,000","349,000,000","-1,089,000,000","10,277,000,000"
39964,Goodwill,"Goodwill – Maintenance Reporting Unit – Refer to Notes 2 and 7 to the financial statements",543971,09/30/24,11/13/24,3,"Deloitte & Touche LLP",,,,Philadelphia,PA,PENNSYLVANIA,"US Mid Atlantic",10-K,2024-11-13,,"BrightView Holdings, Inc.",1734713,"=""BV""","980 JOLLY ROAD","SUITE 300","BLUE BELL",PA,PENNSYLVANIA,"US Mid Atlantic",,,"=""0700""","Agricultural services",561730,"Landscaping Services",34,16,09/30/24,"1,492,152,064",09/30/24,"2,767,100,000","66,400,000","-329,100,000","3,391,800,000"
39213,"Revenue from customer contracts","Assessment of gift card breakage revenue",540236,06/26/24,08/21/24,4,"KPMG LLP",,,,Dallas,TX,TEXAS,"US Southwest",10-K,2024-08-21,,"BRINKER INTERNATIONAL, INC",703351,"=""EAT""","3000 OLYMPUS BLVD.",,DALLAS,TX,TEXAS,"US Southwest",,,"=""5812""","Eating and Drinking Places",722110,"Full-Service Restaurants",34,72,06/28/24,"3,220,668,416",06/26/24,"4,415,100,000","155,300,000","-175,300,000","2,593,100,000"
43029,"Revenue from customer contracts","Sufficiency of Audit Evidence over Revenue",553609,12/31/24,02/26/25,4,"KPMG LLP",,,,Richmond,VA,VIRGINIA,"US Mid Atlantic",10-K,2025-02-26,,"BRINKS CO",78890,"=""BCO""","1801 BAYBERRY COURT","P O BOX 18100",RICHMOND,VA,VIRGINIA,"US Mid Atlantic",,,"=""4731""","Arrangement of Transportation of  Freight and Cargo",561613,"Armored Car Services",34,93,12/31/24,"3,979,833,088",12/31/24,"5,011,900,000","162,900,000","-1,672,300,000","6,623,100,000"
40930,"Sales return and allowances","Gross-to-Net U.S. Rebate Accruals for U.S. Medicaid, Medicare Part D, and managed healthcare — Refer to “Note 2. Revenue” to the financial statements",550865,12/31/24,02/12/25,3,"Deloitte & Touche LLP",,,,Morristown,NJ,"NEW JERSEY","US Mid Atlantic",10-K,2025-02-12,,"BRISTOL MYERS SQUIBB CO",14272,"=""BMY""","ROUTE 206 AND PROVINCE LINE ROAD",,PRINCETON,NJ,"NEW JERSEY","US Mid Atlantic",,,"=""2834""","Pharmaceutical Preparations",325412,"Pharmaceutical Preparation Manufacturing",34,57,01/02/25,"115,180,150,784",12/31/24,"48,300,000,000","-8,948,000,000","-28,691,000,000","92,603,000,000"
40931,"Uncertain tax positions","Taxes — Unrecognized Tax Benefit Liabilities for U.S. Transfer Pricing — Refer to “Note 7. Income Taxes” to the financial statements",550865,12/31/24,02/12/25,3,"Deloitte & Touche LLP",,,,Morristown,NJ,"NEW JERSEY","US Mid Atlantic",10-K,2025-02-12,,"BRISTOL MYERS SQUIBB CO",14272,"=""BMY""","ROUTE 206 AND PROVINCE LINE ROAD",,PRINCETON,NJ,"NEW JERSEY","US Mid Atlantic",,,"=""2834""","Pharmaceutical Preparations",325412,"Pharmaceutical Preparation Manufacturing",34,57,01/02/25,"115,180,150,784",12/31/24,"48,300,000,000","-8,948,000,000","-28,691,000,000","92,603,000,000"
43500,"Deferred income taxes","Realizability of certain deferred tax assets",553978,12/31/24,02/27/25,4,"KPMG LLP",,,,Houston,TX,TEXAS,"US Southwest",10-K,2025-02-27,,"Bristow Group Inc.",1525221,"=""VTOL""","3151 BRIARPARK DRIVE, SUITE 700",,HOUSTON,TX,TEXAS,"US Southwest",,,"=""4522""","Air Transportation, Nonscheduled",481111,"Scheduled Passenger Air Transportation",34,35,01/02/25,"1,010,568,384",12/31/24,"1,415,491,000","272,212,000",,"2,125,246,000"
41432,"Goodwill and intangible assets","Impairment analysis of goodwill and trademarks and similar intangibles arising from the 2017 acquisition of Reynolds American Inc. (Reynolds American)",551361,12/31/24,02/12/25,4,"KPMG LLP",87,"KPMG LLP",1118,London,X0,"UNITED KINGDOM",Foreign,20-F,2025-02-14,,"British American Tobacco p.l.c.",1303523,"=""BTI""","GLOBE HOUSE","4 TEMPLE PLACE",LONDON,X0,"UNITED KINGDOM",Foreign,,,"=""2111""",Cigarettes,312221,"Cigarette Manufacturing",34,37,01/02/25,"89,773,932,544",12/31/24,"32,396,000,000","3,984,000,000","-55,899,000,000","148,910,000,000"
41433,"Other contingent liabilities","Canadian legal proceedings",551361,12/31/24,02/12/25,4,"KPMG LLP",87,"KPMG LLP",1118,London,X0,"UNITED KINGDOM",Foreign,20-F,2025-02-14,,"British American Tobacco p.l.c.",1303523,"=""BTI""","GLOBE HOUSE","4 TEMPLE PLACE",LONDON,X0,"UNITED KINGDOM",Foreign,,,"=""2111""",Cigarettes,312221,"Cigarette Manufacturing",34,37,01/02/25,"89,773,932,544",12/31/24,"32,396,000,000","3,984,000,000","-55,899,000,000","148,910,000,000"
40832,"Real estate investments","Impairment of Real Estate Assets — Refer to Notes 1 and 5 to the financial statements",550677,12/31/24,02/10/25,3,"Deloitte & Touche LLP",,,,Philadelphia,PA,PENNSYLVANIA,"US Mid Atlantic",10-K,2025-02-10,,"Brixmor Operating Partnership LP",1630031,,"100 PARK AVENUE",,"NEW YORK",NY,"NEW YORK","US Mid Atlantic",1581068,"Brixmor Property Group Inc.","=""6798""","Real Estate Investment Trusts",531120,"Lessors of Nonresidential Buildings (except Miniwarehouses)",34,,,,12/31/24,"1,285,054,000","339,274,000",,"8,908,254,000"
40830,"Real estate investments","Impairment of Real Estate Assets — Refer to Notes 1 and 5 to the financial statements",550673,12/31/24,02/10/25,3,"Deloitte & Touche LLP",,,,Philadelphia,PA,PENNSYLVANIA,"US Mid Atlantic",10-K,2025-02-10,,"Brixmor Property Group Inc.",1581068,"=""BRX""","100 PARK AVENUE",,"NEW YORK",NY,"NEW YORK","US Mid Atlantic",,,"=""6798""","Real Estate Investment Trusts",525990,"Other Financial Vehicles",34,28,12/31/24,"8,504,897,536",12/31/24,"1,285,054,000","339,274,000",,"8,908,914,000"
40353,"Business combinations","Acquisition of VMware — Valuation of VMware Cloud Foundation (“VCF”) Developed Technology, Certain Customer Contracts and Related Relationships, VCF In-process Research and Development, and VMware Trade Name Intangible Assets",545691,11/03/24,12/20/24,1,"PricewaterhouseCoopers LLP",,,,"San Jose",CA,CALIFORNIA,"US West",10-K,2024-12-20,,"Broadcom Inc.",1730168,"=""AVGO""","3421 HILLVIEW AVENUE",,"PALO ALTO",CA,CALIFORNIA,"US West",,,"=""3674""","Semiconductors and Related Devices",334413,"Semiconductor and Related Device Manufacturing",34,174,11/05/24,"812,213,207,040",11/03/24,"51,574,000,000","5,895,000,000","-70,778,000,000","165,645,000,000"
39050,Goodwill,"Goodwill - Refer to Notes 2 and 10 to the financial statements",539681,06/30/24,08/06/24,3,"Deloitte & Touche LLP",,,,"New York",NY,"NEW YORK","US Mid Atlantic",10-K,2024-08-06,,"BROADRIDGE FINANCIAL SOLUTIONS, INC.",1383312,"=""BR""","5 DAKOTA DRIVE",,"LAKE SUCCESS",NY,"NEW YORK","US Mid Atlantic",,,"=""7389""","Business Services, NEC",522320,"Financial Transactions Processing, Reserve, and Clearinghouse Activities",34,197,06/30/24,"22,989,899,776",06/30/24,"6,506,800,000","698,000,000","-2,608,500,000","8,242,400,000"
41969,"Long-lived assets","Evaluation of long-lived asset impairment —Refer to Note 2 to the consolidated financial statements",552135,12/31/24,02/20/25,3,"Deloitte & Touche LLP",,,,Rochester,NY,"NEW YORK","US Mid Atlantic",10-K,2025-02-20,,"Broadstone Net Lease, Inc.",1424182,"=""BNL""","207 HIGH POINT DRIVE",,VICTOR,NY,"NEW YORK","US Mid Atlantic",,,"=""6798""","Real Estate Investment Trusts",525990,"Other Financial Vehicles",34,16,12/31/24,"2,991,608,320",12/31/24,"431,800,000","162,441,000","2,396,338,000","5,216,417,000"
41760,Leases,"Evaluation of operating lease right-of-use assets for impairment",551897,12/31/24,02/19/25,2,"Ernst & Young LLP",,,,Chicago,IL,ILLINOIS,"US Midwest",10-K,2025-02-19,,"Brookdale Senior Living Inc.",1332349,"=""BKD""","105 WESTWOOD PLACE","SUITE 400",BRENTWOOD,TN,TENNESSEE,"US Southeast",,,"=""8050""","Services-Nursing & Personal Care Facilities",623312,"Homes for the Elderly",34,5,12/31/24,"1,006,099,712",12/31/24,"3,125,487,000","-201,935,000","185,154,000","6,335,562,000"
45066,"Equity investments and joint ventures","Accounting for Equity Method Investment in Brookfield Asset Management ULC – Refer to Notes 2 and 3 to the financial statements",557782,12/31/24,03/17/25,3,"Deloitte & Touche LLP",468,"Deloitte LLP",1208,Toronto,A6,ONTARIO,Canada,10-K,2025-03-17,,"Brookfield Asset Management Ltd.",1937926,"=""BAM""","BROOKFIELD PLACE","250 VESEY STREET, 15TH FLOOR","NEW YORK",NY,"NEW YORK","US Mid Atlantic",,,"=""6282""","Investment Advice",541611,"Administrative Management and General Management Consulting Services",34,54,01/02/25,"22,443,845,632",12/31/24,"466,000,000","541,000,000",,"4,386,000,000"
46311,Goodwill,"Goodwill – Refer to Notes 2(m) and 14 to the financial statements",560284,12/31/24,03/31/25,3,"Deloitte & Touche LLP",468,"Deloitte LLP",1208,Toronto,A6,ONTARIO,Canada,20-F,2025-04-01,,"Brookfield Business Corp",1871130,"=""BBUC""","250 VESEY STREET","15TH FLOOR","NEW YORK",NY,"NEW YORK","US Mid Atlantic",,,"=""1700""","Construction - Special Trade Contractors",561439,"Other Business Service Centers (including Copy Shops)",34,24,01/02/25,"1,782,277,248",12/31/24,"8,208,000,000","-1,927,000,000","-11,013,000,000","19,098,000,000"
46312,Goodwill,"Goodwill Impairment&#8201;—&#8201;Refer to Notes 2(m) and 14 to the financial statements",560284,12/31/24,03/31/25,3,"Deloitte & Touche LLP",468,"Deloitte LLP",1208,Toronto,A6,ONTARIO,Canada,20-F,2025-04-01,,"Brookfield Business Corp",1871130,"=""BBUC""","250 VESEY STREET","15TH FLOOR","NEW YORK",NY,"NEW YORK","US Mid Atlantic",,,"=""1700""","Construction - Special Trade Contractors",561439,"Other Business Service Centers (including Copy Shops)",34,24,01/02/25,"1,782,277,248",12/31/24,"8,208,000,000","-1,927,000,000","-11,013,000,000","19,098,000,000"
46527,Goodwill,"Goodwill – Refer to Notes 2(n) and 14 to the financial statements",561075,12/31/24,04/09/25,3,"Deloitte & Touche LLP",468,"Deloitte LLP",1208,Toronto,A6,ONTARIO,Canada,20-F,2025-04-10,,"Brookfield Business Partners L.P.",1654795,"=""BBU""","73 FRONT STREET, 5TH FLOOR",,HAMILTON,D0,BERMUDA,Foreign,,,"=""1700""","Construction - Special Trade Contractors",325998,"All Other Miscellaneous Chemical Product and Preparation Manufacturing",34,23,12/31/24,,12/31/24,"40,620,000,000",,,"75,474,000,000"
46528,Goodwill,"Goodwill Impairment – Refer to Notes 2(n) and 14 to the financial statements",561075,12/31/24,04/09/25,3,"Deloitte & Touche LLP",468,"Deloitte LLP",1208,Toronto,A6,ONTARIO,Canada,20-F,2025-04-10,,"Brookfield Business Partners L.P.",1654795,"=""BBU""","73 FRONT STREET, 5TH FLOOR",,HAMILTON,D0,BERMUDA,Foreign,,,"=""1700""","Construction - Special Trade Contractors",325998,"All Other Miscellaneous Chemical Product and Preparation Manufacturing",34,23,12/31/24,,12/31/24,"40,620,000,000",,,"75,474,000,000"
46529,"Other income taxes","U.S. legislation for domestic energy production and manufacturing – Refer to Note 2(ae)(ii), 6 and 22 to the financial statements",561075,12/31/24,04/09/25,3,"Deloitte & Touche LLP",468,"Deloitte LLP",1208,Toronto,A6,ONTARIO,Canada,20-F,2025-04-10,,"Brookfield Business Partners L.P.",1654795,"=""BBU""","73 FRONT STREET, 5TH FLOOR",,HAMILTON,D0,BERMUDA,Foreign,,,"=""1700""","Construction - Special Trade Contractors",325998,"All Other Miscellaneous Chemical Product and Preparation Manufacturing",34,23,12/31/24,,12/31/24,"40,620,000,000",,,"75,474,000,000"
45399,"Property, plant and equipment","Fair Value of Investment Properties and Property, Plant and Equipment – Refer to Notes 2(h)(i), 2(h)(ii), 11, and 12 to the financial statements",558499,12/31/24,03/21/25,3,"Deloitte & Touche LLP",468,"Deloitte LLP",1208,Toronto,A6,ONTARIO,Canada,40-F,2025-03-24,,"BROOKFIELD Corp /ON/",1001085,"=""BN""","BROOKFIELD PLACE, 181 BAY ST, STE 100","PO BOX 762",TORONTO,A6,ONTARIO,Canada,,,"=""6512""","Operators of Nonresidential Buildings",531120,"Lessors of Nonresidential Buildings (except Miniwarehouses)",34,58,01/02/25,"94,422,458,368",12/31/24,"69,391,000,000","1,853,000,000","-25,825,000,000","490,424,000,000"
45445,"Property, plant and equipment","Fair Value of Investment Properties and Property, Plant and Equipment – Refer to Notes 2(h)(i), 2(h)(ii), 11, and 12 to the financial statements",558636,12/31/24,03/21/25,3,"Deloitte & Touche LLP",468,"Deloitte LLP",1208,Toronto,A6,ONTARIO,Canada,6-K,2025-03-24,,"BROOKFIELD Corp /ON/",1001085,"=""BN""","BROOKFIELD PLACE, 181 BAY ST, STE 100","PO BOX 762",TORONTO,A6,ONTARIO,Canada,,,"=""6512""","Operators of Nonresidential Buildings",531120,"Lessors of Nonresidential Buildings (except Miniwarehouses)",34,58,01/02/25,"94,422,458,368",12/31/24,"69,391,000,000","1,853,000,000","-25,825,000,000","490,424,000,000"
45405,"Property, plant and equipment","Revaluation of Property, Plant and Equipment - Refer to Notes 3 and 9 to the financial statements",558521,12/31/24,03/21/25,3,"Deloitte & Touche LLP",468,"Deloitte LLP",1208,Toronto,A6,ONTARIO,Canada,20-F,2025-03-24,,"Brookfield Infrastructure Corp",1788348,"=""BIPC""","250 VESEY STREET, 15TH FLOOR",,"NEW YORK",NY,"NEW YORK","US Mid Atlantic",,,"=""4923""","Natural Gas Transmission and Distribution",486210,"Pipeline Transportation of Natural Gas",34,40,01/02/25,"5,247,189,504",12/31/24,"3,666,000,000","72,000,000","-5,754,000,000","23,587,000,000"
45473,"Property, plant and equipment","Fair Value of Investment Properties and Revaluation of Property, Plant and Equipment - Refer to Notes 3, 14 and 17 to the financial statements",558497,12/31/24,03/21/25,3,"Deloitte & Touche LLP",468,"Deloitte LLP",1208,Toronto,A6,ONTARIO,Canada,20-F,2025-03-24,,"Brookfield Infrastructure Partners L.P.",1406234,"=""BIP""","73 FRONT STREET",,HAMILTON,D0,BERMUDA,Foreign,,,"=""4400""","Water Transportation",221121,"Electric Bulk Power Transmission and Control",34,32,01/02/25,"14,698,419,200",12/31/24,"21,039,000,000","1,683,000,000","313,000,000","104,590,000,000"
45474,"Business combinations","Acquisition of ATC Telecom Infrastructure Private Limited - Refer to Notes 3 and 7 to the financial statements",558497,12/31/24,03/21/25,3,"Deloitte & Touche LLP",468,"Deloitte LLP",1208,Toronto,A6,ONTARIO,Canada,20-F,2025-03-24,,"Brookfield Infrastructure Partners L.P.",1406234,"=""BIP""","73 FRONT STREET",,HAMILTON,D0,BERMUDA,Foreign,,,"=""4400""","Water Transportation",221121,"Electric Bulk Power Transmission and Control",34,32,01/02/25,"14,698,419,200",12/31/24,"21,039,000,000","1,683,000,000","313,000,000","104,590,000,000"
45250,"Other investments","Valuation of investments which utilize significant unobservable inputs",558155,12/31/24,03/20/25,2,"Ernst & Young LLP",,,,"Los Angeles",CA,CALIFORNIA,"US West",10-K,2025-03-20,,"Brookfield Oaktree Holdings, LLC",1403528,"=""OAK.A""","333 SOUTH GRAND AVENUE","28TH FLOOR","LOS ANGELES",CA,CALIFORNIA,"US West",,,"=""6282""","Investment Advice",523920,"Portfolio Management",34,22,01/02/25,"2,120,991,104",12/31/24,"187,788,000","307,524,000",,"7,073,432,000"
45363,"Property, plant and equipment","Fair Value of Investment Properties - Refer to Notes 2(d), 2(q)(v) and 3 to the financial statements",558371,12/31/24,03/21/25,3,"Deloitte & Touche LLP",468,"Deloitte LLP",1208,Toronto,A6,ONTARIO,Canada,20-F,2025-03-21,,"Brookfield Property Partners L.P.",1545772,"=""BPYPM""","73 FRONT STREET",,HAMILTON,D0,BERMUDA,Foreign,,,"=""6500""","Real Estate",531312,"Nonresidential Property Managers",34,16,01/02/25,"116,803,200",12/31/24,"9,111,000,000","-1,997,000,000","6,590,000,000","102,591,000,000"
45149,"Real estate investments","Impairment of Investments in real estate - Refer to Note 2 in the financial statements",557857,12/31/24,03/18/25,3,"Deloitte & Touche LLP",,,,"New York",NY,"NEW YORK","US Mid Atlantic",10-K,2025-03-18,,"BROOKFIELD REAL ESTATE INCOME TRUST INC.",1713407,,"250 VESEY STREET","15TH FLOOR","NEW YORK",NY,"NEW YORK","US Mid Atlantic",,,"=""6798""","Real Estate Investment Trusts",525990,"Other Financial Vehicles",34,,,,12/31/24,"143,988,000","-32,181,000","610,497,000","1,821,263,000"
45219,"Real estate investments","Impairment of Investments in real estate - Refer to Note 2 in the financial statements",558113,12/31/24,03/18/25,3,"Deloitte & Touche LLP",,,,"New York",NY,"NEW YORK","US Mid Atlantic",424B3,2025-03-19,,"BROOKFIELD REAL ESTATE INCOME TRUST INC.",1713407,,"250 VESEY STREET","15TH FLOOR","NEW YORK",NY,"NEW YORK","US Mid Atlantic",,,"=""6798""","Real Estate Investment Trusts",525990,"Other Financial Vehicles",34,,,,12/31/24,"143,988,000","-32,181,000","610,497,000","1,821,263,000"
44013,"Property, plant and equipment","Revaluation of power generating assets",554544,12/31/24,02/28/25,2,"Ernst & Young LLP",192,"Ernst & Young LLP Chartered Accountants",1263,Toronto,A6,ONTARIO,Canada,20-F,2025-02-28,,"Brookfield Renewable Corp",1791863,"=""BEPC""","250 VESEY STREET, 15TH FLOOR",,"NEW YORK",NY,"NEW YORK","US Mid Atlantic",,,"=""4911""","Electric Services",221111,"Hydroelectric Power Generation",34,28,01/02/25,"5,039,225,344",12/31/24,"4,142,000,000","433,000,000","-692,000,000","44,129,000,000"
43824,"Property, plant and equipment","Revaluation of power generating assets",554633,12/31/24,02/28/25,2,"Ernst & Young LLP",192,"Ernst & Young LLP Chartered Accountants",1263,Toronto,A6,ONTARIO,Canada,20-F,2025-02-28,,"Brookfield Renewable Partners L.P.",1533232,"=""BEP""","73 FRONT STREET","FIFTH FLOOR",HAMILTON,D0,BERMUDA,Foreign,,,"=""4911""","Electric Services",221111,"Hydroelectric Power Generation",34,23,01/02/25,"6,636,367,872",12/31/24,"5,876,000,000","-9,000,000","2,397,000,000","94,809,000,000"
43825,"Business combinations","Significant utility-scale acquisition",554633,12/31/24,02/28/25,2,"Ernst & Young LLP",192,"Ernst & Young LLP Chartered Accountants",1263,Toronto,A6,ONTARIO,Canada,20-F,2025-02-28,,"Brookfield Renewable Partners L.P.",1533232,"=""BEP""","73 FRONT STREET","FIFTH FLOOR",HAMILTON,D0,BERMUDA,Foreign,,,"=""4911""","Electric Services",221111,"Hydroelectric Power Generation",34,23,01/02/25,"6,636,367,872",12/31/24,"5,876,000,000","-9,000,000","2,397,000,000","94,809,000,000"
43956,"Property, plant and equipment","Revaluation of power generating assets",554899,12/31/24,02/28/25,2,"Ernst & Young LLP",192,"Ernst & Young LLP Chartered Accountants",1263,Toronto,A6,ONTARIO,Canada,6-K,2025-02-28,,"Brookfield Renewable Partners L.P.",1533232,"=""BEP""","73 FRONT STREET","FIFTH FLOOR",HAMILTON,D0,BERMUDA,Foreign,,,"=""4911""","Electric Services",221111,"Hydroelectric Power Generation",34,23,01/02/25,"6,636,367,872",12/31/24,"5,876,000,000","-9,000,000","2,397,000,000","94,809,000,000"
43957,"Business combinations","Significant utility-scale acquisition",554899,12/31/24,02/28/25,2,"Ernst & Young LLP",192,"Ernst & Young LLP Chartered Accountants",1263,Toronto,A6,ONTARIO,Canada,6-K,2025-02-28,,"Brookfield Renewable Partners L.P.",1533232,"=""BEP""","73 FRONT STREET","FIFTH FLOOR",HAMILTON,D0,BERMUDA,Foreign,,,"=""4911""","Electric Services",221111,"Hydroelectric Power Generation",34,23,01/02/25,"6,636,367,872",12/31/24,"5,876,000,000","-9,000,000","2,397,000,000","94,809,000,000"
45711,"Insurance contract liabilities","Policy and Contract Claims – Property and casualty liability for unpaid claims and claim adjustment expenses — Refer to Notes 2 and 20 to the financial statements",559178,12/31/24,03/27/25,3,"Deloitte & Touche LLP",468,"Deloitte LLP",1208,Toronto,A6,ONTARIO,Canada,20-F,2025-03-27,,"Brookfield Wealth Solutions Ltd.",1837429,"=""BNT""","IDEATION HOUSE, 1ST FLOOR","94 PITTS BAY ROAD",PEMBROKE,D0,BERMUDA,Foreign,,,"=""6399""","Insurance Carriers, NEC",524126,"Direct Property and Casualty Insurance Carriers",34,57,01/02/25,"878,741,248",12/31/24,"14,103,000,000","1,247,000,000","9,753,000,000","139,953,000,000"
45712,"Insurance contract liabilities","Fixed Indexed Annuity Contracts – Valuation of embedded derivative liability and market risk benefits —Refer to Notes 2, 18, 19 to the financial statements",559178,12/31/24,03/27/25,3,"Deloitte & Touche LLP",468,"Deloitte LLP",1208,Toronto,A6,ONTARIO,Canada,20-F,2025-03-27,,"Brookfield Wealth Solutions Ltd.",1837429,"=""BNT""","IDEATION HOUSE, 1ST FLOOR","94 PITTS BAY ROAD",PEMBROKE,D0,BERMUDA,Foreign,,,"=""6399""","Insurance Carriers, NEC",524126,"Direct Property and Casualty Insurance Carriers",34,57,01/02/25,"878,741,248",12/31/24,"14,103,000,000","1,247,000,000","9,753,000,000","139,953,000,000"
45713,"Business combinations","Assumptions utilized in the valuation of actuarially determined liabilities and Value of Business acquired (VOBA) – Refer to Notes 2 and 16 to the financial statements",559178,12/31/24,03/27/25,3,"Deloitte & Touche LLP",468,"Deloitte LLP",1208,Toronto,A6,ONTARIO,Canada,20-F,2025-03-27,,"Brookfield Wealth Solutions Ltd.",1837429,"=""BNT""","IDEATION HOUSE, 1ST FLOOR","94 PITTS BAY ROAD",PEMBROKE,D0,BERMUDA,Foreign,,,"=""6399""","Insurance Carriers, NEC",524126,"Direct Property and Casualty Insurance Carriers",34,57,01/02/25,"878,741,248",12/31/24,"14,103,000,000","1,247,000,000","9,753,000,000","139,953,000,000"
44207,"Allowance for credit losses","Assessment of the collective allowance for credit losses",554934,12/31/24,03/03/25,4,"KPMG LLP",,,,Boston,MA,MASSACHUSETTS,"US New England",10-K,2025-03-03,,"BROOKLINE BANCORP INC",1049782,"=""BRKL""","131 CLARENDON STREET",,BOSTON,MA,MASSACHUSETTS,"US New England",,,"=""6035""","Savings Institutions, Federally Chartered",522120,"Savings Institutions",34,12,01/02/25,"1,033,541,952",12/31/24,"333,556,000","68,715,000","963,256,000","11,905,326,000"
41164,"Business combinations","Business Combinations — Purchased Customer Accounts — Refer to Note 3 to the consolidated financial statements",551162,12/31/24,02/12/25,3,"Deloitte & Touche LLP",,,,Tampa,FL,FLORIDA,"US Southeast",10-K,2025-02-13,,"BROWN & BROWN, INC.",79282,"=""BRO""","300 N. BEACH STREET",,"DAYTONA BEACH",FL,FLORIDA,"US Southeast",,,"=""6411""","Insurance Agents, Brokers, and Service",524210,"Insurance Agencies and Brokerages",34,101,01/02/25,"28,750,256,128",12/31/24,"4,805,000,000","993,000,000","-3,364,000,000","17,612,000,000"
38596,"Other intangible assets","Valuation of Gin Mare and Diplomático Other Intangible Assets",537552,04/30/24,06/14/24,2,"Ernst & Young LLP",,,,Louisville,KY,KENTUCKY,"US Mid Atlantic",10-K,2024-06-14,,"BROWN FORMAN CORP",14693,"=""BF.B""","850 DIXIE HWY",,LOUISVILLE,KY,KENTUCKY,"US Mid Atlantic",,,"=""2080""",Beverages,312140,Distilleries,34,47,05/02/24,"14,409,232,384",04/30/24,"4,178,000,000","1,024,000,000","1,072,000,000","8,166,000,000"
36938,"Revenue from customer contracts","Revenue – Refer to Notes 2n and 23 to the Financial Statements",531537,01/31/24,03/27/24,3,"Deloitte & Touche LLP",486,"Deloitte srl",1208,Montreal,A8,QUEBEC,Canada,40-F,2024-03-28,,"BRP Inc.",1748797,"=""DOOO""","726 SAINT-JOSEPH STREET",,VALCOURT,A8,QUEBEC,Canada,,,"=""3790""","Miscellaneous Transportation Equipment",336999,"All Other Transportation Equipment Manufacturing",34,63,02/02/24,"2,296,900,608",01/31/24,"7,457,100,000","557,200,000","111,400,000","5,071,300,000"
44689,"Equity investments and joint ventures","Preferred Equity Investments",557130,12/31/24,03/12/25,2,"Ernst & Young LLP",,,,"New York",NY,"NEW YORK","US Mid Atlantic",10-K,2025-03-12,,"BRT Apartments Corp.",14846,"=""BRT""","60 CUTTER MILL RD","SUITE 303","GREAT NECK",NY,"NEW YORK","US Mid Atlantic",,,"=""6798""","Real Estate Investment Trusts",531110,"Lessors of Residential Buildings and Dwellings",34,18,01/02/25,"331,738,080",12/31/24,"94,773,000","-9,791,000",,"713,463,000"
43991,"Revenue from customer contracts","Revenue Recognition – System Sales",554948,12/31/24,03/03/25,1,"PricewaterhouseCoopers LLP",,,,Boston,MA,MASSACHUSETTS,"US New England",10-K,2025-03-03,,"BRUKER CORP",1109354,"=""BRKR""","40 MANNING RD",,BILLERICA,MA,MASSACHUSETTS,"US New England",,,"=""3826""","Laboratory Analytical Instruments",334516,"Analytical Laboratory Instrument Manufacturing",34,59,01/02/25,"8,915,492,864",12/31/24,"3,366,400,000","113,100,000","-620,500,000","5,806,700,000"
43992,"Business combinations","Acquisition of ELITechGroup – Valuation of Customer Relationships and Technology",554948,12/31/24,03/03/25,1,"PricewaterhouseCoopers LLP",,,,Boston,MA,MASSACHUSETTS,"US New England",10-K,2025-03-03,,"BRUKER CORP",1109354,"=""BRKR""","40 MANNING RD",,BILLERICA,MA,MASSACHUSETTS,"US New England",,,"=""3826""","Laboratory Analytical Instruments",334516,"Analytical Laboratory Instrument Manufacturing",34,59,01/02/25,"8,915,492,864",12/31/24,"3,366,400,000","113,100,000","-620,500,000","5,806,700,000"
41447,Goodwill,"Navico Reporting Unit Goodwill Impairment – Refer to Notes 1 and 9 to the financial statements",551395,12/31/24,02/14/25,3,"Deloitte & Touche LLP",,,,Chicago,IL,ILLINOIS,"US Midwest",10-K,2025-02-14,,"BRUNSWICK CORP",14930,"=""BC""","26125 N. RIVERWOODS BLVD. SUITE 500",,METTAWA,IL,ILLINOIS,"US Midwest",,,"=""3510""","Engines & Turbines",333618,"Other Engine Equipment Manufacturing",34,64,01/02/25,"4,205,770,496",12/31/24,"5,237,100,000","130,100,000","7,900,000","5,677,700,000"
37325,Inventory,"Inventory – Adjustment to Inventory for Markdowns and Obsolescence – Refer to Note A to the financial statements",532562,02/03/24,04/03/24,3,"Deloitte & Touche LLP",,,,Omaha,NE,NEBRASKA,"US Midwest",10-K,2024-04-03,,"BUCKLE INC",885245,"=""BKE""","2407 W 24TH ST",,KEARNEY,NE,NEBRASKA,"US Midwest",,,"=""5651""","Family Clothing Stores",448110,"Men's Clothing Stores",34,38,02/05/24,"1,907,340,032",02/03/24,"1,261,102,000","219,919,000",,"889,810,000"
47230,"Property, plant and equipment","Impairment of property, plant, equipment and development cost",563407,12/31/24,04/30/25,2,"Ernst & Young LLP",846,"Tanaka Valdivia & Asociados Sociedad Civil de Responsabilidad Limitada",1315,Lima,R5,PERU,Foreign,20-F,2025-04-30,,"BUENAVENTURA MINING CO INC",1013131,"=""BVN""","AVE CARLOS VILLARAN 790",,LIMA,R5,PERU,Foreign,,,"=""1000""","Metal mining",212221,"Gold Ore Mining",34,12,01/02/25,"3,069,953,792",12/31/24,"1,154,605,000","416,263,000",,"5,047,903,000"
47231,"Uncertain tax positions","Receivable related to Claims from Tax Authority",563407,12/31/24,04/30/25,2,"Ernst & Young LLP",846,"Tanaka Valdivia & Asociados Sociedad Civil de Responsabilidad Limitada",1315,Lima,R5,PERU,Foreign,20-F,2025-04-30,,"BUENAVENTURA MINING CO INC",1013131,"=""BVN""","AVE CARLOS VILLARAN 790",,LIMA,R5,PERU,Foreign,,,"=""1000""","Metal mining",212221,"Gold Ore Mining",34,12,01/02/25,"3,069,953,792",12/31/24,"1,154,605,000","416,263,000",,"5,047,903,000"
37702,"Revenue from customer contracts","Revenue recognition - gift card breakage",533694,02/03/24,04/18/24,2,"Ernst & Young LLP",,,,"Saint Louis",MO,MISSOURI,"US Southeast",10-K,2024-04-18,,"BUILD-A-BEAR WORKSHOP INC",1113809,"=""BBW""","415 S. 18TH STREET, SUITE 200",,"ST LOUIS",MO,MISSOURI,"US Southeast",,,"=""5945""","Hobby, Toy, and Game Shops",339931,"Doll and Stuffed Toy Manufacturing",34,23,02/05/24,"321,878,016",02/03/24,"486,114,000","52,805,000",,"272,325,000"
42081,"Revenue from customer contracts","Revenue Recognition – Distribution Sales",552221,12/31/24,02/20/25,1,"PricewaterhouseCoopers LLP",,,,Dallas,TX,TEXAS,"US Southwest",10-K,2025-02-20,,"Builders FirstSource, Inc.",1316835,"=""BLDR""","6031 CONNECTION DR., STE. 400",,IRVING,TX,TEXAS,"US Southwest",,,"=""5211""","Lumber and Other Building Materials Dealers",238290,"Other Building Equipment Contractors",34,143,12/31/24,"16,233,703,424",12/31/24,"16,400,492,000","1,077,898,000","-485,668,000","10,583,086,000"
47963,"Other intangible assets","Digital assets held&#8201;—&#8201;inventories, Digital assets held&#8201;—&#8201;intangible assets, and Digital assets held&#8201;—&#8201;financial assets&#8201;—&#8201;Refer to Notes 2, 3, and 13",568740,12/31/24,05/21/25,3,"Deloitte & Touche LLP",,,,"San Francisco",CA,CALIFORNIA,"US West",DRS/A,2025-05-21,,Bullish,1872195,"=""BLSH""","UGLAND HOUSE, BOX 309",,"GRAND CAYMAN",E9,"CAYMAN ISLANDS",Foreign,,,"=""6199""","Finance Services",523210,"Securities and Commodity Exchanges",33,,,,12/31/24,"250,263,249,000","79,564,000","2,294,907,000","3,047,412,000"
47964,"Other intangible assets","Digital assets held&#8201;—&#8201;inventories, Digital assets held&#8201;—&#8201;intangible assets, and Digital assets held&#8201;—&#8201;financial assets&#8201;—&#8201;Refer to Notes 2, 3, and 13",568744,12/31/24,05/21/25,3,"Deloitte & Touche LLP",,,,"San Francisco",CA,CALIFORNIA,"US West",DRS/A,2025-06-18,,Bullish,1872195,"=""BLSH""","UGLAND HOUSE, BOX 309",,"GRAND CAYMAN",E9,"CAYMAN ISLANDS",Foreign,,,"=""6199""","Finance Services",523210,"Securities and Commodity Exchanges",33,,,,12/31/24,"250,263,249,000","79,564,000","2,294,907,000","3,047,412,000"
47966,"Other intangible assets","Digital assets held&#8201;—&#8201;inventories, Digital assets held&#8201;—&#8201;intangible assets, and Digital assets held&#8201;—&#8201;financial assets&#8201;—&#8201;Refer to Notes 2, 3, and 13",568747,12/31/24,05/21/25,3,"Deloitte & Touche LLP",,,,"San Francisco",CA,CALIFORNIA,"US West",DRS/A,2025-07-07,,Bullish,1872195,"=""BLSH""","UGLAND HOUSE, BOX 309",,"GRAND CAYMAN",E9,"CAYMAN ISLANDS",Foreign,,,"=""6199""","Finance Services",523210,"Securities and Commodity Exchanges",33,,,,12/31/24,"250,263,249,000","79,564,000","2,294,907,000","3,047,412,000"
47980,"Other intangible assets","Digital assets held - inventories, Digital assets held - intangible assets, and Digital assets held - financial assets - Refer to Notes 2, 3, and 13",568789,12/31/24,05/21/25,3,"Deloitte & Touche LLP",,,,"San Francisco",CA,CALIFORNIA,"US West",F-1,2025-07-18,,Bullish,1872195,"=""BLSH""","UGLAND HOUSE, BOX 309",,"GRAND CAYMAN",E9,"CAYMAN ISLANDS",Foreign,,,"=""6199""","Finance Services",523210,"Securities and Commodity Exchanges",33,,,,12/31/24,"250,263,249,000","79,564,000","2,294,907,000","3,047,412,000"
48104,"Other intangible assets","Digital assets held&#8201;—&#8201;inventories, Digital assets held&#8201;—&#8201;intangible assets, and Digital assets held&#8201;—&#8201;financial assets&#8201;—&#8201;Refer to Notes 2, 3, and 13",569714,12/31/24,05/21/25,3,"Deloitte & Touche LLP",,,,"San Francisco",CA,CALIFORNIA,"US West",F-1/A,2025-08-04,,Bullish,1872195,"=""BLSH""","UGLAND HOUSE, BOX 309",,"GRAND CAYMAN",E9,"CAYMAN ISLANDS",Foreign,,,"=""6199""","Finance Services",523210,"Securities and Commodity Exchanges",33,,,,12/31/24,"250,263,249,000","79,564,000","2,294,907,000","3,047,412,000"
48166,"Other intangible assets","Digital assets held&#8201;—&#8201;inventories, Digital assets held&#8201;—&#8201;intangible assets, and Digital assets held&#8201;—&#8201;financial assets&#8201;—&#8201;Refer to Notes 2, 3, and 13",570149,12/31/24,05/21/25,3,"Deloitte & Touche LLP",,,,"San Francisco",CA,CALIFORNIA,"US West",F-1/A,2025-08-11,,Bullish,1872195,"=""BLSH""","UGLAND HOUSE, BOX 309",,"GRAND CAYMAN",E9,"CAYMAN ISLANDS",Foreign,,,"=""6199""","Finance Services",523210,"Securities and Commodity Exchanges",33,,,,12/31/24,"250,263,249,000","79,564,000","2,294,907,000","3,047,412,000"
48186,"Other intangible assets","Digital assets held - inventories, Digital assets held - intangible assets, and Digital assets held - financial assets - Refer to Notes 2, 3, and 13",570338,12/31/24,05/21/25,3,"Deloitte & Touche LLP",,,,"San Francisco",CA,CALIFORNIA,"US West",424B4,2025-08-13,,Bullish,1872195,"=""BLSH""","UGLAND HOUSE, BOX 309",,"GRAND CAYMAN",E9,"CAYMAN ISLANDS",Foreign,,,"=""6199""","Finance Services",523210,"Securities and Commodity Exchanges",33,,,,12/31/24,"250,263,249,000","79,564,000","2,294,907,000","3,047,412,000"
43909,"Uncertain tax positions","Measurement of the Tax Receivable Agreement Liability",554795,12/31/24,02/28/25,2,"Ernst & Young LLP",,,,Austin,TX,TEXAS,"US Southwest",10-K,2025-02-28,,"Bumble Inc.",1830043,"=""BMBL""","1105 WEST 41ST STREET",,AUSTIN,TX,TEXAS,"US Southwest",,,"=""7370""","Services-Computer Programming, Data Processing, Etc.",511210,"Software Publishers",34,8,12/31/24,"871,856,128",12/31/24,"1,071,643,000","-557,008,000","-1,310,600,000","2,524,887,000"
43910,"Goodwill and intangible assets","Impairment of Goodwill and Indefinite-Lived Intangibles",554795,12/31/24,02/28/25,2,"Ernst & Young LLP",,,,Austin,TX,TEXAS,"US Southwest",10-K,2025-02-28,,"Bumble Inc.",1830043,"=""BMBL""","1105 WEST 41ST STREET",,AUSTIN,TX,TEXAS,"US Southwest",,,"=""7370""","Services-Computer Programming, Data Processing, Etc.",511210,"Software Publishers",34,8,12/31/24,"871,856,128",12/31/24,"1,071,643,000","-557,008,000","-1,310,600,000","2,524,887,000"
41967,Inventory,"Readily Marketable Inventories and Physically Settled Forward Purchase and Sale Contracts - Refer to Notes 1 and 15 to the financial statements",552133,12/31/24,02/20/25,3,"Deloitte & Touche LLP",,,,"Saint Louis",MO,MISSOURI,"US Southeast",10-K,2025-02-20,,"Bunge Global SA",1996862,"=""BG""","ROUTE DE FLORISSANT 13",,GENEVA,V8,SWITZERLAND,Foreign,,,"=""2070""","Fats & Oils",0,,34,78,01/02/25,"10,830,874,624",12/31/24,"53,108,000,000","1,137,000,000","9,143,000,000","24,899,000,000"
46374,Inventory,"Readily Marketable Inventories and Physically Settled Forward Purchase and Sale Contracts - Refer to Notes 1 and 15 to the financial statements",560677,12/31/24,02/20/25,3,"Deloitte & Touche LLP",,,,"Saint Louis",MO,MISSOURI,"US Southeast",ARS,2025-04-04,,"Bunge Global SA",1996862,"=""BG""","ROUTE DE FLORISSANT 13",,GENEVA,V8,SWITZERLAND,Foreign,,,"=""2070""","Fats & Oils",0,,34,78,01/02/25,"10,830,874,624",12/31/24,"53,108,000,000","1,137,000,000","9,143,000,000","24,899,000,000"
44060,"Other investments","Fair value of capital provision assets",555023,12/31/24,03/03/25,4,"KPMG LLP",,,,"New York",NY,"NEW YORK","US Mid Atlantic",10-K,2025-03-03,,"Burford Capital Ltd",1714174,"=""BUR""","OAK HOUSE","HIRZEL STREET","ST PETER PORT",Y7,GUERNSEY,Foreign,,,"=""6199""","Finance Services",523110,"Investment Banking and Securities Dealing",34,13,01/02/25,"2,822,425,856",12/31/24,"410,494,000","146,484,000","2,285,484,000","6,175,025,000"
42500,"Deferred and capitalized costs","Property and Equipment – Appropriate Capitalization of Costs – Refer to Notes 2 and 9 to the financial statements",552911,12/31/24,02/24/25,3,"Deloitte & Touche LLP",,,,"Fort Worth",TX,TEXAS,"US Southwest",10-K,2025-02-24,,"BURLINGTON NORTHERN SANTA FE, LLC",934612,"=""BNI""","2650 LOU MENK DR",,"FT WORTH",TX,TEXAS,"US Southwest",1067983,"BERKSHIRE HATHAWAY INC","=""4011""","Railroads, Line-haul Operating",482111,"Line-Haul Railroads",34,,,,12/31/24,"23,437,000,000","5,031,000,000","35,290,000,000","96,170,000,000"
36138,Inventory,"Retail Inventory Method—Impact of Markdowns—Refer to Note 1 to the financial statements",530185,02/03/24,03/15/24,3,"Deloitte & Touche LLP",,,,Morristown,NJ,"NEW JERSEY","US Mid Atlantic",10-K,2024-03-15,,"Burlington Stores, Inc.",1579298,"=""BURL""","1830 ROUTE 130 NORTH",,BURLINGTON,NJ,"NEW JERSEY","US Mid Atlantic",,,"=""5311""","Department Stores",448140,"Family Clothing Stores",34,194,02/05/24,"12,492,735,488",02/03/24,"9,727,467,000","339,649,000","711,868,000","7,706,840,000"
47123,"Revenue from customer contracts","Revenue recognition – determining the standalone selling price of the Company’s performance obligation for in-hospital business",563174,12/31/24,04/29/25,2,"Ernst & Young LLP",211,"Ernst & Young Hua Ming LLP",1408,Shanghai,F4,CHINA,Foreign,20-F,2025-04-29,,"Burning Rock Biotech Ltd",1792267,"=""BNR""","NO. 5 XINGDAO RING ROAD NORTH,","INTERNATIONAL BIO ISLAND","GUANGZHOU, GUANGDONG",F4,CHINA,Foreign,,,"=""8071""","Medical Laboratories",621511,"Medical Laboratories",34,7,01/02/25,"62,900,428",12/31/24,"70,668,000","-47,488,000","79,515,000","121,287,000"
43839,Inventory,"Inventory Raw Materials Valuation – Refer to “Note 2. Summary of Significant Accounting Policies and Note 5. Inventories” to the financial statements",554548,12/31/24,02/28/25,3,"Deloitte & Touche LLP",,,,"New York",NY,"NEW YORK","US Mid Atlantic",10-K,2025-02-28,,"Butterfly Network, Inc.",1804176,"=""BFLY""","1600 DISTRICT AVENUE",,BURLINGTON,MA,MASSACHUSETTS,"US New England",,,"=""3844""","X-Ray Apparatus and Tubes and Related Irradiation Apparatus",511210,"Software Publishers",34,3,12/31/24,"588,513,600",12/31/24,"82,056,000","-72,492,000","159,916,000","256,082,000"
45932,"Revenue from customer contracts","Sufficiency of audit evidence on determining the timing of cargo sales revenue recognition",559651,12/31/24,03/28/25,4,"KPMG LLP",81,"KPMG LLP",1051,Singapore,U0,SINGAPORE,Foreign,20-F,2025-03-28,,"BW LPG Ltd",1649313,"=""BWLP""","10 PASIR PANJANG ROAD",#17-02,"MAPLETREE BUSINESS CITY",U0,SINGAPORE,Foreign,,,"=""4700""","Transportation Services",0,,34,,12/31/24,,12/31/24,"3,563,747,000","394,868,000","1,937,494,000","3,320,420,000"
42621,"Revenue from customer contracts","Over Time Revenue Recognition – Estimating Costs at Completion – Refer to Note 1 and Note 3 to the Financial Statements",552969,12/31/24,02/24/25,3,"Deloitte & Touche LLP",,,,Charlotte,NC,"NORTH CAROLINA","US Southeast",10-K,2025-02-24,,"BWX Technologies, Inc.",1486957,"=""BWXT""","800 MAIN STREET","4TH FLOOR",LYNCHBURG,VA,VIRGINIA,"US Mid Atlantic",,,"=""3510""","Engines & Turbines",332410,"Power Boiler and Heat Exchanger Manufacturing",34,111,12/31/24,"10,186,703,872",12/31/24,"2,703,654,000","281,941,000","627,993,000","2,869,924,000"
45244,"Revenue from customer contracts","Over Time Revenue Recognition – Estimating Costs at Completion – Refer to Note 1 and Note 3 to the Financial Statements",558018,12/31/24,02/24/25,3,"Deloitte & Touche LLP",,,,Charlotte,NC,"NORTH CAROLINA","US Southeast",10-K/A,2025-03-19,,"BWX Technologies, Inc.",1486957,"=""BWXT""","800 MAIN STREET","4TH FLOOR",LYNCHBURG,VA,VIRGINIA,"US Mid Atlantic",,,"=""3510""","Engines & Turbines",332410,"Power Boiler and Heat Exchanger Manufacturing",34,111,12/31/24,"10,186,703,872",12/31/24,"2,703,654,000","281,941,000","627,993,000","2,869,924,000"
43146,"Long-lived assets","Impairment Assessment of Long-Lived Assets and Investments in Unconsolidated Joint Ventures",553833,12/31/24,02/27/25,1,"PricewaterhouseCoopers LLP",,,,Boston,MA,MASSACHUSETTS,"US New England",10-K,2025-02-27,,"BXP, Inc.",1037540,"=""BXP""","800 BOYLSTON STREET","SUITE 1900",BOSTON,MA,MASSACHUSETTS,"US New England",,,"=""6798""","Real Estate Investment Trusts",531120,"Lessors of Nonresidential Buildings (except Miniwarehouses)",34,74,01/02/25,"11,652,758,528",12/31/24,"3,407,719,000","14,272,000",,"26,084,980,000"
43147,"Business combinations","Purchase Price Allocation for Long-Lived Asset Property Acquisitions",553833,12/31/24,02/27/25,1,"PricewaterhouseCoopers LLP",,,,Boston,MA,MASSACHUSETTS,"US New England",10-K,2025-02-27,,"BXP, Inc.",1037540,"=""BXP""","800 BOYLSTON STREET","SUITE 1900",BOSTON,MA,MASSACHUSETTS,"US New England",,,"=""6798""","Real Estate Investment Trusts",531120,"Lessors of Nonresidential Buildings (except Miniwarehouses)",34,74,01/02/25,"11,652,758,528",12/31/24,"3,407,719,000","14,272,000",,"26,084,980,000"
41355,"Revenue from customer contracts","Revenue Recognition — Refer to Notes 1 and 9 to the financial statements",551333,12/31/24,02/14/25,3,"Deloitte & Touche LLP",,,,Minneapolis,MN,MINNESOTA,"US Midwest",10-K,2025-02-14,,"C. H. ROBINSON WORLDWIDE, INC.",1043277,"=""CHRW""","14701 CHARLSON ROAD",,"EDEN PRAIRIE",MN,MINNESOTA,"US Midwest",,,"=""4731""","Arrangement of Transportation of  Freight and Cargo",488510,"Freight Transportation Arrangement",34,103,01/02/25,"12,149,130,240",12/31/24,"17,724,956,000","465,690,000","264,893,000","5,297,926,000"
38616,"Revenue from customer contracts","Revenue - Refer to Notes 1 and 2 to the financial statements",537640,04/30/24,06/18/24,3,"Deloitte & Touche LLP",,,,"San Jose",CA,CALIFORNIA,"US West",10-K,2024-06-18,,"C3.ai, Inc.",1577526,"=""AI""","1400 SEAPORT BLVD",,"REDWOOD CITY",CA,CALIFORNIA,"US West",,,"=""7372""","Prepackaged Software",334611,"Software Reproducing",34,23,05/02/24,"2,744,404,736",04/30/24,"310,582,000","-279,696,000","872,728,000","1,038,225,000"
43280,"Revenue from customer contracts","Revenue recognition for certain research and development services",553932,12/31/24,02/27/25,4,"KPMG LLP",,,,Boston,MA,MASSACHUSETTS,"US New England",10-K,2025-02-27,,"C4 Therapeutics, Inc.",1662579,"=""CCCC""","490 ARSENAL WAY","SUITE 120",WATERTOWN,MA,MASSACHUSETTS,"US New England",,,"=""2836""","Biological Products, Except Diagnostic Substances",325414,"Biological Product (except Diagnostic) Manufacturing",34,4,12/31/24,"254,253,232",12/31/24,"35,584,000","-105,316,000",,"349,602,000"
47111,"Revenue from customer contracts","Revenue recognition for certain research and development services",563226,12/31/24,02/27/25,4,"KPMG LLP",,,,Boston,MA,MASSACHUSETTS,"US New England",ARS,2025-04-29,,"C4 Therapeutics, Inc.",1662579,"=""CCCC""","490 ARSENAL WAY","SUITE 120",WATERTOWN,MA,MASSACHUSETTS,"US New England",,,"=""2836""","Biological Products, Except Diagnostic Substances",325414,"Biological Product (except Diagnostic) Manufacturing",34,4,12/31/24,"254,253,232",12/31/24,"35,584,000","-105,316,000",,"349,602,000"
46076,"Research and development expenses","Accounting for Accrued Clinical Trial Expenses",559833,12/31/24,03/31/25,2,"Ernst & Young LLP",,,,Philadelphia,PA,PENNSYLVANIA,"US Mid Atlantic",10-K,2025-03-31,Yes,"Cabaletta Bio, Inc.",1759138,"=""CABA""","2929 ARCH STREET","SUITE 600",PHILADELPHIA,PA,PENNSYLVANIA,"US Mid Atlantic",,,"=""2836""","Biological Products, Except Diagnostic Substances",325414,"Biological Product (except Diagnostic) Manufacturing",34,2,12/31/24,"115,186,840",12/31/24,,"-115,864,000",,"185,046,000"
43729,"Deferred and capitalized costs","Capitalization of Internal Labor Costs",554508,12/31/24,02/27/25,1,"PricewaterhouseCoopers LLP",,,,Phoenix,AZ,ARIZONA,"US Southwest",10-K,2025-02-28,,"Cable One, Inc.",1632127,"=""CABO""","210 E. EARLL DRIVE",,PHOENIX,AZ,ARIZONA,"US Southwest",,,"=""4841""","Cable and Other Pay Television Services",515210,"Cable and Other Subscription Programming",34,362,12/31/24,"2,034,884,480",12/31/24,"1,579,542,000","14,480,000","-1,666,432,000","6,525,895,000"
43730,"Equity investments and joint ventures","Fair Value of Options Associated with the Mega Broadband Investment",554508,12/31/24,02/27/25,1,"PricewaterhouseCoopers LLP",,,,Phoenix,AZ,ARIZONA,"US Southwest",10-K,2025-02-28,,"Cable One, Inc.",1632127,"=""CABO""","210 E. EARLL DRIVE",,PHOENIX,AZ,ARIZONA,"US Southwest",,,"=""4841""","Cable and Other Pay Television Services",515210,"Cable and Other Subscription Programming",34,362,12/31/24,"2,034,884,480",12/31/24,"1,579,542,000","14,480,000","-1,666,432,000","6,525,895,000"
40045,"Other contingent liabilities","Commitments and Contingencies — CWP Respirator Liabilities — Refer to Note T to the consolidated financial statements",544217,09/30/24,11/20/24,3,"Deloitte & Touche LLP",,,,Boston,MA,MASSACHUSETTS,"US New England",10-K,2024-11-20,,"CABOT CORP",16040,"=""CBT""","TWO SEAPORT LANE SUITE 1400",,BOSTON,MA,MASSACHUSETTS,"US New England",,,"=""2890""","Miscellaneous Chemical Products",325211,"Plastics Material and Resin Manufacturing",34,111,10/02/24,"6,062,966,272",09/30/24,"3,994,000,000","380,000,000","1,239,000,000","3,736,000,000"
39074,"Revenue from customer contracts","Revenue Recognized Over Time",539803,06/30/24,08/08/24,1,"PricewaterhouseCoopers LLP",,,,Washington,DC,"DISTRICT OF COLUMBIA","US Mid Atlantic",10-K,2024-08-08,,"CACI INTERNATIONAL INC /DE/",16058,"=""CACI""","TWO RESTON OVERLOOK","12021 SUNSET HILLS ROAD",RESTON,VA,VIRGINIA,"US Mid Atlantic",,,"=""7373""","Computer Integrated Systems Design",541512,"Computer Systems Design Services",34,428,07/02/24,"9,548,883,968",06/30/24,"7,659,832,000","419,924,000","-1,111,126,000","6,796,101,000"
43474,"Other debt","Liability related to the Tax Receivable Agreement",554061,12/31/24,02/27/25,1,"PricewaterhouseCoopers LLP",,,,Houston,TX,TEXAS,"US Southwest",10-K,2025-02-27,,"Cactus, Inc.",1699136,"=""WHD""","920 MEMORIAL CITY WAY","SUITE 300",HOUSTON,TX,TEXAS,"US Southwest",,,"=""3533""","Oil and Gas Field Machinery and Equipment",333132,"Oil and Gas Field Machinery and Equipment Manufacturing",34,58,12/31/24,"3,977,324,032",12/31/24,"1,129,814,000","185,407,000","704,098,000","1,739,328,000"
45501,"Revenue from customer contracts","Recognition of revenue from time charter and transportation and installation activities",558765,12/31/24,03/25/25,2,"Ernst & Young LLP",599,"Ernst & Young godkendt revisionspartnerselskab",1757,Copenhagen,G7,DENMARK,Foreign,20-F,2025-03-25,,"Cadeler A/S",1978867,"=""CDLR""","KALVEBOD BRYGGE 43",,"COPENHAGEN V",G7,DENMARK,Foreign,,,"=""4412""","Deep Sea Foreign Transportation of  Freight",483111,"Deep Sea Freight Transportation",33,23,01/02/25,"1,786,714,112",12/31/24,"257,570,000","67,379,000","1,258,871,000","2,005,795,000"
45502,"Property, plant and equipment","Impairment testing of vessels and assets under construction",558765,12/31/24,03/25/25,2,"Ernst & Young LLP",599,"Ernst & Young godkendt revisionspartnerselskab",1757,Copenhagen,G7,DENMARK,Foreign,20-F,2025-03-25,,"Cadeler A/S",1978867,"=""CDLR""","KALVEBOD BRYGGE 43",,"COPENHAGEN V",G7,DENMARK,Foreign,,,"=""4412""","Deep Sea Foreign Transportation of  Freight",483111,"Deep Sea Freight Transportation",33,23,01/02/25,"1,786,714,112",12/31/24,"257,570,000","67,379,000","1,258,871,000","2,005,795,000"
42450,"Revenue from customer contracts","Revenue Recognition – Identifying and Evaluating Terms and Conditions in Contracts",552750,12/31/24,02/20/25,1,"PricewaterhouseCoopers LLP",,,,"San Jose",CA,CALIFORNIA,"US West",10-K,2025-02-21,,"CADENCE DESIGN SYSTEMS INC",813672,"=""CDNS""","2655 SEELY AVENUE BLDG 5",,"SAN JOSE",CA,CALIFORNIA,"US West",,,"=""7372""","Prepackaged Software",511210,"Software Publishers",34,298,01/02/25,"81,637,122,048",12/31/24,"4,641,264,000","1,055,484,000","1,700,173,000","8,974,482,000"
45860,"Going concern","Liquidity Assessment",559445,12/31/24,03/28/25,1,"PricewaterhouseCoopers LLP",,,,"Los Angeles",CA,CALIFORNIA,"US West",10-K,2025-03-28,,"CADIZ INC",727273,"=""CDZI""","550 SOUTH HOPE STREET","SUITE 2850","LOS ANGELES",CA,CALIFORNIA,"US West",,,"=""4941""","Water Supply",531312,"Nonresidential Property Managers",34,5,12/31/24,"391,840,224",12/31/24,"9,608,000","-31,140,000","28,247,000","134,494,000"
38444,"Revenue from customer contracts","Revenue recognition – Estimated costs to complete certain contracts",536665,03/31/24,05/27/24,1,"PricewaterhouseCoopers LLP",493,"PricewaterhouseCoopers srl",271,Montreal,A8,QUEBEC,Canada,6-K,2024-05-28,,"CAE INC",1173382,"=""CAE""","8585 COTE DE LIESSE",,ST-LAURENT,A8,QUEBEC,Canada,,,"=""3690""","Miscellaneous Electrical Machinery, Equipment & Supplies",333319,"Other Commercial and Service Industry Machinery Manufacturing",34,20,04/02/24,"6,269,111,808",03/31/24,"3,164,800,000","-219,000,000","704,200,000","7,267,000,000"
38445,Goodwill,"Goodwill impairment assessment – Defense and Security cash-generating unit",536665,03/31/24,05/27/24,1,"PricewaterhouseCoopers LLP",493,"PricewaterhouseCoopers srl",271,Montreal,A8,QUEBEC,Canada,6-K,2024-05-28,,"CAE INC",1173382,"=""CAE""","8585 COTE DE LIESSE",,ST-LAURENT,A8,QUEBEC,Canada,,,"=""3690""","Miscellaneous Electrical Machinery, Equipment & Supplies",333319,"Other Commercial and Service Industry Machinery Manufacturing",34,20,04/02/24,"6,269,111,808",03/31/24,"3,164,800,000","-219,000,000","704,200,000","7,267,000,000"
38669,"Revenue from customer contracts","Revenue recognition – Estimated costs to complete certain contracts",537781,03/31/24,05/27/24,1,"PricewaterhouseCoopers LLP",493,"PricewaterhouseCoopers srl",271,Montreal,A8,QUEBEC,Canada,40-F,2024-06-21,,"CAE INC",1173382,"=""CAE""","8585 COTE DE LIESSE",,ST-LAURENT,A8,QUEBEC,Canada,,,"=""3690""","Miscellaneous Electrical Machinery, Equipment & Supplies",333319,"Other Commercial and Service Industry Machinery Manufacturing",34,20,04/02/24,"6,269,111,808",03/31/24,"3,164,800,000","-219,000,000","704,200,000","7,267,000,000"
38670,Goodwill,"Goodwill impairment assessment – Defense and Security cash-generating unit",537781,03/31/24,05/27/24,1,"PricewaterhouseCoopers LLP",493,"PricewaterhouseCoopers srl",271,Montreal,A8,QUEBEC,Canada,40-F,2024-06-21,,"CAE INC",1173382,"=""CAE""","8585 COTE DE LIESSE",,ST-LAURENT,A8,QUEBEC,Canada,,,"=""3690""","Miscellaneous Electrical Machinery, Equipment & Supplies",333319,"Other Commercial and Service Industry Machinery Manufacturing",34,20,04/02/24,"6,269,111,808",03/31/24,"3,164,800,000","-219,000,000","704,200,000","7,267,000,000"
38674,"Revenue from customer contracts","Revenue recognition – Estimated costs to complete certain contracts",537871,03/31/24,05/27/24,1,"PricewaterhouseCoopers LLP",493,"PricewaterhouseCoopers srl",271,Montreal,A8,QUEBEC,Canada,6-K,2024-06-21,,"CAE INC",1173382,"=""CAE""","8585 COTE DE LIESSE",,ST-LAURENT,A8,QUEBEC,Canada,,,"=""3690""","Miscellaneous Electrical Machinery, Equipment & Supplies",333319,"Other Commercial and Service Industry Machinery Manufacturing",34,20,04/02/24,"6,269,111,808",03/31/24,"3,164,800,000","-219,000,000","704,200,000","7,267,000,000"
38675,Goodwill,"Goodwill impairment assessment – Defense and Security cash-generating unit",537871,03/31/24,05/27/24,1,"PricewaterhouseCoopers LLP",493,"PricewaterhouseCoopers srl",271,Montreal,A8,QUEBEC,Canada,6-K,2024-06-21,,"CAE INC",1173382,"=""CAE""","8585 COTE DE LIESSE",,ST-LAURENT,A8,QUEBEC,Canada,,,"=""3690""","Miscellaneous Electrical Machinery, Equipment & Supplies",333319,"Other Commercial and Service Industry Machinery Manufacturing",34,20,04/02/24,"6,269,111,808",03/31/24,"3,164,800,000","-219,000,000","704,200,000","7,267,000,000"
42767,Goodwill,"Goodwill – Refer to Note 5 to the Financial Statements",553217,12/31/24,02/25/25,3,"Deloitte & Touche LLP",,,,"Las Vegas",NV,NEVADA,"US West",10-K,2025-02-25,,"Caesars Entertainment, Inc.",1590895,"=""CZR""","100 WEST LIBERTY STREET, 12TH FLOOR",,RENO,NV,NEVADA,"US West",,,"=""7011""","Hotels and Motels",721120,"Casino Hotels",34,33,12/31/24,"7,062,484,480",12/31/24,"11,245,000,000","-278,000,000","-10,577,000,000","32,590,000,000"
44296,"Other contingent liabilities","Provision for bodily injury claims related to exposure to silica dust and the related assessment of the claims",555631,12/31/24,03/05/25,2,"Ernst & Young LLP",222,"Kost Forer Gabbay & Kasierer",1281,"Tel Aviv",L3,ISRAEL,Foreign,20-F,2025-03-05,,"Caesarstone Ltd.",1504379,"=""CSTE""","Kibbutz Sdot Yam",,"MP Menashe",L3,ISRAEL,Foreign,,,"=""3281""","Cut Stone and Stone Products",327991,"Cut Stone and Stone Product Manufacturing",34,4,12/31/24,"146,833,456",12/31/24,"443,221,000","-42,832,000","279,109,000","549,041,000"
40494,"Related party transactions","Mexican IVA taxes receivable — Refer to Note 14 to the financial statements",547191,10/31/24,01/14/25,3,"Deloitte & Touche LLP",,,,"Los Angeles",CA,CALIFORNIA,"US West",10-K,2025-01-14,,"CALAVO GROWERS INC",1133470,"=""CVGW""","1141A CUMMINGS ROAD",,"SANTA PAULA",CA,CALIFORNIA,"US West",,,"=""0700""","Agricultural services",111339,"Other Noncitrus Fruit Farming",34,27,10/31/24,"473,177,152",10/31/24,"661,544,000","-1,076,000","190,121,000","301,119,000"
40495,"Uncertain tax positions","Uncertain Tax Positions Related to Mexico tax audits — Refer to Note 7 to the financial statements",547191,10/31/24,01/14/25,3,"Deloitte & Touche LLP",,,,"Los Angeles",CA,CALIFORNIA,"US West",10-K,2025-01-14,,"CALAVO GROWERS INC",1133470,"=""CVGW""","1141A CUMMINGS ROAD",,"SANTA PAULA",CA,CALIFORNIA,"US West",,,"=""0700""","Agricultural services",111339,"Other Noncitrus Fruit Farming",34,27,10/31/24,"473,177,152",10/31/24,"661,544,000","-1,076,000","190,121,000","301,119,000"
37292,Inventory,"Inventory Markdown Reserves",532435,02/03/24,04/02/24,2,"Ernst & Young LLP",,,,"Saint Louis",MO,MISSOURI,"US Southeast",10-K,2024-04-02,,"CALERES INC",14707,"=""CAL""","8300 MARYLAND AVE","P O BOX 29","ST LOUIS",MO,MISSOURI,"US Southeast",,,"=""3140""","Footwear, (No Rubber)",448210,"Shoe Stores",34,32,02/05/24,"1,129,324,928",02/03/24,"2,817,294,000","171,391,000","357,321,000","1,804,746,000"
44100,"Proven and unproven reserves","Impact of estimated oil and gas reserves on depletion expense for proved oil and gas properties",555076,12/31/24,03/03/25,4,"KPMG LLP",,,,"Los Angeles",CA,CALIFORNIA,"US West",10-K,2025-03-03,,"California Resources Corp",1609253,"=""CRC""","1 WORLD TRADE CENTER","SUITE 1500","LONG BEACH",CA,CALIFORNIA,"US West",,,"=""1311""","Crude Petroleum and Natural Gas",211111,"Crude Petroleum and Natural Gas Extraction",34,52,12/31/24,"4,727,195,648",12/31/24,"2,957,000,000","376,000,000",,"7,135,000,000"
44101,"Business combinations","Evaluation of the fair value measurement of oil and gas properties acquired in the Aera Energy LLC business combination",555076,12/31/24,03/03/25,4,"KPMG LLP",,,,"Los Angeles",CA,CALIFORNIA,"US West",10-K,2025-03-03,,"California Resources Corp",1609253,"=""CRC""","1 WORLD TRADE CENTER","SUITE 1500","LONG BEACH",CA,CALIFORNIA,"US West",,,"=""1311""","Crude Petroleum and Natural Gas",211111,"Crude Petroleum and Natural Gas Extraction",34,52,12/31/24,"4,727,195,648",12/31/24,"2,957,000,000","376,000,000",,"7,135,000,000"
43145,"Regulatory assets and liabilities","Regulatory Assets and Liabilities - Regulated Utility Accounting— Refer to Notes 2 and 4 to the financial statements",553819,12/31/24,02/27/25,3,"Deloitte & Touche LLP",,,,"San Francisco",CA,CALIFORNIA,"US West",10-K,2025-02-27,,"CALIFORNIA WATER SERVICE GROUP",1035201,"=""CWT""","1720 N FIRST ST","C/O CALIFORNIA WATER SERVICE CO","SAN JOSE",CA,CALIFORNIA,"US West",,,"=""4941""","Water Supply",221310,"Water Supply and Irrigation Systems",34,45,12/31/24,"2,696,409,600",12/31/24,"1,036,806,000","190,807,000","1,560,996,000","5,180,283,000"
42267,Inventory,"Evaluation of net realizable value of components and finished goods inventory and excess and obsolete component liabilities",552428,12/31/24,02/21/25,4,"KPMG LLP",,,,"Santa Clara",CA,CALIFORNIA,"US West",10-K,2025-02-21,,"CALIX, INC",1406666,"=""CALX""","3155 OLSEN DRIVE, SUITE 450",,"SAN JOSE",CA,CALIFORNIA,"US West",,,"=""4899""","Communications Services, NEC",517110,"Wired Telecommunications Carriers",34,34,01/02/25,"2,248,111,104",12/31/24,"831,518,000","-29,747,000","664,765,000","939,267,000"
42115,"Property, plant and equipment","Asset Impairment — Determination of Impairment Indicators and Impairment of Properties Under Development and Land – Refer to Notes 2 , 7, and 11 to the financial statements",552281,12/31/24,02/20/25,3,"Deloitte & Touche LLP",,,,Houston,TX,TEXAS,"US Southwest",10-K,2025-02-20,,"CAMDEN PROPERTY TRUST",906345,"=""CPT""","2800 POST OAK BOULEVARD","SUITE 2700",HOUSTON,TX,TEXAS,"US Southwest",,,"=""6798""","Real Estate Investment Trusts",525990,"Other Financial Vehicles",34,115,01/02/25,"12,234,214,400",12/31/24,"1,550,979,000","163,293,000",,"8,852,144,000"
42181,"Deferred income taxes","Assessment of recoverability of deferred tax assets",552340,12/31/24,02/19/25,4,"KPMG LLP",187,"KPMG LLP Chartered Accountants",85,Saskatoon,A9,SASKATCHEWAN,Canada,6-K,2025-02-20,,"CAMECO CORP",1009001,"=""CCJ""","2121 11TH ST W",,SASKATOON,Z4,CANADA,Canada,,,"=""1090""","Metal Mining",212221,"Gold Ore Mining",34,51,12/31/24,"22,370,686,976",12/31/24,"2,180,345,000","119,484,000","4,397,501,000","6,888,477,000"
45444,"Deferred income taxes","Assessment of recoverability of deferred tax assets",558328,12/31/24,02/19/25,4,"KPMG LLP",187,"KPMG LLP Chartered Accountants",85,Saskatoon,A9,SASKATCHEWAN,Canada,40-F,2025-03-21,,"CAMECO CORP",1009001,"=""CCJ""","2121 11TH ST W",,SASKATOON,Z4,CANADA,Canada,,,"=""1090""","Metal Mining",212221,"Gold Ore Mining",34,51,12/31/24,"22,370,686,976",12/31/24,"2,180,345,000","119,484,000","4,397,501,000","6,888,477,000"
39507,"Other intangible assets","Indefinite-Lived Intangible Assets Impairment Test for Certain Trademarks",541350,07/28/24,09/19/24,1,"PricewaterhouseCoopers LLP",,,,Philadelphia,PA,PENNSYLVANIA,"US Mid Atlantic",10-K,2024-09-19,,"CAMPBELL'S Co",16732,"=""CPB""","CAMPBELL PL",,CAMDEN,NJ,"NEW JERSEY","US Mid Atlantic",,,"=""2000""","Food and Kindred Products",311999,"All Other Miscellaneous Food Manufacturing",34,48,07/30/24,"14,220,121,088",07/28/24,"9,636,000,000","567,000,000","-5,997,000,000","15,235,000,000"
39508,"Business combinations","Acquisition of Sovos Brands – Valuation of the Rao’s Trademark",541350,07/28/24,09/19/24,1,"PricewaterhouseCoopers LLP",,,,Philadelphia,PA,PENNSYLVANIA,"US Mid Atlantic",10-K,2024-09-19,,"CAMPBELL'S Co",16732,"=""CPB""","CAMPBELL PL",,CAMDEN,NJ,"NEW JERSEY","US Mid Atlantic",,,"=""2000""","Food and Kindred Products",311999,"All Other Miscellaneous Food Manufacturing",34,48,07/30/24,"14,220,121,088",07/28/24,"9,636,000,000","567,000,000","-5,997,000,000","15,235,000,000"
43883,"Revenue from customer contracts","Revenue Recognition — Chargebacks related to Extended Service Contracts and Other Insurance Products - Refer to Note 1 to the consolidated financial statements",554715,12/31/24,02/28/25,3,"Deloitte & Touche LLP",,,,Chicago,IL,ILLINOIS,"US Midwest",10-K,2025-02-28,,"Camping World Holdings, Inc.",1669779,"=""CWH""","2 MARRIOTT DRIVE",,LINCOLNSHIRE,IL,ILLINOIS,"US Midwest",,,"=""5500""","Retail-Auto Dealers & Gasoline Stations",441210,"Recreational Vehicle Dealers",34,21,01/02/25,"937,580,416",12/31/24,"6,099,974,000","-38,637,000","-426,930,000","4,863,277,000"
43884,"Long-lived assets","Long-Lived Asset Impairment — Refer to Notes 1 and 5 to the consolidated financial statements",554715,12/31/24,02/28/25,3,"Deloitte & Touche LLP",,,,Chicago,IL,ILLINOIS,"US Midwest",10-K,2025-02-28,,"Camping World Holdings, Inc.",1669779,"=""CWH""","2 MARRIOTT DRIVE",,LINCOLNSHIRE,IL,ILLINOIS,"US Midwest",,,"=""5500""","Retail-Auto Dealers & Gasoline Stations",441210,"Recreational Vehicle Dealers",34,21,01/02/25,"937,580,416",12/31/24,"6,099,974,000","-38,637,000","-426,930,000","4,863,277,000"
45234,Inventory,"Inventory Provision Estimate",558024,12/31/24,03/18/25,4,"KPMG LLP",220,"Somekh Chaikin Certified Public Accountants (Israel)",1057,"Tel Aviv",L3,ISRAEL,Foreign,20-F,2025-03-19,,"CAMTEK LTD",1109138,"=""CAMT""","INDUSTRIAL ZONE",*,"MIGDAL HAEMEK",L3,ISRAEL,Foreign,,,"=""3827""","Optical Instruments and Lenses",333314,"Optical Instrument and Lens Manufacturing",34,81,12/31/24,"3,670,940,416",12/31/24,"429,234,000","118,515,000","461,533,000","892,042,000"
46606,"Going concern","Liquidity and Capital Resources",561312,12/31/24,04/14/25,2,"Ernst & Young LLP",222,"Kost Forer Gabbay & Kasierer",1281,"Tel Aviv",L3,ISRAEL,Foreign,20-F,2025-04-14,,"Can-Fite BioPharma Ltd.",1536196,"=""CANF""","26 BEN GURION STREET",,"RAMAT GAN",L3,ISRAEL,Foreign,,,"=""2834""","Pharmaceutical Preparations",325412,"Pharmaceutical Preparation Manufacturing",34,2,01/02/25,"8,113,696",12/31/24,"674,000","-7,880,000",,"9,120,000"
46832,"Revenue from customer contracts","Sufficiency of audit evidence on evaluating the timing of revenue recognition for products sales",561884,12/31/24,04/18/25,4,"KPMG LLP",355,"KPMG Huazhen LLP",1186,Beijing,F4,CHINA,Foreign,20-F,2025-04-18,,"Canaan Inc.",1780652,"=""CAN""","28 AYER RAJAH CRESCENT",#06-08,SINGAPORE,U0,SINGAPORE,Foreign,,,"=""6199""","Finance Services",334413,"Semiconductor and Related Device Manufacturing",34,2,12/31/24,"690,513,600",12/31/24,"269,324,000","-249,752,000","265,353,000","463,011,000"
38323,Inventory,"Inventory Obsolescence– Refer to Notes 2k, 3 and 10 to the financial statements",536261,03/31/24,05/15/24,3,"Deloitte & Touche LLP",468,"Deloitte LLP",1208,Toronto,A6,ONTARIO,Canada,20-F,2024-05-16,,"Canada Goose Holdings Inc.",1690511,"=""GOOS""","250 BOWIE AVENUE",,TORONTO,A6,ONTARIO,Canada,,,"=""2300""","Apparel & Other Finishd Prods of Fabrics & Similar Matl",315222,"Men's and Boys' Cut and Sew Suit, Coat, and Overcoat Manufacturing",34,12,03/31/24,"549,072,960",03/31/24,"985,600,000","42,900,000","155,900,000","1,094,800,000"
44991,"Other expenses","Determination of Shared Service Expense",557632,12/31/24,01/30/25,4,"KPMG LLP",187,"KPMG LLP Chartered Accountants",85,Toronto,A6,ONTARIO,Canada,"POS AM",2025-03-14,,"CANADIAN DERIVATIVES CLEARING CORP",319643,,"120 ADELAIDE STREET W","SUITE 300",TORONTO,A6,ONTARIO,Canada,,,"=""6200""","Security & Commodity Brokers, Dealers, Exchanges & Services",523140,"Commodity Contracts Brokerage",34,,,,,,,,
40168,"Allowance for credit losses","Allowance for credit losses",544936,10/31/24,12/04/24,2,"Ernst & Young LLP",192,"Ernst & Young LLP Chartered Accountants",1263,Toronto,A6,ONTARIO,Canada,40-F,2024-12-05,,"CANADIAN IMPERIAL BANK OF COMMERCE /CAN/",1045520,"=""CM""","81 BAY STREET","CIBC SQUARE",TORONTO,A6,ONTARIO,Canada,,,"=""6029""","Commercial Banks, NEC",522110,"Commercial Banking",34,63,10/29/24,"58,816,245,760",10/31/24,"16,934,000,000","5,104,000,000","36,200,000,000","747,505,000,000"
40169,"Derivatives and hedging","Fair value measurement of derivatives",544936,10/31/24,12/04/24,2,"Ernst & Young LLP",192,"Ernst & Young LLP Chartered Accountants",1263,Toronto,A6,ONTARIO,Canada,40-F,2024-12-05,,"CANADIAN IMPERIAL BANK OF COMMERCE /CAN/",1045520,"=""CM""","81 BAY STREET","CIBC SQUARE",TORONTO,A6,ONTARIO,Canada,,,"=""6029""","Commercial Banks, NEC",522110,"Commercial Banking",34,63,10/29/24,"58,816,245,760",10/31/24,"16,934,000,000","5,104,000,000","36,200,000,000","747,505,000,000"
40170,"Uncertain tax positions","Measurement of uncertain tax provisions",544936,10/31/24,12/04/24,2,"Ernst & Young LLP",192,"Ernst & Young LLP Chartered Accountants",1263,Toronto,A6,ONTARIO,Canada,40-F,2024-12-05,,"CANADIAN IMPERIAL BANK OF COMMERCE /CAN/",1045520,"=""CM""","81 BAY STREET","CIBC SQUARE",TORONTO,A6,ONTARIO,Canada,,,"=""6029""","Commercial Banks, NEC",522110,"Commercial Banking",34,63,10/29/24,"58,816,245,760",10/31/24,"16,934,000,000","5,104,000,000","36,200,000,000","747,505,000,000"
40686,"Deferred income taxes","Evaluation of income taxes",548192,12/31/24,02/04/25,4,"KPMG LLP",187,"KPMG LLP Chartered Accountants",85,Montreal,A8,QUEBEC,Canada,6-K,2025-02-04,,"CANADIAN NATIONAL RAILWAY CO",16868,"=""CNI""","935 DE LA GAUCHETIERE ST W",*,MONTREAL,A8,QUEBEC,Canada,,,"=""4011""","Railroads, Line-haul Operating",482111,"Line-Haul Railroads",34,102,12/31/24,,12/31/24,"11,959,066,473",,,"40,036,844,211"
40687,"Deferred and capitalized costs","Evaluation of capitalization of costs relating to track and railway infrastructure",548192,12/31/24,02/04/25,4,"KPMG LLP",187,"KPMG LLP Chartered Accountants",85,Montreal,A8,QUEBEC,Canada,6-K,2025-02-04,,"CANADIAN NATIONAL RAILWAY CO",16868,"=""CNI""","935 DE LA GAUCHETIERE ST W",*,MONTREAL,A8,QUEBEC,Canada,,,"=""4011""","Railroads, Line-haul Operating",482111,"Line-Haul Railroads",34,102,12/31/24,,12/31/24,"11,959,066,473",,,"40,036,844,211"
45659,"Business combinations","Acquisition of Chevron’s Assets - Valuation of Acquired Property, Plant and Equipment",558865,12/31/24,03/05/25,1,"PricewaterhouseCoopers LLP",191,"PricewaterhouseCoopers LLP Chartered Accountants",271,Calgary,A0,ALBERTA,Canada,40-F,2025-03-26,,"CANADIAN NATURAL RESOURCES LTD",1017413,"=""CNQ""","2500, 855 - 2ND STREET S.W.",,CALGARY,A0,ALBERTA,Canada,,,"=""1311""","Crude Petroleum and Natural Gas",211111,"Crude Petroleum and Natural Gas Extraction",34,31,12/31/24,"64,919,486,464",12/31/24,"24,792,000,000","4,246,000,000",,"59,351,000,000"
45660,"Proven and unproven reserves","The Impact of Crude Oil and Natural Gas Reserves on Property, Plant and Equipment Assets in the North America Exploration and Production Segment",558865,12/31/24,03/05/25,1,"PricewaterhouseCoopers LLP",191,"PricewaterhouseCoopers LLP Chartered Accountants",271,Calgary,A0,ALBERTA,Canada,40-F,2025-03-26,,"CANADIAN NATURAL RESOURCES LTD",1017413,"=""CNQ""","2500, 855 - 2ND STREET S.W.",,CALGARY,A0,ALBERTA,Canada,,,"=""1311""","Crude Petroleum and Natural Gas",211111,"Crude Petroleum and Natural Gas Extraction",34,31,12/31/24,"64,919,486,464",12/31/24,"24,792,000,000","4,246,000,000",,"59,351,000,000"
43346,"Pension and other post-employment benefits","Defined Benefit Pension",554012,12/31/24,02/27/25,2,"Ernst & Young LLP",192,"Ernst & Young LLP Chartered Accountants",1263,Calgary,A0,ALBERTA,Canada,10-K,2025-02-27,,"CANADIAN PACIFIC KANSAS CITY LTD/CN",16875,"=""CP""","7550 OGDEN DALE ROAD S.E.",,CALGARY,A0,ALBERTA,Canada,,,"=""4011""","Railroads, Line-haul Operating",482111,"Line-Haul Railroads",34,74,01/02/25,"68,768,849,920",12/31/24,"10,114,000,000","2,585,000,000","17,658,000,000","61,010,000,000"
47170,"Revenue from customer contracts","Revenue Recognition of Battery Energy Storage Solutions, Refer to Note 2 (y) and Note 21 to the Financial Statements",563461,12/31/24,04/30/25,3,"Deloitte & Touche LLP",499,"Deloitte Touche Tohmatsu Certified Public Accountants LLP",1113,Shanghai,F4,CHINA,Foreign,20-F,2025-04-30,,"Canadian Solar Inc.",1375877,"=""CSIQ""","4273 KING STREET EAST, SUITE 102",,KITCHENER,A6,ONTARIO,Canada,,,"=""3674""","Semiconductors and Related Devices",423690,"Other Electronic Parts and Equipment Merchant Wholesalers",34,12,01/02/25,"796,551,232",12/31/24,"5,993,409,000","36,051,000","3,032,308,000","13,511,550,000"
43357,Consolidation,"Investments in Unconsolidated Affiliates in Alight — Other-than-temporary impairment — Refer to Note B to the financial statements",554027,12/31/24,02/27/25,3,"Deloitte & Touche LLP",,,,"Las Vegas",NV,NEVADA,"US West",10-K,2025-02-27,,"Cannae Holdings, Inc.",1704720,"=""CNNE""","C/O CANNAE HOLDINGS, INC.","1701 VILLAGE CENTER CIRCLE","LAS VEGAS",NV,NEVADA,"US West",,,"=""5810""","Retail-Eating & Drinking Places",722110,"Full-Service Restaurants",34,20,01/02/25,"1,232,206,976",12/31/24,"452,500,000","-304,600,000","1,768,000,000","2,228,900,000"
39436,"Revenue from customer contracts","Revenue Recognition – Refer to Notes 2 and 11 to the financial statements",541092,06/30/24,09/10/24,3,"Deloitte & Touche LLP",,,,Atlanta,GA,GEORGIA,"US Southeast",10-K,2024-09-10,,"CANTALOUPE, INC.",896429,"=""CTLP""","101 LINDENWOOD DRIVE","SUITE 405",MALVERN,PA,PENNSYLVANIA,"US Mid Atlantic",,,"=""3578""","Calculating and Accounting Machines, Except Electronic Computers",332116,"Metal Stamping",34,7,07/02/24,"481,272,192",06/30/24,"268,596,000","11,993,000","64,937,000","335,568,000"
46045,"Real estate investments","Impairment of Real Estate Investments",559791,12/31/24,03/31/25,2,"Ernst & Young LLP",,,,"New York",NY,"NEW YORK","US Mid Atlantic",10-K,2025-03-31,,"Cantor Fitzgerald Income Trust, Inc.",1666244,,"110 EAST 59TH STREET",,"NEW YORK",NY,"NEW YORK","US Mid Atlantic",,,"=""6798""","Real Estate Investment Trusts",525990,"Other Financial Vehicles",34,,,,12/31/24,"95,537,590","-9,131,653","154,784,285","1,126,048,172"
46769,"Real estate investments","Impairment of Real Estate Investments",561730,12/31/24,03/31/25,2,"Ernst & Young LLP",,,,"New York",NY,"NEW YORK","US Mid Atlantic",424B3,2025-04-15,,"Cantor Fitzgerald Income Trust, Inc.",1666244,,"110 EAST 59TH STREET",,"NEW YORK",NY,"NEW YORK","US Mid Atlantic",,,"=""6798""","Real Estate Investment Trusts",525990,"Other Financial Vehicles",34,,,,12/31/24,"95,537,590","-9,131,653","154,784,285","1,126,048,172"
42097,"Allowance for credit losses","Allowance for credit losses – Credit Card",552250,12/31/24,02/20/25,2,"Ernst & Young LLP",,,,Tysons,VA,VIRGINIA,"US Mid Atlantic",10-K,2025-02-20,,"CAPITAL ONE FINANCIAL CORP",927628,"=""COF""","1680 CAPITAL ONE DRIVE",,MCLEAN,VA,VIRGINIA,"US Mid Atlantic",,,"=""6021""","National Commercial Banks",522291,"Consumer Lending",34,179,01/02/25,"68,179,714,048",12/31/24,"27,396,000,000","4,750,000,000","45,725,000,000","490,144,000,000"
40114,"Allowance for credit losses","Allowance for credit losses on loans evaluated on a collective basis",544578,09/30/24,11/27/24,4,"KPMG LLP",,,,"Kansas City",MO,MISSOURI,"US Southeast",10-K,2024-11-27,,"Capitol Federal Financial, Inc.",1490906,"=""CFFN""","700 S KANSAS AVENUE",,TOPEKA,KS,KANSAS,"US Midwest",,,"=""6035""","Savings Institutions, Federally Chartered",522110,"Commercial Banking",34,6,10/02/24,"744,653,248",09/30/24,"166,046,000","38,010,000",,"9,527,608,000"
38473,"Goodwill and intangible assets","Valuation of Goodwill and Indefinite-lived Intangible Assets",536684,03/30/24,05/29/24,2,"Ernst & Young LLP",,,,"New York",NY,"NEW YORK","US Mid Atlantic",10-K,2024-05-29,,"Capri Holdings Ltd",1530721,"=""CPRI""","90 WHITFIELD STREET","2ND FLOOR",LONDON,X0,"UNITED KINGDOM",Foreign,,,"=""3100""","Leather & Leather Products",424330,"Women's, Children's, and Infants' Clothing and Accessories Merchant Wholesalers",34,45,03/31/24,"5,283,322,368",03/30/24,"5,170,000,000","-229,000,000","-901,000,000","6,689,000,000"
39153,Goodwill,"Valuation of Goodwill",540030,06/30/24,08/14/24,2,"Ernst & Young LLP",,,,"Grandview Heights",OH,OHIO,"US Midwest",10-K,2024-08-14,,"CARDINAL HEALTH INC",721371,"=""CAH""","7000 CARDINAL PLACE",,DUBLIN,OH,OHIO,"US Midwest",,,"=""5122""","Drugs, Drug Proprietaries, and Druggists` Sundries",325412,"Pharmaceutical Preparation Manufacturing",34,98,06/30/24,"23,990,079,488",06/30/24,"226,827,000,000","852,000,000","-9,663,000,000","45,121,000,000"
39154,"Uncertain tax positions","Uncertain Tax Positions",540030,06/30/24,08/14/24,2,"Ernst & Young LLP",,,,"Grandview Heights",OH,OHIO,"US Midwest",10-K,2024-08-14,,"CARDINAL HEALTH INC",721371,"=""CAH""","7000 CARDINAL PLACE",,DUBLIN,OH,OHIO,"US Midwest",,,"=""5122""","Drugs, Drug Proprietaries, and Druggists` Sundries",325412,"Pharmaceutical Preparation Manufacturing",34,98,06/30/24,"23,990,079,488",06/30/24,"226,827,000,000","852,000,000","-9,663,000,000","45,121,000,000"
44715,"Revenue from customer contracts","Revenue – Refer to Note 2 and 6 to the consolidated financial statements",557166,12/31/24,03/12/25,3,"Deloitte & Touche LLP",,,,Atlanta,GA,GEORGIA,"US Southeast",10-K,2025-03-12,,"Cardlytics, Inc.",1666071,"=""CDLX""","675 PONCE DE LEON AVENUE, NE","SUITE 4100",ATLANTA,GA,GEORGIA,"US Southeast",,,"=""7370""","Services-Computer Programming, Data Processing, Etc.",518210,"Data Processing, Hosting, and Related Services",34,4,12/31/24,"190,163,472",12/31/24,"278,298,000","-189,304,000","-134,148,000","392,711,000"
44716,Goodwill,"Goodwill – Certain Reporting Units – Refer to Note 2 and Note 5 to the consolidated financial statements",557166,12/31/24,03/12/25,3,"Deloitte & Touche LLP",,,,Atlanta,GA,GEORGIA,"US Southeast",10-K,2025-03-12,,"Cardlytics, Inc.",1666071,"=""CDLX""","675 PONCE DE LEON AVENUE, NE","SUITE 4100",ATLANTA,GA,GEORGIA,"US Southeast",,,"=""7370""","Services-Computer Programming, Data Processing, Etc.",518210,"Data Processing, Hosting, and Related Services",34,4,12/31/24,"190,163,472",12/31/24,"278,298,000","-189,304,000","-134,148,000","392,711,000"
46277,"Revenue from customer contracts","Revenue - Refer to Note 2 and 6 to the consolidated financial statements",560536,12/31/24,03/12/25,3,"Deloitte & Touche LLP",,,,Atlanta,GA,GEORGIA,"US Southeast",ARS,2025-04-03,,"Cardlytics, Inc.",1666071,"=""CDLX""","675 PONCE DE LEON AVENUE, NE","SUITE 4100",ATLANTA,GA,GEORGIA,"US Southeast",,,"=""7370""","Services-Computer Programming, Data Processing, Etc.",518210,"Data Processing, Hosting, and Related Services",34,4,12/31/24,"190,163,472",12/31/24,"278,298,000","-189,304,000","-134,148,000","392,711,000"
46278,Goodwill,"Goodwill - Certain Reporting Units - Refer to Note 2 and Note 5 to the consolidated financial statements",560536,12/31/24,03/12/25,3,"Deloitte & Touche LLP",,,,Atlanta,GA,GEORGIA,"US Southeast",ARS,2025-04-03,,"Cardlytics, Inc.",1666071,"=""CDLX""","675 PONCE DE LEON AVENUE, NE","SUITE 4100",ATLANTA,GA,GEORGIA,"US Southeast",,,"=""7370""","Services-Computer Programming, Data Processing, Etc.",518210,"Data Processing, Hosting, and Related Services",34,4,12/31/24,"190,163,472",12/31/24,"278,298,000","-189,304,000","-134,148,000","392,711,000"
43728,"Revenue from customer contracts","Testing Services Revenue (non-Medicare) — Refer to Note 2 to the consolidated financial statements",554498,12/31/24,02/27/25,3,"Deloitte & Touche LLP",,,,"San Francisco",CA,CALIFORNIA,"US West",10-K,2025-02-28,,"CareDx, Inc.",1217234,"=""CDNA""","8000 MARINA BLVD","4TH FLOOR",BRISBANE,CA,CALIFORNIA,"US West",,,"=""8071""","Medical Laboratories",325413,"In-Vitro Diagnostic Substance Manufacturing",34,22,01/02/25,"1,154,200,960",12/31/24,"333,785,000","52,549,000","300,087,000","491,050,000"
40984,"Real estate investments","Impairment of Real Estate Investments, Assets Held for Sale, Net and Asset Sales — Refer to Notes 2 and 4 to the financial statements",550919,12/31/24,02/12/25,3,"Deloitte & Touche LLP",,,,"Costa Mesa",CA,CALIFORNIA,"US West",10-K,2025-02-12,,"CareTrust REIT, Inc.",1590717,"=""CTRE""","905 CALLE AMANECER, SUITE 300",,"SAN CLEMENTE",CA,CALIFORNIA,"US West",,,"=""6798""","Real Estate Investment Trusts",525990,"Other Financial Vehicles",34,27,12/31/24,"5,058,161,152",12/31/24,"228,261,000","125,080,000",,"3,437,016,000"
42002,"Goodwill and intangible assets","Impairment of Goodwill and Intangible Assets",552166,12/31/24,02/20/25,2,"Ernst & Young LLP",,,,Boston,MA,MASSACHUSETTS,"US New England",10-K,2025-02-20,,"CarGurus, Inc.",1494259,"=""CARG""","1001 BOYLSTON STREET","16TH FLOOR",BOSTON,MA,MASSACHUSETTS,"US New England",,,"=""7374""","Computer Processing and Data Preparation and Processing Services",518210,"Data Processing, Hosting, and Related Services",34,37,12/31/24,"3,252,153,856",12/31/24,"894,384,000","20,972,000","483,755,000","824,536,000"
42003,"Revenue from customer contracts","Revenue Recognition",552166,12/31/24,02/20/25,2,"Ernst & Young LLP",,,,Boston,MA,MASSACHUSETTS,"US New England",10-K,2025-02-20,,"CarGurus, Inc.",1494259,"=""CARG""","1001 BOYLSTON STREET","16TH FLOOR",BOSTON,MA,MASSACHUSETTS,"US New England",,,"=""7374""","Computer Processing and Data Preparation and Processing Services",518210,"Data Processing, Hosting, and Related Services",34,37,12/31/24,"3,252,153,856",12/31/24,"894,384,000","20,972,000","483,755,000","824,536,000"
41494,"Other intangible assets","Other Intangible Assets, Net – Henry Indefinite-Lived Trade Name — Refer to Notes 1 and 11 to the financial statements",551473,12/31/24,02/14/25,3,"Deloitte & Touche LLP",,,,Tempe,AZ,ARIZONA,"US Southwest",10-K,2025-02-14,,"CARLISLE COMPANIES INC",790051,"=""CSL""","16430 N. SCOTTSDALE RD.","SUITE 400",SCOTTSDALE,AZ,ARIZONA,"US Southwest",,,"=""3060""","Fabricated Rubber Products, NEC",326291,"Rubber Product Manufacturing for Mechanical Use",34,366,01/02/25,"16,605,718,528",12/31/24,"5,003,600,000","1,311,800,000","-519,600,000","5,816,600,000"
43314,"Equity investments and joint ventures","Measurement of principal equity method investments, including accrued performance allocations",553980,12/31/24,02/27/25,2,"Ernst & Young LLP",,,,Tysons,VA,VIRGINIA,"US Mid Atlantic",10-K,2025-02-27,,"Carlyle Group Inc.",1527166,"=""CG""","C/O THE CARLYLE GROUP","1001 PENNSYLVANIA AVENUE, N.W.",WASHINGTON,DC,"DISTRICT OF COLUMBIA","US Mid Atlantic",,,"=""6282""","Investment Advice",523120,"Securities Brokerage",34,51,01/02/25,"18,145,169,408",12/31/24,"4,739,900,000","1,686,000,000","4,972,800,000","23,103,500,000"
42832,"Other investments","Valuation of investments using significant unobservable inputs",553265,12/31/24,02/25/25,2,"Ernst & Young LLP",,,,Tysons,VA,VIRGINIA,"US Mid Atlantic",10-K,2025-02-25,,"Carlyle Secured Lending, Inc.",1544206,"=""CGBD""","ONE VANDERBILT AVENUE, SUITE 3400",,"NEW YORK",NY,"NEW YORK","US Mid Atlantic",,,,,525990,"Other Financial Vehicles",34,18,12/31/24,"912,749,248",12/31/24,"164,105,000","88,978,000",,"1,925,993,000"
45101,"Other investments","Valuation of investments using significant unobservable inputs",557978,12/31/24,02/25/25,2,"Ernst & Young LLP",,,,Tysons,VA,VIRGINIA,"US Mid Atlantic",424B3,2025-03-17,,"Carlyle Secured Lending, Inc.",1544206,"=""CGBD""","ONE VANDERBILT AVENUE, SUITE 3400",,"NEW YORK",NY,"NEW YORK","US Mid Atlantic",,,,,525990,"Other Financial Vehicles",34,18,12/31/24,"912,749,248",12/31/24,"164,105,000","88,978,000",,"1,925,993,000"
37515,"Allowance for credit losses","Assessment of the allowance for loan losses on core managed receivables",533238,02/29/24,04/15/24,4,"KPMG LLP",,,,Richmond,VA,VIRGINIA,"US Mid Atlantic",10-K,2024-04-15,,"CARMAX INC",1170010,"=""KMX""","12800 TUCKAHOE CREEK PARKWAY",,RICHMOND,VA,VIRGINIA,"US Mid Atlantic",,,"=""5500""","Retail-Auto Dealers & Gasoline Stations",423110,"Automobile and Other Motor Vehicle Merchant Wholesalers",34,77,02/27/24,"12,106,240,000",02/29/24,"26,536,040,000","479,204,000","5,932,482,000","27,196,797,000"
40593,"Other debt","Debt – Refer to Notes 2 and 5 to the Financial Statements",547755,11/30/24,01/27/25,3,"Deloitte & Touche LLP",,,,Miami,FL,FLORIDA,"US Southeast",10-K,2025-01-27,,"CARNIVAL CORP",815097,"=""CCL""","3655 NW 87TH AVE","PO BOX 1347",MIAMI,FL,FLORIDA,"US Southeast",,,"=""4400""","Water Transportation",483112,"Deep Sea Passenger Transportation",34,26,12/02/24,"29,996,744,704",11/30/24,"25,021,000,000","1,916,000,000","7,511,000,000","49,057,000,000"
40590,"Balance sheet classification of debt and equity","Debt – Refer to Notes 2 and 5 to the Financial Statements",547723,11/30/24,01/27/25,3,"Deloitte & Touche LLP",,,,Miami,FL,FLORIDA,"US Southeast",10-K,2025-01-27,,"CARNIVAL PLC",1125259,"=""CUK""","100 HARBOUR PARADE","CARNIVAL HOUSE",LONDON,X0,"UNITED KINGDOM",Foreign,,,"=""4400""","Water Transportation",483112,"Deep Sea Passenger Transportation",34,23,11/30/24,"3,329,117,184",11/30/24,"25,021,000,000","1,916,000,000","7,511,000,000","49,057,000,000"
39109,"Revenue from customer contracts","Revenue Recognition - Goods Transferred to the Customer",539991,06/30/24,08/13/24,1,"PricewaterhouseCoopers LLP",,,,Philadelphia,PA,PENNSYLVANIA,"US Mid Atlantic",10-K,2024-08-13,,"CARPENTER TECHNOLOGY CORP",17843,"=""CRS""","BNY MELLON BUILDING","1735 MARKET STREET, 15TH FL",PHILADELPHIA,PA,PENNSYLVANIA,"US Mid Atlantic",,,"=""3312""","Steel Works, Blast Furnaces (Including Coke Ovens), and Rolling Mills",331111,"Iron and Steel Mills",34,105,07/02/24,"5,220,278,272",06/30/24,"2,759,700,000","186,500,000","1,386,300,000","3,291,700,000"
40848,"Business combinations","Acquisition of the VCS Business - Valuation of Intangible Assets Acquired",550657,12/31/24,02/11/25,1,"PricewaterhouseCoopers LLP",,,,Miami,FL,FLORIDA,"US Southeast",10-K,2025-02-11,,"CARRIER GLOBAL Corp",1783180,"=""CARR""","13995 PASTEUR BOULEVARD",,"PALM BEACH GARDENS",FL,FLORIDA,"US Southeast",,,"=""3585""","Air-Conditioning and Warm Air Heating Equipment and Commercial and Industrial Refrigeration Equipment",333415,"Air-Conditioning and Warm Air Heating Equipment and Commercial and Industrial Refrigeration Equipment Man",34,68,12/31/24,"59,955,331,072",12/31/24,"22,486,000,000","5,604,000,000","-6,952,000,000","37,403,000,000"
48062,"Business combinations","Acquisition of the VCS Business - Valuation of Intangible Assets Acquired",569388,12/31/24,02/11/25,1,"PricewaterhouseCoopers LLP",,,,Miami,FL,FLORIDA,"US Southeast",8-K,2025-07-29,,"CARRIER GLOBAL Corp",1783180,"=""CARR""","13995 PASTEUR BOULEVARD",,"PALM BEACH GARDENS",FL,FLORIDA,"US Southeast",,,"=""3585""","Air-Conditioning and Warm Air Heating Equipment and Commercial and Industrial Refrigeration Equipment",333415,"Air-Conditioning and Warm Air Heating Equipment and Commercial and Industrial Refrigeration Equipment Man",34,68,12/31/24,"59,955,331,072",12/31/24,"22,486,000,000","5,604,000,000","-6,952,000,000","37,403,000,000"
43479,"Revenue from customer contracts","Revenue Recognition",554009,12/31/24,02/27/25,2,"Ernst & Young LLP",,,,Chicago,IL,ILLINOIS,"US Midwest",10-K,2025-02-27,,"Cars.com Inc.",1683606,"=""CARS""","300 S. RIVERSIDE PLAZA","SUITE 1000",CHICAGO,IL,ILLINOIS,"US Midwest",,,"=""7374""","Computer Processing and Data Preparation and Processing Services",518210,"Data Processing, Hosting, and Related Services",34,17,12/31/24,"1,115,896,064",12/31/24,"719,152,000","48,188,000","-217,484,000","1,111,865,000"
42943,"Revenue from customer contracts","Revenue Recognition - U.S. Wholesale",553076,12/28/24,02/25/25,1,"PricewaterhouseCoopers LLP",,,,Atlanta,GA,GEORGIA,"US Southeast",10-K,2025-02-25,,"CARTERS INC",1060822,"=""CRI""","PHIPPS TOWER","3438 PEACHTREE ROAD NE SUITE 1800",ATLANTA,GA,GEORGIA,"US Southeast",,,"=""2300""","Apparel & Other Finishd Prods of Fabrics & Similar Matl",424330,"Women's, Children's, and Infants' Clothing and Accessories Merchant Wholesalers",34,54,12/31/24,"1,953,115,648",12/28/24,"2,844,102,000","185,509,000","356,136,000","2,433,167,000"
42944,"Other intangible assets","Indefinite-Lived Intangible Asset Impairment Assessment - OshKosh Tradename",553076,12/28/24,02/25/25,1,"PricewaterhouseCoopers LLP",,,,Atlanta,GA,GEORGIA,"US Southeast",10-K,2025-02-25,,"CARTERS INC",1060822,"=""CRI""","PHIPPS TOWER","3438 PEACHTREE ROAD NE SUITE 1800",ATLANTA,GA,GEORGIA,"US Southeast",,,"=""2300""","Apparel & Other Finishd Prods of Fabrics & Similar Matl",424330,"Women's, Children's, and Infants' Clothing and Accessories Merchant Wholesalers",34,54,12/31/24,"1,953,115,648",12/28/24,"2,844,102,000","185,509,000","356,136,000","2,433,167,000"
42945,Goodwill,"Goodwill Impairment Assessment – Canada Reporting Unit",553076,12/28/24,02/25/25,1,"PricewaterhouseCoopers LLP",,,,Atlanta,GA,GEORGIA,"US Southeast",10-K,2025-02-25,,"CARTERS INC",1060822,"=""CRI""","PHIPPS TOWER","3438 PEACHTREE ROAD NE SUITE 1800",ATLANTA,GA,GEORGIA,"US Southeast",,,"=""2300""","Apparel & Other Finishd Prods of Fabrics & Similar Matl",424330,"Women's, Children's, and Infants' Clothing and Accessories Merchant Wholesalers",34,54,12/31/24,"1,953,115,648",12/28/24,"2,844,102,000","185,509,000","356,136,000","2,433,167,000"
44779,"Other contingent liabilities","Valuation of contingent value right",557315,12/31/24,03/13/25,2,"Ernst & Young LLP",,,,Boston,MA,MASSACHUSETTS,"US New England",10-K,2025-03-13,,"Cartesian Therapeutics, Inc.",1453687,"=""RNAC""","7495 NEW HORIZON WAY",,FREDERICK,MD,MARYLAND,"US Mid Atlantic",,,"=""2834""","Pharmaceutical Preparations",325414,"Biological Product (except Diagnostic) Manufacturing",34,17,01/02/25,"430,274,208",12/31/24,"38,913,000","-77,424,000","-54,965,000","435,023,000"
38686,Inventory,"Sufficiency of audit evidence over merchandise inventory quantities at store locations",537891,04/30/24,06/24/24,4,"KPMG LLP",,,,"Des Moines",IA,IOWA,"US Midwest",10-K,2024-06-24,,"CASEYS GENERAL STORES INC",726958,"=""CASY""","PO BOX 3001",,ANKENY,IA,IOWA,"US Midwest",,,"=""5500""","Retail-Auto Dealers & Gasoline Stations",447110,"Gasoline Stations with Convenience Stores",34,317,05/02/24,"11,718,900,736",04/30/24,"14,862,913,000","501,972,000","2,362,718,000","6,347,433,000"
46172,"Long-lived assets","Assessment of impairment triggering events related to the manufacturing asset group",560163,12/31/24,03/31/25,4,"KPMG LLP",355,"KPMG Huazhen LLP",1186,Beijing,F4,CHINA,Foreign,20-F,2025-03-31,Yes,"CASI Pharmaceuticals, Inc.",1962738,"=""CASI""","1701-1702, CHINA CENTRAL OFFICE TOWER 1","NO. 81 JIANGUO ROAD, CHAOYANG DISTRICT",BEIJING,F4,CHINA,Foreign,,,"=""2834""","Pharmaceutical Preparations",325412,"Pharmaceutical Preparation Manufacturing",34,3,12/31/24,"43,844,004",12/31/24,"28,537,000","-39,661,007",,"53,674,000"
44273,"Allowance for credit losses","Assessment of the qualitative risk factors related to the allowance for credit losses on loans evaluated on a collective basis",555532,12/31/24,03/05/25,4,"KPMG LLP",,,,"Saint Louis",MO,MISSOURI,"US Southeast",10-K,2025-03-05,,"CASS INFORMATION SYSTEMS INC",708781,"=""CASS""","12444 POWERSCOURT DRIVE",,"ST. LOUIS",MO,MISSOURI,"US Southeast",,,"=""7389""","Business Services, NEC",541512,"Computer Systems Design Services",34,40,01/02/25,"544,262,400",12/31/24,"199,189,000","19,168,000","202,671,000","2,395,081,000"
44208,"Other contingent liabilities","Loss Contingencies",554936,12/31/24,03/03/25,2,"Ernst & Young LLP",,,,Austin,TX,TEXAS,"US Southwest",10-K,2025-03-03,,"CASSAVA SCIENCES INC",1069530,"=""SAVA""","6801 N CAPITAL OF TEXAS HIGHWAY","BUILDING 1; SUITE 300",AUSTIN,TX,TEXAS,"US Southwest",,,"=""2834""","Pharmaceutical Preparations",325412,"Pharmaceutical Preparation Manufacturing",34,2,12/31/24,"113,759,504",12/31/24,,"-24,342,000","145,667,000","157,533,000"
43319,"Revenue from customer contracts","Measurement of test revenue",553843,12/31/24,02/27/25,4,"KPMG LLP",,,,Houston,TX,TEXAS,"US Southwest",10-K,2025-02-27,,"CASTLE BIOSCIENCES INC",1447362,"=""CSTL""","505 S FRIENDSWOOD DRIVE","SUITE 401",FRIENDSWOOD,TX,TEXAS,"US Southwest",,,"=""8071""","Medical Laboratories",621511,"Medical Laboratories",34,27,12/31/24,"759,077,120",12/31/24,"332,069,000","18,245,000","349,606,000","531,235,000"
47387,"Shareholder valuation","Mezzanine Equity – Refer to Note 14(c) to the financial statements",564987,12/31/24,05/14/25,3,"Deloitte & Touche LLP",615,"Deloitte Certified Public Accountants SA",1163,Athens,J3,GREECE,Foreign,20-F,2025-05-14,,"Castor Maritime Inc.",1720161,"=""CTRM""","CHRISTODOULOU CHATZIPAVLOU 223","HAWAII ROYAL GARDENS, APART. 16",LIMASSOL,G4,CYPRUS,Foreign,,,"=""4412""","Deep Sea Foreign Transportation of  Freight",483111,"Deep Sea Freight Transportation",34,3,01/02/25,"27,634,428",12/31/24,"66,243,379","14,618,996","532,869,390","797,376,921"
41569,"Allowance for credit losses","Customer Finance Receivables Allowance for Credit Losses",551482,12/31/24,02/14/25,1,"PricewaterhouseCoopers LLP",,,,Nashville,TN,TENNESSEE,"US Southeast",10-K,2025-02-14,,"CATERPILLAR FINANCIAL SERVICES CORP",764764,,"2120 WEST END AVE",,NASHVILLE,TN,TENNESSEE,"US Southeast",18230,"CATERPILLAR INC","=""6159""","Miscellaneous Business Credit Institutions",522320,"Financial Transactions Processing, Reserve, and Clearinghouse Activities",34,,,,12/31/24,"2,127,000,000","598,000,000",,"34,084,000,000"
41459,"Warranty liabilities","Product Warranty Liability",551443,12/31/24,02/14/25,1,"PricewaterhouseCoopers LLP",,,,Dallas,TX,TEXAS,"US Southwest",10-K,2025-02-14,,"CATERPILLAR INC",18230,"=""CAT""","5205 N. O'CONNOR BOULEVARD","SUITE 100",IRVING,TX,TEXAS,"US Southwest",,,"=""3531""","Construction Machinery and Equipment",333120,"Construction Machinery Manufacturing",34,360,01/02/25,"173,697,843,200",12/31/24,"64,809,000,000","10,792,000,000","13,851,000,000","87,764,000,000"
43969,"Allowance for credit losses","Allowance for loan losses for loans evaluated on a collective basis modeled using an econometric methodology.",554822,12/31/24,02/28/25,4,"KPMG LLP",,,,"Los Angeles",CA,CALIFORNIA,"US West",10-K,2025-02-28,,"CATHAY GENERAL BANCORP",861842,"=""CATY""","777 N BROADWAY",,"LOS ANGELES",CA,CALIFORNIA,"US West",,,"=""6022""","State Commercial Banks",522110,"Commercial Banking",34,47,01/02/25,"3,353,455,616",12/31/24,"692,219,000","285,979,000","2,466,673,000","23,054,681,000"
36712,"Long-lived assets","Impairment of Long-Lived Assets - Store Location Asset Groupings",531383,02/03/24,03/27/24,1,"PricewaterhouseCoopers LLP",,,,Charlotte,NC,"NORTH CAROLINA","US Southeast",10-K,2024-03-27,,"CATO CORP",18255,"=""CATO""","8100 DENMARK ROAD",,CHARLOTTE,NC,"NORTH CAROLINA","US Southeast",,,"=""5621""","Women`s Clothing Stores",448120,"Women's Clothing Stores",34,7,02/05/24,"129,692,416",02/03/24,"708,059,000","-23,941,000",,"486,817,000"
42995,"Deferred income taxes","Income Taxes - Realizability of Deferred Tax Assets — Refer to Notes 2 and 7 to the financial statements",553570,12/29/24,02/25/25,3,"Deloitte & Touche LLP",,,,McLean,VA,VIRGINIA,"US Mid Atlantic",10-K,2025-02-26,,"CAVA GROUP, INC.",1639438,"=""CAVA""","14 RIDGE SQUARE NW","SUITE 500",WASHINGTON,DC,"DISTRICT OF COLUMBIA","US Mid Atlantic",,,"=""5812""","Eating and Drinking Places",813910,"Business Associations",34,113,12/31/24,"12,982,490,112",12/29/24,"963,713,000","130,319,000","692,267,000","1,169,669,000"
43925,"Business combinations","Acquisition date fair value of client list intangible asset",554806,12/31/24,02/28/25,4,"KPMG LLP",,,,Cleveland,OH,OHIO,"US Midwest",10-K,2025-02-28,,"CBIZ, Inc.",944148,"=""CBZ""","5959 ROCKSIDE WOODS BLVD N.","SUITE 600",INDEPENDENCE,OH,OHIO,"US Midwest",,,"=""7389""","Business Services, NEC",561499,"All Other Business Support Services",34,81,01/02/25,"4,073,249,280",12/31/24,"1,813,472,000","41,038,000","-1,165,487,000","4,470,883,000"
44109,"Real estate investments","Real Estate Assets – Change in Management’s Intent — Refer to Note 2 to the financial statements",555086,12/31/24,03/03/25,3,"Deloitte & Touche LLP",,,,Atlanta,GA,GEORGIA,"US Southeast",10-K,2025-03-03,,"CBL & ASSOCIATES PROPERTIES INC",910612,"=""CBL""","2030 HAMILTON PLACE BVLD, SUITE 500","CBL CENTER",CHATTANOOGA,TN,TENNESSEE,"US Southeast",915140,"CBL & ASSOCIATES LIMITED PARTNERSHIP","=""6798""","Real Estate Investment Trusts",525990,"Other Financial Vehicles",34,30,01/02/25,"918,173,248",12/31/24,"515,561,000","58,970,000","-23,861,000","2,747,191,000"
42329,"Uncertain tax positions","Evaluation of unrecognized tax benefits",552511,12/31/24,02/21/25,4,"KPMG LLP",,,,"Kansas City",MO,MISSOURI,"US Southeast",10-K,2025-02-21,,"Cboe Global Markets, Inc.",1374310,"=""CBOE""","433 WEST VAN BUREN STREET",,CHICAGO,IL,ILLINOIS,"US Midwest",,,"=""6200""","Security & Commodity Brokers, Dealers, Exchanges & Services",523120,"Securities Brokerage",34,196,01/02/25,"20,564,482,048",12/31/24,"4,094,500,000","764,900,000","-221,500,000","7,789,100,000"
41550,"Uncertain tax positions","Assessment of gross unrecognized tax benefits",551351,12/31/24,02/14/25,4,"KPMG LLP",,,,Chicago,IL,ILLINOIS,"US Midwest",10-K,2025-02-14,,"CBRE GROUP, INC.",1138118,"=""CBRE""","2121 NORTH PEARL STREET","SUITE 300",DALLAS,TX,TEXAS,"US Southwest",,,"=""6500""","Real Estate",531390,"Other Activities Related to Real Estate",34,130,01/02/25,"39,751,737,344",12/31/24,"35,767,000,000","968,000,000","492,000,000","24,383,000,000"
42862,"Revenue from customer contracts","Revenue Recognition - Refer to Notes 2 and 4 to the financial statements",553299,12/31/24,02/25/25,3,"Deloitte & Touche LLP",,,,Chicago,IL,ILLINOIS,"US Midwest",10-K,2025-02-25,,"CCC Intelligent Solutions Holdings Inc.",1818201,"=""CCC""","167 N. GREEN STREET","9TH FLOOR",CHICAGO,IL,ILLINOIS,"US Midwest",,,"=""7372""","Prepackaged Software",511210,"Software Publishers",34,12,12/31/24,"7,380,599,296",12/31/24,"944,800,000","26,145,000","-332,500,000","3,183,218,000"
40653,"Revenue from customer contracts","Testing of residential and SMB revenue",548003,12/31/24,01/30/25,4,"KPMG LLP",,,,"Saint Louis",MO,MISSOURI,"US Southeast",10-K,2025-01-31,,"CCO HOLDINGS LLC",1271833,,"400 WASHINGTON BLVD.",,STAMFORD,CT,CONNECTICUT,"US New England",1091667,"CHARTER COMMUNICATIONS, INC. /MO/","=""4841""","Cable and Other Pay Television Services",517212,"Cellular and Other Wireless Telecommunications",34,,,,12/31/24,"55,085,000,000","7,406,000,000","-58,876,000,000","148,371,000,000"
42271,"Revenue from customer contracts","Revenue recognition – Professional Services",552431,12/31/24,02/21/25,2,"Ernst & Young LLP",,,,Chicago,IL,ILLINOIS,"US Midwest",10-K,2025-02-21,,"CDW Corp",1402057,"=""CDW""","200 N MILWAUKEE AVENUE",,"VERNON HILLS",IL,ILLINOIS,"US Midwest",,,"=""5961""","Catalog and Mail-Order Houses",423430,"Computer and Computer Peripheral Equipment and Software Merchant Wholesalers",34,170,01/02/25,"22,658,887,680",12/31/24,"20,998,700,000","1,077,800,000","-3,624,300,000","14,678,400,000"
42275,"Uncertain tax positions","Evaluation of the Company's application of multinational income tax regulations",552417,12/31/24,02/21/25,4,"KPMG LLP",,,,Dallas,TX,TEXAS,"US Southwest",10-K,2025-02-21,,"Celanese Corp",1306830,"=""CE""","222 W. LAS COLINAS BLVD., SUITE 900N",,IRVING,TX,TEXAS,"US Southwest",,,"=""2820""","Plastic Mail, Synth Resin/Rubber, Cellulos (No Glass)",424690,"Other Chemical and Allied Products Merchant Wholesalers",34,68,01/02/25,"7,479,142,400",12/31/24,"10,280,000,000","-1,522,000,000","-3,853,000,000","22,857,000,000"
42276,Goodwill,"Assessment of goodwill for impairment",552417,12/31/24,02/21/25,4,"KPMG LLP",,,,Dallas,TX,TEXAS,"US Southwest",10-K,2025-02-21,,"Celanese Corp",1306830,"=""CE""","222 W. LAS COLINAS BLVD., SUITE 900N",,IRVING,TX,TEXAS,"US Southwest",,,"=""2820""","Plastic Mail, Synth Resin/Rubber, Cellulos (No Glass)",424690,"Other Chemical and Allied Products Merchant Wholesalers",34,68,01/02/25,"7,479,142,400",12/31/24,"10,280,000,000","-1,522,000,000","-3,853,000,000","22,857,000,000"
44031,Goodwill,"Valuation of goodwill for the capital equipment reporting unit",554927,12/31/24,02/28/25,4,"KPMG LLP",187,"KPMG LLP Chartered Accountants",85,Toronto,A6,ONTARIO,Canada,10-K,2025-03-03,,"CELESTICA INC",1030894,"=""CLS""","5140 YONGE STREET, SUITE 1900",,TORONTO,A6,ONTARIO,Canada,,,"=""3672""","Printed Circuit Boards",334412,"Bare Printed Circuit Board Manufacturing",34,93,01/02/25,"11,070,878,720",12/31/24,"9,646,000,000","428,000,000","1,247,500,000","5,988,200,000"
43579,"Research and development expenses","Research and Development Expenses and Accruals Related to Clinical Research Organization and Contract Development and Manufacturing Organization Activities",554240,12/31/24,02/27/25,1,"PricewaterhouseCoopers LLP",,,,Boston,MA,MASSACHUSETTS,"US New England",10-K,2025-02-27,,"Celldex Therapeutics, Inc.",744218,"=""CLDX""","53 FRONTAGE ROAD","SUITE 220",HAMPTON,NJ,"NEW JERSEY","US Mid Atlantic",,,"=""2835""","In Vitro and In Vivo Diagnostic Substances",325414,"Biological Product (except Diagnostic) Manufacturing",34,25,12/31/24,"1,677,284,864",12/31/24,"7,020,000","-157,863,000","719,815,000","792,340,000"
45146,"Revenue from customer contracts","Revenue recognition",557849,12/31/24,03/18/25,2,"Ernst & Young LLP",222,"Kost Forer Gabbay & Kasierer",1281,"Tel Aviv",L3,ISRAEL,Foreign,20-F,2025-03-18,,"Cellebrite DI Ltd.",1854587,"=""CLBT""","94 SHLOMO SHMELZER ROAD",,"PETAH TIKVA",L3,ISRAEL,Foreign,,,"=""7372""","Prepackaged Software",511210,"Software Publishers",34,22,12/31/24,"4,732,994,048",12/31/24,"401,203,000","-283,007,000","296,000,000","690,567,000"
44766,"Equity investments and joint ventures","Initial Accounting for the Warrant Exercise Inducement Transaction — Refer to “Note 6. Stockholders’ Equity” to the financial statements",557290,12/31/24,03/12/25,3,"Deloitte & Touche LLP",,,,Morristown,NJ,"NEW JERSEY","US Mid Atlantic",10-K,2025-03-13,Yes,"Cellectar Biosciences, Inc.",1279704,"=""CLRB""","100 CAMPUS DRIVE",,"FLORHAM PARK",NJ,"NEW JERSEY","US Mid Atlantic",,,"=""2834""","Pharmaceutical Preparations",325412,"Pharmaceutical Preparation Manufacturing",34,0,12/31/24,"13,823,962",12/31/24,,"-44,581,446",,"25,474,047"
44924,"Revenue from customer contracts","Identification of performance obligations in the joint research and collaboration agreement",557516,12/31/24,03/13/25,4,"KPMG LLP",66,"KPMG SA",1253,Paris,I0,FRANCE,Foreign,20-F,2025-03-14,,"Cellectis S.A.",1627281,"=""CLLS""","8 RUE DE LA CROIX JARRY",,"PARIS, LLE-DE-FRANCE",I0,FRANCE,Foreign,,,"=""2836""","Biological Products, Except Diagnostic Substances",325414,"Biological Product (except Diagnostic) Manufacturing",34,2,01/02/25,"129,869,672",12/31/24,"49,217,000","-36,762,000","129,918,000","383,545,000"
44033,"Sales return and allowances","Accrued Promotional Allowances",554994,12/31/24,03/03/25,2,"Ernst & Young LLP",,,,"Boca Raton",FL,FLORIDA,"US Southeast",10-K,2025-03-03,,"Celsius Holdings, Inc.",1341766,"=""CELH""","ALALIPSEOS 30","APT 25",THESSALONIKI,FL,FLORIDA,"US Southeast",,,"=""2086""","Bottled and Canned Soft Drinks and Carbonated Waters",312111,"Soft Drink Manufacturing",34,27,01/02/25,"6,392,855,552",12/31/24,"1,355,630,000","145,074,000","1,140,622,000","1,766,881,000"
47092,"Other contingent liabilities","Receivable related to Claims from Tax Authority",563204,12/31/24,04/29/25,2,"Ernst & Young LLP",846,"Tanaka Valdivia & Asociados Sociedad Civil de Responsabilidad Limitada",1315,Lima,R5,PERU,Foreign,20-F,2025-04-29,,"CEMENTOS PACASMAYO SAA",1221029,"=""CPAC""","CALLE LA COLONIA 150","URBANIZACION EL VIVERO SURCO","LIMA 33",R5,PERU,Foreign,,,"=""3241""","Cement, Hydraulic",327310,"Cement Manufacturing",34,6,01/02/25,"473,884,928",12/31/24,"526,517,000","52,936,000","304,784,000","842,728,000"
47054,Goodwill,"Evaluation of the goodwill impairment analysis for a group of cash generating units",563039,12/31/24,04/25/25,4,"KPMG LLP",75,"KPMG Cardenas Dosal SC",1141,Monterrey,O5,MEXICO,Foreign,20-F,2025-04-28,,"CEMEX SAB DE CV",1076378,"=""CX""","AVE. CONSTITUTION 444 PTE",,MONTEREY,O5,MEXICO,Foreign,,,"=""3241""","Cement, Hydraulic",327310,"Cement Manufacturing",34,6,01/02/25,"8,245,305,344",12/31/24,"16,200,000,000","939,000,000","2,815,000,000","27,299,000,000"
47055,"Property, plant and equipment","Evaluation of impairment indicators related to a cement plant",563039,12/31/24,04/25/25,4,"KPMG LLP",75,"KPMG Cardenas Dosal SC",1141,Monterrey,O5,MEXICO,Foreign,20-F,2025-04-28,,"CEMEX SAB DE CV",1076378,"=""CX""","AVE. CONSTITUTION 444 PTE",,MONTEREY,O5,MEXICO,Foreign,,,"=""3241""","Cement, Hydraulic",327310,"Cement Manufacturing",34,6,01/02/25,"8,245,305,344",12/31/24,"16,200,000,000","939,000,000","2,815,000,000","27,299,000,000"
40101,"Other contingent liabilities","Legal Matters and Contingencies - Opioid Lawsuits and Investigations",544462,09/30/24,11/26/24,2,"Ernst & Young LLP",,,,Philadelphia,PA,PENNSYLVANIA,"US Mid Atlantic",10-K,2024-11-26,,"Cencora, Inc.",1140859,"=""COR""","1 WEST FIRST AVENUE",,CONSHOHOCKEN,PA,PENNSYLVANIA,"US Mid Atlantic",,,"=""5122""","Drugs, Drug Proprietaries, and Druggists` Sundries",424210,"Drugs and Druggists' Sundries Merchant Wholesalers",34,222,10/02/24,"43,673,456,640",09/30/24,"293,958,599,000","1,509,120,000","-12,673,135,000","67,101,667,000"
40102,Goodwill,"Goodwill Impairment Evaluation of the PharmaLex Reporting Unit",544462,09/30/24,11/26/24,2,"Ernst & Young LLP",,,,Philadelphia,PA,PENNSYLVANIA,"US Mid Atlantic",10-K,2024-11-26,,"Cencora, Inc.",1140859,"=""COR""","1 WEST FIRST AVENUE",,CONSHOHOCKEN,PA,PENNSYLVANIA,"US Mid Atlantic",,,"=""5122""","Drugs, Drug Proprietaries, and Druggists` Sundries",424210,"Drugs and Druggists' Sundries Merchant Wholesalers",34,222,10/02/24,"43,673,456,640",09/30/24,"293,958,599,000","1,509,120,000","-12,673,135,000","67,101,667,000"
41990,"Research and development expenses","Impact of Crude Oil and Natural Gas Reserves (together, the Reserves) on Property, Plant and Equipment (PP&E), Net within the Oil Sands and Offshore Segments",552150,12/31/24,02/19/25,1,"PricewaterhouseCoopers LLP",191,"PricewaterhouseCoopers LLP Chartered Accountants",271,Calgary,A0,ALBERTA,Canada,40-F,2025-02-20,,"CENOVUS ENERGY INC.",1475260,"=""CVE""","225 - 6 AVENUE S.W.","P.O. BOX 766",CALGARY,A0,ALBERTA,Canada,,,"=""1311""","Crude Petroleum and Natural Gas",211111,"Crude Petroleum and Natural Gas Extraction",34,15,01/02/25,"28,658,311,168",12/31/24,"37,740,000,000","2,185,000,000","18,656,000,000","39,312,000,000"
41991,"Property, plant and equipment","Impairment Assessment of PP&E for each of the Wood River, Toledo, and Lima CGUs within the U.S. Refining Segment",552150,12/31/24,02/19/25,1,"PricewaterhouseCoopers LLP",191,"PricewaterhouseCoopers LLP Chartered Accountants",271,Calgary,A0,ALBERTA,Canada,40-F,2025-02-20,,"CENOVUS ENERGY INC.",1475260,"=""CVE""","225 - 6 AVENUE S.W.","P.O. BOX 766",CALGARY,A0,ALBERTA,Canada,,,"=""1311""","Crude Petroleum and Natural Gas",211111,"Crude Petroleum and Natural Gas Extraction",34,15,01/02/25,"28,658,311,168",12/31/24,"37,740,000,000","2,185,000,000","18,656,000,000","39,312,000,000"
41611,"Insurance contract liabilities","Evaluation of the estimated medical claims liability",551696,12/31/24,02/18/25,4,"KPMG LLP",,,,"Saint Louis",MO,MISSOURI,"US Southeast",10-K,2025-02-18,,"CENTENE CORP",1071739,"=""CNC""","7700 FORSYTH BLVD.",,"ST LOUIS",MO,MISSOURI,"US Southeast",,,"=""6324""","Hospital and Medical Service Plans",524114,"Direct Health and Medical Insurance Carriers",34,61,01/02/25,"30,549,381,120",12/31/24,"163,071,000,000","3,305,000,000","3,453,000,000","82,445,000,000"
41612,"Other contingent liabilities","Evaluation of the estimated Affordable Care Act risk adjustment accruals",551696,12/31/24,02/18/25,4,"KPMG LLP",,,,"Saint Louis",MO,MISSOURI,"US Southeast",10-K,2025-02-18,,"CENTENE CORP",1071739,"=""CNC""","7700 FORSYTH BLVD.",,"ST LOUIS",MO,MISSOURI,"US Southeast",,,"=""6324""","Hospital and Medical Service Plans",524114,"Direct Health and Medical Insurance Carriers",34,61,01/02/25,"30,549,381,120",12/31/24,"163,071,000,000","3,305,000,000","3,453,000,000","82,445,000,000"
42214,"Regulatory assets and liabilities","Impact of Rate Regulation on the Financial Statements — Refer to Note 7 to the financial statements",552155,12/31/24,02/20/25,3,"Deloitte & Touche LLP",,,,Houston,TX,TEXAS,"US Southwest",10-K,2025-02-20,,"CENTERPOINT ENERGY HOUSTON ELECTRIC LLC",48732,,"1111 LOUISIANA",,HOUSTON,TX,TEXAS,"US Southwest",1130310,"CENTERPOINT ENERGY INC","=""4911""","Electric Services",221121,"Electric Bulk Power Transmission and Control",34,,,,12/31/24,"3,939,000,000","546,000,000",,"19,712,000,000"
41947,"Regulatory assets and liabilities","Impact of Rate Regulation on the Financial Statements — Refer to Note 7 to the financial statements",552118,12/31/24,02/20/25,3,"Deloitte & Touche LLP",,,,Houston,TX,TEXAS,"US Southwest",10-K,2025-02-20,,"CENTERPOINT ENERGY INC",1130310,"=""CNP""","1111 LOUISIANA ST.",,HOUSTON,TX,TEXAS,"US Southwest",,,"=""4911""","Electric Services",221122,"Electric Power Distribution",34,32,12/31/24,"20,679,307,264",12/31/24,"8,643,000,000","1,019,000,000","6,723,000,000","43,768,000,000"
42252,"Regulatory assets and liabilities","Impact of Rate Regulation on the Financial Statements — Refer to Note 7 to the financial statements",552061,12/31/24,02/20/25,3,"Deloitte & Touche LLP",,,,Houston,TX,TEXAS,"US Southwest",10-K,2025-02-20,,"CENTERPOINT ENERGY RESOURCES CORP",1042773,,"1111 LOUISIANA ST",,HOUSTON,TX,TEXAS,"US Southwest",1130310,"CENTERPOINT ENERGY INC","=""4923""","Natural Gas Transmission and Distribution",221210,"Natural Gas Distribution",34,,,,12/31/24,"3,925,000,000","540,000,000","4,807,000,000","16,425,000,000"
42239,"Revenue from customer contracts","Assessment of the Accounting and Valuation of the Additional Royal Gold Agreement",552354,12/31/24,02/20/25,4,"KPMG LLP",187,"KPMG LLP Chartered Accountants",85,Toronto,A6,ONTARIO,Canada,6-K,2025-02-20,,"Centerra Gold Inc.",1854640,"=""CGAU""","1 UNIVERSITY AVENUE, SUITE 1800",,TORONTO,A6,ONTARIO,Canada,,,"=""1040""","Metal Mining",212221,"Gold Ore Mining",34,6,01/02/25,"1,269,278,080",12/31/24,"1,214,503,000","80,394,000",,"2,265,133,000"
45919,"Revenue from customer contracts","Assessment of the Accounting and Valuation of the Additional Royal Gold Agreement",559582,12/31/24,02/20/25,4,"KPMG LLP",187,"KPMG LLP Chartered Accountants",85,Toronto,A6,ONTARIO,Canada,40-F,2025-03-28,,"Centerra Gold Inc.",1854640,"=""CGAU""","1 UNIVERSITY AVENUE, SUITE 1800",,TORONTO,A6,ONTARIO,Canada,,,"=""1040""","Metal Mining",212221,"Gold Ore Mining",34,6,01/02/25,"1,269,278,080",12/31/24,"1,214,503,000","80,394,000",,"2,265,133,000"
40120,"Revenue from customer contracts","Net Sales - Revenue Recognition for Consignment Arrangements — Refer to Note 1 to the financial statements",544536,09/28/24,11/27/24,3,"Deloitte & Touche LLP",,,,"San Francisco",CA,CALIFORNIA,"US West",10-K,2024-11-27,,"CENTRAL GARDEN & PET CO",887733,"=""CENT""","1340 TREAT BOULEVARD","SUITE 600","WALNUT CREEK",CA,CALIFORNIA,"US West",,,"=""5190""","Wholesale-Miscellaneous Nondurable Goods",424910,"Farm Supplies Merchant Wholesalers",34,36,09/30/24,"404,000,512",09/28/24,"3,200,460,000","107,983,000","531,013,000","3,553,439,000"
47100,"Other investments","Improvements to Investment in airport concessions and major maintenance disbursements — Refer to Notes 10 and 16 to the consolidated financial statements.",563209,12/31/24,04/29/25,3,"Deloitte & Touche LLP",127,"Galaz Yamazaki Ruiz Urquiza SC",1153,"Mexico City",O5,MEXICO,Foreign,20-F,2025-04-29,,"Central North Airport Group",1378239,"=""OMAB""","AEROPUERTO INTERNACIONAL DE MONTERREY",,APODACA,NY,"NEW YORK","US Mid Atlantic",,,"=""4581""","Airports, Flying Fields, and Airport Terminal Services",488119,"Other Airport Operations",34,70,01/02/25,"2,958,668,032",12/31/24,"724,914,000","237,401,000",,"1,309,738,000"
46966,"Long-lived assets","Impairment of property, plant and equipment and intangible assets",562688,12/31/24,04/25/25,2,"Ernst & Young LLP",912,"Pistrelli Henry Martin y Asociados SA",1449,"Buenos Aires",C1,ARGENTINA,Foreign,20-F,2025-04-25,,"CENTRAL PUERTO S.A.",1717161,"=""CEPU""","AV. T&#1086;MAS ALVA EDISON 2701",,"BUENOS AIRES",C1,ARGENTINA,Foreign,,,"=""4911""","Electric Services",221112,"Fossil Fuel Electric Power Generation",34,16,01/02/25,"2,373,986,816",12/31/24,"715,975,000","59,412,000","1,716,134,000","2,582,014,000"
