"CAM Key","CAM Topic","CAM Company Title","Audit Opinion Key","Year Ended Date","Signature Date","Auditor Key",Auditor,"Auditor Affiliate Key","Auditor Affiliate","Auditor Affiliate PCAOB","Auditor City","Auditor State Code","Auditor State Name","Auditor State Region",Source,"Source Date","Going Concern",Company,"CIK Code",Ticker,"Bus Street 1","Bus Street 2",City,"State Code","State Name","State Region","Parent CIK","Parent Name","SIC Code","SIC Description","NAICS Code","NAICS Description","Filer Act","Stock Price ($)","Stock Price Date","Market Cap ($)","Financials Date","Revenue ($)","Earnings ($)","Book Value ($)","Assets ($)"
48001,Inventory,"Assessment of the write-down of inventories",568882,05/31/25,07/21/25,4,"KPMG LLP",,,,Chicago,IL,ILLINOIS,"US Midwest",10-K,2025-07-22,,"AAR CORP",1750,"=""AIR""","1100 N WOOD DALE RD",,"WOOD DALE",IL,ILLINOIS,"US Midwest",,,"=""3720""","Aircraft & Parts",334613,"Magnetic and Optical Recording Media Manufacturing",34,62,06/02/25,"2,247,822,592",05/31/25,"2,780,500,000","12,500,000","461,200,000","2,844,600,000"
46229,"Long-lived assets","Impairment of Long-Lived Assets – Stores",559659,02/01/25,03/31/25,1,"PricewaterhouseCoopers LLP",,,,Columbus,OH,OHIO,"US Midwest",10-K,2025-03-31,,"ABERCROMBIE & FITCH CO /DE/",1018840,"=""ANF""","6301 FITCH PATH",,"NEW ALBANY",OH,OHIO,"US Midwest",,,"=""5651""","Family Clothing Stores",448140,"Family Clothing Stores",34,116,02/03/25,"5,820,563,968",02/01/25,"4,948,587,000","566,223,000",,"3,299,887,000"
45272,"Other contingent liabilities","Gain Contingency - Refer to Note 12 to the financial statements",558203,02/01/25,03/20/25,3,"Deloitte & Touche LLP",,,,Houston,TX,TEXAS,"US Southwest",10-K,2025-03-20,,"Academy Sports & Outdoors, Inc.",1817358,"=""ASO""","1800 NORTH MASON ROAD",,KATY,TX,TEXAS,"US Southwest",,,"=""5940""","Retail-Miscellaneous Shopping Goods Stores",451110,"Sporting Goods Stores",34,51,02/03/25,"3,534,394,112",02/01/25,"5,933,450,000","418,447,000","563,108,000","4,900,963,000"
48620,"Revenue from customer contracts","Estimated costs to complete certain technology integration consulting services contracts",573851,08/31/25,10/10/25,4,"KPMG LLP",,,,Chicago,IL,ILLINOIS,"US Midwest",10-K,2025-10-10,,"Accenture plc",1467373,"=""ACN""","1 GRAND CANAL SQUARE","GRAND CANAL HARBOUR",DUBLIN,L2,IRELAND,Foreign,,,"=""7389""","Business Services, NEC",541611,"Administrative Management and General Management Consulting Services",34,256,09/02/25,"174,283,554,816",08/31/25,"69,672,977,000","7,678,433,000","6,248,275,000","65,394,897,000"
48621,"Uncertain tax positions","Unrecognized tax benefits",573851,08/31/25,10/10/25,4,"KPMG LLP",,,,Chicago,IL,ILLINOIS,"US Midwest",10-K,2025-10-10,,"Accenture plc",1467373,"=""ACN""","1 GRAND CANAL SQUARE","GRAND CANAL HARBOUR",DUBLIN,L2,IRELAND,Foreign,,,"=""7389""","Business Services, NEC",541611,"Administrative Management and General Management Consulting Services",34,256,09/02/25,"174,283,554,816",08/31/25,"69,672,977,000","7,678,433,000","6,248,275,000","65,394,897,000"
48682,"Business combinations","Acquisition of QSC, LLC – Valuation of Developed Technology",574498,08/31/25,10/27/25,2,"Ernst & Young LLP",,,,Atlanta,GA,GEORGIA,"US Southeast",10-K,2025-10-27,,"ACUITY INC. (DE)",1144215,"=""AYI""","1170 PEACHTREE STREET NE","SUITE 1200",ATLANTA,GA,GEORGIA,"US Southeast",,,"=""3640""","Electric Lighting & Wiring Equipment",335110,"Electric Lamp Bulb and Part Manufacturing",34,333,09/02/25,"10,213,309,440",08/31/25,"4,345,600,000","396,600,000","130,400,000","4,755,200,000"
48841,Goodwill,"Interim and Annual Goodwill Impairment Assessments",575754,09/30/25,11/18/25,1,"PricewaterhouseCoopers LLP",,,,Detroit,MI,MICHIGAN,"US Midwest",10-K,2025-11-18,,"Adient plc",1670541,"=""ADNT""","25 NORTH WALL QUAY","DUBLIN 1",DUBLIN,L2,IRELAND,Foreign,,,"=""3714""","Motor Vehicle Parts and Accessories",336399,"All Other Motor Vehicle Parts Manufacturing",34,25,10/02/25,"2,019,773,824",09/30/25,"14,535,000,000","-281,000,000","-265,000,000","8,954,000,000"
48132,Goodwill,"Goodwill Impairment Assessment – Ross University School of Medicine (“RUSM”) Reporting Unit",569870,06/30/25,08/07/25,1,"PricewaterhouseCoopers LLP",,,,Chicago,IL,ILLINOIS,"US Midwest",10-K,2025-08-07,,"Adtalem Global Education Inc.",730464,"=""ATGE""","233 S. WACKER DRIVE","SUITE 800",CHICAGO,IL,ILLINOIS,"US Midwest",,,"=""8200""","Services-Educational Services",611519,"Other Technical and Trade Schools",34,127,06/30/25,"4,574,173,184",06/30/25,"1,788,290,000","237,065,000","-293,111,000","2,752,352,000"
47409,"Business combinations","Acquisition of Orenco - Valuation of Customer Relationships and Developed Technology Intangibles - Refer to Note 4 to the financial statements",565116,03/31/25,05/15/25,3,"Deloitte & Touche LLP",,,,Columbus,OH,OHIO,"US Midwest",10-K,2025-05-15,,"ADVANCED DRAINAGE SYSTEMS, INC.",1604028,"=""WMS""","4024 GREEN STRIPE LANE",,HILLIARD,OH,OHIO,"US Midwest",,,"=""3086""","Plastics Foam Products",326122,"Plastics Pipe and Pipe Fitting Manufacturing",34,109,03/31/25,"8,427,546,112",03/31/25,"2,904,245,000","450,172,000","449,805,000","3,690,360,000"
48857,"Revenue from customer contracts","Revenue Recognition - Contract cost and claim recovery estimates",575819,09/30/25,11/18/25,2,"Ernst & Young LLP",,,,Dallas,TX,TEXAS,"US Southwest",10-K,2025-11-19,,AECOM,868857,"=""ACM""","13355 NOEL ROAD","SUITE 400",DALLAS,TX,TEXAS,"US Southwest",,,"=""8711""","Engineering Services",541611,"Administrative Management and General Management Consulting Services",34,130,09/30/25,"17,193,646,080",09/30/25,"16,139,622,000","561,774,000","-1,391,319,000","12,200,249,000"
47788,"Revenue from customer contracts","Revenue Recognition — Contract Estimates on Select Contracts - Refer to Note 1 to the financial statements",567400,04/30/25,06/24/25,3,"Deloitte & Touche LLP",,,,"Los Angeles",CA,CALIFORNIA,"US West",10-K,2025-06-25,,"AeroVironment Inc",1368622,"=""AVAV""","241 18TH STREET SOUTH, SUITE 650",,ARLINGTON,VA,VIRGINIA,"US Mid Atlantic",,,"=""3721""",Aircraft,336411,"Aircraft Manufacturing",34,152,04/30/25,"4,283,094,272",04/30/25,"820,627,000","43,619,000","581,015,000","1,120,567,000"
48313,"Allowance for credit losses","Allowance for Credit Losses — Refer to Notes 2 and 4 to the financial statements",571038,06/30/25,08/28/25,3,"Deloitte & Touche LLP",,,,"San Francisco",CA,CALIFORNIA,"US West",10-K,2025-08-28,,"Affirm Holdings, Inc.",1820953,"=""AFRM""","650 CALIFORNIA STREET",,"SAN FRANCISCO",CA,CALIFORNIA,"US West",,,"=""6141""","Personal Credit Institutions",522320,"Financial Transactions Processing, Reserve, and Clearinghouse Activities",34,69,06/30/25,"19,661,934,592",06/30/25,"1,616,190,000","52,183,000","2,521,918,000","11,154,929,000"
48879,"Revenue from customer contracts","Revenue Recognition – On-site Customer Contracts – Refer to Notes 1 and 7 to the Financial Statements",575849,09/30/25,11/20/25,3,"Deloitte & Touche LLP",,,,Philadelphia,PA,PENNSYLVANIA,"US Mid Atlantic",10-K,2025-11-20,,"Air Products & Chemicals, Inc.",2969,"=""APD""","1940 AIR PRODUCTS BLVD.",,ALLENTOWN,PA,PENNSYLVANIA,"US Mid Atlantic",,,"=""2810""","Industrial Inorganic Chemicals",325120,"Industrial Gas Manufacturing",34,271,10/02/25,"60,223,016,960",09/30/25,"12,147,400,000","-394,500,000","13,767,500,000","41,059,500,000"
47837,"Other investments","Redeemable non-controlling interest – valuation of Contrail Aviation Support, LLC — Refer to Notes 1 and 4 to the financial statements",567582,03/31/25,06/27/25,3,"Deloitte & Touche LLP",,,,Minneapolis,MN,MINNESOTA,"US Midwest",10-K,2025-06-27,,"AIR T INC",353184,"=""AIRT""","11020 DAVID TAYLOR DRIVE","SUITE 305",CHARLOTTE,NC,"NORTH CAROLINA","US Southeast",,,"=""4513""","Air Courier Services",492110,Couriers,34,18,04/02/25,"48,630,340",03/31/25,"291,850,000","-6,140,000","-16,724,000","173,778,000"
48172,Inventory,"Inventories, net - valuation of inventories - Refer to Notes 1 and 4 to the financial statements",570241,03/31/25,06/27/25,3,"Deloitte & Touche LLP",,,,Minneapolis,MN,MINNESOTA,"US Midwest",10-K/A,2025-08-12,,"AIR T INC",353184,"=""AIRT""","11020 DAVID TAYLOR DRIVE","SUITE 305",CHARLOTTE,NC,"NORTH CAROLINA","US Southeast",,,"=""4513""","Air Courier Services",492110,Couriers,34,18,04/02/25,"48,630,340",03/31/25,"291,850,000","-6,140,000","-16,724,000","173,778,000"
46901,"Other income taxes","Accounting for Income Tax",562326,02/28/25,04/23/25,2,"Ernst & Young LLP",,,,Stamford,CT,CONNECTICUT,"US New England",10-K,2025-04-23,,"Aircastle LTD",1362988,"=""AYR""","C/O AIRCASTLE ADVISOR LLC","201 TRESSER BLVD, SUITE 400",STAMFORD,CT,CONNECTICUT,"US New England",,,"=""7359""","Equipment Rental and Leasing, NEC",532411,"Commercial Air, Rail, and Water Transportation Equipment Rental and Leasing",34,,,,02/28/25,"820,975,000","123,613,000",,"8,510,164,000"
46856,"Other contingent liabilities","Self-Insurance Liabilities — Refer to Note 1 to the financial statements",562103,02/22/25,04/21/25,3,"Deloitte & Touche LLP",,,,Boise,ID,IDAHO,"US West",10-K,2025-04-21,,"Albertsons Companies, Inc.",1646972,"=""ACI""","250 PARKCENTER BLVD.",,BOISE,ID,IDAHO,"US West",,,"=""5411""","Grocery Stores",445110,"Supermarkets and Other Grocery (except Convenience) Stores",34,20,02/24/25,"11,836,720,128",02/22/25,"80,390,900,000","958,600,000","-133,100,000","26,755,700,000"
47827,Goodwill,"Impairment assessment on goodwill relating to a reporting unit under Hujing Digital Media and Entertainment Group",567471,03/31/25,06/26/25,1,"PricewaterhouseCoopers LLP",94,"PricewaterhouseCoopers Zhong Tian LLP",1424,Shanghai,F4,CHINA,Foreign,20-F,2025-06-26,,"Alibaba Group Holding Ltd",1577552,"=""BABA""","26/F TOWER ONE","TIMES SQUARE, 1 MATHESON STREET","CAUSEWAY BAY",K3,"HONG KONG",Foreign,,,"=""7389""","Business Services, NEC",518210,"Data Processing, Hosting, and Related Services",33,130,04/02/25,"333,008,994,304",03/31/25,"137,395,000,000","17,942,000,000","102,757,000,000","248,801,000,000"
47686,Goodwill,"Impairment test of goodwill",566854,03/31/25,06/12/25,4,"KPMG LLP",187,"KPMG LLP Chartered Accountants",85,Montreal,A8,QUEBEC,Canada,40-F,2025-06-12,,"Alithya Group inc",1734520,"=""ALYAF""","700 RENE-LEVESQUE WEST BOULEVARD","SUITE 400",MONTREAL,A8,QUEBEC,Canada,,,"=""7370""","Services-Computer Programming, Data Processing, Etc.",541512,"Computer Systems Design Services",34,1,03/31/25,"107,676,096",03/31/25,"328,978,000","900,000","-49,540,000","295,974,000"
47687,"Revenue from customer contracts","Revenue recognition for fixed-fee and time and material arrangements applying the input method",566854,03/31/25,06/12/25,4,"KPMG LLP",187,"KPMG LLP Chartered Accountants",85,Montreal,A8,QUEBEC,Canada,40-F,2025-06-12,,"Alithya Group inc",1734520,"=""ALYAF""","700 RENE-LEVESQUE WEST BOULEVARD","SUITE 400",MONTREAL,A8,QUEBEC,Canada,,,"=""7370""","Services-Computer Programming, Data Processing, Etc.",541512,"Computer Systems Design Services",34,1,03/31/25,"107,676,096",03/31/25,"328,978,000","900,000","-49,540,000","295,974,000"
47504,"Sales return and allowances","Revenue Recognition – Sales Allowance",565564,03/28/25,05/22/25,1,"PricewaterhouseCoopers LLP",,,,Boston,MA,MASSACHUSETTS,"US New England",10-K,2025-05-22,,"ALLEGRO MICROSYSTEMS, INC.",866291,"=""ALGM""","955 PERIMETER ROAD",,MANCHESTER,NH,"NEW HAMPSHIRE","US New England",,,"=""3674""","Semiconductors and Related Devices",334413,"Semiconductor and Related Device Manufacturing",34,27,03/26/25,"4,943,757,312",03/28/25,"725,006,000","-73,010,000","464,965,000","1,420,961,000"
48312,Inventory,"Inventories — Excess and Obsolete Inventory Reserve — Refer to Note 1 to the financial statements",571042,06/30/25,08/28/25,3,"Deloitte & Touche LLP",,,,"San Jose",CA,CALIFORNIA,"US West",10-K,2025-08-28,,"ALPHA & OMEGA SEMICONDUCTOR Ltd",1387467,"=""AOSL""","475 OAKMEAD PARKWAY",,SUNNYVALE,CA,CALIFORNIA,"US West",,,"=""3674""","Semiconductors and Related Devices",334413,"Semiconductor and Related Device Manufacturing",34,28,07/02/25,"824,649,472",06/30/25,"696,162,000","-96,976,000","822,063,000","1,034,303,000"
48347,"Research and development expenses","Research and development tax incentive receivable",571096,06/30/25,08/29/25,1,"PricewaterhouseCoopers LLP",89,PricewaterhouseCoopers,1379,Melbourne,C3,AUSTRALIA,Foreign,20-F,2025-08-29,,"ALTERITY THERAPEUTICS LTD",1131343,"=""ATHE""","LEVEL 3, 460 BOURKE STREET",,MELBOURNE,C3,AUSTRALIA,Foreign,,,"=""2834""","Pharmaceutical Preparations",325412,"Pharmaceutical Preparation Manufacturing",34,4,07/02/25,"35,345,084",06/30/25,,"-7,961,091",,"30,163,418"
45837,"Other income taxes","Accounting for Income Taxes",559393,01/31/25,03/28/25,1,"PricewaterhouseCoopers LLP",,,,"San Jose",CA,CALIFORNIA,"US West",10-K,2025-03-28,,"AMBARELLA INC",1280263,"=""AMBA""","3001 TASMAN DRIVE",,"SANTA CLARA",CA,CALIFORNIA,"US West",,,"=""3674""","Semiconductors and Related Devices",334413,"Semiconductor and Related Device Manufacturing",34,76,01/29/25,"3,163,510,272",01/31/25,"284,865,000","-117,126,000","210,508,000","688,968,000"
48212,"Business combinations","Acquisition of Berry Global Group, Inc. – Valuation of Customer Relationships",570419,06/30/25,08/15/25,1,"PricewaterhouseCoopers LLP",119,"PricewaterhouseCoopers AG",1358,Zurich,V8,SWITZERLAND,Foreign,10-K,2025-08-15,,"Amcor plc",1748790,"=""AMCR""","83 TOWER ROAD NORTH",,"WARMLEY, BRISTOL",X0,"UNITED KINGDOM",Foreign,,,"=""3990""","Miscellaneous Manufacturing Industries",322221,"Coated and Laminated Packaging Paper and Plastics Film Manufacturing",34,10,07/02/25,"14,005,376,000",06/30/25,"15,009,000,000","511,000,000","-6,951,000,000","37,066,000,000"
48927,"Revenue from customer contracts","Revenue recognition related to the cost-based input method for certain fixed-price contracts",576065,10/03/25,11/25/25,2,"Ernst & Young LLP",,,,Tysons,VA,VIRGINIA,"US Mid Atlantic",10-K,2025-11-25,,"Amentum Holdings, Inc.",2011286,"=""AMTM""","4800 WESTFIELDS BOULEVARD","SUITE 400",CHANTILLY,VA,VIRGINIA,"US Mid Atlantic",,,"=""7389""","Business Services, NEC",0,,34,25,10/01/25,"6,122,148,864",10/03/25,"14,393,000,000","66,000,000","-3,153,000,000","11,460,000,000"
48478,"Discontinued operations","Valuation of Held for Sale Assets",572391,06/30/25,09/18/25,4,"KPMG LLP",,,,Portland,OR,OREGON,"US West",10-K,2025-09-18,Yes,"AMERICAN BATTERY TECHNOLOGY Co",1576873,"=""ABAT""","100 WASHINGTON STREET","SUITE 100",RENO,NV,NEVADA,"US West",,,"=""1400""","Mining & Quarrying of Nonmetallic Minerals (No Fuels)",212393,"Other Chemical and Fertilizer Mineral Mining",34,2,06/30/25,"157,785,600",06/30/25,"4,290,224","-46,762,625","69,832,329","84,457,791"
45273,"Long-lived assets","Retail Store Long-Lived Asset Impairment",558204,02/01/25,03/20/25,2,"Ernst & Young LLP",,,,Pittsburgh,PA,PENNSYLVANIA,"US Mid Atlantic",10-K,2025-03-20,,"AMERICAN EAGLE OUTFITTERS INC",919012,"=""AEO""","77 HOT METAL STREET",,PITTSBURGH,PA,PENNSYLVANIA,"US Mid Atlantic",,,"=""5651""","Family Clothing Stores",448140,"Family Clothing Stores",34,16,02/03/25,"2,977,577,728",02/01/25,"5,328,652,000","329,380,000","1,499,332,000","3,830,775,000"
47736,"Allowance for credit losses","Allowance for expected credit losses on retail loans",567121,03/31/25,06/18/25,4,"KPMG LLP",,,,"Los Angeles",CA,CALIFORNIA,"US West",10-K,2025-06-18,,"AMERICAN HONDA FINANCE CORP",864270,,"1919 TORRANCE BLVD.",,TORRANCE,CA,CALIFORNIA,"US West",715153,"HONDA MOTOR CO LTD","=""6141""","Personal Credit Institutions",522291,"Consumer Lending",34,,,,03/31/25,"6,897,000,000","1,110,000,000",,"88,969,000,000"
47737,Leases,"Estimated early termination losses on operating lease assets",567121,03/31/25,06/18/25,4,"KPMG LLP",,,,"Los Angeles",CA,CALIFORNIA,"US West",10-K,2025-06-18,,"AMERICAN HONDA FINANCE CORP",864270,,"1919 TORRANCE BLVD.",,TORRANCE,CA,CALIFORNIA,"US West",715153,"HONDA MOTOR CO LTD","=""6141""","Personal Credit Institutions",522291,"Consumer Lending",34,,,,03/31/25,"6,897,000,000","1,110,000,000",,"88,969,000,000"
47738,Leases,"Estimated end of term residual values of leased vehicles",567121,03/31/25,06/18/25,4,"KPMG LLP",,,,"Los Angeles",CA,CALIFORNIA,"US West",10-K,2025-06-18,,"AMERICAN HONDA FINANCE CORP",864270,,"1919 TORRANCE BLVD.",,TORRANCE,CA,CALIFORNIA,"US West",715153,"HONDA MOTOR CO LTD","=""6141""","Personal Credit Institutions",522291,"Consumer Lending",34,,,,03/31/25,"6,897,000,000","1,110,000,000",,"88,969,000,000"
47794,"Revenue from customer contracts","Timing of Revenue Recognition",567411,04/30/25,06/25/25,2,"Ernst & Young LLP",,,,Richmond,VA,VIRGINIA,"US Mid Atlantic",10-K,2025-06-25,,"AMERICAN WOODMARK CORP",794619,"=""AMWD""","3102 SHAWNEE DRIVE",,WINCHESTER,VA,VIRGINIA,"US Mid Atlantic",,,"=""2430""","Millwood, Veneer, Plywood, & Structural Wood Members",337110,"Wood Kitchen Cabinet and Countertop Manufacturing",34,60,05/02/25,"897,348,864",04/30/25,"1,709,585,000","99,456,000","148,386,000","1,570,569,000"
48922,"Revenue from customer contracts","Revenue Recognition – Measuring Price Protection Credits",576071,11/01/25,11/25/25,2,"Ernst & Young LLP",,,,Boston,MA,MASSACHUSETTS,"US New England",10-K,2025-11-25,,"ANALOG DEVICES INC",6281,"=""ADI""","ONE ANALOG WAY",,WILMINGTON,MA,MASSACHUSETTS,"US New England",,,"=""3674""","Semiconductors and Related Devices",334413,"Semiconductor and Related Device Manufacturing",34,234,11/03/25,"114,925,707,264",11/01/25,"11,019,707,000","2,267,342,000","-1,143,240,000","47,992,712,000"
47973,Inventory,"Inventories – Excess Quantities and Obsolescence — Refer to Notes 1 & 5",568693,05/31/25,07/18/25,3,"Deloitte & Touche LLP",,,,Boston,MA,MASSACHUSETTS,"US New England",10-K,2025-07-18,,"ANGIODYNAMICS INC",1275187,"=""ANGO""","14 PLAZA DRIVE",,LATHAM,NY,"NEW YORK","US Mid Atlantic",,,"=""3841""","Surgical and Medical Instruments and Apparatus",334510,"Electromedical and Electrotherapeutic Apparatus Manufacturing",34,10,06/02/25,"393,887,776",05/31/25,"292,498,000","-33,993,000","113,854,000","280,144,000"
46947,"Revenue from customer contracts","Net Sales — Revenue Recognition for Long-Term Contracts in the Architectural Services Segment — Refer to Notes 1, 2, and 16 to the consolidated financial statements",562452,03/01/25,04/24/25,3,"Deloitte & Touche LLP",,,,Minneapolis,MN,MINNESOTA,"US Midwest",10-K,2025-04-24,,"APOGEE ENTERPRISES, INC.",6845,"=""APOG""","4400 WEST 78TH STREET","SUITE 520",MINNEAPOLIS,MN,MINNESOTA,"US Midwest",,,"=""3231""","Glass Products, Made of Purchased Glass",327215,"Glass Product Manufacturing Made of Purchased Glass",34,46,03/03/25,"1,020,172,800",03/01/25,"1,360,994,000","85,052,000","123,706,000","1,175,269,000"
48707,"Uncertain tax positions","Uncertain Tax Positions",574814,09/27/25,10/31/25,2,"Ernst & Young LLP",,,,"San Jose",CA,CALIFORNIA,"US West",10-K,2025-10-31,,"Apple Inc.",320193,"=""AAPL""","ONE APPLE PARK WAY",,CUPERTINO,CA,CALIFORNIA,"US West",,,"=""3571""","Electronic Computers",334111,"Electronic Computer Manufacturing",34,255,09/30/25,"3,761,715,281,920",09/27/25,"416,161,000,000","112,010,000,000",,"359,241,000,000"
48202,Goodwill,"Goodwill - A reporting unit within the Engineered Solutions segment - Refer to Notes 1 and 5 to the financial statements",570414,06/30/25,08/15/25,3,"Deloitte & Touche LLP",,,,Cleveland,OH,OHIO,"US Midwest",10-K,2025-08-15,,"APPLIED INDUSTRIAL TECHNOLOGIES INC",109563,"=""AIT""","ONE APPLIED PLAZA",,CLEVELAND,OH,OHIO,"US Midwest",,,"=""5080""","Wholesale-Machinery, Equipment & Supplies",423830,"Industrial Machinery and Equipment Merchant Wholesalers",34,245,07/02/25,"9,337,972,736",06/30/25,"4,563,424,000","392,988,000","796,546,000","3,175,544,000"
48203,Inventory,"Inventory - Refer to Notes 1 and 4 to the financial statements",570414,06/30/25,08/15/25,3,"Deloitte & Touche LLP",,,,Cleveland,OH,OHIO,"US Midwest",10-K,2025-08-15,,"APPLIED INDUSTRIAL TECHNOLOGIES INC",109563,"=""AIT""","ONE APPLIED PLAZA",,CLEVELAND,OH,OHIO,"US Midwest",,,"=""5080""","Wholesale-Machinery, Equipment & Supplies",423830,"Industrial Machinery and Equipment Merchant Wholesalers",34,245,07/02/25,"9,337,972,736",06/30/25,"4,563,424,000","392,988,000","796,546,000","3,175,544,000"
48933,Goodwill,"Goodwill - FSS US Reporting Unit - Refer to Note 4 to the financial statements",576042,10/03/25,11/25/25,3,"Deloitte & Touche LLP",,,,Philadelphia,PA,PENNSYLVANIA,"US Mid Atlantic",10-K,2025-11-25,,Aramark,1584509,"=""ARMK""","2400 MARKET STREET",,PHILADELPHIA,PA,PENNSYLVANIA,"US Mid Atlantic",,,"=""5812""","Eating and Drinking Places",722310,"Food Service Contractors",34,38,10/01/25,"10,075,075,584",10/03/25,"18,506,299,000","326,394,000","-3,586,548,000","13,304,629,000"
47552,"Revenue from customer contracts","Revenue Recognition for Material Long-Term Revenue Contracts - Refer to Notes 1 and 4 to the Consolidated Financial Statements",565826,03/31/25,05/28/25,3,"Deloitte & Touche LLP",,,,"San Jose",CA,CALIFORNIA,"US West",20-F,2025-05-28,,"ARM HOLDINGS PLC /UK",1973239,"=""ARM""","110 FULBOURN ROAD",,CAMBRIDGE,X0,"UNITED KINGDOM",Foreign,,,"=""3674""","Semiconductors and Related Devices",334413,"Semiconductor and Related Device Manufacturing",34,108,04/02/25,"112,501,342,208",03/31/25,"4,007,000,000","792,000,000","5,068,000,000","8,932,000,000"
48938,"Other liabilities and provisions","Sufficiency of audit evidence over valuation of future royalty sales liability",576087,09/30/25,11/25/25,4,"KPMG LLP",,,,"San Diego",CA,CALIFORNIA,"US West",10-K,2025-11-25,,"ARROWHEAD PHARMACEUTICALS, INC.",879407,"=""ARWR""","177 E COLORADO BLVD","SUITE 700",PASADENA,CA,CALIFORNIA,"US West",,,"=""2834""","Pharmaceutical Preparations",541710,"Research and Development in the Physical, Engineering, and Life Sciences",34,34,09/30/25,"4,680,361,984",09/30/25,"829,448,000","-1,631,000","459,191,000","1,385,295,000"
48939,"Revenue from customer contracts","Evaluation of distinct performance obligations related to the license and collaboration agreement with Sarepta Therapeutics, Inc",576087,09/30/25,11/25/25,4,"KPMG LLP",,,,"San Diego",CA,CALIFORNIA,"US West",10-K,2025-11-25,,"ARROWHEAD PHARMACEUTICALS, INC.",879407,"=""ARWR""","177 E COLORADO BLVD","SUITE 700",PASADENA,CA,CALIFORNIA,"US West",,,"=""2834""","Pharmaceutical Preparations",541710,"Research and Development in the Physical, Engineering, and Life Sciences",34,34,09/30/25,"4,680,361,984",09/30/25,"829,448,000","-1,631,000","459,191,000","1,385,295,000"
45156,"Revenue from customer contracts","Revenue Recognition",557844,01/31/25,03/18/25,1,"PricewaterhouseCoopers LLP",,,,"San Francisco",CA,CALIFORNIA,"US West",10-K,2025-03-18,,"Asana, Inc.",1477720,"=""ASAN""","633 FOLSOM STREET","SUITE 100","SAN FRANCISCO",CA,CALIFORNIA,"US West",,,"=""7372""","Prepackaged Software",511210,"Software Publishers",34,22,01/29/25,"3,109,860,096",01/31/25,"723,876,000","-255,536,000",,"891,415,000"
48875,"Asset retirement and environmental obligations","Valuation of Environmental Remediation Reserves",575846,09/30/25,11/20/25,2,"Ernst & Young LLP",,,,"Grandview Heights",OH,OHIO,"US Midwest",10-K,2025-11-20,,"ASHLAND INC.",1674862,"=""ASH""","8145 BLAZER DRIVE",,WILMINGTON,DE,DELAWARE,"US Mid Atlantic",,,"=""5160""","Wholesale-Chemicals & Allied Products",424690,"Other Chemical and Allied Products Merchant Wholesalers",34,49,10/02/25,"2,218,567,168",09/30/25,"1,824,000,000","-845,000,000","636,000,000","4,611,000,000"
48876,"Other contingent liabilities","Valuation of Asbestos Litigation Reserves",575846,09/30/25,11/20/25,2,"Ernst & Young LLP",,,,"Grandview Heights",OH,OHIO,"US Midwest",10-K,2025-11-20,,"ASHLAND INC.",1674862,"=""ASH""","8145 BLAZER DRIVE",,WILMINGTON,DE,DELAWARE,"US Mid Atlantic",,,"=""5160""","Wholesale-Chemicals & Allied Products",424690,"Other Chemical and Allied Products Merchant Wholesalers",34,49,10/02/25,"2,218,567,168",09/30/25,"1,824,000,000","-845,000,000","636,000,000","4,611,000,000"
48877,Goodwill,"Evaluation of Goodwill Impairment for the Life Sciences and Specialty Additives Reporting Units",575846,09/30/25,11/20/25,2,"Ernst & Young LLP",,,,"Grandview Heights",OH,OHIO,"US Midwest",10-K,2025-11-20,,"ASHLAND INC.",1674862,"=""ASH""","8145 BLAZER DRIVE",,WILMINGTON,DE,DELAWARE,"US Mid Atlantic",,,"=""5160""","Wholesale-Chemicals & Allied Products",424690,"Other Chemical and Allied Products Merchant Wholesalers",34,49,10/02/25,"2,218,567,168",09/30/25,"1,824,000,000","-845,000,000","636,000,000","4,611,000,000"
48957,Goodwill,"Goodwill - Refer to Notes 1 and 12 to the financial statements",576152,09/30/25,11/25/25,3,"Deloitte & Touche LLP",,,,Chicago,IL,ILLINOIS,"US Midwest",10-K,2025-11-26,,"Atkore Inc.",1666138,"=""ATKR""","16100 SOUTH LATHROP AVENUE",,HARVEY,IL,ILLINOIS,"US Midwest",,,"=""3690""","Miscellaneous Electrical Machinery, Equipment & Supplies",335932,"Noncurrent-Carrying Wiring Device Manufacturing",34,63,09/30/25,"2,112,158,336",09/30/25,"2,850,378,000","-15,175,000","943,098,000","2,851,922,000"
48958,"Long-lived assets","Impairment of HDPE Asset Group — Refer to Notes 1, 12 and 14 to the financial statements",576152,09/30/25,11/25/25,3,"Deloitte & Touche LLP",,,,Chicago,IL,ILLINOIS,"US Midwest",10-K,2025-11-26,,"Atkore Inc.",1666138,"=""ATKR""","16100 SOUTH LATHROP AVENUE",,HARVEY,IL,ILLINOIS,"US Midwest",,,"=""3690""","Miscellaneous Electrical Machinery, Equipment & Supplies",335932,"Noncurrent-Carrying Wiring Device Manufacturing",34,63,09/30/25,"2,112,158,336",09/30/25,"2,850,378,000","-15,175,000","943,098,000","2,851,922,000"
48210,"Revenue from customer contracts","Revenue Recognition",570417,06/30/25,08/15/25,2,"Ernst & Young LLP",,,,"San Francisco",CA,CALIFORNIA,"US West",10-K,2025-08-15,,"Atlassian Corp",1650372,"=""TEAM""","350 BUSH STREET","FLOOR 13","SAN FRANCISCO",CA,CALIFORNIA,"US West",,,"=""7372""","Prepackaged Software",511210,"Software Publishers",34,207,07/02/25,"34,169,339,904",06/30/25,"5,215,304,000","-256,687,000","-203,631,000","6,041,970,000"
48816,"Regulatory assets and liabilities",Regulation,575631,09/30/25,11/14/25,2,"Ernst & Young LLP",,,,Dallas,TX,TEXAS,"US Southwest",10-K,2025-11-14,,"ATMOS ENERGY CORP",731802,"=""ATO""","1800 THREE LINCOLN CTR","5430 LBJ FREEWAY",DALLAS,TX,TEXAS,"US Southwest",,,"=""4924""","Natural Gas Distribution",221210,"Natural Gas Distribution",34,171,09/30/25,"27,587,801,088",09/30/25,"4,702,755,000","1,198,754,000","12,752,506,000","28,249,522,000"
47578,"Revenue from customer contracts","Estimated costs to complete on long-term revenue construction contracts",565902,03/31/25,05/29/25,2,"Ernst & Young LLP",192,"Ernst & Young LLP Chartered Accountants",1263,Toronto,A6,ONTARIO,Canada,40-F,2025-05-29,,"ATS Corp /ATS",1394832,"=""ATS""","730 FOUNTAIN STREET NORTH","BUILDING #3",CAMBRIDGE,A6,ONTARIO,Canada,,,"=""3569""","General Industrial Machinery and Equipment, NEC",333999,"All Other Miscellaneous General Purpose Machinery Manufacturing",34,25,03/31/25,"2,415,360,512",03/31/25,"1,760,145,000","-19,439,000","-310,807,000","3,211,306,000"
47579,"Business combinations","Valuation of acquired intangible assets in Paxiom Group business combination",565902,03/31/25,05/29/25,2,"Ernst & Young LLP",192,"Ernst & Young LLP Chartered Accountants",1263,Toronto,A6,ONTARIO,Canada,40-F,2025-05-29,,"ATS Corp /ATS",1394832,"=""ATS""","730 FOUNTAIN STREET NORTH","BUILDING #3",CAMBRIDGE,A6,ONTARIO,Canada,,,"=""3569""","General Industrial Machinery and Equipment, NEC",333999,"All Other Miscellaneous General Purpose Machinery Manufacturing",34,25,03/31/25,"2,415,360,512",03/31/25,"1,760,145,000","-19,439,000","-310,807,000","3,211,306,000"
47580,"Revenue from customer contracts","Estimated costs to complete on long-term revenue construction contracts",565903,03/31/25,05/29/25,2,"Ernst & Young LLP",192,"Ernst & Young LLP Chartered Accountants",1263,Toronto,A6,ONTARIO,Canada,40-F/A,2025-05-29,,"ATS Corp /ATS",1394832,"=""ATS""","730 FOUNTAIN STREET NORTH","BUILDING #3",CAMBRIDGE,A6,ONTARIO,Canada,,,"=""3569""","General Industrial Machinery and Equipment, NEC",333999,"All Other Miscellaneous General Purpose Machinery Manufacturing",34,25,03/31/25,"2,415,360,512",03/31/25,"1,760,145,000","-19,439,000","-310,807,000","3,211,306,000"
47581,"Business combinations","Valuation of acquired intangible assets in Paxiom Group business combination",565903,03/31/25,05/29/25,2,"Ernst & Young LLP",192,"Ernst & Young LLP Chartered Accountants",1263,Toronto,A6,ONTARIO,Canada,40-F/A,2025-05-29,,"ATS Corp /ATS",1394832,"=""ATS""","730 FOUNTAIN STREET NORTH","BUILDING #3",CAMBRIDGE,A6,ONTARIO,Canada,,,"=""3569""","General Industrial Machinery and Equipment, NEC",333999,"All Other Miscellaneous General Purpose Machinery Manufacturing",34,25,03/31/25,"2,415,360,512",03/31/25,"1,760,145,000","-19,439,000","-310,807,000","3,211,306,000"
47750,Goodwill,"Valuation of goodwill in the Plant Propagation cash generating unit",567114,03/31/25,06/17/25,2,"Ernst & Young LLP",192,"Ernst & Young LLP Chartered Accountants",1263,Vancouver,A1,"BRITISH COLUMBIA",Canada,40-F,2025-06-18,,"AURORA CANNABIS INC",1683541,"=""ACB""","2207 90B STREET SW",,EDMONTON,A0,ALBERTA,Canada,,,"=""2833""","Medicinal Chemicals and Botanical Products",111419,"Other Food Crops Grown Under Cover",34,4,03/31/25,"246,868,272",03/31/25,"238,522,000","1,105,000","332,213,000","592,438,000"
47751,"Property, plant and equipment","Valuation of cannabis biological assets",567114,03/31/25,06/17/25,2,"Ernst & Young LLP",192,"Ernst & Young LLP Chartered Accountants",1263,Vancouver,A1,"BRITISH COLUMBIA",Canada,40-F,2025-06-18,,"AURORA CANNABIS INC",1683541,"=""ACB""","2207 90B STREET SW",,EDMONTON,A0,ALBERTA,Canada,,,"=""2833""","Medicinal Chemicals and Botanical Products",111419,"Other Food Crops Grown Under Cover",34,4,03/31/25,"246,868,272",03/31/25,"238,522,000","1,105,000","332,213,000","592,438,000"
44380,"Revenue from customer contracts","Revenue Recognition",556015,01/31/25,03/06/25,2,"Ernst & Young LLP",,,,"San Francisco",CA,CALIFORNIA,"US West",10-K,2025-03-06,,"Autodesk, Inc.",769397,"=""ADSK""","ONE MARKET, STE. 400.",,"SAN FRANCISCO",CA,CALIFORNIA,"US West",,,"=""7372""","Prepackaged Software",511210,"Software Publishers",34,304,01/29/25,"65,396,551,680",01/31/25,"6,131,000,000","1,112,000,000","-2,195,000,000","10,833,000,000"
48116,Goodwill,"Goodwill – Employer Services Reportable Segment— Refer to Notes 1 and 8 to the financial statements",569844,06/30/25,08/06/25,3,"Deloitte & Touche LLP",,,,Morristown,NJ,"NEW JERSEY","US Mid Atlantic",10-K,2025-08-06,,"AUTOMATIC DATA PROCESSING INC",8670,"=""ADP""","ONE ADP BOULVARD",,ROSELAND,NJ,"NEW JERSEY","US Mid Atlantic",,,"=""7374""","Computer Processing and Data Preparation and Processing Services",518210,"Data Processing, Hosting, and Related Services",34,305,07/02/25,"123,826,733,056",06/30/25,"20,560,900,000","4,079,700,000","1,311,500,000","53,369,300,000"
48117,"Other liabilities and provisions","Client Funds Obligations - Refer to Note 5 to the financial statements",569844,06/30/25,08/06/25,3,"Deloitte & Touche LLP",,,,Morristown,NJ,"NEW JERSEY","US Mid Atlantic",10-K,2025-08-06,,"AUTOMATIC DATA PROCESSING INC",8670,"=""ADP""","ONE ADP BOULVARD",,ROSELAND,NJ,"NEW JERSEY","US Mid Atlantic",,,"=""7374""","Computer Processing and Data Preparation and Processing Services",518210,"Data Processing, Hosting, and Related Services",34,305,07/02/25,"123,826,733,056",06/30/25,"20,560,900,000","4,079,700,000","1,311,500,000","53,369,300,000"
48680,"Other contingent liabilities","Valuation of Self-insurance Reserves",574505,08/30/25,10/27/25,2,"Ernst & Young LLP",,,,Memphis,TN,TENNESSEE,"US Southeast",10-K,2025-10-27,,"AUTOZONE INC",866787,"=""AZO""","123 SOUTH FRONT ST","DEPT 8074",MEMPHIS,TN,TENNESSEE,"US Southeast",,,"=""5531""","Auto and Home Supply Stores",441310,"Automotive Parts and Accessories Stores",34,"4,197",08/28/25,"70,211,919,872",08/30/25,"18,938,717,000","2,498,247,000","-3,716,958,000","19,355,324,000"
48409,"Revenue from customer contracts","Revenue Recognition — Service Revenues - Estimated Costs to Complete - Refer to Note 3 to the financial statements",571897,06/27/25,09/10/25,3,"Deloitte & Touche LLP",,,,Austin,TX,TEXAS,"US Southwest",10-K,2025-09-10,,"AVIAT NETWORKS, INC.",1377789,"=""AVNW""","200 PARKER DRIVE","SUITE C100A",AUSTIN,TX,TEXAS,"US Southwest",,,"=""3663""","Radio and Television Broadcasting and Communications Equipment",517212,"Cellular and Other Wireless Telecommunications",34,24,06/26/25,"303,856,800",06/27/25,"434,606,000","1,341,000","216,631,000","633,296,000"
48216,"Other income taxes","Evaluation of accounting for income taxes",570431,06/28/25,08/15/25,4,"KPMG LLP",,,,Phoenix,AZ,ARIZONA,"US Southwest",10-K,2025-08-15,,"AVNET INC",8858,"=""AVT""","2211 SOUTH 47TH STREET",,PHOENIX,AZ,ARIZONA,"US Southwest",,,"=""5065""","Electronic Parts and Equipment, NEC",334419,"Other Electronic Component Manufacturing",34,53,06/30/25,"4,451,146,240",06/28/25,"22,200,754,000","240,217,000","4,174,464,000","12,118,553,000"
47629,"Revenue from customer contracts","Subscription Revenue — Refer to Notes 2 and 3 to the financial statements",566243,03/31/25,06/04/25,3,"Deloitte & Touche LLP",,,,"New York",NY,"NEW YORK","US Mid Atlantic",10-K,2025-06-04,,"Bark, Inc.",1819574,"=""BARK""","120 BROADWAY, 12TH FLOOR",,"NEW YORK",NY,"NEW YORK","US Mid Atlantic",,,"=""5990""","Retail-Retail Stores, NEC",454111,"Electronic Shopping",34,1,04/02/25,"248,379,088",03/31/25,"484,182,000","-32,878,000","94,100,000","260,635,000"
44960,"Other revenue","Loyalty Program",557582,02/01/25,03/14/25,2,"Ernst & Young LLP",,,,"Grandview Heights",OH,OHIO,"US Midwest",10-K,2025-03-14,,"Bath & Body Works, Inc.",701985,"=""BBWI""","THREE LIMITED PKWY","P O BOX 16000",COLUMBUS,OH,OHIO,"US Midwest",,,"=""5990""","Retail-Retail Stores, NEC",448120,"Women's Clothing Stores",34,38,02/03/25,"8,230,119,936",02/01/25,"7,307,000,000","798,000,000","-2,178,000,000","4,872,000,000"
48792,Inventory,"Owned Inventory - Valuation of Projects in Progress - Refer to Notes 2 and 4 to the financial statements.",575523,09/30/25,11/13/25,3,"Deloitte & Touche LLP",,,,Atlanta,GA,GEORGIA,"US Southeast",10-K,2025-11-13,,"BEAZER HOMES USA INC",915840,"=""BZH""","2002 SUMMIT BLVD NE","15TH FLOOR",ATLANTA,GA,GEORGIA,"US Southeast",,,"=""1531""","Operative Builders",236117,"New Housing Operative Builders",34,25,09/30/25,"730,664,320",09/30/25,"2,371,555,000","45,588,000","1,237,530,000","2,609,708,000"
48937,"Uncertain tax positions","Income taxes — Uncertain tax positions",576019,09/30/25,11/25/25,2,"Ernst & Young LLP",,,,"New York",NY,"NEW YORK","US Mid Atlantic",10-K,2025-11-25,,"BECTON DICKINSON & CO",10795,"=""BDX""","ONE BECTON DR",,"FRANKLIN LAKES",NJ,"NEW JERSEY","US Mid Atlantic",,,"=""3841""","Surgical and Medical Instruments and Apparatus",334516,"Analytical Laboratory Instrument Manufacturing",34,192,10/02/25,"54,917,824,512",09/30/25,"21,840,000,000","1,677,000,000","-10,627,000,000","55,325,000,000"
48842,"Sales return and allowances","Receivables, net - Allowance for Trade Promotions",575756,09/30/25,11/18/25,1,"PricewaterhouseCoopers LLP",,,,"Saint Louis",MO,MISSOURI,"US Southeast",10-K,2025-11-18,,"BELLRING BRANDS, INC.",1772016,"=""BRBR""","1 N. BRENTWOOD BOULEVARD, SUITE 1550",,CLAYTON,MO,MISSOURI,"US Southeast",,,"=""2000""","Food and Kindred Products",446191,"Food (Health) Supplement Stores",34,36,09/30/25,"4,391,079,936",09/30/25,"2,316,600,000","216,200,000","-644,800,000","941,000,000"
45214,"Vendor/supplier rebates","Vendor Allowances – Domestic Reporting Segment — Refer to Note 1 to the financial statements",558028,02/01/25,03/19/25,3,"Deloitte & Touche LLP",,,,Minneapolis,MN,MINNESOTA,"US Midwest",10-K,2025-03-19,,"BEST BUY CO INC",764478,"=""BBY""","7601 PENN AVE SOUTH",,RICHFIELD,MN,MINNESOTA,"US Midwest",,,"=""5731""","Radio, Television, and Consumer Electronics Stores",443112,"Radio, Television, and Other Electronics Stores",34,84,02/03/25,"17,911,795,712",02/01/25,"41,528,000,000","927,000,000","1,900,000,000","14,782,000,000"
45215,Goodwill,"Goodwill – Best Buy Health Reporting Unit — Refer to Note 1 and Note 3 to the financial statements",558028,02/01/25,03/19/25,3,"Deloitte & Touche LLP",,,,Minneapolis,MN,MINNESOTA,"US Midwest",10-K,2025-03-19,,"BEST BUY CO INC",764478,"=""BBY""","7601 PENN AVE SOUTH",,RICHFIELD,MN,MINNESOTA,"US Midwest",,,"=""5731""","Radio, Television, and Consumer Electronics Stores",443112,"Radio, Television, and Other Electronics Stores",34,84,02/03/25,"17,911,795,712",02/01/25,"41,528,000,000","927,000,000","1,900,000,000","14,782,000,000"
48273,"Property, plant and equipment","Carrying value of property, plant and equipment",570713,06/30/25,08/22/25,2,"Ernst & Young LLP",32,"Ernst & Young",1435,Melbourne,C3,AUSTRALIA,Foreign,20-F,2025-08-22,,"BHP Group Ltd",811809,"=""BHP""","LEVEL 27","180 LONSDALE STREET",MELBOURNE,C3,AUSTRALIA,Foreign,,,"=""1000""","Metal mining",212210,"Iron Ore Mining",34,48,06/30/25,"122,035,363,840",06/30/25,"51,262,000,000","9,019,000,000","45,741,000,000","108,790,000,000"
48274,"Asset retirement and environmental obligations","Closure and rehabilitation provisions",570713,06/30/25,08/22/25,2,"Ernst & Young LLP",32,"Ernst & Young",1435,Melbourne,C3,AUSTRALIA,Foreign,20-F,2025-08-22,,"BHP Group Ltd",811809,"=""BHP""","LEVEL 27","180 LONSDALE STREET",MELBOURNE,C3,AUSTRALIA,Foreign,,,"=""1000""","Metal mining",212210,"Iron Ore Mining",34,48,06/30/25,"122,035,363,840",06/30/25,"51,262,000,000","9,019,000,000","45,741,000,000","108,790,000,000"
48275,"Other contingent liabilities","Samarco dam failure provisions recognised and the contingent liabilities disclosed",570713,06/30/25,08/22/25,2,"Ernst & Young LLP",32,"Ernst & Young",1435,Melbourne,C3,AUSTRALIA,Foreign,20-F,2025-08-22,,"BHP Group Ltd",811809,"=""BHP""","LEVEL 27","180 LONSDALE STREET",MELBOURNE,C3,AUSTRALIA,Foreign,,,"=""1000""","Metal mining",212210,"Iron Ore Mining",34,48,06/30/25,"122,035,363,840",06/30/25,"51,262,000,000","9,019,000,000","45,741,000,000","108,790,000,000"
48319,"Revenue from customer contracts","Revenue Recognition",571060,06/30/25,08/28/25,1,"PricewaterhouseCoopers LLP",,,,"San Jose",CA,CALIFORNIA,"US West",10-K,2025-08-28,,"BILL Holdings, Inc.",1786352,"=""BILL""","6220 AMERICA CENTER DR.","SUITE 100","SAN JOSE",CA,CALIFORNIA,"US West",,,"=""7372""","Prepackaged Software",511210,"Software Publishers",34,46,06/30/25,"4,765,356,544",06/30/25,"1,462,570,000","23,799,000","1,294,726,000","10,063,982,000"
48265,"Revenue from customer contracts","Sufficiency of audit evidence over net sales",570718,06/30/25,08/22/25,4,"KPMG LLP",,,,Minneapolis,MN,MINNESOTA,"US Midwest",10-K,2025-08-22,,"BIO-TECHNE Corp",842023,"=""TECH""","614 MCKINLEY PL N E","SUITE 1500",MINNEAPOLIS,MN,MINNESOTA,"US Midwest",,,"=""2836""","Biological Products, Except Diagnostic Substances",325413,"In-Vitro Diagnostic Substance Manufacturing",34,53,07/02/25,"8,336,884,736",06/30/25,"1,219,635,000","73,400,000","572,274,000","2,557,868,000"
48752,"Goodwill and intangible assets","Impairment Tests on Goodwill (Pro Farm Group, Inc., Rizobacter S.A. and Bioceres Crops S.A. Cash Generating Units), intangible assets not yet available for use, which have indefinite useful lives and intangible assets with definite useful lives for which events or changes in circumstances indicate that their carrying amount may not be recoverable. (Bioceres Crops S.A. Cash Generating Unit).",575300,06/30/25,11/10/25,1,"PricewaterhouseCoopers LLP",88,"Price Waterhouse & Co SRL",1349,Rosario,C1,ARGENTINA,Foreign,20-F,2025-11-10,Yes,"Bioceres Crop Solutions Corp.",1769484,"=""BIOX""","PO BOX 309, UGLAND HOUSE",,"GEORGE TOWN, GRAND CAYMAN",E9,"CAYMAN ISLANDS",Foreign,,,"=""2870""","Agricultural Chemicals",325320,"Pesticide and Other Agricultural Chemical Manufacturing",34,5,07/02/25,"313,613,920",06/30/25,"333,567,646","-58,845,253","-27,891,943","763,645,080"
48039,"Going concern","Assessment of the Company’s ability to continue as a going concern",569168,03/29/25,07/25/25,4,"KPMG LLP",187,"KPMG LLP Chartered Accountants",85,Montreal,A8,QUEBEC,Canada,20-F,2025-07-25,,"BIRKS GROUP INC.",1179821,"=""BGI""","2020 ROBERT BOURASSA","SUITE 200",MONTREAL,A8,QUEBEC,Canada,,,"=""5944""","Jewelry Stores",448310,"Jewelry Stores",34,1,03/31/25,"13,658,225",03/29/25,"177,807,000","-12,819,000","-21,028,000","196,080,000"
48040,Inventory,"Evaluation of the reserve for slow-moving finished goods inventories",569168,03/29/25,07/25/25,4,"KPMG LLP",187,"KPMG LLP Chartered Accountants",85,Montreal,A8,QUEBEC,Canada,20-F,2025-07-25,,"BIRKS GROUP INC.",1179821,"=""BGI""","2020 ROBERT BOURASSA","SUITE 200",MONTREAL,A8,QUEBEC,Canada,,,"=""5944""","Jewelry Stores",448310,"Jewelry Stores",34,1,03/31/25,"13,658,225",03/29/25,"177,807,000","-12,819,000","-21,028,000","196,080,000"
44905,"Other contingent liabilities","Workers’ Compensation and General Liability Reserves",557498,02/01/25,03/14/25,1,"PricewaterhouseCoopers LLP",,,,Boston,MA,MASSACHUSETTS,"US New England",10-K,2025-03-14,,"BJ's Wholesale Club Holdings, Inc.",1531152,"=""BJ""","350 CAMPUS DRIVE",,MARLBOROUGH,MA,MASSACHUSETTS,"US New England",,,"=""5331""","Variety Stores",452910,"Warehouse Clubs and Supercenters",34,100,02/03/25,"13,159,176,192",02/01/25,"20,501,804,000","534,417,000","737,529,000","7,065,305,000"
46325,Goodwill,"Impairment Tests of Goodwill for the UEM and Cylance Reporting Units",560402,02/28/25,04/02/25,1,"PricewaterhouseCoopers LLP",191,"PricewaterhouseCoopers LLP Chartered Accountants",271,Toronto,A6,ONTARIO,Canada,10-K,2025-04-02,,"BLACKBERRY Ltd",1070235,"=""BB""","2200 UNIVERSITY AVENUE EAST",*,WATERLOO,A6,ONTARIO,Canada,,,"=""7372""","Prepackaged Software",518210,"Data Processing, Hosting, and Related Services",34,5,02/28/25,"2,808,246,272",02/28/25,"534,900,000","-79,000,000","200,200,000","1,295,600,000"
47396,Inventory,"Inventories – Refer to Note 2 to the financial statements",565107,03/29/25,05/15/25,3,"Deloitte & Touche LLP",,,,"Costa Mesa",CA,CALIFORNIA,"US West",10-K,2025-05-15,,"Boot Barn Holdings, Inc.",1610250,"=""BOOT""","17100 LAGUNA CANYON ROAD",,IRVINE,CA,CALIFORNIA,"US West",,,"=""5661""","Shoe Stores",448210,"Shoe Stores",34,107,03/31/25,"3,286,603,264",03/29/25,"1,911,104,000","180,942,000","874,878,000","2,018,021,000"
47527,"Revenue from customer contracts","Revenue recognition for select contracts under the cost-based input method",565627,03/31/25,05/23/25,2,"Ernst & Young LLP",,,,Tysons,VA,VIRGINIA,"US Mid Atlantic",10-K,2025-05-23,,"Booz Allen Hamilton Holding Corp",1443646,"=""BAH""","8283 GREENSBORO DRIVE",,MCLEAN,VA,VIRGINIA,"US Mid Atlantic",,,"=""8742""","Management Consulting Services",541611,"Administrative Management and General Management Consulting Services",34,105,03/31/25,"13,059,846,144",03/31/25,"11,980,000,000","935,000,000","-1,965,000,000","7,312,000,000"
47528,"Other contingent liabilities","Government Contracting Matters – Provision for Claimed Costs",565627,03/31/25,05/23/25,2,"Ernst & Young LLP",,,,Tysons,VA,VIRGINIA,"US Mid Atlantic",10-K,2025-05-23,,"Booz Allen Hamilton Holding Corp",1443646,"=""BAH""","8283 GREENSBORO DRIVE",,MCLEAN,VA,VIRGINIA,"US Mid Atlantic",,,"=""8742""","Management Consulting Services",541611,"Administrative Management and General Management Consulting Services",34,105,03/31/25,"13,059,846,144",03/31/25,"11,980,000,000","935,000,000","-1,965,000,000","7,312,000,000"
47529,"Uncertain tax positions","Income tax reserves for uncertain tax positions",565627,03/31/25,05/23/25,2,"Ernst & Young LLP",,,,Tysons,VA,VIRGINIA,"US Mid Atlantic",10-K,2025-05-23,,"Booz Allen Hamilton Holding Corp",1443646,"=""BAH""","8283 GREENSBORO DRIVE",,MCLEAN,VA,VIRGINIA,"US Mid Atlantic",,,"=""8742""","Management Consulting Services",541611,"Administrative Management and General Management Consulting Services",34,105,03/31/25,"13,059,846,144",03/31/25,"11,980,000,000","935,000,000","-1,965,000,000","7,312,000,000"
44571,"Revenue from customer contracts","Revenue recognition – evaluation of contract terms and conditions",556735,01/31/25,03/10/25,2,"Ernst & Young LLP",,,,"San Francisco",CA,CALIFORNIA,"US West",10-K,2025-03-10,,"BOX INC",1372612,"=""BOX""","900 JEFFERSON AVE",,"REDWOOD CITY",CA,CALIFORNIA,"US West",,,"=""7372""","Prepackaged Software",511210,"Software Publishers",34,33,01/29/25,"4,768,091,136",01/31/25,"1,090,130,000","244,621,000","120,307,000","1,667,520,000"
48383,"Deferred income taxes","Taxes — Valuation Allowances — Refer to Notes 1 and 11 to the financial statements",571508,07/31/25,09/04/25,3,"Deloitte & Touche LLP",,,,Milwaukee,WI,WISCONSIN,"US Midwest",10-K,2025-09-04,,"BRADY CORP",746598,"=""BRC""","6555 W GOOD HOPE RD","P O BOX 571",MILWAUKEE,WI,WISCONSIN,"US Midwest",,,"=""3990""","Miscellaneous Manufacturing Industries",322222,"Coated and Laminated Paper Manufacturing",34,71,07/29/25,"3,105,538,048",07/31/25,"1,513,605,000","189,256,000","409,892,000","1,734,253,000"
47267,"Other contingent liabilities","Estimate of Self-Insurance Reserves",564149,02/01/25,05/02/25,2,"Ernst & Young LLP",,,,Nashville,TN,TENNESSEE,"US Southeast",10-K,2025-05-02,Yes,"BRAND HOUSE COLLECTIVE, INC.",1056285,"=""KIRK""","5310 MARYLAND WAY",,BRENTWOOD,TN,TENNESSEE,"US Southeast",,,"=""5990""","Retail-Retail Stores, NEC",442299,"All Other Home Furnishings Stores",34,2,02/03/25,"19,939,272",02/01/25,"441,360,000","-23,132,000",,"242,188,000"
46030,"Revenue from customer contracts","Revenue Recognition",559793,01/31/25,03/31/25,2,"Ernst & Young LLP",,,,"New York",NY,"NEW YORK","US Mid Atlantic",10-K,2025-03-31,,"Braze, Inc.",1676238,"=""BRZE""","63 MADISON BUILDING","28 E. 28TH ST., FLOOR 12 MAILROOM","NEW YORK",NY,"NEW YORK","US Mid Atlantic",,,"=""7372""","Prepackaged Software",511210,"Software Publishers",34,46,01/29/25,"4,020,010,496",01/31/25,"593,410,000","-103,743,000","443,171,000","870,998,000"
48867,Goodwill,"Goodwill – Maintenance Reporting Unit – Refer to Notes 2 and 7 to the financial statements",575794,09/30/25,11/19/25,3,"Deloitte & Touche LLP",,,,Philadelphia,PA,PENNSYLVANIA,"US Mid Atlantic",10-K,2025-11-19,,"BrightView Holdings, Inc.",1734713,"=""BV""","980 JOLLY ROAD","SUITE 300","BLUE BELL",PA,PENNSYLVANIA,"US Mid Atlantic",,,"=""0700""","Agricultural services",561730,"Landscaping Services",34,13,09/30/25,"1,270,320,000",09/30/25,"2,672,800,000","56,000,000","-282,100,000","3,392,000,000"
48213,"Revenue from customer contracts","Assessment of gift card breakage revenue",570428,06/25/25,08/15/25,4,"KPMG LLP",,,,Dallas,TX,TEXAS,"US Southwest",10-K,2025-08-15,,"BRINKER INTERNATIONAL, INC",703351,"=""EAT""","3000 OLYMPUS BLVD.",,DALLAS,TX,TEXAS,"US Southwest",,,"=""5812""","Eating and Drinking Places",722110,"Full-Service Restaurants",34,180,06/27/25,"8,003,429,888",06/25/25,"5,384,200,000","383,100,000","158,800,000","2,678,600,000"
48111,Goodwill,"Goodwill - Refer to Notes 2 and 10 to the financial statements",569765,06/30/25,08/05/25,3,"Deloitte & Touche LLP",,,,"New York",NY,"NEW YORK","US Mid Atlantic",10-K,2025-08-05,,"BROADRIDGE FINANCIAL SOLUTIONS, INC.",1383312,"=""BR""","5 DAKOTA DRIVE",,"LAKE SUCCESS",NY,"NEW YORK","US Mid Atlantic",,,"=""7389""","Business Services, NEC",522320,"Financial Transactions Processing, Reserve, and Clearinghouse Activities",34,243,06/30/25,"28,483,115,008",06/30/25,"6,889,100,000","839,600,000","-2,231,900,000","8,545,000,000"
47704,"Other intangible assets","Valuation of Gin Mare and Diplomático Other Intangible Assets",566897,04/30/25,06/13/25,2,"Ernst & Young LLP",,,,Louisville,KY,KENTUCKY,"US Mid Atlantic",10-K,2025-06-13,,"BROWN FORMAN CORP",14693,"=""BF.B""","850 DIXIE HWY",,LOUISVILLE,KY,KENTUCKY,"US Mid Atlantic",,,"=""2080""",Beverages,312140,Distilleries,34,35,05/02/25,"10,472,128,512",04/30/25,"3,975,000,000","869,000,000","1,507,000,000","8,086,000,000"
45605,"Revenue from customer contracts","Revenue—Refer to Notes 2m and 20 to the financial statements",558995,01/31/25,03/25/25,3,"Deloitte & Touche LLP",486,"Deloitte srl",1208,Montreal,A8,QUEBEC,Canada,40-F,2025-03-26,,"BRP Inc.",1748797,"=""DOOO""","726 SAINT-JOSEPH STREET",,VALCOURT,A8,QUEBEC,Canada,,,"=""3790""","Miscellaneous Transportation Equipment",336999,"All Other Transportation Equipment Manufacturing",34,48,01/31/25,"1,650,037,760",01/31/25,"5,406,300,000","-147,100,000","-246,500,000","4,345,500,000"
46324,Inventory,"Inventory – Adjustment to Inventory for Markdowns and Obsolescence – Refer to Note A to the financial statements",560394,02/01/25,04/02/25,3,"Deloitte & Touche LLP",,,,Omaha,NE,NEBRASKA,"US Midwest",10-K,2025-04-02,,"BUCKLE INC",885245,"=""BKE""","2407 W 24TH ST",,KEARNEY,NE,NEBRASKA,"US Midwest",,,"=""5651""","Family Clothing Stores",448110,"Men's Clothing Stores",34,47,02/03/25,"2,374,690,560",02/01/25,"1,217,689,000","195,468,000",,"913,173,000"
46780,"Revenue from customer contracts","Revenue recognition - gift card breakage",561793,02/01/25,04/17/25,2,"Ernst & Young LLP",,,,"Saint Louis",MO,MISSOURI,"US Southeast",10-K,2025-04-17,,"BUILD-A-BEAR WORKSHOP INC",1113809,"=""BBW""","415 S. 18TH STREET, SUITE 200",,"ST LOUIS",MO,MISSOURI,"US Southeast",,,"=""5945""","Hobby, Toy, and Game Shops",339931,"Doll and Stuffed Toy Manufacturing",34,40,02/03/25,"533,295,360",02/01/25,"496,404,000","51,785,000",,"289,956,000"
45083,Inventory,"Retail Inventory Method—Impact of Markdowns—Refer to Note 1 to the financial statements",557839,02/01/25,03/17/25,3,"Deloitte & Touche LLP",,,,Morristown,NJ,"NEW JERSEY","US Mid Atlantic",10-K,2025-03-17,,"Burlington Stores, Inc.",1579298,"=""BURL""","1830 ROUTE 130 NORTH",,BURLINGTON,NJ,"NEW JERSEY","US Mid Atlantic",,,"=""5311""","Department Stores",448140,"Family Clothing Stores",34,274,02/03/25,"17,372,211,200",02/01/25,"10,634,823,000","503,639,000","1,085,432,000","8,770,413,000"
47774,"Revenue from customer contracts","Revenue - Refer to Notes 1 and 2 to the financial statements",567275,04/30/25,06/23/25,3,"Deloitte & Touche LLP",,,,"San Jose",CA,CALIFORNIA,"US West",10-K,2025-06-23,,"C3.ai, Inc.",1577526,"=""AI""","1400 SEAPORT BLVD",,"REDWOOD CITY",CA,CALIFORNIA,"US West",,,"=""7372""","Prepackaged Software",334611,"Software Reproducing",34,22,05/02/25,"2,905,286,656",04/30/25,"389,056,000","-288,702,000","837,678,000","1,025,882,000"
48915,"Other contingent liabilities","Commitments and Contingencies — CWP Respirator Liabilities — Refer to Note S to the consolidated financial statements",575992,09/30/25,11/24/25,3,"Deloitte & Touche LLP",,,,Boston,MA,MASSACHUSETTS,"US New England",10-K,2025-11-24,,"CABOT CORP",16040,"=""CBT""","TWO SEAPORT LANE SUITE 1400",,BOSTON,MA,MASSACHUSETTS,"US New England",,,"=""2890""","Miscellaneous Chemical Products",325211,"Plastics Material and Resin Manufacturing",34,76,10/02/25,"4,022,193,920",09/30/25,"3,713,000,000","331,000,000","1,361,000,000","3,815,000,000"
48127,"Business combinations","Acquisition of Azure Summit Technology, LLC - Valuation of A Certain Technology Intangible Asset",569881,06/30/25,08/07/25,1,"PricewaterhouseCoopers LLP",,,,Washington,DC,"DISTRICT OF COLUMBIA","US Mid Atlantic",10-K,2025-08-07,,"CACI INTERNATIONAL INC /DE/",16058,"=""CACI""","TWO RESTON OVERLOOK","12021 SUNSET HILLS ROAD",RESTON,VA,VIRGINIA,"US Mid Atlantic",,,"=""7373""","Computer Integrated Systems Design",541512,"Computer Systems Design Services",34,488,07/02/25,"10,726,967,296",06/30/25,"8,627,824,000","499,830,000","-2,219,136,000","8,647,598,000"
48128,"Revenue from customer contracts","Revenue Recognized Over Time",569881,06/30/25,08/07/25,1,"PricewaterhouseCoopers LLP",,,,Washington,DC,"DISTRICT OF COLUMBIA","US Mid Atlantic",10-K,2025-08-07,,"CACI INTERNATIONAL INC /DE/",16058,"=""CACI""","TWO RESTON OVERLOOK","12021 SUNSET HILLS ROAD",RESTON,VA,VIRGINIA,"US Mid Atlantic",,,"=""7373""","Computer Integrated Systems Design",541512,"Computer Systems Design Services",34,488,07/02/25,"10,726,967,296",06/30/25,"8,627,824,000","499,830,000","-2,219,136,000","8,647,598,000"
47370,"Revenue from customer contracts","Revenue recognition – Estimated costs to complete certain contracts",564983,03/31/25,05/13/25,1,"PricewaterhouseCoopers LLP",493,"PricewaterhouseCoopers srl",271,Montreal,A8,QUEBEC,Canada,6-K,2025-05-13,,"CAE INC",1173382,"=""CAE""","8585 COTE DE LIESSE",,ST-LAURENT,A8,QUEBEC,Canada,,,"=""3690""","Miscellaneous Electrical Machinery, Equipment & Supplies",333319,"Other Commercial and Service Industry Machinery Manufacturing",34,25,03/31/25,"7,875,318,784",03/31/25,"3,271,100,000","288,300,000","709,000,000","7,791,400,000"
47758,"Revenue from customer contracts","Revenue recognition – Estimated costs to complete certain contracts",567163,03/31/25,05/13/25,1,"PricewaterhouseCoopers LLP",493,"PricewaterhouseCoopers srl",271,Montreal,A8,QUEBEC,Canada,40-F,2025-06-20,,"CAE INC",1173382,"=""CAE""","8585 COTE DE LIESSE",,ST-LAURENT,A8,QUEBEC,Canada,,,"=""3690""","Miscellaneous Electrical Machinery, Equipment & Supplies",333319,"Other Commercial and Service Industry Machinery Manufacturing",34,25,03/31/25,"7,875,318,784",03/31/25,"3,271,100,000","288,300,000","709,000,000","7,791,400,000"
47766,"Revenue from customer contracts","Revenue recognition – Estimated costs to complete certain contracts",567255,03/31/25,05/13/25,1,"PricewaterhouseCoopers LLP",493,"PricewaterhouseCoopers srl",271,Montreal,A8,QUEBEC,Canada,6-K,2025-06-20,,"CAE INC",1173382,"=""CAE""","8585 COTE DE LIESSE",,ST-LAURENT,A8,QUEBEC,Canada,,,"=""3690""","Miscellaneous Electrical Machinery, Equipment & Supplies",333319,"Other Commercial and Service Industry Machinery Manufacturing",34,25,03/31/25,"7,875,318,784",03/31/25,"3,271,100,000","288,300,000","709,000,000","7,791,400,000"
46232,Inventory,"Inventory Markdown Reserves",560308,02/01/25,04/01/25,2,"Ernst & Young LLP",,,,"Saint Louis",MO,MISSOURI,"US Southeast",10-K,2025-04-01,,"CALERES INC",14707,"=""CAL""","8300 MARYLAND AVE","P O BOX 29","ST LOUIS",MO,MISSOURI,"US Southeast",,,"=""3140""","Footwear, (No Rubber)",448210,"Shoe Stores",34,17,02/03/25,"577,747,200",02/01/25,"2,722,683,000","107,255,000","406,750,000","1,894,754,000"
48474,"Other intangible assets","Indefinite-Lived Intangible Assets Impairment Tests for Certain Trademarks",572394,08/03/25,09/18/25,1,"PricewaterhouseCoopers LLP",,,,Philadelphia,PA,PENNSYLVANIA,"US Mid Atlantic",10-K,2025-09-18,,"CAMPBELL'S Co",16732,"=""CPB""","CAMPBELL PL",,CAMDEN,NJ,"NEW JERSEY","US Mid Atlantic",,,"=""2000""","Food and Kindred Products",311999,"All Other Miscellaneous Food Manufacturing",34,33,08/05/25,"9,727,980,544",08/03/25,"10,253,000,000","602,000,000","-5,445,000,000","14,896,000,000"
47474,Inventory,"Inventory Obsolescence– Refer to Notes 2k, 3 and 10 to the financial statements",565488,03/30/25,05/20/25,3,"Deloitte & Touche LLP",468,"Deloitte LLP",1208,Toronto,A6,ONTARIO,Canada,20-F,2025-05-21,,"Canada Goose Holdings Inc.",1690511,"=""GOOS""","250 BOWIE AVENUE",,TORONTO,A6,ONTARIO,Canada,,,"=""2300""","Apparel & Other Finishd Prods of Fabrics & Similar Matl",315222,"Men's and Boys' Cut and Sew Suit, Coat, and Overcoat Manufacturing",34,8,03/31/25,"364,351,616",03/30/25,"944,100,000","72,500,000","236,100,000","1,131,900,000"
48399,"Revenue from customer contracts","Revenue Recognition – Refer to Notes 2 and 11 to the financial statements",571666,06/30/25,09/08/25,3,"Deloitte & Touche LLP",,,,Atlanta,GA,GEORGIA,"US Southeast",10-K,2025-09-08,,"CANTALOUPE, INC.",896429,"=""CTLP""","101 LINDENWOOD DRIVE","SUITE 405",MALVERN,PA,PENNSYLVANIA,"US Mid Atlantic",,,"=""3578""","Calculating and Accounting Machines, Except Electronic Computers",332116,"Metal Stamping",34,11,06/30/25,"805,446,720",06/30/25,"302,548,000","64,533,000","127,198,000","381,858,000"
48962,"Allowance for credit losses","Allowance for credit losses on loans evaluated on a collective basis",576145,09/30/25,11/26/25,4,"KPMG LLP",,,,"Kansas City",MO,MISSOURI,"US Southeast",10-K,2025-11-26,,"Capitol Federal Financial, Inc.",1490906,"=""CFFN""","700 S KANSAS AVENUE",,TOPEKA,KS,KANSAS,"US Midwest",,,"=""6035""","Savings Institutions, Federally Chartered",522110,"Commercial Banking",34,6,10/02/25,"827,484,608",09/30/25,"200,291,000","68,025,000",,"9,778,701,000"
47561,"Goodwill and intangible assets","Valuation of Goodwill and Indefinite-lived Intangible Assets",565813,03/29/25,05/28/25,2,"Ernst & Young LLP",,,,"New York",NY,"NEW YORK","US Mid Atlantic",10-K,2025-05-28,,"Capri Holdings Ltd",1530721,"=""CPRI""","90 WHITFIELD STREET","2ND FLOOR",LONDON,X0,"UNITED KINGDOM",Foreign,,,"=""3100""","Leather & Leather Products",424330,"Women's, Children's, and Infants' Clothing and Accessories Merchant Wholesalers",34,20,03/31/25,"2,326,427,392",03/29/25,"4,442,000,000","-1,182,000,000","-1,436,000,000","5,213,000,000"
48174,Goodwill,"Valuation of Goodwill",570237,06/30/25,08/12/25,2,"Ernst & Young LLP",,,,"Grandview Heights",OH,OHIO,"US Midwest",10-K,2025-08-12,,"CARDINAL HEALTH INC",721371,"=""CAH""","7000 CARDINAL PLACE",,DUBLIN,OH,OHIO,"US Midwest",,,"=""5122""","Drugs, Drug Proprietaries, and Druggists` Sundries",325412,"Pharmaceutical Preparation Manufacturing",34,168,06/30/25,"40,097,738,752",06/30/25,"222,578,000,000","1,561,000,000","-14,958,000,000","53,122,000,000"
46560,"Allowance for credit losses","Assessment of the allowance for loan losses on Tier 1 managed receivables",561189,02/28/25,04/11/25,4,"KPMG LLP",,,,Richmond,VA,VIRGINIA,"US Mid Atlantic",10-K,2025-04-11,,"CARMAX INC",1170010,"=""KMX""","12800 TUCKAHOE CREEK PARKWAY",,RICHMOND,VA,VIRGINIA,"US Mid Atlantic",,,"=""5500""","Retail-Auto Dealers & Gasoline Stations",423110,"Automobile and Other Motor Vehicle Merchant Wholesalers",34,83,02/28/25,"12,720,933,888",02/28/25,"26,353,420,000","500,556,000","6,101,730,000","27,404,206,000"
48177,"Revenue from customer contracts","Revenue Recognition - Goods Transferred to the Customer",570232,06/30/25,08/12/25,1,"PricewaterhouseCoopers LLP",,,,Philadelphia,PA,PENNSYLVANIA,"US Mid Atlantic",10-K,2025-08-12,,"CARPENTER TECHNOLOGY CORP",17843,"=""CRS""","BNY MELLON BUILDING","1735 MARKET STREET, 15TH FL",PHILADELPHIA,PA,PENNSYLVANIA,"US Mid Atlantic",,,"=""3312""","Steel Works, Blast Furnaces (Including Coke Ovens), and Rolling Mills",331111,"Iron and Steel Mills",34,275,07/02/25,"13,691,808,768",06/30/25,"2,877,100,000","376,000,000","1,650,200,000","3,486,800,000"
47775,Inventory,"Sufficiency of audit evidence over merchandise inventory quantities at store locations",567276,04/30/25,06/23/25,4,"KPMG LLP",,,,Minneapolis,MN,MINNESOTA,"US Midwest",10-K,2025-06-23,,"CASEYS GENERAL STORES INC",726958,"=""CASY""","PO BOX 3001",,ANKENY,IA,IOWA,"US Midwest",,,"=""5500""","Retail-Auto Dealers & Gasoline Stations",447110,"Gasoline Stations with Convenience Stores",34,459,05/02/25,"17,024,630,784",04/30/25,"15,940,899,000","546,520,000","2,263,777,000","8,208,118,000"
47776,"Business combinations","Evaluation of the fair value of real property acquired in a business combination",567276,04/30/25,06/23/25,4,"KPMG LLP",,,,Minneapolis,MN,MINNESOTA,"US Midwest",10-K,2025-06-23,,"CASEYS GENERAL STORES INC",726958,"=""CASY""","PO BOX 3001",,ANKENY,IA,IOWA,"US Midwest",,,"=""5500""","Retail-Auto Dealers & Gasoline Stations",447110,"Gasoline Stations with Convenience Stores",34,459,05/02/25,"17,024,630,784",04/30/25,"15,940,899,000","546,520,000","2,263,777,000","8,208,118,000"
46136,"Long-lived assets","Impairment of Long-Lived Assets - Store Location Asset Groupings",560086,02/01/25,03/31/25,1,"PricewaterhouseCoopers LLP",,,,Charlotte,NC,"NORTH CAROLINA","US Southeast",10-K,2025-03-31,,"CATO CORP",18255,"=""CATO""","8100 DENMARK ROAD",,CHARLOTTE,NC,"NORTH CAROLINA","US Southeast",,,"=""5621""","Women`s Clothing Stores",448120,"Women's Clothing Stores",34,3,02/03/25,"64,846,208",02/01/25,"649,806,000","-18,057,000",,"452,361,000"
48946,"Other contingent liabilities","Legal Matters and Contingencies - Opioid Lawsuits and Investigations",576034,09/30/25,11/25/25,2,"Ernst & Young LLP",,,,Philadelphia,PA,PENNSYLVANIA,"US Mid Atlantic",10-K,2025-11-25,,"Cencora, Inc.",1140859,"=""COR""","1 WEST FIRST AVENUE",,CONSHOHOCKEN,PA,PENNSYLVANIA,"US Mid Atlantic",,,"=""5122""","Drugs, Drug Proprietaries, and Druggists` Sundries",424210,"Drugs and Druggists' Sundries Merchant Wholesalers",34,309,10/02/25,"59,824,898,048",09/30/25,"321,332,819,000","1,554,169,000","-15,942,682,000","76,590,112,000"
48947,Goodwill,"Goodwill Impairment Evaluation of the PharmaLex Reporting Unit",576034,09/30/25,11/25/25,2,"Ernst & Young LLP",,,,Philadelphia,PA,PENNSYLVANIA,"US Mid Atlantic",10-K,2025-11-25,,"Cencora, Inc.",1140859,"=""COR""","1 WEST FIRST AVENUE",,CONSHOHOCKEN,PA,PENNSYLVANIA,"US Mid Atlantic",,,"=""5122""","Drugs, Drug Proprietaries, and Druggists` Sundries",424210,"Drugs and Druggists' Sundries Merchant Wholesalers",34,309,10/02/25,"59,824,898,048",09/30/25,"321,332,819,000","1,554,169,000","-15,942,682,000","76,590,112,000"
48950,"Revenue from customer contracts","Net Sales - Revenue Recognition for Consignment Arrangements — Refer to Note 1 to the financial statements",576107,09/27/25,11/26/25,3,"Deloitte & Touche LLP",,,,"San Francisco",CA,CALIFORNIA,"US West",10-K,2025-11-26,,"CENTRAL GARDEN & PET CO",887733,"=""CENT""","1340 TREAT BOULEVARD","SUITE 600","WALNUT CREEK",CA,CALIFORNIA,"US West",,,"=""5190""","Wholesale-Miscellaneous Nondurable Goods",424910,"Farm Supplies Merchant Wholesalers",34,33,09/29/25,"316,334,240",09/27/25,"3,129,064,000","162,843,000","580,933,000","3,625,643,000"
48720,"Revenue from customer contracts","Revenue Recognition - Estimates of total expected labour costs for business and strategic information technology (IT) consulting and systems integration services under fixed-fee arrangements",575039,09/30/25,11/04/25,1,"PricewaterhouseCoopers LLP",493,"PricewaterhouseCoopers srl",271,Montreal,A8,QUEBEC,Canada,6-K,2025-11-05,,"CGI INC",1061574,"=""GIB""","1350 RENE LEVESQUE BOULEVARD WEST","25TH FLOOR",MONTREAL,A8,QUEBEC,Canada,,,"=""8742""","Management Consulting Services",511210,"Software Publishers",34,89,09/30/25,"17,263,824,736",09/30/25,"11,506,399,305","1,028,507,902",,"14,116,166,915"
47544,"Other contingent liabilities","Self-Insured Risks",565729,03/29/25,05/27/25,2,"Ernst & Young LLP",,,,Detroit,MI,MICHIGAN,"US Midwest",10-K,2025-05-27,,"Champion Homes, Inc.",90896,"=""SKY""","755 W BIG BEAVER ROAD","SUITE 1000",TROY,MI,MICHIGAN,"US Midwest",,,"=""2451""","Mobile Homes",321991,"Manufactured Home (Mobile Home) Manufacturing",34,95,03/31/25,"5,411,649,024",03/29/25,"2,483,448,000","198,413,000","1,121,753,000","2,110,408,000"
45926,"Revenue from customer contracts","Revenue Recognition – Networked Charging Systems and Subscriptions",559351,01/31/25,03/28/25,1,"PricewaterhouseCoopers LLP",,,,"San Jose",CA,CALIFORNIA,"US West",10-K,2025-03-28,,"ChargePoint Holdings, Inc.",1777393,"=""CHPT""","240 EAST HACIENDA AVENUE",,CAMPBELL,CA,CALIFORNIA,"US West",,,"=""3790""","Miscellaneous Transportation Equipment",511210,"Software Publishers",34,1,01/29/25,"430,707,296",01/31/25,"417,083,000","-277,066,000","-136,244,000","898,175,000"
45598,"Vendor/supplier rebates","Vendor Rebates — Refer to Note 2 to the financial statements",558986,02/02/25,03/26/25,3,"Deloitte & Touche LLP",,,,"Boca Raton",FL,FLORIDA,"US Southeast",10-K,2025-03-26,,"Chewy, Inc.",1766502,"=""CHWY""","7700 WEST SUNRISE BOULEVARD",,PLANTATION,FL,FLORIDA,"US Southeast",,,"=""5961""","Catalog and Mail-Order Houses",454111,"Electronic Shopping",34,39,02/04/25,"6,245,608,448",02/02/25,"11,861,335,000","392,738,000","222,017,000","3,014,527,000"
47678,"Revenue from customer contracts","Sufficiency of audit evidence over revenue recognition",566808,03/31/25,06/11/25,4,"KPMG LLP",,,,"Santa Clara",CA,CALIFORNIA,"US West",10-K,2025-06-11,Yes,"Chrome Holding Co.",1804591,"=""MEHCQ""","870 MARKET STREET","ROOM 415","SAN FRANCISCO",CA,CALIFORNIA,"US West",,,"=""2834""","Pharmaceutical Preparations",621511,"Medical Laboratories",34,1,03/31/25,"15,051,855",03/31/25,"189,896,000","-280,885,000","-52,077,000","159,894,000"
48721,Inventory,"Valuation of Grain and Oilseed Inventories and Grain and Oilseed Forward Commodity Purchase and Sales Contracts",574982,08/31/25,11/05/25,1,"PricewaterhouseCoopers LLP",,,,Minneapolis,MN,MINNESOTA,"US Midwest",10-K,2025-11-05,,"CHS INC",823277,"=""CHSCP""","5500 CENEX DRIVE",,"INVER GROVE HEIGHTS",MN,MINNESOTA,"US Midwest",,,"=""5150""","Wholesale-Farm Product Raw Materials",424590,"Other Farm Product Raw Material Merchant Wholesalers",34,27,12/01/25,,08/31/25,"35,462,608,000","597,917,000",,"18,863,849,000"
48145,"Revenue from customer contracts","Revenue Recognition– Certain Physical Printed Products and Other Revenue",570001,06/30/25,08/08/25,1,"PricewaterhouseCoopers LLP",,,,Boston,MA,MASSACHUSETTS,"US New England",10-K,2025-08-08,,"CIMPRESS plc",1262976,"=""CMPR""","FIRST FLOOR BUILDING 3","FINNABAIR BUSINESS AND TECHNOLOGY PARK","DUNDALK, COUNTY LOUTH",L2,IRELAND,Foreign,,,"=""2750""","Commercial Printing",323119,"Other Commercial Printing",34,47,06/30/25,"1,150,434,304",06/30/25,"3,403,079,000","14,952,000","-1,553,701,000","1,968,144,000"
48693,"Revenue from customer contracts","Revenue Recognition- Certain Physical Printed Products and Other Revenue",574623,06/30/25,08/08/25,1,"PricewaterhouseCoopers LLP",,,,Boston,MA,MASSACHUSETTS,"US New England",ARS,2025-10-29,,"CIMPRESS plc",1262976,"=""CMPR""","FIRST FLOOR BUILDING 3","FINNABAIR BUSINESS AND TECHNOLOGY PARK","DUNDALK, COUNTY LOUTH",L2,IRELAND,Foreign,,,"=""2750""","Commercial Printing",323119,"Other Commercial Printing",34,47,06/30/25,"1,150,434,304",06/30/25,"3,403,079,000","14,952,000","-1,553,701,000","1,968,144,000"
48047,"Other contingent liabilities","Valuation of Insurance Reserves",569239,05/31/25,07/28/25,2,"Ernst & Young LLP",,,,Cincinnati,OH,OHIO,"US Midwest",10-K,2025-07-28,,"CINTAS CORP",723254,"=""CTAS""","6800 CINTAS BLVD","P O BOX 625737",CINCINNATI,OH,OHIO,"US Midwest",,,"=""2320""","Men's & Boys' Furnishgs, Work Clothg, & Allied Garments",812332,"Industrial Launderers",34,227,05/31/25,"91,267,719,168",05/31/25,"10,340,181,000","1,812,281,000","974,426,000","9,825,241,000"
47524,Inventory,"Inventory valuation",565638,03/29/25,05/23/25,2,"Ernst & Young LLP",,,,Austin,TX,TEXAS,"US Southwest",10-K,2025-05-23,,"CIRRUS LOGIC, INC.",772406,"=""CRUS""","800 WEST 6TH STREET",,AUSTIN,TX,TEXAS,"US Southwest",,,"=""3674""","Semiconductors and Related Devices",334413,"Semiconductor and Related Device Manufacturing",34,100,03/31/25,"5,296,157,696",03/29/25,"1,896,077,000","331,507,000","1,486,052,000","2,327,073,000"
48377,"Revenue from customer contracts","Revenue Recognition for Certain Products and Services",571407,07/26/25,09/03/25,1,"PricewaterhouseCoopers LLP",,,,"San Jose",CA,CALIFORNIA,"US West",10-K,2025-09-03,,"CISCO SYSTEMS, INC.",858877,"=""CSCO""","170 WEST TASMAN DR",,"SAN JOSE",CA,CALIFORNIA,"US West",,,"=""3576""","Computer Communications Equipment",334119,"Other Computer Peripheral Equipment Manufacturing",34,68,07/28/25,"268,963,069,952",07/26/25,"56,654,000,000","10,180,000,000","-21,468,000,000","122,291,000,000"
46763,Inventory,"Inventory – Retail Inventory Method – Refer to Note 2 to the consolidated financial statements",561664,02/01/25,04/16/25,3,"Deloitte & Touche LLP",,,,Atlanta,GA,GEORGIA,"US Southeast",10-K,2025-04-16,,"Citi Trends Inc",1318484,"=""CTRN""","17 PARK OF COMMERCE BLVD","SUITE 200",SAVANNAH,GA,GEORGIA,"US Southeast",,,"=""5600""","Retail-Apparel & Accessory Stores",448150,"Clothing Accessories Stores",34,24,02/03/25,"212,437,488",02/01/25,"753,079,000","-43,170,000",,"462,769,000"
48945,Inventory,"Inventories, Net - Inventory Reserves - Refer to Note 1 to the financial statements",576080,09/30/25,11/25/25,3,"Deloitte & Touche LLP",,,,Minneapolis,MN,MINNESOTA,"US Midwest",10-K,2025-11-25,,"Clearfield, Inc.",796505,"=""CLFD""","7050 WINNETKA AVE. N.","SUITE 100","BROOKLYN PARK",MN,MINNESOTA,"US Midwest",,,"=""3661""","Telephone and Telegraph Apparatus",334210,"Telephone Apparatus Manufacturing",34,35,10/02/25,"487,629,664",09/30/25,"150,134,000","-8,050,000","242,101,000","306,173,000"
48155,"Equity investments and joint ventures","Valuation of Venture Agreement Terminal Obligation",570017,06/30/25,08/08/25,2,"Ernst & Young LLP",,,,"San Francisco",CA,CALIFORNIA,"US West",10-K,2025-08-08,,"CLOROX CO /DE/",21076,"=""CLX""","THE CLOROX COMPANY","1221 BROADWAY",OAKLAND,CA,CALIFORNIA,"US West",,,"=""2842""","Speciality Cleaning, Polishing, and Sanitary Preparations",325612,"Polish and Other Sanitation Good Manufacturing",34,125,07/02/25,"15,364,695,040",06/30/25,"7,104,000,000","810,000,000","-1,474,000,000","5,561,000,000"
48612,"Equity investments and joint ventures","Valuation of Venture Agreement Terminal Obligation",573753,06/30/25,08/08/25,2,"Ernst & Young LLP",,,,"San Francisco",CA,CALIFORNIA,"US West","DEF 14A",2025-10-07,,"CLOROX CO /DE/",21076,"=""CLX""","THE CLOROX COMPANY","1221 BROADWAY",OAKLAND,CA,CALIFORNIA,"US West",,,"=""2842""","Speciality Cleaning, Polishing, and Sanitary Preparations",325612,"Polish and Other Sanitation Good Manufacturing",34,125,07/02/25,"15,364,695,040",06/30/25,"7,104,000,000","810,000,000","-1,474,000,000","5,561,000,000"
48642,Goodwill,"Impairment Assessment of Academic education services Reporting Unit’s Goodwill",574057,06/30/25,10/17/25,2,"Ernst & Young LLP",211,"Ernst & Young Hua Ming LLP",1408,Shanghai,F4,CHINA,Foreign,20-F,2025-10-17,,"CLPS Inc",1724542,"=""CLPS""","UNIT 1102, 11TH FL, MILLENNIUM CITY 3","370 KWUN TONG ROAD, KWUN TONG",KOWLOON,K3,"HONG KONG",Foreign,,,"=""7372""","Prepackaged Software",541513,"Computer Facilities Management Services",34,1,06/30/25,"26,029,260",06/30/25,"164,481,414","-7,049,734","52,045,901","118,109,430"
46256,"Revenue from customer contracts","Revenue Recognition using the Input Method",560427,01/31/25,04/02/25,1,"PricewaterhouseCoopers LLP",223,"Kesselman & Kesselman",1309,"Tel Aviv",L3,ISRAEL,Foreign,20-F,2025-04-02,,"Cognyte Software Ltd.",1824814,"=""CGNT""","33 MASKIT",,"HERZLIYA PITUACH",L3,ISRAEL,Foreign,,,"=""7372""","Prepackaged Software",511210,"Software Publishers",34,9,01/31/25,"670,852,544",01/31/25,"350,632,000","-12,051,000","72,044,000","497,820,000"
48215,Goodwill,"Goodwill Impairment Assessment - Lasers Reporting Unit",570430,06/30/25,08/14/25,2,"Ernst & Young LLP",,,,Pittsburgh,PA,PENNSYLVANIA,"US Mid Atlantic",10-K,2025-08-15,,"COHERENT CORP.",820318,"=""COHR""","375 SAXONBURG BLVD",,SAXONBURG,PA,PENNSYLVANIA,"US Mid Atlantic",,,"=""3827""","Optical Instruments and Lenses",333314,"Optical Instrument and Lens Manufacturing",34,88,07/02/25,"13,734,732,800",06/30/25,"5,810,115,000","49,364,000","451,944,000","14,910,936,000"
48069,"Other intangible assets","Evaluation of the existence of and the Company’s rights related to crypto assets (current assets) held in cold wallets, and assessment of the obligation to safeguard crypto assets held on behalf of its customers in cold wallets",569440,03/31/25,07/30/25,4,"KPMG LLP",333,"KPMG AZSA LLC",1009,Tokyo,M0,JAPAN,Foreign,20-F,2025-07-30,,"Coincheck Group N.V.",1913847,"=""CNCK""","NIEUWEZIJDS VOORBURGWAL 162","1012 SJ",AMSTERDAM,P7,NETHERLANDS,Foreign,,,"=""6199""","Finance Services",518210,"Data Processing, Hosting, and Related Services",34,8,12/01/25,"1,030,818,465",03/31/25,"2,563,000,000","-96,000,000","56,000,000","751,000,000"
48334,"Other intangible assets","Evaluation of the existence of and the Company’s rights related to crypto assets (current assets) held in cold wallets, and assessment of the obligation to safeguard crypto assets held on behalf of its customers in cold wallets",571221,03/31/25,07/30/25,4,"KPMG LLP",333,"KPMG AZSA LLC",1009,Tokyo,M0,JAPAN,Foreign,"POS AM",2025-08-29,,"Coincheck Group N.V.",1913847,"=""CNCK""","NIEUWEZIJDS VOORBURGWAL 162","1012 SJ",AMSTERDAM,P7,NETHERLANDS,Foreign,,,"=""6199""","Finance Services",518210,"Data Processing, Hosting, and Related Services",34,8,12/01/25,"1,030,818,465",03/31/25,"2,563,000,000","-96,000,000","56,000,000","751,000,000"
48419,"Other intangible assets","Evaluation of the existence of and the Company’s rights related to crypto assets (current assets) held in cold wallets, and assessment of the obligation to safeguard crypto assets held on behalf of its customers in cold wallets",571970,03/31/25,07/30/25,4,"KPMG LLP",333,"KPMG AZSA LLC",1009,Tokyo,M0,JAPAN,Foreign,424B3,2025-09-10,,"Coincheck Group N.V.",1913847,"=""CNCK""","NIEUWEZIJDS VOORBURGWAL 162","1012 SJ",AMSTERDAM,P7,NETHERLANDS,Foreign,,,"=""6199""","Finance Services",518210,"Data Processing, Hosting, and Related Services",34,8,12/01/25,"1,030,818,465",03/31/25,"2,563,000,000","-96,000,000","56,000,000","751,000,000"
47555,Goodwill,"Valuation of Goodwill for the Precision Conveyance Reporting Unit",565802,03/31/25,05/28/25,2,"Ernst & Young LLP",,,,Charlotte,NC,"NORTH CAROLINA","US Southeast",10-K,2025-05-28,,"COLUMBUS MCKINNON CORP",1005229,"=""CMCO""","13320 BALLANTYNE CORPORATE PLACE","SUITE D",CHARLOTTE,NC,"NORTH CAROLINA","US Southeast",,,"=""3531""","Construction Machinery and Equipment",333923,"Overhead Traveling Crane, Hoist, and Monorail System Manufacturing",34,17,03/31/25,"484,507,648",03/31/25,"963,027,000","-5,138,000","-185,274,000","1,738,788,000"
48633,Goodwill,"Goodwill — Annual impairment test for one Reporting Unit within the North America Steel Group segment and one Reporting Unit within the Emerging Businesses Group segment – Refer to Notes 1 and 6 to the Financial Statements",574027,08/31/25,10/16/25,3,"Deloitte & Touche LLP",,,,Dallas,TX,TEXAS,"US Southwest",10-K,2025-10-16,,"COMMERCIAL METALS Co",22444,"=""CMC""","6565 N. MACARTHUR BLVD., SUITE 800","P O BOX 1046",IRVING,TX,TEXAS,"US Southwest",,,"=""3312""","Steel Works, Blast Furnaces (Including Coke Ovens), and Rolling Mills",331111,"Iron and Steel Mills",34,58,08/31/25,"6,412,277,248",08/31/25,"7,798,480,000","84,662,000","3,595,405,000","7,171,834,000"
47277,"Revenue from customer contracts","Accounting for Revenue Recognition",564311,03/31/25,05/05/25,2,"Ernst & Young LLP",,,,Iselin,NJ,"NEW JERSEY","US Mid Atlantic",10-K,2025-05-05,,"COMMVAULT SYSTEMS INC",1169561,"=""CVLT""","1 COMMVAULT WAY",,"TINTON FALLS",NJ,"NEW JERSEY","US Mid Atlantic",,,"=""7372""","Prepackaged Software",511210,"Software Publishers",34,166,04/02/25,"7,320,761,856",03/31/25,"995,619,000","76,106,000","119,130,000","1,118,266,000"
48755,"Revenue from customer contracts","Net Sales – Over Time Accounting Using the Cost-to-Cost Measure for Specific Identified Material Contracts — Refer to Note 1 to the financial statements",575310,07/31/25,11/10/25,3,"Deloitte & Touche LLP",,,,Jericho,NY,"NEW YORK","US Mid Atlantic",10-K,2025-11-10,,"COMTECH TELECOMMUNICATIONS CORP /DE/",23197,"=""CMTL""","305 N 54TH STREET",,CHANDLER,AZ,ARIZONA,"US Southwest",,,"=""3663""","Radio and Television Broadcasting and Communications Equipment",334220,"Radio and Television Broadcasting and Wireless Communications Equipment Manufacturing",34,2,07/31/25,"63,820,372",07/31/25,"499,528,000","-155,302,000","-83,763,000","740,835,000"
48756,Goodwill,"Goodwill - Refer to Note 15 to the financial statements",575310,07/31/25,11/10/25,3,"Deloitte & Touche LLP",,,,Jericho,NY,"NEW YORK","US Mid Atlantic",10-K,2025-11-10,,"COMTECH TELECOMMUNICATIONS CORP /DE/",23197,"=""CMTL""","305 N 54TH STREET",,CHANDLER,AZ,ARIZONA,"US Southwest",,,"=""3663""","Radio and Television Broadcasting and Communications Equipment",334220,"Radio and Television Broadcasting and Wireless Communications Equipment Manufacturing",34,2,07/31/25,"63,820,372",07/31/25,"499,528,000","-155,302,000","-83,763,000","740,835,000"
48757,"Other debt","Debt - Refer to Notes 8 and 9 to the Financial Statements",575310,07/31/25,11/10/25,3,"Deloitte & Touche LLP",,,,Jericho,NY,"NEW YORK","US Mid Atlantic",10-K,2025-11-10,,"COMTECH TELECOMMUNICATIONS CORP /DE/",23197,"=""CMTL""","305 N 54TH STREET",,CHANDLER,AZ,ARIZONA,"US Southwest",,,"=""3663""","Radio and Television Broadcasting and Communications Equipment",334220,"Radio and Television Broadcasting and Wireless Communications Equipment Manufacturing",34,2,07/31/25,"63,820,372",07/31/25,"499,528,000","-155,302,000","-83,763,000","740,835,000"
48758,"Going concern","Liquidity - Refer to Note 1 to the financial statements",575310,07/31/25,11/10/25,3,"Deloitte & Touche LLP",,,,Jericho,NY,"NEW YORK","US Mid Atlantic",10-K,2025-11-10,,"COMTECH TELECOMMUNICATIONS CORP /DE/",23197,"=""CMTL""","305 N 54TH STREET",,CHANDLER,AZ,ARIZONA,"US Southwest",,,"=""3663""","Radio and Television Broadcasting and Communications Equipment",334220,"Radio and Television Broadcasting and Wireless Communications Equipment Manufacturing",34,2,07/31/25,"63,820,372",07/31/25,"499,528,000","-155,302,000","-83,763,000","740,835,000"
47913,"Goodwill and intangible assets","Evaluation of the recoverability of the carrying value of the Birds Eye indefinite-lived intangible asset",568309,05/25/25,07/10/25,4,"KPMG LLP",,,,Omaha,NE,NEBRASKA,"US Midwest",10-K,2025-07-10,,"CONAGRA BRANDS INC.",23217,"=""CAG""","222 W. MERCHANDISE MART PLAZA","SUITE 1300",CHICAGO,IL,ILLINOIS,"US Midwest",,,"=""2000""","Food and Kindred Products",311422,"Specialty Canning",34,23,05/31/25,"10,927,066,112",05/25/25,"11,612,800,000","1,152,400,000","-3,990,300,000","20,933,900,000"
46886,"Uncertain tax positions","Unrecognized tax benefits",562342,02/28/25,04/23/25,4,"KPMG LLP",,,,Rochester,NY,"NEW YORK","US Mid Atlantic",10-K,2025-04-23,,"CONSTELLATION BRANDS, INC.",16918,"=""STZ""","50 EAST BROAD STREET",,ROCHESTER,NY,"NEW YORK","US Mid Atlantic",,,"=""2080""",Beverages,424820,"Wine and Distilled Alcoholic Beverage Merchant Wholesalers",34,178,02/26/25,"32,228,657,152",02/28/25,"10,208,700,000","-81,400,000","-777,100,000","21,652,300,000"
46887,Goodwill,"Fair value of the Wine and Spirits reporting unit",562342,02/28/25,04/23/25,4,"KPMG LLP",,,,Rochester,NY,"NEW YORK","US Mid Atlantic",10-K,2025-04-23,,"CONSTELLATION BRANDS, INC.",16918,"=""STZ""","50 EAST BROAD STREET",,ROCHESTER,NY,"NEW YORK","US Mid Atlantic",,,"=""2080""",Beverages,424820,"Wine and Distilled Alcoholic Beverage Merchant Wholesalers",34,178,02/26/25,"32,228,657,152",02/28/25,"10,208,700,000","-81,400,000","-777,100,000","21,652,300,000"
45488,"Revenue from customer contracts","Revenue Recognition – Net Product Sales",558723,02/02/25,03/25/25,1,"PricewaterhouseCoopers LLP",,,,"Saint Louis",MO,MISSOURI,"US Southeast",10-K,2025-03-25,,"Core & Main, Inc.",1856525,"=""CNM""","1830 CRAIG PARK COURT",,"ST. LOUIS",MO,MISSOURI,"US Southeast",,,"=""5099""","Durable Goods, NEC",221310,"Water Supply and Irrigation Systems",34,55,02/04/25,"10,391,950,336",02/02/25,"7,441,000,000","411,000,000","-1,135,000,000","5,870,000,000"
48614,"Revenue from customer contracts","Sufficiency of audit evidence over United States and Canada revenue",573766,08/31/25,10/07/25,4,"KPMG LLP",,,,Seattle,WA,WASHINGTON,"US West",10-K,2025-10-08,,"COSTCO WHOLESALE CORP /NEW",909832,"=""COST""","999 LAKE DRIVE",,ISSAQUAH,WA,WASHINGTON,"US West",,,"=""5331""","Variety Stores",452910,"Warehouse Clubs and Supercenters",34,939,09/02/25,"416,345,161,728",08/31/25,"275,235,000,000","8,099,000,000",,"77,099,000,000"
48241,"Other intangible assets","Other Intangible Assets, net – CoverGirl and Sally Hansen Trademark Valuations – Refer to Notes 2 and 9 to the financial statements",570635,06/30/25,08/21/25,3,"Deloitte & Touche LLP",,,,"New York",NY,"NEW YORK","US Mid Atlantic",10-K,2025-08-21,,"COTY INC.",1024305,"=""COTY""","350 FIFTH AVENUE",,"NEW YORK",NY,"NEW YORK","US Mid Atlantic",,,"=""2844""","Perfumes, Cosmetics, and Other Toilet Preparations",325620,"Toilet Preparation Manufacturing",34,5,07/02/25,"4,439,955,968",06/30/25,"5,892,900,000","-367,900,000","-3,497,700,000","11,907,700,000"
45479,"Revenue from customer contracts","Revenue Recognition – Term-based software licenses sold in conjunction with post-contract support",558697,01/31/25,03/25/25,1,"PricewaterhouseCoopers LLP",,,,"San Jose",CA,CALIFORNIA,"US West",10-K,2025-03-25,,"Couchbase, Inc.",1845022,"=""BASE""","3155 OLSEN DRIVE",,"SAN JOSE",CA,CALIFORNIA,"US West",,,"=""7372""","Prepackaged Software",511210,"Software Publishers",34,17,01/29/25,"914,518,784",01/31/25,"209,466,000","-74,653,000",,"260,598,000"
48538,"Other contingent liabilities","Commitments and Contingencies – Insurance Reserves – Refer to Notes 1 and 14 to the financial statements",573002,08/01/25,09/26/25,3,"Deloitte & Touche LLP",,,,Nashville,TN,TENNESSEE,"US Southeast",10-K,2025-09-26,,"CRACKER BARREL OLD COUNTRY STORE, INC",1067294,"=""CBRL""","PO BOX 787",,LEBANON,TN,TENNESSEE,"US Southeast",,,"=""5812""","Eating and Drinking Places",722110,"Full-Service Restaurants",34,62,07/30/25,"1,380,550,912",08/01/25,"3,483,684,000","46,379,000","437,339,000","2,161,884,000"
47875,Inventory,"Inventory Valuation",567885,05/03/25,07/01/25,2,"Ernst & Young LLP",,,,"San Jose",CA,CALIFORNIA,"US West",10-K,2025-07-02,,"Credo Technology Group Holding Ltd",1807794,"=""CRDO""","C/O MAPLES CORPORATE SERVICES, LIMITED","PO BOX 309, UGLAND HOUSE","GRAND CAYMAN",E9,"CAYMAN ISLANDS",Foreign,,,"=""3674""","Semiconductors and Related Devices",334413,"Semiconductor and Related Device Manufacturing",34,49,05/05/25,"8,267,621,376",05/03/25,"436,775,000","52,183,000",,"809,257,000"
48676,"Other investments","Level 3 Investment Properties Valued Using Discounted Cash Flows",574411,06/30/25,10/23/25,1,"PricewaterhouseCoopers LLP",88,"Price Waterhouse & Co SRL",1349,"Buenos Aires",C1,ARGENTINA,Foreign,20-F,2025-10-24,,"CRESUD INC",1034957,"=""CRESY""","CARLOS M. DELLA PAOLERA 261","9TH FLOOR","BUENOS AIRES",C1,ARGENTINA,Foreign,,,"=""6500""","Real Estate",112111,"Beef Cattle Ranching and Farming",34,11,07/02/25,"652,412,736",06/30/25,"789,000,000","188,000,000","791,000,000","4,274,000,000"
44565,"Revenue from customer contracts","Revenue Recognition – Subscription Revenue",556802,01/31/25,03/10/25,1,"PricewaterhouseCoopers LLP",,,,"San Jose",CA,CALIFORNIA,"US West",10-K,2025-03-10,,"CrowdStrike Holdings, Inc.",1535527,"=""CRWD""","206 E. 9TH STREET","SUITE 1400",AUSTIN,TX,TEXAS,"US Southwest",,,"=""7372""","Prepackaged Software",511210,"Software Publishers",34,397,01/29/25,"92,855,304,192",01/31/25,"3,953,624,000","-19,271,000","2,233,575,000","8,701,578,000"
47792,"Business combinations","Fair value of the licensing relationships intangible asset acquired in a business combination",567406,03/30/25,06/25/25,4,"KPMG LLP",,,,"Baton Rouge",LA,LOUISIANA,"US Southeast",10-K,2025-06-25,,"CROWN CRAFTS INC",25895,"=""CRWS""","916 SOUTH BURNSIDE AVENUE",,GONZALES,LA,LOUISIANA,"US Southeast",,,"=""2211""","Broadwoven Fabric Mills, Cotton",313210,"Broadwoven Fabric Mills",34,4,03/31/25,"38,465,856",03/30/25,"87,250,000","-9,356,000","32,569,000","81,154,000"
47793,"Allowance for credit losses","Evaluation of certain anticipated returns and claims, expected credit losses, and chargebacks",567406,03/30/25,06/25/25,4,"KPMG LLP",,,,"Baton Rouge",LA,LOUISIANA,"US Southeast",10-K,2025-06-25,,"CROWN CRAFTS INC",25895,"=""CRWS""","916 SOUTH BURNSIDE AVENUE",,GONZALES,LA,LOUISIANA,"US Southeast",,,"=""2211""","Broadwoven Fabric Mills, Cotton",313210,"Broadwoven Fabric Mills",34,4,03/31/25,"38,465,856",03/30/25,"87,250,000","-9,356,000","32,569,000","81,154,000"
47795,"Revenue from customer contracts","Revenue Recognition – Uniquely Configured Contracts — Refer to Notes 1 and 2 to the financial statements",567413,04/26/25,06/25/25,3,"Deloitte & Touche LLP",,,,Minneapolis,MN,MINNESOTA,"US Midwest",10-K,2025-06-25,,"DAKTRONICS INC /SD/",915779,"=""DAKT""","PO BOX 5128","201 DAKTRONICS DRIVE",BROOKINGS,SD,"SOUTH DAKOTA","US Midwest",,,"=""3990""","Miscellaneous Manufacturing Industries",334220,"Radio and Television Broadcasting and Wireless Communications Equipment Manufacturing",34,13,04/30/25,"622,457,216",04/26/25,"756,477,000","-10,121,000","268,175,000","502,892,000"
48195,"Revenue from customer contracts","Revenue Recognition - Uniquely Configured Contracts - Refer to Notes 1 and 2 to the financial statement",570362,04/26/25,06/25/25,3,"Deloitte & Touche LLP",,,,Minneapolis,MN,MINNESOTA,"US Midwest",ARS,2025-08-14,,"DAKTRONICS INC /SD/",915779,"=""DAKT""","PO BOX 5128","201 DAKTRONICS DRIVE",BROOKINGS,SD,"SOUTH DAKOTA","US Midwest",,,"=""3990""","Miscellaneous Manufacturing Industries",334220,"Radio and Television Broadcasting and Wireless Communications Equipment Manufacturing",34,13,04/30/25,"622,457,216",04/26/25,"756,477,000","-10,121,000","268,175,000","502,892,000"
48367,"Revenue from customer contracts","Revenue Recognition — Uniquely Configured Contracts — Refer to Notes 1 and 2 to the financial statements",571410,04/26/25,06/25/25,3,"Deloitte & Touche LLP",,,,Minneapolis,MN,MINNESOTA,"US Midwest",ARS/A,2025-09-03,,"DAKTRONICS INC /SD/",915779,"=""DAKT""","PO BOX 5128","201 DAKTRONICS DRIVE",BROOKINGS,SD,"SOUTH DAKOTA","US Midwest",,,"=""3990""","Miscellaneous Manufacturing Industries",334220,"Radio and Television Broadcasting and Wireless Communications Equipment Manufacturing",34,13,04/30/25,"622,457,216",04/26/25,"756,477,000","-10,121,000","268,175,000","502,892,000"
47971,"Long-lived assets","Evaluation of long-lived assets for impairment",568704,05/25/25,07/18/25,4,"KPMG LLP",,,,Orlando,FL,FLORIDA,"US Southeast",10-K,2025-07-18,,"DARDEN RESTAURANTS INC",940944,"=""DRI""","1000 DARDEN CENTER DRIVE",,ORLANDO,FL,FLORIDA,"US Southeast",,,"=""5812""","Eating and Drinking Places",722110,"Full-Service Restaurants",34,214,05/27/25,"25,049,468,928",05/25/25,"12,076,700,000","1,049,600,000","-694,500,000","12,587,000,000"
46418,"Revenue from customer contracts","Deferred entertainment revenue for unused game play credits",560755,02/04/25,04/07/25,4,"KPMG LLP",,,,Dallas,TX,TEXAS,"US Southwest",10-K,2025-04-07,,"Dave & Buster's Entertainment, Inc.",1525769,"=""PLAY""","2481 MANANA DRIVE",,DALLAS,TX,TEXAS,"US Southwest",,,"=""5812""","Eating and Drinking Places",722110,"Full-Service Restaurants",34,27,02/06/25,"1,044,968,320",02/04/25,"2,132,700,000","58,300,000","-775,000,000","4,015,800,000"
46419,"Revenue from customer contracts","Deferred entertainment revenue for unredeemed tickets",560755,02/04/25,04/07/25,4,"KPMG LLP",,,,Dallas,TX,TEXAS,"US Southwest",10-K,2025-04-07,,"Dave & Buster's Entertainment, Inc.",1525769,"=""PLAY""","2481 MANANA DRIVE",,DALLAS,TX,TEXAS,"US Southwest",,,"=""5812""","Eating and Drinking Places",722110,"Full-Service Restaurants",34,27,02/06/25,"1,044,968,320",02/04/25,"2,132,700,000","58,300,000","-775,000,000","4,015,800,000"
47519,"Sales return and allowances","Wholesale sales return liability",565643,03/31/25,05/23/25,4,"KPMG LLP",,,,"Los Angeles",CA,CALIFORNIA,"US West",10-K,2025-05-23,,"DECKERS OUTDOOR CORP",910521,"=""DECK""","250 COROMAR DRIVE",,GOLETA,CA,CALIFORNIA,"US West",,,"=""3021""","Rubber and Plastics Footwear",316211,"Rubber and Plastics Footwear Manufacturing",34,112,03/31/25,"16,793,973,760",03/31/25,"4,985,612,000","966,091,000","2,483,324,000","3,570,252,000"
45513,"Revenue from customer contracts","Revenue Recognition — Identification of Performance Obligations in Revenue Contracts",558682,01/31/25,03/25/25,1,"PricewaterhouseCoopers LLP",,,,Austin,TX,TEXAS,"US Southwest",10-K,2025-03-25,,"Dell Technologies Inc.",1571996,"=""DELL""","ONE DELL WAY",,"ROUND ROCK",TX,TEXAS,"US Southwest",,,"=""3571""","Electronic Computers",334111,"Electronic Computer Manufacturing",34,103,01/29/25,"36,841,463,808",01/31/25,"95,567,000,000","4,592,000,000","-25,590,000,000","79,746,000,000"
44446,"Revenue from customer contracts","Determination of standalone selling prices of distinct performance obligations for customer contracts with multiple performance obligations",556076,01/31/25,03/05/25,4,"KPMG LLP",187,"KPMG LLP Chartered Accountants",85,Vaughan,A6,ONTARIO,Canada,6-K,2025-03-06,,"DESCARTES SYSTEMS GROUP INC",1050140,"=""DSGX""","120 RANDALL ST",,WATERLOO,A6,ONTARIO,Canada,,,"=""7372""","Prepackaged Software",511210,"Software Publishers",34,116,01/31/25,"9,915,739,389",01/31/25,"651,000,000","140,393,789",,"1,647,384,000"
44447,"Business combinations","Business combinations - Valuation of acquired intangible assets",556076,01/31/25,03/05/25,4,"KPMG LLP",187,"KPMG LLP Chartered Accountants",85,Vaughan,A6,ONTARIO,Canada,6-K,2025-03-06,,"DESCARTES SYSTEMS GROUP INC",1050140,"=""DSGX""","120 RANDALL ST",,WATERLOO,A6,ONTARIO,Canada,,,"=""7372""","Prepackaged Software",511210,"Software Publishers",34,116,01/31/25,"9,915,739,389",01/31/25,"651,000,000","140,393,789",,"1,647,384,000"
45389,Inventory,"Valuation of U.S. Retail Segment Inventories – Refer to Note 1 to the financial statements",558498,02/01/25,03/24/25,3,"Deloitte & Touche LLP",,,,Columbus,OH,OHIO,"US Midwest",10-K,2025-03-24,,"Designer Brands Inc.",1319947,"=""DBI""","810 DSW DRIVE",,COLUMBUS,OH,OHIO,"US Midwest",,,"=""5661""","Shoe Stores",448210,"Shoe Stores",34,5,02/03/25,"189,722,480",02/01/25,"3,009,262,000","-10,549,000","66,750,000","2,009,224,000"
45277,"Long-lived assets","Impairment of long-lived store assets",558213,02/01/25,03/20/25,4,"KPMG LLP",,,,Minneapolis,MN,MINNESOTA,"US Midwest",10-K,2025-03-20,,"DESTINATION XL GROUP, INC.",813298,"=""DXLG""","555 TURNPIKE STREET",,CANTON,MA,MASSACHUSETTS,"US New England",,,"=""5651""","Family Clothing Stores",448140,"Family Clothing Stores",34,3,02/03/25,"144,457,248",02/01/25,"467,015,000","3,055,000","140,073,000","380,955,000"
48194,"Other contingent liabilities","Contingent liabilities associated with Brazil taxes",570361,06/30/25,08/14/25,1,"PricewaterhouseCoopers LLP",121,"PricewaterhouseCoopers LLP",876,London,X0,"UNITED KINGDOM",Foreign,20-F,2025-08-14,,"DIAGEO PLC",835403,"=""DEO""","16 GREAT MARLBOROUGH STREET",,LONDON,X0,"UNITED KINGDOM",Foreign,,,"=""2080""",Beverages,424820,"Wine and Distilled Alcoholic Beverage Merchant Wholesalers",34,105,07/02/25,"63,844,732,928",06/30/25,"20,245,000,000","2,538,000,000","-3,686,000,000","49,322,000,000"
45813,Inventory,"Inventories, net – Obsolescence Reserve — Refer to Note 1 to the financial statements",559073,02/01/25,03/27/25,3,"Deloitte & Touche LLP",,,,Pittsburgh,PA,PENNSYLVANIA,"US Mid Atlantic",10-K,2025-03-27,,"DICK'S SPORTING GOODS, INC.",1089063,"=""DKS""","345 COURT STREET",,CORAOPOLIS,PA,PENNSYLVANIA,"US Mid Atlantic",,,"=""5940""","Retail-Miscellaneous Shopping Goods Stores",451110,"Sporting Goods Stores",34,237,02/03/25,"13,738,875,904",02/01/25,"13,442,849,000","1,165,308,000","2,893,809,000","10,458,694,000"
48887,Goodwill,"Goodwill — IoT Solutions — Refer to Notes 1 and 3 to the financial statements",575931,09/30/25,11/21/25,3,"Deloitte & Touche LLP",,,,Minneapolis,MN,MINNESOTA,"US Midwest",10-K,2025-11-21,,"DIGI INTERNATIONAL INC",854775,"=""DGII""","9350 EXCELSIOR BLVD.","SUITE 700",HOPKINS,MN,MINNESOTA,"US Midwest",,,"=""3576""","Computer Communications Equipment",334119,"Other Computer Peripheral Equipment Manufacturing",34,37,10/02/25,"1,369,437,312",09/30/25,"430,221,000","40,804,000","-107,483,000","922,646,000"
48888,"Business combinations","Acquisitions – Jolt Software, Inc. – Customer Relationship Intangible Asset – Refer to Note 1 and Note 2 to the financial statements",575931,09/30/25,11/21/25,3,"Deloitte & Touche LLP",,,,Minneapolis,MN,MINNESOTA,"US Midwest",10-K,2025-11-21,,"DIGI INTERNATIONAL INC",854775,"=""DGII""","9350 EXCELSIOR BLVD.","SUITE 700",HOPKINS,MN,MINNESOTA,"US Midwest",,,"=""3576""","Computer Communications Equipment",334119,"Other Computer Peripheral Equipment Manufacturing",34,37,10/02/25,"1,369,437,312",09/30/25,"430,221,000","40,804,000","-107,483,000","922,646,000"
45906,"Pension and other post-employment benefits","Pension Plan projected benefit obligation",559524,02/01/25,03/28/25,4,"KPMG LLP",,,,Dallas,TX,TEXAS,"US Southwest",10-K,2025-03-28,,"DILLARD'S, INC.",28917,"=""DDS""","1600 CANTRELL RD",,"LITTLE ROCK",AR,ARKANSAS,"US Southeast",,,"=""5311""","Department Stores",452111,"Department Stores (except Discount Department Stores)",34,461,02/03/25,"5,498,828,288",02/01/25,"6,590,231,000","593,476,000",,"3,531,054,000"
45147,"Revenue from customer contracts","Revenue Recognition - Identifying and Evaluating Terms and Conditions in Contracts",557852,01/31/25,03/18/25,1,"PricewaterhouseCoopers LLP",,,,"San Jose",CA,CALIFORNIA,"US West",10-K,2025-03-18,,"DOCUSIGN, INC.",1261333,"=""DOCU""","221 MAIN ST., SUITE 1550",,"SAN FRANCISCO",CA,CALIFORNIA,"US West",,,"=""7372""","Prepackaged Software",511210,"Software Publishers",34,95,01/29/25,"19,285,129,216",01/31/25,"2,976,739,000","1,067,885,000","1,471,827,000","4,012,705,000"
48854,"Revenue from customer contracts","Assessment of revenue estimate related to sales-based licensing arrangements",575746,09/26/25,11/18/25,4,"KPMG LLP",,,,"San Francisco",CA,CALIFORNIA,"US West",10-K,2025-11-18,,"Dolby Laboratories, Inc.",1308547,"=""DLB""","1275 MARKET STREET",,"SAN FRANCISCO",CA,CALIFORNIA,"US West",,,"=""6794""","Patent Owners and Lessors",512110,"Motion Picture and Video Production",34,72,09/30/25,"4,400,285,184",09/26/25,"1,349,130,000","255,018,000","1,695,600,000","3,227,760,000"
45382,"Other contingent liabilities","Estimate of Workers’ Compensation and General Liability Reserves",558410,01/31/25,03/21/25,2,"Ernst & Young LLP",,,,Nashville,TN,TENNESSEE,"US Southeast",10-K,2025-03-21,,"DOLLAR GENERAL CORP",29534,"=""DG""","100 MISSION RIDGE",,GOODLETTSVILLE,TN,TENNESSEE,"US Southeast",,,"=""5331""","Variety Stores",452990,"All Other General Merchandise Stores",34,72,01/29/25,"15,843,445,760",01/31/25,"40,612,308,000","1,125,253,000","1,875,418,000","31,132,733,000"
45575,"Other contingent liabilities","Evaluation of estimated self-insurance liability",558934,02/01/25,03/26/25,4,"KPMG LLP",,,,"Virginia Beach",VA,VIRGINIA,"US Mid Atlantic",10-K,2025-03-26,,"DOLLAR TREE, INC.",935703,"=""DLTR""","500 VOLVO PARKWAY",N/A,CHESAPEAKE,VA,VIRGINIA,"US Mid Atlantic",,,"=""5331""","Variety Stores",452990,"All Other General Merchandise Stores",34,72,02/03/25,"15,403,217,920",02/01/25,"17,578,500,000","-3,030,100,000","3,556,200,000","18,644,000,000"
45576,"Other intangible assets","Trade name intangible asset impairment",558934,02/01/25,03/26/25,4,"KPMG LLP",,,,"Virginia Beach",VA,VIRGINIA,"US Mid Atlantic",10-K,2025-03-26,,"DOLLAR TREE, INC.",935703,"=""DLTR""","500 VOLVO PARKWAY",N/A,CHESAPEAKE,VA,VIRGINIA,"US Mid Atlantic",,,"=""5331""","Variety Stores",452990,"All Other General Merchandise Stores",34,72,02/03/25,"15,403,217,920",02/01/25,"17,578,500,000","-3,030,100,000","3,556,200,000","18,644,000,000"
46406,"Revenue from customer contracts","Revenue recognition",560639,01/31/25,04/03/25,2,"Ernst & Young LLP",,,,"Salt Lake City",UT,UTAH,"US West",10-K,2025-04-04,,"DOMO, INC.",1505952,"=""DOMO""","802 EAST 1050 SOUTH",,"AMERICAN FORK",UT,UTAH,"US West",,,"=""7372""","Prepackaged Software",511210,"Software Publishers",34,8,01/29/25,"286,392,896",01/31/25,"317,044,000","-81,935,000","-188,849,000","214,340,000"
48551,"Revenue from customer contracts","Revenue Recognition - Product Sales",572990,07/31/25,09/26/25,1,"PricewaterhouseCoopers LLP",,,,Minneapolis,MN,MINNESOTA,"US Midwest",10-K,2025-09-26,,"DONALDSON Co INC",29644,"=""DCI""","1400 W. 94TH ST.",,BLOOMINGTON,MN,MINNESOTA,"US Midwest",,,"=""3564""","Industrial and Commercial Fans and Blowers and Air  Purification Equipment",333411,"Air Purification Equipment Manufacturing",34,72,07/29/25,"8,401,088,000",07/31/25,"3,690,900,000","367,000,000","862,500,000","2,977,200,000"
47467,"Revenue from customer contracts","Revenue Recognition–Subscriptions–Refer to Notes 2 and 3 to the Financial Statements",565425,03/31/25,05/20/25,3,"Deloitte & Touche LLP",,,,"San Francisco",CA,CALIFORNIA,"US West",10-K,2025-05-20,,"Doximity, Inc.",1516513,"=""DOCS""","500 THIRD STREET, SUITE 510",,"SAN FRANCISCO",CA,CALIFORNIA,"US West",,,"=""7371""","Computer Programming Services",541511,"Custom Computer Programming Services",34,58,04/02/25,"7,736,460,288",03/31/25,"570,399,000","223,185,000","991,613,000","1,264,309,000"
47639,"Other contingent liabilities","Contingencies, including litigations",566432,03/31/25,06/06/25,2,"Ernst & Young LLP",490,"Ernst & Young Associates LLP",1712,Hyderabad,K7,INDIA,Foreign,20-F,2025-06-06,,"DR REDDYS LABORATORIES LTD",1135951,"=""RDY""","8-2-337, ROAD NO.3 BANJARA HILLS",,HYPERABAD,K7,INDIA,Foreign,,,"=""2834""","Pharmaceutical Preparations",325412,"Pharmaceutical Preparation Manufacturing",34,13,03/31/25,"10,974,120,960",03/31/25,"3,809,000,000","670,000,000","2,630,000,000","5,768,000,000"
47640,"Sales return and allowances","Chargebacks related to Revenue",566432,03/31/25,06/06/25,2,"Ernst & Young LLP",490,"Ernst & Young Associates LLP",1712,Hyderabad,K7,INDIA,Foreign,20-F,2025-06-06,,"DR REDDYS LABORATORIES LTD",1135951,"=""RDY""","8-2-337, ROAD NO.3 BANJARA HILLS",,HYPERABAD,K7,INDIA,Foreign,,,"=""2834""","Pharmaceutical Preparations",325412,"Pharmaceutical Preparation Manufacturing",34,13,03/31/25,"10,974,120,960",03/31/25,"3,809,000,000","670,000,000","2,630,000,000","5,768,000,000"
47641,"Business combinations","Acquisition from Haleon UK Enterprises Limited",566432,03/31/25,06/06/25,2,"Ernst & Young LLP",490,"Ernst & Young Associates LLP",1712,Hyderabad,K7,INDIA,Foreign,20-F,2025-06-06,,"DR REDDYS LABORATORIES LTD",1135951,"=""RDY""","8-2-337, ROAD NO.3 BANJARA HILLS",,HYPERABAD,K7,INDIA,Foreign,,,"=""2834""","Pharmaceutical Preparations",325412,"Pharmaceutical Preparation Manufacturing",34,13,03/31/25,"10,974,120,960",03/31/25,"3,809,000,000","670,000,000","2,630,000,000","5,768,000,000"
45403,"Sales return and allowances","Product return reserve",558517,02/02/25,03/21/25,4,"KPMG LLP",,,,Milwaukee,WI,WISCONSIN,"US Midwest",10-K,2025-03-24,,"DULUTH HOLDINGS INC.",1649744,"=""DLTH""","201 EAST FRONT STREET",,"MOUNT HOREB",WI,WISCONSIN,"US Midwest",,,"=""5600""","Retail-Apparel & Accessory Stores",448110,"Men's Clothing Stores",34,3,02/04/25,"91,939,440",02/02/25,"626,629,000","-43,671,000",,"452,442,000"
47425,"Revenue from customer contracts","Revenue Recognition — Refer to Notes 1 and 11 to the financial statements",565130,03/31/25,05/14/25,3,"Deloitte & Touche LLP",,,,McLean,VA,VIRGINIA,"US Mid Atlantic",10-K,2025-05-15,,"DXC Technology Co",1688568,"=""DXC""","20408 BASHAN DRIVE","SUITE 231",ASHBURN,VA,VIRGINIA,"US Mid Atlantic",,,"=""7374""","Computer Processing and Data Preparation and Processing Services",518210,"Data Processing, Hosting, and Related Services",34,17,03/31/25,"3,089,507,072",03/31/25,"12,871,000,000","389,000,000","1,061,000,000","13,205,000,000"
43821,"Business combinations","Acquisition of Certain Assets of a Telecommunications Construction Contractor - Valuation of Customer Relationships",554613,01/25/25,02/28/25,1,"PricewaterhouseCoopers LLP",,,,Miami,FL,FLORIDA,"US Southeast",10-K,2025-02-28,,"DYCOM INDUSTRIES INC",67215,"=""DY""","300 BANYAN BLVD","SUITE 1101","WEST PALM BEACH",FL,FLORIDA,"US Southeast",,,"=""1623""","Water, Sewer, Pipeline, and Communications and Power Line Construction",237130,"Power and Communication Line and Related Structures Construction",34,178,01/27/25,"5,197,971,968",01/25/25,"4,702,014,000","233,413,000","689,021,000","2,945,367,000"
47494,"Revenue from customer contracts","Revenue Recognition – Determination of Distinct Performance Obligations",565546,03/31/25,05/22/25,2,"Ernst & Young LLP",,,,Detroit,MI,MICHIGAN,"US Midwest",10-K,2025-05-22,,"Dynatrace, Inc.",1773383,"=""DT""","280 CONGRESS STREET","11TH FLOOR",BOSTON,MA,MASSACHUSETTS,"US New England",,,"=""7372""","Prepackaged Software",518210,"Data Processing, Hosting, and Related Services",34,48,04/02/25,"14,479,560,704",03/31/25,"1,698,683,000","483,684,000","1,259,179,000","4,139,678,000"
47495,"Deferred income taxes","Income Taxes – Valuation of Transferred IP",565546,03/31/25,05/22/25,2,"Ernst & Young LLP",,,,Detroit,MI,MICHIGAN,"US Midwest",10-K,2025-05-22,,"Dynatrace, Inc.",1773383,"=""DT""","280 CONGRESS STREET","11TH FLOOR",BOSTON,MA,MASSACHUSETTS,"US New England",,,"=""7372""","Prepackaged Software",518210,"Data Processing, Hosting, and Related Services",34,48,04/02/25,"14,479,560,704",03/31/25,"1,698,683,000","483,684,000","1,259,179,000","4,139,678,000"
47569,"Sales return and allowances","Provision for Certain Customer Incentives and Allowances — Refer to Note 2 to the financial statements",565913,03/31/25,05/28/25,3,"Deloitte & Touche LLP",,,,"San Francisco",CA,CALIFORNIA,"US West",10-K,2025-05-29,,"e.l.f. Beauty, Inc.",1600033,"=""ELF""","601 12TH STREET","SUITE 1400",OAKLAND,CA,CALIFORNIA,"US West",,,"=""2844""","Perfumes, Cosmetics, and Other Toilet Preparations",325620,"Toilet Preparation Manufacturing",34,63,03/31/25,"3,499,289,088",03/31/25,"1,313,517,000","112,089,000","212,575,000","1,248,175,000"
47115,Goodwill,"Goodwill impairment assessment",563238,02/28/25,04/29/25,2,"Ernst & Young LLP",,,,Austin,TX,TEXAS,"US Southwest",10-K,2025-04-29,,"E2open Parent Holdings, Inc.",1800347,"=""ETWO""","14135 MIDWAY ROAD","SUITE G300",ADDISON,TX,TEXAS,"US Southwest",,,"=""7374""","Computer Processing and Data Preparation and Processing Services",511210,"Software Publishers",34,2,02/28/25,"709,721,984",02/28/25,"607,688,000","-659,830,000","-1,041,855,000","2,371,035,000"
47116,"Other income taxes","Tax receivable agreement liability",563238,02/28/25,04/29/25,2,"Ernst & Young LLP",,,,Austin,TX,TEXAS,"US Southwest",10-K,2025-04-29,,"E2open Parent Holdings, Inc.",1800347,"=""ETWO""","14135 MIDWAY ROAD","SUITE G300",ADDISON,TX,TEXAS,"US Southwest",,,"=""7374""","Computer Processing and Data Preparation and Processing Services",511210,"Software Publishers",34,2,02/28/25,"709,721,984",02/28/25,"607,688,000","-659,830,000","-1,041,855,000","2,371,035,000"
47458,Inventory,"Raw Materials and Materials-in-Progress inventory existence",565434,03/31/25,05/20/25,2,"Ernst & Young LLP",,,,Dallas,TX,TEXAS,"US Southwest",10-K,2025-05-20,,"EAGLE MATERIALS INC",918646,"=""EXP""","5960 BERKSHIRE LANE","SUITE 900",DALLAS,TX,TEXAS,"US Southwest",,,"=""3241""","Cement, Hydraulic",327310,"Cement Manufacturing",34,222,03/31/25,"7,317,724,672",03/31/25,"2,260,508,000","463,416,000","860,948,000","3,264,588,000"
48852,"Other intangible assets","Indefinite-lived Intangible Asset Impairment Assessment – Banana Boat Trade Name",575745,09/30/25,11/17/25,1,"PricewaterhouseCoopers LLP",,,,Stamford,CT,CONNECTICUT,"US New England",10-K,2025-11-18,,"EDGEWELL PERSONAL CARE Co",1096752,"=""EPC""","6 RESEARCH DRIVE",,SHELTON,CT,CONNECTICUT,"US New England",,,"=""2844""","Perfumes, Cosmetics, and Other Toilet Preparations",335912,"Primary Battery Manufacturing",34,21,10/02/25,"957,163,456",09/30/25,"2,223,500,000","25,400,000","-659,300,000","3,756,300,000"
48853,Goodwill,"Goodwill Impairment Assessments – Wet Shave and Skin Care Reporting Units",575745,09/30/25,11/17/25,1,"PricewaterhouseCoopers LLP",,,,Stamford,CT,CONNECTICUT,"US New England",10-K,2025-11-18,,"EDGEWELL PERSONAL CARE Co",1096752,"=""EPC""","6 RESEARCH DRIVE",,SHELTON,CT,CONNECTICUT,"US New England",,,"=""2844""","Perfumes, Cosmetics, and Other Toilet Preparations",335912,"Primary Battery Manufacturing",34,21,10/02/25,"957,163,456",09/30/25,"2,223,500,000","25,400,000","-659,300,000","3,756,300,000"
47673,"Revenue from customer contracts","Revenue Recognition – Identification and Evaluation of Terms and Conditions in Contracts",566754,04/30/25,06/09/25,1,"PricewaterhouseCoopers LLP",,,,"San Jose",CA,CALIFORNIA,"US West",10-K,2025-06-10,,"Elastic N.V.",1707753,"=""ESTC""","KEIZERSGRACHT 281",,AMSTERDAM,P7,NETHERLANDS,Foreign,,,"=""7372""","Prepackaged Software",511210,"Software Publishers",34,83,05/02/25,"8,657,910,784",04/30/25,"1,483,296,000","-108,114,000","596,413,000","2,592,853,000"
47365,"Revenue from customer contracts","Assessment of the estimated offering period",564931,03/29/25,05/13/25,4,"KPMG LLP",,,,"Santa Clara",CA,CALIFORNIA,"US West",10-K,2025-05-13,,"ELECTRONIC ARTS INC.",712515,"=""EA""","209 REDWOOD SHORES PARKWAY",,"REDWOOD CITY",CA,CALIFORNIA,"US West",,,"=""7372""","Prepackaged Software",511210,"Software Publishers",34,145,04/02/25,"37,755,670,528",03/31/25,"7,463,000,000","1,121,000,000","717,000,000","12,368,000,000"
47773,"Other investments","Valuation of Certain Level 3 Investments in Securities",567273,03/31/25,06/23/25,1,"PricewaterhouseCoopers LLP",,,,"New York",NY,"NEW YORK","US Mid Atlantic",10-K,2025-06-23,,"Ellington Credit Co",1560672,"=""EARN""","53 FOREST AVENUE",,"OLD GREENWICH",CT,CONNECTICUT,"US New England",,,"=""6798""","Real Estate Investment Trusts",525990,"Other Financial Vehicles",40,,,,,,,,
48924,"Revenue from customer contracts","Estimation of variable consideration for revenue recognition",576054,09/30/25,11/25/25,2,"Ernst & Young LLP",,,,"New York",NY,"NEW YORK","US Mid Atlantic",10-K,2025-11-25,,"Embecta Corp.",1872789,"=""EMBC""","1209 ORANGE STREET",,WILMINGTON,DE,DELAWARE,"US Mid Atlantic",,,"=""3841""","Surgical and Medical Instruments and Apparatus",325411,"Medicinal and Botanical Manufacturing",34,14,09/30/25,"825,380,160",09/30/25,"1,080",95,-673,"1,091"
48759,"Other revenue","Sufficiency of Audit Evidence over Net Sales",575311,09/30/25,11/10/25,4,"KPMG LLP",,,,"Saint Louis",MO,MISSOURI,"US Southeast",10-K,2025-11-10,,"EMERSON ELECTRIC CO",32604,"=""EMR""","8027 FORSYTH BLVD",,"ST LOUIS",MO,MISSOURI,"US Southeast",,,"=""3600""","Electronic & Other Electrical Equipment (No Computer Equip)",335999,"All Other Miscellaneous Electrical Equipment and Component Manufacturing",34,133,10/02/25,"74,880,540,672",09/30/25,"18,016,000,000","2,293,000,000","-7,369,000,000","41,964,000,000"
48863,"Research and development expenses","Research and Development and Pharmaceutical Drug Manufacturing Accruals",575789,09/30/25,11/19/25,1,"PricewaterhouseCoopers LLP",,,,Boston,MA,MASSACHUSETTS,"US New England",10-K,2025-11-19,,"ENANTA PHARMACEUTICALS INC",1177648,"=""ENTA""","4 KINGSBURY AVENUE",,WATERTOWN,MA,MASSACHUSETTS,"US New England",,,"=""2834""","Pharmaceutical Preparations",325412,"Pharmaceutical Preparation Manufacturing",34,10,10/02/25,"220,833,952",09/30/25,"65,324,000","-81,889,000",,"280,732,000"
48390,"Business combinations","Valuation of acquired client relationships – GalaxE acquisition",571466,06/30/25,09/04/25,1,"PricewaterhouseCoopers LLP",121,"PricewaterhouseCoopers LLP",876,Reading,X0,"UNITED KINGDOM",Foreign,20-F,2025-09-04,,"Endava plc",1656081,"=""DAVA""","125 OLD BROAD STREET",,LONDON,X0,"UNITED KINGDOM",Foreign,,,"=""7371""","Computer Programming Services",541511,"Custom Computer Programming Services",34,15,06/30/25,"653,613,696",06/30/25,"1,058,260,000","29,068,000","12,545,000","1,282,335,000"
48391,Goodwill,"Impairment assessment of goodwill",571466,06/30/25,09/04/25,1,"PricewaterhouseCoopers LLP",121,"PricewaterhouseCoopers LLP",876,Reading,X0,"UNITED KINGDOM",Foreign,20-F,2025-09-04,,"Endava plc",1656081,"=""DAVA""","125 OLD BROAD STREET",,LONDON,X0,"UNITED KINGDOM",Foreign,,,"=""7371""","Computer Programming Services",541511,"Custom Computer Programming Services",34,15,06/30/25,"653,613,696",06/30/25,"1,058,260,000","29,068,000","12,545,000","1,282,335,000"
48392,"Deferred income taxes","Recoverability assessment of UK deferred tax assets",571466,06/30/25,09/04/25,1,"PricewaterhouseCoopers LLP",121,"PricewaterhouseCoopers LLP",876,Reading,X0,"UNITED KINGDOM",Foreign,20-F,2025-09-04,,"Endava plc",1656081,"=""DAVA""","125 OLD BROAD STREET",,LONDON,X0,"UNITED KINGDOM",Foreign,,,"=""7371""","Computer Programming Services",541511,"Custom Computer Programming Services",34,15,06/30/25,"653,613,696",06/30/25,"1,058,260,000","29,068,000","12,545,000","1,282,335,000"
48843,"Revenue from customer contracts","Revenue Recognition - Trade Promotion Programs",575753,09/30/25,11/18/25,1,"PricewaterhouseCoopers LLP",,,,"Saint Louis",MO,MISSOURI,"US Southeast",10-K,2025-11-18,,"ENERGIZER HOLDINGS, INC.",1632790,"=""ENR""","8235 FORSYTH BOULEVARD","SUITE 100","SAINT LOUIS",MO,MISSOURI,"US Southeast",,,"=""3690""","Miscellaneous Electrical Machinery, Equipment & Supplies",335911,"Storage Battery Manufacturing",34,25,10/02/25,"1,706,030,720",09/30/25,"2,952,700,000","239,000,000","-1,886,800,000","4,556,700,000"
48640,"Business combinations","Valuation of the potential earn-out and acquired intangible assets",574060,08/31/25,10/17/25,2,"Ernst & Young LLP",,,,Milwaukee,WI,WISCONSIN,"US Midwest",10-K,2025-10-17,,"ENERPAC TOOL GROUP CORP",6955,"=""EPAC""","648 N PLANKINTON AVE, 4TH FLOOR",,MILWAUKEE,WI,WISCONSIN,"US Midwest",,,"=""3590""","Misc Industrial & Commercial Machinery & Equipment",333991,"Power-Driven Handtool Manufacturing",34,42,09/02/25,"2,262,131,456",08/31/25,"616,899,000","92,749,000","96,965,000","827,867,000"
47472,"Other income taxes","Accounting for Certain Tax Credits Under the Inflation Reduction Act",565482,03/31/25,05/21/25,2,"Ernst & Young LLP",,,,Philadelphia,PA,PENNSYLVANIA,"US Mid Atlantic",10-K,2025-05-21,,EnerSys,1289308,"=""ENS""","2366 BERNVILLE ROAD",,READING,PA,PENNSYLVANIA,"US Mid Atlantic",,,"=""3690""","Miscellaneous Electrical Machinery, Equipment & Supplies",335911,"Storage Battery Manufacturing",34,92,03/31/25,"3,589,208,832",03/31/25,"3,617,579,000","363,735,000","819,575,000","3,971,248,000"
47473,"Other intangible assets","Valuation of Indefinite-Lived Intangible Assets",565482,03/31/25,05/21/25,2,"Ernst & Young LLP",,,,Philadelphia,PA,PENNSYLVANIA,"US Mid Atlantic",10-K,2025-05-21,,EnerSys,1289308,"=""ENS""","2366 BERNVILLE ROAD",,READING,PA,PENNSYLVANIA,"US Mid Atlantic",,,"=""3690""","Miscellaneous Electrical Machinery, Equipment & Supplies",335911,"Storage Battery Manufacturing",34,92,03/31/25,"3,589,208,832",03/31/25,"3,617,579,000","363,735,000","819,575,000","3,971,248,000"
47742,"Other income taxes","Accounting for Certain Tax Credits Under the Inflation Reduction Act",567148,03/31/25,05/21/25,2,"Ernst & Young LLP",,,,Philadelphia,PA,PENNSYLVANIA,"US Mid Atlantic","DEF 14A",2025-06-18,,EnerSys,1289308,"=""ENS""","2366 BERNVILLE ROAD",,READING,PA,PENNSYLVANIA,"US Mid Atlantic",,,"=""3690""","Miscellaneous Electrical Machinery, Equipment & Supplies",335911,"Storage Battery Manufacturing",34,92,03/31/25,"3,589,208,832",03/31/25,"3,617,579,000","363,735,000","819,575,000","3,971,248,000"
47743,"Other intangible assets","Valuation of Indefinite-Lived Intangible Assets",567148,03/31/25,05/21/25,2,"Ernst & Young LLP",,,,Philadelphia,PA,PENNSYLVANIA,"US Mid Atlantic","DEF 14A",2025-06-18,,EnerSys,1289308,"=""ENS""","2366 BERNVILLE ROAD",,READING,PA,PENNSYLVANIA,"US Mid Atlantic",,,"=""3690""","Miscellaneous Electrical Machinery, Equipment & Supplies",335911,"Storage Battery Manufacturing",34,92,03/31/25,"3,589,208,832",03/31/25,"3,617,579,000","363,735,000","819,575,000","3,971,248,000"
47744,"Business combinations","Acquisition of Bren-Tronics",567148,03/31/25,05/21/25,2,"Ernst & Young LLP",,,,Philadelphia,PA,PENNSYLVANIA,"US Mid Atlantic","DEF 14A",2025-06-18,,EnerSys,1289308,"=""ENS""","2366 BERNVILLE ROAD",,READING,PA,PENNSYLVANIA,"US Mid Atlantic",,,"=""3690""","Miscellaneous Electrical Machinery, Equipment & Supplies",335911,"Storage Battery Manufacturing",34,92,03/31/25,"3,589,208,832",03/31/25,"3,617,579,000","363,735,000","819,575,000","3,971,248,000"
47488,"Revenue from customer contracts","Revenue Recognition – Gross Versus Net Recognition of Sales of Third-Party Software – Refer to Note 1 to the financial statements",565536,03/31/25,05/22/25,3,"Deloitte & Touche LLP",,,,McLean,VA,VIRGINIA,"US Mid Atlantic",10-K,2025-05-22,,"EPLUS INC",1022408,"=""PLUS""","13595 DULLES TECHNOLOGY DRIVE",,HERNDON,VA,VIRGINIA,"US Mid Atlantic",,,"=""5045""","Computers and Computer Peripheral Equipment and Software",541512,"Computer Systems Design Services",34,61,03/31/25,"1,618,881,792",03/31/25,"2,068,789,000","107,978,000","692,758,000","1,884,805,000"
47489,"Accounts/loans receivable","Transfers of Financial Assets – Refer to Note 4 to the financial statements",565536,03/31/25,05/22/25,3,"Deloitte & Touche LLP",,,,McLean,VA,VIRGINIA,"US Mid Atlantic",10-K,2025-05-22,,"EPLUS INC",1022408,"=""PLUS""","13595 DULLES TECHNOLOGY DRIVE",,HERNDON,VA,VIRGINIA,"US Mid Atlantic",,,"=""5045""","Computers and Computer Peripheral Equipment and Software",541512,"Computer Systems Design Services",34,61,03/31/25,"1,618,881,792",03/31/25,"2,068,789,000","107,978,000","692,758,000","1,884,805,000"
48233,"Other intangible assets","Interim Indefinite-Lived Intangible Asset Impairment Assessment – TOM FORD Trademark",570595,06/30/25,08/20/25,1,"PricewaterhouseCoopers LLP",,,,"New York",NY,"NEW YORK","US Mid Atlantic",10-K,2025-08-20,,"ESTEE LAUDER COMPANIES INC",1001250,"=""EL""","767 FIFTH AVE",,"NEW YORK",NY,"NEW YORK","US Mid Atlantic",,,"=""2844""","Perfumes, Cosmetics, and Other Toilet Preparations",325620,"Toilet Preparation Manufacturing",34,81,06/30/25,"18,925,365,248",06/30/25,"14,326,000,000","-1,133,000,000","-2,029,000,000","19,892,000,000"
48234,"Other intangible assets","Annual Indefinite-Lived Intangible Asset Impairment Assessments – DECIEM Trademarks",570595,06/30/25,08/20/25,1,"PricewaterhouseCoopers LLP",,,,"New York",NY,"NEW YORK","US Mid Atlantic",10-K,2025-08-20,,"ESTEE LAUDER COMPANIES INC",1001250,"=""EL""","767 FIFTH AVE",,"NEW YORK",NY,"NEW YORK","US Mid Atlantic",,,"=""2844""","Perfumes, Cosmetics, and Other Toilet Preparations",325620,"Toilet Preparation Manufacturing",34,81,06/30/25,"18,925,365,248",06/30/25,"14,326,000,000","-1,133,000,000","-2,029,000,000","19,892,000,000"
48936,"Revenue from customer contracts","Revenue Recognition for Certain Products and Services",576018,09/30/25,11/25/25,1,"PricewaterhouseCoopers LLP",,,,Seattle,WA,WASHINGTON,"US West",10-K,2025-11-25,,"F5, INC.",1048695,"=""FFIV""","801 5TH AVENUE",,SEATTLE,WA,WASHINGTON,"US West",,,"=""3576""","Computer Communications Equipment",541512,"Computer Systems Design Services",34,327,10/02/25,"18,795,565,056",09/30/25,"3,088,072,000","692,380,000","1,148,117,000","6,319,492,000"
48228,"Revenue from customer contracts","Revenue recognition – Identifying and evaluating terms and conditions in contracts for the timing of revenue recognition.",570552,06/27/25,08/19/25,1,"PricewaterhouseCoopers LLP",262,"PricewaterhouseCoopers ABAS Limited",1194,Bangkok,W1,THAILAND,Foreign,10-K,2025-08-19,,Fabrinet,1408710,"=""FN""","C/O INTERTRUST CORPORATE SERVICES","ONE NEXUS WAY, CAMANA BAY","GRAND CAYMAN",E9,"CAYMAN ISLANDS",Foreign,,,"=""3661""","Telephone and Telegraph Apparatus",333314,"Optical Instrument and Lens Manufacturing",34,299,06/26/25,"10,710,857,728",06/27/25,"3,419,327,000","332,527,000","1,979,656,000","2,831,432,000"
48659,"Uncertain tax positions","Measurement of income tax provision",574232,08/31/25,10/22/25,2,"Ernst & Young LLP",,,,Stamford,CT,CONNECTICUT,"US New England",10-K,2025-10-22,,"FACTSET RESEARCH SYSTEMS INC",1013237,"=""FDS""","45 GLOVER AVENUE",,NORWALK,CT,CONNECTICUT,"US New England",,,"=""7370""","Services-Computer Programming, Data Processing, Etc.",511210,"Software Publishers",34,369,09/02/25,"13,946,163,200",08/31/25,"2,321,748,000","597,040,000","-1,014,397,000","4,304,272,000"
48660,"Business combinations","Valuation of Acquired Software Technology",574232,08/31/25,10/22/25,2,"Ernst & Young LLP",,,,Stamford,CT,CONNECTICUT,"US New England",10-K,2025-10-22,,"FACTSET RESEARCH SYSTEMS INC",1013237,"=""FDS""","45 GLOVER AVENUE",,NORWALK,CT,CONNECTICUT,"US New England",,,"=""7370""","Services-Computer Programming, Data Processing, Etc.",511210,"Software Publishers",34,369,09/02/25,"13,946,163,200",08/31/25,"2,321,748,000","597,040,000","-1,014,397,000","4,304,272,000"
48742,"Revenue from customer contracts","Revenue Recognition – Contracts with Customers – Refer to Note 1 and Note 9 to the financial statements",575237,09/30/25,11/07/25,3,"Deloitte & Touche LLP",,,,"San Diego",CA,CALIFORNIA,"US West",10-K,2025-11-07,,"FAIR ISAAC CORP",814547,"=""FICO""","5 WEST MENDENHALL","SUITES 105",BOZEMAN,MT,MONTANA,"US West",,,"=""7389""","Business Services, NEC",561499,"All Other Business Support Services",34,"1,785",10/02/25,"42,838,843,392",09/30/25,"1,990,869,000","651,946,000","-2,529,124,000","1,868,133,000"
47987,"Pension and other post-employment benefits","U.S. Pension Projected Benefit Obligation",568828,05/31/25,07/21/25,2,"Ernst & Young LLP",,,,Memphis,TN,TENNESSEE,"US Southeast",10-K,2025-07-21,,"FEDEX CORP",1048911,"=""FDX""","942 SOUTH SHADY GROVE ROAD",,MEMPHIS,TN,TENNESSEE,"US Southeast",,,"=""4513""","Air Courier Services",492110,Couriers,34,218,06/02/25,"52,206,206,976",05/31/25,"87,926,000,000","4,092,000,000","21,471,000,000","87,627,000,000"
47988,"Other contingent liabilities","Valuation of Self-Insurance Accruals",568828,05/31/25,07/21/25,2,"Ernst & Young LLP",,,,Memphis,TN,TENNESSEE,"US Southeast",10-K,2025-07-21,,"FEDEX CORP",1048911,"=""FDX""","942 SOUTH SHADY GROVE ROAD",,MEMPHIS,TN,TENNESSEE,"US Southeast",,,"=""4513""","Air Courier Services",492110,Couriers,34,218,06/02/25,"52,206,206,976",05/31/25,"87,926,000,000","4,092,000,000","21,471,000,000","87,627,000,000"
48544,Inventory,"Inventory Reserves - Refer to Note 1 to the Financial Statements",572982,07/31/25,09/26/25,3,"Deloitte & Touche LLP",,,,Richmond,VA,VIRGINIA,"US Mid Atlantic",10-K,2025-09-26,,"Ferguson Enterprises Inc. /DE/",2011641,"=""FERG""","751 LAKEFRONT COMMONS",,"NEWPORT NEWS",VA,VIRGINIA,"US Mid Atlantic",,,"=""5070""","Wholesale-Hardware & Plumbing & Heating Equipment & Supplies",238220,"Plumbing, Heating, and Air-Conditioning Contractors",34,227,07/29/25,"44,752,207,872",07/31/25,"30,762,000,000","1,856,000,000","2,642,000,000","17,729,000,000"
45329,Inventory,"Slow-moving and obsolete inventories at net realizable value",558142,02/01/25,03/20/25,4,"KPMG LLP",,,,Philadelphia,PA,PENNSYLVANIA,"US Mid Atlantic",10-K,2025-03-20,,"FIVE BELOW, INC",1177609,"=""FIVE""","701 MARKET STREET","SUITE 300",PHILADELPHIA,PA,PENNSYLVANIA,"US Mid Atlantic",,,"=""5331""","Variety Stores",452111,"Department Stores (except Discount Department Stores)",34,92,02/03/25,"5,079,038,976",02/01/25,"3,876,527,000","253,611,000",,"4,339,574,000"
47475,"Revenue from customer contracts","Revenue - Variable Consideration and Associated Customer-Related Accruals for Pricing Adjustments - Refer to Notes 2 and 4 to the Financial Statements",565500,03/31/25,05/21/25,3,"Deloitte & Touche LLP",,,,"San Jose",CA,CALIFORNIA,"US West",10-K,2025-05-21,,"FLEX LTD.",866374,"=""FLEX""","12515-8 RESEARCH BLVD","SUITE 300",AUSTIN,TX,TEXAS,"US Southwest",,,"=""3672""","Printed Circuit Boards",334418,"Printed Circuit Assembly (Electronic Assembly) Manufacturing",34,34,04/02/25,"13,050,405,888",03/31/25,"25,813,000,000","838,000,000","3,318,000,000","18,381,000,000"
48277,Inventory,"Inventories — Refer to Notes 1 and 3 to the financial statements",570709,06/30/25,08/22/25,3,"Deloitte & Touche LLP",,,,Minneapolis,MN,MINNESOTA,"US Midwest",10-K,2025-08-22,,"FLEXSTEEL INDUSTRIES INC",37472,"=""FLXS""","385 BELL ST.",,DUBUQUE,IA,IOWA,"US Midwest",,,"=""2510""","Household Furniture",337121,"Upholstered Household Furniture Manufacturing",34,39,07/02/25,"203,125,712",06/30/25,"441,073,000","20,154,000",,"282,486,000"
48278,"Long-lived assets","Mexicali Right-of-Use Asset Impairment — Refer to Notes 1 and 2 to the financial statements",570709,06/30/25,08/22/25,3,"Deloitte & Touche LLP",,,,Minneapolis,MN,MINNESOTA,"US Midwest",10-K,2025-08-22,,"FLEXSTEEL INDUSTRIES INC",37472,"=""FLXS""","385 BELL ST.",,DUBUQUE,IA,IOWA,"US Midwest",,,"=""2510""","Household Furniture",337121,"Upholstered Household Furniture Manufacturing",34,39,07/02/25,"203,125,712",06/30/25,"441,073,000","20,154,000",,"282,486,000"
48923,"Revenue from customer contracts","Revenue Recognition – Percentage of Completion",576053,09/30/25,11/25/25,2,"Ernst & Young LLP",,,,Tysons,VA,VIRGINIA,"US Mid Atlantic",10-K,2025-11-25,,"Fluence Energy, Inc.",1868941,"=""FLNC""","4601 FAIRFAX DRIVE","SUITE 600",ARLINGTON,VA,VIRGINIA,"US Mid Atlantic",,,"=""3690""","Miscellaneous Electrical Machinery, Equipment & Supplies",0,,34,13,10/02/25,"1,709,641,088",09/30/25,"2,262,830,000","-48,314,000","337,608,000","2,357,000,000"
45757,Inventory,"Sufficiency of audit evidence over merchandise inventories",559258,02/01/25,03/27/25,4,"KPMG LLP",,,,"New York",NY,"NEW YORK","US Mid Atlantic",10-K,2025-03-27,,"FOOT LOCKER, INC.",850209,"=""FL""","FOOT LOCKER, INC.","330 WEST 34TH STREET","NEW YORK",NY,"NEW YORK","US Mid Atlantic",,,"=""5661""","Shoe Stores",448210,"Shoe Stores",34,19,02/03/25,"1,791,501,696",02/01/25,"7,988,000,000","12,000,000","1,785,000,000","6,748,000,000"
45758,Goodwill,"Fair value assessment of the EMEA and Asia Pacific reporting units",559258,02/01/25,03/27/25,4,"KPMG LLP",,,,"New York",NY,"NEW YORK","US Mid Atlantic",10-K,2025-03-27,,"FOOT LOCKER, INC.",850209,"=""FL""","FOOT LOCKER, INC.","330 WEST 34TH STREET","NEW YORK",NY,"NEW YORK","US Mid Atlantic",,,"=""5661""","Shoe Stores",448210,"Shoe Stores",34,19,02/03/25,"1,791,501,696",02/01/25,"7,988,000,000","12,000,000","1,785,000,000","6,748,000,000"
48865,Inventory,"Land development costs (including estimated costs to complete)",575791,09/30/25,11/19/25,2,"Ernst & Young LLP",,,,"Fort Worth",TX,TEXAS,"US Southwest",10-K,2025-11-19,,"Forestar Group Inc.",1406587,"=""FOR""","2221 E. LAMAR BLVD.","SUITE 790",ARLINGTON,TX,TEXAS,"US Southwest",,,"=""6500""","Real Estate",237210,"Land Subdivision",34,27,10/02/25,"1,364,362,368",09/30/25,"1,662,400,000","167,900,000",,"3,137,000,000"
48121,"Depreciation and amortization","Program rights amortization – National sports programming",569833,06/30/25,08/06/25,2,"Ernst & Young LLP",,,,"New York",NY,"NEW YORK","US Mid Atlantic",10-K,2025-08-06,,"Fox Corp",1754301,"=""FOX""","1211 AVENUE OF THE AMERICAS",,"NEW YORK",NY,"NEW YORK","US Mid Atlantic",,,"=""4833""","Television Broadcasting Stations",515120,"Television Broadcasting",34,51,07/02/25,"11,960,449,024",06/30/25,"16,300,000,000","2,263,000,000","5,642,000,000","23,195,000,000"
48122,"Other contingent liabilities","Defamation and disparagement claims",569833,06/30/25,08/06/25,2,"Ernst & Young LLP",,,,"New York",NY,"NEW YORK","US Mid Atlantic",10-K,2025-08-06,,"Fox Corp",1754301,"=""FOX""","1211 AVENUE OF THE AMERICAS",,"NEW YORK",NY,"NEW YORK","US Mid Atlantic",,,"=""4833""","Television Broadcasting Stations",515120,"Television Broadcasting",34,51,07/02/25,"11,960,449,024",06/30/25,"16,300,000,000","2,263,000,000","5,642,000,000","23,195,000,000"
48775,"Revenue from customer contracts","Revenue Recognition – Refer to Note 2 to the Financial Statements",575401,08/31/25,11/12/25,3,"Deloitte & Touche LLP",,,,"Salt Lake City",UT,UTAH,"US West",10-K,2025-11-12,,"FRANKLIN COVEY CO",886206,"=""FC""","2200 W PARKWAY BLVD",,"SALT LAKE CITY",UT,UTAH,"US West",,,"=""8741""","Management Services",611710,"Educational Support Services",34,20,09/02/25,"247,653,296",08/31/25,"267,067,000","3,068,000","1,140,000","242,912,000"
48760,"Deferred income taxes","Realizability of Deferred Tax Assets",575312,09/30/25,11/10/25,1,"PricewaterhouseCoopers LLP",,,,"San Francisco",CA,CALIFORNIA,"US West",10-K,2025-11-10,,"FRANKLIN RESOURCES INC",38777,"=""BEN""","ONE FRANKLIN PARKWAY","BUILDING 920/2, LEGAL-FRI SECRETARY","SAN MATEO",CA,CALIFORNIA,"US West",,,"=""6282""","Investment Advice",523930,"Investment Advice",34,23,09/30/25,"12,049,614,848",09/30/25,"8,675,800,000","524,900,000","2,887,800,000","32,368,300,000"
48761,"Other intangible assets","Valuation of the Indefinite-Lived Intangible Asset Associated with the Management Contracts Managed by Western Asset Management",575312,09/30/25,11/10/25,1,"PricewaterhouseCoopers LLP",,,,"San Francisco",CA,CALIFORNIA,"US West",10-K,2025-11-10,,"FRANKLIN RESOURCES INC",38777,"=""BEN""","ONE FRANKLIN PARKWAY","BUILDING 920/2, LEGAL-FRI SECRETARY","SAN MATEO",CA,CALIFORNIA,"US West",,,"=""6282""","Investment Advice",523930,"Investment Advice",34,23,09/30/25,"12,049,614,848",09/30/25,"8,675,800,000","524,900,000","2,887,800,000","32,368,300,000"
47700,"Revenue from customer contracts","Revenue recognition – Fee and commission income from brokerage services from one institutional brokerage customer – Refer to Notes 2, 6 and 18 to the financial statements",566916,03/31/25,06/13/25,3,"Deloitte & Touche LLP",732,"Deloitte LLP",1056,Almaty,1P,KAZAKHSTAN,Foreign,10-K,2025-06-13,,"Freedom Holding Corp.",924805,"=""FRHC""","40 WALL STREET, 58TH FLOOR",,"NEW YORK, NY",NY,"NEW YORK","US Mid Atlantic",,,"=""6211""","Security Brokers, Dealers, and Flotation Companies",211111,"Crude Petroleum and Natural Gas Extraction",34,138,04/02/25,"8,338,916,864",03/31/25,"1,435,115,000","84,650,000","1,110,962,000","9,914,017,000"
48056,"Revenue from customer contracts","Revenue recognition - Fee and commission income from brokerage services from one institutional brokerage customer - Refer to Notes 2, 6 and 18 to the financial statements",569253,03/31/25,06/13/25,3,"Deloitte & Touche LLP",732,"Deloitte LLP",1056,Almaty,1P,KAZAKHSTAN,Foreign,ARS,2025-07-29,,"Freedom Holding Corp.",924805,"=""FRHC""","40 WALL STREET, 58TH FLOOR",,"NEW YORK, NY",NY,"NEW YORK","US Mid Atlantic",,,"=""6211""","Security Brokers, Dealers, and Flotation Companies",211111,"Crude Petroleum and Natural Gas Extraction",34,138,04/02/25,"8,338,916,864",03/31/25,"1,435,115,000","84,650,000","1,110,962,000","9,914,017,000"
45456,"Sales return and allowances","Wholesale revenue markdown allowances",558544,01/31/25,03/24/25,2,"Ernst & Young LLP",,,,"New York",NY,"NEW YORK","US Mid Atlantic",10-K,2025-03-24,,"G III APPAREL GROUP LTD /DE/",821002,"=""GIII""","512 SEVENTH AVE",,"NEW YORK",NY,"NEW YORK","US Mid Atlantic",,,"=""2300""","Apparel & Other Finishd Prods of Fabrics & Similar Matl",315292,"Fur and Leather Apparel Manufacturing",34,32,01/29/25,"1,425,001,344",01/31/25,"3,180,796,000","193,566,000","1,043,475,000","2,483,234,000"
45541,Inventory,"Valuation of Merchandise Inventories - Refer to Note 2 to the financial statements",558661,02/01/25,03/25/25,3,"Deloitte & Touche LLP",,,,Dallas,TX,TEXAS,"US Southwest",10-K,2025-03-25,,"GameStop Corp.",1326380,"=""GME""","625 WESTPORT PARKWAY",,GRAPEVINE,TX,TEXAS,"US Southwest",,,"=""5734""","Computer and Computer Software Stores",443120,"Computer and Software Stores",34,26,02/03/25,"11,567,661,056",02/01/25,"3,823,000,000","131,300,000",,"5,875,400,000"
45176,"Sales return and allowances","Sales Return Allowances and Right of Returns Asset — Refer to Note 1 in the financial statements",557772,02/01/25,03/18/25,3,"Deloitte & Touche LLP",,,,"San Francisco",CA,CALIFORNIA,"US West",10-K,2025-03-18,,"GAP INC",39911,"=""GAP""","TWO FOLSOM STREET",,"SAN FRANCISCO",CA,CALIFORNIA,"US West",,,"=""5651""","Family Clothing Stores",448140,"Family Clothing Stores",34,23,02/03/25,"8,715,286,528",02/01/25,"15,086,000,000","844,000,000",,"11,885,000,000"
46496,"Sales return and allowances","Sales Return Allowances and Right of Returns Asset - Refer to Note 1 in the financial statements",560988,02/01/25,03/18/25,3,"Deloitte & Touche LLP",,,,"San Francisco",CA,CALIFORNIA,"US West",ARS,2025-04-09,,"GAP INC",39911,"=""GAP""","TWO FOLSOM STREET",,"SAN FRANCISCO",CA,CALIFORNIA,"US West",,,"=""5651""","Family Clothing Stores",448140,"Family Clothing Stores",34,23,02/03/25,"8,715,286,528",02/01/25,"15,086,000,000","844,000,000",,"11,885,000,000"
47416,"Financial statements and disclosures","Sufficiency of audit evidence over net revenues",565076,03/28/25,05/15/25,4,"KPMG LLP",,,,"Santa Clara",CA,CALIFORNIA,"US West",10-K,2025-05-15,,"Gen Digital Inc.",849399,"=""GEN""","60 E RIO SALADO PARKWAY","SUITE 1000",TEMPE,AZ,ARIZONA,"US Southwest",,,"=""7372""","Prepackaged Software",511210,"Software Publishers",34,28,03/26/25,"16,966,776,832",03/28/25,"3,935,000,000","643,000,000","-10,235,000,000","15,495,000,000"
47417,"Uncertain tax positions","Assessment of uncertain tax positions",565076,03/28/25,05/15/25,4,"KPMG LLP",,,,"Santa Clara",CA,CALIFORNIA,"US West",10-K,2025-05-15,,"Gen Digital Inc.",849399,"=""GEN""","60 E RIO SALADO PARKWAY","SUITE 1000",TEMPE,AZ,ARIZONA,"US Southwest",,,"=""7372""","Prepackaged Software",511210,"Software Publishers",34,28,03/26/25,"16,966,776,832",03/28/25,"3,935,000,000","643,000,000","-10,235,000,000","15,495,000,000"
47832,"Goodwill and intangible assets","Valuation of goodwill and brand intangible assets",567480,05/25/25,06/25/25,4,"KPMG LLP",,,,Minneapolis,MN,MINNESOTA,"US Midwest",10-K,2025-06-26,,"GENERAL MILLS INC",40704,"=""GIS""","NUMBER ONE GENERAL MILLS BLVD",,MINNEAPOLIS,MN,MINNESOTA,"US Midwest",,,"=""2040""","Grain Mill Products",311230,"Breakfast Cereal Manufacturing",34,54,05/31/25,"29,431,347,200",05/25/25,"19,486,600,000","2,295,200,000","-13,504,600,000","33,071,100,000"
45653,Inventory,"Valuation of Journeys Group Inventory - Markdown Allowances",558881,02/01/25,03/26/25,2,"Ernst & Young LLP",,,,Nashville,TN,TENNESSEE,"US Southeast",10-K,2025-03-26,,"GENESCO INC",18498,"=""GCO""","535 MARRIOTT DRIVE","12TH FLOOR",NASHVILLE,TN,TENNESSEE,"US Southeast",,,"=""5661""","Shoe Stores",448210,"Shoe Stores",34,39,02/03/25,"442,774,176",02/01/25,"2,325,062,000","-18,890,000","512,048,000","1,335,536,000"
45362,"Revenue from customer contracts","Evaluation of standalone selling prices (SSPs) for self-managed subscription and self-managed license performance obligations",558370,01/31/25,03/21/25,4,"KPMG LLP",,,,Pittsburgh,PA,PENNSYLVANIA,"US Mid Atlantic",10-K,2025-03-21,,"Gitlab Inc.",1653482,"=""GTLB""","268 BUSH STREET",#350,"SAN FRANCISCO",CA,CALIFORNIA,"US West",,,"=""7372""","Prepackaged Software",541511,"Custom Computer Programming Services",34,70,01/29/25,"9,930,596,352",01/31/25,"759,249,000","-6,326,000","741,936,000","1,399,263,000"
48835,"Other investments","Valuation of Level 3 Investments",575678,09/30/25,11/17/25,1,"PricewaterhouseCoopers LLP",,,,Washington,DC,"DISTRICT OF COLUMBIA","US Mid Atlantic",10-K,2025-11-17,,"GLADSTONE CAPITAL CORP",1143513,"=""GLAD""","1521 WESTBRANCH DRIVE","SUITE 100",MCLEAN,VA,VIRGINIA,"US Mid Atlantic",,,,,525990,"Other Financial Vehicles",34,22,10/02/25,"486,344,192",09/30/25,"69,136,000","58,110,000",,"907,597,000"
47379,"Other investments","Valuation of Level 3 Investments",564919,03/31/25,05/13/25,1,"PricewaterhouseCoopers LLP",,,,Washington,DC,"DISTRICT OF COLUMBIA","US Mid Atlantic",10-K,2025-05-13,,"GLADSTONE INVESTMENT CORPORATION\DE",1321741,"=""GAIN""","1521 WESTBRANCH DRIVE","SUITE 100",MCLEAN,VA,VIRGINIA,"US Mid Atlantic",,,,,525990,"Other Financial Vehicles",34,13,03/31/25,"492,147,424",03/31/25,"80,161,000","65,319,000",,"1,006,404,000"
47752,Goodwill,"Interim Quantitative Goodwill Impairment Assessment for the Ames Reporting Unit",567113,04/30/25,06/18/25,2,"Ernst & Young LLP",,,,Atlanta,GA,GEORGIA,"US Southeast",10-K,2025-06-18,,"GMS Inc.",1600438,"=""GMS""","100 CRESCENT CENTRE PARKWAY","SUITE 800",TUCKER,GA,GEORGIA,"US Southeast",,,"=""5030""","Wholesale-Lumber & Other Construction Materials",423310,"Lumber, Plywood, Millwork, and Wood Panel Merchant Wholesalers",34,73,04/30/25,"2,795,894,528",04/30/25,"5,513,738,000","115,469,000","2,130,000","3,831,267,000"
48847,"Other investments","Valuation of investments using significant unobservable inputs and assumptions",575750,09/30/25,11/18/25,2,"Ernst & Young LLP",,,,Chicago,IL,ILLINOIS,"US Midwest",10-K,2025-11-18,,"GOLUB CAPITAL BDC, Inc.",1476765,"=""GBDC""","200 PARK AVENUE","25TH FLOOR","NEW YORK",NY,"NEW YORK","US Mid Atlantic",,,,,525990,"Other Financial Vehicles",34,14,09/30/25,"3,641,650,688",09/30/25,"580,159,000","376,646,000",,"8,978,299,000"
47772,"Going concern","Going concern analysis",567272,03/31/25,06/23/25,4,"KPMG LLP",,,,Philadelphia,PA,PENNSYLVANIA,"US Mid Atlantic",10-K,2025-06-23,,"Grace Therapeutics, Inc.",1444192,"=""GRCE""","103 CARNEGIE CENTER","SUITE 300",PRINCETON,NJ,"NEW JERSEY","US Mid Atlantic",,,"=""2834""","Pharmaceutical Preparations",325412,"Pharmaceutical Preparation Manufacturing",34,2,04/02/25,"23,423,080",03/31/25,,"-9,568,000","17,344,000","71,993,000"
47659,"Revenue from customer contracts","Revenue Recognition - Over time Revenue - Refer to Notes 1 and 3 to the financial statements",566625,03/31/25,06/09/25,3,"Deloitte & Touche LLP",,,,Rochester,NY,"NEW YORK","US Mid Atlantic",10-K,2025-06-09,,"GRAHAM CORP",716314,"=""GHM""","20 FLORENCE AVE",,BATAVIA,NY,"NEW YORK","US Mid Atlantic",,,"=""3560""","General Industrial Machinery & Equipment",333912,"Air and Gas Compressor Manufacturing",34,29,03/31/25,"314,224,448",03/31/25,"209,896,000","12,230,000","63,730,000","264,110,000"
48354,"Other investments","Investments at fair value - Fair Value Measurements — Refer to Note 6",571304,06/30/25,09/02/25,3,"Deloitte & Touche LLP",,,,Boston,MA,MASSACHUSETTS,"US New England",10-K,2025-09-02,,"Great Elm Group, Inc.",1831096,"=""GEG""","3801 PGA BOULEVARD","SUITE 603","PALM BEACH GARDENS",FL,FLORIDA,"US Southeast",,,"=""7372""","Prepackaged Software",551112,"Offices of Other Holding Companies",34,2,06/30/25,"54,964,604",06/30/25,"16,316,000","12,891,000","57,869,000","153,937,000"
48685,Inventory,"Sufficiency of audit evidence over inventory",574556,08/31/25,10/28/25,4,"KPMG LLP",,,,Portland,OR,OREGON,"US West",10-K,2025-10-28,,"GREENBRIER COMPANIES INC",923120,"=""GBX""","ONE CENTERPOINTE DR","STE 200","LAKE OSWEGO",OR,OREGON,"US West",,,"=""3743""","Railroad Equipment",336510,"Railroad Rolling Stock Manufacturing",34,47,08/31/25,"1,439,607,936",08/31/25,"3,240,200,000","204,100,000","1,174,100,000","4,360,600,000"
48862,Goodwill,"Goodwill – Customized Polymer Solutions - Small Plastics & Jerrycans & Customized Polymer Solutions – Intermediate Bulk Containers Reporting Units - Refer to Notes 1 & 3 to the Financial Statements",575804,09/30/25,11/19/25,3,"Deloitte & Touche LLP",,,,Columbus,OH,OHIO,"US Midwest",10-KT,2025-11-19,,"GREIF, INC",43920,"=""GEF""","425 WINTER ROAD",,DELAWARE,OH,OHIO,"US Midwest",,,"=""3412""","Metal Shipping Barrels, Drums, Kegs, and Pails",322211,"Corrugated and Solid Fiber Box Manufacturing",34,,,,,,,,
46547,"Property, plant and equipment","Impairment of retail location right-of-use assets and property and equipment",561151,02/01/25,04/11/25,2,"Ernst & Young LLP",,,,"Los Angeles",CA,CALIFORNIA,"US West",10-K,2025-04-11,,"GUESS INC",912463,"=""GES""","ATTN:  ANNE DEEDWANIA","1444 SOUTH ALAMEDA STREET","LOS ANGELES",CA,CALIFORNIA,"US West",,,"=""2340""","Women's, Misses', Children's & Infants' Undergarments",315239,"Women's and Girls' Cut and Sew Other Outerwear Manufacturing",34,12,02/03/25,"632,404,608",02/01/25,"2,995,273,000","60,423,000",,"2,766,678,000"
48424,"Revenue from customer contracts","Evaluation of revenue related to software licensing arrangements and subscriptions to cloud services with non-standard terms",571984,07/31/25,09/11/25,4,"KPMG LLP",,,,"Santa Clara",CA,CALIFORNIA,"US West",10-K,2025-09-11,,"Guidewire Software, Inc.",1528396,"=""GWRE""","970 PARK PL, SUITE 200",,"SAN MATEO",CA,CALIFORNIA,"US West",,,"=""7372""","Prepackaged Software",511210,"Software Publishers",34,225,07/29/25,"18,908,563,456",07/31/25,"1,202,459,000","69,804,000","1,051,210,000","2,721,099,000"
48204,"Uncertain tax positions","Income Taxes - Uncertain Tax Positions - Refer to Note 9 to the consolidated financial statements",570415,06/30/25,08/15/25,3,"Deloitte & Touche LLP",,,,"Kansas City",MO,MISSOURI,"US Southeast",10-K,2025-08-15,,"H&R BLOCK INC",12659,"=""HRB""","ONE H&R BLOCK WAY",,"KANSAS CITY",MO,MISSOURI,"US Southeast",,,"=""7200""","Services-Personal Services",541213,"Tax Preparation Services",34,56,07/02/25,"7,483,915,264",06/30/25,"3,760,995,000","605,773,000","-972,569,000","3,263,898,000"
48205,Goodwill,"Goodwill - Wave Reporting Unit - Refer to Note 6 to the consolidated financial statements",570415,06/30/25,08/15/25,3,"Deloitte & Touche LLP",,,,"Kansas City",MO,MISSOURI,"US Southeast",10-K,2025-08-15,,"H&R BLOCK INC",12659,"=""HRB""","ONE H&R BLOCK WAY",,"KANSAS CITY",MO,MISSOURI,"US Southeast",,,"=""7200""","Services-Personal Services",541213,"Tax Preparation Services",34,56,07/02/25,"7,483,915,264",06/30/25,"3,760,995,000","605,773,000","-972,569,000","3,263,898,000"
47487,"Business combinations","Business combination",565512,03/29/25,05/21/25,2,"Ernst & Young LLP",,,,Boston,MA,MASSACHUSETTS,"US New England",10-K,2025-05-21,,"HAEMONETICS CORP",313143,"=""HAE""","125 SUMMER STREET",,BOSTON,MA,MASSACHUSETTS,"US New England",,,"=""3841""","Surgical and Medical Instruments and Apparatus",334510,"Electromedical and Electrotherapeutic Apparatus Manufacturing",34,64,03/31/25,"3,192,590,848",03/29/25,"1,360,824,000","167,679,000","-239,176,000","2,450,948,000"
48454,"Sales return and allowances","Estimation of the Trade and Promotional Incentive Accrual",572183,06/30/25,09/15/25,2,"Ernst & Young LLP",,,,Jericho,NY,"NEW YORK","US Mid Atlantic",10-K,2025-09-15,,"HAIN CELESTIAL GROUP INC",910406,"=""HAIN""","221 RIVER STREET, 12TH FLOOR",,HOBOKEN,NJ,"NEW JERSEY","US Mid Atlantic",,,"=""2000""","Food and Kindred Products",424490,"Other Grocery and Related Products Merchant Wholesalers",34,2,06/30/25,"137,231,680",06/30/25,"1,559,780,000","-530,841,000","-236,861,000","1,603,278,000"
48455,Goodwill,"Valuation of the U.S., United Kingdom, and Canada Reporting Units",572183,06/30/25,09/15/25,2,"Ernst & Young LLP",,,,Jericho,NY,"NEW YORK","US Mid Atlantic",10-K,2025-09-15,,"HAIN CELESTIAL GROUP INC",910406,"=""HAIN""","221 RIVER STREET, 12TH FLOOR",,HOBOKEN,NJ,"NEW JERSEY","US Mid Atlantic",,,"=""2000""","Food and Kindred Products",424490,"Other Grocery and Related Products Merchant Wholesalers",34,2,06/30/25,"137,231,680",06/30/25,"1,559,780,000","-530,841,000","-236,861,000","1,603,278,000"
47602,"Deferred income taxes","Recognition of Net Deferred Tax Asset from Equity Offering and Unit Exchange",565958,03/31/25,05/30/25,2,"Ernst & Young LLP",,,,Philadelphia,PA,PENNSYLVANIA,"US Mid Atlantic",10-K,2025-05-30,,"Hamilton Lane INC",1433642,"=""HLNE""","110 WASHINGTON STREET","SUITE 1300",CONSHOHOCKEN,PA,PENNSYLVANIA,"US Mid Atlantic",,,"=""6282""","Investment Advice",523920,"Portfolio Management",34,155,04/02/25,"6,495,169,536",03/31/25,"699,631,000","217,417,000",,"1,690,355,000"
48710,"Asset retirement and environmental obligations","Provision for environmental rehabilitation",574794,06/30/25,10/31/25,2,"Ernst & Young LLP",281,"Ernst & Young Incorporated",1698,Johannesburg,T3,"SOUTH AFRICA",Foreign,20-F,2025-10-31,,"HARMONY GOLD MINING CO LTD",1023514,"=""HMY""","SUITE NO.1, PRIVATE BAG X1","CAR MAIN REEF ROAD AND WARD AVENUE","MELROSE ARCH",T3,"SOUTH AFRICA",Foreign,,,"=""1040""","Metal Mining",212221,"Gold Ore Mining",34,14,07/02/25,"9,021,366,272",06/30/25,"4,158,000,000","819,000,000","2,769,000,000","4,361,000,000"
47927,"Allowance for credit losses","Assessment of allowance for credit losses for loans evaluated on a collective basis",568458,03/31/25,07/14/25,4,"KPMG LLP",827,"KPMG Assurance and Consulting Services LLP (2115)",2115,Mumbai,K7,INDIA,Foreign,20-F,2025-07-14,,"HDFC BANK LTD",1144967,"=""HDB""","HDFC BANK HOUSE","SENAPATI BAPAT ROAD",MUBAI,K7,INDIA,Foreign,,,"=""6029""","Commercial Banks, NEC",522110,"Commercial Banking",34,66,04/02/25,"167,410,581,504",03/31/25,"25,623,700,000","7,879,800,000","54,713,500,000","563,779,800,000"
47928,"Insurance contract liabilities","Liabilities for future policy benefits in respect of life insurance policies",568458,03/31/25,07/14/25,4,"KPMG LLP",827,"KPMG Assurance and Consulting Services LLP (2115)",2115,Mumbai,K7,INDIA,Foreign,20-F,2025-07-14,,"HDFC BANK LTD",1144967,"=""HDB""","HDFC BANK HOUSE","SENAPATI BAPAT ROAD",MUBAI,K7,INDIA,Foreign,,,"=""6029""","Commercial Banks, NEC",522110,"Commercial Banking",34,66,04/02/25,"167,410,581,504",03/31/25,"25,623,700,000","7,879,800,000","54,713,500,000","563,779,800,000"
45145,"Revenue from customer contracts","Service Revenue Recognition",557848,01/31/25,03/18/25,1,"PricewaterhouseCoopers LLP",,,,"Salt Lake City",UT,UTAH,"US West",10-K,2025-03-18,,"HEALTHEQUITY, INC.",1428336,"=""HQY""","15 WEST SCENIC POINTE DRIVE","SUITE 100",DRAPER,UT,UTAH,"US West",,,"=""7389""","Business Services, NEC",518210,"Data Processing, Hosting, and Related Services",34,110,01/31/25,"9,555,305,472",01/31/25,"1,199,774,000","96,703,000","-737,892,000","3,448,550,000"
48893,"Other contingent liabilities","Self-Insurance Accruals",575922,09/30/25,11/21/25,2,"Ernst & Young LLP",,,,Tulsa,OK,OKLAHOMA,"US Southwest",10-K,2025-11-21,,"Helmerich & Payne, Inc.",46765,"=""HP""","222 N. DETROIT AVE.",,TULSA,OK,OKLAHOMA,"US Southwest",,,"=""1381""","Drilling Oil and Gas Wells",213111,"Drilling Oil and Gas Wells",34,23,10/02/25,"2,277,172,224",09/30/25,"3,746,013,000","-163,695,000","2,056,396,000","6,705,738,000"
48894,"Business combinations","Business Combination - Land Rigs and customer contracts",575922,09/30/25,11/21/25,2,"Ernst & Young LLP",,,,Tulsa,OK,OKLAHOMA,"US Southwest",10-K,2025-11-21,,"Helmerich & Payne, Inc.",46765,"=""HP""","222 N. DETROIT AVE.",,TULSA,OK,OKLAHOMA,"US Southwest",,,"=""1381""","Drilling Oil and Gas Wells",213111,"Drilling Oil and Gas Wells",34,23,10/02/25,"2,277,172,224",09/30/25,"3,746,013,000","-163,695,000","2,056,396,000","6,705,738,000"
48895,Goodwill,"Impairment of Goodwill",575922,09/30/25,11/21/25,2,"Ernst & Young LLP",,,,Tulsa,OK,OKLAHOMA,"US Southwest",10-K,2025-11-21,,"Helmerich & Payne, Inc.",46765,"=""HP""","222 N. DETROIT AVE.",,TULSA,OK,OKLAHOMA,"US Southwest",,,"=""1381""","Drilling Oil and Gas Wells",213111,"Drilling Oil and Gas Wells",34,23,10/02/25,"2,277,172,224",09/30/25,"3,746,013,000","-163,695,000","2,056,396,000","6,705,738,000"
48866,"Goodwill and intangible assets","Evaluation of Goodwill and Indefinite-Lived Intangible Assets Impairment for A Reporting Unit and Indefinite-Lived Intangible Asset within the Molding Technology Solutions reportable operating segment",575792,09/30/25,11/19/25,2,"Ernst & Young LLP",,,,Cincinnati,OH,OHIO,"US Midwest",10-K,2025-11-19,,"Hillenbrand, Inc.",1417398,"=""HI""","ONE BATESVILLE BOULEVARD",,BATESVILLE,IN,INDIANA,"US Midwest",,,"=""3990""","Miscellaneous Manufacturing Industries",812210,"Funeral Homes and Funeral Services",34,27,09/30/25,"1,906,320,000",09/30/25,"2,673,800,000","43,100,000","-1,350,700,000","4,467,100,000"
48849,"Revenue from customer contracts","Capital Equipment Revenue Recognition",575748,09/27/25,11/18/25,2,"Ernst & Young LLP",,,,Boston,MA,MASSACHUSETTS,"US New England",10-K,2025-11-18,,"HOLOGIC INC",859737,"=""HOLX""","250 CAMPUS DRIVE",,MARLBOROUGH,MA,MASSACHUSETTS,"US New England",,,"=""3844""","X-Ray Apparatus and Tubes and Related Irradiation Apparatus",334517,"Irradiation Apparatus Manufacturing",34,67,09/29/25,"14,935,454,720",09/27/25,"4,100,500,000","565,700,000","818,200,000","9,014,900,000"
48850,"Business combinations","Valuation of Intangible Assets acquired in Business Combination",575748,09/27/25,11/18/25,2,"Ernst & Young LLP",,,,Boston,MA,MASSACHUSETTS,"US New England",10-K,2025-11-18,,"HOLOGIC INC",859737,"=""HOLX""","250 CAMPUS DRIVE",,MARLBOROUGH,MA,MASSACHUSETTS,"US New England",,,"=""3844""","X-Ray Apparatus and Tubes and Related Irradiation Apparatus",334517,"Irradiation Apparatus Manufacturing",34,67,09/29/25,"14,935,454,720",09/27/25,"4,100,500,000","565,700,000","818,200,000","9,014,900,000"
45352,"Business combinations","Fair values of customer relationships intangible assets",558362,02/02/25,03/20/25,4,"KPMG LLP",,,,Atlanta,GA,GEORGIA,"US Southeast",10-K,2025-03-21,,"HOME DEPOT, INC.",354950,"=""HD""","2455 PACES FERRY ROAD",,ATLANTA,GA,GEORGIA,"US Southeast",,,"=""5211""","Lumber and Other Building Materials Dealers",444110,"Home Centers",34,411,02/04/25,"408,758,779,904",02/02/25,"159,514,000,000","14,806,000,000","-21,818,000,000","96,119,000,000"
45353,Inventory,"Estimation of store shrink",558362,02/02/25,03/20/25,4,"KPMG LLP",,,,Atlanta,GA,GEORGIA,"US Southeast",10-K,2025-03-21,,"HOME DEPOT, INC.",354950,"=""HD""","2455 PACES FERRY ROAD",,ATLANTA,GA,GEORGIA,"US Southeast",,,"=""5211""","Lumber and Other Building Materials Dealers",444110,"Home Centers",34,411,02/04/25,"408,758,779,904",02/02/25,"159,514,000,000","14,806,000,000","-21,818,000,000","96,119,000,000"
47746,"Warranty liabilities","Evaluation of the provisions for specific warranty programs",567119,03/31/25,06/18/25,4,"KPMG LLP",333,"KPMG AZSA LLC",1009,Tokyo,M0,JAPAN,Foreign,20-F,2025-06-18,,"HONDA MOTOR CO LTD",715153,"=""HMC""","1-1, MINAMI-AOYAMA 2-CHOME",MINATO-KU,TOKYO,M0,JAPAN,Foreign,,,"=""3711""","Motor Vehicles and Passenger Car Bodies",336111,"Automobile Manufacturing",34,27,04/02/25,"43,959,152,640",03/31/25,"145,037,000,000","6,039,000,000","74,900,000,000","205,804,000,000"
47747,"Allowance for credit losses","Allowance for expected credit losses on retail receivables at the finance subsidiary in the United States",567119,03/31/25,06/18/25,4,"KPMG LLP",333,"KPMG AZSA LLC",1009,Tokyo,M0,JAPAN,Foreign,20-F,2025-06-18,,"HONDA MOTOR CO LTD",715153,"=""HMC""","1-1, MINAMI-AOYAMA 2-CHOME",MINATO-KU,TOKYO,M0,JAPAN,Foreign,,,"=""3711""","Motor Vehicles and Passenger Car Bodies",336111,"Automobile Manufacturing",34,27,04/02/25,"43,959,152,640",03/31/25,"145,037,000,000","6,039,000,000","74,900,000,000","205,804,000,000"
47748,Leases,"Estimated end of term residual values of lease vehicles at the finance subsidiary in the United States",567119,03/31/25,06/18/25,4,"KPMG LLP",333,"KPMG AZSA LLC",1009,Tokyo,M0,JAPAN,Foreign,20-F,2025-06-18,,"HONDA MOTOR CO LTD",715153,"=""HMC""","1-1, MINAMI-AOYAMA 2-CHOME",MINATO-KU,TOKYO,M0,JAPAN,Foreign,,,"=""3711""","Motor Vehicles and Passenger Car Bodies",336111,"Automobile Manufacturing",34,27,04/02/25,"43,959,152,640",03/31/25,"145,037,000,000","6,039,000,000","74,900,000,000","205,804,000,000"
46827,"Financial statements and disclosures","Sufficiency of audit evidence over revenue",561911,02/02/25,04/18/25,4,"KPMG LLP",,,,Charlotte,NC,"NORTH CAROLINA","US Southeast",10-K,2025-04-18,,"HOOKER FURNISHINGS Corp",1077688,"=""HOFT""","440 E COMMONWEALTH BLVD","POB 4708",MARTINSVILLE,VA,VIRGINIA,"US Mid Atlantic",,,"=""2510""","Household Furniture",337125,"Household Furniture (except Wood and Metal) Manufacturing",34,13,02/04/25,"139,235,616",02/02/25,"397,465,000","-12,507,000","167,243,000","313,942,000"
48856,"Other contingent liabilities","Estimation of reserves for construction defect matters",575820,09/30/25,11/19/25,2,"Ernst & Young LLP",,,,"Fort Worth",TX,TEXAS,"US Southwest",10-K,2025-11-19,,"HORTON D R INC /DE/",882184,"=""DHI""","1341 HORTON CIRCLE",,ARLINGTON,TX,TEXAS,"US Southwest",,,"=""1531""","Operative Builders",236117,"New Housing Operative Builders",34,171,10/02/25,"51,119,243,264",09/30/25,"34,250,400,000","3,585,200,000","24,026,900,000","35,471,200,000"
47403,"Revenue from customer contracts","Recognition of Revenue",565092,03/31/25,05/15/25,4,"KPMG LLP",,,,"Los Angeles",CA,CALIFORNIA,"US West",10-K,2025-05-15,,"HOULIHAN LOKEY, INC.",1302215,"=""HLI""","HOULIHAN LOKEY, INC.","10250 CONSTELLATION BLVD., 5TH FLOOR","LOS ANGELES",CA,CALIFORNIA,"US West",,,"=""6282""","Investment Advice",523110,"Investment Banking and Securities Dealing",34,166,04/02/25,"8,962,433,024",03/31/25,"2,389,416,000","399,711,000","677,618,000","3,819,708,000"
48907,"Revenue from customer contracts","Revenue Recognition – Software and Related Services Contracts – Refer to Note 3 to the Financial Statements",575914,09/30/25,11/21/25,3,"Deloitte & Touche LLP",,,,Nashville,TN,TENNESSEE,"US Southeast",10-K,2025-11-21,,"i3 Verticals, Inc.",1728688,"=""IIIV""","40 BURTON HILLS BLVD.","SUITE 415",NASHVILLE,TN,TENNESSEE,"US Southeast",,,"=""7389""","Business Services, NEC",423420,"Office Equipment Merchant Wholesalers",34,33,10/02/25,"776,719,552",09/30/25,"213,158,000","17,873,000","-42,997,000","638,411,000"
48037,"Allowance for credit losses","Allowance for Credit Losses",569166,03/31/25,07/25/25,4,"KPMG LLP",827,"KPMG Assurance and Consulting Services LLP (2115)",2115,Mumbai,K7,INDIA,Foreign,20-F,2025-07-25,,"ICICI BANK LTD",1103838,"=""IBN""","ICICI BANK TOWERS","BANDRA-KURLA COMPLEX",MUMBAI,K7,INDIA,Foreign,,,"=""6029""","Commercial Banks, NEC",522110,"Commercial Banking",34,31,04/02/25,"110,391,115,776",03/31/25,"21,318,984,000","5,970,247,000","35,736,228,000","309,133,512,000"
48038,"Insurance contract liabilities","Liabilities in respect to life insurance policies",569166,03/31/25,07/25/25,4,"KPMG LLP",827,"KPMG Assurance and Consulting Services LLP (2115)",2115,Mumbai,K7,INDIA,Foreign,20-F,2025-07-25,,"ICICI BANK LTD",1103838,"=""IBN""","ICICI BANK TOWERS","BANDRA-KURLA COMPLEX",MUMBAI,K7,INDIA,Foreign,,,"=""6029""","Commercial Banks, NEC",522110,"Commercial Banking",34,31,04/02/25,"110,391,115,776",03/31/25,"21,318,984,000","5,970,247,000","35,736,228,000","309,133,512,000"
48903,"Revenue from customer contracts","Revenue recognition for certain fixed-price construction contracts",575910,09/30/25,11/21/25,2,"Ernst & Young LLP",,,,Houston,TX,TEXAS,"US Southwest",10-K,2025-11-21,,"IES Holdings, Inc.",1048268,"=""IESC""","13131 DAIRY ASHFORD ROAD","SUITE 500",HOUSTON,TX,TEXAS,"US Southwest",,,"=""1731""","Electrical Work",238210,"Electrical Contractors",34,398,09/30/25,"7,895,127,040",09/30/25,"3,371,468,000","305,975,000","734,480,000","1,595,661,000"
47571,"Research and development expenses","Clinical Trial Accrual",565918,03/31/25,05/29/25,2,"Ernst & Young LLP",,,,Iselin,NJ,"NEW JERSEY","US Mid Atlantic",10-K,2025-05-29,,"Immunovant, Inc.",1764013,"=""IMVT""","320 WEST 37TH STREET",,"NEW YORK",NY,"NEW YORK","US Mid Atlantic",,,"=""2836""","Biological Products, Except Diagnostic Substances",325414,"Biological Product (except Diagnostic) Manufacturing",34,17,03/31/25,"2,907,207,168",03/31/25,,"-413,840,000",,"776,222,000"
48677,"Other revenue","Grant income",574412,06/30/25,10/24/25,1,"PricewaterhouseCoopers LLP",89,PricewaterhouseCoopers,1379,Sydney,C3,AUSTRALIA,Foreign,20-F,2025-10-24,,"IMMUTEP Ltd",1506184,"=""IMMP""","LEVEL 32, SUITE 32.07 AUSTRALIA SQUARE","264 GEORGE STREET","SYDNEY,",C3,AUSTRALIA,Foreign,,,"=""2834""","Pharmaceutical Preparations",325412,"Pharmaceutical Preparation Manufacturing",34,2,07/02/25,"246,944,096",06/30/25,"3,299,385","-40,260,938","89,412,762","102,879,241"
47863,"Revenue from customer contracts","Revenue Recognition - Refer to Notes 1.5(a) and 2.11 to the consolidated financial statements",567774,03/31/25,07/01/25,3,"Deloitte & Touche LLP",16,"Deloitte Haskins & Sells LLP",1180,Bengaluru,K7,INDIA,Foreign,20-F,2025-07-01,,"Infosys Ltd",1067491,"=""INFY""","ELECTRONICS CITY, HOSUR ROAD",*,BANGALORE,K7,INDIA,Foreign,,,"=""7371""","Computer Programming Services",541511,"Custom Computer Programming Services",34,18,04/02/25,"76,334,448,640",03/31/25,"19,277,000,000","3,162,000,000","9,700,000,000","17,419,000,000"
47864,"Revenue from customer contracts","Revenue recognition - Fixed price contracts using the percentage of completion method - Refer to Notes 1.5(a) and 2.11 to the consolidated financial statements",567774,03/31/25,07/01/25,3,"Deloitte & Touche LLP",16,"Deloitte Haskins & Sells LLP",1180,Bengaluru,K7,INDIA,Foreign,20-F,2025-07-01,,"Infosys Ltd",1067491,"=""INFY""","ELECTRONICS CITY, HOSUR ROAD",*,BANGALORE,K7,INDIA,Foreign,,,"=""7371""","Computer Programming Services",541511,"Custom Computer Programming Services",34,18,04/02/25,"76,334,448,640",03/31/25,"19,277,000,000","3,162,000,000","9,700,000,000","17,419,000,000"
48952,"Vendor/supplier rebates","Vendor Allowances – Refer to Note 1 to the consolidated financial statements.",576176,09/27/25,11/26/25,3,"Deloitte & Touche LLP",,,,Charlotte,NC,"NORTH CAROLINA","US Southeast",10-K,2025-11-26,,"INGLES MARKETS INC",50493,"=""IMKTA""","PO BOX 6676",,ASHEVILLE,NC,"NORTH CAROLINA","US Southeast",,,"=""5411""","Grocery Stores",445110,"Supermarkets and Other Grocery (except Convenience) Stores",34,70,09/30/25,"1,012,001,408",09/27/25,"5,334,032,609","83,592,501",,"2,566,054,643"
48235,"Revenue from customer contracts","Revenues - Revenue Recognition– Refer to Notes 2 and 3 to the financial statements",570596,06/30/25,08/20/25,3,"Deloitte & Touche LLP",,,,"San Jose",CA,CALIFORNIA,"US West",10-K,2025-08-20,,"Intapp, Inc.",1565687,"=""INTA""","3101 PARK BOULEVARD",,"PALO ALTO",CA,CALIFORNIA,"US West",,,"=""7372""","Prepackaged Software",518210,"Data Processing, Hosting, and Related Services",34,48,07/02/25,"3,872,898,560",06/30/25,"504,120,000","-18,217,000","152,806,000","894,161,000"
48368,"Revenue from customer contracts","Determination of Distinct Performance Obligations in Revenue Contracts",571408,07/31/25,09/03/25,2,"Ernst & Young LLP",,,,"San Jose",CA,CALIFORNIA,"US West",10-K,2025-09-03,,"INTUIT INC.",896878,"=""INTU""","2700 COAST AVENUE",,"MOUNTAIN VIEW",CA,CALIFORNIA,"US West",,,"=""7372""","Prepackaged Software",511210,"Software Publishers",34,806,07/29/25,"224,926,121,984",07/31/25,"18,831,000,000","3,869,000,000","428,000,000","36,958,000,000"
48883,"Revenue from customer contracts","Determination of Distinct Performance Obligations in Revenue Contracts",575901,07/31/25,09/03/25,2,"Ernst & Young LLP",,,,"San Jose",CA,CALIFORNIA,"US West",8-K,2025-11-20,,"INTUIT INC.",896878,"=""INTU""","2700 COAST AVENUE",,"MOUNTAIN VIEW",CA,CALIFORNIA,"US West",,,"=""7372""","Prepackaged Software",511210,"Software Publishers",34,806,07/29/25,"224,926,121,984",07/31/25,"18,831,000,000","3,869,000,000","428,000,000","36,958,000,000"
48623,"Deferred and stock-based compensation","Valuation of share-based payments",573951,06/30/25,10/14/25,1,"PricewaterhouseCoopers LLP",89,PricewaterhouseCoopers,1379,Perth,C3,AUSTRALIA,Foreign,20-F,2025-10-14,,"IPERIONX Ltd",1898601,"=""IPX""","129 W TRADE STREET","SUITE 1405",CHARLOTTE,NC,"NORTH CAROLINA","US Southeast",,,"=""1090""","Metal Mining",423520,"Coal and Other Mineral and Ore Merchant Wholesalers",34,30,07/02/25,"765,303,168",06/30/25,,"-35,348,675","78,893,006","105,034,979"
48675,"Other investments","Level 3 Investment Properties Valued Using Discounted Cash Flows",574428,06/30/25,10/23/25,1,"PricewaterhouseCoopers LLP",88,"Price Waterhouse & Co SRL",1349,"Buenos Aires",C1,ARGENTINA,Foreign,20-F,2025-10-24,,"IRSA INVESTMENTS & REPRESENTATIONS INC",933267,"=""IRS""","C/MORENO NO.877","PISO 22","BUENOS AIRES",C1,ARGENTINA,Foreign,,,"=""6552""","Land Subdividers and Developers, Except Cemeteries",237210,"Land Subdivision",34,14,06/30/25,"1,061,964,736",06/30/25,"394,000,000","165,000,000","1,310,000,000","2,824,000,000"
47734,"Other intangible assets","Hostess brand indefinite-lived intangible trademark impairment evaluation",567122,04/30/25,06/18/25,2,"Ernst & Young LLP",,,,Akron,OH,OHIO,"US Midwest",10-K,2025-06-18,,"J M SMUCKER Co",91419,"=""SJM""","ONE STRAWBERRY LANE",,ORRVILLE,OH,OHIO,"US Midwest",,,"=""2033""","Canned Fruits, Vegetables, Preserves, Jams, and Jellies",311421,"Fruit and Vegetable Canning",34,115,05/02/25,"12,212,371,456",04/30/25,"8,726,100,000","-1,230,800,000","-5,974,300,000","17,563,300,000"
47735,Goodwill,"Sweet Baked Snacks goodwill impairment evaluation",567122,04/30/25,06/18/25,2,"Ernst & Young LLP",,,,Akron,OH,OHIO,"US Midwest",10-K,2025-06-18,,"J M SMUCKER Co",91419,"=""SJM""","ONE STRAWBERRY LANE",,ORRVILLE,OH,OHIO,"US Midwest",,,"=""2033""","Canned Fruits, Vegetables, Preserves, Jams, and Jellies",311421,"Fruit and Vegetable Canning",34,115,05/02/25,"12,212,371,456",04/30/25,"8,726,100,000","-1,230,800,000","-5,974,300,000","17,563,300,000"
48639,"Uncertain tax positions","Uncertain Tax Positions",574061,08/31/25,10/17/25,2,"Ernst & Young LLP",,,,Tampa,FL,FLORIDA,"US Southeast",10-K,2025-10-17,,"JABIL INC",898293,"=""JBL""","10800 ROOSEVELT BOULEVARD NORTH",,"ST PETERSBURG",FL,FLORIDA,"US Southeast",,,"=""3672""","Printed Circuit Boards",334412,"Bare Printed Circuit Board Manufacturing",34,202,09/02/25,"21,686,990,848",08/31/25,"29,802,000,000","657,000,000","399,000,000","18,543,000,000"
48290,"Revenue from customer contracts","Revenue Recognition - estimating variable consideration",570819,06/30/25,08/25/25,1,"PricewaterhouseCoopers LLP",,,,"Kansas City",MO,MISSOURI,"US Southeast",10-K,2025-08-25,,"JACK HENRY & ASSOCIATES INC",779152,"=""JKHY""","PO BOX 807","663 HWY 60",MONETT,MO,MISSOURI,"US Southeast",,,"=""7373""","Computer Integrated Systems Design",541512,"Computer Systems Design Services",34,179,07/02/25,"13,064,644,608",06/30/25,"2,375,288,000","455,748,000","640,775,000","3,043,970,000"
48858,Goodwill,"Valuation of goodwill and trademark related to the Del Taco reporting unit",575816,09/28/25,11/19/25,4,"KPMG LLP",,,,"San Diego",CA,CALIFORNIA,"US West",10-K,2025-11-19,,"JACK IN THE BOX INC",807882,"=""JACK""","9357 SPECTRUM CENTER BLVD",,"SAN DIEGO",CA,CALIFORNIA,"US West",,,"=""5812""","Eating and Drinking Places",722211,"Limited-Service Restaurants",34,20,09/30/25,"373,504,992",09/28/25,"1,465,314,000","-80,719,000","-1,189,781,000","2,593,421,000"
48869,"Revenue from customer contracts","Revenue Recognition for Certain Fixed-Price Contracts",575857,09/26/25,11/20/25,2,"Ernst & Young LLP",,,,Dallas,TX,TEXAS,"US Southwest",10-K,2025-11-20,,"JACOBS SOLUTIONS INC.",52988,"=""J""","1999 BRYAN STREET, SUITE 3500",,DALLAS,TX,TEXAS,"US Southwest",,,"=""1600""","Heavy Construction Other Than Bldg Const - Contractors",236220,"Commercial and Institutional Building Construction",34,150,09/30/25,"17,845,522,432",09/26/25,"12,029,783,000","289,336,000","-838,987,000","11,252,535,000"
48870,"Balance sheet classification of debt and equity","Redeemable Noncontrolling Interests",575857,09/26/25,11/20/25,2,"Ernst & Young LLP",,,,Dallas,TX,TEXAS,"US Southwest",10-K,2025-11-20,,"JACOBS SOLUTIONS INC.",52988,"=""J""","1999 BRYAN STREET, SUITE 3500",,DALLAS,TX,TEXAS,"US Southwest",,,"=""1600""","Heavy Construction Other Than Bldg Const - Contractors",236220,"Commercial and Institutional Building Construction",34,150,09/30/25,"17,845,522,432",09/26/25,"12,029,783,000","289,336,000","-838,987,000","11,252,535,000"
47466,"Other contingent liabilities","Asbestos Liability Valuation",565420,03/31/25,05/20/25,2,"Ernst & Young LLP",,,,Irvine,CA,CALIFORNIA,"US West",20-F,2025-05-20,,"James Hardie Industries plc",1159152,"=""JHX""","1ST FLOOR, BLOCK A","ONE PARK PLACE, UPPER HATCH STREET","DUBLIN 2",L2,IRELAND,Foreign,,,"=""3272""","Concrete Products, Except Block and Brick",327310,"Cement Manufacturing",33,24,04/02/25,"10,293,709,824",03/31/25,"3,877,500,000","424,000,000","1,822,200,000","5,229,900,000"
47502,"Other contingent liabilities","Asbestos Liability Valuation",565615,03/31/25,05/20/25,2,"Ernst & Young LLP",,,,Irvine,CA,CALIFORNIA,"US West",6-K,2025-05-22,,"James Hardie Industries plc",1159152,"=""JHX""","1ST FLOOR, BLOCK A","ONE PARK PLACE, UPPER HATCH STREET","DUBLIN 2",L2,IRELAND,Foreign,,,"=""3272""","Concrete Products, Except Block and Brick",327310,"Cement Manufacturing",33,24,04/02/25,"10,293,709,824",03/31/25,"3,877,500,000","424,000,000","1,822,200,000","5,229,900,000"
47785,"Revenue from customer contracts","Revenue Recognition - Research Subscriptions Revenue",567395,04/30/25,06/25/25,1,"PricewaterhouseCoopers LLP",,,,"New York",NY,"NEW YORK","US Mid Atlantic",10-K,2025-06-25,,"JOHN WILEY & SONS, INC.",107140,"=""WLY""","111 RIVER STREET",,HOBOKEN,NJ,"NEW JERSEY","US Mid Atlantic",,,"=""2731""","Books: Publishing, or Publishing and Printing",511130,"Book Publishers",34,44,05/02/25,"1,990,100,224",04/30/25,"1,677,609,000","84,161,000","-964,343,000","2,691,466,000"
48810,"Revenue from customer contracts","Revenue Recognition from Certain Contracts with Customers",575634,09/30/25,11/14/25,1,"PricewaterhouseCoopers LLP",,,,Milwaukee,WI,WISCONSIN,"US Midwest",10-K,2025-11-14,,"Johnson Controls International plc",833444,"=""JCI""","ONE ALBERT QUAY","ALBERT QUAY",CORK,L2,IRELAND,Foreign,,,"=""3585""","Air-Conditioning and Warm Air Heating Equipment and Commercial and Industrial Refrigeration Equipment",561621,"Security Systems Services (except Locksmiths)",34,109,10/02/25,"71,105,519,616",09/30/25,"23,596,000,000","3,291,000,000","-7,319,000,000","37,939,000,000"
47910,"Revenue from customer contracts","Deferred Royalty Obligation — Refer to Notes 2 and 11 to the financial statements",568303,04/30/25,07/10/25,3,"Deloitte & Touche LLP",,,,Boston,MA,MASSACHUSETTS,"US New England",10-K,2025-07-10,,"KalVista Pharmaceuticals, Inc.",1348911,"=""KALV""","200 CROSSING BOULEVARD",,FRAMINGHAM,MA,MASSACHUSETTS,"US New England",,,"=""2834""","Pharmaceutical Preparations",325412,"Pharmaceutical Preparation Manufacturing",34,14,04/30/25,"685,223,424",04/30/25,,"-183,444,000",,"250,770,000"
48173,"Other income taxes","Provision for Income Taxes",570239,06/30/25,08/12/25,1,"PricewaterhouseCoopers LLP",,,,Pittsburgh,PA,PENNSYLVANIA,"US Mid Atlantic",10-K,2025-08-12,,"KENNAMETAL INC",55242,"=""KMT""","525 WILLIAM PENN PLACE","SUITE 3300",PITTSBURGH,PA,PENNSYLVANIA,"US Mid Atlantic",,,"=""3541""","Machine Tools,  Metal Cutting Type",333515,"Cutting Tool and Machine Tool Accessory Manufacturing",34,24,07/02/25,"1,855,524,992",06/30/25,"1,966,845,000","93,125,000","934,044,000","2,545,412,000"
48282,"Revenue from customer contracts","Revenue Recognition—Contracts Recognized Over Time— Refer to Notes 1 and 2 to the financial statements",570696,06/30/25,08/22/25,3,"Deloitte & Touche LLP",,,,Indianapolis,IN,INDIANA,"US Midwest",10-K,2025-08-22,,"Kimball Electronics, Inc.",1606757,"=""KE""","1205 KIMBALL BLVD.",,JASPER,IN,INDIANA,"US Midwest",,,"=""3672""","Printed Circuit Boards",541330,"Engineering Services",34,20,07/02/25,"489,070,720",06/30/25,"1,486,727,000","16,984,000","561,266,000","1,077,312,000"
48154,"Revenue from customer contracts","Revenue Recognition",570014,06/30/25,08/08/25,1,"PricewaterhouseCoopers LLP",,,,"San Jose",CA,CALIFORNIA,"US West",10-K,2025-08-08,,"KLA CORP",319201,"=""KLAC""","ONE TECHNOLOGY DRIVE",,MILPITAS,CA,CALIFORNIA,"US West",,,"=""3827""","Optical Instruments and Lenses",334515,"Instrument Manufacturing for Measuring and Testing Electricity and Electrical Signals",34,921,07/02/25,"121,807,577,088",06/30/25,"12,156,162,000","4,061,643,000","2,455,475,000","16,067,926,000"
45274,Inventory,"Merchandise Inventories",558210,02/01/25,03/20/25,2,"Ernst & Young LLP",,,,Milwaukee,WI,WISCONSIN,"US Midwest",10-K,2025-03-20,,"KOHLS Corp",885639,"=""KSS""","N56 W17000 RIDGEWOOD DR",,"MENOMONEE FALLS",WI,WISCONSIN,"US Midwest",,,"=""5311""","Department Stores",452111,"Department Stores (except Discount Department Stores)",34,13,02/03/25,"1,444,901,248",02/01/25,"16,221,000,000","109,000,000",,"13,559,000,000"
45275,"Uncertain tax positions","Unrecognized Tax Benefits",558210,02/01/25,03/20/25,2,"Ernst & Young LLP",,,,Milwaukee,WI,WISCONSIN,"US Midwest",10-K,2025-03-20,,"KOHLS Corp",885639,"=""KSS""","N56 W17000 RIDGEWOOD DR",,"MENOMONEE FALLS",WI,WISCONSIN,"US Midwest",,,"=""5311""","Department Stores",452111,"Department Stores (except Discount Department Stores)",34,13,02/03/25,"1,444,901,248",02/01/25,"16,221,000,000","109,000,000",,"13,559,000,000"
47841,"Revenue from customer contracts","Consulting Revenue Recognition",567584,04/30/25,06/27/25,2,"Ernst & Young LLP",,,,"Los Angeles",CA,CALIFORNIA,"US West",10-K,2025-06-27,,"KORN FERRY",56679,"=""KFY""","1900 AVENUE OF THE STARS","STE. 1225","LOS ANGELES",CA,CALIFORNIA,"US West",,,"=""7361""","Employment Agencies",541612,"Human Resources and Executive Search Consulting Services",34,64,05/02/25,"3,307,401,984",04/30/25,"2,761,086,000","246,062,000","847,431,000","3,861,224,000"
46230,"Other contingent liabilities","Litigation Contingencies Related to Opioid Claims and Merger Termination",560304,02/01/25,04/01/25,1,"PricewaterhouseCoopers LLP",,,,Cincinnati,OH,OHIO,"US Midwest",10-K,2025-04-01,,"KROGER CO",56873,"=""KR""","1014 VINE ST",,CINCINNATI,OH,OHIO,"US Midwest",,,"=""5411""","Grocery Stores",445110,"Supermarkets and Other Grocery (except Convenience) Stores",34,63,02/03/25,"45,825,974,272",02/01/25,"147,123,000,000","2,665,000,000","4,777,000,000","52,616,000,000"
48881,Inventory,"Valuation of inventories - Reserves for excess and obsolete raw materials",575858,10/04/25,11/20/25,1,"PricewaterhouseCoopers LLP",601,"PricewaterhouseCoopers LLP (Singapore)",1093,Singapore,U0,SINGAPORE,Foreign,10-K,2025-11-20,,"KULICKE & SOFFA INDUSTRIES INC",56978,"=""KLIC""","23A SERANGOON NORTH AVENUE 5, #01-01",,SINGAPORE,U0,SINGAPORE,Foreign,,,"=""3674""","Semiconductors and Related Devices",333295,"Semiconductor Machinery Manufacturing",34,42,10/06/25,"2,169,775,360",10/04/25,"654,081,000","213,000","746,369,000","1,104,342,000"
48733,Leases,"Evaluation of incremental borrowing rates for new operating leases",575080,08/31/25,11/06/25,4,"KPMG LLP",,,,"San Diego",CA,CALIFORNIA,"US West",10-K,2025-11-06,,"KURA SUSHI USA, INC.",1772177,"=""KRUS""","17461 DERIAN AVE.","SUITE 200",IRVINE,CA,CALIFORNIA,"US West",,,"=""5812""","Eating and Drinking Places",722110,"Full-Service Restaurants",34,85,08/31/25,"942,302,016",08/31/25,"282,763,000","-1,904,000",,"430,942,000"
47598,"Revenue from customer contracts","Revenue Recognition for Certain Services",565966,03/31/25,05/30/25,1,"PricewaterhouseCoopers LLP",,,,"New York",NY,"NEW YORK","US Mid Atlantic",10-K,2025-05-30,,"Kyndryl Holdings, Inc.",1867072,"=""KD""","ONE VANDERBILT AVENUE","15TH FLOOR","NEW YORK",NY,"NEW YORK","US Mid Atlantic",,,"=""7373""","Computer Integrated Systems Design",541512,"Computer Systems Design Services",34,33,04/02/25,"7,699,860,992",03/31/25,"15,057,000,000","252,000,000","212,000,000","10,452,000,000"
47729,Goodwill,"Goodwill Impairment Assessment – Joybird Reporting Unit",567072,04/26/25,06/17/25,1,"PricewaterhouseCoopers LLP",,,,Detroit,MI,MICHIGAN,"US Midwest",10-K,2025-06-17,,"LA-Z-BOY INC",57131,"=""LZB""","ONE LA-Z-BOY DRIVE",,MONROE,MI,MICHIGAN,"US Midwest",,,"=""2510""","Household Furniture",337121,"Upholstered Household Furniture Manufacturing",34,40,04/30/25,"1,625,977,984",04/26/25,"2,109,207,000","99,556,000","763,872,000","1,922,162,000"
47730,Goodwill,"Goodwill Impairment Assessment – United Kingdom Reporting Unit",567072,04/26/25,06/17/25,1,"PricewaterhouseCoopers LLP",,,,Detroit,MI,MICHIGAN,"US Midwest",10-K,2025-06-17,,"LA-Z-BOY INC",57131,"=""LZB""","ONE LA-Z-BOY DRIVE",,MONROE,MI,MICHIGAN,"US Midwest",,,"=""2510""","Household Furniture",337121,"Upholstered Household Furniture Manufacturing",34,40,04/30/25,"1,625,977,984",04/26/25,"2,109,207,000","99,556,000","763,872,000","1,922,162,000"
48159,Inventory,"Inventory - Valuation",570131,06/29/25,08/11/25,2,"Ernst & Young LLP",,,,"San Jose",CA,CALIFORNIA,"US West",10-K,2025-08-11,,"LAM RESEARCH CORP",707549,"=""LRCX""","4650 CUSHING BLVD",,FREMONT,CA,CALIFORNIA,"US West",,,"=""3559""","Special  Industry Machinery, NEC",333295,"Semiconductor Machinery Manufacturing",34,97,07/01/25,"123,831,410,688",06/29/25,"18,435,591,000","5,358,217,000","8,052,934,000","21,345,260,000"
48010,Inventory,"Sufficiency of audit evidence over the finished goods inventory held at third-party warehouse locations",568950,05/25/25,07/23/25,4,"KPMG LLP",,,,Seattle,WA,WASHINGTON,"US West",10-K,2025-07-23,,"Lamb Weston Holdings, Inc.",1679273,"=""LW""","599 S. RIVERSHORE LANE",,EAGLE,ID,IDAHO,"US West",,,"=""2030""","Canned, Frozen & Preservd Fruit, Veg & Food Specialties",311411,"Frozen Fruit, Juice, and Vegetable Manufacturing",34,56,05/31/25,"7,766,682,112",05/25/25,"6,451,300,000","357,200,000","533,500,000","7,392,600,000"
48125,Inventory,"Sufficiency of audit evidence over the finished goods inventory held at third-party warehouse locations",569883,05/25/25,07/23/25,4,"KPMG LLP",,,,Seattle,WA,WASHINGTON,"US West",ARS,2025-08-07,,"Lamb Weston Holdings, Inc.",1679273,"=""LW""","599 S. RIVERSHORE LANE",,EAGLE,ID,IDAHO,"US West",,,"=""2030""","Canned, Frozen & Preservd Fruit, Veg & Food Specialties",311411,"Frozen Fruit, Juice, and Vegetable Manufacturing",34,56,05/31/25,"7,766,682,112",05/25/25,"6,451,300,000","357,200,000","533,500,000","7,392,600,000"
45785,"Other intangible assets","Indefinite-lived Intangible Asset – Refer to Notes 2 and 10 to the financial statements",559256,01/31/25,03/27/25,3,"Deloitte & Touche LLP",,,,Chicago,IL,ILLINOIS,"US Midwest",10-K,2025-03-27,,"LANDS' END, INC.",799288,"=""LE""","FIVE LANDS' END LANE",,DODGEVILLE,WI,WISCONSIN,"US Midwest",,,"=""5651""","Family Clothing Stores",454113,"Mail-Order Houses",34,13,01/29/25,"407,961,952",01/31/25,"1,362,935,000","6,233,000","-17,778,000","765,481,000"
48575,Goodwill,"Assessment of goodwill impairment test for certain reporting units",573144,06/30/25,09/29/25,4,"KPMG LLP",82,"KPMG Inc",1025,Johannesburg,T3,"SOUTH AFRICA",Foreign,10-K,2025-09-29,,"LESAKA TECHNOLOGIES INC",1041514,"=""LSAK""","4TH FLOOR, PRESIDENT PLACE","CNR. JAN SMUTS & BOLTON","ROSEBANK, JOHANNESBURG",T3,"SOUTH AFRICA",Foreign,,,"=""6099""","Functions Related to Deposit Banking, NEC",517110,"Wired Telecommunications Carriers",34,5,07/02/25,"368,872,288",06/30/25,"659,701,000","-87,504,000","-84,068,000","653,710,000"
48576,"Business combinations","Assessment of certain intangibles assets acquired through business combinations",573144,06/30/25,09/29/25,4,"KPMG LLP",82,"KPMG Inc",1025,Johannesburg,T3,"SOUTH AFRICA",Foreign,10-K,2025-09-29,,"LESAKA TECHNOLOGIES INC",1041514,"=""LSAK""","4TH FLOOR, PRESIDENT PLACE","CNR. JAN SMUTS & BOLTON","ROSEBANK, JOHANNESBURG",T3,"SOUTH AFRICA",Foreign,,,"=""6099""","Functions Related to Deposit Banking, NEC",517110,"Wired Telecommunications Carriers",34,5,07/02/25,"368,872,288",06/30/25,"659,701,000","-87,504,000","-84,068,000","653,710,000"
48396,"Uncertain tax positions","Income Tax Expense-US Jurisdiction – Refer to Notes 2 and 11 to the financial statements",571440,06/30/25,09/04/25,3,"Deloitte & Touche LLP",,,,"Salt Lake City",UT,UTAH,"US West",10-K,2025-09-04,,"Lifevantage Corp",849146,"=""LFVN""","3300 TRIUMPH BLVD","SUITE 700",LEHI,UT,UTAH,"US West",,,"=""2834""","Pharmaceutical Preparations",325412,"Pharmaceutical Preparation Manufacturing",34,13,07/02/25,"168,681,648",06/30/25,"228,530,000","9,805,000","34,396,000","71,958,000"
47500,"Revenue from customer contracts","Revenue Recognition - Principal versus Agent Considerations for payment processing services",565618,03/31/25,05/22/25,1,"PricewaterhouseCoopers LLP",493,"PricewaterhouseCoopers srl",271,Montreal,A8,QUEBEC,Canada,6-K,2025-05-22,,"Lightspeed Commerce Inc.",1823306,"=""LSPD""","700 SAINT-ANTOINE STREET EAST, SUITE 300",,MONTREAL,Z4,CANADA,Canada,,,"=""7372""","Prepackaged Software",511210,"Software Publishers",34,9,03/31/25,"1,280,994,304",03/31/25,"1,076,826,000","-667,196,000","706,463,000","1,826,203,000"
47501,Goodwill,"Goodwill impairment assessment",565618,03/31/25,05/22/25,1,"PricewaterhouseCoopers LLP",493,"PricewaterhouseCoopers srl",271,Montreal,A8,QUEBEC,Canada,6-K,2025-05-22,,"Lightspeed Commerce Inc.",1823306,"=""LSPD""","700 SAINT-ANTOINE STREET EAST, SUITE 300",,MONTREAL,Z4,CANADA,Canada,,,"=""7372""","Prepackaged Software",511210,"Software Publishers",34,9,03/31/25,"1,280,994,304",03/31/25,"1,076,826,000","-667,196,000","706,463,000","1,826,203,000"
47506,"Revenue from customer contracts","Revenue Recognition - Principal versus Agent Considerations for payment processing services",565557,03/31/25,05/22/25,1,"PricewaterhouseCoopers LLP",493,"PricewaterhouseCoopers srl",271,Montreal,A8,QUEBEC,Canada,40-F,2025-05-22,,"Lightspeed Commerce Inc.",1823306,"=""LSPD""","700 SAINT-ANTOINE STREET EAST, SUITE 300",,MONTREAL,Z4,CANADA,Canada,,,"=""7372""","Prepackaged Software",511210,"Software Publishers",34,9,03/31/25,"1,280,994,304",03/31/25,"1,076,826,000","-667,196,000","706,463,000","1,826,203,000"
47507,Goodwill,"Goodwill impairment assessment",565557,03/31/25,05/22/25,1,"PricewaterhouseCoopers LLP",493,"PricewaterhouseCoopers srl",271,Montreal,A8,QUEBEC,Canada,40-F,2025-05-22,,"Lightspeed Commerce Inc.",1823306,"=""LSPD""","700 SAINT-ANTOINE STREET EAST, SUITE 300",,MONTREAL,Z4,CANADA,Canada,,,"=""7372""","Prepackaged Software",511210,"Software Publishers",34,9,03/31/25,"1,280,994,304",03/31/25,"1,076,826,000","-667,196,000","706,463,000","1,826,203,000"
48665,"Revenue from customer contracts","Sufficiency of audit evidence over operating revenues",574297,08/31/25,10/23/25,4,"KPMG LLP",,,,Omaha,NE,NEBRASKA,"US Midwest",10-K,2025-10-23,,"LINDSAY CORP",836157,"=""LNN""","18135 BURKE STREET","SUITE 100",OMAHA,NE,NEBRASKA,"US Midwest",,,"=""3523""","Farm Machinery and Equipment",333111,"Farm Machinery and Equipment Manufacturing",34,137,08/31/25,"1,482,632,960",08/31/25,"676,368,000","74,052,000","425,060,000","840,836,000"
47597,"Other intangible assets","Pre-release Film Impairments",565970,03/31/25,05/30/25,2,"Ernst & Young LLP",,,,"Los Angeles",CA,CALIFORNIA,"US West",10-K,2025-05-30,,"Lionsgate Studios Corp.",2052959,"=""LION""","250 HOWE STREET, 20TH FLOOR",,VANCOUVER,A1,"BRITISH COLUMBIA",Canada,,,"=""7812""","Motion Picture and Video Tape Production",0,,34,,,,,,,,
48033,"Other investments","Pre-release Film Impairments",569151,03/31/25,05/30/25,2,"Ernst & Young LLP",,,,"Los Angeles",CA,CALIFORNIA,"US West",S-1/A,2025-07-24,,"Lionsgate Studios Corp.",2052959,"=""LION""","250 HOWE STREET, 20TH FLOOR",,VANCOUVER,A1,"BRITISH COLUMBIA",Canada,,,"=""7812""","Motion Picture and Video Tape Production",0,,34,,,,,,,,
48059,"Other investments","Pre-release Film Impairments",569343,03/31/25,05/30/25,2,"Ernst & Young LLP",,,,"Los Angeles",CA,CALIFORNIA,"US West",S-1/A,2025-07-29,,"Lionsgate Studios Corp.",2052959,"=""LION""","250 HOWE STREET, 20TH FLOOR",,VANCOUVER,A1,"BRITISH COLUMBIA",Canada,,,"=""7812""","Motion Picture and Video Tape Production",0,,34,,,,,,,,
48114,"Other investments","Pre-release Film Impairments",569797,03/31/25,05/30/25,2,"Ernst & Young LLP",,,,"Los Angeles",CA,CALIFORNIA,"US West",424B3,2025-08-05,,"Lionsgate Studios Corp.",2052959,"=""LION""","250 HOWE STREET, 20TH FLOOR",,VANCOUVER,A1,"BRITISH COLUMBIA",Canada,,,"=""7812""","Motion Picture and Video Tape Production",0,,34,,,,,,,,
48873,"Revenue from customer contracts","Revenue - Refer to Note 2 to the financial statements",575837,09/30/25,11/20/25,3,"Deloitte & Touche LLP",,,,McLean,VA,VIRGINIA,"US Mid Atlantic",10-K,2025-11-20,,"LIQUIDITY SERVICES INC",1235468,"=""LQDT""","6931 ARLINGTON ROAD","SUITE 460",BETHESDA,MD,MARYLAND,"US Mid Atlantic",,,"=""7389""","Business Services, NEC",454112,"Electronic Auctions",34,27,09/30/25,"841,459,008",09/30/25,"476,669,000","19,343,000","87,027,000","375,101,000"
47485,"Revenue from customer contracts","Evaluation of the sufficiency of audit evidence over revenue",565514,03/31/25,05/21/25,4,"KPMG LLP",,,,Dallas,TX,TEXAS,"US Southwest",10-K,2025-05-21,,"LiveRamp Holdings, Inc.",733269,"=""RAMP""","225 BUSH STREET","17TH FLOOR","SAN FRANCISCO",CA,CALIFORNIA,"US West",,,"=""7374""","Computer Processing and Data Preparation and Processing Services",518210,"Data Processing, Hosting, and Related Services",34,26,03/31/25,"1,709,960,960",03/31/25,"745,580,000","-814,000","426,936,000","1,259,371,000"
47530,"Sales return and allowances","Assessment of the accruals for certain Customer Programs",565626,03/31/25,05/23/25,4,"KPMG LLP",,,,"San Francisco",CA,CALIFORNIA,"US West",10-K,2025-05-23,,"LOGITECH INTERNATIONAL S.A.",1032975,"=""LOGI""","3930 NORTH FIRST STREET","C/O LOGITECH INC","SAN JOSE",CA,CALIFORNIA,"US West",,,"=""3577""","Computer Peripheral Equipment, NEC",334119,"Other Computer Peripheral Equipment Manufacturing",34,86,04/02/25,"12,781,928,448",03/31/25,"4,554,900,000","631,529,000","1,639,560,000","3,538,504,000"
47572,"Going concern","Liquidity risk assessment",565911,02/28/25,05/29/25,1,"PricewaterhouseCoopers LLP",493,"PricewaterhouseCoopers srl",271,Montreal,A8,QUEBEC,Canada,10-K,2025-05-29,,"Loop Industries, Inc.",1504678,"=""LOOP""","480 FERNAND POITRAS",,TERREBONNE,A8,QUEBEC,Canada,,,"=""2800""","Chemicals & Allied Products",517212,"Cellular and Other Wireless Telecommunications",34,1,02/26/25,"62,382,544",02/28/25,"10,889,000","-15,057,000","-1,341,000","18,578,000"
47601,"Going concern","Liquidity risk assessment",565959,02/28/25,05/29/25,1,"PricewaterhouseCoopers LLP",493,"PricewaterhouseCoopers srl",271,Montreal,A8,QUEBEC,Canada,10-K/A,2025-05-30,,"Loop Industries, Inc.",1504678,"=""LOOP""","480 FERNAND POITRAS",,TERREBONNE,A8,QUEBEC,Canada,,,"=""2800""","Chemicals & Allied Products",517212,"Cellular and Other Wireless Telecommunications",34,1,02/26/25,"62,382,544",02/28/25,"10,889,000","-15,057,000","-1,341,000","18,578,000"
46526,Inventory,"Barter Arrangements — Refer to Note 1 to the financial statements",561074,02/02/25,04/10/25,3,"Deloitte & Touche LLP",,,,Stamford,CT,CONNECTICUT,"US New England",10-K,2025-04-10,,"Lovesac Co",1701758,"=""LOVE""","421 ATLANTIC STREET, SUITE 200",,STAMFORD,CT,CONNECTICUT,"US New England",,,"=""5712""","Furniture Stores",337121,"Upholstered Household Furniture Manufacturing",34,25,02/04/25,"380,728,544",02/02/25,"680,628,000","11,556,000","214,625,000","532,250,000"
45451,Inventory,"Merchandise Inventory – Vendor Funds – Refer to Note 1 to the financial statements",558548,01/31/25,03/24/25,3,"Deloitte & Touche LLP",,,,Charlotte,NC,"NORTH CAROLINA","US Southeast",10-K,2025-03-24,,"LOWES COMPANIES INC",60667,"=""LOW""","1000 LOWES BLVD.",,MOORESVILLE,NC,"NORTH CAROLINA","US Southeast",,,"=""5211""","Lumber and Other Building Materials Dealers",444110,"Home Centers",34,262,01/29/25,"147,785,842,688",01/31/25,"83,674,000,000","6,957,000,000",,"43,102,000,000"
45688,Inventory,"Inventory provision",559131,02/02/25,03/27/25,1,"PricewaterhouseCoopers LLP",191,"PricewaterhouseCoopers LLP Chartered Accountants",271,Vancouver,A1,"BRITISH COLUMBIA",Canada,10-K,2025-03-27,,"lululemon athletica inc.",1397187,"=""LULU""","1818 CORNWALL AVENUE",,VANCOUVER,A1,"BRITISH COLUMBIA",Canada,,,"=""2300""","Apparel & Other Finishd Prods of Fabrics & Similar Matl",315239,"Women's and Girls' Cut and Sew Other Outerwear Manufacturing",34,416,02/04/25,"48,522,039,296",02/02/25,"10,588,126,000","1,814,616,000","4,152,856,000","7,603,292,000"
48231,Inventory,"Inventories, Valuation of Inventory - Refer to Notes 1 and 7 to the financial statements",570554,06/28/25,08/19/25,3,"Deloitte & Touche LLP",,,,"San Jose",CA,CALIFORNIA,"US West",10-K,2025-08-19,,"Lumentum Holdings Inc.",1633978,"=""LITE""","1001 RIDDER PARK DRIVE",,"SAN JOSE",CA,CALIFORNIA,"US West",,,"=""3669""","Communications Equipment, NEC",334210,"Telephone Apparatus Manufacturing",34,95,06/30/25,"6,597,164,032",06/28/25,"1,645,000,000","25,900,000","-391,300,000","4,218,700,000"
48701,"Business combinations","Acquisition of YOOX Net-a-Porter Group S.p.A. (“YNAP”) and bargain purchase gain",574739,06/30/25,10/30/25,4,"KPMG LLP",254,"KPMG AG Wirtschaftsprüfungsgesellschaft",1021,Munich,2M,GERMANY,Foreign,20-F,2025-10-30,,"LuxExperience B.V.",1831907,"=""LUXE""","EINSTEINRING 9",,ASCHHEIM/MUNICH,2M,GERMANY,Foreign,,,"=""5961""","Catalog and Mail-Order Houses",454111,"Electronic Shopping",34,7,05/01/25,"627,557,480",06/30/25,"1,481,737,000","669,055,000","1,418,064,000","2,678,630,000"
48702,"Long-lived assets","Impairment of non-financial assets related to the Online CGU, including Goodwill",574739,06/30/25,10/30/25,4,"KPMG LLP",254,"KPMG AG Wirtschaftsprüfungsgesellschaft",1021,Munich,2M,GERMANY,Foreign,20-F,2025-10-30,,"LuxExperience B.V.",1831907,"=""LUXE""","EINSTEINRING 9",,ASCHHEIM/MUNICH,2M,GERMANY,Foreign,,,"=""5961""","Catalog and Mail-Order Houses",454111,"Electronic Shopping",34,7,05/01/25,"627,557,480",06/30/25,"1,481,737,000","669,055,000","1,418,064,000","2,678,630,000"
48822,Inventory,"Inventories – Excess Quantities and Obsolescence — Refer to Notes 2 and 8 to the financial statements",575620,10/03/25,11/14/25,3,"Deloitte & Touche LLP",,,,Boston,MA,MASSACHUSETTS,"US New England",10-K,2025-11-14,,"MACOM Technology Solutions Holdings, Inc.",1493594,"=""MTSI""","100 CHELMSFORD STREET",,LOWELL,MA,MASSACHUSETTS,"US New England",,,"=""3674""","Semiconductors and Related Devices",334413,"Semiconductor and Related Device Manufacturing",34,127,10/01/25,"9,425,085,440",10/03/25,"967,258,000","-54,210,000","912,210,000","2,103,360,000"
45394,Inventory,"Sufficiency of audit evidence over merchandise inventories",558351,02/01/25,03/21/25,4,"KPMG LLP",,,,Cincinnati,OH,OHIO,"US Midwest",10-K,2025-03-21,,"Macy's, Inc.",794367,"=""M""","151 WEST 34TH STREET",,"NEW YORK",NY,"NEW YORK","US Mid Atlantic",,,"=""5311""","Department Stores",452111,"Department Stores (except Discount Department Stores)",34,15,02/03/25,"4,228,392,960",02/01/25,"23,006,000,000","582,000,000","3,299,000,000","16,402,000,000"
48183,"Related party transactions","Related Party Transactions - Refer to Note 16 to the financial statements",570296,06/30/25,08/13/25,3,"Deloitte & Touche LLP",,,,"New York",NY,"NEW YORK","US Mid Atlantic",10-K,2025-08-13,,"Madison Square Garden Entertainment Corp.",1952073,"=""MSGE""","TWO PENNSYLVANIA PLAZA",,"NEW YORK",NY,"NEW YORK","US Mid Atlantic",,,"=""7990""","Services-Miscellaneous Amusement & Recreation",711310,"Promoters of Performing Arts, Sports, and Similar Events with Facilities",34,40,07/02/25,"1,610,328,448",06/30/25,"942,734,000","37,431,000","-146,142,000","1,669,842,000"
48178,"Related party transactions","Related Party Transactions — Refer to Note 17 to the financial statements",570231,06/30/25,08/12/25,3,"Deloitte & Touche LLP",,,,"New York",NY,"NEW YORK","US Mid Atlantic",10-K,2025-08-12,,"Madison Square Garden Sports Corp.",1636519,"=""MSGS""","TWO PENNSYLVANIA PLAZA",,"NEW YORK",NY,"NEW YORK","US Mid Atlantic",,,"=""7990""","Services-Miscellaneous Amusement & Recreation",711310,"Promoters of Performing Arts, Sports, and Similar Events with Facilities",34,208,07/02/25,"4,057,421,568",06/30/25,"1,039,220,000","-22,438,000","-611,606,000","1,472,974,000"
48929,Goodwill,"Goodwill – impairment assessment",576069,09/27/25,11/25/25,2,"Ernst & Young LLP",,,,Indianapolis,IN,INDIANA,"US Midwest",10-K,2025-11-25,,"Magnera Corp",41719,"=""MAGN""","9335 HARRIS CORNERS PKWY","SUITE 300",CHARLOTTE,NC,"NORTH CAROLINA","US Southeast",,,"=""2621""","Paper Mills",322122,"Newsprint Mills",34,11,09/29/25,"399,076,000",09/27/25,"3,204,000,000","-159,000,000","174,000,000","3,989,000,000"
47717,"Revenue from customer contracts","Evaluation of the sufficiency of audit evidence over revenue recognition",566998,03/31/25,06/16/25,4,"KPMG LLP",827,"KPMG Assurance and Consulting Services LLP (2115)",2115,Bengaluru,K7,INDIA,Foreign,20-F,2025-06-16,,"MakeMyTrip Ltd",1495153,"=""MMYT""","19TH FLOOR, BUILDING NO.5,","DLF CYBER CITY,",GURGAON,K7,INDIA,Foreign,,,"=""4700""","Transportation Services",561510,"Travel Agencies",34,101,04/02/25,"7,108,916,736",03/31/25,"978,336,000","95,274,000","604,839,000","1,828,288,000"
47718,"Deferred income taxes","Recoverability of deferred tax assets",566998,03/31/25,06/16/25,4,"KPMG LLP",827,"KPMG Assurance and Consulting Services LLP (2115)",2115,Bengaluru,K7,INDIA,Foreign,20-F,2025-06-16,,"MakeMyTrip Ltd",1495153,"=""MMYT""","19TH FLOOR, BUILDING NO.5,","DLF CYBER CITY,",GURGAON,K7,INDIA,Foreign,,,"=""4700""","Transportation Services",561510,"Travel Agencies",34,101,04/02/25,"7,108,916,736",03/31/25,"978,336,000","95,274,000","604,839,000","1,828,288,000"
48317,"Warranty liabilities","Evaluation of certain assumptions underlying the product warranty liability for certain brands",571056,06/30/25,08/28/25,4,"KPMG LLP",,,,Nashville,TN,TENNESSEE,"US Southeast",10-K,2025-08-28,,"MALIBU BOATS, INC.",1590976,"=""MBUU""","5075 KIMBERLY WAY",,LOUDON,TN,TENNESSEE,"US Southeast",,,"=""3730""","Ship & Boat Building & Repairing",336612,"Boat Building",34,31,06/30/25,"602,538,048",06/30/25,"807,561,000","14,879,000","295,521,000","734,578,000"
48481,"Revenue from customer contracts","Commercial revenue",572390,06/30/25,09/18/25,1,"PricewaterhouseCoopers LLP",121,"PricewaterhouseCoopers LLP",876,Manchester,X0,"UNITED KINGDOM",Foreign,20-F,2025-09-18,,"Manchester United plc",1549107,"=""MANU""","Old Trafford",,Manchester,X0,"UNITED KINGDOM",Foreign,,,"=""7900""","Services-Amusement & Recreation Services",711211,"Sports Teams and Clubs",34,17,07/02/25,"960,036,992",06/30/25,"913,358,000","-45,253,000","-1,058,903,000","2,244,269,000"
48482,"Other intangible assets","Value of intangible assets – registrations",572390,06/30/25,09/18/25,1,"PricewaterhouseCoopers LLP",121,"PricewaterhouseCoopers LLP",876,Manchester,X0,"UNITED KINGDOM",Foreign,20-F,2025-09-18,,"Manchester United plc",1549107,"=""MANU""","Old Trafford",,Manchester,X0,"UNITED KINGDOM",Foreign,,,"=""7900""","Services-Amusement & Recreation Services",711211,"Sports Teams and Clubs",34,17,07/02/25,"960,036,992",06/30/25,"913,358,000","-45,253,000","-1,058,903,000","2,244,269,000"
48833,Inventory,"Fair Value of Trade-in Used Boats",575677,09/30/25,11/17/25,4,"KPMG LLP",,,,Tampa,FL,FLORIDA,"US Southeast",10-K,2025-11-17,,"MARINEMAX INC",1057060,"=""HZO""","2600 MCCORMICK DRIVE",SUITE200,CLEARWATER,FL,FLORIDA,"US Southeast",,,"=""5531""","Auto and Home Supply Stores",441222,"Boat Dealers",34,26,10/02/25,"555,476,992",09/30/25,"2,309,288,000","-31,631,000","374,843,000","2,470,438,000"
48834,Goodwill,"Goodwill impairment assessment of certain reporting units",575677,09/30/25,11/17/25,4,"KPMG LLP",,,,Tampa,FL,FLORIDA,"US Southeast",10-K,2025-11-17,,"MARINEMAX INC",1057060,"=""HZO""","2600 MCCORMICK DRIVE",SUITE200,CLEARWATER,FL,FLORIDA,"US Southeast",,,"=""5531""","Auto and Home Supply Stores",441222,"Boat Dealers",34,26,10/02/25,"555,476,992",09/30/25,"2,309,288,000","-31,631,000","374,843,000","2,470,438,000"
44732,Inventory,"Inventories – Management Judgments Regarding Excess and Obsolete Inventory Reserves — Refer to Note 2 to the financial statements.",557178,02/01/25,03/12/25,3,"Deloitte & Touche LLP",,,,"San Jose",CA,CALIFORNIA,"US West",10-K,2025-03-12,,"Marvell Technology, Inc.",1835632,"=""MRVL""","1000 N. WEST STREET","SUITE 1200",WILMINGTON,DE,DELAWARE,"US Mid Atlantic",,,"=""3674""","Semiconductors and Related Devices",334413,"Semiconductor and Related Device Manufacturing",34,114,02/03/25,"98,263,465,984",02/01/25,"5,767,300,000","-885,000,000","-870,500,000","20,204,500,000"
48238,"Sales return and allowances","Trade-Related Allowances - Refer to Note 1 in the Financial Statements",570644,06/30/25,08/21/25,3,"Deloitte & Touche LLP",,,,Columbus,OH,OHIO,"US Midwest",10-K,2025-08-21,,"MARZETTI CO",57515,"=""MZTI""","380 POLARIS PARKWAY",,WESTERVILLE,OH,OHIO,"US Midwest",,,"=""2030""","Canned, Frozen & Preservd Fruit, Veg & Food Specialties",311941,"Mayonnaise, Dressing, and Other Prepared Sauce Manufacturing",34,173,06/30/25,"4,756,979,712",06/30/25,"1,909,122,000","167,347,000","775,723,000","1,274,724,000"
48304,"Warranty liabilities","Product Warranties — Refer to Notes 1 and 8 to the financial statements",570961,06/30/25,08/27/25,3,"Deloitte & Touche LLP",,,,Nashville,TN,TENNESSEE,"US Southeast",10-K,2025-08-27,,"MasterCraft Boat Holdings, Inc.",1638290,"=""MCFT""","100 CHEROKEE COVE DRIVE",,VONORE,TN,TENNESSEE,"US Southeast",,,"=""3730""","Ship & Boat Building & Repairing",336612,"Boat Building",34,19,06/30/25,"304,838,112",06/30/25,"284,203,000","7,043,000","123,043,000","259,948,000"
48305,"Other intangible assets","Other Intangible Assets — Crest Impairment Evaluation — Refer to Notes 1 and 7 to the financial statements",570961,06/30/25,08/27/25,3,"Deloitte & Touche LLP",,,,Nashville,TN,TENNESSEE,"US Southeast",10-K,2025-08-27,,"MasterCraft Boat Holdings, Inc.",1638290,"=""MCFT""","100 CHEROKEE COVE DRIVE",,VONORE,TN,TENNESSEE,"US Southeast",,,"=""3730""","Ship & Boat Building & Repairing",336612,"Boat Building",34,19,06/30/25,"304,838,112",06/30/25,"284,203,000","7,043,000","123,043,000","259,948,000"
48413,"Revenue from customer contracts","Revenue – Fixed Price Contracts – Refer to Notes 1 and 2 to the financial statements",571913,06/30/25,09/10/25,3,"Deloitte & Touche LLP",,,,Tulsa,OK,OKLAHOMA,"US Southwest",10-K,2025-09-10,,"MATRIX SERVICE CO",866273,"=""MTRX""","15 EAST 5TH STREET","SUITE 1100",TULSA,OK,OKLAHOMA,"US Southwest",,,"=""1700""","Construction - Special Trade Contractors",236210,"Industrial Building Construction",34,14,07/02/25,"385,166,464",06/30/25,"769,286,000","-29,462,000","113,114,000","600,256,000"
48414,Goodwill,"Goodwill – Certain Reporting Units – Refer to Notes 1 and 4 to the financial statements",571913,06/30/25,09/10/25,3,"Deloitte & Touche LLP",,,,Tulsa,OK,OKLAHOMA,"US Southwest",10-K,2025-09-10,,"MATRIX SERVICE CO",866273,"=""MTRX""","15 EAST 5TH STREET","SUITE 1100",TULSA,OK,OKLAHOMA,"US Southwest",,,"=""1700""","Construction - Special Trade Contractors",236210,"Industrial Building Construction",34,14,07/02/25,"385,166,464",06/30/25,"769,286,000","-29,462,000","113,114,000","600,256,000"
48884,Goodwill,"Valuation of Goodwill",575924,09/30/25,11/21/25,2,"Ernst & Young LLP",,,,Pittsburgh,PA,PENNSYLVANIA,"US Mid Atlantic",10-K,2025-11-21,,"MATTHEWS INTERNATIONAL CORP",63296,"=""MATW""","TWO NORTHSHORE CENTER",,PITTSBURGH,PA,PENNSYLVANIA,"US Mid Atlantic",,,"=""3360""","Nonferrous Foundries (Castings)",332323,"Ornamental and Architectural Metal Work Manufacturing",34,24,09/30/25,"747,723,072",09/30/25,"1,497,689,000","-24,471,000","-112,577,000","1,694,442,000"
48872,"Revenue from customer contracts","Sufficiency of audit evidence over performance-based contract revenue",575835,09/30/25,11/20/25,4,"KPMG LLP",,,,McLean,VA,VIRGINIA,"US Mid Atlantic",10-K,2025-11-20,,"MAXIMUS, INC.",1032220,"=""MMS""","ATTN: TREASURY DEPT.","1600 TYSONS BLVD, #1400",MCLEAN,VA,VIRGINIA,"US Mid Atlantic",,,"=""7389""","Business Services, NEC",541611,"Administrative Management and General Management Consulting Services",34,91,09/30/25,"5,007,533,056",09/30/25,"5,431,276,000","319,034,000","-860,586,000","4,069,639,000"
47813,"Goodwill and intangible assets","Goodwill and indefinite-lived intangible asset impairment assessment",567503,03/31/25,06/05/25,2,"Ernst & Young LLP",,,,"New York",NY,"NEW YORK","US Mid Atlantic",DRS/A,2025-06-05,,"McGraw Hill, Inc.",1951070,"=""MH""","C/O PLATINUM EQUITY ADVISORS, LLC","360 N. CRESCENT DRIVE, SOUTH BUILDING","BEVERLY HILLS",CA,CALIFORNIA,"US West",,,"=""2741""","Miscellaneous Publishing",0,,34,,,,03/31/25,"2,101,299,000","-85,839,000","-3,731,536,000","5,757,760,000"
47814,"Revenue from customer contracts","Revenue Recognition - Identification of performance obligations in revenue contracts",567503,03/31/25,06/05/25,2,"Ernst & Young LLP",,,,"New York",NY,"NEW YORK","US Mid Atlantic",DRS/A,2025-06-05,,"McGraw Hill, Inc.",1951070,"=""MH""","C/O PLATINUM EQUITY ADVISORS, LLC","360 N. CRESCENT DRIVE, SOUTH BUILDING","BEVERLY HILLS",CA,CALIFORNIA,"US West",,,"=""2741""","Miscellaneous Publishing",0,,34,,,,03/31/25,"2,101,299,000","-85,839,000","-3,731,536,000","5,757,760,000"
47835,"Goodwill and intangible assets","Goodwill and indefinite-lived intangible asset impairment assessment",567638,03/31/25,06/05/25,2,"Ernst & Young LLP",,,,"New York",NY,"NEW YORK","US Mid Atlantic",S-1,2025-06-27,,"McGraw Hill, Inc.",1951070,"=""MH""","C/O PLATINUM EQUITY ADVISORS, LLC","360 N. CRESCENT DRIVE, SOUTH BUILDING","BEVERLY HILLS",CA,CALIFORNIA,"US West",,,"=""2741""","Miscellaneous Publishing",0,,34,,,,03/31/25,"2,101,299,000","-85,839,000","-3,731,536,000","5,757,760,000"
47836,"Revenue from customer contracts","Revenue Recognition - Identification of performance obligations in revenue contracts",567638,03/31/25,06/05/25,2,"Ernst & Young LLP",,,,"New York",NY,"NEW YORK","US Mid Atlantic",S-1,2025-06-27,,"McGraw Hill, Inc.",1951070,"=""MH""","C/O PLATINUM EQUITY ADVISORS, LLC","360 N. CRESCENT DRIVE, SOUTH BUILDING","BEVERLY HILLS",CA,CALIFORNIA,"US West",,,"=""2741""","Miscellaneous Publishing",0,,34,,,,03/31/25,"2,101,299,000","-85,839,000","-3,731,536,000","5,757,760,000"
47902,"Goodwill and intangible assets","Goodwill and indefinite-lived intangible asset impairment assessment",568184,03/31/25,06/05/25,2,"Ernst & Young LLP",,,,"New York",NY,"NEW YORK","US Mid Atlantic",S-1/A,2025-07-08,,"McGraw Hill, Inc.",1951070,"=""MH""","C/O PLATINUM EQUITY ADVISORS, LLC","360 N. CRESCENT DRIVE, SOUTH BUILDING","BEVERLY HILLS",CA,CALIFORNIA,"US West",,,"=""2741""","Miscellaneous Publishing",0,,34,,,,03/31/25,"2,101,299,000","-85,839,000","-3,731,536,000","5,757,760,000"
47903,"Revenue from customer contracts","Revenue Recognition - Identification of performance obligations in revenue contracts",568184,03/31/25,06/05/25,2,"Ernst & Young LLP",,,,"New York",NY,"NEW YORK","US Mid Atlantic",S-1/A,2025-07-08,,"McGraw Hill, Inc.",1951070,"=""MH""","C/O PLATINUM EQUITY ADVISORS, LLC","360 N. CRESCENT DRIVE, SOUTH BUILDING","BEVERLY HILLS",CA,CALIFORNIA,"US West",,,"=""2741""","Miscellaneous Publishing",0,,34,,,,03/31/25,"2,101,299,000","-85,839,000","-3,731,536,000","5,757,760,000"
47932,"Goodwill and intangible assets","Goodwill and indefinite-lived intangible asset impairment assessment",568483,03/31/25,06/05/25,2,"Ernst & Young LLP",,,,"New York",NY,"NEW YORK","US Mid Atlantic",S-1/A,2025-07-14,,"McGraw Hill, Inc.",1951070,"=""MH""","C/O PLATINUM EQUITY ADVISORS, LLC","360 N. CRESCENT DRIVE, SOUTH BUILDING","BEVERLY HILLS",CA,CALIFORNIA,"US West",,,"=""2741""","Miscellaneous Publishing",0,,34,,,,03/31/25,"2,101,299,000","-85,839,000","-3,731,536,000","5,757,760,000"
47933,"Revenue from customer contracts","Revenue Recognition - Identification of performance obligations in revenue contracts",568483,03/31/25,06/05/25,2,"Ernst & Young LLP",,,,"New York",NY,"NEW YORK","US Mid Atlantic",S-1/A,2025-07-14,,"McGraw Hill, Inc.",1951070,"=""MH""","C/O PLATINUM EQUITY ADVISORS, LLC","360 N. CRESCENT DRIVE, SOUTH BUILDING","BEVERLY HILLS",CA,CALIFORNIA,"US West",,,"=""2741""","Miscellaneous Publishing",0,,34,,,,03/31/25,"2,101,299,000","-85,839,000","-3,731,536,000","5,757,760,000"
47958,"Goodwill and intangible assets","Goodwill and indefinite-lived intangible asset impairment assessment",568665,03/31/25,06/05/25,2,"Ernst & Young LLP",,,,"New York",NY,"NEW YORK","US Mid Atlantic",S-1/A,2025-07-17,,"McGraw Hill, Inc.",1951070,"=""MH""","C/O PLATINUM EQUITY ADVISORS, LLC","360 N. CRESCENT DRIVE, SOUTH BUILDING","BEVERLY HILLS",CA,CALIFORNIA,"US West",,,"=""2741""","Miscellaneous Publishing",0,,34,,,,03/31/25,"2,101,299,000","-85,839,000","-3,731,536,000","5,757,760,000"
47959,"Revenue from customer contracts","Revenue Recognition - Identification of performance obligations in revenue contracts",568665,03/31/25,06/05/25,2,"Ernst & Young LLP",,,,"New York",NY,"NEW YORK","US Mid Atlantic",S-1/A,2025-07-17,,"McGraw Hill, Inc.",1951070,"=""MH""","C/O PLATINUM EQUITY ADVISORS, LLC","360 N. CRESCENT DRIVE, SOUTH BUILDING","BEVERLY HILLS",CA,CALIFORNIA,"US West",,,"=""2741""","Miscellaneous Publishing",0,,34,,,,03/31/25,"2,101,299,000","-85,839,000","-3,731,536,000","5,757,760,000"
47985,"Goodwill and intangible assets","Goodwill and indefinite-lived intangible asset impairment assessment",568856,03/31/25,06/05/25,2,"Ernst & Young LLP",,,,"New York",NY,"NEW YORK","US Mid Atlantic",S-1/A,2025-07-21,,"McGraw Hill, Inc.",1951070,"=""MH""","C/O PLATINUM EQUITY ADVISORS, LLC","360 N. CRESCENT DRIVE, SOUTH BUILDING","BEVERLY HILLS",CA,CALIFORNIA,"US West",,,"=""2741""","Miscellaneous Publishing",0,,34,,,,03/31/25,"2,101,299,000","-85,839,000","-3,731,536,000","5,757,760,000"
47986,"Revenue from customer contracts","Revenue Recognition - Identification of performance obligations in revenue contracts",568856,03/31/25,06/05/25,2,"Ernst & Young LLP",,,,"New York",NY,"NEW YORK","US Mid Atlantic",S-1/A,2025-07-21,,"McGraw Hill, Inc.",1951070,"=""MH""","C/O PLATINUM EQUITY ADVISORS, LLC","360 N. CRESCENT DRIVE, SOUTH BUILDING","BEVERLY HILLS",CA,CALIFORNIA,"US West",,,"=""2741""","Miscellaneous Publishing",0,,34,,,,03/31/25,"2,101,299,000","-85,839,000","-3,731,536,000","5,757,760,000"
48031,"Goodwill and intangible assets","Goodwill and indefinite-lived intangible asset impairment assessment",569159,03/31/25,06/05/25,2,"Ernst & Young LLP",,,,"New York",NY,"NEW YORK","US Mid Atlantic",424B4,2025-07-24,,"McGraw Hill, Inc.",1951070,"=""MH""","C/O PLATINUM EQUITY ADVISORS, LLC","360 N. CRESCENT DRIVE, SOUTH BUILDING","BEVERLY HILLS",CA,CALIFORNIA,"US West",,,"=""2741""","Miscellaneous Publishing",0,,34,,,,03/31/25,"2,101,299,000","-85,839,000","-3,731,536,000","5,757,760,000"
48032,"Revenue from customer contracts","Revenue Recognition - Identification of performance obligations in revenue contracts",569159,03/31/25,06/05/25,2,"Ernst & Young LLP",,,,"New York",NY,"NEW YORK","US Mid Atlantic",424B4,2025-07-24,,"McGraw Hill, Inc.",1951070,"=""MH""","C/O PLATINUM EQUITY ADVISORS, LLC","360 N. CRESCENT DRIVE, SOUTH BUILDING","BEVERLY HILLS",CA,CALIFORNIA,"US West",,,"=""2741""","Miscellaneous Publishing",0,,34,,,,03/31/25,"2,101,299,000","-85,839,000","-3,731,536,000","5,757,760,000"
47330,"Other contingent liabilities","Uncertain Tax Position, Opioid-Related Claims - refer to Note 1 and Note 6 to the financial statements",564633,03/31/25,05/08/25,3,"Deloitte & Touche LLP",,,,Dallas,TX,TEXAS,"US Southwest",10-K,2025-05-09,,"MCKESSON CORP",927653,"=""MCK""","6555 STATE HIGHWAY 161",,IRVING,TX,TEXAS,"US Southwest",,,"=""5122""","Drugs, Drug Proprietaries, and Druggists` Sundries",424210,"Drugs and Druggists' Sundries Merchant Wholesalers",34,694,04/02/25,"86,917,603,328",03/31/25,"359,051,000,000","3,295,000,000","-13,560,000,000","75,140,000,000"
47762,"Uncertain tax positions","Income Tax Reserve for the Uncertain Tax Position Related to Puerto Rico Manufacturing",567165,04/25/25,06/20/25,1,"PricewaterhouseCoopers LLP",,,,Minneapolis,MN,MINNESOTA,"US Midwest",10-K,2025-06-20,,"Medtronic plc",1613103,"=""MDT""","BUILDING TWO PARKMORE BUSINESS PARK WEST",,GALWAY,L2,IRELAND,Foreign,,,"=""3845""","Electromedical and Electrotherapeutic Apparatus",334510,"Electromedical and Electrotherapeutic Apparatus Manufacturing",34,84,04/23/25,"107,413,020,672",04/25/25,"33,537,000,000","4,664,000,000","-5,381,000,000","91,679,000,000"
48160,"Revenue from customer contracts","Estimate of total contract costs to be incurred for certain fixed price contract revenue recognized over time",570120,06/27/25,08/11/25,4,"KPMG LLP",,,,Boston,MA,MASSACHUSETTS,"US New England",10-K,2025-08-11,,"MERCURY SYSTEMS INC",1049521,"=""MRCY""","50 MINUTEMAN ROAD",,ANDOVER,MA,MASSACHUSETTS,"US New England",,,"=""3670""","Electronic Components & Accessories",334418,"Printed Circuit Assembly (Electronic Assembly) Manufacturing",34,51,06/26/25,"3,069,014,784",06/27/25,"912,020,000","-37,904,000","324,757,000","2,434,764,000"
48342,"Goodwill and intangible assets","Impairment assessment of in-process research and development intangible assets and goodwill",571099,06/30/25,08/29/25,1,"PricewaterhouseCoopers LLP",89,PricewaterhouseCoopers,1379,Melbourne,C3,AUSTRALIA,Foreign,20-F,2025-08-29,,"MESOBLAST LTD",1345099,"=""MESO""","LEVEL 38","55 COLLINS STREET","MELBOURNE, VICTORIA",C3,AUSTRALIA,Foreign,,,"=""2836""","Biological Products, Except Diagnostic Substances",325414,"Biological Product (except Diagnostic) Manufacturing",34,11,07/02/25,"1,239,977,600",06/30/25,"17,198,000","-102,142,000","25,616,000","784,683,000"
47905,Goodwill,"Goodwill Impairment Assessment of the Nordic Lights Reporting Unit",568246,05/03/25,07/09/25,2,"Ernst & Young LLP",,,,Chicago,IL,ILLINOIS,"US Midwest",10-K,2025-07-09,,"METHODE ELECTRONICS INC",65270,"=""MEI""","8750 WEST BRYN MAWR AVENUE","SUITE 1000",CHICAGO,IL,ILLINOIS,"US Midwest",,,"=""3678""","Electronic Connectors",334417,"Electronic Connector Manufacturing",34,7,05/05/25,"235,558,944",05/03/25,"1,048,100,000","-62,600,000","282,200,000","1,305,800,000"
47522,"Uncertain tax positions","Unrecognized tax benefits",565641,03/31/25,05/22/25,2,"Ernst & Young LLP",,,,Phoenix,AZ,ARIZONA,"US Southwest",10-K,2025-05-23,,"MICROCHIP TECHNOLOGY INC",827054,"=""MCHP""","2355 W CHANDLER BLVD",,CHANDLER,AZ,ARIZONA,"US Southwest",,,"=""3674""","Semiconductors and Related Devices",334413,"Semiconductor and Related Device Manufacturing",34,49,04/02/25,"26,315,483,136",03/31/25,"4,401,600,000","-500,000","-1,995,500,000","15,374,600,000"
48599,"Property, plant and equipment","Accounting for the U.S. CHIPS Act Funding Agreements",573499,08/28/25,10/03/25,1,"PricewaterhouseCoopers LLP",,,,"San Jose",CA,CALIFORNIA,"US West",10-K,2025-10-03,,"MICRON TECHNOLOGY INC",723125,"=""MU""","8000 S FEDERAL WAY","PO BOX 6",BOISE,ID,IDAHO,"US West",,,"=""3674""","Semiconductors and Related Devices",334413,"Semiconductor and Related Device Manufacturing",34,117,08/26/25,"130,378,072,064",08/28/25,"37,378,000,000","8,539,000,000","52,562,000,000","82,798,000,000"
48067,"Revenue from customer contracts","Revenue Recognition – Refer to Note 1 to the financial statements",569470,06/30/25,07/30/25,3,"Deloitte & Touche LLP",,,,Seattle,WA,WASHINGTON,"US West",10-K,2025-07-30,,"MICROSOFT CORP",789019,"=""MSFT""","ONE MICROSOFT WAY",,REDMOND,WA,WASHINGTON,"US West",,,"=""7372""","Prepackaged Software",511210,"Software Publishers",34,497,06/30/25,"3,697,745,854,464",06/30/25,"281,724,000,000","101,832,000,000","201,366,000,000","619,003,000,000"
48068,"Uncertain tax positions","Income Taxes – Uncertain Tax Positions – Refer to Note 11 to the financial statements",569470,06/30/25,07/30/25,3,"Deloitte & Touche LLP",,,,Seattle,WA,WASHINGTON,"US West",10-K,2025-07-30,,"MICROSOFT CORP",789019,"=""MSFT""","ONE MICROSOFT WAY",,REDMOND,WA,WASHINGTON,"US West",,,"=""7372""","Prepackaged Software",511210,"Software Publishers",34,497,06/30/25,"3,697,745,854,464",06/30/25,"281,724,000,000","101,832,000,000","201,366,000,000","619,003,000,000"
47991,Goodwill,"Goodwill impairment assessment",568832,05/31/25,07/21/25,4,"KPMG LLP",,,,Chicago,IL,ILLINOIS,"US Midwest",10-K,2025-07-21,,"MILLERKNOLL, INC.",66382,"=""MLKN""","855 E MAIN AVE","PO BOX 302",ZEELAND,MI,MICHIGAN,"US Midwest",,,"=""2520""","Office Furniture",337214,"Office Furniture (except Wood) Manufacturing",34,16,06/02/25,"1,113,753,216",05/31/25,"3,669,900,000","-36,900,000","-497,300,000","3,950,200,000"
47992,"Other intangible assets","Knoll and Muuto tradenames impairment assessment",568832,05/31/25,07/21/25,4,"KPMG LLP",,,,Chicago,IL,ILLINOIS,"US Midwest",10-K,2025-07-21,,"MILLERKNOLL, INC.",66382,"=""MLKN""","855 E MAIN AVE","PO BOX 302",ZEELAND,MI,MICHIGAN,"US Midwest",,,"=""2520""","Office Furniture",337214,"Office Furniture (except Wood) Manufacturing",34,16,06/02/25,"1,113,753,216",05/31/25,"3,669,900,000","-36,900,000","-497,300,000","3,950,200,000"
47888,"Allowance for credit losses","Allowance for Credit Losses—Commercial and Krungsri Segments — Macroeconomic Variables in Multiple Economic Forecast Scenarios and Weightings Given to Each Scenario — Refer to Notes 1 and 4 to the Financial Statements",568114,03/31/25,07/07/25,3,"Deloitte & Touche LLP",19,"Deloitte Touche Tohmatsu LLC",1044,Tokyo,M0,JAPAN,Foreign,20-F,2025-07-07,,"MITSUBISHI UFJ FINANCIAL GROUP INC",67088,"=""MUFG""","4-5, MARUNOUCHI 1-CHOME",CHIYODA-KU,TOKYO,M0,JAPAN,Foreign,,,"=""6029""","Commercial Banks, NEC",522110,"Commercial Banking",34,13,04/02/25,"163,104,538,624",03/31/25,"32,550,000,000","8,472,000,000","109,167,000,000","2,714,593,000,000"
47889,"Allowance for credit losses","Allowance for Credit Losses — Krungsri Segment — Qualitative Adjustments — Refer to Notes 1 and 4 to the Financial Statements",568114,03/31/25,07/07/25,3,"Deloitte & Touche LLP",19,"Deloitte Touche Tohmatsu LLC",1044,Tokyo,M0,JAPAN,Foreign,20-F,2025-07-07,,"MITSUBISHI UFJ FINANCIAL GROUP INC",67088,"=""MUFG""","4-5, MARUNOUCHI 1-CHOME",CHIYODA-KU,TOKYO,M0,JAPAN,Foreign,,,"=""6029""","Commercial Banks, NEC",522110,"Commercial Banking",34,13,04/02/25,"163,104,538,624",03/31/25,"32,550,000,000","8,472,000,000","109,167,000,000","2,714,593,000,000"
47890,"Allowance for credit losses","Allowance for Credit Losses—Commercial Segment—Internal Credit Rating — Refer to Notes 1 and 4 to the Financial Statements",568114,03/31/25,07/07/25,3,"Deloitte & Touche LLP",19,"Deloitte Touche Tohmatsu LLC",1044,Tokyo,M0,JAPAN,Foreign,20-F,2025-07-07,,"MITSUBISHI UFJ FINANCIAL GROUP INC",67088,"=""MUFG""","4-5, MARUNOUCHI 1-CHOME",CHIYODA-KU,TOKYO,M0,JAPAN,Foreign,,,"=""6029""","Commercial Banks, NEC",522110,"Commercial Banking",34,13,04/02/25,"163,104,538,624",03/31/25,"32,550,000,000","8,472,000,000","109,167,000,000","2,714,593,000,000"
47786,"Allowance for credit losses","Allowance for Credit Losses",567399,03/31/25,06/25/25,2,"Ernst & Young LLP",48,"Ernst & Young ShinNihon LLC",789,Tokyo,M0,JAPAN,Foreign,20-F,2025-06-25,,"MIZUHO FINANCIAL GROUP INC",1335730,"=""MFG""","1-5-5, OTEMACHI",,"CHIYODA-KU, TOKYO",M0,JAPAN,Foreign,,,"=""6021""","National Commercial Banks",523110,"Investment Banking and Securities Dealing",34,5,04/02/25,"6,906,759,680",03/31/25,"20,983,000,000","3,968,000,000","65,975,000,000","1,850,616,000,000"
47787,"Other investments","Valuation of Certain Level 3 Financial Instruments",567399,03/31/25,06/25/25,2,"Ernst & Young LLP",48,"Ernst & Young ShinNihon LLC",789,Tokyo,M0,JAPAN,Foreign,20-F,2025-06-25,,"MIZUHO FINANCIAL GROUP INC",1335730,"=""MFG""","1-5-5, OTEMACHI",,"CHIYODA-KU, TOKYO",M0,JAPAN,Foreign,,,"=""6021""","National Commercial Banks",523110,"Investment Banking and Securities Dealing",34,5,04/02/25,"6,906,759,680",03/31/25,"20,983,000,000","3,968,000,000","65,975,000,000","1,850,616,000,000"
47486,"Deferred income taxes","Realizability of certain domestic deferred tax assets",565513,03/31/25,05/21/25,4,"KPMG LLP",,,,Milwaukee,WI,WISCONSIN,"US Midwest",10-K,2025-05-21,,"MODINE MANUFACTURING CO",67347,"=""MOD""","1500 DEKOVEN AVE",,RACINE,WI,WISCONSIN,"US Midwest",,,"=""3714""","Motor Vehicle Parts and Accessories",336399,"All Other Motor Vehicle Parts Manufacturing",34,77,03/31/25,"4,019,704,576",03/31/25,"2,583,500,000","184,000,000","529,600,000","1,917,600,000"
48080,"Other investments","Valuation of available-for-sale debt securities",569501,03/31/25,07/31/25,1,"PricewaterhouseCoopers LLP",94,"PricewaterhouseCoopers Zhong Tian LLP",1424,Shanghai,F4,CHINA,Foreign,20-F,2025-07-31,,"MOGU Inc.",1743971,"=""MOGU""","MINGQI CENTER, 8/F, BUILDING NO. 1","NO. 666 ZHENHUA ROAD, XIHU DISTRICT",HANGZHOU,F4,CHINA,Foreign,,,"=""7389""","Business Services, NEC",454111,"Electronic Shopping",34,2,04/02/25,"16,355,874",03/31/25,"19,476,000","-8,627,000","70,085,000","118,348,000"
45350,"Revenue from customer contracts","Revenue Recognition - Subscription Revenue",558358,01/31/25,03/20/25,1,"PricewaterhouseCoopers LLP",,,,"San Francisco",CA,CALIFORNIA,"US West",10-K,2025-03-21,,"MongoDB, Inc.",1441816,"=""MDB""","1633 BROADWAY","38TH FLOOR","NEW YORK",NY,"NEW YORK","US Mid Atlantic",,,"=""7372""","Prepackaged Software",511210,"Software Publishers",34,278,01/29/25,"20,727,400,448",01/31/25,"2,006,443,000","-129,072,000","2,687,948,000","3,430,293,000"
47553,Goodwill,"Interim Goodwill Impairment Assessment",565815,03/29/25,05/28/25,1,"PricewaterhouseCoopers LLP",,,,Fairport,NY,"NEW YORK","US Mid Atlantic",10-K,2025-05-28,,"MONRO, INC.",876427,"=""MNRO""","295 WOODCLIFF DRIVE, SUITE 202",,FAIRPORT,NY,"NEW YORK","US Mid Atlantic",,,"=""7500""","Services-Automotive Repair, Services & Parking",811112,"Automotive Exhaust System Repair",34,14,03/31/25,"433,563,328",03/29/25,"1,195,334,000","-5,182,000","-126,064,000","1,641,823,000"
47554,"Long-lived assets","Evaluation and Impairment of Long-Lived Assets for Certain Asset Groups",565815,03/29/25,05/28/25,1,"PricewaterhouseCoopers LLP",,,,Fairport,NY,"NEW YORK","US Mid Atlantic",10-K,2025-05-28,,"MONRO, INC.",876427,"=""MNRO""","295 WOODCLIFF DRIVE, SUITE 202",,FAIRPORT,NY,"NEW YORK","US Mid Atlantic",,,"=""7500""","Services-Automotive Repair, Services & Parking",811112,"Automotive Exhaust System Repair",34,14,03/31/25,"433,563,328",03/29/25,"1,195,334,000","-5,182,000","-126,064,000","1,641,823,000"
48954,"Revenue from customer contracts","Estimated costs at completion used to recognize revenue for select long-term production contracts",576174,09/27/25,11/26/25,2,"Ernst & Young LLP",,,,Buffalo,NY,"NEW YORK","US Mid Atlantic",10-K,2025-11-26,,"MOOG INC.",67887,"=""MOG.A""","400 JAMISON ROAD",,"EAST AURORA",NY,"NEW YORK","US Mid Atlantic",,,"=""3590""","Misc Industrial & Commercial Machinery & Equipment",334511,"Search, Detection, Navigation, Guidance, Aeronautical, and Nautical System and Instrument Manufacturing",34,201,09/29/25,"5,724,294,656",09/27/25,"3,860,624,000","235,028,000","1,084,141,000","4,426,055,000"
47656,"Sales return and allowances","Marketing Allowances",566627,03/31/25,06/09/25,2,"Ernst & Young LLP",,,,"Los Angeles",CA,CALIFORNIA,"US West",10-K,2025-06-09,,"MOTORCAR PARTS OF AMERICA INC",918251,"=""MPAA""","2929 CALIFORNIA STREET",,TORRANCE,CA,CALIFORNIA,"US West",,,"=""3714""","Motor Vehicle Parts and Accessories",336322,"Other Motor Vehicle Electrical and Electronic Equipment Manufacturing",34,9,04/02/25,"185,261,904",03/31/25,"757,354,000","-19,470,000","253,942,000","957,636,000"
46767,Inventory,"Valuation of Component Parts Inventory",561646,01/31/25,04/16/25,1,"PricewaterhouseCoopers LLP",,,,"New York",NY,"NEW YORK","US Mid Atlantic",10-K,2025-04-16,,"MOVADO GROUP INC",72573,"=""MOV""","650 FROM ROAD","SUITE 375",PARAMUS,NJ,"NEW JERSEY","US Mid Atlantic",,,"=""3873""","Watches, Clocks, Clockwork Operated Devices and Parts",334518,"Watch, Clock, and Part Manufacturing",34,19,01/31/25,"299,950,816",01/31/25,"653,378,000","18,364,000","475,792,000","729,231,000"
48670,Inventory,"Measurement of Inventory Valuation Reserves",574272,08/30/25,10/23/25,2,"Ernst & Young LLP",,,,Jericho,NY,"NEW YORK","US Mid Atlantic",10-K,2025-10-23,,"MSC INDUSTRIAL DIRECT CO INC",1003078,"=""MSM""","515 BROADHOLLOW ROAD",,MELVILLE,NY,"NEW YORK","US Mid Atlantic",,,"=""5084""","Industrial Machinery and Equipment",423840,"Industrial Supplies Merchant Wholesalers",34,90,08/31/25,"5,033,909,248",08/30/25,"3,769,521,000","199,328,000","579,053,000","2,462,064,000"
48864,Goodwill,"Valuation of Goodwill",575790,09/30/25,11/19/25,2,"Ernst & Young LLP",,,,Atlanta,GA,GEORGIA,"US Southeast",10-K,2025-11-19,,"Mueller Water Products, Inc.",1350593,"=""MWA""","1200 ABERNATHY RD, NE","SUITE 1200",ATLANTA,GA,GEORGIA,"US Southeast",,,"=""3490""","Miscellaneous Fabricated Metal Products",237110,"Water and Sewer Line and Related Structures Construction",34,26,09/30/25,"3,989,567,232",09/30/25,"1,429,700,000","191,700,000","585,200,000","1,838,900,000"
48289,Inventory,"Excess and Slow-Moving Inventory Reserve — Refer to Note 1 and 6 to the financial statements",570818,06/30/25,08/25/25,3,"Deloitte & Touche LLP",,,,Jericho,NY,"NEW YORK","US Mid Atlantic",10-K,2025-08-25,,"NAPCO SECURITY TECHNOLOGIES, INC",69633,"=""NSSC""","333 BAYVIEW AVE",,AMITYVILLE,NY,"NEW YORK","US Mid Atlantic",,,"=""3669""","Communications Equipment, NEC",334290,"Other Communications Equipment Manufacturing",34,30,06/30/25,"1,058,639,168",06/30/25,"181,621,000","43,406,000","165,319,000","198,141,000"
48890,"Proven and unproven reserves","The Impact of Proved Natural Gas Reserves on Exploration and Production Properties, Net",575925,09/30/25,11/21/25,1,"PricewaterhouseCoopers LLP",,,,Buffalo,NY,"NEW YORK","US Mid Atlantic",10-K,2025-11-21,,"NATIONAL FUEL GAS CO",70145,"=""NFG""","6363 MAIN STREET",,WILLIAMSVILLE,NY,"NEW YORK","US Mid Atlantic",,,"=""4924""","Natural Gas Distribution",221210,"Natural Gas Distribution",34,92,10/02/25,"8,286,346,240",09/30/25,"2,277,541,000","518,504,000","3,089,128,000","8,719,104,000"
47575,"Asset retirement and environmental obligations","US environmental provisions – Refer to notes 1F, 26 and 35 to the financial statements",565890,03/31/25,05/14/25,3,"Deloitte & Touche LLP",293,"Deloitte LLP",1147,London,X0,"UNITED KINGDOM",Foreign,20-F,2025-05-29,,"NATIONAL GRID PLC",1004315,"=""NGG""","1-3 STRAND",,LONDON,X0,"UNITED KINGDOM",Foreign,,,"=""4922""","Natural Gas Transmission",486210,"Pipeline Transportation of Natural Gas",34,66,03/31/25,"64,260,059,136",03/31/25,"23,722,000,000","3,750,000,000","31,891,000,000","137,778,000,000"
48112,"Allowance for credit losses","Assessment of the allowance for credit losses of loans evaluated on a collective basis",569777,05/31/25,08/05/25,4,"KPMG LLP",,,,McLean,VA,VIRGINIA,"US Mid Atlantic",10-K,2025-08-05,,"NATIONAL RURAL UTILITIES COOPERATIVE FINANCE CORP /DC/",70502,"=""NRUC""","20701 COOPERATIVE WAY",,DULLES,VA,VIRGINIA,"US Mid Atlantic",,,"=""6159""","Miscellaneous Business Credit Institutions",522110,"Commercial Banking",34,,,,05/31/25,"292,485,000","139,733,000",,"38,325,049,000"
46235,"Revenue from customer contracts","Revenue Recognition",560314,01/31/25,04/01/25,2,"Ernst & Young LLP",,,,Raleigh,NC,"NORTH CAROLINA","US Southeast",10-K,2025-04-01,,"nCino, Inc.",1902733,"=""NCNO""","6770 PARKER FARM DRIVE",,WILMINGTON,NC,"NORTH CAROLINA","US Southeast",,,"=""7372""","Prepackaged Software",511210,"Software Publishers",34,34,01/31/25,"3,866,403,072",01/31/25,"540,657,000","-37,878,000","-76,348,000","1,610,381,000"
47661,"Revenue from customer contracts","Revenue — Refer to Notes 1, 6, and 15 to the financial statements",566601,04/25/25,06/09/25,3,"Deloitte & Touche LLP",,,,Raleigh,NC,"NORTH CAROLINA","US Southeast",10-K,2025-06-09,,"NetApp, Inc.",1002047,"=""NTAP""","3060 OLSEN DRIVE",,"SAN JOSE",CA,CALIFORNIA,"US West",,,"=""3572""","Computer Storage Devices",334112,"Computer Storage Device Manufacturing",34,85,04/23/25,"17,265,569,792",04/25/25,"6,572,000,000","1,186,000,000","-1,726,000,000","10,823,000,000"
47411,Goodwill,"Interim Goodwill Impairment Assessment",565088,03/31/25,05/15/25,1,"PricewaterhouseCoopers LLP",,,,Boston,MA,MASSACHUSETTS,"US New England",10-K,2025-05-15,,"NETSCOUT SYSTEMS INC",1078075,"=""NTCT""","310 LITTLETON ROAD",,WESTFORD,MA,MASSACHUSETTS,"US New England",,,"=""7373""","Computer Integrated Systems Design",541512,"Computer Systems Design Services",34,22,04/02/25,"1,547,748,608",03/31/25,"822,679,000","-366,922,000","225,322,000","2,186,578,000"
47412,"Revenue from customer contracts","Revenue from Contracts with Customers - Identification of Distinct Performance Obligations",565088,03/31/25,05/15/25,1,"PricewaterhouseCoopers LLP",,,,Boston,MA,MASSACHUSETTS,"US New England",10-K,2025-05-15,,"NETSCOUT SYSTEMS INC",1078075,"=""NTCT""","310 LITTLETON ROAD",,WESTFORD,MA,MASSACHUSETTS,"US New England",,,"=""7373""","Computer Integrated Systems Design",541512,"Computer Systems Design Services",34,22,04/02/25,"1,547,748,608",03/31/25,"822,679,000","-366,922,000","225,322,000","2,186,578,000"
48880,"Regulatory assets and liabilities","Regulation — Impact of Rate-Regulation on the Financial Statements — Refer to Notes 2 and 4 to the financial statements",575856,09/30/25,11/20/25,3,"Deloitte & Touche LLP",,,,Morristown,NJ,"NEW JERSEY","US Mid Atlantic",10-K,2025-11-20,,"NEW JERSEY RESOURCES CORP",356309,"=""NJR""","1415 WYCKOFF RD","PO BOX 1468",WALL,NJ,"NEW JERSEY","US Mid Atlantic",,,"=""4924""","Natural Gas Distribution",221210,"Natural Gas Distribution",34,47,10/02/25,"4,726,237,184",09/30/25,"2,036,412,000","335,627,000","2,380,515,000","7,578,775,000"
48534,"Revenue from customer contracts","Revenue recognition - Educational services and test preparation courses - refer to Note 2 and Note 21 of the Financial Statements",572898,05/31/25,09/25/25,3,"Deloitte & Touche LLP",499,"Deloitte Touche Tohmatsu Certified Public Accountants LLP",1113,Beijing,F4,CHINA,Foreign,20-F,2025-09-25,,"New Oriental Education & Technology Group Inc.",1372920,"=""EDU""","NO. 6 HAI DIAN ZHONG STREET, 9TH FLOOR",,BEIJING,F4,CHINA,Foreign,,,"=""8200""","Services-Educational Services",611710,"Educational Support Services",34,46,06/02/25,"75,192,582,144",05/31/25,"4,900,262,000","371,716,000","3,550,121,000","7,805,499,000"
48118,Goodwill,"Valuation of Goodwill",569827,06/30/25,08/06/25,2,"Ernst & Young LLP",,,,"New York",NY,"NEW YORK","US Mid Atlantic",10-K,2025-08-06,,"NEWS CORP",1564708,"=""NWS""","1211 AVENUE OF THE AMERICAS",,"NEW YORK",NY,"NEW YORK","US Mid Atlantic",,,"=""2711""","Newspapers:  Publishing, or Publishing and Printing",518111,"Internet Service Providers",34,34,07/02/25,"6,490,931,200",06/30/25,"8,452,000,000","1,180,000,000","2,471,000,000","15,504,000,000"
47505,"Revenue from customer contracts","Contract Estimates, Revenue Recognition– Refer to Note 2 to the financial statements",565558,03/31/25,05/21/25,3,"Deloitte & Touche LLP",,,,"San Jose",CA,CALIFORNIA,"US West",10-K,2025-05-22,,"Nextpower Inc.",1852131,"=""NXT""","6200 PASEO PADRE PARKWAY",,FREMONT,CA,CALIFORNIA,"US West",,,"=""3812""","Search, Detection, Navigation, Guidance, Aeronautical, and Nautical Systems and  Instruments",334511,"Search, Detection, Navigation, Guidance, Aeronautical, and Nautical System and Instrument Manufacturing",34,44,04/02/25,"6,257,142,272",03/31/25,"2,959,197,000","517,246,000","1,203,871,000","3,192,516,000"
47969,"Uncertain tax positions","Accounting for Income Taxes",568600,05/31/25,07/17/25,1,"PricewaterhouseCoopers LLP",,,,Portland,OR,OREGON,"US West",10-K,2025-07-17,,"NIKE, Inc.",320187,"=""NKE""","ONE BOWERMAN DR",,BEAVERTON,OR,OREGON,"US West",,,"=""3021""","Rubber and Plastics Footwear",316211,"Rubber and Plastics Footwear Manufacturing",34,62,06/02/25,"72,535,785,472",05/31/25,"46,309,000,000","3,219,000,000","12,714,000,000","36,579,000,000"
48422,"Other debt","Warrants issued in the current year and classified as equity— Refer to Notes 3 and 10 to the financial statements",571982,06/30/25,09/11/25,3,"Deloitte & Touche LLP",,,,Denver,CO,COLORADO,"US West",10-K,2025-09-11,Yes,"NIOCORP DEVELOPMENTS LTD",1512228,"=""NB""","7000 S. YOSEMITE STREET","STE. 115",CENTENNIAL,CO,COLORADO,"US West",,,"=""1000""","Metal mining",212299,"All Other Metal Ore Mining",34,2,06/30/25,"136,284,480",06/30/25,,"-17,405,000",,"43,819,000"
47771,"Other investments","Fair value of certain level 3 financial instruments",567271,03/31/25,06/23/25,2,"Ernst & Young LLP",48,"Ernst & Young ShinNihon LLC",789,Tokyo,M0,JAPAN,Foreign,20-F,2025-06-23,,"NOMURA HOLDINGS INC",1163653,"=""NMR""","1-13-1 NIHONBASHI",CHUO-KU,TOKYO,M0,JAPAN,Foreign,,,"=""6211""","Security Brokers, Dealers, and Flotation Companies",523120,"Securities Brokerage",34,6,04/02/25,"18,329,559,040",03/31/25,"12,601,000,000","2,279,000,000",,"379,846,000,000"
45345,Inventory,"Merchandise Inventories—Refer to Note 1 to the financial statements",558355,02/01/25,03/21/25,3,"Deloitte & Touche LLP",,,,Seattle,WA,WASHINGTON,"US West",10-K,2025-03-21,,"NORDSTROM INC",72333,,"1617 SIXTH AVENUE",,SEATTLE,WA,WASHINGTON,"US West",,,"=""5651""","Family Clothing Stores",448140,"Family Clothing Stores",34,24,02/03/25,"3,984,151,552",02/01/25,"15,016,000,000","294,000,000","891,000,000","8,966,000,000"
47341,Goodwill,"Goodwill Impairment Assessment - North America Reporting Unit",564794,03/31/25,05/12/25,1,"PricewaterhouseCoopers LLP",,,,Atlanta,GA,GEORGIA,"US Southeast",10-K,2025-05-12,,"Novelis Inc.",1304280,"=""NVL""","3550 PEACHTREE ROAD","SUITE 1100",ATLANTA,GA,GEORGIA,"US Southeast",,,"=""3350""","Rolling Drawing & Extruding of Nonferrous Metals",331319,"Other Aluminum Rolling and Drawing",34,,,,03/31/25,"17,149,000,000","683,000,000","2,922,000,000","16,515,000,000"
48531,"Revenue from customer contracts","Revenue Recognition — Refer to Notes 1 and 2 to the financial statements",572828,07/31/25,09/23/25,3,"Deloitte & Touche LLP",,,,"San Jose",CA,CALIFORNIA,"US West",10-K,2025-09-24,,"Nutanix, Inc.",1618732,"=""NTNX""","1740 TECHNOLOGY DRIVE","SUITE 150","SAN JOSE",CA,CALIFORNIA,"US West",,,"=""7372""","Prepackaged Software",511210,"Software Publishers",34,76,07/29/25,"20,253,251,584",07/31/25,"2,537,927,000","188,366,000","-882,370,000","3,283,194,000"
43165,Inventory,"Valuation of Inventories - Provisions for Excess or Obsolete Inventories and Excess Product Purchase Commitments",553448,01/26/25,02/26/25,1,"PricewaterhouseCoopers LLP",,,,"San Jose",CA,CALIFORNIA,"US West",10-K,2025-02-26,,"NVIDIA CORP",1045810,"=""NVDA""","2788 SAN TOMAS EXPRESSWAY",,"SANTA CLARA",CA,CALIFORNIA,"US West",,,"=""3674""","Semiconductors and Related Devices",334413,"Semiconductor and Related Device Manufacturing",34,120,01/31/25,"2,938,953,269,248",01/26/25,"130,497,000,000","72,880,000,000","73,332,000,000","111,601,000,000"
48851,"Other investments","Valuation of investments using significant unobservable inputs",575747,09/30/25,11/17/25,2,"Ernst & Young LLP",,,,"Los Angeles",CA,CALIFORNIA,"US West",10-K,2025-11-18,,"Oaktree Specialty Lending Corp",1414932,"=""OCSL""","333 SOUTH GRAND AVENUE","28TH FLOOR","LOS ANGLES",CA,CALIFORNIA,"US West",,,,,523920,"Portfolio Management",34,13,09/30/25,"1,149,516,032",09/30/25,"200,956,000","33,920,000",,"3,002,991,000"
44277,"Revenue from customer contracts","Revenue recognition – Identifying and evaluating terms and conditions in contracts",555612,01/31/25,03/05/25,2,"Ernst & Young LLP",,,,"San Jose",CA,CALIFORNIA,"US West",10-K,2025-03-05,,"Okta, Inc.",1660134,"=""OKTA""","100 FIRST STREET","SUITE 600","SAN FRANCISCO",CA,CALIFORNIA,"US West",,,"=""7372""","Prepackaged Software",518210,"Data Processing, Hosting, and Related Services",34,94,01/29/25,"15,378,840,576",01/31/25,"2,610,000,000","28,000,000","819,000,000","9,437,000,000"
45597,Inventory,"Estimation of store shrink",558985,02/01/25,03/26/25,4,"KPMG LLP",,,,Harrisburg,PA,PENNSYLVANIA,"US Mid Atlantic",10-K,2025-03-26,,"Ollie's Bargain Outlet Holdings, Inc.",1639300,"=""OLLI""","6295 ALLENTOWN BOULEVARD, SUITE 1",,HARRISBURG,PA,PENNSYLVANIA,"US Mid Atlantic",,,"=""5331""","Variety Stores",452990,"All Other General Merchandise Stores",34,108,02/03/25,"6,595,230,720",02/01/25,"2,271,705,000","199,762,000","1,019,901,000","2,561,145,000"
46244,"Revenue from customer contracts","Sufficiency of audit evidence over subscription revenue",560296,01/31/25,04/01/25,4,"KPMG LLP",,,,"Santa Clara",CA,CALIFORNIA,"US West",10-K,2025-04-01,,"OOMA INC",1327688,"=""OOMA""","525 ALMANOR AVENUE","SUITE 200",SUNNYVALE,CA,CALIFORNIA,"US West",,,"=""7374""","Computer Processing and Data Preparation and Processing Services",517310,"Telecommunications Resellers",34,15,01/29/25,"399,060,000",01/31/25,"256,852,000","-6,901,000","40,025,000","149,195,000"
48130,"Revenue from customer contracts","Evaluation of the determination of standalone selling prices of revenue performance obligations for customer contracts with a software license",569869,06/30/25,08/06/25,4,"KPMG LLP",187,"KPMG LLP Chartered Accountants",85,Toronto,A6,ONTARIO,Canada,10-K,2025-08-07,,"OPEN TEXT CORP",1002638,"=""OTEX""","275 FRANK TOMPA DRIVE",*,WATERLOO,A6,ONTARIO,Canada,,,"=""7373""","Computer Integrated Systems Design",511210,"Software Publishers",34,29,06/30/25,"7,439,704,064",06/30/25,"5,168,405,000","435,868,000","-5,565,187,000","13,774,064,000"
48131,"Uncertain tax positions","Assessment of uncertain tax positions",569869,06/30/25,08/06/25,4,"KPMG LLP",187,"KPMG LLP Chartered Accountants",85,Toronto,A6,ONTARIO,Canada,10-K,2025-08-07,,"OPEN TEXT CORP",1002638,"=""OTEX""","275 FRANK TOMPA DRIVE",*,WATERLOO,A6,ONTARIO,Canada,,,"=""7373""","Computer Integrated Systems Design",511210,"Software Publishers",34,29,06/30/25,"7,439,704,064",06/30/25,"5,168,405,000","435,868,000","-5,565,187,000","13,774,064,000"
47753,"Uncertain tax positions","Uncertain Tax Positions",567112,05/31/25,06/18/25,2,"Ernst & Young LLP",,,,"San Jose",CA,CALIFORNIA,"US West",10-K,2025-06-18,,"ORACLE CORP",1341439,"=""ORCL""","2300 ORACLE WAY",,AUSTIN,TX,TEXAS,"US Southwest",,,"=""7372""","Prepackaged Software",511210,"Software Publishers",34,167,06/02/25,"467,101,253,632",05/31/25,"57,399,000,000","12,443,000,000","-46,343,000,000","168,361,000,000"
47784,"Other investments","Assessment of the fair value measurement of the investment funds categorized as Level 3 financial instruments in the fair value hierarchy",567335,03/31/25,06/24/25,4,"KPMG LLP",333,"KPMG AZSA LLC",1009,Tokyo,M0,JAPAN,Foreign,20-F,2025-06-24,,"ORIX CORP",1070304,"=""IX""","WORLD TRADE CENTER BLDG., SOUTH TOWER","2-4-1 HAMAMATSU-CHO, MINATO-KU",TOKYO,M0,JAPAN,Foreign,,,"=""6159""","Miscellaneous Business Credit Institutions",523110,"Investment Banking and Securities Dealing",34,21,03/31/25,"23,737,088,000",03/31/25,"19,224,000,000","2,351,000,000",,"112,788,000,000"
46156,"Other intangible assets","Valuation of Johnny Was Trademark",560099,02/01/25,03/31/25,2,"Ernst & Young LLP",,,,Atlanta,GA,GEORGIA,"US Southeast",10-K,2025-03-31,,"OXFORD INDUSTRIES INC",75288,"=""OXM""","999 PEACHTREE STREET NE","SUITE 688",ATLANTA,GA,GEORGIA,"US Southeast",,,"=""2320""","Men's & Boys' Furnishgs, Work Clothg, & Allied Garments",315228,"Men's and Boys' Cut and Sew Other Outerwear Manufacturing",34,76,02/03/25,"1,185,427,968",02/01/25,"1,516,601,000","92,973,000","337,262,000","1,289,805,000"
45075,"Revenue from customer contracts","Revenue recognition – cloud-hosted software subscription fees",557814,01/31/25,03/17/25,1,"PricewaterhouseCoopers LLP",,,,"San Francisco",CA,CALIFORNIA,"US West",10-K,2025-03-17,,"PagerDuty, Inc.",1568100,"=""PD""","600 TOWNSEND STREET #200",,"SAN FRANCISCO",CA,CALIFORNIA,"US West",,,"=""7372""","Prepackaged Software",518210,"Data Processing, Hosting, and Related Services",34,19,01/29/25,"1,747,205,248",01/31/25,"467,499,000","-42,735,000","-10,221,000","927,266,000"
48343,"Revenue from customer contracts","REVENUE RECOGNITION",571098,07/31/25,08/29/25,2,"Ernst & Young LLP",,,,"San Mateo",CA,CALIFORNIA,"US West",10-K,2025-08-29,,"Palo Alto Networks Inc",1327567,"=""PANW""","3000 TANNERY WAY",,"SANTA CLARA",CA,CALIFORNIA,"US West",,,"=""3577""","Computer Peripheral Equipment, NEC",511210,"Software Publishers",34,194,07/29/25,"129,252,515,840",07/31/25,"9,221,500,000","1,133,900,000","2,495,100,000","23,576,200,000"
48344,"Business combinations","VALUATION OF CONTINGENT CONSIDERATION LIABILITY IN CONNECTION WITH THE ACQUISITION OF IBM QRADAR ASSETS",571098,07/31/25,08/29/25,2,"Ernst & Young LLP",,,,"San Mateo",CA,CALIFORNIA,"US West",10-K,2025-08-29,,"Palo Alto Networks Inc",1327567,"=""PANW""","3000 TANNERY WAY",,"SANTA CLARA",CA,CALIFORNIA,"US West",,,"=""3577""","Computer Peripheral Equipment, NEC",511210,"Software Publishers",34,194,07/29/25,"129,252,515,840",07/31/25,"9,221,500,000","1,133,900,000","2,495,100,000","23,576,200,000"
48276,"Revenue from customer contracts","Revenue — Refer to Notes 1 and 2 to the financial statements",570711,06/30/25,08/22/25,3,"Deloitte & Touche LLP",,,,Cleveland,OH,OHIO,"US Midwest",10-K,2025-08-22,,"Parker-Hannifin Corp",76334,"=""PH""","6035 PARKLAND BOULEVARD",,CLEVELAND,OH,OHIO,"US Midwest",,,"=""3490""","Miscellaneous Fabricated Metal Products",339991,"Gasket, Packing, and Sealing Device Manufacturing",34,711,07/02/25,"90,908,942,336",06/30/25,"19,850,000,000","3,531,000,000","-4,386,000,000","29,494,000,000"
47920,"Other contingent liabilities","Professional Employer Organization (PEO) Workers’ Compensation Insurance Reserves",568364,05/31/25,07/11/25,1,"PricewaterhouseCoopers LLP",,,,Fairport,NY,"NEW YORK","US Mid Atlantic",10-K,2025-07-11,,"PAYCHEX INC",723531,"=""PAYX""","911 PANORAMA TRAIL S",,ROCHESTER,NY,"NEW YORK","US Mid Atlantic",,,"=""8700""","Services-Engineering, Accounting, Research, Management",541214,"Payroll Services",34,158,06/02/25,"56,730,030,080",05/31/25,"5,571,700,000","1,657,300,000","-2,333,400,000","16,564,100,000"
47921,"Business combinations","Acquisition of Paycor HCM, Inc. – Valuation of Customer Relationships",568364,05/31/25,07/11/25,1,"PricewaterhouseCoopers LLP",,,,Fairport,NY,"NEW YORK","US Mid Atlantic",10-K,2025-07-11,,"PAYCHEX INC",723531,"=""PAYX""","911 PANORAMA TRAIL S",,ROCHESTER,NY,"NEW YORK","US Mid Atlantic",,,"=""8700""","Services-Engineering, Accounting, Research, Management",541214,"Payroll Services",34,158,06/02/25,"56,730,030,080",05/31/25,"5,571,700,000","1,657,300,000","-2,333,400,000","16,564,100,000"
48119,"Deferred and capitalized costs","Capitalized internal-use software development costs",569829,06/30/25,08/06/25,4,"KPMG LLP",,,,Chicago,IL,ILLINOIS,"US Midwest",10-K,2025-08-06,,"Paylocity Holding Corp",1591698,"=""PCTY""","1400 AMERICAN LANE",,SCHAUMBURG,IL,ILLINOIS,"US Midwest",,,"=""7372""","Prepackaged Software",511210,"Software Publishers",34,180,07/02/25,"9,943,629,824",06/30/25,"1,595,221,000","227,127,000","665,659,000","4,389,428,000"
48120,"Business combinations","Fair value of proprietary technology intangible asset",569829,06/30/25,08/06/25,4,"KPMG LLP",,,,Chicago,IL,ILLINOIS,"US Midwest",10-K,2025-08-06,,"Paylocity Holding Corp",1591698,"=""PCTY""","1400 AMERICAN LANE",,SCHAUMBURG,IL,ILLINOIS,"US Midwest",,,"=""7372""","Prepackaged Software",511210,"Software Publishers",34,180,07/02/25,"9,943,629,824",06/30/25,"1,595,221,000","227,127,000","665,659,000","4,389,428,000"
48124,Inventory,"Existence of Inventory",569882,06/30/25,08/07/25,2,"Ernst & Young LLP",,,,"New York",NY,"NEW YORK","US Mid Atlantic",10-K,2025-08-07,,"PELOTON INTERACTIVE, INC.",1639825,"=""PTON""","C/O PELOTON INTERACTIVE, INC.","441 NINTH AVE., SIXTH FLOOR","NEW YORK",NY,"NEW YORK","US Mid Atlantic",,,"=""3949""","Sporting and Athletic Goods, NEC",451110,"Sporting Goods Stores",34,7,06/30/25,"2,710,620,160",06/30/25,"2,490,800,000","-118,900,000","-460,700,000","2,125,300,000"
48658,"Revenue from customer contracts","Revenue Recognition — Refer to the Significant Accounting Policies and Revenue and Customer Contract Balances notes to the financial statements",574174,08/29/25,10/21/25,3,"Deloitte & Touche LLP",,,,"San Jose",CA,CALIFORNIA,"US West",10-K,2025-10-21,,"Penguin Solutions, Inc.",1616533,"=""PENG""","45800 NORTHPORT LOOP WEST",,FREMONT,CA,CALIFORNIA,"US West",,,"=""3674""","Semiconductors and Related Devices",334413,"Semiconductor and Related Device Manufacturing",34,24,08/27/25,"1,271,251,072",08/29/25,"1,368,794,000","25,391,000","363,307,000","1,617,200,000"
48182,"Vendor/supplier rebates","Vendor Rebates and Other Promotional Incentives - Refer to Note 2 to the financial statements",570293,06/28/25,08/13/25,3,"Deloitte & Touche LLP",,,,Richmond,VA,VIRGINIA,"US Mid Atlantic",10-K,2025-08-13,,"Performance Food Group Co",1618673,"=""PFGC""","12500 WEST CREEK PARKWAY",,RICHMOND,VA,VIRGINIA,"US Mid Atlantic",,,"=""5141""","Groceries, General Line",722310,"Food Service Contractors",34,87,06/30/25,"13,549,103,104",06/28/25,"63,298,900,000","340,200,000","-696,200,000","17,881,200,000"
47248,"Revenue from customer contracts","Specialty Piping Systems and Coating Revenue Recognition under the Input Method",563618,01/31/25,05/01/25,1,"PricewaterhouseCoopers LLP",,,,Houston,TX,TEXAS,"US Southwest",10-K,2025-05-01,,"Perma-Pipe International Holdings, Inc.",914122,"=""PPIH""","25025 I-45","SUITE 200","THE WOODLANDS",TX,TEXAS,"US Southwest",,,"=""3564""","Industrial and Commercial Fans and Blowers and Air  Purification Equipment",332996,"Fabricated Pipe and Pipe Fitting Manufacturing",34,15,01/29/25,"122,292,944",01/31/25,"158,384,000","8,983,000","81,048,000","165,241,000"
46082,"Vendor/supplier rebates","Vendor allowances",559878,02/01/25,03/31/25,2,"Ernst & Young LLP",,,,"San Diego",CA,CALIFORNIA,"US West",10-K,2025-03-31,,"Petco Health & Wellness Company, Inc.",1826470,"=""WOOF""","10850 VIA FRONTERA",,"SAN DIEGO",CA,CALIFORNIA,"US West",,,"=""5990""","Retail-Retail Stores, NEC",453910,"Pet and Pet Supplies Stores",34,3,02/03/25,"782,580,672",02/01/25,"6,116,462,000","-101,816,000","-891,434,000","5,194,430,000"
48307,"Business combinations","Acquisition of Zoetis’ Medicated Feed Additives Portfolio and Certain Water-Soluble Products – Valuation of Personal and Real Property",570958,06/30/25,08/27/25,1,"PricewaterhouseCoopers LLP",,,,"Florham Park",NJ,"NEW JERSEY","US Mid Atlantic",10-K,2025-08-27,,"PHIBRO ANIMAL HEALTH CORP",1069899,"=""PAHC""","GLENPOINTE CENTRE EAST, 3RD FLOOR","300 FRANK W. BURR BLVD., SUITE 21",TEANECK,NJ,"NEW JERSEY","US Mid Atlantic",,,"=""2834""","Pharmaceutical Preparations",311119,"Other Animal Food Manufacturing",34,28,07/02/25,"569,070,016",06/30/25,"1,296,215,000","48,264,000","189,568,000","1,360,900,000"
44869,"Financial statements and disclosures","Evaluation of the sufficiency of audit evidence over revenue",557271,01/31/25,03/13/25,4,"KPMG LLP",,,,Pittsburgh,PA,PENNSYLVANIA,"US Mid Atlantic",10-K,2025-03-13,,"Phreesia, Inc.",1412408,"=""PHR""","1521 CONCORD PIKE","SUITE 301 PMB 221",WILMINGTON,DE,DELAWARE,"US Mid Atlantic",,,"=""7389""","Business Services, NEC",511210,"Software Publishers",34,28,01/31/25,"1,671,406,720",01/31/25,"419,813,000","-58,527,000","160,820,000","388,415,000"
45657,"Internal controls","Evaluation of the sufficiency of audit evidence over revenue recognition",558874,01/31/25,03/26/25,4,"KPMG LLP",,,,"San Francisco",CA,CALIFORNIA,"US West",10-K,2025-03-26,,"Planet Labs PBC",1836833,"=""PL""","645 HARRISON STREET","FLOOR 4","SAN FRANCISCO",CA,CALIFORNIA,"US West",,,"=""3663""","Radio and Television Broadcasting and Communications Equipment",517910,"Other Telecommunications",34,6,01/29/25,"1,529,309,440",01/31/25,"244,352,000","-123,196,000","261,394,000","633,796,000"
48955,"Proven and unproven reserves","Assessment of impairment indicators for mineral properties",576118,08/31/25,11/26/25,1,"PricewaterhouseCoopers LLP",191,"PricewaterhouseCoopers LLP Chartered Accountants",271,Vancouver,A1,"BRITISH COLUMBIA",Canada,40-F,2025-11-26,,"PLATINUM GROUP METALS LTD",1095052,"=""PLG""","SUITE 838-1100 MELVILLE STREET",,VANCOUVER,A1,"BRITISH COLUMBIA",Canada,,,"=""1040""","Metal Mining",213114,"Support Activities for Metal Mining",34,2,08/31/25,"180,113,776",08/31/25,,"-4,537,000",,"62,099,000"
48813,"Revenue from customer contracts","Revenue Recognition",575632,09/27/25,11/14/25,1,"PricewaterhouseCoopers LLP",,,,Milwaukee,WI,WISCONSIN,"US Midwest",10-K,2025-11-14,,"PLEXUS CORP",785786,"=""PLXS""","PLEXUS CORP","ONE PLEXUS WAY",NEENAH,WI,WISCONSIN,"US Midwest",,,"=""3672""","Printed Circuit Boards",334412,"Bare Printed Circuit Board Manufacturing",34,143,09/29/25,"3,866,388,224",09/27/25,"4,032,966,000","172,885,000",,"3,137,110,000"
48471,"Going concern","Liquidity and capital resources",572333,06/30/25,09/17/25,1,"PricewaterhouseCoopers LLP",223,"Kesselman & Kesselman",1309,Haifa,L3,ISRAEL,Foreign,10-K,2025-09-17,Yes,"Pluri Inc.",1158780,"=""PLUR""","MATAM ADVANCED TECHNOLOGY PARK","BUILDING NO. 5",HAIFA,L3,ISRAEL,Foreign,,,"=""2836""","Biological Products, Except Diagnostic Substances",325414,"Biological Product (except Diagnostic) Manufacturing",34,5,06/30/25,"39,074,148",06/30/25,"1,336,000","-22,377,000","-12,771,000","38,683,000"
48472,"Business combinations","Valuation of intangible assets - Kokomodo Transaction",572333,06/30/25,09/17/25,1,"PricewaterhouseCoopers LLP",223,"Kesselman & Kesselman",1309,Haifa,L3,ISRAEL,Foreign,10-K,2025-09-17,Yes,"Pluri Inc.",1158780,"=""PLUR""","MATAM ADVANCED TECHNOLOGY PARK","BUILDING NO. 5",HAIFA,L3,ISRAEL,Foreign,,,"=""2836""","Biological Products, Except Diagnostic Substances",325414,"Biological Product (except Diagnostic) Manufacturing",34,5,06/30/25,"39,074,148",06/30/25,"1,336,000","-22,377,000","-12,771,000","38,683,000"
48905,Goodwill,"Goodwill Impairment Assessment – Weetabix Reporting Unit",575912,09/30/25,11/21/25,1,"PricewaterhouseCoopers LLP",,,,"Saint Louis",MO,MISSOURI,"US Southeast",10-K,2025-11-21,,"Post Holdings, Inc.",1530950,"=""POST""","2503 S. HANLEY ROAD",,"ST. LOUIS",MO,MISSOURI,"US Southeast",,,"=""2040""","Grain Mill Products",311230,"Breakfast Cereal Manufacturing",34,107,10/02/25,"5,804,648,448",09/30/25,"8,158,100,000","335,700,000","-4,106,200,000","13,528,400,000"
48860,"Revenue from customer contracts","Revenue Recognition - Long-term fixed price contracts",575812,09/30/25,11/19/25,1,"PricewaterhouseCoopers LLP",,,,Houston,TX,TEXAS,"US Southwest",10-K,2025-11-19,,"POWELL INDUSTRIES INC",80420,"=""POWL""","8550 MOSLEY DR","POST OFFICE BOX 12818",HOUSTON,TX,TEXAS,"US Southwest",,,"=""3613""","Switchgear and Switchboard Apparatus",335314,"Relay and Industrial Control Manufacturing",34,308,10/02/25,"3,711,319,808",09/30/25,"1,104,318,000","180,747,000","628,507,000","1,108,984,000"
47829,"Business combinations","Determination of Accounting Acquirer and Assessment of the Accounting Treatment - Refer to Note 3 to the financial statements",567476,03/31/25,06/26/25,3,"Deloitte & Touche LLP",24,"Deloitte & Touche",1130,Johannesburg,T3,"SOUTH AFRICA",Foreign,10-K,2025-06-26,,"Powerfleet, Inc.",1774170,"=""AIOT""","123 TICE BLVD.",,"WOODCLIFF LAKE",NJ,"NEW JERSEY","US Mid Atlantic",,,"=""3669""","Communications Equipment, NEC",334290,"Other Communications Equipment Manufacturing",34,6,04/02/25,"747,352,704",03/31/25,"362,515,000","-50,987,000","-195,136,000","910,071,000"
47830,"Business combinations","MiX Combination - Refer to Note 2Y and 3 to the financial statements",567476,03/31/25,06/26/25,3,"Deloitte & Touche LLP",24,"Deloitte & Touche",1130,Johannesburg,T3,"SOUTH AFRICA",Foreign,10-K,2025-06-26,,"Powerfleet, Inc.",1774170,"=""AIOT""","123 TICE BLVD.",,"WOODCLIFF LAKE",NJ,"NEW JERSEY","US Mid Atlantic",,,"=""3669""","Communications Equipment, NEC",334290,"Other Communications Equipment Manufacturing",34,6,04/02/25,"747,352,704",03/31/25,"362,515,000","-50,987,000","-195,136,000","910,071,000"
47831,"Business combinations","Fleet Complete Acquisition - Refer to Note 2Y and 3 to the financial statements",567476,03/31/25,06/26/25,3,"Deloitte & Touche LLP",24,"Deloitte & Touche",1130,Johannesburg,T3,"SOUTH AFRICA",Foreign,10-K,2025-06-26,,"Powerfleet, Inc.",1774170,"=""AIOT""","123 TICE BLVD.",,"WOODCLIFF LAKE",NJ,"NEW JERSEY","US Mid Atlantic",,,"=""3669""","Communications Equipment, NEC",334290,"Other Communications Equipment Manufacturing",34,6,04/02/25,"747,352,704",03/31/25,"362,515,000","-50,987,000","-195,136,000","910,071,000"
48229,Goodwill,"Valuation of Goodwill",570553,06/30/25,08/19/25,2,"Ernst & Young LLP",,,,Raleigh,NC,"NORTH CAROLINA","US Southeast",10-K,2025-08-19,,"Premier, Inc.",1577916,"=""PINC""","13034 BALLANTYNE CORPORATE PLACE",,CHARLOTTE,NC,"NORTH CAROLINA","US Southeast",,,"=""8741""","Management Services",541611,"Administrative Management and General Management Consulting Services",34,22,06/30/25,"1,810,198,400",06/30/25,"1,012,647,000","20,269,000","381,913,000","3,097,074,000"
47338,"Other intangible assets","Indefinite-Lived Tradename Impairment Assessments – Summer’s Eve and Monistat",564623,03/31/25,05/09/25,1,"PricewaterhouseCoopers LLP",,,,Stamford,CT,CONNECTICUT,"US New England",10-K,2025-05-09,,"Prestige Consumer Healthcare Inc.",1295947,"=""PBH""","660 WHITE PLAINS RD.",,TARRYTOWN,NY,"NEW YORK","US Mid Atlantic",,,"=""2834""","Pharmaceutical Preparations",424210,"Drugs and Druggists' Sundries Merchant Wholesalers",34,86,04/02/25,"4,261,740,288",03/31/25,"1,137,762,000","214,605,000","-987,878,000","3,402,218,000"
47339,Goodwill,"Goodwill Impairment Assessment – North American Women’s Health Reporting Unit",564623,03/31/25,05/09/25,1,"PricewaterhouseCoopers LLP",,,,Stamford,CT,CONNECTICUT,"US New England",10-K,2025-05-09,,"Prestige Consumer Healthcare Inc.",1295947,"=""PBH""","660 WHITE PLAINS RD.",,TARRYTOWN,NY,"NEW YORK","US Mid Atlantic",,,"=""2834""","Pharmaceutical Preparations",424210,"Drugs and Druggists' Sundries Merchant Wholesalers",34,86,04/02/25,"4,261,740,288",03/31/25,"1,137,762,000","214,605,000","-987,878,000","3,402,218,000"
48700,"Uncertain tax positions","Uncertain Tax Positions and Income Tax and VAT Receivables",574696,08/31/25,10/30/25,2,"Ernst & Young LLP",,,,"San Diego",CA,CALIFORNIA,"US West",10-K,2025-10-30,,"PRICESMART INC",1041803,"=""PSMT""","9797 AERO DRIVE",,"SAN DIEGO",CA,CALIFORNIA,"US West",,,"=""5331""","Variety Stores",452910,"Warehouse Clubs and Supercenters",34,107,08/31/25,"3,297,798,144",08/31/25,"5,270,094,000","147,887,000","1,204,134,000","2,269,157,000"
48103,"Other intangible assets","Intangible Assets — Gillette Indefinite-Lived Intangible Asset — Refer to Notes 1 and 4 to the financial statements",569690,06/30/25,08/04/25,3,"Deloitte & Touche LLP",,,,Cincinnati,OH,OHIO,"US Midwest",10-K,2025-08-04,,"PROCTER & GAMBLE Co",80424,"=""PG""","ONE PROCTER & GAMBLE PLAZA",,CINCINNATI,OH,OHIO,"US Midwest",,,"=""2840""","Soap, Detergents, Cleang Preparations, Perfumes, Cosmetics",325612,"Polish and Other Sanitation Good Manufacturing",34,161,07/02/25,"377,940,180,992",06/30/25,"84,284,000,000","15,974,000,000","-11,550,000,000","125,229,000,000"
48293,"Other investments","Fair Valuation of Level 3 Investments - Refer to Notes 2 and 3 to the financial statements",570880,06/30/25,08/26/25,3,"Deloitte & Touche LLP",,,,"New York",NY,"NEW YORK","US Mid Atlantic",10-K,2025-08-26,,"PROSPECT CAPITAL CORP",1287032,"=""PSEC""","10 EAST 40TH STREET 44TH FL",,"NEW YORK",NY,"NEW YORK","US Mid Atlantic",,,,,525990,"Other Financial Vehicles",34,3,06/30/25,"1,449,771,008",06/30/25,"571,161,000","-469,924,000",,"6,804,938,000"
48364,"Other investments","Fair Valuation of Level 3 Investments - Refer to Notes 2 and 8 to the financial statements",571353,06/30/25,09/03/25,3,"Deloitte & Touche LLP",,,,"New York",NY,"NEW YORK","US Mid Atlantic",10-K,2025-09-03,,"Prospect Floating Rate & Alternative Income Fund, Inc.",1521945,,"10 EAST 40TH STREET, 42ND FLOOR",,"NEW YORK",NY,"NEW YORK","US Mid Atlantic",,,,,525910,"Open-End Investment Funds",34,,,,06/30/25,"9,397,546","3,634,434","39,988,137","102,925,390"
48378,"Other investments","Fair Valuation of Level 3 Investments - Refer to Notes 2 and 8 to the financial statements",571662,06/30/25,09/03/25,3,"Deloitte & Touche LLP",,,,"New York",NY,"NEW YORK","US Mid Atlantic",424B3,2025-09-05,,"Prospect Floating Rate & Alternative Income Fund, Inc.",1521945,,"10 EAST 40TH STREET, 42ND FLOOR",,"NEW YORK",NY,"NEW YORK","US Mid Atlantic",,,,,525910,"Open-End Investment Funds",34,,,,06/30/25,"9,397,546","3,634,434","39,988,137","102,925,390"
48336,"Allowance for credit losses","Allowance for Credit Losses related to Qualitative Factors for Single Family Mortgage, Multifamily Mortgage, and Commercial Real Estate - Refer to Notes 1 and 3 to the Financial Statements",571093,06/30/25,08/29/25,3,"Deloitte & Touche LLP",,,,"Costa Mesa",CA,CALIFORNIA,"US West",10-K,2025-08-29,,"PROVIDENT FINANCIAL HOLDINGS INC",1010470,"=""PROV""","3756 CENTRAL AVE",,RIVERSIDE,CA,CALIFORNIA,"US West",,,"=""6035""","Savings Institutions, Federally Chartered",522120,"Savings Institutions",34,16,07/02/25,"103,621,000",06/30/25,"39,666,000","6,255,000",,"1,245,613,000"
48886,"Revenue from customer contracts","Revenue Recognition - Identification of Distinct Performance Obligations",575932,09/30/25,11/21/25,1,"PricewaterhouseCoopers LLP",,,,Boston,MA,MASSACHUSETTS,"US New England",10-K,2025-11-21,,"PTC INC.",857005,"=""PTC""","121 SEAPORT BOULEVARD",,BOSTON,MA,MASSACHUSETTS,"US New England",,,"=""7372""","Prepackaged Software",541511,"Custom Computer Programming Services",34,203,10/02/25,"24,320,315,392",09/30/25,"2,739,226,000","741,032,000","-491,750,000","6,617,172,000"
45696,"Revenue from customer contracts","Revenue Recognition—Determination of Standalone Selling Prices — Refer to Note 2 of the Financial Statements",559134,02/02/25,03/26/25,3,"Deloitte & Touche LLP",,,,"San Jose",CA,CALIFORNIA,"US West",10-K,2025-03-27,,"Pure Storage, Inc.",1474432,"=""PSTG""","2555 AUGUSTINE DRIVE",,"SANTA CLARA",CA,CALIFORNIA,"US West",,,"=""3572""","Computer Storage Devices",334112,"Computer Storage Device Manufacturing",34,68,02/04/25,"22,298,296,320",02/02/25,"3,168,164,000","106,739,000","925,974,000","3,963,942,000"
47275,"Revenue from customer contracts","Revenue Recognition-Determination of Standalone Selling Prices Refer to Note 2 of the Financial Statements",564203,02/02/25,03/26/25,3,"Deloitte & Touche LLP",,,,"San Jose",CA,CALIFORNIA,"US West",ARS,2025-05-02,,"Pure Storage, Inc.",1474432,"=""PSTG""","2555 AUGUSTINE DRIVE",,"SANTA CLARA",CA,CALIFORNIA,"US West",,,"=""3572""","Computer Storage Devices",334112,"Computer Storage Device Manufacturing",34,68,02/04/25,"22,298,296,320",02/02/25,"3,168,164,000","106,739,000","925,974,000","3,963,942,000"
46289,"Goodwill and intangible assets","Valuation of Goodwill and Indefinite-Lived Intangibles",560271,02/02/25,04/01/25,2,"Ernst & Young LLP",,,,"New York",NY,"NEW YORK","US Mid Atlantic",10-K,2025-04-01,,"PVH CORP. /DE/",78239,"=""PVH""","285 MADISON AVENUE",,"NEW YORK",NY,"NEW YORK","US Mid Atlantic",,,"=""2320""","Men's & Boys' Furnishgs, Work Clothg, & Allied Garments",315223,"Men's and Boys' Cut and Sew Shirt (except Work Shirt) Manufacturing",34,83,02/04/25,"4,590,295,040",02/02/25,"8,652,900,000","598,500,000","-140,500,000","11,033,200,000"
47671,"Uncertain tax positions","Income Taxes — Accounting for Uncertainty in Income Taxes — Refer to Note 1 and Note 5 to the financial statements",566767,03/31/25,06/10/25,3,"Deloitte & Touche LLP",,,,Raleigh,NC,"NORTH CAROLINA","US Southeast",10-K,2025-06-10,,"PYXUS INTERNATIONAL, INC.",939930,"=""PYYX""","6001 HOSPITALITY COURT","SUITE 100",MORRISVILLE,NC,"NORTH CAROLINA","US Southeast",,,"=""5150""","Wholesale-Farm Product Raw Materials",312210,"Tobacco Stemming and Redrying",34,4,04/02/25,"94,739,992",03/31/25,"2,481,260,000","15,166,000","131,582,000","1,503,843,000"
47447,Inventory,"Inventory - Valuation",565302,03/29/25,05/19/25,2,"Ernst & Young LLP",,,,Charlotte,NC,"NORTH CAROLINA","US Southeast",10-K,2025-05-19,,"Qorvo, Inc.",1604778,"=""QRVO""","7628 THORNDIKE ROAD",,GREENSBORO,NC,"NORTH CAROLINA","US Southeast",,,"=""3674""","Semiconductors and Related Devices",334413,"Semiconductor and Related Device Manufacturing",34,72,03/31/25,"6,762,864,640",03/29/25,"3,718,971,000","55,615,000","729,093,000","5,933,131,000"
48722,"Revenue from customer contracts","Revenue Recognition – Qualcomm CDMA Technologies (QCT) Segment",574983,09/28/25,11/05/25,1,"PricewaterhouseCoopers LLP",,,,"San Diego",CA,CALIFORNIA,"US West",10-K,2025-11-05,,"QUALCOMM INC/DE",804328,"=""QCOM""","5775 MOREHOUSE DR",,"SAN DIEGO",CA,CALIFORNIA,"US West",,,"=""3663""","Radio and Television Broadcasting and Communications Equipment",334290,"Other Communications Equipment Manufacturing",34,166,09/30/25,"178,670,632,960",09/28/25,"44,284,000,000","5,541,000,000","8,700,000,000","50,143,000,000"
48242,"Revenue from customer contracts","Revenue Recognition",570636,06/30/25,08/21/25,1,"PricewaterhouseCoopers LLP",,,,"San Francisco",CA,CALIFORNIA,"US West",10-K,2025-08-21,,"QUINSTREET, INC",1117297,"=""QNST""","950 TOWER LANE, 12TH FLOOR",,"FOSTER CITY",CA,CALIFORNIA,"US West",,,"=""7389""","Business Services, NEC",541613,"Marketing Consulting Services",34,16,07/02/25,"930,594,432",06/30/25,"1,093,711,000","4,707,000","90,513,000","431,107,000"
47508,"Sales return and allowances","End-of-season Markdown Reserves",565555,03/29/25,05/22/25,2,"Ernst & Young LLP",,,,"New York",NY,"NEW YORK","US Mid Atlantic",10-K,2025-05-22,,"RALPH LAUREN CORP",1037038,"=""RL""","650 MADISON AVENUE",,"NEW YORK",NY,"NEW YORK","US Mid Atlantic",,,"=""2320""","Men's & Boys' Furnishgs, Work Clothg, & Allied Garments",315228,"Men's and Boys' Cut and Sew Other Outerwear Manufacturing",34,221,03/31/25,"8,741,304,320",03/29/25,"7,079,000,000","742,900,000","1,637,200,000","7,047,300,000"
47509,Inventory,"Estimated Realizable Value of Inventory",565555,03/29/25,05/22/25,2,"Ernst & Young LLP",,,,"New York",NY,"NEW YORK","US Mid Atlantic",10-K,2025-05-22,,"RALPH LAUREN CORP",1037038,"=""RL""","650 MADISON AVENUE",,"NEW YORK",NY,"NEW YORK","US Mid Atlantic",,,"=""2320""","Men's & Boys' Furnishgs, Work Clothg, & Allied Garments",315228,"Men's and Boys' Cut and Sew Other Outerwear Manufacturing",34,221,03/31/25,"8,741,304,320",03/29/25,"7,079,000,000","742,900,000","1,637,200,000","7,047,300,000"
48932,"Allowance for credit losses","Assessment of the allowance for credit losses related to the commercial and industrial (C&I) and the commercial real estate (CRE) portfolio segments that are collectively evaluated for impairment",576075,09/30/25,11/25/25,4,"KPMG LLP",,,,"New York",NY,"NEW YORK","US Mid Atlantic",10-K,2025-11-25,,"RAYMOND JAMES FINANCIAL INC",720005,"=""RJF""","880 CARILLON PKWY",,"ST PETERSBURG",FL,FLORIDA,"US Southeast",,,"=""6211""","Security Brokers, Dealers, and Flotation Companies",523120,"Securities Brokerage",34,166,10/02/25,"33,189,455,872",09/30/25,"14,065,000,000","2,135,000,000","10,656,000,000","88,230,000,000"
47436,Goodwill,"Valuation of Goodwill – Industrial Reporting Unit",565225,03/29/25,05/16/25,2,"Ernst & Young LLP",,,,Hartford,CT,CONNECTICUT,"US New England",10-K,2025-05-16,,"RBC Bearings INC",1324948,"=""RBC""","ONE TRIBOLOGY CENTER",,OXFORD,CT,CONNECTICUT,"US New England",,,"=""3562""","Ball and Roller Bearings",332991,"Ball and Roller Bearing Manufacturing",34,322,03/31/25,"10,127,909,888",03/29/25,"1,636,300,000","246,200,000","-165,900,000","4,685,200,000"
47493,"Research and development expenses","Accrued Research and Development Costs",565545,03/31/25,05/22/25,1,"PricewaterhouseCoopers LLP",,,,Boston,MA,MASSACHUSETTS,"US New England",10-K,2025-05-22,,"Replimune Group, Inc.",1737953,"=""REPL""","500 UNICORN PARK",,WOBURN,MA,MASSACHUSETTS,"US New England",,,"=""2836""","Biological Products, Except Diagnostic Substances",325414,"Biological Product (except Diagnostic) Manufacturing",34,10,03/31/25,"751,579,008",03/31/25,,"-247,297,000",,"551,328,000"
48152,Goodwill,"Evaluation of goodwill triggering events",570003,06/30/25,08/07/25,4,"KPMG LLP",,,,"San Diego",CA,CALIFORNIA,"US West",10-K,2025-08-08,,"RESMED INC",943819,"=""RMD""","9001 SPECTRUM CENTER BLVD.",,"SAN DIEGO",CA,CALIFORNIA,"US West",,,"=""3841""","Surgical and Medical Instruments and Apparatus",339112,"Surgical and Medical Instrument Manufacturing",34,256,07/02/25,"37,519,020,032",06/30/25,"5,146,327,000","1,400,723,000","2,456,318,000","8,174,391,000"
46270,Leases,"Determination of the Classification of New Real Estate Lease Contracts",560420,02/01/25,04/02/25,1,"PricewaterhouseCoopers LLP",,,,"San Francisco",CA,CALIFORNIA,"US West",10-K,2025-04-02,,RH,1528849,"=""RH""","15 KOCH ROAD","SUITE K","CORTE MADERA",CA,CALIFORNIA,"US West",,,"=""5712""","Furniture Stores",442299,"All Other Home Furnishings Stores",34,395,02/03/25,"7,350,729,216",02/01/25,"3,180,753,000","72,412,000","-380,650,000","4,554,689,000"
48783,"Related party transactions","Identification and disclosure of related parties and related party transactions - Refer to Notes 1, 2 and 10 to the financial statements",575391,09/30/25,11/12/25,3,"Deloitte & Touche LLP",,,,Boston,MA,MASSACHUSETTS,"US New England",10-K,2025-11-12,,"RMR GROUP INC.",1644378,"=""RMR""","TWO NEWTON PL., 255 WASH. ST., STE. 300",,NEWTON,MA,MASSACHUSETTS,"US New England",,,"=""8742""","Management Consulting Services",541611,"Administrative Management and General Management Consulting Services",34,16,09/30/25,"252,678,784",09/30/25,"700,284,000","17,596,000","129,759,000","718,245,000"
48784,Goodwill,"Goodwill — Refer to Notes 2 and 4 to the financial statements",575391,09/30/25,11/12/25,3,"Deloitte & Touche LLP",,,,Boston,MA,MASSACHUSETTS,"US New England",10-K,2025-11-12,,"RMR GROUP INC.",1644378,"=""RMR""","TWO NEWTON PL., 255 WASH. ST., STE. 300",,NEWTON,MA,MASSACHUSETTS,"US New England",,,"=""8742""","Management Consulting Services",541611,"Administrative Management and General Management Consulting Services",34,16,09/30/25,"252,678,784",09/30/25,"700,284,000","17,596,000","129,759,000","718,245,000"
48777,"Goodwill and intangible assets","Goodwill and Intangible Assets Valuation — Sensia Reporting Unit — Refer to Note 3 to the financial statements",575388,09/30/25,11/12/25,3,"Deloitte & Touche LLP",,,,Milwaukee,WI,WISCONSIN,"US Midwest",10-K,2025-11-12,,"ROCKWELL AUTOMATION, INC",1024478,"=""ROK""","1201 SOUTH 2ND STREET",,MILWAUKEE,WI,WISCONSIN,"US Midwest",,,"=""3829""","Measuring and Controlling Devices, NEC",333612,"Speed Changer, Industrial High-Speed Drive, and Gear Manufacturing",34,350,09/30/25,"39,299,194,880",09/30/25,"8,342,000,000","869,000,000","-1,049,000,000","11,219,000,000"
48778,"Other contingent liabilities","Commitments and Contingent Liabilities — Asbestos — Refer to Note 17 to the financial statements",575388,09/30/25,11/12/25,3,"Deloitte & Touche LLP",,,,Milwaukee,WI,WISCONSIN,"US Midwest",10-K,2025-11-12,,"ROCKWELL AUTOMATION, INC",1024478,"=""ROK""","1201 SOUTH 2ND STREET",,MILWAUKEE,WI,WISCONSIN,"US Midwest",,,"=""3829""","Measuring and Controlling Devices, NEC",333612,"Speed Changer, Industrial High-Speed Drive, and Gear Manufacturing",34,350,09/30/25,"39,299,194,880",09/30/25,"8,342,000,000","869,000,000","-1,049,000,000","11,219,000,000"
47565,"Research and development expenses","Clinical Trial Accrual",565916,03/31/25,05/29/25,2,"Ernst & Young LLP",,,,Iselin,NJ,"NEW JERSEY","US Mid Atlantic",10-K,2025-05-29,,"Roivant Sciences Ltd.",1635088,"=""ROIV""","7TH FLOOR, 50 BROADWAY",,LONDON,X0,"UNITED KINGDOM",Foreign,,,"=""2834""","Pharmaceutical Preparations",325412,"Pharmaceutical Preparation Manufacturing",34,10,03/31/25,"7,022,017,536",03/31/25,"29,053,000","-171,981,000",,"5,436,940,000"
47566,"Other investments","Valuation of Investment in Datavant",565916,03/31/25,05/29/25,2,"Ernst & Young LLP",,,,Iselin,NJ,"NEW JERSEY","US Mid Atlantic",10-K,2025-05-29,,"Roivant Sciences Ltd.",1635088,"=""ROIV""","7TH FLOOR, 50 BROADWAY",,LONDON,X0,"UNITED KINGDOM",Foreign,,,"=""2834""","Pharmaceutical Preparations",325412,"Pharmaceutical Preparation Manufacturing",34,10,03/31/25,"7,022,017,536",03/31/25,"29,053,000","-171,981,000",,"5,436,940,000"
48029,Goodwill,"Goodwill – Specific Reporting Unit - Refer to Note C to the Consolidated Financial Statements",569052,05/31/25,07/24/25,3,"Deloitte & Touche LLP",,,,Cleveland,OH,OHIO,"US Midwest",10-K,2025-07-24,,"RPM INTERNATIONAL INC/DE/",110621,"=""RPM""","2628 PEARL RD","P O BOX 777",MEDINA,OH,OHIO,"US Midwest",,,"=""2851""","Paints, Varnishes, Lacquers, Enamels, and Allied Products",325510,"Paint and Coating Manufacturing",34,114,05/31/25,"14,602,142,720",05/31/25,"7,372,644,000","688,688,000","486,904,000","7,775,949,000"
47445,"Property, plant and equipment","Aircraft component- estimated useful lives and expected residual values",565299,03/31/25,05/19/25,1,"PricewaterhouseCoopers LLP",104,PricewaterhouseCoopers,1366,Dublin,L2,IRELAND,Foreign,20-F,2025-05-19,,"RYANAIR HOLDINGS PLC",1038683,"=""RYAAY""","C/O RYANAIR LTD CORPORATE HEAD OFFICE","DUBLIN AIRPORT","COUNTY DUBLIN",L2,IRELAND,Foreign,,,"=""4512""","Air Transportation, Scheduled",481111,"Scheduled Passenger Air Transportation",34,42,03/31/25,"22,538,043,392",03/31/25,"15,067,200,000","1,740,900,000","7,443,200,000","18,911,200,000"
45719,"Revenue from customer contracts","Revenue Recognition – Allocation of Transaction Price to Performance Obligations",559212,01/31/25,03/27/25,2,"Ernst & Young LLP",,,,Austin,TX,TEXAS,"US Southwest",10-K,2025-03-27,,"SailPoint, Inc.",2030781,"=""SAIL""","11120 FOUR POINTS DRIVE","SUITE 100",AUSTIN,TX,TEXAS,"US Southwest",,,"=""7372""","Prepackaged Software",541512,"Computer Systems Design Services",34,,,,01/31/25,"861,611,000","-315,830,000","-1,104,690,000","7,411,916,000"
44253,"Revenue from customer contracts","Revenue Recognition",555460,01/31/25,03/05/25,2,"Ernst & Young LLP",,,,"San Francisco",CA,CALIFORNIA,"US West",10-K,2025-03-05,,"Salesforce, Inc.",1108524,"=""CRM""","SALESFORCE TOWER","415 MISSION STREET 3RD FL","SAN FRANCISCO",CA,CALIFORNIA,"US West",,,"=""7372""","Prepackaged Software",518210,"Data Processing, Hosting, and Related Services",34,354,01/29/25,"338,777,997,312",01/31/25,"37,895,000,000","6,197,000,000","5,462,000,000","102,928,000,000"
44254,"Other investments","Impairment of Strategic Investments",555460,01/31/25,03/05/25,2,"Ernst & Young LLP",,,,"San Francisco",CA,CALIFORNIA,"US West",10-K,2025-03-05,,"Salesforce, Inc.",1108524,"=""CRM""","SALESFORCE TOWER","415 MISSION STREET 3RD FL","SAN FRANCISCO",CA,CALIFORNIA,"US West",,,"=""7372""","Prepackaged Software",518210,"Data Processing, Hosting, and Related Services",34,354,01/29/25,"338,777,997,312",01/31/25,"37,895,000,000","6,197,000,000","5,462,000,000","102,928,000,000"
48795,"Vendor/supplier rebates","Evaluation of vendor rebates and concessions",575514,09/30/25,11/13/25,4,"KPMG LLP",,,,Dallas,TX,TEXAS,"US Southwest",10-K,2025-11-13,,"Sally Beauty Holdings, Inc.",1368458,"=""SBH""","3001 COLORADO BOULEVARD",,DENTON,TX,TEXAS,"US Southwest",,,"=""5990""","Retail-Retail Stores, NEC",446120,"Cosmetics, Beauty Supplies, and Perfume Stores",34,16,09/30/25,"1,593,405,056",09/30/25,"3,701,424,000","195,878,000","200,515,000","2,871,096,000"
45508,"Revenue from customer contracts","Revenue Recognition – Refer to Notes 2 and 7 to the financial statements",558687,02/01/25,03/25/25,3,"Deloitte & Touche LLP",,,,"San Francisco",CA,CALIFORNIA,"US West",10-K,2025-03-25,,"Samsara Inc.",1642896,"=""IOT""","1 DE HARO STREET",,"SAN FRANCISCO",CA,CALIFORNIA,"US West",,,"=""7373""","Computer Integrated Systems Design",518210,"Data Processing, Hosting, and Related Services",34,51,02/03/25,"13,849,871,360",02/01/25,"1,249,199,000","-154,907,000",,"2,024,302,000"
48239,"Revenue from customer contracts","Assessment of variable consideration for sales to resellers",570643,06/27/25,08/20/25,4,"KPMG LLP",,,,Irvine,CA,CALIFORNIA,"US West",10-K,2025-08-21,,"Sandisk Corp",2023554,"=""SNDK""","951 SANDISK DRIVE",,MILPITAS,CA,CALIFORNIA,"US West",,,"=""3572""","Computer Storage Devices",0,,34,47,06/26/25,"6,892,995,072",06/27/25,"7,355,000,000","-1,641,000,000","4,217,000,000","12,985,000,000"
48236,"Asset retirement and environmental obligations","Valuation of the Projected Benefit Obligation related to the Supplemental Employee Retirement Plan (SERP)",570598,06/26/25,08/20/25,1,"PricewaterhouseCoopers LLP",,,,Chicago,IL,ILLINOIS,"US Midwest",10-K,2025-08-20,,"SANFILIPPO JOHN B & SON INC",880117,"=""JBSS""","1703 N. RANDALL ROAD",,ELGIN,IL,ILLINOIS,"US Midwest",,,"=""2060""","Sugar & Confectionery Products",311911,"Roasted Nuts and Peanut Butter Manufacturing",34,63,06/30/25,"571,907,648",06/26/25,"1,107,246,000","58,934,000","344,519,000","597,603,000"
48793,"Revenue from customer contracts","Revenue Recognition using the Cost-to-cost Method for Government Contracts in the Defense and Aerospace Division",575522,09/27/25,11/13/25,1,"PricewaterhouseCoopers LLP",,,,"San Jose",CA,CALIFORNIA,"US West",10-K,2025-11-13,,"SANMINA CORP",897723,"=""SANM""","2700 N FIRST ST",,"SAN JOSE",CA,CALIFORNIA,"US West",,,"=""3672""","Printed Circuit Boards",334412,"Bare Printed Circuit Board Manufacturing",34,114,09/29/25,"6,052,580,864",09/27/25,"8,128,382,000","245,893,000",,"5,858,173,000"
47310,"Other investments","Valuation of investments using significant unobservable inputs",564488,02/28/25,05/07/25,2,"Ernst & Young LLP",,,,"New York",NY,"NEW YORK","US Mid Atlantic",10-K,2025-05-07,,"SARATOGA INVESTMENT CORP.",1377936,"=""SAR""","535 MADISON AVENUE",,"NEW YORK",NY,"NEW YORK","US Mid Atlantic",,,,,523999,"Miscellaneous Financial Investment Activities",34,26,02/26/25,"368,701,792",02/28/25,"96,796,193","29,147,193",,"1,191,543,857"
48329,"Property, plant and equipment","Impairment assessment of non-financial assets related to certain cash generating units",571160,06/30/25,08/29/25,4,"KPMG LLP",82,"KPMG Inc",1025,Johannesburg,T3,"SOUTH AFRICA",Foreign,20-F,2025-08-29,,"SASOL LTD",314590,"=""SSL""","50 KATHERINE STREET SANDTON",SANDTON,JOHANNESBURG,T3,"SOUTH AFRICA",Foreign,,,"=""1311""","Crude Petroleum and Natural Gas",325110,"Petrochemical Manufacturing",34,5,07/02/25,"3,210,718,720",06/30/25,"14,017,000,000","6,973,000,000","8,445,000,000","20,232,000,000"
48330,"Asset retirement and environmental obligations","Evaluation of the environmental provisions related to certain sites within South Africa and Mozambique",571160,06/30/25,08/29/25,4,"KPMG LLP",82,"KPMG Inc",1025,Johannesburg,T3,"SOUTH AFRICA",Foreign,20-F,2025-08-29,,"SASOL LTD",314590,"=""SSL""","50 KATHERINE STREET SANDTON",SANDTON,JOHANNESBURG,T3,"SOUTH AFRICA",Foreign,,,"=""1311""","Crude Petroleum and Natural Gas",325110,"Petrochemical Manufacturing",34,5,07/02/25,"3,210,718,720",06/30/25,"14,017,000,000","6,973,000,000","8,445,000,000","20,232,000,000"
48035,"Revenue from customer contracts","Revenue Recognition - allocation of contract transaction price to identified performance obligations",569169,05/31/25,07/25/25,2,"Ernst & Young LLP",,,,"New York",NY,"NEW YORK","US Mid Atlantic",10-K,2025-07-25,,"SCHOLASTIC CORP",866729,"=""SCHL""","555 BROADWAY",,"NEW YORK",NY,"NEW YORK","US Mid Atlantic",,,"=""2731""","Books: Publishing, or Publishing and Printing",511130,"Book Publishers",34,17,05/31/25,"418,191,456",05/31/25,"1,625,500,000","-1,900,000","581,600,000","1,950,100,000"
48036,"Business combinations","Fair value of investment in film and television programs and distribution contracts and relationships in the 9 Story Media Group business combination",569169,05/31/25,07/25/25,2,"Ernst & Young LLP",,,,"New York",NY,"NEW YORK","US Mid Atlantic",10-K,2025-07-25,,"SCHOLASTIC CORP",866729,"=""SCHL""","555 BROADWAY",,"NEW YORK",NY,"NEW YORK","US Mid Atlantic",,,"=""2731""","Books: Publishing, or Publishing and Printing",511130,"Book Publishers",34,17,05/31/25,"418,191,456",05/31/25,"1,625,500,000","-1,900,000","581,600,000","1,950,100,000"
45081,"Revenue from customer contracts","Cost estimation for revenue recognition on certain contracts using a cost input measure of progress",557835,01/31/25,03/17/25,2,"Ernst & Young LLP",,,,Tysons,VA,VIRGINIA,"US Mid Atlantic",10-K,2025-03-17,,"Science Applications International Corp",1571123,"=""SAIC""","12010 SUNSET HILLS ROAD",,RESTON,VA,VIRGINIA,"US Mid Atlantic",,,"=""7373""","Computer Integrated Systems Design",541330,"Engineering Services",34,108,01/31/25,"5,197,440,000",01/31/25,"7,479,000,000","362,000,000","-2,053,000,000","5,246,000,000"
45082,"Uncertain tax positions","Certain unrecognized tax benefits that, if recognized, would materially affect the effective income tax rate",557835,01/31/25,03/17/25,2,"Ernst & Young LLP",,,,Tysons,VA,VIRGINIA,"US Mid Atlantic",10-K,2025-03-17,,"Science Applications International Corp",1571123,"=""SAIC""","12010 SUNSET HILLS ROAD",,RESTON,VA,VIRGINIA,"US Mid Atlantic",,,"=""7373""","Computer Integrated Systems Design",541330,"Engineering Services",34,108,01/31/25,"5,197,440,000",01/31/25,"7,479,000,000","362,000,000","-2,053,000,000","5,246,000,000"
48943,"Sales return and allowances","Promotional Programs and Allowances - Refer to Note 2 to the financial statements",576082,09/30/25,11/25/25,3,"Deloitte & Touche LLP",,,,Columbus,OH,OHIO,"US Midwest",10-K,2025-11-25,,"SCOTTS MIRACLE-GRO CO",825542,"=""SMG""","14111 SCOTTSLAWN ROAD",,MARYSVILLE,OH,OHIO,"US Midwest",,,"=""2870""","Agricultural Chemicals",325311,"Nitrogenous Fertilizer Manufacturing",34,58,10/02/25,"3,375,397,120",09/30/25,"3,413,100,000","145,200,000","-1,003,200,000","2,742,000,000"
48091,"Sales return and allowances","Revenue recognition—Sales incentive program rebates and discounts",569580,06/27/25,08/01/25,2,"Ernst & Young LLP",,,,"San Jose",CA,CALIFORNIA,"US West",10-K,2025-08-01,,"Seagate Technology Holdings plc",1137789,"=""STX""","121 WOODLANDS AVENUE 5",,SINGAPORE,U0,SINGAPORE,Foreign,,,"=""3572""","Computer Storage Devices",334112,"Computer Storage Device Manufacturing",34,141,06/26/25,"29,856,874,496",06/27/25,"9,097,000,000","1,469,000,000","-1,674,000,000","8,023,000,000"
48092,"Deferred income taxes","Realizability of deferred income taxes",569580,06/27/25,08/01/25,2,"Ernst & Young LLP",,,,"San Jose",CA,CALIFORNIA,"US West",10-K,2025-08-01,,"Seagate Technology Holdings plc",1137789,"=""STX""","121 WOODLANDS AVENUE 5",,SINGAPORE,U0,SINGAPORE,Foreign,,,"=""3572""","Computer Storage Devices",334112,"Computer Storage Device Manufacturing",34,141,06/26/25,"29,856,874,496",06/27/25,"9,097,000,000","1,469,000,000","-1,674,000,000","8,023,000,000"
48240,"Revenue from customer contracts","Commission Revenue – Medicare Advantage Renewal Commissions – Refer to Notes 1 and 13 to the financial statements",570642,06/30/25,08/21/25,3,"Deloitte & Touche LLP",,,,"Kansas City",MO,MISSOURI,"US Southeast",10-K,2025-08-21,,"SelectQuote, Inc.",1794783,"=""SLQT""","6800 WEST 115TH STREET","SUITE 2511","OVERLAND PARK",KS,KANSAS,"US Midwest",,,"=""6411""","Insurance Agents, Brokers, and Service",524113,"Direct Life Insurance Carriers",34,2,07/02/25,"414,531,040",06/30/25,"1,526,594,000","47,580,000","529,047,000","1,249,356,000"
45481,Inventory,"Inventories – Excess Quantities and Obsolescence – Refer to Notes 2 and 6 to the financial statements",558699,01/26/25,03/25/25,3,"Deloitte & Touche LLP",,,,"Los Angeles",CA,CALIFORNIA,"US West",10-K,2025-03-25,,"SEMTECH CORP",88941,"=""SMTC""","200 FLYNN ROAD",,CAMARILLO,CA,CALIFORNIA,"US West",,,"=""3674""","Semiconductors and Related Devices",334413,"Semiconductor and Related Device Manufacturing",34,61,01/28/25,"4,624,979,968",01/26/25,"909,287,000","-161,896,000","-23,776,000","1,419,264,000"
47688,Inventory,"Inventories — Refer to Notes 1 and 4 to the financial statements",566863,03/31/25,06/12/25,3,"Deloitte & Touche LLP",,,,Rochester,NY,"NEW YORK","US Mid Atlantic",10-K,2025-06-12,,"Seneca Foods Corp",88948,"=""SENEA""","3736 SOUTH MAIN STREET",*,MARION,NY,"NEW YORK","US Mid Atlantic",,,"=""2033""","Canned Fruits, Vegetables, Preserves, Jams, and Jellies",311421,"Fruit and Vegetable Canning",34,89,03/31/25,"475,667,008",03/31/25,"1,578,887,000","41,224,000",,"1,181,429,000"
45593,"Revenue from customer contracts","Revenue Recognition — Refer to Notes 2 and 3 to the financial statements",558977,01/31/25,03/26/25,3,"Deloitte & Touche LLP",,,,"San Jose",CA,CALIFORNIA,"US West",10-K,2025-03-26,,"SentinelOne, Inc.",1583708,"=""S""","444 CASTRO STREET","SUITE 400","MOUNTAIN VIEW",CA,CALIFORNIA,"US West",,,"=""7372""","Prepackaged Software",518210,"Data Processing, Hosting, and Related Services",34,24,01/29/25,"6,984,520,704",01/31/25,"821,461,000","-288,441,000","932,456,000","2,406,625,000"
45424,Inventory,"Merchandise Inventories — Refer to Note 2 to the financial statements",558340,02/01/25,03/21/25,3,"Deloitte & Touche LLP",,,,Indianapolis,IN,INDIANA,"US Midwest",10-K,2025-03-21,,"SHOE CARNIVAL INC",895447,"=""SCVL""","1800 INNOVATION POINT","5TH FLOOR","FORT MILL",SC,"SOUTH CAROLINA","US Southeast",,,"=""5661""","Shoe Stores",448210,"Shoe Stores",34,25,02/03/25,"691,869,504",02/01/25,"1,202,885,000","73,766,000","590,010,000","1,124,133,000"
45246,"Revenue from customer contracts","Revenue recognition related to extended service plans",558019,02/01/25,03/19/25,4,"KPMG LLP",,,,Louisville,KY,KENTUCKY,"US Mid Atlantic",10-K,2025-03-19,,"SIGNET JEWELERS LTD",832988,"=""SIG""","CLARENDON HOUSE","2 CHURCH STREET",HAMILTON,D0,BERMUDA,Foreign,,,"=""5944""","Jewelry Stores",448310,"Jewelry Stores",34,58,02/03/25,"2,519,456,512",02/01/25,"6,703,800,000","61,200,000","1,062,600,000","5,726,600,000"
45247,"Other intangible assets","Valuations of the Digital brands reporting unit and the Blue Nile trade name",558019,02/01/25,03/19/25,4,"KPMG LLP",,,,Louisville,KY,KENTUCKY,"US Mid Atlantic",10-K,2025-03-19,,"SIGNET JEWELERS LTD",832988,"=""SIG""","CLARENDON HOUSE","2 CHURCH STREET",HAMILTON,D0,BERMUDA,Foreign,,,"=""5944""","Jewelry Stores",448310,"Jewelry Stores",34,58,02/03/25,"2,519,456,512",02/01/25,"6,703,800,000","61,200,000","1,062,600,000","5,726,600,000"
47511,"Long-lived assets","Impairment – Assessment of Whether Indicators of Impairment or Impairment Reversal Exist in Non-financial Assets — Refer to Note 2 to the financial statements",565693,03/31/25,05/22/25,3,"Deloitte & Touche LLP",468,"Deloitte LLP",1208,Vancouver,A1,"BRITISH COLUMBIA",Canada,6-K,2025-05-23,,"SILVERCORP METALS INC",1340677,"=""SVM""","SUITE 1750","1066 W. HASTINGS STREET",VANCOUVER,A1,"BRITISH COLUMBIA",Canada,,,"=""1040""","Metal Mining",212222,"Silver Ore Mining",34,4,03/31/25,"842,639,552",03/31/25,"298,895,000","78,769,000","115,746,000","1,138,941,000"
47512,"Other debt","Convertible Notes – Valuation of Embedded Conversion Features — Refer to Notes 2 and 16 to the financial statements",565693,03/31/25,05/22/25,3,"Deloitte & Touche LLP",468,"Deloitte LLP",1208,Vancouver,A1,"BRITISH COLUMBIA",Canada,6-K,2025-05-23,,"SILVERCORP METALS INC",1340677,"=""SVM""","SUITE 1750","1066 W. HASTINGS STREET",VANCOUVER,A1,"BRITISH COLUMBIA",Canada,,,"=""1040""","Metal Mining",212222,"Silver Ore Mining",34,4,03/31/25,"842,639,552",03/31/25,"298,895,000","78,769,000","115,746,000","1,138,941,000"
47513,"Business combinations","Acquisition – Valuation of Acquired Mineral Rights and Properties— Refer to Notes 2 and 3 to the financial statements",565693,03/31/25,05/22/25,3,"Deloitte & Touche LLP",468,"Deloitte LLP",1208,Vancouver,A1,"BRITISH COLUMBIA",Canada,6-K,2025-05-23,,"SILVERCORP METALS INC",1340677,"=""SVM""","SUITE 1750","1066 W. HASTINGS STREET",VANCOUVER,A1,"BRITISH COLUMBIA",Canada,,,"=""1040""","Metal Mining",212222,"Silver Ore Mining",34,4,03/31/25,"842,639,552",03/31/25,"298,895,000","78,769,000","115,746,000","1,138,941,000"
47633,"Long-lived assets","Impairment – Assessment of Whether Indicators of Impairment or Impairment Reversal Exist in Non-financial Assets — Refer to Note 2 to the financial statements",566329,03/31/25,05/22/25,3,"Deloitte & Touche LLP",468,"Deloitte LLP",1208,Vancouver,A1,"BRITISH COLUMBIA",Canada,40-F,2025-06-05,,"SILVERCORP METALS INC",1340677,"=""SVM""","SUITE 1750","1066 W. HASTINGS STREET",VANCOUVER,A1,"BRITISH COLUMBIA",Canada,,,"=""1040""","Metal Mining",212222,"Silver Ore Mining",34,4,03/31/25,"842,639,552",03/31/25,"298,895,000","78,769,000","115,746,000","1,138,941,000"
47634,"Other debt","Convertible Notes – Valuation of Embedded Conversion Features — Refer to Notes 2 and 16 to the financial statements",566329,03/31/25,05/22/25,3,"Deloitte & Touche LLP",468,"Deloitte LLP",1208,Vancouver,A1,"BRITISH COLUMBIA",Canada,40-F,2025-06-05,,"SILVERCORP METALS INC",1340677,"=""SVM""","SUITE 1750","1066 W. HASTINGS STREET",VANCOUVER,A1,"BRITISH COLUMBIA",Canada,,,"=""1040""","Metal Mining",212222,"Silver Ore Mining",34,4,03/31/25,"842,639,552",03/31/25,"298,895,000","78,769,000","115,746,000","1,138,941,000"
47635,"Business combinations","Acquisition – Valuation of Acquired Mineral Rights and Properties— Refer to Notes 2 and 3 to the financial statements",566329,03/31/25,05/22/25,3,"Deloitte & Touche LLP",468,"Deloitte LLP",1208,Vancouver,A1,"BRITISH COLUMBIA",Canada,40-F,2025-06-05,,"SILVERCORP METALS INC",1340677,"=""SVM""","SUITE 1750","1066 W. HASTINGS STREET",VANCOUVER,A1,"BRITISH COLUMBIA",Canada,,,"=""1040""","Metal Mining",212222,"Silver Ore Mining",34,4,03/31/25,"842,639,552",03/31/25,"298,895,000","78,769,000","115,746,000","1,138,941,000"
48686,"Sales return and allowances","Revenue Recognition — Trade Promotions — Refer to Note 2 to the consolidated financial statements",574551,08/30/25,10/28/25,3,"Deloitte & Touche LLP",,,,Denver,CO,COLORADO,"US West",10-K,2025-10-28,,"Simply Good Foods Co",1702744,"=""SMPL""","1225 17TH STREET","SUITE 1000",DENVER,CO,COLORADO,"US West",,,"=""2000""","Food and Kindred Products",311340,"Nonchocolate Confectionery Manufacturing",34,29,08/28/25,"2,879,508,480",08/30/25,"1,450,920,000","103,614,000","-44,744,000","2,396,045,000"
48687,"Other intangible assets","Intangible Assets - Atkins Indefinite-Lived Intangible Asset - Refer to Notes 2 and 5 to the consolidated financial statements",574551,08/30/25,10/28/25,3,"Deloitte & Touche LLP",,,,Denver,CO,COLORADO,"US West",10-K,2025-10-28,,"Simply Good Foods Co",1702744,"=""SMPL""","1225 17TH STREET","SUITE 1000",DENVER,CO,COLORADO,"US West",,,"=""2000""","Food and Kindred Products",311340,"Nonchocolate Confectionery Manufacturing",34,29,08/28/25,"2,879,508,480",08/30/25,"1,450,920,000","103,614,000","-44,744,000","2,396,045,000"
46612,"Revenue from customer contracts","Revenue recognition – Enterprise-grade solution revenue under Talent Development Solutions segment",561322,01/31/25,04/14/25,2,"Ernst & Young LLP",,,,Boston,MA,MASSACHUSETTS,"US New England",10-K,2025-04-14,,"Skillsoft Corp.",1774675,"=""SKIL""","300 INNOVATIVE WAY","SUITE 2210",NASHUA,NH,"NEW HAMPSHIRE","US New England",,,"=""7372""","Prepackaged Software",541511,"Custom Computer Programming Services",34,30,01/29/25,"248,423,808",01/31/25,"530,994,000","-121,908,000","-650,446,000","1,106,069,000"
46613,"Other intangible assets","Valuation of indefinite-lived trademark",561322,01/31/25,04/14/25,2,"Ernst & Young LLP",,,,Boston,MA,MASSACHUSETTS,"US New England",10-K,2025-04-14,,"Skillsoft Corp.",1774675,"=""SKIL""","300 INNOVATIVE WAY","SUITE 2210",NASHUA,NH,"NEW HAMPSHIRE","US New England",,,"=""7372""","Prepackaged Software",541511,"Custom Computer Programming Services",34,30,01/29/25,"248,423,808",01/31/25,"530,994,000","-121,908,000","-650,446,000","1,106,069,000"
48740,"Other income taxes","Application of tax laws and regulations",575169,10/03/25,11/07/25,4,"KPMG LLP",,,,Irvine,CA,CALIFORNIA,"US West",10-K,2025-11-07,,"SKYWORKS SOLUTIONS, INC.",4127,"=""SWKS""","5260 CALIFORNIA AVENUE",,IRVINE,CA,CALIFORNIA,"US West",,,"=""3674""","Semiconductors and Related Devices",334413,"Semiconductor and Related Device Manufacturing",34,76,10/01/25,"11,330,960,384",10/03/25,"4,086,900,000","477,100,000","2,771,400,000","7,917,000,000"
45373,"Revenue from customer contracts","Revenue Recognition - Capacity Arrangements",558384,01/31/25,03/21/25,1,"PricewaterhouseCoopers LLP",,,,"San Jose",CA,CALIFORNIA,"US West",10-K,2025-03-21,,"Snowflake Inc.",1640147,"=""SNOW""","106 EAST BABCOCK STREET","SUITE 3A",BOZEMAN,MT,MONTANA,"US West",,,"=""7372""","Prepackaged Software",518210,"Data Processing, Hosting, and Related Services",34,183,01/29/25,"60,368,687,104",01/31/25,"3,626,396,000","-1,285,640,000","1,665,342,000","9,033,938,000"
48824,"Revenue from customer contracts","Evaluation of standalone selling prices for unspecified software upgrades and cloud-based services",575617,09/27/25,11/14/25,4,"KPMG LLP",,,,Seattle,WA,WASHINGTON,"US West",10-K,2025-11-14,,"Sonos Inc",1314727,"=""SONO""","301 COROMAR DRIVE",,"SANTA BARBARA",CA,CALIFORNIA,"US West",,,"=""3651""","Household Audio and Video Equipment",334310,"Audio and Video Equipment Manufacturing",34,15,09/29/25,"1,871,226,624",09/27/25,"1,443,276,000","-61,144,000","197,015,000","823,278,000"
47755,"Insurance contract liabilities","Significant assumptions used in the valuation of insurance contract liabilities not measured under the premium allocation approach (“PAA”)",567181,03/31/25,06/20/25,1,"PricewaterhouseCoopers LLP",882,"PricewaterhouseCoopers Japan LLC",2743,Tokyo,M0,JAPAN,Foreign,20-F,2025-06-20,,"Sony Group Corp",313838,"=""SONY""","1-7-1, KONAN",MINATO-KU,TOKYO,M0,JAPAN,Foreign,,,"=""3651""","Household Audio and Video Equipment",334310,"Audio and Video Equipment Manufacturing",34,25,04/02/25,"151,703,945,216",03/31/25,"86,646,000,000","7,756,000,000","40,122,000,000","236,012,000,000"
48948,"Other investments","Evaluation of the evidence pertaining to the existence of the gold holdings",576037,09/30/25,11/25/25,4,"KPMG LLP",,,,"New York",NY,"NEW YORK","US Mid Atlantic",10-K,2025-11-25,,"SPDR GOLD TRUST",1222333,"=""GLD""","C/O WORLD GOLD TRUST SERVICES, LLC","685 THIRD AVENUE, SUITE 2702","NEW YORK",NY,"NEW YORK","US Mid Atlantic",,,"=""6221""","Commodity Contracts Brokers and Dealers",525990,"Other Financial Vehicles",34,355,10/02/25,"118,357,942,272",09/30/25,,"35,553,539,000",,"124,571,115,000"
48848,"Other intangible assets","Valuation of the Rejuvenate Tradename",575744,09/30/25,11/18/25,4,"KPMG LLP",,,,Milwaukee,WI,WISCONSIN,"US Midwest",10-K,2025-11-18,,"Spectrum Brands Holdings, Inc.",109177,"=""SPB""","3001 DEMING WAY",,MIDDLETON,WI,WISCONSIN,"US Midwest",,,"=""3690""","Miscellaneous Electrical Machinery, Equipment & Supplies",334419,"Other Electronic Component Manufacturing",34,54,10/02/25,"1,300,886,016",09/30/25,"2,809,000,000","99,900,000","105,300,000","3,379,600,000"
48817,"Regulatory assets and liabilities","Regulatory Matters – Impact of Rate Regulation on the Financial Statements – Refer to Note 15 to the financial statements",575629,09/30/25,11/14/25,3,"Deloitte & Touche LLP",,,,"Saint Louis",MO,MISSOURI,"US Southeast",10-K,2025-11-14,,"SPIRE ALABAMA INC",3146,,"2101 6TH AVENUE NORTH",,BIRMINGHAM,AL,ALABAMA,"US Southeast",1126956,"SPIRE INC","=""4924""","Natural Gas Distribution",221210,"Natural Gas Distribution",34,,,,09/30/25,"545,200,000","84,900,000",,"2,570,300,000"
48825,"Regulatory assets and liabilities","Regulatory Matters – Impact of Rate Regulation on the Financial Statements – Refer to Note 15 to the financial statements",575614,09/30/25,11/14/25,3,"Deloitte & Touche LLP",,,,"Saint Louis",MO,MISSOURI,"US Southeast",10-K,2025-11-14,,"SPIRE INC",1126956,"=""SR""","700 MARKET STREET",,"ST LOUIS",MO,MISSOURI,"US Southeast",,,"=""4924""","Natural Gas Distribution",221210,"Natural Gas Distribution",34,82,10/02/25,"4,831,793,152",09/30/25,"2,476,400,000","271,700,000","2,223,900,000","11,575,300,000"
48811,"Regulatory assets and liabilities","Regulatory Matters – Impact of Rate Regulation on the Financial Statements – Refer to Note 15 to the financial statements",575638,09/30/25,11/14/25,3,"Deloitte & Touche LLP",,,,"Saint Louis",MO,MISSOURI,"US Southeast",10-K,2025-11-14,,"SPIRE MISSOURI INC",57183,,"700 MARKET STREET",,"ST LOUIS",MO,MISSOURI,"US Southeast",1126956,"SPIRE INC","=""4924""","Natural Gas Distribution",221210,"Natural Gas Distribution",34,,,,09/30/25,"1,544,100,000","128,300,000","1,957,500,000","6,349,800,000"
45369,"Financial statements and disclosures","Sufficiency of audit evidence over costs to obtain customer contracts",558378,01/31/25,03/20/25,4,"KPMG LLP",,,,"New York",NY,"NEW YORK","US Mid Atlantic",10-K,2025-03-21,,"Sprinklr, Inc.",1569345,"=""CXM""","441 9TH AVE","12TH FLOOR","NEW YORK",NY,"NEW YORK","US Mid Atlantic",,,"=""7372""","Prepackaged Software",334611,"Software Reproducing",34,9,01/29/25,"1,259,000,192",01/31/25,"796,394,000","121,609,000","562,106,000","1,184,199,000"
48096,"Revenue from customer contracts","Revenue recognition – Revenue recognized over time – Refer to note 3 to the financial statements",569665,06/30/25,08/01/25,3,"Deloitte & Touche LLP",,,,Boston,MA,MASSACHUSETTS,"US New England",10-K,2025-08-04,,"STANDEX INTERNATIONAL CORP/DE/",310354,"=""SXI""","23 KEEWAYDIN DRIVE","SUITE 300",SALEM,NH,"NEW HAMPSHIRE","US New England",,,"=""3580""","Refrigeration & Service Industry Machinery",333415,"Air-Conditioning and Warm Air Heating Equipment and Commercial and Industrial Refrigeration Equipment Man",34,156,06/30/25,"1,876,526,336",06/30/25,"790,107,000","55,760,000","-96,505,000","1,566,880,000"
48097,"Business combinations","Acquisitions – Amran/Narayan Group Customer Relationships Intangible Asset – Refer to note 2 to the financial statements",569665,06/30/25,08/01/25,3,"Deloitte & Touche LLP",,,,Boston,MA,MASSACHUSETTS,"US New England",10-K,2025-08-04,,"STANDEX INTERNATIONAL CORP/DE/",310354,"=""SXI""","23 KEEWAYDIN DRIVE","SUITE 300",SALEM,NH,"NEW HAMPSHIRE","US New England",,,"=""3580""","Refrigeration & Service Industry Machinery",333415,"Air-Conditioning and Warm Air Heating Equipment and Commercial and Industrial Refrigeration Equipment Man",34,156,06/30/25,"1,876,526,336",06/30/25,"790,107,000","55,760,000","-96,505,000","1,566,880,000"
48812,Goodwill,"Goodwill Impairment Assessments for China Reporting Unit – Refer to Note 1 and Note 8 to the financial statements",575633,09/28/25,11/14/25,3,"Deloitte & Touche LLP",,,,Seattle,WA,WASHINGTON,"US West",10-K,2025-11-14,,"STARBUCKS CORP",829224,"=""SBUX""","P O BOX 34067",,SEATTLE,WA,WASHINGTON,"US West",,,"=""5810""","Retail-Eating & Drinking Places",722213,"Snack and Nonalcoholic Beverage Bars",34,85,09/30/25,"96,164,823,040",09/28/25,"37,184,400,000","1,856,400,000","-11,632,300,000","32,019,700,000"
46838,Goodwill,"Goodwill – AMQ Reporting Unit – Refer to Notes 2 and 11 to the financial statements",561900,02/28/25,04/18/25,3,"Deloitte & Touche LLP",,,,"Grand Rapids",MI,MICHIGAN,"US Midwest",10-K,2025-04-18,,"STEELCASE INC",1050825,"=""SCS""","901 44TH STREET SE",,"GRAND RAPIDS",MI,MICHIGAN,"US Midwest",,,"=""2522""","Office Furniture, Except Wood",337214,"Office Furniture (except Wood) Manufacturing",34,12,02/26/25,"1,168,453,888",02/28/25,"3,166,000,000","120,700,000","601,200,000","2,330,400,000"
47526,"Equity investments and joint ventures","Valuation of underlying investments of equity method investments",565635,03/31/25,05/23/25,2,"Ernst & Young LLP",,,,"Los Angeles",CA,CALIFORNIA,"US West",10-K,2025-05-23,,"StepStone Group Inc.",1796022,"=""STEP""","277 PARK AVENUE","45TH FLOOR","NEW YORK",NY,"NEW YORK","US Mid Atlantic",,,"=""6282""","Investment Advice",523920,"Portfolio Management",34,56,04/02/25,"4,218,003,712",03/31/25,"1,162,129,000","-2,209,000","-280,834,000","4,586,693,000"
47570,"Uncertain tax positions","Uncertain Tax Positions",565917,03/31/25,05/29/25,2,"Ernst & Young LLP",,,,Cleveland,OH,OHIO,"US Midwest",10-K,2025-05-29,,"STERIS plc",1757898,"=""STE""","70 SIR JOHN ROGERSON'S QUAY",,DUBLIN,L2,IRELAND,Foreign,,,"=""3842""","Orthopedic, Prosthetic, and Surgical Appliances and Supplies",339113,"Surgical Appliance and Supplies Manufacturing",34,228,04/02/25,"22,358,931,456",03/31/25,"5,459,515,000","614,641,000","653,337,000","10,146,811,000"
48535,Inventory,"Inventory, Net – Excess and Slow-Moving Inventory Reserve – Refer to Note 2 to the financial statements",572901,08/02/25,09/25/25,3,"Deloitte & Touche LLP",,,,"San Francisco",CA,CALIFORNIA,"US West",10-K,2025-09-25,,"Stitch Fix, Inc.",1576942,"=""SFIX""","1 MONTGOMERY STREET","SUITE 1500","SAN FRANCISCO",CA,CALIFORNIA,"US West",,,"=""5961""","Catalog and Mail-Order Houses",812990,"All Other Personal Services",34,5,08/04/25,"533,432,768",08/02/25,"1,267,171,000","-28,739,000",,"480,622,000"
48969,"Revenue from customer contracts","Accounting for unrealized gains and losses from certain market making activities",576259,09/30/25,11/28/25,4,"KPMG LLP",,,,"Kansas City",MO,MISSOURI,"US Southeast",10-K,2025-11-28,,"StoneX Group Inc.",913760,"=""SNEX""","230 PARK AVE","10TH FLOOR","NEW YORK",NY,"NEW YORK","US Mid Atlantic",,,"=""6200""","Security & Commodity Brokers, Dealers, Exchanges & Services",523110,"Investment Banking and Securities Dealing",34,103,10/02/25,"5,356,257,280",09/30/25,"130,897,700,000","305,900,000","1,641,200,000","45,268,000,000"
48970,"Business combinations","Acquisition date fair value of client base intangible assets",576259,09/30/25,11/28/25,4,"KPMG LLP",,,,"Kansas City",MO,MISSOURI,"US Southeast",10-K,2025-11-28,,"StoneX Group Inc.",913760,"=""SNEX""","230 PARK AVE","10TH FLOOR","NEW YORK",NY,"NEW YORK","US Mid Atlantic",,,"=""6200""","Security & Commodity Brokers, Dealers, Exchanges & Services",523110,"Investment Banking and Securities Dealing",34,103,10/02/25,"5,356,257,280",09/30/25,"130,897,700,000","305,900,000","1,641,200,000","45,268,000,000"
48291,"Warranty liabilities","Specific Warranty Reserve – Refer to Note 2 to the Financial Statements",570823,06/29/25,08/25/25,3,"Deloitte & Touche LLP",,,,Milwaukee,WI,WISCONSIN,"US Midwest",10-K,2025-08-25,,"STRATTEC SECURITY CORP",933034,"=""STRT""","3333 WEST GOOD HOPE ROAD",,MILWAUKEE,WI,WISCONSIN,"US Midwest",,,"=""3714""","Motor Vehicle Parts and Accessories",336322,"Other Motor Vehicle Electrical and Electronic Equipment Manufacturing",34,64,07/01/25,"267,717,312",06/29/25,"565,066,000","18,685,000",,"391,454,000"
48115,"Revenue from customer contracts","Revenues from certain funding-based contracts",569816,06/30/25,08/05/25,4,"KPMG LLP",,,,McLean,VA,VIRGINIA,"US Mid Atlantic",10-K,2025-08-06,,"Stride, Inc.",1157408,"=""LRN""","11720 PLAZA AMERICA DRIVE","9TH FLOOR",RESTON,VA,VIRGINIA,"US Mid Atlantic",,,"=""8200""","Services-Educational Services",516110,"Internet Publishing and Broadcasting",34,145,06/30/25,"6,318,331,392",06/30/25,"2,405,317,000","287,941,000","1,080,818,000","2,293,959,000"
48951,"Other contingent liabilities","Accrued Insurance",576114,09/27/25,11/26/25,1,"PricewaterhouseCoopers LLP",,,,"Florham Park",NJ,"NEW JERSEY","US Mid Atlantic",10-K,2025-11-26,,"SUBURBAN PROPANE PARTNERS LP",1005210,"=""SPH""","P O BOX 206","240 ROUTE 10 WEST",WIPPANY,NJ,"NEW JERSEY","US Mid Atlantic",,,"=""5900""","Retail-Miscellaneous Retail",454312,"Liquefied Petroleum Gas (Bottled Gas) Dealers",34,19,09/29/25,"1,217,149,056",09/27/25,"1,432,518,000","106,570,000","-644,033,000","2,296,274,000"
47848,"Allowance for credit losses","Assessment of the allowance for loan losses for SMBC’s corporate loans",567565,03/31/25,06/26/25,4,"KPMG LLP",333,"KPMG AZSA LLC",1009,Tokyo,M0,JAPAN,Foreign,20-F,2025-06-27,,"SUMITOMO MITSUI FINANCIAL GROUP, INC.",1022837,"=""SMFG""","1-2, MARUNOUCHI 1-CHOME",CHIYODA-KU,TOKYO,M0,JAPAN,Foreign,,,"=""6029""","Commercial Banks, NEC",522110,"Commercial Banking",34,15,03/31/25,"99,814,752,256",03/31/25,"25,679,000,000","3,454,000,000","101,962,000,000","1,953,759,000,000"
48249,Inventory,"Valuation of inventories",570645,06/28/25,08/21/25,4,"KPMG LLP",,,,"Santa Clara",CA,CALIFORNIA,"US West",10-K,2025-08-21,,"SYNAPTICS Inc",817720,"=""SYNA""","1109 MCKAY DRIVE",,"SAN JOSE",CA,CALIFORNIA,"US West",,,"=""3674""","Semiconductors and Related Devices",334119,"Other Computer Peripheral Equipment Manufacturing",34,68,07/02/25,"2,634,967,552",06/30/25,"1,074,300,000","-47,800,000","260,400,000","2,584,400,000"
48250,"Business combinations","Evaluation of the fair value of certain assets acquired in a business combination",570645,06/28/25,08/21/25,4,"KPMG LLP",,,,"Santa Clara",CA,CALIFORNIA,"US West",10-K,2025-08-21,,"SYNAPTICS Inc",817720,"=""SYNA""","1109 MCKAY DRIVE",,"SAN JOSE",CA,CALIFORNIA,"US West",,,"=""3674""","Semiconductors and Related Devices",334119,"Other Computer Peripheral Equipment Manufacturing",34,68,07/02/25,"2,634,967,552",06/30/25,"1,074,300,000","-47,800,000","260,400,000","2,584,400,000"
48271,Goodwill,"Valuation of Goodwill",570725,06/28/25,08/21/25,2,"Ernst & Young LLP",,,,Houston,TX,TEXAS,"US Southwest",10-K,2025-08-22,,"SYSCO CORP",96021,"=""SYY""","1390 ENCLAVE PKWY",,HOUSTON,TX,TEXAS,"US Southwest",,,"=""5140""","Wholesale-Groceries & Related Products",424410,"General Line Grocery Merchant Wholesalers",34,76,06/30/25,"36,715,094,016",06/28/25,"81,370,000,000","1,828,000,000","-4,481,000,000","26,774,000,000"
47451,"Depreciation and amortization","Impairment of intangible assets that are subject to amortization",565435,03/31/25,05/20/25,2,"Ernst & Young LLP",,,,"New York",NY,"NEW YORK","US Mid Atlantic",10-K,2025-05-20,,"TAKE TWO INTERACTIVE SOFTWARE INC",946581,"=""TTWO""","110 WEST 44TH STREET",,"NEW YORK",NY,"NEW YORK","US Mid Atlantic",,,"=""7372""","Prepackaged Software",511210,"Software Publishers",34,211,04/02/25,"37,258,244,096",03/31/25,"5,633,600,000","-4,478,900,000","-3,148,200,000","9,180,700,000"
47452,Goodwill,"Impairment of goodwill for a certain reporting unit",565435,03/31/25,05/20/25,2,"Ernst & Young LLP",,,,"New York",NY,"NEW YORK","US Mid Atlantic",10-K,2025-05-20,,"TAKE TWO INTERACTIVE SOFTWARE INC",946581,"=""TTWO""","110 WEST 44TH STREET",,"NEW YORK",NY,"NEW YORK","US Mid Atlantic",,,"=""7372""","Prepackaged Software",511210,"Software Publishers",34,211,04/02/25,"37,258,244,096",03/31/25,"5,633,600,000","-4,478,900,000","-3,148,200,000","9,180,700,000"
47789,"Sales return and allowances","Evaluation of the provisions for U.S. Medicaid and U.S. commercial managed care rebates",567401,03/31/25,06/25/25,4,"KPMG LLP",333,"KPMG AZSA LLC",1009,Tokyo,M0,JAPAN,Foreign,20-F,2025-06-25,,"TAKEDA PHARMACEUTICAL CO LTD",1395064,"=""TAK""","1-1, NIHONBASHI-HONCHO 2-CHOME, CHUO-KU",,TOKYO,M0,JAPAN,Foreign,,,"=""2834""","Pharmaceutical Preparations",325412,"Pharmaceutical Preparation Manufacturing",34,15,03/31/25,"46,800,338,944",03/31/25,"30,638,000,000","723,000,000","-13,514,000,000","95,281,000,000"
47790,Goodwill,"Valuation of goodwill",567401,03/31/25,06/25/25,4,"KPMG LLP",333,"KPMG AZSA LLC",1009,Tokyo,M0,JAPAN,Foreign,20-F,2025-06-25,,"TAKEDA PHARMACEUTICAL CO LTD",1395064,"=""TAK""","1-1, NIHONBASHI-HONCHO 2-CHOME, CHUO-KU",,TOKYO,M0,JAPAN,Foreign,,,"=""2834""","Pharmaceutical Preparations",325412,"Pharmaceutical Preparation Manufacturing",34,15,03/31/25,"46,800,338,944",03/31/25,"30,638,000,000","723,000,000","-13,514,000,000","95,281,000,000"
47716,"Revenue from customer contracts","Revenue recognition - Learning services - Refer to Note 2 to the financial statements",566999,02/28/25,06/16/25,3,"Deloitte & Touche LLP",499,"Deloitte Touche Tohmatsu Certified Public Accountants LLP",1113,Beijing,F4,CHINA,Foreign,20-F,2025-06-16,,"TAL Education Group",1499620,"=""TAL""","4/F, TAL BUILDING NO.1, COURTYARD NO. 9","QIXIN MIDDLE STREET, CHANGPING DISTRICT",Beijing,F4,CHINA,Foreign,,,"=""8200""","Services-Educational Services",611691,"Exam Preparation and Tutoring",34,14,02/26/25,"687,172,224",02/28/25,"2,250,233,000","84,591,000","3,583,687,000","5,503,067,000"
48189,"Goodwill and intangible assets","Goodwill and Indefinite-lived Brand Intangible - Kate Spade - Refer to Notes 3 and 14 to the financial statements",570349,06/28/25,08/14/25,3,"Deloitte & Touche LLP",,,,"New York",NY,"NEW YORK","US Mid Atlantic",10-K,2025-08-14,,"TAPESTRY, INC.",1116132,"=""TPR""","10 HUDSON YARDS",,"NEW YORK",NY,"NEW YORK","US Mid Atlantic",,,"=""3100""","Leather & Leather Products",316992,"Women's Handbag and Purse Manufacturing",34,88,06/30/25,"18,273,261,568",06/28/25,"7,010,700,000","183,200,000","-845,100,000","6,580,500,000"
44700,"Accounts/loans receivable","Valuation of Vendor Income Receivable",557138,02/01/25,03/12/25,2,"Ernst & Young LLP",,,,Minneapolis,MN,MINNESOTA,"US Midwest",10-K,2025-03-12,,"TARGET CORP",27419,"=""TGT""","1000 NICOLLET MALL",,MINNEAPOLIS,MN,MINNESOTA,"US Midwest",,,"=""5331""","Variety Stores",452112,"Discount Department Stores",34,134,02/03/25,"61,473,714,176",02/01/25,"106,566,000,000","4,091,000,000",,"57,769,000,000"
48750,"Deferred income taxes","Income Taxes — Realizability of Deferred Tax Assets — Refer to Notes 2 and 15 to the financial statements",575279,09/26/25,11/10/25,3,"Deloitte & Touche LLP",,,,Philadelphia,PA,PENNSYLVANIA,"US Mid Atlantic",10-K,2025-11-10,,"TE Connectivity plc",1385157,"=""TEL""","PARKMORE BUSINESS PARK WEST",PARKMORE,GALWAY,L2,IRELAND,Foreign,,,"=""5065""","Electronic Parts and Equipment, NEC",517212,"Cellular and Other Wireless Telecommunications",34,216,09/24/25,"63,693,991,936",09/26/25,"17,262,000,000","1,842,000,000","3,377,000,000","25,081,000,000"
48798,"Pension and other post-employment benefits","Valuation of Pension Benefit Obligation",575515,09/30/25,11/12/25,2,"Ernst & Young LLP",,,,Chattanooga,TN,TENNESSEE,"US Southeast",10-K,2025-11-13,,"Tennessee Valley Authority",1376986,"=""TVC""","400 WEST SUMMIT HILL DRIVE",,KNOXVILLE,TN,TENNESSEE,"US Southeast",,,"=""4911""","Electric Services",221111,"Hydroelectric Power Generation",34,24,12/01/25,,09/30/25,"13,672,000,000","1,360,000,000",,"60,882,000,000"
48799,"Other investments","Valuation of Alternative Investments",575515,09/30/25,11/12/25,2,"Ernst & Young LLP",,,,Chattanooga,TN,TENNESSEE,"US Southeast",10-K,2025-11-13,,"Tennessee Valley Authority",1376986,"=""TVC""","400 WEST SUMMIT HILL DRIVE",,KNOXVILLE,TN,TENNESSEE,"US Southeast",,,"=""4911""","Electric Services",221111,"Hydroelectric Power Generation",34,24,12/01/25,,09/30/25,"13,672,000,000","1,360,000,000",,"60,882,000,000"
48800,"Asset retirement and environmental obligations","Valuation of Non-Nuclear Asset Retirement Obligations",575515,09/30/25,11/12/25,2,"Ernst & Young LLP",,,,Chattanooga,TN,TENNESSEE,"US Southeast",10-K,2025-11-13,,"Tennessee Valley Authority",1376986,"=""TVC""","400 WEST SUMMIT HILL DRIVE",,KNOXVILLE,TN,TENNESSEE,"US Southeast",,,"=""4911""","Electric Services",221111,"Hydroelectric Power Generation",34,24,12/01/25,,09/30/25,"13,672,000,000","1,360,000,000",,"60,882,000,000"
48871,"Revenue from customer contracts","Revenue Recognition – Certain fixed-price, time-and-materials and cost-plus contracts",575860,09/28/25,11/20/25,1,"PricewaterhouseCoopers LLP",,,,"Los Angeles",CA,CALIFORNIA,"US West",10-K,2025-11-20,,"TETRA TECH INC",831641,"=""TTEK""","3475 EAST FOOTHILL BOULEVARD",,PASADENA,CA,CALIFORNIA,"US West",,,"=""8711""","Engineering Services",541330,"Engineering Services",34,33,09/30/25,"8,771,376,128",09/28/25,"5,442,590,000","247,724,000","-391,249,000","4,282,174,000"
48949,"Allowance for credit losses","Allowance for Credit Losses – Refer to Notes 1 and 5 to the financial statements",576040,09/30/25,11/25/25,3,"Deloitte & Touche LLP",,,,Cleveland,OH,OHIO,"US Midwest",10-K,2025-11-25,,"TFS Financial CORP",1381668,"=""TFSL""","7007 BROADWAY AVENUE",,CLEVELAND,OH,OHIO,"US Midwest",,,"=""6035""","Savings Institutions, Federally Chartered",522110,"Commercial Banking",34,13,10/02/25,"3,733,150,720",09/30/25,"318,974,000","90,959,000",,"17,456,316,000"
47497,"Revenue from customer contracts","Evaluation of estimated costs at completion for revenue recognized over time under select fixed fee contracts",565550,03/31/25,05/22/25,4,"KPMG LLP",,,,Austin,TX,TEXAS,"US Southwest",10-K,2025-05-22,,"Thermon Group Holdings, Inc.",1489096,"=""THR""","7171 SOUTHWEST PARKWAY","BUILDING 300, SUITE 200",AUSTIN,TX,TEXAS,"US Southwest",,,"=""3620""","Electrical Industrial Apparatus",335311,"Power, Distribution, and Specialty Transformer Manufacturing",34,28,03/31/25,"925,827,840",03/31/25,"498,207,000","53,515,000","115,701,000","755,452,000"
48529,Goodwill,"Valuation of Goodwill — Airxcel Reporting Unit — Refer to Notes 1 and 6 to the financial statements",572833,07/31/25,09/24/25,3,"Deloitte & Touche LLP",,,,Chicago,IL,ILLINOIS,"US Midwest",10-K,2025-09-24,,"THOR INDUSTRIES INC",730263,"=""THO""","52700 INDEPENDENCE COURT",,ELKHART,IN,INDIANA,"US Midwest",,,"=""3716""","Motor  Homes",336214,"Travel Trailer and Camper Manufacturing",34,91,07/31/25,"4,789,095,936",07/31/25,"9,579,490,000","258,559,000","1,688,622,000","7,065,284,000"
48065,"Goodwill and intangible assets","Impairment Assessments of Goodwill and Indefinite-lived Intangible Assets related to Cannabis and Beverage Reporting Units",569246,05/31/25,07/28/25,1,"PricewaterhouseCoopers LLP",191,"PricewaterhouseCoopers LLP Chartered Accountants",271,Toronto,A6,ONTARIO,Canada,10-K,2025-07-29,,"Tilray Brands, Inc.",1731348,"=""TLRY""","655 MADISON AVENUE","19TH FLOOR","NEW YORK",NY,"NEW YORK","US Mid Atlantic",,,"=""2833""","Medicinal Chemicals and Botanical Products",325411,"Medicinal and Botanical Manufacturing",34,0,05/31/25,"455,230,048",05/31/25,"821,309,000","-2,181,356,000","737,701,000","2,074,327,000"
46431,Inventory,"Inventories – Valuation of Used Equipment Inventories — Refer to Notes 1 and 5 to the financial statements",560752,01/31/25,04/07/25,3,"Deloitte & Touche LLP",,,,Minneapolis,MN,MINNESOTA,"US Midwest",10-K,2025-04-07,,"Titan Machinery Inc.",1409171,"=""TITN""","644 EAST BEATON DRIVE",,"WEST FARGO",ND,"NORTH DAKOTA","US Midwest",,,"=""5990""","Retail-Retail Stores, NEC",444220,"Nursery, Garden Center, and Farm Supply Stores",34,18,01/29/25,"419,037,536",01/31/25,"2,702,122,000","-36,911,000","504,525,000","1,813,938,000"
46432,Goodwill,"Goodwill Impairment Assessment – Agriculture and Australia Reporting Units – Refer to Notes 1 and 7 to the financial statements",560752,01/31/25,04/07/25,3,"Deloitte & Touche LLP",,,,Minneapolis,MN,MINNESOTA,"US Midwest",10-K,2025-04-07,,"Titan Machinery Inc.",1409171,"=""TITN""","644 EAST BEATON DRIVE",,"WEST FARGO",ND,"NORTH DAKOTA","US Midwest",,,"=""5990""","Retail-Retail Stores, NEC",444220,"Nursery, Garden Center, and Farm Supply Stores",34,18,01/29/25,"419,037,536",01/31/25,"2,702,122,000","-36,911,000","504,525,000","1,813,938,000"
46294,"Deferred income taxes","Income Tax Provision",560408,02/01/25,04/02/25,1,"PricewaterhouseCoopers LLP",,,,Boston,MA,MASSACHUSETTS,"US New England",10-K,2025-04-02,,"TJX COMPANIES INC /DE/",109198,"=""TJX""","770 COCHITUATE RD",,FRAMINGHAM,MA,MASSACHUSETTS,"US New England",,,"=""5651""","Family Clothing Stores",452990,"All Other General Merchandise Stores",34,124,02/03/25,"139,744,083,968",02/01/25,"56,360,000,000","4,864,000,000","8,299,000,000","31,749,000,000"
46236,Inventory,Inventory,560318,02/01/25,04/01/25,1,"PricewaterhouseCoopers LLP",,,,"Los Angeles",CA,CALIFORNIA,"US West",10-K,2025-04-01,,"Torrid Holdings Inc.",1792781,"=""CURV""","18501 E. SAN JOSE AVENUE",,"CITY OF INDUSTRY",CA,CALIFORNIA,"US West",,,"=""5600""","Retail-Apparel & Accessory Stores",448120,"Women's Clothing Stores",34,7,02/03/25,"691,393,344",02/01/25,"1,103,737,000","16,318,000","-199,489,000","488,441,000"
46906,Inventory,Inventory,562353,02/01/25,04/01/25,1,"PricewaterhouseCoopers LLP",,,,"Los Angeles",CA,CALIFORNIA,"US West",ARS,2025-04-23,,"Torrid Holdings Inc.",1792781,"=""CURV""","18501 E. SAN JOSE AVENUE",,"CITY OF INDUSTRY",CA,CALIFORNIA,"US West",,,"=""5600""","Retail-Apparel & Accessory Stores",448120,"Women's Clothing Stores",34,7,02/03/25,"691,393,344",02/01/25,"1,103,737,000","16,318,000","-199,489,000","488,441,000"
47732,"Other contingent liabilities","Liabilities for the costs of recalls and other safety measures",567110,03/31/25,06/18/25,1,"PricewaterhouseCoopers LLP",882,"PricewaterhouseCoopers Japan LLC",2743,Nagoya,M0,JAPAN,Foreign,20-F,2025-06-18,,"TOYOTA MOTOR CORP/",1094517,"=""TM""","1 TOYATA-CHO","AICHI PREFECTURE 471-8571","TOYOTA CITY",M0,JAPAN,Foreign,,,"=""3711""","Motor Vehicles and Passenger Car Bodies",336111,"Automobile Manufacturing",34,177,04/02/25,"238,910,537,728",03/31/25,"321,230,000,000","32,030,000,000","231,120,000,000","625,929,000,000"
47733,"Allowance for credit losses","Allowance for credit losses—Retail finance receivables",567110,03/31/25,06/18/25,1,"PricewaterhouseCoopers LLP",882,"PricewaterhouseCoopers Japan LLC",2743,Nagoya,M0,JAPAN,Foreign,20-F,2025-06-18,,"TOYOTA MOTOR CORP/",1094517,"=""TM""","1 TOYATA-CHO","AICHI PREFECTURE 471-8571","TOYOTA CITY",M0,JAPAN,Foreign,,,"=""3711""","Motor Vehicles and Passenger Car Bodies",336111,"Automobile Manufacturing",34,177,04/02/25,"238,910,537,728",03/31/25,"321,230,000,000","32,030,000,000","231,120,000,000","625,929,000,000"
47623,"Allowance for credit losses","Retail Loan Portfolio Allowance for Credit Losses",566192,03/31/25,06/03/25,1,"PricewaterhouseCoopers LLP",,,,Dallas,TX,TEXAS,"US Southwest",10-K,2025-06-03,,"TOYOTA MOTOR CREDIT CORP",834071,,"6565 HEADQUARTERS DRIVE, W2-3D",,PLANO,TX,TEXAS,"US Southwest",1094517,"TOYOTA MOTOR CORP/","=""6141""","Personal Credit Institutions",522220,"Sales Financing",34,,,,03/31/25,"8,833,000,000","1,712,000,000",,"155,294,000,000"
48776,Goodwill,"Annual assessment of goodwill for impairment",575389,09/30/25,11/12/25,2,"Ernst & Young LLP",,,,Cleveland,OH,OHIO,"US Midwest",10-K,2025-11-12,,"TransDigm Group INC",1260221,"=""TDG""","1350 EUCLID AVENUE","SUITE 1600",CLEVELAND,OH,OHIO,"US Midwest",,,"=""3728""","Aircraft Parts and Auxiliary Equipment, NEC",336413,"Other Aircraft Parts and Auxiliary Equipment Manufacturing",34,"1,318",09/30/25,"74,304,225,280",09/30/25,"8,831,000,000","2,074,000,000","-23,752,000,000","22,909,000,000"
47556,"Deferred income taxes","Realizability of Deferred Tax Assets",565803,03/31/25,05/28/25,2,"Ernst & Young LLP",,,,Philadelphia,PA,PENNSYLVANIA,"US Mid Atlantic",10-K,2025-05-28,,"TRIUMPH GROUP INC",1021162,,"555 E LANCASTER AVENUE","SUITE 400",RADNOR,PA,PENNSYLVANIA,"US Mid Atlantic",,,"=""3720""","Aircraft & Parts",336413,"Other Aircraft Parts and Auxiliary Equipment Manufacturing",34,25,03/31/25,"1,962,214,912",03/31/25,"1,261,962,000","40,874,000","-644,979,000","1,626,928,000"
47557,"Pension and other post-employment benefits","Defined Benefit Pension Obligations",565803,03/31/25,05/28/25,2,"Ernst & Young LLP",,,,Philadelphia,PA,PENNSYLVANIA,"US Mid Atlantic",10-K,2025-05-28,,"TRIUMPH GROUP INC",1021162,,"555 E LANCASTER AVENUE","SUITE 400",RADNOR,PA,PENNSYLVANIA,"US Mid Atlantic",,,"=""3720""","Aircraft & Parts",336413,"Other Aircraft Parts and Auxiliary Equipment Manufacturing",34,25,03/31/25,"1,962,214,912",03/31/25,"1,261,962,000","40,874,000","-644,979,000","1,626,928,000"
48831,"Revenue from customer contracts","Revenue recognition",575682,09/30/25,11/17/25,2,"Ernst & Young LLP",,,,"San Mateo",CA,CALIFORNIA,"US West",10-K,2025-11-17,,"Twist Bioscience Corp",1581280,"=""TWST""","681 GATEWAY BLVD.",,"SOUTH SAN FRANCISCO",CA,CALIFORNIA,"US West",,,"=""2836""","Biological Products, Except Diagnostic Substances",325414,"Biological Product (except Diagnostic) Manufacturing",34,31,10/02/25,"1,851,873,152",09/30/25,"376,572,000","-77,670,000","377,338,000","641,861,000"
48749,Goodwill,"Interim Goodwill Impairment Assessment – Beef Reporting Unit",575274,09/27/25,11/10/25,1,"PricewaterhouseCoopers LLP",,,,Springdale,AR,ARKANSAS,"US Southeast",10-K,2025-11-10,,"TYSON FOODS, INC.",100493,"=""TSN""","2200 DON TYSON PARKWAY",,SPRINGDALE,AR,ARKANSAS,"US Southeast",,,"=""2015""","Poultry Slaughtering and Processing",311612,"Meat Processed from Carcasses",34,54,09/30/25,"15,529,799,680",09/27/25,"54,441,000,000","474,000,000","2,992,000,000","36,658,000,000"
47574,"Insurance contract liabilities","Policy Benefits and Losses, Claims and Loss Expenses Payable – self-insurance liabilities - public liability and third-party property damage claims - refer to note 3 to the financial statements",565924,03/31/25,05/28/25,3,"Deloitte & Touche LLP",,,,Tempe,AZ,ARIZONA,"US Southwest",10-K,2025-05-29,,"U-Haul Holding Co /NV/",4457,"=""UHAL""","5555 KIETZKE LANE STE 100",,RENO,NV,NEVADA,"US West",,,"=""7510""","Services-Auto Rental & Leasing (No Drivers)",532120,"Truck, Utility Trailer, and RV (Recreational Vehicle) Rental and Leasing",34,65,03/31/25,"1,281,565,056",03/31/25,"5,828,665,000","367,090,000",,"20,479,170,000"
48279,Inventory,"Valuation of excess or obsolete inventory",570694,06/30/25,08/22/25,4,"KPMG LLP",,,,"New York",NY,"NEW YORK","US Mid Atlantic",10-K,2025-08-22,,"Ubiquiti Inc.",1511737,"=""UI""","685 THIRD AVENUE, 27TH FLOOR",,"NEW YORK",NY,"NEW YORK","US Mid Atlantic",,,"=""3663""","Radio and Television Broadcasting and Communications Equipment",541512,"Computer Systems Design Services",34,412,06/30/25,"24,901,574,656",06/30/25,"2,573,545,000","711,922,000",,"1,466,451,000"
48885,"Revenue from customer contracts","Sufficiency of audit evidence over revenue from contracts with customers",575933,09/30/25,11/21/25,4,"KPMG LLP",,,,Philadelphia,PA,PENNSYLVANIA,"US Mid Atlantic",10-K,2025-11-21,,"UGI CORP /PA/",884614,"=""UGI""","500 N GULPH RD","P O BOX 858","KING OF PRUSSIA",PA,PENNSYLVANIA,"US Mid Atlantic",,,"=""4932""","Gas and Other Services Combined",221210,"Natural Gas Distribution",34,33,09/30/25,"7,133,473,280",09/30/25,"7,287,000,000","678,000,000","1,597,000,000","15,462,000,000"
45446,"Revenue from customer contracts","Revenue Recognition - Assessment of Terms and Conditions in Certain Contracts",558570,01/31/25,03/24/25,4,"KPMG LLP",,,,"New York",NY,"NEW YORK","US Mid Atlantic",10-K,2025-03-24,,"UiPath, Inc.",1734722,"=""PATH""","ONE VANDERBILT AVENUE","60TH FLOOR","NEW YORK",NY,"NEW YORK","US Mid Atlantic",,,"=""7372""","Prepackaged Software",511210,"Software Publishers",34,14,01/29/25,"6,726,904,832",01/31/25,"1,429,664,000","-73,694,000","1,750,553,000","2,865,270,000"
45675,"Revenue from customer contracts","Loyalty Program",559095,02/01/25,03/27/25,2,"Ernst & Young LLP",,,,Chicago,IL,ILLINOIS,"US Midwest",10-K,2025-03-27,,"Ulta Beauty, Inc.",1403568,"=""ULTA""","1000 REMINGTON BLVD","SUITE 120",BOLINGBROOK,IL,ILLINOIS,"US Midwest",,,"=""5990""","Retail-Retail Stores, NEC",812112,"Beauty Salons",34,408,02/03/25,"18,926,487,552",02/01/25,"11,295,654,000","1,201,118,000","2,477,279,000","6,001,693,000"
47499,"Revenue from customer contracts","Revenue Recognition",565547,03/31/25,05/22/25,1,"PricewaterhouseCoopers LLP",,,,Baltimore,MD,MARYLAND,"US Mid Atlantic",10-K,2025-05-22,,"Under Armour, Inc.",1336917,"=""UAA""","101 PERFORMANCE DRIVE",,BALTIMORE,MD,MARYLAND,"US Mid Atlantic",,,"=""2300""","Apparel & Other Finishd Prods of Fabrics & Similar Matl",315192,"Underwear and Nightwear Knitting Mills",34,7,04/02/25,"1,246,230,016",03/31/25,"5,164,310,000","-201,267,000","1,397,422,000","4,300,871,000"
48296,Inventory,"Evaluation of the net realizable value of raw material and finished goods inventories",570869,06/29/25,08/26/25,4,"KPMG LLP",,,,Winston-Salem,NC,"NORTH CAROLINA","US Southeast",10-K,2025-08-26,,"UNIFI INC",100726,"=""UFI""","7201 WEST FRIENDLY RD","P O BOX 19109",GREENSBORO,NC,"NORTH CAROLINA","US Southeast",,,"=""2200""","Textile Mill Products",313112,"Yarn Texturizing, Throwing, and Twisting Mills",34,5,07/01/25,"92,170,528",06/29/25,"571,344,000","-20,348,000",,"426,868,000"
48691,"Other contingent liabilities","Self-Insured Workers’ Compensation, Vehicles and General Liability Insurance-related Accruals",574636,08/30/25,10/29/25,2,"Ernst & Young LLP",,,,Boston,MA,MASSACHUSETTS,"US New England",10-K,2025-10-29,,"UNIFIRST CORP",717954,"=""UNF""","68 JONSPIN RD",,WILMINGTON,MA,MASSACHUSETTS,"US New England",,,"=""7200""","Services-Personal Services",812331,"Linen Supply",34,177,08/28/25,"2,655,472,128",08/30/25,"2,432,352,000","148,271,000","1,405,380,000","2,778,155,000"
48593,"Pension and other post-employment benefits","Assessment of the value of the defined benefit pension obligation",573395,08/02/25,09/30/25,4,"KPMG LLP",,,,Minneapolis,MN,MINNESOTA,"US Midwest",10-K,2025-10-01,,"UNITED NATURAL FOODS INC",1020859,"=""UNFI""","15 PARK ROW W","STE 302",PROVIDENCE,RI,"RHODE ISLAND","US New England",,,"=""5141""","Groceries, General Line",424490,"Other Grocery and Related Products Merchant Wholesalers",34,26,08/04/25,"1,597,113,088",08/02/25,"31,784,000,000","-118,000,000","956,000,000","7,595,000,000"
47604,"Sales return and allowances","Allowance for Advances to Tobacco Suppliers",565955,03/31/25,05/30/25,2,"Ernst & Young LLP",,,,Richmond,VA,VIRGINIA,"US Mid Atlantic",10-K,2025-05-30,,"UNIVERSAL CORP /VA/",102037,"=""UVV""","9201 FOREST HILL AVENUE","STONY POINT II BUILDING",RICHMOND,VA,VIRGINIA,"US Mid Atlantic",,,"=""5150""","Wholesale-Farm Product Raw Materials",312210,"Tobacco Stemming and Redrying",34,56,04/02/25,"1,373,904,384",03/31/25,"2,947,284,000","95,047,000","1,186,880,000","2,989,552,000"
47605,"Other income taxes","Allowance for Recoverable Value-Added Tax (“VAT”) Credits",565955,03/31/25,05/30/25,2,"Ernst & Young LLP",,,,Richmond,VA,VIRGINIA,"US Mid Atlantic",10-K,2025-05-30,,"UNIVERSAL CORP /VA/",102037,"=""UVV""","9201 FOREST HILL AVENUE","STONY POINT II BUILDING",RICHMOND,VA,VIRGINIA,"US Mid Atlantic",,,"=""5150""","Wholesale-Farm Product Raw Materials",312210,"Tobacco Stemming and Redrying",34,56,04/02/25,"1,373,904,384",03/31/25,"2,947,284,000","95,047,000","1,186,880,000","2,989,552,000"
48960,"Revenue from customer contracts","Revenues - Proprietary Loan Program Revenue Recognition - Refer to Note 2 in the FY 2025 Form 10K",576138,09/30/25,11/26/25,3,"Deloitte & Touche LLP",,,,Tempe,AZ,ARIZONA,"US Southwest",10-K,2025-11-26,,"UNIVERSAL TECHNICAL INSTITUTE INC",1261654,"=""UTI""","20410 NORTH 19TH AVENUE,","SUITE 200",PHOENIX,AZ,ARIZONA,"US Southwest",,,"=""8200""","Services-Educational Services",611519,"Other Technical and Trade Schools",34,31,10/02/25,"1,712,166,784",09/30/25,"835,616,000","63,018,000","282,299,000","826,139,000"
48530,"Long-lived assets","Assessment of impairment indicators of long-lived assets",572822,07/31/25,09/23/25,1,"PricewaterhouseCoopers LLP",191,"PricewaterhouseCoopers LLP Chartered Accountants",271,Vancouver,A1,"BRITISH COLUMBIA",Canada,10-K,2025-09-24,,"URANIUM ENERGY CORP",1334933,"=""UEC""","1830 - 1188 WEST GEORGIA STREET",,VANCOUVER,A1,"BRITISH COLUMBIA",Canada,,,"=""1090""","Metal Mining",212291,"Uranium-Radium-Vanadium Ore Mining",34,9,07/31/25,"3,936,317,440",07/31/25,"66,837,000","-87,656,000",,"1,107,653,000"
46263,"Long-lived assets","Retail Location Asset Impairment — Refer to Note 2 to the financial statements",560266,01/31/25,04/01/25,3,"Deloitte & Touche LLP",,,,Philadelphia,PA,PENNSYLVANIA,"US Mid Atlantic",10-K,2025-04-01,,"URBAN OUTFITTERS INC",912615,"=""URBN""","5000 SOUTH BROAD STREET",,PHILADELPHIA,PA,PENNSYLVANIA,"US Mid Atlantic",,,"=""5651""","Family Clothing Stores",448140,"Family Clothing Stores",34,55,01/29/25,"5,063,245,312",01/31/25,"5,550,666,000","402,462,000",,"4,519,480,000"
47490,"Other intangible assets","Interim Indefinite-Lived Intangible Asset Impairment Analysis – Dickies Trademark",565539,03/29/25,05/22/25,1,"PricewaterhouseCoopers LLP",,,,Greensboro,NC,"NORTH CAROLINA","US Southeast",10-K,2025-05-22,,"V F CORP",103379,"=""VFC""","1551 WEWATTA STREET",,DENVER,CO,COLORADO,"US West",,,"=""2320""","Men's & Boys' Furnishgs, Work Clothg, & Allied Garments",315224,"Men's and Boys' Cut and Sew Trouser, Slack, and Jean Manufacturing",34,16,03/31/25,"6,048,069,632",03/29/25,"9,504,691,000","-189,716,000","-826,734,000","9,377,536,000"
48574,"Business combinations","Fair Value Measurement of the Contingent Consideration",573155,07/31/25,09/29/25,1,"PricewaterhouseCoopers LLP",,,,Denver,CO,COLORADO,"US West",10-K,2025-09-29,,"VAIL RESORTS INC",812011,"=""MTN""","390 INTERLOCKEN CRESCENT","SUITE 1000",BROOMFIELD,CO,COLORADO,"US West",,,"=""7990""","Services-Miscellaneous Amusement & Recreation",713920,"Skiing Facilities",34,150,07/31/25,"5,392,052,736",07/31/25,"2,964,347,000","280,004,000","-1,549,213,000","5,777,885,000"
48906,"Pension and other post-employment benefits","Accounting for defined benefit pension obligation",575913,09/30/25,11/21/25,2,"Ernst & Young LLP",,,,Louisville,KY,KENTUCKY,"US Mid Atlantic",10-K,2025-11-21,,"VALVOLINE INC",1674910,"=""VVV""","100 VALVOLINE WAY","SUITE 100",LEXINGTON,KY,KENTUCKY,"US Mid Atlantic",,,"=""2990""","Miscellaneous Products of Petroleum & Coal",324191,"Petroleum Lubricating Oil and Grease Manufacturing",34,36,10/02/25,"4,585,031,680",09/30/25,"1,710,300,000","210,700,000","-402,000,000","2,670,400,000"
48839,Inventory,"Inventories – Valuation of Excess and Obsolete Inventories — Refer to Note 1 to the financial statements",575755,10/03/25,11/18/25,3,"Deloitte & Touche LLP",,,,"Salt Lake City",UT,UTAH,"US West",10-K,2025-11-18,,"Varex Imaging Corp",1681622,"=""VREX""","1678 S. PIONEER ROAD",,"SALT LAKE CITY",UT,UTAH,"US West",,,"=""3679""","Electronic Components, NEC",334517,"Irradiation Apparatus Manufacturing",34,12,10/01/25,"507,544,992",10/03/25,"844,600,000","-70,300,000","260,200,000","1,107,400,000"
48840,Goodwill,"Goodwill – Medical Reporting Unit – Refer to Notes 1 and 12 of the financial statements",575755,10/03/25,11/18/25,3,"Deloitte & Touche LLP",,,,"Salt Lake City",UT,UTAH,"US West",10-K,2025-11-18,,"Varex Imaging Corp",1681622,"=""VREX""","1678 S. PIONEER ROAD",,"SALT LAKE CITY",UT,UTAH,"US West",,,"=""3679""","Electronic Components, NEC",334517,"Irradiation Apparatus Manufacturing",34,12,10/01/25,"507,544,992",10/03/25,"844,600,000","-70,300,000","260,200,000","1,107,400,000"
45393,"Financial statements and disclosures","Evaluation of the sufficiency of audit evidence over revenue",558502,01/31/25,03/24/25,4,"KPMG LLP",,,,"San Francisco",CA,CALIFORNIA,"US West",10-K,2025-03-24,,"VEEVA SYSTEMS INC",1393052,"=""VEEV""","4280 HACIENDA DRIVE",,PLEASANTON,CA,CALIFORNIA,"US West",,,"=""7372""","Prepackaged Software",511210,"Software Publishers",34,232,01/29/25,"37,713,985,536",01/31/25,"2,746,619,000","714,138,000","5,348,036,000","7,339,756,000"
45908,"Other intangible assets","Indefinite-Lived Intangible Assets – Refer to Notes 2 and 15 to the financial statements",559530,02/01/25,03/28/25,3,"Deloitte & Touche LLP",,,,Indianapolis,IN,INDIANA,"US Midwest",10-K,2025-03-28,,"Vera Bradley, Inc.",1495320,"=""VRA""","12420 STONEBRIDGE ROAD",,ROANOKE,IN,INDIANA,"US Midwest",,,"=""3100""","Leather & Leather Products",448150,"Clothing Accessories Stores",34,4,02/03/25,"99,260,728",02/01/25,"371,967,000","-62,188,000","178,955,000","306,690,000"
45556,"Revenue from customer contracts","Revenue Recognition — Software License Arrangements — Refer to Note 2 to the financial statements",558894,01/31/25,03/26/25,3,"Deloitte & Touche LLP",,,,Jericho,NY,"NEW YORK","US Mid Atlantic",10-K,2025-03-26,,"VERINT SYSTEMS INC",1166388,"=""VRNT""","225 BROADHOLLOW ROAD",,MELVILLE,NY,"NEW YORK","US Mid Atlantic",,,"=""7373""","Computer Integrated Systems Design",541511,"Custom Computer Programming Services",34,25,01/31/25,"1,576,986,240",01/31/25,"909,186,000","82,267,000","-144,102,000","2,290,049,000"
47535,"Revenue from customer contracts","Revenue Recognition – Communication Services Segment",565740,03/31/25,05/23/25,1,"PricewaterhouseCoopers LLP",,,,"San Diego",CA,CALIFORNIA,"US West",10-K,2025-05-27,,"VIASAT INC",797721,"=""VSAT""","6155 EL CAMINO REAL",,CARLSBAD,CA,CALIFORNIA,"US West",,,"=""4899""","Communications Services, NEC",334210,"Telephone Apparatus Manufacturing",34,10,04/02/25,"1,327,353,472",03/31/25,"4,519,571,000","-574,962,000","660,922,000","15,448,784,000"
48164,"Revenue from customer contracts","Revenue Recognition - Network and Service Enablement Reportable Segment",570130,06/28/25,08/11/25,1,"PricewaterhouseCoopers LLP",,,,Phoenix,AZ,ARIZONA,"US Southwest",10-K,2025-08-11,,"VIAVI SOLUTIONS INC.",912093,"=""VIAV""","1445 SOUTH SPECTRUM BLVD.","SUITE 102",CHANDLER,AZ,ARIZONA,"US Southwest",,,"=""3674""","Semiconductors and Related Devices",334413,"Semiconductor and Related Device Manufacturing",34,10,06/30/25,"2,247,993,088",06/28/25,"1,084,300,000","34,800,000","52,900,000","1,993,800,000"
48165,"Business combinations","Acquisition of Inertial Labs – Valuation of Contingent Consideration and Developed Technology Acquired",570130,06/28/25,08/11/25,1,"PricewaterhouseCoopers LLP",,,,Phoenix,AZ,ARIZONA,"US Southwest",10-K,2025-08-11,,"VIAVI SOLUTIONS INC.",912093,"=""VIAV""","1445 SOUTH SPECTRUM BLVD.","SUITE 102",CHANDLER,AZ,ARIZONA,"US Southwest",,,"=""3674""","Semiconductors and Related Devices",334413,"Semiconductor and Related Device Manufacturing",34,10,06/30/25,"2,247,993,088",06/28/25,"1,084,300,000","34,800,000","52,900,000","1,993,800,000"
45370,Inventory,"Reserve for Store Inventory Losses",558379,02/01/25,03/21/25,2,"Ernst & Young LLP",,,,"Grandview Heights",OH,OHIO,"US Midwest",10-K,2025-03-21,,"Victoria's Secret & Co.",1856437,"=""VSCO""","4 LIMITED PARKWAY EAST",,REYNOLDSBURG,OH,OHIO,"US Midwest",,,"=""5621""","Women`s Clothing Stores",448120,"Women's Clothing Stores",34,35,02/03/25,"2,744,679,680",02/01/25,"6,230,000,000","165,000,000","-103,000,000","4,532,000,000"
48616,"Long-lived assets","Assessment of indicators of impairment of long-lived assets",573800,07/26/25,10/09/25,4,"KPMG LLP",,,,"Short Hills",NJ,"NEW JERSEY","US Mid Atlantic",10-K,2025-10-09,,"VILLAGE SUPER MARKET INC",103595,"=""VLGEA""","733 MOUNTAIN AVE",,SPRINGFIELD,NJ,"NEW JERSEY","US Mid Atlantic",,,"=""5411""","Grocery Stores",445110,"Supermarkets and Other Grocery (except Convenience) Stores",34,35,07/28/25,"374,100,576",07/26/25,"2,320,690,000","56,380,000","467,774,000","1,003,711,000"
47268,"Revenue from customer contracts","Revenue Recognition",564174,02/01/25,05/02/25,1,"PricewaterhouseCoopers LLP",,,,"New York",NY,"NEW YORK","US Mid Atlantic",10-K,2025-05-02,,"VINCE HOLDING CORP.",1579157,"=""VNCE""","500 FIFTH AVENUE","20TH FLOOR","NEW YORK",NY,"NEW YORK","US Mid Atlantic",,,"=""5600""","Retail-Apparel & Accessory Stores",448150,"Clothing Accessories Stores",34,3,02/03/25,"43,881,512",02/01/25,"293,452,000","-19,047,000","41,759,000","222,735,000"
48727,"Other contingent liabilities","Assessment of the litigation accrual for class members opting out of the Damages Class settlement in the Interchange Multidistrict Litigation (MDL)",575073,09/30/25,11/06/25,4,"KPMG LLP",,,,"San Francisco",CA,CALIFORNIA,"US West",10-K,2025-11-06,,"VISA INC.",1403161,"=""V""","P.O. BOX 8999",,"SAN FRANCISCO",CA,CALIFORNIA,"US West",,,"=""7389""","Business Services, NEC",522320,"Financial Transactions Processing, Reserve, and Clearinghouse Activities",34,346,10/02/25,"587,659,214,848",09/30/25,"40,000,000,000","20,058,000,000","-9,616,000,000","99,627,000,000"
47646,Goodwill,"Carrying value of cash generating units, including goodwill – Germany",566456,03/31/25,06/03/25,2,"Ernst & Young LLP",57,"Ernst & Young LLP",1438,London,X0,"UNITED KINGDOM",Foreign,20-F,2025-06-06,,"VODAFONE GROUP PUBLIC LTD CO",839923,"=""VOD""","VODAFONE HOUSE","THE CONNECTION",NEWBURY,X0,"UNITED KINGDOM",Foreign,,,"=""4812""","Radiotelephone Communications",517212,"Cellular and Other Wireless Telecommunications",34,9,04/02/25,"26,282,639,360",03/31/25,"40,452,000,000","-4,046,000,000","20,855,000,000","138,829,000,000"
47647,"Deferred income taxes","Recognition and recoverability of deferred tax assets in Luxembourg and the UK",566456,03/31/25,06/03/25,2,"Ernst & Young LLP",57,"Ernst & Young LLP",1438,London,X0,"UNITED KINGDOM",Foreign,20-F,2025-06-06,,"VODAFONE GROUP PUBLIC LTD CO",839923,"=""VOD""","VODAFONE HOUSE","THE CONNECTION",NEWBURY,X0,"UNITED KINGDOM",Foreign,,,"=""4812""","Radiotelephone Communications",517212,"Cellular and Other Wireless Telecommunications",34,9,04/02/25,"26,282,639,360",03/31/25,"40,452,000,000","-4,046,000,000","20,855,000,000","138,829,000,000"
48844,"Allowance for credit losses","Allowance for Loan Losses - Refer to Notes A and E to the financial statements",575760,09/30/25,11/18/25,3,"Deloitte & Touche LLP",,,,Seattle,WA,WASHINGTON,"US West",10-K,2025-11-18,,"WAFD INC",936528,"=""WAFD""","425 PIKE STREET",,SEATTLE,WA,WASHINGTON,"US West",,,"=""6021""","National Commercial Banks",522120,"Savings Institutions",34,30,10/02/25,"2,355,882,496",09/30/25,"717,732,000","226,068,000","2,597,482,000","26,699,699,000"
44910,"Other contingent liabilities",Contingencies,557459,01/31/25,03/14/25,2,"Ernst & Young LLP",,,,Rogers,AR,ARKANSAS,"US Southeast",10-K,2025-03-14,,"Walmart Inc.",104169,"=""WMT""","1 CUSTOMER DRIVE",,BENTONVILLE,AR,ARKANSAS,"US Southeast",,,"=""5331""","Variety Stores",452112,"Discount Department Stores",34,98,01/29/25,"783,255,142,400",01/31/25,"680,985,000,000","19,436,000,000","62,492,000,000","260,823,000,000"
48801,"Depreciation and amortization","Amortization of Production Costs Predominantly Monetized as a Group",575517,09/27/25,11/13/25,1,"PricewaterhouseCoopers LLP",,,,"Los Angeles",CA,CALIFORNIA,"US West",10-K,2025-11-13,,"Walt Disney Co",1744489,"=""DIS""","500 SOUTH BUENA VISTA STREET",,BURBANK,CA,CALIFORNIA,"US West",,,"=""7990""","Services-Miscellaneous Amusement & Recreation",713110,"Amusement and Theme Parks",34,115,09/30/25,"205,069,500,416",09/27/25,"94,425,000,000","12,404,000,000","-4,024,000,000","197,514,000,000"
48874,"Other revenue","Sufficiency of audit evidence over Recorded Music digital revenue",575842,09/30/25,11/20/25,4,"KPMG LLP",,,,"New York",NY,"NEW YORK","US Mid Atlantic",10-K,2025-11-20,,"Warner Music Group Corp.",1319161,"=""WMG""","1633 BROADWAY",,"NEW YORK",NY,"NEW YORK","US Mid Atlantic",,,"=""7900""","Services-Amusement & Recreation Services",512230,"Music Publishers",34,34,09/30/25,"5,003,629,568",09/30/25,"6,707,000,000","365,000,000","-4,293,000,000","9,829,000,000"
48681,"Revenue from customer contracts","Revenue Recognition – Product Sales",574497,08/31/25,10/27/25,1,"PricewaterhouseCoopers LLP",,,,"San Diego",CA,CALIFORNIA,"US West",10-K,2025-10-27,,"WD 40 CO",105132,"=""WDFC""","9715 BUSINESSPARK AVENUE",,"SAN DIEGO",CA,CALIFORNIA,"US West",,,"=""2890""","Miscellaneous Chemical Products",324191,"Petroleum Lubricating Oil and Grease Manufacturing",34,214,09/02/25,"2,890,562,560",08/31/25,"619,985,000","90,994,000","168,586,000","475,809,000"
48187,"Sales return and allowances","Evaluation of sufficiency of audit evidence over certain variable consideration reductions to revenue",570348,06/27/25,08/13/25,4,"KPMG LLP",,,,"Santa Clara",CA,CALIFORNIA,"US West",10-K,2025-08-14,,"WESTERN DIGITAL CORP",106040,"=""WDC""","5601 GREAT OAKS PARKWAY",,"SAN JOSE",CA,CALIFORNIA,"US West",,,"=""3572""","Computer Storage Devices",334112,"Computer Storage Device Manufacturing",34,64,06/26/25,"22,157,264,896",06/27/25,"9,520,000,000","1,889,000,000","1,221,000,000","14,002,000,000"
48188,"Uncertain tax positions","Tax-free determination of the Flash business separation and the debt-for-equity exchange",570348,06/27/25,08/13/25,4,"KPMG LLP",,,,"Santa Clara",CA,CALIFORNIA,"US West",10-K,2025-08-14,,"WESTERN DIGITAL CORP",106040,"=""WDC""","5601 GREAT OAKS PARKWAY",,"SAN JOSE",CA,CALIFORNIA,"US West",,,"=""3572""","Computer Storage Devices",334112,"Computer Storage Device Manufacturing",34,64,06/26/25,"22,157,264,896",06/27/25,"9,520,000,000","1,889,000,000","1,221,000,000","14,002,000,000"
48716,"Allowance for credit losses","Provisions for expected credit losses on loans and credit commitments (ECL)",574948,09/30/25,11/02/25,4,"KPMG LLP",59,KPMG,1020,Sydney,C3,AUSTRALIA,Foreign,20-F,2025-11-04,,"WESTPAC BANKING CORP",719245,"=""WBKCY""","LEVEL 3, 275 KENT STREET",,SYDNEY,C3,AUSTRALIA,Foreign,,,"=""6029""","Commercial Banks, NEC",522110,"Commercial Banking",34,21,07/28/25,"73,302,061,989",09/30/25,"14,835,000,000","4,584,000,000","41,290,000,000","745,832,000,000"
45731,"Long-lived assets","Impairment for Store-level Long-lived Assets — Refer to Note A and L to the financial statements.",559222,02/02/25,03/26/25,3,"Deloitte & Touche LLP",,,,"San Francisco",CA,CALIFORNIA,"US West",10-K,2025-03-27,,"WILLIAMS SONOMA INC",719955,"=""WSM""","3250 VAN NESS AVENUE",,"SAN FRANCISCO",CA,CALIFORNIA,"US West",,,"=""5700""","Retail-Home Furniture, Furnishings & Equipment Stores",442299,"All Other Home Furnishings Stores",34,208,02/04/25,"25,628,176,384",02/02/25,"7,711,541,000","1,125,251,000","2,065,159,000","5,301,607,000"
48661,"Warranty liabilities","Product Warranties – Grand Design Towables – Refer to Note 8 to the financial statements",574233,08/30/25,10/22/25,3,"Deloitte & Touche LLP",,,,Minneapolis,MN,MINNESOTA,"US Midwest",10-K,2025-10-22,,"WINNEBAGO INDUSTRIES INC",107687,"=""WGO""","13200 PIONEER TRAIL",,"EDEN PRAIRIE",MN,MINNESOTA,"US Midwest",,,"=""3716""","Motor  Homes",336213,"Motor Home Manufacturing",34,36,08/31/25,"1,007,440,000",08/30/25,"2,798,200,000","25,700,000","283,600,000","2,154,400,000"
47492,"Revenue from customer contracts","Revenue from fixed-price contracts using the percentage-of-completion method - Refer Notes 2 (iv)(a), 3(xiv)B(i) and 24 to the financial statements.",565544,03/31/25,05/22/25,3,"Deloitte & Touche LLP",16,"Deloitte Haskins & Sells LLP",1180,Bengaluru,K7,INDIA,Foreign,20-F,2025-05-22,,"WIPRO LTD",1123799,"=""WIT""","SARGAPUR ROAD",BANGALORE,KARNATAKA,K7,INDIA,Foreign,,,"=""7371""","Computer Programming Services",541511,"Custom Computer Programming Services",34,3,03/31/25,"32,008,304,640",03/31/25,"10,423,000,000","1,546,000,000","5,567,000,000","15,052,000,000"
48295,Inventory,"Valuation of Inventories – Estimate of Obsolescence Reserves",570873,06/29/25,08/26/25,1,"PricewaterhouseCoopers LLP",,,,Raleigh,NC,"NORTH CAROLINA","US Southeast",10-K,2025-08-26,Yes,"WOLFSPEED, INC.",895419,"=""WOLF""","4600 SILICON DR",,DURHAM,NC,"NORTH CAROLINA","US Southeast",,,"=""3674""","Semiconductors and Related Devices",334412,"Bare Printed Circuit Board Manufacturing",34,1,07/01/25,"122,945,112",06/29/25,"757,600,000","-1,609,200,000","-470,900,000","6,854,400,000"
48944,"Revenue from customer contracts","Point in time and over time revenue recognition and material rights and costs to fulfill a contract – Refer to Notes 1 and 3 to the financial statements",576030,09/30/25,11/25/25,3,"Deloitte & Touche LLP",,,,Denver,CO,COLORADO,"US West",10-K,2025-11-25,,"Woodward, Inc.",108312,"=""WWD""","1000 EAST DRAKE ROAD",,"FORT COLLINS",CO,COLORADO,"US West",,,"=""3620""","Electrical Industrial Apparatus",335314,"Relay and Industrial Control Manufacturing",34,254,10/02/25,"15,253,607,424",09/30/25,"3,567,064,000","442,111,000","1,306,022,000","4,630,143,000"
44678,"Revenue from customer contracts","Revenue Recognition",556924,01/31/25,03/11/25,2,"Ernst & Young LLP",,,,"San Francisco",CA,CALIFORNIA,"US West",10-K,2025-03-11,,"Workday, Inc.",1327811,"=""WDAY""","6110 STONERIDGE MALL ROAD",,PLEASANTON,CA,CALIFORNIA,"US West",,,"=""7374""","Computer Processing and Data Preparation and Processing Services",518210,"Data Processing, Hosting, and Related Services",34,265,01/29/25,"56,795,598,848",01/31/25,"8,446,000,000","526,000,000","5,195,000,000","17,977,000,000"
48930,"Other investments","Evaluation of the evidence pertaining to the existence of the gold holdings",576047,09/30/25,11/25/25,4,"KPMG LLP",,,,"New York",NY,"NEW YORK","US Mid Atlantic",10-K,2025-11-25,,"World Gold Trust",1618181,"=""GLDM""","685 THIRD AVENUE","27TH FLOOR","NEW YORK",NY,"NEW YORK","US Mid Atlantic",,,"=""6221""","Commodity Contracts Brokers and Dealers",523130,"Commodity Contracts Dealing",34,76,10/02/25,"18,648,791,040",09/30/25,,"5,309,224,000",,"20,855,894,000"
48931,"Other investments","Evaluation of the evidence pertaining to the existence of the gold holdings",576046,09/30/25,11/25/25,4,"KPMG LLP",,,,"New York",NY,"NEW YORK","US Mid Atlantic",10-K,2025-11-25,,"World Gold Trust",1618181,"=""GLDM""","685 THIRD AVENUE","27TH FLOOR","NEW YORK",NY,"NEW YORK","US Mid Atlantic",,,"=""6221""","Commodity Contracts Brokers and Dealers",523130,"Commodity Contracts Dealing",34,76,10/02/25,"18,648,791,040",09/30/25,,"5,309,224,000",,"20,855,894,000"
48073,"Equity investments and joint ventures","Sufficiency of audit evidence over equity in net income of unconsolidated affiliates",569424,05/31/25,07/30/25,4,"KPMG LLP",,,,Indianapolis,IN,INDIANA,"US Midwest",10-K,2025-07-30,,"WORTHINGTON ENTERPRISES, INC.",108516,"=""WOR""","200 W. OLD WILSON BRIDGE ROAD",,COLUMBUS,OH,OHIO,"US Midwest",,,"=""3310""","Steel Works, Blast Furnaces & Rolling & Finishing Mills",331111,"Iron and Steel Mills",34,59,06/02/25,"2,942,121,216",05/31/25,"1,153,762,000","96,053,000","370,309,000","1,695,152,000"
48064,"Revenue from customer contracts","Sufficiency of audit evidence over net sales",569248,05/31/25,07/29/25,4,"KPMG LLP",,,,Indianapolis,IN,INDIANA,"US Midwest",10-K,2025-07-29,,"Worthington Steel, Inc.",1968487,"=""WS""","100 OLD WILSON BRIDGE ROAD",,COLUMBUS,OH,OHIO,"US Midwest",,,"=""3310""","Steel Works, Blast Furnaces & Rolling & Finishing Mills",331221,"Rolled Steel Shape Manufacturing",34,26,06/02/25,"1,306,569,088",05/31/25,"3,093,300,000","110,700,000","926,600,000","1,961,800,000"
44792,"Revenue from customer contracts","Revenue Recognition",557330,01/31/25,03/13/25,2,"Ernst & Young LLP",,,,"New York",NY,"NEW YORK","US Mid Atlantic",10-K,2025-03-13,,"Yext, Inc.",1614178,"=""YEXT""","61 NINTH AVENUE",,"NEW YORK",NY,"NEW YORK","US Mid Atlantic",,,"=""7374""","Computer Processing and Data Preparation and Processing Services",518210,"Data Processing, Hosting, and Related Services",34,7,01/29/25,"869,101,248",01/31/25,"420,957,000","-27,948,000","-19,780,000","610,078,000"
44793,"Business combinations","Accounting for the Hearsay Social, Inc. Acquisition",557330,01/31/25,03/13/25,2,"Ernst & Young LLP",,,,"New York",NY,"NEW YORK","US Mid Atlantic",10-K,2025-03-13,,"Yext, Inc.",1614178,"=""YEXT""","61 NINTH AVENUE",,"NEW YORK",NY,"NEW YORK","US Mid Atlantic",,,"=""7374""","Computer Processing and Data Preparation and Processing Services",518210,"Data Processing, Hosting, and Related Services",34,7,01/29/25,"869,101,248",01/31/25,"420,957,000","-27,948,000","-19,780,000","610,078,000"
47067,"Revenue from customer contracts","Revenue Recognition",563014,01/31/25,03/13/25,2,"Ernst & Young LLP",,,,"New York",NY,"NEW YORK","US Mid Atlantic",ARS,2025-04-28,,"Yext, Inc.",1614178,"=""YEXT""","61 NINTH AVENUE",,"NEW YORK",NY,"NEW YORK","US Mid Atlantic",,,"=""7374""","Computer Processing and Data Preparation and Processing Services",518210,"Data Processing, Hosting, and Related Services",34,7,01/29/25,"869,101,248",01/31/25,"420,957,000","-27,948,000","-19,780,000","610,078,000"
47068,"Business combinations","Accounting for the Hearsay Social, Inc. Acquisition",563014,01/31/25,03/13/25,2,"Ernst & Young LLP",,,,"New York",NY,"NEW YORK","US Mid Atlantic",ARS,2025-04-28,,"Yext, Inc.",1614178,"=""YEXT""","61 NINTH AVENUE",,"NEW YORK",NY,"NEW YORK","US Mid Atlantic",,,"=""7374""","Computer Processing and Data Preparation and Processing Services",518210,"Data Processing, Hosting, and Related Services",34,7,01/29/25,"869,101,248",01/31/25,"420,957,000","-27,948,000","-19,780,000","610,078,000"
43722,"Revenue from customer contracts","Sufficiency of Audit Evidence Over Revenue",554497,01/31/25,02/28/25,4,"KPMG LLP",,,,"San Francisco",CA,CALIFORNIA,"US West",10-K,2025-02-28,,"Zoom Communications, Inc.",1585521,"=""ZM""","55 ALMADEN BOULEVARD, 6TH FLOOR",,"SAN JOSE",CA,CALIFORNIA,"US West",,,"=""7370""","Services-Computer Programming, Data Processing, Etc.",511210,"Software Publishers",34,87,01/29/25,"22,855,127,040",01/31/25,"4,665,433,000","1,010,238,000","8,627,789,000","10,988,421,000"
48425,"Revenue from customer contracts","Revenue Recognition – Subscription and Support Revenue",571988,07/31/25,09/11/25,1,"PricewaterhouseCoopers LLP",,,,"San Jose",CA,CALIFORNIA,"US West",10-K,2025-09-11,,"Zscaler, Inc.",1713683,"=""ZS""","120 HOLGER WAY",,"SAN JOSE",CA,CALIFORNIA,"US West",,,"=""7371""","Computer Programming Services",541511,"Custom Computer Programming Services",34,290,07/29/25,"45,162,643,456",07/31/25,"2,673,115,000","-41,478,000","1,334,220,000","6,419,888,000"


"Copyright © 2025 IVES Group, Inc."
"Revenue, market cap, earnings and book value data provided by Morningstar"
