"CAM Key","CAM Topic","CAM Company Title","Audit Opinion Key","Year Ended Date","Signature Date","Auditor Key",Auditor,"Auditor Affiliate Key","Auditor Affiliate","Auditor Affiliate PCAOB","Auditor City","Auditor State Code","Auditor State Name","Auditor State Region",Source,"Source Date","Going Concern",Company,"CIK Code",Ticker,"Bus Street 1","Bus Street 2",City,"State Code","State Name","State Region","Parent CIK","Parent Name","SIC Code","SIC Description","NAICS Code","NAICS Description","Filer Act","Stock Price ($)","Stock Price Date","Market Cap ($)","Financials Date","Revenue ($)","Earnings ($)","Book Value ($)","Assets ($)"
7348,"Revenue from customer contracts","Revenue Recognition	",444898,12/31/20,02/26/21,2,"Ernst & Young LLP",,,,"Redwood City",CA,CALIFORNIA,"US West",10-K,2021-02-26,,"10x Genomics, Inc.",1770787,"=""TXG""","6230 STONERIDGE MALL ROAD",,PLEASANTON,CA,CALIFORNIA,"US West",,,"=""3826""","Laboratory Analytical Instruments",334516,"Analytical Laboratory Instrument Manufacturing",34,142,12/31/20,"12,149,909,504",12/31/20,"298,845,000","-542,731,000",,"929,341,000"
11465,"Revenue from customer contracts","Revenue Recognition— Refer to Note 15 to the financial statements",454848,12/31/20,04/29/21,3,"Deloitte & Touche LLP",499,"Deloitte Touche Tohmatsu Certified Public Accountants LLP",1113,Shanghai,F4,CHINA,Foreign,20-F,2021-04-30,,"111, Inc.",1738906,"=""YI""","3-4/F, NO.295 ZUCHONGZHI ROAD","PUDONG NEW AREA",SHANGHAI,F4,CHINA,Foreign,,,"=""5912""","Drug Stores and Proprietary Stores",446110,"Pharmacies and Drug Stores",34,7,12/29/20,"320,577,696",12/31/20,"1,254,344,000","-69,808,000","194,980,000","462,780,000"
10183,"Allowance for credit losses","Allowance for Credit Losses – Refer to Note 2 to the consolidated financial statements",451129,12/31/20,03/30/21,3,"Deloitte & Touche LLP",,,,Atlanta,GA,GEORGIA,"US Southeast",10-K,2021-03-30,,"1st FRANKLIN FINANCIAL CORP",38723,,"135 E TUGALO ST","P O BOX 880",TOCCOA,GA,GEORGIA,"US Southeast",,,"=""6141""","Personal Credit Institutions",522292,"Real Estate Credit",34,,,,12/31/20,"181,787,312","15,890,262",,"1,013,656,372"
3995,"Long-lived assets","Assessment of impairment of store-level long-lived assets",425799,02/29/20,04/29/20,4,"KPMG LLP",,,,"Short Hills",NJ,"NEW JERSEY","US Mid Atlantic",10-K,2020-04-29,,"20230930-DK-Butterfly-1, Inc.",886158,,"650 LIBERTY AVENUE",,UNION,NJ,"NEW JERSEY","US Mid Atlantic",,,"=""5700""","Retail-Home Furniture, Furnishings & Equipment Stores",442299,"All Other Home Furnishings Stores",34,10,03/02/20,"1,311,503,488",02/29/20,"11,158,580,000","-613,816,000",,"7,790,515,000"
3996,Inventory,"Assessment of the valuation of merchandise inventories",425799,02/29/20,04/29/20,4,"KPMG LLP",,,,"Short Hills",NJ,"NEW JERSEY","US Mid Atlantic",10-K,2020-04-29,,"20230930-DK-Butterfly-1, Inc.",886158,,"650 LIBERTY AVENUE",,UNION,NJ,"NEW JERSEY","US Mid Atlantic",,,"=""5700""","Retail-Home Furniture, Furnishings & Equipment Stores",442299,"All Other Home Furnishings Stores",34,10,03/02/20,"1,311,503,488",02/29/20,"11,158,580,000","-613,816,000",,"7,790,515,000"
6789,"Deferred and capitalized costs","Assessment of capitalized technology costs incurred on software development projects",444106,12/31/20,02/25/21,4,"KPMG LLP",,,,McLean,VA,VIRGINIA,"US Mid Atlantic",10-K,2021-02-25,,"2U, LLC",1459417,,"7900 HARKINS ROAD",,LANHAM,MD,MARYLAND,"US Mid Atlantic",,,"=""7372""","Prepackaged Software",511210,"Software Publishers",34,40,12/29/20,"2,856,809,472",12/31/20,"774,533,000","-216,484,000","212,390,000","1,544,264,000"
4975,"Other contingent liabilities","Legal Proceedings Contingencies",440864,12/31/20,02/04/21,1,"PricewaterhouseCoopers LLP",,,,Minneapolis,MN,MINNESOTA,"US Midwest",10-K,2021-02-04,,"3M CO",66740,"=""MMM""","3M CENTER","BLDG. 220-9E-02","ST PAUL",MN,MINNESOTA,"US Midwest",,,"=""3841""","Surgical and Medical Instruments and Apparatus",322222,"Coated and Laminated Paper Manufacturing",34,175,12/31/20,"84,432,330,752",12/31/20,"32,184,000,000","5,384,000,000","-6,770,000,000","47,344,000,000"
11220,"Other investments","Valuation of the Available-for-Sale Debt Security in Golden Finance",453713,12/31/20,04/23/21,1,"PricewaterhouseCoopers LLP",94,"PricewaterhouseCoopers Zhong Tian LLP",1424,Shanghai,F4,CHINA,Foreign,20-F,2021-04-23,,"51JOB, INC.",1295484,,"TOWER T6, CRYSTAL PLAZA, JIANG YAO ROAD",PUDONG,SHANGHAI,F4,CHINA,Foreign,,,"=""7361""","Employment Agencies",561310,"Employment Placement Agencies",34,70,12/31/20,"4,718,466,048",12/31/20,"564,077,000","167,784,000","1,737,504,000","2,396,966,000"
8383,"Balance sheet classification of debt and equity","Exchange Offer – Refer to Notes 2, 3, and 5 to the financial statements",446271,12/31/20,03/04/21,3,"Deloitte & Touche LLP",,,,Chicago,IL,ILLINOIS,"US Midwest",10-K,2021-03-04,,"A. M. Castle & Co.",18172,"=""CTAM""","1420 KENSINGTON ROAD","SUITE 220","OAK BROOK",IL,ILLINOIS,"US Midwest",,,"=""5051""","Metals Service Centers and Offices",423510,"Metal Service Centers and Other Metal Merchant Wholesalers",34,3,12/31/20,"22,055,200",12/31/20,"368,253,000","-40,660,000","-22,680,000","289,597,000"
4344,Inventory,"Assessment of the write-down of inventories",429723,05/31/20,07/21/20,4,"KPMG LLP",,,,Chicago,IL,ILLINOIS,"US Midwest",10-K,2020-07-21,,"AAR CORP",1750,"=""AIR""","1100 N WOOD DALE RD",,"WOOD DALE",IL,ILLINOIS,"US Midwest",,,"=""3720""","Aircraft & Parts",334613,"Magnetic and Optical Recording Media Manufacturing",34,20,05/31/20,"707,913,536",05/31/20,"2,072,000,000","4,400,000","780,900,000","2,079,000,000"
4345,"Revenue from customer contracts","Evaluation of the key inputs and assumptions used in the estimation of costs at completion of the performance obligations",429723,05/31/20,07/21/20,4,"KPMG LLP",,,,Chicago,IL,ILLINOIS,"US Midwest",10-K,2020-07-21,,"AAR CORP",1750,"=""AIR""","1100 N WOOD DALE RD",,"WOOD DALE",IL,ILLINOIS,"US Midwest",,,"=""3720""","Aircraft & Parts",334613,"Magnetic and Optical Recording Media Manufacturing",34,20,05/31/20,"707,913,536",05/31/20,"2,072,000,000","4,400,000","780,900,000","2,079,000,000"
6088,"Other contingent liabilities","Estimated claims liabilities	",443057,12/31/20,02/23/21,2,"Ernst & Young LLP",,,,Atlanta,GA,GEORGIA,"US Southeast",10-K,2021-02-23,,"Aaron's Company, Inc.",1821393,,"400 GALLERIA PARKWAY SE, SUITE 300",,ATLANTA,GA,GEORGIA,"US Southeast",,,"=""7359""","Equipment Rental and Leasing, NEC",532210,"Consumer Electronics and Appliances Rental",34,19,12/31/20,"648,525,120",12/31/20,"1,734,919,000","-265,912,000","694,659,000","1,353,457,000"
6089,Leases,"Allowance for lease merchandise write-offs",443057,12/31/20,02/23/21,2,"Ernst & Young LLP",,,,Atlanta,GA,GEORGIA,"US Southeast",10-K,2021-02-23,,"Aaron's Company, Inc.",1821393,,"400 GALLERIA PARKWAY SE, SUITE 300",,ATLANTA,GA,GEORGIA,"US Southeast",,,"=""7359""","Equipment Rental and Leasing, NEC",532210,"Consumer Electronics and Appliances Rental",34,19,12/31/20,"648,525,120",12/31/20,"1,734,919,000","-265,912,000","694,659,000","1,353,457,000"
7618,"Revenue from customer contracts","Revenue recognition for long-term fixed price contracts using the percentage-of-completion method ",443977,12/31/20,02/25/21,4,"KPMG LLP",288,"KPMG AG",3240,Zurich,V8,SWITZERLAND,Foreign,20-F,2021-02-26,,"ABB LTD",1091587,"=""ABBNY""","PO BOX 8131",*,ZURICH,V8,SWITZERLAND,Foreign,,,"=""3613""","Switchgear and Switchboard Apparatus",335311,"Power, Distribution, and Specialty Transformer Manufacturing",34,28,12/31/20,"56,782,123,008",12/31/20,"26,134,000,000","5,146,000,000","2,757,000,000","41,088,000,000"
7619,"Other income taxes","Valuation of unrecognized tax benefits related to transfer pricing",443977,12/31/20,02/25/21,4,"KPMG LLP",288,"KPMG AG",3240,Zurich,V8,SWITZERLAND,Foreign,20-F,2021-02-26,,"ABB LTD",1091587,"=""ABBNY""","PO BOX 8131",*,ZURICH,V8,SWITZERLAND,Foreign,,,"=""3613""","Switchgear and Switchboard Apparatus",335311,"Power, Distribution, and Specialty Transformer Manufacturing",34,28,12/31/20,"56,782,123,008",12/31/20,"26,134,000,000","5,146,000,000","2,757,000,000","41,088,000,000"
7620,Goodwill,"Valuation of goodwill for the Machine Automation reporting unit",443977,12/31/20,02/25/21,4,"KPMG LLP",288,"KPMG AG",3240,Zurich,V8,SWITZERLAND,Foreign,20-F,2021-02-26,,"ABB LTD",1091587,"=""ABBNY""","PO BOX 8131",*,ZURICH,V8,SWITZERLAND,Foreign,,,"=""3613""","Switchgear and Switchboard Apparatus",335311,"Power, Distribution, and Specialty Transformer Manufacturing",34,28,12/31/20,"56,782,123,008",12/31/20,"26,134,000,000","5,146,000,000","2,757,000,000","41,088,000,000"
7621,"Equity investments and joint ventures","Valuation of the retained noncontrolling interest in the Power Grids business",443977,12/31/20,02/25/21,4,"KPMG LLP",288,"KPMG AG",3240,Zurich,V8,SWITZERLAND,Foreign,20-F,2021-02-26,,"ABB LTD",1091587,"=""ABBNY""","PO BOX 8131",*,ZURICH,V8,SWITZERLAND,Foreign,,,"=""3613""","Switchgear and Switchboard Apparatus",335311,"Power, Distribution, and Specialty Transformer Manufacturing",34,28,12/31/20,"56,782,123,008",12/31/20,"26,134,000,000","5,146,000,000","2,757,000,000","41,088,000,000"
5842,"Other income taxes","Income taxes – Unrecognized tax benefits",442771,12/31/20,02/19/21,2,"Ernst & Young LLP",,,,Chicago,IL,ILLINOIS,"US Midwest",10-K,2021-02-19,,"ABBOTT LABORATORIES",1800,"=""ABT""","100 ABBOTT PARK ROAD",,"ABBOTT PARK",IL,ILLINOIS,"US Midwest",,,"=""2834""","Pharmaceutical Preparations",325412,"Pharmaceutical Preparation Manufacturing",34,109,12/31/20,"193,932,001,280",12/31/20,"34,608,000,000","4,495,000,000","-5,744,000,000","72,548,000,000"
5814,"Sales return and allowances","Sales rebate accruals for Medicaid, Medicare and managed care programs	",442621,12/31/20,02/19/21,2,"Ernst & Young LLP",,,,Chicago,IL,ILLINOIS,"US Midwest",10-K,2021-02-19,,"AbbVie Inc.",1551152,"=""ABBV""","1 NORTH WAUKEGAN ROAD",,"NORTH CHICAGO",IL,ILLINOIS,"US Midwest",,,"=""2834""","Pharmaceutical Preparations",325412,"Pharmaceutical Preparation Manufacturing",34,107,12/31/20,"189,133,979,648",12/31/20,"45,804,000,000","4,616,000,000","-102,924,000,000","150,565,000,000"
5815,"Business combinations","Valuation of contingent consideration	",442621,12/31/20,02/19/21,2,"Ernst & Young LLP",,,,Chicago,IL,ILLINOIS,"US Midwest",10-K,2021-02-19,,"AbbVie Inc.",1551152,"=""ABBV""","1 NORTH WAUKEGAN ROAD",,"NORTH CHICAGO",IL,ILLINOIS,"US Midwest",,,"=""2834""","Pharmaceutical Preparations",325412,"Pharmaceutical Preparation Manufacturing",34,107,12/31/20,"189,133,979,648",12/31/20,"45,804,000,000","4,616,000,000","-102,924,000,000","150,565,000,000"
5816,"Business combinations","Accounting for Allergan plc acquisition – Valuation of intangible assets	",442621,12/31/20,02/19/21,2,"Ernst & Young LLP",,,,Chicago,IL,ILLINOIS,"US Midwest",10-K,2021-02-19,,"AbbVie Inc.",1551152,"=""ABBV""","1 NORTH WAUKEGAN ROAD",,"NORTH CHICAGO",IL,ILLINOIS,"US Midwest",,,"=""2834""","Pharmaceutical Preparations",325412,"Pharmaceutical Preparation Manufacturing",34,107,12/31/20,"189,133,979,648",12/31/20,"45,804,000,000","4,616,000,000","-102,924,000,000","150,565,000,000"
5817,"Business combinations","Accounting for Allergan plc acquisition – Unrecognized tax benefits	",442621,12/31/20,02/19/21,2,"Ernst & Young LLP",,,,Chicago,IL,ILLINOIS,"US Midwest",10-K,2021-02-19,,"AbbVie Inc.",1551152,"=""ABBV""","1 NORTH WAUKEGAN ROAD",,"NORTH CHICAGO",IL,ILLINOIS,"US Midwest",,,"=""2834""","Pharmaceutical Preparations",325412,"Pharmaceutical Preparation Manufacturing",34,107,12/31/20,"189,133,979,648",12/31/20,"45,804,000,000","4,616,000,000","-102,924,000,000","150,565,000,000"
3713,"Long-lived assets","Impairment of Long-Lived Assets - Stores",423497,02/01/20,03/31/20,1,"PricewaterhouseCoopers LLP",,,,Columbus,OH,OHIO,"US Midwest",10-K,2020-03-31,,"ABERCROMBIE & FITCH CO /DE/",1018840,"=""ANF""","6301 FITCH PATH",,"NEW ALBANY",OH,OHIO,"US Midwest",,,"=""5651""","Family Clothing Stores",448140,"Family Clothing Stores",34,16,02/03/20,"1,027,186,368",02/01/20,"3,623,073,000","39,358,000",,"3,549,665,000"
3714,"Policy changes","Adoption of the Leases Accounting Standard - Impairment of right-of-use assets for stores",423497,02/01/20,03/31/20,1,"PricewaterhouseCoopers LLP",,,,Columbus,OH,OHIO,"US Midwest",10-K,2020-03-31,,"ABERCROMBIE & FITCH CO /DE/",1018840,"=""ANF""","6301 FITCH PATH",,"NEW ALBANY",OH,OHIO,"US Midwest",,,"=""5651""","Family Clothing Stores",448140,"Family Clothing Stores",34,16,02/03/20,"1,027,186,368",02/01/20,"3,623,073,000","39,358,000",,"3,549,665,000"
4133,"Other investments","Valuation of investments in medical device companies – Refer to Note 8, Goodwill, In-Process Research & Development and Other Assets – Other Assets",426974,03/31/20,05/21/20,3,"Deloitte & Touche LLP",,,,Boston,MA,MASSACHUSETTS,"US New England",10-K,2020-05-21,,"ABIOMED INC",815094,,"22 CHERRY HILL DR",,DANVERS,MA,MASSACHUSETTS,"US New England",,,"=""3841""","Surgical and Medical Instruments and Apparatus",339112,"Surgical and Medical Instrument Manufacturing",34,145,03/31/20,"6,533,460,992",03/31/20,"840,883,000","203,009,000","1,027,584,000","1,216,462,000"
4853,"Other contingent liabilities","Evaluation of self-insurance liabilities",437421,10/31/20,12/17/20,4,"KPMG LLP",,,,"New York",NY,"NEW YORK","US Mid Atlantic",10-K,2020-12-17,,"ABM INDUSTRIES INC /DE/",771497,"=""ABM""","ONE LIBERTY PLAZA","7TH FLOOR","NEW YORK",NY,"NEW YORK","US Mid Atlantic",,,"=""7340""","Services-To Dwellings & Other Buildings",561720,"Janitorial Services",34,35,10/31/20,"2,317,496,064",10/31/20,"5,987,600,000","300,000","-410,600,000","3,777,000,000"
4854,Goodwill,"Evaluation of the goodwill impairment charge for the Aviation and Education reporting units",437421,10/31/20,12/17/20,4,"KPMG LLP",,,,"New York",NY,"NEW YORK","US Mid Atlantic",10-K,2020-12-17,,"ABM INDUSTRIES INC /DE/",771497,"=""ABM""","ONE LIBERTY PLAZA","7TH FLOOR","NEW YORK",NY,"NEW YORK","US Mid Atlantic",,,"=""7340""","Services-To Dwellings & Other Buildings",561720,"Janitorial Services",34,35,10/31/20,"2,317,496,064",10/31/20,"5,987,600,000","300,000","-410,600,000","3,777,000,000"
7928,"Other investments","Evaluation of the Evidence Pertaining to the Existence of the Gold Holdings",445118,12/31/20,02/26/21,4,"KPMG LLP",,,,"New York",NY,"NEW YORK","US Mid Atlantic",10-K,2021-03-01,,"abrdn Gold ETF Trust",1450923,"=""SGOL""","C/O ABRDN","1900 MARKET STREET, SUITE 200",PHILADELPHIA,PA,PENNSYLVANIA,"US Mid Atlantic",,,"=""6221""","Commodity Contracts Brokers and Dealers",525990,"Other Financial Vehicles",34,18,12/29/20,"2,667,461,888",12/31/20,,"363,748,000",,"2,652,891,000"
7858,"Other investments","Evaluation of the Evidence Pertaining to the Existence of the Palladium Holdings",445131,12/31/20,02/26/21,4,"KPMG LLP",,,,"New York",NY,"NEW YORK","US Mid Atlantic",10-K,2021-03-01,,"abrdn Palladium ETF Trust",1459862,"=""PALL""","C/O ABRDN","1900 MARKET STREET, SUITE 200",PHILADELPHIA,PA,PENNSYLVANIA,"US Mid Atlantic",,,"=""6221""","Commodity Contracts Brokers and Dealers",523991,"Trust, Fiduciary, and Custody Activities",34,218,12/29/20,"371,024,992",12/31/20,,"60,608,000",,"356,424,000"
8121,"Other investments","Evaluation of the Evidence Pertaining to the Existence of the Platinum Holdings",445128,12/31/20,02/26/21,4,"KPMG LLP",,,,"New York",NY,"NEW YORK","US Mid Atlantic",10-K,2021-03-01,,"abrdn Platinum ETF Trust",1460235,"=""PPLT""","C/O ABRDN","1900 MARKET STREET, SUITE 200",PHILADELPHIA,PA,PENNSYLVANIA,"US Mid Atlantic",,,"=""6221""","Commodity Contracts Brokers and Dealers",523991,"Trust, Fiduciary, and Custody Activities",34,99,12/29/20,"1,326,064,000",12/31/20,,"174,917,000",,"1,330,272,000"
7854,"Other investments","Evaluation of the Evidence Pertaining to the Existence of the Bullion Holdings",445132,12/31/20,02/26/21,4,"KPMG LLP",,,,"New York",NY,"NEW YORK","US Mid Atlantic",10-K,2021-03-01,,"abrdn Precious Metals Basket ETF Trust",1483386,"=""GLTR""","C/O ABRDN","1900 MARKET STREET, SUITE 200",PHILADELPHIA,PA,PENNSYLVANIA,"US Mid Atlantic",,,"=""6221""","Commodity Contracts Brokers and Dealers",523920,"Portfolio Management",34,97,12/29/20,"793,646,976",12/31/20,,"141,534,000",,"842,282,000"
7981,"Other investments","Evaluation of the Evidence Pertaining to the Existence of the Silver Holdings",445124,12/31/20,02/26/21,4,"KPMG LLP",,,,"New York",NY,"NEW YORK","US Mid Atlantic",10-K,2021-03-01,,"abrdn Silver ETF Trust",1450922,"=""SIVR""","C/O ABRDN","1900 MARKET STREET, SUITE 200",PHILADELPHIA,PA,PENNSYLVANIA,"US Mid Atlantic",,,"=""6221""","Commodity Contracts Brokers and Dealers",523991,"Trust, Fiduciary, and Custody Activities",34,25,12/29/20,"855,900,032",12/31/20,,"261,212,000",,"863,884,000"
8024,"Other contingent liabilities","Legal Contingencies - Refer to Notes 8 and 13 to the financial statements",445126,12/31/20,03/01/21,3,"Deloitte & Touche LLP",,,,Boston,MA,MASSACHUSETTS,"US New England",10-K,2021-03-01,,"Acacia Communications, Inc.",1651235,,"THREE MILL AND MAIN PLACE","SUITE 400",MAYNARD,MA,MASSACHUSETTS,"US New England",,,"=""3674""","Semiconductors and Related Devices",334413,"Semiconductor and Related Device Manufacturing",34,,,,12/31/20,"583,451,000","90,391,000",,"861,764,000"
8025,"Uncertain tax positions","Income Taxes: Uncertain Tax Positions - Refer to Note 14 to the financial statements",445126,12/31/20,03/01/21,3,"Deloitte & Touche LLP",,,,Boston,MA,MASSACHUSETTS,"US New England",10-K,2021-03-01,,"Acacia Communications, Inc.",1651235,,"THREE MILL AND MAIN PLACE","SUITE 400",MAYNARD,MA,MASSACHUSETTS,"US New England",,,"=""3674""","Semiconductors and Related Devices",334413,"Semiconductor and Related Device Manufacturing",34,,,,12/31/20,"583,451,000","90,391,000",,"861,764,000"
7301,"Revenue from customer contracts","Revenue Recognition",444824,12/31/20,02/26/21,2,"Ernst & Young LLP",,,,Nashville,TN,TENNESSEE,"US Southeast",10-K,2021-02-26,,"Acadia Healthcare Company, Inc.",1520697,"=""ACHC""","6100 TOWER CIRCLE","SUITE 1000",FRANKLIN,TN,TENNESSEE,"US Southeast",,,"=""8093""","Specialty Outpatient Facilities, NEC",623220,"Residential Mental Health and Substance Abuse Facilities",34,50,12/31/20,"4,424,105,984",12/31/20,"2,089,929,000","-672,132,000","-219,028,000","6,499,362,000"
7302,Goodwill,"Valuation of Goodwill",444824,12/31/20,02/26/21,2,"Ernst & Young LLP",,,,Nashville,TN,TENNESSEE,"US Southeast",10-K,2021-02-26,,"Acadia Healthcare Company, Inc.",1520697,"=""ACHC""","6100 TOWER CIRCLE","SUITE 1000",FRANKLIN,TN,TENNESSEE,"US Southeast",,,"=""8093""","Specialty Outpatient Facilities, NEC",623220,"Residential Mental Health and Substance Abuse Facilities",34,50,12/31/20,"4,424,105,984",12/31/20,"2,089,929,000","-672,132,000","-219,028,000","6,499,362,000"
7080,"Sales return and allowances","Allowance for Medicare Part D rebates",443548,12/31/20,02/24/21,2,"Ernst & Young LLP",,,,"San Diego",CA,CALIFORNIA,"US West",10-K,2021-02-25,,"ACADIA PHARMACEUTICALS INC",1070494,"=""ACAD""","12830 EL CAMINO REAL","SUITE 400","SAN DIEGO",CA,CALIFORNIA,"US West",,,"=""2834""","Pharmaceutical Preparations",325412,"Pharmaceutical Preparation Manufacturing",34,53,12/31/20,"8,534,235,136",12/31/20,"441,755,000","-281,584,000","625,901,000","782,616,000"
8141,"Deferred and stock-based compensation","Assessment of the fair value measurement of the cash-settled affiliate awards liability",445036,12/31/20,03/01/21,4,"KPMG LLP",,,,Boston,MA,MASSACHUSETTS,"US New England",10-K,2021-03-01,,"Acadian Asset Management Inc.",1748824,"=""AAMI""","200 STATE STREET","SUITE 601A",BOSTON,MA,MASSACHUSETTS,"US New England",,,"=""6282""","Investment Advice",523930,"Investment Advice",34,19,12/29/20,"1,516,222,720",12/31/20,"471,000,000","286,700,000","61,900,000","1,379,200,000"
8275,"Property, plant and equipment","Instruments in Inventory and Property and Equipment Valuation",445595,12/31/20,03/01/21,2,"Ernst & Young LLP",,,,Phoenix,AZ,ARIZONA,"US Southwest",10-K,2021-03-02,,"Accelerate Diagnostics, Inc",727207,"=""AXDXQ""","3950 S. COUNTRY CLUB ROAD #470","BUILDING 3-307",TUCSON,AZ,ARIZONA,"US Southwest",,,"=""3826""","Laboratory Analytical Instruments",511210,"Software Publishers",34,8,12/31/20,"436,668,096",12/31/20,"11,165,000","-78,208,000",,"93,425,000"
6777,"Research and development expenses","Accrued and Prepaid Clinical Trial Expenses",444111,12/31/20,02/25/21,2,"Ernst & Young LLP",,,,Boston,MA,MASSACHUSETTS,"US New England",10-K,2021-02-25,,"ACCELERON PHARMA INC",1280600,,"128 SIDNEY STREET",,CAMBRIDGE,MA,MASSACHUSETTS,"US New England",,,"=""2836""","Biological Products, Except Diagnostic Substances",325414,"Biological Product (except Diagnostic) Manufacturing",34,128,12/31/20,"7,725,512,192",12/31/20,"92,523,000","-166,030,000",,"932,337,000"
4580,"Revenue from customer contracts","Estimated costs to complete certain technology integration consulting services contracts",434322,08/31/20,10/22/20,4,"KPMG LLP",,,,Chicago,IL,ILLINOIS,"US Midwest",10-K,2020-10-22,,"Accenture plc",1467373,"=""ACN""","1 GRAND CANAL SQUARE","GRAND CANAL HARBOUR",DUBLIN,L2,IRELAND,Foreign,,,"=""7389""","Business Services, NEC",541611,"Administrative Management and General Management Consulting Services",34,240,08/31/20,"152,155,340,800",08/31/20,"44,327,039,000","5,107,839,000","9,290,716,000","37,078,593,000"
4581,"Uncertain tax positions","Unrecognized tax benefits",434322,08/31/20,10/22/20,4,"KPMG LLP",,,,Chicago,IL,ILLINOIS,"US Midwest",10-K,2020-10-22,,"Accenture plc",1467373,"=""ACN""","1 GRAND CANAL SQUARE","GRAND CANAL HARBOUR",DUBLIN,L2,IRELAND,Foreign,,,"=""7389""","Business Services, NEC",541611,"Administrative Management and General Management Consulting Services",34,240,08/31/20,"152,155,340,800",08/31/20,"44,327,039,000","5,107,839,000","9,290,716,000","37,078,593,000"
7179,Inventory,"Evaluation of the write-down of certain finished goods inventory for obsolete and slow-moving items",444643,12/31/20,02/26/21,4,"KPMG LLP",,,,Chicago,IL,ILLINOIS,"US Midwest",10-K,2021-02-26,,"ACCO BRANDS Corp",712034,"=""ACCO""","FOUR CORPORATE DRIVE",,"LAKE ZURICH",IL,ILLINOIS,"US Midwest",,,"=""2780""","Blankbooks, Looseleaf Binders & Bookbindg & Relatd Work",323118,"Blankbook, Looseleaf Binders, and Devices Manufacturing",34,8,12/31/20,"802,264,704",12/31/20,"1,655,200,000","62,000,000","-1,061,700,000","3,048,700,000"
7180,"Business combinations","Assessment of the fair value of acquired customer relationships and vendor relationships",444643,12/31/20,02/26/21,4,"KPMG LLP",,,,Chicago,IL,ILLINOIS,"US Midwest",10-K,2021-02-26,,"ACCO BRANDS Corp",712034,"=""ACCO""","FOUR CORPORATE DRIVE",,"LAKE ZURICH",IL,ILLINOIS,"US Midwest",,,"=""2780""","Blankbooks, Looseleaf Binders & Bookbindg & Relatd Work",323118,"Blankbook, Looseleaf Binders, and Devices Manufacturing",34,8,12/31/20,"802,264,704",12/31/20,"1,655,200,000","62,000,000","-1,061,700,000","3,048,700,000"
10808,Inventory,"Evaluation of the write-down of certain finished goods inventory for obsolete and slow-moving items",452524,12/31/20,02/26/21,4,"KPMG LLP",,,,Chicago,IL,ILLINOIS,"US Midwest",10-K/A,2021-04-12,,"ACCO BRANDS Corp",712034,"=""ACCO""","FOUR CORPORATE DRIVE",,"LAKE ZURICH",IL,ILLINOIS,"US Midwest",,,"=""2780""","Blankbooks, Looseleaf Binders & Bookbindg & Relatd Work",323118,"Blankbook, Looseleaf Binders, and Devices Manufacturing",34,8,12/31/20,"802,264,704",12/31/20,"1,655,200,000","62,000,000","-1,061,700,000","3,048,700,000"
10809,"Business combinations","Assessment of the fair value of acquired customer relationships and vendor relationships",452524,12/31/20,02/26/21,4,"KPMG LLP",,,,Chicago,IL,ILLINOIS,"US Midwest",10-K/A,2021-04-12,,"ACCO BRANDS Corp",712034,"=""ACCO""","FOUR CORPORATE DRIVE",,"LAKE ZURICH",IL,ILLINOIS,"US Midwest",,,"=""2780""","Blankbooks, Looseleaf Binders & Bookbindg & Relatd Work",323118,"Blankbook, Looseleaf Binders, and Devices Manufacturing",34,8,12/31/20,"802,264,704",12/31/20,"1,655,200,000","62,000,000","-1,061,700,000","3,048,700,000"
7877,"Other liabilities and provisions","Valuation of Future Tranche Right Liability",445400,12/31/20,03/01/21,2,"Ernst & Young LLP",,,,Philadelphia,PA,PENNSYLVANIA,"US Mid Atlantic",10-K,2021-03-01,,"Aceragen, Inc.",861838,,"505 EAGLEVIEW BOULEVARD","SUITE 212",EXTON,PA,PENNSYLVANIA,"US Mid Atlantic",,,"=""2836""","Biological Products, Except Diagnostic Substances",325414,"Biological Product (except Diagnostic) Manufacturing",34,4,12/29/20,"133,953,000",12/31/20,,"-112,662,000",,"42,399,000"
8904,"Going concern",Liquidity,448382,12/31/20,03/11/21,1,"PricewaterhouseCoopers LLP",191,"PricewaterhouseCoopers LLP Chartered Accountants",271,Vancouver,A1,"BRITISH COLUMBIA",Canada,10-K,2021-03-11,,"ACHIEVE LIFE SCIENCES, INC.",949858,"=""ACHV""","22722 29TH DR. SE","SUITE 100",SEATTLE,WA,WASHINGTON,"US West",,,"=""2835""","In Vitro and In Vivo Diagnostic Substances",325412,"Pharmaceutical Preparation Manufacturing",34,8,12/31/20,"49,505,052",12/31/20,,"-14,730,000","34,388,000","40,298,000"
6611,"Revenue from customer contracts","Revenue Recognition - Refer to Note 2 to the financial statements",443734,12/31/20,02/25/21,3,"Deloitte & Touche LLP",,,,Omaha,NE,NEBRASKA,"US Midwest",10-K,2021-02-25,,"ACI WORLDWIDE, INC.",935036,"=""ACIW""","6060 COVENTRY DRIVE",,ELKHORN,NE,NEBRASKA,"US Midwest",,,"=""7372""","Prepackaged Software",511210,"Software Publishers",34,38,12/31/20,"4,500,621,312",12/31/20,"1,294,322,000","72,660,000","-592,068,000","3,386,903,000"
6940,"Business combinations","Fair Value of Contingent Consideration Liability
",443771,12/31/20,02/25/21,1,"PricewaterhouseCoopers LLP",,,,Philadelphia,PA,PENNSYLVANIA,"US Mid Atlantic",10-K,2021-02-25,,"Aclaris Therapeutics, Inc.",1557746,"=""ACRS""","701 LEE ROAD","SUITE 103",WAYNE,PA,PENNSYLVANIA,"US Mid Atlantic",,,"=""2834""","Pharmaceutical Preparations",325412,"Pharmaceutical Preparation Manufacturing",34,6,12/31/20,"291,857,248",12/31/20,"6,482,000","-51,015,000","34,588,000","70,784,000"
9452,"Revenue from customer contracts","Estimate of variable consideration in contracts with customers",448903,12/31/20,03/16/21,2,"Ernst & Young LLP",,,,Stamford,CT,CONNECTICUT,"US New England",10-K,2021-03-16,,"Acorda Therapeutics, Inc.",1008848,,"TWO BLUE HILL PLAZA",,"PEARL RIVER",NY,"NEW YORK","US Mid Atlantic",,,"=""2836""","Biological Products, Except Diagnostic Substances",325414,"Biological Product (except Diagnostic) Manufacturing",34,1,12/29/20,"33,434,588",12/31/20,"152,967,000","-99,594,000","-129,026,000","632,680,000"
9453,"Other contingent liabilities","Fair Value Measurement of the Contingent Consideration",448903,12/31/20,03/16/21,2,"Ernst & Young LLP",,,,Stamford,CT,CONNECTICUT,"US New England",10-K,2021-03-16,,"Acorda Therapeutics, Inc.",1008848,,"TWO BLUE HILL PLAZA",,"PEARL RIVER",NY,"NEW YORK","US Mid Atlantic",,,"=""2836""","Biological Products, Except Diagnostic Substances",325414,"Biological Product (except Diagnostic) Manufacturing",34,1,12/29/20,"33,434,588",12/31/20,"152,967,000","-99,594,000","-129,026,000","632,680,000"
6250,"Revenue from customer contracts","Revenue Recognition – Determination of Service Period for Online Functionality",443177,12/31/20,02/23/21,1,"PricewaterhouseCoopers LLP",,,,"Los Angeles",CA,CALIFORNIA,"US West",10-K,2021-02-23,,"Activision Blizzard, Inc.",718877,,"2701 OLYMPIC BOULEVARD","BUILDING B","SANTA MONICA",CA,CALIFORNIA,"US West",,,"=""7372""","Prepackaged Software",511210,"Software Publishers",34,93,12/31/20,"71,887,216,640",12/31/20,"8,086,000,000","2,197,000,000","4,661,000,000","23,109,000,000"
4586,"Other intangible assets","Valuation of Indefinite-Lived Trade Names",434387,08/31/20,10/23/20,2,"Ernst & Young LLP",,,,Atlanta,GA,GEORGIA,"US Southeast",10-K,2020-10-23,,"ACUITY INC. (DE)",1144215,"=""AYI""","1170 PEACHTREE STREET NE","SUITE 1200",ATLANTA,GA,GEORGIA,"US Southeast",,,"=""3640""","Electric Lighting & Wiring Equipment",335110,"Electric Lamp Bulb and Part Manufacturing",34,109,08/31/20,"4,248,399,104",08/31/20,"3,326,300,000","248,300,000","441,600,000","3,491,700,000"
4587,"Business combinations","Valuation of Intangible Assets Resulting from the Acquisition of The Luminaires Group",434387,08/31/20,10/23/20,2,"Ernst & Young LLP",,,,Atlanta,GA,GEORGIA,"US Southeast",10-K,2020-10-23,,"ACUITY INC. (DE)",1144215,"=""AYI""","1170 PEACHTREE STREET NE","SUITE 1200",ATLANTA,GA,GEORGIA,"US Southeast",,,"=""3640""","Electric Lighting & Wiring Equipment",335110,"Electric Lamp Bulb and Part Manufacturing",34,109,08/31/20,"4,248,399,104",08/31/20,"3,326,300,000","248,300,000","441,600,000","3,491,700,000"
6987,"Other income taxes","Accounting for Income Taxes",444140,12/31/20,02/25/21,1,"PricewaterhouseCoopers LLP",,,,Boston,MA,MASSACHUSETTS,"US New England",10-K,2021-02-25,,"Acushnet Holdings Corp.",1672013,"=""GOLF""","333 BRIDGE STREET",,FAIRHAVEN,MA,MASSACHUSETTS,"US New England",,,"=""3949""","Sporting and Athletic Goods, NEC",339920,"Sporting and Athletic Goods Manufacturing",34,41,12/31/20,"2,999,741,696",12/31/20,"1,612,169,000","96,006,000","295,356,000","1,866,555,000"
6177,"Insurance contract liabilities","Accrued Sales Deductions for the Medicare Part D Coverage Gap",443132,12/31/20,02/23/21,1,"PricewaterhouseCoopers LLP",,,,"San Jose",CA,CALIFORNIA,"US West",10-K,2021-02-23,,"Adamas Pharmaceuticals Inc",1328143,,"1900 POWELL ST., SUITE 1000",,EMERYVILLE,CA,CALIFORNIA,"US West",,,"=""2834""","Pharmaceutical Preparations",325412,"Pharmaceutical Preparation Manufacturing",34,4,12/31/20,"124,993,920",12/31/20,"74,461,000","-57,403,000",,"120,029,000"
8581,"Business combinations","Initial measurement of the fair value of the customer relationship intangible asset acquired in the CTL Transportation, LLC acquisition",446641,12/31/20,03/05/21,4,"KPMG LLP",,,,Houston,TX,TEXAS,"US Southwest",10-K,2021-03-05,,"ADAMS RESOURCES & ENERGY, INC.",2178,,"2727 ALLEN PARKWAY","9TH FLOOR",HOUSTON,TX,TEXAS,"US Southwest",,,"=""5172""","Petroleum and Petroleum Products Wholesalers, Except Bulk Stations and Terminals",424720,"Petroleum and Petroleum Products Merchant Wholesalers (except Bulk Stations and Terminals)",34,24,12/31/20,"102,273,552",12/31/20,"1,022,422,000","995,000","144,986,000","296,187,000"
8582,"Other contingent liabilities","Measurement of accrued liabilities for automobile and workers’ compensation claims",446641,12/31/20,03/05/21,4,"KPMG LLP",,,,Houston,TX,TEXAS,"US Southwest",10-K,2021-03-05,,"ADAMS RESOURCES & ENERGY, INC.",2178,,"2727 ALLEN PARKWAY","9TH FLOOR",HOUSTON,TX,TEXAS,"US Southwest",,,"=""5172""","Petroleum and Petroleum Products Wholesalers, Except Bulk Stations and Terminals",424720,"Petroleum and Petroleum Products Merchant Wholesalers (except Bulk Stations and Terminals)",34,24,12/31/20,"102,273,552",12/31/20,"1,022,422,000","995,000","144,986,000","296,187,000"
7038,"Revenue from customer contracts","Allocation of transaction price to the performance obligations",444170,12/31/20,02/25/21,4,"KPMG LLP",87,"KPMG LLP",1118,Reading,X0,"UNITED KINGDOM",Foreign,10-K,2021-02-25,,"Adaptimmune Therapeutics PLC",1621227,"=""ADAPY""","60 JUBILEE AVENUE","MILTON PARK","ABINGDON, OXFORDSHIRE",X0,"UNITED KINGDOM",Foreign,,,"=""2836""","Biological Products, Except Diagnostic Substances",325412,"Pharmaceutical Preparation Manufacturing",34,5,12/31/20,"834,331,520",12/31/20,"3,958,000","-130,092,000","339,497,000","451,142,000"
7039,"Revenue from customer contracts","Evaluation of estimation of costs to complete for Astellas collaboration agreement",444170,12/31/20,02/25/21,4,"KPMG LLP",87,"KPMG LLP",1118,Reading,X0,"UNITED KINGDOM",Foreign,10-K,2021-02-25,,"Adaptimmune Therapeutics PLC",1621227,"=""ADAPY""","60 JUBILEE AVENUE","MILTON PARK","ABINGDON, OXFORDSHIRE",X0,"UNITED KINGDOM",Foreign,,,"=""2836""","Biological Products, Except Diagnostic Substances",325412,"Pharmaceutical Preparation Manufacturing",34,5,12/31/20,"834,331,520",12/31/20,"3,958,000","-130,092,000","339,497,000","451,142,000"
6450,"Research and development expenses","Estimation of Total Expected Costs of Genentech Agreement",443581,12/31/20,02/24/21,2,"Ernst & Young LLP",,,,Seattle,WA,WASHINGTON,"US West",10-K,2021-02-24,,"Adaptive Biotechnologies Corp",1478320,"=""ADPT""","1165 EASTLAKE AVE E",,SEATTLE,WA,WASHINGTON,"US West",,,"=""2836""","Biological Products, Except Diagnostic Substances",325414,"Biological Product (except Diagnostic) Manufacturing",34,59,12/31/20,"8,139,060,736",12/31/20,"98,382,000","-146,227,000","614,069,000","1,116,414,000"
8114,"Accounts/loans receivable","Valuation of Accounts Receivable, Net of Allowances for Implicit Price Concessions",445017,12/31/20,03/01/21,1,"PricewaterhouseCoopers LLP",,,,Dallas,TX,TEXAS,"US Southwest",10-K,2021-03-01,,"Addus HomeCare Corp",1468328,"=""ADUS""","6303 COWBOYS WAY","SUITE 600",FRISCO,TX,TEXAS,"US Southwest",,,"=""8082""","Home Health Care Services",621610,"Home Health Care Services",34,117,12/31/20,"1,853,066,368",12/31/20,"764,775,000","33,133,000","-21,945,000","892,582,000"
8115,"Business combinations","Valuation of Queen City Hospice Identifiable Intangible Assets",445017,12/31/20,03/01/21,1,"PricewaterhouseCoopers LLP",,,,Dallas,TX,TEXAS,"US Southwest",10-K,2021-03-01,,"Addus HomeCare Corp",1468328,"=""ADUS""","6303 COWBOYS WAY","SUITE 600",FRISCO,TX,TEXAS,"US Southwest",,,"=""8082""","Home Health Care Services",621610,"Home Health Care Services",34,117,12/31/20,"1,853,066,368",12/31/20,"764,775,000","33,133,000","-21,945,000","892,582,000"
8916,"Other assets","Valuation of Level 3 Biological Assets",448519,12/31/20,03/09/21,1,"PricewaterhouseCoopers LLP",88,"Price Waterhouse & Co SRL",1349,"Buenos Aires",C1,ARGENTINA,Foreign,6-K,2021-03-11,,"Adecoagro S.A.",1499505,"=""AGRO""","28, BOULEVARD F.W. RAIFFEEISEN",,N/A,N4,LUXEMBOURG,Foreign,,,"=""0100""","Agricultural production- crops",111150,"Corn Farming",34,7,12/29/20,"763,401,024",12/31/20,"817,764,000","1,070,000","898,111,000","2,482,236,000"
8917,"Long-lived assets","Property, Plant and Equipment and Goodwill Impairment Assessment- Cash Generating Units with Allocated Goodwill in Brazil",448519,12/31/20,03/09/21,1,"PricewaterhouseCoopers LLP",88,"Price Waterhouse & Co SRL",1349,"Buenos Aires",C1,ARGENTINA,Foreign,6-K,2021-03-11,,"Adecoagro S.A.",1499505,"=""AGRO""","28, BOULEVARD F.W. RAIFFEEISEN",,N/A,N4,LUXEMBOURG,Foreign,,,"=""0100""","Agricultural production- crops",111150,"Corn Farming",34,7,12/29/20,"763,401,024",12/31/20,"817,764,000","1,070,000","898,111,000","2,482,236,000"
11372,"Other assets","Valuation of Level 3 Biological Assets",454591,12/31/20,04/28/21,1,"PricewaterhouseCoopers LLP",88,"Price Waterhouse & Co SRL",1349,"Buenos Aires",C1,ARGENTINA,Foreign,20-F,2021-04-29,,"Adecoagro S.A.",1499505,"=""AGRO""","28, BOULEVARD F.W. RAIFFEEISEN",,N/A,N4,LUXEMBOURG,Foreign,,,"=""0100""","Agricultural production- crops",111150,"Corn Farming",34,7,12/29/20,"763,401,024",12/31/20,"817,764,000","1,070,000","898,111,000","2,482,236,000"
11373,"Long-lived assets","Property, Plant and Equipment and Goodwill Impairment Assessment- Cash Generating Units with Allocated Goodwill in Brazil",454591,12/31/20,04/28/21,1,"PricewaterhouseCoopers LLP",88,"Price Waterhouse & Co SRL",1349,"Buenos Aires",C1,ARGENTINA,Foreign,20-F,2021-04-29,,"Adecoagro S.A.",1499505,"=""AGRO""","28, BOULEVARD F.W. RAIFFEEISEN",,N/A,N4,LUXEMBOURG,Foreign,,,"=""0100""","Agricultural production- crops",111150,"Corn Farming",34,7,12/29/20,"763,401,024",12/31/20,"817,764,000","1,070,000","898,111,000","2,482,236,000"
7338,"Revenue from customer contracts","Revenue recognition – Allocation of Transaction Price in Fixed-Fee Media IP Licensing Arrangements",444766,12/31/20,02/26/21,1,"PricewaterhouseCoopers LLP",,,,"San Jose",CA,CALIFORNIA,"US West",10-K,2021-02-26,,"Adeia Inc.",1803696,"=""ADEA""","3025 ORCHARD PARKWAY",,"SAN JOSE",CA,CALIFORNIA,"US West",,,"=""4841""","Cable and Other Pay Television Services",334413,"Semiconductor and Related Device Manufacturing",34,21,12/29/20,"2,171,234,816",12/31/20,"515,919,000","146,762,000","-394,531,000","2,701,176,000"
7339,"Business combinations","TiVo Merger – Valuation of Acquired Intangible Assets",444766,12/31/20,02/26/21,1,"PricewaterhouseCoopers LLP",,,,"San Jose",CA,CALIFORNIA,"US West",10-K,2021-02-26,,"Adeia Inc.",1803696,"=""ADEA""","3025 ORCHARD PARKWAY",,"SAN JOSE",CA,CALIFORNIA,"US West",,,"=""4841""","Cable and Other Pay Television Services",334413,"Semiconductor and Related Device Manufacturing",34,21,12/29/20,"2,171,234,816",12/31/20,"515,919,000","146,762,000","-394,531,000","2,701,176,000"
7340,Goodwill,"Goodwill Impairment Assessments - Product Reporting Unit",444766,12/31/20,02/26/21,1,"PricewaterhouseCoopers LLP",,,,"San Jose",CA,CALIFORNIA,"US West",10-K,2021-02-26,,"Adeia Inc.",1803696,"=""ADEA""","3025 ORCHARD PARKWAY",,"SAN JOSE",CA,CALIFORNIA,"US West",,,"=""4841""","Cable and Other Pay Television Services",334413,"Semiconductor and Related Device Manufacturing",34,21,12/29/20,"2,171,234,816",12/31/20,"515,919,000","146,762,000","-394,531,000","2,701,176,000"
4756,Goodwill,"Americas and EMEA Reporting Units Goodwill Impairment Assessments",436289,09/30/20,11/30/20,1,"PricewaterhouseCoopers LLP",,,,Detroit,MI,MICHIGAN,"US Midwest",10-K,2020-11-30,,"Adient plc",1670541,"=""ADNT""","25 NORTH WALL QUAY","DUBLIN 1",DUBLIN,L2,IRELAND,Foreign,,,"=""3714""","Motor Vehicle Parts and Accessories",336399,"All Other Motor Vehicle Parts Manufacturing",34,20,10/02/20,"1,855,155,328",09/30/20,"12,670,000,000","-547,000,000","-1,244,000,000","10,261,000,000"
4883,"Revenue from customer contracts","Performance obligations in cloud-enabled software subscriptions",439637,11/27/20,01/15/21,4,"KPMG LLP",,,,"Santa Clara",CA,CALIFORNIA,"US West",10-K,2021-01-15,,"ADOBE INC.",796343,"=""ADBE""","345 PARK AVE",,"SAN JOSE",CA,CALIFORNIA,"US West",,,"=""7372""","Prepackaged Software",511210,"Software Publishers",34,478,11/30/20,"229,187,125,248",11/27/20,"12,868,000,000","5,260,000,000","1,163,000,000","24,284,000,000"
4884,"Deferred income taxes","Fair value of the intra-entity transfer of certain intellectual property rights",439637,11/27/20,01/15/21,4,"KPMG LLP",,,,"Santa Clara",CA,CALIFORNIA,"US West",10-K,2021-01-15,,"ADOBE INC.",796343,"=""ADBE""","345 PARK AVE",,"SAN JOSE",CA,CALIFORNIA,"US West",,,"=""7372""","Prepackaged Software",511210,"Software Publishers",34,478,11/30/20,"229,187,125,248",11/27/20,"12,868,000,000","5,260,000,000","1,163,000,000","24,284,000,000"
6707,Goodwill,"Goodwill Impairment Assessment -- Commercial Reporting Unit",443957,12/31/20,02/25/21,1,"PricewaterhouseCoopers LLP",,,,"Hallandale Beach",FL,FLORIDA,"US Southeast",10-K,2021-02-25,,"ADT Inc.",1703056,"=""ADT""","1501 YAMATO ROAD",,"BOCA RATON",FL,FLORIDA,"US Southeast",,,"=""7381""","Detective, Guard, and Armored Car Services",561621,"Security Systems Services (except Locksmiths)",34,8,12/31/20,"6,052,456,960",12/31/20,"5,314,787,000","-632,193,000","-8,103,656,000","16,116,936,000"
4442,"Business combinations","Acquisition of OnCourse Learning LLC – Valuation of Customer Relationships",430956,06/30/20,08/18/20,1,"PricewaterhouseCoopers LLP",,,,Chicago,IL,ILLINOIS,"US Midwest",10-K,2020-08-18,,"Adtalem Global Education Inc.",730464,"=""ATGE""","233 S. WACKER DRIVE","SUITE 800",CHICAGO,IL,ILLINOIS,"US Midwest",,,"=""8200""","Services-Educational Services",611519,"Other Technical and Trade Schools",34,31,06/30/20,"1,615,781,632",06/30/20,"1,052,001,000","-85,334,000","339,545,000","2,228,687,000"
7330,Inventory,"Excess and Obsolete Inventory Reserve",444894,12/31/20,02/26/21,1,"PricewaterhouseCoopers LLP",,,,Birmingham,AL,ALABAMA,"US Southeast",10-K,2021-02-26,,"ADTRAN Holdings, Inc.",926282,"=""ADTN""","901 EXPLORER BLVD",,HUNTSVILLE,AL,ALABAMA,"US Southeast",,,"=""3661""","Telephone and Telegraph Apparatus",334210,"Telephone Apparatus Manufacturing",34,15,12/31/20,"712,519,552",12/31/20,"506,510,000","2,378,000","342,506,000","525,679,000"
5929,"Vendor/supplier rebates","Vendor Incentives - Refer to Note 2 to the Consolidated Financial Statements",442794,01/02/21,02/22/21,3,"Deloitte & Touche LLP",,,,Charlotte,NC,"NORTH CAROLINA","US Southeast",10-K,2021-02-22,,"ADVANCE AUTO PARTS INC",1158449,"=""AAP""","4200 SIX FORKS ROAD",,RALEIGH,NC,"NORTH CAROLINA","US Southeast",,,"=""5531""","Auto and Home Supply Stores",441310,"Automotive Parts and Accessories Stores",34,157,01/04/21,"10,676,233,216",01/02/21,"10,106,321,000","493,021,000","1,884,795,000","11,839,636,000"
4210,"Business combinations","Acquisitions, Infiltrator Water Technologies, Customer Relationships Intangible— Refer to Note 4 to the financial statements",427500,03/31/20,06/01/20,3,"Deloitte & Touche LLP",,,,Columbus,OH,OHIO,"US Midwest",10-K,2020-06-01,,"ADVANCED DRAINAGE SYSTEMS, INC.",1604028,"=""WMS""","4024 GREEN STRIPE LANE",,HILLIARD,OH,OHIO,"US Midwest",,,"=""3086""","Plastics Foam Products",326122,"Plastics Pipe and Pipe Fitting Manufacturing",34,29,03/31/20,"2,040,751,360",03/31/20,"1,673,805,000","-193,174,000","-380,337,000","2,369,888,000"
4211,Goodwill,"Goodwill, Infiltrator Water Technologies Reporting Unit — Refer to Note 8 to the financial statements",427500,03/31/20,06/01/20,3,"Deloitte & Touche LLP",,,,Columbus,OH,OHIO,"US Midwest",10-K,2020-06-01,,"ADVANCED DRAINAGE SYSTEMS, INC.",1604028,"=""WMS""","4024 GREEN STRIPE LANE",,HILLIARD,OH,OHIO,"US Midwest",,,"=""3086""","Plastics Foam Products",326122,"Plastics Pipe and Pipe Fitting Manufacturing",34,29,03/31/20,"2,040,751,360",03/31/20,"1,673,805,000","-193,174,000","-380,337,000","2,369,888,000"
6203,"Other income taxes","Accounting for income taxes",443178,12/31/20,02/23/21,2,"Ernst & Young LLP",,,,Denver,CO,COLORADO,"US West",10-K,2021-02-24,,"ADVANCED ENERGY INDUSTRIES INC",927003,"=""AEIS""","ATTN:  PAUL OLDHAM","1595 WYNKOOP ST, SUITE 800",DENVER,CO,COLORADO,"US West",,,"=""3679""","Electronic Components, NEC",335999,"All Other Miscellaneous Electrical Equipment and Component Manufacturing",34,97,12/31/20,"3,713,272,320",12/31/20,"1,415,826,000","134,675,000","435,817,000","1,647,662,000"
4932,Inventory,"Inventory Valuation",440592,12/26/20,01/29/21,2,"Ernst & Young LLP",,,,"San Jose",CA,CALIFORNIA,"US West",10-K,2021-01-29,,"ADVANCED MICRO DEVICES INC",2488,"=""AMD""","2485 AUGUSTINE DRIVE",,"SANTA CLARA",CA,CALIFORNIA,"US West",,,"=""3674""","Semiconductors and Related Devices",334413,"Semiconductor and Related Device Manufacturing",34,92,12/31/20,"111,060,811,776",12/26/20,"9,763,000,000","2,490,000,000","5,548,000,000","8,962,000,000"
4933,"Deferred income taxes","Deferred Tax Asset Valuation Allowance",440592,12/26/20,01/29/21,2,"Ernst & Young LLP",,,,"San Jose",CA,CALIFORNIA,"US West",10-K,2021-01-29,,"ADVANCED MICRO DEVICES INC",2488,"=""AMD""","2485 AUGUSTINE DRIVE",,"SANTA CLARA",CA,CALIFORNIA,"US West",,,"=""3674""","Semiconductors and Related Devices",334413,"Semiconductor and Related Device Manufacturing",34,92,12/31/20,"111,060,811,776",12/26/20,"9,763,000,000","2,490,000,000","5,548,000,000","8,962,000,000"
5838,Goodwill,"Goodwill Impairment Assessment
",442774,12/31/20,02/19/21,1,"PricewaterhouseCoopers LLP",,,,"Florham Park",NJ,"NEW JERSEY","US Mid Atlantic",10-K,2021-02-19,,"AdvanSix Inc.",1673985,"=""ASIX""","300 KIMBALL DRIVE","SUITE 101",PARSIPPANY,NJ,"NEW JERSEY","US Mid Atlantic",,,"=""2821""","Plastics Material and Synthetic Resins, and Nonvulcanizable Elastomers",325211,"Plastics Material and Resin Manufacturing",34,20,12/31/20,"560,384,192",12/31/20,"1,157,917,000","46,077,000","429,118,000","1,263,407,000"
9338,Goodwill,"Goodwill Impairment Assessment",449070,12/31/20,03/16/21,1,"PricewaterhouseCoopers LLP",,,,Irvine,CA,CALIFORNIA,"US West","POS AM",2021-03-16,,"Advantage Solutions Inc.",1776661,"=""ADV""","C/O ADVANTAGE SOLUTIONS, INC.","7676 FORSYTH BOULEVARD, 5TH FLOOR","ST. LOUIS",MO,MISSOURI,"US Southeast",,,"=""7389""","Business Services, NEC",541611,"Administrative Management and General Management Consulting Services",34,13,12/31/20,"4,127,809,536",12/31/20,"3,155,671,000","-175,806,000","-2,194,300,000","5,777,492,000"
9339,"Other intangible assets","Indefinite-Lived Intangible Assets Impairment Assessment",449070,12/31/20,03/16/21,1,"PricewaterhouseCoopers LLP",,,,Irvine,CA,CALIFORNIA,"US West","POS AM",2021-03-16,,"Advantage Solutions Inc.",1776661,"=""ADV""","C/O ADVANTAGE SOLUTIONS, INC.","7676 FORSYTH BOULEVARD, 5TH FLOOR","ST. LOUIS",MO,MISSOURI,"US Southeast",,,"=""7389""","Business Services, NEC",541611,"Administrative Management and General Management Consulting Services",34,13,12/31/20,"4,127,809,536",12/31/20,"3,155,671,000","-175,806,000","-2,194,300,000","5,777,492,000"
9341,Goodwill,"Goodwill Impairment Assessment",449098,12/31/20,03/16/21,1,"PricewaterhouseCoopers LLP",,,,Irvine,CA,CALIFORNIA,"US West",10-K,2021-03-16,,"Advantage Solutions Inc.",1776661,"=""ADV""","C/O ADVANTAGE SOLUTIONS, INC.","7676 FORSYTH BOULEVARD, 5TH FLOOR","ST. LOUIS",MO,MISSOURI,"US Southeast",,,"=""7389""","Business Services, NEC",541611,"Administrative Management and General Management Consulting Services",34,13,12/31/20,"4,127,809,536",12/31/20,"3,155,671,000","-175,806,000","-2,194,300,000","5,777,492,000"
9342,"Other intangible assets","Indefinite-Lived Intangible Assets Impairment Assessment",449098,12/31/20,03/16/21,1,"PricewaterhouseCoopers LLP",,,,Irvine,CA,CALIFORNIA,"US West",10-K,2021-03-16,,"Advantage Solutions Inc.",1776661,"=""ADV""","C/O ADVANTAGE SOLUTIONS, INC.","7676 FORSYTH BOULEVARD, 5TH FLOOR","ST. LOUIS",MO,MISSOURI,"US Southeast",,,"=""7389""","Business Services, NEC",541611,"Administrative Management and General Management Consulting Services",34,13,12/31/20,"4,127,809,536",12/31/20,"3,155,671,000","-175,806,000","-2,194,300,000","5,777,492,000"
10972,Goodwill,"Goodwill Impairment Assessment",450463,12/31/20,03/16/21,1,"PricewaterhouseCoopers LLP",,,,Irvine,CA,CALIFORNIA,"US West",S-1,2021-03-25,,"Advantage Solutions Inc.",1776661,"=""ADV""","C/O ADVANTAGE SOLUTIONS, INC.","7676 FORSYTH BOULEVARD, 5TH FLOOR","ST. LOUIS",MO,MISSOURI,"US Southeast",,,"=""7389""","Business Services, NEC",541611,"Administrative Management and General Management Consulting Services",34,13,12/31/20,"4,127,809,536",12/31/20,"3,155,671,000","-175,806,000","-2,194,300,000","5,777,492,000"
10973,"Other intangible assets","Indefinite-Lived Intangible Assets Impairment Assessment",450463,12/31/20,03/16/21,1,"PricewaterhouseCoopers LLP",,,,Irvine,CA,CALIFORNIA,"US West",S-1,2021-03-25,,"Advantage Solutions Inc.",1776661,"=""ADV""","C/O ADVANTAGE SOLUTIONS, INC.","7676 FORSYTH BOULEVARD, 5TH FLOOR","ST. LOUIS",MO,MISSOURI,"US Southeast",,,"=""7389""","Business Services, NEC",541611,"Administrative Management and General Management Consulting Services",34,13,12/31/20,"4,127,809,536",12/31/20,"3,155,671,000","-175,806,000","-2,194,300,000","5,777,492,000"
11750,Goodwill,"Goodwill Impairment Assessment",456526,12/31/20,03/16/21,1,"PricewaterhouseCoopers LLP",,,,Irvine,CA,CALIFORNIA,"US West",10-K/A,2021-05-17,,"Advantage Solutions Inc.",1776661,"=""ADV""","C/O ADVANTAGE SOLUTIONS, INC.","7676 FORSYTH BOULEVARD, 5TH FLOOR","ST. LOUIS",MO,MISSOURI,"US Southeast",,,"=""7389""","Business Services, NEC",541611,"Administrative Management and General Management Consulting Services",34,13,12/31/20,"4,127,809,536",12/31/20,"3,155,671,000","-175,806,000","-2,194,300,000","5,777,492,000"
11751,"Other intangible assets","Indefinite-Lived Intangible Assets Impairment Assessment",456526,12/31/20,03/16/21,1,"PricewaterhouseCoopers LLP",,,,Irvine,CA,CALIFORNIA,"US West",10-K/A,2021-05-17,,"Advantage Solutions Inc.",1776661,"=""ADV""","C/O ADVANTAGE SOLUTIONS, INC.","7676 FORSYTH BOULEVARD, 5TH FLOOR","ST. LOUIS",MO,MISSOURI,"US Southeast",,,"=""7389""","Business Services, NEC",541611,"Administrative Management and General Management Consulting Services",34,13,12/31/20,"4,127,809,536",12/31/20,"3,155,671,000","-175,806,000","-2,194,300,000","5,777,492,000"
11752,"Other debt","Accounting for and Valuation of Private Placement Warrants",456526,12/31/20,03/16/21,1,"PricewaterhouseCoopers LLP",,,,Irvine,CA,CALIFORNIA,"US West",10-K/A,2021-05-17,,"Advantage Solutions Inc.",1776661,"=""ADV""","C/O ADVANTAGE SOLUTIONS, INC.","7676 FORSYTH BOULEVARD, 5TH FLOOR","ST. LOUIS",MO,MISSOURI,"US Southeast",,,"=""7389""","Business Services, NEC",541611,"Administrative Management and General Management Consulting Services",34,13,12/31/20,"4,127,809,536",12/31/20,"3,155,671,000","-175,806,000","-2,194,300,000","5,777,492,000"
11776,Goodwill,"Goodwill Impairment Assessment",456597,12/31/20,03/16/21,1,"PricewaterhouseCoopers LLP",,,,Irvine,CA,CALIFORNIA,"US West","POS AM",2021-05-19,,"Advantage Solutions Inc.",1776661,"=""ADV""","C/O ADVANTAGE SOLUTIONS, INC.","7676 FORSYTH BOULEVARD, 5TH FLOOR","ST. LOUIS",MO,MISSOURI,"US Southeast",,,"=""7389""","Business Services, NEC",541611,"Administrative Management and General Management Consulting Services",34,13,12/31/20,"4,127,809,536",12/31/20,"3,155,671,000","-175,806,000","-2,194,300,000","5,777,492,000"
11777,"Other intangible assets","Indefinite-Lived Intangible Assets Impairment Assessment",456597,12/31/20,03/16/21,1,"PricewaterhouseCoopers LLP",,,,Irvine,CA,CALIFORNIA,"US West","POS AM",2021-05-19,,"Advantage Solutions Inc.",1776661,"=""ADV""","C/O ADVANTAGE SOLUTIONS, INC.","7676 FORSYTH BOULEVARD, 5TH FLOOR","ST. LOUIS",MO,MISSOURI,"US Southeast",,,"=""7389""","Business Services, NEC",541611,"Administrative Management and General Management Consulting Services",34,13,12/31/20,"4,127,809,536",12/31/20,"3,155,671,000","-175,806,000","-2,194,300,000","5,777,492,000"
11778,"Other debt","Accounting for and Valuation of Private Placement Warrants",456597,12/31/20,03/16/21,1,"PricewaterhouseCoopers LLP",,,,Irvine,CA,CALIFORNIA,"US West","POS AM",2021-05-19,,"Advantage Solutions Inc.",1776661,"=""ADV""","C/O ADVANTAGE SOLUTIONS, INC.","7676 FORSYTH BOULEVARD, 5TH FLOOR","ST. LOUIS",MO,MISSOURI,"US Southeast",,,"=""7389""","Business Services, NEC",541611,"Administrative Management and General Management Consulting Services",34,13,12/31/20,"4,127,809,536",12/31/20,"3,155,671,000","-175,806,000","-2,194,300,000","5,777,492,000"
11779,Goodwill,"Goodwill Impairment Assessment",456601,12/31/20,03/16/21,1,"PricewaterhouseCoopers LLP",,,,Irvine,CA,CALIFORNIA,"US West","POS AM",2021-05-19,,"Advantage Solutions Inc.",1776661,"=""ADV""","C/O ADVANTAGE SOLUTIONS, INC.","7676 FORSYTH BOULEVARD, 5TH FLOOR","ST. LOUIS",MO,MISSOURI,"US Southeast",,,"=""7389""","Business Services, NEC",541611,"Administrative Management and General Management Consulting Services",34,13,12/31/20,"4,127,809,536",12/31/20,"3,155,671,000","-175,806,000","-2,194,300,000","5,777,492,000"
11780,"Other intangible assets","Indefinite-Lived Intangible Assets Impairment Assessment",456601,12/31/20,03/16/21,1,"PricewaterhouseCoopers LLP",,,,Irvine,CA,CALIFORNIA,"US West","POS AM",2021-05-19,,"Advantage Solutions Inc.",1776661,"=""ADV""","C/O ADVANTAGE SOLUTIONS, INC.","7676 FORSYTH BOULEVARD, 5TH FLOOR","ST. LOUIS",MO,MISSOURI,"US Southeast",,,"=""7389""","Business Services, NEC",541611,"Administrative Management and General Management Consulting Services",34,13,12/31/20,"4,127,809,536",12/31/20,"3,155,671,000","-175,806,000","-2,194,300,000","5,777,492,000"
11781,"Other debt","Accounting for and Valuation of Private Placement Warrants",456601,12/31/20,03/16/21,1,"PricewaterhouseCoopers LLP",,,,Irvine,CA,CALIFORNIA,"US West","POS AM",2021-05-19,,"Advantage Solutions Inc.",1776661,"=""ADV""","C/O ADVANTAGE SOLUTIONS, INC.","7676 FORSYTH BOULEVARD, 5TH FLOOR","ST. LOUIS",MO,MISSOURI,"US Southeast",,,"=""7389""","Business Services, NEC",541611,"Administrative Management and General Management Consulting Services",34,13,12/31/20,"4,127,809,536",12/31/20,"3,155,671,000","-175,806,000","-2,194,300,000","5,777,492,000"
7839,"Research and development expenses","Accrued research and development expenses – clinical and manufacturing costs",445498,12/31/20,03/01/21,2,"Ernst & Young LLP",,,,"San Jose",CA,CALIFORNIA,"US West",10-K,2021-03-01,,"Adverum Biotechnologies, Inc.",1501756,"=""ADVM""","100 CARDINAL WAY",,"REDWOOD CITY",CA,CALIFORNIA,"US West",,,"=""2836""","Biological Products, Except Diagnostic Substances",325414,"Biological Product (except Diagnostic) Manufacturing",34,11,12/31/20,"1,057,431,168",12/31/20,,"-117,507,000",,"482,567,000"
7840,"Uncertain tax positions","Uncertain tax positions	",445498,12/31/20,03/01/21,2,"Ernst & Young LLP",,,,"San Jose",CA,CALIFORNIA,"US West",10-K,2021-03-01,,"Adverum Biotechnologies, Inc.",1501756,"=""ADVM""","100 CARDINAL WAY",,"REDWOOD CITY",CA,CALIFORNIA,"US West",,,"=""2836""","Biological Products, Except Diagnostic Substances",325414,"Biological Product (except Diagnostic) Manufacturing",34,11,12/31/20,"1,057,431,168",12/31/20,,"-117,507,000",,"482,567,000"
4672,"Revenue from customer contracts","Revenue Recognition - Contract cost and claim recovery estimates",435776,09/30/20,11/18/20,2,"Ernst & Young LLP",,,,"Los Angeles",CA,CALIFORNIA,"US West",10-K,2020-11-19,,AECOM,868857,"=""ACM""","13355 NOEL ROAD","SUITE 400",DALLAS,TX,TEXAS,"US Southwest",,,"=""8711""","Engineering Services",541611,"Administrative Management and General Management Consulting Services",34,42,09/30/20,"6,570,749,952",09/30/20,"13,239,976,000","-186,370,000","-268,580,000","12,998,951,000"
4673,Goodwill,"Valuation of goodwill",435776,09/30/20,11/18/20,2,"Ernst & Young LLP",,,,"Los Angeles",CA,CALIFORNIA,"US West",10-K,2020-11-19,,AECOM,868857,"=""ACM""","13355 NOEL ROAD","SUITE 400",DALLAS,TX,TEXAS,"US Southwest",,,"=""8711""","Engineering Services",541611,"Administrative Management and General Management Consulting Services",34,42,09/30/20,"6,570,749,952",09/30/20,"13,239,976,000","-186,370,000","-268,580,000","12,998,951,000"
8795,Goodwill,"Goodwill Impairment Assessment – Fyfe Reporting Unit",448151,12/31/20,03/10/21,1,"PricewaterhouseCoopers LLP",,,,"Saint Louis",MO,MISSOURI,"US Southeast",10-K,2021-03-10,,"Aegion Corp",353020,,"17988 EDISON AVENUE",,CHESTERFIELD,MO,MISSOURI,"US Southeast",,,"=""1623""","Water, Sewer, Pipeline, and Communications and Power Line Construction",237110,"Water and Sewer Line and Related Structures Construction",34,19,12/31/20,"581,856,448",12/31/20,"807,764,000","-31,861,000","130,063,000","901,447,000"
8796,Goodwill,"Goodwill and Disposal Group Impairment Assessments – Energy Services",448151,12/31/20,03/10/21,1,"PricewaterhouseCoopers LLP",,,,"Saint Louis",MO,MISSOURI,"US Southeast",10-K,2021-03-10,,"Aegion Corp",353020,,"17988 EDISON AVENUE",,CHESTERFIELD,MO,MISSOURI,"US Southeast",,,"=""1623""","Water, Sewer, Pipeline, and Communications and Power Line Construction",237110,"Water and Sewer Line and Related Structures Construction",34,19,12/31/20,"581,856,448",12/31/20,"807,764,000","-31,861,000","130,063,000","901,447,000"
9577,"Insurance contract liabilities","Valuation of certain assets and liabilities arising from insurance contracts",449461,12/31/20,03/17/21,1,"PricewaterhouseCoopers LLP",108,"PricewaterhouseCoopers Accountants NV",1395,Amsterdam,P7,NETHERLANDS,Foreign,20-F,2021-03-18,,"AEGON LTD.",769218,"=""AEG""","WORLD TRADE CENTER SCHIPHOL","SCHIPHOL BOULEVARD 223",SCHIPHOL,P7,NETHERLANDS,Foreign,,,"=""6311""","Life Insurance",524113,"Direct Life Insurance Carriers",34,25,12/29/20,"53,028,450,304",12/31/20,"62,508,000,000","-165,000,000","28,387,000,000","543,032,000,000"
9578,"Other investments","Valuation of certain Level 3 investments",449461,12/31/20,03/17/21,1,"PricewaterhouseCoopers LLP",108,"PricewaterhouseCoopers Accountants NV",1395,Amsterdam,P7,NETHERLANDS,Foreign,20-F,2021-03-18,,"AEGON LTD.",769218,"=""AEG""","WORLD TRADE CENTER SCHIPHOL","SCHIPHOL BOULEVARD 223",SCHIPHOL,P7,NETHERLANDS,Foreign,,,"=""6311""","Life Insurance",524113,"Direct Life Insurance Carriers",34,25,12/29/20,"53,028,450,304",12/31/20,"62,508,000,000","-165,000,000","28,387,000,000","543,032,000,000"
9579,"Goodwill and intangible assets","Impairments of Assets",449461,12/31/20,03/17/21,1,"PricewaterhouseCoopers LLP",108,"PricewaterhouseCoopers Accountants NV",1395,Amsterdam,P7,NETHERLANDS,Foreign,20-F,2021-03-18,,"AEGON LTD.",769218,"=""AEG""","WORLD TRADE CENTER SCHIPHOL","SCHIPHOL BOULEVARD 223",SCHIPHOL,P7,NETHERLANDS,Foreign,,,"=""6311""","Life Insurance",524113,"Direct Life Insurance Carriers",34,25,12/29/20,"53,028,450,304",12/31/20,"62,508,000,000","-165,000,000","28,387,000,000","543,032,000,000"
6669,"Regulatory assets and liabilities","Accounting for the Effects of Cost-Based Regulation",443788,12/31/20,02/25/21,1,"PricewaterhouseCoopers LLP",,,,Columbus,OH,OHIO,"US Midwest",10-K,2021-02-25,,"AEP Texas Inc.",1721781,,"1 RIVERSIDE PLAZA",,COLUMBUS,OH,OHIO,"US Midwest",4904,"AMERICAN ELECTRIC POWER CO INC","=""4911""","Electric Services",221122,"Electric Power Distribution",34,,,,12/31/20,"1,618,900,000","241,000,000",,"11,030,200,000"
6670,"Revenue from customer contracts","Valuation of Level 3 Risk Management Commodity Contracts",443788,12/31/20,02/25/21,1,"PricewaterhouseCoopers LLP",,,,Columbus,OH,OHIO,"US Midwest",10-K,2021-02-25,,"AEP Texas Inc.",1721781,,"1 RIVERSIDE PLAZA",,COLUMBUS,OH,OHIO,"US Midwest",4904,"AMERICAN ELECTRIC POWER CO INC","=""4911""","Electric Services",221122,"Electric Power Distribution",34,,,,12/31/20,"1,618,900,000","241,000,000",,"11,030,200,000"
6907,"Regulatory assets and liabilities","Accounting for the Effects of Cost-Based Regulation",443790,12/31/20,02/25/21,1,"PricewaterhouseCoopers LLP",,,,Columbus,OH,OHIO,"US Midwest",10-K,2021-02-25,,"AEP Transmission Company, LLC",1702494,,"1 RIVERSIDE PLAZA",,COLUMBUS,OH,OHIO,"US Midwest",4904,"AMERICAN ELECTRIC POWER CO INC","=""4911""","Electric Services",221121,"Electric Bulk Power Transmission and Control",34,,,,12/31/20,"1,145,700,000","423,400,000",,"11,246,000,000"
8270,Leases,"Identification of impairment events and resulting impairment calculations",445606,12/31/20,03/02/21,1,"PricewaterhouseCoopers LLP",104,PricewaterhouseCoopers,1366,Dublin,L2,IRELAND,Foreign,20-F,2021-03-02,,"AerCap Holdings N.V.",1378789,"=""AER""","AERCAP HOUSE","65 ST. STEPHEN'S GREEN",DUBLIN,L2,IRELAND,Foreign,,,"=""7359""","Equipment Rental and Leasing, NEC",532411,"Commercial Air, Rail, and Water Transportation Equipment Rental and Leasing",34,45,12/29/20,"5,876,518,400",12/31/20,"4,321,006,000","-298,566,000","8,639,836,000","42,048,039,000"
8271,"Revenue from customer contracts","Measurement of operating lease revenue on a cash receipts basis",445606,12/31/20,03/02/21,1,"PricewaterhouseCoopers LLP",104,PricewaterhouseCoopers,1366,Dublin,L2,IRELAND,Foreign,20-F,2021-03-02,,"AerCap Holdings N.V.",1378789,"=""AER""","AERCAP HOUSE","65 ST. STEPHEN'S GREEN",DUBLIN,L2,IRELAND,Foreign,,,"=""7359""","Equipment Rental and Leasing, NEC",532411,"Commercial Air, Rail, and Water Transportation Equipment Rental and Leasing",34,45,12/29/20,"5,876,518,400",12/31/20,"4,321,006,000","-298,566,000","8,639,836,000","42,048,039,000"
7616,"Sales return and allowances","Provisions for Revenue Reserves – Commercial and Medicare Part D Rebates",444003,12/31/20,02/25/21,1,"PricewaterhouseCoopers LLP",,,,"Florham Park",NJ,"NEW JERSEY","US Mid Atlantic",10-K,2021-02-26,,"AERIE PHARMACEUTICALS INC",1337553,,"4301 EMPEROR BOULEVARD","SUITE 400",DURHAM,NC,"NORTH CAROLINA","US Southeast",,,"=""2836""","Biological Products, Except Diagnostic Substances",325414,"Biological Product (except Diagnostic) Manufacturing",34,14,12/31/20,"632,560,384",12/31/20,"83,138,000","-183,101,000",,"402,045,000"
5727,"Revenue from customer contracts","Revenue recognition - estimated total cost at completion on fixed-price contracts",442275,12/31/20,02/18/21,1,"PricewaterhouseCoopers LLP",,,,Sacramento,CA,CALIFORNIA,"US West",10-K,2021-02-18,,"AEROJET ROCKETDYNE HOLDINGS, INC.",40888,,"222 N. PACIFIC COAST HIGHWAY","SUITE 500","EL SEGUNDO",CA,CALIFORNIA,"US West",,,"=""3760""","Guided Missiles & Space Vehicles & Parts",326291,"Rubber Product Manufacturing for Mechanical Use",34,53,12/31/20,"4,058,880,000",12/31/20,"2,072,700,000","137,500,000","27,300,000","2,899,900,000"
4273,"Revenue from customer contracts","Revenue Recognition - Refer to Note 1 to the financial statements",428540,04/30/20,06/23/20,3,"Deloitte & Touche LLP",,,,"Los Angeles",CA,CALIFORNIA,"US West",10-K,2020-06-24,,"AeroVironment Inc",1368622,"=""AVAV""","241 18TH STREET SOUTH, SUITE 650",,ARLINGTON,VA,VIRGINIA,"US Mid Atlantic",,,"=""3721""",Aircraft,336411,"Aircraft Manufacturing",34,60,04/30/20,"1,450,074,880",04/30/20,"367,296,000","41,074,000","489,924,000","584,954,000"
4274,"Business combinations","Business Acquisitions – Refer to Note 19 to the financial statements",428540,04/30/20,06/23/20,3,"Deloitte & Touche LLP",,,,"Los Angeles",CA,CALIFORNIA,"US West",10-K,2020-06-24,,"AeroVironment Inc",1368622,"=""AVAV""","241 18TH STREET SOUTH, SUITE 650",,ARLINGTON,VA,VIRGINIA,"US Mid Atlantic",,,"=""3721""",Aircraft,336411,"Aircraft Manufacturing",34,60,04/30/20,"1,450,074,880",04/30/20,"367,296,000","41,074,000","489,924,000","584,954,000"
6592,Goodwill,"Goodwill Impairment Evaluation of the Gener Reporting Unit",443707,12/31/20,02/24/21,2,"Ernst & Young LLP",,,,Tysons,VA,VIRGINIA,"US Mid Atlantic",10-K,2021-02-25,,"AES CORP",874761,"=""AES""","4300 WILSON BOULEVARD",,ARLINGTON,VA,VIRGINIA,"US Mid Atlantic",,,"=""4991""","Cogeneration Services & Small Power Producers",221122,"Electric Power Distribution",34,24,12/31/20,"15,636,198,400",12/31/20,"9,660,000,000","46,000,000","1,618,000,000","34,603,000,000"
6593,"Property, plant and equipment","Evaluation of Impairment Indicators and Re-evaluation of Useful Lives",443707,12/31/20,02/24/21,2,"Ernst & Young LLP",,,,Tysons,VA,VIRGINIA,"US Mid Atlantic",10-K,2021-02-25,,"AES CORP",874761,"=""AES""","4300 WILSON BOULEVARD",,ARLINGTON,VA,VIRGINIA,"US Mid Atlantic",,,"=""4991""","Cogeneration Services & Small Power Producers",221122,"Electric Power Distribution",34,24,12/31/20,"15,636,198,400",12/31/20,"9,660,000,000","46,000,000","1,618,000,000","34,603,000,000"
6594,"Long-lived assets","Long-Lived Asset Impairment Evaluation of AES Gener",443707,12/31/20,02/24/21,2,"Ernst & Young LLP",,,,Tysons,VA,VIRGINIA,"US Mid Atlantic",10-K,2021-02-25,,"AES CORP",874761,"=""AES""","4300 WILSON BOULEVARD",,ARLINGTON,VA,VIRGINIA,"US Mid Atlantic",,,"=""4991""","Cogeneration Services & Small Power Producers",221122,"Electric Power Distribution",34,24,12/31/20,"15,636,198,400",12/31/20,"9,660,000,000","46,000,000","1,618,000,000","34,603,000,000"
5799,"Equity investments and joint ventures","Impairment Evaluation for Equity Method Investments in Affiliates",442638,12/31/20,02/19/21,1,"PricewaterhouseCoopers LLP",,,,Boston,MA,MASSACHUSETTS,"US New England",10-K,2021-02-19,,"AFFILIATED MANAGERS GROUP, INC.",1004434,"=""AMG""","777 SOUTH FLAGLER DRIVE","SUITE 1401 EAST TOWER","WEST PALM BEACH",FL,FLORIDA,"US Southeast",,,"=""6282""","Investment Advice",523930,"Investment Advice",34,102,12/31/20,"4,474,800,128",12/31/20,"1,935,200,000","202,200,000","-259,000,000","7,888,900,000"
11051,"Revenue from customer contracts","Revenue recognition from collaboration agreements",452785,12/31/20,04/15/21,4,"KPMG LLP",254,"KPMG AG Wirtschaftsprüfungsgesellschaft",1021,Mannheim,2M,GERMANY,Foreign,20-F,2021-04-15,,"Affimed N.V.",1608390,"=""AFMDQ""","GOTTLIEB-DAIMLER-STRASSE 2",,MANNHEIM,2M,GERMANY,Foreign,,,"=""2834""","Pharmaceutical Preparations",325414,"Biological Product (except Diagnostic) Manufacturing",34,6,12/29/20,"452,161,920",12/31/20,"34,700,000","-50,614,000","85,985,000","215,009,000"
11052,"Other investments","Valuation of shares in non-public companies",452785,12/31/20,04/15/21,4,"KPMG LLP",254,"KPMG AG Wirtschaftsprüfungsgesellschaft",1021,Mannheim,2M,GERMANY,Foreign,20-F,2021-04-15,,"Affimed N.V.",1608390,"=""AFMDQ""","GOTTLIEB-DAIMLER-STRASSE 2",,MANNHEIM,2M,GERMANY,Foreign,,,"=""2834""","Pharmaceutical Preparations",325414,"Biological Product (except Diagnostic) Manufacturing",34,6,12/29/20,"452,161,920",12/31/20,"34,700,000","-50,614,000","85,985,000","215,009,000"
6279,"Long-term investments","Assessment of the measurement of fair value of certain investments and derivatives",443303,12/31/20,02/23/21,4,"KPMG LLP",,,,Atlanta,GA,GEORGIA,"US Southeast",10-K,2021-02-23,,"AFLAC INC",4977,"=""AFL""","1932 WYNNTON RD",,COLUMBUS,GA,GEORGIA,"US Southeast",,,"=""6321""","Accident and Health Insurance",524114,"Direct Health and Medical Insurance Carriers",34,44,12/31/20,"30,793,428,992",12/31/20,"22,147,000,000","4,778,000,000",,"165,086,000,000"
6280,"Insurance contract liabilities","Assessment of the estimate of unpaid policy claims",443303,12/31/20,02/23/21,4,"KPMG LLP",,,,Atlanta,GA,GEORGIA,"US Southeast",10-K,2021-02-23,,"AFLAC INC",4977,"=""AFL""","1932 WYNNTON RD",,COLUMBUS,GA,GEORGIA,"US Southeast",,,"=""6321""","Accident and Health Insurance",524114,"Direct Health and Medical Insurance Carriers",34,44,12/31/20,"30,793,428,992",12/31/20,"22,147,000,000","4,778,000,000",,"165,086,000,000"
11515,"Business combinations","Accounting for Business combinations",455214,12/31/20,04/30/21,2,"Ernst & Young LLP",34,"Ernst & Young Auditores Independentes SS",1448,"Belo Horizonte",D5,BRAZIL,Foreign,20-F,2021-04-30,,"Afya Ltd",1771007,"=""AFYA""","ALAMEDA OSCAR NIEMEYER, NO. 119","15TH FLOOR, VILA DA SERRA","NOVA LIMA, MINAS GERAIS",D5,BRAZIL,Foreign,,,"=""8200""","Services-Educational Services",611710,"Educational Support Services",34,25,12/29/20,"2,240,017,152",12/31/20,"231,256,000","59,294,000","40,278,000","922,778,000"
6128,"Other investments","Fair Value of Investments in Certain Residential Mortgage Loans, Commercial Loans, and Non-QM Loans",443066,12/31/20,02/22/21,1,"PricewaterhouseCoopers LLP",,,,"New York",NY,"NEW YORK","US Mid Atlantic",10-K,2021-02-23,,"AG Mortgage Investment Trust, Inc.",1514281,"=""MITN""","245 PARK AVENUE","26TH FLOOR","NEW YORK",NY,"NEW YORK","US Mid Atlantic",,,"=""6798""","Real Estate Investment Trusts",525990,"Other Financial Vehicles",34,3,12/31/20,"122,230,176",12/31/20,"-391,590,000","-420,919,000",,"1,400,045,000"
8060,"Sales return and allowances","Assessment of the reserve and allowance for volume discount and sales incentive programs in certain geographic regions",444991,12/31/20,02/26/21,4,"KPMG LLP",,,,Atlanta,GA,GEORGIA,"US Southeast",10-K,2021-03-01,,"AGCO CORP /DE",880266,"=""AGCO""","4205 RIVER GREEN PKWAY",,DULUTH,GA,GEORGIA,"US Southeast",,,"=""3523""","Farm Machinery and Equipment",333111,"Farm Machinery and Equipment Manufacturing",34,103,12/31/20,"7,727,856,640",12/31/20,"9,149,700,000","427,100,000","1,217,900,000","8,504,200,000"
8061,"Other income taxes","Assessment of gross unrecognized income tax benefits in certain jurisdictions",444991,12/31/20,02/26/21,4,"KPMG LLP",,,,Atlanta,GA,GEORGIA,"US Southeast",10-K,2021-03-01,,"AGCO CORP /DE",880266,"=""AGCO""","4205 RIVER GREEN PKWAY",,DULUTH,GA,GEORGIA,"US Southeast",,,"=""3523""","Farm Machinery and Equipment",333111,"Farm Machinery and Equipment Manufacturing",34,103,12/31/20,"7,727,856,640",12/31/20,"9,149,700,000","427,100,000","1,217,900,000","8,504,200,000"
8062,Goodwill,"Assessment of goodwill impairment for certain reporting units",444991,12/31/20,02/26/21,4,"KPMG LLP",,,,Atlanta,GA,GEORGIA,"US Southeast",10-K,2021-03-01,,"AGCO CORP /DE",880266,"=""AGCO""","4205 RIVER GREEN PKWAY",,DULUTH,GA,GEORGIA,"US Southeast",,,"=""3523""","Farm Machinery and Equipment",333111,"Farm Machinery and Equipment Manufacturing",34,103,12/31/20,"7,727,856,640",12/31/20,"9,149,700,000","427,100,000","1,217,900,000","8,504,200,000"
9382,"Revenue from customer contracts","License and Stock Purchase Agreement with Betta Pharmaceuticals Co., LTD",449129,12/31/20,03/16/21,4,"KPMG LLP",,,,Boston,MA,MASSACHUSETTS,"US New England",10-K,2021-03-16,Yes,"AGENUS INC",1098972,"=""AGEN""","3 FORBES ROAD",,LEXINGTON,MA,MASSACHUSETTS,"US New England",,,"=""2836""","Biological Products, Except Diagnostic Substances",325414,"Biological Product (except Diagnostic) Manufacturing",34,3,12/31/20,"611,901,888",12/31/20,"88,170,000","-180,914,000","-213,093,000","214,514,000"
8089,"Sales return and allowances","Product Revenue -Net",445513,12/31/20,03/01/21,2,"Ernst & Young LLP",,,,Iselin,NJ,"NEW JERSEY","US Mid Atlantic",10-K,2021-03-01,Yes,"AGILE THERAPEUTICS INC",1261249,,"500 COLLEGE ROAD EAST","SUITE 310",PRINCETON,NJ,"NEW JERSEY","US Mid Atlantic",,,"=""2834""","Pharmaceutical Preparations",325412,"Pharmaceutical Preparation Manufacturing",34,3,12/31/20,"251,302,944",12/31/20,"749,000","-51,853,000",,"73,062,000"
4847,"Uncertain tax positions","Uncertain Tax Positions
",437438,10/31/20,12/17/20,1,"PricewaterhouseCoopers LLP",,,,"San Jose",CA,CALIFORNIA,"US West",10-K,2020-12-18,,"AGILENT TECHNOLOGIES, INC.",1090872,"=""A""","5301 STEVENS CREEK BLVD",,"SANTA CLARA",CA,CALIFORNIA,"US West",,,"=""3826""","Laboratory Analytical Instruments",334515,"Instrument Manufacturing for Measuring and Testing Electricity and Electrical Signals",34,102,10/31/20,"31,239,540,736",10/31/20,"5,339,000,000","719,000,000","440,000,000","9,627,000,000"
7765,"Other liabilities and provisions","Valuation of the obligation under the tax receivable agreement",446694,12/31/20,02/16/21,4,"KPMG LLP",,,,Minneapolis,MN,MINNESOTA,"US Midwest",DRS/A,2021-02-16,,"AGILITI, INC. \DE",1749704,,"11095 VIKING DRIVE, SUITE 300",,"EDEN PRAIRIE",MN,MINNESOTA,"US Midwest",,,"=""7350""","Services-Miscellaneous Equipment Rental & Leasing",532490,"Other Commercial and Industrial Machinery and Equipment Rental and Leasing",34,,,,12/31/20,"773,312,000","-22,478,000","-777,407,000","1,903,356,000"
7766,"Business combinations","Acquisition date fair value of customer relationship asset",446694,12/31/20,02/16/21,4,"KPMG LLP",,,,Minneapolis,MN,MINNESOTA,"US Midwest",DRS/A,2021-02-16,,"AGILITI, INC. \DE",1749704,,"11095 VIKING DRIVE, SUITE 300",,"EDEN PRAIRIE",MN,MINNESOTA,"US Midwest",,,"=""7350""","Services-Miscellaneous Equipment Rental & Leasing",532490,"Other Commercial and Industrial Machinery and Equipment Rental and Leasing",34,,,,12/31/20,"773,312,000","-22,478,000","-777,407,000","1,903,356,000"
8602,"Other liabilities and provisions","Valuation of the obligation under the tax receivable agreement",446573,12/31/20,02/16/21,4,"KPMG LLP",,,,Minneapolis,MN,MINNESOTA,"US Midwest",S-1,2021-03-05,,"AGILITI, INC. \DE",1749704,,"11095 VIKING DRIVE, SUITE 300",,"EDEN PRAIRIE",MN,MINNESOTA,"US Midwest",,,"=""7350""","Services-Miscellaneous Equipment Rental & Leasing",532490,"Other Commercial and Industrial Machinery and Equipment Rental and Leasing",34,,,,12/31/20,"773,312,000","-22,478,000","-777,407,000","1,903,356,000"
8603,"Business combinations","Acquisition date fair value of customer relationship asset",446573,12/31/20,02/16/21,4,"KPMG LLP",,,,Minneapolis,MN,MINNESOTA,"US Midwest",S-1,2021-03-05,,"AGILITI, INC. \DE",1749704,,"11095 VIKING DRIVE, SUITE 300",,"EDEN PRAIRIE",MN,MINNESOTA,"US Midwest",,,"=""7350""","Services-Miscellaneous Equipment Rental & Leasing",532490,"Other Commercial and Industrial Machinery and Equipment Rental and Leasing",34,,,,12/31/20,"773,312,000","-22,478,000","-777,407,000","1,903,356,000"
10937,"Other liabilities and provisions","Valuation of the obligation under the tax receivable agreement",452755,12/31/20,02/16/21,4,"KPMG LLP",,,,Minneapolis,MN,MINNESOTA,"US Midwest",S-1/A,2021-04-15,,"AGILITI, INC. \DE",1749704,,"11095 VIKING DRIVE, SUITE 300",,"EDEN PRAIRIE",MN,MINNESOTA,"US Midwest",,,"=""7350""","Services-Miscellaneous Equipment Rental & Leasing",532490,"Other Commercial and Industrial Machinery and Equipment Rental and Leasing",34,,,,12/31/20,"773,312,000","-22,478,000","-777,407,000","1,903,356,000"
10938,"Business combinations","Acquisition date fair value of customer relationship asset",452755,12/31/20,02/16/21,4,"KPMG LLP",,,,Minneapolis,MN,MINNESOTA,"US Midwest",S-1/A,2021-04-15,,"AGILITI, INC. \DE",1749704,,"11095 VIKING DRIVE, SUITE 300",,"EDEN PRAIRIE",MN,MINNESOTA,"US Midwest",,,"=""7350""","Services-Miscellaneous Equipment Rental & Leasing",532490,"Other Commercial and Industrial Machinery and Equipment Rental and Leasing",34,,,,12/31/20,"773,312,000","-22,478,000","-777,407,000","1,903,356,000"
11189,"Other liabilities and provisions","Valuation of the obligation under the tax receivable agreement",453518,12/31/20,02/16/21,4,"KPMG LLP",,,,Minneapolis,MN,MINNESOTA,"US Midwest",S-1/A,2021-04-21,,"AGILITI, INC. \DE",1749704,,"11095 VIKING DRIVE, SUITE 300",,"EDEN PRAIRIE",MN,MINNESOTA,"US Midwest",,,"=""7350""","Services-Miscellaneous Equipment Rental & Leasing",532490,"Other Commercial and Industrial Machinery and Equipment Rental and Leasing",34,,,,12/31/20,"773,312,000","-22,478,000","-777,407,000","1,903,356,000"
11190,"Business combinations","Acquisition date fair value of customer relationship asset",453518,12/31/20,02/16/21,4,"KPMG LLP",,,,Minneapolis,MN,MINNESOTA,"US Midwest",S-1/A,2021-04-21,,"AGILITI, INC. \DE",1749704,,"11095 VIKING DRIVE, SUITE 300",,"EDEN PRAIRIE",MN,MINNESOTA,"US Midwest",,,"=""7350""","Services-Miscellaneous Equipment Rental & Leasing",532490,"Other Commercial and Industrial Machinery and Equipment Rental and Leasing",34,,,,12/31/20,"773,312,000","-22,478,000","-777,407,000","1,903,356,000"
11284,"Other liabilities and provisions","Valuation of the obligation under the tax receivable agreement",454242,12/31/20,02/16/21,4,"KPMG LLP",,,,Minneapolis,MN,MINNESOTA,"US Midwest",424B4,2021-04-26,,"AGILITI, INC. \DE",1749704,,"11095 VIKING DRIVE, SUITE 300",,"EDEN PRAIRIE",MN,MINNESOTA,"US Midwest",,,"=""7350""","Services-Miscellaneous Equipment Rental & Leasing",532490,"Other Commercial and Industrial Machinery and Equipment Rental and Leasing",34,,,,12/31/20,"773,312,000","-22,478,000","-777,407,000","1,903,356,000"
11285,"Business combinations","Acquisition date fair value of customer relationship asset",454242,12/31/20,02/16/21,4,"KPMG LLP",,,,Minneapolis,MN,MINNESOTA,"US Midwest",424B4,2021-04-26,,"AGILITI, INC. \DE",1749704,,"11095 VIKING DRIVE, SUITE 300",,"EDEN PRAIRIE",MN,MINNESOTA,"US Midwest",,,"=""7350""","Services-Miscellaneous Equipment Rental & Leasing",532490,"Other Commercial and Industrial Machinery and Equipment Rental and Leasing",34,,,,12/31/20,"773,312,000","-22,478,000","-777,407,000","1,903,356,000"
12804,"Insurance contract liabilities","Valuation of incurred but not reported claims",462806,12/31/20,08/30/21,2,"Ernst & Young LLP",,,,"Los Angeles",CA,CALIFORNIA,"US West",S-1,2021-08-30,,"agilon health, inc.",1831097,"=""AGL""","440 POLARIS PARKWAY","SUITE 550",WESTERVILLE,OH,OHIO,"US Midwest",,,"=""8090""","Services-Misc Health & Allied Services, NEC",541511,"Custom Computer Programming Services",34,,,,12/31/20,"1,218,333,000","-60,052,000","-77,238,000","446,361,000"
12868,"Insurance contract liabilities","Valuation of incurred but not reported claims",463248,12/31/20,08/30/21,2,"Ernst & Young LLP",,,,"Los Angeles",CA,CALIFORNIA,"US West",S-1/A,2021-09-07,,"agilon health, inc.",1831097,"=""AGL""","440 POLARIS PARKWAY","SUITE 550",WESTERVILLE,OH,OHIO,"US Midwest",,,"=""8090""","Services-Misc Health & Allied Services, NEC",541511,"Custom Computer Programming Services",34,,,,12/31/20,"1,218,333,000","-60,052,000","-77,238,000","446,361,000"
12930,"Insurance contract liabilities","Valuation of incurred but not reported claims",463601,12/31/20,08/30/21,2,"Ernst & Young LLP",,,,"Los Angeles",CA,CALIFORNIA,"US West",424B4,2021-09-13,,"agilon health, inc.",1831097,"=""AGL""","440 POLARIS PARKWAY","SUITE 550",WESTERVILLE,OH,OHIO,"US Midwest",,,"=""8090""","Services-Misc Health & Allied Services, NEC",541511,"Custom Computer Programming Services",34,,,,12/31/20,"1,218,333,000","-60,052,000","-77,238,000","446,361,000"
6636,"Discontinued operations","Liability related to sale of future revenue",443611,12/31/20,02/25/21,1,"PricewaterhouseCoopers LLP",,,,Boston,MA,MASSACHUSETTS,"US New England",10-K,2021-02-25,,"AGIOS PHARMACEUTICALS, INC.",1439222,"=""AGIO""","88 SIDNEY STREET",,CAMBRIDGE,MA,MASSACHUSETTS,"US New England",,,"=""2834""","Pharmaceutical Preparations",325412,"Pharmaceutical Preparation Manufacturing",34,43,12/31/20,"3,002,505,472",12/31/20,"203,196,000","-327,370,000",,"852,952,000"
7462,"Depreciation and amortization","Agency securities and non-agency securities of high credit quality net premium amortization",444917,12/31/20,02/26/21,2,"Ernst & Young LLP",,,,Tysons,VA,VIRGINIA,"US Mid Atlantic",10-K,2021-02-26,,"AGNC Investment Corp.",1423689,"=""AGNC""","7373 WISCONSIN AVENUE, 22ND FLOOR",,BETHESDA,MD,MARYLAND,"US Mid Atlantic",,,"=""6798""","Real Estate Investment Trusts",525990,"Other Financial Vehicles",34,16,12/31/20,"8,416,200,192",12/31/20,"-173,000,000","-266,000,000","10,553,000,000","81,817,000,000"
9996,Goodwill,"Goodwill and property, plant and mine development impairment",450576,12/31/20,03/26/21,2,"Ernst & Young LLP",192,"Ernst & Young LLP Chartered Accountants",1263,Toronto,A6,ONTARIO,Canada,40-F,2021-03-26,,"AGNICO EAGLE MINES LTD",2809,"=""AEM""","145 KING STREET EAST","SUITE 400",TORONTO,A6,ONTARIO,Canada,,,"=""1040""","Metal Mining",212221,"Gold Ore Mining",34,71,12/31/20,"17,155,167,232",12/31/20,"3,138,113,000","511,607,000","5,275,421,000","9,614,755,000"
9185,"Goodwill and intangible assets","Goodwill and Indefinite-Lived Intangible Assets — Tecnidex Reporting Unit and Trade Names — Refer to Notes 2 and 8 to the financial statements",448852,12/31/20,03/15/21,3,"Deloitte & Touche LLP",,,,Philadelphia,PA,PENNSYLVANIA,"US Mid Atlantic",10-K,2021-03-15,,"AgroFresh Solutions, Inc.",1592016,,"100 S. INDEPENDENCE MALL WEST",,PHILADELPHIA,PA,PENNSYLVANIA,"US Mid Atlantic",,,"=""2870""","Agricultural Chemicals",423820,"Farm and Garden Machinery and Equipment Merchant Wholesalers",34,2,12/31/20,"119,018,248",12/31/20,"157,643,000","-53,711,000","-171,559,000","785,783,000"
11344,"Equity investments and joint ventures","Investment in Affiliates - Other-than-temporary Impairment (“OTTI”) assessment of the equity method investment in CNFinance Holdings Limited (“CNFinance”) — Refer to Notes 2(i) and 7 to the financial statements",454548,12/31/20,04/28/21,3,"Deloitte & Touche LLP",8,"Deloitte Touche Tohmatsu",1104,"Hong Kong",F4,CHINA,Foreign,20-F,2021-04-28,,"AIFU Inc.",1413855,"=""AIFU""","60/F PEARL RIVER TOWER","NO.15 WEST ZHUJIANG ROAD TIANHE DISTRICT",GUANGZHOU,F4,CHINA,Foreign,,,"=""6411""","Insurance Agents, Brokers, and Service",524126,"Direct Property and Casualty Insurance Carriers",34,12,12/29/20,"823,166,208",12/31/20,"499,732,000","41,019,000","263,562,000","471,115,000"
9142,"Business combinations","Accounting for Acquisitions of Real Estate",448423,12/31/20,03/12/21,2,"Ernst & Young LLP",,,,Denver,CO,COLORADO,"US West",10-K,2021-03-12,,"Aimco OP L.P.",1820878,,"4582 S ULSTER STREET, SUITE 1450",,DENVER,CO,COLORADO,"US West",,,"=""6500""","Real Estate",531110,"Lessors of Residential Buildings and Dwellings",34,,,,12/31/20,"151,451,000","-5,310,000",,"1,840,492,000"
6045,Leases,"Assessment of the carrying value of flight equipment subject to operating leases",442941,12/31/20,02/22/21,4,"KPMG LLP",,,,"Los Angeles",CA,CALIFORNIA,"US West",10-K,2021-02-22,,"AIR LEASE CORP",1487712,"=""AL""","2000 AVENUE OF THE STARS","SUITE 1000N","LOS ANGELES",CA,CALIFORNIA,"US West",,,"=""7359""","Equipment Rental and Leasing, NEC",532411,"Commercial Air, Rail, and Water Transportation Equipment Rental and Leasing",34,44,12/31/20,"5,057,345,536",12/31/20,"2,015,439,000","516,264,000",,"25,215,175,000"
4683,"Revenue from customer contracts","Revenue – On-site Industrial Gas Customer Contracts – Refer to Notes 1 and 4 to the financial statements",435849,09/30/20,11/19/20,3,"Deloitte & Touche LLP",,,,Philadelphia,PA,PENNSYLVANIA,"US Mid Atlantic",10-K,2020-11-19,,"Air Products & Chemicals, Inc.",2969,"=""APD""","1940 AIR PRODUCTS BLVD.",,ALLENTOWN,PA,PENNSYLVANIA,"US Mid Atlantic",,,"=""2810""","Industrial Inorganic Chemicals",325120,"Industrial Gas Manufacturing",34,298,09/30/20,"65,832,259,584",09/30/20,"8,856,300,000","1,886,700,000","10,752,500,000","25,168,500,000"
7725,"Other debt","Fair Value Measurements - Level 3 Liabilities - Refer to Notes D and E to the financial statements",445468,12/31/20,03/01/21,3,"Deloitte & Touche LLP",,,,Cincinnati,OH,OHIO,"US Midwest",10-K,2021-03-01,,"Air Transport Services Group, Inc.",894081,"=""ATSG""","145 HUNTER DR",,WILMINGTON,OH,OHIO,"US Midwest",,,"=""4513""","Air Courier Services",492110,Couriers,34,31,12/31/20,"1,866,611,584",12/31/20,"1,570,575,000","32,115,000","339,207,000","3,001,745,000"
7360,"Uncertain tax positions","Uncertain Tax Positions",444757,12/31/20,02/26/21,1,"PricewaterhouseCoopers LLP",,,,"San Francisco",CA,CALIFORNIA,"US West",10-K,2021-02-26,,"Airbnb, Inc.",1559720,"=""ABNB""","888 BRANNAN ST.",,"SAN FRANCISCO",CA,CALIFORNIA,"US West",,,"=""7340""","Services-To Dwellings & Other Buildings",511210,"Software Publishers",34,147,12/31/20,"16,955,400,192",12/31/20,"3,378,199,000","-4,584,716,000","2,170,096,000","10,491,499,000"
7365,"Other contingent liabilities","Massachusetts Tax Litigation Matter",444750,12/31/20,02/26/21,1,"PricewaterhouseCoopers LLP",,,,Boston,MA,MASSACHUSETTS,"US New England",10-K,2021-02-26,,"AKAMAI TECHNOLOGIES INC",1086222,"=""AKAM""","145 BROADWAY",,CAMBRIDGE,MA,MASSACHUSETTS,"US New England",,,"=""7389""","Business Services, NEC",334119,"Other Computer Peripheral Equipment Manufacturing",34,105,12/31/20,"17,082,893,312",12/31/20,"3,198,149,000","557,054,000","2,342,201,000","7,764,130,000"
6944,"Other intangible assets","Valuation of Impairment of Intangible Assets",443907,12/31/20,02/25/21,2,"Ernst & Young LLP",,,,Boston,MA,MASSACHUSETTS,"US New England",10-K,2021-02-25,,"Akebia Therapeutics, Inc.",1517022,"=""AKBA""","245 FIRST STREET",,CAMBRIDGE,MA,MASSACHUSETTS,"US New England",,,"=""2834""","Pharmaceutical Preparations",325412,"Pharmaceutical Preparation Manufacturing",34,3,12/31/20,"414,607,424",12/31/20,"294,644,000","-384,841,000","48,395,000","644,139,000"
6945,"Revenue from customer contracts","Valuation of Excess Purchase Commitment Liability",443907,12/31/20,02/25/21,2,"Ernst & Young LLP",,,,Boston,MA,MASSACHUSETTS,"US New England",10-K,2021-02-25,,"Akebia Therapeutics, Inc.",1517022,"=""AKBA""","245 FIRST STREET",,CAMBRIDGE,MA,MASSACHUSETTS,"US New England",,,"=""2834""","Pharmaceutical Preparations",325412,"Pharmaceutical Preparation Manufacturing",34,3,12/31/20,"414,607,424",12/31/20,"294,644,000","-384,841,000","48,395,000","644,139,000"
5587,"Regulatory assets and liabilities","Impact of Rate Regulation on the Financial Statements – Refer to Note 1 (Summary of Significant Accounting Policies – Regulatory Assets and Liabilities) and Note 2 (Regulatory Matters – Alabama Power) to the financial statements",442118,12/31/20,02/17/21,3,"Deloitte & Touche LLP",,,,Birmingham,AL,ALABAMA,"US Southeast",10-K,2021-02-18,,"ALABAMA POWER CO",3153,,"600 N 18TH ST","P O BOX 2641",BIRMINGHAM,AL,ALABAMA,"US Southeast",92122,"SOUTHERN CO","=""4911""","Electric Services",221122,"Electric Power Distribution",34,,,,12/31/20,"5,830,000,000","1,165,000,000",,"30,803,000,000"
7692,Inventory,"Sufficiency of evidence over the existence of inventory",443940,12/31/20,02/25/21,4,"KPMG LLP",,,,"San Antonio",TX,TEXAS,"US Southwest",10-K,2021-02-26,,"ALAMO GROUP INC",897077,"=""ALG""","1627 E WALNUT",,SEGUIN,TX,TEXAS,"US Southwest",,,"=""3523""","Farm Machinery and Equipment",333111,"Farm Machinery and Equipment Manufacturing",34,138,12/31/20,"1,629,179,264",12/31/20,"1,163,466,000","57,804,000","237,339,000","1,109,329,000"
6769,"Property, plant and equipment","Evaluation of the carrying value of mineral property, plant and equipment of the Young-Davidson cash generating unit",444066,12/31/20,02/23/21,4,"KPMG LLP",187,"KPMG LLP Chartered Accountants",85,Toronto,A6,ONTARIO,Canada,6-K,2021-02-25,,"ALAMOS GOLD INC",1178819,"=""AGI""","181 BAY STREET","SUITE 3910",TORONTO,A6,ONTARIO,Canada,,,"=""1040""","Metal Mining",212221,"Gold Ore Mining",34,9,12/31/20,"3,436,797,184",12/31/20,"748,100,000","144,200,000",,"3,636,500,000"
10263,"Property, plant and equipment","Evaluation of the carrying value of mineral property, plant and equipment of the Young-Davidson cash generating unit",451266,12/31/20,02/23/21,4,"KPMG LLP",187,"KPMG LLP Chartered Accountants",85,Toronto,A6,ONTARIO,Canada,40-F,2021-03-30,,"ALAMOS GOLD INC",1178819,"=""AGI""","181 BAY STREET","SUITE 3910",TORONTO,A6,ONTARIO,Canada,,,"=""1040""","Metal Mining",212221,"Gold Ore Mining",34,9,12/31/20,"3,436,797,184",12/31/20,"748,100,000","144,200,000",,"3,636,500,000"
6723,"Business combinations","Acquisition of Shooter Detection Systems - Valuation of Acquired Developed Technology Intangible Asset",443968,12/31/20,02/25/21,1,"PricewaterhouseCoopers LLP",,,,McLean,VA,VIRGINIA,"US Mid Atlantic",10-K,2021-02-25,,"Alarm.com Holdings, Inc.",1459200,"=""ALRM""","8281 GREENSBORO DRIVE","SUITE 100",TYSONS,VA,VIRGINIA,"US Mid Atlantic",,,"=""7372""","Prepackaged Software",541511,"Custom Computer Programming Services",34,103,12/31/20,"5,119,080,448",12/31/20,"618,003,000","77,853,000","262,346,000","731,687,000"
7139,"Revenue from customer contracts","Assessment of Mileage Plan™ model",444780,12/31/20,02/26/21,4,"KPMG LLP",,,,Seattle,WA,WASHINGTON,"US West",10-K,2021-02-26,,"ALASKA AIR GROUP, INC.",766421,"=""ALK""","19300 INTERNATIONAL BOULEVARD",,SEATTLE,WA,WASHINGTON,"US West",,,"=""4512""","Air Transportation, Scheduled",481111,"Scheduled Passenger Air Transportation",34,52,12/31/20,"6,459,314,688",12/31/20,"3,566,000,000","-1,324,000,000","938,000,000","14,046,000,000"
7140,Leases,"Evaluation of leased aircraft return costs for permanently parked aircraft",444780,12/31/20,02/26/21,4,"KPMG LLP",,,,Seattle,WA,WASHINGTON,"US West",10-K,2021-02-26,,"ALASKA AIR GROUP, INC.",766421,"=""ALK""","19300 INTERNATIONAL BOULEVARD",,SEATTLE,WA,WASHINGTON,"US West",,,"=""4512""","Air Transportation, Scheduled",481111,"Scheduled Passenger Air Transportation",34,52,12/31/20,"6,459,314,688",12/31/20,"3,566,000,000","-1,324,000,000","938,000,000","14,046,000,000"
6673,"Revenue from customer contracts","Evaluation of estimated total contract costs at completion for Albany Engineered Composites revenue recognition for certain firm-fixed-price contracts",443850,12/31/20,02/25/21,4,"KPMG LLP",,,,Albany,NY,"NEW YORK","US Mid Atlantic",10-K,2021-02-25,,"ALBANY INTERNATIONAL CORP /DE/",819793,"=""AIN""","216 AIRPORT DRIVE",,ROCHESTER,NH,"NEW HAMPSHIRE","US New England",,,"=""2221""","Broadwoven Fabric Mills, Manmade Fiber and Silk",313210,"Broadwoven Fabric Mills",34,73,12/31/20,"2,255,784,960",12/31/20,"900,610,000","98,589,000","581,644,000","1,549,936,000"
5787,Goodwill,"Goodwill Impairment Assessment – Refining Solutions Reporting Unit",442633,12/31/20,02/19/21,1,"PricewaterhouseCoopers LLP",,,,Charlotte,NC,"NORTH CAROLINA","US Southeast",10-K,2021-02-19,,"ALBEMARLE CORP",915913,"=""ALB""","4250 CONGRESS STREET","SUITE 900",CHARLOTTE,NC,"NORTH CAROLINA","US Southeast",,,"=""2821""","Plastics Material and Synthetic Resins, and Nonvulcanizable Elastomers",325211,"Plastics Material and Resin Manufacturing",34,148,12/31/20,"15,761,332,224",12/31/20,"3,128,909,000","375,764,000","2,253,602,000","10,450,946,000"
6608,"Research and development expenses","Accounting for Clinical Trial Expense",443643,12/31/20,02/25/21,2,"Ernst & Young LLP",,,,Boston,MA,MASSACHUSETTS,"US New England",10-K,2021-02-25,,"ALBIREO PHARMA, INC.",1322505,,"10 POST OFFICE SQUARE","SUITE 502 SOUTH",BOSTON,MA,MASSACHUSETTS,"US New England",,,"=""2834""","Pharmaceutical Preparations",325412,"Pharmaceutical Preparation Manufacturing",34,38,12/31/20,"716,705,088",12/31/20,"8,308,000","-107,633,000","163,971,000","285,607,000"
7037,"Deferred income taxes","Realization of Net Deferred Tax Assets at Alcoa Canada Company",444172,12/31/20,02/25/21,1,"PricewaterhouseCoopers LLP",,,,Pittsburgh,PA,PENNSYLVANIA,"US Mid Atlantic",10-K,2021-02-25,,"Alcoa Corp",1675149,"=""AA""","201 ISABELLA STREET","SUITE 500",PITTSBURGH,PA,PENNSYLVANIA,"US Mid Atlantic",,,"=""3334""","Primary Production of Aluminum",331312,"Primary Aluminum Production",34,23,12/31/20,"4,286,794,496",12/31/20,"9,286,000,000","-170,000,000",,"14,860,000,000"
6284,"Goodwill and intangible assets","Goodwill and Alcon Brand Name Impairment Assessments",443202,12/31/20,02/23/21,1,"PricewaterhouseCoopers LLP",,,,"Fort Worth",TX,TEXAS,"US Southwest",20-F,2021-02-23,,"ALCON INC",1167379,"=""ALC""","6201 SOUTH FREEWAY",,"FORT WORTH",TX,TEXAS,"US Southwest",,,"=""3851""","Ophthalmic Goods",339115,"Ophthalmic Goods Manufacturing",34,66,12/29/20,"32,342,532,096",12/31/20,"6,833,000,000","-531,000,000","820,000,000","27,600,000,000"
6285,"Other intangible assets","In-Process Research and Development and Definite Lived Intangible Asset Impairment Assessments",443202,12/31/20,02/23/21,1,"PricewaterhouseCoopers LLP",,,,"Fort Worth",TX,TEXAS,"US Southwest",20-F,2021-02-23,,"ALCON INC",1167379,"=""ALC""","6201 SOUTH FREEWAY",,"FORT WORTH",TX,TEXAS,"US Southwest",,,"=""3851""","Ophthalmic Goods",339115,"Ophthalmic Goods Manufacturing",34,66,12/29/20,"32,342,532,096",12/31/20,"6,833,000,000","-531,000,000","820,000,000","27,600,000,000"
6991,"Revenue from customer contracts","Revenue Recognition",444183,12/31/20,02/25/21,2,"Ernst & Young LLP",,,,"San Jose",CA,CALIFORNIA,"US West",10-K,2021-02-25,,"Alector, Inc.",1653087,"=""ALEC""","131 OYSTER POINT BLVD., SUITE 600",,"SOUTH SAN FRANCISCO",CA,CALIFORNIA,"US West",,,"=""2836""","Biological Products, Except Diagnostic Substances",325414,"Biological Product (except Diagnostic) Manufacturing",34,15,12/31/20,"1,200,055,040",12/31/20,"21,098,000","-190,228,000",,"488,251,000"
7617,"Equity investments and joint ventures","Investment in Affiliates — Determination of Impairment Indicators — Refer to Note 5 to the financial statements",444119,12/31/20,02/26/21,3,"Deloitte & Touche LLP",,,,Honolulu,HI,HAWAII,"US West",10-K,2021-02-26,,"Alexander & Baldwin, Inc.",1545654,"=""ALEX""","822 BISHOP STREET, P.O. BOX 3440",,HONOLULU,HI,HAWAII,"US West",,,"=""6798""","Real Estate Investment Trusts",531312,"Nonresidential Property Managers",34,17,12/31/20,"1,243,832,064",12/31/20,"305,300,000","5,600,000","1,092,100,000","2,036,000,000"
5354,"Real estate investments","Real Estate - Refer to Note 3 to the financial statements",441880,12/31/20,02/16/21,3,"Deloitte & Touche LLP",,,,"New York",NY,"NEW YORK","US Mid Atlantic",10-K,2021-02-16,,"ALEXANDERS INC",3499,"=""ALX""","210 ROUTE 4 EAST",,PARAMUS,NJ,"NEW JERSEY","US Mid Atlantic",,,"=""6798""","Real Estate Investment Trusts",525990,"Other Financial Vehicles",34,277,12/31/20,"1,416,506,880",12/31/20,"199,142,000","41,939,000",,"1,404,138,000"
4939,"Business combinations","Recognition of acquired real estate – Purchase price accounting",440653,12/31/20,02/01/21,2,"Ernst & Young LLP",,,,"Los Angeles",CA,CALIFORNIA,"US West",10-K,2021-02-01,,"ALEXANDRIA REAL ESTATE EQUITIES, INC.",1035443,"=""ARE""","26 NORTH EUCLID AVENUE",,PASADENA,CA,CALIFORNIA,"US West",,,"=""6798""","Real Estate Investment Trusts",525990,"Other Financial Vehicles",34,178,12/31/20,"24,360,949,760",12/31/20,"1,885,637,000","770,959,000",,"22,827,878,000"
8932,"Business combinations","Keno Hill cash-generating unit (CGU) impairment assessment",448458,12/31/20,03/11/21,1,"PricewaterhouseCoopers LLP",191,"PricewaterhouseCoopers LLP Chartered Accountants",271,Vancouver,A1,"BRITISH COLUMBIA",Canada,40-F,2021-03-11,,"ALEXCO RESOURCE CORP",1364128,,"SUITE 1150","200 GRANVILLE ST",VANCOUVER,A1,"BRITISH COLUMBIA",Canada,,,"=""1040""","Metal Mining",212221,"Gold Ore Mining",34,3,12/29/20,"359,984,000",12/31/20,"2,250,000","-24,516,000",,"134,746,000"
8933,"Other investments","Valuations of the embedded derivative asset",448458,12/31/20,03/11/21,1,"PricewaterhouseCoopers LLP",191,"PricewaterhouseCoopers LLP Chartered Accountants",271,Vancouver,A1,"BRITISH COLUMBIA",Canada,40-F,2021-03-11,,"ALEXCO RESOURCE CORP",1364128,,"SUITE 1150","200 GRANVILLE ST",VANCOUVER,A1,"BRITISH COLUMBIA",Canada,,,"=""1040""","Metal Mining",212221,"Gold Ore Mining",34,3,12/29/20,"359,984,000",12/31/20,"2,250,000","-24,516,000",,"134,746,000"
5014,"Other intangible assets","Definite-lived Intangible Asset Impairment - KANUMA Purchased Technology Intangible Asset",441146,12/31/20,02/08/21,1,"PricewaterhouseCoopers LLP",,,,Boston,MA,MASSACHUSETTS,"US New England",10-K,2021-02-08,,"ALEXION PHARMACEUTICALS, INC.",899866,,"121 SEAPORT BOULEVARD",,BOSTON,MA,MASSACHUSETTS,"US New England",,,"=""2834""","Pharmaceutical Preparations",325412,"Pharmaceutical Preparation Manufacturing",34,156,12/31/20,"34,294,679,552",12/31/20,"6,069,900,000","603,400,000","3,848,100,000","18,103,000,000"
5015,"Business combinations","Valuation of Purchased Technology Intangible Assets Acquired in the Portola Pharmaceuticals, Inc. Acquisition",441146,12/31/20,02/08/21,1,"PricewaterhouseCoopers LLP",,,,Boston,MA,MASSACHUSETTS,"US New England",10-K,2021-02-08,,"ALEXION PHARMACEUTICALS, INC.",899866,,"121 SEAPORT BOULEVARD",,BOSTON,MA,MASSACHUSETTS,"US New England",,,"=""2834""","Pharmaceutical Preparations",325412,"Pharmaceutical Preparation Manufacturing",34,156,12/31/20,"34,294,679,552",12/31/20,"6,069,900,000","603,400,000","3,848,100,000","18,103,000,000"
8516,"Regulatory assets and liabilities","Regulatory assets and liabilities—Recovery of costs through rate regulation",446232,12/31/20,03/04/21,2,"Ernst & Young LLP",192,"Ernst & Young LLP Chartered Accountants",1263,Toronto,A6,ONTARIO,Canada,40-F,2021-03-05,,"ALGONQUIN POWER & UTILITIES CORP.",1174169,"=""AQN""","354 DAVIS ROAD",,OAKVILLE,A6,ONTARIO,Canada,,,"=""4911""","Electric Services",221111,"Hydroelectric Power Generation",34,17,12/29/20,"8,707,349,504",12/31/20,"1,677,058,000","782,463,000","4,207,450,000","13,224,149,000"
8517,"Equity investments and joint ventures","Accounting for Long-term Investments and Related Financing Arrangements",446232,12/31/20,03/04/21,2,"Ernst & Young LLP",192,"Ernst & Young LLP Chartered Accountants",1263,Toronto,A6,ONTARIO,Canada,40-F,2021-03-05,,"ALGONQUIN POWER & UTILITIES CORP.",1174169,"=""AQN""","354 DAVIS ROAD",,OAKVILLE,A6,ONTARIO,Canada,,,"=""4911""","Electric Services",221111,"Hydroelectric Power Generation",34,17,12/29/20,"8,707,349,504",12/31/20,"1,677,058,000","782,463,000","4,207,450,000","13,224,149,000"
8518,Goodwill,"Impairment of Goodwill",446232,12/31/20,03/04/21,2,"Ernst & Young LLP",192,"Ernst & Young LLP Chartered Accountants",1263,Toronto,A6,ONTARIO,Canada,40-F,2021-03-05,,"ALGONQUIN POWER & UTILITIES CORP.",1174169,"=""AQN""","354 DAVIS ROAD",,OAKVILLE,A6,ONTARIO,Canada,,,"=""4911""","Electric Services",221111,"Hydroelectric Power Generation",34,17,12/29/20,"8,707,349,504",12/31/20,"1,677,058,000","782,463,000","4,207,450,000","13,224,149,000"
11585,"Regulatory assets and liabilities","Regulatory assets and liabilities—Recovery of costs through rate regulation",455503,12/31/20,03/04/21,2,"Ernst & Young LLP",192,"Ernst & Young LLP Chartered Accountants",1263,Toronto,A6,ONTARIO,Canada,6-K,2021-05-03,,"ALGONQUIN POWER & UTILITIES CORP.",1174169,"=""AQN""","354 DAVIS ROAD",,OAKVILLE,A6,ONTARIO,Canada,,,"=""4911""","Electric Services",221111,"Hydroelectric Power Generation",34,17,12/29/20,"8,707,349,504",12/31/20,"1,677,058,000","782,463,000","4,207,450,000","13,224,149,000"
11586,"Other investments","Accounting for Long-term Investments and Related Financing Arrangements",455503,12/31/20,03/04/21,2,"Ernst & Young LLP",192,"Ernst & Young LLP Chartered Accountants",1263,Toronto,A6,ONTARIO,Canada,6-K,2021-05-03,,"ALGONQUIN POWER & UTILITIES CORP.",1174169,"=""AQN""","354 DAVIS ROAD",,OAKVILLE,A6,ONTARIO,Canada,,,"=""4911""","Electric Services",221111,"Hydroelectric Power Generation",34,17,12/29/20,"8,707,349,504",12/31/20,"1,677,058,000","782,463,000","4,207,450,000","13,224,149,000"
11587,Goodwill,"Impairment of Goodwill",455503,12/31/20,03/04/21,2,"Ernst & Young LLP",192,"Ernst & Young LLP Chartered Accountants",1263,Toronto,A6,ONTARIO,Canada,6-K,2021-05-03,,"ALGONQUIN POWER & UTILITIES CORP.",1174169,"=""AQN""","354 DAVIS ROAD",,OAKVILLE,A6,ONTARIO,Canada,,,"=""4911""","Electric Services",221111,"Hydroelectric Power Generation",34,17,12/29/20,"8,707,349,504",12/31/20,"1,677,058,000","782,463,000","4,207,450,000","13,224,149,000"
4330,Goodwill,"Impairment Assessment on Goodwill Allocated to Reporting Units under the Digital Media and Entertainment Segment",429351,03/31/20,07/09/20,1,"PricewaterhouseCoopers LLP",95,PricewaterhouseCoopers,1389,"Hong Kong",F4,CHINA,Foreign,20-F,2020-07-09,,"Alibaba Group Holding Ltd",1577552,"=""BABA""","26/F TOWER ONE","TIMES SQUARE, 1 MATHESON STREET","CAUSEWAY BAY",K3,"HONG KONG",Foreign,,,"=""7389""","Business Services, NEC",518210,"Data Processing, Hosting, and Related Services",33,189,04/02/20,"488,695,562,240",03/31/20,"71,860,000,000","21,067,000,000","60,167,000,000","185,107,000,000"
4331,"Business combinations","Valuation of Intangible Assets Acquired in Connection with Business Combinations",429351,03/31/20,07/09/20,1,"PricewaterhouseCoopers LLP",95,PricewaterhouseCoopers,1389,"Hong Kong",F4,CHINA,Foreign,20-F,2020-07-09,,"Alibaba Group Holding Ltd",1577552,"=""BABA""","26/F TOWER ONE","TIMES SQUARE, 1 MATHESON STREET","CAUSEWAY BAY",K3,"HONG KONG",Foreign,,,"=""7389""","Business Services, NEC",518210,"Data Processing, Hosting, and Related Services",33,189,04/02/20,"488,695,562,240",03/31/20,"71,860,000,000","21,067,000,000","60,167,000,000","185,107,000,000"
4332,"Equity investments and joint ventures","Fair Value Determination Related to Investments in Privately Held Companies Accounted for Using the Measurement Alternative",429351,03/31/20,07/09/20,1,"PricewaterhouseCoopers LLP",95,PricewaterhouseCoopers,1389,"Hong Kong",F4,CHINA,Foreign,20-F,2020-07-09,,"Alibaba Group Holding Ltd",1577552,"=""BABA""","26/F TOWER ONE","TIMES SQUARE, 1 MATHESON STREET","CAUSEWAY BAY",K3,"HONG KONG",Foreign,,,"=""7389""","Business Services, NEC",518210,"Data Processing, Hosting, and Related Services",33,189,04/02/20,"488,695,562,240",03/31/20,"71,860,000,000","21,067,000,000","60,167,000,000","185,107,000,000"
4333,"Equity investments and joint ventures","Investment in Ant Small and Micro Financial Services Group Co., Ltd. (“Ant Group”)",429351,03/31/20,07/09/20,1,"PricewaterhouseCoopers LLP",95,PricewaterhouseCoopers,1389,"Hong Kong",F4,CHINA,Foreign,20-F,2020-07-09,,"Alibaba Group Holding Ltd",1577552,"=""BABA""","26/F TOWER ONE","TIMES SQUARE, 1 MATHESON STREET","CAUSEWAY BAY",K3,"HONG KONG",Foreign,,,"=""7389""","Business Services, NEC",518210,"Data Processing, Hosting, and Related Services",33,189,04/02/20,"488,695,562,240",03/31/20,"71,860,000,000","21,067,000,000","60,167,000,000","185,107,000,000"
4950,Goodwill,"Impairment Assessment on Goodwill Allocated to Reporting Units under the Digital Media and Entertainment Segment",440752,03/31/20,07/09/20,1,"PricewaterhouseCoopers LLP",95,PricewaterhouseCoopers,1389,"Hong Kong",F4,CHINA,Foreign,6-K,2021-02-02,,"Alibaba Group Holding Ltd",1577552,"=""BABA""","26/F TOWER ONE","TIMES SQUARE, 1 MATHESON STREET","CAUSEWAY BAY",K3,"HONG KONG",Foreign,,,"=""7389""","Business Services, NEC",518210,"Data Processing, Hosting, and Related Services",33,189,04/02/20,"488,695,562,240",03/31/20,"71,860,000,000","21,067,000,000","60,167,000,000","185,107,000,000"
4951,"Equity investments and joint ventures","Fair Value Determination Related to Investments in Privately Held Companies Accounted for Using the Measurement Alternative",440752,03/31/20,07/09/20,1,"PricewaterhouseCoopers LLP",95,PricewaterhouseCoopers,1389,"Hong Kong",F4,CHINA,Foreign,6-K,2021-02-02,,"Alibaba Group Holding Ltd",1577552,"=""BABA""","26/F TOWER ONE","TIMES SQUARE, 1 MATHESON STREET","CAUSEWAY BAY",K3,"HONG KONG",Foreign,,,"=""7389""","Business Services, NEC",518210,"Data Processing, Hosting, and Related Services",33,189,04/02/20,"488,695,562,240",03/31/20,"71,860,000,000","21,067,000,000","60,167,000,000","185,107,000,000"
4952,"Business combinations","Valuation of Intangible Assets Acquired in Connection with Business Combinations",440752,03/31/20,07/09/20,1,"PricewaterhouseCoopers LLP",95,PricewaterhouseCoopers,1389,"Hong Kong",F4,CHINA,Foreign,6-K,2021-02-02,,"Alibaba Group Holding Ltd",1577552,"=""BABA""","26/F TOWER ONE","TIMES SQUARE, 1 MATHESON STREET","CAUSEWAY BAY",K3,"HONG KONG",Foreign,,,"=""7389""","Business Services, NEC",518210,"Data Processing, Hosting, and Related Services",33,189,04/02/20,"488,695,562,240",03/31/20,"71,860,000,000","21,067,000,000","60,167,000,000","185,107,000,000"
4953,"Equity investments and joint ventures","Investment in Ant Small and Micro Financial Services Group Co., Ltd. (“Ant Group”)",440752,03/31/20,07/09/20,1,"PricewaterhouseCoopers LLP",95,PricewaterhouseCoopers,1389,"Hong Kong",F4,CHINA,Foreign,6-K,2021-02-02,,"Alibaba Group Holding Ltd",1577552,"=""BABA""","26/F TOWER ONE","TIMES SQUARE, 1 MATHESON STREET","CAUSEWAY BAY",K3,"HONG KONG",Foreign,,,"=""7389""","Business Services, NEC",518210,"Data Processing, Hosting, and Related Services",33,189,04/02/20,"488,695,562,240",03/31/20,"71,860,000,000","21,067,000,000","60,167,000,000","185,107,000,000"
7308,"Revenue from customer contracts","Revenue Recognition – Determination of Standalone Selling Price of Distinct Performance Obligations in Clear Aligner Contracts",444890,12/31/20,02/26/21,1,"PricewaterhouseCoopers LLP",,,,"San Jose",CA,CALIFORNIA,"US West",10-K,2021-02-26,,"ALIGN TECHNOLOGY INC",1097149,"=""ALGN""","410 NORTH SCOTTSDALE ROAD, SUITE 1300",,TEMPE,AZ,ARIZONA,"US Southwest",,,"=""3842""","Orthopedic, Prosthetic, and Surgical Appliances and Supplies",339114,"Dental Equipment and Supplies Manufacturing",34,534,12/31/20,"42,141,208,576",12/31/20,"2,471,941,000","1,775,888,000","2,658,976,000","4,829,683,000"
7309,"Deferred income taxes","Deferred Tax Asset – Valuation of Intellectual Property Rights",444890,12/31/20,02/26/21,1,"PricewaterhouseCoopers LLP",,,,"San Jose",CA,CALIFORNIA,"US West",10-K,2021-02-26,,"ALIGN TECHNOLOGY INC",1097149,"=""ALGN""","410 NORTH SCOTTSDALE ROAD, SUITE 1300",,TEMPE,AZ,ARIZONA,"US Southwest",,,"=""3842""","Orthopedic, Prosthetic, and Surgical Appliances and Supplies",339114,"Dental Equipment and Supplies Manufacturing",34,534,12/31/20,"42,141,208,576",12/31/20,"2,471,941,000","1,775,888,000","2,658,976,000","4,829,683,000"
7310,"Business combinations","Acquisition of exocad Global Holdings GmbH – Valuation of Existing Technology Intangible Asset",444890,12/31/20,02/26/21,1,"PricewaterhouseCoopers LLP",,,,"San Jose",CA,CALIFORNIA,"US West",10-K,2021-02-26,,"ALIGN TECHNOLOGY INC",1097149,"=""ALGN""","410 NORTH SCOTTSDALE ROAD, SUITE 1300",,TEMPE,AZ,ARIZONA,"US Southwest",,,"=""3842""","Orthopedic, Prosthetic, and Surgical Appliances and Supplies",339114,"Dental Equipment and Supplies Manufacturing",34,534,12/31/20,"42,141,208,576",12/31/20,"2,471,941,000","1,775,888,000","2,658,976,000","4,829,683,000"
5199,"Sales return and allowances","Rebate Accruals - Medicaid Drug Rebate Program",441582,12/31/20,02/11/21,1,"PricewaterhouseCoopers LLP",,,,Boston,MA,MASSACHUSETTS,"US New England",10-K,2021-02-11,,"Alkermes plc.",1520262,"=""ALKS""","CONNAUGHT HOUSE","1 BURLINGTON ROAD","DUBLIN 4",L2,IRELAND,Foreign,,,"=""2834""","Pharmaceutical Preparations",325412,"Pharmaceutical Preparation Manufacturing",34,20,12/31/20,"3,175,264,768",12/31/20,"1,038,756,000","-110,861,000","862,918,000","1,949,730,000"
8127,"Research and development expenses","Accrued contract research and development expenses",445045,12/31/20,03/01/21,2,"Ernst & Young LLP",,,,"Redwood City",CA,CALIFORNIA,"US West",10-K,2021-03-01,,"Allakos Inc.",1564824,,"4757 EXECUTIVE DRIVE","SUITE  210","SAN DIEGO",CA,CALIFORNIA,"US West",,,"=""2834""","Pharmaceutical Preparations",325414,"Biological Product (except Diagnostic) Manufacturing",34,140,12/31/20,"7,431,340,032",12/31/20,,"-153,480,000",,"719,618,000"
6148,"Insurance contract liabilities","Reserves for Incurred But Not Reported (IBNR) Claims",443222,12/31/20,02/23/21,2,"Ernst & Young LLP",,,,"New York",NY,"NEW YORK","US Mid Atlantic",10-K,2021-02-23,,"ALLEGHANY CORP /DE",775368,,"1411 BROADWAY","34TH FLOOR","NEW YORK",NY,"NEW YORK","US Mid Atlantic",,,"=""6331""","Fire, Marine, and Casualty Insurance",524126,"Direct Property and Casualty Insurance Carriers",34,604,12/31/20,"8,476,519,936",12/31/20,"8,896,719,000","101,754,000","7,587,904,000","28,927,010,000"
7844,"Property, plant and equipment","Impairment of Sunseeker Resort property and equipment",445272,12/31/20,03/01/21,4,"KPMG LLP",,,,Dallas,TX,TEXAS,"US Southwest",10-K,2021-03-01,,"Allegiant Travel CO",1362468,"=""ALGT""","1201 N. TOWN CENTER DRIVE",,"LAS VEGAS",NV,NEVADA,"US West",,,"=""4512""","Air Transportation, Scheduled",561510,"Travel Agencies",34,189,12/31/20,"3,104,589,056",12/31/20,"990,073,000","-184,093,000",,"3,258,925,000"
7845,"Depreciation and amortization","Amortization period of deferred engine major maintenance costs",445272,12/31/20,03/01/21,4,"KPMG LLP",,,,Dallas,TX,TEXAS,"US Southwest",10-K,2021-03-01,,"Allegiant Travel CO",1362468,"=""ALGT""","1201 N. TOWN CENTER DRIVE",,"LAS VEGAS",NV,NEVADA,"US West",,,"=""4512""","Air Transportation, Scheduled",561510,"Travel Agencies",34,189,12/31/20,"3,104,589,056",12/31/20,"990,073,000","-184,093,000",,"3,258,925,000"
5383,Goodwill,"Goodwill Impairment Assessments - EMEA and Asia Pacific Reporting Units",441853,12/31/20,02/16/21,1,"PricewaterhouseCoopers LLP",,,,Indianapolis,IN,INDIANA,"US Midwest",10-K,2021-02-16,,"Allegion plc",1579241,"=""ALLE""","UNIT NO. 233, THE CAPEL BUILDING","MARY'S ABBEY","DUBLIN 7",L2,IRELAND,Foreign,,,"=""7381""","Detective, Guard, and Armored Car Services",423610,"Electrical Apparatus and Equipment, Wiring Supplies, and Related Equipment Merchant  Wholesalers",34,116,12/31/20,"10,615,339,008",12/31/20,"2,719,900,000","314,300,000","-476,700,000","3,069,400,000"
5459,"Regulatory assets and liabilities","Accounting for the Effects of Regulatory Matters",442030,12/31/20,02/17/21,1,"PricewaterhouseCoopers LLP",,,,Minneapolis,MN,MINNESOTA,"US Midwest",10-K,2021-02-17,,"ALLETE INC",66756,"=""ALE""","30 W SUPERIOR ST",,DULUTH,MN,MINNESOTA,"US Midwest",,,"=""4931""","Electric and Other Services Combined",221122,"Electric Power Distribution",34,61,12/29/20,"3,189,698,816",12/31/20,"1,169,100,000","174,200,000",,"6,084,600,000"
6133,"Other contingent liabilities","Valuation of workers’ compensation and pneumoconiosis benefits",443073,12/31/20,02/23/21,2,"Ernst & Young LLP",,,,Tulsa,OK,OKLAHOMA,"US Southwest",10-K,2021-02-23,,"ALLIANCE RESOURCE PARTNERS LP",1086600,"=""ARLP""","1717 SOUTH BOULDER AVENUE","SUITE 400",TULSA,OK,OKLAHOMA,"US Southwest",,,"=""1221""","Bituminous Coal and Lignite Surface Mining",212111,"Bituminous Coal and Lignite Surface Mining",34,4,12/31/20,"569,834,560",12/31/20,"1,328,129,000","-129,220,000","1,056,518,000","2,166,016,000"
6134,"Long-lived assets","Long-lived asset recoverability analyses",443073,12/31/20,02/23/21,2,"Ernst & Young LLP",,,,Tulsa,OK,OKLAHOMA,"US Southwest",10-K,2021-02-23,,"ALLIANCE RESOURCE PARTNERS LP",1086600,"=""ARLP""","1717 SOUTH BOULDER AVENUE","SUITE 400",TULSA,OK,OKLAHOMA,"US Southwest",,,"=""1221""","Bituminous Coal and Lignite Surface Mining",212111,"Bituminous Coal and Lignite Surface Mining",34,4,12/31/20,"569,834,560",12/31/20,"1,328,129,000","-129,220,000","1,056,518,000","2,166,016,000"
5145,"Equity investments and joint ventures","Measurement of Equity in Net Income Attributable to AB Unitholders – Performance-Based Fees",441486,12/31/20,02/11/21,1,"PricewaterhouseCoopers LLP",,,,"New York",NY,"NEW YORK","US Mid Atlantic",10-K,2021-02-11,,"ALLIANCEBERNSTEIN HOLDING L.P.",825313,"=""AB""","501 COMMERCE STREET",,NASHVILLE,TN,TENNESSEE,"US Southeast",1333986,"Equitable Holdings, Inc.","=""6282""","Investment Advice",523930,"Investment Advice",34,33,12/29/20,"3,161,257,984",12/31/20,"308,404,000","279,380,000",,"1,606,033,000"
5148,"Revenue from customer contracts","Performance-Based Fees",441488,12/31/20,02/11/21,1,"PricewaterhouseCoopers LLP",,,,"New York",NY,"NEW YORK","US Mid Atlantic",10-K,2021-02-11,,"ALLIANCEBERNSTEIN L.P.",1109448,,"501 COMMERCE STREET",,NASHVILLE,TN,TENNESSEE,"US Southeast",1333986,"Equitable Holdings, Inc.","=""6282""","Investment Advice",523930,"Investment Advice",34,,,,12/31/20,"3,718,006,000","881,602,000","1,086,608,000","9,697,840,000"
5794,"Regulatory assets and liabilities","Regulatory Assets and Regulatory Liabilities - Impact of rate regulation on the financial statements - Refer to Notes 1 and 2 to the financial statements",442628,12/31/20,02/19/21,3,"Deloitte & Touche LLP",,,,Milwaukee,WI,WISCONSIN,"US Midwest",10-K,2021-02-19,,"ALLIANT ENERGY CORP",352541,"=""LNT""","4902 NORTH BILTMORE LANE","SUITE 1000",MADISON,WI,WISCONSIN,"US Midwest",,,"=""4931""","Electric and Other Services Combined",221122,"Electric Power Distribution",34,52,12/31/20,"12,875,719,680",12/31/20,"3,416,000,000","624,000,000",,"17,710,000,000"
8842,Inventory,"Inventories – Refer to Note 1 to the financial statements",448092,12/31/20,03/10/21,3,"Deloitte & Touche LLP",,,,Williamsville,NY,"NEW YORK","US Mid Atlantic",10-K,2021-03-10,,"ALLIENT INC",46129,"=""ALNT""","495 COMMERCE DRIVE, SUITE 3",,AMHERST,NY,"NEW YORK","US Mid Atlantic",,,"=""3825""","Instruments for Measuring and Testing of Electricity and Electrical Signals",334519,"Other Measuring and Controlling Device Manufacturing",34,50,12/29/20,"488,860,480",12/31/20,"366,694,000","13,643,000","15,337,000","349,197,000"
5681,"Warranty liabilities","Product Warranty Liabilities",442325,12/31/20,02/18/21,1,"PricewaterhouseCoopers LLP",,,,Indianapolis,IN,INDIANA,"US Midwest",10-K,2021-02-18,,"Allison Transmission Holdings Inc",1411207,"=""ALSN""","ONE ALLISON WAY",,Indianapolis,IN,INDIANA,"US Midwest",,,"=""3714""","Motor Vehicle Parts and Accessories",336350,"Motor Vehicle Transmission and Power Train Parts Manufacturing",34,43,12/31/20,"4,832,004,096",12/31/20,"2,081,000,000","299,000,000","-2,271,000,000","4,477,000,000"
6739,"Research and development expenses","Accrued Research and Development Costs	",443998,12/31/20,02/25/21,2,"Ernst & Young LLP",,,,"San Jose",CA,CALIFORNIA,"US West",10-K,2021-02-25,,"Allogene Therapeutics, Inc.",1737287,"=""ALLO""","210 EAST GRAND AVENUE",,"SOUTH SAN FRANCISCO",CA,CALIFORNIA,"US West",,,"=""2836""","Biological Products, Except Diagnostic Substances",325414,"Biological Product (except Diagnostic) Manufacturing",34,25,12/31/20,"3,545,571,584",12/31/20,,"-316,381,000",,"1,227,829,000"
9248,"Revenue from customer contracts","Revenue Recognition",449029,12/31/20,03/15/21,2,"Ernst & Young LLP",222,"Kost Forer Gabbay & Kasierer",1281,"Tel Aviv",L3,ISRAEL,Foreign,20-F,2021-03-15,,"Allot Ltd.",1365767,"=""ALLT""","22 HANGAR STREET","NEVE NE'EMAN, INDUSTRIAL ZONE B",HOD-HASHARON,L3,ISRAEL,Foreign,,,"=""3576""","Computer Communications Equipment",541511,"Custom Computer Programming Services",34,11,12/29/20,"363,503,264",12/31/20,"135,922,000","-9,348,000","95,725,000","201,600,000"
5954,"Insurance contract liabilities","Reserve for Property and Casualty Insurance Claims and Claims Expense - Refer to Notes 2 and 8 to the Financial Statements",442781,12/31/20,02/19/21,3,"Deloitte & Touche LLP",,,,Chicago,IL,ILLINOIS,"US Midwest",10-K,2021-02-22,,"ALLSTATE CORP",899051,"=""ALL""","3100 SANDERS ROAD",,NORTHBROOK,IL,ILLINOIS,"US Midwest",,,"=""6331""","Fire, Marine, and Casualty Insurance",524126,"Direct Property and Casualty Insurance Carriers",34,110,12/31/20,"33,418,719,232",12/31/20,"44,791,000,000","5,576,000,000","27,673,000,000","125,987,000,000"
5955,"Insurance contract liabilities","Reserve for Life-Contingent Contract Benefits and Premium Deficiency Reserve for Life-Contingent Immediate Annuities - Refer to Notes 2 and 9 to the Financial Statements.",442781,12/31/20,02/19/21,3,"Deloitte & Touche LLP",,,,Chicago,IL,ILLINOIS,"US Midwest",10-K,2021-02-22,,"ALLSTATE CORP",899051,"=""ALL""","3100 SANDERS ROAD",,NORTHBROOK,IL,ILLINOIS,"US Midwest",,,"=""6331""","Fire, Marine, and Casualty Insurance",524126,"Direct Property and Casualty Insurance Carriers",34,110,12/31/20,"33,418,719,232",12/31/20,"44,791,000,000","5,576,000,000","27,673,000,000","125,987,000,000"
10192,"Insurance contract liabilities","Reserve for Life-Contingent Contract Benefits and Premium Deficiency Reserve for Life-Contingent Immediate Annuities – Refer to Notes 2 and 8 to the Financial Statements",451102,12/31/20,03/12/21,3,"Deloitte & Touche LLP",,,,Chicago,IL,ILLINOIS,"US Midwest",S-1,2021-03-30,,"ALLSTATE LIFE INSURANCE CO OF NEW YORK",839759,,"878 VETERAN'S MEMORIAL HIGHWAY","SUITE 400",HAUPPAUGE,NY,"NEW YORK","US Mid Atlantic",899051,"ALLSTATE CORP","=""6311""","Life Insurance",524113,"Direct Life Insurance Carriers",34,,,,,,,,
11297,"Insurance contract liabilities","Reserve for Life-Contingent Contract Benefits and Premium Deficiency Reserve for Life-Contingent Immediate Annuities – Refer to Notes 2 and 8 to the Financial Statements",454296,12/31/20,03/12/21,3,"Deloitte & Touche LLP",,,,Chicago,IL,ILLINOIS,"US Midwest",S-1/A,2021-04-27,,"ALLSTATE LIFE INSURANCE CO OF NEW YORK",839759,,"878 VETERAN'S MEMORIAL HIGHWAY","SUITE 400",HAUPPAUGE,NY,"NEW YORK","US Mid Atlantic",899051,"ALLSTATE CORP","=""6311""","Life Insurance",524113,"Direct Life Insurance Carriers",34,,,,,,,,
6476,"Allowance for credit losses","Allowance for Loan Losses - Consumer Automotive Portfolio - Refer to Notes 1 and 9 to the financial statements
",443470,12/31/20,02/24/21,3,"Deloitte & Touche LLP",,,,Detroit,MI,MICHIGAN,"US Midwest",10-K,2021-02-24,,"Ally Financial Inc.",40729,"=""ALLY""","ALLY DETROIT CENTER","500 WOODWARD AVE. FLOOR 10",DETROIT,MI,MICHIGAN,"US Midwest",,,"=""6022""","State Commercial Banks",522220,"Sales Financing",34,36,12/31/20,"13,360,889,856",12/31/20,"6,200,000,000","1,085,000,000",,"182,165,000,000"
5181,"Other liabilities and provisions","Liability Related to Sale of Future Royalties and Commercial Milestones",441556,12/31/20,02/11/21,1,"PricewaterhouseCoopers LLP",,,,Boston,MA,MASSACHUSETTS,"US New England",10-K,2021-02-11,,"ALNYLAM PHARMACEUTICALS, INC.",1178670,"=""ALNY""","675 WEST KENDALL STREET","HENRI A. TERMEER SQUARE",CAMBRIDGE,MA,MASSACHUSETTS,"US New England",,,"=""2834""","Pharmaceutical Preparations",325412,"Pharmaceutical Preparation Manufacturing",34,130,12/31/20,"15,132,017,664",12/31/20,"492,853,000","-858,281,000",,"3,407,061,000"
4960,"Other contingent liabilities","Loss Contingencies",440740,12/31/20,02/02/21,2,"Ernst & Young LLP",,,,"San Jose",CA,CALIFORNIA,"US West",10-K,2021-02-03,,"Alphabet Inc.",1652044,"=""GOOGL""","1600 AMPHITHEATRE PARKWAY",,"MOUNTAIN VIEW",CA,CALIFORNIA,"US West",,,"=""7370""","Services-Computer Programming, Data Processing, Etc.",518112,"Web Search Portals",34,"1,758",12/29/20,"528,459,694,080",12/31/20,"182,527,000,000","40,269,000,000","199,924,000,000","319,616,000,000"
7130,"Derivatives and hedging","Fair Value Measurement of Level 3 Derivatives",444668,12/31/20,02/25/21,2,"Ernst & Young LLP",192,"Ernst & Young LLP Chartered Accountants",1263,Calgary,A0,ALBERTA,Canada,40-F,2021-02-26,,"AltaGas Ltd.",1695519,,"1700, 355-4 AVENUE SW",,CALGARY,A0,ALBERTA,Canada,,,"=""1311""","Crude Petroleum and Natural Gas",211111,"Crude Petroleum and Natural Gas Extraction",34,,,,12/31/20,"4,385,000,000","433,000,000","1,149,000,000","16,901,000,000"
7131,"Business combinations","Acquisition of Additional Interest in Petrogas Energy Corp. (“Petrogas”)",444668,12/31/20,02/25/21,2,"Ernst & Young LLP",192,"Ernst & Young LLP Chartered Accountants",1263,Calgary,A0,ALBERTA,Canada,40-F,2021-02-26,,"AltaGas Ltd.",1695519,,"1700, 355-4 AVENUE SW",,CALGARY,A0,ALBERTA,Canada,,,"=""1311""","Crude Petroleum and Natural Gas",211111,"Crude Petroleum and Natural Gas Extraction",34,,,,12/31/20,"4,385,000,000","433,000,000","1,149,000,000","16,901,000,000"
7132,"Regulatory assets and liabilities","Regulatory Accounting",444668,12/31/20,02/25/21,2,"Ernst & Young LLP",192,"Ernst & Young LLP Chartered Accountants",1263,Calgary,A0,ALBERTA,Canada,40-F,2021-02-26,,"AltaGas Ltd.",1695519,,"1700, 355-4 AVENUE SW",,CALGARY,A0,ALBERTA,Canada,,,"=""1311""","Crude Petroleum and Natural Gas",211111,"Crude Petroleum and Natural Gas Extraction",34,,,,12/31/20,"4,385,000,000","433,000,000","1,149,000,000","16,901,000,000"
7429,"Revenue from customer contracts","Software Revenue Recognition",444908,12/31/20,02/26/21,2,"Ernst & Young LLP",,,,Detroit,MI,MICHIGAN,"US Midwest",10-K,2021-02-26,,"Altair Engineering Inc.",1701732,"=""ALTR""","1820 E. BIG BEAVER ROAD",,TROY,MI,MICHIGAN,"US Midwest",,,"=""7372""","Prepackaged Software",511210,"Software Publishers",34,58,12/31/20,"2,572,486,912",12/31/20,"469,921,000","-10,500,000","38,775,000","829,902,000"
7430,"Business combinations","Business Combination",444908,12/31/20,02/26/21,2,"Ernst & Young LLP",,,,Detroit,MI,MICHIGAN,"US Midwest",10-K,2021-02-26,,"Altair Engineering Inc.",1701732,"=""ALTR""","1820 E. BIG BEAVER ROAD",,TROY,MI,MICHIGAN,"US Midwest",,,"=""7372""","Prepackaged Software",511210,"Software Publishers",34,58,12/31/20,"2,572,486,912",12/31/20,"469,921,000","-10,500,000","38,775,000","829,902,000"
10472,"Other intangible assets","INTANGIBLE ASSETS - CAPITALIZED DEVELOPMENT EXPENDITURE – refer to note 2 (section development expenditures), note 3 (section intangible assets), and note 8 (intangible assets) to the financial statements",451387,12/31/20,03/31/21,3,"Deloitte & Touche LLP",395,"Deloitte AG",1235,Zurich,V8,SWITZERLAND,Foreign,20-F,2021-03-31,,"Altamira Therapeutics Ltd.",1601936,"=""CYTOF""","CLARENDON HOUSE","2 CHURCH STREET","HAMILTON HM 11",D0,BERMUDA,Foreign,,,"=""2834""","Pharmaceutical Preparations",325412,"Pharmaceutical Preparation Manufacturing",34,3,12/29/20,"11,140,062",12/31/20,"196,301","-9,276,729","8,659,404","23,530,027"
10473,"Other debt","LOAN AND DERIVATIVE FINANCIAL INSTRUMENTS - DETERMINATION OF ACCOUNTING TREATMENT OF CONVERTIBLE LOAN AGREEMENT AND VALUATION OF CONVERSION RIGHT - refer to note 3 (convertible loans), and note 25 (loan) to the financial statements",451387,12/31/20,03/31/21,3,"Deloitte & Touche LLP",395,"Deloitte AG",1235,Zurich,V8,SWITZERLAND,Foreign,20-F,2021-03-31,,"Altamira Therapeutics Ltd.",1601936,"=""CYTOF""","CLARENDON HOUSE","2 CHURCH STREET","HAMILTON HM 11",D0,BERMUDA,Foreign,,,"=""2834""","Pharmaceutical Preparations",325412,"Pharmaceutical Preparation Manufacturing",34,3,12/29/20,"11,140,062",12/31/20,"196,301","-9,276,729","8,659,404","23,530,027"
8418,"Going concern","Going concern assessment",446219,12/31/20,03/04/21,2,"Ernst & Young LLP",50,"Ernst & Young AS",1572,Stavanger,Q8,NORWAY,Foreign,20-F,2021-03-04,,"Altera Infrastructure L.P.",1382298,,"ALTERA HOUSE, UNIT 3, PROSPECT PARK","ARNHALL BUSINESS PARK, WESTHILL",ABERDEENSHIRE,X0,"UNITED KINGDOM",Foreign,911971,"TEEKAY CORP LTD","=""4400""","Water Transportation",488320,"Marine Cargo Handling",34,21,12/29/20,"8,839,662,592",12/31/20,"1,182,110,000","-346,163,000","99,896,000","4,385,631,000"
8419,"Property, plant and equipment","Impairment of vessels",446219,12/31/20,03/04/21,2,"Ernst & Young LLP",50,"Ernst & Young AS",1572,Stavanger,Q8,NORWAY,Foreign,20-F,2021-03-04,,"Altera Infrastructure L.P.",1382298,,"ALTERA HOUSE, UNIT 3, PROSPECT PARK","ARNHALL BUSINESS PARK, WESTHILL",ABERDEENSHIRE,X0,"UNITED KINGDOM",Foreign,911971,"TEEKAY CORP LTD","=""4400""","Water Transportation",488320,"Marine Cargo Handling",34,21,12/29/20,"8,839,662,592",12/31/20,"1,182,110,000","-346,163,000","99,896,000","4,385,631,000"
5288,"Revenue from customer contracts","Revenue Recognition – Determination of Standalone Selling Prices – Refer to Notes 2 and 3 of the Financial Statements",441752,12/31/20,02/12/21,3,"Deloitte & Touche LLP",,,,"Los Angeles",CA,CALIFORNIA,"US West",10-K,2021-02-12,,"Alteryx, Inc.",1689923,,"17200 LAGUNA CANYON ROAD",,IRVINE,CA,CALIFORNIA,"US West",,,"=""7372""","Prepackaged Software",511210,"Software Publishers",34,122,12/31/20,"7,141,035,008",12/31/20,"495,308,000","-24,374,000","423,530,000","1,465,295,000"
6966,"Other intangible assets","Impairment assessment of Indefinite-lived Intangible Assets",443576,12/31/20,02/25/21,2,"Ernst & Young LLP",,,,Baltimore,MD,MARYLAND,"US Mid Atlantic",10-K,2021-02-25,,"Altimmune, Inc.",1326190,"=""ALT""","910 CLOPPER ROAD","SUITE 201S",GAITHERSBURG,MD,MARYLAND,"US Mid Atlantic",,,"=""2834""","Pharmaceutical Preparations",325412,"Pharmaceutical Preparation Manufacturing",34,11,12/31/20,"418,972,416",12/31/20,"8,185,027","-49,044,477","218,442,477","245,115,213"
8290,"Shareholder valuation","Series A Preferred Shares",445977,12/31/20,03/03/21,2,"Ernst & Young LLP",,,,Atlanta,GA,GEORGIA,"US Southeast",10-K,2021-03-03,,"Altisource Asset Management Corp",1555074,"=""AAMCD""","5100 TAMARIND REEF",,CHRISTIANSTED,VI,"VIRGIN ISLANDS (US)",Foreign,,,"=""6500""","Real Estate",523930,"Investment Advice",34,23,12/29/20,"38,778,496",12/31/20,,"39,821,000",,"99,752,000"
7593,Goodwill,"Goodwill —Thomson and JVS Reporting Units — Refer to Notes 1 and 7 to the financial statements",444952,12/31/20,02/26/21,3,"Deloitte & Touche LLP",,,,Boston,MA,MASSACHUSETTS,"US New England",10-K,2021-02-26,,"Altra Industrial Motion Corp.",1374535,,"300 GRANITE STREET","SUITE 201",BRAINTREE,MA,MASSACHUSETTS,"US New England",,,"=""3569""","General Industrial Machinery and Equipment, NEC",423840,"Industrial Supplies Merchant Wholesalers",34,55,12/31/20,"3,585,022,208",12/31/20,"1,726,000,000","-25,500,000","-1,058,900,000","4,208,100,000"
4912,"Other contingent liabilities","Tobacco and Health Litigation Provisions and Disclosures",440379,12/31/20,01/28/21,1,"PricewaterhouseCoopers LLP",,,,Richmond,VA,VIRGINIA,"US Mid Atlantic",8-K,2021-01-28,,"ALTRIA GROUP, INC.",764180,"=""MO""","6601 WEST BROAD STREET",,RICHMOND,VA,VIRGINIA,"US Mid Atlantic",,,"=""2111""",Cigarettes,312221,"Cigarette Manufacturing",34,41,12/31/20,"76,195,184,640",12/31/20,"26,153,000,000","4,467,000,000","-14,913,000,000","47,414,000,000"
4913,"Equity investments and joint ventures","JUUL - Determination of the Fair Value of the Investment",440379,12/31/20,01/28/21,1,"PricewaterhouseCoopers LLP",,,,Richmond,VA,VIRGINIA,"US Mid Atlantic",8-K,2021-01-28,,"ALTRIA GROUP, INC.",764180,"=""MO""","6601 WEST BROAD STREET",,RICHMOND,VA,VIRGINIA,"US Mid Atlantic",,,"=""2111""",Cigarettes,312221,"Cigarette Manufacturing",34,41,12/31/20,"76,195,184,640",12/31/20,"26,153,000,000","4,467,000,000","-14,913,000,000","47,414,000,000"
4914,"Equity investments and joint ventures","Other Than Temporary Impairment Assessment - Investment in Anheuser-Busch InBev SA/NV (“ABI”)",440379,12/31/20,01/28/21,1,"PricewaterhouseCoopers LLP",,,,Richmond,VA,VIRGINIA,"US Mid Atlantic",8-K,2021-01-28,,"ALTRIA GROUP, INC.",764180,"=""MO""","6601 WEST BROAD STREET",,RICHMOND,VA,VIRGINIA,"US Mid Atlantic",,,"=""2111""",Cigarettes,312221,"Cigarette Manufacturing",34,41,12/31/20,"76,195,184,640",12/31/20,"26,153,000,000","4,467,000,000","-14,913,000,000","47,414,000,000"
7133,"Other contingent liabilities","Tobacco and Health Litigation Provisions and Disclosures",444788,12/31/20,01/28/21,1,"PricewaterhouseCoopers LLP",,,,Richmond,VA,VIRGINIA,"US Mid Atlantic",10-K,2021-02-26,,"ALTRIA GROUP, INC.",764180,"=""MO""","6601 WEST BROAD STREET",,RICHMOND,VA,VIRGINIA,"US Mid Atlantic",,,"=""2111""",Cigarettes,312221,"Cigarette Manufacturing",34,41,12/31/20,"76,195,184,640",12/31/20,"26,153,000,000","4,467,000,000","-14,913,000,000","47,414,000,000"
7134,"Equity investments and joint ventures","JUUL - Determination of the Fair Value of the Investment",444788,12/31/20,01/28/21,1,"PricewaterhouseCoopers LLP",,,,Richmond,VA,VIRGINIA,"US Mid Atlantic",10-K,2021-02-26,,"ALTRIA GROUP, INC.",764180,"=""MO""","6601 WEST BROAD STREET",,RICHMOND,VA,VIRGINIA,"US Mid Atlantic",,,"=""2111""",Cigarettes,312221,"Cigarette Manufacturing",34,41,12/31/20,"76,195,184,640",12/31/20,"26,153,000,000","4,467,000,000","-14,913,000,000","47,414,000,000"
7135,"Equity investments and joint ventures","Other Than Temporary Impairment Assessment - Investment in Anheuser-Busch InBev SA/NV (“ABI”)",444788,12/31/20,01/28/21,1,"PricewaterhouseCoopers LLP",,,,Richmond,VA,VIRGINIA,"US Mid Atlantic",10-K,2021-02-26,,"ALTRIA GROUP, INC.",764180,"=""MO""","6601 WEST BROAD STREET",,RICHMOND,VA,VIRGINIA,"US Mid Atlantic",,,"=""2111""",Cigarettes,312221,"Cigarette Manufacturing",34,41,12/31/20,"76,195,184,640",12/31/20,"26,153,000,000","4,467,000,000","-14,913,000,000","47,414,000,000"
11185,"Property, plant and equipment","Impairment assessment of property, plant and equipment",453434,12/31/20,04/22/21,1,"PricewaterhouseCoopers LLP",94,"PricewaterhouseCoopers Zhong Tian LLP",1424,Shanghai,F4,CHINA,Foreign,20-F,2021-04-22,,"ALUMINUM CORP OF CHINA LTD",1161611,"=""ALMMF""","NO 12B FUXING ROAD","HAIDIAN DISTRICT",BEIJING,F4,CHINA,Foreign,,,"=""3334""","Primary Production of Aluminum",331312,"Primary Aluminum Production",34,9,12/29/20,"1,353,569,152",12/31/20,"31,192,556,000","343,234,000","6,269,460,000","29,823,681,000"
11186,Goodwill,"Impairment assessment of goodwill",453434,12/31/20,04/22/21,1,"PricewaterhouseCoopers LLP",94,"PricewaterhouseCoopers Zhong Tian LLP",1424,Shanghai,F4,CHINA,Foreign,20-F,2021-04-22,,"ALUMINUM CORP OF CHINA LTD",1161611,"=""ALMMF""","NO 12B FUXING ROAD","HAIDIAN DISTRICT",BEIJING,F4,CHINA,Foreign,,,"=""3334""","Primary Production of Aluminum",331312,"Primary Aluminum Production",34,9,12/29/20,"1,353,569,152",12/31/20,"31,192,556,000","343,234,000","6,269,460,000","29,823,681,000"
6622,"Sales return and allowances","Product Return Reserve Estimate",443741,12/31/20,02/25/21,2,"Ernst & Young LLP",,,,Iselin,NJ,"NEW JERSEY","US Mid Atlantic",10-K,2021-02-25,,"AMARIN CORP PLC\UK",897448,"=""AMRN""","SPACES SOUTH DOCKLANDS, BLOCK C","77 SIR JOHN ROGERSON'S QUAY","ELY CAMBRIDGESHIRE",X0,"UNITED KINGDOM",Foreign,,,"=""2834""","Pharmaceutical Preparations",325412,"Pharmaceutical Preparation Manufacturing",34,5,12/31/20,"1,919,511,168",12/31/20,"614,060,000","-18,000,000","613,688,000","966,021,000"
4959,"Uncertain tax positions","Uncertain Tax Positions",440738,12/31/20,02/02/21,2,"Ernst & Young LLP",,,,Seattle,WA,WASHINGTON,"US West",10-K,2021-02-03,,"AMAZON COM INC",1018724,"=""AMZN""","410 TERRY AVENUE NORTH",,SEATTLE,WA,WASHINGTON,"US West",,,"=""5961""","Catalog and Mail-Order Houses",518210,"Data Processing, Hosting, and Related Services",34,"3,257",12/31/20,"1,638,235,766,784",12/31/20,"386,064,000,000","21,331,000,000","78,387,000,000","321,195,000,000"
3637,"Other income taxes","Accounting for Income Taxes",422988,01/31/20,03/27/20,1,"PricewaterhouseCoopers LLP",,,,"San Jose",CA,CALIFORNIA,"US West",10-K,2020-03-27,,"AMBARELLA INC",1280263,"=""AMBA""","3001 TASMAN DRIVE",,"SANTA CLARA",CA,CALIFORNIA,"US West",,,"=""3674""","Semiconductors and Related Devices",334413,"Semiconductor and Related Device Manufacturing",34,59,01/31/20,"1,999,263,744",01/31/20,"228,732,000","-44,792,000","403,645,000","527,276,000"
9735,"Other income taxes","Tax contingencies",449684,12/31/20,03/16/21,1,"PricewaterhouseCoopers LLP",91,"PricewaterhouseCoopers Auditores Independentes",1351,"São Paulo",D5,BRAZIL,Foreign,20-F,2021-03-22,,"AMBEV S.A.",1565025,"=""ABEV""","RUA DR. RENATO PAES DE BARROS, 1017","3 ANDAR PARTE","SAO PAULO",D5,BRAZIL,Foreign,,,"=""2080""",Beverages,312120,Breweries,34,3,12/29/20,"49,077,452,800",12/31/20,"11,239,300,000","2,258,700,000","5,046,300,000","24,103,100,000"
9736,"Other income taxes","PIS and COFINS Recovery - exclusion of ICMS (VAT tax) from the basis of calculation",449684,12/31/20,03/16/21,1,"PricewaterhouseCoopers LLP",91,"PricewaterhouseCoopers Auditores Independentes",1351,"São Paulo",D5,BRAZIL,Foreign,20-F,2021-03-22,,"AMBEV S.A.",1565025,"=""ABEV""","RUA DR. RENATO PAES DE BARROS, 1017","3 ANDAR PARTE","SAO PAULO",D5,BRAZIL,Foreign,,,"=""2080""",Beverages,312120,Breweries,34,3,12/29/20,"49,077,452,800",12/31/20,"11,239,300,000","2,258,700,000","5,046,300,000","24,103,100,000"
9124,Goodwill,"Goodwill Impairment",448450,12/31/20,03/12/21,2,"Ernst & Young LLP",,,,"Kansas City",MO,MISSOURI,"US Southeast",10-K,2021-03-12,,"AMC ENTERTAINMENT HOLDINGS, INC.",1411579,"=""AMC""","ONE AMC WAY","11500 ASH STREET",LEAWOOD,KS,KANSAS,"US Midwest",,,"=""7830""","Services-Motion Picture Theaters",512131,"Motion Picture Theaters (except Drive-Ins)",34,2,12/31/20,"365,719,040",12/31/20,"1,242,400,000","-4,589,100,000","-5,595,600,000","10,276,400,000"
9125,"Going concern","Liquidity – Impact of COVID-19",448450,12/31/20,03/12/21,2,"Ernst & Young LLP",,,,"Kansas City",MO,MISSOURI,"US Southeast",10-K,2021-03-12,,"AMC ENTERTAINMENT HOLDINGS, INC.",1411579,"=""AMC""","ONE AMC WAY","11500 ASH STREET",LEAWOOD,KS,KANSAS,"US Midwest",,,"=""7830""","Services-Motion Picture Theaters",512131,"Motion Picture Theaters (except Drive-Ins)",34,2,12/31/20,"365,719,040",12/31/20,"1,242,400,000","-4,589,100,000","-5,595,600,000","10,276,400,000"
9126,Leases,"Valuation of operating lease liabilities",448450,12/31/20,03/12/21,2,"Ernst & Young LLP",,,,"Kansas City",MO,MISSOURI,"US Southeast",10-K,2021-03-12,,"AMC ENTERTAINMENT HOLDINGS, INC.",1411579,"=""AMC""","ONE AMC WAY","11500 ASH STREET",LEAWOOD,KS,KANSAS,"US Midwest",,,"=""7830""","Services-Motion Picture Theaters",512131,"Motion Picture Theaters (except Drive-Ins)",34,2,12/31/20,"365,719,040",12/31/20,"1,242,400,000","-4,589,100,000","-5,595,600,000","10,276,400,000"
7607,Goodwill,"Assessment of the carrying value of goodwill in the AMC Networks International (AMCNI) reporting unit",444920,12/31/20,02/26/21,4,"KPMG LLP",,,,"New York",NY,"NEW YORK","US Mid Atlantic",10-K,2021-02-26,,"AMC Networks Inc.",1514991,"=""AMCX""","11 PENN PLAZA",,"NEW YORK",NY,"NEW YORK","US Mid Atlantic",,,"=""4841""","Cable and Other Pay Television Services",515120,"Television Broadcasting",34,36,12/31/20,"1,072,205,760",12/31/20,"2,814,956,000","239,979,000","-1,433,756,000","5,246,338,000"
7608,"Depreciation and amortization","Assessment of amortization of owned original program rights",444920,12/31/20,02/26/21,4,"KPMG LLP",,,,"New York",NY,"NEW YORK","US Mid Atlantic",10-K,2021-02-26,,"AMC Networks Inc.",1514991,"=""AMCX""","11 PENN PLAZA",,"NEW YORK",NY,"NEW YORK","US Mid Atlantic",,,"=""4841""","Cable and Other Pay Television Services",515120,"Television Broadcasting",34,36,12/31/20,"1,072,205,760",12/31/20,"2,814,956,000","239,979,000","-1,433,756,000","5,246,338,000"
4478,Goodwill,"Goodwill Impairment Assessment - Flexibles North America and Flexibles Latin America Reporting Units within the Flexibles Segment",431367,06/30/20,08/27/20,1,"PricewaterhouseCoopers LLP",119,"PricewaterhouseCoopers AG",1358,Zurich,V8,SWITZERLAND,Foreign,10-K,2020-08-27,,"Amcor plc",1748790,"=""AMCR""","83 TOWER ROAD NORTH",,"WARMLEY, BRISTOL",X0,"UNITED KINGDOM",Foreign,,,"=""3990""","Miscellaneous Manufacturing Industries",322221,"Coated and Laminated Packaging Paper and Plastics Film Manufacturing",34,11,07/02/20,"16,689,036,288",06/30/20,"12,467,500,000","612,200,000","-2,707,700,000","16,442,100,000"
4843,"Revenue from customer contracts","Revenue recognition for projects",437260,09/30/20,12/14/20,2,"Ernst & Young LLP",,,,"New York",NY,"NEW YORK","US Mid Atlantic",20-F,2020-12-14,,"AMDOCS LTD",1062579,"=""DOX""","P.O BOX 263, HIRZEL HOUSE","SMITH STREET,","ST. PETER PORT",Y7,GUERNSEY,Foreign,,,"=""7371""","Computer Programming Services",541511,"Custom Computer Programming Services",34,57,10/02/20,"7,748,106,752",09/30/20,"4,169,039,000","497,840,000","747,667,000","6,341,621,000"
4844,"Uncertain tax positions","Uncertain Tax Positions",437260,09/30/20,12/14/20,2,"Ernst & Young LLP",,,,"New York",NY,"NEW YORK","US Mid Atlantic",20-F,2020-12-14,,"AMDOCS LTD",1062579,"=""DOX""","P.O BOX 263, HIRZEL HOUSE","SMITH STREET,","ST. PETER PORT",Y7,GUERNSEY,Foreign,,,"=""7371""","Computer Programming Services",541511,"Custom Computer Programming Services",34,57,10/02/20,"7,748,106,752",09/30/20,"4,169,039,000","497,840,000","747,667,000","6,341,621,000"
7056,"Business combinations","Acquisition of AseraCare Hospice – Evaluation of the fair value of certain intangible assets",443605,12/31/20,02/25/21,4,"KPMG LLP",,,,"Baton Rouge",LA,LOUISIANA,"US Southeast",10-K,2021-02-25,,"AMEDISYS INC",896262,,"3854 AMERICAN WAY","SUITE A","BATON ROUGE",LA,LOUISIANA,"US Southeast",,,"=""8082""","Home Health Care Services",621610,"Home Health Care Services",34,293,12/31/20,"9,625,412,608",12/31/20,"2,105,891,000","183,608,000","-197,644,000","1,567,198,000"
7057,"Revenue from customer contracts","Evaluation of the non-contractual revenue adjustment estimates for Home Health and Hospice",443605,12/31/20,02/25/21,4,"KPMG LLP",,,,"Baton Rouge",LA,LOUISIANA,"US Southeast",10-K,2021-02-25,,"AMEDISYS INC",896262,,"3854 AMERICAN WAY","SUITE A","BATON ROUGE",LA,LOUISIANA,"US Southeast",,,"=""8082""","Home Health Care Services",621610,"Home Health Care Services",34,293,12/31/20,"9,625,412,608",12/31/20,"2,105,891,000","183,608,000","-197,644,000","1,567,198,000"
5993,"Regulatory assets and liabilities","Accounting for the Effects of Regulation",442991,12/31/20,02/22/21,1,"PricewaterhouseCoopers LLP",,,,"Saint Louis",MO,MISSOURI,"US Southeast",10-K,2021-02-22,,"AMEREN CORP",1002910,"=""AEE""","1901 CHOUTEAU AVE","MC 1310","ST LOUIS",MO,MISSOURI,"US Southeast",,,"=""4931""","Electric and Other Services Combined",221122,"Electric Power Distribution",34,78,12/31/20,"19,772,598,272",12/31/20,"5,794,000,000","871,000,000","8,527,000,000","32,030,000,000"
5991,"Regulatory assets and liabilities","Accounting for the Effects of Regulation",442993,12/31/20,02/22/21,1,"PricewaterhouseCoopers LLP",,,,"Saint Louis",MO,MISSOURI,"US Southeast",10-K,2021-02-22,,"Ameren Illinois Co",18654,"=""AILIH""","10 RICHARD MARK WAY",,COLLINSVILLE,IL,ILLINOIS,"US Midwest",1002910,"AMEREN CORP","=""4931""","Electric and Other Services Combined",221121,"Electric Bulk Power Transmission and Control",34,,,,12/31/20,"2,535,000,000","382,000,000","4,555,000,000","13,535,000,000"
11375,"Deferred income taxes","Deferred tax assets, realizability of Net Operating Loss Carryforwards",454599,12/31/20,04/28/21,2,"Ernst & Young LLP",139,"Mancera SC",1284,"Mexico City",O5,MEXICO,Foreign,20-F,2021-04-29,,"AMERICA MOVIL SAB DE CV/",1129137,"=""AMX""","LAGO ZURICH 245",*,"COLONIA ANAHUAC",O5,MEXICO,Foreign,,,"=""4813""","Telephone Communications, Except Radiotelephone",517310,"Telecommunications Resellers",34,15,12/29/20,"32,823,867,392",12/31/20,"40,922,390,000","2,560,887,000","-1,306,418,000","81,556,208,000"
11376,Goodwill,"Impairment of goodwill
",454599,12/31/20,04/28/21,2,"Ernst & Young LLP",139,"Mancera SC",1284,"Mexico City",O5,MEXICO,Foreign,20-F,2021-04-29,,"AMERICA MOVIL SAB DE CV/",1129137,"=""AMX""","LAGO ZURICH 245",*,"COLONIA ANAHUAC",O5,MEXICO,Foreign,,,"=""4813""","Telephone Communications, Except Radiotelephone",517310,"Telecommunications Resellers",34,15,12/29/20,"32,823,867,392",12/31/20,"40,922,390,000","2,560,887,000","-1,306,418,000","81,556,208,000"
11377,"Pension and other post-employment benefits","Discount rates used in determining pension and postretirement benefit obligations in Mexico",454599,12/31/20,04/28/21,2,"Ernst & Young LLP",139,"Mancera SC",1284,"Mexico City",O5,MEXICO,Foreign,20-F,2021-04-29,,"AMERICA MOVIL SAB DE CV/",1129137,"=""AMX""","LAGO ZURICH 245",*,"COLONIA ANAHUAC",O5,MEXICO,Foreign,,,"=""4813""","Telephone Communications, Except Radiotelephone",517310,"Telecommunications Resellers",34,15,12/29/20,"32,823,867,392",12/31/20,"40,922,390,000","2,560,887,000","-1,306,418,000","81,556,208,000"
11378,"Policy changes","Revaluation of towers due to a change in accounting policy",454599,12/31/20,04/28/21,2,"Ernst & Young LLP",139,"Mancera SC",1284,"Mexico City",O5,MEXICO,Foreign,20-F,2021-04-29,,"AMERICA MOVIL SAB DE CV/",1129137,"=""AMX""","LAGO ZURICH 245",*,"COLONIA ANAHUAC",O5,MEXICO,Foreign,,,"=""4813""","Telephone Communications, Except Radiotelephone",517310,"Telecommunications Resellers",34,15,12/29/20,"32,823,867,392",12/31/20,"40,922,390,000","2,560,887,000","-1,306,418,000","81,556,208,000"
5578,"Revenue from customer contracts","Estimate of mileage credits not expected to be redeemed",442204,12/31/20,02/17/21,4,"KPMG LLP",,,,Dallas,TX,TEXAS,"US Southwest",10-K,2021-02-17,,"American Airlines Group Inc.",6201,"=""AAL""","1 SKYVIEW DRIVE",,"FORT WORTH",TX,TEXAS,"US Southwest",,,"=""4512""","Air Transportation, Scheduled",481111,"Scheduled Passenger Air Transportation",34,16,12/31/20,"9,800,731,648",12/31/20,"17,337,000,000","-8,885,000,000","-12,987,000,000","62,008,000,000"
5579,"Deferred income taxes","Sufficiency of audit evidence over realizability of operating loss carryforwards",442204,12/31/20,02/17/21,4,"KPMG LLP",,,,Dallas,TX,TEXAS,"US Southwest",10-K,2021-02-17,,"American Airlines Group Inc.",6201,"=""AAL""","1 SKYVIEW DRIVE",,"FORT WORTH",TX,TEXAS,"US Southwest",,,"=""4512""","Air Transportation, Scheduled",481111,"Scheduled Passenger Air Transportation",34,16,12/31/20,"9,800,731,648",12/31/20,"17,337,000,000","-8,885,000,000","-12,987,000,000","62,008,000,000"
5576,"Revenue from customer contracts","Estimate of mileage credits not expected to be redeemed",442202,12/31/20,02/17/21,4,"KPMG LLP",,,,Dallas,TX,TEXAS,"US Southwest",10-K,2021-02-17,,"AMERICAN AIRLINES, INC.",4515,,"1 SKYVIEW DRIVE",,"FORT WORTH",TX,TEXAS,"US Southwest",6201,"American Airlines Group Inc.","=""4512""","Air Transportation, Scheduled",481111,"Scheduled Passenger Air Transportation",34,,,,12/31/20,"17,335,000,000","-8,450,000,000","-1,772,000,000","69,215,000,000"
5577,"Deferred income taxes","Sufficiency of audit evidence over realizability of operating loss carryforwards",442202,12/31/20,02/17/21,4,"KPMG LLP",,,,Dallas,TX,TEXAS,"US Southwest",10-K,2021-02-17,,"AMERICAN AIRLINES, INC.",4515,,"1 SKYVIEW DRIVE",,"FORT WORTH",TX,TEXAS,"US Southwest",6201,"American Airlines Group Inc.","=""4512""","Air Transportation, Scheduled",481111,"Scheduled Passenger Air Transportation",34,,,,12/31/20,"17,335,000,000","-8,450,000,000","-1,772,000,000","69,215,000,000"
5400,"Real estate investments","Impairment of real estate properties",441925,12/31/20,02/16/21,2,"Ernst & Young LLP",,,,"San Diego",CA,CALIFORNIA,"US West",10-K,2021-02-16,,"American Assets Trust, Inc.",1500217,"=""AAT""","3420 CARMEL MOUNTAIN ROAD","SUITE 100","SAN DIEGO",CA,CALIFORNIA,"US West",,,"=""6798""","Real Estate Investment Trusts",525990,"Other Financial Vehicles",34,29,12/31/20,"1,746,555,264",12/31/20,"344,573,000","27,660,000",,"2,817,309,000"
5401,"Accounts/loans receivable","Collectability of accounts receivable and straight-line rents receivable",441925,12/31/20,02/16/21,2,"Ernst & Young LLP",,,,"San Diego",CA,CALIFORNIA,"US West",10-K,2021-02-16,,"American Assets Trust, Inc.",1500217,"=""AAT""","3420 CARMEL MOUNTAIN ROAD","SUITE 100","SAN DIEGO",CA,CALIFORNIA,"US West",,,"=""6798""","Real Estate Investment Trusts",525990,"Other Financial Vehicles",34,29,12/31/20,"1,746,555,264",12/31/20,"344,573,000","27,660,000",,"2,817,309,000"
5402,"Real estate investments","Impairment of real estate properties",441926,12/31/20,02/16/21,2,"Ernst & Young LLP",,,,"San Diego",CA,CALIFORNIA,"US West",10-K,2021-02-16,,"American Assets Trust, L.P.",1509570,,"11455 EL CAMINO REAL","SUITE 200","SAN DIEGO",CA,CALIFORNIA,"US West",,,"=""6798""","Real Estate Investment Trusts",525990,"Other Financial Vehicles",34,,,,12/31/20,"344,573,000","35,588,000",,"2,817,309,000"
5403,"Accounts/loans receivable","Collectability of accounts receivable and straight-line rents receivable",441926,12/31/20,02/16/21,2,"Ernst & Young LLP",,,,"San Diego",CA,CALIFORNIA,"US West",10-K,2021-02-16,,"American Assets Trust, L.P.",1509570,,"11455 EL CAMINO REAL","SUITE 200","SAN DIEGO",CA,CALIFORNIA,"US West",,,"=""6798""","Real Estate Investment Trusts",525990,"Other Financial Vehicles",34,,,,12/31/20,"344,573,000","35,588,000",,"2,817,309,000"
5258,Goodwill,"Goodwill Impairment — Refer to Notes 1 and 3 to the consolidated financial statements",441677,12/31/20,02/12/21,3,"Deloitte & Touche LLP",,,,Detroit,MI,MICHIGAN,"US Midwest",10-K,2021-02-12,,"AMERICAN AXLE & MANUFACTURING HOLDINGS INC",1062231,"=""AXL""","ONE DAUCH DRIVE",,DETROIT,MI,MICHIGAN,"US Midwest",,,"=""3714""","Motor Vehicle Parts and Accessories",336350,"Motor Vehicle Transmission and Power Train Parts Manufacturing",34,8,12/31/20,"944,921,984",12/31/20,"4,710,800,000","-561,300,000","-595,900,000","5,916,300,000"
5259,"Other income taxes","Income Taxes — Refer to Notes 1 and 9 to the consolidated financial statements",441677,12/31/20,02/12/21,3,"Deloitte & Touche LLP",,,,Detroit,MI,MICHIGAN,"US Midwest",10-K,2021-02-12,,"AMERICAN AXLE & MANUFACTURING HOLDINGS INC",1062231,"=""AXL""","ONE DAUCH DRIVE",,DETROIT,MI,MICHIGAN,"US Midwest",,,"=""3714""","Motor Vehicle Parts and Accessories",336350,"Motor Vehicle Transmission and Power Train Parts Manufacturing",34,8,12/31/20,"944,921,984",12/31/20,"4,710,800,000","-561,300,000","-595,900,000","5,916,300,000"
7525,"Real estate investments","Impairment of Long-Lived Assets",444198,12/31/20,02/26/21,2,"Ernst & Young LLP",,,,Austin,TX,TEXAS,"US Southwest",10-K,2021-02-26,,"AMERICAN CAMPUS COMMUNITIES INC",1283630,,"805 LAS CIMAS PARKWAY","SUITE 400",AUSTIN,TX,TEXAS,"US Southwest",,,"=""6798""","Real Estate Investment Trusts",525990,"Other Financial Vehicles",34,43,12/31/20,"5,882,600,448",12/31/20,"870,584,000","72,803,000",,"7,531,160,000"
7521,"Real estate investments","Impairment of Long-Lived Assets",444201,12/31/20,02/26/21,2,"Ernst & Young LLP",,,,Austin,TX,TEXAS,"US Southwest",10-K,2021-02-26,,"American Campus Communities Operating Partnership LP",1357369,,"12700 HILL COUNTRY BOULEVARD","SUITE T-200",AUSTIN,TX,TEXAS,"US Southwest",,,"=""6798""","Real Estate Investment Trusts",525990,"Other Financial Vehicles",34,,,,12/31/20,"870,584,000","73,107,000",,"7,531,160,000"
8733,"Insurance contract liabilities","LIABILITY FOR UNPAID LOSSES AND LOSS ADJUSTMENT EXPENSE (LAE)- Refer to Notes 2 and 9 to the Financial Statements",447833,12/31/20,03/09/21,3,"Deloitte & Touche LLP",,,,Tampa,FL,FLORIDA,"US Southeast",10-K,2021-03-09,,"AMERICAN COASTAL INSURANCE Corp",1401521,"=""ACIC""","570 CARILLON PARKWAY","SUITE 100","SAINT PETERSBURG",FL,FLORIDA,"US Southeast",,,"=""6331""","Fire, Marine, and Casualty Insurance",524126,"Direct Property and Casualty Insurance Carriers",34,6,12/29/20,"248,573,968",12/31/20,"846,656,000","-96,454,000","300,778,000","2,848,941,000"
3432,"Property, plant and equipment","Retail Store Impairment - Leasehold Improvements and Operating Lease Right of Use Assets",421560,02/01/20,03/12/20,2,"Ernst & Young LLP",,,,Pittsburgh,PA,PENNSYLVANIA,"US Mid Atlantic",10-K,2020-03-12,,"AMERICAN EAGLE OUTFITTERS INC",919012,"=""AEO""","77 HOT METAL STREET",,PITTSBURGH,PA,PENNSYLVANIA,"US Mid Atlantic",,,"=""5651""","Family Clothing Stores",448140,"Family Clothing Stores",34,14,02/03/20,"2,402,896,384",02/01/20,"4,308,212,000","191,257,000","1,194,849,000","3,328,679,000"
6911,"Regulatory assets and liabilities","Accounting for the Effects of Cost-Based Regulation",443787,12/31/20,02/25/21,1,"PricewaterhouseCoopers LLP",,,,Columbus,OH,OHIO,"US Midwest",10-K,2021-02-25,,"AMERICAN ELECTRIC POWER CO INC",4904,"=""AEP""","1 RIVERSIDE PLAZA",,COLUMBUS,OH,OHIO,"US Midwest",,,"=""4911""","Electric Services",221122,"Electric Power Distribution",34,81,12/29/20,"40,296,636,416",12/31/20,"14,918,500,000","2,200,100,000","20,543,600,000","80,757,200,000"
6912,"Derivatives and hedging","Valuation of Level 3 Risk Management Commodity Contracts",443787,12/31/20,02/25/21,1,"PricewaterhouseCoopers LLP",,,,Columbus,OH,OHIO,"US Midwest",10-K,2021-02-25,,"AMERICAN ELECTRIC POWER CO INC",4904,"=""AEP""","1 RIVERSIDE PLAZA",,COLUMBUS,OH,OHIO,"US Midwest",,,"=""4911""","Electric Services",221122,"Electric Power Distribution",34,81,12/29/20,"40,296,636,416",12/31/20,"14,918,500,000","2,200,100,000","20,543,600,000","80,757,200,000"
5273,"Allowance for credit losses","Reserves for Credit Losses on Card Member Loans",441693,12/31/20,02/12/21,1,"PricewaterhouseCoopers LLP",,,,"New York",NY,"NEW YORK","US Mid Atlantic",10-K,2021-02-12,,"AMERICAN EXPRESS CO",4962,"=""AXP""","200 VESEY STREET","50TH FLOOR","NEW YORK",NY,"NEW YORK","US Mid Atlantic",,,"=""6199""","Finance Services",523930,"Investment Advice",34,121,12/31/20,"97,332,551,680",12/31/20,"31,357,000,000","3,135,000,000",,"191,367,000,000"
5274,"Other liabilities and provisions","Membership Rewards Liability",441693,12/31/20,02/12/21,1,"PricewaterhouseCoopers LLP",,,,"New York",NY,"NEW YORK","US Mid Atlantic",10-K,2021-02-12,,"AMERICAN EXPRESS CO",4962,"=""AXP""","200 VESEY STREET","50TH FLOOR","NEW YORK",NY,"NEW YORK","US Mid Atlantic",,,"=""6199""","Finance Services",523930,"Investment Advice",34,121,12/31/20,"97,332,551,680",12/31/20,"31,357,000,000","3,135,000,000",,"191,367,000,000"
6648,"Revenue from customer contracts","Purchase Price of Acquired U.S. Global Corporate Payments (GCP) Card Member Receivables",443795,12/31/20,02/25/21,1,"PricewaterhouseCoopers LLP",,,,"New York",NY,"NEW YORK","US Mid Atlantic",10-K,2021-02-25,,"AMERICAN EXPRESS CREDIT CORP",4969,,"200 VESEY STREET",,"NEW YORK",NY,"NEW YORK","US Mid Atlantic",4962,"AMERICAN EXPRESS CO","=""6153""","Short-Term Business Credit Institutions, Except Agricultural",522320,"Financial Transactions Processing, Reserve, and Clearinghouse Activities",34,,,,12/31/20,"312,000,000","201,000,000",,"24,308,000,000"
7025,"Other investments","Valuation of investments in securities	",444162,12/31/20,02/25/21,2,"Ernst & Young LLP",,,,Cincinnati,OH,OHIO,"US Midwest",10-K,2021-02-25,,"AMERICAN FINANCIAL GROUP INC",1042046,"=""AFG""","GREAT AMERICAN INSURANCE GROUP TOWER","301 E. 4TH STREET",CINCINNATI,OH,OHIO,"US Midwest",,,"=""6331""","Fire, Marine, and Casualty Insurance",524126,"Direct Property and Casualty Insurance Carriers",34,86,12/29/20,"7,452,971,008",12/31/20,"7,909,000,000","732,000,000","6,582,000,000","73,566,000,000"
7026,"Insurance contract liabilities","Property and casualty unpaid losses and loss adjustment expenses	",444162,12/31/20,02/25/21,2,"Ernst & Young LLP",,,,Cincinnati,OH,OHIO,"US Midwest",10-K,2021-02-25,,"AMERICAN FINANCIAL GROUP INC",1042046,"=""AFG""","GREAT AMERICAN INSURANCE GROUP TOWER","301 E. 4TH STREET",CINCINNATI,OH,OHIO,"US Midwest",,,"=""6331""","Fire, Marine, and Casualty Insurance",524126,"Direct Property and Casualty Insurance Carriers",34,86,12/29/20,"7,452,971,008",12/31/20,"7,909,000,000","732,000,000","6,582,000,000","73,566,000,000"
7027,"Insurance contract liabilities","Amortization of annuity deferred policy acquisition costs	",444162,12/31/20,02/25/21,2,"Ernst & Young LLP",,,,Cincinnati,OH,OHIO,"US Midwest",10-K,2021-02-25,,"AMERICAN FINANCIAL GROUP INC",1042046,"=""AFG""","GREAT AMERICAN INSURANCE GROUP TOWER","301 E. 4TH STREET",CINCINNATI,OH,OHIO,"US Midwest",,,"=""6331""","Fire, Marine, and Casualty Insurance",524126,"Direct Property and Casualty Insurance Carriers",34,86,12/29/20,"7,452,971,008",12/31/20,"7,909,000,000","732,000,000","6,582,000,000","73,566,000,000"
7028,"Derivatives and hedging","Valuation of annuity contract embedded derivatives	",444162,12/31/20,02/25/21,2,"Ernst & Young LLP",,,,Cincinnati,OH,OHIO,"US Midwest",10-K,2021-02-25,,"AMERICAN FINANCIAL GROUP INC",1042046,"=""AFG""","GREAT AMERICAN INSURANCE GROUP TOWER","301 E. 4TH STREET",CINCINNATI,OH,OHIO,"US Midwest",,,"=""6331""","Fire, Marine, and Casualty Insurance",524126,"Direct Property and Casualty Insurance Carriers",34,86,12/29/20,"7,452,971,008",12/31/20,"7,909,000,000","732,000,000","6,582,000,000","73,566,000,000"
10018,"Long-lived assets","Impairment of Long-Lived Assets — Determination of Impairment Indicators — Refer to Note 2 to the financial statements",450531,12/31/20,03/26/21,3,"Deloitte & Touche LLP",,,,"Costa Mesa",CA,CALIFORNIA,"US West",10-K,2021-03-26,,"American Healthcare REIT, Inc.",1632970,"=""AHR""","18191 VON KARMAN AVENUE","SUITE 300",IRVINE,CA,CALIFORNIA,"US West",,,"=""6798""","Real Estate Investment Trusts",525990,"Other Financial Vehicles",34,,,,12/31/20,"155,119,000","-18,942,000","488,256,000","1,092,773,000"
12380,"Long-lived assets","Impairment of Long-Lived Assets — Determination of Impairment Indicators — Refer to Note 2 to the financial statements",460351,12/31/20,03/26/21,3,"Deloitte & Touche LLP",,,,"Costa Mesa",CA,CALIFORNIA,"US West",S-4,2021-07-16,,"American Healthcare REIT, Inc.",1632970,"=""AHR""","18191 VON KARMAN AVENUE","SUITE 300",IRVINE,CA,CALIFORNIA,"US West",,,"=""6798""","Real Estate Investment Trusts",525990,"Other Financial Vehicles",34,,,,12/31/20,"155,119,000","-18,942,000","488,256,000","1,092,773,000"
12463,"Long-lived assets","Impairment of Long-Lived Assets — Determination of Impairment Indicators — Refer to Note 2 to the financial statements",461056,12/31/20,03/26/21,3,"Deloitte & Touche LLP",,,,"Costa Mesa",CA,CALIFORNIA,"US West",S-4/A,2021-07-27,,"American Healthcare REIT, Inc.",1632970,"=""AHR""","18191 VON KARMAN AVENUE","SUITE 300",IRVINE,CA,CALIFORNIA,"US West",,,"=""6798""","Real Estate Investment Trusts",525990,"Other Financial Vehicles",34,,,,12/31/20,"155,119,000","-18,942,000","488,256,000","1,092,773,000"
22394,"Long-lived assets","Impairment of Long-Lived Assets—Determination of Impairment Indicators—Refer to Note 2 to the financial statements",492101,12/31/20,03/26/21,3,"Deloitte & Touche LLP",,,,"Costa Mesa",CA,CALIFORNIA,"US West",S-11,2022-09-16,,"American Healthcare REIT, Inc.",1632970,"=""AHR""","18191 VON KARMAN AVENUE","SUITE 300",IRVINE,CA,CALIFORNIA,"US West",,,"=""6798""","Real Estate Investment Trusts",525990,"Other Financial Vehicles",34,,,,12/31/20,"155,119,000","-18,942,000","488,256,000","1,092,773,000"
7376,"Business combinations","Purchase Price Accounting	",444334,12/31/20,02/26/21,2,"Ernst & Young LLP",,,,"Los Angeles",CA,CALIFORNIA,"US West",10-K,2021-02-26,,"American Homes 4 Rent",1562401,"=""AMH""","280 PILOT ROAD",,"LAS VEGAS",NV,NEVADA,"US West",,,"=""6798""","Real Estate Investment Trusts",525990,"Other Financial Vehicles",34,30,12/31/20,"9,480,641,536",12/31/20,"1,172,514,000","140,374,000","5,668,815,000","9,593,625,000"
7380,"Business combinations","Purchase Price Accounting",444332,12/31/20,02/26/21,2,"Ernst & Young LLP",,,,"Los Angeles",CA,CALIFORNIA,"US West",10-K,2021-02-26,,"American Homes 4 Rent, L.P.",1716558,,"280 PILOT ROAD",,"LAS VEGAS",NV,NEVADA,"US West",1562401,"American Homes 4 Rent","=""6798""","Real Estate Investment Trusts",531110,"Lessors of Residential Buildings and Dwellings",34,,,,12/31/20,"1,172,514,000","154,829,000","6,352,151,000","9,593,625,000"
5864,"Other investments","Valuation of Certain Level 3 Fixed Maturity Securities",442762,12/31/20,02/19/21,1,"PricewaterhouseCoopers LLP",,,,"New York",NY,"NEW YORK","US Mid Atlantic",10-K,2021-02-19,,"AMERICAN INTERNATIONAL GROUP, INC.",5272,"=""AIG""","1271 AVE OF THE AMERICAS","FL 37","NEW YORK",NY,"NEW YORK","US Mid Atlantic",,,"=""6331""","Fire, Marine, and Casualty Insurance",524130,"Reinsurance Carriers",34,38,12/31/20,"32,618,588,160",12/31/20,"43,736,000,000","-5,944,000,000",,"586,481,000,000"
5865,"Insurance contract liabilities","Valuation of Insurance Liabilities - Unpaid Losses and Loss Adjustment Expenses (Loss Reserves)",442762,12/31/20,02/19/21,1,"PricewaterhouseCoopers LLP",,,,"New York",NY,"NEW YORK","US Mid Atlantic",10-K,2021-02-19,,"AMERICAN INTERNATIONAL GROUP, INC.",5272,"=""AIG""","1271 AVE OF THE AMERICAS","FL 37","NEW YORK",NY,"NEW YORK","US Mid Atlantic",,,"=""6331""","Fire, Marine, and Casualty Insurance",524130,"Reinsurance Carriers",34,38,12/31/20,"32,618,588,160",12/31/20,"43,736,000,000","-5,944,000,000",,"586,481,000,000"
5866,"Pension and other post-employment benefits","Valuation of Embedded Derivatives for Variable Annuity and Equity-Indexed Annuity Products and Valuation of Certain Guaranteed Benefit Features for Universal Life Products",442762,12/31/20,02/19/21,1,"PricewaterhouseCoopers LLP",,,,"New York",NY,"NEW YORK","US Mid Atlantic",10-K,2021-02-19,,"AMERICAN INTERNATIONAL GROUP, INC.",5272,"=""AIG""","1271 AVE OF THE AMERICAS","FL 37","NEW YORK",NY,"NEW YORK","US Mid Atlantic",,,"=""6331""","Fire, Marine, and Casualty Insurance",524130,"Reinsurance Carriers",34,38,12/31/20,"32,618,588,160",12/31/20,"43,736,000,000","-5,944,000,000",,"586,481,000,000"
5867,"Business combinations","Valuation of Deferred Policy Acquisition Costs for Universal Life and Individual Retirement Variable Annuity Products",442762,12/31/20,02/19/21,1,"PricewaterhouseCoopers LLP",,,,"New York",NY,"NEW YORK","US Mid Atlantic",10-K,2021-02-19,,"AMERICAN INTERNATIONAL GROUP, INC.",5272,"=""AIG""","1271 AVE OF THE AMERICAS","FL 37","NEW YORK",NY,"NEW YORK","US Mid Atlantic",,,"=""6331""","Fire, Marine, and Casualty Insurance",524130,"Reinsurance Carriers",34,38,12/31/20,"32,618,588,160",12/31/20,"43,736,000,000","-5,944,000,000",,"586,481,000,000"
5868,"Deferred income taxes","Recoverability of U.S. Federal Deferred Tax Asset",442762,12/31/20,02/19/21,1,"PricewaterhouseCoopers LLP",,,,"New York",NY,"NEW YORK","US Mid Atlantic",10-K,2021-02-19,,"AMERICAN INTERNATIONAL GROUP, INC.",5272,"=""AIG""","1271 AVE OF THE AMERICAS","FL 37","NEW YORK",NY,"NEW YORK","US Mid Atlantic",,,"=""6331""","Fire, Marine, and Casualty Insurance",524130,"Reinsurance Carriers",34,38,12/31/20,"32,618,588,160",12/31/20,"43,736,000,000","-5,944,000,000",,"586,481,000,000"
8445,"Insurance contract liabilities","Policyholders’ Account Balances – Valuation of embedded derivative liabilities for equity-indexed contracts — Refer to Notes 7 and 9 to the financial statements",446183,12/31/20,03/04/21,3,"Deloitte & Touche LLP",,,,Houston,TX,TEXAS,"US Southwest",10-K,2021-03-04,,"American National Group Inc",1801075,,"ONE MOODY PLAZA",,GALVESTON,TX,TEXAS,"US Southwest",,,"=""6311""","Life Insurance",524113,"Direct Life Insurance Carriers",34,,,"2,584,397,664",12/31/20,"2,218,074,000","421,590,000","6,465,567,000","29,467,815,000"
8446,"Insurance contract liabilities","Policy and Contract Claims – Property and casualty liability for unpaid claims and claim adjustment expenses — Refer to Notes 2 and 12 to the financial statements",446183,12/31/20,03/04/21,3,"Deloitte & Touche LLP",,,,Houston,TX,TEXAS,"US Southwest",10-K,2021-03-04,,"American National Group Inc",1801075,,"ONE MOODY PLAZA",,GALVESTON,TX,TEXAS,"US Southwest",,,"=""6311""","Life Insurance",524113,"Direct Life Insurance Carriers",34,,,"2,584,397,664",12/31/20,"2,218,074,000","421,590,000","6,465,567,000","29,467,815,000"
8447,"Allowance for credit losses","Mortgage Loans on Real Estate – Allowance for Credit Losses — Refer to Notes 2, 3, and 5 to the financial statements",446183,12/31/20,03/04/21,3,"Deloitte & Touche LLP",,,,Houston,TX,TEXAS,"US Southwest",10-K,2021-03-04,,"American National Group Inc",1801075,,"ONE MOODY PLAZA",,GALVESTON,TX,TEXAS,"US Southwest",,,"=""6311""","Life Insurance",524113,"Direct Life Insurance Carriers",34,,,"2,584,397,664",12/31/20,"2,218,074,000","421,590,000","6,465,567,000","29,467,815,000"
7816,"Deferred and capitalized costs","Valuation of deferred policy acquisition costs and deferred sales inducements and liability for lifetime income benefit riders",445318,12/31/20,03/01/21,4,"KPMG LLP",,,,"Des Moines",IA,IOWA,"US Midwest",10-K,2021-03-01,,"American National Group Inc.",1039828,"=""AEL.A""","6000 WESTOWN PARKWAY",,"WEST DES MOINES",IA,IOWA,"US Midwest",,,"=""6311""","Life Insurance",524113,"Direct Life Insurance Carriers",34,28,12/31/20,"2,647,632,384",12/31/20,"2,426,673,000","671,460,000",,"71,688,579,000"
7817,"Insurance contract liabilities","Fair value for embedded derivatives in fixed index annuity contracts",445318,12/31/20,03/01/21,4,"KPMG LLP",,,,"Des Moines",IA,IOWA,"US Midwest",10-K,2021-03-01,,"American National Group Inc.",1039828,"=""AEL.A""","6000 WESTOWN PARKWAY",,"WEST DES MOINES",IA,IOWA,"US Midwest",,,"=""6311""","Life Insurance",524113,"Direct Life Insurance Carriers",34,28,12/31/20,"2,647,632,384",12/31/20,"2,426,673,000","671,460,000",,"71,688,579,000"
8734,Goodwill,"Goodwill – HCN Reporting Unit – Refer to Notes 2 and 7 to the financial statements",447832,12/31/20,03/09/21,3,"Deloitte & Touche LLP",,,,McLean,VA,VIRGINIA,"US Mid Atlantic",10-K,2021-03-09,,"AMERICAN PUBLIC EDUCATION INC",1201792,"=""APEI""","111 W CONGRESS STREET",,"CHARLES TOWN",WV,"WEST VIRGINIA","US Mid Atlantic",,,"=""8200""","Services-Educational Services",923110,"Administration of Education Programs",34,30,12/31/20,"451,378,304",12/31/20,"321,785,000","18,822,000","276,641,000","371,018,000"
5990,"Regulatory assets and liabilities","Accounting for the Effects of Rate Regulation",442994,12/31/20,02/22/21,1,"PricewaterhouseCoopers LLP",,,,"Los Angeles",CA,CALIFORNIA,"US West",10-K,2021-02-22,,"AMERICAN STATES WATER CO",1056903,"=""AWR""","630 E FOOTHILL BLVD",,"SAN DIMAS",CA,CALIFORNIA,"US West",,,"=""4941""","Water Supply",221310,"Water Supply and Irrigation Systems",34,80,12/31/20,"2,933,052,672",12/31/20,"488,243,000","86,425,000","640,557,000","1,791,603,000"
10137,"Deferred and stock-based compensation","Equity-Based Compensation – Multi-Year Outperformance Award",450842,12/31/20,03/29/21,1,"PricewaterhouseCoopers LLP",,,,"New York",NY,"NEW YORK","US Mid Atlantic",10-K,2021-03-29,,"American Strategic Investment Co.",1595527,"=""NYC""","222 BELLEVUE AVENUE",,NEWPORT,RI,"RHODE ISLAND","US New England",,,"=""6798""","Real Estate Investment Trusts",531120,"Lessors of Nonresidential Buildings (except Miniwarehouses)",34,8,12/29/20,"99,092,824",12/31/20,"62,895,000","-40,962,000","279,440,000","861,846,000"
6985,"Revenue from customer contracts","Revenue Recognition for Significant Contract Modifications - Refer to Notes 1 and 4 to the financial statements",444144,12/31/20,02/25/21,3,"Deloitte & Touche LLP",,,,Boston,MA,MASSACHUSETTS,"US New England",10-K,2021-02-25,,"AMERICAN TOWER CORP /MA/",1053507,"=""AMT""","116 HUNTINGTON AVE",,BOSTON,MA,MASSACHUSETTS,"US New England",,,"=""6798""","Real Estate Investment Trusts",525930,"Real Estate Investment Trusts",34,224,12/31/20,"99,734,315,008",12/31/20,"8,041,500,000","1,690,600,000","-16,816,900,000","47,233,500,000"
6986,"Business combinations","InSite Wireless Group, LLC Acquisition – Refer to Notes 1, 5 and 7 to the financial statements",444144,12/31/20,02/25/21,3,"Deloitte & Touche LLP",,,,Boston,MA,MASSACHUSETTS,"US New England",10-K,2021-02-25,,"AMERICAN TOWER CORP /MA/",1053507,"=""AMT""","116 HUNTINGTON AVE",,BOSTON,MA,MASSACHUSETTS,"US New England",,,"=""6798""","Real Estate Investment Trusts",525930,"Real Estate Investment Trusts",34,224,12/31/20,"99,734,315,008",12/31/20,"8,041,500,000","1,690,600,000","-16,816,900,000","47,233,500,000"
6445,"Regulatory assets and liabilities","Accounting for the Effects of Rate Regulation",443583,12/31/20,02/24/21,1,"PricewaterhouseCoopers LLP",,,,Philadelphia,PA,PENNSYLVANIA,"US Mid Atlantic",10-K,2021-02-24,,"American Water Works Company, Inc.",1410636,"=""AWK""","1 WATER STREET",,CAMDEN,NJ,"NEW JERSEY","US Mid Atlantic",,,"=""4941""","Water Supply",221310,"Water Supply and Irrigation Systems",34,153,12/31/20,"27,823,880,192",12/31/20,"3,777,000,000","709,000,000","4,899,000,000","24,766,000,000"
4299,Goodwill,"Assessment of goodwill recoverability",428804,04/30/20,06/29/20,4,"KPMG LLP",,,,Richmond,VA,VIRGINIA,"US Mid Atlantic",10-K,2020-06-29,,"AMERICAN WOODMARK CORP",794619,"=""AMWD""","3102 SHAWNEE DRIVE",,WINCHESTER,VA,VIRGINIA,"US Mid Atlantic",,,"=""2430""","Millwood, Veneer, Plywood, & Structural Wood Members",337110,"Wood Kitchen Cabinet and Countertop Manufacturing",34,51,04/30/20,"870,193,280",04/30/20,"1,650,333,000","74,861,000","-236,740,000","1,622,806,000"
7904,"Business combinations","Accounting for the Acquisition of Nova Cold",445372,12/31/20,03/01/21,2,"Ernst & Young LLP",,,,Atlanta,GA,GEORGIA,"US Southeast",10-K,2021-03-01,,"AMERICOLD REALTY TRUST",1455863,"=""COLD""","10 Glenlake Pkwy., Suite 800 S. Tower",,Atlanta,GA,GEORGIA,"US Southeast",,,"=""6798""","Real Estate Investment Trusts",525990,"Other Financial Vehicles",34,37,12/31/20,"9,396,058,112",12/31/20,"1,987,727,000","24,540,000","2,112,288,000","7,744,757,000"
7905,Goodwill,"Test of Goodwill for Impairment",445372,12/31/20,03/01/21,2,"Ernst & Young LLP",,,,Atlanta,GA,GEORGIA,"US Southeast",10-K,2021-03-01,,"AMERICOLD REALTY TRUST",1455863,"=""COLD""","10 Glenlake Pkwy., Suite 800 S. Tower",,Atlanta,GA,GEORGIA,"US Southeast",,,"=""6798""","Real Estate Investment Trusts",525990,"Other Financial Vehicles",34,37,12/31/20,"9,396,058,112",12/31/20,"1,987,727,000","24,540,000","2,112,288,000","7,744,757,000"
10215,"Insurance contract liabilities","Liability for unpaid losses and loss adjustment expenses — Refer to Note 2 and 6 to the consolidated financial statements",451049,12/31/20,03/30/21,3,"Deloitte & Touche LLP",506,"Deloitte Ltd",5230,Hamilton,D0,BERMUDA,Foreign,10-K,2021-03-30,,"AMERINST INSURANCE GROUP LTD",1065201,,"CEDAR MANAGEMENT LIMITED, 25 CHURCH ST.","CONTINENTAL BLDG, , P.O. BOX HM 1601",HAMILTON,D0,BERMUDA,Foreign,,,"=""6399""","Insurance Carriers, NEC",524128,"Other Direct Insurance (except Life, Health, and Medical) Carriers",34,,,,12/31/20,"16,166,296","-14,592,215",,"38,323,118"
6387,"Other investments","Valuation of Certain Level 2 and Level 3 Available-for-Sale Securities",443414,12/31/20,02/24/21,1,"PricewaterhouseCoopers LLP",,,,Minneapolis,MN,MINNESOTA,"US Midwest",10-K,2021-02-24,,"AMERIPRISE CERTIFICATE CO",52428,,"50606 AMERIPRISE FINANCIAL CENTER",,MINNEAPOLIS,MN,MINNESOTA,"US Midwest",820027,"AMERIPRISE FINANCIAL INC",,,525990,"Other Financial Vehicles",34,,,,12/31/20,"136,186,000","29,460,000","420,744,000","7,290,756,000"
6381,"Insurance contract liabilities","Valuation of the reserves for long term care policies",443412,12/31/20,02/24/21,1,"PricewaterhouseCoopers LLP",,,,Minneapolis,MN,MINNESOTA,"US Midwest",10-K,2021-02-24,,"AMERIPRISE FINANCIAL INC",820027,"=""AMP""","1099 AMERIPRISE FINANCIAL CENTER",,MINNEAPOLIS,MN,MINNESOTA,"US Midwest",,,"=""6282""","Investment Advice",523930,"Investment Advice",34,194,12/31/20,"22,691,061,760",12/31/20,"11,958,000,000","1,534,000,000",,"165,883,000,000"
6382,"Other debt","Valuation of the embedded derivatives in certain variable annuity riders",443412,12/31/20,02/24/21,1,"PricewaterhouseCoopers LLP",,,,Minneapolis,MN,MINNESOTA,"US Midwest",10-K,2021-02-24,,"AMERIPRISE FINANCIAL INC",820027,"=""AMP""","1099 AMERIPRISE FINANCIAL CENTER",,MINNEAPOLIS,MN,MINNESOTA,"US Midwest",,,"=""6282""","Investment Advice",523930,"Investment Advice",34,194,12/31/20,"22,691,061,760",12/31/20,"11,958,000,000","1,534,000,000",,"165,883,000,000"
6383,"Insurance contract liabilities","Valuation of certain guarantees on variable annuity and certain life insurance policies accounted for as insurance liabilities",443412,12/31/20,02/24/21,1,"PricewaterhouseCoopers LLP",,,,Minneapolis,MN,MINNESOTA,"US Midwest",10-K,2021-02-24,,"AMERIPRISE FINANCIAL INC",820027,"=""AMP""","1099 AMERIPRISE FINANCIAL CENTER",,MINNEAPOLIS,MN,MINNESOTA,"US Midwest",,,"=""6282""","Investment Advice",523930,"Investment Advice",34,194,12/31/20,"22,691,061,760",12/31/20,"11,958,000,000","1,534,000,000",,"165,883,000,000"
7101,"Insurance contract liabilities","Valuation of Loss and Loss Adjustment Expense reserves",444827,12/31/20,02/26/21,2,"Ernst & Young LLP",,,,Philadelphia,PA,PENNSYLVANIA,"US Mid Atlantic",10-K,2021-02-26,,"AMERISAFE INC",1018979,"=""AMSF""","2301 HIGHWAY 190 WEST",,DERIDDER,LA,LOUISIANA,"US Southeast",,,"=""6331""","Fire, Marine, and Casualty Insurance",524126,"Direct Property and Casualty Insurance Carriers",34,57,12/31/20,"1,110,182,656",12/31/20,"339,477,000","86,602,000",,"1,470,855,000"
5640,"Business combinations","Accounting for Acquisitions",442220,12/31/20,02/18/21,2,"Ernst & Young LLP",,,,Philadelphia,PA,PENNSYLVANIA,"US Mid Atlantic",10-K,2021-02-18,,"AMETEK INC/",1037868,"=""AME""","1100 CASSATT ROAD",,BERWYN,PA,PENNSYLVANIA,"US Mid Atlantic",,,"=""3823""","Industrial Instruments for Measurement, Display, and Control of Process Variables; and Related Products",335312,"Motor and Generator Manufacturing",34,121,12/31/20,"27,878,989,824",12/31/20,"4,540,029,000","872,439,000","-899,279,000","10,357,483,000"
5641,"Other intangible assets","Impairment Assessment of Indefinite Lived Intangible Assets (other than Goodwill)",442220,12/31/20,02/18/21,2,"Ernst & Young LLP",,,,Philadelphia,PA,PENNSYLVANIA,"US Mid Atlantic",10-K,2021-02-18,,"AMETEK INC/",1037868,"=""AME""","1100 CASSATT ROAD",,BERWYN,PA,PENNSYLVANIA,"US Mid Atlantic",,,"=""3823""","Industrial Instruments for Measurement, Display, and Control of Process Variables; and Related Products",335312,"Motor and Generator Manufacturing",34,121,12/31/20,"27,878,989,824",12/31/20,"4,540,029,000","872,439,000","-899,279,000","10,357,483,000"
5029,"Sales return and allowances","Sales deductions",441240,12/31/20,02/08/21,2,"Ernst & Young LLP",,,,"Los Angeles",CA,CALIFORNIA,"US West",10-K,2021-02-09,,"AMGEN INC",318154,"=""AMGN""","ONE AMGEN CENTER DRIVE",,"THOUSAND OAKS",CA,CALIFORNIA,"US West",,,"=""2836""","Biological Products, Except Diagnostic Substances",325414,"Biological Product (except Diagnostic) Manufacturing",34,230,12/31/20,"132,962,738,176",12/31/20,"25,424,000,000","7,264,000,000","-21,867,000,000","62,948,000,000"
5030,"Other income taxes","Unrecognized tax benefits",441240,12/31/20,02/08/21,2,"Ernst & Young LLP",,,,"Los Angeles",CA,CALIFORNIA,"US West",10-K,2021-02-09,,"AMGEN INC",318154,"=""AMGN""","ONE AMGEN CENTER DRIVE",,"THOUSAND OAKS",CA,CALIFORNIA,"US West",,,"=""2836""","Biological Products, Except Diagnostic Substances",325414,"Biological Product (except Diagnostic) Manufacturing",34,230,12/31/20,"132,962,738,176",12/31/20,"25,424,000,000","7,264,000,000","-21,867,000,000","62,948,000,000"
8075,"Business combinations","Fair Value Measurement of the Contingent Consideration",445560,12/31/20,03/01/21,2,"Ernst & Young LLP",,,,Iselin,NJ,"NEW JERSEY","US Mid Atlantic",10-K,2021-03-01,,"AMICUS THERAPEUTICS, INC.",1178879,"=""FOLD""","47 HULFISH STREET",,PRINCETON,NJ,"NEW JERSEY","US Mid Atlantic",,,"=""2834""","Pharmaceutical Preparations",325412,"Pharmaceutical Preparation Manufacturing",34,23,12/31/20,"6,051,045,376",12/31/20,"260,886,000","-276,852,000","105,508,000","886,520,000"
5861,"Other income taxes","Accounting for Income Taxes",442650,12/31/20,02/19/21,1,"PricewaterhouseCoopers LLP",,,,Phoenix,AZ,ARIZONA,"US Southwest",10-K,2021-02-19,,"AMKOR TECHNOLOGY, INC.",1047127,"=""AMKR""","2045 EAST INNOVATION CIRCLE",,TEMPE,AZ,ARIZONA,"US Southwest",,,"=""3674""","Semiconductors and Related Devices",334515,"Instrument Manufacturing for Measuring and Testing Electricity and Electrical Signals",34,15,12/31/20,"3,661,861,376",12/31/20,"5,050,589,000","338,138,000","2,298,374,000","5,022,311,000"
7112,"Other contingent liabilities","Professional liability reserve",444787,12/31/20,02/26/21,4,"KPMG LLP",,,,"San Diego",CA,CALIFORNIA,"US West",10-K,2021-02-26,,"AMN HEALTHCARE SERVICES INC",1142750,"=""AMN""","2999 OLYMPUS BOULEVARD","SUITE 500",DALLAS,TX,TEXAS,"US Southwest",,,"=""7363""","Help Supply Services",561310,"Employment Placement Agencies",34,68,12/31/20,"3,211,367,168",12/31/20,"2,393,714,000","70,665,000","-609,719,000","2,353,507,000"
7113,"Business combinations","Fair value of intangible assets in acquisition of Stratus Video",444787,12/31/20,02/26/21,4,"KPMG LLP",,,,"San Diego",CA,CALIFORNIA,"US West",10-K,2021-02-26,,"AMN HEALTHCARE SERVICES INC",1142750,"=""AMN""","2999 OLYMPUS BOULEVARD","SUITE 500",DALLAS,TX,TEXAS,"US Southwest",,,"=""7363""","Help Supply Services",561310,"Employment Placement Agencies",34,68,12/31/20,"3,211,367,168",12/31/20,"2,393,714,000","70,665,000","-609,719,000","2,353,507,000"
7779,"Sales return and allowances","Medicaid Rebates",445474,12/31/20,03/01/21,2,"Ernst & Young LLP",,,,Iselin,NJ,"NEW JERSEY","US Mid Atlantic",10-K,2021-03-01,,"Amneal Pharmaceuticals, Inc.",1723128,"=""AMRX""","30831 HUNTWOOD AVE",,HAYWARD,CA,CALIFORNIA,"US West",,,"=""2834""","Pharmaceutical Preparations",325412,"Pharmaceutical Preparation Manufacturing",34,5,12/31/20,"674,870,208",12/31/20,"1,992,523,000","91,059,000","-1,512,365,000","4,006,033,000"
7780,"Sales return and allowances","Sales Returns",445474,12/31/20,03/01/21,2,"Ernst & Young LLP",,,,Iselin,NJ,"NEW JERSEY","US Mid Atlantic",10-K,2021-03-01,,"Amneal Pharmaceuticals, Inc.",1723128,"=""AMRX""","30831 HUNTWOOD AVE",,HAYWARD,CA,CALIFORNIA,"US West",,,"=""2834""","Pharmaceutical Preparations",325412,"Pharmaceutical Preparation Manufacturing",34,5,12/31/20,"674,870,208",12/31/20,"1,992,523,000","91,059,000","-1,512,365,000","4,006,033,000"
7781,"Other intangible assets","Impairment of Intangible Assets with Finite Lives	",445474,12/31/20,03/01/21,2,"Ernst & Young LLP",,,,Iselin,NJ,"NEW JERSEY","US Mid Atlantic",10-K,2021-03-01,,"Amneal Pharmaceuticals, Inc.",1723128,"=""AMRX""","30831 HUNTWOOD AVE",,HAYWARD,CA,CALIFORNIA,"US West",,,"=""2834""","Pharmaceutical Preparations",325412,"Pharmaceutical Preparation Manufacturing",34,5,12/31/20,"674,870,208",12/31/20,"1,992,523,000","91,059,000","-1,512,365,000","4,006,033,000"
7782,"Goodwill and intangible assets","Impairment of Goodwill and Other Indefinite-lived Intangible Asset	",445474,12/31/20,03/01/21,2,"Ernst & Young LLP",,,,Iselin,NJ,"NEW JERSEY","US Mid Atlantic",10-K,2021-03-01,,"Amneal Pharmaceuticals, Inc.",1723128,"=""AMRX""","30831 HUNTWOOD AVE",,HAYWARD,CA,CALIFORNIA,"US West",,,"=""2834""","Pharmaceutical Preparations",325412,"Pharmaceutical Preparation Manufacturing",34,5,12/31/20,"674,870,208",12/31/20,"1,992,523,000","91,059,000","-1,512,365,000","4,006,033,000"
7783,"Business combinations","AvKARE and R&S Acquisitions",445474,12/31/20,03/01/21,2,"Ernst & Young LLP",,,,Iselin,NJ,"NEW JERSEY","US Mid Atlantic",10-K,2021-03-01,,"Amneal Pharmaceuticals, Inc.",1723128,"=""AMRX""","30831 HUNTWOOD AVE",,HAYWARD,CA,CALIFORNIA,"US West",,,"=""2834""","Pharmaceutical Preparations",325412,"Pharmaceutical Preparation Manufacturing",34,5,12/31/20,"674,870,208",12/31/20,"1,992,523,000","91,059,000","-1,512,365,000","4,006,033,000"
9217,"Sales return and allowances","Provision for chargebacks estimate",448932,12/31/20,03/15/21,2,"Ernst & Young LLP",,,,Irvine,CA,CALIFORNIA,"US West",10-K,2021-03-15,,"Amphastar Pharmaceuticals, Inc.",1297184,"=""AMPH""","11570 SIXTH STREET",,"RANCHO CUCAMONGA",CA,CALIFORNIA,"US West",,,"=""2834""","Pharmaceutical Preparations",325412,"Pharmaceutical Preparation Manufacturing",34,20,12/31/20,"955,133,248",12/31/20,"349,846,000","1,403,000","361,691,000","631,236,000"
9218,Inventory,"Inventory lower of cost or net realizable value estimate",448932,12/31/20,03/15/21,2,"Ernst & Young LLP",,,,Irvine,CA,CALIFORNIA,"US West",10-K,2021-03-15,,"Amphastar Pharmaceuticals, Inc.",1297184,"=""AMPH""","11570 SIXTH STREET",,"RANCHO CUCAMONGA",CA,CALIFORNIA,"US West",,,"=""2834""","Pharmaceutical Preparations",325412,"Pharmaceutical Preparation Manufacturing",34,20,12/31/20,"955,133,248",12/31/20,"349,846,000","1,403,000","361,691,000","631,236,000"
5120,"Other income taxes","Income Taxes — Unrecognized Tax Benefits — Refer to Notes 1 and 6 to the financial statements",441469,12/31/20,02/10/21,3,"Deloitte & Touche LLP",,,,Hartford,CT,CONNECTICUT,"US New England",10-K,2021-02-10,,"AMPHENOL CORP /DE/",820313,"=""APH""","358 HALL AVE",,WALLINGFORD,CT,CONNECTICUT,"US New England",,,"=""3678""","Electronic Connectors",334417,"Electronic Connector Manufacturing",34,131,12/31/20,"39,136,468,992",12/31/20,"8,598,900,000","1,203,400,000","-44,700,000","12,327,300,000"
8884,"Proven and unproven reserves","Oil and Gas Reserve Quantities & Related Cashflows as used in the calculation of DD&A and Impairment — Refer to Notes 2 and 18 to the financial statements",448365,12/31/20,03/11/21,3,"Deloitte & Touche LLP",,,,Houston,TX,TEXAS,"US Southwest",10-K,2021-03-11,,"Amplify Energy Corp.",1533924,"=""AMPY""","500 DALLAS STREET","SUITE 1700",,TX,TEXAS,"US Southwest",,,"=""1311""","Crude Petroleum and Natural Gas",211111,"Crude Petroleum and Natural Gas Extraction",34,1,12/31/20,"49,339,196",12/31/20,"202,144,000","-464,030,000",,"384,759,000"
4723,"Sales return and allowances","Revenue Recognition – Measuring Variable Consideration",436021,10/31/20,11/24/20,2,"Ernst & Young LLP",,,,Boston,MA,MASSACHUSETTS,"US New England",10-K,2020-11-24,,"ANALOG DEVICES INC",6281,"=""ADI""","ONE ANALOG WAY",,WILMINGTON,MA,MASSACHUSETTS,"US New England",,,"=""3674""","Semiconductors and Related Devices",334413,"Semiconductor and Related Device Manufacturing",34,118,11/02/20,"43,738,816,512",10/31/20,"5,603,056,000","1,220,761,000","-3,930,760,000","21,468,603,000"
4724,Goodwill,"Goodwill – Quantitative Impairment Assessment",436021,10/31/20,11/24/20,2,"Ernst & Young LLP",,,,Boston,MA,MASSACHUSETTS,"US New England",10-K,2020-11-24,,"ANALOG DEVICES INC",6281,"=""ADI""","ONE ANALOG WAY",,WILMINGTON,MA,MASSACHUSETTS,"US New England",,,"=""3674""","Semiconductors and Related Devices",334413,"Semiconductor and Related Device Manufacturing",34,118,11/02/20,"43,738,816,512",10/31/20,"5,603,056,000","1,220,761,000","-3,930,760,000","21,468,603,000"
3705,"Depreciation and amortization","Evaluation of the amortization period for capitalized sales commissions",423302,01/31/20,03/30/20,4,"KPMG LLP",,,,"San Francisco",CA,CALIFORNIA,"US West",10-K,2020-03-30,,"Anaplan, Inc.",1540755,,"50 HAWTHORNE STREET",,"SAN FRANCISCO",CA,CALIFORNIA,"US West",,,"=""7372""","Prepackaged Software",511210,"Software Publishers",34,58,01/31/20,"7,803,156,992",01/31/20,"348,022,000","-149,217,000","259,302,000","649,807,000"
6794,"Research and development expenses","Evaluation of Research and Development Costs",444103,12/31/20,02/25/21,4,"KPMG LLP",,,,"San Diego",CA,CALIFORNIA,"US West",10-K,2021-02-25,,"ANAPTYSBIO, INC",1370053,"=""ANAB""","10770 WATERIDGE CIRCLE, SUITE 210",,"SAN DIEGO",CA,CALIFORNIA,"US West",,,"=""2834""","Pharmaceutical Preparations",325412,"Pharmaceutical Preparation Manufacturing",34,22,12/31/20,"588,153,984",12/31/20,"75,000,000","-19,931,000",,"416,552,000"
6795,"Revenue from customer contracts","Assessment of the Presentation of GlaxoSmithKline Payment as Revenue",444103,12/31/20,02/25/21,4,"KPMG LLP",,,,"San Diego",CA,CALIFORNIA,"US West",10-K,2021-02-25,,"ANAPTYSBIO, INC",1370053,"=""ANAB""","10770 WATERIDGE CIRCLE, SUITE 210",,"SAN DIEGO",CA,CALIFORNIA,"US West",,,"=""2834""","Pharmaceutical Preparations",325412,"Pharmaceutical Preparation Manufacturing",34,22,12/31/20,"588,153,984",12/31/20,"75,000,000","-19,931,000",,"416,552,000"
6893,Goodwill,"Goodwill—GSM and FSI Reporting Units—Refer to Notes 1 and 17 to the consolidated financial statements",443873,12/31/20,02/25/21,3,"Deloitte & Touche LLP",,,,Cleveland,OH,OHIO,"US Midwest",10-K,2021-02-25,,"Andersons, Inc.",821026,"=""ANDE""","1947 BRIARFIELD BOULEVARD",,MAUMEE,OH,OHIO,"US Midwest",,,"=""5150""","Wholesale-Farm Product Raw Materials",493130,"Farm Product Warehousing and Storage",34,25,12/31/20,"822,408,512",12/31/20,"8,064,620,000","7,710,000","683,242,000","4,272,121,000"
11347,"Goodwill and intangible assets","Impairment of indefinite lived assets - distribution rights and goodwill",454562,12/31/20,04/27/21,2,"Ernst & Young LLP",636,"EY Servicios Profesionales de Auditoría y Asesorías SpA (EY Audit SpA)",1431,Santiago,F3,CHILE,Foreign,20-F,2021-04-28,,"ANDINA BOTTLING CO INC",925261,"=""AKO.A""","AVENIDA EL GOLF 40, PISO 4","LAS CONDES",SANTIAGO,F3,CHILE,Foreign,,,"=""2086""","Bottled and Canned Soft Drinks and Carbonated Waters",312111,"Soft Drink Manufacturing",34,13,12/29/20,"1,047,176,256",12/31/20,"2,390,262,000","173,283,000","152,486,000","3,445,552,000"
11348,"Other contingent liabilities","Tax Contingencies in Brazil",454562,12/31/20,04/27/21,2,"Ernst & Young LLP",636,"EY Servicios Profesionales de Auditoría y Asesorías SpA (EY Audit SpA)",1431,Santiago,F3,CHILE,Foreign,20-F,2021-04-28,,"ANDINA BOTTLING CO INC",925261,"=""AKO.A""","AVENIDA EL GOLF 40, PISO 4","LAS CONDES",SANTIAGO,F3,CHILE,Foreign,,,"=""2086""","Bottled and Canned Soft Drinks and Carbonated Waters",312111,"Soft Drink Manufacturing",34,13,12/29/20,"1,047,176,256",12/31/20,"2,390,262,000","173,283,000","152,486,000","3,445,552,000"
5408,"Deferred and stock-based compensation","Stock-Based Compensation",441932,12/31/20,02/16/21,2,"Ernst & Young LLP",,,,"New York",NY,"NEW YORK","US Mid Atlantic",10-K,2021-02-16,,"Angi Inc.",1705110,"=""ANGI""","555 WEST 18TH STREET",,"NEW YORK",NY,"NEW YORK","US Mid Atlantic",,,"=""7310""",Services-Advertising,541870,"Advertising Material Distribution Services",34,13,12/31/20,"1,033,995,584",12/31/20,"1,467,925,000","-6,283,000","197,140,000","2,368,182,000"
10021,"Disposals and divestitures","Sale of South African assets	",450528,12/31/20,03/26/21,2,"Ernst & Young LLP",281,"Ernst & Young Incorporated",1698,Johannesburg,T3,"SOUTH AFRICA",Foreign,20-F,2021-03-26,,"ANGLOGOLD ASHANTI (PTY) LTD",1067428,"=""AU""","76 JEPPE STREET","PO BOX 62117",MARSHALLTOWN,T3,"SOUTH AFRICA",Foreign,,,"=""1040""","Metal Mining",212221,"Gold Ore Mining",34,23,12/29/20,"9,539,469,312",12/31/20,"4,595,000,000","1,009,000,000","3,597,000,000","7,705,000,000"
10022,"Deferred and capitalized costs","Obuasi re-development operational readiness assessment	",450528,12/31/20,03/26/21,2,"Ernst & Young LLP",281,"Ernst & Young Incorporated",1698,Johannesburg,T3,"SOUTH AFRICA",Foreign,20-F,2021-03-26,,"ANGLOGOLD ASHANTI (PTY) LTD",1067428,"=""AU""","76 JEPPE STREET","PO BOX 62117",MARSHALLTOWN,T3,"SOUTH AFRICA",Foreign,,,"=""1040""","Metal Mining",212221,"Gold Ore Mining",34,23,12/29/20,"9,539,469,312",12/31/20,"4,595,000,000","1,009,000,000","3,597,000,000","7,705,000,000"
10023,"Other income taxes","Geita VAT recoverability	",450528,12/31/20,03/26/21,2,"Ernst & Young LLP",281,"Ernst & Young Incorporated",1698,Johannesburg,T3,"SOUTH AFRICA",Foreign,20-F,2021-03-26,,"ANGLOGOLD ASHANTI (PTY) LTD",1067428,"=""AU""","76 JEPPE STREET","PO BOX 62117",MARSHALLTOWN,T3,"SOUTH AFRICA",Foreign,,,"=""1040""","Metal Mining",212221,"Gold Ore Mining",34,23,12/29/20,"9,539,469,312",12/31/20,"4,595,000,000","1,009,000,000","3,597,000,000","7,705,000,000"
10024,"Asset retirement and environmental obligations","Rehabilitation and decommissioning provision",450528,12/31/20,03/26/21,2,"Ernst & Young LLP",281,"Ernst & Young Incorporated",1698,Johannesburg,T3,"SOUTH AFRICA",Foreign,20-F,2021-03-26,,"ANGLOGOLD ASHANTI (PTY) LTD",1067428,"=""AU""","76 JEPPE STREET","PO BOX 62117",MARSHALLTOWN,T3,"SOUTH AFRICA",Foreign,,,"=""1040""","Metal Mining",212221,"Gold Ore Mining",34,23,12/29/20,"9,539,469,312",12/31/20,"4,595,000,000","1,009,000,000","3,597,000,000","7,705,000,000"
9645,"Goodwill and intangible assets","Impairment of goodwill and intangible assets with indefinite useful life",449598,12/31/20,03/17/21,1,"PricewaterhouseCoopers LLP",266,"PricewaterhouseCoopers Bedrijfsrevisoren BCVBA",1350,Sint-Stevens-Woluwe,C9,BELGIUM,Foreign,20-F,2021-03-19,,"Anheuser-Busch InBev SA/NV",1668717,"=""BUD""","BROUWERIJPLEIN 1",,LEUVEN,C9,BELGIUM,Foreign,,,"=""2082""","Malt Beverages",312120,Breweries,34,71,12/29/20,"120,203,264,000",12/31/20,"46,881,000,000","2,202,000,000","-94,476,000,000","226,409,000,000"
9646,"Uncertain tax positions","Uncertain tax positions",449598,12/31/20,03/17/21,1,"PricewaterhouseCoopers LLP",266,"PricewaterhouseCoopers Bedrijfsrevisoren BCVBA",1350,Sint-Stevens-Woluwe,C9,BELGIUM,Foreign,20-F,2021-03-19,,"Anheuser-Busch InBev SA/NV",1668717,"=""BUD""","BROUWERIJPLEIN 1",,LEUVEN,C9,BELGIUM,Foreign,,,"=""2082""","Malt Beverages",312120,Breweries,34,71,12/29/20,"120,203,264,000",12/31/20,"46,881,000,000","2,202,000,000","-94,476,000,000","226,409,000,000"
8490,"Business combinations","Business Combinations — Refer to Note 3 to the financial statements",446625,12/31/20,03/05/21,3,"Deloitte & Touche LLP",,,,Boston,MA,MASSACHUSETTS,"US New England",10-K,2021-03-05,,"Anika Therapeutics, Inc.",898437,"=""ANIK""","32 WIGGINS AVENUE",,BEDFORD,MA,MASSACHUSETTS,"US New England",,,"=""3841""","Surgical and Medical Instruments and Apparatus",325414,"Biological Product (except Diagnostic) Manufacturing",34,45,12/31/20,"648,530,560",12/31/20,"130,457,000","-23,982,000","172,830,000","365,605,000"
8491,Goodwill,"Goodwill –Arthrosurface and Parcus Medical Reporting Unit — Refer to Notes 2 and 8 to the financial statements",446625,12/31/20,03/05/21,3,"Deloitte & Touche LLP",,,,Boston,MA,MASSACHUSETTS,"US New England",10-K,2021-03-05,,"Anika Therapeutics, Inc.",898437,"=""ANIK""","32 WIGGINS AVENUE",,BEDFORD,MA,MASSACHUSETTS,"US New England",,,"=""3841""","Surgical and Medical Instruments and Apparatus",325414,"Biological Product (except Diagnostic) Manufacturing",34,45,12/31/20,"648,530,560",12/31/20,"130,457,000","-23,982,000","172,830,000","365,605,000"
11273,"Business combinations","Business Combinations — Refer to Note 3 to the financial statements",454136,12/31/20,03/05/21,3,"Deloitte & Touche LLP",,,,Boston,MA,MASSACHUSETTS,"US New England",10-K/A,2021-04-26,,"Anika Therapeutics, Inc.",898437,"=""ANIK""","32 WIGGINS AVENUE",,BEDFORD,MA,MASSACHUSETTS,"US New England",,,"=""3841""","Surgical and Medical Instruments and Apparatus",325414,"Biological Product (except Diagnostic) Manufacturing",34,45,12/31/20,"648,530,560",12/31/20,"130,457,000","-23,982,000","172,830,000","365,605,000"
11274,Goodwill,"Goodwill –Arthrosurface and Parcus Medical Reporting Unit — Refer to Notes 2 and 8 to the financial statements",454136,12/31/20,03/05/21,3,"Deloitte & Touche LLP",,,,Boston,MA,MASSACHUSETTS,"US New England",10-K/A,2021-04-26,,"Anika Therapeutics, Inc.",898437,"=""ANIK""","32 WIGGINS AVENUE",,BEDFORD,MA,MASSACHUSETTS,"US New England",,,"=""3841""","Surgical and Medical Instruments and Apparatus",325414,"Biological Product (except Diagnostic) Manufacturing",34,45,12/31/20,"648,530,560",12/31/20,"130,457,000","-23,982,000","172,830,000","365,605,000"
5778,"Allowance for credit losses","Allowance for loan losses",442397,12/31/20,02/18/21,2,"Ernst & Young LLP",,,,"New York",NY,"NEW YORK","US Mid Atlantic",10-K,2021-02-19,,"ANNALY CAPITAL MANAGEMENT INC",1043219,"=""NLY""","1211 AVENUE OF THE AMERICAS",,"NEW YORK",NY,"NEW YORK","US Mid Atlantic",,,"=""6798""","Real Estate Investment Trusts",525990,"Other Financial Vehicles",34,8,12/31/20,"11,815,133,184",12/31/20,"-678,997,000","-891,163,000","13,880,975,000","88,455,103,000"
5779,"Depreciation and amortization","Amortization of net premiums on residential securities",442397,12/31/20,02/18/21,2,"Ernst & Young LLP",,,,"New York",NY,"NEW YORK","US Mid Atlantic",10-K,2021-02-19,,"ANNALY CAPITAL MANAGEMENT INC",1043219,"=""NLY""","1211 AVENUE OF THE AMERICAS",,"NEW YORK",NY,"NEW YORK","US Mid Atlantic",,,"=""6798""","Real Estate Investment Trusts",525990,"Other Financial Vehicles",34,8,12/31/20,"11,815,133,184",12/31/20,"-678,997,000","-891,163,000","13,880,975,000","88,455,103,000"
6419,"Revenue from customer contracts","Revenue—Time-Based Lease Licenses—Refer to Notes 2 and 3 to the financial statements",443535,12/31/20,02/24/21,3,"Deloitte & Touche LLP",,,,Pittsburgh,PA,PENNSYLVANIA,"US Mid Atlantic",10-K,2021-02-24,,"ANSYS INC",1013462,"=""ANSS""","2600 ANSYS DRIVE, SOUTHPOINTE",,CANONSBURG,PA,PENNSYLVANIA,"US Mid Atlantic",,,"=""7372""","Prepackaged Software",511210,"Software Publishers",34,364,12/31/20,"31,495,079,936",12/31/20,"1,681,297,000","433,887,000","364,701,000","5,940,590,000"
6420,"Business combinations","Acquisitions — Analytical Graphics, Inc. — Developed Technology Intangible Asset — Refer to Notes 2 and 4 to the financial statements",443535,12/31/20,02/24/21,3,"Deloitte & Touche LLP",,,,Pittsburgh,PA,PENNSYLVANIA,"US Mid Atlantic",10-K,2021-02-24,,"ANSYS INC",1013462,"=""ANSS""","2600 ANSYS DRIVE, SOUTHPOINTE",,CANONSBURG,PA,PENNSYLVANIA,"US Mid Atlantic",,,"=""7372""","Prepackaged Software",511210,"Software Publishers",34,364,12/31/20,"31,495,079,936",12/31/20,"1,681,297,000","433,887,000","364,701,000","5,940,590,000"
8205,"Sales return and allowances","Evaluation of certain assumptions impacting the government and insurance plan rebate reserves",445740,12/31/20,03/02/21,4,"KPMG LLP",,,,Minneapolis,MN,MINNESOTA,"US Midwest",10-K,2021-03-02,,"ANTARES PHARMA, INC.",1016169,,"100 PRINCETON SOUTH","SUITE 300",EWING,NJ,"NEW JERSEY","US Mid Atlantic",,,"=""3841""","Surgical and Medical Instruments and Apparatus",339112,"Surgical and Medical Instrument Manufacturing",34,4,12/31/20,"665,675,648",12/31/20,"149,599,000","56,201,000","110,327,000","212,531,000"
8206,"Deferred income taxes","Evaluation of the realizability of deferred tax assets",445740,12/31/20,03/02/21,4,"KPMG LLP",,,,Minneapolis,MN,MINNESOTA,"US Midwest",10-K,2021-03-02,,"ANTARES PHARMA, INC.",1016169,,"100 PRINCETON SOUTH","SUITE 300",EWING,NJ,"NEW JERSEY","US Mid Atlantic",,,"=""3841""","Surgical and Medical Instruments and Apparatus",339112,"Surgical and Medical Instrument Manufacturing",34,4,12/31/20,"665,675,648",12/31/20,"149,599,000","56,201,000","110,327,000","212,531,000"
5551,Leases,"Lease classification for ongoing modifications to the gathering and compression assets",442143,12/31/20,02/17/21,4,"KPMG LLP",,,,Denver,CO,COLORADO,"US West",10-K,2021-02-17,,"Antero Midstream Corp",1623925,"=""AM""","1615 WYNKOOP STREET",,DENVER,CO,COLORADO,"US West",,,"=""4922""","Natural Gas Transmission",486210,"Pipeline Transportation of Natural Gas",34,8,12/31/20,"3,674,886,656",12/31/20,"900,719,000","-122,527,000","990,839,000","5,610,912,000"
5552,"Long-lived assets","Impairment of Utica fresh water assets",442143,12/31/20,02/17/21,4,"KPMG LLP",,,,Denver,CO,COLORADO,"US West",10-K,2021-02-17,,"Antero Midstream Corp",1623925,"=""AM""","1615 WYNKOOP STREET",,DENVER,CO,COLORADO,"US West",,,"=""4922""","Natural Gas Transmission",486210,"Pipeline Transportation of Natural Gas",34,8,12/31/20,"3,674,886,656",12/31/20,"900,719,000","-122,527,000","990,839,000","5,610,912,000"
5575,"Proven and unproven reserves","Estimated oil and gas reserves on depletion expense related to proved oil and gas properties ",442205,12/31/20,02/17/21,4,"KPMG LLP",,,,Denver,CO,COLORADO,"US West",10-K,2021-02-17,,"ANTERO RESOURCES Corp",1433270,"=""AR""","1615 WYNKOOP STREET",,DENVER,CO,COLORADO,"US West",,,"=""1311""","Crude Petroleum and Natural Gas",211111,"Crude Petroleum and Natural Gas Extraction",34,5,12/31/20,"1,464,262,400",12/31/20,"3,491,699,000","-1,267,897,000",,"13,150,845,000"
6119,Goodwill,"Interim Goodwill Impairment Assessment—Realogy Brokerage Group Reporting Unit",443042,12/31/20,02/23/21,1,"PricewaterhouseCoopers LLP",,,,"Florham Park",NJ,"NEW JERSEY","US Mid Atlantic",10-K,2021-02-23,,"Anywhere Real Estate Group LLC",1355001,,"175 PARK AVENUE",,MADISON,NJ,"NEW JERSEY","US Mid Atlantic",1398987,"Anywhere Real Estate Inc.","=""6531""","Real Estate Agents and Managers",531210,"Offices of Real Estate Agents and Brokers",34,,,,12/31/20,"6,221,000,000","-360,000,000","-3,108,000,000","6,934,000,000"
6120,"Other intangible assets","Interim Other Indefinite-Lived Asset Impairment Assessment – Realogy Franchise Group Trademark Intangible Asset",443042,12/31/20,02/23/21,1,"PricewaterhouseCoopers LLP",,,,"Florham Park",NJ,"NEW JERSEY","US Mid Atlantic",10-K,2021-02-23,,"Anywhere Real Estate Group LLC",1355001,,"175 PARK AVENUE",,MADISON,NJ,"NEW JERSEY","US Mid Atlantic",1398987,"Anywhere Real Estate Inc.","=""6531""","Real Estate Agents and Managers",531210,"Offices of Real Estate Agents and Brokers",34,,,,12/31/20,"6,221,000,000","-360,000,000","-3,108,000,000","6,934,000,000"
6092,Goodwill,"Interim Goodwill Impairment Assessment—Realogy Brokerage Group Reporting Unit",443045,12/31/20,02/23/21,1,"PricewaterhouseCoopers LLP",,,,"Florham Park",NJ,"NEW JERSEY","US Mid Atlantic",10-K,2021-02-23,,"Anywhere Real Estate Inc.",1398987,"=""HOUS""","175 PARK AVENUE",,MADISON,NJ,"NEW JERSEY","US Mid Atlantic",,,"=""6531""","Real Estate Agents and Managers",531210,"Offices of Real Estate Agents and Brokers",34,13,12/29/20,"1,554,049,152",12/31/20,"6,221,000,000","-360,000,000","-3,108,000,000","6,934,000,000"
6093,"Other intangible assets","Interim Other Indefinite-Lived Asset Impairment Assessment – Realogy Franchise Group Trademark Intangible Asset",443045,12/31/20,02/23/21,1,"PricewaterhouseCoopers LLP",,,,"Florham Park",NJ,"NEW JERSEY","US Mid Atlantic",10-K,2021-02-23,,"Anywhere Real Estate Inc.",1398987,"=""HOUS""","175 PARK AVENUE",,MADISON,NJ,"NEW JERSEY","US Mid Atlantic",,,"=""6531""","Real Estate Agents and Managers",531210,"Offices of Real Estate Agents and Brokers",34,13,12/29/20,"1,554,049,152",12/31/20,"6,221,000,000","-360,000,000","-3,108,000,000","6,934,000,000"
5873,"Deferred income taxes","Realizability of Deferred Tax Assets	",442614,12/31/20,02/19/21,2,"Ernst & Young LLP",,,,Chicago,IL,ILLINOIS,"US Midwest",10-K,2021-02-19,,"Aon plc",315293,"=""AON""","15 GEORGES QUAY",,"DUBLIN 2",L2,IRELAND,Foreign,,,"=""6411""","Insurance Agents, Brokers, and Service",524210,"Insurance Agencies and Brokerages",34,211,12/31/20,"47,641,387,008",12/31/20,"11,066,000,000","1,969,000,000","-5,811,000,000","32,114,000,000"
7480,"Proven and unproven reserves","Depreciation, depletion and amortization and impairment of property and equipment",444279,12/31/20,02/25/21,2,"Ernst & Young LLP",,,,Houston,TX,TEXAS,"US Southwest",10-K,2021-02-26,,"APACHE CORP",6769,,"2000 W SAM HOUSTON PKWY S","SUITE 200",HOUSTON,TX,TEXAS,"US Southwest",1841666,"APA Corp","=""1311""","Crude Petroleum and Natural Gas",211111,"Crude Petroleum and Natural Gas Extraction",34,14,12/29/20,"5,341,316,096",12/31/20,"4,435,000,000","-4,784,000,000",,"12,746,000,000"
7481,"Asset retirement and environmental obligations","Accounting for asset retirement obligation for the North Sea segment",444279,12/31/20,02/25/21,2,"Ernst & Young LLP",,,,Houston,TX,TEXAS,"US Southwest",10-K,2021-02-26,,"APACHE CORP",6769,,"2000 W SAM HOUSTON PKWY S","SUITE 200",HOUSTON,TX,TEXAS,"US Southwest",1841666,"APA Corp","=""1311""","Crude Petroleum and Natural Gas",211111,"Crude Petroleum and Natural Gas Extraction",34,14,12/29/20,"5,341,316,096",12/31/20,"4,435,000,000","-4,784,000,000",,"12,746,000,000"
9275,"Real estate investments","Impairment of Real Estate",448687,12/31/20,03/12/21,2,"Ernst & Young LLP",,,,Denver,CO,COLORADO,"US West",10-K,2021-03-15,,"Apartment Income REIT Corp.",1820877,,"4582 S. ULSTER STREET, SUITE 1700",,DENVER,CO,COLORADO,"US West",,,"=""6798""","Real Estate Investment Trusts",525990,"Other Financial Vehicles",34,38,12/31/20,"5,717,752,320",12/31/20,"719,556,000","-104,127,000","1,354,014,000","6,229,278,000"
9274,"Real estate investments","Impairment of Real Estate",448686,12/31/20,03/12/21,2,"Ernst & Young LLP",,,,Denver,CO,COLORADO,"US West",10-K,2021-03-15,,"Apartment Income REIT, L.P.",926660,,"345 PARK AVENUE",,"NEW YORK",NY,"NEW YORK","US Mid Atlantic",922864,"APARTMENT INVESTMENT & MANAGEMENT CO","=""6513""","Operators of Apartment Buildings",531110,"Lessors of Residential Buildings and Dwellings",34,,,,12/31/20,"719,556,000","-102,546,000","1,417,199,000","6,229,278,000"
9143,"Business combinations","Accounting for Acquisitions of Real Estate",448432,12/31/20,03/12/21,2,"Ernst & Young LLP",,,,Denver,CO,COLORADO,"US West",10-K,2021-03-12,,"APARTMENT INVESTMENT & MANAGEMENT CO",922864,"=""AIV""","4582 SOUTH ULSTER STREET","SUITE 1450",DENVER,CO,COLORADO,"US West",,,"=""6798""","Real Estate Investment Trusts",525990,"Other Financial Vehicles",34,5,12/31/20,"786,911,488",12/31/20,"151,451,000","-5,041,000",,"1,840,492,000"
6932,"Other debt","Development Derivative Liability — Refer to Notes 4 and 10 to the financial statements.",443892,12/31/20,02/25/21,3,"Deloitte & Touche LLP",,,,Boston,MA,MASSACHUSETTS,"US New England",10-K,2021-02-25,,"Apellis Pharmaceuticals, Inc.",1492422,"=""APLS""","100 FIFTH AVENUE",,WALTHAM,MA,MASSACHUSETTS,"US New England",,,"=""2834""","Pharmaceutical Preparations",325412,"Pharmaceutical Preparation Manufacturing",34,57,12/31/20,"4,354,635,776",12/31/20,"250,646,000","-344,874,000",,"960,569,000"
4362,"Goodwill and intangible assets","Valuation of Goodwill for the LATAM, Nuuvera and Broken Coast Cash Generating Units and Indefinite lived Intangible Assets",430099,05/31/20,07/28/20,1,"PricewaterhouseCoopers LLP",191,"PricewaterhouseCoopers LLP Chartered Accountants",271,Toronto,A6,ONTARIO,Canada,40-F,2020-07-29,,"Aphria Inc.",1733418,,"245 TALBOT STREET W., SUITE 103",,LEAMINGTON,A6,ONTARIO,Canada,,,"=""2833""","Medicinal Chemicals and Botanical Products",325411,"Medicinal and Botanical Manufacturing",34,5,06/02/20,"1,129,451,008",05/31/20,"393,097,000","-61,231,000","601,623,000","1,807,581,000"
4363,Inventory,"Fair value less costs to sell inventory and biological assets",430099,05/31/20,07/28/20,1,"PricewaterhouseCoopers LLP",191,"PricewaterhouseCoopers LLP Chartered Accountants",271,Toronto,A6,ONTARIO,Canada,40-F,2020-07-29,,"Aphria Inc.",1733418,,"245 TALBOT STREET W., SUITE 103",,LEAMINGTON,A6,ONTARIO,Canada,,,"=""2833""","Medicinal Chemicals and Botanical Products",325411,"Medicinal and Botanical Manufacturing",34,5,06/02/20,"1,129,451,008",05/31/20,"393,097,000","-61,231,000","601,623,000","1,807,581,000"
9804,"Revenue from customer contracts","Total estimated costs for certain fixed price projects recognized over time",450051,12/31/20,03/24/21,4,"KPMG LLP",,,,Minneapolis,MN,MINNESOTA,"US Midwest",10-K,2021-03-24,,"APi Group Corp",1796209,"=""APG""","C/O API GROUP, INC.","1100 OLD HIGHWAY 8 NW","NEW BRIGHTON",MN,MINNESOTA,"US Midwest",,,"=""7340""","Services-To Dwellings & Other Buildings",238910,"Site Preparation Contractors",34,18,12/31/20,"3,049,200,128",12/31/20,"3,587,000,000","-153,000,000","-467,000,000","4,065,000,000"
9805,"Business combinations","Fair value measurement of certain acquired intangible assets",450051,12/31/20,03/24/21,4,"KPMG LLP",,,,Minneapolis,MN,MINNESOTA,"US Midwest",10-K,2021-03-24,,"APi Group Corp",1796209,"=""APG""","C/O API GROUP, INC.","1100 OLD HIGHWAY 8 NW","NEW BRIGHTON",MN,MINNESOTA,"US Midwest",,,"=""7340""","Services-To Dwellings & Other Buildings",238910,"Site Preparation Contractors",34,18,12/31/20,"3,049,200,128",12/31/20,"3,587,000,000","-153,000,000","-467,000,000","4,065,000,000"
9806,Goodwill,"Fair value of certain reporting units subject to the goodwill impairment test",450051,12/31/20,03/24/21,4,"KPMG LLP",,,,Minneapolis,MN,MINNESOTA,"US Midwest",10-K,2021-03-24,,"APi Group Corp",1796209,"=""APG""","C/O API GROUP, INC.","1100 OLD HIGHWAY 8 NW","NEW BRIGHTON",MN,MINNESOTA,"US Midwest",,,"=""7340""","Services-To Dwellings & Other Buildings",238910,"Site Preparation Contractors",34,18,12/31/20,"3,049,200,128",12/31/20,"3,587,000,000","-153,000,000","-467,000,000","4,065,000,000"
3892,"Revenue from customer contracts","Net Sales - Revenue Recognition for Long-Term Contracts in the Architectural Services Segment - Refer to Notes 1, 3, and 16 to the consolidated financial statements",425216,02/29/20,04/24/20,3,"Deloitte & Touche LLP",,,,Minneapolis,MN,MINNESOTA,"US Midwest",10-K,2020-04-24,,"APOGEE ENTERPRISES, INC.",6845,"=""APOG""","4400 WEST 78TH STREET","SUITE 520",MINNEAPOLIS,MN,MINNESOTA,"US Midwest",,,"=""3231""","Glass Products, Made of Purchased Glass",327215,"Glass Product Manufacturing Made of Purchased Glass",34,30,02/29/20,"798,319,168",02/29/20,"1,387,439,000","61,914,000","191,071,000","1,128,991,000"
3893,Goodwill,"Goodwill - Sotawall and Alumicor Reporting Units - Refer to Notes 1 and 7 to the financial statements",425216,02/29/20,04/24/20,3,"Deloitte & Touche LLP",,,,Minneapolis,MN,MINNESOTA,"US Midwest",10-K,2020-04-24,,"APOGEE ENTERPRISES, INC.",6845,"=""APOG""","4400 WEST 78TH STREET","SUITE 520",MINNEAPOLIS,MN,MINNESOTA,"US Midwest",,,"=""3231""","Glass Products, Made of Purchased Glass",327215,"Glass Product Manufacturing Made of Purchased Glass",34,30,02/29/20,"798,319,168",02/29/20,"1,387,439,000","61,914,000","191,071,000","1,128,991,000"
5847,"Other revenue","Performance Allocations - Refer to Note 2 in the consolidated financial statements",442767,12/31/20,02/19/21,3,"Deloitte & Touche LLP",,,,"New York",NY,"NEW YORK","US Mid Atlantic",10-K,2021-02-19,,"Apollo Asset Management, Inc.",1411494,,"9 WEST 57TH STREET, 42ND FLOOR",,"new York",NY,"NEW YORK","US Mid Atlantic",1858681,"Apollo Global Management, Inc.","=""6282""","Investment Advice",541611,"Administrative Management and General Management Consulting Services",34,48,12/29/20,"10,999,176,192",12/31/20,"2,220,780,000","156,614,000","2,095,059,000","23,669,084,000"
5111,"Allowance for credit losses","Current Expected Credit Losses (“CECL”) Allowance—Estimation of Economic Conditions—Refer to Notes 2 and 4 to the Financial Statements",441439,12/31/20,02/10/21,3,"Deloitte & Touche LLP",,,,"New York",NY,"NEW YORK","US Mid Atlantic",10-K,2021-02-10,,"Apollo Commercial Real Estate Finance, Inc.",1467760,"=""ARI""","C/O APOLLO GLOBAL MANAGEMENT, LLC","9 WEST 57TH STREET, 43RD FLOOR","NEW YORK",NY,"NEW YORK","US Mid Atlantic",,,"=""6798""","Real Estate Investment Trusts",525990,"Other Financial Vehicles",34,11,12/31/20,"1,555,934,848",12/31/20,"210,576,000","18,377,000",,"6,940,020,000"
5112,"Allowance for credit losses","CECL Allowance—Estimation of Fair Value of Underlying Collateral of Loans Exhibiting Signs of Financial Difficulty — Refer to Notes 2 and 4 to the financial statements",441439,12/31/20,02/10/21,3,"Deloitte & Touche LLP",,,,"New York",NY,"NEW YORK","US Mid Atlantic",10-K,2021-02-10,,"Apollo Commercial Real Estate Finance, Inc.",1467760,"=""ARI""","C/O APOLLO GLOBAL MANAGEMENT, LLC","9 WEST 57TH STREET, 43RD FLOOR","NEW YORK",NY,"NEW YORK","US Mid Atlantic",,,"=""6798""","Real Estate Investment Trusts",525990,"Other Financial Vehicles",34,11,12/31/20,"1,555,934,848",12/31/20,"210,576,000","18,377,000",,"6,940,020,000"
6905,"Regulatory assets and liabilities","Accounting for the Effects of Cost-Based Regulation",443791,12/31/20,02/25/21,1,"PricewaterhouseCoopers LLP",,,,Columbus,OH,OHIO,"US Midwest",10-K,2021-02-25,,"APPALACHIAN POWER CO",6879,,"1 RIVERSIDE PLAZA",,COLUMBUS,OH,OHIO,"US Midwest",4904,"AMERICAN ELECTRIC POWER CO INC","=""4911""","Electric Services",221122,"Electric Power Distribution",34,,,,12/31/20,"2,796,200,000","369,700,000",,"13,315,200,000"
7643,"Uncertain tax positions","Uncertain Tax Positions",445410,12/31/20,03/01/21,1,"PricewaterhouseCoopers LLP",,,,"Los Angeles",CA,CALIFORNIA,"US West",10-K,2021-03-01,,"APPFOLIO INC",1433195,"=""APPF""","70 CASTILIAN DRIVE",,"SANTA BARBARA",CA,CALIFORNIA,"US West",,,"=""7372""","Prepackaged Software",511210,"Software Publishers",34,180,12/31/20,"3,371,969,280",12/31/20,"310,056,000","158,403,000","177,957,000","389,480,000"
6240,"Real estate investments","Investments in Real Estate – Indicators of impairment",443174,12/31/20,02/23/21,2,"Ernst & Young LLP",,,,Richmond,VA,VIRGINIA,"US Mid Atlantic",10-K,2021-02-23,,"Apple Hospitality REIT, Inc.",1418121,"=""APLE""","814 EAST MAIN STREET",,RICHMOND,VA,VIRGINIA,"US Mid Atlantic",,,"=""6798""","Real Estate Investment Trusts",525990,"Other Financial Vehicles",34,13,12/31/20,"2,881,671,424",12/31/20,"601,879,000","-173,207,000",,"4,829,759,000"
4597,"Uncertain tax positions","Uncertain Tax Positions",434747,09/26/20,10/29/20,2,"Ernst & Young LLP",,,,"San Jose",CA,CALIFORNIA,"US West",10-K,2020-10-30,,"Apple Inc.",320193,"=""AAPL""","ONE APPLE PARK WAY",,CUPERTINO,CA,CALIFORNIA,"US West",,,"=""3571""","Electronic Computers",334111,"Electronic Computer Manufacturing",34,116,09/30/20,"1,966,078,951,424",09/26/20,"274,515,000,000","57,411,000,000",,"323,888,000,000"
4436,Goodwill,"Goodwill - FCX and Canada Reporting Units - Refer to Note 5 to the financial statements",430850,06/30/20,08/14/20,3,"Deloitte & Touche LLP",,,,Cleveland,OH,OHIO,"US Midwest",10-K,2020-08-14,,"APPLIED INDUSTRIAL TECHNOLOGIES INC",109563,"=""AIT""","ONE APPLIED PLAZA",,CLEVELAND,OH,OHIO,"US Midwest",,,"=""5080""","Wholesale-Machinery, Equipment & Supplies",423830,"Industrial Machinery and Equipment Merchant Wholesalers",34,62,06/30/20,"2,415,116,800",06/30/20,"3,245,652,000","24,042,000","-40,267,000","2,283,551,000"
4832,Inventory,"Evaluation of net realizable value adjustments to inventories for excess or obsolescence",437158,10/25/20,12/11/20,4,"KPMG LLP",,,,"Santa Clara",CA,CALIFORNIA,"US West",10-K,2020-12-11,,"APPLIED MATERIALS INC /DE",6951,"=""AMAT""","3050 BOWERS AVE",,"SANTA CLARA",CA,CALIFORNIA,"US West",,,"=""3674""","Semiconductors and Related Devices",333295,"Semiconductor Machinery Manufacturing",34,59,10/31/20,"54,136,221,696",10/25/20,"17,202,000,000","3,619,000,000","6,959,000,000","22,353,000,000"
5943,Goodwill,"Goodwill Impairment Assessment - Beauty + Home and Active Packaging Reporting Units",442552,12/31/20,02/19/21,1,"PricewaterhouseCoopers LLP",,,,Chicago,IL,ILLINOIS,"US Midwest",10-K,2021-02-19,,"APTARGROUP, INC.",896622,"=""ATR""","265 EXCHANGE DRIVE","SUITE 301","CRYSTAL LAKE",IL,ILLINOIS,"US Midwest",,,"=""3089""","Plastics Products, NEC",326199,"All Other Plastics Product Manufacturing",34,137,12/31/20,"8,897,850,368",12/31/20,"2,929,340,000","214,040,000","607,559,000","3,990,053,000"
5021,"Uncertain tax positions","Uncertain Tax Positions",441195,12/31/20,02/08/21,2,"Ernst & Young LLP",,,,Detroit,MI,MICHIGAN,"US Midwest",10-K,2021-02-08,,"Aptiv PLC",1521332,"=""APTV""","SPITALSTRASSE 5",,SCHAFFHAUSEN,V8,SWITZERLAND,Foreign,,,"=""3714""","Motor Vehicle Parts and Accessories",423120,"Motor Vehicle Supplies and New Parts Merchant Wholesalers",34,130,12/31/20,"35,181,604,864",12/31/20,"13,066,000,000","1,804,000,000","4,234,000,000","17,522,000,000"
5022,"Revenue from customer contracts","Revenue Recognition",441195,12/31/20,02/08/21,2,"Ernst & Young LLP",,,,Detroit,MI,MICHIGAN,"US Midwest",10-K,2021-02-08,,"Aptiv PLC",1521332,"=""APTV""","SPITALSTRASSE 5",,SCHAFFHAUSEN,V8,SWITZERLAND,Foreign,,,"=""3714""","Motor Vehicle Parts and Accessories",423120,"Motor Vehicle Supplies and New Parts Merchant Wholesalers",34,130,12/31/20,"35,181,604,864",12/31/20,"13,066,000,000","1,804,000,000","4,234,000,000","17,522,000,000"
5023,"Equity investments and joint ventures","Autonomous Driving Joint Venture",441195,12/31/20,02/08/21,2,"Ernst & Young LLP",,,,Detroit,MI,MICHIGAN,"US Midwest",10-K,2021-02-08,,"Aptiv PLC",1521332,"=""APTV""","SPITALSTRASSE 5",,SCHAFFHAUSEN,V8,SWITZERLAND,Foreign,,,"=""3714""","Motor Vehicle Parts and Accessories",423120,"Motor Vehicle Supplies and New Parts Merchant Wholesalers",34,130,12/31/20,"35,181,604,864",12/31/20,"13,066,000,000","1,804,000,000","4,234,000,000","17,522,000,000"
9743,"Research and development expenses","Evaluation of Research and Development Prepaid and Accrued Costs",450033,12/31/20,03/23/21,4,"KPMG LLP",187,"KPMG LLP Chartered Accountants",85,Vaughan,A6,ONTARIO,Canada,10-K,2021-03-23,,"Aptose Biosciences Inc.",882361,"=""APTOF""","66 WELLINGTON STREET WEST, SUITE 5300","TD BANK TOWER BOX 48",TORONTO,A6,ONTARIO,Canada,,,"=""2836""","Biological Products, Except Diagnostic Substances",325414,"Biological Product (except Diagnostic) Manufacturing",34,4,12/31/20,"389,302,016",12/31/20,,"-55,238,000",,"126,262,000"
4746,Goodwill,"Impairment of goodwill recorded in one reporting unit in the FSS International segment",436116,10/02/20,11/24/20,4,"KPMG LLP",,,,Philadelphia,PA,PENNSYLVANIA,"US Mid Atlantic",10-K,2020-11-24,,Aramark,1584509,"=""ARMK""","2400 MARKET STREET",,PHILADELPHIA,PA,PENNSYLVANIA,"US Mid Atlantic",,,"=""5812""","Eating and Drinking Places",722310,"Food Service Contractors",34,26,09/30/20,"6,691,205,120",10/02/20,"12,829,559,000","-461,529,000","-4,530,489,000","15,712,684,000"
11071,"Property, plant and equipment","Valuation of Biological Assets",453021,12/31/20,04/15/21,1,"PricewaterhouseCoopers LLP",644,"PricewaterhouseCoopers Consultores Auditores SpA",1364,Santiago,F3,CHILE,Foreign,20-F,2021-04-16,,"ARAUCO & CONSTITUTION PULP INC",1004156,,"EL GOLF NO 150","14TH FL.",SANTIAGO,F3,CHILE,Foreign,,,"=""2611""","Pulp Mills",322110,"Pulp Mills",34,,,,12/31/20,"4,732,869,000","25,305,000","7,253,978,000","16,028,319,000"
5871,"Other investments","Valuation of Mortgage Servicing Rights",442615,12/31/20,02/19/21,2,"Ernst & Young LLP",,,,"New York",NY,"NEW YORK","US Mid Atlantic",10-K,2021-02-19,,"ARBOR REALTY TRUST INC",1253986,"=""ABR""","333 EARLE OVINGTON BOULEVARD","SUITE 900",UNIONDALE,NY,"NEW YORK","US Mid Atlantic",,,"=""6798""","Real Estate Investment Trusts",525990,"Other Financial Vehicles",34,14,12/31/20,"1,746,708,992",12/31/20,"264,259,000","170,949,000","1,238,920,000","7,660,986,000"
5872,"Allowance for credit losses","Allowance for Credit Losses",442615,12/31/20,02/19/21,2,"Ernst & Young LLP",,,,"New York",NY,"NEW YORK","US Mid Atlantic",10-K,2021-02-19,,"ARBOR REALTY TRUST INC",1253986,"=""ABR""","333 EARLE OVINGTON BOULEVARD","SUITE 900",UNIONDALE,NY,"NEW YORK","US Mid Atlantic",,,"=""6798""","Real Estate Investment Trusts",525990,"Other Financial Vehicles",34,14,12/31/20,"1,746,708,992",12/31/20,"264,259,000","170,949,000","1,238,920,000","7,660,986,000"
8409,"Other contingent liabilities","Valuation of contingent consideration liability",446240,12/31/20,03/04/21,2,"Ernst & Young LLP",,,,Philadelphia,PA,PENNSYLVANIA,"US Mid Atlantic",10-K,2021-03-04,,"Arbutus Biopharma Corp",1447028,"=""ABUS""","701 VETERANS CIRCLE",,WARMINSTER,PA,PENNSYLVANIA,"US Mid Atlantic",,,"=""2834""","Pharmaceutical Preparations",541710,"Research and Development in the Physical, Engineering, and Life Sciences",34,4,12/31/20,"318,359,456",12/31/20,"6,914,000","-63,745,000",,"137,080,000"
10344,Inventory,"GoodWheat and GoodHemp Inventory Valuation – Refer to Note 4 to the Consolidated Financial Statements",451607,12/31/20,03/31/21,3,"Deloitte & Touche LLP",,,,Phoenix,AZ,ARIZONA,"US Southwest",10-K,2021-03-31,,"Arcadia Biosciences, Inc.",1469443,"=""RKDA""","5956 SHERRY LANE","SUITE 2000",DALLAS,TX,TEXAS,"US Southwest",,,"=""1311""","Crude Petroleum and Natural Gas",541710,"Research and Development in the Physical, Engineering, and Life Sciences",34,3,12/31/20,"34,030,624",12/31/20,"8,034,000","-4,655,000","26,947,000","47,348,000"
7403,"Other contingent liabilities","Self-insurance reserves",444905,12/31/20,02/26/21,2,"Ernst & Young LLP",,,,Tulsa,OK,OKLAHOMA,"US Southwest",10-K,2021-02-26,,"ARCBEST CORP /DE/",894405,"=""ARCB""","8401 MCCLURE DRIVE",,"FORT SMITH",AR,ARKANSAS,"US Southeast",,,"=""4213""","Trucking, Except Local",484122,"General Freight Trucking, Long-Distance, Less Than Truckload",34,43,12/31/20,"1,083,321,728",12/31/20,"2,940,163,000","71,100,000","685,292,000","1,779,008,000"
7404,"Goodwill and intangible assets","Impairment analysis of goodwill and indefinite-lived intangible assets",444905,12/31/20,02/26/21,2,"Ernst & Young LLP",,,,Tulsa,OK,OKLAHOMA,"US Southwest",10-K,2021-02-26,,"ARCBEST CORP /DE/",894405,"=""ARCB""","8401 MCCLURE DRIVE",,"FORT SMITH",AR,ARKANSAS,"US Southeast",,,"=""4213""","Trucking, Except Local",484122,"General Freight Trucking, Long-Distance, Less Than Truckload",34,43,12/31/20,"1,083,321,728",12/31/20,"2,940,163,000","71,100,000","685,292,000","1,779,008,000"
8685,"Long-lived assets","Goodwill and Property, Plant and Equipment – Refer to Note 5.3 to the Consolidated Financial Statements",447229,12/31/20,03/08/21,3,"Deloitte & Touche LLP",406,"Deloitte Audit",1287,Luxembourg,N4,LUXEMBOURG,Foreign,20-F,2021-03-08,,ArcelorMittal,1243429,"=""MT""","24-26, BOULEVARD D?AVRANCHES","L-1160 LUXEMBOURG",LUXEMBOURG,N4,LUXEMBOURG,Foreign,,,"=""3312""","Steel Works, Blast Furnaces (Including Coke Ovens), and Rolling Mills",331111,"Iron and Steel Mills",34,23,12/29/20,"23,257,585,664",12/31/20,"53,270,000,000","-578,000,000","33,968,000,000","82,052,000,000"
8686,"Deferred income taxes","Deferred Tax Assets - Refer to Note 10.4 to the Consolidated Financial Statements",447229,12/31/20,03/08/21,3,"Deloitte & Touche LLP",406,"Deloitte Audit",1287,Luxembourg,N4,LUXEMBOURG,Foreign,20-F,2021-03-08,,ArcelorMittal,1243429,"=""MT""","24-26, BOULEVARD D?AVRANCHES","L-1160 LUXEMBOURG",LUXEMBOURG,N4,LUXEMBOURG,Foreign,,,"=""3312""","Steel Works, Blast Furnaces (Including Coke Ovens), and Rolling Mills",331111,"Iron and Steel Mills",34,23,12/29/20,"23,257,585,664",12/31/20,"53,270,000,000","-578,000,000","33,968,000,000","82,052,000,000"
12510,"Long-lived assets","Goodwill and Property, Plant and Equipment – Refer to Note 5.3 to the Consolidated Financial Statements",461381,12/31/20,03/08/21,3,"Deloitte & Touche LLP",406,"Deloitte Audit",1287,Luxembourg,N4,LUXEMBOURG,Foreign,6-K,2021-07-30,,ArcelorMittal,1243429,"=""MT""","24-26, BOULEVARD D?AVRANCHES","L-1160 LUXEMBOURG",LUXEMBOURG,N4,LUXEMBOURG,Foreign,,,"=""3312""","Steel Works, Blast Furnaces (Including Coke Ovens), and Rolling Mills",331111,"Iron and Steel Mills",34,23,12/29/20,"23,257,585,664",12/31/20,"53,270,000,000","-578,000,000","33,968,000,000","82,052,000,000"
12511,"Deferred income taxes","Deferred Tax Assets - Refer to Note 10.4 to the Consolidated Financial Statements",461381,12/31/20,03/08/21,3,"Deloitte & Touche LLP",406,"Deloitte Audit",1287,Luxembourg,N4,LUXEMBOURG,Foreign,6-K,2021-07-30,,ArcelorMittal,1243429,"=""MT""","24-26, BOULEVARD D?AVRANCHES","L-1160 LUXEMBOURG",LUXEMBOURG,N4,LUXEMBOURG,Foreign,,,"=""3312""","Steel Works, Blast Furnaces (Including Coke Ovens), and Rolling Mills",331111,"Iron and Steel Mills",34,23,12/29/20,"23,257,585,664",12/31/20,"53,270,000,000","-578,000,000","33,968,000,000","82,052,000,000"
7505,"Other contingent liabilities","Valuation of Reserve for Losses and Loss Adjustment Expenses",444218,12/31/20,02/26/21,1,"PricewaterhouseCoopers LLP",,,,"New York",NY,"NEW YORK","US Mid Atlantic",10-K,2021-02-26,,"ARCH CAPITAL GROUP LTD.",947484,"=""ACGL""","WATERLOO HOUSE, GROUND FLOOR","100 PITTS BAY ROAD",PEMBROKE,D0,BERMUDA,Foreign,,,"=""6331""","Fire, Marine, and Casualty Insurance",524130,"Reinsurance Carriers",34,36,12/31/20,"14,670,413,824",12/31/20,"8,525,275,000","1,405,521,000","12,471,571,000","43,282,297,000"
5287,"Asset retirement and environmental obligations","Asset Retirement Obligation (ARO) Liability",441751,12/31/20,02/12/21,2,"Ernst & Young LLP",,,,"Saint Louis",MO,MISSOURI,"US Southeast",10-K,2021-02-12,,"ARCH RESOURCES, INC.",1037676,,"CITY PLACE ONE STE 300","ARCH MINERAL CORP","ST LOUIS",MO,MISSOURI,"US Southeast",,,"=""1221""","Bituminous Coal and Lignite Surface Mining",212111,"Bituminous Coal and Lignite Surface Mining",34,44,12/31/20,"666,835,968",12/31/20,"1,467,592,000","-344,615,000",,"1,722,472,000"
5673,Inventory,"Fair Value Measurements over Inventory and Commodity Derivatives",442254,12/31/20,02/18/21,2,"Ernst & Young LLP",,,,"Saint Louis",MO,MISSOURI,"US Southeast",10-K,2021-02-18,,"Archer-Daniels-Midland Co",7084,"=""ADM""","77 W. WACKER DR.",,CHICAGO,IL,ILLINOIS,"US Midwest",,,"=""2070""","Fats & Oils",311222,"Soybean Processing",34,49,12/29/20,"27,513,438,208",12/31/20,"64,355,000,000","1,772,000,000","14,661,000,000","49,719,000,000"
6124,"Long-lived assets","Long-Lived Asset Impairment - Refer to Note 18 to the financial statements.",443064,12/31/20,02/22/21,3,"Deloitte & Touche LLP",,,,Houston,TX,TEXAS,"US Southwest",10-K,2021-02-23,,"Archrock, Inc.",1389050,"=""AROC""","16666 NORTHCHASE DRIVE","STE 100",HOUSTON,TX,TEXAS,"US Southwest",,,"=""4922""","Natural Gas Transmission",213112,"Support Activities for Oil and Gas Operations",34,9,12/31/20,"1,324,652,544",12/31/20,"874,970,000","-68,445,000","874,026,000","2,779,722,000"
10662,"Business combinations","Business combinations - fair value of net assets acquired",451701,12/31/20,03/31/21,2,"Ernst & Young LLP",34,"Ernst & Young Auditores Independentes SS",1448,Fortaleza,D5,BRAZIL,Foreign,20-F,2021-04-01,,"Arco Platform Ltd.",1740594,,"RUA AUGUSTA 2840","9TH FLOOR, SUITE 91","SAO PAULO - SP",D5,BRAZIL,Foreign,,,"=""8200""","Services-Educational Services",611710,"Educational Support Services",34,36,12/29/20,"978,433,664",12/31/20,"192,852,000","3,231,000","-67,142,000","881,037,000"
10663,Goodwill,"Goodwill impairment test",451701,12/31/20,03/31/21,2,"Ernst & Young LLP",34,"Ernst & Young Auditores Independentes SS",1448,Fortaleza,D5,BRAZIL,Foreign,20-F,2021-04-01,,"Arco Platform Ltd.",1740594,,"RUA AUGUSTA 2840","9TH FLOOR, SUITE 91","SAO PAULO - SP",D5,BRAZIL,Foreign,,,"=""8200""","Services-Educational Services",611710,"Educational Support Services",34,36,12/29/20,"978,433,664",12/31/20,"192,852,000","3,231,000","-67,142,000","881,037,000"
10664,"Business combinations","Accounts payable to selling shareholders",451701,12/31/20,03/31/21,2,"Ernst & Young LLP",34,"Ernst & Young Auditores Independentes SS",1448,Fortaleza,D5,BRAZIL,Foreign,20-F,2021-04-01,,"Arco Platform Ltd.",1740594,,"RUA AUGUSTA 2840","9TH FLOOR, SUITE 91","SAO PAULO - SP",D5,BRAZIL,Foreign,,,"=""8200""","Services-Educational Services",611710,"Educational Support Services",34,36,12/29/20,"978,433,664",12/31/20,"192,852,000","3,231,000","-67,142,000","881,037,000"
6193,Goodwill,"Goodwill Impairment Assessment - Extrusions Reporting Unit",443155,12/31/20,02/23/21,1,"PricewaterhouseCoopers LLP",,,,Pittsburgh,PA,PENNSYLVANIA,"US Mid Atlantic",10-K,2021-02-23,,"Arconic Corp",1790982,,"201 ISABELLA STREET",,PITTSBURGH,PA,PENNSYLVANIA,"US Mid Atlantic",,,"=""3350""","Rolling Drawing & Extruding of Nonferrous Metals",331315,"Aluminum Sheet, Plate, and Foil Manufacturing",34,30,12/31/20,"3,254,315,735",12/31/20,"5,675,000,000","-109,000,000","1,447,000,000","6,314,000,000"
9492,"Long-lived assets","Impairment of long-lived assets for markets with impairment indicators",449198,12/31/20,03/17/21,2,"Ernst & Young LLP",134,"Pistrelli Henry Martin y Asociados SRL (Inactive)",1449,"Buenos Aires",C1,ARGENTINA,Foreign,6-K,2021-03-17,,"Arcos Dorados Holdings Inc.",1508478,"=""ARCO""","RIO NEGRO 1338, FIRST FLOOR",,MONTEVIDEO,X3,URUGUAY,Foreign,,,"=""5812""","Eating and Drinking Places",722211,"Limited-Service Restaurants",34,5,12/29/20,"601,739,648",12/31/20,"1,984,219,000","-149,451,000","160,500,000","2,293,954,000"
9493,"Other contingent liabilities","Tax and labor contingencies",449198,12/31/20,03/17/21,2,"Ernst & Young LLP",134,"Pistrelli Henry Martin y Asociados SRL (Inactive)",1449,"Buenos Aires",C1,ARGENTINA,Foreign,6-K,2021-03-17,,"Arcos Dorados Holdings Inc.",1508478,"=""ARCO""","RIO NEGRO 1338, FIRST FLOOR",,MONTEVIDEO,X3,URUGUAY,Foreign,,,"=""5812""","Eating and Drinking Places",722211,"Limited-Service Restaurants",34,5,12/29/20,"601,739,648",12/31/20,"1,984,219,000","-149,451,000","160,500,000","2,293,954,000"
11422,"Long-lived assets","Impairment of long-lived assets for markets with impairment indicators	",454825,12/31/20,03/17/21,2,"Ernst & Young LLP",134,"Pistrelli Henry Martin y Asociados SRL (Inactive)",1449,"Buenos Aires",C1,ARGENTINA,Foreign,20-F,2021-04-29,,"Arcos Dorados Holdings Inc.",1508478,"=""ARCO""","RIO NEGRO 1338, FIRST FLOOR",,MONTEVIDEO,X3,URUGUAY,Foreign,,,"=""5812""","Eating and Drinking Places",722211,"Limited-Service Restaurants",34,5,12/29/20,"601,739,648",12/31/20,"1,984,219,000","-149,451,000","160,500,000","2,293,954,000"
11423,"Other contingent liabilities","Tax and labor contingencies",454825,12/31/20,03/17/21,2,"Ernst & Young LLP",134,"Pistrelli Henry Martin y Asociados SRL (Inactive)",1449,"Buenos Aires",C1,ARGENTINA,Foreign,20-F,2021-04-29,,"Arcos Dorados Holdings Inc.",1508478,"=""ARCO""","RIO NEGRO 1338, FIRST FLOOR",,MONTEVIDEO,X3,URUGUAY,Foreign,,,"=""5812""","Eating and Drinking Places",722211,"Limited-Service Restaurants",34,5,12/29/20,"601,739,648",12/31/20,"1,984,219,000","-149,451,000","160,500,000","2,293,954,000"
6974,Goodwill,"Valuation of Goodwill",443596,12/31/20,02/25/21,2,"Ernst & Young LLP",,,,Dallas,TX,TEXAS,"US Southwest",10-K,2021-02-25,,"Arcosa, Inc.",1739445,"=""ACA""","500 N. AKARD SREET","SUITE 400",DALLAS,TX,TEXAS,"US Southwest",,,"=""3440""","Fabricated Structural Metal Products",327992,"Ground or Treated Mineral and Earth Manufacturing",34,55,12/31/20,"2,647,625,984",12/31/20,"1,935,600,000","106,600,000","885,300,000","2,646,700,000"
6975,"Business combinations","Accounting for acquisitions",443596,12/31/20,02/25/21,2,"Ernst & Young LLP",,,,Dallas,TX,TEXAS,"US Southwest",10-K,2021-02-25,,"Arcosa, Inc.",1739445,"=""ACA""","500 N. AKARD SREET","SUITE 400",DALLAS,TX,TEXAS,"US Southwest",,,"=""3440""","Fabricated Structural Metal Products",327992,"Ground or Treated Mineral and Earth Manufacturing",34,55,12/31/20,"2,647,625,984",12/31/20,"1,935,600,000","106,600,000","885,300,000","2,646,700,000"
8037,"Research and development expenses","Accrued research and development expenses",445559,12/31/20,03/01/21,2,"Ernst & Young LLP",,,,"San Diego",CA,CALIFORNIA,"US West",10-K,2021-03-01,,"Arcturus Therapeutics Holdings Inc.",1768224,"=""ARCT""","10285 SCIENCE CENTER DRIVE",,"SAN DIEGO",CA,CALIFORNIA,"US West",,,"=""2834""","Pharmaceutical Preparations",325414,"Biological Product (except Diagnostic) Manufacturing",34,43,12/31/20,"1,136,208,896",12/31/20,"9,539,000","-72,148,000",,"476,456,000"
7074,"Revenue from customer contracts","Revenue recognition for license and collaboration agreement with Gilead Sciences, Inc.",443531,12/31/20,02/24/21,2,"Ernst & Young LLP",,,,"Redwood City",CA,CALIFORNIA,"US West",10-K,2021-02-25,,"Arcus Biosciences, Inc.",1724521,"=""RCUS""","3928 POINT EDEN WAY",,HAYWARD,CA,CALIFORNIA,"US West",,,"=""2834""","Pharmaceutical Preparations",325412,"Pharmaceutical Preparation Manufacturing",34,26,12/31/20,"1,690,377,216",12/31/20,"77,517,000","-122,858,000",,"772,292,000"
6406,Goodwill,"Goodwill Impairment Assessment for the Glass Packaging North America Cash Generating Unit",443580,12/31/20,02/24/21,1,"PricewaterhouseCoopers LLP",104,PricewaterhouseCoopers,1366,Dublin,L2,IRELAND,Foreign,6-K,2021-02-24,,"Ardagh Group S.A.",1689662,,"56 RUE CHARLES MARTEL",,LUXEMBOURG,N4,LUXEMBOURG,Foreign,,,"=""3221""","Glass Containers",332431,"Metal Can Manufacturing",34,17,12/29/20,"318,912,512",12/31/20,"6,731,000,000","35,000,000","-3,118,000,000","9,652,000,000"
8580,Goodwill,"Goodwill Impairment Assessment for the Glass Packaging North America Cash Generating Unit",447345,12/31/20,02/24/21,1,"PricewaterhouseCoopers LLP",104,PricewaterhouseCoopers,1366,Dublin,L2,IRELAND,Foreign,20-F,2021-03-08,,"Ardagh Group S.A.",1689662,,"56 RUE CHARLES MARTEL",,LUXEMBOURG,N4,LUXEMBOURG,Foreign,,,"=""3221""","Glass Containers",332431,"Metal Can Manufacturing",34,17,12/29/20,"318,912,512",12/31/20,"6,731,000,000","35,000,000","-3,118,000,000","9,652,000,000"
8673,"Other liabilities and provisions","Accrued clinical and contract manufacturing expenses",446800,12/31/20,03/08/21,2,"Ernst & Young LLP",,,,"Redwood City",CA,CALIFORNIA,"US West",10-K,2021-03-08,,"ARDELYX, INC.",1437402,"=""ARDX""","34175 ARDENWOOD BLVD.",,FREMONT,CA,CALIFORNIA,"US West",,,"=""2834""","Pharmaceutical Preparations",325412,"Pharmaceutical Preparation Manufacturing",34,6,12/31/20,"605,591,808",12/31/20,"7,571,000","-94,313,000",,"201,562,000"
8553,"Property, plant and equipment","Vessel Impairment – Future Charter Rates – Refer to Note 2 of the consolidated financial statements",446660,12/31/20,03/05/21,3,"Deloitte & Touche LLP",,,,"New York",NY,"NEW YORK","US Mid Atlantic",20-F,2021-03-05,,"Ardmore Shipping Corp",1577437,"=""ASC""","DORCHESTER HOUSE","7 CHURCH STREET",HAMILTON,D0,BERMUDA,Foreign,,,"=""4412""","Deep Sea Foreign Transportation of  Freight",483111,"Deep Sea Freight Transportation",34,3,12/29/20,"104,920,128",12/31/20,"220,058,000","-6,046,000",,"752,007,855"
6157,"Research and development expenses","Evaluation of the accrued clinical and preclinical study fees",443257,12/31/20,02/23/21,4,"KPMG LLP",,,,"San Diego",CA,CALIFORNIA,"US West",10-K,2021-02-23,,"ARENA PHARMACEUTICALS INC",1080709,,"6154 NANCY RIDGE DRIVE",,"SAN DIEGO",CA,CALIFORNIA,"US West",,,"=""2834""","Pharmaceutical Preparations",325412,"Pharmaceutical Preparation Manufacturing",34,77,12/31/20,"4,503,099,392",12/31/20,"319,000","-404,734,000",,"1,190,720,000"
5092,"Other investments","Fair value of investments",441411,12/31/20,02/10/21,4,"KPMG LLP",,,,"Los Angeles",CA,CALIFORNIA,"US West",10-K,2021-02-10,,"ARES CAPITAL CORP",1287750,"=""ARCC""","245 PARK AVENUE, 44TH FLOOR",,"NEW YORK",NY,"NEW YORK","US Mid Atlantic",,,,,525990,"Other Financial Vehicles",34,17,12/29/20,"7,040,884,736",12/31/20,"1,194,000,000","484,000,000",,"16,196,000,000"
5562,"Allowance for credit losses","Current expected credit losses",442107,12/31/20,02/17/21,2,"Ernst & Young LLP",,,,"Los Angeles",CA,CALIFORNIA,"US West",10-K,2021-02-18,,"Ares Commercial Real Estate Corp",1529377,"=""ACRE""","245 PARK AVENUE","42ND FLOOR","NEW YORK",NY,"NEW YORK","US Mid Atlantic",,,"=""6798""","Real Estate Investment Trusts",525990,"Other Financial Vehicles",34,12,12/31/20,"398,298,176",12/31/20,"13,593,000","21,840,000",,"137,882,000"
6961,"Equity investments and joint ventures","Valuation of underlying investments of equity method investments",443930,12/31/20,02/25/21,2,"Ernst & Young LLP",,,,"Los Angeles",CA,CALIFORNIA,"US West",10-K,2021-02-25,,"Ares Management Corp",1176948,"=""ARES""","1800 AVE OF THE STARS","SUITE 1400","LOS ANGELES",CA,CALIFORNIA,"US West",,,"=""6282""","Investment Advice",523930,"Investment Advice",34,47,12/31/20,"6,924,939,776",12/31/20,"1,452,822,000","152,142,000",,"15,168,992,000"
8628,"Business combinations","Evaluation of the estimated fair value of certain acquired tangible and intangible assets and liabilities in an asset acquisition",446639,12/31/20,03/05/21,4,"KPMG LLP",,,,Denver,CO,COLORADO,"US West",10-K,2021-03-05,,"Ares Real Estate Income Trust Inc.",1327978,"=""ZAREDX""","ONE TABOR CENTER","1200 SEVENTEENTH STREET, SUITE 2900",DENVER,CO,COLORADO,"US West",,,"=""6798""","Real Estate Investment Trusts",525990,"Other Financial Vehicles",34,,,,12/31/20,"186,592,000","-14,914,000",,"2,111,560,000"
8629,"Real estate investments","Assessment of the expected hold periods for investments in real estate properties",446639,12/31/20,03/05/21,4,"KPMG LLP",,,,Denver,CO,COLORADO,"US West",10-K,2021-03-05,,"Ares Real Estate Income Trust Inc.",1327978,"=""ZAREDX""","ONE TABOR CENTER","1200 SEVENTEENTH STREET, SUITE 2900",DENVER,CO,COLORADO,"US West",,,"=""6798""","Real Estate Investment Trusts",525990,"Other Financial Vehicles",34,,,,12/31/20,"186,592,000","-14,914,000",,"2,111,560,000"
10288,"Research and development expenses","Trade and Other Payables – research and development cost accruals — Refer to Note 15 to the financial statements",451209,12/31/20,03/30/21,3,"Deloitte & Touche LLP",21,"Deloitte Accountants BV",1243,Rotterdam,P7,NETHERLANDS,Foreign,20-F,2021-03-30,,"ARGENX SE",1697862,"=""ARGX""","INDUSTRIEPARK ZWIJNAARDE 7","BUILDING C B-9052",ZWIJNAARDE,C9,BELGIUM,Foreign,,,"=""2836""","Biological Products, Except Diagnostic Substances",325414,"Biological Product (except Diagnostic) Manufacturing",34,302,12/29/20,"12,927,237,120",12/31/20,"64,911,000","-608,455,000","1,506,707,000","2,279,407,000"
9285,"Other contingent liabilities","Reserves for losses and loss adjustment expenses",448707,12/31/20,03/12/21,2,"Ernst & Young LLP",,,,"San Antonio",TX,TEXAS,"US Southwest",10-K,2021-03-15,,"Argo Group International Holdings, Inc.",1091748,"=""ARGD""","501 7TH AVENUE, 7TH FLOOR",,"NEW YORK",NY,"NEW YORK","US Mid Atlantic",,,"=""6361""","Title Insurance",524126,"Direct Property and Casualty Insurance Carriers",34,44,12/31/20,"1,516,131,200",12/31/20,"1,889,600,000","-54,100,000","1,650,000,000","10,465,800,000"
5765,Inventory,"Inventory Valuation & Contract Manufacturer/Supplier Liabilities",442340,12/31/20,02/18/21,2,"Ernst & Young LLP",,,,"San Jose",CA,CALIFORNIA,"US West",10-K,2021-02-19,,"Arista Networks, Inc.",1596532,"=""ANET""","5453 GREAT AMERICA PARKWAY",,"SANTA CLARA",CA,CALIFORNIA,"US West",,,"=""3576""","Computer Communications Equipment",511210,"Software Publishers",34,291,12/31/20,"22,133,116,928",12/31/20,"2,317,512,000","634,557,000","3,007,805,000","4,738,919,000"
6356,"Regulatory assets and liabilities","Regulatory Accounting — Impact of Rate Regulation on the Financial Statements — Refer to Notes 1 and 4 to the Financial Statements.",443275,12/31/20,02/24/21,3,"Deloitte & Touche LLP",,,,Phoenix,AZ,ARIZONA,"US Southwest",10-K,2021-02-24,,"ARIZONA PUBLIC SERVICE CO",7286,,"400 NORTH FIFTH STREET",,PHOENIX,AZ,ARIZONA,"US Southwest",764622,"PINNACLE WEST CAPITAL CORP","=""4931""","Electric and Other Services Combined",221112,"Fossil Fuel Electric Power Generation",34,,,,12/31/20,"3,586,982,000","587,521,000","-299,689,000","1,158,903,000"
7225,"Other investments","Fair Value Measurement of Certain Mortgage Credit Securities and Mortgage Loans of the Consolidated VIE",444873,12/31/20,02/26/21,1,"PricewaterhouseCoopers LLP",,,,McLean,VA,VIRGINIA,"US Mid Atlantic",10-K,2021-02-26,,"Arlington Asset Investment Corp.",1209028,,"6862 ELM STREET","SUITE 320",MCLEAN,VA,VIRGINIA,"US Mid Atlantic",,,"=""6798""","Real Estate Investment Trusts",525990,"Other Financial Vehicles",34,24,12/29/20,"808,281,472",12/31/20,"23,098,000","-67,716,000",,"1,191,698,000"
6305,"Allowance for credit losses","Allowance for Loan Losses - Notes Receivable",443312,12/31/20,02/23/21,2,"Ernst & Young LLP",,,,Tysons,VA,VIRGINIA,"US Mid Atlantic",10-K,2021-02-24,,"Armada Hoffler Properties, Inc.",1569187,"=""AHH""","222 CENTRAL PARK AVENUE","SUITE 2100","VIRGINIA BEACH",VA,VIRGINIA,"US Mid Atlantic",,,"=""6500""","Real Estate",525990,"Other Financial Vehicles",34,11,12/31/20,"662,801,536",12/31/20,"383,634,000","29,152,000","465,045,000","1,916,971,000"
6306,"Revenue from customer contracts","General contracting revenue recognition",443312,12/31/20,02/23/21,2,"Ernst & Young LLP",,,,Tysons,VA,VIRGINIA,"US Mid Atlantic",10-K,2021-02-24,,"Armada Hoffler Properties, Inc.",1569187,"=""AHH""","222 CENTRAL PARK AVENUE","SUITE 2100","VIRGINIA BEACH",VA,VIRGINIA,"US Mid Atlantic",,,"=""6500""","Real Estate",525990,"Other Financial Vehicles",34,11,12/31/20,"662,801,536",12/31/20,"383,634,000","29,152,000","465,045,000","1,916,971,000"
6307,"Business combinations","Accounting for Acquisition of Operating Properties",443312,12/31/20,02/23/21,2,"Ernst & Young LLP",,,,Tysons,VA,VIRGINIA,"US Mid Atlantic",10-K,2021-02-24,,"Armada Hoffler Properties, Inc.",1569187,"=""AHH""","222 CENTRAL PARK AVENUE","SUITE 2100","VIRGINIA BEACH",VA,VIRGINIA,"US Mid Atlantic",,,"=""6500""","Real Estate",525990,"Other Financial Vehicles",34,11,12/31/20,"662,801,536",12/31/20,"383,634,000","29,152,000","465,045,000","1,916,971,000"
9528,"Other intangible assets","Valuation of in-process research and development intangible assets",449423,12/31/20,03/18/21,2,"Ernst & Young LLP",,,,"San Diego",CA,CALIFORNIA,"US West",10-K,2021-03-18,Yes,"Armata Pharmaceuticals, Inc.",921114,"=""ARMP""","5005 MCCONNELL AVE",,"LOS ANGELES",CA,CALIFORNIA,"US West",,,"=""2836""","Biological Products, Except Diagnostic Substances",325414,"Biological Product (except Diagnostic) Manufacturing",34,3,12/31/20,"55,691,612",12/31/20,"823,000","-22,181,000","5,111,000","39,516,000"
5508,"Other investments","Investment in Securities—Valuation—Refer to Notes 3 and 6 to the consolidated financial statements",442089,12/31/20,02/17/21,3,"Deloitte & Touche LLP",,,,Miami,FL,FLORIDA,"US Southeast",10-K,2021-02-17,,"Armour Residential REIT, Inc.",1428205,"=""ARR""","3001 OCEAN DRIVE","SUITE 201","VERO BEACH",FL,FLORIDA,"US Southeast",,,"=""6798""","Real Estate Investment Trusts",525990,"Other Financial Vehicles",34,11,12/31/20,"704,479,104",12/31/20,"-182,134,000","-215,111,000",,"5,524,486,000"
8133,"Long-lived assets","Valuation of North American long-lived tangible and intangible assets",445039,12/31/20,03/01/21,4,"KPMG LLP",,,,Philadelphia,PA,PENNSYLVANIA,"US Mid Atlantic",10-K,2021-03-01,,"Armstrong Flooring, Inc.",1655075,"=""AFIIQ""","1770 HEMPSTEAD ROAD","P.O. BOX 10068",LANCASTER,PA,PENNSYLVANIA,"US Mid Atlantic",,,"=""3089""","Plastics Products, NEC",321918,"Other Millwork (including Flooring)",34,4,12/29/20,"84,342,264",12/31/20,"584,800,000","-63,100,000","208,800,000","498,700,000"
8134,Inventory,"Net realizable value of inventory",445039,12/31/20,03/01/21,4,"KPMG LLP",,,,Philadelphia,PA,PENNSYLVANIA,"US Mid Atlantic",10-K,2021-03-01,,"Armstrong Flooring, Inc.",1655075,"=""AFIIQ""","1770 HEMPSTEAD ROAD","P.O. BOX 10068",LANCASTER,PA,PENNSYLVANIA,"US Mid Atlantic",,,"=""3089""","Plastics Products, NEC",321918,"Other Millwork (including Flooring)",34,4,12/29/20,"84,342,264",12/31/20,"584,800,000","-63,100,000","208,800,000","498,700,000"
6117,"Pension and other post-employment benefits","Pension and post retirement benefit obligations",443038,12/31/20,02/23/21,4,"KPMG LLP",,,,Philadelphia,PA,PENNSYLVANIA,"US Mid Atlantic",10-K,2021-02-23,,"ARMSTRONG WORLD INDUSTRIES INC",7431,"=""AWI""","2500 COLUMBIA AVE",,LANCASTER,PA,PENNSYLVANIA,"US Mid Atlantic",,,"=""3089""","Plastics Products, NEC",326199,"All Other Plastics Product Manufacturing",34,74,12/31/20,"3,564,309,248",12/31/20,"936,900,000","-99,100,000","-167,300,000","1,718,500,000"
6118,"Other contingent liabilities","Fair value of contingent consideration",443038,12/31/20,02/23/21,4,"KPMG LLP",,,,Philadelphia,PA,PENNSYLVANIA,"US Mid Atlantic",10-K,2021-02-23,,"ARMSTRONG WORLD INDUSTRIES INC",7431,"=""AWI""","2500 COLUMBIA AVE",,LANCASTER,PA,PENNSYLVANIA,"US Mid Atlantic",,,"=""3089""","Plastics Products, NEC",326199,"All Other Plastics Product Manufacturing",34,74,12/31/20,"3,564,309,248",12/31/20,"936,900,000","-99,100,000","-167,300,000","1,718,500,000"
5740,"Other intangible assets","Intangible Asset Impairment Assessment - Wireless Spectrum Licenses (UScellular Licenses)",442283,12/31/20,02/18/21,1,"PricewaterhouseCoopers LLP",,,,Chicago,IL,ILLINOIS,"US Midwest",10-K,2021-02-18,,"ARRAY DIGITAL INFRASTRUCTURE, INC.",821130,"=""AD""","500 WEST MADISON STREET","SUITE 810",CHICAGO,IL,ILLINOIS,"US Midwest",1051512,"TELEPHONE & DATA SYSTEMS INC /DE/","=""4812""","Radiotelephone Communications",517212,"Cellular and Other Wireless Telecommunications",34,31,12/31/20,"1,626,569,984",12/31/20,"4,037,000,000","229,000,000","1,792,000,000","9,681,000,000"
5945,"Sales return and allowances","Estimate of variable consideration for revenue recognition",442554,12/31/20,02/19/21,2,"Ernst & Young LLP",55,"Ernst & Young AB",1433,Stockholm,V7,SWEDEN,Foreign,10-K,2021-02-19,,"Arriver Holdco, Inc.",1733186,,"26545 AMERICAN DRIVE",,SOUTHFIELD,MI,MICHIGAN,"US Midwest",,,"=""3714""","Motor Vehicle Parts and Accessories",336322,"Other Motor Vehicle Electrical and Electronic Equipment Manufacturing",34,21,12/31/20,"2,364,300,032",12/31/20,"1,373,000,000","-545,000,000","901,000,000","2,288,000,000"
5946,Goodwill,"Estimate of reporting unit fair value for the goodwill impairment test",442554,12/31/20,02/19/21,2,"Ernst & Young LLP",55,"Ernst & Young AB",1433,Stockholm,V7,SWEDEN,Foreign,10-K,2021-02-19,,"Arriver Holdco, Inc.",1733186,,"26545 AMERICAN DRIVE",,SOUTHFIELD,MI,MICHIGAN,"US Midwest",,,"=""3714""","Motor Vehicle Parts and Accessories",336322,"Other Motor Vehicle Electrical and Electronic Equipment Manufacturing",34,21,12/31/20,"2,364,300,032",12/31/20,"1,373,000,000","-545,000,000","901,000,000","2,288,000,000"
5159,Inventory,"Evaluation of net realizable value adjustments to inventories for excess or obsolescence",441497,12/31/20,02/11/21,2,"Ernst & Young LLP",,,,Denver,CO,COLORADO,"US West",10-K,2021-02-11,,"ARROW ELECTRONICS, INC.",7536,"=""ARW""","7459 S LIMA STREET",,ENGLEWOOD,CO,COLORADO,"US West",,,"=""5065""","Electronic Parts and Equipment, NEC",423610,"Electrical Apparatus and Equipment, Wiring Supplies, and Related Equipment Merchant  Wholesalers",34,97,12/31/20,"7,282,224,128",12/31/20,"28,673,363,000","584,438,000","2,740,031,000","17,053,911,000"
5160,Goodwill,"Evaluation of Americas Components and eInfochips Goodwill for Impairment",441497,12/31/20,02/11/21,2,"Ernst & Young LLP",,,,Denver,CO,COLORADO,"US West",10-K,2021-02-11,,"ARROW ELECTRONICS, INC.",7536,"=""ARW""","7459 S LIMA STREET",,ENGLEWOOD,CO,COLORADO,"US West",,,"=""5065""","Electronic Parts and Equipment, NEC",423610,"Electrical Apparatus and Equipment, Wiring Supplies, and Related Equipment Merchant  Wholesalers",34,97,12/31/20,"7,282,224,128",12/31/20,"28,673,363,000","584,438,000","2,740,031,000","17,053,911,000"
8876,"Allowance for credit losses","Allowance for loan losses related to loans collectively evaluated for impairment",448008,12/31/20,03/10/21,4,"KPMG LLP",,,,Albany,NY,"NEW YORK","US Mid Atlantic",10-K,2021-03-10,,"ARROW FINANCIAL CORP",717538,"=""AROW""","250 GLEN ST",,"GLENS FALLS",NY,"NEW YORK","US Mid Atlantic",,,"=""6021""","National Commercial Banks",522110,"Commercial Banking",34,30,12/31/20,"464,043,712",12/31/20,"122,541,000","40,827,000","310,569,000","3,688,636,000"
5008,"Business combinations","Business acquisitions – Accounting for acquisitions",441142,12/31/20,02/05/21,2,"Ernst & Young LLP",,,,Chicago,IL,ILLINOIS,"US Midwest",10-K,2021-02-08,,"Arthur J. Gallagher & Co.",354190,"=""AJG""","2850 GOLF ROAD",,"ROLLING MEADOWS",IL,ILLINOIS,"US Midwest",,,"=""6411""","Insurance Agents, Brokers, and Service",524210,"Insurance Agencies and Brokerages",34,124,12/31/20,"23,962,626,048",12/31/20,"7,003,600,000","818,800,000","-2,340,700,000","22,331,400,000"
5009,"Revenue from customer contracts","Brokerage revenue recognition",441142,12/31/20,02/05/21,2,"Ernst & Young LLP",,,,Chicago,IL,ILLINOIS,"US Midwest",10-K,2021-02-08,,"Arthur J. Gallagher & Co.",354190,"=""AJG""","2850 GOLF ROAD",,"ROLLING MEADOWS",IL,ILLINOIS,"US Midwest",,,"=""6411""","Insurance Agents, Brokers, and Service",524210,"Insurance Agencies and Brokerages",34,124,12/31/20,"23,962,626,048",12/31/20,"7,003,600,000","818,800,000","-2,340,700,000","22,331,400,000"
6155,"Deferred income taxes","Income Taxes – Deferred Tax Assets and Amounts Payable Under Tax Receivable Agreements",443259,12/31/20,02/23/21,1,"PricewaterhouseCoopers LLP",,,,Chicago,IL,ILLINOIS,"US Midwest",10-K,2021-02-23,,"Artisan Partners Asset Management Inc.",1517302,"=""APAM""","875 E. WISCONSIN AVENUE","SUITE 800",MILWAUKEE,WI,WISCONSIN,"US Midwest",,,"=""6282""","Investment Advice",523120,"Securities Brokerage",34,50,12/31/20,"3,178,014,976",12/31/20,"888,763,000","217,291,000",,"1,151,962,000"
6085,"Deferred and capitalized costs","Deferred Preservation Costs",443063,12/31/20,02/22/21,2,"Ernst & Young LLP",,,,Atlanta,GA,GEORGIA,"US Southeast",10-K,2021-02-23,,"ARTIVION, INC.",784199,"=""AORT""","1655 ROBERTS BOULEVARD N W",,KENNESAW,GA,GEORGIA,"US Southeast",,,"=""3841""","Surgical and Medical Instruments and Apparatus",541710,"Research and Development in the Physical, Engineering, and Life Sciences",34,23,12/29/20,"888,280,960",12/31/20,"253,227,000","-16,682,000","-114,905,000","789,404,000"
6086,"Business combinations","Valuation of contingent consideration liability and acquired developed technology intangible asset - Ascyrus acquisition",443063,12/31/20,02/22/21,2,"Ernst & Young LLP",,,,Atlanta,GA,GEORGIA,"US Southeast",10-K,2021-02-23,,"ARTIVION, INC.",784199,"=""AORT""","1655 ROBERTS BOULEVARD N W",,KENNESAW,GA,GEORGIA,"US Southeast",,,"=""3841""","Surgical and Medical Instruments and Apparatus",541710,"Research and Development in the Physical, Engineering, and Life Sciences",34,23,12/29/20,"888,280,960",12/31/20,"253,227,000","-16,682,000","-114,905,000","789,404,000"
7818,"Research and development expenses","Prepaid and Accrued Research and Development - Refer to Note 2 in the Consolidated Financial Statements",445494,12/31/20,03/01/21,3,"Deloitte & Touche LLP",,,,Hartford,CT,CONNECTICUT,"US New England",10-K,2021-03-01,,"ARVINAS, INC.",1655759,"=""ARVN""","395 WINCHESTER AVE","5 SCIENCE PARK","NEW HAVEN",CT,CONNECTICUT,"US New England",,,"=""2834""","Pharmaceutical Preparations",325412,"Pharmaceutical Preparation Manufacturing",34,85,12/31/20,"4,115,346,176",12/31/20,"25,900,000","-119,300,000",,"717,368,587"
7754,"Business combinations","Fair Value Estimate of Manufacturer Franchise Rights in Acquisitions and Impairment Assessments	",445379,12/31/20,03/01/21,2,"Ernst & Young LLP",,,,Atlanta,GA,GEORGIA,"US Southeast",10-K,2021-03-01,,"ASBURY AUTOMOTIVE GROUP INC",1144980,"=""ABG""","6655 PEACHTREE DUNWOODY ROAD",,ATLANTA,GA,GEORGIA,"US Southeast",,,"=""5500""","Retail-Auto Dealers & Gasoline Stations",441110,"New Car Dealers",34,146,12/31/20,"2,810,647,552",12/31/20,"7,131,800,000","254,200,000","-81,900,000","3,676,300,000"
8810,"Research and development expenses","Prepayments, Trade Payables and Accrued Expenses - Clinical Trial Accruals — Refer to Notes 2 and 3 to the financial statements",448129,12/31/20,03/10/21,3,"Deloitte & Touche LLP",582,"Deloitte Statsautoriseret Revisionspartnerselskab",1294,Copenhagen,G7,DENMARK,Foreign,20-F,2021-03-10,,"Ascendis Pharma A/S",1612042,"=""ASND""","TUBORG BOULEVARD 12",,HELLERUP,G7,DENMARK,Foreign,,,"=""2834""","Pharmaceutical Preparations",325412,"Pharmaceutical Preparation Manufacturing",34,167,12/29/20,"7,994,440,192",12/31/20,"8,507,000","-512,615,000","1,019,215,000","1,198,832,000"
8719,"Business combinations","Earn-out liabilities",447865,12/31/20,03/09/21,4,"KPMG LLP",,,,Richmond,VA,VIRGINIA,"US Mid Atlantic",10-K,2021-03-09,,"ASCENT INDUSTRIES CO.",95953,"=""ACNT""","20 N. MARTINGALE RD","SUITE 430",SCHAUMBURG,IL,ILLINOIS,"US Midwest",,,"=""2800""","Chemicals & Allied Products",331210,"Iron and Steel Pipe and Tube Manufacturing from Purchased Steel",34,7,12/29/20,"64,216,272",12/31/20,"256,000,000","-27,267,000","67,514,000","206,984,000"
10699,Goodwill,"Goodwill - Packaging, Testing and Electronics Manufacturing Services (EMS) Segments - Refer to Notes 4, 5, 18 and 29 to the Consolidated Financial Statements",452130,12/31/20,04/01/21,3,"Deloitte & Touche LLP",28,"Deloitte & Touche",1060,Taipei,F5,TAIWAN,Foreign,20-F,2021-04-06,,"ASE Technology Holding Co., Ltd.",1122411,"=""ASX""","26, CHIN 3RD RD.","NANZIH DISTRICT",KAOHSIUNG,F5,TAIWAN,Foreign,,,"=""3674""","Semiconductors and Related Devices",334413,"Semiconductor and Related Device Manufacturing",34,6,12/31/20,"12,493,661,184",12/31/20,"16,975,540,000","1,019,713,000","4,787,849,000","20,769,339,000"
7882,"Goodwill and intangible assets","Goodwill and Identifiable Intangible Assets, net — Creative Circle Reporting Unit Goodwill and Trademark — Refer to Notes 2 and 6 to the financial statements",445395,12/31/20,03/01/21,3,"Deloitte & Touche LLP",,,,"Los Angeles",CA,CALIFORNIA,"US West",10-K,2021-03-01,,"ASGN Inc",890564,"=""ASGN""","4400 COX ROAD, SUITE 110",,"GLEN ALLEN",VA,VIRGINIA,"US Mid Atlantic",,,"=""7363""","Help Supply Services",561310,"Employment Placement Agencies",34,84,12/31/20,"4,418,737,152",12/31/20,"3,502,100,000","200,300,000","-519,200,000","3,278,000,000"
4731,"Asset retirement and environmental obligations","Valuation of Environmental Remediation Reserves",436010,09/30/20,11/23/20,2,"Ernst & Young LLP",,,,Cincinnati,OH,OHIO,"US Midwest",10-K,2020-11-23,,"ASHLAND INC.",1674862,"=""ASH""","8145 BLAZER DRIVE",,WILMINGTON,DE,DELAWARE,"US Mid Atlantic",,,"=""5160""","Wholesale-Chemicals & Allied Products",424690,"Other Chemical and Allied Products Merchant Wholesalers",34,71,09/30/20,"4,326,119,936",09/30/20,"2,326,000,000","-508,000,000","265,000,000","6,877,000,000"
4732,"Other contingent liabilities","Valuation of Asbestos Litigation Reserve",436010,09/30/20,11/23/20,2,"Ernst & Young LLP",,,,Cincinnati,OH,OHIO,"US Midwest",10-K,2020-11-23,,"ASHLAND INC.",1674862,"=""ASH""","8145 BLAZER DRIVE",,WILMINGTON,DE,DELAWARE,"US Mid Atlantic",,,"=""5160""","Wholesale-Chemicals & Allied Products",424690,"Other Chemical and Allied Products Merchant Wholesalers",34,71,09/30/20,"4,326,119,936",09/30/20,"2,326,000,000","-508,000,000","265,000,000","6,877,000,000"
4733,Goodwill,"Impairment Analyses of Goodwill of the Specialty Additives Reporting Unit",436010,09/30/20,11/23/20,2,"Ernst & Young LLP",,,,Cincinnati,OH,OHIO,"US Midwest",10-K,2020-11-23,,"ASHLAND INC.",1674862,"=""ASH""","8145 BLAZER DRIVE",,WILMINGTON,DE,DELAWARE,"US Mid Atlantic",,,"=""5160""","Wholesale-Chemicals & Allied Products",424690,"Other Chemical and Allied Products Merchant Wholesalers",34,71,09/30/20,"4,326,119,936",09/30/20,"2,326,000,000","-508,000,000","265,000,000","6,877,000,000"
11392,"Revenue from customer contracts","Revenue Recognition – Estimating Measure of Progress for Supply, Delivery and Installation (“SDI”) Contracts",454624,12/31/20,04/29/21,1,"PricewaterhouseCoopers LLP",331,"PricewaterhouseCoopers Taiwan",1345,Taipei,F5,TAIWAN,Foreign,20-F,2021-04-29,,"ASIA PACIFIC WIRE & CABLE CORP LTD",1026980,"=""APWC""","15/FL. B, NO. 77, SEC. 2,","DUNHUA SOUTH ROAD","TAIPEI, 106",F5,TAIWAN,Foreign,,,"=""3357""","Drawing and Insulating of Nonferrous Wire",332618,"Other Fabricated Wire Product Manufacturing",34,2,12/29/20,"29,159,502",12/31/20,"313,564,000","3,709,000","157,680,000","338,119,000"
5075,"Revenue from customer contracts","Complex revenue recognition due to the identification of distinct performance obligations and allocation of the total contract consideration.",441346,12/31/20,02/10/21,4,"KPMG LLP",76,"KPMG Accountants NV",1012,Rotterdam,P7,NETHERLANDS,Foreign,20-F,2021-02-10,,"ASML HOLDING NV",937966,"=""ASML""","DE RUN 6501",,"DR VELDHOVEN",P7,NETHERLANDS,Foreign,,,"=""3559""","Special  Industry Machinery, NEC",333295,"Semiconductor Machinery Manufacturing",34,484,12/29/20,"203,192,582,144",12/31/20,"17,103,500,000","4,348,200,000","10,017,700,000","33,363,200,000"
9022,Inventory,"Evaluation of net realizable value of certain inventories",448573,12/31/20,03/12/21,4,"KPMG LLP",,,,Hartford,CT,CONNECTICUT,"US New England",10-K,2021-03-12,,"ASPEN AEROGELS INC",1145986,"=""ASPN""","30 FORBES ROAD","BUILDING B",NORTHBOROUGH,MA,MASSACHUSETTS,"US New England",,,"=""5030""","Wholesale-Lumber & Other Construction Materials",541330,"Engineering Services",34,17,12/31/20,"464,343,936",12/31/20,"100,273,000","-21,569,000",,"97,424,000"
10791,"Insurance contract liabilities","Estimate of claims Incurred but not reported",452510,12/31/20,04/09/21,4,"KPMG LLP",87,"KPMG LLP",1118,London,X0,"UNITED KINGDOM",Foreign,20-F,2021-04-09,,"ASPEN INSURANCE HOLDINGS LTD",1267395,"=""AHL""","11 VICTORIA ST",,HAMILTON,D0,BERMUDA,Foreign,,,"=""6331""","Fire, Marine, and Casualty Insurance",524130,"Reinsurance Carriers",34,26,12/29/20,"1,555,796,864",12/31/20,"2,835,500,000","-40,100,000","2,864,400,000","13,090,600,000"
10792,"Other investments","Fair value of privately-held investments",452510,12/31/20,04/09/21,4,"KPMG LLP",87,"KPMG LLP",1118,London,X0,"UNITED KINGDOM",Foreign,20-F,2021-04-09,,"ASPEN INSURANCE HOLDINGS LTD",1267395,"=""AHL""","11 VICTORIA ST",,HAMILTON,D0,BERMUDA,Foreign,,,"=""6331""","Fire, Marine, and Casualty Insurance",524130,"Reinsurance Carriers",34,26,12/29/20,"1,555,796,864",12/31/20,"2,835,500,000","-40,100,000","2,864,400,000","13,090,600,000"
10793,"Insurance contract liabilities","Estimate of reinsurance recoverables on claims incurred but not reported",452510,12/31/20,04/09/21,4,"KPMG LLP",87,"KPMG LLP",1118,London,X0,"UNITED KINGDOM",Foreign,20-F,2021-04-09,,"ASPEN INSURANCE HOLDINGS LTD",1267395,"=""AHL""","11 VICTORIA ST",,HAMILTON,D0,BERMUDA,Foreign,,,"=""6331""","Fire, Marine, and Casualty Insurance",524130,"Reinsurance Carriers",34,26,12/29/20,"1,555,796,864",12/31/20,"2,835,500,000","-40,100,000","2,864,400,000","13,090,600,000"
4823,"Revenue from customer contracts","Determination of Standalone Selling Prices for Term License and Maintenance Performance Obligations",437040,06/30/20,12/09/20,4,"KPMG LLP",,,,Boston,MA,MASSACHUSETTS,"US New England",10-K,2020-12-09,,"ASPENTECH Corp",929940,,"20 CROSBY DRIVE",,BEDFORD,MA,MASSACHUSETTS,"US New England",,,"=""7371""","Computer Programming Services",541511,"Custom Computer Programming Services",34,104,07/02/20,"7,036,509,184",06/30/20,"598,717,000","229,671,000","285,519,000","1,223,306,000"
4824,"Policy changes","Sufficiency of audit evidence over incomplete revenue contracts at the adoption date of Topic 606 that were modified prior to the adoption date of Topic 606",437040,06/30/20,12/09/20,4,"KPMG LLP",,,,Boston,MA,MASSACHUSETTS,"US New England",10-K,2020-12-09,,"ASPENTECH Corp",929940,,"20 CROSBY DRIVE",,BEDFORD,MA,MASSACHUSETTS,"US New England",,,"=""7371""","Computer Programming Services",541511,"Custom Computer Programming Services",34,104,07/02/20,"7,036,509,184",06/30/20,"598,717,000","229,671,000","285,519,000","1,223,306,000"
6704,"Research and development expenses","Accrued clinical trial expenses",443899,12/31/20,02/25/21,2,"Ernst & Young LLP",,,,"Redwood City",CA,CALIFORNIA,"US West",10-K,2021-02-25,,"ASSEMBLY BIOSCIENCES, INC.",1426800,"=""ASMB""","TWO TOWER PLACE","7TH FLOOR","SOUTH SAN FRANCISCO",CA,CALIFORNIA,"US West",,,"=""2834""","Pharmaceutical Preparations",541710,"Research and Development in the Physical, Engineering, and Life Sciences",34,6,12/31/20,"205,861,360",12/31/20,"79,105,000","-62,152,000","198,940,000","283,254,000"
6705,"Revenue from customer contracts","Revenue Recognition for the Collaborative Arrangement with BeiGene, Ltd.",443899,12/31/20,02/25/21,2,"Ernst & Young LLP",,,,"Redwood City",CA,CALIFORNIA,"US West",10-K,2021-02-25,,"ASSEMBLY BIOSCIENCES, INC.",1426800,"=""ASMB""","TWO TOWER PLACE","7TH FLOOR","SOUTH SAN FRANCISCO",CA,CALIFORNIA,"US West",,,"=""2834""","Pharmaceutical Preparations",541710,"Research and Development in the Physical, Engineering, and Life Sciences",34,6,12/31/20,"205,861,360",12/31/20,"79,105,000","-62,152,000","198,940,000","283,254,000"
9089,"Sales return and allowances","Product sales allowances",448652,12/31/20,03/12/21,2,"Ernst & Young LLP",,,,Chicago,IL,ILLINOIS,"US Midwest",10-K,2021-03-12,,"Assertio Holdings, Inc.",1808665,"=""ASRT""","100 S. SAUNDERS ROAD","SUITE 300","LAKE FOREST",IL,ILLINOIS,"US Midwest",,,"=""2834""","Pharmaceutical Preparations",325412,"Pharmaceutical Preparation Manufacturing",34,0,12/31/20,"40,600,772",12/31/20,"106,275,000","-28,144,000","-144,568,000","303,274,000"
9090,"Business combinations","Accounting for Zyla Life Science Inc. Acquisition",448652,12/31/20,03/12/21,2,"Ernst & Young LLP",,,,Chicago,IL,ILLINOIS,"US Midwest",10-K,2021-03-12,,"Assertio Holdings, Inc.",1808665,"=""ASRT""","100 S. SAUNDERS ROAD","SUITE 300","LAKE FOREST",IL,ILLINOIS,"US Midwest",,,"=""2834""","Pharmaceutical Preparations",325412,"Pharmaceutical Preparation Manufacturing",34,0,12/31/20,"40,600,772",12/31/20,"106,275,000","-28,144,000","-144,568,000","303,274,000"
9091,Goodwill,"Valuation of Goodwill",448652,12/31/20,03/12/21,2,"Ernst & Young LLP",,,,Chicago,IL,ILLINOIS,"US Midwest",10-K,2021-03-12,,"Assertio Holdings, Inc.",1808665,"=""ASRT""","100 S. SAUNDERS ROAD","SUITE 300","LAKE FOREST",IL,ILLINOIS,"US Midwest",,,"=""2834""","Pharmaceutical Preparations",325412,"Pharmaceutical Preparation Manufacturing",34,0,12/31/20,"40,600,772",12/31/20,"106,275,000","-28,144,000","-144,568,000","303,274,000"
5079,"Asset retirement and environmental obligations","Assessment of the allowance credit losses related to loans, excluding individually analyzed loans",441385,12/31/20,02/09/21,4,"KPMG LLP",,,,Chicago,IL,ILLINOIS,"US Midwest",10-K,2021-02-09,,"ASSOCIATED BANC-CORP",7789,"=""ASB""","433 MAIN STREET",,"GREEN BAY",WI,WISCONSIN,"US Midwest",,,"=""6022""","State Commercial Banks",522110,"Commercial Banking",34,17,12/31/20,"2,617,860,864",12/31/20,"1,103,009,000","306,774,000","2,913,379,000","33,419,783,000"
5080,Goodwill,"Valuation of goodwill",441385,12/31/20,02/09/21,4,"KPMG LLP",,,,Chicago,IL,ILLINOIS,"US Midwest",10-K,2021-02-09,,"ASSOCIATED BANC-CORP",7789,"=""ASB""","433 MAIN STREET",,"GREEN BAY",WI,WISCONSIN,"US Midwest",,,"=""6022""","State Commercial Banks",522110,"Commercial Banking",34,17,12/31/20,"2,617,860,864",12/31/20,"1,103,009,000","306,774,000","2,913,379,000","33,419,783,000"
5809,"Insurance contract liabilities","Valuation of Claims and Benefits Payable Reserves for Short Duration Insurance Contracts",442623,12/31/20,02/19/21,1,"PricewaterhouseCoopers LLP",,,,"New York",NY,"NEW YORK","US Mid Atlantic",10-K,2021-02-19,,"ASSURANT, INC.",1267238,"=""AIZ""","ONE CHASE MANHATTAN PLAZA",,"NEW YORK",NY,"NEW YORK","US Mid Atlantic",,,"=""6399""","Insurance Carriers, NEC",524130,"Reinsurance Carriers",34,136,12/31/20,"7,896,374,784",12/31/20,"9,597,600,000","440,800,000","2,665,900,000","44,649,900,000"
5810,"Insurance contract liabilities","Valuation of Future Policy Benefits and Claims and Benefits Payable for Certain Long Duration Insurance Contracts",442623,12/31/20,02/19/21,1,"PricewaterhouseCoopers LLP",,,,"New York",NY,"NEW YORK","US Mid Atlantic",10-K,2021-02-19,,"ASSURANT, INC.",1267238,"=""AIZ""","ONE CHASE MANHATTAN PLAZA",,"NEW YORK",NY,"NEW YORK","US Mid Atlantic",,,"=""6399""","Insurance Carriers, NEC",524130,"Reinsurance Carriers",34,136,12/31/20,"7,896,374,784",12/31/20,"9,597,600,000","440,800,000","2,665,900,000","44,649,900,000"
7202,"Insurance contract liabilities","Valuation of the Loss and Loss Adjustment Expense (LAE) Reserve and the Salvage and Subrogation Recoverable - Estimation of the Expected Loss to be Paid",444598,12/31/20,02/26/21,1,"PricewaterhouseCoopers LLP",,,,"New York",NY,"NEW YORK","US Mid Atlantic",10-K,2021-02-26,,"ASSURED GUARANTY LTD",1273813,"=""AGO""","30 WOODBOURNE AVENUE","5TH FLOOR",HAMILTON,D0,BERMUDA,Foreign,,,"=""6351""","Surety Insurance",524292,"Third Party Administration of Insurance and Pension Funds",34,31,12/31/20,"2,441,951,744",12/31/20,"1,115,000,000","362,000,000","6,461,000,000","15,334,000,000"
7859,Inventory,"Evaluation of the sufficiency of audit evidence over inventories and net sales",445505,12/31/20,03/01/21,4,"KPMG LLP",,,,Knoxville,TN,TENNESSEE,"US Southeast",10-K,2021-03-01,,"ASTEC INDUSTRIES INC",792987,"=""ASTE""","1725 SHEPHERD ROAD",,CHATTANOOGA,TN,TENNESSEE,"US Southeast",,,"=""3531""","Construction Machinery and Equipment",333120,"Construction Machinery Manufacturing",34,58,12/31/20,"1,308,781,184",12/31/20,"1,024,400,000","46,000,000","572,600,000","848,200,000"
9272,"Accounts/loans receivable","Risk Pool Settlements and Related Receivables",448684,12/31/20,03/12/21,2,"Ernst & Young LLP",,,,"Los Angeles",CA,CALIFORNIA,"US West",10-K,2021-03-15,,"Astrana Health, Inc.",1083446,"=""ASTH""","1668 S. GARFIELD AVENUE","2ND FLOOR",ALHAMBRA,CA,CALIFORNIA,"US West",,,"=""8742""","Management Consulting Services",621111,"Offices of Physicians (except Mental Health Specialists)",34,18,12/29/20,"956,702,592",12/31/20,"687,180,000","37,688,000","119,023,000","817,486,000"
9273,"Insurance contract liabilities","Valuation of Incurred but not Reported (IBNR) Claims Liability",448684,12/31/20,03/12/21,2,"Ernst & Young LLP",,,,"Los Angeles",CA,CALIFORNIA,"US West",10-K,2021-03-15,,"Astrana Health, Inc.",1083446,"=""ASTH""","1668 S. GARFIELD AVENUE","2ND FLOOR",ALHAMBRA,CA,CALIFORNIA,"US West",,,"=""8742""","Management Consulting Services",621111,"Offices of Physicians (except Mental Health Specialists)",34,18,12/29/20,"956,702,592",12/31/20,"687,180,000","37,688,000","119,023,000","817,486,000"
5362,"Sales return and allowances","Recognition and measurement of accruals for certain rebates in the US",441844,12/31/20,02/11/21,1,"PricewaterhouseCoopers LLP",121,"PricewaterhouseCoopers LLP",876,London,X0,"UNITED KINGDOM",Foreign,20-F,2021-02-16,,"ASTRAZENECA PLC",901832,"=""AZN""","1 FRANCIS CRICK AVENUE","CAMBRIDGE BIOMEDICAL CAMPUS",LONDON,X0,"UNITED KINGDOM",Foreign,,,"=""2834""","Pharmaceutical Preparations",325412,"Pharmaceutical Preparation Manufacturing",34,50,12/29/20,"31,567,474,688",12/31/20,"26,617,000,000","3,144,000,000","-17,170,000,000","66,729,000,000"
5363,"Other intangible assets","Impairment assessment of the product, marketing and distribution rights and other intangible assets (excluding goodwill and software intangible assets)",441844,12/31/20,02/11/21,1,"PricewaterhouseCoopers LLP",121,"PricewaterhouseCoopers LLP",876,London,X0,"UNITED KINGDOM",Foreign,20-F,2021-02-16,,"ASTRAZENECA PLC",901832,"=""AZN""","1 FRANCIS CRICK AVENUE","CAMBRIDGE BIOMEDICAL CAMPUS",LONDON,X0,"UNITED KINGDOM",Foreign,,,"=""2834""","Pharmaceutical Preparations",325412,"Pharmaceutical Preparation Manufacturing",34,50,12/29/20,"31,567,474,688",12/31/20,"26,617,000,000","3,144,000,000","-17,170,000,000","66,729,000,000"
5364,"Other contingent liabilities","Recognition and measurement of legal provisions and contingent liabilities",441844,12/31/20,02/11/21,1,"PricewaterhouseCoopers LLP",121,"PricewaterhouseCoopers LLP",876,London,X0,"UNITED KINGDOM",Foreign,20-F,2021-02-16,,"ASTRAZENECA PLC",901832,"=""AZN""","1 FRANCIS CRICK AVENUE","CAMBRIDGE BIOMEDICAL CAMPUS",LONDON,X0,"UNITED KINGDOM",Foreign,,,"=""2834""","Pharmaceutical Preparations",325412,"Pharmaceutical Preparation Manufacturing",34,50,12/29/20,"31,567,474,688",12/31/20,"26,617,000,000","3,144,000,000","-17,170,000,000","66,729,000,000"
5365,"Uncertain tax positions","Recognition and measurement of accruals for tax contingencies",441844,12/31/20,02/11/21,1,"PricewaterhouseCoopers LLP",121,"PricewaterhouseCoopers LLP",876,London,X0,"UNITED KINGDOM",Foreign,20-F,2021-02-16,,"ASTRAZENECA PLC",901832,"=""AZN""","1 FRANCIS CRICK AVENUE","CAMBRIDGE BIOMEDICAL CAMPUS",LONDON,X0,"UNITED KINGDOM",Foreign,,,"=""2834""","Pharmaceutical Preparations",325412,"Pharmaceutical Preparation Manufacturing",34,50,12/29/20,"31,567,474,688",12/31/20,"26,617,000,000","3,144,000,000","-17,170,000,000","66,729,000,000"
5366,"Pension and other post-employment benefits","Valuation of defined benefit obligations",441844,12/31/20,02/11/21,1,"PricewaterhouseCoopers LLP",121,"PricewaterhouseCoopers LLP",876,London,X0,"UNITED KINGDOM",Foreign,20-F,2021-02-16,,"ASTRAZENECA PLC",901832,"=""AZN""","1 FRANCIS CRICK AVENUE","CAMBRIDGE BIOMEDICAL CAMPUS",LONDON,X0,"UNITED KINGDOM",Foreign,,,"=""2834""","Pharmaceutical Preparations",325412,"Pharmaceutical Preparation Manufacturing",34,50,12/29/20,"31,567,474,688",12/31/20,"26,617,000,000","3,144,000,000","-17,170,000,000","66,729,000,000"
7832,Goodwill,"Valuation of Goodwill",445297,12/31/20,03/01/21,2,"Ernst & Young LLP",,,,Buffalo,NY,"NEW YORK","US Mid Atlantic",10-K,2021-03-01,,"ASTRONICS CORP",8063,"=""ATRO""","130 COMMERCE WAY",-,"EAST AURORA",NY,"NEW YORK","US Mid Atlantic",,,"=""3728""","Aircraft Parts and Auxiliary Equipment, NEC",336413,"Other Aircraft Parts and Auxiliary Equipment Manufacturing",34,13,12/31/20,"317,741,024",12/31/20,"502,587,000","-115,781,000","102,203,000","619,745,000"
7833,"Revenue from customer contracts","Revenue Recognition",445297,12/31/20,03/01/21,2,"Ernst & Young LLP",,,,Buffalo,NY,"NEW YORK","US Mid Atlantic",10-K,2021-03-01,,"ASTRONICS CORP",8063,"=""ATRO""","130 COMMERCE WAY",-,"EAST AURORA",NY,"NEW YORK","US Mid Atlantic",,,"=""3728""","Aircraft Parts and Auxiliary Equipment, NEC",336413,"Other Aircraft Parts and Auxiliary Equipment Manufacturing",34,13,12/31/20,"317,741,024",12/31/20,"502,587,000","-115,781,000","102,203,000","619,745,000"
6996,"Pension and other post-employment benefits","Discount rates used in determining pension and postretirement benefit obligations",444182,12/31/20,02/25/21,2,"Ernst & Young LLP",,,,Dallas,TX,TEXAS,"US Southwest",10-K,2021-02-25,,"AT&T Inc.",732717,"=""T""","208 S. AKARD ST",,DALLAS,TX,TEXAS,"US Southwest",,,"=""4813""","Telephone Communications, Except Radiotelephone",517110,"Wired Telecommunications Carriers",34,29,12/29/20,"203,376,033,792",12/31/20,"143,050,000,000","-5,176,000,000","-106,109,000,000","525,761,000,000"
6997,"Uncertain tax positions","Uncertain tax positions",444182,12/31/20,02/25/21,2,"Ernst & Young LLP",,,,Dallas,TX,TEXAS,"US Southwest",10-K,2021-02-25,,"AT&T Inc.",732717,"=""T""","208 S. AKARD ST",,DALLAS,TX,TEXAS,"US Southwest",,,"=""4813""","Telephone Communications, Except Radiotelephone",517110,"Wired Telecommunications Carriers",34,29,12/29/20,"203,376,033,792",12/31/20,"143,050,000,000","-5,176,000,000","-106,109,000,000","525,761,000,000"
6998,"Long-lived assets","Impairment of goodwill and long-lived assets",444182,12/31/20,02/25/21,2,"Ernst & Young LLP",,,,Dallas,TX,TEXAS,"US Southwest",10-K,2021-02-25,,"AT&T Inc.",732717,"=""T""","208 S. AKARD ST",,DALLAS,TX,TEXAS,"US Southwest",,,"=""4813""","Telephone Communications, Except Radiotelephone",517110,"Wired Telecommunications Carriers",34,29,12/29/20,"203,376,033,792",12/31/20,"143,050,000,000","-5,176,000,000","-106,109,000,000","525,761,000,000"
12120,"Pension and other post-employment benefits","Discount rates used in determining pension and postretirement benefit obligations",458745,12/31/20,02/25/21,2,"Ernst & Young LLP",,,,Dallas,TX,TEXAS,"US Southwest",8-K,2021-06-21,,"AT&T Inc.",732717,"=""T""","208 S. AKARD ST",,DALLAS,TX,TEXAS,"US Southwest",,,"=""4813""","Telephone Communications, Except Radiotelephone",517110,"Wired Telecommunications Carriers",34,29,12/29/20,"203,376,033,792",12/31/20,"143,050,000,000","-5,176,000,000","-106,109,000,000","525,761,000,000"
12121,"Uncertain tax positions","Uncertain tax positions",458745,12/31/20,02/25/21,2,"Ernst & Young LLP",,,,Dallas,TX,TEXAS,"US Southwest",8-K,2021-06-21,,"AT&T Inc.",732717,"=""T""","208 S. AKARD ST",,DALLAS,TX,TEXAS,"US Southwest",,,"=""4813""","Telephone Communications, Except Radiotelephone",517110,"Wired Telecommunications Carriers",34,29,12/29/20,"203,376,033,792",12/31/20,"143,050,000,000","-5,176,000,000","-106,109,000,000","525,761,000,000"
12122,"Long-lived assets","Impairment of goodwill and long-lived assets",458745,12/31/20,02/25/21,2,"Ernst & Young LLP",,,,Dallas,TX,TEXAS,"US Southwest",8-K,2021-06-21,,"AT&T Inc.",732717,"=""T""","208 S. AKARD ST",,DALLAS,TX,TEXAS,"US Southwest",,,"=""4813""","Telephone Communications, Except Radiotelephone",517110,"Wired Telecommunications Carriers",34,29,12/29/20,"203,376,033,792",12/31/20,"143,050,000,000","-5,176,000,000","-106,109,000,000","525,761,000,000"
10845,Goodwill,"Valuation of goodwill in the overseas art study services reporting unit",452598,12/31/20,04/13/21,4,"KPMG LLP",355,"KPMG Huazhen LLP",1186,Beijing,F4,CHINA,Foreign,20-F,2021-04-13,,"ATA Creativity Global",1420529,"=""AACG""","RM. 507, BLDG. 3, BINHUZHUOYUECHENG","WENHUAKECHUANGYUAN, HUAYUAN BLVD. 365","BAOHE, HEFEI, ANHUI",F4,CHINA,Foreign,,,"=""8200""","Services-Educational Services",611710,"Educational Support Services",34,1,12/29/20,"37,758,232",12/31/20,"24,797,019","-14,097,990","-8,935,723","88,018,140"
7801,"Revenue from customer contracts","Revenue and Deferred Revenue – Accounting for Research, Development and License Agreement – Refer to Note 7 to the Financial Statements",445484,12/31/20,03/01/21,3,"Deloitte & Touche LLP",,,,"San Jose",CA,CALIFORNIA,"US West",10-K,2021-03-01,,"Atara Biotherapeutics, Inc.",1604464,"=""ATRA""","1280 RANCHO CONEJO BLVD",,"THOUSAND OAKS",CA,CALIFORNIA,"US West",,,"=""2836""","Biological Products, Except Diagnostic Substances",325412,"Pharmaceutical Preparation Manufacturing",34,20,12/31/20,"1,636,592,384",12/31/20,,"-306,620,000",,"588,120,000"
7802,"Research and development expenses","Accrued Research and Development Expenses & Prepaid Research and Development Expenses (Clinical Trial Accrued and Prepaid Expenses) - Refer to Note 2 to the Financial Statements",445484,12/31/20,03/01/21,3,"Deloitte & Touche LLP",,,,"San Jose",CA,CALIFORNIA,"US West",10-K,2021-03-01,,"Atara Biotherapeutics, Inc.",1604464,"=""ATRA""","1280 RANCHO CONEJO BLVD",,"THOUSAND OAKS",CA,CALIFORNIA,"US West",,,"=""2836""","Biological Products, Except Diagnostic Substances",325412,"Pharmaceutical Preparation Manufacturing",34,20,12/31/20,"1,636,592,384",12/31/20,,"-306,620,000",,"588,120,000"
9616,"Revenue from customer contracts","Recognition of unbilled revenue",449807,12/31/20,03/22/21,2,"Ernst & Young LLP",34,"Ernst & Young Auditores Independentes SS",1448,"São Paulo",D5,BRAZIL,Foreign,20-F,2021-03-22,,"Atento S.A.",1606457,,"DA VINCI BLDG, 4 RUE LOU HEMMER,","L-1748 LUXEMBOURG FINDEL",LUXEMBOURG-FINDEL,N4,LUXEMBOURG,Foreign,,,"=""4813""","Telephone Communications, Except Radiotelephone",517110,"Wired Telecommunications Carriers",34,13,12/29/20,"197,997,792",12/31/20,"1,412,262,000","-46,880,000","-89,981,000","1,176,123,000"
9617,Goodwill,"Goodwill impairment assessment",449807,12/31/20,03/22/21,2,"Ernst & Young LLP",34,"Ernst & Young Auditores Independentes SS",1448,"São Paulo",D5,BRAZIL,Foreign,20-F,2021-03-22,,"Atento S.A.",1606457,,"DA VINCI BLDG, 4 RUE LOU HEMMER,","L-1748 LUXEMBOURG FINDEL",LUXEMBOURG-FINDEL,N4,LUXEMBOURG,Foreign,,,"=""4813""","Telephone Communications, Except Radiotelephone",517110,"Wired Telecommunications Carriers",34,13,12/29/20,"197,997,792",12/31/20,"1,412,262,000","-46,880,000","-89,981,000","1,176,123,000"
9618,"Deferred income taxes","Recoverability of deferred tax assets",449807,12/31/20,03/22/21,2,"Ernst & Young LLP",34,"Ernst & Young Auditores Independentes SS",1448,"São Paulo",D5,BRAZIL,Foreign,20-F,2021-03-22,,"Atento S.A.",1606457,,"DA VINCI BLDG, 4 RUE LOU HEMMER,","L-1748 LUXEMBOURG FINDEL",LUXEMBOURG-FINDEL,N4,LUXEMBOURG,Foreign,,,"=""4813""","Telephone Communications, Except Radiotelephone",517110,"Wired Telecommunications Carriers",34,13,12/29/20,"197,997,792",12/31/20,"1,412,262,000","-46,880,000","-89,981,000","1,176,123,000"
20908,"Revenue from customer contracts","Recognition of unbilled revenue",486118,12/31/20,03/22/21,2,"Ernst & Young LLP",34,"Ernst & Young Auditores Independentes SS",1448,"São Paulo",D5,BRAZIL,Foreign,20-F,2022-05-02,,"Atento S.A.",1606457,,"DA VINCI BLDG, 4 RUE LOU HEMMER,","L-1748 LUXEMBOURG FINDEL",LUXEMBOURG-FINDEL,N4,LUXEMBOURG,Foreign,,,"=""4813""","Telephone Communications, Except Radiotelephone",517110,"Wired Telecommunications Carriers",34,13,12/29/20,"197,997,792",12/31/20,"1,412,262,000","-46,880,000","-89,981,000","1,176,123,000"
20909,Goodwill,"Goodwill impairment assessment",486118,12/31/20,03/22/21,2,"Ernst & Young LLP",34,"Ernst & Young Auditores Independentes SS",1448,"São Paulo",D5,BRAZIL,Foreign,20-F,2022-05-02,,"Atento S.A.",1606457,,"DA VINCI BLDG, 4 RUE LOU HEMMER,","L-1748 LUXEMBOURG FINDEL",LUXEMBOURG-FINDEL,N4,LUXEMBOURG,Foreign,,,"=""4813""","Telephone Communications, Except Radiotelephone",517110,"Wired Telecommunications Carriers",34,13,12/29/20,"197,997,792",12/31/20,"1,412,262,000","-46,880,000","-89,981,000","1,176,123,000"
20910,"Deferred income taxes","Recoverability of deferred tax assets",486118,12/31/20,03/22/21,2,"Ernst & Young LLP",34,"Ernst & Young Auditores Independentes SS",1448,"São Paulo",D5,BRAZIL,Foreign,20-F,2022-05-02,,"Atento S.A.",1606457,,"DA VINCI BLDG, 4 RUE LOU HEMMER,","L-1748 LUXEMBOURG FINDEL",LUXEMBOURG-FINDEL,N4,LUXEMBOURG,Foreign,,,"=""4813""","Telephone Communications, Except Radiotelephone",517110,"Wired Telecommunications Carriers",34,13,12/29/20,"197,997,792",12/31/20,"1,412,262,000","-46,880,000","-89,981,000","1,176,123,000"
5753,"Other investments","Valuation of certain structured fixed maturity securities",442427,12/31/20,02/19/21,1,"PricewaterhouseCoopers LLP",,,,"Des Moines",IA,IOWA,"US Midwest",10-K,2021-02-19,,"Athene Holding Ltd.",1527469,"=""ATHS""","7700 MILLS CIVIC PARKWAY",,"WEST DES MOINES",IA,IOWA,"US Midwest",,,"=""6311""","Life Insurance",523920,"Portfolio Management",34,43,12/31/20,"8,261,309,952",12/31/20,"14,764,000,000","1,541,000,000",,"202,771,000,000"
5754,"Insurance contract liabilities","Valuation of embedded derivatives of fixed indexed annuities",442427,12/31/20,02/19/21,1,"PricewaterhouseCoopers LLP",,,,"Des Moines",IA,IOWA,"US Midwest",10-K,2021-02-19,,"Athene Holding Ltd.",1527469,"=""ATHS""","7700 MILLS CIVIC PARKWAY",,"WEST DES MOINES",IA,IOWA,"US Midwest",,,"=""6311""","Life Insurance",523920,"Portfolio Management",34,43,12/31/20,"8,261,309,952",12/31/20,"14,764,000,000","1,541,000,000",,"202,771,000,000"
5755,"Insurance contract liabilities","Valuation of guaranteed lifetime withdrawal benefits (GLWB)",442427,12/31/20,02/19/21,1,"PricewaterhouseCoopers LLP",,,,"Des Moines",IA,IOWA,"US Midwest",10-K,2021-02-19,,"Athene Holding Ltd.",1527469,"=""ATHS""","7700 MILLS CIVIC PARKWAY",,"WEST DES MOINES",IA,IOWA,"US Midwest",,,"=""6311""","Life Insurance",523920,"Portfolio Management",34,43,12/31/20,"8,261,309,952",12/31/20,"14,764,000,000","1,541,000,000",,"202,771,000,000"
5756,"Deferred and capitalized costs","Valuation of deferred acquisition costs (DAC)",442427,12/31/20,02/19/21,1,"PricewaterhouseCoopers LLP",,,,"Des Moines",IA,IOWA,"US Midwest",10-K,2021-02-19,,"Athene Holding Ltd.",1527469,"=""ATHS""","7700 MILLS CIVIC PARKWAY",,"WEST DES MOINES",IA,IOWA,"US Midwest",,,"=""6311""","Life Insurance",523920,"Portfolio Management",34,43,12/31/20,"8,261,309,952",12/31/20,"14,764,000,000","1,541,000,000",,"202,771,000,000"
8090,"Revenue from customer contracts","License Revenue Recognition – Refer to Notes 2 and 18 (Oncology Innovation Platform) to the financial statements",445512,12/31/20,03/01/21,3,"Deloitte & Touche LLP",,,,Williamsville,NY,"NEW YORK","US Mid Atlantic",10-K,2021-03-01,,"Athenex, Inc.",1300699,,"1001 MAIN STREET","SUITE 600",BUFFALO,NY,"NEW YORK","US Mid Atlantic",,,"=""2834""","Pharmaceutical Preparations",325412,"Pharmaceutical Preparation Manufacturing",34,11,12/29/20,"1,037,932,352",12/31/20,"144,391,000","-146,179,000","130,666,000","384,329,000"
8091,"Sales return and allowances","Revenue Chargebacks – Refer to Note 18 (Commercial Platform) to the financial statements",445512,12/31/20,03/01/21,3,"Deloitte & Touche LLP",,,,Williamsville,NY,"NEW YORK","US Mid Atlantic",10-K,2021-03-01,,"Athenex, Inc.",1300699,,"1001 MAIN STREET","SUITE 600",BUFFALO,NY,"NEW YORK","US Mid Atlantic",,,"=""2834""","Pharmaceutical Preparations",325412,"Pharmaceutical Preparation Manufacturing",34,11,12/29/20,"1,037,932,352",12/31/20,"144,391,000","-146,179,000","130,666,000","384,329,000"
9938,"Deferred and stock-based compensation","Stock-Based Compensation Modification",450337,12/31/20,03/25/21,2,"Ernst & Young LLP",,,,Cleveland,OH,OHIO,"US Midwest",10-K,2021-03-25,,"ATHERSYS, INC / NEW",1368148,"=""ATHXQ""","3201 CARNEGIE AVENUE",,CLEVELAND,OH,OHIO,"US Midwest",,,"=""2834""","Pharmaceutical Preparations",325412,"Pharmaceutical Preparation Manufacturing",34,2,12/31/20,"353,453,760",12/31/20,"1,440,000","-78,765,000",,"59,714,000"
7460,Goodwill,"Valuation of goodwill",444343,12/31/20,02/26/21,2,"Ernst & Young LLP",,,,Pittsburgh,PA,PENNSYLVANIA,"US Mid Atlantic",10-K,2021-02-26,,"ATI INC",1018963,"=""ATI""","2021 MCKINNEY AVENUE",,DALLAS,TX,TEXAS,"US Southwest",,,"=""3317""","Steel Pipe and Tubes",331111,"Iron and Steel Mills",34,17,12/31/20,"2,126,733,952",12/31/20,"2,982,100,000","-1,572,600,000","280,400,000","4,034,900,000"
7461,"Long-lived assets","Long-lived assets and asset impairment valuation",444343,12/31/20,02/26/21,2,"Ernst & Young LLP",,,,Pittsburgh,PA,PENNSYLVANIA,"US Mid Atlantic",10-K,2021-02-26,,"ATI INC",1018963,"=""ATI""","2021 MCKINNEY AVENUE",,DALLAS,TX,TEXAS,"US Southwest",,,"=""3317""","Steel Pipe and Tubes",331111,"Iron and Steel Mills",34,17,12/31/20,"2,126,733,952",12/31/20,"2,982,100,000","-1,572,600,000","280,400,000","4,034,900,000"
4671,Goodwill,"Goodwill - Refer to Notes 1 and 14 to the financial statements",435774,09/30/20,11/19/20,3,"Deloitte & Touche LLP",,,,Chicago,IL,ILLINOIS,"US Midwest",10-K,2020-11-19,,"Atkore Inc.",1666138,"=""ATKR""","16100 SOUTH LATHROP AVENUE",,HARVEY,IL,ILLINOIS,"US Midwest",,,"=""3690""","Miscellaneous Electrical Machinery, Equipment & Supplies",335932,"Noncurrent-Carrying Wiring Device Manufacturing",34,23,09/30/20,"1,077,561,600",09/30/20,"1,765,421,000","152,302,000","-65,178,000","1,558,525,000"
9468,"Allowance for credit losses","Allowance for Credit Losses",449076,12/31/20,03/16/21,2,"Ernst & Young LLP",,,,Atlanta,GA,GEORGIA,"US Southeast",10-K,2021-03-16,,"Atlantic Capital Bancshares, Inc.",1461755,,"RESURGENS PLAZA","945 EAST PACES FERRY ROAD NE, STE 1600",ATLANTA,GA,GEORGIA,"US Southeast",,,"=""6022""","State Commercial Banks",522110,"Commercial Banking",34,16,12/31/20,"324,687,008",12/31/20,"79,812,000","22,540,000","315,930,000","3,615,617,000"
6366,"Regulatory assets and liabilities","Accounting for the Effects of Rate Regulation",443402,12/31/20,02/24/21,1,"PricewaterhouseCoopers LLP",,,,Philadelphia,PA,PENNSYLVANIA,"US Mid Atlantic",10-K,2021-02-24,,"ATLANTIC CITY ELECTRIC CO",8192,,"500 NORTH WAKEFIELD DRIVE",,NEWARK,DE,DELAWARE,"US Mid Atlantic",1109357,"EXELON CORP","=""4911""","Electric Services",221122,"Electric Power Distribution",34,,,,12/31/20,"1,245,000,000","112,000,000",,"4,286,000,000"
8395,Goodwill,"Goodwill impairment analysis for the Curtis Palmer reporting unit",446261,12/31/20,03/04/21,4,"KPMG LLP",,,,"New York",NY,"NEW YORK","US Mid Atlantic",10-K,2021-03-04,,"ATLANTIC POWER CORP",1419242,,"3 ALLIED DRIVE","SUITE 155",DEDHAM,MA,MASSACHUSETTS,"US New England",,,"=""4900""","Electric, Gas & Sanitary Services",221112,"Fossil Fuel Electric Power Generation",34,2,12/31/20,"187,367,392",12/31/20,"272,000,000","73,500,000","17,000,000","847,200,000"
7217,"Allowance for credit losses","Allowance for Loan and Lease Losses ",444539,12/31/20,02/26/21,2,"Ernst & Young LLP",,,,Richmond,VA,VIRGINIA,"US Mid Atlantic",10-K,2021-02-26,,"Atlantic Union Bankshares Corp",883948,"=""AUB""","4300 COX ROAD",,"GLEN ALLEN",VA,VIRGINIA,"US Mid Atlantic",,,"=""6022""","State Commercial Banks",522110,"Commercial Banking",34,33,12/31/20,"2,593,340,160",12/31/20,"599,643,000","158,228,000","1,715,745,000","19,628,449,000"
7218,Goodwill,"Goodwill Impairment Analysis",444539,12/31/20,02/26/21,2,"Ernst & Young LLP",,,,Richmond,VA,VIRGINIA,"US Mid Atlantic",10-K,2021-02-26,,"Atlantic Union Bankshares Corp",883948,"=""AUB""","4300 COX ROAD",,"GLEN ALLEN",VA,VIRGINIA,"US Mid Atlantic",,,"=""6022""","State Commercial Banks",522110,"Commercial Banking",34,33,12/31/20,"2,593,340,160",12/31/20,"599,643,000","158,228,000","1,715,745,000","19,628,449,000"
7982,"Other intangible assets","Recoverability assessment of contracted concessional assets",445061,12/31/20,02/27/21,2,"Ernst & Young LLP",163,"Ernst & Young SL",1461,Madrid,U3,SPAIN,Foreign,20-F,2021-03-01,,"Atlantica Sustainable Infrastructure plc",1601072,,"GREAT WEST HOUSE, GW1, 17TH FLOOR","GREAT WEST ROAD",BRENTFORD,X0,"UNITED KINGDOM",Foreign,,,"=""4911""","Electric Services",221121,"Electric Bulk Power Transmission and Control",34,37,12/29/20,"3,769,421,824",12/31/20,"1,013,260,000","11,968,000",,"9,938,354,000"
5621,"Deferred and capitalized costs","Heavy Maintenance Costs",442211,12/31/20,02/18/21,1,"PricewaterhouseCoopers LLP",,,,"New York",NY,"NEW YORK","US Mid Atlantic",10-K,2021-02-18,,"ATLAS AIR WORLDWIDE HOLDINGS INC",1135185,,"2000 WESTCHESTER AVENUE",,PURCHASE,NY,"NEW YORK","US Mid Atlantic",,,"=""4522""","Air Transportation, Nonscheduled",481212,"Nonscheduled Chartered Freight Air Transportation",34,55,12/31/20,"1,500,793,344",12/31/20,"3,211,116,000","360,286,000","2,190,713,000","6,029,188,000"
9678,"Property, plant and equipment","Assessment of indicators of impairment for vessels",449614,12/31/20,03/19/21,4,"KPMG LLP",187,"KPMG LLP Chartered Accountants",85,Vancouver,A1,"BRITISH COLUMBIA",Canada,20-F,2021-03-19,,"Atlas Corp.",1794846,,"2600-200 GRANVILLE STREET",,VANCOUVER,A1,"BRITISH COLUMBIA",Canada,,,"=""4412""","Deep Sea Foreign Transportation of  Freight",483111,"Deep Sea Freight Transportation",34,,,,12/31/20,"1,421,100,000","192,600,000","3,550,300,000","9,289,100,000"
9679,"Business combinations","Evaluation of the acquisition-date fair value of property, plant, and equipment assets",449614,12/31/20,03/19/21,4,"KPMG LLP",187,"KPMG LLP Chartered Accountants",85,Vancouver,A1,"BRITISH COLUMBIA",Canada,20-F,2021-03-19,,"Atlas Corp.",1794846,,"2600-200 GRANVILLE STREET",,VANCOUVER,A1,"BRITISH COLUMBIA",Canada,,,"=""4412""","Deep Sea Foreign Transportation of  Freight",483111,"Deep Sea Freight Transportation",34,,,,12/31/20,"1,421,100,000","192,600,000","3,550,300,000","9,289,100,000"
4439,"Revenue from customer contracts","Revenue recognition",430869,06/30/20,08/14/20,2,"Ernst & Young LLP",,,,"San Francisco",CA,CALIFORNIA,"US West",20-F,2020-08-14,,"Atlassian Corp",1650372,"=""TEAM""","350 BUSH STREET","FLOOR 13","SAN FRANCISCO",CA,CALIFORNIA,"US West",,,"=""7372""","Prepackaged Software",511210,"Software Publishers",34,190,07/02/20,"22,464,591,872",06/30/20,"1,614,173,000","-350,654,000","-199,524,000","3,894,072,000"
4638,"Deferred and capitalized costs","Determination of Capital Costs",435534,09/30/20,11/13/20,2,"Ernst & Young LLP",,,,Dallas,TX,TEXAS,"US Southwest",10-K,2020-11-13,,"ATMOS ENERGY CORP",731802,"=""ATO""","1800 THREE LINCOLN CTR","5430 LBJ FREEWAY",DALLAS,TX,TEXAS,"US Southwest",,,"=""4924""","Natural Gas Distribution",221210,"Natural Gas Distribution",34,96,09/30/20,"12,033,105,920",09/30/20,"2,821,137,000","601,443,000","6,059,946,000","15,359,032,000"
7788,Goodwill,"Goodwill Impairment Assessment for Viya Reporting Unit",445355,12/31/20,03/01/21,1,"PricewaterhouseCoopers LLP",,,,Boston,MA,MASSACHUSETTS,"US New England",10-K,2021-03-01,,"ATN International, Inc.",879585,"=""ATNI""","500 CUMMINGS CENTER",,BEVERLY,MA,MASSACHUSETTS,"US New England",,,"=""4813""","Telephone Communications, Except Radiotelephone",517310,"Telecommunications Resellers",34,42,12/31/20,"663,920,384",12/31/20,"455,444,000","-14,122,000","464,962,000","1,083,711,000"
8481,Goodwill,"Valuation of goodwill for the cash generating unit GMF",446033,12/31/20,02/26/21,4,"KPMG LLP",254,"KPMG AG Wirtschaftsprüfungsgesellschaft",1021,Berlin,2M,GERMANY,Foreign,20-F,2021-03-04,,"Atotech Ltd",1762459,,"3RD FLOOR, 44 ESPLANADE",,"ST HELIER",Y9,JERSEY,Foreign,,,"=""2890""","Miscellaneous Chemical Products",325998,"All Other Miscellaneous Chemical Product and Preparation Manufacturing",34,,,,12/31/20,"1,234,300,000","-289,300,000","-1,791,400,000","3,634,500,000"
7377,"Business combinations","Valuation of Contingent Consideration Pursuant to the SentreHEART Merger Agreement - Refer to Note 3 to the financial statements ",444336,12/31/20,02/26/21,3,"Deloitte & Touche LLP",,,,Cincinnati,OH,OHIO,"US Midwest",10-K,2021-02-26,,"AtriCure, Inc.",1323885,"=""ATRC""","7555 INNOVATION WAY",,MASON,OH,OHIO,"US Midwest",,,"=""3841""","Surgical and Medical Instruments and Apparatus",339113,"Surgical Appliance and Supplies Manufacturing",34,56,12/31/20,"2,524,411,904",12/31/20,"206,531,000","-48,155,000","49,414,000","714,539,000"
7378,"Business combinations","Valuation of the In Process Research and Development Intangible Asset Pursuant to the nContact Merger Agreement — Refer to Note 6 to the financial statements",444336,12/31/20,02/26/21,3,"Deloitte & Touche LLP",,,,Cincinnati,OH,OHIO,"US Midwest",10-K,2021-02-26,,"AtriCure, Inc.",1323885,"=""ATRC""","7555 INNOVATION WAY",,MASON,OH,OHIO,"US Midwest",,,"=""3841""","Surgical and Medical Instruments and Apparatus",339113,"Surgical Appliance and Supplies Manufacturing",34,56,12/31/20,"2,524,411,904",12/31/20,"206,531,000","-48,155,000","49,414,000","714,539,000"
11283,"Revenue from customer contracts","Revenue Recognition",454126,12/31/20,04/27/21,2,"Ernst & Young LLP",222,"Kost Forer Gabbay & Kasierer",1281,"Tel Aviv",L3,ISRAEL,Foreign,20-F,2021-04-27,,"AUDIOCODES LTD",1086434,"=""AUDC""","6 OFRA HAZA STREET",,"AIRPORT CITY LOD",L3,ISRAEL,Foreign,,,"=""3661""","Telephone and Telegraph Apparatus",334513,"Instruments and Related Products Manufacturing for Measuring, Displaying, and Controlling Industrial Proc",34,28,12/29/20,"816,698,048",12/31/20,"220,774,000","27,248,000","173,064,000","358,123,000"
10997,"Deferred and stock-based compensation","Measurement of the royalty obligation",443442,12/31/20,02/24/21,1,"PricewaterhouseCoopers LLP",191,"PricewaterhouseCoopers LLP Chartered Accountants",271,Edmonton,A0,ALBERTA,Canada,10-K,2021-02-24,,"Aurinia Pharmaceuticals Inc.",1600620,"=""AUPH""","#140, 14315 - 118 AVENUE",,EDMONTON,A0,ALBERTA,Canada,,,"=""2834""","Pharmaceutical Preparations",325412,"Pharmaceutical Preparation Manufacturing",34,14,12/31/20,"1,752,606,720",12/31/20,"50,118,000","-102,680,000","398,418,000","463,661,000"
4538,"Goodwill and intangible assets","Valuation of goodwill and intangible assets in the cannabis operating segment",432793,06/30/20,09/24/20,4,"KPMG LLP",187,"KPMG LLP Chartered Accountants",85,Vancouver,A1,"BRITISH COLUMBIA",Canada,40-F,2020-09-25,,"AURORA CANNABIS INC",1683541,"=""ACB""","2207 90B STREET SW",,EDMONTON,A0,ALBERTA,Canada,,,"=""2833""","Medicinal Chemicals and Botanical Products",111419,"Other Food Crops Grown Under Cover",34,12,07/02/20,"1,040,289,536",06/30/20,"197,286,000","-2,429,780,000","592,829,000","2,041,058,000"
4539,"Other assets","Measurement of fair value of biological assets",432793,06/30/20,09/24/20,4,"KPMG LLP",187,"KPMG LLP Chartered Accountants",85,Vancouver,A1,"BRITISH COLUMBIA",Canada,40-F,2020-09-25,,"AURORA CANNABIS INC",1683541,"=""ACB""","2207 90B STREET SW",,EDMONTON,A0,ALBERTA,Canada,,,"=""2833""","Medicinal Chemicals and Botanical Products",111419,"Other Food Crops Grown Under Cover",34,12,07/02/20,"1,040,289,536",06/30/20,"197,286,000","-2,429,780,000","592,829,000","2,041,058,000"
3510,"Revenue from customer contracts","Revenue Recognition",422376,01/31/20,03/19/20,2,"Ernst & Young LLP",,,,"San Francisco",CA,CALIFORNIA,"US West",10-K,2020-03-19,,"Autodesk, Inc.",769397,"=""ADSK""","ONE MARKET, STE. 400.",,"SAN FRANCISCO",CA,CALIFORNIA,"US West",,,"=""7372""","Prepackaged Software",511210,"Software Publishers",34,197,01/31/20,"43,188,891,648",01/31/20,"3,274,300,000","214,500,000","-2,655,000,000","6,179,300,000"
3511,"Uncertain tax positions","Uncertain tax positions",422376,01/31/20,03/19/20,2,"Ernst & Young LLP",,,,"San Francisco",CA,CALIFORNIA,"US West",10-K,2020-03-19,,"Autodesk, Inc.",769397,"=""ADSK""","ONE MARKET, STE. 400.",,"SAN FRANCISCO",CA,CALIFORNIA,"US West",,,"=""7372""","Prepackaged Software",511210,"Software Publishers",34,197,01/31/20,"43,188,891,648",01/31/20,"3,274,300,000","214,500,000","-2,655,000,000","6,179,300,000"
8239,"Sales return and allowances","Revenue recognition—sales rebates",445709,12/31/20,03/02/21,1,"PricewaterhouseCoopers LLP",94,"PricewaterhouseCoopers Zhong Tian LLP",1424,Beijing,F4,CHINA,Foreign,20-F,2021-03-02,,"Autohome Inc.",1527636,"=""ATHM""","18TH FLOOR TOWER B, CEC PLAZA","3 Dan Ling Street, Haidian District",BEIJING,F4,CHINA,Foreign,,,"=""7374""","Computer Processing and Data Preparation and Processing Services",518210,"Data Processing, Hosting, and Related Services",34,97,12/29/20,"11,490,696,192",12/31/20,"1,323,979,000","520,693,000","2,166,757,000","3,628,681,000"
8240,"Business combinations","Valuation of Technologies and Trademarks Intangible Assets Acquired in a Business Combination",445709,12/31/20,03/02/21,1,"PricewaterhouseCoopers LLP",94,"PricewaterhouseCoopers Zhong Tian LLP",1424,Beijing,F4,CHINA,Foreign,20-F,2021-03-02,,"Autohome Inc.",1527636,"=""ATHM""","18TH FLOOR TOWER B, CEC PLAZA","3 Dan Ling Street, Haidian District",BEIJING,F4,CHINA,Foreign,,,"=""7374""","Computer Processing and Data Preparation and Processing Services",518210,"Data Processing, Hosting, and Related Services",34,97,12/29/20,"11,490,696,192",12/31/20,"1,323,979,000","520,693,000","2,166,757,000","3,628,681,000"
5947,"Revenue from customer contracts","Revenue recognition – Variable consideration",442555,12/31/20,02/19/21,2,"Ernst & Young LLP",55,"Ernst & Young AB",1433,Stockholm,V7,SWEDEN,Foreign,10-K,2021-02-19,,"AUTOLIV INC",1034670,"=""ALV""","3350 AIRPORT RD",,OGDEN,UT,UTAH,"US West",,,"=""3714""","Motor Vehicle Parts and Accessories",336399,"All Other Motor Vehicle Parts Manufacturing",34,92,12/31/20,"8,049,540,096",12/31/20,"7,447,400,000","186,900,000","997,200,000","8,156,800,000"
5948,"Warranty liabilities","Product recalls",442555,12/31/20,02/19/21,2,"Ernst & Young LLP",55,"Ernst & Young AB",1433,Stockholm,V7,SWEDEN,Foreign,10-K,2021-02-19,,"AUTOLIV INC",1034670,"=""ALV""","3350 AIRPORT RD",,OGDEN,UT,UTAH,"US West",,,"=""3714""","Motor Vehicle Parts and Accessories",336399,"All Other Motor Vehicle Parts Manufacturing",34,92,12/31/20,"8,049,540,096",12/31/20,"7,447,400,000","186,900,000","997,200,000","8,156,800,000"
4380,Goodwill,"Goodwill – Employer Services Reportable Segment— Refer to Notes 1 and 7 to the financial statements",430411,06/30/20,08/05/20,3,"Deloitte & Touche LLP",,,,Parsippany,NJ,"NEW JERSEY","US Mid Atlantic",10-K,2020-08-05,,"AUTOMATIC DATA PROCESSING INC",8670,"=""ADP""","ONE ADP BOULVARD",,ROSELAND,NJ,"NEW JERSEY","US Mid Atlantic",,,"=""7374""","Computer Processing and Data Preparation and Processing Services",518210,"Data Processing, Hosting, and Related Services",34,149,06/30/20,"64,007,811,072",06/30/20,"14,589,800,000","2,466,500,000","2,227,000,000","39,165,500,000"
4381,"Other liabilities and provisions","Client Fund Obligations - Refer to Note 4 to the financial statements",430411,06/30/20,08/05/20,3,"Deloitte & Touche LLP",,,,Parsippany,NJ,"NEW JERSEY","US Mid Atlantic",10-K,2020-08-05,,"AUTOMATIC DATA PROCESSING INC",8670,"=""ADP""","ONE ADP BOULVARD",,ROSELAND,NJ,"NEW JERSEY","US Mid Atlantic",,,"=""7374""","Computer Processing and Data Preparation and Processing Services",518210,"Data Processing, Hosting, and Related Services",34,149,06/30/20,"64,007,811,072",06/30/20,"14,589,800,000","2,466,500,000","2,227,000,000","39,165,500,000"
5430,"Other intangible assets","Assessment of the fair value of franchise rights",441943,12/31/20,02/16/21,4,"KPMG LLP",,,,"Fort Lauderdale",FL,FLORIDA,"US Southeast",10-K,2021-02-16,,"AUTONATION, INC.",350698,"=""AN""","200 SW 1ST AVE","SUITE 1600","FORT LAUDERDALE",FL,FLORIDA,"US Southeast",,,"=""5500""","Retail-Auto Dealers & Gasoline Stations",441110,"New Car Dealers",34,70,12/31/20,"5,826,315,264",12/31/20,"20,390,000,000","381,600,000","1,529,200,000","9,887,200,000"
5431,Goodwill,"Valuation of goodwill in the Premium Luxury reporting unit",441943,12/31/20,02/16/21,4,"KPMG LLP",,,,"Fort Lauderdale",FL,FLORIDA,"US Southeast",10-K,2021-02-16,,"AUTONATION, INC.",350698,"=""AN""","200 SW 1ST AVE","SUITE 1600","FORT LAUDERDALE",FL,FLORIDA,"US Southeast",,,"=""5500""","Retail-Auto Dealers & Gasoline Stations",441110,"New Car Dealers",34,70,12/31/20,"5,826,315,264",12/31/20,"20,390,000,000","381,600,000","1,529,200,000","9,887,200,000"
4595,"Other contingent liabilities","Valuation of Self-insurance Reserves",434577,08/29/20,10/26/20,2,"Ernst & Young LLP",,,,Memphis,TN,TENNESSEE,"US Southeast",10-K,2020-10-26,,"AUTOZONE INC",866787,"=""AZO""","123 SOUTH FRONT ST","DEPT 8074",MEMPHIS,TN,TENNESSEE,"US Southeast",,,"=""5531""","Auto and Home Supply Stores",441310,"Automotive Parts and Accessories Stores",34,"1,196",08/31/20,"27,964,942,336",08/29/20,"12,631,967,000","1,732,972,000","-1,180,622,000","14,423,872,000"
8732,"Revenue from customer contracts","Presentation of the Gain on Sale of Hospital Products - Refer to Note 4 to the financial statements",447834,12/31/20,03/09/21,3,"Deloitte & Touche LLP",,,,"Saint Louis",MO,MISSOURI,"US Southeast",10-K,2021-03-09,,"AVADEL PHARMACEUTICALS PLC",1012477,"=""AVDL""","10 EARLSFORT TERRACE",,"DUBLIN 2",L2,IRELAND,Foreign,,,"=""2834""","Pharmaceutical Preparations",325412,"Pharmaceutical Preparation Manufacturing",34,7,12/31/20,"390,085,280",12/31/20,"22,334,000","7,028,000","145,430,000","311,637,000"
6742,"Revenue from customer contracts","Revenue Recognition— Refer to Note 2 to the financial statements",444007,12/31/20,02/25/21,3,"Deloitte & Touche LLP",,,,Seattle,WA,WASHINGTON,"US West",10-K,2021-02-25,,"AVALARA, INC.",1348036,,"255 S. KING ST.","SUITE 1800",SEATTLE,WA,WASHINGTON,"US West",,,"=""7372""","Prepackaged Software",511210,"Software Publishers",34,165,12/31/20,"14,025,213,952",12/31/20,"500,569,000","-55,320,000","480,413,000","1,602,333,000"
6743,"Business combinations","Acquisition – Transaction Tax Resources, Inc. — Customer Relationships Intangible Asset - Refer to Note 5 to the financial statements",444007,12/31/20,02/25/21,3,"Deloitte & Touche LLP",,,,Seattle,WA,WASHINGTON,"US West",10-K,2021-02-25,,"AVALARA, INC.",1348036,,"255 S. KING ST.","SUITE 1800",SEATTLE,WA,WASHINGTON,"US West",,,"=""7372""","Prepackaged Software",511210,"Software Publishers",34,165,12/31/20,"14,025,213,952",12/31/20,"500,569,000","-55,320,000","480,413,000","1,602,333,000"
8650,"Business combinations","Accounting for Acquisition of Aevi Genomic Medicine",447264,12/31/20,03/08/21,2,"Ernst & Young LLP",,,,Baltimore,MD,MARYLAND,"US Mid Atlantic",10-K,2021-03-08,Yes,"Avalo Therapeutics, Inc.",1534120,"=""AVTX""","1500 LIBERTY RIDGE DRIVE","SUITE 321",WAYNE,PA,PENNSYLVANIA,"US Mid Atlantic",,,"=""2834""","Pharmaceutical Preparations",325412,"Pharmaceutical Preparation Manufacturing",34,3,12/29/20,"204,504,432",12/31/20,"6,698,615","-63,499,772","8,567,330","43,755,319"
6721,"Deferred and capitalized costs","Valuation of Deferred Development Costs",443866,12/31/20,02/25/21,2,"Ernst & Young LLP",,,,Tysons,VA,VIRGINIA,"US Mid Atlantic",10-K,2021-02-25,,"AVALONBAY COMMUNITIES INC",915912,"=""AVB""","4040 WILSON BOULEVARD","STE 1000",ARLINGTON,VA,VIRGINIA,"US Mid Atlantic",,,"=""6798""","Real Estate Investment Trusts",525990,"Other Financial Vehicles",34,160,12/31/20,"22,384,263,168",12/31/20,"2,301,261,000","827,630,000",,"19,199,144,000"
7761,Goodwill,"Evaluation of the impairment of the carrying value of goodwill in the Renewables reporting unit",445375,12/31/20,03/01/21,4,"KPMG LLP",,,,"New York",NY,"NEW YORK","US Mid Atlantic",10-K,2021-03-01,,"Avangrid, Inc.",1634997,,"180 MARSH HILL ROAD",,ORANGE,CT,CONNECTICUT,"US New England",,,"=""4911""","Electric Services",221119,"Other Electric Power Generation",34,45,12/29/20,"13,927,072,768",12/31/20,"6,320,000,000","581,000,000","11,785,000,000","37,823,000,000"
7762,"Regulatory assets and liabilities","Evaluation of regulatory assets and liabilities",445375,12/31/20,03/01/21,4,"KPMG LLP",,,,"New York",NY,"NEW YORK","US Mid Atlantic",10-K,2021-03-01,,"Avangrid, Inc.",1634997,,"180 MARSH HILL ROAD",,ORANGE,CT,CONNECTICUT,"US New England",,,"=""4911""","Electric Services",221119,"Other Electric Power Generation",34,45,12/29/20,"13,927,072,768",12/31/20,"6,320,000,000","581,000,000","11,785,000,000","37,823,000,000"
7763,"Other debt","Evaluation of tax equity financing arrangements",445375,12/31/20,03/01/21,4,"KPMG LLP",,,,"New York",NY,"NEW YORK","US Mid Atlantic",10-K,2021-03-01,,"Avangrid, Inc.",1634997,,"180 MARSH HILL ROAD",,ORANGE,CT,CONNECTICUT,"US New England",,,"=""4911""","Electric Services",221119,"Other Electric Power Generation",34,45,12/29/20,"13,927,072,768",12/31/20,"6,320,000,000","581,000,000","11,785,000,000","37,823,000,000"
5856,"Sales return and allowances","Net Sales / Accrued rebate expense — Refer to Notes 1 and 4 to the consolidated financial statements",442653,12/31/20,02/19/21,3,"Deloitte & Touche LLP",,,,Atlanta,GA,GEORGIA,"US Southeast",10-K,2021-02-19,,"AVANOS MEDICAL, INC.",1606498,"=""AVNS""","5405 WINDWARD PARKWAY","SUITE 100 SOUTH",ALPHARETTA,GA,GEORGIA,"US Southeast",,,"=""3842""","Orthopedic, Prosthetic, and Surgical Appliances and Supplies",524114,"Direct Health and Medical Insurance Carriers",34,46,12/31/20,"2,198,458,624",12/31/20,"714,800,000","-29,000,000","296,300,000","1,672,800,000"
7713,"Business combinations","Business Combination",444936,12/31/20,02/26/21,2,"Ernst & Young LLP",,,,Dallas,TX,TEXAS,"US Southwest",10-K,2021-02-26,,"AVANTAX, INC.",1068875,,"3200 OLYMPUS BLVD.","SUITE 100",DALLAS,TX,TEXAS,"US Southwest",,,"=""6199""","Finance Services",519120,"Libraries and Archives",34,15,12/29/20,"704,320,960",12/31/20,"754,952,000","-342,755,000","-464,710,000","1,064,192,000"
7714,Goodwill,"Impairment of Goodwill",444936,12/31/20,02/26/21,2,"Ernst & Young LLP",,,,Dallas,TX,TEXAS,"US Southwest",10-K,2021-02-26,,"AVANTAX, INC.",1068875,,"3200 OLYMPUS BLVD.","SUITE 100",DALLAS,TX,TEXAS,"US Southwest",,,"=""6199""","Finance Services",519120,"Libraries and Archives",34,15,12/29/20,"704,320,960",12/31/20,"754,952,000","-342,755,000","-464,710,000","1,064,192,000"
5375,Goodwill,"Goodwill —Americas sciences and Europe Reporting Units - Refer to Notes 2, 5 and 10 to the financial statements",441862,12/31/20,02/16/21,3,"Deloitte & Touche LLP",,,,Philadelphia,PA,PENNSYLVANIA,"US Mid Atlantic",10-K,2021-02-16,,"Avantor, Inc.",1722482,"=""AVTR""","RADNOR CORPORATE CENTER, BUILDING ONE","SUITE 200, 100 MATSONFORD ROAD",RADNOR,PA,PENNSYLVANIA,"US Mid Atlantic",,,"=""3826""","Laboratory Analytical Instruments",325188,"All Other Basic Inorganic Chemical Manufacturing",34,28,12/31/20,"16,329,815,040",12/31/20,"6,393,600,000","116,600,000","-4,234,700,000","9,906,500,000"
4740,Goodwill,"Goodwill Interim Impairment Assessment - Products & Solutions and Services Reporting Units",436125,09/30/20,11/25/20,1,"PricewaterhouseCoopers LLP",,,,"San Jose",CA,CALIFORNIA,"US West",10-K,2020-11-25,,"Avaya Holdings Corp.",1418100,,"co Avaya Inc","2605 MERIDIAN PARKWAY, SUITE 200",DURHAM,NC,"NORTH CAROLINA","US Southeast",,,"=""7372""","Prepackaged Software",541611,"Administrative Management and General Management Consulting Services",34,17,10/02/20,"1,401,498,112",09/30/20,"2,873,000,000","-680,000,000","-3,670,000,000","6,231,000,000"
4741,"Other intangible assets","Indefinite-Lived Intangible Asset Interim Impairment Assessment - Trade Name",436125,09/30/20,11/25/20,1,"PricewaterhouseCoopers LLP",,,,"San Jose",CA,CALIFORNIA,"US West",10-K,2020-11-25,,"Avaya Holdings Corp.",1418100,,"co Avaya Inc","2605 MERIDIAN PARKWAY, SUITE 200",DURHAM,NC,"NORTH CAROLINA","US Southeast",,,"=""7372""","Prepackaged Software",541611,"Administrative Management and General Management Consulting Services",34,17,10/02/20,"1,401,498,112",09/30/20,"2,873,000,000","-680,000,000","-3,670,000,000","6,231,000,000"
10668,"Sales return and allowances","Revenue Recognition",451914,01/02/21,03/19/21,2,"Ernst & Young LLP",,,,Atlanta,GA,GEORGIA,"US Southeast",S-1,2021-04-01,,"Aveanna Healthcare Holdings, Inc.",1832332,"=""AVAH""","400 INTERSTATE NORTH PARKWAY","STE 1700",ATLANTA,GA,GEORGIA,"US Southeast",,,"=""8082""","Home Health Care Services",621610,"Home Health Care Services",34,,,,01/02/21,"1,495,105,000","-57,050,000","-1,122,788,000","1,844,016,000"
10669,Goodwill,"Interim Valuation of Therapy Reporting Unit Goodwill",451914,01/02/21,03/19/21,2,"Ernst & Young LLP",,,,Atlanta,GA,GEORGIA,"US Southeast",S-1,2021-04-01,,"Aveanna Healthcare Holdings, Inc.",1832332,"=""AVAH""","400 INTERSTATE NORTH PARKWAY","STE 1700",ATLANTA,GA,GEORGIA,"US Southeast",,,"=""8082""","Home Health Care Services",621610,"Home Health Care Services",34,,,,01/02/21,"1,495,105,000","-57,050,000","-1,122,788,000","1,844,016,000"
11134,"Sales return and allowances","Revenue Recognition",453160,01/02/21,03/19/21,2,"Ernst & Young LLP",,,,Atlanta,GA,GEORGIA,"US Southeast",S-1/A,2021-04-20,,"Aveanna Healthcare Holdings, Inc.",1832332,"=""AVAH""","400 INTERSTATE NORTH PARKWAY","STE 1700",ATLANTA,GA,GEORGIA,"US Southeast",,,"=""8082""","Home Health Care Services",621610,"Home Health Care Services",34,,,,01/02/21,"1,495,105,000","-57,050,000","-1,122,788,000","1,844,016,000"
11135,Goodwill,"Interim Valuation of Therapy Reporting Unit Goodwill",453160,01/02/21,03/19/21,2,"Ernst & Young LLP",,,,Atlanta,GA,GEORGIA,"US Southeast",S-1/A,2021-04-20,,"Aveanna Healthcare Holdings, Inc.",1832332,"=""AVAH""","400 INTERSTATE NORTH PARKWAY","STE 1700",ATLANTA,GA,GEORGIA,"US Southeast",,,"=""8082""","Home Health Care Services",621610,"Home Health Care Services",34,,,,01/02/21,"1,495,105,000","-57,050,000","-1,122,788,000","1,844,016,000"
11248,"Sales return and allowances","Revenue Recognition",454075,01/02/21,03/19/21,2,"Ernst & Young LLP",,,,Atlanta,GA,GEORGIA,"US Southeast",S-1/A,2021-04-26,,"Aveanna Healthcare Holdings, Inc.",1832332,"=""AVAH""","400 INTERSTATE NORTH PARKWAY","STE 1700",ATLANTA,GA,GEORGIA,"US Southeast",,,"=""8082""","Home Health Care Services",621610,"Home Health Care Services",34,,,,01/02/21,"1,495,105,000","-57,050,000","-1,122,788,000","1,844,016,000"
11249,Goodwill,"Interim Valuation of Therapy Reporting Unit Goodwill",454075,01/02/21,03/19/21,2,"Ernst & Young LLP",,,,Atlanta,GA,GEORGIA,"US Southeast",S-1/A,2021-04-26,,"Aveanna Healthcare Holdings, Inc.",1832332,"=""AVAH""","400 INTERSTATE NORTH PARKWAY","STE 1700",ATLANTA,GA,GEORGIA,"US Southeast",,,"=""8082""","Home Health Care Services",621610,"Home Health Care Services",34,,,,01/02/21,"1,495,105,000","-57,050,000","-1,122,788,000","1,844,016,000"
11329,"Sales return and allowances","Revenue Recognition",454405,01/02/21,03/19/21,2,"Ernst & Young LLP",,,,Atlanta,GA,GEORGIA,"US Southeast",S-1/A,2021-04-28,,"Aveanna Healthcare Holdings, Inc.",1832332,"=""AVAH""","400 INTERSTATE NORTH PARKWAY","STE 1700",ATLANTA,GA,GEORGIA,"US Southeast",,,"=""8082""","Home Health Care Services",621610,"Home Health Care Services",34,,,,01/02/21,"1,495,105,000","-57,050,000","-1,122,788,000","1,844,016,000"
11330,Goodwill,"Interim Valuation of Therapy Reporting Unit Goodwill",454405,01/02/21,03/19/21,2,"Ernst & Young LLP",,,,Atlanta,GA,GEORGIA,"US Southeast",S-1/A,2021-04-28,,"Aveanna Healthcare Holdings, Inc.",1832332,"=""AVAH""","400 INTERSTATE NORTH PARKWAY","STE 1700",ATLANTA,GA,GEORGIA,"US Southeast",,,"=""8082""","Home Health Care Services",621610,"Home Health Care Services",34,,,,01/02/21,"1,495,105,000","-57,050,000","-1,122,788,000","1,844,016,000"
11495,"Sales return and allowances","Revenue Recognition",455255,01/02/21,03/19/21,2,"Ernst & Young LLP",,,,Atlanta,GA,GEORGIA,"US Southeast",424B4,2021-04-30,,"Aveanna Healthcare Holdings, Inc.",1832332,"=""AVAH""","400 INTERSTATE NORTH PARKWAY","STE 1700",ATLANTA,GA,GEORGIA,"US Southeast",,,"=""8082""","Home Health Care Services",621610,"Home Health Care Services",34,,,,01/02/21,"1,495,105,000","-57,050,000","-1,122,788,000","1,844,016,000"
11496,Goodwill,"Interim Valuation of Therapy Reporting Unit Goodwill",455255,01/02/21,03/19/21,2,"Ernst & Young LLP",,,,Atlanta,GA,GEORGIA,"US Southeast",424B4,2021-04-30,,"Aveanna Healthcare Holdings, Inc.",1832332,"=""AVAH""","400 INTERSTATE NORTH PARKWAY","STE 1700",ATLANTA,GA,GEORGIA,"US Southeast",,,"=""8082""","Home Health Care Services",621610,"Home Health Care Services",34,,,,01/02/21,"1,495,105,000","-57,050,000","-1,122,788,000","1,844,016,000"
9418,"Research and development expenses","Accrued Clinical Trial Costs and Contract Research",449122,12/31/20,03/16/21,2,"Ernst & Young LLP",,,,Boston,MA,MASSACHUSETTS,"US New England",10-K,2021-03-16,,"AVEO PHARMACEUTICALS, INC.",1325879,,"30 WINTER STREET",,BOSTON,MA,MASSACHUSETTS,"US New England",,,"=""2834""","Pharmaceutical Preparations",325412,"Pharmaceutical Preparation Manufacturing",34,6,12/31/20,"155,114,912",12/31/20,"6,019,000","-35,584,000",,"66,912,000"
6609,"Deferred income taxes","Income Taxes",443730,01/02/21,02/24/21,1,"PricewaterhouseCoopers LLP",,,,"Los Angeles",CA,CALIFORNIA,"US West",10-K,2021-02-25,,"Avery Dennison Corp",8818,"=""AVY""","8080 NORTON PARKWAY",,MENTOR,OH,OHIO,"US Midwest",,,"=""2670""","Converted Paper & Paperboard Prods (No Contaners/Boxes)",322222,"Coated and Laminated Paper Manufacturing",34,152,01/04/21,"12,671,152,128",01/02/21,"6,971,500,000","555,900,000","123,600,000","6,083,900,000"
11555,"Goodwill and intangible assets","Assessment of the impairment analysis of the Air Transport Cash Generating Unit (“Air Transport CGU”)",455355,12/31/20,04/30/21,4,"KPMG LLP",664,"KPMG SAS",5070,Bogota,F8,COLOMBIA,Foreign,20-F,2021-05-03,Yes,"Avianca Holdings S.A.",1575969,,"AVENIDA CALLE 26 #59 - 15",,BOGOTA,F8,COLOMBIA,Foreign,,,"=""4512""","Air Transportation, Scheduled",481111,"Scheduled Passenger Air Transportation",34,0,12/31/20,"48,603,132",12/31/20,"1,711,585,000","-1,094,135,000","-1,777,530,000","6,860,494,000"
6927,"Asset retirement and environmental obligations","Environmental Accrued Liabilities",443776,12/31/20,02/25/21,2,"Ernst & Young LLP",,,,Cleveland,OH,OHIO,"US Midwest",10-K,2021-02-25,,"AVIENT CORP",1122976,"=""AVNT""","33587 WALKER ROAD",,"AVON LAKE",OH,OHIO,"US Midwest",,,"=""2821""","Plastics Material and Synthetic Resins, and Nonvulcanizable Elastomers",325211,"Plastics Material and Resin Manufacturing",34,40,12/31/20,"3,677,563,904",12/31/20,"3,242,100,000","131,600,000","-619,500,000","4,870,500,000"
6928,Goodwill,"Quantitative Impairment Assessment of Goodwill",443776,12/31/20,02/25/21,2,"Ernst & Young LLP",,,,Cleveland,OH,OHIO,"US Midwest",10-K,2021-02-25,,"AVIENT CORP",1122976,"=""AVNT""","33587 WALKER ROAD",,"AVON LAKE",OH,OHIO,"US Midwest",,,"=""2821""","Plastics Material and Synthetic Resins, and Nonvulcanizable Elastomers",325211,"Plastics Material and Resin Manufacturing",34,40,12/31/20,"3,677,563,904",12/31/20,"3,242,100,000","131,600,000","-619,500,000","4,870,500,000"
6929,"Business combinations","Accounting for the Clariant Masterbatch Business Combination",443776,12/31/20,02/25/21,2,"Ernst & Young LLP",,,,Cleveland,OH,OHIO,"US Midwest",10-K,2021-02-25,,"AVIENT CORP",1122976,"=""AVNT""","33587 WALKER ROAD",,"AVON LAKE",OH,OHIO,"US Midwest",,,"=""2821""","Plastics Material and Synthetic Resins, and Nonvulcanizable Elastomers",325211,"Plastics Material and Resin Manufacturing",34,40,12/31/20,"3,677,563,904",12/31/20,"3,242,100,000","131,600,000","-619,500,000","4,870,500,000"
5441,"Depreciation and amortization","Vehicles - Depreciation Expense - United States Risk Vehicles - Refer to Notes 2 and 8 to the financial statements",441949,12/31/20,02/17/21,3,"Deloitte & Touche LLP",,,,"New York",NY,"NEW YORK","US Mid Atlantic",10-K,2021-02-17,,"AVIS BUDGET GROUP, INC.",723612,"=""CAR""","379 INTERPACE PARKWAY",,PARSIPPANY,NJ,"NEW JERSEY","US Mid Atlantic",,,"=""7510""","Services-Auto Rental & Leasing (No Drivers)",532111,"Passenger Car Rental",34,37,12/31/20,"2,611,000,064",12/31/20,"5,402,000,000","-684,000,000","1,468,000,000","16,881,000,000"
5442,"Other contingent liabilities","Self-Insurance Reserves - Public Liability and Property Damage Claims - United States - Refer to Note 2 to the financial statements",441949,12/31/20,02/17/21,3,"Deloitte & Touche LLP",,,,"New York",NY,"NEW YORK","US Mid Atlantic",10-K,2021-02-17,,"AVIS BUDGET GROUP, INC.",723612,"=""CAR""","379 INTERPACE PARKWAY",,PARSIPPANY,NJ,"NEW JERSEY","US Mid Atlantic",,,"=""7510""","Services-Auto Rental & Leasing (No Drivers)",532111,"Passenger Car Rental",34,37,12/31/20,"2,611,000,064",12/31/20,"5,402,000,000","-684,000,000","1,468,000,000","16,881,000,000"
5443,Goodwill,"Goodwill - Europe, Middle East and Africa (“EMEA”) Reporting Unit - Refer to Notes 2 and 7 to the financial statements",441949,12/31/20,02/17/21,3,"Deloitte & Touche LLP",,,,"New York",NY,"NEW YORK","US Mid Atlantic",10-K,2021-02-17,,"AVIS BUDGET GROUP, INC.",723612,"=""CAR""","379 INTERPACE PARKWAY",,PARSIPPANY,NJ,"NEW JERSEY","US Mid Atlantic",,,"=""7510""","Services-Auto Rental & Leasing (No Drivers)",532111,"Passenger Car Rental",34,37,12/31/20,"2,611,000,064",12/31/20,"5,402,000,000","-684,000,000","1,468,000,000","16,881,000,000"
6216,"Regulatory assets and liabilities","Regulatory Matters - Refer to Notes 1, 22, and 23 to the financial statements",443188,12/31/20,02/23/21,3,"Deloitte & Touche LLP",,,,Portland,OR,OREGON,"US West",10-K,2021-02-24,,"AVISTA CORP",104918,"=""AVA""","1411 E MISSION AVE",,SPOKANE,WA,WASHINGTON,"US West",,,"=""4931""","Electric and Other Services Combined",221210,"Natural Gas Distribution",34,40,12/31/20,"2,779,249,408",12/31/20,"1,321,891,000","129,488,000","1,977,300,000","6,402,097,000"
4419,"Other income taxes","Evaluation of accounting for income taxes",430811,06/27/20,08/14/20,4,"KPMG LLP",,,,Phoenix,AZ,ARIZONA,"US Southwest",10-K,2020-08-14,,"AVNET INC",8858,"=""AVT""","2211 SOUTH 47TH STREET",,PHOENIX,AZ,ARIZONA,"US Southwest",,,"=""5065""","Electronic Parts and Equipment, NEC",334419,"Other Electronic Component Manufacturing",34,28,06/30/20,"2,755,323,904",06/27/20,"17,634,333,000","-31,081,000","2,887,227,000","8,105,197,000"
4420,Goodwill,"Assessment of goodwill impairment",430811,06/27/20,08/14/20,4,"KPMG LLP",,,,Phoenix,AZ,ARIZONA,"US Southwest",10-K,2020-08-14,,"AVNET INC",8858,"=""AVT""","2211 SOUTH 47TH STREET",,PHOENIX,AZ,ARIZONA,"US Southwest",,,"=""5065""","Electronic Parts and Equipment, NEC",334419,"Other Electronic Component Manufacturing",34,28,06/30/20,"2,755,323,904",06/27/20,"17,634,333,000","-31,081,000","2,887,227,000","8,105,197,000"
8564,"Deferred income taxes","Realizability of the deferred tax assets",446416,12/31/20,03/05/21,1,"PricewaterhouseCoopers LLP",121,"PricewaterhouseCoopers LLP",876,London,X0,"UNITED KINGDOM",Foreign,10-K,2021-03-05,,"AVON PRODUCTS INC",8868,,"1 AVON PLACE",,SUFFERN,NY,"NEW YORK","US Mid Atlantic",1776967,"Natura &Co Holding S.A.","=""2844""","Perfumes, Cosmetics, and Other Toilet Preparations",325620,"Toilet Preparation Manufacturing",34,,,,12/31/20,"3,625,200,000","-362,800,000","-954,700,000","2,564,300,000"
5512,"Other income taxes","Measurement of Unrecognized Tax Benefits",442091,12/31/20,02/18/21,1,"PricewaterhouseCoopers LLP",,,,Philadelphia,PA,PENNSYLVANIA,"US Mid Atlantic",10-K,2021-02-18,,"Axalta Coating Systems Ltd.",1616862,"=""AXTA""","1050 CONSTITUTION AVENUE",,PHILADELPHIA,PA,PENNSYLVANIA,"US Mid Atlantic",,,"=""2851""","Paints, Varnishes, Lacquers, Enamels, and Allied Products",325510,"Paint and Coating Manufacturing",34,29,12/31/20,"6,703,540,224",12/31/20,"3,737,600,000","121,600,000","-1,010,700,000","7,157,200,000"
7499,"Revenue from customer contracts","Systems Revenue recognition",444216,12/31/20,02/26/21,2,"Ernst & Young LLP",,,,Boston,MA,MASSACHUSETTS,"US New England",10-K,2021-02-26,,"AXCELIS TECHNOLOGIES INC",1113232,"=""ACLS""","108 CHERRY HILL DRIVE",,BEVERLY,MA,MASSACHUSETTS,"US New England",,,"=""3559""","Special  Industry Machinery, NEC",333295,"Semiconductor Machinery Manufacturing",34,29,12/31/20,"979,392,960",12/31/20,"474,560,000","49,982,000",,"624,624,000"
7500,Inventory,"Estimate of Excess Inventory",444216,12/31/20,02/26/21,2,"Ernst & Young LLP",,,,Boston,MA,MASSACHUSETTS,"US New England",10-K,2021-02-26,,"AXCELIS TECHNOLOGIES INC",1113232,"=""ACLS""","108 CHERRY HILL DRIVE",,BEVERLY,MA,MASSACHUSETTS,"US New England",,,"=""3559""","Special  Industry Machinery, NEC",333295,"Semiconductor Machinery Manufacturing",34,29,12/31/20,"979,392,960",12/31/20,"474,560,000","49,982,000",,"624,624,000"
7450,"Other contingent liabilities","Reserve for losses and loss expenses - Refer to Notes 2 and 8 to the consolidated financial statements",444904,12/31/20,02/26/21,3,"Deloitte & Touche LLP",506,"Deloitte Ltd",5230,Hamilton,D0,BERMUDA,Foreign,10-K,2021-02-26,,"AXIS CAPITAL HOLDINGS LTD",1214816,"=""AXS""","92 PITTS BAY ROAD",,PEMBROKE,D0,BERMUDA,Foreign,,,"=""6331""","Fire, Marine, and Casualty Insurance",524126,"Direct Property and Casualty Insurance Carriers",34,50,12/29/20,"4,240,509,952",12/31/20,"4,841,954,000","-120,424,000","4,975,260,000","25,877,687,000"
7919,Inventory,"Inventory – Valuation Associated with Excess and Obsolete (E&O) Inventory — Refer to Notes 3 and 4 to the financial statements",445111,12/31/20,03/01/21,3,"Deloitte & Touche LLP",,,,Miami,FL,FLORIDA,"US Southeast",10-K,2021-03-01,,"Axogen, Inc.",805928,"=""AXGN""","13631 PROGRESS BLVD.","SUITE 400",ALACHUA,FL,FLORIDA,"US Southeast",,,"=""3845""","Electromedical and Electrotherapeutic Apparatus",325412,"Pharmaceutical Preparation Manufacturing",34,18,12/31/20,"727,075,904",12/31/20,"112,300,000","-23,786,000","121,095,000","201,381,000"
7629,"Other debt","Accounting for the Hercules Capital, Inc. warrants",445420,12/31/20,03/01/21,2,"Ernst & Young LLP",,,,"New York",NY,"NEW YORK","US Mid Atlantic",10-K,2021-03-01,,"Axsome Therapeutics, Inc.",1579428,"=""AXSM""","ONE WORLD TRADE CENTER, 29TH FLOOR",,"NEW YORK",NY,"NEW YORK","US Mid Atlantic",,,"=""2834""","Pharmaceutical Preparations",325412,"Pharmaceutical Preparation Manufacturing",34,81,12/31/20,"3,044,867,072",12/31/20,,"-102,900,600",,"186,134,323"
4666,Goodwill,"Goodwill Impairment Assessment – GENEWIZ Reporting Unit",435748,09/30/20,11/18/20,1,"PricewaterhouseCoopers LLP",,,,Boston,MA,MASSACHUSETTS,"US New England",10-K,2020-11-18,,"Azenta, Inc.",933974,"=""AZTA""","200 SUMMIT DRIVE","6TH FLOOR",BURLINGTON,MA,MASSACHUSETTS,"US New England",,,"=""3559""","Special  Industry Machinery, NEC",333298,"All Other Industrial Machinery Manufacturing",34,47,10/02/20,"3,477,058,048",09/30/20,"897,273,000","64,853,000","493,753,000","1,559,125,000"
11521,Leases,"Maintenance reserve deposits",455107,12/31/20,04/30/21,2,"Ernst & Young LLP",34,"Ernst & Young Auditores Independentes SS",1448,"São Paulo",D5,BRAZIL,Foreign,20-F,2021-04-30,,"AZUL SA",1432364,"=""AZULQ""","AV. MARCOS PENTEADO ULHOA RODRIGUES","NO. 939, 9 FLOOR, ED. JATOBA",BARUERI,D5,BRAZIL,Foreign,,,"=""4512""","Air Transportation, Scheduled",481111,"Scheduled Passenger Air Transportation",34,22,12/29/20,"2,390,467,840",12/31/20,"1,105,873,000","-2,085,924,000","-2,949,255,000","3,040,787,000"
11522,"Going concern","Assessment of the impacts of the COVID-19 pandemic",455107,12/31/20,04/30/21,2,"Ernst & Young LLP",34,"Ernst & Young Auditores Independentes SS",1448,"São Paulo",D5,BRAZIL,Foreign,20-F,2021-04-30,,"AZUL SA",1432364,"=""AZULQ""","AV. MARCOS PENTEADO ULHOA RODRIGUES","NO. 939, 9 FLOOR, ED. JATOBA",BARUERI,D5,BRAZIL,Foreign,,,"=""4512""","Air Transportation, Scheduled",481111,"Scheduled Passenger Air Transportation",34,22,12/29/20,"2,390,467,840",12/31/20,"1,105,873,000","-2,085,924,000","-2,949,255,000","3,040,787,000"
8216,"Business combinations","Initial measurement of Crisco trademark and customer relationships",445731,01/02/21,03/02/21,4,"KPMG LLP",,,,"Short Hills",NJ,"NEW JERSEY","US Mid Atlantic",10-K,2021-03-02,,"B&G Foods, Inc.",1278027,"=""BGS""","FOUR GATEHALL DRIVE","SUITE 110",PARSIPPANY,NJ,"NEW JERSEY","US Mid Atlantic",,,"=""2000""","Food and Kindred Products",311999,"All Other Miscellaneous Food Manufacturing",34,28,01/04/21,"1,779,804,160",01/02/21,"1,967,909,000","131,988,000","-1,784,196,000","3,767,570,000"
8217,"Other intangible assets","Assessment of the carrying value of a certain indefinite-lived intangible asset",445731,01/02/21,03/02/21,4,"KPMG LLP",,,,"Short Hills",NJ,"NEW JERSEY","US Mid Atlantic",10-K,2021-03-02,,"B&G Foods, Inc.",1278027,"=""BGS""","FOUR GATEHALL DRIVE","SUITE 110",PARSIPPANY,NJ,"NEW JERSEY","US Mid Atlantic",,,"=""2000""","Food and Kindred Products",311999,"All Other Miscellaneous Food Manufacturing",34,28,01/04/21,"1,779,804,160",01/02/21,"1,967,909,000","131,988,000","-1,784,196,000","3,767,570,000"
6195,"Long-lived assets","Impairment reversal of the Masbate Mine long-lived assets",443248,12/31/20,02/23/21,1,"PricewaterhouseCoopers LLP",191,"PricewaterhouseCoopers LLP Chartered Accountants",271,Vancouver,A1,"BRITISH COLUMBIA",Canada,6-K,2021-02-24,,"B2GOLD CORP",1429937,"=""BTG""","PARK PLACE","SUITE 3400 - 666 BURRARD STREET",VANCOUVER,A1,"BRITISH COLUMBIA",Canada,,,"=""1040""","Metal Mining",212221,"Gold Ore Mining",34,6,12/31/20,"5,886,373,888",12/31/20,"1,788,928,000","672,413,000",,"3,362,379,000"
10188,"Long-lived assets","Impairment reversal of the Masbate Mine long-lived assets",451128,12/31/20,02/23/21,1,"PricewaterhouseCoopers LLP",191,"PricewaterhouseCoopers LLP Chartered Accountants",271,Vancouver,A1,"BRITISH COLUMBIA",Canada,40-F,2021-03-30,,"B2GOLD CORP",1429937,"=""BTG""","PARK PLACE","SUITE 3400 - 666 BURRARD STREET",VANCOUVER,A1,"BRITISH COLUMBIA",Canada,,,"=""1040""","Metal Mining",212221,"Gold Ore Mining",34,6,12/31/20,"5,886,373,888",12/31/20,"1,788,928,000","672,413,000",,"3,362,379,000"
8653,"Revenue from customer contracts","Revenue Recognition and Contracts – Refer to Notes 2 and 5 to the financial statements",447304,12/31/20,03/08/21,3,"Deloitte & Touche LLP",,,,Cleveland,OH,OHIO,"US Midwest",10-K,2021-03-08,,"Babcock & Wilcox Enterprises, Inc.",1630805,"=""BW""","1200 E. MARKET STREET, SUITE 650",,AKRON,OH,OHIO,"US Midwest",,,"=""3433""","Heating Equipment, Except Electric and Warm Air Furnaces",333414,"Heating Equipment (except Warm Air Furnaces) Manufacturing",34,4,12/31/20,"191,126,528",12/31/20,"566,317,000","-10,318,000","-410,637,000","591,792,000"
8654,"Other debt","Accounting for A&R Credit Agreement– Refer to Notes 14 and 15 to the financial statements",447304,12/31/20,03/08/21,3,"Deloitte & Touche LLP",,,,Cleveland,OH,OHIO,"US Midwest",10-K,2021-03-08,,"Babcock & Wilcox Enterprises, Inc.",1630805,"=""BW""","1200 E. MARKET STREET, SUITE 650",,AKRON,OH,OHIO,"US Midwest",,,"=""3433""","Heating Equipment, Except Electric and Warm Air Furnaces",333414,"Heating Equipment (except Warm Air Furnaces) Manufacturing",34,4,12/31/20,"191,126,528",12/31/20,"566,317,000","-10,318,000","-410,637,000","591,792,000"
6446,"Warranty liabilities","Warranty and After-Sale Costs Reserve",443626,12/31/20,02/24/21,2,"Ernst & Young LLP",,,,Milwaukee,WI,WISCONSIN,"US Midwest",10-K,2021-02-24,,"BADGER METER INC",9092,"=""BMI""","4545 WEST BROWN DEER ROAD",,MILWAUKEE,WI,WISCONSIN,"US Midwest",,,"=""3824""","Totalizing Fluid Meters and Counting Devices",335313,"Switchgear and Switchboard Apparatus Manufacturing",34,94,12/31/20,"2,741,641,216",12/31/20,"425,544,000","49,343,000","218,953,000","468,380,000"
6447,"Business combinations","Accounting for Acquisitions – Valuation of s::can Messtechnik GmbH Intangible Assets",443626,12/31/20,02/24/21,2,"Ernst & Young LLP",,,,Milwaukee,WI,WISCONSIN,"US Midwest",10-K,2021-02-24,,"BADGER METER INC",9092,"=""BMI""","4545 WEST BROWN DEER ROAD",,MILWAUKEE,WI,WISCONSIN,"US Midwest",,,"=""3824""","Totalizing Fluid Meters and Counting Devices",335313,"Switchgear and Switchboard Apparatus Manufacturing",34,94,12/31/20,"2,741,641,216",12/31/20,"425,544,000","49,343,000","218,953,000","468,380,000"
8753,"Equity investments and joint ventures","Valuation of equity investments accounted for using the measurement alternative",447263,12/31/20,03/09/21,2,"Ernst & Young LLP",211,"Ernst & Young Hua Ming LLP",1408,Beijing,F4,CHINA,Foreign,20-F,2021-03-09,,"Baidu, Inc.",1329099,"=""BIDU""","BAIDU CAMPUS, NO. 10 SHANGDI 10TH STREET","HAIDIAN DISTRICT",BEIJING,F4,CHINA,Foreign,,,"=""7370""","Services-Computer Programming, Data Processing, Etc.",518210,"Data Processing, Hosting, and Related Services",34,195,12/29/20,"53,413,326,848",12/31/20,"16,373,000,000","3,436,000,000","22,712,000,000","50,874,000,000"
8754,"Equity investments and joint ventures","Impairment assessment of equity method investments and equity investments accounted for using the measurement alternative",447263,12/31/20,03/09/21,2,"Ernst & Young LLP",211,"Ernst & Young Hua Ming LLP",1408,Beijing,F4,CHINA,Foreign,20-F,2021-03-09,,"Baidu, Inc.",1329099,"=""BIDU""","BAIDU CAMPUS, NO. 10 SHANGDI 10TH STREET","HAIDIAN DISTRICT",BEIJING,F4,CHINA,Foreign,,,"=""7370""","Services-Computer Programming, Data Processing, Etc.",518210,"Data Processing, Hosting, and Related Services",34,195,12/29/20,"53,413,326,848",12/31/20,"16,373,000,000","3,436,000,000","22,712,000,000","50,874,000,000"
6448,"Equity investments and joint ventures","Valuation of Portfolio Investments—Certain Level 3 Portfolio Investments in Loans, Preferred Equity, and Equity Interests Valued Using Significant Unobservable Inputs Developed by Management",443587,12/31/20,02/24/21,1,"PricewaterhouseCoopers LLP",,,,Boston,MA,MASSACHUSETTS,"US New England",10-K,2021-02-24,,"Bain Capital Specialty Finance, Inc.",1655050,"=""BCSF""","C/O BAIN CAPITAL CREDIT, LP","200 CLARENDON STREET",BOSTON,MA,MASSACHUSETTS,"US New England",,,,,525990,"Other Financial Vehicles",34,12,12/31/20,"783,140,288",12/31/20,"131,151,000","8,278,000",,"2,603,492,000"
6851,"Revenue from customer contracts","Revenue recognition on certain agreements for sales of new products manufactured to unique customer specifications",443935,12/31/20,02/25/21,4,"KPMG LLP",,,,Houston,TX,TEXAS,"US Southwest",10-K,2021-02-25,,"Baker Hughes Co",1701605,"=""BKR""","575 NORTH DAIRY ASHFORD ROAD, SUITE 100",,HOUSTON,TX,TEXAS,"US Southwest",40545,"GENERAL ELECTRIC CO","=""3533""","Oil and Gas Field Machinery and Equipment",333132,"Oil and Gas Field Machinery and Equipment Manufacturing",34,21,12/31/20,"15,095,400,448",12/31/20,"20,705,000,000","-9,940,000,000","2,519,000,000","38,007,000,000"
6852,Goodwill,"Goodwill impairment in the Oilfield Services reporting unit",443935,12/31/20,02/25/21,4,"KPMG LLP",,,,Houston,TX,TEXAS,"US Southwest",10-K,2021-02-25,,"Baker Hughes Co",1701605,"=""BKR""","575 NORTH DAIRY ASHFORD ROAD, SUITE 100",,HOUSTON,TX,TEXAS,"US Southwest",40545,"GENERAL ELECTRIC CO","=""3533""","Oil and Gas Field Machinery and Equipment",333132,"Oil and Gas Field Machinery and Equipment Manufacturing",34,21,12/31/20,"15,095,400,448",12/31/20,"20,705,000,000","-9,940,000,000","2,519,000,000","38,007,000,000"
7008,"Revenue from customer contracts","Revenue recognition on certain agreements for sales of new products manufactured to unique customer specifications",444205,12/31/20,02/25/21,4,"KPMG LLP",,,,Houston,TX,TEXAS,"US Southwest",10-K,2021-02-25,,"Baker Hughes Holdings LLC",808362,,"575 NORTH DAIRY ASHFORD ROAD, SUITE 100",,HOUSTON,TX,TEXAS,"US Southwest",40545,"GENERAL ELECTRIC CO","=""3533""","Oil and Gas Field Machinery and Equipment",333131,"Mining Machinery and Equipment Manufacturing",34,,,,12/31/20,"20,705,000,000","-15,825,000,000","7,895,000,000","37,929,000,000"
7009,Goodwill,"Goodwill impairment in the Oilfield Services reporting unit",444205,12/31/20,02/25/21,4,"KPMG LLP",,,,Houston,TX,TEXAS,"US Southwest",10-K,2021-02-25,,"Baker Hughes Holdings LLC",808362,,"575 NORTH DAIRY ASHFORD ROAD, SUITE 100",,HOUSTON,TX,TEXAS,"US Southwest",40545,"GENERAL ELECTRIC CO","=""3533""","Oil and Gas Field Machinery and Equipment",333131,"Mining Machinery and Equipment Manufacturing",34,,,,12/31/20,"20,705,000,000","-15,825,000,000","7,895,000,000","37,929,000,000"
5469,"Revenue from customer contracts","Revenue Recognition - Estimated Costs at Completion for Aerospace Fixed-Price Contract",442052,12/31/20,02/17/21,1,"PricewaterhouseCoopers LLP",,,,Denver,CO,COLORADO,"US West",10-K,2021-02-17,,"BALL Corp",9389,"=""BALL""","9200 W. 108TH CIRCLE",,WESTMINSTER,CO,COLORADO,"US West",,,"=""3411""","Metal Cans",322215,"Nonfolding Sanitary Food Container Manufacturing",34,92,12/29/20,"30,172,780,544",12/31/20,"11,781,000,000","585,000,000","-3,092,000,000","18,252,000,000"
8978,"Revenue from customer contracts","Estimated costs to complete engineering and technology transfer services for long-term fixed-price contracts",448305,12/31/20,03/10/21,4,"KPMG LLP",187,"KPMG LLP Chartered Accountants",85,Vancouver,A1,"BRITISH COLUMBIA",Canada,40-F,2021-03-11,,"Ballard Power Systems Inc.",1453015,"=""BLDP""","9000 GLENLYON PARKWAY",,BURNABY,A1,"BRITISH COLUMBIA",Canada,,,"=""3620""","Electrical Industrial Apparatus",335999,"All Other Miscellaneous Electrical Equipment and Component Manufacturing",34,22,12/29/20,"5,154,217,472",12/31/20,"103,877,000","-51,377,000","856,846,000","975,599,000"
11491,"Revenue from customer contracts","Estimated costs to complete engineering and technology transfer services for long-term fixed-price contracts",455247,12/31/20,03/10/21,4,"KPMG LLP",187,"KPMG LLP Chartered Accountants",85,Vancouver,A1,"BRITISH COLUMBIA",Canada,6-K,2021-04-29,,"Ballard Power Systems Inc.",1453015,"=""BLDP""","9000 GLENLYON PARKWAY",,BURNABY,A1,"BRITISH COLUMBIA",Canada,,,"=""3620""","Electrical Industrial Apparatus",335999,"All Other Miscellaneous Electrical Equipment and Component Manufacturing",34,22,12/29/20,"5,154,217,472",12/31/20,"103,877,000","-51,377,000","856,846,000","975,599,000"
8786,Goodwill,"Goodwill — All Reporting Units — Refer to Notes 2 and 7 to the financial statements",448165,12/31/20,03/10/21,3,"Deloitte & Touche LLP",,,,Parsippany,NJ,"NEW JERSEY","US Mid Atlantic",10-K,2021-03-10,,"Bally's Corp",1747079,"=""BALY""","100 WESTMINSTER STREET",,PROVIDENCE,RI,"RHODE ISLAND","US New England",,,"=""7011""","Hotels and Motels",721120,"Casino Hotels",34,50,12/31/20,"1,541,354,624",12/31/20,"372,792,000","-5,487,000","-523,776,000","1,929,855,000"
8787,"Business combinations","Acquisitions – Black Hawk Casinos, Casino KC and Casino Vicksburg, Bally’s Atlantic City & Eldorado Resort Casino Shreveport – Acquired Intangible Assets — Refer to Note 2 and Note 5 to the financial statements",448165,12/31/20,03/10/21,3,"Deloitte & Touche LLP",,,,Parsippany,NJ,"NEW JERSEY","US Mid Atlantic",10-K,2021-03-10,,"Bally's Corp",1747079,"=""BALY""","100 WESTMINSTER STREET",,PROVIDENCE,RI,"RHODE ISLAND","US New England",,,"=""7011""","Hotels and Motels",721120,"Casino Hotels",34,50,12/31/20,"1,541,354,624",12/31/20,"372,792,000","-5,487,000","-523,776,000","1,929,855,000"
8788,"Business combinations","Sinclair Agreement – Refer to Note 9 to the financial statements",448165,12/31/20,03/10/21,3,"Deloitte & Touche LLP",,,,Parsippany,NJ,"NEW JERSEY","US Mid Atlantic",10-K,2021-03-10,,"Bally's Corp",1747079,"=""BALY""","100 WESTMINSTER STREET",,PROVIDENCE,RI,"RHODE ISLAND","US New England",,,"=""7011""","Hotels and Motels",721120,"Casino Hotels",34,50,12/31/20,"1,541,354,624",12/31/20,"372,792,000","-5,487,000","-523,776,000","1,929,855,000"
6371,"Regulatory assets and liabilities","Accounting for the Effects of Rate Regulation",443405,12/31/20,02/24/21,1,"PricewaterhouseCoopers LLP",,,,Baltimore,MD,MARYLAND,"US Mid Atlantic",10-K,2021-02-24,,"BALTIMORE GAS & ELECTRIC CO",9466,,"2 CENTER PLAZA","110 W. FAYETTE STREET",BALTIMORE,MD,MARYLAND,"US Mid Atlantic",1004440,"CONSTELLATION ENERGY GROUP INC","=""4931""","Electric and Other Services Combined",221122,"Electric Power Distribution",34,,,,12/31/20,"3,098,000,000","349,000,000",,"11,650,000,000"
7164,"Allowance for credit losses","Allowance for Credit Losses",444798,12/31/20,02/26/21,2,"Ernst & Young LLP",,,,Irvine,CA,CALIFORNIA,"US West",10-K,2021-02-26,,"BANC OF CALIFORNIA, INC.",1169770,"=""BANC""","3 MACARTHUR PLACE",,"SANTA ANA",CA,CALIFORNIA,"US West",,,"=""6021""","National Commercial Banks",522120,"Savings Institutions",34,15,12/31/20,"732,079,744",12/31/20,"213,393,000","12,574,000","857,430,000","7,877,334,000"
11022,"Allowance for credit losses","Provision for expected credit losses on financial assets at amortized cost and at fair value through comprehensive income, loan commitments and financial guarantees",452871,12/31/20,04/15/21,4,"KPMG LLP",466,KPMG,1410,"Buenos Aires",C1,ARGENTINA,Foreign,20-F,2021-04-15,,"Banco BBVA Argentina S.A.",913059,"=""BBAR""","AV. CORDOBA 111",,"BUENOS AIRES",C1,ARGENTINA,Foreign,,,"=""6029""","Commercial Banks, NEC",522110,"Commercial Banking",34,3,12/29/20,"673,981,056",12/31/20,"1,453,476,000","119,767,000","1,989,814,000","12,442,724,000"
11023,"Other investments","Measurement of fair value of difficult-to-value financial instruments",452871,12/31/20,04/15/21,4,"KPMG LLP",466,KPMG,1410,"Buenos Aires",C1,ARGENTINA,Foreign,20-F,2021-04-15,,"Banco BBVA Argentina S.A.",913059,"=""BBAR""","AV. CORDOBA 111",,"BUENOS AIRES",C1,ARGENTINA,Foreign,,,"=""6029""","Commercial Banks, NEC",522110,"Commercial Banking",34,3,12/29/20,"673,981,056",12/31/20,"1,453,476,000","119,767,000","1,989,814,000","12,442,724,000"
7366,"Allowance for credit losses","Expected credit losses related to loans and advances",444745,12/31/20,02/26/21,4,"KPMG LLP",330,"KPMG Auditores SL",1027,Madrid,U3,SPAIN,Foreign,20-F,2021-02-26,,"BANCO BILBAO VIZCAYA ARGENTARIA, S.A.",842180,"=""BBVA""","CALLE AZUL 4",,BILBOA,U3,SPAIN,Foreign,,,"=""6029""","Commercial Banks, NEC",522110,"Commercial Banking",33,5,12/29/20,"33,006,039,040",12/31/20,"21,900,000,000","2,939,000,000","159,560,000,000","900,757,000,000"
7367,"Other investments","Measurement of fair value of certain difficult-to-value financial instruments",444745,12/31/20,02/26/21,4,"KPMG LLP",330,"KPMG Auditores SL",1027,Madrid,U3,SPAIN,Foreign,20-F,2021-02-26,,"BANCO BILBAO VIZCAYA ARGENTARIA, S.A.",842180,"=""BBVA""","CALLE AZUL 4",,BILBOA,U3,SPAIN,Foreign,,,"=""6029""","Commercial Banks, NEC",522110,"Commercial Banking",33,5,12/29/20,"33,006,039,040",12/31/20,"21,900,000,000","2,939,000,000","159,560,000,000","900,757,000,000"
11950,"Allowance for credit losses","Expected credit losses related to loans and advances",457462,12/31/20,02/26/21,4,"KPMG LLP",330,"KPMG Auditores SL",1027,Madrid,U3,SPAIN,Foreign,6-K,2021-06-02,,"BANCO BILBAO VIZCAYA ARGENTARIA, S.A.",842180,"=""BBVA""","CALLE AZUL 4",,BILBOA,U3,SPAIN,Foreign,,,"=""6029""","Commercial Banks, NEC",522110,"Commercial Banking",33,5,12/29/20,"33,006,039,040",12/31/20,"21,900,000,000","2,939,000,000","159,560,000,000","900,757,000,000"
11951,"Other investments","Measurement of fair value of certain difficult-to-value financial instruments",457462,12/31/20,02/26/21,4,"KPMG LLP",330,"KPMG Auditores SL",1027,Madrid,U3,SPAIN,Foreign,6-K,2021-06-02,,"BANCO BILBAO VIZCAYA ARGENTARIA, S.A.",842180,"=""BBVA""","CALLE AZUL 4",,BILBOA,U3,SPAIN,Foreign,,,"=""6029""","Commercial Banks, NEC",522110,"Commercial Banking",33,5,12/29/20,"33,006,039,040",12/31/20,"21,900,000,000","2,939,000,000","159,560,000,000","900,757,000,000"
11233,"Allowance for credit losses","Expected Credit Loss Allowance for Commercial, Mortgage and Consumer Loans - Collective Basis",453987,12/31/20,04/22/21,1,"PricewaterhouseCoopers LLP",644,"PricewaterhouseCoopers Consultores Auditores SpA",1364,Santiago,F3,CHILE,Foreign,20-F,2021-04-23,,"BANCO ITAU CHILE",1276671,"=""ITCLY""","AV. PRESIDENTE RIESCO 5537",,SANTIAGO,F3,CHILE,Foreign,,,"=""6029""","Commercial Banks, NEC",522110,"Commercial Banking",34,5,12/29/20,"1,653,365,760",12/31/20,"901,000,000","-1,163,000,000","2,245,000,000","49,946,000,000"
11234,Goodwill,"Goodwill Impairment Assessment",453987,12/31/20,04/22/21,1,"PricewaterhouseCoopers LLP",644,"PricewaterhouseCoopers Consultores Auditores SpA",1364,Santiago,F3,CHILE,Foreign,20-F,2021-04-23,,"BANCO ITAU CHILE",1276671,"=""ITCLY""","AV. PRESIDENTE RIESCO 5537",,SANTIAGO,F3,CHILE,Foreign,,,"=""6029""","Commercial Banks, NEC",522110,"Commercial Banking",34,5,12/29/20,"1,653,365,760",12/31/20,"901,000,000","-1,163,000,000","2,245,000,000","49,946,000,000"
11235,"Derivatives and hedging","Valuation of Level 3 - Financial Derivative Contracts",453987,12/31/20,04/22/21,1,"PricewaterhouseCoopers LLP",644,"PricewaterhouseCoopers Consultores Auditores SpA",1364,Santiago,F3,CHILE,Foreign,20-F,2021-04-23,,"BANCO ITAU CHILE",1276671,"=""ITCLY""","AV. PRESIDENTE RIESCO 5537",,SANTIAGO,F3,CHILE,Foreign,,,"=""6029""","Commercial Banks, NEC",522110,"Commercial Banking",34,5,12/29/20,"1,653,365,760",12/31/20,"901,000,000","-1,163,000,000","2,245,000,000","49,946,000,000"
7708,"Allowance for credit losses","Measurement of expected credit losses",444934,12/31/20,02/26/21,1,"PricewaterhouseCoopers LLP",91,"PricewaterhouseCoopers Auditores Independentes",1351,"São Paulo",D5,BRAZIL,Foreign,20-F,2021-02-26,,"Banco Santander (Brasil) S.A.",1471055,"=""BSBR""","AV. JUSCELINO KUBITSCHEK, 2235","AV. JUSCELINO KUBITSCHEK, 2041","SAO PAULO, SP",D5,BRAZIL,Foreign,891478,"Banco Santander, S.A.","=""6029""","Commercial Banks, NEC",522110,"Commercial Banking",34,9,12/29/20,"33,528,141,824",12/31/20,"5,580,990,000","2,530,241,000","13,050,725,000","178,344,301,000"
7709,"Other contingent liabilities","Provisions for judicial and administrative proceedings",444934,12/31/20,02/26/21,1,"PricewaterhouseCoopers LLP",91,"PricewaterhouseCoopers Auditores Independentes",1351,"São Paulo",D5,BRAZIL,Foreign,20-F,2021-02-26,,"Banco Santander (Brasil) S.A.",1471055,"=""BSBR""","AV. JUSCELINO KUBITSCHEK, 2235","AV. JUSCELINO KUBITSCHEK, 2041","SAO PAULO, SP",D5,BRAZIL,Foreign,891478,"Banco Santander, S.A.","=""6029""","Commercial Banks, NEC",522110,"Commercial Banking",34,9,12/29/20,"33,528,141,824",12/31/20,"5,580,990,000","2,530,241,000","13,050,725,000","178,344,301,000"
7149,"Allowance for credit losses","Expected Credit Loss Allowance for Commercial, Mortgage and Consumer Loans – Collective Basis",444728,12/31/20,02/26/21,1,"PricewaterhouseCoopers LLP",644,"PricewaterhouseCoopers Consultores Auditores SpA",1364,Santiago,F3,CHILE,Foreign,20-F,2021-02-26,,"BANCO SANTANDER CHILE",1027552,"=""BSAC""","BANDERA 140, PISO 19",,SANTIAGO,F3,CHILE,Foreign,891478,"Banco Santander, S.A.","=""6029""","Commercial Banks, NEC",522293,"International Trade Financing",34,19,12/29/20,"9,167,903,744",12/31/20,"2,164,000,000","778,000,000","4,979,000,000","78,400,000,000"
8588,"Allowance for credit losses","Allowance for Impairment Losses – Macroeconomic and Portfolio Factors Impacting the Downside Scenario of the Forward-Looking Analysis and the Calculation of the Macroeconomic Overlay",446229,12/31/20,03/04/21,1,"PricewaterhouseCoopers LLP",107,"PricewaterhouseCoopers SC",1128,"Mexico City",O5,MEXICO,Foreign,20-F,2021-03-05,,"Banco Santander Mexico S.A., Institucion de Banca Multiple, Grupo Financiero Santander Mexico",1698287,"=""BSMX""","PROLONGACION PASEO DE LA REFORMA NO. 500","PISO 2, MODULO 206",MEXICO,O5,MEXICO,Foreign,,,"=""6029""","Commercial Banks, NEC",522110,"Commercial Banking",34,5,12/29/20,"3,488,819,456",12/31/20,"-1,556,000,000","-4,266,000,000","7,286,000,000","92,239,000,000"
7584,"Accounts/loans receivable","Estimation of impairment of financial assets at amortised cost– loans and advances to customers",444959,12/31/20,02/26/21,1,"PricewaterhouseCoopers LLP",117,"PricewaterhouseCoopers Auditores SL",1306,Madrid,U3,SPAIN,Foreign,20-F,2021-02-26,,"Banco Santander, S.A.",891478,"=""SAN""","CIUDAD GRUPO SANTANDER","BOADILLA DEL MONTE",MADRID,U3,SPAIN,Foreign,,,"=""6029""","Commercial Banks, NEC",522110,"Commercial Banking",34,3,12/29/20,"54,102,892,544",12/31/20,"38,991,000,000","-11,001,000,000","432,293,000,000","1,845,428,000,000"
7585,Goodwill,"Goodwill Impairment Assessment of Certain Cash Generating Units (CGUs)",444959,12/31/20,02/26/21,1,"PricewaterhouseCoopers LLP",117,"PricewaterhouseCoopers Auditores SL",1306,Madrid,U3,SPAIN,Foreign,20-F,2021-02-26,,"Banco Santander, S.A.",891478,"=""SAN""","CIUDAD GRUPO SANTANDER","BOADILLA DEL MONTE",MADRID,U3,SPAIN,Foreign,,,"=""6029""","Commercial Banks, NEC",522110,"Commercial Banking",34,3,12/29/20,"54,102,892,544",12/31/20,"38,991,000,000","-11,001,000,000","432,293,000,000","1,845,428,000,000"
7586,"Deferred income taxes","Recoverability of deferred tax assets – Spain and Brazil",444959,12/31/20,02/26/21,1,"PricewaterhouseCoopers LLP",117,"PricewaterhouseCoopers Auditores SL",1306,Madrid,U3,SPAIN,Foreign,20-F,2021-02-26,,"Banco Santander, S.A.",891478,"=""SAN""","CIUDAD GRUPO SANTANDER","BOADILLA DEL MONTE",MADRID,U3,SPAIN,Foreign,,,"=""6029""","Commercial Banks, NEC",522110,"Commercial Banking",34,3,12/29/20,"54,102,892,544",12/31/20,"38,991,000,000","-11,001,000,000","432,293,000,000","1,845,428,000,000"
7587,"Other contingent liabilities","Provisions for contingent liabilities",444959,12/31/20,02/26/21,1,"PricewaterhouseCoopers LLP",117,"PricewaterhouseCoopers Auditores SL",1306,Madrid,U3,SPAIN,Foreign,20-F,2021-02-26,,"Banco Santander, S.A.",891478,"=""SAN""","CIUDAD GRUPO SANTANDER","BOADILLA DEL MONTE",MADRID,U3,SPAIN,Foreign,,,"=""6029""","Commercial Banks, NEC",522110,"Commercial Banking",34,3,12/29/20,"54,102,892,544",12/31/20,"38,991,000,000","-11,001,000,000","432,293,000,000","1,845,428,000,000"
10887,"Accounts/loans receivable","Estimation of impairment of financial assets at amortised cost– loans and advances to customers",452791,12/31/20,02/26/21,1,"PricewaterhouseCoopers LLP",117,"PricewaterhouseCoopers Auditores SL",1306,Madrid,U3,SPAIN,Foreign,6-K,2021-04-14,,"Banco Santander, S.A.",891478,"=""SAN""","CIUDAD GRUPO SANTANDER","BOADILLA DEL MONTE",MADRID,U3,SPAIN,Foreign,,,"=""6029""","Commercial Banks, NEC",522110,"Commercial Banking",34,3,12/29/20,"54,102,892,544",12/31/20,"38,991,000,000","-11,001,000,000","432,293,000,000","1,845,428,000,000"
10888,Goodwill,"Goodwill Impairment Assessment of Certain Cash Generating Units (CGUs)",452791,12/31/20,02/26/21,1,"PricewaterhouseCoopers LLP",117,"PricewaterhouseCoopers Auditores SL",1306,Madrid,U3,SPAIN,Foreign,6-K,2021-04-14,,"Banco Santander, S.A.",891478,"=""SAN""","CIUDAD GRUPO SANTANDER","BOADILLA DEL MONTE",MADRID,U3,SPAIN,Foreign,,,"=""6029""","Commercial Banks, NEC",522110,"Commercial Banking",34,3,12/29/20,"54,102,892,544",12/31/20,"38,991,000,000","-11,001,000,000","432,293,000,000","1,845,428,000,000"
10889,"Deferred income taxes","Recoverability of deferred tax assets – Spain and Brazil",452791,12/31/20,02/26/21,1,"PricewaterhouseCoopers LLP",117,"PricewaterhouseCoopers Auditores SL",1306,Madrid,U3,SPAIN,Foreign,6-K,2021-04-14,,"Banco Santander, S.A.",891478,"=""SAN""","CIUDAD GRUPO SANTANDER","BOADILLA DEL MONTE",MADRID,U3,SPAIN,Foreign,,,"=""6029""","Commercial Banks, NEC",522110,"Commercial Banking",34,3,12/29/20,"54,102,892,544",12/31/20,"38,991,000,000","-11,001,000,000","432,293,000,000","1,845,428,000,000"
10890,"Other contingent liabilities","Provisions for contingent liabilities",452791,12/31/20,02/26/21,1,"PricewaterhouseCoopers LLP",117,"PricewaterhouseCoopers Auditores SL",1306,Madrid,U3,SPAIN,Foreign,6-K,2021-04-14,,"Banco Santander, S.A.",891478,"=""SAN""","CIUDAD GRUPO SANTANDER","BOADILLA DEL MONTE",MADRID,U3,SPAIN,Foreign,,,"=""6029""","Commercial Banks, NEC",522110,"Commercial Banking",34,3,12/29/20,"54,102,892,544",12/31/20,"38,991,000,000","-11,001,000,000","432,293,000,000","1,845,428,000,000"
11210,"Allowance for credit losses","Allowance for loans, advances and lease losses",453710,12/31/20,04/22/21,1,"PricewaterhouseCoopers LLP",812,"PwC Contadores y Auditores Ltda",6466,Medellin,F8,COLOMBIA,Foreign,20-F,2021-04-23,,"BANCOLOMBIA SA",1071371,,"AVENIDA LOS INDUSTRIALES","CARRERA 48 # 26 -85",MEDELLIN,F8,COLOMBIA,Foreign,,,"=""6029""","Commercial Banks, NEC",522110,"Commercial Banking",34,41,12/29/20,"4,578,869,760",12/31/20,"2,428,000,000","92,000,000","5,566,000,000","74,717,000,000"
11211,Goodwill,"Goodwill Impairment Assessment",453710,12/31/20,04/22/21,1,"PricewaterhouseCoopers LLP",812,"PwC Contadores y Auditores Ltda",6466,Medellin,F8,COLOMBIA,Foreign,20-F,2021-04-23,,"BANCOLOMBIA SA",1071371,,"AVENIDA LOS INDUSTRIALES","CARRERA 48 # 26 -85",MEDELLIN,F8,COLOMBIA,Foreign,,,"=""6029""","Commercial Banks, NEC",522110,"Commercial Banking",34,41,12/29/20,"4,578,869,760",12/31/20,"2,428,000,000","92,000,000","5,566,000,000","74,717,000,000"
8144,"Revenue from customer contracts","Revenue Recognition",445033,12/31/20,03/01/21,2,"Ernst & Young LLP",,,,Raleigh,NC,"NORTH CAROLINA","US Southeast",10-K,2021-03-01,,"Bandwidth Inc.",1514416,"=""BAND""","2230 BANDMATE WAY",,RALEIGH,NC,"NORTH CAROLINA","US Southeast",,,"=""7372""","Prepackaged Software",511210,"Software Publishers",34,154,12/31/20,"3,444,206,336",12/31/20,"343,113,000","-43,977,000","-190,371,000","890,608,000"
8145,"Business combinations","Business Combination",445033,12/31/20,03/01/21,2,"Ernst & Young LLP",,,,Raleigh,NC,"NORTH CAROLINA","US Southeast",10-K,2021-03-01,,"Bandwidth Inc.",1514416,"=""BAND""","2230 BANDMATE WAY",,RALEIGH,NC,"NORTH CAROLINA","US Southeast",,,"=""7372""","Prepackaged Software",511210,"Software Publishers",34,154,12/31/20,"3,444,206,336",12/31/20,"343,113,000","-43,977,000","-190,371,000","890,608,000"
11478,"Allowance for credit losses","Assessment of the allowance for expected credit losses on loans and advances to customers, loan commitments, financial guarantees, financial assets at fair value through other comprehensive income and securities at amortized cost",454866,12/31/20,04/29/21,4,"KPMG LLP",61,"KPMG Auditores Independentes",1124,Osasco,D5,BRAZIL,Foreign,20-F,2021-04-30,,"BANK BRADESCO",1160330,"=""BBD""","CIDADE DE DEUS S/N VILA YARA",OSASCO,"SAO PAULO",D5,BRAZIL,Foreign,,,"=""6022""","State Commercial Banks",522110,"Commercial Banking",34,5,12/29/20,"19,357,270,016",12/31/20,"12,094,898,000","3,086,897,000","25,210,957,000","308,931,845,000"
11479,"Other contingent liabilities","Evaluation of the measurement of provisions and the disclosure of contingent liabilities - tax, civil and labor lawsuits",454866,12/31/20,04/29/21,4,"KPMG LLP",61,"KPMG Auditores Independentes",1124,Osasco,D5,BRAZIL,Foreign,20-F,2021-04-30,,"BANK BRADESCO",1160330,"=""BBD""","CIDADE DE DEUS S/N VILA YARA",OSASCO,"SAO PAULO",D5,BRAZIL,Foreign,,,"=""6022""","State Commercial Banks",522110,"Commercial Banking",34,5,12/29/20,"19,357,270,016",12/31/20,"12,094,898,000","3,086,897,000","25,210,957,000","308,931,845,000"
11480,"Deferred income taxes","Assessment of the recoverability of deferred tax assets arising from carry-forward tax losses",454866,12/31/20,04/29/21,4,"KPMG LLP",61,"KPMG Auditores Independentes",1124,Osasco,D5,BRAZIL,Foreign,20-F,2021-04-30,,"BANK BRADESCO",1160330,"=""BBD""","CIDADE DE DEUS S/N VILA YARA",OSASCO,"SAO PAULO",D5,BRAZIL,Foreign,,,"=""6022""","State Commercial Banks",522110,"Commercial Banking",34,5,12/29/20,"19,357,270,016",12/31/20,"12,094,898,000","3,086,897,000","25,210,957,000","308,931,845,000"
11481,"Goodwill and intangible assets","Evaluation of the impairment testing of goodwill and intangible assets",454866,12/31/20,04/29/21,4,"KPMG LLP",61,"KPMG Auditores Independentes",1124,Osasco,D5,BRAZIL,Foreign,20-F,2021-04-30,,"BANK BRADESCO",1160330,"=""BBD""","CIDADE DE DEUS S/N VILA YARA",OSASCO,"SAO PAULO",D5,BRAZIL,Foreign,,,"=""6022""","State Commercial Banks",522110,"Commercial Banking",34,5,12/29/20,"19,357,270,016",12/31/20,"12,094,898,000","3,086,897,000","25,210,957,000","308,931,845,000"
11482,"Insurance contract liabilities","Evaluation of the measurement of insurance and pension plan technical provisions",454866,12/31/20,04/29/21,4,"KPMG LLP",61,"KPMG Auditores Independentes",1124,Osasco,D5,BRAZIL,Foreign,20-F,2021-04-30,,"BANK BRADESCO",1160330,"=""BBD""","CIDADE DE DEUS S/N VILA YARA",OSASCO,"SAO PAULO",D5,BRAZIL,Foreign,,,"=""6022""","State Commercial Banks",522110,"Commercial Banking",34,5,12/29/20,"19,357,270,016",12/31/20,"12,094,898,000","3,086,897,000","25,210,957,000","308,931,845,000"
6496,"Allowance for credit losses","Allowance for Loan and Lease Losses - Commercial and Consumer Card Loans",443641,12/31/20,02/24/21,1,"PricewaterhouseCoopers LLP",,,,Charlotte,NC,"NORTH CAROLINA","US Southeast",10-K,2021-02-24,,"BANK OF AMERICA CORP /DE/",70858,"=""BAC""","BANK OF AMERICA CORPORATE CENTER","100 N TRYON ST",CHARLOTTE,NC,"NORTH CAROLINA","US Southeast",,,"=""6021""","National Commercial Banks",522110,"Commercial Banking",34,30,12/31/20,"262,206,177,280",12/31/20,"74,208,000,000","17,894,000,000","203,973,000,000","2,819,627,000,000"
6497,"Other investments","Valuation of Certain Level 3 Financial Instruments",443641,12/31/20,02/24/21,1,"PricewaterhouseCoopers LLP",,,,Charlotte,NC,"NORTH CAROLINA","US Southeast",10-K,2021-02-24,,"BANK OF AMERICA CORP /DE/",70858,"=""BAC""","BANK OF AMERICA CORPORATE CENTER","100 N TRYON ST",CHARLOTTE,NC,"NORTH CAROLINA","US Southeast",,,"=""6021""","National Commercial Banks",522110,"Commercial Banking",34,30,12/31/20,"262,206,177,280",12/31/20,"74,208,000,000","17,894,000,000","203,973,000,000","2,819,627,000,000"
11502,"Allowance for credit losses","Allowance for loan losses",455199,12/31/20,04/29/21,2,"Ernst & Young LLP",636,"EY Servicios Profesionales de Auditoría y Asesorías SpA (EY Audit SpA)",1431,Santiago,F3,CHILE,Foreign,20-F,2021-04-30,,"BANK OF CHILE",1161125,"=""BCH""","PASEO AHUMADA 251",,SANTIAGO,F3,CHILE,Foreign,,,"=""6029""","Commercial Banks, NEC",522110,"Commercial Banking",34,20,12/31/20,"10,293,640,554",12/31/20,"2,645,023,561","631,356,756",,"62,972,897,031"
7743,"Allowance for credit losses","Allowance for Credit Losses – Loans and Leases",445458,12/31/20,03/01/21,2,"Ernst & Young LLP",,,,Honolulu,HI,HAWAII,"US West",10-K,2021-03-01,,"BANK OF HAWAII CORP",46195,"=""BOH""","130 MERCHANT STREET",,HONOLULU,HI,HAWAII,"US West",,,"=""6022""","State Commercial Banks",522110,"Commercial Banking",34,77,12/31/20,"3,073,941,760",12/31/20,"562,931,000","153,804,000","1,342,990,000","20,603,651,000"
4782,"Allowance for credit losses","Assessment of the Allowances for Credit Losses for Loans",436472,10/31/20,12/01/20,4,"KPMG LLP",187,"KPMG LLP Chartered Accountants",85,Toronto,A6,ONTARIO,Canada,6-K,2020-12-01,,"BANK OF MONTREAL /CAN/",927971,"=""BMO""","FIRST CANADIAN PLACE",*,TORONTO,A6,ONTARIO,Canada,,,"=""6029""","Commercial Banks, NEC",521110,"Monetary Authorities - Central Bank",34,60,11/02/20,"38,424,252,416",10/31/20,"15,393,000,000","3,823,000,000","35,711,000,000","711,937,000,000"
4783,"Other investments","Assessment of the Measurement of the Fair Value of Certain Securities",436472,10/31/20,12/01/20,4,"KPMG LLP",187,"KPMG LLP Chartered Accountants",85,Toronto,A6,ONTARIO,Canada,6-K,2020-12-01,,"BANK OF MONTREAL /CAN/",927971,"=""BMO""","FIRST CANADIAN PLACE",*,TORONTO,A6,ONTARIO,Canada,,,"=""6029""","Commercial Banks, NEC",521110,"Monetary Authorities - Central Bank",34,60,11/02/20,"38,424,252,416",10/31/20,"15,393,000,000","3,823,000,000","35,711,000,000","711,937,000,000"
4784,"Uncertain tax positions","Assessment of Income Tax Uncertainties",436472,10/31/20,12/01/20,4,"KPMG LLP",187,"KPMG LLP Chartered Accountants",85,Toronto,A6,ONTARIO,Canada,6-K,2020-12-01,,"BANK OF MONTREAL /CAN/",927971,"=""BMO""","FIRST CANADIAN PLACE",*,TORONTO,A6,ONTARIO,Canada,,,"=""6029""","Commercial Banks, NEC",521110,"Monetary Authorities - Central Bank",34,60,11/02/20,"38,424,252,416",10/31/20,"15,393,000,000","3,823,000,000","35,711,000,000","711,937,000,000"
4785,"Insurance contract liabilities","Assessment of Insurance-related Liabilities",436472,10/31/20,12/01/20,4,"KPMG LLP",187,"KPMG LLP Chartered Accountants",85,Toronto,A6,ONTARIO,Canada,6-K,2020-12-01,,"BANK OF MONTREAL /CAN/",927971,"=""BMO""","FIRST CANADIAN PLACE",*,TORONTO,A6,ONTARIO,Canada,,,"=""6029""","Commercial Banks, NEC",521110,"Monetary Authorities - Central Bank",34,60,11/02/20,"38,424,252,416",10/31/20,"15,393,000,000","3,823,000,000","35,711,000,000","711,937,000,000"
4793,"Allowance for credit losses","Assessment of the Allowances for Credit Losses for Loans ",436494,10/31/20,12/01/20,4,"KPMG LLP",187,"KPMG LLP Chartered Accountants",85,Toronto,A6,ONTARIO,Canada,40-F,2020-12-01,,"BANK OF MONTREAL /CAN/",927971,"=""BMO""","FIRST CANADIAN PLACE",*,TORONTO,A6,ONTARIO,Canada,,,"=""6029""","Commercial Banks, NEC",521110,"Monetary Authorities - Central Bank",34,60,11/02/20,"38,424,252,416",10/31/20,"15,393,000,000","3,823,000,000","35,711,000,000","711,937,000,000"
4794,"Other investments","Assessment of the Measurement of the Fair Value of Certain Securities",436494,10/31/20,12/01/20,4,"KPMG LLP",187,"KPMG LLP Chartered Accountants",85,Toronto,A6,ONTARIO,Canada,40-F,2020-12-01,,"BANK OF MONTREAL /CAN/",927971,"=""BMO""","FIRST CANADIAN PLACE",*,TORONTO,A6,ONTARIO,Canada,,,"=""6029""","Commercial Banks, NEC",521110,"Monetary Authorities - Central Bank",34,60,11/02/20,"38,424,252,416",10/31/20,"15,393,000,000","3,823,000,000","35,711,000,000","711,937,000,000"
4795,"Uncertain tax positions","Assessment of Income Tax Uncertainties",436494,10/31/20,12/01/20,4,"KPMG LLP",187,"KPMG LLP Chartered Accountants",85,Toronto,A6,ONTARIO,Canada,40-F,2020-12-01,,"BANK OF MONTREAL /CAN/",927971,"=""BMO""","FIRST CANADIAN PLACE",*,TORONTO,A6,ONTARIO,Canada,,,"=""6029""","Commercial Banks, NEC",521110,"Monetary Authorities - Central Bank",34,60,11/02/20,"38,424,252,416",10/31/20,"15,393,000,000","3,823,000,000","35,711,000,000","711,937,000,000"
4796,"Insurance contract liabilities","Assessment of Insurance-related Liabilities",436494,10/31/20,12/01/20,4,"KPMG LLP",187,"KPMG LLP Chartered Accountants",85,Toronto,A6,ONTARIO,Canada,40-F,2020-12-01,,"BANK OF MONTREAL /CAN/",927971,"=""BMO""","FIRST CANADIAN PLACE",*,TORONTO,A6,ONTARIO,Canada,,,"=""6029""","Commercial Banks, NEC",521110,"Monetary Authorities - Central Bank",34,60,11/02/20,"38,424,252,416",10/31/20,"15,393,000,000","3,823,000,000","35,711,000,000","711,937,000,000"
6174,"Allowance for credit losses","Allowance for Credit Losses",443216,12/31/20,02/23/21,1,"PricewaterhouseCoopers LLP",90,"PricewaterhouseCoopers Ltd",1403,Hamilton,D0,BERMUDA,Foreign,20-F,2021-02-23,,"Bank of N.T. Butterfield & Son Ltd",1653242,"=""NTB""","65 FRONT STREET",,HAMILTON,D0,BERMUDA,Foreign,,,"=""6029""","Commercial Banks, NEC",522110,"Commercial Banking",34,31,12/29/20,"1,645,810,688",12/31/20,"494,189,000","147,217,000","889,129,000","14,738,634,000"
7045,"Allowance for credit losses","Quantitative component of BNY Mellon’s pooled allowance for credit losses for loans and lending-related commitments related to higher risk-rated credits and pass-rated credits",443760,12/31/20,02/25/21,4,"KPMG LLP",,,,"New York",NY,"NEW YORK","US Mid Atlantic",10-K,2021-02-25,,"Bank of New York Mellon Corp",1390777,"=""BK""","240 GREENWICH STREET",,"NEW YORK",NY,"NEW YORK","US Mid Atlantic",,,"=""6022""","State Commercial Banks",522110,"Commercial Banking",34,42,12/31/20,"37,634,244,608",12/31/20,"15,439,000,000","3,617,000,000","25,469,000,000","469,633,000,000"
7046,"Other contingent liabilities","Identification and measurement of accruals for litigation and regulatory contingencies",443760,12/31/20,02/25/21,4,"KPMG LLP",,,,"New York",NY,"NEW YORK","US Mid Atlantic",10-K,2021-02-25,,"Bank of New York Mellon Corp",1390777,"=""BK""","240 GREENWICH STREET",,"NEW YORK",NY,"NEW YORK","US Mid Atlantic",,,"=""6022""","State Commercial Banks",522110,"Commercial Banking",34,42,12/31/20,"37,634,244,608",12/31/20,"15,439,000,000","3,617,000,000","25,469,000,000","469,633,000,000"
4787,"Allowance for credit losses","(i) Assessment of Allowance for Credit Losses on Financial Assets (ACL)",436484,10/31/20,12/01/20,4,"KPMG LLP",187,"KPMG LLP Chartered Accountants",85,Toronto,A6,ONTARIO,Canada,6-K,2020-12-01,,"BANK OF NOVA SCOTIA",9631,"=""BNS""","40 TEMPERANCE STREET",,TORONTO,A6,ONTARIO,Canada,,,"=""6022""","State Commercial Banks",522110,"Commercial Banking",34,42,10/31/20,"50,349,080,576",10/31/20,"18,939,000,000","5,083,000,000","38,334,000,000","852,339,000,000"
4788,"Other investments","(ii) Assessment of the Measurement of Fair Value of Certain Financial Instruments",436484,10/31/20,12/01/20,4,"KPMG LLP",187,"KPMG LLP Chartered Accountants",85,Toronto,A6,ONTARIO,Canada,6-K,2020-12-01,,"BANK OF NOVA SCOTIA",9631,"=""BNS""","40 TEMPERANCE STREET",,TORONTO,A6,ONTARIO,Canada,,,"=""6022""","State Commercial Banks",522110,"Commercial Banking",34,42,10/31/20,"50,349,080,576",10/31/20,"18,939,000,000","5,083,000,000","38,334,000,000","852,339,000,000"
4789,"Uncertain tax positions","(iii) Assessment of Uncertain Tax Provisions",436484,10/31/20,12/01/20,4,"KPMG LLP",187,"KPMG LLP Chartered Accountants",85,Toronto,A6,ONTARIO,Canada,6-K,2020-12-01,,"BANK OF NOVA SCOTIA",9631,"=""BNS""","40 TEMPERANCE STREET",,TORONTO,A6,ONTARIO,Canada,,,"=""6022""","State Commercial Banks",522110,"Commercial Banking",34,42,10/31/20,"50,349,080,576",10/31/20,"18,939,000,000","5,083,000,000","38,334,000,000","852,339,000,000"
4790,"Allowance for credit losses","(i) Assessment of Allowance for Credit Losses on Financial Assets (ACL)",436485,10/31/20,12/01/20,4,"KPMG LLP",187,"KPMG LLP Chartered Accountants",85,Toronto,A6,ONTARIO,Canada,6-K,2020-12-01,,"BANK OF NOVA SCOTIA",9631,"=""BNS""","40 TEMPERANCE STREET",,TORONTO,A6,ONTARIO,Canada,,,"=""6022""","State Commercial Banks",522110,"Commercial Banking",34,42,10/31/20,"50,349,080,576",10/31/20,"18,939,000,000","5,083,000,000","38,334,000,000","852,339,000,000"
4791,"Other investments","(ii) Assessment of the Measurement of Fair Value of Certain Financial Instruments",436485,10/31/20,12/01/20,4,"KPMG LLP",187,"KPMG LLP Chartered Accountants",85,Toronto,A6,ONTARIO,Canada,6-K,2020-12-01,,"BANK OF NOVA SCOTIA",9631,"=""BNS""","40 TEMPERANCE STREET",,TORONTO,A6,ONTARIO,Canada,,,"=""6022""","State Commercial Banks",522110,"Commercial Banking",34,42,10/31/20,"50,349,080,576",10/31/20,"18,939,000,000","5,083,000,000","38,334,000,000","852,339,000,000"
4792,"Uncertain tax positions","(iii) Assessment of Uncertain Tax Provisions",436485,10/31/20,12/01/20,4,"KPMG LLP",187,"KPMG LLP Chartered Accountants",85,Toronto,A6,ONTARIO,Canada,6-K,2020-12-01,,"BANK OF NOVA SCOTIA",9631,"=""BNS""","40 TEMPERANCE STREET",,TORONTO,A6,ONTARIO,Canada,,,"=""6022""","State Commercial Banks",522110,"Commercial Banking",34,42,10/31/20,"50,349,080,576",10/31/20,"18,939,000,000","5,083,000,000","38,334,000,000","852,339,000,000"
4800,"Allowance for credit losses","(i) Assessment of Allowance for Credit Losses on Financial Assets (ACL)",436572,10/31/20,12/01/20,4,"KPMG LLP",187,"KPMG LLP Chartered Accountants",85,Toronto,A6,ONTARIO,Canada,40-F,2020-12-01,,"BANK OF NOVA SCOTIA",9631,"=""BNS""","40 TEMPERANCE STREET",,TORONTO,A6,ONTARIO,Canada,,,"=""6022""","State Commercial Banks",522110,"Commercial Banking",34,42,10/31/20,"50,349,080,576",10/31/20,"18,939,000,000","5,083,000,000","38,334,000,000","852,339,000,000"
4801,"Other investments","(ii) Assessment of the Measurement of Fair Value of Certain Financial Instruments",436572,10/31/20,12/01/20,4,"KPMG LLP",187,"KPMG LLP Chartered Accountants",85,Toronto,A6,ONTARIO,Canada,40-F,2020-12-01,,"BANK OF NOVA SCOTIA",9631,"=""BNS""","40 TEMPERANCE STREET",,TORONTO,A6,ONTARIO,Canada,,,"=""6022""","State Commercial Banks",522110,"Commercial Banking",34,42,10/31/20,"50,349,080,576",10/31/20,"18,939,000,000","5,083,000,000","38,334,000,000","852,339,000,000"
4802,"Uncertain tax positions","(iii) Assessment of Uncertain Tax Provisions",436572,10/31/20,12/01/20,4,"KPMG LLP",187,"KPMG LLP Chartered Accountants",85,Toronto,A6,ONTARIO,Canada,40-F,2020-12-01,,"BANK OF NOVA SCOTIA",9631,"=""BNS""","40 TEMPERANCE STREET",,TORONTO,A6,ONTARIO,Canada,,,"=""6022""","State Commercial Banks",522110,"Commercial Banking",34,42,10/31/20,"50,349,080,576",10/31/20,"18,939,000,000","5,083,000,000","38,334,000,000","852,339,000,000"
7247,"Allowance for credit losses","Assessment of the allowance for credit losses for commercial loans",444864,12/31/20,02/26/21,4,"KPMG LLP",,,,Miami,FL,FLORIDA,"US Southeast",10-K,2021-02-26,,"BankUnited, Inc.",1504008,"=""BKU""","14817 OAK LANE",,"MIAMI LAKES",FL,FLORIDA,"US Southeast",,,"=""6035""","Savings Institutions, Federally Chartered",522110,"Commercial Banking",34,35,12/31/20,"3,236,887,552",12/31/20,"706,548,000","197,853,000","2,905,375,000","35,010,493,000"
4524,"Revenue from customer contracts","Revenue —Warehousing and fulfillment service revenue — refer to Notes 2(r) and 3 to the financial statements",432367,06/30/20,09/16/20,3,"Deloitte & Touche LLP",499,"Deloitte Touche Tohmatsu Certified Public Accountants LLP",1113,Shanghai,F4,CHINA,Foreign,6-K,2020-09-16,,"Baozun Inc.",1625414,"=""BZUN""","NO. 1-9, LANE 510, WEST JIANGCHANG ROAD","JING'AN DISTRICT",SHANGHAI,F4,CHINA,Foreign,,,"=""5961""","Catalog and Mail-Order Houses",454111,"Electronic Shopping",34,33,12/29/20,"1,900,785,664",12/31/20,"1,353,491,000","65,138,000","905,002,000","1,601,684,000"
10825,"Revenue from customer contracts","Revenue –Warehousing and fulfillment service revenue — refer to Notes 2(r) and 3 to the financial statements",452568,12/31/20,04/12/21,3,"Deloitte & Touche LLP",499,"Deloitte Touche Tohmatsu Certified Public Accountants LLP",1113,Shanghai,F4,CHINA,Foreign,20-F,2021-04-12,,"Baozun Inc.",1625414,"=""BZUN""","NO. 1-9, LANE 510, WEST JIANGCHANG ROAD","JING'AN DISTRICT",SHANGHAI,F4,CHINA,Foreign,,,"=""5961""","Catalog and Mail-Order Houses",454111,"Electronic Shopping",34,33,12/29/20,"1,900,785,664",12/31/20,"1,353,491,000","65,138,000","905,002,000","1,601,684,000"
5624,"Allowance for credit losses","Impairment allowance for loans and advances at amortized cost, including off-balance sheet elements of the allowance ",442212,12/31/20,02/17/21,4,"KPMG LLP",87,"KPMG LLP",1118,London,X0,"UNITED KINGDOM",Foreign,20-F,2021-02-18,,"BARCLAYS BANK PLC",312070,"=""DJP""","1 CHURCHILL PLACE",*,LONDON,X0,"UNITED KINGDOM",Foreign,312069,"BARCLAYS PLC","=""6029""","Commercial Banks, NEC",522110,"Commercial Banking",34,,,,12/31/20,"19,527,000,000","3,350,000,000","71,842,000,000","1,448,610,000,000"
5625,"Other investments","Valuation of certain difficult-to-value financial instruments recorded at fair value",442212,12/31/20,02/17/21,4,"KPMG LLP",87,"KPMG LLP",1118,London,X0,"UNITED KINGDOM",Foreign,20-F,2021-02-18,,"BARCLAYS BANK PLC",312070,"=""DJP""","1 CHURCHILL PLACE",*,LONDON,X0,"UNITED KINGDOM",Foreign,312069,"BARCLAYS PLC","=""6029""","Commercial Banks, NEC",522110,"Commercial Banking",34,,,,12/31/20,"19,527,000,000","3,350,000,000","71,842,000,000","1,448,610,000,000"
5626,"Pension and other post-employment benefits","Valuation of the defined benefit pension obligation and certain difficult-to-value pension assets in respect of UK Retirement Fund(‘UKRF’)",442212,12/31/20,02/17/21,4,"KPMG LLP",87,"KPMG LLP",1118,London,X0,"UNITED KINGDOM",Foreign,20-F,2021-02-18,,"BARCLAYS BANK PLC",312070,"=""DJP""","1 CHURCHILL PLACE",*,LONDON,X0,"UNITED KINGDOM",Foreign,312069,"BARCLAYS PLC","=""6029""","Commercial Banks, NEC",522110,"Commercial Banking",34,,,,12/31/20,"19,527,000,000","3,350,000,000","71,842,000,000","1,448,610,000,000"
5651,"Allowance for credit losses","Impairment allowance for loans and advances at amortized cost, including off-balance sheet elements of the allowance",442226,12/31/20,02/17/21,4,"KPMG LLP",87,"KPMG LLP",1118,London,X0,"UNITED KINGDOM",Foreign,20-F,2021-02-18,,"BARCLAYS PLC",312069,"=""BCS""","1 CHURCHILL PLACE","CANARY WHARF",LONDON,X0,"UNITED KINGDOM",Foreign,,,"=""6029""","Commercial Banks, NEC",521110,"Monetary Authorities - Central Bank",34,8,12/29/20,"34,436,939,776",12/31/20,"25,993,000,000","3,364,000,000","79,076,000,000","1,844,732,000,000"
5652,"Other investments","Valuation of certain difficult-to-value financial instruments recorded at fair value",442226,12/31/20,02/17/21,4,"KPMG LLP",87,"KPMG LLP",1118,London,X0,"UNITED KINGDOM",Foreign,20-F,2021-02-18,,"BARCLAYS PLC",312069,"=""BCS""","1 CHURCHILL PLACE","CANARY WHARF",LONDON,X0,"UNITED KINGDOM",Foreign,,,"=""6029""","Commercial Banks, NEC",521110,"Monetary Authorities - Central Bank",34,8,12/29/20,"34,436,939,776",12/31/20,"25,993,000,000","3,364,000,000","79,076,000,000","1,844,732,000,000"
5653,"Goodwill and intangible assets","Recoverability of goodwill and intangible assets",442226,12/31/20,02/17/21,4,"KPMG LLP",87,"KPMG LLP",1118,London,X0,"UNITED KINGDOM",Foreign,20-F,2021-02-18,,"BARCLAYS PLC",312069,"=""BCS""","1 CHURCHILL PLACE","CANARY WHARF",LONDON,X0,"UNITED KINGDOM",Foreign,,,"=""6029""","Commercial Banks, NEC",521110,"Monetary Authorities - Central Bank",34,8,12/29/20,"34,436,939,776",12/31/20,"25,993,000,000","3,364,000,000","79,076,000,000","1,844,732,000,000"
5654,"Pension and other post-employment benefits","Valuation of the defined benefit pension obligation and certain difficult-to-value pension assets in respect of UK Retirement Fund ('UKRF')",442226,12/31/20,02/17/21,4,"KPMG LLP",87,"KPMG LLP",1118,London,X0,"UNITED KINGDOM",Foreign,20-F,2021-02-18,,"BARCLAYS PLC",312069,"=""BCS""","1 CHURCHILL PLACE","CANARY WHARF",LONDON,X0,"UNITED KINGDOM",Foreign,,,"=""6029""","Commercial Banks, NEC",521110,"Monetary Authorities - Central Bank",34,8,12/29/20,"34,436,939,776",12/31/20,"25,993,000,000","3,364,000,000","79,076,000,000","1,844,732,000,000"
9776,"Business combinations","Acquisition of MVC Capital, Inc.",449985,12/31/20,03/23/21,4,"KPMG LLP",,,,Charlotte,NC,"NORTH CAROLINA","US Southeast",10-K,2021-03-23,,"Barings BDC, Inc.",1379785,"=""BBDC""","300 SOUTH TRYON STREET","SUITE 2500",CHARLOTTE,NC,"NORTH CAROLINA","US Southeast",,,,,525990,"Other Financial Vehicles",34,9,12/31/20,"600,907,968",12/31/20,"51,218,000","8,177,000",,"1,677,038,745"
9777,"Derivatives and hedging","Credit Support Agreement",449985,12/31/20,03/23/21,4,"KPMG LLP",,,,Charlotte,NC,"NORTH CAROLINA","US Southeast",10-K,2021-03-23,,"Barings BDC, Inc.",1379785,"=""BBDC""","300 SOUTH TRYON STREET","SUITE 2500",CHARLOTTE,NC,"NORTH CAROLINA","US Southeast",,,,,525990,"Other Financial Vehicles",34,9,12/31/20,"600,907,968",12/31/20,"51,218,000","8,177,000",,"1,677,038,745"
9778,"Other investments","Assessment of the fair value of investments",449985,12/31/20,03/23/21,4,"KPMG LLP",,,,Charlotte,NC,"NORTH CAROLINA","US Southeast",10-K,2021-03-23,,"Barings BDC, Inc.",1379785,"=""BBDC""","300 SOUTH TRYON STREET","SUITE 2500",CHARLOTTE,NC,"NORTH CAROLINA","US Southeast",,,,,525990,"Other Financial Vehicles",34,9,12/31/20,"600,907,968",12/31/20,"51,218,000","8,177,000",,"1,677,038,745"
5995,Goodwill,"Quantitative Goodwill Impairment Assessment",442989,12/31/20,02/22/21,1,"PricewaterhouseCoopers LLP",,,,Hartford,CT,CONNECTICUT,"US New England",10-K,2021-02-22,,"BARNES GROUP INC",9984,,"123 MAIN ST",,BRISTOL,CT,CONNECTICUT,"US New England",,,"=""3490""","Miscellaneous Fabricated Metal Products",334511,"Search, Detection, Navigation, Guidance, Aeronautical, and Nautical System and Instrument Manufacturing",34,51,12/31/20,"2,567,004,928",12/31/20,"1,124,391,000","63,375,000","-193,035,000","2,676,226,000"
8640,"Other contingent liabilities","Workers' Compensation Claims Liabilities",447285,12/31/20,03/08/21,3,"Deloitte & Touche LLP",,,,Portland,OR,OREGON,"US West",10-K,2021-03-08,,"BARRETT BUSINESS SERVICES INC",902791,"=""BBSI""","8100 NE PARKWAY DRIVE","SUITE 200",VANCOUVER,WA,WASHINGTON,"US West",,,"=""7363""","Help Supply Services",561310,"Employment Placement Agencies",34,68,12/31/20,"516,001,216",12/31/20,"880,824,000","33,765,000","150,415,000","774,950,000"
5783,"Long-lived assets","Impairment (impairment reversal) assessments for goodwill and other non-current assets and the measurement of initial fair value assigned to non-controlling interests",442403,12/31/20,02/17/21,1,"PricewaterhouseCoopers LLP",191,"PricewaterhouseCoopers LLP Chartered Accountants",271,Toronto,A6,ONTARIO,Canada,6-K,2021-02-19,,"BARRICK MINING CORP",756894,"=""B""","BROOKFIELD PLACE, TD CANADA TRUST TOWER","161 BAY STREET SUITE 3700",TORONTO,A6,ONTARIO,Canada,,,"=""1040""","Metal Mining",212221,"Gold Ore Mining",34,23,12/29/20,"40,732,299,264",12/31/20,"12,595,000,000","3,614,000,000","18,403,000,000","46,506,000,000"
5784,"Uncertain tax positions","Uncertain tax positions",442403,12/31/20,02/17/21,1,"PricewaterhouseCoopers LLP",191,"PricewaterhouseCoopers LLP Chartered Accountants",271,Toronto,A6,ONTARIO,Canada,6-K,2021-02-19,,"BARRICK MINING CORP",756894,"=""B""","BROOKFIELD PLACE, TD CANADA TRUST TOWER","161 BAY STREET SUITE 3700",TORONTO,A6,ONTARIO,Canada,,,"=""1040""","Metal Mining",212221,"Gold Ore Mining",34,23,12/29/20,"40,732,299,264",12/31/20,"12,595,000,000","3,614,000,000","18,403,000,000","46,506,000,000"
9589,"Long-lived assets","Impairment (impairment reversal) assessments for goodwill and other non-current assets and the measurement of initial fair value assigned to non-controlling interests",449431,12/31/20,02/17/21,1,"PricewaterhouseCoopers LLP",191,"PricewaterhouseCoopers LLP Chartered Accountants",271,Toronto,A6,ONTARIO,Canada,40-F,2021-03-19,,"BARRICK MINING CORP",756894,"=""B""","BROOKFIELD PLACE, TD CANADA TRUST TOWER","161 BAY STREET SUITE 3700",TORONTO,A6,ONTARIO,Canada,,,"=""1040""","Metal Mining",212221,"Gold Ore Mining",34,23,12/29/20,"40,732,299,264",12/31/20,"12,595,000,000","3,614,000,000","18,403,000,000","46,506,000,000"
9590,"Uncertain tax positions","Uncertain tax positions",449431,12/31/20,02/17/21,1,"PricewaterhouseCoopers LLP",191,"PricewaterhouseCoopers LLP Chartered Accountants",271,Toronto,A6,ONTARIO,Canada,40-F,2021-03-19,,"BARRICK MINING CORP",756894,"=""B""","BROOKFIELD PLACE, TD CANADA TRUST TOWER","161 BAY STREET SUITE 3700",TORONTO,A6,ONTARIO,Canada,,,"=""1040""","Metal Mining",212221,"Gold Ore Mining",34,23,12/29/20,"40,732,299,264",12/31/20,"12,595,000,000","3,614,000,000","18,403,000,000","46,506,000,000"
9727,"Long-lived assets","Impairment (impairment reversal) assessments for goodwill and other non-current assets and the measurement of initial fair value assigned to non-controlling interests",449680,12/31/20,02/17/21,1,"PricewaterhouseCoopers LLP",191,"PricewaterhouseCoopers LLP Chartered Accountants",271,Toronto,A6,ONTARIO,Canada,6-K,2021-03-19,,"BARRICK MINING CORP",756894,"=""B""","BROOKFIELD PLACE, TD CANADA TRUST TOWER","161 BAY STREET SUITE 3700",TORONTO,A6,ONTARIO,Canada,,,"=""1040""","Metal Mining",212221,"Gold Ore Mining",34,23,12/29/20,"40,732,299,264",12/31/20,"12,595,000,000","3,614,000,000","18,403,000,000","46,506,000,000"
9728,"Uncertain tax positions","Uncertain tax positions",449680,12/31/20,02/17/21,1,"PricewaterhouseCoopers LLP",191,"PricewaterhouseCoopers LLP Chartered Accountants",271,Toronto,A6,ONTARIO,Canada,6-K,2021-03-19,,"BARRICK MINING CORP",756894,"=""B""","BROOKFIELD PLACE, TD CANADA TRUST TOWER","161 BAY STREET SUITE 3700",TORONTO,A6,ONTARIO,Canada,,,"=""1040""","Metal Mining",212221,"Gold Ore Mining",34,23,12/29/20,"40,732,299,264",12/31/20,"12,595,000,000","3,614,000,000","18,403,000,000","46,506,000,000"
10380,"Long-lived assets","Impairment of Long-Lived Assets",451528,12/31/20,03/31/21,4,"KPMG LLP",,,,Dallas,TX,TEXAS,"US Southwest",10-K,2021-03-31,Yes,"BASIC ENERGY SERVICES, INC.",1109189,,"801 CHERRY STREET","SUITE 2100","FORT WORTH",TX,TEXAS,"US Southwest",,,"=""1389""","Oil and Gas Field Services, NEC",213112,"Support Activities for Oil and Gas Operations",34,0,12/31/20,"2,489,993",12/31/20,"411,375,000","-268,175,000","-186,810,000","349,073,000"
10381,Goodwill,"Goodwill Impairment of the Well Servicing and Water Logistics reporting units",451528,12/31/20,03/31/21,4,"KPMG LLP",,,,Dallas,TX,TEXAS,"US Southwest",10-K,2021-03-31,Yes,"BASIC ENERGY SERVICES, INC.",1109189,,"801 CHERRY STREET","SUITE 2100","FORT WORTH",TX,TEXAS,"US Southwest",,,"=""1389""","Oil and Gas Field Services, NEC",213112,"Support Activities for Oil and Gas Operations",34,0,12/31/20,"2,489,993",12/31/20,"411,375,000","-268,175,000","-186,810,000","349,073,000"
3670,"Long-lived assets","Impairment of Store Assets",423133,02/01/20,03/27/20,2,"Ernst & Young LLP",,,,"Grandview Heights",OH,OHIO,"US Midwest",10-K,2020-03-30,,"Bath & Body Works, Inc.",701985,"=""BBWI""","THREE LIMITED PKWY","P O BOX 16000",COLUMBUS,OH,OHIO,"US Midwest",,,"=""5990""","Retail-Retail Stores, NEC",448120,"Women's Clothing Stores",34,22,02/03/20,"6,204,091,904",02/01/20,"5,405,000,000","-366,000,000","-2,538,000,000","10,125,000,000"
3671,Goodwill,"Valuation of Goodwill",423133,02/01/20,03/27/20,2,"Ernst & Young LLP",,,,"Grandview Heights",OH,OHIO,"US Midwest",10-K,2020-03-30,,"Bath & Body Works, Inc.",701985,"=""BBWI""","THREE LIMITED PKWY","P O BOX 16000",COLUMBUS,OH,OHIO,"US Midwest",,,"=""5990""","Retail-Retail Stores, NEC",448120,"Women's Clothing Stores",34,22,02/03/20,"6,204,091,904",02/01/20,"5,405,000,000","-366,000,000","-2,538,000,000","10,125,000,000"
8645,"Proven and unproven reserves","Proved Oil and Natural Gas Property and Depletion — Oil and Natural Gas Reserve Quantities — Refer to Note 1 and 7 to the financial statements",447313,12/31/20,03/08/21,3,"Deloitte & Touche LLP",,,,Houston,TX,TEXAS,"US Southwest",10-K,2021-03-08,,"BATTALION OIL CORP",1282648,"=""BATL""","820 GESSNER ROAD","SUITE 1100",HOUSTON,TX,TEXAS,"US Southwest",,,"=""1311""","Crude Petroleum and Natural Gas",211111,"Crude Petroleum and Natural Gas Extraction",34,8,12/31/20,"134,493,024",12/31/20,"148,289,000","-229,707,000",,"346,497,000"
14063,"Other intangible assets","Finite-Lived Intangible Assets Impairment Assessment",471456,12/31/20,05/27/21,1,"PricewaterhouseCoopers LLP",,,,"Florham Park",NJ,"NEW JERSEY","US Mid Atlantic",DRS,2021-05-27,,"Bausch & Lomb Corp",1860742,"=""BLCO""","520 APPLEWOOD CRESCENT",,VAUGHAN,A6,ONTARIO,Canada,,,"=""3851""","Ophthalmic Goods",339115,"Ophthalmic Goods Manufacturing",34,,,,12/31/20,"3,412,000,000","-18,000,000","2,671,000,000","11,266,000,000"
14064,"Other intangible assets","Finite-Lived Intangible Assets Impairment Assessment",471447,12/31/20,05/27/21,1,"PricewaterhouseCoopers LLP",,,,"Florham Park",NJ,"NEW JERSEY","US Mid Atlantic",DRS/A,2021-07-09,,"Bausch & Lomb Corp",1860742,"=""BLCO""","520 APPLEWOOD CRESCENT",,VAUGHAN,A6,ONTARIO,Canada,,,"=""3851""","Ophthalmic Goods",339115,"Ophthalmic Goods Manufacturing",34,,,,12/31/20,"3,412,000,000","-18,000,000","2,671,000,000","11,266,000,000"
14065,"Other intangible assets","Finite-Lived Intangible Assets Impairment Assessment",471442,12/31/20,05/27/21,1,"PricewaterhouseCoopers LLP",,,,"Florham Park",NJ,"NEW JERSEY","US Mid Atlantic",DRS/A,2021-09-03,,"Bausch & Lomb Corp",1860742,"=""BLCO""","520 APPLEWOOD CRESCENT",,VAUGHAN,A6,ONTARIO,Canada,,,"=""3851""","Ophthalmic Goods",339115,"Ophthalmic Goods Manufacturing",34,,,,12/31/20,"3,412,000,000","-18,000,000","2,671,000,000","11,266,000,000"
14066,"Other intangible assets","Finite-Lived Intangible Assets Impairment Assessment",471443,12/31/20,05/27/21,1,"PricewaterhouseCoopers LLP",,,,"Florham Park",NJ,"NEW JERSEY","US Mid Atlantic",DRS/A,2021-11-19,,"Bausch & Lomb Corp",1860742,"=""BLCO""","520 APPLEWOOD CRESCENT",,VAUGHAN,A6,ONTARIO,Canada,,,"=""3851""","Ophthalmic Goods",339115,"Ophthalmic Goods Manufacturing",34,,,,12/31/20,"3,412,000,000","-18,000,000","2,671,000,000","11,266,000,000"
14075,"Other intangible assets","Finite-Lived Intangible Assets Impairment Assessment",471441,12/31/20,05/27/21,1,"PricewaterhouseCoopers LLP",,,,"Florham Park",NJ,"NEW JERSEY","US Mid Atlantic",S-1,2022-01-13,,"Bausch & Lomb Corp",1860742,"=""BLCO""","520 APPLEWOOD CRESCENT",,VAUGHAN,A6,ONTARIO,Canada,,,"=""3851""","Ophthalmic Goods",339115,"Ophthalmic Goods Manufacturing",34,,,,12/31/20,"3,412,000,000","-18,000,000","2,671,000,000","11,266,000,000"
6396,"Sales return and allowances","Medicaid Rebates and Sales Returns Allowances",443483,12/31/20,02/24/21,1,"PricewaterhouseCoopers LLP",,,,"Florham Park",NJ,"NEW JERSEY","US Mid Atlantic",10-K,2021-02-24,,"Bausch Health Companies Inc.",885590,"=""BHC""","2150 ST. ELZEAR BLVD. WEST",LAVAL,QUEBEC,A8,QUEBEC,Canada,,,"=""2834""","Pharmaceutical Preparations",325412,"Pharmaceutical Preparation Manufacturing",34,21,12/31/20,"7,392,784,896",12/31/20,"8,027,000,000","-560,000,000","-20,738,000,000","31,199,000,000"
6397,"Other intangible assets","Finite-Lived Intangible Assets Impairment Assessment",443483,12/31/20,02/24/21,1,"PricewaterhouseCoopers LLP",,,,"Florham Park",NJ,"NEW JERSEY","US Mid Atlantic",10-K,2021-02-24,,"Bausch Health Companies Inc.",885590,"=""BHC""","2150 ST. ELZEAR BLVD. WEST",LAVAL,QUEBEC,A8,QUEBEC,Canada,,,"=""2834""","Pharmaceutical Preparations",325412,"Pharmaceutical Preparation Manufacturing",34,21,12/31/20,"7,392,784,896",12/31/20,"8,027,000,000","-560,000,000","-20,738,000,000","31,199,000,000"
6398,Goodwill,"Goodwill Impairment Assessment – Ortho Dermatologics Reporting Unit",443483,12/31/20,02/24/21,1,"PricewaterhouseCoopers LLP",,,,"Florham Park",NJ,"NEW JERSEY","US Mid Atlantic",10-K,2021-02-24,,"Bausch Health Companies Inc.",885590,"=""BHC""","2150 ST. ELZEAR BLVD. WEST",LAVAL,QUEBEC,A8,QUEBEC,Canada,,,"=""2834""","Pharmaceutical Preparations",325412,"Pharmaceutical Preparation Manufacturing",34,21,12/31/20,"7,392,784,896",12/31/20,"8,027,000,000","-560,000,000","-20,738,000,000","31,199,000,000"
11595,"Sales return and allowances","Medicaid Rebates and Sales Returns Allowances",455578,12/31/20,02/24/21,1,"PricewaterhouseCoopers LLP",,,,"Florham Park",NJ,"NEW JERSEY","US Mid Atlantic",8-K,2021-05-04,,"Bausch Health Companies Inc.",885590,"=""BHC""","2150 ST. ELZEAR BLVD. WEST",LAVAL,QUEBEC,A8,QUEBEC,Canada,,,"=""2834""","Pharmaceutical Preparations",325412,"Pharmaceutical Preparation Manufacturing",34,21,12/31/20,"7,392,784,896",12/31/20,"8,027,000,000","-560,000,000","-20,738,000,000","31,199,000,000"
11596,"Other intangible assets","Finite-Lived Intangible Assets Impairment Assessment",455578,12/31/20,02/24/21,1,"PricewaterhouseCoopers LLP",,,,"Florham Park",NJ,"NEW JERSEY","US Mid Atlantic",8-K,2021-05-04,,"Bausch Health Companies Inc.",885590,"=""BHC""","2150 ST. ELZEAR BLVD. WEST",LAVAL,QUEBEC,A8,QUEBEC,Canada,,,"=""2834""","Pharmaceutical Preparations",325412,"Pharmaceutical Preparation Manufacturing",34,21,12/31/20,"7,392,784,896",12/31/20,"8,027,000,000","-560,000,000","-20,738,000,000","31,199,000,000"
11597,Goodwill,"Goodwill Impairment Assessment – Ortho Dermatologics Reporting Unit",455578,12/31/20,02/24/21,1,"PricewaterhouseCoopers LLP",,,,"Florham Park",NJ,"NEW JERSEY","US Mid Atlantic",8-K,2021-05-04,,"Bausch Health Companies Inc.",885590,"=""BHC""","2150 ST. ELZEAR BLVD. WEST",LAVAL,QUEBEC,A8,QUEBEC,Canada,,,"=""2834""","Pharmaceutical Preparations",325412,"Pharmaceutical Preparation Manufacturing",34,21,12/31/20,"7,392,784,896",12/31/20,"8,027,000,000","-560,000,000","-20,738,000,000","31,199,000,000"
5156,"Deferred income taxes","Valuation Allowance on United States (U.S.) Foreign Tax Credit Carryforwards",441495,12/31/20,02/11/21,1,"PricewaterhouseCoopers LLP",,,,Chicago,IL,ILLINOIS,"US Midwest",10-K,2021-02-11,,"BAXTER INTERNATIONAL INC",10456,"=""BAX""","ONE BAXTER PARKWAY",,DEERFIELD,IL,ILLINOIS,"US Midwest",,,"=""3841""","Surgical and Medical Instruments and Apparatus",325414,"Biological Product (except Diagnostic) Manufacturing",34,80,12/31/20,"40,514,359,296",12/31/20,"11,673,000,000","1,102,000,000","3,801,000,000","20,019,000,000"
11494,"Deferred income taxes","Valuation Allowance on United States (U.S.) Foreign Tax Credit Carryforwards",455235,12/31/20,02/11/21,1,"PricewaterhouseCoopers LLP",,,,Chicago,IL,ILLINOIS,"US Midwest",8-K,2021-04-29,,"BAXTER INTERNATIONAL INC",10456,"=""BAX""","ONE BAXTER PARKWAY",,DEERFIELD,IL,ILLINOIS,"US Midwest",,,"=""3841""","Surgical and Medical Instruments and Apparatus",325414,"Biological Product (except Diagnostic) Manufacturing",34,80,12/31/20,"40,514,359,296",12/31/20,"11,673,000,000","1,102,000,000","3,801,000,000","20,019,000,000"
6949,"Proven and unproven reserves","Assessment of the recoverable amount of of oil and gas properties",443534,12/31/20,02/24/21,4,"KPMG LLP",187,"KPMG LLP Chartered Accountants",85,Calgary,A0,ALBERTA,Canada,6-K,2021-02-25,,"BAYTEX ENERGY CORP.",1279495,"=""BTE""","2200 205 5TH AVE SW",,CALGARY,A0,ALBERTA,Canada,,,"=""1381""","Drilling Oil and Gas Wells",213111,"Drilling Oil and Gas Wells",34,1,12/29/20,"125,852,352",12/31/20,"637,160,000","-1,914,414,000",,"2,675,115,000"
6950,"Proven and unproven reserves","Impact of estimated oil and gas reserves on depletion expense related to oil and gas properties",443534,12/31/20,02/24/21,4,"KPMG LLP",187,"KPMG LLP Chartered Accountants",85,Calgary,A0,ALBERTA,Canada,6-K,2021-02-25,,"BAYTEX ENERGY CORP.",1279495,"=""BTE""","2200 205 5TH AVE SW",,CALGARY,A0,ALBERTA,Canada,,,"=""1381""","Drilling Oil and Gas Wells",213111,"Drilling Oil and Gas Wells",34,1,12/29/20,"125,852,352",12/31/20,"637,160,000","-1,914,414,000",,"2,675,115,000"
8183,"Proven and unproven reserves","Assessment of the recoverable amount of of oil and gas properties",445450,12/31/20,02/24/21,4,"KPMG LLP",187,"KPMG LLP Chartered Accountants",85,Calgary,A0,ALBERTA,Canada,40-F,2021-03-02,,"BAYTEX ENERGY CORP.",1279495,"=""BTE""","2200 205 5TH AVE SW",,CALGARY,A0,ALBERTA,Canada,,,"=""1381""","Drilling Oil and Gas Wells",213111,"Drilling Oil and Gas Wells",34,1,12/29/20,"125,852,352",12/31/20,"637,160,000","-1,914,414,000",,"2,675,115,000"
8184,"Proven and unproven reserves","Impact of estimated oil and gas reserves on depletion expense related to oil and gas properties",445450,12/31/20,02/24/21,4,"KPMG LLP",187,"KPMG LLP Chartered Accountants",85,Calgary,A0,ALBERTA,Canada,40-F,2021-03-02,,"BAYTEX ENERGY CORP.",1279495,"=""BTE""","2200 205 5TH AVE SW",,CALGARY,A0,ALBERTA,Canada,,,"=""1381""","Drilling Oil and Gas Wells",213111,"Drilling Oil and Gas Wells",34,1,12/29/20,"125,852,352",12/31/20,"637,160,000","-1,914,414,000",,"2,675,115,000"
8362,"Proven and unproven reserves","Assessment of the recoverable amount of of oil and gas properties",446439,12/31/20,02/24/21,4,"KPMG LLP",187,"KPMG LLP Chartered Accountants",85,Calgary,A0,ALBERTA,Canada,6-K,2021-03-03,,"BAYTEX ENERGY CORP.",1279495,"=""BTE""","2200 205 5TH AVE SW",,CALGARY,A0,ALBERTA,Canada,,,"=""1381""","Drilling Oil and Gas Wells",213111,"Drilling Oil and Gas Wells",34,1,12/29/20,"125,852,352",12/31/20,"637,160,000","-1,914,414,000",,"2,675,115,000"
8363,"Proven and unproven reserves","Impact of estimated oil and gas reserves on depletion expense related to oil and gas properties",446439,12/31/20,02/24/21,4,"KPMG LLP",187,"KPMG LLP Chartered Accountants",85,Calgary,A0,ALBERTA,Canada,6-K,2021-03-03,,"BAYTEX ENERGY CORP.",1279495,"=""BTE""","2200 205 5TH AVE SW",,CALGARY,A0,ALBERTA,Canada,,,"=""1381""","Drilling Oil and Gas Wells",213111,"Drilling Oil and Gas Wells",34,1,12/29/20,"125,852,352",12/31/20,"637,160,000","-1,914,414,000",,"2,675,115,000"
6624,Goodwill,"Valuation of Goodwill",443743,12/31/20,02/25/21,4,"KPMG LLP",,,,Birmingham,AL,ALABAMA,"US Southeast",10-K,2021-02-25,,"BBVA USA Bancshares, Inc.",1409775,,"2200 POST OAK BLVD",,HOUSTON,TX,TEXAS,"US Southwest",,,"=""6021""","National Commercial Banks",522110,"Commercial Banking",34,,,,12/31/20,"2,737,067,000","-1,863,711,000","9,333,568,000","102,756,203,000"
6625,"Allowance for credit losses","Allowance for Loan Losses Evaluated on a Collective Basis",443743,12/31/20,02/25/21,4,"KPMG LLP",,,,Birmingham,AL,ALABAMA,"US Southeast",10-K,2021-02-25,,"BBVA USA Bancshares, Inc.",1409775,,"2200 POST OAK BLVD",,HOUSTON,TX,TEXAS,"US Southwest",,,"=""6021""","National Commercial Banks",522110,"Commercial Banking",34,,,,12/31/20,"2,737,067,000","-1,863,711,000","9,333,568,000","102,756,203,000"
8913,"Goodwill and intangible assets","Goodwill and Intangible Assets – Bell Media Group – Refer to Notes 8, 18 and 21 to the financial statements",448530,12/31/20,03/04/21,3,"Deloitte & Touche LLP",486,"Deloitte srl",1208,Montreal,A8,QUEBEC,Canada,6-K,2021-03-11,,"BCE INC",718940,"=""BCE""","1 CARREFOUR ALEXANDER-GRAHAM-BELL","BUREAU 4100",MONTREAL,A8,QUEBEC,Canada,,,"=""4813""","Telephone Communications, Except Radiotelephone",517310,"Telecommunications Resellers",34,43,12/29/20,"38,587,838,464",12/31/20,"17,962,000,000","2,119,000,000","-2,133,000,000","47,618,000,000"
9011,"Goodwill and intangible assets","Goodwill and Intangible Assets - Bell Media Group - Refer to Notes 8, 18 and 21 to the financial statements",448243,12/31/20,03/04/21,3,"Deloitte & Touche LLP",486,"Deloitte srl",1208,Montreal,A8,QUEBEC,Canada,40-F,2021-03-11,,"BCE INC",718940,"=""BCE""","1 CARREFOUR ALEXANDER-GRAHAM-BELL","BUREAU 4100",MONTREAL,A8,QUEBEC,Canada,,,"=""4813""","Telephone Communications, Except Radiotelephone",517310,"Telecommunications Resellers",34,43,12/29/20,"38,587,838,464",12/31/20,"17,962,000,000","2,119,000,000","-2,133,000,000","47,618,000,000"
8905,"Other investments","Valuation of investments using significant unobservable inputs and assumptions",448387,12/31/20,03/11/21,4,"KPMG LLP",,,,"New York",NY,"NEW YORK","US Mid Atlantic",10-K,2021-03-11,,"BCP Investment Corp",1372807,"=""BCIC""","650 MADISON AVENUE","3RD FLOOR","NEW YORK",NY,"NEW YORK","US Mid Atlantic",,,,,525990,"Other Financial Vehicles",34,2,12/31/20,"143,563,680",12/31/20,"32,480,189","31,572,678",,"600,178,421"
4757,"Other contingent liabilities","Estimation of Product Liability Reserves",436213,09/30/20,11/25/20,2,"Ernst & Young LLP",,,,"New York",NY,"NEW YORK","US Mid Atlantic",10-K,2020-11-25,,"BECTON DICKINSON & CO",10795,"=""BDX""","ONE BECTON DR",,"FRANKLIN LAKES",NJ,"NEW JERSEY","US Mid Atlantic",,,"=""3841""","Surgical and Medical Instruments and Apparatus",334516,"Analytical Laboratory Instrument Manufacturing",34,233,09/30/20,"65,790,410,752",09/30/20,"16,074,000,000","874,000,000","-13,670,000,000","54,012,000,000"
4758,"Uncertain tax positions","Income taxes - Uncertain tax positions",436213,09/30/20,11/25/20,2,"Ernst & Young LLP",,,,"New York",NY,"NEW YORK","US Mid Atlantic",10-K,2020-11-25,,"BECTON DICKINSON & CO",10795,"=""BDX""","ONE BECTON DR",,"FRANKLIN LAKES",NJ,"NEW JERSEY","US Mid Atlantic",,,"=""3841""","Surgical and Medical Instruments and Apparatus",334516,"Analytical Laboratory Instrument Manufacturing",34,233,09/30/20,"65,790,410,752",09/30/20,"16,074,000,000","874,000,000","-13,670,000,000","54,012,000,000"
4759,Goodwill,"Goodwill impairment - Interventional segment",436213,09/30/20,11/25/20,2,"Ernst & Young LLP",,,,"New York",NY,"NEW YORK","US Mid Atlantic",10-K,2020-11-25,,"BECTON DICKINSON & CO",10795,"=""BDX""","ONE BECTON DR",,"FRANKLIN LAKES",NJ,"NEW JERSEY","US Mid Atlantic",,,"=""3841""","Surgical and Medical Instruments and Apparatus",334516,"Analytical Laboratory Instrument Manufacturing",34,233,09/30/20,"65,790,410,752",09/30/20,"16,074,000,000","874,000,000","-13,670,000,000","54,012,000,000"
7208,"Revenue from customer contracts","Estimate of unearned product revenue on undelivered product",444562,12/31/20,02/26/21,4,"KPMG LLP",,,,"Salt Lake City",UT,UTAH,"US West",10-K,2021-02-26,,"BED BATH & BEYOND, INC.",1130713,"=""BBBY""","433 W. ASCENSION WAY, 3RD FLOOR",,MURRAY,UT,UTAH,"US West",,,"=""5961""","Catalog and Mail-Order Houses",454111,"Electronic Shopping",34,52,12/29/20,"2,204,114,176",12/31/20,"2,549,783,000","56,001,000","324,745,000","830,214,000"
9034,Goodwill,"Goodwill - Cinch Connectivity Solutions Europe (“CCS”), Power Solutions & Protection Europe (“PSP”), and CUI Power (“CUI”) Reporting Units – Refer to Notes 1 and 4 to the Financial Statements",448585,12/31/20,03/12/21,3,"Deloitte & Touche LLP",,,,"New York",NY,"NEW YORK","US Mid Atlantic",10-K,2021-03-12,,"BEL FUSE INC /NJ",729580,"=""BELFA""","300 EXECUTIVE DRIVE","SUITE 300","WEST ORANGE",NJ,"NEW JERSEY","US Mid Atlantic",,,"=""3677""","Electronic Coils, Transformers, and Other Inductors",335313,"Switchgear and Switchboard Apparatus Manufacturing",34,13,12/31/20,"28,484,432",12/31/20,"465,771,000","12,795,000","96,044,000","453,866,000"
9035,"Other intangible assets","Indefinite-Lived Intangible Assets – Cinch, Connectivity Solutions and CUI Trademarks — Refer to Notes 1 and 4 to the financial statements",448585,12/31/20,03/12/21,3,"Deloitte & Touche LLP",,,,"New York",NY,"NEW YORK","US Mid Atlantic",10-K,2021-03-12,,"BEL FUSE INC /NJ",729580,"=""BELFA""","300 EXECUTIVE DRIVE","SUITE 300","WEST ORANGE",NJ,"NEW JERSEY","US Mid Atlantic",,,"=""3677""","Electronic Coils, Transformers, and Other Inductors",335313,"Switchgear and Switchboard Apparatus Manufacturing",34,13,12/31/20,"28,484,432",12/31/20,"465,771,000","12,795,000","96,044,000","453,866,000"
5434,Goodwill,"Valuation of Goodwill for Certain Reporting Units",441977,12/31/20,02/16/21,2,"Ernst & Young LLP",,,,"Saint Louis",MO,MISSOURI,"US Southeast",10-K,2021-02-16,,"BELDEN INC.",913142,"=""BDC""","1 NORTH BRENTWOOD BLVD","15TH FLOOR","ST. LOUIS",MO,MISSOURI,"US Southeast",,,"=""3357""","Drawing and Insulating of Nonferrous Wire",334290,"Other Communications Equipment Manufacturing",34,42,12/31/20,"1,870,541,696",12/31/20,"1,862,716,000","-55,162,000","-788,428,000","3,139,734,000"
5435,"Revenue from customer contracts","Revenue recognition - allocating consideration to performance obligations and estimating variable consideration",441977,12/31/20,02/16/21,2,"Ernst & Young LLP",,,,"Saint Louis",MO,MISSOURI,"US Southeast",10-K,2021-02-16,,"BELDEN INC.",913142,"=""BDC""","1 NORTH BRENTWOOD BLVD","15TH FLOOR","ST. LOUIS",MO,MISSOURI,"US Southeast",,,"=""3357""","Drawing and Insulating of Nonferrous Wire",334290,"Other Communications Equipment Manufacturing",34,42,12/31/20,"1,870,541,696",12/31/20,"1,862,716,000","-55,162,000","-788,428,000","3,139,734,000"
10592,"Other debt","Private placement option liability and warrant liability valuation of Bellicum Pharmaceuticals",451185,12/31/20,03/30/21,2,"Ernst & Young LLP",,,,Houston,TX,TEXAS,"US Southwest",10-K,2021-03-31,,"BELLICUM PHARMACEUTICALS, INC",1358403,,"3730 KIRBY DRIVE","SUITE 1200",HOUSTON,TX,TEXAS,"US Southwest",,,"=""2834""","Pharmaceutical Preparations",325412,"Pharmaceutical Preparation Manufacturing",34,4,12/31/20,"29,362,202",12/31/20,"500,000","-7,722,000",,"40,584,000"
7996,"Other income taxes","Evaluation of income tax expense",445299,12/31/20,03/01/21,4,"KPMG LLP",,,,Phoenix,AZ,ARIZONA,"US Southwest",10-K,2021-03-01,,"BENCHMARK ELECTRONICS INC",863436,"=""BHE""","56 SOUTH ROCKFORD DRIVE",,TEMPE,AZ,ARIZONA,"US Southwest",,,"=""3672""","Printed Circuit Boards",334418,"Printed Circuit Assembly (Electronic Assembly) Manufacturing",34,27,12/31/20,"980,327,936",12/31/20,"2,053,131,000","14,055,000","797,472,000","1,744,235,000"
8848,"Revenue from customer contracts","Revenue Recognition – Estimation of Platform Revenue from Insurance Broker Commissions",447895,12/31/20,03/09/21,2,"Ernst & Young LLP",,,,Charlotte,NC,"NORTH CAROLINA","US Southeast",10-K,2021-03-10,,"Benefitfocus, Inc.",1576169,,"100 BENEFITFOCUS WAY",,CHARLESTON,SC,"SOUTH CAROLINA","US Southeast",,,"=""7372""","Prepackaged Software",511210,"Software Publishers",34,14,12/31/20,"468,101,312",12/31/20,"268,141,000","-24,297,000","7,348,000","362,372,000"
6724,"Research and development expenses","Accrual of research and development expenses",443925,12/31/20,02/25/21,2,"Ernst & Young LLP",211,"Ernst & Young Hua Ming LLP",1408,Beijing,F4,CHINA,Foreign,10-K,2021-02-25,,"BeOne Medicines Ltd.",1651308,"=""ONC""","C/O BEONE MEDICINES I GMBH","AESCHENGRABEN 27, 21ST FLOOR",BASEL,V8,SWITZERLAND,Foreign,,,"=""2834""","Pharmaceutical Preparations",325412,"Pharmaceutical Preparation Manufacturing",34,245,12/29/20,"18,213,294,080",12/31/20,"308,874,000","-1,596,906,000","3,864,243,000","5,600,757,000"
6725,"Business combinations","Allocation of proceeds received in relation to the Amgen Collaboration and Share Purchase Agreements",443925,12/31/20,02/25/21,2,"Ernst & Young LLP",211,"Ernst & Young Hua Ming LLP",1408,Beijing,F4,CHINA,Foreign,10-K,2021-02-25,,"BeOne Medicines Ltd.",1651308,"=""ONC""","C/O BEONE MEDICINES I GMBH","AESCHENGRABEN 27, 21ST FLOOR",BASEL,V8,SWITZERLAND,Foreign,,,"=""2834""","Pharmaceutical Preparations",325412,"Pharmaceutical Preparation Manufacturing",34,245,12/29/20,"18,213,294,080",12/31/20,"308,874,000","-1,596,906,000","3,864,243,000","5,600,757,000"
5684,"Allowance for credit losses","Reserves for losses and loss expenses",442313,12/31/20,02/18/21,4,"KPMG LLP",,,,"New York",NY,"NEW YORK","US Mid Atlantic",10-K,2021-02-18,,"BERKLEY W R CORP",11544,"=""WRB""","475 STEAMBOAT ROAD",.,GREENWICH,CT,CONNECTICUT,"US New England",,,"=""6331""","Fire, Marine, and Casualty Insurance",524113,"Direct Life Insurance Carriers",34,66,12/31/20,"11,811,146,752",12/31/20,"8,098,925,000","530,670,000","6,141,150,000","28,606,913,000"
8000,"Regulatory assets and liabilities","Regulatory Matters - Impact of Rate Regulation on the Financial Statements — Refer to Notes 2 and 7 to the financial statements",445081,12/31/20,02/26/21,3,"Deloitte & Touche LLP",,,,"Des Moines",IA,IOWA,"US Midwest",10-K,2021-03-01,,"BERKSHIRE HATHAWAY ENERGY CO",1081316,,"1615 LOCUST STREET",,"DES MOINES",IA,IOWA,"US Midwest",1067983,"BERKSHIRE HATHAWAY INC","=""4900""","Electric, Gas & Sanitary Services",221122,"Electric Power Distribution",34,,,,12/31/20,"20,952,000,000","7,014,000,000","35,474,000,000","127,316,000,000"
8001,Goodwill,"Goodwill — NV Energy and Northern Powergrid Reporting Units — Refer to Notes 2 and 22 to the financial statements",445081,12/31/20,02/26/21,3,"Deloitte & Touche LLP",,,,"Des Moines",IA,IOWA,"US Midwest",10-K,2021-03-01,,"BERKSHIRE HATHAWAY ENERGY CO",1081316,,"1615 LOCUST STREET",,"DES MOINES",IA,IOWA,"US Midwest",1067983,"BERKSHIRE HATHAWAY INC","=""4900""","Electric, Gas & Sanitary Services",221122,"Electric Power Distribution",34,,,,12/31/20,"20,952,000,000","7,014,000,000","35,474,000,000","127,316,000,000"
8002,"Other contingent liabilities","California and Oregon 2020 Wildfires – Contingencies – See Note 16 to the financial statements",445081,12/31/20,02/26/21,3,"Deloitte & Touche LLP",,,,"Des Moines",IA,IOWA,"US Midwest",10-K,2021-03-01,,"BERKSHIRE HATHAWAY ENERGY CO",1081316,,"1615 LOCUST STREET",,"DES MOINES",IA,IOWA,"US Midwest",1067983,"BERKSHIRE HATHAWAY INC","=""4900""","Electric, Gas & Sanitary Services",221122,"Electric Power Distribution",34,,,,12/31/20,"20,952,000,000","7,014,000,000","35,474,000,000","127,316,000,000"
7935,"Insurance contract liabilities","Unpaid Losses and Loss Adjustment Expenses— Refer to Notes 1 and 15 to the financial statements",445088,12/31/20,02/27/21,3,"Deloitte & Touche LLP",,,,Omaha,NE,NEBRASKA,"US Midwest",10-K,2021-03-01,,"BERKSHIRE HATHAWAY INC",1067983,"=""BRK.A""","3555 FARNAM STREET",,OMAHA,NE,NEBRASKA,"US Midwest",,,"=""6331""","Fire, Marine, and Casualty Insurance",524130,"Reinsurance Carriers",34,"347,815",12/31/20,"223,968,854,016",12/31/20,"286,256,000,000","42,521,000,000","339,968,000,000","873,729,000,000"
7936,"Insurance contract liabilities","Unpaid Losses and Loss Adjustment Expenses Under Retroactive Reinsurance Contracts — Refer to Notes 1 and 16 to the financial statements",445088,12/31/20,02/27/21,3,"Deloitte & Touche LLP",,,,Omaha,NE,NEBRASKA,"US Midwest",10-K,2021-03-01,,"BERKSHIRE HATHAWAY INC",1067983,"=""BRK.A""","3555 FARNAM STREET",,OMAHA,NE,NEBRASKA,"US Midwest",,,"=""6331""","Fire, Marine, and Casualty Insurance",524130,"Reinsurance Carriers",34,"347,815",12/31/20,"223,968,854,016",12/31/20,"286,256,000,000","42,521,000,000","339,968,000,000","873,729,000,000"
7937,"Goodwill and intangible assets","Goodwill and Indefinite-Lived Intangible Assets — Refer to Notes 1 and 13 to the financial statements",445088,12/31/20,02/27/21,3,"Deloitte & Touche LLP",,,,Omaha,NE,NEBRASKA,"US Midwest",10-K,2021-03-01,,"BERKSHIRE HATHAWAY INC",1067983,"=""BRK.A""","3555 FARNAM STREET",,OMAHA,NE,NEBRASKA,"US Midwest",,,"=""6331""","Fire, Marine, and Casualty Insurance",524130,"Reinsurance Carriers",34,"347,815",12/31/20,"223,968,854,016",12/31/20,"286,256,000,000","42,521,000,000","339,968,000,000","873,729,000,000"
4734,"Business combinations","Accounting for RPC Group Plc Business Combination",436012,09/26/20,11/23/20,2,"Ernst & Young LLP",,,,Indianapolis,IN,INDIANA,"US Midwest",8-K,2021-09-02,,"BERRY GLOBAL GROUP, INC.",1378992,"=""BERY""","101 OAKLEY STREET","PO BOX 959",EVANSVILLE,IN,INDIANA,"US Midwest",,,"=""3089""","Plastics Products, NEC",326199,"All Other Plastics Product Manufacturing",34,48,09/30/20,"5,926,496,256",09/26/20,"11,709,000,000","559,000,000","-5,578,000,000","16,701,000,000"
4735,Goodwill,"Valuation of Goodwill",436012,09/26/20,11/23/20,2,"Ernst & Young LLP",,,,Indianapolis,IN,INDIANA,"US Midwest",8-K,2021-09-02,,"BERRY GLOBAL GROUP, INC.",1378992,"=""BERY""","101 OAKLEY STREET","PO BOX 959",EVANSVILLE,IN,INDIANA,"US Midwest",,,"=""3089""","Plastics Products, NEC",326199,"All Other Plastics Product Manufacturing",34,48,09/30/20,"5,926,496,256",09/26/20,"11,709,000,000","559,000,000","-5,578,000,000","16,701,000,000"
3573,"Vendor/supplier rebates","Vendor Allowances — Refer to Note 1 to the financial statements",422571,02/01/20,03/23/20,3,"Deloitte & Touche LLP",,,,Minneapolis,MN,MINNESOTA,"US Midwest",10-K,2020-03-23,,"BEST BUY CO INC",764478,"=""BBY""","7601 PENN AVE SOUTH",,RICHFIELD,MN,MINNESOTA,"US Midwest",,,"=""5731""","Radio, Television, and Consumer Electronics Stores",443112,"Radio, Television, and Other Electronics Stores",34,85,02/03/20,"22,063,366,144",02/01/20,"43,638,000,000","1,541,000,000","2,495,000,000","15,591,000,000"
3574,Goodwill,"Goodwill — Best Buy Health Reporting Unit — Refer to Note 1 to the financial statements",422571,02/01/20,03/23/20,3,"Deloitte & Touche LLP",,,,Minneapolis,MN,MINNESOTA,"US Midwest",10-K,2020-03-23,,"BEST BUY CO INC",764478,"=""BBY""","7601 PENN AVE SOUTH",,RICHFIELD,MN,MINNESOTA,"US Midwest",,,"=""5731""","Radio, Television, and Consumer Electronics Stores",443112,"Radio, Television, and Other Electronics Stores",34,85,02/03/20,"22,063,366,144",02/01/20,"43,638,000,000","1,541,000,000","2,495,000,000","15,591,000,000"
11097,Goodwill,"Goodwill impairment assessment for the Store+ reporting unit",453076,12/31/20,04/16/21,2,"Ernst & Young LLP",211,"Ernst & Young Hua Ming LLP",1408,Shanghai,F4,CHINA,Foreign,20-F,2021-04-16,Yes,"BEST Inc.",1709505,,"2/F, BLOCK A, HUAXING MODERN INDUSTRY","PARK, NO.18 TANGMIAO ROAD, XIHU DISTRICT","HANGZHOU, ZHEJIANG PROVINCE",F4,CHINA,Foreign,,,"=""4210""","Trucking & Courier Services (No Air)",541614,"Process, Physical Distribution, and Logistics Consulting Services",34,2,12/29/20,"513,829,312",12/31/20,"4,586,536,000","-309,720,000","252,697,000","3,038,445,000"
8017,"Business combinations","Asset Acquisition — Refer to Notes 2 and 5 to the financial statements",445552,12/31/20,03/01/21,3,"Deloitte & Touche LLP",,,,"Los Angeles",CA,CALIFORNIA,"US West",10-K,2021-03-01,,"BEYOND MEAT, INC.",1655210,"=""BYND""","888 N. DOUGLAS STREET, SUITE 100",,"EL SEGUNDO",CA,CALIFORNIA,"US West",,,"=""2000""","Food and Kindred Products",311991,"Perishable Prepared Food Manufacturing",34,125,12/31/20,"7,852,544,000",12/31/20,"406,785,000","-52,752,000",,"468,006,000"
7973,"Other income taxes","Accounting for Income Taxes",445067,12/31/20,03/01/21,2,"Ernst & Young LLP",,,,"New York",NY,"NEW YORK","US Mid Atlantic",10-K,2021-03-01,,"BGC Group, Inc.",1094831,"=""BGC""","499 PARK AVENUE",,"NEW YORK",NY,"NEW YORK","US Mid Atlantic",,,"=""6200""","Security & Commodity Brokers, Dealers, Exchanges & Services",523120,"Securities Brokerage",34,4,12/29/20,"1,257,340,544",12/31/20,"1,980,154,000","45,062,000","-68,458,000","3,953,242,000"
4529,"Other contingent liabilities","Samarco dam failure provisions and contingent liabilities",432566,06/30/20,09/22/20,2,"Ernst & Young LLP",32,"Ernst & Young",1435,Melbourne,C3,AUSTRALIA,Foreign,20-F,2020-09-22,,"BHP Group Ltd",811809,"=""BHP""","LEVEL 27","180 LONSDALE STREET",MELBOURNE,C3,AUSTRALIA,Foreign,,,"=""1000""","Metal mining",212210,"Iron Ore Mining",34,50,07/02/20,"73,749,389,312",06/30/20,"38,924,000,000","7,956,000,000","47,312,000,000","104,783,000,000"
4530,"Long-lived assets","Long-lived asset impairment",432566,06/30/20,09/22/20,2,"Ernst & Young LLP",32,"Ernst & Young",1435,Melbourne,C3,AUSTRALIA,Foreign,20-F,2020-09-22,,"BHP Group Ltd",811809,"=""BHP""","LEVEL 27","180 LONSDALE STREET",MELBOURNE,C3,AUSTRALIA,Foreign,,,"=""1000""","Metal mining",212210,"Iron Ore Mining",34,50,07/02/20,"73,749,389,312",06/30/20,"38,924,000,000","7,956,000,000","47,312,000,000","104,783,000,000"
4531,"Asset retirement and environmental obligations","Closure and rehabilitation provisions",432566,06/30/20,09/22/20,2,"Ernst & Young LLP",32,"Ernst & Young",1435,Melbourne,C3,AUSTRALIA,Foreign,20-F,2020-09-22,,"BHP Group Ltd",811809,"=""BHP""","LEVEL 27","180 LONSDALE STREET",MELBOURNE,C3,AUSTRALIA,Foreign,,,"=""1000""","Metal mining",212210,"Iron Ore Mining",34,50,07/02/20,"73,749,389,312",06/30/20,"38,924,000,000","7,956,000,000","47,312,000,000","104,783,000,000"
4526,"Other contingent liabilities","Samarco dam failure provisions and contingent liabilities",432565,06/30/20,09/22/20,2,"Ernst & Young LLP",57,"Ernst & Young LLP",1438,London,X0,"UNITED KINGDOM",Foreign,20-F,2020-09-22,,"BHP Group Plc",1171264,,"8TH FLOOR - NEATHOUSE PLACE",,LONDON,X0,"UNITED KINGDOM",Foreign,,,"=""1220""","Silver Ores",212210,"Iron Ore Mining",34,41,07/02/20,"43,614,281,728",06/30/20,"42,931,000,000","7,956,000,000","46,291,000,000","105,733,000,000"
4527,"Long-lived assets","Long-lived asset impairment",432565,06/30/20,09/22/20,2,"Ernst & Young LLP",57,"Ernst & Young LLP",1438,London,X0,"UNITED KINGDOM",Foreign,20-F,2020-09-22,,"BHP Group Plc",1171264,,"8TH FLOOR - NEATHOUSE PLACE",,LONDON,X0,"UNITED KINGDOM",Foreign,,,"=""1220""","Silver Ores",212210,"Iron Ore Mining",34,41,07/02/20,"43,614,281,728",06/30/20,"42,931,000,000","7,956,000,000","46,291,000,000","105,733,000,000"
4528,"Asset retirement and environmental obligations","Closure and rehabilitation provisions",432565,06/30/20,09/22/20,2,"Ernst & Young LLP",57,"Ernst & Young LLP",1438,London,X0,"UNITED KINGDOM",Foreign,20-F,2020-09-22,,"BHP Group Plc",1171264,,"8TH FLOOR - NEATHOUSE PLACE",,LONDON,X0,"UNITED KINGDOM",Foreign,,,"=""1220""","Silver Ores",212210,"Iron Ore Mining",34,41,07/02/20,"43,614,281,728",06/30/20,"42,931,000,000","7,956,000,000","46,291,000,000","105,733,000,000"
8328,"Long-lived assets","Property and Equipment, Net, and Operating Lease Right-of-Use Assets, Net - Impairment of Long-Lived Assets - Refer to Notes 2 and 4 to the financial statements",445893,01/03/21,03/03/21,3,"Deloitte & Touche LLP",,,,"Los Angeles",CA,CALIFORNIA,"US West",10-K,2021-03-03,,"BIG 5 SPORTING GOODS Corp",1156388,"=""BGFV""","2525 EAST EL SEGUNDO BOULEVARD",,"EL SEGUNDO",CA,CALIFORNIA,"US West",,,"=""5940""","Retail-Miscellaneous Shopping Goods Stores",451110,"Sporting Goods Stores",34,11,01/05/21,"240,973,344",01/03/21,"1,041,212,000","55,940,000",,"699,994,000"
8329,Inventory,"Inventory - Valuation of Merchandise Inventories, Net - Refer to Note 2 to the financial statements",445893,01/03/21,03/03/21,3,"Deloitte & Touche LLP",,,,"Los Angeles",CA,CALIFORNIA,"US West",10-K,2021-03-03,,"BIG 5 SPORTING GOODS Corp",1156388,"=""BGFV""","2525 EAST EL SEGUNDO BOULEVARD",,"EL SEGUNDO",CA,CALIFORNIA,"US West",,,"=""5940""","Retail-Miscellaneous Shopping Goods Stores",451110,"Sporting Goods Stores",34,11,01/05/21,"240,973,344",01/03/21,"1,041,212,000","55,940,000",,"699,994,000"
8179,"Property, plant and equipment","Property and Equipment — Refer to Note 5 to the financial statements",445023,12/31/20,02/27/21,3,"Deloitte & Touche LLP",,,,Indianapolis,IN,INDIANA,"US Midwest",10-K,2021-03-01,,"Biglari Holdings Inc.",1726173,"=""BH""","19100 RIDGEWOOD PKWY, SUITE 1200",,"SAN ANTONIO",TX,TEXAS,"US Southwest",,,"=""5812""","Eating and Drinking Places",722110,"Full-Service Restaurants",34,118,12/29/20,"244,078,832",12/31/20,"433,683,000","-37,989,000","487,167,000","1,017,968,000"
8557,"Revenue from customer contracts","Revenue recognition for in-game virtual items",446656,12/31/20,03/05/21,1,"PricewaterhouseCoopers LLP",94,"PricewaterhouseCoopers Zhong Tian LLP",1424,Beijing,F4,CHINA,Foreign,20-F,2021-03-05,,"Bilibili Inc.",1723690,"=""BILI""","17TH FLOOR, BUILDING 3, GUOZHENG CENTER","NO. 485 ZHENGLI ROAD, YANGPU DISTRICT",SHANGHAI,F4,CHINA,Foreign,,,"=""7374""","Computer Processing and Data Preparation and Processing Services",516110,"Internet Publishing and Broadcasting",34,82,12/29/20,"20,014,848,000",12/31/20,"1,834,762,000","-460,519,000","603,604,000","3,649,287,000"
7918,"Pension and other post-employment benefits","Defined Benefit Plan Assets—Hedge Fund and Private Equity Fund Valuation—Refer to Note 1 and Note 12 to the financial statements",445114,12/31/20,03/01/21,3,"Deloitte & Touche LLP",,,,Dayton,OH,OHIO,"US Midwest",10-K,2021-03-01,,"Billerud Americas Corp",1421182,,"8540 GANDER CREEK DRIVE",,MIAMISBURG,OH,OHIO,"US Midwest",,,"=""2621""","Paper Mills",322121,"Paper (except Newsprint) Mills",34,12,12/29/20,"401,642,560",12/31/20,"1,359,000,000","-101,000,000","640,000,000","1,245,000,000"
8728,"Research and development expenses","Accrued and Prepaid Research and Development Expenses",447840,12/31/20,03/09/21,2,"Ernst & Young LLP",,,,Houston,TX,TEXAS,"US Southwest",10-K,2021-03-09,,"BIO-PATH HOLDINGS, INC.",1133818,"=""BPTH""","4710 BELLAIRE BOULEVARD","SUITE 210",BELLAIRE,TX,TEXAS,"US Southwest",,,"=""2834""","Pharmaceutical Preparations",541710,"Research and Development in the Physical, Engineering, and Life Sciences",34,4,12/31/20,"15,897,000",12/31/20,,"-10,882,000",,"16,475,000"
5353,Leases,"Assessment of Lease Term for Reagent Rental Arrangements",441839,12/31/20,02/12/21,4,"KPMG LLP",,,,"Santa Clara",CA,CALIFORNIA,"US West",10-K,2021-02-16,,"BIO-RAD LABORATORIES, INC.",12208,"=""BIO""","1000 ALFRED NOBEL DRIVE",,HERCULES,CA,CALIFORNIA,"US West",,,"=""3826""","Laboratory Analytical Instruments",334516,"Analytical Laboratory Instrument Manufacturing",34,583,12/31/20,"14,438,181,888",12/31/20,"2,545,626,000","3,814,229,000","9,388,527,000","12,972,618,000"
4476,Goodwill,"Goodwill impairment analysis for the Exosome reporting unit",431330,06/30/20,08/26/20,4,"KPMG LLP",,,,Minneapolis,MN,MINNESOTA,"US Midwest",10-K,2020-08-26,,"BIO-TECHNE Corp",842023,"=""TECH""","614 MCKINLEY PL N E","SUITE 1500",MINNEAPOLIS,MN,MINNESOTA,"US Midwest",,,"=""2836""","Biological Products, Except Diagnostic Substances",325413,"In-Vitro Diagnostic Substance Manufacturing",34,264,06/30/20,"10,154,680,320",06/30/20,"738,691,000","229,296,000","136,538,000","2,027,589,000"
7938,"Research and development expenses","Accrued Clinical Trial and Manufacturing Activities",445121,12/31/20,03/01/21,2,"Ernst & Young LLP",,,,Raleigh,NC,"NORTH CAROLINA","US Southeast",10-K,2021-03-01,,"BIOCRYST PHARMACEUTICALS INC",882796,"=""BCRX""","4505 EMPEROR BOULEVARD","SUITE 200",DURHAM,NC,"NORTH CAROLINA","US Southeast",,,"=""2836""","Biological Products, Except Diagnostic Substances",325414,"Biological Product (except Diagnostic) Manufacturing",34,7,12/31/20,"1,317,778,304",12/31/20,"17,812,000","-182,814,000",,"334,715,000"
7939,"Revenue from customer contracts","Valuation of Royalty Financing Obligation",445121,12/31/20,03/01/21,2,"Ernst & Young LLP",,,,Raleigh,NC,"NORTH CAROLINA","US Southeast",10-K,2021-03-01,,"BIOCRYST PHARMACEUTICALS INC",882796,"=""BCRX""","4505 EMPEROR BOULEVARD","SUITE 200",DURHAM,NC,"NORTH CAROLINA","US Southeast",,,"=""2836""","Biological Products, Except Diagnostic Substances",325414,"Biological Product (except Diagnostic) Manufacturing",34,7,12/31/20,"1,317,778,304",12/31/20,"17,812,000","-182,814,000",,"334,715,000"
8994,"Sales return and allowances","Reserves for Medicaid rebates and product returns related to product sales",448171,12/31/20,03/11/21,2,"Ernst & Young LLP",,,,Raleigh,NC,"NORTH CAROLINA","US Southeast",10-K,2021-03-11,,"BIODELIVERY SCIENCES INTERNATIONAL INC",1103021,,"4131 PARKLAKE AVENUE","SUITE 225",RALEIGH,NC,"NORTH CAROLINA","US Southeast",,,"=""2834""","Pharmaceutical Preparations",325412,"Pharmaceutical Preparation Manufacturing",34,4,12/31/20,"425,688,672",12/31/20,"156,471,000","25,711,000","52,143,000","239,894,000"
4963,"Sales return and allowances","Reserves for Medicaid and Managed Care Rebates",440803,12/31/20,02/03/21,1,"PricewaterhouseCoopers LLP",,,,Boston,MA,MASSACHUSETTS,"US New England",10-K,2021-02-03,,"BIOGEN INC.",875045,"=""BIIB""","225 BINNEY STREET",,CAMBRIDGE,MA,MASSACHUSETTS,"US New England",,,"=""2836""","Biological Products, Except Diagnostic Substances",325414,"Biological Product (except Diagnostic) Manufacturing",34,245,12/31/20,"37,316,665,344",12/31/20,"13,444,600,000","4,000,600,000","1,853,900,000","24,618,900,000"
7883,"Deferred income taxes","Income Taxes - Intra-entity Transfer of Intellectual Property Rights",445563,12/31/20,03/01/21,2,"Ernst & Young LLP",,,,Hartford,CT,CONNECTICUT,"US New England",10-K,2021-03-01,,"Biohaven Pharmaceutical Holding Co Ltd.",1689813,,"215 CHURCH STREET",,"NEW HAVEN",CT,CONNECTICUT,"US New England",,,"=""2834""","Pharmaceutical Preparations",325412,"Pharmaceutical Preparation Manufacturing",34,86,12/31/20,"5,180,044,800",12/31/20,"63,627,000","-766,796,000","-369,457,000","686,975,000"
7884,"Other expenses","Liability Related to the Sale of Future Royalties and Non-cash Interest Expense",445563,12/31/20,03/01/21,2,"Ernst & Young LLP",,,,Hartford,CT,CONNECTICUT,"US New England",10-K,2021-03-01,,"Biohaven Pharmaceutical Holding Co Ltd.",1689813,,"215 CHURCH STREET",,"NEW HAVEN",CT,CONNECTICUT,"US New England",,,"=""2834""","Pharmaceutical Preparations",325412,"Pharmaceutical Preparation Manufacturing",34,86,12/31/20,"5,180,044,800",12/31/20,"63,627,000","-766,796,000","-369,457,000","686,975,000"
7885,"Derivatives and hedging","Derivative Liability - Series B Preferred Forward Contract",445563,12/31/20,03/01/21,2,"Ernst & Young LLP",,,,Hartford,CT,CONNECTICUT,"US New England",10-K,2021-03-01,,"Biohaven Pharmaceutical Holding Co Ltd.",1689813,,"215 CHURCH STREET",,"NEW HAVEN",CT,CONNECTICUT,"US New England",,,"=""2834""","Pharmaceutical Preparations",325412,"Pharmaceutical Preparation Manufacturing",34,86,12/31/20,"5,180,044,800",12/31/20,"63,627,000","-766,796,000","-369,457,000","686,975,000"
6073,"Other intangible assets","Intellectual Property Impairment Assessment",443056,12/31/20,02/22/21,1,"PricewaterhouseCoopers LLP",223,"Kesselman & Kesselman",1309,"Tel Aviv",L3,ISRAEL,Foreign,20-F,2021-02-23,,"BioLineRx Ltd.",1498403,"=""BLRX""","2 HAMAAYAN STREET","MODI-IN TECHNOLOGY PARK",MODI-IN,L3,ISRAEL,Foreign,,,"=""2834""","Pharmaceutical Preparations",541710,"Research and Development in the Physical, Engineering, and Life Sciences",34,2,12/29/20,"28,316,564",12/31/20,,"-30,021,000","316,000","47,290,000"
7154,"Revenue from customer contracts","Evaluation of variable consideration relating to Aldurazyme product sales",444796,12/31/20,02/26/21,4,"KPMG LLP",,,,"San Francisco",CA,CALIFORNIA,"US West",10-K,2021-02-26,,"BIOMARIN PHARMACEUTICAL INC",1048477,"=""BMRN""","105 DIGITAL DRIVE",,NOVATO,CA,CALIFORNIA,"US West",,,"=""2834""","Pharmaceutical Preparations",325412,"Pharmaceutical Preparation Manufacturing",34,88,12/31/20,"15,936,868,352",12/31/20,"1,860,455,000","854,029,000","3,552,662,000","5,848,020,000"
7155,"Deferred income taxes","Evaluation of the fair value of the underlying intangible assets utilized to recognize a deferred tax asset
",444796,12/31/20,02/26/21,4,"KPMG LLP",,,,"San Francisco",CA,CALIFORNIA,"US West",10-K,2021-02-26,,"BIOMARIN PHARMACEUTICAL INC",1048477,"=""BMRN""","105 DIGITAL DRIVE",,NOVATO,CA,CALIFORNIA,"US West",,,"=""2834""","Pharmaceutical Preparations",325412,"Pharmaceutical Preparation Manufacturing",34,88,12/31/20,"15,936,868,352",12/31/20,"1,860,455,000","854,029,000","3,552,662,000","5,848,020,000"
10157,"Research and development expenses","Accounting for cost-sharing and related revenue recognition under Genentech and Pfizer Collaboration Agreements",451222,12/31/20,03/30/21,2,"Ernst & Young LLP",271,"Ernst & Young GmbH Wirtschaftsprüfungsgesellschaft (Inactive)",1251,Cologne,2M,GERMANY,Foreign,20-F,2021-03-30,,"BioNTech SE",1776985,"=""BNTX""","AN DER GOLDGRUBE 12",,MAINZ,2M,GERMANY,Foreign,,,"=""2836""","Biological Products, Except Diagnostic Substances",325414,"Biological Product (except Diagnostic) Manufacturing",33,88,12/29/20,"20,020,115,456",12/31/20,"590,152,000","18,596,000","1,478,300,000","2,836,900,000"
10158,"Business combinations","Valuation of IPR&D acquired within Business Combinations of Neon",451222,12/31/20,03/30/21,2,"Ernst & Young LLP",271,"Ernst & Young GmbH Wirtschaftsprüfungsgesellschaft (Inactive)",1251,Cologne,2M,GERMANY,Foreign,20-F,2021-03-30,,"BioNTech SE",1776985,"=""BNTX""","AN DER GOLDGRUBE 12",,MAINZ,2M,GERMANY,Foreign,,,"=""2836""","Biological Products, Except Diagnostic Substances",325414,"Biological Product (except Diagnostic) Manufacturing",33,88,12/29/20,"20,020,115,456",12/31/20,"590,152,000","18,596,000","1,478,300,000","2,836,900,000"
3503,"Other intangible assets","Impairment Assessment of the Trade Name Intangible Asset",422340,02/01/20,03/19/20,1,"PricewaterhouseCoopers LLP",,,,Boston,MA,MASSACHUSETTS,"US New England",10-K,2020-03-19,,"BJ's Wholesale Club Holdings, Inc.",1531152,"=""BJ""","350 CAMPUS DRIVE",,MARLBOROUGH,MA,MASSACHUSETTS,"US New England",,,"=""5331""","Variety Stores",452910,"Warehouse Clubs and Supercenters",34,20,02/03/20,"2,811,217,920",02/01/20,"13,190,707,000","187,176,000","-1,125,463,000","5,269,780,000"
8073,"Long-lived assets","Impairment of Long-lived Assets",445578,12/29/20,03/01/21,2,"Ernst & Young LLP",,,,Irvine,CA,CALIFORNIA,"US West",10-K,2021-03-01,,"BJs RESTAURANTS INC",1013488,"=""BJRI""","7755 CENTER AVENUE","SUITE 300","HUNTINGTON BEACH",CA,CALIFORNIA,"US West",,,"=""5812""","Eating and Drinking Places",722110,"Full-Service Restaurants",34,38,12/31/20,"859,019,840",12/29/20,"778,510,000","-57,885,000","289,115,000","1,059,424,000"
8074,"Other contingent liabilities","Workers’ Compensation and General Liability Reserve",445578,12/29/20,03/01/21,2,"Ernst & Young LLP",,,,Irvine,CA,CALIFORNIA,"US West",10-K,2021-03-01,,"BJs RESTAURANTS INC",1013488,"=""BJRI""","7755 CENTER AVENUE","SUITE 300","HUNTINGTON BEACH",CA,CALIFORNIA,"US West",,,"=""5812""","Eating and Drinking Places",722110,"Full-Service Restaurants",34,38,12/31/20,"859,019,840",12/29/20,"778,510,000","-57,885,000","289,115,000","1,059,424,000"
7124,"Regulatory assets and liabilities","Regulatory Accounting - Impact of Rate Regulation on the Financial Statements — Refer to Notes 1 and 2 to the Financial Statements.",444782,12/31/20,02/26/21,3,"Deloitte & Touche LLP",,,,Minneapolis,MN,MINNESOTA,"US Midwest",10-K,2021-02-26,,"BLACK HILLS CORP /SD/",1130464,"=""BKH""","7001 MT RUSHMORE RD","PO BOX 1400","RAPID CITY",SD,"SOUTH DAKOTA","US Midwest",,,"=""4911""","Electric Services",221119,"Other Electric Power Generation",34,61,12/31/20,"3,858,733,568",12/31/20,"1,696,941,000","227,608,000","1,249,987,000","8,088,786,000"
7116,"Revenue from customer contracts","Assessment of revenue recognition for contracts with multiple performance obligations or modifications",444854,12/31/20,02/26/21,4,"KPMG LLP",,,,Jacksonville,FL,FLORIDA,"US Southeast",10-K,2021-02-26,,"Black Knight, Inc.",1627014,,"601 RIVERSIDE AVENUE",,JACKSONVILLE,FL,FLORIDA,"US Southeast",,,"=""7372""","Prepackaged Software",541611,"Administrative Management and General Management Consulting Services",34,88,12/31/20,"13,872,249,856",12/31/20,"1,238,500,000","264,100,000","-1,598,300,000","6,090,500,000"
7117,"Business combinations","Evaluation of the acquisition-date fair value of the client relationship intangible assets and computer software assets acquired in the Optimal Blue transaction",444854,12/31/20,02/26/21,4,"KPMG LLP",,,,Jacksonville,FL,FLORIDA,"US Southeast",10-K,2021-02-26,,"Black Knight, Inc.",1627014,,"601 RIVERSIDE AVENUE",,JACKSONVILLE,FL,FLORIDA,"US Southeast",,,"=""7372""","Prepackaged Software",541611,"Administrative Management and General Management Consulting Services",34,88,12/31/20,"13,872,249,856",12/31/20,"1,238,500,000","264,100,000","-1,598,300,000","6,090,500,000"
6162,"Proven and unproven reserves","Depreciation, Depletion and Amortization (“DD&A”) and Impairment of Oil and Natural Gas Properties",443220,12/31/20,02/23/21,2,"Ernst & Young LLP",,,,Houston,TX,TEXAS,"US Southwest",10-K,2021-02-23,,"Black Stone Minerals, L.P.",1621434,"=""BSM""","1001 FANNIN STREET, SUITE 2020",,HOUSTON,TX,TEXAS,"US Southwest",,,"=""1311""","Crude Petroleum and Natural Gas",211111,"Crude Petroleum and Natural Gas Extraction",34,7,12/31/20,"1,381,083,264",12/31/20,"342,751,000","121,819,000",,"1,243,978,000"
6163,"Revenue from customer contracts","Revenues from Contracts with Customers Accrual",443220,12/31/20,02/23/21,2,"Ernst & Young LLP",,,,Houston,TX,TEXAS,"US Southwest",10-K,2021-02-23,,"Black Stone Minerals, L.P.",1621434,"=""BSM""","1001 FANNIN STREET, SUITE 2020",,HOUSTON,TX,TEXAS,"US Southwest",,,"=""1311""","Crude Petroleum and Natural Gas",211111,"Crude Petroleum and Natural Gas Extraction",34,7,12/31/20,"1,381,083,264",12/31/20,"342,751,000","121,819,000",,"1,243,978,000"
6111,"Revenue from customer contracts","Revenue recognition - Contracts with Multiple Performance Obligations",443026,12/31/20,02/23/21,1,"PricewaterhouseCoopers LLP",,,,Atlanta,GA,GEORGIA,"US Southeast",10-K,2021-02-23,,"BLACKBAUD INC",1280058,"=""BLKB""","65 FAIRCHILD STREET",,CHARLESTON,SC,"SOUTH CAROLINA","US Southeast",,,"=""7372""","Prepackaged Software",511210,"Software Publishers",34,58,12/31/20,"2,811,827,200",12/31/20,"913,219,000","7,717,000","-599,037,000","2,044,734,000"
3801,Goodwill,"Goodwill Impairment",423879,02/29/20,04/06/20,2,"Ernst & Young LLP",192,"Ernst & Young LLP Chartered Accountants",1263,Waterloo,A6,ONTARIO,Canada,10-K,2020-04-07,,"BLACKBERRY Ltd",1070235,"=""BB""","2200 UNIVERSITY AVENUE EAST",*,WATERLOO,A6,ONTARIO,Canada,,,"=""7372""","Prepackaged Software",518210,"Data Processing, Hosting, and Related Services",34,5,02/29/20,"2,865,208,832",02/29/20,"1,040,000,000","-152,000,000","177,000,000","3,888,000,000"
3802,"Revenue from customer contracts","Revenue Recognition – Licensing Revenues",423879,02/29/20,04/06/20,2,"Ernst & Young LLP",192,"Ernst & Young LLP Chartered Accountants",1263,Waterloo,A6,ONTARIO,Canada,10-K,2020-04-07,,"BLACKBERRY Ltd",1070235,"=""BB""","2200 UNIVERSITY AVENUE EAST",*,WATERLOO,A6,ONTARIO,Canada,,,"=""7372""","Prepackaged Software",518210,"Data Processing, Hosting, and Related Services",34,5,02/29/20,"2,865,208,832",02/29/20,"1,040,000,000","-152,000,000","177,000,000","3,888,000,000"
6871,"Business combinations","Acquisition of Rimilia - Valuation of Acquired Intangible Assets and Contingent Consideration Liability",443921,12/31/20,02/25/21,1,"PricewaterhouseCoopers LLP",,,,"Los Angeles",CA,CALIFORNIA,"US West",10-K,2021-02-25,,"BLACKLINE, INC.",1666134,"=""BL""","21300 VICTORY BOULEVARD","12TH FLOOR","WOODLAND HILLS",CA,CALIFORNIA,"US West",,,"=""7372""","Prepackaged Software",511210,"Software Publishers",34,133,12/31/20,"7,693,640,704",12/31/20,"351,737,000","-46,911,000","82,520,000","1,113,505,000"
8310,"Other investments","Fair value of financial instruments – Refer to Notes 2 and 10 to the financial statements",445942,12/31/20,03/03/21,3,"Deloitte & Touche LLP",,,,"New York",NY,"NEW YORK","US Mid Atlantic",10-K,2021-03-03,,"BlackRock Capital Investment Corp",1326003,,"50 HUDSON YARDS",,"NEW YORK",NY,"NEW YORK","US Mid Atlantic",,,,,523920,"Portfolio Management",34,3,12/31/20,"200,315,328",12/31/20,"51,531,286","-103,852,603",,"511,719,590"
6913,"Other intangible assets","Impairment of indefinite-lived intangible assets — Refer to Notes 2 and 12 to the financial statements",443882,12/31/20,02/25/21,3,"Deloitte & Touche LLP",,,,"New York",NY,"NEW YORK","US Mid Atlantic",10-K,2021-02-25,,"BlackRock Finance, Inc.",1364742,,"50 HUDSON YARDS",,"NEW YORK",NY,"NEW YORK","US Mid Atlantic",,,"=""6211""","Security Brokers, Dealers, and Flotation Companies",523120,"Securities Brokerage",34,706,12/29/20,"107,715,264,512",12/31/20,"16,000,000,000","4,932,000,000","4,791,000,000","176,982,000,000"
6660,"Other investments","Investment Valuation — Level 3 Investments — Refer to Note 2 to the financial statements",443778,12/31/20,02/25/21,3,"Deloitte & Touche LLP",,,,"Los Angeles",CA,CALIFORNIA,"US West",10-K,2021-02-25,,"BlackRock TCP Capital Corp.",1370755,"=""TCPC""","2951 28TH STREET","SUITE 1000","SANTA MONICA",CA,CALIFORNIA,"US West",,,,,525990,"Other Financial Vehicles",34,11,12/31/20,"649,304,064",12/31/20,"130,866,691","71,374,488",,"1,671,987,155"
7114,"Other investments","Fair Value of Underlying Investments to determine Performance Allocations and Accrued Performance Allocations — Refer to Notes 2 and 4 to the financial statements",444853,12/31/20,02/26/21,3,"Deloitte & Touche LLP",,,,"New York",NY,"NEW YORK","US Mid Atlantic",10-K,2021-02-26,,"Blackstone Inc.",1393818,"=""BX""","345 PARK AVENUE",,"NEW YORK",NY,"NEW YORK","US Mid Atlantic",,,"=""6282""","Investment Advice",523920,"Portfolio Management",34,65,12/31/20,"44,321,972,224",12/31/20,"5,935,765,000","1,045,363,000","4,467,764,000","26,269,252,000"
5073,"Allowance for credit losses","Current Expected Credit Loss (“CECL”) Reserve – Adjustments to Reflect Management’s Estimation of Economic Conditions – Refer to Note 2 in the Financial Statements",441344,12/31/20,02/10/21,3,"Deloitte & Touche LLP",,,,"New York",NY,"NEW YORK","US Mid Atlantic",10-K,2021-02-10,,"BLACKSTONE MORTGAGE TRUST, INC.",1061630,"=""BXMT""","345 PARK AVENUE","24TH FLOOR","NEW YORK",NY,"NEW YORK","US Mid Atlantic",,,"=""6798""","Real Estate Investment Trusts",525990,"Other Financial Vehicles",34,28,12/31/20,"4,040,854,272",12/31/20,"264,524,000","137,670,000",,"16,958,955,000"
5074,"Accounts/loans receivable","CECL Reserve – Estimation of Fair Value of Underlying Collateral of Impaired Loans – Refer to Note 2 and Note 3 in the Financial Statements",441344,12/31/20,02/10/21,3,"Deloitte & Touche LLP",,,,"New York",NY,"NEW YORK","US Mid Atlantic",10-K,2021-02-10,,"BLACKSTONE MORTGAGE TRUST, INC.",1061630,"=""BXMT""","345 PARK AVENUE","24TH FLOOR","NEW YORK",NY,"NEW YORK","US Mid Atlantic",,,"=""6798""","Real Estate Investment Trusts",525990,"Other Financial Vehicles",34,28,12/31/20,"4,040,854,272",12/31/20,"264,524,000","137,670,000",,"16,958,955,000"
9415,"Real estate investments","Allocation of Purchase Price for Investments in Real Estate — Refer to Notes 2, 3, and 4 to the financial statements",449266,12/31/20,03/17/21,3,"Deloitte & Touche LLP",,,,"New York",NY,"NEW YORK","US Mid Atlantic",10-K,2021-03-17,,"Blackstone Real Estate Income Trust, Inc.",1662972,"=""BSTT""","345 PARK AVENUE",,"NEW YORK",NY,"NEW YORK","US Mid Atlantic",,,"=""6798""","Real Estate Investment Trusts",525990,"Other Financial Vehicles",34,,,,12/31/20,"2,551,648,000","-853,399,000",,"40,684,015,000"
8483,"Other investments","Fair Value — Investments — Refer to Footnote 2 and 5 in the financial statements",446038,12/31/20,03/03/21,3,"Deloitte & Touche LLP",,,,"New York",NY,"NEW YORK","US Mid Atlantic",10-K,2021-03-04,,"Blackstone Secured Lending Fund",1736035,"=""BXSL""","345 PARK AVENUE","31ST FLOOR","NEW YORK",NY,"NEW YORK","US Mid Atlantic",,,,,525990,"Other Financial Vehicles",34,,,,12/31/20,"389,641,000","-4,361,000","3,267,809,000","5,950,866,000"
13164,"Other investments","Fair Value — Investments — Refer to Footnote 2 and 5 in the financial statements",464787,12/31/20,03/03/21,3,"Deloitte & Touche LLP",,,,"New York",NY,"NEW YORK","US Mid Atlantic",DRS,2021-07-29,,"Blackstone Secured Lending Fund",1736035,"=""BXSL""","345 PARK AVENUE","31ST FLOOR","NEW YORK",NY,"NEW YORK","US Mid Atlantic",,,,,525990,"Other Financial Vehicles",34,,,,12/31/20,"389,641,000","-4,361,000","3,267,809,000","5,950,866,000"
13180,"Other investments","Fair Value — Investments — Refer to Footnote 2 and 5 in the financial statements",464841,12/31/20,03/03/21,3,"Deloitte & Touche LLP",,,,"New York",NY,"NEW YORK","US Mid Atlantic",N-2,2021-10-01,,"Blackstone Secured Lending Fund",1736035,"=""BXSL""","345 PARK AVENUE","31ST FLOOR","NEW YORK",NY,"NEW YORK","US Mid Atlantic",,,,,525990,"Other Financial Vehicles",34,,,,12/31/20,"389,641,000","-4,361,000","3,267,809,000","5,950,866,000"
13330,"Other investments","Fair Value — Investments — Refer to Footnote 2 and 5 in the financial statements",465675,12/31/20,03/03/21,3,"Deloitte & Touche LLP",,,,"New York",NY,"NEW YORK","US Mid Atlantic",N-2/A,2021-10-18,,"Blackstone Secured Lending Fund",1736035,"=""BXSL""","345 PARK AVENUE","31ST FLOOR","NEW YORK",NY,"NEW YORK","US Mid Atlantic",,,,,525990,"Other Financial Vehicles",34,,,,12/31/20,"389,641,000","-4,361,000","3,267,809,000","5,950,866,000"
13435,"Other investments","Fair Value — Investments — Refer to Footnote 2 and 5 in the financial statements",466587,12/31/20,03/03/21,3,"Deloitte & Touche LLP",,,,"New York",NY,"NEW YORK","US Mid Atlantic",424B1,2021-10-29,,"Blackstone Secured Lending Fund",1736035,"=""BXSL""","345 PARK AVENUE","31ST FLOOR","NEW YORK",NY,"NEW YORK","US Mid Atlantic",,,,,525990,"Other Financial Vehicles",34,,,,12/31/20,"389,641,000","-4,361,000","3,267,809,000","5,950,866,000"
6226,"Sales return and allowances","Accrued transaction losses",443180,12/31/20,02/23/21,2,"Ernst & Young LLP",,,,"San Francisco",CA,CALIFORNIA,"US West",10-K,2021-02-23,,"Block, Inc.",1512673,"=""XYZ""","1955 BROADWAY","SUITE 600",OAKLAND,CA,CALIFORNIA,"US West",,,"=""7372""","Prepackaged Software",511210,"Software Publishers",34,218,12/31/20,"84,920,311,808",12/31/20,"9,497,578,000","213,105,000","2,227,256,000","9,869,550,000"
6227,"Other debt","Convertible Senior Notes",443180,12/31/20,02/23/21,2,"Ernst & Young LLP",,,,"San Francisco",CA,CALIFORNIA,"US West",10-K,2021-02-23,,"Block, Inc.",1512673,"=""XYZ""","1955 BROADWAY","SUITE 600",OAKLAND,CA,CALIFORNIA,"US West",,,"=""7372""","Prepackaged Software",511210,"Software Publishers",34,218,12/31/20,"84,920,311,808",12/31/20,"9,497,578,000","213,105,000","2,227,256,000","9,869,550,000"
7597,"Revenue from customer contracts","Revenue Recognition — Refer to Notes 2 and 3 to the financial statements",444926,12/31/20,02/26/21,3,"Deloitte & Touche LLP",,,,"San Jose",CA,CALIFORNIA,"US West",10-K,2021-02-26,,"Bloom Energy Corp",1664703,"=""BE""","4353 NORTH FIRST STREET",,"SAN JOSE",CA,CALIFORNIA,"US West",,,"=""3620""","Electrical Industrial Apparatus",335311,"Power, Distribution, and Specialty Transformer Manufacturing",34,29,12/31/20,"4,015,112,192",12/31/20,"794,247,000","-157,553,000",,"1,454,387,000"
7598,"Other debt","Convertible Notes – Refer to Notes 5 and 7 to the financial statements
",444926,12/31/20,02/26/21,3,"Deloitte & Touche LLP",,,,"San Jose",CA,CALIFORNIA,"US West",10-K,2021-02-26,,"Bloom Energy Corp",1664703,"=""BE""","4353 NORTH FIRST STREET",,"SAN JOSE",CA,CALIFORNIA,"US West",,,"=""3620""","Electrical Industrial Apparatus",335311,"Power, Distribution, and Specialty Transformer Manufacturing",34,29,12/31/20,"4,015,112,192",12/31/20,"794,247,000","-157,553,000",,"1,454,387,000"
6478,"Insurance contract liabilities","Valuation of Insurance Reserves",443438,12/27/20,02/24/21,1,"PricewaterhouseCoopers LLP",,,,Tampa,FL,FLORIDA,"US Southeast",10-K,2021-02-24,,"Bloomin' Brands, Inc.",1546417,"=""BLMN""","2202 NORTH WEST SHORE BOULEVARD","SUITE 500",TAMPA,FL,FLORIDA,"US Southeast",,,"=""5812""","Eating and Drinking Places",722110,"Full-Service Restaurants",34,19,12/31/20,"1,706,155,136",12/27/20,"3,170,561,000","-158,715,000","-727,002,000","3,362,107,000"
6479,Goodwill,"Goodwill Interim Impairment Assessment of One International Reporting Unit",443438,12/27/20,02/24/21,1,"PricewaterhouseCoopers LLP",,,,Tampa,FL,FLORIDA,"US Southeast",10-K,2021-02-24,,"Bloomin' Brands, Inc.",1546417,"=""BLMN""","2202 NORTH WEST SHORE BOULEVARD","SUITE 500",TAMPA,FL,FLORIDA,"US Southeast",,,"=""5812""","Eating and Drinking Places",722110,"Full-Service Restaurants",34,19,12/31/20,"1,706,155,136",12/27/20,"3,170,561,000","-158,715,000","-727,002,000","3,362,107,000"
6842,"Other investments","Fair value of investments",444977,12/31/20,02/23/21,4,"KPMG LLP",,,,"New York",NY,"NEW YORK","US Mid Atlantic",10-K,2021-02-23,,"Blue Owl Capital Corp",1655888,"=""OBDC""","399 PARK AVENUE",,"NEW YORK",NY,"NEW YORK","US Mid Atlantic",,,,,525990,"Other Financial Vehicles",34,13,12/29/20,"5,046,962,176",12/31/20,"650,348,000","387,740,000",,"11,304,357,000"
6220,"Revenue from customer contracts","Amendment to the Bristol-Myers Squibb Collaboration Agreement",443160,12/31/20,02/23/21,2,"Ernst & Young LLP",,,,Boston,MA,MASSACHUSETTS,"US New England",10-K,2021-02-23,,"bluebird bio, Inc.",1293971,,"455 GRAND UNION BOULEVARD",,SOMERVILLE,MA,MASSACHUSETTS,"US New England",,,"=""2836""","Biological Products, Except Diagnostic Substances",325414,"Biological Product (except Diagnostic) Manufacturing",34,43,12/31/20,"1,860,793,600",12/31/20,"250,734,000","-618,695,000","1,331,887,000","1,781,252,000"
6221,"Research and development expenses","Bristol-Myers Squibb Ide-cel Co-Development, Co-Promote and Profit Share Agreement",443160,12/31/20,02/23/21,2,"Ernst & Young LLP",,,,Boston,MA,MASSACHUSETTS,"US New England",10-K,2021-02-23,,"bluebird bio, Inc.",1293971,,"455 GRAND UNION BOULEVARD",,SOMERVILLE,MA,MASSACHUSETTS,"US New England",,,"=""2836""","Biological Products, Except Diagnostic Substances",325414,"Biological Product (except Diagnostic) Manufacturing",34,43,12/31/20,"1,860,793,600",12/31/20,"250,734,000","-618,695,000","1,331,887,000","1,781,252,000"
6222,"Research and development expenses","Accrued Clinical and Contract Research Organization Costs and Manufacturing Costs",443160,12/31/20,02/23/21,2,"Ernst & Young LLP",,,,Boston,MA,MASSACHUSETTS,"US New England",10-K,2021-02-23,,"bluebird bio, Inc.",1293971,,"455 GRAND UNION BOULEVARD",,SOMERVILLE,MA,MASSACHUSETTS,"US New England",,,"=""2836""","Biological Products, Except Diagnostic Substances",325414,"Biological Product (except Diagnostic) Manufacturing",34,43,12/31/20,"1,860,793,600",12/31/20,"250,734,000","-618,695,000","1,331,887,000","1,781,252,000"
5558,"Revenue from customer contracts","Roche – Pralsetinib Collaboration",442131,12/31/20,02/17/21,2,"Ernst & Young LLP",,,,Boston,MA,MASSACHUSETTS,"US New England",10-K,2021-02-17,,"Blueprint Medicines Corp",1597264,,"45 SIDNEY STREET",,CAMBRIDGE,MA,MASSACHUSETTS,"US New England",,,"=""2834""","Pharmaceutical Preparations",325412,"Pharmaceutical Preparation Manufacturing",34,112,12/31/20,"6,481,544,704",12/31/20,"793,735,000","313,882,000",,"1,718,393,000"
5559,"Research and development expenses","Accrued Clinical Trial Expenses",442131,12/31/20,02/17/21,2,"Ernst & Young LLP",,,,Boston,MA,MASSACHUSETTS,"US New England",10-K,2021-02-17,,"Blueprint Medicines Corp",1597264,,"45 SIDNEY STREET",,CAMBRIDGE,MA,MASSACHUSETTS,"US New England",,,"=""2834""","Pharmaceutical Preparations",325412,"Pharmaceutical Preparation Manufacturing",34,112,12/31/20,"6,481,544,704",12/31/20,"793,735,000","313,882,000",,"1,718,393,000"
5031,Goodwill,"Goodwill – Refer to Notes 2 and 8 to the financial statements",441244,12/31/20,02/09/21,3,"Deloitte & Touche LLP",,,,Houston,TX,TEXAS,"US Southwest",10-K,2021-02-09,,"Boardwalk Pipeline Partners, LP",1336047,,"9 GREENWAY PLAZA, SUITE 2800",,HOUSTON,TX,TEXAS,"US Southwest",,,"=""4922""","Natural Gas Transmission",486210,"Pipeline Transportation of Natural Gas",34,,,,12/31/20,"1,297,600,000","290,500,000","5,011,700,000","9,229,900,000"
4935,"Revenue from customer contracts","Cost Estimates for Fixed-Price Development Contracts – Refer to Notes 1 and 13 to the financial statements",440644,12/31/20,02/01/21,3,"Deloitte & Touche LLP",,,,Chicago,IL,ILLINOIS,"US Midwest",10-K,2021-02-01,,"BOEING CO",12927,"=""BA""","100 N RIVERSIDE PLZ",,CHICAGO,IL,ILLINOIS,"US Midwest",,,"=""3721""",Aircraft,336411,"Aircraft Manufacturing",34,214,12/31/20,"124,651,446,272",12/31/20,"58,158,000,000","-11,873,000,000","-29,240,000,000","152,136,000,000"
4936,"Revenue from customer contracts","Program Accounting Estimates for the 777X Program – Refer to Notes 1 and 7 to the financial statements",440644,12/31/20,02/01/21,3,"Deloitte & Touche LLP",,,,Chicago,IL,ILLINOIS,"US Midwest",10-K,2021-02-01,,"BOEING CO",12927,"=""BA""","100 N RIVERSIDE PLZ",,CHICAGO,IL,ILLINOIS,"US Midwest",,,"=""3721""",Aircraft,336411,"Aircraft Manufacturing",34,214,12/31/20,"124,651,446,272",12/31/20,"58,158,000,000","-11,873,000,000","-29,240,000,000","152,136,000,000"
4937,"Other contingent liabilities","Liabilities related to the 737 MAX Grounding – Refer to Notes 13 and 21 to the financial statements",440644,12/31/20,02/01/21,3,"Deloitte & Touche LLP",,,,Chicago,IL,ILLINOIS,"US Midwest",10-K,2021-02-01,,"BOEING CO",12927,"=""BA""","100 N RIVERSIDE PLZ",,CHICAGO,IL,ILLINOIS,"US Midwest",,,"=""3721""",Aircraft,336411,"Aircraft Manufacturing",34,214,12/31/20,"124,651,446,272",12/31/20,"58,158,000,000","-11,873,000,000","-29,240,000,000","152,136,000,000"
4938,"Deferred income taxes","Income Taxes – Realizability of Deferred Tax Assets– Refer to Notes 1 and 4 to the financial statements",440644,12/31/20,02/01/21,3,"Deloitte & Touche LLP",,,,Chicago,IL,ILLINOIS,"US Midwest",10-K,2021-02-01,,"BOEING CO",12927,"=""BA""","100 N RIVERSIDE PLZ",,CHICAGO,IL,ILLINOIS,"US Midwest",,,"=""3721""",Aircraft,336411,"Aircraft Manufacturing",34,214,12/31/20,"124,651,446,272",12/31/20,"58,158,000,000","-11,873,000,000","-29,240,000,000","152,136,000,000"
7654,Goodwill,"Goodwill Reallocation – Fair Value of the Carrier Services Reporting Unit",445406,12/31/20,03/01/21,1,"PricewaterhouseCoopers LLP",,,,"Los Angeles",CA,CALIFORNIA,"US West",10-K,2021-03-01,,"BOINGO WIRELESS, INC.",1169988,,"10960 WILSHIRE BLVD., 23RD FLOOR",,"LOS ANGELES",CA,CALIFORNIA,"US West",,,"=""4899""","Communications Services, NEC",517212,"Cellular and Other Wireless Telecommunications",34,13,12/31/20,"567,706,304",12/31/20,"237,416,000","-17,093,000","12,296,000","576,479,000"
6040,"Sales return and allowances","Customer rebates payable for engineered wood products",442949,12/31/20,02/22/21,4,"KPMG LLP",,,,Boise,ID,IDAHO,"US West",10-K,2021-02-22,,"BOISE CASCADE Co",1328581,"=""BCC""","1111 WEST JEFFERSON STREET, SUITE 300","P. O. BOX 50",BOISE,ID,IDAHO,"US West",,,"=""5030""","Wholesale-Lumber & Other Construction Materials",321999,"All Other Miscellaneous Wood Product Manufacturing",34,48,12/31/20,"1,873,807,744",12/31/20,"5,474,838,000","174,979,000","773,843,000","1,965,718,000"
6325,"Allowance for credit losses","Allowance for credit losses",443354,12/31/20,02/24/21,2,"Ernst & Young LLP",,,,Tulsa,OK,OKLAHOMA,"US Southwest",10-K,2021-02-24,,"BOK FINANCIAL CORP",875357,"=""BOKF""","BANK OF OKLAHOMA TOWER","BOSTON AVENUE AT SECOND STREET",TULSA,OK,OKLAHOMA,"US Southwest",,,"=""6021""","National Commercial Banks",522110,"Commercial Banking",34,68,12/31/20,"4,768,782,848",12/31/20,"1,728,172,000","435,030,000","4,104,739,000","46,671,088,000"
6439,"Other revenue","Total Revenues - Refer to Notes 2 and 3 to the financial statements",443500,12/31/20,02/24/21,3,"Deloitte & Touche LLP",,,,Stamford,CT,CONNECTICUT,"US New England",10-K,2021-02-24,,"Booking Holdings Inc.",1075531,"=""BKNG""","800 CONNECTICUT AVE",,NORWALK,CT,CONNECTICUT,"US New England",,,"=""4700""","Transportation Services",561510,"Travel Agencies",34,"2,227",12/31/20,"91,227,987,968",12/31/20,"6,796,000,000","59,000,000","1,186,000,000","21,874,000,000"
6440,Goodwill,"Goodwill - Refer to Notes 2 and 11 to the financial statements",443500,12/31/20,02/24/21,3,"Deloitte & Touche LLP",,,,Stamford,CT,CONNECTICUT,"US New England",10-K,2021-02-24,,"Booking Holdings Inc.",1075531,"=""BKNG""","800 CONNECTICUT AVE",,NORWALK,CT,CONNECTICUT,"US New England",,,"=""4700""","Transportation Services",561510,"Travel Agencies",34,"2,227",12/31/20,"91,227,987,968",12/31/20,"6,796,000,000","59,000,000","1,186,000,000","21,874,000,000"
6441,"Other contingent liabilities","Commitments and Contingencies - Tax Matters - Refer to Note 16 to the financial statements",443500,12/31/20,02/24/21,3,"Deloitte & Touche LLP",,,,Stamford,CT,CONNECTICUT,"US New England",10-K,2021-02-24,,"Booking Holdings Inc.",1075531,"=""BKNG""","800 CONNECTICUT AVE",,NORWALK,CT,CONNECTICUT,"US New England",,,"=""4700""","Transportation Services",561510,"Travel Agencies",34,"2,227",12/31/20,"91,227,987,968",12/31/20,"6,796,000,000","59,000,000","1,186,000,000","21,874,000,000"
4140,"Policy changes","Incremental Borrowing Rate (IBR) used in Adoption of ASC 842 – Refer to Note 2 to the financial statements",427047,03/28/20,05/22/20,3,"Deloitte & Touche LLP",,,,"Costa Mesa",CA,CALIFORNIA,"US West",10-K,2020-05-22,,"Boot Barn Holdings, Inc.",1610250,"=""BOOT""","17100 LAGUNA CANYON ROAD",,IRVINE,CA,CALIFORNIA,"US West",,,"=""5661""","Shoe Stores",448210,"Shoe Stores",34,13,03/31/20,"372,500,384",03/28/20,"845,575,000","47,949,000","63,217,000","924,711,000"
4150,"Revenue from customer contracts","Revenue recognition related to the cost-based input method and variable consideration",427081,03/31/20,05/26/20,2,"Ernst & Young LLP",,,,Tysons,VA,VIRGINIA,"US Mid Atlantic",10-K,2020-05-26,,"Booz Allen Hamilton Holding Corp",1443646,"=""BAH""","8283 GREENSBORO DRIVE",,MCLEAN,VA,VIRGINIA,"US Mid Atlantic",,,"=""8742""","Management Consulting Services",541611,"Administrative Management and General Management Consulting Services",34,69,03/31/20,"9,521,735,680",03/31/20,"7,463,841,000","482,603,000","-1,025,791,000","4,793,966,000"
4151,"Other contingent liabilities","Government Contracting Matters - Provision for Claimed Indirect Costs",427081,03/31/20,05/26/20,2,"Ernst & Young LLP",,,,Tysons,VA,VIRGINIA,"US Mid Atlantic",10-K,2020-05-26,,"Booz Allen Hamilton Holding Corp",1443646,"=""BAH""","8283 GREENSBORO DRIVE",,MCLEAN,VA,VIRGINIA,"US Mid Atlantic",,,"=""8742""","Management Consulting Services",541611,"Administrative Management and General Management Consulting Services",34,69,03/31/20,"9,521,735,680",03/31/20,"7,463,841,000","482,603,000","-1,025,791,000","4,793,966,000"
4152,"Uncertain tax positions","Unrecognized Tax Benefits",427081,03/31/20,05/26/20,2,"Ernst & Young LLP",,,,Tysons,VA,VIRGINIA,"US Mid Atlantic",10-K,2020-05-26,,"Booz Allen Hamilton Holding Corp",1443646,"=""BAH""","8283 GREENSBORO DRIVE",,MCLEAN,VA,VIRGINIA,"US Mid Atlantic",,,"=""8742""","Management Consulting Services",541611,"Administrative Management and General Management Consulting Services",34,69,03/31/20,"9,521,735,680",03/31/20,"7,463,841,000","482,603,000","-1,025,791,000","4,793,966,000"
6061,"Business combinations","Valuation of Intangible Assets Related to the Acquisition of Delphi Technologies PLC - Customer Relationships, Developed Technology and Trade Name",442899,12/31/20,02/22/21,1,"PricewaterhouseCoopers LLP",,,,Detroit,MI,MICHIGAN,"US Midwest",10-K,2021-02-22,,"BORGWARNER INC",908255,"=""BWA""","3850 HAMLIN RD.",,"AUBURN HILLS",MI,MICHIGAN,"US Midwest",,,"=""3714""","Motor Vehicle Parts and Accessories",336399,"All Other Motor Vehicle Parts Manufacturing",34,39,12/31/20,"8,121,254,400",12/31/20,"10,165,000,000","500,000,000","2,705,000,000","16,029,000,000"
6062,"Other income taxes","Income Taxes - Worldwide Provision for Income Taxes",442899,12/31/20,02/22/21,1,"PricewaterhouseCoopers LLP",,,,Detroit,MI,MICHIGAN,"US Midwest",10-K,2021-02-22,,"BORGWARNER INC",908255,"=""BWA""","3850 HAMLIN RD.",,"AUBURN HILLS",MI,MICHIGAN,"US Midwest",,,"=""3714""","Motor Vehicle Parts and Accessories",336399,"All Other Motor Vehicle Parts Manufacturing",34,39,12/31/20,"8,121,254,400",12/31/20,"10,165,000,000","500,000,000","2,705,000,000","16,029,000,000"
5560,"Other intangible assets","Dogfish Head brand Name Intangible — Refer to Note H to the financial statements",442130,12/26/20,02/17/21,3,"Deloitte & Touche LLP",,,,Boston,MA,MASSACHUSETTS,"US New England",10-K,2021-02-17,,"BOSTON BEER CO INC",949870,"=""SAM""","ONE DESIGN CENTER PLACE","SUITE 850",BOSTON,MA,MASSACHUSETTS,"US New England",,,"=""2082""","Malt Beverages",312120,Breweries,34,994,12/31/20,"9,947,553,792",12/26/20,"1,736,432,000","191,960,000","740,508,000","1,378,825,000"
10138,Goodwill,"Valuation of goodwill for the insurance brokerage operations and insurance carrier operations reporting units.",450829,12/31/20,03/29/21,4,"KPMG LLP",,,,Omaha,NE,NEBRASKA,"US Midwest",10-K,2021-03-29,,"BOSTON OMAHA Corp",1494582,"=""BOC""","1601 DODGE STREET","SUITE 3300",OMAHA,NE,NEBRASKA,"US Midwest",,,"=""6510""","Real Estate Operators (No Developers) & Lessors",531210,"Offices of Real Estate Agents and Brokers",34,26,12/29/20,"688,940,608",12/31/20,"45,743,463","-49,089","338,324,532","621,258,907"
10139,"Business combinations","Evaluating the fair value of the Customer Relationship Intangible Assets acquired in the FibAire Communications, LLC and Utah Broadband, LLC Acquisitions.",450829,12/31/20,03/29/21,4,"KPMG LLP",,,,Omaha,NE,NEBRASKA,"US Midwest",10-K,2021-03-29,,"BOSTON OMAHA Corp",1494582,"=""BOC""","1601 DODGE STREET","SUITE 3300",OMAHA,NE,NEBRASKA,"US Midwest",,,"=""6510""","Real Estate Operators (No Developers) & Lessors",531210,"Offices of Real Estate Agents and Brokers",34,26,12/29/20,"688,940,608",12/31/20,"45,743,463","-49,089","338,324,532","621,258,907"
11833,Goodwill,"Valuation of goodwill for the insurance brokerage operations and insurance carrier operations reporting units.",456901,12/31/20,03/29/21,4,"KPMG LLP",,,,Omaha,NE,NEBRASKA,"US Midwest",10-K/A,2021-05-24,,"BOSTON OMAHA Corp",1494582,"=""BOC""","1601 DODGE STREET","SUITE 3300",OMAHA,NE,NEBRASKA,"US Midwest",,,"=""6510""","Real Estate Operators (No Developers) & Lessors",531210,"Offices of Real Estate Agents and Brokers",34,26,12/29/20,"688,940,608",12/31/20,"45,743,463","-49,089","338,324,532","621,258,907"
11834,"Business combinations","Evaluating the fair value of the Customer Relationship Intangible Assets acquired in the FibAire Communications, LLC and Utah Broadband, LLC Acquisitions.",456901,12/31/20,03/29/21,4,"KPMG LLP",,,,Omaha,NE,NEBRASKA,"US Midwest",10-K/A,2021-05-24,,"BOSTON OMAHA Corp",1494582,"=""BOC""","1601 DODGE STREET","SUITE 3300",OMAHA,NE,NEBRASKA,"US Midwest",,,"=""6510""","Real Estate Operators (No Developers) & Lessors",531210,"Offices of Real Estate Agents and Brokers",34,26,12/29/20,"688,940,608",12/31/20,"45,743,463","-49,089","338,324,532","621,258,907"
7995,"Allowance for credit losses","Allowance for loan losses – Loans evaluated on a collective basis",445320,12/31/20,03/01/21,4,"KPMG LLP",,,,Boston,MA,MASSACHUSETTS,"US New England",10-K,2021-03-01,,"BOSTON PRIVATE FINANCIAL HOLDINGS INC",821127,,"10 POST OFFICE SQ",,BOSTON,MA,MASSACHUSETTS,"US New England",,,"=""6022""","State Commercial Banks",522110,"Commercial Banking",34,8,12/31/20,"695,724,480",12/31/20,"295,312,000","45,153,000","801,345,000","10,048,733,000"
7383,"Long-lived assets","Impairment Assessments of Long-Lived Assets and Investments in Unconsolidated Joint Ventures",444330,12/31/20,02/26/21,1,"PricewaterhouseCoopers LLP",,,,Boston,MA,MASSACHUSETTS,"US New England",10-K,2021-02-26,,"BOSTON PROPERTIES LTD PARTNERSHIP",1043121,,"800 BOYLSTON STREET","SUITE 1900",BOSTON,MA,MASSACHUSETTS,"US New England",1037540,"BXP, Inc.","=""6798""","Real Estate Investment Trusts",525990,"Other Financial Vehicles",34,,,,12/31/20,"2,765,686,000","990,479,000",,"22,586,907,000"
6262,"Other contingent liabilities","Contingent Consideration",443189,12/31/20,02/23/21,2,"Ernst & Young LLP",,,,Boston,MA,MASSACHUSETTS,"US New England",10-K,2021-02-23,,"BOSTON SCIENTIFIC CORP",885725,"=""BSX""","300 BOSTON SCIENTIFIC WAY",,MARLBOROUGH,MA,MASSACHUSETTS,"US New England",,,"=""3841""","Surgical and Medical Instruments and Apparatus",339112,"Surgical and Medical Instrument Manufacturing",34,36,12/31/20,"50,927,562,752",12/31/20,"9,913,000,000","-80,000,000","-541,000,000","30,777,000,000"
4485,"Deferred and capitalized costs","Capitalized Software Development Costs and Internal Use Software Costs",431405,06/30/20,08/28/20,2,"Ernst & Young LLP",,,,Boston,MA,MASSACHUSETTS,"US New England",10-K,2020-08-28,,"BOTTOMLINE TECHNOLOGIES INC",1073349,,"325 CORPORATE DRIVE",,PORTSMOUTH,NH,"NEW HAMPSHIRE","US New England",,,"=""7372""","Prepackaged Software",511210,"Software Publishers",34,51,06/30/20,"2,141,072,384",06/30/20,"442,221,000","-9,229,000","32,510,000","793,137,000"
7242,"Business combinations","Income tax impacts of the sale of the Octane business",444865,12/31/20,02/26/21,4,"KPMG LLP",,,,Portland,OR,OREGON,"US West",10-K,2021-02-26,,"BOWFLEX INC.",1078207,"=""BFXXQ""","17750 SE 6TH WAY",,VANCOUVER,WA,WASHINGTON,"US West",,,"=""3949""","Sporting and Athletic Goods, NEC",339920,"Sporting and Athletic Goods Manufacturing",34,18,12/29/20,"547,684,992",12/31/20,"552,560,000","59,848,000","143,815,000","318,117,000"
3516,"Revenue from customer contracts","Revenue recognition – evaluation of contract terms and conditions",422384,01/31/20,03/19/20,2,"Ernst & Young LLP",,,,"San Jose",CA,CALIFORNIA,"US West",10-K,2020-03-19,,"BOX INC",1372612,"=""BOX""","900 JEFFERSON AVE",,"REDWOOD CITY",CA,CALIFORNIA,"US West",,,"=""7372""","Prepackaged Software",511210,"Software Publishers",34,15,01/31/20,"2,263,683,328",01/31/20,"696,264,000","-144,348,000","3,617,000","959,991,000"
7991,"Goodwill and intangible assets","Goodwill and Indefinite-Lived Intangibles—Refer to Notes 1, 4 and 5 to the financial statements",445054,12/31/20,03/01/21,3,"Deloitte & Touche LLP",,,,"Las Vegas",NV,NEVADA,"US West",10-K,2021-03-01,,"BOYD GAMING CORP",906553,"=""BYD""","6465 SOUTH RAINBOW BOULEVARD",,"LAS VEGAS",NV,NEVADA,"US West",,,"=""7011""","Hotels and Motels",721120,"Casino Hotels",34,43,12/31/20,"4,799,780,352",12/31/20,"2,178,490,000","-134,700,000","-1,229,517,000","6,558,948,000"
6634,"Equity investments and joint ventures","Accounting for Equity Method Investments — Refer to Notes 2 and 6 to the financial statements.",443612,12/31/20,02/25/21,3,"Deloitte & Touche LLP",,,,Houston,TX,TEXAS,"US Southwest",10-K,2021-02-25,,"BP Midstream Partners LP",1708301,,"501 WESTLAKE PARK BLVD",,HOUSTON,TX,TEXAS,"US Southwest",,,"=""4610""","Pipelines, Except Natural Gas",486110,"Pipeline Transportation of Crude Oil",34,11,12/31/20,"555,471,424",12/31/20,"128,900,000","168,400,000",,"738,900,000"
9751,"Property, plant and equipment","Property, plant and equipment (PP&E) assets – Impairment of upstream oil and gas – Notes 1, 4 and 12 to the financial statements",449747,12/31/20,03/22/21,3,"Deloitte & Touche LLP",293,"Deloitte LLP",1147,London,X0,"UNITED KINGDOM",Foreign,20-F,2021-03-22,,"BP PLC",313807,"=""BP""","1 ST JAMES'S SQUARE",,LONDON,X0,"UNITED KINGDOM",Foreign,,,"=""2911""","Petroleum Refining",324110,"Petroleum Refineries",34,21,12/29/20,"75,626,692,608",12/31/20,"180,366,000,000","-20,729,000,000","52,677,000,000","267,654,000,000"
9752,"Other intangible assets","Intangible assets – Write-off of Exploration and Appraisal (E&A) assets, included within 'intangible assets' within the Group balance sheet – Notes 1, 8 and 15 to the financial statements",449747,12/31/20,03/22/21,3,"Deloitte & Touche LLP",293,"Deloitte LLP",1147,London,X0,"UNITED KINGDOM",Foreign,20-F,2021-03-22,,"BP PLC",313807,"=""BP""","1 ST JAMES'S SQUARE",,LONDON,X0,"UNITED KINGDOM",Foreign,,,"=""2911""","Petroleum Refining",324110,"Petroleum Refineries",34,21,12/29/20,"75,626,692,608",12/31/20,"180,366,000,000","-20,729,000,000","52,677,000,000","267,654,000,000"
9753,"Other investments","Accounting for structured commodity transactions (SCTs) within the trading and shipping (T&S) function and the valuation of other Level 3 financial instruments, where fraud risks may arise in revenue recognition (potentially impacting all financial statement accounts, in particular finance debt) - Notes 1, 20, 22, 29 and 30 to the financial statements",449747,12/31/20,03/22/21,3,"Deloitte & Touche LLP",293,"Deloitte LLP",1147,London,X0,"UNITED KINGDOM",Foreign,20-F,2021-03-22,,"BP PLC",313807,"=""BP""","1 ST JAMES'S SQUARE",,LONDON,X0,"UNITED KINGDOM",Foreign,,,"=""2911""","Petroleum Refining",324110,"Petroleum Refineries",34,21,12/29/20,"75,626,692,608",12/31/20,"180,366,000,000","-20,729,000,000","52,677,000,000","267,654,000,000"
14200,"Property, plant and equipment","1.Property, plant and equipment (PP&E) assets – Impairment of upstream oil and gas – Notes 1, 4 and 12 to the financial statements",472252,12/31/20,03/22/21,3,"Deloitte & Touche LLP",293,"Deloitte LLP",1147,London,X0,"UNITED KINGDOM",Foreign,6-K,2022-01-31,,"BP PLC",313807,"=""BP""","1 ST JAMES'S SQUARE",,LONDON,X0,"UNITED KINGDOM",Foreign,,,"=""2911""","Petroleum Refining",324110,"Petroleum Refineries",34,21,12/29/20,"75,626,692,608",12/31/20,"180,366,000,000","-20,729,000,000","52,677,000,000","267,654,000,000"
14201,"Other intangible assets","2.Intangible assets – Write-off of Exploration and Appraisal (E&A) assets, included within 'intangible assets' within the Group balance sheet – Notes 1, 8 and 15 to the financial statements",472252,12/31/20,03/22/21,3,"Deloitte & Touche LLP",293,"Deloitte LLP",1147,London,X0,"UNITED KINGDOM",Foreign,6-K,2022-01-31,,"BP PLC",313807,"=""BP""","1 ST JAMES'S SQUARE",,LONDON,X0,"UNITED KINGDOM",Foreign,,,"=""2911""","Petroleum Refining",324110,"Petroleum Refineries",34,21,12/29/20,"75,626,692,608",12/31/20,"180,366,000,000","-20,729,000,000","52,677,000,000","267,654,000,000"
14202,"Other investments","3.Accounting for structured commodity transactions (SCTs) within the trading and shipping (T&S) function and the valuation of other Level 3 financial instruments, where fraud risks may arise in revenue recognition (potentially impacting all financial statement accounts, in particular finance debt) - Notes 1, 20, 22, 29 and 30 to the financial statements",472252,12/31/20,03/22/21,3,"Deloitte & Touche LLP",293,"Deloitte LLP",1147,London,X0,"UNITED KINGDOM",Foreign,6-K,2022-01-31,,"BP PLC",313807,"=""BP""","1 ST JAMES'S SQUARE",,LONDON,X0,"UNITED KINGDOM",Foreign,,,"=""2911""","Petroleum Refining",324110,"Petroleum Refineries",34,21,12/29/20,"75,626,692,608",12/31/20,"180,366,000,000","-20,729,000,000","52,677,000,000","267,654,000,000"
9367,"Going concern","Going Concern Assessment",449159,12/31/20,03/16/21,4,"KPMG LLP",,,,Dallas,TX,TEXAS,"US Southwest",10-K,2021-03-16,Yes,"BP PRUDHOE BAY ROYALTY TRUST",850033,"=""BPPTU""","C/O BANKOF NEW YORK","601 TAVIS STREET, FLOOR 17",HOUSTON,TX,TEXAS,"US Southwest",,,"=""2911""","Petroleum Refining",525920,"Trusts, Estates, and Agency Accounts",34,2,12/31/20,"50,932,000",12/31/20,"9,269,000","8,126,000",,"266,000"
4518,"Deferred income taxes","Taxes — Valuation Allowances — Refer to Note 11 to the financial statements",432284,07/31/20,09/16/20,3,"Deloitte & Touche LLP",,,,Milwaukee,WI,WISCONSIN,"US Midwest",10-K,2020-09-16,,"BRADY CORP",746598,"=""BRC""","6555 W GOOD HOPE RD","P O BOX 571",MILWAUKEE,WI,WISCONSIN,"US Midwest",,,"=""3990""","Miscellaneous Manufacturing Industries",322222,"Coated and Laminated Paper Manufacturing",34,46,07/31/20,"2,227,566,080",07/31/20,"1,081,299,000","112,369,000","424,704,000","1,142,466,000"
4968,"Deferred and stock-based compensation","Stock-Based Compensation to Employees and Directors – Stock Options — Refer to Note 11 to the financial statements",440806,12/31/20,02/04/21,3,"Deloitte & Touche LLP",257,"Brightman Almagor Zohar & Co",1197,"Tel Aviv",L3,ISRAEL,Foreign,10-K,2021-02-04,,"BRAINSTORM CELL THERAPEUTICS INC.",1137883,"=""BCLI""","1325 AVENUE OF AMERICAS","28TH FLOOR","NEW YORK",NY,"NEW YORK","US Mid Atlantic",,,"=""2836""","Biological Products, Except Diagnostic Substances",325413,"In-Vitro Diagnostic Substance Manufacturing",34,5,12/31/20,"159,274,688",12/31/20,,"-31,811,000",,"51,259,000"
6456,"Real estate investments","Impairment Assessments of Real Estate Investments and Investments in Unconsolidated Real Estate Ventures",443616,12/31/20,02/24/21,1,"PricewaterhouseCoopers LLP",,,,Philadelphia,PA,PENNSYLVANIA,"US Mid Atlantic",10-K,2021-02-24,,"BRANDYWINE OPERATING PARTNERSHIP, L.P.",1060386,,"C/O BRANDYWINE REALTY TRUST","2929 ARCH STREET, SUITE 1800",PHILADELPHIA,PA,PENNSYLVANIA,"US Mid Atlantic",790816,"BRANDYWINE REALTY TRUST","=""6798""","Real Estate Investment Trusts",525990,"Other Financial Vehicles",34,,,,12/31/20,"534,852,000","307,306,000","1,756,006,000","3,900,106,000"
6457,"Real estate investments","Impairment Assessments of Real Estate Investments and Investments in Unconsolidated Real Estate Ventures",443617,12/31/20,02/24/21,1,"PricewaterhouseCoopers LLP",,,,Philadelphia,PA,PENNSYLVANIA,"US Mid Atlantic",10-K,2021-02-24,,"BRANDYWINE REALTY TRUST",790816,"=""BDN""","2929 ARCH STREET","SUITE 1800",PHILADELPHIA,PA,PENNSYLVANIA,"US Mid Atlantic",,,"=""6798""","Real Estate Investment Trusts",525990,"Other Financial Vehicles",34,12,12/31/20,"2,031,523,968",12/31/20,"534,852,000","305,527,000","1,745,573,000","3,900,106,000"
11688,Goodwill,"Evaluation of impairment of cash generating units that contain goodwill",456300,12/31/20,05/13/21,4,"KPMG LLP",61,"KPMG Auditores Independentes",1124,"São Paulo",D5,BRAZIL,Foreign,20-F,2021-05-14,,"BRASKEM SA",1071438,"=""BAK""","RUA ETENO, 1561","POLO PETROQUIMICO DE CAMACARI",CAMACARI,D5,BRAZIL,Foreign,,,"=""2860""","Industrial Organic Chemicals",325110,"Petrochemical Manufacturing",34,9,12/29/20,"1,563,075,072",12/31/20,"11,270,936,000","-1,350,604,000","-746,969,000","16,573,085,000"
11689,"Asset retirement and environmental obligations","Evaluation of the provision and disclosures related to geological phenomenon in Alagoas State",456300,12/31/20,05/13/21,4,"KPMG LLP",61,"KPMG Auditores Independentes",1124,"São Paulo",D5,BRAZIL,Foreign,20-F,2021-05-14,,"BRASKEM SA",1071438,"=""BAK""","RUA ETENO, 1561","POLO PETROQUIMICO DE CAMACARI",CAMACARI,D5,BRAZIL,Foreign,,,"=""2860""","Industrial Organic Chemicals",325110,"Petrochemical Manufacturing",34,9,12/29/20,"1,563,075,072",12/31/20,"11,270,936,000","-1,350,604,000","-746,969,000","16,573,085,000"
11690,"Going concern","Going concern assessment",456300,12/31/20,05/13/21,4,"KPMG LLP",61,"KPMG Auditores Independentes",1124,"São Paulo",D5,BRAZIL,Foreign,20-F,2021-05-14,,"BRASKEM SA",1071438,"=""BAK""","RUA ETENO, 1561","POLO PETROQUIMICO DE CAMACARI",CAMACARI,D5,BRAZIL,Foreign,,,"=""2860""","Industrial Organic Chemicals",325110,"Petrochemical Manufacturing",34,9,12/29/20,"1,563,075,072",12/31/20,"11,270,936,000","-1,350,604,000","-746,969,000","16,573,085,000"
11506,"Other income taxes","Recoverability of ICMS (State Value Added Tax “VAT”) tax credits",455210,12/31/20,04/29/21,2,"Ernst & Young LLP",34,"Ernst & Young Auditores Independentes SS",1448,"São Paulo",D5,BRAZIL,Foreign,20-F,2021-04-30,,"BRAZILIAN DISTRIBUTION CO COMPANHIA BRASILEIRA DE DISTR CBD",1038572,"=""CBDBY""","AV BRIGADEIRO LUIZ ANTONIO","3126 1 ANDAR SP","SAO PAULO",D5,BRAZIL,Foreign,,,"=""5411""","Grocery Stores",445110,"Supermarkets and Other Grocery (except Convenience) Stores",34,14,12/29/20,"1,435,389,824",12/31/20,"3,234,000,000","448,000,000","1,717,000,000","10,302,000,000"
11507,"Uncertain tax positions","Tax claims with a probability of loss assessed as possible",455210,12/31/20,04/29/21,2,"Ernst & Young LLP",34,"Ernst & Young Auditores Independentes SS",1448,"São Paulo",D5,BRAZIL,Foreign,20-F,2021-04-30,,"BRAZILIAN DISTRIBUTION CO COMPANHIA BRASILEIRA DE DISTR CBD",1038572,"=""CBDBY""","AV BRIGADEIRO LUIZ ANTONIO","3126 1 ANDAR SP","SAO PAULO",D5,BRAZIL,Foreign,,,"=""5411""","Grocery Stores",445110,"Supermarkets and Other Grocery (except Convenience) Stores",34,14,12/29/20,"1,435,389,824",12/31/20,"3,234,000,000","448,000,000","1,717,000,000","10,302,000,000"
11508,"Discontinued operations","Corporate reorganization",455210,12/31/20,04/29/21,2,"Ernst & Young LLP",34,"Ernst & Young Auditores Independentes SS",1448,"São Paulo",D5,BRAZIL,Foreign,20-F,2021-04-30,,"BRAZILIAN DISTRIBUTION CO COMPANHIA BRASILEIRA DE DISTR CBD",1038572,"=""CBDBY""","AV BRIGADEIRO LUIZ ANTONIO","3126 1 ANDAR SP","SAO PAULO",D5,BRAZIL,Foreign,,,"=""5411""","Grocery Stores",445110,"Supermarkets and Other Grocery (except Convenience) Stores",34,14,12/29/20,"1,435,389,824",12/31/20,"3,234,000,000","448,000,000","1,717,000,000","10,302,000,000"
11617,"Other contingent liabilities","Litigation Contingencies",455984,12/31/20,05/07/21,1,"PricewaterhouseCoopers LLP",91,"PricewaterhouseCoopers Auditores Independentes",1351,"Rio de Janeiro",D5,BRAZIL,Foreign,20-F,2021-05-10,,"BRAZILIAN ELECTRIC POWER CO",1439124,"=""AXIA""","RUA DA QUITANDA, 196, 24TH FLOOR",CENTRO,"RIO DE JANEIRO",D5,BRAZIL,Foreign,,,"=""4911""","Electric Services",221111,"Hydroelectric Power Generation",34,7,12/29/20,"7,685,445,632",12/31/20,"4,890,250,000","1,229,701,000","13,994,997,000","34,455,055,000"
11618,"Long-lived assets","Assessment of Impairment for fixed assets and investments in associate companies",455984,12/31/20,05/07/21,1,"PricewaterhouseCoopers LLP",91,"PricewaterhouseCoopers Auditores Independentes",1351,"Rio de Janeiro",D5,BRAZIL,Foreign,20-F,2021-05-10,,"BRAZILIAN ELECTRIC POWER CO",1439124,"=""AXIA""","RUA DA QUITANDA, 196, 24TH FLOOR",CENTRO,"RIO DE JANEIRO",D5,BRAZIL,Foreign,,,"=""4911""","Electric Services",221111,"Hydroelectric Power Generation",34,7,12/29/20,"7,685,445,632",12/31/20,"4,890,250,000","1,229,701,000","13,994,997,000","34,455,055,000"
11619,"Deferred income taxes","Deferred taxes assessment",455984,12/31/20,05/07/21,1,"PricewaterhouseCoopers LLP",91,"PricewaterhouseCoopers Auditores Independentes",1351,"Rio de Janeiro",D5,BRAZIL,Foreign,20-F,2021-05-10,,"BRAZILIAN ELECTRIC POWER CO",1439124,"=""AXIA""","RUA DA QUITANDA, 196, 24TH FLOOR",CENTRO,"RIO DE JANEIRO",D5,BRAZIL,Foreign,,,"=""4911""","Electric Services",221111,"Hydroelectric Power Generation",34,7,12/29/20,"7,685,445,632",12/31/20,"4,890,250,000","1,229,701,000","13,994,997,000","34,455,055,000"
11620,"Revenue from customer contracts","Contractual transmission assets - Measurement",455984,12/31/20,05/07/21,1,"PricewaterhouseCoopers LLP",91,"PricewaterhouseCoopers Auditores Independentes",1351,"Rio de Janeiro",D5,BRAZIL,Foreign,20-F,2021-05-10,,"BRAZILIAN ELECTRIC POWER CO",1439124,"=""AXIA""","RUA DA QUITANDA, 196, 24TH FLOOR",CENTRO,"RIO DE JANEIRO",D5,BRAZIL,Foreign,,,"=""4911""","Electric Services",221111,"Hydroelectric Power Generation",34,7,12/29/20,"7,685,445,632",12/31/20,"4,890,250,000","1,229,701,000","13,994,997,000","34,455,055,000"
11621,"Pension and other post-employment benefits","Post-employment benefits",455984,12/31/20,05/07/21,1,"PricewaterhouseCoopers LLP",91,"PricewaterhouseCoopers Auditores Independentes",1351,"Rio de Janeiro",D5,BRAZIL,Foreign,20-F,2021-05-10,,"BRAZILIAN ELECTRIC POWER CO",1439124,"=""AXIA""","RUA DA QUITANDA, 196, 24TH FLOOR",CENTRO,"RIO DE JANEIRO",D5,BRAZIL,Foreign,,,"=""4911""","Electric Services",221111,"Hydroelectric Power Generation",34,7,12/29/20,"7,685,445,632",12/31/20,"4,890,250,000","1,229,701,000","13,994,997,000","34,455,055,000"
7405,"Allowance for credit losses","Allowance for Loan Loss — Refer to Notes 2 and 8 to the financial statements",444376,12/31/20,02/26/21,3,"Deloitte & Touche LLP",,,,Dallas,TX,TEXAS,"US Southwest",10-K,2021-02-26,,"BREAD FINANCIAL HOLDINGS, INC.",1101215,"=""BFH""","3095 LOYALTY CIRCLE",,COLUMBUS,OH,OHIO,"US Midwest",,,"=""6141""","Personal Credit Institutions",518210,"Data Processing, Hosting, and Related Services",34,71,12/29/20,"3,388,246,784",12/31/20,"4,521,400,000","214,000,000","811,000,000","22,547,000,000"
7406,Goodwill,"Goodwill — BrandLoyalty Reporting Unit — Refer to Notes 2 and 14 to the financial statements",444376,12/31/20,02/26/21,3,"Deloitte & Touche LLP",,,,Dallas,TX,TEXAS,"US Southwest",10-K,2021-02-26,,"BREAD FINANCIAL HOLDINGS, INC.",1101215,"=""BFH""","3095 LOYALTY CIRCLE",,COLUMBUS,OH,OHIO,"US Midwest",,,"=""6141""","Personal Credit Institutions",518210,"Data Processing, Hosting, and Related Services",34,71,12/29/20,"3,388,246,784",12/31/20,"4,521,400,000","214,000,000","811,000,000","22,547,000,000"
10010,"Deferred income taxes","Recoverability of deferred tax assets",450552,12/31/20,03/26/21,4,"KPMG LLP",61,"KPMG Auditores Independentes",1124,"São Paulo",D5,BRAZIL,Foreign,20-F,2021-03-26,,"BRF S.A.",1122491,"=""BRFS""","AV DAS NACOES UNIDAS 14401 22ND-25TH","FLOORS TORRE A2 VILA GERTRUDES 04794-000","SAO PAULO",D5,BRAZIL,Foreign,,,"=""2011""","Meat Packing Plants",311615,"Poultry Processing",34,4,12/29/20,"3,534,258,688",12/31/20,"7,598,803,000","293,596,000","646,261,000","9,559,900,000"
6780,"Other debt","2027 Notes — Refer to Note 10 to the financial statements",444115,12/31/20,02/25/21,3,"Deloitte & Touche LLP",,,,"San Francisco",CA,CALIFORNIA,"US West",10-K,2021-02-25,,"BridgeBio Pharma, Inc.",1743881,"=""BBIO""","3160 PORTER DR.","SUITE 250","PALO ALTO",CA,CALIFORNIA,"US West",,,"=""2834""","Pharmaceutical Preparations",325414,"Biological Product (except Diagnostic) Manufacturing",34,71,12/31/20,"8,735,819,776",12/31/20,"8,249,000","-448,724,000",,"703,588,000"
6781,"Research and development expenses","Accrued Research and Development Liabilities — Refer to Notes 2 and 9 to the financial statements",444115,12/31/20,02/25/21,3,"Deloitte & Touche LLP",,,,"San Francisco",CA,CALIFORNIA,"US West",10-K,2021-02-25,,"BridgeBio Pharma, Inc.",1743881,"=""BBIO""","3160 PORTER DR.","SUITE 250","PALO ALTO",CA,CALIFORNIA,"US West",,,"=""2834""","Pharmaceutical Preparations",325414,"Biological Product (except Diagnostic) Manufacturing",34,71,12/31/20,"8,735,819,776",12/31/20,"8,249,000","-448,724,000",,"703,588,000"
7630,"Revenue from customer contracts","Revenue - Refer to Notes 2 and 3 to the financial statements.",445419,12/31/20,03/01/21,3,"Deloitte & Touche LLP",,,,Boston,MA,MASSACHUSETTS,"US New England",10-K,2021-03-01,,"BRIGHT HORIZONS FAMILY SOLUTIONS INC.",1437578,"=""BFAM""","2 WELLS AVENUE",,NEWTON,MA,MASSACHUSETTS,"US New England",,,"=""8351""","Child Day Care Services",624410,"Child Day Care Services",34,173,12/31/20,"10,460,042,240",12/31/20,"1,515,093,000","26,992,000","-422,790,000","3,726,648,000"
6454,"Revenue from customer contracts","Revenue Recognition – Variable Consideration",443599,12/31/20,02/24/21,2,"Ernst & Young LLP",,,,Boston,MA,MASSACHUSETTS,"US New England",10-K,2021-02-24,,"BRIGHTCOVE INC",1313275,,"281 SUMMER STREET",,BOSTON,MA,MASSACHUSETTS,"US New England",,,"=""7374""","Computer Processing and Data Preparation and Processing Services",511210,"Software Publishers",34,18,12/31/20,"736,313,216",12/31/20,"197,353,000","-5,813,000","8,235,000","186,803,000"
6501,"Insurance contract liabilities","Liability for Future Policy Benefits - Refer to Notes 1 and 3 to the consolidated financial statements",443489,12/31/20,02/24/21,3,"Deloitte & Touche LLP",,,,Charlotte,NC,"NORTH CAROLINA","US Southeast",10-K,2021-02-24,,"Brighthouse Financial, Inc.",1685040,"=""BHF""","11225 N COMMUNITY HOUSE ROAD",,CHARLOTTE,NC,"NORTH CAROLINA","US Southeast",,,"=""6311""","Life Insurance",524113,"Direct Life Insurance Carriers",34,36,12/31/20,"3,194,142,720",12/31/20,"8,503,000,000","-1,061,000,000",,"247,869,000,000"
6502,"Deferred and capitalized costs","Deferred Acquisition Cost (DAC) - Refer to Notes 1 and 4 to the consolidated financial statements",443489,12/31/20,02/24/21,3,"Deloitte & Touche LLP",,,,Charlotte,NC,"NORTH CAROLINA","US Southeast",10-K,2021-02-24,,"Brighthouse Financial, Inc.",1685040,"=""BHF""","11225 N COMMUNITY HOUSE ROAD",,CHARLOTTE,NC,"NORTH CAROLINA","US Southeast",,,"=""6311""","Life Insurance",524113,"Direct Life Insurance Carriers",34,36,12/31/20,"3,194,142,720",12/31/20,"8,503,000,000","-1,061,000,000",,"247,869,000,000"
6503,"Insurance contract liabilities","Embedded Derivative Liabilities Related to Variable Annuity Guarantees - Refer to Notes 1, 7, and 8 to the consolidated financial statements.",443489,12/31/20,02/24/21,3,"Deloitte & Touche LLP",,,,Charlotte,NC,"NORTH CAROLINA","US Southeast",10-K,2021-02-24,,"Brighthouse Financial, Inc.",1685040,"=""BHF""","11225 N COMMUNITY HOUSE ROAD",,CHARLOTTE,NC,"NORTH CAROLINA","US Southeast",,,"=""6311""","Life Insurance",524113,"Direct Life Insurance Carriers",34,36,12/31/20,"3,194,142,720",12/31/20,"8,503,000,000","-1,061,000,000",,"247,869,000,000"
8294,"Insurance contract liabilities","Liability for Future Policy Benefits– Refer to Notes 1 and 3 to the consolidated financial statements",445974,12/31/20,03/03/21,3,"Deloitte & Touche LLP",,,,Charlotte,NC,"NORTH CAROLINA","US Southeast",10-K,2021-03-03,,"BRIGHTHOUSE LIFE INSURANCE Co",733076,,"11225 NORTH COMMUNITY HOUSE ROAD",,CHARLOTTE,NC,"NORTH CAROLINA","US Southeast",1099219,"METLIFE INC","=""6311""","Life Insurance",524113,"Direct Life Insurance Carriers",34,,,,12/31/20,"7,552,000,000","-1,305,000,000","18,115,000,000","235,288,000,000"
8295,"Deferred and capitalized costs","Deferred Acquisition Cost (DAC) – Refer to Notes 1 and 4 to the consolidated financial statements",445974,12/31/20,03/03/21,3,"Deloitte & Touche LLP",,,,Charlotte,NC,"NORTH CAROLINA","US Southeast",10-K,2021-03-03,,"BRIGHTHOUSE LIFE INSURANCE Co",733076,,"11225 NORTH COMMUNITY HOUSE ROAD",,CHARLOTTE,NC,"NORTH CAROLINA","US Southeast",1099219,"METLIFE INC","=""6311""","Life Insurance",524113,"Direct Life Insurance Carriers",34,,,,12/31/20,"7,552,000,000","-1,305,000,000","18,115,000,000","235,288,000,000"
8296,"Other debt","Embedded Derivative Liabilities Related to Variable Annuity Guarantees – Refer to Notes 1, 7, and 8 to the consolidated financial statements",445974,12/31/20,03/03/21,3,"Deloitte & Touche LLP",,,,Charlotte,NC,"NORTH CAROLINA","US Southeast",10-K,2021-03-03,,"BRIGHTHOUSE LIFE INSURANCE Co",733076,,"11225 NORTH COMMUNITY HOUSE ROAD",,CHARLOTTE,NC,"NORTH CAROLINA","US Southeast",1099219,"METLIFE INC","=""6311""","Life Insurance",524113,"Direct Life Insurance Carriers",34,,,,12/31/20,"7,552,000,000","-1,305,000,000","18,115,000,000","235,288,000,000"
8367,"Insurance contract liabilities","Liability for Future Policy Benefits – Refer to Notes 1 and 3 to the financial statements",446206,12/31/20,03/04/21,3,"Deloitte & Touche LLP",,,,,NC,"NORTH CAROLINA","US Southeast",10-K,2021-03-04,,"BRIGHTHOUSE LIFE INSURANCE Co OF NY",1167609,,"285 MADISON AVENUE, 14TH FLOOR",,"NEW YORK",NY,"NEW YORK","US Mid Atlantic",,,"=""6311""","Life Insurance",524113,"Direct Life Insurance Carriers",33,,,,12/31/20,"308,000,000","107,000,000","1,292,000","11,502,000,000"
8368,"Deferred and capitalized costs","Deferred Acquisition Cost (DAC) – Refer to Notes 1 and 4 to the financial statements",446206,12/31/20,03/04/21,3,"Deloitte & Touche LLP",,,,,NC,"NORTH CAROLINA","US Southeast",10-K,2021-03-04,,"BRIGHTHOUSE LIFE INSURANCE Co OF NY",1167609,,"285 MADISON AVENUE, 14TH FLOOR",,"NEW YORK",NY,"NEW YORK","US Mid Atlantic",,,"=""6311""","Life Insurance",524113,"Direct Life Insurance Carriers",33,,,,12/31/20,"308,000,000","107,000,000","1,292,000","11,502,000,000"
8369,"Other debt","Embedded Derivative Liabilities Related to Variable Annuity Guarantees – Refer to Notes 1, 7, and 8 to the financial statements.",446206,12/31/20,03/04/21,3,"Deloitte & Touche LLP",,,,,NC,"NORTH CAROLINA","US Southeast",10-K,2021-03-04,,"BRIGHTHOUSE LIFE INSURANCE Co OF NY",1167609,,"285 MADISON AVENUE, 14TH FLOOR",,"NEW YORK",NY,"NEW YORK","US Mid Atlantic",,,"=""6311""","Life Insurance",524113,"Direct Life Insurance Carriers",33,,,,12/31/20,"308,000,000","107,000,000","1,292,000","11,502,000,000"
6760,"Allowance for credit losses","Allowance for Loan Losses	",444037,12/31/20,02/25/21,2,"Ernst & Young LLP",,,,"New York",NY,"NEW YORK","US Mid Atlantic",10-K,2021-02-25,,"BrightSpire Capital, Inc.",1717547,"=""BRSP""","590 MADISON AVENUE","33RD FLOOR","NEW YORK",NY,"NEW YORK","US Mid Atlantic",,,"=""6798""","Real Estate Investment Trusts",525990,"Other Financial Vehicles",34,7,12/29/20,"934,798,144",12/31/20,"176,873,000","-604,608,000",,"6,211,937,000"
6761,"Equity investments and joint ventures","Impairment of Equity Method Investments	",444037,12/31/20,02/25/21,2,"Ernst & Young LLP",,,,"New York",NY,"NEW YORK","US Mid Atlantic",10-K,2021-02-25,,"BrightSpire Capital, Inc.",1717547,"=""BRSP""","590 MADISON AVENUE","33RD FLOOR","NEW YORK",NY,"NEW YORK","US Mid Atlantic",,,"=""6798""","Real Estate Investment Trusts",525990,"Other Financial Vehicles",34,7,12/29/20,"934,798,144",12/31/20,"176,873,000","-604,608,000",,"6,211,937,000"
6762,"Interest revenue","Recognition of Payment-in-Kind (“PIK”) Interest	",444037,12/31/20,02/25/21,2,"Ernst & Young LLP",,,,"New York",NY,"NEW YORK","US Mid Atlantic",10-K,2021-02-25,,"BrightSpire Capital, Inc.",1717547,"=""BRSP""","590 MADISON AVENUE","33RD FLOOR","NEW YORK",NY,"NEW YORK","US Mid Atlantic",,,"=""6798""","Real Estate Investment Trusts",525990,"Other Financial Vehicles",34,7,12/29/20,"934,798,144",12/31/20,"176,873,000","-604,608,000",,"6,211,937,000"
13327,"Other contingent liabilities","Valuation of self-insurance liabiltiies",465697,12/31/20,09/07/21,4,"KPMG LLP",,,,Louisville,KY,KENTUCKY,"US Mid Atlantic",DRS/A,2021-09-08,,"BrightSpring Health Services, Inc.",1865782,"=""BTSG""","805 N. WHITTINGTON PARKWAY",,LOUISVILLE,KY,KENTUCKY,"US Mid Atlantic",,,"=""8082""","Home Health Care Services",621610,"Home Health Care Services",34,,,,12/31/20,"5,580,372,000","20,810,000","-2,029,913,000","4,541,073,000"
13332,"Other contingent liabilities","Valuation of self-insurance liabilities",465700,12/31/20,09/07/21,4,"KPMG LLP",,,,Louisville,KY,KENTUCKY,"US Mid Atlantic",DRS/A,2021-10-01,,"BrightSpring Health Services, Inc.",1865782,"=""BTSG""","805 N. WHITTINGTON PARKWAY",,LOUISVILLE,KY,KENTUCKY,"US Mid Atlantic",,,"=""8082""","Home Health Care Services",621610,"Home Health Care Services",34,,,,12/31/20,"5,580,372,000","20,810,000","-2,029,913,000","4,541,073,000"
13333,"Other contingent liabilities","Valuation of self-insurance liabilities",465706,12/31/20,09/07/21,4,"KPMG LLP",,,,Louisville,KY,KENTUCKY,"US Mid Atlantic",S-1,2021-10-18,,"BrightSpring Health Services, Inc.",1865782,"=""BTSG""","805 N. WHITTINGTON PARKWAY",,LOUISVILLE,KY,KENTUCKY,"US Mid Atlantic",,,"=""8082""","Home Health Care Services",621610,"Home Health Care Services",34,,,,12/31/20,"5,580,372,000","20,810,000","-2,029,913,000","4,541,073,000"
13448,"Other contingent liabilities","Valuation of self-insurance liabilities",466744,12/31/20,09/07/21,4,"KPMG LLP",,,,Louisville,KY,KENTUCKY,"US Mid Atlantic",S-1/A,2021-11-02,,"BrightSpring Health Services, Inc.",1865782,"=""BTSG""","805 N. WHITTINGTON PARKWAY",,LOUISVILLE,KY,KENTUCKY,"US Mid Atlantic",,,"=""8082""","Home Health Care Services",621610,"Home Health Care Services",34,,,,12/31/20,"5,580,372,000","20,810,000","-2,029,913,000","4,541,073,000"
14013,"Other contingent liabilities","Valuation of self-insurance liabilities",470675,12/31/20,09/07/21,4,"KPMG LLP",,,,Louisville,KY,KENTUCKY,"US Mid Atlantic",S-1/A,2022-01-04,,"BrightSpring Health Services, Inc.",1865782,"=""BTSG""","805 N. WHITTINGTON PARKWAY",,LOUISVILLE,KY,KENTUCKY,"US Mid Atlantic",,,"=""8082""","Home Health Care Services",621610,"Home Health Care Services",34,,,,12/31/20,"5,580,372,000","20,810,000","-2,029,913,000","4,541,073,000"
8224,Goodwill,"Goodwill Impairment Assessments - Global Gaming and Former NAGI and International Reporting Units",445728,12/31/20,03/02/21,1,"PricewaterhouseCoopers LLP",,,,Boston,MA,MASSACHUSETTS,"US New England",20-F,2021-03-02,,"Brightstar Lottery PLC",1619762,"=""BRSL""","10 FINSBURY SQUARE","THIRD FLOOR",LONDON,X0,"UNITED KINGDOM",Foreign,,,"=""7990""","Services-Miscellaneous Amusement & Recreation",713290,"Other Gambling Industries",34,16,12/29/20,"3,176,925,184",12/31/20,"3,116,000,000","-897,000,000","-5,513,000,000","12,992,000,000"
8225,"Revenue from customer contracts","Revenue Recognition – Identifying and Evaluating Contractual Terms and Conditions",445728,12/31/20,03/02/21,1,"PricewaterhouseCoopers LLP",,,,Boston,MA,MASSACHUSETTS,"US New England",20-F,2021-03-02,,"Brightstar Lottery PLC",1619762,"=""BRSL""","10 FINSBURY SQUARE","THIRD FLOOR",LONDON,X0,"UNITED KINGDOM",Foreign,,,"=""7990""","Services-Miscellaneous Amusement & Recreation",713290,"Other Gambling Industries",34,16,12/29/20,"3,176,925,184",12/31/20,"3,116,000,000","-897,000,000","-5,513,000,000","12,992,000,000"
8226,"Discontinued operations","Assets Held for Sale - Goodwill Allocation to Discontinued Operations",445728,12/31/20,03/02/21,1,"PricewaterhouseCoopers LLP",,,,Boston,MA,MASSACHUSETTS,"US New England",20-F,2021-03-02,,"Brightstar Lottery PLC",1619762,"=""BRSL""","10 FINSBURY SQUARE","THIRD FLOOR",LONDON,X0,"UNITED KINGDOM",Foreign,,,"=""7990""","Services-Miscellaneous Amusement & Recreation",713290,"Other Gambling Industries",34,16,12/29/20,"3,176,925,184",12/31/20,"3,116,000,000","-897,000,000","-5,513,000,000","12,992,000,000"
4455,Goodwill,"Assessment of the carrying value of goodwill",431107,06/24/20,08/21/20,4,"KPMG LLP",,,,Dallas,TX,TEXAS,"US Southwest",10-K,2020-08-24,,"BRINKER INTERNATIONAL, INC",703351,"=""EAT""","3000 OLYMPUS BLVD.",,DALLAS,TX,TEXAS,"US Southwest",,,"=""5812""","Eating and Drinking Places",722110,"Full-Service Restaurants",34,24,06/30/20,"1,080,000,000",06/24/20,"3,078,500,000","24,400,000","-689,700,000","2,356,000,000"
4456,"Revenue from customer contracts","Assessment of the gift card breakage revenue",431107,06/24/20,08/21/20,4,"KPMG LLP",,,,Dallas,TX,TEXAS,"US Southwest",10-K,2020-08-24,,"BRINKER INTERNATIONAL, INC",703351,"=""EAT""","3000 OLYMPUS BLVD.",,DALLAS,TX,TEXAS,"US Southwest",,,"=""5812""","Eating and Drinking Places",722110,"Full-Service Restaurants",34,24,06/30/20,"1,080,000,000",06/24/20,"3,078,500,000","24,400,000","-689,700,000","2,356,000,000"
7984,Goodwill,"Valuation of goodwill for the France reporting unit",445547,12/31/20,03/01/21,4,"KPMG LLP",,,,Richmond,VA,VIRGINIA,"US Mid Atlantic",10-K,2021-03-01,,"BRINKS CO",78890,"=""BCO""","1801 BAYBERRY COURT","P O BOX 18100",RICHMOND,VA,VIRGINIA,"US Mid Atlantic",,,"=""4731""","Arrangement of Transportation of  Freight and Cargo",561613,"Armored Car Services",34,72,12/31/20,"3,564,000,000",12/31/20,"3,690,900,000","16,000,000","-1,516,500,000","5,135,600,000"
7985,"Business combinations","Evaluation of the fair value of customer relationship intangible assets acquired in the G4S business combination",445547,12/31/20,03/01/21,4,"KPMG LLP",,,,Richmond,VA,VIRGINIA,"US Mid Atlantic",10-K,2021-03-01,,"BRINKS CO",78890,"=""BCO""","1801 BAYBERRY COURT","P O BOX 18100",RICHMOND,VA,VIRGINIA,"US Mid Atlantic",,,"=""4731""","Arrangement of Transportation of  Freight and Cargo",561613,"Armored Car Services",34,72,12/31/20,"3,564,000,000",12/31/20,"3,690,900,000","16,000,000","-1,516,500,000","5,135,600,000"
5087,"Sales return and allowances","Gross-to-Net U.S. Rebate Accruals for U.S. Medicaid, Medicare Part D, and managed healthcare - Refer to “Note 2 - Revenue” to the financial statements",441409,12/31/20,02/09/21,3,"Deloitte & Touche LLP",,,,Parsippany,NJ,"NEW JERSEY","US Mid Atlantic",10-K,2021-02-10,,"BRISTOL MYERS SQUIBB CO",14272,"=""BMY""","ROUTE 206 AND PROVINCE LINE ROAD",,PRINCETON,NJ,"NEW JERSEY","US Mid Atlantic",,,"=""2834""","Pharmaceutical Preparations",325412,"Pharmaceutical Preparation Manufacturing",34,62,12/31/20,"137,768,632,320",12/31/20,"42,518,000,000","-9,015,000,000","-35,968,000,000","118,481,000,000"
5088,"Uncertain tax positions","Taxes - Unrecognized Tax Benefit Liabilities for U.S. Transfer Pricing - Refer to “Note 7- Income Taxes” to the financial statements",441409,12/31/20,02/09/21,3,"Deloitte & Touche LLP",,,,Parsippany,NJ,"NEW JERSEY","US Mid Atlantic",10-K,2021-02-10,,"BRISTOL MYERS SQUIBB CO",14272,"=""BMY""","ROUTE 206 AND PROVINCE LINE ROAD",,PRINCETON,NJ,"NEW JERSEY","US Mid Atlantic",,,"=""2834""","Pharmaceutical Preparations",325412,"Pharmaceutical Preparation Manufacturing",34,62,12/31/20,"137,768,632,320",12/31/20,"42,518,000,000","-9,015,000,000","-35,968,000,000","118,481,000,000"
5567,"Goodwill and intangible assets","Impairment analysis of goodwill and trademarks with indefinite lives arising from the 2017 acquisition of Reynolds American Inc. (Reynolds American)",442191,12/31/20,02/16/21,4,"KPMG LLP",87,"KPMG LLP",1118,London,X0,"UNITED KINGDOM",Foreign,6-K,2021-02-17,,"British American Tobacco p.l.c.",1303523,"=""BTI""","GLOBE HOUSE","4 TEMPLE PLACE",LONDON,X0,"UNITED KINGDOM",Foreign,,,"=""2111""",Cigarettes,312221,"Cigarette Manufacturing",34,38,12/29/20,"92,881,051,648",12/31/20,"35,235,000,000","8,973,000,000","-71,997,000,000","188,217,000,000"
5568,"Other contingent liabilities","Canadian legal proceedings",442191,12/31/20,02/16/21,4,"KPMG LLP",87,"KPMG LLP",1118,London,X0,"UNITED KINGDOM",Foreign,6-K,2021-02-17,,"British American Tobacco p.l.c.",1303523,"=""BTI""","GLOBE HOUSE","4 TEMPLE PLACE",LONDON,X0,"UNITED KINGDOM",Foreign,,,"=""2111""",Cigarettes,312221,"Cigarette Manufacturing",34,38,12/29/20,"92,881,051,648",12/31/20,"35,235,000,000","8,973,000,000","-71,997,000,000","188,217,000,000"
8757,"Goodwill and intangible assets","Impairment analysis of goodwill and trademarks with indefinite lives arising from the 2017 acquisition of Reynolds American Inc. (Reynolds American)",447273,12/31/20,02/16/21,4,"KPMG LLP",87,"KPMG LLP",1118,London,X0,"UNITED KINGDOM",Foreign,20-F,2021-03-09,,"British American Tobacco p.l.c.",1303523,"=""BTI""","GLOBE HOUSE","4 TEMPLE PLACE",LONDON,X0,"UNITED KINGDOM",Foreign,,,"=""2111""",Cigarettes,312221,"Cigarette Manufacturing",34,38,12/29/20,"92,881,051,648",12/31/20,"35,235,000,000","8,973,000,000","-71,997,000,000","188,217,000,000"
8758,"Other contingent liabilities","Canadian legal proceedings",447273,12/31/20,02/16/21,4,"KPMG LLP",87,"KPMG LLP",1118,London,X0,"UNITED KINGDOM",Foreign,20-F,2021-03-09,,"British American Tobacco p.l.c.",1303523,"=""BTI""","GLOBE HOUSE","4 TEMPLE PLACE",LONDON,X0,"UNITED KINGDOM",Foreign,,,"=""2111""",Cigarettes,312221,"Cigarette Manufacturing",34,38,12/29/20,"92,881,051,648",12/31/20,"35,235,000,000","8,973,000,000","-71,997,000,000","188,217,000,000"
5183,"Real estate investments","Impairment of Real Estate Assets - Refer to Note 1 and Note 5 to the financial statements",441559,12/31/20,02/11/21,3,"Deloitte & Touche LLP",,,,Philadelphia,PA,PENNSYLVANIA,"US Mid Atlantic",10-K,2021-02-11,,"Brixmor Operating Partnership LP",1630031,,"100 PARK AVENUE",,"NEW YORK",NY,"NEW YORK","US Mid Atlantic",1581068,"Brixmor Property Group Inc.","=""6798""","Real Estate Investment Trusts",531120,"Lessors of Nonresidential Buildings (except Miniwarehouses)",34,,,,12/31/20,"1,053,266,000","121,173,000",,"8,332,133,000"
5184,Leases,"Evaluation of Collectability of Receivables – Refer to Note 1 to the financial statements",441559,12/31/20,02/11/21,3,"Deloitte & Touche LLP",,,,Philadelphia,PA,PENNSYLVANIA,"US Mid Atlantic",10-K,2021-02-11,,"Brixmor Operating Partnership LP",1630031,,"100 PARK AVENUE",,"NEW YORK",NY,"NEW YORK","US Mid Atlantic",1581068,"Brixmor Property Group Inc.","=""6798""","Real Estate Investment Trusts",531120,"Lessors of Nonresidential Buildings (except Miniwarehouses)",34,,,,12/31/20,"1,053,266,000","121,173,000",,"8,332,133,000"
5185,"Real estate investments","Impairment of Real Estate Assets - Refer to Note 1 and Note 5 to the financial statements",441560,12/31/20,02/11/21,3,"Deloitte & Touche LLP",,,,Philadelphia,PA,PENNSYLVANIA,"US Mid Atlantic",10-K,2021-02-11,,"Brixmor Property Group Inc.",1581068,"=""BRX""","100 PARK AVENUE",,"NEW YORK",NY,"NEW YORK","US Mid Atlantic",,,"=""6798""","Real Estate Investment Trusts",525990,"Other Financial Vehicles",34,17,12/31/20,"4,906,982,400",12/31/20,"1,053,266,000","121,173,000",,"8,342,147,000"
5186,Leases,"Evaluation of Collectability of Receivables – Refer to Note 1 to the financial statements",441560,12/31/20,02/11/21,3,"Deloitte & Touche LLP",,,,Philadelphia,PA,PENNSYLVANIA,"US Mid Atlantic",10-K,2021-02-11,,"Brixmor Property Group Inc.",1581068,"=""BRX""","100 PARK AVENUE",,"NEW YORK",NY,"NEW YORK","US Mid Atlantic",,,"=""6798""","Real Estate Investment Trusts",525990,"Other Financial Vehicles",34,17,12/31/20,"4,906,982,400",12/31/20,"1,053,266,000","121,173,000",,"8,342,147,000"
4861,"Business combinations","Valuation of Developed Technology and Customer Contracts and Related Relationships Intangible Assets Acquired - Symantec Corporation Enterprise Security Business",437604,11/01/20,12/18/20,1,"PricewaterhouseCoopers LLP",,,,"San Jose",CA,CALIFORNIA,"US West",10-K,2020-12-18,,"Broadcom Inc.",1730168,"=""AVGO""","3421 HILLVIEW AVENUE",,"PALO ALTO",CA,CALIFORNIA,"US West",,,"=""3674""","Semiconductors and Related Devices",334413,"Semiconductor and Related Device Manufacturing",34,354,11/03/20,"143,096,397,824",11/01/20,"23,888,000,000","2,960,000,000","-36,328,000,000","75,933,000,000"
4410,Goodwill,"Goodwill - Refer to Notes 2 and 9 to the financial statements",430714,06/30/20,08/11/20,3,"Deloitte & Touche LLP",,,,"New York",NY,"NEW YORK","US Mid Atlantic",10-K,2020-08-11,,"BROADRIDGE FINANCIAL SOLUTIONS, INC.",1383312,"=""BR""","5 DAKOTA DRIVE",,"LAKE SUCCESS",NY,"NEW YORK","US Mid Atlantic",,,"=""7389""","Business Services, NEC",522320,"Financial Transactions Processing, Reserve, and Clearinghouse Activities",34,126,06/30/20,"14,524,469,248",06/30/20,"4,529,000,000","462,500,000","-911,700,000","4,889,800,000"
6714,Goodwill,"Evaluation of Goodwill for Impairment",443964,12/31/20,02/25/21,2,"Ernst & Young LLP",,,,Chicago,IL,ILLINOIS,"US Midwest",10-K,2021-02-25,,"Brookdale Senior Living Inc.",1332349,"=""BKD""","105 WESTWOOD PLACE","SUITE 400",BRENTWOOD,TN,TENNESSEE,"US Southeast",,,"=""8050""","Services-Nursing & Personal Care Facilities",623312,"Homes for the Elderly",34,4,12/31/20,"831,972,352",12/31/20,"3,540,195,000","82,019,000","646,303,000","6,901,758,000"
6715,"Property, plant and equipment","Evaluation of Property, Plant and Equipment and Leasehold Intangibles, Net and Operating Lease Right-of-Use Assets for Impairment",443964,12/31/20,02/25/21,2,"Ernst & Young LLP",,,,Chicago,IL,ILLINOIS,"US Midwest",10-K,2021-02-25,,"Brookdale Senior Living Inc.",1332349,"=""BKD""","105 WESTWOOD PLACE","SUITE 400",BRENTWOOD,TN,TENNESSEE,"US Southeast",,,"=""8050""","Services-Nursing & Personal Care Facilities",623312,"Homes for the Elderly",34,4,12/31/20,"831,972,352",12/31/20,"3,540,195,000","82,019,000","646,303,000","6,901,758,000"
9482,"Property, plant and equipment","Property, Plant & Equipment (“PP&E”) - Impairment — Refer to Notes 2(o), 2(ah)(iv) and 11 to the financial statements",449155,12/31/20,03/17/21,3,"Deloitte & Touche LLP",468,"Deloitte LLP",1208,Toronto,A6,ONTARIO,Canada,20-F,2021-03-17,,"Brookfield Business Partners L.P.",1654795,"=""BBU""","73 FRONT STREET, 5TH FLOOR",,HAMILTON,D0,BERMUDA,Foreign,,,"=""1700""","Construction - Special Trade Contractors",325998,"All Other Miscellaneous Chemical Product and Preparation Manufacturing",34,38,12/29/20,"3,077,889,536",12/31/20,"37,635,000,000","580,000,000","-14,577,000,000","54,746,000,000"
9483,"Business combinations","Acquisition of IndoStar Capital Finance Limited - Refer to Notes 2(h), 2(ah)(i) and 3(a) to the financial statements",449155,12/31/20,03/17/21,3,"Deloitte & Touche LLP",468,"Deloitte LLP",1208,Toronto,A6,ONTARIO,Canada,20-F,2021-03-17,,"Brookfield Business Partners L.P.",1654795,"=""BBU""","73 FRONT STREET, 5TH FLOOR",,HAMILTON,D0,BERMUDA,Foreign,,,"=""1700""","Construction - Special Trade Contractors",325998,"All Other Miscellaneous Chemical Product and Preparation Manufacturing",34,38,12/29/20,"3,077,889,536",12/31/20,"37,635,000,000","580,000,000","-14,577,000,000","54,746,000,000"
9849,"Other investments","Fair Value of Investment Properties and Property, Plant and Equipment – Refer to Notes 2(g)(i), 2(g)(ii), 11 and 12 to the financial statements",449993,12/31/20,03/23/21,3,"Deloitte & Touche LLP",468,"Deloitte LLP",1208,Toronto,A6,ONTARIO,Canada,40-F,2021-03-24,,"BROOKFIELD Corp /ON/",1001085,"=""BN""","BROOKFIELD PLACE, 181 BAY ST, STE 100","PO BOX 762",TORONTO,A6,ONTARIO,Canada,,,"=""6512""","Operators of Nonresidential Buildings",531120,"Lessors of Nonresidential Buildings (except Miniwarehouses)",34,41,12/29/20,"62,318,731,264",12/31/20,"55,539,000,000","707,000,000","-3,534,000,000","343,696,000,000"
9856,"Other investments","Fair Value of Investment Properties and Property, Plant and Equipment – Refer to Notes 2(g)(i), 2(g)(ii), 11 and 12 to the financial statements",450065,12/31/20,03/23/21,3,"Deloitte & Touche LLP",468,"Deloitte LLP",1208,Toronto,A6,ONTARIO,Canada,6-K,2021-03-24,,"BROOKFIELD Corp /ON/",1001085,"=""BN""","BROOKFIELD PLACE, 181 BAY ST, STE 100","PO BOX 762",TORONTO,A6,ONTARIO,Canada,,,"=""6512""","Operators of Nonresidential Buildings",531120,"Lessors of Nonresidential Buildings (except Miniwarehouses)",34,41,12/29/20,"62,318,731,264",12/31/20,"55,539,000,000","707,000,000","-3,534,000,000","343,696,000,000"
9899,"Real estate investments","Impairment review — Refer to Note 2 to the financial statements",450262,12/31/20,03/25/21,3,"Deloitte & Touche LLP",,,,"New York",NY,"NEW YORK","US Mid Atlantic",10-K,2021-03-25,,"Brookfield DTLA Fund Office Trust Investor Inc.",1575311,"=""DTLAP""","C/O BROOKFIELD OFFICE PROPERTIES INC.","250 VESEY STREET, 15TH FLOOR","NEW YORK",NY,"NEW YORK","US Mid Atlantic",,,"=""6798""","Real Estate Investment Trusts",531120,"Lessors of Nonresidential Buildings (except Miniwarehouses)",34,,,,12/31/20,"284,508,000","-208,028,000","555,464,000","2,816,456,000"
5349,"Property, plant and equipment","Revaluation of Property, Plant and Equipment - Refer to Notes 3 and 7 to the financial statements",441886,12/31/20,02/12/21,3,"Deloitte & Touche LLP",468,"Deloitte LLP",1208,Toronto,A6,ONTARIO,Canada,20-F,2021-02-16,,"Brookfield Infrastructure Corp",1788348,"=""BIPC""","250 VESEY STREET, 15TH FLOOR",,"NEW YORK",NY,"NEW YORK","US Mid Atlantic",,,"=""4923""","Natural Gas Transmission and Distribution",486210,"Pipeline Transportation of Natural Gas",34,,,,12/31/20,"1,430,000,000","-232,000,000","-5,198,000,000","9,344,000,000"
6074,"Property, plant and equipment","Revaluation of Property, Plant and Equipment - Refer to Notes 3 and 7 to the financial statements",442915,12/31/20,02/12/21,3,"Deloitte & Touche LLP",468,"Deloitte LLP",1208,Toronto,A6,ONTARIO,Canada,F-4,2021-02-22,,"Brookfield Infrastructure Corp",1788348,"=""BIPC""","250 VESEY STREET, 15TH FLOOR",,"NEW YORK",NY,"NEW YORK","US Mid Atlantic",,,"=""4923""","Natural Gas Transmission and Distribution",486210,"Pipeline Transportation of Natural Gas",34,,,,12/31/20,"1,430,000,000","-232,000,000","-5,198,000,000","9,344,000,000"
10689,"Property, plant and equipment","Revaluation of Property, Plant and Equipment - Refer to Notes 3 and 7 to the financial statements",452075,12/31/20,02/12/21,3,"Deloitte & Touche LLP",468,"Deloitte LLP",1208,Toronto,A6,ONTARIO,Canada,F-4/A,2021-04-05,,"Brookfield Infrastructure Corp",1788348,"=""BIPC""","250 VESEY STREET, 15TH FLOOR",,"NEW YORK",NY,"NEW YORK","US Mid Atlantic",,,"=""4923""","Natural Gas Transmission and Distribution",486210,"Pipeline Transportation of Natural Gas",34,,,,12/31/20,"1,430,000,000","-232,000,000","-5,198,000,000","9,344,000,000"
9533,"Property, plant and equipment","Revaluation of Property, Plant and Equipment - Refer to Notes 3 and 13 to the financial statements",449422,12/31/20,03/18/21,3,"Deloitte & Touche LLP",468,"Deloitte LLP",1208,Toronto,A6,ONTARIO,Canada,20-F,2021-03-18,,"Brookfield Infrastructure Partners L.P.",1406234,"=""BIP""","73 FRONT STREET",,HAMILTON,D0,BERMUDA,Foreign,,,"=""4400""","Water Transportation",221121,"Electric Bulk Power Transmission and Control",34,50,12/29/20,"14,588,366,848",12/31/20,"8,885,000,000","904,000,000","2,142,000,000","61,331,000,000"
9534,"Other investments","Valuation of Investments in Associates and Joint Ventures - Refer to Notes 3 and 12 to the financial statements",449422,12/31/20,03/18/21,3,"Deloitte & Touche LLP",468,"Deloitte LLP",1208,Toronto,A6,ONTARIO,Canada,20-F,2021-03-18,,"Brookfield Infrastructure Partners L.P.",1406234,"=""BIP""","73 FRONT STREET",,HAMILTON,D0,BERMUDA,Foreign,,,"=""4400""","Water Transportation",221121,"Electric Bulk Power Transmission and Control",34,50,12/29/20,"14,588,366,848",12/31/20,"8,885,000,000","904,000,000","2,142,000,000","61,331,000,000"
7203,"Other investments","Valuation of investments which utilize significant unobservable inputs",444607,12/31/20,02/26/21,2,"Ernst & Young LLP",,,,"Los Angeles",CA,CALIFORNIA,"US West",10-K,2021-02-26,,"Brookfield Oaktree Holdings, LLC",1403528,"=""OAK.A""","333 SOUTH GRAND AVENUE","28TH FLOOR","LOS ANGELES",CA,CALIFORNIA,"US West",,,"=""6282""","Investment Advice",523920,"Portfolio Management",34,28,12/29/20,"2,700,957,184",12/31/20,"271,378,000","188,784,000",,"10,394,115,000"
7448,"Property, plant and equipment","Fair Value of Investment Property - Refer to Notes 2(e), 2(v)(v) and 3 to the financial statements",444910,12/31/20,02/26/21,3,"Deloitte & Touche LLP",468,"Deloitte LLP",1208,Toronto,A6,ONTARIO,Canada,20-F,2021-02-26,,"Brookfield Property Partners L.P.",1545772,"=""BPYPM""","73 FRONT STREET",,HAMILTON,D0,BERMUDA,Foreign,,,"=""6500""","Real Estate",531312,"Nonresidential Property Managers",34,15,12/29/20,"6,429,895,168",12/31/20,"6,593,000,000","-2,058,000,000","11,400,000,000","107,951,000,000"
7108,"Real estate investments","Investment in Real Estate - Impairment - Refer to Notes 2, 3, and 4 to the financial statements",444834,12/31/20,02/26/21,3,"Deloitte & Touche LLP",,,,Chicago,IL,ILLINOIS,"US Midwest",10-K,2021-02-26,,"Brookfield Property REIT Inc.",1496048,,"350 N. ORLEANS ST.","SUITE 300",CHICAGO,IL,ILLINOIS,"US Midwest",,,"=""6798""","Real Estate Investment Trusts",525990,"Other Financial Vehicles",34,15,12/31/20,"584,562,368",12/31/20,"1,529,545,000","-1,316,035,000",,"21,879,964,000"
7109,"Accounts/loans receivable","Collectability and Evaluation of Accounts Receivable and Straight-Line Rent Receivables - Refer to Notes 2 and 12 to the financial statements",444834,12/31/20,02/26/21,3,"Deloitte & Touche LLP",,,,Chicago,IL,ILLINOIS,"US Midwest",10-K,2021-02-26,,"Brookfield Property REIT Inc.",1496048,,"350 N. ORLEANS ST.","SUITE 300",CHICAGO,IL,ILLINOIS,"US Midwest",,,"=""6798""","Real Estate Investment Trusts",525990,"Other Financial Vehicles",34,15,12/31/20,"584,562,368",12/31/20,"1,529,545,000","-1,316,035,000",,"21,879,964,000"
7362,"Property, plant and equipment","Revaluation of power generating assets	",444901,12/31/20,02/26/21,2,"Ernst & Young LLP",192,"Ernst & Young LLP Chartered Accountants",1263,Toronto,A6,ONTARIO,Canada,20-F,2021-02-26,,"Brookfield Renewable Corp",1791863,"=""BEPC""","250 VESEY STREET, 15TH FLOOR",,"NEW YORK",NY,"NEW YORK","US Mid Atlantic",,,"=""4911""","Electric Services",221111,"Hydroelectric Power Generation",34,,,,12/31/20,"3,087,000","-2,819,000","28,320,000","39,473,000"
7363,"Business combinations","Significant acquisition	",444901,12/31/20,02/26/21,2,"Ernst & Young LLP",192,"Ernst & Young LLP Chartered Accountants",1263,Toronto,A6,ONTARIO,Canada,20-F,2021-02-26,,"Brookfield Renewable Corp",1791863,"=""BEPC""","250 VESEY STREET, 15TH FLOOR",,"NEW YORK",NY,"NEW YORK","US Mid Atlantic",,,"=""4911""","Electric Services",221111,"Hydroelectric Power Generation",34,,,,12/31/20,"3,087,000","-2,819,000","28,320,000","39,473,000"
7582,"Property, plant and equipment","Revaluation of power generating assets",444961,12/31/20,02/26/21,2,"Ernst & Young LLP",192,"Ernst & Young LLP Chartered Accountants",1263,Toronto,A6,ONTARIO,Canada,6-K,2021-02-26,,"Brookfield Renewable Partners L.P.",1533232,"=""BEP""","73 FRONT STREET","FIFTH FLOOR",HAMILTON,D0,BERMUDA,Foreign,,,"=""4911""","Electric Services",221111,"Hydroelectric Power Generation",34,42,12/29/20,"14,020,388,864",12/31/20,"3,810,000,000","-45,000,000","6,744,000,000","49,722,000,000"
7583,"Business combinations","Significant acquisition	",444961,12/31/20,02/26/21,2,"Ernst & Young LLP",192,"Ernst & Young LLP Chartered Accountants",1263,Toronto,A6,ONTARIO,Canada,6-K,2021-02-26,,"Brookfield Renewable Partners L.P.",1533232,"=""BEP""","73 FRONT STREET","FIFTH FLOOR",HAMILTON,D0,BERMUDA,Foreign,,,"=""4911""","Electric Services",221111,"Hydroelectric Power Generation",34,42,12/29/20,"14,020,388,864",12/31/20,"3,810,000,000","-45,000,000","6,744,000,000","49,722,000,000"
7595,"Property, plant and equipment","Revaluation of power generating assets	",444929,12/31/20,02/26/21,2,"Ernst & Young LLP",192,"Ernst & Young LLP Chartered Accountants",1263,Toronto,A6,ONTARIO,Canada,20-F,2021-02-26,,"Brookfield Renewable Partners L.P.",1533232,"=""BEP""","73 FRONT STREET","FIFTH FLOOR",HAMILTON,D0,BERMUDA,Foreign,,,"=""4911""","Electric Services",221111,"Hydroelectric Power Generation",34,42,12/29/20,"14,020,388,864",12/31/20,"3,810,000,000","-45,000,000","6,744,000,000","49,722,000,000"
7596,"Business combinations","Significant acquisition	",444929,12/31/20,02/26/21,2,"Ernst & Young LLP",192,"Ernst & Young LLP Chartered Accountants",1263,Toronto,A6,ONTARIO,Canada,20-F,2021-02-26,,"Brookfield Renewable Partners L.P.",1533232,"=""BEP""","73 FRONT STREET","FIFTH FLOOR",HAMILTON,D0,BERMUDA,Foreign,,,"=""4911""","Electric Services",221111,"Hydroelectric Power Generation",34,42,12/29/20,"14,020,388,864",12/31/20,"3,810,000,000","-45,000,000","6,744,000,000","49,722,000,000"
7513,"Allowance for credit losses","Assessment of the collective allowance for credit losses",444221,12/31/20,02/26/21,4,"KPMG LLP",,,,Boston,MA,MASSACHUSETTS,"US New England",10-K,2021-02-26,,"BROOKLINE BANCORP INC",1049782,"=""BRKL""","131 CLARENDON STREET",,BOSTON,MA,MASSACHUSETTS,"US New England",,,"=""6035""","Savings Institutions, Federally Chartered",522120,"Savings Institutions",34,12,12/31/20,"946,962,752",12/31/20,"222,921,000","47,635,000","778,199,000","8,942,424,000"
6362,"Business combinations","Earn-out obligation — Refer to Notes 1 (Goodwill and Amortizable Intangible Assets) and 3 (Business Combinations) to the financial statements",443282,12/31/20,02/23/21,3,"Deloitte & Touche LLP",,,,Tampa,FL,FLORIDA,"US Southeast",10-K,2021-02-23,,"BROWN & BROWN, INC.",79282,"=""BRO""","300 N. BEACH STREET",,"DAYTONA BEACH",FL,FLORIDA,"US Southeast",,,"=""6411""","Insurance Agents, Brokers, and Service",524210,"Insurance Agencies and Brokerages",34,47,12/31/20,"13,417,220,096",12/31/20,"2,613,375,000","480,483,000","-1,691,355,000","8,966,492,000"
4264,"Other intangible assets","Quantitative Impairment Assessment of Brand Names Intangible Assets",428442,04/30/20,06/19/20,1,"PricewaterhouseCoopers LLP",,,,Louisville,KY,KENTUCKY,"US Mid Atlantic",10-K,2020-06-19,,"BROWN FORMAN CORP",14693,"=""BF.B""","850 DIXIE HWY",,LOUISVILLE,KY,KENTUCKY,"US Mid Atlantic",,,"=""2080""",Beverages,312140,Distilleries,34,61,05/01/20,"18,861,307,904",04/30/20,"3,363,000,000","827,000,000","584,000,000","5,766,000,000"
4268,"Other intangible assets","Quantitative Impairment Assessment of Brand Names Intangible Assets",428498,04/30/20,06/19/20,1,"PricewaterhouseCoopers LLP",,,,Louisville,KY,KENTUCKY,"US Mid Atlantic",10-K/A,2020-06-22,,"BROWN FORMAN CORP",14693,"=""BF.B""","850 DIXIE HWY",,LOUISVILLE,KY,KENTUCKY,"US Mid Atlantic",,,"=""2080""",Beverages,312140,Distilleries,34,61,05/01/20,"18,861,307,904",04/30/20,"3,363,000,000","827,000,000","584,000,000","5,766,000,000"
3818,"Revenue from customer contracts","Revenue – Refer to Note 2n and 22 to the Financial Statements",424020,01/31/20,04/09/20,3,"Deloitte & Touche LLP",486,"Deloitte srl",1208,Montreal,A8,QUEBEC,Canada,40-F,2020-04-09,,"BRP Inc.",1748797,"=""DOOO""","726 SAINT-JOSEPH STREET",,VALCOURT,A8,QUEBEC,Canada,,,"=""3790""","Miscellaneous Transportation Equipment",336999,"All Other Transportation Equipment Manufacturing",34,,,,01/31/20,"4,576,500,000","280,200,000","-907,100,000","2,848,400,000"
3819,"Goodwill and intangible assets","Intangibles – Goodwill and Indefinite Useful Life Intangible Assets – Marine Group – Refer to Notes 2 and 10 to the Financial Statements",424020,01/31/20,04/09/20,3,"Deloitte & Touche LLP",486,"Deloitte srl",1208,Montreal,A8,QUEBEC,Canada,40-F,2020-04-09,,"BRP Inc.",1748797,"=""DOOO""","726 SAINT-JOSEPH STREET",,VALCOURT,A8,QUEBEC,Canada,,,"=""3790""","Miscellaneous Transportation Equipment",336999,"All Other Transportation Equipment Manufacturing",34,,,,01/31/20,"4,576,500,000","280,200,000","-907,100,000","2,848,400,000"
9261,"Equity investments and joint ventures","Joint Venture Consolidation Assessment",448788,12/31/20,03/15/21,2,"Ernst & Young LLP",,,,"New York",NY,"NEW YORK","US Mid Atlantic",10-K,2021-03-15,,"BRT Apartments Corp.",14846,"=""BRT""","60 CUTTER MILL RD","SUITE 303","GREAT NECK",NY,"NEW YORK","US Mid Atlantic",,,"=""6798""","Real Estate Investment Trusts",531110,"Lessors of Residential Buildings and Dwellings",34,15,12/31/20,"249,766,400",12/31/20,"28,102,000","-19,862,000",,"365,741,000"
8033,Goodwill,"Goodwill Impairment Assessment – Reporting Unit in Bruker Scientific Instruments(BSI) NANO Segment",445333,12/31/20,03/01/21,1,"PricewaterhouseCoopers LLP",,,,Boston,MA,MASSACHUSETTS,"US New England",10-K,2021-03-01,,"BRUKER CORP",1109354,"=""BRKR""","40 MANNING RD",,BILLERICA,MA,MASSACHUSETTS,"US New England",,,"=""3826""","Laboratory Analytical Instruments",334516,"Analytical Laboratory Instrument Manufacturing",34,54,12/31/20,"8,227,060,736",12/31/20,"1,987,500,000","157,800,000","411,700,000","3,049,000,000"
5389,"Other intangible assets","Power Products Trade Name Intangible Assets-Refer to Notes 1 and 11 to the financial statements",441909,12/31/20,02/16/21,3,"Deloitte & Touche LLP",,,,Chicago,IL,ILLINOIS,"US Midwest",10-K,2021-02-16,,"BRUNSWICK CORP",14930,"=""BC""","26125 N. RIVERWOODS BLVD. SUITE 500",,METTAWA,IL,ILLINOIS,"US Midwest",,,"=""3510""","Engines & Turbines",333618,"Other Engine Equipment Manufacturing",34,76,12/31/20,"5,937,189,888",12/31/20,"4,347,500,000","372,700,000","540,000,000","3,770,600,000"
7635,"Allowance for credit losses","Allowance for credit losses on loans collectively evaluated",445423,12/31/20,03/01/21,4,"KPMG LLP",,,,Philadelphia,PA,PENNSYLVANIA,"US Mid Atlantic",10-K,2021-03-01,,"BRYN MAWR BANK CORP",802681,,"801 LANCASTER AVE",,"BRYN MAWR",PA,PENNSYLVANIA,"US Mid Atlantic",,,"=""6022""","State Commercial Banks",522110,"Commercial Banking",34,31,12/31/20,"610,785,024",12/31/20,"184,081,000","32,573,000","423,516,000","5,432,022,000"
4125,"Pension and other post-employment benefits","Evaluation of the measurement of fair value of certain unquoted investments included in the plan assets of the BT Pension Scheme (BTPS) that are valued based on inputs that are not directly observable",426963,03/31/20,05/06/20,4,"KPMG LLP",87,"KPMG LLP",1118,London,X0,"UNITED KINGDOM",Foreign,20-F,2020-05-21,,"BT GROUP PLC",756620,,"BT CENTRE - 81 NEWGATE ST",,LONDON,X0,"UNITED KINGDOM",Foreign,,,"=""4813""","Telephone Communications, Except Radiotelephone",517310,"Telecommunications Resellers",34,1,04/02/20,"2,801,043,968",03/31/20,"28,401,000,000","2,150,000,000","1,084,000,000","65,801,000,000"
4126,"Pension and other post-employment benefits","Evaluation of the measurement of the defined benefit obligation of the BTPS",426963,03/31/20,05/06/20,4,"KPMG LLP",87,"KPMG LLP",1118,London,X0,"UNITED KINGDOM",Foreign,20-F,2020-05-21,,"BT GROUP PLC",756620,,"BT CENTRE - 81 NEWGATE ST",,LONDON,X0,"UNITED KINGDOM",Foreign,,,"=""4813""","Telephone Communications, Except Radiotelephone",517310,"Telecommunications Resellers",34,1,04/02/20,"2,801,043,968",03/31/20,"28,401,000,000","2,150,000,000","1,084,000,000","65,801,000,000"
4127,"Regulatory assets and liabilities","Evaluation of regulatory provisions",426963,03/31/20,05/06/20,4,"KPMG LLP",87,"KPMG LLP",1118,London,X0,"UNITED KINGDOM",Foreign,20-F,2020-05-21,,"BT GROUP PLC",756620,,"BT CENTRE - 81 NEWGATE ST",,LONDON,X0,"UNITED KINGDOM",Foreign,,,"=""4813""","Telephone Communications, Except Radiotelephone",517310,"Telecommunications Resellers",34,1,04/02/20,"2,801,043,968",03/31/20,"28,401,000,000","2,150,000,000","1,084,000,000","65,801,000,000"
11509,"Long-lived assets","Impairment of mining concessions, development costs, right-of-use asset, property, plant and equipment",455198,12/31/20,04/29/21,2,"Ernst & Young LLP",692,"Paredes Burga & Asociados Sociedad Civil de Responsabilidad Limitada",1315,Lima,R5,PERU,Foreign,20-F,2021-04-30,,"BUENAVENTURA MINING CO INC",1013131,"=""BVN""","AVE CARLOS VILLARAN 790",,LIMA,R5,PERU,Foreign,,,"=""1000""","Metal mining",212221,"Gold Ore Mining",34,12,12/29/20,"3,345,410,304",12/31/20,"676,542,000","-150,339,000",,"3,979,617,000"
11510,"Uncertain tax positions","Uncertain tax positions",455198,12/31/20,04/29/21,2,"Ernst & Young LLP",692,"Paredes Burga & Asociados Sociedad Civil de Responsabilidad Limitada",1315,Lima,R5,PERU,Foreign,20-F,2021-04-30,,"BUENAVENTURA MINING CO INC",1013131,"=""BVN""","AVE CARLOS VILLARAN 790",,LIMA,R5,PERU,Foreign,,,"=""1000""","Metal mining",212221,"Gold Ore Mining",34,12,12/29/20,"3,345,410,304",12/31/20,"676,542,000","-150,339,000",,"3,979,617,000"
7530,Goodwill,"Goodwill Quantitative Impairment Test",444193,12/31/20,02/26/21,1,"PricewaterhouseCoopers LLP",,,,Dallas,TX,TEXAS,"US Southwest",10-K,2021-02-26,,"Builders FirstSource, Inc.",1316835,"=""BLDR""","6031 CONNECTION DR., STE. 400",,IRVING,TX,TEXAS,"US Southwest",,,"=""5211""","Lumber and Other Building Materials Dealers",238290,"Other Building Equipment Contractors",34,41,12/31/20,"4,767,791,616",12/31/20,"8,558,874,000","313,537,000","247,596,000","4,173,671,000"
5825,Inventory,"Readily Marketable Inventories and Physically Settled Forward Purchase and Sale Contracts - Refer to Notes 1 and 15 to the financial statements",442647,12/31/20,02/19/21,3,"Deloitte & Touche LLP",,,,"Saint Louis",MO,MISSOURI,"US Southeast",10-K,2021-02-19,,BUNGELTD,1144519,,"1391 TIMBERLAKE MANOR PARKWAY",,CHESTERFIELD,MO,MISSOURI,"US Southeast",,,"=""2070""","Fats & Oils",311225,"Fats and Oils Refining and Blending",34,63,12/29/20,"8,860,072,960",12/31/20,"41,404,000,000","1,145,000,000","5,369,000,000","23,655,000,000"
8130,"Deferred and capitalized costs","Property and Equipment – Self Constructed Assets – Appropriate Capitalization of Costs – Refer to Notes 2 and 7 to the financial statements.",445042,12/31/20,03/01/21,3,"Deloitte & Touche LLP",,,,"Fort Worth",TX,TEXAS,"US Southwest",10-K,2021-03-01,,"BURLINGTON NORTHERN SANTA FE, LLC",934612,"=""BNI""","2650 LOU MENK DR",,"FT WORTH",TX,TEXAS,"US Southwest",1067983,"BERKSHIRE HATHAWAY INC","=""4011""","Railroads, Line-haul Operating",482111,"Line-Haul Railroads",34,,,,12/31/20,"20,869,000,000","5,161,000,000","29,153,000,000","88,660,000,000"
3451,"Policy changes","Incremental Borrowing Rate Used in Adoption of Topic No. 842—Refer to Notes 1 and 2 to the financial statements (also see Change in Accounting Principle explanatory paragraph above)",421873,02/01/20,03/13/20,3,"Deloitte & Touche LLP",,,,Parsippany,NJ,"NEW JERSEY","US Mid Atlantic",10-K,2020-03-13,,"Burlington Stores, Inc.",1579298,"=""BURL""","1830 ROUTE 130 NORTH",,BURLINGTON,NJ,"NEW JERSEY","US Mid Atlantic",,,"=""5311""","Department Stores",448140,"Family Clothing Stores",34,222,02/03/20,"14,738,624,512",02/01/20,"7,286,398,000","465,116,000","243,085,000","5,593,859,000"
3452,Inventory,"Retail Inventory Method—Impact of Markdowns—Refer to Note 1 to the financial statements",421873,02/01/20,03/13/20,3,"Deloitte & Touche LLP",,,,Parsippany,NJ,"NEW JERSEY","US Mid Atlantic",10-K,2020-03-13,,"Burlington Stores, Inc.",1579298,"=""BURL""","1830 ROUTE 130 NORTH",,BURLINGTON,NJ,"NEW JERSEY","US Mid Atlantic",,,"=""5311""","Department Stores",448140,"Family Clothing Stores",34,222,02/03/20,"14,738,624,512",02/01/20,"7,286,398,000","465,116,000","243,085,000","5,593,859,000"
6023,"Revenue from customer contracts","Revenue Recognition – Estimating Costs at Completion – Refer to Note 1 and Note 3 to the Financial Statements.",442968,12/31/20,02/22/21,3,"Deloitte & Touche LLP",,,,Charlotte,NC,"NORTH CAROLINA","US Southeast",10-K,2021-02-22,,"BWX Technologies, Inc.",1486957,"=""BWXT""","800 MAIN STREET","4TH FLOOR",LYNCHBURG,VA,VIRGINIA,"US Mid Atlantic",,,"=""3510""","Engines & Turbines",332410,"Power Boiler and Heat Exchanger Manufacturing",34,60,12/31/20,"5,745,334,272",12/31/20,"2,123,516,000","278,670,000","141,307,000","2,293,503,000"
7384,"Long-lived assets","Impairment Assessments of Long-Lived Assets and Investments in Unconsolidated Joint Ventures",444329,12/31/20,02/26/21,1,"PricewaterhouseCoopers LLP",,,,Boston,MA,MASSACHUSETTS,"US New England",10-K,2021-02-26,,"BXP, Inc.",1037540,"=""BXP""","800 BOYLSTON STREET","SUITE 1900",BOSTON,MA,MASSACHUSETTS,"US New England",,,"=""6798""","Real Estate Investment Trusts",531120,"Lessors of Nonresidential Buildings (except Miniwarehouses)",34,95,12/31/20,"14,720,100,352",12/31/20,"2,765,686,000","872,727,000",,"22,858,190,000"
5812,"Revenue from customer contracts","Revenue Recognition — Refer to Notes 1 and 10 to the financial statements",442622,12/31/20,02/19/21,3,"Deloitte & Touche LLP",,,,Minneapolis,MN,MINNESOTA,"US Midwest",10-K,2021-02-19,,"C. H. ROBINSON WORLDWIDE, INC.",1043277,"=""CHRW""","14701 CHARLSON ROAD",,"EDEN PRAIRIE",MN,MINNESOTA,"US Midwest",,,"=""4731""","Arrangement of Transportation of  Freight and Cargo",488510,"Freight Transportation Arrangement",34,94,12/31/20,"12,606,553,088",12/31/20,"16,207,106,000","506,421,000","278,836,000","5,144,258,000"
7482,"Deferred and capitalized costs","Capitalization of Internal Labor Costs",444288,12/31/20,02/25/21,1,"PricewaterhouseCoopers LLP",,,,Phoenix,AZ,ARIZONA,"US Southwest",10-K,2021-02-26,,"Cable One, Inc.",1632127,"=""CABO""","210 E. EARLL DRIVE",,PHOENIX,AZ,ARIZONA,"US Southwest",,,"=""4841""","Cable and Other Pay Television Services",515210,"Cable and Other Subscription Programming",34,"2,228",12/31/20,"13,428,036,608",12/31/20,"1,325,229,000","304,391,000","-213,442,000","4,488,338,000"
7483,"Equity investments and joint ventures","Valuation of the Hargray Investment",444288,12/31/20,02/25/21,1,"PricewaterhouseCoopers LLP",,,,Phoenix,AZ,ARIZONA,"US Southwest",10-K,2021-02-26,,"Cable One, Inc.",1632127,"=""CABO""","210 E. EARLL DRIVE",,PHOENIX,AZ,ARIZONA,"US Southwest",,,"=""4841""","Cable and Other Pay Television Services",515210,"Cable and Other Subscription Programming",34,"2,228",12/31/20,"13,428,036,608",12/31/20,"1,325,229,000","304,391,000","-213,442,000","4,488,338,000"
7484,"Equity investments and joint ventures","Initial Fair Value of Options Associated with the Mega Broadband Investment",444288,12/31/20,02/25/21,1,"PricewaterhouseCoopers LLP",,,,Phoenix,AZ,ARIZONA,"US Southwest",10-K,2021-02-26,,"Cable One, Inc.",1632127,"=""CABO""","210 E. EARLL DRIVE",,PHOENIX,AZ,ARIZONA,"US Southwest",,,"=""4841""","Cable and Other Pay Television Services",515210,"Cable and Other Subscription Programming",34,"2,228",12/31/20,"13,428,036,608",12/31/20,"1,325,229,000","304,391,000","-213,442,000","4,488,338,000"
4754,"Deferred income taxes","Income Taxes — Realizability of U.S. Deferred Tax Assets — Refer to Notes A and S to the consolidated financial statements",436212,09/30/20,11/25/20,3,"Deloitte & Touche LLP",,,,Boston,MA,MASSACHUSETTS,"US New England",10-K,2020-11-25,,"CABOT CORP",16040,"=""CBT""","TWO SEAPORT LANE SUITE 1400",,BOSTON,MA,MASSACHUSETTS,"US New England",,,"=""2890""","Miscellaneous Chemical Products",325211,"Plastics Material and Resin Manufacturing",34,36,09/30/20,"2,034,492,928",09/30/20,"2,614,000,000","-238,000,000","454,000,000","2,781,000,000"
4755,"Other contingent liabilities","Commitments and Contingencies — Respirator Liabilities — Refer to Note U to the consolidated financial statements",436212,09/30/20,11/25/20,3,"Deloitte & Touche LLP",,,,Boston,MA,MASSACHUSETTS,"US New England",10-K,2020-11-25,,"CABOT CORP",16040,"=""CBT""","TWO SEAPORT LANE SUITE 1400",,BOSTON,MA,MASSACHUSETTS,"US New England",,,"=""2890""","Miscellaneous Chemical Products",325211,"Plastics Material and Resin Manufacturing",34,36,09/30/20,"2,034,492,928",09/30/20,"2,614,000,000","-238,000,000","454,000,000","2,781,000,000"
4421,"Revenue from customer contracts","Revenue recognition based on the percentage of completion method",430840,06/30/20,08/14/20,2,"Ernst & Young LLP",,,,Tysons,VA,VIRGINIA,"US Mid Atlantic",10-K,2020-08-14,,"CACI INTERNATIONAL INC /DE/",16058,"=""CACI""","TWO RESTON OVERLOOK","12021 SUNSET HILLS ROAD",RESTON,VA,VIRGINIA,"US Mid Atlantic",,,"=""7373""","Computer Integrated Systems Design",541512,"Computer Systems Design Services",34,217,06/30/20,"5,442,169,856",06/30/20,"5,720,042,000","321,480,000","-1,152,820,000","5,542,472,000"
8065,"Other debt","Liability related to the Tax Receivable Agreement",444990,12/31/20,02/26/21,1,"PricewaterhouseCoopers LLP",,,,Houston,TX,TEXAS,"US Southwest",10-K,2021-03-01,,"Cactus, Inc.",1699136,"=""WHD""","920 MEMORIAL CITY WAY","SUITE 300",HOUSTON,TX,TEXAS,"US Southwest",,,"=""3533""","Oil and Gas Field Machinery and Equipment",333132,"Oil and Gas Field Machinery and Equipment Manufacturing",34,26,12/31/20,"1,243,877,888",12/31/20,"348,566,000","34,446,000","345,146,000","815,594,000"
7823,"Allowance for credit losses","Allowance for Credit Losses",445302,12/31/20,03/01/21,2,"Ernst & Young LLP",,,,Birmingham,AL,ALABAMA,"US Southeast",10-K,2021-03-01,,"Cadence Bancorporation",1614184,,"2800 POST OAK BOULEVARD SUITE 3800",,HOUSTON,TX,TEXAS,"US Southwest",,,"=""6021""","National Commercial Banks",522110,"Commercial Banking",34,16,12/31/20,"2,068,567,936",12/31/20,"648,273,000","-205,527,000","1,994,261,000","18,712,567,000"
6011,"Revenue from customer contracts","Revenue Recognition – Identifying and Evaluating Terms and Conditions in Contracts",442979,01/02/21,02/22/21,1,"PricewaterhouseCoopers LLP",,,,"San Jose",CA,CALIFORNIA,"US West",10-K,2021-02-22,,"CADENCE DESIGN SYSTEMS INC",813672,"=""CDNS""","2655 SEELY AVENUE BLDG 5",,"SAN JOSE",CA,CALIFORNIA,"US West",,,"=""7372""","Prepackaged Software",511210,"Software Publishers",34,136,01/04/21,"37,867,671,552",01/02/21,"2,682,891,000","590,644,000","1,500,341,000","3,950,785,000"
11713,"Revenue from customer contracts","Revenue Recognition – Identifying and Evaluating Terms and Conditions in Contracts",456430,01/02/21,02/22/21,1,"PricewaterhouseCoopers LLP",,,,"San Jose",CA,CALIFORNIA,"US West",10-K/A,2021-05-14,,"CADENCE DESIGN SYSTEMS INC",813672,"=""CDNS""","2655 SEELY AVENUE BLDG 5",,"SAN JOSE",CA,CALIFORNIA,"US West",,,"=""7372""","Prepackaged Software",511210,"Software Publishers",34,136,01/04/21,"37,867,671,552",01/02/21,"2,682,891,000","590,644,000","1,500,341,000","3,950,785,000"
9988,"Going concern","Liquidity Assessment",450588,12/31/20,03/26/21,1,"PricewaterhouseCoopers LLP",,,,"Los Angeles",CA,CALIFORNIA,"US West",10-K,2021-03-26,,"CADIZ INC",727273,"=""CDZI""","550 SOUTH HOPE STREET","SUITE 2850","LOS ANGELES",CA,CALIFORNIA,"US West",,,"=""4941""","Water Supply",531312,"Nonresidential Property Managers",34,11,12/31/20,"393,010,144",12/31/20,"541,000","-37,817,000","-29,114,000","74,363,000"
4148,Goodwill,"Goodwill impairment assessment - Healthcare cash-generating unit",427063,03/31/20,05/22/20,1,"PricewaterhouseCoopers LLP",493,"PricewaterhouseCoopers srl",271,Montreal,A8,QUEBEC,Canada,6-K/A,2020-05-22,,"CAE INC",1173382,"=""CAE""","8585 COTE DE LIESSE",,ST-LAURENT,A8,QUEBEC,Canada,,,"=""3690""","Miscellaneous Electrical Machinery, Equipment & Supplies",333319,"Other Commercial and Service Industry Machinery Manufacturing",34,,,,,,,,
4149,"Revenue from customer contracts","Revenue recognition - Estimated costs to complete certain contracts in the Defence and Security and Civil Aviation Training Solutions segments",427063,03/31/20,05/22/20,1,"PricewaterhouseCoopers LLP",493,"PricewaterhouseCoopers srl",271,Montreal,A8,QUEBEC,Canada,6-K/A,2020-05-22,,"CAE INC",1173382,"=""CAE""","8585 COTE DE LIESSE",,ST-LAURENT,A8,QUEBEC,Canada,,,"=""3690""","Miscellaneous Electrical Machinery, Equipment & Supplies",333319,"Other Commercial and Service Industry Machinery Manufacturing",34,,,,,,,,
4288,Goodwill,"Goodwill impairment assessment - Healthcare cash-generating unit",428683,03/31/20,05/22/20,1,"PricewaterhouseCoopers LLP",493,"PricewaterhouseCoopers srl",271,Montreal,A8,QUEBEC,Canada,40-F,2020-06-26,,"CAE INC",1173382,"=""CAE""","8585 COTE DE LIESSE",,ST-LAURENT,A8,QUEBEC,Canada,,,"=""3690""","Miscellaneous Electrical Machinery, Equipment & Supplies",333319,"Other Commercial and Service Industry Machinery Manufacturing",34,,,,,,,,
4289,"Revenue from customer contracts","Revenue recognition - Estimated costs to complete certain contracts in the Defence and Security and Civil Aviation Training Solutions segments",428683,03/31/20,05/22/20,1,"PricewaterhouseCoopers LLP",493,"PricewaterhouseCoopers srl",271,Montreal,A8,QUEBEC,Canada,40-F,2020-06-26,,"CAE INC",1173382,"=""CAE""","8585 COTE DE LIESSE",,ST-LAURENT,A8,QUEBEC,Canada,,,"=""3690""","Miscellaneous Electrical Machinery, Equipment & Supplies",333319,"Other Commercial and Service Industry Machinery Manufacturing",34,,,,,,,,
