"CAM Key","CAM Topic","CAM Company Title","Audit Opinion Key","Year Ended Date","Signature Date","Auditor Key",Auditor,"Auditor Affiliate Key","Auditor Affiliate","Auditor Affiliate PCAOB","Auditor City","Auditor State Code","Auditor State Name","Auditor State Region",Source,"Source Date","Going Concern",Company,"CIK Code",Ticker,"Bus Street 1","Bus Street 2",City,"State Code","State Name","State Region","Parent CIK","Parent Name","SIC Code","SIC Description","NAICS Code","NAICS Description","Filer Act","Stock Price ($)","Stock Price Date","Market Cap ($)","Financials Date","Revenue ($)","Earnings ($)","Book Value ($)","Assets ($)"
15279,"Revenue from customer contracts","Revenue Recognition",474343,12/31/21,02/18/22,2,"Ernst & Young LLP",,,,"San Jose",CA,CALIFORNIA,"US West",10-K,2022-02-18,,"10x Genomics, Inc.",1770787,"=""TXG""","6230 STONERIDGE MALL ROAD",,PLEASANTON,CA,CALIFORNIA,"US West",,,"=""3826""","Laboratory Analytical Instruments",334516,"Analytical Laboratory Instrument Manufacturing",34,149,12/31/21,"13,833,693,184",12/31/21,"490,490,000","-58,223,000","787,660,000","1,018,826,000"
20811,"Revenue from customer contracts","Revenue Recognition— Refer to Note 14 to the financial statements",485550,12/31/21,04/29/22,3,"Deloitte & Touche LLP",499,"Deloitte Touche Tohmatsu Certified Public Accountants LLP",1113,Shanghai,F4,CHINA,Foreign,20-F,2022-04-29,,"111, Inc.",1738906,"=""YI""","3-4/F, NO.295 ZUCHONGZHI ROAD","PUDONG NEW AREA",SHANGHAI,F4,CHINA,Foreign,,,"=""5912""","Drug Stores and Proprietary Stores",446110,"Pharmacies and Drug Stores",34,3,12/29/21,"145,631,312",12/31/21,"1,949,666,000","-105,095,000","129,072,000","493,592,000"
15672,"Business combinations","Acquisition of Iora Health, Inc. – Valuation of Intangible Assets related to Medicare Advantage and CMS Direct Contracting Contracts",474862,12/31/21,02/23/22,1,"PricewaterhouseCoopers LLP",,,,"San Francisco",CA,CALIFORNIA,"US West",10-K,2022-02-23,,"1Life Healthcare Inc",1404123,,"ONE EMBARCADERO CENTER, SUITE 1900",,"San Francisco",CA,CALIFORNIA,"US West",,,"=""8011""","Offices and Clinics of Doctors of Medicine",621111,"Offices of Physicians (except Mental Health Specialists)",34,18,12/31/21,"3,368,555,520",12/31/21,"623,315,000","-254,641,000","228,961,000","2,627,032,000"
15673,"Insurance contract liabilities","Valuation of Incurred but not yet Reported (“IBNR”) Claims Liability related to Iora Health, Inc.",474862,12/31/21,02/23/22,1,"PricewaterhouseCoopers LLP",,,,"San Francisco",CA,CALIFORNIA,"US West",10-K,2022-02-23,,"1Life Healthcare Inc",1404123,,"ONE EMBARCADERO CENTER, SUITE 1900",,"San Francisco",CA,CALIFORNIA,"US West",,,"=""8011""","Offices and Clinics of Doctors of Medicine",621111,"Offices of Physicians (except Mental Health Specialists)",34,18,12/31/21,"3,368,555,520",12/31/21,"623,315,000","-254,641,000","228,961,000","2,627,032,000"
19775,"Allowance for credit losses","Allowance for Credit Losses – Refer to Note 2 to the consolidated financial statements",482333,12/31/21,03/31/22,3,"Deloitte & Touche LLP",,,,Atlanta,GA,GEORGIA,"US Southeast",10-K,2022-03-31,,"1st FRANKLIN FINANCIAL CORP",38723,,"135 E TUGALO ST","P O BOX 880",TOCCOA,GA,GEORGIA,"US Southeast",,,"=""6141""","Personal Credit Institutions",522292,"Real Estate Credit",34,,,,12/31/21,"221,372,713","41,861,007",,"1,118,221,935"
11194,"Long-lived assets","Assessment of impairment of store-level long-lived assets",453599,02/27/21,04/22/21,4,"KPMG LLP",,,,"Short Hills",NJ,"NEW JERSEY","US Mid Atlantic",10-K,2021-04-22,,"20230930-DK-Butterfly-1, Inc.",886158,,"650 LIBERTY AVENUE",,UNION,NJ,"NEW JERSEY","US Mid Atlantic",,,"=""5700""","Retail-Home Furniture, Furnishings & Equipment Stores",442299,"All Other Home Furnishings Stores",34,28,03/01/21,"3,377,042,176",02/27/21,"9,233,028,000","-150,773,000",,"6,456,930,000"
17315,"Revenue from customer contracts","Determination of implied pricing concessions",476831,12/31/21,03/01/22,4,"KPMG LLP",,,,McLean,VA,VIRGINIA,"US Mid Atlantic",10-K,2022-03-01,,"2U, LLC",1459417,,"7900 HARKINS ROAD",,LANHAM,MD,MARYLAND,"US Mid Atlantic",,,"=""7372""","Prepackaged Software",511210,"Software Publishers",34,20,12/29/21,"1,507,442,048",12/31/21,"945,682,000","-194,766,000","-670,907,000","2,109,006,000"
17316,"Other intangible assets","Evaluation of acquisition-date fair value of acquired intangible assets",476831,12/31/21,03/01/22,4,"KPMG LLP",,,,McLean,VA,VIRGINIA,"US Mid Atlantic",10-K,2022-03-01,,"2U, LLC",1459417,,"7900 HARKINS ROAD",,LANHAM,MD,MARYLAND,"US Mid Atlantic",,,"=""7372""","Prepackaged Software",511210,"Software Publishers",34,20,12/29/21,"1,507,442,048",12/31/21,"945,682,000","-194,766,000","-670,907,000","2,109,006,000"
14525,"Other contingent liabilities","Legal Proceedings",473255,12/31/21,02/09/22,1,"PricewaterhouseCoopers LLP",,,,Minneapolis,MN,MINNESOTA,"US Midwest",10-K,2022-02-09,,"3M CO",66740,"=""MMM""","3M CENTER","BLDG. 220-9E-02","ST PAUL",MN,MINNESOTA,"US Midwest",,,"=""3841""","Surgical and Medical Instruments and Apparatus",322222,"Coated and Laminated Paper Manufacturing",34,178,12/31/21,"84,924,768,256",12/31/21,"35,355,000,000","5,921,000,000","-3,728,000,000","47,072,000,000"
20572,"Other contingent liabilities","Legal Proceedings
",484919,12/31/21,02/09/22,1,"PricewaterhouseCoopers LLP",,,,Minneapolis,MN,MINNESOTA,"US Midwest",8-K,2022-04-26,,"3M CO",66740,"=""MMM""","3M CENTER","BLDG. 220-9E-02","ST PAUL",MN,MINNESOTA,"US Midwest",,,"=""3841""","Surgical and Medical Instruments and Apparatus",322222,"Coated and Laminated Paper Manufacturing",34,178,12/31/21,"84,924,768,256",12/31/21,"35,355,000,000","5,921,000,000","-3,728,000,000","47,072,000,000"
20953,"Going concern","Going Concern Assessment",486197,12/31/21,05/02/22,1,"PricewaterhouseCoopers LLP",94,"PricewaterhouseCoopers Zhong Tian LLP",1424,Beijing,F4,CHINA,Foreign,20-F,2022-05-02,Yes,"51Talk Online Education Group",1659494,"=""COE""","6 SHENTON WAY, #38-07 OUE DOWNTOWN",,SINGAPORE,U0,SINGAPORE,Foreign,,,"=""8200""","Services-Educational Services",611630,"Language Schools",34,1,12/29/21,"13,835,343",12/31/21,"342,280,000","18,918,000","-113,544,000","187,067,000"
20954,"Revenue from customer contracts","Impairment Assessment on Contract Cost Asset",486197,12/31/21,05/02/22,1,"PricewaterhouseCoopers LLP",94,"PricewaterhouseCoopers Zhong Tian LLP",1424,Beijing,F4,CHINA,Foreign,20-F,2022-05-02,Yes,"51Talk Online Education Group",1659494,"=""COE""","6 SHENTON WAY, #38-07 OUE DOWNTOWN",,SINGAPORE,U0,SINGAPORE,Foreign,,,"=""8200""","Services-Educational Services",611630,"Language Schools",34,1,12/29/21,"13,835,343",12/31/21,"342,280,000","18,918,000","-113,544,000","187,067,000"
12414,Inventory,"Assessment of the write-down of inventories",460559,05/31/21,07/20/21,4,"KPMG LLP",,,,Chicago,IL,ILLINOIS,"US Midwest",10-K,2021-07-21,,"AAR CORP",1750,"=""AIR""","1100 N WOOD DALE RD",,"WOOD DALE",IL,ILLINOIS,"US Midwest",,,"=""3720""","Aircraft & Parts",334613,"Magnetic and Optical Recording Media Manufacturing",34,42,05/31/21,"1,476,916,096",05/31/21,"1,652,300,000","35,800,000","850,600,000","1,539,700,000"
12415,"Revenue from customer contracts","Evaluation of the estimate of costs at completion of certain performance obligations",460559,05/31/21,07/20/21,4,"KPMG LLP",,,,Chicago,IL,ILLINOIS,"US Midwest",10-K,2021-07-21,,"AAR CORP",1750,"=""AIR""","1100 N WOOD DALE RD",,"WOOD DALE",IL,ILLINOIS,"US Midwest",,,"=""3720""","Aircraft & Parts",334613,"Magnetic and Optical Recording Media Manufacturing",34,42,05/31/21,"1,476,916,096",05/31/21,"1,652,300,000","35,800,000","850,600,000","1,539,700,000"
15753,"Other contingent liabilities","Estimated claims liabilities",475003,12/31/21,02/23/22,2,"Ernst & Young LLP",,,,Atlanta,GA,GEORGIA,"US Southeast",10-K,2022-02-24,,"Aaron's Company, Inc.",1821393,,"400 GALLERIA PARKWAY SE, SUITE 300",,ATLANTA,GA,GEORGIA,"US Southeast",,,"=""7359""","Equipment Rental and Leasing, NEC",532210,"Consumer Electronics and Appliances Rental",34,25,12/31/21,"763,615,680",12/31/21,"1,845,504,000","109,934,000","699,937,000","1,441,265,000"
15754,Leases,"Allowance for lease merchandise write-offs",475003,12/31/21,02/23/22,2,"Ernst & Young LLP",,,,Atlanta,GA,GEORGIA,"US Southeast",10-K,2022-02-24,,"Aaron's Company, Inc.",1821393,,"400 GALLERIA PARKWAY SE, SUITE 300",,ATLANTA,GA,GEORGIA,"US Southeast",,,"=""7359""","Equipment Rental and Leasing, NEC",532210,"Consumer Electronics and Appliances Rental",34,25,12/31/21,"763,615,680",12/31/21,"1,845,504,000","109,934,000","699,937,000","1,441,265,000"
16751,"Revenue from customer contracts","Revenue recognition for long-term fixed price contracts using the percentage-of-completion method",475440,12/31/21,02/24/22,4,"KPMG LLP",288,"KPMG AG",3240,Zurich,V8,SWITZERLAND,Foreign,20-F,2022-02-25,,"ABB LTD",1091587,"=""ABBNY""","PO BOX 8131",*,ZURICH,V8,SWITZERLAND,Foreign,,,"=""3613""","Switchgear and Switchboard Apparatus",335311,"Power, Distribution, and Specialty Transformer Manufacturing",34,38,12/31/21,"74,736,861,184",12/31/21,"28,945,000,000","4,546,000,000","3,536,000,000","40,260,000,000"
16752,"Other income taxes","Valuation of unrecognized tax benefits related to transfer pricing",475440,12/31/21,02/24/22,4,"KPMG LLP",288,"KPMG AG",3240,Zurich,V8,SWITZERLAND,Foreign,20-F,2022-02-25,,"ABB LTD",1091587,"=""ABBNY""","PO BOX 8131",*,ZURICH,V8,SWITZERLAND,Foreign,,,"=""3613""","Switchgear and Switchboard Apparatus",335311,"Power, Distribution, and Specialty Transformer Manufacturing",34,38,12/31/21,"74,736,861,184",12/31/21,"28,945,000,000","4,546,000,000","3,536,000,000","40,260,000,000"
15278,"Other income taxes","Income taxes – Unrecognized tax benefits",474344,12/31/21,02/18/22,2,"Ernst & Young LLP",,,,Chicago,IL,ILLINOIS,"US Midwest",10-K,2022-02-18,,"ABBOTT LABORATORIES",1800,"=""ABT""","100 ABBOTT PARK ROAD",,"ABBOTT PARK",IL,ILLINOIS,"US Midwest",,,"=""2834""","Pharmaceutical Preparations",325412,"Pharmaceutical Preparation Manufacturing",34,141,12/31/21,"248,276,926,464",12/31/21,"43,075,000,000","7,071,000,000","-168,000,000","75,196,000,000"
15205,"Sales return and allowances","Sales rebate accruals for Medicaid, Medicare and managed care programs",474195,12/31/21,02/18/22,2,"Ernst & Young LLP",,,,Chicago,IL,ILLINOIS,"US Midwest",10-K,2022-02-18,,"AbbVie Inc.",1551152,"=""ABBV""","1 NORTH WAUKEGAN ROAD",,"NORTH CHICAGO",IL,ILLINOIS,"US Midwest",,,"=""2834""","Pharmaceutical Preparations",325412,"Pharmaceutical Preparation Manufacturing",34,135,12/31/21,"239,432,925,184",12/31/21,"56,197,000,000","11,542,000,000","-92,922,000,000","146,529,000,000"
15206,"Business combinations","Valuation of contingent consideration",474195,12/31/21,02/18/22,2,"Ernst & Young LLP",,,,Chicago,IL,ILLINOIS,"US Midwest",10-K,2022-02-18,,"AbbVie Inc.",1551152,"=""ABBV""","1 NORTH WAUKEGAN ROAD",,"NORTH CHICAGO",IL,ILLINOIS,"US Midwest",,,"=""2834""","Pharmaceutical Preparations",325412,"Pharmaceutical Preparation Manufacturing",34,135,12/31/21,"239,432,925,184",12/31/21,"56,197,000,000","11,542,000,000","-92,922,000,000","146,529,000,000"
18385,"Business combinations","Valuation of BioVision, Inc. acquired intangible assets",479300,12/31/21,03/14/22,1,"PricewaterhouseCoopers LLP",121,"PricewaterhouseCoopers LLP",876,Cambridge,X0,"UNITED KINGDOM",Foreign,20-F,2022-03-14,,"Abcam plc",1492074,"=""ABCZF""","DISCOVERY DRIVE","CAMBRIDGE BIOMEDICAL CAMPUS",CAMBRIDGE,X0,"UNITED KINGDOM",Foreign,,,"=""2836""","Biological Products, Except Diagnostic Substances",325414,"Biological Product (except Diagnostic) Manufacturing",34,24,12/29/21,"5,337,977,344",12/31/21,"427,200,000","6,000,000","77,300,000","1,335,600,000"
18386,"Business combinations","Impairment assessment of acquired intangible assets",479300,12/31/21,03/14/22,1,"PricewaterhouseCoopers LLP",121,"PricewaterhouseCoopers LLP",876,Cambridge,X0,"UNITED KINGDOM",Foreign,20-F,2022-03-14,,"Abcam plc",1492074,"=""ABCZF""","DISCOVERY DRIVE","CAMBRIDGE BIOMEDICAL CAMPUS",CAMBRIDGE,X0,"UNITED KINGDOM",Foreign,,,"=""2836""","Biological Products, Except Diagnostic Substances",325414,"Biological Product (except Diagnostic) Manufacturing",34,24,12/29/21,"5,337,977,344",12/31/21,"427,200,000","6,000,000","77,300,000","1,335,600,000"
20027,"Business combinations","Valuation of BioVision, Inc. acquired intangible assets",482887,12/31/21,03/14/22,1,"PricewaterhouseCoopers LLP",121,"PricewaterhouseCoopers LLP",876,Cambridge,X0,"UNITED KINGDOM",Foreign,20-F/A,2022-04-08,,"Abcam plc",1492074,"=""ABCZF""","DISCOVERY DRIVE","CAMBRIDGE BIOMEDICAL CAMPUS",CAMBRIDGE,X0,"UNITED KINGDOM",Foreign,,,"=""2836""","Biological Products, Except Diagnostic Substances",325414,"Biological Product (except Diagnostic) Manufacturing",34,24,12/29/21,"5,337,977,344",12/31/21,"427,200,000","6,000,000","77,300,000","1,335,600,000"
20028,"Business combinations","Impairment assessment of acquired intangible assets",482887,12/31/21,03/14/22,1,"PricewaterhouseCoopers LLP",121,"PricewaterhouseCoopers LLP",876,Cambridge,X0,"UNITED KINGDOM",Foreign,20-F/A,2022-04-08,,"Abcam plc",1492074,"=""ABCZF""","DISCOVERY DRIVE","CAMBRIDGE BIOMEDICAL CAMPUS",CAMBRIDGE,X0,"UNITED KINGDOM",Foreign,,,"=""2836""","Biological Products, Except Diagnostic Substances",325414,"Biological Product (except Diagnostic) Manufacturing",34,24,12/29/21,"5,337,977,344",12/31/21,"427,200,000","6,000,000","77,300,000","1,335,600,000"
16549,"Business combinations","Initial measurement of the fair value of contingent consideration and acquired intangible assets related to a business combination",475915,12/31/21,02/25/22,4,"KPMG LLP",187,"KPMG LLP Chartered Accountants",85,Vancouver,A1,"BRITISH COLUMBIA",Canada,10-K,2022-02-25,,"AbCellera Biologics Inc.",1703057,"=""ABCL""","150 W 4TH AVENUE",,VANCOUVER,A1,"BRITISH COLUMBIA",Canada,,,"=""2834""","Pharmaceutical Preparations",325412,"Pharmaceutical Preparation Manufacturing",34,14,12/31/21,"4,050,576,640",12/31/21,"375,203,000","153,464,000","865,421,000","1,318,569,000"
10126,"Long-lived assets","Impairment of Long-Lived Assets – Stores",450804,01/30/21,03/29/21,1,"PricewaterhouseCoopers LLP",,,,Columbus,OH,OHIO,"US Midwest",10-K,2021-03-29,,"ABERCROMBIE & FITCH CO /DE/",1018840,"=""ANF""","6301 FITCH PATH",,"NEW ALBANY",OH,OHIO,"US Midwest",,,"=""5651""","Family Clothing Stores",448140,"Family Clothing Stores",34,23,01/31/21,"1,439,544,960",01/30/21,"3,125,384,000","-114,021,000",,"3,314,902,000"
11818,"Other investments","Valuation of investments in medical device companies – Refer to Note 10, Other Assets",456785,03/31/21,05/21/21,3,"Deloitte & Touche LLP",,,,Boston,MA,MASSACHUSETTS,"US New England",10-K,2021-05-21,,"ABIOMED INC",815094,,"22 CHERRY HILL DR",,DANVERS,MA,MASSACHUSETTS,"US New England",,,"=""3841""","Surgical and Medical Instruments and Apparatus",339112,"Surgical and Medical Instrument Manufacturing",34,319,03/31/21,"14,429,209,600",03/31/21,"847,522,000","225,525,000","1,233,663,000","1,494,359,000"
13957,"Business combinations","Fair value of customer relationship intangible asset from the acquisition of Able",469802,10/31/21,12/22/21,4,"KPMG LLP",,,,"New York",NY,"NEW YORK","US Mid Atlantic",10-K,2021-12-22,,"ABM INDUSTRIES INC /DE/",771497,"=""ABM""","ONE LIBERTY PLAZA","7TH FLOOR","NEW YORK",NY,"NEW YORK","US Mid Atlantic",,,"=""7340""","Services-To Dwellings & Other Buildings",561720,"Janitorial Services",34,44,10/31/21,"2,961,980,672",10/31/21,"6,228,600,000","126,200,000","-1,044,400,000","4,436,200,000"
13958,"Other contingent liabilities","Valuation of self-insurance liabilities",469802,10/31/21,12/22/21,4,"KPMG LLP",,,,"New York",NY,"NEW YORK","US Mid Atlantic",10-K,2021-12-22,,"ABM INDUSTRIES INC /DE/",771497,"=""ABM""","ONE LIBERTY PLAZA","7TH FLOOR","NEW YORK",NY,"NEW YORK","US Mid Atlantic",,,"=""7340""","Services-To Dwellings & Other Buildings",561720,"Janitorial Services",34,44,10/31/21,"2,961,980,672",10/31/21,"6,228,600,000","126,200,000","-1,044,400,000","4,436,200,000"
17430,"Other investments","Evaluation of the evidence pertaining to the existence of the gold holdings",476715,12/31/21,02/28/22,4,"KPMG LLP",,,,"New York",NY,"NEW YORK","US Mid Atlantic",10-K,2022-03-01,,"abrdn Gold ETF Trust",1450923,"=""SGOL""","C/O ABRDN","1900 MARKET STREET, SUITE 200",PHILADELPHIA,PA,PENNSYLVANIA,"US Mid Atlantic",,,"=""6221""","Commodity Contracts Brokers and Dealers",525990,"Other Financial Vehicles",34,17,12/29/21,"2,395,355,904",12/31/21,,"-130,982,000",,"2,391,578,000"
22540,"Other investments","Evaluation of the evidence pertaining to the existence of the gold holdings",492610,12/31/21,02/28/22,4,"KPMG LLP",,,,"New York",NY,"NEW YORK","US Mid Atlantic",10-K/A,2022-09-29,,"abrdn Gold ETF Trust",1450923,"=""SGOL""","C/O ABRDN","1900 MARKET STREET, SUITE 200",PHILADELPHIA,PA,PENNSYLVANIA,"US Mid Atlantic",,,"=""6221""","Commodity Contracts Brokers and Dealers",525990,"Other Financial Vehicles",34,17,12/29/21,"2,395,355,904",12/31/21,,"-130,982,000",,"2,391,578,000"
17480,"Other investments","Evaluation of the evidence pertaining to the existence of the palladium holdings",476701,12/31/21,02/28/22,4,"KPMG LLP",,,,"New York",NY,"NEW YORK","US Mid Atlantic",10-K,2022-03-01,,"abrdn Palladium ETF Trust",1459862,"=""PALL""","C/O ABRDN","1900 MARKET STREET, SUITE 200",PHILADELPHIA,PA,PENNSYLVANIA,"US Mid Atlantic",,,"=""6221""","Commodity Contracts Brokers and Dealers",523991,"Trust, Fiduciary, and Custody Activities",34,185,12/29/21,"364,664,000",12/31/21,,"-72,918,000",,"358,161,000"
22539,"Other investments","Evaluation of the evidence pertaining to the existence of the palladium holdings",492609,12/31/21,02/28/22,4,"KPMG LLP",,,,"New York",NY,"NEW YORK","US Mid Atlantic",10-K/A,2022-09-29,,"abrdn Palladium ETF Trust",1459862,"=""PALL""","C/O ABRDN","1900 MARKET STREET, SUITE 200",PHILADELPHIA,PA,PENNSYLVANIA,"US Mid Atlantic",,,"=""6221""","Commodity Contracts Brokers and Dealers",523991,"Trust, Fiduciary, and Custody Activities",34,185,12/29/21,"364,664,000",12/31/21,,"-72,918,000",,"358,161,000"
17475,"Other investments","Evaluation of the evidence pertaining to the existence of the platinum holdings",476699,12/31/21,02/28/22,4,"KPMG LLP",,,,"New York",NY,"NEW YORK","US Mid Atlantic",10-K,2022-03-01,,"abrdn Platinum ETF Trust",1460235,"=""PPLT""","C/O ABRDN","1900 MARKET STREET, SUITE 200",PHILADELPHIA,PA,PENNSYLVANIA,"US Mid Atlantic",,,"=""6221""","Commodity Contracts Brokers and Dealers",523991,"Trust, Fiduciary, and Custody Activities",34,90,12/29/21,"1,181,095,936",12/31/21,,"-144,840,000",,"1,138,264,000"
22538,"Other investments","Evaluation of the evidence pertaining to the existence of the platinum holdings",492608,12/31/21,02/28/22,4,"KPMG LLP",,,,"New York",NY,"NEW YORK","US Mid Atlantic",10-K/A,2022-09-29,,"abrdn Platinum ETF Trust",1460235,"=""PPLT""","C/O ABRDN","1900 MARKET STREET, SUITE 200",PHILADELPHIA,PA,PENNSYLVANIA,"US Mid Atlantic",,,"=""6221""","Commodity Contracts Brokers and Dealers",523991,"Trust, Fiduciary, and Custody Activities",34,90,12/29/21,"1,181,095,936",12/31/21,,"-144,840,000",,"1,138,264,000"
17432,"Other investments","Evaluation of the evidence pertaining to the existence of the bullion holdings",476697,12/31/21,02/28/22,4,"KPMG LLP",,,,"New York",NY,"NEW YORK","US Mid Atlantic",10-K,2022-03-01,,"abrdn Precious Metals Basket ETF Trust",1483386,"=""GLTR""","C/O ABRDN","1900 MARKET STREET, SUITE 200",PHILADELPHIA,PA,PENNSYLVANIA,"US Mid Atlantic",,,"=""6221""","Commodity Contracts Brokers and Dealers",523920,"Portfolio Management",34,89,12/29/21,"979,110,016",12/31/21,,"-99,394,000",,"971,011,000"
22537,"Other investments","Evaluation of the evidence pertaining to the existence of the bullion holdings",492600,12/31/21,02/28/22,4,"KPMG LLP",,,,"New York",NY,"NEW YORK","US Mid Atlantic",10-K/A,2022-09-29,,"abrdn Precious Metals Basket ETF Trust",1483386,"=""GLTR""","C/O ABRDN","1900 MARKET STREET, SUITE 200",PHILADELPHIA,PA,PENNSYLVANIA,"US Mid Atlantic",,,"=""6221""","Commodity Contracts Brokers and Dealers",523920,"Portfolio Management",34,89,12/29/21,"979,110,016",12/31/21,,"-99,394,000",,"971,011,000"
17389,"Other investments","Evaluation of the evidence pertaining to the existence of the silver holdings",476749,12/31/21,02/28/22,4,"KPMG LLP",,,,"New York",NY,"NEW YORK","US Mid Atlantic",10-K,2022-03-01,,"abrdn Silver ETF Trust",1450922,"=""SIVR""","C/O ABRDN","1900 MARKET STREET, SUITE 200",PHILADELPHIA,PA,PENNSYLVANIA,"US Mid Atlantic",,,"=""6221""","Commodity Contracts Brokers and Dealers",523991,"Trust, Fiduciary, and Custody Activities",34,22,12/29/21,"960,300,032",12/31/21,,"-143,267,000",,"995,405,000"
22541,"Other investments","Evaluation of the evidence pertaining to the existence of the silver holdings",492611,12/31/21,02/28/22,4,"KPMG LLP",,,,"New York",NY,"NEW YORK","US Mid Atlantic",10-K/A,2022-09-29,,"abrdn Silver ETF Trust",1450922,"=""SIVR""","C/O ABRDN","1900 MARKET STREET, SUITE 200",PHILADELPHIA,PA,PENNSYLVANIA,"US Mid Atlantic",,,"=""6221""","Commodity Contracts Brokers and Dealers",523991,"Trust, Fiduciary, and Custody Activities",34,22,12/29/21,"960,300,032",12/31/21,,"-143,267,000",,"995,405,000"
18942,"Business combinations","Intangible asset –valuation",480254,12/31/21,03/22/22,1,"PricewaterhouseCoopers LLP",286,"PricewaterhouseCoopers SA",1358,Lausanne,V8,SWITZERLAND,Foreign,20-F,2022-03-22,,"AC Immune SA",1651625,"=""ACIU""","EPFL INNOVATION PARK, BUILDING B",,"1015 LAUSANNE",V8,SWITZERLAND,Foreign,,,"=""2834""","Pharmaceutical Preparations",325412,"Pharmaceutical Preparation Manufacturing",34,5,12/29/21,"361,122,432",12/31/21,,"-80,114,000","199,268,000","286,937,000"
10741,"Deferred income taxes","Income Taxes — Refer to Note 12 to the financial statements",452264,01/30/21,04/07/21,3,"Deloitte & Touche LLP",,,,Houston,TX,TEXAS,"US Southwest",10-K,2021-04-07,,"Academy Sports & Outdoors, Inc.",1817358,"=""ASO""","1800 NORTH MASON ROAD",,KATY,TX,TEXAS,"US Southwest",,,"=""5940""","Retail-Miscellaneous Shopping Goods Stores",451110,"Sporting Goods Stores",34,22,01/31/21,"1,958,961,152",01/30/21,"5,689,233,000","308,764,000","-326,937,000","4,384,482,000"
17516,"Revenue from customer contracts","Revenue Recognition",476730,12/31/21,03/01/22,2,"Ernst & Young LLP",,,,Nashville,TN,TENNESSEE,"US Southeast",10-K,2022-03-01,,"Acadia Healthcare Company, Inc.",1520697,"=""ACHC""","6100 TOWER CIRCLE","SUITE 1000",FRANKLIN,TN,TENNESSEE,"US Southeast",,,"=""8093""","Specialty Outpatient Facilities, NEC",623220,"Residential Mental Health and Substance Abuse Facilities",34,61,12/31/21,"5,404,008,960",12/31/21,"2,314,394,000","190,635,000","312,795,000","4,768,078,000"
17493,"Sales return and allowances","Allowance for Medicare Part D rebates",476707,12/31/21,02/28/22,2,"Ernst & Young LLP",,,,"San Diego",CA,CALIFORNIA,"US West",10-K,2022-03-01,,"ACADIA PHARMACEUTICALS INC",1070494,"=""ACAD""","12830 EL CAMINO REAL","SUITE 400","SAN DIEGO",CA,CALIFORNIA,"US West",,,"=""2834""","Pharmaceutical Preparations",325412,"Pharmaceutical Preparation Manufacturing",34,23,12/31/21,"3,758,036,224",12/31/21,"484,145,000","-167,870,000","540,894,000","700,122,000"
16772,"Deferred and stock-based compensation","Assessment of the fair value measurement of the cash-settled affiliate awards liability",476226,12/31/21,02/28/22,4,"KPMG LLP",,,,Boston,MA,MASSACHUSETTS,"US New England",10-K,2022-02-28,,"Acadian Asset Management Inc.",1748824,"=""AAMI""","200 STATE STREET","SUITE 601A",BOSTON,MA,MASSACHUSETTS,"US New England",,,"=""6282""","Investment Advice",523930,"Investment Advice",34,26,12/31/21,"1,162,169,856",12/31/21,"499,000,000","828,400,000","-37,900,000","714,800,000"
18441,"Property, plant and equipment","Valuation of Instruments in Inventory and Property and Equipment",479393,12/31/21,03/14/22,2,"Ernst & Young LLP",,,,Phoenix,AZ,ARIZONA,"US Southwest",10-K,2022-03-14,,"Accelerate Diagnostics, Inc",727207,"=""AXDXQ""","3950 S. COUNTRY CLUB ROAD #470","BUILDING 3-307",TUCSON,AZ,ARIZONA,"US Southwest",,,"=""3826""","Laboratory Analytical Instruments",511210,"Software Publishers",34,5,12/31/21,"353,127,840",12/31/21,"11,782,000","-77,702,000",,"83,047,000"
13305,"Revenue from customer contracts","Estimated costs to complete certain technology integration consulting services contracts",465601,08/31/21,10/15/21,4,"KPMG LLP",,,,Chicago,IL,ILLINOIS,"US Midwest",10-K,2021-10-15,,"Accenture plc",1467373,"=""ACN""","1 GRAND CANAL SQUARE","GRAND CANAL HARBOUR",DUBLIN,L2,IRELAND,Foreign,,,"=""7389""","Business Services, NEC",541611,"Administrative Management and General Management Consulting Services",34,337,08/31/21,"212,734,853,120",08/31/21,"50,533,389,000","5,906,809,000","8,403,593,000","43,175,843,000"
13306,"Uncertain tax positions","Unrecognized tax benefits",465601,08/31/21,10/15/21,4,"KPMG LLP",,,,Chicago,IL,ILLINOIS,"US Midwest",10-K,2021-10-15,,"Accenture plc",1467373,"=""ACN""","1 GRAND CANAL SQUARE","GRAND CANAL HARBOUR",DUBLIN,L2,IRELAND,Foreign,,,"=""7389""","Business Services, NEC",541611,"Administrative Management and General Management Consulting Services",34,337,08/31/21,"212,734,853,120",08/31/21,"50,533,389,000","5,906,809,000","8,403,593,000","43,175,843,000"
15834,Inventory,"Write-down of certain finished goods inventory for obsolete and slow-moving items",475113,12/31/21,02/23/22,4,"KPMG LLP",,,,Chicago,IL,ILLINOIS,"US Midwest",10-K,2022-02-23,,"ACCO BRANDS Corp",712034,"=""ACCO""","FOUR CORPORATE DRIVE",,"LAKE ZURICH",IL,ILLINOIS,"US Midwest",,,"=""2780""","Blankbooks, Looseleaf Binders & Bookbindg & Relatd Work",323118,"Blankbook, Looseleaf Binders, and Devices Manufacturing",34,8,12/31/21,"791,456,256",12/31/21,"2,025,300,000","101,900,000","-827,900,000","3,091,300,000"
15835,Goodwill,"Goodwill Impairment Assessment of International Reporting Unit",475113,12/31/21,02/23/22,4,"KPMG LLP",,,,Chicago,IL,ILLINOIS,"US Midwest",10-K,2022-02-23,,"ACCO BRANDS Corp",712034,"=""ACCO""","FOUR CORPORATE DRIVE",,"LAKE ZURICH",IL,ILLINOIS,"US Midwest",,,"=""2780""","Blankbooks, Looseleaf Binders & Bookbindg & Relatd Work",323118,"Blankbook, Looseleaf Binders, and Devices Manufacturing",34,8,12/31/21,"791,456,256",12/31/21,"2,025,300,000","101,900,000","-827,900,000","3,091,300,000"
19828,"Research and development expenses","Accounting for Research and Development Prepayments, Accruals and Related Expenses",482386,12/31/21,03/31/22,2,"Ernst & Young LLP",,,,Philadelphia,PA,PENNSYLVANIA,"US Mid Atlantic",10-K,2022-03-31,,"Aceragen, Inc.",861838,,"505 EAGLEVIEW BOULEVARD","SUITE 212",EXTON,PA,PENNSYLVANIA,"US Mid Atlantic",,,"=""2836""","Biological Products, Except Diagnostic Substances",325414,"Biological Product (except Diagnostic) Manufacturing",34,1,12/31/21,"30,106,260",12/31/21,,"98,091,000",,"34,864,000"
18127,"Going concern",Liquidity,478768,12/31/21,03/10/22,1,"PricewaterhouseCoopers LLP",191,"PricewaterhouseCoopers LLP Chartered Accountants",271,Vancouver,A1,"BRITISH COLUMBIA",Canada,10-K,2022-03-10,,"ACHIEVE LIFE SCIENCES, INC.",949858,"=""ACHV""","22722 29TH DR. SE","SUITE 100",SEATTLE,WA,WASHINGTON,"US West",,,"=""2835""","In Vitro and In Vivo Diagnostic Substances",325412,"Pharmaceutical Preparation Manufacturing",34,8,12/31/21,"73,548,560",12/31/21,,"-33,152,000","25,367,000","47,516,000"
16085,"Revenue from customer contracts","Revenue Recognition - Refer to Note 2 to the financial statements",475541,12/31/21,02/24/22,3,"Deloitte & Touche LLP",,,,Omaha,NE,NEBRASKA,"US Midwest",10-K,2022-02-24,,"ACI WORLDWIDE, INC.",935036,"=""ACIW""","6060 COVENTRY DRIVE",,ELKHORN,NE,NEBRASKA,"US Midwest",,,"=""7372""","Prepackaged Software",511210,"Software Publishers",34,35,12/31/21,"4,015,832,576",12/31/21,"1,370,598,000","127,791,000","-476,235,000","3,158,741,000"
16092,"Business combinations","Fair Value of the Contingent Consideration Liability related to zunsemetinib",475437,12/31/21,02/24/22,1,"PricewaterhouseCoopers LLP",,,,Philadelphia,PA,PENNSYLVANIA,"US Mid Atlantic",10-K,2022-02-24,,"Aclaris Therapeutics, Inc.",1557746,"=""ACRS""","701 LEE ROAD","SUITE 103",WAYNE,PA,PENNSYLVANIA,"US Mid Atlantic",,,"=""2834""","Pharmaceutical Preparations",325412,"Pharmaceutical Preparation Manufacturing",34,15,12/31/21,"890,261,632",12/31/21,"6,761,000","-90,865,000","218,693,000","251,211,000"
18814,"Revenue from customer contracts","Estimate of variable consideration in contracts with customers",479973,12/31/21,03/18/22,2,"Ernst & Young LLP",,,,Stamford,CT,CONNECTICUT,"US New England",10-K,2022-03-18,,"Acorda Therapeutics, Inc.",1008848,,"TWO BLUE HILL PLAZA",,"PEARL RIVER",NY,"NEW YORK","US Mid Atlantic",,,"=""2836""","Biological Products, Except Diagnostic Substances",325414,"Biological Product (except Diagnostic) Manufacturing",34,2,12/29/21,"25,765,156",12/31/21,"129,071,000","-103,954,000","-184,843,000","455,470,000"
18815,"Other contingent liabilities","Fair Value Measurement of the Contingent Consideration",479973,12/31/21,03/18/22,2,"Ernst & Young LLP",,,,Stamford,CT,CONNECTICUT,"US New England",10-K,2022-03-18,,"Acorda Therapeutics, Inc.",1008848,,"TWO BLUE HILL PLAZA",,"PEARL RIVER",NY,"NEW YORK","US Mid Atlantic",,,"=""2836""","Biological Products, Except Diagnostic Substances",325414,"Biological Product (except Diagnostic) Manufacturing",34,2,12/29/21,"25,765,156",12/31/21,"129,071,000","-103,954,000","-184,843,000","455,470,000"
16594,"Revenue from customer contracts","Revenue Recognition – Determination of Estimated Service Period",476111,12/31/21,02/25/22,1,"PricewaterhouseCoopers LLP",,,,"Los Angeles",CA,CALIFORNIA,"US West",10-K,2022-02-25,,"Activision Blizzard, Inc.",718877,,"2701 OLYMPIC BOULEVARD","BUILDING B","SANTA MONICA",CA,CALIFORNIA,"US West",,,"=""7372""","Prepackaged Software",511210,"Software Publishers",34,67,12/31/21,"51,830,407,168",12/31/21,"8,803,000,000","2,699,000,000","7,142,000,000","25,056,000,000"
13395,"Other intangible assets","Valuation of Indefinite-Lived Trade Names",466337,08/31/21,10/27/21,2,"Ernst & Young LLP",,,,Atlanta,GA,GEORGIA,"US Southeast",10-K,2021-10-27,,"ACUITY INC. (DE)",1144215,"=""AYI""","1170 PEACHTREE STREET NE","SUITE 1200",ATLANTA,GA,GEORGIA,"US Southeast",,,"=""3640""","Electric Lighting & Wiring Equipment",335110,"Electric Lamp Bulb and Part Manufacturing",34,185,08/31/21,"6,494,047,232",08/31/21,"3,461,000,000","306,300,000","376,600,000","3,575,100,000"
17499,"Other income taxes","Accounting for Income Taxes",477124,12/31/21,03/01/22,1,"PricewaterhouseCoopers LLP",,,,Boston,MA,MASSACHUSETTS,"US New England",10-K,2022-03-01,,"Acushnet Holdings Corp.",1672013,"=""GOLF""","333 BRIDGE STREET",,FAIRHAVEN,MA,MASSACHUSETTS,"US New England",,,"=""3949""","Sporting and Athletic Goods, NEC",339920,"Sporting and Athletic Goods Manufacturing",34,53,12/31/21,"3,850,448,384",12/31/21,"2,147,930,000","178,873,000","370,371,000","2,005,836,000"
18049,"Other contingent liabilities","Measurement of accrued liabilities for automobile and workers’ compensation claims",478695,12/31/21,03/09/22,4,"KPMG LLP",,,,Houston,TX,TEXAS,"US Southwest",10-K,2022-03-09,,"ADAMS RESOURCES & ENERGY, INC.",2178,,"2727 ALLEN PARKWAY","9TH FLOOR",HOUSTON,TX,TEXAS,"US Southwest",,,"=""5172""","Petroleum and Petroleum Products Wholesalers, Except Bulk Stations and Terminals",424720,"Petroleum and Petroleum Products Merchant Wholesalers (except Bulk Stations and Terminals)",34,28,12/31/21,"121,112,576",12/31/21,"2,025,204,000","11,888,000","157,069,000","374,703,000"
17563,"Other revenue","Implicit Price Concession",477067,12/31/21,03/01/22,4,"KPMG LLP",,,,Philadelphia,PA,PENNSYLVANIA,"US Mid Atlantic",10-K,2022-03-01,,"AdaptHealth Corp.",1725255,"=""AHCO""","555 EAST NORTH LANE","SUITE 5075",CONSHOHOCKEN,PA,PENNSYLVANIA,"US Mid Atlantic",,,"=""8082""","Home Health Care Services",423450,"Medical, Dental, and Hospital Equipment and Supplies Merchant Wholesalers",34,24,12/31/21,"3,273,817,600",12/31/21,"2,465,130,000","156,175,000","-1,652,892,000","5,250,484,000"
17564,"Business combinations","Evaluation of fair value of tradenames intangible assets acquired",477067,12/31/21,03/01/22,4,"KPMG LLP",,,,Philadelphia,PA,PENNSYLVANIA,"US Mid Atlantic",10-K,2022-03-01,,"AdaptHealth Corp.",1725255,"=""AHCO""","555 EAST NORTH LANE","SUITE 5075",CONSHOHOCKEN,PA,PENNSYLVANIA,"US Mid Atlantic",,,"=""8082""","Home Health Care Services",423450,"Medical, Dental, and Hospital Equipment and Supplies Merchant Wholesalers",34,24,12/31/21,"3,273,817,600",12/31/21,"2,465,130,000","156,175,000","-1,652,892,000","5,250,484,000"
18393,"Revenue from customer contracts","Evaluation of estimation of costs to complete for Astellas collaboration agreement",479311,12/31/21,03/14/22,4,"KPMG LLP",87,"KPMG LLP",1118,Reading,X0,"UNITED KINGDOM",Foreign,10-K,2022-03-14,,"Adaptimmune Therapeutics PLC",1621227,"=""ADAPY""","60 JUBILEE AVENUE","MILTON PARK","ABINGDON, OXFORDSHIRE",X0,"UNITED KINGDOM",Foreign,,,"=""2836""","Biological Products, Except Diagnostic Substances",325412,"Pharmaceutical Preparation Manufacturing",34,4,12/31/21,"585,967,488",12/31/21,"6,149,000","-158,090,000","204,960,000","469,545,000"
14895,"Research and development expenses","Genentech Agreement",473793,12/31/21,02/15/22,2,"Ernst & Young LLP",,,,Seattle,WA,WASHINGTON,"US West",10-K,2022-02-15,,"Adaptive Biotechnologies Corp",1478320,"=""ADPT""","1165 EASTLAKE AVE E",,SEATTLE,WA,WASHINGTON,"US West",,,"=""2836""","Biological Products, Except Diagnostic Substances",325414,"Biological Product (except Diagnostic) Manufacturing",34,28,12/31/21,"3,967,511,808",12/31/21,"154,344,000","-207,279,000","476,494,000","923,344,000"
18745,"Other debt","Royalty purchase agreement with HealthCare Royalty Partners – Deferred royalty obligation accretion of the liability",479850,12/31/21,03/17/22,1,"PricewaterhouseCoopers LLP",286,"PricewaterhouseCoopers SA",1358,Lausanne,V8,SWITZERLAND,Foreign,20-F,2022-03-17,,"ADC Therapeutics SA",1771910,"=""ADCT""",BIOPOLE,"ROUTE DE LA CORNICHE 3B",EPALINGES,V8,SWITZERLAND,Foreign,,,"=""2834""","Pharmaceutical Preparations",325412,"Pharmaceutical Preparation Manufacturing",34,20,12/29/21,"1,568,955,520",12/31/21,"33,917,000","-230,026,000","152,506,000","617,972,000"
18746,"Sales return and allowances","Revenue – Gross-to-net sales adjustments (GTN)",479850,12/31/21,03/17/22,1,"PricewaterhouseCoopers LLP",286,"PricewaterhouseCoopers SA",1358,Lausanne,V8,SWITZERLAND,Foreign,20-F,2022-03-17,,"ADC Therapeutics SA",1771910,"=""ADCT""",BIOPOLE,"ROUTE DE LA CORNICHE 3B",EPALINGES,V8,SWITZERLAND,Foreign,,,"=""2834""","Pharmaceutical Preparations",325412,"Pharmaceutical Preparation Manufacturing",34,20,12/29/21,"1,568,955,520",12/31/21,"33,917,000","-230,026,000","152,506,000","617,972,000"
18747,"Other debt","Convertible loans – Valuation of the embedded derivatives",479850,12/31/21,03/17/22,1,"PricewaterhouseCoopers LLP",286,"PricewaterhouseCoopers SA",1358,Lausanne,V8,SWITZERLAND,Foreign,20-F,2022-03-17,,"ADC Therapeutics SA",1771910,"=""ADCT""",BIOPOLE,"ROUTE DE LA CORNICHE 3B",EPALINGES,V8,SWITZERLAND,Foreign,,,"=""2834""","Pharmaceutical Preparations",325412,"Pharmaceutical Preparation Manufacturing",34,20,12/29/21,"1,568,955,520",12/31/21,"33,917,000","-230,026,000","152,506,000","617,972,000"
16531,"Accounts/loans receivable","Valuation of Accounts Receivable, Net of Allowances for Implicit Price Concessions",476071,12/31/21,02/25/22,1,"PricewaterhouseCoopers LLP",,,,Dallas,TX,TEXAS,"US Southwest",10-K,2022-02-25,,"Addus HomeCare Corp",1468328,"=""ADUS""","6303 COWBOYS WAY","SUITE 600",FRISCO,TX,TEXAS,"US Southwest",,,"=""8082""","Home Health Care Services",621610,"Home Health Care Services",34,94,12/31/21,"1,490,549,376",12/31/21,"864,499,000","45,126,000","5,631,000","947,585,000"
16532,Goodwill,"Goodwill Impairment Assessment – Hospice Reporting Unit",476071,12/31/21,02/25/22,1,"PricewaterhouseCoopers LLP",,,,Dallas,TX,TEXAS,"US Southwest",10-K,2022-02-25,,"Addus HomeCare Corp",1468328,"=""ADUS""","6303 COWBOYS WAY","SUITE 600",FRISCO,TX,TEXAS,"US Southwest",,,"=""8082""","Home Health Care Services",621610,"Home Health Care Services",34,94,12/31/21,"1,490,549,376",12/31/21,"864,499,000","45,126,000","5,631,000","947,585,000"
18523,"Other assets","Valuation of Level 3 Biological Assets",479507,12/31/21,03/11/22,1,"PricewaterhouseCoopers LLP",88,"Price Waterhouse & Co SRL",1349,"Buenos Aires",C1,ARGENTINA,Foreign,6-K,2022-03-14,,"Adecoagro S.A.",1499505,"=""AGRO""","28, BOULEVARD F.W. RAIFFEEISEN",,N/A,N4,LUXEMBOURG,Foreign,,,"=""0100""","Agricultural production- crops",111150,"Corn Farming",34,8,12/31/21,"853,224,640",12/31/21,"1,124,352,000","130,717,000","980,382,000","2,582,401,000"
18524,"Long-lived assets","Property, Plant and Equipment and Goodwill Impairment Assessment- Cash Generating Units with Allocated Goodwill in Brazil",479507,12/31/21,03/11/22,1,"PricewaterhouseCoopers LLP",88,"Price Waterhouse & Co SRL",1349,"Buenos Aires",C1,ARGENTINA,Foreign,6-K,2022-03-14,,"Adecoagro S.A.",1499505,"=""AGRO""","28, BOULEVARD F.W. RAIFFEEISEN",,N/A,N4,LUXEMBOURG,Foreign,,,"=""0100""","Agricultural production- crops",111150,"Corn Farming",34,8,12/31/21,"853,224,640",12/31/21,"1,124,352,000","130,717,000","980,382,000","2,582,401,000"
20704,"Other assets","Valuation of Level 3 Biological Assets
",485477,12/31/21,04/28/22,1,"PricewaterhouseCoopers LLP",88,"Price Waterhouse & Co SRL",1349,"Buenos Aires",C1,ARGENTINA,Foreign,20-F,2022-04-28,,"Adecoagro S.A.",1499505,"=""AGRO""","28, BOULEVARD F.W. RAIFFEEISEN",,N/A,N4,LUXEMBOURG,Foreign,,,"=""0100""","Agricultural production- crops",111150,"Corn Farming",34,8,12/31/21,"853,224,640",12/31/21,"1,124,352,000","130,717,000","980,382,000","2,582,401,000"
20705,"Long-lived assets","Property, Plant and Equipment and Goodwill Impairment Assessment- Cash Generating Units with Allocated Goodwill in Brazil",485477,12/31/21,04/28/22,1,"PricewaterhouseCoopers LLP",88,"Price Waterhouse & Co SRL",1349,"Buenos Aires",C1,ARGENTINA,Foreign,20-F,2022-04-28,,"Adecoagro S.A.",1499505,"=""AGRO""","28, BOULEVARD F.W. RAIFFEEISEN",,N/A,N4,LUXEMBOURG,Foreign,,,"=""0100""","Agricultural production- crops",111150,"Corn Farming",34,8,12/31/21,"853,224,640",12/31/21,"1,124,352,000","130,717,000","980,382,000","2,582,401,000"
16061,"Revenue from customer contracts","Revenue Recognition – Allocation of Transaction Price in Fixed-Fee Media IP Licensing Arrangements",475507,12/31/21,02/24/22,1,"PricewaterhouseCoopers LLP",,,,"San Jose",CA,CALIFORNIA,"US West",10-K,2022-02-24,,"Adeia Inc.",1803696,"=""ADEA""","3025 ORCHARD PARKWAY",,"SAN JOSE",CA,CALIFORNIA,"US West",,,"=""4841""","Cable and Other Pay Television Services",334413,"Semiconductor and Related Device Manufacturing",34,19,12/31/21,"1,952,646,656",12/31/21,"391,212,000","-55,457,000","-319,371,000","2,470,022,000"
16062,Goodwill,"Goodwill Impairment Assessment - Product Reporting Unit",475507,12/31/21,02/24/22,1,"PricewaterhouseCoopers LLP",,,,"San Jose",CA,CALIFORNIA,"US West",10-K,2022-02-24,,"Adeia Inc.",1803696,"=""ADEA""","3025 ORCHARD PARKWAY",,"SAN JOSE",CA,CALIFORNIA,"US West",,,"=""4841""","Cable and Other Pay Television Services",334413,"Semiconductor and Related Device Manufacturing",34,19,12/31/21,"1,952,646,656",12/31/21,"391,212,000","-55,457,000","-319,371,000","2,470,022,000"
13685,Goodwill,"Annual Goodwill Impairment Assessment",467983,09/30/21,11/23/21,1,"PricewaterhouseCoopers LLP",,,,Detroit,MI,MICHIGAN,"US Midwest",10-K,2021-11-23,,"Adient plc",1670541,"=""ADNT""","25 NORTH WALL QUAY","DUBLIN 1",DUBLIN,L2,IRELAND,Foreign,,,"=""3714""","Motor Vehicle Parts and Accessories",336399,"All Other Motor Vehicle Parts Manufacturing",34,43,09/28/21,"4,005,196,544",09/30/21,"13,680,000,000","1,108,000,000","-151,000,000","10,778,000,000"
14105,"Revenue from customer contracts","Performance obligations in cloud-enabled software subscriptions",471763,12/03/21,01/21/22,4,"KPMG LLP",,,,"Santa Clara",CA,CALIFORNIA,"US West",10-K,2022-01-21,,"ADOBE INC.",796343,"=""ADBE""","345 PARK AVE",,"SAN JOSE",CA,CALIFORNIA,"US West",,,"=""7372""","Prepackaged Software",511210,"Software Publishers",34,657,12/01/21,"312,795,693,056",12/03/21,"15,785,000,000","4,822,000,000","309,000,000","27,241,000,000"
17251,Goodwill,"Goodwill Impairment Assessment -- Commercial Reporting Unit",476977,12/31/21,03/01/22,1,"PricewaterhouseCoopers LLP",,,,"Hallandale Beach",FL,FLORIDA,"US Southeast",10-K,2022-03-01,,"ADT Inc.",1703056,"=""ADT""","1501 YAMATO ROAD",,"BOCA RATON",FL,FLORIDA,"US Southeast",,,"=""7381""","Detective, Guard, and Armored Car Services",561621,"Security Systems Services (except Locksmiths)",34,8,12/31/21,"7,121,805,312",12/31/21,"5,307,111,000","-340,820,000","-8,108,035,000","16,894,351,000"
12664,"Deferred income taxes","Accounting for Income Taxes",462230,06/30/21,08/19/21,1,"PricewaterhouseCoopers LLP",,,,Chicago,IL,ILLINOIS,"US Midwest",10-K,2021-08-19,,"Adtalem Global Education Inc.",730464,"=""ATGE""","233 S. WACKER DRIVE","SUITE 800",CHICAGO,IL,ILLINOIS,"US Midwest",,,"=""8200""","Services-Educational Services",611519,"Other Technical and Trade Schools",34,36,06/30/21,"1,755,376,896",06/30/21,"1,112,380,000","76,909,000","340,237,000","3,053,836,000"
16242,Inventory,"Excess and Obsolete Inventory Reserve",475608,12/31/21,02/25/22,1,"PricewaterhouseCoopers LLP",,,,Birmingham,AL,ALABAMA,"US Southeast",10-K,2022-02-25,,"ADTRAN Holdings, Inc.",926282,"=""ADTN""","901 EXPLORER BLVD",,HUNTSVILLE,AL,ALABAMA,"US Southeast",,,"=""3661""","Telephone and Telegraph Apparatus",334210,"Telephone Apparatus Manufacturing",34,23,12/31/21,"1,120,108,288",12/31/21,"563,004,000","-8,635,000","330,841,000","569,017,000"
14879,"Vendor/supplier rebates","Vendor Incentives - Refer to Note 2 to the Consolidated Financial Statements",473777,01/01/22,02/15/22,3,"Deloitte & Touche LLP",,,,Charlotte,NC,"NORTH CAROLINA","US Southeast",10-K,2022-02-15,,"ADVANCE AUTO PARTS INC",1158449,"=""AAP""","4200 SIX FORKS ROAD",,RALEIGH,NC,"NORTH CAROLINA","US Southeast",,,"=""5531""","Auto and Home Supply Stores",441310,"Automotive Parts and Accessories Stores",34,237,01/03/22,"14,764,459,008",01/01/22,"10,997,989,000","596,615,000","1,483,330,000","12,194,209,000"
11876,Goodwill,"Goodwill, Infiltrator Water Technologies Reporting Unit —Refer to Note 8 to the financial statements",457149,03/31/21,05/27/21,3,"Deloitte & Touche LLP",,,,Columbus,OH,OHIO,"US Midwest",10-K,2021-05-27,,"ADVANCED DRAINAGE SYSTEMS, INC.",1604028,"=""WMS""","4024 GREEN STRIPE LANE",,HILLIARD,OH,OHIO,"US Midwest",,,"=""3086""","Plastics Foam Products",326122,"Plastics Pipe and Pipe Fitting Manufacturing",34,103,03/31/21,"7,399,622,144",03/31/21,"1,982,780,000","224,230,000","-31,393,000","2,413,832,000"
18570,"Other income taxes","Accounting for income taxes",479578,12/31/21,03/16/22,2,"Ernst & Young LLP",,,,Denver,CO,COLORADO,"US West",10-K,2022-03-16,,"ADVANCED ENERGY INDUSTRIES INC",927003,"=""AEIS""","ATTN:  PAUL OLDHAM","1595 WYNKOOP ST, SUITE 800",DENVER,CO,COLORADO,"US West",,,"=""3679""","Electronic Components, NEC",335999,"All Other Miscellaneous Electrical Equipment and Component Manufacturing",34,91,12/31/21,"3,422,854,400",12/31/21,"1,455,954,000","134,736,000","499,255,000","1,817,340,000"
14447,Inventory,"Inventory Valuation",472982,12/25/21,02/03/22,2,"Ernst & Young LLP",,,,"San Jose",CA,CALIFORNIA,"US West",10-K,2022-02-03,,"ADVANCED MICRO DEVICES INC",2488,"=""AMD""","2485 AUGUSTINE DRIVE",,"SANTA CLARA",CA,CALIFORNIA,"US West",,,"=""3674""","Semiconductors and Related Devices",334413,"Semiconductor and Related Device Manufacturing",34,144,12/31/21,"173,687,291,904",12/25/21,"16,434,000,000","3,162,000,000","7,208,000,000","12,419,000,000"
15274,"Revenue from customer contracts","Revenue Recognition - Transfer of Control",474346,12/31/21,02/18/22,1,"PricewaterhouseCoopers LLP",,,,"Florham Park",NJ,"NEW JERSEY","US Mid Atlantic",10-K,2022-02-18,,"AdvanSix Inc.",1673985,"=""ASIX""","300 KIMBALL DRIVE","SUITE 101",PARSIPPANY,NJ,"NEW JERSEY","US Mid Atlantic",,,"=""2821""","Plastics Material and Synthetic Resins, and Nonvulcanizable Elastomers",325211,"Plastics Material and Resin Manufacturing",34,47,12/31/21,"1,329,612,800",12/31/21,"1,684,625,000","139,791,000","583,598,000","1,311,999,000"
17561,Goodwill,"Goodwill Impairment Assessments",477069,12/31/21,03/01/22,1,"PricewaterhouseCoopers LLP",,,,Irvine,CA,CALIFORNIA,"US West",10-K,2022-03-01,,"Advantage Solutions Inc.",1776661,"=""ADV""","C/O ADVANTAGE SOLUTIONS, INC.","7676 FORSYTH BOULEVARD, 5TH FLOOR","ST. LOUIS",MO,MISSOURI,"US Southeast",,,"=""7389""","Business Services, NEC",541611,"Administrative Management and General Management Consulting Services",34,8,12/31/21,"2,542,047,744",12/31/21,"3,602,298,000","54,494,000","-2,008,308,000","5,854,268,000"
17562,"Other intangible assets","Indefinite-Lived Intangible Assets Impairment Assessments",477069,12/31/21,03/01/22,1,"PricewaterhouseCoopers LLP",,,,Irvine,CA,CALIFORNIA,"US West",10-K,2022-03-01,,"Advantage Solutions Inc.",1776661,"=""ADV""","C/O ADVANTAGE SOLUTIONS, INC.","7676 FORSYTH BOULEVARD, 5TH FLOOR","ST. LOUIS",MO,MISSOURI,"US Southeast",,,"=""7389""","Business Services, NEC",541611,"Administrative Management and General Management Consulting Services",34,8,12/31/21,"2,542,047,744",12/31/21,"3,602,298,000","54,494,000","-2,008,308,000","5,854,268,000"
19376,"Research and development expenses","Accrued research and development expenses – clinical and manufacturing costs",481276,12/31/21,03/29/22,2,"Ernst & Young LLP",,,,"San Jose",CA,CALIFORNIA,"US West",10-K,2022-03-29,,"Adverum Biotechnologies, Inc.",1501756,"=""ADVM""","100 CARDINAL WAY",,"REDWOOD CITY",CA,CALIFORNIA,"US West",,,"=""2836""","Biological Products, Except Diagnostic Substances",325414,"Biological Product (except Diagnostic) Manufacturing",34,2,12/31/21,"173,150,560",12/31/21,"7,500,000","-145,540,000",,"439,727,000"
13594,"Revenue from customer contracts","Revenue Recognition - Contract cost and claim recovery estimates",467675,09/30/21,11/17/21,2,"Ernst & Young LLP",,,,"Los Angeles",CA,CALIFORNIA,"US West",10-K,2021-11-17,,AECOM,868857,"=""ACM""","13355 NOEL ROAD","SUITE 400",DALLAS,TX,TEXAS,"US Southwest",,,"=""8711""","Engineering Services",541611,"Administrative Management and General Management Consulting Services",34,63,09/30/21,"9,041,111,040",09/30/21,"13,340,852,000","173,185,000","-844,896,000","11,733,954,000"
13595,Goodwill,"Valuation of goodwill",467675,09/30/21,11/17/21,2,"Ernst & Young LLP",,,,"Los Angeles",CA,CALIFORNIA,"US West",10-K,2021-11-17,,AECOM,868857,"=""ACM""","13355 NOEL ROAD","SUITE 400",DALLAS,TX,TEXAS,"US Southwest",,,"=""8711""","Engineering Services",541611,"Administrative Management and General Management Consulting Services",34,63,09/30/21,"9,041,111,040",09/30/21,"13,340,852,000","173,185,000","-844,896,000","11,733,954,000"
18908,"Insurance contract liabilities","Valuation of certain assets and liabilities arising from insurance contracts
",480193,12/31/21,03/21/22,1,"PricewaterhouseCoopers LLP",108,"PricewaterhouseCoopers Accountants NV",1395,Amsterdam,P7,NETHERLANDS,Foreign,20-F,2022-03-21,,"AEGON LTD.",769218,"=""AEG""","WORLD TRADE CENTER SCHIPHOL","SCHIPHOL BOULEVARD 223",SCHIPHOL,P7,NETHERLANDS,Foreign,,,"=""6311""","Life Insurance",524113,"Direct Life Insurance Carriers",34,5,12/29/21,"10,448,609,280",12/31/21,"61,233,000,000","2,307,000,000","28,249,000,000","532,498,000,000"
18909,"Other investments","Valuation of certain Level 3 investments",480193,12/31/21,03/21/22,1,"PricewaterhouseCoopers LLP",108,"PricewaterhouseCoopers Accountants NV",1395,Amsterdam,P7,NETHERLANDS,Foreign,20-F,2022-03-21,,"AEGON LTD.",769218,"=""AEG""","WORLD TRADE CENTER SCHIPHOL","SCHIPHOL BOULEVARD 223",SCHIPHOL,P7,NETHERLANDS,Foreign,,,"=""6311""","Life Insurance",524113,"Direct Life Insurance Carriers",34,5,12/29/21,"10,448,609,280",12/31/21,"61,233,000,000","2,307,000,000","28,249,000,000","532,498,000,000"
15950,"Regulatory assets and liabilities","Accounting for the Effects of Cost-Based Regulation",475009,12/31/21,02/24/22,1,"PricewaterhouseCoopers LLP",,,,Columbus,OH,OHIO,"US Midwest",10-K,2022-02-24,,"AEP Texas Inc.",1721781,,"1 RIVERSIDE PLAZA",,COLUMBUS,OH,OHIO,"US Midwest",4904,"AMERICAN ELECTRIC POWER CO INC","=""4911""","Electric Services",221122,"Electric Power Distribution",34,,,,12/31/21,"1,593,800,000","289,800,000",,"11,836,700,000"
15953,"Regulatory assets and liabilities","Accounting for the Effects of Cost-Based Regulation",475011,12/31/21,02/24/22,1,"PricewaterhouseCoopers LLP",,,,Columbus,OH,OHIO,"US Midwest",10-K,2022-02-24,,"AEP Transmission Company, LLC",1702494,,"1 RIVERSIDE PLAZA",,COLUMBUS,OH,OHIO,"US Midwest",4904,"AMERICAN ELECTRIC POWER CO INC","=""4911""","Electric Services",221121,"Electric Bulk Power Transmission and Control",34,,,,12/31/21,"1,469,300,000","591,700,000",,"12,524,400,000"
19412,"Business combinations","Evaluation of the fair value of acquired flight equipment held for operating leases and maintenance rights assets",481402,12/31/21,03/30/22,4,"KPMG LLP",71,KPMG,1116,Dublin,L2,IRELAND,Foreign,20-F,2022-03-30,,"AerCap Holdings N.V.",1378789,"=""AER""","AERCAP HOUSE","65 ST. STEPHEN'S GREEN",DUBLIN,L2,IRELAND,Foreign,,,"=""7359""","Equipment Rental and Leasing, NEC",532411,"Commercial Air, Rail, and Water Transportation Equipment Rental and Leasing",34,65,12/29/21,"8,496,768,512",12/31/21,"4,412,003,000","1,000,507,000","16,361,864,000","74,569,768,000"
19413,Leases,"Assessment of impairment of flight equipment held for operating leases subject to impairment",481402,12/31/21,03/30/22,4,"KPMG LLP",71,KPMG,1116,Dublin,L2,IRELAND,Foreign,20-F,2022-03-30,,"AerCap Holdings N.V.",1378789,"=""AER""","AERCAP HOUSE","65 ST. STEPHEN'S GREEN",DUBLIN,L2,IRELAND,Foreign,,,"=""7359""","Equipment Rental and Leasing, NEC",532411,"Commercial Air, Rail, and Water Transportation Equipment Rental and Leasing",34,65,12/29/21,"8,496,768,512",12/31/21,"4,412,003,000","1,000,507,000","16,361,864,000","74,569,768,000"
16737,"Sales return and allowances","Provisions for Revenue Reserves – Commercial and Medicare Part D Rebates
",475448,12/31/21,02/24/22,1,"PricewaterhouseCoopers LLP",,,,"Florham Park",NJ,"NEW JERSEY","US Mid Atlantic",10-K,2022-02-25,,"AERIE PHARMACEUTICALS INC",1337553,,"4301 EMPEROR BOULEVARD","SUITE 400",DURHAM,NC,"NORTH CAROLINA","US Southeast",,,"=""2836""","Biological Products, Except Diagnostic Substances",325414,"Biological Product (except Diagnostic) Manufacturing",34,7,12/31/21,"340,080,192",12/31/21,"194,134,000","-74,810,000",,"431,391,000"
15211,"Revenue from customer contracts","Revenue recognition - estimated total cost at completion on fixed-price contracts",474101,12/31/21,02/18/22,1,"PricewaterhouseCoopers LLP",,,,Sacramento,CA,CALIFORNIA,"US West",10-K,2022-02-18,,"AEROJET ROCKETDYNE HOLDINGS, INC.",40888,,"222 N. PACIFIC COAST HIGHWAY","SUITE 500","EL SEGUNDO",CA,CALIFORNIA,"US West",,,"=""3760""","Guided Missiles & Space Vehicles & Parts",326291,"Rubber Product Manufacturing for Mechanical Use",34,47,12/31/21,"3,745,476,096",12/31/21,"2,188,000,000","146,600,000","327,000,000","2,423,400,000"
12251,"Revenue from customer contracts","Revenue Recognition - Refer to Note 1 to the financial statements",459334,04/30/21,06/29/21,3,"Deloitte & Touche LLP",,,,"Los Angeles",CA,CALIFORNIA,"US West",10-K,2021-06-29,,"AeroVironment Inc",1368622,"=""AVAV""","241 18TH STREET SOUTH, SUITE 650",,ARLINGTON,VA,VIRGINIA,"US Mid Atlantic",,,"=""3721""",Aircraft,336411,"Aircraft Manufacturing",34,110,04/30/21,"2,734,670,080",04/30/21,"394,912,000","23,331,000","191,620,000","928,566,000"
12252,"Business combinations","Business Acquisitions – Refer to Note 21 to the financial statements",459334,04/30/21,06/29/21,3,"Deloitte & Touche LLP",,,,"Los Angeles",CA,CALIFORNIA,"US West",10-K,2021-06-29,,"AeroVironment Inc",1368622,"=""AVAV""","241 18TH STREET SOUTH, SUITE 650",,ARLINGTON,VA,VIRGINIA,"US Mid Atlantic",,,"=""3721""",Aircraft,336411,"Aircraft Manufacturing",34,110,04/30/21,"2,734,670,080",04/30/21,"394,912,000","23,331,000","191,620,000","928,566,000"
16799,Goodwill,"Goodwill Impairment Evaluation of the AES Andes Reporting Unit
",476139,12/31/21,02/28/22,2,"Ernst & Young LLP",,,,Tysons,VA,VIRGINIA,"US Mid Atlantic",10-K,2022-02-28,,"AES CORP",874761,"=""AES""","4300 WILSON BOULEVARD",,ARLINGTON,VA,VIRGINIA,"US Mid Atlantic",,,"=""4991""","Cogeneration Services & Small Power Producers",221122,"Electric Power Distribution",34,24,12/31/21,"16,203,084,800",12/31/21,"11,141,000,000","-409,000,000","1,428,000,000","32,963,000,000"
16800,"Property, plant and equipment","Identification and Valuation of Long-Lived Asset Impairments and Re-evaluation of Useful Lives",476139,12/31/21,02/28/22,2,"Ernst & Young LLP",,,,Tysons,VA,VIRGINIA,"US Mid Atlantic",10-K,2022-02-28,,"AES CORP",874761,"=""AES""","4300 WILSON BOULEVARD",,ARLINGTON,VA,VIRGINIA,"US Mid Atlantic",,,"=""4991""","Cogeneration Services & Small Power Producers",221122,"Electric Power Distribution",34,24,12/31/21,"16,203,084,800",12/31/21,"11,141,000,000","-409,000,000","1,428,000,000","32,963,000,000"
16801,"Business combinations","Accounting for the Merger of sPower and Distributed Energy Development Platforms
",476139,12/31/21,02/28/22,2,"Ernst & Young LLP",,,,Tysons,VA,VIRGINIA,"US Mid Atlantic",10-K,2022-02-28,,"AES CORP",874761,"=""AES""","4300 WILSON BOULEVARD",,ARLINGTON,VA,VIRGINIA,"US Mid Atlantic",,,"=""4991""","Cogeneration Services & Small Power Producers",221122,"Electric Power Distribution",34,24,12/31/21,"16,203,084,800",12/31/21,"11,141,000,000","-409,000,000","1,428,000,000","32,963,000,000"
17528,"Revenue from customer contracts","Revenue — Refer to Notes 1 and 3 to the financial statements",476639,12/31/21,02/28/22,3,"Deloitte & Touche LLP",,,,"San Jose",CA,CALIFORNIA,"US West",10-K,2022-03-01,,"Aeva Technologies, Inc.",1789029,"=""AEVA""","555 ELLIS STREET",,"MOUNTAIN VIEW",CA,CALIFORNIA,"US West",,,"=""3714""","Motor Vehicle Parts and Accessories",334413,"Semiconductor and Related Device Manufacturing",34,8,12/31/21,"1,625,377,280",12/31/21,"9,265,000","-101,878,000","451,951,000","479,188,000"
15298,"Business combinations","Acquisition of Parnassus - Acquired Client Relationships",474306,12/31/21,02/18/22,1,"PricewaterhouseCoopers LLP",,,,Boston,MA,MASSACHUSETTS,"US New England",10-K,2022-02-18,,"AFFILIATED MANAGERS GROUP, INC.",1004434,"=""AMG""","777 SOUTH FLAGLER DRIVE","SUITE 1401 EAST TOWER","WEST PALM BEACH",FL,FLORIDA,"US Southeast",,,"=""6282""","Investment Advice",523930,"Investment Advice",34,165,12/31/21,"6,613,301,760",12/31/21,"2,301,000,000","565,700,000","-1,195,300,000","8,876,400,000"
15299,"Equity investments and joint ventures","Impairment Evaluation for Equity Method Investments in Affiliates",474306,12/31/21,02/18/22,1,"PricewaterhouseCoopers LLP",,,,Boston,MA,MASSACHUSETTS,"US New England",10-K,2022-02-18,,"AFFILIATED MANAGERS GROUP, INC.",1004434,"=""AMG""","777 SOUTH FLAGLER DRIVE","SUITE 1401 EAST TOWER","WEST PALM BEACH",FL,FLORIDA,"US Southeast",,,"=""6282""","Investment Advice",523930,"Investment Advice",34,165,12/31/21,"6,613,301,760",12/31/21,"2,301,000,000","565,700,000","-1,195,300,000","8,876,400,000"
19552,"Revenue from customer contracts","Revenue recognition from collaboration agreements",481742,12/31/21,03/31/22,4,"KPMG LLP",254,"KPMG AG Wirtschaftsprüfungsgesellschaft",1021,Mannheim,2M,GERMANY,Foreign,20-F,2022-03-31,,"Affimed N.V.",1608390,"=""AFMDQ""","GOTTLIEB-DAIMLER-STRASSE 2",,MANNHEIM,2M,GERMANY,Foreign,,,"=""2834""","Pharmaceutical Preparations",325414,"Biological Product (except Diagnostic) Manufacturing",34,6,12/29/21,"541,563,200",12/31/21,"45,904,000","-65,415,000","152,777,000","256,024,000"
12996,"Allowance for credit losses","Allowance for Credit Losses — Refer to Notes 2 and 4 to the financial statements",463853,06/30/21,09/17/21,3,"Deloitte & Touche LLP",,,,"San Francisco",CA,CALIFORNIA,"US West",10-K,2021-09-17,,"Affirm Holdings, Inc.",1820953,"=""AFRM""","650 CALIFORNIA STREET",,"SAN FRANCISCO",CA,CALIFORNIA,"US West",,,"=""6141""","Personal Credit Institutions",522320,"Financial Transactions Processing, Reserve, and Clearinghouse Activities",34,67,06/30/21,"12,199,222,272",06/30/21,"870,464,000","-430,923,000","1,996,708,000","4,866,967,000"
15823,"Long-term investments","Assessment of the fair value of certain privately issued securities",474941,12/31/21,02/23/22,4,"KPMG LLP",,,,Atlanta,GA,GEORGIA,"US Southeast",10-K,2022-02-23,,"AFLAC INC",4977,"=""AFL""","1932 WYNNTON RD",,COLUMBUS,GA,GEORGIA,"US Southeast",,,"=""6321""","Accident and Health Insurance",524114,"Direct Health and Medical Insurance Carriers",34,58,12/31/21,"38,077,988,864",12/31/21,"21,554,000,000","4,231,000,000",,"157,542,000,000"
15824,"Insurance contract liabilities","Assessment of the estimate of unpaid policy claims",474941,12/31/21,02/23/22,4,"KPMG LLP",,,,Atlanta,GA,GEORGIA,"US Southeast",10-K,2022-02-23,,"AFLAC INC",4977,"=""AFL""","1932 WYNNTON RD",,COLUMBUS,GA,GEORGIA,"US Southeast",,,"=""6321""","Accident and Health Insurance",524114,"Direct Health and Medical Insurance Carriers",34,58,12/31/21,"38,077,988,864",12/31/21,"21,554,000,000","4,231,000,000",,"157,542,000,000"
15825,"Policy changes","Assessment of the disclosure of the expected transition date impact on accumulated other comprehensive income from the adoption of ASU 2018-12",474941,12/31/21,02/23/22,4,"KPMG LLP",,,,Atlanta,GA,GEORGIA,"US Southeast",10-K,2022-02-23,,"AFLAC INC",4977,"=""AFL""","1932 WYNNTON RD",,COLUMBUS,GA,GEORGIA,"US Southeast",,,"=""6321""","Accident and Health Insurance",524114,"Direct Health and Medical Insurance Carriers",34,58,12/31/21,"38,077,988,864",12/31/21,"21,554,000,000","4,231,000,000",,"157,542,000,000"
19578,"Business combinations","Accounting for Business combinations",481893,12/31/21,03/31/22,2,"Ernst & Young LLP",34,"Ernst & Young Auditores Independentes SS",1448,"Belo Horizonte",D5,BRAZIL,Foreign,6-K,2022-03-31,,"Afya Ltd",1771007,"=""AFYA""","ALAMEDA OSCAR NIEMEYER, NO. 119","15TH FLOOR, VILA DA SERRA","NOVA LIMA, MINAS GERAIS",D5,BRAZIL,Foreign,,,"=""8200""","Services-Educational Services",611710,"Educational Support Services",34,16,12/31/21,"726,825,344",12/31/21,"308,684,000","43,498,000","-171,038,000","1,157,524,000"
20804,"Business combinations","Accounting for Business combinations",485864,12/31/21,03/31/22,2,"Ernst & Young LLP",34,"Ernst & Young Auditores Independentes SS",1448,"Belo Horizonte",D5,BRAZIL,Foreign,20-F,2022-04-29,,"Afya Ltd",1771007,"=""AFYA""","ALAMEDA OSCAR NIEMEYER, NO. 119","15TH FLOOR, VILA DA SERRA","NOVA LIMA, MINAS GERAIS",D5,BRAZIL,Foreign,,,"=""8200""","Services-Educational Services",611710,"Educational Support Services",34,16,12/31/21,"726,825,344",12/31/21,"308,684,000","43,498,000","-171,038,000","1,157,524,000"
16357,"Other investments","Fair Value of Investments in Certain Residential Mortgage Loans
",475868,12/31/21,02/25/22,1,"PricewaterhouseCoopers LLP",,,,"New York",NY,"NEW YORK","US Mid Atlantic",10-K,2022-02-25,,"AG Mortgage Investment Trust, Inc.",1514281,"=""MITN""","245 PARK AVENUE","26TH FLOOR","NEW YORK",NY,"NEW YORK","US Mid Atlantic",,,"=""6798""","Real Estate Investment Trusts",525990,"Other Financial Vehicles",34,10,12/31/21,"245,056,992",12/31/21,"99,796,000","104,186,000",,"3,362,728,000"
16462,"Sales return and allowances","Assessment of the reserve and allowance for volume discount and sales incentive programs in certain geographic regions",476021,12/31/21,02/25/22,4,"KPMG LLP",,,,Atlanta,GA,GEORGIA,"US Southeast",10-K,2022-02-25,,"AGCO CORP /DE",880266,"=""AGCO""","4205 RIVER GREEN PKWAY",,DULUTH,GA,GEORGIA,"US Southeast",,,"=""3523""","Farm Machinery and Equipment",333111,"Farm Machinery and Equipment Manufacturing",34,116,12/31/21,"8,636,681,216",12/31/21,"11,138,300,000","897,000,000","1,742,900,000","9,182,100,000"
16463,"Other income taxes","Assessment of gross unrecognized income tax benefits in certain jurisdictions",476021,12/31/21,02/25/22,4,"KPMG LLP",,,,Atlanta,GA,GEORGIA,"US Southeast",10-K,2022-02-25,,"AGCO CORP /DE",880266,"=""AGCO""","4205 RIVER GREEN PKWAY",,DULUTH,GA,GEORGIA,"US Southeast",,,"=""3523""","Farm Machinery and Equipment",333111,"Farm Machinery and Equipment Manufacturing",34,116,12/31/21,"8,636,681,216",12/31/21,"11,138,300,000","897,000,000","1,742,900,000","9,182,100,000"
16464,Goodwill,"Assessment of goodwill impairment for certain reporting units",476021,12/31/21,02/25/22,4,"KPMG LLP",,,,Atlanta,GA,GEORGIA,"US Southeast",10-K,2022-02-25,,"AGCO CORP /DE",880266,"=""AGCO""","4205 RIVER GREEN PKWAY",,DULUTH,GA,GEORGIA,"US Southeast",,,"=""3523""","Farm Machinery and Equipment",333111,"Farm Machinery and Equipment Manufacturing",34,116,12/31/21,"8,636,681,216",12/31/21,"11,138,300,000","897,000,000","1,742,900,000","9,182,100,000"
17464,"Going concern","Going concern analysis",476688,12/31/21,03/01/22,4,"KPMG LLP",,,,Boston,MA,MASSACHUSETTS,"US New England",10-K,2022-03-01,,"AGENUS INC",1098972,"=""AGEN""","3 FORBES ROAD",,LEXINGTON,MA,MASSACHUSETTS,"US New England",,,"=""2836""","Biological Products, Except Diagnostic Substances",325414,"Biological Product (except Diagnostic) Manufacturing",34,3,12/31/21,"827,211,264",12/31/21,"295,665,000","-23,926,000","1,076,000","465,958,000"
19422,"Sales return and allowances","Product Revenue -Net",481463,12/31/21,03/30/22,2,"Ernst & Young LLP",,,,Iselin,NJ,"NEW JERSEY","US Mid Atlantic",10-K,2022-03-30,Yes,"AGILE THERAPEUTICS INC",1261249,,"500 COLLEGE ROAD EAST","SUITE 310",PRINCETON,NJ,"NEW JERSEY","US Mid Atlantic",,,"=""2834""","Pharmaceutical Preparations",325412,"Pharmaceutical Preparation Manufacturing",34,0,12/31/21,"59,484,056",12/31/21,"4,101,000","-71,067,000",,"39,333,000"
13918,"Uncertain tax positions","Uncertain Tax Positions",469516,10/31/21,12/17/21,1,"PricewaterhouseCoopers LLP",,,,"San Jose",CA,CALIFORNIA,"US West",10-K,2021-12-17,,"AGILENT TECHNOLOGIES, INC.",1090872,"=""A""","5301 STEVENS CREEK BLVD",,"SANTA CLARA",CA,CALIFORNIA,"US West",,,"=""3826""","Laboratory Analytical Instruments",334515,"Instrument Manufacturing for Measuring and Testing Electricity and Electrical Signals",34,157,10/31/21,"47,561,981,952",10/31/21,"6,319,000,000","1,210,000,000","433,000,000","10,705,000,000"
17970,"Business combinations","Acquisition date fair value of customer relationship assets",478308,12/31/21,03/08/22,4,"KPMG LLP",,,,Minneapolis,MN,MINNESOTA,"US Midwest",10-K,2022-03-08,,"AGILITI, INC. \DE",1749704,,"11095 VIKING DRIVE, SUITE 300",,"EDEN PRAIRIE",MN,MINNESOTA,"US Midwest",,,"=""7350""","Services-Miscellaneous Equipment Rental & Leasing",532490,"Other Commercial and Industrial Machinery and Equipment Rental and Leasing",34,23,12/31/21,"3,032,803,328",12/31/21,"1,038,690,000","24,006,000","-890,328,000","2,515,747,000"
17702,"Revenue from customer contracts","Estimating Medicare Advantage risk adjustment revenue",477340,12/31/21,03/03/22,2,"Ernst & Young LLP",,,,"Los Angeles",CA,CALIFORNIA,"US West",10-K,2022-03-03,,"agilon health, inc.",1831097,"=""AGL""","440 POLARIS PARKWAY","SUITE 550",WESTERVILLE,OH,OHIO,"US Midwest",,,"=""8090""","Services-Misc Health & Allied Services, NEC",541511,"Custom Computer Programming Services",34,27,12/31/21,"10,802,565,120",12/31/21,"1,833,559,000","-406,487,000","994,958,000","1,586,252,000"
17703,"Insurance contract liabilities","Valuation of incurred but not reported claims ",477340,12/31/21,03/03/22,2,"Ernst & Young LLP",,,,"Los Angeles",CA,CALIFORNIA,"US West",10-K,2022-03-03,,"agilon health, inc.",1831097,"=""AGL""","440 POLARIS PARKWAY","SUITE 550",WESTERVILLE,OH,OHIO,"US Midwest",,,"=""8090""","Services-Misc Health & Allied Services, NEC",541511,"Custom Computer Programming Services",34,27,12/31/21,"10,802,565,120",12/31/21,"1,833,559,000","-406,487,000","994,958,000","1,586,252,000"
16101,"Discontinued operations","Discontinued Operations - Expenses Directly Attributable to the Oncology Business",475435,12/31/21,02/24/22,1,"PricewaterhouseCoopers LLP",,,,Boston,MA,MASSACHUSETTS,"US New England",10-K,2022-02-24,,"AGIOS PHARMACEUTICALS, INC.",1439222,"=""AGIO""","88 SIDNEY STREET",,CAMBRIDGE,MA,MASSACHUSETTS,"US New England",,,"=""2834""","Pharmaceutical Preparations",325412,"Pharmaceutical Preparation Manufacturing",34,33,12/31/21,"1,785,965,824",12/31/21,,"1,604,715,000",,"1,437,736,000"
15674,"Depreciation and amortization","Agency securities and non-agency securities of high credit quality net premium amortization",474864,12/31/21,02/23/22,2,"Ernst & Young LLP",,,,Tysons,VA,VIRGINIA,"US Mid Atlantic",10-K,2022-02-23,,"AGNC Investment Corp.",1423689,"=""AGNC""","7373 WISCONSIN AVENUE, 22ND FLOOR",,BETHESDA,MD,MARYLAND,"US Mid Atlantic",,,"=""6798""","Real Estate Investment Trusts",525990,"Other Financial Vehicles",34,15,12/31/21,"7,853,888,000",12/31/21,"837,000,000","749,000,000","9,765,000,000","68,149,000,000"
19113,Goodwill,"Goodwill impairment assessment",480691,12/31/21,03/24/22,2,"Ernst & Young LLP",192,"Ernst & Young LLP Chartered Accountants",1263,Toronto,A6,ONTARIO,Canada,40-F,2022-03-25,,"AGNICO EAGLE MINES LTD",2809,"=""AEM""","145 KING STREET EAST","SUITE 400",TORONTO,A6,ONTARIO,Canada,,,"=""1040""","Metal Mining",212221,"Gold Ore Mining",34,53,12/31/21,"13,019,399,168",12/31/21,"3,823,878,000","543,009,000","5,573,043,000","10,186,776,000"
20638,"Business combinations","Acquisition of Easemob
",485284,12/31/21,04/28/22,1,"PricewaterhouseCoopers LLP",94,"PricewaterhouseCoopers Zhong Tian LLP",1424,Shanghai,F4,CHINA,Foreign,20-F,2022-04-28,,"Agora, Inc.",1802883,"=""API""","2804 MISSION COLLEGE BLVD,",,"SANTA CLARA",CA,CALIFORNIA,"US West",,,"=""7372""","Prepackaged Software",518210,"Data Processing, Hosting, and Related Services",34,15,12/29/21,"1,284,151,424",12/31/21,"167,982,000","-72,355,000","803,422,000","944,999,000"
20639,"Allowance for credit losses","Valuation of allowance for current expected credit losses – accounts receivable, net",485284,12/31/21,04/28/22,1,"PricewaterhouseCoopers LLP",94,"PricewaterhouseCoopers Zhong Tian LLP",1424,Shanghai,F4,CHINA,Foreign,20-F,2022-04-28,,"Agora, Inc.",1802883,"=""API""","2804 MISSION COLLEGE BLVD,",,"SANTA CLARA",CA,CALIFORNIA,"US West",,,"=""7372""","Prepackaged Software",518210,"Data Processing, Hosting, and Related Services",34,15,12/29/21,"1,284,151,424",12/31/21,"167,982,000","-72,355,000","803,422,000","944,999,000"
18038,"Goodwill and intangible assets","Goodwill and Indefinite-Lived Intangible Assets — Refer to Notes 2 and 7 to the financial statements",478661,12/31/21,03/09/22,3,"Deloitte & Touche LLP",,,,Philadelphia,PA,PENNSYLVANIA,"US Mid Atlantic",10-K,2022-03-09,,"AgroFresh Solutions, Inc.",1592016,,"100 S. INDEPENDENCE MALL WEST",,PHILADELPHIA,PA,PENNSYLVANIA,"US Mid Atlantic",,,"=""2870""","Agricultural Chemicals",423820,"Farm and Garden Machinery and Equipment Merchant Wholesalers",34,2,12/31/21,"104,311,824",12/31/21,"165,989,000","-5,423,000","-159,080,000","732,562,000"
20742,"Revenue from customer contracts","Revenue recognition: Estimate of variable renewal commissions for long-term life insurance products and impact on revenue recognized — Refer to Note 2(p) to the consolidated financial statements",485829,12/31/21,04/29/22,3,"Deloitte & Touche LLP",499,"Deloitte Touche Tohmatsu Certified Public Accountants LLP",1113,Shenzhen,F4,CHINA,Foreign,20-F,2022-04-29,,"AIFU Inc.",1413855,"=""AIFU""","60/F PEARL RIVER TOWER","NO.15 WEST ZHUJIANG ROAD TIANHE DISTRICT",GUANGZHOU,F4,CHINA,Foreign,,,"=""6411""","Insurance Agents, Brokers, and Service",524126,"Direct Property and Casualty Insurance Carriers",34,7,12/29/21,"364,586,272",12/31/21,"513,249,000","39,381,000","271,131,000","508,699,000"
17209,"Business combinations","Accounting for Acquisitions of Real Estate",477007,12/31/21,03/01/22,2,"Ernst & Young LLP",,,,Denver,CO,COLORADO,"US West",10-K,2022-03-01,,"Aimco OP L.P.",1820878,,"4582 S ULSTER STREET, SUITE 1450",,DENVER,CO,COLORADO,"US West",,,"=""6500""","Real Estate",531110,"Lessors of Residential Buildings and Dwellings",34,,,,12/31/21,"169,836,000","-6,207,000",,"2,434,101,000"
15076,Leases,"Assessment of the carrying value of flight equipment subject to operating leases",474113,12/31/21,02/17/22,4,"KPMG LLP",,,,Irvine,CA,CALIFORNIA,"US West",10-K,2022-02-17,,"AIR LEASE CORP",1487712,"=""AL""","2000 AVENUE OF THE STARS","SUITE 1000N","LOS ANGELES",CA,CALIFORNIA,"US West",,,"=""7359""","Equipment Rental and Leasing, NEC",532411,"Commercial Air, Rail, and Water Transportation Equipment Rental and Leasing",34,44,12/31/21,"5,041,651,712",12/31/21,"2,088,389,000","436,632,000",,"26,968,722,000"
13616,"Revenue from customer contracts","Revenue Recognition – On-site Customer Contracts – Refer to Notes 1 and 4 to the Financial Statements",467759,09/30/21,11/18/21,3,"Deloitte & Touche LLP",,,,Philadelphia,PA,PENNSYLVANIA,"US Mid Atlantic",10-K,2021-11-18,,"Air Products & Chemicals, Inc.",2969,"=""APD""","1940 AIR PRODUCTS BLVD.",,ALLENTOWN,PA,PENNSYLVANIA,"US Mid Atlantic",,,"=""2810""","Industrial Inorganic Chemicals",325120,"Industrial Gas Manufacturing",34,256,09/30/21,"56,701,923,328",09/30/21,"10,323,000,000","2,099,100,000","12,207,500,000","26,859,200,000"
13617,"Revenue from customer contracts","Revenue Recognition – Cost Incurred Input Method – Refer to Notes 1 and 4 to the Financial Statements",467759,09/30/21,11/18/21,3,"Deloitte & Touche LLP",,,,Philadelphia,PA,PENNSYLVANIA,"US Mid Atlantic",10-K,2021-11-18,,"Air Products & Chemicals, Inc.",2969,"=""APD""","1940 AIR PRODUCTS BLVD.",,ALLENTOWN,PA,PENNSYLVANIA,"US Mid Atlantic",,,"=""2810""","Industrial Inorganic Chemicals",325120,"Industrial Gas Manufacturing",34,256,09/30/21,"56,701,923,328",09/30/21,"10,323,000,000","2,099,100,000","12,207,500,000","26,859,200,000"
12175,"Other investments","Redeemable non-controlling interest – valuation of Contrail Aviation Support, LLC — Refer to Notes 1 and 5 to the financial statements",459117,03/31/21,06/25/21,3,"Deloitte & Touche LLP",,,,Minneapolis,MN,MINNESOTA,"US Midwest",10-K,2021-06-25,,"AIR T INC",353184,"=""AIRT""","11020 DAVID TAYLOR DRIVE","SUITE 305",CHARLOTTE,NC,"NORTH CAROLINA","US Southeast",,,"=""4513""","Air Courier Services",492110,Couriers,34,24,03/31/21,"68,501,648",03/31/21,"175,121,000","-7,277,000","16,096,000","140,750,000"
12176,Inventory,"Inventories, net – valuation of inventories– Refer to Notes 1 and 6 to the financial statements",459117,03/31/21,06/25/21,3,"Deloitte & Touche LLP",,,,Minneapolis,MN,MINNESOTA,"US Midwest",10-K,2021-06-25,,"AIR T INC",353184,"=""AIRT""","11020 DAVID TAYLOR DRIVE","SUITE 305",CHARLOTTE,NC,"NORTH CAROLINA","US Southeast",,,"=""4513""","Air Courier Services",492110,Couriers,34,24,03/31/21,"68,501,648",03/31/21,"175,121,000","-7,277,000","16,096,000","140,750,000"
17407,"Other debt","Stock warrants - Remeasurement and Reclassification - Refer to Note C to the Financial Statements",477050,12/31/21,03/01/22,3,"Deloitte & Touche LLP",,,,Cincinnati,OH,OHIO,"US Midwest",10-K,2022-03-01,,"Air Transport Services Group, Inc.",894081,"=""ATSG""","145 HUNTER DR",,WILMINGTON,OH,OHIO,"US Midwest",,,"=""4513""","Air Courier Services",492110,Couriers,34,29,12/31/21,"2,178,297,344",12/31/21,"1,734,282,000","231,420,000","817,252,000","3,267,335,000"
16363,"Uncertain tax positions","Uncertain Tax Positions",475875,12/31/21,02/25/22,1,"PricewaterhouseCoopers LLP",,,,"San Francisco",CA,CALIFORNIA,"US West",10-K,2022-02-25,,"Airbnb, Inc.",1559720,"=""ABNB""","888 BRANNAN ST.",,"SAN FRANCISCO",CA,CALIFORNIA,"US West",,,"=""7340""","Services-To Dwellings & Other Buildings",511210,"Software Publishers",34,166,12/31/21,"60,685,606,912",12/31/21,"5,992,000,000","-352,000,000","4,070,803,000","13,708,474,000"
11170,Leases,"Recoverability assessment and Impairment of flight equipment held for lease",453424,02/28/21,04/21/21,2,"Ernst & Young LLP",,,,Stamford,CT,CONNECTICUT,"US New England",10-K,2021-04-21,,"Aircastle LTD",1362988,"=""AYR""","C/O AIRCASTLE ADVISOR LLC","201 TRESSER BLVD, SUITE 400",STAMFORD,CT,CONNECTICUT,"US New England",,,"=""7359""","Equipment Rental and Leasing, NEC",532411,"Commercial Air, Rail, and Water Transportation Equipment Rental and Leasing",34,,,,02/28/21,"832,288,000","-333,168,000","1,731,070,000","7,698,338,000"
11171,"Other income taxes","Accounting for Income Tax",453424,02/28/21,04/21/21,2,"Ernst & Young LLP",,,,Stamford,CT,CONNECTICUT,"US New England",10-K,2021-04-21,,"Aircastle LTD",1362988,"=""AYR""","C/O AIRCASTLE ADVISOR LLC","201 TRESSER BLVD, SUITE 400",STAMFORD,CT,CONNECTICUT,"US New England",,,"=""7359""","Equipment Rental and Leasing, NEC",532411,"Commercial Air, Rail, and Water Transportation Equipment Rental and Leasing",34,,,,02/28/21,"832,288,000","-333,168,000","1,731,070,000","7,698,338,000"
18918,"Business combinations","Fair value of measurement of contingent consideration and intangible assets acquired in the NimbeLink Acquisition",480201,12/31/21,03/21/22,4,"KPMG LLP",,,,"San Diego",CA,CALIFORNIA,"US West",10-K,2022-03-21,,"AIRGAIN INC",1272842,"=""AIRG""","3611 VALLEY CENTRE DRIVE","SUITE 150","SAN DIEGO",CA,CALIFORNIA,"US West",,,"=""3663""","Radio and Television Broadcasting and Communications Equipment",334220,"Radio and Television Broadcasting and Wireless Communications Equipment Manufacturing",34,11,12/31/21,"107,331,112",12/31/21,"64,273,000","-10,087,000","19,099,000","66,390,000"
16826,"Business combinations","Valuation of Completed Technologies – Acquisition of Guardicore Ltd.",476338,12/31/21,02/28/22,1,"PricewaterhouseCoopers LLP",,,,Boston,MA,MASSACHUSETTS,"US New England",10-K,2022-02-28,,"AKAMAI TECHNOLOGIES INC",1086222,"=""AKAM""","145 BROADWAY",,CAMBRIDGE,MA,MASSACHUSETTS,"US New England",,,"=""7389""","Business Services, NEC",334119,"Other Computer Peripheral Equipment Manufacturing",34,117,12/31/21,"18,786,336,768",12/31/21,"3,461,223,000","651,642,000","2,060,535,000","8,138,673,000"
17500,"Revenue from customer contracts","Valuation of Excess Purchase Commitment Liability",477060,12/31/21,03/01/22,2,"Ernst & Young LLP",,,,Boston,MA,MASSACHUSETTS,"US New England",10-K,2022-03-01,Yes,"Akebia Therapeutics, Inc.",1517022,"=""AKBA""","245 FIRST STREET",,CAMBRIDGE,MA,MASSACHUSETTS,"US New England",,,"=""2834""","Pharmaceutical Preparations",325412,"Pharmaceutical Preparation Manufacturing",34,2,12/31/21,"400,022,176",12/31/21,"211,650,000","-282,024,000","-93,163,000","529,347,000"
16636,"Research and development expenses","Accrued Research and Development Expenses & Prepaid Research and Development Expenses — Refer to Note 2 to the financial statements",475563,12/31/21,02/25/22,3,"Deloitte & Touche LLP",,,,Parsippany,NJ,"NEW JERSEY","US Mid Atlantic",10-K,2022-02-25,,"Akero Therapeutics, Inc.",1744659,"=""AKRO""","601 GATEWAY BOULEVARD, SUITE 350",,"SOUTH SAN FRANCISCO",CA,CALIFORNIA,"US West",,,"=""2834""","Pharmaceutical Preparations",325412,"Pharmaceutical Preparation Manufacturing",34,21,12/31/21,"738,150,400",12/31/21,,"-100,777,000",,"195,548,000"
14963,"Regulatory assets and liabilities","Impact of Rate Regulation on the Financial Statements – Refer to Note 1 (Summary of Significant Accounting Policies – Regulatory Assets and Liabilities) and Note 2 (Regulatory Matters) to the financial statements",473955,12/31/21,02/16/22,3,"Deloitte & Touche LLP",,,,Birmingham,AL,ALABAMA,"US Southeast",10-K,2022-02-17,,"ALABAMA POWER CO",3153,,"600 N 18TH ST","P O BOX 2641",BIRMINGHAM,AL,ALABAMA,"US Southeast",92122,"SOUTHERN CO","=""4911""","Electric Services",221122,"Electric Power Distribution",34,,,,12/31/21,"6,413,000,000","1,253,000,000",,"32,982,000,000"
16090,Inventory,"Sufficiency of evidence over the existence of inventory",475415,12/31/21,02/24/22,4,"KPMG LLP",,,,"San Antonio",TX,TEXAS,"US Southwest",10-K,2022-02-24,,"ALAMO GROUP INC",897077,"=""ALG""","1627 E WALNUT",,SEGUIN,TX,TEXAS,"US Southwest",,,"=""3523""","Farm Machinery and Equipment",333111,"Farm Machinery and Equipment Manufacturing",34,147,12/31/21,"1,747,641,472",12/31/21,"1,334,223,000","80,245,000","319,791,000","1,205,742,000"
17358,"Property, plant and equipment","Evaluation of indicators of impairment or impairment reversal of mineral, property, plant and equipment of the Young-Davidson cash generating unit",477127,12/31/21,02/23/22,4,"KPMG LLP",187,"KPMG LLP Chartered Accountants",85,Toronto,A6,ONTARIO,Canada,6-K,2022-03-01,,"ALAMOS GOLD INC",1178819,"=""AGI""","181 BAY STREET","SUITE 3910",TORONTO,A6,ONTARIO,Canada,,,"=""1040""","Metal Mining",212221,"Gold Ore Mining",34,8,12/31/21,"3,013,632,000",12/31/21,"823,600,000","-66,700,000",,"3,621,500,000"
19390,"Property, plant and equipment","Evaluation of indicators of impairment or impairment reversal of mineral, property, plant and equipment of the Young-Davidson cash generating unit",481335,12/31/21,02/23/22,4,"KPMG LLP",187,"KPMG LLP Chartered Accountants",85,Toronto,A6,ONTARIO,Canada,40-F,2022-03-30,,"ALAMOS GOLD INC",1178819,"=""AGI""","181 BAY STREET","SUITE 3910",TORONTO,A6,ONTARIO,Canada,,,"=""1040""","Metal Mining",212221,"Gold Ore Mining",34,8,12/31/21,"3,013,632,000",12/31/21,"823,600,000","-66,700,000",,"3,621,500,000"
16298,"Revenue from customer contracts","Revenue recognition",475361,12/31/21,02/24/22,1,"PricewaterhouseCoopers LLP",,,,Washington,DC,"DISTRICT OF COLUMBIA","US Mid Atlantic",10-K,2022-02-24,,"Alarm.com Holdings, Inc.",1459200,"=""ALRM""","8281 GREENSBORO DRIVE","SUITE 100",TYSONS,VA,VIRGINIA,"US Mid Atlantic",,,"=""7372""","Prepackaged Software",541511,"Custom Computer Programming Services",34,85,12/31/21,"4,262,504,192",12/31/21,"748,969,000","52,259,000","421,748,000","1,232,015,000"
16299,"Other debt","Convertible Senior Notes Transaction",475361,12/31/21,02/24/22,1,"PricewaterhouseCoopers LLP",,,,Washington,DC,"DISTRICT OF COLUMBIA","US Mid Atlantic",10-K,2022-02-24,,"Alarm.com Holdings, Inc.",1459200,"=""ALRM""","8281 GREENSBORO DRIVE","SUITE 100",TYSONS,VA,VIRGINIA,"US Mid Atlantic",,,"=""7372""","Prepackaged Software",541511,"Custom Computer Programming Services",34,85,12/31/21,"4,262,504,192",12/31/21,"748,969,000","52,259,000","421,748,000","1,232,015,000"
14716,"Revenue from customer contracts","Assessment of Mileage Plan model",473593,12/31/21,02/11/22,4,"KPMG LLP",,,,Seattle,WA,WASHINGTON,"US West",10-K,2022-02-11,,"ALASKA AIR GROUP, INC.",766421,"=""ALK""","19300 INTERNATIONAL BOULEVARD",,SEATTLE,WA,WASHINGTON,"US West",,,"=""4512""","Air Transportation, Scheduled",481111,"Scheduled Passenger Air Transportation",34,52,12/31/21,"6,559,695,360",12/31/21,"6,176,000,000","478,000,000","1,757,000,000","13,951,000,000"
16649,"Revenue from customer contracts","Evaluation of estimated total contract costs at completion for Albany Engineered Composites revenue recognition for certain firm-fixed-price contracts",475591,12/31/21,02/25/22,4,"KPMG LLP",,,,Albany,NY,"NEW YORK","US Mid Atlantic",10-K,2022-02-25,,"ALBANY INTERNATIONAL CORP /DE/",819793,"=""AIN""","216 AIRPORT DRIVE",,ROCHESTER,NH,"NEW HAMPSHIRE","US New England",,,"=""2221""","Broadwoven Fabric Mills, Manmade Fiber and Silk",313210,"Broadwoven Fabric Mills",34,88,12/31/21,"2,838,845,952",12/31/21,"929,240,000","118,478,000","652,762,000","1,556,064,000"
15390,Goodwill,"Goodwill Impairment Assessment – Refining Solutions Reporting Unit
",474430,12/31/21,02/18/22,1,"PricewaterhouseCoopers LLP",,,,Charlotte,NC,"NORTH CAROLINA","US Southeast",10-K,2022-02-22,,"ALBEMARLE CORP",915913,"=""ALB""","4250 CONGRESS STREET","SUITE 900",CHARLOTTE,NC,"NORTH CAROLINA","US Southeast",,,"=""2821""","Plastics Material and Synthetic Resins, and Nonvulcanizable Elastomers",325211,"Plastics Material and Resin Manufacturing",34,234,12/31/21,"27,354,597,376",12/31/21,"3,327,957,000","123,672,000","3,718,692,000","10,974,118,000"
11364,"Real estate investments","Stockholders' Equity and Convertible Preferred Stock – Refer to Note 9 to the financial statements",454575,02/27/21,04/28/21,3,"Deloitte & Touche LLP",,,,Boise,ID,IDAHO,"US West",10-K,2021-04-28,,"Albertsons Companies, Inc.",1646972,"=""ACI""","250 PARKCENTER BLVD.",,BOISE,ID,IDAHO,"US West",,,"=""5411""","Grocery Stores",445110,"Supermarkets and Other Grocery (except Convenience) Stores",34,17,03/01/21,"7,755,784,192",02/27/21,"69,690,400,000","850,200,000","-368,700,000","26,598,000,000"
11365,"Other contingent liabilities","Self-Insurance Liabilities—Refer to Note 1 to the financial statements",454575,02/27/21,04/28/21,3,"Deloitte & Touche LLP",,,,Boise,ID,IDAHO,"US West",10-K,2021-04-28,,"Albertsons Companies, Inc.",1646972,"=""ACI""","250 PARKCENTER BLVD.",,BOISE,ID,IDAHO,"US West",,,"=""5411""","Grocery Stores",445110,"Supermarkets and Other Grocery (except Convenience) Stores",34,17,03/01/21,"7,755,784,192",02/27/21,"69,690,400,000","850,200,000","-368,700,000","26,598,000,000"
17413,"Research and development expenses","Accounting for Clinical Trial Expense",476740,12/31/21,03/01/22,2,"Ernst & Young LLP",,,,Boston,MA,MASSACHUSETTS,"US New England",10-K,2022-03-01,,"ALBIREO PHARMA, INC.",1322505,,"10 POST OFFICE SQUARE","SUITE 502 SOUTH",BOSTON,MA,MASSACHUSETTS,"US New England",,,"=""2834""","Pharmaceutical Preparations",325412,"Pharmaceutical Preparation Manufacturing",34,23,12/31/21,"449,416,704",12/31/21,"40,579,000","-34,030,000","158,348,000","302,051,000"
16139,"Pension and other post-employment benefits","U.S. Pension Annuitizations",475337,12/31/21,02/24/22,1,"PricewaterhouseCoopers LLP",,,,Pittsburgh,PA,PENNSYLVANIA,"US Mid Atlantic",10-K,2022-02-24,,"Alcoa Corp",1675149,"=""AA""","201 ISABELLA STREET","SUITE 500",PITTSBURGH,PA,PENNSYLVANIA,"US Mid Atlantic",,,"=""3334""","Primary Production of Aluminum",331312,"Primary Aluminum Production",34,60,12/31/21,"10,968,663,040",12/31/21,"12,152,000,000","429,000,000",,"15,025,000,000"
14881,"Goodwill and intangible assets","Goodwill and Alcon Brand Name Impairment Assessments",473779,12/31/21,02/15/22,1,"PricewaterhouseCoopers LLP",,,,"Fort Worth",TX,TEXAS,"US Southwest",20-F,2022-02-15,,"ALCON INC",1167379,"=""ALC""","6201 SOUTH FREEWAY",,"FORT WORTH",TX,TEXAS,"US Southwest",,,"=""3851""","Ophthalmic Goods",339115,"Ophthalmic Goods Manufacturing",34,89,12/29/21,"43,295,911,936",12/31/21,"8,291,000,000","376,000,000","1,586,000,000","27,999,000,000"
14882,"Other intangible assets","In-Process Research and Development and Definite Lived Intangible Asset Impairment Assessments",473779,12/31/21,02/15/22,1,"PricewaterhouseCoopers LLP",,,,"Fort Worth",TX,TEXAS,"US Southwest",20-F,2022-02-15,,"ALCON INC",1167379,"=""ALC""","6201 SOUTH FREEWAY",,"FORT WORTH",TX,TEXAS,"US Southwest",,,"=""3851""","Ophthalmic Goods",339115,"Ophthalmic Goods Manufacturing",34,89,12/29/21,"43,295,911,936",12/31/21,"8,291,000,000","376,000,000","1,586,000,000","27,999,000,000"
16271,"Revenue from customer contracts","Revenue Recognition",475334,12/31/21,02/24/22,2,"Ernst & Young LLP",,,,"Redwood City",CA,CALIFORNIA,"US West",10-K,2022-02-24,,"Alector, Inc.",1653087,"=""ALEC""","131 OYSTER POINT BLVD., SUITE 600",,"SOUTH SAN FRANCISCO",CA,CALIFORNIA,"US West",,,"=""2836""","Biological Products, Except Diagnostic Substances",325414,"Biological Product (except Diagnostic) Manufacturing",34,21,12/31/21,"1,693,014,912",12/31/21,"207,085,000","-36,329,000",,"814,658,000"
16272,"Revenue from customer contracts","New Collaboration Agreement",475334,12/31/21,02/24/22,2,"Ernst & Young LLP",,,,"Redwood City",CA,CALIFORNIA,"US West",10-K,2022-02-24,,"Alector, Inc.",1653087,"=""ALEC""","131 OYSTER POINT BLVD., SUITE 600",,"SOUTH SAN FRANCISCO",CA,CALIFORNIA,"US West",,,"=""2836""","Biological Products, Except Diagnostic Substances",325414,"Biological Product (except Diagnostic) Manufacturing",34,21,12/31/21,"1,693,014,912",12/31/21,"207,085,000","-36,329,000",,"814,658,000"
15772,"Other contingent liabilities","Self-Insurance Reserves - Refer to Notes 2 and 16 to the consolidated financial statements",475021,12/31/21,02/23/22,3,"Deloitte & Touche LLP",,,,Boston,MA,MASSACHUSETTS,"US New England",10-K,2022-02-24,,"AlerisLife Inc.",1159281,,"400 CENTRE STREET",,NEWTON,MA,MASSACHUSETTS,"US New England",,,"=""8051""","Skilled Nursing Care Facilities",623311,"Continuing Care Retirement Communities",34,3,12/31/21,"96,354,816",12/31/21,"934,593,000","-29,925,000",,"376,277,000"
15773,"Property, plant and equipment","Long-Lived Asset Recoverability — Refer to Notes 2 and 5 to the consolidated financial statements",475021,12/31/21,02/23/22,3,"Deloitte & Touche LLP",,,,Boston,MA,MASSACHUSETTS,"US New England",10-K,2022-02-24,,"AlerisLife Inc.",1159281,,"400 CENTRE STREET",,NEWTON,MA,MASSACHUSETTS,"US New England",,,"=""8051""","Skilled Nursing Care Facilities",623311,"Continuing Care Retirement Communities",34,3,12/31/21,"96,354,816",12/31/21,"934,593,000","-29,925,000",,"376,277,000"
16626,"Discontinued operations","Assessment of Held for Sale and Discontinued Operations Classification — Refer to Note 2 to the financial statements",475641,12/31/21,02/25/22,3,"Deloitte & Touche LLP",,,,Honolulu,HI,HAWAII,"US West",10-K,2022-02-25,,"Alexander & Baldwin, Inc.",1545654,"=""ALEX""","822 BISHOP STREET, P.O. BOX 3440",,HONOLULU,HI,HAWAII,"US West",,,"=""6798""","Real Estate Investment Trusts",531312,"Nonresidential Property Managers",34,25,12/31/21,"1,819,025,024",12/31/21,"379,300,000","35,400,000","1,064,800,000","1,879,800,000"
14753,"Real estate investments","Real Estate Impairment – Refer to Note 2 to the financial statements",473600,12/31/21,02/14/22,3,"Deloitte & Touche LLP",,,,"New York",NY,"NEW YORK","US Mid Atlantic",10-K,2022-02-14,,"ALEXANDERS INC",3499,"=""ALX""","210 ROUTE 4 EAST",,PARAMUS,NJ,"NEW JERSEY","US Mid Atlantic",,,"=""6798""","Real Estate Investment Trusts",525990,"Other Financial Vehicles",34,260,12/31/21,"1,329,427,584",12/31/21,"206,148,000","132,930,000",,"1,391,965,000"
14219,"Business combinations","Recognition of acquired real estate – Purchase price accounting",472327,12/31/21,01/31/22,2,"Ernst & Young LLP",,,,"Los Angeles",CA,CALIFORNIA,"US West",10-K,2022-01-31,,"ALEXANDRIA REAL ESTATE EQUITIES, INC.",1035443,"=""ARE""","26 NORTH EUCLID AVENUE",,PASADENA,CA,CALIFORNIA,"US West",,,"=""6798""","Real Estate Investment Trusts",525990,"Other Financial Vehicles",34,223,12/31/21,"35,237,462,016",12/31/21,"2,114,150,000","571,247,000",,"30,219,373,000"
18889,"Other investments","Valuation of the embedded derivative asset",480145,12/31/21,03/21/22,1,"PricewaterhouseCoopers LLP",191,"PricewaterhouseCoopers LLP Chartered Accountants",271,Vancouver,A1,"BRITISH COLUMBIA",Canada,40-F,2022-03-21,,"ALEXCO RESOURCE CORP",1364128,,"SUITE 1150","200 GRANVILLE ST",VANCOUVER,A1,"BRITISH COLUMBIA",Canada,,,"=""1040""","Metal Mining",212221,"Gold Ore Mining",34,2,12/29/21,"226,862,080",12/31/21,"17,023,000","-2,491,000",,"166,538,000"
12306,"Derivatives and hedging","Derivative financial instruments – Refer to Notes 3 and 21 to the financial statements",459780,03/31/21,07/06/21,3,"Deloitte & Touche LLP",468,"Deloitte LLP",1208,Toronto,A6,ONTARIO,Canada,F-4,2021-07-07,,"Algoma Steel Group Inc.",1860805,"=""ASTL""","105 WEST STREET",,"SAULT STE. MARIE",A6,ONTARIO,Canada,,,"=""3312""","Steel Works, Blast Furnaces (Including Coke Ovens), and Rolling Mills",331111,"Iron and Steel Mills",34,,,,03/31/21,"1,428,100,000","-60,500,000","137,000,000","1,236,300,000"
12647,"Derivatives and hedging","Derivative financial instruments – Refer to Notes 3 and 21 to the financial statements",462092,03/31/21,07/06/21,3,"Deloitte & Touche LLP",468,"Deloitte LLP",1208,Toronto,A6,ONTARIO,Canada,F-4/A,2021-08-17,,"Algoma Steel Group Inc.",1860805,"=""ASTL""","105 WEST STREET",,"SAULT STE. MARIE",A6,ONTARIO,Canada,,,"=""3312""","Steel Works, Blast Furnaces (Including Coke Ovens), and Rolling Mills",331111,"Iron and Steel Mills",34,,,,03/31/21,"1,428,100,000","-60,500,000","137,000,000","1,236,300,000"
12880,"Derivatives and hedging","Derivative financial instruments – Refer to Notes 3 and 21 to the financial statements",463315,03/31/21,07/06/21,3,"Deloitte & Touche LLP",468,"Deloitte LLP",1208,Toronto,A6,ONTARIO,Canada,F-4/A,2021-09-08,,"Algoma Steel Group Inc.",1860805,"=""ASTL""","105 WEST STREET",,"SAULT STE. MARIE",A6,ONTARIO,Canada,,,"=""3312""","Steel Works, Blast Furnaces (Including Coke Ovens), and Rolling Mills",331111,"Iron and Steel Mills",34,,,,03/31/21,"1,428,100,000","-60,500,000","137,000,000","1,236,300,000"
13003,"Derivatives and hedging","Derivative financial instruments – Refer to Notes 3 and 21 to the financial statements",463900,03/31/21,07/06/21,3,"Deloitte & Touche LLP",468,"Deloitte LLP",1208,Toronto,A6,ONTARIO,Canada,F-4/A,2021-09-20,,"Algoma Steel Group Inc.",1860805,"=""ASTL""","105 WEST STREET",,"SAULT STE. MARIE",A6,ONTARIO,Canada,,,"=""3312""","Steel Works, Blast Furnaces (Including Coke Ovens), and Rolling Mills",331111,"Iron and Steel Mills",34,,,,03/31/21,"1,428,100,000","-60,500,000","137,000,000","1,236,300,000"
13399,"Derivatives and hedging","Derivative financial instruments – Refer to Notes 3 and 21 to the financial statements",466362,03/31/21,07/06/21,3,"Deloitte & Touche LLP",468,"Deloitte LLP",1208,Toronto,A6,ONTARIO,Canada,F-1,2021-10-27,,"Algoma Steel Group Inc.",1860805,"=""ASTL""","105 WEST STREET",,"SAULT STE. MARIE",A6,ONTARIO,Canada,,,"=""3312""","Steel Works, Blast Furnaces (Including Coke Ovens), and Rolling Mills",331111,"Iron and Steel Mills",34,,,,03/31/21,"1,428,100,000","-60,500,000","137,000,000","1,236,300,000"
17803,"Regulatory assets and liabilities","Regulatory assets and liabilities—Recovery of costs through rate regulation",477467,12/31/21,03/03/22,2,"Ernst & Young LLP",192,"Ernst & Young LLP Chartered Accountants",1263,Toronto,A6,ONTARIO,Canada,40-F,2022-03-04,,"ALGONQUIN POWER & UTILITIES CORP.",1174169,"=""AQN""","354 DAVIS ROAD",,OAKVILLE,A6,ONTARIO,Canada,,,"=""4911""","Electric Services",221111,"Hydroelectric Power Generation",34,14,12/29/21,"8,628,705,280",12/31/21,"2,285,479,000","264,859,000","4,872,163,000","16,797,503,000"
20957,"Regulatory assets and liabilities","Regulatory assets and liabilities—Recovery of costs through rate regulation",486233,12/31/21,03/03/22,2,"Ernst & Young LLP",192,"Ernst & Young LLP Chartered Accountants",1263,Toronto,A6,ONTARIO,Canada,6-K,2022-05-02,,"ALGONQUIN POWER & UTILITIES CORP.",1174169,"=""AQN""","354 DAVIS ROAD",,OAKVILLE,A6,ONTARIO,Canada,,,"=""4911""","Electric Services",221111,"Hydroelectric Power Generation",34,14,12/29/21,"8,628,705,280",12/31/21,"2,285,479,000","264,859,000","4,872,163,000","16,797,503,000"
12454,Goodwill,"Impairment Assessment on Goodwill Allocated to Reporting Units under the Digital Media and Entertainment Segment",460895,03/31/21,07/27/21,1,"PricewaterhouseCoopers LLP",95,PricewaterhouseCoopers,1389,"Hong Kong",F4,CHINA,Foreign,20-F,2021-07-27,,"Alibaba Group Holding Ltd",1577552,"=""BABA""","26/F TOWER ONE","TIMES SQUARE, 1 MATHESON STREET","CAUSEWAY BAY",K3,"HONG KONG",Foreign,,,"=""7389""","Business Services, NEC",518210,"Data Processing, Hosting, and Related Services",33,232,03/29/21,"622,891,761,664",03/31/21,"109,426,000,000","22,971,000,000","88,869,000,000","257,852,000,000"
12455,"Business combinations","Valuation of Intangible Assets Acquired in Connection with Business Combinations",460895,03/31/21,07/27/21,1,"PricewaterhouseCoopers LLP",95,PricewaterhouseCoopers,1389,"Hong Kong",F4,CHINA,Foreign,20-F,2021-07-27,,"Alibaba Group Holding Ltd",1577552,"=""BABA""","26/F TOWER ONE","TIMES SQUARE, 1 MATHESON STREET","CAUSEWAY BAY",K3,"HONG KONG",Foreign,,,"=""7389""","Business Services, NEC",518210,"Data Processing, Hosting, and Related Services",33,232,03/29/21,"622,891,761,664",03/31/21,"109,426,000,000","22,971,000,000","88,869,000,000","257,852,000,000"
12456,"Other investments","Fair Value Determination Related to Investments in Privately Held Companies Accounted for Using the Measurement Alternative",460895,03/31/21,07/27/21,1,"PricewaterhouseCoopers LLP",95,PricewaterhouseCoopers,1389,"Hong Kong",F4,CHINA,Foreign,20-F,2021-07-27,,"Alibaba Group Holding Ltd",1577552,"=""BABA""","26/F TOWER ONE","TIMES SQUARE, 1 MATHESON STREET","CAUSEWAY BAY",K3,"HONG KONG",Foreign,,,"=""7389""","Business Services, NEC",518210,"Data Processing, Hosting, and Related Services",33,232,03/29/21,"622,891,761,664",03/31/21,"109,426,000,000","22,971,000,000","88,869,000,000","257,852,000,000"
12475,Goodwill,"Impairment Assessment on Goodwill Allocated to Reporting Units under the Digital Media and
Entertainment Segment",461194,03/31/21,07/27/21,1,"PricewaterhouseCoopers LLP",95,PricewaterhouseCoopers,1389,"Hong Kong",F4,CHINA,Foreign,6-K,2021-07-27,,"Alibaba Group Holding Ltd",1577552,"=""BABA""","26/F TOWER ONE","TIMES SQUARE, 1 MATHESON STREET","CAUSEWAY BAY",K3,"HONG KONG",Foreign,,,"=""7389""","Business Services, NEC",518210,"Data Processing, Hosting, and Related Services",33,232,03/29/21,"622,891,761,664",03/31/21,"109,426,000,000","22,971,000,000","88,869,000,000","257,852,000,000"
12476,"Business combinations","Valuation of Intangible Assets Acquired in Connection with Business Combinations",461194,03/31/21,07/27/21,1,"PricewaterhouseCoopers LLP",95,PricewaterhouseCoopers,1389,"Hong Kong",F4,CHINA,Foreign,6-K,2021-07-27,,"Alibaba Group Holding Ltd",1577552,"=""BABA""","26/F TOWER ONE","TIMES SQUARE, 1 MATHESON STREET","CAUSEWAY BAY",K3,"HONG KONG",Foreign,,,"=""7389""","Business Services, NEC",518210,"Data Processing, Hosting, and Related Services",33,232,03/29/21,"622,891,761,664",03/31/21,"109,426,000,000","22,971,000,000","88,869,000,000","257,852,000,000"
12477,"Other investments","Fair Value Determination Related to Investments in Privately Held Companies Accounted for Using the
Measurement Alternative",461194,03/31/21,07/27/21,1,"PricewaterhouseCoopers LLP",95,PricewaterhouseCoopers,1389,"Hong Kong",F4,CHINA,Foreign,6-K,2021-07-27,,"Alibaba Group Holding Ltd",1577552,"=""BABA""","26/F TOWER ONE","TIMES SQUARE, 1 MATHESON STREET","CAUSEWAY BAY",K3,"HONG KONG",Foreign,,,"=""7389""","Business Services, NEC",518210,"Data Processing, Hosting, and Related Services",33,232,03/29/21,"622,891,761,664",03/31/21,"109,426,000,000","22,971,000,000","88,869,000,000","257,852,000,000"
18179,"Revenue from customer contracts","Revenue recognition – Health solution services",478963,12/31/21,03/10/22,2,"Ernst & Young LLP",,,,Chicago,IL,ILLINOIS,"US Midwest",10-K,2022-03-10,,"Alight, Inc. / Delaware",1809104,"=""ALIT""","4 OVERLOOK POINT",,LINCOLNSHIRE,IL,ILLINOIS,"US Midwest",,,"=""7389""","Business Services, NEC",511210,"Software Publishers",34,11,12/31/21,"5,016,964,096",12/31/21,"2,915,000,000","-60,000,000","-3,668,000,000","10,988,000,000"
18180,"Other debt","Measurement of the Tax Receivable Agreement Liability",478963,12/31/21,03/10/22,2,"Ernst & Young LLP",,,,Chicago,IL,ILLINOIS,"US Midwest",10-K,2022-03-10,,"Alight, Inc. / Delaware",1809104,"=""ALIT""","4 OVERLOOK POINT",,LINCOLNSHIRE,IL,ILLINOIS,"US Midwest",,,"=""7389""","Business Services, NEC",511210,"Software Publishers",34,11,12/31/21,"5,016,964,096",12/31/21,"2,915,000,000","-60,000,000","-3,668,000,000","10,988,000,000"
20081,"Revenue from customer contracts","Revenue recognition — Health solution services",483091,12/31/21,03/10/22,2,"Ernst & Young LLP",,,,Chicago,IL,ILLINOIS,"US Midwest","POS AM",2022-04-12,,"Alight, Inc. / Delaware",1809104,"=""ALIT""","4 OVERLOOK POINT",,LINCOLNSHIRE,IL,ILLINOIS,"US Midwest",,,"=""7389""","Business Services, NEC",511210,"Software Publishers",34,11,12/31/21,"5,016,964,096",12/31/21,"2,915,000,000","-60,000,000","-3,668,000,000","10,988,000,000"
20082,"Other debt","Measurement of the Tax Receivable Agreement Liability",483091,12/31/21,03/10/22,2,"Ernst & Young LLP",,,,Chicago,IL,ILLINOIS,"US Midwest","POS AM",2022-04-12,,"Alight, Inc. / Delaware",1809104,"=""ALIT""","4 OVERLOOK POINT",,LINCOLNSHIRE,IL,ILLINOIS,"US Midwest",,,"=""7389""","Business Services, NEC",511210,"Software Publishers",34,11,12/31/21,"5,016,964,096",12/31/21,"2,915,000,000","-60,000,000","-3,668,000,000","10,988,000,000"
16622,"Revenue from customer contracts","Revenue Recognition – Determination of Standalone Selling Price of Distinct Performance Obligations in Clear Aligner Contracts",475831,12/31/21,02/25/22,1,"PricewaterhouseCoopers LLP",,,,"San Jose",CA,CALIFORNIA,"US West",10-K,2022-02-25,,"ALIGN TECHNOLOGY INC",1097149,"=""ALGN""","410 NORTH SCOTTSDALE ROAD, SUITE 1300",,TEMPE,AZ,ARIZONA,"US Southwest",,,"=""3842""","Orthopedic, Prosthetic, and Surgical Appliances and Supplies",339114,"Dental Equipment and Supplies Manufacturing",34,657,12/31/21,"51,726,639,104",12/31/21,"3,952,584,000","772,020,000","3,094,458,000","5,942,110,000"
17706,"Insurance contract liabilities","Medical expenses payable – Incurred but not paid claims - Refer to Notes 2 and 7 to the financial statements",477365,12/31/21,03/03/22,3,"Deloitte & Touche LLP",,,,"Los Angeles",CA,CALIFORNIA,"US West",10-K,2022-03-03,,"Alignment Healthcare, Inc.",1832466,"=""ALHC""","1100 W. TOWN AND COUNTRY ROAD","SUITE 1600",ORANGE,CA,CALIFORNIA,"US West",,,"=""6324""","Hospital and Medical Service Plans",524114,"Direct Health and Medical Insurance Carriers",34,14,12/31/21,"2,631,942,144",12/31/21,"1,167,773,000","-195,286,000","270,924,000","630,895,000"
17707,"Other revenue","Revenue – Classification of revenue recognized related to Direct Contracting Entities (“DCE”) Refer to Note 2 to the financial statements",477365,12/31/21,03/03/22,3,"Deloitte & Touche LLP",,,,"Los Angeles",CA,CALIFORNIA,"US West",10-K,2022-03-03,,"Alignment Healthcare, Inc.",1832466,"=""ALHC""","1100 W. TOWN AND COUNTRY ROAD","SUITE 1600",ORANGE,CA,CALIFORNIA,"US West",,,"=""6324""","Hospital and Medical Service Plans",524114,"Direct Health and Medical Insurance Carriers",34,14,12/31/21,"2,631,942,144",12/31/21,"1,167,773,000","-195,286,000","270,924,000","630,895,000"
13933,"Revenue from customer contracts","Revenue Recognition – Refer to Note 2 to the financial statements",469610,09/30/21,12/20/21,3,"Deloitte & Touche LLP",,,,Jericho,NY,"NEW YORK","US Mid Atlantic",10-K,2021-12-20,,"ALJ REGIONAL HOLDINGS INC",1438731,"=""ALJJ""","244 MADISON AVENUE, PMB #358",,"NEW YORK",NY,"NEW YORK","US Mid Atlantic",,,"=""7389""","Business Services, NEC",561422,"Telemarketing Bureaus",34,1,09/30/21,"44,950,360",09/30/21,"440,853,000","-4,643,000","-18,035,000","214,653,000"
14900,"Sales return and allowances","Rebate Accruals - Medicaid Drug Rebate Program
",473849,12/31/21,02/16/22,1,"PricewaterhouseCoopers LLP",,,,Boston,MA,MASSACHUSETTS,"US New England",10-K,2022-02-16,,"Alkermes plc.",1520262,"=""ALKS""","CONNAUGHT HOUSE","1 BURLINGTON ROAD","DUBLIN 4",L2,IRELAND,Foreign,,,"=""2834""","Pharmaceutical Preparations",325412,"Pharmaceutical Preparation Manufacturing",34,23,12/31/21,"3,766,662,144",12/31/21,"1,173,751,000","-48,169,000","945,668,000","2,024,484,000"
17196,"Research and development expenses","Accrued contract research and development expenses",476944,12/31/21,03/01/22,2,"Ernst & Young LLP",,,,"Redwood City",CA,CALIFORNIA,"US West",10-K,2022-03-01,,"Allakos Inc.",1564824,,"4757 EXECUTIVE DRIVE","SUITE  210","SAN DIEGO",CA,CALIFORNIA,"US West",,,"=""2834""","Pharmaceutical Preparations",325414,"Biological Product (except Diagnostic) Manufacturing",34,10,12/31/21,"534,749,376",12/31/21,,"-269,860,000",,"534,824,000"
15886,"Insurance contract liabilities","Reserves for Incurred But Not Reported (IBNR) Claims",475139,12/31/21,02/23/22,2,"Ernst & Young LLP",,,,"New York",NY,"NEW YORK","US Mid Atlantic",10-K,2022-02-23,,"ALLEGHANY CORP /DE",775368,,"1411 BROADWAY","34TH FLOOR","NEW YORK",NY,"NEW YORK","US Mid Atlantic",,,"=""6331""","Fire, Marine, and Casualty Insurance",524126,"Direct Property and Casualty Insurance Carriers",34,668,12/31/21,"9,078,246,400",12/31/21,"12,004,105,000","1,034,892,000","7,826,215,000","32,268,675,000"
17334,"Revenue from customer contracts","Estimated credit vouchers not expected to be redeemed",476746,12/31/21,03/01/22,4,"KPMG LLP",,,,Dallas,TX,TEXAS,"US Southwest",10-K,2022-03-01,,"Allegiant Travel CO",1362468,"=""ALGT""","1201 N. TOWN CENTER DRIVE",,"LAS VEGAS",NV,NEVADA,"US West",,,"=""4512""","Air Transportation, Scheduled",561510,"Travel Agencies",34,187,12/31/21,"3,387,552,768",12/31/21,"1,707,910,000","151,853,000",,"3,991,073,000"
14774,Goodwill,"Goodwill Impairment Assessment - Allegion International Reporting Unit",473708,12/31/21,02/15/22,1,"PricewaterhouseCoopers LLP",,,,Indianapolis,IN,INDIANA,"US Midwest",10-K,2022-02-15,,"Allegion plc",1579241,"=""ALLE""","UNIT NO. 233, THE CAPEL BUILDING","MARY'S ABBEY","DUBLIN 7",L2,IRELAND,Foreign,,,"=""7381""","Detective, Guard, and Armored Car Services",423610,"Electrical Apparatus and Equipment, Wiring Supplies, and Related Equipment Merchant  Wholesalers",34,132,12/31/21,"11,683,277,824",12/31/21,"2,867,400,000","483,000,000","-492,200,000","3,051,000,000"
14842,"Regulatory assets and liabilities","Accounting for the Effects of Regulatory Matters",473818,12/31/21,02/16/22,1,"PricewaterhouseCoopers LLP",,,,Minneapolis,MN,MINNESOTA,"US Midwest",10-K,2022-02-16,,"ALLETE INC",66756,"=""ALE""","30 W SUPERIOR ST",,DULUTH,MN,MINNESOTA,"US Midwest",,,"=""4931""","Electric and Other Services Combined",221122,"Electric Power Distribution",34,66,12/29/21,"3,480,297,216",12/31/21,"1,419,200,000","169,200,000",,"6,435,000,000"
14638,"Equity investments and joint ventures","Measurement of Equity in Net Income Attributable to AB Unitholders – Performance-Based Fees",473384,12/31/21,02/11/22,1,"PricewaterhouseCoopers LLP",,,,Nashville,TN,TENNESSEE,"US Southeast",10-K,2022-02-11,,"ALLIANCEBERNSTEIN HOLDING L.P.",825313,"=""AB""","501 COMMERCE STREET",,NASHVILLE,TN,TENNESSEE,"US Southeast",1333986,"Equitable Holdings, Inc.","=""6282""","Investment Advice",523930,"Investment Advice",34,49,12/29/21,"4,815,252,480",12/31/21,"416,326,000","385,843,000",,"1,623,764,000"
14651,"Revenue from customer contracts","Performance-Based Fees",473369,12/31/21,02/11/22,1,"PricewaterhouseCoopers LLP",,,,Nashville,TN,TENNESSEE,"US Southeast",10-K,2022-02-11,,"ALLIANCEBERNSTEIN L.P.",1109448,,"501 COMMERCE STREET",,NASHVILLE,TN,TENNESSEE,"US Southeast",1333986,"Equitable Holdings, Inc.","=""6282""","Investment Advice",523930,"Investment Advice",34,,,,12/31/21,"4,436,457,000","1,148,623,000","1,448,798,000","10,510,088,000"
15232,"Regulatory assets and liabilities","Regulatory Assets and Regulatory Liabilities - Impact of rate regulation on the financial statements - Refer to Notes 1 and 2 to the financial statements",474199,12/31/21,02/18/22,3,"Deloitte & Touche LLP",,,,Milwaukee,WI,WISCONSIN,"US Midwest",10-K,2022-02-18,,"ALLIANT ENERGY CORP",352541,"=""LNT""","4902 NORTH BILTMORE LANE","SUITE 1000",MADISON,WI,WISCONSIN,"US Midwest",,,"=""4931""","Electric and Other Services Combined",221122,"Electric Power Distribution",34,61,12/31/21,"15,396,669,440",12/31/21,"3,669,000,000","674,000,000",,"18,553,000,000"
18033,Inventory,"Inventories – Refer to Note 1 to the financial statements",478616,12/31/21,03/09/22,3,"Deloitte & Touche LLP",,,,Williamsville,NY,"NEW YORK","US Mid Atlantic",10-K,2022-03-09,,"ALLIENT INC",46129,"=""ALNT""","495 COMMERCE DRIVE, SUITE 3",,AMHERST,NY,"NEW YORK","US Mid Atlantic",,,"=""3825""","Instruments for Measuring and Testing of Electricity and Electrical Signals",334519,"Other Measuring and Controlling Device Manufacturing",34,36,12/31/21,"560,522,880",12/31/21,"403,516,000","24,094,000","-22,657,000","470,785,000"
18034,"Business combinations","Acquisitions — Spectrum Controls, Inc. — Customer Lists Intangible Asset — Refer to Note 2 to the financial statements",478616,12/31/21,03/09/22,3,"Deloitte & Touche LLP",,,,Williamsville,NY,"NEW YORK","US Mid Atlantic",10-K,2022-03-09,,"ALLIENT INC",46129,"=""ALNT""","495 COMMERCE DRIVE, SUITE 3",,AMHERST,NY,"NEW YORK","US Mid Atlantic",,,"=""3825""","Instruments for Measuring and Testing of Electricity and Electrical Signals",334519,"Other Measuring and Controlling Device Manufacturing",34,36,12/31/21,"560,522,880",12/31/21,"403,516,000","24,094,000","-22,657,000","470,785,000"
15085,"Warranty liabilities","Product Warranty Liabilities",474115,12/31/21,02/17/22,1,"PricewaterhouseCoopers LLP",,,,Indianapolis,IN,INDIANA,"US Midwest",10-K,2022-02-17,,"Allison Transmission Holdings Inc",1411207,"=""ALSN""","ONE ALLISON WAY",,Indianapolis,IN,INDIANA,"US Midwest",,,"=""3714""","Motor Vehicle Parts and Accessories",336350,"Motor Vehicle Transmission and Power Train Parts Manufacturing",34,36,12/31/21,"3,608,208,384",12/31/21,"2,402,000,000","442,000,000","-2,347,000,000","4,457,000,000"
15784,"Research and development expenses","Accrued Clinical Trial Expenses",474960,12/31/21,02/23/22,2,"Ernst & Young LLP",,,,"Redwood City",CA,CALIFORNIA,"US West",10-K,2022-02-23,,"Allogene Therapeutics, Inc.",1737287,"=""ALLO""","210 EAST GRAND AVENUE",,"SOUTH SAN FRANCISCO",CA,CALIFORNIA,"US West",,,"=""2836""","Biological Products, Except Diagnostic Substances",325414,"Biological Product (except Diagnostic) Manufacturing",34,15,12/31/21,"2,127,936,128",12/31/21,"114,089,000","-182,051,000",,"1,038,634,000"
18961,"Revenue from customer contracts","Revenue Recognition",480315,12/31/21,03/22/22,2,"Ernst & Young LLP",222,"Kost Forer Gabbay & Kasierer",1281,"Tel Aviv",L3,ISRAEL,Foreign,20-F,2022-03-22,,"Allot Ltd.",1365767,"=""ALLT""","22 HANGAR STREET","NEVE NE'EMAN, INDUSTRIAL ZONE B",HOD-HASHARON,L3,ISRAEL,Foreign,,,"=""3576""","Computer Communications Equipment",541511,"Custom Computer Programming Services",34,12,12/29/21,"418,576,608",12/31/21,"145,600,000","-15,040,000","90,870,000","203,414,000"
15314,"Insurance contract liabilities","Reserve for Property and Casualty Insurance Claims and Claims Expense - Refer to Notes 2 and 9 to the Financial Statements",474320,12/31/21,02/18/22,3,"Deloitte & Touche LLP",,,,Chicago,IL,ILLINOIS,"US Midwest",10-K,2022-02-18,,"ALLSTATE CORP",899051,"=""ALL""","3100 SANDERS ROAD",,NORTHBROOK,IL,ILLINOIS,"US Midwest",,,"=""6331""","Fire, Marine, and Casualty Insurance",524126,"Direct Property and Casualty Insurance Carriers",34,118,12/31/21,"33,059,649,536",12/31/21,"50,588,000,000","1,599,000,000","21,677,000,000","99,440,000,000"
15315,"Business combinations","National General Acquisition - Refer to Notes 2 and 3 to the Financial Statements",474320,12/31/21,02/18/22,3,"Deloitte & Touche LLP",,,,Chicago,IL,ILLINOIS,"US Midwest",10-K,2022-02-18,,"ALLSTATE CORP",899051,"=""ALL""","3100 SANDERS ROAD",,NORTHBROOK,IL,ILLINOIS,"US Midwest",,,"=""6331""","Fire, Marine, and Casualty Insurance",524126,"Direct Property and Casualty Insurance Carriers",34,118,12/31/21,"33,059,649,536",12/31/21,"50,588,000,000","1,599,000,000","21,677,000,000","99,440,000,000"
16413,"Allowance for credit losses","Allowance for Loan Losses - Consumer Automotive Portfolio - Refer to Notes 1 and 9 to the financial statements",475985,12/31/21,02/25/22,3,"Deloitte & Touche LLP",,,,Detroit,MI,MICHIGAN,"US Midwest",10-K,2022-02-25,,"Ally Financial Inc.",40729,"=""ALLY""","ALLY DETROIT CENTER","500 WOODWARD AVE. FLOOR 10",DETROIT,MI,MICHIGAN,"US Midwest",,,"=""6022""","State Commercial Banks",522220,"Sales Financing",34,48,12/31/21,"16,089,353,216",12/31/21,"8,671,000,000","3,060,000,000",,"182,114,000,000"
30581,"Goodwill and intangible assets","Valuation of goodwill and intangible assets with an indefinite useful life",514275,12/31/21,01/20/23,2,"Ernst & Young LLP",483,"Ernst & Young Audit SAS",1522,Medellin,F8,COLOMBIA,Foreign,DRS,2023-01-23,,"Almacenes Exito S.A.",1957146,"=""EXTOY""","CARRERA 48 # 32 B SUR 139.",,"ENVIGADO, ANTIOQUIA,",F8,COLOMBIA,Foreign,,,"=""5331""","Variety Stores",445110,"Supermarkets and Other Grocery (except Convenience) Stores",34,,,,12/31/21,"4,158,000,000","146,000,000",,
30582,"Deferred income taxes","Valuation of deferred tax assets and tax credits",514275,12/31/21,01/20/23,2,"Ernst & Young LLP",483,"Ernst & Young Audit SAS",1522,Medellin,F8,COLOMBIA,Foreign,DRS,2023-01-23,,"Almacenes Exito S.A.",1957146,"=""EXTOY""","CARRERA 48 # 32 B SUR 139.",,"ENVIGADO, ANTIOQUIA,",F8,COLOMBIA,Foreign,,,"=""5331""","Variety Stores",445110,"Supermarkets and Other Grocery (except Convenience) Stores",34,,,,12/31/21,"4,158,000,000","146,000,000",,
30583,"Vendor/supplier rebates","Valuation of discounts and rebates from suppliers",514275,12/31/21,01/20/23,2,"Ernst & Young LLP",483,"Ernst & Young Audit SAS",1522,Medellin,F8,COLOMBIA,Foreign,DRS,2023-01-23,,"Almacenes Exito S.A.",1957146,"=""EXTOY""","CARRERA 48 # 32 B SUR 139.",,"ENVIGADO, ANTIOQUIA,",F8,COLOMBIA,Foreign,,,"=""5331""","Variety Stores",445110,"Supermarkets and Other Grocery (except Convenience) Stores",34,,,,12/31/21,"4,158,000,000","146,000,000",,
30584,"Goodwill and intangible assets","Valuation of goodwill and intangible assets with an indefinite useful life",514276,12/31/21,01/20/23,2,"Ernst & Young LLP",483,"Ernst & Young Audit SAS",1522,Medellin,F8,COLOMBIA,Foreign,DRS/A,2023-04-03,,"Almacenes Exito S.A.",1957146,"=""EXTOY""","CARRERA 48 # 32 B SUR 139.",,"ENVIGADO, ANTIOQUIA,",F8,COLOMBIA,Foreign,,,"=""5331""","Variety Stores",445110,"Supermarkets and Other Grocery (except Convenience) Stores",34,,,,12/31/21,"4,158,000,000","146,000,000",,
30585,"Deferred income taxes","Valuation of deferred tax assets and tax credits",514276,12/31/21,01/20/23,2,"Ernst & Young LLP",483,"Ernst & Young Audit SAS",1522,Medellin,F8,COLOMBIA,Foreign,DRS/A,2023-04-03,,"Almacenes Exito S.A.",1957146,"=""EXTOY""","CARRERA 48 # 32 B SUR 139.",,"ENVIGADO, ANTIOQUIA,",F8,COLOMBIA,Foreign,,,"=""5331""","Variety Stores",445110,"Supermarkets and Other Grocery (except Convenience) Stores",34,,,,12/31/21,"4,158,000,000","146,000,000",,
30586,"Vendor/supplier rebates","Valuation of discounts and rebates from suppliers",514276,12/31/21,01/20/23,2,"Ernst & Young LLP",483,"Ernst & Young Audit SAS",1522,Medellin,F8,COLOMBIA,Foreign,DRS/A,2023-04-03,,"Almacenes Exito S.A.",1957146,"=""EXTOY""","CARRERA 48 # 32 B SUR 139.",,"ENVIGADO, ANTIOQUIA,",F8,COLOMBIA,Foreign,,,"=""5331""","Variety Stores",445110,"Supermarkets and Other Grocery (except Convenience) Stores",34,,,,12/31/21,"4,158,000,000","146,000,000",,
14610,"Other liabilities and provisions","Liability Related to Sale of Future Royalties and Commercial Milestones",473356,12/31/21,02/10/22,1,"PricewaterhouseCoopers LLP",,,,Boston,MA,MASSACHUSETTS,"US New England",10-K,2022-02-10,,"ALNYLAM PHARMACEUTICALS, INC.",1178670,"=""ALNY""","675 WEST KENDALL STREET","HENRI A. TERMEER SQUARE",CAMBRIDGE,MA,MASSACHUSETTS,"US New England",,,"=""2834""","Pharmaceutical Preparations",325412,"Pharmaceutical Preparation Manufacturing",34,170,12/31/21,"20,380,463,104",12/31/21,"844,287,000","-852,824,000",,"3,643,304,000"
14243,"Other contingent liabilities","Loss Contingencies",472404,12/31/21,02/01/22,2,"Ernst & Young LLP",,,,"San Jose",CA,CALIFORNIA,"US West",10-K,2022-02-02,,"Alphabet Inc.",1652044,"=""GOOGL""","1600 AMPHITHEATRE PARKWAY",,"MOUNTAIN VIEW",CA,CALIFORNIA,"US West",,,"=""7370""","Services-Computer Programming, Data Processing, Etc.",518112,"Web Search Portals",34,"2,933",12/29/21,"882,304,876,544",12/31/21,"257,637,000,000","76,033,000,000","227,262,000,000","359,268,000,000"
17654,Inventory,"Valuation of Inventories - Refer to Note 2 to the Financial Statements",477096,12/31/21,03/01/22,3,"Deloitte & Touche LLP",,,,"San Diego",CA,CALIFORNIA,"US West",10-K,2022-03-02,,"Alphatec Holdings, Inc.",1350653,"=""ATEC""","1950 CAMINO VIA ROBLE",,CARLSBAD,CA,CALIFORNIA,"US West",,,"=""3841""","Surgical and Medical Instruments and Apparatus",339112,"Surgical and Medical Instrument Manufacturing",34,11,12/31/21,"1,137,707,904",12/31/21,"243,212,000","-143,032,000","-21,938,000","572,053,000"
18811,"Revenue from customer contracts","Accounting for Revenue under the AbbVie Collaboration Agreement",479970,12/31/21,03/17/22,2,"Ernst & Young LLP",,,,Seattle,WA,WASHINGTON,"US West",10-K,2022-03-17,,"ALPINE IMMUNE SCIENCES, INC.",1626199,,"188 EAST BLAINE ST., SUITE 200",,SEATTLE,WA,WASHINGTON,"US West",,,"=""2834""","Pharmaceutical Preparations",325412,"Pharmaceutical Preparation Manufacturing",34,14,12/31/21,"418,190,752",12/31/21,"23,443,000","-50,333,000",,"255,900,000"
17812,"Derivatives and hedging","Fair Value Measurement of Level 3 Derivatives",477537,12/31/21,03/03/22,2,"Ernst & Young LLP",192,"Ernst & Young LLP Chartered Accountants",1263,Calgary,A0,ALBERTA,Canada,40-F,2022-03-04,,"AltaGas Ltd.",1695519,,"1700, 355-4 AVENUE SW",,CALGARY,A0,ALBERTA,Canada,,,"=""1311""","Crude Petroleum and Natural Gas",211111,"Crude Petroleum and Natural Gas Extraction",34,,,,12/31/21,"8,370,000,000","224,000,000","1,287,000,000","17,095,000,000"
17813,"Equity investments and joint ventures","Valuation of Equity Method Investment in Mountain Valley Pipeline LLC",477537,12/31/21,03/03/22,2,"Ernst & Young LLP",192,"Ernst & Young LLP Chartered Accountants",1263,Calgary,A0,ALBERTA,Canada,40-F,2022-03-04,,"AltaGas Ltd.",1695519,,"1700, 355-4 AVENUE SW",,CALGARY,A0,ALBERTA,Canada,,,"=""1311""","Crude Petroleum and Natural Gas",211111,"Crude Petroleum and Natural Gas Extraction",34,,,,12/31/21,"8,370,000,000","224,000,000","1,287,000,000","17,095,000,000"
16844,"Revenue from customer contracts","Software Revenue Recognition",476410,12/31/21,02/28/22,2,"Ernst & Young LLP",,,,Detroit,MI,MICHIGAN,"US Midwest",10-K,2022-02-28,,"Altair Engineering Inc.",1701732,"=""ALTR""","1820 E. BIG BEAVER ROAD",,TROY,MI,MICHIGAN,"US Midwest",,,"=""7372""","Prepackaged Software",511210,"Software Publishers",34,77,12/31/21,"3,983,835,648",12/31/21,"532,179,000","-8,794,000","144,746,000","1,163,275,000"
16845,"Business combinations","Business Combination",476410,12/31/21,02/28/22,2,"Ernst & Young LLP",,,,Detroit,MI,MICHIGAN,"US Midwest",10-K,2022-02-28,,"Altair Engineering Inc.",1701732,"=""ALTR""","1820 E. BIG BEAVER ROAD",,TROY,MI,MICHIGAN,"US Midwest",,,"=""7372""","Prepackaged Software",511210,"Software Publishers",34,77,12/31/21,"3,983,835,648",12/31/21,"532,179,000","-8,794,000","144,746,000","1,163,275,000"
20087,"Other intangible assets","INTANGIBLE ASSETS – CAPITALIZED DEVELOPMENT EXPENDITURE – refer to note 2 (section development expenditures), note 3 (section intangible assets – research and development), and note 9 (intangible assets) to the financial statements",483105,12/31/21,04/12/22,3,"Deloitte & Touche LLP",395,"Deloitte AG",1235,Zurich,V8,SWITZERLAND,Foreign,20-F,2022-04-12,,"Altamira Therapeutics Ltd.",1601936,"=""CYTOF""","CLARENDON HOUSE","2 CHURCH STREET","HAMILTON HM 11",D0,BERMUDA,Foreign,,,"=""2834""","Pharmaceutical Preparations",325412,"Pharmaceutical Preparation Manufacturing",34,2,12/29/21,"23,405,176",12/31/21,"69,396","-18,721,882","-1,403,311","21,039,698"
24131,"Other intangible assets","INTANGIBLE ASSETS – CAPITALIZED DEVELOPMENT EXPENDITURE – refer to note 2 (section development expenditures), note 3 (section intangible assets – research and development), and note 9 (intangible assets) to the financial statements",499628,12/31/21,04/12/22,3,"Deloitte & Touche LLP",395,"Deloitte AG",1235,Zurich,V8,SWITZERLAND,Foreign,F-1,2023-02-16,,"Altamira Therapeutics Ltd.",1601936,"=""CYTOF""","CLARENDON HOUSE","2 CHURCH STREET","HAMILTON HM 11",D0,BERMUDA,Foreign,,,"=""2834""","Pharmaceutical Preparations",325412,"Pharmaceutical Preparation Manufacturing",34,2,12/29/21,"23,405,176",12/31/21,"69,396","-18,721,882","-1,403,311","21,039,698"
25886,"Other intangible assets","INTANGIBLE ASSETS – CAPITALIZED DEVELOPMENT EXPENDITURE – refer to note 2 (section development expenditures), note 3 (section intangible assets – research and development), and note 9 (intangible assets) to the financial statements",501889,12/31/21,04/12/22,3,"Deloitte & Touche LLP",395,"Deloitte AG",1235,Zurich,V8,SWITZERLAND,Foreign,F-1/A,2023-02-28,,"Altamira Therapeutics Ltd.",1601936,"=""CYTOF""","CLARENDON HOUSE","2 CHURCH STREET","HAMILTON HM 11",D0,BERMUDA,Foreign,,,"=""2834""","Pharmaceutical Preparations",325412,"Pharmaceutical Preparation Manufacturing",34,2,12/29/21,"23,405,176",12/31/21,"69,396","-18,721,882","-1,403,311","21,039,698"
26463,"Other intangible assets","INTANGIBLE ASSETS – CAPITALIZED DEVELOPMENT EXPENDITURE – refer to note 2 (section development expenditures), note 3 (section intangible assets – research and development), and note 9 (intangible assets) to the financial statements",502327,12/31/21,04/12/22,3,"Deloitte & Touche LLP",395,"Deloitte AG",1235,Zurich,V8,SWITZERLAND,Foreign,F-1/A,2023-03-01,,"Altamira Therapeutics Ltd.",1601936,"=""CYTOF""","CLARENDON HOUSE","2 CHURCH STREET","HAMILTON HM 11",D0,BERMUDA,Foreign,,,"=""2834""","Pharmaceutical Preparations",325412,"Pharmaceutical Preparation Manufacturing",34,2,12/29/21,"23,405,176",12/31/21,"69,396","-18,721,882","-1,403,311","21,039,698"
26827,"Other intangible assets","INTANGIBLE ASSETS – CAPITALIZED DEVELOPMENT EXPENDITURE – refer to note 2 (section development expenditures), note 3 (section intangible assets – research and development), and note 9 (intangible assets) to the financial statements",503415,12/31/21,04/12/22,3,"Deloitte & Touche LLP",395,"Deloitte AG",1235,Zurich,V8,SWITZERLAND,Foreign,F-1/A,2023-03-07,,"Altamira Therapeutics Ltd.",1601936,"=""CYTOF""","CLARENDON HOUSE","2 CHURCH STREET","HAMILTON HM 11",D0,BERMUDA,Foreign,,,"=""2834""","Pharmaceutical Preparations",325412,"Pharmaceutical Preparation Manufacturing",34,2,12/29/21,"23,405,176",12/31/21,"69,396","-18,721,882","-1,403,311","21,039,698"
27253,"Other intangible assets","INTANGIBLE ASSETS – CAPITALIZED DEVELOPMENT EXPENDITURE – refer to note 2 (section development expenditures), note 3 (section intangible assets – research and development), and note 9 (intangible assets) to the financial statements",504790,12/31/21,04/12/22,3,"Deloitte & Touche LLP",395,"Deloitte AG",1235,Zurich,V8,SWITZERLAND,Foreign,F-1/A,2023-03-13,,"Altamira Therapeutics Ltd.",1601936,"=""CYTOF""","CLARENDON HOUSE","2 CHURCH STREET","HAMILTON HM 11",D0,BERMUDA,Foreign,,,"=""2834""","Pharmaceutical Preparations",325412,"Pharmaceutical Preparation Manufacturing",34,2,12/29/21,"23,405,176",12/31/21,"69,396","-18,721,882","-1,403,311","21,039,698"
27927,"Other intangible assets","INTANGIBLE ASSETS – CAPITALIZED DEVELOPMENT EXPENDITURE – refer to note 2 (section development expenditures), note 3 (section intangible assets – research and development), and note 9 (intangible assets) to the financial statements",505965,12/31/21,04/12/22,3,"Deloitte & Touche LLP",395,"Deloitte AG",1235,Zurich,V8,SWITZERLAND,Foreign,F-1/A,2023-03-23,,"Altamira Therapeutics Ltd.",1601936,"=""CYTOF""","CLARENDON HOUSE","2 CHURCH STREET","HAMILTON HM 11",D0,BERMUDA,Foreign,,,"=""2834""","Pharmaceutical Preparations",325412,"Pharmaceutical Preparation Manufacturing",34,2,12/29/21,"23,405,176",12/31/21,"69,396","-18,721,882","-1,403,311","21,039,698"
28077,"Other intangible assets","INTANGIBLE ASSETS – CAPITALIZED DEVELOPMENT EXPENDITURE – refer to note 2 (section development expenditures), note 3 (section intangible assets – research and development), and note 9 (intangible assets) to the financial statements",506368,12/31/21,04/12/22,3,"Deloitte & Touche LLP",395,"Deloitte AG",1235,Zurich,V8,SWITZERLAND,Foreign,F-1/A,2023-03-27,,"Altamira Therapeutics Ltd.",1601936,"=""CYTOF""","CLARENDON HOUSE","2 CHURCH STREET","HAMILTON HM 11",D0,BERMUDA,Foreign,,,"=""2834""","Pharmaceutical Preparations",325412,"Pharmaceutical Preparation Manufacturing",34,2,12/29/21,"23,405,176",12/31/21,"69,396","-18,721,882","-1,403,311","21,039,698"
18040,"Going concern","Going concern assessment",478646,12/31/21,03/09/22,2,"Ernst & Young LLP",50,"Ernst & Young AS",1572,Stavanger,Q8,NORWAY,Foreign,20-F,2022-03-09,,"Altera Infrastructure L.P.",1382298,,"ALTERA HOUSE, UNIT 3, PROSPECT PARK","ARNHALL BUSINESS PARK, WESTHILL",ABERDEENSHIRE,X0,"UNITED KINGDOM",Foreign,911971,"TEEKAY CORP LTD","=""4400""","Water Transportation",488320,"Marine Cargo Handling",34,4,12/29/21,"21,625,640",12/31/21,"1,151,260,000","-136,450,000","-45,143,000","3,884,724,000"
18041,"Property, plant and equipment","Impairment of vessels",478646,12/31/21,03/09/22,2,"Ernst & Young LLP",50,"Ernst & Young AS",1572,Stavanger,Q8,NORWAY,Foreign,20-F,2022-03-09,,"Altera Infrastructure L.P.",1382298,,"ALTERA HOUSE, UNIT 3, PROSPECT PARK","ARNHALL BUSINESS PARK, WESTHILL",ABERDEENSHIRE,X0,"UNITED KINGDOM",Foreign,911971,"TEEKAY CORP LTD","=""4400""","Water Transportation",488320,"Marine Cargo Handling",34,4,12/29/21,"21,625,640",12/31/21,"1,151,260,000","-136,450,000","-45,143,000","3,884,724,000"
12835,"Research and development expenses","Research and development tax incentive receivable",462952,06/30/21,09/02/21,1,"PricewaterhouseCoopers LLP",89,PricewaterhouseCoopers,1379,Melbourne,C3,AUSTRALIA,Foreign,20-F,2021-09-02,,"ALTERITY THERAPEUTICS LTD",1131343,"=""ATHE""","LEVEL 3, 460 BOURKE STREET",,MELBOURNE,C3,AUSTRALIA,Foreign,,,"=""2834""","Pharmaceutical Preparations",325412,"Pharmaceutical Preparation Manufacturing",34,2,07/02/21,"30,256,276",06/30/21,,"-11,493,508",,"25,214,530"
14868,"Revenue from customer contracts","Revenue Recognition – Determination of Standalone Selling Prices – Refer to Notes 2 and 3 of the Financial Statements",473771,12/31/21,02/15/22,3,"Deloitte & Touche LLP",,,,"Los Angeles",CA,CALIFORNIA,"US West",10-K,2022-02-15,,"Alteryx, Inc.",1689923,,"17200 LAGUNA CANYON ROAD",,IRVINE,CA,CALIFORNIA,"US West",,,"=""7372""","Prepackaged Software",511210,"Software Publishers",34,61,12/31/21,"3,616,145,408",12/31/21,"536,000,000","-180,000,000","323,602,000","1,599,688,000"
18547,"Deferred and capitalized costs","Accounting for the Lonza manufacturing agreement, including related long-lived asset impairment assessment",479559,12/31/21,03/15/22,2,"Ernst & Young LLP",,,,Tysons,VA,VIRGINIA,"US Mid Atlantic",10-K,2022-03-15,,"Altimmune, Inc.",1326190,"=""ALT""","910 CLOPPER ROAD","SUITE 201S",GAITHERSBURG,MD,MARYLAND,"US Mid Atlantic",,,"=""2834""","Pharmaceutical Preparations",325412,"Pharmaceutical Preparation Manufacturing",34,9,12/31/21,"375,502,912",12/31/21,"4,410,356","-97,090,824","186,715,744","218,864,844"
19668,"Shareholder valuation","Series A Preferred Shares",482022,12/31/21,03/31/22,2,"Ernst & Young LLP",,,,Atlanta,GA,GEORGIA,"US Southeast",10-K,2022-03-31,,"Altisource Asset Management Corp",1555074,"=""AAMCD""","5100 TAMARIND REEF",,CHRISTIANSTED,VI,"VIRGIN ISLANDS (US)",Foreign,,,"=""6500""","Real Estate",523930,"Investment Advice",34,18,12/31/21,"36,794,540",12/31/21,,"-6,004,000",,"81,476,000"
16955,Goodwill,"Goodwill —Thomson Reporting Unit — Refer to Notes 1 and 7 to the financial statements",476443,12/31/21,02/28/22,3,"Deloitte & Touche LLP",,,,Boston,MA,MASSACHUSETTS,"US New England",10-K,2022-02-28,,"Altra Industrial Motion Corp.",1374535,,"300 GRANITE STREET","SUITE 201",BRAINTREE,MA,MASSACHUSETTS,"US New England",,,"=""3569""","General Industrial Machinery and Equipment, NEC",423840,"Industrial Supplies Merchant Wholesalers",34,52,12/31/21,"3,348,107,008",12/31/21,"1,899,800,000","27,700,000","-636,100,000","4,130,600,000"
14145,"Other contingent liabilities","Tobacco and Health Litigation Provisions and Disclosures",472056,12/31/21,01/27/22,1,"PricewaterhouseCoopers LLP",,,,Richmond,VA,VIRGINIA,"US Mid Atlantic",8-K,2022-01-27,,"ALTRIA GROUP, INC.",764180,"=""MO""","6601 WEST BROAD STREET",,RICHMOND,VA,VIRGINIA,"US Mid Atlantic",,,"=""2111""",Cigarettes,312221,"Cigarette Manufacturing",34,47,12/31/21,"86,400,294,912",12/31/21,"26,013,000,000","2,475,000,000","-19,089,000,000","39,523,000,000"
14146,"Equity investments and joint ventures","JUUL Labs, Inc. (“JUUL”) - Determination of the Fair Value of the Investment",472056,12/31/21,01/27/22,1,"PricewaterhouseCoopers LLP",,,,Richmond,VA,VIRGINIA,"US Mid Atlantic",8-K,2022-01-27,,"ALTRIA GROUP, INC.",764180,"=""MO""","6601 WEST BROAD STREET",,RICHMOND,VA,VIRGINIA,"US Mid Atlantic",,,"=""2111""",Cigarettes,312221,"Cigarette Manufacturing",34,47,12/31/21,"86,400,294,912",12/31/21,"26,013,000,000","2,475,000,000","-19,089,000,000","39,523,000,000"
14147,"Equity investments and joint ventures","Impairment Assessment - Investment in Anheuser-Busch InBev SA/NV (“ABI”)",472056,12/31/21,01/27/22,1,"PricewaterhouseCoopers LLP",,,,Richmond,VA,VIRGINIA,"US Mid Atlantic",8-K,2022-01-27,,"ALTRIA GROUP, INC.",764180,"=""MO""","6601 WEST BROAD STREET",,RICHMOND,VA,VIRGINIA,"US Mid Atlantic",,,"=""2111""",Cigarettes,312221,"Cigarette Manufacturing",34,47,12/31/21,"86,400,294,912",12/31/21,"26,013,000,000","2,475,000,000","-19,089,000,000","39,523,000,000"
16557,"Other contingent liabilities","Tobacco and Health Litigation Provisions and Disclosures",475750,12/31/21,01/27/22,1,"PricewaterhouseCoopers LLP",,,,Richmond,VA,VIRGINIA,"US Mid Atlantic",10-K,2022-02-25,,"ALTRIA GROUP, INC.",764180,"=""MO""","6601 WEST BROAD STREET",,RICHMOND,VA,VIRGINIA,"US Mid Atlantic",,,"=""2111""",Cigarettes,312221,"Cigarette Manufacturing",34,47,12/31/21,"86,400,294,912",12/31/21,"26,013,000,000","2,475,000,000","-19,089,000,000","39,523,000,000"
16558,"Equity investments and joint ventures","JUUL Labs, Inc. (“JUUL”) - Determination of the Fair Value of the Investment",475750,12/31/21,01/27/22,1,"PricewaterhouseCoopers LLP",,,,Richmond,VA,VIRGINIA,"US Mid Atlantic",10-K,2022-02-25,,"ALTRIA GROUP, INC.",764180,"=""MO""","6601 WEST BROAD STREET",,RICHMOND,VA,VIRGINIA,"US Mid Atlantic",,,"=""2111""",Cigarettes,312221,"Cigarette Manufacturing",34,47,12/31/21,"86,400,294,912",12/31/21,"26,013,000,000","2,475,000,000","-19,089,000,000","39,523,000,000"
16559,"Equity investments and joint ventures","Impairment Assessment - Investment in Anheuser-Busch InBev SA/NV (“ABI”)",475750,12/31/21,01/27/22,1,"PricewaterhouseCoopers LLP",,,,Richmond,VA,VIRGINIA,"US Mid Atlantic",10-K,2022-02-25,,"ALTRIA GROUP, INC.",764180,"=""MO""","6601 WEST BROAD STREET",,RICHMOND,VA,VIRGINIA,"US Mid Atlantic",,,"=""2111""",Cigarettes,312221,"Cigarette Manufacturing",34,47,12/31/21,"86,400,294,912",12/31/21,"26,013,000,000","2,475,000,000","-19,089,000,000","39,523,000,000"
20494,"Property, plant and equipment","Impairment assessment of property, plant and equipment",484350,12/31/21,04/22/22,1,"PricewaterhouseCoopers LLP",94,"PricewaterhouseCoopers Zhong Tian LLP",1424,Shanghai,F4,CHINA,Foreign,20-F,2022-04-22,,"ALUMINUM CORP OF CHINA LTD",1161611,"=""ALMMF""","NO 12B FUXING ROAD","HAIDIAN DISTRICT",BEIJING,F4,CHINA,Foreign,,,"=""3334""","Primary Production of Aluminum",331312,"Primary Aluminum Production",34,14,12/29/21,"2,134,474,368",12/31/21,"46,896,114,000","1,775,656,000","7,397,936,000","35,281,731,000"
20495,Goodwill,"Impairment assessment of goodwill",484350,12/31/21,04/22/22,1,"PricewaterhouseCoopers LLP",94,"PricewaterhouseCoopers Zhong Tian LLP",1424,Shanghai,F4,CHINA,Foreign,20-F,2022-04-22,,"ALUMINUM CORP OF CHINA LTD",1161611,"=""ALMMF""","NO 12B FUXING ROAD","HAIDIAN DISTRICT",BEIJING,F4,CHINA,Foreign,,,"=""3334""","Primary Production of Aluminum",331312,"Primary Aluminum Production",34,14,12/29/21,"2,134,474,368",12/31/21,"46,896,114,000","1,775,656,000","7,397,936,000","35,281,731,000"
16810,"Research and development expenses","Assessment of clinical accruals",476184,12/31/21,02/28/22,4,"KPMG LLP",,,,"San Francisco",CA,CALIFORNIA,"US West",10-K,2022-02-28,,"ALX ONCOLOGY HOLDINGS INC",1810182,"=""ALXO""","323 ALLERTON AVENUE",,"SOUTH SAN FRANCISCO",CA,CALIFORNIA,"US West",,,"=""2834""","Pharmaceutical Preparations",325412,"Pharmaceutical Preparation Manufacturing",34,21,12/31/21,"872,216,064",12/31/21,,"-83,463,000",,"380,183,000"
17594,"Sales return and allowances","Product Return Reserve Estimate",476557,12/31/21,03/01/22,2,"Ernst & Young LLP",,,,Iselin,NJ,"NEW JERSEY","US Mid Atlantic",10-K,2022-03-01,,"AMARIN CORP PLC\UK",897448,"=""AMRN""","SPACES SOUTH DOCKLANDS, BLOCK C","77 SIR JOHN ROGERSON'S QUAY","ELY CAMBRIDGESHIRE",X0,"UNITED KINGDOM",Foreign,,,"=""2834""","Pharmaceutical Preparations",325412,"Pharmaceutical Preparation Manufacturing",34,3,12/31/21,"1,336,535,296",12/31/21,"583,187,000","7,729,000","643,552,000","1,068,065,000"
14471,"Uncertain tax positions","Income Taxes",473074,12/31/21,02/03/22,2,"Ernst & Young LLP",,,,Seattle,WA,WASHINGTON,"US West",10-K,2022-02-04,,"AMAZON COM INC",1018724,"=""AMZN""","410 TERRY AVENUE NORTH",,SEATTLE,WA,WASHINGTON,"US West",,,"=""5961""","Catalog and Mail-Order Houses",518210,"Data Processing, Hosting, and Related Services",34,"3,334",12/31/21,"1,697,179,107,328",12/31/21,"469,822,000,000","33,364,000,000","122,874,000,000","420,549,000,000"
10459,"Other income taxes","Accounting for Income Taxes",451393,01/31/21,03/31/21,1,"PricewaterhouseCoopers LLP",,,,"San Jose",CA,CALIFORNIA,"US West",10-K,2021-03-31,,"AMBARELLA INC",1280263,"=""AMBA""","3001 TASMAN DRIVE",,"SANTA CLARA",CA,CALIFORNIA,"US West",,,"=""3674""","Semiconductors and Related Devices",334413,"Semiconductor and Related Device Manufacturing",34,94,01/31/21,"3,354,256,384",01/31/21,"222,990,000","-59,786,000","429,672,000","573,280,000"
20897,Goodwill,"Goodwill impairment assessment",486114,12/31/21,04/29/22,1,"PricewaterhouseCoopers LLP",95,PricewaterhouseCoopers,1389,"Hong Kong",F4,CHINA,Foreign,20-F,2022-05-02,,"Amber International Holding Ltd",1697818,"=""AMBR""","1 WALLICH STREET","#30-02 GUOCO TOWER",SINGAPORE,U0,SINGAPORE,Foreign,,,"=""6199""","Finance Services",511210,"Software Publishers",34,5,12/31/21,"441,637,472",12/31/21,"307,702,000","-13,631,000","148,965,000","507,734,000"
20898,"Other investments","Impairment assessment of investments in equity securities without readily determinable fair value",486114,12/31/21,04/29/22,1,"PricewaterhouseCoopers LLP",95,PricewaterhouseCoopers,1389,"Hong Kong",F4,CHINA,Foreign,20-F,2022-05-02,,"Amber International Holding Ltd",1697818,"=""AMBR""","1 WALLICH STREET","#30-02 GUOCO TOWER",SINGAPORE,U0,SINGAPORE,Foreign,,,"=""6199""","Finance Services",511210,"Software Publishers",34,5,12/31/21,"441,637,472",12/31/21,"307,702,000","-13,631,000","148,965,000","507,734,000"
18852,"Other income taxes","Tax contingencies",480109,12/31/21,03/16/22,1,"PricewaterhouseCoopers LLP",91,"PricewaterhouseCoopers Auditores Independentes",1351,"São Paulo",D5,BRAZIL,Foreign,20-F,2022-03-18,,"AMBEV S.A.",1565025,"=""ABEV""","RUA DR. RENATO PAES DE BARROS, 1017","3 ANDAR PARTE","SAO PAULO",D5,BRAZIL,Foreign,,,"=""2080""",Beverages,312120,Breweries,34,3,12/29/21,"42,641,620,992",12/31/21,"13,079,800,000","2,355,900,000","5,663,000,000","24,883,800,000"
18853,"Other income taxes","PIS and COFINS Recovery - exclusion of ICMS (VAT tax) from the basis of calculation",480109,12/31/21,03/16/22,1,"PricewaterhouseCoopers LLP",91,"PricewaterhouseCoopers Auditores Independentes",1351,"São Paulo",D5,BRAZIL,Foreign,20-F,2022-03-18,,"AMBEV S.A.",1565025,"=""ABEV""","RUA DR. RENATO PAES DE BARROS, 1017","3 ANDAR PARTE","SAO PAULO",D5,BRAZIL,Foreign,,,"=""2080""",Beverages,312120,Breweries,34,3,12/29/21,"42,641,620,992",12/31/21,"13,079,800,000","2,355,900,000","5,663,000,000","24,883,800,000"
17241,Leases,"Valuation of operating leases",476988,12/31/21,03/01/22,2,"Ernst & Young LLP",,,,"Kansas City",MO,MISSOURI,"US Southeast",10-K,2022-03-01,,"AMC ENTERTAINMENT HOLDINGS, INC.",1411579,"=""AMC""","ONE AMC WAY","11500 ASH STREET",LEAWOOD,KS,KANSAS,"US Midwest",,,"=""7830""","Services-Motion Picture Theaters",512131,"Motion Picture Theaters (except Drive-Ins)",34,27,12/31/21,"13,980,231,680",12/31/21,"2,527,900,000","-1,269,100,000","-4,372,700,000","10,821,500,000"
14944,Goodwill,"Assessment of the carrying value of goodwill in the AMC Networks International (AMCNI) reporting unit",473887,12/31/21,02/16/22,4,"KPMG LLP",,,,"New York",NY,"NEW YORK","US Mid Atlantic",10-K,2022-02-16,,"AMC Networks Inc.",1514991,"=""AMCX""","11 PENN PLAZA",,"NEW YORK",NY,"NEW YORK","US Mid Atlantic",,,"=""4841""","Cable and Other Pay Television Services",515120,"Television Broadcasting",34,34,12/31/21,"1,063,920,512",12/31/21,"3,077,608,000","250,596,000","-1,705,679,000","5,748,946,000"
14945,"Depreciation and amortization","Assessment of amortization of owned original program rights predominantly monetized individually",473887,12/31/21,02/16/22,4,"KPMG LLP",,,,"New York",NY,"NEW YORK","US Mid Atlantic",10-K,2022-02-16,,"AMC Networks Inc.",1514991,"=""AMCX""","11 PENN PLAZA",,"NEW YORK",NY,"NEW YORK","US Mid Atlantic",,,"=""4841""","Cable and Other Pay Television Services",515120,"Television Broadcasting",34,34,12/31/21,"1,063,920,512",12/31/21,"3,077,608,000","250,596,000","-1,705,679,000","5,748,946,000"
12726,Goodwill,"Goodwill Impairment Assessment - Flexibles Latin America Reporting Unit within the Flexibles Segment",462385,06/30/21,08/24/21,1,"PricewaterhouseCoopers LLP",119,"PricewaterhouseCoopers AG",1358,Zurich,V8,SWITZERLAND,Foreign,10-K,2021-08-24,,"Amcor plc",1748790,"=""AMCR""","83 TOWER ROAD NORTH",,"WARMLEY, BRISTOL",X0,"UNITED KINGDOM",Foreign,,,"=""3990""","Miscellaneous Manufacturing Industries",322221,"Coated and Laminated Packaging Paper and Plastics Film Manufacturing",34,12,07/02/21,"17,792,290,816",06/30/21,"12,861,000,000","939,000,000","-2,490,000,000","17,188,000,000"
13835,"Revenue from customer contracts","Revenue recognition for projects",469145,09/30/21,12/09/21,2,"Ernst & Young LLP",,,,"New York",NY,"NEW YORK","US Mid Atlantic",20-F,2021-12-09,,"AMDOCS LTD",1062579,"=""DOX""","P.O BOX 263, HIRZEL HOUSE","SMITH STREET,","ST. PETER PORT",Y7,GUERNSEY,Foreign,,,"=""7371""","Computer Programming Services",541511,"Custom Computer Programming Services",34,76,09/28/21,"9,999,343,616",09/30/21,"4,288,640,000","688,374,000","710,999,000","6,511,774,000"
13836,"Uncertain tax positions","Uncertain Tax Positions",469145,09/30/21,12/09/21,2,"Ernst & Young LLP",,,,"New York",NY,"NEW YORK","US Mid Atlantic",20-F,2021-12-09,,"AMDOCS LTD",1062579,"=""DOX""","P.O BOX 263, HIRZEL HOUSE","SMITH STREET,","ST. PETER PORT",Y7,GUERNSEY,Foreign,,,"=""7371""","Computer Programming Services",541511,"Custom Computer Programming Services",34,76,09/28/21,"9,999,343,616",09/30/21,"4,288,640,000","688,374,000","710,999,000","6,511,774,000"
15959,"Business combinations","Acquisition of Contessa Health, Inc. – Evaluation of the fair value of noncontrolling interest and of certain intangible assets",475180,12/31/21,02/24/22,4,"KPMG LLP",,,,"Baton Rouge",LA,LOUISIANA,"US Southeast",10-K,2022-02-24,,"AMEDISYS INC",896262,,"3854 AMERICAN WAY","SUITE A","BATON ROUGE",LA,LOUISIANA,"US Southeast",,,"=""8082""","Home Health Care Services",621610,"Home Health Care Services",34,162,12/31/21,"5,262,713,856",12/31/21,"2,227,412,000","209,072,000","-375,929,000","1,856,968,000"
15960,"Revenue from customer contracts","Evaluation of the non-contractual revenue adjustment estimates for Home Health and Hospice",475180,12/31/21,02/24/22,4,"KPMG LLP",,,,"Baton Rouge",LA,LOUISIANA,"US Southeast",10-K,2022-02-24,,"AMEDISYS INC",896262,,"3854 AMERICAN WAY","SUITE A","BATON ROUGE",LA,LOUISIANA,"US Southeast",,,"=""8082""","Home Health Care Services",621610,"Home Health Care Services",34,162,12/31/21,"5,262,713,856",12/31/21,"2,227,412,000","209,072,000","-375,929,000","1,856,968,000"
15510,"Regulatory assets and liabilities","Accounting for the Effects of Regulation",474637,12/31/21,02/22/22,1,"PricewaterhouseCoopers LLP",,,,"Saint Louis",MO,MISSOURI,"US Southeast",10-K,2022-02-23,,"AMEREN CORP",1002910,"=""AEE""","1901 CHOUTEAU AVE","MC 1310","ST LOUIS",MO,MISSOURI,"US Southeast",,,"=""4931""","Electric and Other Services Combined",221122,"Electric Power Distribution",34,89,12/31/21,"22,937,876,480",12/31/21,"6,394,000,000","990,000,000","9,289,000,000","35,735,000,000"
15448,"Regulatory assets and liabilities","Accounting for the Effects of Regulation",474586,12/31/21,02/22/22,1,"PricewaterhouseCoopers LLP",,,,"Saint Louis",MO,MISSOURI,"US Southeast",10-K,2022-02-23,,"Ameren Illinois Co",18654,"=""AILIH""","10 RICHARD MARK WAY",,COLLINSVILLE,IL,ILLINOIS,"US Midwest",1002910,"AMEREN CORP","=""4931""","Electric and Other Services Combined",221121,"Electric Bulk Power Transmission and Control",34,,,,12/31/21,"2,895,000,000","427,000,000","5,229,000,000","15,035,000,000"
20766,"Deferred income taxes","Deferred tax assets, realizability of Net Operating Loss Carryforwards",485819,12/31/21,04/29/22,2,"Ernst & Young LLP",139,"Mancera SC",1284,"Mexico City",O5,MEXICO,Foreign,20-F,2022-04-29,,"AMERICA MOVIL SAB DE CV/",1129137,"=""AMX""","LAGO ZURICH 245",*,"COLONIA ANAHUAC",O5,MEXICO,Foreign,,,"=""4813""","Telephone Communications, Except Radiotelephone",517310,"Telecommunications Resellers",34,21,12/29/21,"48,120,844,288",12/31/21,"41,804,782,000","9,593,262,000","5,366,771,000","82,562,905,000"
20767,Goodwill,"Impairment of goodwill",485819,12/31/21,04/29/22,2,"Ernst & Young LLP",139,"Mancera SC",1284,"Mexico City",O5,MEXICO,Foreign,20-F,2022-04-29,,"AMERICA MOVIL SAB DE CV/",1129137,"=""AMX""","LAGO ZURICH 245",*,"COLONIA ANAHUAC",O5,MEXICO,Foreign,,,"=""4813""","Telephone Communications, Except Radiotelephone",517310,"Telecommunications Resellers",34,21,12/29/21,"48,120,844,288",12/31/21,"41,804,782,000","9,593,262,000","5,366,771,000","82,562,905,000"
20768,"Pension and other post-employment benefits","Discount rate used in determining defined benefit pension obligations in Mexico",485819,12/31/21,04/29/22,2,"Ernst & Young LLP",139,"Mancera SC",1284,"Mexico City",O5,MEXICO,Foreign,20-F,2022-04-29,,"AMERICA MOVIL SAB DE CV/",1129137,"=""AMX""","LAGO ZURICH 245",*,"COLONIA ANAHUAC",O5,MEXICO,Foreign,,,"=""4813""","Telephone Communications, Except Radiotelephone",517310,"Telecommunications Resellers",34,21,12/29/21,"48,120,844,288",12/31/21,"41,804,782,000","9,593,262,000","5,366,771,000","82,562,905,000"
15383,"Revenue from customer contracts","Estimate of mileage credits not expected to be redeemed",474423,12/31/21,02/22/22,4,"KPMG LLP",,,,Dallas,TX,TEXAS,"US Southwest",10-K,2022-02-22,,"American Airlines Group Inc.",6201,"=""AAL""","1 SKYVIEW DRIVE",,"FORT WORTH",TX,TEXAS,"US Southwest",,,"=""4512""","Air Transportation, Scheduled",481111,"Scheduled Passenger Air Transportation",34,18,12/31/21,"11,633,187,840",12/31/21,"29,882,000,000","-1,993,000,000","-13,419,000,000","66,467,000,000"
15384,"Deferred income taxes","Sufficiency of audit evidence over realizability of tax operating loss and other carryforwards",474423,12/31/21,02/22/22,4,"KPMG LLP",,,,Dallas,TX,TEXAS,"US Southwest",10-K,2022-02-22,,"American Airlines Group Inc.",6201,"=""AAL""","1 SKYVIEW DRIVE",,"FORT WORTH",TX,TEXAS,"US Southwest",,,"=""4512""","Air Transportation, Scheduled",481111,"Scheduled Passenger Air Transportation",34,18,12/31/21,"11,633,187,840",12/31/21,"29,882,000,000","-1,993,000,000","-13,419,000,000","66,467,000,000"
15364,"Revenue from customer contracts","Estimate of mileage credits not expected to be redeemed",474417,12/31/21,02/22/22,4,"KPMG LLP",,,,Dallas,TX,TEXAS,"US Southwest",10-K,2022-02-22,,"AMERICAN AIRLINES, INC.",4515,,"1 SKYVIEW DRIVE",,"FORT WORTH",TX,TEXAS,"US Southwest",6201,"American Airlines Group Inc.","=""4512""","Air Transportation, Scheduled",481111,"Scheduled Passenger Air Transportation",34,,,,12/31/21,"29,880,000,000","-1,777,000,000","-2,253,000,000","71,145,000,000"
15365,"Deferred income taxes","Sufficiency of audit evidence over realizability of tax operating loss and other carryforwards",474417,12/31/21,02/22/22,4,"KPMG LLP",,,,Dallas,TX,TEXAS,"US Southwest",10-K,2022-02-22,,"AMERICAN AIRLINES, INC.",4515,,"1 SKYVIEW DRIVE",,"FORT WORTH",TX,TEXAS,"US Southwest",6201,"American Airlines Group Inc.","=""4512""","Air Transportation, Scheduled",481111,"Scheduled Passenger Air Transportation",34,,,,12/31/21,"29,880,000,000","-1,777,000,000","-2,253,000,000","71,145,000,000"
14721,"Real estate investments","Impairment of real estate properties",473587,12/31/21,02/11/22,2,"Ernst & Young LLP",,,,"San Diego",CA,CALIFORNIA,"US West",10-K,2022-02-11,,"American Assets Trust, Inc.",1500217,"=""AAT""","3420 CARMEL MOUNTAIN ROAD","SUITE 100","SAN DIEGO",CA,CALIFORNIA,"US West",,,"=""6798""","Real Estate Investment Trusts",525990,"Other Financial Vehicles",34,38,12/31/21,"2,271,525,120",12/31/21,"375,828,000","28,376,000",,"3,017,927,000"
14722,"Business combinations","Property asset acquisitions",473587,12/31/21,02/11/22,2,"Ernst & Young LLP",,,,"San Diego",CA,CALIFORNIA,"US West",10-K,2022-02-11,,"American Assets Trust, Inc.",1500217,"=""AAT""","3420 CARMEL MOUNTAIN ROAD","SUITE 100","SAN DIEGO",CA,CALIFORNIA,"US West",,,"=""6798""","Real Estate Investment Trusts",525990,"Other Financial Vehicles",34,38,12/31/21,"2,271,525,120",12/31/21,"375,828,000","28,376,000",,"3,017,927,000"
14690,"Real estate investments","Impairment of real estate properties",473546,12/31/21,02/11/22,2,"Ernst & Young LLP",,,,"San Diego",CA,CALIFORNIA,"US West",10-K,2022-02-11,,"American Assets Trust, L.P.",1509570,,"11455 EL CAMINO REAL","SUITE 200","SAN DIEGO",CA,CALIFORNIA,"US West",,,"=""6798""","Real Estate Investment Trusts",525990,"Other Financial Vehicles",34,,,,12/31/21,"375,828,000","36,593,000",,"3,017,927,000"
14691,"Business combinations","Property asset acquisitions",473546,12/31/21,02/11/22,2,"Ernst & Young LLP",,,,"San Diego",CA,CALIFORNIA,"US West",10-K,2022-02-11,,"American Assets Trust, L.P.",1509570,,"11455 EL CAMINO REAL","SUITE 200","SAN DIEGO",CA,CALIFORNIA,"US West",,,"=""6798""","Real Estate Investment Trusts",525990,"Other Financial Vehicles",34,,,,12/31/21,"375,828,000","36,593,000",,"3,017,927,000"
14681,"Other income taxes","Income Taxes — Refer to Notes 1 and 9 to the consolidated financial statements",473433,12/31/21,02/11/22,3,"Deloitte & Touche LLP",,,,Detroit,MI,MICHIGAN,"US Midwest",10-K,2022-02-11,,"AMERICAN AXLE & MANUFACTURING HOLDINGS INC",1062231,"=""AXL""","ONE DAUCH DRIVE",,DETROIT,MI,MICHIGAN,"US Midwest",,,"=""3714""","Motor Vehicle Parts and Accessories",336350,"Motor Vehicle Transmission and Power Train Parts Manufacturing",34,9,12/31/21,"1,063,619,968",12/31/21,"5,156,600,000","5,900,000","-423,200,000","5,635,700,000"
14682,Goodwill,"Goodwill Impairment Analysis — Refer to Notes 1 and 3 to the consolidated financial statements",473433,12/31/21,02/11/22,3,"Deloitte & Touche LLP",,,,Detroit,MI,MICHIGAN,"US Midwest",10-K,2022-02-11,,"AMERICAN AXLE & MANUFACTURING HOLDINGS INC",1062231,"=""AXL""","ONE DAUCH DRIVE",,DETROIT,MI,MICHIGAN,"US Midwest",,,"=""3714""","Motor Vehicle Parts and Accessories",336350,"Motor Vehicle Transmission and Power Train Parts Manufacturing",34,9,12/31/21,"1,063,619,968",12/31/21,"5,156,600,000","5,900,000","-423,200,000","5,635,700,000"
17067,"Real estate investments","Impairment of Long-Lived Assets",476238,12/31/21,02/28/22,2,"Ernst & Young LLP",,,,Austin,TX,TEXAS,"US Southwest",10-K,2022-02-28,,"AMERICAN CAMPUS COMMUNITIES INC",1283630,,"805 LAS CIMAS PARKWAY","SUITE 400",AUSTIN,TX,TEXAS,"US Southwest",,,"=""6798""","Real Estate Investment Trusts",525990,"Other Financial Vehicles",34,57,12/31/21,"7,966,988,800",12/31/21,"942,409,000","35,489,000",,"7,574,586,000"
18628,"Insurance contract liabilities","LIABILITY FOR UNPAID LOSSES AND LOSS ADJUSTMENT EXPENSE (LAE)- Refer to Notes 2 and 10 to the Financial Statements",479666,12/31/21,03/15/22,3,"Deloitte & Touche LLP",,,,Tampa,FL,FLORIDA,"US Southeast",10-K,2022-03-15,,"AMERICAN COASTAL INSURANCE Corp",1401521,"=""ACIC""","570 CARILLON PARKWAY","SUITE 100","SAINT PETERSBURG",FL,FLORIDA,"US Southeast",,,"=""6331""","Fire, Marine, and Casualty Insurance",524126,"Direct Property and Casualty Insurance Carriers",34,4,12/29/21,"188,809,232",12/31/21,"228,685,000","-57,919,000","220,986,000","2,698,573,000"
8954,"Property, plant and equipment","Retail Store Long-Lived Asset Impairment",448411,01/30/21,03/11/21,2,"Ernst & Young LLP",,,,Pittsburgh,PA,PENNSYLVANIA,"US Mid Atlantic",10-K,2021-03-11,,"AMERICAN EAGLE OUTFITTERS INC",919012,"=""AEO""","77 HOT METAL STREET",,PITTSBURGH,PA,PENNSYLVANIA,"US Mid Atlantic",,,"=""5651""","Family Clothing Stores",448140,"Family Clothing Stores",34,23,01/31/21,"3,774,141,184",01/30/21,"3,759,113,000","-209,274,000","1,016,333,000","3,434,806,000"
15936,"Regulatory assets and liabilities","Accounting for the Effects of Cost-Based Regulation",474972,12/31/21,02/24/22,1,"PricewaterhouseCoopers LLP",,,,Columbus,OH,OHIO,"US Midwest",10-K,2022-02-24,,"AMERICAN ELECTRIC POWER CO INC",4904,"=""AEP""","1 RIVERSIDE PLAZA",,COLUMBUS,OH,OHIO,"US Midwest",,,"=""4911""","Electric Services",221122,"Electric Power Distribution",34,89,12/29/21,"44,613,464,064",12/31/21,"16,792,000,000","2,488,100,000","22,424,000,000","87,668,700,000"
15937,"Derivatives and hedging","Valuation of Level 3 Risk Management Commodity Contracts",474972,12/31/21,02/24/22,1,"PricewaterhouseCoopers LLP",,,,Columbus,OH,OHIO,"US Midwest",10-K,2022-02-24,,"AMERICAN ELECTRIC POWER CO INC",4904,"=""AEP""","1 RIVERSIDE PLAZA",,COLUMBUS,OH,OHIO,"US Midwest",,,"=""4911""","Electric Services",221122,"Electric Power Distribution",34,89,12/29/21,"44,613,464,064",12/31/21,"16,792,000,000","2,488,100,000","22,424,000,000","87,668,700,000"
14719,"Allowance for credit losses","Reserves for Credit Losses on Card Member Loans",473590,12/31/21,02/11/22,1,"PricewaterhouseCoopers LLP",,,,"New York",NY,"NEW YORK","US Mid Atlantic",10-K,2022-02-11,,"AMERICAN EXPRESS CO",4962,"=""AXP""","200 VESEY STREET","50TH FLOOR","NEW YORK",NY,"NEW YORK","US Mid Atlantic",,,"=""6199""","Finance Services",523930,"Investment Advice",34,164,12/31/21,"124,499,599,360",12/31/21,"43,799,000,000","8,060,000,000",,"188,548,000,000"
14720,"Other liabilities and provisions","Membership Rewards Liability",473590,12/31/21,02/11/22,1,"PricewaterhouseCoopers LLP",,,,"New York",NY,"NEW YORK","US Mid Atlantic",10-K,2022-02-11,,"AMERICAN EXPRESS CO",4962,"=""AXP""","200 VESEY STREET","50TH FLOOR","NEW YORK",NY,"NEW YORK","US Mid Atlantic",,,"=""6199""","Finance Services",523930,"Investment Advice",34,164,12/31/21,"124,499,599,360",12/31/21,"43,799,000,000","8,060,000,000",,"188,548,000,000"
16686,"Other investments","Valuation of investments in securities",475837,12/31/21,02/25/22,2,"Ernst & Young LLP",,,,Cincinnati,OH,OHIO,"US Midwest",10-K,2022-02-25,,"AMERICAN FINANCIAL GROUP INC",1042046,"=""AFG""","GREAT AMERICAN INSURANCE GROUP TOWER","301 E. 4TH STREET",CINCINNATI,OH,OHIO,"US Midwest",,,"=""6331""","Fire, Marine, and Casualty Insurance",524126,"Direct Property and Casualty Insurance Carriers",34,139,12/29/21,"11,792,535,552",12/31/21,"6,552,000,000","1,995,000,000","4,766,000,000","28,931,000,000"
16687,"Insurance contract liabilities","Property and casualty unpaid losses and loss adjustment expenses",475837,12/31/21,02/25/22,2,"Ernst & Young LLP",,,,Cincinnati,OH,OHIO,"US Midwest",10-K,2022-02-25,,"AMERICAN FINANCIAL GROUP INC",1042046,"=""AFG""","GREAT AMERICAN INSURANCE GROUP TOWER","301 E. 4TH STREET",CINCINNATI,OH,OHIO,"US Midwest",,,"=""6331""","Fire, Marine, and Casualty Insurance",524126,"Direct Property and Casualty Insurance Carriers",34,139,12/29/21,"11,792,535,552",12/31/21,"6,552,000,000","1,995,000,000","4,766,000,000","28,931,000,000"
19171,"Business combinations","Merger of Griffin-American Healthcare REIT III, Inc. and Griffin-American Healthcare REIT IV, Inc. — Real Estate Investments Purchase Price Allocation — Refer to Notes 1, 2 and 3 to the financial statements",480766,12/31/21,03/25/22,3,"Deloitte & Touche LLP",,,,"Costa Mesa",CA,CALIFORNIA,"US West",10-K,2022-03-25,,"American Healthcare REIT, Inc.",1632970,"=""AHR""","18191 VON KARMAN AVENUE","SUITE 300",IRVINE,CA,CALIFORNIA,"US West",,,"=""6798""","Real Estate Investment Trusts",525990,"Other Financial Vehicles",34,,,,12/31/21,"1,282,254,000","-53,269,000","1,370,802,000","4,580,339,000"
19172,"Long-lived assets","Impairment of Long-Lived Assets relating to historical GAHR III real estate investments — Refer to Note 2 to the financial statements",480766,12/31/21,03/25/22,3,"Deloitte & Touche LLP",,,,"Costa Mesa",CA,CALIFORNIA,"US West",10-K,2022-03-25,,"American Healthcare REIT, Inc.",1632970,"=""AHR""","18191 VON KARMAN AVENUE","SUITE 300",IRVINE,CA,CALIFORNIA,"US West",,,"=""6798""","Real Estate Investment Trusts",525990,"Other Financial Vehicles",34,,,,12/31/21,"1,282,254,000","-53,269,000","1,370,802,000","4,580,339,000"
22406,"Business combinations","Merger of Griffin-American Healthcare REIT III, Inc. and Griffin-American Healthcare REIT IV, Inc.—Real Estate Investments Purchase Price Allocation—Refer to Notes 1, 2 and 3 to the financial statements",492100,12/31/21,03/25/22,3,"Deloitte & Touche LLP",,,,"Costa Mesa",CA,CALIFORNIA,"US West",S-11,2022-09-16,,"American Healthcare REIT, Inc.",1632970,"=""AHR""","18191 VON KARMAN AVENUE","SUITE 300",IRVINE,CA,CALIFORNIA,"US West",,,"=""6798""","Real Estate Investment Trusts",525990,"Other Financial Vehicles",34,,,,12/31/21,"1,282,254,000","-53,269,000","1,370,802,000","4,580,339,000"
22407,"Long-lived assets","Impairment of Long-Lived Assets relating to historical GAHR III real estate investments—Refer to Note 2 to the financial statements",492100,12/31/21,03/25/22,3,"Deloitte & Touche LLP",,,,"Costa Mesa",CA,CALIFORNIA,"US West",S-11,2022-09-16,,"American Healthcare REIT, Inc.",1632970,"=""AHR""","18191 VON KARMAN AVENUE","SUITE 300",IRVINE,CA,CALIFORNIA,"US West",,,"=""6798""","Real Estate Investment Trusts",525990,"Other Financial Vehicles",34,,,,12/31/21,"1,282,254,000","-53,269,000","1,370,802,000","4,580,339,000"
16602,"Business combinations","Purchase price accounting",475862,12/31/21,02/25/22,2,"Ernst & Young LLP",,,,"Los Angeles",CA,CALIFORNIA,"US West",10-K,2022-02-25,,"American Homes 4 Rent",1562401,"=""AMH""","280 PILOT ROAD",,"LAS VEGAS",NV,NEVADA,"US West",,,"=""6798""","Real Estate Investment Trusts",525990,"Other Financial Vehicles",34,44,12/31/21,"14,712,387,584",12/31/21,"1,303,882,000","189,092,000","5,939,292,000","10,962,433,000"
16474,"Business combinations","Purchase price accounting",475896,12/31/21,02/25/22,2,"Ernst & Young LLP",,,,"Los Angeles",CA,CALIFORNIA,"US West",10-K,2022-02-25,,"American Homes 4 Rent, L.P.",1716558,,"280 PILOT ROAD",,"LAS VEGAS",NV,NEVADA,"US West",1562401,"American Homes 4 Rent","=""6798""","Real Estate Investment Trusts",531110,"Lessors of Residential Buildings and Dwellings",34,,,,12/31/21,"1,303,882,000","210,559,000","6,618,150,000","10,962,433,000"
12159,"Allowance for credit losses","Allowance for expected credit losses on retail loans",458957,03/31/21,06/24/21,4,"KPMG LLP",,,,"Los Angeles",CA,CALIFORNIA,"US West",10-K,2021-06-24,,"AMERICAN HONDA FINANCE CORP",864270,,"1919 TORRANCE BLVD.",,TORRANCE,CA,CALIFORNIA,"US West",715153,"HONDA MOTOR CO LTD","=""6141""","Personal Credit Institutions",522291,"Consumer Lending",34,,,,03/31/21,"8,776,000,000","1,912,000,000",,"80,802,000,000"
12160,Leases,"Estimated early termination losses on operating receivables",458957,03/31/21,06/24/21,4,"KPMG LLP",,,,"Los Angeles",CA,CALIFORNIA,"US West",10-K,2021-06-24,,"AMERICAN HONDA FINANCE CORP",864270,,"1919 TORRANCE BLVD.",,TORRANCE,CA,CALIFORNIA,"US West",715153,"HONDA MOTOR CO LTD","=""6141""","Personal Credit Institutions",522291,"Consumer Lending",34,,,,03/31/21,"8,776,000,000","1,912,000,000",,"80,802,000,000"
12161,Leases,"Estimated end of term residual values of lease vehicles",458957,03/31/21,06/24/21,4,"KPMG LLP",,,,"Los Angeles",CA,CALIFORNIA,"US West",10-K,2021-06-24,,"AMERICAN HONDA FINANCE CORP",864270,,"1919 TORRANCE BLVD.",,TORRANCE,CA,CALIFORNIA,"US West",715153,"HONDA MOTOR CO LTD","=""6141""","Personal Credit Institutions",522291,"Consumer Lending",34,,,,03/31/21,"8,776,000,000","1,912,000,000",,"80,802,000,000"
15156,"Other investments","Valuation of Certain Level 3 Fixed Maturity Securities",474023,12/31/21,02/17/22,1,"PricewaterhouseCoopers LLP",,,,"New York",NY,"NEW YORK","US Mid Atlantic",10-K,2022-02-17,,"AMERICAN INTERNATIONAL GROUP, INC.",5272,"=""AIG""","1271 AVE OF THE AMERICAS","FL 37","NEW YORK",NY,"NEW YORK","US Mid Atlantic",,,"=""6331""","Fire, Marine, and Casualty Insurance",524130,"Reinsurance Carriers",34,57,12/31/21,"46,550,564,864",12/31/21,"52,057,000,000","9,388,000,000",,"596,112,000,000"
15157,"Insurance contract liabilities","Valuation of Insurance Liabilities - Unpaid Losses and Loss Adjustment Expenses (Loss Reserves), Net of Reinsurance",474023,12/31/21,02/17/22,1,"PricewaterhouseCoopers LLP",,,,"New York",NY,"NEW YORK","US Mid Atlantic",10-K,2022-02-17,,"AMERICAN INTERNATIONAL GROUP, INC.",5272,"=""AIG""","1271 AVE OF THE AMERICAS","FL 37","NEW YORK",NY,"NEW YORK","US Mid Atlantic",,,"=""6331""","Fire, Marine, and Casualty Insurance",524130,"Reinsurance Carriers",34,57,12/31/21,"46,550,564,864",12/31/21,"52,057,000,000","9,388,000,000",,"596,112,000,000"
15158,"Insurance contract liabilities","Valuation of Embedded Derivatives for Variable Annuity and Fixed Index Annuity Products and Valuation of Certain Guaranteed Benefit Features for Universal Life Products",474023,12/31/21,02/17/22,1,"PricewaterhouseCoopers LLP",,,,"New York",NY,"NEW YORK","US Mid Atlantic",10-K,2022-02-17,,"AMERICAN INTERNATIONAL GROUP, INC.",5272,"=""AIG""","1271 AVE OF THE AMERICAS","FL 37","NEW YORK",NY,"NEW YORK","US Mid Atlantic",,,"=""6331""","Fire, Marine, and Casualty Insurance",524130,"Reinsurance Carriers",34,57,12/31/21,"46,550,564,864",12/31/21,"52,057,000,000","9,388,000,000",,"596,112,000,000"
15159,"Depreciation and amortization","Valuation of Deferred Policy Acquisition Costs for Universal Life and Individual Retirement Variable Annuity Products",474023,12/31/21,02/17/22,1,"PricewaterhouseCoopers LLP",,,,"New York",NY,"NEW YORK","US Mid Atlantic",10-K,2022-02-17,,"AMERICAN INTERNATIONAL GROUP, INC.",5272,"=""AIG""","1271 AVE OF THE AMERICAS","FL 37","NEW YORK",NY,"NEW YORK","US Mid Atlantic",,,"=""6331""","Fire, Marine, and Casualty Insurance",524130,"Reinsurance Carriers",34,57,12/31/21,"46,550,564,864",12/31/21,"52,057,000,000","9,388,000,000",,"596,112,000,000"
15160,"Deferred income taxes","Recoverability of U.S. Federal Deferred Tax Asset",474023,12/31/21,02/17/22,1,"PricewaterhouseCoopers LLP",,,,"New York",NY,"NEW YORK","US Mid Atlantic",10-K,2022-02-17,,"AMERICAN INTERNATIONAL GROUP, INC.",5272,"=""AIG""","1271 AVE OF THE AMERICAS","FL 37","NEW YORK",NY,"NEW YORK","US Mid Atlantic",,,"=""6331""","Fire, Marine, and Casualty Insurance",524130,"Reinsurance Carriers",34,57,12/31/21,"46,550,564,864",12/31/21,"52,057,000,000","9,388,000,000",,"596,112,000,000"
16466,"Insurance contract liabilities","Policyholders’ Account Balances – Valuation of embedded derivative liabilities for equity-indexed contracts — Refer to Notes 7 and 9 to the financial statements",475902,12/31/21,02/25/22,3,"Deloitte & Touche LLP",,,,Houston,TX,TEXAS,"US Southwest",10-K,2022-02-25,,"American National Group Inc",1801075,,"ONE MOODY PLAZA",,GALVESTON,TX,TEXAS,"US Southwest",,,"=""6311""","Life Insurance",524113,"Direct Life Insurance Carriers",34,189,12/31/21,"5,077,378,848",12/31/21,"4,391,791,000","699,336,072",,"31,320,321,000"
16467,"Insurance contract liabilities","Policy and Contract Claims – Property and casualty liability for unpaid claims and claim adjustment expenses — Refer to Notes 2 and 12 to the financial statements",475902,12/31/21,02/25/22,3,"Deloitte & Touche LLP",,,,Houston,TX,TEXAS,"US Southwest",10-K,2022-02-25,,"American National Group Inc",1801075,,"ONE MOODY PLAZA",,GALVESTON,TX,TEXAS,"US Southwest",,,"=""6311""","Life Insurance",524113,"Direct Life Insurance Carriers",34,189,12/31/21,"5,077,378,848",12/31/21,"4,391,791,000","699,336,072",,"31,320,321,000"
17365,"Deferred and capitalized costs","Deferred Policy Acquisition Costs (DAC), Deferred Sales Inducements (DSI) and liability for Lifetime Income Benefit Rider (LIBR)",476859,12/31/21,03/01/22,2,"Ernst & Young LLP",,,,"Des Moines",IA,IOWA,"US Midwest",10-K,2022-03-01,,"American National Group Inc.",1039828,"=""AEL.A""","6000 WESTOWN PARKWAY",,"WEST DES MOINES",IA,IOWA,"US Midwest",,,"=""6311""","Life Insurance",524113,"Direct Life Insurance Carriers",34,39,12/31/21,"3,600,626,176",12/31/21,"3,689,961,000","553,023,000",,"78,349,109,000"
17366,"Insurance contract liabilities","Fixed Index Annuity Embedded Derivative Liability",476859,12/31/21,03/01/22,2,"Ernst & Young LLP",,,,"Des Moines",IA,IOWA,"US Midwest",10-K,2022-03-01,,"American National Group Inc.",1039828,"=""AEL.A""","6000 WESTOWN PARKWAY",,"WEST DES MOINES",IA,IOWA,"US Midwest",,,"=""6311""","Life Insurance",524113,"Direct Life Insurance Carriers",34,39,12/31/21,"3,600,626,176",12/31/21,"3,689,961,000","553,023,000",,"78,349,109,000"
17685,"Business combinations","Accounting for Acquisition of Rasmussen University — Refer to Note 3 to the financial statements",477161,12/31/21,03/02/22,3,"Deloitte & Touche LLP",,,,McLean,VA,VIRGINIA,"US Mid Atlantic",10-K,2022-03-02,,"AMERICAN PUBLIC EDUCATION INC",1201792,"=""APEI""","111 W CONGRESS STREET",,"CHARLES TOWN",WV,"WEST VIRGINIA","US Mid Atlantic",,,"=""8200""","Services-Educational Services",923110,"Administration of Education Programs",34,22,12/31/21,"416,275,264",12/31/21,"418,803,000","17,752,000","87,044,000","725,608,000"
21990,"Business combinations","Accounting for Acquisition of Rasmussen University — Refer to Note 3 to the financial statements",490543,12/31/21,03/02/22,3,"Deloitte & Touche LLP",,,,McLean,VA,VIRGINIA,"US Mid Atlantic",10-K/A,2022-08-08,,"AMERICAN PUBLIC EDUCATION INC",1201792,"=""APEI""","111 W CONGRESS STREET",,"CHARLES TOWN",WV,"WEST VIRGINIA","US Mid Atlantic",,,"=""8200""","Services-Educational Services",923110,"Administration of Education Programs",34,22,12/31/21,"416,275,264",12/31/21,"418,803,000","17,752,000","87,044,000","725,608,000"
15532,"Regulatory assets and liabilities","Accounting for the Effects of Rate Regulation",474695,12/31/21,02/22/22,1,"PricewaterhouseCoopers LLP",,,,"Los Angeles",CA,CALIFORNIA,"US West",10-K,2022-02-22,,"AMERICAN STATES WATER CO",1056903,"=""AWR""","630 E FOOTHILL BLVD",,"SAN DIMAS",CA,CALIFORNIA,"US West",,,"=""4941""","Water Supply",221310,"Water Supply and Irrigation Systems",34,103,12/31/21,"3,820,689,408",12/31/21,"498,853,000","94,347,000","684,831,000","1,900,983,000"
18849,"Real estate investments","Impairment Assessment of Real Estate Investments, including Acquired Intangible Assets and Below-Market Lease Liabilities",480110,12/31/21,03/18/22,1,"PricewaterhouseCoopers LLP",,,,"New York",NY,"NEW YORK","US Mid Atlantic",10-K,2022-03-18,,"American Strategic Investment Co.",1595527,"=""NYC""","222 BELLEVUE AVENUE",,NEWPORT,RI,"RHODE ISLAND","US New England",,,"=""6798""","Real Estate Investment Trusts",531120,"Lessors of Nonresidential Buildings (except Miniwarehouses)",34,11,12/31/21,"140,876,800",12/31/21,"70,219,000","-39,466,000","251,511,000","823,051,000"
16247,"Business combinations","Telxius Acquisition – Refer to Notes 1, 5 and 6 to the financial statements",475592,12/31/21,02/24/22,3,"Deloitte & Touche LLP",,,,Boston,MA,MASSACHUSETTS,"US New England",10-K,2022-02-25,,"AMERICAN TOWER CORP /MA/",1053507,"=""AMT""","116 HUNTINGTON AVE",,BOSTON,MA,MASSACHUSETTS,"US New England",,,"=""6798""","Real Estate Investment Trusts",525930,"Real Estate Investment Trusts",34,293,12/31/21,"133,313,306,624",12/31/21,"9,356,900,000","2,567,700,000","-28,996,100,000","69,887,900,000"
14929,"Regulatory assets and liabilities","Accounting for the Effects of Rate Regulation",473915,12/31/21,02/16/22,1,"PricewaterhouseCoopers LLP",,,,Philadelphia,PA,PENNSYLVANIA,"US Mid Atlantic",10-K,2022-02-16,,"American Water Works Company, Inc.",1410636,"=""AWK""","1 WATER STREET",,CAMDEN,NJ,"NEW JERSEY","US Mid Atlantic",,,"=""4941""","Water Supply",221310,"Water Supply and Irrigation Systems",34,189,12/31/21,"34,299,070,464",12/31/21,"3,930,000,000","1,263,000,000","6,162,000,000","26,075,000,000"
17080,"Revenue from customer contracts","Revenue Recognition - Platform Subscription and Visits",476192,12/31/21,02/28/22,1,"PricewaterhouseCoopers LLP",,,,Boston,MA,MASSACHUSETTS,"US New England",10-K,2022-02-28,,"American Well Corp",1393584,"=""AMWL""","75 STATE STREET","26TH FLOOR",Boston,MA,MASSACHUSETTS,"US New England",,,"=""7389""","Business Services, NEC",923120,"Administration of Public Health Programs",34,6,12/31/21,"1,385,590,784",12/31/21,"252,789,000","-176,334,000","644,088,000","1,445,836,000"
17081,"Business combinations","Valuation of Customer Relationships and Technology Intangible Assets - SilverCloud Health Holdings, Inc.",476192,12/31/21,02/28/22,1,"PricewaterhouseCoopers LLP",,,,Boston,MA,MASSACHUSETTS,"US New England",10-K,2022-02-28,,"American Well Corp",1393584,"=""AMWL""","75 STATE STREET","26TH FLOOR",Boston,MA,MASSACHUSETTS,"US New England",,,"=""7389""","Business Services, NEC",923120,"Administration of Public Health Programs",34,6,12/31/21,"1,385,590,784",12/31/21,"252,789,000","-176,334,000","644,088,000","1,445,836,000"
17082,"Business combinations","Valuation of Technology Intangible Asset - Conversa Health, Inc.",476192,12/31/21,02/28/22,1,"PricewaterhouseCoopers LLP",,,,Boston,MA,MASSACHUSETTS,"US New England",10-K,2022-02-28,,"American Well Corp",1393584,"=""AMWL""","75 STATE STREET","26TH FLOOR",Boston,MA,MASSACHUSETTS,"US New England",,,"=""7389""","Business Services, NEC",923120,"Administration of Public Health Programs",34,6,12/31/21,"1,385,590,784",12/31/21,"252,789,000","-176,334,000","644,088,000","1,445,836,000"
12239,Goodwill,"Assessment of goodwill recoverability",459322,04/30/21,06/29/21,4,"KPMG LLP",,,,Richmond,VA,VIRGINIA,"US Mid Atlantic",10-K,2021-06-29,,"AMERICAN WOODMARK CORP",794619,"=""AMWD""","3102 SHAWNEE DRIVE",,WINCHESTER,VA,VIRGINIA,"US Mid Atlantic",,,"=""2430""","Millwood, Veneer, Plywood, & Structural Wood Members",337110,"Wood Kitchen Cabinet and Countertop Manufacturing",34,99,04/30/21,"1,671,037,568",04/30/21,"1,744,014,000","58,763,000","-146,494,000","1,636,514,000"
17317,"Business combinations","Accounting for the Acquisition of Agro Merchants",476830,12/31/21,03/01/22,2,"Ernst & Young LLP",,,,Atlanta,GA,GEORGIA,"US Southeast",10-K,2022-03-01,,"AMERICOLD REALTY TRUST",1455863,"=""COLD""","10 Glenlake Pkwy., Suite 800 S. Tower",,Atlanta,GA,GEORGIA,"US Southeast",,,"=""6798""","Real Estate Investment Trusts",525990,"Other Financial Vehicles",34,33,12/31/21,"8,796,986,368",12/31/21,"2,714,790,000","-30,455,000","1,854,922,000","8,104,058,000"
17318,Goodwill,"Test of Goodwill for Impairment",476830,12/31/21,03/01/22,2,"Ernst & Young LLP",,,,Atlanta,GA,GEORGIA,"US Southeast",10-K,2022-03-01,,"AMERICOLD REALTY TRUST",1455863,"=""COLD""","10 Glenlake Pkwy., Suite 800 S. Tower",,Atlanta,GA,GEORGIA,"US Southeast",,,"=""6798""","Real Estate Investment Trusts",525990,"Other Financial Vehicles",34,33,12/31/21,"8,796,986,368",12/31/21,"2,714,790,000","-30,455,000","1,854,922,000","8,104,058,000"
16510,"Other investments","Valuation of Certain Level 2 and Level 3 Available-for-Sale Securities",475975,12/31/21,02/25/22,1,"PricewaterhouseCoopers LLP",,,,Minneapolis,MN,MINNESOTA,"US Midwest",10-K,2022-02-25,,"AMERIPRISE CERTIFICATE CO",52428,,"50606 AMERIPRISE FINANCIAL CENTER",,MINNEAPOLIS,MN,MINNESOTA,"US Midwest",820027,"AMERIPRISE FINANCIAL INC",,,525990,"Other Financial Vehicles",34,,,,12/31/21,"68,540,000","23,193,000","320,030,000","5,300,489,000"
16422,"Insurance contract liabilities","Valuation of the reserves for long term care policies",475989,12/31/21,02/25/22,1,"PricewaterhouseCoopers LLP",,,,Minneapolis,MN,MINNESOTA,"US Midwest",10-K,2022-02-25,,"AMERIPRISE FINANCIAL INC",820027,"=""AMP""","1099 AMERIPRISE FINANCIAL CENTER",,MINNEAPOLIS,MN,MINNESOTA,"US Midwest",,,"=""6282""","Investment Advice",523930,"Investment Advice",34,302,12/31/21,"33,442,332,672",12/31/21,"13,443,000,000","2,760,000,000",,"175,979,000,000"
16423,"Other debt","Valuation of the embedded derivatives in certain variable annuity riders",475989,12/31/21,02/25/22,1,"PricewaterhouseCoopers LLP",,,,Minneapolis,MN,MINNESOTA,"US Midwest",10-K,2022-02-25,,"AMERIPRISE FINANCIAL INC",820027,"=""AMP""","1099 AMERIPRISE FINANCIAL CENTER",,MINNEAPOLIS,MN,MINNESOTA,"US Midwest",,,"=""6282""","Investment Advice",523930,"Investment Advice",34,302,12/31/21,"33,442,332,672",12/31/21,"13,443,000,000","2,760,000,000",,"175,979,000,000"
16424,"Insurance contract liabilities","Valuation of certain guarantees on variable annuity and certain life insurance policies accounted for as insurance liabilities",475989,12/31/21,02/25/22,1,"PricewaterhouseCoopers LLP",,,,Minneapolis,MN,MINNESOTA,"US Midwest",10-K,2022-02-25,,"AMERIPRISE FINANCIAL INC",820027,"=""AMP""","1099 AMERIPRISE FINANCIAL CENTER",,MINNEAPOLIS,MN,MINNESOTA,"US Midwest",,,"=""6282""","Investment Advice",523930,"Investment Advice",34,302,12/31/21,"33,442,332,672",12/31/21,"13,443,000,000","2,760,000,000",,"175,979,000,000"
16885,"Allowance for credit losses","Allowance for credit losses on loans evaluated on a collective basis",476466,12/31/21,02/28/22,4,"KPMG LLP",,,,Atlanta,GA,GEORGIA,"US Southeast",10-K,2022-02-28,,"Ameris Bancorp",351569,"=""ABCB""","3490 PIEDMONT RD","SUITE 1550",ATLANTA,GA,GEORGIA,"US Southeast",,,"=""6022""","State Commercial Banks",522110,"Commercial Banking",34,50,12/31/21,"3,458,186,496",12/31/21,"1,056,236,000","376,913,000","1,827,893,000","23,858,321,000"
16653,"Insurance contract liabilities","Valuation of Loss and Loss Adjustment Expense reserves",475820,12/31/21,02/25/22,2,"Ernst & Young LLP",,,,Philadelphia,PA,PENNSYLVANIA,"US Mid Atlantic",10-K,2022-02-25,,"AMERISAFE INC",1018979,"=""AMSF""","2301 HIGHWAY 190 WEST",,DERIDDER,LA,LOUISIANA,"US Southeast",,,"=""6331""","Fire, Marine, and Casualty Insurance",524126,"Direct Property and Casualty Insurance Carriers",34,54,12/31/21,"1,042,367,040",12/31/21,"315,934,000","65,756,000",,"1,402,724,000"
15403,"Business combinations","Accounting for the Acquisition of Abaco Systems, Inc.",474508,12/31/21,02/22/22,2,"Ernst & Young LLP",,,,Philadelphia,PA,PENNSYLVANIA,"US Mid Atlantic",10-K,2022-02-22,,"AMETEK INC/",1037868,"=""AME""","1100 CASSATT ROAD",,BERWYN,PA,PENNSYLVANIA,"US Mid Atlantic",,,"=""3823""","Industrial Instruments for Measurement, Display, and Control of Process Variables; and Related Products",335312,"Motor and Generator Manufacturing",34,147,12/31/21,"34,063,624,192",12/31/21,"5,546,514,000","990,053,000","-1,735,471,000","11,898,187,000"
15404,"Other intangible assets","Impairment Assessment of Indefinite Lived Intangible Assets (other than Goodwill)",474508,12/31/21,02/22/22,2,"Ernst & Young LLP",,,,Philadelphia,PA,PENNSYLVANIA,"US Mid Atlantic",10-K,2022-02-22,,"AMETEK INC/",1037868,"=""AME""","1100 CASSATT ROAD",,BERWYN,PA,PENNSYLVANIA,"US Mid Atlantic",,,"=""3823""","Industrial Instruments for Measurement, Display, and Control of Process Variables; and Related Products",335312,"Motor and Generator Manufacturing",34,147,12/31/21,"34,063,624,192",12/31/21,"5,546,514,000","990,053,000","-1,735,471,000","11,898,187,000"
15370,"Other revenue","Evaluation of the sufficiency of audit evidence obtained over revenue
",474411,12/31/21,02/22/22,4,"KPMG LLP",,,,Dallas,TX,TEXAS,"US Southwest",10-K,2022-02-22,,"AMF Hawaii Investments, LLC",1845290,,"650 5TH AVENUE, 17TH FLOOR",,"NEW YORK",NY,"NEW YORK","US Mid Atlantic",,,"=""5172""","Petroleum and Petroleum Products Wholesalers, Except Bulk Stations and Terminals",424720,"Petroleum and Petroleum Products Merchant Wholesalers (except Bulk Stations and Terminals)",34,,,"322,454,731",12/31/21,"235,984,000","2,684,059,000","170,213,000","536,451,000"
14952,"Sales return and allowances","Sales deductions",473893,12/31/21,02/16/22,2,"Ernst & Young LLP",,,,"Los Angeles",CA,CALIFORNIA,"US West",10-K,2022-02-16,,"AMGEN INC",318154,"=""AMGN""","ONE AMGEN CENTER DRIVE",,"THOUSAND OAKS",CA,CALIFORNIA,"US West",,,"=""2836""","Biological Products, Except Diagnostic Substances",325414,"Biological Product (except Diagnostic) Manufacturing",34,225,12/31/21,"125,600,751,616",12/31/21,"25,979,000,000","5,893,000,000","-23,372,000,000","61,165,000,000"
14953,"Other income taxes","Unrecognized tax benefits",473893,12/31/21,02/16/22,2,"Ernst & Young LLP",,,,"Los Angeles",CA,CALIFORNIA,"US West",10-K,2022-02-16,,"AMGEN INC",318154,"=""AMGN""","ONE AMGEN CENTER DRIVE",,"THOUSAND OAKS",CA,CALIFORNIA,"US West",,,"=""2836""","Biological Products, Except Diagnostic Substances",325414,"Biological Product (except Diagnostic) Manufacturing",34,225,12/31/21,"125,600,751,616",12/31/21,"25,979,000,000","5,893,000,000","-23,372,000,000","61,165,000,000"
15996,"Business combinations","Fair Value Measurement of the Contingent Consideration",475267,12/31/21,02/24/22,2,"Ernst & Young LLP",,,,Iselin,NJ,"NEW JERSEY","US Mid Atlantic",10-K,2022-02-24,,"AMICUS THERAPEUTICS, INC.",1178879,"=""FOLD""","47 HULFISH STREET",,PRINCETON,NJ,"NEW JERSEY","US Mid Atlantic",,,"=""2834""","Pharmaceutical Preparations",325412,"Pharmaceutical Preparation Manufacturing",34,12,12/31/21,"3,221,442,816",12/31/21,"305,514,000","-250,460,000","109,572,000","905,140,000"
15324,"Other income taxes","Accounting for Income Taxes",474325,12/31/21,02/18/22,1,"PricewaterhouseCoopers LLP",,,,Phoenix,AZ,ARIZONA,"US Southwest",10-K,2022-02-18,,"AMKOR TECHNOLOGY, INC.",1047127,"=""AMKR""","2045 EAST INNOVATION CIRCLE",,TEMPE,AZ,ARIZONA,"US Southwest",,,"=""3674""","Semiconductors and Related Devices",334515,"Instrument Manufacturing for Measuring and Testing Electricity and Electrical Signals",34,25,12/31/21,"6,056,568,832",12/31/21,"6,138,329,000","642,995,000","2,917,760,000","6,038,554,000"
16040,"Other contingent liabilities","Professional Liability Reserve",475262,12/31/21,02/24/22,4,"KPMG LLP",,,,"San Diego",CA,CALIFORNIA,"US West",10-K,2022-02-24,,"AMN HEALTHCARE SERVICES INC",1142750,"=""AMN""","2999 OLYMPUS BOULEVARD","SUITE 500",DALLAS,TX,TEXAS,"US Southwest",,,"=""7363""","Help Supply Services",561310,"Employment Placement Agencies",34,122,12/31/21,"5,781,682,688",12/31/21,"3,984,235,000","327,388,000","-244,774,000","3,131,906,000"
17221,"Sales return and allowances","Medicaid Rebates",477001,12/31/21,03/01/22,2,"Ernst & Young LLP",,,,Iselin,NJ,"NEW JERSEY","US Mid Atlantic",10-K,2022-03-01,,"Amneal Pharmaceuticals, Inc.",1723128,"=""AMRX""","30831 HUNTWOOD AVE",,HAYWARD,CA,CALIFORNIA,"US West",,,"=""2834""","Pharmaceutical Preparations",325412,"Pharmaceutical Preparation Manufacturing",34,5,12/31/21,"715,688,256",12/31/21,"2,093,669,000","10,624,000","-1,382,692,000","3,939,664,000"
17222,"Sales return and allowances","Sales Returns",477001,12/31/21,03/01/22,2,"Ernst & Young LLP",,,,Iselin,NJ,"NEW JERSEY","US Mid Atlantic",10-K,2022-03-01,,"Amneal Pharmaceuticals, Inc.",1723128,"=""AMRX""","30831 HUNTWOOD AVE",,HAYWARD,CA,CALIFORNIA,"US West",,,"=""2834""","Pharmaceutical Preparations",325412,"Pharmaceutical Preparation Manufacturing",34,5,12/31/21,"715,688,256",12/31/21,"2,093,669,000","10,624,000","-1,382,692,000","3,939,664,000"
17223,"Other intangible assets","Impairment of Intangible Assets with Finite Lives",477001,12/31/21,03/01/22,2,"Ernst & Young LLP",,,,Iselin,NJ,"NEW JERSEY","US Mid Atlantic",10-K,2022-03-01,,"Amneal Pharmaceuticals, Inc.",1723128,"=""AMRX""","30831 HUNTWOOD AVE",,HAYWARD,CA,CALIFORNIA,"US West",,,"=""2834""","Pharmaceutical Preparations",325412,"Pharmaceutical Preparation Manufacturing",34,5,12/31/21,"715,688,256",12/31/21,"2,093,669,000","10,624,000","-1,382,692,000","3,939,664,000"
17224,"Goodwill and intangible assets","Impairment of Goodwill and Other Indefinite-lived Intangible Assets",477001,12/31/21,03/01/22,2,"Ernst & Young LLP",,,,Iselin,NJ,"NEW JERSEY","US Mid Atlantic",10-K,2022-03-01,,"Amneal Pharmaceuticals, Inc.",1723128,"=""AMRX""","30831 HUNTWOOD AVE",,HAYWARD,CA,CALIFORNIA,"US West",,,"=""2834""","Pharmaceutical Preparations",325412,"Pharmaceutical Preparation Manufacturing",34,5,12/31/21,"715,688,256",12/31/21,"2,093,669,000","10,624,000","-1,382,692,000","3,939,664,000"
18310,"Sales return and allowances","Provision for chargebacks estimate",479163,12/31/21,03/11/22,2,"Ernst & Young LLP",,,,Irvine,CA,CALIFORNIA,"US West",10-K,2022-03-11,,"Amphastar Pharmaceuticals, Inc.",1297184,"=""AMPH""","11570 SIXTH STREET",,"RANCHO CUCAMONGA",CA,CALIFORNIA,"US West",,,"=""2834""","Pharmaceutical Preparations",325412,"Pharmaceutical Preparation Manufacturing",34,23,12/31/21,"1,111,280,256",12/31/21,"437,768,000","62,116,000","406,652,000","671,529,000"
18311,Inventory,"Inventory lower of cost or net realizable value estimate",479163,12/31/21,03/11/22,2,"Ernst & Young LLP",,,,Irvine,CA,CALIFORNIA,"US West",10-K,2022-03-11,,"Amphastar Pharmaceuticals, Inc.",1297184,"=""AMPH""","11570 SIXTH STREET",,"RANCHO CUCAMONGA",CA,CALIFORNIA,"US West",,,"=""2834""","Pharmaceutical Preparations",325412,"Pharmaceutical Preparation Manufacturing",34,23,12/31/21,"1,111,280,256",12/31/21,"437,768,000","62,116,000","406,652,000","671,529,000"
18312,"Equity investments and joint ventures","Accounting for Amphastar Nanjing Pharmaceuticals, Inc. restructuring transaction",479163,12/31/21,03/11/22,2,"Ernst & Young LLP",,,,Irvine,CA,CALIFORNIA,"US West",10-K,2022-03-11,,"Amphastar Pharmaceuticals, Inc.",1297184,"=""AMPH""","11570 SIXTH STREET",,"RANCHO CUCAMONGA",CA,CALIFORNIA,"US West",,,"=""2834""","Pharmaceutical Preparations",325412,"Pharmaceutical Preparation Manufacturing",34,23,12/31/21,"1,111,280,256",12/31/21,"437,768,000","62,116,000","406,652,000","671,529,000"
14552,"Other income taxes","Income Taxes — Unrecognized Tax Benefits — Refer to Notes 1 and 6 to the financial statements",473217,12/31/21,02/09/22,3,"Deloitte & Touche LLP",,,,Hartford,CT,CONNECTICUT,"US New England",10-K,2022-02-09,,"AMPHENOL CORP /DE/",820313,"=""APH""","358 HALL AVE",,WALLINGFORD,CT,CONNECTICUT,"US New England",,,"=""3678""","Electronic Connectors",334417,"Electronic Connector Manufacturing",34,87,12/31/21,"52,397,285,376",12/31/21,"10,876,300,000","1,590,800,000","-812,700,000","14,678,400,000"
18051,"Proven and unproven reserves","Oil and Gas Reserve Quantities & Related Undiscounted Cashflows as used in the calculation of DD&A and Impairment — Refer to Notes 2 and 18 to the financial statements",478655,12/31/21,03/09/22,3,"Deloitte & Touche LLP",,,,Houston,TX,TEXAS,"US Southwest",10-K,2022-03-09,,"Amplify Energy Corp.",1533924,"=""AMPY""","500 DALLAS STREET","SUITE 1700",,TX,TEXAS,"US Southwest",,,"=""1311""","Crude Petroleum and Natural Gas",211111,"Crude Petroleum and Natural Gas Extraction",34,3,12/31/21,"118,255,080",12/31/21,"342,916,000","-32,070,000",,"455,100,000"
18052,"Asset retirement and environmental obligations","Southern California Pipeline Incident – Refer to Notes 2, 13 and 15 to the financial statements",478655,12/31/21,03/09/22,3,"Deloitte & Touche LLP",,,,Houston,TX,TEXAS,"US Southwest",10-K,2022-03-09,,"Amplify Energy Corp.",1533924,"=""AMPY""","500 DALLAS STREET","SUITE 1700",,TX,TEXAS,"US Southwest",,,"=""1311""","Crude Petroleum and Natural Gas",211111,"Crude Petroleum and Natural Gas Extraction",34,3,12/31/21,"118,255,080",12/31/21,"342,916,000","-32,070,000",,"455,100,000"
13787,"Sales return and allowances","Revenue Recognition – Measuring Variable Consideration",468714,10/30/21,12/03/21,2,"Ernst & Young LLP",,,,Boston,MA,MASSACHUSETTS,"US New England",10-K,2021-12-03,,"ANALOG DEVICES INC",6281,"=""ADI""","ONE ANALOG WAY",,WILMINGTON,MA,MASSACHUSETTS,"US New England",,,"=""3674""","Semiconductors and Related Devices",334413,"Semiconductor and Related Device Manufacturing",34,175,11/01/21,"64,433,827,840",10/30/21,"7,318,286,000","1,390,422,000","-4,193,098,000","52,322,071,000"
13788,"Business combinations","Accounting for Acquisitions – Valuation of Identified Intangibles",468714,10/30/21,12/03/21,2,"Ernst & Young LLP",,,,Boston,MA,MASSACHUSETTS,"US New England",10-K,2021-12-03,,"ANALOG DEVICES INC",6281,"=""ADI""","ONE ANALOG WAY",,WILMINGTON,MA,MASSACHUSETTS,"US New England",,,"=""3674""","Semiconductors and Related Devices",334413,"Semiconductor and Related Device Manufacturing",34,175,11/01/21,"64,433,827,840",10/30/21,"7,318,286,000","1,390,422,000","-4,193,098,000","52,322,071,000"
9033,"Depreciation and amortization","Amortization period for capitalized sales commissions",448566,01/31/21,03/12/21,4,"KPMG LLP",,,,"San Francisco",CA,CALIFORNIA,"US West",10-K,2021-03-12,,"Anaplan, Inc.",1540755,,"50 HAWTHORNE STREET",,"SAN FRANCISCO",CA,CALIFORNIA,"US West",,,"=""7372""","Prepackaged Software",511210,"Software Publishers",34,67,01/31/21,"9,571,582,976",01/31/21,"447,755,000","-153,967,000","245,634,000","739,125,000"
17928,"Research and development expenses","Evaluation of Research and Development Costs",477950,12/31/21,03/07/22,4,"KPMG LLP",,,,"San Diego",CA,CALIFORNIA,"US West",10-K,2022-03-07,,"ANAPTYSBIO, INC",1370053,"=""ANAB""","10770 WATERIDGE CIRCLE, SUITE 210",,"SAN DIEGO",CA,CALIFORNIA,"US West",,,"=""2834""","Pharmaceutical Preparations",325412,"Pharmaceutical Preparation Manufacturing",34,35,12/31/21,"960,733,248",12/31/21,"63,175,000","-57,796,000",,"643,070,000"
15956,Goodwill,"Goodwill—GSM and FSI Reporting Units—Refer to Notes 1 and 17 to the Consolidated Financial Statements",475188,12/31/21,02/24/22,3,"Deloitte & Touche LLP",,,,Cleveland,OH,OHIO,"US Midwest",10-K,2022-02-24,,"Andersons, Inc.",821026,"=""ANDE""","1947 BRIARFIELD BOULEVARD",,MAUMEE,OH,OHIO,"US Midwest",,,"=""5150""","Wholesale-Farm Product Raw Materials",493130,"Farm Product Warehousing and Storage",34,39,12/31/21,"1,310,681,856",12/31/21,"12,612,050,000","103,986,000","825,946,000","4,569,219,000"
20620,"Other contingent liabilities","Tax Contingencies in Brazil",485194,12/31/21,04/26/22,2,"Ernst & Young LLP",636,"EY Servicios Profesionales de Auditoría y Asesorías SpA (EY Audit SpA)",1431,Santiago,F3,CHILE,Foreign,20-F,2022-04-27,,"ANDINA BOTTLING CO INC",925261,"=""AKO.A""","AVENIDA EL GOLF 40, PISO 4","LAS CONDES",SANTIAGO,F3,CHILE,Foreign,,,"=""2086""","Bottled and Canned Soft Drinks and Carbonated Waters",312111,"Soft Drink Manufacturing",34,10,12/29/21,"821,945,728",12/31/21,"2,601,799,000","184,309,000","350,317,000","3,457,872,000"
19252,"Other investments","Assessment of the valuation of residential mortgage loans at fair value",480976,12/31/21,03/28/22,4,"KPMG LLP",,,,Atlanta,GA,GEORGIA,"US Southeast",10-K,2022-03-28,,"Angel Oak Mortgage REIT, Inc.",1766478,"=""AOMD""","3344 PEACHTREE ROAD NE","SUITE 1725",ATLANTA,GA,GEORGIA,"US Southeast",,,"=""6500""","Real Estate",531390,"Other Activities Related to Real Estate",34,16,12/31/21,"413,223,648",12/31/21,"41,761,000","21,113,000",,"2,577,929,000"
17438,"Deferred and stock-based compensation","Stock-Based Compensation
",477102,12/31/21,03/01/22,2,"Ernst & Young LLP",,,,"New York",NY,"NEW YORK","US Mid Atlantic",10-K,2022-03-01,,"Angi Inc.",1705110,"=""ANGI""","555 WEST 18TH STREET",,"NEW YORK",NY,"NEW YORK","US Mid Atlantic",,,"=""7310""",Services-Advertising,541870,"Advertising Material Distribution Services",34,9,12/31/21,"742,123,392",12/31/21,"1,685,438,000","-71,378,000","24,754,000","2,010,141,000"
12461,Inventory,"Inventories – Excess Quantities and Obsolescence — Refer to Notes 1 & 6
",461050,05/31/21,07/27/21,3,"Deloitte & Touche LLP",,,,Boston,MA,MASSACHUSETTS,"US New England",10-K,2021-07-27,,"ANGIODYNAMICS INC",1275187,"=""ANGO""","14 PLAZA DRIVE",,LATHAM,NY,"NEW YORK","US Mid Atlantic",,,"=""3841""","Surgical and Medical Instruments and Apparatus",334510,"Electromedical and Electrotherapeutic Apparatus Manufacturing",34,23,05/31/21,"891,297,984",05/31/21,"291,010,000","-31,548,000","69,164,000","561,438,000"
19434,"Proven and unproven reserves","Geita VAT recoverability
",481452,12/31/21,03/29/22,2,"Ernst & Young LLP",281,"Ernst & Young Incorporated",1698,Johannesburg,T3,"SOUTH AFRICA",Foreign,20-F,2022-03-30,,"ANGLOGOLD ASHANTI (PTY) LTD",1067428,"=""AU""","76 JEPPE STREET","PO BOX 62117",MARSHALLTOWN,T3,"SOUTH AFRICA",Foreign,,,"=""1040""","Metal Mining",212221,"Gold Ore Mining",34,21,12/31/21,"8,759,180,288",12/31/21,"4,029,000,000","646,000,000","3,887,000,000","7,967,000,000"
19435,"Asset retirement and environmental obligations","Environmental rehabilitation obligations",481452,12/31/21,03/29/22,2,"Ernst & Young LLP",281,"Ernst & Young Incorporated",1698,Johannesburg,T3,"SOUTH AFRICA",Foreign,20-F,2022-03-30,,"ANGLOGOLD ASHANTI (PTY) LTD",1067428,"=""AU""","76 JEPPE STREET","PO BOX 62117",MARSHALLTOWN,T3,"SOUTH AFRICA",Foreign,,,"=""1040""","Metal Mining",212221,"Gold Ore Mining",34,21,12/31/21,"8,759,180,288",12/31/21,"4,029,000,000","646,000,000","3,887,000,000","7,967,000,000"
18854,"Goodwill and intangible assets","Impairment of goodwill and intangible assets with indefinite useful life",480105,12/31/21,03/16/22,1,"PricewaterhouseCoopers LLP",266,"PricewaterhouseCoopers Bedrijfsrevisoren BCVBA",1350,Diegem,C9,BELGIUM,Foreign,20-F,2022-03-18,,"Anheuser-Busch InBev SA/NV",1668717,"=""BUD""","BROUWERIJPLEIN 1",,LEUVEN,C9,BELGIUM,Foreign,,,"=""2082""","Malt Beverages",312120,Breweries,34,60,12/29/21,"102,034,776,064",12/31/21,"54,304,000,000","6,113,000,000","-87,559,000,000","217,626,000,000"
18855,"Uncertain tax positions","Uncertain tax positions",480105,12/31/21,03/16/22,1,"PricewaterhouseCoopers LLP",266,"PricewaterhouseCoopers Bedrijfsrevisoren BCVBA",1350,Diegem,C9,BELGIUM,Foreign,20-F,2022-03-18,,"Anheuser-Busch InBev SA/NV",1668717,"=""BUD""","BROUWERIJPLEIN 1",,LEUVEN,C9,BELGIUM,Foreign,,,"=""2082""","Malt Beverages",312120,Breweries,34,60,12/29/21,"102,034,776,064",12/31/21,"54,304,000,000","6,113,000,000","-87,559,000,000","217,626,000,000"
18251,Inventory,"Inventories — Refer to Notes 2 and 5 to the financial statements",479022,12/31/21,03/10/22,3,"Deloitte & Touche LLP",,,,Boston,MA,MASSACHUSETTS,"US New England",10-K,2022-03-11,,"Anika Therapeutics, Inc.",898437,"=""ANIK""","32 WIGGINS AVENUE",,BEDFORD,MA,MASSACHUSETTS,"US New England",,,"=""3841""","Surgical and Medical Instruments and Apparatus",325414,"Biological Product (except Diagnostic) Manufacturing",34,36,12/31/21,"517,421,024",12/31/21,"147,794,000","4,134,000","196,922,000","347,535,000"
15207,"Depreciation and amortization","Amortization of net premiums on Agency mortgage-backed securities",474098,12/31/21,02/17/22,2,"Ernst & Young LLP",,,,"New York",NY,"NEW YORK","US Mid Atlantic",10-K,2022-02-18,,"ANNALY CAPITAL MANAGEMENT INC",1043219,"=""NLY""","1211 AVENUE OF THE AMERICAS",,"NEW YORK",NY,"NEW YORK","US Mid Atlantic",,,"=""6798""","Real Estate Investment Trusts",525990,"Other Financial Vehicles",34,8,12/31/21,"11,415,137,280",12/31/21,"2,586,969,000","2,389,896,000","13,145,585,000","76,764,064,000"
15208,"Other investments","Valuation of mortgage servicing rights",474098,12/31/21,02/17/22,2,"Ernst & Young LLP",,,,"New York",NY,"NEW YORK","US Mid Atlantic",10-K,2022-02-18,,"ANNALY CAPITAL MANAGEMENT INC",1043219,"=""NLY""","1211 AVENUE OF THE AMERICAS",,"NEW YORK",NY,"NEW YORK","US Mid Atlantic",,,"=""6798""","Real Estate Investment Trusts",525990,"Other Financial Vehicles",34,8,12/31/21,"11,415,137,280",12/31/21,"2,586,969,000","2,389,896,000","13,145,585,000","76,764,064,000"
17441,"Research and development expenses","Accrued preclinical study and clinical trial expenses",477058,12/31/21,03/01/22,4,"KPMG LLP",,,,"San Francisco",CA,CALIFORNIA,"US West",10-K,2022-03-01,,"Annexon, Inc.",1528115,"=""ANNX""","1400 SIERRA POINT PARKWAY","BLDG C, SUITE 200",BRISBANE,CA,CALIFORNIA,"US West",,,"=""2834""","Pharmaceutical Preparations",325412,"Pharmaceutical Preparation Manufacturing",34,11,12/31/21,"443,064,224",12/31/21,,"-130,323,000",,"287,040,000"
15685,"Revenue from customer contracts","Revenue—Time-Based Lease Licenses—Refer to Notes 2 and 3 to the financial statement",474873,12/31/21,02/23/22,3,"Deloitte & Touche LLP",,,,Pittsburgh,PA,PENNSYLVANIA,"US Mid Atlantic",10-K,2022-02-23,,"ANSYS INC",1013462,"=""ANSS""","2600 ANSYS DRIVE, SOUTHPOINTE",,CANONSBURG,PA,PENNSYLVANIA,"US Mid Atlantic",,,"=""7372""","Prepackaged Software",511210,"Software Publishers",34,401,12/31/21,"34,929,119,232",12/31/21,"1,906,715,000","454,627,000","311,658,000","6,324,314,000"
17691,"Sales return and allowances","Government and insurance plan rebate reserves
",477434,12/31/21,03/03/22,4,"KPMG LLP",,,,Minneapolis,MN,MINNESOTA,"US Midwest",10-K,2022-03-03,,"ANTARES PHARMA, INC.",1016169,,"100 PRINCETON SOUTH","SUITE 300",EWING,NJ,"NEW JERSEY","US Mid Atlantic",,,"=""3841""","Surgical and Medical Instruments and Apparatus",339112,"Surgical and Medical Instrument Manufacturing",34,4,12/31/21,"607,157,056",12/31/21,"183,982,000","46,289,000","156,784,000","257,505,000"
14947,"Balance sheet classification of assets","Lease classification for ongoing modifications to the gathering and compression assets",473889,12/31/21,02/16/22,4,"KPMG LLP",,,,Denver,CO,COLORADO,"US West",10-K,2022-02-16,,"Antero Midstream Corp",1623925,"=""AM""","1615 WYNKOOP STREET",,DENVER,CO,COLORADO,"US West",,,"=""4922""","Natural Gas Transmission",486210,"Pipeline Transportation of Natural Gas",34,10,12/31/21,"4,622,151,680",12/31/21,"898,202,000","331,617,000","929,923,000","5,544,001,000"
14983,"Proven and unproven reserves","Estimated oil and gas reserves on depletion expense related to proved oil and gas properties",473908,12/31/21,02/16/22,4,"KPMG LLP",,,,Denver,CO,COLORADO,"US West",10-K,2022-02-16,,"ANTERO RESOURCES Corp",1433270,"=""AR""","1615 WYNKOOP STREET",,DENVER,CO,COLORADO,"US West",,,"=""1311""","Crude Petroleum and Natural Gas",211111,"Crude Petroleum and Natural Gas Extraction",34,18,12/31/21,"5,493,774,848",12/31/21,"4,619,432,000","-186,899,000",,"13,896,528,000"
16753,Goodwill,"Annual Goodwill Impairment Assessment – Realogy Leads Group Reporting Unit
",475458,12/31/21,02/25/22,1,"PricewaterhouseCoopers LLP",,,,"Florham Park",NJ,"NEW JERSEY","US Mid Atlantic",10-K,2022-02-25,,"Anywhere Real Estate Group LLC",1355001,,"175 PARK AVENUE",,MADISON,NJ,"NEW JERSEY","US Mid Atlantic",1398987,"Anywhere Real Estate Inc.","=""6531""","Real Estate Agents and Managers",531210,"Offices of Real Estate Agents and Brokers",34,,,,12/31/21,"7,983,000,000","343,000,000","-2,616,000,000","7,210,000,000"
16270,Goodwill,"Annual Goodwill Impairment Assessment – Realogy Leads Group Reporting Unit",475634,12/31/21,02/25/22,1,"PricewaterhouseCoopers LLP",,,,"Florham Park",NJ,"NEW JERSEY","US Mid Atlantic",10-K,2022-02-25,,"Anywhere Real Estate Inc.",1398987,"=""HOUS""","175 PARK AVENUE",,MADISON,NJ,"NEW JERSEY","US Mid Atlantic",,,"=""6531""","Real Estate Agents and Managers",531210,"Offices of Real Estate Agents and Brokers",34,17,12/29/21,"1,971,506,560",12/31/21,"7,983,000,000","343,000,000","-2,616,000,000","7,210,000,000"
15249,"Deferred income taxes","Realizability of Deferred Tax Assets",474374,12/31/21,02/18/22,2,"Ernst & Young LLP",,,,Chicago,IL,ILLINOIS,"US Midwest",10-K,2022-02-18,,"Aon plc",315293,"=""AON""","15 GEORGES QUAY",,"DUBLIN 2",L2,IRELAND,Foreign,,,"=""6411""","Insurance Agents, Brokers, and Service",524210,"Insurance Agencies and Brokerages",34,301,12/31/21,"64,560,287,744",12/31/21,"12,193,000,000","1,255,000,000","-7,865,000,000","31,917,000,000"
15501,"Proven and unproven reserves","Depreciation, depletion and amortization of property and equipment",474626,12/31/21,02/22/22,2,"Ernst & Young LLP",,,,Houston,TX,TEXAS,"US Southwest",10-K,2022-02-22,,"APA Corp",1841666,"=""APA""","2000 W SAM HOUSTON PKWY S","SUITE 200",HOUSTON,TX,TEXAS,"US Southwest",,,"=""1311""","Crude Petroleum and Natural Gas",211111,"Crude Petroleum and Natural Gas Extraction",34,27,12/31/21,"9,328,968,704",12/31/21,"7,985,000,000","1,135,000,000",,"13,303,000,000"
15502,"Asset retirement and environmental obligations","Accounting for asset retirement obligation for the North Sea segment",474626,12/31/21,02/22/22,2,"Ernst & Young LLP",,,,Houston,TX,TEXAS,"US Southwest",10-K,2022-02-22,,"APA Corp",1841666,"=""APA""","2000 W SAM HOUSTON PKWY S","SUITE 200",HOUSTON,TX,TEXAS,"US Southwest",,,"=""1311""","Crude Petroleum and Natural Gas",211111,"Crude Petroleum and Natural Gas Extraction",34,27,12/31/21,"9,328,968,704",12/31/21,"7,985,000,000","1,135,000,000",,"13,303,000,000"
15503,"Other contingent liabilities","Accounting for decommissioning contingency for sold Gulf of Mexico properties",474626,12/31/21,02/22/22,2,"Ernst & Young LLP",,,,Houston,TX,TEXAS,"US Southwest",10-K,2022-02-22,,"APA Corp",1841666,"=""APA""","2000 W SAM HOUSTON PKWY S","SUITE 200",HOUSTON,TX,TEXAS,"US Southwest",,,"=""1311""","Crude Petroleum and Natural Gas",211111,"Crude Petroleum and Natural Gas Extraction",34,27,12/31/21,"9,328,968,704",12/31/21,"7,985,000,000","1,135,000,000",,"13,303,000,000"
15456,"Proven and unproven reserves","Depreciation, depletion and amortization of property and equipment",474619,12/31/21,02/22/22,2,"Ernst & Young LLP",,,,Houston,TX,TEXAS,"US Southwest",10-K,2022-02-22,,"APACHE CORP",6769,,"2000 W SAM HOUSTON PKWY S","SUITE 200",HOUSTON,TX,TEXAS,"US Southwest",1841666,"APA Corp","=""1311""","Crude Petroleum and Natural Gas",211111,"Crude Petroleum and Natural Gas Extraction",34,28,12/29/21,"27,910",12/31/21,"7,985,000,000","1,224,000,000",,"14,393,000,000"
15457,"Asset retirement and environmental obligations","Accounting for asset retirement obligation for the North Sea segment",474619,12/31/21,02/22/22,2,"Ernst & Young LLP",,,,Houston,TX,TEXAS,"US Southwest",10-K,2022-02-22,,"APACHE CORP",6769,,"2000 W SAM HOUSTON PKWY S","SUITE 200",HOUSTON,TX,TEXAS,"US Southwest",1841666,"APA Corp","=""1311""","Crude Petroleum and Natural Gas",211111,"Crude Petroleum and Natural Gas Extraction",34,28,12/29/21,"27,910",12/31/21,"7,985,000,000","1,224,000,000",,"14,393,000,000"
15458,"Other contingent liabilities","Accounting for decommissioning contingency for sold Gulf of Mexico properties",474619,12/31/21,02/22/22,2,"Ernst & Young LLP",,,,Houston,TX,TEXAS,"US Southwest",10-K,2022-02-22,,"APACHE CORP",6769,,"2000 W SAM HOUSTON PKWY S","SUITE 200",HOUSTON,TX,TEXAS,"US Southwest",1841666,"APA Corp","=""1311""","Crude Petroleum and Natural Gas",211111,"Crude Petroleum and Natural Gas Extraction",34,28,12/29/21,"27,910",12/31/21,"7,985,000,000","1,224,000,000",,"14,393,000,000"
17532,"Business combinations","Real Estate— Refer to Notes 2 and 3 to the financial statements",476632,12/31/21,03/01/22,3,"Deloitte & Touche LLP",,,,Denver,CO,COLORADO,"US West",10-K,2022-03-01,,"Apartment Income REIT Corp.",1820877,,"4582 S. ULSTER STREET, SUITE 1700",,DENVER,CO,COLORADO,"US West",,,"=""6798""","Real Estate Investment Trusts",525990,"Other Financial Vehicles",34,55,12/31/21,"8,583,100,928",12/31/21,"740,853,000","447,621,000","1,860,109,000","6,440,360,000"
17533,"Real estate investments","Leased Real Estate Assets— Refer to Notes 2, 4 and 5 to the financial statements
",476632,12/31/21,03/01/22,3,"Deloitte & Touche LLP",,,,Denver,CO,COLORADO,"US West",10-K,2022-03-01,,"Apartment Income REIT Corp.",1820877,,"4582 S. ULSTER STREET, SUITE 1700",,DENVER,CO,COLORADO,"US West",,,"=""6798""","Real Estate Investment Trusts",525990,"Other Financial Vehicles",34,55,12/31/21,"8,583,100,928",12/31/21,"740,853,000","447,621,000","1,860,109,000","6,440,360,000"
17513,"Real estate investments","Real Estate— Refer to Notes 2 and 3 to the financial statements",476738,12/31/21,03/01/22,3,"Deloitte & Touche LLP",,,,Denver,CO,COLORADO,"US West",10-K,2022-03-01,,"Apartment Income REIT, L.P.",926660,,"345 PARK AVENUE",,"NEW YORK",NY,"NEW YORK","US Mid Atlantic",922864,"APARTMENT INVESTMENT & MANAGEMENT CO","=""6513""","Operators of Apartment Buildings",531110,"Lessors of Residential Buildings and Dwellings",34,,,,12/31/21,"740,853,000","482,467,000","2,057,122,000","6,440,360,000"
17514,"Real estate investments","Leased Real Estate Assets— Refer to Notes 2, 4 and 5 to the financial statements",476738,12/31/21,03/01/22,3,"Deloitte & Touche LLP",,,,Denver,CO,COLORADO,"US West",10-K,2022-03-01,,"Apartment Income REIT, L.P.",926660,,"345 PARK AVENUE",,"NEW YORK",NY,"NEW YORK","US Mid Atlantic",922864,"APARTMENT INVESTMENT & MANAGEMENT CO","=""6513""","Operators of Apartment Buildings",531110,"Lessors of Residential Buildings and Dwellings",34,,,,12/31/21,"740,853,000","482,467,000","2,057,122,000","6,440,360,000"
17215,"Business combinations","Accounting for Acquisitions of Real Estate",477010,12/31/21,03/01/22,2,"Ernst & Young LLP",,,,Denver,CO,COLORADO,"US West",10-K,2022-03-01,,"APARTMENT INVESTMENT & MANAGEMENT CO",922864,"=""AIV""","4582 SOUTH ULSTER STREET","SUITE 1450",DENVER,CO,COLORADO,"US West",,,"=""6798""","Real Estate Investment Trusts",525990,"Other Financial Vehicles",34,8,12/31/21,"1,156,595,072",12/31/21,"169,836,000","-5,910,000",,"2,434,101,000"
16926,"Other debt","Development Liability — Refer to Notes 6 and 12 to the financial statements.",476456,12/31/21,02/28/22,3,"Deloitte & Touche LLP",,,,Boston,MA,MASSACHUSETTS,"US New England",10-K,2022-02-28,,"Apellis Pharmaceuticals, Inc.",1492422,"=""APLS""","100 FIFTH AVENUE",,WALTHAM,MA,MASSACHUSETTS,"US New England",,,"=""2834""","Pharmaceutical Preparations",325412,"Pharmaceutical Preparation Manufacturing",34,47,12/31/21,"4,610,934,784",12/31/21,"66,563,000","-746,354,000",,"881,765,000"
17339,"Revenue from customer contracts","Total estimated costs for certain fixed price projects recognized over time",476727,12/31/21,03/01/22,4,"KPMG LLP",,,,Minneapolis,MN,MINNESOTA,"US Midwest",10-K,2022-03-01,,"APi Group Corp",1796209,"=""APG""","C/O API GROUP, INC.","1100 OLD HIGHWAY 8 NW","NEW BRIGHTON",MN,MINNESOTA,"US Midwest",,,"=""7340""","Services-To Dwellings & Other Buildings",238910,"Site Preparation Contractors",34,26,12/31/21,"5,798,249,984",12/31/21,"3,940,000,000","47,000,000","345,000,000","5,159,000,000"
11199,Goodwill,"Goodwill — EFCO and Sotawall Reporting Units — Refer to Notes 1 and 6 to the consolidated financial statements",453699,02/27/21,04/22/21,3,"Deloitte & Touche LLP",,,,Minneapolis,MN,MINNESOTA,"US Midwest",10-K,2021-04-22,,"APOGEE ENTERPRISES, INC.",6845,"=""APOG""","4400 WEST 78TH STREET","SUITE 520",MINNEAPOLIS,MN,MINNESOTA,"US Midwest",,,"=""3231""","Glass Products, Made of Purchased Glass",327215,"Glass Product Manufacturing Made of Purchased Glass",34,37,02/28/21,"961,691,904",02/27/21,"1,230,774,000","15,436,000","232,594,000","1,015,099,000"
11200,"Revenue from customer contracts","Net Sales — Revenue Recognition for Long-Term Contracts in the Architectural Services Segment — Refer to Notes 1, 2, and 15 to the consolidated financial statements",453699,02/27/21,04/22/21,3,"Deloitte & Touche LLP",,,,Minneapolis,MN,MINNESOTA,"US Midwest",10-K,2021-04-22,,"APOGEE ENTERPRISES, INC.",6845,"=""APOG""","4400 WEST 78TH STREET","SUITE 520",MINNEAPOLIS,MN,MINNESOTA,"US Midwest",,,"=""3231""","Glass Products, Made of Purchased Glass",327215,"Glass Product Manufacturing Made of Purchased Glass",34,37,02/28/21,"961,691,904",02/27/21,"1,230,774,000","15,436,000","232,594,000","1,015,099,000"
16355,"Other revenue","Performance Allocations— Refer to Note 2 in the consolidated financial statements
",475852,12/31/21,02/25/22,3,"Deloitte & Touche LLP",,,,"New York",NY,"NEW YORK","US Mid Atlantic",10-K,2022-02-25,,"Apollo Asset Management, Inc.",1411494,,"9 WEST 57TH STREET, 42ND FLOOR",,"new York",NY,"NEW YORK","US Mid Atlantic",1858681,"Apollo Global Management, Inc.","=""6282""","Investment Advice",541611,"Administrative Management and General Management Consulting Services",34,,,,12/31/21,"5,812,508,000","2,315,489,000","5,442,217,000","30,501,894,000"
14507,"Allowance for credit losses","Current Expected Credit Losses (""CECL"") Allowance—Estimation of Economic Conditions—Refer to Notes 2 and 4 in the Financial Statements",473200,12/31/21,02/08/22,3,"Deloitte & Touche LLP",,,,"New York",NY,"NEW YORK","US Mid Atlantic",10-K,2022-02-08,,"Apollo Commercial Real Estate Finance, Inc.",1467760,"=""ARI""","C/O APOLLO GLOBAL MANAGEMENT, LLC","9 WEST 57TH STREET, 43RD FLOOR","NEW YORK",NY,"NEW YORK","US Mid Atlantic",,,"=""6798""","Real Estate Investment Trusts",525990,"Other Financial Vehicles",34,13,12/31/21,"1,841,005,824",12/31/21,"18,917,000","223,515,000",,"8,416,695,000"
14508,"Allowance for credit losses","CECL Allowance—Estimation of Fair Value of Underlying Collateral of Loans Exhibiting Signs of Financial Difficulty — Refer to Notes 2 and 4 to the financial statements",473200,12/31/21,02/08/22,3,"Deloitte & Touche LLP",,,,"New York",NY,"NEW YORK","US Mid Atlantic",10-K,2022-02-08,,"Apollo Commercial Real Estate Finance, Inc.",1467760,"=""ARI""","C/O APOLLO GLOBAL MANAGEMENT, LLC","9 WEST 57TH STREET, 43RD FLOOR","NEW YORK",NY,"NEW YORK","US Mid Atlantic",,,"=""6798""","Real Estate Investment Trusts",525990,"Other Financial Vehicles",34,13,12/31/21,"1,841,005,824",12/31/21,"18,917,000","223,515,000",,"8,416,695,000"
15939,"Regulatory assets and liabilities","Accounting for the Effects of Cost-Based Regulation",474977,12/31/21,02/24/22,1,"PricewaterhouseCoopers LLP",,,,Columbus,OH,OHIO,"US Midwest",10-K,2022-02-24,,"APPALACHIAN POWER CO",6879,,"1 RIVERSIDE PLAZA",,COLUMBUS,OH,OHIO,"US Midwest",4904,"AMERICAN ELECTRIC POWER CO INC","=""4911""","Electric Services",221122,"Electric Power Distribution",34,,,,12/31/21,"3,105,200,000","348,900,000",,"14,088,900,000"
16852,"Uncertain tax positions","Uncertain Tax Positions",476425,12/31/21,02/28/22,1,"PricewaterhouseCoopers LLP",,,,"Los Angeles",CA,CALIFORNIA,"US West",10-K,2022-02-28,,"APPFOLIO INC",1433195,"=""APPF""","70 CASTILIAN DRIVE",,"SANTA BARBARA",CA,CALIFORNIA,"US West",,,"=""7372""","Prepackaged Software",511210,"Software Publishers",34,121,12/31/21,"2,350,621,952",12/31/21,"359,370,000","1,028,000","188,311,000","408,017,000"
17371,"Other debt","Valuation of Private Warrant Liability
",477042,12/31/21,03/01/22,2,"Ernst & Young LLP",,,,Louisville,KY,KENTUCKY,"US Mid Atlantic",10-K,2022-03-01,,"AppHarvest, Inc.",1807707,,"1890 STAR SHOOT PKWY","STE 170 PMB 168",LEXINGTON,KY,KENTUCKY,"US Mid Atlantic",,,"=""0100""","Agricultural production- crops",111419,"Other Food Crops Grown Under Cover",34,4,12/29/21,"400,778,816",12/31/21,"9,050,000","-166,186,000",,"554,064,000"
15511,"Real estate investments","Investments in Real Estate – Indicators of impairment",474638,12/31/21,02/22/22,2,"Ernst & Young LLP",,,,Richmond,VA,VIRGINIA,"US Mid Atlantic",10-K,2022-02-22,,"Apple Hospitality REIT, Inc.",1418121,"=""APLE""","814 EAST MAIN STREET",,RICHMOND,VA,VIRGINIA,"US Mid Atlantic",,,"=""6798""","Real Estate Investment Trusts",525990,"Other Financial Vehicles",34,16,12/31/21,"3,686,328,576",12/31/21,"933,869,000","18,828,000",,"4,790,527,000"
13413,"Uncertain tax positions","Uncertain Tax Positions",466481,09/25/21,10/28/21,2,"Ernst & Young LLP",,,,"San Jose",CA,CALIFORNIA,"US West",10-K,2021-10-29,,"Apple Inc.",320193,"=""AAPL""","ONE APPLE PARK WAY",,CUPERTINO,CA,CALIFORNIA,"US West",,,"=""3571""","Electronic Computers",334111,"Electronic Computer Manufacturing",34,142,09/30/21,"2,324,390,215,680",09/25/21,"365,817,000,000","94,680,000,000",,"351,002,000,000"
13038,"Research and development expenses","Accrued Research and Development Expenses",464182,06/30/21,09/23/21,2,"Ernst & Young LLP",,,,Tampa,FL,FLORIDA,"US Southeast",10-K,2021-09-23,,"APPLIED GENETIC TECHNOLOGIES CORP",1273636,,"14193 NW 119TH TERRACE","SUITE #10",ALACHUA,FL,FLORIDA,"US Southeast",,,"=""2836""","Biological Products, Except Diagnostic Substances",325412,"Pharmaceutical Preparation Manufacturing",34,4,06/30/21,"167,324,544",06/30/21,"500,000","-57,829,000","84,521,000","126,966,000"
12654,Goodwill,"Goodwill - FCX Reporting Unit - Refer to Note 5 to the financial statements",462110,06/30/21,08/17/21,3,"Deloitte & Touche LLP",,,,Cleveland,OH,OHIO,"US Midwest",10-K,2021-08-17,,"APPLIED INDUSTRIAL TECHNOLOGIES INC",109563,"=""AIT""","ONE APPLIED PLAZA",,CLEVELAND,OH,OHIO,"US Midwest",,,"=""5080""","Wholesale-Machinery, Equipment & Supplies",423830,"Industrial Machinery and Equipment Merchant Wholesalers",34,91,06/30/21,"3,507,267,072",06/30/21,"3,235,919,000","144,757,000","92,841,000","2,271,807,000"
13910,Inventory,"Evaluation of net realizable value adjustments to inventories for excess or obsolescence",469509,10/31/21,12/17/21,4,"KPMG LLP",,,,"Santa Clara",CA,CALIFORNIA,"US West",10-K,2021-12-17,,"APPLIED MATERIALS INC /DE",6951,"=""AMAT""","3050 BOWERS AVE",,"SANTA CLARA",CA,CALIFORNIA,"US West",,,"=""3674""","Semiconductors and Related Devices",333295,"Semiconductor Machinery Manufacturing",34,137,10/31/21,"121,891,799,040",10/31/21,"23,063,000,000","5,888,000,000","8,664,000,000","25,825,000,000"
16303,"Research and development expenses","Accrued and Prepaid Expenses - Accrued and Prepaid Research and Development Expenses - Refer to Note 2 to the financial statements",475365,12/31/21,02/24/22,3,"Deloitte & Touche LLP",,,,"San Francisco",CA,CALIFORNIA,"US West",10-K,2022-02-24,,"Applied Molecular Transport Inc.",1801777,,"C/O THE CORPORATION TRUST COMPANY","CORPORATION TRUST CENTER, 1209 ORANGE ST",WILMINGTON,DE,DELAWARE,"US Mid Atlantic",,,"=""2834""","Pharmaceutical Preparations",325412,"Pharmaceutical Preparation Manufacturing",34,14,12/31/21,"539,906,999",12/31/21,"626,000","-100,287,000","163,587,000","214,038,000"
18335,"Business combinations","Acquisitions – Acquisition of Adjust – Forecasted Revenue — Refer to Notes 2 and 6 to the financial statements",479210,12/31/21,03/11/22,3,"Deloitte & Touche LLP",,,,"San Jose",CA,CALIFORNIA,"US West",10-K,2022-03-11,,"AppLovin Corp",1751008,"=""APP""","1100 PAGE MILL RD",,"PALO ALTO",CA,CALIFORNIA,"US West",,,"=""7370""","Services-Computer Programming, Data Processing, Etc.",541511,"Custom Computer Programming Services",34,94,12/31/21,"27,941,183,488",12/31/21,"2,793,104,000","35,446,000","-537,483,000","6,163,579,000"
17574,"Revenue from customer contracts","Accounts Receivable and Net Revenues Fee-for-service arrangements— Refer to Note 1 to the financial statements",476538,12/31/21,03/01/22,3,"Deloitte & Touche LLP",,,,"Costa Mesa",CA,CALIFORNIA,"US West",10-K,2022-03-01,,"Apria, Inc.",1735803,,"7353 COMPANY DRIVE",,INDIANAPOLIS,IN,INDIANA,"US Midwest",,,"=""8082""","Home Health Care Services",621610,"Home Health Care Services",34,33,12/31/21,"1,158,003,968",12/31/21,"1,145,275,000","64,877,000","-60,903,000","775,429,000"
15289,"Business combinations","Acquisition of Voluntis – Valuation of the Technology Intangible Asset",474232,12/31/21,02/18/22,1,"PricewaterhouseCoopers LLP",,,,Chicago,IL,ILLINOIS,"US Midwest",10-K,2022-02-18,,"APTARGROUP, INC.",896622,"=""ATR""","265 EXCHANGE DRIVE","SUITE 301","CRYSTAL LAKE",IL,ILLINOIS,"US Midwest",,,"=""3089""","Plastics Products, NEC",326199,"All Other Plastics Product Manufacturing",34,122,12/31/21,"8,022,439,936",12/31/21,"3,227,221,000","244,097,000","632,907,000","4,141,364,000"
14480,"Uncertain tax positions","Uncertain Tax Positions",473144,12/31/21,02/07/22,2,"Ernst & Young LLP",,,,Detroit,MI,MICHIGAN,"US Midwest",10-K,2022-02-07,,"Aptiv PLC",1521332,"=""APTV""","SPITALSTRASSE 5",,SCHAFFHAUSEN,V8,SWITZERLAND,Foreign,,,"=""3714""","Motor Vehicle Parts and Accessories",423120,"Motor Vehicle Supplies and New Parts Merchant Wholesalers",34,165,12/31/21,"44,621,307,904",12/31/21,"15,618,000,000","590,000,000","4,872,000,000","18,007,000,000"
14481,"Revenue from customer contracts","Revenue Recognition",473144,12/31/21,02/07/22,2,"Ernst & Young LLP",,,,Detroit,MI,MICHIGAN,"US Midwest",10-K,2022-02-07,,"Aptiv PLC",1521332,"=""APTV""","SPITALSTRASSE 5",,SCHAFFHAUSEN,V8,SWITZERLAND,Foreign,,,"=""3714""","Motor Vehicle Parts and Accessories",423120,"Motor Vehicle Supplies and New Parts Merchant Wholesalers",34,165,12/31/21,"44,621,307,904",12/31/21,"15,618,000,000","590,000,000","4,872,000,000","18,007,000,000"
18953,"Research and development expenses","Research and Development Prepaid and Accrued Costs",480292,12/31/21,03/22/22,4,"KPMG LLP",187,"KPMG LLP Chartered Accountants",85,Vaughan,A6,ONTARIO,Canada,10-K,2022-03-22,,"Aptose Biosciences Inc.",882361,"=""APTOF""","66 WELLINGTON STREET WEST, SUITE 5300","TD BANK TOWER BOX 48",TORONTO,A6,ONTARIO,Canada,,,"=""2836""","Biological Products, Except Diagnostic Substances",325414,"Biological Product (except Diagnostic) Manufacturing",34,1,12/31/21,"124,490,280",12/31/21,,"-65,354,000",,"82,525,000"
13694,Goodwill,"Goodwill - FSS US Reporting Unit - Refer to Note 4 to the financial statements",467990,10/01/21,11/23/21,3,"Deloitte & Touche LLP",,,,Philadelphia,PA,PENNSYLVANIA,"US Mid Atlantic",10-K,2021-11-23,,Aramark,1584509,"=""ARMK""","2400 MARKET STREET",,PHILADELPHIA,PA,PENNSYLVANIA,"US Mid Atlantic",,,"=""5812""","Eating and Drinking Places",722310,"Food Service Contractors",34,37,12/31/21,"9,462,354,944",10/01/21,"12,095,965,000","-90,833,000","-4,783,997,000","14,376,164,000"
20450,"Property, plant and equipment","Valuation of Biological Assets",484101,12/31/21,04/13/22,1,"PricewaterhouseCoopers LLP",644,"PricewaterhouseCoopers Consultores Auditores SpA",1364,Santiago,F3,CHILE,Foreign,20-F,2022-04-21,,"ARAUCO & CONSTITUTION PULP INC",1004156,,"EL GOLF NO 150","14TH FL.",SANTIAGO,F3,CHILE,Foreign,,,"=""2611""","Pulp Mills",322110,"Pulp Mills",34,,,,,,,,
15203,"Other investments","Valuation of Mortgage Servicing Rights",474117,12/31/21,02/18/22,2,"Ernst & Young LLP",,,,"New York",NY,"NEW YORK","US Mid Atlantic",10-K,2022-02-18,,"ARBOR REALTY TRUST INC",1253986,"=""ABR""","333 EARLE OVINGTON BOULEVARD","SUITE 900",UNIONDALE,NY,"NEW YORK","US Mid Atlantic",,,"=""6798""","Real Estate Investment Trusts",525990,"Other Financial Vehicles",34,18,12/31/21,"2,772,955,136",12/31/21,"333,148,000","339,300,000","2,317,362,000","15,073,845,000"
15204,"Allowance for credit losses","Allowance for Credit Losses",474117,12/31/21,02/18/22,2,"Ernst & Young LLP",,,,"New York",NY,"NEW YORK","US Mid Atlantic",10-K,2022-02-18,,"ARBOR REALTY TRUST INC",1253986,"=""ABR""","333 EARLE OVINGTON BOULEVARD","SUITE 900",UNIONDALE,NY,"NEW YORK","US Mid Atlantic",,,"=""6798""","Real Estate Investment Trusts",525990,"Other Financial Vehicles",34,18,12/31/21,"2,772,955,136",12/31/21,"333,148,000","339,300,000","2,317,362,000","15,073,845,000"
17698,"Other contingent liabilities","Valuation of contingent consideration liability
",477421,12/31/21,03/03/22,2,"Ernst & Young LLP",,,,Philadelphia,PA,PENNSYLVANIA,"US Mid Atlantic",10-K,2022-03-03,,"Arbutus Biopharma Corp",1447028,"=""ABUS""","701 VETERANS CIRCLE",,WARMINSTER,PA,PENNSYLVANIA,"US Mid Atlantic",,,"=""2834""","Pharmaceutical Preparations",541710,"Research and Development in the Physical, Engineering, and Life Sciences",34,4,12/31/21,"564,002,304",12/31/21,"10,988,000","-76,247,000",,"204,485,000"
19618,Inventory,"GoodWheat Inventory Valuation – Refer to Note 4 to the consolidated financial statements",481992,12/31/21,03/31/22,3,"Deloitte & Touche LLP",,,,Phoenix,AZ,ARIZONA,"US Southwest",10-K,2022-03-31,Yes,"Arcadia Biosciences, Inc.",1469443,"=""RKDA""","5956 SHERRY LANE","SUITE 2000",DALLAS,TX,TEXAS,"US Southwest",,,"=""1311""","Crude Petroleum and Natural Gas",541710,"Research and Development in the Physical, Engineering, and Life Sciences",34,1,12/31/21,"23,071,604",12/31/21,"6,780,000","-14,660,000","30,609,000","43,918,000"
16396,"Other contingent liabilities","Insurance reserves",475998,12/31/21,02/25/22,2,"Ernst & Young LLP",,,,Tulsa,OK,OKLAHOMA,"US Southwest",10-K,2022-02-25,,"ARCBEST CORP /DE/",894405,"=""ARCB""","8401 MCCLURE DRIVE",,"FORT SMITH",AR,ARKANSAS,"US Southeast",,,"=""4213""","Trucking, Except Local",484122,"General Freight Trucking, Long-Distance, Less Than Truckload",34,120,12/31/21,"2,980,320,000",12/31/21,"3,766,185,000","213,521,000","502,150,000","2,112,676,000"
16397,"Business combinations","Accounting for the MoLo Solutions, LLC acquisition",475998,12/31/21,02/25/22,2,"Ernst & Young LLP",,,,Tulsa,OK,OKLAHOMA,"US Southwest",10-K,2022-02-25,,"ARCBEST CORP /DE/",894405,"=""ARCB""","8401 MCCLURE DRIVE",,"FORT SMITH",AR,ARKANSAS,"US Southeast",,,"=""4213""","Trucking, Except Local",484122,"General Freight Trucking, Long-Distance, Less Than Truckload",34,120,12/31/21,"2,980,320,000",12/31/21,"3,766,185,000","213,521,000","502,150,000","2,112,676,000"
18283,"Long-lived assets","Goodwill and Property, Plant and Equipment – Refer to Note 5.3 to the Consolidated Financial Statements",479157,12/31/21,03/11/22,3,"Deloitte & Touche LLP",406,"Deloitte Audit",1287,Luxembourg,N4,LUXEMBOURG,Foreign,20-F,2022-03-11,,ArcelorMittal,1243429,"=""MT""","24-26, BOULEVARD D?AVRANCHES","L-1160 LUXEMBOURG",LUXEMBOURG,N4,LUXEMBOURG,Foreign,,,"=""3312""","Steel Works, Blast Furnaces (Including Coke Ovens), and Rolling Mills",331111,"Iron and Steel Mills",34,32,12/29/21,"35,048,218,624",12/31/21,"76,571,000,000","15,565,000,000","44,681,000,000","90,512,000,000"
18284,"Deferred income taxes","Deferred Tax Assets - Refer to Note 10.4 to the Consolidated Financial Statements",479157,12/31/21,03/11/22,3,"Deloitte & Touche LLP",406,"Deloitte Audit",1287,Luxembourg,N4,LUXEMBOURG,Foreign,20-F,2022-03-11,,ArcelorMittal,1243429,"=""MT""","24-26, BOULEVARD D?AVRANCHES","L-1160 LUXEMBOURG",LUXEMBOURG,N4,LUXEMBOURG,Foreign,,,"=""3312""","Steel Works, Blast Furnaces (Including Coke Ovens), and Rolling Mills",331111,"Iron and Steel Mills",34,32,12/29/21,"35,048,218,624",12/31/21,"76,571,000,000","15,565,000,000","44,681,000,000","90,512,000,000"
16253,"Other contingent liabilities","Valuation of Reserve for Losses and Loss Adjustment Expenses",475597,12/31/21,02/25/22,1,"PricewaterhouseCoopers LLP",,,,"New York",NY,"NEW YORK","US Mid Atlantic",10-K,2022-02-25,,"ARCH CAPITAL GROUP LTD.",947484,"=""ACGL""","WATERLOO HOUSE, GROUND FLOOR","100 PITTS BAY ROAD",PEMBROKE,D0,BERMUDA,Foreign,,,"=""6331""","Fire, Marine, and Casualty Insurance",524130,"Reinsurance Carriers",34,44,12/31/21,"16,843,166,720",12/31/21,"9,248,000,000","2,157,000,000","12,610,146,000","45,100,945,000"
14909,"Asset retirement and environmental obligations","Asset Retirement Obligation (ARO) Liability",473862,12/31/21,02/16/22,2,"Ernst & Young LLP",,,,"Saint Louis",MO,MISSOURI,"US Southeast",10-K,2022-02-16,,"ARCH RESOURCES, INC.",1037676,,"CITY PLACE ONE STE 300","ARCH MINERAL CORP","ST LOUIS",MO,MISSOURI,"US Southeast",,,"=""1221""","Bituminous Coal and Lignite Surface Mining",212111,"Bituminous Coal and Lignite Surface Mining",34,91,12/31/21,"1,405,688,704",12/31/21,"2,208,042,000","337,573,000",,"2,117,160,000"
14978,Inventory,"Fair Value Measurements over Certain Merchandisable Agricultural Inventory and Commodity Contracts",473959,12/31/21,02/17/22,2,"Ernst & Young LLP",,,,"Saint Louis",MO,MISSOURI,"US Southeast",10-K,2022-02-17,,"Archer-Daniels-Midland Co",7084,"=""ADM""","77 W. WACKER DR.",,CHICAGO,IL,ILLINOIS,"US Midwest",,,"=""2070""","Fats & Oils",311222,"Soybean Processing",34,67,12/29/21,"37,488,160,768",12/31/21,"85,249,000,000","2,709,000,000","15,989,000,000","56,136,000,000"
15670,"Long-lived assets","Long-Lived Asset Impairment - Refer to Note 18 to the financial statements.",474860,12/31/21,02/23/22,3,"Deloitte & Touche LLP",,,,Houston,TX,TEXAS,"US Southwest",10-K,2022-02-23,,"Archrock, Inc.",1389050,"=""AROC""","16666 NORTHCHASE DRIVE","STE 100",HOUSTON,TX,TEXAS,"US Southwest",,,"=""4922""","Natural Gas Transmission",213112,"Support Activities for Oil and Gas Operations",34,7,12/31/21,"1,152,409,600",12/31/21,"781,461,000","28,217,000","843,551,000","2,589,966,000"
19761,"Business combinations","Business combinations - fair value of net assets acquired",482092,12/31/21,03/31/22,2,"Ernst & Young LLP",34,"Ernst & Young Auditores Independentes SS",1448,Fortaleza,D5,BRAZIL,Foreign,20-F,2022-03-31,,"Arco Platform Ltd.",1740594,,"RUA AUGUSTA 2840","9TH FLOOR, SUITE 91","SAO PAULO - SP",D5,BRAZIL,Foreign,,,"=""8200""","Services-Educational Services",611710,"Educational Support Services",34,21,12/29/21,"645,391,936",12/31/21,"221,198,000","-28,381,000","-248,138,000","1,075,425,000"
19762,Goodwill,"Goodwill impairment test",482092,12/31/21,03/31/22,2,"Ernst & Young LLP",34,"Ernst & Young Auditores Independentes SS",1448,Fortaleza,D5,BRAZIL,Foreign,20-F,2022-03-31,,"Arco Platform Ltd.",1740594,,"RUA AUGUSTA 2840","9TH FLOOR, SUITE 91","SAO PAULO - SP",D5,BRAZIL,Foreign,,,"=""8200""","Services-Educational Services",611710,"Educational Support Services",34,21,12/29/21,"645,391,936",12/31/21,"221,198,000","-28,381,000","-248,138,000","1,075,425,000"
19763,"Business combinations","Accounts payable to selling shareholders",482092,12/31/21,03/31/22,2,"Ernst & Young LLP",34,"Ernst & Young Auditores Independentes SS",1448,Fortaleza,D5,BRAZIL,Foreign,20-F,2022-03-31,,"Arco Platform Ltd.",1740594,,"RUA AUGUSTA 2840","9TH FLOOR, SUITE 91","SAO PAULO - SP",D5,BRAZIL,Foreign,,,"=""8200""","Services-Educational Services",611710,"Educational Support Services",34,21,12/29/21,"645,391,936",12/31/21,"221,198,000","-28,381,000","-248,138,000","1,075,425,000"
15368,Goodwill,"Goodwill Impairment Assessment – Extrusions Reporting Unit",474410,12/31/21,02/18/22,1,"PricewaterhouseCoopers LLP",,,,Pittsburgh,PA,PENNSYLVANIA,"US Mid Atlantic",10-K,2022-02-22,,"Arconic Corp",1790982,,"201 ISABELLA STREET",,PITTSBURGH,PA,PENNSYLVANIA,"US Mid Atlantic",,,"=""3350""","Rolling Drawing & Extruding of Nonferrous Metals",331315,"Aluminum Sheet, Plate, and Foil Manufacturing",34,33,12/31/21,"3,476,840,448",12/31/21,"7,504,000,000","-397,000,000","1,223,000,000","6,580,000,000"
18601,"Long-lived assets","Impairment of long-lived assets for markets with impairment indicators",479595,12/31/21,03/16/22,2,"Ernst & Young LLP",134,"Pistrelli Henry Martin y Asociados SRL (Inactive)",1449,"Buenos Aires",C1,ARGENTINA,Foreign,6-K,2022-03-16,,"Arcos Dorados Holdings Inc.",1508478,"=""ARCO""","RIO NEGRO 1338, FIRST FLOOR",,MONTEVIDEO,X3,URUGUAY,Foreign,,,"=""5812""","Eating and Drinking Places",722211,"Limited-Service Restaurants",34,6,12/31/21,"760,688,640",12/31/21,"2,659,941,000","45,486,000","181,622,000","2,361,257,000"
18602,"Other contingent liabilities","Tax and labor contingencies",479595,12/31/21,03/16/22,2,"Ernst & Young LLP",134,"Pistrelli Henry Martin y Asociados SRL (Inactive)",1449,"Buenos Aires",C1,ARGENTINA,Foreign,6-K,2022-03-16,,"Arcos Dorados Holdings Inc.",1508478,"=""ARCO""","RIO NEGRO 1338, FIRST FLOOR",,MONTEVIDEO,X3,URUGUAY,Foreign,,,"=""5812""","Eating and Drinking Places",722211,"Limited-Service Restaurants",34,6,12/31/21,"760,688,640",12/31/21,"2,659,941,000","45,486,000","181,622,000","2,361,257,000"
20198,"Long-lived assets","Impairment of long-lived assets for markets with impairment indicators",483380,12/31/21,03/16/22,2,"Ernst & Young LLP",134,"Pistrelli Henry Martin y Asociados SRL (Inactive)",1449,"Buenos Aires",C1,ARGENTINA,Foreign,6-K/A,2022-04-14,,"Arcos Dorados Holdings Inc.",1508478,"=""ARCO""","RIO NEGRO 1338, FIRST FLOOR",,MONTEVIDEO,X3,URUGUAY,Foreign,,,"=""5812""","Eating and Drinking Places",722211,"Limited-Service Restaurants",34,6,12/31/21,"760,688,640",12/31/21,"2,659,941,000","45,486,000","181,622,000","2,361,257,000"
20199,"Other contingent liabilities","Tax and labor contingencies
",483380,12/31/21,03/16/22,2,"Ernst & Young LLP",134,"Pistrelli Henry Martin y Asociados SRL (Inactive)",1449,"Buenos Aires",C1,ARGENTINA,Foreign,6-K/A,2022-04-14,,"Arcos Dorados Holdings Inc.",1508478,"=""ARCO""","RIO NEGRO 1338, FIRST FLOOR",,MONTEVIDEO,X3,URUGUAY,Foreign,,,"=""5812""","Eating and Drinking Places",722211,"Limited-Service Restaurants",34,6,12/31/21,"760,688,640",12/31/21,"2,659,941,000","45,486,000","181,622,000","2,361,257,000"
20747,"Long-lived assets","Impairment of long-lived assets for markets with impairment indicators",485837,12/31/21,03/16/22,2,"Ernst & Young LLP",134,"Pistrelli Henry Martin y Asociados SRL (Inactive)",1449,"Buenos Aires",C1,ARGENTINA,Foreign,20-F,2022-04-29,,"Arcos Dorados Holdings Inc.",1508478,"=""ARCO""","RIO NEGRO 1338, FIRST FLOOR",,MONTEVIDEO,X3,URUGUAY,Foreign,,,"=""5812""","Eating and Drinking Places",722211,"Limited-Service Restaurants",34,6,12/31/21,"760,688,640",12/31/21,"2,659,941,000","45,486,000","181,622,000","2,361,257,000"
20748,"Other contingent liabilities","Tax and labor contingencies",485837,12/31/21,03/16/22,2,"Ernst & Young LLP",134,"Pistrelli Henry Martin y Asociados SRL (Inactive)",1449,"Buenos Aires",C1,ARGENTINA,Foreign,20-F,2022-04-29,,"Arcos Dorados Holdings Inc.",1508478,"=""ARCO""","RIO NEGRO 1338, FIRST FLOOR",,MONTEVIDEO,X3,URUGUAY,Foreign,,,"=""5812""","Eating and Drinking Places",722211,"Limited-Service Restaurants",34,6,12/31/21,"760,688,640",12/31/21,"2,659,941,000","45,486,000","181,622,000","2,361,257,000"
15748,Goodwill,"Valuation of Goodwill",475007,12/31/21,02/24/22,2,"Ernst & Young LLP",,,,Dallas,TX,TEXAS,"US Southwest",10-K,2022-02-24,,"Arcosa, Inc.",1739445,"=""ACA""","500 N. AKARD SREET","SUITE 400",DALLAS,TX,TEXAS,"US Southwest",,,"=""3440""","Fabricated Structural Metal Products",327992,"Ground or Treated Mineral and Earth Manufacturing",34,53,12/31/21,"2,545,410,048",12/31/21,"2,036,400,000","69,600,000","798,100,000","3,188,100,000"
15749,"Business combinations","Accounting for acquisitions",475007,12/31/21,02/24/22,2,"Ernst & Young LLP",,,,Dallas,TX,TEXAS,"US Southwest",10-K,2022-02-24,,"Arcosa, Inc.",1739445,"=""ACA""","500 N. AKARD SREET","SUITE 400",DALLAS,TX,TEXAS,"US Southwest",,,"=""3440""","Fabricated Structural Metal Products",327992,"Ground or Treated Mineral and Earth Manufacturing",34,53,12/31/21,"2,545,410,048",12/31/21,"2,036,400,000","69,600,000","798,100,000","3,188,100,000"
17570,"Research and development expenses","Accrued research and development expenses",476531,12/31/21,02/28/22,2,"Ernst & Young LLP",,,,"San Diego",CA,CALIFORNIA,"US West",10-K,2022-03-01,,"Arcturus Therapeutics Holdings Inc.",1768224,"=""ARCT""","10285 SCIENCE CENTER DRIVE",,"SAN DIEGO",CA,CALIFORNIA,"US West",,,"=""2834""","Pharmaceutical Preparations",325414,"Biological Product (except Diagnostic) Manufacturing",34,37,12/31/21,"976,027,712",12/31/21,"12,359,000","-203,674,000",,"392,814,000"
15701,"Revenue from customer contracts","Accounting for license and collaboration agreements with Gilead Sciences, Inc.",474908,12/31/21,02/23/22,2,"Ernst & Young LLP",,,,"Redwood City",CA,CALIFORNIA,"US West",10-K,2022-02-23,,"Arcus Biosciences, Inc.",1724521,"=""RCUS""","3928 POINT EDEN WAY",,HAYWARD,CA,CALIFORNIA,"US West",,,"=""2834""","Pharmaceutical Preparations",325412,"Pharmaceutical Preparation Manufacturing",34,40,12/31/21,"2,864,536,832",12/31/21,"383,000,000","53,000,000",,"1,591,898,000"
15494,"Research and development expenses","Accrued Clinical Trial Costs",474629,12/31/21,02/22/22,2,"Ernst & Young LLP",,,,"Los Angeles",CA,CALIFORNIA,"US West",10-K,2022-02-22,,"Arcutis Biotherapeutics, Inc.",1787306,"=""ARQT""","3027 TOWNSGATE ROAD","SUITE 300","WESTLAKE VILLAGE",CA,CALIFORNIA,"US West",,,"=""2834""","Pharmaceutical Preparations",325412,"Pharmaceutical Preparation Manufacturing",34,21,12/31/21,"1,042,301,440",12/31/21,,"-206,356,000",,"408,152,000"
17809,"Business combinations","Accounting for the merger with Gores Holdings V. under IFRS 2",477485,12/31/21,03/04/22,1,"PricewaterhouseCoopers LLP",104,PricewaterhouseCoopers,1366,Dublin,L2,IRELAND,Foreign,20-F,2022-03-04,,"Ardagh Metal Packaging S.A.",1845097,"=""AMBP""","56, RUE CHARLES MARTEL",,LUXEMBOURG,N4,LUXEMBOURG,Foreign,,,"=""3411""","Metal Cans",332431,"Metal Can Manufacturing",34,,,,12/31/21,"4,055,000,000","-210,000,000","-1,376,000,000","5,325,000,000"
17811,"Business combinations","Accounting for the merger with Gores Holdings V. under IFRS 2",477487,12/31/21,03/04/22,1,"PricewaterhouseCoopers LLP",104,PricewaterhouseCoopers,1366,Dublin,L2,IRELAND,Foreign,"POS AM",2022-03-04,,"Ardagh Metal Packaging S.A.",1845097,"=""AMBP""","56, RUE CHARLES MARTEL",,LUXEMBOURG,N4,LUXEMBOURG,Foreign,,,"=""3411""","Metal Cans",332431,"Metal Can Manufacturing",34,,,,12/31/21,"4,055,000,000","-210,000,000","-1,376,000,000","5,325,000,000"
16890,"Business combinations","Accounting for Restructuring activities",476469,12/31/21,02/28/22,2,"Ernst & Young LLP",,,,"Redwood City",CA,CALIFORNIA,"US West",10-K,2022-02-28,Yes,"ARDELYX, INC.",1437402,"=""ARDX""","34175 ARDENWOOD BLVD.",,FREMONT,CA,CALIFORNIA,"US West",,,"=""2834""","Pharmaceutical Preparations",325412,"Pharmaceutical Preparation Manufacturing",34,1,12/31/21,"143,200,784",12/31/21,"10,097,000","-158,165,000",,"149,913,000"
18294,"Property, plant and equipment","Vessel Impairment – Future Charter Rates – Refer to Note 2 of the consolidated financial statements",479184,12/31/21,03/11/22,3,"Deloitte & Touche LLP",,,,"New York",NY,"NEW YORK","US Mid Atlantic",20-F,2022-03-11,,"Ardmore Shipping Corp",1577437,"=""ASC""","DORCHESTER HOUSE","7 CHURCH STREET",HAMILTON,D0,BERMUDA,Foreign,,,"=""4412""","Deep Sea Foreign Transportation of  Freight",483111,"Deep Sea Freight Transportation",34,3,12/29/21,"111,506,984",12/31/21,"192,484,301","-36,832,643",,"724,530,914"
15651,"Research and development expenses","Evaluation of the accrued clinical and preclinical study fees",474844,12/31/21,02/23/22,4,"KPMG LLP",,,,"San Diego",CA,CALIFORNIA,"US West",10-K,2022-02-23,,"ARENA PHARMACEUTICALS INC",1080709,,"6154 NANCY RIDGE DRIVE",,"SAN DIEGO",CA,CALIFORNIA,"US West",,,"=""2834""","Pharmaceutical Preparations",325412,"Pharmaceutical Preparation Manufacturing",34,93,12/31/21,"5,721,769,472",12/31/21,"54,000","-616,433,000",,"784,705,000"
14537,"Other investments","Fair value of investments",473233,12/31/21,02/09/22,4,"KPMG LLP",,,,"Los Angeles",CA,CALIFORNIA,"US West",10-K,2022-02-09,,"ARES CAPITAL CORP",1287750,"=""ARCC""","245 PARK AVENUE, 44TH FLOOR",,"NEW YORK",NY,"NEW YORK","US Mid Atlantic",,,,,525990,"Other Financial Vehicles",34,21,12/29/21,"9,606,719,488",12/31/21,"1,448,000,000","1,567,000,000",,"20,843,000,000"
14766,"Allowance for credit losses","Current expected credit losses",473689,12/31/21,02/14/22,2,"Ernst & Young LLP",,,,"Los Angeles",CA,CALIFORNIA,"US West",10-K,2022-02-15,,"Ares Commercial Real Estate Corp",1529377,"=""ACRE""","245 PARK AVENUE","42ND FLOOR","NEW YORK",NY,"NEW YORK","US Mid Atlantic",,,"=""6798""","Real Estate Investment Trusts",525990,"Other Financial Vehicles",34,15,12/31/21,"685,474,624",12/31/21,"18,518,000","60,460,000",,"241,394,000"
18048,"Long-lived assets","Evaluation of the estimated fair value of certain acquired tangible assets",478667,12/31/21,03/09/22,4,"KPMG LLP",,,,Denver,CO,COLORADO,"US West",10-K,2022-03-09,,"ARES INDUSTRIAL REAL ESTATE INCOME TRUST Inc.",1625941,"=""ZAIRDX""","1200 17TH STREET","SUITE 2900",DENVER,CO,COLORADO,"US West",,,"=""6798""","Real Estate Investment Trusts",525990,"Other Financial Vehicles",34,,,,12/31/21,"177,069,000","-75,349,000",,"5,249,109,000"
17107,"Equity investments and joint ventures","Valuation of underlying investments of equity method investments",476360,12/31/21,02/28/22,2,"Ernst & Young LLP",,,,"Los Angeles",CA,CALIFORNIA,"US West",10-K,2022-02-28,,"Ares Management Corp",1176948,"=""ARES""","1800 AVE OF THE STARS","SUITE 1400","LOS ANGELES",CA,CALIFORNIA,"US West",,,"=""6282""","Investment Advice",523930,"Investment Advice",34,81,12/31/21,"13,681,910,784",12/31/21,"3,917,283,000","408,837,000","1,498,417,000","21,605,164,000"
17108,"Business combinations","Accounting for the acquisition of Landmark Partners, LLC",476360,12/31/21,02/28/22,2,"Ernst & Young LLP",,,,"Los Angeles",CA,CALIFORNIA,"US West",10-K,2022-02-28,,"Ares Management Corp",1176948,"=""ARES""","1800 AVE OF THE STARS","SUITE 1400","LOS ANGELES",CA,CALIFORNIA,"US West",,,"=""6282""","Investment Advice",523930,"Investment Advice",34,81,12/31/21,"13,681,910,784",12/31/21,"3,917,283,000","408,837,000","1,498,417,000","21,605,164,000"
18401,"Business combinations","Assessment of the estimated fair value of certain acquired tangible and intangible assets and liabilities",479316,12/31/21,03/11/22,4,"KPMG LLP",,,,Denver,CO,COLORADO,"US West",10-K,2022-03-14,,"Ares Real Estate Income Trust Inc.",1327978,"=""ZAREDX""","ONE TABOR CENTER","1200 SEVENTEENTH STREET, SUITE 2900",DENVER,CO,COLORADO,"US West",,,"=""6798""","Real Estate Investment Trusts",525990,"Other Financial Vehicles",34,,,,12/31/21,"218,350,000","30,754,000",,"2,990,971,000"
18402,"Real estate investments","Assessment of the expected hold periods for investments in real estate properties",479316,12/31/21,03/11/22,4,"KPMG LLP",,,,Denver,CO,COLORADO,"US West",10-K,2022-03-14,,"Ares Real Estate Income Trust Inc.",1327978,"=""ZAREDX""","ONE TABOR CENTER","1200 SEVENTEENTH STREET, SUITE 2900",DENVER,CO,COLORADO,"US West",,,"=""6798""","Real Estate Investment Trusts",525990,"Other Financial Vehicles",34,,,,12/31/21,"218,350,000","30,754,000",,"2,990,971,000"
18900,"Research and development expenses","Trade and Other Payables – Research and development cost accruals — Refer to Note 15 to the financial statements",480179,12/31/21,03/21/22,3,"Deloitte & Touche LLP",21,"Deloitte Accountants BV",1243,Rotterdam,P7,NETHERLANDS,Foreign,20-F,2022-03-21,,"ARGENX SE",1697862,"=""ARGX""","INDUSTRIEPARK ZWIJNAARDE 7","BUILDING C B-9052",ZWIJNAARDE,C9,BELGIUM,Foreign,,,"=""2836""","Biological Products, Except Diagnostic Substances",325414,"Biological Product (except Diagnostic) Manufacturing",34,351,12/29/21,"16,715,597,824",12/31/21,"539,418,000","-408,266,000","2,362,539,000","2,850,273,000"
18901,"Revenue from customer contracts","Revenue – Determination of appropriate accounting of the license and collaboration agreement  — Refer to Note 16 to the financial statements ",480179,12/31/21,03/21/22,3,"Deloitte & Touche LLP",21,"Deloitte Accountants BV",1243,Rotterdam,P7,NETHERLANDS,Foreign,20-F,2022-03-21,,"ARGENX SE",1697862,"=""ARGX""","INDUSTRIEPARK ZWIJNAARDE 7","BUILDING C B-9052",ZWIJNAARDE,C9,BELGIUM,Foreign,,,"=""2836""","Biological Products, Except Diagnostic Substances",325414,"Biological Product (except Diagnostic) Manufacturing",34,351,12/29/21,"16,715,597,824",12/31/21,"539,418,000","-408,266,000","2,362,539,000","2,850,273,000"
18629,"Other contingent liabilities","Reserves for losses and loss adjustment expenses
",479677,12/31/21,03/16/22,2,"Ernst & Young LLP",,,,"San Antonio",TX,TEXAS,"US Southwest",10-K,2022-03-16,,"Argo Group International Holdings, Inc.",1091748,"=""ARGD""","501 7TH AVENUE, 7TH FLOOR",,"NEW YORK",NY,"NEW YORK","US Mid Atlantic",,,"=""6361""","Title Insurance",524126,"Direct Property and Casualty Insurance Carriers",34,58,12/31/21,"2,026,701,184",12/31/21,"2,130,300,000","6,700,000","1,570,600,000","10,317,800,000"
14767,Inventory,"Inventory Valuation & Contract Manufacturer/Supplier Liabilities",473686,12/31/21,02/14/22,2,"Ernst & Young LLP",,,,"San Jose",CA,CALIFORNIA,"US West",10-K,2022-02-15,,"Arista Networks, Inc.",1596532,"=""ANET""","5453 GREAT AMERICA PARKWAY",,"SANTA CLARA",CA,CALIFORNIA,"US West",,,"=""3576""","Computer Communications Equipment",511210,"Software Publishers",34,144,12/31/21,"44,229,144,576",12/31/21,"2,948,037,000","840,854,000","3,696,648,000","5,734,429,000"
16640,"Regulatory assets and liabilities","Regulatory Accounting — Impact of Rate Regulation on the Financial Statements — Refer to Notes 1 and 4 to the financial statements.",475579,12/31/21,02/25/22,3,"Deloitte & Touche LLP",,,,Phoenix,AZ,ARIZONA,"US Southwest",10-K,2022-02-25,,"ARIZONA PUBLIC SERVICE CO",7286,,"400 NORTH FIFTH STREET",,PHOENIX,AZ,ARIZONA,"US Southwest",764622,"PINNACLE WEST CAPITAL CORP","=""4931""","Electric and Other Services Combined",221112,"Fossil Fuel Electric Power Generation",34,,,,12/31/21,"3,803,835,000","632,279,000","6,361,676,000","21,909,656,000"
18177,"Other investments","Fair Value of the Mortgage Servicing Rights used to value the MSR Financing Receivables",478863,12/31/21,03/10/22,1,"PricewaterhouseCoopers LLP",,,,Washington,DC,"DISTRICT OF COLUMBIA","US Mid Atlantic",10-K,2022-03-10,,"Arlington Asset Investment Corp.",1209028,,"6862 ELM STREET","SUITE 320",MCLEAN,VA,VIRGINIA,"US Mid Atlantic",,,"=""6798""","Real Estate Investment Trusts",525990,"Other Financial Vehicles",34,25,12/29/21,"790,763,008",12/31/21,"17,583,000","-9,515,000",,"726,860,000"
18178,"Other investments","Fair Value of Certain Credit Securities",478863,12/31/21,03/10/22,1,"PricewaterhouseCoopers LLP",,,,Washington,DC,"DISTRICT OF COLUMBIA","US Mid Atlantic",10-K,2022-03-10,,"Arlington Asset Investment Corp.",1209028,,"6862 ELM STREET","SUITE 320",MCLEAN,VA,VIRGINIA,"US Mid Atlantic",,,"=""6798""","Real Estate Investment Trusts",525990,"Other Financial Vehicles",34,25,12/29/21,"790,763,008",12/31/21,"17,583,000","-9,515,000",,"726,860,000"
15910,"Allowance for credit losses","Allowance for Loan Losses - Notes Receivable
",475236,12/31/21,02/23/22,2,"Ernst & Young LLP",,,,Richmond,VA,VIRGINIA,"US Mid Atlantic",10-K,2022-02-24,,"Armada Hoffler Properties, Inc.",1569187,"=""AHH""","222 CENTRAL PARK AVENUE","SUITE 2100","VIRGINIA BEACH",VA,VIRGINIA,"US Mid Atlantic",,,"=""6500""","Real Estate",525990,"Other Financial Vehicles",34,15,12/31/21,"959,038,080",12/31/21,"284,076,000","21,892,000","493,314,000","1,938,063,000"
15911,"Business combinations","Accounting for Acquisition of Operating Properties
",475236,12/31/21,02/23/22,2,"Ernst & Young LLP",,,,Richmond,VA,VIRGINIA,"US Mid Atlantic",10-K,2022-02-24,,"Armada Hoffler Properties, Inc.",1569187,"=""AHH""","222 CENTRAL PARK AVENUE","SUITE 2100","VIRGINIA BEACH",VA,VIRGINIA,"US Mid Atlantic",,,"=""6500""","Real Estate",525990,"Other Financial Vehicles",34,15,12/31/21,"959,038,080",12/31/21,"284,076,000","21,892,000","493,314,000","1,938,063,000"
18771,"Research and development expenses","Accrued clinical trial expenses and related research and development costs",479903,12/31/21,03/17/22,2,"Ernst & Young LLP",,,,"San Diego",CA,CALIFORNIA,"US West",10-K,2022-03-17,Yes,"Armata Pharmaceuticals, Inc.",921114,"=""ARMP""","5005 MCCONNELL AVE",,"LOS ANGELES",CA,CALIFORNIA,"US West",,,"=""2836""","Biological Products, Except Diagnostic Substances",325414,"Biological Product (except Diagnostic) Manufacturing",34,5,12/31/21,"148,575,392",12/31/21,"4,474,000","-23,155,000","11,651,000","69,768,000"
18772,Leases,"Determination of incremental borrowing rate for lease right-of-use assets and lease liabilities",479903,12/31/21,03/17/22,2,"Ernst & Young LLP",,,,"San Diego",CA,CALIFORNIA,"US West",10-K,2022-03-17,Yes,"Armata Pharmaceuticals, Inc.",921114,"=""ARMP""","5005 MCCONNELL AVE",,"LOS ANGELES",CA,CALIFORNIA,"US West",,,"=""2836""","Biological Products, Except Diagnostic Substances",325414,"Biological Product (except Diagnostic) Manufacturing",34,5,12/31/21,"148,575,392",12/31/21,"4,474,000","-23,155,000","11,651,000","69,768,000"
18059,"Long-lived assets","Valuation of North American long-lived tangible and intangible assets",478669,12/31/21,03/09/22,4,"KPMG LLP",,,,Philadelphia,PA,PENNSYLVANIA,"US Mid Atlantic",10-K,2022-03-09,Yes,"Armstrong Flooring, Inc.",1655075,"=""AFIIQ""","1770 HEMPSTEAD ROAD","P.O. BOX 10068",LANCASTER,PA,PENNSYLVANIA,"US Mid Atlantic",,,"=""3089""","Plastics Products, NEC",321918,"Other Millwork (including Flooring)",34,2,12/31/21,"43,123,560",12/31/21,"649,900,000","-53,000,000","186,800,000","517,000,000"
18060,Inventory,"Net realizable value of certain inventory",478669,12/31/21,03/09/22,4,"KPMG LLP",,,,Philadelphia,PA,PENNSYLVANIA,"US Mid Atlantic",10-K,2022-03-09,Yes,"Armstrong Flooring, Inc.",1655075,"=""AFIIQ""","1770 HEMPSTEAD ROAD","P.O. BOX 10068",LANCASTER,PA,PENNSYLVANIA,"US Mid Atlantic",,,"=""3089""","Plastics Products, NEC",321918,"Other Millwork (including Flooring)",34,2,12/31/21,"43,123,560",12/31/21,"649,900,000","-53,000,000","186,800,000","517,000,000"
15388,"Pension and other post-employment benefits","Pension and post retirement benefit obligations",474424,12/31/21,02/22/22,4,"KPMG LLP",,,,Philadelphia,PA,PENNSYLVANIA,"US Mid Atlantic",10-K,2022-02-22,,"ARMSTRONG WORLD INDUSTRIES INC",7431,"=""AWI""","2500 COLUMBIA AVE",,LANCASTER,PA,PENNSYLVANIA,"US Mid Atlantic",,,"=""3089""","Plastics Products, NEC",326199,"All Other Plastics Product Manufacturing",34,116,12/31/21,"5,492,743,168",12/31/21,"1,106,600,000","183,200,000","-68,700,000","1,710,000,000"
15064,"Other intangible assets","Intangible Asset Impairment Assessment – Wireless Spectrum Licenses (UScellular Licenses)",474065,12/31/21,02/17/22,1,"PricewaterhouseCoopers LLP",,,,Chicago,IL,ILLINOIS,"US Midwest",10-K,2022-02-17,,"ARRAY DIGITAL INFRASTRUCTURE, INC.",821130,"=""AD""","500 WEST MADISON STREET","SUITE 810",CHICAGO,IL,ILLINOIS,"US Midwest",1051512,"TELEPHONE & DATA SYSTEMS INC /DE/","=""4812""","Radiotelephone Communications",517212,"Cellular and Other Wireless Telecommunications",34,32,12/31/21,"1,670,560,000",12/31/21,"4,122,000,000","155,000,000","470,000,000","10,341,000,000"
20621,"Deferred and capitalized costs","Capitalization of development costs",485188,12/31/21,04/27/22,4,"KPMG LLP",87,"KPMG LLP",1118,London,X0,"UNITED KINGDOM",Foreign,20-F,2022-04-27,,Arrival,1835059,"=""ARVLF""","60A, RUE DES BRUYERES","L-1274 HOWALD LUXEMBOURG",LUXEMBOURG,N4,LUXEMBOURG,Foreign,,,"=""3711""","Motor Vehicles and Passenger Car Bodies",336111,"Automobile Manufacturing",34,0,12/01/25,"131,532",12/31/21,,"-1,254,989,000","814,889,000","1,778,494,000"
20622,"Business combinations","Accounting for the merger with CIIG Merger Corp.",485188,12/31/21,04/27/22,4,"KPMG LLP",87,"KPMG LLP",1118,London,X0,"UNITED KINGDOM",Foreign,20-F,2022-04-27,,Arrival,1835059,"=""ARVLF""","60A, RUE DES BRUYERES","L-1274 HOWALD LUXEMBOURG",LUXEMBOURG,N4,LUXEMBOURG,Foreign,,,"=""3711""","Motor Vehicles and Passenger Car Bodies",336111,"Automobile Manufacturing",34,0,12/01/25,"131,532",12/31/21,,"-1,254,989,000","814,889,000","1,778,494,000"
20623,"Allowance for credit losses","Recoverability of employee loans",485188,12/31/21,04/27/22,4,"KPMG LLP",87,"KPMG LLP",1118,London,X0,"UNITED KINGDOM",Foreign,20-F,2022-04-27,,Arrival,1835059,"=""ARVLF""","60A, RUE DES BRUYERES","L-1274 HOWALD LUXEMBOURG",LUXEMBOURG,N4,LUXEMBOURG,Foreign,,,"=""3711""","Motor Vehicles and Passenger Car Bodies",336111,"Automobile Manufacturing",34,0,12/01/25,"131,532",12/31/21,,"-1,254,989,000","814,889,000","1,778,494,000"
22048,"Deferred and capitalized costs","Capitalisation of development costs",490772,12/31/21,04/27/22,4,"KPMG LLP",87,"KPMG LLP",1118,London,X0,"UNITED KINGDOM",Foreign,6-K,2022-08-12,,Arrival,1835059,"=""ARVLF""","60A, RUE DES BRUYERES","L-1274 HOWALD LUXEMBOURG",LUXEMBOURG,N4,LUXEMBOURG,Foreign,,,"=""3711""","Motor Vehicles and Passenger Car Bodies",336111,"Automobile Manufacturing",34,0,12/01/25,"131,532",12/31/21,,"-1,254,989,000","814,889,000","1,778,494,000"
22049,"Business combinations","Accounting for the merger with CIIG Merger Corp.",490772,12/31/21,04/27/22,4,"KPMG LLP",87,"KPMG LLP",1118,London,X0,"UNITED KINGDOM",Foreign,6-K,2022-08-12,,Arrival,1835059,"=""ARVLF""","60A, RUE DES BRUYERES","L-1274 HOWALD LUXEMBOURG",LUXEMBOURG,N4,LUXEMBOURG,Foreign,,,"=""3711""","Motor Vehicles and Passenger Car Bodies",336111,"Automobile Manufacturing",34,0,12/01/25,"131,532",12/31/21,,"-1,254,989,000","814,889,000","1,778,494,000"
22050,"Allowance for credit losses","Recoverability of employee loans",490772,12/31/21,04/27/22,4,"KPMG LLP",87,"KPMG LLP",1118,London,X0,"UNITED KINGDOM",Foreign,6-K,2022-08-12,,Arrival,1835059,"=""ARVLF""","60A, RUE DES BRUYERES","L-1274 HOWALD LUXEMBOURG",LUXEMBOURG,N4,LUXEMBOURG,Foreign,,,"=""3711""","Motor Vehicles and Passenger Car Bodies",336111,"Automobile Manufacturing",34,0,12/01/25,"131,532",12/31/21,,"-1,254,989,000","814,889,000","1,778,494,000"
22061,"Deferred and capitalized costs","Capitalisation of development costs",490778,12/31/21,04/27/22,4,"KPMG LLP",87,"KPMG LLP",1118,London,X0,"UNITED KINGDOM",Foreign,6-K/A,2022-08-15,,Arrival,1835059,"=""ARVLF""","60A, RUE DES BRUYERES","L-1274 HOWALD LUXEMBOURG",LUXEMBOURG,N4,LUXEMBOURG,Foreign,,,"=""3711""","Motor Vehicles and Passenger Car Bodies",336111,"Automobile Manufacturing",34,0,12/01/25,"131,532",12/31/21,,"-1,254,989,000","814,889,000","1,778,494,000"
22062,"Business combinations","Accounting for the merger with CIIG Merger Corp.",490778,12/31/21,04/27/22,4,"KPMG LLP",87,"KPMG LLP",1118,London,X0,"UNITED KINGDOM",Foreign,6-K/A,2022-08-15,,Arrival,1835059,"=""ARVLF""","60A, RUE DES BRUYERES","L-1274 HOWALD LUXEMBOURG",LUXEMBOURG,N4,LUXEMBOURG,Foreign,,,"=""3711""","Motor Vehicles and Passenger Car Bodies",336111,"Automobile Manufacturing",34,0,12/01/25,"131,532",12/31/21,,"-1,254,989,000","814,889,000","1,778,494,000"
22063,"Allowance for credit losses","Recoverability of employee loans",490778,12/31/21,04/27/22,4,"KPMG LLP",87,"KPMG LLP",1118,London,X0,"UNITED KINGDOM",Foreign,6-K/A,2022-08-15,,Arrival,1835059,"=""ARVLF""","60A, RUE DES BRUYERES","L-1274 HOWALD LUXEMBOURG",LUXEMBOURG,N4,LUXEMBOURG,Foreign,,,"=""3711""","Motor Vehicles and Passenger Car Bodies",336111,"Automobile Manufacturing",34,0,12/01/25,"131,532",12/31/21,,"-1,254,989,000","814,889,000","1,778,494,000"
15149,"Revenue from customer contracts","Estimate of variable consideration for revenue recognition",474003,12/31/21,02/17/22,2,"Ernst & Young LLP",55,"Ernst & Young AB",1433,Stockholm,V7,SWEDEN,Foreign,10-K,2022-02-17,,"Arriver Holdco, Inc.",1733186,,"26545 AMERICAN DRIVE",,SOUTHFIELD,MI,MICHIGAN,"US Midwest",,,"=""3714""","Motor Vehicle Parts and Accessories",336322,"Other Motor Vehicle Electrical and Electronic Equipment Manufacturing",34,35,12/31/21,"3,973,760,000",12/31/21,"1,657,000,000","-385,000,000","524,000,000","1,750,000,000"
14665,Inventory,"Evaluation of net realizable value adjustments to inventories for excess or obsolescence",473437,12/31/21,02/11/22,2,"Ernst & Young LLP",,,,Denver,CO,COLORADO,"US West",10-K,2022-02-11,,"ARROW ELECTRONICS, INC.",7536,"=""ARW""","7459 S LIMA STREET",,ENGLEWOOD,CO,COLORADO,"US West",,,"=""5065""","Electronic Parts and Equipment, NEC",423610,"Electrical Apparatus and Equipment, Wiring Supplies, and Related Equipment Merchant  Wholesalers",34,134,12/31/21,"9,139,221,504",12/31/21,"34,477,018,000","1,108,197,000","3,006,895,000","19,535,540,000"
14666,Goodwill,"Evaluation of Americas Components and eInfochips Goodwill for Impairment",473437,12/31/21,02/11/22,2,"Ernst & Young LLP",,,,Denver,CO,COLORADO,"US West",10-K,2022-02-11,,"ARROW ELECTRONICS, INC.",7536,"=""ARW""","7459 S LIMA STREET",,ENGLEWOOD,CO,COLORADO,"US West",,,"=""5065""","Electronic Parts and Equipment, NEC",423610,"Electrical Apparatus and Equipment, Wiring Supplies, and Related Equipment Merchant  Wholesalers",34,134,12/31/21,"9,139,221,504",12/31/21,"34,477,018,000","1,108,197,000","3,006,895,000","19,535,540,000"
18343,"Allowance for credit losses","Allowance for Credit Losses – Loans evaluated on a collective basis",479246,12/31/21,03/11/22,4,"KPMG LLP",,,,Albany,NY,"NEW YORK","US Mid Atlantic",10-K,2022-03-11,,"ARROW FINANCIAL CORP",717538,"=""AROW""","250 GLEN ST",,"GLENS FALLS",NY,"NEW YORK","US Mid Atlantic",,,"=""6021""","National Commercial Banks",522110,"Commercial Banking",34,35,12/31/21,"565,154,816",12/31/21,"142,452,000","49,857,000","347,395,000","4,027,952,000"
15335,"Business combinations","Business acquisitions – Accounting for acquisitions",474334,12/31/21,02/18/22,2,"Ernst & Young LLP",,,,Chicago,IL,ILLINOIS,"US Midwest",10-K,2022-02-18,,"Arthur J. Gallagher & Co.",354190,"=""AJG""","2850 GOLF ROAD",,"ROLLING MEADOWS",IL,ILLINOIS,"US Midwest",,,"=""6411""","Insurance Agents, Brokers, and Service",524210,"Insurance Agencies and Brokerages",34,170,12/31/21,"35,376,193,536",12/31/21,"8,209,400,000","906,800,000","-4,111,800,000","33,345,000,000"
15461,"Deferred income taxes","Income Taxes – Deferred Tax Assets and Amounts Payable Under Tax Receivable Agreements",474562,12/31/21,02/22/22,1,"PricewaterhouseCoopers LLP",,,,Chicago,IL,ILLINOIS,"US Midwest",10-K,2022-02-22,,"Artisan Partners Asset Management Inc.",1517302,"=""APAM""","875 E. WISCONSIN AVENUE","SUITE 800",MILWAUKEE,WI,WISCONSIN,"US Midwest",,,"=""6282""","Investment Advice",523120,"Securities Brokerage",34,48,12/31/21,"3,177,581,824",12/31/21,"1,216,433,000","336,158,000",,"1,208,047,000"
15436,"Deferred and capitalized costs","Deferred Preservation Costs",474615,12/31/21,02/22/22,2,"Ernst & Young LLP",,,,Atlanta,GA,GEORGIA,"US Southeast",10-K,2022-02-22,,"ARTIVION, INC.",784199,"=""AORT""","1655 ROBERTS BOULEVARD N W",,KENNESAW,GA,GEORGIA,"US Southeast",,,"=""3841""","Surgical and Medical Instruments and Apparatus",541710,"Research and Development in the Physical, Engineering, and Life Sciences",34,20,12/31/21,"812,168,512",12/31/21,"298,836,000","-14,834,000","-101,368,000","793,052,000"
16991,"Research and development expenses","Prepaid and Accrued Research and Development - Refer to Note 2 in the Consolidated Financial Statements",476530,12/31/21,02/28/22,3,"Deloitte & Touche LLP",,,,Hartford,CT,CONNECTICUT,"US New England",10-K,2022-02-28,,"ARVINAS, INC.",1655759,"=""ARVN""","395 WINCHESTER AVE","5 SCIENCE PARK","NEW HAVEN",CT,CONNECTICUT,"US New England",,,"=""2834""","Pharmaceutical Preparations",325412,"Pharmaceutical Preparation Manufacturing",34,82,12/31/21,"4,353,419,776",12/31/21,"46,700,000","-191,000,000",,"1,581,600,000"
16992,"Revenue from customer contracts","Accounting Considerations for ARV 471 Revenue Agreement – Refer to Notes 2 and 3 in the consolidated financial statements",476530,12/31/21,02/28/22,3,"Deloitte & Touche LLP",,,,Hartford,CT,CONNECTICUT,"US New England",10-K,2022-02-28,,"ARVINAS, INC.",1655759,"=""ARVN""","395 WINCHESTER AVE","5 SCIENCE PARK","NEW HAVEN",CT,CONNECTICUT,"US New England",,,"=""2834""","Pharmaceutical Preparations",325412,"Pharmaceutical Preparation Manufacturing",34,82,12/31/21,"4,353,419,776",12/31/21,"46,700,000","-191,000,000",,"1,581,600,000"
17272,"Other intangible assets","Manufacturer Franchise Rights Impairment Assessment
",476929,12/31/21,03/01/22,2,"Ernst & Young LLP",,,,Atlanta,GA,GEORGIA,"US Southeast",10-K,2022-03-01,,"ASBURY AUTOMOTIVE GROUP INC",1144980,"=""ABG""","6655 PEACHTREE DUNWOODY ROAD",,ATLANTA,GA,GEORGIA,"US Southeast",,,"=""5500""","Retail-Auto Dealers & Gasoline Stations",441110,"New Car Dealers",34,173,12/31/21,"3,996,634,112",12/31/21,"9,837,700,000","532,400,000","-1,491,900,000","8,002,600,000"
17571,"Research and development expenses","Prepayments, Trade Payables and Accrued Expenses - Clinical Trial Accruals — Refer to Notes 2 and 3 to the financial statements",477175,12/31/21,03/02/22,3,"Deloitte & Touche LLP",582,"Deloitte Statsautoriseret Revisionspartnerselskab",1294,Copenhagen,G7,DENMARK,Foreign,20-F,2022-03-02,,"Ascendis Pharma A/S",1612042,"=""ASND""","TUBORG BOULEVARD 12",,HELLERUP,G7,DENMARK,Foreign,,,"=""2834""","Pharmaceutical Preparations",325412,"Pharmaceutical Preparation Manufacturing",34,134,12/29/21,"7,189,114,368",12/31/21,"8,845,000","-436,205,000","998,878,000","1,233,776,000"
19289,Goodwill,"Goodwill - Packaging and Testing Segments - Refer to Notes 4, 5, 18, 29 and 30 to the Consolidated Financial Statements",481088,12/31/21,03/25/22,3,"Deloitte & Touche LLP",28,"Deloitte & Touche",1060,Taipei,F5,TAIWAN,Foreign,20-F,2022-03-29,,"ASE Technology Holding Co., Ltd.",1122411,"=""ASX""","26, CHIN 3RD RD.","NANZIH DISTRICT",KAOHSIUNG,F5,TAIWAN,Foreign,,,"=""3674""","Semiconductors and Related Devices",334413,"Semiconductor and Related Device Manufacturing",34,8,12/31/21,"16,723,717,120",12/31/21,"20,602,058,000","2,249,973,000","6,397,171,000","24,334,619,000"
17494,"Discontinued operations","Discontinued Operations — Refer to Note 4 to the financial statements
",476654,12/31/21,02/28/22,3,"Deloitte & Touche LLP",,,,"Los Angeles",CA,CALIFORNIA,"US West",10-K,2022-03-01,,"ASGN Inc",890564,"=""ASGN""","4400 COX ROAD, SUITE 110",,"GLEN ALLEN",VA,VIRGINIA,"US Mid Atlantic",,,"=""7363""","Help Supply Services",561310,"Employment Placement Agencies",34,123,12/31/21,"6,392,119,808",12/31/21,"4,009,500,000","409,900,000","-192,000,000","3,502,800,000"
13664,"Asset retirement and environmental obligations","Valuation of Environmental Remediation Reserves",467904,09/30/21,11/22/21,2,"Ernst & Young LLP",,,,"Grandview Heights",OH,OHIO,"US Midwest",10-K,2021-11-22,,"ASHLAND INC.",1674862,"=""ASH""","8145 BLAZER DRIVE",,WILMINGTON,DE,DELAWARE,"US Mid Atlantic",,,"=""5160""","Wholesale-Chemicals & Allied Products",424690,"Other Chemical and Allied Products Merchant Wholesalers",34,89,09/30/21,"5,079,839,744",09/30/21,"2,111,000,000","220,000,000","223,000,000","6,612,000,000"
13665,"Other contingent liabilities","Valuation of Asbestos Litigation Reserve ",467904,09/30/21,11/22/21,2,"Ernst & Young LLP",,,,"Grandview Heights",OH,OHIO,"US Midwest",10-K,2021-11-22,,"ASHLAND INC.",1674862,"=""ASH""","8145 BLAZER DRIVE",,WILMINGTON,DE,DELAWARE,"US Mid Atlantic",,,"=""5160""","Wholesale-Chemicals & Allied Products",424690,"Other Chemical and Allied Products Merchant Wholesalers",34,89,09/30/21,"5,079,839,744",09/30/21,"2,111,000,000","220,000,000","223,000,000","6,612,000,000"
20844,"Revenue from customer contracts","Revenue Recognition – Estimating Measure of Progress for Supply, Delivery and Installation (“SDI”) Contracts",485643,12/31/21,04/29/22,1,"PricewaterhouseCoopers LLP",331,"PricewaterhouseCoopers Taiwan",1345,Taipei,F5,TAIWAN,Foreign,20-F,2022-04-29,,"ASIA PACIFIC WIRE & CABLE CORP LTD",1026980,"=""APWC""","15/FL. B, NO. 77, SEC. 2,","DUNHUA SOUTH ROAD","TAIPEI, 106",F5,TAIWAN,Foreign,,,"=""3357""","Drawing and Insulating of Nonferrous Wire",332618,"Other Fabricated Wire Product Manufacturing",34,2,12/29/21,"27,293,846",12/31/21,"476,659,000","-8,512,000","147,371,000","389,428,000"
14554,"Revenue from customer contracts","Revenue recognition - Identification of distinct performance obligations and allocation of the total contract consideration",473213,12/31/21,02/09/22,4,"KPMG LLP",76,"KPMG Accountants NV",1012,Amstelveen,P7,NETHERLANDS,Foreign,20-F,2022-02-09,,"ASML HOLDING NV",937966,"=""ASML""","DE RUN 6501",,"DR VELDHOVEN",P7,NETHERLANDS,Foreign,,,"=""3559""","Special  Industry Machinery, NEC",333295,"Semiconductor Machinery Manufacturing",34,802,12/29/21,"334,035,910,656",12/31/21,"21,164,500,000","6,690,400,000","5,268,500,000","34,378,800,000"
17361,Inventory,"Net realizable value of certain inventories",476716,12/31/21,02/28/22,4,"KPMG LLP",,,,Hartford,CT,CONNECTICUT,"US New England",10-K,2022-03-01,,"ASPEN AEROGELS INC",1145986,"=""ASPN""","30 FORBES ROAD","BUILDING B",NORTHBOROUGH,MA,MASSACHUSETTS,"US New England",,,"=""5030""","Wholesale-Lumber & Other Construction Materials",541330,"Engineering Services",34,50,12/31/21,"1,653,929,984",12/31/21,"121,622,000","-36,865,000",,"182,954,000"
21133,"Insurance contract liabilities","Estimate of claims Incurred but not reported",487032,12/31/21,05/16/22,4,"KPMG LLP",87,"KPMG LLP",1118,London,X0,"UNITED KINGDOM",Foreign,20-F,2022-05-16,,"ASPEN INSURANCE HOLDINGS LTD",1267395,"=""AHL""","11 VICTORIA ST",,HAMILTON,D0,BERMUDA,Foreign,,,"=""6331""","Fire, Marine, and Casualty Insurance",524130,"Reinsurance Carriers",34,27,12/29/21,"1,624,648,064",12/31/21,"2,628,900,000","29,800,000","2,752,900,000","13,844,100,000"
21134,"Other investments","Fair value of privately-held investments",487032,12/31/21,05/16/22,4,"KPMG LLP",87,"KPMG LLP",1118,London,X0,"UNITED KINGDOM",Foreign,20-F,2022-05-16,,"ASPEN INSURANCE HOLDINGS LTD",1267395,"=""AHL""","11 VICTORIA ST",,HAMILTON,D0,BERMUDA,Foreign,,,"=""6331""","Fire, Marine, and Casualty Insurance",524130,"Reinsurance Carriers",34,27,12/29/21,"1,624,648,064",12/31/21,"2,628,900,000","29,800,000","2,752,900,000","13,844,100,000"
21135,"Insurance contract liabilities","Estimate of reinsurance recoverables on claims incurred but not reported",487032,12/31/21,05/16/22,4,"KPMG LLP",87,"KPMG LLP",1118,London,X0,"UNITED KINGDOM",Foreign,20-F,2022-05-16,,"ASPEN INSURANCE HOLDINGS LTD",1267395,"=""AHL""","11 VICTORIA ST",,HAMILTON,D0,BERMUDA,Foreign,,,"=""6331""","Fire, Marine, and Casualty Insurance",524130,"Reinsurance Carriers",34,27,12/29/21,"1,624,648,064",12/31/21,"2,628,900,000","29,800,000","2,752,900,000","13,844,100,000"
12678,"Revenue from customer contracts","Determination of Standalone Selling Prices for Term License and Maintenance Performance Obligations",462145,06/30/21,08/18/21,4,"KPMG LLP",,,,Boston,MA,MASSACHUSETTS,"US New England",10-K,2021-08-18,,"ASPENTECH Corp",929940,,"20 CROSBY DRIVE",,BEDFORD,MA,MASSACHUSETTS,"US New England",,,"=""7371""","Computer Programming Services",541511,"Custom Computer Programming Services",34,143,07/02/21,"9,725,454,336",06/30/21,"709,376,000","319,803,000","595,117,000","1,454,000,000"
18313,"Research and development expenses","Accrued research and development expenses",479171,12/31/21,03/11/22,2,"Ernst & Young LLP",,,,"Redwood City",CA,CALIFORNIA,"US West",10-K,2022-03-11,,"ASSEMBLY BIOSCIENCES, INC.",1426800,"=""ASMB""","TWO TOWER PLACE","7TH FLOOR","SOUTH SAN FRANCISCO",CA,CALIFORNIA,"US West",,,"=""2834""","Pharmaceutical Preparations",541710,"Research and Development in the Physical, Engineering, and Life Sciences",34,2,12/31/21,"112,120,616",12/31/21,"6,254,000","-129,855,000","168,929,000","191,060,000"
18314,"Goodwill and intangible assets","Impairment of goodwill and indefinite-lived intangible asset",479171,12/31/21,03/11/22,2,"Ernst & Young LLP",,,,"Redwood City",CA,CALIFORNIA,"US West",10-K,2022-03-11,,"ASSEMBLY BIOSCIENCES, INC.",1426800,"=""ASMB""","TWO TOWER PLACE","7TH FLOOR","SOUTH SAN FRANCISCO",CA,CALIFORNIA,"US West",,,"=""2834""","Pharmaceutical Preparations",541710,"Research and Development in the Physical, Engineering, and Life Sciences",34,2,12/31/21,"112,120,616",12/31/21,"6,254,000","-129,855,000","168,929,000","191,060,000"
14490,"Allowance for credit losses","Assessment of the allowance for credit losses related to loans, excluding individually analyzed loans",473154,12/31/21,02/08/22,4,"KPMG LLP",,,,Chicago,IL,ILLINOIS,"US Midwest",10-K,2022-02-08,,"ASSOCIATED BANC-CORP",7789,"=""ASB""","433 MAIN STREET",,"GREEN BAY",WI,WISCONSIN,"US Midwest",,,"=""6022""","State Commercial Banks",522110,"Commercial Banking",34,23,12/31/21,"3,373,650,176",12/31/21,"1,146,230,000","350,994,000","2,861,768,000","35,104,252,000"
15566,"Insurance contract liabilities","Valuation of Claims and Benefits Payable Reserves for Global Lifestyle and Global Housing Short Duration Insurance Contracts",474684,12/31/21,02/22/22,1,"PricewaterhouseCoopers LLP",,,,"New York",NY,"NEW YORK","US Mid Atlantic",10-K,2022-02-22,,"ASSURANT, INC.",1267238,"=""AIZ""","ONE CHASE MANHATTAN PLAZA",,"NEW YORK",NY,"NEW YORK","US Mid Atlantic",,,"=""6399""","Insurance Carriers, NEC",524130,"Reinsurance Carriers",34,156,12/31/21,"8,689,836,032",12/31/21,"10,187,600,000","1,361,800,000","2,198,900,000","33,911,500,000"
16729,"Insurance contract liabilities","Valuation of the Loss and Loss Adjustment Expense (LAE) Reserve and the Salvage and Subrogation Recoverable - Estimation of the Expected Loss to be Paid (Recovered)",475443,12/31/21,02/25/22,1,"PricewaterhouseCoopers LLP",,,,"New York",NY,"NEW YORK","US Mid Atlantic",10-K,2022-02-25,,"ASSURED GUARANTY LTD",1273813,"=""AGO""","30 WOODBOURNE AVENUE","5TH FLOOR",HAMILTON,D0,BERMUDA,Foreign,,,"=""6351""","Surety Insurance",524292,"Third Party Administration of Insurance and Pension Funds",34,50,12/31/21,"3,389,424,896",12/31/21,"848,000,000","389,000,000","6,139,000,000","18,208,000,000"
16887,Inventory,"Evaluation of the sufficiency of audit evidence over inventories and net sales",476502,12/31/21,02/28/22,4,"KPMG LLP",,,,Atlanta,GA,GEORGIA,"US Southeast",10-K,2022-02-28,,"ASTEC INDUSTRIES INC",792987,"=""ASTE""","1725 SHEPHERD ROAD",,CHATTANOOGA,TN,TENNESSEE,"US Southeast",,,"=""3531""","Construction Machinery and Equipment",333120,"Construction Machinery Manufacturing",34,69,12/31/21,"1,577,073,664",12/31/21,"1,097,200,000","17,800,000","593,000,000","911,300,000"
16824,"Accounts/loans receivable","Risk Pool Settlements and Related Receivables",476336,12/31/21,02/28/22,2,"Ernst & Young LLP",,,,"Los Angeles",CA,CALIFORNIA,"US West",10-K,2022-02-28,,"Astrana Health, Inc.",1083446,"=""ASTH""","1668 S. GARFIELD AVENUE","2ND FLOOR",ALHAMBRA,CA,CALIFORNIA,"US West",,,"=""8742""","Management Consulting Services",621111,"Offices of Physicians (except Mental Health Specialists)",34,74,12/29/21,"4,116,740,352",12/31/21,"773,915,000","68,923,000","175,479,000","867,361,000"
16825,"Insurance contract liabilities","Valuation of Incurred but not Reported (IBNR) Claims Liability",476336,12/31/21,02/28/22,2,"Ernst & Young LLP",,,,"Los Angeles",CA,CALIFORNIA,"US West",10-K,2022-02-28,,"Astrana Health, Inc.",1083446,"=""ASTH""","1668 S. GARFIELD AVENUE","2ND FLOOR",ALHAMBRA,CA,CALIFORNIA,"US West",,,"=""8742""","Management Consulting Services",621111,"Offices of Physicians (except Mental Health Specialists)",34,74,12/29/21,"4,116,740,352",12/31/21,"773,915,000","68,923,000","175,479,000","867,361,000"
15556,"Sales return and allowances","Recognition and measurement of accruals for certain rebates in the US (excluding rare diseases)",474690,12/31/21,02/10/22,1,"PricewaterhouseCoopers LLP",121,"PricewaterhouseCoopers LLP",876,London,X0,"UNITED KINGDOM",Foreign,20-F,2022-02-22,,"ASTRAZENECA PLC",901832,"=""AZN""","1 FRANCIS CRICK AVENUE","CAMBRIDGE BIOMEDICAL CAMPUS",LONDON,X0,"UNITED KINGDOM",Foreign,,,"=""2834""","Pharmaceutical Preparations",325412,"Pharmaceutical Preparation Manufacturing",34,59,12/29/21,"37,102,854,144",12/31/21,"37,417,000,000","115,000,000","-23,116,000,000","105,363,000,000"
15557,"Other intangible assets","Impairment assessment of the product, marketing and distribution rights and other intangibles (excluding goodwill and software development costs)",474690,12/31/21,02/10/22,1,"PricewaterhouseCoopers LLP",121,"PricewaterhouseCoopers LLP",876,London,X0,"UNITED KINGDOM",Foreign,20-F,2022-02-22,,"ASTRAZENECA PLC",901832,"=""AZN""","1 FRANCIS CRICK AVENUE","CAMBRIDGE BIOMEDICAL CAMPUS",LONDON,X0,"UNITED KINGDOM",Foreign,,,"=""2834""","Pharmaceutical Preparations",325412,"Pharmaceutical Preparation Manufacturing",34,59,12/29/21,"37,102,854,144",12/31/21,"37,417,000,000","115,000,000","-23,116,000,000","105,363,000,000"
15558,"Other contingent liabilities","Recognition and measurement of legal provisions and legal proceedings contingent liabilities",474690,12/31/21,02/10/22,1,"PricewaterhouseCoopers LLP",121,"PricewaterhouseCoopers LLP",876,London,X0,"UNITED KINGDOM",Foreign,20-F,2022-02-22,,"ASTRAZENECA PLC",901832,"=""AZN""","1 FRANCIS CRICK AVENUE","CAMBRIDGE BIOMEDICAL CAMPUS",LONDON,X0,"UNITED KINGDOM",Foreign,,,"=""2834""","Pharmaceutical Preparations",325412,"Pharmaceutical Preparation Manufacturing",34,59,12/29/21,"37,102,854,144",12/31/21,"37,417,000,000","115,000,000","-23,116,000,000","105,363,000,000"
15559,"Uncertain tax positions","Recognition and measurement of accruals for tax contingencies",474690,12/31/21,02/10/22,1,"PricewaterhouseCoopers LLP",121,"PricewaterhouseCoopers LLP",876,London,X0,"UNITED KINGDOM",Foreign,20-F,2022-02-22,,"ASTRAZENECA PLC",901832,"=""AZN""","1 FRANCIS CRICK AVENUE","CAMBRIDGE BIOMEDICAL CAMPUS",LONDON,X0,"UNITED KINGDOM",Foreign,,,"=""2834""","Pharmaceutical Preparations",325412,"Pharmaceutical Preparation Manufacturing",34,59,12/29/21,"37,102,854,144",12/31/21,"37,417,000,000","115,000,000","-23,116,000,000","105,363,000,000"
15560,"Pension and other post-employment benefits","Valuation of defined benefit obligations
",474690,12/31/21,02/10/22,1,"PricewaterhouseCoopers LLP",121,"PricewaterhouseCoopers LLP",876,London,X0,"UNITED KINGDOM",Foreign,20-F,2022-02-22,,"ASTRAZENECA PLC",901832,"=""AZN""","1 FRANCIS CRICK AVENUE","CAMBRIDGE BIOMEDICAL CAMPUS",LONDON,X0,"UNITED KINGDOM",Foreign,,,"=""2834""","Pharmaceutical Preparations",325412,"Pharmaceutical Preparation Manufacturing",34,59,12/29/21,"37,102,854,144",12/31/21,"37,417,000,000","115,000,000","-23,116,000,000","105,363,000,000"
15561,"Business combinations","Acquisition of Alexion Pharmaceuticals Inc. - valuation of the acquired intangible assets and inventory",474690,12/31/21,02/10/22,1,"PricewaterhouseCoopers LLP",121,"PricewaterhouseCoopers LLP",876,London,X0,"UNITED KINGDOM",Foreign,20-F,2022-02-22,,"ASTRAZENECA PLC",901832,"=""AZN""","1 FRANCIS CRICK AVENUE","CAMBRIDGE BIOMEDICAL CAMPUS",LONDON,X0,"UNITED KINGDOM",Foreign,,,"=""2834""","Pharmaceutical Preparations",325412,"Pharmaceutical Preparation Manufacturing",34,59,12/29/21,"37,102,854,144",12/31/21,"37,417,000,000","115,000,000","-23,116,000,000","105,363,000,000"
18212,"Business combinations","Determination of accounting acquirer and assessment of accounting model in the merger with Quellis Biosciences, Inc.",478891,12/31/21,03/10/22,2,"Ernst & Young LLP",,,,Boston,MA,MASSACHUSETTS,"US New England",10-K,2022-03-10,,"Astria Therapeutics, Inc.",1454789,"=""ATXS""","22 BOSTON WHARF ROAD","10TH FLOOR",BOSTON,MA,MASSACHUSETTS,"US New England",,,"=""2834""","Pharmaceutical Preparations",325412,"Pharmaceutical Preparation Manufacturing",34,5,12/31/21,"70,161,384",12/31/21,,"-194,912,000",,"127,514,000"
17784,Goodwill,"Valuation of Goodwill",477818,12/31/21,03/04/22,2,"Ernst & Young LLP",,,,Buffalo,NY,"NEW YORK","US Mid Atlantic",10-K,2022-03-04,,"ASTRONICS CORP",8063,"=""ATRO""","130 COMMERCE WAY",-,"EAST AURORA",NY,"NEW YORK","US Mid Atlantic",,,"=""3728""","Aircraft Parts and Auxiliary Equipment, NEC",336413,"Other Aircraft Parts and Auxiliary Equipment Manufacturing",34,12,12/31/21,"301,230,528",12/31/21,"444,908,000","-25,578,000","104,002,000","609,138,000"
17785,"Revenue from customer contracts","Revenue Recognition",477818,12/31/21,03/04/22,2,"Ernst & Young LLP",,,,Buffalo,NY,"NEW YORK","US Mid Atlantic",10-K,2022-03-04,,"ASTRONICS CORP",8063,"=""ATRO""","130 COMMERCE WAY",-,"EAST AURORA",NY,"NEW YORK","US Mid Atlantic",,,"=""3728""","Aircraft Parts and Auxiliary Equipment, NEC",336413,"Other Aircraft Parts and Auxiliary Equipment Manufacturing",34,12,12/31/21,"301,230,528",12/31/21,"444,908,000","-25,578,000","104,002,000","609,138,000"
9845,Goodwill,"Valuation of goodwill",449977,01/30/21,03/24/21,2,"Ernst & Young LLP",,,,Dallas,TX,TEXAS,"US Southwest",10-K,2021-03-24,,"At Home Group Inc.",1646228,,"AT HOME GROUP INC.","1600 EAST PLANO PARKWAY",PLANO,TX,TEXAS,"US Southwest",,,"=""5700""","Retail-Home Furniture, Furnishings & Equipment Stores",442110,"Furniture Stores",34,24,01/31/21,"1,592,396,416",01/30/21,"1,737,063,000","-149,729,000","482,702,000","2,524,913,000"
14846,"Pension and other post-employment benefits","Discount rates used in determining pension and postretirement benefit obligations",473816,12/31/21,02/16/22,2,"Ernst & Young LLP",,,,Dallas,TX,TEXAS,"US Southwest",10-K,2022-02-16,,"AT&T Inc.",732717,"=""T""","208 S. AKARD ST",,DALLAS,TX,TEXAS,"US Southwest",,,"=""4813""","Telephone Communications, Except Radiotelephone",517110,"Wired Telecommunications Carriers",34,25,12/29/21,"175,954,247,680",12/31/21,"134,038,000,000","20,081,000,000","-114,442,000,000","551,622,000,000"
14847,Goodwill,"Evaluation of goodwill for impairment",473816,12/31/21,02/16/22,2,"Ernst & Young LLP",,,,Dallas,TX,TEXAS,"US Southwest",10-K,2022-02-16,,"AT&T Inc.",732717,"=""T""","208 S. AKARD ST",,DALLAS,TX,TEXAS,"US Southwest",,,"=""4813""","Telephone Communications, Except Radiotelephone",517110,"Wired Telecommunications Carriers",34,25,12/29/21,"175,954,247,680",12/31/21,"134,038,000,000","20,081,000,000","-114,442,000,000","551,622,000,000"
20561,Goodwill,"Valuation of goodwill",484806,12/31/21,04/26/22,4,"KPMG LLP",355,"KPMG Huazhen LLP",1186,Beijing,F4,CHINA,Foreign,20-F,2022-04-26,,"ATA Creativity Global",1420529,"=""AACG""","RM. 507, BLDG. 3, BINHUZHUOYUECHENG","WENHUAKECHUANGYUAN, HUAYUAN BLVD. 365","BAOHE, HEFEI, ANHUI",F4,CHINA,Foreign,,,"=""8200""","Services-Educational Services",611710,"Educational Support Services",34,1,12/29/21,"33,551,168",12/31/21,"31,727,344","-5,279,734","-15,743,470","79,577,508"
16973,"Revenue from customer contracts","Revenue and Deferred Revenue – Accounting for Out- License Agreement – Refer to Note 2 and 7 to the Financial Statements",476394,12/31/21,02/28/22,3,"Deloitte & Touche LLP",,,,"San Francisco",CA,CALIFORNIA,"US West",10-K,2022-02-28,,"Atara Biotherapeutics, Inc.",1604464,"=""ATRA""","1280 RANCHO CONEJO BLVD",,"THOUSAND OAKS",CA,CALIFORNIA,"US West",,,"=""2836""","Biological Products, Except Diagnostic Substances",325412,"Pharmaceutical Preparation Manufacturing",34,16,12/31/21,"1,444,734,976",12/31/21,"20,340,000","-340,141,000",,"468,127,000"
16974,"Research and development expenses","Accrued Research and Development Expenses & Prepaid Research and Development Expenses (Clinical Trial Accrued and Prepaid Expenses) - Refer to Note 2 to the financial statements",476394,12/31/21,02/28/22,3,"Deloitte & Touche LLP",,,,"San Francisco",CA,CALIFORNIA,"US West",10-K,2022-02-28,,"Atara Biotherapeutics, Inc.",1604464,"=""ATRA""","1280 RANCHO CONEJO BLVD",,"THOUSAND OAKS",CA,CALIFORNIA,"US West",,,"=""2836""","Biological Products, Except Diagnostic Substances",325412,"Pharmaceutical Preparation Manufacturing",34,16,12/31/21,"1,444,734,976",12/31/21,"20,340,000","-340,141,000",,"468,127,000"
16963,"Revenue from customer contracts","Assessment of the satisfaction of the Combined Performance Obligation pursuant to the Roche License Agreement",476385,12/31/21,02/28/22,4,"KPMG LLP",,,,Boston,MA,MASSACHUSETTS,"US New England",10-K,2022-02-28,,"Atea Pharmaceuticals, Inc.",1593899,"=""AVIR""","225 FRANKLIN STREET","SUITE 2100",BOSTON,MA,MASSACHUSETTS,"US New England",,,"=""2834""","Pharmaceutical Preparations",325412,"Pharmaceutical Preparation Manufacturing",34,9,12/31/21,"742,938,432",12/31/21,"351,367,000","121,190,000",,"772,892,000"
20903,"Internal controls","Cyber-attack- Refer to Note 4d) to the financial statements",486117,12/31/21,04/29/22,3,"Deloitte & Touche LLP",4,"Deloitte Touche Tohmatsu Auditores Independentes",1045,"São Paulo",D5,BRAZIL,Foreign,20-F,2022-05-02,,"Atento S.A.",1606457,,"DA VINCI BLDG, 4 RUE LOU HEMMER,","L-1748 LUXEMBOURG FINDEL",LUXEMBOURG-FINDEL,N4,LUXEMBOURG,Foreign,,,"=""4813""","Telephone Communications, Except Radiotelephone",517110,"Wired Telecommunications Carriers",34,24,12/29/21,"360,000,000",12/31/21,"1,449,225,000","-92,951,000","-209,702,000","1,107,776,000"
20904,"Other contingent liabilities","Provision for risks and contingencies - Refer to Note 21 to the financial statements",486117,12/31/21,04/29/22,3,"Deloitte & Touche LLP",4,"Deloitte Touche Tohmatsu Auditores Independentes",1045,"São Paulo",D5,BRAZIL,Foreign,20-F,2022-05-02,,"Atento S.A.",1606457,,"DA VINCI BLDG, 4 RUE LOU HEMMER,","L-1748 LUXEMBOURG FINDEL",LUXEMBOURG-FINDEL,N4,LUXEMBOURG,Foreign,,,"=""4813""","Telephone Communications, Except Radiotelephone",517110,"Wired Telecommunications Carriers",34,24,12/29/21,"360,000,000",12/31/21,"1,449,225,000","-92,951,000","-209,702,000","1,107,776,000"
20905,"Revenue from customer contracts","Revenue - Refer to Notes 3P) and 22 to the financial statements",486117,12/31/21,04/29/22,3,"Deloitte & Touche LLP",4,"Deloitte Touche Tohmatsu Auditores Independentes",1045,"São Paulo",D5,BRAZIL,Foreign,20-F,2022-05-02,,"Atento S.A.",1606457,,"DA VINCI BLDG, 4 RUE LOU HEMMER,","L-1748 LUXEMBOURG FINDEL",LUXEMBOURG-FINDEL,N4,LUXEMBOURG,Foreign,,,"=""4813""","Telephone Communications, Except Radiotelephone",517110,"Wired Telecommunications Carriers",34,24,12/29/21,"360,000,000",12/31/21,"1,449,225,000","-92,951,000","-209,702,000","1,107,776,000"
16348,"Other investments","Valuation of certain structured fixed maturity securities",475684,12/31/21,02/25/22,1,"PricewaterhouseCoopers LLP",,,,"Des Moines",IA,IOWA,"US Midwest",10-K,2022-02-25,,"Athene Holding Ltd.",1527469,"=""ATHS""","7700 MILLS CIVIC PARKWAY",,"WEST DES MOINES",IA,IOWA,"US Midwest",,,"=""6311""","Life Insurance",523920,"Portfolio Management",34,83,12/31/21,"16,011,154,432",12/31/21,"26,320,000,000","3,859,000,000","20,130,000,000","235,149,000,000"
16349,"Insurance contract liabilities","Valuation of embedded derivatives of fixed indexed annuities",475684,12/31/21,02/25/22,1,"PricewaterhouseCoopers LLP",,,,"Des Moines",IA,IOWA,"US Midwest",10-K,2022-02-25,,"Athene Holding Ltd.",1527469,"=""ATHS""","7700 MILLS CIVIC PARKWAY",,"WEST DES MOINES",IA,IOWA,"US Midwest",,,"=""6311""","Life Insurance",523920,"Portfolio Management",34,83,12/31/21,"16,011,154,432",12/31/21,"26,320,000,000","3,859,000,000","20,130,000,000","235,149,000,000"
16350,"Insurance contract liabilities","Valuation of guaranteed lifetime withdrawal benefits (GLWB)",475684,12/31/21,02/25/22,1,"PricewaterhouseCoopers LLP",,,,"Des Moines",IA,IOWA,"US Midwest",10-K,2022-02-25,,"Athene Holding Ltd.",1527469,"=""ATHS""","7700 MILLS CIVIC PARKWAY",,"WEST DES MOINES",IA,IOWA,"US Midwest",,,"=""6311""","Life Insurance",523920,"Portfolio Management",34,83,12/31/21,"16,011,154,432",12/31/21,"26,320,000,000","3,859,000,000","20,130,000,000","235,149,000,000"
16351,"Deferred and capitalized costs","Valuation of deferred acquisition costs (DAC)",475684,12/31/21,02/25/22,1,"PricewaterhouseCoopers LLP",,,,"Des Moines",IA,IOWA,"US Midwest",10-K,2022-02-25,,"Athene Holding Ltd.",1527469,"=""ATHS""","7700 MILLS CIVIC PARKWAY",,"WEST DES MOINES",IA,IOWA,"US Midwest",,,"=""6311""","Life Insurance",523920,"Portfolio Management",34,83,12/31/21,"16,011,154,432",12/31/21,"26,320,000,000","3,859,000,000","20,130,000,000","235,149,000,000"
18656,"Revenue from customer contracts","Revenue Chargebacks – Refer to Note 19 (Commercial Platform) to the consolidated financial statements",479820,12/31/21,03/16/22,3,"Deloitte & Touche LLP",,,,Williamsville,NY,"NEW YORK","US Mid Atlantic",8-K,2022-03-16,Yes,"Athenex, Inc.",1300699,,"1001 MAIN STREET","SUITE 600",BUFFALO,NY,"NEW YORK","US Mid Atlantic",,,"=""2834""","Pharmaceutical Preparations",325412,"Pharmaceutical Preparation Manufacturing",34,1,12/31/21,"149,776,864",12/31/21,"95,369,000","-199,768,000","-20,765,000","267,448,000"
18657,"Business combinations","Accounting for Business Combinations – Refer to Note 3 (Kuur Acquisition) to the consolidated financial statements",479820,12/31/21,03/16/22,3,"Deloitte & Touche LLP",,,,Williamsville,NY,"NEW YORK","US Mid Atlantic",8-K,2022-03-16,Yes,"Athenex, Inc.",1300699,,"1001 MAIN STREET","SUITE 600",BUFFALO,NY,"NEW YORK","US Mid Atlantic",,,"=""2834""","Pharmaceutical Preparations",325412,"Pharmaceutical Preparation Manufacturing",34,1,12/31/21,"149,776,864",12/31/21,"95,369,000","-199,768,000","-20,765,000","267,448,000"
18658,Goodwill,"Goodwill – Oncology Platform reporting unit – Refer to Note 8 to the financial statements",479820,12/31/21,03/16/22,3,"Deloitte & Touche LLP",,,,Williamsville,NY,"NEW YORK","US Mid Atlantic",8-K,2022-03-16,Yes,"Athenex, Inc.",1300699,,"1001 MAIN STREET","SUITE 600",BUFFALO,NY,"NEW YORK","US Mid Atlantic",,,"=""2834""","Pharmaceutical Preparations",325412,"Pharmaceutical Preparation Manufacturing",34,1,12/31/21,"149,776,864",12/31/21,"95,369,000","-199,768,000","-20,765,000","267,448,000"
18695,"Revenue from customer contracts","Revenue Chargebacks – Refer to Note 19 (Commercial Platform) to the consolidated financial statements",479704,12/31/21,03/16/22,3,"Deloitte & Touche LLP",,,,Williamsville,NY,"NEW YORK","US Mid Atlantic",10-K,2022-03-16,Yes,"Athenex, Inc.",1300699,,"1001 MAIN STREET","SUITE 600",BUFFALO,NY,"NEW YORK","US Mid Atlantic",,,"=""2834""","Pharmaceutical Preparations",325412,"Pharmaceutical Preparation Manufacturing",34,1,12/31/21,"149,776,864",12/31/21,"95,369,000","-199,768,000","-20,765,000","267,448,000"
18696,"Business combinations","Accounting for Business Combinations – Refer to Note 3 (Kuur Acquisition) to the consolidated financial statements",479704,12/31/21,03/16/22,3,"Deloitte & Touche LLP",,,,Williamsville,NY,"NEW YORK","US Mid Atlantic",10-K,2022-03-16,Yes,"Athenex, Inc.",1300699,,"1001 MAIN STREET","SUITE 600",BUFFALO,NY,"NEW YORK","US Mid Atlantic",,,"=""2834""","Pharmaceutical Preparations",325412,"Pharmaceutical Preparation Manufacturing",34,1,12/31/21,"149,776,864",12/31/21,"95,369,000","-199,768,000","-20,765,000","267,448,000"
18697,Goodwill,"Goodwill – Oncology Platform reporting unit – Refer to Note 8 to the financial statements",479704,12/31/21,03/16/22,3,"Deloitte & Touche LLP",,,,Williamsville,NY,"NEW YORK","US Mid Atlantic",10-K,2022-03-16,Yes,"Athenex, Inc.",1300699,,"1001 MAIN STREET","SUITE 600",BUFFALO,NY,"NEW YORK","US Mid Atlantic",,,"=""2834""","Pharmaceutical Preparations",325412,"Pharmaceutical Preparation Manufacturing",34,1,12/31/21,"149,776,864",12/31/21,"95,369,000","-199,768,000","-20,765,000","267,448,000"
18610,"Revenue from customer contracts","Revenue Recognition from Collaboration Arrangements
",479648,12/31/21,03/15/22,2,"Ernst & Young LLP",,,,Cleveland,OH,OHIO,"US Midwest",10-K,2022-03-15,Yes,"ATHERSYS, INC / NEW",1368148,"=""ATHXQ""","3201 CARNEGIE AVENUE",,CLEVELAND,OH,OHIO,"US Midwest",,,"=""2834""","Pharmaceutical Preparations",325412,"Pharmaceutical Preparation Manufacturing",34,1,12/31/21,"218,559,760",12/31/21,"5,514,000","-86,955,000",,"60,184,000"
16352,Goodwill,"Goodwill impairment assessment",475744,12/31/21,02/25/22,2,"Ernst & Young LLP",,,,Pittsburgh,PA,PENNSYLVANIA,"US Mid Atlantic",10-K,2022-02-25,,"ATI INC",1018963,"=""ATI""","2021 MCKINNEY AVENUE",,DALLAS,TX,TEXAS,"US Southwest",,,"=""3317""","Steel Pipe and Tubes",331111,"Iron and Steel Mills",34,16,12/31/21,"2,027,140,992",12/31/21,"2,799,800,000","-38,200,000","457,700,000","4,285,200,000"
17350,"Revenue from customer contracts","Valuation of patient service revenue and related accounts receivable - contractual allowances",477044,12/31/21,03/01/22,1,"PricewaterhouseCoopers LLP",,,,Chicago,IL,ILLINOIS,"US Midwest",10-K,2022-03-01,,"ATI Physical Therapy, Inc.",1815849,"=""ATIP""","2001 BUTTERFIELD ROAD","SUITE 1600","DOWNERS GROVE",IL,ILLINOIS,"US Midwest",,,"=""8050""","Services-Nursing & Personal Care Facilities",621340,"Offices of Physical, Occupational and Speech Therapists, and Audiologists",34,3,12/31/21,"669,185,984",12/31/21,"627,871,000","-778,328,000","-516,089,000","1,562,694,000"
17351,"Goodwill and intangible assets","Goodwill and indefinite-lived intangible assets impairment assessments",477044,12/31/21,03/01/22,1,"PricewaterhouseCoopers LLP",,,,Chicago,IL,ILLINOIS,"US Midwest",10-K,2022-03-01,,"ATI Physical Therapy, Inc.",1815849,"=""ATIP""","2001 BUTTERFIELD ROAD","SUITE 1600","DOWNERS GROVE",IL,ILLINOIS,"US Midwest",,,"=""8050""","Services-Nursing & Personal Care Facilities",621340,"Offices of Physical, Occupational and Speech Therapists, and Audiologists",34,3,12/31/21,"669,185,984",12/31/21,"627,871,000","-778,328,000","-516,089,000","1,562,694,000"
19881,"Revenue from customer contracts","Valuation of patient service revenue and related accounts receivable—contractual allowances",482458,12/31/21,03/01/22,1,"PricewaterhouseCoopers LLP",,,,Chicago,IL,ILLINOIS,"US Midwest","POS AM",2022-04-01,,"ATI Physical Therapy, Inc.",1815849,"=""ATIP""","2001 BUTTERFIELD ROAD","SUITE 1600","DOWNERS GROVE",IL,ILLINOIS,"US Midwest",,,"=""8050""","Services-Nursing & Personal Care Facilities",621340,"Offices of Physical, Occupational and Speech Therapists, and Audiologists",34,3,12/31/21,"669,185,984",12/31/21,"627,871,000","-778,328,000","-516,089,000","1,562,694,000"
19882,"Goodwill and intangible assets","Goodwill and indefinite-lived intangible assets impairment assessments",482458,12/31/21,03/01/22,1,"PricewaterhouseCoopers LLP",,,,Chicago,IL,ILLINOIS,"US Midwest","POS AM",2022-04-01,,"ATI Physical Therapy, Inc.",1815849,"=""ATIP""","2001 BUTTERFIELD ROAD","SUITE 1600","DOWNERS GROVE",IL,ILLINOIS,"US Midwest",,,"=""8050""","Services-Nursing & Personal Care Facilities",621340,"Offices of Physical, Occupational and Speech Therapists, and Audiologists",34,3,12/31/21,"669,185,984",12/31/21,"627,871,000","-778,328,000","-516,089,000","1,562,694,000"
20083,"Revenue from customer contracts","Valuation of patient service revenue and related accounts receivable—contractual allowances",483092,12/31/21,03/01/22,1,"PricewaterhouseCoopers LLP",,,,Chicago,IL,ILLINOIS,"US Midwest",S-1,2022-04-12,,"ATI Physical Therapy, Inc.",1815849,"=""ATIP""","2001 BUTTERFIELD ROAD","SUITE 1600","DOWNERS GROVE",IL,ILLINOIS,"US Midwest",,,"=""8050""","Services-Nursing & Personal Care Facilities",621340,"Offices of Physical, Occupational and Speech Therapists, and Audiologists",34,3,12/31/21,"669,185,984",12/31/21,"627,871,000","-778,328,000","-516,089,000","1,562,694,000"
20084,"Goodwill and intangible assets","Goodwill and indefinite-lived intangible assets impairment assessments",483092,12/31/21,03/01/22,1,"PricewaterhouseCoopers LLP",,,,Chicago,IL,ILLINOIS,"US Midwest",S-1,2022-04-12,,"ATI Physical Therapy, Inc.",1815849,"=""ATIP""","2001 BUTTERFIELD ROAD","SUITE 1600","DOWNERS GROVE",IL,ILLINOIS,"US Midwest",,,"=""8050""","Services-Nursing & Personal Care Facilities",621340,"Offices of Physical, Occupational and Speech Therapists, and Audiologists",34,3,12/31/21,"669,185,984",12/31/21,"627,871,000","-778,328,000","-516,089,000","1,562,694,000"
13598,Goodwill,"Goodwill - Refer to Notes 1 and 12 to the financial statements",467681,09/30/21,11/18/21,3,"Deloitte & Touche LLP",,,,Chicago,IL,ILLINOIS,"US Midwest",10-K,2021-11-18,,"Atkore Inc.",1666138,"=""ATKR""","16100 SOUTH LATHROP AVENUE",,HARVEY,IL,ILLINOIS,"US Midwest",,,"=""3690""","Miscellaneous Electrical Machinery, Equipment & Supplies",335932,"Noncurrent-Carrying Wiring Device Manufacturing",34,87,09/30/21,"3,998,073,088",09/30/21,"2,928,014,000","587,857,000","424,484,000","2,210,099,000"
16417,"Regulatory assets and liabilities","Accounting for the Effects of Rate Regulation",475978,12/31/21,02/25/22,1,"PricewaterhouseCoopers LLP",,,,Philadelphia,PA,PENNSYLVANIA,"US Mid Atlantic",10-K,2022-02-25,,"ATLANTIC CITY ELECTRIC CO",8192,,"500 NORTH WAKEFIELD DRIVE",,NEWARK,DE,DELAWARE,"US Mid Atlantic",1109357,"EXELON CORP","=""4911""","Electric Services",221122,"Electric Power Distribution",34,,,,12/31/21,"1,388,000,000","146,000,000",,"4,556,000,000"
21689,"Regulatory assets and liabilities","Accounting for the Effects of Rate Regulation",489119,12/31/21,02/25/22,1,"PricewaterhouseCoopers LLP",,,,Philadelphia,PA,PENNSYLVANIA,"US Mid Atlantic",8-K,2022-06-30,,"ATLANTIC CITY ELECTRIC CO",8192,,"500 NORTH WAKEFIELD DRIVE",,NEWARK,DE,DELAWARE,"US Mid Atlantic",1109357,"EXELON CORP","=""4911""","Electric Services",221122,"Electric Power Distribution",34,,,,12/31/21,"1,388,000,000","146,000,000",,"4,556,000,000"
16713,"Allowance for credit losses","Allowance for Loan and Lease Losses ",476119,12/31/21,02/25/22,2,"Ernst & Young LLP",,,,Richmond,VA,VIRGINIA,"US Mid Atlantic",10-K,2022-02-25,,"Atlantic Union Bankshares Corp",883948,"=""AUB""","4300 COX ROAD",,"GLEN ALLEN",VA,VIRGINIA,"US Mid Atlantic",,,"=""6022""","State Commercial Banks",522110,"Commercial Banking",34,37,12/31/21,"2,821,497,344",12/31/21,"737,954,000","263,917,000","1,731,199,000","20,064,796,000"
19020,"Other intangible assets","Recoverability assessment of contracted concessional assets",480455,12/31/21,02/27/22,2,"Ernst & Young LLP",163,"Ernst & Young SL",1461,Madrid,U3,SPAIN,Foreign,20-F/A,2022-03-24,,"Atlantica Sustainable Infrastructure plc",1601072,,"GREAT WEST HOUSE, GW1, 17TH FLOOR","GREAT WEST ROAD",BRENTFORD,X0,"UNITED KINGDOM",Foreign,,,"=""4911""","Electric Services",221121,"Electric Bulk Power Transmission and Control",34,35,12/29/21,"3,771,881,728",12/31/21,"1,211,749,000","-30,080,000",,"9,751,930,000"
15124,"Deferred and capitalized costs","Heavy Maintenance Costs",474080,12/31/21,02/17/22,1,"PricewaterhouseCoopers LLP",,,,"New York",NY,"NEW YORK","US Mid Atlantic",10-K,2022-02-17,,"ATLAS AIR WORLDWIDE HOLDINGS INC",1135185,,"2000 WESTCHESTER AVENUE",,PURCHASE,NY,"NEW YORK","US Mid Atlantic",,,"=""4522""","Air Transportation, Nonscheduled",481212,"Nonscheduled Chartered Freight Air Transportation",34,94,12/31/21,"2,749,781,760",12/31/21,"4,030,829,000","493,317,000","2,744,541,000","6,443,243,000"
19088,"Property, plant and equipment","Assessment of indicators of impairment for vessels",480581,12/31/21,03/24/22,4,"KPMG LLP",187,"KPMG LLP Chartered Accountants",85,Vancouver,A1,"BRITISH COLUMBIA",Canada,20-F,2022-03-24,,"Atlas Corp.",1794846,,"2600-200 GRANVILLE STREET",,VANCOUVER,A1,"BRITISH COLUMBIA",Canada,,,"=""4412""","Deep Sea Foreign Transportation of  Freight",483111,"Deep Sea Freight Transportation",34,,,,12/31/21,"1,646,600,000","400,500,000","3,739,200,000","10,569,600,000"
12630,"Revenue from customer contracts","Revenue recognition",462019,06/30/21,08/13/21,2,"Ernst & Young LLP",,,,"San Francisco",CA,CALIFORNIA,"US West",20-F,2021-08-13,,"Atlassian Corp",1650372,"=""TEAM""","350 BUSH STREET","FLOOR 13","SAN FRANCISCO",CA,CALIFORNIA,"US West",,,"=""7372""","Prepackaged Software",511210,"Software Publishers",34,263,07/02/21,"33,681,045,504",06/30/21,"2,089,132,000","-696,315,000","-555,434,000","2,945,344,000"
13531,"Deferred and capitalized costs","Determination of Capital Costs",467392,09/30/21,11/12/21,2,"Ernst & Young LLP",,,,Dallas,TX,TEXAS,"US Southwest",10-K,2021-11-12,,"ATMOS ENERGY CORP",731802,"=""ATO""","1800 THREE LINCOLN CTR","5430 LBJ FREEWAY",DALLAS,TX,TEXAS,"US Southwest",,,"=""4924""","Natural Gas Distribution",221210,"Natural Gas Distribution",34,88,09/30/21,"11,679,422,464",09/30/21,"3,407,490,000","665,563,000","7,175,632,000","19,608,662,000"
18630,"Business combinations","Acquisition of Alaska Communications Systems Group, Inc. – Valuation of Customer Relationships and Trade Name Intangible Assets",479678,12/31/21,03/16/22,1,"PricewaterhouseCoopers LLP",,,,Boston,MA,MASSACHUSETTS,"US New England",10-K,2022-03-16,,"ATN International, Inc.",879585,"=""ATNI""","500 CUMMINGS CENTER",,BEVERLY,MA,MASSACHUSETTS,"US New England",,,"=""4813""","Telephone Communications, Except Radiotelephone",517310,"Telecommunications Resellers",34,40,12/31/21,"627,731,968",12/31/21,"602,707,000","-22,108,000","476,022,000","1,608,604,000"
18631,Goodwill,"Goodwill Impairment for Viya Reporting Unit",479678,12/31/21,03/16/22,1,"PricewaterhouseCoopers LLP",,,,Boston,MA,MASSACHUSETTS,"US New England",10-K,2022-03-16,,"ATN International, Inc.",879585,"=""ATNI""","500 CUMMINGS CENTER",,BEVERLY,MA,MASSACHUSETTS,"US New England",,,"=""4813""","Telephone Communications, Except Radiotelephone",517310,"Telecommunications Resellers",34,40,12/31/21,"627,731,968",12/31/21,"602,707,000","-22,108,000","476,022,000","1,608,604,000"
20070,"Revenue from customer contracts","Accuracy of key input data for revenue recognized over time",482996,12/31/21,04/08/22,4,"KPMG LLP",254,"KPMG AG Wirtschaftsprüfungsgesellschaft",1021,Berlin,2M,GERMANY,Foreign,20-F,2022-04-11,,"Atotech Ltd",1762459,,"3RD FLOOR, 44 ESPLANADE",,"ST HELIER",Y9,JERSEY,Foreign,,,"=""2890""","Miscellaneous Chemical Products",325998,"All Other Miscellaneous Chemical Product and Preparation Manufacturing",34,26,12/29/21,"667,998,656",12/31/21,"1,499,200,000","7,600,000","-1,233,700,000","3,496,900,000"
20618,"Other intangible assets","Intangible assets, net — Business Cooperation Agreement (“BCA”) — Determination of Impairment Indicator — Refer to Notes 2.13 and 6 to the financial statements",485189,12/31/21,04/27/22,3,"Deloitte & Touche LLP",499,"Deloitte Touche Tohmatsu Certified Public Accountants LLP",1113,Shanghai,F4,CHINA,Foreign,20-F,2022-04-27,,"ATRenew Inc.",1838957,"=""RERE""","12TH FLOOR, NO.6 BUILDING","433 SONGHU ROAD",SHANGHAI,K3,"HONG KONG",Foreign,,,"=""5990""","Retail-Retail Stores, NEC",453310,"Used Merchandise Stores",34,,,,12/31/21,"1,220,751,000","-128,119,000","555,632,000","1,177,209,000"
15097,"Deferred and stock-based compensation","Valuation of Performance Share Awards with a Market Condition - Refer to Note 16 to the financial statements",474088,12/31/21,02/17/22,3,"Deloitte & Touche LLP",,,,Cincinnati,OH,OHIO,"US Midwest",10-K,2022-02-17,,"AtriCure, Inc.",1323885,"=""ATRC""","7555 INNOVATION WAY",,MASON,OH,OHIO,"US Midwest",,,"=""3841""","Surgical and Medical Instruments and Apparatus",339113,"Surgical Appliance and Supplies Manufacturing",34,70,12/31/21,"3,199,492,608",12/31/21,"274,329,000","50,199,000","205,983,000","615,312,000"
18549,"Research and development expenses","Accrued clinical studies costs",479566,12/31/21,03/15/22,2,"Ernst & Young LLP",,,,"San Diego",CA,CALIFORNIA,"US West",10-K,2022-03-15,,"aTYR PHARMA INC",1339970,"=""ATYR""","10240 SORRENTO VALLEY ROAD","SUITE 300","SAN DIEGO",CA,CALIFORNIA,"US West",,,"=""2836""","Biological Products, Except Diagnostic Substances",325414,"Biological Product (except Diagnostic) Manufacturing",34,7,12/29/21,"202,594,032",12/31/21,,"-33,768,000",,"115,537,000"
20733,"Revenue from customer contracts","Revenue Recognition",485541,12/31/21,04/28/22,2,"Ernst & Young LLP",222,"Kost Forer Gabbay & Kasierer",1281,"Tel Aviv",L3,ISRAEL,Foreign,20-F,2022-04-28,,"AUDIOCODES LTD",1086434,"=""AUDC""","6 OFRA HAZA STREET",,"AIRPORT CITY LOD",L3,ISRAEL,Foreign,,,"=""3661""","Telephone and Telegraph Apparatus",334513,"Instruments and Related Products Manufacturing for Measuring, Displaying, and Controlling Industrial Proc",34,35,12/29/21,"1,149,350,144",12/31/21,"248,920,000","33,751,000","165,568,000","349,364,000"
16769,"Deferred and stock-based compensation","Measurement of deferred compensation liability
",476204,12/31/21,02/25/22,1,"PricewaterhouseCoopers LLP",191,"PricewaterhouseCoopers LLP Chartered Accountants",271,Edmonton,A0,ALBERTA,Canada,10-K,2022-02-28,,"Aurinia Pharmaceuticals Inc.",1600620,"=""AUPH""","#140, 14315 - 118 AVENUE",,EDMONTON,A0,ALBERTA,Canada,,,"=""2834""","Pharmaceutical Preparations",325412,"Pharmaceutical Preparation Manufacturing",34,23,12/31/21,"3,238,392,064",12/31/21,"45,605,000","-180,966,000","470,687,000","543,367,000"
13081,"Goodwill and intangible assets","Valuation of goodwill and indefinite life intangible assets in the cannabis operating segment and the U.S. CBD cash generating unit",464379,06/30/21,09/27/21,4,"KPMG LLP",187,"KPMG LLP Chartered Accountants",85,Vancouver,A1,"BRITISH COLUMBIA",Canada,40-F,2021-09-27,,"AURORA CANNABIS INC",1683541,"=""ACB""","2207 90B STREET SW",,EDMONTON,A0,ALBERTA,Canada,,,"=""2833""","Medicinal Chemicals and Botanical Products",111419,"Other Food Crops Grown Under Cover",34,9,07/02/21,"993,272,320",06/30/21,"198,055,000","-561,325,000","631,926,000","2,103,473,000"
13082,"Other assets","Measurement of fair value of biological assets",464379,06/30/21,09/27/21,4,"KPMG LLP",187,"KPMG LLP Chartered Accountants",85,Vancouver,A1,"BRITISH COLUMBIA",Canada,40-F,2021-09-27,,"AURORA CANNABIS INC",1683541,"=""ACB""","2207 90B STREET SW",,EDMONTON,A0,ALBERTA,Canada,,,"=""2833""","Medicinal Chemicals and Botanical Products",111419,"Other Food Crops Grown Under Cover",34,9,07/02/21,"993,272,320",06/30/21,"198,055,000","-561,325,000","631,926,000","2,103,473,000"
13083,Inventory,"Assessment of the cannabis inventory provision",464379,06/30/21,09/27/21,4,"KPMG LLP",187,"KPMG LLP Chartered Accountants",85,Vancouver,A1,"BRITISH COLUMBIA",Canada,40-F,2021-09-27,,"AURORA CANNABIS INC",1683541,"=""ACB""","2207 90B STREET SW",,EDMONTON,A0,ALBERTA,Canada,,,"=""2833""","Medicinal Chemicals and Botanical Products",111419,"Other Food Crops Grown Under Cover",34,9,07/02/21,"993,272,320",06/30/21,"198,055,000","-561,325,000","631,926,000","2,103,473,000"
9663,"Revenue from customer contracts","Revenue Recognition",449572,01/31/21,03/19/21,2,"Ernst & Young LLP",,,,"San Francisco",CA,CALIFORNIA,"US West",10-K,2021-03-19,,"Autodesk, Inc.",769397,"=""ADSK""","ONE MARKET, STE. 400.",,"SAN FRANCISCO",CA,CALIFORNIA,"US West",,,"=""7372""","Prepackaged Software",511210,"Software Publishers",34,277,01/31/21,"60,923,629,568",01/31/21,"3,790,400,000","1,208,200,000","-1,829,600,000","7,279,800,000"
9664,"Uncertain tax positions","Uncertain tax positions",449572,01/31/21,03/19/21,2,"Ernst & Young LLP",,,,"San Francisco",CA,CALIFORNIA,"US West",10-K,2021-03-19,,"Autodesk, Inc.",769397,"=""ADSK""","ONE MARKET, STE. 400.",,"SAN FRANCISCO",CA,CALIFORNIA,"US West",,,"=""7372""","Prepackaged Software",511210,"Software Publishers",34,277,01/31/21,"60,923,629,568",01/31/21,"3,790,400,000","1,208,200,000","-1,829,600,000","7,279,800,000"
9665,"Deferred income taxes","Realizability of Deferred Tax Assets",449572,01/31/21,03/19/21,2,"Ernst & Young LLP",,,,"San Francisco",CA,CALIFORNIA,"US West",10-K,2021-03-19,,"Autodesk, Inc.",769397,"=""ADSK""","ONE MARKET, STE. 400.",,"SAN FRANCISCO",CA,CALIFORNIA,"US West",,,"=""7372""","Prepackaged Software",511210,"Software Publishers",34,277,01/31/21,"60,923,629,568",01/31/21,"3,790,400,000","1,208,200,000","-1,829,600,000","7,279,800,000"
20546,"Allowance for credit losses","Allowance for current expected credit losses on accounts receivable",484664,12/31/21,04/25/22,1,"PricewaterhouseCoopers LLP",94,"PricewaterhouseCoopers Zhong Tian LLP",1424,Beijing,F4,CHINA,Foreign,20-F,2022-04-25,,"Autohome Inc.",1527636,"=""ATHM""","18TH FLOOR TOWER B, CEC PLAZA","3 Dan Ling Street, Haidian District",BEIJING,F4,CHINA,Foreign,,,"=""7374""","Computer Processing and Data Preparation and Processing Services",518210,"Data Processing, Hosting, and Related Services",34,26,12/29/21,"12,522,008,576",12/31/21,"1,135,510,000","337,117,000","3,105,687,000","4,476,297,000"
20547,"Equity investments and joint ventures","The determination of fair value of convertible redeemable noncontrolling interests in TTP Car Inc. (“TTP”)",484664,12/31/21,04/25/22,1,"PricewaterhouseCoopers LLP",94,"PricewaterhouseCoopers Zhong Tian LLP",1424,Beijing,F4,CHINA,Foreign,20-F,2022-04-25,,"Autohome Inc.",1527636,"=""ATHM""","18TH FLOOR TOWER B, CEC PLAZA","3 Dan Ling Street, Haidian District",BEIJING,F4,CHINA,Foreign,,,"=""7374""","Computer Processing and Data Preparation and Processing Services",518210,"Data Processing, Hosting, and Related Services",34,26,12/29/21,"12,522,008,576",12/31/21,"1,135,510,000","337,117,000","3,105,687,000","4,476,297,000"
15341,"Revenue from customer contracts","Revenue recognition – Variable consideration",474394,12/31/21,02/22/22,2,"Ernst & Young LLP",55,"Ernst & Young AB",1433,Stockholm,V7,SWEDEN,Foreign,10-K,2022-02-22,,"AUTOLIV INC",1034670,"=""ALV""","3350 AIRPORT RD",,OGDEN,UT,UTAH,"US West",,,"=""3714""","Motor Vehicle Parts and Accessories",336399,"All Other Motor Vehicle Parts Manufacturing",34,103,12/31/21,"9,048,375,296",12/31/21,"8,230,000,000","436,000,000","1,239,000,000","7,538,000,000"
15342,"Warranty liabilities","Product recalls",474394,12/31/21,02/22/22,2,"Ernst & Young LLP",55,"Ernst & Young AB",1433,Stockholm,V7,SWEDEN,Foreign,10-K,2022-02-22,,"AUTOLIV INC",1034670,"=""ALV""","3350 AIRPORT RD",,OGDEN,UT,UTAH,"US West",,,"=""3714""","Motor Vehicle Parts and Accessories",336399,"All Other Motor Vehicle Parts Manufacturing",34,103,12/31/21,"9,048,375,296",12/31/21,"8,230,000,000","436,000,000","1,239,000,000","7,538,000,000"
12534,Goodwill,"Goodwill – Employer Services Reportable Segment— Refer to Notes 1 and 7 to the financial statements",461569,06/30/21,08/04/21,3,"Deloitte & Touche LLP",,,,Parsippany,NJ,"NEW JERSEY","US Mid Atlantic",10-K,2021-08-04,,"AUTOMATIC DATA PROCESSING INC",8670,"=""ADP""","ONE ADP BOULVARD",,ROSELAND,NJ,"NEW JERSEY","US Mid Atlantic",,,"=""7374""","Computer Processing and Data Preparation and Processing Services",518210,"Data Processing, Hosting, and Related Services",34,199,06/30/21,"84,155,293,696",06/30/21,"15,005,400,000","2,598,500,000","2,121,600,000","48,772,500,000"
12535,"Other liabilities and provisions","Client Funds Obligations - Refer to Note 4 to the financial statements",461569,06/30/21,08/04/21,3,"Deloitte & Touche LLP",,,,Parsippany,NJ,"NEW JERSEY","US Mid Atlantic",10-K,2021-08-04,,"AUTOMATIC DATA PROCESSING INC",8670,"=""ADP""","ONE ADP BOULVARD",,ROSELAND,NJ,"NEW JERSEY","US Mid Atlantic",,,"=""7374""","Computer Processing and Data Preparation and Processing Services",518210,"Data Processing, Hosting, and Related Services",34,199,06/30/21,"84,155,293,696",06/30/21,"15,005,400,000","2,598,500,000","2,121,600,000","48,772,500,000"
15132,"Other intangible assets","Fair value of franchise rights",474077,12/31/21,02/17/22,4,"KPMG LLP",,,,"Fort Lauderdale",FL,FLORIDA,"US Southeast",10-K,2022-02-17,,"AUTONATION, INC.",350698,"=""AN""","200 SW 1ST AVE","SUITE 1600","FORT LAUDERDALE",FL,FLORIDA,"US Southeast",,,"=""5500""","Retail-Auto Dealers & Gasoline Stations",441110,"New Car Dealers",34,117,12/31/21,"7,316,049,408",12/31/21,"25,844,000,000","1,373,000,000","398,200,000","8,943,600,000"
13389,"Other contingent liabilities","Valuation of Self-insurance Reserves",466240,08/28/21,10/25/21,2,"Ernst & Young LLP",,,,Memphis,TN,TENNESSEE,"US Southeast",10-K,2021-10-25,,"AUTOZONE INC",866787,"=""AZO""","123 SOUTH FRONT ST","DEPT 8074",MEMPHIS,TN,TENNESSEE,"US Southeast",,,"=""5531""","Auto and Home Supply Stores",441310,"Automotive Parts and Accessories Stores",34,"1,549",08/31/21,"32,745,932,800",08/28/21,"14,629,585,000","2,170,314,000","-2,100,181,000","14,516,199,000"
15993,"Revenue from customer contracts","Subscription and Returns Revenue— Refer to Note 2 and Note 6 to the financial statements",475292,12/31/21,02/24/22,3,"Deloitte & Touche LLP",,,,Seattle,WA,WASHINGTON,"US West",10-K,2022-02-24,,"AVALARA, INC.",1348036,,"255 S. KING ST.","SUITE 1800",SEATTLE,WA,WASHINGTON,"US West",,,"=""7372""","Prepackaged Software",511210,"Software Publishers",34,129,12/31/21,"11,243,802,624",12/31/21,"698,977,000","-135,618,000","257,255,000","2,698,531,000"
21027,"Revenue from customer contracts","Subscription and Returns Revenue— Refer to Note 2 and Note 6 to the financial statements",486709,12/31/21,02/24/22,3,"Deloitte & Touche LLP",,,,Seattle,WA,WASHINGTON,"US West",10-K/A,2022-05-05,,"AVALARA, INC.",1348036,,"255 S. KING ST.","SUITE 1800",SEATTLE,WA,WASHINGTON,"US West",,,"=""7372""","Prepackaged Software",511210,"Software Publishers",34,129,12/31/21,"11,243,802,624",12/31/21,"698,977,000","-135,618,000","257,255,000","2,698,531,000"
17641,"Other debt","Accounting for long-term debt",477170,12/31/21,03/02/22,2,"Ernst & Young LLP",,,,Baltimore,MD,MARYLAND,"US Mid Atlantic",10-K,2022-03-02,Yes,"Avalo Therapeutics, Inc.",1534120,"=""AVTX""","1500 LIBERTY RIDGE DRIVE","SUITE 321",WAYNE,PA,PENNSYLVANIA,"US Mid Atlantic",,,"=""2834""","Pharmaceutical Preparations",325412,"Pharmaceutical Preparation Manufacturing",34,2,12/31/21,"191,750,144",12/31/21,"5,398,000","-84,376,000","8,635,000","80,214,000"
16386,"Deferred and capitalized costs","Valuation of Deferred Development Costs and Land Held for Development",476001,12/31/21,02/25/22,2,"Ernst & Young LLP",,,,Tysons,VA,VIRGINIA,"US Mid Atlantic",10-K,2022-02-25,,"AVALONBAY COMMUNITIES INC",915912,"=""AVB""","4040 WILSON BOULEVARD","STE 1000",ARLINGTON,VA,VIRGINIA,"US Mid Atlantic",,,"=""6798""","Real Estate Investment Trusts",525990,"Other Financial Vehicles",34,253,12/31/21,"35,299,938,304",12/31/21,"2,294,850,000","1,004,299,000",,"19,902,016,000"
15718,Goodwill,"Evaluation of the impairment of the carrying value of goodwill in the Renewables reporting unit",474896,12/31/21,02/23/22,4,"KPMG LLP",,,,"New York",NY,"NEW YORK","US Mid Atlantic",10-K,2022-02-23,,"Avangrid, Inc.",1634997,,"180 MARSH HILL ROAD",,ORANGE,CT,CONNECTICUT,"US New England",,,"=""4911""","Electric Services",221119,"Other Electric Power Generation",34,50,12/31/21,"19,282,016,256",12/31/21,"6,974,000,000","707,000,000","15,664,000,000","39,504,000,000"
15719,"Regulatory assets and liabilities","Evaluation of regulatory assets and liabilities",474896,12/31/21,02/23/22,4,"KPMG LLP",,,,"New York",NY,"NEW YORK","US Mid Atlantic",10-K,2022-02-23,,"Avangrid, Inc.",1634997,,"180 MARSH HILL ROAD",,ORANGE,CT,CONNECTICUT,"US New England",,,"=""4911""","Electric Services",221119,"Other Electric Power Generation",34,50,12/31/21,"19,282,016,256",12/31/21,"6,974,000,000","707,000,000","15,664,000,000","39,504,000,000"
15720,"Other debt","Evaluation of tax equity financing arrangements",474896,12/31/21,02/23/22,4,"KPMG LLP",,,,"New York",NY,"NEW YORK","US Mid Atlantic",10-K,2022-02-23,,"Avangrid, Inc.",1634997,,"180 MARSH HILL ROAD",,ORANGE,CT,CONNECTICUT,"US New England",,,"=""4911""","Electric Services",221119,"Other Electric Power Generation",34,50,12/31/21,"19,282,016,256",12/31/21,"6,974,000,000","707,000,000","15,664,000,000","39,504,000,000"
15708,"Sales return and allowances","Net Sales/Accrued Expenses - Refer to Notes 1 and 15 to the consolidated financial statements",474891,12/31/21,02/23/22,3,"Deloitte & Touche LLP",,,,Atlanta,GA,GEORGIA,"US Southeast",10-K,2022-02-23,,"AVANOS MEDICAL, INC.",1606498,"=""AVNS""","5405 WINDWARD PARKWAY","SUITE 100 SOUTH",ALPHARETTA,GA,GEORGIA,"US Southeast",,,"=""3842""","Orthopedic, Prosthetic, and Surgical Appliances and Supplies",524114,"Direct Health and Medical Insurance Carriers",34,35,12/31/21,"1,671,307,392",12/31/21,"744,600,000","5,200,000","321,100,000","1,594,600,000"
16732,"Business combinations","Valuation of contingent consideration",475433,12/31/21,02/25/22,2,"Ernst & Young LLP",,,,Dallas,TX,TEXAS,"US Southwest",10-K,2022-02-25,,"AVANTAX, INC.",1068875,,"3200 OLYMPUS BLVD.","SUITE 100",DALLAS,TX,TEXAS,"US Southwest",,,"=""6199""","Finance Services",519120,"Libraries and Archives",34,17,12/29/21,"850,628,800",12/31/21,"885,200,000","7,757,000","-415,488,000","1,071,943,000"
16733,Goodwill,"Goodwill Impairment",475433,12/31/21,02/25/22,2,"Ernst & Young LLP",,,,Dallas,TX,TEXAS,"US Southwest",10-K,2022-02-25,,"AVANTAX, INC.",1068875,,"3200 OLYMPUS BLVD.","SUITE 100",DALLAS,TX,TEXAS,"US Southwest",,,"=""6199""","Finance Services",519120,"Libraries and Archives",34,17,12/29/21,"850,628,800",12/31/21,"885,200,000","7,757,000","-415,488,000","1,071,943,000"
14702,Goodwill,"Goodwill —Americas and Europe Reporting Units - Refer to Notes 2, 6 and 11 to the financial statements",473536,12/31/21,02/11/22,3,"Deloitte & Touche LLP",,,,Philadelphia,PA,PENNSYLVANIA,"US Mid Atlantic",10-K,2022-02-11,,"Avantor, Inc.",1722482,"=""AVTR""","RADNOR CORPORATE CENTER, BUILDING ONE","SUITE 200, 100 MATSONFORD ROAD",RADNOR,PA,PENNSYLVANIA,"US Mid Atlantic",,,"=""3826""","Laboratory Analytical Instruments",325188,"All Other Basic Inorganic Chemical Manufacturing",34,42,12/31/21,"25,692,758,016",12/31/21,"7,386,100,000","572,600,000","-6,284,400,000","13,897,200,000"
13656,"Revenue from customer contracts","Revenue Recognition - Subscription-Based Term Software License Arrangements",467911,09/30/21,11/22/21,1,"PricewaterhouseCoopers LLP",,,,"New York",NY,"NEW YORK","US Mid Atlantic",10-K,2021-11-22,,"Avaya Holdings Corp.",1418100,,"co Avaya Inc","2605 MERIDIAN PARKWAY, SUITE 200",DURHAM,NC,"NORTH CAROLINA","US Southeast",,,"=""7372""","Prepackaged Software",541611,"Administrative Management and General Management Consulting Services",34,20,09/30/21,"1,664,647,808",09/30/21,"2,973,000,000","-13,000,000","-3,193,000,000","5,985,000,000"
19261,"Sales return and allowances","Revenue Recognition",480996,01/01/22,03/28/22,2,"Ernst & Young LLP",,,,Atlanta,GA,GEORGIA,"US Southeast",10-K,2022-03-28,,"Aveanna Healthcare Holdings, Inc.",1832332,"=""AVAH""","400 INTERSTATE NORTH PARKWAY","STE 1700",ATLANTA,GA,GEORGIA,"US Southeast",,,"=""8082""","Home Health Care Services",621610,"Home Health Care Services",34,7,01/03/22,"1,373,864,832",01/01/22,"1,678,618,000","-117,044,000","-1,300,480,000","2,334,371,000"
19262,Goodwill,"Goodwill Impairment",480996,01/01/22,03/28/22,2,"Ernst & Young LLP",,,,Atlanta,GA,GEORGIA,"US Southeast",10-K,2022-03-28,,"Aveanna Healthcare Holdings, Inc.",1832332,"=""AVAH""","400 INTERSTATE NORTH PARKWAY","STE 1700",ATLANTA,GA,GEORGIA,"US Southeast",,,"=""8082""","Home Health Care Services",621610,"Home Health Care Services",34,7,01/03/22,"1,373,864,832",01/01/22,"1,678,618,000","-117,044,000","-1,300,480,000","2,334,371,000"
18481,"Sales return and allowances","Product discounts and allowances",479365,12/31/21,03/14/22,2,"Ernst & Young LLP",,,,Boston,MA,MASSACHUSETTS,"US New England",10-K,2022-03-14,,"AVEO PHARMACEUTICALS, INC.",1325879,,"30 WINTER STREET",,BOSTON,MA,MASSACHUSETTS,"US New England",,,"=""2834""","Pharmaceutical Preparations",325412,"Pharmaceutical Preparation Manufacturing",34,5,12/31/21,"161,687,744",12/31/21,"42,295,000","-53,342,000",,"105,341,000"
15881,"Deferred income taxes","Income Taxes",475063,01/01/22,02/23/22,1,"PricewaterhouseCoopers LLP",,,,"Los Angeles",CA,CALIFORNIA,"US West",10-K,2022-02-23,,"Avery Dennison Corp",8818,"=""AVY""","8080 NORTON PARKWAY",,MENTOR,OH,OHIO,"US Midwest",,,"=""2670""","Converted Paper & Paperboard Prods (No Contaners/Boxes)",322222,"Coated and Laminated Paper Manufacturing",34,211,01/03/22,"17,454,137,344",01/01/22,"8,408,300,000","740,100,000","-868,500,000","7,971,600,000"
15882,"Business combinations","Acquisition of CB Velocity Holdings, LLC (“Vestcom”)
",475063,01/01/22,02/23/22,1,"PricewaterhouseCoopers LLP",,,,"Los Angeles",CA,CALIFORNIA,"US West",10-K,2022-02-23,,"Avery Dennison Corp",8818,"=""AVY""","8080 NORTON PARKWAY",,MENTOR,OH,OHIO,"US Midwest",,,"=""2670""","Converted Paper & Paperboard Prods (No Contaners/Boxes)",322222,"Coated and Laminated Paper Manufacturing",34,211,01/03/22,"17,454,137,344",01/01/22,"8,408,300,000","740,100,000","-868,500,000","7,971,600,000"
12249,"Deferred and capitalized costs","Estimated costs at completion for projects",459332,04/30/21,06/29/21,2,"Ernst & Young LLP",,,,Irvine,CA,CALIFORNIA,"US West",10-K,2021-06-29,,"Avid Bioservices, Inc.",704562,,"14191 MYFORD ROAD",,TUSTIN,CA,CALIFORNIA,"US West",,,"=""2834""","Pharmaceutical Preparations",325412,"Pharmaceutical Preparation Manufacturing",34,21,04/30/21,"1,307,487,232",04/30/21,"95,868,000","11,212,000",,"265,510,000"
15538,"Asset retirement and environmental obligations","Environmental Accrued Liabilities",474700,12/31/21,02/22/22,2,"Ernst & Young LLP",,,,Cleveland,OH,OHIO,"US Midwest",10-K,2022-02-22,,"AVIENT CORP",1122976,"=""AVNT""","33587 WALKER ROAD",,"AVON LAKE",OH,OHIO,"US Midwest",,,"=""2821""","Plastics Material and Synthetic Resins, and Nonvulcanizable Elastomers",325211,"Plastics Material and Resin Manufacturing",34,56,12/31/21,"5,125,020,160",12/31/21,"3,315,500,000","230,800,000","-436,900,000","4,997,200,000"
15539,"Business combinations","Accounting for the Clariant Color Business Combination",474700,12/31/21,02/22/22,2,"Ernst & Young LLP",,,,Cleveland,OH,OHIO,"US Midwest",10-K,2022-02-22,,"AVIENT CORP",1122976,"=""AVNT""","33587 WALKER ROAD",,"AVON LAKE",OH,OHIO,"US Midwest",,,"=""2821""","Plastics Material and Synthetic Resins, and Nonvulcanizable Elastomers",325211,"Plastics Material and Resin Manufacturing",34,56,12/31/21,"5,125,020,160",12/31/21,"3,315,500,000","230,800,000","-436,900,000","4,997,200,000"
15054,"Depreciation and amortization","Vehicles - Depreciation Expense - United States Risk Vehicles - Refer to Notes 2 and 8 to the financial statements",474073,12/31/21,02/17/22,3,"Deloitte & Touche LLP",,,,"New York",NY,"NEW YORK","US Mid Atlantic",10-K,2022-02-17,,"AVIS BUDGET GROUP, INC.",723612,"=""CAR""","379 INTERPACE PARKWAY",,PARSIPPANY,NJ,"NEW JERSEY","US Mid Atlantic",,,"=""7510""","Services-Auto Rental & Leasing (No Drivers)",532111,"Passenger Car Rental",34,207,12/31/21,"11,612,720,128",12/31/21,"9,313,000,000","1,285,000,000","1,401,000,000","22,063,000,000"
15055,"Other contingent liabilities","Self-Insurance Reserves - Public Liability and Property Damage Claims - United States - Refer to Note 2 to the financial statements",474073,12/31/21,02/17/22,3,"Deloitte & Touche LLP",,,,"New York",NY,"NEW YORK","US Mid Atlantic",10-K,2022-02-17,,"AVIS BUDGET GROUP, INC.",723612,"=""CAR""","379 INTERPACE PARKWAY",,PARSIPPANY,NJ,"NEW JERSEY","US Mid Atlantic",,,"=""7510""","Services-Auto Rental & Leasing (No Drivers)",532111,"Passenger Car Rental",34,207,12/31/21,"11,612,720,128",12/31/21,"9,313,000,000","1,285,000,000","1,401,000,000","22,063,000,000"
15056,Goodwill,"Goodwill - Europe, Middle East and Africa (“EMEA”) Reporting Unit - Refer to Notes 2 and 7 to the financial statements",474073,12/31/21,02/17/22,3,"Deloitte & Touche LLP",,,,"New York",NY,"NEW YORK","US Mid Atlantic",10-K,2022-02-17,,"AVIS BUDGET GROUP, INC.",723612,"=""CAR""","379 INTERPACE PARKWAY",,PARSIPPANY,NJ,"NEW JERSEY","US Mid Atlantic",,,"=""7510""","Services-Auto Rental & Leasing (No Drivers)",532111,"Passenger Car Rental",34,207,12/31/21,"11,612,720,128",12/31/21,"9,313,000,000","1,285,000,000","1,401,000,000","22,063,000,000"
15548,"Regulatory assets and liabilities","Regulatory Matters - Refer to Notes 1, 22, and 23 to the financial statements",474652,12/31/21,02/22/22,3,"Deloitte & Touche LLP",,,,Portland,OR,OREGON,"US West",10-K,2022-02-23,,"AVISTA CORP",104918,"=""AVA""","1411 E MISSION AVE",,SPOKANE,WA,WASHINGTON,"US West",,,"=""4931""","Electric and Other Services Combined",221210,"Natural Gas Distribution",34,42,12/31/21,"3,037,929,728",12/31/21,"1,438,936,000","147,334,000","2,102,318,000","6,853,583,000"
12621,"Other income taxes","Evaluation of accounting for income taxes",462010,07/03/21,08/13/21,4,"KPMG LLP",,,,Phoenix,AZ,ARIZONA,"US Southwest",10-K,2021-08-13,,"AVNET INC",8858,"=""AVT""","2211 SOUTH 47TH STREET",,PHOENIX,AZ,ARIZONA,"US Southwest",,,"=""5065""","Electronic Parts and Equipment, NEC",334419,"Other Electronic Component Manufacturing",34,40,07/01/21,"4,003,962,368",07/03/21,"19,534,679,000","193,114,000","3,217,540,000","8,925,422,000"
18150,"Deferred income taxes","Realizability of the deferred tax assets",478838,12/31/21,03/10/22,1,"PricewaterhouseCoopers LLP",121,"PricewaterhouseCoopers LLP",876,London,X0,"UNITED KINGDOM",Foreign,10-K,2022-03-10,,"AVON PRODUCTS INC",8868,,"1 AVON PLACE",,SUFFERN,NY,"NEW YORK","US Mid Atlantic",1776967,"Natura &Co Holding S.A.","=""2844""","Perfumes, Cosmetics, and Other Toilet Preparations",325620,"Toilet Preparation Manufacturing",34,,,,12/31/21,"3,404,500,000","-192,100,000","-930,600,000","2,307,800,000"
15219,"Other income taxes","Measurement of Unrecognized Tax Benefits",474130,12/31/21,02/18/22,1,"PricewaterhouseCoopers LLP",,,,Philadelphia,PA,PENNSYLVANIA,"US Mid Atlantic",10-K,2022-02-18,,"Axalta Coating Systems Ltd.",1616862,"=""AXTA""","1050 CONSTITUTION AVENUE",,PHILADELPHIA,PA,PENNSYLVANIA,"US Mid Atlantic",,,"=""2851""","Paints, Varnishes, Lacquers, Enamels, and Allied Products",325510,"Paint and Coating Manufacturing",34,33,12/31/21,"7,531,488,256",12/31/21,"4,416,200,000","263,900,000","-1,378,000,000","7,217,200,000"
16340,"Revenue from customer contracts","Systems Revenue recognition",475674,12/31/21,02/25/22,2,"Ernst & Young LLP",,,,Boston,MA,MASSACHUSETTS,"US New England",10-K,2022-02-25,,"AXCELIS TECHNOLOGIES INC",1113232,"=""ACLS""","108 CHERRY HILL DRIVE",,BEVERLY,MA,MASSACHUSETTS,"US New England",,,"=""3559""","Special  Industry Machinery, NEC",333295,"Semiconductor Machinery Manufacturing",34,75,12/31/21,"2,478,374,400",12/31/21,"662,428,000","98,650,000",,"753,240,000"
16341,Inventory,"Estimate of Excess Inventory",475674,12/31/21,02/25/22,2,"Ernst & Young LLP",,,,Boston,MA,MASSACHUSETTS,"US New England",10-K,2022-02-25,,"AXCELIS TECHNOLOGIES INC",1113232,"=""ACLS""","108 CHERRY HILL DRIVE",,BEVERLY,MA,MASSACHUSETTS,"US New England",,,"=""3559""","Special  Industry Machinery, NEC",333295,"Semiconductor Machinery Manufacturing",34,75,12/31/21,"2,478,374,400",12/31/21,"662,428,000","98,650,000",,"753,240,000"
16641,"Other contingent liabilities","Reserve for losses and loss expenses - Refer to Notes 2 and 8 to the consolidated financial statements",475825,12/31/21,02/25/22,3,"Deloitte & Touche LLP",506,"Deloitte Ltd",5230,Hamilton,D0,BERMUDA,Foreign,10-K,2022-02-25,,"AXIS CAPITAL HOLDINGS LTD",1214816,"=""AXS""","92 PITTS BAY ROAD",,PEMBROKE,D0,BERMUDA,Foreign,,,"=""6331""","Fire, Marine, and Casualty Insurance",524126,"Direct Property and Casualty Insurance Carriers",34,54,12/29/21,"4,610,824,192",12/31/21,"5,321,725,000","618,609,000","5,101,138,000","27,368,970,000"
16425,Inventory,"Inventory – Valuation Associated with Excess and Obsolete (E&O) Inventory — Refer to Notes 3 and 4 to the financial statements",476010,12/31/21,02/25/22,3,"Deloitte & Touche LLP",,,,Miami,FL,FLORIDA,"US Southeast",10-K,2022-02-25,,"Axogen, Inc.",805928,"=""AXGN""","13631 PROGRESS BLVD.","SUITE 400",ALACHUA,FL,FLORIDA,"US Southeast",,,"=""3845""","Electromedical and Electrotherapeutic Apparatus",325412,"Pharmaceutical Preparation Manufacturing",34,9,12/31/21,"391,075,232",12/31/21,"127,358,000","-26,985,000","109,691,000","208,024,000"
17402,"Other debt","Accounting for the Hercules Capital, Inc. Term Loan Amendment",476862,12/31/21,03/01/22,2,"Ernst & Young LLP",,,,"New York",NY,"NEW YORK","US Mid Atlantic",10-K,2022-03-01,,"Axsome Therapeutics, Inc.",1579428,"=""AXSM""","ONE WORLD TRADE CENTER, 29TH FLOOR",,"NEW YORK",NY,"NEW YORK","US Mid Atlantic",,,"=""2834""","Pharmaceutical Preparations",325412,"Pharmaceutical Preparation Manufacturing",34,38,12/31/21,"1,428,718,464",12/31/21,,"-130,402,992",,"87,785,058"
13683,Goodwill,"Quantitative Goodwill Impairment Assessment",467974,09/30/21,11/23/21,1,"PricewaterhouseCoopers LLP",,,,Chicago,IL,ILLINOIS,"US Midwest",10-K,2021-11-23,,"AZEK Co Inc.",1782754,,"1330 W FULTON STREET, #350",,CHICAGO,IL,ILLINOIS,"US Midwest",,,"=""3089""","Plastics Products, NEC",332322,"Sheet Metal Work Manufacturing",34,37,09/30/21,"5,657,266,176",09/30/21,"1,178,974,000","88,865,000","233,202,000","2,187,834,000"
13702,"Business combinations","Acquisition of Precise Automation Inc. – Valuation of Completed Technology",468146,09/30/21,11/24/21,1,"PricewaterhouseCoopers LLP",,,,Boston,MA,MASSACHUSETTS,"US New England",10-K,2021-11-24,,"Azenta, Inc.",933974,"=""AZTA""","200 SUMMIT DRIVE","6TH FLOOR",BURLINGTON,MA,MASSACHUSETTS,"US New England",,,"=""3559""","Special  Industry Machinery, NEC",333298,"All Other Industrial Machinery Manufacturing",34,105,09/28/21,"7,819,730,944",09/30/21,"513,703,000","110,747,000","669,444,000","1,819,512,000"
20920,"Revenue from customer contracts",Breakage,486136,12/31/21,04/29/22,2,"Ernst & Young LLP",34,"Ernst & Young Auditores Independentes SS",1448,"São Paulo",D5,BRAZIL,Foreign,20-F,2022-05-02,,"AZUL SA",1432364,"=""AZULQ""","AV. MARCOS PENTEADO ULHOA RODRIGUES","NO. 939, 9 FLOOR, ED. JATOBA",BARUERI,D5,BRAZIL,Foreign,,,"=""4512""","Air Transportation, Scheduled",481111,"Scheduled Passenger Air Transportation",34,13,12/29/21,"1,394,013,312",12/31/21,"1,790,975,000","-756,411,000","-3,535,196,000","3,327,374,000"
20921,Leases,"Maintenance reserve deposits",486136,12/31/21,04/29/22,2,"Ernst & Young LLP",34,"Ernst & Young Auditores Independentes SS",1448,"São Paulo",D5,BRAZIL,Foreign,20-F,2022-05-02,,"AZUL SA",1432364,"=""AZULQ""","AV. MARCOS PENTEADO ULHOA RODRIGUES","NO. 939, 9 FLOOR, ED. JATOBA",BARUERI,D5,BRAZIL,Foreign,,,"=""4512""","Air Transportation, Scheduled",481111,"Scheduled Passenger Air Transportation",34,13,12/29/21,"1,394,013,312",12/31/21,"1,790,975,000","-756,411,000","-3,535,196,000","3,327,374,000"
20922,"Going concern","Assessment of the impacts of the COVID-19 pandemic",486136,12/31/21,04/29/22,2,"Ernst & Young LLP",34,"Ernst & Young Auditores Independentes SS",1448,"São Paulo",D5,BRAZIL,Foreign,20-F,2022-05-02,,"AZUL SA",1432364,"=""AZULQ""","AV. MARCOS PENTEADO ULHOA RODRIGUES","NO. 939, 9 FLOOR, ED. JATOBA",BARUERI,D5,BRAZIL,Foreign,,,"=""4512""","Air Transportation, Scheduled",481111,"Scheduled Passenger Air Transportation",34,13,12/29/21,"1,394,013,312",12/31/21,"1,790,975,000","-756,411,000","-3,535,196,000","3,327,374,000"
17396,"Other intangible assets","Assessment of the carrying values of certain indefinite-lived intangible assets",476850,01/01/22,03/01/22,4,"KPMG LLP",,,,"Short Hills",NJ,"NEW JERSEY","US Mid Atlantic",10-K,2022-03-01,,"B&G Foods, Inc.",1278027,"=""BGS""","FOUR GATEHALL DRIVE","SUITE 110",PARSIPPANY,NJ,"NEW JERSEY","US Mid Atlantic",,,"=""2000""","Food and Kindred Products",311999,"All Other Miscellaneous Food Manufacturing",34,31,01/03/22,"2,029,975,296",01/01/22,"2,056,264,000","67,363,000","-1,651,736,000","3,828,545,000"
15876,"Long-lived assets","Menankoto Property impairment analysis
",475046,12/31/21,02/22/22,1,"PricewaterhouseCoopers LLP",191,"PricewaterhouseCoopers LLP Chartered Accountants",271,Vancouver,A1,"BRITISH COLUMBIA",Canada,6-K,2022-02-23,,"B2GOLD CORP",1429937,"=""BTG""","PARK PLACE","SUITE 3400 - 666 BURRARD STREET",VANCOUVER,A1,"BRITISH COLUMBIA",Canada,,,"=""1040""","Metal Mining",212221,"Gold Ore Mining",34,4,12/31/21,"4,151,391,488",12/31/21,"1,762,264,000","460,825,000",,"3,561,293,000"
19485,"Long-lived assets","Menankoto Property impairment analysis",481484,12/31/21,02/22/22,1,"PricewaterhouseCoopers LLP",191,"PricewaterhouseCoopers LLP Chartered Accountants",271,Vancouver,A1,"BRITISH COLUMBIA",Canada,40-F,2022-03-30,,"B2GOLD CORP",1429937,"=""BTG""","PARK PLACE","SUITE 3400 - 666 BURRARD STREET",VANCOUVER,A1,"BRITISH COLUMBIA",Canada,,,"=""1040""","Metal Mining",212221,"Gold Ore Mining",34,4,12/31/21,"4,151,391,488",12/31/21,"1,762,264,000","460,825,000",,"3,561,293,000"
17917,"Revenue from customer contracts","Revenue Recognition and Contracts – Refer to Notes 2 and 5 to the financial statements",478133,12/31/21,03/08/22,3,"Deloitte & Touche LLP",,,,Cleveland,OH,OHIO,"US Midwest",10-K,2022-03-08,,"Babcock & Wilcox Enterprises, Inc.",1630805,"=""BW""","1200 E. MARKET STREET, SUITE 650",,AKRON,OH,OHIO,"US Midwest",,,"=""3433""","Heating Equipment, Except Electric and Warm Air Furnaces",333414,"Heating Equipment (except Warm Air Furnaces) Manufacturing",34,9,12/31/21,"778,299,712",12/31/21,"710,873,000","30,894,000","-127,108,000","913,265,000"
15877,"Warranty liabilities","Warranty and After-Sale Costs Reserve",475055,12/31/21,02/23/22,2,"Ernst & Young LLP",,,,Milwaukee,WI,WISCONSIN,"US Midwest",10-K,2022-02-23,,"BADGER METER INC",9092,"=""BMI""","4545 WEST BROWN DEER ROAD",,MILWAUKEE,WI,WISCONSIN,"US Midwest",,,"=""3824""","Totalizing Fluid Meters and Counting Devices",335313,"Switchgear and Switchboard Apparatus Manufacturing",34,107,12/31/21,"3,116,851,456",12/31/21,"505,198,000","60,884,000","234,581,000","530,818,000"
15878,"Business combinations","Accounting for Acquisitions – Valuation of Analytical Technology, Inc. Intangible Assets",475055,12/31/21,02/23/22,2,"Ernst & Young LLP",,,,Milwaukee,WI,WISCONSIN,"US Midwest",10-K,2022-02-23,,"BADGER METER INC",9092,"=""BMI""","4545 WEST BROWN DEER ROAD",,MILWAUKEE,WI,WISCONSIN,"US Midwest",,,"=""3824""","Totalizing Fluid Meters and Counting Devices",335313,"Switchgear and Switchboard Apparatus Manufacturing",34,107,12/31/21,"3,116,851,456",12/31/21,"505,198,000","60,884,000","234,581,000","530,818,000"
19190,"Equity investments and joint ventures","Valuation of equity investments accounted for using the measurement alternative",480881,12/31/21,03/28/22,2,"Ernst & Young LLP",211,"Ernst & Young Hua Ming LLP",1408,Beijing,F4,CHINA,Foreign,20-F,2022-03-28,,"Baidu, Inc.",1329099,"=""BIDU""","BAIDU CAMPUS, NO. 10 SHANGDI 10TH STREET","HAIDIAN DISTRICT",BEIJING,F4,CHINA,Foreign,,,"=""7370""","Services-Computer Programming, Data Processing, Etc.",518210,"Data Processing, Hosting, and Related Services",34,136,12/29/21,"35,901,911,040",12/31/21,"19,533,000,000","1,604,000,000","27,632,000,000","59,629,000,000"
19191,"Equity investments and joint ventures","Impairment assessment of equity method investments and equity investments accounted for using the measurement alternative",480881,12/31/21,03/28/22,2,"Ernst & Young LLP",211,"Ernst & Young Hua Ming LLP",1408,Beijing,F4,CHINA,Foreign,20-F,2022-03-28,,"Baidu, Inc.",1329099,"=""BIDU""","BAIDU CAMPUS, NO. 10 SHANGDI 10TH STREET","HAIDIAN DISTRICT",BEIJING,F4,CHINA,Foreign,,,"=""7370""","Services-Computer Programming, Data Processing, Etc.",518210,"Data Processing, Hosting, and Related Services",34,136,12/29/21,"35,901,911,040",12/31/21,"19,533,000,000","1,604,000,000","27,632,000,000","59,629,000,000"
15812,"Equity investments and joint ventures","Valuation of Portfolio Investments—Certain Level 3 Portfolio Investments in Loans, Subordinated Debt, Preferred Equity, and Equity Interests Valued Using Significant Unobservable Inputs Developed by Management",474955,12/31/21,02/23/22,1,"PricewaterhouseCoopers LLP",,,,Boston,MA,MASSACHUSETTS,"US New England",10-K,2022-02-23,,"Bain Capital Specialty Finance, Inc.",1655050,"=""BCSF""","C/O BAIN CAPITAL CREDIT, LP","200 CLARENDON STREET",BOSTON,MA,MASSACHUSETTS,"US New England",,,,,525990,"Other Financial Vehicles",34,15,12/31/21,"981,992,064",12/31/21,"146,049,000","119,807,000",,"2,571,193,000"
14699,"Revenue from customer contracts","Revenue recognition on certain agreements for sales of goods manufactured to unique customer specifications",473539,12/31/21,02/11/22,4,"KPMG LLP",,,,Houston,TX,TEXAS,"US Southwest",10-K,2022-02-11,,"Baker Hughes Co",1701605,"=""BKR""","575 NORTH DAIRY ASHFORD ROAD, SUITE 100",,HOUSTON,TX,TEXAS,"US Southwest",40545,"GENERAL ELECTRIC CO","=""3533""","Oil and Gas Field Machinery and Equipment",333132,"Oil and Gas Field Machinery and Equipment Manufacturing",34,24,12/31/21,"21,870,540,800",12/31/21,"20,502,000,000","-219,000,000","4,740,000,000","35,308,000,000"
14715,"Revenue from customer contracts","Revenue recognition on certain agreements for sales of goods manufactured to unique customer specifications",473594,12/31/21,02/11/22,4,"KPMG LLP",,,,Houston,TX,TEXAS,"US Southwest",10-K,2022-02-11,,"Baker Hughes Holdings LLC",808362,,"575 NORTH DAIRY ASHFORD ROAD, SUITE 100",,HOUSTON,TX,TEXAS,"US Southwest",40545,"GENERAL ELECTRIC CO","=""3533""","Oil and Gas Field Machinery and Equipment",333131,"Mining Machinery and Equipment Manufacturing",34,,,,12/31/21,"20,502,000,000","-372,000,000","6,735,000,000","35,286,000,000"
17559,"Business combinations","Valuation of the Acquired Purchased Customer Accounts and Distributor Relationships Intangible Assets",477070,12/31/21,03/01/22,1,"PricewaterhouseCoopers LLP",,,,Tampa,FL,FLORIDA,"US Southeast",10-K,2022-03-01,,"Baldwin Insurance Group, Inc.",1781755,"=""BWIN""","4211 W. BOY SCOUT BLVD.","SUITE 800",TAMPA,FL,FLORIDA,"US Southeast",,,"=""6411""","Insurance Agents, Brokers, and Service",524210,"Insurance Agencies and Brokerages",34,36,12/31/21,"2,116,149,248",12/31/21,"567,290,000","-30,646,000","-1,564,556,000","2,876,307,000"
17560,"Other contingent liabilities","Valuation of Contingent Earnout Liabilities",477070,12/31/21,03/01/22,1,"PricewaterhouseCoopers LLP",,,,Tampa,FL,FLORIDA,"US Southeast",10-K,2022-03-01,,"Baldwin Insurance Group, Inc.",1781755,"=""BWIN""","4211 W. BOY SCOUT BLVD.","SUITE 800",TAMPA,FL,FLORIDA,"US Southeast",,,"=""6411""","Insurance Agents, Brokers, and Service",524210,"Insurance Agencies and Brokerages",34,36,12/31/21,"2,116,149,248",12/31/21,"567,290,000","-30,646,000","-1,564,556,000","2,876,307,000"
14916,"Revenue from customer contracts","Revenue Recognition - Estimated Costs at Completion for Aerospace Fixed-Price Contracts",473869,12/31/21,02/16/22,1,"PricewaterhouseCoopers LLP",,,,Denver,CO,COLORADO,"US West",10-K,2022-02-16,,"BALL Corp",9389,"=""BALL""","9200 W. 108TH CIRCLE",,WESTMINSTER,CO,COLORADO,"US West",,,"=""3411""","Metal Cans",322215,"Nonfolding Sanitary Food Container Manufacturing",34,95,12/29/21,"30,844,442,624",12/31/21,"13,811,000,000","878,000,000","-2,439,000,000","19,714,000,000"
18414,"Revenue from customer contracts","Estimated costs to complete engineering and technology transfer services for long-term fixed-price contracts",479410,12/31/21,03/11/22,4,"KPMG LLP",187,"KPMG LLP Chartered Accountants",85,Vancouver,A1,"BRITISH COLUMBIA",Canada,40-F,2022-03-14,,"Ballard Power Systems Inc.",1453015,"=""BLDP""","9000 GLENLYON PARKWAY",,BURNABY,A1,"BRITISH COLUMBIA",Canada,,,"=""3620""","Electrical Industrial Apparatus",335999,"All Other Miscellaneous Electrical Equipment and Component Manufacturing",34,12,12/29/21,"3,379,296,512",12/31/21,"104,505,000","-114,233,000","1,243,161,000","1,440,943,000"
20958,"Revenue from customer contracts","Estimated costs to complete engineering and technology transfer services for long-term fixed-price contracts",486240,12/31/21,03/11/22,4,"KPMG LLP",187,"KPMG LLP Chartered Accountants",85,Vancouver,A1,"BRITISH COLUMBIA",Canada,6-K,2022-05-02,,"Ballard Power Systems Inc.",1453015,"=""BLDP""","9000 GLENLYON PARKWAY",,BURNABY,A1,"BRITISH COLUMBIA",Canada,,,"=""3620""","Electrical Industrial Apparatus",335999,"All Other Miscellaneous Electrical Equipment and Component Manufacturing",34,12,12/29/21,"3,379,296,512",12/31/21,"104,505,000","-114,233,000","1,243,161,000","1,440,943,000"
17443,"Business combinations","Acquisition of Gamesys Group, Plc. – Refer to Notes 1 and 5 to the financial statements",477056,12/31/21,03/01/22,3,"Deloitte & Touche LLP",,,,Stamford,CT,CONNECTICUT,"US New England",10-K,2022-03-01,,"Bally's Corp",1747079,"=""BALY""","100 WESTMINSTER STREET",,PROVIDENCE,RI,"RHODE ISLAND","US New England",,,"=""7011""","Hotels and Motels",721120,"Casino Hotels",34,38,12/31/21,"1,988,805,376",12/31/21,"1,322,443,000","-114,697,000","-2,988,563,000","6,553,217,000"
21998,"Business combinations","Acquisition of Gamesys Group, Plc. – Refer to Notes 1 and 5 to the financial statements",490583,12/31/21,03/01/22,3,"Deloitte & Touche LLP",,,,Stamford,CT,CONNECTICUT,"US New England",10-K,2022-08-08,,"Bally's Corp",1747079,"=""BALY""","100 WESTMINSTER STREET",,PROVIDENCE,RI,"RHODE ISLAND","US New England",,,"=""7011""","Hotels and Motels",721120,"Casino Hotels",34,38,12/31/21,"1,988,805,376",12/31/21,"1,322,443,000","-114,697,000","-2,988,563,000","6,553,217,000"
22829,"Business combinations","Acquisition of Gamesys Group, Plc. – Refer to Notes 1 and 5 to the financial statements",494438,12/31/21,03/01/22,3,"Deloitte & Touche LLP",,,,Stamford,CT,CONNECTICUT,"US New England",10-K/A,2022-11-09,,"Bally's Corp",1747079,"=""BALY""","100 WESTMINSTER STREET",,PROVIDENCE,RI,"RHODE ISLAND","US New England",,,"=""7011""","Hotels and Motels",721120,"Casino Hotels",34,38,12/31/21,"1,988,805,376",12/31/21,"1,322,443,000","-114,697,000","-2,988,563,000","6,553,217,000"
16484,"Regulatory assets and liabilities","Accounting for the Effects of Rate Regulation",476019,12/31/21,02/25/22,1,"PricewaterhouseCoopers LLP",,,,Baltimore,MD,MARYLAND,"US Mid Atlantic",10-K,2022-02-25,,"BALTIMORE GAS & ELECTRIC CO",9466,,"2 CENTER PLAZA","110 W. FAYETTE STREET",BALTIMORE,MD,MARYLAND,"US Mid Atlantic",1004440,"CONSTELLATION ENERGY GROUP INC","=""4931""","Electric and Other Services Combined",221122,"Electric Power Distribution",34,,,,12/31/21,"3,341,000,000","408,000,000",,"12,324,000,000"
17489,"Allowance for credit losses","Allowance for Loan Losses",476706,12/31/21,03/01/22,2,"Ernst & Young LLP",,,,Irvine,CA,CALIFORNIA,"US West",10-K,2022-03-01,,"BANC OF CALIFORNIA, INC.",1169770,"=""BANC""","3 MACARTHUR PLACE",,"SANTA ANA",CA,CALIFORNIA,"US West",,,"=""6021""","National Commercial Banks",522120,"Savings Institutions",34,20,12/31/21,"1,220,132,608",12/31/21,"1,459,751,000","606,959,000","964,578,000","9,393,743,000"
17490,"Business combinations","Accounting for Merger with Pacific Mercantile Bancorp, Fair Value Estimate - Loans",476706,12/31/21,03/01/22,2,"Ernst & Young LLP",,,,Irvine,CA,CALIFORNIA,"US West",10-K,2022-03-01,,"BANC OF CALIFORNIA, INC.",1169770,"=""BANC""","3 MACARTHUR PLACE",,"SANTA ANA",CA,CALIFORNIA,"US West",,,"=""6021""","National Commercial Banks",522120,"Savings Institutions",34,20,12/31/21,"1,220,132,608",12/31/21,"1,459,751,000","606,959,000","964,578,000","9,393,743,000"
20096,"Allowance for credit losses","Provision for expected credit losses on financial assets at amortized cost and at fair value through comprehensive income, loan commitments and financial guarantees",483123,12/31/21,04/12/22,4,"KPMG LLP",466,KPMG,1410,"Buenos Aires",C1,ARGENTINA,Foreign,20-F,2022-04-12,,"Banco BBVA Argentina S.A.",913059,"=""BBAR""","AV. CORDOBA 111",,"BUENOS AIRES",C1,ARGENTINA,Foreign,,,"=""6029""","Commercial Banks, NEC",522110,"Commercial Banking",34,3,12/29/21,"669,896,384",12/31/21,"1,763,484,000","91,105,000","2,961,348,000","19,556,390,000"
20097,"Other investments","Measurement of fair value of difficult-to-value financial instruments",483123,12/31/21,04/12/22,4,"KPMG LLP",466,KPMG,1410,"Buenos Aires",C1,ARGENTINA,Foreign,20-F,2022-04-12,,"Banco BBVA Argentina S.A.",913059,"=""BBAR""","AV. CORDOBA 111",,"BUENOS AIRES",C1,ARGENTINA,Foreign,,,"=""6029""","Commercial Banks, NEC",522110,"Commercial Banking",34,3,12/29/21,"669,896,384",12/31/21,"1,763,484,000","91,105,000","2,961,348,000","19,556,390,000"
29494,"Allowance for credit losses","Provision for expected credit losses on financial assets at amortized cost and at fair value through comprehensive income, loan commitments and financial guarantees",510101,12/31/21,04/26/23,4,"KPMG LLP",466,KPMG,1410,"Buenos Aires",C1,ARGENTINA,Foreign,20-F,2023-04-26,,"Banco BBVA Argentina S.A.",913059,"=""BBAR""","AV. CORDOBA 111",,"BUENOS AIRES",C1,ARGENTINA,Foreign,,,"=""6029""","Commercial Banks, NEC",522110,"Commercial Banking",34,3,12/29/21,"669,896,384",12/31/21,"1,763,484,000","91,105,000","2,961,348,000","19,556,390,000"
29495,"Other investments","Measurement of fair value of difficult-to-value financial instruments",510101,12/31/21,04/26/23,4,"KPMG LLP",466,KPMG,1410,"Buenos Aires",C1,ARGENTINA,Foreign,20-F,2023-04-26,,"Banco BBVA Argentina S.A.",913059,"=""BBAR""","AV. CORDOBA 111",,"BUENOS AIRES",C1,ARGENTINA,Foreign,,,"=""6029""","Commercial Banks, NEC",522110,"Commercial Banking",34,3,12/29/21,"669,896,384",12/31/21,"1,763,484,000","91,105,000","2,961,348,000","19,556,390,000"
17787,"Allowance for credit losses","Expected credit losses related to loans and advances to customers",477814,12/31/21,03/04/22,4,"KPMG LLP",330,"KPMG Auditores SL",1027,Madrid,U3,SPAIN,Foreign,20-F,2022-03-04,,"BANCO BILBAO VIZCAYA ARGENTARIA, S.A.",842180,"=""BBVA""","CALLE AZUL 4",,BILBOA,U3,SPAIN,Foreign,,,"=""6029""","Commercial Banks, NEC",522110,"Commercial Banking",33,6,12/29/21,"39,407,210,496",12/31/21,"23,567,000,000","6,642,000,000","63,908,000,000","753,836,000,000"
17788,"Other investments","Measurement of fair value of certain difficult-to-value financial instruments",477814,12/31/21,03/04/22,4,"KPMG LLP",330,"KPMG Auditores SL",1027,Madrid,U3,SPAIN,Foreign,20-F,2022-03-04,,"BANCO BILBAO VIZCAYA ARGENTARIA, S.A.",842180,"=""BBVA""","CALLE AZUL 4",,BILBOA,U3,SPAIN,Foreign,,,"=""6029""","Commercial Banks, NEC",522110,"Commercial Banking",33,6,12/29/21,"39,407,210,496",12/31/21,"23,567,000,000","6,642,000,000","63,908,000,000","753,836,000,000"
20653,"Allowance for credit losses","Expected Credit Loss Allowance for Commercial, Mortgage and Consumer Loans - Collective Basis",485258,12/31/21,04/27/22,1,"PricewaterhouseCoopers LLP",644,"PricewaterhouseCoopers Consultores Auditores SpA",1364,Santiago,F3,CHILE,Foreign,20-F,2022-04-28,,"BANCO ITAU CHILE",1276671,"=""ITCLY""","AV. PRESIDENTE RIESCO 5537",,SANTIAGO,F3,CHILE,Foreign,,,"=""6029""","Commercial Banks, NEC",522110,"Commercial Banking",34,3,12/29/21,"1,000,901,184",12/31/21,"1,293,000,000","324,000,000","2,991,000,000","44,132,000,000"
20654,Goodwill,"Goodwill Impairment Assessment",485258,12/31/21,04/27/22,1,"PricewaterhouseCoopers LLP",644,"PricewaterhouseCoopers Consultores Auditores SpA",1364,Santiago,F3,CHILE,Foreign,20-F,2022-04-28,,"BANCO ITAU CHILE",1276671,"=""ITCLY""","AV. PRESIDENTE RIESCO 5537",,SANTIAGO,F3,CHILE,Foreign,,,"=""6029""","Commercial Banks, NEC",522110,"Commercial Banking",34,3,12/29/21,"1,000,901,184",12/31/21,"1,293,000,000","324,000,000","2,991,000,000","44,132,000,000"
16952,"Allowance for credit losses","Measurement of expected credit losses",476488,12/31/21,02/24/22,1,"PricewaterhouseCoopers LLP",91,"PricewaterhouseCoopers Auditores Independentes",1351,"São Paulo",D5,BRAZIL,Foreign,20-F,2022-02-28,,"Banco Santander (Brasil) S.A.",1471055,"=""BSBR""","AV. JUSCELINO KUBITSCHEK, 2235","AV. JUSCELINO KUBITSCHEK, 2041","SAO PAULO, SP",D5,BRAZIL,Foreign,891478,"Banco Santander, S.A.","=""6029""","Commercial Banks, NEC",522110,"Commercial Banking",34,5,12/31/21,"40,097,902,592",12/31/21,"7,971,226,000","2,787,578,000","12,352,662,000","166,096,834,000"
16953,"Other contingent liabilities","Provisions for judicial and administrative proceedings",476488,12/31/21,02/24/22,1,"PricewaterhouseCoopers LLP",91,"PricewaterhouseCoopers Auditores Independentes",1351,"São Paulo",D5,BRAZIL,Foreign,20-F,2022-02-28,,"Banco Santander (Brasil) S.A.",1471055,"=""BSBR""","AV. JUSCELINO KUBITSCHEK, 2235","AV. JUSCELINO KUBITSCHEK, 2041","SAO PAULO, SP",D5,BRAZIL,Foreign,891478,"Banco Santander, S.A.","=""6029""","Commercial Banks, NEC",522110,"Commercial Banking",34,5,12/31/21,"40,097,902,592",12/31/21,"7,971,226,000","2,787,578,000","12,352,662,000","166,096,834,000"
17033,"Allowance for credit losses","Measurement of expected credit losses",476321,12/31/21,02/24/22,1,"PricewaterhouseCoopers LLP",91,"PricewaterhouseCoopers Auditores Independentes",1351,"São Paulo",D5,BRAZIL,Foreign,6-K,2022-02-28,,"Banco Santander (Brasil) S.A.",1471055,"=""BSBR""","AV. JUSCELINO KUBITSCHEK, 2235","AV. JUSCELINO KUBITSCHEK, 2041","SAO PAULO, SP",D5,BRAZIL,Foreign,891478,"Banco Santander, S.A.","=""6029""","Commercial Banks, NEC",522110,"Commercial Banking",34,5,12/31/21,"40,097,902,592",12/31/21,"7,971,226,000","2,787,578,000","12,352,662,000","166,096,834,000"
17034,"Other contingent liabilities","Provisions for judicial and administrative proceedings",476321,12/31/21,02/24/22,1,"PricewaterhouseCoopers LLP",91,"PricewaterhouseCoopers Auditores Independentes",1351,"São Paulo",D5,BRAZIL,Foreign,6-K,2022-02-28,,"Banco Santander (Brasil) S.A.",1471055,"=""BSBR""","AV. JUSCELINO KUBITSCHEK, 2235","AV. JUSCELINO KUBITSCHEK, 2041","SAO PAULO, SP",D5,BRAZIL,Foreign,891478,"Banco Santander, S.A.","=""6029""","Commercial Banks, NEC",522110,"Commercial Banking",34,5,12/31/21,"40,097,902,592",12/31/21,"7,971,226,000","2,787,578,000","12,352,662,000","166,096,834,000"
16389,"Allowance for credit losses","Expected Credit Loss Allowance for Commercial, Mortgage and Consumer Loans – Collective Basis",476002,12/31/21,02/25/22,1,"PricewaterhouseCoopers LLP",644,"PricewaterhouseCoopers Consultores Auditores SpA",1364,Santiago,F3,CHILE,Foreign,20-F,2022-02-25,,"BANCO SANTANDER CHILE",1027552,"=""BSAC""","BANDERA 140, PISO 19",,SANTIAGO,F3,CHILE,Foreign,891478,"Banco Santander, S.A.","=""6029""","Commercial Banks, NEC",522293,"International Trade Financing",34,16,12/29/21,"7,646,201,344",12/31/21,"2,326,000,000","1,001,000,000","4,974,000,000","74,932,000,000"
17766,"Allowance for credit losses","Allowance for Impairment Losses – Macroeconomic and Portfolio Factors Impacting the Downside Scenario of the Forward-Looking Analysis",477363,12/31/21,03/03/22,1,"PricewaterhouseCoopers LLP",107,"PricewaterhouseCoopers SC",1128,"Mexico City",O5,MEXICO,Foreign,20-F,2022-03-03,,"Banco Santander Mexico S.A., Institucion de Banca Multiple, Grupo Financiero Santander Mexico",1698287,"=""BSMX""","PROLONGACION PASEO DE LA REFORMA NO. 500","PISO 2, MODULO 206",MEXICO,O5,MEXICO,Foreign,,,"=""6029""","Commercial Banks, NEC",522110,"Commercial Banking",34,6,12/29/21,"3,668,244,480",12/31/21,"-879,000,000","-3,579,000,000","7,531,000,000","82,004,000,000"
17550,"Accounts/loans receivable","Estimation of impairment of financial assets at amortised cost– loans and advances to customers",477116,12/31/21,03/01/22,1,"PricewaterhouseCoopers LLP",117,"PricewaterhouseCoopers Auditores SL",1306,Madrid,U3,SPAIN,Foreign,20-F,2022-03-01,,"Banco Santander, S.A.",891478,"=""SAN""","CIUDAD GRUPO SANTANDER","BOADILLA DEL MONTE",MADRID,U3,SPAIN,Foreign,,,"=""6029""","Commercial Banks, NEC",522110,"Commercial Banking",34,3,12/29/21,"57,050,710,016",12/31/21,"42,938,000,000","8,987,000,000","437,166,000,000","1,814,789,000,000"
17551,Goodwill,"Goodwill Impairment Assessment of Certain Cash Generating Units (CGUs)",477116,12/31/21,03/01/22,1,"PricewaterhouseCoopers LLP",117,"PricewaterhouseCoopers Auditores SL",1306,Madrid,U3,SPAIN,Foreign,20-F,2022-03-01,,"Banco Santander, S.A.",891478,"=""SAN""","CIUDAD GRUPO SANTANDER","BOADILLA DEL MONTE",MADRID,U3,SPAIN,Foreign,,,"=""6029""","Commercial Banks, NEC",522110,"Commercial Banking",34,3,12/29/21,"57,050,710,016",12/31/21,"42,938,000,000","8,987,000,000","437,166,000,000","1,814,789,000,000"
17552,"Other contingent liabilities","Provisions for contingent liabilities",477116,12/31/21,03/01/22,1,"PricewaterhouseCoopers LLP",117,"PricewaterhouseCoopers Auditores SL",1306,Madrid,U3,SPAIN,Foreign,20-F,2022-03-01,,"Banco Santander, S.A.",891478,"=""SAN""","CIUDAD GRUPO SANTANDER","BOADILLA DEL MONTE",MADRID,U3,SPAIN,Foreign,,,"=""6029""","Commercial Banks, NEC",522110,"Commercial Banking",34,3,12/29/21,"57,050,710,016",12/31/21,"42,938,000,000","8,987,000,000","437,166,000,000","1,814,789,000,000"
20061,"Accounts/loans receivable","Estimation of impairment of financial assets at amortised cost– loans and advances to customers",482977,12/31/21,03/01/22,1,"PricewaterhouseCoopers LLP",117,"PricewaterhouseCoopers Auditores SL",1306,Madrid,U3,SPAIN,Foreign,6-K,2022-04-08,,"Banco Santander, S.A.",891478,"=""SAN""","CIUDAD GRUPO SANTANDER","BOADILLA DEL MONTE",MADRID,U3,SPAIN,Foreign,,,"=""6029""","Commercial Banks, NEC",522110,"Commercial Banking",34,3,12/29/21,"57,050,710,016",12/31/21,"42,938,000,000","8,987,000,000","437,166,000,000","1,814,789,000,000"
20062,Goodwill,"Goodwill Impairment Assessment of Certain Cash Generating Units (CGUs)",482977,12/31/21,03/01/22,1,"PricewaterhouseCoopers LLP",117,"PricewaterhouseCoopers Auditores SL",1306,Madrid,U3,SPAIN,Foreign,6-K,2022-04-08,,"Banco Santander, S.A.",891478,"=""SAN""","CIUDAD GRUPO SANTANDER","BOADILLA DEL MONTE",MADRID,U3,SPAIN,Foreign,,,"=""6029""","Commercial Banks, NEC",522110,"Commercial Banking",34,3,12/29/21,"57,050,710,016",12/31/21,"42,938,000,000","8,987,000,000","437,166,000,000","1,814,789,000,000"
20063,"Other contingent liabilities","Provisions for contingent liabilities",482977,12/31/21,03/01/22,1,"PricewaterhouseCoopers LLP",117,"PricewaterhouseCoopers Auditores SL",1306,Madrid,U3,SPAIN,Foreign,6-K,2022-04-08,,"Banco Santander, S.A.",891478,"=""SAN""","CIUDAD GRUPO SANTANDER","BOADILLA DEL MONTE",MADRID,U3,SPAIN,Foreign,,,"=""6029""","Commercial Banks, NEC",522110,"Commercial Banking",34,3,12/29/21,"57,050,710,016",12/31/21,"42,938,000,000","8,987,000,000","437,166,000,000","1,814,789,000,000"
20592,"Allowance for credit losses","Allowance for loans, advances and lease losses",485021,12/31/21,04/26/22,1,"PricewaterhouseCoopers LLP",812,"PwC Contadores y Auditores Ltda",6466,Medellin,F8,COLOMBIA,Foreign,20-F,2022-04-27,,"BANCOLOMBIA SA",1071371,,"AVENIDA LOS INDUSTRIALES","CARRERA 48 # 26 -85",MEDELLIN,F8,COLOMBIA,Foreign,,,"=""6029""","Commercial Banks, NEC",522110,"Commercial Banking",34,32,12/29/21,"3,574,027,776",12/31/21,"3,722,000,000","1,034,000,000","5,800,000,000","71,217,000,000"
20593,Goodwill,"Goodwill Impairment Assessment",485021,12/31/21,04/26/22,1,"PricewaterhouseCoopers LLP",812,"PwC Contadores y Auditores Ltda",6466,Medellin,F8,COLOMBIA,Foreign,20-F,2022-04-27,,"BANCOLOMBIA SA",1071371,,"AVENIDA LOS INDUSTRIALES","CARRERA 48 # 26 -85",MEDELLIN,F8,COLOMBIA,Foreign,,,"=""6029""","Commercial Banks, NEC",522110,"Commercial Banking",34,32,12/29/21,"3,574,027,776",12/31/21,"3,722,000,000","1,034,000,000","5,800,000,000","71,217,000,000"
16677,"Revenue from customer contracts","Revenue Recognition",475584,12/31/21,02/25/22,2,"Ernst & Young LLP",,,,Raleigh,NC,"NORTH CAROLINA","US Southeast",10-K,2022-02-25,,"Bandwidth Inc.",1514416,"=""BAND""","2230 BANDMATE WAY",,RALEIGH,NC,"NORTH CAROLINA","US Southeast",,,"=""7372""","Prepackaged Software",511210,"Software Publishers",34,72,12/31/21,"1,663,252,480",12/31/21,"490,907,000","-27,362,000","-143,045,000","1,065,539,000"
20837,"Allowance for credit losses","Assessment of the allowance for expected credit losses on loans and advances to customers, loan commitments, financial guarantees, financial assets at fair value through other comprehensive income and securities at amortized cost",485636,12/31/21,04/28/22,4,"KPMG LLP",61,"KPMG Auditores Independentes",1124,"São Paulo",D5,BRAZIL,Foreign,20-F,2022-04-29,,"BANK BRADESCO",1160330,"=""BBD""","CIDADE DE DEUS S/N VILA YARA",OSASCO,"SAO PAULO",D5,BRAZIL,Foreign,,,"=""6022""","State Commercial Banks",522110,"Commercial Banking",34,3,12/31/21,"33,147,897,856",12/31/21,"16,663,261,000","4,197,631,000","24,212,896,000","300,820,861,000"
20838,"Other contingent liabilities","Evaluation of the measurement of provisions and the disclosure of contingent liabilities - tax, civil and labor lawsuits",485636,12/31/21,04/28/22,4,"KPMG LLP",61,"KPMG Auditores Independentes",1124,"São Paulo",D5,BRAZIL,Foreign,20-F,2022-04-29,,"BANK BRADESCO",1160330,"=""BBD""","CIDADE DE DEUS S/N VILA YARA",OSASCO,"SAO PAULO",D5,BRAZIL,Foreign,,,"=""6022""","State Commercial Banks",522110,"Commercial Banking",34,3,12/31/21,"33,147,897,856",12/31/21,"16,663,261,000","4,197,631,000","24,212,896,000","300,820,861,000"
20839,"Deferred income taxes","Assessment of the recoverability of deferred tax assets",485636,12/31/21,04/28/22,4,"KPMG LLP",61,"KPMG Auditores Independentes",1124,"São Paulo",D5,BRAZIL,Foreign,20-F,2022-04-29,,"BANK BRADESCO",1160330,"=""BBD""","CIDADE DE DEUS S/N VILA YARA",OSASCO,"SAO PAULO",D5,BRAZIL,Foreign,,,"=""6022""","State Commercial Banks",522110,"Commercial Banking",34,3,12/31/21,"33,147,897,856",12/31/21,"16,663,261,000","4,197,631,000","24,212,896,000","300,820,861,000"
20840,"Goodwill and intangible assets","Evaluation of the impairment testing of goodwill and intangible assets",485636,12/31/21,04/28/22,4,"KPMG LLP",61,"KPMG Auditores Independentes",1124,"São Paulo",D5,BRAZIL,Foreign,20-F,2022-04-29,,"BANK BRADESCO",1160330,"=""BBD""","CIDADE DE DEUS S/N VILA YARA",OSASCO,"SAO PAULO",D5,BRAZIL,Foreign,,,"=""6022""","State Commercial Banks",522110,"Commercial Banking",34,3,12/31/21,"33,147,897,856",12/31/21,"16,663,261,000","4,197,631,000","24,212,896,000","300,820,861,000"
20841,"Insurance contract liabilities","Evaluation of the measurement of insurance and pension plan technical provisions",485636,12/31/21,04/28/22,4,"KPMG LLP",61,"KPMG Auditores Independentes",1124,"São Paulo",D5,BRAZIL,Foreign,20-F,2022-04-29,,"BANK BRADESCO",1160330,"=""BBD""","CIDADE DE DEUS S/N VILA YARA",OSASCO,"SAO PAULO",D5,BRAZIL,Foreign,,,"=""6022""","State Commercial Banks",522110,"Commercial Banking",34,3,12/31/21,"33,147,897,856",12/31/21,"16,663,261,000","4,197,631,000","24,212,896,000","300,820,861,000"
15443,"Allowance for credit losses","Allowance for Loan and Lease Losses - Commercial and Consumer Card Loans",474617,12/31/21,02/22/22,1,"PricewaterhouseCoopers LLP",,,,Charlotte,NC,"NORTH CAROLINA","US Southeast",10-K,2022-02-22,,"BANK OF AMERICA CORP /DE/",70858,"=""BAC""","BANK OF AMERICA CORPORATE CENTER","100 N TRYON ST",CHARLOTTE,NC,"NORTH CAROLINA","US Southeast",,,"=""6021""","National Commercial Banks",522110,"Commercial Banking",34,44,12/31/21,"359,382,712,320",12/31/21,"93,707,000,000","31,978,000,000","201,044,000,000","3,169,495,000,000"
15444,"Other investments","Valuation of Certain Level 3 Financial Instruments",474617,12/31/21,02/22/22,1,"PricewaterhouseCoopers LLP",,,,Charlotte,NC,"NORTH CAROLINA","US Southeast",10-K,2022-02-22,,"BANK OF AMERICA CORP /DE/",70858,"=""BAC""","BANK OF AMERICA CORPORATE CENTER","100 N TRYON ST",CHARLOTTE,NC,"NORTH CAROLINA","US Southeast",,,"=""6021""","National Commercial Banks",522110,"Commercial Banking",34,44,12/31/21,"359,382,712,320",12/31/21,"93,707,000,000","31,978,000,000","201,044,000,000","3,169,495,000,000"
20762,"Allowance for credit losses","Allowance for loan losses",485821,12/31/21,04/28/22,2,"Ernst & Young LLP",636,"EY Servicios Profesionales de Auditoría y Asesorías SpA (EY Audit SpA)",1431,Santiago,F3,CHILE,Foreign,20-F,2022-04-29,,"BANK OF CHILE",1161125,"=""BCH""","PASEO AHUMADA 251",,SANTIAGO,F3,CHILE,Foreign,,,"=""6029""","Commercial Banks, NEC",522110,"Commercial Banking",34,16,12/31/21,"7,934,891,713",12/31/21,"2,606,923,375","934,407,999",,"60,956,677,632"
17525,"Allowance for credit losses","Allowance for Credit Losses – Loans and Leases",476640,12/31/21,02/28/22,2,"Ernst & Young LLP",,,,Honolulu,HI,HAWAII,"US West",10-K,2022-03-01,,"BANK OF HAWAII CORP",46195,"=""BOH""","130 MERCHANT STREET",,HONOLULU,HI,HAWAII,"US West",,,"=""6022""","State Commercial Banks",522110,"Commercial Banking",34,84,12/31/21,"3,371,607,552",12/31/21,"719,143,000","253,372,000","1,580,094,000","22,784,941,000"
13790,"Allowance for credit losses","Assessment of the Allowances for Credit Losses for Loans",468717,10/31/21,12/03/21,4,"KPMG LLP",187,"KPMG LLP Chartered Accountants",85,Toronto,A6,ONTARIO,Canada,40-F,2021-12-03,,"BANK OF MONTREAL /CAN/",927971,"=""BMO""","FIRST CANADIAN PLACE",*,TORONTO,A6,ONTARIO,Canada,,,"=""6029""","Commercial Banks, NEC",521110,"Monetary Authorities - Central Bank",34,110,11/02/21,"71,210,147,840",10/31/21,"20,788,000,000","6,255,000,000","40,240,000,000","797,205,000,000"
13791,"Other investments","Assessment of the Measurement of the Fair Value of Certain Securities",468717,10/31/21,12/03/21,4,"KPMG LLP",187,"KPMG LLP Chartered Accountants",85,Toronto,A6,ONTARIO,Canada,40-F,2021-12-03,,"BANK OF MONTREAL /CAN/",927971,"=""BMO""","FIRST CANADIAN PLACE",*,TORONTO,A6,ONTARIO,Canada,,,"=""6029""","Commercial Banks, NEC",521110,"Monetary Authorities - Central Bank",34,110,11/02/21,"71,210,147,840",10/31/21,"20,788,000,000","6,255,000,000","40,240,000,000","797,205,000,000"
13792,"Uncertain tax positions","Assessment of Income Tax Uncertainties",468717,10/31/21,12/03/21,4,"KPMG LLP",187,"KPMG LLP Chartered Accountants",85,Toronto,A6,ONTARIO,Canada,40-F,2021-12-03,,"BANK OF MONTREAL /CAN/",927971,"=""BMO""","FIRST CANADIAN PLACE",*,TORONTO,A6,ONTARIO,Canada,,,"=""6029""","Commercial Banks, NEC",521110,"Monetary Authorities - Central Bank",34,110,11/02/21,"71,210,147,840",10/31/21,"20,788,000,000","6,255,000,000","40,240,000,000","797,205,000,000"
13793,"Insurance contract liabilities","Assessment of Insurance-Related Liabilities",468717,10/31/21,12/03/21,4,"KPMG LLP",187,"KPMG LLP Chartered Accountants",85,Toronto,A6,ONTARIO,Canada,40-F,2021-12-03,,"BANK OF MONTREAL /CAN/",927971,"=""BMO""","FIRST CANADIAN PLACE",*,TORONTO,A6,ONTARIO,Canada,,,"=""6029""","Commercial Banks, NEC",521110,"Monetary Authorities - Central Bank",34,110,11/02/21,"71,210,147,840",10/31/21,"20,788,000,000","6,255,000,000","40,240,000,000","797,205,000,000"
13796,"Allowance for credit losses","Assessment of the Allowances for Credit Losses for Loans",468746,10/31/21,12/03/21,4,"KPMG LLP",187,"KPMG LLP Chartered Accountants",85,Toronto,A6,ONTARIO,Canada,6-K,2021-12-06,,"BANK OF MONTREAL /CAN/",927971,"=""BMO""","FIRST CANADIAN PLACE",*,TORONTO,A6,ONTARIO,Canada,,,"=""6029""","Commercial Banks, NEC",521110,"Monetary Authorities - Central Bank",34,110,11/02/21,"71,210,147,840",10/31/21,"20,788,000,000","6,255,000,000","40,240,000,000","797,205,000,000"
13797,"Other investments","Assessment of the Measurement of the Fair Value of Certain Securities",468746,10/31/21,12/03/21,4,"KPMG LLP",187,"KPMG LLP Chartered Accountants",85,Toronto,A6,ONTARIO,Canada,6-K,2021-12-06,,"BANK OF MONTREAL /CAN/",927971,"=""BMO""","FIRST CANADIAN PLACE",*,TORONTO,A6,ONTARIO,Canada,,,"=""6029""","Commercial Banks, NEC",521110,"Monetary Authorities - Central Bank",34,110,11/02/21,"71,210,147,840",10/31/21,"20,788,000,000","6,255,000,000","40,240,000,000","797,205,000,000"
13798,"Uncertain tax positions","Assessment of Income Tax Uncertainties",468746,10/31/21,12/03/21,4,"KPMG LLP",187,"KPMG LLP Chartered Accountants",85,Toronto,A6,ONTARIO,Canada,6-K,2021-12-06,,"BANK OF MONTREAL /CAN/",927971,"=""BMO""","FIRST CANADIAN PLACE",*,TORONTO,A6,ONTARIO,Canada,,,"=""6029""","Commercial Banks, NEC",521110,"Monetary Authorities - Central Bank",34,110,11/02/21,"71,210,147,840",10/31/21,"20,788,000,000","6,255,000,000","40,240,000,000","797,205,000,000"
13799,"Insurance contract liabilities","Assessment of Insurance-Related Liabilities",468746,10/31/21,12/03/21,4,"KPMG LLP",187,"KPMG LLP Chartered Accountants",85,Toronto,A6,ONTARIO,Canada,6-K,2021-12-06,,"BANK OF MONTREAL /CAN/",927971,"=""BMO""","FIRST CANADIAN PLACE",*,TORONTO,A6,ONTARIO,Canada,,,"=""6029""","Commercial Banks, NEC",521110,"Monetary Authorities - Central Bank",34,110,11/02/21,"71,210,147,840",10/31/21,"20,788,000,000","6,255,000,000","40,240,000,000","797,205,000,000"
15883,"Allowance for credit losses","Allowance for Credit Losses",474900,12/31/21,02/23/22,1,"PricewaterhouseCoopers LLP",90,"PricewaterhouseCoopers Ltd",1403,Hamilton,D0,BERMUDA,Foreign,20-F,2022-02-23,,"Bank of N.T. Butterfield & Son Ltd",1653242,"=""NTB""","65 FRONT STREET",,HAMILTON,D0,BERMUDA,Foreign,,,"=""6029""","Commercial Banks, NEC",522110,"Commercial Banking",34,38,12/29/21,"1,909,417,984",12/31/21,"499,681,000","162,668,000","891,387,000","15,335,200,000"
16201,"Allowance for credit losses","Quantitative component of BNY Mellon’s pooled allowance for credit losses for loans and lending-related commitments related to higher risk-rated and pass-rated commercial and institutional credits and loans secured by commercial real estate",475632,12/31/21,02/25/22,4,"KPMG LLP",,,,"New York",NY,"NEW YORK","US Mid Atlantic",10-K,2022-02-25,,"Bank of New York Mellon Corp",1390777,"=""BK""","240 GREENWICH STREET",,"NEW YORK",NY,"NEW YORK","US Mid Atlantic",,,"=""6022""","State Commercial Banks",522110,"Commercial Banking",34,58,12/31/21,"46,704,762,880",12/31/21,"16,162,000,000","3,759,000,000","22,692,000,000","444,438,000,000"
16202,"Other contingent liabilities","Identification and measurement of accruals for litigation and regulatory contingencies",475632,12/31/21,02/25/22,4,"KPMG LLP",,,,"New York",NY,"NEW YORK","US Mid Atlantic",10-K,2022-02-25,,"Bank of New York Mellon Corp",1390777,"=""BK""","240 GREENWICH STREET",,"NEW YORK",NY,"NEW YORK","US Mid Atlantic",,,"=""6022""","State Commercial Banks",522110,"Commercial Banking",34,58,12/31/21,"46,704,762,880",12/31/21,"16,162,000,000","3,759,000,000","22,692,000,000","444,438,000,000"
13747,"Allowance for credit losses","(i) Assessment of Allowance for Credit Losses on Financial Assets (ACL)",468452,10/31/21,11/30/21,4,"KPMG LLP",187,"KPMG LLP Chartered Accountants",85,Toronto,A6,ONTARIO,Canada,6-K,2021-11-30,,"BANK OF NOVA SCOTIA",9631,"=""BNS""","40 TEMPERANCE STREET",,TORONTO,A6,ONTARIO,Canada,,,"=""6022""","State Commercial Banks",522110,"Commercial Banking",34,66,11/02/21,"80,284,729,344",10/31/21,"23,754,000,000","7,764,000,000","43,724,000,000","955,866,000,000"
13748,"Other investments","(ii) Assessment of the Measurement of Fair Value of Certain Financial Instruments",468452,10/31/21,11/30/21,4,"KPMG LLP",187,"KPMG LLP Chartered Accountants",85,Toronto,A6,ONTARIO,Canada,6-K,2021-11-30,,"BANK OF NOVA SCOTIA",9631,"=""BNS""","40 TEMPERANCE STREET",,TORONTO,A6,ONTARIO,Canada,,,"=""6022""","State Commercial Banks",522110,"Commercial Banking",34,66,11/02/21,"80,284,729,344",10/31/21,"23,754,000,000","7,764,000,000","43,724,000,000","955,866,000,000"
13749,"Uncertain tax positions","(iii) Assessment of Uncertain Tax Provisions",468452,10/31/21,11/30/21,4,"KPMG LLP",187,"KPMG LLP Chartered Accountants",85,Toronto,A6,ONTARIO,Canada,6-K,2021-11-30,,"BANK OF NOVA SCOTIA",9631,"=""BNS""","40 TEMPERANCE STREET",,TORONTO,A6,ONTARIO,Canada,,,"=""6022""","State Commercial Banks",522110,"Commercial Banking",34,66,11/02/21,"80,284,729,344",10/31/21,"23,754,000,000","7,764,000,000","43,724,000,000","955,866,000,000"
13750,"Allowance for credit losses","(i) Assessment of Allowance for Credit Losses on Financial Assets (ACL)",468453,10/31/21,11/30/21,4,"KPMG LLP",187,"KPMG LLP Chartered Accountants",85,Toronto,A6,ONTARIO,Canada,6-K,2021-11-30,,"BANK OF NOVA SCOTIA",9631,"=""BNS""","40 TEMPERANCE STREET",,TORONTO,A6,ONTARIO,Canada,,,"=""6022""","State Commercial Banks",522110,"Commercial Banking",34,66,11/02/21,"80,284,729,344",10/31/21,"23,754,000,000","7,764,000,000","43,724,000,000","955,866,000,000"
13751,"Other investments","(ii) Assessment of the Measurement of Fair Value of Certain Financial Instruments",468453,10/31/21,11/30/21,4,"KPMG LLP",187,"KPMG LLP Chartered Accountants",85,Toronto,A6,ONTARIO,Canada,6-K,2021-11-30,,"BANK OF NOVA SCOTIA",9631,"=""BNS""","40 TEMPERANCE STREET",,TORONTO,A6,ONTARIO,Canada,,,"=""6022""","State Commercial Banks",522110,"Commercial Banking",34,66,11/02/21,"80,284,729,344",10/31/21,"23,754,000,000","7,764,000,000","43,724,000,000","955,866,000,000"
13752,"Uncertain tax positions","(iii) Assessment of Uncertain Tax Provisions",468453,10/31/21,11/30/21,4,"KPMG LLP",187,"KPMG LLP Chartered Accountants",85,Toronto,A6,ONTARIO,Canada,6-K,2021-11-30,,"BANK OF NOVA SCOTIA",9631,"=""BNS""","40 TEMPERANCE STREET",,TORONTO,A6,ONTARIO,Canada,,,"=""6022""","State Commercial Banks",522110,"Commercial Banking",34,66,11/02/21,"80,284,729,344",10/31/21,"23,754,000,000","7,764,000,000","43,724,000,000","955,866,000,000"
13758,"Allowance for credit losses","(i) Assessment of Allowance for Credit Losses on Financial Assets (ACL)",468467,10/31/21,11/30/21,4,"KPMG LLP",187,"KPMG LLP Chartered Accountants",85,Toronto,A6,ONTARIO,Canada,40-F,2021-11-30,,"BANK OF NOVA SCOTIA",9631,"=""BNS""","40 TEMPERANCE STREET",,TORONTO,A6,ONTARIO,Canada,,,"=""6022""","State Commercial Banks",522110,"Commercial Banking",34,66,11/02/21,"80,284,729,344",10/31/21,"23,754,000,000","7,764,000,000","43,724,000,000","955,866,000,000"
13759,"Other investments","(ii) Assessment of the Measurement of Fair Value of Certain Financial Instruments",468467,10/31/21,11/30/21,4,"KPMG LLP",187,"KPMG LLP Chartered Accountants",85,Toronto,A6,ONTARIO,Canada,40-F,2021-11-30,,"BANK OF NOVA SCOTIA",9631,"=""BNS""","40 TEMPERANCE STREET",,TORONTO,A6,ONTARIO,Canada,,,"=""6022""","State Commercial Banks",522110,"Commercial Banking",34,66,11/02/21,"80,284,729,344",10/31/21,"23,754,000,000","7,764,000,000","43,724,000,000","955,866,000,000"
13760,"Uncertain tax positions","(iii) Assessment of Uncertain Tax Provisions",468467,10/31/21,11/30/21,4,"KPMG LLP",187,"KPMG LLP Chartered Accountants",85,Toronto,A6,ONTARIO,Canada,40-F,2021-11-30,,"BANK OF NOVA SCOTIA",9631,"=""BNS""","40 TEMPERANCE STREET",,TORONTO,A6,ONTARIO,Canada,,,"=""6022""","State Commercial Banks",522110,"Commercial Banking",34,66,11/02/21,"80,284,729,344",10/31/21,"23,754,000,000","7,764,000,000","43,724,000,000","955,866,000,000"
16178,"Allowance for credit losses","Allowance for Credit Losses — Refer to Notes 1 and 4 to the financial statements",475370,12/31/21,02/24/22,3,"Deloitte & Touche LLP",,,,Miami,FL,FLORIDA,"US Southeast",10-K,2022-02-24,,"BankUnited, Inc.",1504008,"=""BKU""","14817 OAK LANE",,"MIAMI LAKES",FL,FLORIDA,"US Southeast",,,"=""6035""","Savings Institutions, Federally Chartered",522110,"Commercial Banking",34,42,12/31/21,"3,623,766,272",12/31/21,"996,960,000","414,984,000","2,960,124,000","35,815,396,000"
20824,"Business combinations","Purchase Price Allocation from Business Combination — refer to Notes 2(af) and 9 to the financial statements",485584,12/31/21,04/29/22,3,"Deloitte & Touche LLP",499,"Deloitte Touche Tohmatsu Certified Public Accountants LLP",1113,Shanghai,F4,CHINA,Foreign,20-F,2022-04-29,,"Baozun Inc.",1625414,"=""BZUN""","NO. 1-9, LANE 510, WEST JIANGCHANG ROAD","JING'AN DISTRICT",SHANGHAI,F4,CHINA,Foreign,,,"=""5961""","Catalog and Mail-Order Houses",454111,"Electronic Shopping",34,14,12/31/21,"967,414,464",12/31/21,"1,474,304,000","-34,492,000","860,522,000","1,932,889,000"
15430,"Allowance for credit losses","Impairment allowance for loans and advances at amortized cost, including off-balance sheet elements of the allowance",474587,12/31/21,02/22/22,4,"KPMG LLP",87,"KPMG LLP",1118,London,X0,"UNITED KINGDOM",Foreign,20-F,2022-02-23,,"BARCLAYS BANK PLC",312070,"=""DJP""","1 CHURCHILL PLACE",*,LONDON,X0,"UNITED KINGDOM",Foreign,312069,"BARCLAYS PLC","=""6029""","Commercial Banks, NEC",522110,"Commercial Banking",34,,,,12/31/21,"23,929,000,000","6,214,000,000","74,316,000,000","1,438,139,000,000"
15431,"Other investments","Valuation of certain difficult-to-value financial instruments recorded at fair value",474587,12/31/21,02/22/22,4,"KPMG LLP",87,"KPMG LLP",1118,London,X0,"UNITED KINGDOM",Foreign,20-F,2022-02-23,,"BARCLAYS BANK PLC",312070,"=""DJP""","1 CHURCHILL PLACE",*,LONDON,X0,"UNITED KINGDOM",Foreign,312069,"BARCLAYS PLC","=""6029""","Commercial Banks, NEC",522110,"Commercial Banking",34,,,,12/31/21,"23,929,000,000","6,214,000,000","74,316,000,000","1,438,139,000,000"
15432,"Pension and other post-employment benefits","UK Pension Scheme – Defined Benefit Obligation (‘DBO’) assumptions",474587,12/31/21,02/22/22,4,"KPMG LLP",87,"KPMG LLP",1118,London,X0,"UNITED KINGDOM",Foreign,20-F,2022-02-23,,"BARCLAYS BANK PLC",312070,"=""DJP""","1 CHURCHILL PLACE",*,LONDON,X0,"UNITED KINGDOM",Foreign,312069,"BARCLAYS PLC","=""6029""","Commercial Banks, NEC",522110,"Commercial Banking",34,,,,12/31/21,"23,929,000,000","6,214,000,000","74,316,000,000","1,438,139,000,000"
21246,"Allowance for credit losses","Impairment allowance for loans and advances at amortized cost, including off-balance sheet elements of the allowance",487287,12/31/21,05/22/22,4,"KPMG LLP",87,"KPMG LLP",1118,London,X0,"UNITED KINGDOM",Foreign,20-F/A,2022-05-23,,"BARCLAYS BANK PLC",312070,"=""DJP""","1 CHURCHILL PLACE",*,LONDON,X0,"UNITED KINGDOM",Foreign,312069,"BARCLAYS PLC","=""6029""","Commercial Banks, NEC",522110,"Commercial Banking",34,,,,12/31/21,"23,929,000,000","6,214,000,000","74,316,000,000","1,438,139,000,000"
21247,"Other investments","Valuation of certain difficult-to-value financial instruments recorded at fair value",487287,12/31/21,05/22/22,4,"KPMG LLP",87,"KPMG LLP",1118,London,X0,"UNITED KINGDOM",Foreign,20-F/A,2022-05-23,,"BARCLAYS BANK PLC",312070,"=""DJP""","1 CHURCHILL PLACE",*,LONDON,X0,"UNITED KINGDOM",Foreign,312069,"BARCLAYS PLC","=""6029""","Commercial Banks, NEC",522110,"Commercial Banking",34,,,,12/31/21,"23,929,000,000","6,214,000,000","74,316,000,000","1,438,139,000,000"
21248,"Pension and other post-employment benefits","UK Pension Scheme – Defined Benefit Obligation (‘DBO’) assumptions",487287,12/31/21,05/22/22,4,"KPMG LLP",87,"KPMG LLP",1118,London,X0,"UNITED KINGDOM",Foreign,20-F/A,2022-05-23,,"BARCLAYS BANK PLC",312070,"=""DJP""","1 CHURCHILL PLACE",*,LONDON,X0,"UNITED KINGDOM",Foreign,312069,"BARCLAYS PLC","=""6029""","Commercial Banks, NEC",522110,"Commercial Banking",34,,,,12/31/21,"23,929,000,000","6,214,000,000","74,316,000,000","1,438,139,000,000"
15438,"Allowance for credit losses","Impairment allowance for loans and advances at amortized cost, including off-balance sheet elements of the allowance",474584,12/31/21,02/22/22,4,"KPMG LLP",87,"KPMG LLP",1118,London,X0,"UNITED KINGDOM",Foreign,20-F,2022-02-23,,"BARCLAYS PLC",312069,"=""BCS""","1 CHURCHILL PLACE","CANARY WHARF",LONDON,X0,"UNITED KINGDOM",Foreign,,,"=""6029""","Commercial Banks, NEC",521110,"Monetary Authorities - Central Bank",34,10,12/29/21,"44,416,798,720",12/31/21,"33,589,000,000","9,557,000,000","82,841,000,000","1,874,963,000,000"
15439,"Other investments","Valuation of certain difficult-to-value financial instruments recorded at fair value",474584,12/31/21,02/22/22,4,"KPMG LLP",87,"KPMG LLP",1118,London,X0,"UNITED KINGDOM",Foreign,20-F,2022-02-23,,"BARCLAYS PLC",312069,"=""BCS""","1 CHURCHILL PLACE","CANARY WHARF",LONDON,X0,"UNITED KINGDOM",Foreign,,,"=""6029""","Commercial Banks, NEC",521110,"Monetary Authorities - Central Bank",34,10,12/29/21,"44,416,798,720",12/31/21,"33,589,000,000","9,557,000,000","82,841,000,000","1,874,963,000,000"
15440,"Pension and other post-employment benefits","UK Pension Scheme – Defined Benefit Obligation (‘DBO’) assumptions",474584,12/31/21,02/22/22,4,"KPMG LLP",87,"KPMG LLP",1118,London,X0,"UNITED KINGDOM",Foreign,20-F,2022-02-23,,"BARCLAYS PLC",312069,"=""BCS""","1 CHURCHILL PLACE","CANARY WHARF",LONDON,X0,"UNITED KINGDOM",Foreign,,,"=""6029""","Commercial Banks, NEC",521110,"Monetary Authorities - Central Bank",34,10,12/29/21,"44,416,798,720",12/31/21,"33,589,000,000","9,557,000,000","82,841,000,000","1,874,963,000,000"
21243,"Allowance for credit losses","Impairment allowance for loans and advances at amortized cost, including off-balance sheet elements of the allowance",487286,12/31/21,05/22/22,4,"KPMG LLP",87,"KPMG LLP",1118,London,X0,"UNITED KINGDOM",Foreign,20-F/A,2022-05-23,,"BARCLAYS PLC",312069,"=""BCS""","1 CHURCHILL PLACE","CANARY WHARF",LONDON,X0,"UNITED KINGDOM",Foreign,,,"=""6029""","Commercial Banks, NEC",521110,"Monetary Authorities - Central Bank",34,10,12/29/21,"44,416,798,720",12/31/21,"33,589,000,000","9,557,000,000","82,841,000,000","1,874,963,000,000"
21244,"Other investments","Valuation of certain difficult-to-value financial instruments recorded at fair value",487286,12/31/21,05/22/22,4,"KPMG LLP",87,"KPMG LLP",1118,London,X0,"UNITED KINGDOM",Foreign,20-F/A,2022-05-23,,"BARCLAYS PLC",312069,"=""BCS""","1 CHURCHILL PLACE","CANARY WHARF",LONDON,X0,"UNITED KINGDOM",Foreign,,,"=""6029""","Commercial Banks, NEC",521110,"Monetary Authorities - Central Bank",34,10,12/29/21,"44,416,798,720",12/31/21,"33,589,000,000","9,557,000,000","82,841,000,000","1,874,963,000,000"
21245,"Pension and other post-employment benefits","UK Pension Scheme – Defined Benefit Obligation (‘DBO’) assumptions",487286,12/31/21,05/22/22,4,"KPMG LLP",87,"KPMG LLP",1118,London,X0,"UNITED KINGDOM",Foreign,20-F/A,2022-05-23,,"BARCLAYS PLC",312069,"=""BCS""","1 CHURCHILL PLACE","CANARY WHARF",LONDON,X0,"UNITED KINGDOM",Foreign,,,"=""6029""","Commercial Banks, NEC",521110,"Monetary Authorities - Central Bank",34,10,12/29/21,"44,416,798,720",12/31/21,"33,589,000,000","9,557,000,000","82,841,000,000","1,874,963,000,000"
15662,"Other investments","Assessment of the fair value of investments",474859,12/31/21,02/23/22,4,"KPMG LLP",,,,Charlotte,NC,"NORTH CAROLINA","US Southeast",10-K,2022-02-23,,"Barings BDC, Inc.",1379785,"=""BBDC""","300 SOUTH TRYON STREET","SUITE 2500",CHARLOTTE,NC,"NORTH CAROLINA","US Southeast",,,,,525990,"Other Financial Vehicles",34,11,12/31/21,"719,783,232",12/31/21,"102,321,709","77,685,429",,"2,160,906,341"
12264,Inventory,"Non-Returnable Inventory Reserve",459385,05/01/21,06/30/21,2,"Ernst & Young LLP",,,,Iselin,NJ,"NEW JERSEY","US Mid Atlantic",10-K,2021-06-30,,"Barnes & Noble Education, Inc.",1634117,"=""BNED""","120 MOUNTAIN VIEW BOULEVARD",,"BASKING RIDGE",NJ,"NEW JERSEY","US Mid Atlantic",,,"=""5940""","Retail-Miscellaneous Shopping Goods Stores",451211,"Book Stores",34,8,05/03/21,"407,434,784",05/01/21,"1,433,890,000","-131,787,000","145,430,000","1,038,418,000"
12265,"Long-lived assets","Long-Lived Asset Impairment",459385,05/01/21,06/30/21,2,"Ernst & Young LLP",,,,Iselin,NJ,"NEW JERSEY","US Mid Atlantic",10-K,2021-06-30,,"Barnes & Noble Education, Inc.",1634117,"=""BNED""","120 MOUNTAIN VIEW BOULEVARD",,"BASKING RIDGE",NJ,"NEW JERSEY","US Mid Atlantic",,,"=""5940""","Retail-Miscellaneous Shopping Goods Stores",451211,"Book Stores",34,8,05/03/21,"407,434,784",05/01/21,"1,433,890,000","-131,787,000","145,430,000","1,038,418,000"
15411,Goodwill,"Quantitative Goodwill Impairment Assessment",474486,12/31/21,02/22/22,1,"PricewaterhouseCoopers LLP",,,,Hartford,CT,CONNECTICUT,"US New England",10-K,2022-02-22,,"BARNES GROUP INC",9984,,"123 MAIN ST",,BRISTOL,CT,CONNECTICUT,"US New England",,,"=""3490""","Miscellaneous Fabricated Metal Products",334511,"Search, Detection, Navigation, Guidance, Aeronautical, and Nautical System and Instrument Manufacturing",34,47,12/31/21,"2,361,418,752",12/31/21,"1,258,846,000","99,873,000","-26,850,000","2,576,820,000"
17849,"Other contingent liabilities","Workers' Compensation Claims Liabilities",477955,12/31/21,03/07/22,3,"Deloitte & Touche LLP",,,,Portland,OR,OREGON,"US West",10-K,2022-03-07,,"BARRETT BUSINESS SERVICES INC",902791,"=""BBSI""","8100 NE PARKWAY DRIVE","SUITE 200",VANCOUVER,WA,WASHINGTON,"US West",,,"=""7363""","Help Supply Services",561310,"Employment Placement Agencies",34,69,12/31/21,"512,228,192",12/31/21,"955,166,000","38,079,000","160,710,000","746,952,000"
15029,"Long-lived assets","Impairment (impairment reversal) assessments for goodwill and other non-current assets",473969,12/31/21,02/15/22,1,"PricewaterhouseCoopers LLP",191,"PricewaterhouseCoopers LLP Chartered Accountants",271,Toronto,A6,ONTARIO,Canada,6-K,2022-02-17,,"BARRICK MINING CORP",756894,"=""B""","BROOKFIELD PLACE, TD CANADA TRUST TOWER","161 BAY STREET SUITE 3700",TORONTO,A6,ONTARIO,Canada,,,"=""1040""","Metal Mining",212221,"Gold Ore Mining",34,19,12/31/21,"33,807,290,368",12/31/21,"11,985,000,000","3,288,000,000","18,938,000,000","46,890,000,000"
15030,"Uncertain tax positions","Uncertain tax positions",473969,12/31/21,02/15/22,1,"PricewaterhouseCoopers LLP",191,"PricewaterhouseCoopers LLP Chartered Accountants",271,Toronto,A6,ONTARIO,Canada,6-K,2022-02-17,,"BARRICK MINING CORP",756894,"=""B""","BROOKFIELD PLACE, TD CANADA TRUST TOWER","161 BAY STREET SUITE 3700",TORONTO,A6,ONTARIO,Canada,,,"=""1040""","Metal Mining",212221,"Gold Ore Mining",34,19,12/31/21,"33,807,290,368",12/31/21,"11,985,000,000","3,288,000,000","18,938,000,000","46,890,000,000"
18821,"Long-lived assets","Impairment (impairment reversal) assessments for goodwill and other non-current assets",479990,12/31/21,02/15/22,1,"PricewaterhouseCoopers LLP",191,"PricewaterhouseCoopers LLP Chartered Accountants",271,Toronto,A6,ONTARIO,Canada,40-F,2022-03-18,,"BARRICK MINING CORP",756894,"=""B""","BROOKFIELD PLACE, TD CANADA TRUST TOWER","161 BAY STREET SUITE 3700",TORONTO,A6,ONTARIO,Canada,,,"=""1040""","Metal Mining",212221,"Gold Ore Mining",34,19,12/31/21,"33,807,290,368",12/31/21,"11,985,000,000","3,288,000,000","18,938,000,000","46,890,000,000"
18822,"Uncertain tax positions","Uncertain tax positions",479990,12/31/21,02/15/22,1,"PricewaterhouseCoopers LLP",191,"PricewaterhouseCoopers LLP Chartered Accountants",271,Toronto,A6,ONTARIO,Canada,40-F,2022-03-18,,"BARRICK MINING CORP",756894,"=""B""","BROOKFIELD PLACE, TD CANADA TRUST TOWER","161 BAY STREET SUITE 3700",TORONTO,A6,ONTARIO,Canada,,,"=""1040""","Metal Mining",212221,"Gold Ore Mining",34,19,12/31/21,"33,807,290,368",12/31/21,"11,985,000,000","3,288,000,000","18,938,000,000","46,890,000,000"
18831,Goodwill,"Impairment (impairment reversal) assessments for goodwill and other non-current assets",480020,12/31/21,02/15/22,1,"PricewaterhouseCoopers LLP",191,"PricewaterhouseCoopers LLP Chartered Accountants",271,Toronto,A6,ONTARIO,Canada,6-K,2022-03-18,,"BARRICK MINING CORP",756894,"=""B""","BROOKFIELD PLACE, TD CANADA TRUST TOWER","161 BAY STREET SUITE 3700",TORONTO,A6,ONTARIO,Canada,,,"=""1040""","Metal Mining",212221,"Gold Ore Mining",34,19,12/31/21,"33,807,290,368",12/31/21,"11,985,000,000","3,288,000,000","18,938,000,000","46,890,000,000"
18832,"Uncertain tax positions","Uncertain tax positions",480020,12/31/21,02/15/22,1,"PricewaterhouseCoopers LLP",191,"PricewaterhouseCoopers LLP Chartered Accountants",271,Toronto,A6,ONTARIO,Canada,6-K,2022-03-18,,"BARRICK MINING CORP",756894,"=""B""","BROOKFIELD PLACE, TD CANADA TRUST TOWER","161 BAY STREET SUITE 3700",TORONTO,A6,ONTARIO,Canada,,,"=""1040""","Metal Mining",212221,"Gold Ore Mining",34,19,12/31/21,"33,807,290,368",12/31/21,"11,985,000,000","3,288,000,000","18,938,000,000","46,890,000,000"
14207,Inventory,"Measurement of Reserves for Excess and Obsolete Inventories",472270,11/27/21,01/31/22,2,"Ernst & Young LLP",,,,Richmond,VA,VIRGINIA,"US Mid Atlantic",10-K,2022-01-31,,"BASSETT FURNITURE INDUSTRIES INC",10329,"=""BSET""","PO BOX 626",,BASSETT,VA,VIRGINIA,"US Mid Atlantic",,,"=""2511""","Wood Household Furniture, Except Upholstered",337122,"Nonupholstered Wood Household Furniture Manufacturing",34,15,11/30/21,"148,874,160",11/27/21,"430,886,000","18,042,000","139,284,000","421,660,000"
9666,"Long-lived assets","Impairment of Store Assets",449594,01/30/21,03/19/21,2,"Ernst & Young LLP",,,,"Grandview Heights",OH,OHIO,"US Midwest",10-K,2021-03-19,,"Bath & Body Works, Inc.",701985,"=""BBWI""","THREE LIMITED PKWY","P O BOX 16000",COLUMBUS,OH,OHIO,"US Midwest",,,"=""5990""","Retail-Retail Stores, NEC",448120,"Women's Clothing Stores",34,41,01/31/21,"11,331,279,872",01/30/21,"11,847,000,000","844,000,000","-1,701,000,000","11,571,000,000"
17864,"Proven and unproven reserves","Proved Oil and Natural Gas Property and Depletion — Oil and Natural Gas Reserve Quantities — Refer to Note 1 and 5 to the financial statements",478040,12/31/21,03/07/22,3,"Deloitte & Touche LLP",,,,Houston,TX,TEXAS,"US Southwest",10-K,2022-03-07,,"BATTALION OIL CORP",1282648,"=""BATL""","820 GESSNER ROAD","SUITE 1100",HOUSTON,TX,TEXAS,"US Southwest",,,"=""1311""","Crude Petroleum and Natural Gas",211111,"Crude Petroleum and Natural Gas Extraction",34,10,12/31/21,"159,484,352",12/31/21,"285,205,000","-28,317,000",,"390,267,000"
19438,"Other intangible assets","Finite-Lived Intangible Assets Impairment Assessment",481437,12/31/21,03/30/22,1,"PricewaterhouseCoopers LLP",,,,"Florham Park",NJ,"NEW JERSEY","US Mid Atlantic",S-1/A,2022-03-31,,"Bausch & Lomb Corp",1860742,"=""BLCO""","520 APPLEWOOD CRESCENT",,VAUGHAN,A6,ONTARIO,Canada,,,"=""3851""","Ophthalmic Goods",339115,"Ophthalmic Goods Manufacturing",34,,,,12/31/21,"3,765,000,000","182,000,000","2,479,000,000","10,823,000,000"
20669,"Other intangible assets","Finite-Lived Intangible Assets Impairment Assessment",485306,12/31/21,03/30/22,1,"PricewaterhouseCoopers LLP",,,,"Florham Park",NJ,"NEW JERSEY","US Mid Atlantic",S-1/A,2022-04-28,,"Bausch & Lomb Corp",1860742,"=""BLCO""","520 APPLEWOOD CRESCENT",,VAUGHAN,A6,ONTARIO,Canada,,,"=""3851""","Ophthalmic Goods",339115,"Ophthalmic Goods Manufacturing",34,,,,12/31/21,"3,765,000,000","182,000,000","2,479,000,000","10,823,000,000"
21003,"Other intangible assets","Finite-Lived Intangible Assets Impairment Assessment",486572,12/31/21,03/30/22,1,"PricewaterhouseCoopers LLP",,,,"Florham Park",NJ,"NEW JERSEY","US Mid Atlantic",424B4,2022-05-06,,"Bausch & Lomb Corp",1860742,"=""BLCO""","520 APPLEWOOD CRESCENT",,VAUGHAN,A6,ONTARIO,Canada,,,"=""3851""","Ophthalmic Goods",339115,"Ophthalmic Goods Manufacturing",34,,,,12/31/21,"3,765,000,000","182,000,000","2,479,000,000","10,823,000,000"
15816,"Sales return and allowances","Medicaid Rebates and Sales Returns Allowances",475060,12/31/21,02/23/22,1,"PricewaterhouseCoopers LLP",,,,"Florham Park",NJ,"NEW JERSEY","US Mid Atlantic",10-K,2022-02-23,,"Bausch Health Companies Inc.",885590,"=""BHC""","2150 ST. ELZEAR BLVD. WEST",LAVAL,QUEBEC,A8,QUEBEC,Canada,,,"=""2834""","Pharmaceutical Preparations",325412,"Pharmaceutical Preparation Manufacturing",34,28,12/31/21,"9,923,192,832",12/31/21,"8,434,000,000","-948,000,000","-19,309,000,000","29,202,000,000"
15817,"Other intangible assets","Finite-Lived Intangible Assets Impairment Assessment",475060,12/31/21,02/23/22,1,"PricewaterhouseCoopers LLP",,,,"Florham Park",NJ,"NEW JERSEY","US Mid Atlantic",10-K,2022-02-23,,"Bausch Health Companies Inc.",885590,"=""BHC""","2150 ST. ELZEAR BLVD. WEST",LAVAL,QUEBEC,A8,QUEBEC,Canada,,,"=""2834""","Pharmaceutical Preparations",325412,"Pharmaceutical Preparation Manufacturing",34,28,12/31/21,"9,923,192,832",12/31/21,"8,434,000,000","-948,000,000","-19,309,000,000","29,202,000,000"
15818,Goodwill,"Goodwill Impairment Assessments – Ortho Dermatologics Reporting Unit",475060,12/31/21,02/23/22,1,"PricewaterhouseCoopers LLP",,,,"Florham Park",NJ,"NEW JERSEY","US Mid Atlantic",10-K,2022-02-23,,"Bausch Health Companies Inc.",885590,"=""BHC""","2150 ST. ELZEAR BLVD. WEST",LAVAL,QUEBEC,A8,QUEBEC,Canada,,,"=""2834""","Pharmaceutical Preparations",325412,"Pharmaceutical Preparation Manufacturing",34,28,12/31/21,"9,923,192,832",12/31/21,"8,434,000,000","-948,000,000","-19,309,000,000","29,202,000,000"
21058,"Sales return and allowances","Medicaid Rebates and Sales Returns Allowances",486824,12/31/21,02/23/22,1,"PricewaterhouseCoopers LLP",,,,"Florham Park",NJ,"NEW JERSEY","US Mid Atlantic",8-K,2022-05-11,,"Bausch Health Companies Inc.",885590,"=""BHC""","2150 ST. ELZEAR BLVD. WEST",LAVAL,QUEBEC,A8,QUEBEC,Canada,,,"=""2834""","Pharmaceutical Preparations",325412,"Pharmaceutical Preparation Manufacturing",34,28,12/31/21,"9,923,192,832",12/31/21,"8,434,000,000","-948,000,000","-19,309,000,000","29,202,000,000"
21059,"Other intangible assets","Finite-Lived Intangible Assets Impairment Assessment",486824,12/31/21,02/23/22,1,"PricewaterhouseCoopers LLP",,,,"Florham Park",NJ,"NEW JERSEY","US Mid Atlantic",8-K,2022-05-11,,"Bausch Health Companies Inc.",885590,"=""BHC""","2150 ST. ELZEAR BLVD. WEST",LAVAL,QUEBEC,A8,QUEBEC,Canada,,,"=""2834""","Pharmaceutical Preparations",325412,"Pharmaceutical Preparation Manufacturing",34,28,12/31/21,"9,923,192,832",12/31/21,"8,434,000,000","-948,000,000","-19,309,000,000","29,202,000,000"
21060,Goodwill,"Goodwill Impairment Assessments – Ortho Dermatologics Reporting Unit",486824,12/31/21,02/23/22,1,"PricewaterhouseCoopers LLP",,,,"Florham Park",NJ,"NEW JERSEY","US Mid Atlantic",8-K,2022-05-11,,"Bausch Health Companies Inc.",885590,"=""BHC""","2150 ST. ELZEAR BLVD. WEST",LAVAL,QUEBEC,A8,QUEBEC,Canada,,,"=""2834""","Pharmaceutical Preparations",325412,"Pharmaceutical Preparation Manufacturing",34,28,12/31/21,"9,923,192,832",12/31/21,"8,434,000,000","-948,000,000","-19,309,000,000","29,202,000,000"
15516,"Deferred income taxes","Valuation Allowance on United States (U.S.) Foreign Tax Credit Carryforwards",474646,12/31/21,02/23/22,1,"PricewaterhouseCoopers LLP",,,,Chicago,IL,ILLINOIS,"US Midwest",10-K,2022-02-23,,"BAXTER INTERNATIONAL INC",10456,"=""BAX""","ONE BAXTER PARKWAY",,DEERFIELD,IL,ILLINOIS,"US Midwest",,,"=""3841""","Surgical and Medical Instruments and Apparatus",325414,"Biological Product (except Diagnostic) Manufacturing",34,86,12/31/21,"43,058,667,520",12/31/21,"12,146,000,000","1,284,000,000","-8,551,000,000","33,521,000,000"
15517,"Business combinations","Valuation of Certain Acquired Intangible Assets - Hill-Rom Holdings, Inc. (Hillrom) Acquisition",474646,12/31/21,02/23/22,1,"PricewaterhouseCoopers LLP",,,,Chicago,IL,ILLINOIS,"US Midwest",10-K,2022-02-23,,"BAXTER INTERNATIONAL INC",10456,"=""BAX""","ONE BAXTER PARKWAY",,DEERFIELD,IL,ILLINOIS,"US Midwest",,,"=""3841""","Surgical and Medical Instruments and Apparatus",325414,"Biological Product (except Diagnostic) Manufacturing",34,86,12/31/21,"43,058,667,520",12/31/21,"12,146,000,000","1,284,000,000","-8,551,000,000","33,521,000,000"
16132,"Proven and unproven reserves","Assessment of the recoverable amount of of oil and gas properties",475647,12/31/21,02/24/22,4,"KPMG LLP",187,"KPMG LLP Chartered Accountants",85,Calgary,A0,ALBERTA,Canada,6-K,2022-02-24,,"BAYTEX ENERGY CORP.",1279495,"=""BTE""","2200 205 5TH AVE SW",,CALGARY,A0,ALBERTA,Canada,,,"=""1381""","Drilling Oil and Gas Wells",213111,"Drilling Oil and Gas Wells",34,3,12/31/21,"1,743,418,112",12/31/21,"1,210,497,000","1,277,441,000",,"3,827,450,000"
16133,"Proven and unproven reserves","Impact of estimated oil and gas reserves on depletion expense related to oil and gas properties",475647,12/31/21,02/24/22,4,"KPMG LLP",187,"KPMG LLP Chartered Accountants",85,Calgary,A0,ALBERTA,Canada,6-K,2022-02-24,,"BAYTEX ENERGY CORP.",1279495,"=""BTE""","2200 205 5TH AVE SW",,CALGARY,A0,ALBERTA,Canada,,,"=""1381""","Drilling Oil and Gas Wells",213111,"Drilling Oil and Gas Wells",34,3,12/31/21,"1,743,418,112",12/31/21,"1,210,497,000","1,277,441,000",,"3,827,450,000"
17174,"Proven and unproven reserves","Assessment of the recoverable amount of of oil and gas properties",476955,12/31/21,02/24/22,4,"KPMG LLP",187,"KPMG LLP Chartered Accountants",85,Calgary,A0,ALBERTA,Canada,40-F,2022-03-01,,"BAYTEX ENERGY CORP.",1279495,"=""BTE""","2200 205 5TH AVE SW",,CALGARY,A0,ALBERTA,Canada,,,"=""1381""","Drilling Oil and Gas Wells",213111,"Drilling Oil and Gas Wells",34,3,12/31/21,"1,743,418,112",12/31/21,"1,210,497,000","1,277,441,000",,"3,827,450,000"
17175,"Proven and unproven reserves","Impact of estimated oil and gas reserves on depletion expense related to oil and gas properties",476955,12/31/21,02/24/22,4,"KPMG LLP",187,"KPMG LLP Chartered Accountants",85,Calgary,A0,ALBERTA,Canada,40-F,2022-03-01,,"BAYTEX ENERGY CORP.",1279495,"=""BTE""","2200 205 5TH AVE SW",,CALGARY,A0,ALBERTA,Canada,,,"=""1381""","Drilling Oil and Gas Wells",213111,"Drilling Oil and Gas Wells",34,3,12/31/21,"1,743,418,112",12/31/21,"1,210,497,000","1,277,441,000",,"3,827,450,000"
17820,"Proven and unproven reserves","Assessment of the recoverable amount of of oil and gas properties",477618,12/31/21,02/24/22,4,"KPMG LLP",187,"KPMG LLP Chartered Accountants",85,Calgary,A0,ALBERTA,Canada,6-K,2022-03-04,,"BAYTEX ENERGY CORP.",1279495,"=""BTE""","2200 205 5TH AVE SW",,CALGARY,A0,ALBERTA,Canada,,,"=""1381""","Drilling Oil and Gas Wells",213111,"Drilling Oil and Gas Wells",34,3,12/31/21,"1,743,418,112",12/31/21,"1,210,497,000","1,277,441,000",,"3,827,450,000"
17821,"Proven and unproven reserves","Impact of estimated oil and gas reserves on depletion expense related to oil and gas properties",477618,12/31/21,02/24/22,4,"KPMG LLP",187,"KPMG LLP Chartered Accountants",85,Calgary,A0,ALBERTA,Canada,6-K,2022-03-04,,"BAYTEX ENERGY CORP.",1279495,"=""BTE""","2200 205 5TH AVE SW",,CALGARY,A0,ALBERTA,Canada,,,"=""1381""","Drilling Oil and Gas Wells",213111,"Drilling Oil and Gas Wells",34,3,12/31/21,"1,743,418,112",12/31/21,"1,210,497,000","1,277,441,000",,"3,827,450,000"
18431,"Other investments","Fair Value of Level 3 Investments — Refer to Notes 2 and 4 to the financial statements",479454,12/31/21,03/14/22,3,"Deloitte & Touche LLP",,,,"New York",NY,"NEW YORK","US Mid Atlantic",10-K,2022-03-14,,"BC Partners Lending Corp",1726548,,"650 MADISON AVENUE",,"NEW YORK",NY,"NEW YORK","US Mid Atlantic",,,,,525990,"Other Financial Vehicles",34,,,,12/31/21,"7,750,000","2,126,000","43,765,000","113,360,000"
17792,"Goodwill and intangible assets","Goodwill and Intangible Assets - Bell Media Group - Refer to Notes 7, 19 and 22 to the financial statements",477441,12/31/21,03/03/22,3,"Deloitte & Touche LLP",486,"Deloitte srl",1208,Montreal,A8,QUEBEC,Canada,40-F,2022-03-04,,"BCE INC",718940,"=""BCE""","1 CARREFOUR ALEXANDER-GRAHAM-BELL","BUREAU 4100",MONTREAL,A8,QUEBEC,Canada,,,"=""4813""","Telephone Communications, Except Radiotelephone",517310,"Telecommunications Resellers",34,52,12/29/21,"46,595,461,120",12/31/21,"18,564,000,000","2,290,000,000","-2,777,000,000","52,855,000,000"
17818,"Goodwill and intangible assets","Goodwill and Intangible Assets – Bell Media Group – Refer to Notes 7, 19 and 22 to the financial statements",477613,12/31/21,03/03/22,3,"Deloitte & Touche LLP",486,"Deloitte srl",1208,Montreal,A8,QUEBEC,Canada,6-K,2022-03-04,,"BCE INC",718940,"=""BCE""","1 CARREFOUR ALEXANDER-GRAHAM-BELL","BUREAU 4100",MONTREAL,A8,QUEBEC,Canada,,,"=""4813""","Telephone Communications, Except Radiotelephone",517310,"Telecommunications Resellers",34,52,12/29/21,"46,595,461,120",12/31/21,"18,564,000,000","2,290,000,000","-2,777,000,000","52,855,000,000"
18196,"Other investments","Fair Value of Level 3 Investments — Refer to Notes 2 and 4 to the financial statements",478880,12/31/21,03/10/22,3,"Deloitte & Touche LLP",,,,"New York",NY,"NEW YORK","US Mid Atlantic",10-K,2022-03-10,,"BCP Investment Corp",1372807,"=""BCIC""","650 MADISON AVENUE","3RD FLOOR","NEW YORK",NY,"NEW YORK","US Mid Atlantic",,,,,525990,"Other Financial Vehicles",34,25,12/31/21,"240,164,448",12/31/21,"66,442,000","26,026,000",,"648,301,000"
18197,"Business combinations","Significant Unusual Transaction – Business Acquisition –- Refer to Note 11 to the financial statements",478880,12/31/21,03/10/22,3,"Deloitte & Touche LLP",,,,"New York",NY,"NEW YORK","US Mid Atlantic",10-K,2022-03-10,,"BCP Investment Corp",1372807,"=""BCIC""","650 MADISON AVENUE","3RD FLOOR","NEW YORK",NY,"NEW YORK","US Mid Atlantic",,,,,525990,"Other Financial Vehicles",34,25,12/31/21,"240,164,448",12/31/21,"66,442,000","26,026,000",,"648,301,000"
17177,"Business combinations","Acquisition of Myx",476961,12/31/21,03/01/22,2,"Ernst & Young LLP",,,,"Los Angeles",CA,CALIFORNIA,"US West",10-K,2022-03-01,,"Beachbody Company, Inc.",1826889,"=""BODI""","400 CONTINENTAL BLVD","SUITE 400","EL SEGUNDO",CA,CALIFORNIA,"US West",,,"=""5960""","Retail-Nonstore Retailers",454111,"Electronic Shopping",34,2,12/31/21,"398,950,304",12/31/21,"873,645,000","-228,382,000","213,852,000","637,612,000"
17178,"Goodwill and intangible assets","Goodwill and Intangible Assets Impairment",476961,12/31/21,03/01/22,2,"Ernst & Young LLP",,,,"Los Angeles",CA,CALIFORNIA,"US West",10-K,2022-03-01,,"Beachbody Company, Inc.",1826889,"=""BODI""","400 CONTINENTAL BLVD","SUITE 400","EL SEGUNDO",CA,CALIFORNIA,"US West",,,"=""5960""","Retail-Nonstore Retailers",454111,"Electronic Shopping",34,2,12/31/21,"398,950,304",12/31/21,"873,645,000","-228,382,000","213,852,000","637,612,000"
17208,"Business combinations","Guide Asset Acquisition – Contingent Consideration Liabilities— Refer to Notes 2, 4, and 8 to the financial statements",476208,12/31/21,02/28/22,3,"Deloitte & Touche LLP",,,,Boston,MA,MASSACHUSETTS,"US New England",10-K,2022-02-28,,"Beam Therapeutics Inc.",1745999,"=""BEAM""","26 LANDSDOWNE STREET",,CAMBRIDGE,MA,MASSACHUSETTS,"US New England",,,"=""2836""","Biological Products, Except Diagnostic Substances",325414,"Biological Product (except Diagnostic) Manufacturing",34,80,12/31/21,"5,449,953,280",12/31/21,"51,844,000","-370,638,000",,"1,474,453,000"
17200,"Other debt","Convertible Senior Notes and Capped Call Transactions — Refer to Notes 2 and 10 to the financial statements",476959,12/31/21,03/01/22,3,"Deloitte & Touche LLP",,,,"Los Angeles",CA,CALIFORNIA,"US West",10-K,2022-03-01,,"Beauty Health Co",1818093,"=""SKIN""","2165 SPRING STREET",,"LONG BEACH",CA,CALIFORNIA,"US West",,,"=""3841""","Surgical and Medical Instruments and Apparatus",325620,"Toilet Preparation Manufacturing",34,24,12/31/21,"3,638,448,896",12/31/21,"260,086,000","-378,764,000","122,593,000","1,218,806,000"
20863,"Other debt","Convertible Senior Notes and Capped Call Transactions — Refer to Notes 2 and 10 to the financial statements",485996,12/31/21,03/01/22,3,"Deloitte & Touche LLP",,,,"Los Angeles",CA,CALIFORNIA,"US West","POS AM",2022-05-02,,"Beauty Health Co",1818093,"=""SKIN""","2165 SPRING STREET",,"LONG BEACH",CA,CALIFORNIA,"US West",,,"=""3841""","Surgical and Medical Instruments and Apparatus",325620,"Toilet Preparation Manufacturing",34,24,12/31/21,"3,638,448,896",12/31/21,"260,086,000","-378,764,000","122,593,000","1,218,806,000"
13521,Inventory,"Owned Inventory - Valuation of Projects in Progress — Refer to Notes 2 and 5 to the financial statements.",467335,09/30/21,11/10/21,3,"Deloitte & Touche LLP",,,,Atlanta,GA,GEORGIA,"US Southeast",10-K,2021-11-10,,"BEAZER HOMES USA INC",915840,"=""BZH""","2002 SUMMIT BLVD NE","15TH FLOOR",ATLANTA,GA,GEORGIA,"US Southeast",,,"=""1531""","Operative Builders",236117,"New Housing Operative Builders",34,17,09/30/21,"539,824,896",09/30/21,"2,140,303,000","122,021,000","713,508,000","2,078,810,000"
13715,"Other contingent liabilities","Estimation of Product Liability Reserves",468225,09/30/21,11/24/21,2,"Ernst & Young LLP",,,,"New York",NY,"NEW YORK","US Mid Atlantic",10-K,2021-11-24,,"BECTON DICKINSON & CO",10795,"=""BDX""","ONE BECTON DR",,"FRANKLIN LAKES",NJ,"NEW JERSEY","US Mid Atlantic",,,"=""3841""","Surgical and Medical Instruments and Apparatus",334516,"Analytical Laboratory Instrument Manufacturing",34,246,09/30/21,"68,177,506,304",09/30/21,"20,248,000,000","2,091,000,000","-13,005,000,000","53,868,000,000"
13716,"Uncertain tax positions","Income taxes — Uncertain tax positions",468225,09/30/21,11/24/21,2,"Ernst & Young LLP",,,,"New York",NY,"NEW YORK","US Mid Atlantic",10-K,2021-11-24,,"BECTON DICKINSON & CO",10795,"=""BDX""","ONE BECTON DR",,"FRANKLIN LAKES",NJ,"NEW JERSEY","US Mid Atlantic",,,"=""3841""","Surgical and Medical Instruments and Apparatus",334516,"Analytical Laboratory Instrument Manufacturing",34,246,09/30/21,"68,177,506,304",09/30/21,"20,248,000,000","2,091,000,000","-13,005,000,000","53,868,000,000"
13717,Goodwill,"Goodwill impairment — Interventional segment",468225,09/30/21,11/24/21,2,"Ernst & Young LLP",,,,"New York",NY,"NEW YORK","US Mid Atlantic",10-K,2021-11-24,,"BECTON DICKINSON & CO",10795,"=""BDX""","ONE BECTON DR",,"FRANKLIN LAKES",NJ,"NEW JERSEY","US Mid Atlantic",,,"=""3841""","Surgical and Medical Instruments and Apparatus",334516,"Analytical Laboratory Instrument Manufacturing",34,246,09/30/21,"68,177,506,304",09/30/21,"20,248,000,000","2,091,000,000","-13,005,000,000","53,868,000,000"
16709,"Revenue from customer contracts","Estimate of unearned product revenue on undelivered product",475524,12/31/21,02/25/22,4,"KPMG LLP",,,,"Salt Lake City",UT,UTAH,"US West",10-K,2022-02-25,,"BED BATH & BEYOND, INC.",1130713,"=""BBBY""","433 W. ASCENSION WAY, 3RD FLOOR",,MURRAY,UT,UTAH,"US West",,,"=""5961""","Catalog and Mail-Order Houses",454111,"Electronic Shopping",34,60,12/29/21,"2,568,827,392",12/31/21,"2,756,446,000","389,372,000","738,226,000","1,065,966,000"
16710,Consolidation,"Assessment of control under the variable interest entity model",475524,12/31/21,02/25/22,4,"KPMG LLP",,,,"Salt Lake City",UT,UTAH,"US West",10-K,2022-02-25,,"BED BATH & BEYOND, INC.",1130713,"=""BBBY""","433 W. ASCENSION WAY, 3RD FLOOR",,MURRAY,UT,UTAH,"US West",,,"=""5961""","Catalog and Mail-Order Houses",454111,"Electronic Shopping",34,60,12/29/21,"2,568,827,392",12/31/21,"2,756,446,000","389,372,000","738,226,000","1,065,966,000"
16711,Subsidiary/affiliate,"Initial valuation of retained noncontrolling interest in former subsidiaries",475524,12/31/21,02/25/22,4,"KPMG LLP",,,,"Salt Lake City",UT,UTAH,"US West",10-K,2022-02-25,,"BED BATH & BEYOND, INC.",1130713,"=""BBBY""","433 W. ASCENSION WAY, 3RD FLOOR",,MURRAY,UT,UTAH,"US West",,,"=""5961""","Catalog and Mail-Order Houses",454111,"Electronic Shopping",34,60,12/29/21,"2,568,827,392",12/31/21,"2,756,446,000","389,372,000","738,226,000","1,065,966,000"
14859,Goodwill,"Goodwill Impairment related to Tripwire Reporting Unit",473765,12/31/21,02/15/22,2,"Ernst & Young LLP",,,,"Saint Louis",MO,MISSOURI,"US Southeast",10-K,2022-02-15,,"BELDEN INC.",913142,"=""BDC""","1 NORTH BRENTWOOD BLVD","15TH FLOOR","ST. LOUIS",MO,MISSOURI,"US Southeast",,,"=""3357""","Drawing and Insulating of Nonferrous Wire",334290,"Other Communications Equipment Manufacturing",34,66,12/31/21,"2,956,206,848",12/31/21,"2,301,260,000","63,925,000","-498,881,000","3,417,677,000"
14860,"Revenue from customer contracts","Revenue recognition - allocating consideration to performance obligations and estimating variable consideration",473765,12/31/21,02/15/22,2,"Ernst & Young LLP",,,,"Saint Louis",MO,MISSOURI,"US Southeast",10-K,2022-02-15,,"BELDEN INC.",913142,"=""BDC""","1 NORTH BRENTWOOD BLVD","15TH FLOOR","ST. LOUIS",MO,MISSOURI,"US Southeast",,,"=""3357""","Drawing and Insulating of Nonferrous Wire",334290,"Other Communications Equipment Manufacturing",34,66,12/31/21,"2,956,206,848",12/31/21,"2,301,260,000","63,925,000","-498,881,000","3,417,677,000"
19063,"Other debt","Warrant liability valuation of Bellicum Pharmaceuticals",480542,12/31/21,03/24/22,2,"Ernst & Young LLP",,,,Houston,TX,TEXAS,"US Southwest",10-K,2022-03-24,,"BELLICUM PHARMACEUTICALS, INC",1358403,,"3730 KIRBY DRIVE","SUITE 1200",HOUSTON,TX,TEXAS,"US Southwest",,,"=""2834""","Pharmaceutical Preparations",325412,"Pharmaceutical Preparation Manufacturing",34,1,12/31/21,"12,559,626",12/31/21,"6,200,000","-9,705,000",,"49,143,000"
13641,"Sales return and allowances","Receivables, net- Allowance for Trade Promotions",467821,09/30/21,11/19/21,1,"PricewaterhouseCoopers LLP",,,,"Saint Louis",MO,MISSOURI,"US Southeast",10-K,2021-11-19,,"BELLRING BRANDS, INC.",1772016,"=""BRBR""","1 N. BRENTWOOD BOULEVARD, SUITE 1550",,CLAYTON,MO,MISSOURI,"US Southeast",,,"=""2000""","Food and Kindred Products",446191,"Food (Health) Supplement Stores",34,31,09/30/21,"1,214,945,664",09/30/21,"1,247,100,000","27,600,000","-354,500,000","696,500,000"
16668,"Other income taxes","Evaluation of income tax expense",476116,12/31/21,02/25/22,4,"KPMG LLP",,,,Phoenix,AZ,ARIZONA,"US Southwest",10-K,2022-02-25,,"BENCHMARK ELECTRONICS INC",863436,"=""BHE""","56 SOUTH ROCKFORD DRIVE",,TEMPE,AZ,ARIZONA,"US Southwest",,,"=""3672""","Printed Circuit Boards",334418,"Printed Circuit Assembly (Electronic Assembly) Manufacturing",34,27,12/31/21,"954,272,320",12/31/21,"2,255,319,000","35,770,000","781,686,000","1,903,880,000"
17735,"Revenue from customer contracts","Revenue Recognition – Estimation of Platform Revenue from Insurance Broker Commissions",477452,12/31/21,03/03/22,2,"Ernst & Young LLP",,,,Charlotte,NC,"NORTH CAROLINA","US Southeast",10-K,2022-03-04,,"Benefitfocus, Inc.",1576169,,"100 BENEFITFOCUS WAY",,CHARLESTON,SC,"SOUTH CAROLINA","US Southeast",,,"=""7372""","Prepackaged Software",511210,"Software Publishers",34,11,12/31/21,"356,689,408",12/31/21,"263,097,000","-32,166,000","-52,495,000","260,841,000"
17400,"Business combinations","Evaluation of the fair value of certain customer relationships acquired through business combinations",476843,12/31/21,03/01/22,4,"KPMG LLP",,,,Philadelphia,PA,PENNSYLVANIA,"US Mid Atlantic",10-K,2022-03-01,,"BENTLEY SYSTEMS INC",1031308,"=""BSY""","685 STOCKTON DRIVE",,EXTON,PA,PENNSYLVANIA,"US Mid Atlantic",,,"=""7372""","Prepackaged Software",541511,"Custom Computer Programming Services",34,48,12/31/21,"13,093,803,008",12/31/21,"965,046,000","93,192,000","-1,425,089,000","2,659,243,000"
17401,"Revenue from customer contracts","Evaluation of the standalone selling price for certain term license subscriptions and portfolio balancing material rights",476843,12/31/21,03/01/22,4,"KPMG LLP",,,,Philadelphia,PA,PENNSYLVANIA,"US Mid Atlantic",10-K,2022-03-01,,"BENTLEY SYSTEMS INC",1031308,"=""BSY""","685 STOCKTON DRIVE",,EXTON,PA,PENNSYLVANIA,"US Mid Atlantic",,,"=""7372""","Prepackaged Software",541511,"Custom Computer Programming Services",34,48,12/31/21,"13,093,803,008",12/31/21,"965,046,000","93,192,000","-1,425,089,000","2,659,243,000"
16743,"Research and development expenses","Accrual of research and development expenses",476214,12/31/21,02/28/22,2,"Ernst & Young LLP",211,"Ernst & Young Hua Ming LLP",1408,Beijing,F4,CHINA,Foreign,10-K,2022-02-28,,"BeOne Medicines Ltd.",1651308,"=""ONC""","C/O BEONE MEDICINES I GMBH","AESCHENGRABEN 27, 21ST FLOOR",BASEL,V8,SWITZERLAND,Foreign,,,"=""2834""","Pharmaceutical Preparations",325412,"Pharmaceutical Preparation Manufacturing",34,261,12/29/21,"19,632,711,680",12/31/21,"1,176,283,000","-1,413,354,000","6,196,308,000","8,645,949,000"
16744,"Revenue from customer contracts","Allocation of transaction price in relation to the Novartis Tislelizumab Agreement",476214,12/31/21,02/28/22,2,"Ernst & Young LLP",211,"Ernst & Young Hua Ming LLP",1408,Beijing,F4,CHINA,Foreign,10-K,2022-02-28,,"BeOne Medicines Ltd.",1651308,"=""ONC""","C/O BEONE MEDICINES I GMBH","AESCHENGRABEN 27, 21ST FLOOR",BASEL,V8,SWITZERLAND,Foreign,,,"=""2834""","Pharmaceutical Preparations",325412,"Pharmaceutical Preparation Manufacturing",34,261,12/29/21,"19,632,711,680",12/31/21,"1,176,283,000","-1,413,354,000","6,196,308,000","8,645,949,000"
16190,"Allowance for credit losses","Reserves for losses and loss expenses",475376,12/31/21,02/24/22,4,"KPMG LLP",,,,"New York",NY,"NEW YORK","US Mid Atlantic",10-K,2022-02-24,,"BERKLEY W R CORP",11544,"=""WRB""","475 STEAMBOAT ROAD",.,GREENWICH,CT,CONNECTICUT,"US New England",,,"=""6331""","Fire, Marine, and Casualty Insurance",524113,"Direct Life Insurance Carriers",34,82,12/31/21,"14,565,836,800",12/31/21,"9,455,466,000","1,022,490,000","6,483,359,000","32,086,414,000"
17142,"Regulatory assets and liabilities","Regulatory Matters — Impact of Rate Regulation on the Financial Statements — Refer to Notes 2 and 7 to the financial statements",476166,12/31/21,02/25/22,3,"Deloitte & Touche LLP",,,,"Des Moines",IA,IOWA,"US Midwest",10-K,2022-02-28,,"BERKSHIRE HATHAWAY ENERGY CO",1081316,,"1615 LOCUST STREET",,"DES MOINES",IA,IOWA,"US Midwest",1067983,"BERKSHIRE HATHAWAY INC","=""4900""","Electric, Gas & Sanitary Services",221122,"Electric Power Distribution",34,,,,12/31/21,"25,150,000,000","5,790,000,000","35,044,000,000","132,065,000,000"
17143,"Other contingent liabilities","California and Oregon 2020 Wildfires — Contingencies — See Note 16 to the financial statements",476166,12/31/21,02/25/22,3,"Deloitte & Touche LLP",,,,"Des Moines",IA,IOWA,"US Midwest",10-K,2022-02-28,,"BERKSHIRE HATHAWAY ENERGY CO",1081316,,"1615 LOCUST STREET",,"DES MOINES",IA,IOWA,"US Midwest",1067983,"BERKSHIRE HATHAWAY INC","=""4900""","Electric, Gas & Sanitary Services",221122,"Electric Power Distribution",34,,,,12/31/21,"25,150,000,000","5,790,000,000","35,044,000,000","132,065,000,000"
17122,"Insurance contract liabilities","Unpaid Losses and Loss Adjustment Expenses— Refer to Notes 1 and 16 to the financial statements",476161,12/31/21,02/26/22,3,"Deloitte & Touche LLP",,,,Omaha,NE,NEBRASKA,"US Midwest",10-K,2022-02-28,,"BERKSHIRE HATHAWAY INC",1067983,"=""BRK.A""","3555 FARNAM STREET",,OMAHA,NE,NEBRASKA,"US Midwest",,,"=""6331""","Fire, Marine, and Casualty Insurance",524130,"Reinsurance Carriers",34,"450,662",12/31/21,"278,109,388,800",12/31/21,"354,727,000,000","89,937,000,000","403,838,000,000","958,784,000,000"
17123,"Insurance contract liabilities","Unpaid Losses and Loss Adjustment Expenses Under Retroactive Reinsurance Contracts — Refer to Notes 1 and 17 to the financial statements",476161,12/31/21,02/26/22,3,"Deloitte & Touche LLP",,,,Omaha,NE,NEBRASKA,"US Midwest",10-K,2022-02-28,,"BERKSHIRE HATHAWAY INC",1067983,"=""BRK.A""","3555 FARNAM STREET",,OMAHA,NE,NEBRASKA,"US Midwest",,,"=""6331""","Fire, Marine, and Casualty Insurance",524130,"Reinsurance Carriers",34,"450,662",12/31/21,"278,109,388,800",12/31/21,"354,727,000,000","89,937,000,000","403,838,000,000","958,784,000,000"
17124,"Goodwill and intangible assets","Goodwill and Indefinite-Lived Intangible Assets — Refer to Notes 1 and 13 to the financial statements",476161,12/31/21,02/26/22,3,"Deloitte & Touche LLP",,,,Omaha,NE,NEBRASKA,"US Midwest",10-K,2022-02-28,,"BERKSHIRE HATHAWAY INC",1067983,"=""BRK.A""","3555 FARNAM STREET",,OMAHA,NE,NEBRASKA,"US Midwest",,,"=""6331""","Fire, Marine, and Casualty Insurance",524130,"Reinsurance Carriers",34,"450,662",12/31/21,"278,109,388,800",12/31/21,"354,727,000,000","89,937,000,000","403,838,000,000","958,784,000,000"
13605,"Pension and other post-employment benefits","United Kingdom Defined Benefit Pension Obligation",467797,10/02/21,11/18/21,2,"Ernst & Young LLP",,,,Indianapolis,IN,INDIANA,"US Midwest",10-K,2021-11-18,,"BERRY GLOBAL GROUP, INC.",1378992,"=""BERY""","101 OAKLEY STREET","PO BOX 959",EVANSVILLE,IN,INDIANA,"US Midwest",,,"=""3089""","Plastics Products, NEC",326199,"All Other Plastics Product Manufacturing",34,61,10/04/21,"8,300,655,104",10/02/21,"13,850,000,000","733,000,000","-4,254,000,000","17,882,000,000"
9643,"Vendor/supplier rebates","Vendor Allowances — Refer to Note 1 to the financial statements",449599,01/30/21,03/19/21,3,"Deloitte & Touche LLP",,,,Minneapolis,MN,MINNESOTA,"US Midwest",10-K,2021-03-19,,"BEST BUY CO INC",764478,"=""BBY""","7601 PENN AVE SOUTH",,RICHFIELD,MN,MINNESOTA,"US Midwest",,,"=""5731""","Radio, Television, and Consumer Electronics Stores",443112,"Radio, Television, and Other Electronics Stores",34,109,01/31/21,"27,966,740,480",01/30/21,"47,262,000,000","1,798,000,000","3,601,000,000","19,067,000,000"
9644,Goodwill,"Goodwill — Best Buy Health Reporting Unit — Refer to Note 1 to the financial statements",449599,01/30/21,03/19/21,3,"Deloitte & Touche LLP",,,,Minneapolis,MN,MINNESOTA,"US Midwest",10-K,2021-03-19,,"BEST BUY CO INC",764478,"=""BBY""","7601 PENN AVE SOUTH",,RICHFIELD,MN,MINNESOTA,"US Midwest",,,"=""5731""","Radio, Television, and Consumer Electronics Stores",443112,"Radio, Television, and Other Electronics Stores",34,109,01/31/21,"27,966,740,480",01/30/21,"47,262,000,000","1,798,000,000","3,601,000,000","19,067,000,000"
20402,"Long-lived assets","Impairment assessment of long-lived assets",483830,12/31/21,04/18/22,2,"Ernst & Young LLP",211,"Ernst & Young Hua Ming LLP",1408,Shanghai,F4,CHINA,Foreign,20-F,2022-04-18,,"BEST Inc.",1709505,,"2/F, BLOCK A, HUAXING MODERN INDUSTRY","PARK, NO.18 TANGMIAO ROAD, XIHU DISTRICT","HANGZHOU, ZHEJIANG PROVINCE",F4,CHINA,Foreign,,,"=""4210""","Trucking & Courier Services (No Air)",541614,"Process, Physical Distribution, and Logistics Consulting Services",34,1,12/29/21,"199,867,072",12/31/21,"1,792,752,000","41,094,000","337,814,000","1,779,893,000"
20830,Goodwill,"Impairment of Goodwill and Brand Intangible Asset Refer to Notes 2 o), 2 p), 4, 11 and 12 to the consolidated and combined financial statements",485612,12/31/21,04/28/22,3,"Deloitte & Touche LLP",127,"Galaz Yamazaki Ruiz Urquiza SC",1153,Guadalajara,O5,MEXICO,Foreign,20-F,2022-04-29,,"BETTERWARE DE MEXICO, S.A.P.I. DE C.V",1788257,"=""BWMX""","CRUCE CARRETERA GDL AMECA HUAXTLA KM5",,"EL ARENAL",O5,MEXICO,Foreign,,,"=""5961""","Catalog and Mail-Order Houses",423220,"Home Furnishing Merchant Wholesalers",34,19,12/29/21,"697,309,504",12/31/21,"491,946,000","85,411,000","21,731,000","253,371,000"
20831,"Allowance for credit losses","Account receivable (Expected Credit Loss) — Assessment of allowance for credit losses under the expected credit loss (ECL) methodology Refer to Notes 2 g), 4 and 6 to the consolidated and combined financial statements",485612,12/31/21,04/28/22,3,"Deloitte & Touche LLP",127,"Galaz Yamazaki Ruiz Urquiza SC",1153,Guadalajara,O5,MEXICO,Foreign,20-F,2022-04-29,,"BETTERWARE DE MEXICO, S.A.P.I. DE C.V",1788257,"=""BWMX""","CRUCE CARRETERA GDL AMECA HUAXTLA KM5",,"EL ARENAL",O5,MEXICO,Foreign,,,"=""5961""","Catalog and Mail-Order Houses",423220,"Home Furnishing Merchant Wholesalers",34,19,12/29/21,"697,309,504",12/31/21,"491,946,000","85,411,000","21,731,000","253,371,000"
17650,"Other debt","Additional Paid-in Capital—Capped Call Transactions—Refer to Notes 2 and 8 to the financial statements",477078,12/31/21,03/01/22,3,"Deloitte & Touche LLP",,,,"Los Angeles",CA,CALIFORNIA,"US West",10-K,2022-03-02,,"BEYOND MEAT, INC.",1655210,"=""BYND""","888 N. DOUGLAS STREET, SUITE 100",,"EL SEGUNDO",CA,CALIFORNIA,"US West",,,"=""2000""","Food and Kindred Products",311991,"Perishable Prepared Food Manufacturing",34,65,12/31/21,"4,131,202,560",12/31/21,"464,700,000","-182,105,000",,"1,379,399,000"
16827,"Other income taxes","Accounting for Income Taxes",476342,12/31/21,02/28/22,2,"Ernst & Young LLP",,,,"New York",NY,"NEW YORK","US Mid Atlantic",10-K,2022-02-28,,"BGC Group, Inc.",1094831,"=""BGC""","499 PARK AVENUE",,"NEW YORK",NY,"NEW YORK","US Mid Atlantic",,,"=""6200""","Security & Commodity Brokers, Dealers, Exchanges & Services",523120,"Securities Brokerage",34,5,12/29/21,"1,498,047,872",12/31/21,"1,946,035,000","124,007,000","-56,153,000","3,342,166,000"
13011,"Long-lived assets","Carrying value of non-current assets",463914,06/30/21,09/21/21,2,"Ernst & Young LLP",32,"Ernst & Young",1435,Melbourne,C3,AUSTRALIA,Foreign,20-F,2021-09-21,,"BHP Group Ltd",811809,"=""BHP""","LEVEL 27","180 LONSDALE STREET",MELBOURNE,C3,AUSTRALIA,Foreign,,,"=""1000""","Metal mining",212210,"Iron Ore Mining",34,73,07/02/21,"107,464,654,848",06/30/21,"56,921,000,000","11,304,000,000","49,827,000,000","108,927,000,000"
13012,"Asset retirement and environmental obligations","Closure and rehabilitation provisions ",463914,06/30/21,09/21/21,2,"Ernst & Young LLP",32,"Ernst & Young",1435,Melbourne,C3,AUSTRALIA,Foreign,20-F,2021-09-21,,"BHP Group Ltd",811809,"=""BHP""","LEVEL 27","180 LONSDALE STREET",MELBOURNE,C3,AUSTRALIA,Foreign,,,"=""1000""","Metal mining",212210,"Iron Ore Mining",34,73,07/02/21,"107,464,654,848",06/30/21,"56,921,000,000","11,304,000,000","49,827,000,000","108,927,000,000"
13013,"Other contingent liabilities","Samarco dam failure provisions recognised, including the Germano dam decommissioning, and contingent liabilities disclosed",463914,06/30/21,09/21/21,2,"Ernst & Young LLP",32,"Ernst & Young",1435,Melbourne,C3,AUSTRALIA,Foreign,20-F,2021-09-21,,"BHP Group Ltd",811809,"=""BHP""","LEVEL 27","180 LONSDALE STREET",MELBOURNE,C3,AUSTRALIA,Foreign,,,"=""1000""","Metal mining",212210,"Iron Ore Mining",34,73,07/02/21,"107,464,654,848",06/30/21,"56,921,000,000","11,304,000,000","49,827,000,000","108,927,000,000"
13015,"Long-lived assets","Carrying value of non-current assets",463912,06/30/21,09/21/21,2,"Ernst & Young LLP",57,"Ernst & Young LLP",1438,London,X0,"UNITED KINGDOM",Foreign,20-F,2021-09-21,,"BHP Group Plc",1171264,,"8TH FLOOR - NEATHOUSE PLACE",,LONDON,X0,"UNITED KINGDOM",Foreign,,,"=""1220""","Silver Ores",212210,"Iron Ore Mining",34,60,07/02/21,"63,362,154,496",06/30/21,"60,817,000,000","11,304,000,000","49,827,000,000","108,927,000,000"
13016,"Asset retirement and environmental obligations","Closure and rehabilitation provisions ",463912,06/30/21,09/21/21,2,"Ernst & Young LLP",57,"Ernst & Young LLP",1438,London,X0,"UNITED KINGDOM",Foreign,20-F,2021-09-21,,"BHP Group Plc",1171264,,"8TH FLOOR - NEATHOUSE PLACE",,LONDON,X0,"UNITED KINGDOM",Foreign,,,"=""1220""","Silver Ores",212210,"Iron Ore Mining",34,60,07/02/21,"63,362,154,496",06/30/21,"60,817,000,000","11,304,000,000","49,827,000,000","108,927,000,000"
13017,"Other contingent liabilities","Samarco dam failure provisions recognised, including the Germano dam decommissioning, and contingent liabilities disclosed
 ",463912,06/30/21,09/21/21,2,"Ernst & Young LLP",57,"Ernst & Young LLP",1438,London,X0,"UNITED KINGDOM",Foreign,20-F,2021-09-21,,"BHP Group Plc",1171264,,"8TH FLOOR - NEATHOUSE PLACE",,LONDON,X0,"UNITED KINGDOM",Foreign,,,"=""1220""","Silver Ores",212210,"Iron Ore Mining",34,60,07/02/21,"63,362,154,496",06/30/21,"60,817,000,000","11,304,000,000","49,827,000,000","108,927,000,000"
17569,"Revenue from customer contracts","Revenue recognition - Initial accounting treatment for Ionis Collaboration agreement",476528,12/31/21,03/01/22,1,"PricewaterhouseCoopers LLP",121,"PricewaterhouseCoopers LLP",876,Cambridge,X0,"UNITED KINGDOM",Foreign,10-K,2022-03-01,,"BICYCLE THERAPEUTICS PLC",1761612,"=""BCYC""","BLOCKS A & B, PORTWAY BUILDING","GRANTA PARK, GREAT ABINGTON",CAMBRIDGE,X0,"UNITED KINGDOM",Foreign,,,"=""2834""","Pharmaceutical Preparations",325412,"Pharmaceutical Preparation Manufacturing",34,61,12/31/21,"1,800,495,872",12/31/21,"11,697,000","-66,819,000",,"479,792,000"
17675,Inventory,"Inventory - Valuation of Merchandise Inventories, Net - Refer to Note 2 to the financial statements",477139,01/02/22,03/02/22,3,"Deloitte & Touche LLP",,,,"Los Angeles",CA,CALIFORNIA,"US West",10-K,2022-03-02,,"BIG 5 SPORTING GOODS Corp",1156388,"=""BGFV""","2525 EAST EL SEGUNDO BOULEVARD",,"EL SEGUNDO",CA,CALIFORNIA,"US West",,,"=""5940""","Retail-Miscellaneous Shopping Goods Stores",451110,"Sporting Goods Stores",34,20,01/04/22,"443,538,144",01/02/22,"1,161,820,000","102,386,000",,"753,953,000"
16763,"Property, plant and equipment","Property and Equipment — Refer to Note 5 to the financial statements
",476213,12/31/21,02/26/22,3,"Deloitte & Touche LLP",,,,Indianapolis,IN,INDIANA,"US Midwest",10-K,2022-02-28,,"Biglari Holdings Inc.",1726173,"=""BH""","19100 RIDGEWOOD PKWY, SUITE 1200",,"SAN ANTONIO",TX,TEXAS,"US Southwest",,,"=""5812""","Eating and Drinking Places",722110,"Full-Service Restaurants",34,143,12/31/21,"294,926,016",12/31/21,"366,106,000","35,478,000","510,686,000","894,807,000"
20532,"Revenue from customer contracts","Revenue recognition for in-game virtual items
",484604,12/31/21,04/25/22,1,"PricewaterhouseCoopers LLP",94,"PricewaterhouseCoopers Zhong Tian LLP",1424,Beijing,F4,CHINA,Foreign,20-F,2022-04-25,,"Bilibili Inc.",1723690,"=""BILI""","17TH FLOOR, BUILDING 3, GUOZHENG CENTER","NO. 485 ZHENGLI ROAD, YANGPU DISTRICT",SHANGHAI,F4,CHINA,Foreign,,,"=""7374""","Computer Processing and Data Preparation and Processing Services",516110,"Internet Publishing and Broadcasting",34,43,12/29/21,"11,417,480,192",12/31/21,"3,041,365,000","-1,065,253,000","2,436,672,000","8,167,314,000"
12798,"Other liabilities and provisions","Funds Held for Customers and Customer Fund Deposits",462759,06/30/21,08/30/21,2,"Ernst & Young LLP",,,,"San Francisco",CA,CALIFORNIA,"US West",10-K,2021-08-30,,"BILL Holdings, Inc.",1786352,"=""BILL""","6220 AMERICA CENTER DR.","SUITE 100","SAN JOSE",CA,CALIFORNIA,"US West",,,"=""7372""","Prepackaged Software",511210,"Software Publishers",34,183,06/30/21,"17,311,242,240",06/30/21,"238,265,000","-98,720,000","340,206,000","5,969,173,000"
12799,"Other debt","Convertible Senior Notes",462759,06/30/21,08/30/21,2,"Ernst & Young LLP",,,,"San Francisco",CA,CALIFORNIA,"US West",10-K,2021-08-30,,"BILL Holdings, Inc.",1786352,"=""BILL""","6220 AMERICA CENTER DR.","SUITE 100","SAN JOSE",CA,CALIFORNIA,"US West",,,"=""7372""","Prepackaged Software",511210,"Software Publishers",34,183,06/30/21,"17,311,242,240",06/30/21,"238,265,000","-98,720,000","340,206,000","5,969,173,000"
12800,"Business combinations","Valuation of Acquired Intangible Assets",462759,06/30/21,08/30/21,2,"Ernst & Young LLP",,,,"San Francisco",CA,CALIFORNIA,"US West",10-K,2021-08-30,,"BILL Holdings, Inc.",1786352,"=""BILL""","6220 AMERICA CENTER DR.","SUITE 100","SAN JOSE",CA,CALIFORNIA,"US West",,,"=""7372""","Prepackaged Software",511210,"Software Publishers",34,183,06/30/21,"17,311,242,240",06/30/21,"238,265,000","-98,720,000","340,206,000","5,969,173,000"
16781,"Pension and other post-employment benefits","Defined Benefit Plan Assets—Hedge Fund and Private Equity Fund Valuation—Refer to Note 1 and Note 13 to the financial statements",476194,12/31/21,02/28/22,3,"Deloitte & Touche LLP",,,,Dayton,OH,OHIO,"US Midwest",10-K,2022-02-28,,"Billerud Americas Corp",1421182,,"8540 GANDER CREEK DRIVE",,MIAMISBURG,OH,OHIO,"US Midwest",,,"=""2621""","Paper Mills",322121,"Paper (except Newsprint) Mills",34,27,12/31/21,"787,484,608",12/31/21,"1,278,000,000","-3,000,000","667,000,000","1,055,000,000"
18162,"Research and development expenses","Prepaid or Accrued Research and Development Expenses",478858,12/31/21,03/10/22,2,"Ernst & Young LLP",,,,Houston,TX,TEXAS,"US Southwest",10-K,2022-03-10,,"BIO-PATH HOLDINGS, INC.",1133818,"=""BPTH""","4710 BELLAIRE BOULEVARD","SUITE 210",BELLAIRE,TX,TEXAS,"US Southwest",,,"=""2834""","Pharmaceutical Preparations",541710,"Research and Development in the Physical, Engineering, and Life Sciences",34,4,12/31/21,"26,993,200",12/31/21,,"-10,440,000",,"26,568,000"
14733,Leases,"Assessment of Lease Term for Reagent Rental Arrangements",473570,12/31/21,02/11/22,4,"KPMG LLP",,,,"Santa Clara",CA,CALIFORNIA,"US West",10-K,2022-02-11,,"BIO-RAD LABORATORIES, INC.",12208,"=""BIO""","1000 ALFRED NOBEL DRIVE",,HERCULES,CA,CALIFORNIA,"US West",,,"=""3826""","Laboratory Analytical Instruments",334516,"Analytical Laboratory Instrument Manufacturing",34,756,12/31/21,"18,778,927,104",12/31/21,"2,922,545,000","4,245,902,000","13,065,852,000","17,775,795,000"
14734,"Equity investments and joint ventures","Accounting for the Investment in Sartorius AG",473570,12/31/21,02/11/22,4,"KPMG LLP",,,,"Santa Clara",CA,CALIFORNIA,"US West",10-K,2022-02-11,,"BIO-RAD LABORATORIES, INC.",12208,"=""BIO""","1000 ALFRED NOBEL DRIVE",,HERCULES,CA,CALIFORNIA,"US West",,,"=""3826""","Laboratory Analytical Instruments",334516,"Analytical Laboratory Instrument Manufacturing",34,756,12/31/21,"18,778,927,104",12/31/21,"2,922,545,000","4,245,902,000","13,065,852,000","17,775,795,000"
12745,Goodwill,"Goodwill impairment analysis for the Exosome reporting unit",462493,06/30/21,08/25/21,4,"KPMG LLP",,,,Minneapolis,MN,MINNESOTA,"US Midwest",10-K,2021-08-25,,"BIO-TECHNE Corp",842023,"=""TECH""","614 MCKINLEY PL N E","SUITE 1500",MINNEAPOLIS,MN,MINNESOTA,"US Midwest",,,"=""2836""","Biological Products, Except Diagnostic Substances",325413,"In-Vitro Diagnostic Substance Manufacturing",34,450,06/30/21,"17,540,876,288",06/30/21,"931,032,000","140,410,000","129,336,000","2,262,957,000"
12746,"Business combinations","Fair value measurement of the developed technology and in-process research and development intangible assets acquired in the Asuragen acquisition

 ",462493,06/30/21,08/25/21,4,"KPMG LLP",,,,Minneapolis,MN,MINNESOTA,"US Midwest",10-K,2021-08-25,,"BIO-TECHNE Corp",842023,"=""TECH""","614 MCKINLEY PL N E","SUITE 1500",MINNEAPOLIS,MN,MINNESOTA,"US Midwest",,,"=""2836""","Biological Products, Except Diagnostic Substances",325413,"In-Vitro Diagnostic Substance Manufacturing",34,450,06/30/21,"17,540,876,288",06/30/21,"931,032,000","140,410,000","129,336,000","2,262,957,000"
12747,"Other contingent liabilities","Initial fair value measurement of the contingent consideration liability related to the Asuragen acquisition",462493,06/30/21,08/25/21,4,"KPMG LLP",,,,Minneapolis,MN,MINNESOTA,"US Midwest",10-K,2021-08-25,,"BIO-TECHNE Corp",842023,"=""TECH""","614 MCKINLEY PL N E","SUITE 1500",MINNEAPOLIS,MN,MINNESOTA,"US Midwest",,,"=""2836""","Biological Products, Except Diagnostic Substances",325413,"In-Vitro Diagnostic Substance Manufacturing",34,450,06/30/21,"17,540,876,288",06/30/21,"931,032,000","140,410,000","129,336,000","2,262,957,000"
16915,"Regulatory assets and liabilities","Accrual of Clinical Trial Expenses",476511,12/31/21,02/28/22,2,"Ernst & Young LLP",,,,"San Diego",CA,CALIFORNIA,"US West",10-K,2022-02-28,,"BioAtla, Inc.",1826892,"=""BCAB""","11085 TORREYANA ROAD",,"SAN DIEGO",CA,CALIFORNIA,"US West",,,"=""2836""","Biological Products, Except Diagnostic Substances",325414,"Biological Product (except Diagnostic) Manufacturing",34,20,12/31/21,"702,738,944",12/31/21,"250,000","-95,402,000",,"254,422,000"
16945,"Research and development expenses","Accrued Clinical Trial and Manufacturing Activities",476524,12/31/21,02/28/22,2,"Ernst & Young LLP",,,,Raleigh,NC,"NORTH CAROLINA","US Southeast",10-K,2022-02-28,,"BIOCRYST PHARMACEUTICALS INC",882796,"=""BCRX""","4505 EMPEROR BOULEVARD","SUITE 200",DURHAM,NC,"NORTH CAROLINA","US Southeast",,,"=""2836""","Biological Products, Except Diagnostic Substances",325414,"Biological Product (except Diagnostic) Manufacturing",34,14,12/31/21,"2,553,247,488",12/31/21,"157,170,000","-184,062,000",,"588,151,000"
16946,"Revenue from customer contracts","Royalty Financing Obligations",476524,12/31/21,02/28/22,2,"Ernst & Young LLP",,,,Raleigh,NC,"NORTH CAROLINA","US Southeast",10-K,2022-02-28,,"BIOCRYST PHARMACEUTICALS INC",882796,"=""BCRX""","4505 EMPEROR BOULEVARD","SUITE 200",DURHAM,NC,"NORTH CAROLINA","US Southeast",,,"=""2836""","Biological Products, Except Diagnostic Substances",325414,"Biological Product (except Diagnostic) Manufacturing",34,14,12/31/21,"2,553,247,488",12/31/21,"157,170,000","-184,062,000",,"588,151,000"
16947,"Sales return and allowances","Product Sales, net",476524,12/31/21,02/28/22,2,"Ernst & Young LLP",,,,Raleigh,NC,"NORTH CAROLINA","US Southeast",10-K,2022-02-28,,"BIOCRYST PHARMACEUTICALS INC",882796,"=""BCRX""","4505 EMPEROR BOULEVARD","SUITE 200",DURHAM,NC,"NORTH CAROLINA","US Southeast",,,"=""2836""","Biological Products, Except Diagnostic Substances",325414,"Biological Product (except Diagnostic) Manufacturing",34,14,12/31/21,"2,553,247,488",12/31/21,"157,170,000","-184,062,000",,"588,151,000"
18093,"Sales return and allowances","Reserve for product returns",478614,12/31/21,03/09/22,2,"Ernst & Young LLP",,,,Raleigh,NC,"NORTH CAROLINA","US Southeast",10-K,2022-03-09,,"BIODELIVERY SCIENCES INTERNATIONAL INC",1103021,,"4131 PARKLAKE AVENUE","SUITE 225",RALEIGH,NC,"NORTH CAROLINA","US Southeast",,,"=""2834""","Pharmaceutical Preparations",325412,"Pharmaceutical Preparation Manufacturing",34,3,12/31/21,"306,449,280",12/31/21,"166,703,000","84,860,000","123,559,000","324,596,000"
14449,"Sales return and allowances","Reserves for Medicaid and Managed Care Rebates",472988,12/31/21,02/03/22,1,"PricewaterhouseCoopers LLP",,,,Boston,MA,MASSACHUSETTS,"US New England",10-K,2022-02-03,,"BIOGEN INC.",875045,"=""BIIB""","225 BINNEY STREET",,CAMBRIDGE,MA,MASSACHUSETTS,"US New England",,,"=""2836""","Biological Products, Except Diagnostic Substances",325414,"Biological Product (except Diagnostic) Manufacturing",34,240,12/31/21,"35,268,239,360",12/31/21,"10,981,700,000","1,556,100,000","2,913,800,000","23,877,300,000"
16674,"Other revenue","Government Rebates",476092,12/31/21,02/25/22,2,"Ernst & Young LLP",,,,Hartford,CT,CONNECTICUT,"US New England",10-K,2022-02-25,,"Biohaven Pharmaceutical Holding Co Ltd.",1689813,,"215 CHURCH STREET",,"NEW HAVEN",CT,CONNECTICUT,"US New England",,,"=""2834""","Pharmaceutical Preparations",325412,"Pharmaceutical Preparation Manufacturing",34,138,12/31/21,"9,224,110,080",12/31/21,"462,509,000","-846,586,000","-735,818,000","1,077,212,000"
18550,"Other intangible assets","Intellectual Property Impairment Assessment",479607,12/31/21,03/15/22,1,"PricewaterhouseCoopers LLP",223,"Kesselman & Kesselman",1309,"Tel Aviv",L3,ISRAEL,Foreign,20-F,2022-03-16,,"BioLineRx Ltd.",1498403,"=""BLRX""","2 HAMAAYAN STREET","MODI-IN TECHNOLOGY PARK",MODI-IN,L3,ISRAEL,Foreign,,,"=""2834""","Pharmaceutical Preparations",541710,"Research and Development in the Physical, Engineering, and Life Sciences",34,2,12/29/21,"48,650,956",12/31/21,,"-27,054,000","46,383,000","81,391,000"
16353,"Revenue from customer contracts","Evaluation of variable consideration relating to Aldurazyme product sales",475746,12/31/21,02/25/22,4,"KPMG LLP",,,,"San Francisco",CA,CALIFORNIA,"US West",10-K,2022-02-25,,"BIOMARIN PHARMACEUTICAL INC",1048477,"=""BMRN""","105 DIGITAL DRIVE",,NOVATO,CA,CALIFORNIA,"US West",,,"=""2834""","Pharmaceutical Preparations",325412,"Pharmaceutical Preparation Manufacturing",34,88,12/31/21,"16,248,670,208",12/31/21,"1,846,275,000","-64,080,000","3,701,056,000","6,003,325,000"
19379,"Revenue from customer contracts","Revenue recognition from collaboration partner’s COVID-19 vaccine sales",481303,12/31/21,03/30/22,2,"Ernst & Young LLP",271,"Ernst & Young GmbH Wirtschaftsprüfungsgesellschaft (Inactive)",1251,Cologne,2M,GERMANY,Foreign,20-F,2022-03-30,,"BioNTech SE",1776985,"=""BNTX""","AN DER GOLDGRUBE 12",,MAINZ,2M,GERMANY,Foreign,,,"=""2836""","Biological Products, Except Diagnostic Substances",325414,"Biological Product (except Diagnostic) Manufacturing",33,241,12/29/21,"58,112,385,024",12/31/21,"21,580,400,000","11,704,700,000","13,295,300,000","18,002,800,000"
22700,"Revenue from customer contracts","Revenue recognition from collaboration partner’s COVID-19 vaccine sales",493663,12/31/21,03/30/22,2,"Ernst & Young LLP",271,"Ernst & Young GmbH Wirtschaftsprüfungsgesellschaft (Inactive)",1251,Cologne,2M,GERMANY,Foreign,20-F/A,2022-10-26,,"BioNTech SE",1776985,"=""BNTX""","AN DER GOLDGRUBE 12",,MAINZ,2M,GERMANY,Foreign,,,"=""2836""","Biological Products, Except Diagnostic Substances",325414,"Biological Product (except Diagnostic) Manufacturing",33,241,12/29/21,"58,112,385,024",12/31/21,"21,580,400,000","11,704,700,000","13,295,300,000","18,002,800,000"
12088,"Going concern","Assessment of the Company’s ability to continue as a going concern",458538,03/27/21,06/17/21,4,"KPMG LLP",187,"KPMG LLP Chartered Accountants",85,Montreal,A8,QUEBEC,Canada,20-F,2021-06-17,,"BIRKS GROUP INC.",1179821,"=""BGI""","2020 ROBERT BOURASSA","SUITE 200",MONTREAL,A8,QUEBEC,Canada,,,"=""5944""","Jewelry Stores",448310,"Jewelry Stores",34,3,03/29/21,"34,244,724",03/27/21,"143,068,000","-5,838,000","-6,316,000","201,680,000"
12089,Inventory,"Evaluation of the reserve for slow-moving finished goods inventories",458538,03/27/21,06/17/21,4,"KPMG LLP",187,"KPMG LLP Chartered Accountants",85,Montreal,A8,QUEBEC,Canada,20-F,2021-06-17,,"BIRKS GROUP INC.",1179821,"=""BGI""","2020 ROBERT BOURASSA","SUITE 200",MONTREAL,A8,QUEBEC,Canada,,,"=""5944""","Jewelry Stores",448310,"Jewelry Stores",34,3,03/29/21,"34,244,724",03/27/21,"143,068,000","-5,838,000","-6,316,000","201,680,000"
9588,"Other contingent liabilities","Workers’ Compensation and General Liability Reserves",449434,01/30/21,03/19/21,1,"PricewaterhouseCoopers LLP",,,,Boston,MA,MASSACHUSETTS,"US New England",10-K,2021-03-19,,"BJ's Wholesale Club Holdings, Inc.",1531152,"=""BJ""","350 CAMPUS DRIVE",,MARLBOROUGH,MA,MASSACHUSETTS,"US New England",,,"=""5331""","Variety Stores",452910,"Warehouse Clubs and Supercenters",34,42,01/31/21,"5,771,667,456",01/30/21,"15,430,017,000","421,030,000","-739,930,000","5,411,530,000"
16694,"Long-lived assets","Evaluation of long-lived assets for impairment",475529,12/28/21,02/24/22,4,"KPMG LLP",,,,"Los Angeles",CA,CALIFORNIA,"US West",10-K,2022-02-25,,"BJs RESTAURANTS INC",1013488,"=""BJRI""","7755 CENTER AVENUE","SUITE 300","HUNTINGTON BEACH",CA,CALIFORNIA,"US West",,,"=""5812""","Eating and Drinking Places",722110,"Full-Service Restaurants",34,35,12/31/21,"805,153,216",12/28/21,"1,087,038,000","-3,606,000","329,098,000","1,035,166,000"
16695,"Other contingent liabilities","Evaluation of workers’ compensation and general liability accrual",475529,12/28/21,02/24/22,4,"KPMG LLP",,,,"Los Angeles",CA,CALIFORNIA,"US West",10-K,2022-02-25,,"BJs RESTAURANTS INC",1013488,"=""BJRI""","7755 CENTER AVENUE","SUITE 300","HUNTINGTON BEACH",CA,CALIFORNIA,"US West",,,"=""5812""","Eating and Drinking Places",722110,"Full-Service Restaurants",34,35,12/31/21,"805,153,216",12/28/21,"1,087,038,000","-3,606,000","329,098,000","1,035,166,000"
14808,"Regulatory assets and liabilities","Regulatory Accounting - Impact of Rate Regulation on the Financial Statements — Refer to Notes 1 and 2 to the Financial Statements.",473734,12/31/21,02/15/22,3,"Deloitte & Touche LLP",,,,Minneapolis,MN,MINNESOTA,"US Midwest",10-K,2022-02-15,,"BLACK HILLS CORP /SD/",1130464,"=""BKH""","7001 MT RUSHMORE RD","PO BOX 1400","RAPID CITY",SD,"SOUTH DAKOTA","US Midwest",,,"=""4911""","Electric Services",221119,"Other Electric Power Generation",34,71,12/31/21,"4,568,632,320",12/31/21,"1,949,100,000","236,700,000","1,476,870,000","9,131,896,000"
16488,"Revenue from customer contracts","Assessment of revenue recognition for contracts with multiple performance obligations or modifications",475884,12/31/21,02/25/22,4,"KPMG LLP",,,,Jacksonville,FL,FLORIDA,"US Southeast",10-K,2022-02-25,,"Black Knight, Inc.",1627014,,"601 RIVERSIDE AVENUE",,JACKSONVILLE,FL,FLORIDA,"US Southeast",,,"=""7372""","Prepackaged Software",541611,"Administrative Management and General Management Consulting Services",34,83,12/31/21,"12,877,599,744",12/31/21,"1,475,200,000","207,900,000","-1,648,300,000","6,350,900,000"
15505,"Proven and unproven reserves","Depreciation, Depletion and Amortization (“DD&A”) of Oil and Natural Gas Properties",474624,12/31/21,02/22/22,2,"Ernst & Young LLP",,,,Houston,TX,TEXAS,"US Southwest",10-K,2022-02-22,,"Black Stone Minerals, L.P.",1621434,"=""BSM""","1001 FANNIN STREET, SUITE 2020",,HOUSTON,TX,TEXAS,"US Southwest",,,"=""1311""","Crude Petroleum and Natural Gas",211111,"Crude Petroleum and Natural Gas Extraction",34,10,12/31/21,"2,155,519,744",12/31/21,"359,260,000","181,987,000",,"1,247,921,000"
15506,"Revenue from customer contracts","Revenues from Contracts with Customers Accrual",474624,12/31/21,02/22/22,2,"Ernst & Young LLP",,,,Houston,TX,TEXAS,"US Southwest",10-K,2022-02-22,,"Black Stone Minerals, L.P.",1621434,"=""BSM""","1001 FANNIN STREET, SUITE 2020",,HOUSTON,TX,TEXAS,"US Southwest",,,"=""1311""","Crude Petroleum and Natural Gas",211111,"Crude Petroleum and Natural Gas Extraction",34,10,12/31/21,"2,155,519,744",12/31/21,"359,260,000","181,987,000",,"1,247,921,000"
17201,"Business combinations","Acquisition of EVERFI, Inc. - Valuation of the Customer Relationships, Certain Developed Technology Assets, Marketing Assets, and Content Intangible Assets",476956,12/31/21,03/01/22,1,"PricewaterhouseCoopers LLP",,,,Atlanta,GA,GEORGIA,"US Southeast",10-K,2022-03-01,,"BLACKBAUD INC",1280058,"=""BLKB""","65 FAIRCHILD STREET",,CHARLESTON,SC,"SOUTH CAROLINA","US Southeast",,,"=""7372""","Prepackaged Software",511210,"Software Publishers",34,79,12/31/21,"4,105,606,400",12/31/21,"927,740,000","5,698,000","-1,161,009,000","2,971,617,000"
17202,"Revenue from customer contracts","Revenue recognition - Contracts with Multiple Performance Obligations",476956,12/31/21,03/01/22,1,"PricewaterhouseCoopers LLP",,,,Atlanta,GA,GEORGIA,"US Southeast",10-K,2022-03-01,,"BLACKBAUD INC",1280058,"=""BLKB""","65 FAIRCHILD STREET",,CHARLESTON,SC,"SOUTH CAROLINA","US Southeast",,,"=""7372""","Prepackaged Software",511210,"Software Publishers",34,79,12/31/21,"4,105,606,400",12/31/21,"927,740,000","5,698,000","-1,161,009,000","2,971,617,000"
10413,Goodwill,"Goodwill impairment test",451783,02/28/21,03/31/21,1,"PricewaterhouseCoopers LLP",191,"PricewaterhouseCoopers LLP Chartered Accountants",271,Toronto,A6,ONTARIO,Canada,10-K,2021-03-31,,"BLACKBERRY Ltd",1070235,"=""BB""","2200 UNIVERSITY AVENUE EAST",*,WATERLOO,A6,ONTARIO,Canada,,,"=""7372""","Prepackaged Software",518210,"Data Processing, Hosting, and Related Services",34,10,02/28/21,"5,683,328,512",02/28/21,"893,000,000","-1,104,000,000","-116,000,000","2,818,000,000"
10414,"Revenue from customer contracts","Revenue recognition – Intellectual property licensing",451783,02/28/21,03/31/21,1,"PricewaterhouseCoopers LLP",191,"PricewaterhouseCoopers LLP Chartered Accountants",271,Toronto,A6,ONTARIO,Canada,10-K,2021-03-31,,"BLACKBERRY Ltd",1070235,"=""BB""","2200 UNIVERSITY AVENUE EAST",*,WATERLOO,A6,ONTARIO,Canada,,,"=""7372""","Prepackaged Software",518210,"Data Processing, Hosting, and Related Services",34,10,02/28/21,"5,683,328,512",02/28/21,"893,000,000","-1,104,000,000","-116,000,000","2,818,000,000"
16490,"Business combinations","Valuation of the Rimilia Contingent Consideration Liability",475888,12/31/21,02/25/22,1,"PricewaterhouseCoopers LLP",,,,"Los Angeles",CA,CALIFORNIA,"US West",10-K,2022-02-25,,"BLACKLINE, INC.",1666134,"=""BL""","21300 VICTORY BOULEVARD","12TH FLOOR","WOODLAND HILLS",CA,CALIFORNIA,"US West",,,"=""7372""","Prepackaged Software",511210,"Software Publishers",34,104,12/31/21,"6,107,229,184",12/31/21,"425,706,000","-115,161,000","4,283,000","1,817,578,000"
16491,"Other debt","Convertible Notes Transactions",475888,12/31/21,02/25/22,1,"PricewaterhouseCoopers LLP",,,,"Los Angeles",CA,CALIFORNIA,"US West",10-K,2022-02-25,,"BLACKLINE, INC.",1666134,"=""BL""","21300 VICTORY BOULEVARD","12TH FLOOR","WOODLAND HILLS",CA,CALIFORNIA,"US West",,,"=""7372""","Prepackaged Software",511210,"Software Publishers",34,104,12/31/21,"6,107,229,184",12/31/21,"425,706,000","-115,161,000","4,283,000","1,817,578,000"
19085,"Business combinations","Valuation of the Rimilia Contingent Consideration Liability",480566,12/31/21,02/25/22,1,"PricewaterhouseCoopers LLP",,,,"Los Angeles",CA,CALIFORNIA,"US West",10-K/A,2022-03-24,,"BLACKLINE, INC.",1666134,"=""BL""","21300 VICTORY BOULEVARD","12TH FLOOR","WOODLAND HILLS",CA,CALIFORNIA,"US West",,,"=""7372""","Prepackaged Software",511210,"Software Publishers",34,104,12/31/21,"6,107,229,184",12/31/21,"425,706,000","-115,161,000","4,283,000","1,817,578,000"
19086,"Other debt","Convertible Notes Transactions",480566,12/31/21,02/25/22,1,"PricewaterhouseCoopers LLP",,,,"Los Angeles",CA,CALIFORNIA,"US West",10-K/A,2022-03-24,,"BLACKLINE, INC.",1666134,"=""BL""","21300 VICTORY BOULEVARD","12TH FLOOR","WOODLAND HILLS",CA,CALIFORNIA,"US West",,,"=""7372""","Prepackaged Software",511210,"Software Publishers",34,104,12/31/21,"6,107,229,184",12/31/21,"425,706,000","-115,161,000","4,283,000","1,817,578,000"
17645,"Other investments","Investment Valuation — Level 3 Investments — Refer to Note 2 to the financial statements",477164,12/31/21,03/02/22,3,"Deloitte & Touche LLP",,,,"Los Angeles",CA,CALIFORNIA,"US West",10-K,2022-03-02,,"BlackRock Capital Investment Corp",1326003,,"50 HUDSON YARDS",,"NEW YORK",NY,"NEW YORK","US Mid Atlantic",,,,,523920,"Portfolio Management",34,4,12/31/21,"295,507,936",12/31/21,"34,624,121","66,488,228",,"571,976,274"
16583,"Other intangible assets","Impairment of indefinite-lived intangible assets — Refer to Notes 2 and 12 to the financial statements",475845,12/31/21,02/25/22,3,"Deloitte & Touche LLP",,,,"New York",NY,"NEW YORK","US Mid Atlantic",10-K,2022-02-25,,"BlackRock Finance, Inc.",1364742,,"50 HUDSON YARDS",,"NEW YORK",NY,"NEW YORK","US Mid Atlantic",,,"=""6211""","Security Brokers, Dealers, and Flotation Companies",523120,"Securities Brokerage",34,910,12/29/21,"138,202,087,424",12/31/21,"19,169,000,000","5,901,000,000","4,976,000,000","152,648,000,000"
15989,"Other investments","Investment Valuation — Level 3 Investments — Refer to Note 2 to the financial statements",475296,12/31/21,02/24/22,3,"Deloitte & Touche LLP",,,,"Los Angeles",CA,CALIFORNIA,"US West",10-K,2022-02-24,,"BlackRock TCP Capital Corp.",1370755,"=""TCPC""","2951 28TH STREET","SUITE 1000","SANTA MONICA",CA,CALIFORNIA,"US West",,,,,525990,"Other Financial Vehicles",34,14,12/31/21,"780,435,712",12/31/21,"124,116,948","133,790,774",,"1,894,229,327"
16487,"Other investments","Fair Value of Underlying Investments to determine Performance Allocations and Accrued Performance Allocations — Refer to Notes 2 and 4 to the financial statements",475889,12/31/21,02/25/22,3,"Deloitte & Touche LLP",,,,"New York",NY,"NEW YORK","US Mid Atlantic",10-K,2022-02-25,,"Blackstone Inc.",1393818,"=""BX""","345 PARK AVENUE",,"NEW YORK",NY,"NEW YORK","US Mid Atlantic",,,"=""6282""","Investment Advice",523920,"Portfolio Management",34,129,12/31/21,"91,134,525,440",12/31/21,"22,378,880,000","5,857,397,000","7,316,335,000","41,196,408,000"
14534,"Allowance for credit losses","Current Expected Credit Loss (“CECL”) Reserve – Adjustments to Reflect Management’s Estimation of Economic Conditions – Refer to Note 2 in the Financial Statements",473229,12/31/21,02/09/22,3,"Deloitte & Touche LLP",,,,"New York",NY,"NEW YORK","US Mid Atlantic",10-K,2022-02-09,,"BLACKSTONE MORTGAGE TRUST, INC.",1061630,"=""BXMT""","345 PARK AVENUE","24TH FLOOR","NEW YORK",NY,"NEW YORK","US Mid Atlantic",,,"=""6798""","Real Estate Investment Trusts",525990,"Other Financial Vehicles",34,31,12/31/21,"5,149,665,280",12/31/21,"554,331,000","419,193,000",,"22,703,289,000"
14535,"Accounts/loans receivable","CECL Reserve – Estimation of Fair Value of Underlying Collateral of Impaired Loans – Refer to Note 2 and Note 3 in the Financial Statements",473229,12/31/21,02/09/22,3,"Deloitte & Touche LLP",,,,"New York",NY,"NEW YORK","US Mid Atlantic",10-K,2022-02-09,,"BLACKSTONE MORTGAGE TRUST, INC.",1061630,"=""BXMT""","345 PARK AVENUE","24TH FLOOR","NEW YORK",NY,"NEW YORK","US Mid Atlantic",,,"=""6798""","Real Estate Investment Trusts",525990,"Other Financial Vehicles",34,31,12/31/21,"5,149,665,280",12/31/21,"554,331,000","419,193,000",,"22,703,289,000"
18035,"Other investments","Fair Value — Investments — Refer to Footnote 2 and 5 in the financial statements",478594,12/31/21,03/09/22,3,"Deloitte & Touche LLP",,,,"New York",NY,"NEW YORK","US Mid Atlantic",10-K,2022-03-09,,"Blackstone Private Credit Fund",1803498,,"345 PARK AVENUE","31ST FLOOR","NEW YORK",NY,"NEW YORK","US Mid Atlantic",,,,,525990,"Other Financial Vehicles",34,,,,12/31/21,"810,440,000","507,416,000","12,854,820,000","32,353,714,000"
20551,"Other investments","Fair Value — Investments — Refer to Footnote 2 and 5 in the financial statements",484681,12/31/21,03/09/22,3,"Deloitte & Touche LLP",,,,"New York",NY,"NEW YORK","US Mid Atlantic",N-2,2022-04-25,,"Blackstone Private Credit Fund",1803498,,"345 PARK AVENUE","31ST FLOOR","NEW YORK",NY,"NEW YORK","US Mid Atlantic",,,,,525990,"Other Financial Vehicles",34,,,,12/31/21,"810,440,000","507,416,000","12,854,820,000","32,353,714,000"
21855,"Other investments","Fair Value — Investments — Refer to Footnote 2 and 5 in the financial statements",489992,12/31/21,03/09/22,3,"Deloitte & Touche LLP",,,,"New York",NY,"NEW YORK","US Mid Atlantic",N-2/A,2022-07-25,,"Blackstone Private Credit Fund",1803498,,"345 PARK AVENUE","31ST FLOOR","NEW YORK",NY,"NEW YORK","US Mid Atlantic",,,,,525990,"Other Financial Vehicles",34,,,,12/31/21,"810,440,000","507,416,000","12,854,820,000","32,353,714,000"
22628,"Other investments","Fair Value — Investments — Refer to Footnote 2 and 5 in the financial statements",493185,12/31/21,03/09/22,3,"Deloitte & Touche LLP",,,,"New York",NY,"NEW YORK","US Mid Atlantic",N-2/A,2022-10-14,,"Blackstone Private Credit Fund",1803498,,"345 PARK AVENUE","31ST FLOOR","NEW YORK",NY,"NEW YORK","US Mid Atlantic",,,,,525990,"Other Financial Vehicles",34,,,,12/31/21,"810,440,000","507,416,000","12,854,820,000","32,353,714,000"
23248,"Other investments","Fair Value — Investments — Refer to Footnote 2 and 5 in the financial statements",496025,12/31/21,03/09/22,3,"Deloitte & Touche LLP",,,,"New York",NY,"NEW YORK","US Mid Atlantic",N-2/A,2022-12-16,,"Blackstone Private Credit Fund",1803498,,"345 PARK AVENUE","31ST FLOOR","NEW YORK",NY,"NEW YORK","US Mid Atlantic",,,,,525990,"Other Financial Vehicles",34,,,,12/31/21,"810,440,000","507,416,000","12,854,820,000","32,353,714,000"
23415,"Other investments","Fair Value — Investments — Refer to Footnote 2 and 5 in the financial statements",497538,12/31/21,03/09/22,3,"Deloitte & Touche LLP",,,,"New York",NY,"NEW YORK","US Mid Atlantic",N-2/A,2023-01-13,,"Blackstone Private Credit Fund",1803498,,"345 PARK AVENUE","31ST FLOOR","NEW YORK",NY,"NEW YORK","US Mid Atlantic",,,,,525990,"Other Financial Vehicles",34,,,,12/31/21,"810,440,000","507,416,000","12,854,820,000","32,353,714,000"
18400,"Real estate investments","Allocation of Purchase Price for Investments in Real Estate — Refer to Notes 2, 3, and 4 to the financial statements",479317,12/31/21,03/11/22,3,"Deloitte & Touche LLP",,,,"New York",NY,"NEW YORK","US Mid Atlantic",10-K,2022-03-14,,"Blackstone Real Estate Income Trust, Inc.",1662972,"=""BSTT""","345 PARK AVENUE",,"NEW YORK",NY,"NEW YORK","US Mid Atlantic",,,"=""6798""","Real Estate Investment Trusts",525990,"Other Financial Vehicles",34,,,,12/31/21,"3,696,671,000","-804,783,000",,"106,338,864,000"
17074,"Other investments","Fair Value — Investments — Refer to Footnote 2 and 5 in the financial statements",476211,12/31/21,02/28/22,3,"Deloitte & Touche LLP",,,,"New York",NY,"NEW YORK","US Mid Atlantic",10-K,2022-02-28,,"Blackstone Secured Lending Fund",1736035,"=""BXSL""","345 PARK AVENUE","31ST FLOOR","NEW YORK",NY,"NEW YORK","US Mid Atlantic",,,,,525990,"Other Financial Vehicles",34,34,12/31/21,"5,755,317,248",12/31/21,"504,231,000","460,422,000",,"10,177,541,000"
16183,"Sales return and allowances","Accrued transaction losses",475424,12/31/21,02/24/22,2,"Ernst & Young LLP",,,,"San Francisco",CA,CALIFORNIA,"US West",10-K,2022-02-24,,"Block, Inc.",1512673,"=""XYZ""","1955 BROADWAY","SUITE 600",OAKLAND,CA,CALIFORNIA,"US West",,,"=""7372""","Prepackaged Software",511210,"Software Publishers",34,162,12/31/21,"65,126,842,368",12/31/21,"17,661,203,000","166,284,000","2,496,530,000","13,925,764,000"
16184,"Business combinations","Business combinations",475424,12/31/21,02/24/22,2,"Ernst & Young LLP",,,,"San Francisco",CA,CALIFORNIA,"US West",10-K,2022-02-24,,"Block, Inc.",1512673,"=""XYZ""","1955 BROADWAY","SUITE 600",OAKLAND,CA,CALIFORNIA,"US West",,,"=""7372""","Prepackaged Software",511210,"Software Publishers",34,162,12/31/21,"65,126,842,368",12/31/21,"17,661,203,000","166,284,000","2,496,530,000","13,925,764,000"
16684,"Other revenue","Managed Services Sale and Leaseback Revenue – Refer to Notes 2 and 9 to the financial statements",476090,12/31/21,02/25/22,3,"Deloitte & Touche LLP",,,,"San Jose",CA,CALIFORNIA,"US West",10-K,2022-02-25,,"Bloom Energy Corp",1664703,"=""BE""","4353 NORTH FIRST STREET",,"SAN JOSE",CA,CALIFORNIA,"US West",,,"=""3620""","Electrical Industrial Apparatus",335311,"Power, Distribution, and Specialty Transformer Manufacturing",34,22,12/31/21,"3,522,562,048",12/31/21,"972,176,000","-164,473,000","162,568,000","1,725,571,000"
16685,"Other investments","Securities Purchase Agreement – Refer to Note 18 to the financial statements",476090,12/31/21,02/25/22,3,"Deloitte & Touche LLP",,,,"San Jose",CA,CALIFORNIA,"US West",10-K,2022-02-25,,"Bloom Energy Corp",1664703,"=""BE""","4353 NORTH FIRST STREET",,"SAN JOSE",CA,CALIFORNIA,"US West",,,"=""3620""","Electrical Industrial Apparatus",335311,"Power, Distribution, and Specialty Transformer Manufacturing",34,22,12/31/21,"3,522,562,048",12/31/21,"972,176,000","-164,473,000","162,568,000","1,725,571,000"
15798,"Insurance contract liabilities","Valuation of Insurance Reserves
",474947,12/26/21,02/23/22,1,"PricewaterhouseCoopers LLP",,,,Tampa,FL,FLORIDA,"US Southeast",10-K,2022-02-23,,"Bloomin' Brands, Inc.",1546417,"=""BLMN""","2202 NORTH WEST SHORE BOULEVARD","SUITE 500",TAMPA,FL,FLORIDA,"US Southeast",,,"=""5812""","Eating and Drinking Places",722110,"Full-Service Restaurants",34,21,12/31/21,"1,872,524,288",12/26/21,"4,122,385,000","215,555,000","-505,395,000","3,294,271,000"
15696,"Other investments","Fair value of investments",474903,12/31/21,02/23/22,4,"KPMG LLP",,,,"New York",NY,"NEW YORK","US Mid Atlantic",10-K,2022-02-23,,"Blue Owl Capital Corp",1655888,"=""OBDC""","399 PARK AVENUE",,"NEW YORK",NY,"NEW YORK","US Mid Atlantic",,,,,525990,"Other Financial Vehicles",34,14,12/31/21,"5,575,738,880",12/31/21,"802,271,000","624,882,000",,"13,298,170,000"
17018,"Business combinations","Evaluation of the fair value of certain acquired intangible assets
",476598,12/31/21,02/28/22,4,"KPMG LLP",,,,"New York",NY,"NEW YORK","US Mid Atlantic",10-K,2022-02-28,,"BLUE OWL CAPITAL INC.",1823945,"=""OWL""","399 PARK AVENUE, 37TH FLOOR",,"NEW YORK",NY,"NEW YORK","US Mid Atlantic",,,"=""6282""","Investment Advice",523930,"Investment Advice",34,15,12/31/21,"6,037,348,352",12/31/21,"823,878,000","-376,171,000","-5,080,089,000","8,266,398,000"
17019,"Business combinations","Fair value of earnout securities on date of Business Combination
",476598,12/31/21,02/28/22,4,"KPMG LLP",,,,"New York",NY,"NEW YORK","US Mid Atlantic",10-K,2022-02-28,,"BLUE OWL CAPITAL INC.",1823945,"=""OWL""","399 PARK AVENUE, 37TH FLOOR",,"NEW YORK",NY,"NEW YORK","US Mid Atlantic",,,"=""6282""","Investment Advice",523930,"Investment Advice",34,15,12/31/21,"6,037,348,352",12/31/21,"823,878,000","-376,171,000","-5,080,089,000","8,266,398,000"
20462,"Business combinations","Evaluation of the fair value of certain acquired intangible assets
",484114,12/31/21,02/28/22,4,"KPMG LLP",,,,"New York",NY,"NEW YORK","US Mid Atlantic","POS AM",2022-04-21,,"BLUE OWL CAPITAL INC.",1823945,"=""OWL""","399 PARK AVENUE, 37TH FLOOR",,"NEW YORK",NY,"NEW YORK","US Mid Atlantic",,,"=""6282""","Investment Advice",523930,"Investment Advice",34,15,12/31/21,"6,037,348,352",12/31/21,"823,878,000","-376,171,000","-5,080,089,000","8,266,398,000"
20463,"Business combinations","Fair value of earnout securities on date of Business Combination
",484114,12/31/21,02/28/22,4,"KPMG LLP",,,,"New York",NY,"NEW YORK","US Mid Atlantic","POS AM",2022-04-21,,"BLUE OWL CAPITAL INC.",1823945,"=""OWL""","399 PARK AVENUE, 37TH FLOOR",,"NEW YORK",NY,"NEW YORK","US Mid Atlantic",,,"=""6282""","Investment Advice",523930,"Investment Advice",34,15,12/31/21,"6,037,348,352",12/31/21,"823,878,000","-376,171,000","-5,080,089,000","8,266,398,000"
18249,"Other investments","Fair value of investments",479004,12/31/21,03/10/22,4,"KPMG LLP",,,,"New York",NY,"NEW YORK","US Mid Atlantic",10-K,2022-03-11,,"Blue Owl Technology Finance Corp.",1747777,"=""OTF""","399 PARK AVENUE",,"NEW YORK",NY,"NEW YORK","US Mid Atlantic",,,,,525990,"Other Financial Vehicles",34,,,,12/31/21,"354,137,000","147,846,000","3,532,150,000","6,291,675,000"
17841,"Research and development expenses","Accrued Clinical and Contract Research Organization Costs and Manufacturing Costs",477786,12/31/21,03/04/22,2,"Ernst & Young LLP",,,,Boston,MA,MASSACHUSETTS,"US New England",10-K,2022-03-04,Yes,"bluebird bio, Inc.",1293971,,"455 GRAND UNION BOULEVARD",,SOMERVILLE,MA,MASSACHUSETTS,"US New England",,,"=""2836""","Biological Products, Except Diagnostic Substances",325414,"Biological Product (except Diagnostic) Manufacturing",34,10,12/31/21,"710,438,848",12/31/21,"3,662,000","-819,378,000","368,631,000","593,795,000"
17739,"Allowance for credit losses","Allowance for Loan Losses",477482,12/31/21,03/03/22,2,"Ernst & Young LLP",,,,"Boca Raton",FL,FLORIDA,"US Southeast",10-K,2022-03-04,,"Bluegreen Vacations Holding Corp",315858,,"401 EAST LAS OLAS BLVD","SUITE 800","FORT LAUDERDALE",FL,FLORIDA,"US Southeast",,,"=""6500""","Real Estate",522120,"Savings Institutions",34,35,12/31/21,"600,855,552",12/31/21,"546,288,000","58,730,000","182,085,000","1,210,512,000"
15596,"Pension and other post-employment benefits","Valuation of the Pension Benefit Obligation",474677,01/01/22,02/22/22,2,"Ernst & Young LLP",,,,Atlanta,GA,GEORGIA,"US Southeast",10-K,2022-02-22,,"BlueLinx Holdings Inc.",1301787,"=""BXC""","1950 SPECTRUM CIRCLE","SUITE 300",MARIETTA,GA,GEORGIA,"US Southeast",,,"=""5031""","Lumber, Plywood, Millwork, and Wood Panels",444190,"Other Building Material Dealers",34,91,01/03/22,"884,084,864",01/01/22,"4,277,178,000","296,133,000","301,874,000","1,317,454,000"
15021,"Research and development expenses","Accrued Clinical Trial Expenses",473947,12/31/21,02/17/22,2,"Ernst & Young LLP",,,,Boston,MA,MASSACHUSETTS,"US New England",10-K,2022-02-17,,"Blueprint Medicines Corp",1597264,,"45 SIDNEY STREET",,CAMBRIDGE,MA,MASSACHUSETTS,"US New England",,,"=""2834""","Pharmaceutical Preparations",325412,"Pharmaceutical Preparation Manufacturing",34,107,12/31/21,"6,334,601,728",12/31/21,"180,080,000","-644,085,000",,"1,252,225,000"
15022,"Revenue from customer contracts","Collaboration Agreement with Zai Lab",473947,12/31/21,02/17/22,2,"Ernst & Young LLP",,,,Boston,MA,MASSACHUSETTS,"US New England",10-K,2022-02-17,,"Blueprint Medicines Corp",1597264,,"45 SIDNEY STREET",,CAMBRIDGE,MA,MASSACHUSETTS,"US New England",,,"=""2834""","Pharmaceutical Preparations",325412,"Pharmaceutical Preparation Manufacturing",34,107,12/31/21,"6,334,601,728",12/31/21,"180,080,000","-644,085,000",,"1,252,225,000"
15023,"Business combinations","Lengo Therapeutics Inc. Acquisition",473947,12/31/21,02/17/22,2,"Ernst & Young LLP",,,,Boston,MA,MASSACHUSETTS,"US New England",10-K,2022-02-17,,"Blueprint Medicines Corp",1597264,,"45 SIDNEY STREET",,CAMBRIDGE,MA,MASSACHUSETTS,"US New England",,,"=""2834""","Pharmaceutical Preparations",325412,"Pharmaceutical Preparation Manufacturing",34,107,12/31/21,"6,334,601,728",12/31/21,"180,080,000","-644,085,000",,"1,252,225,000"
14501,Goodwill,"Goodwill – Refer to Notes 2 and 8 to the financial statements",473182,12/31/21,02/08/22,3,"Deloitte & Touche LLP",,,,Houston,TX,TEXAS,"US Southwest",10-K,2022-02-08,,"Boardwalk Pipeline Partners, LP",1336047,,"9 GREENWAY PLAZA, SUITE 2800",,HOUSTON,TX,TEXAS,"US Southwest",,,"=""4922""","Natural Gas Transmission",486210,"Pipeline Transportation of Natural Gas",34,,,,12/31/21,"1,340,100,000","315,000,000","5,231,700,000","9,331,400,000"
14203,"Revenue from customer contracts","Cost Estimates for Fixed-Price Development Contracts – Refer to Notes 1 and 13 to the financial statements",472269,12/31/21,01/31/22,3,"Deloitte & Touche LLP",,,,Chicago,IL,ILLINOIS,"US Midwest",10-K,2022-01-31,,"BOEING CO",12927,"=""BA""","100 N RIVERSIDE PLZ",,CHICAGO,IL,ILLINOIS,"US Midwest",,,"=""3721""",Aircraft,336411,"Aircraft Manufacturing",34,201,12/31/21,"118,560,858,112",12/31/21,"62,286,000,000","-4,202,000,000","-25,629,000,000","138,552,000,000"
14204,"Revenue from customer contracts","Program Accounting Estimates for the 777X Program – Refer to Notes 1 and 7 to the financial statements",472269,12/31/21,01/31/22,3,"Deloitte & Touche LLP",,,,Chicago,IL,ILLINOIS,"US Midwest",10-K,2022-01-31,,"BOEING CO",12927,"=""BA""","100 N RIVERSIDE PLZ",,CHICAGO,IL,ILLINOIS,"US Midwest",,,"=""3721""",Aircraft,336411,"Aircraft Manufacturing",34,201,12/31/21,"118,560,858,112",12/31/21,"62,286,000,000","-4,202,000,000","-25,629,000,000","138,552,000,000"
14205,"Other contingent liabilities","Program Accounting Revenue Estimates for the 787 Program — Refer to Notes 1, 7, and 22 to the financial statements",472269,12/31/21,01/31/22,3,"Deloitte & Touche LLP",,,,Chicago,IL,ILLINOIS,"US Midwest",10-K,2022-01-31,,"BOEING CO",12927,"=""BA""","100 N RIVERSIDE PLZ",,CHICAGO,IL,ILLINOIS,"US Midwest",,,"=""3721""",Aircraft,336411,"Aircraft Manufacturing",34,201,12/31/21,"118,560,858,112",12/31/21,"62,286,000,000","-4,202,000,000","-25,629,000,000","138,552,000,000"
14206,"Deferred income taxes","Liabilities related to the 737 MAX Grounding – Refer to Note 13 to the financial statements",472269,12/31/21,01/31/22,3,"Deloitte & Touche LLP",,,,Chicago,IL,ILLINOIS,"US Midwest",10-K,2022-01-31,,"BOEING CO",12927,"=""BA""","100 N RIVERSIDE PLZ",,CHICAGO,IL,ILLINOIS,"US Midwest",,,"=""3721""",Aircraft,336411,"Aircraft Manufacturing",34,201,12/31/21,"118,560,858,112",12/31/21,"62,286,000,000","-4,202,000,000","-25,629,000,000","138,552,000,000"
15600,"Sales return and allowances","Customer rebates payable for engineered wood products",474681,12/31/21,02/22/22,4,"KPMG LLP",,,,Boise,ID,IDAHO,"US West",10-K,2022-02-22,,"BOISE CASCADE Co",1328581,"=""BCC""","1111 WEST JEFFERSON STREET, SUITE 300","P. O. BOX 50",BOISE,ID,IDAHO,"US West",,,"=""5030""","Wholesale-Lumber & Other Construction Materials",321999,"All Other Miscellaneous Wood Product Manufacturing",34,71,12/31/21,"2,800,367,104",12/31/21,"7,926,111,000","712,486,000","1,276,886,000","2,572,640,000"
15636,"Allowance for credit losses","Allowance for credit losses",474793,12/31/21,02/23/22,2,"Ernst & Young LLP",,,,Tulsa,OK,OKLAHOMA,"US Southwest",10-K,2022-02-23,,"BOK FINANCIAL CORP",875357,"=""BOKF""","BANK OF OKLAHOMA TOWER","BOSTON AVENUE AT SECOND STREET",TULSA,OK,OKLAHOMA,"US Southwest",,,"=""6021""","National Commercial Banks",522110,"Commercial Banking",34,105,12/31/21,"7,222,665,216",12/31/21,"1,973,808,000","618,121,000","4,227,205,000","50,249,431,000"
15646,"Other revenue","Total Revenues - Refer to Notes 2 and 3 to the financial statements",474842,12/31/21,02/23/22,3,"Deloitte & Touche LLP",,,,Stamford,CT,CONNECTICUT,"US New England",10-K,2022-02-23,,"Booking Holdings Inc.",1075531,"=""BKNG""","800 CONNECTICUT AVE",,NORWALK,CT,CONNECTICUT,"US New England",,,"=""4700""","Transportation Services",561510,"Travel Agencies",34,"2,399",12/31/21,"98,526,904,320",12/31/21,"10,958,000,000","1,165,000,000","1,234,000,000","23,641,000,000"
15647,Goodwill,"Goodwill - Refer to Notes 2 and 11 to the financial statements",474842,12/31/21,02/23/22,3,"Deloitte & Touche LLP",,,,Stamford,CT,CONNECTICUT,"US New England",10-K,2022-02-23,,"Booking Holdings Inc.",1075531,"=""BKNG""","800 CONNECTICUT AVE",,NORWALK,CT,CONNECTICUT,"US New England",,,"=""4700""","Transportation Services",561510,"Travel Agencies",34,"2,399",12/31/21,"98,526,904,320",12/31/21,"10,958,000,000","1,165,000,000","1,234,000,000","23,641,000,000"
15648,"Other contingent liabilities","Commitments and Contingencies - Tax Matters - Refer to Note 16 to the financial statement",474842,12/31/21,02/23/22,3,"Deloitte & Touche LLP",,,,Stamford,CT,CONNECTICUT,"US New England",10-K,2022-02-23,,"Booking Holdings Inc.",1075531,"=""BKNG""","800 CONNECTICUT AVE",,NORWALK,CT,CONNECTICUT,"US New England",,,"=""4700""","Transportation Services",561510,"Travel Agencies",34,"2,399",12/31/21,"98,526,904,320",12/31/21,"10,958,000,000","1,165,000,000","1,234,000,000","23,641,000,000"
11685,Inventory,"Inventories – Refer to Note 2 to the financial statements",456290,03/27/21,05/13/21,3,"Deloitte & Touche LLP",,,,"Costa Mesa",CA,CALIFORNIA,"US West",10-K,2021-05-13,,"Boot Barn Holdings, Inc.",1610250,"=""BOOT""","17100 LAGUNA CANYON ROAD",,IRVINE,CA,CALIFORNIA,"US West",,,"=""5661""","Shoe Stores",448210,"Shoe Stores",34,62,03/31/21,"1,822,692,096",03/27/21,"893,491,000","59,386,000","136,504,000","933,581,000"
11807,"Revenue from customer contracts","Revenue recognition related to the cost-based input method and variable consideration",456737,03/31/21,05/21/21,2,"Ernst & Young LLP",,,,Tysons,VA,VIRGINIA,"US Mid Atlantic",10-K,2021-05-21,,"Booz Allen Hamilton Holding Corp",1443646,"=""BAH""","8283 GREENSBORO DRIVE",,MCLEAN,VA,VIRGINIA,"US Mid Atlantic",,,"=""8742""","Management Consulting Services",541611,"Administrative Management and General Management Consulting Services",34,81,03/31/21,"10,971,892,736",03/31/21,"7,858,938,000","608,958,000","-817,112,000","5,499,601,000"
11808,"Other contingent liabilities","Government Contracting Matters - Provision for Claimed Indirect Costs",456737,03/31/21,05/21/21,2,"Ernst & Young LLP",,,,Tysons,VA,VIRGINIA,"US Mid Atlantic",10-K,2021-05-21,,"Booz Allen Hamilton Holding Corp",1443646,"=""BAH""","8283 GREENSBORO DRIVE",,MCLEAN,VA,VIRGINIA,"US Mid Atlantic",,,"=""8742""","Management Consulting Services",541611,"Administrative Management and General Management Consulting Services",34,81,03/31/21,"10,971,892,736",03/31/21,"7,858,938,000","608,958,000","-817,112,000","5,499,601,000"
11809,"Uncertain tax positions","Unrecognized Tax Benefits",456737,03/31/21,05/21/21,2,"Ernst & Young LLP",,,,Tysons,VA,VIRGINIA,"US Mid Atlantic",10-K,2021-05-21,,"Booz Allen Hamilton Holding Corp",1443646,"=""BAH""","8283 GREENSBORO DRIVE",,MCLEAN,VA,VIRGINIA,"US Mid Atlantic",,,"=""8742""","Management Consulting Services",541611,"Administrative Management and General Management Consulting Services",34,81,03/31/21,"10,971,892,736",03/31/21,"7,858,938,000","608,958,000","-817,112,000","5,499,601,000"
14861,"Other income taxes","Worldwide Provision for Income Taxes",473766,12/31/21,02/15/22,1,"PricewaterhouseCoopers LLP",,,,Detroit,MI,MICHIGAN,"US Midwest",10-K,2022-02-15,,"BORGWARNER INC",908255,"=""BWA""","3850 HAMLIN RD.",,"AUBURN HILLS",MI,MICHIGAN,"US Midwest",,,"=""3714""","Motor Vehicle Parts and Accessories",336399,"All Other Motor Vehicle Parts Manufacturing",34,45,12/31/21,"10,806,744,064",12/31/21,"14,838,000,000","537,000,000","2,578,000,000","16,575,000,000"
15427,"Other intangible assets","Dogfish Head Brand Name Intangible — Refer to Notes B and I to the financial statements",474576,12/25/21,02/22/22,3,"Deloitte & Touche LLP",,,,Boston,MA,MASSACHUSETTS,"US New England",10-K,2022-02-22,,"BOSTON BEER CO INC",949870,"=""SAM""","ONE DESIGN CENTER PLACE","SUITE 850",BOSTON,MA,MASSACHUSETTS,"US New England",,,"=""2082""","Malt Beverages",312120,Breweries,34,505,12/31/21,"5,143,837,696",12/25/21,"2,057,622,000","14,553,000","767,203,000","1,386,784,000"
15428,Inventory,"Reserve for Excess or Expired Inventory — Refer to Notes B, C, and E to the financial statements",474576,12/25/21,02/22/22,3,"Deloitte & Touche LLP",,,,Boston,MA,MASSACHUSETTS,"US New England",10-K,2022-02-22,,"BOSTON BEER CO INC",949870,"=""SAM""","ONE DESIGN CENTER PLACE","SUITE 850",BOSTON,MA,MASSACHUSETTS,"US New England",,,"=""2082""","Malt Beverages",312120,Breweries,34,505,12/31/21,"5,143,837,696",12/25/21,"2,057,622,000","14,553,000","767,203,000","1,386,784,000"
19239,"Insurance contract liabilities","Estimated reserves for losses and loss adjustment expenses (LAE)",480950,12/31/21,03/28/22,4,"KPMG LLP",,,,Omaha,NE,NEBRASKA,"US Midwest",10-K,2022-03-28,,"BOSTON OMAHA Corp",1494582,"=""BOC""","1601 DODGE STREET","SUITE 3300",OMAHA,NE,NEBRASKA,"US Midwest",,,"=""6510""","Real Estate Operators (No Developers) & Lessors",531210,"Offices of Real Estate Agents and Brokers",34,29,12/31/21,"822,907,648",12/31/21,"56,971,811","52,748,177","424,589,925","787,737,024"
16567,"Long-lived assets","Impairment Indicators of Long-Lived Assets and Investments in Unconsolidated Joint Ventures",475811,12/31/21,02/25/22,1,"PricewaterhouseCoopers LLP",,,,Boston,MA,MASSACHUSETTS,"US New England",10-K,2022-02-25,,"BOSTON PROPERTIES LTD PARTNERSHIP",1043121,,"800 BOYLSTON STREET","SUITE 1900",BOSTON,MA,MASSACHUSETTS,"US New England",1037540,"BXP, Inc.","=""6798""","Real Estate Investment Trusts",525990,"Other Financial Vehicles",34,,,,12/31/21,"2,888,621,000","570,965,000",,"22,103,814,000"
16568,"Property, plant and equipment","Purchase Price Allocation for Long-Lived Asset Property Acquisitions",475811,12/31/21,02/25/22,1,"PricewaterhouseCoopers LLP",,,,Boston,MA,MASSACHUSETTS,"US New England",10-K,2022-02-25,,"BOSTON PROPERTIES LTD PARTNERSHIP",1043121,,"800 BOYLSTON STREET","SUITE 1900",BOSTON,MA,MASSACHUSETTS,"US New England",1037540,"BXP, Inc.","=""6798""","Real Estate Investment Trusts",525990,"Other Financial Vehicles",34,,,,12/31/21,"2,888,621,000","570,965,000",,"22,103,814,000"
15845,"Business combinations","Business Combinations
",475058,12/31/21,02/23/22,2,"Ernst & Young LLP",,,,Boston,MA,MASSACHUSETTS,"US New England",10-K,2022-02-23,,"BOSTON SCIENTIFIC CORP",885725,"=""BSX""","300 BOSTON SCIENTIFIC WAY",,MARLBOROUGH,MA,MASSACHUSETTS,"US New England",,,"=""3841""","Surgical and Medical Instruments and Apparatus",339112,"Surgical and Medical Instrument Manufacturing",34,42,12/31/21,"60,556,099,584",12/31/21,"11,888,000,000","1,039,000,000","-1,487,000,000","32,230,000,000"
12792,"Deferred and capitalized costs","Capitalized Software Development Costs and Internal Use Software Costs",462705,06/30/21,08/30/21,2,"Ernst & Young LLP",,,,Boston,MA,MASSACHUSETTS,"US New England",10-K,2021-08-30,,"BOTTOMLINE TECHNOLOGIES INC",1073349,,"325 CORPORATE DRIVE",,PORTSMOUTH,NH,"NEW HAMPSHIRE","US New England",,,"=""7372""","Prepackaged Software",511210,"Software Publishers",34,37,06/30/21,"1,603,227,904",06/30/21,"471,403,000","-16,288,000","46,845,000","815,728,000"
9657,"Revenue from customer contracts","Revenue recognition – evaluation of contract terms and conditions",449574,01/31/21,03/19/21,2,"Ernst & Young LLP",,,,"San Jose",CA,CALIFORNIA,"US West",10-K,2021-03-19,,"BOX INC",1372612,"=""BOX""","900 JEFFERSON AVE",,"REDWOOD CITY",CA,CALIFORNIA,"US West",,,"=""7372""","Prepackaged Software",511210,"Software Publishers",34,17,01/31/21,"2,771,816,448",01/31/21,"770,770,000","-43,433,000","132,325,000","1,351,682,000"
16964,"Goodwill and intangible assets","Goodwill and Indefinite-Lived Intangibles—Refer to Notes 1, 3 and 4 to the financial statements",476508,12/31/21,02/28/22,3,"Deloitte & Touche LLP",,,,"Las Vegas",NV,NEVADA,"US West",10-K,2022-02-28,,"BOYD GAMING CORP",906553,"=""BYD""","6465 SOUTH RAINBOW BOULEVARD",,"LAS VEGAS",NV,NEVADA,"US West",,,"=""7011""","Hotels and Motels",721120,"Casino Hotels",34,66,12/31/21,"7,298,146,816",12/31/21,"3,369,810,000","463,846,000","-800,961,000","6,224,169,000"
18248,"Equity investments and joint ventures","Accounting for Equity Method Investments — Refer to Notes 2 and 5 to the financial statements.",479030,12/31/21,03/11/22,3,"Deloitte & Touche LLP",,,,Houston,TX,TEXAS,"US Southwest",10-K,2022-03-11,,"BP Midstream Partners LP",1708301,,"501 WESTLAKE PARK BLVD",,HOUSTON,TX,TEXAS,"US Southwest",,,"=""4610""","Pipelines, Except Natural Gas",486110,"Pipeline Transportation of Crude Oil",34,15,12/31/21,"1,603,356,416",12/31/21,"119,900,000","152,100,000",,"738,800,000"
18817,"Property, plant and equipment","Impairment of upstream oil and gas property, plant and equipment (PP&E) assets – Notes 1, 3 and 11 to the financial statements",479983,12/31/21,03/18/22,3,"Deloitte & Touche LLP",293,"Deloitte LLP",1147,London,X0,"UNITED KINGDOM",Foreign,20-F,2022-03-18,,"BP PLC",313807,"=""BP""","1 ST JAMES'S SQUARE",,LONDON,X0,"UNITED KINGDOM",Foreign,,,"=""2911""","Petroleum Refining",324110,"Petroleum Refineries",34,27,12/29/21,"96,335,331,328",12/31/21,"157,739,000,000","8,487,000,000","56,639,000,000","287,272,000,000"
18818,"Asset retirement and environmental obligations","Decommissioning provisions – Notes 1 and 22",479983,12/31/21,03/18/22,3,"Deloitte & Touche LLP",293,"Deloitte LLP",1147,London,X0,"UNITED KINGDOM",Foreign,20-F,2022-03-18,,"BP PLC",313807,"=""BP""","1 ST JAMES'S SQUARE",,LONDON,X0,"UNITED KINGDOM",Foreign,,,"=""2911""","Petroleum Refining",324110,"Petroleum Refineries",34,27,12/29/21,"96,335,331,328",12/31/21,"157,739,000,000","8,487,000,000","56,639,000,000","287,272,000,000"
18819,"Other debt","Accounting for complex transactions executed by the trading and shipping (T&S) function to deliver against the wider group strategy and valuation of commodity financial derivatives, where fraud risks may arise in revenue recognition (potentially impacting all financial statement accounts, in particular finance debt) - Notes 1, 19, 21, 28 and 29 to the financial statements",479983,12/31/21,03/18/22,3,"Deloitte & Touche LLP",293,"Deloitte LLP",1147,London,X0,"UNITED KINGDOM",Foreign,20-F,2022-03-18,,"BP PLC",313807,"=""BP""","1 ST JAMES'S SQUARE",,LONDON,X0,"UNITED KINGDOM",Foreign,,,"=""2911""","Petroleum Refining",324110,"Petroleum Refineries",34,27,12/29/21,"96,335,331,328",12/31/21,"157,739,000,000","8,487,000,000","56,639,000,000","287,272,000,000"
18820,"Long-lived assets","Impairment of E&A assets and refinery PP&E as a consequence, inter alia, of climate change and the energy transition – Notes 1, 3 and 14",479983,12/31/21,03/18/22,3,"Deloitte & Touche LLP",293,"Deloitte LLP",1147,London,X0,"UNITED KINGDOM",Foreign,20-F,2022-03-18,,"BP PLC",313807,"=""BP""","1 ST JAMES'S SQUARE",,LONDON,X0,"UNITED KINGDOM",Foreign,,,"=""2911""","Petroleum Refining",324110,"Petroleum Refineries",34,27,12/29/21,"96,335,331,328",12/31/21,"157,739,000,000","8,487,000,000","56,639,000,000","287,272,000,000"
12836,"Deferred income taxes","Taxes — Valuation Allowances — Refer to Note 11 to the financial statements",462954,07/31/21,09/02/21,3,"Deloitte & Touche LLP",,,,Milwaukee,WI,WISCONSIN,"US Midwest",10-K,2021-09-02,,"BRADY CORP",746598,"=""BRC""","6555 W GOOD HOPE RD","P O BOX 571",MILWAUKEE,WI,WISCONSIN,"US Midwest",,,"=""3990""","Miscellaneous Manufacturing Industries",322222,"Coated and Laminated Paper Manufacturing",34,55,07/31/21,"2,653,524,480",07/31/21,"1,144,698,000","129,659,000","256,557,000","1,377,756,000"
19178,"Deferred and stock-based compensation","Stock-Based Compensation to Employees and Directors – Stock Options — Refer to Note 10 to the financial statements",480852,12/31/21,03/28/22,3,"Deloitte & Touche LLP",257,"Brightman Almagor Zohar & Co",1197,"Tel Aviv",L3,ISRAEL,Foreign,10-K,2022-03-28,,"BRAINSTORM CELL THERAPEUTICS INC.",1137883,"=""BCLI""","1325 AVENUE OF AMERICAS","28TH FLOOR","NEW YORK",NY,"NEW YORK","US Mid Atlantic",,,"=""2836""","Biological Products, Except Diagnostic Substances",325413,"In-Vitro Diagnostic Substance Manufacturing",34,4,12/31/21,"145,605,600",12/31/21,,"-24,457,000",,"29,277,000"
10000,"Other contingent liabilities","Estimate of Workers' Compensation and General Liability Self-Insurance Reserves",450570,01/30/21,03/26/21,2,"Ernst & Young LLP",,,,Nashville,TN,TENNESSEE,"US Southeast",10-K,2021-03-26,,"BRAND HOUSE COLLECTIVE, INC.",1056285,"=""KIRK""","5310 MARYLAND WAY",,BRENTWOOD,TN,TENNESSEE,"US Southeast",,,"=""5990""","Retail-Retail Stores, NEC",442299,"All Other Home Furnishings Stores",34,25,01/31/21,"363,880,672",01/30/21,"543,496,000","16,639,000",,"387,112,000"
10001,"Long-lived assets","Impairment of Long-Lived Assets",450570,01/30/21,03/26/21,2,"Ernst & Young LLP",,,,Nashville,TN,TENNESSEE,"US Southeast",10-K,2021-03-26,,"BRAND HOUSE COLLECTIVE, INC.",1056285,"=""KIRK""","5310 MARYLAND WAY",,BRENTWOOD,TN,TENNESSEE,"US Southeast",,,"=""5990""","Retail-Retail Stores, NEC",442299,"All Other Home Furnishings Stores",34,25,01/31/21,"363,880,672",01/30/21,"543,496,000","16,639,000",,"387,112,000"
16151,"Real estate investments","Impairment Assessments of Real Estate Investments and Investments in Unconsolidated Real Estate Ventures",475348,12/31/21,02/24/22,1,"PricewaterhouseCoopers LLP",,,,Philadelphia,PA,PENNSYLVANIA,"US Mid Atlantic",10-K,2022-02-24,,"BRANDYWINE OPERATING PARTNERSHIP, L.P.",1060386,,"C/O BRANDYWINE REALTY TRUST","2929 ARCH STREET, SUITE 1800",PHILADELPHIA,PA,PENNSYLVANIA,"US Mid Atlantic",790816,"BRANDYWINE REALTY TRUST","=""6798""","Real Estate Investment Trusts",525990,"Other Financial Vehicles",34,,,,12/31/21,"486,819,000","12,369,000","1,669,829,000","3,846,196,000"
16138,"Real estate investments","Impairment Assessments of Real Estate Investments and Investments in Unconsolidated Real Estate Ventures ",475394,12/31/21,02/24/22,1,"PricewaterhouseCoopers LLP",,,,Philadelphia,PA,PENNSYLVANIA,"US Mid Atlantic",10-K,2022-02-24,,"BRANDYWINE REALTY TRUST",790816,"=""BDN""","2929 ARCH STREET","SUITE 1800",PHILADELPHIA,PA,PENNSYLVANIA,"US Mid Atlantic",,,"=""6798""","Real Estate Investment Trusts",525990,"Other Financial Vehicles",34,13,12/31/21,"2,296,514,304",12/31/21,"486,819,000","12,289,000","1,661,711,000","3,846,196,000"
20650,"Asset retirement and environmental obligations","Evaluation of the provision and disclosures related to geological phenomenon in Alagoas State",485252,12/31/21,04/27/22,4,"KPMG LLP",61,"KPMG Auditores Independentes",1124,"São Paulo",D5,BRAZIL,Foreign,20-F,2022-04-28,,"BRASKEM SA",1071438,"=""BAK""","RUA ETENO, 1561","POLO PETROQUIMICO DE CAMACARI",CAMACARI,D5,BRAZIL,Foreign,,,"=""2860""","Industrial Organic Chemicals",325110,"Petrochemical Manufacturing",34,20,12/29/21,"6,904,443,904",12/31/21,"18,963,000,000","2,507,000,000","895,604,000","16,618,378,000"
21130,"Discontinued operations","Discontinuation of Hypermarket Format and Sale and transfer of Store Locations to Assaí - Refer to notes 1.1 and 32 to the financial statements",487026,12/31/21,05/16/22,3,"Deloitte & Touche LLP",4,"Deloitte Touche Tohmatsu Auditores Independentes",1045,"São Paulo",D5,BRAZIL,Foreign,20-F,2022-05-16,,"BRAZILIAN DISTRIBUTION CO COMPANHIA BRASILEIRA DE DISTR CBD",1038572,"=""CBDBY""","AV BRIGADEIRO LUIZ ANTONIO","3126 1 ANDAR SP","SAO PAULO",D5,BRAZIL,Foreign,,,"=""5411""","Grocery Stores",445110,"Supermarkets and Other Grocery (except Convenience) Stores",34,4,12/31/21,"1,074,170,496",12/31/21,"2,926,000,000","172,000,000","1,418,000,000","8,877,000,000"
21131,"Other income taxes","Recoverable Tax Credits - Refer to notes 10 and 20.1 to the financial statements",487026,12/31/21,05/16/22,3,"Deloitte & Touche LLP",4,"Deloitte Touche Tohmatsu Auditores Independentes",1045,"São Paulo",D5,BRAZIL,Foreign,20-F,2022-05-16,,"BRAZILIAN DISTRIBUTION CO COMPANHIA BRASILEIRA DE DISTR CBD",1038572,"=""CBDBY""","AV BRIGADEIRO LUIZ ANTONIO","3126 1 ANDAR SP","SAO PAULO",D5,BRAZIL,Foreign,,,"=""5411""","Grocery Stores",445110,"Supermarkets and Other Grocery (except Convenience) Stores",34,4,12/31/21,"1,074,170,496",12/31/21,"2,926,000,000","172,000,000","1,418,000,000","8,877,000,000"
21016,"Other contingent liabilities","Litigation Contingencies",486663,12/31/21,05/06/22,1,"PricewaterhouseCoopers LLP",91,"PricewaterhouseCoopers Auditores Independentes",1351,"Rio de Janeiro",D5,BRAZIL,Foreign,20-F,2022-05-06,,"BRAZILIAN ELECTRIC POWER CO",1439124,"=""AXIA""","RUA DA QUITANDA, 196, 24TH FLOOR",CENTRO,"RIO DE JANEIRO",D5,BRAZIL,Foreign,,,"=""4911""","Electric Services",221111,"Hydroelectric Power Generation",34,6,12/29/21,"7,488,175,616",12/31/21,"6,216,667,000","1,025,787,000","12,770,023,000","33,806,655,000"
21017,"Long-lived assets","Assessment of Impairment for fixed assets and investments in associate companies",486663,12/31/21,05/06/22,1,"PricewaterhouseCoopers LLP",91,"PricewaterhouseCoopers Auditores Independentes",1351,"Rio de Janeiro",D5,BRAZIL,Foreign,20-F,2022-05-06,,"BRAZILIAN ELECTRIC POWER CO",1439124,"=""AXIA""","RUA DA QUITANDA, 196, 24TH FLOOR",CENTRO,"RIO DE JANEIRO",D5,BRAZIL,Foreign,,,"=""4911""","Electric Services",221111,"Hydroelectric Power Generation",34,6,12/29/21,"7,488,175,616",12/31/21,"6,216,667,000","1,025,787,000","12,770,023,000","33,806,655,000"
21018,"Revenue from customer contracts","Contractual transmission assets - Measurement",486663,12/31/21,05/06/22,1,"PricewaterhouseCoopers LLP",91,"PricewaterhouseCoopers Auditores Independentes",1351,"Rio de Janeiro",D5,BRAZIL,Foreign,20-F,2022-05-06,,"BRAZILIAN ELECTRIC POWER CO",1439124,"=""AXIA""","RUA DA QUITANDA, 196, 24TH FLOOR",CENTRO,"RIO DE JANEIRO",D5,BRAZIL,Foreign,,,"=""4911""","Electric Services",221111,"Hydroelectric Power Generation",34,6,12/29/21,"7,488,175,616",12/31/21,"6,216,667,000","1,025,787,000","12,770,023,000","33,806,655,000"
21019,"Pension and other post-employment benefits","Post-employment benefits",486663,12/31/21,05/06/22,1,"PricewaterhouseCoopers LLP",91,"PricewaterhouseCoopers Auditores Independentes",1351,"Rio de Janeiro",D5,BRAZIL,Foreign,20-F,2022-05-06,,"BRAZILIAN ELECTRIC POWER CO",1439124,"=""AXIA""","RUA DA QUITANDA, 196, 24TH FLOOR",CENTRO,"RIO DE JANEIRO",D5,BRAZIL,Foreign,,,"=""4911""","Electric Services",221111,"Hydroelectric Power Generation",34,6,12/29/21,"7,488,175,616",12/31/21,"6,216,667,000","1,025,787,000","12,770,023,000","33,806,655,000"
22555,"Other contingent liabilities","Litigation Contingencies",492754,12/31/21,05/06/22,1,"PricewaterhouseCoopers LLP",91,"PricewaterhouseCoopers Auditores Independentes",1351,"Rio de Janeiro",D5,BRAZIL,Foreign,20-F/A,2022-10-03,,"BRAZILIAN ELECTRIC POWER CO",1439124,"=""AXIA""","RUA DA QUITANDA, 196, 24TH FLOOR",CENTRO,"RIO DE JANEIRO",D5,BRAZIL,Foreign,,,"=""4911""","Electric Services",221111,"Hydroelectric Power Generation",34,6,12/29/21,"7,488,175,616",12/31/21,"6,216,667,000","1,025,787,000","12,770,023,000","33,806,655,000"
22556,"Long-lived assets","Assessment of Impairment for fixed assets and investments in associate companies",492754,12/31/21,05/06/22,1,"PricewaterhouseCoopers LLP",91,"PricewaterhouseCoopers Auditores Independentes",1351,"Rio de Janeiro",D5,BRAZIL,Foreign,20-F/A,2022-10-03,,"BRAZILIAN ELECTRIC POWER CO",1439124,"=""AXIA""","RUA DA QUITANDA, 196, 24TH FLOOR",CENTRO,"RIO DE JANEIRO",D5,BRAZIL,Foreign,,,"=""4911""","Electric Services",221111,"Hydroelectric Power Generation",34,6,12/29/21,"7,488,175,616",12/31/21,"6,216,667,000","1,025,787,000","12,770,023,000","33,806,655,000"
22557,"Revenue from customer contracts","Contractual transmission assets - Measurement",492754,12/31/21,05/06/22,1,"PricewaterhouseCoopers LLP",91,"PricewaterhouseCoopers Auditores Independentes",1351,"Rio de Janeiro",D5,BRAZIL,Foreign,20-F/A,2022-10-03,,"BRAZILIAN ELECTRIC POWER CO",1439124,"=""AXIA""","RUA DA QUITANDA, 196, 24TH FLOOR",CENTRO,"RIO DE JANEIRO",D5,BRAZIL,Foreign,,,"=""4911""","Electric Services",221111,"Hydroelectric Power Generation",34,6,12/29/21,"7,488,175,616",12/31/21,"6,216,667,000","1,025,787,000","12,770,023,000","33,806,655,000"
22558,"Pension and other post-employment benefits","Post-employment benefits",492754,12/31/21,05/06/22,1,"PricewaterhouseCoopers LLP",91,"PricewaterhouseCoopers Auditores Independentes",1351,"Rio de Janeiro",D5,BRAZIL,Foreign,20-F/A,2022-10-03,,"BRAZILIAN ELECTRIC POWER CO",1439124,"=""AXIA""","RUA DA QUITANDA, 196, 24TH FLOOR",CENTRO,"RIO DE JANEIRO",D5,BRAZIL,Foreign,,,"=""4911""","Electric Services",221111,"Hydroelectric Power Generation",34,6,12/29/21,"7,488,175,616",12/31/21,"6,216,667,000","1,025,787,000","12,770,023,000","33,806,655,000"
16252,"Allowance for credit losses","Allowance for Credit Losses — Refer to Notes 1 and 4 to the financial statements",475596,12/31/21,02/25/22,3,"Deloitte & Touche LLP",,,,Dallas,TX,TEXAS,"US Southwest",10-K,2022-02-25,,"BREAD FINANCIAL HOLDINGS, INC.",1101215,"=""BFH""","3095 LOYALTY CIRCLE",,COLUMBUS,OH,OHIO,"US Midwest",,,"=""6141""","Personal Credit Institutions",518210,"Data Processing, Hosting, and Related Services",34,67,12/31/21,"3,321,842,944",12/31/21,"3,655,000,000","801,000,000","1,399,000,000","21,746,000,000"
19140,"Deferred income taxes","Recoverability of deferred tax assets",480737,12/31/21,03/25/22,4,"KPMG LLP",61,"KPMG Auditores Independentes",1124,"São Paulo",D5,BRAZIL,Foreign,20-F,2022-03-25,,"BRF S.A.",1122491,"=""BRFS""","AV DAS NACOES UNIDAS 14401 22ND-25TH","FLOORS TORRE A2 VILA GERTRUDES 04794-000","SAO PAULO",D5,BRAZIL,Foreign,,,"=""2011""","Meat Packing Plants",311615,"Poultry Processing",34,4,12/29/21,"3,184,895,232",12/31/21,"8,679,229,000","78,525,000","413,933,000","10,035,238,000"
19141,"Business combinations","Acquisition-date fair value of the brands acquired through business combinations",480737,12/31/21,03/25/22,4,"KPMG LLP",61,"KPMG Auditores Independentes",1124,"São Paulo",D5,BRAZIL,Foreign,20-F,2022-03-25,,"BRF S.A.",1122491,"=""BRFS""","AV DAS NACOES UNIDAS 14401 22ND-25TH","FLOORS TORRE A2 VILA GERTRUDES 04794-000","SAO PAULO",D5,BRAZIL,Foreign,,,"=""2011""","Meat Packing Plants",311615,"Poultry Processing",34,4,12/29/21,"3,184,895,232",12/31/21,"8,679,229,000","78,525,000","413,933,000","10,035,238,000"
16639,"Research and development expenses","Research and Development Expenses and Accrued Research and Development Liabilities - Refer to Notes 2 and 9 to the financial statements",475561,12/31/21,02/24/22,3,"Deloitte & Touche LLP",,,,"San Francisco",CA,CALIFORNIA,"US West",10-K,2022-02-25,,"BridgeBio Pharma, Inc.",1743881,"=""BBIO""","3160 PORTER DR.","SUITE 250","PALO ALTO",CA,CALIFORNIA,"US West",,,"=""2834""","Pharmaceutical Preparations",325414,"Biological Product (except Diagnostic) Manufacturing",34,17,12/31/21,"2,457,686,528",12/31/21,"69,716,000","-562,539,000","-913,925,000","1,012,792,000"
16506,"Revenue from customer contracts","Revenue - Refer to Note 2 and 3 to the financial statements",476066,12/31/21,02/25/22,3,"Deloitte & Touche LLP",,,,Boston,MA,MASSACHUSETTS,"US New England",10-K,2022-02-25,,"BRIGHT HORIZONS FAMILY SOLUTIONS INC.",1437578,"=""BFAM""","2 WELLS AVENUE",,NEWTON,MA,MASSACHUSETTS,"US New England",,,"=""8351""","Child Day Care Services",624410,"Child Day Care Services",34,126,12/31/21,"7,465,333,760",12/31/21,"1,755,307,000","70,459,000","-553,481,000","3,640,047,000"
15267,"Revenue from customer contracts","Revenue Recognition – Variable Consideration",474355,12/31/21,02/18/22,2,"Ernst & Young LLP",,,,Boston,MA,MASSACHUSETTS,"US New England",10-K,2022-02-18,,"BRIGHTCOVE INC",1313275,,"281 SUMMER STREET",,BOSTON,MA,MASSACHUSETTS,"US New England",,,"=""7374""","Computer Processing and Data Preparation and Processing Services",511210,"Software Publishers",34,10,12/31/21,"421,571,360",12/31/21,"211,093,000","5,397,000","26,082,000","216,468,000"
16278,"Insurance contract liabilities","Liability for Future Policy Benefits – Refer to Notes 1 and 3 to the consolidated financial statements",475340,12/31/21,02/24/22,3,"Deloitte & Touche LLP",,,,Charlotte,NC,"NORTH CAROLINA","US Southeast",10-K,2022-02-24,,"Brighthouse Financial, Inc.",1685040,"=""BHF""","11225 N COMMUNITY HOUSE ROAD",,CHARLOTTE,NC,"NORTH CAROLINA","US Southeast",,,"=""6311""","Life Insurance",524113,"Direct Life Insurance Carriers",34,52,12/31/21,"4,033,669,632",12/31/21,"4,976,000,000","1,643,000,000",,"259,840,000,000"
16279,"Deferred and capitalized costs","Deferred Acquisition Cost (DAC) – Refer to Notes 1 and 4 to the consolidated financial statements",475340,12/31/21,02/24/22,3,"Deloitte & Touche LLP",,,,Charlotte,NC,"NORTH CAROLINA","US Southeast",10-K,2022-02-24,,"Brighthouse Financial, Inc.",1685040,"=""BHF""","11225 N COMMUNITY HOUSE ROAD",,CHARLOTTE,NC,"NORTH CAROLINA","US Southeast",,,"=""6311""","Life Insurance",524113,"Direct Life Insurance Carriers",34,52,12/31/21,"4,033,669,632",12/31/21,"4,976,000,000","1,643,000,000",,"259,840,000,000"
16280,"Insurance contract liabilities","Embedded Derivative Liabilities Related to Variable Annuity Guarantees – Refer to Notes 1, 7, and 8 to the consolidated financial statements.",475340,12/31/21,02/24/22,3,"Deloitte & Touche LLP",,,,Charlotte,NC,"NORTH CAROLINA","US Southeast",10-K,2022-02-24,,"Brighthouse Financial, Inc.",1685040,"=""BHF""","11225 N COMMUNITY HOUSE ROAD",,CHARLOTTE,NC,"NORTH CAROLINA","US Southeast",,,"=""6311""","Life Insurance",524113,"Direct Life Insurance Carriers",34,52,12/31/21,"4,033,669,632",12/31/21,"4,976,000,000","1,643,000,000",,"259,840,000,000"
17616,"Insurance contract liabilities","Liability for Future Policy Benefits– Refer to Notes 1 and 3 to the consolidated financial statements",477194,12/31/21,03/02/22,3,"Deloitte & Touche LLP",,,,Charlotte,NC,"NORTH CAROLINA","US Southeast",10-K,2022-03-02,,"BRIGHTHOUSE LIFE INSURANCE Co",733076,,"11225 NORTH COMMUNITY HOUSE ROAD",,CHARLOTTE,NC,"NORTH CAROLINA","US Southeast",1099219,"METLIFE INC","=""6311""","Life Insurance",524113,"Direct Life Insurance Carriers",34,,,,12/31/21,"4,110,000,000","1,762,000,000",,"247,255,000,000"
17617,"Deferred and capitalized costs","Deferred Acquisition Cost (DAC) – Refer to Notes 1 and 4 to the consolidated financial statements",477194,12/31/21,03/02/22,3,"Deloitte & Touche LLP",,,,Charlotte,NC,"NORTH CAROLINA","US Southeast",10-K,2022-03-02,,"BRIGHTHOUSE LIFE INSURANCE Co",733076,,"11225 NORTH COMMUNITY HOUSE ROAD",,CHARLOTTE,NC,"NORTH CAROLINA","US Southeast",1099219,"METLIFE INC","=""6311""","Life Insurance",524113,"Direct Life Insurance Carriers",34,,,,12/31/21,"4,110,000,000","1,762,000,000",,"247,255,000,000"
17618,"Other debt","Embedded Derivative Liabilities Related to Variable Annuity Guarantees – Refer to Notes 1, 7, and 8 to the consolidated financial statements.",477194,12/31/21,03/02/22,3,"Deloitte & Touche LLP",,,,Charlotte,NC,"NORTH CAROLINA","US Southeast",10-K,2022-03-02,,"BRIGHTHOUSE LIFE INSURANCE Co",733076,,"11225 NORTH COMMUNITY HOUSE ROAD",,CHARLOTTE,NC,"NORTH CAROLINA","US Southeast",1099219,"METLIFE INC","=""6311""","Life Insurance",524113,"Direct Life Insurance Carriers",34,,,,12/31/21,"4,110,000,000","1,762,000,000",,"247,255,000,000"
17695,"Insurance contract liabilities","Liability for Future Policy Benefits – Refer to Notes 1 and 3 to the financial statements",477426,12/31/21,03/03/22,3,"Deloitte & Touche LLP",,,,Charlotte,NC,"NORTH CAROLINA","US Southeast",10-K,2022-03-03,,"BRIGHTHOUSE LIFE INSURANCE Co OF NY",1167609,,"285 MADISON AVENUE, 14TH FLOOR",,"NEW YORK",NY,"NEW YORK","US Mid Atlantic",,,"=""6311""","Life Insurance",524113,"Direct Life Insurance Carriers",33,,,,12/31/21,"100,000,000","-18,000,000",,"12,978,000,000"
17696,"Deferred and capitalized costs","Deferred Acquisition Cost (DAC) – Refer to Notes 1 and 4 to the financial statements",477426,12/31/21,03/03/22,3,"Deloitte & Touche LLP",,,,Charlotte,NC,"NORTH CAROLINA","US Southeast",10-K,2022-03-03,,"BRIGHTHOUSE LIFE INSURANCE Co OF NY",1167609,,"285 MADISON AVENUE, 14TH FLOOR",,"NEW YORK",NY,"NEW YORK","US Mid Atlantic",,,"=""6311""","Life Insurance",524113,"Direct Life Insurance Carriers",33,,,,12/31/21,"100,000,000","-18,000,000",,"12,978,000,000"
17697,"Other debt","Embedded Derivative Liabilities Related to Variable Annuity Guarantees – Refer to Notes 1, 7, and 8 to the financial statements.",477426,12/31/21,03/03/22,3,"Deloitte & Touche LLP",,,,Charlotte,NC,"NORTH CAROLINA","US Southeast",10-K,2022-03-03,,"BRIGHTHOUSE LIFE INSURANCE Co OF NY",1167609,,"285 MADISON AVENUE, 14TH FLOOR",,"NEW YORK",NY,"NEW YORK","US Mid Atlantic",,,"=""6311""","Life Insurance",524113,"Direct Life Insurance Carriers",33,,,,12/31/21,"100,000,000","-18,000,000",,"12,978,000,000"
15497,"Allowance for credit losses","Allowance for Loan Losses",474631,12/31/21,02/22/22,2,"Ernst & Young LLP",,,,"New York",NY,"NEW YORK","US Mid Atlantic",10-K,2022-02-22,,"BrightSpire Capital, Inc.",1717547,"=""BRSP""","590 MADISON AVENUE","33RD FLOOR","NEW YORK",NY,"NEW YORK","US Mid Atlantic",,,"=""6798""","Real Estate Investment Trusts",525990,"Other Financial Vehicles",34,10,12/31/21,"1,331,433,728",12/31/21,"104,967,000","-68,236,000",,"5,638,369,000"
15498,"Equity investments and joint ventures","Impairment of Equity Method Investments",474631,12/31/21,02/22/22,2,"Ernst & Young LLP",,,,"New York",NY,"NEW YORK","US Mid Atlantic",10-K,2022-02-22,,"BrightSpire Capital, Inc.",1717547,"=""BRSP""","590 MADISON AVENUE","33RD FLOOR","NEW YORK",NY,"NEW YORK","US Mid Atlantic",,,"=""6798""","Real Estate Investment Trusts",525990,"Other Financial Vehicles",34,10,12/31/21,"1,331,433,728",12/31/21,"104,967,000","-68,236,000",,"5,638,369,000"
17624,"Revenue from customer contracts","Revenue Recognition – Identifying and Evaluating Contractual Terms and Conditions
",477377,12/31/21,03/03/22,1,"PricewaterhouseCoopers LLP",,,,Boston,MA,MASSACHUSETTS,"US New England",20-F,2022-03-03,,"Brightstar Lottery PLC",1619762,"=""BRSL""","10 FINSBURY SQUARE","THIRD FLOOR",LONDON,X0,"UNITED KINGDOM",Foreign,,,"=""7990""","Services-Miscellaneous Amusement & Recreation",713290,"Other Gambling Industries",34,28,12/29/21,"5,832,266,240",12/31/21,"4,089,000,000","483,000,000","-4,785,000,000","11,325,000,000"
13585,Goodwill,"Goodwill – Maintenance Reporting Unit – Refer to Notes 2 and 7 to the financial statements ",467629,09/30/21,11/17/21,3,"Deloitte & Touche LLP",,,,Philadelphia,PA,PENNSYLVANIA,"US Mid Atlantic",10-K,2021-11-17,,"BrightView Holdings, Inc.",1734713,"=""BV""","980 JOLLY ROAD","SUITE 300","BLUE BELL",PA,PENNSYLVANIA,"US Mid Atlantic",,,"=""0700""","Agricultural services",561730,"Landscaping Services",34,15,09/30/21,"1,552,752,000",09/30/21,"2,553,600,000","46,300,000","-805,700,000","3,237,600,000"
12759,"Revenue from customer contracts","Assessment of the gift card breakage revenue",462603,06/30/21,08/26/21,4,"KPMG LLP",,,,Dallas,TX,TEXAS,"US Southwest",10-K,2021-08-26,,"BRINKER INTERNATIONAL, INC",703351,"=""EAT""","3000 OLYMPUS BLVD.",,DALLAS,TX,TEXAS,"US Southwest",,,"=""5812""","Eating and Drinking Places",722110,"Full-Service Restaurants",34,62,06/30/21,"2,838,915,072",06/30/21,"3,337,800,000","131,600,000","-512,600,000","2,274,900,000"
17119,Goodwill,"Valuation of goodwill for the Europe reporting unit",476162,12/31/21,02/25/22,4,"KPMG LLP",,,,Richmond,VA,VIRGINIA,"US Mid Atlantic",10-K,2022-02-28,,"BRINKS CO",78890,"=""BCO""","1801 BAYBERRY COURT","P O BOX 18100",RICHMOND,VA,VIRGINIA,"US Mid Atlantic",,,"=""4731""","Arrangement of Transportation of  Freight and Cargo",561613,"Armored Car Services",34,66,12/31/21,"3,108,017,920",12/31/21,"4,200,200,000","105,200,000","-1,779,900,000","5,566,700,000"
17120,"Business combinations","Fair value of acquired customer relationship intangible asset",476162,12/31/21,02/25/22,4,"KPMG LLP",,,,Richmond,VA,VIRGINIA,"US Mid Atlantic",10-K,2022-02-28,,"BRINKS CO",78890,"=""BCO""","1801 BAYBERRY COURT","P O BOX 18100",RICHMOND,VA,VIRGINIA,"US Mid Atlantic",,,"=""4731""","Arrangement of Transportation of  Freight and Cargo",561613,"Armored Car Services",34,66,12/31/21,"3,108,017,920",12/31/21,"4,200,200,000","105,200,000","-1,779,900,000","5,566,700,000"
14538,"Sales return and allowances","Gross-to-Net U.S. Rebate Accruals for U.S. Medicaid, Medicare Part D, and managed healthcare - Refer to “Note 2 - Revenue” to the financial statements",473234,12/31/21,02/08/22,3,"Deloitte & Touche LLP",,,,Parsippany,NJ,"NEW JERSEY","US Mid Atlantic",10-K,2022-02-09,,"BRISTOL MYERS SQUIBB CO",14272,"=""BMY""","ROUTE 206 AND PROVINCE LINE ROAD",,PRINCETON,NJ,"NEW JERSEY","US Mid Atlantic",,,"=""2834""","Pharmaceutical Preparations",325412,"Pharmaceutical Preparation Manufacturing",34,62,12/31/21,"134,239,551,488",12/31/21,"46,385,000,000","6,994,000,000","-27,083,000,000","109,314,000,000"
14539,"Uncertain tax positions","Taxes - Unrecognized Tax Benefit Liabilities for U.S. Transfer Pricing - Refer to “Note 7- Income Taxes” to the financial statements",473234,12/31/21,02/08/22,3,"Deloitte & Touche LLP",,,,Parsippany,NJ,"NEW JERSEY","US Mid Atlantic",10-K,2022-02-09,,"BRISTOL MYERS SQUIBB CO",14272,"=""BMY""","ROUTE 206 AND PROVINCE LINE ROAD",,PRINCETON,NJ,"NEW JERSEY","US Mid Atlantic",,,"=""2834""","Pharmaceutical Preparations",325412,"Pharmaceutical Preparation Manufacturing",34,62,12/31/21,"134,239,551,488",12/31/21,"46,385,000,000","6,994,000,000","-27,083,000,000","109,314,000,000"
11868,"Business combinations","Evaluation of the fair value of the aircraft acquired in the Era business combination",457026,03/31/21,05/26/21,4,"KPMG LLP",,,,Houston,TX,TEXAS,"US Southwest",10-K,2021-05-27,,"Bristow Group Inc.",1525221,"=""VTOL""","3151 BRIARPARK DRIVE, SUITE 700",,HOUSTON,TX,TEXAS,"US Southwest",,,"=""4522""","Air Transportation, Nonscheduled",481111,"Scheduled Passenger Air Transportation",34,26,03/31/21,"768,482,560",03/31/21,"1,178,062,000","-85,166,000",,"1,992,270,000"
14673,"Goodwill and intangible assets","Impairment analysis of goodwill and trademarks with indefinite lives arising from the 2017 acquisition of Reynolds American Inc. (Reynolds American)",473427,12/31/21,02/10/22,4,"KPMG LLP",87,"KPMG LLP",1118,London,X0,"UNITED KINGDOM",Foreign,6-K,2022-02-11,,"British American Tobacco p.l.c.",1303523,"=""BTI""","GLOBE HOUSE","4 TEMPLE PLACE",LONDON,X0,"UNITED KINGDOM",Foreign,,,"=""2111""",Cigarettes,312221,"Cigarette Manufacturing",34,37,12/29/21,"91,655,430,144",12/31/21,"34,788,000,000","9,446,000,000","-65,724,000,000","186,056,000,000"
14674,"Other contingent liabilities","Canadian legal proceedings",473427,12/31/21,02/10/22,4,"KPMG LLP",87,"KPMG LLP",1118,London,X0,"UNITED KINGDOM",Foreign,6-K,2022-02-11,,"British American Tobacco p.l.c.",1303523,"=""BTI""","GLOBE HOUSE","4 TEMPLE PLACE",LONDON,X0,"UNITED KINGDOM",Foreign,,,"=""2111""",Cigarettes,312221,"Cigarette Manufacturing",34,37,12/29/21,"91,655,430,144",12/31/21,"34,788,000,000","9,446,000,000","-65,724,000,000","186,056,000,000"
17957,"Goodwill and intangible assets","Impairment analysis of goodwill and trademarks with indefinite lives arising from the 2017 acquisition of Reynolds American Inc. (Reynolds American)",478265,12/31/21,02/10/22,4,"KPMG LLP",87,"KPMG LLP",1118,London,X0,"UNITED KINGDOM",Foreign,20-F,2022-03-08,,"British American Tobacco p.l.c.",1303523,"=""BTI""","GLOBE HOUSE","4 TEMPLE PLACE",LONDON,X0,"UNITED KINGDOM",Foreign,,,"=""2111""",Cigarettes,312221,"Cigarette Manufacturing",34,37,12/29/21,"91,655,430,144",12/31/21,"34,788,000,000","9,446,000,000","-65,724,000,000","186,056,000,000"
17958,"Other contingent liabilities","Canadian legal proceedings
",478265,12/31/21,02/10/22,4,"KPMG LLP",87,"KPMG LLP",1118,London,X0,"UNITED KINGDOM",Foreign,20-F,2022-03-08,,"British American Tobacco p.l.c.",1303523,"=""BTI""","GLOBE HOUSE","4 TEMPLE PLACE",LONDON,X0,"UNITED KINGDOM",Foreign,,,"=""2111""",Cigarettes,312221,"Cigarette Manufacturing",34,37,12/29/21,"91,655,430,144",12/31/21,"34,788,000,000","9,446,000,000","-65,724,000,000","186,056,000,000"
14482,"Real estate investments","Impairment of Real Estate Assets - Refer to Note 1 and Note 5 to the financial statements",473147,12/31/21,02/07/22,3,"Deloitte & Touche LLP",,,,Philadelphia,PA,PENNSYLVANIA,"US Mid Atlantic",10-K,2022-02-07,,"Brixmor Operating Partnership LP",1630031,,"100 PARK AVENUE",,"NEW YORK",NY,"NEW YORK","US Mid Atlantic",1581068,"Brixmor Property Group Inc.","=""6798""","Real Estate Investment Trusts",531120,"Lessors of Nonresidential Buildings (except Miniwarehouses)",34,,,,12/31/21,"1,152,274,000","270,187,000",,"8,362,235,000"
14483,Leases,"Evaluation of Collectability of Receivables – Refer to Note 1 to the financial statements",473147,12/31/21,02/07/22,3,"Deloitte & Touche LLP",,,,Philadelphia,PA,PENNSYLVANIA,"US Mid Atlantic",10-K,2022-02-07,,"Brixmor Operating Partnership LP",1630031,,"100 PARK AVENUE",,"NEW YORK",NY,"NEW YORK","US Mid Atlantic",1581068,"Brixmor Property Group Inc.","=""6798""","Real Estate Investment Trusts",531120,"Lessors of Nonresidential Buildings (except Miniwarehouses)",34,,,,12/31/21,"1,152,274,000","270,187,000",,"8,362,235,000"
14477,"Real estate investments","Impairment of Real Estate Assets - Refer to Note 1 and Note 5 to the financial statements",473146,12/31/21,02/07/22,3,"Deloitte & Touche LLP",,,,Philadelphia,PA,PENNSYLVANIA,"US Mid Atlantic",10-K,2022-02-07,,"Brixmor Property Group Inc.",1581068,"=""BRX""","100 PARK AVENUE",,"NEW YORK",NY,"NEW YORK","US Mid Atlantic",,,"=""6798""","Real Estate Investment Trusts",525990,"Other Financial Vehicles",34,25,12/31/21,"7,552,107,520",12/31/21,"1,152,274,000","270,187,000",,"8,377,393,000"
14478,Leases,"Evaluation of Collectability of Receivables – Refer to Note 1 to the financial statements",473146,12/31/21,02/07/22,3,"Deloitte & Touche LLP",,,,Philadelphia,PA,PENNSYLVANIA,"US Mid Atlantic",10-K,2022-02-07,,"Brixmor Property Group Inc.",1581068,"=""BRX""","100 PARK AVENUE",,"NEW YORK",NY,"NEW YORK","US Mid Atlantic",,,"=""6798""","Real Estate Investment Trusts",525990,"Other Financial Vehicles",34,25,12/31/21,"7,552,107,520",12/31/21,"1,152,274,000","270,187,000",,"8,377,393,000"
13912,"Uncertain tax positions","Uncertain Tax Positions (UTPs)",469511,10/31/21,12/17/21,1,"PricewaterhouseCoopers LLP",,,,"San Jose",CA,CALIFORNIA,"US West",10-K,2021-12-17,,"Broadcom Inc.",1730168,"=""AVGO""","3421 HILLVIEW AVENUE",,"PALO ALTO",CA,CALIFORNIA,"US West",,,"=""3674""","Semiconductors and Related Devices",334413,"Semiconductor and Related Device Manufacturing",34,532,10/31/21,"219,592,097,792",10/31/21,"27,450,000,000","6,736,000,000","-29,835,000,000","75,570,000,000"
12615,Goodwill,"Goodwill - Refer to Notes 2 and 10 to the financial statements",461941,06/30/21,08/12/21,3,"Deloitte & Touche LLP",,,,"New York",NY,"NEW YORK","US Mid Atlantic",10-K,2021-08-12,,"BROADRIDGE FINANCIAL SOLUTIONS, INC.",1383312,"=""BR""","5 DAKOTA DRIVE",,"LAKE SUCCESS",NY,"NEW YORK","US Mid Atlantic",,,"=""7389""","Business Services, NEC",522320,"Financial Transactions Processing, Reserve, and Clearinghouse Activities",34,162,06/30/21,"18,753,632,256",06/30/21,"4,993,700,000","547,400,000","-3,336,100,000","8,119,700,000"
15677,"Business combinations","Investment in rental property — Refer to Notes 2 and 5 to the financial statements",474866,12/31/21,02/23/22,3,"Deloitte & Touche LLP",,,,Rochester,NY,"NEW YORK","US Mid Atlantic",10-K,2022-02-23,,"Broadstone Net Lease, Inc.",1424182,"=""BNL""","207 HIGH POINT DRIVE",,VICTOR,NY,"NEW YORK","US Mid Atlantic",,,"=""6798""","Real Estate Investment Trusts",525990,"Other Financial Vehicles",34,25,12/31/21,"4,030,345,984",12/31/21,"382,876,000","102,426,000","1,933,881,000","4,618,648,000"
15678,"Long-lived assets","Evaluation of long-lived asset impairment —Refer to Note 2 to the consolidated financial statements",474866,12/31/21,02/23/22,3,"Deloitte & Touche LLP",,,,Rochester,NY,"NEW YORK","US Mid Atlantic",10-K,2022-02-23,,"Broadstone Net Lease, Inc.",1424182,"=""BNL""","207 HIGH POINT DRIVE",,VICTOR,NY,"NEW YORK","US Mid Atlantic",,,"=""6798""","Real Estate Investment Trusts",525990,"Other Financial Vehicles",34,25,12/31/21,"4,030,345,984",12/31/21,"382,876,000","102,426,000","1,933,881,000","4,618,648,000"
14890,"Property, plant and equipment","Evaluation of Property, Plant and Equipment and Leasehold Intangibles, Net and Operating Lease Right-of-Use Assets for Impairment",473788,12/31/21,02/15/22,2,"Ernst & Young LLP",,,,Chicago,IL,ILLINOIS,"US Midwest",10-K,2022-02-15,,"Brookdale Senior Living Inc.",1332349,"=""BKD""","105 WESTWOOD PLACE","SUITE 400",BRENTWOOD,TN,TENNESSEE,"US Southeast",,,"=""8050""","Services-Nursing & Personal Care Facilities",623312,"Homes for the Elderly",34,5,12/31/21,"964,702,208",12/31/21,"2,758,259,000","-99,290,000","670,081,000","6,410,467,000"
19387,Goodwill,"Goodwill&#8201;—&#8201;Refer to Notes 2(n) and 12 to the financial statements
",481351,12/31/21,03/29/22,3,"Deloitte & Touche LLP",468,"Deloitte LLP",1208,Toronto,A6,ONTARIO,Canada,20-F,2022-03-30,,"Brookfield Business Corp",1871130,"=""BBUC""","250 VESEY STREET","15TH FLOOR","NEW YORK",NY,"NEW YORK","US Mid Atlantic",,,"=""1700""","Construction - Special Trade Contractors",561439,"Other Business Service Centers (including Copy Shops)",34,,,,12/31/21,"6,375,000,000","93,000,000","-6,958,000,000","15,920,000,000"
20533,"Business combinations","Acquisition of Businesses – Refer to Notes 2(e), 2(ad)(i) and 3(a) to the financial statements",484614,12/31/21,04/25/22,3,"Deloitte & Touche LLP",468,"Deloitte LLP",1208,Toronto,A6,ONTARIO,Canada,20-F,2022-04-25,,"Brookfield Business Partners L.P.",1654795,"=""BBU""","73 FRONT STREET, 5TH FLOOR",,HAMILTON,D0,BERMUDA,Foreign,,,"=""1700""","Construction - Special Trade Contractors",325998,"All Other Miscellaneous Chemical Product and Preparation Manufacturing",34,46,12/29/21,"3,632,310,016",12/31/21,"46,587,000,000","2,153,000,000","-21,139,000,000","64,219,000,000"
20534,Goodwill,"Goodwill and Property, Plant & Equipment (“PP&E”) - Impairment — Refer to Notes 2(n), 2(ad)(iv), 11, and 13 to the financial statements",484614,12/31/21,04/25/22,3,"Deloitte & Touche LLP",468,"Deloitte LLP",1208,Toronto,A6,ONTARIO,Canada,20-F,2022-04-25,,"Brookfield Business Partners L.P.",1654795,"=""BBU""","73 FRONT STREET, 5TH FLOOR",,HAMILTON,D0,BERMUDA,Foreign,,,"=""1700""","Construction - Special Trade Contractors",325998,"All Other Miscellaneous Chemical Product and Preparation Manufacturing",34,46,12/29/21,"3,632,310,016",12/31/21,"46,587,000,000","2,153,000,000","-21,139,000,000","64,219,000,000"
19570,"Property, plant and equipment","Fair Value of Investment Properties and Property, Plant and Equipment – Refer to Notes 2(h)(i), 2(h)(ii), 11, and 12 to the financial statements",481591,12/31/21,03/30/22,3,"Deloitte & Touche LLP",468,"Deloitte LLP",1208,Toronto,A6,ONTARIO,Canada,40-F,2022-03-31,,"BROOKFIELD Corp /ON/",1001085,"=""BN""","BROOKFIELD PLACE, 181 BAY ST, STE 100","PO BOX 762",TORONTO,A6,ONTARIO,Canada,,,"=""6512""","Operators of Nonresidential Buildings",531120,"Lessors of Nonresidential Buildings (except Miniwarehouses)",34,61,12/29/21,"61,818,519,552",12/31/21,"68,127,000,000","12,388,000,000","-4,481,000,000","391,003,000,000"
19571,"Business combinations","Acquisition of Inter Pipeline Ltd. – Refer to Notes 2(d)(i), 2(r), and 5 to the financial statements",481591,12/31/21,03/30/22,3,"Deloitte & Touche LLP",468,"Deloitte LLP",1208,Toronto,A6,ONTARIO,Canada,40-F,2022-03-31,,"BROOKFIELD Corp /ON/",1001085,"=""BN""","BROOKFIELD PLACE, 181 BAY ST, STE 100","PO BOX 762",TORONTO,A6,ONTARIO,Canada,,,"=""6512""","Operators of Nonresidential Buildings",531120,"Lessors of Nonresidential Buildings (except Miniwarehouses)",34,61,12/29/21,"61,818,519,552",12/31/21,"68,127,000,000","12,388,000,000","-4,481,000,000","391,003,000,000"
19666,"Property, plant and equipment","Fair Value of Investment Properties and Property, Plant and Equipment – Refer to Notes 2(h)(i), 2(h)(ii), 11, and 12 to the financial statements",481660,12/31/21,03/30/22,3,"Deloitte & Touche LLP",468,"Deloitte LLP",1208,Toronto,A6,ONTARIO,Canada,6-K,2022-03-31,,"BROOKFIELD Corp /ON/",1001085,"=""BN""","BROOKFIELD PLACE, 181 BAY ST, STE 100","PO BOX 762",TORONTO,A6,ONTARIO,Canada,,,"=""6512""","Operators of Nonresidential Buildings",531120,"Lessors of Nonresidential Buildings (except Miniwarehouses)",34,61,12/29/21,"61,818,519,552",12/31/21,"68,127,000,000","12,388,000,000","-4,481,000,000","391,003,000,000"
19667,"Business combinations","Acquisition of Inter Pipeline Ltd. – Refer to Notes 2(d)(i), 2(r), and 5 to the financial statements",481660,12/31/21,03/30/22,3,"Deloitte & Touche LLP",468,"Deloitte LLP",1208,Toronto,A6,ONTARIO,Canada,6-K,2022-03-31,,"BROOKFIELD Corp /ON/",1001085,"=""BN""","BROOKFIELD PLACE, 181 BAY ST, STE 100","PO BOX 762",TORONTO,A6,ONTARIO,Canada,,,"=""6512""","Operators of Nonresidential Buildings",531120,"Lessors of Nonresidential Buildings (except Miniwarehouses)",34,61,12/29/21,"61,818,519,552",12/31/21,"68,127,000,000","12,388,000,000","-4,481,000,000","391,003,000,000"
19027,"Real estate investments","Impairment Review — Refer to Note 2 to the financial statements
",480483,12/31/21,03/24/22,3,"Deloitte & Touche LLP",,,,"New York",NY,"NEW YORK","US Mid Atlantic",10-K,2022-03-24,,"Brookfield DTLA Fund Office Trust Investor Inc.",1575311,"=""DTLAP""","C/O BROOKFIELD OFFICE PROPERTIES INC.","250 VESEY STREET, 15TH FLOOR","NEW YORK",NY,"NEW YORK","US Mid Atlantic",,,"=""6798""","Real Estate Investment Trusts",531120,"Lessors of Nonresidential Buildings (except Miniwarehouses)",34,,,,12/31/21,"282,778,000","-121,009,000","437,931,000","2,722,478,000"
18091,"Property, plant and equipment","Revaluation of Property, Plant and Equipment - Refer to Notes 3 and 9 to the financial statements",478598,12/31/21,03/09/22,3,"Deloitte & Touche LLP",468,"Deloitte LLP",1208,Toronto,A6,ONTARIO,Canada,20-F,2022-03-09,,"Brookfield Infrastructure Corp",1788348,"=""BIPC""","250 VESEY STREET, 15TH FLOOR",,"NEW YORK",NY,"NEW YORK","US Mid Atlantic",,,"=""4923""","Natural Gas Transmission and Distribution",486210,"Pipeline Transportation of Natural Gas",34,67,12/29/21,"3,010,551,552",12/31/21,"1,643,000,000","27,000,000","-5,303,000,000","10,086,000,000"
18067,"Property, plant and equipment","Revaluation of Property, Plant and Equipment - Refer to Notes 3 and 13 to the financial statements",478649,12/31/21,03/09/22,3,"Deloitte & Touche LLP",468,"Deloitte LLP",1208,Toronto,A6,ONTARIO,Canada,20-F,2022-03-09,,"Brookfield Infrastructure Partners L.P.",1406234,"=""BIP""","73 FRONT STREET",,HAMILTON,D0,BERMUDA,Foreign,,,"=""4400""","Water Transportation",221121,"Electric Bulk Power Transmission and Control",34,60,12/29/21,"17,767,159,808",12/31/21,"11,537,000,000","2,719,000,000","2,060,000,000","73,961,000,000"
18068,"Equity investments and joint ventures","Valuation of Investments in Associates and Joint Ventures - Refer to Notes 3 and 12 to the financial statements",478649,12/31/21,03/09/22,3,"Deloitte & Touche LLP",468,"Deloitte LLP",1208,Toronto,A6,ONTARIO,Canada,20-F,2022-03-09,,"Brookfield Infrastructure Partners L.P.",1406234,"=""BIP""","73 FRONT STREET",,HAMILTON,D0,BERMUDA,Foreign,,,"=""4400""","Water Transportation",221121,"Electric Bulk Power Transmission and Control",34,60,12/29/21,"17,767,159,808",12/31/21,"11,537,000,000","2,719,000,000","2,060,000,000","73,961,000,000"
18069,"Business combinations","Acquisition of Inter Pipeline Ltd. - Refer to Notes 3 and 6 to the financial statements",478649,12/31/21,03/09/22,3,"Deloitte & Touche LLP",468,"Deloitte LLP",1208,Toronto,A6,ONTARIO,Canada,20-F,2022-03-09,,"Brookfield Infrastructure Partners L.P.",1406234,"=""BIP""","73 FRONT STREET",,HAMILTON,D0,BERMUDA,Foreign,,,"=""4400""","Water Transportation",221121,"Electric Bulk Power Transmission and Control",34,60,12/29/21,"17,767,159,808",12/31/21,"11,537,000,000","2,719,000,000","2,060,000,000","73,961,000,000"
18389,"Other investments","Valuation of investments which utilize significant unobservable inputs
",479307,12/31/21,03/11/22,2,"Ernst & Young LLP",,,,"Los Angeles",CA,CALIFORNIA,"US West",10-K,2022-03-14,,"Brookfield Oaktree Holdings, LLC",1403528,"=""OAK.A""","333 SOUTH GRAND AVENUE","28TH FLOOR","LOS ANGELES",CA,CALIFORNIA,"US West",,,"=""6282""","Investment Advice",523920,"Portfolio Management",34,27,12/29/21,"2,603,969,536",12/31/21,"1,299,145,000","653,354,000",,"14,397,849,000"
16545,"Property, plant and equipment","Fair Value of Investment Property - Refer to Notes 2(e), 2(v)(v) and 3 to the financial statements",476075,12/31/21,02/25/22,3,"Deloitte & Touche LLP",468,"Deloitte LLP",1208,Toronto,A6,ONTARIO,Canada,20-F,2022-02-25,,"Brookfield Property Partners L.P.",1545772,"=""BPYPM""","73 FRONT STREET",,HAMILTON,D0,BERMUDA,Foreign,,,"=""6500""","Real Estate",531312,"Nonresidential Property Managers",34,26,12/29/21,"11,117,469,696",12/31/21,"7,100,000,000","3,499,000,000","7,712,000,000","112,004,000,000"
17546,"Property, plant and equipment","Revaluation of power generating assets",476646,12/31/21,02/28/22,2,"Ernst & Young LLP",192,"Ernst & Young LLP Chartered Accountants",1263,Toronto,A6,ONTARIO,Canada,20-F,2022-03-01,,"Brookfield Renewable Corp",1791863,"=""BEPC""","250 VESEY STREET, 15TH FLOOR",,"NEW YORK",NY,"NEW YORK","US Mid Atlantic",,,"=""4911""","Electric Services",221111,"Hydroelectric Power Generation",34,,,,12/31/21,"3,367,000,000","930,000,000","-1,067,000,000","41,986,000,000"
17336,"Property, plant and equipment","Revaluation of power generating assets",476745,12/31/21,02/28/22,2,"Ernst & Young LLP",192,"Ernst & Young LLP Chartered Accountants",1263,Toronto,A6,ONTARIO,Canada,20-F,2022-03-01,,"Brookfield Renewable Partners L.P.",1533232,"=""BEP""","73 FRONT STREET","FIFTH FLOOR",HAMILTON,D0,BERMUDA,Foreign,,,"=""4911""","Electric Services",221111,"Hydroelectric Power Generation",34,35,12/29/21,"9,517,636,608",12/31/21,"4,096,000,000","-66,000,000","7,615,000,000","55,867,000,000"
17337,"Business combinations","Significant acquisitions",476745,12/31/21,02/28/22,2,"Ernst & Young LLP",192,"Ernst & Young LLP Chartered Accountants",1263,Toronto,A6,ONTARIO,Canada,20-F,2022-03-01,,"Brookfield Renewable Partners L.P.",1533232,"=""BEP""","73 FRONT STREET","FIFTH FLOOR",HAMILTON,D0,BERMUDA,Foreign,,,"=""4911""","Electric Services",221111,"Hydroelectric Power Generation",34,35,12/29/21,"9,517,636,608",12/31/21,"4,096,000,000","-66,000,000","7,615,000,000","55,867,000,000"
17347,"Property, plant and equipment","Revaluation of power generating assets",477129,12/31/21,02/28/22,2,"Ernst & Young LLP",192,"Ernst & Young LLP Chartered Accountants",1263,Toronto,A6,ONTARIO,Canada,6-K,2022-03-01,,"Brookfield Renewable Partners L.P.",1533232,"=""BEP""","73 FRONT STREET","FIFTH FLOOR",HAMILTON,D0,BERMUDA,Foreign,,,"=""4911""","Electric Services",221111,"Hydroelectric Power Generation",34,35,12/29/21,"9,517,636,608",12/31/21,"4,096,000,000","-66,000,000","7,615,000,000","55,867,000,000"
17348,"Business combinations","Significant acquisitions",477129,12/31/21,02/28/22,2,"Ernst & Young LLP",192,"Ernst & Young LLP Chartered Accountants",1263,Toronto,A6,ONTARIO,Canada,6-K,2022-03-01,,"Brookfield Renewable Partners L.P.",1533232,"=""BEP""","73 FRONT STREET","FIFTH FLOOR",HAMILTON,D0,BERMUDA,Foreign,,,"=""4911""","Electric Services",221111,"Hydroelectric Power Generation",34,35,12/29/21,"9,517,636,608",12/31/21,"4,096,000,000","-66,000,000","7,615,000,000","55,867,000,000"
18975,"Other contingent liabilities","Valuation of Insurance Reserves - Refer to Notes 2(r) and 10 to the financial statements",480332,12/31/21,03/22/22,3,"Deloitte & Touche LLP",468,"Deloitte LLP",1208,Toronto,A6,ONTARIO,Canada,20-F,2022-03-23,,"Brookfield Wealth Solutions Ltd.",1837429,"=""BNT""","IDEATION HOUSE, 1ST FLOOR","94 PITTS BAY ROAD",PEMBROKE,D0,BERMUDA,Foreign,,,"=""6399""","Insurance Carriers, NEC",524126,"Direct Property and Casualty Insurance Carriers",34,,,,12/31/21,"1,041,000,000","-112,000,000","1,435,000,000","11,493,000,000"
18976,"Other contingent liabilities","Accounting for Structured Entities - Refer to Note 2(ai) to the financial statements",480332,12/31/21,03/22/22,3,"Deloitte & Touche LLP",468,"Deloitte LLP",1208,Toronto,A6,ONTARIO,Canada,20-F,2022-03-23,,"Brookfield Wealth Solutions Ltd.",1837429,"=""BNT""","IDEATION HOUSE, 1ST FLOOR","94 PITTS BAY ROAD",PEMBROKE,D0,BERMUDA,Foreign,,,"=""6399""","Insurance Carriers, NEC",524126,"Direct Property and Casualty Insurance Carriers",34,,,,12/31/21,"1,041,000,000","-112,000,000","1,435,000,000","11,493,000,000"
16648,"Allowance for credit losses","Assessment of the collective allowance for credit losses
",475842,12/31/21,02/25/22,4,"KPMG LLP",,,,Boston,MA,MASSACHUSETTS,"US New England",10-K,2022-02-25,,"BROOKLINE BANCORP INC",1049782,"=""BRKL""","131 CLARENDON STREET",,BOSTON,MA,MASSACHUSETTS,"US New England",,,"=""6035""","Savings Institutions, Federally Chartered",522120,"Savings Institutions",34,16,12/31/21,"1,265,081,856",12/31/21,"317,199,000","115,440,000","832,639,000","8,602,622,000"
15634,"Business combinations","Earn-out obligation — Refer to Notes 1 (Goodwill and Amortizable Intangible Assets) and 3 (Business Combinations) to the financial statements ",474676,12/31/21,02/22/22,3,"Deloitte & Touche LLP",,,,Tampa,FL,FLORIDA,"US Southeast",10-K,2022-02-23,,"BROWN & BROWN, INC.",79282,"=""BRO""","300 N. BEACH STREET",,"DAYTONA BEACH",FL,FLORIDA,"US Southeast",,,"=""6411""","Insurance Agents, Brokers, and Service",524210,"Insurance Agencies and Brokerages",34,70,12/31/21,"19,853,819,904",12/31/21,"3,051,398,000","587,104,000","-1,621,400,000","9,795,443,000"
12097,"Other intangible assets","Valuation of Other Intangible Assets with Indefinite Lives",458587,04/30/21,06/21/21,2,"Ernst & Young LLP",,,,Louisville,KY,KENTUCKY,"US Mid Atlantic",10-K,2021-06-21,,"BROWN FORMAN CORP",14693,"=""BF.B""","850 DIXIE HWY",,LOUISVILLE,KY,KENTUCKY,"US Mid Atlantic",,,"=""2080""",Beverages,312140,Distilleries,34,76,04/28/21,"23,593,504,768",04/30/21,"3,461,000,000","903,000,000","1,201,000,000","6,522,000,000"
9950,"Revenue from customer contracts","Revenue — Refer to Note 2 and 22 to the Financial Statements",450124,01/31/21,03/24/21,3,"Deloitte & Touche LLP",486,"Deloitte srl",1208,Montreal,A8,QUEBEC,Canada,40-F,2021-03-25,,"BRP Inc.",1748797,"=""DOOO""","726 SAINT-JOSEPH STREET",,VALCOURT,A8,QUEBEC,Canada,,,"=""3790""","Miscellaneous Transportation Equipment",336999,"All Other Transportation Equipment Manufacturing",34,71,02/02/21,"3,009,482,752",01/31/21,"4,660,000,000","284,100,000","-735,900,000","3,824,700,000"
9951,"Goodwill and intangible assets","Intangibles — Goodwill and Indefinite Useful Life Intangible Assets — Marine Segment — Refer to Notes 2 and 9 to the Financial Statements",450124,01/31/21,03/24/21,3,"Deloitte & Touche LLP",486,"Deloitte srl",1208,Montreal,A8,QUEBEC,Canada,40-F,2021-03-25,,"BRP Inc.",1748797,"=""DOOO""","726 SAINT-JOSEPH STREET",,VALCOURT,A8,QUEBEC,Canada,,,"=""3790""","Miscellaneous Transportation Equipment",336999,"All Other Transportation Equipment Manufacturing",34,71,02/02/21,"3,009,482,752",01/31/21,"4,660,000,000","284,100,000","-735,900,000","3,824,700,000"
18604,"Equity investments and joint ventures","Joint Venture Consolidation Assessment",479606,12/31/21,03/15/22,2,"Ernst & Young LLP",,,,"New York",NY,"NEW YORK","US Mid Atlantic",10-K,2022-03-16,,"BRT Apartments Corp.",14846,"=""BRT""","60 CUTTER MILL RD","SUITE 303","GREAT NECK",NY,"NEW YORK","US Mid Atlantic",,,"=""6798""","Real Estate Investment Trusts",531110,"Lessors of Residential Buildings and Dwellings",34,24,12/31/21,"416,202,496",12/31/21,"32,057,000","29,114,000",,"459,538,000"
16842,"Revenue from customer contracts","Identification of performance obligations in the Company’s revenue agreements with customers",476408,12/31/21,02/28/22,4,"KPMG LLP",,,,"San Francisco",CA,CALIFORNIA,"US West",10-K,2022-02-28,,"Bruker Cellular Analysis, Inc.",1689657,,"5858 HORTON STREET","SUITE 320",EMERYVILLE,CA,CALIFORNIA,"US West",,,"=""3826""","Laboratory Analytical Instruments",334516,"Analytical Laboratory Instrument Manufacturing",34,18,12/31/21,"1,228,886,784",12/31/21,"85,388,000","-71,724,000",,"287,253,000"
16843,"Revenue from customer contracts","Estimate of expected costs at completion for certain strategic partnership and services agreements",476408,12/31/21,02/28/22,4,"KPMG LLP",,,,"San Francisco",CA,CALIFORNIA,"US West",10-K,2022-02-28,,"Bruker Cellular Analysis, Inc.",1689657,,"5858 HORTON STREET","SUITE 320",EMERYVILLE,CA,CALIFORNIA,"US West",,,"=""3826""","Laboratory Analytical Instruments",334516,"Analytical Laboratory Instrument Manufacturing",34,18,12/31/21,"1,228,886,784",12/31/21,"85,388,000","-71,724,000",,"287,253,000"
16812,Goodwill,"Goodwill Impairment Assessment—Reporting Unit in Bruker Scientific Instruments (BSI) Nano Segment",476235,12/31/21,02/28/22,1,"PricewaterhouseCoopers LLP",,,,Boston,MA,MASSACHUSETTS,"US New England",10-K,2022-02-28,,"BRUKER CORP",1109354,"=""BRKR""","40 MANNING RD",,BILLERICA,MA,MASSACHUSETTS,"US New England",,,"=""3826""","Laboratory Analytical Instruments",334516,"Analytical Laboratory Instrument Manufacturing",34,84,12/31/21,"12,649,742,336",12/31/21,"2,417,900,000","277,100,000","519,400,000","3,650,000,000"
14918,"Business combinations","Acquisitions – Navico – Trade Name, Customer Relationship, and Developed Technology Intangible Assets – Refer to Note 5 to the financial statements",473871,12/31/21,02/16/22,3,"Deloitte & Touche LLP",,,,Chicago,IL,ILLINOIS,"US Midwest",10-K,2022-02-16,,"BRUNSWICK CORP",14930,"=""BC""","26125 N. RIVERWOODS BLVD. SUITE 500",,METTAWA,IL,ILLINOIS,"US Midwest",,,"=""3510""","Engines & Turbines",333618,"Other Engine Equipment Manufacturing",34,101,12/31/21,"7,749,460,992",12/31/21,"5,846,200,000","593,300,000","-26,300,000","5,425,000,000"
10579,Inventory,"Inventory - Adjustment to Inventory for Markdowns and Obsolescence — Refer to Note A to the financial statements",451312,01/30/21,03/31/21,3,"Deloitte & Touche LLP",,,,Omaha,NE,NEBRASKA,"US Midwest",10-K,2021-03-31,,"BUCKLE INC",885245,"=""BKE""","2407 W 24TH ST",,KEARNEY,NE,NEBRASKA,"US Midwest",,,"=""5651""","Family Clothing Stores",448110,"Men's Clothing Stores",34,39,01/31/21,"1,942,711,936",01/30/21,"901,278,000","130,139,000",,"845,814,000"
21092,"Long-lived assets","Impairment of mining concessions, development costs, right-of-use asset, property, plant and equipment",486938,12/31/21,05/13/22,2,"Ernst & Young LLP",846,"Tanaka Valdivia & Asociados Sociedad Civil de Responsabilidad Limitada",1315,Lima,R5,PERU,Foreign,20-F,2022-05-13,,"BUENAVENTURA MINING CO INC",1013131,"=""BVN""","AVE CARLOS VILLARAN 790",,LIMA,R5,PERU,Foreign,,,"=""1000""","Metal mining",212221,"Gold Ore Mining",34,7,12/29/21,"1,819,137,920",12/31/21,"900,450,000","-262,804,000",,"4,561,811,000"
21093,"Uncertain tax positions","Uncertain tax positions",486938,12/31/21,05/13/22,2,"Ernst & Young LLP",846,"Tanaka Valdivia & Asociados Sociedad Civil de Responsabilidad Limitada",1315,Lima,R5,PERU,Foreign,20-F,2022-05-13,,"BUENAVENTURA MINING CO INC",1013131,"=""BVN""","AVE CARLOS VILLARAN 790",,LIMA,R5,PERU,Foreign,,,"=""1000""","Metal mining",212221,"Gold Ore Mining",34,7,12/29/21,"1,819,137,920",12/31/21,"900,450,000","-262,804,000",,"4,561,811,000"
10952,"Revenue from customer contracts","Revenue recognition - gift card breakage",452874,01/30/21,04/15/21,2,"Ernst & Young LLP",,,,"Saint Louis",MO,MISSOURI,"US Southeast",10-K,2021-04-15,,"BUILD-A-BEAR WORKSHOP INC",1113809,"=""BBW""","415 S. 18TH STREET, SUITE 200",,"ST LOUIS",MO,MISSOURI,"US Southeast",,,"=""5945""","Hobby, Toy, and Game Shops",339931,"Doll and Stuffed Toy Manufacturing",34,6,01/31/21,"89,372,672",01/30/21,"255,310,000","-22,983,000",,"261,372,000"
10953,"Property, plant and equipment","Impairment of store assets",452874,01/30/21,04/15/21,2,"Ernst & Young LLP",,,,"Saint Louis",MO,MISSOURI,"US Southeast",10-K,2021-04-15,,"BUILD-A-BEAR WORKSHOP INC",1113809,"=""BBW""","415 S. 18TH STREET, SUITE 200",,"ST LOUIS",MO,MISSOURI,"US Southeast",,,"=""5945""","Hobby, Toy, and Game Shops",339931,"Doll and Stuffed Toy Manufacturing",34,6,01/31/21,"89,372,672",01/30/21,"255,310,000","-22,983,000",,"261,372,000"
17376,"Business combinations","Merger with BMC Stock Holdings, Inc. - Valuation of Customer Relationships",476868,12/31/21,03/01/22,1,"PricewaterhouseCoopers LLP",,,,Dallas,TX,TEXAS,"US Southwest",10-K,2022-03-01,,"Builders FirstSource, Inc.",1316835,"=""BLDR""","6031 CONNECTION DR., STE. 400",,IRVING,TX,TEXAS,"US Southwest",,,"=""5211""","Lumber and Other Building Materials Dealers",238290,"Other Building Equipment Contractors",34,86,12/31/21,"15,412,372,480",12/31/21,"19,893,856,000","1,725,416,000","-71,120,000","10,714,343,000"
16311,Inventory,"Readily Marketable Inventories and Physically Settled Forward Purchase and Sale Contracts - Refer to Notes 1 and 15 to the financial statements",475373,12/31/21,02/24/22,3,"Deloitte & Touche LLP",,,,"Saint Louis",MO,MISSOURI,"US Southeast",10-K,2022-02-24,,BUNGELTD,1144519,,"1391 TIMBERLAKE MANOR PARKWAY",,CHESTERFIELD,MO,MISSOURI,"US Southeast",,,"=""2070""","Fats & Oils",311225,"Fats and Oils Refining and Blending",34,92,12/29/21,"12,957,367,296",12/31/21,"59,152,000,000","2,078,000,000","7,135,000,000","23,819,000,000"
12245,"Other investments","Investment in Merit Functional Foods Corporation",459326,03/31/21,06/29/21,1,"PricewaterhouseCoopers LLP",191,"PricewaterhouseCoopers LLP Chartered Accountants",271,Vancouver,A1,"BRITISH COLUMBIA",Canada,40-F,2021-06-29,,"Burcon NutraScience Corp",1158399,,"1946 WEST BROADWAY",,VANCOUVER,A1,"BRITISH COLUMBIA",Canada,,,"=""2020""","Dairy Products",311999,"All Other Miscellaneous Food Manufacturing",34,4,03/31/21,,03/31/21,"205,629",,,"29,991,978"
12608,"Other investments","Investment in Merit Functional Foods Corporation",461916,03/31/21,06/29/21,1,"PricewaterhouseCoopers LLP",191,"PricewaterhouseCoopers LLP Chartered Accountants",271,Vancouver,A1,"BRITISH COLUMBIA",Canada,40-F/A,2021-08-11,,"Burcon NutraScience Corp",1158399,,"1946 WEST BROADWAY",,VANCOUVER,A1,"BRITISH COLUMBIA",Canada,,,"=""2020""","Dairy Products",311999,"All Other Miscellaneous Food Manufacturing",34,4,03/31/21,,03/31/21,"205,629",,,"29,991,978"
19282,"Other investments","Valuation of capital provision assets",481102,12/31/21,03/29/22,2,"Ernst & Young LLP",57,"Ernst & Young LLP",1438,Guernsey,X0,"UNITED KINGDOM",Foreign,20-F,2022-03-29,,"Burford Capital Ltd",1714174,"=""BUR""","OAK HOUSE","HIRZEL STREET","ST PETER PORT",Y7,GUERNSEY,Foreign,,,"=""6199""","Finance Services",523110,"Investment Banking and Securities Dealing",34,10,12/29/21,"2,212,403,712",12/31/21,"158,683,000","-28,751,000","1,561,853,000","3,741,504,000"
19283,Goodwill,"Goodwill impairment assessment
",481102,12/31/21,03/29/22,2,"Ernst & Young LLP",57,"Ernst & Young LLP",1438,Guernsey,X0,"UNITED KINGDOM",Foreign,20-F,2022-03-29,,"Burford Capital Ltd",1714174,"=""BUR""","OAK HOUSE","HIRZEL STREET","ST PETER PORT",Y7,GUERNSEY,Foreign,,,"=""6199""","Finance Services",523110,"Investment Banking and Securities Dealing",34,10,12/29/21,"2,212,403,712",12/31/21,"158,683,000","-28,751,000","1,561,853,000","3,741,504,000"
16775,"Property, plant and equipment","Property and Equipment – Self Constructed Assets – Appropriate Capitalization of Costs – Refer to Notes 2 and 7 to the financial statements.",476201,12/31/21,02/28/22,3,"Deloitte & Touche LLP",,,,"Fort Worth",TX,TEXAS,"US Southwest",10-K,2022-02-28,,"BURLINGTON NORTHERN SANTA FE, LLC",934612,"=""BNI""","2650 LOU MENK DR",,"FT WORTH",TX,TEXAS,"US Southwest",1067983,"BERKSHIRE HATHAWAY INC","=""4011""","Railroads, Line-haul Operating",482111,"Line-Haul Railroads",34,,,,12/31/21,"23,282,000,000","5,990,000,000","31,597,000,000","91,437,000,000"
9200,Inventory,"Retail Inventory Method—Impact of Markdowns—Refer to Note 1 to the financial statements",448895,01/30/21,03/15/21,3,"Deloitte & Touche LLP",,,,Parsippany,NJ,"NEW JERSEY","US Mid Atlantic",10-K,2021-03-15,,"Burlington Stores, Inc.",1579298,"=""BURL""","1830 ROUTE 130 NORTH",,BURLINGTON,NJ,"NEW JERSEY","US Mid Atlantic",,,"=""5311""","Department Stores",448140,"Family Clothing Stores",34,249,01/31/21,"16,523,557,888",01/30/21,"5,763,980,000","-216,499,000","179,690,000","6,781,092,000"
20860,"Revenue from customer contracts","Revenue recognition – determining the standalone selling price of the Company’s performance obligation for in-hospital business",485854,12/31/21,04/29/22,2,"Ernst & Young LLP",211,"Ernst & Young Hua Ming LLP",1408,Guangzhou,F4,CHINA,Foreign,20-F,2022-04-29,,"Burning Rock Biotech Ltd",1792267,"=""BNR""","NO. 5 XINGDAO RING ROAD NORTH,","INTERNATIONAL BIO ISLAND","GUANGZHOU, GUANGDONG",F4,CHINA,Foreign,,,"=""8071""","Medical Laboratories",621511,"Medical Laboratories",34,9,12/29/21,"822,518,912",12/31/21,"79,685,000","-125,004,000","288,728,000","357,518,000"
16950,"Revenue from customer contracts","Purchase Commitments - Note 20 Commitments and Contingencies",476442,12/31/21,02/28/22,3,"Deloitte & Touche LLP",,,,"New York",NY,"NEW YORK","US Mid Atlantic",10-K,2022-02-28,,"Butterfly Network, Inc.",1804176,"=""BFLY""","1600 DISTRICT AVENUE",,BURLINGTON,MA,MASSACHUSETTS,"US New England",,,"=""3844""","X-Ray Apparatus and Tubes and Related Irradiation Apparatus",511210,"Software Publishers",34,7,12/31/21,"1,148,091,264",12/31/21,"62,565,000","-32,409,000",,"571,965,000"
